simdata/FP16-R100/1024_results.json
[
    {
        "BLOCK_SIZE_M": 128,
        "BLOCK_SIZE_N": 128,
        "BLOCK_SIZE_K": 32,
        "GROUP_SIZE_M": 8,
        "num_stages": 6,
        "num_warps": 4,
        "ms": 0.016766462475061417,
        "min_ms": 0.016766462475061417,
        "max_ms": 0.016766462475061417,
        "compile_time": 1.9237322807312012
    },
    {
        "BLOCK_SIZE_M": 128,
        "BLOCK_SIZE_N": 128,
        "BLOCK_SIZE_K": 32,
        "GROUP_SIZE_M": 8,
        "num_stages": 4,
        "num_warps": 4,
        "ms": 0.016865137964487076,
        "min_ms": 0.016865137964487076,
        "max_ms": 0.016865137964487076,
        "compile_time": 0.709155797958374
    },
    {
        "BLOCK_SIZE_M": 128,
        "BLOCK_SIZE_N": 128,
        "BLOCK_SIZE_K": 32,
        "GROUP_SIZE_M": 8,
        "num_stages": 7,
        "num_warps": 4,
        "ms": 0.017008084803819656,
        "min_ms": 0.017008084803819656,
        "max_ms": 0.017008084803819656,
        "compile_time": 1.9637768268585205
    },
    {
        "BLOCK_SIZE_M": 128,
        "BLOCK_SIZE_N": 128,
        "BLOCK_SIZE_K": 32,
        "GROUP_SIZE_M": 8,
        "num_stages": 5,
        "num_warps": 4,
        "ms": 0.017009876668453217,
        "min_ms": 0.017009876668453217,
        "max_ms": 0.017009876668453217,
        "compile_time": 0.6634440422058105
    },
    {
        "BLOCK_SIZE_M": 128,
        "BLOCK_SIZE_N": 128,
        "BLOCK_SIZE_K": 32,
        "GROUP_SIZE_M": 8,
        "num_stages": 3,
        "num_warps": 4,
        "ms": 0.017215315252542496,
        "min_ms": 0.017215315252542496,
        "max_ms": 0.017215315252542496,
        "compile_time": 0.676081657409668
    },
    {
        "BLOCK_SIZE_M": 128,
        "BLOCK_SIZE_N": 128,
        "BLOCK_SIZE_K": 64,
        "GROUP_SIZE_M": 8,
        "num_stages": 3,
        "num_warps": 8,
        "ms": 0.017271466553211212,
        "min_ms": 0.017271466553211212,
        "max_ms": 0.017271466553211212,
        "compile_time": 0.6750562191009521
    },
    {
        "BLOCK_SIZE_M": 128,
        "BLOCK_SIZE_N": 128,
        "BLOCK_SIZE_K": 32,
        "GROUP_SIZE_M": 8,
        "num_stages": 8,
        "num_warps": 4,
        "ms": 0.01737344078719616,
        "min_ms": 0.01737344078719616,
        "max_ms": 0.01737344078719616,
        "compile_time": 2.031707286834717
    },
    {
        "BLOCK_SIZE_M": 128,
        "BLOCK_SIZE_N": 128,
        "BLOCK_SIZE_K": 64,
        "GROUP_SIZE_M": 8,
        "num_stages": 4,
        "num_warps": 8,
        "ms": 0.01740134321153164,
        "min_ms": 0.01740134321153164,
        "max_ms": 0.01740134321153164,
        "compile_time": 0.6529703140258789
    },
    {
        "BLOCK_SIZE_M": 128,
        "BLOCK_SIZE_N": 128,
        "BLOCK_SIZE_K": 64,
        "GROUP_SIZE_M": 8,
        "num_stages": 5,
        "num_warps": 8,
        "ms": 0.01740647293627262,
        "min_ms": 0.01740647293627262,
        "max_ms": 0.01740647293627262,
        "compile_time": 0.6858909130096436
    },
    {
        "BLOCK_SIZE_M": 128,
        "BLOCK_SIZE_N": 128,
        "BLOCK_SIZE_K": 64,
        "GROUP_SIZE_M": 8,
        "num_stages": 6,
        "num_warps": 8,
        "ms": 0.01787613146007061,
        "min_ms": 0.01787613146007061,
        "max_ms": 0.01787613146007061,
        "compile_time": 1.7141385078430176
    },
    {
        "BLOCK_SIZE_M": 64,
        "BLOCK_SIZE_N": 256,
        "BLOCK_SIZE_K": 32,
        "GROUP_SIZE_M": 8,
        "num_stages": 3,
        "num_warps": 4,
        "ms": 0.017986945807933807,
        "min_ms": 0.017986945807933807,
        "max_ms": 0.017986945807933807,
        "compile_time": 0.6681864261627197
    },
    {
        "BLOCK_SIZE_M": 64,
        "BLOCK_SIZE_N": 64,
        "BLOCK_SIZE_K": 32,
        "GROUP_SIZE_M": 8,
        "num_stages": 3,
        "num_warps": 2,
        "ms": 0.018053654581308365,
        "min_ms": 0.018053654581308365,
        "max_ms": 0.018053654581308365,
        "compile_time": 0.6419014930725098
    },
    {
        "BLOCK_SIZE_M": 256,
        "BLOCK_SIZE_N": 64,
        "BLOCK_SIZE_K": 64,
        "GROUP_SIZE_M": 8,
        "num_stages": 4,
        "num_warps": 8,
        "ms": 0.018087590113282204,
        "min_ms": 0.018087590113282204,
        "max_ms": 0.018087590113282204,
        "compile_time": 0.726639986038208
    },
    {
        "BLOCK_SIZE_M": 64,
        "BLOCK_SIZE_N": 256,
        "BLOCK_SIZE_K": 32,
        "GROUP_SIZE_M": 8,
        "num_stages": 5,
        "num_warps": 4,
        "ms": 0.01812778040766716,
        "min_ms": 0.01812778040766716,
        "max_ms": 0.01812778040766716,
        "compile_time": 0.6435861587524414
    },
    {
        "BLOCK_SIZE_M": 64,
        "BLOCK_SIZE_N": 64,
        "BLOCK_SIZE_K": 32,
        "GROUP_SIZE_M": 8,
        "num_stages": 4,
        "num_warps": 2,
        "ms": 0.01819446310400963,
        "min_ms": 0.01819446310400963,
        "max_ms": 0.01819446310400963,
        "compile_time": 0.6517877578735352
    },
    {
        "BLOCK_SIZE_M": 256,
        "BLOCK_SIZE_N": 64,
        "BLOCK_SIZE_K": 64,
        "GROUP_SIZE_M": 8,
        "num_stages": 3,
        "num_warps": 8,
        "ms": 0.01821083575487137,
        "min_ms": 0.01821083575487137,
        "max_ms": 0.01821083575487137,
        "compile_time": 0.6987361907958984
    },
    {
        "BLOCK_SIZE_M": 256,
        "BLOCK_SIZE_N": 64,
        "BLOCK_SIZE_K": 64,
        "GROUP_SIZE_M": 8,
        "num_stages": 5,
        "num_warps": 8,
        "ms": 0.018218252807855606,
        "min_ms": 0.018218252807855606,
        "max_ms": 0.018218252807855606,
        "compile_time": 0.7389030456542969
    },
    {
        "BLOCK_SIZE_M": 64,
        "BLOCK_SIZE_N": 64,
        "BLOCK_SIZE_K": 64,
        "GROUP_SIZE_M": 8,
        "num_stages": 3,
        "num_warps": 4,
        "ms": 0.018272850662469864,
        "min_ms": 0.018272850662469864,
        "max_ms": 0.018272850662469864,
        "compile_time": 0.6564619541168213
    },
    {
        "BLOCK_SIZE_M": 64,
        "BLOCK_SIZE_N": 64,
        "BLOCK_SIZE_K": 32,
        "GROUP_SIZE_M": 8,
        "num_stages": 4,
        "num_warps": 4,
        "ms": 0.01830206625163555,
        "min_ms": 0.01830206625163555,
        "max_ms": 0.01830206625163555,
        "compile_time": 0.6224725246429443
    },
    {
        "BLOCK_SIZE_M": 128,
        "BLOCK_SIZE_N": 128,
        "BLOCK_SIZE_K": 32,
        "GROUP_SIZE_M": 8,
        "num_stages": 5,
        "num_warps": 8,
        "ms": 0.018365439027547836,
        "min_ms": 0.018365439027547836,
        "max_ms": 0.018365439027547836,
        "compile_time": 0.6625447273254395
    },
    {
        "BLOCK_SIZE_M": 128,
        "BLOCK_SIZE_N": 128,
        "BLOCK_SIZE_K": 32,
        "GROUP_SIZE_M": 8,
        "num_stages": 6,
        "num_warps": 8,
        "ms": 0.018400078639388084,
        "min_ms": 0.018400078639388084,
        "max_ms": 0.018400078639388084,
        "compile_time": 1.4652831554412842
    },
    {
        "BLOCK_SIZE_M": 64,
        "BLOCK_SIZE_N": 256,
        "BLOCK_SIZE_K": 64,
        "GROUP_SIZE_M": 8,
        "num_stages": 3,
        "num_warps": 8,
        "ms": 0.018406033515930176,
        "min_ms": 0.018406033515930176,
        "max_ms": 0.018406033515930176,
        "compile_time": 0.6592197418212891
    },
    {
        "BLOCK_SIZE_M": 64,
        "BLOCK_SIZE_N": 64,
        "BLOCK_SIZE_K": 64,
        "GROUP_SIZE_M": 8,
        "num_stages": 4,
        "num_warps": 2,
        "ms": 0.01842993125319481,
        "min_ms": 0.01842993125319481,
        "max_ms": 0.01842993125319481,
        "compile_time": 0.6388638019561768
    },
    {
        "BLOCK_SIZE_M": 64,
        "BLOCK_SIZE_N": 64,
        "BLOCK_SIZE_K": 32,
        "GROUP_SIZE_M": 8,
        "num_stages": 3,
        "num_warps": 4,
        "ms": 0.01843041367828846,
        "min_ms": 0.01843041367828846,
        "max_ms": 0.01843041367828846,
        "compile_time": 0.6655066013336182
    },
    {
        "BLOCK_SIZE_M": 64,
        "BLOCK_SIZE_N": 64,
        "BLOCK_SIZE_K": 64,
        "GROUP_SIZE_M": 8,
        "num_stages": 4,
        "num_warps": 4,
        "ms": 0.01843269169330597,
        "min_ms": 0.01843269169330597,
        "max_ms": 0.01843269169330597,
        "compile_time": 0.651280403137207
    },
    {
        "BLOCK_SIZE_M": 128,
        "BLOCK_SIZE_N": 128,
        "BLOCK_SIZE_K": 64,
        "GROUP_SIZE_M": 8,
        "num_stages": 4,
        "num_warps": 4,
        "ms": 0.018463384360074997,
        "min_ms": 0.018463384360074997,
        "max_ms": 0.018463384360074997,
        "compile_time": 0.7043182849884033
    },
    {
        "BLOCK_SIZE_M": 128,
        "BLOCK_SIZE_N": 128,
        "BLOCK_SIZE_K": 64,
        "GROUP_SIZE_M": 8,
        "num_stages": 5,
        "num_warps": 4,
        "ms": 0.018514972180128098,
        "min_ms": 0.018514972180128098,
        "max_ms": 0.018514972180128098,
        "compile_time": 0.6893682479858398
    },
    {
        "BLOCK_SIZE_M": 128,
        "BLOCK_SIZE_N": 128,
        "BLOCK_SIZE_K": 64,
        "GROUP_SIZE_M": 8,
        "num_stages": 3,
        "num_warps": 4,
        "ms": 0.018530765548348427,
        "min_ms": 0.018530765548348427,
        "max_ms": 0.018530765548348427,
        "compile_time": 0.7093143463134766
    },
    {
        "BLOCK_SIZE_M": 128,
        "BLOCK_SIZE_N": 128,
        "BLOCK_SIZE_K": 128,
        "GROUP_SIZE_M": 8,
        "num_stages": 3,
        "num_warps": 8,
        "ms": 0.018580248579382896,
        "min_ms": 0.018580248579382896,
        "max_ms": 0.018580248579382896,
        "compile_time": 0.6847941875457764
    },
    {
        "BLOCK_SIZE_M": 64,
        "BLOCK_SIZE_N": 256,
        "BLOCK_SIZE_K": 64,
        "GROUP_SIZE_M": 8,
        "num_stages": 4,
        "num_warps": 8,
        "ms": 0.018611609935760498,
        "min_ms": 0.018611609935760498,
        "max_ms": 0.018611609935760498,
        "compile_time": 0.6481385231018066
    },
    {
        "BLOCK_SIZE_M": 64,
        "BLOCK_SIZE_N": 256,
        "BLOCK_SIZE_K": 64,
        "GROUP_SIZE_M": 8,
        "num_stages": 5,
        "num_warps": 8,
        "ms": 0.018617529422044754,
        "min_ms": 0.018617529422044754,
        "max_ms": 0.018617529422044754,
        "compile_time": 0.6619465351104736
    },
    {
        "BLOCK_SIZE_M": 128,
        "BLOCK_SIZE_N": 128,
        "BLOCK_SIZE_K": 32,
        "GROUP_SIZE_M": 8,
        "num_stages": 7,
        "num_warps": 8,
        "ms": 0.018636679276823997,
        "min_ms": 0.018636679276823997,
        "max_ms": 0.018636679276823997,
        "compile_time": 1.5298562049865723
    },
    {
        "BLOCK_SIZE_M": 64,
        "BLOCK_SIZE_N": 128,
        "BLOCK_SIZE_K": 32,
        "GROUP_SIZE_M": 8,
        "num_stages": 3,
        "num_warps": 4,
        "ms": 0.018653180450201035,
        "min_ms": 0.018653180450201035,
        "max_ms": 0.018653180450201035,
        "compile_time": 0.6498322486877441
    },
    {
        "BLOCK_SIZE_M": 128,
        "BLOCK_SIZE_N": 128,
        "BLOCK_SIZE_K": 32,
        "GROUP_SIZE_M": 8,
        "num_stages": 4,
        "num_warps": 8,
        "ms": 0.018664177507162094,
        "min_ms": 0.018664177507162094,
        "max_ms": 0.018664177507162094,
        "compile_time": 0.6876358985900879
    },
    {
        "BLOCK_SIZE_M": 64,
        "BLOCK_SIZE_N": 64,
        "BLOCK_SIZE_K": 32,
        "GROUP_SIZE_M": 8,
        "num_stages": 5,
        "num_warps": 2,
        "ms": 0.01867256686091423,
        "min_ms": 0.01867256686091423,
        "max_ms": 0.01867256686091423,
        "compile_time": 0.6546878814697266
    },
    {
        "BLOCK_SIZE_M": 64,
        "BLOCK_SIZE_N": 64,
        "BLOCK_SIZE_K": 64,
        "GROUP_SIZE_M": 8,
        "num_stages": 3,
        "num_warps": 2,
        "ms": 0.018684973940253258,
        "min_ms": 0.018684973940253258,
        "max_ms": 0.018684973940253258,
        "compile_time": 0.6522839069366455
    },
    {
        "BLOCK_SIZE_M": 64,
        "BLOCK_SIZE_N": 128,
        "BLOCK_SIZE_K": 64,
        "GROUP_SIZE_M": 8,
        "num_stages": 3,
        "num_warps": 4,
        "ms": 0.018693797290325165,
        "min_ms": 0.018693797290325165,
        "max_ms": 0.018693797290325165,
        "compile_time": 0.6709394454956055
    },
    {
        "BLOCK_SIZE_M": 128,
        "BLOCK_SIZE_N": 128,
        "BLOCK_SIZE_K": 32,
        "GROUP_SIZE_M": 8,
        "num_stages": 3,
        "num_warps": 8,
        "ms": 0.018698643893003464,
        "min_ms": 0.018698643893003464,
        "max_ms": 0.018698643893003464,
        "compile_time": 0.7058539390563965
    },
    {
        "BLOCK_SIZE_M": 128,
        "BLOCK_SIZE_N": 64,
        "BLOCK_SIZE_K": 64,
        "GROUP_SIZE_M": 8,
        "num_stages": 3,
        "num_warps": 4,
        "ms": 0.018733032047748566,
        "min_ms": 0.018733032047748566,
        "max_ms": 0.018733032047748566,
        "compile_time": 0.6937918663024902
    },
    {
        "BLOCK_SIZE_M": 256,
        "BLOCK_SIZE_N": 64,
        "BLOCK_SIZE_K": 32,
        "GROUP_SIZE_M": 8,
        "num_stages": 4,
        "num_warps": 4,
        "ms": 0.018811285495758057,
        "min_ms": 0.018811285495758057,
        "max_ms": 0.018811285495758057,
        "compile_time": 0.7364635467529297
    },
    {
        "BLOCK_SIZE_M": 64,
        "BLOCK_SIZE_N": 256,
        "BLOCK_SIZE_K": 32,
        "GROUP_SIZE_M": 8,
        "num_stages": 3,
        "num_warps": 8,
        "ms": 0.018873795866966248,
        "min_ms": 0.018873795866966248,
        "max_ms": 0.018873795866966248,
        "compile_time": 0.671076774597168
    },
    {
        "BLOCK_SIZE_M": 256,
        "BLOCK_SIZE_N": 64,
        "BLOCK_SIZE_K": 32,
        "GROUP_SIZE_M": 8,
        "num_stages": 5,
        "num_warps": 4,
        "ms": 0.01890021190047264,
        "min_ms": 0.01890021190047264,
        "max_ms": 0.01890021190047264,
        "compile_time": 0.7425661087036133
    },
    {
        "BLOCK_SIZE_M": 256,
        "BLOCK_SIZE_N": 64,
        "BLOCK_SIZE_K": 32,
        "GROUP_SIZE_M": 8,
        "num_stages": 3,
        "num_warps": 4,
        "ms": 0.018908793106675148,
        "min_ms": 0.018908793106675148,
        "max_ms": 0.018908793106675148,
        "compile_time": 0.713768720626831
    },
    {
        "BLOCK_SIZE_M": 128,
        "BLOCK_SIZE_N": 128,
        "BLOCK_SIZE_K": 32,
        "GROUP_SIZE_M": 8,
        "num_stages": 8,
        "num_warps": 8,
        "ms": 0.01893361657857895,
        "min_ms": 0.01893361657857895,
        "max_ms": 0.01893361657857895,
        "compile_time": 1.499589443206787
    },
    {
        "BLOCK_SIZE_M": 64,
        "BLOCK_SIZE_N": 128,
        "BLOCK_SIZE_K": 32,
        "GROUP_SIZE_M": 8,
        "num_stages": 5,
        "num_warps": 4,
        "ms": 0.018955295905470848,
        "min_ms": 0.018955295905470848,
        "max_ms": 0.018955295905470848,
        "compile_time": 0.6564834117889404
    },
    {
        "BLOCK_SIZE_M": 64,
        "BLOCK_SIZE_N": 64,
        "BLOCK_SIZE_K": 32,
        "GROUP_SIZE_M": 8,
        "num_stages": 5,
        "num_warps": 4,
        "ms": 0.018958542495965958,
        "min_ms": 0.018958542495965958,
        "max_ms": 0.018958542495965958,
        "compile_time": 0.6389434337615967
    },
    {
        "BLOCK_SIZE_M": 64,
        "BLOCK_SIZE_N": 256,
        "BLOCK_SIZE_K": 32,
        "GROUP_SIZE_M": 8,
        "num_stages": 4,
        "num_warps": 8,
        "ms": 0.0189592894166708,
        "min_ms": 0.0189592894166708,
        "max_ms": 0.0189592894166708,
        "compile_time": 0.6762371063232422
    },
    {
        "BLOCK_SIZE_M": 64,
        "BLOCK_SIZE_N": 256,
        "BLOCK_SIZE_K": 32,
        "GROUP_SIZE_M": 8,
        "num_stages": 5,
        "num_warps": 8,
        "ms": 0.01898328587412834,
        "min_ms": 0.01898328587412834,
        "max_ms": 0.01898328587412834,
        "compile_time": 0.6785838603973389
    },
    {
        "BLOCK_SIZE_M": 64,
        "BLOCK_SIZE_N": 256,
        "BLOCK_SIZE_K": 32,
        "GROUP_SIZE_M": 8,
        "num_stages": 6,
        "num_warps": 8,
        "ms": 0.018990909680724144,
        "min_ms": 0.018990909680724144,
        "max_ms": 0.018990909680724144,
        "compile_time": 1.4417564868927002
    },
    {
        "BLOCK_SIZE_M": 64,
        "BLOCK_SIZE_N": 128,
        "BLOCK_SIZE_K": 64,
        "GROUP_SIZE_M": 8,
        "num_stages": 4,
        "num_warps": 4,
        "ms": 0.019065886735916138,
        "min_ms": 0.019065886735916138,
        "max_ms": 0.019065886735916138,
        "compile_time": 0.6565799713134766
    },
    {
        "BLOCK_SIZE_M": 128,
        "BLOCK_SIZE_N": 64,
        "BLOCK_SIZE_K": 32,
        "GROUP_SIZE_M": 8,
        "num_stages": 3,
        "num_warps": 4,
        "ms": 0.019137665629386902,
        "min_ms": 0.019137665629386902,
        "max_ms": 0.019137665629386902,
        "compile_time": 0.7045633792877197
    },
    {
        "BLOCK_SIZE_M": 64,
        "BLOCK_SIZE_N": 128,
        "BLOCK_SIZE_K": 32,
        "GROUP_SIZE_M": 8,
        "num_stages": 4,
        "num_warps": 4,
        "ms": 0.019153818488121033,
        "min_ms": 0.019153818488121033,
        "max_ms": 0.019153818488121033,
        "compile_time": 0.6747536659240723
    },
    {
        "BLOCK_SIZE_M": 128,
        "BLOCK_SIZE_N": 128,
        "BLOCK_SIZE_K": 64,
        "GROUP_SIZE_M": 8,
        "num_stages": 6,
        "num_warps": 4,
        "ms": 0.01934376358985901,
        "min_ms": 0.01934376358985901,
        "max_ms": 0.01934376358985901,
        "compile_time": 2.28135347366333
    },
    {
        "BLOCK_SIZE_M": 64,
        "BLOCK_SIZE_N": 256,
        "BLOCK_SIZE_K": 32,
        "GROUP_SIZE_M": 8,
        "num_stages": 7,
        "num_warps": 8,
        "ms": 0.019354527816176414,
        "min_ms": 0.019354527816176414,
        "max_ms": 0.019354527816176414,
        "compile_time": 1.479827880859375
    },
    {
        "BLOCK_SIZE_M": 256,
        "BLOCK_SIZE_N": 64,
        "BLOCK_SIZE_K": 128,
        "GROUP_SIZE_M": 8,
        "num_stages": 3,
        "num_warps": 8,
        "ms": 0.01960974931716919,
        "min_ms": 0.01960974931716919,
        "max_ms": 0.01960974931716919,
        "compile_time": 0.7439465522766113
    },
    {
        "BLOCK_SIZE_M": 256,
        "BLOCK_SIZE_N": 64,
        "BLOCK_SIZE_K": 32,
        "GROUP_SIZE_M": 8,
        "num_stages": 7,
        "num_warps": 4,
        "ms": 0.01964103803038597,
        "min_ms": 0.01964103803038597,
        "max_ms": 0.01964103803038597,
        "compile_time": 2.1545252799987793
    },
    {
        "BLOCK_SIZE_M": 128,
        "BLOCK_SIZE_N": 64,
        "BLOCK_SIZE_K": 32,
        "GROUP_SIZE_M": 8,
        "num_stages": 4,
        "num_warps": 4,
        "ms": 0.019642304629087448,
        "min_ms": 0.019642304629087448,
        "max_ms": 0.019642304629087448,
        "compile_time": 0.6919281482696533
    },
    {
        "BLOCK_SIZE_M": 64,
        "BLOCK_SIZE_N": 64,
        "BLOCK_SIZE_K": 32,
        "GROUP_SIZE_M": 8,
        "num_stages": 6,
        "num_warps": 2,
        "ms": 0.019674306735396385,
        "min_ms": 0.019674306735396385,
        "max_ms": 0.019674306735396385,
        "compile_time": 1.4957492351531982
    },
    {
        "BLOCK_SIZE_M": 128,
        "BLOCK_SIZE_N": 64,
        "BLOCK_SIZE_K": 32,
        "GROUP_SIZE_M": 8,
        "num_stages": 5,
        "num_warps": 4,
        "ms": 0.01967501826584339,
        "min_ms": 0.01967501826584339,
        "max_ms": 0.01967501826584339,
        "compile_time": 0.7064402103424072
    },
    {
        "BLOCK_SIZE_M": 256,
        "BLOCK_SIZE_N": 64,
        "BLOCK_SIZE_K": 64,
        "GROUP_SIZE_M": 8,
        "num_stages": 5,
        "num_warps": 4,
        "ms": 0.019792163744568825,
        "min_ms": 0.019792163744568825,
        "max_ms": 0.019792163744568825,
        "compile_time": 0.7510311603546143
    },
    {
        "BLOCK_SIZE_M": 64,
        "BLOCK_SIZE_N": 64,
        "BLOCK_SIZE_K": 32,
        "GROUP_SIZE_M": 8,
        "num_stages": 6,
        "num_warps": 4,
        "ms": 0.019810816273093224,
        "min_ms": 0.019810816273093224,
        "max_ms": 0.019810816273093224,
        "compile_time": 1.2462849617004395
    },
    {
        "BLOCK_SIZE_M": 64,
        "BLOCK_SIZE_N": 128,
        "BLOCK_SIZE_K": 32,
        "GROUP_SIZE_M": 8,
        "num_stages": 6,
        "num_warps": 4,
        "ms": 0.019813884049654007,
        "min_ms": 0.019813884049654007,
        "max_ms": 0.019813884049654007,
        "compile_time": 1.4490344524383545
    },
    {
        "BLOCK_SIZE_M": 256,
        "BLOCK_SIZE_N": 64,
        "BLOCK_SIZE_K": 32,
        "GROUP_SIZE_M": 8,
        "num_stages": 8,
        "num_warps": 4,
        "ms": 0.01989690773189068,
        "min_ms": 0.01989690773189068,
        "max_ms": 0.01989690773189068,
        "compile_time": 2.2634360790252686
    },
    {
        "BLOCK_SIZE_M": 64,
        "BLOCK_SIZE_N": 256,
        "BLOCK_SIZE_K": 32,
        "GROUP_SIZE_M": 8,
        "num_stages": 8,
        "num_warps": 8,
        "ms": 0.01992281712591648,
        "min_ms": 0.01992281712591648,
        "max_ms": 0.01992281712591648,
        "compile_time": 1.5056419372558594
    },
    {
        "BLOCK_SIZE_M": 128,
        "BLOCK_SIZE_N": 64,
        "BLOCK_SIZE_K": 64,
        "GROUP_SIZE_M": 8,
        "num_stages": 4,
        "num_warps": 4,
        "ms": 0.02003750018775463,
        "min_ms": 0.02003750018775463,
        "max_ms": 0.02003750018775463,
        "compile_time": 0.7304513454437256
    },
    {
        "BLOCK_SIZE_M": 128,
        "BLOCK_SIZE_N": 64,
        "BLOCK_SIZE_K": 32,
        "GROUP_SIZE_M": 8,
        "num_stages": 6,
        "num_warps": 4,
        "ms": 0.020240049809217453,
        "min_ms": 0.020240049809217453,
        "max_ms": 0.020240049809217453,
        "compile_time": 1.525602102279663
    },
    {
        "BLOCK_SIZE_M": 64,
        "BLOCK_SIZE_N": 256,
        "BLOCK_SIZE_K": 32,
        "GROUP_SIZE_M": 8,
        "num_stages": 4,
        "num_warps": 4,
        "ms": 0.020261568948626518,
        "min_ms": 0.020261568948626518,
        "max_ms": 0.020261568948626518,
        "compile_time": 0.7049152851104736
    },
    {
        "BLOCK_SIZE_M": 64,
        "BLOCK_SIZE_N": 64,
        "BLOCK_SIZE_K": 32,
        "GROUP_SIZE_M": 8,
        "num_stages": 7,
        "num_warps": 2,
        "ms": 0.020299416035413742,
        "min_ms": 0.020299416035413742,
        "max_ms": 0.020299416035413742,
        "compile_time": 1.5256893634796143
    },
    {
        "BLOCK_SIZE_M": 256,
        "BLOCK_SIZE_N": 64,
        "BLOCK_SIZE_K": 32,
        "GROUP_SIZE_M": 8,
        "num_stages": 4,
        "num_warps": 8,
        "ms": 0.020309511572122574,
        "min_ms": 0.020309511572122574,
        "max_ms": 0.020309511572122574,
        "compile_time": 0.7578184604644775
    },
    {
        "BLOCK_SIZE_M": 256,
        "BLOCK_SIZE_N": 64,
        "BLOCK_SIZE_K": 32,
        "GROUP_SIZE_M": 8,
        "num_stages": 3,
        "num_warps": 8,
        "ms": 0.020356377586722374,
        "min_ms": 0.020356377586722374,
        "max_ms": 0.020356377586722374,
        "compile_time": 0.7512176036834717
    },
    {
        "BLOCK_SIZE_M": 64,
        "BLOCK_SIZE_N": 256,
        "BLOCK_SIZE_K": 32,
        "GROUP_SIZE_M": 8,
        "num_stages": 6,
        "num_warps": 4,
        "ms": 0.020384084433317184,
        "min_ms": 0.020384084433317184,
        "max_ms": 0.020384084433317184,
        "compile_time": 1.9982831478118896
    },
    {
        "BLOCK_SIZE_M": 64,
        "BLOCK_SIZE_N": 64,
        "BLOCK_SIZE_K": 32,
        "GROUP_SIZE_M": 8,
        "num_stages": 7,
        "num_warps": 4,
        "ms": 0.02041628584265709,
        "min_ms": 0.02041628584265709,
        "max_ms": 0.02041628584265709,
        "compile_time": 1.249652624130249
    },
    {
        "BLOCK_SIZE_M": 256,
        "BLOCK_SIZE_N": 64,
        "BLOCK_SIZE_K": 32,
        "GROUP_SIZE_M": 8,
        "num_stages": 5,
        "num_warps": 8,
        "ms": 0.02041875384747982,
        "min_ms": 0.02041875384747982,
        "max_ms": 0.02041875384747982,
        "compile_time": 0.7342648506164551
    },
    {
        "BLOCK_SIZE_M": 64,
        "BLOCK_SIZE_N": 128,
        "BLOCK_SIZE_K": 32,
        "GROUP_SIZE_M": 8,
        "num_stages": 7,
        "num_warps": 4,
        "ms": 0.020443616434931755,
        "min_ms": 0.020443616434931755,
        "max_ms": 0.020443616434931755,
        "compile_time": 1.4709973335266113
    },
    {
        "BLOCK_SIZE_M": 64,
        "BLOCK_SIZE_N": 256,
        "BLOCK_SIZE_K": 128,
        "GROUP_SIZE_M": 8,
        "num_stages": 3,
        "num_warps": 8,
        "ms": 0.020495541393756866,
        "min_ms": 0.020495541393756866,
        "max_ms": 0.020495541393756866,
        "compile_time": 0.7182908058166504
    },
    {
        "BLOCK_SIZE_M": 256,
        "BLOCK_SIZE_N": 64,
        "BLOCK_SIZE_K": 32,
        "GROUP_SIZE_M": 8,
        "num_stages": 6,
        "num_warps": 4,
        "ms": 0.0205966979265213,
        "min_ms": 0.0205966979265213,
        "max_ms": 0.0205966979265213,
        "compile_time": 2.1604840755462646
    },
    {
        "BLOCK_SIZE_M": 256,
        "BLOCK_SIZE_N": 64,
        "BLOCK_SIZE_K": 32,
        "GROUP_SIZE_M": 8,
        "num_stages": 6,
        "num_warps": 8,
        "ms": 0.020650850608944893,
        "min_ms": 0.020650850608944893,
        "max_ms": 0.020650850608944893,
        "compile_time": 1.595841407775879
    },
    {
        "BLOCK_SIZE_M": 256,
        "BLOCK_SIZE_N": 64,
        "BLOCK_SIZE_K": 64,
        "GROUP_SIZE_M": 8,
        "num_stages": 4,
        "num_warps": 4,
        "ms": 0.020688913762569427,
        "min_ms": 0.020688913762569427,
        "max_ms": 0.020688913762569427,
        "compile_time": 0.7642383575439453
    },
    {
        "BLOCK_SIZE_M": 128,
        "BLOCK_SIZE_N": 64,
        "BLOCK_SIZE_K": 32,
        "GROUP_SIZE_M": 8,
        "num_stages": 7,
        "num_warps": 4,
        "ms": 0.020708929747343063,
        "min_ms": 0.020708929747343063,
        "max_ms": 0.020708929747343063,
        "compile_time": 1.598487138748169
    },
    {
        "BLOCK_SIZE_M": 64,
        "BLOCK_SIZE_N": 128,
        "BLOCK_SIZE_K": 64,
        "GROUP_SIZE_M": 8,
        "num_stages": 5,
        "num_warps": 4,
        "ms": 0.020714491605758667,
        "min_ms": 0.020714491605758667,
        "max_ms": 0.020714491605758667,
        "compile_time": 0.6972949504852295
    },
    {
        "BLOCK_SIZE_M": 256,
        "BLOCK_SIZE_N": 64,
        "BLOCK_SIZE_K": 64,
        "GROUP_SIZE_M": 8,
        "num_stages": 3,
        "num_warps": 4,
        "ms": 0.020819751545786858,
        "min_ms": 0.020819751545786858,
        "max_ms": 0.020819751545786858,
        "compile_time": 0.7639632225036621
    },
    {
        "BLOCK_SIZE_M": 64,
        "BLOCK_SIZE_N": 64,
        "BLOCK_SIZE_K": 64,
        "GROUP_SIZE_M": 8,
        "num_stages": 2,
        "num_warps": 4,
        "ms": 0.020840367302298546,
        "min_ms": 0.020840367302298546,
        "max_ms": 0.020840367302298546,
        "compile_time": 0.7043206691741943
    },
    {
        "BLOCK_SIZE_M": 128,
        "BLOCK_SIZE_N": 128,
        "BLOCK_SIZE_K": 128,
        "GROUP_SIZE_M": 8,
        "num_stages": 3,
        "num_warps": 16,
        "ms": 0.020872104912996292,
        "min_ms": 0.020872104912996292,
        "max_ms": 0.020872104912996292,
        "compile_time": 0.7130184173583984
    },
    {
        "BLOCK_SIZE_M": 64,
        "BLOCK_SIZE_N": 256,
        "BLOCK_SIZE_K": 32,
        "GROUP_SIZE_M": 8,
        "num_stages": 8,
        "num_warps": 4,
        "ms": 0.0209428109228611,
        "min_ms": 0.0209428109228611,
        "max_ms": 0.0209428109228611,
        "compile_time": 2.142784595489502
    },
    {
        "BLOCK_SIZE_M": 256,
        "BLOCK_SIZE_N": 64,
        "BLOCK_SIZE_K": 32,
        "GROUP_SIZE_M": 8,
        "num_stages": 7,
        "num_warps": 8,
        "ms": 0.02094837836921215,
        "min_ms": 0.02094837836921215,
        "max_ms": 0.02094837836921215,
        "compile_time": 1.6517910957336426
    },
    {
        "BLOCK_SIZE_M": 128,
        "BLOCK_SIZE_N": 64,
        "BLOCK_SIZE_K": 64,
        "GROUP_SIZE_M": 8,
        "num_stages": 7,
        "num_warps": 4,
        "ms": 0.02101977728307247,
        "min_ms": 0.02101977728307247,
        "max_ms": 0.02101977728307247,
        "compile_time": 1.8199644088745117
    },
    {
        "BLOCK_SIZE_M": 64,
        "BLOCK_SIZE_N": 128,
        "BLOCK_SIZE_K": 64,
        "GROUP_SIZE_M": 8,
        "num_stages": 6,
        "num_warps": 4,
        "ms": 0.021090935915708542,
        "min_ms": 0.021090935915708542,
        "max_ms": 0.021090935915708542,
        "compile_time": 1.702878475189209
    },
    {
        "BLOCK_SIZE_M": 256,
        "BLOCK_SIZE_N": 64,
        "BLOCK_SIZE_K": 32,
        "GROUP_SIZE_M": 8,
        "num_stages": 8,
        "num_warps": 8,
        "ms": 0.021159853786230087,
        "min_ms": 0.021159853786230087,
        "max_ms": 0.021159853786230087,
        "compile_time": 1.6655807495117188
    },
    {
        "BLOCK_SIZE_M": 32,
        "BLOCK_SIZE_N": 128,
        "BLOCK_SIZE_K": 32,
        "GROUP_SIZE_M": 8,
        "num_stages": 4,
        "num_warps": 2,
        "ms": 0.0212165005505085,
        "min_ms": 0.0212165005505085,
        "max_ms": 0.0212165005505085,
        "compile_time": 0.6350314617156982
    },
    {
        "BLOCK_SIZE_M": 64,
        "BLOCK_SIZE_N": 64,
        "BLOCK_SIZE_K": 128,
        "GROUP_SIZE_M": 8,
        "num_stages": 2,
        "num_warps": 4,
        "ms": 0.021355390548706055,
        "min_ms": 0.021355390548706055,
        "max_ms": 0.021355390548706055,
        "compile_time": 0.6946930885314941
    },
    {
        "BLOCK_SIZE_M": 128,
        "BLOCK_SIZE_N": 64,
        "BLOCK_SIZE_K": 64,
        "GROUP_SIZE_M": 8,
        "num_stages": 2,
        "num_warps": 4,
        "ms": 0.021422583609819412,
        "min_ms": 0.021422583609819412,
        "max_ms": 0.021422583609819412,
        "compile_time": 0.7348041534423828
    },
    {
        "BLOCK_SIZE_M": 64,
        "BLOCK_SIZE_N": 128,
        "BLOCK_SIZE_K": 128,
        "GROUP_SIZE_M": 8,
        "num_stages": 2,
        "num_warps": 4,
        "ms": 0.02142331749200821,
        "min_ms": 0.02142331749200821,
        "max_ms": 0.02142331749200821,
        "compile_time": 0.6832273006439209
    },
    {
        "BLOCK_SIZE_M": 128,
        "BLOCK_SIZE_N": 128,
        "BLOCK_SIZE_K": 64,
        "GROUP_SIZE_M": 8,
        "num_stages": 4,
        "num_warps": 16,
        "ms": 0.021492168307304382,
        "min_ms": 0.021492168307304382,
        "max_ms": 0.021492168307304382,
        "compile_time": 0.7376923561096191
    },
    {
        "BLOCK_SIZE_M": 32,
        "BLOCK_SIZE_N": 128,
        "BLOCK_SIZE_K": 32,
        "GROUP_SIZE_M": 8,
        "num_stages": 4,
        "num_warps": 4,
        "ms": 0.02151377499103546,
        "min_ms": 0.02151377499103546,
        "max_ms": 0.02151377499103546,
        "compile_time": 0.6438548564910889
    },
    {
        "BLOCK_SIZE_M": 128,
        "BLOCK_SIZE_N": 128,
        "BLOCK_SIZE_K": 64,
        "GROUP_SIZE_M": 8,
        "num_stages": 3,
        "num_warps": 16,
        "ms": 0.021561864763498306,
        "min_ms": 0.021561864763498306,
        "max_ms": 0.021561864763498306,
        "compile_time": 0.7507600784301758
    },
    {
        "BLOCK_SIZE_M": 64,
        "BLOCK_SIZE_N": 128,
        "BLOCK_SIZE_K": 64,
        "GROUP_SIZE_M": 8,
        "num_stages": 3,
        "num_warps": 8,
        "ms": 0.021621931344270706,
        "min_ms": 0.021621931344270706,
        "max_ms": 0.021621931344270706,
        "compile_time": 0.7246630191802979
    },
    {
        "BLOCK_SIZE_M": 64,
        "BLOCK_SIZE_N": 128,
        "BLOCK_SIZE_K": 64,
        "GROUP_SIZE_M": 8,
        "num_stages": 2,
        "num_warps": 4,
        "ms": 0.02162613719701767,
        "min_ms": 0.02162613719701767,
        "max_ms": 0.02162613719701767,
        "compile_time": 0.6855971813201904
    },
    {
        "BLOCK_SIZE_M": 128,
        "BLOCK_SIZE_N": 64,
        "BLOCK_SIZE_K": 64,
        "GROUP_SIZE_M": 8,
        "num_stages": 3,
        "num_warps": 8,
        "ms": 0.021677160635590553,
        "min_ms": 0.021677160635590553,
        "max_ms": 0.021677160635590553,
        "compile_time": 0.7330114841461182
    },
    {
        "BLOCK_SIZE_M": 128,
        "BLOCK_SIZE_N": 64,
        "BLOCK_SIZE_K": 128,
        "GROUP_SIZE_M": 8,
        "num_stages": 2,
        "num_warps": 4,
        "ms": 0.021719915792346,
        "min_ms": 0.021719915792346,
        "max_ms": 0.021719915792346,
        "compile_time": 0.7398536205291748
    },
    {
        "BLOCK_SIZE_M": 128,
        "BLOCK_SIZE_N": 128,
        "BLOCK_SIZE_K": 64,
        "GROUP_SIZE_M": 8,
        "num_stages": 5,
        "num_warps": 16,
        "ms": 0.021731693297624588,
        "min_ms": 0.021731693297624588,
        "max_ms": 0.021731693297624588,
        "compile_time": 0.7327921390533447
    },
    {
        "BLOCK_SIZE_M": 128,
        "BLOCK_SIZE_N": 32,
        "BLOCK_SIZE_K": 32,
        "GROUP_SIZE_M": 8,
        "num_stages": 3,
        "num_warps": 4,
        "ms": 0.021763313561677933,
        "min_ms": 0.021763313561677933,
        "max_ms": 0.021763313561677933,
        "compile_time": 0.7231400012969971
    },
    {
        "BLOCK_SIZE_M": 64,
        "BLOCK_SIZE_N": 256,
        "BLOCK_SIZE_K": 128,
        "GROUP_SIZE_M": 8,
        "num_stages": 3,
        "num_warps": 16,
        "ms": 0.021774012595415115,
        "min_ms": 0.021774012595415115,
        "max_ms": 0.021774012595415115,
        "compile_time": 0.7223362922668457
    },
    {
        "BLOCK_SIZE_M": 32,
        "BLOCK_SIZE_N": 128,
        "BLOCK_SIZE_K": 64,
        "GROUP_SIZE_M": 8,
        "num_stages": 3,
        "num_warps": 2,
        "ms": 0.02192029543220997,
        "min_ms": 0.02192029543220997,
        "max_ms": 0.02192029543220997,
        "compile_time": 0.6720542907714844
    },
    {
        "BLOCK_SIZE_M": 128,
        "BLOCK_SIZE_N": 32,
        "BLOCK_SIZE_K": 64,
        "GROUP_SIZE_M": 8,
        "num_stages": 3,
        "num_warps": 4,
        "ms": 0.021938180550932884,
        "min_ms": 0.021938180550932884,
        "max_ms": 0.021938180550932884,
        "compile_time": 0.7263712882995605
    },
    {
        "BLOCK_SIZE_M": 32,
        "BLOCK_SIZE_N": 128,
        "BLOCK_SIZE_K": 64,
        "GROUP_SIZE_M": 8,
        "num_stages": 3,
        "num_warps": 4,
        "ms": 0.02193872071802616,
        "min_ms": 0.02193872071802616,
        "max_ms": 0.02193872071802616,
        "compile_time": 0.65380859375
    },
    {
        "BLOCK_SIZE_M": 128,
        "BLOCK_SIZE_N": 32,
        "BLOCK_SIZE_K": 32,
        "GROUP_SIZE_M": 8,
        "num_stages": 3,
        "num_warps": 2,
        "ms": 0.021971523761749268,
        "min_ms": 0.021971523761749268,
        "max_ms": 0.021971523761749268,
        "compile_time": 0.7253327369689941
    },
    {
        "BLOCK_SIZE_M": 64,
        "BLOCK_SIZE_N": 128,
        "BLOCK_SIZE_K": 64,
        "GROUP_SIZE_M": 8,
        "num_stages": 7,
        "num_warps": 4,
        "ms": 0.021986231207847595,
        "min_ms": 0.021986231207847595,
        "max_ms": 0.021986231207847595,
        "compile_time": 1.7904694080352783
    },
    {
        "BLOCK_SIZE_M": 64,
        "BLOCK_SIZE_N": 64,
        "BLOCK_SIZE_K": 64,
        "GROUP_SIZE_M": 8,
        "num_stages": 3,
        "num_warps": 8,
        "ms": 0.022006187587976456,
        "min_ms": 0.022006187587976456,
        "max_ms": 0.022006187587976456,
        "compile_time": 0.7065756320953369
    },
    {
        "BLOCK_SIZE_M": 128,
        "BLOCK_SIZE_N": 64,
        "BLOCK_SIZE_K": 64,
        "GROUP_SIZE_M": 8,
        "num_stages": 4,
        "num_warps": 8,
        "ms": 0.022076737135648727,
        "min_ms": 0.022076737135648727,
        "max_ms": 0.022076737135648727,
        "compile_time": 0.7288980484008789
    },
    {
        "BLOCK_SIZE_M": 64,
        "BLOCK_SIZE_N": 128,
        "BLOCK_SIZE_K": 32,
        "GROUP_SIZE_M": 8,
        "num_stages": 8,
        "num_warps": 4,
        "ms": 0.022087462246418,
        "min_ms": 0.022087462246418,
        "max_ms": 0.022087462246418,
        "compile_time": 1.526745080947876
    },
    {
        "BLOCK_SIZE_M": 256,
        "BLOCK_SIZE_N": 64,
        "BLOCK_SIZE_K": 64,
        "GROUP_SIZE_M": 8,
        "num_stages": 4,
        "num_warps": 16,
        "ms": 0.022103335708379745,
        "min_ms": 0.022103335708379745,
        "max_ms": 0.022103335708379745,
        "compile_time": 0.7841129302978516
    },
    {
        "BLOCK_SIZE_M": 128,
        "BLOCK_SIZE_N": 32,
        "BLOCK_SIZE_K": 64,
        "GROUP_SIZE_M": 8,
        "num_stages": 3,
        "num_warps": 2,
        "ms": 0.02215462550520897,
        "min_ms": 0.02215462550520897,
        "max_ms": 0.02215462550520897,
        "compile_time": 0.7393393516540527
    },
    {
        "BLOCK_SIZE_M": 64,
        "BLOCK_SIZE_N": 64,
        "BLOCK_SIZE_K": 64,
        "GROUP_SIZE_M": 8,
        "num_stages": 5,
        "num_warps": 2,
        "ms": 0.02217705361545086,
        "min_ms": 0.02217705361545086,
        "max_ms": 0.02217705361545086,
        "compile_time": 0.6934125423431396
    },
    {
        "BLOCK_SIZE_M": 128,
        "BLOCK_SIZE_N": 32,
        "BLOCK_SIZE_K": 32,
        "GROUP_SIZE_M": 8,
        "num_stages": 4,
        "num_warps": 2,
        "ms": 0.022208083420991898,
        "min_ms": 0.022208083420991898,
        "max_ms": 0.022208083420991898,
        "compile_time": 0.7295403480529785
    },
    {
        "BLOCK_SIZE_M": 128,
        "BLOCK_SIZE_N": 64,
        "BLOCK_SIZE_K": 64,
        "GROUP_SIZE_M": 8,
        "num_stages": 5,
        "num_warps": 4,
        "ms": 0.022258706390857697,
        "min_ms": 0.022258706390857697,
        "max_ms": 0.022258706390857697,
        "compile_time": 0.7395803928375244
    },
    {
        "BLOCK_SIZE_M": 64,
        "BLOCK_SIZE_N": 256,
        "BLOCK_SIZE_K": 64,
        "GROUP_SIZE_M": 8,
        "num_stages": 4,
        "num_warps": 16,
        "ms": 0.022317200899124146,
        "min_ms": 0.022317200899124146,
        "max_ms": 0.022317200899124146,
        "compile_time": 0.6701743602752686
    },
    {
        "BLOCK_SIZE_M": 256,
        "BLOCK_SIZE_N": 64,
        "BLOCK_SIZE_K": 128,
        "GROUP_SIZE_M": 8,
        "num_stages": 3,
        "num_warps": 16,
        "ms": 0.022331474348902702,
        "min_ms": 0.022331474348902702,
        "max_ms": 0.022331474348902702,
        "compile_time": 0.7831442356109619
    },
    {
        "BLOCK_SIZE_M": 64,
        "BLOCK_SIZE_N": 256,
        "BLOCK_SIZE_K": 64,
        "GROUP_SIZE_M": 8,
        "num_stages": 3,
        "num_warps": 16,
        "ms": 0.022361038252711296,
        "min_ms": 0.022361038252711296,
        "max_ms": 0.022361038252711296,
        "compile_time": 0.6826844215393066
    },
    {
        "BLOCK_SIZE_M": 128,
        "BLOCK_SIZE_N": 128,
        "BLOCK_SIZE_K": 64,
        "GROUP_SIZE_M": 8,
        "num_stages": 6,
        "num_warps": 16,
        "ms": 0.0223817341029644,
        "min_ms": 0.0223817341029644,
        "max_ms": 0.0223817341029644,
        "compile_time": 1.4510071277618408
    },
    {
        "BLOCK_SIZE_M": 64,
        "BLOCK_SIZE_N": 128,
        "BLOCK_SIZE_K": 64,
        "GROUP_SIZE_M": 8,
        "num_stages": 4,
        "num_warps": 8,
        "ms": 0.02239816263318062,
        "min_ms": 0.02239816263318062,
        "max_ms": 0.02239816263318062,
        "compile_time": 0.7349588871002197
    },
    {
        "BLOCK_SIZE_M": 64,
        "BLOCK_SIZE_N": 64,
        "BLOCK_SIZE_K": 64,
        "GROUP_SIZE_M": 8,
        "num_stages": 7,
        "num_warps": 4,
        "ms": 0.022400440648198128,
        "min_ms": 0.022400440648198128,
        "max_ms": 0.022400440648198128,
        "compile_time": 1.4352529048919678
    },
    {
        "BLOCK_SIZE_M": 128,
        "BLOCK_SIZE_N": 128,
        "BLOCK_SIZE_K": 128,
        "GROUP_SIZE_M": 8,
        "num_stages": 3,
        "num_warps": 4,
        "ms": 0.022400522604584694,
        "min_ms": 0.022400522604584694,
        "max_ms": 0.022400522604584694,
        "compile_time": 0.6524388790130615
    },
    {
        "BLOCK_SIZE_M": 32,
        "BLOCK_SIZE_N": 128,
        "BLOCK_SIZE_K": 32,
        "GROUP_SIZE_M": 8,
        "num_stages": 3,
        "num_warps": 2,
        "ms": 0.022401530295610428,
        "min_ms": 0.022401530295610428,
        "max_ms": 0.022401530295610428,
        "compile_time": 0.6563386917114258
    },
    {
        "BLOCK_SIZE_M": 64,
        "BLOCK_SIZE_N": 128,
        "BLOCK_SIZE_K": 32,
        "GROUP_SIZE_M": 8,
        "num_stages": 2,
        "num_warps": 4,
        "ms": 0.02240287885069847,
        "min_ms": 0.02240287885069847,
        "max_ms": 0.02240287885069847,
        "compile_time": 0.7040619850158691
    },
    {
        "BLOCK_SIZE_M": 128,
        "BLOCK_SIZE_N": 32,
        "BLOCK_SIZE_K": 32,
        "GROUP_SIZE_M": 8,
        "num_stages": 4,
        "num_warps": 4,
        "ms": 0.022404517978429794,
        "min_ms": 0.022404517978429794,
        "max_ms": 0.022404517978429794,
        "compile_time": 0.7194859981536865
    },
    {
        "BLOCK_SIZE_M": 64,
        "BLOCK_SIZE_N": 64,
        "BLOCK_SIZE_K": 64,
        "GROUP_SIZE_M": 8,
        "num_stages": 8,
        "num_warps": 4,
        "ms": 0.022420251742005348,
        "min_ms": 0.022420251742005348,
        "max_ms": 0.022420251742005348,
        "compile_time": 1.4844963550567627
    },
    {
        "BLOCK_SIZE_M": 64,
        "BLOCK_SIZE_N": 64,
        "BLOCK_SIZE_K": 128,
        "GROUP_SIZE_M": 8,
        "num_stages": 3,
        "num_warps": 4,
        "ms": 0.022427931427955627,
        "min_ms": 0.022427931427955627,
        "max_ms": 0.022427931427955627,
        "compile_time": 0.712493896484375
    },
    {
        "BLOCK_SIZE_M": 64,
        "BLOCK_SIZE_N": 64,
        "BLOCK_SIZE_K": 32,
        "GROUP_SIZE_M": 8,
        "num_stages": 2,
        "num_warps": 4,
        "ms": 0.022435028105974197,
        "min_ms": 0.022435028105974197,
        "max_ms": 0.022435028105974197,
        "compile_time": 0.6706666946411133
    },
    {
        "BLOCK_SIZE_M": 32,
        "BLOCK_SIZE_N": 128,
        "BLOCK_SIZE_K": 32,
        "GROUP_SIZE_M": 8,
        "num_stages": 3,
        "num_warps": 4,
        "ms": 0.022459978237748146,
        "min_ms": 0.022459978237748146,
        "max_ms": 0.022459978237748146,
        "compile_time": 0.6644742488861084
    },
    {
        "BLOCK_SIZE_M": 128,
        "BLOCK_SIZE_N": 64,
        "BLOCK_SIZE_K": 64,
        "GROUP_SIZE_M": 8,
        "num_stages": 6,
        "num_warps": 4,
        "ms": 0.02246619388461113,
        "min_ms": 0.02246619388461113,
        "max_ms": 0.02246619388461113,
        "compile_time": 1.8039865493774414
    },
    {
        "BLOCK_SIZE_M": 32,
        "BLOCK_SIZE_N": 128,
        "BLOCK_SIZE_K": 32,
        "GROUP_SIZE_M": 8,
        "num_stages": 5,
        "num_warps": 2,
        "ms": 0.02251686155796051,
        "min_ms": 0.02251686155796051,
        "max_ms": 0.02251686155796051,
        "compile_time": 0.6605677604675293
    },
    {
        "BLOCK_SIZE_M": 32,
        "BLOCK_SIZE_N": 128,
        "BLOCK_SIZE_K": 32,
        "GROUP_SIZE_M": 8,
        "num_stages": 5,
        "num_warps": 4,
        "ms": 0.022517677396535873,
        "min_ms": 0.022517677396535873,
        "max_ms": 0.022517677396535873,
        "compile_time": 0.6525382995605469
    },
    {
        "BLOCK_SIZE_M": 128,
        "BLOCK_SIZE_N": 64,
        "BLOCK_SIZE_K": 32,
        "GROUP_SIZE_M": 8,
        "num_stages": 8,
        "num_warps": 4,
        "ms": 0.022519957274198532,
        "min_ms": 0.022519957274198532,
        "max_ms": 0.022519957274198532,
        "compile_time": 1.622974157333374
    },
    {
        "BLOCK_SIZE_M": 64,
        "BLOCK_SIZE_N": 256,
        "BLOCK_SIZE_K": 32,
        "GROUP_SIZE_M": 8,
        "num_stages": 7,
        "num_warps": 4,
        "ms": 0.02252800017595291,
        "min_ms": 0.02252800017595291,
        "max_ms": 0.02252800017595291,
        "compile_time": 2.0573296546936035
    },
    {
        "BLOCK_SIZE_M": 64,
        "BLOCK_SIZE_N": 64,
        "BLOCK_SIZE_K": 128,
        "GROUP_SIZE_M": 8,
        "num_stages": 3,
        "num_warps": 8,
        "ms": 0.0226031132042408,
        "min_ms": 0.0226031132042408,
        "max_ms": 0.0226031132042408,
        "compile_time": 0.6957588195800781
    },
    {
        "BLOCK_SIZE_M": 64,
        "BLOCK_SIZE_N": 64,
        "BLOCK_SIZE_K": 64,
        "GROUP_SIZE_M": 8,
        "num_stages": 6,
        "num_warps": 4,
        "ms": 0.022607998922467232,
        "min_ms": 0.022607998922467232,
        "max_ms": 0.022607998922467232,
        "compile_time": 1.4292843341827393
    },
    {
        "BLOCK_SIZE_M": 256,
        "BLOCK_SIZE_N": 64,
        "BLOCK_SIZE_K": 64,
        "GROUP_SIZE_M": 8,
        "num_stages": 3,
        "num_warps": 16,
        "ms": 0.022616466507315636,
        "min_ms": 0.022616466507315636,
        "max_ms": 0.022616466507315636,
        "compile_time": 0.7875640392303467
    },
    {
        "BLOCK_SIZE_M": 64,
        "BLOCK_SIZE_N": 64,
        "BLOCK_SIZE_K": 32,
        "GROUP_SIZE_M": 8,
        "num_stages": 8,
        "num_warps": 2,
        "ms": 0.022688256576657295,
        "min_ms": 0.022688256576657295,
        "max_ms": 0.022688256576657295,
        "compile_time": 1.5511164665222168
    },
    {
        "BLOCK_SIZE_M": 32,
        "BLOCK_SIZE_N": 512,
        "BLOCK_SIZE_K": 32,
        "GROUP_SIZE_M": 8,
        "num_stages": 5,
        "num_warps": 8,
        "ms": 0.022690046578645706,
        "min_ms": 0.022690046578645706,
        "max_ms": 0.022690046578645706,
        "compile_time": 1.391430139541626
    },
    {
        "BLOCK_SIZE_M": 64,
        "BLOCK_SIZE_N": 64,
        "BLOCK_SIZE_K": 64,
        "GROUP_SIZE_M": 8,
        "num_stages": 4,
        "num_warps": 8,
        "ms": 0.022696901112794876,
        "min_ms": 0.022696901112794876,
        "max_ms": 0.022696901112794876,
        "compile_time": 0.7102246284484863
    },
    {
        "BLOCK_SIZE_M": 32,
        "BLOCK_SIZE_N": 256,
        "BLOCK_SIZE_K": 32,
        "GROUP_SIZE_M": 8,
        "num_stages": 3,
        "num_warps": 4,
        "ms": 0.0227043516933918,
        "min_ms": 0.0227043516933918,
        "max_ms": 0.0227043516933918,
        "compile_time": 0.707327127456665
    },
    {
        "BLOCK_SIZE_M": 64,
        "BLOCK_SIZE_N": 64,
        "BLOCK_SIZE_K": 32,
        "GROUP_SIZE_M": 8,
        "num_stages": 2,
        "num_warps": 2,
        "ms": 0.02278144098818302,
        "min_ms": 0.02278144098818302,
        "max_ms": 0.02278144098818302,
        "compile_time": 0.6813955307006836
    },
    {
        "BLOCK_SIZE_M": 32,
        "BLOCK_SIZE_N": 256,
        "BLOCK_SIZE_K": 32,
        "GROUP_SIZE_M": 8,
        "num_stages": 4,
        "num_warps": 4,
        "ms": 0.022786380723118782,
        "min_ms": 0.022786380723118782,
        "max_ms": 0.022786380723118782,
        "compile_time": 0.7177114486694336
    },
    {
        "BLOCK_SIZE_M": 64,
        "BLOCK_SIZE_N": 64,
        "BLOCK_SIZE_K": 128,
        "GROUP_SIZE_M": 8,
        "num_stages": 4,
        "num_warps": 4,
        "ms": 0.022795649245381355,
        "min_ms": 0.022795649245381355,
        "max_ms": 0.022795649245381355,
        "compile_time": 0.684546709060669
    },
    {
        "BLOCK_SIZE_M": 64,
        "BLOCK_SIZE_N": 128,
        "BLOCK_SIZE_K": 128,
        "GROUP_SIZE_M": 8,
        "num_stages": 3,
        "num_warps": 4,
        "ms": 0.02281816303730011,
        "min_ms": 0.02281816303730011,
        "max_ms": 0.02281816303730011,
        "compile_time": 0.7232575416564941
    },
    {
        "BLOCK_SIZE_M": 64,
        "BLOCK_SIZE_N": 256,
        "BLOCK_SIZE_K": 64,
        "GROUP_SIZE_M": 8,
        "num_stages": 3,
        "num_warps": 4,
        "ms": 0.02284499630331993,
        "min_ms": 0.02284499630331993,
        "max_ms": 0.02284499630331993,
        "compile_time": 0.7417149543762207
    },
    {
        "BLOCK_SIZE_M": 512,
        "BLOCK_SIZE_N": 32,
        "BLOCK_SIZE_K": 64,
        "GROUP_SIZE_M": 8,
        "num_stages": 3,
        "num_warps": 8,
        "ms": 0.022854270413517952,
        "min_ms": 0.022854270413517952,
        "max_ms": 0.022854270413517952,
        "compile_time": 2.070183277130127
    },
    {
        "BLOCK_SIZE_M": 64,
        "BLOCK_SIZE_N": 256,
        "BLOCK_SIZE_K": 64,
        "GROUP_SIZE_M": 8,
        "num_stages": 5,
        "num_warps": 16,
        "ms": 0.02287088707089424,
        "min_ms": 0.02287088707089424,
        "max_ms": 0.02287088707089424,
        "compile_time": 0.7269675731658936
    },
    {
        "BLOCK_SIZE_M": 64,
        "BLOCK_SIZE_N": 64,
        "BLOCK_SIZE_K": 128,
        "GROUP_SIZE_M": 8,
        "num_stages": 5,
        "num_warps": 4,
        "ms": 0.022880125790834427,
        "min_ms": 0.022880125790834427,
        "max_ms": 0.022880125790834427,
        "compile_time": 0.6852381229400635
    },
    {
        "BLOCK_SIZE_M": 32,
        "BLOCK_SIZE_N": 256,
        "BLOCK_SIZE_K": 32,
        "GROUP_SIZE_M": 8,
        "num_stages": 5,
        "num_warps": 4,
        "ms": 0.023012466728687286,
        "min_ms": 0.023012466728687286,
        "max_ms": 0.023012466728687286,
        "compile_time": 0.7169978618621826
    },
    {
        "BLOCK_SIZE_M": 64,
        "BLOCK_SIZE_N": 64,
        "BLOCK_SIZE_K": 64,
        "GROUP_SIZE_M": 8,
        "num_stages": 2,
        "num_warps": 2,
        "ms": 0.02302936278283596,
        "min_ms": 0.02302936278283596,
        "max_ms": 0.02302936278283596,
        "compile_time": 0.6944522857666016
    },
    {
        "BLOCK_SIZE_M": 128,
        "BLOCK_SIZE_N": 64,
        "BLOCK_SIZE_K": 32,
        "GROUP_SIZE_M": 8,
        "num_stages": 2,
        "num_warps": 4,
        "ms": 0.023048456758260727,
        "min_ms": 0.023048456758260727,
        "max_ms": 0.023048456758260727,
        "compile_time": 0.7141749858856201
    },
    {
        "BLOCK_SIZE_M": 64,
        "BLOCK_SIZE_N": 128,
        "BLOCK_SIZE_K": 128,
        "GROUP_SIZE_M": 8,
        "num_stages": 2,
        "num_warps": 8,
        "ms": 0.02305247262120247,
        "min_ms": 0.02305247262120247,
        "max_ms": 0.02305247262120247,
        "compile_time": 0.7188558578491211
    },
    {
        "BLOCK_SIZE_M": 256,
        "BLOCK_SIZE_N": 64,
        "BLOCK_SIZE_K": 64,
        "GROUP_SIZE_M": 8,
        "num_stages": 5,
        "num_warps": 16,
        "ms": 0.02306320145726204,
        "min_ms": 0.02306320145726204,
        "max_ms": 0.02306320145726204,
        "compile_time": 0.7880759239196777
    },
    {
        "BLOCK_SIZE_M": 64,
        "BLOCK_SIZE_N": 64,
        "BLOCK_SIZE_K": 64,
        "GROUP_SIZE_M": 8,
        "num_stages": 6,
        "num_warps": 2,
        "ms": 0.023067111149430275,
        "min_ms": 0.023067111149430275,
        "max_ms": 0.023067111149430275,
        "compile_time": 1.7867491245269775
    },
    {
        "BLOCK_SIZE_M": 64,
        "BLOCK_SIZE_N": 128,
        "BLOCK_SIZE_K": 64,
        "GROUP_SIZE_M": 8,
        "num_stages": 5,
        "num_warps": 8,
        "ms": 0.023073401302099228,
        "min_ms": 0.023073401302099228,
        "max_ms": 0.023073401302099228,
        "compile_time": 0.7210662364959717
    },
    {
        "BLOCK_SIZE_M": 64,
        "BLOCK_SIZE_N": 256,
        "BLOCK_SIZE_K": 64,
        "GROUP_SIZE_M": 8,
        "num_stages": 5,
        "num_warps": 4,
        "ms": 0.02307341992855072,
        "min_ms": 0.02307341992855072,
        "max_ms": 0.02307341992855072,
        "compile_time": 0.7080471515655518
    },
    {
        "BLOCK_SIZE_M": 32,
        "BLOCK_SIZE_N": 256,
        "BLOCK_SIZE_K": 64,
        "GROUP_SIZE_M": 8,
        "num_stages": 3,
        "num_warps": 4,
        "ms": 0.023123839870095253,
        "min_ms": 0.023123839870095253,
        "max_ms": 0.023123839870095253,
        "compile_time": 0.8139655590057373
    },
    {
        "BLOCK_SIZE_M": 32,
        "BLOCK_SIZE_N": 128,
        "BLOCK_SIZE_K": 32,
        "GROUP_SIZE_M": 8,
        "num_stages": 6,
        "num_warps": 2,
        "ms": 0.023127945140004158,
        "min_ms": 0.023127945140004158,
        "max_ms": 0.023127945140004158,
        "compile_time": 1.4040906429290771
    },
    {
        "BLOCK_SIZE_M": 64,
        "BLOCK_SIZE_N": 256,
        "BLOCK_SIZE_K": 64,
        "GROUP_SIZE_M": 8,
        "num_stages": 4,
        "num_warps": 4,
        "ms": 0.023155640810728073,
        "min_ms": 0.023155640810728073,
        "max_ms": 0.023155640810728073,
        "compile_time": 0.7170734405517578
    },
    {
        "BLOCK_SIZE_M": 32,
        "BLOCK_SIZE_N": 64,
        "BLOCK_SIZE_K": 32,
        "GROUP_SIZE_M": 8,
        "num_stages": 4,
        "num_warps": 2,
        "ms": 0.02316858246922493,
        "min_ms": 0.02316858246922493,
        "max_ms": 0.02316858246922493,
        "compile_time": 0.6555359363555908
    },
    {
        "BLOCK_SIZE_M": 32,
        "BLOCK_SIZE_N": 128,
        "BLOCK_SIZE_K": 32,
        "GROUP_SIZE_M": 8,
        "num_stages": 6,
        "num_warps": 4,
        "ms": 0.023173868656158447,
        "min_ms": 0.023173868656158447,
        "max_ms": 0.023173868656158447,
        "compile_time": 1.2326042652130127
    },
    {
        "BLOCK_SIZE_M": 128,
        "BLOCK_SIZE_N": 32,
        "BLOCK_SIZE_K": 32,
        "GROUP_SIZE_M": 8,
        "num_stages": 5,
        "num_warps": 4,
        "ms": 0.02318645641207695,
        "min_ms": 0.02318645641207695,
        "max_ms": 0.02318645641207695,
        "compile_time": 0.7311606407165527
    },
    {
        "BLOCK_SIZE_M": 128,
        "BLOCK_SIZE_N": 32,
        "BLOCK_SIZE_K": 32,
        "GROUP_SIZE_M": 8,
        "num_stages": 2,
        "num_warps": 2,
        "ms": 0.023201024159789085,
        "min_ms": 0.023201024159789085,
        "max_ms": 0.023201024159789085,
        "compile_time": 0.7269690036773682
    },
    {
        "BLOCK_SIZE_M": 64,
        "BLOCK_SIZE_N": 128,
        "BLOCK_SIZE_K": 32,
        "GROUP_SIZE_M": 8,
        "num_stages": 3,
        "num_warps": 8,
        "ms": 0.02320118434727192,
        "min_ms": 0.02320118434727192,
        "max_ms": 0.02320118434727192,
        "compile_time": 0.7059669494628906
    },
    {
        "BLOCK_SIZE_M": 128,
        "BLOCK_SIZE_N": 32,
        "BLOCK_SIZE_K": 32,
        "GROUP_SIZE_M": 8,
        "num_stages": 5,
        "num_warps": 2,
        "ms": 0.02320370078086853,
        "min_ms": 0.02320370078086853,
        "max_ms": 0.02320370078086853,
        "compile_time": 0.7304730415344238
    },
    {
        "BLOCK_SIZE_M": 64,
        "BLOCK_SIZE_N": 256,
        "BLOCK_SIZE_K": 16,
        "GROUP_SIZE_M": 8,
        "num_stages": 3,
        "num_warps": 4,
        "ms": 0.023210112005472183,
        "min_ms": 0.023210112005472183,
        "max_ms": 0.023210112005472183,
        "compile_time": 1.626281499862671
    },
    {
        "BLOCK_SIZE_M": 256,
        "BLOCK_SIZE_N": 32,
        "BLOCK_SIZE_K": 64,
        "GROUP_SIZE_M": 8,
        "num_stages": 3,
        "num_warps": 4,
        "ms": 0.023224813863635063,
        "min_ms": 0.023224813863635063,
        "max_ms": 0.023224813863635063,
        "compile_time": 0.8077297210693359
    },
    {
        "BLOCK_SIZE_M": 128,
        "BLOCK_SIZE_N": 64,
        "BLOCK_SIZE_K": 128,
        "GROUP_SIZE_M": 8,
        "num_stages": 2,
        "num_warps": 8,
        "ms": 0.023247359320521355,
        "min_ms": 0.023247359320521355,
        "max_ms": 0.023247359320521355,
        "compile_time": 0.7344763278961182
    },
    {
        "BLOCK_SIZE_M": 64,
        "BLOCK_SIZE_N": 64,
        "BLOCK_SIZE_K": 64,
        "GROUP_SIZE_M": 8,
        "num_stages": 5,
        "num_warps": 8,
        "ms": 0.023266857489943504,
        "min_ms": 0.023266857489943504,
        "max_ms": 0.023266857489943504,
        "compile_time": 0.7466585636138916
    },
    {
        "BLOCK_SIZE_M": 32,
        "BLOCK_SIZE_N": 512,
        "BLOCK_SIZE_K": 32,
        "GROUP_SIZE_M": 8,
        "num_stages": 4,
        "num_warps": 8,
        "ms": 0.023271549493074417,
        "min_ms": 0.023271549493074417,
        "max_ms": 0.023271549493074417,
        "compile_time": 1.5040979385375977
    },
    {
        "BLOCK_SIZE_M": 128,
        "BLOCK_SIZE_N": 64,
        "BLOCK_SIZE_K": 128,
        "GROUP_SIZE_M": 8,
        "num_stages": 3,
        "num_warps": 4,
        "ms": 0.023284409195184708,
        "min_ms": 0.023284409195184708,
        "max_ms": 0.023284409195184708,
        "compile_time": 0.7573385238647461
    },
    {
        "BLOCK_SIZE_M": 64,
        "BLOCK_SIZE_N": 256,
        "BLOCK_SIZE_K": 16,
        "GROUP_SIZE_M": 8,
        "num_stages": 6,
        "num_warps": 4,
        "ms": 0.023308802396059036,
        "min_ms": 0.023308802396059036,
        "max_ms": 0.023308802396059036,
        "compile_time": 1.68851900100708
    },
    {
        "BLOCK_SIZE_M": 128,
        "BLOCK_SIZE_N": 64,
        "BLOCK_SIZE_K": 32,
        "GROUP_SIZE_M": 8,
        "num_stages": 3,
        "num_warps": 8,
        "ms": 0.023311685770750046,
        "min_ms": 0.023311685770750046,
        "max_ms": 0.023311685770750046,
        "compile_time": 0.7489981651306152
    },
    {
        "BLOCK_SIZE_M": 128,
        "BLOCK_SIZE_N": 64,
        "BLOCK_SIZE_K": 64,
        "GROUP_SIZE_M": 8,
        "num_stages": 5,
        "num_warps": 8,
        "ms": 0.023318501189351082,
        "min_ms": 0.023318501189351082,
        "max_ms": 0.023318501189351082,
        "compile_time": 0.7424991130828857
    },
    {
        "BLOCK_SIZE_M": 64,
        "BLOCK_SIZE_N": 256,
        "BLOCK_SIZE_K": 16,
        "GROUP_SIZE_M": 8,
        "num_stages": 4,
        "num_warps": 4,
        "ms": 0.023320674896240234,
        "min_ms": 0.023320674896240234,
        "max_ms": 0.023320674896240234,
        "compile_time": 1.4648313522338867
    },
    {
        "BLOCK_SIZE_M": 64,
        "BLOCK_SIZE_N": 256,
        "BLOCK_SIZE_K": 16,
        "GROUP_SIZE_M": 8,
        "num_stages": 5,
        "num_warps": 4,
        "ms": 0.023357098922133446,
        "min_ms": 0.023357098922133446,
        "max_ms": 0.023357098922133446,
        "compile_time": 1.6808710098266602
    },
    {
        "BLOCK_SIZE_M": 64,
        "BLOCK_SIZE_N": 256,
        "BLOCK_SIZE_K": 16,
        "GROUP_SIZE_M": 8,
        "num_stages": 7,
        "num_warps": 4,
        "ms": 0.023360077291727066,
        "min_ms": 0.023360077291727066,
        "max_ms": 0.023360077291727066,
        "compile_time": 1.7126362323760986
    },
    {
        "BLOCK_SIZE_M": 128,
        "BLOCK_SIZE_N": 64,
        "BLOCK_SIZE_K": 64,
        "GROUP_SIZE_M": 8,
        "num_stages": 2,
        "num_warps": 8,
        "ms": 0.023372560739517212,
        "min_ms": 0.023372560739517212,
        "max_ms": 0.023372560739517212,
        "compile_time": 0.653233528137207
    },
    {
        "BLOCK_SIZE_M": 64,
        "BLOCK_SIZE_N": 128,
        "BLOCK_SIZE_K": 128,
        "GROUP_SIZE_M": 8,
        "num_stages": 4,
        "num_warps": 4,
        "ms": 0.02337932586669922,
        "min_ms": 0.02337932586669922,
        "max_ms": 0.02337932586669922,
        "compile_time": 0.7235836982727051
    },
    {
        "BLOCK_SIZE_M": 64,
        "BLOCK_SIZE_N": 32,
        "BLOCK_SIZE_K": 32,
        "GROUP_SIZE_M": 8,
        "num_stages": 4,
        "num_warps": 2,
        "ms": 0.0234017726033926,
        "min_ms": 0.0234017726033926,
        "max_ms": 0.0234017726033926,
        "compile_time": 0.7088112831115723
    },
    {
        "BLOCK_SIZE_M": 32,
        "BLOCK_SIZE_N": 512,
        "BLOCK_SIZE_K": 64,
        "GROUP_SIZE_M": 8,
        "num_stages": 3,
        "num_warps": 8,
        "ms": 0.023407872766256332,
        "min_ms": 0.023407872766256332,
        "max_ms": 0.023407872766256332,
        "compile_time": 1.7691829204559326
    },
    {
        "BLOCK_SIZE_M": 64,
        "BLOCK_SIZE_N": 128,
        "BLOCK_SIZE_K": 32,
        "GROUP_SIZE_M": 8,
        "num_stages": 4,
        "num_warps": 8,
        "ms": 0.02340882644057274,
        "min_ms": 0.02340882644057274,
        "max_ms": 0.02340882644057274,
        "compile_time": 0.7181713581085205
    },
    {
        "BLOCK_SIZE_M": 64,
        "BLOCK_SIZE_N": 32,
        "BLOCK_SIZE_K": 64,
        "GROUP_SIZE_M": 8,
        "num_stages": 3,
        "num_warps": 2,
        "ms": 0.023448919877409935,
        "min_ms": 0.023448919877409935,
        "max_ms": 0.023448919877409935,
        "compile_time": 0.7043499946594238
    },
    {
        "BLOCK_SIZE_M": 32,
        "BLOCK_SIZE_N": 64,
        "BLOCK_SIZE_K": 64,
        "GROUP_SIZE_M": 8,
        "num_stages": 3,
        "num_warps": 2,
        "ms": 0.023449663072824478,
        "min_ms": 0.023449663072824478,
        "max_ms": 0.023449663072824478,
        "compile_time": 0.677269458770752
    },
    {
        "BLOCK_SIZE_M": 64,
        "BLOCK_SIZE_N": 64,
        "BLOCK_SIZE_K": 64,
        "GROUP_SIZE_M": 8,
        "num_stages": 5,
        "num_warps": 4,
        "ms": 0.023450404405593872,
        "min_ms": 0.023450404405593872,
        "max_ms": 0.023450404405593872,
        "compile_time": 0.7070300579071045
    },
    {
        "BLOCK_SIZE_M": 32,
        "BLOCK_SIZE_N": 64,
        "BLOCK_SIZE_K": 32,
        "GROUP_SIZE_M": 8,
        "num_stages": 3,
        "num_warps": 4,
        "ms": 0.023465216159820557,
        "min_ms": 0.023465216159820557,
        "max_ms": 0.023465216159820557,
        "compile_time": 0.6576898097991943
    },
    {
        "BLOCK_SIZE_M": 32,
        "BLOCK_SIZE_N": 64,
        "BLOCK_SIZE_K": 32,
        "GROUP_SIZE_M": 8,
        "num_stages": 3,
        "num_warps": 2,
        "ms": 0.02349483035504818,
        "min_ms": 0.02349483035504818,
        "max_ms": 0.02349483035504818,
        "compile_time": 0.6677525043487549
    },
    {
        "BLOCK_SIZE_M": 128,
        "BLOCK_SIZE_N": 64,
        "BLOCK_SIZE_K": 128,
        "GROUP_SIZE_M": 8,
        "num_stages": 4,
        "num_warps": 4,
        "ms": 0.023506097495555878,
        "min_ms": 0.023506097495555878,
        "max_ms": 0.023506097495555878,
        "compile_time": 0.7358090877532959
    },
    {
        "BLOCK_SIZE_M": 64,
        "BLOCK_SIZE_N": 64,
        "BLOCK_SIZE_K": 128,
        "GROUP_SIZE_M": 8,
        "num_stages": 2,
        "num_warps": 2,
        "ms": 0.023508567363023758,
        "min_ms": 0.023508567363023758,
        "max_ms": 0.023508567363023758,
        "compile_time": 0.71034836769104
    },
    {
        "BLOCK_SIZE_M": 128,
        "BLOCK_SIZE_N": 64,
        "BLOCK_SIZE_K": 64,
        "GROUP_SIZE_M": 8,
        "num_stages": 6,
        "num_warps": 8,
        "ms": 0.023554302752017975,
        "min_ms": 0.023554302752017975,
        "max_ms": 0.023554302752017975,
        "compile_time": 1.462076187133789
    },
    {
        "BLOCK_SIZE_M": 64,
        "BLOCK_SIZE_N": 128,
        "BLOCK_SIZE_K": 128,
        "GROUP_SIZE_M": 8,
        "num_stages": 3,
        "num_warps": 8,
        "ms": 0.023593084886670113,
        "min_ms": 0.023593084886670113,
        "max_ms": 0.023593084886670113,
        "compile_time": 0.7206337451934814
    },
    {
        "BLOCK_SIZE_M": 64,
        "BLOCK_SIZE_N": 32,
        "BLOCK_SIZE_K": 32,
        "GROUP_SIZE_M": 8,
        "num_stages": 3,
        "num_warps": 4,
        "ms": 0.023632057011127472,
        "min_ms": 0.023632057011127472,
        "max_ms": 0.023632057011127472,
        "compile_time": 0.699460506439209
    },
    {
        "BLOCK_SIZE_M": 128,
        "BLOCK_SIZE_N": 32,
        "BLOCK_SIZE_K": 32,
        "GROUP_SIZE_M": 8,
        "num_stages": 6,
        "num_warps": 2,
        "ms": 0.02363711968064308,
        "min_ms": 0.02363711968064308,
        "max_ms": 0.02363711968064308,
        "compile_time": 1.651336908340454
    },
    {
        "BLOCK_SIZE_M": 32,
        "BLOCK_SIZE_N": 64,
        "BLOCK_SIZE_K": 64,
        "GROUP_SIZE_M": 8,
        "num_stages": 3,
        "num_warps": 4,
        "ms": 0.0236569382250309,
        "min_ms": 0.0236569382250309,
        "max_ms": 0.0236569382250309,
        "compile_time": 0.673598051071167
    },
    {
        "BLOCK_SIZE_M": 32,
        "BLOCK_SIZE_N": 64,
        "BLOCK_SIZE_K": 32,
        "GROUP_SIZE_M": 8,
        "num_stages": 4,
        "num_warps": 4,
        "ms": 0.023695748299360275,
        "min_ms": 0.023695748299360275,
        "max_ms": 0.023695748299360275,
        "compile_time": 0.664064884185791
    },
    {
        "BLOCK_SIZE_M": 64,
        "BLOCK_SIZE_N": 256,
        "BLOCK_SIZE_K": 16,
        "GROUP_SIZE_M": 8,
        "num_stages": 8,
        "num_warps": 4,
        "ms": 0.02369864657521248,
        "min_ms": 0.02369864657521248,
        "max_ms": 0.02369864657521248,
        "compile_time": 1.7911531925201416
    },
    {
        "BLOCK_SIZE_M": 64,
        "BLOCK_SIZE_N": 128,
        "BLOCK_SIZE_K": 64,
        "GROUP_SIZE_M": 8,
        "num_stages": 6,
        "num_warps": 8,
        "ms": 0.02371874824166298,
        "min_ms": 0.02371874824166298,
        "max_ms": 0.02371874824166298,
        "compile_time": 1.4046571254730225
    },
    {
        "BLOCK_SIZE_M": 64,
        "BLOCK_SIZE_N": 128,
        "BLOCK_SIZE_K": 64,
        "GROUP_SIZE_M": 8,
        "num_stages": 2,
        "num_warps": 8,
        "ms": 0.023737726733088493,
        "min_ms": 0.023737726733088493,
        "max_ms": 0.023737726733088493,
        "compile_time": 0.7201817035675049
    },
    {
        "BLOCK_SIZE_M": 128,
        "BLOCK_SIZE_N": 64,
        "BLOCK_SIZE_K": 128,
        "GROUP_SIZE_M": 8,
        "num_stages": 3,
        "num_warps": 8,
        "ms": 0.023747863247990608,
        "min_ms": 0.023747863247990608,
        "max_ms": 0.023747863247990608,
        "compile_time": 0.7495219707489014
    },
    {
        "BLOCK_SIZE_M": 128,
        "BLOCK_SIZE_N": 64,
        "BLOCK_SIZE_K": 32,
        "GROUP_SIZE_M": 8,
        "num_stages": 4,
        "num_warps": 8,
        "ms": 0.023754030466079712,
        "min_ms": 0.023754030466079712,
        "max_ms": 0.023754030466079712,
        "compile_time": 0.7463235855102539
    },
    {
        "BLOCK_SIZE_M": 64,
        "BLOCK_SIZE_N": 64,
        "BLOCK_SIZE_K": 16,
        "GROUP_SIZE_M": 8,
        "num_stages": 4,
        "num_warps": 4,
        "ms": 0.02375411055982113,
        "min_ms": 0.02375411055982113,
        "max_ms": 0.02375411055982113,
        "compile_time": 1.1955311298370361
    },
    {
        "BLOCK_SIZE_M": 32,
        "BLOCK_SIZE_N": 64,
        "BLOCK_SIZE_K": 32,
        "GROUP_SIZE_M": 8,
        "num_stages": 5,
        "num_warps": 2,
        "ms": 0.02375705912709236,
        "min_ms": 0.02375705912709236,
        "max_ms": 0.02375705912709236,
        "compile_time": 0.6493103504180908
    },
    {
        "BLOCK_SIZE_M": 64,
        "BLOCK_SIZE_N": 128,
        "BLOCK_SIZE_K": 32,
        "GROUP_SIZE_M": 8,
        "num_stages": 5,
        "num_warps": 8,
        "ms": 0.02379268780350685,
        "min_ms": 0.02379268780350685,
        "max_ms": 0.02379268780350685,
        "compile_time": 0.7594025135040283
    },
    {
        "BLOCK_SIZE_M": 128,
        "BLOCK_SIZE_N": 32,
        "BLOCK_SIZE_K": 32,
        "GROUP_SIZE_M": 8,
        "num_stages": 6,
        "num_warps": 4,
        "ms": 0.02379632368683815,
        "min_ms": 0.02379632368683815,
        "max_ms": 0.02379632368683815,
        "compile_time": 1.4128444194793701
    },
    {
        "BLOCK_SIZE_M": 32,
        "BLOCK_SIZE_N": 128,
        "BLOCK_SIZE_K": 64,
        "GROUP_SIZE_M": 8,
        "num_stages": 3,
        "num_warps": 8,
        "ms": 0.023801598697900772,
        "min_ms": 0.023801598697900772,
        "max_ms": 0.023801598697900772,
        "compile_time": 0.669705867767334
    },
    {
        "BLOCK_SIZE_M": 64,
        "BLOCK_SIZE_N": 32,
        "BLOCK_SIZE_K": 32,
        "GROUP_SIZE_M": 8,
        "num_stages": 5,
        "num_warps": 2,
        "ms": 0.02383587323129177,
        "min_ms": 0.02383587323129177,
        "max_ms": 0.02383587323129177,
        "compile_time": 0.7424209117889404
    },
    {
        "BLOCK_SIZE_M": 128,
        "BLOCK_SIZE_N": 64,
        "BLOCK_SIZE_K": 32,
        "GROUP_SIZE_M": 8,
        "num_stages": 5,
        "num_warps": 8,
        "ms": 0.02392120100557804,
        "min_ms": 0.02392120100557804,
        "max_ms": 0.02392120100557804,
        "compile_time": 0.7634866237640381
    },
    {
        "BLOCK_SIZE_M": 128,
        "BLOCK_SIZE_N": 64,
        "BLOCK_SIZE_K": 64,
        "GROUP_SIZE_M": 8,
        "num_stages": 7,
        "num_warps": 8,
        "ms": 0.02397516742348671,
        "min_ms": 0.02397516742348671,
        "max_ms": 0.02397516742348671,
        "compile_time": 1.5059449672698975
    },
    {
        "BLOCK_SIZE_M": 128,
        "BLOCK_SIZE_N": 64,
        "BLOCK_SIZE_K": 128,
        "GROUP_SIZE_M": 8,
        "num_stages": 4,
        "num_warps": 8,
        "ms": 0.023982977494597435,
        "min_ms": 0.023982977494597435,
        "max_ms": 0.023982977494597435,
        "compile_time": 0.7786083221435547
    },
    {
        "BLOCK_SIZE_M": 128,
        "BLOCK_SIZE_N": 32,
        "BLOCK_SIZE_K": 64,
        "GROUP_SIZE_M": 8,
        "num_stages": 3,
        "num_warps": 8,
        "ms": 0.02398400381207466,
        "min_ms": 0.02398400381207466,
        "max_ms": 0.02398400381207466,
        "compile_time": 0.7459251880645752
    },
    {
        "BLOCK_SIZE_M": 128,
        "BLOCK_SIZE_N": 128,
        "BLOCK_SIZE_K": 64,
        "GROUP_SIZE_M": 8,
        "num_stages": 2,
        "num_warps": 8,
        "ms": 0.02398526482284069,
        "min_ms": 0.02398526482284069,
        "max_ms": 0.02398526482284069,
        "compile_time": 0.7449369430541992
    },
    {
        "BLOCK_SIZE_M": 128,
        "BLOCK_SIZE_N": 128,
        "BLOCK_SIZE_K": 64,
        "GROUP_SIZE_M": 8,
        "num_stages": 2,
        "num_warps": 4,
        "ms": 0.023995012044906616,
        "min_ms": 0.023995012044906616,
        "max_ms": 0.023995012044906616,
        "compile_time": 0.7683990001678467
    },
    {
        "BLOCK_SIZE_M": 64,
        "BLOCK_SIZE_N": 64,
        "BLOCK_SIZE_K": 64,
        "GROUP_SIZE_M": 8,
        "num_stages": 6,
        "num_warps": 8,
        "ms": 0.024001920595765114,
        "min_ms": 0.024001920595765114,
        "max_ms": 0.024001920595765114,
        "compile_time": 1.2625479698181152
    },
    {
        "BLOCK_SIZE_M": 64,
        "BLOCK_SIZE_N": 128,
        "BLOCK_SIZE_K": 32,
        "GROUP_SIZE_M": 8,
        "num_stages": 6,
        "num_warps": 8,
        "ms": 0.02401246689260006,
        "min_ms": 0.02401246689260006,
        "max_ms": 0.02401246689260006,
        "compile_time": 1.2667262554168701
    },
    {
        "BLOCK_SIZE_M": 64,
        "BLOCK_SIZE_N": 64,
        "BLOCK_SIZE_K": 32,
        "GROUP_SIZE_M": 8,
        "num_stages": 3,
        "num_warps": 8,
        "ms": 0.024025484919548035,
        "min_ms": 0.024025484919548035,
        "max_ms": 0.024025484919548035,
        "compile_time": 0.726895809173584
    },
    {
        "BLOCK_SIZE_M": 128,
        "BLOCK_SIZE_N": 128,
        "BLOCK_SIZE_K": 128,
        "GROUP_SIZE_M": 8,
        "num_stages": 2,
        "num_warps": 8,
        "ms": 0.024045100435614586,
        "min_ms": 0.024045100435614586,
        "max_ms": 0.024045100435614586,
        "compile_time": 0.6720290184020996
    },
    {
        "BLOCK_SIZE_M": 32,
        "BLOCK_SIZE_N": 64,
        "BLOCK_SIZE_K": 32,
        "GROUP_SIZE_M": 8,
        "num_stages": 6,
        "num_warps": 2,
        "ms": 0.02406640350818634,
        "min_ms": 0.02406640350818634,
        "max_ms": 0.02406640350818634,
        "compile_time": 1.2475104331970215
    },
    {
        "BLOCK_SIZE_M": 128,
        "BLOCK_SIZE_N": 64,
        "BLOCK_SIZE_K": 32,
        "GROUP_SIZE_M": 8,
        "num_stages": 6,
        "num_warps": 8,
        "ms": 0.02409471943974495,
        "min_ms": 0.02409471943974495,
        "max_ms": 0.02409471943974495,
        "compile_time": 1.3331518173217773
    },
    {
        "BLOCK_SIZE_M": 128,
        "BLOCK_SIZE_N": 32,
        "BLOCK_SIZE_K": 64,
        "GROUP_SIZE_M": 8,
        "num_stages": 2,
        "num_warps": 2,
        "ms": 0.02420244738459587,
        "min_ms": 0.02420244738459587,
        "max_ms": 0.02420244738459587,
        "compile_time": 0.6557056903839111
    },
    {
        "BLOCK_SIZE_M": 32,
        "BLOCK_SIZE_N": 128,
        "BLOCK_SIZE_K": 64,
        "GROUP_SIZE_M": 8,
        "num_stages": 2,
        "num_warps": 4,
        "ms": 0.024205924943089485,
        "min_ms": 0.024205924943089485,
        "max_ms": 0.024205924943089485,
        "compile_time": 0.6842224597930908
    },
    {
        "BLOCK_SIZE_M": 64,
        "BLOCK_SIZE_N": 64,
        "BLOCK_SIZE_K": 16,
        "GROUP_SIZE_M": 8,
        "num_stages": 6,
        "num_warps": 4,
        "ms": 0.024226296693086624,
        "min_ms": 0.024226296693086624,
        "max_ms": 0.024226296693086624,
        "compile_time": 1.2073674201965332
    },
    {
        "BLOCK_SIZE_M": 128,
        "BLOCK_SIZE_N": 128,
        "BLOCK_SIZE_K": 32,
        "GROUP_SIZE_M": 8,
        "num_stages": 5,
        "num_warps": 16,
        "ms": 0.024235008284449577,
        "min_ms": 0.024235008284449577,
        "max_ms": 0.024235008284449577,
        "compile_time": 0.7579717636108398
    },
    {
        "BLOCK_SIZE_M": 128,
        "BLOCK_SIZE_N": 128,
        "BLOCK_SIZE_K": 32,
        "GROUP_SIZE_M": 8,
        "num_stages": 3,
        "num_warps": 16,
        "ms": 0.024243583902716637,
        "min_ms": 0.024243583902716637,
        "max_ms": 0.024243583902716637,
        "compile_time": 0.7514581680297852
    },
    {
        "BLOCK_SIZE_M": 64,
        "BLOCK_SIZE_N": 32,
        "BLOCK_SIZE_K": 32,
        "GROUP_SIZE_M": 8,
        "num_stages": 4,
        "num_warps": 4,
        "ms": 0.024267952889204025,
        "min_ms": 0.024267952889204025,
        "max_ms": 0.024267952889204025,
        "compile_time": 0.6985828876495361
    },
    {
        "BLOCK_SIZE_M": 64,
        "BLOCK_SIZE_N": 32,
        "BLOCK_SIZE_K": 64,
        "GROUP_SIZE_M": 8,
        "num_stages": 3,
        "num_warps": 4,
        "ms": 0.024268414825201035,
        "min_ms": 0.024268414825201035,
        "max_ms": 0.024268414825201035,
        "compile_time": 0.702716588973999
    },
    {
        "BLOCK_SIZE_M": 32,
        "BLOCK_SIZE_N": 64,
        "BLOCK_SIZE_K": 32,
        "GROUP_SIZE_M": 8,
        "num_stages": 5,
        "num_warps": 4,
        "ms": 0.024334996938705444,
        "min_ms": 0.024334996938705444,
        "max_ms": 0.024334996938705444,
        "compile_time": 0.6512138843536377
    },
    {
        "BLOCK_SIZE_M": 128,
        "BLOCK_SIZE_N": 128,
        "BLOCK_SIZE_K": 32,
        "GROUP_SIZE_M": 8,
        "num_stages": 4,
        "num_warps": 16,
        "ms": 0.0243424903601408,
        "min_ms": 0.0243424903601408,
        "max_ms": 0.0243424903601408,
        "compile_time": 0.7703680992126465
    },
    {
        "BLOCK_SIZE_M": 256,
        "BLOCK_SIZE_N": 32,
        "BLOCK_SIZE_K": 64,
        "GROUP_SIZE_M": 8,
        "num_stages": 2,
        "num_warps": 4,
        "ms": 0.0243539996445179,
        "min_ms": 0.0243539996445179,
        "max_ms": 0.0243539996445179,
        "compile_time": 0.7981328964233398
    },
    {
        "BLOCK_SIZE_M": 32,
        "BLOCK_SIZE_N": 128,
        "BLOCK_SIZE_K": 128,
        "GROUP_SIZE_M": 8,
        "num_stages": 2,
        "num_warps": 4,
        "ms": 0.024356666952371597,
        "min_ms": 0.024356666952371597,
        "max_ms": 0.024356666952371597,
        "compile_time": 0.6664426326751709
    },
    {
        "BLOCK_SIZE_M": 64,
        "BLOCK_SIZE_N": 64,
        "BLOCK_SIZE_K": 128,
        "GROUP_SIZE_M": 8,
        "num_stages": 3,
        "num_warps": 2,
        "ms": 0.024378350004553795,
        "min_ms": 0.024378350004553795,
        "max_ms": 0.024378350004553795,
        "compile_time": 0.7025349140167236
    },
    {
        "BLOCK_SIZE_M": 32,
        "BLOCK_SIZE_N": 512,
        "BLOCK_SIZE_K": 32,
        "GROUP_SIZE_M": 8,
        "num_stages": 3,
        "num_warps": 8,
        "ms": 0.024386176839470863,
        "min_ms": 0.024386176839470863,
        "max_ms": 0.024386176839470863,
        "compile_time": 1.4831984043121338
    },
    {
        "BLOCK_SIZE_M": 128,
        "BLOCK_SIZE_N": 64,
        "BLOCK_SIZE_K": 32,
        "GROUP_SIZE_M": 8,
        "num_stages": 7,
        "num_warps": 8,
        "ms": 0.0244273841381073,
        "min_ms": 0.0244273841381073,
        "max_ms": 0.0244273841381073,
        "compile_time": 1.3391008377075195
    },
    {
        "BLOCK_SIZE_M": 64,
        "BLOCK_SIZE_N": 128,
        "BLOCK_SIZE_K": 128,
        "GROUP_SIZE_M": 8,
        "num_stages": 4,
        "num_warps": 8,
        "ms": 0.02444390393793583,
        "min_ms": 0.02444390393793583,
        "max_ms": 0.02444390393793583,
        "compile_time": 0.7198376655578613
    },
    {
        "BLOCK_SIZE_M": 256,
        "BLOCK_SIZE_N": 32,
        "BLOCK_SIZE_K": 64,
        "GROUP_SIZE_M": 8,
        "num_stages": 3,
        "num_warps": 8,
        "ms": 0.024448487907648087,
        "min_ms": 0.024448487907648087,
        "max_ms": 0.024448487907648087,
        "compile_time": 0.7913181781768799
    },
    {
        "BLOCK_SIZE_M": 64,
        "BLOCK_SIZE_N": 32,
        "BLOCK_SIZE_K": 32,
        "GROUP_SIZE_M": 8,
        "num_stages": 6,
        "num_warps": 2,
        "ms": 0.024450741708278656,
        "min_ms": 0.024450741708278656,
        "max_ms": 0.024450741708278656,
        "compile_time": 1.3808348178863525
    },
    {
        "BLOCK_SIZE_M": 32,
        "BLOCK_SIZE_N": 256,
        "BLOCK_SIZE_K": 64,
        "GROUP_SIZE_M": 8,
        "num_stages": 3,
        "num_warps": 8,
        "ms": 0.024454202502965927,
        "min_ms": 0.024454202502965927,
        "max_ms": 0.024454202502965927,
        "compile_time": 0.7692379951477051
    },
    {
        "BLOCK_SIZE_M": 64,
        "BLOCK_SIZE_N": 64,
        "BLOCK_SIZE_K": 32,
        "GROUP_SIZE_M": 8,
        "num_stages": 4,
        "num_warps": 8,
        "ms": 0.024481022730469704,
        "min_ms": 0.024481022730469704,
        "max_ms": 0.024481022730469704,
        "compile_time": 0.707721471786499
    },
    {
        "BLOCK_SIZE_M": 128,
        "BLOCK_SIZE_N": 64,
        "BLOCK_SIZE_K": 32,
        "GROUP_SIZE_M": 8,
        "num_stages": 2,
        "num_warps": 8,
        "ms": 0.024509182199835777,
        "min_ms": 0.024509182199835777,
        "max_ms": 0.024509182199835777,
        "compile_time": 0.751105546951294
    },
    {
        "BLOCK_SIZE_M": 128,
        "BLOCK_SIZE_N": 128,
        "BLOCK_SIZE_K": 32,
        "GROUP_SIZE_M": 8,
        "num_stages": 6,
        "num_warps": 16,
        "ms": 0.02454349771142006,
        "min_ms": 0.02454349771142006,
        "max_ms": 0.02454349771142006,
        "compile_time": 1.3626434803009033
    },
    {
        "BLOCK_SIZE_M": 128,
        "BLOCK_SIZE_N": 32,
        "BLOCK_SIZE_K": 128,
        "GROUP_SIZE_M": 8,
        "num_stages": 2,
        "num_warps": 4,
        "ms": 0.024633759632706642,
        "min_ms": 0.024633759632706642,
        "max_ms": 0.024633759632706642,
        "compile_time": 0.7102758884429932
    },
    {
        "BLOCK_SIZE_M": 64,
        "BLOCK_SIZE_N": 128,
        "BLOCK_SIZE_K": 32,
        "GROUP_SIZE_M": 8,
        "num_stages": 7,
        "num_warps": 8,
        "ms": 0.024649888277053833,
        "min_ms": 0.024649888277053833,
        "max_ms": 0.024649888277053833,
        "compile_time": 1.323695182800293
    },
    {
        "BLOCK_SIZE_M": 32,
        "BLOCK_SIZE_N": 128,
        "BLOCK_SIZE_K": 64,
        "GROUP_SIZE_M": 8,
        "num_stages": 4,
        "num_warps": 8,
        "ms": 0.024673644453287125,
        "min_ms": 0.024673644453287125,
        "max_ms": 0.024673644453287125,
        "compile_time": 0.6836502552032471
    },
    {
        "BLOCK_SIZE_M": 64,
        "BLOCK_SIZE_N": 64,
        "BLOCK_SIZE_K": 128,
        "GROUP_SIZE_M": 8,
        "num_stages": 6,
        "num_warps": 4,
        "ms": 0.02468104287981987,
        "min_ms": 0.02468104287981987,
        "max_ms": 0.02468104287981987,
        "compile_time": 1.6793925762176514
    },
    {
        "BLOCK_SIZE_M": 64,
        "BLOCK_SIZE_N": 64,
        "BLOCK_SIZE_K": 16,
        "GROUP_SIZE_M": 8,
        "num_stages": 7,
        "num_warps": 4,
        "ms": 0.024709846824407578,
        "min_ms": 0.024709846824407578,
        "max_ms": 0.024709846824407578,
        "compile_time": 1.2534334659576416
    },
    {
        "BLOCK_SIZE_M": 128,
        "BLOCK_SIZE_N": 32,
        "BLOCK_SIZE_K": 64,
        "GROUP_SIZE_M": 8,
        "num_stages": 2,
        "num_warps": 4,
        "ms": 0.024712245911359787,
        "min_ms": 0.024712245911359787,
        "max_ms": 0.024712245911359787,
        "compile_time": 0.7647225856781006
    },
    {
        "BLOCK_SIZE_M": 32,
        "BLOCK_SIZE_N": 64,
        "BLOCK_SIZE_K": 32,
        "GROUP_SIZE_M": 8,
        "num_stages": 6,
        "num_warps": 4,
        "ms": 0.024720076471567154,
        "min_ms": 0.024720076471567154,
        "max_ms": 0.024720076471567154,
        "compile_time": 1.1379508972167969
    },
    {
        "BLOCK_SIZE_M": 64,
        "BLOCK_SIZE_N": 128,
        "BLOCK_SIZE_K": 64,
        "GROUP_SIZE_M": 8,
        "num_stages": 7,
        "num_warps": 8,
        "ms": 0.024729305878281593,
        "min_ms": 0.024729305878281593,
        "max_ms": 0.024729305878281593,
        "compile_time": 1.4441475868225098
    },
    {
        "BLOCK_SIZE_M": 64,
        "BLOCK_SIZE_N": 64,
        "BLOCK_SIZE_K": 64,
        "GROUP_SIZE_M": 8,
        "num_stages": 2,
        "num_warps": 8,
        "ms": 0.024743275716900826,
        "min_ms": 0.024743275716900826,
        "max_ms": 0.024743275716900826,
        "compile_time": 0.700545072555542
    },
    {
        "BLOCK_SIZE_M": 64,
        "BLOCK_SIZE_N": 64,
        "BLOCK_SIZE_K": 32,
        "GROUP_SIZE_M": 8,
        "num_stages": 5,
        "num_warps": 8,
        "ms": 0.024746814742684364,
        "min_ms": 0.024746814742684364,
        "max_ms": 0.024746814742684364,
        "compile_time": 0.7200067043304443
    },
    {
        "BLOCK_SIZE_M": 64,
        "BLOCK_SIZE_N": 64,
        "BLOCK_SIZE_K": 128,
        "GROUP_SIZE_M": 8,
        "num_stages": 1,
        "num_warps": 4,
        "ms": 0.02477196604013443,
        "min_ms": 0.02477196604013443,
        "max_ms": 0.02477196604013443,
        "compile_time": 0.7163190841674805
    },
    {
        "BLOCK_SIZE_M": 32,
        "BLOCK_SIZE_N": 128,
        "BLOCK_SIZE_K": 16,
        "GROUP_SIZE_M": 8,
        "num_stages": 5,
        "num_warps": 2,
        "ms": 0.024775754660367966,
        "min_ms": 0.024775754660367966,
        "max_ms": 0.024775754660367966,
        "compile_time": 1.2664146423339844
    },
    {
        "BLOCK_SIZE_M": 64,
        "BLOCK_SIZE_N": 32,
        "BLOCK_SIZE_K": 32,
        "GROUP_SIZE_M": 8,
        "num_stages": 5,
        "num_warps": 4,
        "ms": 0.02477840706706047,
        "min_ms": 0.02477840706706047,
        "max_ms": 0.02477840706706047,
        "compile_time": 0.7256290912628174
    },
    {
        "BLOCK_SIZE_M": 32,
        "BLOCK_SIZE_N": 128,
        "BLOCK_SIZE_K": 16,
        "GROUP_SIZE_M": 8,
        "num_stages": 4,
        "num_warps": 2,
        "ms": 0.024834707379341125,
        "min_ms": 0.024834707379341125,
        "max_ms": 0.024834707379341125,
        "compile_time": 1.2669522762298584
    },
    {
        "BLOCK_SIZE_M": 64,
        "BLOCK_SIZE_N": 64,
        "BLOCK_SIZE_K": 16,
        "GROUP_SIZE_M": 8,
        "num_stages": 8,
        "num_warps": 4,
        "ms": 0.024876505136489868,
        "min_ms": 0.024876505136489868,
        "max_ms": 0.024876505136489868,
        "compile_time": 1.2868928909301758
    },
    {
        "BLOCK_SIZE_M": 64,
        "BLOCK_SIZE_N": 32,
        "BLOCK_SIZE_K": 64,
        "GROUP_SIZE_M": 8,
        "num_stages": 2,
        "num_warps": 2,
        "ms": 0.024899909272789955,
        "min_ms": 0.024899909272789955,
        "max_ms": 0.024899909272789955,
        "compile_time": 0.7058601379394531
    },
    {
        "BLOCK_SIZE_M": 128,
        "BLOCK_SIZE_N": 128,
        "BLOCK_SIZE_K": 32,
        "GROUP_SIZE_M": 8,
        "num_stages": 2,
        "num_warps": 4,
        "ms": 0.02493424154818058,
        "min_ms": 0.02493424154818058,
        "max_ms": 0.02493424154818058,
        "compile_time": 0.774430513381958
    },
    {
        "BLOCK_SIZE_M": 256,
        "BLOCK_SIZE_N": 32,
        "BLOCK_SIZE_K": 32,
        "GROUP_SIZE_M": 8,
        "num_stages": 4,
        "num_warps": 4,
        "ms": 0.024980271235108376,
        "min_ms": 0.024980271235108376,
        "max_ms": 0.024980271235108376,
        "compile_time": 0.7893381118774414
    },
    {
        "BLOCK_SIZE_M": 128,
        "BLOCK_SIZE_N": 128,
        "BLOCK_SIZE_K": 32,
        "GROUP_SIZE_M": 8,
        "num_stages": 7,
        "num_warps": 16,
        "ms": 0.024990413337945938,
        "min_ms": 0.024990413337945938,
        "max_ms": 0.024990413337945938,
        "compile_time": 1.3870677947998047
    },
    {
        "BLOCK_SIZE_M": 64,
        "BLOCK_SIZE_N": 64,
        "BLOCK_SIZE_K": 16,
        "GROUP_SIZE_M": 8,
        "num_stages": 4,
        "num_warps": 2,
        "ms": 0.025054175406694412,
        "min_ms": 0.025054175406694412,
        "max_ms": 0.025054175406694412,
        "compile_time": 1.3505401611328125
    },
    {
        "BLOCK_SIZE_M": 64,
        "BLOCK_SIZE_N": 32,
        "BLOCK_SIZE_K": 64,
        "GROUP_SIZE_M": 8,
        "num_stages": 5,
        "num_warps": 4,
        "ms": 0.02505972422659397,
        "min_ms": 0.02505972422659397,
        "max_ms": 0.02505972422659397,
        "compile_time": 0.6997230052947998
    },
    {
        "BLOCK_SIZE_M": 64,
        "BLOCK_SIZE_N": 32,
        "BLOCK_SIZE_K": 32,
        "GROUP_SIZE_M": 8,
        "num_stages": 2,
        "num_warps": 4,
        "ms": 0.025066997855901718,
        "min_ms": 0.025066997855901718,
        "max_ms": 0.025066997855901718,
        "compile_time": 0.7181267738342285
    },
    {
        "BLOCK_SIZE_M": 128,
        "BLOCK_SIZE_N": 128,
        "BLOCK_SIZE_K": 32,
        "GROUP_SIZE_M": 8,
        "num_stages": 8,
        "num_warps": 16,
        "ms": 0.025074411183595657,
        "min_ms": 0.025074411183595657,
        "max_ms": 0.025074411183595657,
        "compile_time": 1.4003779888153076
    },
    {
        "BLOCK_SIZE_M": 64,
        "BLOCK_SIZE_N": 64,
        "BLOCK_SIZE_K": 256,
        "GROUP_SIZE_M": 8,
        "num_stages": 3,
        "num_warps": 4,
        "ms": 0.025089319795370102,
        "min_ms": 0.025089319795370102,
        "max_ms": 0.025089319795370102,
        "compile_time": 0.7311489582061768
    },
    {
        "BLOCK_SIZE_M": 32,
        "BLOCK_SIZE_N": 128,
        "BLOCK_SIZE_K": 64,
        "GROUP_SIZE_M": 8,
        "num_stages": 2,
        "num_warps": 2,
        "ms": 0.025103744119405746,
        "min_ms": 0.025103744119405746,
        "max_ms": 0.025103744119405746,
        "compile_time": 0.692171573638916
    },
    {
        "BLOCK_SIZE_M": 32,
        "BLOCK_SIZE_N": 128,
        "BLOCK_SIZE_K": 64,
        "GROUP_SIZE_M": 8,
        "num_stages": 6,
        "num_warps": 4,
        "ms": 0.02510606311261654,
        "min_ms": 0.02510606311261654,
        "max_ms": 0.02510606311261654,
        "compile_time": 1.4721996784210205
    },
    {
        "BLOCK_SIZE_M": 64,
        "BLOCK_SIZE_N": 64,
        "BLOCK_SIZE_K": 32,
        "GROUP_SIZE_M": 8,
        "num_stages": 6,
        "num_warps": 8,
        "ms": 0.0251169353723526,
        "min_ms": 0.0251169353723526,
        "max_ms": 0.0251169353723526,
        "compile_time": 1.2056927680969238
    },
    {
        "BLOCK_SIZE_M": 512,
        "BLOCK_SIZE_N": 32,
        "BLOCK_SIZE_K": 64,
        "GROUP_SIZE_M": 8,
        "num_stages": 3,
        "num_warps": 16,
        "ms": 0.0251317135989666,
        "min_ms": 0.0251317135989666,
        "max_ms": 0.0251317135989666,
        "compile_time": 1.656743049621582
    },
    {
        "BLOCK_SIZE_M": 64,
        "BLOCK_SIZE_N": 32,
        "BLOCK_SIZE_K": 64,
        "GROUP_SIZE_M": 8,
        "num_stages": 2,
        "num_warps": 4,
        "ms": 0.02514624036848545,
        "min_ms": 0.02514624036848545,
        "max_ms": 0.02514624036848545,
        "compile_time": 0.7168455123901367
    },
    {
        "BLOCK_SIZE_M": 64,
        "BLOCK_SIZE_N": 64,
        "BLOCK_SIZE_K": 16,
        "GROUP_SIZE_M": 8,
        "num_stages": 3,
        "num_warps": 2,
        "ms": 0.025186240673065186,
        "min_ms": 0.025186240673065186,
        "max_ms": 0.025186240673065186,
        "compile_time": 1.3251934051513672
    },
    {
        "BLOCK_SIZE_M": 32,
        "BLOCK_SIZE_N": 128,
        "BLOCK_SIZE_K": 128,
        "GROUP_SIZE_M": 8,
        "num_stages": 3,
        "num_warps": 8,
        "ms": 0.02519429847598076,
        "min_ms": 0.02519429847598076,
        "max_ms": 0.02519429847598076,
        "compile_time": 0.6891815662384033
    },
    {
        "BLOCK_SIZE_M": 32,
        "BLOCK_SIZE_N": 64,
        "BLOCK_SIZE_K": 64,
        "GROUP_SIZE_M": 8,
        "num_stages": 2,
        "num_warps": 2,
        "ms": 0.025197524577379227,
        "min_ms": 0.025197524577379227,
        "max_ms": 0.025197524577379227,
        "compile_time": 0.5853617191314697
    },
    {
        "BLOCK_SIZE_M": 64,
        "BLOCK_SIZE_N": 64,
        "BLOCK_SIZE_K": 32,
        "GROUP_SIZE_M": 8,
        "num_stages": 8,
        "num_warps": 4,
        "ms": 0.025215372443199158,
        "min_ms": 0.025215372443199158,
        "max_ms": 0.025215372443199158,
        "compile_time": 1.3166735172271729
    },
    {
        "BLOCK_SIZE_M": 128,
        "BLOCK_SIZE_N": 32,
        "BLOCK_SIZE_K": 64,
        "GROUP_SIZE_M": 8,
        "num_stages": 4,
        "num_warps": 8,
        "ms": 0.025272056460380554,
        "min_ms": 0.025272056460380554,
        "max_ms": 0.025272056460380554,
        "compile_time": 0.7438559532165527
    },
    {
        "BLOCK_SIZE_M": 64,
        "BLOCK_SIZE_N": 64,
        "BLOCK_SIZE_K": 16,
        "GROUP_SIZE_M": 8,
        "num_stages": 5,
        "num_warps": 2,
        "ms": 0.02528548240661621,
        "min_ms": 0.02528548240661621,
        "max_ms": 0.02528548240661621,
        "compile_time": 1.3450374603271484
    },
    {
        "BLOCK_SIZE_M": 32,
        "BLOCK_SIZE_N": 64,
        "BLOCK_SIZE_K": 16,
        "GROUP_SIZE_M": 8,
        "num_stages": 5,
        "num_warps": 2,
        "ms": 0.02529165707528591,
        "min_ms": 0.02529165707528591,
        "max_ms": 0.02529165707528591,
        "compile_time": 1.13895583152771
    },
    {
        "BLOCK_SIZE_M": 128,
        "BLOCK_SIZE_N": 32,
        "BLOCK_SIZE_K": 32,
        "GROUP_SIZE_M": 8,
        "num_stages": 2,
        "num_warps": 4,
        "ms": 0.025354240089654922,
        "min_ms": 0.025354240089654922,
        "max_ms": 0.025354240089654922,
        "compile_time": 0.7595527172088623
    },
    {
        "BLOCK_SIZE_M": 64,
        "BLOCK_SIZE_N": 32,
        "BLOCK_SIZE_K": 128,
        "GROUP_SIZE_M": 8,
        "num_stages": 3,
        "num_warps": 4,
        "ms": 0.025358140468597412,
        "min_ms": 0.025358140468597412,
        "max_ms": 0.025358140468597412,
        "compile_time": 0.7214093208312988
    },
    {
        "BLOCK_SIZE_M": 64,
        "BLOCK_SIZE_N": 32,
        "BLOCK_SIZE_K": 32,
        "GROUP_SIZE_M": 8,
        "num_stages": 6,
        "num_warps": 4,
        "ms": 0.025391926988959312,
        "min_ms": 0.025391926988959312,
        "max_ms": 0.025391926988959312,
        "compile_time": 1.2769172191619873
    },
    {
        "BLOCK_SIZE_M": 64,
        "BLOCK_SIZE_N": 128,
        "BLOCK_SIZE_K": 32,
        "GROUP_SIZE_M": 8,
        "num_stages": 8,
        "num_warps": 8,
        "ms": 0.025408098474144936,
        "min_ms": 0.025408098474144936,
        "max_ms": 0.025408098474144936,
        "compile_time": 1.1458196640014648
    },
    {
        "BLOCK_SIZE_M": 64,
        "BLOCK_SIZE_N": 64,
        "BLOCK_SIZE_K": 16,
        "GROUP_SIZE_M": 8,
        "num_stages": 8,
        "num_warps": 2,
        "ms": 0.02541845478117466,
        "min_ms": 0.02541845478117466,
        "max_ms": 0.02541845478117466,
        "compile_time": 1.4172029495239258
    },
    {
        "BLOCK_SIZE_M": 128,
        "BLOCK_SIZE_N": 32,
        "BLOCK_SIZE_K": 64,
        "GROUP_SIZE_M": 8,
        "num_stages": 6,
        "num_warps": 4,
        "ms": 0.025450825691223145,
        "min_ms": 0.025450825691223145,
        "max_ms": 0.025450825691223145,
        "compile_time": 1.6297016143798828
    },
    {
        "BLOCK_SIZE_M": 64,
        "BLOCK_SIZE_N": 64,
        "BLOCK_SIZE_K": 64,
        "GROUP_SIZE_M": 8,
        "num_stages": 1,
        "num_warps": 4,
        "ms": 0.025455614551901817,
        "min_ms": 0.025455614551901817,
        "max_ms": 0.025455614551901817,
        "compile_time": 0.7266733646392822
    },
    {
        "BLOCK_SIZE_M": 64,
        "BLOCK_SIZE_N": 64,
        "BLOCK_SIZE_K": 16,
        "GROUP_SIZE_M": 8,
        "num_stages": 6,
        "num_warps": 2,
        "ms": 0.025458618998527527,
        "min_ms": 0.025458618998527527,
        "max_ms": 0.025458618998527527,
        "compile_time": 1.3445110321044922
    },
    {
        "BLOCK_SIZE_M": 32,
        "BLOCK_SIZE_N": 64,
        "BLOCK_SIZE_K": 32,
        "GROUP_SIZE_M": 8,
        "num_stages": 7,
        "num_warps": 4,
        "ms": 0.025461923331022263,
        "min_ms": 0.025461923331022263,
        "max_ms": 0.025461923331022263,
        "compile_time": 1.1476564407348633
    },
    {
        "BLOCK_SIZE_M": 64,
        "BLOCK_SIZE_N": 32,
        "BLOCK_SIZE_K": 32,
        "GROUP_SIZE_M": 8,
        "num_stages": 3,
        "num_warps": 2,
        "ms": 0.025468017905950546,
        "min_ms": 0.025468017905950546,
        "max_ms": 0.025468017905950546,
        "compile_time": 0.7138340473175049
    },
    {
        "BLOCK_SIZE_M": 32,
        "BLOCK_SIZE_N": 512,
        "BLOCK_SIZE_K": 64,
        "GROUP_SIZE_M": 8,
        "num_stages": 3,
        "num_warps": 16,
        "ms": 0.025471076369285583,
        "min_ms": 0.025471076369285583,
        "max_ms": 0.025471076369285583,
        "compile_time": 1.4081027507781982
    },
    {
        "BLOCK_SIZE_M": 32,
        "BLOCK_SIZE_N": 64,
        "BLOCK_SIZE_K": 64,
        "GROUP_SIZE_M": 8,
        "num_stages": 2,
        "num_warps": 4,
        "ms": 0.025478100404143333,
        "min_ms": 0.025478100404143333,
        "max_ms": 0.025478100404143333,
        "compile_time": 0.6568605899810791
    },
    {
        "BLOCK_SIZE_M": 32,
        "BLOCK_SIZE_N": 128,
        "BLOCK_SIZE_K": 16,
        "GROUP_SIZE_M": 8,
        "num_stages": 6,
        "num_warps": 2,
        "ms": 0.025499487295746803,
        "min_ms": 0.025499487295746803,
        "max_ms": 0.025499487295746803,
        "compile_time": 1.307922124862671
    },
    {
        "BLOCK_SIZE_M": 128,
        "BLOCK_SIZE_N": 32,
        "BLOCK_SIZE_K": 128,
        "GROUP_SIZE_M": 8,
        "num_stages": 2,
        "num_warps": 2,
        "ms": 0.025510424748063087,
        "min_ms": 0.025510424748063087,
        "max_ms": 0.025510424748063087,
        "compile_time": 0.7480840682983398
    },
    {
        "BLOCK_SIZE_M": 256,
        "BLOCK_SIZE_N": 64,
        "BLOCK_SIZE_K": 64,
        "GROUP_SIZE_M": 8,
        "num_stages": 2,
        "num_warps": 8,
        "ms": 0.025511037558317184,
        "min_ms": 0.025511037558317184,
        "max_ms": 0.025511037558317184,
        "compile_time": 0.8098430633544922
    },
    {
        "BLOCK_SIZE_M": 256,
        "BLOCK_SIZE_N": 32,
        "BLOCK_SIZE_K": 32,
        "GROUP_SIZE_M": 8,
        "num_stages": 3,
        "num_warps": 4,
        "ms": 0.0255350973457098,
        "min_ms": 0.0255350973457098,
        "max_ms": 0.0255350973457098,
        "compile_time": 0.7732994556427002
    },
    {
        "BLOCK_SIZE_M": 64,
        "BLOCK_SIZE_N": 64,
        "BLOCK_SIZE_K": 16,
        "GROUP_SIZE_M": 8,
        "num_stages": 3,
        "num_warps": 4,
        "ms": 0.02554369531571865,
        "min_ms": 0.02554369531571865,
        "max_ms": 0.02554369531571865,
        "compile_time": 1.212928056716919
    },
    {
        "BLOCK_SIZE_M": 64,
        "BLOCK_SIZE_N": 64,
        "BLOCK_SIZE_K": 64,
        "GROUP_SIZE_M": 8,
        "num_stages": 7,
        "num_warps": 8,
        "ms": 0.02562618814408779,
        "min_ms": 0.02562618814408779,
        "max_ms": 0.02562618814408779,
        "compile_time": 1.2884747982025146
    },
    {
        "BLOCK_SIZE_M": 64,
        "BLOCK_SIZE_N": 64,
        "BLOCK_SIZE_K": 32,
        "GROUP_SIZE_M": 8,
        "num_stages": 7,
        "num_warps": 8,
        "ms": 0.025637393817305565,
        "min_ms": 0.025637393817305565,
        "max_ms": 0.025637393817305565,
        "compile_time": 1.2207896709442139
    },
    {
        "BLOCK_SIZE_M": 64,
        "BLOCK_SIZE_N": 64,
        "BLOCK_SIZE_K": 16,
        "GROUP_SIZE_M": 8,
        "num_stages": 5,
        "num_warps": 4,
        "ms": 0.025654654949903488,
        "min_ms": 0.025654654949903488,
        "max_ms": 0.025654654949903488,
        "compile_time": 1.221914529800415
    },
    {
        "BLOCK_SIZE_M": 64,
        "BLOCK_SIZE_N": 32,
        "BLOCK_SIZE_K": 32,
        "GROUP_SIZE_M": 8,
        "num_stages": 7,
        "num_warps": 4,
        "ms": 0.025670161470770836,
        "min_ms": 0.025670161470770836,
        "max_ms": 0.025670161470770836,
        "compile_time": 1.2750895023345947
    },
    {
        "BLOCK_SIZE_M": 32,
        "BLOCK_SIZE_N": 128,
        "BLOCK_SIZE_K": 16,
        "GROUP_SIZE_M": 8,
        "num_stages": 3,
        "num_warps": 2,
        "ms": 0.02567092515528202,
        "min_ms": 0.02567092515528202,
        "max_ms": 0.02567092515528202,
        "compile_time": 1.0948615074157715
    },
    {
        "BLOCK_SIZE_M": 32,
        "BLOCK_SIZE_N": 64,
        "BLOCK_SIZE_K": 16,
        "GROUP_SIZE_M": 8,
        "num_stages": 6,
        "num_warps": 2,
        "ms": 0.0256875641644001,
        "min_ms": 0.0256875641644001,
        "max_ms": 0.0256875641644001,
        "compile_time": 1.1583003997802734
    },
    {
        "BLOCK_SIZE_M": 32,
        "BLOCK_SIZE_N": 128,
        "BLOCK_SIZE_K": 64,
        "GROUP_SIZE_M": 8,
        "num_stages": 5,
        "num_warps": 8,
        "ms": 0.02571929432451725,
        "min_ms": 0.02571929432451725,
        "max_ms": 0.02571929432451725,
        "compile_time": 0.7016208171844482
    },
    {
        "BLOCK_SIZE_M": 32,
        "BLOCK_SIZE_N": 128,
        "BLOCK_SIZE_K": 64,
        "GROUP_SIZE_M": 8,
        "num_stages": 7,
        "num_warps": 4,
        "ms": 0.025752609595656395,
        "min_ms": 0.025752609595656395,
        "max_ms": 0.025752609595656395,
        "compile_time": 1.508934736251831
    },
    {
        "BLOCK_SIZE_M": 32,
        "BLOCK_SIZE_N": 128,
        "BLOCK_SIZE_K": 16,
        "GROUP_SIZE_M": 8,
        "num_stages": 7,
        "num_warps": 2,
        "ms": 0.025754636153578758,
        "min_ms": 0.025754636153578758,
        "max_ms": 0.025754636153578758,
        "compile_time": 1.1421465873718262
    },
    {
        "BLOCK_SIZE_M": 64,
        "BLOCK_SIZE_N": 128,
        "BLOCK_SIZE_K": 32,
        "GROUP_SIZE_M": 8,
        "num_stages": 2,
        "num_warps": 8,
        "ms": 0.025776833295822144,
        "min_ms": 0.025776833295822144,
        "max_ms": 0.025776833295822144,
        "compile_time": 0.753547191619873
    },
    {
        "BLOCK_SIZE_M": 128,
        "BLOCK_SIZE_N": 128,
        "BLOCK_SIZE_K": 256,
        "GROUP_SIZE_M": 8,
        "num_stages": 1,
        "num_warps": 8,
        "ms": 0.0257869865745306,
        "min_ms": 0.0257869865745306,
        "max_ms": 0.0257869865745306,
        "compile_time": 0.7761437892913818
    },
    {
        "BLOCK_SIZE_M": 32,
        "BLOCK_SIZE_N": 128,
        "BLOCK_SIZE_K": 32,
        "GROUP_SIZE_M": 8,
        "num_stages": 2,
        "num_warps": 2,
        "ms": 0.0257972814142704,
        "min_ms": 0.0257972814142704,
        "max_ms": 0.0257972814142704,
        "compile_time": 0.6750714778900146
    },
    {
        "BLOCK_SIZE_M": 64,
        "BLOCK_SIZE_N": 64,
        "BLOCK_SIZE_K": 16,
        "GROUP_SIZE_M": 8,
        "num_stages": 7,
        "num_warps": 2,
        "ms": 0.02580585516989231,
        "min_ms": 0.02580585516989231,
        "max_ms": 0.02580585516989231,
        "compile_time": 1.4057655334472656
    },
    {
        "BLOCK_SIZE_M": 64,
        "BLOCK_SIZE_N": 32,
        "BLOCK_SIZE_K": 32,
        "GROUP_SIZE_M": 8,
        "num_stages": 2,
        "num_warps": 2,
        "ms": 0.025830302387475967,
        "min_ms": 0.025830302387475967,
        "max_ms": 0.025830302387475967,
        "compile_time": 0.7257752418518066
    },
    {
        "BLOCK_SIZE_M": 64,
        "BLOCK_SIZE_N": 256,
        "BLOCK_SIZE_K": 64,
        "GROUP_SIZE_M": 8,
        "num_stages": 2,
        "num_warps": 8,
        "ms": 0.0258345790207386,
        "min_ms": 0.0258345790207386,
        "max_ms": 0.0258345790207386,
        "compile_time": 0.7382068634033203
    },
    {
        "BLOCK_SIZE_M": 64,
        "BLOCK_SIZE_N": 128,
        "BLOCK_SIZE_K": 16,
        "GROUP_SIZE_M": 8,
        "num_stages": 7,
        "num_warps": 4,
        "ms": 0.025841400027275085,
        "min_ms": 0.025841400027275085,
        "max_ms": 0.025841400027275085,
        "compile_time": 1.3978445529937744
    },
    {
        "BLOCK_SIZE_M": 128,
        "BLOCK_SIZE_N": 64,
        "BLOCK_SIZE_K": 32,
        "GROUP_SIZE_M": 8,
        "num_stages": 8,
        "num_warps": 8,
        "ms": 0.025848442688584328,
        "min_ms": 0.025848442688584328,
        "max_ms": 0.025848442688584328,
        "compile_time": 1.3801238536834717
    },
    {
        "BLOCK_SIZE_M": 64,
        "BLOCK_SIZE_N": 32,
        "BLOCK_SIZE_K": 32,
        "GROUP_SIZE_M": 8,
        "num_stages": 8,
        "num_warps": 4,
        "ms": 0.025875017046928406,
        "min_ms": 0.025875017046928406,
        "max_ms": 0.025875017046928406,
        "compile_time": 1.2923598289489746
    },
    {
        "BLOCK_SIZE_M": 128,
        "BLOCK_SIZE_N": 128,
        "BLOCK_SIZE_K": 128,
        "GROUP_SIZE_M": 8,
        "num_stages": 1,
        "num_warps": 8,
        "ms": 0.02588737942278385,
        "min_ms": 0.02588737942278385,
        "max_ms": 0.02588737942278385,
        "compile_time": 0.7804214954376221
    },
    {
        "BLOCK_SIZE_M": 128,
        "BLOCK_SIZE_N": 32,
        "BLOCK_SIZE_K": 64,
        "GROUP_SIZE_M": 8,
        "num_stages": 7,
        "num_warps": 4,
        "ms": 0.025901025161147118,
        "min_ms": 0.025901025161147118,
        "max_ms": 0.025901025161147118,
        "compile_time": 1.6967837810516357
    },
    {
        "BLOCK_SIZE_M": 32,
        "BLOCK_SIZE_N": 128,
        "BLOCK_SIZE_K": 128,
        "GROUP_SIZE_M": 8,
        "num_stages": 4,
        "num_warps": 4,
        "ms": 0.025909606367349625,
        "min_ms": 0.025909606367349625,
        "max_ms": 0.025909606367349625,
        "compile_time": 0.6951470375061035
    },
    {
        "BLOCK_SIZE_M": 32,
        "BLOCK_SIZE_N": 128,
        "BLOCK_SIZE_K": 16,
        "GROUP_SIZE_M": 8,
        "num_stages": 5,
        "num_warps": 4,
        "ms": 0.025938693434000015,
        "min_ms": 0.025938693434000015,
        "max_ms": 0.025938693434000015,
        "compile_time": 1.1504454612731934
    },
    {
        "BLOCK_SIZE_M": 32,
        "BLOCK_SIZE_N": 64,
        "BLOCK_SIZE_K": 128,
        "GROUP_SIZE_M": 8,
        "num_stages": 3,
        "num_warps": 8,
        "ms": 0.025992173701524734,
        "min_ms": 0.025992173701524734,
        "max_ms": 0.025992173701524734,
        "compile_time": 0.7121145725250244
    },
    {
        "BLOCK_SIZE_M": 32,
        "BLOCK_SIZE_N": 256,
        "BLOCK_SIZE_K": 32,
        "GROUP_SIZE_M": 8,
        "num_stages": 4,
        "num_warps": 8,
        "ms": 0.02600264549255371,
        "min_ms": 0.02600264549255371,
        "max_ms": 0.02600264549255371,
        "compile_time": 0.7219364643096924
    },
    {
        "BLOCK_SIZE_M": 128,
        "BLOCK_SIZE_N": 128,
        "BLOCK_SIZE_K": 256,
        "GROUP_SIZE_M": 8,
        "num_stages": 2,
        "num_warps": 8,
        "ms": 0.026016999036073685,
        "min_ms": 0.026016999036073685,
        "max_ms": 0.026016999036073685,
        "compile_time": 0.7971880435943604
    },
    {
        "BLOCK_SIZE_M": 32,
        "BLOCK_SIZE_N": 128,
        "BLOCK_SIZE_K": 16,
        "GROUP_SIZE_M": 8,
        "num_stages": 8,
        "num_warps": 2,
        "ms": 0.02604937180876732,
        "min_ms": 0.02604937180876732,
        "max_ms": 0.02604937180876732,
        "compile_time": 1.3511207103729248
    },
    {
        "BLOCK_SIZE_M": 32,
        "BLOCK_SIZE_N": 128,
        "BLOCK_SIZE_K": 16,
        "GROUP_SIZE_M": 8,
        "num_stages": 4,
        "num_warps": 4,
        "ms": 0.026068557053804398,
        "min_ms": 0.026068557053804398,
        "max_ms": 0.026068557053804398,
        "compile_time": 1.1447384357452393
    },
    {
        "BLOCK_SIZE_M": 64,
        "BLOCK_SIZE_N": 64,
        "BLOCK_SIZE_K": 64,
        "GROUP_SIZE_M": 8,
        "num_stages": 8,
        "num_warps": 8,
        "ms": 0.026076827198266983,
        "min_ms": 0.026076827198266983,
        "max_ms": 0.026076827198266983,
        "compile_time": 1.3052716255187988
    },
    {
        "BLOCK_SIZE_M": 32,
        "BLOCK_SIZE_N": 256,
        "BLOCK_SIZE_K": 32,
        "GROUP_SIZE_M": 8,
        "num_stages": 3,
        "num_warps": 8,
        "ms": 0.02608640119433403,
        "min_ms": 0.02608640119433403,
        "max_ms": 0.02608640119433403,
        "compile_time": 0.7543537616729736
    },
    {
        "BLOCK_SIZE_M": 64,
        "BLOCK_SIZE_N": 64,
        "BLOCK_SIZE_K": 256,
        "GROUP_SIZE_M": 8,
        "num_stages": 2,
        "num_warps": 4,
        "ms": 0.02610420621931553,
        "min_ms": 0.02610420621931553,
        "max_ms": 0.02610420621931553,
        "compile_time": 0.7258388996124268
    },
    {
        "BLOCK_SIZE_M": 32,
        "BLOCK_SIZE_N": 64,
        "BLOCK_SIZE_K": 16,
        "GROUP_SIZE_M": 8,
        "num_stages": 7,
        "num_warps": 2,
        "ms": 0.026120517402887344,
        "min_ms": 0.026120517402887344,
        "max_ms": 0.026120517402887344,
        "compile_time": 1.2044727802276611
    },
    {
        "BLOCK_SIZE_M": 256,
        "BLOCK_SIZE_N": 64,
        "BLOCK_SIZE_K": 32,
        "GROUP_SIZE_M": 8,
        "num_stages": 4,
        "num_warps": 16,
        "ms": 0.026159072294831276,
        "min_ms": 0.026159072294831276,
        "max_ms": 0.026159072294831276,
        "compile_time": 0.7981946468353271
    },
    {
        "BLOCK_SIZE_M": 32,
        "BLOCK_SIZE_N": 128,
        "BLOCK_SIZE_K": 16,
        "GROUP_SIZE_M": 8,
        "num_stages": 6,
        "num_warps": 4,
        "ms": 0.026173438876867294,
        "min_ms": 0.026173438876867294,
        "max_ms": 0.026173438876867294,
        "compile_time": 1.17655611038208
    },
    {
        "BLOCK_SIZE_M": 64,
        "BLOCK_SIZE_N": 256,
        "BLOCK_SIZE_K": 32,
        "GROUP_SIZE_M": 8,
        "num_stages": 3,
        "num_warps": 16,
        "ms": 0.026186052709817886,
        "min_ms": 0.026186052709817886,
        "max_ms": 0.026186052709817886,
        "compile_time": 0.7449703216552734
    },
    {
        "BLOCK_SIZE_M": 64,
        "BLOCK_SIZE_N": 256,
        "BLOCK_SIZE_K": 32,
        "GROUP_SIZE_M": 8,
        "num_stages": 4,
        "num_warps": 16,
        "ms": 0.026186784729361534,
        "min_ms": 0.026186784729361534,
        "max_ms": 0.026186784729361534,
        "compile_time": 0.7381210327148438
    },
    {
        "BLOCK_SIZE_M": 64,
        "BLOCK_SIZE_N": 128,
        "BLOCK_SIZE_K": 16,
        "GROUP_SIZE_M": 8,
        "num_stages": 4,
        "num_warps": 4,
        "ms": 0.026211360469460487,
        "min_ms": 0.026211360469460487,
        "max_ms": 0.026211360469460487,
        "compile_time": 1.3496532440185547
    },
    {
        "BLOCK_SIZE_M": 64,
        "BLOCK_SIZE_N": 64,
        "BLOCK_SIZE_K": 128,
        "GROUP_SIZE_M": 8,
        "num_stages": 4,
        "num_warps": 8,
        "ms": 0.02621225081384182,
        "min_ms": 0.02621225081384182,
        "max_ms": 0.02621225081384182,
        "compile_time": 0.71730637550354
    },
    {
        "BLOCK_SIZE_M": 64,
        "BLOCK_SIZE_N": 256,
        "BLOCK_SIZE_K": 32,
        "GROUP_SIZE_M": 8,
        "num_stages": 6,
        "num_warps": 16,
        "ms": 0.026217084378004074,
        "min_ms": 0.026217084378004074,
        "max_ms": 0.026217084378004074,
        "compile_time": 1.3080377578735352
    },
    {
        "BLOCK_SIZE_M": 64,
        "BLOCK_SIZE_N": 64,
        "BLOCK_SIZE_K": 128,
        "GROUP_SIZE_M": 8,
        "num_stages": 5,
        "num_warps": 8,
        "ms": 0.026256417855620384,
        "min_ms": 0.026256417855620384,
        "max_ms": 0.026256417855620384,
        "compile_time": 0.7245345115661621
    },
    {
        "BLOCK_SIZE_M": 64,
        "BLOCK_SIZE_N": 256,
        "BLOCK_SIZE_K": 32,
        "GROUP_SIZE_M": 8,
        "num_stages": 5,
        "num_warps": 16,
        "ms": 0.02626064419746399,
        "min_ms": 0.02626064419746399,
        "max_ms": 0.02626064419746399,
        "compile_time": 0.7406272888183594
    },
    {
        "BLOCK_SIZE_M": 256,
        "BLOCK_SIZE_N": 64,
        "BLOCK_SIZE_K": 128,
        "GROUP_SIZE_M": 8,
        "num_stages": 2,
        "num_warps": 8,
        "ms": 0.026262640953063965,
        "min_ms": 0.026262640953063965,
        "max_ms": 0.026262640953063965,
        "compile_time": 0.820939302444458
    },
    {
        "BLOCK_SIZE_M": 128,
        "BLOCK_SIZE_N": 128,
        "BLOCK_SIZE_K": 128,
        "GROUP_SIZE_M": 8,
        "num_stages": 2,
        "num_warps": 16,
        "ms": 0.026306796818971634,
        "min_ms": 0.026306796818971634,
        "max_ms": 0.026306796818971634,
        "compile_time": 0.7717175483703613
    },
    {
        "BLOCK_SIZE_M": 256,
        "BLOCK_SIZE_N": 32,
        "BLOCK_SIZE_K": 64,
        "GROUP_SIZE_M": 8,
        "num_stages": 2,
        "num_warps": 8,
        "ms": 0.026309192180633545,
        "min_ms": 0.026309192180633545,
        "max_ms": 0.026309192180633545,
        "compile_time": 0.8051397800445557
    },
    {
        "BLOCK_SIZE_M": 256,
        "BLOCK_SIZE_N": 32,
        "BLOCK_SIZE_K": 32,
        "GROUP_SIZE_M": 8,
        "num_stages": 5,
        "num_warps": 4,
        "ms": 0.026333624497056007,
        "min_ms": 0.026333624497056007,
        "max_ms": 0.026333624497056007,
        "compile_time": 0.7745587825775146
    },
    {
        "BLOCK_SIZE_M": 32,
        "BLOCK_SIZE_N": 64,
        "BLOCK_SIZE_K": 16,
        "GROUP_SIZE_M": 8,
        "num_stages": 8,
        "num_warps": 2,
        "ms": 0.026339832693338394,
        "min_ms": 0.026339832693338394,
        "max_ms": 0.026339832693338394,
        "compile_time": 1.1841063499450684
    },
    {
        "BLOCK_SIZE_M": 64,
        "BLOCK_SIZE_N": 256,
        "BLOCK_SIZE_K": 32,
        "GROUP_SIZE_M": 8,
        "num_stages": 7,
        "num_warps": 16,
        "ms": 0.026343727484345436,
        "min_ms": 0.026343727484345436,
        "max_ms": 0.026343727484345436,
        "compile_time": 1.3407890796661377
    },
    {
        "BLOCK_SIZE_M": 128,
        "BLOCK_SIZE_N": 32,
        "BLOCK_SIZE_K": 64,
        "GROUP_SIZE_M": 8,
        "num_stages": 5,
        "num_warps": 8,
        "ms": 0.026349622756242752,
        "min_ms": 0.026349622756242752,
        "max_ms": 0.026349622756242752,
        "compile_time": 0.7319903373718262
    },
    {
        "BLOCK_SIZE_M": 64,
        "BLOCK_SIZE_N": 32,
        "BLOCK_SIZE_K": 64,
        "GROUP_SIZE_M": 8,
        "num_stages": 3,
        "num_warps": 8,
        "ms": 0.026367008686065674,
        "min_ms": 0.026367008686065674,
        "max_ms": 0.026367008686065674,
        "compile_time": 0.7224571704864502
    },
    {
        "BLOCK_SIZE_M": 128,
        "BLOCK_SIZE_N": 128,
        "BLOCK_SIZE_K": 128,
        "GROUP_SIZE_M": 8,
        "num_stages": 2,
        "num_warps": 4,
        "ms": 0.026408368721604347,
        "min_ms": 0.026408368721604347,
        "max_ms": 0.026408368721604347,
        "compile_time": 0.8033862113952637
    },
    {
        "BLOCK_SIZE_M": 64,
        "BLOCK_SIZE_N": 128,
        "BLOCK_SIZE_K": 16,
        "GROUP_SIZE_M": 8,
        "num_stages": 6,
        "num_warps": 4,
        "ms": 0.026419470086693764,
        "min_ms": 0.026419470086693764,
        "max_ms": 0.026419470086693764,
        "compile_time": 1.40346097946167
    },
    {
        "BLOCK_SIZE_M": 32,
        "BLOCK_SIZE_N": 512,
        "BLOCK_SIZE_K": 32,
        "GROUP_SIZE_M": 8,
        "num_stages": 4,
        "num_warps": 16,
        "ms": 0.026433702558279037,
        "min_ms": 0.026433702558279037,
        "max_ms": 0.026433702558279037,
        "compile_time": 1.284792184829712
    },
    {
        "BLOCK_SIZE_M": 32,
        "BLOCK_SIZE_N": 64,
        "BLOCK_SIZE_K": 64,
        "GROUP_SIZE_M": 8,
        "num_stages": 4,
        "num_warps": 8,
        "ms": 0.026484083384275436,
        "min_ms": 0.026484083384275436,
        "max_ms": 0.026484083384275436,
        "compile_time": 0.6962804794311523
    },
    {
        "BLOCK_SIZE_M": 256,
        "BLOCK_SIZE_N": 32,
        "BLOCK_SIZE_K": 64,
        "GROUP_SIZE_M": 8,
        "num_stages": 4,
        "num_warps": 4,
        "ms": 0.026493731886148453,
        "min_ms": 0.026493731886148453,
        "max_ms": 0.026493731886148453,
        "compile_time": 0.7979450225830078
    },
    {
        "BLOCK_SIZE_M": 64,
        "BLOCK_SIZE_N": 64,
        "BLOCK_SIZE_K": 32,
        "GROUP_SIZE_M": 8,
        "num_stages": 8,
        "num_warps": 8,
        "ms": 0.02650291845202446,
        "min_ms": 0.02650291845202446,
        "max_ms": 0.02650291845202446,
        "compile_time": 1.2353699207305908
    },
    {
        "BLOCK_SIZE_M": 64,
        "BLOCK_SIZE_N": 32,
        "BLOCK_SIZE_K": 64,
        "GROUP_SIZE_M": 8,
        "num_stages": 4,
        "num_warps": 4,
        "ms": 0.026526477187871933,
        "min_ms": 0.026526477187871933,
        "max_ms": 0.026526477187871933,
        "compile_time": 0.7390744686126709
    },
    {
        "BLOCK_SIZE_M": 512,
        "BLOCK_SIZE_N": 32,
        "BLOCK_SIZE_K": 32,
        "GROUP_SIZE_M": 8,
        "num_stages": 3,
        "num_warps": 8,
        "ms": 0.026528602465987206,
        "min_ms": 0.026528602465987206,
        "max_ms": 0.026528602465987206,
        "compile_time": 1.777557611465454
    },
    {
        "BLOCK_SIZE_M": 128,
        "BLOCK_SIZE_N": 32,
        "BLOCK_SIZE_K": 64,
        "GROUP_SIZE_M": 8,
        "num_stages": 4,
        "num_warps": 2,
        "ms": 0.02654285356402397,
        "min_ms": 0.02654285356402397,
        "max_ms": 0.02654285356402397,
        "compile_time": 0.7431211471557617
    },
    {
        "BLOCK_SIZE_M": 32,
        "BLOCK_SIZE_N": 256,
        "BLOCK_SIZE_K": 128,
        "GROUP_SIZE_M": 8,
        "num_stages": 2,
        "num_warps": 4,
        "ms": 0.026549696922302246,
        "min_ms": 0.026549696922302246,
        "max_ms": 0.026549696922302246,
        "compile_time": 0.7613821029663086
    },
    {
        "BLOCK_SIZE_M": 512,
        "BLOCK_SIZE_N": 32,
        "BLOCK_SIZE_K": 32,
        "GROUP_SIZE_M": 8,
        "num_stages": 4,
        "num_warps": 8,
        "ms": 0.026577359065413475,
        "min_ms": 0.026577359065413475,
        "max_ms": 0.026577359065413475,
        "compile_time": 1.8156614303588867
    },
    {
        "BLOCK_SIZE_M": 32,
        "BLOCK_SIZE_N": 128,
        "BLOCK_SIZE_K": 64,
        "GROUP_SIZE_M": 8,
        "num_stages": 2,
        "num_warps": 8,
        "ms": 0.026577536016702652,
        "min_ms": 0.026577536016702652,
        "max_ms": 0.026577536016702652,
        "compile_time": 0.6932048797607422
    },
    {
        "BLOCK_SIZE_M": 64,
        "BLOCK_SIZE_N": 32,
        "BLOCK_SIZE_K": 128,
        "GROUP_SIZE_M": 8,
        "num_stages": 2,
        "num_warps": 2,
        "ms": 0.02663131058216095,
        "min_ms": 0.02663131058216095,
        "max_ms": 0.02663131058216095,
        "compile_time": 0.6972289085388184
    },
    {
        "BLOCK_SIZE_M": 256,
        "BLOCK_SIZE_N": 64,
        "BLOCK_SIZE_K": 32,
        "GROUP_SIZE_M": 8,
        "num_stages": 3,
        "num_warps": 16,
        "ms": 0.026638954877853394,
        "min_ms": 0.026638954877853394,
        "max_ms": 0.026638954877853394,
        "compile_time": 0.8225243091583252
    },
    {
        "BLOCK_SIZE_M": 32,
        "BLOCK_SIZE_N": 64,
        "BLOCK_SIZE_K": 128,
        "GROUP_SIZE_M": 8,
        "num_stages": 3,
        "num_warps": 2,
        "ms": 0.026700716465711594,
        "min_ms": 0.026700716465711594,
        "max_ms": 0.026700716465711594,
        "compile_time": 0.7011516094207764
    },
    {
        "BLOCK_SIZE_M": 32,
        "BLOCK_SIZE_N": 128,
        "BLOCK_SIZE_K": 64,
        "GROUP_SIZE_M": 8,
        "num_stages": 8,
        "num_warps": 4,
        "ms": 0.026704709976911545,
        "min_ms": 0.026704709976911545,
        "max_ms": 0.026704709976911545,
        "compile_time": 1.5639641284942627
    },
    {
        "BLOCK_SIZE_M": 32,
        "BLOCK_SIZE_N": 128,
        "BLOCK_SIZE_K": 16,
        "GROUP_SIZE_M": 8,
        "num_stages": 7,
        "num_warps": 4,
        "ms": 0.026711810380220413,
        "min_ms": 0.026711810380220413,
        "max_ms": 0.026711810380220413,
        "compile_time": 1.1819727420806885
    },
    {
        "BLOCK_SIZE_M": 32,
        "BLOCK_SIZE_N": 128,
        "BLOCK_SIZE_K": 64,
        "GROUP_SIZE_M": 8,
        "num_stages": 4,
        "num_warps": 2,
        "ms": 0.026715993881225586,
        "min_ms": 0.026715993881225586,
        "max_ms": 0.026715993881225586,
        "compile_time": 0.6932675838470459
    },
    {
        "BLOCK_SIZE_M": 32,
        "BLOCK_SIZE_N": 128,
        "BLOCK_SIZE_K": 16,
        "GROUP_SIZE_M": 8,
        "num_stages": 8,
        "num_warps": 4,
        "ms": 0.026724284514784813,
        "min_ms": 0.026724284514784813,
        "max_ms": 0.026724284514784813,
        "compile_time": 1.0473659038543701
    },
    {
        "BLOCK_SIZE_M": 128,
        "BLOCK_SIZE_N": 128,
        "BLOCK_SIZE_K": 64,
        "GROUP_SIZE_M": 8,
        "num_stages": 2,
        "num_warps": 16,
        "ms": 0.0267411470413208,
        "min_ms": 0.0267411470413208,
        "max_ms": 0.0267411470413208,
        "compile_time": 0.7591440677642822
    },
    {
        "BLOCK_SIZE_M": 32,
        "BLOCK_SIZE_N": 64,
        "BLOCK_SIZE_K": 32,
        "GROUP_SIZE_M": 8,
        "num_stages": 8,
        "num_warps": 4,
        "ms": 0.026751762256026268,
        "min_ms": 0.026751762256026268,
        "max_ms": 0.026751762256026268,
        "compile_time": 1.1781063079833984
    },
    {
        "BLOCK_SIZE_M": 256,
        "BLOCK_SIZE_N": 64,
        "BLOCK_SIZE_K": 32,
        "GROUP_SIZE_M": 8,
        "num_stages": 6,
        "num_warps": 16,
        "ms": 0.0267538633197546,
        "min_ms": 0.0267538633197546,
        "max_ms": 0.0267538633197546,
        "compile_time": 1.463184118270874
    },
    {
        "BLOCK_SIZE_M": 256,
        "BLOCK_SIZE_N": 64,
        "BLOCK_SIZE_K": 32,
        "GROUP_SIZE_M": 8,
        "num_stages": 7,
        "num_warps": 16,
        "ms": 0.026753943413496017,
        "min_ms": 0.026753943413496017,
        "max_ms": 0.026753943413496017,
        "compile_time": 1.4989304542541504
    },
    {
        "BLOCK_SIZE_M": 128,
        "BLOCK_SIZE_N": 32,
        "BLOCK_SIZE_K": 128,
        "GROUP_SIZE_M": 8,
        "num_stages": 3,
        "num_warps": 8,
        "ms": 0.026761597022414207,
        "min_ms": 0.026761597022414207,
        "max_ms": 0.026761597022414207,
        "compile_time": 0.784325122833252
    },
    {
        "BLOCK_SIZE_M": 64,
        "BLOCK_SIZE_N": 256,
        "BLOCK_SIZE_K": 32,
        "GROUP_SIZE_M": 8,
        "num_stages": 8,
        "num_warps": 16,
        "ms": 0.026776304468512535,
        "min_ms": 0.026776304468512535,
        "max_ms": 0.026776304468512535,
        "compile_time": 1.3998970985412598
    },
    {
        "BLOCK_SIZE_M": 32,
        "BLOCK_SIZE_N": 64,
        "BLOCK_SIZE_K": 32,
        "GROUP_SIZE_M": 8,
        "num_stages": 2,
        "num_warps": 4,
        "ms": 0.02684290148317814,
        "min_ms": 0.02684290148317814,
        "max_ms": 0.02684290148317814,
        "compile_time": 0.6842527389526367
    },
    {
        "BLOCK_SIZE_M": 32,
        "BLOCK_SIZE_N": 128,
        "BLOCK_SIZE_K": 128,
        "GROUP_SIZE_M": 8,
        "num_stages": 5,
        "num_warps": 4,
        "ms": 0.02684940956532955,
        "min_ms": 0.02684940956532955,
        "max_ms": 0.02684940956532955,
        "compile_time": 0.7026863098144531
    },
    {
        "BLOCK_SIZE_M": 32,
        "BLOCK_SIZE_N": 256,
        "BLOCK_SIZE_K": 32,
        "GROUP_SIZE_M": 8,
        "num_stages": 5,
        "num_warps": 8,
        "ms": 0.026858577504754066,
        "min_ms": 0.026858577504754066,
        "max_ms": 0.026858577504754066,
        "compile_time": 0.7629940509796143
    },
    {
        "BLOCK_SIZE_M": 32,
        "BLOCK_SIZE_N": 256,
        "BLOCK_SIZE_K": 64,
        "GROUP_SIZE_M": 8,
        "num_stages": 4,
        "num_warps": 4,
        "ms": 0.0268697589635849,
        "min_ms": 0.0268697589635849,
        "max_ms": 0.0268697589635849,
        "compile_time": 0.8319694995880127
    },
    {
        "BLOCK_SIZE_M": 128,
        "BLOCK_SIZE_N": 32,
        "BLOCK_SIZE_K": 64,
        "GROUP_SIZE_M": 8,
        "num_stages": 2,
        "num_warps": 8,
        "ms": 0.026887860149145126,
        "min_ms": 0.026887860149145126,
        "max_ms": 0.026887860149145126,
        "compile_time": 0.7680349349975586
    },
    {
        "BLOCK_SIZE_M": 32,
        "BLOCK_SIZE_N": 64,
        "BLOCK_SIZE_K": 32,
        "GROUP_SIZE_M": 8,
        "num_stages": 8,
        "num_warps": 2,
        "ms": 0.026890307664871216,
        "min_ms": 0.026890307664871216,
        "max_ms": 0.026890307664871216,
        "compile_time": 1.3268437385559082
    },
    {
        "BLOCK_SIZE_M": 32,
        "BLOCK_SIZE_N": 128,
        "BLOCK_SIZE_K": 32,
        "GROUP_SIZE_M": 8,
        "num_stages": 7,
        "num_warps": 2,
        "ms": 0.02689540386199951,
        "min_ms": 0.02689540386199951,
        "max_ms": 0.02689540386199951,
        "compile_time": 1.5719099044799805
    },
    {
        "BLOCK_SIZE_M": 256,
        "BLOCK_SIZE_N": 64,
        "BLOCK_SIZE_K": 32,
        "GROUP_SIZE_M": 8,
        "num_stages": 5,
        "num_warps": 16,
        "ms": 0.02691156230866909,
        "min_ms": 0.02691156230866909,
        "max_ms": 0.02691156230866909,
        "compile_time": 0.8000893592834473
    },
    {
        "BLOCK_SIZE_M": 32,
        "BLOCK_SIZE_N": 256,
        "BLOCK_SIZE_K": 32,
        "GROUP_SIZE_M": 8,
        "num_stages": 6,
        "num_warps": 4,
        "ms": 0.026917839422822,
        "min_ms": 0.026917839422822,
        "max_ms": 0.026917839422822,
        "compile_time": 1.5918550491333008
    },
    {
        "BLOCK_SIZE_M": 64,
        "BLOCK_SIZE_N": 128,
        "BLOCK_SIZE_K": 16,
        "GROUP_SIZE_M": 8,
        "num_stages": 8,
        "num_warps": 4,
        "ms": 0.02692168578505516,
        "min_ms": 0.02692168578505516,
        "max_ms": 0.02692168578505516,
        "compile_time": 1.4117755889892578
    },
    {
        "BLOCK_SIZE_M": 64,
        "BLOCK_SIZE_N": 256,
        "BLOCK_SIZE_K": 32,
        "GROUP_SIZE_M": 8,
        "num_stages": 2,
        "num_warps": 4,
        "ms": 0.026924723759293556,
        "min_ms": 0.026924723759293556,
        "max_ms": 0.026924723759293556,
        "compile_time": 0.7489755153656006
    },
    {
        "BLOCK_SIZE_M": 128,
        "BLOCK_SIZE_N": 32,
        "BLOCK_SIZE_K": 64,
        "GROUP_SIZE_M": 8,
        "num_stages": 8,
        "num_warps": 4,
        "ms": 0.026929426938295364,
        "min_ms": 0.026929426938295364,
        "max_ms": 0.026929426938295364,
        "compile_time": 1.7584006786346436
    },
    {
        "BLOCK_SIZE_M": 32,
        "BLOCK_SIZE_N": 128,
        "BLOCK_SIZE_K": 16,
        "GROUP_SIZE_M": 8,
        "num_stages": 3,
        "num_warps": 4,
        "ms": 0.026956994086503983,
        "min_ms": 0.026956994086503983,
        "max_ms": 0.026956994086503983,
        "compile_time": 1.123622179031372
    },
    {
        "BLOCK_SIZE_M": 512,
        "BLOCK_SIZE_N": 32,
        "BLOCK_SIZE_K": 32,
        "GROUP_SIZE_M": 8,
        "num_stages": 5,
        "num_warps": 8,
        "ms": 0.02695724368095398,
        "min_ms": 0.02695724368095398,
        "max_ms": 0.02695724368095398,
        "compile_time": 1.8649518489837646
    },
    {
        "BLOCK_SIZE_M": 64,
        "BLOCK_SIZE_N": 32,
        "BLOCK_SIZE_K": 128,
        "GROUP_SIZE_M": 8,
        "num_stages": 3,
        "num_warps": 8,
        "ms": 0.026960676535964012,
        "min_ms": 0.026960676535964012,
        "max_ms": 0.026960676535964012,
        "compile_time": 0.7354707717895508
    },
    {
        "BLOCK_SIZE_M": 32,
        "BLOCK_SIZE_N": 64,
        "BLOCK_SIZE_K": 64,
        "GROUP_SIZE_M": 8,
        "num_stages": 5,
        "num_warps": 8,
        "ms": 0.02697356976568699,
        "min_ms": 0.02697356976568699,
        "max_ms": 0.02697356976568699,
        "compile_time": 0.6935689449310303
    },
    {
        "BLOCK_SIZE_M": 32,
        "BLOCK_SIZE_N": 512,
        "BLOCK_SIZE_K": 32,
        "GROUP_SIZE_M": 8,
        "num_stages": 3,
        "num_warps": 16,
        "ms": 0.026980016380548477,
        "min_ms": 0.026980016380548477,
        "max_ms": 0.026980016380548477,
        "compile_time": 1.2717082500457764
    },
    {
        "BLOCK_SIZE_M": 32,
        "BLOCK_SIZE_N": 512,
        "BLOCK_SIZE_K": 32,
        "GROUP_SIZE_M": 8,
        "num_stages": 5,
        "num_warps": 16,
        "ms": 0.0269999410957098,
        "min_ms": 0.0269999410957098,
        "max_ms": 0.0269999410957098,
        "compile_time": 1.2957227230072021
    },
    {
        "BLOCK_SIZE_M": 64,
        "BLOCK_SIZE_N": 32,
        "BLOCK_SIZE_K": 64,
        "GROUP_SIZE_M": 8,
        "num_stages": 5,
        "num_warps": 2,
        "ms": 0.027012327685952187,
        "min_ms": 0.027012327685952187,
        "max_ms": 0.027012327685952187,
        "compile_time": 0.7314846515655518
    },
    {
        "BLOCK_SIZE_M": 32,
        "BLOCK_SIZE_N": 128,
        "BLOCK_SIZE_K": 64,
        "GROUP_SIZE_M": 8,
        "num_stages": 5,
        "num_warps": 2,
        "ms": 0.027023375034332275,
        "min_ms": 0.027023375034332275,
        "max_ms": 0.027023375034332275,
        "compile_time": 0.6917545795440674
    },
    {
        "BLOCK_SIZE_M": 128,
        "BLOCK_SIZE_N": 32,
        "BLOCK_SIZE_K": 128,
        "GROUP_SIZE_M": 8,
        "num_stages": 4,
        "num_warps": 4,
        "ms": 0.027053341269493103,
        "min_ms": 0.027053341269493103,
        "max_ms": 0.027053341269493103,
        "compile_time": 0.7759392261505127
    },
    {
        "BLOCK_SIZE_M": 256,
        "BLOCK_SIZE_N": 64,
        "BLOCK_SIZE_K": 32,
        "GROUP_SIZE_M": 8,
        "num_stages": 8,
        "num_warps": 16,
        "ms": 0.027056708931922913,
        "min_ms": 0.027056708931922913,
        "max_ms": 0.027056708931922913,
        "compile_time": 1.473418951034546
    },
    {
        "BLOCK_SIZE_M": 128,
        "BLOCK_SIZE_N": 128,
        "BLOCK_SIZE_K": 64,
        "GROUP_SIZE_M": 8,
        "num_stages": 1,
        "num_warps": 16,
        "ms": 0.027091464027762413,
        "min_ms": 0.027091464027762413,
        "max_ms": 0.027091464027762413,
        "compile_time": 0.8050432205200195
    },
    {
        "BLOCK_SIZE_M": 32,
        "BLOCK_SIZE_N": 64,
        "BLOCK_SIZE_K": 64,
        "GROUP_SIZE_M": 8,
        "num_stages": 3,
        "num_warps": 8,
        "ms": 0.027121862396597862,
        "min_ms": 0.027121862396597862,
        "max_ms": 0.027121862396597862,
        "compile_time": 0.6973092555999756
    },
    {
        "BLOCK_SIZE_M": 256,
        "BLOCK_SIZE_N": 64,
        "BLOCK_SIZE_K": 32,
        "GROUP_SIZE_M": 8,
        "num_stages": 2,
        "num_warps": 4,
        "ms": 0.027130166068673134,
        "min_ms": 0.027130166068673134,
        "max_ms": 0.027130166068673134,
        "compile_time": 0.7911579608917236
    },
    {
        "BLOCK_SIZE_M": 32,
        "BLOCK_SIZE_N": 64,
        "BLOCK_SIZE_K": 32,
        "GROUP_SIZE_M": 8,
        "num_stages": 2,
        "num_warps": 2,
        "ms": 0.02715010941028595,
        "min_ms": 0.02715010941028595,
        "max_ms": 0.02715010941028595,
        "compile_time": 0.7038590908050537
    },
    {
        "BLOCK_SIZE_M": 32,
        "BLOCK_SIZE_N": 128,
        "BLOCK_SIZE_K": 128,
        "GROUP_SIZE_M": 8,
        "num_stages": 2,
        "num_warps": 2,
        "ms": 0.02717222273349762,
        "min_ms": 0.02717222273349762,
        "max_ms": 0.02717222273349762,
        "compile_time": 0.7256176471710205
    },
    {
        "BLOCK_SIZE_M": 128,
        "BLOCK_SIZE_N": 128,
        "BLOCK_SIZE_K": 32,
        "GROUP_SIZE_M": 8,
        "num_stages": 2,
        "num_warps": 8,
        "ms": 0.027217786759138107,
        "min_ms": 0.027217786759138107,
        "max_ms": 0.027217786759138107,
        "compile_time": 0.7868719100952148
    },
    {
        "BLOCK_SIZE_M": 32,
        "BLOCK_SIZE_N": 64,
        "BLOCK_SIZE_K": 64,
        "GROUP_SIZE_M": 8,
        "num_stages": 5,
        "num_warps": 2,
        "ms": 0.027235042303800583,
        "min_ms": 0.027235042303800583,
        "max_ms": 0.027235042303800583,
        "compile_time": 0.6945199966430664
    },
    {
        "BLOCK_SIZE_M": 64,
        "BLOCK_SIZE_N": 64,
        "BLOCK_SIZE_K": 64,
        "GROUP_SIZE_M": 8,
        "num_stages": 7,
        "num_warps": 2,
        "ms": 0.027235474437475204,
        "min_ms": 0.027235474437475204,
        "max_ms": 0.027235474437475204,
        "compile_time": 1.7805850505828857
    },
    {
        "BLOCK_SIZE_M": 64,
        "BLOCK_SIZE_N": 32,
        "BLOCK_SIZE_K": 64,
        "GROUP_SIZE_M": 8,
        "num_stages": 4,
        "num_warps": 8,
        "ms": 0.027262169867753983,
        "min_ms": 0.027262169867753983,
        "max_ms": 0.027262169867753983,
        "compile_time": 0.7462255954742432
    },
    {
        "BLOCK_SIZE_M": 32,
        "BLOCK_SIZE_N": 256,
        "BLOCK_SIZE_K": 64,
        "GROUP_SIZE_M": 8,
        "num_stages": 2,
        "num_warps": 4,
        "ms": 0.027278203517198563,
        "min_ms": 0.027278203517198563,
        "max_ms": 0.027278203517198563,
        "compile_time": 0.7886240482330322
    },
    {
        "BLOCK_SIZE_M": 64,
        "BLOCK_SIZE_N": 32,
        "BLOCK_SIZE_K": 128,
        "GROUP_SIZE_M": 8,
        "num_stages": 3,
        "num_warps": 2,
        "ms": 0.027281511574983597,
        "min_ms": 0.027281511574983597,
        "max_ms": 0.027281511574983597,
        "compile_time": 0.736351490020752
    },
    {
        "BLOCK_SIZE_M": 32,
        "BLOCK_SIZE_N": 128,
        "BLOCK_SIZE_K": 32,
        "GROUP_SIZE_M": 8,
        "num_stages": 2,
        "num_warps": 4,
        "ms": 0.027311598882079124,
        "min_ms": 0.027311598882079124,
        "max_ms": 0.027311598882079124,
        "compile_time": 0.7058537006378174
    },
    {
        "BLOCK_SIZE_M": 64,
        "BLOCK_SIZE_N": 256,
        "BLOCK_SIZE_K": 128,
        "GROUP_SIZE_M": 8,
        "num_stages": 2,
        "num_warps": 8,
        "ms": 0.027355339378118515,
        "min_ms": 0.027355339378118515,
        "max_ms": 0.027355339378118515,
        "compile_time": 0.7808411121368408
    },
    {
        "BLOCK_SIZE_M": 32,
        "BLOCK_SIZE_N": 128,
        "BLOCK_SIZE_K": 64,
        "GROUP_SIZE_M": 8,
        "num_stages": 6,
        "num_warps": 8,
        "ms": 0.027405258268117905,
        "min_ms": 0.027405258268117905,
        "max_ms": 0.027405258268117905,
        "compile_time": 1.2504241466522217
    },
    {
        "BLOCK_SIZE_M": 64,
        "BLOCK_SIZE_N": 64,
        "BLOCK_SIZE_K": 64,
        "GROUP_SIZE_M": 8,
        "num_stages": 1,
        "num_warps": 2,
        "ms": 0.027428964152932167,
        "min_ms": 0.027428964152932167,
        "max_ms": 0.027428964152932167,
        "compile_time": 0.7432456016540527
    },
    {
        "BLOCK_SIZE_M": 32,
        "BLOCK_SIZE_N": 256,
        "BLOCK_SIZE_K": 64,
        "GROUP_SIZE_M": 8,
        "num_stages": 2,
        "num_warps": 8,
        "ms": 0.027486935257911682,
        "min_ms": 0.027486935257911682,
        "max_ms": 0.027486935257911682,
        "compile_time": 0.8300836086273193
    },
    {
        "BLOCK_SIZE_M": 32,
        "BLOCK_SIZE_N": 64,
        "BLOCK_SIZE_K": 128,
        "GROUP_SIZE_M": 8,
        "num_stages": 3,
        "num_warps": 4,
        "ms": 0.027498800307512283,
        "min_ms": 0.027498800307512283,
        "max_ms": 0.027498800307512283,
        "compile_time": 0.6985912322998047
    },
    {
        "BLOCK_SIZE_M": 256,
        "BLOCK_SIZE_N": 64,
        "BLOCK_SIZE_K": 64,
        "GROUP_SIZE_M": 8,
        "num_stages": 2,
        "num_warps": 4,
        "ms": 0.027505526319146156,
        "min_ms": 0.027505526319146156,
        "max_ms": 0.027505526319146156,
        "compile_time": 0.7917959690093994
    },
    {
        "BLOCK_SIZE_M": 64,
        "BLOCK_SIZE_N": 64,
        "BLOCK_SIZE_K": 128,
        "GROUP_SIZE_M": 8,
        "num_stages": 1,
        "num_warps": 2,
        "ms": 0.027516406029462814,
        "min_ms": 0.027516406029462814,
        "max_ms": 0.027516406029462814,
        "compile_time": 0.7546682357788086
    },
    {
        "BLOCK_SIZE_M": 128,
        "BLOCK_SIZE_N": 128,
        "BLOCK_SIZE_K": 256,
        "GROUP_SIZE_M": 8,
        "num_stages": 1,
        "num_warps": 16,
        "ms": 0.027518540620803833,
        "min_ms": 0.027518540620803833,
        "max_ms": 0.027518540620803833,
        "compile_time": 0.7889325618743896
    },
    {
        "BLOCK_SIZE_M": 64,
        "BLOCK_SIZE_N": 64,
        "BLOCK_SIZE_K": 32,
        "GROUP_SIZE_M": 8,
        "num_stages": 2,
        "num_warps": 8,
        "ms": 0.027539873495697975,
        "min_ms": 0.027539873495697975,
        "max_ms": 0.027539873495697975,
        "compile_time": 0.7772161960601807
    },
    {
        "BLOCK_SIZE_M": 256,
        "BLOCK_SIZE_N": 32,
        "BLOCK_SIZE_K": 128,
        "GROUP_SIZE_M": 8,
        "num_stages": 2,
        "num_warps": 4,
        "ms": 0.02754131890833378,
        "min_ms": 0.02754131890833378,
        "max_ms": 0.02754131890833378,
        "compile_time": 0.7963414192199707
    },
    {
        "BLOCK_SIZE_M": 32,
        "BLOCK_SIZE_N": 64,
        "BLOCK_SIZE_K": 64,
        "GROUP_SIZE_M": 8,
        "num_stages": 6,
        "num_warps": 2,
        "ms": 0.02756914496421814,
        "min_ms": 0.02756914496421814,
        "max_ms": 0.02756914496421814,
        "compile_time": 1.5117902755737305
    },
    {
        "BLOCK_SIZE_M": 64,
        "BLOCK_SIZE_N": 64,
        "BLOCK_SIZE_K": 64,
        "GROUP_SIZE_M": 8,
        "num_stages": 8,
        "num_warps": 2,
        "ms": 0.027585411444306374,
        "min_ms": 0.027585411444306374,
        "max_ms": 0.027585411444306374,
        "compile_time": 1.9546840190887451
    },
    {
        "BLOCK_SIZE_M": 32,
        "BLOCK_SIZE_N": 128,
        "BLOCK_SIZE_K": 32,
        "GROUP_SIZE_M": 8,
        "num_stages": 3,
        "num_warps": 8,
        "ms": 0.02767389640212059,
        "min_ms": 0.02767389640212059,
        "max_ms": 0.02767389640212059,
        "compile_time": 0.7125937938690186
    },
    {
        "BLOCK_SIZE_M": 32,
        "BLOCK_SIZE_N": 64,
        "BLOCK_SIZE_K": 64,
        "GROUP_SIZE_M": 8,
        "num_stages": 1,
        "num_warps": 2,
        "ms": 0.027702966704964638,
        "min_ms": 0.027702966704964638,
        "max_ms": 0.027702966704964638,
        "compile_time": 0.7074780464172363
    },
    {
        "BLOCK_SIZE_M": 32,
        "BLOCK_SIZE_N": 64,
        "BLOCK_SIZE_K": 64,
        "GROUP_SIZE_M": 8,
        "num_stages": 6,
        "num_warps": 8,
        "ms": 0.0277116559445858,
        "min_ms": 0.0277116559445858,
        "max_ms": 0.0277116559445858,
        "compile_time": 1.175020694732666
    },
    {
        "BLOCK_SIZE_M": 128,
        "BLOCK_SIZE_N": 32,
        "BLOCK_SIZE_K": 128,
        "GROUP_SIZE_M": 8,
        "num_stages": 3,
        "num_warps": 4,
        "ms": 0.027735626325011253,
        "min_ms": 0.027735626325011253,
        "max_ms": 0.027735626325011253,
        "compile_time": 0.6888566017150879
    },
    {
        "BLOCK_SIZE_M": 256,
        "BLOCK_SIZE_N": 32,
        "BLOCK_SIZE_K": 64,
        "GROUP_SIZE_M": 8,
        "num_stages": 4,
        "num_warps": 8,
        "ms": 0.02774590253829956,
        "min_ms": 0.02774590253829956,
        "max_ms": 0.02774590253829956,
        "compile_time": 0.8285326957702637
    },
    {
        "BLOCK_SIZE_M": 32,
        "BLOCK_SIZE_N": 256,
        "BLOCK_SIZE_K": 32,
        "GROUP_SIZE_M": 8,
        "num_stages": 7,
        "num_warps": 4,
        "ms": 0.027746673673391342,
        "min_ms": 0.027746673673391342,
        "max_ms": 0.027746673673391342,
        "compile_time": 1.708608865737915
    },
    {
        "BLOCK_SIZE_M": 64,
        "BLOCK_SIZE_N": 64,
        "BLOCK_SIZE_K": 128,
        "GROUP_SIZE_M": 8,
        "num_stages": 2,
        "num_warps": 8,
        "ms": 0.027770210057497025,
        "min_ms": 0.027770210057497025,
        "max_ms": 0.027770210057497025,
        "compile_time": 0.7406060695648193
    },
    {
        "BLOCK_SIZE_M": 64,
        "BLOCK_SIZE_N": 64,
        "BLOCK_SIZE_K": 256,
        "GROUP_SIZE_M": 8,
        "num_stages": 2,
        "num_warps": 8,
        "ms": 0.02777126058936119,
        "min_ms": 0.02777126058936119,
        "max_ms": 0.02777126058936119,
        "compile_time": 0.7377462387084961
    },
    {
        "BLOCK_SIZE_M": 32,
        "BLOCK_SIZE_N": 128,
        "BLOCK_SIZE_K": 128,
        "GROUP_SIZE_M": 8,
        "num_stages": 4,
        "num_warps": 8,
        "ms": 0.027774930000305176,
        "min_ms": 0.027774930000305176,
        "max_ms": 0.027774930000305176,
        "compile_time": 0.6828382015228271
    },
    {
        "BLOCK_SIZE_M": 32,
        "BLOCK_SIZE_N": 64,
        "BLOCK_SIZE_K": 16,
        "GROUP_SIZE_M": 8,
        "num_stages": 4,
        "num_warps": 2,
        "ms": 0.02779812179505825,
        "min_ms": 0.02779812179505825,
        "max_ms": 0.02779812179505825,
        "compile_time": 1.1408720016479492
    },
    {
        "BLOCK_SIZE_M": 32,
        "BLOCK_SIZE_N": 256,
        "BLOCK_SIZE_K": 64,
        "GROUP_SIZE_M": 8,
        "num_stages": 4,
        "num_warps": 8,
        "ms": 0.02784900739789009,
        "min_ms": 0.02784900739789009,
        "max_ms": 0.02784900739789009,
        "compile_time": 0.8039970397949219
    },
    {
        "BLOCK_SIZE_M": 128,
        "BLOCK_SIZE_N": 64,
        "BLOCK_SIZE_K": 64,
        "GROUP_SIZE_M": 8,
        "num_stages": 1,
        "num_warps": 8,
        "ms": 0.02785351313650608,
        "min_ms": 0.02785351313650608,
        "max_ms": 0.02785351313650608,
        "compile_time": 0.7541255950927734
    },
    {
        "BLOCK_SIZE_M": 64,
        "BLOCK_SIZE_N": 128,
        "BLOCK_SIZE_K": 64,
        "GROUP_SIZE_M": 8,
        "num_stages": 1,
        "num_warps": 8,
        "ms": 0.027866939082741737,
        "min_ms": 0.027866939082741737,
        "max_ms": 0.027866939082741737,
        "compile_time": 0.7561798095703125
    },
    {
        "BLOCK_SIZE_M": 64,
        "BLOCK_SIZE_N": 128,
        "BLOCK_SIZE_K": 32,
        "GROUP_SIZE_M": 8,
        "num_stages": 3,
        "num_warps": 2,
        "ms": 0.0278709027916193,
        "min_ms": 0.0278709027916193,
        "max_ms": 0.0278709027916193,
        "compile_time": 0.761573314666748
    },
    {
        "BLOCK_SIZE_M": 64,
        "BLOCK_SIZE_N": 32,
        "BLOCK_SIZE_K": 64,
        "GROUP_SIZE_M": 8,
        "num_stages": 5,
        "num_warps": 8,
        "ms": 0.027872473001480103,
        "min_ms": 0.027872473001480103,
        "max_ms": 0.027872473001480103,
        "compile_time": 0.6960701942443848
    },
    {
        "BLOCK_SIZE_M": 128,
        "BLOCK_SIZE_N": 32,
        "BLOCK_SIZE_K": 64,
        "GROUP_SIZE_M": 8,
        "num_stages": 5,
        "num_warps": 2,
        "ms": 0.027883553877472878,
        "min_ms": 0.027883553877472878,
        "max_ms": 0.027883553877472878,
        "compile_time": 0.7756011486053467
    },
    {
        "BLOCK_SIZE_M": 32,
        "BLOCK_SIZE_N": 64,
        "BLOCK_SIZE_K": 64,
        "GROUP_SIZE_M": 8,
        "num_stages": 5,
        "num_warps": 4,
        "ms": 0.027912259101867676,
        "min_ms": 0.027912259101867676,
        "max_ms": 0.027912259101867676,
        "compile_time": 0.7139503955841064
    },
    {
        "BLOCK_SIZE_M": 64,
        "BLOCK_SIZE_N": 128,
        "BLOCK_SIZE_K": 32,
        "GROUP_SIZE_M": 8,
        "num_stages": 4,
        "num_warps": 2,
        "ms": 0.027929434552788734,
        "min_ms": 0.027929434552788734,
        "max_ms": 0.027929434552788734,
        "compile_time": 0.7576651573181152
    },
    {
        "BLOCK_SIZE_M": 32,
        "BLOCK_SIZE_N": 128,
        "BLOCK_SIZE_K": 64,
        "GROUP_SIZE_M": 8,
        "num_stages": 4,
        "num_warps": 4,
        "ms": 0.027947891503572464,
        "min_ms": 0.027947891503572464,
        "max_ms": 0.027947891503572464,
        "compile_time": 0.690838098526001
    },
    {
        "BLOCK_SIZE_M": 32,
        "BLOCK_SIZE_N": 256,
        "BLOCK_SIZE_K": 16,
        "GROUP_SIZE_M": 8,
        "num_stages": 5,
        "num_warps": 4,
        "ms": 0.027950774878263474,
        "min_ms": 0.027950774878263474,
        "max_ms": 0.027950774878263474,
        "compile_time": 1.4049973487854004
    },
    {
        "BLOCK_SIZE_M": 32,
        "BLOCK_SIZE_N": 128,
        "BLOCK_SIZE_K": 32,
        "GROUP_SIZE_M": 8,
        "num_stages": 8,
        "num_warps": 2,
        "ms": 0.02796122431755066,
        "min_ms": 0.02796122431755066,
        "max_ms": 0.02796122431755066,
        "compile_time": 1.6104340553283691
    },
    {
        "BLOCK_SIZE_M": 128,
        "BLOCK_SIZE_N": 128,
        "BLOCK_SIZE_K": 128,
        "GROUP_SIZE_M": 8,
        "num_stages": 1,
        "num_warps": 16,
        "ms": 0.02796597220003605,
        "min_ms": 0.02796597220003605,
        "max_ms": 0.02796597220003605,
        "compile_time": 0.7879860401153564
    },
    {
        "BLOCK_SIZE_M": 64,
        "BLOCK_SIZE_N": 256,
        "BLOCK_SIZE_K": 256,
        "GROUP_SIZE_M": 8,
        "num_stages": 1,
        "num_warps": 16,
        "ms": 0.027971113100647926,
        "min_ms": 0.027971113100647926,
        "max_ms": 0.027971113100647926,
        "compile_time": 0.7622470855712891
    },
    {
        "BLOCK_SIZE_M": 32,
        "BLOCK_SIZE_N": 128,
        "BLOCK_SIZE_K": 128,
        "GROUP_SIZE_M": 8,
        "num_stages": 3,
        "num_warps": 4,
        "ms": 0.027982259169220924,
        "min_ms": 0.027982259169220924,
        "max_ms": 0.027982259169220924,
        "compile_time": 0.6903073787689209
    },
    {
        "BLOCK_SIZE_M": 128,
        "BLOCK_SIZE_N": 64,
        "BLOCK_SIZE_K": 32,
        "GROUP_SIZE_M": 8,
        "num_stages": 4,
        "num_warps": 2,
        "ms": 0.028013695031404495,
        "min_ms": 0.028013695031404495,
        "max_ms": 0.028013695031404495,
        "compile_time": 0.7775673866271973
    },
    {
        "BLOCK_SIZE_M": 64,
        "BLOCK_SIZE_N": 128,
        "BLOCK_SIZE_K": 16,
        "GROUP_SIZE_M": 8,
        "num_stages": 3,
        "num_warps": 4,
        "ms": 0.028030330315232277,
        "min_ms": 0.028030330315232277,
        "max_ms": 0.028030330315232277,
        "compile_time": 1.3240656852722168
    },
    {
        "BLOCK_SIZE_M": 128,
        "BLOCK_SIZE_N": 64,
        "BLOCK_SIZE_K": 32,
        "GROUP_SIZE_M": 8,
        "num_stages": 3,
        "num_warps": 2,
        "ms": 0.02806767262518406,
        "min_ms": 0.02806767262518406,
        "max_ms": 0.02806767262518406,
        "compile_time": 0.7839608192443848
    },
    {
        "BLOCK_SIZE_M": 32,
        "BLOCK_SIZE_N": 64,
        "BLOCK_SIZE_K": 128,
        "GROUP_SIZE_M": 8,
        "num_stages": 4,
        "num_warps": 8,
        "ms": 0.028080511838197708,
        "min_ms": 0.028080511838197708,
        "max_ms": 0.028080511838197708,
        "compile_time": 0.6875948905944824
    },
    {
        "BLOCK_SIZE_M": 128,
        "BLOCK_SIZE_N": 128,
        "BLOCK_SIZE_K": 256,
        "GROUP_SIZE_M": 8,
        "num_stages": 2,
        "num_warps": 16,
        "ms": 0.028128081932663918,
        "min_ms": 0.028128081932663918,
        "max_ms": 0.028128081932663918,
        "compile_time": 0.7811703681945801
    },
    {
        "BLOCK_SIZE_M": 128,
        "BLOCK_SIZE_N": 32,
        "BLOCK_SIZE_K": 64,
        "GROUP_SIZE_M": 8,
        "num_stages": 6,
        "num_warps": 8,
        "ms": 0.02812877669930458,
        "min_ms": 0.02812877669930458,
        "max_ms": 0.02812877669930458,
        "compile_time": 1.420809030532837
    },
    {
        "BLOCK_SIZE_M": 32,
        "BLOCK_SIZE_N": 64,
        "BLOCK_SIZE_K": 64,
        "GROUP_SIZE_M": 8,
        "num_stages": 7,
        "num_warps": 2,
        "ms": 0.028131818398833275,
        "min_ms": 0.028131818398833275,
        "max_ms": 0.028131818398833275,
        "compile_time": 1.5422163009643555
    },
    {
        "BLOCK_SIZE_M": 32,
        "BLOCK_SIZE_N": 256,
        "BLOCK_SIZE_K": 16,
        "GROUP_SIZE_M": 8,
        "num_stages": 4,
        "num_warps": 4,
        "ms": 0.028133440762758255,
        "min_ms": 0.028133440762758255,
        "max_ms": 0.028133440762758255,
        "compile_time": 1.3539559841156006
    },
    {
        "BLOCK_SIZE_M": 128,
        "BLOCK_SIZE_N": 128,
        "BLOCK_SIZE_K": 16,
        "GROUP_SIZE_M": 8,
        "num_stages": 8,
        "num_warps": 8,
        "ms": 0.02815466746687889,
        "min_ms": 0.02815466746687889,
        "max_ms": 0.02815466746687889,
        "compile_time": 1.4499306678771973
    },
    {
        "BLOCK_SIZE_M": 64,
        "BLOCK_SIZE_N": 64,
        "BLOCK_SIZE_K": 128,
        "GROUP_SIZE_M": 8,
        "num_stages": 3,
        "num_warps": 16,
        "ms": 0.02818986214697361,
        "min_ms": 0.02818986214697361,
        "max_ms": 0.02818986214697361,
        "compile_time": 0.7536835670471191
    },
    {
        "BLOCK_SIZE_M": 128,
        "BLOCK_SIZE_N": 128,
        "BLOCK_SIZE_K": 16,
        "GROUP_SIZE_M": 8,
        "num_stages": 4,
        "num_warps": 8,
        "ms": 0.028190815821290016,
        "min_ms": 0.028190815821290016,
        "max_ms": 0.028190815821290016,
        "compile_time": 1.4253709316253662
    },
    {
        "BLOCK_SIZE_M": 64,
        "BLOCK_SIZE_N": 32,
        "BLOCK_SIZE_K": 64,
        "GROUP_SIZE_M": 8,
        "num_stages": 6,
        "num_warps": 2,
        "ms": 0.028197601437568665,
        "min_ms": 0.028197601437568665,
        "max_ms": 0.028197601437568665,
        "compile_time": 1.6601579189300537
    },
    {
        "BLOCK_SIZE_M": 32,
        "BLOCK_SIZE_N": 128,
        "BLOCK_SIZE_K": 32,
        "GROUP_SIZE_M": 8,
        "num_stages": 4,
        "num_warps": 8,
        "ms": 0.02820199728012085,
        "min_ms": 0.02820199728012085,
        "max_ms": 0.02820199728012085,
        "compile_time": 0.7054893970489502
    },
    {
        "BLOCK_SIZE_M": 64,
        "BLOCK_SIZE_N": 32,
        "BLOCK_SIZE_K": 32,
        "GROUP_SIZE_M": 8,
        "num_stages": 8,
        "num_warps": 2,
        "ms": 0.028204213827848434,
        "min_ms": 0.028204213827848434,
        "max_ms": 0.028204213827848434,
        "compile_time": 1.473647117614746
    },
    {
        "BLOCK_SIZE_M": 64,
        "BLOCK_SIZE_N": 128,
        "BLOCK_SIZE_K": 128,
        "GROUP_SIZE_M": 8,
        "num_stages": 1,
        "num_warps": 8,
        "ms": 0.028243768960237503,
        "min_ms": 0.028243768960237503,
        "max_ms": 0.028243768960237503,
        "compile_time": 0.7632200717926025
    },
    {
        "BLOCK_SIZE_M": 256,
        "BLOCK_SIZE_N": 32,
        "BLOCK_SIZE_K": 64,
        "GROUP_SIZE_M": 8,
        "num_stages": 5,
        "num_warps": 4,
        "ms": 0.028250714763998985,
        "min_ms": 0.028250714763998985,
        "max_ms": 0.028250714763998985,
        "compile_time": 0.8203599452972412
    },
    {
        "BLOCK_SIZE_M": 128,
        "BLOCK_SIZE_N": 128,
        "BLOCK_SIZE_K": 16,
        "GROUP_SIZE_M": 8,
        "num_stages": 8,
        "num_warps": 4,
        "ms": 0.028270293027162552,
        "min_ms": 0.028270293027162552,
        "max_ms": 0.028270293027162552,
        "compile_time": 1.7903659343719482
    },
    {
        "BLOCK_SIZE_M": 32,
        "BLOCK_SIZE_N": 128,
        "BLOCK_SIZE_K": 128,
        "GROUP_SIZE_M": 8,
        "num_stages": 1,
        "num_warps": 4,
        "ms": 0.028288444504141808,
        "min_ms": 0.028288444504141808,
        "max_ms": 0.028288444504141808,
        "compile_time": 0.7140493392944336
    },
    {
        "BLOCK_SIZE_M": 32,
        "BLOCK_SIZE_N": 256,
        "BLOCK_SIZE_K": 32,
        "GROUP_SIZE_M": 8,
        "num_stages": 2,
        "num_warps": 4,
        "ms": 0.028296267613768578,
        "min_ms": 0.028296267613768578,
        "max_ms": 0.028296267613768578,
        "compile_time": 0.729733943939209
    },
    {
        "BLOCK_SIZE_M": 128,
        "BLOCK_SIZE_N": 64,
        "BLOCK_SIZE_K": 32,
        "GROUP_SIZE_M": 8,
        "num_stages": 5,
        "num_warps": 2,
        "ms": 0.02830415405333042,
        "min_ms": 0.02830415405333042,
        "max_ms": 0.02830415405333042,
        "compile_time": 0.7967619895935059
    },
    {
        "BLOCK_SIZE_M": 32,
        "BLOCK_SIZE_N": 128,
        "BLOCK_SIZE_K": 32,
        "GROUP_SIZE_M": 8,
        "num_stages": 5,
        "num_warps": 8,
        "ms": 0.028305212035775185,
        "min_ms": 0.028305212035775185,
        "max_ms": 0.028305212035775185,
        "compile_time": 0.7218661308288574
    },
    {
        "BLOCK_SIZE_M": 64,
        "BLOCK_SIZE_N": 128,
        "BLOCK_SIZE_K": 32,
        "GROUP_SIZE_M": 8,
        "num_stages": 5,
        "num_warps": 2,
        "ms": 0.0283244289457798,
        "min_ms": 0.0283244289457798,
        "max_ms": 0.0283244289457798,
        "compile_time": 0.7737483978271484
    },
    {
        "BLOCK_SIZE_M": 128,
        "BLOCK_SIZE_N": 32,
        "BLOCK_SIZE_K": 64,
        "GROUP_SIZE_M": 8,
        "num_stages": 4,
        "num_warps": 4,
        "ms": 0.028387922793626785,
        "min_ms": 0.028387922793626785,
        "max_ms": 0.028387922793626785,
        "compile_time": 0.7639350891113281
    },
    {
        "BLOCK_SIZE_M": 128,
        "BLOCK_SIZE_N": 128,
        "BLOCK_SIZE_K": 16,
        "GROUP_SIZE_M": 8,
        "num_stages": 3,
        "num_warps": 4,
        "ms": 0.02839117869734764,
        "min_ms": 0.02839117869734764,
        "max_ms": 0.02839117869734764,
        "compile_time": 1.7126033306121826
    },
    {
        "BLOCK_SIZE_M": 32,
        "BLOCK_SIZE_N": 256,
        "BLOCK_SIZE_K": 64,
        "GROUP_SIZE_M": 8,
        "num_stages": 5,
        "num_warps": 4,
        "ms": 0.028400251641869545,
        "min_ms": 0.028400251641869545,
        "max_ms": 0.028400251641869545,
        "compile_time": 0.8276228904724121
    },
    {
        "BLOCK_SIZE_M": 128,
        "BLOCK_SIZE_N": 64,
        "BLOCK_SIZE_K": 128,
        "GROUP_SIZE_M": 8,
        "num_stages": 1,
        "num_warps": 8,
        "ms": 0.02842344343662262,
        "min_ms": 0.02842344343662262,
        "max_ms": 0.02842344343662262,
        "compile_time": 0.784074068069458
    },
    {
        "BLOCK_SIZE_M": 128,
        "BLOCK_SIZE_N": 128,
        "BLOCK_SIZE_K": 16,
        "GROUP_SIZE_M": 8,
        "num_stages": 4,
        "num_warps": 4,
        "ms": 0.028440475463867188,
        "min_ms": 0.028440475463867188,
        "max_ms": 0.028440475463867188,
        "compile_time": 1.7413182258605957
    },
    {
        "BLOCK_SIZE_M": 128,
        "BLOCK_SIZE_N": 128,
        "BLOCK_SIZE_K": 16,
        "GROUP_SIZE_M": 8,
        "num_stages": 6,
        "num_warps": 8,
        "ms": 0.028454044833779335,
        "min_ms": 0.028454044833779335,
        "max_ms": 0.028454044833779335,
        "compile_time": 1.449704647064209
    },
    {
        "BLOCK_SIZE_M": 128,
        "BLOCK_SIZE_N": 32,
        "BLOCK_SIZE_K": 64,
        "GROUP_SIZE_M": 8,
        "num_stages": 5,
        "num_warps": 4,
        "ms": 0.02849627658724785,
        "min_ms": 0.02849627658724785,
        "max_ms": 0.02849627658724785,
        "compile_time": 0.770524263381958
    },
    {
        "BLOCK_SIZE_M": 256,
        "BLOCK_SIZE_N": 32,
        "BLOCK_SIZE_K": 64,
        "GROUP_SIZE_M": 8,
        "num_stages": 5,
        "num_warps": 8,
        "ms": 0.028502095490694046,
        "min_ms": 0.028502095490694046,
        "max_ms": 0.028502095490694046,
        "compile_time": 0.8137247562408447
    },
    {
        "BLOCK_SIZE_M": 32,
        "BLOCK_SIZE_N": 64,
        "BLOCK_SIZE_K": 16,
        "GROUP_SIZE_M": 8,
        "num_stages": 3,
        "num_warps": 2,
        "ms": 0.02850332297384739,
        "min_ms": 0.02850332297384739,
        "max_ms": 0.02850332297384739,
        "compile_time": 1.1509926319122314
    },
    {
        "BLOCK_SIZE_M": 256,
        "BLOCK_SIZE_N": 32,
        "BLOCK_SIZE_K": 32,
        "GROUP_SIZE_M": 8,
        "num_stages": 6,
        "num_warps": 4,
        "ms": 0.028505291789770126,
        "min_ms": 0.028505291789770126,
        "max_ms": 0.028505291789770126,
        "compile_time": 1.777334451675415
    },
    {
        "BLOCK_SIZE_M": 64,
        "BLOCK_SIZE_N": 256,
        "BLOCK_SIZE_K": 256,
        "GROUP_SIZE_M": 8,
        "num_stages": 1,
        "num_warps": 8,
        "ms": 0.02850956842303276,
        "min_ms": 0.02850956842303276,
        "max_ms": 0.02850956842303276,
        "compile_time": 0.7588531970977783
    },
    {
        "BLOCK_SIZE_M": 32,
        "BLOCK_SIZE_N": 128,
        "BLOCK_SIZE_K": 64,
        "GROUP_SIZE_M": 8,
        "num_stages": 7,
        "num_warps": 8,
        "ms": 0.02850998379290104,
        "min_ms": 0.02850998379290104,
        "max_ms": 0.02850998379290104,
        "compile_time": 1.2898814678192139
    },
    {
        "BLOCK_SIZE_M": 32,
        "BLOCK_SIZE_N": 64,
        "BLOCK_SIZE_K": 64,
        "GROUP_SIZE_M": 8,
        "num_stages": 7,
        "num_warps": 8,
        "ms": 0.028520965948700905,
        "min_ms": 0.028520965948700905,
        "max_ms": 0.028520965948700905,
        "compile_time": 1.1722240447998047
    },
    {
        "BLOCK_SIZE_M": 128,
        "BLOCK_SIZE_N": 128,
        "BLOCK_SIZE_K": 16,
        "GROUP_SIZE_M": 8,
        "num_stages": 5,
        "num_warps": 4,
        "ms": 0.028532976284623146,
        "min_ms": 0.028532976284623146,
        "max_ms": 0.028532976284623146,
        "compile_time": 1.760927438735962
    },
    {
        "BLOCK_SIZE_M": 256,
        "BLOCK_SIZE_N": 64,
        "BLOCK_SIZE_K": 64,
        "GROUP_SIZE_M": 8,
        "num_stages": 2,
        "num_warps": 16,
        "ms": 0.028537821024656296,
        "min_ms": 0.028537821024656296,
        "max_ms": 0.028537821024656296,
        "compile_time": 0.8342077732086182
    },
    {
        "BLOCK_SIZE_M": 64,
        "BLOCK_SIZE_N": 256,
        "BLOCK_SIZE_K": 256,
        "GROUP_SIZE_M": 8,
        "num_stages": 2,
        "num_warps": 8,
        "ms": 0.028555821627378464,
        "min_ms": 0.028555821627378464,
        "max_ms": 0.028555821627378464,
        "compile_time": 0.7578086853027344
    },
    {
        "BLOCK_SIZE_M": 128,
        "BLOCK_SIZE_N": 128,
        "BLOCK_SIZE_K": 16,
        "GROUP_SIZE_M": 8,
        "num_stages": 7,
        "num_warps": 8,
        "ms": 0.028585832566022873,
        "min_ms": 0.028585832566022873,
        "max_ms": 0.028585832566022873,
        "compile_time": 1.4345734119415283
    },
    {
        "BLOCK_SIZE_M": 64,
        "BLOCK_SIZE_N": 128,
        "BLOCK_SIZE_K": 128,
        "GROUP_SIZE_M": 8,
        "num_stages": 1,
        "num_warps": 4,
        "ms": 0.02860940992832184,
        "min_ms": 0.02860940992832184,
        "max_ms": 0.02860940992832184,
        "compile_time": 0.7474365234375
    },
    {
        "BLOCK_SIZE_M": 32,
        "BLOCK_SIZE_N": 256,
        "BLOCK_SIZE_K": 32,
        "GROUP_SIZE_M": 8,
        "num_stages": 8,
        "num_warps": 4,
        "ms": 0.028616195544600487,
        "min_ms": 0.028616195544600487,
        "max_ms": 0.028616195544600487,
        "compile_time": 1.7711491584777832
    },
    {
        "BLOCK_SIZE_M": 64,
        "BLOCK_SIZE_N": 32,
        "BLOCK_SIZE_K": 64,
        "GROUP_SIZE_M": 8,
        "num_stages": 7,
        "num_warps": 2,
        "ms": 0.028617089614272118,
        "min_ms": 0.028617089614272118,
        "max_ms": 0.028617089614272118,
        "compile_time": 1.6797962188720703
    },
    {
        "BLOCK_SIZE_M": 128,
        "BLOCK_SIZE_N": 128,
        "BLOCK_SIZE_K": 16,
        "GROUP_SIZE_M": 8,
        "num_stages": 6,
        "num_warps": 4,
        "ms": 0.028622150421142578,
        "min_ms": 0.028622150421142578,
        "max_ms": 0.028622150421142578,
        "compile_time": 1.7890849113464355
    },
    {
        "BLOCK_SIZE_M": 256,
        "BLOCK_SIZE_N": 32,
        "BLOCK_SIZE_K": 32,
        "GROUP_SIZE_M": 8,
        "num_stages": 2,
        "num_warps": 4,
        "ms": 0.028646081686019897,
        "min_ms": 0.028646081686019897,
        "max_ms": 0.028646081686019897,
        "compile_time": 0.8260011672973633
    },
    {
        "BLOCK_SIZE_M": 256,
        "BLOCK_SIZE_N": 64,
        "BLOCK_SIZE_K": 128,
        "GROUP_SIZE_M": 8,
        "num_stages": 2,
        "num_warps": 16,
        "ms": 0.0286608524620533,
        "min_ms": 0.0286608524620533,
        "max_ms": 0.0286608524620533,
        "compile_time": 0.8420910835266113
    },
    {
        "BLOCK_SIZE_M": 128,
        "BLOCK_SIZE_N": 32,
        "BLOCK_SIZE_K": 128,
        "GROUP_SIZE_M": 8,
        "num_stages": 5,
        "num_warps": 4,
        "ms": 0.028667155653238297,
        "min_ms": 0.028667155653238297,
        "max_ms": 0.028667155653238297,
        "compile_time": 0.7800266742706299
    },
    {
        "BLOCK_SIZE_M": 128,
        "BLOCK_SIZE_N": 128,
        "BLOCK_SIZE_K": 16,
        "GROUP_SIZE_M": 8,
        "num_stages": 3,
        "num_warps": 8,
        "ms": 0.028669431805610657,
        "min_ms": 0.028669431805610657,
        "max_ms": 0.028669431805610657,
        "compile_time": 1.4143280982971191
    },
    {
        "BLOCK_SIZE_M": 32,
        "BLOCK_SIZE_N": 64,
        "BLOCK_SIZE_K": 128,
        "GROUP_SIZE_M": 8,
        "num_stages": 1,
        "num_warps": 4,
        "ms": 0.028678271919488907,
        "min_ms": 0.028678271919488907,
        "max_ms": 0.028678271919488907,
        "compile_time": 0.7103867530822754
    },
    {
        "BLOCK_SIZE_M": 32,
        "BLOCK_SIZE_N": 128,
        "BLOCK_SIZE_K": 128,
        "GROUP_SIZE_M": 8,
        "num_stages": 3,
        "num_warps": 2,
        "ms": 0.028715070337057114,
        "min_ms": 0.028715070337057114,
        "max_ms": 0.028715070337057114,
        "compile_time": 0.6954362392425537
    },
    {
        "BLOCK_SIZE_M": 128,
        "BLOCK_SIZE_N": 256,
        "BLOCK_SIZE_K": 32,
        "GROUP_SIZE_M": 8,
        "num_stages": 4,
        "num_warps": 8,
        "ms": 0.02871551178395748,
        "min_ms": 0.02871551178395748,
        "max_ms": 0.02871551178395748,
        "compile_time": 0.8138036727905273
    },
    {
        "BLOCK_SIZE_M": 256,
        "BLOCK_SIZE_N": 128,
        "BLOCK_SIZE_K": 32,
        "GROUP_SIZE_M": 8,
        "num_stages": 4,
        "num_warps": 8,
        "ms": 0.028723444789648056,
        "min_ms": 0.028723444789648056,
        "max_ms": 0.028723444789648056,
        "compile_time": 0.8308465480804443
    },
    {
        "BLOCK_SIZE_M": 32,
        "BLOCK_SIZE_N": 256,
        "BLOCK_SIZE_K": 16,
        "GROUP_SIZE_M": 8,
        "num_stages": 3,
        "num_warps": 4,
        "ms": 0.028728505596518517,
        "min_ms": 0.028728505596518517,
        "max_ms": 0.028728505596518517,
        "compile_time": 1.3021433353424072
    },
    {
        "BLOCK_SIZE_M": 128,
        "BLOCK_SIZE_N": 128,
        "BLOCK_SIZE_K": 16,
        "GROUP_SIZE_M": 8,
        "num_stages": 7,
        "num_warps": 4,
        "ms": 0.028739631175994873,
        "min_ms": 0.028739631175994873,
        "max_ms": 0.028739631175994873,
        "compile_time": 1.7965326309204102
    },
    {
        "BLOCK_SIZE_M": 64,
        "BLOCK_SIZE_N": 128,
        "BLOCK_SIZE_K": 32,
        "GROUP_SIZE_M": 8,
        "num_stages": 6,
        "num_warps": 2,
        "ms": 0.028749028220772743,
        "min_ms": 0.028749028220772743,
        "max_ms": 0.028749028220772743,
        "compile_time": 2.0997562408447266
    },
    {
        "BLOCK_SIZE_M": 128,
        "BLOCK_SIZE_N": 32,
        "BLOCK_SIZE_K": 32,
        "GROUP_SIZE_M": 8,
        "num_stages": 3,
        "num_warps": 8,
        "ms": 0.028767000883817673,
        "min_ms": 0.028767000883817673,
        "max_ms": 0.028767000883817673,
        "compile_time": 0.7987213134765625
    },
    {
        "BLOCK_SIZE_M": 32,
        "BLOCK_SIZE_N": 64,
        "BLOCK_SIZE_K": 128,
        "GROUP_SIZE_M": 8,
        "num_stages": 4,
        "num_warps": 2,
        "ms": 0.02878141961991787,
        "min_ms": 0.02878141961991787,
        "max_ms": 0.02878141961991787,
        "compile_time": 0.683190107345581
    },
    {
        "BLOCK_SIZE_M": 128,
        "BLOCK_SIZE_N": 64,
        "BLOCK_SIZE_K": 32,
        "GROUP_SIZE_M": 8,
        "num_stages": 6,
        "num_warps": 2,
        "ms": 0.028785381466150284,
        "min_ms": 0.028785381466150284,
        "max_ms": 0.028785381466150284,
        "compile_time": 2.1322226524353027
    },
    {
        "BLOCK_SIZE_M": 128,
        "BLOCK_SIZE_N": 128,
        "BLOCK_SIZE_K": 128,
        "GROUP_SIZE_M": 8,
        "num_stages": 3,
        "num_warps": 32,
        "ms": 0.02878735400736332,
        "min_ms": 0.02878735400736332,
        "max_ms": 0.02878735400736332,
        "compile_time": 0.7725012302398682
    },
    {
        "BLOCK_SIZE_M": 128,
        "BLOCK_SIZE_N": 128,
        "BLOCK_SIZE_K": 16,
        "GROUP_SIZE_M": 8,
        "num_stages": 5,
        "num_warps": 8,
        "ms": 0.028837531805038452,
        "min_ms": 0.028837531805038452,
        "max_ms": 0.028837531805038452,
        "compile_time": 1.4740686416625977
    },
    {
        "BLOCK_SIZE_M": 64,
        "BLOCK_SIZE_N": 32,
        "BLOCK_SIZE_K": 64,
        "GROUP_SIZE_M": 8,
        "num_stages": 6,
        "num_warps": 8,
        "ms": 0.028864288702607155,
        "min_ms": 0.028864288702607155,
        "max_ms": 0.028864288702607155,
        "compile_time": 1.286614179611206
    },
    {
        "BLOCK_SIZE_M": 64,
        "BLOCK_SIZE_N": 64,
        "BLOCK_SIZE_K": 128,
        "GROUP_SIZE_M": 8,
        "num_stages": 6,
        "num_warps": 8,
        "ms": 0.028873801231384277,
        "min_ms": 0.028873801231384277,
        "max_ms": 0.028873801231384277,
        "compile_time": 1.4352309703826904
    },
    {
        "BLOCK_SIZE_M": 32,
        "BLOCK_SIZE_N": 128,
        "BLOCK_SIZE_K": 256,
        "GROUP_SIZE_M": 8,
        "num_stages": 3,
        "num_warps": 4,
        "ms": 0.02893052063882351,
        "min_ms": 0.02893052063882351,
        "max_ms": 0.02893052063882351,
        "compile_time": 0.7245123386383057
    },
    {
        "BLOCK_SIZE_M": 32,
        "BLOCK_SIZE_N": 128,
        "BLOCK_SIZE_K": 256,
        "GROUP_SIZE_M": 8,
        "num_stages": 2,
        "num_warps": 4,
        "ms": 0.02894389070570469,
        "min_ms": 0.02894389070570469,
        "max_ms": 0.02894389070570469,
        "compile_time": 0.6688237190246582
    },
    {
        "BLOCK_SIZE_M": 64,
        "BLOCK_SIZE_N": 32,
        "BLOCK_SIZE_K": 64,
        "GROUP_SIZE_M": 8,
        "num_stages": 1,
        "num_warps": 2,
        "ms": 0.028949588537216187,
        "min_ms": 0.028949588537216187,
        "max_ms": 0.028949588537216187,
        "compile_time": 0.7559468746185303
    },
    {
        "BLOCK_SIZE_M": 128,
        "BLOCK_SIZE_N": 256,
        "BLOCK_SIZE_K": 32,
        "GROUP_SIZE_M": 8,
        "num_stages": 5,
        "num_warps": 8,
        "ms": 0.028950702399015427,
        "min_ms": 0.028950702399015427,
        "max_ms": 0.028950702399015427,
        "compile_time": 0.8058416843414307
    },
    {
        "BLOCK_SIZE_M": 64,
        "BLOCK_SIZE_N": 256,
        "BLOCK_SIZE_K": 32,
        "GROUP_SIZE_M": 8,
        "num_stages": 2,
        "num_warps": 8,
        "ms": 0.028963247314095497,
        "min_ms": 0.028963247314095497,
        "max_ms": 0.028963247314095497,
        "compile_time": 0.755563497543335
    },
    {
        "BLOCK_SIZE_M": 256,
        "BLOCK_SIZE_N": 32,
        "BLOCK_SIZE_K": 32,
        "GROUP_SIZE_M": 8,
        "num_stages": 7,
        "num_warps": 4,
        "ms": 0.02896650694310665,
        "min_ms": 0.02896650694310665,
        "max_ms": 0.02896650694310665,
        "compile_time": 1.7954144477844238
    },
    {
        "BLOCK_SIZE_M": 128,
        "BLOCK_SIZE_N": 256,
        "BLOCK_SIZE_K": 32,
        "GROUP_SIZE_M": 8,
        "num_stages": 3,
        "num_warps": 8,
        "ms": 0.02896779216825962,
        "min_ms": 0.02896779216825962,
        "max_ms": 0.02896779216825962,
        "compile_time": 0.7860398292541504
    },
    {
        "BLOCK_SIZE_M": 256,
        "BLOCK_SIZE_N": 64,
        "BLOCK_SIZE_K": 32,
        "GROUP_SIZE_M": 8,
        "num_stages": 2,
        "num_warps": 8,
        "ms": 0.028971344232559204,
        "min_ms": 0.028971344232559204,
        "max_ms": 0.028971344232559204,
        "compile_time": 0.840895414352417
    },
    {
        "BLOCK_SIZE_M": 64,
        "BLOCK_SIZE_N": 128,
        "BLOCK_SIZE_K": 32,
        "GROUP_SIZE_M": 8,
        "num_stages": 7,
        "num_warps": 2,
        "ms": 0.02898573875427246,
        "min_ms": 0.02898573875427246,
        "max_ms": 0.02898573875427246,
        "compile_time": 2.11460018157959
    },
    {
        "BLOCK_SIZE_M": 32,
        "BLOCK_SIZE_N": 512,
        "BLOCK_SIZE_K": 16,
        "GROUP_SIZE_M": 8,
        "num_stages": 6,
        "num_warps": 4,
        "ms": 0.028999900445342064,
        "min_ms": 0.028999900445342064,
        "max_ms": 0.028999900445342064,
        "compile_time": 1.872892141342163
    },
    {
        "BLOCK_SIZE_M": 128,
        "BLOCK_SIZE_N": 256,
        "BLOCK_SIZE_K": 32,
        "GROUP_SIZE_M": 8,
        "num_stages": 6,
        "num_warps": 8,
        "ms": 0.029008764773607254,
        "min_ms": 0.029008764773607254,
        "max_ms": 0.029008764773607254,
        "compile_time": 2.0270514488220215
    },
    {
        "BLOCK_SIZE_M": 32,
        "BLOCK_SIZE_N": 128,
        "BLOCK_SIZE_K": 32,
        "GROUP_SIZE_M": 8,
        "num_stages": 6,
        "num_warps": 8,
        "ms": 0.02903304435312748,
        "min_ms": 0.02903304435312748,
        "max_ms": 0.02903304435312748,
        "compile_time": 1.1572940349578857
    },
    {
        "BLOCK_SIZE_M": 64,
        "BLOCK_SIZE_N": 256,
        "BLOCK_SIZE_K": 64,
        "GROUP_SIZE_M": 8,
        "num_stages": 2,
        "num_warps": 4,
        "ms": 0.029062632471323013,
        "min_ms": 0.029062632471323013,
        "max_ms": 0.029062632471323013,
        "compile_time": 0.7584874629974365
    },
    {
        "BLOCK_SIZE_M": 32,
        "BLOCK_SIZE_N": 512,
        "BLOCK_SIZE_K": 16,
        "GROUP_SIZE_M": 8,
        "num_stages": 4,
        "num_warps": 4,
        "ms": 0.02907273732125759,
        "min_ms": 0.02907273732125759,
        "max_ms": 0.02907273732125759,
        "compile_time": 1.7568328380584717
    },
    {
        "BLOCK_SIZE_M": 64,
        "BLOCK_SIZE_N": 64,
        "BLOCK_SIZE_K": 256,
        "GROUP_SIZE_M": 8,
        "num_stages": 3,
        "num_warps": 8,
        "ms": 0.029080122709274292,
        "min_ms": 0.029080122709274292,
        "max_ms": 0.029080122709274292,
        "compile_time": 0.7677974700927734
    },
    {
        "BLOCK_SIZE_M": 128,
        "BLOCK_SIZE_N": 32,
        "BLOCK_SIZE_K": 64,
        "GROUP_SIZE_M": 8,
        "num_stages": 7,
        "num_warps": 8,
        "ms": 0.029083747416734695,
        "min_ms": 0.029083747416734695,
        "max_ms": 0.029083747416734695,
        "compile_time": 1.4596989154815674
    },
    {
        "BLOCK_SIZE_M": 64,
        "BLOCK_SIZE_N": 256,
        "BLOCK_SIZE_K": 64,
        "GROUP_SIZE_M": 8,
        "num_stages": 2,
        "num_warps": 16,
        "ms": 0.02908858098089695,
        "min_ms": 0.02908858098089695,
        "max_ms": 0.02908858098089695,
        "compile_time": 0.77305006980896
    },
    {
        "BLOCK_SIZE_M": 64,
        "BLOCK_SIZE_N": 128,
        "BLOCK_SIZE_K": 32,
        "GROUP_SIZE_M": 8,
        "num_stages": 1,
        "num_warps": 8,
        "ms": 0.02911441959440708,
        "min_ms": 0.02911441959440708,
        "max_ms": 0.02911441959440708,
        "compile_time": 0.7599427700042725
    },
    {
        "BLOCK_SIZE_M": 32,
        "BLOCK_SIZE_N": 512,
        "BLOCK_SIZE_K": 16,
        "GROUP_SIZE_M": 8,
        "num_stages": 5,
        "num_warps": 4,
        "ms": 0.029126157984137535,
        "min_ms": 0.029126157984137535,
        "max_ms": 0.029126157984137535,
        "compile_time": 1.7862930297851562
    },
    {
        "BLOCK_SIZE_M": 32,
        "BLOCK_SIZE_N": 128,
        "BLOCK_SIZE_K": 64,
        "GROUP_SIZE_M": 8,
        "num_stages": 5,
        "num_warps": 4,
        "ms": 0.02914457395672798,
        "min_ms": 0.02914457395672798,
        "max_ms": 0.02914457395672798,
        "compile_time": 0.7081706523895264
    },
    {
        "BLOCK_SIZE_M": 32,
        "BLOCK_SIZE_N": 512,
        "BLOCK_SIZE_K": 16,
        "GROUP_SIZE_M": 8,
        "num_stages": 7,
        "num_warps": 4,
        "ms": 0.029149770736694336,
        "min_ms": 0.029149770736694336,
        "max_ms": 0.029149770736694336,
        "compile_time": 1.8948907852172852
    },
    {
        "BLOCK_SIZE_M": 64,
        "BLOCK_SIZE_N": 32,
        "BLOCK_SIZE_K": 128,
        "GROUP_SIZE_M": 8,
        "num_stages": 4,
        "num_warps": 8,
        "ms": 0.029159357771277428,
        "min_ms": 0.029159357771277428,
        "max_ms": 0.029159357771277428,
        "compile_time": 0.7658588886260986
    },
    {
        "BLOCK_SIZE_M": 256,
        "BLOCK_SIZE_N": 32,
        "BLOCK_SIZE_K": 32,
        "GROUP_SIZE_M": 8,
        "num_stages": 3,
        "num_warps": 8,
        "ms": 0.029166067019104958,
        "min_ms": 0.029166067019104958,
        "max_ms": 0.029166067019104958,
        "compile_time": 0.8201251029968262
    },
    {
        "BLOCK_SIZE_M": 32,
        "BLOCK_SIZE_N": 256,
        "BLOCK_SIZE_K": 64,
        "GROUP_SIZE_M": 8,
        "num_stages": 5,
        "num_warps": 8,
        "ms": 0.02918434701859951,
        "min_ms": 0.02918434701859951,
        "max_ms": 0.02918434701859951,
        "compile_time": 0.8364195823669434
    },
    {
        "BLOCK_SIZE_M": 256,
        "BLOCK_SIZE_N": 64,
        "BLOCK_SIZE_K": 128,
        "GROUP_SIZE_M": 8,
        "num_stages": 1,
        "num_warps": 8,
        "ms": 0.029199134558439255,
        "min_ms": 0.029199134558439255,
        "max_ms": 0.029199134558439255,
        "compile_time": 0.8506286144256592
    },
    {
        "BLOCK_SIZE_M": 64,
        "BLOCK_SIZE_N": 256,
        "BLOCK_SIZE_K": 128,
        "GROUP_SIZE_M": 8,
        "num_stages": 2,
        "num_warps": 16,
        "ms": 0.029220212250947952,
        "min_ms": 0.029220212250947952,
        "max_ms": 0.029220212250947952,
        "compile_time": 0.7632846832275391
    },
    {
        "BLOCK_SIZE_M": 256,
        "BLOCK_SIZE_N": 128,
        "BLOCK_SIZE_K": 32,
        "GROUP_SIZE_M": 8,
        "num_stages": 6,
        "num_warps": 8,
        "ms": 0.029222149401903152,
        "min_ms": 0.029222149401903152,
        "max_ms": 0.029222149401903152,
        "compile_time": 2.085176706314087
    },
    {
        "BLOCK_SIZE_M": 128,
        "BLOCK_SIZE_N": 32,
        "BLOCK_SIZE_K": 32,
        "GROUP_SIZE_M": 8,
        "num_stages": 4,
        "num_warps": 8,
        "ms": 0.029226267710328102,
        "min_ms": 0.029226267710328102,
        "max_ms": 0.029226267710328102,
        "compile_time": 0.7881457805633545
    },
    {
        "BLOCK_SIZE_M": 32,
        "BLOCK_SIZE_N": 256,
        "BLOCK_SIZE_K": 128,
        "GROUP_SIZE_M": 8,
        "num_stages": 3,
        "num_warps": 8,
        "ms": 0.029233524575829506,
        "min_ms": 0.029233524575829506,
        "max_ms": 0.029233524575829506,
        "compile_time": 0.8235540390014648
    },
    {
        "BLOCK_SIZE_M": 128,
        "BLOCK_SIZE_N": 64,
        "BLOCK_SIZE_K": 32,
        "GROUP_SIZE_M": 8,
        "num_stages": 7,
        "num_warps": 2,
        "ms": 0.0292457677423954,
        "min_ms": 0.0292457677423954,
        "max_ms": 0.0292457677423954,
        "compile_time": 2.2156307697296143
    },
    {
        "BLOCK_SIZE_M": 32,
        "BLOCK_SIZE_N": 256,
        "BLOCK_SIZE_K": 16,
        "GROUP_SIZE_M": 8,
        "num_stages": 6,
        "num_warps": 4,
        "ms": 0.02924693189561367,
        "min_ms": 0.02924693189561367,
        "max_ms": 0.02924693189561367,
        "compile_time": 1.3735311031341553
    },
    {
        "BLOCK_SIZE_M": 256,
        "BLOCK_SIZE_N": 128,
        "BLOCK_SIZE_K": 32,
        "GROUP_SIZE_M": 8,
        "num_stages": 5,
        "num_warps": 8,
        "ms": 0.029276419430971146,
        "min_ms": 0.029276419430971146,
        "max_ms": 0.029276419430971146,
        "compile_time": 0.8058671951293945
    },
    {
        "BLOCK_SIZE_M": 64,
        "BLOCK_SIZE_N": 64,
        "BLOCK_SIZE_K": 64,
        "GROUP_SIZE_M": 8,
        "num_stages": 3,
        "num_warps": 16,
        "ms": 0.02928468957543373,
        "min_ms": 0.02928468957543373,
        "max_ms": 0.02928468957543373,
        "compile_time": 0.733339786529541
    },
    {
        "BLOCK_SIZE_M": 32,
        "BLOCK_SIZE_N": 512,
        "BLOCK_SIZE_K": 16,
        "GROUP_SIZE_M": 8,
        "num_stages": 8,
        "num_warps": 4,
        "ms": 0.029326599091291428,
        "min_ms": 0.029326599091291428,
        "max_ms": 0.029326599091291428,
        "compile_time": 1.9123694896697998
    },
    {
        "BLOCK_SIZE_M": 32,
        "BLOCK_SIZE_N": 64,
        "BLOCK_SIZE_K": 128,
        "GROUP_SIZE_M": 8,
        "num_stages": 4,
        "num_warps": 4,
        "ms": 0.02932867780327797,
        "min_ms": 0.02932867780327797,
        "max_ms": 0.02932867780327797,
        "compile_time": 0.6652238368988037
    },
    {
        "BLOCK_SIZE_M": 32,
        "BLOCK_SIZE_N": 64,
        "BLOCK_SIZE_K": 64,
        "GROUP_SIZE_M": 8,
        "num_stages": 6,
        "num_warps": 4,
        "ms": 0.02933633327484131,
        "min_ms": 0.02933633327484131,
        "max_ms": 0.02933633327484131,
        "compile_time": 1.2870731353759766
    },
    {
        "BLOCK_SIZE_M": 256,
        "BLOCK_SIZE_N": 32,
        "BLOCK_SIZE_K": 128,
        "GROUP_SIZE_M": 8,
        "num_stages": 3,
        "num_warps": 4,
        "ms": 0.02933996543288231,
        "min_ms": 0.02933996543288231,
        "max_ms": 0.02933996543288231,
        "compile_time": 0.8573932647705078
    },
    {
        "BLOCK_SIZE_M": 32,
        "BLOCK_SIZE_N": 64,
        "BLOCK_SIZE_K": 64,
        "GROUP_SIZE_M": 8,
        "num_stages": 7,
        "num_warps": 4,
        "ms": 0.02936512604355812,
        "min_ms": 0.02936512604355812,
        "max_ms": 0.02936512604355812,
        "compile_time": 1.29132080078125
    },
    {
        "BLOCK_SIZE_M": 256,
        "BLOCK_SIZE_N": 128,
        "BLOCK_SIZE_K": 32,
        "GROUP_SIZE_M": 8,
        "num_stages": 3,
        "num_warps": 8,
        "ms": 0.02937723696231842,
        "min_ms": 0.02937723696231842,
        "max_ms": 0.02937723696231842,
        "compile_time": 0.8362958431243896
    },
    {
        "BLOCK_SIZE_M": 256,
        "BLOCK_SIZE_N": 32,
        "BLOCK_SIZE_K": 128,
        "GROUP_SIZE_M": 8,
        "num_stages": 3,
        "num_warps": 8,
        "ms": 0.029401054605841637,
        "min_ms": 0.029401054605841637,
        "max_ms": 0.029401054605841637,
        "compile_time": 0.8258745670318604
    },
    {
        "BLOCK_SIZE_M": 32,
        "BLOCK_SIZE_N": 256,
        "BLOCK_SIZE_K": 16,
        "GROUP_SIZE_M": 8,
        "num_stages": 8,
        "num_warps": 4,
        "ms": 0.02941839024424553,
        "min_ms": 0.02941839024424553,
        "max_ms": 0.02941839024424553,
        "compile_time": 1.445716142654419
    },
    {
        "BLOCK_SIZE_M": 32,
        "BLOCK_SIZE_N": 256,
        "BLOCK_SIZE_K": 16,
        "GROUP_SIZE_M": 8,
        "num_stages": 7,
        "num_warps": 4,
        "ms": 0.029439613223075867,
        "min_ms": 0.029439613223075867,
        "max_ms": 0.029439613223075867,
        "compile_time": 1.48207688331604
    },
    {
        "BLOCK_SIZE_M": 64,
        "BLOCK_SIZE_N": 128,
        "BLOCK_SIZE_K": 16,
        "GROUP_SIZE_M": 8,
        "num_stages": 5,
        "num_warps": 4,
        "ms": 0.029446613043546677,
        "min_ms": 0.029446613043546677,
        "max_ms": 0.029446613043546677,
        "compile_time": 1.3660888671875
    },
    {
        "BLOCK_SIZE_M": 32,
        "BLOCK_SIZE_N": 256,
        "BLOCK_SIZE_K": 128,
        "GROUP_SIZE_M": 8,
        "num_stages": 3,
        "num_warps": 4,
        "ms": 0.029460027813911438,
        "min_ms": 0.029460027813911438,
        "max_ms": 0.029460027813911438,
        "compile_time": 0.8068976402282715
    },
    {
        "BLOCK_SIZE_M": 32,
        "BLOCK_SIZE_N": 256,
        "BLOCK_SIZE_K": 32,
        "GROUP_SIZE_M": 8,
        "num_stages": 7,
        "num_warps": 8,
        "ms": 0.02948620915412903,
        "min_ms": 0.02948620915412903,
        "max_ms": 0.02948620915412903,
        "compile_time": 1.4378447532653809
    },
    {
        "BLOCK_SIZE_M": 128,
        "BLOCK_SIZE_N": 32,
        "BLOCK_SIZE_K": 64,
        "GROUP_SIZE_M": 8,
        "num_stages": 6,
        "num_warps": 2,
        "ms": 0.02949327602982521,
        "min_ms": 0.02949327602982521,
        "max_ms": 0.02949327602982521,
        "compile_time": 2.1549606323242188
    },
    {
        "BLOCK_SIZE_M": 128,
        "BLOCK_SIZE_N": 32,
        "BLOCK_SIZE_K": 32,
        "GROUP_SIZE_M": 8,
        "num_stages": 5,
        "num_warps": 8,
        "ms": 0.02949395217001438,
        "min_ms": 0.02949395217001438,
        "max_ms": 0.02949395217001438,
        "compile_time": 0.7661395072937012
    },
    {
        "BLOCK_SIZE_M": 128,
        "BLOCK_SIZE_N": 64,
        "BLOCK_SIZE_K": 64,
        "GROUP_SIZE_M": 8,
        "num_stages": 3,
        "num_warps": 16,
        "ms": 0.029505174607038498,
        "min_ms": 0.029505174607038498,
        "max_ms": 0.029505174607038498,
        "compile_time": 0.7799530029296875
    },
    {
        "BLOCK_SIZE_M": 256,
        "BLOCK_SIZE_N": 64,
        "BLOCK_SIZE_K": 16,
        "GROUP_SIZE_M": 8,
        "num_stages": 3,
        "num_warps": 4,
        "ms": 0.029507815837860107,
        "min_ms": 0.029507815837860107,
        "max_ms": 0.029507815837860107,
        "compile_time": 1.8772969245910645
    },
    {
        "BLOCK_SIZE_M": 256,
        "BLOCK_SIZE_N": 32,
        "BLOCK_SIZE_K": 32,
        "GROUP_SIZE_M": 8,
        "num_stages": 4,
        "num_warps": 8,
        "ms": 0.029508793726563454,
        "min_ms": 0.029508793726563454,
        "max_ms": 0.029508793726563454,
        "compile_time": 0.8404088020324707
    },
    {
        "BLOCK_SIZE_M": 128,
        "BLOCK_SIZE_N": 32,
        "BLOCK_SIZE_K": 128,
        "GROUP_SIZE_M": 8,
        "num_stages": 3,
        "num_warps": 2,
        "ms": 0.029514435678720474,
        "min_ms": 0.029514435678720474,
        "max_ms": 0.029514435678720474,
        "compile_time": 0.7551021575927734
    },
    {
        "BLOCK_SIZE_M": 128,
        "BLOCK_SIZE_N": 128,
        "BLOCK_SIZE_K": 64,
        "GROUP_SIZE_M": 8,
        "num_stages": 3,
        "num_warps": 32,
        "ms": 0.029518723487854004,
        "min_ms": 0.029518723487854004,
        "max_ms": 0.029518723487854004,
        "compile_time": 0.7873938083648682
    },
    {
        "BLOCK_SIZE_M": 256,
        "BLOCK_SIZE_N": 32,
        "BLOCK_SIZE_K": 32,
        "GROUP_SIZE_M": 8,
        "num_stages": 8,
        "num_warps": 4,
        "ms": 0.029545387253165245,
        "min_ms": 0.029545387253165245,
        "max_ms": 0.029545387253165245,
        "compile_time": 1.7720234394073486
    },
    {
        "BLOCK_SIZE_M": 256,
        "BLOCK_SIZE_N": 64,
        "BLOCK_SIZE_K": 16,
        "GROUP_SIZE_M": 8,
        "num_stages": 4,
        "num_warps": 4,
        "ms": 0.02955537661910057,
        "min_ms": 0.02955537661910057,
        "max_ms": 0.02955537661910057,
        "compile_time": 1.9135568141937256
    },
    {
        "BLOCK_SIZE_M": 128,
        "BLOCK_SIZE_N": 32,
        "BLOCK_SIZE_K": 64,
        "GROUP_SIZE_M": 8,
        "num_stages": 1,
        "num_warps": 2,
        "ms": 0.029556602239608765,
        "min_ms": 0.029556602239608765,
        "max_ms": 0.029556602239608765,
        "compile_time": 0.8037769794464111
    },
    {
        "BLOCK_SIZE_M": 32,
        "BLOCK_SIZE_N": 256,
        "BLOCK_SIZE_K": 32,
        "GROUP_SIZE_M": 8,
        "num_stages": 6,
        "num_warps": 8,
        "ms": 0.0295571181923151,
        "min_ms": 0.0295571181923151,
        "max_ms": 0.0295571181923151,
        "compile_time": 1.3278257846832275
    },
    {
        "BLOCK_SIZE_M": 128,
        "BLOCK_SIZE_N": 64,
        "BLOCK_SIZE_K": 128,
        "GROUP_SIZE_M": 8,
        "num_stages": 1,
        "num_warps": 4,
        "ms": 0.02956182137131691,
        "min_ms": 0.02956182137131691,
        "max_ms": 0.02956182137131691,
        "compile_time": 0.7965552806854248
    },
    {
        "BLOCK_SIZE_M": 128,
        "BLOCK_SIZE_N": 256,
        "BLOCK_SIZE_K": 32,
        "GROUP_SIZE_M": 8,
        "num_stages": 7,
        "num_warps": 8,
        "ms": 0.029595261439681053,
        "min_ms": 0.029595261439681053,
        "max_ms": 0.029595261439681053,
        "compile_time": 1.9230382442474365
    },
    {
        "BLOCK_SIZE_M": 256,
        "BLOCK_SIZE_N": 64,
        "BLOCK_SIZE_K": 256,
        "GROUP_SIZE_M": 8,
        "num_stages": 2,
        "num_warps": 8,
        "ms": 0.029613349586725235,
        "min_ms": 0.029613349586725235,
        "max_ms": 0.029613349586725235,
        "compile_time": 0.8273584842681885
    },
    {
        "BLOCK_SIZE_M": 64,
        "BLOCK_SIZE_N": 32,
        "BLOCK_SIZE_K": 64,
        "GROUP_SIZE_M": 8,
        "num_stages": 6,
        "num_warps": 4,
        "ms": 0.029665905982255936,
        "min_ms": 0.029665905982255936,
        "max_ms": 0.029665905982255936,
        "compile_time": 1.3966166973114014
    },
    {
        "BLOCK_SIZE_M": 128,
        "BLOCK_SIZE_N": 32,
        "BLOCK_SIZE_K": 64,
        "GROUP_SIZE_M": 8,
        "num_stages": 1,
        "num_warps": 4,
        "ms": 0.029670214280486107,
        "min_ms": 0.029670214280486107,
        "max_ms": 0.029670214280486107,
        "compile_time": 0.8022012710571289
    },
    {
        "BLOCK_SIZE_M": 128,
        "BLOCK_SIZE_N": 32,
        "BLOCK_SIZE_K": 128,
        "GROUP_SIZE_M": 8,
        "num_stages": 4,
        "num_warps": 8,
        "ms": 0.02968822792172432,
        "min_ms": 0.02968822792172432,
        "max_ms": 0.02968822792172432,
        "compile_time": 0.8012475967407227
    },
    {
        "BLOCK_SIZE_M": 64,
        "BLOCK_SIZE_N": 64,
        "BLOCK_SIZE_K": 64,
        "GROUP_SIZE_M": 8,
        "num_stages": 4,
        "num_warps": 16,
        "ms": 0.029709497466683388,
        "min_ms": 0.029709497466683388,
        "max_ms": 0.029709497466683388,
        "compile_time": 0.7634804248809814
    },
    {
        "BLOCK_SIZE_M": 128,
        "BLOCK_SIZE_N": 128,
        "BLOCK_SIZE_K": 32,
        "GROUP_SIZE_M": 8,
        "num_stages": 2,
        "num_warps": 16,
        "ms": 0.02973158285021782,
        "min_ms": 0.02973158285021782,
        "max_ms": 0.02973158285021782,
        "compile_time": 0.8043217658996582
    },
    {
        "BLOCK_SIZE_M": 32,
        "BLOCK_SIZE_N": 128,
        "BLOCK_SIZE_K": 32,
        "GROUP_SIZE_M": 8,
        "num_stages": 7,
        "num_warps": 8,
        "ms": 0.029741209000349045,
        "min_ms": 0.029741209000349045,
        "max_ms": 0.029741209000349045,
        "compile_time": 1.1977689266204834
    },
    {
        "BLOCK_SIZE_M": 64,
        "BLOCK_SIZE_N": 32,
        "BLOCK_SIZE_K": 64,
        "GROUP_SIZE_M": 8,
        "num_stages": 7,
        "num_warps": 8,
        "ms": 0.029746344313025475,
        "min_ms": 0.029746344313025475,
        "max_ms": 0.029746344313025475,
        "compile_time": 1.3082165718078613
    },
    {
        "BLOCK_SIZE_M": 256,
        "BLOCK_SIZE_N": 64,
        "BLOCK_SIZE_K": 16,
        "GROUP_SIZE_M": 8,
        "num_stages": 5,
        "num_warps": 4,
        "ms": 0.029755543917417526,
        "min_ms": 0.029755543917417526,
        "max_ms": 0.029755543917417526,
        "compile_time": 1.9081203937530518
    },
    {
        "BLOCK_SIZE_M": 32,
        "BLOCK_SIZE_N": 512,
        "BLOCK_SIZE_K": 16,
        "GROUP_SIZE_M": 8,
        "num_stages": 3,
        "num_warps": 4,
        "ms": 0.02975974977016449,
        "min_ms": 0.02975974977016449,
        "max_ms": 0.02975974977016449,
        "compile_time": 1.707315444946289
    },
    {
        "BLOCK_SIZE_M": 128,
        "BLOCK_SIZE_N": 128,
        "BLOCK_SIZE_K": 64,
        "GROUP_SIZE_M": 8,
        "num_stages": 4,
        "num_warps": 32,
        "ms": 0.029765674844384193,
        "min_ms": 0.029765674844384193,
        "max_ms": 0.029765674844384193,
        "compile_time": 0.8123817443847656
    },
    {
        "BLOCK_SIZE_M": 128,
        "BLOCK_SIZE_N": 32,
        "BLOCK_SIZE_K": 128,
        "GROUP_SIZE_M": 8,
        "num_stages": 1,
        "num_warps": 4,
        "ms": 0.0297696553170681,
        "min_ms": 0.0297696553170681,
        "max_ms": 0.0297696553170681,
        "compile_time": 0.8065159320831299
    },
    {
        "BLOCK_SIZE_M": 32,
        "BLOCK_SIZE_N": 128,
        "BLOCK_SIZE_K": 32,
        "GROUP_SIZE_M": 8,
        "num_stages": 7,
        "num_warps": 4,
        "ms": 0.029792705550789833,
        "min_ms": 0.029792705550789833,
        "max_ms": 0.029792705550789833,
        "compile_time": 1.3186521530151367
    },
    {
        "BLOCK_SIZE_M": 64,
        "BLOCK_SIZE_N": 128,
        "BLOCK_SIZE_K": 64,
        "GROUP_SIZE_M": 8,
        "num_stages": 1,
        "num_warps": 4,
        "ms": 0.029803818091750145,
        "min_ms": 0.029803818091750145,
        "max_ms": 0.029803818091750145,
        "compile_time": 0.748436450958252
    },
    {
        "BLOCK_SIZE_M": 32,
        "BLOCK_SIZE_N": 64,
        "BLOCK_SIZE_K": 128,
        "GROUP_SIZE_M": 8,
        "num_stages": 1,
        "num_warps": 2,
        "ms": 0.02981453202664852,
        "min_ms": 0.02981453202664852,
        "max_ms": 0.02981453202664852,
        "compile_time": 0.7196803092956543
    },
    {
        "BLOCK_SIZE_M": 64,
        "BLOCK_SIZE_N": 128,
        "BLOCK_SIZE_K": 128,
        "GROUP_SIZE_M": 8,
        "num_stages": 3,
        "num_warps": 16,
        "ms": 0.029846463352441788,
        "min_ms": 0.029846463352441788,
        "max_ms": 0.029846463352441788,
        "compile_time": 0.7503418922424316
    },
    {
        "BLOCK_SIZE_M": 256,
        "BLOCK_SIZE_N": 64,
        "BLOCK_SIZE_K": 16,
        "GROUP_SIZE_M": 8,
        "num_stages": 6,
        "num_warps": 4,
        "ms": 0.02985074557363987,
        "min_ms": 0.02985074557363987,
        "max_ms": 0.02985074557363987,
        "compile_time": 1.7523784637451172
    },
    {
        "BLOCK_SIZE_M": 32,
        "BLOCK_SIZE_N": 512,
        "BLOCK_SIZE_K": 32,
        "GROUP_SIZE_M": 8,
        "num_stages": 3,
        "num_warps": 4,
        "ms": 0.029865002259612083,
        "min_ms": 0.029865002259612083,
        "max_ms": 0.029865002259612083,
        "compile_time": 2.1289546489715576
    },
    {
        "BLOCK_SIZE_M": 128,
        "BLOCK_SIZE_N": 128,
        "BLOCK_SIZE_K": 128,
        "GROUP_SIZE_M": 8,
        "num_stages": 1,
        "num_warps": 4,
        "ms": 0.02988073229789734,
        "min_ms": 0.02988073229789734,
        "max_ms": 0.02988073229789734,
        "compile_time": 0.7974040508270264
    },
    {
        "BLOCK_SIZE_M": 128,
        "BLOCK_SIZE_N": 128,
        "BLOCK_SIZE_K": 64,
        "GROUP_SIZE_M": 8,
        "num_stages": 1,
        "num_warps": 8,
        "ms": 0.029886815696954727,
        "min_ms": 0.029886815696954727,
        "max_ms": 0.029886815696954727,
        "compile_time": 0.8133833408355713
    },
    {
        "BLOCK_SIZE_M": 32,
        "BLOCK_SIZE_N": 256,
        "BLOCK_SIZE_K": 32,
        "GROUP_SIZE_M": 8,
        "num_stages": 8,
        "num_warps": 8,
        "ms": 0.02989298477768898,
        "min_ms": 0.02989298477768898,
        "max_ms": 0.02989298477768898,
        "compile_time": 1.4446220397949219
    },
    {
        "BLOCK_SIZE_M": 32,
        "BLOCK_SIZE_N": 32,
        "BLOCK_SIZE_K": 32,
        "GROUP_SIZE_M": 8,
        "num_stages": 3,
        "num_warps": 2,
        "ms": 0.029905026778578758,
        "min_ms": 0.029905026778578758,
        "max_ms": 0.029905026778578758,
        "compile_time": 0.7158229351043701
    },
    {
        "BLOCK_SIZE_M": 32,
        "BLOCK_SIZE_N": 128,
        "BLOCK_SIZE_K": 128,
        "GROUP_SIZE_M": 8,
        "num_stages": 5,
        "num_warps": 8,
        "ms": 0.029912155121564865,
        "min_ms": 0.029912155121564865,
        "max_ms": 0.029912155121564865,
        "compile_time": 0.7266976833343506
    },
    {
        "BLOCK_SIZE_M": 32,
        "BLOCK_SIZE_N": 32,
        "BLOCK_SIZE_K": 32,
        "GROUP_SIZE_M": 8,
        "num_stages": 4,
        "num_warps": 2,
        "ms": 0.029920879751443863,
        "min_ms": 0.029920879751443863,
        "max_ms": 0.029920879751443863,
        "compile_time": 0.7086203098297119
    },
    {
        "BLOCK_SIZE_M": 128,
        "BLOCK_SIZE_N": 32,
        "BLOCK_SIZE_K": 256,
        "GROUP_SIZE_M": 8,
        "num_stages": 3,
        "num_warps": 4,
        "ms": 0.029932457953691483,
        "min_ms": 0.029932457953691483,
        "max_ms": 0.029932457953691483,
        "compile_time": 0.7818708419799805
    },
    {
        "BLOCK_SIZE_M": 128,
        "BLOCK_SIZE_N": 64,
        "BLOCK_SIZE_K": 128,
        "GROUP_SIZE_M": 8,
        "num_stages": 3,
        "num_warps": 16,
        "ms": 0.02993786707520485,
        "min_ms": 0.02993786707520485,
        "max_ms": 0.02993786707520485,
        "compile_time": 0.8167209625244141
    },
    {
        "BLOCK_SIZE_M": 32,
        "BLOCK_SIZE_N": 128,
        "BLOCK_SIZE_K": 64,
        "GROUP_SIZE_M": 8,
        "num_stages": 8,
        "num_warps": 8,
        "ms": 0.029944583773612976,
        "min_ms": 0.029944583773612976,
        "max_ms": 0.029944583773612976,
        "compile_time": 1.3469910621643066
    },
    {
        "BLOCK_SIZE_M": 256,
        "BLOCK_SIZE_N": 64,
        "BLOCK_SIZE_K": 16,
        "GROUP_SIZE_M": 8,
        "num_stages": 7,
        "num_warps": 4,
        "ms": 0.02996818721294403,
        "min_ms": 0.02996818721294403,
        "max_ms": 0.02996818721294403,
        "compile_time": 1.8929250240325928
    },
    {
        "BLOCK_SIZE_M": 128,
        "BLOCK_SIZE_N": 64,
        "BLOCK_SIZE_K": 64,
        "GROUP_SIZE_M": 8,
        "num_stages": 4,
        "num_warps": 16,
        "ms": 0.030001018196344376,
        "min_ms": 0.030001018196344376,
        "max_ms": 0.030001018196344376,
        "compile_time": 0.8062918186187744
    },
    {
        "BLOCK_SIZE_M": 32,
        "BLOCK_SIZE_N": 128,
        "BLOCK_SIZE_K": 64,
        "GROUP_SIZE_M": 8,
        "num_stages": 6,
        "num_warps": 2,
        "ms": 0.030010884627699852,
        "min_ms": 0.030010884627699852,
        "max_ms": 0.030010884627699852,
        "compile_time": 2.012148857116699
    },
    {
        "BLOCK_SIZE_M": 64,
        "BLOCK_SIZE_N": 32,
        "BLOCK_SIZE_K": 128,
        "GROUP_SIZE_M": 8,
        "num_stages": 4,
        "num_warps": 4,
        "ms": 0.030015472322702408,
        "min_ms": 0.030015472322702408,
        "max_ms": 0.030015472322702408,
        "compile_time": 0.774275541305542
    },
    {
        "BLOCK_SIZE_M": 128,
        "BLOCK_SIZE_N": 32,
        "BLOCK_SIZE_K": 64,
        "GROUP_SIZE_M": 8,
        "num_stages": 7,
        "num_warps": 2,
        "ms": 0.03003082610666752,
        "min_ms": 0.03003082610666752,
        "max_ms": 0.03003082610666752,
        "compile_time": 2.2434427738189697
    },
    {
        "BLOCK_SIZE_M": 32,
        "BLOCK_SIZE_N": 512,
        "BLOCK_SIZE_K": 32,
        "GROUP_SIZE_M": 8,
        "num_stages": 4,
        "num_warps": 4,
        "ms": 0.030037706717848778,
        "min_ms": 0.030037706717848778,
        "max_ms": 0.030037706717848778,
        "compile_time": 2.2276713848114014
    },
    {
        "BLOCK_SIZE_M": 256,
        "BLOCK_SIZE_N": 64,
        "BLOCK_SIZE_K": 128,
        "GROUP_SIZE_M": 8,
        "num_stages": 3,
        "num_warps": 32,
        "ms": 0.03005395270884037,
        "min_ms": 0.03005395270884037,
        "max_ms": 0.03005395270884037,
        "compile_time": 0.8428504467010498
    },
    {
        "BLOCK_SIZE_M": 256,
        "BLOCK_SIZE_N": 32,
        "BLOCK_SIZE_K": 32,
        "GROUP_SIZE_M": 8,
        "num_stages": 5,
        "num_warps": 8,
        "ms": 0.030058104544878006,
        "min_ms": 0.030058104544878006,
        "max_ms": 0.030058104544878006,
        "compile_time": 0.8300511837005615
    },
    {
        "BLOCK_SIZE_M": 128,
        "BLOCK_SIZE_N": 64,
        "BLOCK_SIZE_K": 64,
        "GROUP_SIZE_M": 8,
        "num_stages": 1,
        "num_warps": 4,
        "ms": 0.03006524220108986,
        "min_ms": 0.03006524220108986,
        "max_ms": 0.03006524220108986,
        "compile_time": 0.808582067489624
    },
    {
        "BLOCK_SIZE_M": 32,
        "BLOCK_SIZE_N": 32,
        "BLOCK_SIZE_K": 64,
        "GROUP_SIZE_M": 8,
        "num_stages": 2,
        "num_warps": 2,
        "ms": 0.030124986544251442,
        "min_ms": 0.030124986544251442,
        "max_ms": 0.030124986544251442,
        "compile_time": 0.7152783870697021
    },
    {
        "BLOCK_SIZE_M": 32,
        "BLOCK_SIZE_N": 32,
        "BLOCK_SIZE_K": 64,
        "GROUP_SIZE_M": 8,
        "num_stages": 4,
        "num_warps": 2,
        "ms": 0.03012995421886444,
        "min_ms": 0.03012995421886444,
        "max_ms": 0.03012995421886444,
        "compile_time": 0.6674191951751709
    },
    {
        "BLOCK_SIZE_M": 64,
        "BLOCK_SIZE_N": 32,
        "BLOCK_SIZE_K": 128,
        "GROUP_SIZE_M": 8,
        "num_stages": 4,
        "num_warps": 2,
        "ms": 0.03013477846980095,
        "min_ms": 0.03013477846980095,
        "max_ms": 0.03013477846980095,
        "compile_time": 0.7722961902618408
    },
    {
        "BLOCK_SIZE_M": 256,
        "BLOCK_SIZE_N": 64,
        "BLOCK_SIZE_K": 16,
        "GROUP_SIZE_M": 8,
        "num_stages": 8,
        "num_warps": 4,
        "ms": 0.030142003670334816,
        "min_ms": 0.030142003670334816,
        "max_ms": 0.030142003670334816,
        "compile_time": 1.9326558113098145
    },
    {
        "BLOCK_SIZE_M": 32,
        "BLOCK_SIZE_N": 128,
        "BLOCK_SIZE_K": 256,
        "GROUP_SIZE_M": 8,
        "num_stages": 3,
        "num_warps": 8,
        "ms": 0.030142072588205338,
        "min_ms": 0.030142072588205338,
        "max_ms": 0.030142072588205338,
        "compile_time": 0.7281875610351562
    },
    {
        "BLOCK_SIZE_M": 32,
        "BLOCK_SIZE_N": 64,
        "BLOCK_SIZE_K": 256,
        "GROUP_SIZE_M": 8,
        "num_stages": 2,
        "num_warps": 4,
        "ms": 0.030142277479171753,
        "min_ms": 0.030142277479171753,
        "max_ms": 0.030142277479171753,
        "compile_time": 0.7327296733856201
    },
    {
        "BLOCK_SIZE_M": 128,
        "BLOCK_SIZE_N": 32,
        "BLOCK_SIZE_K": 32,
        "GROUP_SIZE_M": 8,
        "num_stages": 6,
        "num_warps": 8,
        "ms": 0.03015437349677086,
        "min_ms": 0.03015437349677086,
        "max_ms": 0.03015437349677086,
        "compile_time": 1.3435218334197998
    },
    {
        "BLOCK_SIZE_M": 128,
        "BLOCK_SIZE_N": 128,
        "BLOCK_SIZE_K": 64,
        "GROUP_SIZE_M": 8,
        "num_stages": 5,
        "num_warps": 32,
        "ms": 0.03016744926571846,
        "min_ms": 0.03016744926571846,
        "max_ms": 0.03016744926571846,
        "compile_time": 0.8050980567932129
    },
    {
        "BLOCK_SIZE_M": 64,
        "BLOCK_SIZE_N": 256,
        "BLOCK_SIZE_K": 256,
        "GROUP_SIZE_M": 8,
        "num_stages": 2,
        "num_warps": 16,
        "ms": 0.03017779253423214,
        "min_ms": 0.03017779253423214,
        "max_ms": 0.03017779253423214,
        "compile_time": 0.7433986663818359
    },
    {
        "BLOCK_SIZE_M": 32,
        "BLOCK_SIZE_N": 32,
        "BLOCK_SIZE_K": 64,
        "GROUP_SIZE_M": 8,
        "num_stages": 4,
        "num_warps": 4,
        "ms": 0.03018353320658207,
        "min_ms": 0.03018353320658207,
        "max_ms": 0.03018353320658207,
        "compile_time": 0.6744992733001709
    },
    {
        "BLOCK_SIZE_M": 64,
        "BLOCK_SIZE_N": 64,
        "BLOCK_SIZE_K": 64,
        "GROUP_SIZE_M": 8,
        "num_stages": 5,
        "num_warps": 16,
        "ms": 0.0302029550075531,
        "min_ms": 0.0302029550075531,
        "max_ms": 0.0302029550075531,
        "compile_time": 0.7684919834136963
    },
    {
        "BLOCK_SIZE_M": 64,
        "BLOCK_SIZE_N": 128,
        "BLOCK_SIZE_K": 64,
        "GROUP_SIZE_M": 8,
        "num_stages": 4,
        "num_warps": 16,
        "ms": 0.030207347124814987,
        "min_ms": 0.030207347124814987,
        "max_ms": 0.030207347124814987,
        "compile_time": 0.7475297451019287
    },
    {
        "BLOCK_SIZE_M": 64,
        "BLOCK_SIZE_N": 128,
        "BLOCK_SIZE_K": 64,
        "GROUP_SIZE_M": 8,
        "num_stages": 3,
        "num_warps": 16,
        "ms": 0.030256543308496475,
        "min_ms": 0.030256543308496475,
        "max_ms": 0.030256543308496475,
        "compile_time": 0.7773177623748779
    },
    {
        "BLOCK_SIZE_M": 32,
        "BLOCK_SIZE_N": 128,
        "BLOCK_SIZE_K": 32,
        "GROUP_SIZE_M": 8,
        "num_stages": 8,
        "num_warps": 8,
        "ms": 0.03028397634625435,
        "min_ms": 0.03028397634625435,
        "max_ms": 0.03028397634625435,
        "compile_time": 1.20521879196167
    },
    {
        "BLOCK_SIZE_M": 128,
        "BLOCK_SIZE_N": 32,
        "BLOCK_SIZE_K": 32,
        "GROUP_SIZE_M": 8,
        "num_stages": 7,
        "num_warps": 2,
        "ms": 0.030307680368423462,
        "min_ms": 0.030307680368423462,
        "max_ms": 0.030307680368423462,
        "compile_time": 1.7051703929901123
    },
    {
        "BLOCK_SIZE_M": 64,
        "BLOCK_SIZE_N": 256,
        "BLOCK_SIZE_K": 128,
        "GROUP_SIZE_M": 8,
        "num_stages": 1,
        "num_warps": 16,
        "ms": 0.030315246433019638,
        "min_ms": 0.030315246433019638,
        "max_ms": 0.030315246433019638,
        "compile_time": 0.7790608406066895
    },
    {
        "BLOCK_SIZE_M": 32,
        "BLOCK_SIZE_N": 512,
        "BLOCK_SIZE_K": 16,
        "GROUP_SIZE_M": 8,
        "num_stages": 7,
        "num_warps": 8,
        "ms": 0.030345911160111427,
        "min_ms": 0.030345911160111427,
        "max_ms": 0.030345911160111427,
        "compile_time": 1.4554831981658936
    },
    {
        "BLOCK_SIZE_M": 128,
        "BLOCK_SIZE_N": 32,
        "BLOCK_SIZE_K": 64,
        "GROUP_SIZE_M": 8,
        "num_stages": 8,
        "num_warps": 8,
        "ms": 0.030360747128725052,
        "min_ms": 0.030360747128725052,
        "max_ms": 0.030360747128725052,
        "compile_time": 1.5363407135009766
    },
    {
        "BLOCK_SIZE_M": 256,
        "BLOCK_SIZE_N": 64,
        "BLOCK_SIZE_K": 128,
        "GROUP_SIZE_M": 8,
        "num_stages": 1,
        "num_warps": 16,
        "ms": 0.03036550059914589,
        "min_ms": 0.03036550059914589,
        "max_ms": 0.03036550059914589,
        "compile_time": 0.8528518676757812
    },
    {
        "BLOCK_SIZE_M": 32,
        "BLOCK_SIZE_N": 512,
        "BLOCK_SIZE_K": 16,
        "GROUP_SIZE_M": 8,
        "num_stages": 6,
        "num_warps": 8,
        "ms": 0.030373865738511086,
        "min_ms": 0.030373865738511086,
        "max_ms": 0.030373865738511086,
        "compile_time": 1.4523098468780518
    },
    {
        "BLOCK_SIZE_M": 128,
        "BLOCK_SIZE_N": 128,
        "BLOCK_SIZE_K": 32,
        "GROUP_SIZE_M": 8,
        "num_stages": 1,
        "num_warps": 8,
        "ms": 0.030393213033676147,
        "min_ms": 0.030393213033676147,
        "max_ms": 0.030393213033676147,
        "compile_time": 0.7764501571655273
    },
    {
        "BLOCK_SIZE_M": 32,
        "BLOCK_SIZE_N": 512,
        "BLOCK_SIZE_K": 32,
        "GROUP_SIZE_M": 8,
        "num_stages": 5,
        "num_warps": 4,
        "ms": 0.030405813828110695,
        "min_ms": 0.030405813828110695,
        "max_ms": 0.030405813828110695,
        "compile_time": 2.276854991912842
    },
    {
        "BLOCK_SIZE_M": 32,
        "BLOCK_SIZE_N": 128,
        "BLOCK_SIZE_K": 128,
        "GROUP_SIZE_M": 8,
        "num_stages": 3,
        "num_warps": 16,
        "ms": 0.030423974618315697,
        "min_ms": 0.030423974618315697,
        "max_ms": 0.030423974618315697,
        "compile_time": 0.7281284332275391
    },
    {
        "BLOCK_SIZE_M": 64,
        "BLOCK_SIZE_N": 32,
        "BLOCK_SIZE_K": 256,
        "GROUP_SIZE_M": 8,
        "num_stages": 2,
        "num_warps": 4,
        "ms": 0.030449923127889633,
        "min_ms": 0.030449923127889633,
        "max_ms": 0.030449923127889633,
        "compile_time": 0.7715094089508057
    },
    {
        "BLOCK_SIZE_M": 32,
        "BLOCK_SIZE_N": 128,
        "BLOCK_SIZE_K": 64,
        "GROUP_SIZE_M": 8,
        "num_stages": 7,
        "num_warps": 2,
        "ms": 0.03045426681637764,
        "min_ms": 0.03045426681637764,
        "max_ms": 0.03045426681637764,
        "compile_time": 2.0437934398651123
    },
    {
        "BLOCK_SIZE_M": 256,
        "BLOCK_SIZE_N": 32,
        "BLOCK_SIZE_K": 32,
        "GROUP_SIZE_M": 8,
        "num_stages": 2,
        "num_warps": 8,
        "ms": 0.030456211417913437,
        "min_ms": 0.030456211417913437,
        "max_ms": 0.030456211417913437,
        "compile_time": 0.8370883464813232
    },
    {
        "BLOCK_SIZE_M": 64,
        "BLOCK_SIZE_N": 64,
        "BLOCK_SIZE_K": 32,
        "GROUP_SIZE_M": 8,
        "num_stages": 1,
        "num_warps": 4,
        "ms": 0.03046521171927452,
        "min_ms": 0.03046521171927452,
        "max_ms": 0.03046521171927452,
        "compile_time": 0.7677743434906006
    },
    {
        "BLOCK_SIZE_M": 64,
        "BLOCK_SIZE_N": 32,
        "BLOCK_SIZE_K": 256,
        "GROUP_SIZE_M": 8,
        "num_stages": 2,
        "num_warps": 2,
        "ms": 0.03049851395189762,
        "min_ms": 0.03049851395189762,
        "max_ms": 0.03049851395189762,
        "compile_time": 0.7479913234710693
    },
    {
        "BLOCK_SIZE_M": 128,
        "BLOCK_SIZE_N": 64,
        "BLOCK_SIZE_K": 128,
        "GROUP_SIZE_M": 8,
        "num_stages": 4,
        "num_warps": 16,
        "ms": 0.03052419424057007,
        "min_ms": 0.03052419424057007,
        "max_ms": 0.03052419424057007,
        "compile_time": 0.8040461540222168
    },
    {
        "BLOCK_SIZE_M": 64,
        "BLOCK_SIZE_N": 128,
        "BLOCK_SIZE_K": 64,
        "GROUP_SIZE_M": 8,
        "num_stages": 5,
        "num_warps": 16,
        "ms": 0.030531365424394608,
        "min_ms": 0.030531365424394608,
        "max_ms": 0.030531365424394608,
        "compile_time": 0.7674269676208496
    },
    {
        "BLOCK_SIZE_M": 64,
        "BLOCK_SIZE_N": 256,
        "BLOCK_SIZE_K": 16,
        "GROUP_SIZE_M": 8,
        "num_stages": 7,
        "num_warps": 8,
        "ms": 0.030559346079826355,
        "min_ms": 0.030559346079826355,
        "max_ms": 0.030559346079826355,
        "compile_time": 1.444256067276001
    },
    {
        "BLOCK_SIZE_M": 128,
        "BLOCK_SIZE_N": 32,
        "BLOCK_SIZE_K": 32,
        "GROUP_SIZE_M": 8,
        "num_stages": 8,
        "num_warps": 2,
        "ms": 0.030581343919038773,
        "min_ms": 0.030581343919038773,
        "max_ms": 0.030581343919038773,
        "compile_time": 1.7620773315429688
    },
    {
        "BLOCK_SIZE_M": 64,
        "BLOCK_SIZE_N": 64,
        "BLOCK_SIZE_K": 64,
        "GROUP_SIZE_M": 8,
        "num_stages": 1,
        "num_warps": 8,
        "ms": 0.030615011230111122,
        "min_ms": 0.030615011230111122,
        "max_ms": 0.030615011230111122,
        "compile_time": 0.7814126014709473
    },
    {
        "BLOCK_SIZE_M": 64,
        "BLOCK_SIZE_N": 128,
        "BLOCK_SIZE_K": 32,
        "GROUP_SIZE_M": 8,
        "num_stages": 2,
        "num_warps": 2,
        "ms": 0.030644237995147705,
        "min_ms": 0.030644237995147705,
        "max_ms": 0.030644237995147705,
        "compile_time": 0.78485107421875
    },
    {
        "BLOCK_SIZE_M": 64,
        "BLOCK_SIZE_N": 256,
        "BLOCK_SIZE_K": 16,
        "GROUP_SIZE_M": 8,
        "num_stages": 8,
        "num_warps": 8,
        "ms": 0.030649717897176743,
        "min_ms": 0.030649717897176743,
        "max_ms": 0.030649717897176743,
        "compile_time": 1.4747602939605713
    },
    {
        "BLOCK_SIZE_M": 256,
        "BLOCK_SIZE_N": 64,
        "BLOCK_SIZE_K": 64,
        "GROUP_SIZE_M": 8,
        "num_stages": 1,
        "num_warps": 16,
        "ms": 0.030660102143883705,
        "min_ms": 0.030660102143883705,
        "max_ms": 0.030660102143883705,
        "compile_time": 0.835101842880249
    },
    {
        "BLOCK_SIZE_M": 32,
        "BLOCK_SIZE_N": 512,
        "BLOCK_SIZE_K": 16,
        "GROUP_SIZE_M": 8,
        "num_stages": 8,
        "num_warps": 8,
        "ms": 0.030688876286149025,
        "min_ms": 0.030688876286149025,
        "max_ms": 0.030688876286149025,
        "compile_time": 1.453833818435669
    },
    {
        "BLOCK_SIZE_M": 32,
        "BLOCK_SIZE_N": 128,
        "BLOCK_SIZE_K": 32,
        "GROUP_SIZE_M": 8,
        "num_stages": 8,
        "num_warps": 4,
        "ms": 0.030697684735059738,
        "min_ms": 0.030697684735059738,
        "max_ms": 0.030697684735059738,
        "compile_time": 1.3559346199035645
    },
    {
        "BLOCK_SIZE_M": 64,
        "BLOCK_SIZE_N": 32,
        "BLOCK_SIZE_K": 128,
        "GROUP_SIZE_M": 8,
        "num_stages": 2,
        "num_warps": 8,
        "ms": 0.0307062566280365,
        "min_ms": 0.0307062566280365,
        "max_ms": 0.0307062566280365,
        "compile_time": 0.7396223545074463
    },
    {
        "BLOCK_SIZE_M": 64,
        "BLOCK_SIZE_N": 256,
        "BLOCK_SIZE_K": 16,
        "GROUP_SIZE_M": 8,
        "num_stages": 5,
        "num_warps": 8,
        "ms": 0.030732840299606323,
        "min_ms": 0.030732840299606323,
        "max_ms": 0.030732840299606323,
        "compile_time": 1.2300705909729004
    },
    {
        "BLOCK_SIZE_M": 128,
        "BLOCK_SIZE_N": 128,
        "BLOCK_SIZE_K": 64,
        "GROUP_SIZE_M": 8,
        "num_stages": 6,
        "num_warps": 32,
        "ms": 0.030738499015569687,
        "min_ms": 0.030738499015569687,
        "max_ms": 0.030738499015569687,
        "compile_time": 1.4048571586608887
    },
    {
        "BLOCK_SIZE_M": 64,
        "BLOCK_SIZE_N": 32,
        "BLOCK_SIZE_K": 64,
        "GROUP_SIZE_M": 8,
        "num_stages": 2,
        "num_warps": 8,
        "ms": 0.030743196606636047,
        "min_ms": 0.030743196606636047,
        "max_ms": 0.030743196606636047,
        "compile_time": 0.7368450164794922
    },
    {
        "BLOCK_SIZE_M": 64,
        "BLOCK_SIZE_N": 32,
        "BLOCK_SIZE_K": 64,
        "GROUP_SIZE_M": 8,
        "num_stages": 1,
        "num_warps": 4,
        "ms": 0.030755842104554176,
        "min_ms": 0.030755842104554176,
        "max_ms": 0.030755842104554176,
        "compile_time": 0.7629446983337402
    },
    {
        "BLOCK_SIZE_M": 64,
        "BLOCK_SIZE_N": 256,
        "BLOCK_SIZE_K": 16,
        "GROUP_SIZE_M": 8,
        "num_stages": 6,
        "num_warps": 8,
        "ms": 0.030775662511587143,
        "min_ms": 0.030775662511587143,
        "max_ms": 0.030775662511587143,
        "compile_time": 1.4290812015533447
    },
    {
        "BLOCK_SIZE_M": 64,
        "BLOCK_SIZE_N": 64,
        "BLOCK_SIZE_K": 64,
        "GROUP_SIZE_M": 8,
        "num_stages": 6,
        "num_warps": 16,
        "ms": 0.030790621414780617,
        "min_ms": 0.030790621414780617,
        "max_ms": 0.030790621414780617,
        "compile_time": 1.2535715103149414
    },
    {
        "BLOCK_SIZE_M": 64,
        "BLOCK_SIZE_N": 64,
        "BLOCK_SIZE_K": 128,
        "GROUP_SIZE_M": 8,
        "num_stages": 1,
        "num_warps": 8,
        "ms": 0.030813757330179214,
        "min_ms": 0.030813757330179214,
        "max_ms": 0.030813757330179214,
        "compile_time": 0.7636137008666992
    },
    {
        "BLOCK_SIZE_M": 64,
        "BLOCK_SIZE_N": 256,
        "BLOCK_SIZE_K": 16,
        "GROUP_SIZE_M": 8,
        "num_stages": 3,
        "num_warps": 8,
        "ms": 0.030837517231702805,
        "min_ms": 0.030837517231702805,
        "max_ms": 0.030837517231702805,
        "compile_time": 1.3751420974731445
    },
    {
        "BLOCK_SIZE_M": 128,
        "BLOCK_SIZE_N": 64,
        "BLOCK_SIZE_K": 32,
        "GROUP_SIZE_M": 8,
        "num_stages": 8,
        "num_warps": 2,
        "ms": 0.030852576717734337,
        "min_ms": 0.030852576717734337,
        "max_ms": 0.030852576717734337,
        "compile_time": 2.287348747253418
    },
    {
        "BLOCK_SIZE_M": 128,
        "BLOCK_SIZE_N": 128,
        "BLOCK_SIZE_K": 64,
        "GROUP_SIZE_M": 8,
        "num_stages": 1,
        "num_warps": 4,
        "ms": 0.0308724045753479,
        "min_ms": 0.0308724045753479,
        "max_ms": 0.0308724045753479,
        "compile_time": 0.8131706714630127
    },
    {
        "BLOCK_SIZE_M": 128,
        "BLOCK_SIZE_N": 32,
        "BLOCK_SIZE_K": 64,
        "GROUP_SIZE_M": 8,
        "num_stages": 8,
        "num_warps": 2,
        "ms": 0.03087517060339451,
        "min_ms": 0.03087517060339451,
        "max_ms": 0.03087517060339451,
        "compile_time": 2.342092514038086
    },
    {
        "BLOCK_SIZE_M": 64,
        "BLOCK_SIZE_N": 256,
        "BLOCK_SIZE_K": 16,
        "GROUP_SIZE_M": 8,
        "num_stages": 4,
        "num_warps": 8,
        "ms": 0.030895274132490158,
        "min_ms": 0.030895274132490158,
        "max_ms": 0.030895274132490158,
        "compile_time": 1.3876042366027832
    },
    {
        "BLOCK_SIZE_M": 64,
        "BLOCK_SIZE_N": 256,
        "BLOCK_SIZE_K": 64,
        "GROUP_SIZE_M": 8,
        "num_stages": 1,
        "num_warps": 16,
        "ms": 0.03090939298272133,
        "min_ms": 0.03090939298272133,
        "max_ms": 0.03090939298272133,
        "compile_time": 0.7937989234924316
    },
    {
        "BLOCK_SIZE_M": 128,
        "BLOCK_SIZE_N": 64,
        "BLOCK_SIZE_K": 32,
        "GROUP_SIZE_M": 8,
        "num_stages": 2,
        "num_warps": 2,
        "ms": 0.03094390593469143,
        "min_ms": 0.03094390593469143,
        "max_ms": 0.03094390593469143,
        "compile_time": 0.7902495861053467
    },
    {
        "BLOCK_SIZE_M": 32,
        "BLOCK_SIZE_N": 128,
        "BLOCK_SIZE_K": 128,
        "GROUP_SIZE_M": 8,
        "num_stages": 1,
        "num_warps": 2,
        "ms": 0.030983274802565575,
        "min_ms": 0.030983274802565575,
        "max_ms": 0.030983274802565575,
        "compile_time": 0.7374565601348877
    },
    {
        "BLOCK_SIZE_M": 64,
        "BLOCK_SIZE_N": 128,
        "BLOCK_SIZE_K": 128,
        "GROUP_SIZE_M": 8,
        "num_stages": 4,
        "num_warps": 16,
        "ms": 0.030989881604909897,
        "min_ms": 0.030989881604909897,
        "max_ms": 0.030989881604909897,
        "compile_time": 0.7818849086761475
    },
    {
        "BLOCK_SIZE_M": 128,
        "BLOCK_SIZE_N": 64,
        "BLOCK_SIZE_K": 16,
        "GROUP_SIZE_M": 8,
        "num_stages": 7,
        "num_warps": 4,
        "ms": 0.03102235123515129,
        "min_ms": 0.03102235123515129,
        "max_ms": 0.03102235123515129,
        "compile_time": 1.4708783626556396
    },
    {
        "BLOCK_SIZE_M": 256,
        "BLOCK_SIZE_N": 64,
        "BLOCK_SIZE_K": 64,
        "GROUP_SIZE_M": 8,
        "num_stages": 1,
        "num_warps": 8,
        "ms": 0.031030451878905296,
        "min_ms": 0.031030451878905296,
        "max_ms": 0.031030451878905296,
        "compile_time": 0.8560371398925781
    },
    {
        "BLOCK_SIZE_M": 32,
        "BLOCK_SIZE_N": 64,
        "BLOCK_SIZE_K": 256,
        "GROUP_SIZE_M": 8,
        "num_stages": 2,
        "num_warps": 2,
        "ms": 0.031047487631440163,
        "min_ms": 0.031047487631440163,
        "max_ms": 0.031047487631440163,
        "compile_time": 0.7377076148986816
    },
    {
        "BLOCK_SIZE_M": 32,
        "BLOCK_SIZE_N": 64,
        "BLOCK_SIZE_K": 64,
        "GROUP_SIZE_M": 8,
        "num_stages": 2,
        "num_warps": 8,
        "ms": 0.031087780371308327,
        "min_ms": 0.031087780371308327,
        "max_ms": 0.031087780371308327,
        "compile_time": 0.7331500053405762
    },
    {
        "BLOCK_SIZE_M": 32,
        "BLOCK_SIZE_N": 64,
        "BLOCK_SIZE_K": 128,
        "GROUP_SIZE_M": 8,
        "num_stages": 2,
        "num_warps": 8,
        "ms": 0.031155908480286598,
        "min_ms": 0.031155908480286598,
        "max_ms": 0.031155908480286598,
        "compile_time": 0.7465932369232178
    },
    {
        "BLOCK_SIZE_M": 64,
        "BLOCK_SIZE_N": 64,
        "BLOCK_SIZE_K": 16,
        "GROUP_SIZE_M": 8,
        "num_stages": 2,
        "num_warps": 2,
        "ms": 0.031158963218331337,
        "min_ms": 0.031158963218331337,
        "max_ms": 0.031158963218331337,
        "compile_time": 1.336808681488037
    },
    {
        "BLOCK_SIZE_M": 32,
        "BLOCK_SIZE_N": 256,
        "BLOCK_SIZE_K": 32,
        "GROUP_SIZE_M": 8,
        "num_stages": 2,
        "num_warps": 8,
        "ms": 0.031213033944368362,
        "min_ms": 0.031213033944368362,
        "max_ms": 0.031213033944368362,
        "compile_time": 0.7771546840667725
    },
    {
        "BLOCK_SIZE_M": 32,
        "BLOCK_SIZE_N": 512,
        "BLOCK_SIZE_K": 16,
        "GROUP_SIZE_M": 8,
        "num_stages": 3,
        "num_warps": 8,
        "ms": 0.031217452138662338,
        "min_ms": 0.031217452138662338,
        "max_ms": 0.031217452138662338,
        "compile_time": 1.3523380756378174
    },
    {
        "BLOCK_SIZE_M": 64,
        "BLOCK_SIZE_N": 128,
        "BLOCK_SIZE_K": 64,
        "GROUP_SIZE_M": 8,
        "num_stages": 6,
        "num_warps": 16,
        "ms": 0.031231045722961426,
        "min_ms": 0.031231045722961426,
        "max_ms": 0.031231045722961426,
        "compile_time": 1.3128409385681152
    },
    {
        "BLOCK_SIZE_M": 32,
        "BLOCK_SIZE_N": 256,
        "BLOCK_SIZE_K": 16,
        "GROUP_SIZE_M": 8,
        "num_stages": 5,
        "num_warps": 8,
        "ms": 0.031245097517967224,
        "min_ms": 0.031245097517967224,
        "max_ms": 0.031245097517967224,
        "compile_time": 1.2857849597930908
    },
    {
        "BLOCK_SIZE_M": 128,
        "BLOCK_SIZE_N": 128,
        "BLOCK_SIZE_K": 128,
        "GROUP_SIZE_M": 8,
        "num_stages": 1,
        "num_warps": 32,
        "ms": 0.03124799206852913,
        "min_ms": 0.03124799206852913,
        "max_ms": 0.03124799206852913,
        "compile_time": 0.8354113101959229
    },
    {
        "BLOCK_SIZE_M": 32,
        "BLOCK_SIZE_N": 512,
        "BLOCK_SIZE_K": 16,
        "GROUP_SIZE_M": 8,
        "num_stages": 5,
        "num_warps": 8,
        "ms": 0.0312509723007679,
        "min_ms": 0.0312509723007679,
        "max_ms": 0.0312509723007679,
        "compile_time": 1.4015347957611084
    },
    {
        "BLOCK_SIZE_M": 32,
        "BLOCK_SIZE_N": 512,
        "BLOCK_SIZE_K": 16,
        "GROUP_SIZE_M": 8,
        "num_stages": 4,
        "num_warps": 8,
        "ms": 0.03126583993434906,
        "min_ms": 0.03126583993434906,
        "max_ms": 0.03126583993434906,
        "compile_time": 1.3681366443634033
    },
    {
        "BLOCK_SIZE_M": 32,
        "BLOCK_SIZE_N": 64,
        "BLOCK_SIZE_K": 64,
        "GROUP_SIZE_M": 8,
        "num_stages": 8,
        "num_warps": 4,
        "ms": 0.03126709908246994,
        "min_ms": 0.03126709908246994,
        "max_ms": 0.03126709908246994,
        "compile_time": 1.3270998001098633
    },
    {
        "BLOCK_SIZE_M": 128,
        "BLOCK_SIZE_N": 64,
        "BLOCK_SIZE_K": 64,
        "GROUP_SIZE_M": 8,
        "num_stages": 2,
        "num_warps": 2,
        "ms": 0.03127100691199303,
        "min_ms": 0.03127100691199303,
        "max_ms": 0.03127100691199303,
        "compile_time": 0.8137257099151611
    },
    {
        "BLOCK_SIZE_M": 128,
        "BLOCK_SIZE_N": 32,
        "BLOCK_SIZE_K": 32,
        "GROUP_SIZE_M": 8,
        "num_stages": 7,
        "num_warps": 8,
        "ms": 0.031275637447834015,
        "min_ms": 0.031275637447834015,
        "max_ms": 0.031275637447834015,
        "compile_time": 1.353116750717163
    },
    {
        "BLOCK_SIZE_M": 64,
        "BLOCK_SIZE_N": 512,
        "BLOCK_SIZE_K": 32,
        "GROUP_SIZE_M": 8,
        "num_stages": 3,
        "num_warps": 8,
        "ms": 0.031306710094213486,
        "min_ms": 0.031306710094213486,
        "max_ms": 0.031306710094213486,
        "compile_time": 1.9961607456207275
    },
    {
        "BLOCK_SIZE_M": 32,
        "BLOCK_SIZE_N": 32,
        "BLOCK_SIZE_K": 32,
        "GROUP_SIZE_M": 8,
        "num_stages": 5,
        "num_warps": 2,
        "ms": 0.03131626918911934,
        "min_ms": 0.03131626918911934,
        "max_ms": 0.03131626918911934,
        "compile_time": 0.7219345569610596
    },
    {
        "BLOCK_SIZE_M": 256,
        "BLOCK_SIZE_N": 128,
        "BLOCK_SIZE_K": 64,
        "GROUP_SIZE_M": 8,
        "num_stages": 3,
        "num_warps": 8,
        "ms": 0.03132470324635506,
        "min_ms": 0.03132470324635506,
        "max_ms": 0.03132470324635506,
        "compile_time": 0.8549249172210693
    },
    {
        "BLOCK_SIZE_M": 32,
        "BLOCK_SIZE_N": 256,
        "BLOCK_SIZE_K": 16,
        "GROUP_SIZE_M": 8,
        "num_stages": 4,
        "num_warps": 8,
        "ms": 0.031347908079624176,
        "min_ms": 0.031347908079624176,
        "max_ms": 0.031347908079624176,
        "compile_time": 1.2726941108703613
    },
    {
        "BLOCK_SIZE_M": 32,
        "BLOCK_SIZE_N": 128,
        "BLOCK_SIZE_K": 64,
        "GROUP_SIZE_M": 8,
        "num_stages": 8,
        "num_warps": 2,
        "ms": 0.031355101615190506,
        "min_ms": 0.031355101615190506,
        "max_ms": 0.031355101615190506,
        "compile_time": 2.140928030014038
    },
    {
        "BLOCK_SIZE_M": 32,
        "BLOCK_SIZE_N": 32,
        "BLOCK_SIZE_K": 32,
        "GROUP_SIZE_M": 8,
        "num_stages": 3,
        "num_warps": 4,
        "ms": 0.03140585124492645,
        "min_ms": 0.03140585124492645,
        "max_ms": 0.03140585124492645,
        "compile_time": 0.7306439876556396
    },
    {
        "BLOCK_SIZE_M": 128,
        "BLOCK_SIZE_N": 32,
        "BLOCK_SIZE_K": 32,
        "GROUP_SIZE_M": 8,
        "num_stages": 1,
        "num_warps": 2,
        "ms": 0.0314483568072319,
        "min_ms": 0.0314483568072319,
        "max_ms": 0.0314483568072319,
        "compile_time": 0.8007528781890869
    },
    {
        "BLOCK_SIZE_M": 256,
        "BLOCK_SIZE_N": 128,
        "BLOCK_SIZE_K": 64,
        "GROUP_SIZE_M": 8,
        "num_stages": 4,
        "num_warps": 8,
        "ms": 0.03146511688828468,
        "min_ms": 0.03146511688828468,
        "max_ms": 0.03146511688828468,
        "compile_time": 0.8647303581237793
    },
    {
        "BLOCK_SIZE_M": 32,
        "BLOCK_SIZE_N": 32,
        "BLOCK_SIZE_K": 32,
        "GROUP_SIZE_M": 8,
        "num_stages": 6,
        "num_warps": 2,
        "ms": 0.03147001564502716,
        "min_ms": 0.03147001564502716,
        "max_ms": 0.03147001564502716,
        "compile_time": 1.2043826580047607
    },
    {
        "BLOCK_SIZE_M": 64,
        "BLOCK_SIZE_N": 32,
        "BLOCK_SIZE_K": 64,
        "GROUP_SIZE_M": 8,
        "num_stages": 8,
        "num_warps": 4,
        "ms": 0.031470317393541336,
        "min_ms": 0.031470317393541336,
        "max_ms": 0.031470317393541336,
        "compile_time": 1.450899600982666
    },
    {
        "BLOCK_SIZE_M": 32,
        "BLOCK_SIZE_N": 64,
        "BLOCK_SIZE_K": 128,
        "GROUP_SIZE_M": 8,
        "num_stages": 5,
        "num_warps": 4,
        "ms": 0.031473416835069656,
        "min_ms": 0.031473416835069656,
        "max_ms": 0.031473416835069656,
        "compile_time": 0.7361867427825928
    },
    {
        "BLOCK_SIZE_M": 64,
        "BLOCK_SIZE_N": 64,
        "BLOCK_SIZE_K": 128,
        "GROUP_SIZE_M": 8,
        "num_stages": 4,
        "num_warps": 16,
        "ms": 0.03148560971021652,
        "min_ms": 0.03148560971021652,
        "max_ms": 0.03148560971021652,
        "compile_time": 0.7815136909484863
    },
    {
        "BLOCK_SIZE_M": 512,
        "BLOCK_SIZE_N": 32,
        "BLOCK_SIZE_K": 32,
        "GROUP_SIZE_M": 8,
        "num_stages": 3,
        "num_warps": 4,
        "ms": 0.03152378648519516,
        "min_ms": 0.03152378648519516,
        "max_ms": 0.03152378648519516,
        "compile_time": 2.4064862728118896
    },
    {
        "BLOCK_SIZE_M": 64,
        "BLOCK_SIZE_N": 512,
        "BLOCK_SIZE_K": 32,
        "GROUP_SIZE_M": 8,
        "num_stages": 5,
        "num_warps": 8,
        "ms": 0.031537238508462906,
        "min_ms": 0.031537238508462906,
        "max_ms": 0.031537238508462906,
        "compile_time": 2.0567562580108643
    },
    {
        "BLOCK_SIZE_M": 128,
        "BLOCK_SIZE_N": 128,
        "BLOCK_SIZE_K": 32,
        "GROUP_SIZE_M": 8,
        "num_stages": 1,
        "num_warps": 16,
        "ms": 0.03157014772295952,
        "min_ms": 0.03157014772295952,
        "max_ms": 0.03157014772295952,
        "compile_time": 0.8141613006591797
    },
    {
        "BLOCK_SIZE_M": 256,
        "BLOCK_SIZE_N": 64,
        "BLOCK_SIZE_K": 64,
        "GROUP_SIZE_M": 8,
        "num_stages": 3,
        "num_warps": 32,
        "ms": 0.031583476811647415,
        "min_ms": 0.031583476811647415,
        "max_ms": 0.031583476811647415,
        "compile_time": 0.8543119430541992
    },
    {
        "BLOCK_SIZE_M": 256,
        "BLOCK_SIZE_N": 64,
        "BLOCK_SIZE_K": 32,
        "GROUP_SIZE_M": 8,
        "num_stages": 1,
        "num_warps": 8,
        "ms": 0.03159458190202713,
        "min_ms": 0.03159458190202713,
        "max_ms": 0.03159458190202713,
        "compile_time": 0.8617634773254395
    },
    {
        "BLOCK_SIZE_M": 128,
        "BLOCK_SIZE_N": 64,
        "BLOCK_SIZE_K": 16,
        "GROUP_SIZE_M": 8,
        "num_stages": 3,
        "num_warps": 4,
        "ms": 0.0316353440284729,
        "min_ms": 0.0316353440284729,
        "max_ms": 0.0316353440284729,
        "compile_time": 1.4373753070831299
    },
    {
        "BLOCK_SIZE_M": 32,
        "BLOCK_SIZE_N": 32,
        "BLOCK_SIZE_K": 64,
        "GROUP_SIZE_M": 8,
        "num_stages": 5,
        "num_warps": 4,
        "ms": 0.03164774924516678,
        "min_ms": 0.03164774924516678,
        "max_ms": 0.03164774924516678,
        "compile_time": 0.7151563167572021
    },
    {
        "BLOCK_SIZE_M": 128,
        "BLOCK_SIZE_N": 32,
        "BLOCK_SIZE_K": 128,
        "GROUP_SIZE_M": 8,
        "num_stages": 5,
        "num_warps": 8,
        "ms": 0.03165741264820099,
        "min_ms": 0.03165741264820099,
        "max_ms": 0.03165741264820099,
        "compile_time": 0.8153047561645508
    },
    {
        "BLOCK_SIZE_M": 512,
        "BLOCK_SIZE_N": 32,
        "BLOCK_SIZE_K": 32,
        "GROUP_SIZE_M": 8,
        "num_stages": 4,
        "num_warps": 16,
        "ms": 0.03166569769382477,
        "min_ms": 0.03166569769382477,
        "max_ms": 0.03166569769382477,
        "compile_time": 1.6092581748962402
    },
    {
        "BLOCK_SIZE_M": 128,
        "BLOCK_SIZE_N": 32,
        "BLOCK_SIZE_K": 32,
        "GROUP_SIZE_M": 8,
        "num_stages": 8,
        "num_warps": 8,
        "ms": 0.03169707581400871,
        "min_ms": 0.03169707581400871,
        "max_ms": 0.03169707581400871,
        "compile_time": 1.3740432262420654
    },
    {
        "BLOCK_SIZE_M": 256,
        "BLOCK_SIZE_N": 128,
        "BLOCK_SIZE_K": 32,
        "GROUP_SIZE_M": 8,
        "num_stages": 7,
        "num_warps": 8,
        "ms": 0.03170476108789444,
        "min_ms": 0.03170476108789444,
        "max_ms": 0.03170476108789444,
        "compile_time": 2.052370071411133
    },
    {
        "BLOCK_SIZE_M": 512,
        "BLOCK_SIZE_N": 32,
        "BLOCK_SIZE_K": 32,
        "GROUP_SIZE_M": 8,
        "num_stages": 4,
        "num_warps": 4,
        "ms": 0.03172016888856888,
        "min_ms": 0.03172016888856888,
        "max_ms": 0.03172016888856888,
        "compile_time": 2.4463727474212646
    },
    {
        "BLOCK_SIZE_M": 128,
        "BLOCK_SIZE_N": 64,
        "BLOCK_SIZE_K": 16,
        "GROUP_SIZE_M": 8,
        "num_stages": 4,
        "num_warps": 4,
        "ms": 0.03172345086932182,
        "min_ms": 0.03172345086932182,
        "max_ms": 0.03172345086932182,
        "compile_time": 1.444059133529663
    },
    {
        "BLOCK_SIZE_M": 128,
        "BLOCK_SIZE_N": 64,
        "BLOCK_SIZE_K": 64,
        "GROUP_SIZE_M": 8,
        "num_stages": 5,
        "num_warps": 16,
        "ms": 0.031744420528411865,
        "min_ms": 0.031744420528411865,
        "max_ms": 0.031744420528411865,
        "compile_time": 0.8186182975769043
    },
    {
        "BLOCK_SIZE_M": 32,
        "BLOCK_SIZE_N": 256,
        "BLOCK_SIZE_K": 16,
        "GROUP_SIZE_M": 8,
        "num_stages": 3,
        "num_warps": 8,
        "ms": 0.03177644684910774,
        "min_ms": 0.03177644684910774,
        "max_ms": 0.03177644684910774,
        "compile_time": 1.2023861408233643
    },
    {
        "BLOCK_SIZE_M": 64,
        "BLOCK_SIZE_N": 32,
        "BLOCK_SIZE_K": 128,
        "GROUP_SIZE_M": 8,
        "num_stages": 5,
        "num_warps": 4,
        "ms": 0.03178613632917404,
        "min_ms": 0.03178613632917404,
        "max_ms": 0.03178613632917404,
        "compile_time": 0.7461564540863037
    },
    {
        "BLOCK_SIZE_M": 32,
        "BLOCK_SIZE_N": 128,
        "BLOCK_SIZE_K": 32,
        "GROUP_SIZE_M": 8,
        "num_stages": 2,
        "num_warps": 8,
        "ms": 0.03180020675063133,
        "min_ms": 0.03180020675063133,
        "max_ms": 0.03180020675063133,
        "compile_time": 0.6938080787658691
    },
    {
        "BLOCK_SIZE_M": 64,
        "BLOCK_SIZE_N": 256,
        "BLOCK_SIZE_K": 32,
        "GROUP_SIZE_M": 8,
        "num_stages": 2,
        "num_warps": 16,
        "ms": 0.03181029111146927,
        "min_ms": 0.03181029111146927,
        "max_ms": 0.03181029111146927,
        "compile_time": 0.782078742980957
    },
    {
        "BLOCK_SIZE_M": 128,
        "BLOCK_SIZE_N": 32,
        "BLOCK_SIZE_K": 32,
        "GROUP_SIZE_M": 8,
        "num_stages": 2,
        "num_warps": 8,
        "ms": 0.0318160243332386,
        "min_ms": 0.0318160243332386,
        "max_ms": 0.0318160243332386,
        "compile_time": 0.8046648502349854
    },
    {
        "BLOCK_SIZE_M": 32,
        "BLOCK_SIZE_N": 256,
        "BLOCK_SIZE_K": 16,
        "GROUP_SIZE_M": 8,
        "num_stages": 6,
        "num_warps": 8,
        "ms": 0.03183271735906601,
        "min_ms": 0.03183271735906601,
        "max_ms": 0.03183271735906601,
        "compile_time": 1.251389741897583
    },
    {
        "BLOCK_SIZE_M": 32,
        "BLOCK_SIZE_N": 64,
        "BLOCK_SIZE_K": 16,
        "GROUP_SIZE_M": 8,
        "num_stages": 4,
        "num_warps": 4,
        "ms": 0.03183416649699211,
        "min_ms": 0.03183416649699211,
        "max_ms": 0.03183416649699211,
        "compile_time": 1.1419715881347656
    },
    {
        "BLOCK_SIZE_M": 128,
        "BLOCK_SIZE_N": 32,
        "BLOCK_SIZE_K": 128,
        "GROUP_SIZE_M": 8,
        "num_stages": 2,
        "num_warps": 8,
        "ms": 0.03184112161397934,
        "min_ms": 0.03184112161397934,
        "max_ms": 0.03184112161397934,
        "compile_time": 0.8253052234649658
    },
    {
        "BLOCK_SIZE_M": 64,
        "BLOCK_SIZE_N": 32,
        "BLOCK_SIZE_K": 64,
        "GROUP_SIZE_M": 8,
        "num_stages": 7,
        "num_warps": 4,
        "ms": 0.03186679258942604,
        "min_ms": 0.03186679258942604,
        "max_ms": 0.03186679258942604,
        "compile_time": 1.4516925811767578
    },
    {
        "BLOCK_SIZE_M": 32,
        "BLOCK_SIZE_N": 32,
        "BLOCK_SIZE_K": 32,
        "GROUP_SIZE_M": 8,
        "num_stages": 7,
        "num_warps": 2,
        "ms": 0.031872525811195374,
        "min_ms": 0.031872525811195374,
        "max_ms": 0.031872525811195374,
        "compile_time": 1.2439191341400146
    },
    {
        "BLOCK_SIZE_M": 128,
        "BLOCK_SIZE_N": 64,
        "BLOCK_SIZE_K": 16,
        "GROUP_SIZE_M": 8,
        "num_stages": 5,
        "num_warps": 4,
        "ms": 0.031876564025878906,
        "min_ms": 0.031876564025878906,
        "max_ms": 0.031876564025878906,
        "compile_time": 1.4500188827514648
    },
    {
        "BLOCK_SIZE_M": 32,
        "BLOCK_SIZE_N": 64,
        "BLOCK_SIZE_K": 128,
        "GROUP_SIZE_M": 8,
        "num_stages": 6,
        "num_warps": 4,
        "ms": 0.031898900866508484,
        "min_ms": 0.031898900866508484,
        "max_ms": 0.031898900866508484,
        "compile_time": 1.5667192935943604
    },
    {
        "BLOCK_SIZE_M": 32,
        "BLOCK_SIZE_N": 32,
        "BLOCK_SIZE_K": 128,
        "GROUP_SIZE_M": 8,
        "num_stages": 3,
        "num_warps": 4,
        "ms": 0.03194352239370346,
        "min_ms": 0.03194352239370346,
        "max_ms": 0.03194352239370346,
        "compile_time": 0.7982916831970215
    },
    {
        "BLOCK_SIZE_M": 128,
        "BLOCK_SIZE_N": 64,
        "BLOCK_SIZE_K": 64,
        "GROUP_SIZE_M": 8,
        "num_stages": 6,
        "num_warps": 16,
        "ms": 0.03195393830537796,
        "min_ms": 0.03195393830537796,
        "max_ms": 0.03195393830537796,
        "compile_time": 1.3836627006530762
    },
    {
        "BLOCK_SIZE_M": 64,
        "BLOCK_SIZE_N": 64,
        "BLOCK_SIZE_K": 256,
        "GROUP_SIZE_M": 8,
        "num_stages": 1,
        "num_warps": 8,
        "ms": 0.03195638954639435,
        "min_ms": 0.03195638954639435,
        "max_ms": 0.03195638954639435,
        "compile_time": 0.7827353477478027
    },
    {
        "BLOCK_SIZE_M": 128,
        "BLOCK_SIZE_N": 64,
        "BLOCK_SIZE_K": 64,
        "GROUP_SIZE_M": 8,
        "num_stages": 4,
        "num_warps": 2,
        "ms": 0.03195805102586746,
        "min_ms": 0.03195805102586746,
        "max_ms": 0.03195805102586746,
        "compile_time": 0.7995452880859375
    },
    {
        "BLOCK_SIZE_M": 512,
        "BLOCK_SIZE_N": 32,
        "BLOCK_SIZE_K": 32,
        "GROUP_SIZE_M": 8,
        "num_stages": 5,
        "num_warps": 4,
        "ms": 0.03198976069688797,
        "min_ms": 0.03198976069688797,
        "max_ms": 0.03198976069688797,
        "compile_time": 2.5391933917999268
    },
    {
        "BLOCK_SIZE_M": 256,
        "BLOCK_SIZE_N": 64,
        "BLOCK_SIZE_K": 64,
        "GROUP_SIZE_M": 8,
        "num_stages": 4,
        "num_warps": 32,
        "ms": 0.031992074102163315,
        "min_ms": 0.031992074102163315,
        "max_ms": 0.031992074102163315,
        "compile_time": 0.847404956817627
    },
    {
        "BLOCK_SIZE_M": 128,
        "BLOCK_SIZE_N": 64,
        "BLOCK_SIZE_K": 16,
        "GROUP_SIZE_M": 8,
        "num_stages": 6,
        "num_warps": 4,
        "ms": 0.0320289321243763,
        "min_ms": 0.0320289321243763,
        "max_ms": 0.0320289321243763,
        "compile_time": 1.4641749858856201
    },
    {
        "BLOCK_SIZE_M": 128,
        "BLOCK_SIZE_N": 32,
        "BLOCK_SIZE_K": 32,
        "GROUP_SIZE_M": 8,
        "num_stages": 1,
        "num_warps": 4,
        "ms": 0.03203736990690231,
        "min_ms": 0.03203736990690231,
        "max_ms": 0.03203736990690231,
        "compile_time": 0.8060503005981445
    },
    {
        "BLOCK_SIZE_M": 32,
        "BLOCK_SIZE_N": 32,
        "BLOCK_SIZE_K": 32,
        "GROUP_SIZE_M": 8,
        "num_stages": 5,
        "num_warps": 4,
        "ms": 0.03204164654016495,
        "min_ms": 0.03204164654016495,
        "max_ms": 0.03204164654016495,
        "compile_time": 0.7261843681335449
    },
    {
        "BLOCK_SIZE_M": 64,
        "BLOCK_SIZE_N": 128,
        "BLOCK_SIZE_K": 64,
        "GROUP_SIZE_M": 8,
        "num_stages": 7,
        "num_warps": 16,
        "ms": 0.03204546123743057,
        "min_ms": 0.03204546123743057,
        "max_ms": 0.03204546123743057,
        "compile_time": 1.317842960357666
    },
    {
        "BLOCK_SIZE_M": 512,
        "BLOCK_SIZE_N": 32,
        "BLOCK_SIZE_K": 32,
        "GROUP_SIZE_M": 8,
        "num_stages": 3,
        "num_warps": 16,
        "ms": 0.03206172585487366,
        "min_ms": 0.03206172585487366,
        "max_ms": 0.03206172585487366,
        "compile_time": 1.5036513805389404
    },
    {
        "BLOCK_SIZE_M": 256,
        "BLOCK_SIZE_N": 64,
        "BLOCK_SIZE_K": 16,
        "GROUP_SIZE_M": 8,
        "num_stages": 6,
        "num_warps": 8,
        "ms": 0.032069507986307144,
        "min_ms": 0.032069507986307144,
        "max_ms": 0.032069507986307144,
        "compile_time": 1.5957603454589844
    },
    {
        "BLOCK_SIZE_M": 256,
        "BLOCK_SIZE_N": 64,
        "BLOCK_SIZE_K": 32,
        "GROUP_SIZE_M": 8,
        "num_stages": 2,
        "num_warps": 16,
        "ms": 0.032078154385089874,
        "min_ms": 0.032078154385089874,
        "max_ms": 0.032078154385089874,
        "compile_time": 0.8685512542724609
    },
    {
        "BLOCK_SIZE_M": 128,
        "BLOCK_SIZE_N": 32,
        "BLOCK_SIZE_K": 128,
        "GROUP_SIZE_M": 8,
        "num_stages": 3,
        "num_warps": 16,
        "ms": 0.03208940476179123,
        "min_ms": 0.03208940476179123,
        "max_ms": 0.03208940476179123,
        "compile_time": 0.7989182472229004
    },
    {
        "BLOCK_SIZE_M": 64,
        "BLOCK_SIZE_N": 128,
        "BLOCK_SIZE_K": 256,
        "GROUP_SIZE_M": 8,
        "num_stages": 2,
        "num_warps": 8,
        "ms": 0.03209527209401131,
        "min_ms": 0.03209527209401131,
        "max_ms": 0.03209527209401131,
        "compile_time": 0.8377046585083008
    },
    {
        "BLOCK_SIZE_M": 64,
        "BLOCK_SIZE_N": 256,
        "BLOCK_SIZE_K": 64,
        "GROUP_SIZE_M": 8,
        "num_stages": 3,
        "num_warps": 32,
        "ms": 0.032116807997226715,
        "min_ms": 0.032116807997226715,
        "max_ms": 0.032116807997226715,
        "compile_time": 0.7867906093597412
    },
    {
        "BLOCK_SIZE_M": 32,
        "BLOCK_SIZE_N": 64,
        "BLOCK_SIZE_K": 64,
        "GROUP_SIZE_M": 8,
        "num_stages": 4,
        "num_warps": 4,
        "ms": 0.032122254371643066,
        "min_ms": 0.032122254371643066,
        "max_ms": 0.032122254371643066,
        "compile_time": 0.7475464344024658
    },
    {
        "BLOCK_SIZE_M": 32,
        "BLOCK_SIZE_N": 256,
        "BLOCK_SIZE_K": 16,
        "GROUP_SIZE_M": 8,
        "num_stages": 7,
        "num_warps": 8,
        "ms": 0.03215402364730835,
        "min_ms": 0.03215402364730835,
        "max_ms": 0.03215402364730835,
        "compile_time": 1.1445512771606445
    },
    {
        "BLOCK_SIZE_M": 256,
        "BLOCK_SIZE_N": 64,
        "BLOCK_SIZE_K": 64,
        "GROUP_SIZE_M": 8,
        "num_stages": 1,
        "num_warps": 4,
        "ms": 0.032171569764614105,
        "min_ms": 0.032171569764614105,
        "max_ms": 0.032171569764614105,
        "compile_time": 0.8582007884979248
    },
    {
        "BLOCK_SIZE_M": 128,
        "BLOCK_SIZE_N": 32,
        "BLOCK_SIZE_K": 32,
        "GROUP_SIZE_M": 8,
        "num_stages": 7,
        "num_warps": 4,
        "ms": 0.032187409698963165,
        "min_ms": 0.032187409698963165,
        "max_ms": 0.032187409698963165,
        "compile_time": 1.4713542461395264
    },
    {
        "BLOCK_SIZE_M": 512,
        "BLOCK_SIZE_N": 64,
        "BLOCK_SIZE_K": 32,
        "GROUP_SIZE_M": 8,
        "num_stages": 3,
        "num_warps": 8,
        "ms": 0.03219904750585556,
        "min_ms": 0.03219904750585556,
        "max_ms": 0.03219904750585556,
        "compile_time": 2.3150794506073
    },
    {
        "BLOCK_SIZE_M": 128,
        "BLOCK_SIZE_N": 64,
        "BLOCK_SIZE_K": 64,
        "GROUP_SIZE_M": 8,
        "num_stages": 2,
        "num_warps": 16,
        "ms": 0.03221746161580086,
        "min_ms": 0.03221746161580086,
        "max_ms": 0.03221746161580086,
        "compile_time": 0.805018424987793
    },
    {
        "BLOCK_SIZE_M": 32,
        "BLOCK_SIZE_N": 32,
        "BLOCK_SIZE_K": 32,
        "GROUP_SIZE_M": 8,
        "num_stages": 8,
        "num_warps": 2,
        "ms": 0.03225504606962204,
        "min_ms": 0.03225504606962204,
        "max_ms": 0.03225504606962204,
        "compile_time": 1.2364842891693115
    },
    {
        "BLOCK_SIZE_M": 64,
        "BLOCK_SIZE_N": 256,
        "BLOCK_SIZE_K": 64,
        "GROUP_SIZE_M": 8,
        "num_stages": 4,
        "num_warps": 32,
        "ms": 0.03227560967206955,
        "min_ms": 0.03227560967206955,
        "max_ms": 0.03227560967206955,
        "compile_time": 0.8036410808563232
    },
    {
        "BLOCK_SIZE_M": 128,
        "BLOCK_SIZE_N": 32,
        "BLOCK_SIZE_K": 256,
        "GROUP_SIZE_M": 8,
        "num_stages": 3,
        "num_warps": 8,
        "ms": 0.03228696435689926,
        "min_ms": 0.03228696435689926,
        "max_ms": 0.03228696435689926,
        "compile_time": 0.7879936695098877
    },
    {
        "BLOCK_SIZE_M": 32,
        "BLOCK_SIZE_N": 256,
        "BLOCK_SIZE_K": 16,
        "GROUP_SIZE_M": 8,
        "num_stages": 8,
        "num_warps": 8,
        "ms": 0.032313272356987,
        "min_ms": 0.032313272356987,
        "max_ms": 0.032313272356987,
        "compile_time": 1.2881379127502441
    },
    {
        "BLOCK_SIZE_M": 128,
        "BLOCK_SIZE_N": 64,
        "BLOCK_SIZE_K": 64,
        "GROUP_SIZE_M": 8,
        "num_stages": 3,
        "num_warps": 2,
        "ms": 0.03232409805059433,
        "min_ms": 0.03232409805059433,
        "max_ms": 0.03232409805059433,
        "compile_time": 0.8149409294128418
    },
    {
        "BLOCK_SIZE_M": 128,
        "BLOCK_SIZE_N": 64,
        "BLOCK_SIZE_K": 16,
        "GROUP_SIZE_M": 8,
        "num_stages": 8,
        "num_warps": 4,
        "ms": 0.03233814984560013,
        "min_ms": 0.03233814984560013,
        "max_ms": 0.03233814984560013,
        "compile_time": 1.5118355751037598
    },
    {
        "BLOCK_SIZE_M": 128,
        "BLOCK_SIZE_N": 256,
        "BLOCK_SIZE_K": 64,
        "GROUP_SIZE_M": 8,
        "num_stages": 4,
        "num_warps": 8,
        "ms": 0.03237881138920784,
        "min_ms": 0.03237881138920784,
        "max_ms": 0.03237881138920784,
        "compile_time": 0.8241481781005859
    },
    {
        "BLOCK_SIZE_M": 128,
        "BLOCK_SIZE_N": 256,
        "BLOCK_SIZE_K": 64,
        "GROUP_SIZE_M": 8,
        "num_stages": 3,
        "num_warps": 8,
        "ms": 0.032393280416727066,
        "min_ms": 0.032393280416727066,
        "max_ms": 0.032393280416727066,
        "compile_time": 0.8270654678344727
    },
    {
        "BLOCK_SIZE_M": 32,
        "BLOCK_SIZE_N": 32,
        "BLOCK_SIZE_K": 64,
        "GROUP_SIZE_M": 8,
        "num_stages": 6,
        "num_warps": 4,
        "ms": 0.03241345286369324,
        "min_ms": 0.03241345286369324,
        "max_ms": 0.03241345286369324,
        "compile_time": 1.2218573093414307
    },
    {
        "BLOCK_SIZE_M": 64,
        "BLOCK_SIZE_N": 64,
        "BLOCK_SIZE_K": 128,
        "GROUP_SIZE_M": 8,
        "num_stages": 5,
        "num_warps": 16,
        "ms": 0.032452356070280075,
        "min_ms": 0.032452356070280075,
        "max_ms": 0.032452356070280075,
        "compile_time": 0.771329402923584
    },
    {
        "BLOCK_SIZE_M": 256,
        "BLOCK_SIZE_N": 64,
        "BLOCK_SIZE_K": 16,
        "GROUP_SIZE_M": 8,
        "num_stages": 8,
        "num_warps": 8,
        "ms": 0.032483335584402084,
        "min_ms": 0.032483335584402084,
        "max_ms": 0.032483335584402084,
        "compile_time": 1.5934107303619385
    },
    {
        "BLOCK_SIZE_M": 128,
        "BLOCK_SIZE_N": 32,
        "BLOCK_SIZE_K": 256,
        "GROUP_SIZE_M": 8,
        "num_stages": 2,
        "num_warps": 4,
        "ms": 0.03249477595090866,
        "min_ms": 0.03249477595090866,
        "max_ms": 0.03249477595090866,
        "compile_time": 0.7674257755279541
    },
    {
        "BLOCK_SIZE_M": 32,
        "BLOCK_SIZE_N": 32,
        "BLOCK_SIZE_K": 32,
        "GROUP_SIZE_M": 8,
        "num_stages": 2,
        "num_warps": 2,
        "ms": 0.03250347077846527,
        "min_ms": 0.03250347077846527,
        "max_ms": 0.03250347077846527,
        "compile_time": 0.7099838256835938
    },
    {
        "BLOCK_SIZE_M": 32,
        "BLOCK_SIZE_N": 32,
        "BLOCK_SIZE_K": 64,
        "GROUP_SIZE_M": 8,
        "num_stages": 3,
        "num_warps": 2,
        "ms": 0.03251891955733299,
        "min_ms": 0.03251891955733299,
        "max_ms": 0.03251891955733299,
        "compile_time": 0.7411785125732422
    },
    {
        "BLOCK_SIZE_M": 64,
        "BLOCK_SIZE_N": 128,
        "BLOCK_SIZE_K": 256,
        "GROUP_SIZE_M": 8,
        "num_stages": 2,
        "num_warps": 4,
        "ms": 0.032527707517147064,
        "min_ms": 0.032527707517147064,
        "max_ms": 0.032527707517147064,
        "compile_time": 0.8253660202026367
    },
    {
        "BLOCK_SIZE_M": 512,
        "BLOCK_SIZE_N": 64,
        "BLOCK_SIZE_K": 32,
        "GROUP_SIZE_M": 8,
        "num_stages": 4,
        "num_warps": 8,
        "ms": 0.0325322225689888,
        "min_ms": 0.0325322225689888,
        "max_ms": 0.0325322225689888,
        "compile_time": 2.3278849124908447
    },
    {
        "BLOCK_SIZE_M": 128,
        "BLOCK_SIZE_N": 32,
        "BLOCK_SIZE_K": 32,
        "GROUP_SIZE_M": 8,
        "num_stages": 8,
        "num_warps": 4,
        "ms": 0.032547492533922195,
        "min_ms": 0.032547492533922195,
        "max_ms": 0.032547492533922195,
        "compile_time": 1.5048882961273193
    },
    {
        "BLOCK_SIZE_M": 64,
        "BLOCK_SIZE_N": 256,
        "BLOCK_SIZE_K": 128,
        "GROUP_SIZE_M": 8,
        "num_stages": 3,
        "num_warps": 32,
        "ms": 0.03255247324705124,
        "min_ms": 0.03255247324705124,
        "max_ms": 0.03255247324705124,
        "compile_time": 0.7691552639007568
    },
    {
        "BLOCK_SIZE_M": 128,
        "BLOCK_SIZE_N": 128,
        "BLOCK_SIZE_K": 64,
        "GROUP_SIZE_M": 8,
        "num_stages": 1,
        "num_warps": 32,
        "ms": 0.03255264833569527,
        "min_ms": 0.03255264833569527,
        "max_ms": 0.03255264833569527,
        "compile_time": 0.8566761016845703
    },
    {
        "BLOCK_SIZE_M": 64,
        "BLOCK_SIZE_N": 256,
        "BLOCK_SIZE_K": 16,
        "GROUP_SIZE_M": 8,
        "num_stages": 3,
        "num_warps": 16,
        "ms": 0.03257079795002937,
        "min_ms": 0.03257079795002937,
        "max_ms": 0.03257079795002937,
        "compile_time": 1.25111722946167
    },
    {
        "BLOCK_SIZE_M": 128,
        "BLOCK_SIZE_N": 64,
        "BLOCK_SIZE_K": 32,
        "GROUP_SIZE_M": 8,
        "num_stages": 1,
        "num_warps": 8,
        "ms": 0.0325874462723732,
        "min_ms": 0.0325874462723732,
        "max_ms": 0.0325874462723732,
        "compile_time": 0.8220069408416748
    },
    {
        "BLOCK_SIZE_M": 256,
        "BLOCK_SIZE_N": 64,
        "BLOCK_SIZE_K": 128,
        "GROUP_SIZE_M": 8,
        "num_stages": 3,
        "num_warps": 4,
        "ms": 0.032601483166217804,
        "min_ms": 0.032601483166217804,
        "max_ms": 0.032601483166217804,
        "compile_time": 0.7611751556396484
    },
    {
        "BLOCK_SIZE_M": 32,
        "BLOCK_SIZE_N": 128,
        "BLOCK_SIZE_K": 64,
        "GROUP_SIZE_M": 8,
        "num_stages": 3,
        "num_warps": 16,
        "ms": 0.032613687217235565,
        "min_ms": 0.032613687217235565,
        "max_ms": 0.032613687217235565,
        "compile_time": 0.7510507106781006
    },
    {
        "BLOCK_SIZE_M": 256,
        "BLOCK_SIZE_N": 64,
        "BLOCK_SIZE_K": 256,
        "GROUP_SIZE_M": 8,
        "num_stages": 2,
        "num_warps": 16,
        "ms": 0.032616112381219864,
        "min_ms": 0.032616112381219864,
        "max_ms": 0.032616112381219864,
        "compile_time": 0.8625390529632568
    },
    {
        "BLOCK_SIZE_M": 32,
        "BLOCK_SIZE_N": 32,
        "BLOCK_SIZE_K": 32,
        "GROUP_SIZE_M": 8,
        "num_stages": 2,
        "num_warps": 4,
        "ms": 0.03262452408671379,
        "min_ms": 0.03262452408671379,
        "max_ms": 0.03262452408671379,
        "compile_time": 0.7601428031921387
    },
    {
        "BLOCK_SIZE_M": 32,
        "BLOCK_SIZE_N": 64,
        "BLOCK_SIZE_K": 16,
        "GROUP_SIZE_M": 8,
        "num_stages": 3,
        "num_warps": 4,
        "ms": 0.032631512731313705,
        "min_ms": 0.032631512731313705,
        "max_ms": 0.032631512731313705,
        "compile_time": 1.1419029235839844
    },
    {
        "BLOCK_SIZE_M": 128,
        "BLOCK_SIZE_N": 64,
        "BLOCK_SIZE_K": 64,
        "GROUP_SIZE_M": 8,
        "num_stages": 7,
        "num_warps": 16,
        "ms": 0.03263308107852936,
        "min_ms": 0.03263308107852936,
        "max_ms": 0.03263308107852936,
        "compile_time": 1.405014991760254
    },
    {
        "BLOCK_SIZE_M": 32,
        "BLOCK_SIZE_N": 32,
        "BLOCK_SIZE_K": 32,
        "GROUP_SIZE_M": 8,
        "num_stages": 6,
        "num_warps": 4,
        "ms": 0.032638564705848694,
        "min_ms": 0.032638564705848694,
        "max_ms": 0.032638564705848694,
        "compile_time": 1.1265811920166016
    },
    {
        "BLOCK_SIZE_M": 64,
        "BLOCK_SIZE_N": 64,
        "BLOCK_SIZE_K": 128,
        "GROUP_SIZE_M": 8,
        "num_stages": 4,
        "num_warps": 2,
        "ms": 0.032638825476169586,
        "min_ms": 0.032638825476169586,
        "max_ms": 0.032638825476169586,
        "compile_time": 0.7943823337554932
    },
    {
        "BLOCK_SIZE_M": 64,
        "BLOCK_SIZE_N": 64,
        "BLOCK_SIZE_K": 128,
        "GROUP_SIZE_M": 8,
        "num_stages": 5,
        "num_warps": 2,
        "ms": 0.032642070204019547,
        "min_ms": 0.032642070204019547,
        "max_ms": 0.032642070204019547,
        "compile_time": 0.7829799652099609
    },
    {
        "BLOCK_SIZE_M": 256,
        "BLOCK_SIZE_N": 64,
        "BLOCK_SIZE_K": 16,
        "GROUP_SIZE_M": 8,
        "num_stages": 7,
        "num_warps": 8,
        "ms": 0.03264467790722847,
        "min_ms": 0.03264467790722847,
        "max_ms": 0.03264467790722847,
        "compile_time": 1.6122734546661377
    },
    {
        "BLOCK_SIZE_M": 32,
        "BLOCK_SIZE_N": 64,
        "BLOCK_SIZE_K": 64,
        "GROUP_SIZE_M": 8,
        "num_stages": 1,
        "num_warps": 8,
        "ms": 0.03264717385172844,
        "min_ms": 0.03264717385172844,
        "max_ms": 0.03264717385172844,
        "compile_time": 0.7266709804534912
    },
    {
        "BLOCK_SIZE_M": 64,
        "BLOCK_SIZE_N": 256,
        "BLOCK_SIZE_K": 16,
        "GROUP_SIZE_M": 8,
        "num_stages": 5,
        "num_warps": 16,
        "ms": 0.03265143185853958,
        "min_ms": 0.03265143185853958,
        "max_ms": 0.03265143185853958,
        "compile_time": 1.279221773147583
    },
    {
        "BLOCK_SIZE_M": 64,
        "BLOCK_SIZE_N": 128,
        "BLOCK_SIZE_K": 16,
        "GROUP_SIZE_M": 8,
        "num_stages": 3,
        "num_warps": 8,
        "ms": 0.03265807777643204,
        "min_ms": 0.03265807777643204,
        "max_ms": 0.03265807777643204,
        "compile_time": 1.2620947360992432
    },
    {
        "BLOCK_SIZE_M": 64,
        "BLOCK_SIZE_N": 256,
        "BLOCK_SIZE_K": 64,
        "GROUP_SIZE_M": 8,
        "num_stages": 5,
        "num_warps": 32,
        "ms": 0.03267712518572807,
        "min_ms": 0.03267712518572807,
        "max_ms": 0.03267712518572807,
        "compile_time": 0.780897855758667
    },
    {
        "BLOCK_SIZE_M": 64,
        "BLOCK_SIZE_N": 64,
        "BLOCK_SIZE_K": 32,
        "GROUP_SIZE_M": 8,
        "num_stages": 1,
        "num_warps": 8,
        "ms": 0.03268727660179138,
        "min_ms": 0.03268727660179138,
        "max_ms": 0.03268727660179138,
        "compile_time": 0.7812604904174805
    },
    {
        "BLOCK_SIZE_M": 64,
        "BLOCK_SIZE_N": 64,
        "BLOCK_SIZE_K": 128,
        "GROUP_SIZE_M": 8,
        "num_stages": 2,
        "num_warps": 16,
        "ms": 0.03270353749394417,
        "min_ms": 0.03270353749394417,
        "max_ms": 0.03270353749394417,
        "compile_time": 0.7841086387634277
    },
    {
        "BLOCK_SIZE_M": 256,
        "BLOCK_SIZE_N": 32,
        "BLOCK_SIZE_K": 32,
        "GROUP_SIZE_M": 8,
        "num_stages": 6,
        "num_warps": 8,
        "ms": 0.03270518407225609,
        "min_ms": 0.03270518407225609,
        "max_ms": 0.03270518407225609,
        "compile_time": 1.563272476196289
    },
    {
        "BLOCK_SIZE_M": 64,
        "BLOCK_SIZE_N": 128,
        "BLOCK_SIZE_K": 16,
        "GROUP_SIZE_M": 8,
        "num_stages": 4,
        "num_warps": 8,
        "ms": 0.03271372616291046,
        "min_ms": 0.03271372616291046,
        "max_ms": 0.03271372616291046,
        "compile_time": 1.274315357208252
    },
    {
        "BLOCK_SIZE_M": 32,
        "BLOCK_SIZE_N": 32,
        "BLOCK_SIZE_K": 64,
        "GROUP_SIZE_M": 8,
        "num_stages": 3,
        "num_warps": 4,
        "ms": 0.03271665796637535,
        "min_ms": 0.03271665796637535,
        "max_ms": 0.03271665796637535,
        "compile_time": 0.7366349697113037
    },
    {
        "BLOCK_SIZE_M": 512,
        "BLOCK_SIZE_N": 32,
        "BLOCK_SIZE_K": 32,
        "GROUP_SIZE_M": 8,
        "num_stages": 5,
        "num_warps": 16,
        "ms": 0.03275757282972336,
        "min_ms": 0.03275757282972336,
        "max_ms": 0.03275757282972336,
        "compile_time": 1.6684551239013672
    },
    {
        "BLOCK_SIZE_M": 512,
        "BLOCK_SIZE_N": 64,
        "BLOCK_SIZE_K": 32,
        "GROUP_SIZE_M": 8,
        "num_stages": 5,
        "num_warps": 8,
        "ms": 0.032776933163404465,
        "min_ms": 0.032776933163404465,
        "max_ms": 0.032776933163404465,
        "compile_time": 2.3427810668945312
    },
    {
        "BLOCK_SIZE_M": 128,
        "BLOCK_SIZE_N": 16,
        "BLOCK_SIZE_K": 32,
        "GROUP_SIZE_M": 8,
        "num_stages": 2,
        "num_warps": 4,
        "ms": 0.03279654681682587,
        "min_ms": 0.03279654681682587,
        "max_ms": 0.03279654681682587,
        "compile_time": 1.3572900295257568
    },
    {
        "BLOCK_SIZE_M": 256,
        "BLOCK_SIZE_N": 64,
        "BLOCK_SIZE_K": 64,
        "GROUP_SIZE_M": 8,
        "num_stages": 5,
        "num_warps": 32,
        "ms": 0.03280062600970268,
        "min_ms": 0.03280062600970268,
        "max_ms": 0.03280062600970268,
        "compile_time": 0.8571207523345947
    },
    {
        "BLOCK_SIZE_M": 32,
        "BLOCK_SIZE_N": 64,
        "BLOCK_SIZE_K": 16,
        "GROUP_SIZE_M": 8,
        "num_stages": 5,
        "num_warps": 4,
        "ms": 0.03282687067985535,
        "min_ms": 0.03282687067985535,
        "max_ms": 0.03282687067985535,
        "compile_time": 1.1544322967529297
    },
    {
        "BLOCK_SIZE_M": 512,
        "BLOCK_SIZE_N": 32,
        "BLOCK_SIZE_K": 64,
        "GROUP_SIZE_M": 8,
        "num_stages": 2,
        "num_warps": 8,
        "ms": 0.032836560159921646,
        "min_ms": 0.032836560159921646,
        "max_ms": 0.032836560159921646,
        "compile_time": 2.053907632827759
    },
    {
        "BLOCK_SIZE_M": 64,
        "BLOCK_SIZE_N": 128,
        "BLOCK_SIZE_K": 16,
        "GROUP_SIZE_M": 8,
        "num_stages": 5,
        "num_warps": 8,
        "ms": 0.032839685678482056,
        "min_ms": 0.032839685678482056,
        "max_ms": 0.032839685678482056,
        "compile_time": 1.251821517944336
    },
    {
        "BLOCK_SIZE_M": 32,
        "BLOCK_SIZE_N": 64,
        "BLOCK_SIZE_K": 128,
        "GROUP_SIZE_M": 8,
        "num_stages": 7,
        "num_warps": 4,
        "ms": 0.03285064548254013,
        "min_ms": 0.03285064548254013,
        "max_ms": 0.03285064548254013,
        "compile_time": 1.6242222785949707
    },
    {
        "BLOCK_SIZE_M": 32,
        "BLOCK_SIZE_N": 128,
        "BLOCK_SIZE_K": 64,
        "GROUP_SIZE_M": 8,
        "num_stages": 4,
        "num_warps": 16,
        "ms": 0.03285715728998184,
        "min_ms": 0.03285715728998184,
        "max_ms": 0.03285715728998184,
        "compile_time": 0.7470197677612305
    },
    {
        "BLOCK_SIZE_M": 32,
        "BLOCK_SIZE_N": 128,
        "BLOCK_SIZE_K": 128,
        "GROUP_SIZE_M": 8,
        "num_stages": 2,
        "num_warps": 8,
        "ms": 0.03286098688840866,
        "min_ms": 0.03286098688840866,
        "max_ms": 0.03286098688840866,
