simdata/FP16-R100/1536_fails.json
[
    {
        "BLOCK_SIZE_M": 16,
        "BLOCK_SIZE_N": 16,
        "BLOCK_SIZE_K": 512,
        "GROUP_SIZE_M": 8,
        "num_stages": 7,
        "num_warps": 2,
        "compile_time": 0.010080337524414062
    },
    {
        "BLOCK_SIZE_M": 16,
        "BLOCK_SIZE_N": 16,
        "BLOCK_SIZE_K": 512,
        "GROUP_SIZE_M": 8,
        "num_stages": 7,
        "num_warps": 4,
        "compile_time": 0.006332874298095703
    },
    {
        "BLOCK_SIZE_M": 16,
        "BLOCK_SIZE_N": 16,
        "BLOCK_SIZE_K": 512,
        "GROUP_SIZE_M": 8,
        "num_stages": 7,
        "num_warps": 8,
        "compile_time": 0.004962444305419922
    },
    {
        "BLOCK_SIZE_M": 16,
        "BLOCK_SIZE_N": 16,
        "BLOCK_SIZE_K": 512,
        "GROUP_SIZE_M": 8,
        "num_stages": 7,
        "num_warps": 16,
        "compile_time": 0.005159616470336914
    },
    {
        "BLOCK_SIZE_M": 16,
        "BLOCK_SIZE_N": 16,
        "BLOCK_SIZE_K": 512,
        "GROUP_SIZE_M": 8,
        "num_stages": 7,
        "num_warps": 32,
        "compile_time": 0.003363370895385742
    },
    {
        "BLOCK_SIZE_M": 16,
        "BLOCK_SIZE_N": 16,
        "BLOCK_SIZE_K": 512,
        "GROUP_SIZE_M": 8,
        "num_stages": 8,
        "num_warps": 2,
        "compile_time": 0.0036478042602539062
    },
    {
        "BLOCK_SIZE_M": 16,
        "BLOCK_SIZE_N": 16,
        "BLOCK_SIZE_K": 512,
        "GROUP_SIZE_M": 8,
        "num_stages": 8,
        "num_warps": 4,
        "compile_time": 0.0033597946166992188
    },
    {
        "BLOCK_SIZE_M": 16,
        "BLOCK_SIZE_N": 16,
        "BLOCK_SIZE_K": 512,
        "GROUP_SIZE_M": 8,
        "num_stages": 8,
        "num_warps": 8,
        "compile_time": 0.0027544498443603516
    },
    {
        "BLOCK_SIZE_M": 16,
        "BLOCK_SIZE_N": 16,
        "BLOCK_SIZE_K": 512,
        "GROUP_SIZE_M": 8,
        "num_stages": 8,
        "num_warps": 16,
        "compile_time": 0.002672910690307617
    },
    {
        "BLOCK_SIZE_M": 16,
        "BLOCK_SIZE_N": 16,
        "BLOCK_SIZE_K": 512,
        "GROUP_SIZE_M": 8,
        "num_stages": 8,
        "num_warps": 32,
        "compile_time": 0.0027081966400146484
    },
    {
        "BLOCK_SIZE_M": 16,
        "BLOCK_SIZE_N": 32,
        "BLOCK_SIZE_K": 256,
        "GROUP_SIZE_M": 8,
        "num_stages": 8,
        "num_warps": 2,
        "compile_time": 1.2040488719940186
    },
    {
        "BLOCK_SIZE_M": 16,
        "BLOCK_SIZE_N": 32,
        "BLOCK_SIZE_K": 256,
        "GROUP_SIZE_M": 8,
        "num_stages": 8,
        "num_warps": 4,
        "compile_time": 0.7235679626464844
    },
    {
        "BLOCK_SIZE_M": 16,
        "BLOCK_SIZE_N": 32,
        "BLOCK_SIZE_K": 256,
        "GROUP_SIZE_M": 8,
        "num_stages": 8,
        "num_warps": 8,
        "compile_time": 0.5251860618591309
    },
    {
        "BLOCK_SIZE_M": 16,
        "BLOCK_SIZE_N": 32,
        "BLOCK_SIZE_K": 256,
        "GROUP_SIZE_M": 8,
        "num_stages": 8,
        "num_warps": 16,
        "compile_time": 0.433866024017334
    },
    {
        "BLOCK_SIZE_M": 16,
        "BLOCK_SIZE_N": 32,
        "BLOCK_SIZE_K": 256,
        "GROUP_SIZE_M": 8,
        "num_stages": 8,
        "num_warps": 32,
        "compile_time": 0.3924744129180908
    },
    {
        "BLOCK_SIZE_M": 16,
        "BLOCK_SIZE_N": 32,
        "BLOCK_SIZE_K": 512,
        "GROUP_SIZE_M": 8,
        "num_stages": 5,
        "num_warps": 2,
        "compile_time": 2.3898301124572754
    },
    {
        "BLOCK_SIZE_M": 16,
        "BLOCK_SIZE_N": 32,
        "BLOCK_SIZE_K": 512,
        "GROUP_SIZE_M": 8,
        "num_stages": 5,
        "num_warps": 4,
        "compile_time": 1.0542707443237305
    },
    {
        "BLOCK_SIZE_M": 16,
        "BLOCK_SIZE_N": 32,
        "BLOCK_SIZE_K": 512,
        "GROUP_SIZE_M": 8,
        "num_stages": 5,
        "num_warps": 8,
        "compile_time": 0.7081339359283447
    },
    {
        "BLOCK_SIZE_M": 16,
        "BLOCK_SIZE_N": 32,
        "BLOCK_SIZE_K": 512,
        "GROUP_SIZE_M": 8,
        "num_stages": 5,
        "num_warps": 16,
        "compile_time": 0.5743474960327148
    },
    {
        "BLOCK_SIZE_M": 16,
        "BLOCK_SIZE_N": 32,
        "BLOCK_SIZE_K": 512,
        "GROUP_SIZE_M": 8,
        "num_stages": 5,
        "num_warps": 32,
        "compile_time": 0.49702000617980957
    },
    {
        "BLOCK_SIZE_M": 16,
        "BLOCK_SIZE_N": 32,
        "BLOCK_SIZE_K": 512,
        "GROUP_SIZE_M": 8,
        "num_stages": 6,
        "num_warps": 2,
        "compile_time": 2.5182230472564697
    },
    {
        "BLOCK_SIZE_M": 16,
        "BLOCK_SIZE_N": 32,
        "BLOCK_SIZE_K": 512,
        "GROUP_SIZE_M": 8,
        "num_stages": 6,
        "num_warps": 4,
        "compile_time": 1.1328151226043701
    },
    {
        "BLOCK_SIZE_M": 16,
        "BLOCK_SIZE_N": 32,
        "BLOCK_SIZE_K": 512,
        "GROUP_SIZE_M": 8,
        "num_stages": 6,
        "num_warps": 8,
        "compile_time": 0.7375099658966064
    },
    {
        "BLOCK_SIZE_M": 16,
        "BLOCK_SIZE_N": 32,
        "BLOCK_SIZE_K": 512,
        "GROUP_SIZE_M": 8,
        "num_stages": 6,
        "num_warps": 16,
        "compile_time": 0.5821309089660645
    },
    {
        "BLOCK_SIZE_M": 16,
        "BLOCK_SIZE_N": 32,
        "BLOCK_SIZE_K": 512,
        "GROUP_SIZE_M": 8,
        "num_stages": 6,
        "num_warps": 32,
        "compile_time": 0.5130369663238525
    },
    {
        "BLOCK_SIZE_M": 16,
        "BLOCK_SIZE_N": 32,
        "BLOCK_SIZE_K": 512,
        "GROUP_SIZE_M": 8,
        "num_stages": 7,
        "num_warps": 2,
        "compile_time": 2.7293033599853516
    },
    {
        "BLOCK_SIZE_M": 16,
        "BLOCK_SIZE_N": 32,
        "BLOCK_SIZE_K": 512,
        "GROUP_SIZE_M": 8,
        "num_stages": 7,
        "num_warps": 4,
        "compile_time": 1.2322337627410889
    },
    {
        "BLOCK_SIZE_M": 16,
        "BLOCK_SIZE_N": 32,
        "BLOCK_SIZE_K": 512,
        "GROUP_SIZE_M": 8,
        "num_stages": 7,
        "num_warps": 8,
        "compile_time": 0.8122718334197998
    },
    {
        "BLOCK_SIZE_M": 16,
        "BLOCK_SIZE_N": 32,
        "BLOCK_SIZE_K": 512,
        "GROUP_SIZE_M": 8,
        "num_stages": 7,
        "num_warps": 16,
        "compile_time": 0.6338727474212646
    },
    {
        "BLOCK_SIZE_M": 16,
        "BLOCK_SIZE_N": 32,
        "BLOCK_SIZE_K": 512,
        "GROUP_SIZE_M": 8,
        "num_stages": 7,
        "num_warps": 32,
        "compile_time": 0.5314791202545166
    },
    {
        "BLOCK_SIZE_M": 16,
        "BLOCK_SIZE_N": 32,
        "BLOCK_SIZE_K": 512,
        "GROUP_SIZE_M": 8,
        "num_stages": 8,
        "num_warps": 2,
        "compile_time": 2.848054885864258
    },
    {
        "BLOCK_SIZE_M": 16,
        "BLOCK_SIZE_N": 32,
        "BLOCK_SIZE_K": 512,
        "GROUP_SIZE_M": 8,
        "num_stages": 8,
        "num_warps": 4,
        "compile_time": 1.3064117431640625
    },
    {
        "BLOCK_SIZE_M": 16,
        "BLOCK_SIZE_N": 32,
        "BLOCK_SIZE_K": 512,
        "GROUP_SIZE_M": 8,
        "num_stages": 8,
        "num_warps": 8,
        "compile_time": 0.8288388252258301
    },
    {
        "BLOCK_SIZE_M": 16,
        "BLOCK_SIZE_N": 32,
        "BLOCK_SIZE_K": 512,
        "GROUP_SIZE_M": 8,
        "num_stages": 8,
        "num_warps": 16,
        "compile_time": 0.6596851348876953
    },
    {
        "BLOCK_SIZE_M": 16,
        "BLOCK_SIZE_N": 32,
        "BLOCK_SIZE_K": 512,
        "GROUP_SIZE_M": 8,
        "num_stages": 8,
        "num_warps": 32,
        "compile_time": 0.5535788536071777
    },
    {
        "BLOCK_SIZE_M": 16,
        "BLOCK_SIZE_N": 64,
        "BLOCK_SIZE_K": 256,
        "GROUP_SIZE_M": 8,
        "num_stages": 6,
        "num_warps": 2,
        "compile_time": 2.2293667793273926
    },
    {
        "BLOCK_SIZE_M": 16,
        "BLOCK_SIZE_N": 64,
        "BLOCK_SIZE_K": 256,
        "GROUP_SIZE_M": 8,
        "num_stages": 6,
        "num_warps": 4,
        "compile_time": 1.0070815086364746
    },
    {
        "BLOCK_SIZE_M": 16,
        "BLOCK_SIZE_N": 64,
        "BLOCK_SIZE_K": 256,
        "GROUP_SIZE_M": 8,
        "num_stages": 6,
        "num_warps": 8,
        "compile_time": 0.6127958297729492
    },
    {
        "BLOCK_SIZE_M": 16,
        "BLOCK_SIZE_N": 64,
        "BLOCK_SIZE_K": 256,
        "GROUP_SIZE_M": 8,
        "num_stages": 6,
        "num_warps": 16,
        "compile_time": 0.4846220016479492
    },
    {
        "BLOCK_SIZE_M": 16,
        "BLOCK_SIZE_N": 64,
        "BLOCK_SIZE_K": 256,
        "GROUP_SIZE_M": 8,
        "num_stages": 6,
        "num_warps": 32,
        "compile_time": 0.42711472511291504
    },
    {
        "BLOCK_SIZE_M": 16,
        "BLOCK_SIZE_N": 64,
        "BLOCK_SIZE_K": 256,
        "GROUP_SIZE_M": 8,
        "num_stages": 7,
        "num_warps": 2,
        "compile_time": 2.3501453399658203
    },
    {
        "BLOCK_SIZE_M": 16,
        "BLOCK_SIZE_N": 64,
        "BLOCK_SIZE_K": 256,
        "GROUP_SIZE_M": 8,
        "num_stages": 7,
        "num_warps": 4,
        "compile_time": 1.0571041107177734
    },
    {
        "BLOCK_SIZE_M": 16,
        "BLOCK_SIZE_N": 64,
        "BLOCK_SIZE_K": 256,
        "GROUP_SIZE_M": 8,
        "num_stages": 7,
        "num_warps": 8,
        "compile_time": 0.6420705318450928
    },
    {
        "BLOCK_SIZE_M": 16,
        "BLOCK_SIZE_N": 64,
        "BLOCK_SIZE_K": 256,
        "GROUP_SIZE_M": 8,
        "num_stages": 7,
        "num_warps": 16,
        "compile_time": 0.5004925727844238
    },
    {
        "BLOCK_SIZE_M": 16,
        "BLOCK_SIZE_N": 64,
        "BLOCK_SIZE_K": 256,
        "GROUP_SIZE_M": 8,
        "num_stages": 7,
        "num_warps": 32,
        "compile_time": 0.43383073806762695
    },
    {
        "BLOCK_SIZE_M": 16,
        "BLOCK_SIZE_N": 64,
        "BLOCK_SIZE_K": 256,
        "GROUP_SIZE_M": 8,
        "num_stages": 8,
        "num_warps": 2,
        "compile_time": 2.447422981262207
    },
    {
        "BLOCK_SIZE_M": 16,
        "BLOCK_SIZE_N": 64,
        "BLOCK_SIZE_K": 256,
        "GROUP_SIZE_M": 8,
        "num_stages": 8,
        "num_warps": 4,
        "compile_time": 1.150965929031372
    },
    {
        "BLOCK_SIZE_M": 16,
        "BLOCK_SIZE_N": 64,
        "BLOCK_SIZE_K": 256,
        "GROUP_SIZE_M": 8,
        "num_stages": 8,
        "num_warps": 8,
        "compile_time": 0.7030937671661377
    },
    {
        "BLOCK_SIZE_M": 16,
        "BLOCK_SIZE_N": 64,
        "BLOCK_SIZE_K": 256,
        "GROUP_SIZE_M": 8,
        "num_stages": 8,
        "num_warps": 16,
        "compile_time": 0.5285170078277588
    },
    {
        "BLOCK_SIZE_M": 16,
        "BLOCK_SIZE_N": 64,
        "BLOCK_SIZE_K": 256,
        "GROUP_SIZE_M": 8,
        "num_stages": 8,
        "num_warps": 32,
        "compile_time": 0.4577934741973877
    },
    {
        "BLOCK_SIZE_M": 16,
        "BLOCK_SIZE_N": 64,
        "BLOCK_SIZE_K": 512,
        "GROUP_SIZE_M": 8,
        "num_stages": 3,
        "num_warps": 2,
        "compile_time": 10.748398542404175
    },
    {
        "BLOCK_SIZE_M": 16,
        "BLOCK_SIZE_N": 64,
        "BLOCK_SIZE_K": 512,
        "GROUP_SIZE_M": 8,
        "num_stages": 4,
        "num_warps": 2,
        "compile_time": 10.7229483127594
    },
    {
        "BLOCK_SIZE_M": 16,
        "BLOCK_SIZE_N": 64,
        "BLOCK_SIZE_K": 512,
        "GROUP_SIZE_M": 8,
        "num_stages": 4,
        "num_warps": 4,
        "compile_time": 2.010213613510132
    },
    {
        "BLOCK_SIZE_M": 16,
        "BLOCK_SIZE_N": 64,
        "BLOCK_SIZE_K": 512,
        "GROUP_SIZE_M": 8,
        "num_stages": 4,
        "num_warps": 8,
        "compile_time": 0.9401712417602539
    },
    {
        "BLOCK_SIZE_M": 16,
        "BLOCK_SIZE_N": 64,
        "BLOCK_SIZE_K": 512,
        "GROUP_SIZE_M": 8,
        "num_stages": 4,
        "num_warps": 16,
        "compile_time": 0.6661665439605713
    },
    {
        "BLOCK_SIZE_M": 16,
        "BLOCK_SIZE_N": 64,
        "BLOCK_SIZE_K": 512,
        "GROUP_SIZE_M": 8,
        "num_stages": 4,
        "num_warps": 32,
        "compile_time": 0.5661513805389404
    },
    {
        "BLOCK_SIZE_M": 16,
        "BLOCK_SIZE_N": 64,
        "BLOCK_SIZE_K": 512,
        "GROUP_SIZE_M": 8,
        "num_stages": 5,
        "num_warps": 2,
        "compile_time": 10.941885948181152
    },
    {
        "BLOCK_SIZE_M": 16,
        "BLOCK_SIZE_N": 64,
        "BLOCK_SIZE_K": 512,
        "GROUP_SIZE_M": 8,
        "num_stages": 5,
        "num_warps": 4,
        "compile_time": 2.1652426719665527
    },
    {
        "BLOCK_SIZE_M": 16,
        "BLOCK_SIZE_N": 64,
        "BLOCK_SIZE_K": 512,
        "GROUP_SIZE_M": 8,
        "num_stages": 5,
        "num_warps": 8,
        "compile_time": 1.0233538150787354
    },
    {
        "BLOCK_SIZE_M": 16,
        "BLOCK_SIZE_N": 64,
        "BLOCK_SIZE_K": 512,
        "GROUP_SIZE_M": 8,
        "num_stages": 5,
        "num_warps": 16,
        "compile_time": 0.7004389762878418
    },
    {
        "BLOCK_SIZE_M": 16,
        "BLOCK_SIZE_N": 64,
        "BLOCK_SIZE_K": 512,
        "GROUP_SIZE_M": 8,
        "num_stages": 5,
        "num_warps": 32,
        "compile_time": 0.5672576427459717
    },
    {
        "BLOCK_SIZE_M": 16,
        "BLOCK_SIZE_N": 64,
        "BLOCK_SIZE_K": 512,
        "GROUP_SIZE_M": 8,
        "num_stages": 6,
        "num_warps": 2,
        "compile_time": 11.117506504058838
    },
    {
        "BLOCK_SIZE_M": 16,
        "BLOCK_SIZE_N": 64,
        "BLOCK_SIZE_K": 512,
        "GROUP_SIZE_M": 8,
        "num_stages": 6,
        "num_warps": 4,
        "compile_time": 2.3018949031829834
    },
    {
        "BLOCK_SIZE_M": 16,
        "BLOCK_SIZE_N": 64,
        "BLOCK_SIZE_K": 512,
        "GROUP_SIZE_M": 8,
        "num_stages": 6,
        "num_warps": 8,
        "compile_time": 1.0869801044464111
    },
    {
        "BLOCK_SIZE_M": 16,
        "BLOCK_SIZE_N": 64,
        "BLOCK_SIZE_K": 512,
        "GROUP_SIZE_M": 8,
        "num_stages": 6,
        "num_warps": 16,
        "compile_time": 0.7662978172302246
    },
    {
        "BLOCK_SIZE_M": 16,
        "BLOCK_SIZE_N": 64,
        "BLOCK_SIZE_K": 512,
        "GROUP_SIZE_M": 8,
        "num_stages": 6,
        "num_warps": 32,
        "compile_time": 0.6094164848327637
    },
    {
        "BLOCK_SIZE_M": 16,
        "BLOCK_SIZE_N": 64,
        "BLOCK_SIZE_K": 512,
        "GROUP_SIZE_M": 8,
        "num_stages": 7,
        "num_warps": 2,
        "compile_time": 11.275774717330933
    },
    {
        "BLOCK_SIZE_M": 16,
        "BLOCK_SIZE_N": 64,
        "BLOCK_SIZE_K": 512,
        "GROUP_SIZE_M": 8,
        "num_stages": 7,
        "num_warps": 4,
        "compile_time": 2.4489316940307617
    },
    {
        "BLOCK_SIZE_M": 16,
        "BLOCK_SIZE_N": 64,
        "BLOCK_SIZE_K": 512,
        "GROUP_SIZE_M": 8,
        "num_stages": 7,
        "num_warps": 8,
        "compile_time": 1.1972579956054688
    },
    {
        "BLOCK_SIZE_M": 16,
        "BLOCK_SIZE_N": 64,
        "BLOCK_SIZE_K": 512,
        "GROUP_SIZE_M": 8,
        "num_stages": 7,
        "num_warps": 16,
        "compile_time": 0.7655143737792969
    },
    {
        "BLOCK_SIZE_M": 16,
        "BLOCK_SIZE_N": 64,
        "BLOCK_SIZE_K": 512,
        "GROUP_SIZE_M": 8,
        "num_stages": 7,
        "num_warps": 32,
        "compile_time": 0.6351158618927002
    },
    {
        "BLOCK_SIZE_M": 16,
        "BLOCK_SIZE_N": 64,
        "BLOCK_SIZE_K": 512,
        "GROUP_SIZE_M": 8,
        "num_stages": 8,
        "num_warps": 2,
        "compile_time": 11.700721502304077
    },
    {
        "BLOCK_SIZE_M": 16,
        "BLOCK_SIZE_N": 64,
        "BLOCK_SIZE_K": 512,
        "GROUP_SIZE_M": 8,
        "num_stages": 8,
        "num_warps": 4,
        "compile_time": 2.5492093563079834
    },
    {
        "BLOCK_SIZE_M": 16,
        "BLOCK_SIZE_N": 64,
        "BLOCK_SIZE_K": 512,
        "GROUP_SIZE_M": 8,
        "num_stages": 8,
        "num_warps": 8,
        "compile_time": 1.3141882419586182
    },
    {
        "BLOCK_SIZE_M": 16,
        "BLOCK_SIZE_N": 64,
        "BLOCK_SIZE_K": 512,
        "GROUP_SIZE_M": 8,
        "num_stages": 8,
        "num_warps": 16,
        "compile_time": 0.8553140163421631
    },
    {
        "BLOCK_SIZE_M": 16,
        "BLOCK_SIZE_N": 64,
        "BLOCK_SIZE_K": 512,
        "GROUP_SIZE_M": 8,
        "num_stages": 8,
        "num_warps": 32,
        "compile_time": 0.6734299659729004
    },
    {
        "BLOCK_SIZE_M": 16,
        "BLOCK_SIZE_N": 128,
        "BLOCK_SIZE_K": 128,
        "GROUP_SIZE_M": 8,
        "num_stages": 6,
        "num_warps": 2,
        "compile_time": 2.1323137283325195
    },
    {
        "BLOCK_SIZE_M": 16,
        "BLOCK_SIZE_N": 128,
        "BLOCK_SIZE_K": 128,
        "GROUP_SIZE_M": 8,
        "num_stages": 6,
        "num_warps": 4,
        "compile_time": 0.9850454330444336
    },
    {
        "BLOCK_SIZE_M": 16,
        "BLOCK_SIZE_N": 128,
        "BLOCK_SIZE_K": 128,
        "GROUP_SIZE_M": 8,
        "num_stages": 6,
        "num_warps": 8,
        "compile_time": 0.5885453224182129
    },
    {
        "BLOCK_SIZE_M": 16,
        "BLOCK_SIZE_N": 128,
        "BLOCK_SIZE_K": 128,
        "GROUP_SIZE_M": 8,
        "num_stages": 6,
        "num_warps": 16,
        "compile_time": 0.44202613830566406
    },
    {
        "BLOCK_SIZE_M": 16,
        "BLOCK_SIZE_N": 128,
        "BLOCK_SIZE_K": 128,
        "GROUP_SIZE_M": 8,
        "num_stages": 6,
        "num_warps": 32,
        "compile_time": 0.37783384323120117
    },
    {
        "BLOCK_SIZE_M": 16,
        "BLOCK_SIZE_N": 128,
        "BLOCK_SIZE_K": 128,
        "GROUP_SIZE_M": 8,
        "num_stages": 7,
        "num_warps": 2,
        "compile_time": 2.238203763961792
    },
    {
        "BLOCK_SIZE_M": 16,
        "BLOCK_SIZE_N": 128,
        "BLOCK_SIZE_K": 128,
        "GROUP_SIZE_M": 8,
        "num_stages": 7,
        "num_warps": 4,
        "compile_time": 1.0476901531219482
    },
    {
        "BLOCK_SIZE_M": 16,
        "BLOCK_SIZE_N": 128,
        "BLOCK_SIZE_K": 128,
        "GROUP_SIZE_M": 8,
        "num_stages": 7,
        "num_warps": 8,
        "compile_time": 0.6014556884765625
    },
    {
        "BLOCK_SIZE_M": 16,
        "BLOCK_SIZE_N": 128,
        "BLOCK_SIZE_K": 128,
        "GROUP_SIZE_M": 8,
        "num_stages": 7,
        "num_warps": 16,
        "compile_time": 0.46419286727905273
    },
    {
        "BLOCK_SIZE_M": 16,
        "BLOCK_SIZE_N": 128,
        "BLOCK_SIZE_K": 128,
        "GROUP_SIZE_M": 8,
        "num_stages": 7,
        "num_warps": 32,
        "compile_time": 0.3937852382659912
    },
    {
        "BLOCK_SIZE_M": 16,
        "BLOCK_SIZE_N": 128,
        "BLOCK_SIZE_K": 128,
        "GROUP_SIZE_M": 8,
        "num_stages": 8,
        "num_warps": 2,
        "compile_time": 2.408926248550415
    },
    {
        "BLOCK_SIZE_M": 16,
        "BLOCK_SIZE_N": 128,
        "BLOCK_SIZE_K": 128,
        "GROUP_SIZE_M": 8,
        "num_stages": 8,
        "num_warps": 4,
        "compile_time": 1.1333308219909668
    },
    {
        "BLOCK_SIZE_M": 16,
        "BLOCK_SIZE_N": 128,
        "BLOCK_SIZE_K": 128,
        "GROUP_SIZE_M": 8,
        "num_stages": 8,
        "num_warps": 8,
        "compile_time": 0.6604897975921631
    },
    {
        "BLOCK_SIZE_M": 16,
        "BLOCK_SIZE_N": 128,
        "BLOCK_SIZE_K": 128,
        "GROUP_SIZE_M": 8,
        "num_stages": 8,
        "num_warps": 16,
        "compile_time": 0.48946285247802734
    },
    {
        "BLOCK_SIZE_M": 16,
        "BLOCK_SIZE_N": 128,
        "BLOCK_SIZE_K": 128,
        "GROUP_SIZE_M": 8,
        "num_stages": 8,
        "num_warps": 32,
        "compile_time": 0.413776159286499
    },
    {
        "BLOCK_SIZE_M": 16,
        "BLOCK_SIZE_N": 128,
        "BLOCK_SIZE_K": 256,
        "GROUP_SIZE_M": 8,
        "num_stages": 3,
        "num_warps": 2,
        "compile_time": 10.55415654182434
    },
    {
        "BLOCK_SIZE_M": 16,
        "BLOCK_SIZE_N": 128,
        "BLOCK_SIZE_K": 256,
        "GROUP_SIZE_M": 8,
        "num_stages": 4,
        "num_warps": 2,
        "compile_time": 10.80692458152771
    },
    {
        "BLOCK_SIZE_M": 16,
        "BLOCK_SIZE_N": 128,
        "BLOCK_SIZE_K": 256,
        "GROUP_SIZE_M": 8,
        "num_stages": 4,
        "num_warps": 4,
        "compile_time": 1.914503574371338
    },
    {
        "BLOCK_SIZE_M": 16,
        "BLOCK_SIZE_N": 128,
        "BLOCK_SIZE_K": 256,
        "GROUP_SIZE_M": 8,
        "num_stages": 4,
        "num_warps": 8,
        "compile_time": 0.8904027938842773
    },
    {
        "BLOCK_SIZE_M": 16,
        "BLOCK_SIZE_N": 128,
        "BLOCK_SIZE_K": 256,
        "GROUP_SIZE_M": 8,
        "num_stages": 4,
        "num_warps": 16,
        "compile_time": 0.5660622119903564
    },
    {
        "BLOCK_SIZE_M": 16,
        "BLOCK_SIZE_N": 128,
        "BLOCK_SIZE_K": 256,
        "GROUP_SIZE_M": 8,
        "num_stages": 4,
        "num_warps": 32,
        "compile_time": 0.46806931495666504
    },
    {
        "BLOCK_SIZE_M": 16,
        "BLOCK_SIZE_N": 128,
        "BLOCK_SIZE_K": 256,
        "GROUP_SIZE_M": 8,
        "num_stages": 5,
        "num_warps": 2,
        "compile_time": 10.81602931022644
    },
    {
        "BLOCK_SIZE_M": 16,
        "BLOCK_SIZE_N": 128,
        "BLOCK_SIZE_K": 256,
        "GROUP_SIZE_M": 8,
        "num_stages": 5,
        "num_warps": 4,
        "compile_time": 2.0385024547576904
    },
    {
        "BLOCK_SIZE_M": 16,
        "BLOCK_SIZE_N": 128,
        "BLOCK_SIZE_K": 256,
        "GROUP_SIZE_M": 8,
        "num_stages": 5,
        "num_warps": 8,
        "compile_time": 0.9823060035705566
    },
    {
        "BLOCK_SIZE_M": 16,
        "BLOCK_SIZE_N": 128,
        "BLOCK_SIZE_K": 256,
        "GROUP_SIZE_M": 8,
        "num_stages": 5,
        "num_warps": 16,
        "compile_time": 0.6110849380493164
    },
    {
        "BLOCK_SIZE_M": 16,
        "BLOCK_SIZE_N": 128,
        "BLOCK_SIZE_K": 256,
        "GROUP_SIZE_M": 8,
        "num_stages": 5,
        "num_warps": 32,
        "compile_time": 0.4932723045349121
    },
    {
        "BLOCK_SIZE_M": 16,
        "BLOCK_SIZE_N": 128,
        "BLOCK_SIZE_K": 256,
        "GROUP_SIZE_M": 8,
        "num_stages": 6,
        "num_warps": 2,
        "compile_time": 11.142147779464722
    },
    {
        "BLOCK_SIZE_M": 16,
        "BLOCK_SIZE_N": 128,
        "BLOCK_SIZE_K": 256,
        "GROUP_SIZE_M": 8,
        "num_stages": 6,
        "num_warps": 4,
        "compile_time": 2.186736822128296
    },
    {
        "BLOCK_SIZE_M": 16,
        "BLOCK_SIZE_N": 128,
        "BLOCK_SIZE_K": 256,
        "GROUP_SIZE_M": 8,
        "num_stages": 6,
        "num_warps": 8,
        "compile_time": 1.0372447967529297
    },
    {
        "BLOCK_SIZE_M": 16,
        "BLOCK_SIZE_N": 128,
        "BLOCK_SIZE_K": 256,
        "GROUP_SIZE_M": 8,
        "num_stages": 6,
        "num_warps": 16,
        "compile_time": 0.6296591758728027
    },
    {
        "BLOCK_SIZE_M": 16,
        "BLOCK_SIZE_N": 128,
        "BLOCK_SIZE_K": 256,
        "GROUP_SIZE_M": 8,
        "num_stages": 6,
        "num_warps": 32,
        "compile_time": 0.5273807048797607
    },
    {
        "BLOCK_SIZE_M": 16,
        "BLOCK_SIZE_N": 128,
        "BLOCK_SIZE_K": 256,
        "GROUP_SIZE_M": 8,
        "num_stages": 7,
        "num_warps": 2,
        "compile_time": 11.188878297805786
    },
    {
        "BLOCK_SIZE_M": 16,
        "BLOCK_SIZE_N": 128,
        "BLOCK_SIZE_K": 256,
        "GROUP_SIZE_M": 8,
        "num_stages": 7,
        "num_warps": 4,
        "compile_time": 2.298093557357788
    },
    {
        "BLOCK_SIZE_M": 16,
        "BLOCK_SIZE_N": 128,
        "BLOCK_SIZE_K": 256,
        "GROUP_SIZE_M": 8,
        "num_stages": 7,
        "num_warps": 8,
        "compile_time": 1.1183288097381592
    },
    {
        "BLOCK_SIZE_M": 16,
        "BLOCK_SIZE_N": 128,
        "BLOCK_SIZE_K": 256,
        "GROUP_SIZE_M": 8,
        "num_stages": 7,
        "num_warps": 16,
        "compile_time": 0.7012467384338379
    },
    {
        "BLOCK_SIZE_M": 16,
        "BLOCK_SIZE_N": 128,
        "BLOCK_SIZE_K": 256,
        "GROUP_SIZE_M": 8,
        "num_stages": 7,
        "num_warps": 32,
        "compile_time": 0.5552506446838379
    },
    {
        "BLOCK_SIZE_M": 16,
        "BLOCK_SIZE_N": 128,
        "BLOCK_SIZE_K": 256,
        "GROUP_SIZE_M": 8,
        "num_stages": 8,
        "num_warps": 2,
        "compile_time": 11.341265678405762
    },
    {
        "BLOCK_SIZE_M": 16,
        "BLOCK_SIZE_N": 128,
        "BLOCK_SIZE_K": 256,
        "GROUP_SIZE_M": 8,
        "num_stages": 8,
        "num_warps": 4,
        "compile_time": 2.495041847229004
    },
    {
        "BLOCK_SIZE_M": 16,
        "BLOCK_SIZE_N": 128,
        "BLOCK_SIZE_K": 256,
        "GROUP_SIZE_M": 8,
        "num_stages": 8,
        "num_warps": 8,
        "compile_time": 1.2289414405822754
    },
    {
        "BLOCK_SIZE_M": 16,
        "BLOCK_SIZE_N": 128,
        "BLOCK_SIZE_K": 256,
        "GROUP_SIZE_M": 8,
        "num_stages": 8,
        "num_warps": 16,
        "compile_time": 0.7156820297241211
    },
    {
        "BLOCK_SIZE_M": 16,
        "BLOCK_SIZE_N": 128,
        "BLOCK_SIZE_K": 256,
        "GROUP_SIZE_M": 8,
        "num_stages": 8,
        "num_warps": 32,
        "compile_time": 0.5506532192230225
    },
    {
        "BLOCK_SIZE_M": 16,
        "BLOCK_SIZE_N": 128,
        "BLOCK_SIZE_K": 512,
        "GROUP_SIZE_M": 8,
        "num_stages": 1,
        "num_warps": 2,
        "compile_time": 7.733355283737183
    },
    {
        "BLOCK_SIZE_M": 16,
        "BLOCK_SIZE_N": 128,
        "BLOCK_SIZE_K": 512,
        "GROUP_SIZE_M": 8,
        "num_stages": 2,
        "num_warps": 2,
        "compile_time": 7.738014221191406
    },
    {
        "BLOCK_SIZE_M": 16,
        "BLOCK_SIZE_N": 128,
        "BLOCK_SIZE_K": 512,
        "GROUP_SIZE_M": 8,
        "num_stages": 3,
        "num_warps": 2,
        "compile_time": 99.74541783332825
    },
    {
        "BLOCK_SIZE_M": 16,
        "BLOCK_SIZE_N": 128,
        "BLOCK_SIZE_K": 512,
        "GROUP_SIZE_M": 8,
        "num_stages": 3,
        "num_warps": 4,
        "compile_time": 10.598769426345825
    },
    {
        "BLOCK_SIZE_M": 16,
        "BLOCK_SIZE_N": 128,
        "BLOCK_SIZE_K": 512,
        "GROUP_SIZE_M": 8,
        "num_stages": 3,
        "num_warps": 8,
        "compile_time": 1.8701746463775635
    },
    {
        "BLOCK_SIZE_M": 16,
        "BLOCK_SIZE_N": 128,
        "BLOCK_SIZE_K": 512,
        "GROUP_SIZE_M": 8,
        "num_stages": 3,
        "num_warps": 16,
        "compile_time": 0.0051975250244140625
    },
    {
        "BLOCK_SIZE_M": 16,
        "BLOCK_SIZE_N": 128,
        "BLOCK_SIZE_K": 512,
        "GROUP_SIZE_M": 8,
        "num_stages": 3,
        "num_warps": 32,
        "compile_time": 0.003095865249633789
    },
    {
        "BLOCK_SIZE_M": 16,
        "BLOCK_SIZE_N": 128,
        "BLOCK_SIZE_K": 512,
        "GROUP_SIZE_M": 8,
        "num_stages": 4,
        "num_warps": 2,
        "compile_time": 6.03664231300354
    },
    {
        "BLOCK_SIZE_M": 16,
        "BLOCK_SIZE_N": 128,
        "BLOCK_SIZE_K": 512,
        "GROUP_SIZE_M": 8,
        "num_stages": 4,
        "num_warps": 4,
        "compile_time": 10.916142225265503
    },
    {
        "BLOCK_SIZE_M": 16,
        "BLOCK_SIZE_N": 128,
        "BLOCK_SIZE_K": 512,
        "GROUP_SIZE_M": 8,
        "num_stages": 4,
        "num_warps": 8,
        "compile_time": 2.04311203956604
    },
    {
        "BLOCK_SIZE_M": 16,
        "BLOCK_SIZE_N": 128,
        "BLOCK_SIZE_K": 512,
        "GROUP_SIZE_M": 8,
        "num_stages": 4,
        "num_warps": 16,
        "compile_time": 0.9992938041687012
    },
    {
        "BLOCK_SIZE_M": 16,
        "BLOCK_SIZE_N": 128,
        "BLOCK_SIZE_K": 512,
        "GROUP_SIZE_M": 8,
        "num_stages": 4,
        "num_warps": 32,
        "compile_time": 0.6920123100280762
    },
    {
        "BLOCK_SIZE_M": 16,
        "BLOCK_SIZE_N": 128,
        "BLOCK_SIZE_K": 512,
        "GROUP_SIZE_M": 8,
        "num_stages": 5,
        "num_warps": 2,
        "compile_time": 6.41614294052124
    },
    {
        "BLOCK_SIZE_M": 16,
        "BLOCK_SIZE_N": 128,
        "BLOCK_SIZE_K": 512,
        "GROUP_SIZE_M": 8,
        "num_stages": 5,
        "num_warps": 4,
        "compile_time": 11.218400001525879
    },
    {
        "BLOCK_SIZE_M": 16,
        "BLOCK_SIZE_N": 128,
        "BLOCK_SIZE_K": 512,
        "GROUP_SIZE_M": 8,
        "num_stages": 5,
        "num_warps": 8,
        "compile_time": 2.2131357192993164
    },
    {
        "BLOCK_SIZE_M": 16,
        "BLOCK_SIZE_N": 128,
        "BLOCK_SIZE_K": 512,
        "GROUP_SIZE_M": 8,
        "num_stages": 5,
        "num_warps": 16,
        "compile_time": 1.0743863582611084
    },
    {
        "BLOCK_SIZE_M": 16,
        "BLOCK_SIZE_N": 128,
        "BLOCK_SIZE_K": 512,
        "GROUP_SIZE_M": 8,
        "num_stages": 5,
        "num_warps": 32,
        "compile_time": 0.7241051197052002
    },
    {
        "BLOCK_SIZE_M": 16,
        "BLOCK_SIZE_N": 128,
        "BLOCK_SIZE_K": 512,
        "GROUP_SIZE_M": 8,
        "num_stages": 6,
        "num_warps": 2,
        "compile_time": 6.675808906555176
    },
    {
        "BLOCK_SIZE_M": 16,
        "BLOCK_SIZE_N": 128,
        "BLOCK_SIZE_K": 512,
        "GROUP_SIZE_M": 8,
        "num_stages": 6,
        "num_warps": 4,
        "compile_time": 11.29798150062561
    },
    {
        "BLOCK_SIZE_M": 16,
        "BLOCK_SIZE_N": 128,
        "BLOCK_SIZE_K": 512,
        "GROUP_SIZE_M": 8,
        "num_stages": 6,
        "num_warps": 8,
        "compile_time": 2.3240036964416504
    },
    {
        "BLOCK_SIZE_M": 16,
        "BLOCK_SIZE_N": 128,
        "BLOCK_SIZE_K": 512,
        "GROUP_SIZE_M": 8,
        "num_stages": 6,
        "num_warps": 16,
        "compile_time": 1.146942377090454
    },
    {
        "BLOCK_SIZE_M": 16,
        "BLOCK_SIZE_N": 128,
        "BLOCK_SIZE_K": 512,
        "GROUP_SIZE_M": 8,
        "num_stages": 6,
        "num_warps": 32,
        "compile_time": 0.7876522541046143
    },
    {
        "BLOCK_SIZE_M": 16,
        "BLOCK_SIZE_N": 128,
        "BLOCK_SIZE_K": 512,
        "GROUP_SIZE_M": 8,
        "num_stages": 7,
        "num_warps": 2,
        "compile_time": 6.981307506561279
    },
    {
        "BLOCK_SIZE_M": 16,
        "BLOCK_SIZE_N": 128,
        "BLOCK_SIZE_K": 512,
        "GROUP_SIZE_M": 8,
        "num_stages": 7,
        "num_warps": 4,
        "compile_time": 11.227742195129395
    },
    {
        "BLOCK_SIZE_M": 16,
        "BLOCK_SIZE_N": 128,
        "BLOCK_SIZE_K": 512,
        "GROUP_SIZE_M": 8,
        "num_stages": 7,
        "num_warps": 8,
        "compile_time": 2.4363365173339844
    },
    {
        "BLOCK_SIZE_M": 16,
        "BLOCK_SIZE_N": 128,
        "BLOCK_SIZE_K": 512,
        "GROUP_SIZE_M": 8,
        "num_stages": 7,
        "num_warps": 16,
        "compile_time": 1.2311718463897705
    },
    {
        "BLOCK_SIZE_M": 16,
        "BLOCK_SIZE_N": 128,
        "BLOCK_SIZE_K": 512,
        "GROUP_SIZE_M": 8,
        "num_stages": 7,
        "num_warps": 32,
        "compile_time": 0.8353390693664551
    },
    {
        "BLOCK_SIZE_M": 16,
        "BLOCK_SIZE_N": 128,
        "BLOCK_SIZE_K": 512,
        "GROUP_SIZE_M": 8,
        "num_stages": 8,
        "num_warps": 2,
        "compile_time": 7.325723648071289
    },
    {
        "BLOCK_SIZE_M": 16,
        "BLOCK_SIZE_N": 128,
        "BLOCK_SIZE_K": 512,
        "GROUP_SIZE_M": 8,
        "num_stages": 8,
        "num_warps": 4,
        "compile_time": 11.616470575332642
    },
    {
        "BLOCK_SIZE_M": 16,
        "BLOCK_SIZE_N": 128,
        "BLOCK_SIZE_K": 512,
        "GROUP_SIZE_M": 8,
        "num_stages": 8,
        "num_warps": 8,
        "compile_time": 2.5800271034240723
    },
    {
        "BLOCK_SIZE_M": 16,
        "BLOCK_SIZE_N": 128,
        "BLOCK_SIZE_K": 512,
        "GROUP_SIZE_M": 8,
        "num_stages": 8,
        "num_warps": 16,
        "compile_time": 1.330643892288208
    },
    {
        "BLOCK_SIZE_M": 16,
        "BLOCK_SIZE_N": 128,
        "BLOCK_SIZE_K": 512,
        "GROUP_SIZE_M": 8,
        "num_stages": 8,
        "num_warps": 32,
        "compile_time": 0.8644752502441406
    },
    {
        "BLOCK_SIZE_M": 16,
        "BLOCK_SIZE_N": 256,
        "BLOCK_SIZE_K": 64,
        "GROUP_SIZE_M": 8,
        "num_stages": 6,
        "num_warps": 2,
        "compile_time": 2.304611921310425
    },
    {
        "BLOCK_SIZE_M": 16,
        "BLOCK_SIZE_N": 256,
        "BLOCK_SIZE_K": 64,
        "GROUP_SIZE_M": 8,
        "num_stages": 6,
        "num_warps": 4,
        "compile_time": 1.0357534885406494
    },
    {
        "BLOCK_SIZE_M": 16,
        "BLOCK_SIZE_N": 256,
        "BLOCK_SIZE_K": 64,
        "GROUP_SIZE_M": 8,
        "num_stages": 6,
        "num_warps": 8,
        "compile_time": 0.6178436279296875
    },
    {
        "BLOCK_SIZE_M": 16,
        "BLOCK_SIZE_N": 256,
        "BLOCK_SIZE_K": 64,
        "GROUP_SIZE_M": 8,
        "num_stages": 6,
        "num_warps": 16,
        "compile_time": 0.44300341606140137
    },
    {
        "BLOCK_SIZE_M": 16,
        "BLOCK_SIZE_N": 256,
        "BLOCK_SIZE_K": 64,
        "GROUP_SIZE_M": 8,
        "num_stages": 7,
        "num_warps": 2,
        "compile_time": 2.39972186088562
    },
    {
        "BLOCK_SIZE_M": 16,
        "BLOCK_SIZE_N": 256,
        "BLOCK_SIZE_K": 64,
        "GROUP_SIZE_M": 8,
        "num_stages": 7,
        "num_warps": 4,
        "compile_time": 1.091618299484253
    },
    {
        "BLOCK_SIZE_M": 16,
        "BLOCK_SIZE_N": 256,
        "BLOCK_SIZE_K": 64,
        "GROUP_SIZE_M": 8,
        "num_stages": 7,
        "num_warps": 8,
        "compile_time": 0.6303579807281494
    },
    {
        "BLOCK_SIZE_M": 16,
        "BLOCK_SIZE_N": 256,
        "BLOCK_SIZE_K": 64,
        "GROUP_SIZE_M": 8,
        "num_stages": 7,
        "num_warps": 16,
        "compile_time": 0.47992897033691406
    },
    {
        "BLOCK_SIZE_M": 16,
        "BLOCK_SIZE_N": 256,
        "BLOCK_SIZE_K": 64,
        "GROUP_SIZE_M": 8,
        "num_stages": 7,
        "num_warps": 32,
        "compile_time": 0.37291455268859863
    },
    {
        "BLOCK_SIZE_M": 16,
        "BLOCK_SIZE_N": 256,
        "BLOCK_SIZE_K": 64,
        "GROUP_SIZE_M": 8,
        "num_stages": 8,
        "num_warps": 2,
        "compile_time": 2.540043830871582
    },
    {
        "BLOCK_SIZE_M": 16,
        "BLOCK_SIZE_N": 256,
        "BLOCK_SIZE_K": 64,
        "GROUP_SIZE_M": 8,
        "num_stages": 8,
        "num_warps": 4,
        "compile_time": 1.1620638370513916
    },
    {
        "BLOCK_SIZE_M": 16,
        "BLOCK_SIZE_N": 256,
        "BLOCK_SIZE_K": 64,
        "GROUP_SIZE_M": 8,
        "num_stages": 8,
        "num_warps": 8,
        "compile_time": 0.6826908588409424
    },
    {
        "BLOCK_SIZE_M": 16,
        "BLOCK_SIZE_N": 256,
        "BLOCK_SIZE_K": 64,
        "GROUP_SIZE_M": 8,
        "num_stages": 8,
        "num_warps": 16,
        "compile_time": 0.47685909271240234
    },
    {
        "BLOCK_SIZE_M": 16,
        "BLOCK_SIZE_N": 256,
        "BLOCK_SIZE_K": 64,
        "GROUP_SIZE_M": 8,
        "num_stages": 8,
        "num_warps": 32,
        "compile_time": 0.3863399028778076
    },
    {
        "BLOCK_SIZE_M": 16,
        "BLOCK_SIZE_N": 256,
        "BLOCK_SIZE_K": 128,
        "GROUP_SIZE_M": 8,
        "num_stages": 3,
        "num_warps": 2,
        "compile_time": 10.51795744895935
    },
    {
        "BLOCK_SIZE_M": 16,
        "BLOCK_SIZE_N": 256,
        "BLOCK_SIZE_K": 128,
        "GROUP_SIZE_M": 8,
        "num_stages": 4,
        "num_warps": 2,
        "compile_time": 10.712471723556519
    },
    {
        "BLOCK_SIZE_M": 16,
        "BLOCK_SIZE_N": 256,
        "BLOCK_SIZE_K": 128,
        "GROUP_SIZE_M": 8,
        "num_stages": 4,
        "num_warps": 4,
        "compile_time": 1.8799924850463867
    },
    {
        "BLOCK_SIZE_M": 16,
        "BLOCK_SIZE_N": 256,
        "BLOCK_SIZE_K": 128,
        "GROUP_SIZE_M": 8,
        "num_stages": 4,
        "num_warps": 8,
        "compile_time": 0.8878295421600342
    },
    {
        "BLOCK_SIZE_M": 16,
        "BLOCK_SIZE_N": 256,
        "BLOCK_SIZE_K": 128,
        "GROUP_SIZE_M": 8,
        "num_stages": 4,
        "num_warps": 16,
        "compile_time": 0.5439903736114502
    },
    {
        "BLOCK_SIZE_M": 16,
        "BLOCK_SIZE_N": 256,
        "BLOCK_SIZE_K": 128,
        "GROUP_SIZE_M": 8,
        "num_stages": 4,
        "num_warps": 32,
        "compile_time": 0.43036460876464844
    },
    {
        "BLOCK_SIZE_M": 16,
        "BLOCK_SIZE_N": 256,
        "BLOCK_SIZE_K": 128,
        "GROUP_SIZE_M": 8,
        "num_stages": 5,
        "num_warps": 2,
        "compile_time": 10.912647008895874
    },
    {
        "BLOCK_SIZE_M": 16,
        "BLOCK_SIZE_N": 256,
        "BLOCK_SIZE_K": 128,
        "GROUP_SIZE_M": 8,
        "num_stages": 5,
        "num_warps": 4,
        "compile_time": 2.0227859020233154
    },
    {
        "BLOCK_SIZE_M": 16,
        "BLOCK_SIZE_N": 256,
        "BLOCK_SIZE_K": 128,
        "GROUP_SIZE_M": 8,
        "num_stages": 5,
        "num_warps": 8,
        "compile_time": 0.9714648723602295
    },
    {
        "BLOCK_SIZE_M": 16,
        "BLOCK_SIZE_N": 256,
        "BLOCK_SIZE_K": 128,
        "GROUP_SIZE_M": 8,
        "num_stages": 5,
        "num_warps": 16,
        "compile_time": 0.5840291976928711
    },
    {
        "BLOCK_SIZE_M": 16,
        "BLOCK_SIZE_N": 256,
        "BLOCK_SIZE_K": 128,
        "GROUP_SIZE_M": 8,
        "num_stages": 5,
        "num_warps": 32,
        "compile_time": 0.4530794620513916
    },
    {
        "BLOCK_SIZE_M": 16,
        "BLOCK_SIZE_N": 256,
        "BLOCK_SIZE_K": 128,
        "GROUP_SIZE_M": 8,
        "num_stages": 6,
        "num_warps": 2,
        "compile_time": 11.095808506011963
    },
    {
        "BLOCK_SIZE_M": 16,
        "BLOCK_SIZE_N": 256,
        "BLOCK_SIZE_K": 128,
        "GROUP_SIZE_M": 8,
        "num_stages": 6,
        "num_warps": 4,
        "compile_time": 2.1544220447540283
    },
    {
        "BLOCK_SIZE_M": 16,
        "BLOCK_SIZE_N": 256,
        "BLOCK_SIZE_K": 128,
        "GROUP_SIZE_M": 8,
        "num_stages": 6,
        "num_warps": 8,
        "compile_time": 1.0338029861450195
    },
    {
        "BLOCK_SIZE_M": 16,
        "BLOCK_SIZE_N": 256,
        "BLOCK_SIZE_K": 128,
        "GROUP_SIZE_M": 8,
        "num_stages": 6,
        "num_warps": 16,
        "compile_time": 0.6223394870758057
    },
    {
        "BLOCK_SIZE_M": 16,
        "BLOCK_SIZE_N": 256,
        "BLOCK_SIZE_K": 128,
        "GROUP_SIZE_M": 8,
        "num_stages": 6,
        "num_warps": 32,
        "compile_time": 0.48148393630981445
    },
    {
        "BLOCK_SIZE_M": 16,
        "BLOCK_SIZE_N": 256,
        "BLOCK_SIZE_K": 128,
        "GROUP_SIZE_M": 8,
        "num_stages": 7,
        "num_warps": 2,
        "compile_time": 11.234166383743286
    },
    {
        "BLOCK_SIZE_M": 16,
        "BLOCK_SIZE_N": 256,
        "BLOCK_SIZE_K": 128,
        "GROUP_SIZE_M": 8,
        "num_stages": 7,
        "num_warps": 4,
        "compile_time": 2.270869731903076
    },
    {
        "BLOCK_SIZE_M": 16,
        "BLOCK_SIZE_N": 256,
        "BLOCK_SIZE_K": 128,
        "GROUP_SIZE_M": 8,
        "num_stages": 7,
        "num_warps": 8,
        "compile_time": 1.1165297031402588
    },
    {
        "BLOCK_SIZE_M": 16,
        "BLOCK_SIZE_N": 256,
        "BLOCK_SIZE_K": 128,
        "GROUP_SIZE_M": 8,
        "num_stages": 7,
        "num_warps": 16,
        "compile_time": 0.6591217517852783
    },
    {
        "BLOCK_SIZE_M": 16,
        "BLOCK_SIZE_N": 256,
        "BLOCK_SIZE_K": 128,
        "GROUP_SIZE_M": 8,
        "num_stages": 7,
        "num_warps": 32,
        "compile_time": 0.48858141899108887
    },
    {
        "BLOCK_SIZE_M": 16,
        "BLOCK_SIZE_N": 256,
        "BLOCK_SIZE_K": 128,
        "GROUP_SIZE_M": 8,
        "num_stages": 8,
        "num_warps": 2,
        "compile_time": 11.50816035270691
    },
    {
        "BLOCK_SIZE_M": 16,
        "BLOCK_SIZE_N": 256,
        "BLOCK_SIZE_K": 128,
        "GROUP_SIZE_M": 8,
        "num_stages": 8,
        "num_warps": 4,
        "compile_time": 2.4310014247894287
    },
    {
        "BLOCK_SIZE_M": 16,
        "BLOCK_SIZE_N": 256,
        "BLOCK_SIZE_K": 128,
        "GROUP_SIZE_M": 8,
        "num_stages": 8,
        "num_warps": 8,
        "compile_time": 1.232238531112671
    },
    {
        "BLOCK_SIZE_M": 16,
        "BLOCK_SIZE_N": 256,
        "BLOCK_SIZE_K": 128,
        "GROUP_SIZE_M": 8,
        "num_stages": 8,
        "num_warps": 16,
        "compile_time": 0.7190687656402588
    },
    {
        "BLOCK_SIZE_M": 16,
        "BLOCK_SIZE_N": 256,
        "BLOCK_SIZE_K": 128,
        "GROUP_SIZE_M": 8,
        "num_stages": 8,
        "num_warps": 32,
        "compile_time": 0.5272905826568604
    },
    {
        "BLOCK_SIZE_M": 16,
        "BLOCK_SIZE_N": 256,
        "BLOCK_SIZE_K": 256,
        "GROUP_SIZE_M": 8,
        "num_stages": 1,
        "num_warps": 2,
        "compile_time": 7.619481801986694
    },
    {
        "BLOCK_SIZE_M": 16,
        "BLOCK_SIZE_N": 256,
        "BLOCK_SIZE_K": 256,
        "GROUP_SIZE_M": 8,
        "num_stages": 2,
        "num_warps": 2,
        "compile_time": 7.6196324825286865
    },
    {
        "BLOCK_SIZE_M": 16,
        "BLOCK_SIZE_N": 256,
        "BLOCK_SIZE_K": 256,
        "GROUP_SIZE_M": 8,
        "num_stages": 3,
        "num_warps": 2,
        "compile_time": 100.0255982875824
    },
    {
        "BLOCK_SIZE_M": 16,
        "BLOCK_SIZE_N": 256,
        "BLOCK_SIZE_K": 256,
        "GROUP_SIZE_M": 8,
        "num_stages": 3,
        "num_warps": 4,
        "compile_time": 10.792784452438354
    },
    {
        "BLOCK_SIZE_M": 16,
        "BLOCK_SIZE_N": 256,
        "BLOCK_SIZE_K": 256,
        "GROUP_SIZE_M": 8,
        "num_stages": 3,
        "num_warps": 8,
        "compile_time": 0.004496574401855469
    },
    {
        "BLOCK_SIZE_M": 16,
        "BLOCK_SIZE_N": 256,
        "BLOCK_SIZE_K": 256,
        "GROUP_SIZE_M": 8,
        "num_stages": 3,
        "num_warps": 16,
        "compile_time": 0.8147561550140381
    },
    {
        "BLOCK_SIZE_M": 16,
        "BLOCK_SIZE_N": 256,
        "BLOCK_SIZE_K": 256,
        "GROUP_SIZE_M": 8,
        "num_stages": 3,
        "num_warps": 32,
        "compile_time": 0.5558688640594482
    },
    {
        "BLOCK_SIZE_M": 16,
        "BLOCK_SIZE_N": 256,
        "BLOCK_SIZE_K": 256,
        "GROUP_SIZE_M": 8,
        "num_stages": 4,
        "num_warps": 2,
        "compile_time": 6.017395734786987
    },
    {
        "BLOCK_SIZE_M": 16,
        "BLOCK_SIZE_N": 256,
        "BLOCK_SIZE_K": 256,
        "GROUP_SIZE_M": 8,
        "num_stages": 4,
        "num_warps": 4,
        "compile_time": 10.692757368087769
    },
    {
        "BLOCK_SIZE_M": 16,
        "BLOCK_SIZE_N": 256,
        "BLOCK_SIZE_K": 256,
        "GROUP_SIZE_M": 8,
        "num_stages": 4,
        "num_warps": 8,
        "compile_time": 1.9286274909973145
    },
    {
        "BLOCK_SIZE_M": 16,
        "BLOCK_SIZE_N": 256,
        "BLOCK_SIZE_K": 256,
        "GROUP_SIZE_M": 8,
        "num_stages": 4,
        "num_warps": 16,
        "compile_time": 0.9107897281646729
    },
    {
        "BLOCK_SIZE_M": 16,
        "BLOCK_SIZE_N": 256,
        "BLOCK_SIZE_K": 256,
        "GROUP_SIZE_M": 8,
        "num_stages": 4,
        "num_warps": 32,
        "compile_time": 0.5799012184143066
    },
    {
        "BLOCK_SIZE_M": 16,
        "BLOCK_SIZE_N": 256,
        "BLOCK_SIZE_K": 256,
        "GROUP_SIZE_M": 8,
        "num_stages": 5,
        "num_warps": 2,
        "compile_time": 6.272409915924072
    },
    {
        "BLOCK_SIZE_M": 16,
        "BLOCK_SIZE_N": 256,
        "BLOCK_SIZE_K": 256,
        "GROUP_SIZE_M": 8,
        "num_stages": 5,
        "num_warps": 4,
        "compile_time": 10.962485074996948
    },
    {
        "BLOCK_SIZE_M": 16,
        "BLOCK_SIZE_N": 256,
        "BLOCK_SIZE_K": 256,
        "GROUP_SIZE_M": 8,
        "num_stages": 5,
        "num_warps": 8,
        "compile_time": 2.08115553855896
    },
    {
        "BLOCK_SIZE_M": 16,
        "BLOCK_SIZE_N": 256,
        "BLOCK_SIZE_K": 256,
        "GROUP_SIZE_M": 8,
        "num_stages": 5,
        "num_warps": 16,
        "compile_time": 1.0013084411621094
    },
    {
        "BLOCK_SIZE_M": 16,
        "BLOCK_SIZE_N": 256,
        "BLOCK_SIZE_K": 256,
        "GROUP_SIZE_M": 8,
        "num_stages": 5,
        "num_warps": 32,
        "compile_time": 0.6416099071502686
    },
    {
        "BLOCK_SIZE_M": 16,
        "BLOCK_SIZE_N": 256,
        "BLOCK_SIZE_K": 256,
        "GROUP_SIZE_M": 8,
        "num_stages": 6,
        "num_warps": 2,
        "compile_time": 6.708571672439575
    },
    {
        "BLOCK_SIZE_M": 16,
        "BLOCK_SIZE_N": 256,
        "BLOCK_SIZE_K": 256,
        "GROUP_SIZE_M": 8,
        "num_stages": 6,
        "num_warps": 4,
        "compile_time": 11.155499458312988
    },
    {
        "BLOCK_SIZE_M": 16,
        "BLOCK_SIZE_N": 256,
        "BLOCK_SIZE_K": 256,
        "GROUP_SIZE_M": 8,
        "num_stages": 6,
        "num_warps": 8,
        "compile_time": 2.2526659965515137
    },
    {
        "BLOCK_SIZE_M": 16,
        "BLOCK_SIZE_N": 256,
        "BLOCK_SIZE_K": 256,
        "GROUP_SIZE_M": 8,
        "num_stages": 6,
        "num_warps": 16,
        "compile_time": 1.080594778060913
    },
    {
        "BLOCK_SIZE_M": 16,
        "BLOCK_SIZE_N": 256,
        "BLOCK_SIZE_K": 256,
        "GROUP_SIZE_M": 8,
        "num_stages": 6,
        "num_warps": 32,
        "compile_time": 0.6855804920196533
    },
    {
        "BLOCK_SIZE_M": 16,
        "BLOCK_SIZE_N": 256,
        "BLOCK_SIZE_K": 256,
        "GROUP_SIZE_M": 8,
        "num_stages": 7,
        "num_warps": 2,
        "compile_time": 6.838832139968872
    },
    {
        "BLOCK_SIZE_M": 16,
        "BLOCK_SIZE_N": 256,
        "BLOCK_SIZE_K": 256,
        "GROUP_SIZE_M": 8,
        "num_stages": 7,
        "num_warps": 4,
        "compile_time": 11.184340238571167
    },
    {
        "BLOCK_SIZE_M": 16,
        "BLOCK_SIZE_N": 256,
        "BLOCK_SIZE_K": 256,
        "GROUP_SIZE_M": 8,
        "num_stages": 7,
        "num_warps": 8,
        "compile_time": 2.3809659481048584
    },
    {
        "BLOCK_SIZE_M": 16,
        "BLOCK_SIZE_N": 256,
        "BLOCK_SIZE_K": 256,
        "GROUP_SIZE_M": 8,
        "num_stages": 7,
        "num_warps": 16,
        "compile_time": 1.1912662982940674
    },
    {
        "BLOCK_SIZE_M": 16,
        "BLOCK_SIZE_N": 256,
        "BLOCK_SIZE_K": 256,
        "GROUP_SIZE_M": 8,
        "num_stages": 7,
        "num_warps": 32,
        "compile_time": 0.7433419227600098
    },
    {
        "BLOCK_SIZE_M": 16,
        "BLOCK_SIZE_N": 256,
        "BLOCK_SIZE_K": 256,
        "GROUP_SIZE_M": 8,
        "num_stages": 8,
        "num_warps": 2,
        "compile_time": 7.20803689956665
    },
    {
        "BLOCK_SIZE_M": 16,
        "BLOCK_SIZE_N": 256,
        "BLOCK_SIZE_K": 256,
        "GROUP_SIZE_M": 8,
        "num_stages": 8,
        "num_warps": 4,
        "compile_time": 11.491734504699707
    },
    {
        "BLOCK_SIZE_M": 16,
        "BLOCK_SIZE_N": 256,
        "BLOCK_SIZE_K": 256,
        "GROUP_SIZE_M": 8,
        "num_stages": 8,
        "num_warps": 8,
        "compile_time": 2.57209849357605
    },
    {
        "BLOCK_SIZE_M": 16,
        "BLOCK_SIZE_N": 256,
        "BLOCK_SIZE_K": 256,
        "GROUP_SIZE_M": 8,
        "num_stages": 8,
        "num_warps": 16,
        "compile_time": 1.2510590553283691
    },
    {
        "BLOCK_SIZE_M": 16,
        "BLOCK_SIZE_N": 256,
        "BLOCK_SIZE_K": 256,
        "GROUP_SIZE_M": 8,
        "num_stages": 8,
        "num_warps": 32,
        "compile_time": 0.7765922546386719
    },
    {
        "BLOCK_SIZE_M": 16,
        "BLOCK_SIZE_N": 256,
        "BLOCK_SIZE_K": 512,
        "GROUP_SIZE_M": 8,
        "num_stages": 1,
        "num_warps": 2,
        "compile_time": 19.233736515045166
    },
    {
        "BLOCK_SIZE_M": 16,
        "BLOCK_SIZE_N": 256,
        "BLOCK_SIZE_K": 512,
        "GROUP_SIZE_M": 8,
        "num_stages": 1,
        "num_warps": 4,
        "compile_time": 7.8421080112457275
    },
    {
        "BLOCK_SIZE_M": 16,
        "BLOCK_SIZE_N": 256,
        "BLOCK_SIZE_K": 512,
        "GROUP_SIZE_M": 8,
        "num_stages": 1,
        "num_warps": 8,
        "compile_time": 2.763094186782837
    },
    {
        "BLOCK_SIZE_M": 16,
        "BLOCK_SIZE_N": 256,
        "BLOCK_SIZE_K": 512,
        "GROUP_SIZE_M": 8,
        "num_stages": 1,
        "num_warps": 16,
        "compile_time": 1.1446361541748047
    },
    {
        "BLOCK_SIZE_M": 16,
        "BLOCK_SIZE_N": 256,
        "BLOCK_SIZE_K": 512,
        "GROUP_SIZE_M": 8,
        "num_stages": 1,
        "num_warps": 32,
        "compile_time": 0.6781957149505615
    },
    {
        "BLOCK_SIZE_M": 16,
        "BLOCK_SIZE_N": 256,
        "BLOCK_SIZE_K": 512,
        "GROUP_SIZE_M": 8,
        "num_stages": 2,
        "num_warps": 2,
        "compile_time": 19.20509672164917
    },
    {
        "BLOCK_SIZE_M": 16,
        "BLOCK_SIZE_N": 256,
        "BLOCK_SIZE_K": 512,
        "GROUP_SIZE_M": 8,
        "num_stages": 2,
        "num_warps": 4,
        "compile_time": 7.7271623611450195
    },
    {
        "BLOCK_SIZE_M": 16,
        "BLOCK_SIZE_N": 256,
        "BLOCK_SIZE_K": 512,
        "GROUP_SIZE_M": 8,
        "num_stages": 2,
        "num_warps": 8,
        "compile_time": 3.004815101623535
    },
    {
        "BLOCK_SIZE_M": 16,
        "BLOCK_SIZE_N": 256,
        "BLOCK_SIZE_K": 512,
        "GROUP_SIZE_M": 8,
        "num_stages": 2,
        "num_warps": 16,
        "compile_time": 1.3123035430908203
    },
    {
        "BLOCK_SIZE_M": 16,
        "BLOCK_SIZE_N": 256,
        "BLOCK_SIZE_K": 512,
        "GROUP_SIZE_M": 8,
        "num_stages": 2,
        "num_warps": 32,
        "compile_time": 0.7825949192047119
    },
    {
        "BLOCK_SIZE_M": 16,
        "BLOCK_SIZE_N": 256,
        "BLOCK_SIZE_K": 512,
        "GROUP_SIZE_M": 8,
        "num_stages": 3,
        "num_warps": 2,
        "compile_time": 19.585905075073242
    },
    {
        "BLOCK_SIZE_M": 16,
        "BLOCK_SIZE_N": 256,
        "BLOCK_SIZE_K": 512,
        "GROUP_SIZE_M": 8,
        "num_stages": 3,
        "num_warps": 4,
        "compile_time": 99.12725973129272
    },
    {
        "BLOCK_SIZE_M": 16,
        "BLOCK_SIZE_N": 256,
        "BLOCK_SIZE_K": 512,
        "GROUP_SIZE_M": 8,
        "num_stages": 3,
        "num_warps": 8,
        "compile_time": 10.64171314239502
    },
    {
        "BLOCK_SIZE_M": 16,
        "BLOCK_SIZE_N": 256,
        "BLOCK_SIZE_K": 512,
        "GROUP_SIZE_M": 8,
        "num_stages": 3,
        "num_warps": 16,
        "compile_time": 1.9582171440124512
    },
    {
        "BLOCK_SIZE_M": 16,
        "BLOCK_SIZE_N": 256,
        "BLOCK_SIZE_K": 512,
        "GROUP_SIZE_M": 8,
        "num_stages": 3,
        "num_warps": 32,
        "compile_time": 0.9335105419158936
    },
    {
        "BLOCK_SIZE_M": 16,
        "BLOCK_SIZE_N": 256,
        "BLOCK_SIZE_K": 512,
        "GROUP_SIZE_M": 8,
        "num_stages": 4,
        "num_warps": 2,
        "compile_time": 20.435930490493774
    },
    {
        "BLOCK_SIZE_M": 16,
        "BLOCK_SIZE_N": 256,
        "BLOCK_SIZE_K": 512,
        "GROUP_SIZE_M": 8,
        "num_stages": 4,
        "num_warps": 4,
        "compile_time": 6.0383827686309814
    },
    {
        "BLOCK_SIZE_M": 16,
        "BLOCK_SIZE_N": 256,
        "BLOCK_SIZE_K": 512,
        "GROUP_SIZE_M": 8,
        "num_stages": 4,
        "num_warps": 8,
        "compile_time": 10.656556129455566
    },
    {
        "BLOCK_SIZE_M": 16,
        "BLOCK_SIZE_N": 256,
        "BLOCK_SIZE_K": 512,
        "GROUP_SIZE_M": 8,
        "num_stages": 4,
        "num_warps": 16,
        "compile_time": 2.1139135360717773
    },
    {
        "BLOCK_SIZE_M": 16,
        "BLOCK_SIZE_N": 256,
        "BLOCK_SIZE_K": 512,
        "GROUP_SIZE_M": 8,
        "num_stages": 4,
        "num_warps": 32,
        "compile_time": 1.0240309238433838
    },
    {
        "BLOCK_SIZE_M": 16,
        "BLOCK_SIZE_N": 256,
        "BLOCK_SIZE_K": 512,
        "GROUP_SIZE_M": 8,
        "num_stages": 5,
        "num_warps": 2,
        "compile_time": 21.35159134864807
    },
    {
        "BLOCK_SIZE_M": 16,
        "BLOCK_SIZE_N": 256,
        "BLOCK_SIZE_K": 512,
        "GROUP_SIZE_M": 8,
        "num_stages": 5,
        "num_warps": 4,
        "compile_time": 6.473459005355835
    },
    {
        "BLOCK_SIZE_M": 16,
        "BLOCK_SIZE_N": 256,
        "BLOCK_SIZE_K": 512,
        "GROUP_SIZE_M": 8,
        "num_stages": 5,
        "num_warps": 8,
        "compile_time": 11.088708400726318
    },
    {
        "BLOCK_SIZE_M": 16,
        "BLOCK_SIZE_N": 256,
        "BLOCK_SIZE_K": 512,
        "GROUP_SIZE_M": 8,
        "num_stages": 5,
        "num_warps": 16,
        "compile_time": 2.293128252029419
    },
    {
        "BLOCK_SIZE_M": 16,
        "BLOCK_SIZE_N": 256,
        "BLOCK_SIZE_K": 512,
        "GROUP_SIZE_M": 8,
        "num_stages": 5,
        "num_warps": 32,
        "compile_time": 1.115140438079834
    },
    {
        "BLOCK_SIZE_M": 16,
        "BLOCK_SIZE_N": 256,
        "BLOCK_SIZE_K": 512,
        "GROUP_SIZE_M": 8,
        "num_stages": 6,
        "num_warps": 2,
        "compile_time": 22.289515256881714
    },
    {
        "BLOCK_SIZE_M": 16,
        "BLOCK_SIZE_N": 256,
        "BLOCK_SIZE_K": 512,
        "GROUP_SIZE_M": 8,
        "num_stages": 6,
        "num_warps": 4,
        "compile_time": 6.844713926315308
    },
    {
        "BLOCK_SIZE_M": 16,
        "BLOCK_SIZE_N": 256,
        "BLOCK_SIZE_K": 512,
        "GROUP_SIZE_M": 8,
        "num_stages": 6,
        "num_warps": 8,
        "compile_time": 11.27328109741211
    },
    {
        "BLOCK_SIZE_M": 16,
        "BLOCK_SIZE_N": 256,
        "BLOCK_SIZE_K": 512,
        "GROUP_SIZE_M": 8,
        "num_stages": 6,
        "num_warps": 16,
        "compile_time": 2.465576648712158
    },
    {
        "BLOCK_SIZE_M": 16,
        "BLOCK_SIZE_N": 256,
        "BLOCK_SIZE_K": 512,
        "GROUP_SIZE_M": 8,
        "num_stages": 6,
        "num_warps": 32,
        "compile_time": 1.238379955291748
    },
    {
        "BLOCK_SIZE_M": 16,
        "BLOCK_SIZE_N": 256,
        "BLOCK_SIZE_K": 512,
        "GROUP_SIZE_M": 8,
        "num_stages": 7,
        "num_warps": 2,
        "compile_time": 22.800636291503906
    },
    {
        "BLOCK_SIZE_M": 16,
        "BLOCK_SIZE_N": 256,
        "BLOCK_SIZE_K": 512,
        "GROUP_SIZE_M": 8,
        "num_stages": 7,
        "num_warps": 4,
        "compile_time": 7.203349828720093
    },
    {
        "BLOCK_SIZE_M": 16,
        "BLOCK_SIZE_N": 256,
        "BLOCK_SIZE_K": 512,
        "GROUP_SIZE_M": 8,
        "num_stages": 7,
        "num_warps": 8,
        "compile_time": 11.480690240859985
    },
    {
        "BLOCK_SIZE_M": 16,
        "BLOCK_SIZE_N": 256,
        "BLOCK_SIZE_K": 512,
        "GROUP_SIZE_M": 8,
        "num_stages": 7,
        "num_warps": 16,
        "compile_time": 2.65816330909729
    },
    {
        "BLOCK_SIZE_M": 16,
        "BLOCK_SIZE_N": 256,
        "BLOCK_SIZE_K": 512,
        "GROUP_SIZE_M": 8,
        "num_stages": 7,
        "num_warps": 32,
        "compile_time": 1.3019368648529053
    },
    {
        "BLOCK_SIZE_M": 16,
        "BLOCK_SIZE_N": 256,
        "BLOCK_SIZE_K": 512,
        "GROUP_SIZE_M": 8,
        "num_stages": 8,
        "num_warps": 2,
        "compile_time": 6.05844521522522
    },
    {
        "BLOCK_SIZE_M": 16,
        "BLOCK_SIZE_N": 256,
        "BLOCK_SIZE_K": 512,
        "GROUP_SIZE_M": 8,
        "num_stages": 8,
        "num_warps": 4,
        "compile_time": 7.75981068611145
    },
    {
        "BLOCK_SIZE_M": 16,
        "BLOCK_SIZE_N": 256,
        "BLOCK_SIZE_K": 512,
        "GROUP_SIZE_M": 8,
        "num_stages": 8,
        "num_warps": 8,
        "compile_time": 11.888530492782593
    },
    {
        "BLOCK_SIZE_M": 16,
        "BLOCK_SIZE_N": 256,
        "BLOCK_SIZE_K": 512,
        "GROUP_SIZE_M": 8,
        "num_stages": 8,
        "num_warps": 16,
        "compile_time": 2.867492198944092
    },
    {
        "BLOCK_SIZE_M": 16,
        "BLOCK_SIZE_N": 256,
        "BLOCK_SIZE_K": 512,
        "GROUP_SIZE_M": 8,
        "num_stages": 8,
        "num_warps": 32,
        "compile_time": 1.3783037662506104
    },
    {
        "BLOCK_SIZE_M": 16,
        "BLOCK_SIZE_N": 512,
        "BLOCK_SIZE_K": 32,
        "GROUP_SIZE_M": 8,
        "num_stages": 6,
        "num_warps": 2,
        "compile_time": 2.5507421493530273
    },
    {
        "BLOCK_SIZE_M": 16,
        "BLOCK_SIZE_N": 512,
        "BLOCK_SIZE_K": 32,
        "GROUP_SIZE_M": 8,
        "num_stages": 6,
        "num_warps": 4,
        "compile_time": 1.1735618114471436
    },
    {
        "BLOCK_SIZE_M": 16,
        "BLOCK_SIZE_N": 512,
        "BLOCK_SIZE_K": 32,
        "GROUP_SIZE_M": 8,
        "num_stages": 6,
        "num_warps": 8,
        "compile_time": 0.6770970821380615
    },
    {
        "BLOCK_SIZE_M": 16,
        "BLOCK_SIZE_N": 512,
        "BLOCK_SIZE_K": 32,
        "GROUP_SIZE_M": 8,
        "num_stages": 7,
        "num_warps": 2,
        "compile_time": 2.6648733615875244
    },
    {
        "BLOCK_SIZE_M": 16,
        "BLOCK_SIZE_N": 512,
        "BLOCK_SIZE_K": 32,
        "GROUP_SIZE_M": 8,
        "num_stages": 7,
        "num_warps": 4,
        "compile_time": 1.2366416454315186
    },
    {
        "BLOCK_SIZE_M": 16,
        "BLOCK_SIZE_N": 512,
        "BLOCK_SIZE_K": 32,
        "GROUP_SIZE_M": 8,
        "num_stages": 7,
        "num_warps": 8,
        "compile_time": 0.7120985984802246
    },
    {
        "BLOCK_SIZE_M": 16,
        "BLOCK_SIZE_N": 512,
        "BLOCK_SIZE_K": 32,
        "GROUP_SIZE_M": 8,
        "num_stages": 7,
        "num_warps": 16,
        "compile_time": 0.4702780246734619
    },
    {
        "BLOCK_SIZE_M": 16,
        "BLOCK_SIZE_N": 512,
        "BLOCK_SIZE_K": 32,
        "GROUP_SIZE_M": 8,
        "num_stages": 7,
        "num_warps": 32,
        "compile_time": 0.39106273651123047
    },
    {
        "BLOCK_SIZE_M": 16,
        "BLOCK_SIZE_N": 512,
        "BLOCK_SIZE_K": 32,
        "GROUP_SIZE_M": 8,
        "num_stages": 8,
        "num_warps": 2,
        "compile_time": 2.7551941871643066
    },
    {
        "BLOCK_SIZE_M": 16,
        "BLOCK_SIZE_N": 512,
        "BLOCK_SIZE_K": 32,
        "GROUP_SIZE_M": 8,
        "num_stages": 8,
        "num_warps": 4,
        "compile_time": 1.2883341312408447
    },
    {
        "BLOCK_SIZE_M": 16,
        "BLOCK_SIZE_N": 512,
        "BLOCK_SIZE_K": 32,
        "GROUP_SIZE_M": 8,
        "num_stages": 8,
        "num_warps": 8,
        "compile_time": 0.7476403713226318
    },
    {
        "BLOCK_SIZE_M": 16,
        "BLOCK_SIZE_N": 512,
        "BLOCK_SIZE_K": 32,
        "GROUP_SIZE_M": 8,
        "num_stages": 8,
        "num_warps": 16,
        "compile_time": 0.4836289882659912
    },
    {
        "BLOCK_SIZE_M": 16,
        "BLOCK_SIZE_N": 512,
        "BLOCK_SIZE_K": 32,
        "GROUP_SIZE_M": 8,
        "num_stages": 8,
        "num_warps": 32,
        "compile_time": 0.396287202835083
    },
    {
        "BLOCK_SIZE_M": 16,
        "BLOCK_SIZE_N": 512,
        "BLOCK_SIZE_K": 64,
        "GROUP_SIZE_M": 8,
        "num_stages": 3,
        "num_warps": 2,
        "compile_time": 10.831661224365234
    },
    {
        "BLOCK_SIZE_M": 16,
        "BLOCK_SIZE_N": 512,
        "BLOCK_SIZE_K": 64,
        "GROUP_SIZE_M": 8,
        "num_stages": 4,
        "num_warps": 2,
        "compile_time": 10.965110540390015
    },
    {
        "BLOCK_SIZE_M": 16,
        "BLOCK_SIZE_N": 512,
        "BLOCK_SIZE_K": 64,
        "GROUP_SIZE_M": 8,
        "num_stages": 4,
        "num_warps": 4,
        "compile_time": 2.072897434234619
    },
    {
        "BLOCK_SIZE_M": 16,
        "BLOCK_SIZE_N": 512,
        "BLOCK_SIZE_K": 64,
        "GROUP_SIZE_M": 8,
        "num_stages": 4,
        "num_warps": 8,
        "compile_time": 0.9513349533081055
    },
    {
        "BLOCK_SIZE_M": 16,
        "BLOCK_SIZE_N": 512,
        "BLOCK_SIZE_K": 64,
        "GROUP_SIZE_M": 8,
        "num_stages": 4,
        "num_warps": 16,
        "compile_time": 0.5766565799713135
    },
    {
        "BLOCK_SIZE_M": 16,
        "BLOCK_SIZE_N": 512,
        "BLOCK_SIZE_K": 64,
        "GROUP_SIZE_M": 8,
        "num_stages": 4,
        "num_warps": 32,
        "compile_time": 0.40776872634887695
    },
    {
        "BLOCK_SIZE_M": 16,
        "BLOCK_SIZE_N": 512,
        "BLOCK_SIZE_K": 64,
        "GROUP_SIZE_M": 8,
        "num_stages": 5,
        "num_warps": 2,
        "compile_time": 11.21232008934021
    },
    {
        "BLOCK_SIZE_M": 16,
        "BLOCK_SIZE_N": 512,
        "BLOCK_SIZE_K": 64,
        "GROUP_SIZE_M": 8,
        "num_stages": 5,
        "num_warps": 4,
        "compile_time": 2.2116899490356445
    },
    {
        "BLOCK_SIZE_M": 16,
        "BLOCK_SIZE_N": 512,
        "BLOCK_SIZE_K": 64,
        "GROUP_SIZE_M": 8,
        "num_stages": 5,
        "num_warps": 8,
        "compile_time": 1.0250365734100342
    },
    {
        "BLOCK_SIZE_M": 16,
        "BLOCK_SIZE_N": 512,
        "BLOCK_SIZE_K": 64,
        "GROUP_SIZE_M": 8,
        "num_stages": 5,
        "num_warps": 16,
        "compile_time": 0.6014912128448486
    },
    {
        "BLOCK_SIZE_M": 16,
        "BLOCK_SIZE_N": 512,
        "BLOCK_SIZE_K": 64,
        "GROUP_SIZE_M": 8,
        "num_stages": 5,
        "num_warps": 32,
        "compile_time": 0.4289681911468506
    },
    {
        "BLOCK_SIZE_M": 16,
        "BLOCK_SIZE_N": 512,
        "BLOCK_SIZE_K": 64,
        "GROUP_SIZE_M": 8,
        "num_stages": 6,
        "num_warps": 2,
        "compile_time": 11.425849199295044
    },
    {
        "BLOCK_SIZE_M": 16,
        "BLOCK_SIZE_N": 512,
        "BLOCK_SIZE_K": 64,
        "GROUP_SIZE_M": 8,
        "num_stages": 6,
        "num_warps": 4,
        "compile_time": 2.3303115367889404
    },
    {
        "BLOCK_SIZE_M": 16,
        "BLOCK_SIZE_N": 512,
        "BLOCK_SIZE_K": 64,
        "GROUP_SIZE_M": 8,
        "num_stages": 6,
        "num_warps": 8,
        "compile_time": 1.1034748554229736
    },
    {
        "BLOCK_SIZE_M": 16,
        "BLOCK_SIZE_N": 512,
        "BLOCK_SIZE_K": 64,
        "GROUP_SIZE_M": 8,
        "num_stages": 6,
        "num_warps": 16,
        "compile_time": 0.6626324653625488
    },
    {
        "BLOCK_SIZE_M": 16,
        "BLOCK_SIZE_N": 512,
        "BLOCK_SIZE_K": 64,
        "GROUP_SIZE_M": 8,
        "num_stages": 6,
        "num_warps": 32,
        "compile_time": 0.4547438621520996
    },
    {
        "BLOCK_SIZE_M": 16,
        "BLOCK_SIZE_N": 512,
        "BLOCK_SIZE_K": 64,
        "GROUP_SIZE_M": 8,
        "num_stages": 7,
        "num_warps": 2,
        "compile_time": 11.504407167434692
    },
    {
        "BLOCK_SIZE_M": 16,
        "BLOCK_SIZE_N": 512,
        "BLOCK_SIZE_K": 64,
        "GROUP_SIZE_M": 8,
        "num_stages": 7,
        "num_warps": 4,
        "compile_time": 2.411548376083374
    },
    {
        "BLOCK_SIZE_M": 16,
        "BLOCK_SIZE_N": 512,
        "BLOCK_SIZE_K": 64,
        "GROUP_SIZE_M": 8,
        "num_stages": 7,
        "num_warps": 8,
        "compile_time": 1.143751859664917
    },
    {
        "BLOCK_SIZE_M": 16,
        "BLOCK_SIZE_N": 512,
        "BLOCK_SIZE_K": 64,
        "GROUP_SIZE_M": 8,
        "num_stages": 7,
        "num_warps": 16,
        "compile_time": 0.664801836013794
    },
    {
        "BLOCK_SIZE_M": 16,
        "BLOCK_SIZE_N": 512,
        "BLOCK_SIZE_K": 64,
        "GROUP_SIZE_M": 8,
        "num_stages": 7,
        "num_warps": 32,
        "compile_time": 0.4264993667602539
    },
    {
        "BLOCK_SIZE_M": 16,
        "BLOCK_SIZE_N": 512,
        "BLOCK_SIZE_K": 64,
        "GROUP_SIZE_M": 8,
        "num_stages": 8,
        "num_warps": 2,
        "compile_time": 11.857980012893677
    },
    {
        "BLOCK_SIZE_M": 16,
        "BLOCK_SIZE_N": 512,
        "BLOCK_SIZE_K": 64,
        "GROUP_SIZE_M": 8,
        "num_stages": 8,
        "num_warps": 4,
        "compile_time": 2.5921502113342285
    },
    {
        "BLOCK_SIZE_M": 16,
        "BLOCK_SIZE_N": 512,
        "BLOCK_SIZE_K": 64,
        "GROUP_SIZE_M": 8,
        "num_stages": 8,
        "num_warps": 8,
        "compile_time": 1.3074567317962646
    },
    {
        "BLOCK_SIZE_M": 16,
        "BLOCK_SIZE_N": 512,
        "BLOCK_SIZE_K": 64,
        "GROUP_SIZE_M": 8,
        "num_stages": 8,
        "num_warps": 16,
        "compile_time": 0.7433929443359375
    },
    {
        "BLOCK_SIZE_M": 16,
        "BLOCK_SIZE_N": 512,
        "BLOCK_SIZE_K": 64,
        "GROUP_SIZE_M": 8,
        "num_stages": 8,
        "num_warps": 32,
        "compile_time": 0.48308444023132324
    },
    {
        "BLOCK_SIZE_M": 16,
        "BLOCK_SIZE_N": 512,
        "BLOCK_SIZE_K": 128,
        "GROUP_SIZE_M": 8,
        "num_stages": 1,
        "num_warps": 2,
        "compile_time": 8.03799819946289
    },
    {
        "BLOCK_SIZE_M": 16,
        "BLOCK_SIZE_N": 512,
        "BLOCK_SIZE_K": 128,
        "GROUP_SIZE_M": 8,
        "num_stages": 2,
        "num_warps": 2,
        "compile_time": 7.866941928863525
    },
    {
        "BLOCK_SIZE_M": 16,
        "BLOCK_SIZE_N": 512,
        "BLOCK_SIZE_K": 128,
        "GROUP_SIZE_M": 8,
        "num_stages": 3,
        "num_warps": 2,
        "compile_time": 99.68090438842773
    },
    {
        "BLOCK_SIZE_M": 16,
        "BLOCK_SIZE_N": 512,
        "BLOCK_SIZE_K": 128,
        "GROUP_SIZE_M": 8,
        "num_stages": 3,
        "num_warps": 4,
        "compile_time": 10.738173484802246
    },
    {
        "BLOCK_SIZE_M": 16,
        "BLOCK_SIZE_N": 512,
        "BLOCK_SIZE_K": 128,
        "GROUP_SIZE_M": 8,
        "num_stages": 3,
        "num_warps": 8,
        "compile_time": 0.005510091781616211
    },
    {
        "BLOCK_SIZE_M": 16,
        "BLOCK_SIZE_N": 512,
        "BLOCK_SIZE_K": 128,
        "GROUP_SIZE_M": 8,
        "num_stages": 3,
        "num_warps": 16,
        "compile_time": 0.0030753612518310547
    },
    {
        "BLOCK_SIZE_M": 16,
        "BLOCK_SIZE_N": 512,
        "BLOCK_SIZE_K": 128,
        "GROUP_SIZE_M": 8,
        "num_stages": 3,
        "num_warps": 32,
        "compile_time": 0.003039121627807617
    },
    {
        "BLOCK_SIZE_M": 16,
        "BLOCK_SIZE_N": 512,
        "BLOCK_SIZE_K": 128,
        "GROUP_SIZE_M": 8,
        "num_stages": 4,
        "num_warps": 2,
        "compile_time": 6.128021955490112
    },
    {
        "BLOCK_SIZE_M": 16,
        "BLOCK_SIZE_N": 512,
        "BLOCK_SIZE_K": 128,
        "GROUP_SIZE_M": 8,
        "num_stages": 4,
        "num_warps": 4,
        "compile_time": 10.836532831192017
    },
    {
        "BLOCK_SIZE_M": 16,
        "BLOCK_SIZE_N": 512,
        "BLOCK_SIZE_K": 128,
        "GROUP_SIZE_M": 8,
        "num_stages": 4,
        "num_warps": 8,
        "compile_time": 0.0040318965911865234
    },
    {
        "BLOCK_SIZE_M": 16,
        "BLOCK_SIZE_N": 512,
        "BLOCK_SIZE_K": 128,
        "GROUP_SIZE_M": 8,
        "num_stages": 4,
        "num_warps": 16,
        "compile_time": 0.0031251907348632812
    },
    {
        "BLOCK_SIZE_M": 16,
        "BLOCK_SIZE_N": 512,
        "BLOCK_SIZE_K": 128,
        "GROUP_SIZE_M": 8,
        "num_stages": 4,
        "num_warps": 32,
        "compile_time": 0.003050088882446289
    },
    {
        "BLOCK_SIZE_M": 16,
        "BLOCK_SIZE_N": 512,
        "BLOCK_SIZE_K": 128,
        "GROUP_SIZE_M": 8,
        "num_stages": 5,
        "num_warps": 2,
        "compile_time": 6.374134063720703
    },
    {
        "BLOCK_SIZE_M": 16,
        "BLOCK_SIZE_N": 512,
        "BLOCK_SIZE_K": 128,
        "GROUP_SIZE_M": 8,
        "num_stages": 5,
        "num_warps": 4,
        "compile_time": 11.004765748977661
    },
    {
        "BLOCK_SIZE_M": 16,
        "BLOCK_SIZE_N": 512,
        "BLOCK_SIZE_K": 128,
        "GROUP_SIZE_M": 8,
        "num_stages": 5,
        "num_warps": 8,
        "compile_time": 0.005211830139160156
    },
    {
        "BLOCK_SIZE_M": 16,
        "BLOCK_SIZE_N": 512,
        "BLOCK_SIZE_K": 128,
        "GROUP_SIZE_M": 8,
        "num_stages": 5,
        "num_warps": 16,
        "compile_time": 0.003155231475830078
    },
    {
        "BLOCK_SIZE_M": 16,
        "BLOCK_SIZE_N": 512,
        "BLOCK_SIZE_K": 128,
        "GROUP_SIZE_M": 8,
        "num_stages": 5,
        "num_warps": 32,
        "compile_time": 0.003000497817993164
    },
    {
        "BLOCK_SIZE_M": 16,
        "BLOCK_SIZE_N": 512,
        "BLOCK_SIZE_K": 128,
        "GROUP_SIZE_M": 8,
        "num_stages": 6,
        "num_warps": 2,
        "compile_time": 6.619976282119751
    },
    {
        "BLOCK_SIZE_M": 16,
        "BLOCK_SIZE_N": 512,
        "BLOCK_SIZE_K": 128,
        "GROUP_SIZE_M": 8,
        "num_stages": 6,
        "num_warps": 4,
        "compile_time": 11.19308876991272
    },
    {
        "BLOCK_SIZE_M": 16,
        "BLOCK_SIZE_N": 512,
        "BLOCK_SIZE_K": 128,
        "GROUP_SIZE_M": 8,
        "num_stages": 6,
        "num_warps": 8,
        "compile_time": 0.004044771194458008
    },
    {
        "BLOCK_SIZE_M": 16,
        "BLOCK_SIZE_N": 512,
        "BLOCK_SIZE_K": 128,
        "GROUP_SIZE_M": 8,
        "num_stages": 6,
        "num_warps": 16,
        "compile_time": 0.003190279006958008
    },
    {
        "BLOCK_SIZE_M": 16,
        "BLOCK_SIZE_N": 512,
        "BLOCK_SIZE_K": 128,
        "GROUP_SIZE_M": 8,
        "num_stages": 6,
        "num_warps": 32,
        "compile_time": 0.0030336380004882812
    },
    {
        "BLOCK_SIZE_M": 16,
        "BLOCK_SIZE_N": 512,
        "BLOCK_SIZE_K": 128,
        "GROUP_SIZE_M": 8,
        "num_stages": 7,
        "num_warps": 2,
        "compile_time": 7.059655427932739
    },
    {
        "BLOCK_SIZE_M": 16,
        "BLOCK_SIZE_N": 512,
        "BLOCK_SIZE_K": 128,
        "GROUP_SIZE_M": 8,
        "num_stages": 7,
        "num_warps": 4,
        "compile_time": 11.321127891540527
    },
    {
        "BLOCK_SIZE_M": 16,
        "BLOCK_SIZE_N": 512,
        "BLOCK_SIZE_K": 128,
        "GROUP_SIZE_M": 8,
        "num_stages": 7,
        "num_warps": 8,
        "compile_time": 0.004231691360473633
    },
    {
        "BLOCK_SIZE_M": 16,
        "BLOCK_SIZE_N": 512,
        "BLOCK_SIZE_K": 128,
        "GROUP_SIZE_M": 8,
        "num_stages": 7,
        "num_warps": 16,
        "compile_time": 0.003195524215698242
    },
    {
        "BLOCK_SIZE_M": 16,
        "BLOCK_SIZE_N": 512,
        "BLOCK_SIZE_K": 128,
        "GROUP_SIZE_M": 8,
        "num_stages": 7,
        "num_warps": 32,
        "compile_time": 0.0030879974365234375
    },
    {
        "BLOCK_SIZE_M": 16,
        "BLOCK_SIZE_N": 512,
        "BLOCK_SIZE_K": 128,
        "GROUP_SIZE_M": 8,
        "num_stages": 8,
        "num_warps": 2,
        "compile_time": 7.412092924118042
    },
    {
        "BLOCK_SIZE_M": 16,
        "BLOCK_SIZE_N": 512,
        "BLOCK_SIZE_K": 128,
        "GROUP_SIZE_M": 8,
        "num_stages": 8,
        "num_warps": 4,
        "compile_time": 11.432503938674927
    },
    {
        "BLOCK_SIZE_M": 16,
        "BLOCK_SIZE_N": 512,
        "BLOCK_SIZE_K": 128,
        "GROUP_SIZE_M": 8,
        "num_stages": 8,
        "num_warps": 8,
        "compile_time": 0.004913330078125
    },
    {
        "BLOCK_SIZE_M": 16,
        "BLOCK_SIZE_N": 512,
        "BLOCK_SIZE_K": 128,
        "GROUP_SIZE_M": 8,
        "num_stages": 8,
        "num_warps": 16,
        "compile_time": 0.004065513610839844
    },
    {
        "BLOCK_SIZE_M": 16,
        "BLOCK_SIZE_N": 512,
        "BLOCK_SIZE_K": 128,
        "GROUP_SIZE_M": 8,
        "num_stages": 8,
        "num_warps": 32,
        "compile_time": 0.0030579566955566406
    },
    {
        "BLOCK_SIZE_M": 16,
        "BLOCK_SIZE_N": 512,
        "BLOCK_SIZE_K": 256,
        "GROUP_SIZE_M": 8,
        "num_stages": 1,
        "num_warps": 2,
        "compile_time": 19.179085969924927
    },
    {
        "BLOCK_SIZE_M": 16,
        "BLOCK_SIZE_N": 512,
        "BLOCK_SIZE_K": 256,
        "GROUP_SIZE_M": 8,
        "num_stages": 1,
        "num_warps": 4,
        "compile_time": 7.995088338851929
    },
    {
        "BLOCK_SIZE_M": 16,
        "BLOCK_SIZE_N": 512,
        "BLOCK_SIZE_K": 256,
        "GROUP_SIZE_M": 8,
        "num_stages": 1,
        "num_warps": 8,
        "compile_time": 0.00366973876953125
    },
    {
        "BLOCK_SIZE_M": 16,
        "BLOCK_SIZE_N": 512,
        "BLOCK_SIZE_K": 256,
        "GROUP_SIZE_M": 8,
        "num_stages": 1,
        "num_warps": 16,
        "compile_time": 0.0037658214569091797
    },
    {
        "BLOCK_SIZE_M": 16,
        "BLOCK_SIZE_N": 512,
        "BLOCK_SIZE_K": 256,
        "GROUP_SIZE_M": 8,
        "num_stages": 1,
        "num_warps": 32,
        "compile_time": 0.002888202667236328
    },
    {
        "BLOCK_SIZE_M": 16,
        "BLOCK_SIZE_N": 512,
        "BLOCK_SIZE_K": 256,
        "GROUP_SIZE_M": 8,
        "num_stages": 2,
        "num_warps": 2,
        "compile_time": 19.187239170074463
    },
    {
        "BLOCK_SIZE_M": 16,
        "BLOCK_SIZE_N": 512,
        "BLOCK_SIZE_K": 256,
        "GROUP_SIZE_M": 8,
        "num_stages": 2,
        "num_warps": 4,
        "compile_time": 7.757275819778442
    },
    {
        "BLOCK_SIZE_M": 16,
        "BLOCK_SIZE_N": 512,
        "BLOCK_SIZE_K": 256,
        "GROUP_SIZE_M": 8,
        "num_stages": 2,
        "num_warps": 8,
        "compile_time": 0.0038487911224365234
    },
    {
        "BLOCK_SIZE_M": 16,
        "BLOCK_SIZE_N": 512,
        "BLOCK_SIZE_K": 256,
        "GROUP_SIZE_M": 8,
        "num_stages": 2,
        "num_warps": 16,
        "compile_time": 0.002870798110961914
    },
    {
        "BLOCK_SIZE_M": 16,
        "BLOCK_SIZE_N": 512,
        "BLOCK_SIZE_K": 256,
        "GROUP_SIZE_M": 8,
        "num_stages": 2,
        "num_warps": 32,
        "compile_time": 0.002802133560180664
    },
    {
        "BLOCK_SIZE_M": 16,
        "BLOCK_SIZE_N": 512,
        "BLOCK_SIZE_K": 256,
        "GROUP_SIZE_M": 8,
        "num_stages": 3,
        "num_warps": 2,
        "compile_time": 20.092313051223755
    },
    {
        "BLOCK_SIZE_M": 16,
        "BLOCK_SIZE_N": 512,
        "BLOCK_SIZE_K": 256,
        "GROUP_SIZE_M": 8,
        "num_stages": 3,
        "num_warps": 4,
        "compile_time": 99.69417357444763
    },
    {
        "BLOCK_SIZE_M": 16,
        "BLOCK_SIZE_N": 512,
        "BLOCK_SIZE_K": 256,
        "GROUP_SIZE_M": 8,
        "num_stages": 3,
        "num_warps": 8,
        "compile_time": 10.499382495880127
    },
    {
        "BLOCK_SIZE_M": 16,
        "BLOCK_SIZE_N": 512,
        "BLOCK_SIZE_K": 256,
        "GROUP_SIZE_M": 8,
        "num_stages": 3,
        "num_warps": 16,
        "compile_time": 0.0041544437408447266
    },
    {
        "BLOCK_SIZE_M": 16,
        "BLOCK_SIZE_N": 512,
        "BLOCK_SIZE_K": 256,
        "GROUP_SIZE_M": 8,
        "num_stages": 3,
        "num_warps": 32,
        "compile_time": 0.004323244094848633
    },
    {
        "BLOCK_SIZE_M": 16,
        "BLOCK_SIZE_N": 512,
        "BLOCK_SIZE_K": 256,
        "GROUP_SIZE_M": 8,
        "num_stages": 4,
        "num_warps": 2,
        "compile_time": 20.68834638595581
    },
    {
        "BLOCK_SIZE_M": 16,
        "BLOCK_SIZE_N": 512,
        "BLOCK_SIZE_K": 256,
        "GROUP_SIZE_M": 8,
        "num_stages": 4,
        "num_warps": 4,
        "compile_time": 6.1423115730285645
    },
    {
        "BLOCK_SIZE_M": 16,
        "BLOCK_SIZE_N": 512,
        "BLOCK_SIZE_K": 256,
        "GROUP_SIZE_M": 8,
        "num_stages": 4,
        "num_warps": 8,
        "compile_time": 10.748132705688477
    },
    {
        "BLOCK_SIZE_M": 16,
        "BLOCK_SIZE_N": 512,
        "BLOCK_SIZE_K": 256,
        "GROUP_SIZE_M": 8,
        "num_stages": 4,
        "num_warps": 16,
        "compile_time": 0.0039038658142089844
    },
    {
        "BLOCK_SIZE_M": 16,
        "BLOCK_SIZE_N": 512,
        "BLOCK_SIZE_K": 256,
        "GROUP_SIZE_M": 8,
        "num_stages": 4,
        "num_warps": 32,
        "compile_time": 0.002905607223510742
    },
    {
        "BLOCK_SIZE_M": 16,
        "BLOCK_SIZE_N": 512,
        "BLOCK_SIZE_K": 256,
        "GROUP_SIZE_M": 8,
        "num_stages": 5,
        "num_warps": 2,
        "compile_time": 21.31097388267517
    },
    {
        "BLOCK_SIZE_M": 16,
        "BLOCK_SIZE_N": 512,
        "BLOCK_SIZE_K": 256,
        "GROUP_SIZE_M": 8,
        "num_stages": 5,
        "num_warps": 4,
        "compile_time": 6.431890964508057
    },
    {
        "BLOCK_SIZE_M": 16,
        "BLOCK_SIZE_N": 512,
        "BLOCK_SIZE_K": 256,
        "GROUP_SIZE_M": 8,
        "num_stages": 5,
        "num_warps": 8,
        "compile_time": 11.180639028549194
    },
    {
        "BLOCK_SIZE_M": 16,
        "BLOCK_SIZE_N": 512,
        "BLOCK_SIZE_K": 256,
        "GROUP_SIZE_M": 8,
        "num_stages": 5,
        "num_warps": 16,
        "compile_time": 0.003818035125732422
    },
    {
        "BLOCK_SIZE_M": 16,
        "BLOCK_SIZE_N": 512,
        "BLOCK_SIZE_K": 256,
        "GROUP_SIZE_M": 8,
        "num_stages": 5,
        "num_warps": 32,
        "compile_time": 0.002905607223510742
    },
    {
        "BLOCK_SIZE_M": 16,
        "BLOCK_SIZE_N": 512,
        "BLOCK_SIZE_K": 256,
        "GROUP_SIZE_M": 8,
        "num_stages": 6,
        "num_warps": 2,
        "compile_time": 22.381548166275024
    },
    {
        "BLOCK_SIZE_M": 16,
        "BLOCK_SIZE_N": 512,
        "BLOCK_SIZE_K": 256,
        "GROUP_SIZE_M": 8,
        "num_stages": 6,
        "num_warps": 4,
        "compile_time": 6.909317970275879
    },
    {
        "BLOCK_SIZE_M": 16,
        "BLOCK_SIZE_N": 512,
        "BLOCK_SIZE_K": 256,
        "GROUP_SIZE_M": 8,
        "num_stages": 6,
        "num_warps": 8,
        "compile_time": 11.40665888786316
    },
    {
        "BLOCK_SIZE_M": 16,
        "BLOCK_SIZE_N": 512,
        "BLOCK_SIZE_K": 256,
        "GROUP_SIZE_M": 8,
        "num_stages": 6,
        "num_warps": 16,
        "compile_time": 0.003877401351928711
    },
    {
        "BLOCK_SIZE_M": 16,
        "BLOCK_SIZE_N": 512,
        "BLOCK_SIZE_K": 256,
        "GROUP_SIZE_M": 8,
        "num_stages": 6,
        "num_warps": 32,
        "compile_time": 0.0029120445251464844
    },
    {
        "BLOCK_SIZE_M": 16,
        "BLOCK_SIZE_N": 512,
        "BLOCK_SIZE_K": 256,
        "GROUP_SIZE_M": 8,
        "num_stages": 7,
        "num_warps": 2,
        "compile_time": 23.340994358062744
    },
    {
        "BLOCK_SIZE_M": 16,
        "BLOCK_SIZE_N": 512,
        "BLOCK_SIZE_K": 256,
        "GROUP_SIZE_M": 8,
        "num_stages": 7,
        "num_warps": 4,
        "compile_time": 7.298274993896484
    },
    {
        "BLOCK_SIZE_M": 16,
        "BLOCK_SIZE_N": 512,
        "BLOCK_SIZE_K": 256,
        "GROUP_SIZE_M": 8,
        "num_stages": 7,
        "num_warps": 8,
        "compile_time": 11.103120803833008
    },
    {
        "BLOCK_SIZE_M": 16,
        "BLOCK_SIZE_N": 512,
        "BLOCK_SIZE_K": 256,
        "GROUP_SIZE_M": 8,
        "num_stages": 7,
        "num_warps": 16,
        "compile_time": 0.004045724868774414
    },
    {
        "BLOCK_SIZE_M": 16,
        "BLOCK_SIZE_N": 512,
        "BLOCK_SIZE_K": 256,
        "GROUP_SIZE_M": 8,
        "num_stages": 7,
        "num_warps": 32,
        "compile_time": 0.0028944015502929688
    },
    {
        "BLOCK_SIZE_M": 16,
        "BLOCK_SIZE_N": 512,
        "BLOCK_SIZE_K": 256,
        "GROUP_SIZE_M": 8,
        "num_stages": 8,
        "num_warps": 2,
        "compile_time": 6.082924127578735
    },
    {
        "BLOCK_SIZE_M": 16,
        "BLOCK_SIZE_N": 512,
        "BLOCK_SIZE_K": 256,
        "GROUP_SIZE_M": 8,
        "num_stages": 8,
        "num_warps": 4,
        "compile_time": 7.570848703384399
    },
    {
        "BLOCK_SIZE_M": 16,
        "BLOCK_SIZE_N": 512,
        "BLOCK_SIZE_K": 256,
        "GROUP_SIZE_M": 8,
        "num_stages": 8,
        "num_warps": 8,
        "compile_time": 11.750547170639038
    },
    {
        "BLOCK_SIZE_M": 16,
        "BLOCK_SIZE_N": 512,
        "BLOCK_SIZE_K": 256,
        "GROUP_SIZE_M": 8,
        "num_stages": 8,
        "num_warps": 16,
        "compile_time": 0.003711700439453125
    },
    {
        "BLOCK_SIZE_M": 16,
        "BLOCK_SIZE_N": 512,
        "BLOCK_SIZE_K": 256,
        "GROUP_SIZE_M": 8,
        "num_stages": 8,
        "num_warps": 32,
        "compile_time": 0.002909421920776367
    },
    {
        "BLOCK_SIZE_M": 16,
        "BLOCK_SIZE_N": 512,
        "BLOCK_SIZE_K": 512,
        "GROUP_SIZE_M": 8,
        "num_stages": 1,
        "num_warps": 2,
        "compile_time": 71.63028526306152
    },
    {
        "BLOCK_SIZE_M": 16,
        "BLOCK_SIZE_N": 512,
        "BLOCK_SIZE_K": 512,
        "GROUP_SIZE_M": 8,
        "num_stages": 1,
        "num_warps": 4,
        "compile_time": 19.07997965812683
    },
    {
        "BLOCK_SIZE_M": 16,
        "BLOCK_SIZE_N": 512,
        "BLOCK_SIZE_K": 512,
        "GROUP_SIZE_M": 8,
        "num_stages": 1,
        "num_warps": 8,
        "compile_time": 7.86165452003479
    },
    {
        "BLOCK_SIZE_M": 16,
        "BLOCK_SIZE_N": 512,
        "BLOCK_SIZE_K": 512,
        "GROUP_SIZE_M": 8,
        "num_stages": 1,
        "num_warps": 16,
        "compile_time": 0.004290342330932617
    },
    {
        "BLOCK_SIZE_M": 16,
        "BLOCK_SIZE_N": 512,
        "BLOCK_SIZE_K": 512,
        "GROUP_SIZE_M": 8,
        "num_stages": 1,
        "num_warps": 32,
        "compile_time": 0.002960205078125
    },
    {
        "BLOCK_SIZE_M": 16,
        "BLOCK_SIZE_N": 512,
        "BLOCK_SIZE_K": 512,
        "GROUP_SIZE_M": 8,
        "num_stages": 2,
        "num_warps": 2,
        "compile_time": 71.75002455711365
    },
    {
        "BLOCK_SIZE_M": 16,
        "BLOCK_SIZE_N": 512,
        "BLOCK_SIZE_K": 512,
        "GROUP_SIZE_M": 8,
        "num_stages": 2,
        "num_warps": 4,
        "compile_time": 19.32507085800171
    },
    {
        "BLOCK_SIZE_M": 16,
        "BLOCK_SIZE_N": 512,
        "BLOCK_SIZE_K": 512,
        "GROUP_SIZE_M": 8,
        "num_stages": 2,
        "num_warps": 8,
        "compile_time": 7.8464601039886475
    },
    {
        "BLOCK_SIZE_M": 16,
        "BLOCK_SIZE_N": 512,
        "BLOCK_SIZE_K": 512,
        "GROUP_SIZE_M": 8,
        "num_stages": 2,
        "num_warps": 16,
        "compile_time": 0.003994941711425781
    },
    {
        "BLOCK_SIZE_M": 16,
        "BLOCK_SIZE_N": 512,
        "BLOCK_SIZE_K": 512,
        "GROUP_SIZE_M": 8,
        "num_stages": 2,
        "num_warps": 32,
        "compile_time": 0.0029218196868896484
    },
    {
        "BLOCK_SIZE_M": 16,
        "BLOCK_SIZE_N": 512,
        "BLOCK_SIZE_K": 512,
        "GROUP_SIZE_M": 8,
        "num_stages": 3,
        "num_warps": 2,
        "compile_time": 6.990432024002075
    },
    {
        "BLOCK_SIZE_M": 16,
        "BLOCK_SIZE_N": 512,
        "BLOCK_SIZE_K": 512,
        "GROUP_SIZE_M": 8,
        "num_stages": 3,
        "num_warps": 4,
        "compile_time": 19.93224048614502
    },
    {
        "BLOCK_SIZE_M": 16,
        "BLOCK_SIZE_N": 512,
        "BLOCK_SIZE_K": 512,
        "GROUP_SIZE_M": 8,
        "num_stages": 3,
        "num_warps": 8,
        "compile_time": 6.028519868850708
    },
    {
        "BLOCK_SIZE_M": 16,
        "BLOCK_SIZE_N": 512,
        "BLOCK_SIZE_K": 512,
        "GROUP_SIZE_M": 8,
        "num_stages": 3,
        "num_warps": 16,
        "compile_time": 10.222364664077759
    },
    {
        "BLOCK_SIZE_M": 16,
        "BLOCK_SIZE_N": 512,
        "BLOCK_SIZE_K": 512,
        "GROUP_SIZE_M": 8,
        "num_stages": 3,
        "num_warps": 32,
        "compile_time": 0.0039556026458740234
    },
    {
        "BLOCK_SIZE_M": 16,
        "BLOCK_SIZE_N": 512,
        "BLOCK_SIZE_K": 512,
        "GROUP_SIZE_M": 8,
        "num_stages": 4,
        "num_warps": 2,
        "compile_time": 8.557981967926025
    },
    {
        "BLOCK_SIZE_M": 16,
        "BLOCK_SIZE_N": 512,
        "BLOCK_SIZE_K": 512,
        "GROUP_SIZE_M": 8,
        "num_stages": 4,
        "num_warps": 4,
        "compile_time": 20.718191385269165
    },
    {
        "BLOCK_SIZE_M": 16,
        "BLOCK_SIZE_N": 512,
        "BLOCK_SIZE_K": 512,
        "GROUP_SIZE_M": 8,
        "num_stages": 4,
        "num_warps": 8,
        "compile_time": 6.528779745101929
    },
    {
        "BLOCK_SIZE_M": 16,
        "BLOCK_SIZE_N": 512,
        "BLOCK_SIZE_K": 512,
        "GROUP_SIZE_M": 8,
        "num_stages": 4,
        "num_warps": 16,
        "compile_time": 10.67479133605957
    },
    {
        "BLOCK_SIZE_M": 16,
        "BLOCK_SIZE_N": 512,
        "BLOCK_SIZE_K": 512,
        "GROUP_SIZE_M": 8,
        "num_stages": 4,
        "num_warps": 32,
        "compile_time": 0.0036220550537109375
    },
    {
        "BLOCK_SIZE_M": 16,
        "BLOCK_SIZE_N": 512,
        "BLOCK_SIZE_K": 512,
        "GROUP_SIZE_M": 8,
        "num_stages": 5,
        "num_warps": 2,
        "compile_time": 10.336485624313354
    },
    {
        "BLOCK_SIZE_M": 16,
        "BLOCK_SIZE_N": 512,
        "BLOCK_SIZE_K": 512,
        "GROUP_SIZE_M": 8,
        "num_stages": 5,
        "num_warps": 4,
        "compile_time": 21.90114188194275
    },
    {
        "BLOCK_SIZE_M": 16,
        "BLOCK_SIZE_N": 512,
        "BLOCK_SIZE_K": 512,
        "GROUP_SIZE_M": 8,
        "num_stages": 5,
        "num_warps": 8,
        "compile_time": 6.758627653121948
    },
    {
        "BLOCK_SIZE_M": 16,
        "BLOCK_SIZE_N": 512,
        "BLOCK_SIZE_K": 512,
        "GROUP_SIZE_M": 8,
        "num_stages": 5,
        "num_warps": 16,
        "compile_time": 11.358195781707764
    },
    {
        "BLOCK_SIZE_M": 16,
        "BLOCK_SIZE_N": 512,
        "BLOCK_SIZE_K": 512,
        "GROUP_SIZE_M": 8,
        "num_stages": 5,
        "num_warps": 32,
        "compile_time": 2.338027000427246
    },
    {
        "BLOCK_SIZE_M": 16,
        "BLOCK_SIZE_N": 512,
        "BLOCK_SIZE_K": 512,
        "GROUP_SIZE_M": 8,
        "num_stages": 6,
        "num_warps": 2,
        "compile_time": 12.050164461135864
    },
    {
        "BLOCK_SIZE_M": 16,
        "BLOCK_SIZE_N": 512,
        "BLOCK_SIZE_K": 512,
        "GROUP_SIZE_M": 8,
        "num_stages": 6,
        "num_warps": 4,
        "compile_time": 22.46424961090088
    },
    {
        "BLOCK_SIZE_M": 16,
        "BLOCK_SIZE_N": 512,
        "BLOCK_SIZE_K": 512,
        "GROUP_SIZE_M": 8,
        "num_stages": 6,
        "num_warps": 8,
        "compile_time": 7.15346360206604
    },
    {
        "BLOCK_SIZE_M": 16,
        "BLOCK_SIZE_N": 512,
        "BLOCK_SIZE_K": 512,
        "GROUP_SIZE_M": 8,
        "num_stages": 6,
        "num_warps": 16,
        "compile_time": 11.150538921356201
    },
    {
        "BLOCK_SIZE_M": 16,
        "BLOCK_SIZE_N": 512,
        "BLOCK_SIZE_K": 512,
        "GROUP_SIZE_M": 8,
        "num_stages": 6,
        "num_warps": 32,
        "compile_time": 2.5115857124328613
    },
    {
        "BLOCK_SIZE_M": 16,
        "BLOCK_SIZE_N": 512,
        "BLOCK_SIZE_K": 512,
        "GROUP_SIZE_M": 8,
        "num_stages": 7,
        "num_warps": 2,
        "compile_time": 13.974228858947754
    },
    {
        "BLOCK_SIZE_M": 16,
        "BLOCK_SIZE_N": 512,
        "BLOCK_SIZE_K": 512,
        "GROUP_SIZE_M": 8,
        "num_stages": 7,
        "num_warps": 4,
        "compile_time": 6.043006896972656
    },
    {
        "BLOCK_SIZE_M": 16,
        "BLOCK_SIZE_N": 512,
        "BLOCK_SIZE_K": 512,
        "GROUP_SIZE_M": 8,
        "num_stages": 7,
        "num_warps": 8,
        "compile_time": 7.712555170059204
    },
    {
        "BLOCK_SIZE_M": 16,
        "BLOCK_SIZE_N": 512,
        "BLOCK_SIZE_K": 512,
        "GROUP_SIZE_M": 8,
        "num_stages": 7,
        "num_warps": 16,
        "compile_time": 11.816351175308228
    },
    {
        "BLOCK_SIZE_M": 16,
        "BLOCK_SIZE_N": 512,
        "BLOCK_SIZE_K": 512,
        "GROUP_SIZE_M": 8,
        "num_stages": 7,
        "num_warps": 32,
        "compile_time": 2.767735004425049
    },
    {
        "BLOCK_SIZE_M": 16,
        "BLOCK_SIZE_N": 512,
        "BLOCK_SIZE_K": 512,
        "GROUP_SIZE_M": 8,
        "num_stages": 8,
        "num_warps": 2,
        "compile_time": 15.77813720703125
    },
    {
        "BLOCK_SIZE_M": 16,
        "BLOCK_SIZE_N": 512,
        "BLOCK_SIZE_K": 512,
        "GROUP_SIZE_M": 8,
        "num_stages": 8,
        "num_warps": 4,
        "compile_time": 6.7474024295806885
    },
    {
        "BLOCK_SIZE_M": 16,
        "BLOCK_SIZE_N": 512,
        "BLOCK_SIZE_K": 512,
        "GROUP_SIZE_M": 8,
        "num_stages": 8,
        "num_warps": 8,
        "compile_time": 8.082083463668823
    },
    {
        "BLOCK_SIZE_M": 16,
        "BLOCK_SIZE_N": 512,
        "BLOCK_SIZE_K": 512,
        "GROUP_SIZE_M": 8,
        "num_stages": 8,
        "num_warps": 16,
        "compile_time": 11.897791624069214
    },
    {
        "BLOCK_SIZE_M": 16,
        "BLOCK_SIZE_N": 512,
        "BLOCK_SIZE_K": 512,
        "GROUP_SIZE_M": 8,
        "num_stages": 8,
        "num_warps": 32,
        "compile_time": 2.9194765090942383
    },
    {
        "BLOCK_SIZE_M": 32,
        "BLOCK_SIZE_N": 16,
        "BLOCK_SIZE_K": 256,
        "GROUP_SIZE_M": 8,
        "num_stages": 8,
        "num_warps": 2,
        "compile_time": 1.4518918991088867
    },
    {
        "BLOCK_SIZE_M": 32,
        "BLOCK_SIZE_N": 16,
        "BLOCK_SIZE_K": 256,
        "GROUP_SIZE_M": 8,
        "num_stages": 8,
        "num_warps": 4,
        "compile_time": 0.8932881355285645
    },
    {
        "BLOCK_SIZE_M": 32,
        "BLOCK_SIZE_N": 16,
        "BLOCK_SIZE_K": 256,
        "GROUP_SIZE_M": 8,
        "num_stages": 8,
        "num_warps": 8,
        "compile_time": 0.6949450969696045
    },
    {
        "BLOCK_SIZE_M": 32,
        "BLOCK_SIZE_N": 16,
        "BLOCK_SIZE_K": 256,
        "GROUP_SIZE_M": 8,
        "num_stages": 8,
        "num_warps": 16,
        "compile_time": 0.5792930126190186
    },
    {
        "BLOCK_SIZE_M": 32,
        "BLOCK_SIZE_N": 16,
        "BLOCK_SIZE_K": 256,
        "GROUP_SIZE_M": 8,
        "num_stages": 8,
        "num_warps": 32,
        "compile_time": 0.5436618328094482
    },
    {
        "BLOCK_SIZE_M": 32,
        "BLOCK_SIZE_N": 16,
        "BLOCK_SIZE_K": 512,
        "GROUP_SIZE_M": 8,
        "num_stages": 5,
        "num_warps": 2,
        "compile_time": 2.6627821922302246
    },
    {
        "BLOCK_SIZE_M": 32,
        "BLOCK_SIZE_N": 16,
        "BLOCK_SIZE_K": 512,
        "GROUP_SIZE_M": 8,
        "num_stages": 5,
        "num_warps": 4,
        "compile_time": 1.2435812950134277
    },
    {
        "BLOCK_SIZE_M": 32,
        "BLOCK_SIZE_N": 16,
        "BLOCK_SIZE_K": 512,
        "GROUP_SIZE_M": 8,
        "num_stages": 5,
        "num_warps": 8,
        "compile_time": 0.8756415843963623
    },
    {
        "BLOCK_SIZE_M": 32,
        "BLOCK_SIZE_N": 16,
        "BLOCK_SIZE_K": 512,
        "GROUP_SIZE_M": 8,
        "num_stages": 5,
        "num_warps": 16,
        "compile_time": 0.7014825344085693
    },
    {
        "BLOCK_SIZE_M": 32,
        "BLOCK_SIZE_N": 16,
        "BLOCK_SIZE_K": 512,
        "GROUP_SIZE_M": 8,
        "num_stages": 5,
        "num_warps": 32,
        "compile_time": 0.6393027305603027
    },
    {
        "BLOCK_SIZE_M": 32,
        "BLOCK_SIZE_N": 16,
        "BLOCK_SIZE_K": 512,
        "GROUP_SIZE_M": 8,
        "num_stages": 6,
        "num_warps": 2,
        "compile_time": 2.865751266479492
    },
    {
        "BLOCK_SIZE_M": 32,
        "BLOCK_SIZE_N": 16,
        "BLOCK_SIZE_K": 512,
        "GROUP_SIZE_M": 8,
        "num_stages": 6,
        "num_warps": 4,
        "compile_time": 1.3770225048065186
    },
    {
        "BLOCK_SIZE_M": 32,
        "BLOCK_SIZE_N": 16,
        "BLOCK_SIZE_K": 512,
        "GROUP_SIZE_M": 8,
        "num_stages": 6,
        "num_warps": 8,
        "compile_time": 0.8992674350738525
    },
    {
        "BLOCK_SIZE_M": 32,
        "BLOCK_SIZE_N": 16,
        "BLOCK_SIZE_K": 512,
        "GROUP_SIZE_M": 8,
        "num_stages": 6,
        "num_warps": 16,
        "compile_time": 0.7301115989685059
    },
    {
        "BLOCK_SIZE_M": 32,
        "BLOCK_SIZE_N": 16,
        "BLOCK_SIZE_K": 512,
        "GROUP_SIZE_M": 8,
        "num_stages": 6,
        "num_warps": 32,
        "compile_time": 0.6580543518066406
    },
    {
        "BLOCK_SIZE_M": 32,
        "BLOCK_SIZE_N": 16,
        "BLOCK_SIZE_K": 512,
        "GROUP_SIZE_M": 8,
        "num_stages": 7,
        "num_warps": 2,
        "compile_time": 3.08034610748291
    },
    {
        "BLOCK_SIZE_M": 32,
        "BLOCK_SIZE_N": 16,
        "BLOCK_SIZE_K": 512,
        "GROUP_SIZE_M": 8,
        "num_stages": 7,
        "num_warps": 4,
        "compile_time": 1.4632964134216309
    },
    {
        "BLOCK_SIZE_M": 32,
        "BLOCK_SIZE_N": 16,
        "BLOCK_SIZE_K": 512,
        "GROUP_SIZE_M": 8,
        "num_stages": 7,
        "num_warps": 8,
        "compile_time": 0.9639098644256592
    },
    {
        "BLOCK_SIZE_M": 32,
        "BLOCK_SIZE_N": 16,
        "BLOCK_SIZE_K": 512,
        "GROUP_SIZE_M": 8,
        "num_stages": 7,
        "num_warps": 16,
        "compile_time": 0.7741844654083252
    },
    {
        "BLOCK_SIZE_M": 32,
        "BLOCK_SIZE_N": 16,
        "BLOCK_SIZE_K": 512,
        "GROUP_SIZE_M": 8,
        "num_stages": 7,
        "num_warps": 32,
        "compile_time": 0.660517692565918
    },
    {
        "BLOCK_SIZE_M": 32,
        "BLOCK_SIZE_N": 16,
        "BLOCK_SIZE_K": 512,
        "GROUP_SIZE_M": 8,
        "num_stages": 8,
        "num_warps": 2,
        "compile_time": 3.1734988689422607
    },
    {
        "BLOCK_SIZE_M": 32,
        "BLOCK_SIZE_N": 16,
        "BLOCK_SIZE_K": 512,
        "GROUP_SIZE_M": 8,
        "num_stages": 8,
        "num_warps": 4,
        "compile_time": 1.5479474067687988
    },
    {
        "BLOCK_SIZE_M": 32,
        "BLOCK_SIZE_N": 16,
        "BLOCK_SIZE_K": 512,
        "GROUP_SIZE_M": 8,
        "num_stages": 8,
        "num_warps": 8,
        "compile_time": 1.0222125053405762
    },
    {
        "BLOCK_SIZE_M": 32,
        "BLOCK_SIZE_N": 16,
        "BLOCK_SIZE_K": 512,
        "GROUP_SIZE_M": 8,
        "num_stages": 8,
        "num_warps": 16,
        "compile_time": 0.7769606113433838
    },
    {
        "BLOCK_SIZE_M": 32,
        "BLOCK_SIZE_N": 16,
        "BLOCK_SIZE_K": 512,
        "GROUP_SIZE_M": 8,
        "num_stages": 8,
        "num_warps": 32,
        "compile_time": 0.684485673904419
    },
    {
        "BLOCK_SIZE_M": 32,
        "BLOCK_SIZE_N": 32,
        "BLOCK_SIZE_K": 256,
        "GROUP_SIZE_M": 8,
        "num_stages": 7,
        "num_warps": 2,
        "compile_time": 1.75128173828125
    },
    {
        "BLOCK_SIZE_M": 32,
        "BLOCK_SIZE_N": 32,
        "BLOCK_SIZE_K": 256,
        "GROUP_SIZE_M": 8,
        "num_stages": 7,
        "num_warps": 4,
        "compile_time": 1.0377874374389648
    },
    {
        "BLOCK_SIZE_M": 32,
        "BLOCK_SIZE_N": 32,
        "BLOCK_SIZE_K": 256,
        "GROUP_SIZE_M": 8,
        "num_stages": 7,
        "num_warps": 8,
        "compile_time": 0.7034461498260498
    },
    {
        "BLOCK_SIZE_M": 32,
        "BLOCK_SIZE_N": 32,
        "BLOCK_SIZE_K": 256,
        "GROUP_SIZE_M": 8,
        "num_stages": 7,
        "num_warps": 16,
        "compile_time": 0.5766255855560303
    },
    {
        "BLOCK_SIZE_M": 32,
        "BLOCK_SIZE_N": 32,
        "BLOCK_SIZE_K": 256,
        "GROUP_SIZE_M": 8,
        "num_stages": 7,
        "num_warps": 32,
        "compile_time": 0.5159320831298828
    },
    {
        "BLOCK_SIZE_M": 32,
        "BLOCK_SIZE_N": 32,
        "BLOCK_SIZE_K": 256,
        "GROUP_SIZE_M": 8,
        "num_stages": 8,
        "num_warps": 2,
        "compile_time": 1.863468885421753
    },
    {
        "BLOCK_SIZE_M": 32,
        "BLOCK_SIZE_N": 32,
        "BLOCK_SIZE_K": 256,
        "GROUP_SIZE_M": 8,
        "num_stages": 8,
        "num_warps": 4,
        "compile_time": 1.0912175178527832
    },
    {
        "BLOCK_SIZE_M": 32,
        "BLOCK_SIZE_N": 32,
        "BLOCK_SIZE_K": 256,
        "GROUP_SIZE_M": 8,
        "num_stages": 8,
        "num_warps": 8,
        "compile_time": 0.7391059398651123
    },
    {
        "BLOCK_SIZE_M": 32,
        "BLOCK_SIZE_N": 32,
        "BLOCK_SIZE_K": 256,
        "GROUP_SIZE_M": 8,
        "num_stages": 8,
        "num_warps": 16,
        "compile_time": 0.6013200283050537
    },
    {
        "BLOCK_SIZE_M": 32,
        "BLOCK_SIZE_N": 32,
        "BLOCK_SIZE_K": 256,
        "GROUP_SIZE_M": 8,
        "num_stages": 8,
        "num_warps": 32,
        "compile_time": 0.524371862411499
    },
    {
        "BLOCK_SIZE_M": 32,
        "BLOCK_SIZE_N": 32,
        "BLOCK_SIZE_K": 512,
        "GROUP_SIZE_M": 8,
        "num_stages": 4,
        "num_warps": 2,
        "compile_time": 3.7138242721557617
    },
    {
        "BLOCK_SIZE_M": 32,
        "BLOCK_SIZE_N": 32,
        "BLOCK_SIZE_K": 512,
        "GROUP_SIZE_M": 8,
        "num_stages": 4,
        "num_warps": 4,
        "compile_time": 1.4764018058776855
    },
    {
        "BLOCK_SIZE_M": 32,
        "BLOCK_SIZE_N": 32,
        "BLOCK_SIZE_K": 512,
        "GROUP_SIZE_M": 8,
        "num_stages": 4,
        "num_warps": 8,
        "compile_time": 0.9119126796722412
    },
    {
        "BLOCK_SIZE_M": 32,
        "BLOCK_SIZE_N": 32,
        "BLOCK_SIZE_K": 512,
        "GROUP_SIZE_M": 8,
        "num_stages": 4,
        "num_warps": 16,
        "compile_time": 0.721459150314331
    },
    {
        "BLOCK_SIZE_M": 32,
        "BLOCK_SIZE_N": 32,
        "BLOCK_SIZE_K": 512,
        "GROUP_SIZE_M": 8,
        "num_stages": 4,
        "num_warps": 32,
        "compile_time": 0.6399800777435303
    },
    {
        "BLOCK_SIZE_M": 32,
        "BLOCK_SIZE_N": 32,
        "BLOCK_SIZE_K": 512,
        "GROUP_SIZE_M": 8,
        "num_stages": 5,
        "num_warps": 2,
        "compile_time": 3.9305992126464844
    },
    {
        "BLOCK_SIZE_M": 32,
        "BLOCK_SIZE_N": 32,
        "BLOCK_SIZE_K": 512,
        "GROUP_SIZE_M": 8,
        "num_stages": 5,
        "num_warps": 4,
        "compile_time": 1.603304147720337
    },
    {
        "BLOCK_SIZE_M": 32,
        "BLOCK_SIZE_N": 32,
        "BLOCK_SIZE_K": 512,
        "GROUP_SIZE_M": 8,
        "num_stages": 5,
        "num_warps": 8,
        "compile_time": 0.958721399307251
    },
    {
        "BLOCK_SIZE_M": 32,
        "BLOCK_SIZE_N": 32,
        "BLOCK_SIZE_K": 512,
        "GROUP_SIZE_M": 8,
        "num_stages": 5,
        "num_warps": 16,
        "compile_time": 0.7562580108642578
    },
    {
        "BLOCK_SIZE_M": 32,
        "BLOCK_SIZE_N": 32,
        "BLOCK_SIZE_K": 512,
        "GROUP_SIZE_M": 8,
        "num_stages": 5,
        "num_warps": 32,
        "compile_time": 0.6466305255889893
    },
    {
        "BLOCK_SIZE_M": 32,
        "BLOCK_SIZE_N": 32,
        "BLOCK_SIZE_K": 512,
        "GROUP_SIZE_M": 8,
        "num_stages": 6,
        "num_warps": 2,
        "compile_time": 4.143464088439941
    },
    {
        "BLOCK_SIZE_M": 32,
        "BLOCK_SIZE_N": 32,
        "BLOCK_SIZE_K": 512,
        "GROUP_SIZE_M": 8,
        "num_stages": 6,
        "num_warps": 4,
        "compile_time": 1.723757028579712
    },
    {
        "BLOCK_SIZE_M": 32,
        "BLOCK_SIZE_N": 32,
        "BLOCK_SIZE_K": 512,
        "GROUP_SIZE_M": 8,
        "num_stages": 6,
        "num_warps": 8,
        "compile_time": 1.0397913455963135
    },
    {
        "BLOCK_SIZE_M": 32,
        "BLOCK_SIZE_N": 32,
        "BLOCK_SIZE_K": 512,
        "GROUP_SIZE_M": 8,
        "num_stages": 6,
        "num_warps": 16,
        "compile_time": 0.7776176929473877
    },
    {
        "BLOCK_SIZE_M": 32,
        "BLOCK_SIZE_N": 32,
        "BLOCK_SIZE_K": 512,
        "GROUP_SIZE_M": 8,
        "num_stages": 6,
        "num_warps": 32,
        "compile_time": 0.6849606037139893
    },
    {
        "BLOCK_SIZE_M": 32,
        "BLOCK_SIZE_N": 32,
        "BLOCK_SIZE_K": 512,
        "GROUP_SIZE_M": 8,
        "num_stages": 7,
        "num_warps": 2,
        "compile_time": 4.359006643295288
    },
    {
        "BLOCK_SIZE_M": 32,
        "BLOCK_SIZE_N": 32,
        "BLOCK_SIZE_K": 512,
        "GROUP_SIZE_M": 8,
        "num_stages": 7,
        "num_warps": 4,
        "compile_time": 1.8585858345031738
    },
    {
        "BLOCK_SIZE_M": 32,
        "BLOCK_SIZE_N": 32,
        "BLOCK_SIZE_K": 512,
        "GROUP_SIZE_M": 8,
        "num_stages": 7,
        "num_warps": 8,
        "compile_time": 1.1207482814788818
    },
    {
        "BLOCK_SIZE_M": 32,
        "BLOCK_SIZE_N": 32,
        "BLOCK_SIZE_K": 512,
        "GROUP_SIZE_M": 8,
        "num_stages": 7,
        "num_warps": 16,
        "compile_time": 0.8291110992431641
    },
    {
        "BLOCK_SIZE_M": 32,
        "BLOCK_SIZE_N": 32,
        "BLOCK_SIZE_K": 512,
        "GROUP_SIZE_M": 8,
        "num_stages": 7,
        "num_warps": 32,
        "compile_time": 0.6901309490203857
    },
    {
        "BLOCK_SIZE_M": 32,
        "BLOCK_SIZE_N": 32,
        "BLOCK_SIZE_K": 512,
        "GROUP_SIZE_M": 8,
        "num_stages": 8,
        "num_warps": 2,
        "compile_time": 4.5812668800354
    },
    {
        "BLOCK_SIZE_M": 32,
        "BLOCK_SIZE_N": 32,
        "BLOCK_SIZE_K": 512,
        "GROUP_SIZE_M": 8,
        "num_stages": 8,
        "num_warps": 4,
        "compile_time": 1.9663703441619873
    },
    {
        "BLOCK_SIZE_M": 32,
        "BLOCK_SIZE_N": 32,
        "BLOCK_SIZE_K": 512,
        "GROUP_SIZE_M": 8,
        "num_stages": 8,
        "num_warps": 8,
        "compile_time": 1.219132423400879
    },
    {
        "BLOCK_SIZE_M": 32,
        "BLOCK_SIZE_N": 32,
        "BLOCK_SIZE_K": 512,
        "GROUP_SIZE_M": 8,
        "num_stages": 8,
        "num_warps": 16,
        "compile_time": 0.8635098934173584
    },
    {
        "BLOCK_SIZE_M": 32,
        "BLOCK_SIZE_N": 32,
        "BLOCK_SIZE_K": 512,
        "GROUP_SIZE_M": 8,
        "num_stages": 8,
        "num_warps": 32,
        "compile_time": 0.7145376205444336
    },
    {
        "BLOCK_SIZE_M": 32,
        "BLOCK_SIZE_N": 64,
        "BLOCK_SIZE_K": 128,
        "GROUP_SIZE_M": 8,
        "num_stages": 8,
        "num_warps": 2,
        "compile_time": 1.4652602672576904
    },
    {
        "BLOCK_SIZE_M": 32,
        "BLOCK_SIZE_N": 64,
        "BLOCK_SIZE_K": 128,
        "GROUP_SIZE_M": 8,
        "num_stages": 8,
        "num_warps": 4,
        "compile_time": 0.8876402378082275
    },
    {
        "BLOCK_SIZE_M": 32,
        "BLOCK_SIZE_N": 64,
        "BLOCK_SIZE_K": 128,
        "GROUP_SIZE_M": 8,
        "num_stages": 8,
        "num_warps": 8,
        "compile_time": 0.603478193283081
    },
    {
        "BLOCK_SIZE_M": 32,
        "BLOCK_SIZE_N": 64,
        "BLOCK_SIZE_K": 128,
        "GROUP_SIZE_M": 8,
        "num_stages": 8,
        "num_warps": 16,
        "compile_time": 0.4924941062927246
    },
    {
        "BLOCK_SIZE_M": 32,
        "BLOCK_SIZE_N": 64,
        "BLOCK_SIZE_K": 128,
        "GROUP_SIZE_M": 8,
        "num_stages": 8,
        "num_warps": 32,
        "compile_time": 0.4640624523162842
    },
    {
        "BLOCK_SIZE_M": 32,
        "BLOCK_SIZE_N": 64,
        "BLOCK_SIZE_K": 256,
        "GROUP_SIZE_M": 8,
        "num_stages": 5,
        "num_warps": 2,
        "compile_time": 2.7589571475982666
    },
    {
        "BLOCK_SIZE_M": 32,
        "BLOCK_SIZE_N": 64,
        "BLOCK_SIZE_K": 256,
        "GROUP_SIZE_M": 8,
        "num_stages": 5,
        "num_warps": 4,
        "compile_time": 1.2259845733642578
    },
    {
        "BLOCK_SIZE_M": 32,
        "BLOCK_SIZE_N": 64,
        "BLOCK_SIZE_K": 256,
        "GROUP_SIZE_M": 8,
        "num_stages": 5,
        "num_warps": 8,
        "compile_time": 0.7977275848388672
    },
    {
        "BLOCK_SIZE_M": 32,
        "BLOCK_SIZE_N": 64,
        "BLOCK_SIZE_K": 256,
        "GROUP_SIZE_M": 8,
        "num_stages": 5,
        "num_warps": 16,
        "compile_time": 0.5887010097503662
    },
    {
        "BLOCK_SIZE_M": 32,
        "BLOCK_SIZE_N": 64,
        "BLOCK_SIZE_K": 256,
        "GROUP_SIZE_M": 8,
        "num_stages": 5,
        "num_warps": 32,
        "compile_time": 0.5014276504516602
    },
    {
        "BLOCK_SIZE_M": 32,
        "BLOCK_SIZE_N": 64,
        "BLOCK_SIZE_K": 256,
        "GROUP_SIZE_M": 8,
        "num_stages": 6,
        "num_warps": 2,
        "compile_time": 2.830714702606201
    },
    {
        "BLOCK_SIZE_M": 32,
        "BLOCK_SIZE_N": 64,
        "BLOCK_SIZE_K": 256,
        "GROUP_SIZE_M": 8,
        "num_stages": 6,
        "num_warps": 4,
        "compile_time": 1.3268110752105713
    },
    {
        "BLOCK_SIZE_M": 32,
        "BLOCK_SIZE_N": 64,
        "BLOCK_SIZE_K": 256,
        "GROUP_SIZE_M": 8,
        "num_stages": 6,
        "num_warps": 8,
        "compile_time": 0.8586618900299072
    },
    {
        "BLOCK_SIZE_M": 32,
        "BLOCK_SIZE_N": 64,
        "BLOCK_SIZE_K": 256,
        "GROUP_SIZE_M": 8,
        "num_stages": 6,
        "num_warps": 16,
        "compile_time": 0.6190719604492188
    },
    {
        "BLOCK_SIZE_M": 32,
        "BLOCK_SIZE_N": 64,
        "BLOCK_SIZE_K": 256,
        "GROUP_SIZE_M": 8,
        "num_stages": 6,
        "num_warps": 32,
        "compile_time": 0.5209779739379883
    },
    {
        "BLOCK_SIZE_M": 32,
        "BLOCK_SIZE_N": 64,
        "BLOCK_SIZE_K": 256,
        "GROUP_SIZE_M": 8,
        "num_stages": 7,
        "num_warps": 2,
        "compile_time": 3.0456464290618896
    },
    {
        "BLOCK_SIZE_M": 32,
        "BLOCK_SIZE_N": 64,
        "BLOCK_SIZE_K": 256,
        "GROUP_SIZE_M": 8,
        "num_stages": 7,
        "num_warps": 4,
        "compile_time": 1.4420464038848877
    },
    {
        "BLOCK_SIZE_M": 32,
        "BLOCK_SIZE_N": 64,
        "BLOCK_SIZE_K": 256,
        "GROUP_SIZE_M": 8,
        "num_stages": 7,
        "num_warps": 8,
        "compile_time": 0.8909013271331787
    },
    {
        "BLOCK_SIZE_M": 32,
        "BLOCK_SIZE_N": 64,
        "BLOCK_SIZE_K": 256,
        "GROUP_SIZE_M": 8,
        "num_stages": 7,
        "num_warps": 16,
        "compile_time": 0.6482081413269043
    },
    {
        "BLOCK_SIZE_M": 32,
        "BLOCK_SIZE_N": 64,
        "BLOCK_SIZE_K": 256,
        "GROUP_SIZE_M": 8,
        "num_stages": 7,
        "num_warps": 32,
        "compile_time": 0.5511164665222168
    },
    {
        "BLOCK_SIZE_M": 32,
        "BLOCK_SIZE_N": 64,
        "BLOCK_SIZE_K": 256,
        "GROUP_SIZE_M": 8,
        "num_stages": 8,
        "num_warps": 2,
        "compile_time": 3.1904923915863037
    },
    {
        "BLOCK_SIZE_M": 32,
        "BLOCK_SIZE_N": 64,
        "BLOCK_SIZE_K": 256,
        "GROUP_SIZE_M": 8,
        "num_stages": 8,
        "num_warps": 4,
        "compile_time": 1.5298640727996826
    },
    {
        "BLOCK_SIZE_M": 32,
        "BLOCK_SIZE_N": 64,
        "BLOCK_SIZE_K": 256,
        "GROUP_SIZE_M": 8,
        "num_stages": 8,
        "num_warps": 8,
        "compile_time": 0.9549562931060791
    },
    {
        "BLOCK_SIZE_M": 32,
        "BLOCK_SIZE_N": 64,
        "BLOCK_SIZE_K": 256,
        "GROUP_SIZE_M": 8,
        "num_stages": 8,
        "num_warps": 16,
        "compile_time": 0.6819839477539062
    },
    {
        "BLOCK_SIZE_M": 32,
        "BLOCK_SIZE_N": 64,
        "BLOCK_SIZE_K": 256,
        "GROUP_SIZE_M": 8,
        "num_stages": 8,
        "num_warps": 32,
        "compile_time": 0.5625944137573242
    },
    {
        "BLOCK_SIZE_M": 32,
        "BLOCK_SIZE_N": 64,
        "BLOCK_SIZE_K": 512,
        "GROUP_SIZE_M": 8,
        "num_stages": 3,
        "num_warps": 2,
        "compile_time": 12.629189014434814
    },
    {
        "BLOCK_SIZE_M": 32,
        "BLOCK_SIZE_N": 64,
        "BLOCK_SIZE_K": 512,
        "GROUP_SIZE_M": 8,
        "num_stages": 3,
        "num_warps": 4,
        "compile_time": 2.435983180999756
    },
    {
        "BLOCK_SIZE_M": 32,
        "BLOCK_SIZE_N": 64,
        "BLOCK_SIZE_K": 512,
        "GROUP_SIZE_M": 8,
        "num_stages": 3,
        "num_warps": 8,
        "compile_time": 1.1342082023620605
    },
    {
        "BLOCK_SIZE_M": 32,
        "BLOCK_SIZE_N": 64,
        "BLOCK_SIZE_K": 512,
        "GROUP_SIZE_M": 8,
        "num_stages": 3,
        "num_warps": 16,
        "compile_time": 0.7663898468017578
    },
    {
        "BLOCK_SIZE_M": 32,
        "BLOCK_SIZE_N": 64,
        "BLOCK_SIZE_K": 512,
        "GROUP_SIZE_M": 8,
        "num_stages": 3,
        "num_warps": 32,
        "compile_time": 0.6327321529388428
    },
    {
        "BLOCK_SIZE_M": 32,
        "BLOCK_SIZE_N": 64,
        "BLOCK_SIZE_K": 512,
        "GROUP_SIZE_M": 8,
        "num_stages": 4,
        "num_warps": 2,
        "compile_time": 12.686580657958984
    },
    {
        "BLOCK_SIZE_M": 32,
        "BLOCK_SIZE_N": 64,
        "BLOCK_SIZE_K": 512,
        "GROUP_SIZE_M": 8,
        "num_stages": 4,
        "num_warps": 4,
        "compile_time": 2.61928391456604
    },
    {
        "BLOCK_SIZE_M": 32,
        "BLOCK_SIZE_N": 64,
        "BLOCK_SIZE_K": 512,
        "GROUP_SIZE_M": 8,
        "num_stages": 4,
        "num_warps": 8,
        "compile_time": 1.2167079448699951
    },
    {
        "BLOCK_SIZE_M": 32,
        "BLOCK_SIZE_N": 64,
        "BLOCK_SIZE_K": 512,
        "GROUP_SIZE_M": 8,
        "num_stages": 4,
        "num_warps": 16,
        "compile_time": 0.8216369152069092
    },
    {
        "BLOCK_SIZE_M": 32,
        "BLOCK_SIZE_N": 64,
        "BLOCK_SIZE_K": 512,
        "GROUP_SIZE_M": 8,
        "num_stages": 4,
        "num_warps": 32,
        "compile_time": 0.6867144107818604
    },
    {
        "BLOCK_SIZE_M": 32,
        "BLOCK_SIZE_N": 64,
        "BLOCK_SIZE_K": 512,
        "GROUP_SIZE_M": 8,
        "num_stages": 5,
        "num_warps": 2,
        "compile_time": 13.040367364883423
    },
    {
        "BLOCK_SIZE_M": 32,
        "BLOCK_SIZE_N": 64,
        "BLOCK_SIZE_K": 512,
        "GROUP_SIZE_M": 8,
        "num_stages": 5,
        "num_warps": 4,
        "compile_time": 2.8241405487060547
    },
    {
        "BLOCK_SIZE_M": 32,
        "BLOCK_SIZE_N": 64,
        "BLOCK_SIZE_K": 512,
        "GROUP_SIZE_M": 8,
        "num_stages": 5,
        "num_warps": 8,
        "compile_time": 1.3432514667510986
    },
    {
        "BLOCK_SIZE_M": 32,
        "BLOCK_SIZE_N": 64,
        "BLOCK_SIZE_K": 512,
        "GROUP_SIZE_M": 8,
        "num_stages": 5,
        "num_warps": 16,
        "compile_time": 0.8832952976226807
    },
    {
        "BLOCK_SIZE_M": 32,
        "BLOCK_SIZE_N": 64,
        "BLOCK_SIZE_K": 512,
        "GROUP_SIZE_M": 8,
        "num_stages": 5,
        "num_warps": 32,
        "compile_time": 0.7096173763275146
    },
    {
        "BLOCK_SIZE_M": 32,
        "BLOCK_SIZE_N": 64,
        "BLOCK_SIZE_K": 512,
        "GROUP_SIZE_M": 8,
        "num_stages": 6,
        "num_warps": 2,
        "compile_time": 13.287808418273926
    },
    {
        "BLOCK_SIZE_M": 32,
        "BLOCK_SIZE_N": 64,
        "BLOCK_SIZE_K": 512,
        "GROUP_SIZE_M": 8,
        "num_stages": 6,
        "num_warps": 4,
        "compile_time": 2.956636667251587
    },
    {
        "BLOCK_SIZE_M": 32,
        "BLOCK_SIZE_N": 64,
        "BLOCK_SIZE_K": 512,
        "GROUP_SIZE_M": 8,
        "num_stages": 6,
        "num_warps": 8,
        "compile_time": 1.4297051429748535
    },
    {
        "BLOCK_SIZE_M": 32,
        "BLOCK_SIZE_N": 64,
        "BLOCK_SIZE_K": 512,
        "GROUP_SIZE_M": 8,
        "num_stages": 6,
        "num_warps": 16,
        "compile_time": 0.9283230304718018
    },
    {
        "BLOCK_SIZE_M": 32,
        "BLOCK_SIZE_N": 64,
        "BLOCK_SIZE_K": 512,
        "GROUP_SIZE_M": 8,
        "num_stages": 6,
        "num_warps": 32,
        "compile_time": 0.7486271858215332
    },
    {
        "BLOCK_SIZE_M": 32,
        "BLOCK_SIZE_N": 64,
        "BLOCK_SIZE_K": 512,
        "GROUP_SIZE_M": 8,
        "num_stages": 7,
        "num_warps": 2,
        "compile_time": 13.564039707183838
    },
    {
        "BLOCK_SIZE_M": 32,
        "BLOCK_SIZE_N": 64,
        "BLOCK_SIZE_K": 512,
        "GROUP_SIZE_M": 8,
        "num_stages": 7,
        "num_warps": 4,
        "compile_time": 3.146552562713623
    },
    {
        "BLOCK_SIZE_M": 32,
        "BLOCK_SIZE_N": 64,
        "BLOCK_SIZE_K": 512,
        "GROUP_SIZE_M": 8,
        "num_stages": 7,
        "num_warps": 8,
        "compile_time": 1.5886588096618652
    },
    {
        "BLOCK_SIZE_M": 32,
        "BLOCK_SIZE_N": 64,
        "BLOCK_SIZE_K": 512,
        "GROUP_SIZE_M": 8,
        "num_stages": 7,
        "num_warps": 16,
        "compile_time": 0.9989781379699707
    },
    {
        "BLOCK_SIZE_M": 32,
        "BLOCK_SIZE_N": 64,
        "BLOCK_SIZE_K": 512,
        "GROUP_SIZE_M": 8,
        "num_stages": 7,
        "num_warps": 32,
        "compile_time": 0.776181697845459
    },
    {
        "BLOCK_SIZE_M": 32,
        "BLOCK_SIZE_N": 64,
        "BLOCK_SIZE_K": 512,
        "GROUP_SIZE_M": 8,
        "num_stages": 8,
        "num_warps": 2,
        "compile_time": 13.60816216468811
    },
    {
        "BLOCK_SIZE_M": 32,
        "BLOCK_SIZE_N": 64,
        "BLOCK_SIZE_K": 512,
        "GROUP_SIZE_M": 8,
        "num_stages": 8,
        "num_warps": 4,
        "compile_time": 3.3281090259552
    },
    {
        "BLOCK_SIZE_M": 32,
        "BLOCK_SIZE_N": 64,
        "BLOCK_SIZE_K": 512,
        "GROUP_SIZE_M": 8,
        "num_stages": 8,
        "num_warps": 8,
        "compile_time": 1.6587955951690674
    },
    {
        "BLOCK_SIZE_M": 32,
        "BLOCK_SIZE_N": 64,
        "BLOCK_SIZE_K": 512,
        "GROUP_SIZE_M": 8,
        "num_stages": 8,
        "num_warps": 16,
        "compile_time": 1.071453332901001
    },
    {
        "BLOCK_SIZE_M": 32,
        "BLOCK_SIZE_N": 64,
        "BLOCK_SIZE_K": 512,
        "GROUP_SIZE_M": 8,
        "num_stages": 8,
        "num_warps": 32,
        "compile_time": 0.8050515651702881
    },
    {
        "BLOCK_SIZE_M": 32,
        "BLOCK_SIZE_N": 128,
        "BLOCK_SIZE_K": 128,
        "GROUP_SIZE_M": 8,
        "num_stages": 6,
        "num_warps": 2,
        "compile_time": 2.5425078868865967
    },
    {
        "BLOCK_SIZE_M": 32,
        "BLOCK_SIZE_N": 128,
        "BLOCK_SIZE_K": 128,
        "GROUP_SIZE_M": 8,
        "num_stages": 6,
        "num_warps": 4,
        "compile_time": 1.187086582183838
    },
    {
        "BLOCK_SIZE_M": 32,
        "BLOCK_SIZE_N": 128,
        "BLOCK_SIZE_K": 128,
        "GROUP_SIZE_M": 8,
        "num_stages": 6,
        "num_warps": 8,
        "compile_time": 0.7757859230041504
    },
    {
        "BLOCK_SIZE_M": 32,
        "BLOCK_SIZE_N": 128,
        "BLOCK_SIZE_K": 128,
        "GROUP_SIZE_M": 8,
        "num_stages": 6,
        "num_warps": 16,
        "compile_time": 0.561997652053833
    },
    {
        "BLOCK_SIZE_M": 32,
        "BLOCK_SIZE_N": 128,
        "BLOCK_SIZE_K": 128,
        "GROUP_SIZE_M": 8,
        "num_stages": 6,
        "num_warps": 32,
        "compile_time": 0.4627110958099365
    },
    {
        "BLOCK_SIZE_M": 32,
        "BLOCK_SIZE_N": 128,
        "BLOCK_SIZE_K": 128,
        "GROUP_SIZE_M": 8,
        "num_stages": 7,
        "num_warps": 2,
        "compile_time": 2.6898884773254395
    },
    {
        "BLOCK_SIZE_M": 32,
        "BLOCK_SIZE_N": 128,
        "BLOCK_SIZE_K": 128,
        "GROUP_SIZE_M": 8,
        "num_stages": 7,
        "num_warps": 4,
        "compile_time": 1.2701361179351807
    },
    {
        "BLOCK_SIZE_M": 32,
        "BLOCK_SIZE_N": 128,
        "BLOCK_SIZE_K": 128,
        "GROUP_SIZE_M": 8,
        "num_stages": 7,
        "num_warps": 8,
        "compile_time": 0.8129632472991943
    },
    {
        "BLOCK_SIZE_M": 32,
        "BLOCK_SIZE_N": 128,
        "BLOCK_SIZE_K": 128,
        "GROUP_SIZE_M": 8,
        "num_stages": 7,
        "num_warps": 16,
        "compile_time": 0.580155611038208
    },
    {
        "BLOCK_SIZE_M": 32,
        "BLOCK_SIZE_N": 128,
        "BLOCK_SIZE_K": 128,
        "GROUP_SIZE_M": 8,
        "num_stages": 7,
        "num_warps": 32,
        "compile_time": 0.4906277656555176
    },
    {
        "BLOCK_SIZE_M": 32,
        "BLOCK_SIZE_N": 128,
        "BLOCK_SIZE_K": 128,
        "GROUP_SIZE_M": 8,
        "num_stages": 8,
        "num_warps": 2,
        "compile_time": 2.895277500152588
    },
    {
        "BLOCK_SIZE_M": 32,
        "BLOCK_SIZE_N": 128,
        "BLOCK_SIZE_K": 128,
        "GROUP_SIZE_M": 8,
        "num_stages": 8,
        "num_warps": 4,
        "compile_time": 1.3869764804840088
    },
    {
        "BLOCK_SIZE_M": 32,
        "BLOCK_SIZE_N": 128,
        "BLOCK_SIZE_K": 128,
        "GROUP_SIZE_M": 8,
        "num_stages": 8,
        "num_warps": 8,
        "compile_time": 0.8604094982147217
    },
    {
        "BLOCK_SIZE_M": 32,
        "BLOCK_SIZE_N": 128,
        "BLOCK_SIZE_K": 128,
        "GROUP_SIZE_M": 8,
        "num_stages": 8,
        "num_warps": 16,
        "compile_time": 0.6074824333190918
    },
    {
        "BLOCK_SIZE_M": 32,
        "BLOCK_SIZE_N": 128,
        "BLOCK_SIZE_K": 128,
        "GROUP_SIZE_M": 8,
        "num_stages": 8,
        "num_warps": 32,
        "compile_time": 0.5025265216827393
    },
    {
        "BLOCK_SIZE_M": 32,
        "BLOCK_SIZE_N": 128,
        "BLOCK_SIZE_K": 256,
        "GROUP_SIZE_M": 8,
        "num_stages": 3,
        "num_warps": 2,
        "compile_time": 11.070020198822021
    },
    {
        "BLOCK_SIZE_M": 32,
        "BLOCK_SIZE_N": 128,
        "BLOCK_SIZE_K": 256,
        "GROUP_SIZE_M": 8,
        "num_stages": 4,
        "num_warps": 2,
        "compile_time": 11.225308656692505
    },
    {
        "BLOCK_SIZE_M": 32,
        "BLOCK_SIZE_N": 128,
        "BLOCK_SIZE_K": 256,
        "GROUP_SIZE_M": 8,
        "num_stages": 4,
        "num_warps": 4,
        "compile_time": 2.2357234954833984
    },
    {
        "BLOCK_SIZE_M": 32,
        "BLOCK_SIZE_N": 128,
        "BLOCK_SIZE_K": 256,
        "GROUP_SIZE_M": 8,
        "num_stages": 4,
        "num_warps": 8,
        "compile_time": 1.085895299911499
    },
    {
        "BLOCK_SIZE_M": 32,
        "BLOCK_SIZE_N": 128,
        "BLOCK_SIZE_K": 256,
        "GROUP_SIZE_M": 8,
        "num_stages": 4,
        "num_warps": 16,
        "compile_time": 0.7300686836242676
    },
    {
        "BLOCK_SIZE_M": 32,
        "BLOCK_SIZE_N": 128,
        "BLOCK_SIZE_K": 256,
        "GROUP_SIZE_M": 8,
        "num_stages": 4,
        "num_warps": 32,
        "compile_time": 0.5650386810302734
    },
    {
        "BLOCK_SIZE_M": 32,
        "BLOCK_SIZE_N": 128,
        "BLOCK_SIZE_K": 256,
        "GROUP_SIZE_M": 8,
        "num_stages": 5,
        "num_warps": 2,
        "compile_time": 11.44789981842041
    },
    {
        "BLOCK_SIZE_M": 32,
        "BLOCK_SIZE_N": 128,
        "BLOCK_SIZE_K": 256,
        "GROUP_SIZE_M": 8,
        "num_stages": 5,
        "num_warps": 4,
        "compile_time": 2.419264554977417
    },
    {
        "BLOCK_SIZE_M": 32,
        "BLOCK_SIZE_N": 128,
        "BLOCK_SIZE_K": 256,
        "GROUP_SIZE_M": 8,
        "num_stages": 5,
        "num_warps": 8,
        "compile_time": 1.206446886062622
    },
    {
        "BLOCK_SIZE_M": 32,
        "BLOCK_SIZE_N": 128,
        "BLOCK_SIZE_K": 256,
        "GROUP_SIZE_M": 8,
        "num_stages": 5,
        "num_warps": 16,
        "compile_time": 0.799389123916626
    },
    {
        "BLOCK_SIZE_M": 32,
        "BLOCK_SIZE_N": 128,
        "BLOCK_SIZE_K": 256,
        "GROUP_SIZE_M": 8,
        "num_stages": 5,
        "num_warps": 32,
        "compile_time": 0.5860404968261719
    },
    {
        "BLOCK_SIZE_M": 32,
        "BLOCK_SIZE_N": 128,
        "BLOCK_SIZE_K": 256,
        "GROUP_SIZE_M": 8,
        "num_stages": 6,
        "num_warps": 2,
        "compile_time": 11.599857568740845
    },
    {
        "BLOCK_SIZE_M": 32,
        "BLOCK_SIZE_N": 128,
        "BLOCK_SIZE_K": 256,
        "GROUP_SIZE_M": 8,
        "num_stages": 6,
        "num_warps": 4,
        "compile_time": 2.5468528270721436
    },
    {
        "BLOCK_SIZE_M": 32,
        "BLOCK_SIZE_N": 128,
        "BLOCK_SIZE_K": 256,
        "GROUP_SIZE_M": 8,
        "num_stages": 6,
        "num_warps": 8,
        "compile_time": 1.2757823467254639
    },
    {
        "BLOCK_SIZE_M": 32,
        "BLOCK_SIZE_N": 128,
        "BLOCK_SIZE_K": 256,
        "GROUP_SIZE_M": 8,
        "num_stages": 6,
        "num_warps": 16,
        "compile_time": 0.8232114315032959
    },
    {
        "BLOCK_SIZE_M": 32,
        "BLOCK_SIZE_N": 128,
        "BLOCK_SIZE_K": 256,
        "GROUP_SIZE_M": 8,
        "num_stages": 6,
        "num_warps": 32,
        "compile_time": 0.6123855113983154
    },
    {
        "BLOCK_SIZE_M": 32,
        "BLOCK_SIZE_N": 128,
        "BLOCK_SIZE_K": 256,
        "GROUP_SIZE_M": 8,
        "num_stages": 7,
        "num_warps": 2,
        "compile_time": 11.79068660736084
    },
    {
        "BLOCK_SIZE_M": 32,
        "BLOCK_SIZE_N": 128,
        "BLOCK_SIZE_K": 256,
        "GROUP_SIZE_M": 8,
        "num_stages": 7,
        "num_warps": 4,
        "compile_time": 2.671502113342285
    },
    {
        "BLOCK_SIZE_M": 32,
        "BLOCK_SIZE_N": 128,
        "BLOCK_SIZE_K": 256,
        "GROUP_SIZE_M": 8,
        "num_stages": 7,
        "num_warps": 8,
        "compile_time": 1.3678154945373535
    },
    {
        "BLOCK_SIZE_M": 32,
        "BLOCK_SIZE_N": 128,
        "BLOCK_SIZE_K": 256,
        "GROUP_SIZE_M": 8,
        "num_stages": 7,
        "num_warps": 16,
        "compile_time": 0.8864390850067139
    },
    {
        "BLOCK_SIZE_M": 32,
        "BLOCK_SIZE_N": 128,
        "BLOCK_SIZE_K": 256,
        "GROUP_SIZE_M": 8,
        "num_stages": 7,
        "num_warps": 32,
        "compile_time": 0.63857102394104
    },
    {
        "BLOCK_SIZE_M": 32,
        "BLOCK_SIZE_N": 128,
        "BLOCK_SIZE_K": 256,
        "GROUP_SIZE_M": 8,
        "num_stages": 8,
        "num_warps": 2,
        "compile_time": 11.799391746520996
    },
    {
        "BLOCK_SIZE_M": 32,
        "BLOCK_SIZE_N": 128,
        "BLOCK_SIZE_K": 256,
        "GROUP_SIZE_M": 8,
        "num_stages": 8,
        "num_warps": 4,
        "compile_time": 2.8695836067199707
    },
    {
        "BLOCK_SIZE_M": 32,
        "BLOCK_SIZE_N": 128,
        "BLOCK_SIZE_K": 256,
        "GROUP_SIZE_M": 8,
        "num_stages": 8,
        "num_warps": 8,
        "compile_time": 1.5102648735046387
    },
    {
        "BLOCK_SIZE_M": 32,
        "BLOCK_SIZE_N": 128,
        "BLOCK_SIZE_K": 256,
        "GROUP_SIZE_M": 8,
        "num_stages": 8,
        "num_warps": 16,
        "compile_time": 0.933375358581543
    },
    {
        "BLOCK_SIZE_M": 32,
        "BLOCK_SIZE_N": 128,
        "BLOCK_SIZE_K": 256,
        "GROUP_SIZE_M": 8,
        "num_stages": 8,
        "num_warps": 32,
        "compile_time": 0.6802997589111328
    },
    {
        "BLOCK_SIZE_M": 32,
        "BLOCK_SIZE_N": 128,
        "BLOCK_SIZE_K": 512,
        "GROUP_SIZE_M": 8,
        "num_stages": 1,
        "num_warps": 2,
        "compile_time": 8.454978227615356
    },
    {
        "BLOCK_SIZE_M": 32,
        "BLOCK_SIZE_N": 128,
        "BLOCK_SIZE_K": 512,
        "GROUP_SIZE_M": 8,
        "num_stages": 2,
        "num_warps": 2,
        "compile_time": 6.014770984649658
    },
    {
        "BLOCK_SIZE_M": 32,
        "BLOCK_SIZE_N": 128,
        "BLOCK_SIZE_K": 512,
        "GROUP_SIZE_M": 8,
        "num_stages": 3,
        "num_warps": 2,
        "compile_time": 6.296144485473633
    },
    {
        "BLOCK_SIZE_M": 32,
        "BLOCK_SIZE_N": 128,
        "BLOCK_SIZE_K": 512,
        "GROUP_SIZE_M": 8,
        "num_stages": 3,
        "num_warps": 4,
        "compile_time": 10.8508460521698
    },
    {
        "BLOCK_SIZE_M": 32,
        "BLOCK_SIZE_N": 128,
        "BLOCK_SIZE_K": 512,
        "GROUP_SIZE_M": 8,
        "num_stages": 3,
        "num_warps": 8,
        "compile_time": 2.190030097961426
    },
    {
        "BLOCK_SIZE_M": 32,
        "BLOCK_SIZE_N": 128,
        "BLOCK_SIZE_K": 512,
        "GROUP_SIZE_M": 8,
        "num_stages": 3,
        "num_warps": 16,
        "compile_time": 1.1101572513580322
    },
    {
        "BLOCK_SIZE_M": 32,
        "BLOCK_SIZE_N": 128,
        "BLOCK_SIZE_K": 512,
        "GROUP_SIZE_M": 8,
        "num_stages": 3,
        "num_warps": 32,
        "compile_time": 0.7649157047271729
    },
    {
        "BLOCK_SIZE_M": 32,
        "BLOCK_SIZE_N": 128,
        "BLOCK_SIZE_K": 512,
        "GROUP_SIZE_M": 8,
        "num_stages": 4,
        "num_warps": 2,
        "compile_time": 6.747311353683472
    },
    {
        "BLOCK_SIZE_M": 32,
        "BLOCK_SIZE_N": 128,
        "BLOCK_SIZE_K": 512,
        "GROUP_SIZE_M": 8,
        "num_stages": 4,
        "num_warps": 4,
        "compile_time": 11.222324132919312
    },
    {
        "BLOCK_SIZE_M": 32,
        "BLOCK_SIZE_N": 128,
        "BLOCK_SIZE_K": 512,
        "GROUP_SIZE_M": 8,
        "num_stages": 4,
        "num_warps": 8,
        "compile_time": 2.344663381576538
    },
    {
        "BLOCK_SIZE_M": 32,
        "BLOCK_SIZE_N": 128,
        "BLOCK_SIZE_K": 512,
        "GROUP_SIZE_M": 8,
        "num_stages": 4,
        "num_warps": 16,
        "compile_time": 1.1921343803405762
    },
    {
        "BLOCK_SIZE_M": 32,
        "BLOCK_SIZE_N": 128,
        "BLOCK_SIZE_K": 512,
        "GROUP_SIZE_M": 8,
        "num_stages": 4,
        "num_warps": 32,
        "compile_time": 0.8064444065093994
    },
    {
        "BLOCK_SIZE_M": 32,
        "BLOCK_SIZE_N": 128,
        "BLOCK_SIZE_K": 512,
        "GROUP_SIZE_M": 8,
        "num_stages": 5,
        "num_warps": 2,
        "compile_time": 7.143150806427002
    },
    {
        "BLOCK_SIZE_M": 32,
        "BLOCK_SIZE_N": 128,
        "BLOCK_SIZE_K": 512,
        "GROUP_SIZE_M": 8,
        "num_stages": 5,
        "num_warps": 4,
        "compile_time": 11.161220073699951
    },
    {
        "BLOCK_SIZE_M": 32,
        "BLOCK_SIZE_N": 128,
        "BLOCK_SIZE_K": 512,
        "GROUP_SIZE_M": 8,
        "num_stages": 5,
        "num_warps": 8,
        "compile_time": 2.5363266468048096
    },
    {
        "BLOCK_SIZE_M": 32,
        "BLOCK_SIZE_N": 128,
        "BLOCK_SIZE_K": 512,
        "GROUP_SIZE_M": 8,
        "num_stages": 5,
        "num_warps": 16,
        "compile_time": 1.2915148735046387
    },
    {
        "BLOCK_SIZE_M": 32,
        "BLOCK_SIZE_N": 128,
        "BLOCK_SIZE_K": 512,
        "GROUP_SIZE_M": 8,
        "num_stages": 5,
        "num_warps": 32,
        "compile_time": 0.8598012924194336
    },
    {
        "BLOCK_SIZE_M": 32,
        "BLOCK_SIZE_N": 128,
        "BLOCK_SIZE_K": 512,
        "GROUP_SIZE_M": 8,
        "num_stages": 6,
        "num_warps": 2,
        "compile_time": 7.5566794872283936
    },
    {
        "BLOCK_SIZE_M": 32,
        "BLOCK_SIZE_N": 128,
        "BLOCK_SIZE_K": 512,
        "GROUP_SIZE_M": 8,
        "num_stages": 6,
        "num_warps": 4,
        "compile_time": 11.68382215499878
    },
    {
        "BLOCK_SIZE_M": 32,
        "BLOCK_SIZE_N": 128,
        "BLOCK_SIZE_K": 512,
        "GROUP_SIZE_M": 8,
        "num_stages": 6,
        "num_warps": 8,
        "compile_time": 2.6841483116149902
    },
    {
        "BLOCK_SIZE_M": 32,
        "BLOCK_SIZE_N": 128,
        "BLOCK_SIZE_K": 512,
        "GROUP_SIZE_M": 8,
        "num_stages": 6,
        "num_warps": 16,
        "compile_time": 1.402156114578247
    },
    {
        "BLOCK_SIZE_M": 32,
        "BLOCK_SIZE_N": 128,
        "BLOCK_SIZE_K": 512,
        "GROUP_SIZE_M": 8,
        "num_stages": 6,
        "num_warps": 32,
        "compile_time": 0.9350559711456299
    },
    {
        "BLOCK_SIZE_M": 32,
        "BLOCK_SIZE_N": 128,
        "BLOCK_SIZE_K": 512,
        "GROUP_SIZE_M": 8,
        "num_stages": 7,
        "num_warps": 2,
        "compile_time": 7.884198427200317
    },
    {
        "BLOCK_SIZE_M": 32,
        "BLOCK_SIZE_N": 128,
        "BLOCK_SIZE_K": 512,
        "GROUP_SIZE_M": 8,
        "num_stages": 7,
        "num_warps": 4,
        "compile_time": 11.922934770584106
    },
    {
        "BLOCK_SIZE_M": 32,
        "BLOCK_SIZE_N": 128,
        "BLOCK_SIZE_K": 512,
        "GROUP_SIZE_M": 8,
        "num_stages": 7,
        "num_warps": 8,
        "compile_time": 2.879564046859741
    },
    {
        "BLOCK_SIZE_M": 32,
        "BLOCK_SIZE_N": 128,
        "BLOCK_SIZE_K": 512,
        "GROUP_SIZE_M": 8,
        "num_stages": 7,
        "num_warps": 16,
        "compile_time": 0.005442380905151367
    },
    {
        "BLOCK_SIZE_M": 32,
        "BLOCK_SIZE_N": 128,
        "BLOCK_SIZE_K": 512,
        "GROUP_SIZE_M": 8,
        "num_stages": 7,
        "num_warps": 32,
        "compile_time": 0.9608521461486816
    },
    {
        "BLOCK_SIZE_M": 32,
        "BLOCK_SIZE_N": 128,
        "BLOCK_SIZE_K": 512,
        "GROUP_SIZE_M": 8,
        "num_stages": 8,
        "num_warps": 2,
        "compile_time": 8.430826425552368
    },
    {
        "BLOCK_SIZE_M": 32,
        "BLOCK_SIZE_N": 128,
        "BLOCK_SIZE_K": 512,
        "GROUP_SIZE_M": 8,
        "num_stages": 8,
        "num_warps": 4,
        "compile_time": 12.19933009147644
    },
    {
        "BLOCK_SIZE_M": 32,
        "BLOCK_SIZE_N": 128,
        "BLOCK_SIZE_K": 512,
        "GROUP_SIZE_M": 8,
        "num_stages": 8,
        "num_warps": 8,
        "compile_time": 3.0337464809417725
    },
    {
        "BLOCK_SIZE_M": 32,
        "BLOCK_SIZE_N": 128,
        "BLOCK_SIZE_K": 512,
        "GROUP_SIZE_M": 8,
        "num_stages": 8,
        "num_warps": 16,
        "compile_time": 1.6382977962493896
    },
    {
        "BLOCK_SIZE_M": 32,
        "BLOCK_SIZE_N": 128,
        "BLOCK_SIZE_K": 512,
        "GROUP_SIZE_M": 8,
        "num_stages": 8,
        "num_warps": 32,
        "compile_time": 1.0206496715545654
    },
    {
        "BLOCK_SIZE_M": 32,
        "BLOCK_SIZE_N": 256,
        "BLOCK_SIZE_K": 64,
        "GROUP_SIZE_M": 8,
        "num_stages": 6,
        "num_warps": 2,
        "compile_time": 2.816481828689575
    },
    {
        "BLOCK_SIZE_M": 32,
        "BLOCK_SIZE_N": 256,
        "BLOCK_SIZE_K": 64,
        "GROUP_SIZE_M": 8,
        "num_stages": 6,
        "num_warps": 4,
        "compile_time": 1.2192578315734863
    },
    {
        "BLOCK_SIZE_M": 32,
        "BLOCK_SIZE_N": 256,
        "BLOCK_SIZE_K": 64,
        "GROUP_SIZE_M": 8,
        "num_stages": 6,
        "num_warps": 8,
        "compile_time": 0.7698111534118652
    },
    {
        "BLOCK_SIZE_M": 32,
        "BLOCK_SIZE_N": 256,
        "BLOCK_SIZE_K": 64,
        "GROUP_SIZE_M": 8,
        "num_stages": 6,
        "num_warps": 16,
        "compile_time": 0.5631103515625
    },
    {
        "BLOCK_SIZE_M": 32,
        "BLOCK_SIZE_N": 256,
        "BLOCK_SIZE_K": 64,
        "GROUP_SIZE_M": 8,
        "num_stages": 6,
        "num_warps": 32,
        "compile_time": 0.471935510635376
    },
    {
        "BLOCK_SIZE_M": 32,
        "BLOCK_SIZE_N": 256,
        "BLOCK_SIZE_K": 64,
        "GROUP_SIZE_M": 8,
        "num_stages": 7,
        "num_warps": 2,
        "compile_time": 2.9256863594055176
    },
    {
        "BLOCK_SIZE_M": 32,
        "BLOCK_SIZE_N": 256,
        "BLOCK_SIZE_K": 64,
        "GROUP_SIZE_M": 8,
        "num_stages": 7,
        "num_warps": 4,
        "compile_time": 1.3028922080993652
    },
    {
        "BLOCK_SIZE_M": 32,
        "BLOCK_SIZE_N": 256,
        "BLOCK_SIZE_K": 64,
        "GROUP_SIZE_M": 8,
        "num_stages": 7,
        "num_warps": 8,
        "compile_time": 0.8138084411621094
    },
    {
        "BLOCK_SIZE_M": 32,
        "BLOCK_SIZE_N": 256,
        "BLOCK_SIZE_K": 64,
        "GROUP_SIZE_M": 8,
        "num_stages": 7,
        "num_warps": 16,
        "compile_time": 0.5891308784484863
    },
    {
        "BLOCK_SIZE_M": 32,
        "BLOCK_SIZE_N": 256,
        "BLOCK_SIZE_K": 64,
        "GROUP_SIZE_M": 8,
        "num_stages": 7,
        "num_warps": 32,
        "compile_time": 0.4817330837249756
    },
    {
        "BLOCK_SIZE_M": 32,
        "BLOCK_SIZE_N": 256,
        "BLOCK_SIZE_K": 64,
        "GROUP_SIZE_M": 8,
        "num_stages": 8,
        "num_warps": 2,
        "compile_time": 3.1195056438446045
    },
    {
        "BLOCK_SIZE_M": 32,
        "BLOCK_SIZE_N": 256,
        "BLOCK_SIZE_K": 64,
        "GROUP_SIZE_M": 8,
        "num_stages": 8,
        "num_warps": 4,
        "compile_time": 1.3831961154937744
    },
    {
        "BLOCK_SIZE_M": 32,
        "BLOCK_SIZE_N": 256,
        "BLOCK_SIZE_K": 64,
        "GROUP_SIZE_M": 8,
        "num_stages": 8,
        "num_warps": 8,
        "compile_time": 0.8346414566040039
    },
    {
        "BLOCK_SIZE_M": 32,
        "BLOCK_SIZE_N": 256,
        "BLOCK_SIZE_K": 64,
        "GROUP_SIZE_M": 8,
        "num_stages": 8,
        "num_warps": 16,
        "compile_time": 0.6070680618286133
    },
    {
        "BLOCK_SIZE_M": 32,
        "BLOCK_SIZE_N": 256,
        "BLOCK_SIZE_K": 64,
        "GROUP_SIZE_M": 8,
        "num_stages": 8,
        "num_warps": 32,
        "compile_time": 0.48708629608154297
    },
    {
        "BLOCK_SIZE_M": 32,
        "BLOCK_SIZE_N": 256,
        "BLOCK_SIZE_K": 128,
        "GROUP_SIZE_M": 8,
        "num_stages": 3,
        "num_warps": 2,
        "compile_time": 11.13787317276001
    },
    {
        "BLOCK_SIZE_M": 32,
        "BLOCK_SIZE_N": 256,
        "BLOCK_SIZE_K": 128,
        "GROUP_SIZE_M": 8,
        "num_stages": 4,
        "num_warps": 2,
        "compile_time": 11.235206842422485
    },
    {
        "BLOCK_SIZE_M": 32,
        "BLOCK_SIZE_N": 256,
        "BLOCK_SIZE_K": 128,
        "GROUP_SIZE_M": 8,
        "num_stages": 4,
        "num_warps": 4,
        "compile_time": 2.2589263916015625
    },
    {
        "BLOCK_SIZE_M": 32,
        "BLOCK_SIZE_N": 256,
        "BLOCK_SIZE_K": 128,
        "GROUP_SIZE_M": 8,
        "num_stages": 4,
        "num_warps": 8,
        "compile_time": 1.0489563941955566
    },
    {
        "BLOCK_SIZE_M": 32,
        "BLOCK_SIZE_N": 256,
        "BLOCK_SIZE_K": 128,
        "GROUP_SIZE_M": 8,
        "num_stages": 4,
        "num_warps": 16,
        "compile_time": 0.7083225250244141
    },
    {
        "BLOCK_SIZE_M": 32,
        "BLOCK_SIZE_N": 256,
        "BLOCK_SIZE_K": 128,
        "GROUP_SIZE_M": 8,
        "num_stages": 4,
        "num_warps": 32,
        "compile_time": 0.5200653076171875
    },
    {
        "BLOCK_SIZE_M": 32,
        "BLOCK_SIZE_N": 256,
        "BLOCK_SIZE_K": 128,
        "GROUP_SIZE_M": 8,
        "num_stages": 5,
        "num_warps": 2,
        "compile_time": 11.432584047317505
    },
    {
        "BLOCK_SIZE_M": 32,
        "BLOCK_SIZE_N": 256,
        "BLOCK_SIZE_K": 128,
        "GROUP_SIZE_M": 8,
        "num_stages": 5,
        "num_warps": 4,
        "compile_time": 2.37943959236145
    },
    {
        "BLOCK_SIZE_M": 32,
        "BLOCK_SIZE_N": 256,
        "BLOCK_SIZE_K": 128,
        "GROUP_SIZE_M": 8,
        "num_stages": 5,
        "num_warps": 8,
        "compile_time": 1.1144046783447266
    },
    {
        "BLOCK_SIZE_M": 32,
        "BLOCK_SIZE_N": 256,
        "BLOCK_SIZE_K": 128,
        "GROUP_SIZE_M": 8,
        "num_stages": 5,
        "num_warps": 16,
        "compile_time": 0.7345981597900391
    },
    {
        "BLOCK_SIZE_M": 32,
        "BLOCK_SIZE_N": 256,
        "BLOCK_SIZE_K": 128,
        "GROUP_SIZE_M": 8,
        "num_stages": 5,
        "num_warps": 32,
        "compile_time": 0.5302660465240479
    },
    {
        "BLOCK_SIZE_M": 32,
        "BLOCK_SIZE_N": 256,
        "BLOCK_SIZE_K": 128,
        "GROUP_SIZE_M": 8,
        "num_stages": 6,
        "num_warps": 2,
        "compile_time": 11.586562633514404
    },
    {
        "BLOCK_SIZE_M": 32,
        "BLOCK_SIZE_N": 256,
        "BLOCK_SIZE_K": 128,
        "GROUP_SIZE_M": 8,
        "num_stages": 6,
        "num_warps": 4,
        "compile_time": 2.521618604660034
    },
    {
        "BLOCK_SIZE_M": 32,
        "BLOCK_SIZE_N": 256,
        "BLOCK_SIZE_K": 128,
        "GROUP_SIZE_M": 8,
        "num_stages": 6,
        "num_warps": 8,
        "compile_time": 1.2153382301330566
    },
    {
        "BLOCK_SIZE_M": 32,
        "BLOCK_SIZE_N": 256,
        "BLOCK_SIZE_K": 128,
        "GROUP_SIZE_M": 8,
        "num_stages": 6,
        "num_warps": 16,
        "compile_time": 0.7995929718017578
    },
    {
        "BLOCK_SIZE_M": 32,
        "BLOCK_SIZE_N": 256,
        "BLOCK_SIZE_K": 128,
        "GROUP_SIZE_M": 8,
        "num_stages": 6,
        "num_warps": 32,
        "compile_time": 0.5730621814727783
    },
    {
        "BLOCK_SIZE_M": 32,
        "BLOCK_SIZE_N": 256,
        "BLOCK_SIZE_K": 128,
        "GROUP_SIZE_M": 8,
        "num_stages": 7,
        "num_warps": 2,
        "compile_time": 11.593143701553345
    },
    {
        "BLOCK_SIZE_M": 32,
        "BLOCK_SIZE_N": 256,
        "BLOCK_SIZE_K": 128,
        "GROUP_SIZE_M": 8,
        "num_stages": 7,
        "num_warps": 4,
        "compile_time": 2.6632962226867676
    },
    {
        "BLOCK_SIZE_M": 32,
        "BLOCK_SIZE_N": 256,
        "BLOCK_SIZE_K": 128,
        "GROUP_SIZE_M": 8,
        "num_stages": 7,
        "num_warps": 8,
        "compile_time": 1.2856218814849854
    },
    {
        "BLOCK_SIZE_M": 32,
        "BLOCK_SIZE_N": 256,
        "BLOCK_SIZE_K": 128,
        "GROUP_SIZE_M": 8,
        "num_stages": 7,
        "num_warps": 16,
        "compile_time": 0.8401150703430176
    },
    {
        "BLOCK_SIZE_M": 32,
        "BLOCK_SIZE_N": 256,
        "BLOCK_SIZE_K": 128,
        "GROUP_SIZE_M": 8,
        "num_stages": 7,
        "num_warps": 32,
        "compile_time": 0.6042764186859131
    },
    {
        "BLOCK_SIZE_M": 32,
        "BLOCK_SIZE_N": 256,
        "BLOCK_SIZE_K": 128,
        "GROUP_SIZE_M": 8,
        "num_stages": 8,
        "num_warps": 2,
        "compile_time": 11.831057071685791
    },
    {
        "BLOCK_SIZE_M": 32,
        "BLOCK_SIZE_N": 256,
        "BLOCK_SIZE_K": 128,
        "GROUP_SIZE_M": 8,
        "num_stages": 8,
        "num_warps": 4,
        "compile_time": 2.763338327407837
    },
    {
        "BLOCK_SIZE_M": 32,
        "BLOCK_SIZE_N": 256,
        "BLOCK_SIZE_K": 128,
        "GROUP_SIZE_M": 8,
        "num_stages": 8,
        "num_warps": 8,
        "compile_time": 1.4343249797821045
    },
    {
        "BLOCK_SIZE_M": 32,
        "BLOCK_SIZE_N": 256,
        "BLOCK_SIZE_K": 128,
        "GROUP_SIZE_M": 8,
        "num_stages": 8,
        "num_warps": 16,
        "compile_time": 0.8897557258605957
    },
    {
        "BLOCK_SIZE_M": 32,
        "BLOCK_SIZE_N": 256,
        "BLOCK_SIZE_K": 128,
        "GROUP_SIZE_M": 8,
        "num_stages": 8,
        "num_warps": 32,
        "compile_time": 0.6412739753723145
    },
    {
        "BLOCK_SIZE_M": 32,
        "BLOCK_SIZE_N": 256,
        "BLOCK_SIZE_K": 256,
        "GROUP_SIZE_M": 8,
        "num_stages": 1,
        "num_warps": 2,
        "compile_time": 8.25743818283081
    },
    {
        "BLOCK_SIZE_M": 32,
        "BLOCK_SIZE_N": 256,
        "BLOCK_SIZE_K": 256,
        "GROUP_SIZE_M": 8,
        "num_stages": 2,
        "num_warps": 2,
        "compile_time": 8.318243265151978
    },
    {
        "BLOCK_SIZE_M": 32,
        "BLOCK_SIZE_N": 256,
        "BLOCK_SIZE_K": 256,
        "GROUP_SIZE_M": 8,
        "num_stages": 3,
        "num_warps": 2,
        "compile_time": 6.097973823547363
    },
    {
        "BLOCK_SIZE_M": 32,
        "BLOCK_SIZE_N": 256,
        "BLOCK_SIZE_K": 256,
        "GROUP_SIZE_M": 8,
        "num_stages": 3,
        "num_warps": 4,
        "compile_time": 10.787184000015259
    },
    {
        "BLOCK_SIZE_M": 32,
        "BLOCK_SIZE_N": 256,
        "BLOCK_SIZE_K": 256,
        "GROUP_SIZE_M": 8,
        "num_stages": 3,
        "num_warps": 8,
        "compile_time": 2.036672353744507
    },
    {
        "BLOCK_SIZE_M": 32,
        "BLOCK_SIZE_N": 256,
        "BLOCK_SIZE_K": 256,
        "GROUP_SIZE_M": 8,
        "num_stages": 3,
        "num_warps": 16,
        "compile_time": 1.0380868911743164
    },
    {
        "BLOCK_SIZE_M": 32,
        "BLOCK_SIZE_N": 256,
        "BLOCK_SIZE_K": 256,
        "GROUP_SIZE_M": 8,
        "num_stages": 3,
        "num_warps": 32,
        "compile_time": 0.73822021484375
    },
    {
        "BLOCK_SIZE_M": 32,
        "BLOCK_SIZE_N": 256,
        "BLOCK_SIZE_K": 256,
        "GROUP_SIZE_M": 8,
        "num_stages": 4,
        "num_warps": 2,
        "compile_time": 6.573434352874756
    },
    {
        "BLOCK_SIZE_M": 32,
        "BLOCK_SIZE_N": 256,
        "BLOCK_SIZE_K": 256,
        "GROUP_SIZE_M": 8,
        "num_stages": 4,
        "num_warps": 4,
        "compile_time": 10.780855417251587
    },
    {
        "BLOCK_SIZE_M": 32,
        "BLOCK_SIZE_N": 256,
        "BLOCK_SIZE_K": 256,
        "GROUP_SIZE_M": 8,
        "num_stages": 4,
        "num_warps": 8,
        "compile_time": 2.2266695499420166
    },
    {
        "BLOCK_SIZE_M": 32,
        "BLOCK_SIZE_N": 256,
        "BLOCK_SIZE_K": 256,
        "GROUP_SIZE_M": 8,
        "num_stages": 4,
        "num_warps": 16,
        "compile_time": 1.0982286930084229
    },
    {
        "BLOCK_SIZE_M": 32,
        "BLOCK_SIZE_N": 256,
        "BLOCK_SIZE_K": 256,
        "GROUP_SIZE_M": 8,
        "num_stages": 4,
        "num_warps": 32,
        "compile_time": 0.72953200340271
    },
    {
        "BLOCK_SIZE_M": 32,
        "BLOCK_SIZE_N": 256,
        "BLOCK_SIZE_K": 256,
        "GROUP_SIZE_M": 8,
        "num_stages": 5,
        "num_warps": 2,
        "compile_time": 6.84261155128479
    },
    {
        "BLOCK_SIZE_M": 32,
        "BLOCK_SIZE_N": 256,
        "BLOCK_SIZE_K": 256,
        "GROUP_SIZE_M": 8,
        "num_stages": 5,
        "num_warps": 4,
        "compile_time": 10.996155977249146
    },
    {
        "BLOCK_SIZE_M": 32,
        "BLOCK_SIZE_N": 256,
        "BLOCK_SIZE_K": 256,
        "GROUP_SIZE_M": 8,
        "num_stages": 5,
        "num_warps": 8,
        "compile_time": 2.3830244541168213
    },
    {
        "BLOCK_SIZE_M": 32,
        "BLOCK_SIZE_N": 256,
        "BLOCK_SIZE_K": 256,
        "GROUP_SIZE_M": 8,
        "num_stages": 5,
        "num_warps": 16,
        "compile_time": 1.1961705684661865
    },
    {
        "BLOCK_SIZE_M": 32,
        "BLOCK_SIZE_N": 256,
        "BLOCK_SIZE_K": 256,
        "GROUP_SIZE_M": 8,
        "num_stages": 5,
        "num_warps": 32,
        "compile_time": 0.7883045673370361
    },
    {
        "BLOCK_SIZE_M": 32,
        "BLOCK_SIZE_N": 256,
        "BLOCK_SIZE_K": 256,
        "GROUP_SIZE_M": 8,
        "num_stages": 6,
        "num_warps": 2,
        "compile_time": 7.196582078933716
    },
    {
        "BLOCK_SIZE_M": 32,
        "BLOCK_SIZE_N": 256,
        "BLOCK_SIZE_K": 256,
        "GROUP_SIZE_M": 8,
        "num_stages": 6,
        "num_warps": 4,
        "compile_time": 11.111535787582397
    },
    {
        "BLOCK_SIZE_M": 32,
        "BLOCK_SIZE_N": 256,
        "BLOCK_SIZE_K": 256,
        "GROUP_SIZE_M": 8,
        "num_stages": 6,
        "num_warps": 8,
        "compile_time": 2.566772222518921
    },
    {
        "BLOCK_SIZE_M": 32,
        "BLOCK_SIZE_N": 256,
        "BLOCK_SIZE_K": 256,
        "GROUP_SIZE_M": 8,
        "num_stages": 6,
        "num_warps": 16,
        "compile_time": 1.3082220554351807
    },
    {
        "BLOCK_SIZE_M": 32,
        "BLOCK_SIZE_N": 256,
        "BLOCK_SIZE_K": 256,
        "GROUP_SIZE_M": 8,
        "num_stages": 6,
        "num_warps": 32,
        "compile_time": 0.8304111957550049
    },
    {
        "BLOCK_SIZE_M": 32,
        "BLOCK_SIZE_N": 256,
        "BLOCK_SIZE_K": 256,
        "GROUP_SIZE_M": 8,
        "num_stages": 7,
        "num_warps": 2,
        "compile_time": 7.438626527786255
    },
    {
        "BLOCK_SIZE_M": 32,
        "BLOCK_SIZE_N": 256,
        "BLOCK_SIZE_K": 256,
        "GROUP_SIZE_M": 8,
        "num_stages": 7,
        "num_warps": 4,
        "compile_time": 11.510093688964844
    },
    {
        "BLOCK_SIZE_M": 32,
        "BLOCK_SIZE_N": 256,
        "BLOCK_SIZE_K": 256,
        "GROUP_SIZE_M": 8,
        "num_stages": 7,
        "num_warps": 8,
        "compile_time": 2.6840105056762695
    },
    {
        "BLOCK_SIZE_M": 32,
        "BLOCK_SIZE_N": 256,
        "BLOCK_SIZE_K": 256,
        "GROUP_SIZE_M": 8,
        "num_stages": 7,
        "num_warps": 16,
        "compile_time": 1.3592438697814941
    },
    {
        "BLOCK_SIZE_M": 32,
        "BLOCK_SIZE_N": 256,
        "BLOCK_SIZE_K": 256,
        "GROUP_SIZE_M": 8,
        "num_stages": 7,
        "num_warps": 32,
        "compile_time": 0.876305103302002
    },
    {
        "BLOCK_SIZE_M": 32,
        "BLOCK_SIZE_N": 256,
        "BLOCK_SIZE_K": 256,
        "GROUP_SIZE_M": 8,
        "num_stages": 8,
        "num_warps": 2,
        "compile_time": 7.81038236618042
    },
    {
        "BLOCK_SIZE_M": 32,
        "BLOCK_SIZE_N": 256,
        "BLOCK_SIZE_K": 256,
        "GROUP_SIZE_M": 8,
        "num_stages": 8,
        "num_warps": 4,
        "compile_time": 12.014866828918457
    },
    {
        "BLOCK_SIZE_M": 32,
        "BLOCK_SIZE_N": 256,
        "BLOCK_SIZE_K": 256,
        "GROUP_SIZE_M": 8,
        "num_stages": 8,
        "num_warps": 8,
        "compile_time": 2.8642406463623047
    },
    {
        "BLOCK_SIZE_M": 32,
        "BLOCK_SIZE_N": 256,
        "BLOCK_SIZE_K": 256,
        "GROUP_SIZE_M": 8,
        "num_stages": 8,
        "num_warps": 16,
        "compile_time": 1.4786450862884521
    },
    {
        "BLOCK_SIZE_M": 32,
        "BLOCK_SIZE_N": 256,
        "BLOCK_SIZE_K": 256,
        "GROUP_SIZE_M": 8,
        "num_stages": 8,
        "num_warps": 32,
        "compile_time": 0.9447238445281982
    },
    {
        "BLOCK_SIZE_M": 32,
        "BLOCK_SIZE_N": 256,
        "BLOCK_SIZE_K": 512,
        "GROUP_SIZE_M": 8,
        "num_stages": 1,
        "num_warps": 2,
        "compile_time": 19.659449100494385
    },
    {
        "BLOCK_SIZE_M": 32,
        "BLOCK_SIZE_N": 256,
        "BLOCK_SIZE_K": 512,
        "GROUP_SIZE_M": 8,
        "num_stages": 1,
        "num_warps": 4,
        "compile_time": 8.33769178390503
    },
    {
        "BLOCK_SIZE_M": 32,
        "BLOCK_SIZE_N": 256,
        "BLOCK_SIZE_K": 512,
        "GROUP_SIZE_M": 8,
        "num_stages": 1,
        "num_warps": 8,
        "compile_time": 3.157925844192505
    },
    {
        "BLOCK_SIZE_M": 32,
        "BLOCK_SIZE_N": 256,
        "BLOCK_SIZE_K": 512,
        "GROUP_SIZE_M": 8,
        "num_stages": 1,
        "num_warps": 16,
        "compile_time": 1.3577501773834229
    },
    {
        "BLOCK_SIZE_M": 32,
        "BLOCK_SIZE_N": 256,
        "BLOCK_SIZE_K": 512,
        "GROUP_SIZE_M": 8,
        "num_stages": 1,
        "num_warps": 32,
        "compile_time": 0.8536715507507324
    },
    {
        "BLOCK_SIZE_M": 32,
        "BLOCK_SIZE_N": 256,
        "BLOCK_SIZE_K": 512,
        "GROUP_SIZE_M": 8,
        "num_stages": 2,
        "num_warps": 2,
        "compile_time": 19.549193143844604
    },
    {
        "BLOCK_SIZE_M": 32,
        "BLOCK_SIZE_N": 256,
        "BLOCK_SIZE_K": 512,
        "GROUP_SIZE_M": 8,
        "num_stages": 2,
        "num_warps": 4,
        "compile_time": 8.200690984725952
    },
    {
        "BLOCK_SIZE_M": 32,
        "BLOCK_SIZE_N": 256,
        "BLOCK_SIZE_K": 512,
        "GROUP_SIZE_M": 8,
        "num_stages": 2,
        "num_warps": 8,
        "compile_time": 3.429471492767334
    },
    {
        "BLOCK_SIZE_M": 32,
        "BLOCK_SIZE_N": 256,
        "BLOCK_SIZE_K": 512,
        "GROUP_SIZE_M": 8,
        "num_stages": 2,
        "num_warps": 16,
        "compile_time": 1.5692942142486572
    },
    {
        "BLOCK_SIZE_M": 32,
        "BLOCK_SIZE_N": 256,
        "BLOCK_SIZE_K": 512,
        "GROUP_SIZE_M": 8,
        "num_stages": 2,
        "num_warps": 32,
        "compile_time": 0.9129393100738525
    },
    {
        "BLOCK_SIZE_M": 32,
        "BLOCK_SIZE_N": 256,
        "BLOCK_SIZE_K": 512,
        "GROUP_SIZE_M": 8,
        "num_stages": 3,
        "num_warps": 2,
        "compile_time": 20.476720571517944
    },
    {
        "BLOCK_SIZE_M": 32,
        "BLOCK_SIZE_N": 256,
        "BLOCK_SIZE_K": 512,
        "GROUP_SIZE_M": 8,
        "num_stages": 3,
        "num_warps": 4,
        "compile_time": 6.014189958572388
    },
    {
        "BLOCK_SIZE_M": 32,
        "BLOCK_SIZE_N": 256,
        "BLOCK_SIZE_K": 512,
        "GROUP_SIZE_M": 8,
        "num_stages": 3,
        "num_warps": 8,
        "compile_time": 10.84328818321228
    },
    {
        "BLOCK_SIZE_M": 32,
        "BLOCK_SIZE_N": 256,
        "BLOCK_SIZE_K": 512,
        "GROUP_SIZE_M": 8,
        "num_stages": 3,
        "num_warps": 16,
        "compile_time": 2.1749703884124756
    },
    {
        "BLOCK_SIZE_M": 32,
        "BLOCK_SIZE_N": 256,
        "BLOCK_SIZE_K": 512,
        "GROUP_SIZE_M": 8,
        "num_stages": 3,
        "num_warps": 32,
        "compile_time": 1.0769100189208984
    },
    {
        "BLOCK_SIZE_M": 32,
        "BLOCK_SIZE_N": 256,
        "BLOCK_SIZE_K": 512,
        "GROUP_SIZE_M": 8,
        "num_stages": 4,
        "num_warps": 2,
        "compile_time": 21.939964056015015
    },
    {
        "BLOCK_SIZE_M": 32,
        "BLOCK_SIZE_N": 256,
        "BLOCK_SIZE_K": 512,
        "GROUP_SIZE_M": 8,
        "num_stages": 4,
        "num_warps": 4,
        "compile_time": 6.647740602493286
    },
    {
        "BLOCK_SIZE_M": 32,
        "BLOCK_SIZE_N": 256,
        "BLOCK_SIZE_K": 512,
        "GROUP_SIZE_M": 8,
        "num_stages": 4,
        "num_warps": 8,
        "compile_time": 11.13342571258545
    },
    {
        "BLOCK_SIZE_M": 32,
        "BLOCK_SIZE_N": 256,
        "BLOCK_SIZE_K": 512,
        "GROUP_SIZE_M": 8,
        "num_stages": 4,
        "num_warps": 16,
        "compile_time": 2.402200222015381
    },
    {
        "BLOCK_SIZE_M": 32,
        "BLOCK_SIZE_N": 256,
        "BLOCK_SIZE_K": 512,
        "GROUP_SIZE_M": 8,
        "num_stages": 4,
        "num_warps": 32,
        "compile_time": 1.1893353462219238
    },
    {
        "BLOCK_SIZE_M": 32,
        "BLOCK_SIZE_N": 256,
        "BLOCK_SIZE_K": 512,
        "GROUP_SIZE_M": 8,
        "num_stages": 5,
        "num_warps": 2,
        "compile_time": 22.299718141555786
    },
    {
        "BLOCK_SIZE_M": 32,
        "BLOCK_SIZE_N": 256,
        "BLOCK_SIZE_K": 512,
        "GROUP_SIZE_M": 8,
        "num_stages": 5,
        "num_warps": 4,
        "compile_time": 6.96332311630249
    },
    {
        "BLOCK_SIZE_M": 32,
        "BLOCK_SIZE_N": 256,
        "BLOCK_SIZE_K": 512,
        "GROUP_SIZE_M": 8,
        "num_stages": 5,
        "num_warps": 8,
        "compile_time": 11.49164342880249
    },
    {
        "BLOCK_SIZE_M": 32,
        "BLOCK_SIZE_N": 256,
        "BLOCK_SIZE_K": 512,
        "GROUP_SIZE_M": 8,
        "num_stages": 5,
        "num_warps": 16,
        "compile_time": 2.596050977706909
    },
    {
        "BLOCK_SIZE_M": 32,
        "BLOCK_SIZE_N": 256,
        "BLOCK_SIZE_K": 512,
        "GROUP_SIZE_M": 8,
        "num_stages": 5,
        "num_warps": 32,
        "compile_time": 1.281911849975586
    },
    {
        "BLOCK_SIZE_M": 32,
        "BLOCK_SIZE_N": 256,
        "BLOCK_SIZE_K": 512,
        "GROUP_SIZE_M": 8,
        "num_stages": 6,
        "num_warps": 2,
        "compile_time": 22.97254776954651
    },
    {
        "BLOCK_SIZE_M": 32,
        "BLOCK_SIZE_N": 256,
        "BLOCK_SIZE_K": 512,
        "GROUP_SIZE_M": 8,
        "num_stages": 6,
        "num_warps": 4,
        "compile_time": 7.18656063079834
    },
    {
        "BLOCK_SIZE_M": 32,
        "BLOCK_SIZE_N": 256,
        "BLOCK_SIZE_K": 512,
        "GROUP_SIZE_M": 8,
        "num_stages": 6,
        "num_warps": 8,
        "compile_time": 11.510114431381226
    },
    {
        "BLOCK_SIZE_M": 32,
        "BLOCK_SIZE_N": 256,
        "BLOCK_SIZE_K": 512,
        "GROUP_SIZE_M": 8,
        "num_stages": 6,
        "num_warps": 16,
        "compile_time": 2.844475746154785
    },
    {
        "BLOCK_SIZE_M": 32,
        "BLOCK_SIZE_N": 256,
        "BLOCK_SIZE_K": 512,
        "GROUP_SIZE_M": 8,
        "num_stages": 6,
        "num_warps": 32,
        "compile_time": 1.393444299697876
    },
    {
        "BLOCK_SIZE_M": 32,
        "BLOCK_SIZE_N": 256,
        "BLOCK_SIZE_K": 512,
        "GROUP_SIZE_M": 8,
        "num_stages": 7,
        "num_warps": 2,
        "compile_time": 6.110706090927124
    },
    {
        "BLOCK_SIZE_M": 32,
        "BLOCK_SIZE_N": 256,
        "BLOCK_SIZE_K": 512,
        "GROUP_SIZE_M": 8,
        "num_stages": 7,
        "num_warps": 4,
        "compile_time": 7.7840211391448975
    },
    {
        "BLOCK_SIZE_M": 32,
        "BLOCK_SIZE_N": 256,
        "BLOCK_SIZE_K": 512,
        "GROUP_SIZE_M": 8,
        "num_stages": 7,
        "num_warps": 8,
        "compile_time": 11.933125734329224
    },
    {
        "BLOCK_SIZE_M": 32,
        "BLOCK_SIZE_N": 256,
        "BLOCK_SIZE_K": 512,
        "GROUP_SIZE_M": 8,
        "num_stages": 7,
        "num_warps": 16,
        "compile_time": 2.982485771179199
    },
    {
        "BLOCK_SIZE_M": 32,
        "BLOCK_SIZE_N": 256,
        "BLOCK_SIZE_K": 512,
        "GROUP_SIZE_M": 8,
        "num_stages": 7,
        "num_warps": 32,
        "compile_time": 1.4957571029663086
    },
    {
        "BLOCK_SIZE_M": 32,
        "BLOCK_SIZE_N": 256,
        "BLOCK_SIZE_K": 512,
        "GROUP_SIZE_M": 8,
        "num_stages": 8,
        "num_warps": 2,
        "compile_time": 6.905117511749268
    },
    {
        "BLOCK_SIZE_M": 32,
        "BLOCK_SIZE_N": 256,
        "BLOCK_SIZE_K": 512,
        "GROUP_SIZE_M": 8,
        "num_stages": 8,
        "num_warps": 4,
        "compile_time": 8.17206883430481
    },
    {
        "BLOCK_SIZE_M": 32,
        "BLOCK_SIZE_N": 256,
        "BLOCK_SIZE_K": 512,
        "GROUP_SIZE_M": 8,
        "num_stages": 8,
        "num_warps": 8,
        "compile_time": 11.671807765960693
    },
    {
        "BLOCK_SIZE_M": 32,
        "BLOCK_SIZE_N": 256,
        "BLOCK_SIZE_K": 512,
        "GROUP_SIZE_M": 8,
        "num_stages": 8,
        "num_warps": 16,
        "compile_time": 3.19681715965271
    },
    {
        "BLOCK_SIZE_M": 32,
        "BLOCK_SIZE_N": 256,
        "BLOCK_SIZE_K": 512,
        "GROUP_SIZE_M": 8,
        "num_stages": 8,
        "num_warps": 32,
        "compile_time": 1.619168758392334
    },
    {
        "BLOCK_SIZE_M": 32,
        "BLOCK_SIZE_N": 512,
        "BLOCK_SIZE_K": 32,
        "GROUP_SIZE_M": 8,
        "num_stages": 6,
        "num_warps": 2,
        "compile_time": 4.1611692905426025
    },
    {
        "BLOCK_SIZE_M": 32,
        "BLOCK_SIZE_N": 512,
        "BLOCK_SIZE_K": 32,
        "GROUP_SIZE_M": 8,
        "num_stages": 6,
        "num_warps": 4,
        "compile_time": 1.5418953895568848
    },
    {
        "BLOCK_SIZE_M": 32,
        "BLOCK_SIZE_N": 512,
        "BLOCK_SIZE_K": 32,
        "GROUP_SIZE_M": 8,
        "num_stages": 6,
        "num_warps": 8,
        "compile_time": 0.8318953514099121
    },
    {
        "BLOCK_SIZE_M": 32,
        "BLOCK_SIZE_N": 512,
        "BLOCK_SIZE_K": 32,
        "GROUP_SIZE_M": 8,
        "num_stages": 6,
        "num_warps": 16,
        "compile_time": 0.5857434272766113
    },
    {
        "BLOCK_SIZE_M": 32,
        "BLOCK_SIZE_N": 512,
        "BLOCK_SIZE_K": 32,
        "GROUP_SIZE_M": 8,
        "num_stages": 7,
        "num_warps": 2,
        "compile_time": 4.238703727722168
    },
    {
        "BLOCK_SIZE_M": 32,
        "BLOCK_SIZE_N": 512,
        "BLOCK_SIZE_K": 32,
        "GROUP_SIZE_M": 8,
        "num_stages": 7,
        "num_warps": 4,
        "compile_time": 1.6236600875854492
    },
    {
        "BLOCK_SIZE_M": 32,
        "BLOCK_SIZE_N": 512,
        "BLOCK_SIZE_K": 32,
        "GROUP_SIZE_M": 8,
        "num_stages": 7,
        "num_warps": 8,
        "compile_time": 0.8915853500366211
    },
    {
        "BLOCK_SIZE_M": 32,
        "BLOCK_SIZE_N": 512,
        "BLOCK_SIZE_K": 32,
        "GROUP_SIZE_M": 8,
        "num_stages": 7,
        "num_warps": 16,
        "compile_time": 0.6133067607879639
    },
    {
        "BLOCK_SIZE_M": 32,
        "BLOCK_SIZE_N": 512,
        "BLOCK_SIZE_K": 32,
        "GROUP_SIZE_M": 8,
        "num_stages": 7,
        "num_warps": 32,
        "compile_time": 0.47037792205810547
    },
    {
        "BLOCK_SIZE_M": 32,
        "BLOCK_SIZE_N": 512,
        "BLOCK_SIZE_K": 32,
        "GROUP_SIZE_M": 8,
        "num_stages": 8,
        "num_warps": 2,
        "compile_time": 4.34568452835083
    },
    {
        "BLOCK_SIZE_M": 32,
        "BLOCK_SIZE_N": 512,
        "BLOCK_SIZE_K": 32,
        "GROUP_SIZE_M": 8,
        "num_stages": 8,
        "num_warps": 4,
        "compile_time": 1.6717815399169922
    },
    {
        "BLOCK_SIZE_M": 32,
        "BLOCK_SIZE_N": 512,
        "BLOCK_SIZE_K": 32,
        "GROUP_SIZE_M": 8,
        "num_stages": 8,
        "num_warps": 8,
        "compile_time": 0.9370167255401611
    },
    {
        "BLOCK_SIZE_M": 32,
        "BLOCK_SIZE_N": 512,
        "BLOCK_SIZE_K": 32,
        "GROUP_SIZE_M": 8,
        "num_stages": 8,
        "num_warps": 16,
        "compile_time": 0.6267096996307373
    },
    {
        "BLOCK_SIZE_M": 32,
        "BLOCK_SIZE_N": 512,
        "BLOCK_SIZE_K": 32,
        "GROUP_SIZE_M": 8,
        "num_stages": 8,
        "num_warps": 32,
        "compile_time": 0.47698354721069336
    },
    {
        "BLOCK_SIZE_M": 32,
        "BLOCK_SIZE_N": 512,
        "BLOCK_SIZE_K": 64,
        "GROUP_SIZE_M": 8,
        "num_stages": 2,
        "num_warps": 2,
        "compile_time": 6.050958871841431
    },
    {
        "BLOCK_SIZE_M": 32,
        "BLOCK_SIZE_N": 512,
        "BLOCK_SIZE_K": 64,
        "GROUP_SIZE_M": 8,
        "num_stages": 3,
        "num_warps": 2,
        "compile_time": 11.937942743301392
    },
    {
        "BLOCK_SIZE_M": 32,
        "BLOCK_SIZE_N": 512,
        "BLOCK_SIZE_K": 64,
        "GROUP_SIZE_M": 8,
        "num_stages": 4,
        "num_warps": 2,
        "compile_time": 11.952972412109375
    },
    {
        "BLOCK_SIZE_M": 32,
        "BLOCK_SIZE_N": 512,
        "BLOCK_SIZE_K": 64,
        "GROUP_SIZE_M": 8,
        "num_stages": 4,
        "num_warps": 4,
        "compile_time": 2.5126943588256836
    },
    {
        "BLOCK_SIZE_M": 32,
        "BLOCK_SIZE_N": 512,
        "BLOCK_SIZE_K": 64,
        "GROUP_SIZE_M": 8,
        "num_stages": 4,
        "num_warps": 8,
        "compile_time": 1.0911014080047607
    },
    {
        "BLOCK_SIZE_M": 32,
        "BLOCK_SIZE_N": 512,
        "BLOCK_SIZE_K": 64,
        "GROUP_SIZE_M": 8,
        "num_stages": 4,
        "num_warps": 16,
        "compile_time": 0.6866137981414795
    },
    {
        "BLOCK_SIZE_M": 32,
        "BLOCK_SIZE_N": 512,
        "BLOCK_SIZE_K": 64,
        "GROUP_SIZE_M": 8,
        "num_stages": 4,
        "num_warps": 32,
        "compile_time": 0.5428199768066406
    },
    {
        "BLOCK_SIZE_M": 32,
        "BLOCK_SIZE_N": 512,
        "BLOCK_SIZE_K": 64,
        "GROUP_SIZE_M": 8,
        "num_stages": 5,
        "num_warps": 2,
        "compile_time": 12.17476487159729
    },
    {
        "BLOCK_SIZE_M": 32,
        "BLOCK_SIZE_N": 512,
        "BLOCK_SIZE_K": 64,
        "GROUP_SIZE_M": 8,
        "num_stages": 5,
        "num_warps": 4,
        "compile_time": 2.6796271800994873
    },
    {
        "BLOCK_SIZE_M": 32,
        "BLOCK_SIZE_N": 512,
        "BLOCK_SIZE_K": 64,
        "GROUP_SIZE_M": 8,
        "num_stages": 5,
        "num_warps": 8,
        "compile_time": 1.182569980621338
    },
    {
        "BLOCK_SIZE_M": 32,
        "BLOCK_SIZE_N": 512,
        "BLOCK_SIZE_K": 64,
        "GROUP_SIZE_M": 8,
        "num_stages": 5,
        "num_warps": 16,
        "compile_time": 0.7436556816101074
    },
    {
        "BLOCK_SIZE_M": 32,
        "BLOCK_SIZE_N": 512,
        "BLOCK_SIZE_K": 64,
        "GROUP_SIZE_M": 8,
        "num_stages": 5,
        "num_warps": 32,
        "compile_time": 0.5543429851531982
    },
    {
        "BLOCK_SIZE_M": 32,
        "BLOCK_SIZE_N": 512,
        "BLOCK_SIZE_K": 64,
        "GROUP_SIZE_M": 8,
        "num_stages": 6,
        "num_warps": 2,
        "compile_time": 12.303539514541626
    },
    {
        "BLOCK_SIZE_M": 32,
        "BLOCK_SIZE_N": 512,
        "BLOCK_SIZE_K": 64,
        "GROUP_SIZE_M": 8,
        "num_stages": 6,
        "num_warps": 4,
        "compile_time": 2.808093786239624
    },
    {
        "BLOCK_SIZE_M": 32,
        "BLOCK_SIZE_N": 512,
        "BLOCK_SIZE_K": 64,
        "GROUP_SIZE_M": 8,
        "num_stages": 6,
        "num_warps": 8,
        "compile_time": 1.2732837200164795
    },
    {
        "BLOCK_SIZE_M": 32,
        "BLOCK_SIZE_N": 512,
        "BLOCK_SIZE_K": 64,
        "GROUP_SIZE_M": 8,
        "num_stages": 6,
        "num_warps": 16,
        "compile_time": 0.7995429039001465
    },
    {
        "BLOCK_SIZE_M": 32,
        "BLOCK_SIZE_N": 512,
        "BLOCK_SIZE_K": 64,
        "GROUP_SIZE_M": 8,
        "num_stages": 6,
        "num_warps": 32,
        "compile_time": 0.5863916873931885
    },
    {
        "BLOCK_SIZE_M": 32,
        "BLOCK_SIZE_N": 512,
        "BLOCK_SIZE_K": 64,
        "GROUP_SIZE_M": 8,
        "num_stages": 7,
        "num_warps": 2,
        "compile_time": 12.479819774627686
    },
    {
        "BLOCK_SIZE_M": 32,
        "BLOCK_SIZE_N": 512,
        "BLOCK_SIZE_K": 64,
        "GROUP_SIZE_M": 8,
        "num_stages": 7,
        "num_warps": 4,
        "compile_time": 2.951341152191162
    },
    {
        "BLOCK_SIZE_M": 32,
        "BLOCK_SIZE_N": 512,
        "BLOCK_SIZE_K": 64,
        "GROUP_SIZE_M": 8,
        "num_stages": 7,
        "num_warps": 8,
        "compile_time": 1.3418076038360596
    },
    {
        "BLOCK_SIZE_M": 32,
        "BLOCK_SIZE_N": 512,
        "BLOCK_SIZE_K": 64,
        "GROUP_SIZE_M": 8,
        "num_stages": 7,
        "num_warps": 16,
        "compile_time": 0.8054440021514893
    },
    {
        "BLOCK_SIZE_M": 32,
        "BLOCK_SIZE_N": 512,
        "BLOCK_SIZE_K": 64,
        "GROUP_SIZE_M": 8,
        "num_stages": 7,
        "num_warps": 32,
        "compile_time": 0.6142034530639648
    },
    {
        "BLOCK_SIZE_M": 32,
        "BLOCK_SIZE_N": 512,
        "BLOCK_SIZE_K": 64,
        "GROUP_SIZE_M": 8,
        "num_stages": 8,
        "num_warps": 2,
        "compile_time": 12.6199369430542
    },
    {
        "BLOCK_SIZE_M": 32,
        "BLOCK_SIZE_N": 512,
        "BLOCK_SIZE_K": 64,
        "GROUP_SIZE_M": 8,
        "num_stages": 8,
        "num_warps": 4,
        "compile_time": 3.0875537395477295
    },
    {
        "BLOCK_SIZE_M": 32,
        "BLOCK_SIZE_N": 512,
        "BLOCK_SIZE_K": 64,
        "GROUP_SIZE_M": 8,
        "num_stages": 8,
        "num_warps": 8,
        "compile_time": 1.482377529144287
    },
    {
        "BLOCK_SIZE_M": 32,
        "BLOCK_SIZE_N": 512,
        "BLOCK_SIZE_K": 64,
        "GROUP_SIZE_M": 8,
        "num_stages": 8,
        "num_warps": 16,
        "compile_time": 0.8870294094085693
    },
    {
        "BLOCK_SIZE_M": 32,
        "BLOCK_SIZE_N": 512,
        "BLOCK_SIZE_K": 64,
        "GROUP_SIZE_M": 8,
        "num_stages": 8,
        "num_warps": 32,
        "compile_time": 0.6386852264404297
    },
    {
        "BLOCK_SIZE_M": 32,
        "BLOCK_SIZE_N": 512,
        "BLOCK_SIZE_K": 128,
        "GROUP_SIZE_M": 8,
        "num_stages": 1,
        "num_warps": 2,
        "compile_time": 9.499540567398071
    },
    {
        "BLOCK_SIZE_M": 32,
        "BLOCK_SIZE_N": 512,
        "BLOCK_SIZE_K": 128,
        "GROUP_SIZE_M": 8,
        "num_stages": 2,
        "num_warps": 2,
        "compile_time": 6.00493049621582
    },
    {
        "BLOCK_SIZE_M": 32,
        "BLOCK_SIZE_N": 512,
        "BLOCK_SIZE_K": 128,
        "GROUP_SIZE_M": 8,
        "num_stages": 3,
        "num_warps": 2,
        "compile_time": 6.325608730316162
    },
    {
        "BLOCK_SIZE_M": 32,
        "BLOCK_SIZE_N": 512,
        "BLOCK_SIZE_K": 128,
        "GROUP_SIZE_M": 8,
        "num_stages": 3,
        "num_warps": 4,
        "compile_time": 10.881445169448853
    },
    {
        "BLOCK_SIZE_M": 32,
        "BLOCK_SIZE_N": 512,
        "BLOCK_SIZE_K": 128,
        "GROUP_SIZE_M": 8,
        "num_stages": 3,
        "num_warps": 8,
        "compile_time": 2.119917154312134
    },
    {
        "BLOCK_SIZE_M": 32,
        "BLOCK_SIZE_N": 512,
        "BLOCK_SIZE_K": 128,
        "GROUP_SIZE_M": 8,
        "num_stages": 3,
        "num_warps": 16,
        "compile_time": 1.0219664573669434
    },
    {
        "BLOCK_SIZE_M": 32,
        "BLOCK_SIZE_N": 512,
        "BLOCK_SIZE_K": 128,
        "GROUP_SIZE_M": 8,
        "num_stages": 3,
        "num_warps": 32,
        "compile_time": 0.6721930503845215
    },
    {
        "BLOCK_SIZE_M": 32,
        "BLOCK_SIZE_N": 512,
        "BLOCK_SIZE_K": 128,
        "GROUP_SIZE_M": 8,
        "num_stages": 4,
        "num_warps": 2,
        "compile_time": 6.539669036865234
    },
    {
        "BLOCK_SIZE_M": 32,
        "BLOCK_SIZE_N": 512,
        "BLOCK_SIZE_K": 128,
        "GROUP_SIZE_M": 8,
        "num_stages": 4,
        "num_warps": 4,
        "compile_time": 11.288685083389282
    },
    {
        "BLOCK_SIZE_M": 32,
        "BLOCK_SIZE_N": 512,
        "BLOCK_SIZE_K": 128,
        "GROUP_SIZE_M": 8,
        "num_stages": 4,
        "num_warps": 8,
        "compile_time": 2.2757513523101807
    },
    {
        "BLOCK_SIZE_M": 32,
        "BLOCK_SIZE_N": 512,
        "BLOCK_SIZE_K": 128,
        "GROUP_SIZE_M": 8,
        "num_stages": 4,
        "num_warps": 16,
        "compile_time": 1.1056654453277588
    },
    {
        "BLOCK_SIZE_M": 32,
        "BLOCK_SIZE_N": 512,
        "BLOCK_SIZE_K": 128,
        "GROUP_SIZE_M": 8,
        "num_stages": 4,
        "num_warps": 32,
        "compile_time": 0.7286453247070312
    },
    {
        "BLOCK_SIZE_M": 32,
        "BLOCK_SIZE_N": 512,
        "BLOCK_SIZE_K": 128,
        "GROUP_SIZE_M": 8,
        "num_stages": 5,
        "num_warps": 2,
        "compile_time": 6.997566223144531
    },
    {
        "BLOCK_SIZE_M": 32,
        "BLOCK_SIZE_N": 512,
        "BLOCK_SIZE_K": 128,
        "GROUP_SIZE_M": 8,
        "num_stages": 5,
        "num_warps": 4,
        "compile_time": 11.246306896209717
    },
    {
        "BLOCK_SIZE_M": 32,
        "BLOCK_SIZE_N": 512,
        "BLOCK_SIZE_K": 128,
        "GROUP_SIZE_M": 8,
        "num_stages": 5,
        "num_warps": 8,
        "compile_time": 2.4037539958953857
    },
    {
        "BLOCK_SIZE_M": 32,
        "BLOCK_SIZE_N": 512,
        "BLOCK_SIZE_K": 128,
        "GROUP_SIZE_M": 8,
        "num_stages": 5,
        "num_warps": 16,
        "compile_time": 1.1822597980499268
    },
    {
        "BLOCK_SIZE_M": 32,
        "BLOCK_SIZE_N": 512,
        "BLOCK_SIZE_K": 128,
        "GROUP_SIZE_M": 8,
        "num_stages": 5,
        "num_warps": 32,
        "compile_time": 0.7761287689208984
    },
    {
        "BLOCK_SIZE_M": 32,
        "BLOCK_SIZE_N": 512,
        "BLOCK_SIZE_K": 128,
        "GROUP_SIZE_M": 8,
        "num_stages": 6,
        "num_warps": 2,
        "compile_time": 7.33471417427063
    },
    {
        "BLOCK_SIZE_M": 32,
        "BLOCK_SIZE_N": 512,
        "BLOCK_SIZE_K": 128,
        "GROUP_SIZE_M": 8,
        "num_stages": 6,
        "num_warps": 4,
        "compile_time": 11.494325160980225
    },
    {
        "BLOCK_SIZE_M": 32,
        "BLOCK_SIZE_N": 512,
        "BLOCK_SIZE_K": 128,
        "GROUP_SIZE_M": 8,
        "num_stages": 6,
        "num_warps": 8,
        "compile_time": 2.578352928161621
    },
    {
        "BLOCK_SIZE_M": 32,
        "BLOCK_SIZE_N": 512,
        "BLOCK_SIZE_K": 128,
        "GROUP_SIZE_M": 8,
        "num_stages": 6,
        "num_warps": 16,
        "compile_time": 0.004746675491333008
    },
    {
        "BLOCK_SIZE_M": 32,
        "BLOCK_SIZE_N": 512,
        "BLOCK_SIZE_K": 128,
        "GROUP_SIZE_M": 8,
        "num_stages": 6,
        "num_warps": 32,
        "compile_time": 0.8267636299133301
    },
    {
        "BLOCK_SIZE_M": 32,
        "BLOCK_SIZE_N": 512,
        "BLOCK_SIZE_K": 128,
        "GROUP_SIZE_M": 8,
        "num_stages": 7,
        "num_warps": 2,
        "compile_time": 7.611434698104858
    },
    {
        "BLOCK_SIZE_M": 32,
        "BLOCK_SIZE_N": 512,
        "BLOCK_SIZE_K": 128,
        "GROUP_SIZE_M": 8,
        "num_stages": 7,
        "num_warps": 4,
        "compile_time": 11.726832866668701
    },
    {
        "BLOCK_SIZE_M": 32,
        "BLOCK_SIZE_N": 512,
        "BLOCK_SIZE_K": 128,
        "GROUP_SIZE_M": 8,
        "num_stages": 7,
        "num_warps": 8,
        "compile_time": 2.7061305046081543
    },
    {
        "BLOCK_SIZE_M": 32,
        "BLOCK_SIZE_N": 512,
        "BLOCK_SIZE_K": 128,
        "GROUP_SIZE_M": 8,
        "num_stages": 7,
        "num_warps": 16,
        "compile_time": 1.4046132564544678
    },
    {
        "BLOCK_SIZE_M": 32,
        "BLOCK_SIZE_N": 512,
        "BLOCK_SIZE_K": 128,
        "GROUP_SIZE_M": 8,
        "num_stages": 7,
        "num_warps": 32,
        "compile_time": 0.8710565567016602
    },
    {
        "BLOCK_SIZE_M": 32,
        "BLOCK_SIZE_N": 512,
        "BLOCK_SIZE_K": 128,
        "GROUP_SIZE_M": 8,
        "num_stages": 8,
        "num_warps": 2,
        "compile_time": 8.174328327178955
    },
    {
        "BLOCK_SIZE_M": 32,
        "BLOCK_SIZE_N": 512,
        "BLOCK_SIZE_K": 128,
        "GROUP_SIZE_M": 8,
        "num_stages": 8,
        "num_warps": 4,
        "compile_time": 12.088741064071655
    },
    {
        "BLOCK_SIZE_M": 32,
        "BLOCK_SIZE_N": 512,
        "BLOCK_SIZE_K": 128,
        "GROUP_SIZE_M": 8,
        "num_stages": 8,
        "num_warps": 8,
        "compile_time": 2.9207985401153564
    },
    {
        "BLOCK_SIZE_M": 32,
        "BLOCK_SIZE_N": 512,
        "BLOCK_SIZE_K": 128,
        "GROUP_SIZE_M": 8,
        "num_stages": 8,
        "num_warps": 16,
        "compile_time": 1.4755380153656006
    },
    {
        "BLOCK_SIZE_M": 32,
        "BLOCK_SIZE_N": 512,
        "BLOCK_SIZE_K": 128,
        "GROUP_SIZE_M": 8,
        "num_stages": 8,
        "num_warps": 32,
        "compile_time": 0.0037584304809570312
    },
    {
        "BLOCK_SIZE_M": 32,
        "BLOCK_SIZE_N": 512,
        "BLOCK_SIZE_K": 256,
        "GROUP_SIZE_M": 8,
        "num_stages": 1,
        "num_warps": 2,
        "compile_time": 19.47420907020569
    },
    {
        "BLOCK_SIZE_M": 32,
        "BLOCK_SIZE_N": 512,
        "BLOCK_SIZE_K": 256,
        "GROUP_SIZE_M": 8,
        "num_stages": 1,
        "num_warps": 4,
        "compile_time": 8.281997203826904
    },
    {
        "BLOCK_SIZE_M": 32,
        "BLOCK_SIZE_N": 512,
        "BLOCK_SIZE_K": 256,
        "GROUP_SIZE_M": 8,
        "num_stages": 1,
        "num_warps": 8,
        "compile_time": 3.0353171825408936
    },
    {
        "BLOCK_SIZE_M": 32,
        "BLOCK_SIZE_N": 512,
        "BLOCK_SIZE_K": 256,
        "GROUP_SIZE_M": 8,
        "num_stages": 1,
        "num_warps": 16,
        "compile_time": 0.0041561126708984375
    },
    {
        "BLOCK_SIZE_M": 32,
        "BLOCK_SIZE_N": 512,
        "BLOCK_SIZE_K": 256,
        "GROUP_SIZE_M": 8,
        "num_stages": 1,
        "num_warps": 32,
        "compile_time": 0.7621555328369141
    },
    {
        "BLOCK_SIZE_M": 32,
        "BLOCK_SIZE_N": 512,
        "BLOCK_SIZE_K": 256,
        "GROUP_SIZE_M": 8,
        "num_stages": 2,
        "num_warps": 2,
        "compile_time": 19.775777339935303
    },
    {
        "BLOCK_SIZE_M": 32,
        "BLOCK_SIZE_N": 512,
        "BLOCK_SIZE_K": 256,
        "GROUP_SIZE_M": 8,
        "num_stages": 2,
        "num_warps": 4,
        "compile_time": 8.258188247680664
    },
    {
        "BLOCK_SIZE_M": 32,
        "BLOCK_SIZE_N": 512,
        "BLOCK_SIZE_K": 256,
        "GROUP_SIZE_M": 8,
        "num_stages": 2,
        "num_warps": 8,
        "compile_time": 3.431511402130127
    },
    {
        "BLOCK_SIZE_M": 32,
        "BLOCK_SIZE_N": 512,
        "BLOCK_SIZE_K": 256,
        "GROUP_SIZE_M": 8,
        "num_stages": 2,
        "num_warps": 16,
        "compile_time": 1.4752681255340576
    },
    {
        "BLOCK_SIZE_M": 32,
        "BLOCK_SIZE_N": 512,
        "BLOCK_SIZE_K": 256,
        "GROUP_SIZE_M": 8,
        "num_stages": 2,
        "num_warps": 32,
        "compile_time": 0.8983078002929688
    },
    {
        "BLOCK_SIZE_M": 32,
        "BLOCK_SIZE_N": 512,
        "BLOCK_SIZE_K": 256,
        "GROUP_SIZE_M": 8,
        "num_stages": 3,
        "num_warps": 2,
        "compile_time": 21.233806610107422
    },
    {
        "BLOCK_SIZE_M": 32,
        "BLOCK_SIZE_N": 512,
        "BLOCK_SIZE_K": 256,
        "GROUP_SIZE_M": 8,
        "num_stages": 3,
        "num_warps": 4,
        "compile_time": 6.0122010707855225
    },
    {
        "BLOCK_SIZE_M": 32,
        "BLOCK_SIZE_N": 512,
        "BLOCK_SIZE_K": 256,
        "GROUP_SIZE_M": 8,
        "num_stages": 3,
        "num_warps": 8,
        "compile_time": 10.806949853897095
    },
    {
        "BLOCK_SIZE_M": 32,
        "BLOCK_SIZE_N": 512,
        "BLOCK_SIZE_K": 256,
        "GROUP_SIZE_M": 8,
        "num_stages": 3,
        "num_warps": 16,
        "compile_time": 2.105452060699463
    },
    {
        "BLOCK_SIZE_M": 32,
        "BLOCK_SIZE_N": 512,
        "BLOCK_SIZE_K": 256,
        "GROUP_SIZE_M": 8,
        "num_stages": 3,
        "num_warps": 32,
        "compile_time": 1.0531163215637207
    },
    {
        "BLOCK_SIZE_M": 32,
        "BLOCK_SIZE_N": 512,
        "BLOCK_SIZE_K": 256,
        "GROUP_SIZE_M": 8,
        "num_stages": 4,
        "num_warps": 2,
        "compile_time": 21.636417865753174
    },
    {
        "BLOCK_SIZE_M": 32,
        "BLOCK_SIZE_N": 512,
        "BLOCK_SIZE_K": 256,
        "GROUP_SIZE_M": 8,
        "num_stages": 4,
        "num_warps": 4,
        "compile_time": 6.511690139770508
    },
    {
        "BLOCK_SIZE_M": 32,
        "BLOCK_SIZE_N": 512,
        "BLOCK_SIZE_K": 256,
        "GROUP_SIZE_M": 8,
        "num_stages": 4,
        "num_warps": 8,
        "compile_time": 11.162724256515503
    },
    {
        "BLOCK_SIZE_M": 32,
        "BLOCK_SIZE_N": 512,
        "BLOCK_SIZE_K": 256,
        "GROUP_SIZE_M": 8,
        "num_stages": 4,
        "num_warps": 16,
        "compile_time": 2.3044185638427734
    },
    {
        "BLOCK_SIZE_M": 32,
        "BLOCK_SIZE_N": 512,
        "BLOCK_SIZE_K": 256,
        "GROUP_SIZE_M": 8,
        "num_stages": 4,
        "num_warps": 32,
        "compile_time": 1.1846072673797607
    },
    {
        "BLOCK_SIZE_M": 32,
        "BLOCK_SIZE_N": 512,
        "BLOCK_SIZE_K": 256,
        "GROUP_SIZE_M": 8,
        "num_stages": 5,
        "num_warps": 2,
        "compile_time": 22.523558855056763
    },
    {
        "BLOCK_SIZE_M": 32,
        "BLOCK_SIZE_N": 512,
        "BLOCK_SIZE_K": 256,
        "GROUP_SIZE_M": 8,
        "num_stages": 5,
        "num_warps": 4,
        "compile_time": 6.748019695281982
    },
    {
        "BLOCK_SIZE_M": 32,
        "BLOCK_SIZE_N": 512,
        "BLOCK_SIZE_K": 256,
        "GROUP_SIZE_M": 8,
        "num_stages": 5,
        "num_warps": 8,
        "compile_time": 11.315329313278198
    },
    {
        "BLOCK_SIZE_M": 32,
        "BLOCK_SIZE_N": 512,
        "BLOCK_SIZE_K": 256,
        "GROUP_SIZE_M": 8,
        "num_stages": 5,
        "num_warps": 16,
        "compile_time": 2.4982879161834717
    },
    {
        "BLOCK_SIZE_M": 32,
        "BLOCK_SIZE_N": 512,
        "BLOCK_SIZE_K": 256,
        "GROUP_SIZE_M": 8,
        "num_stages": 5,
        "num_warps": 32,
        "compile_time": 0.0033156871795654297
    },
    {
        "BLOCK_SIZE_M": 32,
        "BLOCK_SIZE_N": 512,
        "BLOCK_SIZE_K": 256,
        "GROUP_SIZE_M": 8,
        "num_stages": 6,
        "num_warps": 2,
        "compile_time": 23.152201652526855
    },
    {
        "BLOCK_SIZE_M": 32,
        "BLOCK_SIZE_N": 512,
        "BLOCK_SIZE_K": 256,
        "GROUP_SIZE_M": 8,
        "num_stages": 6,
        "num_warps": 4,
        "compile_time": 7.181140661239624
    },
    {
        "BLOCK_SIZE_M": 32,
        "BLOCK_SIZE_N": 512,
        "BLOCK_SIZE_K": 256,
        "GROUP_SIZE_M": 8,
        "num_stages": 6,
        "num_warps": 8,
        "compile_time": 11.14798092842102
    },
    {
        "BLOCK_SIZE_M": 32,
        "BLOCK_SIZE_N": 512,
        "BLOCK_SIZE_K": 256,
        "GROUP_SIZE_M": 8,
        "num_stages": 6,
        "num_warps": 16,
        "compile_time": 2.6334850788116455
    },
    {
        "BLOCK_SIZE_M": 32,
        "BLOCK_SIZE_N": 512,
        "BLOCK_SIZE_K": 256,
        "GROUP_SIZE_M": 8,
        "num_stages": 6,
        "num_warps": 32,
        "compile_time": 1.345700979232788
    },
    {
        "BLOCK_SIZE_M": 32,
        "BLOCK_SIZE_N": 512,
        "BLOCK_SIZE_K": 256,
        "GROUP_SIZE_M": 8,
        "num_stages": 7,
        "num_warps": 2,
        "compile_time": 6.259677171707153
    },
    {
        "BLOCK_SIZE_M": 32,
        "BLOCK_SIZE_N": 512,
        "BLOCK_SIZE_K": 256,
        "GROUP_SIZE_M": 8,
        "num_stages": 7,
        "num_warps": 4,
        "compile_time": 7.757904291152954
    },
    {
        "BLOCK_SIZE_M": 32,
        "BLOCK_SIZE_N": 512,
        "BLOCK_SIZE_K": 256,
        "GROUP_SIZE_M": 8,
        "num_stages": 7,
        "num_warps": 8,
        "compile_time": 11.548167943954468
    },
    {
        "BLOCK_SIZE_M": 32,
        "BLOCK_SIZE_N": 512,
        "BLOCK_SIZE_K": 256,
        "GROUP_SIZE_M": 8,
        "num_stages": 7,
        "num_warps": 16,
        "compile_time": 2.8878862857818604
    },
    {
        "BLOCK_SIZE_M": 32,
        "BLOCK_SIZE_N": 512,
        "BLOCK_SIZE_K": 256,
        "GROUP_SIZE_M": 8,
        "num_stages": 7,
        "num_warps": 32,
        "compile_time": 1.4499154090881348
    },
    {
        "BLOCK_SIZE_M": 32,
        "BLOCK_SIZE_N": 512,
        "BLOCK_SIZE_K": 256,
        "GROUP_SIZE_M": 8,
        "num_stages": 8,
        "num_warps": 2,
        "compile_time": 6.882343769073486
    },
    {
        "BLOCK_SIZE_M": 32,
        "BLOCK_SIZE_N": 512,
        "BLOCK_SIZE_K": 256,
        "GROUP_SIZE_M": 8,
        "num_stages": 8,
        "num_warps": 4,
        "compile_time": 8.093084335327148
    },
    {
        "BLOCK_SIZE_M": 32,
        "BLOCK_SIZE_N": 512,
        "BLOCK_SIZE_K": 256,
        "GROUP_SIZE_M": 8,
        "num_stages": 8,
        "num_warps": 8,
        "compile_time": 11.962297201156616
    },
    {
        "BLOCK_SIZE_M": 32,
        "BLOCK_SIZE_N": 512,
        "BLOCK_SIZE_K": 256,
        "GROUP_SIZE_M": 8,
        "num_stages": 8,
        "num_warps": 16,
        "compile_time": 2.9744133949279785
    },
    {
        "BLOCK_SIZE_M": 32,
        "BLOCK_SIZE_N": 512,
        "BLOCK_SIZE_K": 256,
        "GROUP_SIZE_M": 8,
        "num_stages": 8,
        "num_warps": 32,
        "compile_time": 1.5196387767791748
    },
    {
        "BLOCK_SIZE_M": 32,
        "BLOCK_SIZE_N": 512,
        "BLOCK_SIZE_K": 512,
        "GROUP_SIZE_M": 8,
        "num_stages": 1,
        "num_warps": 2,
        "compile_time": 71.91034603118896
    },
    {
        "BLOCK_SIZE_M": 32,
        "BLOCK_SIZE_N": 512,
        "BLOCK_SIZE_K": 512,
        "GROUP_SIZE_M": 8,
        "num_stages": 1,
        "num_warps": 4,
        "compile_time": 19.53457021713257
    },
    {
        "BLOCK_SIZE_M": 32,
        "BLOCK_SIZE_N": 512,
        "BLOCK_SIZE_K": 512,
        "GROUP_SIZE_M": 8,
        "num_stages": 1,
        "num_warps": 8,
        "compile_time": 8.193086862564087
    },
    {
        "BLOCK_SIZE_M": 32,
        "BLOCK_SIZE_N": 512,
        "BLOCK_SIZE_K": 512,
        "GROUP_SIZE_M": 8,
        "num_stages": 1,
        "num_warps": 16,
        "compile_time": 3.1320900917053223
    },
    {
        "BLOCK_SIZE_M": 32,
        "BLOCK_SIZE_N": 512,
        "BLOCK_SIZE_K": 512,
        "GROUP_SIZE_M": 8,
        "num_stages": 1,
        "num_warps": 32,
        "compile_time": 1.4146819114685059
    },
    {
        "BLOCK_SIZE_M": 32,
        "BLOCK_SIZE_N": 512,
        "BLOCK_SIZE_K": 512,
        "GROUP_SIZE_M": 8,
        "num_stages": 2,
        "num_warps": 2,
        "compile_time": 72.21672749519348
    },
    {
        "BLOCK_SIZE_M": 32,
        "BLOCK_SIZE_N": 512,
        "BLOCK_SIZE_K": 512,
        "GROUP_SIZE_M": 8,
        "num_stages": 2,
        "num_warps": 4,
        "compile_time": 19.901135683059692
    },
    {
        "BLOCK_SIZE_M": 32,
        "BLOCK_SIZE_N": 512,
        "BLOCK_SIZE_K": 512,
        "GROUP_SIZE_M": 8,
        "num_stages": 2,
        "num_warps": 8,
        "compile_time": 8.342010498046875
    },
    {
        "BLOCK_SIZE_M": 32,
        "BLOCK_SIZE_N": 512,
        "BLOCK_SIZE_K": 512,
        "GROUP_SIZE_M": 8,
        "num_stages": 2,
        "num_warps": 16,
        "compile_time": 3.481635808944702
    },
    {
        "BLOCK_SIZE_M": 32,
        "BLOCK_SIZE_N": 512,
        "BLOCK_SIZE_K": 512,
        "GROUP_SIZE_M": 8,
        "num_stages": 2,
        "num_warps": 32,
        "compile_time": 1.5570144653320312
    },
    {
        "BLOCK_SIZE_M": 32,
        "BLOCK_SIZE_N": 512,
        "BLOCK_SIZE_K": 512,
        "GROUP_SIZE_M": 8,
        "num_stages": 3,
        "num_warps": 2,
        "compile_time": 7.688179016113281
    },
    {
        "BLOCK_SIZE_M": 32,
        "BLOCK_SIZE_N": 512,
        "BLOCK_SIZE_K": 512,
        "GROUP_SIZE_M": 8,
        "num_stages": 3,
        "num_warps": 4,
        "compile_time": 20.51410746574402
    },
    {
        "BLOCK_SIZE_M": 32,
        "BLOCK_SIZE_N": 512,
        "BLOCK_SIZE_K": 512,
        "GROUP_SIZE_M": 8,
        "num_stages": 3,
        "num_warps": 8,
        "compile_time": 6.113061428070068
    },
    {
        "BLOCK_SIZE_M": 32,
        "BLOCK_SIZE_N": 512,
        "BLOCK_SIZE_K": 512,
        "GROUP_SIZE_M": 8,
        "num_stages": 3,
        "num_warps": 16,
        "compile_time": 10.385031700134277
    },
    {
        "BLOCK_SIZE_M": 32,
        "BLOCK_SIZE_N": 512,
        "BLOCK_SIZE_K": 512,
        "GROUP_SIZE_M": 8,
        "num_stages": 3,
        "num_warps": 32,
        "compile_time": 2.166372060775757
    },
    {
        "BLOCK_SIZE_M": 32,
        "BLOCK_SIZE_N": 512,
        "BLOCK_SIZE_K": 512,
        "GROUP_SIZE_M": 8,
        "num_stages": 4,
        "num_warps": 2,
        "compile_time": 9.156575202941895
    },
    {
        "BLOCK_SIZE_M": 32,
        "BLOCK_SIZE_N": 512,
        "BLOCK_SIZE_K": 512,
        "GROUP_SIZE_M": 8,
        "num_stages": 4,
        "num_warps": 4,
        "compile_time": 21.118603467941284
    },
    {
        "BLOCK_SIZE_M": 32,
        "BLOCK_SIZE_N": 512,
        "BLOCK_SIZE_K": 512,
        "GROUP_SIZE_M": 8,
        "num_stages": 4,
        "num_warps": 8,
        "compile_time": 6.575196266174316
    },
    {
        "BLOCK_SIZE_M": 32,
        "BLOCK_SIZE_N": 512,
        "BLOCK_SIZE_K": 512,
        "GROUP_SIZE_M": 8,
        "num_stages": 4,
        "num_warps": 16,
        "compile_time": 11.040928840637207
    },
    {
        "BLOCK_SIZE_M": 32,
        "BLOCK_SIZE_N": 512,
        "BLOCK_SIZE_K": 512,
        "GROUP_SIZE_M": 8,
        "num_stages": 4,
        "num_warps": 32,
        "compile_time": 2.3605270385742188
    },
    {
        "BLOCK_SIZE_M": 32,
        "BLOCK_SIZE_N": 512,
        "BLOCK_SIZE_K": 512,
        "GROUP_SIZE_M": 8,
        "num_stages": 5,
        "num_warps": 2,
        "compile_time": 10.873060464859009
    },
    {
        "BLOCK_SIZE_M": 32,
        "BLOCK_SIZE_N": 512,
        "BLOCK_SIZE_K": 512,
        "GROUP_SIZE_M": 8,
        "num_stages": 5,
        "num_warps": 4,
        "compile_time": 22.18461585044861
    },
    {
        "BLOCK_SIZE_M": 32,
        "BLOCK_SIZE_N": 512,
        "BLOCK_SIZE_K": 512,
        "GROUP_SIZE_M": 8,
        "num_stages": 5,
        "num_warps": 8,
        "compile_time": 7.103342533111572
    },
    {
        "BLOCK_SIZE_M": 32,
        "BLOCK_SIZE_N": 512,
        "BLOCK_SIZE_K": 512,
        "GROUP_SIZE_M": 8,
        "num_stages": 5,
        "num_warps": 16,
        "compile_time": 11.462900400161743
    },
    {
        "BLOCK_SIZE_M": 32,
        "BLOCK_SIZE_N": 512,
        "BLOCK_SIZE_K": 512,
        "GROUP_SIZE_M": 8,
        "num_stages": 5,
        "num_warps": 32,
        "compile_time": 2.5852293968200684
    },
    {
        "BLOCK_SIZE_M": 32,
        "BLOCK_SIZE_N": 512,
        "BLOCK_SIZE_K": 512,
        "GROUP_SIZE_M": 8,
        "num_stages": 6,
        "num_warps": 2,
        "compile_time": 12.757179975509644
    },
    {
        "BLOCK_SIZE_M": 32,
        "BLOCK_SIZE_N": 512,
        "BLOCK_SIZE_K": 512,
        "GROUP_SIZE_M": 8,
        "num_stages": 6,
        "num_warps": 4,
        "compile_time": 23.05752921104431
    },
    {
        "BLOCK_SIZE_M": 32,
        "BLOCK_SIZE_N": 512,
        "BLOCK_SIZE_K": 512,
        "GROUP_SIZE_M": 8,
        "num_stages": 6,
        "num_warps": 8,
        "compile_time": 7.513412714004517
    },
    {
        "BLOCK_SIZE_M": 32,
        "BLOCK_SIZE_N": 512,
        "BLOCK_SIZE_K": 512,
        "GROUP_SIZE_M": 8,
        "num_stages": 6,
        "num_warps": 16,
        "compile_time": 11.757061958312988
    },
    {
        "BLOCK_SIZE_M": 32,
        "BLOCK_SIZE_N": 512,
        "BLOCK_SIZE_K": 512,
        "GROUP_SIZE_M": 8,
        "num_stages": 6,
        "num_warps": 32,
        "compile_time": 0.004041433334350586
    },
    {
        "BLOCK_SIZE_M": 32,
        "BLOCK_SIZE_N": 512,
        "BLOCK_SIZE_K": 512,
        "GROUP_SIZE_M": 8,
        "num_stages": 7,
        "num_warps": 2,
        "compile_time": 14.412825107574463
    },
    {
        "BLOCK_SIZE_M": 32,
        "BLOCK_SIZE_N": 512,
        "BLOCK_SIZE_K": 512,
        "GROUP_SIZE_M": 8,
        "num_stages": 7,
        "num_warps": 4,
        "compile_time": 6.2421252727508545
    },
    {
        "BLOCK_SIZE_M": 32,
        "BLOCK_SIZE_N": 512,
        "BLOCK_SIZE_K": 512,
        "GROUP_SIZE_M": 8,
        "num_stages": 7,
        "num_warps": 8,
        "compile_time": 7.934092283248901
    },
    {
        "BLOCK_SIZE_M": 32,
        "BLOCK_SIZE_N": 512,
        "BLOCK_SIZE_K": 512,
        "GROUP_SIZE_M": 8,
        "num_stages": 7,
        "num_warps": 16,
        "compile_time": 12.055264949798584
    },
    {
        "BLOCK_SIZE_M": 32,
        "BLOCK_SIZE_N": 512,
        "BLOCK_SIZE_K": 512,
        "GROUP_SIZE_M": 8,
        "num_stages": 7,
        "num_warps": 32,
        "compile_time": 0.003931760787963867
    },
    {
        "BLOCK_SIZE_M": 32,
        "BLOCK_SIZE_N": 512,
        "BLOCK_SIZE_K": 512,
        "GROUP_SIZE_M": 8,
        "num_stages": 8,
        "num_warps": 2,
        "compile_time": 16.557751655578613
    },
    {
        "BLOCK_SIZE_M": 32,
        "BLOCK_SIZE_N": 512,
        "BLOCK_SIZE_K": 512,
        "GROUP_SIZE_M": 8,
        "num_stages": 8,
        "num_warps": 4,
        "compile_time": 7.1830153465271
    },
    {
        "BLOCK_SIZE_M": 32,
        "BLOCK_SIZE_N": 512,
        "BLOCK_SIZE_K": 512,
        "GROUP_SIZE_M": 8,
        "num_stages": 8,
        "num_warps": 8,
        "compile_time": 8.477731704711914
    },
    {
        "BLOCK_SIZE_M": 32,
        "BLOCK_SIZE_N": 512,
        "BLOCK_SIZE_K": 512,
        "GROUP_SIZE_M": 8,
        "num_stages": 8,
        "num_warps": 16,
        "compile_time": 12.22136378288269
    },
    {
        "BLOCK_SIZE_M": 32,
        "BLOCK_SIZE_N": 512,
        "BLOCK_SIZE_K": 512,
        "GROUP_SIZE_M": 8,
        "num_stages": 8,
        "num_warps": 32,
        "compile_time": 3.1876800060272217
    },
    {
        "BLOCK_SIZE_M": 64,
        "BLOCK_SIZE_N": 16,
        "BLOCK_SIZE_K": 256,
        "GROUP_SIZE_M": 8,
        "num_stages": 6,
        "num_warps": 2,
        "compile_time": 2.5092861652374268
    },
    {
        "BLOCK_SIZE_M": 64,
        "BLOCK_SIZE_N": 16,
        "BLOCK_SIZE_K": 256,
        "GROUP_SIZE_M": 8,
        "num_stages": 6,
        "num_warps": 4,
        "compile_time": 1.248713731765747
    },
    {
        "BLOCK_SIZE_M": 64,
        "BLOCK_SIZE_N": 16,
        "BLOCK_SIZE_K": 256,
        "GROUP_SIZE_M": 8,
        "num_stages": 6,
        "num_warps": 8,
        "compile_time": 0.8042521476745605
    },
    {
        "BLOCK_SIZE_M": 64,
        "BLOCK_SIZE_N": 16,
        "BLOCK_SIZE_K": 256,
        "GROUP_SIZE_M": 8,
        "num_stages": 6,
        "num_warps": 16,
        "compile_time": 0.6467955112457275
    },
    {
        "BLOCK_SIZE_M": 64,
        "BLOCK_SIZE_N": 16,
        "BLOCK_SIZE_K": 256,
        "GROUP_SIZE_M": 8,
        "num_stages": 6,
        "num_warps": 32,
        "compile_time": 0.5736842155456543
    },
    {
        "BLOCK_SIZE_M": 64,
        "BLOCK_SIZE_N": 16,
        "BLOCK_SIZE_K": 256,
        "GROUP_SIZE_M": 8,
        "num_stages": 7,
        "num_warps": 2,
        "compile_time": 2.628352642059326
    },
    {
        "BLOCK_SIZE_M": 64,
        "BLOCK_SIZE_N": 16,
        "BLOCK_SIZE_K": 256,
        "GROUP_SIZE_M": 8,
        "num_stages": 7,
        "num_warps": 4,
        "compile_time": 1.318575143814087
    },
    {
        "BLOCK_SIZE_M": 64,
        "BLOCK_SIZE_N": 16,
        "BLOCK_SIZE_K": 256,
        "GROUP_SIZE_M": 8,
        "num_stages": 7,
        "num_warps": 8,
        "compile_time": 0.8387961387634277
    },
    {
        "BLOCK_SIZE_M": 64,
        "BLOCK_SIZE_N": 16,
        "BLOCK_SIZE_K": 256,
        "GROUP_SIZE_M": 8,
        "num_stages": 7,
        "num_warps": 16,
        "compile_time": 0.6643538475036621
    },
    {
        "BLOCK_SIZE_M": 64,
        "BLOCK_SIZE_N": 16,
        "BLOCK_SIZE_K": 256,
        "GROUP_SIZE_M": 8,
        "num_stages": 7,
        "num_warps": 32,
        "compile_time": 0.6028916835784912
    },
    {
        "BLOCK_SIZE_M": 64,
        "BLOCK_SIZE_N": 16,
        "BLOCK_SIZE_K": 256,
        "GROUP_SIZE_M": 8,
        "num_stages": 8,
        "num_warps": 2,
        "compile_time": 2.865304708480835
    },
    {
        "BLOCK_SIZE_M": 64,
        "BLOCK_SIZE_N": 16,
        "BLOCK_SIZE_K": 256,
        "GROUP_SIZE_M": 8,
        "num_stages": 8,
        "num_warps": 4,
        "compile_time": 1.3861730098724365
    },
    {
        "BLOCK_SIZE_M": 64,
        "BLOCK_SIZE_N": 16,
        "BLOCK_SIZE_K": 256,
        "GROUP_SIZE_M": 8,
        "num_stages": 8,
        "num_warps": 8,
        "compile_time": 0.854896068572998
    },
    {
        "BLOCK_SIZE_M": 64,
        "BLOCK_SIZE_N": 16,
        "BLOCK_SIZE_K": 256,
        "GROUP_SIZE_M": 8,
        "num_stages": 8,
        "num_warps": 16,
        "compile_time": 0.6707277297973633
    },
    {
        "BLOCK_SIZE_M": 64,
        "BLOCK_SIZE_N": 16,
        "BLOCK_SIZE_K": 256,
        "GROUP_SIZE_M": 8,
        "num_stages": 8,
        "num_warps": 32,
        "compile_time": 0.5936086177825928
    },
    {
        "BLOCK_SIZE_M": 64,
        "BLOCK_SIZE_N": 16,
        "BLOCK_SIZE_K": 512,
        "GROUP_SIZE_M": 8,
        "num_stages": 3,
        "num_warps": 2,
        "compile_time": 11.272576808929443
    },
    {
        "BLOCK_SIZE_M": 64,
        "BLOCK_SIZE_N": 16,
        "BLOCK_SIZE_K": 512,
        "GROUP_SIZE_M": 8,
        "num_stages": 4,
        "num_warps": 2,
        "compile_time": 11.440871238708496
    },
    {
        "BLOCK_SIZE_M": 64,
        "BLOCK_SIZE_N": 16,
        "BLOCK_SIZE_K": 512,
        "GROUP_SIZE_M": 8,
        "num_stages": 4,
        "num_warps": 4,
        "compile_time": 2.2554028034210205
    },
    {
        "BLOCK_SIZE_M": 64,
        "BLOCK_SIZE_N": 16,
        "BLOCK_SIZE_K": 512,
        "GROUP_SIZE_M": 8,
        "num_stages": 4,
        "num_warps": 8,
        "compile_time": 1.1419026851654053
    },
    {
        "BLOCK_SIZE_M": 64,
        "BLOCK_SIZE_N": 16,
        "BLOCK_SIZE_K": 512,
        "GROUP_SIZE_M": 8,
        "num_stages": 4,
        "num_warps": 16,
        "compile_time": 0.8211486339569092
    },
    {
        "BLOCK_SIZE_M": 64,
        "BLOCK_SIZE_N": 16,
        "BLOCK_SIZE_K": 512,
        "GROUP_SIZE_M": 8,
        "num_stages": 4,
        "num_warps": 32,
        "compile_time": 0.7219150066375732
    },
    {
        "BLOCK_SIZE_M": 64,
        "BLOCK_SIZE_N": 16,
        "BLOCK_SIZE_K": 512,
        "GROUP_SIZE_M": 8,
        "num_stages": 5,
        "num_warps": 2,
        "compile_time": 11.603263139724731
    },
    {
        "BLOCK_SIZE_M": 64,
        "BLOCK_SIZE_N": 16,
        "BLOCK_SIZE_K": 512,
        "GROUP_SIZE_M": 8,
        "num_stages": 5,
        "num_warps": 4,
        "compile_time": 2.3864846229553223
    },
    {
        "BLOCK_SIZE_M": 64,
        "BLOCK_SIZE_N": 16,
        "BLOCK_SIZE_K": 512,
        "GROUP_SIZE_M": 8,
        "num_stages": 5,
        "num_warps": 8,
        "compile_time": 1.2295730113983154
    },
    {
        "BLOCK_SIZE_M": 64,
        "BLOCK_SIZE_N": 16,
        "BLOCK_SIZE_K": 512,
        "GROUP_SIZE_M": 8,
        "num_stages": 5,
        "num_warps": 16,
        "compile_time": 0.8656914234161377
    },
    {
        "BLOCK_SIZE_M": 64,
        "BLOCK_SIZE_N": 16,
        "BLOCK_SIZE_K": 512,
        "GROUP_SIZE_M": 8,
        "num_stages": 5,
        "num_warps": 32,
        "compile_time": 0.7194702625274658
    },
    {
        "BLOCK_SIZE_M": 64,
        "BLOCK_SIZE_N": 16,
        "BLOCK_SIZE_K": 512,
        "GROUP_SIZE_M": 8,
        "num_stages": 6,
        "num_warps": 2,
        "compile_time": 11.981325387954712
    },
    {
        "BLOCK_SIZE_M": 64,
        "BLOCK_SIZE_N": 16,
        "BLOCK_SIZE_K": 512,
        "GROUP_SIZE_M": 8,
        "num_stages": 6,
        "num_warps": 4,
        "compile_time": 2.5516951084136963
    },
    {
        "BLOCK_SIZE_M": 64,
        "BLOCK_SIZE_N": 16,
        "BLOCK_SIZE_K": 512,
        "GROUP_SIZE_M": 8,
        "num_stages": 6,
        "num_warps": 8,
        "compile_time": 1.310072660446167
    },
    {
        "BLOCK_SIZE_M": 64,
        "BLOCK_SIZE_N": 16,
        "BLOCK_SIZE_K": 512,
        "GROUP_SIZE_M": 8,
        "num_stages": 6,
        "num_warps": 16,
        "compile_time": 0.9272265434265137
    },
    {
        "BLOCK_SIZE_M": 64,
        "BLOCK_SIZE_N": 16,
        "BLOCK_SIZE_K": 512,
        "GROUP_SIZE_M": 8,
        "num_stages": 6,
        "num_warps": 32,
        "compile_time": 0.7645478248596191
    },
    {
        "BLOCK_SIZE_M": 64,
        "BLOCK_SIZE_N": 16,
        "BLOCK_SIZE_K": 512,
        "GROUP_SIZE_M": 8,
        "num_stages": 7,
        "num_warps": 2,
        "compile_time": 11.992002010345459
    },
    {
        "BLOCK_SIZE_M": 64,
        "BLOCK_SIZE_N": 16,
        "BLOCK_SIZE_K": 512,
        "GROUP_SIZE_M": 8,
        "num_stages": 7,
        "num_warps": 4,
        "compile_time": 2.703131914138794
    },
    {
        "BLOCK_SIZE_M": 64,
        "BLOCK_SIZE_N": 16,
        "BLOCK_SIZE_K": 512,
        "GROUP_SIZE_M": 8,
        "num_stages": 7,
        "num_warps": 8,
        "compile_time": 1.3845505714416504
    },
    {
        "BLOCK_SIZE_M": 64,
        "BLOCK_SIZE_N": 16,
        "BLOCK_SIZE_K": 512,
        "GROUP_SIZE_M": 8,
        "num_stages": 7,
        "num_warps": 16,
        "compile_time": 0.9643709659576416
    },
    {
        "BLOCK_SIZE_M": 64,
        "BLOCK_SIZE_N": 16,
        "BLOCK_SIZE_K": 512,
        "GROUP_SIZE_M": 8,
        "num_stages": 7,
        "num_warps": 32,
        "compile_time": 0.80295729637146
    },
    {
        "BLOCK_SIZE_M": 64,
        "BLOCK_SIZE_N": 16,
        "BLOCK_SIZE_K": 512,
        "GROUP_SIZE_M": 8,
        "num_stages": 8,
        "num_warps": 2,
        "compile_time": 12.215517520904541
    },
    {
        "BLOCK_SIZE_M": 64,
        "BLOCK_SIZE_N": 16,
        "BLOCK_SIZE_K": 512,
        "GROUP_SIZE_M": 8,
        "num_stages": 8,
        "num_warps": 4,
        "compile_time": 2.8636763095855713
    },
    {
        "BLOCK_SIZE_M": 64,
        "BLOCK_SIZE_N": 16,
        "BLOCK_SIZE_K": 512,
        "GROUP_SIZE_M": 8,
        "num_stages": 8,
        "num_warps": 8,
        "compile_time": 1.5229592323303223
    },
    {
        "BLOCK_SIZE_M": 64,
        "BLOCK_SIZE_N": 16,
        "BLOCK_SIZE_K": 512,
        "GROUP_SIZE_M": 8,
        "num_stages": 8,
        "num_warps": 16,
        "compile_time": 1.0130548477172852
    },
    {
        "BLOCK_SIZE_M": 64,
        "BLOCK_SIZE_N": 16,
        "BLOCK_SIZE_K": 512,
        "GROUP_SIZE_M": 8,
        "num_stages": 8,
        "num_warps": 32,
        "compile_time": 0.8212668895721436
    },
    {
        "BLOCK_SIZE_M": 64,
        "BLOCK_SIZE_N": 32,
        "BLOCK_SIZE_K": 128,
        "GROUP_SIZE_M": 8,
        "num_stages": 8,
        "num_warps": 2,
        "compile_time": 1.5176222324371338
    },
    {
        "BLOCK_SIZE_M": 64,
        "BLOCK_SIZE_N": 32,
        "BLOCK_SIZE_K": 128,
        "GROUP_SIZE_M": 8,
        "num_stages": 8,
        "num_warps": 4,
        "compile_time": 0.9755327701568604
    },
    {
        "BLOCK_SIZE_M": 64,
        "BLOCK_SIZE_N": 32,
        "BLOCK_SIZE_K": 128,
        "GROUP_SIZE_M": 8,
        "num_stages": 8,
        "num_warps": 8,
        "compile_time": 0.6599905490875244
    },
    {
        "BLOCK_SIZE_M": 64,
        "BLOCK_SIZE_N": 32,
        "BLOCK_SIZE_K": 128,
        "GROUP_SIZE_M": 8,
        "num_stages": 8,
        "num_warps": 16,
        "compile_time": 0.5470643043518066
    },
    {
        "BLOCK_SIZE_M": 64,
        "BLOCK_SIZE_N": 32,
        "BLOCK_SIZE_K": 128,
        "GROUP_SIZE_M": 8,
        "num_stages": 8,
        "num_warps": 32,
        "compile_time": 0.5052566528320312
    },
    {
        "BLOCK_SIZE_M": 64,
        "BLOCK_SIZE_N": 32,
        "BLOCK_SIZE_K": 256,
        "GROUP_SIZE_M": 8,
        "num_stages": 5,
        "num_warps": 2,
        "compile_time": 2.84952974319458
    },
    {
        "BLOCK_SIZE_M": 64,
        "BLOCK_SIZE_N": 32,
        "BLOCK_SIZE_K": 256,
        "GROUP_SIZE_M": 8,
        "num_stages": 5,
        "num_warps": 4,
        "compile_time": 1.2948625087738037
    },
    {
        "BLOCK_SIZE_M": 64,
        "BLOCK_SIZE_N": 32,
        "BLOCK_SIZE_K": 256,
        "GROUP_SIZE_M": 8,
        "num_stages": 5,
        "num_warps": 8,
        "compile_time": 0.843512773513794
    },
    {
        "BLOCK_SIZE_M": 64,
        "BLOCK_SIZE_N": 32,
        "BLOCK_SIZE_K": 256,
        "GROUP_SIZE_M": 8,
        "num_stages": 5,
        "num_warps": 16,
        "compile_time": 0.6302247047424316
    },
    {
        "BLOCK_SIZE_M": 64,
        "BLOCK_SIZE_N": 32,
        "BLOCK_SIZE_K": 256,
        "GROUP_SIZE_M": 8,
        "num_stages": 5,
        "num_warps": 32,
        "compile_time": 0.5588610172271729
    },
    {
        "BLOCK_SIZE_M": 64,
        "BLOCK_SIZE_N": 32,
        "BLOCK_SIZE_K": 256,
        "GROUP_SIZE_M": 8,
        "num_stages": 6,
        "num_warps": 2,
        "compile_time": 3.0645225048065186
    },
    {
        "BLOCK_SIZE_M": 64,
        "BLOCK_SIZE_N": 32,
        "BLOCK_SIZE_K": 256,
        "GROUP_SIZE_M": 8,
        "num_stages": 6,
        "num_warps": 4,
        "compile_time": 1.4073436260223389
    },
    {
        "BLOCK_SIZE_M": 64,
        "BLOCK_SIZE_N": 32,
        "BLOCK_SIZE_K": 256,
        "GROUP_SIZE_M": 8,
        "num_stages": 6,
        "num_warps": 8,
        "compile_time": 0.8885221481323242
    },
    {
        "BLOCK_SIZE_M": 64,
        "BLOCK_SIZE_N": 32,
        "BLOCK_SIZE_K": 256,
        "GROUP_SIZE_M": 8,
        "num_stages": 6,
        "num_warps": 16,
        "compile_time": 0.6661932468414307
    },
    {
        "BLOCK_SIZE_M": 64,
        "BLOCK_SIZE_N": 32,
        "BLOCK_SIZE_K": 256,
        "GROUP_SIZE_M": 8,
        "num_stages": 6,
        "num_warps": 32,
        "compile_time": 0.5714559555053711
    },
    {
        "BLOCK_SIZE_M": 64,
        "BLOCK_SIZE_N": 32,
        "BLOCK_SIZE_K": 256,
        "GROUP_SIZE_M": 8,
        "num_stages": 7,
        "num_warps": 2,
        "compile_time": 3.2576169967651367
    },
    {
        "BLOCK_SIZE_M": 64,
        "BLOCK_SIZE_N": 32,
        "BLOCK_SIZE_K": 256,
        "GROUP_SIZE_M": 8,
        "num_stages": 7,
        "num_warps": 4,
        "compile_time": 1.4994113445281982
    },
    {
        "BLOCK_SIZE_M": 64,
        "BLOCK_SIZE_N": 32,
        "BLOCK_SIZE_K": 256,
        "GROUP_SIZE_M": 8,
        "num_stages": 7,
        "num_warps": 8,
        "compile_time": 0.9303851127624512
    },
    {
        "BLOCK_SIZE_M": 64,
        "BLOCK_SIZE_N": 32,
        "BLOCK_SIZE_K": 256,
        "GROUP_SIZE_M": 8,
        "num_stages": 7,
        "num_warps": 16,
        "compile_time": 0.6954259872436523
    },
    {
        "BLOCK_SIZE_M": 64,
        "BLOCK_SIZE_N": 32,
        "BLOCK_SIZE_K": 256,
        "GROUP_SIZE_M": 8,
        "num_stages": 7,
        "num_warps": 32,
        "compile_time": 0.5958495140075684
    },
    {
        "BLOCK_SIZE_M": 64,
        "BLOCK_SIZE_N": 32,
        "BLOCK_SIZE_K": 256,
        "GROUP_SIZE_M": 8,
        "num_stages": 8,
        "num_warps": 2,
        "compile_time": 3.353811264038086
    },
    {
        "BLOCK_SIZE_M": 64,
        "BLOCK_SIZE_N": 32,
        "BLOCK_SIZE_K": 256,
        "GROUP_SIZE_M": 8,
        "num_stages": 8,
        "num_warps": 4,
        "compile_time": 1.5867030620574951
    },
    {
        "BLOCK_SIZE_M": 64,
        "BLOCK_SIZE_N": 32,
        "BLOCK_SIZE_K": 256,
        "GROUP_SIZE_M": 8,
        "num_stages": 8,
        "num_warps": 8,
        "compile_time": 0.9978981018066406
    },
    {
        "BLOCK_SIZE_M": 64,
        "BLOCK_SIZE_N": 32,
        "BLOCK_SIZE_K": 256,
        "GROUP_SIZE_M": 8,
        "num_stages": 8,
        "num_warps": 16,
        "compile_time": 0.7416808605194092
    },
    {
        "BLOCK_SIZE_M": 64,
        "BLOCK_SIZE_N": 32,
        "BLOCK_SIZE_K": 256,
        "GROUP_SIZE_M": 8,
        "num_stages": 8,
        "num_warps": 32,
        "compile_time": 0.625633716583252
    },
    {
        "BLOCK_SIZE_M": 64,
        "BLOCK_SIZE_N": 32,
        "BLOCK_SIZE_K": 512,
        "GROUP_SIZE_M": 8,
        "num_stages": 3,
        "num_warps": 2,
        "compile_time": 13.116589546203613
    },
    {
        "BLOCK_SIZE_M": 64,
        "BLOCK_SIZE_N": 32,
        "BLOCK_SIZE_K": 512,
        "GROUP_SIZE_M": 8,
        "num_stages": 3,
        "num_warps": 4,
        "compile_time": 2.5797946453094482
    },
    {
        "BLOCK_SIZE_M": 64,
        "BLOCK_SIZE_N": 32,
        "BLOCK_SIZE_K": 512,
        "GROUP_SIZE_M": 8,
        "num_stages": 3,
        "num_warps": 8,
        "compile_time": 1.18058180809021
    },
    {
        "BLOCK_SIZE_M": 64,
        "BLOCK_SIZE_N": 32,
        "BLOCK_SIZE_K": 512,
        "GROUP_SIZE_M": 8,
        "num_stages": 3,
        "num_warps": 16,
        "compile_time": 0.8070566654205322
    },
    {
        "BLOCK_SIZE_M": 64,
        "BLOCK_SIZE_N": 32,
        "BLOCK_SIZE_K": 512,
        "GROUP_SIZE_M": 8,
        "num_stages": 3,
        "num_warps": 32,
        "compile_time": 0.7025654315948486
    },
    {
        "BLOCK_SIZE_M": 64,
        "BLOCK_SIZE_N": 32,
        "BLOCK_SIZE_K": 512,
        "GROUP_SIZE_M": 8,
        "num_stages": 4,
        "num_warps": 2,
        "compile_time": 13.34416389465332
    },
    {
        "BLOCK_SIZE_M": 64,
        "BLOCK_SIZE_N": 32,
        "BLOCK_SIZE_K": 512,
        "GROUP_SIZE_M": 8,
        "num_stages": 4,
        "num_warps": 4,
        "compile_time": 2.7847018241882324
    },
    {
        "BLOCK_SIZE_M": 64,
        "BLOCK_SIZE_N": 32,
        "BLOCK_SIZE_K": 512,
        "GROUP_SIZE_M": 8,
        "num_stages": 4,
        "num_warps": 8,
        "compile_time": 1.2807528972625732
    },
    {
        "BLOCK_SIZE_M": 64,
        "BLOCK_SIZE_N": 32,
        "BLOCK_SIZE_K": 512,
        "GROUP_SIZE_M": 8,
        "num_stages": 4,
        "num_warps": 16,
        "compile_time": 0.8729515075683594
    },
    {
        "BLOCK_SIZE_M": 64,
        "BLOCK_SIZE_N": 32,
        "BLOCK_SIZE_K": 512,
        "GROUP_SIZE_M": 8,
        "num_stages": 4,
        "num_warps": 32,
        "compile_time": 0.7328903675079346
    },
    {
        "BLOCK_SIZE_M": 64,
        "BLOCK_SIZE_N": 32,
        "BLOCK_SIZE_K": 512,
        "GROUP_SIZE_M": 8,
        "num_stages": 5,
        "num_warps": 2,
        "compile_time": 13.77280330657959
    },
    {
        "BLOCK_SIZE_M": 64,
        "BLOCK_SIZE_N": 32,
        "BLOCK_SIZE_K": 512,
        "GROUP_SIZE_M": 8,
        "num_stages": 5,
        "num_warps": 4,
        "compile_time": 2.9172203540802
    },
    {
        "BLOCK_SIZE_M": 64,
        "BLOCK_SIZE_N": 32,
        "BLOCK_SIZE_K": 512,
        "GROUP_SIZE_M": 8,
        "num_stages": 5,
        "num_warps": 8,
        "compile_time": 1.3753304481506348
    },
    {
        "BLOCK_SIZE_M": 64,
        "BLOCK_SIZE_N": 32,
        "BLOCK_SIZE_K": 512,
        "GROUP_SIZE_M": 8,
        "num_stages": 5,
        "num_warps": 16,
        "compile_time": 0.9261772632598877
    },
    {
        "BLOCK_SIZE_M": 64,
        "BLOCK_SIZE_N": 32,
        "BLOCK_SIZE_K": 512,
        "GROUP_SIZE_M": 8,
        "num_stages": 5,
        "num_warps": 32,
        "compile_time": 0.7466104030609131
    },
    {
        "BLOCK_SIZE_M": 64,
        "BLOCK_SIZE_N": 32,
        "BLOCK_SIZE_K": 512,
        "GROUP_SIZE_M": 8,
        "num_stages": 6,
        "num_warps": 2,
        "compile_time": 13.711723804473877
    },
    {
        "BLOCK_SIZE_M": 64,
        "BLOCK_SIZE_N": 32,
        "BLOCK_SIZE_K": 512,
        "GROUP_SIZE_M": 8,
        "num_stages": 6,
        "num_warps": 4,
        "compile_time": 3.087937831878662
    },
    {
        "BLOCK_SIZE_M": 64,
        "BLOCK_SIZE_N": 32,
        "BLOCK_SIZE_K": 512,
        "GROUP_SIZE_M": 8,
        "num_stages": 6,
        "num_warps": 8,
        "compile_time": 1.4776341915130615
    },
    {
        "BLOCK_SIZE_M": 64,
        "BLOCK_SIZE_N": 32,
        "BLOCK_SIZE_K": 512,
        "GROUP_SIZE_M": 8,
        "num_stages": 6,
        "num_warps": 16,
        "compile_time": 0.980748176574707
    },
    {
        "BLOCK_SIZE_M": 64,
        "BLOCK_SIZE_N": 32,
        "BLOCK_SIZE_K": 512,
        "GROUP_SIZE_M": 8,
        "num_stages": 6,
        "num_warps": 32,
        "compile_time": 0.7933139801025391
    },
    {
        "BLOCK_SIZE_M": 64,
        "BLOCK_SIZE_N": 32,
        "BLOCK_SIZE_K": 512,
        "GROUP_SIZE_M": 8,
        "num_stages": 7,
        "num_warps": 2,
        "compile_time": 14.108096837997437
    },
    {
        "BLOCK_SIZE_M": 64,
        "BLOCK_SIZE_N": 32,
        "BLOCK_SIZE_K": 512,
        "GROUP_SIZE_M": 8,
        "num_stages": 7,
        "num_warps": 4,
        "compile_time": 3.3146398067474365
    },
    {
        "BLOCK_SIZE_M": 64,
        "BLOCK_SIZE_N": 32,
        "BLOCK_SIZE_K": 512,
        "GROUP_SIZE_M": 8,
        "num_stages": 7,
        "num_warps": 8,
        "compile_time": 1.6282124519348145
    },
    {
        "BLOCK_SIZE_M": 64,
        "BLOCK_SIZE_N": 32,
        "BLOCK_SIZE_K": 512,
        "GROUP_SIZE_M": 8,
        "num_stages": 7,
        "num_warps": 16,
        "compile_time": 1.043004035949707
    },
    {
        "BLOCK_SIZE_M": 64,
        "BLOCK_SIZE_N": 32,
        "BLOCK_SIZE_K": 512,
        "GROUP_SIZE_M": 8,
        "num_stages": 7,
        "num_warps": 32,
        "compile_time": 0.8132801055908203
    },
    {
        "BLOCK_SIZE_M": 64,
        "BLOCK_SIZE_N": 32,
        "BLOCK_SIZE_K": 512,
        "GROUP_SIZE_M": 8,
        "num_stages": 8,
        "num_warps": 2,
        "compile_time": 14.196133375167847
    },
    {
        "BLOCK_SIZE_M": 64,
        "BLOCK_SIZE_N": 32,
        "BLOCK_SIZE_K": 512,
        "GROUP_SIZE_M": 8,
        "num_stages": 8,
        "num_warps": 4,
        "compile_time": 3.4274423122406006
    },
    {
        "BLOCK_SIZE_M": 64,
        "BLOCK_SIZE_N": 32,
        "BLOCK_SIZE_K": 512,
        "GROUP_SIZE_M": 8,
        "num_stages": 8,
        "num_warps": 8,
        "compile_time": 1.6580100059509277
    },
    {
        "BLOCK_SIZE_M": 64,
        "BLOCK_SIZE_N": 32,
        "BLOCK_SIZE_K": 512,
        "GROUP_SIZE_M": 8,
        "num_stages": 8,
        "num_warps": 16,
        "compile_time": 1.067608118057251
    },
    {
        "BLOCK_SIZE_M": 64,
        "BLOCK_SIZE_N": 32,
        "BLOCK_SIZE_K": 512,
        "GROUP_SIZE_M": 8,
        "num_stages": 8,
        "num_warps": 32,
        "compile_time": 0.8554739952087402
    },
    {
        "BLOCK_SIZE_M": 64,
        "BLOCK_SIZE_N": 64,
        "BLOCK_SIZE_K": 128,
        "GROUP_SIZE_M": 8,
        "num_stages": 7,
        "num_warps": 2,
        "compile_time": 1.8903591632843018
    },
    {
        "BLOCK_SIZE_M": 64,
        "BLOCK_SIZE_N": 64,
        "BLOCK_SIZE_K": 128,
        "GROUP_SIZE_M": 8,
        "num_stages": 7,
        "num_warps": 4,
        "compile_time": 1.1030895709991455
    },
    {
        "BLOCK_SIZE_M": 64,
        "BLOCK_SIZE_N": 64,
        "BLOCK_SIZE_K": 128,
        "GROUP_SIZE_M": 8,
        "num_stages": 7,
        "num_warps": 8,
        "compile_time": 0.7772159576416016
    },
    {
        "BLOCK_SIZE_M": 64,
        "BLOCK_SIZE_N": 64,
        "BLOCK_SIZE_K": 128,
        "GROUP_SIZE_M": 8,
        "num_stages": 7,
        "num_warps": 16,
        "compile_time": 0.5831782817840576
    },
    {
        "BLOCK_SIZE_M": 64,
        "BLOCK_SIZE_N": 64,
        "BLOCK_SIZE_K": 128,
        "GROUP_SIZE_M": 8,
        "num_stages": 7,
        "num_warps": 32,
        "compile_time": 0.5004794597625732
    },
    {
        "BLOCK_SIZE_M": 64,
        "BLOCK_SIZE_N": 64,
        "BLOCK_SIZE_K": 128,
        "GROUP_SIZE_M": 8,
        "num_stages": 8,
        "num_warps": 2,
        "compile_time": 2.0402820110321045
    },
    {
        "BLOCK_SIZE_M": 64,
        "BLOCK_SIZE_N": 64,
        "BLOCK_SIZE_K": 128,
        "GROUP_SIZE_M": 8,
        "num_stages": 8,
        "num_warps": 4,
        "compile_time": 1.161703109741211
    },
    {
        "BLOCK_SIZE_M": 64,
        "BLOCK_SIZE_N": 64,
        "BLOCK_SIZE_K": 128,
        "GROUP_SIZE_M": 8,
        "num_stages": 8,
        "num_warps": 8,
        "compile_time": 0.8175592422485352
    },
    {
        "BLOCK_SIZE_M": 64,
        "BLOCK_SIZE_N": 64,
        "BLOCK_SIZE_K": 128,
        "GROUP_SIZE_M": 8,
        "num_stages": 8,
        "num_warps": 16,
        "compile_time": 0.5897631645202637
    },
    {
        "BLOCK_SIZE_M": 64,
        "BLOCK_SIZE_N": 64,
        "BLOCK_SIZE_K": 128,
        "GROUP_SIZE_M": 8,
        "num_stages": 8,
        "num_warps": 32,
        "compile_time": 0.5082297325134277
    },
    {
        "BLOCK_SIZE_M": 64,
        "BLOCK_SIZE_N": 64,
        "BLOCK_SIZE_K": 256,
        "GROUP_SIZE_M": 8,
        "num_stages": 4,
        "num_warps": 2,
        "compile_time": 4.040453195571899
    },
    {
        "BLOCK_SIZE_M": 64,
        "BLOCK_SIZE_N": 64,
        "BLOCK_SIZE_K": 256,
        "GROUP_SIZE_M": 8,
        "num_stages": 4,
        "num_warps": 4,
        "compile_time": 1.5689620971679688
    },
    {
        "BLOCK_SIZE_M": 64,
        "BLOCK_SIZE_N": 64,
        "BLOCK_SIZE_K": 256,
        "GROUP_SIZE_M": 8,
        "num_stages": 4,
        "num_warps": 8,
        "compile_time": 0.9786126613616943
    },
    {
        "BLOCK_SIZE_M": 64,
        "BLOCK_SIZE_N": 64,
        "BLOCK_SIZE_K": 256,
        "GROUP_SIZE_M": 8,
        "num_stages": 4,
        "num_warps": 16,
        "compile_time": 0.6988317966461182
    },
    {
        "BLOCK_SIZE_M": 64,
        "BLOCK_SIZE_N": 64,
        "BLOCK_SIZE_K": 256,
        "GROUP_SIZE_M": 8,
        "num_stages": 4,
        "num_warps": 32,
        "compile_time": 0.5576221942901611
    },
    {
        "BLOCK_SIZE_M": 64,
        "BLOCK_SIZE_N": 64,
        "BLOCK_SIZE_K": 256,
        "GROUP_SIZE_M": 8,
        "num_stages": 5,
        "num_warps": 2,
        "compile_time": 4.245390176773071
    },
    {
        "BLOCK_SIZE_M": 64,
        "BLOCK_SIZE_N": 64,
        "BLOCK_SIZE_K": 256,
        "GROUP_SIZE_M": 8,
        "num_stages": 5,
        "num_warps": 4,
        "compile_time": 1.6797974109649658
    },
    {
        "BLOCK_SIZE_M": 64,
        "BLOCK_SIZE_N": 64,
        "BLOCK_SIZE_K": 256,
        "GROUP_SIZE_M": 8,
        "num_stages": 5,
        "num_warps": 8,
        "compile_time": 1.0215091705322266
    },
    {
        "BLOCK_SIZE_M": 64,
        "BLOCK_SIZE_N": 64,
        "BLOCK_SIZE_K": 256,
        "GROUP_SIZE_M": 8,
        "num_stages": 5,
        "num_warps": 16,
        "compile_time": 0.7283704280853271
    },
    {
        "BLOCK_SIZE_M": 64,
        "BLOCK_SIZE_N": 64,
        "BLOCK_SIZE_K": 256,
        "GROUP_SIZE_M": 8,
        "num_stages": 5,
        "num_warps": 32,
        "compile_time": 0.5783374309539795
    },
    {
        "BLOCK_SIZE_M": 64,
        "BLOCK_SIZE_N": 64,
        "BLOCK_SIZE_K": 256,
        "GROUP_SIZE_M": 8,
        "num_stages": 6,
        "num_warps": 2,
        "compile_time": 4.599940061569214
    },
    {
        "BLOCK_SIZE_M": 64,
        "BLOCK_SIZE_N": 64,
        "BLOCK_SIZE_K": 256,
        "GROUP_SIZE_M": 8,
        "num_stages": 6,
        "num_warps": 4,
        "compile_time": 1.8097708225250244
    },
    {
        "BLOCK_SIZE_M": 64,
        "BLOCK_SIZE_N": 64,
        "BLOCK_SIZE_K": 256,
        "GROUP_SIZE_M": 8,
        "num_stages": 6,
        "num_warps": 8,
        "compile_time": 1.0928926467895508
    },
    {
        "BLOCK_SIZE_M": 64,
        "BLOCK_SIZE_N": 64,
        "BLOCK_SIZE_K": 256,
        "GROUP_SIZE_M": 8,
        "num_stages": 6,
        "num_warps": 16,
        "compile_time": 0.7693064212799072
    },
    {
        "BLOCK_SIZE_M": 64,
        "BLOCK_SIZE_N": 64,
        "BLOCK_SIZE_K": 256,
        "GROUP_SIZE_M": 8,
        "num_stages": 6,
        "num_warps": 32,
        "compile_time": 0.6065268516540527
    },
    {
        "BLOCK_SIZE_M": 64,
        "BLOCK_SIZE_N": 64,
        "BLOCK_SIZE_K": 256,
        "GROUP_SIZE_M": 8,
        "num_stages": 7,
        "num_warps": 2,
        "compile_time": 4.792916536331177
    },
    {
        "BLOCK_SIZE_M": 64,
        "BLOCK_SIZE_N": 64,
        "BLOCK_SIZE_K": 256,
        "GROUP_SIZE_M": 8,
        "num_stages": 7,
        "num_warps": 4,
        "compile_time": 1.9505493640899658
    },
    {
        "BLOCK_SIZE_M": 64,
        "BLOCK_SIZE_N": 64,
        "BLOCK_SIZE_K": 256,
        "GROUP_SIZE_M": 8,
        "num_stages": 7,
        "num_warps": 8,
        "compile_time": 1.1616439819335938
    },
    {
        "BLOCK_SIZE_M": 64,
        "BLOCK_SIZE_N": 64,
        "BLOCK_SIZE_K": 256,
        "GROUP_SIZE_M": 8,
        "num_stages": 7,
        "num_warps": 16,
        "compile_time": 0.8002653121948242
    },
    {
        "BLOCK_SIZE_M": 64,
        "BLOCK_SIZE_N": 64,
        "BLOCK_SIZE_K": 256,
        "GROUP_SIZE_M": 8,
        "num_stages": 7,
        "num_warps": 32,
        "compile_time": 0.6288397312164307
    },
    {
        "BLOCK_SIZE_M": 64,
        "BLOCK_SIZE_N": 64,
        "BLOCK_SIZE_K": 256,
        "GROUP_SIZE_M": 8,
        "num_stages": 8,
        "num_warps": 2,
        "compile_time": 5.114234447479248
    },
    {
        "BLOCK_SIZE_M": 64,
        "BLOCK_SIZE_N": 64,
        "BLOCK_SIZE_K": 256,
        "GROUP_SIZE_M": 8,
        "num_stages": 8,
        "num_warps": 4,
        "compile_time": 2.103719472885132
    },
    {
        "BLOCK_SIZE_M": 64,
        "BLOCK_SIZE_N": 64,
        "BLOCK_SIZE_K": 256,
        "GROUP_SIZE_M": 8,
        "num_stages": 8,
        "num_warps": 8,
        "compile_time": 1.295889139175415
    },
    {
        "BLOCK_SIZE_M": 64,
        "BLOCK_SIZE_N": 64,
        "BLOCK_SIZE_K": 256,
        "GROUP_SIZE_M": 8,
        "num_stages": 8,
        "num_warps": 16,
        "compile_time": 0.8661110401153564
    },
    {
        "BLOCK_SIZE_M": 64,
        "BLOCK_SIZE_N": 64,
        "BLOCK_SIZE_K": 256,
        "GROUP_SIZE_M": 8,
        "num_stages": 8,
        "num_warps": 32,
        "compile_time": 0.6544349193572998
    },
    {
        "BLOCK_SIZE_M": 64,
        "BLOCK_SIZE_N": 64,
        "BLOCK_SIZE_K": 512,
        "GROUP_SIZE_M": 8,
        "num_stages": 1,
        "num_warps": 2,
        "compile_time": 6.000936031341553
    },
    {
        "BLOCK_SIZE_M": 64,
        "BLOCK_SIZE_N": 64,
        "BLOCK_SIZE_K": 512,
        "GROUP_SIZE_M": 8,
        "num_stages": 2,
        "num_warps": 2,
        "compile_time": 6.0010082721710205
    },
    {
        "BLOCK_SIZE_M": 64,
        "BLOCK_SIZE_N": 64,
        "BLOCK_SIZE_K": 512,
        "GROUP_SIZE_M": 8,
        "num_stages": 3,
        "num_warps": 2,
        "compile_time": 24.05375599861145
    },
    {
        "BLOCK_SIZE_M": 64,
        "BLOCK_SIZE_N": 64,
        "BLOCK_SIZE_K": 512,
        "GROUP_SIZE_M": 8,
        "num_stages": 3,
        "num_warps": 4,
        "compile_time": 3.7972400188446045
    },
    {
        "BLOCK_SIZE_M": 64,
        "BLOCK_SIZE_N": 64,
        "BLOCK_SIZE_K": 512,
        "GROUP_SIZE_M": 8,
        "num_stages": 3,
        "num_warps": 8,
        "compile_time": 1.5360758304595947
    },
    {
        "BLOCK_SIZE_M": 64,
        "BLOCK_SIZE_N": 64,
        "BLOCK_SIZE_K": 512,
        "GROUP_SIZE_M": 8,
        "num_stages": 3,
        "num_warps": 16,
        "compile_time": 0.9376688003540039
    },
    {
        "BLOCK_SIZE_M": 64,
        "BLOCK_SIZE_N": 64,
        "BLOCK_SIZE_K": 512,
        "GROUP_SIZE_M": 8,
        "num_stages": 3,
        "num_warps": 32,
        "compile_time": 0.7293715476989746
    },
    {
        "BLOCK_SIZE_M": 64,
        "BLOCK_SIZE_N": 64,
        "BLOCK_SIZE_K": 512,
        "GROUP_SIZE_M": 8,
        "num_stages": 4,
        "num_warps": 2,
        "compile_time": 24.25668478012085
    },
    {
        "BLOCK_SIZE_M": 64,
        "BLOCK_SIZE_N": 64,
        "BLOCK_SIZE_K": 512,
        "GROUP_SIZE_M": 8,
        "num_stages": 4,
        "num_warps": 4,
        "compile_time": 4.098379135131836
    },
    {
        "BLOCK_SIZE_M": 64,
        "BLOCK_SIZE_N": 64,
        "BLOCK_SIZE_K": 512,
        "GROUP_SIZE_M": 8,
        "num_stages": 4,
        "num_warps": 8,
        "compile_time": 1.6803691387176514
    },
    {
        "BLOCK_SIZE_M": 64,
        "BLOCK_SIZE_N": 64,
        "BLOCK_SIZE_K": 512,
        "GROUP_SIZE_M": 8,
        "num_stages": 4,
        "num_warps": 16,
        "compile_time": 1.0289297103881836
    },
    {
        "BLOCK_SIZE_M": 64,
        "BLOCK_SIZE_N": 64,
        "BLOCK_SIZE_K": 512,
        "GROUP_SIZE_M": 8,
        "num_stages": 4,
        "num_warps": 32,
        "compile_time": 0.7842795848846436
    },
    {
        "BLOCK_SIZE_M": 64,
        "BLOCK_SIZE_N": 64,
        "BLOCK_SIZE_K": 512,
        "GROUP_SIZE_M": 8,
        "num_stages": 5,
        "num_warps": 2,
        "compile_time": 24.732558488845825
    },
    {
        "BLOCK_SIZE_M": 64,
        "BLOCK_SIZE_N": 64,
        "BLOCK_SIZE_K": 512,
        "GROUP_SIZE_M": 8,
        "num_stages": 5,
        "num_warps": 4,
        "compile_time": 4.392392635345459
    },
    {
        "BLOCK_SIZE_M": 64,
        "BLOCK_SIZE_N": 64,
        "BLOCK_SIZE_K": 512,
        "GROUP_SIZE_M": 8,
        "num_stages": 5,
        "num_warps": 8,
        "compile_time": 1.8273847103118896
    },
    {
        "BLOCK_SIZE_M": 64,
        "BLOCK_SIZE_N": 64,
        "BLOCK_SIZE_K": 512,
        "GROUP_SIZE_M": 8,
        "num_stages": 5,
        "num_warps": 16,
        "compile_time": 0.0041234493255615234
    },
    {
        "BLOCK_SIZE_M": 64,
        "BLOCK_SIZE_N": 64,
        "BLOCK_SIZE_K": 512,
        "GROUP_SIZE_M": 8,
        "num_stages": 5,
        "num_warps": 32,
        "compile_time": 0.8336694240570068
    },
    {
        "BLOCK_SIZE_M": 64,
        "BLOCK_SIZE_N": 64,
        "BLOCK_SIZE_K": 512,
        "GROUP_SIZE_M": 8,
        "num_stages": 6,
        "num_warps": 2,
        "compile_time": 24.86353635787964
    },
    {
        "BLOCK_SIZE_M": 64,
        "BLOCK_SIZE_N": 64,
        "BLOCK_SIZE_K": 512,
        "GROUP_SIZE_M": 8,
        "num_stages": 6,
        "num_warps": 4,
        "compile_time": 4.600736856460571
    },
    {
        "BLOCK_SIZE_M": 64,
        "BLOCK_SIZE_N": 64,
        "BLOCK_SIZE_K": 512,
        "GROUP_SIZE_M": 8,
        "num_stages": 6,
        "num_warps": 8,
        "compile_time": 1.9566445350646973
    },
    {
        "BLOCK_SIZE_M": 64,
        "BLOCK_SIZE_N": 64,
        "BLOCK_SIZE_K": 512,
        "GROUP_SIZE_M": 8,
        "num_stages": 6,
        "num_warps": 16,
        "compile_time": 1.1742737293243408
    },
    {
        "BLOCK_SIZE_M": 64,
        "BLOCK_SIZE_N": 64,
        "BLOCK_SIZE_K": 512,
        "GROUP_SIZE_M": 8,
        "num_stages": 6,
        "num_warps": 32,
        "compile_time": 0.006512641906738281
    },
    {
        "BLOCK_SIZE_M": 64,
        "BLOCK_SIZE_N": 64,
        "BLOCK_SIZE_K": 512,
        "GROUP_SIZE_M": 8,
        "num_stages": 7,
        "num_warps": 2,
        "compile_time": 25.348408699035645
    },
    {
        "BLOCK_SIZE_M": 64,
        "BLOCK_SIZE_N": 64,
        "BLOCK_SIZE_K": 512,
        "GROUP_SIZE_M": 8,
        "num_stages": 7,
        "num_warps": 4,
        "compile_time": 4.803654193878174
    },
    {
        "BLOCK_SIZE_M": 64,
        "BLOCK_SIZE_N": 64,
        "BLOCK_SIZE_K": 512,
        "GROUP_SIZE_M": 8,
        "num_stages": 7,
        "num_warps": 8,
        "compile_time": 2.105572462081909
    },
    {
        "BLOCK_SIZE_M": 64,
        "BLOCK_SIZE_N": 64,
        "BLOCK_SIZE_K": 512,
        "GROUP_SIZE_M": 8,
        "num_stages": 7,
        "num_warps": 16,
        "compile_time": 1.2582221031188965
    },
    {
        "BLOCK_SIZE_M": 64,
        "BLOCK_SIZE_N": 64,
        "BLOCK_SIZE_K": 512,
        "GROUP_SIZE_M": 8,
        "num_stages": 7,
        "num_warps": 32,
        "compile_time": 0.9733104705810547
    },
    {
        "BLOCK_SIZE_M": 64,
        "BLOCK_SIZE_N": 64,
        "BLOCK_SIZE_K": 512,
        "GROUP_SIZE_M": 8,
        "num_stages": 8,
        "num_warps": 2,
        "compile_time": 25.551544666290283
    },
    {
        "BLOCK_SIZE_M": 64,
        "BLOCK_SIZE_N": 64,
        "BLOCK_SIZE_K": 512,
        "GROUP_SIZE_M": 8,
        "num_stages": 8,
        "num_warps": 4,
        "compile_time": 5.070126056671143
    },
    {
        "BLOCK_SIZE_M": 64,
        "BLOCK_SIZE_N": 64,
        "BLOCK_SIZE_K": 512,
        "GROUP_SIZE_M": 8,
        "num_stages": 8,
        "num_warps": 8,
        "compile_time": 2.221277952194214
    },
    {
        "BLOCK_SIZE_M": 64,
        "BLOCK_SIZE_N": 64,
        "BLOCK_SIZE_K": 512,
        "GROUP_SIZE_M": 8,
        "num_stages": 8,
        "num_warps": 16,
        "compile_time": 1.3213574886322021
    },
    {
        "BLOCK_SIZE_M": 64,
        "BLOCK_SIZE_N": 64,
        "BLOCK_SIZE_K": 512,
        "GROUP_SIZE_M": 8,
        "num_stages": 8,
        "num_warps": 32,
        "compile_time": 0.9621696472167969
    },
    {
        "BLOCK_SIZE_M": 64,
        "BLOCK_SIZE_N": 128,
        "BLOCK_SIZE_K": 64,
        "GROUP_SIZE_M": 8,
        "num_stages": 8,
        "num_warps": 2,
        "compile_time": 1.9255869388580322
    },
    {
        "BLOCK_SIZE_M": 64,
        "BLOCK_SIZE_N": 128,
        "BLOCK_SIZE_K": 64,
        "GROUP_SIZE_M": 8,
        "num_stages": 8,
        "num_warps": 4,
        "compile_time": 1.1111340522766113
    },
    {
        "BLOCK_SIZE_M": 64,
        "BLOCK_SIZE_N": 128,
        "BLOCK_SIZE_K": 64,
        "GROUP_SIZE_M": 8,
        "num_stages": 8,
        "num_warps": 8,
        "compile_time": 0.7368943691253662
    },
    {
        "BLOCK_SIZE_M": 64,
        "BLOCK_SIZE_N": 128,
        "BLOCK_SIZE_K": 64,
        "GROUP_SIZE_M": 8,
        "num_stages": 8,
        "num_warps": 16,
        "compile_time": 0.5720181465148926
    },
    {
        "BLOCK_SIZE_M": 64,
        "BLOCK_SIZE_N": 128,
        "BLOCK_SIZE_K": 64,
        "GROUP_SIZE_M": 8,
        "num_stages": 8,
        "num_warps": 32,
        "compile_time": 0.48605847358703613
    },
    {
        "BLOCK_SIZE_M": 64,
        "BLOCK_SIZE_N": 128,
        "BLOCK_SIZE_K": 128,
        "GROUP_SIZE_M": 8,
        "num_stages": 5,
        "num_warps": 2,
        "compile_time": 3.1956989765167236
    },
    {
        "BLOCK_SIZE_M": 64,
        "BLOCK_SIZE_N": 128,
        "BLOCK_SIZE_K": 128,
        "GROUP_SIZE_M": 8,
        "num_stages": 5,
        "num_warps": 4,
        "compile_time": 1.4380953311920166
    },
    {
        "BLOCK_SIZE_M": 64,
        "BLOCK_SIZE_N": 128,
        "BLOCK_SIZE_K": 128,
        "GROUP_SIZE_M": 8,
        "num_stages": 5,
        "num_warps": 8,
        "compile_time": 0.9143483638763428
    },
    {
        "BLOCK_SIZE_M": 64,
        "BLOCK_SIZE_N": 128,
        "BLOCK_SIZE_K": 128,
        "GROUP_SIZE_M": 8,
        "num_stages": 5,
        "num_warps": 16,
        "compile_time": 0.6498117446899414
    },
    {
        "BLOCK_SIZE_M": 64,
        "BLOCK_SIZE_N": 128,
        "BLOCK_SIZE_K": 128,
        "GROUP_SIZE_M": 8,
        "num_stages": 5,
        "num_warps": 32,
        "compile_time": 0.513192892074585
    },
    {
        "BLOCK_SIZE_M": 64,
        "BLOCK_SIZE_N": 128,
        "BLOCK_SIZE_K": 128,
        "GROUP_SIZE_M": 8,
        "num_stages": 6,
        "num_warps": 2,
        "compile_time": 3.398920774459839
    },
    {
        "BLOCK_SIZE_M": 64,
        "BLOCK_SIZE_N": 128,
        "BLOCK_SIZE_K": 128,
        "GROUP_SIZE_M": 8,
        "num_stages": 6,
        "num_warps": 4,
        "compile_time": 1.5232434272766113
    },
    {
        "BLOCK_SIZE_M": 64,
        "BLOCK_SIZE_N": 128,
        "BLOCK_SIZE_K": 128,
        "GROUP_SIZE_M": 8,
        "num_stages": 6,
        "num_warps": 8,
        "compile_time": 0.962376594543457
    },
    {
        "BLOCK_SIZE_M": 64,
        "BLOCK_SIZE_N": 128,
        "BLOCK_SIZE_K": 128,
        "GROUP_SIZE_M": 8,
        "num_stages": 6,
        "num_warps": 16,
        "compile_time": 0.6895503997802734
    },
    {
        "BLOCK_SIZE_M": 64,
        "BLOCK_SIZE_N": 128,
        "BLOCK_SIZE_K": 128,
        "GROUP_SIZE_M": 8,
        "num_stages": 6,
        "num_warps": 32,
        "compile_time": 0.5344815254211426
    },
    {
        "BLOCK_SIZE_M": 64,
        "BLOCK_SIZE_N": 128,
        "BLOCK_SIZE_K": 128,
        "GROUP_SIZE_M": 8,
        "num_stages": 7,
        "num_warps": 2,
        "compile_time": 3.6562118530273438
    },
    {
        "BLOCK_SIZE_M": 64,
        "BLOCK_SIZE_N": 128,
        "BLOCK_SIZE_K": 128,
        "GROUP_SIZE_M": 8,
        "num_stages": 7,
        "num_warps": 4,
        "compile_time": 1.6303751468658447
    },
    {
        "BLOCK_SIZE_M": 64,
        "BLOCK_SIZE_N": 128,
        "BLOCK_SIZE_K": 128,
        "GROUP_SIZE_M": 8,
        "num_stages": 7,
        "num_warps": 8,
        "compile_time": 1.025588035583496
    },
    {
        "BLOCK_SIZE_M": 64,
        "BLOCK_SIZE_N": 128,
        "BLOCK_SIZE_K": 128,
        "GROUP_SIZE_M": 8,
        "num_stages": 7,
        "num_warps": 16,
        "compile_time": 0.7222402095794678
    },
    {
        "BLOCK_SIZE_M": 64,
        "BLOCK_SIZE_N": 128,
        "BLOCK_SIZE_K": 128,
        "GROUP_SIZE_M": 8,
        "num_stages": 7,
        "num_warps": 32,
        "compile_time": 0.5441296100616455
    },
    {
        "BLOCK_SIZE_M": 64,
        "BLOCK_SIZE_N": 128,
        "BLOCK_SIZE_K": 128,
        "GROUP_SIZE_M": 8,
        "num_stages": 8,
        "num_warps": 2,
        "compile_time": 3.7652270793914795
    },
    {
        "BLOCK_SIZE_M": 64,
        "BLOCK_SIZE_N": 128,
        "BLOCK_SIZE_K": 128,
        "GROUP_SIZE_M": 8,
        "num_stages": 8,
        "num_warps": 4,
        "compile_time": 1.740638256072998
    },
    {
        "BLOCK_SIZE_M": 64,
        "BLOCK_SIZE_N": 128,
        "BLOCK_SIZE_K": 128,
        "GROUP_SIZE_M": 8,
        "num_stages": 8,
        "num_warps": 8,
        "compile_time": 1.0823619365692139
    },
    {
        "BLOCK_SIZE_M": 64,
        "BLOCK_SIZE_N": 128,
        "BLOCK_SIZE_K": 128,
        "GROUP_SIZE_M": 8,
        "num_stages": 8,
        "num_warps": 16,
        "compile_time": 0.7387492656707764
    },
    {
        "BLOCK_SIZE_M": 64,
        "BLOCK_SIZE_N": 128,
        "BLOCK_SIZE_K": 128,
        "GROUP_SIZE_M": 8,
        "num_stages": 8,
        "num_warps": 32,
        "compile_time": 0.5637283325195312
    },
    {
        "BLOCK_SIZE_M": 64,
        "BLOCK_SIZE_N": 128,
        "BLOCK_SIZE_K": 256,
        "GROUP_SIZE_M": 8,
        "num_stages": 3,
        "num_warps": 2,
        "compile_time": 13.072349786758423
    },
    {
        "BLOCK_SIZE_M": 64,
        "BLOCK_SIZE_N": 128,
        "BLOCK_SIZE_K": 256,
        "GROUP_SIZE_M": 8,
        "num_stages": 3,
        "num_warps": 4,
        "compile_time": 2.7505712509155273
    },
    {
        "BLOCK_SIZE_M": 64,
        "BLOCK_SIZE_N": 128,
        "BLOCK_SIZE_K": 256,
        "GROUP_SIZE_M": 8,
        "num_stages": 3,
        "num_warps": 8,
        "compile_time": 1.2572486400604248
    },
    {
        "BLOCK_SIZE_M": 64,
        "BLOCK_SIZE_N": 128,
        "BLOCK_SIZE_K": 256,
        "GROUP_SIZE_M": 8,
        "num_stages": 3,
        "num_warps": 16,
        "compile_time": 0.8496139049530029
    },
    {
        "BLOCK_SIZE_M": 64,
        "BLOCK_SIZE_N": 128,
        "BLOCK_SIZE_K": 256,
        "GROUP_SIZE_M": 8,
        "num_stages": 3,
        "num_warps": 32,
        "compile_time": 0.6446764469146729
    },
    {
        "BLOCK_SIZE_M": 64,
        "BLOCK_SIZE_N": 128,
        "BLOCK_SIZE_K": 256,
        "GROUP_SIZE_M": 8,
        "num_stages": 4,
        "num_warps": 2,
        "compile_time": 13.171178817749023
    },
    {
        "BLOCK_SIZE_M": 64,
        "BLOCK_SIZE_N": 128,
        "BLOCK_SIZE_K": 256,
        "GROUP_SIZE_M": 8,
        "num_stages": 4,
        "num_warps": 4,
        "compile_time": 2.9410581588745117
    },
    {
        "BLOCK_SIZE_M": 64,
        "BLOCK_SIZE_N": 128,
        "BLOCK_SIZE_K": 256,
        "GROUP_SIZE_M": 8,
        "num_stages": 4,
        "num_warps": 8,
        "compile_time": 1.3379085063934326
    },
    {
        "BLOCK_SIZE_M": 64,
        "BLOCK_SIZE_N": 128,
        "BLOCK_SIZE_K": 256,
        "GROUP_SIZE_M": 8,
        "num_stages": 4,
        "num_warps": 16,
        "compile_time": 0.8907761573791504
    },
    {
        "BLOCK_SIZE_M": 64,
        "BLOCK_SIZE_N": 128,
        "BLOCK_SIZE_K": 256,
        "GROUP_SIZE_M": 8,
        "num_stages": 4,
        "num_warps": 32,
        "compile_time": 0.6721596717834473
    },
    {
        "BLOCK_SIZE_M": 64,
        "BLOCK_SIZE_N": 128,
        "BLOCK_SIZE_K": 256,
        "GROUP_SIZE_M": 8,
        "num_stages": 5,
        "num_warps": 2,
        "compile_time": 13.600707769393921
    },
    {
        "BLOCK_SIZE_M": 64,
        "BLOCK_SIZE_N": 128,
        "BLOCK_SIZE_K": 256,
        "GROUP_SIZE_M": 8,
        "num_stages": 5,
        "num_warps": 4,
        "compile_time": 3.124260187149048
    },
    {
        "BLOCK_SIZE_M": 64,
        "BLOCK_SIZE_N": 128,
        "BLOCK_SIZE_K": 256,
        "GROUP_SIZE_M": 8,
        "num_stages": 5,
        "num_warps": 8,
        "compile_time": 1.4463591575622559
    },
    {
        "BLOCK_SIZE_M": 64,
        "BLOCK_SIZE_N": 128,
        "BLOCK_SIZE_K": 256,
        "GROUP_SIZE_M": 8,
        "num_stages": 5,
        "num_warps": 16,
        "compile_time": 0.9626038074493408
    },
    {
        "BLOCK_SIZE_M": 64,
        "BLOCK_SIZE_N": 128,
        "BLOCK_SIZE_K": 256,
        "GROUP_SIZE_M": 8,
        "num_stages": 5,
        "num_warps": 32,
        "compile_time": 0.7097997665405273
    },
    {
        "BLOCK_SIZE_M": 64,
        "BLOCK_SIZE_N": 128,
        "BLOCK_SIZE_K": 256,
        "GROUP_SIZE_M": 8,
        "num_stages": 6,
        "num_warps": 2,
        "compile_time": 13.745085716247559
    },
    {
        "BLOCK_SIZE_M": 64,
        "BLOCK_SIZE_N": 128,
        "BLOCK_SIZE_K": 256,
        "GROUP_SIZE_M": 8,
        "num_stages": 6,
        "num_warps": 4,
        "compile_time": 3.3363828659057617
    },
    {
        "BLOCK_SIZE_M": 64,
        "BLOCK_SIZE_N": 128,
        "BLOCK_SIZE_K": 256,
        "GROUP_SIZE_M": 8,
        "num_stages": 6,
        "num_warps": 8,
        "compile_time": 1.5494499206542969
    },
    {
        "BLOCK_SIZE_M": 64,
        "BLOCK_SIZE_N": 128,
        "BLOCK_SIZE_K": 256,
        "GROUP_SIZE_M": 8,
        "num_stages": 6,
        "num_warps": 16,
        "compile_time": 1.0140411853790283
    },
    {
        "BLOCK_SIZE_M": 64,
        "BLOCK_SIZE_N": 128,
        "BLOCK_SIZE_K": 256,
        "GROUP_SIZE_M": 8,
        "num_stages": 6,
        "num_warps": 32,
        "compile_time": 0.7416603565216064
    },
    {
        "BLOCK_SIZE_M": 64,
        "BLOCK_SIZE_N": 128,
        "BLOCK_SIZE_K": 256,
        "GROUP_SIZE_M": 8,
        "num_stages": 7,
        "num_warps": 2,
        "compile_time": 14.055800199508667
    },
    {
        "BLOCK_SIZE_M": 64,
        "BLOCK_SIZE_N": 128,
        "BLOCK_SIZE_K": 256,
        "GROUP_SIZE_M": 8,
        "num_stages": 7,
        "num_warps": 4,
        "compile_time": 3.4990901947021484
    },
    {
        "BLOCK_SIZE_M": 64,
        "BLOCK_SIZE_N": 128,
        "BLOCK_SIZE_K": 256,
        "GROUP_SIZE_M": 8,
        "num_stages": 7,
        "num_warps": 8,
        "compile_time": 1.7280914783477783
    },
    {
        "BLOCK_SIZE_M": 64,
        "BLOCK_SIZE_N": 128,
        "BLOCK_SIZE_K": 256,
        "GROUP_SIZE_M": 8,
        "num_stages": 7,
        "num_warps": 16,
        "compile_time": 1.0864036083221436
    },
    {
        "BLOCK_SIZE_M": 64,
        "BLOCK_SIZE_N": 128,
        "BLOCK_SIZE_K": 256,
        "GROUP_SIZE_M": 8,
        "num_stages": 7,
        "num_warps": 32,
        "compile_time": 0.005856752395629883
    },
    {
        "BLOCK_SIZE_M": 64,
        "BLOCK_SIZE_N": 128,
        "BLOCK_SIZE_K": 256,
        "GROUP_SIZE_M": 8,
        "num_stages": 8,
        "num_warps": 2,
        "compile_time": 14.361022233963013
    },
    {
        "BLOCK_SIZE_M": 64,
        "BLOCK_SIZE_N": 128,
        "BLOCK_SIZE_K": 256,
        "GROUP_SIZE_M": 8,
        "num_stages": 8,
        "num_warps": 4,
        "compile_time": 3.6831328868865967
    },
    {
        "BLOCK_SIZE_M": 64,
        "BLOCK_SIZE_N": 128,
        "BLOCK_SIZE_K": 256,
        "GROUP_SIZE_M": 8,
        "num_stages": 8,
        "num_warps": 8,
        "compile_time": 1.7940101623535156
    },
    {
        "BLOCK_SIZE_M": 64,
        "BLOCK_SIZE_N": 128,
        "BLOCK_SIZE_K": 256,
        "GROUP_SIZE_M": 8,
        "num_stages": 8,
        "num_warps": 16,
        "compile_time": 1.157698631286621
    },
    {
        "BLOCK_SIZE_M": 64,
        "BLOCK_SIZE_N": 128,
        "BLOCK_SIZE_K": 256,
        "GROUP_SIZE_M": 8,
        "num_stages": 8,
        "num_warps": 32,
        "compile_time": 0.7933239936828613
    },
    {
        "BLOCK_SIZE_M": 64,
        "BLOCK_SIZE_N": 128,
        "BLOCK_SIZE_K": 512,
        "GROUP_SIZE_M": 8,
        "num_stages": 1,
        "num_warps": 2,
        "compile_time": 7.075904607772827
    },
    {
        "BLOCK_SIZE_M": 64,
        "BLOCK_SIZE_N": 128,
        "BLOCK_SIZE_K": 512,
        "GROUP_SIZE_M": 8,
        "num_stages": 1,
        "num_warps": 4,
        "compile_time": 4.36288857460022
    },
    {
        "BLOCK_SIZE_M": 64,
        "BLOCK_SIZE_N": 128,
        "BLOCK_SIZE_K": 512,
        "GROUP_SIZE_M": 8,
        "num_stages": 1,
        "num_warps": 8,
        "compile_time": 1.8233065605163574
    },
    {
        "BLOCK_SIZE_M": 64,
        "BLOCK_SIZE_N": 128,
        "BLOCK_SIZE_K": 512,
        "GROUP_SIZE_M": 8,
        "num_stages": 1,
        "num_warps": 16,
        "compile_time": 1.0316581726074219
    },
    {
        "BLOCK_SIZE_M": 64,
        "BLOCK_SIZE_N": 128,
        "BLOCK_SIZE_K": 512,
        "GROUP_SIZE_M": 8,
        "num_stages": 1,
        "num_warps": 32,
        "compile_time": 0.707148551940918
    },
    {
        "BLOCK_SIZE_M": 64,
        "BLOCK_SIZE_N": 128,
        "BLOCK_SIZE_K": 512,
        "GROUP_SIZE_M": 8,
        "num_stages": 2,
        "num_warps": 2,
        "compile_time": 7.2722015380859375
    },
    {
        "BLOCK_SIZE_M": 64,
        "BLOCK_SIZE_N": 128,
        "BLOCK_SIZE_K": 512,
        "GROUP_SIZE_M": 8,
        "num_stages": 2,
        "num_warps": 4,
        "compile_time": 4.821749687194824
    },
    {
        "BLOCK_SIZE_M": 64,
        "BLOCK_SIZE_N": 128,
        "BLOCK_SIZE_K": 512,
        "GROUP_SIZE_M": 8,
        "num_stages": 2,
        "num_warps": 8,
        "compile_time": 2.041250705718994
    },
    {
        "BLOCK_SIZE_M": 64,
        "BLOCK_SIZE_N": 128,
        "BLOCK_SIZE_K": 512,
        "GROUP_SIZE_M": 8,
        "num_stages": 2,
        "num_warps": 16,
        "compile_time": 1.1792526245117188
    },
    {
        "BLOCK_SIZE_M": 64,
        "BLOCK_SIZE_N": 128,
        "BLOCK_SIZE_K": 512,
        "GROUP_SIZE_M": 8,
        "num_stages": 2,
        "num_warps": 32,
        "compile_time": 0.8057255744934082
    },
    {
        "BLOCK_SIZE_M": 64,
        "BLOCK_SIZE_N": 128,
        "BLOCK_SIZE_K": 512,
        "GROUP_SIZE_M": 8,
        "num_stages": 3,
        "num_warps": 2,
        "compile_time": 7.95877742767334
    },
    {
        "BLOCK_SIZE_M": 64,
        "BLOCK_SIZE_N": 128,
        "BLOCK_SIZE_K": 512,
        "GROUP_SIZE_M": 8,
        "num_stages": 3,
        "num_warps": 4,
        "compile_time": 12.968677282333374
    },
    {
        "BLOCK_SIZE_M": 64,
        "BLOCK_SIZE_N": 128,
        "BLOCK_SIZE_K": 512,
        "GROUP_SIZE_M": 8,
        "num_stages": 3,
        "num_warps": 8,
        "compile_time": 2.8020975589752197
    },
    {
        "BLOCK_SIZE_M": 64,
        "BLOCK_SIZE_N": 128,
        "BLOCK_SIZE_K": 512,
        "GROUP_SIZE_M": 8,
        "num_stages": 3,
        "num_warps": 16,
        "compile_time": 1.3726739883422852
    },
    {
        "BLOCK_SIZE_M": 64,
        "BLOCK_SIZE_N": 128,
        "BLOCK_SIZE_K": 512,
        "GROUP_SIZE_M": 8,
        "num_stages": 3,
        "num_warps": 32,
        "compile_time": 0.9058229923248291
    },
    {
        "BLOCK_SIZE_M": 64,
        "BLOCK_SIZE_N": 128,
        "BLOCK_SIZE_K": 512,
        "GROUP_SIZE_M": 8,
        "num_stages": 4,
        "num_warps": 2,
        "compile_time": 8.515944957733154
    },
    {
        "BLOCK_SIZE_M": 64,
        "BLOCK_SIZE_N": 128,
        "BLOCK_SIZE_K": 512,
        "GROUP_SIZE_M": 8,
        "num_stages": 4,
        "num_warps": 4,
        "compile_time": 13.194369554519653
    },
    {
        "BLOCK_SIZE_M": 64,
        "BLOCK_SIZE_N": 128,
        "BLOCK_SIZE_K": 512,
        "GROUP_SIZE_M": 8,
        "num_stages": 4,
        "num_warps": 8,
        "compile_time": 3.0492875576019287
    },
    {
        "BLOCK_SIZE_M": 64,
        "BLOCK_SIZE_N": 128,
        "BLOCK_SIZE_K": 512,
        "GROUP_SIZE_M": 8,
        "num_stages": 4,
        "num_warps": 16,
        "compile_time": 1.4859941005706787
    },
    {
        "BLOCK_SIZE_M": 64,
        "BLOCK_SIZE_N": 128,
        "BLOCK_SIZE_K": 512,
        "GROUP_SIZE_M": 8,
        "num_stages": 4,
        "num_warps": 32,
        "compile_time": 0.004624843597412109
    },
    {
        "BLOCK_SIZE_M": 64,
        "BLOCK_SIZE_N": 128,
        "BLOCK_SIZE_K": 512,
        "GROUP_SIZE_M": 8,
        "num_stages": 5,
        "num_warps": 2,
        "compile_time": 8.795064926147461
    },
    {
        "BLOCK_SIZE_M": 64,
        "BLOCK_SIZE_N": 128,
        "BLOCK_SIZE_K": 512,
        "GROUP_SIZE_M": 8,
        "num_stages": 5,
        "num_warps": 4,
        "compile_time": 13.366026639938354
    },
    {
        "BLOCK_SIZE_M": 64,
        "BLOCK_SIZE_N": 128,
        "BLOCK_SIZE_K": 512,
        "GROUP_SIZE_M": 8,
        "num_stages": 5,
        "num_warps": 8,
        "compile_time": 3.231592893600464
    },
    {
        "BLOCK_SIZE_M": 64,
        "BLOCK_SIZE_N": 128,
        "BLOCK_SIZE_K": 512,
        "GROUP_SIZE_M": 8,
        "num_stages": 5,
        "num_warps": 16,
        "compile_time": 1.612170696258545
    },
    {
        "BLOCK_SIZE_M": 64,
        "BLOCK_SIZE_N": 128,
        "BLOCK_SIZE_K": 512,
        "GROUP_SIZE_M": 8,
        "num_stages": 5,
        "num_warps": 32,
        "compile_time": 1.0004277229309082
    },
    {
        "BLOCK_SIZE_M": 64,
        "BLOCK_SIZE_N": 128,
        "BLOCK_SIZE_K": 512,
        "GROUP_SIZE_M": 8,
        "num_stages": 6,
        "num_warps": 2,
        "compile_time": 9.395063161849976
    },
    {
        "BLOCK_SIZE_M": 64,
        "BLOCK_SIZE_N": 128,
        "BLOCK_SIZE_K": 512,
        "GROUP_SIZE_M": 8,
        "num_stages": 6,
        "num_warps": 4,
        "compile_time": 13.502989053726196
    },
    {
        "BLOCK_SIZE_M": 64,
        "BLOCK_SIZE_N": 128,
        "BLOCK_SIZE_K": 512,
        "GROUP_SIZE_M": 8,
        "num_stages": 6,
        "num_warps": 8,
        "compile_time": 3.419098377227783
    },
    {
        "BLOCK_SIZE_M": 64,
        "BLOCK_SIZE_N": 128,
        "BLOCK_SIZE_K": 512,
        "GROUP_SIZE_M": 8,
        "num_stages": 6,
        "num_warps": 16,
        "compile_time": 1.7485384941101074
    },
    {
        "BLOCK_SIZE_M": 64,
        "BLOCK_SIZE_N": 128,
        "BLOCK_SIZE_K": 512,
        "GROUP_SIZE_M": 8,
        "num_stages": 6,
        "num_warps": 32,
        "compile_time": 1.093851089477539
    },
    {
        "BLOCK_SIZE_M": 64,
        "BLOCK_SIZE_N": 128,
        "BLOCK_SIZE_K": 512,
        "GROUP_SIZE_M": 8,
        "num_stages": 7,
        "num_warps": 2,
        "compile_time": 9.817815780639648
    },
    {
        "BLOCK_SIZE_M": 64,
        "BLOCK_SIZE_N": 128,
        "BLOCK_SIZE_K": 512,
        "GROUP_SIZE_M": 8,
        "num_stages": 7,
        "num_warps": 4,
        "compile_time": 14.0659761428833
    },
    {
        "BLOCK_SIZE_M": 64,
        "BLOCK_SIZE_N": 128,
        "BLOCK_SIZE_K": 512,
        "GROUP_SIZE_M": 8,
        "num_stages": 7,
        "num_warps": 8,
        "compile_time": 3.6152408123016357
    },
    {
        "BLOCK_SIZE_M": 64,
        "BLOCK_SIZE_N": 128,
        "BLOCK_SIZE_K": 512,
        "GROUP_SIZE_M": 8,
        "num_stages": 7,
        "num_warps": 16,
        "compile_time": 1.8550269603729248
    },
    {
        "BLOCK_SIZE_M": 64,
        "BLOCK_SIZE_N": 128,
        "BLOCK_SIZE_K": 512,
        "GROUP_SIZE_M": 8,
        "num_stages": 7,
        "num_warps": 32,
        "compile_time": 0.004653453826904297
    },
    {
        "BLOCK_SIZE_M": 64,
        "BLOCK_SIZE_N": 128,
        "BLOCK_SIZE_K": 512,
        "GROUP_SIZE_M": 8,
        "num_stages": 8,
        "num_warps": 2,
        "compile_time": 10.243335962295532
    },
    {
        "BLOCK_SIZE_M": 64,
        "BLOCK_SIZE_N": 128,
        "BLOCK_SIZE_K": 512,
        "GROUP_SIZE_M": 8,
        "num_stages": 8,
        "num_warps": 4,
        "compile_time": 14.176740646362305
    },
    {
        "BLOCK_SIZE_M": 64,
        "BLOCK_SIZE_N": 128,
        "BLOCK_SIZE_K": 512,
        "GROUP_SIZE_M": 8,
        "num_stages": 8,
        "num_warps": 8,
        "compile_time": 3.7843005657196045
    },
    {
        "BLOCK_SIZE_M": 64,
        "BLOCK_SIZE_N": 128,
        "BLOCK_SIZE_K": 512,
        "GROUP_SIZE_M": 8,
        "num_stages": 8,
        "num_warps": 16,
        "compile_time": 1.9891133308410645
    },
    {
        "BLOCK_SIZE_M": 64,
        "BLOCK_SIZE_N": 128,
        "BLOCK_SIZE_K": 512,
        "GROUP_SIZE_M": 8,
        "num_stages": 8,
        "num_warps": 32,
        "compile_time": 1.2489025592803955
    },
    {
        "BLOCK_SIZE_M": 64,
        "BLOCK_SIZE_N": 256,
        "BLOCK_SIZE_K": 64,
        "GROUP_SIZE_M": 8,
        "num_stages": 6,
        "num_warps": 2,
        "compile_time": 4.530252933502197
    },
    {
        "BLOCK_SIZE_M": 64,
        "BLOCK_SIZE_N": 256,
        "BLOCK_SIZE_K": 64,
        "GROUP_SIZE_M": 8,
        "num_stages": 6,
        "num_warps": 4,
        "compile_time": 1.7192645072937012
    },
    {
        "BLOCK_SIZE_M": 64,
        "BLOCK_SIZE_N": 256,
        "BLOCK_SIZE_K": 64,
        "GROUP_SIZE_M": 8,
        "num_stages": 6,
        "num_warps": 8,
        "compile_time": 1.015373945236206
    },
    {
        "BLOCK_SIZE_M": 64,
        "BLOCK_SIZE_N": 256,
        "BLOCK_SIZE_K": 64,
        "GROUP_SIZE_M": 8,
        "num_stages": 6,
        "num_warps": 16,
        "compile_time": 0.6926805973052979
    },
    {
        "BLOCK_SIZE_M": 64,
        "BLOCK_SIZE_N": 256,
        "BLOCK_SIZE_K": 64,
        "GROUP_SIZE_M": 8,
        "num_stages": 6,
        "num_warps": 32,
        "compile_time": 0.5535750389099121
    },
    {
        "BLOCK_SIZE_M": 64,
        "BLOCK_SIZE_N": 256,
        "BLOCK_SIZE_K": 64,
        "GROUP_SIZE_M": 8,
        "num_stages": 7,
        "num_warps": 2,
        "compile_time": 4.739604234695435
    },
    {
        "BLOCK_SIZE_M": 64,
        "BLOCK_SIZE_N": 256,
        "BLOCK_SIZE_K": 64,
        "GROUP_SIZE_M": 8,
        "num_stages": 7,
        "num_warps": 4,
        "compile_time": 1.808154821395874
    },
    {
        "BLOCK_SIZE_M": 64,
        "BLOCK_SIZE_N": 256,
        "BLOCK_SIZE_K": 64,
        "GROUP_SIZE_M": 8,
        "num_stages": 7,
        "num_warps": 8,
        "compile_time": 1.0438368320465088
    },
    {
        "BLOCK_SIZE_M": 64,
        "BLOCK_SIZE_N": 256,
        "BLOCK_SIZE_K": 64,
        "GROUP_SIZE_M": 8,
        "num_stages": 7,
        "num_warps": 16,
        "compile_time": 0.7031323909759521
    },
    {
        "BLOCK_SIZE_M": 64,
        "BLOCK_SIZE_N": 256,
        "BLOCK_SIZE_K": 64,
        "GROUP_SIZE_M": 8,
        "num_stages": 7,
        "num_warps": 32,
        "compile_time": 0.5498850345611572
    },
    {
        "BLOCK_SIZE_M": 64,
        "BLOCK_SIZE_N": 256,
        "BLOCK_SIZE_K": 64,
        "GROUP_SIZE_M": 8,
        "num_stages": 8,
        "num_warps": 2,
        "compile_time": 4.898463010787964
    },
    {
        "BLOCK_SIZE_M": 64,
        "BLOCK_SIZE_N": 256,
        "BLOCK_SIZE_K": 64,
        "GROUP_SIZE_M": 8,
        "num_stages": 8,
        "num_warps": 4,
        "compile_time": 1.871845006942749
    },
    {
        "BLOCK_SIZE_M": 64,
        "BLOCK_SIZE_N": 256,
        "BLOCK_SIZE_K": 64,
        "GROUP_SIZE_M": 8,
        "num_stages": 8,
        "num_warps": 8,
        "compile_time": 1.1128547191619873
    },
    {
        "BLOCK_SIZE_M": 64,
        "BLOCK_SIZE_N": 256,
        "BLOCK_SIZE_K": 64,
        "GROUP_SIZE_M": 8,
        "num_stages": 8,
        "num_warps": 16,
        "compile_time": 0.7511634826660156
    },
    {
        "BLOCK_SIZE_M": 64,
        "BLOCK_SIZE_N": 256,
        "BLOCK_SIZE_K": 64,
        "GROUP_SIZE_M": 8,
        "num_stages": 8,
        "num_warps": 32,
        "compile_time": 0.5894758701324463
    },
    {
        "BLOCK_SIZE_M": 64,
        "BLOCK_SIZE_N": 256,
        "BLOCK_SIZE_K": 128,
        "GROUP_SIZE_M": 8,
        "num_stages": 1,
        "num_warps": 2,
        "compile_time": 6.001363277435303
    },
    {
        "BLOCK_SIZE_M": 64,
        "BLOCK_SIZE_N": 256,
        "BLOCK_SIZE_K": 128,
        "GROUP_SIZE_M": 8,
        "num_stages": 2,
        "num_warps": 2,
        "compile_time": 6.021076202392578
    },
    {
        "BLOCK_SIZE_M": 64,
        "BLOCK_SIZE_N": 256,
        "BLOCK_SIZE_K": 128,
        "GROUP_SIZE_M": 8,
        "num_stages": 3,
        "num_warps": 2,
        "compile_time": 12.644996881484985
    },
    {
        "BLOCK_SIZE_M": 64,
        "BLOCK_SIZE_N": 256,
        "BLOCK_SIZE_K": 128,
        "GROUP_SIZE_M": 8,
        "num_stages": 4,
        "num_warps": 2,
        "compile_time": 12.964518547058105
    },
    {
        "BLOCK_SIZE_M": 64,
        "BLOCK_SIZE_N": 256,
        "BLOCK_SIZE_K": 128,
        "GROUP_SIZE_M": 8,
        "num_stages": 4,
        "num_warps": 4,
        "compile_time": 2.874671697616577
    },
    {
        "BLOCK_SIZE_M": 64,
        "BLOCK_SIZE_N": 256,
        "BLOCK_SIZE_K": 128,
        "GROUP_SIZE_M": 8,
        "num_stages": 4,
        "num_warps": 8,
        "compile_time": 1.2961595058441162
    },
    {
        "BLOCK_SIZE_M": 64,
        "BLOCK_SIZE_N": 256,
        "BLOCK_SIZE_K": 128,
        "GROUP_SIZE_M": 8,
        "num_stages": 4,
        "num_warps": 16,
        "compile_time": 0.8720805644989014
    },
    {
        "BLOCK_SIZE_M": 64,
        "BLOCK_SIZE_N": 256,
        "BLOCK_SIZE_K": 128,
        "GROUP_SIZE_M": 8,
        "num_stages": 4,
        "num_warps": 32,
        "compile_time": 0.6510417461395264
    },
    {
        "BLOCK_SIZE_M": 64,
        "BLOCK_SIZE_N": 256,
        "BLOCK_SIZE_K": 128,
        "GROUP_SIZE_M": 8,
        "num_stages": 5,
        "num_warps": 2,
        "compile_time": 13.286926507949829
    },
    {
        "BLOCK_SIZE_M": 64,
        "BLOCK_SIZE_N": 256,
        "BLOCK_SIZE_K": 128,
        "GROUP_SIZE_M": 8,
        "num_stages": 5,
        "num_warps": 4,
        "compile_time": 3.0006377696990967
    },
    {
        "BLOCK_SIZE_M": 64,
        "BLOCK_SIZE_N": 256,
        "BLOCK_SIZE_K": 128,
        "GROUP_SIZE_M": 8,
        "num_stages": 5,
        "num_warps": 8,
        "compile_time": 1.3907372951507568
    },
    {
        "BLOCK_SIZE_M": 64,
        "BLOCK_SIZE_N": 256,
        "BLOCK_SIZE_K": 128,
        "GROUP_SIZE_M": 8,
        "num_stages": 5,
        "num_warps": 16,
        "compile_time": 0.9162037372589111
    },
    {
        "BLOCK_SIZE_M": 64,
        "BLOCK_SIZE_N": 256,
        "BLOCK_SIZE_K": 128,
        "GROUP_SIZE_M": 8,
        "num_stages": 5,
        "num_warps": 32,
        "compile_time": 0.6598479747772217
    },
    {
        "BLOCK_SIZE_M": 64,
        "BLOCK_SIZE_N": 256,
        "BLOCK_SIZE_K": 128,
        "GROUP_SIZE_M": 8,
        "num_stages": 6,
        "num_warps": 2,
        "compile_time": 13.291711568832397
    },
    {
        "BLOCK_SIZE_M": 64,
        "BLOCK_SIZE_N": 256,
        "BLOCK_SIZE_K": 128,
        "GROUP_SIZE_M": 8,
        "num_stages": 6,
        "num_warps": 4,
        "compile_time": 3.151120901107788
    },
    {
        "BLOCK_SIZE_M": 64,
        "BLOCK_SIZE_N": 256,
        "BLOCK_SIZE_K": 128,
        "GROUP_SIZE_M": 8,
        "num_stages": 6,
        "num_warps": 8,
        "compile_time": 1.479766845703125
    },
    {
        "BLOCK_SIZE_M": 64,
        "BLOCK_SIZE_N": 256,
        "BLOCK_SIZE_K": 128,
        "GROUP_SIZE_M": 8,
        "num_stages": 6,
        "num_warps": 16,
        "compile_time": 0.9709663391113281
    },
    {
        "BLOCK_SIZE_M": 64,
        "BLOCK_SIZE_N": 256,
        "BLOCK_SIZE_K": 128,
        "GROUP_SIZE_M": 8,
        "num_stages": 6,
        "num_warps": 32,
        "compile_time": 0.7174463272094727
    },
    {
        "BLOCK_SIZE_M": 64,
        "BLOCK_SIZE_N": 256,
        "BLOCK_SIZE_K": 128,
        "GROUP_SIZE_M": 8,
        "num_stages": 7,
        "num_warps": 2,
        "compile_time": 13.633595705032349
    },
    {
        "BLOCK_SIZE_M": 64,
        "BLOCK_SIZE_N": 256,
        "BLOCK_SIZE_K": 128,
        "GROUP_SIZE_M": 8,
        "num_stages": 7,
        "num_warps": 4,
        "compile_time": 3.358402967453003
    },
    {
        "BLOCK_SIZE_M": 64,
        "BLOCK_SIZE_N": 256,
        "BLOCK_SIZE_K": 128,
        "GROUP_SIZE_M": 8,
        "num_stages": 7,
        "num_warps": 8,
        "compile_time": 1.5898549556732178
    },
    {
        "BLOCK_SIZE_M": 64,
        "BLOCK_SIZE_N": 256,
        "BLOCK_SIZE_K": 128,
        "GROUP_SIZE_M": 8,
        "num_stages": 7,
        "num_warps": 16,
        "compile_time": 1.0272681713104248
    },
    {
        "BLOCK_SIZE_M": 64,
        "BLOCK_SIZE_N": 256,
        "BLOCK_SIZE_K": 128,
        "GROUP_SIZE_M": 8,
        "num_stages": 7,
        "num_warps": 32,
        "compile_time": 0.7211947441101074
    },
    {
        "BLOCK_SIZE_M": 64,
        "BLOCK_SIZE_N": 256,
        "BLOCK_SIZE_K": 128,
        "GROUP_SIZE_M": 8,
        "num_stages": 8,
        "num_warps": 2,
        "compile_time": 13.846402883529663
    },
    {
        "BLOCK_SIZE_M": 64,
        "BLOCK_SIZE_N": 256,
        "BLOCK_SIZE_K": 128,
        "GROUP_SIZE_M": 8,
        "num_stages": 8,
        "num_warps": 4,
        "compile_time": 3.4691855907440186
    },
    {
        "BLOCK_SIZE_M": 64,
        "BLOCK_SIZE_N": 256,
        "BLOCK_SIZE_K": 128,
        "GROUP_SIZE_M": 8,
        "num_stages": 8,
        "num_warps": 8,
        "compile_time": 1.7122554779052734
    },
    {
        "BLOCK_SIZE_M": 64,
        "BLOCK_SIZE_N": 256,
        "BLOCK_SIZE_K": 128,
        "GROUP_SIZE_M": 8,
        "num_stages": 8,
        "num_warps": 16,
        "compile_time": 1.0811231136322021
    },
    {
        "BLOCK_SIZE_M": 64,
        "BLOCK_SIZE_N": 256,
        "BLOCK_SIZE_K": 128,
        "GROUP_SIZE_M": 8,
        "num_stages": 8,
        "num_warps": 32,
        "compile_time": 0.773277759552002
    },
    {
        "BLOCK_SIZE_M": 64,
        "BLOCK_SIZE_N": 256,
        "BLOCK_SIZE_K": 256,
        "GROUP_SIZE_M": 8,
        "num_stages": 1,
        "num_warps": 2,
        "compile_time": 6.181654691696167
    },
    {
        "BLOCK_SIZE_M": 64,
        "BLOCK_SIZE_N": 256,
        "BLOCK_SIZE_K": 256,
        "GROUP_SIZE_M": 8,
        "num_stages": 2,
        "num_warps": 2,
        "compile_time": 6.384556293487549
    },
    {
        "BLOCK_SIZE_M": 64,
        "BLOCK_SIZE_N": 256,
        "BLOCK_SIZE_K": 256,
        "GROUP_SIZE_M": 8,
        "num_stages": 3,
        "num_warps": 2,
        "compile_time": 6.812122583389282
    },
    {
        "BLOCK_SIZE_M": 64,
        "BLOCK_SIZE_N": 256,
        "BLOCK_SIZE_K": 256,
        "GROUP_SIZE_M": 8,
        "num_stages": 3,
        "num_warps": 4,
        "compile_time": 11.367979526519775
    },
    {
        "BLOCK_SIZE_M": 64,
        "BLOCK_SIZE_N": 256,
        "BLOCK_SIZE_K": 256,
        "GROUP_SIZE_M": 8,
        "num_stages": 3,
        "num_warps": 8,
        "compile_time": 2.4762654304504395
    },
    {
        "BLOCK_SIZE_M": 64,
        "BLOCK_SIZE_N": 256,
        "BLOCK_SIZE_K": 256,
        "GROUP_SIZE_M": 8,
        "num_stages": 3,
        "num_warps": 16,
        "compile_time": 1.2062907218933105
    },
    {
        "BLOCK_SIZE_M": 64,
        "BLOCK_SIZE_N": 256,
        "BLOCK_SIZE_K": 256,
        "GROUP_SIZE_M": 8,
        "num_stages": 3,
        "num_warps": 32,
        "compile_time": 0.7996788024902344
    },
    {
        "BLOCK_SIZE_M": 64,
        "BLOCK_SIZE_N": 256,
        "BLOCK_SIZE_K": 256,
        "GROUP_SIZE_M": 8,
        "num_stages": 4,
        "num_warps": 2,
        "compile_time": 7.234431982040405
    },
    {
        "BLOCK_SIZE_M": 64,
        "BLOCK_SIZE_N": 256,
