simdata/FP16-R100/1536_results.json
[
    {
        "BLOCK_SIZE_M": 256,
        "BLOCK_SIZE_N": 128,
        "BLOCK_SIZE_K": 32,
        "GROUP_SIZE_M": 8,
        "num_stages": 4,
        "num_warps": 8,
        "ms": 0.04123243689537048,
        "min_ms": 0.04123243689537048,
        "max_ms": 0.04123243689537048,
        "compile_time": 1.6281194686889648
    },
    {
        "BLOCK_SIZE_M": 128,
        "BLOCK_SIZE_N": 256,
        "BLOCK_SIZE_K": 32,
        "GROUP_SIZE_M": 8,
        "num_stages": 4,
        "num_warps": 8,
        "ms": 0.04132041335105896,
        "min_ms": 0.04132041335105896,
        "max_ms": 0.04132041335105896,
        "compile_time": 2.0495541095733643
    },
    {
        "BLOCK_SIZE_M": 64,
        "BLOCK_SIZE_N": 128,
        "BLOCK_SIZE_K": 32,
        "GROUP_SIZE_M": 8,
        "num_stages": 3,
        "num_warps": 4,
        "ms": 0.04157865047454834,
        "min_ms": 0.04157865047454834,
        "max_ms": 0.04157865047454834,
        "compile_time": 1.5347850322723389
    },
    {
        "BLOCK_SIZE_M": 128,
        "BLOCK_SIZE_N": 256,
        "BLOCK_SIZE_K": 32,
        "GROUP_SIZE_M": 8,
        "num_stages": 5,
        "num_warps": 8,
        "ms": 0.041721370071172714,
        "min_ms": 0.041721370071172714,
        "max_ms": 0.041721370071172714,
        "compile_time": 2.0960278511047363
    },
    {
        "BLOCK_SIZE_M": 128,
        "BLOCK_SIZE_N": 256,
        "BLOCK_SIZE_K": 32,
        "GROUP_SIZE_M": 8,
        "num_stages": 3,
        "num_warps": 8,
        "ms": 0.04182463511824608,
        "min_ms": 0.04182463511824608,
        "max_ms": 0.04182463511824608,
        "compile_time": 2.012526273727417
    },
    {
        "BLOCK_SIZE_M": 128,
        "BLOCK_SIZE_N": 256,
        "BLOCK_SIZE_K": 32,
        "GROUP_SIZE_M": 8,
        "num_stages": 6,
        "num_warps": 8,
        "ms": 0.04207364469766617,
        "min_ms": 0.04207364469766617,
        "max_ms": 0.04207364469766617,
        "compile_time": 2.132704257965088
    },
    {
        "BLOCK_SIZE_M": 128,
        "BLOCK_SIZE_N": 64,
        "BLOCK_SIZE_K": 64,
        "GROUP_SIZE_M": 8,
        "num_stages": 3,
        "num_warps": 4,
        "ms": 0.042138323187828064,
        "min_ms": 0.042138323187828064,
        "max_ms": 0.042138323187828064,
        "compile_time": 1.7999939918518066
    },
    {
        "BLOCK_SIZE_M": 64,
        "BLOCK_SIZE_N": 128,
        "BLOCK_SIZE_K": 32,
        "GROUP_SIZE_M": 8,
        "num_stages": 4,
        "num_warps": 4,
        "ms": 0.042160339653491974,
        "min_ms": 0.042160339653491974,
        "max_ms": 0.042160339653491974,
        "compile_time": 1.5645017623901367
    },
    {
        "BLOCK_SIZE_M": 256,
        "BLOCK_SIZE_N": 128,
        "BLOCK_SIZE_K": 32,
        "GROUP_SIZE_M": 8,
        "num_stages": 5,
        "num_warps": 8,
        "ms": 0.04223731532692909,
        "min_ms": 0.04223731532692909,
        "max_ms": 0.04223731532692909,
        "compile_time": 1.5752754211425781
    },
    {
        "BLOCK_SIZE_M": 256,
        "BLOCK_SIZE_N": 128,
        "BLOCK_SIZE_K": 32,
        "GROUP_SIZE_M": 8,
        "num_stages": 6,
        "num_warps": 8,
        "ms": 0.042354706674814224,
        "min_ms": 0.042354706674814224,
        "max_ms": 0.042354706674814224,
        "compile_time": 1.5202972888946533
    },
    {
        "BLOCK_SIZE_M": 128,
        "BLOCK_SIZE_N": 256,
        "BLOCK_SIZE_K": 32,
        "GROUP_SIZE_M": 8,
        "num_stages": 7,
        "num_warps": 8,
        "ms": 0.04236659035086632,
        "min_ms": 0.04236659035086632,
        "max_ms": 0.04236659035086632,
        "compile_time": 2.1569576263427734
    },
    {
        "BLOCK_SIZE_M": 256,
        "BLOCK_SIZE_N": 128,
        "BLOCK_SIZE_K": 32,
        "GROUP_SIZE_M": 8,
        "num_stages": 3,
        "num_warps": 8,
        "ms": 0.04250096157193184,
        "min_ms": 0.04250096157193184,
        "max_ms": 0.04250096157193184,
        "compile_time": 1.5715889930725098
    },
    {
        "BLOCK_SIZE_M": 256,
        "BLOCK_SIZE_N": 128,
        "BLOCK_SIZE_K": 32,
        "GROUP_SIZE_M": 8,
        "num_stages": 7,
        "num_warps": 8,
        "ms": 0.04260791465640068,
        "min_ms": 0.04260791465640068,
        "max_ms": 0.04260791465640068,
        "compile_time": 1.5302951335906982
    },
    {
        "BLOCK_SIZE_M": 128,
        "BLOCK_SIZE_N": 128,
        "BLOCK_SIZE_K": 32,
        "GROUP_SIZE_M": 8,
        "num_stages": 4,
        "num_warps": 4,
        "ms": 0.04268995672464371,
        "min_ms": 0.04268995672464371,
        "max_ms": 0.04268995672464371,
        "compile_time": 2.070138454437256
    },
    {
        "BLOCK_SIZE_M": 128,
        "BLOCK_SIZE_N": 64,
        "BLOCK_SIZE_K": 32,
        "GROUP_SIZE_M": 8,
        "num_stages": 3,
        "num_warps": 4,
        "ms": 0.04270030930638313,
        "min_ms": 0.04270030930638313,
        "max_ms": 0.04270030930638313,
        "compile_time": 1.6199512481689453
    },
    {
        "BLOCK_SIZE_M": 128,
        "BLOCK_SIZE_N": 128,
        "BLOCK_SIZE_K": 32,
        "GROUP_SIZE_M": 8,
        "num_stages": 3,
        "num_warps": 4,
        "ms": 0.0427904836833477,
        "min_ms": 0.0427904836833477,
        "max_ms": 0.0427904836833477,
        "compile_time": 2.029179811477661
    },
    {
        "BLOCK_SIZE_M": 128,
        "BLOCK_SIZE_N": 128,
        "BLOCK_SIZE_K": 32,
        "GROUP_SIZE_M": 8,
        "num_stages": 5,
        "num_warps": 4,
        "ms": 0.04291997104883194,
        "min_ms": 0.04291997104883194,
        "max_ms": 0.04291997104883194,
        "compile_time": 2.022799491882324
    },
    {
        "BLOCK_SIZE_M": 64,
        "BLOCK_SIZE_N": 128,
        "BLOCK_SIZE_K": 64,
        "GROUP_SIZE_M": 8,
        "num_stages": 4,
        "num_warps": 4,
        "ms": 0.0429411306977272,
        "min_ms": 0.0429411306977272,
        "max_ms": 0.0429411306977272,
        "compile_time": 1.7525298595428467
    },
    {
        "BLOCK_SIZE_M": 64,
        "BLOCK_SIZE_N": 128,
        "BLOCK_SIZE_K": 32,
        "GROUP_SIZE_M": 8,
        "num_stages": 5,
        "num_warps": 4,
        "ms": 0.04303515702486038,
        "min_ms": 0.04303515702486038,
        "max_ms": 0.04303515702486038,
        "compile_time": 1.5956742763519287
    },
    {
        "BLOCK_SIZE_M": 64,
        "BLOCK_SIZE_N": 256,
        "BLOCK_SIZE_K": 32,
        "GROUP_SIZE_M": 8,
        "num_stages": 4,
        "num_warps": 4,
        "ms": 0.043265219777822495,
        "min_ms": 0.043265219777822495,
        "max_ms": 0.043265219777822495,
        "compile_time": 2.0310380458831787
    },
    {
        "BLOCK_SIZE_M": 128,
        "BLOCK_SIZE_N": 64,
        "BLOCK_SIZE_K": 32,
        "GROUP_SIZE_M": 8,
        "num_stages": 4,
        "num_warps": 4,
        "ms": 0.04328061267733574,
        "min_ms": 0.04328061267733574,
        "max_ms": 0.04328061267733574,
        "compile_time": 1.6108930110931396
    },
    {
        "BLOCK_SIZE_M": 128,
        "BLOCK_SIZE_N": 128,
        "BLOCK_SIZE_K": 32,
        "GROUP_SIZE_M": 8,
        "num_stages": 6,
        "num_warps": 4,
        "ms": 0.043299369513988495,
        "min_ms": 0.043299369513988495,
        "max_ms": 0.043299369513988495,
        "compile_time": 2.139998197555542
    },
    {
        "BLOCK_SIZE_M": 128,
        "BLOCK_SIZE_N": 64,
        "BLOCK_SIZE_K": 32,
        "GROUP_SIZE_M": 8,
        "num_stages": 5,
        "num_warps": 4,
        "ms": 0.04331127554178238,
        "min_ms": 0.04331127554178238,
        "max_ms": 0.04331127554178238,
        "compile_time": 1.651740312576294
    },
    {
        "BLOCK_SIZE_M": 128,
        "BLOCK_SIZE_N": 64,
        "BLOCK_SIZE_K": 32,
        "GROUP_SIZE_M": 8,
        "num_stages": 3,
        "num_warps": 2,
        "ms": 0.043367236852645874,
        "min_ms": 0.043367236852645874,
        "max_ms": 0.043367236852645874,
        "compile_time": 2.108668327331543
    },
    {
        "BLOCK_SIZE_M": 64,
        "BLOCK_SIZE_N": 256,
        "BLOCK_SIZE_K": 32,
        "GROUP_SIZE_M": 8,
        "num_stages": 3,
        "num_warps": 4,
        "ms": 0.04343455657362938,
        "min_ms": 0.04343455657362938,
        "max_ms": 0.04343455657362938,
        "compile_time": 1.9858248233795166
    },
    {
        "BLOCK_SIZE_M": 64,
        "BLOCK_SIZE_N": 128,
        "BLOCK_SIZE_K": 32,
        "GROUP_SIZE_M": 8,
        "num_stages": 6,
        "num_warps": 4,
        "ms": 0.043773215264081955,
        "min_ms": 0.043773215264081955,
        "max_ms": 0.043773215264081955,
        "compile_time": 1.6034917831420898
    },
    {
        "BLOCK_SIZE_M": 64,
        "BLOCK_SIZE_N": 128,
        "BLOCK_SIZE_K": 32,
        "GROUP_SIZE_M": 8,
        "num_stages": 3,
        "num_warps": 2,
        "ms": 0.04385250061750412,
        "min_ms": 0.04385250061750412,
        "max_ms": 0.04385250061750412,
        "compile_time": 2.0206854343414307
    },
    {
        "BLOCK_SIZE_M": 64,
        "BLOCK_SIZE_N": 256,
        "BLOCK_SIZE_K": 32,
        "GROUP_SIZE_M": 8,
        "num_stages": 5,
        "num_warps": 4,
        "ms": 0.044087380170822144,
        "min_ms": 0.044087380170822144,
        "max_ms": 0.044087380170822144,
        "compile_time": 2.0931155681610107
    },
    {
        "BLOCK_SIZE_M": 128,
        "BLOCK_SIZE_N": 64,
        "BLOCK_SIZE_K": 64,
        "GROUP_SIZE_M": 8,
        "num_stages": 4,
        "num_warps": 4,
        "ms": 0.044133126735687256,
        "min_ms": 0.044133126735687256,
        "max_ms": 0.044133126735687256,
        "compile_time": 1.8875744342803955
    },
    {
        "BLOCK_SIZE_M": 64,
        "BLOCK_SIZE_N": 128,
        "BLOCK_SIZE_K": 32,
        "GROUP_SIZE_M": 8,
        "num_stages": 4,
        "num_warps": 2,
        "ms": 0.0442151203751564,
        "min_ms": 0.0442151203751564,
        "max_ms": 0.0442151203751564,
        "compile_time": 2.064915657043457
    },
    {
        "BLOCK_SIZE_M": 64,
        "BLOCK_SIZE_N": 128,
        "BLOCK_SIZE_K": 32,
        "GROUP_SIZE_M": 8,
        "num_stages": 7,
        "num_warps": 4,
        "ms": 0.044519104063510895,
        "min_ms": 0.044519104063510895,
        "max_ms": 0.044519104063510895,
        "compile_time": 1.6459457874298096
    },
    {
        "BLOCK_SIZE_M": 128,
        "BLOCK_SIZE_N": 64,
        "BLOCK_SIZE_K": 32,
        "GROUP_SIZE_M": 8,
        "num_stages": 6,
        "num_warps": 4,
        "ms": 0.04456878453493118,
        "min_ms": 0.04456878453493118,
        "max_ms": 0.04456878453493118,
        "compile_time": 1.6871843338012695
    },
    {
        "BLOCK_SIZE_M": 128,
        "BLOCK_SIZE_N": 128,
        "BLOCK_SIZE_K": 64,
        "GROUP_SIZE_M": 8,
        "num_stages": 3,
        "num_warps": 4,
        "ms": 0.044748347252607346,
        "min_ms": 0.044748347252607346,
        "max_ms": 0.044748347252607346,
        "compile_time": 2.3130226135253906
    },
    {
        "BLOCK_SIZE_M": 64,
        "BLOCK_SIZE_N": 128,
        "BLOCK_SIZE_K": 64,
        "GROUP_SIZE_M": 8,
        "num_stages": 5,
        "num_warps": 4,
        "ms": 0.0447542630136013,
        "min_ms": 0.0447542630136013,
        "max_ms": 0.0447542630136013,
        "compile_time": 1.7832167148590088
    },
    {
        "BLOCK_SIZE_M": 64,
        "BLOCK_SIZE_N": 128,
        "BLOCK_SIZE_K": 32,
        "GROUP_SIZE_M": 8,
        "num_stages": 5,
        "num_warps": 2,
        "ms": 0.044775914400815964,
        "min_ms": 0.044775914400815964,
        "max_ms": 0.044775914400815964,
        "compile_time": 2.098566770553589
    },
    {
        "BLOCK_SIZE_M": 64,
        "BLOCK_SIZE_N": 128,
        "BLOCK_SIZE_K": 64,
        "GROUP_SIZE_M": 8,
        "num_stages": 6,
        "num_warps": 4,
        "ms": 0.04512579366564751,
        "min_ms": 0.04512579366564751,
        "max_ms": 0.04512579366564751,
        "compile_time": 1.8430616855621338
    },
    {
        "BLOCK_SIZE_M": 256,
        "BLOCK_SIZE_N": 128,
        "BLOCK_SIZE_K": 64,
        "GROUP_SIZE_M": 8,
        "num_stages": 3,
        "num_warps": 8,
        "ms": 0.04516446217894554,
        "min_ms": 0.04516446217894554,
        "max_ms": 0.04516446217894554,
        "compile_time": 1.4316010475158691
    },
    {
        "BLOCK_SIZE_M": 128,
        "BLOCK_SIZE_N": 64,
        "BLOCK_SIZE_K": 32,
        "GROUP_SIZE_M": 8,
        "num_stages": 7,
        "num_warps": 4,
        "ms": 0.04539211094379425,
        "min_ms": 0.04539211094379425,
        "max_ms": 0.04539211094379425,
        "compile_time": 1.6262166500091553
    },
    {
        "BLOCK_SIZE_M": 64,
        "BLOCK_SIZE_N": 512,
        "BLOCK_SIZE_K": 32,
        "GROUP_SIZE_M": 8,
        "num_stages": 3,
        "num_warps": 8,
        "ms": 0.045419104397296906,
        "min_ms": 0.045419104397296906,
        "max_ms": 0.045419104397296906,
        "compile_time": 2.0172979831695557
    },
    {
        "BLOCK_SIZE_M": 128,
        "BLOCK_SIZE_N": 64,
        "BLOCK_SIZE_K": 32,
        "GROUP_SIZE_M": 8,
        "num_stages": 4,
        "num_warps": 2,
        "ms": 0.04550684243440628,
        "min_ms": 0.04550684243440628,
        "max_ms": 0.04550684243440628,
        "compile_time": 2.1390392780303955
    },
    {
        "BLOCK_SIZE_M": 256,
        "BLOCK_SIZE_N": 128,
        "BLOCK_SIZE_K": 64,
        "GROUP_SIZE_M": 8,
        "num_stages": 4,
        "num_warps": 8,
        "ms": 0.04560994729399681,
        "min_ms": 0.04560994729399681,
        "max_ms": 0.04560994729399681,
        "compile_time": 1.5218594074249268
    },
    {
        "BLOCK_SIZE_M": 64,
        "BLOCK_SIZE_N": 512,
        "BLOCK_SIZE_K": 32,
        "GROUP_SIZE_M": 8,
        "num_stages": 5,
        "num_warps": 8,
        "ms": 0.04566950723528862,
        "min_ms": 0.04566950723528862,
        "max_ms": 0.04566950723528862,
        "compile_time": 2.138004779815674
    },
    {
        "BLOCK_SIZE_M": 128,
        "BLOCK_SIZE_N": 64,
        "BLOCK_SIZE_K": 32,
        "GROUP_SIZE_M": 8,
        "num_stages": 5,
        "num_warps": 2,
        "ms": 0.04568794369697571,
        "min_ms": 0.04568794369697571,
        "max_ms": 0.04568794369697571,
        "compile_time": 2.1834795475006104
    },
    {
        "BLOCK_SIZE_M": 128,
        "BLOCK_SIZE_N": 128,
        "BLOCK_SIZE_K": 32,
        "GROUP_SIZE_M": 8,
        "num_stages": 7,
        "num_warps": 4,
        "ms": 0.04577473923563957,
        "min_ms": 0.04577473923563957,
        "max_ms": 0.04577473923563957,
        "compile_time": 2.2132842540740967
    },
    {
        "BLOCK_SIZE_M": 64,
        "BLOCK_SIZE_N": 128,
        "BLOCK_SIZE_K": 64,
        "GROUP_SIZE_M": 8,
        "num_stages": 3,
        "num_warps": 4,
        "ms": 0.04589574784040451,
        "min_ms": 0.04589574784040451,
        "max_ms": 0.04589574784040451,
        "compile_time": 1.7229728698730469
    },
    {
        "BLOCK_SIZE_M": 128,
        "BLOCK_SIZE_N": 64,
        "BLOCK_SIZE_K": 64,
        "GROUP_SIZE_M": 8,
        "num_stages": 2,
        "num_warps": 4,
        "ms": 0.046082496643066406,
        "min_ms": 0.046082496643066406,
        "max_ms": 0.046082496643066406,
        "compile_time": 1.8243365287780762
    },
    {
        "BLOCK_SIZE_M": 64,
        "BLOCK_SIZE_N": 128,
        "BLOCK_SIZE_K": 64,
        "GROUP_SIZE_M": 8,
        "num_stages": 3,
        "num_warps": 8,
        "ms": 0.04630454257130623,
        "min_ms": 0.04630454257130623,
        "max_ms": 0.04630454257130623,
        "compile_time": 1.4641268253326416
    },
    {
        "BLOCK_SIZE_M": 64,
        "BLOCK_SIZE_N": 128,
        "BLOCK_SIZE_K": 32,
        "GROUP_SIZE_M": 8,
        "num_stages": 8,
        "num_warps": 4,
        "ms": 0.04637667164206505,
        "min_ms": 0.04637667164206505,
        "max_ms": 0.04637667164206505,
        "compile_time": 1.6637744903564453
    },
    {
        "BLOCK_SIZE_M": 128,
        "BLOCK_SIZE_N": 128,
        "BLOCK_SIZE_K": 32,
        "GROUP_SIZE_M": 8,
        "num_stages": 8,
        "num_warps": 4,
        "ms": 0.04640717804431915,
        "min_ms": 0.04640717804431915,
        "max_ms": 0.04640717804431915,
        "compile_time": 2.3281543254852295
    },
    {
        "BLOCK_SIZE_M": 64,
        "BLOCK_SIZE_N": 128,
        "BLOCK_SIZE_K": 64,
        "GROUP_SIZE_M": 8,
        "num_stages": 7,
        "num_warps": 4,
        "ms": 0.046482108533382416,
        "min_ms": 0.046482108533382416,
        "max_ms": 0.046482108533382416,
        "compile_time": 1.9177067279815674
    },
    {
        "BLOCK_SIZE_M": 128,
        "BLOCK_SIZE_N": 128,
        "BLOCK_SIZE_K": 64,
        "GROUP_SIZE_M": 8,
        "num_stages": 3,
        "num_warps": 8,
        "ms": 0.04653496295213699,
        "min_ms": 0.04653496295213699,
        "max_ms": 0.04653496295213699,
        "compile_time": 1.8720388412475586
    },
    {
        "BLOCK_SIZE_M": 128,
        "BLOCK_SIZE_N": 64,
        "BLOCK_SIZE_K": 64,
        "GROUP_SIZE_M": 8,
        "num_stages": 3,
        "num_warps": 8,
        "ms": 0.0465446338057518,
        "min_ms": 0.0465446338057518,
        "max_ms": 0.0465446338057518,
        "compile_time": 1.536583662033081
    },
    {
        "BLOCK_SIZE_M": 64,
        "BLOCK_SIZE_N": 128,
        "BLOCK_SIZE_K": 64,
        "GROUP_SIZE_M": 8,
        "num_stages": 4,
        "num_warps": 8,
        "ms": 0.04657469317317009,
        "min_ms": 0.04657469317317009,
        "max_ms": 0.04657469317317009,
        "compile_time": 1.5003621578216553
    },
    {
        "BLOCK_SIZE_M": 128,
        "BLOCK_SIZE_N": 64,
        "BLOCK_SIZE_K": 32,
        "GROUP_SIZE_M": 8,
        "num_stages": 6,
        "num_warps": 2,
        "ms": 0.04674631357192993,
        "min_ms": 0.04674631357192993,
        "max_ms": 0.04674631357192993,
        "compile_time": 2.2292380332946777
    },
    {
        "BLOCK_SIZE_M": 128,
        "BLOCK_SIZE_N": 128,
        "BLOCK_SIZE_K": 64,
        "GROUP_SIZE_M": 8,
        "num_stages": 4,
        "num_warps": 8,
        "ms": 0.04678913205862045,
        "min_ms": 0.04678913205862045,
        "max_ms": 0.04678913205862045,
        "compile_time": 1.9687278270721436
    },
    {
        "BLOCK_SIZE_M": 128,
        "BLOCK_SIZE_N": 256,
        "BLOCK_SIZE_K": 64,
        "GROUP_SIZE_M": 8,
        "num_stages": 3,
        "num_warps": 8,
        "ms": 0.046861737966537476,
        "min_ms": 0.046861737966537476,
        "max_ms": 0.046861737966537476,
        "compile_time": 2.238975763320923
    },
    {
        "BLOCK_SIZE_M": 128,
        "BLOCK_SIZE_N": 64,
        "BLOCK_SIZE_K": 64,
        "GROUP_SIZE_M": 8,
        "num_stages": 4,
        "num_warps": 8,
        "ms": 0.04689136520028114,
        "min_ms": 0.04689136520028114,
        "max_ms": 0.04689136520028114,
        "compile_time": 1.5986125469207764
    },
    {
        "BLOCK_SIZE_M": 128,
        "BLOCK_SIZE_N": 64,
        "BLOCK_SIZE_K": 64,
        "GROUP_SIZE_M": 8,
        "num_stages": 7,
        "num_warps": 4,
        "ms": 0.046892423182725906,
        "min_ms": 0.046892423182725906,
        "max_ms": 0.046892423182725906,
        "compile_time": 1.9943218231201172
    },
    {
        "BLOCK_SIZE_M": 64,
        "BLOCK_SIZE_N": 128,
        "BLOCK_SIZE_K": 32,
        "GROUP_SIZE_M": 8,
        "num_stages": 2,
        "num_warps": 4,
        "ms": 0.04695841670036316,
        "min_ms": 0.04695841670036316,
        "max_ms": 0.04695841670036316,
        "compile_time": 1.5387036800384521
    },
    {
        "BLOCK_SIZE_M": 128,
        "BLOCK_SIZE_N": 256,
        "BLOCK_SIZE_K": 64,
        "GROUP_SIZE_M": 8,
        "num_stages": 4,
        "num_warps": 8,
        "ms": 0.046964310109615326,
        "min_ms": 0.046964310109615326,
        "max_ms": 0.046964310109615326,
        "compile_time": 2.3414852619171143
    },
    {
        "BLOCK_SIZE_M": 128,
        "BLOCK_SIZE_N": 64,
        "BLOCK_SIZE_K": 32,
        "GROUP_SIZE_M": 8,
        "num_stages": 2,
        "num_warps": 4,
        "ms": 0.047304920852184296,
        "min_ms": 0.047304920852184296,
        "max_ms": 0.047304920852184296,
        "compile_time": 1.6230242252349854
    },
    {
        "BLOCK_SIZE_M": 128,
        "BLOCK_SIZE_N": 64,
        "BLOCK_SIZE_K": 64,
        "GROUP_SIZE_M": 8,
        "num_stages": 5,
        "num_warps": 4,
        "ms": 0.047416578978300095,
        "min_ms": 0.047416578978300095,
        "max_ms": 0.047416578978300095,
        "compile_time": 1.900564432144165
    },
    {
        "BLOCK_SIZE_M": 128,
        "BLOCK_SIZE_N": 128,
        "BLOCK_SIZE_K": 64,
        "GROUP_SIZE_M": 8,
        "num_stages": 5,
        "num_warps": 8,
        "ms": 0.04747863486409187,
        "min_ms": 0.04747863486409187,
        "max_ms": 0.04747863486409187,
        "compile_time": 1.9215762615203857
    },
    {
        "BLOCK_SIZE_M": 128,
        "BLOCK_SIZE_N": 64,
        "BLOCK_SIZE_K": 32,
        "GROUP_SIZE_M": 8,
        "num_stages": 7,
        "num_warps": 2,
        "ms": 0.04748072847723961,
        "min_ms": 0.04748072847723961,
        "max_ms": 0.04748072847723961,
        "compile_time": 2.2719461917877197
    },
    {
        "BLOCK_SIZE_M": 64,
        "BLOCK_SIZE_N": 128,
        "BLOCK_SIZE_K": 128,
        "GROUP_SIZE_M": 8,
        "num_stages": 3,
        "num_warps": 4,
        "ms": 0.047693029046058655,
        "min_ms": 0.047693029046058655,
        "max_ms": 0.047693029046058655,
        "compile_time": 2.0810153484344482
    },
    {
        "BLOCK_SIZE_M": 512,
        "BLOCK_SIZE_N": 64,
        "BLOCK_SIZE_K": 32,
        "GROUP_SIZE_M": 8,
        "num_stages": 4,
        "num_warps": 8,
        "ms": 0.04771197959780693,
        "min_ms": 0.04771197959780693,
        "max_ms": 0.04771197959780693,
        "compile_time": 2.67655873298645
    },
    {
        "BLOCK_SIZE_M": 128,
        "BLOCK_SIZE_N": 64,
        "BLOCK_SIZE_K": 32,
        "GROUP_SIZE_M": 8,
        "num_stages": 8,
        "num_warps": 4,
        "ms": 0.047763120383024216,
        "min_ms": 0.047763120383024216,
        "max_ms": 0.047763120383024216,
        "compile_time": 1.8265271186828613
    },
    {
        "BLOCK_SIZE_M": 128,
        "BLOCK_SIZE_N": 64,
        "BLOCK_SIZE_K": 64,
        "GROUP_SIZE_M": 8,
        "num_stages": 6,
        "num_warps": 4,
        "ms": 0.04810526594519615,
        "min_ms": 0.04810526594519615,
        "max_ms": 0.04810526594519615,
        "compile_time": 1.9468481540679932
    },
    {
        "BLOCK_SIZE_M": 512,
        "BLOCK_SIZE_N": 64,
        "BLOCK_SIZE_K": 32,
        "GROUP_SIZE_M": 8,
        "num_stages": 5,
        "num_warps": 8,
        "ms": 0.04813534393906593,
        "min_ms": 0.04813534393906593,
        "max_ms": 0.04813534393906593,
        "compile_time": 2.5125415325164795
    },
    {
        "BLOCK_SIZE_M": 128,
        "BLOCK_SIZE_N": 64,
        "BLOCK_SIZE_K": 64,
        "GROUP_SIZE_M": 8,
        "num_stages": 3,
        "num_warps": 2,
        "ms": 0.04830610007047653,
        "min_ms": 0.04830610007047653,
        "max_ms": 0.04830610007047653,
        "compile_time": 2.489607810974121
    },
    {
        "BLOCK_SIZE_M": 64,
        "BLOCK_SIZE_N": 128,
        "BLOCK_SIZE_K": 16,
        "GROUP_SIZE_M": 8,
        "num_stages": 7,
        "num_warps": 4,
        "ms": 0.048353247344493866,
        "min_ms": 0.048353247344493866,
        "max_ms": 0.048353247344493866,
        "compile_time": 1.5034785270690918
    },
    {
        "BLOCK_SIZE_M": 128,
        "BLOCK_SIZE_N": 64,
        "BLOCK_SIZE_K": 128,
        "GROUP_SIZE_M": 8,
        "num_stages": 3,
        "num_warps": 4,
        "ms": 0.04842843487858772,
        "min_ms": 0.04842843487858772,
        "max_ms": 0.04842843487858772,
        "compile_time": 2.2140135765075684
    },
    {
        "BLOCK_SIZE_M": 256,
        "BLOCK_SIZE_N": 64,
        "BLOCK_SIZE_K": 64,
        "GROUP_SIZE_M": 8,
        "num_stages": 3,
        "num_warps": 4,
        "ms": 0.04844369366765022,
        "min_ms": 0.04844369366765022,
        "max_ms": 0.04844369366765022,
        "compile_time": 2.6402242183685303
    },
    {
        "BLOCK_SIZE_M": 64,
        "BLOCK_SIZE_N": 128,
        "BLOCK_SIZE_K": 128,
        "GROUP_SIZE_M": 8,
        "num_stages": 4,
        "num_warps": 4,
        "ms": 0.04849393293261528,
        "min_ms": 0.04849393293261528,
        "max_ms": 0.04849393293261528,
        "compile_time": 2.1811845302581787
    },
    {
        "BLOCK_SIZE_M": 128,
        "BLOCK_SIZE_N": 128,
        "BLOCK_SIZE_K": 64,
        "GROUP_SIZE_M": 8,
        "num_stages": 6,
        "num_warps": 8,
        "ms": 0.04851879924535751,
        "min_ms": 0.04851879924535751,
        "max_ms": 0.04851879924535751,
        "compile_time": 2.0284712314605713
    },
    {
        "BLOCK_SIZE_M": 256,
        "BLOCK_SIZE_N": 64,
        "BLOCK_SIZE_K": 32,
        "GROUP_SIZE_M": 8,
        "num_stages": 4,
        "num_warps": 4,
        "ms": 0.048536866903305054,
        "min_ms": 0.048536866903305054,
        "max_ms": 0.048536866903305054,
        "compile_time": 2.3480753898620605
    },
    {
        "BLOCK_SIZE_M": 128,
        "BLOCK_SIZE_N": 128,
        "BLOCK_SIZE_K": 64,
        "GROUP_SIZE_M": 8,
        "num_stages": 2,
        "num_warps": 4,
        "ms": 0.04856216162443161,
        "min_ms": 0.04856216162443161,
        "max_ms": 0.04856216162443161,
        "compile_time": 2.1982691287994385
    },
    {
        "BLOCK_SIZE_M": 512,
        "BLOCK_SIZE_N": 64,
        "BLOCK_SIZE_K": 64,
        "GROUP_SIZE_M": 8,
        "num_stages": 3,
        "num_warps": 8,
        "ms": 0.048581451177597046,
        "min_ms": 0.048581451177597046,
        "max_ms": 0.048581451177597046,
        "compile_time": 2.7384896278381348
    },
    {
        "BLOCK_SIZE_M": 256,
        "BLOCK_SIZE_N": 64,
        "BLOCK_SIZE_K": 32,
        "GROUP_SIZE_M": 8,
        "num_stages": 5,
        "num_warps": 4,
        "ms": 0.048845075070858,
        "min_ms": 0.048845075070858,
        "max_ms": 0.048845075070858,
        "compile_time": 2.3684139251708984
    },
    {
        "BLOCK_SIZE_M": 64,
        "BLOCK_SIZE_N": 128,
        "BLOCK_SIZE_K": 128,
        "GROUP_SIZE_M": 8,
        "num_stages": 3,
        "num_warps": 8,
        "ms": 0.04886483773589134,
        "min_ms": 0.04886483773589134,
        "max_ms": 0.04886483773589134,
        "compile_time": 1.6699714660644531
    },
    {
        "BLOCK_SIZE_M": 64,
        "BLOCK_SIZE_N": 128,
        "BLOCK_SIZE_K": 16,
        "GROUP_SIZE_M": 8,
        "num_stages": 3,
        "num_warps": 4,
        "ms": 0.04917563870549202,
        "min_ms": 0.04917563870549202,
        "max_ms": 0.04917563870549202,
        "compile_time": 1.4276528358459473
    },
    {
        "BLOCK_SIZE_M": 64,
        "BLOCK_SIZE_N": 256,
        "BLOCK_SIZE_K": 64,
        "GROUP_SIZE_M": 8,
        "num_stages": 3,
        "num_warps": 8,
        "ms": 0.04933851957321167,
        "min_ms": 0.04933851957321167,
        "max_ms": 0.04933851957321167,
        "compile_time": 1.7457709312438965
    },
    {
        "BLOCK_SIZE_M": 512,
        "BLOCK_SIZE_N": 64,
        "BLOCK_SIZE_K": 32,
        "GROUP_SIZE_M": 8,
        "num_stages": 3,
        "num_warps": 8,
        "ms": 0.04934364929795265,
        "min_ms": 0.04934364929795265,
        "max_ms": 0.04934364929795265,
        "compile_time": 2.66330623626709
    },
    {
        "BLOCK_SIZE_M": 64,
        "BLOCK_SIZE_N": 128,
        "BLOCK_SIZE_K": 16,
        "GROUP_SIZE_M": 8,
        "num_stages": 4,
        "num_warps": 4,
        "ms": 0.049404632300138474,
        "min_ms": 0.049404632300138474,
        "max_ms": 0.049404632300138474,
        "compile_time": 1.4433629512786865
    },
    {
        "BLOCK_SIZE_M": 64,
        "BLOCK_SIZE_N": 256,
        "BLOCK_SIZE_K": 64,
        "GROUP_SIZE_M": 8,
        "num_stages": 4,
        "num_warps": 8,
        "ms": 0.04941149801015854,
        "min_ms": 0.04941149801015854,
        "max_ms": 0.04941149801015854,
        "compile_time": 1.8203072547912598
    },
    {
        "BLOCK_SIZE_M": 256,
        "BLOCK_SIZE_N": 64,
        "BLOCK_SIZE_K": 64,
        "GROUP_SIZE_M": 8,
        "num_stages": 3,
        "num_warps": 8,
        "ms": 0.04944906756281853,
        "min_ms": 0.04944906756281853,
        "max_ms": 0.04944906756281853,
        "compile_time": 2.0128262042999268
    },
    {
        "BLOCK_SIZE_M": 64,
        "BLOCK_SIZE_N": 128,
        "BLOCK_SIZE_K": 64,
        "GROUP_SIZE_M": 8,
        "num_stages": 5,
        "num_warps": 8,
        "ms": 0.049546293914318085,
        "min_ms": 0.049546293914318085,
        "max_ms": 0.049546293914318085,
        "compile_time": 1.5221521854400635
    },
    {
        "BLOCK_SIZE_M": 128,
        "BLOCK_SIZE_N": 64,
        "BLOCK_SIZE_K": 128,
        "GROUP_SIZE_M": 8,
        "num_stages": 3,
        "num_warps": 8,
        "ms": 0.04958866909146309,
        "min_ms": 0.04958866909146309,
        "max_ms": 0.04958866909146309,
        "compile_time": 1.7797207832336426
    },
    {
        "BLOCK_SIZE_M": 256,
        "BLOCK_SIZE_N": 64,
        "BLOCK_SIZE_K": 64,
        "GROUP_SIZE_M": 8,
        "num_stages": 4,
        "num_warps": 8,
        "ms": 0.049697503447532654,
        "min_ms": 0.049697503447532654,
        "max_ms": 0.049697503447532654,
        "compile_time": 2.0608761310577393
    },
    {
        "BLOCK_SIZE_M": 64,
        "BLOCK_SIZE_N": 128,
        "BLOCK_SIZE_K": 32,
        "GROUP_SIZE_M": 8,
        "num_stages": 3,
        "num_warps": 8,
        "ms": 0.049750156700611115,
        "min_ms": 0.049750156700611115,
        "max_ms": 0.049750156700611115,
        "compile_time": 1.4009568691253662
    },
    {
        "BLOCK_SIZE_M": 64,
        "BLOCK_SIZE_N": 128,
        "BLOCK_SIZE_K": 64,
        "GROUP_SIZE_M": 8,
        "num_stages": 6,
        "num_warps": 8,
        "ms": 0.049754321575164795,
        "min_ms": 0.049754321575164795,
        "max_ms": 0.049754321575164795,
        "compile_time": 1.5455849170684814
    },
    {
        "BLOCK_SIZE_M": 64,
        "BLOCK_SIZE_N": 128,
        "BLOCK_SIZE_K": 32,
        "GROUP_SIZE_M": 8,
        "num_stages": 4,
        "num_warps": 8,
        "ms": 0.04978043586015701,
        "min_ms": 0.04978043586015701,
        "max_ms": 0.04978043586015701,
        "compile_time": 1.3971502780914307
    },
    {
        "BLOCK_SIZE_M": 256,
        "BLOCK_SIZE_N": 64,
        "BLOCK_SIZE_K": 32,
        "GROUP_SIZE_M": 8,
        "num_stages": 3,
        "num_warps": 4,
        "ms": 0.049795739352703094,
        "min_ms": 0.049795739352703094,
        "max_ms": 0.049795739352703094,
        "compile_time": 2.2208189964294434
    },
    {
        "BLOCK_SIZE_M": 128,
        "BLOCK_SIZE_N": 64,
        "BLOCK_SIZE_K": 64,
        "GROUP_SIZE_M": 8,
        "num_stages": 5,
        "num_warps": 8,
        "ms": 0.04982389882206917,
        "min_ms": 0.04982389882206917,
        "max_ms": 0.04982389882206917,
        "compile_time": 1.6156611442565918
    },
    {
        "BLOCK_SIZE_M": 64,
        "BLOCK_SIZE_N": 128,
        "BLOCK_SIZE_K": 32,
        "GROUP_SIZE_M": 8,
        "num_stages": 5,
        "num_warps": 8,
        "ms": 0.04989290237426758,
        "min_ms": 0.04989290237426758,
        "max_ms": 0.04989290237426758,
        "compile_time": 1.2983918190002441
    },
    {
        "BLOCK_SIZE_M": 128,
        "BLOCK_SIZE_N": 128,
        "BLOCK_SIZE_K": 32,
        "GROUP_SIZE_M": 8,
        "num_stages": 6,
        "num_warps": 8,
        "ms": 0.04991313815116882,
        "min_ms": 0.04991313815116882,
        "max_ms": 0.04991313815116882,
        "compile_time": 1.6803512573242188
    },
    {
        "BLOCK_SIZE_M": 64,
        "BLOCK_SIZE_N": 128,
        "BLOCK_SIZE_K": 16,
        "GROUP_SIZE_M": 8,
        "num_stages": 6,
        "num_warps": 4,
        "ms": 0.04999465122818947,
        "min_ms": 0.04999465122818947,
        "max_ms": 0.04999465122818947,
        "compile_time": 1.4865493774414062
    },
    {
        "BLOCK_SIZE_M": 64,
        "BLOCK_SIZE_N": 256,
        "BLOCK_SIZE_K": 64,
        "GROUP_SIZE_M": 8,
        "num_stages": 5,
        "num_warps": 8,
        "ms": 0.050004053860902786,
        "min_ms": 0.050004053860902786,
        "max_ms": 0.050004053860902786,
        "compile_time": 1.8734638690948486
    },
    {
        "BLOCK_SIZE_M": 64,
        "BLOCK_SIZE_N": 128,
        "BLOCK_SIZE_K": 128,
        "GROUP_SIZE_M": 8,
        "num_stages": 4,
        "num_warps": 8,
        "ms": 0.050006069242954254,
        "min_ms": 0.050006069242954254,
        "max_ms": 0.050006069242954254,
        "compile_time": 1.745349407196045
    },
    {
        "BLOCK_SIZE_M": 128,
        "BLOCK_SIZE_N": 128,
        "BLOCK_SIZE_K": 128,
        "GROUP_SIZE_M": 8,
        "num_stages": 3,
        "num_warps": 8,
        "ms": 0.05002932623028755,
        "min_ms": 0.05002932623028755,
        "max_ms": 0.05002932623028755,
        "compile_time": 2.726670742034912
    },
    {
        "BLOCK_SIZE_M": 128,
        "BLOCK_SIZE_N": 128,
        "BLOCK_SIZE_K": 32,
        "GROUP_SIZE_M": 8,
        "num_stages": 5,
        "num_warps": 8,
        "ms": 0.05009516328573227,
        "min_ms": 0.05009516328573227,
        "max_ms": 0.05009516328573227,
        "compile_time": 1.7093000411987305
    },
    {
        "BLOCK_SIZE_M": 64,
        "BLOCK_SIZE_N": 128,
        "BLOCK_SIZE_K": 16,
        "GROUP_SIZE_M": 8,
        "num_stages": 5,
        "num_warps": 4,
        "ms": 0.05009991675615311,
        "min_ms": 0.05009991675615311,
        "max_ms": 0.05009991675615311,
        "compile_time": 1.4657764434814453
    },
    {
        "BLOCK_SIZE_M": 128,
        "BLOCK_SIZE_N": 64,
        "BLOCK_SIZE_K": 128,
        "GROUP_SIZE_M": 8,
        "num_stages": 4,
        "num_warps": 4,
        "ms": 0.050248295068740845,
        "min_ms": 0.050248295068740845,
        "max_ms": 0.050248295068740845,
        "compile_time": 2.3021159172058105
    },
    {
        "BLOCK_SIZE_M": 128,
        "BLOCK_SIZE_N": 64,
        "BLOCK_SIZE_K": 128,
        "GROUP_SIZE_M": 8,
        "num_stages": 4,
        "num_warps": 8,
        "ms": 0.0502498634159565,
        "min_ms": 0.0502498634159565,
        "max_ms": 0.0502498634159565,
        "compile_time": 1.8028509616851807
    },
    {
        "BLOCK_SIZE_M": 64,
        "BLOCK_SIZE_N": 128,
        "BLOCK_SIZE_K": 32,
        "GROUP_SIZE_M": 8,
        "num_stages": 6,
        "num_warps": 8,
        "ms": 0.05032621696591377,
        "min_ms": 0.05032621696591377,
        "max_ms": 0.05032621696591377,
        "compile_time": 1.4222595691680908
    },
    {
        "BLOCK_SIZE_M": 128,
        "BLOCK_SIZE_N": 128,
        "BLOCK_SIZE_K": 32,
        "GROUP_SIZE_M": 8,
        "num_stages": 4,
        "num_warps": 8,
        "ms": 0.05036810785531998,
        "min_ms": 0.05036810785531998,
        "max_ms": 0.05036810785531998,
        "compile_time": 1.6337566375732422
    },
    {
        "BLOCK_SIZE_M": 64,
        "BLOCK_SIZE_N": 128,
        "BLOCK_SIZE_K": 16,
        "GROUP_SIZE_M": 8,
        "num_stages": 8,
        "num_warps": 4,
        "ms": 0.05045211315155029,
        "min_ms": 0.05045211315155029,
        "max_ms": 0.05045211315155029,
        "compile_time": 1.50040864944458
    },
    {
        "BLOCK_SIZE_M": 128,
        "BLOCK_SIZE_N": 128,
        "BLOCK_SIZE_K": 32,
        "GROUP_SIZE_M": 8,
        "num_stages": 7,
        "num_warps": 8,
        "ms": 0.05054930970072746,
        "min_ms": 0.05054930970072746,
        "max_ms": 0.05054930970072746,
        "compile_time": 1.708204746246338
    },
    {
        "BLOCK_SIZE_M": 64,
        "BLOCK_SIZE_N": 128,
        "BLOCK_SIZE_K": 32,
        "GROUP_SIZE_M": 8,
        "num_stages": 7,
        "num_warps": 8,
        "ms": 0.050631530582904816,
        "min_ms": 0.050631530582904816,
        "max_ms": 0.050631530582904816,
        "compile_time": 1.446157693862915
    },
    {
        "BLOCK_SIZE_M": 128,
        "BLOCK_SIZE_N": 128,
        "BLOCK_SIZE_K": 64,
        "GROUP_SIZE_M": 8,
        "num_stages": 5,
        "num_warps": 4,
        "ms": 0.050829339772462845,
        "min_ms": 0.050829339772462845,
        "max_ms": 0.050829339772462845,
        "compile_time": 2.435159683227539
    },
    {
        "BLOCK_SIZE_M": 128,
        "BLOCK_SIZE_N": 64,
        "BLOCK_SIZE_K": 64,
        "GROUP_SIZE_M": 8,
        "num_stages": 6,
        "num_warps": 8,
        "ms": 0.050925739109516144,
        "min_ms": 0.050925739109516144,
        "max_ms": 0.050925739109516144,
        "compile_time": 1.6292800903320312
    },
    {
        "BLOCK_SIZE_M": 128,
        "BLOCK_SIZE_N": 128,
        "BLOCK_SIZE_K": 32,
        "GROUP_SIZE_M": 8,
        "num_stages": 3,
        "num_warps": 8,
        "ms": 0.05101779103279114,
        "min_ms": 0.05101779103279114,
        "max_ms": 0.05101779103279114,
        "compile_time": 1.653838872909546
    },
    {
        "BLOCK_SIZE_M": 64,
        "BLOCK_SIZE_N": 256,
        "BLOCK_SIZE_K": 32,
        "GROUP_SIZE_M": 8,
        "num_stages": 4,
        "num_warps": 8,
        "ms": 0.05107841640710831,
        "min_ms": 0.05107841640710831,
        "max_ms": 0.05107841640710831,
        "compile_time": 1.5724539756774902
    },
    {
        "BLOCK_SIZE_M": 64,
        "BLOCK_SIZE_N": 128,
        "BLOCK_SIZE_K": 16,
        "GROUP_SIZE_M": 8,
        "num_stages": 3,
        "num_warps": 2,
        "ms": 0.05108273774385452,
        "min_ms": 0.05108273774385452,
        "max_ms": 0.05108273774385452,
        "compile_time": 1.7802062034606934
    },
    {
        "BLOCK_SIZE_M": 64,
        "BLOCK_SIZE_N": 256,
        "BLOCK_SIZE_K": 32,
        "GROUP_SIZE_M": 8,
        "num_stages": 5,
        "num_warps": 8,
        "ms": 0.051180314272642136,
        "min_ms": 0.051180314272642136,
        "max_ms": 0.051180314272642136,
        "compile_time": 1.5957136154174805
    },
    {
        "BLOCK_SIZE_M": 64,
        "BLOCK_SIZE_N": 128,
        "BLOCK_SIZE_K": 16,
        "GROUP_SIZE_M": 8,
        "num_stages": 4,
        "num_warps": 2,
        "ms": 0.051194775849580765,
        "min_ms": 0.051194775849580765,
        "max_ms": 0.051194775849580765,
        "compile_time": 1.794140100479126
    },
    {
        "BLOCK_SIZE_M": 64,
        "BLOCK_SIZE_N": 128,
        "BLOCK_SIZE_K": 64,
        "GROUP_SIZE_M": 8,
        "num_stages": 7,
        "num_warps": 8,
        "ms": 0.05121378228068352,
        "min_ms": 0.05121378228068352,
        "max_ms": 0.05121378228068352,
        "compile_time": 1.5934319496154785
    },
    {
        "BLOCK_SIZE_M": 128,
        "BLOCK_SIZE_N": 64,
        "BLOCK_SIZE_K": 32,
        "GROUP_SIZE_M": 8,
        "num_stages": 6,
        "num_warps": 8,
        "ms": 0.051240772008895874,
        "min_ms": 0.051240772008895874,
        "max_ms": 0.051240772008895874,
        "compile_time": 1.5100092887878418
    },
    {
        "BLOCK_SIZE_M": 64,
        "BLOCK_SIZE_N": 256,
        "BLOCK_SIZE_K": 16,
        "GROUP_SIZE_M": 8,
        "num_stages": 4,
        "num_warps": 4,
        "ms": 0.051243722438812256,
        "min_ms": 0.051243722438812256,
        "max_ms": 0.051243722438812256,
        "compile_time": 1.6955039501190186
    },
    {
        "BLOCK_SIZE_M": 64,
        "BLOCK_SIZE_N": 256,
        "BLOCK_SIZE_K": 32,
        "GROUP_SIZE_M": 8,
        "num_stages": 6,
        "num_warps": 8,
        "ms": 0.05129651352763176,
        "min_ms": 0.05129651352763176,
        "max_ms": 0.05129651352763176,
        "compile_time": 1.6202924251556396
    },
    {
        "BLOCK_SIZE_M": 128,
        "BLOCK_SIZE_N": 128,
        "BLOCK_SIZE_K": 64,
        "GROUP_SIZE_M": 8,
        "num_stages": 4,
        "num_warps": 4,
        "ms": 0.05133315920829773,
        "min_ms": 0.05133315920829773,
        "max_ms": 0.05133315920829773,
        "compile_time": 2.3611743450164795
    },
    {
        "BLOCK_SIZE_M": 64,
        "BLOCK_SIZE_N": 128,
        "BLOCK_SIZE_K": 16,
        "GROUP_SIZE_M": 8,
        "num_stages": 5,
        "num_warps": 2,
        "ms": 0.051334135234355927,
        "min_ms": 0.051334135234355927,
        "max_ms": 0.051334135234355927,
        "compile_time": 1.7217555046081543
    },
    {
        "BLOCK_SIZE_M": 64,
        "BLOCK_SIZE_N": 64,
        "BLOCK_SIZE_K": 32,
        "GROUP_SIZE_M": 8,
        "num_stages": 4,
        "num_warps": 2,
        "ms": 0.05134524777531624,
        "min_ms": 0.05134524777531624,
        "max_ms": 0.05134524777531624,
        "compile_time": 1.5925700664520264
    },
    {
        "BLOCK_SIZE_M": 64,
        "BLOCK_SIZE_N": 256,
        "BLOCK_SIZE_K": 16,
        "GROUP_SIZE_M": 8,
        "num_stages": 3,
        "num_warps": 4,
        "ms": 0.05135912448167801,
        "min_ms": 0.05135912448167801,
        "max_ms": 0.05135912448167801,
        "compile_time": 1.765711784362793
    },
    {
        "BLOCK_SIZE_M": 256,
        "BLOCK_SIZE_N": 64,
        "BLOCK_SIZE_K": 64,
        "GROUP_SIZE_M": 8,
        "num_stages": 5,
        "num_warps": 8,
        "ms": 0.05142912268638611,
        "min_ms": 0.05142912268638611,
        "max_ms": 0.05142912268638611,
        "compile_time": 2.168509006500244
    },
    {
        "BLOCK_SIZE_M": 128,
        "BLOCK_SIZE_N": 128,
        "BLOCK_SIZE_K": 32,
        "GROUP_SIZE_M": 8,
        "num_stages": 8,
        "num_warps": 8,
        "ms": 0.051470838487148285,
        "min_ms": 0.051470838487148285,
        "max_ms": 0.051470838487148285,
        "compile_time": 1.7826101779937744
    },
    {
        "BLOCK_SIZE_M": 128,
        "BLOCK_SIZE_N": 64,
        "BLOCK_SIZE_K": 32,
        "GROUP_SIZE_M": 8,
        "num_stages": 3,
        "num_warps": 8,
        "ms": 0.051505379378795624,
        "min_ms": 0.051505379378795624,
        "max_ms": 0.051505379378795624,
        "compile_time": 1.463029146194458
    },
    {
        "BLOCK_SIZE_M": 64,
        "BLOCK_SIZE_N": 256,
        "BLOCK_SIZE_K": 32,
        "GROUP_SIZE_M": 8,
        "num_stages": 3,
        "num_warps": 8,
        "ms": 0.05157449096441269,
        "min_ms": 0.05157449096441269,
        "max_ms": 0.05157449096441269,
        "compile_time": 1.5595755577087402
    },
    {
        "BLOCK_SIZE_M": 64,
        "BLOCK_SIZE_N": 512,
        "BLOCK_SIZE_K": 32,
        "GROUP_SIZE_M": 8,
        "num_stages": 4,
        "num_warps": 8,
        "ms": 0.05173328518867493,
        "min_ms": 0.05173328518867493,
        "max_ms": 0.05173328518867493,
        "compile_time": 2.1009562015533447
    },
    {
        "BLOCK_SIZE_M": 128,
        "BLOCK_SIZE_N": 64,
        "BLOCK_SIZE_K": 32,
        "GROUP_SIZE_M": 8,
        "num_stages": 7,
        "num_warps": 8,
        "ms": 0.05176156759262085,
        "min_ms": 0.05176156759262085,
        "max_ms": 0.05176156759262085,
        "compile_time": 1.514348030090332
    },
    {
        "BLOCK_SIZE_M": 64,
        "BLOCK_SIZE_N": 128,
        "BLOCK_SIZE_K": 16,
        "GROUP_SIZE_M": 8,
        "num_stages": 6,
        "num_warps": 2,
        "ms": 0.05189858749508858,
        "min_ms": 0.05189858749508858,
        "max_ms": 0.05189858749508858,
        "compile_time": 1.826979398727417
    },
    {
        "BLOCK_SIZE_M": 128,
        "BLOCK_SIZE_N": 64,
        "BLOCK_SIZE_K": 32,
        "GROUP_SIZE_M": 8,
        "num_stages": 4,
        "num_warps": 8,
        "ms": 0.05196730047464371,
        "min_ms": 0.05196730047464371,
        "max_ms": 0.05196730047464371,
        "compile_time": 1.494192361831665
    },
    {
        "BLOCK_SIZE_M": 64,
        "BLOCK_SIZE_N": 256,
        "BLOCK_SIZE_K": 64,
        "GROUP_SIZE_M": 8,
        "num_stages": 3,
        "num_warps": 4,
        "ms": 0.05202402547001839,
        "min_ms": 0.05202402547001839,
        "max_ms": 0.05202402547001839,
        "compile_time": 2.365021228790283
    },
    {
        "BLOCK_SIZE_M": 64,
        "BLOCK_SIZE_N": 128,
        "BLOCK_SIZE_K": 32,
        "GROUP_SIZE_M": 8,
        "num_stages": 6,
        "num_warps": 2,
        "ms": 0.052136581391096115,
        "min_ms": 0.052136581391096115,
        "max_ms": 0.052136581391096115,
        "compile_time": 2.197908878326416
    },
    {
        "BLOCK_SIZE_M": 64,
        "BLOCK_SIZE_N": 256,
        "BLOCK_SIZE_K": 32,
        "GROUP_SIZE_M": 8,
        "num_stages": 7,
        "num_warps": 8,
        "ms": 0.05214755982160568,
        "min_ms": 0.05214755982160568,
        "max_ms": 0.05214755982160568,
        "compile_time": 1.654639482498169
    },
    {
        "BLOCK_SIZE_M": 64,
        "BLOCK_SIZE_N": 64,
        "BLOCK_SIZE_K": 64,
        "GROUP_SIZE_M": 8,
        "num_stages": 4,
        "num_warps": 4,
        "ms": 0.05215548351407051,
        "min_ms": 0.05215548351407051,
        "max_ms": 0.05215548351407051,
        "compile_time": 1.5266666412353516
    },
    {
        "BLOCK_SIZE_M": 128,
        "BLOCK_SIZE_N": 128,
        "BLOCK_SIZE_K": 32,
        "GROUP_SIZE_M": 8,
        "num_stages": 2,
        "num_warps": 4,
        "ms": 0.05224457383155823,
        "min_ms": 0.05224457383155823,
        "max_ms": 0.05224457383155823,
        "compile_time": 2.0800559520721436
    },
    {
        "BLOCK_SIZE_M": 128,
        "BLOCK_SIZE_N": 128,
        "BLOCK_SIZE_K": 64,
        "GROUP_SIZE_M": 8,
        "num_stages": 6,
        "num_warps": 4,
        "ms": 0.05226326733827591,
        "min_ms": 0.05226326733827591,
        "max_ms": 0.05226326733827591,
        "compile_time": 0.9353249073028564
    },
    {
        "BLOCK_SIZE_M": 64,
        "BLOCK_SIZE_N": 256,
        "BLOCK_SIZE_K": 32,
        "GROUP_SIZE_M": 8,
        "num_stages": 2,
        "num_warps": 4,
        "ms": 0.05227668210864067,
        "min_ms": 0.05227668210864067,
        "max_ms": 0.05227668210864067,
        "compile_time": 1.9756009578704834
    },
    {
        "BLOCK_SIZE_M": 128,
        "BLOCK_SIZE_N": 64,
        "BLOCK_SIZE_K": 64,
        "GROUP_SIZE_M": 8,
        "num_stages": 7,
        "num_warps": 8,
        "ms": 0.05227811262011528,
        "min_ms": 0.05227811262011528,
        "max_ms": 0.05227811262011528,
        "compile_time": 1.6683073043823242
    },
    {
        "BLOCK_SIZE_M": 128,
        "BLOCK_SIZE_N": 64,
        "BLOCK_SIZE_K": 32,
        "GROUP_SIZE_M": 8,
        "num_stages": 5,
        "num_warps": 8,
        "ms": 0.05247517675161362,
        "min_ms": 0.05247517675161362,
        "max_ms": 0.05247517675161362,
        "compile_time": 1.4826419353485107
    },
    {
        "BLOCK_SIZE_M": 64,
        "BLOCK_SIZE_N": 128,
        "BLOCK_SIZE_K": 16,
        "GROUP_SIZE_M": 8,
        "num_stages": 7,
        "num_warps": 2,
        "ms": 0.052522800862789154,
        "min_ms": 0.052522800862789154,
        "max_ms": 0.052522800862789154,
        "compile_time": 1.8271842002868652
    },
    {
        "BLOCK_SIZE_M": 64,
        "BLOCK_SIZE_N": 128,
        "BLOCK_SIZE_K": 16,
        "GROUP_SIZE_M": 8,
        "num_stages": 8,
        "num_warps": 2,
        "ms": 0.05260191485285759,
        "min_ms": 0.05260191485285759,
        "max_ms": 0.05260191485285759,
        "compile_time": 1.8669259548187256
    },
    {
        "BLOCK_SIZE_M": 64,
        "BLOCK_SIZE_N": 256,
        "BLOCK_SIZE_K": 32,
        "GROUP_SIZE_M": 8,
        "num_stages": 8,
        "num_warps": 8,
        "ms": 0.05282064154744148,
        "min_ms": 0.05282064154744148,
        "max_ms": 0.05282064154744148,
        "compile_time": 1.6699838638305664
    },
    {
        "BLOCK_SIZE_M": 64,
        "BLOCK_SIZE_N": 256,
        "BLOCK_SIZE_K": 16,
        "GROUP_SIZE_M": 8,
        "num_stages": 6,
        "num_warps": 4,
        "ms": 0.05288157984614372,
        "min_ms": 0.05288157984614372,
        "max_ms": 0.05288157984614372,
        "compile_time": 1.8078908920288086
    },
    {
        "BLOCK_SIZE_M": 64,
        "BLOCK_SIZE_N": 64,
        "BLOCK_SIZE_K": 32,
        "GROUP_SIZE_M": 8,
        "num_stages": 3,
        "num_warps": 2,
        "ms": 0.05292763561010361,
        "min_ms": 0.05292763561010361,
        "max_ms": 0.05292763561010361,
        "compile_time": 1.586822748184204
    },
    {
        "BLOCK_SIZE_M": 256,
        "BLOCK_SIZE_N": 64,
        "BLOCK_SIZE_K": 128,
        "GROUP_SIZE_M": 8,
        "num_stages": 3,
        "num_warps": 8,
        "ms": 0.05295974016189575,
        "min_ms": 0.05295974016189575,
        "max_ms": 0.05295974016189575,
        "compile_time": 2.3436644077301025
    },
    {
        "BLOCK_SIZE_M": 64,
        "BLOCK_SIZE_N": 256,
        "BLOCK_SIZE_K": 64,
        "GROUP_SIZE_M": 8,
        "num_stages": 2,
        "num_warps": 4,
        "ms": 0.05296347662806511,
        "min_ms": 0.05296347662806511,
        "max_ms": 0.05296347662806511,
        "compile_time": 2.184199094772339
    },
    {
        "BLOCK_SIZE_M": 64,
        "BLOCK_SIZE_N": 64,
        "BLOCK_SIZE_K": 32,
        "GROUP_SIZE_M": 8,
        "num_stages": 4,
        "num_warps": 4,
        "ms": 0.052986256778240204,
        "min_ms": 0.052986256778240204,
        "max_ms": 0.052986256778240204,
        "compile_time": 1.4186177253723145
    },
    {
        "BLOCK_SIZE_M": 64,
        "BLOCK_SIZE_N": 128,
        "BLOCK_SIZE_K": 32,
        "GROUP_SIZE_M": 8,
        "num_stages": 2,
        "num_warps": 2,
        "ms": 0.0530666820704937,
        "min_ms": 0.0530666820704937,
        "max_ms": 0.0530666820704937,
        "compile_time": 2.004413366317749
    },
    {
        "BLOCK_SIZE_M": 64,
        "BLOCK_SIZE_N": 128,
        "BLOCK_SIZE_K": 32,
        "GROUP_SIZE_M": 8,
        "num_stages": 7,
        "num_warps": 2,
        "ms": 0.05314072221517563,
        "min_ms": 0.05314072221517563,
        "max_ms": 0.05314072221517563,
        "compile_time": 2.211864471435547
    },
    {
        "BLOCK_SIZE_M": 64,
        "BLOCK_SIZE_N": 128,
        "BLOCK_SIZE_K": 32,
        "GROUP_SIZE_M": 8,
        "num_stages": 8,
        "num_warps": 8,
        "ms": 0.05316927284002304,
        "min_ms": 0.05316927284002304,
        "max_ms": 0.05316927284002304,
        "compile_time": 1.443950891494751
    },
    {
        "BLOCK_SIZE_M": 128,
        "BLOCK_SIZE_N": 256,
        "BLOCK_SIZE_K": 64,
        "GROUP_SIZE_M": 8,
        "num_stages": 2,
        "num_warps": 8,
        "ms": 0.05319985747337341,
        "min_ms": 0.05319985747337341,
        "max_ms": 0.05319985747337341,
        "compile_time": 2.1679527759552
    },
    {
        "BLOCK_SIZE_M": 64,
        "BLOCK_SIZE_N": 64,
        "BLOCK_SIZE_K": 64,
        "GROUP_SIZE_M": 8,
        "num_stages": 4,
        "num_warps": 2,
        "ms": 0.05325012281537056,
        "min_ms": 0.05325012281537056,
        "max_ms": 0.05325012281537056,
        "compile_time": 1.8220927715301514
    },
    {
        "BLOCK_SIZE_M": 64,
        "BLOCK_SIZE_N": 64,
        "BLOCK_SIZE_K": 32,
        "GROUP_SIZE_M": 8,
        "num_stages": 5,
        "num_warps": 4,
        "ms": 0.05327262356877327,
        "min_ms": 0.05327262356877327,
        "max_ms": 0.05327262356877327,
        "compile_time": 1.4330854415893555
    },
    {
        "BLOCK_SIZE_M": 64,
        "BLOCK_SIZE_N": 256,
        "BLOCK_SIZE_K": 16,
        "GROUP_SIZE_M": 8,
        "num_stages": 7,
        "num_warps": 4,
        "ms": 0.05330764502286911,
        "min_ms": 0.05330764502286911,
        "max_ms": 0.05330764502286911,
        "compile_time": 1.8589911460876465
    },
    {
        "BLOCK_SIZE_M": 256,
        "BLOCK_SIZE_N": 64,
        "BLOCK_SIZE_K": 64,
        "GROUP_SIZE_M": 8,
        "num_stages": 2,
        "num_warps": 4,
        "ms": 0.053494930267333984,
        "min_ms": 0.053494930267333984,
        "max_ms": 0.053494930267333984,
        "compile_time": 2.4567480087280273
    },
    {
        "BLOCK_SIZE_M": 64,
        "BLOCK_SIZE_N": 64,
        "BLOCK_SIZE_K": 64,
        "GROUP_SIZE_M": 8,
        "num_stages": 3,
        "num_warps": 4,
        "ms": 0.05353715270757675,
        "min_ms": 0.05353715270757675,
        "max_ms": 0.05353715270757675,
        "compile_time": 1.4833638668060303
    },
    {
        "BLOCK_SIZE_M": 256,
        "BLOCK_SIZE_N": 64,
        "BLOCK_SIZE_K": 32,
        "GROUP_SIZE_M": 8,
        "num_stages": 6,
        "num_warps": 4,
        "ms": 0.05355731397867203,
        "min_ms": 0.05355731397867203,
        "max_ms": 0.05355731397867203,
        "compile_time": 2.4871609210968018
    },
    {
        "BLOCK_SIZE_M": 128,
        "BLOCK_SIZE_N": 64,
        "BLOCK_SIZE_K": 32,
        "GROUP_SIZE_M": 8,
        "num_stages": 2,
        "num_warps": 2,
        "ms": 0.05356522276997566,
        "min_ms": 0.05356522276997566,
        "max_ms": 0.05356522276997566,
        "compile_time": 2.0979764461517334
    },
    {
        "BLOCK_SIZE_M": 64,
        "BLOCK_SIZE_N": 128,
        "BLOCK_SIZE_K": 64,
        "GROUP_SIZE_M": 8,
        "num_stages": 3,
        "num_warps": 2,
        "ms": 0.053573526442050934,
        "min_ms": 0.053573526442050934,
        "max_ms": 0.053573526442050934,
        "compile_time": 2.4093520641326904
    },
    {
        "BLOCK_SIZE_M": 64,
        "BLOCK_SIZE_N": 64,
        "BLOCK_SIZE_K": 32,
        "GROUP_SIZE_M": 8,
        "num_stages": 7,
        "num_warps": 2,
        "ms": 0.053603362292051315,
        "min_ms": 0.053603362292051315,
        "max_ms": 0.053603362292051315,
        "compile_time": 1.6826856136322021
    },
    {
        "BLOCK_SIZE_M": 64,
        "BLOCK_SIZE_N": 256,
        "BLOCK_SIZE_K": 16,
        "GROUP_SIZE_M": 8,
        "num_stages": 8,
        "num_warps": 4,
        "ms": 0.053631074726581573,
        "min_ms": 0.053631074726581573,
        "max_ms": 0.053631074726581573,
        "compile_time": 1.8739831447601318
    },
    {
        "BLOCK_SIZE_M": 64,
        "BLOCK_SIZE_N": 256,
        "BLOCK_SIZE_K": 16,
        "GROUP_SIZE_M": 8,
        "num_stages": 5,
        "num_warps": 4,
        "ms": 0.0536450557410717,
        "min_ms": 0.0536450557410717,
        "max_ms": 0.0536450557410717,
        "compile_time": 1.8087987899780273
    },
    {
        "BLOCK_SIZE_M": 64,
        "BLOCK_SIZE_N": 64,
        "BLOCK_SIZE_K": 32,
        "GROUP_SIZE_M": 8,
        "num_stages": 6,
        "num_warps": 4,
        "ms": 0.05366542190313339,
        "min_ms": 0.05366542190313339,
        "max_ms": 0.05366542190313339,
        "compile_time": 1.4520907402038574
    },
    {
        "BLOCK_SIZE_M": 64,
        "BLOCK_SIZE_N": 64,
        "BLOCK_SIZE_K": 32,
        "GROUP_SIZE_M": 8,
        "num_stages": 2,
        "num_warps": 2,
        "ms": 0.05381890386343002,
        "min_ms": 0.05381890386343002,
        "max_ms": 0.05381890386343002,
        "compile_time": 1.5338597297668457
    },
    {
        "BLOCK_SIZE_M": 64,
        "BLOCK_SIZE_N": 512,
        "BLOCK_SIZE_K": 64,
        "GROUP_SIZE_M": 8,
        "num_stages": 3,
        "num_warps": 8,
        "ms": 0.05392103269696236,
        "min_ms": 0.05392103269696236,
        "max_ms": 0.05392103269696236,
        "compile_time": 2.359455108642578
    },
    {
        "BLOCK_SIZE_M": 64,
        "BLOCK_SIZE_N": 64,
        "BLOCK_SIZE_K": 64,
        "GROUP_SIZE_M": 8,
        "num_stages": 5,
        "num_warps": 4,
        "ms": 0.05393053963780403,
        "min_ms": 0.05393053963780403,
        "max_ms": 0.05393053963780403,
        "compile_time": 1.565997838973999
    },
    {
        "BLOCK_SIZE_M": 256,
        "BLOCK_SIZE_N": 64,
        "BLOCK_SIZE_K": 32,
        "GROUP_SIZE_M": 8,
        "num_stages": 2,
        "num_warps": 4,
        "ms": 0.054077260196208954,
        "min_ms": 0.054077260196208954,
        "max_ms": 0.054077260196208954,
        "compile_time": 2.2347657680511475
    },
    {
        "BLOCK_SIZE_M": 256,
        "BLOCK_SIZE_N": 128,
        "BLOCK_SIZE_K": 32,
        "GROUP_SIZE_M": 8,
        "num_stages": 2,
        "num_warps": 8,
        "ms": 0.054155994206666946,
        "min_ms": 0.054155994206666946,
        "max_ms": 0.054155994206666946,
        "compile_time": 1.656031847000122
    },
    {
        "BLOCK_SIZE_M": 128,
        "BLOCK_SIZE_N": 128,
        "BLOCK_SIZE_K": 16,
        "GROUP_SIZE_M": 8,
        "num_stages": 8,
        "num_warps": 4,
        "ms": 0.05457191914319992,
        "min_ms": 0.05457191914319992,
        "max_ms": 0.05457191914319992,
        "compile_time": 1.9904851913452148
    },
    {
        "BLOCK_SIZE_M": 256,
        "BLOCK_SIZE_N": 64,
        "BLOCK_SIZE_K": 32,
        "GROUP_SIZE_M": 8,
        "num_stages": 7,
        "num_warps": 4,
        "ms": 0.0546339675784111,
        "min_ms": 0.0546339675784111,
        "max_ms": 0.0546339675784111,
        "compile_time": 2.4701268672943115
    },
    {
        "BLOCK_SIZE_M": 128,
        "BLOCK_SIZE_N": 64,
        "BLOCK_SIZE_K": 32,
        "GROUP_SIZE_M": 8,
        "num_stages": 8,
        "num_warps": 8,
        "ms": 0.054932862520217896,
        "min_ms": 0.054932862520217896,
        "max_ms": 0.054932862520217896,
        "compile_time": 1.588383674621582
    },
    {
        "BLOCK_SIZE_M": 64,
        "BLOCK_SIZE_N": 256,
        "BLOCK_SIZE_K": 128,
        "GROUP_SIZE_M": 8,
        "num_stages": 3,
        "num_warps": 8,
        "ms": 0.054946593940258026,
        "min_ms": 0.054946593940258026,
        "max_ms": 0.054946593940258026,
        "compile_time": 2.048776865005493
    },
    {
        "BLOCK_SIZE_M": 64,
        "BLOCK_SIZE_N": 64,
        "BLOCK_SIZE_K": 32,
        "GROUP_SIZE_M": 8,
        "num_stages": 7,
        "num_warps": 4,
        "ms": 0.055005770176649094,
        "min_ms": 0.055005770176649094,
        "max_ms": 0.055005770176649094,
        "compile_time": 1.459385633468628
    },
    {
        "BLOCK_SIZE_M": 64,
        "BLOCK_SIZE_N": 64,
        "BLOCK_SIZE_K": 128,
        "GROUP_SIZE_M": 8,
        "num_stages": 3,
        "num_warps": 4,
        "ms": 0.05517292022705078,
        "min_ms": 0.05517292022705078,
        "max_ms": 0.05517292022705078,
        "compile_time": 1.762366533279419
    },
    {
        "BLOCK_SIZE_M": 128,
        "BLOCK_SIZE_N": 64,
        "BLOCK_SIZE_K": 64,
        "GROUP_SIZE_M": 8,
        "num_stages": 2,
        "num_warps": 2,
        "ms": 0.0552208237349987,
        "min_ms": 0.0552208237349987,
        "max_ms": 0.0552208237349987,
        "compile_time": 2.3252148628234863
    },
    {
        "BLOCK_SIZE_M": 256,
        "BLOCK_SIZE_N": 64,
        "BLOCK_SIZE_K": 32,
        "GROUP_SIZE_M": 8,
        "num_stages": 8,
        "num_warps": 4,
        "ms": 0.05528753995895386,
        "min_ms": 0.05528753995895386,
        "max_ms": 0.05528753995895386,
        "compile_time": 2.568279981613159
    },
    {
        "BLOCK_SIZE_M": 128,
        "BLOCK_SIZE_N": 256,
        "BLOCK_SIZE_K": 32,
        "GROUP_SIZE_M": 8,
        "num_stages": 2,
        "num_warps": 8,
        "ms": 0.05530405789613724,
        "min_ms": 0.05530405789613724,
        "max_ms": 0.05530405789613724,
        "compile_time": 2.0737056732177734
    },
    {
        "BLOCK_SIZE_M": 64,
        "BLOCK_SIZE_N": 256,
        "BLOCK_SIZE_K": 32,
        "GROUP_SIZE_M": 8,
        "num_stages": 6,
        "num_warps": 4,
        "ms": 0.05549896880984306,
        "min_ms": 0.05549896880984306,
        "max_ms": 0.05549896880984306,
        "compile_time": 2.1680374145507812
    },
    {
        "BLOCK_SIZE_M": 128,
        "BLOCK_SIZE_N": 64,
        "BLOCK_SIZE_K": 64,
        "GROUP_SIZE_M": 8,
        "num_stages": 1,
        "num_warps": 4,
        "ms": 0.05553749203681946,
        "min_ms": 0.05553749203681946,
        "max_ms": 0.05553749203681946,
        "compile_time": 1.6953866481781006
    },
    {
        "BLOCK_SIZE_M": 64,
        "BLOCK_SIZE_N": 64,
        "BLOCK_SIZE_K": 64,
        "GROUP_SIZE_M": 8,
        "num_stages": 6,
        "num_warps": 4,
        "ms": 0.055748216807842255,
        "min_ms": 0.055748216807842255,
        "max_ms": 0.055748216807842255,
        "compile_time": 1.5818126201629639
    },
    {
        "BLOCK_SIZE_M": 64,
        "BLOCK_SIZE_N": 128,
        "BLOCK_SIZE_K": 64,
        "GROUP_SIZE_M": 8,
        "num_stages": 1,
        "num_warps": 4,
        "ms": 0.05578156188130379,
        "min_ms": 0.05578156188130379,
        "max_ms": 0.05578156188130379,
        "compile_time": 1.60209321975708
    },
    {
        "BLOCK_SIZE_M": 64,
        "BLOCK_SIZE_N": 64,
        "BLOCK_SIZE_K": 32,
        "GROUP_SIZE_M": 8,
        "num_stages": 5,
        "num_warps": 2,
        "ms": 0.055860020220279694,
        "min_ms": 0.055860020220279694,
        "max_ms": 0.055860020220279694,
        "compile_time": 1.6739766597747803
    },
    {
        "BLOCK_SIZE_M": 256,
        "BLOCK_SIZE_N": 64,
        "BLOCK_SIZE_K": 32,
        "GROUP_SIZE_M": 8,
        "num_stages": 4,
        "num_warps": 8,
        "ms": 0.05589492991566658,
        "min_ms": 0.05589492991566658,
        "max_ms": 0.05589492991566658,
        "compile_time": 1.8073267936706543
    },
    {
        "BLOCK_SIZE_M": 256,
        "BLOCK_SIZE_N": 64,
        "BLOCK_SIZE_K": 64,
        "GROUP_SIZE_M": 8,
        "num_stages": 5,
        "num_warps": 4,
        "ms": 0.05596908926963806,
        "min_ms": 0.05596908926963806,
        "max_ms": 0.05596908926963806,
        "compile_time": 2.741382360458374
    },
    {
        "BLOCK_SIZE_M": 128,
        "BLOCK_SIZE_N": 64,
        "BLOCK_SIZE_K": 32,
        "GROUP_SIZE_M": 8,
        "num_stages": 1,
        "num_warps": 2,
        "ms": 0.05614688992500305,
        "min_ms": 0.05614688992500305,
        "max_ms": 0.05614688992500305,
        "compile_time": 1.891422986984253
    },
    {
        "BLOCK_SIZE_M": 64,
        "BLOCK_SIZE_N": 64,
        "BLOCK_SIZE_K": 64,
        "GROUP_SIZE_M": 8,
        "num_stages": 5,
        "num_warps": 2,
        "ms": 0.0561569407582283,
        "min_ms": 0.0561569407582283,
        "max_ms": 0.0561569407582283,
        "compile_time": 1.9087843894958496
    },
    {
        "BLOCK_SIZE_M": 64,
        "BLOCK_SIZE_N": 256,
        "BLOCK_SIZE_K": 32,
        "GROUP_SIZE_M": 8,
        "num_stages": 7,
        "num_warps": 4,
        "ms": 0.05620018392801285,
        "min_ms": 0.05620018392801285,
        "max_ms": 0.05620018392801285,
        "compile_time": 2.2196123600006104
    },
    {
        "BLOCK_SIZE_M": 32,
        "BLOCK_SIZE_N": 256,
        "BLOCK_SIZE_K": 32,
        "GROUP_SIZE_M": 8,
        "num_stages": 3,
        "num_warps": 4,
        "ms": 0.05621470883488655,
        "min_ms": 0.05621470883488655,
        "max_ms": 0.05621470883488655,
        "compile_time": 1.5621311664581299
    },
    {
        "BLOCK_SIZE_M": 64,
        "BLOCK_SIZE_N": 64,
        "BLOCK_SIZE_K": 128,
        "GROUP_SIZE_M": 8,
        "num_stages": 2,
        "num_warps": 4,
        "ms": 0.05624920874834061,
        "min_ms": 0.05624920874834061,
        "max_ms": 0.05624920874834061,
        "compile_time": 1.6721632480621338
    },
    {
        "BLOCK_SIZE_M": 128,
        "BLOCK_SIZE_N": 128,
        "BLOCK_SIZE_K": 128,
        "GROUP_SIZE_M": 8,
        "num_stages": 3,
        "num_warps": 16,
        "ms": 0.0562928132712841,
        "min_ms": 0.0562928132712841,
        "max_ms": 0.0562928132712841,
        "compile_time": 1.8919589519500732
    },
    {
        "BLOCK_SIZE_M": 256,
        "BLOCK_SIZE_N": 128,
        "BLOCK_SIZE_K": 64,
        "GROUP_SIZE_M": 8,
        "num_stages": 2,
        "num_warps": 8,
        "ms": 0.056393902748823166,
        "min_ms": 0.056393902748823166,
        "max_ms": 0.056393902748823166,
        "compile_time": 1.5212461948394775
    },
    {
        "BLOCK_SIZE_M": 256,
        "BLOCK_SIZE_N": 64,
        "BLOCK_SIZE_K": 32,
        "GROUP_SIZE_M": 8,
        "num_stages": 5,
        "num_warps": 8,
        "ms": 0.05640759319067001,
        "min_ms": 0.05640759319067001,
        "max_ms": 0.05640759319067001,
        "compile_time": 1.845837116241455
    },
    {
        "BLOCK_SIZE_M": 64,
        "BLOCK_SIZE_N": 64,
        "BLOCK_SIZE_K": 32,
        "GROUP_SIZE_M": 8,
        "num_stages": 8,
        "num_warps": 4,
        "ms": 0.05654788762331009,
        "min_ms": 0.05654788762331009,
        "max_ms": 0.05654788762331009,
        "compile_time": 1.4775309562683105
    },
    {
        "BLOCK_SIZE_M": 64,
        "BLOCK_SIZE_N": 128,
        "BLOCK_SIZE_K": 64,
        "GROUP_SIZE_M": 8,
        "num_stages": 2,
        "num_warps": 4,
        "ms": 0.05659367889165878,
        "min_ms": 0.05659367889165878,
        "max_ms": 0.05659367889165878,
        "compile_time": 1.694394826889038
    },
    {
        "BLOCK_SIZE_M": 64,
        "BLOCK_SIZE_N": 64,
        "BLOCK_SIZE_K": 32,
        "GROUP_SIZE_M": 8,
        "num_stages": 8,
        "num_warps": 2,
        "ms": 0.056823037564754486,
        "min_ms": 0.056823037564754486,
        "max_ms": 0.056823037564754486,
        "compile_time": 1.741187572479248
    },
    {
        "BLOCK_SIZE_M": 64,
        "BLOCK_SIZE_N": 256,
        "BLOCK_SIZE_K": 32,
        "GROUP_SIZE_M": 8,
        "num_stages": 8,
        "num_warps": 4,
        "ms": 0.0570160374045372,
        "min_ms": 0.0570160374045372,
        "max_ms": 0.0570160374045372,
        "compile_time": 2.2590172290802
    },
    {
        "BLOCK_SIZE_M": 64,
        "BLOCK_SIZE_N": 64,
        "BLOCK_SIZE_K": 32,
        "GROUP_SIZE_M": 8,
        "num_stages": 3,
        "num_warps": 4,
        "ms": 0.05707425996661186,
        "min_ms": 0.05707425996661186,
        "max_ms": 0.05707425996661186,
        "compile_time": 1.3959193229675293
    },
    {
        "BLOCK_SIZE_M": 64,
        "BLOCK_SIZE_N": 64,
        "BLOCK_SIZE_K": 32,
        "GROUP_SIZE_M": 8,
        "num_stages": 6,
        "num_warps": 2,
        "ms": 0.05710239335894585,
        "min_ms": 0.05710239335894585,
        "max_ms": 0.05710239335894585,
        "compile_time": 1.6655387878417969
    },
    {
        "BLOCK_SIZE_M": 128,
        "BLOCK_SIZE_N": 64,
        "BLOCK_SIZE_K": 32,
        "GROUP_SIZE_M": 8,
        "num_stages": 1,
        "num_warps": 4,
        "ms": 0.05711886286735535,
        "min_ms": 0.05711886286735535,
        "max_ms": 0.05711886286735535,
        "compile_time": 1.587989091873169
    },
    {
        "BLOCK_SIZE_M": 128,
        "BLOCK_SIZE_N": 128,
        "BLOCK_SIZE_K": 16,
        "GROUP_SIZE_M": 8,
        "num_stages": 4,
        "num_warps": 4,
        "ms": 0.05717990919947624,
        "min_ms": 0.05717990919947624,
        "max_ms": 0.05717990919947624,
        "compile_time": 1.9186742305755615
    },
    {
        "BLOCK_SIZE_M": 128,
        "BLOCK_SIZE_N": 128,
        "BLOCK_SIZE_K": 16,
        "GROUP_SIZE_M": 8,
        "num_stages": 5,
        "num_warps": 4,
        "ms": 0.057345204055309296,
        "min_ms": 0.057345204055309296,
        "max_ms": 0.057345204055309296,
        "compile_time": 1.9330899715423584
    },
    {
        "BLOCK_SIZE_M": 256,
        "BLOCK_SIZE_N": 64,
        "BLOCK_SIZE_K": 32,
        "GROUP_SIZE_M": 8,
        "num_stages": 6,
        "num_warps": 8,
        "ms": 0.05735521391034126,
        "min_ms": 0.05735521391034126,
        "max_ms": 0.05735521391034126,
        "compile_time": 1.8920409679412842
    },
    {
        "BLOCK_SIZE_M": 64,
        "BLOCK_SIZE_N": 128,
        "BLOCK_SIZE_K": 128,
        "GROUP_SIZE_M": 8,
        "num_stages": 2,
        "num_warps": 4,
        "ms": 0.057429589331150055,
        "min_ms": 0.057429589331150055,
        "max_ms": 0.057429589331150055,
        "compile_time": 1.9798765182495117
    },
    {
        "BLOCK_SIZE_M": 64,
        "BLOCK_SIZE_N": 64,
        "BLOCK_SIZE_K": 64,
        "GROUP_SIZE_M": 8,
        "num_stages": 6,
        "num_warps": 2,
        "ms": 0.05745159462094307,
        "min_ms": 0.05745159462094307,
        "max_ms": 0.05745159462094307,
        "compile_time": 1.9384708404541016
    },
    {
        "BLOCK_SIZE_M": 128,
        "BLOCK_SIZE_N": 128,
        "BLOCK_SIZE_K": 16,
        "GROUP_SIZE_M": 8,
        "num_stages": 3,
        "num_warps": 4,
        "ms": 0.05752062797546387,
        "min_ms": 0.05752062797546387,
        "max_ms": 0.05752062797546387,
        "compile_time": 1.871551752090454
    },
    {
        "BLOCK_SIZE_M": 128,
        "BLOCK_SIZE_N": 128,
        "BLOCK_SIZE_K": 16,
        "GROUP_SIZE_M": 8,
        "num_stages": 6,
        "num_warps": 4,
        "ms": 0.057533323764801025,
        "min_ms": 0.057533323764801025,
        "max_ms": 0.057533323764801025,
        "compile_time": 1.9344477653503418
    },
    {
        "BLOCK_SIZE_M": 64,
        "BLOCK_SIZE_N": 512,
        "BLOCK_SIZE_K": 16,
        "GROUP_SIZE_M": 8,
        "num_stages": 6,
        "num_warps": 8,
        "ms": 0.0575827956199646,
        "min_ms": 0.0575827956199646,
        "max_ms": 0.0575827956199646,
        "compile_time": 1.880706787109375
    },
    {
        "BLOCK_SIZE_M": 64,
        "BLOCK_SIZE_N": 128,
        "BLOCK_SIZE_K": 64,
        "GROUP_SIZE_M": 8,
        "num_stages": 2,
        "num_warps": 2,
        "ms": 0.05787045508623123,
        "min_ms": 0.05787045508623123,
        "max_ms": 0.05787045508623123,
        "compile_time": 2.2129266262054443
    },
    {
        "BLOCK_SIZE_M": 128,
        "BLOCK_SIZE_N": 128,
        "BLOCK_SIZE_K": 16,
        "GROUP_SIZE_M": 8,
        "num_stages": 7,
        "num_warps": 4,
        "ms": 0.05792275816202164,
        "min_ms": 0.05792275816202164,
        "max_ms": 0.05792275816202164,
        "compile_time": 1.943779706954956
    },
    {
        "BLOCK_SIZE_M": 256,
        "BLOCK_SIZE_N": 64,
        "BLOCK_SIZE_K": 32,
        "GROUP_SIZE_M": 8,
        "num_stages": 7,
        "num_warps": 8,
        "ms": 0.057964421808719635,
        "min_ms": 0.057964421808719635,
        "max_ms": 0.057964421808719635,
        "compile_time": 1.9061949253082275
    },
    {
        "BLOCK_SIZE_M": 32,
        "BLOCK_SIZE_N": 256,
        "BLOCK_SIZE_K": 16,
        "GROUP_SIZE_M": 8,
        "num_stages": 4,
        "num_warps": 4,
        "ms": 0.05801662802696228,
        "min_ms": 0.05801662802696228,
        "max_ms": 0.05801662802696228,
        "compile_time": 1.4919259548187256
    },
    {
        "BLOCK_SIZE_M": 64,
        "BLOCK_SIZE_N": 128,
        "BLOCK_SIZE_K": 16,
        "GROUP_SIZE_M": 8,
        "num_stages": 2,
        "num_warps": 4,
        "ms": 0.05842454358935356,
        "min_ms": 0.05842454358935356,
        "max_ms": 0.05842454358935356,
        "compile_time": 1.4552927017211914
    },
    {
        "BLOCK_SIZE_M": 256,
        "BLOCK_SIZE_N": 64,
        "BLOCK_SIZE_K": 32,
        "GROUP_SIZE_M": 8,
        "num_stages": 3,
        "num_warps": 8,
        "ms": 0.05842990428209305,
        "min_ms": 0.05842990428209305,
        "max_ms": 0.05842990428209305,
        "compile_time": 1.810788631439209
    },
    {
        "BLOCK_SIZE_M": 256,
        "BLOCK_SIZE_N": 64,
        "BLOCK_SIZE_K": 64,
        "GROUP_SIZE_M": 8,
        "num_stages": 4,
        "num_warps": 4,
        "ms": 0.058440886437892914,
        "min_ms": 0.058440886437892914,
        "max_ms": 0.058440886437892914,
        "compile_time": 2.6538307666778564
    },
    {
        "BLOCK_SIZE_M": 128,
        "BLOCK_SIZE_N": 128,
        "BLOCK_SIZE_K": 128,
        "GROUP_SIZE_M": 8,
        "num_stages": 3,
        "num_warps": 4,
        "ms": 0.05854722857475281,
        "min_ms": 0.05854722857475281,
        "max_ms": 0.05854722857475281,
        "compile_time": 2.9022886753082275
    },
    {
        "BLOCK_SIZE_M": 256,
        "BLOCK_SIZE_N": 32,
        "BLOCK_SIZE_K": 32,
        "GROUP_SIZE_M": 8,
        "num_stages": 3,
        "num_warps": 4,
        "ms": 0.05858536437153816,
        "min_ms": 0.05858536437153816,
        "max_ms": 0.05858536437153816,
        "compile_time": 1.571089267730713
    },
    {
        "BLOCK_SIZE_M": 64,
        "BLOCK_SIZE_N": 512,
        "BLOCK_SIZE_K": 16,
        "GROUP_SIZE_M": 8,
        "num_stages": 4,
        "num_warps": 8,
        "ms": 0.05864517763257027,
        "min_ms": 0.05864517763257027,
        "max_ms": 0.05864517763257027,
        "compile_time": 1.8544964790344238
    },
    {
        "BLOCK_SIZE_M": 128,
        "BLOCK_SIZE_N": 64,
        "BLOCK_SIZE_K": 128,
        "GROUP_SIZE_M": 8,
        "num_stages": 2,
        "num_warps": 4,
        "ms": 0.05867316573858261,
        "min_ms": 0.05867316573858261,
        "max_ms": 0.05867316573858261,
        "compile_time": 2.0845842361450195
    },
    {
        "BLOCK_SIZE_M": 64,
        "BLOCK_SIZE_N": 256,
        "BLOCK_SIZE_K": 128,
        "GROUP_SIZE_M": 8,
        "num_stages": 3,
        "num_warps": 16,
        "ms": 0.05869182199239731,
        "min_ms": 0.05869182199239731,
        "max_ms": 0.05869182199239731,
        "compile_time": 1.716395378112793
    },
    {
        "BLOCK_SIZE_M": 128,
        "BLOCK_SIZE_N": 64,
        "BLOCK_SIZE_K": 16,
        "GROUP_SIZE_M": 8,
        "num_stages": 7,
        "num_warps": 4,
        "ms": 0.05869494751095772,
        "min_ms": 0.05869494751095772,
        "max_ms": 0.05869494751095772,
        "compile_time": 1.6322009563446045
    },
    {
        "BLOCK_SIZE_M": 64,
        "BLOCK_SIZE_N": 512,
        "BLOCK_SIZE_K": 16,
        "GROUP_SIZE_M": 8,
        "num_stages": 5,
        "num_warps": 8,
        "ms": 0.05870147794485092,
        "min_ms": 0.05870147794485092,
        "max_ms": 0.05870147794485092,
        "compile_time": 1.8730943202972412
    },
    {
        "BLOCK_SIZE_M": 128,
        "BLOCK_SIZE_N": 128,
        "BLOCK_SIZE_K": 64,
        "GROUP_SIZE_M": 8,
        "num_stages": 4,
        "num_warps": 16,
        "ms": 0.0587296262383461,
        "min_ms": 0.0587296262383461,
        "max_ms": 0.0587296262383461,
        "compile_time": 1.69195556640625
    },
    {
        "BLOCK_SIZE_M": 128,
        "BLOCK_SIZE_N": 128,
        "BLOCK_SIZE_K": 64,
        "GROUP_SIZE_M": 8,
        "num_stages": 3,
        "num_warps": 16,
        "ms": 0.05874573066830635,
        "min_ms": 0.05874573066830635,
        "max_ms": 0.05874573066830635,
        "compile_time": 1.5826902389526367
    },
    {
        "BLOCK_SIZE_M": 64,
        "BLOCK_SIZE_N": 512,
        "BLOCK_SIZE_K": 16,
        "GROUP_SIZE_M": 8,
        "num_stages": 7,
        "num_warps": 8,
        "ms": 0.0587526336312294,
        "min_ms": 0.0587526336312294,
        "max_ms": 0.0587526336312294,
        "compile_time": 1.9219043254852295
    },
    {
        "BLOCK_SIZE_M": 256,
        "BLOCK_SIZE_N": 64,
        "BLOCK_SIZE_K": 32,
        "GROUP_SIZE_M": 8,
        "num_stages": 8,
        "num_warps": 8,
        "ms": 0.0587749257683754,
        "min_ms": 0.0587749257683754,
        "max_ms": 0.0587749257683754,
        "compile_time": 1.9848289489746094
    },
    {
        "BLOCK_SIZE_M": 128,
        "BLOCK_SIZE_N": 64,
        "BLOCK_SIZE_K": 128,
        "GROUP_SIZE_M": 8,
        "num_stages": 2,
        "num_warps": 8,
        "ms": 0.05877719074487686,
        "min_ms": 0.05877719074487686,
        "max_ms": 0.05877719074487686,
        "compile_time": 1.7535054683685303
    },
    {
        "BLOCK_SIZE_M": 64,
        "BLOCK_SIZE_N": 512,
        "BLOCK_SIZE_K": 16,
        "GROUP_SIZE_M": 8,
        "num_stages": 8,
        "num_warps": 8,
        "ms": 0.05886147543787956,
        "min_ms": 0.05886147543787956,
        "max_ms": 0.05886147543787956,
        "compile_time": 1.936680793762207
    },
    {
        "BLOCK_SIZE_M": 64,
        "BLOCK_SIZE_N": 512,
        "BLOCK_SIZE_K": 16,
        "GROUP_SIZE_M": 8,
        "num_stages": 3,
        "num_warps": 8,
        "ms": 0.05896308273077011,
        "min_ms": 0.05896308273077011,
        "max_ms": 0.05896308273077011,
        "compile_time": 1.8250620365142822
    },
    {
        "BLOCK_SIZE_M": 128,
        "BLOCK_SIZE_N": 64,
        "BLOCK_SIZE_K": 16,
        "GROUP_SIZE_M": 8,
        "num_stages": 3,
        "num_warps": 4,
        "ms": 0.05907869338989258,
        "min_ms": 0.05907869338989258,
        "max_ms": 0.05907869338989258,
        "compile_time": 1.569079875946045
    },
    {
        "BLOCK_SIZE_M": 128,
        "BLOCK_SIZE_N": 128,
        "BLOCK_SIZE_K": 128,
        "GROUP_SIZE_M": 8,
        "num_stages": 2,
        "num_warps": 4,
        "ms": 0.05907915160059929,
        "min_ms": 0.05907915160059929,
        "max_ms": 0.05907915160059929,
        "compile_time": 2.6137075424194336
    },
    {
        "BLOCK_SIZE_M": 128,
        "BLOCK_SIZE_N": 128,
        "BLOCK_SIZE_K": 32,
        "GROUP_SIZE_M": 8,
        "num_stages": 1,
        "num_warps": 8,
        "ms": 0.05916094034910202,
        "min_ms": 0.05916094034910202,
        "max_ms": 0.05916094034910202,
        "compile_time": 1.613715648651123
    },
    {
        "BLOCK_SIZE_M": 64,
        "BLOCK_SIZE_N": 64,
        "BLOCK_SIZE_K": 64,
        "GROUP_SIZE_M": 8,
        "num_stages": 7,
        "num_warps": 4,
        "ms": 0.05918862670660019,
        "min_ms": 0.05918862670660019,
        "max_ms": 0.05918862670660019,
        "compile_time": 1.6382911205291748
    },
    {
        "BLOCK_SIZE_M": 64,
        "BLOCK_SIZE_N": 128,
        "BLOCK_SIZE_K": 128,
        "GROUP_SIZE_M": 8,
        "num_stages": 2,
        "num_warps": 8,
        "ms": 0.05939362570643425,
        "min_ms": 0.05939362570643425,
        "max_ms": 0.05939362570643425,
        "compile_time": 1.645765781402588
    },
    {
        "BLOCK_SIZE_M": 32,
        "BLOCK_SIZE_N": 256,
        "BLOCK_SIZE_K": 16,
        "GROUP_SIZE_M": 8,
        "num_stages": 5,
        "num_warps": 2,
        "ms": 0.059415679425001144,
        "min_ms": 0.059415679425001144,
        "max_ms": 0.059415679425001144,
        "compile_time": 1.8756024837493896
    },
    {
        "BLOCK_SIZE_M": 32,
        "BLOCK_SIZE_N": 256,
        "BLOCK_SIZE_K": 16,
        "GROUP_SIZE_M": 8,
        "num_stages": 4,
        "num_warps": 2,
        "ms": 0.05942419171333313,
        "min_ms": 0.05942419171333313,
        "max_ms": 0.05942419171333313,
        "compile_time": 1.8449041843414307
    },
    {
        "BLOCK_SIZE_M": 128,
        "BLOCK_SIZE_N": 64,
        "BLOCK_SIZE_K": 16,
        "GROUP_SIZE_M": 8,
        "num_stages": 3,
        "num_warps": 2,
        "ms": 0.05950571224093437,
        "min_ms": 0.05950571224093437,
        "max_ms": 0.05950571224093437,
        "compile_time": 1.8991820812225342
    },
    {
        "BLOCK_SIZE_M": 128,
        "BLOCK_SIZE_N": 256,
        "BLOCK_SIZE_K": 16,
        "GROUP_SIZE_M": 8,
        "num_stages": 6,
        "num_warps": 8,
        "ms": 0.05954308062791824,
        "min_ms": 0.05954308062791824,
        "max_ms": 0.05954308062791824,
        "compile_time": 1.8410282135009766
    },
    {
        "BLOCK_SIZE_M": 128,
        "BLOCK_SIZE_N": 128,
        "BLOCK_SIZE_K": 64,
        "GROUP_SIZE_M": 8,
        "num_stages": 5,
        "num_warps": 16,
        "ms": 0.05963855981826782,
        "min_ms": 0.05963855981826782,
        "max_ms": 0.05963855981826782,
        "compile_time": 2.4604203701019287
    },
    {
        "BLOCK_SIZE_M": 32,
        "BLOCK_SIZE_N": 256,
        "BLOCK_SIZE_K": 16,
        "GROUP_SIZE_M": 8,
        "num_stages": 5,
        "num_warps": 4,
        "ms": 0.0596521720290184,
        "min_ms": 0.0596521720290184,
        "max_ms": 0.0596521720290184,
        "compile_time": 1.490307331085205
    },
    {
        "BLOCK_SIZE_M": 128,
        "BLOCK_SIZE_N": 64,
        "BLOCK_SIZE_K": 64,
        "GROUP_SIZE_M": 8,
        "num_stages": 4,
        "num_warps": 2,
        "ms": 0.05980879068374634,
        "min_ms": 0.05980879068374634,
        "max_ms": 0.05980879068374634,
        "compile_time": 2.42454195022583
    },
    {
        "BLOCK_SIZE_M": 128,
        "BLOCK_SIZE_N": 256,
        "BLOCK_SIZE_K": 16,
        "GROUP_SIZE_M": 8,
        "num_stages": 7,
        "num_warps": 8,
        "ms": 0.059851568192243576,
        "min_ms": 0.059851568192243576,
        "max_ms": 0.059851568192243576,
        "compile_time": 1.973867416381836
    },
    {
        "BLOCK_SIZE_M": 128,
        "BLOCK_SIZE_N": 128,
        "BLOCK_SIZE_K": 32,
        "GROUP_SIZE_M": 8,
        "num_stages": 1,
        "num_warps": 4,
        "ms": 0.05997056886553764,
        "min_ms": 0.05997056886553764,
        "max_ms": 0.05997056886553764,
        "compile_time": 2.0754880905151367
    },
    {
        "BLOCK_SIZE_M": 128,
        "BLOCK_SIZE_N": 64,
        "BLOCK_SIZE_K": 16,
        "GROUP_SIZE_M": 8,
        "num_stages": 4,
        "num_warps": 4,
        "ms": 0.060084037482738495,
        "min_ms": 0.060084037482738495,
        "max_ms": 0.060084037482738495,
        "compile_time": 1.5624616146087646
    },
    {
        "BLOCK_SIZE_M": 256,
        "BLOCK_SIZE_N": 128,
        "BLOCK_SIZE_K": 128,
        "GROUP_SIZE_M": 8,
        "num_stages": 2,
        "num_warps": 8,
        "ms": 0.06019609048962593,
        "min_ms": 0.06019609048962593,
        "max_ms": 0.06019609048962593,
        "compile_time": 1.4623181819915771
    },
    {
        "BLOCK_SIZE_M": 128,
        "BLOCK_SIZE_N": 256,
        "BLOCK_SIZE_K": 16,
        "GROUP_SIZE_M": 8,
        "num_stages": 4,
        "num_warps": 8,
        "ms": 0.06019650027155876,
        "min_ms": 0.06019650027155876,
        "max_ms": 0.06019650027155876,
        "compile_time": 0.9708960056304932
    },
    {
        "BLOCK_SIZE_M": 128,
        "BLOCK_SIZE_N": 256,
        "BLOCK_SIZE_K": 16,
        "GROUP_SIZE_M": 8,
        "num_stages": 3,
        "num_warps": 8,
        "ms": 0.06021784618496895,
        "min_ms": 0.06021784618496895,
        "max_ms": 0.06021784618496895,
        "compile_time": 0.9726991653442383
    },
    {
        "BLOCK_SIZE_M": 64,
        "BLOCK_SIZE_N": 64,
        "BLOCK_SIZE_K": 128,
        "GROUP_SIZE_M": 8,
        "num_stages": 4,
        "num_warps": 4,
        "ms": 0.06025315448641777,
        "min_ms": 0.06025315448641777,
        "max_ms": 0.06025315448641777,
        "compile_time": 1.823791742324829
    },
    {
        "BLOCK_SIZE_M": 128,
        "BLOCK_SIZE_N": 256,
        "BLOCK_SIZE_K": 16,
        "GROUP_SIZE_M": 8,
        "num_stages": 8,
        "num_warps": 8,
        "ms": 0.06032460927963257,
        "min_ms": 0.06032460927963257,
        "max_ms": 0.06032460927963257,
        "compile_time": 1.974499225616455
    },
    {
        "BLOCK_SIZE_M": 256,
        "BLOCK_SIZE_N": 128,
        "BLOCK_SIZE_K": 64,
        "GROUP_SIZE_M": 8,
        "num_stages": 3,
        "num_warps": 16,
        "ms": 0.06033056229352951,
        "min_ms": 0.06033056229352951,
        "max_ms": 0.06033056229352951,
        "compile_time": 1.5021395683288574
    },
    {
        "BLOCK_SIZE_M": 64,
        "BLOCK_SIZE_N": 64,
        "BLOCK_SIZE_K": 64,
        "GROUP_SIZE_M": 8,
        "num_stages": 3,
        "num_warps": 2,
        "ms": 0.06038633733987808,
        "min_ms": 0.06038633733987808,
        "max_ms": 0.06038633733987808,
        "compile_time": 1.776240348815918
    },
    {
        "BLOCK_SIZE_M": 256,
        "BLOCK_SIZE_N": 128,
        "BLOCK_SIZE_K": 64,
        "GROUP_SIZE_M": 8,
        "num_stages": 1,
        "num_warps": 16,
        "ms": 0.06046503782272339,
        "min_ms": 0.06046503782272339,
        "max_ms": 0.06046503782272339,
        "compile_time": 1.5313458442687988
    },
    {
        "BLOCK_SIZE_M": 64,
        "BLOCK_SIZE_N": 128,
        "BLOCK_SIZE_K": 32,
        "GROUP_SIZE_M": 8,
        "num_stages": 1,
        "num_warps": 4,
        "ms": 0.0604822114109993,
        "min_ms": 0.0604822114109993,
        "max_ms": 0.0604822114109993,
        "compile_time": 1.506181001663208
    },
    {
        "BLOCK_SIZE_M": 128,
        "BLOCK_SIZE_N": 256,
        "BLOCK_SIZE_K": 32,
        "GROUP_SIZE_M": 8,
        "num_stages": 4,
        "num_warps": 16,
        "ms": 0.060487449169158936,
        "min_ms": 0.060487449169158936,
        "max_ms": 0.060487449169158936,
        "compile_time": 1.6925163269042969
    },
    {
        "BLOCK_SIZE_M": 128,
        "BLOCK_SIZE_N": 256,
        "BLOCK_SIZE_K": 32,
        "GROUP_SIZE_M": 8,
        "num_stages": 3,
        "num_warps": 16,
        "ms": 0.06050748750567436,
        "min_ms": 0.06050748750567436,
        "max_ms": 0.06050748750567436,
        "compile_time": 1.6808667182922363
    },
    {
        "BLOCK_SIZE_M": 128,
        "BLOCK_SIZE_N": 256,
        "BLOCK_SIZE_K": 32,
        "GROUP_SIZE_M": 8,
        "num_stages": 5,
        "num_warps": 16,
        "ms": 0.06053731590509415,
        "min_ms": 0.06053731590509415,
        "max_ms": 0.06053731590509415,
        "compile_time": 1.731384038925171
    },
    {
        "BLOCK_SIZE_M": 256,
        "BLOCK_SIZE_N": 128,
        "BLOCK_SIZE_K": 64,
        "GROUP_SIZE_M": 8,
        "num_stages": 4,
        "num_warps": 16,
        "ms": 0.060602910816669464,
        "min_ms": 0.060602910816669464,
        "max_ms": 0.060602910816669464,
        "compile_time": 1.4290845394134521
    },
    {
        "BLOCK_SIZE_M": 64,
        "BLOCK_SIZE_N": 128,
        "BLOCK_SIZE_K": 32,
        "GROUP_SIZE_M": 8,
        "num_stages": 1,
        "num_warps": 8,
        "ms": 0.06062164157629013,
        "min_ms": 0.06062164157629013,
        "max_ms": 0.06062164157629013,
        "compile_time": 1.369215965270996
    },
    {
        "BLOCK_SIZE_M": 32,
        "BLOCK_SIZE_N": 256,
        "BLOCK_SIZE_K": 16,
        "GROUP_SIZE_M": 8,
        "num_stages": 3,
        "num_warps": 4,
        "ms": 0.06062541529536247,
        "min_ms": 0.06062541529536247,
        "max_ms": 0.06062541529536247,
        "compile_time": 1.44545578956604
    },
    {
        "BLOCK_SIZE_M": 128,
        "BLOCK_SIZE_N": 256,
        "BLOCK_SIZE_K": 16,
        "GROUP_SIZE_M": 8,
        "num_stages": 5,
        "num_warps": 8,
        "ms": 0.06062786653637886,
        "min_ms": 0.06062786653637886,
        "max_ms": 0.06062786653637886,
        "compile_time": 1.9461958408355713
    },
    {
        "BLOCK_SIZE_M": 64,
        "BLOCK_SIZE_N": 64,
        "BLOCK_SIZE_K": 128,
        "GROUP_SIZE_M": 8,
        "num_stages": 3,
        "num_warps": 8,
        "ms": 0.060632430016994476,
        "min_ms": 0.060632430016994476,
        "max_ms": 0.060632430016994476,
        "compile_time": 1.5409419536590576
    },
    {
        "BLOCK_SIZE_M": 32,
        "BLOCK_SIZE_N": 256,
        "BLOCK_SIZE_K": 16,
        "GROUP_SIZE_M": 8,
        "num_stages": 6,
        "num_warps": 4,
        "ms": 0.06066254526376724,
        "min_ms": 0.06066254526376724,
        "max_ms": 0.06066254526376724,
        "compile_time": 1.5010805130004883
    },
    {
        "BLOCK_SIZE_M": 64,
        "BLOCK_SIZE_N": 64,
        "BLOCK_SIZE_K": 64,
        "GROUP_SIZE_M": 8,
        "num_stages": 3,
        "num_warps": 8,
        "ms": 0.06070711463689804,
        "min_ms": 0.06070711463689804,
        "max_ms": 0.06070711463689804,
        "compile_time": 1.3999769687652588
    },
    {
        "BLOCK_SIZE_M": 32,
        "BLOCK_SIZE_N": 256,
        "BLOCK_SIZE_K": 32,
        "GROUP_SIZE_M": 8,
        "num_stages": 3,
        "num_warps": 2,
        "ms": 0.060711104422807693,
        "min_ms": 0.060711104422807693,
        "max_ms": 0.060711104422807693,
        "compile_time": 2.173783540725708
    },
    {
        "BLOCK_SIZE_M": 256,
        "BLOCK_SIZE_N": 64,
        "BLOCK_SIZE_K": 128,
        "GROUP_SIZE_M": 8,
        "num_stages": 3,
        "num_warps": 16,
        "ms": 0.06074461340904236,
        "min_ms": 0.06074461340904236,
        "max_ms": 0.06074461340904236,
        "compile_time": 1.9271059036254883
    },
    {
        "BLOCK_SIZE_M": 32,
        "BLOCK_SIZE_N": 256,
        "BLOCK_SIZE_K": 32,
        "GROUP_SIZE_M": 8,
        "num_stages": 5,
        "num_warps": 8,
        "ms": 0.06076473742723465,
        "min_ms": 0.06076473742723465,
        "max_ms": 0.06076473742723465,
        "compile_time": 1.4036195278167725
    },
    {
        "BLOCK_SIZE_M": 64,
        "BLOCK_SIZE_N": 64,
        "BLOCK_SIZE_K": 64,
        "GROUP_SIZE_M": 8,
        "num_stages": 8,
        "num_warps": 4,
        "ms": 0.06084722280502319,
        "min_ms": 0.06084722280502319,
        "max_ms": 0.06084722280502319,
        "compile_time": 1.6565229892730713
    },
    {
        "BLOCK_SIZE_M": 128,
        "BLOCK_SIZE_N": 64,
        "BLOCK_SIZE_K": 16,
        "GROUP_SIZE_M": 8,
        "num_stages": 4,
        "num_warps": 2,
        "ms": 0.0608619824051857,
        "min_ms": 0.0608619824051857,
        "max_ms": 0.0608619824051857,
        "compile_time": 1.8943710327148438
    },
    {
        "BLOCK_SIZE_M": 128,
        "BLOCK_SIZE_N": 64,
        "BLOCK_SIZE_K": 16,
        "GROUP_SIZE_M": 8,
        "num_stages": 5,
        "num_warps": 4,
        "ms": 0.060866307467222214,
        "min_ms": 0.060866307467222214,
        "max_ms": 0.060866307467222214,
        "compile_time": 1.5905697345733643
    },
    {
        "BLOCK_SIZE_M": 128,
        "BLOCK_SIZE_N": 64,
        "BLOCK_SIZE_K": 16,
        "GROUP_SIZE_M": 8,
        "num_stages": 2,
        "num_warps": 4,
        "ms": 0.06087629124522209,
        "min_ms": 0.06087629124522209,
        "max_ms": 0.06087629124522209,
        "compile_time": 1.5632593631744385
    },
    {
        "BLOCK_SIZE_M": 64,
        "BLOCK_SIZE_N": 64,
        "BLOCK_SIZE_K": 128,
        "GROUP_SIZE_M": 8,
        "num_stages": 5,
        "num_warps": 4,
        "ms": 0.06094295531511307,
        "min_ms": 0.06094295531511307,
        "max_ms": 0.06094295531511307,
        "compile_time": 1.891556978225708
    },
    {
        "BLOCK_SIZE_M": 128,
        "BLOCK_SIZE_N": 64,
        "BLOCK_SIZE_K": 16,
        "GROUP_SIZE_M": 8,
        "num_stages": 5,
        "num_warps": 2,
        "ms": 0.06100256368517876,
        "min_ms": 0.06100256368517876,
        "max_ms": 0.06100256368517876,
        "compile_time": 1.9459106922149658
    },
    {
        "BLOCK_SIZE_M": 32,
        "BLOCK_SIZE_N": 256,
        "BLOCK_SIZE_K": 16,
        "GROUP_SIZE_M": 8,
        "num_stages": 3,
        "num_warps": 2,
        "ms": 0.06105348467826843,
        "min_ms": 0.06105348467826843,
        "max_ms": 0.06105348467826843,
        "compile_time": 1.8315584659576416
    },
    {
        "BLOCK_SIZE_M": 32,
        "BLOCK_SIZE_N": 128,
        "BLOCK_SIZE_K": 32,
        "GROUP_SIZE_M": 8,
        "num_stages": 5,
        "num_warps": 4,
        "ms": 0.06108253449201584,
        "min_ms": 0.06108253449201584,
        "max_ms": 0.06108253449201584,
        "compile_time": 1.4195094108581543
    },
    {
        "BLOCK_SIZE_M": 128,
        "BLOCK_SIZE_N": 256,
        "BLOCK_SIZE_K": 32,
        "GROUP_SIZE_M": 8,
        "num_stages": 6,
        "num_warps": 16,
        "ms": 0.06109418720006943,
        "min_ms": 0.06109418720006943,
        "max_ms": 0.06109418720006943,
        "compile_time": 1.7399346828460693
    },
    {
        "BLOCK_SIZE_M": 256,
        "BLOCK_SIZE_N": 32,
        "BLOCK_SIZE_K": 64,
        "GROUP_SIZE_M": 8,
        "num_stages": 4,
        "num_warps": 4,
        "ms": 0.061122000217437744,
        "min_ms": 0.061122000217437744,
        "max_ms": 0.061122000217437744,
        "compile_time": 1.4545881748199463
    },
    {
        "BLOCK_SIZE_M": 128,
        "BLOCK_SIZE_N": 64,
        "BLOCK_SIZE_K": 16,
        "GROUP_SIZE_M": 8,
        "num_stages": 6,
        "num_warps": 4,
        "ms": 0.061190713196992874,
        "min_ms": 0.061190713196992874,
        "max_ms": 0.061190713196992874,
        "compile_time": 1.6135492324829102
    },
    {
        "BLOCK_SIZE_M": 64,
        "BLOCK_SIZE_N": 256,
        "BLOCK_SIZE_K": 64,
        "GROUP_SIZE_M": 8,
        "num_stages": 3,
        "num_warps": 16,
        "ms": 0.06125177815556526,
        "min_ms": 0.06125177815556526,
        "max_ms": 0.06125177815556526,
        "compile_time": 1.531810998916626
    },
    {
        "BLOCK_SIZE_M": 64,
        "BLOCK_SIZE_N": 128,
        "BLOCK_SIZE_K": 16,
        "GROUP_SIZE_M": 8,
        "num_stages": 1,
        "num_warps": 4,
        "ms": 0.061297524720430374,
        "min_ms": 0.061297524720430374,
        "max_ms": 0.061297524720430374,
        "compile_time": 1.4507198333740234
    },
    {
        "BLOCK_SIZE_M": 64,
        "BLOCK_SIZE_N": 64,
        "BLOCK_SIZE_K": 64,
        "GROUP_SIZE_M": 8,
        "num_stages": 4,
        "num_warps": 8,
        "ms": 0.061308521777391434,
        "min_ms": 0.061308521777391434,
        "max_ms": 0.061308521777391434,
        "compile_time": 1.400482416152954
    },
    {
        "BLOCK_SIZE_M": 128,
        "BLOCK_SIZE_N": 64,
        "BLOCK_SIZE_K": 16,
        "GROUP_SIZE_M": 8,
        "num_stages": 7,
        "num_warps": 2,
        "ms": 0.061317868530750275,
        "min_ms": 0.061317868530750275,
        "max_ms": 0.061317868530750275,
        "compile_time": 2.031275987625122
    },
    {
        "BLOCK_SIZE_M": 128,
        "BLOCK_SIZE_N": 256,
        "BLOCK_SIZE_K": 32,
        "GROUP_SIZE_M": 8,
        "num_stages": 7,
        "num_warps": 16,
        "ms": 0.061360280960798264,
        "min_ms": 0.061360280960798264,
        "max_ms": 0.061360280960798264,
        "compile_time": 1.7568719387054443
    },
    {
        "BLOCK_SIZE_M": 128,
        "BLOCK_SIZE_N": 64,
        "BLOCK_SIZE_K": 64,
        "GROUP_SIZE_M": 8,
        "num_stages": 2,
        "num_warps": 8,
        "ms": 0.061370670795440674,
        "min_ms": 0.061370670795440674,
        "max_ms": 0.061370670795440674,
        "compile_time": 1.6062297821044922
    },
    {
        "BLOCK_SIZE_M": 128,
        "BLOCK_SIZE_N": 128,
        "BLOCK_SIZE_K": 64,
        "GROUP_SIZE_M": 8,
        "num_stages": 6,
        "num_warps": 16,
        "ms": 0.06139824539422989,
        "min_ms": 0.06139824539422989,
        "max_ms": 0.06139824539422989,
        "compile_time": 1.7127172946929932
    },
    {
        "BLOCK_SIZE_M": 64,
        "BLOCK_SIZE_N": 128,
        "BLOCK_SIZE_K": 64,
        "GROUP_SIZE_M": 8,
        "num_stages": 2,
        "num_warps": 8,
        "ms": 0.061425935477018356,
        "min_ms": 0.061425935477018356,
        "max_ms": 0.061425935477018356,
        "compile_time": 1.5132012367248535
    },
    {
        "BLOCK_SIZE_M": 256,
        "BLOCK_SIZE_N": 32,
        "BLOCK_SIZE_K": 32,
        "GROUP_SIZE_M": 8,
        "num_stages": 6,
        "num_warps": 4,
        "ms": 0.06147237494587898,
        "min_ms": 0.06147237494587898,
        "max_ms": 0.06147237494587898,
        "compile_time": 1.6543323993682861
    },
    {
        "BLOCK_SIZE_M": 64,
        "BLOCK_SIZE_N": 256,
        "BLOCK_SIZE_K": 64,
        "GROUP_SIZE_M": 8,
        "num_stages": 4,
        "num_warps": 16,
        "ms": 0.061522893607616425,
        "min_ms": 0.061522893607616425,
        "max_ms": 0.061522893607616425,
        "compile_time": 1.6015591621398926
    },
    {
        "BLOCK_SIZE_M": 256,
        "BLOCK_SIZE_N": 64,
        "BLOCK_SIZE_K": 64,
        "GROUP_SIZE_M": 8,
        "num_stages": 4,
        "num_warps": 16,
        "ms": 0.06153836101293564,
        "min_ms": 0.06153836101293564,
        "max_ms": 0.06153836101293564,
        "compile_time": 1.7726409435272217
    },
    {
        "BLOCK_SIZE_M": 256,
        "BLOCK_SIZE_N": 32,
        "BLOCK_SIZE_K": 64,
        "GROUP_SIZE_M": 8,
        "num_stages": 3,
        "num_warps": 4,
        "ms": 0.06166930869221687,
        "min_ms": 0.06166930869221687,
        "max_ms": 0.06166930869221687,
        "compile_time": 1.4041829109191895
    },
    {
        "BLOCK_SIZE_M": 32,
        "BLOCK_SIZE_N": 256,
        "BLOCK_SIZE_K": 32,
        "GROUP_SIZE_M": 8,
        "num_stages": 6,
        "num_warps": 4,
        "ms": 0.06170009821653366,
        "min_ms": 0.06170009821653366,
        "max_ms": 0.06170009821653366,
        "compile_time": 1.6884870529174805
    },
    {
        "BLOCK_SIZE_M": 256,
        "BLOCK_SIZE_N": 64,
        "BLOCK_SIZE_K": 64,
        "GROUP_SIZE_M": 8,
        "num_stages": 1,
        "num_warps": 4,
        "ms": 0.061742596328258514,
        "min_ms": 0.061742596328258514,
        "max_ms": 0.061742596328258514,
        "compile_time": 2.411072015762329
    },
    {
        "BLOCK_SIZE_M": 256,
        "BLOCK_SIZE_N": 128,
        "BLOCK_SIZE_K": 32,
        "GROUP_SIZE_M": 8,
        "num_stages": 4,
        "num_warps": 16,
        "ms": 0.06176421791315079,
        "min_ms": 0.06176421791315079,
        "max_ms": 0.06176421791315079,
        "compile_time": 1.68601393699646
    },
    {
        "BLOCK_SIZE_M": 256,
        "BLOCK_SIZE_N": 32,
        "BLOCK_SIZE_K": 32,
        "GROUP_SIZE_M": 8,
        "num_stages": 3,
        "num_warps": 2,
        "ms": 0.061942555010318756,
        "min_ms": 0.061942555010318756,
        "max_ms": 0.061942555010318756,
        "compile_time": 3.2454957962036133
    },
    {
        "BLOCK_SIZE_M": 32,
        "BLOCK_SIZE_N": 256,
        "BLOCK_SIZE_K": 32,
        "GROUP_SIZE_M": 8,
        "num_stages": 7,
        "num_warps": 4,
        "ms": 0.061958782374858856,
        "min_ms": 0.061958782374858856,
        "max_ms": 0.061958782374858856,
        "compile_time": 1.7316246032714844
    },
    {
        "BLOCK_SIZE_M": 256,
        "BLOCK_SIZE_N": 32,
        "BLOCK_SIZE_K": 64,
        "GROUP_SIZE_M": 8,
        "num_stages": 3,
        "num_warps": 8,
        "ms": 0.06209065392613411,
        "min_ms": 0.06209065392613411,
        "max_ms": 0.06209065392613411,
        "compile_time": 2.4984419345855713
    },
    {
        "BLOCK_SIZE_M": 128,
        "BLOCK_SIZE_N": 256,
        "BLOCK_SIZE_K": 64,
        "GROUP_SIZE_M": 8,
        "num_stages": 4,
        "num_warps": 16,
        "ms": 0.062099773436784744,
        "min_ms": 0.062099773436784744,
        "max_ms": 0.062099773436784744,
        "compile_time": 1.9124257564544678
    },
    {
        "BLOCK_SIZE_M": 256,
        "BLOCK_SIZE_N": 128,
        "BLOCK_SIZE_K": 32,
        "GROUP_SIZE_M": 8,
        "num_stages": 3,
        "num_warps": 16,
        "ms": 0.06210964918136597,
        "min_ms": 0.06210964918136597,
        "max_ms": 0.06210964918136597,
        "compile_time": 1.6495773792266846
    },
    {
        "BLOCK_SIZE_M": 128,
        "BLOCK_SIZE_N": 64,
        "BLOCK_SIZE_K": 16,
        "GROUP_SIZE_M": 8,
        "num_stages": 8,
        "num_warps": 4,
        "ms": 0.06211496517062187,
        "min_ms": 0.06211496517062187,
        "max_ms": 0.06211496517062187,
        "compile_time": 1.635542631149292
    },
    {
        "BLOCK_SIZE_M": 64,
        "BLOCK_SIZE_N": 256,
        "BLOCK_SIZE_K": 64,
        "GROUP_SIZE_M": 8,
        "num_stages": 5,
        "num_warps": 16,
        "ms": 0.062135182321071625,
        "min_ms": 0.062135182321071625,
        "max_ms": 0.062135182321071625,
        "compile_time": 1.6123340129852295
    },
    {
        "BLOCK_SIZE_M": 256,
        "BLOCK_SIZE_N": 128,
        "BLOCK_SIZE_K": 32,
        "GROUP_SIZE_M": 8,
        "num_stages": 5,
        "num_warps": 16,
        "ms": 0.06215071678161621,
        "min_ms": 0.06215071678161621,
        "max_ms": 0.06215071678161621,
        "compile_time": 1.6292452812194824
    },
    {
        "BLOCK_SIZE_M": 256,
        "BLOCK_SIZE_N": 32,
        "BLOCK_SIZE_K": 64,
        "GROUP_SIZE_M": 8,
        "num_stages": 5,
        "num_warps": 4,
        "ms": 0.06215241551399231,
        "min_ms": 0.06215241551399231,
        "max_ms": 0.06215241551399231,
        "compile_time": 1.4252853393554688
    },
    {
        "BLOCK_SIZE_M": 128,
        "BLOCK_SIZE_N": 128,
        "BLOCK_SIZE_K": 16,
        "GROUP_SIZE_M": 8,
        "num_stages": 8,
        "num_warps": 8,
        "ms": 0.06218722462654114,
        "min_ms": 0.06218722462654114,
        "max_ms": 0.06218722462654114,
        "compile_time": 1.6264498233795166
    },
    {
        "BLOCK_SIZE_M": 128,
        "BLOCK_SIZE_N": 256,
        "BLOCK_SIZE_K": 64,
        "GROUP_SIZE_M": 8,
        "num_stages": 3,
        "num_warps": 16,
        "ms": 0.062250085175037384,
        "min_ms": 0.062250085175037384,
        "max_ms": 0.062250085175037384,
        "compile_time": 1.8955435752868652
    },
    {
        "BLOCK_SIZE_M": 32,
        "BLOCK_SIZE_N": 256,
        "BLOCK_SIZE_K": 64,
        "GROUP_SIZE_M": 8,
        "num_stages": 5,
        "num_warps": 4,
        "ms": 0.062271494418382645,
        "min_ms": 0.062271494418382645,
        "max_ms": 0.062271494418382645,
        "compile_time": 2.0341179370880127
    },
    {
        "BLOCK_SIZE_M": 256,
        "BLOCK_SIZE_N": 64,
        "BLOCK_SIZE_K": 64,
        "GROUP_SIZE_M": 8,
        "num_stages": 3,
        "num_warps": 16,
        "ms": 0.06232135742902756,
        "min_ms": 0.06232135742902756,
        "max_ms": 0.06232135742902756,
        "compile_time": 1.7248826026916504
    },
    {
        "BLOCK_SIZE_M": 256,
        "BLOCK_SIZE_N": 32,
        "BLOCK_SIZE_K": 32,
        "GROUP_SIZE_M": 8,
        "num_stages": 7,
        "num_warps": 4,
        "ms": 0.06237629055976868,
        "min_ms": 0.06237629055976868,
        "max_ms": 0.06237629055976868,
        "compile_time": 1.5865352153778076
    },
    {
        "BLOCK_SIZE_M": 256,
        "BLOCK_SIZE_N": 128,
        "BLOCK_SIZE_K": 32,
        "GROUP_SIZE_M": 8,
        "num_stages": 6,
        "num_warps": 16,
        "ms": 0.062381744384765625,
        "min_ms": 0.062381744384765625,
        "max_ms": 0.062381744384765625,
        "compile_time": 1.5909063816070557
    },
    {
        "BLOCK_SIZE_M": 32,
        "BLOCK_SIZE_N": 256,
        "BLOCK_SIZE_K": 32,
        "GROUP_SIZE_M": 8,
        "num_stages": 8,
        "num_warps": 4,
        "ms": 0.06238182261586189,
        "min_ms": 0.06238182261586189,
        "max_ms": 0.06238182261586189,
        "compile_time": 1.7721469402313232
    },
    {
        "BLOCK_SIZE_M": 128,
        "BLOCK_SIZE_N": 64,
        "BLOCK_SIZE_K": 16,
        "GROUP_SIZE_M": 8,
        "num_stages": 6,
        "num_warps": 2,
        "ms": 0.06244131177663803,
        "min_ms": 0.06244131177663803,
        "max_ms": 0.06244131177663803,
        "compile_time": 1.9944524765014648
    },
    {
        "BLOCK_SIZE_M": 64,
        "BLOCK_SIZE_N": 64,
        "BLOCK_SIZE_K": 256,
        "GROUP_SIZE_M": 8,
        "num_stages": 2,
        "num_warps": 4,
        "ms": 0.062441736459732056,
        "min_ms": 0.062441736459732056,
        "max_ms": 0.062441736459732056,
        "compile_time": 2.091672897338867
    },
    {
        "BLOCK_SIZE_M": 64,
        "BLOCK_SIZE_N": 128,
        "BLOCK_SIZE_K": 128,
        "GROUP_SIZE_M": 8,
        "num_stages": 3,
        "num_warps": 16,
        "ms": 0.06252841651439667,
        "min_ms": 0.06252841651439667,
        "max_ms": 0.06252841651439667,
        "compile_time": 1.5206212997436523
    },
    {
        "BLOCK_SIZE_M": 256,
        "BLOCK_SIZE_N": 32,
        "BLOCK_SIZE_K": 32,
        "GROUP_SIZE_M": 8,
        "num_stages": 2,
        "num_warps": 4,
        "ms": 0.06256500631570816,
        "min_ms": 0.06256500631570816,
        "max_ms": 0.06256500631570816,
        "compile_time": 1.641754388809204
    },
    {
        "BLOCK_SIZE_M": 128,
        "BLOCK_SIZE_N": 64,
        "BLOCK_SIZE_K": 64,
        "GROUP_SIZE_M": 8,
        "num_stages": 3,
        "num_warps": 16,
        "ms": 0.06263555586338043,
        "min_ms": 0.06263555586338043,
        "max_ms": 0.06263555586338043,
        "compile_time": 1.4023988246917725
    },
    {
        "BLOCK_SIZE_M": 32,
        "BLOCK_SIZE_N": 128,
        "BLOCK_SIZE_K": 32,
        "GROUP_SIZE_M": 8,
        "num_stages": 6,
        "num_warps": 4,
        "ms": 0.0627567321062088,
        "min_ms": 0.0627567321062088,
        "max_ms": 0.0627567321062088,
        "compile_time": 1.4135186672210693
    },
    {
        "BLOCK_SIZE_M": 64,
        "BLOCK_SIZE_N": 64,
        "BLOCK_SIZE_K": 128,
        "GROUP_SIZE_M": 8,
        "num_stages": 3,
        "num_warps": 2,
        "ms": 0.06278222799301147,
        "min_ms": 0.06278222799301147,
        "max_ms": 0.06278222799301147,
        "compile_time": 2.4160420894622803
    },
    {
        "BLOCK_SIZE_M": 32,
        "BLOCK_SIZE_N": 128,
        "BLOCK_SIZE_K": 32,
        "GROUP_SIZE_M": 8,
        "num_stages": 3,
        "num_warps": 2,
        "ms": 0.0627928078174591,
        "min_ms": 0.0627928078174591,
        "max_ms": 0.0627928078174591,
        "compile_time": 1.5803539752960205
    },
    {
        "BLOCK_SIZE_M": 256,
        "BLOCK_SIZE_N": 128,
        "BLOCK_SIZE_K": 32,
        "GROUP_SIZE_M": 8,
        "num_stages": 7,
        "num_warps": 16,
        "ms": 0.06280728429555893,
        "min_ms": 0.06280728429555893,
        "max_ms": 0.06280728429555893,
        "compile_time": 1.6011064052581787
    },
    {
        "BLOCK_SIZE_M": 64,
        "BLOCK_SIZE_N": 64,
        "BLOCK_SIZE_K": 64,
        "GROUP_SIZE_M": 8,
        "num_stages": 5,
        "num_warps": 8,
        "ms": 0.0628146380186081,
        "min_ms": 0.0628146380186081,
        "max_ms": 0.0628146380186081,
        "compile_time": 1.4461603164672852
    },
    {
        "BLOCK_SIZE_M": 128,
        "BLOCK_SIZE_N": 64,
        "BLOCK_SIZE_K": 128,
        "GROUP_SIZE_M": 8,
        "num_stages": 3,
        "num_warps": 16,
        "ms": 0.06282166391611099,
        "min_ms": 0.06282166391611099,
        "max_ms": 0.06282166391611099,
        "compile_time": 1.6203911304473877
    },
    {
        "BLOCK_SIZE_M": 256,
        "BLOCK_SIZE_N": 32,
        "BLOCK_SIZE_K": 64,
        "GROUP_SIZE_M": 8,
        "num_stages": 4,
        "num_warps": 8,
        "ms": 0.06284533441066742,
        "min_ms": 0.06284533441066742,
        "max_ms": 0.06284533441066742,
        "compile_time": 2.506000518798828
    },
    {
        "BLOCK_SIZE_M": 128,
        "BLOCK_SIZE_N": 32,
        "BLOCK_SIZE_K": 64,
        "GROUP_SIZE_M": 8,
        "num_stages": 3,
        "num_warps": 4,
        "ms": 0.06286735832691193,
        "min_ms": 0.06286735832691193,
        "max_ms": 0.06286735832691193,
        "compile_time": 1.7098090648651123
    },
    {
        "BLOCK_SIZE_M": 128,
        "BLOCK_SIZE_N": 64,
        "BLOCK_SIZE_K": 128,
        "GROUP_SIZE_M": 8,
        "num_stages": 1,
        "num_warps": 8,
        "ms": 0.06287571787834167,
        "min_ms": 0.06287571787834167,
        "max_ms": 0.06287571787834167,
        "compile_time": 1.6870663166046143
    },
    {
        "BLOCK_SIZE_M": 64,
        "BLOCK_SIZE_N": 128,
        "BLOCK_SIZE_K": 16,
        "GROUP_SIZE_M": 8,
        "num_stages": 2,
        "num_warps": 2,
        "ms": 0.06289178878068924,
        "min_ms": 0.06289178878068924,
        "max_ms": 0.06289178878068924,
        "compile_time": 1.7624692916870117
    },
    {
        "BLOCK_SIZE_M": 512,
        "BLOCK_SIZE_N": 64,
        "BLOCK_SIZE_K": 64,
        "GROUP_SIZE_M": 8,
        "num_stages": 2,
        "num_warps": 8,
        "ms": 0.06290493160486221,
        "min_ms": 0.06290493160486221,
        "max_ms": 0.06290493160486221,
        "compile_time": 2.7775442600250244
    },
    {
        "BLOCK_SIZE_M": 128,
        "BLOCK_SIZE_N": 64,
        "BLOCK_SIZE_K": 64,
        "GROUP_SIZE_M": 8,
        "num_stages": 4,
        "num_warps": 16,
        "ms": 0.06294158846139908,
        "min_ms": 0.06294158846139908,
        "max_ms": 0.06294158846139908,
        "compile_time": 1.538161039352417
    },
    {
        "BLOCK_SIZE_M": 32,
        "BLOCK_SIZE_N": 256,
        "BLOCK_SIZE_K": 64,
        "GROUP_SIZE_M": 8,
        "num_stages": 5,
        "num_warps": 8,
        "ms": 0.06302875280380249,
        "min_ms": 0.06302875280380249,
        "max_ms": 0.06302875280380249,
        "compile_time": 1.6103713512420654
    },
    {
        "BLOCK_SIZE_M": 32,
        "BLOCK_SIZE_N": 256,
        "BLOCK_SIZE_K": 32,
        "GROUP_SIZE_M": 8,
        "num_stages": 6,
        "num_warps": 8,
        "ms": 0.06303727626800537,
        "min_ms": 0.06303727626800537,
        "max_ms": 0.06303727626800537,
        "compile_time": 1.333601951599121
    },
    {
        "BLOCK_SIZE_M": 32,
        "BLOCK_SIZE_N": 256,
        "BLOCK_SIZE_K": 16,
        "GROUP_SIZE_M": 8,
        "num_stages": 4,
        "num_warps": 8,
        "ms": 0.06310151517391205,
        "min_ms": 0.06310151517391205,
        "max_ms": 0.06310151517391205,
        "compile_time": 1.3413512706756592
    },
    {
        "BLOCK_SIZE_M": 32,
        "BLOCK_SIZE_N": 128,
        "BLOCK_SIZE_K": 32,
        "GROUP_SIZE_M": 8,
        "num_stages": 6,
        "num_warps": 2,
        "ms": 0.06310208141803741,
        "min_ms": 0.06310208141803741,
        "max_ms": 0.06310208141803741,
        "compile_time": 1.69627046585083
    },
    {
        "BLOCK_SIZE_M": 64,
        "BLOCK_SIZE_N": 256,
        "BLOCK_SIZE_K": 64,
        "GROUP_SIZE_M": 8,
        "num_stages": 4,
        "num_warps": 4,
        "ms": 0.06326138228178024,
        "min_ms": 0.06326138228178024,
        "max_ms": 0.06326138228178024,
        "compile_time": 2.500617027282715
    },
    {
        "BLOCK_SIZE_M": 32,
        "BLOCK_SIZE_N": 256,
        "BLOCK_SIZE_K": 32,
        "GROUP_SIZE_M": 8,
        "num_stages": 7,
        "num_warps": 8,
        "ms": 0.06328469514846802,
        "min_ms": 0.06328469514846802,
        "max_ms": 0.06328469514846802,
        "compile_time": 1.479478120803833
    },
    {
        "BLOCK_SIZE_M": 256,
        "BLOCK_SIZE_N": 32,
        "BLOCK_SIZE_K": 32,
        "GROUP_SIZE_M": 8,
        "num_stages": 8,
        "num_warps": 4,
        "ms": 0.0632929652929306,
        "min_ms": 0.0632929652929306,
        "max_ms": 0.0632929652929306,
        "compile_time": 1.584345817565918
    },
    {
        "BLOCK_SIZE_M": 32,
        "BLOCK_SIZE_N": 256,
        "BLOCK_SIZE_K": 16,
        "GROUP_SIZE_M": 8,
        "num_stages": 5,
        "num_warps": 8,
        "ms": 0.06340668350458145,
        "min_ms": 0.06340668350458145,
        "max_ms": 0.06340668350458145,
        "compile_time": 1.3687493801116943
    },
    {
        "BLOCK_SIZE_M": 64,
        "BLOCK_SIZE_N": 64,
        "BLOCK_SIZE_K": 64,
        "GROUP_SIZE_M": 8,
        "num_stages": 1,
        "num_warps": 2,
        "ms": 0.06346134841442108,
        "min_ms": 0.06346134841442108,
        "max_ms": 0.06346134841442108,
        "compile_time": 1.6371824741363525
    },
    {
        "BLOCK_SIZE_M": 128,
        "BLOCK_SIZE_N": 64,
        "BLOCK_SIZE_K": 16,
        "GROUP_SIZE_M": 8,
        "num_stages": 8,
        "num_warps": 2,
        "ms": 0.06352514773607254,
        "min_ms": 0.06352514773607254,
        "max_ms": 0.06352514773607254,
        "compile_time": 1.9553887844085693
    },
    {
        "BLOCK_SIZE_M": 128,
        "BLOCK_SIZE_N": 256,
        "BLOCK_SIZE_K": 128,
        "GROUP_SIZE_M": 8,
        "num_stages": 1,
        "num_warps": 16,
        "ms": 0.06353272497653961,
        "min_ms": 0.06353272497653961,
        "max_ms": 0.06353272497653961,
        "compile_time": 1.8561267852783203
    },
    {
        "BLOCK_SIZE_M": 32,
        "BLOCK_SIZE_N": 256,
        "BLOCK_SIZE_K": 16,
        "GROUP_SIZE_M": 8,
        "num_stages": 6,
        "num_warps": 2,
        "ms": 0.06354286521673203,
        "min_ms": 0.06354286521673203,
        "max_ms": 0.06354286521673203,
        "compile_time": 1.915891170501709
    },
    {
        "BLOCK_SIZE_M": 256,
        "BLOCK_SIZE_N": 32,
        "BLOCK_SIZE_K": 32,
        "GROUP_SIZE_M": 8,
        "num_stages": 4,
        "num_warps": 8,
        "ms": 0.0636124238371849,
        "min_ms": 0.0636124238371849,
        "max_ms": 0.0636124238371849,
        "compile_time": 2.5247435569763184
    },
    {
        "BLOCK_SIZE_M": 256,
        "BLOCK_SIZE_N": 32,
        "BLOCK_SIZE_K": 32,
        "GROUP_SIZE_M": 8,
        "num_stages": 3,
        "num_warps": 8,
        "ms": 0.06363972276449203,
        "min_ms": 0.06363972276449203,
        "max_ms": 0.06363972276449203,
        "compile_time": 1.577486276626587
    },
    {
        "BLOCK_SIZE_M": 32,
        "BLOCK_SIZE_N": 128,
        "BLOCK_SIZE_K": 64,
        "GROUP_SIZE_M": 8,
        "num_stages": 5,
        "num_warps": 2,
        "ms": 0.06371267139911652,
        "min_ms": 0.06371267139911652,
        "max_ms": 0.06371267139911652,
        "compile_time": 2.025911569595337
    },
    {
        "BLOCK_SIZE_M": 32,
        "BLOCK_SIZE_N": 256,
        "BLOCK_SIZE_K": 64,
        "GROUP_SIZE_M": 8,
        "num_stages": 4,
        "num_warps": 4,
        "ms": 0.06377972662448883,
        "min_ms": 0.06377972662448883,
        "max_ms": 0.06377972662448883,
        "compile_time": 1.9797394275665283
    },
    {
        "BLOCK_SIZE_M": 256,
        "BLOCK_SIZE_N": 128,
        "BLOCK_SIZE_K": 16,
        "GROUP_SIZE_M": 8,
        "num_stages": 6,
        "num_warps": 8,
        "ms": 0.063779816031456,
        "min_ms": 0.063779816031456,
        "max_ms": 0.063779816031456,
        "compile_time": 2.0508127212524414
    },
    {
        "BLOCK_SIZE_M": 64,
        "BLOCK_SIZE_N": 128,
        "BLOCK_SIZE_K": 64,
        "GROUP_SIZE_M": 8,
        "num_stages": 1,
        "num_warps": 2,
        "ms": 0.06379202753305435,
        "min_ms": 0.06379202753305435,
        "max_ms": 0.06379202753305435,
        "compile_time": 2.134294271469116
    },
    {
        "BLOCK_SIZE_M": 64,
        "BLOCK_SIZE_N": 128,
        "BLOCK_SIZE_K": 64,
        "GROUP_SIZE_M": 8,
        "num_stages": 3,
        "num_warps": 16,
        "ms": 0.06383343786001205,
        "min_ms": 0.06383343786001205,
        "max_ms": 0.06383343786001205,
        "compile_time": 1.4005377292633057
    },
    {
        "BLOCK_SIZE_M": 256,
        "BLOCK_SIZE_N": 128,
        "BLOCK_SIZE_K": 16,
        "GROUP_SIZE_M": 8,
        "num_stages": 7,
        "num_warps": 8,
        "ms": 0.0638463944196701,
        "min_ms": 0.0638463944196701,
        "max_ms": 0.0638463944196701,
        "compile_time": 1.6904230117797852
    },
    {
        "BLOCK_SIZE_M": 32,
        "BLOCK_SIZE_N": 256,
        "BLOCK_SIZE_K": 64,
        "GROUP_SIZE_M": 8,
        "num_stages": 4,
        "num_warps": 8,
        "ms": 0.06389220058917999,
        "min_ms": 0.06389220058917999,
        "max_ms": 0.06389220058917999,
        "compile_time": 1.5591063499450684
    },
    {
        "BLOCK_SIZE_M": 64,
        "BLOCK_SIZE_N": 128,
        "BLOCK_SIZE_K": 128,
        "GROUP_SIZE_M": 8,
        "num_stages": 4,
        "num_warps": 16,
        "ms": 0.06390742212533951,
        "min_ms": 0.06390742212533951,
        "max_ms": 0.06390742212533951,
        "compile_time": 1.5505774021148682
    },
    {
        "BLOCK_SIZE_M": 32,
        "BLOCK_SIZE_N": 128,
        "BLOCK_SIZE_K": 32,
        "GROUP_SIZE_M": 8,
        "num_stages": 4,
        "num_warps": 4,
        "ms": 0.06391670554876328,
        "min_ms": 0.06391670554876328,
        "max_ms": 0.06391670554876328,
        "compile_time": 1.4059123992919922
    },
    {
        "BLOCK_SIZE_M": 32,
        "BLOCK_SIZE_N": 256,
        "BLOCK_SIZE_K": 32,
        "GROUP_SIZE_M": 8,
        "num_stages": 2,
        "num_warps": 4,
        "ms": 0.06392264366149902,
        "min_ms": 0.06392264366149902,
        "max_ms": 0.06392264366149902,
        "compile_time": 1.559314489364624
    },
    {
        "BLOCK_SIZE_M": 32,
        "BLOCK_SIZE_N": 256,
        "BLOCK_SIZE_K": 16,
        "GROUP_SIZE_M": 8,
        "num_stages": 3,
        "num_warps": 8,
        "ms": 0.06403285264968872,
        "min_ms": 0.06403285264968872,
        "max_ms": 0.06403285264968872,
        "compile_time": 1.3451905250549316
    },
    {
        "BLOCK_SIZE_M": 64,
        "BLOCK_SIZE_N": 128,
        "BLOCK_SIZE_K": 64,
        "GROUP_SIZE_M": 8,
        "num_stages": 4,
        "num_warps": 16,
        "ms": 0.06408058851957321,
        "min_ms": 0.06408058851957321,
        "max_ms": 0.06408058851957321,
        "compile_time": 1.4205780029296875
    },
    {
        "BLOCK_SIZE_M": 64,
        "BLOCK_SIZE_N": 256,
        "BLOCK_SIZE_K": 64,
        "GROUP_SIZE_M": 8,
        "num_stages": 5,
        "num_warps": 4,
        "ms": 0.06408827006816864,
        "min_ms": 0.06408827006816864,
        "max_ms": 0.06408827006816864,
        "compile_time": 2.533663749694824
    },
    {
        "BLOCK_SIZE_M": 64,
        "BLOCK_SIZE_N": 64,
        "BLOCK_SIZE_K": 128,
        "GROUP_SIZE_M": 8,
        "num_stages": 6,
        "num_warps": 4,
        "ms": 0.06409937143325806,
        "min_ms": 0.06409937143325806,
        "max_ms": 0.06409937143325806,
        "compile_time": 1.9738292694091797
    },
    {
        "BLOCK_SIZE_M": 128,
        "BLOCK_SIZE_N": 32,
        "BLOCK_SIZE_K": 32,
        "GROUP_SIZE_M": 8,
        "num_stages": 2,
        "num_warps": 2,
        "ms": 0.0641329362988472,
        "min_ms": 0.0641329362988472,
        "max_ms": 0.0641329362988472,
        "compile_time": 1.6737544536590576
    },
    {
        "BLOCK_SIZE_M": 256,
        "BLOCK_SIZE_N": 128,
        "BLOCK_SIZE_K": 16,
        "GROUP_SIZE_M": 8,
        "num_stages": 8,
        "num_warps": 8,
        "ms": 0.06414666026830673,
        "min_ms": 0.06414666026830673,
        "max_ms": 0.06414666026830673,
        "compile_time": 1.7264816761016846
    },
    {
        "BLOCK_SIZE_M": 128,
        "BLOCK_SIZE_N": 64,
        "BLOCK_SIZE_K": 128,
        "GROUP_SIZE_M": 8,
        "num_stages": 4,
        "num_warps": 16,
        "ms": 0.06417174637317657,
        "min_ms": 0.06417174637317657,
        "max_ms": 0.06417174637317657,
        "compile_time": 1.6393067836761475
    },
    {
        "BLOCK_SIZE_M": 256,
        "BLOCK_SIZE_N": 32,
        "BLOCK_SIZE_K": 32,
        "GROUP_SIZE_M": 8,
        "num_stages": 5,
        "num_warps": 8,
        "ms": 0.06424504518508911,
        "min_ms": 0.06424504518508911,
        "max_ms": 0.06424504518508911,
        "compile_time": 1.4912257194519043
    },
    {
        "BLOCK_SIZE_M": 64,
        "BLOCK_SIZE_N": 64,
        "BLOCK_SIZE_K": 64,
        "GROUP_SIZE_M": 8,
        "num_stages": 6,
        "num_warps": 8,
        "ms": 0.06424801051616669,
        "min_ms": 0.06424801051616669,
        "max_ms": 0.06424801051616669,
        "compile_time": 1.4464516639709473
    },
    {
        "BLOCK_SIZE_M": 32,
        "BLOCK_SIZE_N": 128,
        "BLOCK_SIZE_K": 64,
        "GROUP_SIZE_M": 8,
        "num_stages": 4,
        "num_warps": 2,
        "ms": 0.0642562136054039,
        "min_ms": 0.0642562136054039,
        "max_ms": 0.0642562136054039,
        "compile_time": 1.921276330947876
    },
    {
        "BLOCK_SIZE_M": 128,
        "BLOCK_SIZE_N": 32,
        "BLOCK_SIZE_K": 32,
        "GROUP_SIZE_M": 8,
        "num_stages": 3,
        "num_warps": 2,
        "ms": 0.06426376849412918,
        "min_ms": 0.06426376849412918,
        "max_ms": 0.06426376849412918,
        "compile_time": 1.7541396617889404
    },
    {
        "BLOCK_SIZE_M": 32,
        "BLOCK_SIZE_N": 256,
        "BLOCK_SIZE_K": 32,
        "GROUP_SIZE_M": 8,
        "num_stages": 8,
        "num_warps": 8,
        "ms": 0.06426961719989777,
        "min_ms": 0.06426961719989777,
        "max_ms": 0.06426961719989777,
        "compile_time": 1.4974422454833984
    },
    {
        "BLOCK_SIZE_M": 64,
        "BLOCK_SIZE_N": 128,
        "BLOCK_SIZE_K": 16,
        "GROUP_SIZE_M": 8,
        "num_stages": 3,
        "num_warps": 8,
        "ms": 0.06432124227285385,
        "min_ms": 0.06432124227285385,
        "max_ms": 0.06432124227285385,
        "compile_time": 1.3932676315307617
    },
    {
        "BLOCK_SIZE_M": 32,
        "BLOCK_SIZE_N": 256,
        "BLOCK_SIZE_K": 16,
        "GROUP_SIZE_M": 8,
        "num_stages": 6,
        "num_warps": 8,
        "ms": 0.0643542930483818,
        "min_ms": 0.0643542930483818,
        "max_ms": 0.0643542930483818,
        "compile_time": 1.3680875301361084
    },
    {
        "BLOCK_SIZE_M": 64,
        "BLOCK_SIZE_N": 128,
        "BLOCK_SIZE_K": 16,
        "GROUP_SIZE_M": 8,
        "num_stages": 4,
        "num_warps": 8,
        "ms": 0.06435494124889374,
        "min_ms": 0.06435494124889374,
        "max_ms": 0.06435494124889374,
        "compile_time": 1.4032433032989502
    },
    {
        "BLOCK_SIZE_M": 256,
        "BLOCK_SIZE_N": 32,
        "BLOCK_SIZE_K": 32,
        "GROUP_SIZE_M": 8,
        "num_stages": 2,
        "num_warps": 2,
        "ms": 0.0644182562828064,
        "min_ms": 0.0644182562828064,
        "max_ms": 0.0644182562828064,
        "compile_time": 3.173100233078003
    },
    {
        "BLOCK_SIZE_M": 128,
        "BLOCK_SIZE_N": 64,
        "BLOCK_SIZE_K": 64,
        "GROUP_SIZE_M": 8,
        "num_stages": 1,
        "num_warps": 2,
        "ms": 0.06446488946676254,
        "min_ms": 0.06446488946676254,
        "max_ms": 0.06446488946676254,
        "compile_time": 2.2810118198394775
    },
    {
        "BLOCK_SIZE_M": 64,
        "BLOCK_SIZE_N": 512,
        "BLOCK_SIZE_K": 32,
        "GROUP_SIZE_M": 8,
        "num_stages": 2,
        "num_warps": 8,
        "ms": 0.06448434293270111,
        "min_ms": 0.06448434293270111,
        "max_ms": 0.06448434293270111,
        "compile_time": 2.0495364665985107
    },
    {
        "BLOCK_SIZE_M": 256,
        "BLOCK_SIZE_N": 32,
        "BLOCK_SIZE_K": 64,
        "GROUP_SIZE_M": 8,
        "num_stages": 5,
        "num_warps": 8,
        "ms": 0.06462627649307251,
        "min_ms": 0.06462627649307251,
        "max_ms": 0.06462627649307251,
        "compile_time": 2.646807909011841
    },
    {
        "BLOCK_SIZE_M": 64,
        "BLOCK_SIZE_N": 64,
        "BLOCK_SIZE_K": 32,
        "GROUP_SIZE_M": 8,
        "num_stages": 2,
        "num_warps": 4,
        "ms": 0.06464044749736786,
        "min_ms": 0.06464044749736786,
        "max_ms": 0.06464044749736786,
        "compile_time": 1.3793656826019287
    },
    {
        "BLOCK_SIZE_M": 64,
        "BLOCK_SIZE_N": 128,
        "BLOCK_SIZE_K": 128,
        "GROUP_SIZE_M": 8,
        "num_stages": 1,
        "num_warps": 8,
        "ms": 0.0646820217370987,
        "min_ms": 0.0646820217370987,
        "max_ms": 0.0646820217370987,
        "compile_time": 1.5467627048492432
    },
    {
        "BLOCK_SIZE_M": 256,
        "BLOCK_SIZE_N": 64,
        "BLOCK_SIZE_K": 32,
        "GROUP_SIZE_M": 8,
        "num_stages": 1,
        "num_warps": 4,
        "ms": 0.06475357711315155,
        "min_ms": 0.06475357711315155,
        "max_ms": 0.06475357711315155,
        "compile_time": 2.1228344440460205
    },
    {
        "BLOCK_SIZE_M": 64,
        "BLOCK_SIZE_N": 128,
        "BLOCK_SIZE_K": 16,
        "GROUP_SIZE_M": 8,
        "num_stages": 5,
        "num_warps": 8,
        "ms": 0.06477166712284088,
        "min_ms": 0.06477166712284088,
        "max_ms": 0.06477166712284088,
        "compile_time": 1.4021613597869873
    },
    {
        "BLOCK_SIZE_M": 256,
        "BLOCK_SIZE_N": 128,
        "BLOCK_SIZE_K": 64,
        "GROUP_SIZE_M": 8,
        "num_stages": 2,
        "num_warps": 16,
        "ms": 0.06481342017650604,
        "min_ms": 0.06481342017650604,
        "max_ms": 0.06481342017650604,
        "compile_time": 2.7678720951080322
    },
    {
        "BLOCK_SIZE_M": 64,
        "BLOCK_SIZE_N": 128,
        "BLOCK_SIZE_K": 64,
        "GROUP_SIZE_M": 8,
        "num_stages": 5,
        "num_warps": 16,
        "ms": 0.06485141068696976,
        "min_ms": 0.06485141068696976,
        "max_ms": 0.06485141068696976,
        "compile_time": 1.4649395942687988
    },
    {
        "BLOCK_SIZE_M": 128,
        "BLOCK_SIZE_N": 32,
        "BLOCK_SIZE_K": 32,
        "GROUP_SIZE_M": 8,
        "num_stages": 6,
        "num_warps": 2,
        "ms": 0.06487302482128143,
        "min_ms": 0.06487302482128143,
        "max_ms": 0.06487302482128143,
        "compile_time": 1.8502750396728516
    },
    {
        "BLOCK_SIZE_M": 128,
        "BLOCK_SIZE_N": 64,
        "BLOCK_SIZE_K": 16,
        "GROUP_SIZE_M": 8,
        "num_stages": 3,
        "num_warps": 8,
        "ms": 0.06490589678287506,
        "min_ms": 0.06490589678287506,
        "max_ms": 0.06490589678287506,
        "compile_time": 1.4741802215576172
    },
    {
        "BLOCK_SIZE_M": 128,
        "BLOCK_SIZE_N": 256,
        "BLOCK_SIZE_K": 128,
        "GROUP_SIZE_M": 8,
        "num_stages": 2,
        "num_warps": 8,
        "ms": 0.06491449475288391,
        "min_ms": 0.06491449475288391,
        "max_ms": 0.06491449475288391,
        "compile_time": 2.5563154220581055
    },
    {
        "BLOCK_SIZE_M": 128,
        "BLOCK_SIZE_N": 64,
        "BLOCK_SIZE_K": 16,
        "GROUP_SIZE_M": 8,
        "num_stages": 4,
        "num_warps": 8,
        "ms": 0.06501470506191254,
        "min_ms": 0.06501470506191254,
        "max_ms": 0.06501470506191254,
        "compile_time": 1.488969087600708
    },
    {
        "BLOCK_SIZE_M": 32,
        "BLOCK_SIZE_N": 128,
        "BLOCK_SIZE_K": 64,
        "GROUP_SIZE_M": 8,
        "num_stages": 3,
        "num_warps": 4,
        "ms": 0.06504501402378082,
        "min_ms": 0.06504501402378082,
        "max_ms": 0.06504501402378082,
        "compile_time": 1.520989179611206
    },
    {
        "BLOCK_SIZE_M": 128,
        "BLOCK_SIZE_N": 256,
        "BLOCK_SIZE_K": 128,
        "GROUP_SIZE_M": 8,
        "num_stages": 1,
        "num_warps": 8,
        "ms": 0.06505019962787628,
        "min_ms": 0.06505019962787628,
        "max_ms": 0.06505019962787628,
        "compile_time": 2.4874396324157715
    },
    {
        "BLOCK_SIZE_M": 256,
        "BLOCK_SIZE_N": 64,
        "BLOCK_SIZE_K": 64,
        "GROUP_SIZE_M": 8,
        "num_stages": 5,
        "num_warps": 16,
        "ms": 0.06506769359111786,
        "min_ms": 0.06506769359111786,
        "max_ms": 0.06506769359111786,
        "compile_time": 1.8345632553100586
    },
    {
        "BLOCK_SIZE_M": 64,
        "BLOCK_SIZE_N": 128,
        "BLOCK_SIZE_K": 16,
        "GROUP_SIZE_M": 8,
        "num_stages": 6,
        "num_warps": 8,
        "ms": 0.0650734007358551,
        "min_ms": 0.0650734007358551,
        "max_ms": 0.0650734007358551,
        "compile_time": 1.4160873889923096
    },
    {
        "BLOCK_SIZE_M": 128,
        "BLOCK_SIZE_N": 256,
        "BLOCK_SIZE_K": 64,
        "GROUP_SIZE_M": 8,
        "num_stages": 1,
        "num_warps": 16,
        "ms": 0.06509269028902054,
        "min_ms": 0.06509269028902054,
        "max_ms": 0.06509269028902054,
        "compile_time": 1.6601674556732178
    },
    {
        "BLOCK_SIZE_M": 128,
        "BLOCK_SIZE_N": 64,
        "BLOCK_SIZE_K": 32,
        "GROUP_SIZE_M": 8,
        "num_stages": 1,
        "num_warps": 8,
        "ms": 0.0651538223028183,
        "min_ms": 0.0651538223028183,
        "max_ms": 0.0651538223028183,
        "compile_time": 1.478363275527954
    },
    {
        "BLOCK_SIZE_M": 128,
        "BLOCK_SIZE_N": 64,
        "BLOCK_SIZE_K": 32,
        "GROUP_SIZE_M": 8,
        "num_stages": 8,
        "num_warps": 2,
        "ms": 0.06516216695308685,
        "min_ms": 0.06516216695308685,
        "max_ms": 0.06516216695308685,
        "compile_time": 2.513455390930176
    },
    {
        "BLOCK_SIZE_M": 512,
        "BLOCK_SIZE_N": 64,
        "BLOCK_SIZE_K": 32,
        "GROUP_SIZE_M": 8,
        "num_stages": 2,
        "num_warps": 8,
        "ms": 0.06520993262529373,
        "min_ms": 0.06520993262529373,
        "max_ms": 0.06520993262529373,
        "compile_time": 2.5349910259246826
    },
    {
        "BLOCK_SIZE_M": 64,
        "BLOCK_SIZE_N": 256,
        "BLOCK_SIZE_K": 32,
        "GROUP_SIZE_M": 8,
        "num_stages": 1,
        "num_warps": 4,
        "ms": 0.06521562486886978,
        "min_ms": 0.06521562486886978,
        "max_ms": 0.06521562486886978,
        "compile_time": 1.86539626121521
    },
    {
        "BLOCK_SIZE_M": 64,
        "BLOCK_SIZE_N": 64,
        "BLOCK_SIZE_K": 256,
        "GROUP_SIZE_M": 8,
        "num_stages": 3,
        "num_warps": 4,
        "ms": 0.06521598994731903,
        "min_ms": 0.06521598994731903,
        "max_ms": 0.06521598994731903,
        "compile_time": 2.387017011642456
    },
    {
        "BLOCK_SIZE_M": 64,
        "BLOCK_SIZE_N": 64,
        "BLOCK_SIZE_K": 64,
        "GROUP_SIZE_M": 8,
        "num_stages": 2,
        "num_warps": 4,
        "ms": 0.06522448360919952,
        "min_ms": 0.06522448360919952,
        "max_ms": 0.06522448360919952,
        "compile_time": 1.5075724124908447
    },
    {
        "BLOCK_SIZE_M": 64,
        "BLOCK_SIZE_N": 128,
        "BLOCK_SIZE_K": 16,
        "GROUP_SIZE_M": 8,
        "num_stages": 7,
        "num_warps": 8,
        "ms": 0.0653458833694458,
        "min_ms": 0.0653458833694458,
        "max_ms": 0.0653458833694458,
        "compile_time": 1.4161176681518555
    },
    {
        "BLOCK_SIZE_M": 32,
        "BLOCK_SIZE_N": 128,
        "BLOCK_SIZE_K": 64,
        "GROUP_SIZE_M": 8,
        "num_stages": 3,
        "num_warps": 8,
        "ms": 0.06541766226291656,
        "min_ms": 0.06541766226291656,
        "max_ms": 0.06541766226291656,
        "compile_time": 1.3848822116851807
    },
    {
        "BLOCK_SIZE_M": 32,
        "BLOCK_SIZE_N": 128,
        "BLOCK_SIZE_K": 64,
        "GROUP_SIZE_M": 8,
        "num_stages": 4,
        "num_warps": 4,
        "ms": 0.06546320021152496,
        "min_ms": 0.06546320021152496,
        "max_ms": 0.06546320021152496,
        "compile_time": 1.5635707378387451
    },
    {
        "BLOCK_SIZE_M": 128,
        "BLOCK_SIZE_N": 64,
        "BLOCK_SIZE_K": 16,
        "GROUP_SIZE_M": 8,
        "num_stages": 5,
        "num_warps": 8,
        "ms": 0.06556357443332672,
        "min_ms": 0.06556357443332672,
        "max_ms": 0.06556357443332672,
        "compile_time": 1.500147819519043
    },
    {
        "BLOCK_SIZE_M": 64,
        "BLOCK_SIZE_N": 128,
        "BLOCK_SIZE_K": 16,
        "GROUP_SIZE_M": 8,
        "num_stages": 8,
        "num_warps": 8,
        "ms": 0.06561844050884247,
        "min_ms": 0.06561844050884247,
        "max_ms": 0.06561844050884247,
        "compile_time": 1.4440562725067139
    },
    {
        "BLOCK_SIZE_M": 128,
        "BLOCK_SIZE_N": 32,
        "BLOCK_SIZE_K": 64,
        "GROUP_SIZE_M": 8,
        "num_stages": 4,
        "num_warps": 2,
        "ms": 0.06563670188188553,
        "min_ms": 0.06563670188188553,
        "max_ms": 0.06563670188188553,
        "compile_time": 2.182920455932617
    },
    {
        "BLOCK_SIZE_M": 64,
        "BLOCK_SIZE_N": 64,
        "BLOCK_SIZE_K": 16,
        "GROUP_SIZE_M": 8,
        "num_stages": 8,
        "num_warps": 4,
        "ms": 0.0656958669424057,
        "min_ms": 0.0656958669424057,
        "max_ms": 0.0656958669424057,
        "compile_time": 1.4213104248046875
    },
    {
        "BLOCK_SIZE_M": 128,
        "BLOCK_SIZE_N": 32,
        "BLOCK_SIZE_K": 64,
        "GROUP_SIZE_M": 8,
        "num_stages": 4,
        "num_warps": 4,
        "ms": 0.06580798327922821,
        "min_ms": 0.06580798327922821,
        "max_ms": 0.06580798327922821,
        "compile_time": 1.7530126571655273
    },
    {
        "BLOCK_SIZE_M": 32,
        "BLOCK_SIZE_N": 512,
        "BLOCK_SIZE_K": 32,
        "GROUP_SIZE_M": 8,
        "num_stages": 3,
        "num_warps": 4,
        "ms": 0.06581298261880875,
        "min_ms": 0.06581298261880875,
        "max_ms": 0.06581298261880875,
        "compile_time": 2.1470000743865967
    },
    {
        "BLOCK_SIZE_M": 128,
        "BLOCK_SIZE_N": 64,
        "BLOCK_SIZE_K": 16,
        "GROUP_SIZE_M": 8,
        "num_stages": 1,
        "num_warps": 4,
        "ms": 0.0658472403883934,
        "min_ms": 0.0658472403883934,
        "max_ms": 0.0658472403883934,
        "compile_time": 1.5334057807922363
    },
    {
        "BLOCK_SIZE_M": 64,
        "BLOCK_SIZE_N": 128,
        "BLOCK_SIZE_K": 64,
        "GROUP_SIZE_M": 8,
        "num_stages": 6,
        "num_warps": 16,
        "ms": 0.06586434692144394,
        "min_ms": 0.06586434692144394,
        "max_ms": 0.06586434692144394,
        "compile_time": 1.4578242301940918
    },
    {
        "BLOCK_SIZE_M": 128,
        "BLOCK_SIZE_N": 128,
        "BLOCK_SIZE_K": 16,
        "GROUP_SIZE_M": 8,
        "num_stages": 4,
        "num_warps": 8,
        "ms": 0.06587997823953629,
        "min_ms": 0.06587997823953629,
        "max_ms": 0.06587997823953629,
        "compile_time": 1.630279779434204
    },
    {
        "BLOCK_SIZE_M": 32,
        "BLOCK_SIZE_N": 128,
        "BLOCK_SIZE_K": 32,
        "GROUP_SIZE_M": 8,
        "num_stages": 4,
        "num_warps": 2,
        "ms": 0.06590353697538376,
        "min_ms": 0.06590353697538376,
        "max_ms": 0.06590353697538376,
        "compile_time": 1.615558385848999
    },
    {
        "BLOCK_SIZE_M": 64,
        "BLOCK_SIZE_N": 64,
        "BLOCK_SIZE_K": 128,
        "GROUP_SIZE_M": 8,
        "num_stages": 2,
        "num_warps": 2,
        "ms": 0.06590816378593445,
        "min_ms": 0.06590816378593445,
        "max_ms": 0.06590816378593445,
        "compile_time": 2.1443252563476562
    },
    {
        "BLOCK_SIZE_M": 128,
        "BLOCK_SIZE_N": 32,
        "BLOCK_SIZE_K": 64,
        "GROUP_SIZE_M": 8,
        "num_stages": 5,
        "num_warps": 2,
        "ms": 0.06594990193843842,
        "min_ms": 0.06594990193843842,
        "max_ms": 0.06594990193843842,
        "compile_time": 2.2080934047698975
    },
    {
        "BLOCK_SIZE_M": 128,
        "BLOCK_SIZE_N": 64,
        "BLOCK_SIZE_K": 16,
        "GROUP_SIZE_M": 8,
        "num_stages": 6,
        "num_warps": 8,
        "ms": 0.06599009037017822,
        "min_ms": 0.06599009037017822,
        "max_ms": 0.06599009037017822,
        "compile_time": 1.542917013168335
    },
    {
        "BLOCK_SIZE_M": 128,
        "BLOCK_SIZE_N": 128,
        "BLOCK_SIZE_K": 16,
        "GROUP_SIZE_M": 8,
        "num_stages": 3,
        "num_warps": 8,
        "ms": 0.06601164489984512,
        "min_ms": 0.06601164489984512,
        "max_ms": 0.06601164489984512,
        "compile_time": 1.6156136989593506
    },
    {
        "BLOCK_SIZE_M": 64,
        "BLOCK_SIZE_N": 128,
        "BLOCK_SIZE_K": 64,
        "GROUP_SIZE_M": 8,
        "num_stages": 4,
        "num_warps": 2,
        "ms": 0.06603852659463882,
        "min_ms": 0.06603852659463882,
        "max_ms": 0.06603852659463882,
        "compile_time": 2.546496868133545
    },
    {
        "BLOCK_SIZE_M": 128,
        "BLOCK_SIZE_N": 128,
        "BLOCK_SIZE_K": 128,
        "GROUP_SIZE_M": 8,
        "num_stages": 1,
        "num_warps": 4,
        "ms": 0.06611251085996628,
        "min_ms": 0.06611251085996628,
        "max_ms": 0.06611251085996628,
        "compile_time": 2.539893865585327
    },
    {
        "BLOCK_SIZE_M": 128,
        "BLOCK_SIZE_N": 32,
        "BLOCK_SIZE_K": 32,
        "GROUP_SIZE_M": 8,
        "num_stages": 5,
        "num_warps": 4,
        "ms": 0.06613071262836456,
        "min_ms": 0.06613071262836456,
        "max_ms": 0.06613071262836456,
        "compile_time": 1.600721836090088
    },
    {
        "BLOCK_SIZE_M": 32,
        "BLOCK_SIZE_N": 128,
        "BLOCK_SIZE_K": 128,
        "GROUP_SIZE_M": 8,
        "num_stages": 2,
        "num_warps": 4,
        "ms": 0.06613311916589737,
        "min_ms": 0.06613311916589737,
        "max_ms": 0.06613311916589737,
        "compile_time": 1.7264060974121094
    },
    {
        "BLOCK_SIZE_M": 256,
        "BLOCK_SIZE_N": 32,
        "BLOCK_SIZE_K": 128,
        "GROUP_SIZE_M": 8,
        "num_stages": 3,
        "num_warps": 8,
        "ms": 0.06613505631685257,
        "min_ms": 0.06613505631685257,
        "max_ms": 0.06613505631685257,
        "compile_time": 1.279632568359375
    },
    {
        "BLOCK_SIZE_M": 128,
        "BLOCK_SIZE_N": 32,
        "BLOCK_SIZE_K": 32,
        "GROUP_SIZE_M": 8,
        "num_stages": 6,
        "num_warps": 4,
        "ms": 0.0661437064409256,
        "min_ms": 0.0661437064409256,
        "max_ms": 0.0661437064409256,
        "compile_time": 1.582495927810669
    },
    {
        "BLOCK_SIZE_M": 128,
        "BLOCK_SIZE_N": 64,
        "BLOCK_SIZE_K": 16,
        "GROUP_SIZE_M": 8,
        "num_stages": 7,
        "num_warps": 8,
        "ms": 0.06616757810115814,
        "min_ms": 0.06616757810115814,
        "max_ms": 0.06616757810115814,
        "compile_time": 1.559539556503296
    },
    {
        "BLOCK_SIZE_M": 256,
        "BLOCK_SIZE_N": 32,
        "BLOCK_SIZE_K": 128,
        "GROUP_SIZE_M": 8,
        "num_stages": 3,
        "num_warps": 4,
        "ms": 0.06617972999811172,
        "min_ms": 0.06617972999811172,
        "max_ms": 0.06617972999811172,
        "compile_time": 1.3518686294555664
    },
    {
        "BLOCK_SIZE_M": 256,
        "BLOCK_SIZE_N": 64,
        "BLOCK_SIZE_K": 16,
        "GROUP_SIZE_M": 8,
        "num_stages": 6,
        "num_warps": 4,
        "ms": 0.06621051579713821,
        "min_ms": 0.06621051579713821,
        "max_ms": 0.06621051579713821,
        "compile_time": 2.1064813137054443
    },
    {
        "BLOCK_SIZE_M": 32,
        "BLOCK_SIZE_N": 128,
        "BLOCK_SIZE_K": 64,
        "GROUP_SIZE_M": 8,
        "num_stages": 4,
        "num_warps": 8,
        "ms": 0.06623764336109161,
        "min_ms": 0.06623764336109161,
        "max_ms": 0.06623764336109161,
        "compile_time": 1.3693711757659912
    },
    {
        "BLOCK_SIZE_M": 128,
        "BLOCK_SIZE_N": 128,
        "BLOCK_SIZE_K": 16,
        "GROUP_SIZE_M": 8,
        "num_stages": 5,
        "num_warps": 8,
        "ms": 0.06624200195074081,
        "min_ms": 0.06624200195074081,
        "max_ms": 0.06624200195074081,
        "compile_time": 1.6308660507202148
    },
    {
        "BLOCK_SIZE_M": 128,
        "BLOCK_SIZE_N": 128,
        "BLOCK_SIZE_K": 16,
        "GROUP_SIZE_M": 8,
        "num_stages": 6,
        "num_warps": 8,
        "ms": 0.06635211408138275,
        "min_ms": 0.06635211408138275,
        "max_ms": 0.06635211408138275,
        "compile_time": 1.6321561336517334
    },
    {
        "BLOCK_SIZE_M": 128,
        "BLOCK_SIZE_N": 128,
        "BLOCK_SIZE_K": 16,
        "GROUP_SIZE_M": 8,
        "num_stages": 7,
        "num_warps": 8,
        "ms": 0.06638030707836151,
        "min_ms": 0.06638030707836151,
        "max_ms": 0.06638030707836151,
        "compile_time": 1.6344528198242188
    },
    {
        "BLOCK_SIZE_M": 64,
        "BLOCK_SIZE_N": 256,
        "BLOCK_SIZE_K": 32,
        "GROUP_SIZE_M": 8,
        "num_stages": 1,
        "num_warps": 8,
        "ms": 0.06641314178705215,
        "min_ms": 0.06641314178705215,
        "max_ms": 0.06641314178705215,
        "compile_time": 1.5077123641967773
    },
    {
        "BLOCK_SIZE_M": 32,
        "BLOCK_SIZE_N": 128,
        "BLOCK_SIZE_K": 64,
        "GROUP_SIZE_M": 8,
        "num_stages": 5,
        "num_warps": 4,
        "ms": 0.06643183529376984,
        "min_ms": 0.06643183529376984,
        "max_ms": 0.06643183529376984,
        "compile_time": 1.5971994400024414
    },
    {
        "BLOCK_SIZE_M": 64,
        "BLOCK_SIZE_N": 64,
        "BLOCK_SIZE_K": 16,
        "GROUP_SIZE_M": 8,
        "num_stages": 3,
        "num_warps": 2,
        "ms": 0.06646104902029037,
        "min_ms": 0.06646104902029037,
        "max_ms": 0.06646104902029037,
        "compile_time": 1.5021800994873047
    },
    {
        "BLOCK_SIZE_M": 128,
        "BLOCK_SIZE_N": 32,
        "BLOCK_SIZE_K": 128,
        "GROUP_SIZE_M": 8,
        "num_stages": 3,
        "num_warps": 4,
        "ms": 0.06647371500730515,
        "min_ms": 0.06647371500730515,
        "max_ms": 0.06647371500730515,
        "compile_time": 2.033245086669922
    },
    {
        "BLOCK_SIZE_M": 64,
        "BLOCK_SIZE_N": 64,
        "BLOCK_SIZE_K": 16,
        "GROUP_SIZE_M": 8,
        "num_stages": 3,
        "num_warps": 4,
        "ms": 0.06648928672075272,
        "min_ms": 0.06648928672075272,
        "max_ms": 0.06648928672075272,
        "compile_time": 1.374338150024414
    },
    {
        "BLOCK_SIZE_M": 32,
        "BLOCK_SIZE_N": 128,
        "BLOCK_SIZE_K": 32,
        "GROUP_SIZE_M": 8,
        "num_stages": 7,
        "num_warps": 4,
        "ms": 0.06653927266597748,
        "min_ms": 0.06653927266597748,
        "max_ms": 0.06653927266597748,
        "compile_time": 1.464059591293335
    },
    {
        "BLOCK_SIZE_M": 64,
        "BLOCK_SIZE_N": 256,
        "BLOCK_SIZE_K": 128,
        "GROUP_SIZE_M": 8,
        "num_stages": 1,
        "num_warps": 4,
        "ms": 0.06659387052059174,
        "min_ms": 0.06659387052059174,
        "max_ms": 0.06659387052059174,
        "compile_time": 2.650975465774536
    },
    {
        "BLOCK_SIZE_M": 64,
        "BLOCK_SIZE_N": 64,
        "BLOCK_SIZE_K": 16,
        "GROUP_SIZE_M": 8,
        "num_stages": 6,
        "num_warps": 4,
        "ms": 0.06660758703947067,
        "min_ms": 0.06660758703947067,
        "max_ms": 0.06660758703947067,
        "compile_time": 1.4194564819335938
    },
    {
        "BLOCK_SIZE_M": 256,
        "BLOCK_SIZE_N": 64,
        "BLOCK_SIZE_K": 16,
        "GROUP_SIZE_M": 8,
        "num_stages": 7,
        "num_warps": 4,
        "ms": 0.06661079823970795,
        "min_ms": 0.06661079823970795,
        "max_ms": 0.06661079823970795,
        "compile_time": 2.1219940185546875
    },
    {
        "BLOCK_SIZE_M": 128,
        "BLOCK_SIZE_N": 64,
        "BLOCK_SIZE_K": 16,
        "GROUP_SIZE_M": 8,
        "num_stages": 8,
        "num_warps": 8,
        "ms": 0.06661210209131241,
        "min_ms": 0.06661210209131241,
        "max_ms": 0.06661210209131241,
        "compile_time": 1.436624526977539
    },
    {
        "BLOCK_SIZE_M": 32,
        "BLOCK_SIZE_N": 512,
        "BLOCK_SIZE_K": 16,
        "GROUP_SIZE_M": 8,
        "num_stages": 4,
        "num_warps": 4,
        "ms": 0.06668992340564728,
        "min_ms": 0.06668992340564728,
        "max_ms": 0.06668992340564728,
        "compile_time": 1.899186372756958
    },
    {
        "BLOCK_SIZE_M": 128,
        "BLOCK_SIZE_N": 128,
        "BLOCK_SIZE_K": 128,
        "GROUP_SIZE_M": 8,
        "num_stages": 2,
        "num_warps": 8,
        "ms": 0.06672527641057968,
        "min_ms": 0.06672527641057968,
        "max_ms": 0.06672527641057968,
        "compile_time": 1.9683561325073242
    },
    {
        "BLOCK_SIZE_M": 32,
        "BLOCK_SIZE_N": 128,
        "BLOCK_SIZE_K": 32,
        "GROUP_SIZE_M": 8,
        "num_stages": 7,
        "num_warps": 2,
        "ms": 0.06674878299236298,
        "min_ms": 0.06674878299236298,
        "max_ms": 0.06674878299236298,
        "compile_time": 1.727856159210205
    },
    {
        "BLOCK_SIZE_M": 64,
        "BLOCK_SIZE_N": 128,
        "BLOCK_SIZE_K": 16,
        "GROUP_SIZE_M": 8,
        "num_stages": 1,
        "num_warps": 2,
        "ms": 0.06675468385219574,
        "min_ms": 0.06675468385219574,
        "max_ms": 0.06675468385219574,
        "compile_time": 1.6230394840240479
    },
    {
        "BLOCK_SIZE_M": 64,
        "BLOCK_SIZE_N": 64,
        "BLOCK_SIZE_K": 16,
        "GROUP_SIZE_M": 8,
        "num_stages": 4,
        "num_warps": 4,
        "ms": 0.06677109003067017,
        "min_ms": 0.06677109003067017,
        "max_ms": 0.06677109003067017,
        "compile_time": 1.397630214691162
    },
    {
        "BLOCK_SIZE_M": 32,
        "BLOCK_SIZE_N": 256,
        "BLOCK_SIZE_K": 128,
        "GROUP_SIZE_M": 8,
        "num_stages": 3,
        "num_warps": 4,
        "ms": 0.06683464348316193,
        "min_ms": 0.06683464348316193,
        "max_ms": 0.06683464348316193,
        "compile_time": 2.911162853240967
    },
    {
        "BLOCK_SIZE_M": 64,
        "BLOCK_SIZE_N": 128,
        "BLOCK_SIZE_K": 32,
        "GROUP_SIZE_M": 8,
        "num_stages": 1,
        "num_warps": 2,
        "ms": 0.0668724924325943,
        "min_ms": 0.0668724924325943,
        "max_ms": 0.0668724924325943,
        "compile_time": 1.8832032680511475
    },
    {
        "BLOCK_SIZE_M": 128,
        "BLOCK_SIZE_N": 32,
        "BLOCK_SIZE_K": 32,
        "GROUP_SIZE_M": 8,
        "num_stages": 4,
        "num_warps": 4,
        "ms": 0.06687865406274796,
        "min_ms": 0.06687865406274796,
        "max_ms": 0.06687865406274796,
        "compile_time": 1.5579321384429932
    },
    {
        "BLOCK_SIZE_M": 128,
        "BLOCK_SIZE_N": 32,
        "BLOCK_SIZE_K": 64,
        "GROUP_SIZE_M": 8,
        "num_stages": 3,
        "num_warps": 2,
        "ms": 0.0669044703245163,
        "min_ms": 0.0669044703245163,
        "max_ms": 0.0669044703245163,
        "compile_time": 2.1292099952697754
    },
    {
        "BLOCK_SIZE_M": 64,
        "BLOCK_SIZE_N": 64,
        "BLOCK_SIZE_K": 64,
        "GROUP_SIZE_M": 8,
        "num_stages": 2,
        "num_warps": 8,
        "ms": 0.06706677377223969,
        "min_ms": 0.06706677377223969,
        "max_ms": 0.06706677377223969,
        "compile_time": 1.3718280792236328
    },
    {
        "BLOCK_SIZE_M": 64,
        "BLOCK_SIZE_N": 64,
        "BLOCK_SIZE_K": 32,
        "GROUP_SIZE_M": 8,
        "num_stages": 3,
        "num_warps": 8,
        "ms": 0.06707344204187393,
        "min_ms": 0.06707344204187393,
        "max_ms": 0.06707344204187393,
        "compile_time": 1.3594565391540527
    },
    {
        "BLOCK_SIZE_M": 64,
        "BLOCK_SIZE_N": 64,
        "BLOCK_SIZE_K": 16,
        "GROUP_SIZE_M": 8,
        "num_stages": 7,
        "num_warps": 4,
        "ms": 0.06712080538272858,
        "min_ms": 0.06712080538272858,
        "max_ms": 0.06712080538272858,
        "compile_time": 1.3943822383880615
    },
    {
        "BLOCK_SIZE_M": 32,
        "BLOCK_SIZE_N": 128,
        "BLOCK_SIZE_K": 128,
        "GROUP_SIZE_M": 8,
        "num_stages": 3,
        "num_warps": 4,
        "ms": 0.06712300330400467,
        "min_ms": 0.06712300330400467,
        "max_ms": 0.06712300330400467,
        "compile_time": 1.763434648513794
    },
    {
        "BLOCK_SIZE_M": 256,
        "BLOCK_SIZE_N": 64,
        "BLOCK_SIZE_K": 16,
        "GROUP_SIZE_M": 8,
        "num_stages": 8,
        "num_warps": 4,
        "ms": 0.06712499260902405,
        "min_ms": 0.06712499260902405,
        "max_ms": 0.06712499260902405,
        "compile_time": 2.2066080570220947
    },
    {
        "BLOCK_SIZE_M": 256,
        "BLOCK_SIZE_N": 32,
        "BLOCK_SIZE_K": 32,
        "GROUP_SIZE_M": 8,
        "num_stages": 4,
        "num_warps": 4,
        "ms": 0.06728410720825195,
        "min_ms": 0.06728410720825195,
        "max_ms": 0.06728410720825195,
        "compile_time": 1.5250186920166016
    },
    {
        "BLOCK_SIZE_M": 128,
        "BLOCK_SIZE_N": 32,
        "BLOCK_SIZE_K": 64,
        "GROUP_SIZE_M": 8,
        "num_stages": 5,
        "num_warps": 4,
        "ms": 0.0673113763332367,
        "min_ms": 0.0673113763332367,
        "max_ms": 0.0673113763332367,
        "compile_time": 1.7902920246124268
    },
    {
        "BLOCK_SIZE_M": 32,
        "BLOCK_SIZE_N": 256,
        "BLOCK_SIZE_K": 128,
        "GROUP_SIZE_M": 8,
        "num_stages": 3,
        "num_warps": 8,
        "ms": 0.06733138859272003,
        "min_ms": 0.06733138859272003,
        "max_ms": 0.06733138859272003,
        "compile_time": 1.8758118152618408
    },
    {
        "BLOCK_SIZE_M": 64,
        "BLOCK_SIZE_N": 128,
        "BLOCK_SIZE_K": 64,
        "GROUP_SIZE_M": 8,
        "num_stages": 7,
        "num_warps": 16,
        "ms": 0.06734198331832886,
        "min_ms": 0.06734198331832886,
        "max_ms": 0.06734198331832886,
        "compile_time": 1.4828755855560303
    },
    {
        "BLOCK_SIZE_M": 32,
        "BLOCK_SIZE_N": 128,
        "BLOCK_SIZE_K": 32,
        "GROUP_SIZE_M": 8,
        "num_stages": 8,
        "num_warps": 2,
        "ms": 0.0673527792096138,
        "min_ms": 0.0673527792096138,
        "max_ms": 0.0673527792096138,
        "compile_time": 1.7905173301696777
    },
    {
        "BLOCK_SIZE_M": 64,
        "BLOCK_SIZE_N": 256,
        "BLOCK_SIZE_K": 16,
        "GROUP_SIZE_M": 8,
        "num_stages": 3,
        "num_warps": 8,
        "ms": 0.0673578530550003,
        "min_ms": 0.0673578530550003,
        "max_ms": 0.0673578530550003,
        "compile_time": 1.524487018585205
    },
    {
        "BLOCK_SIZE_M": 64,
        "BLOCK_SIZE_N": 64,
        "BLOCK_SIZE_K": 16,
        "GROUP_SIZE_M": 8,
        "num_stages": 5,
        "num_warps": 4,
        "ms": 0.06735830008983612,
        "min_ms": 0.06735830008983612,
        "max_ms": 0.06735830008983612,
        "compile_time": 1.3957927227020264
    },
    {
        "BLOCK_SIZE_M": 256,
        "BLOCK_SIZE_N": 64,
        "BLOCK_SIZE_K": 32,
        "GROUP_SIZE_M": 8,
        "num_stages": 1,
        "num_warps": 8,
        "ms": 0.06738711893558502,
        "min_ms": 0.06738711893558502,
        "max_ms": 0.06738711893558502,
        "compile_time": 1.782198429107666
    },
    {
        "BLOCK_SIZE_M": 32,
        "BLOCK_SIZE_N": 256,
        "BLOCK_SIZE_K": 16,
        "GROUP_SIZE_M": 8,
        "num_stages": 7,
        "num_warps": 2,
        "ms": 0.06739935278892517,
        "min_ms": 0.06739935278892517,
        "max_ms": 0.06739935278892517,
        "compile_time": 1.8992483615875244
    },
    {
        "BLOCK_SIZE_M": 64,
        "BLOCK_SIZE_N": 64,
        "BLOCK_SIZE_K": 16,
        "GROUP_SIZE_M": 8,
        "num_stages": 8,
        "num_warps": 2,
        "ms": 0.06742122769355774,
        "min_ms": 0.06742122769355774,
        "max_ms": 0.06742122769355774,
        "compile_time": 1.5790612697601318
    },
    {
        "BLOCK_SIZE_M": 32,
        "BLOCK_SIZE_N": 128,
        "BLOCK_SIZE_K": 16,
        "GROUP_SIZE_M": 8,
        "num_stages": 3,
        "num_warps": 2,
        "ms": 0.06744350492954254,
        "min_ms": 0.06744350492954254,
        "max_ms": 0.06744350492954254,
        "compile_time": 1.4349141120910645
    },
    {
        "BLOCK_SIZE_M": 64,
        "BLOCK_SIZE_N": 256,
        "BLOCK_SIZE_K": 16,
        "GROUP_SIZE_M": 8,
        "num_stages": 4,
        "num_warps": 8,
        "ms": 0.06746453791856766,
        "min_ms": 0.06746453791856766,
        "max_ms": 0.06746453791856766,
        "compile_time": 1.5488362312316895
    },
    {
        "BLOCK_SIZE_M": 64,
        "BLOCK_SIZE_N": 64,
        "BLOCK_SIZE_K": 32,
        "GROUP_SIZE_M": 8,
        "num_stages": 1,
        "num_warps": 2,
        "ms": 0.06747455894947052,
        "min_ms": 0.06747455894947052,
        "max_ms": 0.06747455894947052,
        "compile_time": 1.5321457386016846
    },
    {
        "BLOCK_SIZE_M": 64,
        "BLOCK_SIZE_N": 256,
        "BLOCK_SIZE_K": 16,
        "GROUP_SIZE_M": 8,
        "num_stages": 5,
        "num_warps": 8,
        "ms": 0.06747570633888245,
        "min_ms": 0.06747570633888245,
        "max_ms": 0.06747570633888245,
        "compile_time": 1.5461483001708984
    },
    {
        "BLOCK_SIZE_M": 128,
        "BLOCK_SIZE_N": 256,
        "BLOCK_SIZE_K": 64,
        "GROUP_SIZE_M": 8,
        "num_stages": 2,
        "num_warps": 16,
        "ms": 0.06753323972225189,
        "min_ms": 0.06753323972225189,
        "max_ms": 0.06753323972225189,
        "compile_time": 1.8657925128936768
    },
    {
        "BLOCK_SIZE_M": 128,
        "BLOCK_SIZE_N": 64,
        "BLOCK_SIZE_K": 128,
        "GROUP_SIZE_M": 8,
        "num_stages": 2,
        "num_warps": 2,
        "ms": 0.067719466984272,
        "min_ms": 0.067719466984272,
        "max_ms": 0.067719466984272,
        "compile_time": 3.090028762817383
    },
    {
        "BLOCK_SIZE_M": 32,
        "BLOCK_SIZE_N": 128,
        "BLOCK_SIZE_K": 32,
        "GROUP_SIZE_M": 8,
        "num_stages": 8,
        "num_warps": 4,
        "ms": 0.06772515922784805,
        "min_ms": 0.06772515922784805,
        "max_ms": 0.06772515922784805,
        "compile_time": 1.4929871559143066
    },
    {
        "BLOCK_SIZE_M": 64,
        "BLOCK_SIZE_N": 64,
        "BLOCK_SIZE_K": 16,
        "GROUP_SIZE_M": 8,
        "num_stages": 2,
        "num_warps": 2,
        "ms": 0.06773276627063751,
        "min_ms": 0.06773276627063751,
        "max_ms": 0.06773276627063751,
        "compile_time": 1.4819815158843994
    },
    {
        "BLOCK_SIZE_M": 128,
        "BLOCK_SIZE_N": 64,
        "BLOCK_SIZE_K": 64,
        "GROUP_SIZE_M": 8,
        "num_stages": 5,
        "num_warps": 16,
        "ms": 0.06773462891578674,
        "min_ms": 0.06773462891578674,
        "max_ms": 0.06773462891578674,
        "compile_time": 1.5544219017028809
    },
    {
        "BLOCK_SIZE_M": 256,
        "BLOCK_SIZE_N": 32,
        "BLOCK_SIZE_K": 32,
        "GROUP_SIZE_M": 8,
        "num_stages": 5,
        "num_warps": 4,
        "ms": 0.06774298846721649,
        "min_ms": 0.06774298846721649,
        "max_ms": 0.06774298846721649,
        "compile_time": 1.5404653549194336
    },
    {
        "BLOCK_SIZE_M": 64,
        "BLOCK_SIZE_N": 64,
        "BLOCK_SIZE_K": 32,
        "GROUP_SIZE_M": 8,
        "num_stages": 4,
        "num_warps": 8,
        "ms": 0.06774343550205231,
        "min_ms": 0.06774343550205231,
        "max_ms": 0.06774343550205231,
        "compile_time": 1.3751380443572998
    },
    {
        "BLOCK_SIZE_M": 128,
        "BLOCK_SIZE_N": 128,
        "BLOCK_SIZE_K": 32,
        "GROUP_SIZE_M": 8,
        "num_stages": 5,
        "num_warps": 16,
        "ms": 0.06776545941829681,
        "min_ms": 0.06776545941829681,
        "max_ms": 0.06776545941829681,
        "compile_time": 1.606398105621338
    },
    {
        "BLOCK_SIZE_M": 128,
        "BLOCK_SIZE_N": 32,
        "BLOCK_SIZE_K": 32,
        "GROUP_SIZE_M": 8,
        "num_stages": 7,
        "num_warps": 2,
        "ms": 0.06777545809745789,
        "min_ms": 0.06777545809745789,
        "max_ms": 0.06777545809745789,
        "compile_time": 1.90376615524292
    },
    {
        "BLOCK_SIZE_M": 32,
        "BLOCK_SIZE_N": 128,
        "BLOCK_SIZE_K": 128,
        "GROUP_SIZE_M": 8,
        "num_stages": 3,
        "num_warps": 8,
        "ms": 0.06787441670894623,
        "min_ms": 0.06787441670894623,
        "max_ms": 0.06787441670894623,
        "compile_time": 1.5356841087341309
    },
    {
        "BLOCK_SIZE_M": 32,
        "BLOCK_SIZE_N": 128,
        "BLOCK_SIZE_K": 32,
        "GROUP_SIZE_M": 8,
        "num_stages": 2,
        "num_warps": 2,
        "ms": 0.06789097934961319,
        "min_ms": 0.06789097934961319,
        "max_ms": 0.06789097934961319,
        "compile_time": 1.5544004440307617
    },
    {
        "BLOCK_SIZE_M": 64,
        "BLOCK_SIZE_N": 64,
        "BLOCK_SIZE_K": 32,
        "GROUP_SIZE_M": 8,
        "num_stages": 6,
        "num_warps": 8,
        "ms": 0.0679171085357666,
        "min_ms": 0.0679171085357666,
        "max_ms": 0.0679171085357666,
        "compile_time": 1.4038925170898438
    },
    {
        "BLOCK_SIZE_M": 64,
        "BLOCK_SIZE_N": 64,
        "BLOCK_SIZE_K": 128,
        "GROUP_SIZE_M": 8,
        "num_stages": 1,
        "num_warps": 4,
        "ms": 0.06792039424180984,
        "min_ms": 0.06792039424180984,
        "max_ms": 0.06792039424180984,
        "compile_time": 1.6132440567016602
    },
    {
        "BLOCK_SIZE_M": 64,
        "BLOCK_SIZE_N": 128,
        "BLOCK_SIZE_K": 32,
        "GROUP_SIZE_M": 8,
        "num_stages": 2,
        "num_warps": 8,
        "ms": 0.06798619031906128,
        "min_ms": 0.06798619031906128,
        "max_ms": 0.06798619031906128,
        "compile_time": 1.4640846252441406
    },
    {
        "BLOCK_SIZE_M": 128,
        "BLOCK_SIZE_N": 32,
        "BLOCK_SIZE_K": 128,
        "GROUP_SIZE_M": 8,
        "num_stages": 2,
        "num_warps": 4,
        "ms": 0.06798888742923737,
        "min_ms": 0.06798888742923737,
        "max_ms": 0.06798888742923737,
        "compile_time": 1.9175457954406738
    },
    {
        "BLOCK_SIZE_M": 64,
        "BLOCK_SIZE_N": 64,
        "BLOCK_SIZE_K": 128,
        "GROUP_SIZE_M": 8,
        "num_stages": 2,
        "num_warps": 8,
        "ms": 0.0680471882224083,
        "min_ms": 0.0680471882224083,
        "max_ms": 0.0680471882224083,
        "compile_time": 1.5250890254974365
    },
    {
        "BLOCK_SIZE_M": 128,
        "BLOCK_SIZE_N": 128,
        "BLOCK_SIZE_K": 32,
        "GROUP_SIZE_M": 8,
        "num_stages": 3,
        "num_warps": 16,
        "ms": 0.0681048333644867,
        "min_ms": 0.0681048333644867,
        "max_ms": 0.0681048333644867,
        "compile_time": 1.5220046043395996
    },
    {
        "BLOCK_SIZE_M": 64,
        "BLOCK_SIZE_N": 128,
        "BLOCK_SIZE_K": 16,
        "GROUP_SIZE_M": 8,
        "num_stages": 1,
        "num_warps": 8,
        "ms": 0.06814347207546234,
        "min_ms": 0.06814347207546234,
        "max_ms": 0.06814347207546234,
        "compile_time": 1.3898546695709229
    },
    {
        "BLOCK_SIZE_M": 64,
        "BLOCK_SIZE_N": 256,
        "BLOCK_SIZE_K": 16,
        "GROUP_SIZE_M": 8,
        "num_stages": 6,
        "num_warps": 8,
        "ms": 0.06815014779567719,
        "min_ms": 0.06815014779567719,
        "max_ms": 0.06815014779567719,
        "compile_time": 1.552236557006836
    },
    {
        "BLOCK_SIZE_M": 64,
        "BLOCK_SIZE_N": 256,
        "BLOCK_SIZE_K": 16,
        "GROUP_SIZE_M": 8,
        "num_stages": 7,
        "num_warps": 8,
        "ms": 0.06823892146348953,
        "min_ms": 0.06823892146348953,
        "max_ms": 0.06823892146348953,
        "compile_time": 1.5918147563934326
    },
    {
        "BLOCK_SIZE_M": 64,
        "BLOCK_SIZE_N": 64,
        "BLOCK_SIZE_K": 32,
        "GROUP_SIZE_M": 8,
        "num_stages": 5,
        "num_warps": 8,
        "ms": 0.06824798882007599,
        "min_ms": 0.06824798882007599,
        "max_ms": 0.06824798882007599,
        "compile_time": 1.39329195022583
    },
    {
        "BLOCK_SIZE_M": 64,
        "BLOCK_SIZE_N": 512,
        "BLOCK_SIZE_K": 32,
        "GROUP_SIZE_M": 8,
        "num_stages": 3,
        "num_warps": 16,
        "ms": 0.06828088313341141,
        "min_ms": 0.06828088313341141,
        "max_ms": 0.06828088313341141,
        "compile_time": 1.635890007019043
    },
    {
        "BLOCK_SIZE_M": 128,
        "BLOCK_SIZE_N": 32,
        "BLOCK_SIZE_K": 64,
        "GROUP_SIZE_M": 8,
        "num_stages": 3,
        "num_warps": 8,
        "ms": 0.06829015165567398,
        "min_ms": 0.06829015165567398,
        "max_ms": 0.06829015165567398,
        "compile_time": 1.540771484375
    },
    {
        "BLOCK_SIZE_M": 128,
        "BLOCK_SIZE_N": 128,
        "BLOCK_SIZE_K": 64,
        "GROUP_SIZE_M": 8,
        "num_stages": 2,
        "num_warps": 8,
        "ms": 0.06837804615497589,
        "min_ms": 0.06837804615497589,
        "max_ms": 0.06837804615497589,
        "compile_time": 1.872307300567627
    },
    {
        "BLOCK_SIZE_M": 32,
        "BLOCK_SIZE_N": 128,
        "BLOCK_SIZE_K": 16,
        "GROUP_SIZE_M": 8,
        "num_stages": 4,
        "num_warps": 4,
        "ms": 0.06837829202413559,
        "min_ms": 0.06837829202413559,
        "max_ms": 0.06837829202413559,
        "compile_time": 1.3388628959655762
    },
    {
        "BLOCK_SIZE_M": 32,
        "BLOCK_SIZE_N": 128,
        "BLOCK_SIZE_K": 64,
        "GROUP_SIZE_M": 8,
        "num_stages": 5,
        "num_warps": 8,
        "ms": 0.06838293373584747,
        "min_ms": 0.06838293373584747,
        "max_ms": 0.06838293373584747,
        "compile_time": 1.4069933891296387
    },
    {
        "BLOCK_SIZE_M": 64,
        "BLOCK_SIZE_N": 256,
        "BLOCK_SIZE_K": 16,
        "GROUP_SIZE_M": 8,
        "num_stages": 2,
        "num_warps": 4,
        "ms": 0.0684114322066307,
        "min_ms": 0.0684114322066307,
        "max_ms": 0.0684114322066307,
        "compile_time": 1.7899565696716309
    },
    {
        "BLOCK_SIZE_M": 32,
        "BLOCK_SIZE_N": 512,
        "BLOCK_SIZE_K": 16,
        "GROUP_SIZE_M": 8,
        "num_stages": 3,
        "num_warps": 4,
        "ms": 0.06844855844974518,
        "min_ms": 0.06844855844974518,
        "max_ms": 0.06844855844974518,
        "compile_time": 1.8545424938201904
    },
    {
        "BLOCK_SIZE_M": 64,
        "BLOCK_SIZE_N": 512,
        "BLOCK_SIZE_K": 32,
        "GROUP_SIZE_M": 8,
        "num_stages": 4,
        "num_warps": 16,
        "ms": 0.0684487372636795,
        "min_ms": 0.0684487372636795,
        "max_ms": 0.0684487372636795,
        "compile_time": 1.6564826965332031
    },
    {
        "BLOCK_SIZE_M": 128,
        "BLOCK_SIZE_N": 128,
        "BLOCK_SIZE_K": 32,
        "GROUP_SIZE_M": 8,
        "num_stages": 6,
        "num_warps": 16,
        "ms": 0.06845779716968536,
        "min_ms": 0.06845779716968536,
        "max_ms": 0.06845779716968536,
        "compile_time": 1.5514495372772217
    },
    {
        "BLOCK_SIZE_M": 128,
        "BLOCK_SIZE_N": 32,
        "BLOCK_SIZE_K": 64,
        "GROUP_SIZE_M": 8,
        "num_stages": 4,
        "num_warps": 8,
        "ms": 0.06847014278173447,
        "min_ms": 0.06847014278173447,
        "max_ms": 0.06847014278173447,
        "compile_time": 1.5828440189361572
    },
    {
        "BLOCK_SIZE_M": 128,
        "BLOCK_SIZE_N": 128,
        "BLOCK_SIZE_K": 64,
        "GROUP_SIZE_M": 8,
        "num_stages": 1,
        "num_warps": 4,
        "ms": 0.06849729269742966,
        "min_ms": 0.06849729269742966,
        "max_ms": 0.06849729269742966,
        "compile_time": 2.2614190578460693
    },
    {
        "BLOCK_SIZE_M": 32,
        "BLOCK_SIZE_N": 512,
        "BLOCK_SIZE_K": 16,
        "GROUP_SIZE_M": 8,
        "num_stages": 5,
        "num_warps": 4,
        "ms": 0.06851264089345932,
        "min_ms": 0.06851264089345932,
        "max_ms": 0.06851264089345932,
        "compile_time": 1.954850196838379
    },
    {
        "BLOCK_SIZE_M": 64,
        "BLOCK_SIZE_N": 256,
        "BLOCK_SIZE_K": 16,
        "GROUP_SIZE_M": 8,
        "num_stages": 8,
        "num_warps": 8,
        "ms": 0.0685558021068573,
        "min_ms": 0.0685558021068573,
        "max_ms": 0.0685558021068573,
        "compile_time": 1.4563605785369873
    },
    {
        "BLOCK_SIZE_M": 128,
        "BLOCK_SIZE_N": 64,
        "BLOCK_SIZE_K": 32,
        "GROUP_SIZE_M": 8,
        "num_stages": 2,
        "num_warps": 8,
        "ms": 0.06862090528011322,
        "min_ms": 0.06862090528011322,
        "max_ms": 0.06862090528011322,
        "compile_time": 1.5167710781097412
    },
    {
        "BLOCK_SIZE_M": 128,
        "BLOCK_SIZE_N": 32,
        "BLOCK_SIZE_K": 64,
        "GROUP_SIZE_M": 8,
        "num_stages": 6,
        "num_warps": 4,
        "ms": 0.06867934763431549,
        "min_ms": 0.06867934763431549,
        "max_ms": 0.06867934763431549,
        "compile_time": 1.8450253009796143
    },
    {
        "BLOCK_SIZE_M": 32,
        "BLOCK_SIZE_N": 256,
        "BLOCK_SIZE_K": 16,
        "GROUP_SIZE_M": 8,
        "num_stages": 8,
        "num_warps": 2,
        "ms": 0.0687025934457779,
        "min_ms": 0.0687025934457779,
        "max_ms": 0.0687025934457779,
        "compile_time": 1.8852615356445312
    },
    {
        "BLOCK_SIZE_M": 128,
        "BLOCK_SIZE_N": 32,
        "BLOCK_SIZE_K": 32,
        "GROUP_SIZE_M": 8,
        "num_stages": 8,
        "num_warps": 2,
        "ms": 0.06871848553419113,
        "min_ms": 0.06871848553419113,
        "max_ms": 0.06871848553419113,
        "compile_time": 1.9645390510559082
    },
    {
        "BLOCK_SIZE_M": 64,
        "BLOCK_SIZE_N": 512,
        "BLOCK_SIZE_K": 32,
        "GROUP_SIZE_M": 8,
        "num_stages": 5,
        "num_warps": 16,
        "ms": 0.0687493160367012,
        "min_ms": 0.0687493160367012,
        "max_ms": 0.0687493160367012,
        "compile_time": 1.6820950508117676
    },
    {
        "BLOCK_SIZE_M": 64,
        "BLOCK_SIZE_N": 64,
        "BLOCK_SIZE_K": 32,
        "GROUP_SIZE_M": 8,
        "num_stages": 7,
        "num_warps": 8,
        "ms": 0.06879618763923645,
        "min_ms": 0.06879618763923645,
        "max_ms": 0.06879618763923645,
        "compile_time": 1.4032039642333984
    },
    {
        "BLOCK_SIZE_M": 256,
        "BLOCK_SIZE_N": 32,
        "BLOCK_SIZE_K": 32,
        "GROUP_SIZE_M": 8,
        "num_stages": 6,
        "num_warps": 8,
        "ms": 0.06882665306329727,
        "min_ms": 0.06882665306329727,
        "max_ms": 0.06882665306329727,
        "compile_time": 1.7096242904663086
    },
    {
        "BLOCK_SIZE_M": 64,
        "BLOCK_SIZE_N": 512,
        "BLOCK_SIZE_K": 16,
        "GROUP_SIZE_M": 8,
        "num_stages": 4,
        "num_warps": 16,
        "ms": 0.06882728636264801,
        "min_ms": 0.06882728636264801,
        "max_ms": 0.06882728636264801,
        "compile_time": 1.4367046356201172
    },
    {
        "BLOCK_SIZE_M": 128,
        "BLOCK_SIZE_N": 32,
        "BLOCK_SIZE_K": 32,
        "GROUP_SIZE_M": 8,
        "num_stages": 3,
        "num_warps": 4,
        "ms": 0.06884513795375824,
        "min_ms": 0.06884513795375824,
        "max_ms": 0.06884513795375824,
        "compile_time": 1.5426676273345947
    },
    {
        "BLOCK_SIZE_M": 32,
        "BLOCK_SIZE_N": 128,
        "BLOCK_SIZE_K": 16,
        "GROUP_SIZE_M": 8,
        "num_stages": 6,
        "num_warps": 2,
        "ms": 0.06886060535907745,
        "min_ms": 0.06886060535907745,
        "max_ms": 0.06886060535907745,
        "compile_time": 1.5143342018127441
    },
    {
        "BLOCK_SIZE_M": 32,
        "BLOCK_SIZE_N": 128,
        "BLOCK_SIZE_K": 16,
        "GROUP_SIZE_M": 8,
        "num_stages": 4,
        "num_warps": 2,
        "ms": 0.06889116764068604,
        "min_ms": 0.06889116764068604,
        "max_ms": 0.06889116764068604,
        "compile_time": 1.47184419631958
    },
    {
        "BLOCK_SIZE_M": 32,
        "BLOCK_SIZE_N": 128,
        "BLOCK_SIZE_K": 16,
        "GROUP_SIZE_M": 8,
        "num_stages": 3,
        "num_warps": 4,
        "ms": 0.06891326606273651,
        "min_ms": 0.06891326606273651,
        "max_ms": 0.06891326606273651,
        "compile_time": 1.2254765033721924
    },
    {
        "BLOCK_SIZE_M": 128,
        "BLOCK_SIZE_N": 64,
        "BLOCK_SIZE_K": 64,
        "GROUP_SIZE_M": 8,
        "num_stages": 6,
        "num_warps": 16,
        "ms": 0.06898211687803268,
        "min_ms": 0.06898211687803268,
        "max_ms": 0.06898211687803268,
        "compile_time": 1.558375597000122
    },
    {
        "BLOCK_SIZE_M": 64,
        "BLOCK_SIZE_N": 512,
        "BLOCK_SIZE_K": 16,
        "GROUP_SIZE_M": 8,
        "num_stages": 7,
        "num_warps": 16,
        "ms": 0.06902658194303513,
        "min_ms": 0.06902658194303513,
        "max_ms": 0.06902658194303513,
        "compile_time": 1.6110620498657227
    },
    {
        "BLOCK_SIZE_M": 256,
        "BLOCK_SIZE_N": 128,
        "BLOCK_SIZE_K": 128,
        "GROUP_SIZE_M": 8,
        "num_stages": 1,
        "num_warps": 8,
        "ms": 0.0690535306930542,
        "min_ms": 0.0690535306930542,
        "max_ms": 0.0690535306930542,
        "compile_time": 1.5377414226531982
    },
    {
        "BLOCK_SIZE_M": 128,
        "BLOCK_SIZE_N": 128,
        "BLOCK_SIZE_K": 32,
        "GROUP_SIZE_M": 8,
        "num_stages": 4,
        "num_warps": 16,
        "ms": 0.06905689090490341,
        "min_ms": 0.06905689090490341,
        "max_ms": 0.06905689090490341,
        "compile_time": 1.5494515895843506
    },
    {
        "BLOCK_SIZE_M": 256,
        "BLOCK_SIZE_N": 128,
        "BLOCK_SIZE_K": 16,
        "GROUP_SIZE_M": 8,
        "num_stages": 3,
        "num_warps": 8,
        "ms": 0.06905809789896011,
        "min_ms": 0.06905809789896011,
        "max_ms": 0.06905809789896011,
        "compile_time": 2.049426317214966
    },
    {
        "BLOCK_SIZE_M": 128,
        "BLOCK_SIZE_N": 128,
        "BLOCK_SIZE_K": 32,
        "GROUP_SIZE_M": 8,
        "num_stages": 7,
        "num_warps": 16,
        "ms": 0.06916016340255737,
        "min_ms": 0.06916016340255737,
        "max_ms": 0.06916016340255737,
        "compile_time": 1.558959722518921
    },
    {
        "BLOCK_SIZE_M": 512,
        "BLOCK_SIZE_N": 32,
        "BLOCK_SIZE_K": 32,
        "GROUP_SIZE_M": 8,
        "num_stages": 3,
        "num_warps": 4,
        "ms": 0.06923166662454605,
        "min_ms": 0.06923166662454605,
        "max_ms": 0.06923166662454605,
        "compile_time": 2.713400363922119
    },
    {
        "BLOCK_SIZE_M": 256,
        "BLOCK_SIZE_N": 128,
        "BLOCK_SIZE_K": 16,
        "GROUP_SIZE_M": 8,
        "num_stages": 4,
        "num_warps": 8,
        "ms": 0.06928716599941254,
        "min_ms": 0.06928716599941254,
        "max_ms": 0.06928716599941254,
        "compile_time": 2.0471715927124023
    },
    {
        "BLOCK_SIZE_M": 64,
        "BLOCK_SIZE_N": 64,
        "BLOCK_SIZE_K": 64,
        "GROUP_SIZE_M": 8,
        "num_stages": 2,
        "num_warps": 2,
        "ms": 0.06929905712604523,
        "min_ms": 0.06929905712604523,
        "max_ms": 0.06929905712604523,
        "compile_time": 1.7434971332550049
    },
    {
        "BLOCK_SIZE_M": 64,
        "BLOCK_SIZE_N": 256,
        "BLOCK_SIZE_K": 128,
        "GROUP_SIZE_M": 8,
        "num_stages": 2,
        "num_warps": 4,
        "ms": 0.06930491328239441,
        "min_ms": 0.06930491328239441,
        "max_ms": 0.06930491328239441,
        "compile_time": 2.9012091159820557
    },
    {
        "BLOCK_SIZE_M": 512,
        "BLOCK_SIZE_N": 64,
        "BLOCK_SIZE_K": 64,
        "GROUP_SIZE_M": 8,
        "num_stages": 3,
        "num_warps": 16,
        "ms": 0.06937433779239655,
        "min_ms": 0.06937433779239655,
        "max_ms": 0.06937433779239655,
        "compile_time": 2.332754373550415
    },
    {
        "BLOCK_SIZE_M": 64,
        "BLOCK_SIZE_N": 512,
        "BLOCK_SIZE_K": 16,
        "GROUP_SIZE_M": 8,
        "num_stages": 5,
        "num_warps": 16,
        "ms": 0.06939081847667694,
        "min_ms": 0.06939081847667694,
        "max_ms": 0.06939081847667694,
        "compile_time": 1.5728533267974854
    },
    {
        "BLOCK_SIZE_M": 32,
        "BLOCK_SIZE_N": 128,
        "BLOCK_SIZE_K": 256,
        "GROUP_SIZE_M": 8,
        "num_stages": 2,
        "num_warps": 4,
        "ms": 0.06943438947200775,
        "min_ms": 0.06943438947200775,
        "max_ms": 0.06943438947200775,
        "compile_time": 2.4003279209136963
    },
    {
        "BLOCK_SIZE_M": 64,
        "BLOCK_SIZE_N": 64,
        "BLOCK_SIZE_K": 128,
        "GROUP_SIZE_M": 8,
        "num_stages": 4,
        "num_warps": 8,
        "ms": 0.06943617761135101,
        "min_ms": 0.06943617761135101,
        "max_ms": 0.06943617761135101,
        "compile_time": 1.6110687255859375
    },
    {
        "BLOCK_SIZE_M": 256,
        "BLOCK_SIZE_N": 32,
        "BLOCK_SIZE_K": 32,
        "GROUP_SIZE_M": 8,
        "num_stages": 7,
        "num_warps": 8,
        "ms": 0.06944788247346878,
        "min_ms": 0.06944788247346878,
        "max_ms": 0.06944788247346878,
        "compile_time": 1.706425428390503
    },
    {
        "BLOCK_SIZE_M": 64,
        "BLOCK_SIZE_N": 512,
        "BLOCK_SIZE_K": 16,
        "GROUP_SIZE_M": 8,
        "num_stages": 6,
        "num_warps": 16,
        "ms": 0.06945877522230148,
        "min_ms": 0.06945877522230148,
        "max_ms": 0.06945877522230148,
        "compile_time": 1.5897064208984375
    },
    {
        "BLOCK_SIZE_M": 128,
        "BLOCK_SIZE_N": 256,
        "BLOCK_SIZE_K": 64,
        "GROUP_SIZE_M": 8,
        "num_stages": 1,
        "num_warps": 8,
        "ms": 0.06948405504226685,
        "min_ms": 0.06948405504226685,
        "max_ms": 0.06948405504226685,
        "compile_time": 2.097177743911743
    },
    {
        "BLOCK_SIZE_M": 64,
        "BLOCK_SIZE_N": 512,
        "BLOCK_SIZE_K": 16,
        "GROUP_SIZE_M": 8,
        "num_stages": 8,
        "num_warps": 16,
        "ms": 0.06949017941951752,
        "min_ms": 0.06949017941951752,
        "max_ms": 0.06949017941951752,
        "compile_time": 1.6089942455291748
    },
    {
        "BLOCK_SIZE_M": 256,
        "BLOCK_SIZE_N": 128,
        "BLOCK_SIZE_K": 16,
        "GROUP_SIZE_M": 8,
        "num_stages": 5,
        "num_warps": 8,
        "ms": 0.06954900175333023,
        "min_ms": 0.06954900175333023,
        "max_ms": 0.06954900175333023,
        "compile_time": 2.0357003211975098
    },
    {
        "BLOCK_SIZE_M": 64,
        "BLOCK_SIZE_N": 64,
        "BLOCK_SIZE_K": 32,
        "GROUP_SIZE_M": 8,
        "num_stages": 1,
        "num_warps": 4,
        "ms": 0.06957042217254639,
        "min_ms": 0.06957042217254639,
        "max_ms": 0.06957042217254639,
        "compile_time": 1.279953956604004
    },
    {
        "BLOCK_SIZE_M": 128,
        "BLOCK_SIZE_N": 32,
        "BLOCK_SIZE_K": 32,
        "GROUP_SIZE_M": 8,
        "num_stages": 4,
        "num_warps": 2,
        "ms": 0.0696873739361763,
        "min_ms": 0.0696873739361763,
        "max_ms": 0.0696873739361763,
        "compile_time": 1.7958452701568604
    },
    {
        "BLOCK_SIZE_M": 128,
        "BLOCK_SIZE_N": 128,
        "BLOCK_SIZE_K": 32,
        "GROUP_SIZE_M": 8,
        "num_stages": 8,
        "num_warps": 16,
        "ms": 0.06974731385707855,
        "min_ms": 0.06974731385707855,
        "max_ms": 0.06974731385707855,
        "compile_time": 1.6496729850769043
    },
    {
        "BLOCK_SIZE_M": 32,
        "BLOCK_SIZE_N": 128,
        "BLOCK_SIZE_K": 64,
        "GROUP_SIZE_M": 8,
        "num_stages": 6,
        "num_warps": 4,
        "ms": 0.06983382254838943,
        "min_ms": 0.06983382254838943,
        "max_ms": 0.06983382254838943,
        "compile_time": 1.6651906967163086
    },
    {
        "BLOCK_SIZE_M": 32,
        "BLOCK_SIZE_N": 512,
        "BLOCK_SIZE_K": 16,
        "GROUP_SIZE_M": 8,
        "num_stages": 4,
        "num_warps": 8,
        "ms": 0.06989844143390656,
        "min_ms": 0.06989844143390656,
        "max_ms": 0.06989844143390656,
        "compile_time": 1.5138659477233887
    },
    {
        "BLOCK_SIZE_M": 256,
        "BLOCK_SIZE_N": 128,
        "BLOCK_SIZE_K": 64,
        "GROUP_SIZE_M": 8,
        "num_stages": 1,
        "num_warps": 8,
        "ms": 0.06989957392215729,
        "min_ms": 0.06989957392215729,
        "max_ms": 0.06989957392215729,
        "compile_time": 2.9288251399993896
    },
    {
        "BLOCK_SIZE_M": 64,
        "BLOCK_SIZE_N": 512,
        "BLOCK_SIZE_K": 16,
        "GROUP_SIZE_M": 8,
        "num_stages": 3,
        "num_warps": 16,
        "ms": 0.06993794441223145,
        "min_ms": 0.06993794441223145,
        "max_ms": 0.06993794441223145,
        "compile_time": 1.5662384033203125
    },
    {
        "BLOCK_SIZE_M": 32,
        "BLOCK_SIZE_N": 128,
        "BLOCK_SIZE_K": 64,
        "GROUP_SIZE_M": 8,
        "num_stages": 7,
        "num_warps": 4,
        "ms": 0.07002296298742294,
        "min_ms": 0.07002296298742294,
        "max_ms": 0.07002296298742294,
        "compile_time": 1.6977367401123047
    },
    {
        "BLOCK_SIZE_M": 128,
        "BLOCK_SIZE_N": 128,
        "BLOCK_SIZE_K": 16,
        "GROUP_SIZE_M": 8,
        "num_stages": 2,
        "num_warps": 4,
        "ms": 0.0700448602437973,
        "min_ms": 0.0700448602437973,
        "max_ms": 0.0700448602437973,
        "compile_time": 1.9692964553833008
    },
    {
        "BLOCK_SIZE_M": 32,
        "BLOCK_SIZE_N": 256,
        "BLOCK_SIZE_K": 32,
        "GROUP_SIZE_M": 8,
        "num_stages": 5,
        "num_warps": 4,
        "ms": 0.07010389864444733,
        "min_ms": 0.07010389864444733,
        "max_ms": 0.07010389864444733,
        "compile_time": 1.7017860412597656
    },
    {
        "BLOCK_SIZE_M": 64,
        "BLOCK_SIZE_N": 64,
        "BLOCK_SIZE_K": 16,
        "GROUP_SIZE_M": 8,
        "num_stages": 4,
        "num_warps": 2,
        "ms": 0.07010763883590698,
        "min_ms": 0.07010763883590698,
        "max_ms": 0.07010763883590698,
        "compile_time": 1.491642713546753
    },
    {
        "BLOCK_SIZE_M": 32,
        "BLOCK_SIZE_N": 256,
        "BLOCK_SIZE_K": 128,
        "GROUP_SIZE_M": 8,
        "num_stages": 3,
        "num_warps": 16,
        "ms": 0.0701223760843277,
        "min_ms": 0.0701223760843277,
        "max_ms": 0.0701223760843277,
        "compile_time": 1.5582191944122314
    },
    {
        "BLOCK_SIZE_M": 256,
        "BLOCK_SIZE_N": 128,
        "BLOCK_SIZE_K": 64,
        "GROUP_SIZE_M": 8,
        "num_stages": 1,
        "num_warps": 32,
        "ms": 0.07012385129928589,
        "min_ms": 0.07012385129928589,
        "max_ms": 0.07012385129928589,
        "compile_time": 1.588855504989624
    },
    {
        "BLOCK_SIZE_M": 128,
        "BLOCK_SIZE_N": 32,
        "BLOCK_SIZE_K": 64,
        "GROUP_SIZE_M": 8,
        "num_stages": 7,
        "num_warps": 4,
        "ms": 0.07024224102497101,
        "min_ms": 0.07024224102497101,
        "max_ms": 0.07024224102497101,
        "compile_time": 1.8897836208343506
    },
    {
        "BLOCK_SIZE_M": 32,
        "BLOCK_SIZE_N": 128,
        "BLOCK_SIZE_K": 16,
        "GROUP_SIZE_M": 8,
        "num_stages": 5,
        "num_warps": 2,
        "ms": 0.07030551135540009,
        "min_ms": 0.07030551135540009,
        "max_ms": 0.07030551135540009,
        "compile_time": 1.4656507968902588
    },
    {
        "BLOCK_SIZE_M": 32,
        "BLOCK_SIZE_N": 64,
        "BLOCK_SIZE_K": 64,
        "GROUP_SIZE_M": 8,
        "num_stages": 4,
        "num_warps": 4,
        "ms": 0.0703640729188919,
        "min_ms": 0.0703640729188919,
        "max_ms": 0.0703640729188919,
        "compile_time": 1.3938970565795898
    },
    {
        "BLOCK_SIZE_M": 32,
        "BLOCK_SIZE_N": 64,
        "BLOCK_SIZE_K": 64,
        "GROUP_SIZE_M": 8,
        "num_stages": 3,
        "num_warps": 4,
        "ms": 0.07036922872066498,
        "min_ms": 0.07036922872066498,
        "max_ms": 0.07036922872066498,
        "compile_time": 1.367912769317627
    },
    {
        "BLOCK_SIZE_M": 64,
        "BLOCK_SIZE_N": 64,
        "BLOCK_SIZE_K": 64,
        "GROUP_SIZE_M": 8,
        "num_stages": 7,
        "num_warps": 8,
        "ms": 0.07039735466241837,
        "min_ms": 0.07039735466241837,
        "max_ms": 0.07039735466241837,
        "compile_time": 1.4662024974822998
    },
    {
        "BLOCK_SIZE_M": 32,
        "BLOCK_SIZE_N": 256,
        "BLOCK_SIZE_K": 16,
        "GROUP_SIZE_M": 8,
        "num_stages": 7,
        "num_warps": 8,
        "ms": 0.07043986767530441,
        "min_ms": 0.07043986767530441,
        "max_ms": 0.07043986767530441,
        "compile_time": 1.407766580581665
    },
    {
        "BLOCK_SIZE_M": 64,
        "BLOCK_SIZE_N": 64,
        "BLOCK_SIZE_K": 256,
        "GROUP_SIZE_M": 8,
        "num_stages": 2,
        "num_warps": 8,
        "ms": 0.07047087699174881,
        "min_ms": 0.07047087699174881,
        "max_ms": 0.07047087699174881,
        "compile_time": 1.749830722808838
    },
    {
        "BLOCK_SIZE_M": 64,
        "BLOCK_SIZE_N": 64,
        "BLOCK_SIZE_K": 16,
        "GROUP_SIZE_M": 8,
        "num_stages": 6,
        "num_warps": 2,
        "ms": 0.07048646360635757,
        "min_ms": 0.07048646360635757,
        "max_ms": 0.07048646360635757,
        "compile_time": 1.571052074432373
    },
    {
        "BLOCK_SIZE_M": 128,
        "BLOCK_SIZE_N": 32,
        "BLOCK_SIZE_K": 128,
        "GROUP_SIZE_M": 8,
        "num_stages": 4,
        "num_warps": 4,
        "ms": 0.07059938460588455,
        "min_ms": 0.07059938460588455,
        "max_ms": 0.07059938460588455,
        "compile_time": 2.1165337562561035
    },
    {
        "BLOCK_SIZE_M": 256,
        "BLOCK_SIZE_N": 32,
        "BLOCK_SIZE_K": 32,
        "GROUP_SIZE_M": 8,
        "num_stages": 8,
        "num_warps": 8,
        "ms": 0.07060907036066055,
        "min_ms": 0.07060907036066055,
        "max_ms": 0.07060907036066055,
        "compile_time": 1.5725493431091309
    },
    {
        "BLOCK_SIZE_M": 32,
        "BLOCK_SIZE_N": 256,
        "BLOCK_SIZE_K": 64,
        "GROUP_SIZE_M": 8,
        "num_stages": 3,
        "num_warps": 4,
        "ms": 0.07063490152359009,
        "min_ms": 0.07063490152359009,
        "max_ms": 0.07063490152359009,
        "compile_time": 1.8806781768798828
    },
    {
        "BLOCK_SIZE_M": 32,
        "BLOCK_SIZE_N": 256,
        "BLOCK_SIZE_K": 32,
        "GROUP_SIZE_M": 8,
        "num_stages": 2,
        "num_warps": 2,
        "ms": 0.07064424455165863,
        "min_ms": 0.07064424455165863,
        "max_ms": 0.07064424455165863,
        "compile_time": 2.0714476108551025
    },
    {
        "BLOCK_SIZE_M": 128,
        "BLOCK_SIZE_N": 128,
        "BLOCK_SIZE_K": 128,
        "GROUP_SIZE_M": 8,
        "num_stages": 2,
        "num_warps": 16,
        "ms": 0.07068046182394028,
        "min_ms": 0.07068046182394028,
        "max_ms": 0.07068046182394028,
        "compile_time": 1.74314546585083
    },
    {
        "BLOCK_SIZE_M": 128,
        "BLOCK_SIZE_N": 32,
        "BLOCK_SIZE_K": 64,
        "GROUP_SIZE_M": 8,
        "num_stages": 5,
        "num_warps": 8,
        "ms": 0.0707152709364891,
        "min_ms": 0.0707152709364891,
        "max_ms": 0.0707152709364891,
        "compile_time": 1.597104549407959
    },
    {
        "BLOCK_SIZE_M": 64,
        "BLOCK_SIZE_N": 64,
        "BLOCK_SIZE_K": 16,
        "GROUP_SIZE_M": 8,
        "num_stages": 5,
        "num_warps": 2,
        "ms": 0.07076839357614517,
        "min_ms": 0.07076839357614517,
        "max_ms": 0.07076839357614517,
        "compile_time": 1.5298233032226562
    },
    {
        "BLOCK_SIZE_M": 128,
        "BLOCK_SIZE_N": 64,
        "BLOCK_SIZE_K": 64,
        "GROUP_SIZE_M": 8,
        "num_stages": 7,
        "num_warps": 16,
        "ms": 0.07078037410974503,
        "min_ms": 0.07078037410974503,
        "max_ms": 0.07078037410974503,
        "compile_time": 1.573364019393921
    },
    {
        "BLOCK_SIZE_M": 128,
        "BLOCK_SIZE_N": 32,
        "BLOCK_SIZE_K": 32,
        "GROUP_SIZE_M": 8,
        "num_stages": 7,
        "num_warps": 4,
        "ms": 0.07079306244850159,
        "min_ms": 0.07079306244850159,
        "max_ms": 0.07079306244850159,
        "compile_time": 1.6413073539733887
    },
    {
        "BLOCK_SIZE_M": 64,
        "BLOCK_SIZE_N": 64,
        "BLOCK_SIZE_K": 128,
        "GROUP_SIZE_M": 8,
        "num_stages": 5,
        "num_warps": 8,
        "ms": 0.07083402574062347,
        "min_ms": 0.07083402574062347,
        "max_ms": 0.07083402574062347,
        "compile_time": 1.6256556510925293
    },
    {
        "BLOCK_SIZE_M": 128,
        "BLOCK_SIZE_N": 32,
        "BLOCK_SIZE_K": 128,
        "GROUP_SIZE_M": 8,
        "num_stages": 3,
        "num_warps": 8,
        "ms": 0.07084181159734726,
        "min_ms": 0.07084181159734726,
        "max_ms": 0.07084181159734726,
        "compile_time": 1.709846019744873
    },
    {
        "BLOCK_SIZE_M": 128,
        "BLOCK_SIZE_N": 256,
        "BLOCK_SIZE_K": 16,
        "GROUP_SIZE_M": 8,
        "num_stages": 3,
        "num_warps": 16,
        "ms": 0.070881187915802,
        "min_ms": 0.070881187915802,
        "max_ms": 0.070881187915802,
        "compile_time": 1.0118279457092285
    },
    {
        "BLOCK_SIZE_M": 32,
        "BLOCK_SIZE_N": 256,
        "BLOCK_SIZE_K": 16,
        "GROUP_SIZE_M": 8,
        "num_stages": 8,
        "num_warps": 8,
        "ms": 0.07092323899269104,
        "min_ms": 0.07092323899269104,
        "max_ms": 0.07092323899269104,
        "compile_time": 1.4002325534820557
    },
    {
        "BLOCK_SIZE_M": 128,
        "BLOCK_SIZE_N": 128,
        "BLOCK_SIZE_K": 16,
        "GROUP_SIZE_M": 8,
        "num_stages": 2,
        "num_warps": 8,
        "ms": 0.07094117999076843,
        "min_ms": 0.07094117999076843,
        "max_ms": 0.07094117999076843,
        "compile_time": 1.6646418571472168
    },
    {
        "BLOCK_SIZE_M": 32,
        "BLOCK_SIZE_N": 512,
        "BLOCK_SIZE_K": 16,
        "GROUP_SIZE_M": 8,
        "num_stages": 5,
        "num_warps": 8,
        "ms": 0.07099853456020355,
        "min_ms": 0.07099853456020355,
        "max_ms": 0.07099853456020355,
        "compile_time": 1.5496041774749756
    },
    {
        "BLOCK_SIZE_M": 32,
        "BLOCK_SIZE_N": 64,
        "BLOCK_SIZE_K": 64,
        "GROUP_SIZE_M": 8,
        "num_stages": 3,
        "num_warps": 2,
        "ms": 0.07103116810321808,
        "min_ms": 0.07103116810321808,
        "max_ms": 0.07103116810321808,
        "compile_time": 1.56258225440979
    },
    {
        "BLOCK_SIZE_M": 64,
        "BLOCK_SIZE_N": 64,
        "BLOCK_SIZE_K": 16,
        "GROUP_SIZE_M": 8,
        "num_stages": 7,
        "num_warps": 2,
        "ms": 0.07103558629751205,
        "min_ms": 0.07103558629751205,
        "max_ms": 0.07103558629751205,
        "compile_time": 1.5719115734100342
    },
    {
        "BLOCK_SIZE_M": 32,
        "BLOCK_SIZE_N": 128,
        "BLOCK_SIZE_K": 16,
        "GROUP_SIZE_M": 8,
        "num_stages": 5,
        "num_warps": 4,
        "ms": 0.07106492668390274,
        "min_ms": 0.07106492668390274,
        "max_ms": 0.07106492668390274,
        "compile_time": 1.3735988140106201
    },
    {
        "BLOCK_SIZE_M": 64,
        "BLOCK_SIZE_N": 64,
        "BLOCK_SIZE_K": 32,
        "GROUP_SIZE_M": 8,
        "num_stages": 8,
        "num_warps": 8,
        "ms": 0.0710773766040802,
        "min_ms": 0.0710773766040802,
        "max_ms": 0.0710773766040802,
        "compile_time": 1.4415478706359863
    },
    {
        "BLOCK_SIZE_M": 32,
        "BLOCK_SIZE_N": 64,
        "BLOCK_SIZE_K": 32,
        "GROUP_SIZE_M": 8,
        "num_stages": 4,
        "num_warps": 2,
        "ms": 0.07108689844608307,
        "min_ms": 0.07108689844608307,
        "max_ms": 0.07108689844608307,
        "compile_time": 1.4308907985687256
    },
    {
        "BLOCK_SIZE_M": 32,
        "BLOCK_SIZE_N": 128,
        "BLOCK_SIZE_K": 64,
        "GROUP_SIZE_M": 8,
        "num_stages": 1,
        "num_warps": 2,
        "ms": 0.07116903364658356,
        "min_ms": 0.07116903364658356,
        "max_ms": 0.07116903364658356,
        "compile_time": 1.6828086376190186
    },
    {
        "BLOCK_SIZE_M": 128,
        "BLOCK_SIZE_N": 256,
        "BLOCK_SIZE_K": 16,
        "GROUP_SIZE_M": 8,
        "num_stages": 5,
        "num_warps": 16,
        "ms": 0.07124336063861847,
        "min_ms": 0.07124336063861847,
        "max_ms": 0.07124336063861847,
        "compile_time": 1.6461443901062012
    },
    {
        "BLOCK_SIZE_M": 128,
        "BLOCK_SIZE_N": 32,
        "BLOCK_SIZE_K": 256,
        "GROUP_SIZE_M": 8,
        "num_stages": 2,
        "num_warps": 4,
        "ms": 0.07128458470106125,
        "min_ms": 0.07128458470106125,
        "max_ms": 0.07128458470106125,
        "compile_time": 2.555288076400757
    },
    {
        "BLOCK_SIZE_M": 32,
        "BLOCK_SIZE_N": 64,
        "BLOCK_SIZE_K": 32,
        "GROUP_SIZE_M": 8,
        "num_stages": 4,
        "num_warps": 4,
        "ms": 0.071285679936409,
        "min_ms": 0.071285679936409,
        "max_ms": 0.071285679936409,
        "compile_time": 1.3402292728424072
    },
    {
        "BLOCK_SIZE_M": 32,
        "BLOCK_SIZE_N": 64,
        "BLOCK_SIZE_K": 32,
        "GROUP_SIZE_M": 8,
        "num_stages": 5,
        "num_warps": 2,
        "ms": 0.07129759341478348,
        "min_ms": 0.07129759341478348,
        "max_ms": 0.07129759341478348,
        "compile_time": 1.4481613636016846
    },
    {
        "BLOCK_SIZE_M": 64,
        "BLOCK_SIZE_N": 32,
        "BLOCK_SIZE_K": 64,
        "GROUP_SIZE_M": 8,
        "num_stages": 3,
        "num_warps": 4,
        "ms": 0.07139085233211517,
        "min_ms": 0.07139085233211517,
        "max_ms": 0.07139085233211517,
        "compile_time": 1.4565284252166748
    },
    {
        "BLOCK_SIZE_M": 32,
        "BLOCK_SIZE_N": 128,
        "BLOCK_SIZE_K": 64,
        "GROUP_SIZE_M": 8,
        "num_stages": 8,
        "num_warps": 4,
        "ms": 0.07139648497104645,
        "min_ms": 0.07139648497104645,
        "max_ms": 0.07139648497104645,
        "compile_time": 1.7667741775512695
    },
    {
        "BLOCK_SIZE_M": 32,
        "BLOCK_SIZE_N": 64,
        "BLOCK_SIZE_K": 32,
        "GROUP_SIZE_M": 8,
        "num_stages": 6,
        "num_warps": 4,
        "ms": 0.07148312032222748,
        "min_ms": 0.07148312032222748,
        "max_ms": 0.07148312032222748,
        "compile_time": 1.3699851036071777
    },
    {
        "BLOCK_SIZE_M": 32,
        "BLOCK_SIZE_N": 256,
        "BLOCK_SIZE_K": 64,
        "GROUP_SIZE_M": 8,
        "num_stages": 3,
        "num_warps": 16,
        "ms": 0.07152809202671051,
        "min_ms": 0.07152809202671051,
        "max_ms": 0.07152809202671051,
        "compile_time": 1.4018278121948242
    },
    {
        "BLOCK_SIZE_M": 64,
        "BLOCK_SIZE_N": 128,
        "BLOCK_SIZE_K": 16,
        "GROUP_SIZE_M": 8,
        "num_stages": 2,
        "num_warps": 8,
        "ms": 0.0715295672416687,
        "min_ms": 0.0715295672416687,
        "max_ms": 0.0715295672416687,
        "compile_time": 1.4087412357330322
    },
    {
        "BLOCK_SIZE_M": 128,
        "BLOCK_SIZE_N": 32,
        "BLOCK_SIZE_K": 32,
        "GROUP_SIZE_M": 8,
        "num_stages": 8,
        "num_warps": 4,
        "ms": 0.07160498946905136,
        "min_ms": 0.07160498946905136,
        "max_ms": 0.07160498946905136,
        "compile_time": 1.661508321762085
    },
    {
        "BLOCK_SIZE_M": 32,
        "BLOCK_SIZE_N": 64,
        "BLOCK_SIZE_K": 32,
        "GROUP_SIZE_M": 8,
        "num_stages": 5,
        "num_warps": 4,
        "ms": 0.07169327884912491,
        "min_ms": 0.07169327884912491,
        "max_ms": 0.07169327884912491,
        "compile_time": 1.3358469009399414
    },
    {
        "BLOCK_SIZE_M": 64,
        "BLOCK_SIZE_N": 32,
        "BLOCK_SIZE_K": 64,
        "GROUP_SIZE_M": 8,
        "num_stages": 4,
        "num_warps": 4,
        "ms": 0.07174094021320343,
        "min_ms": 0.07174094021320343,
        "max_ms": 0.07174094021320343,
        "compile_time": 1.4953830242156982
    },
    {
        "BLOCK_SIZE_M": 32,
        "BLOCK_SIZE_N": 512,
        "BLOCK_SIZE_K": 16,
        "GROUP_SIZE_M": 8,
        "num_stages": 3,
        "num_warps": 8,
        "ms": 0.07177359610795975,
        "min_ms": 0.07177359610795975,
        "max_ms": 0.07177359610795975,
        "compile_time": 1.5044121742248535
    },
    {
        "BLOCK_SIZE_M": 64,
        "BLOCK_SIZE_N": 256,
        "BLOCK_SIZE_K": 32,
        "GROUP_SIZE_M": 8,
        "num_stages": 3,
        "num_warps": 16,
        "ms": 0.07181321829557419,
        "min_ms": 0.07181321829557419,
        "max_ms": 0.07181321829557419,
        "compile_time": 1.4791345596313477
    },
    {
        "BLOCK_SIZE_M": 32,
        "BLOCK_SIZE_N": 64,
        "BLOCK_SIZE_K": 64,
        "GROUP_SIZE_M": 8,
        "num_stages": 5,
        "num_warps": 4,
        "ms": 0.07183679938316345,
        "min_ms": 0.07183679938316345,
        "max_ms": 0.07183679938316345,
        "compile_time": 1.414804458618164
    },
    {
        "BLOCK_SIZE_M": 32,
        "BLOCK_SIZE_N": 128,
        "BLOCK_SIZE_K": 128,
        "GROUP_SIZE_M": 8,
        "num_stages": 4,
        "num_warps": 4,
        "ms": 0.07184001058340073,
        "min_ms": 0.07184001058340073,
        "max_ms": 0.07184001058340073,
        "compile_time": 1.9463021755218506
    },
    {
        "BLOCK_SIZE_M": 128,
        "BLOCK_SIZE_N": 128,
        "BLOCK_SIZE_K": 256,
        "GROUP_SIZE_M": 8,
        "num_stages": 1,
        "num_warps": 8,
        "ms": 0.07184262573719025,
        "min_ms": 0.07184262573719025,
        "max_ms": 0.07184262573719025,
        "compile_time": 2.38036847114563
    },
    {
        "BLOCK_SIZE_M": 32,
        "BLOCK_SIZE_N": 64,
        "BLOCK_SIZE_K": 32,
        "GROUP_SIZE_M": 8,
        "num_stages": 3,
        "num_warps": 4,
        "ms": 0.07184891402721405,
        "min_ms": 0.07184891402721405,
        "max_ms": 0.07184891402721405,
        "compile_time": 1.2950820922851562
    },
    {
        "BLOCK_SIZE_M": 64,
        "BLOCK_SIZE_N": 32,
        "BLOCK_SIZE_K": 64,
        "GROUP_SIZE_M": 8,
        "num_stages": 3,
        "num_warps": 2,
        "ms": 0.07188083976507187,
        "min_ms": 0.07188083976507187,
        "max_ms": 0.07188083976507187,
        "compile_time": 1.637629747390747
    },
    {
        "BLOCK_SIZE_M": 64,
        "BLOCK_SIZE_N": 256,
        "BLOCK_SIZE_K": 32,
        "GROUP_SIZE_M": 8,
        "num_stages": 4,
        "num_warps": 16,
        "ms": 0.07190903276205063,
        "min_ms": 0.07190903276205063,
        "max_ms": 0.07190903276205063,
        "compile_time": 1.480769157409668
    },
    {
        "BLOCK_SIZE_M": 32,
        "BLOCK_SIZE_N": 256,
        "BLOCK_SIZE_K": 32,
        "GROUP_SIZE_M": 8,
        "num_stages": 4,
        "num_warps": 8,
        "ms": 0.07192464917898178,
        "min_ms": 0.07192464917898178,
        "max_ms": 0.07192464917898178,
        "compile_time": 1.4100849628448486
    },
    {
        "BLOCK_SIZE_M": 32,
        "BLOCK_SIZE_N": 256,
        "BLOCK_SIZE_K": 64,
        "GROUP_SIZE_M": 8,
        "num_stages": 3,
        "num_warps": 8,
        "ms": 0.07198800146579742,
        "min_ms": 0.07198800146579742,
        "max_ms": 0.07198800146579742,
        "compile_time": 1.5578210353851318
    },
    {
        "BLOCK_SIZE_M": 64,
        "BLOCK_SIZE_N": 256,
        "BLOCK_SIZE_K": 32,
        "GROUP_SIZE_M": 8,
        "num_stages": 5,
        "num_warps": 16,
        "ms": 0.07202258706092834,
        "min_ms": 0.07202258706092834,
        "max_ms": 0.07202258706092834,
        "compile_time": 1.4813463687896729
    },
    {
        "BLOCK_SIZE_M": 128,
        "BLOCK_SIZE_N": 256,
        "BLOCK_SIZE_K": 32,
        "GROUP_SIZE_M": 8,
        "num_stages": 2,
        "num_warps": 16,
        "ms": 0.07205691188573837,
        "min_ms": 0.07205691188573837,
        "max_ms": 0.07205691188573837,
        "compile_time": 1.6911377906799316
    },
    {
        "BLOCK_SIZE_M": 32,
        "BLOCK_SIZE_N": 128,
        "BLOCK_SIZE_K": 16,
        "GROUP_SIZE_M": 8,
        "num_stages": 6,
        "num_warps": 4,
        "ms": 0.07208144664764404,
        "min_ms": 0.07208144664764404,
        "max_ms": 0.07208144664764404,
        "compile_time": 1.3621907234191895
    },
    {
        "BLOCK_SIZE_M": 128,
        "BLOCK_SIZE_N": 32,
        "BLOCK_SIZE_K": 64,
        "GROUP_SIZE_M": 8,
        "num_stages": 8,
        "num_warps": 4,
        "ms": 0.07210830599069595,
        "min_ms": 0.07210830599069595,
        "max_ms": 0.07210830599069595,
        "compile_time": 1.9235198497772217
    },
    {
        "BLOCK_SIZE_M": 64,
        "BLOCK_SIZE_N": 64,
        "BLOCK_SIZE_K": 64,
        "GROUP_SIZE_M": 8,
        "num_stages": 8,
        "num_warps": 8,
        "ms": 0.07220135629177094,
        "min_ms": 0.07220135629177094,
        "max_ms": 0.07220135629177094,
        "compile_time": 1.5237176418304443
    },
    {
        "BLOCK_SIZE_M": 256,
        "BLOCK_SIZE_N": 32,
        "BLOCK_SIZE_K": 128,
        "GROUP_SIZE_M": 8,
        "num_stages": 3,
        "num_warps": 16,
        "ms": 0.07227678596973419,
        "min_ms": 0.07227678596973419,
        "max_ms": 0.07227678596973419,
        "compile_time": 1.3159663677215576
    },
    {
        "BLOCK_SIZE_M": 128,
        "BLOCK_SIZE_N": 256,
        "BLOCK_SIZE_K": 16,
        "GROUP_SIZE_M": 8,
        "num_stages": 4,
        "num_warps": 16,
        "ms": 0.07228885591030121,
        "min_ms": 0.07228885591030121,
        "max_ms": 0.07228885591030121,
        "compile_time": 0.9932610988616943
    },
    {
        "BLOCK_SIZE_M": 128,
        "BLOCK_SIZE_N": 64,
        "BLOCK_SIZE_K": 16,
        "GROUP_SIZE_M": 8,
        "num_stages": 2,
        "num_warps": 8,
        "ms": 0.07230953872203827,
        "min_ms": 0.07230953872203827,
        "max_ms": 0.07230953872203827,
        "compile_time": 1.4942455291748047
    },
    {
        "BLOCK_SIZE_M": 32,
        "BLOCK_SIZE_N": 256,
        "BLOCK_SIZE_K": 64,
        "GROUP_SIZE_M": 8,
        "num_stages": 4,
        "num_warps": 16,
        "ms": 0.07234962284564972,
        "min_ms": 0.07234962284564972,
        "max_ms": 0.07234962284564972,
        "compile_time": 1.4348595142364502
    },
    {
        "BLOCK_SIZE_M": 32,
        "BLOCK_SIZE_N": 128,
        "BLOCK_SIZE_K": 128,
        "GROUP_SIZE_M": 8,
        "num_stages": 5,
        "num_warps": 4,
        "ms": 0.07244540005922318,
        "min_ms": 0.07244540005922318,
        "max_ms": 0.07244540005922318,
        "compile_time": 2.037889003753662
    },
    {
        "BLOCK_SIZE_M": 32,
        "BLOCK_SIZE_N": 64,
        "BLOCK_SIZE_K": 32,
        "GROUP_SIZE_M": 8,
        "num_stages": 7,
        "num_warps": 4,
        "ms": 0.07246921956539154,
        "min_ms": 0.07246921956539154,
        "max_ms": 0.07246921956539154,
        "compile_time": 1.3759536743164062
    },
    {
        "BLOCK_SIZE_M": 128,
        "BLOCK_SIZE_N": 64,
        "BLOCK_SIZE_K": 64,
        "GROUP_SIZE_M": 8,
        "num_stages": 2,
        "num_warps": 16,
        "ms": 0.07253775745630264,
        "min_ms": 0.07253775745630264,
        "max_ms": 0.07253775745630264,
        "compile_time": 1.5335195064544678
    },
    {
        "BLOCK_SIZE_M": 32,
        "BLOCK_SIZE_N": 128,
        "BLOCK_SIZE_K": 128,
        "GROUP_SIZE_M": 8,
        "num_stages": 3,
        "num_warps": 2,
        "ms": 0.0725676566362381,
        "min_ms": 0.0725676566362381,
        "max_ms": 0.0725676566362381,
        "compile_time": 2.9409217834472656
    },
    {
        "BLOCK_SIZE_M": 64,
        "BLOCK_SIZE_N": 256,
        "BLOCK_SIZE_K": 128,
        "GROUP_SIZE_M": 8,
        "num_stages": 2,
        "num_warps": 8,
        "ms": 0.07257956266403198,
        "min_ms": 0.07257956266403198,
        "max_ms": 0.07257956266403198,
        "compile_time": 2.0166773796081543
    },
    {
        "BLOCK_SIZE_M": 32,
        "BLOCK_SIZE_N": 256,
        "BLOCK_SIZE_K": 32,
        "GROUP_SIZE_M": 8,
        "num_stages": 4,
        "num_warps": 4,
        "ms": 0.07259640842676163,
        "min_ms": 0.07259640842676163,
        "max_ms": 0.07259640842676163,
        "compile_time": 1.6621859073638916
    },
    {
        "BLOCK_SIZE_M": 32,
        "BLOCK_SIZE_N": 256,
        "BLOCK_SIZE_K": 64,
        "GROUP_SIZE_M": 8,
        "num_stages": 5,
        "num_warps": 16,
        "ms": 0.07260171324014664,
        "min_ms": 0.07260171324014664,
        "max_ms": 0.07260171324014664,
        "compile_time": 1.463616132736206
    },
    {
        "BLOCK_SIZE_M": 64,
        "BLOCK_SIZE_N": 256,
        "BLOCK_SIZE_K": 32,
        "GROUP_SIZE_M": 8,
        "num_stages": 6,
        "num_warps": 16,
        "ms": 0.07260497659444809,
        "min_ms": 0.07260497659444809,
        "max_ms": 0.07260497659444809,
        "compile_time": 1.5183584690093994
    },
    {
        "BLOCK_SIZE_M": 32,
        "BLOCK_SIZE_N": 128,
        "BLOCK_SIZE_K": 16,
        "GROUP_SIZE_M": 8,
        "num_stages": 8,
        "num_warps": 4,
        "ms": 0.07262618839740753,
        "min_ms": 0.07262618839740753,
        "max_ms": 0.07262618839740753,
        "compile_time": 1.4092068672180176
    },
    {
        "BLOCK_SIZE_M": 256,
        "BLOCK_SIZE_N": 32,
        "BLOCK_SIZE_K": 64,
        "GROUP_SIZE_M": 8,
        "num_stages": 3,
        "num_warps": 16,
        "ms": 0.07266578823328018,
        "min_ms": 0.07266578823328018,
        "max_ms": 0.07266578823328018,
        "compile_time": 1.5179154872894287
    },
    {
        "BLOCK_SIZE_M": 32,
        "BLOCK_SIZE_N": 128,
        "BLOCK_SIZE_K": 16,
        "GROUP_SIZE_M": 8,
        "num_stages": 1,
        "num_warps": 2,
        "ms": 0.07269032299518585,
        "min_ms": 0.07269032299518585,
        "max_ms": 0.07269032299518585,
        "compile_time": 1.4646296501159668
    },
    {
        "BLOCK_SIZE_M": 256,
        "BLOCK_SIZE_N": 64,
        "BLOCK_SIZE_K": 16,
        "GROUP_SIZE_M": 8,
        "num_stages": 3,
        "num_warps": 8,
        "ms": 0.07270125299692154,
        "min_ms": 0.07270125299692154,
        "max_ms": 0.07270125299692154,
        "compile_time": 1.7342016696929932
    },
    {
        "BLOCK_SIZE_M": 64,
        "BLOCK_SIZE_N": 256,
        "BLOCK_SIZE_K": 16,
        "GROUP_SIZE_M": 8,
        "num_stages": 2,
        "num_warps": 8,
        "ms": 0.0727284699678421,
        "min_ms": 0.0727284699678421,
        "max_ms": 0.0727284699678421,
        "compile_time": 1.5366966724395752
    },
    {
        "BLOCK_SIZE_M": 256,
        "BLOCK_SIZE_N": 128,
        "BLOCK_SIZE_K": 128,
        "GROUP_SIZE_M": 8,
        "num_stages": 2,
        "num_warps": 16,
        "ms": 0.07276840507984161,
        "min_ms": 0.07276840507984161,
        "max_ms": 0.07276840507984161,
        "compile_time": 2.668923854827881
    },
    {
        "BLOCK_SIZE_M": 256,
        "BLOCK_SIZE_N": 128,
        "BLOCK_SIZE_K": 32,
        "GROUP_SIZE_M": 8,
        "num_stages": 1,
        "num_warps": 16,
        "ms": 0.07277926057577133,
        "min_ms": 0.07277926057577133,
        "max_ms": 0.07277926057577133,
        "compile_time": 1.5797901153564453
    },
    {
        "BLOCK_SIZE_M": 128,
        "BLOCK_SIZE_N": 64,
        "BLOCK_SIZE_K": 32,
        "GROUP_SIZE_M": 8,
        "num_stages": 3,
        "num_warps": 16,
        "ms": 0.07278567552566528,
        "min_ms": 0.07278567552566528,
        "max_ms": 0.07278567552566528,
        "compile_time": 1.3601551055908203
    },
    {
        "BLOCK_SIZE_M": 64,
        "BLOCK_SIZE_N": 256,
        "BLOCK_SIZE_K": 64,
        "GROUP_SIZE_M": 8,
        "num_stages": 1,
        "num_warps": 4,
        "ms": 0.07279299944639206,
        "min_ms": 0.07279299944639206,
        "max_ms": 0.07279299944639206,
        "compile_time": 2.1152796745300293
    },
    {
        "BLOCK_SIZE_M": 32,
        "BLOCK_SIZE_N": 256,
        "BLOCK_SIZE_K": 32,
        "GROUP_SIZE_M": 8,
        "num_stages": 3,
        "num_warps": 8,
        "ms": 0.07284396141767502,
        "min_ms": 0.07284396141767502,
        "max_ms": 0.07284396141767502,
        "compile_time": 1.4095919132232666
    },
    {
        "BLOCK_SIZE_M": 128,
        "BLOCK_SIZE_N": 32,
        "BLOCK_SIZE_K": 128,
        "GROUP_SIZE_M": 8,
        "num_stages": 3,
        "num_warps": 2,
        "ms": 0.07286942005157471,
        "min_ms": 0.07286942005157471,
        "max_ms": 0.07286942005157471,
        "compile_time": 3.1489522457122803
    },
    {
        "BLOCK_SIZE_M": 64,
        "BLOCK_SIZE_N": 128,
        "BLOCK_SIZE_K": 32,
        "GROUP_SIZE_M": 8,
        "num_stages": 8,
        "num_warps": 2,
        "ms": 0.07288363575935364,
        "min_ms": 0.07288363575935364,
        "max_ms": 0.07288363575935364,
        "compile_time": 2.3495843410491943
    },
    {
        "BLOCK_SIZE_M": 256,
        "BLOCK_SIZE_N": 64,
        "BLOCK_SIZE_K": 16,
        "GROUP_SIZE_M": 8,
        "num_stages": 4,
        "num_warps": 8,
        "ms": 0.07289954274892807,
        "min_ms": 0.07289954274892807,
        "max_ms": 0.07289954274892807,
        "compile_time": 1.79414701461792
    },
    {
        "BLOCK_SIZE_M": 128,
        "BLOCK_SIZE_N": 32,
        "BLOCK_SIZE_K": 128,
        "GROUP_SIZE_M": 8,
        "num_stages": 5,
        "num_warps": 4,
        "ms": 0.07291252911090851,
        "min_ms": 0.07291252911090851,
        "max_ms": 0.07291252911090851,
        "compile_time": 2.2025516033172607
    },
    {
        "BLOCK_SIZE_M": 128,
        "BLOCK_SIZE_N": 256,
        "BLOCK_SIZE_K": 16,
        "GROUP_SIZE_M": 8,
        "num_stages": 6,
        "num_warps": 16,
        "ms": 0.07292906939983368,
        "min_ms": 0.07292906939983368,
        "max_ms": 0.07292906939983368,
        "compile_time": 1.6883771419525146
    },
    {
        "BLOCK_SIZE_M": 128,
        "BLOCK_SIZE_N": 64,
        "BLOCK_SIZE_K": 32,
        "GROUP_SIZE_M": 8,
        "num_stages": 4,
        "num_warps": 16,
        "ms": 0.07293395698070526,
        "min_ms": 0.07293395698070526,
        "max_ms": 0.07293395698070526,
        "compile_time": 1.4989376068115234
    },
    {
        "BLOCK_SIZE_M": 32,
        "BLOCK_SIZE_N": 256,
        "BLOCK_SIZE_K": 32,
        "GROUP_SIZE_M": 8,
        "num_stages": 4,
        "num_warps": 16,
        "ms": 0.0729973167181015,
        "min_ms": 0.0729973167181015,
        "max_ms": 0.0729973167181015,
        "compile_time": 1.3207142353057861
    },
    {
        "BLOCK_SIZE_M": 64,
        "BLOCK_SIZE_N": 32,
        "BLOCK_SIZE_K": 32,
        "GROUP_SIZE_M": 8,
        "num_stages": 4,
        "num_warps": 2,
        "ms": 0.07302802056074142,
        "min_ms": 0.07302802056074142,
        "max_ms": 0.07302802056074142,
        "compile_time": 1.5029032230377197
    },
    {
        "BLOCK_SIZE_M": 32,
        "BLOCK_SIZE_N": 64,
        "BLOCK_SIZE_K": 32,
        "GROUP_SIZE_M": 8,
        "num_stages": 6,
        "num_warps": 2,
        "ms": 0.07303415238857269,
        "min_ms": 0.07303415238857269,
        "max_ms": 0.07303415238857269,
        "compile_time": 1.4711265563964844
    },
    {
        "BLOCK_SIZE_M": 64,
        "BLOCK_SIZE_N": 32,
        "BLOCK_SIZE_K": 64,
        "GROUP_SIZE_M": 8,
        "num_stages": 5,
        "num_warps": 4,
        "ms": 0.07310865819454193,
        "min_ms": 0.07310865819454193,
        "max_ms": 0.07310865819454193,
        "compile_time": 1.5000205039978027
    },
    {
        "BLOCK_SIZE_M": 32,
        "BLOCK_SIZE_N": 512,
        "BLOCK_SIZE_K": 32,
        "GROUP_SIZE_M": 8,
        "num_stages": 5,
        "num_warps": 8,
        "ms": 0.07311336696147919,
        "min_ms": 0.07311336696147919,
        "max_ms": 0.07311336696147919,
        "compile_time": 1.7328996658325195
    },
    {
        "BLOCK_SIZE_M": 64,
        "BLOCK_SIZE_N": 64,
        "BLOCK_SIZE_K": 16,
        "GROUP_SIZE_M": 8,
        "num_stages": 2,
        "num_warps": 4,
        "ms": 0.07316602021455765,
        "min_ms": 0.07316602021455765,
        "max_ms": 0.07316602021455765,
        "compile_time": 1.3927710056304932
    },
    {
        "BLOCK_SIZE_M": 64,
        "BLOCK_SIZE_N": 256,
        "BLOCK_SIZE_K": 32,
        "GROUP_SIZE_M": 8,
        "num_stages": 7,
        "num_warps": 16,
        "ms": 0.07317973673343658,
        "min_ms": 0.07317973673343658,
        "max_ms": 0.07317973673343658,
        "compile_time": 1.5260505676269531
    },
    {
        "BLOCK_SIZE_M": 256,
        "BLOCK_SIZE_N": 64,
        "BLOCK_SIZE_K": 64,
        "GROUP_SIZE_M": 8,
        "num_stages": 2,
        "num_warps": 8,
        "ms": 0.07322007417678833,
        "min_ms": 0.07322007417678833,
        "max_ms": 0.07322007417678833,
        "compile_time": 2.034661054611206
    },
    {
        "BLOCK_SIZE_M": 64,
        "BLOCK_SIZE_N": 64,
        "BLOCK_SIZE_K": 64,
        "GROUP_SIZE_M": 8,
        "num_stages": 7,
        "num_warps": 2,
        "ms": 0.07328953593969345,
        "min_ms": 0.07328953593969345,
        "max_ms": 0.07328953593969345,
        "compile_time": 2.0676891803741455
    },
    {
        "BLOCK_SIZE_M": 32,
        "BLOCK_SIZE_N": 256,
        "BLOCK_SIZE_K": 32,
        "GROUP_SIZE_M": 8,
        "num_stages": 3,
        "num_warps": 16,
        "ms": 0.07329020649194717,
        "min_ms": 0.07329020649194717,
        "max_ms": 0.07329020649194717,
        "compile_time": 1.3464996814727783
    },
    {
        "BLOCK_SIZE_M": 128,
        "BLOCK_SIZE_N": 256,
        "BLOCK_SIZE_K": 16,
        "GROUP_SIZE_M": 8,
        "num_stages": 7,
        "num_warps": 16,
        "ms": 0.0733155831694603,
        "min_ms": 0.0733155831694603,
        "max_ms": 0.0733155831694603,
        "compile_time": 1.5850677490234375
    },
    {
        "BLOCK_SIZE_M": 256,
        "BLOCK_SIZE_N": 64,
        "BLOCK_SIZE_K": 128,
        "GROUP_SIZE_M": 8,
        "num_stages": 2,
        "num_warps": 4,
        "ms": 0.07336772978305817,
        "min_ms": 0.07336772978305817,
        "max_ms": 0.07336772978305817,
        "compile_time": 3.1720845699310303
    },
    {
        "BLOCK_SIZE_M": 128,
        "BLOCK_SIZE_N": 128,
        "BLOCK_SIZE_K": 128,
        "GROUP_SIZE_M": 8,
        "num_stages": 1,
        "num_warps": 8,
        "ms": 0.07339295744895935,
        "min_ms": 0.07339295744895935,
        "max_ms": 0.07339295744895935,
        "compile_time": 1.9273669719696045
    },
    {
        "BLOCK_SIZE_M": 128,
        "BLOCK_SIZE_N": 256,
        "BLOCK_SIZE_K": 16,
        "GROUP_SIZE_M": 8,
        "num_stages": 8,
        "num_warps": 16,
        "ms": 0.07339387387037277,
        "min_ms": 0.07339387387037277,
        "max_ms": 0.07339387387037277,
        "compile_time": 1.6842470169067383
    },
    {
        "BLOCK_SIZE_M": 64,
        "BLOCK_SIZE_N": 128,
        "BLOCK_SIZE_K": 256,
        "GROUP_SIZE_M": 8,
        "num_stages": 1,
        "num_warps": 8,
        "ms": 0.07339740544557571,
        "min_ms": 0.07339740544557571,
        "max_ms": 0.07339740544557571,
        "compile_time": 1.9032065868377686
    },
    {
        "BLOCK_SIZE_M": 256,
        "BLOCK_SIZE_N": 64,
        "BLOCK_SIZE_K": 16,
        "GROUP_SIZE_M": 8,
        "num_stages": 3,
        "num_warps": 4,
        "ms": 0.07346989214420319,
        "min_ms": 0.07346989214420319,
        "max_ms": 0.07346989214420319,
        "compile_time": 2.103949546813965
    },
    {
        "BLOCK_SIZE_M": 256,
        "BLOCK_SIZE_N": 32,
        "BLOCK_SIZE_K": 64,
        "GROUP_SIZE_M": 8,
        "num_stages": 4,
        "num_warps": 16,
        "ms": 0.07351970672607422,
        "min_ms": 0.07351970672607422,
        "max_ms": 0.07351970672607422,
        "compile_time": 1.4622938632965088
    },
    {
        "BLOCK_SIZE_M": 64,
        "BLOCK_SIZE_N": 32,
        "BLOCK_SIZE_K": 32,
        "GROUP_SIZE_M": 8,
        "num_stages": 4,
        "num_warps": 4,
        "ms": 0.07359962165355682,
        "min_ms": 0.07359962165355682,
        "max_ms": 0.07359962165355682,
        "compile_time": 1.4152576923370361
    },
    {
        "BLOCK_SIZE_M": 128,
        "BLOCK_SIZE_N": 64,
        "BLOCK_SIZE_K": 32,
        "GROUP_SIZE_M": 8,
        "num_stages": 5,
        "num_warps": 16,
        "ms": 0.07360382378101349,
        "min_ms": 0.07360382378101349,
        "max_ms": 0.07360382378101349,
        "compile_time": 1.5159916877746582
    },
    {
        "BLOCK_SIZE_M": 32,
        "BLOCK_SIZE_N": 128,
        "BLOCK_SIZE_K": 64,
        "GROUP_SIZE_M": 8,
        "num_stages": 2,
        "num_warps": 8,
        "ms": 0.07360568642616272,
        "min_ms": 0.07360568642616272,
        "max_ms": 0.07360568642616272,
        "compile_time": 1.3292062282562256
    },
    {
        "BLOCK_SIZE_M": 64,
        "BLOCK_SIZE_N": 128,
        "BLOCK_SIZE_K": 128,
        "GROUP_SIZE_M": 8,
        "num_stages": 2,
        "num_warps": 2,
        "ms": 0.07361803948879242,
        "min_ms": 0.07361803948879242,
        "max_ms": 0.07361803948879242,
        "compile_time": 2.974757432937622
    },
    {
        "BLOCK_SIZE_M": 64,
        "BLOCK_SIZE_N": 256,
        "BLOCK_SIZE_K": 32,
        "GROUP_SIZE_M": 8,
        "num_stages": 8,
        "num_warps": 16,
        "ms": 0.07362453639507294,
        "min_ms": 0.07362453639507294,
        "max_ms": 0.07362453639507294,
        "compile_time": 1.5630378723144531
    },
    {
        "BLOCK_SIZE_M": 32,
        "BLOCK_SIZE_N": 64,
        "BLOCK_SIZE_K": 128,
        "GROUP_SIZE_M": 8,
        "num_stages": 3,
        "num_warps": 2,
        "ms": 0.07364030182361603,
        "min_ms": 0.07364030182361603,
        "max_ms": 0.07364030182361603,
        "compile_time": 1.924267292022705
    },
    {
        "BLOCK_SIZE_M": 64,
        "BLOCK_SIZE_N": 32,
        "BLOCK_SIZE_K": 32,
        "GROUP_SIZE_M": 8,
        "num_stages": 3,
        "num_warps": 4,
        "ms": 0.07364356517791748,
        "min_ms": 0.07364356517791748,
        "max_ms": 0.07364356517791748,
        "compile_time": 1.4135100841522217
    },
    {
        "BLOCK_SIZE_M": 128,
        "BLOCK_SIZE_N": 64,
        "BLOCK_SIZE_K": 32,
        "GROUP_SIZE_M": 8,
        "num_stages": 6,
        "num_warps": 16,
        "ms": 0.07366020977497101,
        "min_ms": 0.07366020977497101,
        "max_ms": 0.07366020977497101,
        "compile_time": 1.503568410873413
    },
    {
        "BLOCK_SIZE_M": 32,
        "BLOCK_SIZE_N": 256,
        "BLOCK_SIZE_K": 16,
        "GROUP_SIZE_M": 8,
        "num_stages": 2,
        "num_warps": 4,
        "ms": 0.07366631180047989,
        "min_ms": 0.07366631180047989,
        "max_ms": 0.07366631180047989,
        "compile_time": 1.435180902481079
    },
    {
        "BLOCK_SIZE_M": 32,
        "BLOCK_SIZE_N": 256,
        "BLOCK_SIZE_K": 32,
        "GROUP_SIZE_M": 8,
        "num_stages": 5,
        "num_warps": 16,
        "ms": 0.07367908954620361,
        "min_ms": 0.07367908954620361,
        "max_ms": 0.07367908954620361,
        "compile_time": 1.3526124954223633
    },
    {
        "BLOCK_SIZE_M": 64,
        "BLOCK_SIZE_N": 128,
        "BLOCK_SIZE_K": 128,
        "GROUP_SIZE_M": 8,
        "num_stages": 1,
        "num_warps": 2,
        "ms": 0.0736989825963974,
        "min_ms": 0.0736989825963974,
        "max_ms": 0.0736989825963974,
        "compile_time": 2.853898048400879
    },
    {
        "BLOCK_SIZE_M": 256,
        "BLOCK_SIZE_N": 64,
        "BLOCK_SIZE_K": 16,
        "GROUP_SIZE_M": 8,
        "num_stages": 5,
        "num_warps": 8,
        "ms": 0.07379131019115448,
        "min_ms": 0.07379131019115448,
        "max_ms": 0.07379131019115448,
        "compile_time": 1.7968642711639404
    },
    {
        "BLOCK_SIZE_M": 64,
        "BLOCK_SIZE_N": 32,
        "BLOCK_SIZE_K": 32,
        "GROUP_SIZE_M": 8,
        "num_stages": 5,
        "num_warps": 4,
        "ms": 0.07382067292928696,
        "min_ms": 0.07382067292928696,
        "max_ms": 0.07382067292928696,
        "compile_time": 1.4392988681793213
    },
    {
        "BLOCK_SIZE_M": 32,
        "BLOCK_SIZE_N": 64,
        "BLOCK_SIZE_K": 32,
        "GROUP_SIZE_M": 8,
        "num_stages": 8,
        "num_warps": 2,
        "ms": 0.0738232284784317,
        "min_ms": 0.0738232284784317,
        "max_ms": 0.0738232284784317,
        "compile_time": 1.5067853927612305
    },
    {
        "BLOCK_SIZE_M": 32,
        "BLOCK_SIZE_N": 256,
        "BLOCK_SIZE_K": 64,
        "GROUP_SIZE_M": 8,
        "num_stages": 1,
        "num_warps": 4,
        "ms": 0.07386460900306702,
        "min_ms": 0.07386460900306702,
        "max_ms": 0.07386460900306702,
        "compile_time": 1.7004384994506836
    },
    {
        "BLOCK_SIZE_M": 32,
        "BLOCK_SIZE_N": 64,
        "BLOCK_SIZE_K": 64,
        "GROUP_SIZE_M": 8,
        "num_stages": 5,
        "num_warps": 2,
        "ms": 0.07388358563184738,
        "min_ms": 0.07388358563184738,
        "max_ms": 0.07388358563184738,
        "compile_time": 1.6245274543762207
    },
    {
        "BLOCK_SIZE_M": 256,
        "BLOCK_SIZE_N": 64,
        "BLOCK_SIZE_K": 32,
        "GROUP_SIZE_M": 8,
        "num_stages": 4,
        "num_warps": 16,
        "ms": 0.07394549995660782,
        "min_ms": 0.07394549995660782,
        "max_ms": 0.07394549995660782,
        "compile_time": 1.7080693244934082
    },
    {
        "BLOCK_SIZE_M": 64,
        "BLOCK_SIZE_N": 64,
        "BLOCK_SIZE_K": 256,
        "GROUP_SIZE_M": 8,
        "num_stages": 3,
        "num_warps": 8,
        "ms": 0.07397310435771942,
        "min_ms": 0.07397310435771942,
        "max_ms": 0.07397310435771942,
        "compile_time": 1.846027135848999
    },
    {
        "BLOCK_SIZE_M": 32,
        "BLOCK_SIZE_N": 128,
        "BLOCK_SIZE_K": 64,
        "GROUP_SIZE_M": 8,
        "num_stages": 6,
        "num_warps": 8,
        "ms": 0.07399214059114456,
        "min_ms": 0.07399214059114456,
        "max_ms": 0.07399214059114456,
        "compile_time": 1.4725277423858643
    },
    {
        "BLOCK_SIZE_M": 64,
        "BLOCK_SIZE_N": 128,
        "BLOCK_SIZE_K": 32,
        "GROUP_SIZE_M": 8,
        "num_stages": 3,
        "num_warps": 16,
        "ms": 0.07400887459516525,
        "min_ms": 0.07400887459516525,
        "max_ms": 0.07400887459516525,
        "compile_time": 1.4095561504364014
    },
    {
        "BLOCK_SIZE_M": 64,
        "BLOCK_SIZE_N": 128,
        "BLOCK_SIZE_K": 256,
        "GROUP_SIZE_M": 8,
        "num_stages": 2,
        "num_warps": 4,
        "ms": 0.07406803220510483,
        "min_ms": 0.07406803220510483,
        "max_ms": 0.07406803220510483,
        "compile_time": 2.891338348388672
    },
    {
        "BLOCK_SIZE_M": 64,
        "BLOCK_SIZE_N": 512,
        "BLOCK_SIZE_K": 64,
        "GROUP_SIZE_M": 8,
        "num_stages": 3,
        "num_warps": 16,
        "ms": 0.07413036376237869,
        "min_ms": 0.07413036376237869,
        "max_ms": 0.07413036376237869,
        "compile_time": 1.8520066738128662
    },
    {
        "BLOCK_SIZE_M": 128,
        "BLOCK_SIZE_N": 256,
        "BLOCK_SIZE_K": 64,
        "GROUP_SIZE_M": 8,
        "num_stages": 1,
        "num_warps": 32,
        "ms": 0.07414405792951584,
        "min_ms": 0.07414405792951584,
        "max_ms": 0.07414405792951584,
        "compile_time": 1.5600075721740723
    },
    {
        "BLOCK_SIZE_M": 256,
        "BLOCK_SIZE_N": 128,
        "BLOCK_SIZE_K": 32,
        "GROUP_SIZE_M": 8,
        "num_stages": 1,
        "num_warps": 32,
        "ms": 0.07415194809436798,
        "min_ms": 0.07415194809436798,
        "max_ms": 0.07415194809436798,
        "compile_time": 1.6445636749267578
    },
    {
        "BLOCK_SIZE_M": 256,
        "BLOCK_SIZE_N": 64,
        "BLOCK_SIZE_K": 16,
        "GROUP_SIZE_M": 8,
        "num_stages": 6,
        "num_warps": 8,
        "ms": 0.07415716350078583,
        "min_ms": 0.07415716350078583,
        "max_ms": 0.07415716350078583,
        "compile_time": 1.8109595775604248
    },
    {
        "BLOCK_SIZE_M": 64,
        "BLOCK_SIZE_N": 32,
        "BLOCK_SIZE_K": 32,
        "GROUP_SIZE_M": 8,
        "num_stages": 3,
        "num_warps": 2,
        "ms": 0.07417108118534088,
        "min_ms": 0.07417108118534088,
        "max_ms": 0.07417108118534088,
        "compile_time": 1.493239402770996
    },
    {
        "BLOCK_SIZE_M": 32,
        "BLOCK_SIZE_N": 64,
        "BLOCK_SIZE_K": 32,
        "GROUP_SIZE_M": 8,
        "num_stages": 7,
        "num_warps": 2,
        "ms": 0.07419884949922562,
        "min_ms": 0.07419884949922562,
        "max_ms": 0.07419884949922562,
        "compile_time": 1.4884834289550781
    },
    {
        "BLOCK_SIZE_M": 256,
        "BLOCK_SIZE_N": 64,
        "BLOCK_SIZE_K": 16,
        "GROUP_SIZE_M": 8,
        "num_stages": 4,
        "num_warps": 4,
        "ms": 0.0742259994149208,
        "min_ms": 0.0742259994149208,
        "max_ms": 0.0742259994149208,
        "compile_time": 2.1759438514709473
    },
    {
        "BLOCK_SIZE_M": 32,
        "BLOCK_SIZE_N": 256,
        "BLOCK_SIZE_K": 16,
        "GROUP_SIZE_M": 8,
        "num_stages": 1,
        "num_warps": 4,
        "ms": 0.07423753291368484,
        "min_ms": 0.07423753291368484,
        "max_ms": 0.07423753291368484,
        "compile_time": 0.9247300624847412
    },
    {
        "BLOCK_SIZE_M": 64,
        "BLOCK_SIZE_N": 256,
        "BLOCK_SIZE_K": 64,
        "GROUP_SIZE_M": 8,
        "num_stages": 2,
        "num_warps": 8,
        "ms": 0.07425347715616226,
        "min_ms": 0.07425347715616226,
        "max_ms": 0.07425347715616226,
        "compile_time": 1.7693581581115723
    },
    {
        "BLOCK_SIZE_M": 64,
        "BLOCK_SIZE_N": 128,
        "BLOCK_SIZE_K": 32,
        "GROUP_SIZE_M": 8,
        "num_stages": 4,
        "num_warps": 16,
        "ms": 0.0743090808391571,
        "min_ms": 0.0743090808391571,
        "max_ms": 0.0743090808391571,
        "compile_time": 1.4239835739135742
    },
    {
        "BLOCK_SIZE_M": 128,
        "BLOCK_SIZE_N": 64,
        "BLOCK_SIZE_K": 32,
        "GROUP_SIZE_M": 8,
        "num_stages": 7,
        "num_warps": 16,
        "ms": 0.07433043420314789,
        "min_ms": 0.07433043420314789,
        "max_ms": 0.07433043420314789,
        "compile_time": 1.5059537887573242
    },
    {
        "BLOCK_SIZE_M": 64,
        "BLOCK_SIZE_N": 32,
        "BLOCK_SIZE_K": 128,
        "GROUP_SIZE_M": 8,
        "num_stages": 3,
        "num_warps": 4,
        "ms": 0.07433541119098663,
        "min_ms": 0.07433541119098663,
        "max_ms": 0.07433541119098663,
        "compile_time": 1.655970573425293
    },
    {
        "BLOCK_SIZE_M": 64,
        "BLOCK_SIZE_N": 32,
        "BLOCK_SIZE_K": 32,
        "GROUP_SIZE_M": 8,
        "num_stages": 5,
        "num_warps": 2,
        "ms": 0.0743766501545906,
        "min_ms": 0.0743766501545906,
        "max_ms": 0.0743766501545906,
        "compile_time": 1.5430443286895752
    },
    {
        "BLOCK_SIZE_M": 128,
        "BLOCK_SIZE_N": 64,
        "BLOCK_SIZE_K": 16,
        "GROUP_SIZE_M": 8,
        "num_stages": 1,
        "num_warps": 8,
        "ms": 0.07437828183174133,
        "min_ms": 0.07437828183174133,
        "max_ms": 0.07437828183174133,
        "compile_time": 1.4759643077850342
    },
    {
        "BLOCK_SIZE_M": 256,
        "BLOCK_SIZE_N": 128,
        "BLOCK_SIZE_K": 128,
        "GROUP_SIZE_M": 8,
        "num_stages": 1,
        "num_warps": 16,
        "ms": 0.07442981749773026,
        "min_ms": 0.07442981749773026,
        "max_ms": 0.07442981749773026,
        "compile_time": 2.69100022315979
    },
    {
        "BLOCK_SIZE_M": 512,
        "BLOCK_SIZE_N": 64,
        "BLOCK_SIZE_K": 32,
        "GROUP_SIZE_M": 8,
        "num_stages": 4,
        "num_warps": 16,
        "ms": 0.07443322986364365,
        "min_ms": 0.07443322986364365,
        "max_ms": 0.07443322986364365,
        "compile_time": 2.190385580062866
    },
    {
        "BLOCK_SIZE_M": 32,
        "BLOCK_SIZE_N": 64,
        "BLOCK_SIZE_K": 128,
        "GROUP_SIZE_M": 8,
        "num_stages": 3,
        "num_warps": 4,
        "ms": 0.07452809810638428,
        "min_ms": 0.07452809810638428,
        "max_ms": 0.07452809810638428,
        "compile_time": 1.5815584659576416
    },
    {
        "BLOCK_SIZE_M": 64,
        "BLOCK_SIZE_N": 64,
        "BLOCK_SIZE_K": 128,
        "GROUP_SIZE_M": 8,
        "num_stages": 6,
        "num_warps": 8,
        "ms": 0.07453355938196182,
        "min_ms": 0.07453355938196182,
        "max_ms": 0.07453355938196182,
        "compile_time": 1.6828258037567139
    },
    {
        "BLOCK_SIZE_M": 128,
        "BLOCK_SIZE_N": 32,
        "BLOCK_SIZE_K": 64,
        "GROUP_SIZE_M": 8,
        "num_stages": 2,
        "num_warps": 8,
        "ms": 0.074571892619133,
        "min_ms": 0.074571892619133,
        "max_ms": 0.074571892619133,
        "compile_time": 1.5596997737884521
    },
    {
        "BLOCK_SIZE_M": 128,
        "BLOCK_SIZE_N": 128,
        "BLOCK_SIZE_K": 256,
        "GROUP_SIZE_M": 8,
        "num_stages": 2,
        "num_warps": 8,
        "ms": 0.07457397133111954,
        "min_ms": 0.07457397133111954,
        "max_ms": 0.07457397133111954,
        "compile_time": 2.5645880699157715
    },
    {
        "BLOCK_SIZE_M": 512,
        "BLOCK_SIZE_N": 64,
        "BLOCK_SIZE_K": 32,
        "GROUP_SIZE_M": 8,
        "num_stages": 1,
        "num_warps": 16,
        "ms": 0.07459911704063416,
        "min_ms": 0.07459911704063416,
        "max_ms": 0.07459911704063416,
        "compile_time": 1.9958975315093994
    },
    {
        "BLOCK_SIZE_M": 256,
        "BLOCK_SIZE_N": 128,
        "BLOCK_SIZE_K": 16,
        "GROUP_SIZE_M": 8,
        "num_stages": 3,
        "num_warps": 16,
        "ms": 0.07460196316242218,
        "min_ms": 0.07460196316242218,
        "max_ms": 0.07460196316242218,
        "compile_time": 1.7762253284454346
    },
    {
        "BLOCK_SIZE_M": 64,
        "BLOCK_SIZE_N": 32,
        "BLOCK_SIZE_K": 64,
        "GROUP_SIZE_M": 8,
        "num_stages": 5,
        "num_warps": 2,
        "ms": 0.07463820278644562,
        "min_ms": 0.07463820278644562,
        "max_ms": 0.07463820278644562,
        "compile_time": 1.7229349613189697
    },
    {
        "BLOCK_SIZE_M": 32,
        "BLOCK_SIZE_N": 128,
        "BLOCK_SIZE_K": 32,
        "GROUP_SIZE_M": 8,
        "num_stages": 1,
        "num_warps": 4,
        "ms": 0.07464031130075455,
        "min_ms": 0.07464031130075455,
        "max_ms": 0.07464031130075455,
        "compile_time": 1.3633949756622314
    },
    {
        "BLOCK_SIZE_M": 64,
        "BLOCK_SIZE_N": 128,
        "BLOCK_SIZE_K": 32,
        "GROUP_SIZE_M": 8,
        "num_stages": 5,
        "num_warps": 16,
        "ms": 0.07464529573917389,
        "min_ms": 0.07464529573917389,
        "max_ms": 0.07464529573917389,
        "compile_time": 1.4307055473327637
    },
    {
        "BLOCK_SIZE_M": 32,
        "BLOCK_SIZE_N": 128,
        "BLOCK_SIZE_K": 128,
        "GROUP_SIZE_M": 8,
        "num_stages": 4,
        "num_warps": 8,
        "ms": 0.07464995980262756,
        "min_ms": 0.07464995980262756,
        "max_ms": 0.07464995980262756,
        "compile_time": 1.6061501502990723
    },
    {
        "BLOCK_SIZE_M": 256,
        "BLOCK_SIZE_N": 64,
        "BLOCK_SIZE_K": 16,
        "GROUP_SIZE_M": 8,
        "num_stages": 7,
        "num_warps": 8,
        "ms": 0.07468770444393158,
        "min_ms": 0.07468770444393158,
        "max_ms": 0.07468770444393158,
        "compile_time": 1.8106303215026855
    },
    {
        "BLOCK_SIZE_M": 256,
        "BLOCK_SIZE_N": 128,
        "BLOCK_SIZE_K": 32,
        "GROUP_SIZE_M": 8,
        "num_stages": 2,
        "num_warps": 16,
        "ms": 0.07468827813863754,
        "min_ms": 0.07468827813863754,
        "max_ms": 0.07468827813863754,
        "compile_time": 1.766068935394287
    },
    {
        "BLOCK_SIZE_M": 512,
        "BLOCK_SIZE_N": 32,
        "BLOCK_SIZE_K": 64,
        "GROUP_SIZE_M": 8,
        "num_stages": 3,
        "num_warps": 8,
        "ms": 0.07476013153791428,
        "min_ms": 0.07476013153791428,
        "max_ms": 0.07476013153791428,
        "compile_time": 1.752413272857666
    },
    {
        "BLOCK_SIZE_M": 32,
        "BLOCK_SIZE_N": 128,
        "BLOCK_SIZE_K": 16,
        "GROUP_SIZE_M": 8,
        "num_stages": 7,
        "num_warps": 4,
        "ms": 0.07480356842279434,
        "min_ms": 0.07480356842279434,
        "max_ms": 0.07480356842279434,
        "compile_time": 1.373311996459961
    },
    {
        "BLOCK_SIZE_M": 256,
        "BLOCK_SIZE_N": 64,
        "BLOCK_SIZE_K": 16,
        "GROUP_SIZE_M": 8,
        "num_stages": 5,
        "num_warps": 4,
        "ms": 0.07481269538402557,
        "min_ms": 0.07481269538402557,
        "max_ms": 0.07481269538402557,
        "compile_time": 2.1555933952331543
    },
    {
        "BLOCK_SIZE_M": 64,
        "BLOCK_SIZE_N": 32,
        "BLOCK_SIZE_K": 32,
        "GROUP_SIZE_M": 8,
        "num_stages": 6,
        "num_warps": 4,
        "ms": 0.07484310120344162,
        "min_ms": 0.07484310120344162,
        "max_ms": 0.07484310120344162,
        "compile_time": 1.450422763824463
    },
    {
        "BLOCK_SIZE_M": 32,
        "BLOCK_SIZE_N": 128,
        "BLOCK_SIZE_K": 32,
        "GROUP_SIZE_M": 8,
        "num_stages": 3,
        "num_warps": 8,
        "ms": 0.07491852343082428,
        "min_ms": 0.07491852343082428,
        "max_ms": 0.07491852343082428,
        "compile_time": 1.3326265811920166
    },
    {
        "BLOCK_SIZE_M": 32,
        "BLOCK_SIZE_N": 512,
        "BLOCK_SIZE_K": 32,
        "GROUP_SIZE_M": 8,
        "num_stages": 4,
        "num_warps": 8,
        "ms": 0.07495039701461792,
        "min_ms": 0.07495039701461792,
        "max_ms": 0.07495039701461792,
        "compile_time": 1.7007460594177246
    },
    {
        "BLOCK_SIZE_M": 256,
        "BLOCK_SIZE_N": 128,
        "BLOCK_SIZE_K": 16,
        "GROUP_SIZE_M": 8,
        "num_stages": 5,
        "num_warps": 16,
        "ms": 0.07497528940439224,
        "min_ms": 0.07497528940439224,
        "max_ms": 0.07497528940439224,
        "compile_time": 1.7646589279174805
    },
    {
        "BLOCK_SIZE_M": 64,
        "BLOCK_SIZE_N": 32,
        "BLOCK_SIZE_K": 128,
        "GROUP_SIZE_M": 8,
        "num_stages": 3,
        "num_warps": 2,
        "ms": 0.07500561326742172,
        "min_ms": 0.07500561326742172,
        "max_ms": 0.07500561326742172,
        "compile_time": 2.0196759700775146
    },
    {
        "BLOCK_SIZE_M": 256,
        "BLOCK_SIZE_N": 64,
        "BLOCK_SIZE_K": 16,
        "GROUP_SIZE_M": 8,
        "num_stages": 8,
        "num_warps": 8,
        "ms": 0.07509250938892365,
        "min_ms": 0.07509250938892365,
        "max_ms": 0.07509250938892365,
        "compile_time": 1.8696444034576416
    },
    {
        "BLOCK_SIZE_M": 32,
        "BLOCK_SIZE_N": 64,
        "BLOCK_SIZE_K": 64,
        "GROUP_SIZE_M": 8,
        "num_stages": 4,
        "num_warps": 2,
        "ms": 0.07509840279817581,
        "min_ms": 0.07509840279817581,
        "max_ms": 0.07509840279817581,
        "compile_time": 1.58408522605896
    },
    {
        "BLOCK_SIZE_M": 32,
        "BLOCK_SIZE_N": 128,
        "BLOCK_SIZE_K": 32,
        "GROUP_SIZE_M": 8,
        "num_stages": 4,
        "num_warps": 8,
        "ms": 0.07518064975738525,
        "min_ms": 0.07518064975738525,
        "max_ms": 0.07518064975738525,
        "compile_time": 1.3500933647155762
    },
    {
        "BLOCK_SIZE_M": 64,
        "BLOCK_SIZE_N": 64,
        "BLOCK_SIZE_K": 64,
        "GROUP_SIZE_M": 8,
        "num_stages": 8,
        "num_warps": 2,
        "ms": 0.0752083957195282,
        "min_ms": 0.0752083957195282,
        "max_ms": 0.0752083957195282,
        "compile_time": 2.107837438583374
    },
    {
        "BLOCK_SIZE_M": 64,
        "BLOCK_SIZE_N": 32,
        "BLOCK_SIZE_K": 64,
        "GROUP_SIZE_M": 8,
        "num_stages": 4,
        "num_warps": 2,
        "ms": 0.07521520555019379,
        "min_ms": 0.07521520555019379,
        "max_ms": 0.07521520555019379,
        "compile_time": 1.707768440246582
    },
    {
        "BLOCK_SIZE_M": 512,
        "BLOCK_SIZE_N": 32,
        "BLOCK_SIZE_K": 32,
        "GROUP_SIZE_M": 8,
        "num_stages": 3,
        "num_warps": 8,
        "ms": 0.0752597376704216,
        "min_ms": 0.0752597376704216,
        "max_ms": 0.0752597376704216,
        "compile_time": 2.1711483001708984
    },
    {
        "BLOCK_SIZE_M": 64,
        "BLOCK_SIZE_N": 512,
        "BLOCK_SIZE_K": 64,
        "GROUP_SIZE_M": 8,
        "num_stages": 2,
        "num_warps": 8,
        "ms": 0.0752696543931961,
        "min_ms": 0.0752696543931961,
        "max_ms": 0.0752696543931961,
        "compile_time": 2.2522430419921875
    },
    {
        "BLOCK_SIZE_M": 256,
        "BLOCK_SIZE_N": 32,
        "BLOCK_SIZE_K": 32,
        "GROUP_SIZE_M": 8,
        "num_stages": 1,
        "num_warps": 2,
        "ms": 0.07528645545244217,
        "min_ms": 0.07528645545244217,
        "max_ms": 0.07528645545244217,
        "compile_time": 1.7216205596923828
    },
    {
        "BLOCK_SIZE_M": 32,
        "BLOCK_SIZE_N": 128,
        "BLOCK_SIZE_K": 32,
        "GROUP_SIZE_M": 8,
        "num_stages": 5,
        "num_warps": 8,
        "ms": 0.07530476897954941,
        "min_ms": 0.07530476897954941,
        "max_ms": 0.07530476897954941,
        "compile_time": 1.3654015064239502
    },
    {
        "BLOCK_SIZE_M": 128,
        "BLOCK_SIZE_N": 64,
        "BLOCK_SIZE_K": 16,
        "GROUP_SIZE_M": 8,
        "num_stages": 2,
        "num_warps": 2,
        "ms": 0.0753047987818718,
        "min_ms": 0.0753047987818718,
        "max_ms": 0.0753047987818718,
        "compile_time": 1.9092695713043213
    },
    {
        "BLOCK_SIZE_M": 64,
        "BLOCK_SIZE_N": 128,
        "BLOCK_SIZE_K": 32,
        "GROUP_SIZE_M": 8,
        "num_stages": 6,
        "num_warps": 16,
        "ms": 0.07534588873386383,
        "min_ms": 0.07534588873386383,
        "max_ms": 0.07534588873386383,
        "compile_time": 1.427863597869873
    },
    {
        "BLOCK_SIZE_M": 32,
        "BLOCK_SIZE_N": 128,
        "BLOCK_SIZE_K": 128,
        "GROUP_SIZE_M": 8,
        "num_stages": 2,
        "num_warps": 8,
        "ms": 0.07545622438192368,
        "min_ms": 0.07545622438192368,
        "max_ms": 0.07545622438192368,
        "compile_time": 1.5087974071502686
    },
    {
        "BLOCK_SIZE_M": 256,
        "BLOCK_SIZE_N": 64,
        "BLOCK_SIZE_K": 32,
        "GROUP_SIZE_M": 8,
        "num_stages": 6,
        "num_warps": 16,
        "ms": 0.07548122853040695,
        "min_ms": 0.07548122853040695,
        "max_ms": 0.07548122853040695,
        "compile_time": 1.7688612937927246
    },
    {
        "BLOCK_SIZE_M": 512,
        "BLOCK_SIZE_N": 32,
        "BLOCK_SIZE_K": 32,
        "GROUP_SIZE_M": 8,
        "num_stages": 4,
        "num_warps": 8,
        "ms": 0.07551450282335281,
        "min_ms": 0.07551450282335281,
        "max_ms": 0.07551450282335281,
        "compile_time": 2.227888345718384
    },
    {
        "BLOCK_SIZE_M": 64,
        "BLOCK_SIZE_N": 128,
        "BLOCK_SIZE_K": 32,
        "GROUP_SIZE_M": 8,
        "num_stages": 7,
        "num_warps": 16,
        "ms": 0.07551523298025131,
        "min_ms": 0.07551523298025131,
        "max_ms": 0.07551523298025131,
        "compile_time": 1.4412877559661865
    },
    {
        "BLOCK_SIZE_M": 64,
        "BLOCK_SIZE_N": 64,
        "BLOCK_SIZE_K": 128,
        "GROUP_SIZE_M": 8,
        "num_stages": 3,
        "num_warps": 16,
        "ms": 0.07551856338977814,
        "min_ms": 0.07551856338977814,
        "max_ms": 0.07551856338977814,
        "compile_time": 1.4534845352172852
    },
    {
        "BLOCK_SIZE_M": 128,
        "BLOCK_SIZE_N": 128,
        "BLOCK_SIZE_K": 16,
        "GROUP_SIZE_M": 8,
        "num_stages": 1,
        "num_warps": 4,
        "ms": 0.07552078366279602,
        "min_ms": 0.07552078366279602,
        "max_ms": 0.07552078366279602,
        "compile_time": 1.8816487789154053
    },
    {
        "BLOCK_SIZE_M": 128,
        "BLOCK_SIZE_N": 128,
        "BLOCK_SIZE_K": 64,
        "GROUP_SIZE_M": 8,
        "num_stages": 2,
        "num_warps": 16,
        "ms": 0.07552392035722733,
        "min_ms": 0.07552392035722733,
        "max_ms": 0.07552392035722733,
        "compile_time": 1.6564936637878418
    },
    {
        "BLOCK_SIZE_M": 64,
        "BLOCK_SIZE_N": 128,
        "BLOCK_SIZE_K": 256,
        "GROUP_SIZE_M": 8,
        "num_stages": 2,
        "num_warps": 8,
        "ms": 0.07556857168674469,
        "min_ms": 0.07556857168674469,
        "max_ms": 0.07556857168674469,
        "compile_time": 2.0327579975128174
    },
    {
        "BLOCK_SIZE_M": 256,
        "BLOCK_SIZE_N": 32,
        "BLOCK_SIZE_K": 64,
        "GROUP_SIZE_M": 8,
        "num_stages": 5,
        "num_warps": 16,
        "ms": 0.07558337599039078,
        "min_ms": 0.07558337599039078,
        "max_ms": 0.07558337599039078,
        "compile_time": 1.598618984222412
    },
    {
        "BLOCK_SIZE_M": 32,
        "BLOCK_SIZE_N": 64,
        "BLOCK_SIZE_K": 64,
        "GROUP_SIZE_M": 8,
        "num_stages": 6,
        "num_warps": 2,
        "ms": 0.07560469210147858,
        "min_ms": 0.07560469210147858,
        "max_ms": 0.07560469210147858,
        "compile_time": 1.6964001655578613
    },
    {
        "BLOCK_SIZE_M": 128,
        "BLOCK_SIZE_N": 64,
        "BLOCK_SIZE_K": 16,
        "GROUP_SIZE_M": 8,
        "num_stages": 1,
        "num_warps": 2,
        "ms": 0.07563993334770203,
        "min_ms": 0.07563993334770203,
        "max_ms": 0.07563993334770203,
        "compile_time": 1.8088886737823486
    },
    {
        "BLOCK_SIZE_M": 32,
        "BLOCK_SIZE_N": 128,
        "BLOCK_SIZE_K": 64,
        "GROUP_SIZE_M": 8,
        "num_stages": 7,
        "num_warps": 8,
        "ms": 0.07564345747232437,
        "min_ms": 0.07564345747232437,
        "max_ms": 0.07564345747232437,
        "compile_time": 1.4741263389587402
    },
    {
        "BLOCK_SIZE_M": 32,
        "BLOCK_SIZE_N": 64,
        "BLOCK_SIZE_K": 32,
        "GROUP_SIZE_M": 8,
        "num_stages": 8,
        "num_warps": 4,
        "ms": 0.07566149532794952,
        "min_ms": 0.07566149532794952,
        "max_ms": 0.07566149532794952,
        "compile_time": 1.3839294910430908
    },
    {
        "BLOCK_SIZE_M": 512,
        "BLOCK_SIZE_N": 64,
        "BLOCK_SIZE_K": 32,
        "GROUP_SIZE_M": 8,
        "num_stages": 3,
        "num_warps": 16,
        "ms": 0.07568173110485077,
        "min_ms": 0.07568173110485077,
        "max_ms": 0.07568173110485077,
        "compile_time": 2.5548276901245117
    },
    {
        "BLOCK_SIZE_M": 128,
        "BLOCK_SIZE_N": 32,
        "BLOCK_SIZE_K": 32,
        "GROUP_SIZE_M": 8,
        "num_stages": 2,
        "num_warps": 4,
        "ms": 0.07577046006917953,
        "min_ms": 0.07577046006917953,
        "max_ms": 0.07577046006917953,
        "compile_time": 1.492178201675415
    },
    {
        "BLOCK_SIZE_M": 32,
        "BLOCK_SIZE_N": 64,
        "BLOCK_SIZE_K": 16,
        "GROUP_SIZE_M": 8,
        "num_stages": 5,
        "num_warps": 2,
        "ms": 0.07577671855688095,
        "min_ms": 0.07577671855688095,
        "max_ms": 0.07577671855688095,
        "compile_time": 1.352015495300293
    },
    {
        "BLOCK_SIZE_M": 256,
        "BLOCK_SIZE_N": 64,
        "BLOCK_SIZE_K": 32,
        "GROUP_SIZE_M": 8,
        "num_stages": 7,
        "num_warps": 16,
        "ms": 0.07583198696374893,
        "min_ms": 0.07583198696374893,
        "max_ms": 0.07583198696374893,
        "compile_time": 1.78855299949646
    },
    {
        "BLOCK_SIZE_M": 64,
        "BLOCK_SIZE_N": 32,
        "BLOCK_SIZE_K": 32,
        "GROUP_SIZE_M": 8,
        "num_stages": 6,
        "num_warps": 2,
        "ms": 0.07586394250392914,
        "min_ms": 0.07586394250392914,
        "max_ms": 0.07586394250392914,
        "compile_time": 1.5599627494812012
    },
    {
        "BLOCK_SIZE_M": 256,
        "BLOCK_SIZE_N": 64,
        "BLOCK_SIZE_K": 32,
        "GROUP_SIZE_M": 8,
        "num_stages": 3,
        "num_warps": 16,
        "ms": 0.07589532434940338,
        "min_ms": 0.07589532434940338,
        "max_ms": 0.07589532434940338,
        "compile_time": 1.7114086151123047
    },
    {
        "BLOCK_SIZE_M": 64,
        "BLOCK_SIZE_N": 32,
        "BLOCK_SIZE_K": 32,
        "GROUP_SIZE_M": 8,
        "num_stages": 7,
        "num_warps": 4,
        "ms": 0.0759255439043045,
        "min_ms": 0.0759255439043045,
        "max_ms": 0.0759255439043045,
        "compile_time": 1.4690356254577637
    },
    {
        "BLOCK_SIZE_M": 64,
        "BLOCK_SIZE_N": 64,
        "BLOCK_SIZE_K": 16,
        "GROUP_SIZE_M": 8,
        "num_stages": 1,
        "num_warps": 2,
        "ms": 0.07603640854358673,
        "min_ms": 0.07603640854358673,
        "max_ms": 0.07603640854358673,
        "compile_time": 1.4561829566955566
    },
    {
        "BLOCK_SIZE_M": 32,
        "BLOCK_SIZE_N": 128,
        "BLOCK_SIZE_K": 16,
        "GROUP_SIZE_M": 8,
        "num_stages": 2,
        "num_warps": 2,
        "ms": 0.0760662630200386,
        "min_ms": 0.0760662630200386,
        "max_ms": 0.0760662630200386,
        "compile_time": 1.4320459365844727
    },
    {
        "BLOCK_SIZE_M": 128,
        "BLOCK_SIZE_N": 128,
        "BLOCK_SIZE_K": 16,
        "GROUP_SIZE_M": 8,
        "num_stages": 1,
        "num_warps": 8,
        "ms": 0.07607751339673996,
        "min_ms": 0.07607751339673996,
        "max_ms": 0.07607751339673996,
        "compile_time": 1.7413020133972168
    },
    {
        "BLOCK_SIZE_M": 32,
        "BLOCK_SIZE_N": 128,
        "BLOCK_SIZE_K": 32,
        "GROUP_SIZE_M": 8,
        "num_stages": 5,
        "num_warps": 2,
        "ms": 0.07609923183917999,
        "min_ms": 0.07609923183917999,
        "max_ms": 0.07609923183917999,
        "compile_time": 1.6911742687225342
    },
    {
        "BLOCK_SIZE_M": 128,
        "BLOCK_SIZE_N": 64,
        "BLOCK_SIZE_K": 256,
        "GROUP_SIZE_M": 8,
        "num_stages": 2,
        "num_warps": 8,
        "ms": 0.07611887902021408,
        "min_ms": 0.07611887902021408,
        "max_ms": 0.07611887902021408,
        "compile_time": 2.115640163421631
    },
    {
        "BLOCK_SIZE_M": 64,
        "BLOCK_SIZE_N": 64,
        "BLOCK_SIZE_K": 32,
        "GROUP_SIZE_M": 8,
        "num_stages": 2,
        "num_warps": 8,
        "ms": 0.07613527774810791,
        "min_ms": 0.07613527774810791,
        "max_ms": 0.07613527774810791,
        "compile_time": 1.3949389457702637
    },
    {
        "BLOCK_SIZE_M": 256,
        "BLOCK_SIZE_N": 128,
        "BLOCK_SIZE_K": 16,
        "GROUP_SIZE_M": 8,
        "num_stages": 4,
        "num_warps": 16,
        "ms": 0.07615617662668228,
        "min_ms": 0.07615617662668228,
        "max_ms": 0.07615617662668228,
        "compile_time": 1.7677597999572754
    },
    {
        "BLOCK_SIZE_M": 256,
        "BLOCK_SIZE_N": 128,
        "BLOCK_SIZE_K": 16,
        "GROUP_SIZE_M": 8,
        "num_stages": 6,
        "num_warps": 16,
        "ms": 0.07618414610624313,
        "min_ms": 0.07618414610624313,
        "max_ms": 0.07618414610624313,
        "compile_time": 1.7710144519805908
    },
    {
        "BLOCK_SIZE_M": 64,
        "BLOCK_SIZE_N": 32,
        "BLOCK_SIZE_K": 128,
        "GROUP_SIZE_M": 8,
        "num_stages": 2,
        "num_warps": 2,
        "ms": 0.07624759525060654,
        "min_ms": 0.07624759525060654,
        "max_ms": 0.07624759525060654,
        "compile_time": 1.8717310428619385
    },
    {
        "BLOCK_SIZE_M": 64,
        "BLOCK_SIZE_N": 32,
        "BLOCK_SIZE_K": 64,
        "GROUP_SIZE_M": 8,
        "num_stages": 2,
        "num_warps": 4,
        "ms": 0.07625742256641388,
        "min_ms": 0.07625742256641388,
        "max_ms": 0.07625742256641388,
        "compile_time": 1.4544456005096436
    },
    {
        "BLOCK_SIZE_M": 32,
        "BLOCK_SIZE_N": 512,
        "BLOCK_SIZE_K": 32,
        "GROUP_SIZE_M": 8,
        "num_stages": 4,
        "num_warps": 16,
        "ms": 0.07628985494375229,
        "min_ms": 0.07628985494375229,
        "max_ms": 0.07628985494375229,
        "compile_time": 1.4550721645355225
    },
    {
        "BLOCK_SIZE_M": 128,
        "BLOCK_SIZE_N": 64,
        "BLOCK_SIZE_K": 64,
        "GROUP_SIZE_M": 8,
        "num_stages": 1,
        "num_warps": 16,
        "ms": 0.07636897265911102,
        "min_ms": 0.07636897265911102,
        "max_ms": 0.07636897265911102,
        "compile_time": 1.488152265548706
    },
    {
        "BLOCK_SIZE_M": 128,
        "BLOCK_SIZE_N": 32,
        "BLOCK_SIZE_K": 64,
        "GROUP_SIZE_M": 8,
        "num_stages": 6,
        "num_warps": 8,
        "ms": 0.07637158781290054,
        "min_ms": 0.07637158781290054,
        "max_ms": 0.07637158781290054,
        "compile_time": 1.6358249187469482
    },
    {
        "BLOCK_SIZE_M": 32,
        "BLOCK_SIZE_N": 512,
        "BLOCK_SIZE_K": 32,
        "GROUP_SIZE_M": 8,
        "num_stages": 5,
        "num_warps": 16,
        "ms": 0.07638008892536163,
        "min_ms": 0.07638008892536163,
        "max_ms": 0.07638008892536163,
        "compile_time": 1.4753944873809814
    },
    {
        "BLOCK_SIZE_M": 32,
        "BLOCK_SIZE_N": 128,
        "BLOCK_SIZE_K": 64,
        "GROUP_SIZE_M": 8,
        "num_stages": 3,
        "num_warps": 2,
        "ms": 0.07640685141086578,
        "min_ms": 0.07640685141086578,
        "max_ms": 0.07640685141086578,
        "compile_time": 1.9183456897735596
    },
    {
        "BLOCK_SIZE_M": 128,
        "BLOCK_SIZE_N": 32,
        "BLOCK_SIZE_K": 64,
        "GROUP_SIZE_M": 8,
        "num_stages": 1,
        "num_warps": 4,
        "ms": 0.0764315128326416,
        "min_ms": 0.0764315128326416,
        "max_ms": 0.0764315128326416,
        "compile_time": 1.5949575901031494
    },
    {
        "BLOCK_SIZE_M": 32,
        "BLOCK_SIZE_N": 64,
        "BLOCK_SIZE_K": 64,
        "GROUP_SIZE_M": 8,
        "num_stages": 2,
        "num_warps": 4,
        "ms": 0.07643502205610275,
        "min_ms": 0.07643502205610275,
        "max_ms": 0.07643502205610275,
        "compile_time": 1.3567407131195068
    },
    {
        "BLOCK_SIZE_M": 32,
        "BLOCK_SIZE_N": 128,
        "BLOCK_SIZE_K": 32,
        "GROUP_SIZE_M": 8,
        "num_stages": 6,
        "num_warps": 8,
        "ms": 0.07644177973270416,
        "min_ms": 0.07644177973270416,
        "max_ms": 0.07644177973270416,
        "compile_time": 1.3790743350982666
    },
    {
        "BLOCK_SIZE_M": 512,
        "BLOCK_SIZE_N": 32,
        "BLOCK_SIZE_K": 32,
        "GROUP_SIZE_M": 8,
        "num_stages": 5,
        "num_warps": 8,
        "ms": 0.07648585736751556,
        "min_ms": 0.07648585736751556,
        "max_ms": 0.07648585736751556,
        "compile_time": 2.208775758743286
    },
    {
        "BLOCK_SIZE_M": 256,
        "BLOCK_SIZE_N": 128,
        "BLOCK_SIZE_K": 16,
        "GROUP_SIZE_M": 8,
        "num_stages": 7,
        "num_warps": 16,
        "ms": 0.07649879157543182,
        "min_ms": 0.07649879157543182,
        "max_ms": 0.07649879157543182,
        "compile_time": 1.6644933223724365
    },
    {
        "BLOCK_SIZE_M": 64,
        "BLOCK_SIZE_N": 32,
        "BLOCK_SIZE_K": 64,
        "GROUP_SIZE_M": 8,
        "num_stages": 6,
        "num_warps": 2,
        "ms": 0.07654435932636261,
        "min_ms": 0.07654435932636261,
        "max_ms": 0.07654435932636261,
        "compile_time": 1.762740135192871
    },
    {
        "BLOCK_SIZE_M": 256,
        "BLOCK_SIZE_N": 128,
        "BLOCK_SIZE_K": 16,
        "GROUP_SIZE_M": 8,
        "num_stages": 8,
        "num_warps": 16,
        "ms": 0.07654868066310883,
        "min_ms": 0.07654868066310883,
        "max_ms": 0.07654868066310883,
        "compile_time": 1.8053979873657227
    },
    {
        "BLOCK_SIZE_M": 256,
        "BLOCK_SIZE_N": 64,
        "BLOCK_SIZE_K": 32,
        "GROUP_SIZE_M": 8,
        "num_stages": 5,
        "num_warps": 16,
        "ms": 0.07655395567417145,
        "min_ms": 0.07655395567417145,
        "max_ms": 0.07655395567417145,
        "compile_time": 1.7495758533477783
    },
    {
        "BLOCK_SIZE_M": 256,
        "BLOCK_SIZE_N": 32,
        "BLOCK_SIZE_K": 32,
        "GROUP_SIZE_M": 8,
        "num_stages": 1,
        "num_warps": 4,
        "ms": 0.07656346261501312,
        "min_ms": 0.07656346261501312,
        "max_ms": 0.07656346261501312,
        "compile_time": 2.6963319778442383
    },
    {
        "BLOCK_SIZE_M": 128,
        "BLOCK_SIZE_N": 64,
        "BLOCK_SIZE_K": 64,
        "GROUP_SIZE_M": 8,
        "num_stages": 1,
        "num_warps": 8,
        "ms": 0.07669366896152496,
        "min_ms": 0.07669366896152496,
        "max_ms": 0.07669366896152496,
        "compile_time": 1.5682530403137207
    },
    {
        "BLOCK_SIZE_M": 64,
        "BLOCK_SIZE_N": 128,
        "BLOCK_SIZE_K": 64,
        "GROUP_SIZE_M": 8,
        "num_stages": 1,
        "num_warps": 8,
        "ms": 0.07675526291131973,
        "min_ms": 0.07675526291131973,
        "max_ms": 0.07675526291131973,
        "compile_time": 1.4789133071899414
    },
    {
        "BLOCK_SIZE_M": 64,
        "BLOCK_SIZE_N": 32,
        "BLOCK_SIZE_K": 32,
        "GROUP_SIZE_M": 8,
        "num_stages": 8,
        "num_warps": 2,
        "ms": 0.07675947993993759,
        "min_ms": 0.07675947993993759,
        "max_ms": 0.07675947993993759,
        "compile_time": 1.6006805896759033
    },
    {
        "BLOCK_SIZE_M": 128,
        "BLOCK_SIZE_N": 128,
        "BLOCK_SIZE_K": 128,
        "GROUP_SIZE_M": 8,
        "num_stages": 1,
        "num_warps": 16,
        "ms": 0.07679686695337296,
        "min_ms": 0.07679686695337296,
        "max_ms": 0.07679686695337296,
        "compile_time": 1.6866390705108643
    },
    {
        "BLOCK_SIZE_M": 256,
        "BLOCK_SIZE_N": 128,
        "BLOCK_SIZE_K": 32,
        "GROUP_SIZE_M": 8,
        "num_stages": 1,
        "num_warps": 8,
        "ms": 0.07680198550224304,
        "min_ms": 0.07680198550224304,
        "max_ms": 0.07680198550224304,
        "compile_time": 1.640566349029541
    },
    {
        "BLOCK_SIZE_M": 256,
        "BLOCK_SIZE_N": 64,
        "BLOCK_SIZE_K": 32,
        "GROUP_SIZE_M": 8,
        "num_stages": 8,
        "num_warps": 16,
        "ms": 0.07680841535329819,
        "min_ms": 0.07680841535329819,
        "max_ms": 0.07680841535329819,
        "compile_time": 1.8025498390197754
    },
    {
        "BLOCK_SIZE_M": 32,
        "BLOCK_SIZE_N": 128,
        "BLOCK_SIZE_K": 16,
        "GROUP_SIZE_M": 8,
        "num_stages": 2,
        "num_warps": 4,
        "ms": 0.07681350409984589,
        "min_ms": 0.07681350409984589,
        "max_ms": 0.07681350409984589,
        "compile_time": 1.3419952392578125
    },
    {
        "BLOCK_SIZE_M": 32,
        "BLOCK_SIZE_N": 128,
        "BLOCK_SIZE_K": 256,
        "GROUP_SIZE_M": 8,
        "num_stages": 3,
        "num_warps": 4,
        "ms": 0.07683408260345459,
        "min_ms": 0.07683408260345459,
        "max_ms": 0.07683408260345459,
        "compile_time": 2.9349660873413086
    },
    {
        "BLOCK_SIZE_M": 64,
        "BLOCK_SIZE_N": 128,
        "BLOCK_SIZE_K": 128,
        "GROUP_SIZE_M": 8,
        "num_stages": 1,
        "num_warps": 4,
        "ms": 0.07686706632375717,
        "min_ms": 0.07686706632375717,
        "max_ms": 0.07686706632375717,
        "compile_time": 1.9256489276885986
    },
    {
        "BLOCK_SIZE_M": 32,
        "BLOCK_SIZE_N": 64,
        "BLOCK_SIZE_K": 16,
        "GROUP_SIZE_M": 8,
        "num_stages": 4,
        "num_warps": 2,
        "ms": 0.07688523828983307,
        "min_ms": 0.07688523828983307,
        "max_ms": 0.07688523828983307,
        "compile_time": 1.3403253555297852
    },
    {
        "BLOCK_SIZE_M": 32,
        "BLOCK_SIZE_N": 128,
        "BLOCK_SIZE_K": 32,
        "GROUP_SIZE_M": 8,
        "num_stages": 3,
        "num_warps": 4,
        "ms": 0.07689235359430313,
        "min_ms": 0.07689235359430313,
        "max_ms": 0.07689235359430313,
        "compile_time": 1.4222743511199951
    },
    {
        "BLOCK_SIZE_M": 128,
        "BLOCK_SIZE_N": 128,
        "BLOCK_SIZE_K": 64,
        "GROUP_SIZE_M": 8,
        "num_stages": 1,
        "num_warps": 16,
        "ms": 0.07699816673994064,
        "min_ms": 0.07699816673994064,
        "max_ms": 0.07699816673994064,
        "compile_time": 1.5676774978637695
    },
    {
        "BLOCK_SIZE_M": 32,
        "BLOCK_SIZE_N": 512,
        "BLOCK_SIZE_K": 64,
        "GROUP_SIZE_M": 8,
        "num_stages": 3,
        "num_warps": 8,
        "ms": 0.07699871063232422,
        "min_ms": 0.07699871063232422,
        "max_ms": 0.07699871063232422,
        "compile_time": 1.9651474952697754
    },
    {
        "BLOCK_SIZE_M": 128,
        "BLOCK_SIZE_N": 256,
        "BLOCK_SIZE_K": 32,
        "GROUP_SIZE_M": 8,
        "num_stages": 1,
        "num_warps": 16,
        "ms": 0.07703475654125214,
        "min_ms": 0.07703475654125214,
        "max_ms": 0.07703475654125214,
        "compile_time": 1.6296112537384033
    },
    {
        "BLOCK_SIZE_M": 128,
        "BLOCK_SIZE_N": 64,
        "BLOCK_SIZE_K": 256,
        "GROUP_SIZE_M": 8,
        "num_stages": 2,
        "num_warps": 4,
        "ms": 0.07706640660762787,
        "min_ms": 0.07706640660762787,
        "max_ms": 0.07706640660762787,
        "compile_time": 2.9476869106292725
    },
    {
        "BLOCK_SIZE_M": 32,
        "BLOCK_SIZE_N": 64,
        "BLOCK_SIZE_K": 16,
        "GROUP_SIZE_M": 8,
        "num_stages": 8,
        "num_warps": 2,
        "ms": 0.07712589204311371,
        "min_ms": 0.07712589204311371,
        "max_ms": 0.07712589204311371,
        "compile_time": 1.4037246704101562
    },
    {
        "BLOCK_SIZE_M": 256,
        "BLOCK_SIZE_N": 32,
        "BLOCK_SIZE_K": 64,
        "GROUP_SIZE_M": 8,
        "num_stages": 2,
        "num_warps": 8,
        "ms": 0.07713964581489563,
        "min_ms": 0.07713964581489563,
        "max_ms": 0.07713964581489563,
        "compile_time": 1.6293163299560547
    },
    {
        "BLOCK_SIZE_M": 512,
        "BLOCK_SIZE_N": 32,
        "BLOCK_SIZE_K": 64,
        "GROUP_SIZE_M": 8,
        "num_stages": 3,
        "num_warps": 16,
        "ms": 0.07715217769145966,
        "min_ms": 0.07715217769145966,
        "max_ms": 0.07715217769145966,
        "compile_time": 1.7842257022857666
    },
    {
        "BLOCK_SIZE_M": 32,
        "BLOCK_SIZE_N": 128,
        "BLOCK_SIZE_K": 128,
        "GROUP_SIZE_M": 8,
        "num_stages": 1,
        "num_warps": 4,
        "ms": 0.07724296301603317,
        "min_ms": 0.07724296301603317,
        "max_ms": 0.07724296301603317,
        "compile_time": 1.6398382186889648
    },
    {
        "BLOCK_SIZE_M": 32,
        "BLOCK_SIZE_N": 512,
        "BLOCK_SIZE_K": 64,
        "GROUP_SIZE_M": 8,
        "num_stages": 3,
        "num_warps": 16,
        "ms": 0.07725393027067184,
        "min_ms": 0.07725393027067184,
        "max_ms": 0.07725393027067184,
        "compile_time": 1.58937406539917
    },
    {
        "BLOCK_SIZE_M": 256,
        "BLOCK_SIZE_N": 32,
        "BLOCK_SIZE_K": 128,
        "GROUP_SIZE_M": 8,
        "num_stages": 2,
        "num_warps": 4,
        "ms": 0.077303946018219,
        "min_ms": 0.077303946018219,
        "max_ms": 0.077303946018219,
        "compile_time": 3.2055935859680176
    },
    {
        "BLOCK_SIZE_M": 256,
        "BLOCK_SIZE_N": 32,
        "BLOCK_SIZE_K": 64,
        "GROUP_SIZE_M": 8,
        "num_stages": 2,
        "num_warps": 4,
        "ms": 0.07740291953086853,
        "min_ms": 0.07740291953086853,
        "max_ms": 0.07740291953086853,
        "compile_time": 1.6279313564300537
    },
    {
        "BLOCK_SIZE_M": 128,
        "BLOCK_SIZE_N": 128,
        "BLOCK_SIZE_K": 256,
        "GROUP_SIZE_M": 8,
        "num_stages": 1,
        "num_warps": 16,
        "ms": 0.07744873315095901,
        "min_ms": 0.07744873315095901,
        "max_ms": 0.07744873315095901,
        "compile_time": 1.8837058544158936
    },
    {
        "BLOCK_SIZE_M": 32,
        "BLOCK_SIZE_N": 256,
        "BLOCK_SIZE_K": 16,
        "GROUP_SIZE_M": 8,
        "num_stages": 7,
        "num_warps": 4,
        "ms": 0.07748918235301971,
        "min_ms": 0.07748918235301971,
        "max_ms": 0.07748918235301971,
        "compile_time": 1.5915875434875488
    },
    {
        "BLOCK_SIZE_M": 32,
        "BLOCK_SIZE_N": 256,
        "BLOCK_SIZE_K": 128,
        "GROUP_SIZE_M": 8,
        "num_stages": 2,
        "num_warps": 4,
        "ms": 0.07761330902576447,
        "min_ms": 0.07761330902576447,
        "max_ms": 0.07761330902576447,
        "compile_time": 2.3730084896087646
    },
    {
        "BLOCK_SIZE_M": 32,
        "BLOCK_SIZE_N": 256,
        "BLOCK_SIZE_K": 16,
        "GROUP_SIZE_M": 8,
        "num_stages": 8,
        "num_warps": 4,
        "ms": 0.07779403030872345,
        "min_ms": 0.07779403030872345,
        "max_ms": 0.07779403030872345,
        "compile_time": 1.574974536895752
    },
    {
        "BLOCK_SIZE_M": 32,
        "BLOCK_SIZE_N": 64,
        "BLOCK_SIZE_K": 64,
        "GROUP_SIZE_M": 8,
        "num_stages": 7,
        "num_warps": 2,
        "ms": 0.07787798345088959,
