simdata/FP16-R100/2048_results.json
[
    {
        "BLOCK_SIZE_M": 128,
        "BLOCK_SIZE_N": 128,
        "BLOCK_SIZE_K": 32,
        "GROUP_SIZE_M": 8,
        "num_stages": 4,
        "num_warps": 4,
        "ms": 0.08610044419765472,
        "min_ms": 0.08610044419765472,
        "max_ms": 0.08610044419765472,
        "compile_time": 1.0406289100646973
    },
    {
        "BLOCK_SIZE_M": 128,
        "BLOCK_SIZE_N": 128,
        "BLOCK_SIZE_K": 32,
        "GROUP_SIZE_M": 8,
        "num_stages": 3,
        "num_warps": 4,
        "ms": 0.08619461208581924,
        "min_ms": 0.08619461208581924,
        "max_ms": 0.08619461208581924,
        "compile_time": 1.0330874919891357
    },
    {
        "BLOCK_SIZE_M": 128,
        "BLOCK_SIZE_N": 128,
        "BLOCK_SIZE_K": 32,
        "GROUP_SIZE_M": 8,
        "num_stages": 5,
        "num_warps": 4,
        "ms": 0.08626661449670792,
        "min_ms": 0.08626661449670792,
        "max_ms": 0.08626661449670792,
        "compile_time": 1.042618751525879
    },
    {
        "BLOCK_SIZE_M": 128,
        "BLOCK_SIZE_N": 128,
        "BLOCK_SIZE_K": 32,
        "GROUP_SIZE_M": 8,
        "num_stages": 6,
        "num_warps": 4,
        "ms": 0.0870961993932724,
        "min_ms": 0.0870961993932724,
        "max_ms": 0.0870961993932724,
        "compile_time": 1.0488405227661133
    },
    {
        "BLOCK_SIZE_M": 128,
        "BLOCK_SIZE_N": 128,
        "BLOCK_SIZE_K": 64,
        "GROUP_SIZE_M": 8,
        "num_stages": 3,
        "num_warps": 4,
        "ms": 0.08770225942134857,
        "min_ms": 0.08770225942134857,
        "max_ms": 0.08770225942134857,
        "compile_time": 1.04642653465271
    },
    {
        "BLOCK_SIZE_M": 128,
        "BLOCK_SIZE_N": 128,
        "BLOCK_SIZE_K": 32,
        "GROUP_SIZE_M": 8,
        "num_stages": 7,
        "num_warps": 4,
        "ms": 0.08994843065738678,
        "min_ms": 0.08994843065738678,
        "max_ms": 0.08994843065738678,
        "compile_time": 1.0311031341552734
    },
    {
        "BLOCK_SIZE_M": 128,
        "BLOCK_SIZE_N": 128,
        "BLOCK_SIZE_K": 32,
        "GROUP_SIZE_M": 8,
        "num_stages": 8,
        "num_warps": 4,
        "ms": 0.09028191864490509,
        "min_ms": 0.09028191864490509,
        "max_ms": 0.09028191864490509,
        "compile_time": 2.3684661388397217
    },
    {
        "BLOCK_SIZE_M": 64,
        "BLOCK_SIZE_N": 128,
        "BLOCK_SIZE_K": 32,
        "GROUP_SIZE_M": 8,
        "num_stages": 4,
        "num_warps": 4,
        "ms": 0.0922844409942627,
        "min_ms": 0.0922844409942627,
        "max_ms": 0.0922844409942627,
        "compile_time": 1.0385026931762695
    },
    {
        "BLOCK_SIZE_M": 64,
        "BLOCK_SIZE_N": 256,
        "BLOCK_SIZE_K": 32,
        "GROUP_SIZE_M": 8,
        "num_stages": 5,
        "num_warps": 4,
        "ms": 0.09238822013139725,
        "min_ms": 0.09238822013139725,
        "max_ms": 0.09238822013139725,
        "compile_time": 1.023766279220581
    },
    {
        "BLOCK_SIZE_M": 64,
        "BLOCK_SIZE_N": 256,
        "BLOCK_SIZE_K": 32,
        "GROUP_SIZE_M": 8,
        "num_stages": 3,
        "num_warps": 4,
        "ms": 0.09247507154941559,
        "min_ms": 0.09247507154941559,
        "max_ms": 0.09247507154941559,
        "compile_time": 1.0280323028564453
    },
    {
        "BLOCK_SIZE_M": 128,
        "BLOCK_SIZE_N": 128,
        "BLOCK_SIZE_K": 64,
        "GROUP_SIZE_M": 8,
        "num_stages": 3,
        "num_warps": 8,
        "ms": 0.09288480132818222,
        "min_ms": 0.09288480132818222,
        "max_ms": 0.09288480132818222,
        "compile_time": 1.0578563213348389
    },
    {
        "BLOCK_SIZE_M": 128,
        "BLOCK_SIZE_N": 128,
        "BLOCK_SIZE_K": 64,
        "GROUP_SIZE_M": 8,
        "num_stages": 4,
        "num_warps": 8,
        "ms": 0.09313572943210602,
        "min_ms": 0.09313572943210602,
        "max_ms": 0.09313572943210602,
        "compile_time": 1.0463404655456543
    },
    {
        "BLOCK_SIZE_M": 64,
        "BLOCK_SIZE_N": 128,
        "BLOCK_SIZE_K": 32,
        "GROUP_SIZE_M": 8,
        "num_stages": 5,
        "num_warps": 4,
        "ms": 0.0933106392621994,
        "min_ms": 0.0933106392621994,
        "max_ms": 0.0933106392621994,
        "compile_time": 1.040140151977539
    },
    {
        "BLOCK_SIZE_M": 128,
        "BLOCK_SIZE_N": 128,
        "BLOCK_SIZE_K": 64,
        "GROUP_SIZE_M": 8,
        "num_stages": 5,
        "num_warps": 8,
        "ms": 0.09349443018436432,
        "min_ms": 0.09349443018436432,
        "max_ms": 0.09349443018436432,
        "compile_time": 1.0840554237365723
    },
    {
        "BLOCK_SIZE_M": 128,
        "BLOCK_SIZE_N": 64,
        "BLOCK_SIZE_K": 32,
        "GROUP_SIZE_M": 8,
        "num_stages": 3,
        "num_warps": 4,
        "ms": 0.09383352100849152,
        "min_ms": 0.09383352100849152,
        "max_ms": 0.09383352100849152,
        "compile_time": 1.064298391342163
    },
    {
        "BLOCK_SIZE_M": 128,
        "BLOCK_SIZE_N": 64,
        "BLOCK_SIZE_K": 32,
        "GROUP_SIZE_M": 8,
        "num_stages": 4,
        "num_warps": 4,
        "ms": 0.09395696967840195,
        "min_ms": 0.09395696967840195,
        "max_ms": 0.09395696967840195,
        "compile_time": 1.0690765380859375
    },
    {
        "BLOCK_SIZE_M": 128,
        "BLOCK_SIZE_N": 128,
        "BLOCK_SIZE_K": 64,
        "GROUP_SIZE_M": 8,
        "num_stages": 6,
        "num_warps": 8,
        "ms": 0.09402254968881607,
        "min_ms": 0.09402254968881607,
        "max_ms": 0.09402254968881607,
        "compile_time": 1.061563491821289
    },
    {
        "BLOCK_SIZE_M": 128,
        "BLOCK_SIZE_N": 64,
        "BLOCK_SIZE_K": 32,
        "GROUP_SIZE_M": 8,
        "num_stages": 5,
        "num_warps": 4,
        "ms": 0.09484339505434036,
        "min_ms": 0.09484339505434036,
        "max_ms": 0.09484339505434036,
        "compile_time": 1.0803086757659912
    },
    {
        "BLOCK_SIZE_M": 64,
        "BLOCK_SIZE_N": 256,
        "BLOCK_SIZE_K": 32,
        "GROUP_SIZE_M": 8,
        "num_stages": 4,
        "num_warps": 4,
        "ms": 0.09557942301034927,
        "min_ms": 0.09557942301034927,
        "max_ms": 0.09557942301034927,
        "compile_time": 1.0155322551727295
    },
    {
        "BLOCK_SIZE_M": 64,
        "BLOCK_SIZE_N": 128,
        "BLOCK_SIZE_K": 32,
        "GROUP_SIZE_M": 8,
        "num_stages": 6,
        "num_warps": 4,
        "ms": 0.09561728686094284,
        "min_ms": 0.09561728686094284,
        "max_ms": 0.09561728686094284,
        "compile_time": 1.0294370651245117
    },
    {
        "BLOCK_SIZE_M": 256,
        "BLOCK_SIZE_N": 64,
        "BLOCK_SIZE_K": 32,
        "GROUP_SIZE_M": 8,
        "num_stages": 4,
        "num_warps": 4,
        "ms": 0.09588968008756638,
        "min_ms": 0.09588968008756638,
        "max_ms": 0.09588968008756638,
        "compile_time": 1.094151258468628
    },
    {
        "BLOCK_SIZE_M": 128,
        "BLOCK_SIZE_N": 64,
        "BLOCK_SIZE_K": 32,
        "GROUP_SIZE_M": 8,
        "num_stages": 6,
        "num_warps": 4,
        "ms": 0.0959145799279213,
        "min_ms": 0.0959145799279213,
        "max_ms": 0.0959145799279213,
        "compile_time": 1.0649821758270264
    },
    {
        "BLOCK_SIZE_M": 128,
        "BLOCK_SIZE_N": 64,
        "BLOCK_SIZE_K": 64,
        "GROUP_SIZE_M": 8,
        "num_stages": 4,
        "num_warps": 4,
        "ms": 0.0959458276629448,
        "min_ms": 0.0959458276629448,
        "max_ms": 0.0959458276629448,
        "compile_time": 1.0863935947418213
    },
    {
        "BLOCK_SIZE_M": 64,
        "BLOCK_SIZE_N": 128,
        "BLOCK_SIZE_K": 32,
        "GROUP_SIZE_M": 8,
        "num_stages": 3,
        "num_warps": 4,
        "ms": 0.09630243480205536,
        "min_ms": 0.09630243480205536,
        "max_ms": 0.09630243480205536,
        "compile_time": 1.0712909698486328
    },
    {
        "BLOCK_SIZE_M": 64,
        "BLOCK_SIZE_N": 128,
        "BLOCK_SIZE_K": 32,
        "GROUP_SIZE_M": 8,
        "num_stages": 7,
        "num_warps": 4,
        "ms": 0.0964832603931427,
        "min_ms": 0.0964832603931427,
        "max_ms": 0.0964832603931427,
        "compile_time": 1.0343518257141113
    },
    {
        "BLOCK_SIZE_M": 128,
        "BLOCK_SIZE_N": 128,
        "BLOCK_SIZE_K": 128,
        "GROUP_SIZE_M": 8,
        "num_stages": 3,
        "num_warps": 8,
        "ms": 0.09682245552539825,
        "min_ms": 0.09682245552539825,
        "max_ms": 0.09682245552539825,
        "compile_time": 1.0504157543182373
    },
    {
        "BLOCK_SIZE_M": 256,
        "BLOCK_SIZE_N": 64,
        "BLOCK_SIZE_K": 32,
        "GROUP_SIZE_M": 8,
        "num_stages": 5,
        "num_warps": 4,
        "ms": 0.09687148779630661,
        "min_ms": 0.09687148779630661,
        "max_ms": 0.09687148779630661,
        "compile_time": 1.0998318195343018
    },
    {
        "BLOCK_SIZE_M": 128,
        "BLOCK_SIZE_N": 64,
        "BLOCK_SIZE_K": 32,
        "GROUP_SIZE_M": 8,
        "num_stages": 7,
        "num_warps": 4,
        "ms": 0.09732810407876968,
        "min_ms": 0.09732810407876968,
        "max_ms": 0.09732810407876968,
        "compile_time": 1.075186014175415
    },
    {
        "BLOCK_SIZE_M": 256,
        "BLOCK_SIZE_N": 64,
        "BLOCK_SIZE_K": 64,
        "GROUP_SIZE_M": 8,
        "num_stages": 3,
        "num_warps": 8,
        "ms": 0.09740190207958221,
        "min_ms": 0.09740190207958221,
        "max_ms": 0.09740190207958221,
        "compile_time": 1.093170166015625
    },
    {
        "BLOCK_SIZE_M": 128,
        "BLOCK_SIZE_N": 128,
        "BLOCK_SIZE_K": 64,
        "GROUP_SIZE_M": 8,
        "num_stages": 4,
        "num_warps": 4,
        "ms": 0.09740807116031647,
        "min_ms": 0.09740807116031647,
        "max_ms": 0.09740807116031647,
        "compile_time": 1.0485928058624268
    },
    {
        "BLOCK_SIZE_M": 256,
        "BLOCK_SIZE_N": 64,
        "BLOCK_SIZE_K": 64,
        "GROUP_SIZE_M": 8,
        "num_stages": 4,
        "num_warps": 8,
        "ms": 0.09741580486297607,
        "min_ms": 0.09741580486297607,
        "max_ms": 0.09741580486297607,
        "compile_time": 1.1029844284057617
    },
    {
        "BLOCK_SIZE_M": 128,
        "BLOCK_SIZE_N": 128,
        "BLOCK_SIZE_K": 64,
        "GROUP_SIZE_M": 8,
        "num_stages": 5,
        "num_warps": 4,
        "ms": 0.0975063294172287,
        "min_ms": 0.0975063294172287,
        "max_ms": 0.0975063294172287,
        "compile_time": 1.0808238983154297
    },
    {
        "BLOCK_SIZE_M": 256,
        "BLOCK_SIZE_N": 64,
        "BLOCK_SIZE_K": 32,
        "GROUP_SIZE_M": 8,
        "num_stages": 3,
        "num_warps": 4,
        "ms": 0.09805841743946075,
        "min_ms": 0.09805841743946075,
        "max_ms": 0.09805841743946075,
        "compile_time": 1.0790801048278809
    },
    {
        "BLOCK_SIZE_M": 128,
        "BLOCK_SIZE_N": 128,
        "BLOCK_SIZE_K": 32,
        "GROUP_SIZE_M": 8,
        "num_stages": 6,
        "num_warps": 8,
        "ms": 0.0981801226735115,
        "min_ms": 0.0981801226735115,
        "max_ms": 0.0981801226735115,
        "compile_time": 1.0621466636657715
    },
    {
        "BLOCK_SIZE_M": 64,
        "BLOCK_SIZE_N": 256,
        "BLOCK_SIZE_K": 64,
        "GROUP_SIZE_M": 8,
        "num_stages": 3,
        "num_warps": 8,
        "ms": 0.09825153648853302,
        "min_ms": 0.09825153648853302,
        "max_ms": 0.09825153648853302,
        "compile_time": 1.0182878971099854
    },
    {
        "BLOCK_SIZE_M": 256,
        "BLOCK_SIZE_N": 64,
        "BLOCK_SIZE_K": 64,
        "GROUP_SIZE_M": 8,
        "num_stages": 3,
        "num_warps": 4,
        "ms": 0.09839129447937012,
        "min_ms": 0.09839129447937012,
        "max_ms": 0.09839129447937012,
        "compile_time": 1.091322660446167
    },
    {
        "BLOCK_SIZE_M": 64,
        "BLOCK_SIZE_N": 256,
        "BLOCK_SIZE_K": 64,
        "GROUP_SIZE_M": 8,
        "num_stages": 4,
        "num_warps": 8,
        "ms": 0.0983969122171402,
        "min_ms": 0.0983969122171402,
        "max_ms": 0.0983969122171402,
        "compile_time": 1.0105326175689697
    },
    {
        "BLOCK_SIZE_M": 128,
        "BLOCK_SIZE_N": 128,
        "BLOCK_SIZE_K": 32,
        "GROUP_SIZE_M": 8,
        "num_stages": 7,
        "num_warps": 8,
        "ms": 0.09857939183712006,
        "min_ms": 0.09857939183712006,
        "max_ms": 0.09857939183712006,
        "compile_time": 1.0536606311798096
    },
    {
        "BLOCK_SIZE_M": 128,
        "BLOCK_SIZE_N": 64,
        "BLOCK_SIZE_K": 64,
        "GROUP_SIZE_M": 8,
        "num_stages": 3,
        "num_warps": 4,
        "ms": 0.09870293736457825,
        "min_ms": 0.09870293736457825,
        "max_ms": 0.09870293736457825,
        "compile_time": 1.077695608139038
    },
    {
        "BLOCK_SIZE_M": 64,
        "BLOCK_SIZE_N": 128,
        "BLOCK_SIZE_K": 64,
        "GROUP_SIZE_M": 8,
        "num_stages": 5,
        "num_warps": 4,
        "ms": 0.09880991280078888,
        "min_ms": 0.09880991280078888,
        "max_ms": 0.09880991280078888,
        "compile_time": 1.0359339714050293
    },
    {
        "BLOCK_SIZE_M": 64,
        "BLOCK_SIZE_N": 256,
        "BLOCK_SIZE_K": 64,
        "GROUP_SIZE_M": 8,
        "num_stages": 5,
        "num_warps": 8,
        "ms": 0.09887084364891052,
        "min_ms": 0.09887084364891052,
        "max_ms": 0.09887084364891052,
        "compile_time": 1.033198595046997
    },
    {
        "BLOCK_SIZE_M": 128,
        "BLOCK_SIZE_N": 128,
        "BLOCK_SIZE_K": 64,
        "GROUP_SIZE_M": 8,
        "num_stages": 6,
        "num_warps": 4,
        "ms": 0.09898068010807037,
        "min_ms": 0.09898068010807037,
        "max_ms": 0.09898068010807037,
        "compile_time": 1.0634844303131104
    },
    {
        "BLOCK_SIZE_M": 128,
        "BLOCK_SIZE_N": 128,
        "BLOCK_SIZE_K": 32,
        "GROUP_SIZE_M": 8,
        "num_stages": 5,
        "num_warps": 8,
        "ms": 0.09912741184234619,
        "min_ms": 0.09912741184234619,
        "max_ms": 0.09912741184234619,
        "compile_time": 1.051926612854004
    },
    {
        "BLOCK_SIZE_M": 256,
        "BLOCK_SIZE_N": 64,
        "BLOCK_SIZE_K": 64,
        "GROUP_SIZE_M": 8,
        "num_stages": 5,
        "num_warps": 8,
        "ms": 0.09916965663433075,
        "min_ms": 0.09916965663433075,
        "max_ms": 0.09916965663433075,
        "compile_time": 1.096735954284668
    },
    {
        "BLOCK_SIZE_M": 64,
        "BLOCK_SIZE_N": 128,
        "BLOCK_SIZE_K": 64,
        "GROUP_SIZE_M": 8,
        "num_stages": 3,
        "num_warps": 4,
        "ms": 0.09917844831943512,
        "min_ms": 0.09917844831943512,
        "max_ms": 0.09917844831943512,
        "compile_time": 1.0537896156311035
    },
    {
        "BLOCK_SIZE_M": 128,
        "BLOCK_SIZE_N": 128,
        "BLOCK_SIZE_K": 32,
        "GROUP_SIZE_M": 8,
        "num_stages": 8,
        "num_warps": 8,
        "ms": 0.09947477281093597,
        "min_ms": 0.09947477281093597,
        "max_ms": 0.09947477281093597,
        "compile_time": 1.0603742599487305
    },
    {
        "BLOCK_SIZE_M": 128,
        "BLOCK_SIZE_N": 128,
        "BLOCK_SIZE_K": 32,
        "GROUP_SIZE_M": 8,
        "num_stages": 4,
        "num_warps": 8,
        "ms": 0.09951933473348618,
        "min_ms": 0.09951933473348618,
        "max_ms": 0.09951933473348618,
        "compile_time": 1.071382999420166
    },
    {
        "BLOCK_SIZE_M": 64,
        "BLOCK_SIZE_N": 128,
        "BLOCK_SIZE_K": 64,
        "GROUP_SIZE_M": 8,
        "num_stages": 4,
        "num_warps": 4,
        "ms": 0.09964495897293091,
        "min_ms": 0.09964495897293091,
        "max_ms": 0.09964495897293091,
        "compile_time": 1.0705642700195312
    },
    {
        "BLOCK_SIZE_M": 128,
        "BLOCK_SIZE_N": 64,
        "BLOCK_SIZE_K": 32,
        "GROUP_SIZE_M": 8,
        "num_stages": 4,
        "num_warps": 2,
        "ms": 0.09984446316957474,
        "min_ms": 0.09984446316957474,
        "max_ms": 0.09984446316957474,
        "compile_time": 1.0801830291748047
    },
    {
        "BLOCK_SIZE_M": 64,
        "BLOCK_SIZE_N": 128,
        "BLOCK_SIZE_K": 64,
        "GROUP_SIZE_M": 8,
        "num_stages": 6,
        "num_warps": 4,
        "ms": 0.10029704868793488,
        "min_ms": 0.10029704868793488,
        "max_ms": 0.10029704868793488,
        "compile_time": 1.0113041400909424
    },
    {
        "BLOCK_SIZE_M": 128,
        "BLOCK_SIZE_N": 128,
        "BLOCK_SIZE_K": 64,
        "GROUP_SIZE_M": 8,
        "num_stages": 2,
        "num_warps": 4,
        "ms": 0.10054025799036026,
        "min_ms": 0.10054025799036026,
        "max_ms": 0.10054025799036026,
        "compile_time": 1.0532422065734863
    },
    {
        "BLOCK_SIZE_M": 64,
        "BLOCK_SIZE_N": 128,
        "BLOCK_SIZE_K": 64,
        "GROUP_SIZE_M": 8,
        "num_stages": 4,
        "num_warps": 8,
        "ms": 0.10057252645492554,
        "min_ms": 0.10057252645492554,
        "max_ms": 0.10057252645492554,
        "compile_time": 0.9428532123565674
    },
    {
        "BLOCK_SIZE_M": 64,
        "BLOCK_SIZE_N": 128,
        "BLOCK_SIZE_K": 64,
        "GROUP_SIZE_M": 8,
        "num_stages": 7,
        "num_warps": 4,
        "ms": 0.10062830150127411,
        "min_ms": 0.10062830150127411,
        "max_ms": 0.10062830150127411,
        "compile_time": 1.031341791152954
    },
    {
        "BLOCK_SIZE_M": 128,
        "BLOCK_SIZE_N": 64,
        "BLOCK_SIZE_K": 64,
        "GROUP_SIZE_M": 8,
        "num_stages": 7,
        "num_warps": 4,
        "ms": 0.1006476879119873,
        "min_ms": 0.1006476879119873,
        "max_ms": 0.1006476879119873,
        "compile_time": 1.0757153034210205
    },
    {
        "BLOCK_SIZE_M": 64,
        "BLOCK_SIZE_N": 128,
        "BLOCK_SIZE_K": 64,
        "GROUP_SIZE_M": 8,
        "num_stages": 3,
        "num_warps": 8,
        "ms": 0.10091817378997803,
        "min_ms": 0.10091817378997803,
        "max_ms": 0.10091817378997803,
        "compile_time": 1.0345137119293213
    },
    {
        "BLOCK_SIZE_M": 128,
        "BLOCK_SIZE_N": 64,
        "BLOCK_SIZE_K": 32,
        "GROUP_SIZE_M": 8,
        "num_stages": 5,
        "num_warps": 2,
        "ms": 0.10145775228738785,
        "min_ms": 0.10145775228738785,
        "max_ms": 0.10145775228738785,
        "compile_time": 1.0694522857666016
    },
    {
        "BLOCK_SIZE_M": 64,
        "BLOCK_SIZE_N": 128,
        "BLOCK_SIZE_K": 32,
        "GROUP_SIZE_M": 8,
        "num_stages": 8,
        "num_warps": 4,
        "ms": 0.10156391561031342,
        "min_ms": 0.10156391561031342,
        "max_ms": 0.10156391561031342,
        "compile_time": 1.0276260375976562
    },
    {
        "BLOCK_SIZE_M": 128,
        "BLOCK_SIZE_N": 64,
        "BLOCK_SIZE_K": 64,
        "GROUP_SIZE_M": 8,
        "num_stages": 4,
        "num_warps": 8,
        "ms": 0.10169915854930878,
        "min_ms": 0.10169915854930878,
        "max_ms": 0.10169915854930878,
        "compile_time": 1.0839166641235352
    },
    {
        "BLOCK_SIZE_M": 256,
        "BLOCK_SIZE_N": 64,
        "BLOCK_SIZE_K": 128,
        "GROUP_SIZE_M": 8,
        "num_stages": 3,
        "num_warps": 8,
        "ms": 0.10173551738262177,
        "min_ms": 0.10173551738262177,
        "max_ms": 0.10173551738262177,
        "compile_time": 1.0658807754516602
    },
    {
        "BLOCK_SIZE_M": 128,
        "BLOCK_SIZE_N": 64,
        "BLOCK_SIZE_K": 64,
        "GROUP_SIZE_M": 8,
        "num_stages": 3,
        "num_warps": 8,
        "ms": 0.10176442563533783,
        "min_ms": 0.10176442563533783,
        "max_ms": 0.10176442563533783,
        "compile_time": 1.0786283016204834
    },
    {
        "BLOCK_SIZE_M": 64,
        "BLOCK_SIZE_N": 256,
        "BLOCK_SIZE_K": 32,
        "GROUP_SIZE_M": 8,
        "num_stages": 4,
        "num_warps": 8,
        "ms": 0.10177738964557648,
        "min_ms": 0.10177738964557648,
        "max_ms": 0.10177738964557648,
        "compile_time": 1.0309128761291504
    },
    {
        "BLOCK_SIZE_M": 64,
        "BLOCK_SIZE_N": 256,
        "BLOCK_SIZE_K": 32,
        "GROUP_SIZE_M": 8,
        "num_stages": 6,
        "num_warps": 8,
        "ms": 0.1019023060798645,
        "min_ms": 0.1019023060798645,
        "max_ms": 0.1019023060798645,
        "compile_time": 1.0323529243469238
    },
    {
        "BLOCK_SIZE_M": 64,
        "BLOCK_SIZE_N": 256,
        "BLOCK_SIZE_K": 32,
        "GROUP_SIZE_M": 8,
        "num_stages": 5,
        "num_warps": 8,
        "ms": 0.10209999233484268,
        "min_ms": 0.10209999233484268,
        "max_ms": 0.10209999233484268,
        "compile_time": 1.023655652999878
    },
    {
        "BLOCK_SIZE_M": 64,
        "BLOCK_SIZE_N": 256,
        "BLOCK_SIZE_K": 32,
        "GROUP_SIZE_M": 8,
        "num_stages": 7,
        "num_warps": 8,
        "ms": 0.10251790285110474,
        "min_ms": 0.10251790285110474,
        "max_ms": 0.10251790285110474,
        "compile_time": 1.0226914882659912
    },
    {
        "BLOCK_SIZE_M": 128,
        "BLOCK_SIZE_N": 128,
        "BLOCK_SIZE_K": 32,
        "GROUP_SIZE_M": 8,
        "num_stages": 3,
        "num_warps": 8,
        "ms": 0.10269157588481903,
        "min_ms": 0.10269157588481903,
        "max_ms": 0.10269157588481903,
        "compile_time": 1.0256080627441406
    },
    {
        "BLOCK_SIZE_M": 256,
        "BLOCK_SIZE_N": 64,
        "BLOCK_SIZE_K": 32,
        "GROUP_SIZE_M": 8,
        "num_stages": 6,
        "num_warps": 4,
        "ms": 0.10305466502904892,
        "min_ms": 0.10305466502904892,
        "max_ms": 0.10305466502904892,
        "compile_time": 1.0882301330566406
    },
    {
        "BLOCK_SIZE_M": 128,
        "BLOCK_SIZE_N": 64,
        "BLOCK_SIZE_K": 128,
        "GROUP_SIZE_M": 8,
        "num_stages": 3,
        "num_warps": 4,
        "ms": 0.10324816405773163,
        "min_ms": 0.10324816405773163,
        "max_ms": 0.10324816405773163,
        "compile_time": 1.0570826530456543
    },
    {
        "BLOCK_SIZE_M": 128,
        "BLOCK_SIZE_N": 64,
        "BLOCK_SIZE_K": 64,
        "GROUP_SIZE_M": 8,
        "num_stages": 5,
        "num_warps": 4,
        "ms": 0.1034293919801712,
        "min_ms": 0.1034293919801712,
        "max_ms": 0.1034293919801712,
        "compile_time": 1.0676703453063965
    },
    {
        "BLOCK_SIZE_M": 64,
        "BLOCK_SIZE_N": 256,
        "BLOCK_SIZE_K": 64,
        "GROUP_SIZE_M": 8,
        "num_stages": 3,
        "num_warps": 4,
        "ms": 0.10361786931753159,
        "min_ms": 0.10361786931753159,
        "max_ms": 0.10361786931753159,
        "compile_time": 1.0334229469299316
    },
    {
        "BLOCK_SIZE_M": 128,
        "BLOCK_SIZE_N": 64,
        "BLOCK_SIZE_K": 32,
        "GROUP_SIZE_M": 8,
        "num_stages": 8,
        "num_warps": 4,
        "ms": 0.10367586463689804,
        "min_ms": 0.10367586463689804,
        "max_ms": 0.10367586463689804,
        "compile_time": 1.066054105758667
    },
    {
        "BLOCK_SIZE_M": 64,
        "BLOCK_SIZE_N": 256,
        "BLOCK_SIZE_K": 32,
        "GROUP_SIZE_M": 8,
        "num_stages": 8,
        "num_warps": 8,
        "ms": 0.10372011363506317,
        "min_ms": 0.10372011363506317,
        "max_ms": 0.10372011363506317,
        "compile_time": 1.0256056785583496
    },
    {
        "BLOCK_SIZE_M": 64,
        "BLOCK_SIZE_N": 256,
        "BLOCK_SIZE_K": 32,
        "GROUP_SIZE_M": 8,
        "num_stages": 3,
        "num_warps": 8,
        "ms": 0.10372841358184814,
        "min_ms": 0.10372841358184814,
        "max_ms": 0.10372841358184814,
        "compile_time": 1.0255827903747559
    },
    {
        "BLOCK_SIZE_M": 256,
        "BLOCK_SIZE_N": 64,
        "BLOCK_SIZE_K": 32,
        "GROUP_SIZE_M": 8,
        "num_stages": 7,
        "num_warps": 4,
        "ms": 0.10395987331867218,
        "min_ms": 0.10395987331867218,
        "max_ms": 0.10395987331867218,
        "compile_time": 1.115722417831421
    },
    {
        "BLOCK_SIZE_M": 128,
        "BLOCK_SIZE_N": 64,
        "BLOCK_SIZE_K": 64,
        "GROUP_SIZE_M": 8,
        "num_stages": 6,
        "num_warps": 4,
        "ms": 0.10401614755392075,
        "min_ms": 0.10401614755392075,
        "max_ms": 0.10401614755392075,
        "compile_time": 1.076789379119873
    },
    {
        "BLOCK_SIZE_M": 64,
        "BLOCK_SIZE_N": 128,
        "BLOCK_SIZE_K": 128,
        "GROUP_SIZE_M": 8,
        "num_stages": 3,
        "num_warps": 4,
        "ms": 0.10418438911437988,
        "min_ms": 0.10418438911437988,
        "max_ms": 0.10418438911437988,
        "compile_time": 1.0293495655059814
    },
    {
        "BLOCK_SIZE_M": 256,
        "BLOCK_SIZE_N": 64,
        "BLOCK_SIZE_K": 64,
        "GROUP_SIZE_M": 8,
        "num_stages": 5,
        "num_warps": 4,
        "ms": 0.10423757880926132,
        "min_ms": 0.10423757880926132,
        "max_ms": 0.10423757880926132,
        "compile_time": 1.0811424255371094
    },
    {
        "BLOCK_SIZE_M": 64,
        "BLOCK_SIZE_N": 128,
        "BLOCK_SIZE_K": 32,
        "GROUP_SIZE_M": 8,
        "num_stages": 4,
        "num_warps": 2,
        "ms": 0.10436513274908066,
        "min_ms": 0.10436513274908066,
        "max_ms": 0.10436513274908066,
        "compile_time": 1.0530788898468018
    },
    {
        "BLOCK_SIZE_M": 256,
        "BLOCK_SIZE_N": 128,
        "BLOCK_SIZE_K": 32,
        "GROUP_SIZE_M": 8,
        "num_stages": 4,
        "num_warps": 8,
        "ms": 0.10484979301691055,
        "min_ms": 0.10484979301691055,
        "max_ms": 0.10484979301691055,
        "compile_time": 1.0873055458068848
    },
    {
        "BLOCK_SIZE_M": 256,
        "BLOCK_SIZE_N": 64,
        "BLOCK_SIZE_K": 32,
        "GROUP_SIZE_M": 8,
        "num_stages": 8,
        "num_warps": 4,
        "ms": 0.10492732375860214,
        "min_ms": 0.10492732375860214,
        "max_ms": 0.10492732375860214,
        "compile_time": 2.598177671432495
    },
    {
        "BLOCK_SIZE_M": 128,
        "BLOCK_SIZE_N": 64,
        "BLOCK_SIZE_K": 128,
        "GROUP_SIZE_M": 8,
        "num_stages": 4,
        "num_warps": 4,
        "ms": 0.10500039905309677,
        "min_ms": 0.10500039905309677,
        "max_ms": 0.10500039905309677,
        "compile_time": 1.0573997497558594
    },
    {
        "BLOCK_SIZE_M": 64,
        "BLOCK_SIZE_N": 128,
        "BLOCK_SIZE_K": 128,
        "GROUP_SIZE_M": 8,
        "num_stages": 4,
        "num_warps": 4,
        "ms": 0.10519615560770035,
        "min_ms": 0.10519615560770035,
        "max_ms": 0.10519615560770035,
        "compile_time": 1.0390992164611816
    },
    {
        "BLOCK_SIZE_M": 128,
        "BLOCK_SIZE_N": 256,
        "BLOCK_SIZE_K": 32,
        "GROUP_SIZE_M": 8,
        "num_stages": 4,
        "num_warps": 8,
        "ms": 0.105476975440979,
        "min_ms": 0.105476975440979,
        "max_ms": 0.105476975440979,
        "compile_time": 1.0335698127746582
    },
    {
        "BLOCK_SIZE_M": 64,
        "BLOCK_SIZE_N": 128,
        "BLOCK_SIZE_K": 32,
        "GROUP_SIZE_M": 8,
        "num_stages": 6,
        "num_warps": 2,
        "ms": 0.10576440393924713,
        "min_ms": 0.10576440393924713,
        "max_ms": 0.10576440393924713,
        "compile_time": 1.019918441772461
    },
    {
        "BLOCK_SIZE_M": 128,
        "BLOCK_SIZE_N": 256,
        "BLOCK_SIZE_K": 32,
        "GROUP_SIZE_M": 8,
        "num_stages": 5,
        "num_warps": 8,
        "ms": 0.10577122122049332,
        "min_ms": 0.10577122122049332,
        "max_ms": 0.10577122122049332,
        "compile_time": 1.0759563446044922
    },
    {
        "BLOCK_SIZE_M": 128,
        "BLOCK_SIZE_N": 64,
        "BLOCK_SIZE_K": 32,
        "GROUP_SIZE_M": 8,
        "num_stages": 6,
        "num_warps": 2,
        "ms": 0.10579310357570648,
        "min_ms": 0.10579310357570648,
        "max_ms": 0.10579310357570648,
        "compile_time": 1.0544428825378418
    },
    {
        "BLOCK_SIZE_M": 128,
        "BLOCK_SIZE_N": 256,
        "BLOCK_SIZE_K": 32,
        "GROUP_SIZE_M": 8,
        "num_stages": 3,
        "num_warps": 8,
        "ms": 0.10599388927221298,
        "min_ms": 0.10599388927221298,
        "max_ms": 0.10599388927221298,
        "compile_time": 1.0538256168365479
    },
    {
        "BLOCK_SIZE_M": 128,
        "BLOCK_SIZE_N": 256,
        "BLOCK_SIZE_K": 32,
        "GROUP_SIZE_M": 8,
        "num_stages": 6,
        "num_warps": 8,
        "ms": 0.10603497177362442,
        "min_ms": 0.10603497177362442,
        "max_ms": 0.10603497177362442,
        "compile_time": 1.0521104335784912
    },
    {
        "BLOCK_SIZE_M": 64,
        "BLOCK_SIZE_N": 256,
        "BLOCK_SIZE_K": 128,
        "GROUP_SIZE_M": 8,
        "num_stages": 3,
        "num_warps": 8,
        "ms": 0.10606175661087036,
        "min_ms": 0.10606175661087036,
        "max_ms": 0.10606175661087036,
        "compile_time": 1.011807918548584
    },
    {
        "BLOCK_SIZE_M": 256,
        "BLOCK_SIZE_N": 128,
        "BLOCK_SIZE_K": 32,
        "GROUP_SIZE_M": 8,
        "num_stages": 6,
        "num_warps": 8,
        "ms": 0.106128990650177,
        "min_ms": 0.106128990650177,
        "max_ms": 0.106128990650177,
        "compile_time": 2.3479623794555664
    },
    {
        "BLOCK_SIZE_M": 256,
        "BLOCK_SIZE_N": 128,
        "BLOCK_SIZE_K": 32,
        "GROUP_SIZE_M": 8,
        "num_stages": 3,
        "num_warps": 8,
        "ms": 0.10635358095169067,
        "min_ms": 0.10635358095169067,
        "max_ms": 0.10635358095169067,
        "compile_time": 1.0909655094146729
    },
    {
        "BLOCK_SIZE_M": 128,
        "BLOCK_SIZE_N": 64,
        "BLOCK_SIZE_K": 32,
        "GROUP_SIZE_M": 8,
        "num_stages": 7,
        "num_warps": 2,
        "ms": 0.10652148723602295,
        "min_ms": 0.10652148723602295,
        "max_ms": 0.10652148723602295,
        "compile_time": 1.0815434455871582
    },
    {
        "BLOCK_SIZE_M": 64,
        "BLOCK_SIZE_N": 128,
        "BLOCK_SIZE_K": 32,
        "GROUP_SIZE_M": 8,
        "num_stages": 7,
        "num_warps": 2,
        "ms": 0.1065998524427414,
        "min_ms": 0.1065998524427414,
        "max_ms": 0.1065998524427414,
        "compile_time": 1.034468412399292
    },
    {
        "BLOCK_SIZE_M": 128,
        "BLOCK_SIZE_N": 64,
        "BLOCK_SIZE_K": 128,
        "GROUP_SIZE_M": 8,
        "num_stages": 3,
        "num_warps": 8,
        "ms": 0.10671713203191757,
        "min_ms": 0.10671713203191757,
        "max_ms": 0.10671713203191757,
        "compile_time": 1.073310375213623
    },
    {
        "BLOCK_SIZE_M": 128,
        "BLOCK_SIZE_N": 256,
        "BLOCK_SIZE_K": 32,
        "GROUP_SIZE_M": 8,
        "num_stages": 7,
        "num_warps": 8,
        "ms": 0.10672470182180405,
        "min_ms": 0.10672470182180405,
        "max_ms": 0.10672470182180405,
        "compile_time": 2.220125436782837
    },
    {
        "BLOCK_SIZE_M": 256,
        "BLOCK_SIZE_N": 128,
        "BLOCK_SIZE_K": 32,
        "GROUP_SIZE_M": 8,
        "num_stages": 5,
        "num_warps": 8,
        "ms": 0.10686836391687393,
        "min_ms": 0.10686836391687393,
        "max_ms": 0.10686836391687393,
        "compile_time": 1.1018257141113281
    },
    {
        "BLOCK_SIZE_M": 256,
        "BLOCK_SIZE_N": 128,
        "BLOCK_SIZE_K": 32,
        "GROUP_SIZE_M": 8,
        "num_stages": 7,
        "num_warps": 8,
        "ms": 0.10691173374652863,
        "min_ms": 0.10691173374652863,
        "max_ms": 0.10691173374652863,
        "compile_time": 2.3840067386627197
    },
    {
        "BLOCK_SIZE_M": 64,
        "BLOCK_SIZE_N": 128,
        "BLOCK_SIZE_K": 128,
        "GROUP_SIZE_M": 8,
        "num_stages": 3,
        "num_warps": 8,
        "ms": 0.10738395154476166,
        "min_ms": 0.10738395154476166,
        "max_ms": 0.10738395154476166,
        "compile_time": 1.03908109664917
    },
    {
        "BLOCK_SIZE_M": 64,
        "BLOCK_SIZE_N": 128,
        "BLOCK_SIZE_K": 64,
        "GROUP_SIZE_M": 8,
        "num_stages": 5,
        "num_warps": 8,
        "ms": 0.10768630355596542,
        "min_ms": 0.10768630355596542,
        "max_ms": 0.10768630355596542,
        "compile_time": 1.0405247211456299
    },
    {
        "BLOCK_SIZE_M": 128,
        "BLOCK_SIZE_N": 64,
        "BLOCK_SIZE_K": 128,
        "GROUP_SIZE_M": 8,
        "num_stages": 4,
        "num_warps": 8,
        "ms": 0.1076863631606102,
        "min_ms": 0.1076863631606102,
        "max_ms": 0.1076863631606102,
        "compile_time": 1.0601410865783691
    },
    {
        "BLOCK_SIZE_M": 128,
        "BLOCK_SIZE_N": 64,
        "BLOCK_SIZE_K": 64,
        "GROUP_SIZE_M": 8,
        "num_stages": 2,
        "num_warps": 4,
        "ms": 0.10784145444631577,
        "min_ms": 0.10784145444631577,
        "max_ms": 0.10784145444631577,
        "compile_time": 1.0709872245788574
    },
    {
        "BLOCK_SIZE_M": 128,
        "BLOCK_SIZE_N": 64,
        "BLOCK_SIZE_K": 64,
        "GROUP_SIZE_M": 8,
        "num_stages": 5,
        "num_warps": 8,
        "ms": 0.10801069438457489,
        "min_ms": 0.10801069438457489,
        "max_ms": 0.10801069438457489,
        "compile_time": 1.074235439300537
    },
    {
        "BLOCK_SIZE_M": 128,
        "BLOCK_SIZE_N": 128,
        "BLOCK_SIZE_K": 128,
        "GROUP_SIZE_M": 8,
        "num_stages": 3,
        "num_warps": 16,
        "ms": 0.10807687044143677,
        "min_ms": 0.10807687044143677,
        "max_ms": 0.10807687044143677,
        "compile_time": 1.0745456218719482
    },
    {
        "BLOCK_SIZE_M": 64,
        "BLOCK_SIZE_N": 128,
        "BLOCK_SIZE_K": 32,
        "GROUP_SIZE_M": 8,
        "num_stages": 2,
        "num_warps": 4,
        "ms": 0.10811394453048706,
        "min_ms": 0.10811394453048706,
        "max_ms": 0.10811394453048706,
        "compile_time": 0.9891643524169922
    },
    {
        "BLOCK_SIZE_M": 64,
        "BLOCK_SIZE_N": 256,
        "BLOCK_SIZE_K": 32,
        "GROUP_SIZE_M": 8,
        "num_stages": 7,
        "num_warps": 4,
        "ms": 0.10816249996423721,
        "min_ms": 0.10816249996423721,
        "max_ms": 0.10816249996423721,
        "compile_time": 1.033606767654419
    },
    {
        "BLOCK_SIZE_M": 64,
        "BLOCK_SIZE_N": 128,
        "BLOCK_SIZE_K": 32,
        "GROUP_SIZE_M": 8,
        "num_stages": 5,
        "num_warps": 2,
        "ms": 0.10820736736059189,
        "min_ms": 0.10820736736059189,
        "max_ms": 0.10820736736059189,
        "compile_time": 1.0244972705841064
    },
    {
        "BLOCK_SIZE_M": 64,
        "BLOCK_SIZE_N": 128,
        "BLOCK_SIZE_K": 128,
        "GROUP_SIZE_M": 8,
        "num_stages": 4,
        "num_warps": 8,
        "ms": 0.10826017707586288,
        "min_ms": 0.10826017707586288,
        "max_ms": 0.10826017707586288,
        "compile_time": 1.0412328243255615
    },
    {
        "BLOCK_SIZE_M": 64,
        "BLOCK_SIZE_N": 256,
        "BLOCK_SIZE_K": 32,
        "GROUP_SIZE_M": 8,
        "num_stages": 6,
        "num_warps": 4,
        "ms": 0.10835442692041397,
        "min_ms": 0.10835442692041397,
        "max_ms": 0.10835442692041397,
        "compile_time": 1.0234129428863525
    },
    {
        "BLOCK_SIZE_M": 64,
        "BLOCK_SIZE_N": 128,
        "BLOCK_SIZE_K": 32,
        "GROUP_SIZE_M": 8,
        "num_stages": 4,
        "num_warps": 8,
        "ms": 0.1088666170835495,
        "min_ms": 0.1088666170835495,
        "max_ms": 0.1088666170835495,
        "compile_time": 1.0458014011383057
    },
    {
        "BLOCK_SIZE_M": 64,
        "BLOCK_SIZE_N": 256,
        "BLOCK_SIZE_K": 32,
        "GROUP_SIZE_M": 8,
        "num_stages": 8,
        "num_warps": 4,
        "ms": 0.10888512432575226,
        "min_ms": 0.10888512432575226,
        "max_ms": 0.10888512432575226,
        "compile_time": 2.4021365642547607
    },
    {
        "BLOCK_SIZE_M": 256,
        "BLOCK_SIZE_N": 64,
        "BLOCK_SIZE_K": 64,
        "GROUP_SIZE_M": 8,
        "num_stages": 4,
        "num_warps": 4,
        "ms": 0.1090247631072998,
        "min_ms": 0.1090247631072998,
        "max_ms": 0.1090247631072998,
        "compile_time": 1.0786762237548828
    },
    {
        "BLOCK_SIZE_M": 64,
        "BLOCK_SIZE_N": 128,
        "BLOCK_SIZE_K": 32,
        "GROUP_SIZE_M": 8,
        "num_stages": 3,
        "num_warps": 8,
        "ms": 0.1091294065117836,
        "min_ms": 0.1091294065117836,
        "max_ms": 0.1091294065117836,
        "compile_time": 1.0386085510253906
    },
    {
        "BLOCK_SIZE_M": 64,
        "BLOCK_SIZE_N": 128,
        "BLOCK_SIZE_K": 64,
        "GROUP_SIZE_M": 8,
        "num_stages": 6,
        "num_warps": 8,
        "ms": 0.10928163677453995,
        "min_ms": 0.10928163677453995,
        "max_ms": 0.10928163677453995,
        "compile_time": 1.0212299823760986
    },
    {
        "BLOCK_SIZE_M": 64,
        "BLOCK_SIZE_N": 128,
        "BLOCK_SIZE_K": 32,
        "GROUP_SIZE_M": 8,
        "num_stages": 5,
        "num_warps": 8,
        "ms": 0.10934553295373917,
        "min_ms": 0.10934553295373917,
        "max_ms": 0.10934553295373917,
        "compile_time": 1.0574870109558105
    },
    {
        "BLOCK_SIZE_M": 64,
        "BLOCK_SIZE_N": 128,
        "BLOCK_SIZE_K": 32,
        "GROUP_SIZE_M": 8,
        "num_stages": 6,
        "num_warps": 8,
        "ms": 0.10934603214263916,
        "min_ms": 0.10934603214263916,
        "max_ms": 0.10934603214263916,
        "compile_time": 1.0409924983978271
    },
    {
        "BLOCK_SIZE_M": 64,
        "BLOCK_SIZE_N": 256,
        "BLOCK_SIZE_K": 16,
        "GROUP_SIZE_M": 8,
        "num_stages": 6,
        "num_warps": 4,
        "ms": 0.10955461114645004,
        "min_ms": 0.10955461114645004,
        "max_ms": 0.10955461114645004,
        "compile_time": 2.0085270404815674
    },
    {
        "BLOCK_SIZE_M": 64,
        "BLOCK_SIZE_N": 128,
        "BLOCK_SIZE_K": 64,
        "GROUP_SIZE_M": 8,
        "num_stages": 7,
        "num_warps": 8,
        "ms": 0.10983258485794067,
        "min_ms": 0.10983258485794067,
        "max_ms": 0.10983258485794067,
        "compile_time": 1.0480661392211914
    },
    {
        "BLOCK_SIZE_M": 128,
        "BLOCK_SIZE_N": 64,
        "BLOCK_SIZE_K": 64,
        "GROUP_SIZE_M": 8,
        "num_stages": 6,
        "num_warps": 8,
        "ms": 0.10995116084814072,
        "min_ms": 0.10995116084814072,
        "max_ms": 0.10995116084814072,
        "compile_time": 1.0858914852142334
    },
    {
        "BLOCK_SIZE_M": 64,
        "BLOCK_SIZE_N": 256,
        "BLOCK_SIZE_K": 16,
        "GROUP_SIZE_M": 8,
        "num_stages": 7,
        "num_warps": 4,
        "ms": 0.11006436496973038,
        "min_ms": 0.11006436496973038,
        "max_ms": 0.11006436496973038,
        "compile_time": 2.0336592197418213
    },
    {
        "BLOCK_SIZE_M": 256,
        "BLOCK_SIZE_N": 64,
        "BLOCK_SIZE_K": 32,
        "GROUP_SIZE_M": 8,
        "num_stages": 4,
        "num_warps": 8,
        "ms": 0.11020152270793915,
        "min_ms": 0.11020152270793915,
        "max_ms": 0.11020152270793915,
        "compile_time": 1.0900440216064453
    },
    {
        "BLOCK_SIZE_M": 128,
        "BLOCK_SIZE_N": 64,
        "BLOCK_SIZE_K": 64,
        "GROUP_SIZE_M": 8,
        "num_stages": 7,
        "num_warps": 8,
        "ms": 0.11028628051280975,
        "min_ms": 0.11028628051280975,
        "max_ms": 0.11028628051280975,
        "compile_time": 1.083845853805542
    },
    {
        "BLOCK_SIZE_M": 256,
        "BLOCK_SIZE_N": 64,
        "BLOCK_SIZE_K": 32,
        "GROUP_SIZE_M": 8,
        "num_stages": 5,
        "num_warps": 8,
        "ms": 0.11030777543783188,
        "min_ms": 0.11030777543783188,
        "max_ms": 0.11030777543783188,
        "compile_time": 1.1118669509887695
    },
    {
        "BLOCK_SIZE_M": 64,
        "BLOCK_SIZE_N": 128,
        "BLOCK_SIZE_K": 32,
        "GROUP_SIZE_M": 8,
        "num_stages": 7,
        "num_warps": 8,
        "ms": 0.11046828329563141,
        "min_ms": 0.11046828329563141,
        "max_ms": 0.11046828329563141,
        "compile_time": 1.0377376079559326
    },
    {
        "BLOCK_SIZE_M": 128,
        "BLOCK_SIZE_N": 64,
        "BLOCK_SIZE_K": 32,
        "GROUP_SIZE_M": 8,
        "num_stages": 6,
        "num_warps": 8,
        "ms": 0.11100810766220093,
        "min_ms": 0.11100810766220093,
        "max_ms": 0.11100810766220093,
        "compile_time": 1.0879614353179932
    },
    {
        "BLOCK_SIZE_M": 256,
        "BLOCK_SIZE_N": 64,
        "BLOCK_SIZE_K": 32,
        "GROUP_SIZE_M": 8,
        "num_stages": 6,
        "num_warps": 8,
        "ms": 0.11102092266082764,
        "min_ms": 0.11102092266082764,
        "max_ms": 0.11102092266082764,
        "compile_time": 1.1109914779663086
    },
    {
        "BLOCK_SIZE_M": 64,
        "BLOCK_SIZE_N": 256,
        "BLOCK_SIZE_K": 16,
        "GROUP_SIZE_M": 8,
        "num_stages": 8,
        "num_warps": 4,
        "ms": 0.1110563725233078,
        "min_ms": 0.1110563725233078,
        "max_ms": 0.1110563725233078,
        "compile_time": 2.052339792251587
    },
    {
        "BLOCK_SIZE_M": 128,
        "BLOCK_SIZE_N": 128,
        "BLOCK_SIZE_K": 128,
        "GROUP_SIZE_M": 8,
        "num_stages": 3,
        "num_warps": 4,
        "ms": 0.11127625405788422,
        "min_ms": 0.11127625405788422,
        "max_ms": 0.11127625405788422,
        "compile_time": 1.0479905605316162
    },
    {
        "BLOCK_SIZE_M": 128,
        "BLOCK_SIZE_N": 64,
        "BLOCK_SIZE_K": 32,
        "GROUP_SIZE_M": 8,
        "num_stages": 4,
        "num_warps": 8,
        "ms": 0.11132389307022095,
        "min_ms": 0.11132389307022095,
        "max_ms": 0.11132389307022095,
        "compile_time": 1.0886547565460205
    },
    {
        "BLOCK_SIZE_M": 256,
        "BLOCK_SIZE_N": 64,
        "BLOCK_SIZE_K": 32,
        "GROUP_SIZE_M": 8,
        "num_stages": 7,
        "num_warps": 8,
        "ms": 0.11155307292938232,
        "min_ms": 0.11155307292938232,
        "max_ms": 0.11155307292938232,
        "compile_time": 1.0983972549438477
    },
    {
        "BLOCK_SIZE_M": 128,
        "BLOCK_SIZE_N": 64,
        "BLOCK_SIZE_K": 32,
        "GROUP_SIZE_M": 8,
        "num_stages": 5,
        "num_warps": 8,
        "ms": 0.11171631515026093,
        "min_ms": 0.11171631515026093,
        "max_ms": 0.11171631515026093,
        "compile_time": 0.9809772968292236
    },
    {
        "BLOCK_SIZE_M": 128,
        "BLOCK_SIZE_N": 64,
        "BLOCK_SIZE_K": 32,
        "GROUP_SIZE_M": 8,
        "num_stages": 7,
        "num_warps": 8,
        "ms": 0.11201731115579605,
        "min_ms": 0.11201731115579605,
        "max_ms": 0.11201731115579605,
        "compile_time": 1.0945744514465332
    },
    {
        "BLOCK_SIZE_M": 128,
        "BLOCK_SIZE_N": 64,
        "BLOCK_SIZE_K": 64,
        "GROUP_SIZE_M": 8,
        "num_stages": 3,
        "num_warps": 2,
        "ms": 0.11232014000415802,
        "min_ms": 0.11232014000415802,
        "max_ms": 0.11232014000415802,
        "compile_time": 1.0557849407196045
    },
    {
        "BLOCK_SIZE_M": 64,
        "BLOCK_SIZE_N": 128,
        "BLOCK_SIZE_K": 64,
        "GROUP_SIZE_M": 8,
        "num_stages": 2,
        "num_warps": 4,
        "ms": 0.1123499870300293,
        "min_ms": 0.1123499870300293,
        "max_ms": 0.1123499870300293,
        "compile_time": 1.0423593521118164
    },
    {
        "BLOCK_SIZE_M": 64,
        "BLOCK_SIZE_N": 128,
        "BLOCK_SIZE_K": 128,
        "GROUP_SIZE_M": 8,
        "num_stages": 2,
        "num_warps": 4,
        "ms": 0.11246727406978607,
        "min_ms": 0.11246727406978607,
        "max_ms": 0.11246727406978607,
        "compile_time": 1.0353291034698486
    },
    {
        "BLOCK_SIZE_M": 64,
        "BLOCK_SIZE_N": 128,
        "BLOCK_SIZE_K": 16,
        "GROUP_SIZE_M": 8,
        "num_stages": 7,
        "num_warps": 4,
        "ms": 0.11265561729669571,
        "min_ms": 0.11265561729669571,
        "max_ms": 0.11265561729669571,
        "compile_time": 1.0528557300567627
    },
    {
        "BLOCK_SIZE_M": 256,
        "BLOCK_SIZE_N": 64,
        "BLOCK_SIZE_K": 32,
        "GROUP_SIZE_M": 8,
        "num_stages": 8,
        "num_warps": 8,
        "ms": 0.11272851377725601,
        "min_ms": 0.11272851377725601,
        "max_ms": 0.11272851377725601,
        "compile_time": 1.1090331077575684
    },
    {
        "BLOCK_SIZE_M": 128,
        "BLOCK_SIZE_N": 64,
        "BLOCK_SIZE_K": 32,
        "GROUP_SIZE_M": 8,
        "num_stages": 3,
        "num_warps": 8,
        "ms": 0.11317145824432373,
        "min_ms": 0.11317145824432373,
        "max_ms": 0.11317145824432373,
        "compile_time": 1.0435123443603516
    },
    {
        "BLOCK_SIZE_M": 64,
        "BLOCK_SIZE_N": 256,
        "BLOCK_SIZE_K": 128,
        "GROUP_SIZE_M": 8,
        "num_stages": 3,
        "num_warps": 16,
        "ms": 0.11319659650325775,
        "min_ms": 0.11319659650325775,
        "max_ms": 0.11319659650325775,
        "compile_time": 1.0442838668823242
    },
    {
        "BLOCK_SIZE_M": 64,
        "BLOCK_SIZE_N": 64,
        "BLOCK_SIZE_K": 32,
        "GROUP_SIZE_M": 8,
        "num_stages": 4,
        "num_warps": 2,
        "ms": 0.11331786960363388,
        "min_ms": 0.11331786960363388,
        "max_ms": 0.11331786960363388,
        "compile_time": 1.0803914070129395
    },
    {
        "BLOCK_SIZE_M": 128,
        "BLOCK_SIZE_N": 128,
        "BLOCK_SIZE_K": 32,
        "GROUP_SIZE_M": 8,
        "num_stages": 2,
        "num_warps": 4,
        "ms": 0.11390261352062225,
        "min_ms": 0.11390261352062225,
        "max_ms": 0.11390261352062225,
        "compile_time": 1.0615167617797852
    },
    {
        "BLOCK_SIZE_M": 64,
        "BLOCK_SIZE_N": 512,
        "BLOCK_SIZE_K": 32,
        "GROUP_SIZE_M": 8,
        "num_stages": 3,
        "num_warps": 8,
        "ms": 0.11396386474370956,
        "min_ms": 0.11396386474370956,
        "max_ms": 0.11396386474370956,
        "compile_time": 2.205512523651123
    },
    {
        "BLOCK_SIZE_M": 128,
        "BLOCK_SIZE_N": 64,
        "BLOCK_SIZE_K": 32,
        "GROUP_SIZE_M": 8,
        "num_stages": 3,
        "num_warps": 2,
        "ms": 0.11420837789773941,
        "min_ms": 0.11420837789773941,
        "max_ms": 0.11420837789773941,
        "compile_time": 1.0783259868621826
    },
    {
        "BLOCK_SIZE_M": 128,
        "BLOCK_SIZE_N": 128,
        "BLOCK_SIZE_K": 64,
        "GROUP_SIZE_M": 8,
        "num_stages": 3,
        "num_warps": 16,
        "ms": 0.1143321841955185,
        "min_ms": 0.1143321841955185,
        "max_ms": 0.1143321841955185,
        "compile_time": 1.1142423152923584
    },
    {
        "BLOCK_SIZE_M": 128,
        "BLOCK_SIZE_N": 128,
        "BLOCK_SIZE_K": 64,
        "GROUP_SIZE_M": 8,
        "num_stages": 5,
        "num_warps": 16,
        "ms": 0.11448826640844345,
        "min_ms": 0.11448826640844345,
        "max_ms": 0.11448826640844345,
        "compile_time": 1.1012320518493652
    },
    {
        "BLOCK_SIZE_M": 128,
        "BLOCK_SIZE_N": 128,
        "BLOCK_SIZE_K": 64,
        "GROUP_SIZE_M": 8,
        "num_stages": 4,
        "num_warps": 16,
        "ms": 0.1147596463561058,
        "min_ms": 0.1147596463561058,
        "max_ms": 0.1147596463561058,
        "compile_time": 1.0710158348083496
    },
    {
        "BLOCK_SIZE_M": 64,
        "BLOCK_SIZE_N": 256,
        "BLOCK_SIZE_K": 16,
        "GROUP_SIZE_M": 8,
        "num_stages": 5,
        "num_warps": 4,
        "ms": 0.11476526409387589,
        "min_ms": 0.11476526409387589,
        "max_ms": 0.11476526409387589,
        "compile_time": 1.888427495956421
    },
    {
        "BLOCK_SIZE_M": 64,
        "BLOCK_SIZE_N": 512,
        "BLOCK_SIZE_K": 32,
        "GROUP_SIZE_M": 8,
        "num_stages": 5,
        "num_warps": 8,
        "ms": 0.11481322348117828,
        "min_ms": 0.11481322348117828,
        "max_ms": 0.11481322348117828,
        "compile_time": 2.3109400272369385
    },
    {
        "BLOCK_SIZE_M": 256,
        "BLOCK_SIZE_N": 64,
        "BLOCK_SIZE_K": 128,
        "GROUP_SIZE_M": 8,
        "num_stages": 3,
        "num_warps": 16,
        "ms": 0.11483113467693329,
        "min_ms": 0.11483113467693329,
        "max_ms": 0.11483113467693329,
        "compile_time": 1.1105360984802246
    },
    {
        "BLOCK_SIZE_M": 256,
        "BLOCK_SIZE_N": 128,
        "BLOCK_SIZE_K": 64,
        "GROUP_SIZE_M": 8,
        "num_stages": 4,
        "num_warps": 8,
        "ms": 0.11503666639328003,
        "min_ms": 0.11503666639328003,
        "max_ms": 0.11503666639328003,
        "compile_time": 1.1123883724212646
    },
    {
        "BLOCK_SIZE_M": 64,
        "BLOCK_SIZE_N": 64,
        "BLOCK_SIZE_K": 32,
        "GROUP_SIZE_M": 8,
        "num_stages": 4,
        "num_warps": 4,
        "ms": 0.11515946686267853,
        "min_ms": 0.11515946686267853,
        "max_ms": 0.11515946686267853,
        "compile_time": 1.0638549327850342
    },
    {
        "BLOCK_SIZE_M": 256,
        "BLOCK_SIZE_N": 128,
        "BLOCK_SIZE_K": 64,
        "GROUP_SIZE_M": 8,
        "num_stages": 3,
        "num_warps": 8,
        "ms": 0.1151634007692337,
        "min_ms": 0.1151634007692337,
        "max_ms": 0.1151634007692337,
        "compile_time": 1.1072826385498047
    },
    {
        "BLOCK_SIZE_M": 64,
        "BLOCK_SIZE_N": 64,
        "BLOCK_SIZE_K": 32,
        "GROUP_SIZE_M": 8,
        "num_stages": 5,
        "num_warps": 4,
        "ms": 0.11517266929149628,
        "min_ms": 0.11517266929149628,
        "max_ms": 0.11517266929149628,
        "compile_time": 1.067338228225708
    },
    {
        "BLOCK_SIZE_M": 64,
        "BLOCK_SIZE_N": 128,
        "BLOCK_SIZE_K": 32,
        "GROUP_SIZE_M": 8,
        "num_stages": 8,
        "num_warps": 8,
        "ms": 0.11539870500564575,
        "min_ms": 0.11539870500564575,
        "max_ms": 0.11539870500564575,
        "compile_time": 1.042527198791504
    },
    {
        "BLOCK_SIZE_M": 128,
        "BLOCK_SIZE_N": 64,
        "BLOCK_SIZE_K": 128,
        "GROUP_SIZE_M": 8,
        "num_stages": 2,
        "num_warps": 4,
        "ms": 0.11546710878610611,
        "min_ms": 0.11546710878610611,
        "max_ms": 0.11546710878610611,
        "compile_time": 1.0830881595611572
    },
    {
        "BLOCK_SIZE_M": 64,
        "BLOCK_SIZE_N": 64,
        "BLOCK_SIZE_K": 32,
        "GROUP_SIZE_M": 8,
        "num_stages": 7,
        "num_warps": 2,
        "ms": 0.11547920852899551,
        "min_ms": 0.11547920852899551,
        "max_ms": 0.11547920852899551,
        "compile_time": 1.0575714111328125
    },
    {
        "BLOCK_SIZE_M": 64,
        "BLOCK_SIZE_N": 128,
        "BLOCK_SIZE_K": 16,
        "GROUP_SIZE_M": 8,
        "num_stages": 8,
        "num_warps": 4,
        "ms": 0.11593381315469742,
        "min_ms": 0.11593381315469742,
        "max_ms": 0.11593381315469742,
        "compile_time": 1.025660514831543
    },
    {
        "BLOCK_SIZE_M": 64,
        "BLOCK_SIZE_N": 64,
        "BLOCK_SIZE_K": 32,
        "GROUP_SIZE_M": 8,
        "num_stages": 6,
        "num_warps": 4,
        "ms": 0.11607445776462555,
        "min_ms": 0.11607445776462555,
        "max_ms": 0.11607445776462555,
        "compile_time": 1.0725393295288086
    },
    {
        "BLOCK_SIZE_M": 128,
        "BLOCK_SIZE_N": 128,
        "BLOCK_SIZE_K": 64,
        "GROUP_SIZE_M": 8,
        "num_stages": 6,
        "num_warps": 16,
        "ms": 0.11610259115695953,
        "min_ms": 0.11610259115695953,
        "max_ms": 0.11610259115695953,
        "compile_time": 1.0520739555358887
    },
    {
        "BLOCK_SIZE_M": 64,
        "BLOCK_SIZE_N": 64,
        "BLOCK_SIZE_K": 32,
        "GROUP_SIZE_M": 8,
        "num_stages": 3,
        "num_warps": 2,
        "ms": 0.11611296981573105,
        "min_ms": 0.11611296981573105,
        "max_ms": 0.11611296981573105,
        "compile_time": 1.0500240325927734
    },
    {
        "BLOCK_SIZE_M": 128,
        "BLOCK_SIZE_N": 128,
        "BLOCK_SIZE_K": 128,
        "GROUP_SIZE_M": 8,
        "num_stages": 2,
        "num_warps": 4,
        "ms": 0.11629648506641388,
        "min_ms": 0.11629648506641388,
        "max_ms": 0.11629648506641388,
        "compile_time": 1.066573143005371
    },
    {
        "BLOCK_SIZE_M": 128,
        "BLOCK_SIZE_N": 64,
        "BLOCK_SIZE_K": 64,
        "GROUP_SIZE_M": 8,
        "num_stages": 4,
        "num_warps": 2,
        "ms": 0.11647981405258179,
        "min_ms": 0.11647981405258179,
        "max_ms": 0.11647981405258179,
        "compile_time": 0.9615645408630371
    },
    {
        "BLOCK_SIZE_M": 64,
        "BLOCK_SIZE_N": 128,
        "BLOCK_SIZE_K": 16,
        "GROUP_SIZE_M": 8,
        "num_stages": 7,
        "num_warps": 2,
        "ms": 0.11658656597137451,
        "min_ms": 0.11658656597137451,
        "max_ms": 0.11658656597137451,
        "compile_time": 2.0451619625091553
    },
    {
        "BLOCK_SIZE_M": 64,
        "BLOCK_SIZE_N": 64,
        "BLOCK_SIZE_K": 32,
        "GROUP_SIZE_M": 8,
        "num_stages": 3,
        "num_warps": 4,
        "ms": 0.11661426723003387,
        "min_ms": 0.11661426723003387,
        "max_ms": 0.11661426723003387,
        "compile_time": 1.0676376819610596
    },
    {
        "BLOCK_SIZE_M": 256,
        "BLOCK_SIZE_N": 64,
        "BLOCK_SIZE_K": 32,
        "GROUP_SIZE_M": 8,
        "num_stages": 3,
        "num_warps": 8,
        "ms": 0.11673340946435928,
        "min_ms": 0.11673340946435928,
        "max_ms": 0.11673340946435928,
        "compile_time": 1.0949480533599854
    },
    {
        "BLOCK_SIZE_M": 64,
        "BLOCK_SIZE_N": 64,
        "BLOCK_SIZE_K": 32,
        "GROUP_SIZE_M": 8,
        "num_stages": 5,
        "num_warps": 2,
        "ms": 0.1168750673532486,
        "min_ms": 0.1168750673532486,
        "max_ms": 0.1168750673532486,
        "compile_time": 1.068338394165039
    },
    {
        "BLOCK_SIZE_M": 128,
        "BLOCK_SIZE_N": 64,
        "BLOCK_SIZE_K": 128,
        "GROUP_SIZE_M": 8,
        "num_stages": 2,
        "num_warps": 8,
        "ms": 0.11701741069555283,
        "min_ms": 0.11701741069555283,
        "max_ms": 0.11701741069555283,
        "compile_time": 0.9694647789001465
    },
    {
        "BLOCK_SIZE_M": 128,
        "BLOCK_SIZE_N": 64,
        "BLOCK_SIZE_K": 32,
        "GROUP_SIZE_M": 8,
        "num_stages": 8,
        "num_warps": 8,
        "ms": 0.11725886166095734,
        "min_ms": 0.11725886166095734,
        "max_ms": 0.11725886166095734,
        "compile_time": 1.083669900894165
    },
    {
        "BLOCK_SIZE_M": 64,
        "BLOCK_SIZE_N": 128,
        "BLOCK_SIZE_K": 32,
        "GROUP_SIZE_M": 8,
        "num_stages": 3,
        "num_warps": 2,
        "ms": 0.11732552200555801,
        "min_ms": 0.11732552200555801,
        "max_ms": 0.11732552200555801,
        "compile_time": 1.0430829524993896
    },
    {
        "BLOCK_SIZE_M": 64,
        "BLOCK_SIZE_N": 128,
        "BLOCK_SIZE_K": 128,
        "GROUP_SIZE_M": 8,
        "num_stages": 2,
        "num_warps": 8,
        "ms": 0.1173592060804367,
        "min_ms": 0.1173592060804367,
        "max_ms": 0.1173592060804367,
        "compile_time": 1.0503408908843994
    },
    {
        "BLOCK_SIZE_M": 256,
        "BLOCK_SIZE_N": 64,
        "BLOCK_SIZE_K": 64,
        "GROUP_SIZE_M": 8,
        "num_stages": 2,
        "num_warps": 4,
        "ms": 0.11761172860860825,
        "min_ms": 0.11761172860860825,
        "max_ms": 0.11761172860860825,
        "compile_time": 1.106523036956787
    },
    {
        "BLOCK_SIZE_M": 64,
        "BLOCK_SIZE_N": 128,
        "BLOCK_SIZE_K": 16,
        "GROUP_SIZE_M": 8,
        "num_stages": 6,
        "num_warps": 2,
        "ms": 0.11811568588018417,
        "min_ms": 0.11811568588018417,
        "max_ms": 0.11811568588018417,
        "compile_time": 2.0172033309936523
    },
    {
        "BLOCK_SIZE_M": 256,
        "BLOCK_SIZE_N": 64,
        "BLOCK_SIZE_K": 64,
        "GROUP_SIZE_M": 8,
        "num_stages": 4,
        "num_warps": 16,
        "ms": 0.1183338314294815,
        "min_ms": 0.1183338314294815,
        "max_ms": 0.1183338314294815,
        "compile_time": 1.0969829559326172
    },
    {
        "BLOCK_SIZE_M": 64,
        "BLOCK_SIZE_N": 64,
        "BLOCK_SIZE_K": 64,
        "GROUP_SIZE_M": 8,
        "num_stages": 4,
        "num_warps": 2,
        "ms": 0.1184266209602356,
        "min_ms": 0.1184266209602356,
        "max_ms": 0.1184266209602356,
        "compile_time": 1.0631206035614014
    },
    {
        "BLOCK_SIZE_M": 64,
        "BLOCK_SIZE_N": 128,
        "BLOCK_SIZE_K": 16,
        "GROUP_SIZE_M": 8,
        "num_stages": 6,
        "num_warps": 4,
        "ms": 0.11844535171985626,
        "min_ms": 0.11844535171985626,
        "max_ms": 0.11844535171985626,
        "compile_time": 1.6687986850738525
    },
    {
        "BLOCK_SIZE_M": 128,
        "BLOCK_SIZE_N": 256,
        "BLOCK_SIZE_K": 64,
        "GROUP_SIZE_M": 8,
        "num_stages": 3,
        "num_warps": 8,
        "ms": 0.11858932673931122,
        "min_ms": 0.11858932673931122,
        "max_ms": 0.11858932673931122,
        "compile_time": 1.0821926593780518
    },
    {
        "BLOCK_SIZE_M": 64,
        "BLOCK_SIZE_N": 256,
        "BLOCK_SIZE_K": 64,
        "GROUP_SIZE_M": 8,
        "num_stages": 3,
        "num_warps": 16,
        "ms": 0.11888128519058228,
        "min_ms": 0.11888128519058228,
        "max_ms": 0.11888128519058228,
        "compile_time": 1.008138656616211
    },
    {
        "BLOCK_SIZE_M": 128,
        "BLOCK_SIZE_N": 256,
        "BLOCK_SIZE_K": 64,
        "GROUP_SIZE_M": 8,
        "num_stages": 4,
        "num_warps": 8,
        "ms": 0.11893191188573837,
        "min_ms": 0.11893191188573837,
        "max_ms": 0.11893191188573837,
        "compile_time": 1.0880730152130127
    },
    {
        "BLOCK_SIZE_M": 64,
        "BLOCK_SIZE_N": 64,
        "BLOCK_SIZE_K": 64,
        "GROUP_SIZE_M": 8,
        "num_stages": 6,
        "num_warps": 4,
        "ms": 0.11893346160650253,
        "min_ms": 0.11893346160650253,
        "max_ms": 0.11893346160650253,
        "compile_time": 1.059600591659546
    },
    {
        "BLOCK_SIZE_M": 512,
        "BLOCK_SIZE_N": 64,
        "BLOCK_SIZE_K": 32,
        "GROUP_SIZE_M": 8,
        "num_stages": 3,
        "num_warps": 8,
        "ms": 0.11906218528747559,
        "min_ms": 0.11906218528747559,
        "max_ms": 0.11906218528747559,
        "compile_time": 2.6118905544281006
    },
    {
        "BLOCK_SIZE_M": 64,
        "BLOCK_SIZE_N": 256,
        "BLOCK_SIZE_K": 64,
        "GROUP_SIZE_M": 8,
        "num_stages": 4,
        "num_warps": 16,
        "ms": 0.11932428181171417,
        "min_ms": 0.11932428181171417,
        "max_ms": 0.11932428181171417,
        "compile_time": 1.0520493984222412
    },
    {
        "BLOCK_SIZE_M": 512,
        "BLOCK_SIZE_N": 64,
        "BLOCK_SIZE_K": 32,
        "GROUP_SIZE_M": 8,
        "num_stages": 4,
        "num_warps": 8,
        "ms": 0.11943042278289795,
        "min_ms": 0.11943042278289795,
        "max_ms": 0.11943042278289795,
        "compile_time": 2.538841485977173
    },
    {
        "BLOCK_SIZE_M": 64,
        "BLOCK_SIZE_N": 64,
        "BLOCK_SIZE_K": 32,
        "GROUP_SIZE_M": 8,
        "num_stages": 6,
        "num_warps": 2,
        "ms": 0.119651660323143,
        "min_ms": 0.119651660323143,
        "max_ms": 0.119651660323143,
        "compile_time": 1.069948434829712
    },
    {
        "BLOCK_SIZE_M": 64,
        "BLOCK_SIZE_N": 64,
        "BLOCK_SIZE_K": 64,
        "GROUP_SIZE_M": 8,
        "num_stages": 5,
        "num_warps": 4,
        "ms": 0.11969349533319473,
        "min_ms": 0.11969349533319473,
        "max_ms": 0.11969349533319473,
        "compile_time": 1.059882402420044
    },
    {
        "BLOCK_SIZE_M": 64,
        "BLOCK_SIZE_N": 64,
        "BLOCK_SIZE_K": 32,
        "GROUP_SIZE_M": 8,
        "num_stages": 7,
        "num_warps": 4,
        "ms": 0.11980395019054413,
        "min_ms": 0.11980395019054413,
        "max_ms": 0.11980395019054413,
        "compile_time": 1.0670013427734375
    },
    {
        "BLOCK_SIZE_M": 64,
        "BLOCK_SIZE_N": 128,
        "BLOCK_SIZE_K": 16,
        "GROUP_SIZE_M": 8,
        "num_stages": 4,
        "num_warps": 2,
        "ms": 0.11985568702220917,
        "min_ms": 0.11985568702220917,
        "max_ms": 0.11985568702220917,
        "compile_time": 1.907670259475708
    },
    {
        "BLOCK_SIZE_M": 64,
        "BLOCK_SIZE_N": 64,
        "BLOCK_SIZE_K": 32,
        "GROUP_SIZE_M": 8,
        "num_stages": 2,
        "num_warps": 2,
        "ms": 0.11997964233160019,
        "min_ms": 0.11997964233160019,
        "max_ms": 0.11997964233160019,
        "compile_time": 1.0357606410980225
    },
    {
        "BLOCK_SIZE_M": 128,
        "BLOCK_SIZE_N": 64,
        "BLOCK_SIZE_K": 64,
        "GROUP_SIZE_M": 8,
        "num_stages": 2,
        "num_warps": 8,
        "ms": 0.12005124241113663,
        "min_ms": 0.12005124241113663,
        "max_ms": 0.12005124241113663,
        "compile_time": 1.039693832397461
    },
    {
        "BLOCK_SIZE_M": 128,
        "BLOCK_SIZE_N": 64,
        "BLOCK_SIZE_K": 32,
        "GROUP_SIZE_M": 8,
        "num_stages": 2,
        "num_warps": 4,
        "ms": 0.12021075189113617,
        "min_ms": 0.12021075189113617,
        "max_ms": 0.12021075189113617,
        "compile_time": 1.1127634048461914
    },
    {
        "BLOCK_SIZE_M": 64,
        "BLOCK_SIZE_N": 256,
        "BLOCK_SIZE_K": 64,
        "GROUP_SIZE_M": 8,
        "num_stages": 5,
        "num_warps": 16,
        "ms": 0.12025660276412964,
        "min_ms": 0.12025660276412964,
        "max_ms": 0.12025660276412964,
        "compile_time": 1.0529615879058838
    },
    {
        "BLOCK_SIZE_M": 64,
        "BLOCK_SIZE_N": 128,
        "BLOCK_SIZE_K": 16,
        "GROUP_SIZE_M": 8,
        "num_stages": 5,
        "num_warps": 2,
        "ms": 0.12038706243038177,
        "min_ms": 0.12038706243038177,
        "max_ms": 0.12038706243038177,
        "compile_time": 2.0052647590637207
    },
    {
        "BLOCK_SIZE_M": 256,
        "BLOCK_SIZE_N": 64,
        "BLOCK_SIZE_K": 64,
        "GROUP_SIZE_M": 8,
        "num_stages": 3,
        "num_warps": 16,
        "ms": 0.12046632915735245,
        "min_ms": 0.12046632915735245,
        "max_ms": 0.12046632915735245,
        "compile_time": 1.1296429634094238
    },
    {
        "BLOCK_SIZE_M": 64,
        "BLOCK_SIZE_N": 128,
        "BLOCK_SIZE_K": 64,
        "GROUP_SIZE_M": 8,
        "num_stages": 2,
        "num_warps": 8,
        "ms": 0.12048536539077759,
        "min_ms": 0.12048536539077759,
        "max_ms": 0.12048536539077759,
        "compile_time": 1.0277509689331055
    },
    {
        "BLOCK_SIZE_M": 512,
        "BLOCK_SIZE_N": 64,
        "BLOCK_SIZE_K": 32,
        "GROUP_SIZE_M": 8,
        "num_stages": 5,
        "num_warps": 8,
        "ms": 0.1206517219543457,
        "min_ms": 0.1206517219543457,
        "max_ms": 0.1206517219543457,
        "compile_time": 2.612898111343384
    },
    {
        "BLOCK_SIZE_M": 64,
        "BLOCK_SIZE_N": 128,
        "BLOCK_SIZE_K": 16,
        "GROUP_SIZE_M": 8,
        "num_stages": 4,
        "num_warps": 4,
        "ms": 0.12144123017787933,
        "min_ms": 0.12144123017787933,
        "max_ms": 0.12144123017787933,
        "compile_time": 1.0577943325042725
    },
    {
        "BLOCK_SIZE_M": 256,
        "BLOCK_SIZE_N": 64,
        "BLOCK_SIZE_K": 64,
        "GROUP_SIZE_M": 8,
        "num_stages": 5,
        "num_warps": 16,
        "ms": 0.12171230465173721,
        "min_ms": 0.12171230465173721,
        "max_ms": 0.12171230465173721,
        "compile_time": 1.1012623310089111
    },
    {
        "BLOCK_SIZE_M": 64,
        "BLOCK_SIZE_N": 256,
        "BLOCK_SIZE_K": 64,
        "GROUP_SIZE_M": 8,
        "num_stages": 4,
        "num_warps": 4,
        "ms": 0.12188053131103516,
        "min_ms": 0.12188053131103516,
        "max_ms": 0.12188053131103516,
        "compile_time": 1.055387258529663
    },
    {
        "BLOCK_SIZE_M": 64,
        "BLOCK_SIZE_N": 64,
        "BLOCK_SIZE_K": 32,
        "GROUP_SIZE_M": 8,
        "num_stages": 8,
        "num_warps": 4,
        "ms": 0.12191624939441681,
        "min_ms": 0.12191624939441681,
        "max_ms": 0.12191624939441681,
        "compile_time": 1.0686416625976562
    },
    {
        "BLOCK_SIZE_M": 64,
        "BLOCK_SIZE_N": 256,
        "BLOCK_SIZE_K": 32,
        "GROUP_SIZE_M": 8,
        "num_stages": 2,
        "num_warps": 4,
        "ms": 0.12202699482440948,
        "min_ms": 0.12202699482440948,
        "max_ms": 0.12202699482440948,
        "compile_time": 1.0655488967895508
    },
    {
        "BLOCK_SIZE_M": 64,
        "BLOCK_SIZE_N": 64,
        "BLOCK_SIZE_K": 64,
        "GROUP_SIZE_M": 8,
        "num_stages": 3,
        "num_warps": 2,
        "ms": 0.12206785380840302,
        "min_ms": 0.12206785380840302,
        "max_ms": 0.12206785380840302,
        "compile_time": 1.0606391429901123
    },
    {
        "BLOCK_SIZE_M": 64,
        "BLOCK_SIZE_N": 64,
        "BLOCK_SIZE_K": 32,
        "GROUP_SIZE_M": 8,
        "num_stages": 8,
        "num_warps": 2,
        "ms": 0.1221420168876648,
        "min_ms": 0.1221420168876648,
        "max_ms": 0.1221420168876648,
        "compile_time": 1.0597913265228271
    },
    {
        "BLOCK_SIZE_M": 64,
        "BLOCK_SIZE_N": 128,
        "BLOCK_SIZE_K": 16,
        "GROUP_SIZE_M": 8,
        "num_stages": 3,
        "num_warps": 4,
        "ms": 0.1221558228135109,
        "min_ms": 0.1221558228135109,
        "max_ms": 0.1221558228135109,
        "compile_time": 1.0340800285339355
    },
    {
        "BLOCK_SIZE_M": 64,
        "BLOCK_SIZE_N": 128,
        "BLOCK_SIZE_K": 64,
        "GROUP_SIZE_M": 8,
        "num_stages": 3,
        "num_warps": 2,
        "ms": 0.12225200980901718,
        "min_ms": 0.12225200980901718,
        "max_ms": 0.12225200980901718,
        "compile_time": 1.039048671722412
    },
    {
        "BLOCK_SIZE_M": 64,
        "BLOCK_SIZE_N": 64,
        "BLOCK_SIZE_K": 128,
        "GROUP_SIZE_M": 8,
        "num_stages": 3,
        "num_warps": 4,
        "ms": 0.12245146185159683,
        "min_ms": 0.12245146185159683,
        "max_ms": 0.12245146185159683,
        "compile_time": 1.0635957717895508
    },
    {
        "BLOCK_SIZE_M": 64,
        "BLOCK_SIZE_N": 256,
        "BLOCK_SIZE_K": 64,
        "GROUP_SIZE_M": 8,
        "num_stages": 5,
        "num_warps": 4,
        "ms": 0.1224687248468399,
        "min_ms": 0.1224687248468399,
        "max_ms": 0.1224687248468399,
        "compile_time": 1.043480396270752
    },
    {
        "BLOCK_SIZE_M": 512,
        "BLOCK_SIZE_N": 64,
        "BLOCK_SIZE_K": 64,
        "GROUP_SIZE_M": 8,
        "num_stages": 3,
        "num_warps": 8,
        "ms": 0.12333966791629791,
        "min_ms": 0.12333966791629791,
        "max_ms": 0.12333966791629791,
        "compile_time": 2.6442782878875732
    },
    {
        "BLOCK_SIZE_M": 64,
        "BLOCK_SIZE_N": 128,
        "BLOCK_SIZE_K": 16,
        "GROUP_SIZE_M": 8,
        "num_stages": 5,
        "num_warps": 4,
        "ms": 0.12341221421957016,
        "min_ms": 0.12341221421957016,
        "max_ms": 0.12341221421957016,
        "compile_time": 1.0511739253997803
    },
    {
        "BLOCK_SIZE_M": 64,
        "BLOCK_SIZE_N": 64,
        "BLOCK_SIZE_K": 64,
        "GROUP_SIZE_M": 8,
        "num_stages": 3,
        "num_warps": 4,
        "ms": 0.12379610538482666,
        "min_ms": 0.12379610538482666,
        "max_ms": 0.12379610538482666,
        "compile_time": 1.0821020603179932
    },
    {
        "BLOCK_SIZE_M": 64,
        "BLOCK_SIZE_N": 64,
        "BLOCK_SIZE_K": 32,
        "GROUP_SIZE_M": 8,
        "num_stages": 2,
        "num_warps": 4,
        "ms": 0.12399135529994965,
        "min_ms": 0.12399135529994965,
        "max_ms": 0.12399135529994965,
        "compile_time": 1.054497241973877
    },
    {
        "BLOCK_SIZE_M": 64,
        "BLOCK_SIZE_N": 64,
        "BLOCK_SIZE_K": 64,
        "GROUP_SIZE_M": 8,
        "num_stages": 4,
        "num_warps": 4,
        "ms": 0.12425287067890167,
        "min_ms": 0.12425287067890167,
        "max_ms": 0.12425287067890167,
        "compile_time": 1.066720962524414
    },
    {
        "BLOCK_SIZE_M": 64,
        "BLOCK_SIZE_N": 256,
        "BLOCK_SIZE_K": 64,
        "GROUP_SIZE_M": 8,
        "num_stages": 2,
        "num_warps": 4,
        "ms": 0.12436030060052872,
        "min_ms": 0.12436030060052872,
        "max_ms": 0.12436030060052872,
        "compile_time": 1.0586047172546387
    },
    {
        "BLOCK_SIZE_M": 64,
        "BLOCK_SIZE_N": 128,
        "BLOCK_SIZE_K": 16,
        "GROUP_SIZE_M": 8,
        "num_stages": 3,
        "num_warps": 2,
        "ms": 0.12494124472141266,
        "min_ms": 0.12494124472141266,
        "max_ms": 0.12494124472141266,
        "compile_time": 1.89945387840271
    },
    {
        "BLOCK_SIZE_M": 64,
        "BLOCK_SIZE_N": 64,
        "BLOCK_SIZE_K": 64,
        "GROUP_SIZE_M": 8,
        "num_stages": 5,
        "num_warps": 2,
        "ms": 0.1262277066707611,
        "min_ms": 0.1262277066707611,
        "max_ms": 0.1262277066707611,
        "compile_time": 1.0598971843719482
    },
    {
        "BLOCK_SIZE_M": 256,
        "BLOCK_SIZE_N": 32,
        "BLOCK_SIZE_K": 32,
        "GROUP_SIZE_M": 8,
        "num_stages": 3,
        "num_warps": 4,
        "ms": 0.12681670486927032,
        "min_ms": 0.12681670486927032,
        "max_ms": 0.12681670486927032,
        "compile_time": 1.1485607624053955
    },
    {
        "BLOCK_SIZE_M": 64,
        "BLOCK_SIZE_N": 64,
        "BLOCK_SIZE_K": 64,
        "GROUP_SIZE_M": 8,
        "num_stages": 6,
        "num_warps": 2,
        "ms": 0.12710408866405487,
        "min_ms": 0.12710408866405487,
        "max_ms": 0.12710408866405487,
        "compile_time": 1.049039363861084
    },
    {
        "BLOCK_SIZE_M": 64,
        "BLOCK_SIZE_N": 64,
        "BLOCK_SIZE_K": 64,
        "GROUP_SIZE_M": 8,
        "num_stages": 7,
        "num_warps": 4,
        "ms": 0.12742920219898224,
        "min_ms": 0.12742920219898224,
        "max_ms": 0.12742920219898224,
        "compile_time": 1.0640692710876465
    },
    {
        "BLOCK_SIZE_M": 128,
        "BLOCK_SIZE_N": 128,
        "BLOCK_SIZE_K": 128,
        "GROUP_SIZE_M": 8,
        "num_stages": 2,
        "num_warps": 8,
        "ms": 0.1276743859052658,
        "min_ms": 0.1276743859052658,
        "max_ms": 0.1276743859052658,
        "compile_time": 1.0912864208221436
    },
    {
        "BLOCK_SIZE_M": 64,
        "BLOCK_SIZE_N": 128,
        "BLOCK_SIZE_K": 16,
        "GROUP_SIZE_M": 8,
        "num_stages": 8,
        "num_warps": 2,
        "ms": 0.1278681755065918,
        "min_ms": 0.1278681755065918,
        "max_ms": 0.1278681755065918,
        "compile_time": 2.056748390197754
    },
    {
        "BLOCK_SIZE_M": 64,
        "BLOCK_SIZE_N": 128,
        "BLOCK_SIZE_K": 64,
        "GROUP_SIZE_M": 8,
        "num_stages": 4,
        "num_warps": 2,
        "ms": 0.1286126673221588,
        "min_ms": 0.1286126673221588,
        "max_ms": 0.1286126673221588,
        "compile_time": 1.0465123653411865
    },
    {
        "BLOCK_SIZE_M": 64,
        "BLOCK_SIZE_N": 128,
        "BLOCK_SIZE_K": 32,
        "GROUP_SIZE_M": 8,
        "num_stages": 2,
        "num_warps": 2,
        "ms": 0.12866981327533722,
        "min_ms": 0.12866981327533722,
        "max_ms": 0.12866981327533722,
        "compile_time": 1.0527124404907227
    },
    {
        "BLOCK_SIZE_M": 128,
        "BLOCK_SIZE_N": 128,
        "BLOCK_SIZE_K": 16,
        "GROUP_SIZE_M": 8,
        "num_stages": 8,
        "num_warps": 8,
        "ms": 0.12874504923820496,
        "min_ms": 0.12874504923820496,
        "max_ms": 0.12874504923820496,
        "compile_time": 1.105485200881958
    },
    {
        "BLOCK_SIZE_M": 64,
        "BLOCK_SIZE_N": 64,
        "BLOCK_SIZE_K": 64,
        "GROUP_SIZE_M": 8,
        "num_stages": 2,
        "num_warps": 4,
        "ms": 0.1291237771511078,
        "min_ms": 0.1291237771511078,
        "max_ms": 0.1291237771511078,
        "compile_time": 1.0836012363433838
    },
    {
        "BLOCK_SIZE_M": 64,
        "BLOCK_SIZE_N": 64,
        "BLOCK_SIZE_K": 128,
        "GROUP_SIZE_M": 8,
        "num_stages": 4,
        "num_warps": 4,
        "ms": 0.12912657856941223,
        "min_ms": 0.12912657856941223,
        "max_ms": 0.12912657856941223,
        "compile_time": 1.0481054782867432
    },
    {
        "BLOCK_SIZE_M": 128,
        "BLOCK_SIZE_N": 128,
        "BLOCK_SIZE_K": 16,
        "GROUP_SIZE_M": 8,
        "num_stages": 8,
        "num_warps": 4,
        "ms": 0.13020028173923492,
        "min_ms": 0.13020028173923492,
        "max_ms": 0.13020028173923492,
        "compile_time": 2.0316760540008545
    },
    {
        "BLOCK_SIZE_M": 64,
        "BLOCK_SIZE_N": 64,
        "BLOCK_SIZE_K": 64,
        "GROUP_SIZE_M": 8,
        "num_stages": 8,
        "num_warps": 4,
        "ms": 0.13024508953094482,
        "min_ms": 0.13024508953094482,
        "max_ms": 0.13024508953094482,
        "compile_time": 1.0888972282409668
    },
    {
        "BLOCK_SIZE_M": 128,
        "BLOCK_SIZE_N": 128,
        "BLOCK_SIZE_K": 32,
        "GROUP_SIZE_M": 8,
        "num_stages": 5,
        "num_warps": 16,
        "ms": 0.13031479716300964,
        "min_ms": 0.13031479716300964,
        "max_ms": 0.13031479716300964,
        "compile_time": 1.0926156044006348
    },
    {
        "BLOCK_SIZE_M": 64,
        "BLOCK_SIZE_N": 64,
        "BLOCK_SIZE_K": 128,
        "GROUP_SIZE_M": 8,
        "num_stages": 6,
        "num_warps": 4,
        "ms": 0.1306747943162918,
        "min_ms": 0.1306747943162918,
        "max_ms": 0.1306747943162918,
        "compile_time": 1.0579557418823242
    },
    {
        "BLOCK_SIZE_M": 64,
        "BLOCK_SIZE_N": 64,
        "BLOCK_SIZE_K": 64,
        "GROUP_SIZE_M": 8,
        "num_stages": 3,
        "num_warps": 8,
        "ms": 0.13075093924999237,
        "min_ms": 0.13075093924999237,
        "max_ms": 0.13075093924999237,
        "compile_time": 1.0708913803100586
    },
    {
        "BLOCK_SIZE_M": 64,
        "BLOCK_SIZE_N": 64,
        "BLOCK_SIZE_K": 128,
        "GROUP_SIZE_M": 8,
        "num_stages": 5,
        "num_warps": 4,
        "ms": 0.13097766041755676,
        "min_ms": 0.13097766041755676,
        "max_ms": 0.13097766041755676,
        "compile_time": 1.0437800884246826
    },
    {
        "BLOCK_SIZE_M": 256,
        "BLOCK_SIZE_N": 32,
        "BLOCK_SIZE_K": 32,
        "GROUP_SIZE_M": 8,
        "num_stages": 6,
        "num_warps": 4,
        "ms": 0.13102105259895325,
        "min_ms": 0.13102105259895325,
        "max_ms": 0.13102105259895325,
        "compile_time": 1.1300246715545654
    },
    {
        "BLOCK_SIZE_M": 128,
        "BLOCK_SIZE_N": 128,
        "BLOCK_SIZE_K": 32,
        "GROUP_SIZE_M": 8,
        "num_stages": 6,
        "num_warps": 16,
        "ms": 0.1312161684036255,
        "min_ms": 0.1312161684036255,
        "max_ms": 0.1312161684036255,
        "compile_time": 1.0888733863830566
    },
    {
        "BLOCK_SIZE_M": 64,
        "BLOCK_SIZE_N": 512,
        "BLOCK_SIZE_K": 32,
        "GROUP_SIZE_M": 8,
        "num_stages": 4,
        "num_warps": 8,
        "ms": 0.13133534789085388,
        "min_ms": 0.13133534789085388,
        "max_ms": 0.13133534789085388,
        "compile_time": 2.2983038425445557
    },
    {
        "BLOCK_SIZE_M": 128,
        "BLOCK_SIZE_N": 128,
        "BLOCK_SIZE_K": 32,
        "GROUP_SIZE_M": 8,
        "num_stages": 3,
        "num_warps": 16,
        "ms": 0.13156332075595856,
        "min_ms": 0.13156332075595856,
        "max_ms": 0.13156332075595856,
        "compile_time": 1.0960288047790527
    },
    {
        "BLOCK_SIZE_M": 128,
        "BLOCK_SIZE_N": 64,
        "BLOCK_SIZE_K": 32,
        "GROUP_SIZE_M": 8,
        "num_stages": 2,
        "num_warps": 2,
        "ms": 0.13160504400730133,
        "min_ms": 0.13160504400730133,
        "max_ms": 0.13160504400730133,
        "compile_time": 1.025315761566162
    },
    {
        "BLOCK_SIZE_M": 256,
        "BLOCK_SIZE_N": 32,
        "BLOCK_SIZE_K": 32,
        "GROUP_SIZE_M": 8,
        "num_stages": 4,
        "num_warps": 4,
        "ms": 0.13172708451747894,
        "min_ms": 0.13172708451747894,
        "max_ms": 0.13172708451747894,
        "compile_time": 1.1351821422576904
    },
    {
        "BLOCK_SIZE_M": 64,
        "BLOCK_SIZE_N": 64,
        "BLOCK_SIZE_K": 128,
        "GROUP_SIZE_M": 8,
        "num_stages": 3,
        "num_warps": 8,
        "ms": 0.13180434703826904,
        "min_ms": 0.13180434703826904,
        "max_ms": 0.13180434703826904,
        "compile_time": 1.073486328125
    },
    {
        "BLOCK_SIZE_M": 64,
        "BLOCK_SIZE_N": 64,
        "BLOCK_SIZE_K": 64,
        "GROUP_SIZE_M": 8,
        "num_stages": 4,
        "num_warps": 8,
        "ms": 0.13184726238250732,
        "min_ms": 0.13184726238250732,
        "max_ms": 0.13184726238250732,
        "compile_time": 1.087291955947876
    },
    {
        "BLOCK_SIZE_M": 128,
        "BLOCK_SIZE_N": 128,
        "BLOCK_SIZE_K": 32,
        "GROUP_SIZE_M": 8,
        "num_stages": 7,
        "num_warps": 16,
        "ms": 0.1319701075553894,
        "min_ms": 0.1319701075553894,
        "max_ms": 0.1319701075553894,
        "compile_time": 1.0989563465118408
    },
    {
        "BLOCK_SIZE_M": 256,
        "BLOCK_SIZE_N": 32,
        "BLOCK_SIZE_K": 32,
        "GROUP_SIZE_M": 8,
        "num_stages": 5,
        "num_warps": 4,
        "ms": 0.13206002116203308,
        "min_ms": 0.13206002116203308,
        "max_ms": 0.13206002116203308,
        "compile_time": 1.0948927402496338
    },
    {
        "BLOCK_SIZE_M": 256,
        "BLOCK_SIZE_N": 32,
        "BLOCK_SIZE_K": 32,
        "GROUP_SIZE_M": 8,
        "num_stages": 7,
        "num_warps": 4,
        "ms": 0.13233935832977295,
        "min_ms": 0.13233935832977295,
        "max_ms": 0.13233935832977295,
        "compile_time": 1.1382436752319336
    },
    {
        "BLOCK_SIZE_M": 128,
        "BLOCK_SIZE_N": 128,
        "BLOCK_SIZE_K": 32,
        "GROUP_SIZE_M": 8,
        "num_stages": 8,
        "num_warps": 16,
        "ms": 0.13257089257240295,
        "min_ms": 0.13257089257240295,
        "max_ms": 0.13257089257240295,
        "compile_time": 1.087993860244751
    },
    {
        "BLOCK_SIZE_M": 128,
        "BLOCK_SIZE_N": 128,
        "BLOCK_SIZE_K": 32,
        "GROUP_SIZE_M": 8,
        "num_stages": 4,
        "num_warps": 16,
        "ms": 0.1326059103012085,
        "min_ms": 0.1326059103012085,
        "max_ms": 0.1326059103012085,
        "compile_time": 1.1180927753448486
    },
    {
        "BLOCK_SIZE_M": 256,
        "BLOCK_SIZE_N": 32,
        "BLOCK_SIZE_K": 64,
        "GROUP_SIZE_M": 8,
        "num_stages": 5,
        "num_warps": 4,
        "ms": 0.13267743587493896,
        "min_ms": 0.13267743587493896,
        "max_ms": 0.13267743587493896,
        "compile_time": 1.1250331401824951
    },
    {
        "BLOCK_SIZE_M": 64,
        "BLOCK_SIZE_N": 128,
        "BLOCK_SIZE_K": 128,
        "GROUP_SIZE_M": 8,
        "num_stages": 3,
        "num_warps": 16,
        "ms": 0.1327643245458603,
        "min_ms": 0.1327643245458603,
        "max_ms": 0.1327643245458603,
        "compile_time": 1.0608222484588623
    },
    {
        "BLOCK_SIZE_M": 128,
        "BLOCK_SIZE_N": 64,
        "BLOCK_SIZE_K": 128,
        "GROUP_SIZE_M": 8,
        "num_stages": 3,
        "num_warps": 16,
        "ms": 0.13285350799560547,
        "min_ms": 0.13285350799560547,
        "max_ms": 0.13285350799560547,
        "compile_time": 1.0960354804992676
    },
    {
        "BLOCK_SIZE_M": 64,
        "BLOCK_SIZE_N": 256,
        "BLOCK_SIZE_K": 16,
        "GROUP_SIZE_M": 8,
        "num_stages": 3,
        "num_warps": 4,
        "ms": 0.13286800682544708,
        "min_ms": 0.13286800682544708,
        "max_ms": 0.13286800682544708,
        "compile_time": 1.929053783416748
    },
    {
        "BLOCK_SIZE_M": 32,
        "BLOCK_SIZE_N": 256,
        "BLOCK_SIZE_K": 32,
        "GROUP_SIZE_M": 8,
        "num_stages": 5,
        "num_warps": 8,
        "ms": 0.1329948604106903,
        "min_ms": 0.1329948604106903,
        "max_ms": 0.1329948604106903,
        "compile_time": 1.047637939453125
    },
    {
        "BLOCK_SIZE_M": 64,
        "BLOCK_SIZE_N": 64,
        "BLOCK_SIZE_K": 128,
        "GROUP_SIZE_M": 8,
        "num_stages": 2,
        "num_warps": 4,
        "ms": 0.13330456614494324,
        "min_ms": 0.13330456614494324,
        "max_ms": 0.13330456614494324,
        "compile_time": 1.0482971668243408
    },
    {
        "BLOCK_SIZE_M": 128,
        "BLOCK_SIZE_N": 64,
        "BLOCK_SIZE_K": 64,
        "GROUP_SIZE_M": 8,
        "num_stages": 1,
        "num_warps": 4,
        "ms": 0.13372255861759186,
        "min_ms": 0.13372255861759186,
        "max_ms": 0.13372255861759186,
        "compile_time": 1.1268951892852783
    },
    {
        "BLOCK_SIZE_M": 128,
        "BLOCK_SIZE_N": 64,
        "BLOCK_SIZE_K": 64,
        "GROUP_SIZE_M": 8,
        "num_stages": 4,
        "num_warps": 16,
        "ms": 0.13373300433158875,
        "min_ms": 0.13373300433158875,
        "max_ms": 0.13373300433158875,
        "compile_time": 1.0990583896636963
    },
    {
        "BLOCK_SIZE_M": 128,
        "BLOCK_SIZE_N": 64,
        "BLOCK_SIZE_K": 64,
        "GROUP_SIZE_M": 8,
        "num_stages": 3,
        "num_warps": 16,
        "ms": 0.1338501274585724,
        "min_ms": 0.1338501274585724,
        "max_ms": 0.1338501274585724,
        "compile_time": 1.097102403640747
    },
    {
        "BLOCK_SIZE_M": 256,
        "BLOCK_SIZE_N": 32,
        "BLOCK_SIZE_K": 32,
        "GROUP_SIZE_M": 8,
        "num_stages": 8,
        "num_warps": 4,
        "ms": 0.13386675715446472,
        "min_ms": 0.13386675715446472,
        "max_ms": 0.13386675715446472,
        "compile_time": 2.182461738586426
    },
    {
        "BLOCK_SIZE_M": 32,
        "BLOCK_SIZE_N": 256,
        "BLOCK_SIZE_K": 32,
        "GROUP_SIZE_M": 8,
        "num_stages": 6,
        "num_warps": 4,
        "ms": 0.1340433657169342,
        "min_ms": 0.1340433657169342,
        "max_ms": 0.1340433657169342,
        "compile_time": 1.0320942401885986
    },
    {
        "BLOCK_SIZE_M": 128,
        "BLOCK_SIZE_N": 64,
        "BLOCK_SIZE_K": 128,
        "GROUP_SIZE_M": 8,
        "num_stages": 1,
        "num_warps": 8,
        "ms": 0.13413694500923157,
        "min_ms": 0.13413694500923157,
        "max_ms": 0.13413694500923157,
        "compile_time": 1.1024627685546875
    },
    {
        "BLOCK_SIZE_M": 32,
        "BLOCK_SIZE_N": 256,
        "BLOCK_SIZE_K": 32,
        "GROUP_SIZE_M": 8,
        "num_stages": 7,
        "num_warps": 4,
        "ms": 0.13435229659080505,
        "min_ms": 0.13435229659080505,
        "max_ms": 0.13435229659080505,
        "compile_time": 1.0383875370025635
    },
    {
        "BLOCK_SIZE_M": 128,
        "BLOCK_SIZE_N": 128,
        "BLOCK_SIZE_K": 64,
        "GROUP_SIZE_M": 8,
        "num_stages": 2,
        "num_warps": 8,
        "ms": 0.1346011608839035,
        "min_ms": 0.1346011608839035,
        "max_ms": 0.1346011608839035,
        "compile_time": 1.087193250656128
    },
    {
        "BLOCK_SIZE_M": 32,
        "BLOCK_SIZE_N": 256,
        "BLOCK_SIZE_K": 32,
        "GROUP_SIZE_M": 8,
        "num_stages": 8,
        "num_warps": 4,
        "ms": 0.134675532579422,
        "min_ms": 0.134675532579422,
        "max_ms": 0.134675532579422,
        "compile_time": 1.0060157775878906
    },
    {
        "BLOCK_SIZE_M": 64,
        "BLOCK_SIZE_N": 256,
        "BLOCK_SIZE_K": 16,
        "GROUP_SIZE_M": 8,
        "num_stages": 4,
        "num_warps": 4,
        "ms": 0.1347082555294037,
        "min_ms": 0.1347082555294037,
        "max_ms": 0.1347082555294037,
        "compile_time": 2.0080406665802
    },
    {
        "BLOCK_SIZE_M": 64,
        "BLOCK_SIZE_N": 64,
        "BLOCK_SIZE_K": 256,
        "GROUP_SIZE_M": 8,
        "num_stages": 2,
        "num_warps": 4,
        "ms": 0.13473054766654968,
        "min_ms": 0.13473054766654968,
        "max_ms": 0.13473054766654968,
        "compile_time": 1.062903642654419
    },
    {
        "BLOCK_SIZE_M": 256,
        "BLOCK_SIZE_N": 32,
        "BLOCK_SIZE_K": 64,
        "GROUP_SIZE_M": 8,
        "num_stages": 3,
        "num_warps": 8,
        "ms": 0.13478609919548035,
        "min_ms": 0.13478609919548035,
        "max_ms": 0.13478609919548035,
        "compile_time": 1.157670021057129
    },
    {
        "BLOCK_SIZE_M": 128,
        "BLOCK_SIZE_N": 64,
        "BLOCK_SIZE_K": 128,
        "GROUP_SIZE_M": 8,
        "num_stages": 4,
        "num_warps": 16,
        "ms": 0.13483862578868866,
        "min_ms": 0.13483862578868866,
        "max_ms": 0.13483862578868866,
        "compile_time": 1.0986542701721191
    },
    {
        "BLOCK_SIZE_M": 64,
        "BLOCK_SIZE_N": 64,
        "BLOCK_SIZE_K": 64,
        "GROUP_SIZE_M": 8,
        "num_stages": 5,
        "num_warps": 8,
        "ms": 0.1348726749420166,
        "min_ms": 0.1348726749420166,
        "max_ms": 0.1348726749420166,
        "compile_time": 1.0803747177124023
    },
    {
        "BLOCK_SIZE_M": 32,
        "BLOCK_SIZE_N": 256,
        "BLOCK_SIZE_K": 64,
        "GROUP_SIZE_M": 8,
        "num_stages": 5,
        "num_warps": 4,
        "ms": 0.1349000632762909,
        "min_ms": 0.1349000632762909,
        "max_ms": 0.1349000632762909,
        "compile_time": 1.0371205806732178
    },
    {
        "BLOCK_SIZE_M": 64,
        "BLOCK_SIZE_N": 128,
        "BLOCK_SIZE_K": 128,
        "GROUP_SIZE_M": 8,
        "num_stages": 1,
        "num_warps": 8,
        "ms": 0.13531282544136047,
        "min_ms": 0.13531282544136047,
        "max_ms": 0.13531282544136047,
        "compile_time": 1.0673186779022217
    },
    {
        "BLOCK_SIZE_M": 64,
        "BLOCK_SIZE_N": 128,
        "BLOCK_SIZE_K": 128,
        "GROUP_SIZE_M": 8,
        "num_stages": 4,
        "num_warps": 16,
        "ms": 0.13538029789924622,
        "min_ms": 0.13538029789924622,
        "max_ms": 0.13538029789924622,
        "compile_time": 1.0673027038574219
    },
    {
        "BLOCK_SIZE_M": 64,
        "BLOCK_SIZE_N": 64,
        "BLOCK_SIZE_K": 128,
        "GROUP_SIZE_M": 8,
        "num_stages": 2,
        "num_warps": 2,
        "ms": 0.13572648167610168,
        "min_ms": 0.13572648167610168,
        "max_ms": 0.13572648167610168,
        "compile_time": 1.0486233234405518
    },
    {
        "BLOCK_SIZE_M": 32,
        "BLOCK_SIZE_N": 256,
        "BLOCK_SIZE_K": 64,
        "GROUP_SIZE_M": 8,
        "num_stages": 5,
        "num_warps": 8,
        "ms": 0.13572804629802704,
        "min_ms": 0.13572804629802704,
        "max_ms": 0.13572804629802704,
        "compile_time": 1.0434651374816895
    },
    {
        "BLOCK_SIZE_M": 256,
        "BLOCK_SIZE_N": 32,
        "BLOCK_SIZE_K": 64,
        "GROUP_SIZE_M": 8,
        "num_stages": 4,
        "num_warps": 4,
        "ms": 0.1358618587255478,
        "min_ms": 0.1358618587255478,
        "max_ms": 0.1358618587255478,
        "compile_time": 1.1190941333770752
    },
    {
        "BLOCK_SIZE_M": 64,
        "BLOCK_SIZE_N": 128,
        "BLOCK_SIZE_K": 64,
        "GROUP_SIZE_M": 8,
        "num_stages": 1,
        "num_warps": 4,
        "ms": 0.1359117478132248,
        "min_ms": 0.1359117478132248,
        "max_ms": 0.1359117478132248,
        "compile_time": 1.0356528759002686
    },
    {
        "BLOCK_SIZE_M": 64,
        "BLOCK_SIZE_N": 128,
        "BLOCK_SIZE_K": 64,
        "GROUP_SIZE_M": 8,
        "num_stages": 2,
        "num_warps": 2,
        "ms": 0.13595545291900635,
        "min_ms": 0.13595545291900635,
        "max_ms": 0.13595545291900635,
        "compile_time": 1.0664536952972412
    },
    {
        "BLOCK_SIZE_M": 256,
        "BLOCK_SIZE_N": 32,
        "BLOCK_SIZE_K": 64,
        "GROUP_SIZE_M": 8,
        "num_stages": 4,
        "num_warps": 8,
        "ms": 0.13614478707313538,
        "min_ms": 0.13614478707313538,
        "max_ms": 0.13614478707313538,
        "compile_time": 1.1337356567382812
    },
    {
        "BLOCK_SIZE_M": 256,
        "BLOCK_SIZE_N": 32,
        "BLOCK_SIZE_K": 32,
        "GROUP_SIZE_M": 8,
        "num_stages": 4,
        "num_warps": 8,
        "ms": 0.13644835352897644,
        "min_ms": 0.13644835352897644,
        "max_ms": 0.13644835352897644,
        "compile_time": 1.1514358520507812
    },
    {
        "BLOCK_SIZE_M": 64,
        "BLOCK_SIZE_N": 512,
        "BLOCK_SIZE_K": 64,
        "GROUP_SIZE_M": 8,
        "num_stages": 3,
        "num_warps": 8,
        "ms": 0.13646182417869568,
        "min_ms": 0.13646182417869568,
        "max_ms": 0.13646182417869568,
        "compile_time": 2.5016674995422363
    },
    {
        "BLOCK_SIZE_M": 128,
        "BLOCK_SIZE_N": 64,
        "BLOCK_SIZE_K": 16,
        "GROUP_SIZE_M": 8,
        "num_stages": 7,
        "num_warps": 4,
        "ms": 0.1365855187177658,
        "min_ms": 0.1365855187177658,
        "max_ms": 0.1365855187177658,
        "compile_time": 1.1406409740447998
    },
    {
        "BLOCK_SIZE_M": 64,
        "BLOCK_SIZE_N": 64,
        "BLOCK_SIZE_K": 64,
        "GROUP_SIZE_M": 8,
        "num_stages": 6,
        "num_warps": 8,
        "ms": 0.13660195469856262,
        "min_ms": 0.13660195469856262,
        "max_ms": 0.13660195469856262,
        "compile_time": 1.0793898105621338
    },
    {
        "BLOCK_SIZE_M": 256,
        "BLOCK_SIZE_N": 32,
        "BLOCK_SIZE_K": 64,
        "GROUP_SIZE_M": 8,
        "num_stages": 5,
        "num_warps": 8,
        "ms": 0.13677097856998444,
        "min_ms": 0.13677097856998444,
        "max_ms": 0.13677097856998444,
        "compile_time": 1.1459918022155762
    },
    {
        "BLOCK_SIZE_M": 64,
        "BLOCK_SIZE_N": 128,
        "BLOCK_SIZE_K": 64,
        "GROUP_SIZE_M": 8,
        "num_stages": 3,
        "num_warps": 16,
        "ms": 0.13690032064914703,
        "min_ms": 0.13690032064914703,
        "max_ms": 0.13690032064914703,
        "compile_time": 1.0763850212097168
    },
    {
        "BLOCK_SIZE_M": 128,
        "BLOCK_SIZE_N": 64,
        "BLOCK_SIZE_K": 32,
        "GROUP_SIZE_M": 8,
        "num_stages": 8,
        "num_warps": 2,
        "ms": 0.13701191544532776,
        "min_ms": 0.13701191544532776,
        "max_ms": 0.13701191544532776,
        "compile_time": 1.1102359294891357
    },
    {
        "BLOCK_SIZE_M": 32,
        "BLOCK_SIZE_N": 256,
        "BLOCK_SIZE_K": 64,
        "GROUP_SIZE_M": 8,
        "num_stages": 4,
        "num_warps": 8,
        "ms": 0.13705965876579285,
        "min_ms": 0.13705965876579285,
        "max_ms": 0.13705965876579285,
        "compile_time": 1.0136752128601074
    },
    {
        "BLOCK_SIZE_M": 128,
        "BLOCK_SIZE_N": 256,
        "BLOCK_SIZE_K": 64,
        "GROUP_SIZE_M": 8,
        "num_stages": 2,
        "num_warps": 8,
        "ms": 0.13708581030368805,
        "min_ms": 0.13708581030368805,
        "max_ms": 0.13708581030368805,
        "compile_time": 1.1364662647247314
    },
    {
        "BLOCK_SIZE_M": 256,
        "BLOCK_SIZE_N": 32,
        "BLOCK_SIZE_K": 32,
        "GROUP_SIZE_M": 8,
        "num_stages": 3,
        "num_warps": 8,
        "ms": 0.1373114287853241,
        "min_ms": 0.1373114287853241,
        "max_ms": 0.1373114287853241,
        "compile_time": 1.1576507091522217
    },
    {
        "BLOCK_SIZE_M": 64,
        "BLOCK_SIZE_N": 128,
        "BLOCK_SIZE_K": 64,
        "GROUP_SIZE_M": 8,
        "num_stages": 4,
        "num_warps": 16,
        "ms": 0.13732093572616577,
        "min_ms": 0.13732093572616577,
        "max_ms": 0.13732093572616577,
        "compile_time": 1.0582139492034912
    },
    {
        "BLOCK_SIZE_M": 32,
        "BLOCK_SIZE_N": 256,
        "BLOCK_SIZE_K": 32,
        "GROUP_SIZE_M": 8,
        "num_stages": 6,
        "num_warps": 8,
        "ms": 0.13735947012901306,
        "min_ms": 0.13735947012901306,
        "max_ms": 0.13735947012901306,
        "compile_time": 1.0465316772460938
    },
    {
        "BLOCK_SIZE_M": 32,
        "BLOCK_SIZE_N": 256,
        "BLOCK_SIZE_K": 64,
        "GROUP_SIZE_M": 8,
        "num_stages": 4,
        "num_warps": 4,
        "ms": 0.1373760849237442,
        "min_ms": 0.1373760849237442,
        "max_ms": 0.1373760849237442,
        "compile_time": 1.0590782165527344
    },
    {
        "BLOCK_SIZE_M": 32,
        "BLOCK_SIZE_N": 128,
        "BLOCK_SIZE_K": 32,
        "GROUP_SIZE_M": 8,
        "num_stages": 4,
        "num_warps": 4,
        "ms": 0.13744406402111053,
        "min_ms": 0.13744406402111053,
        "max_ms": 0.13744406402111053,
        "compile_time": 1.0411300659179688
    },
    {
        "BLOCK_SIZE_M": 128,
        "BLOCK_SIZE_N": 64,
        "BLOCK_SIZE_K": 64,
        "GROUP_SIZE_M": 8,
        "num_stages": 2,
        "num_warps": 2,
        "ms": 0.13746921718120575,
        "min_ms": 0.13746921718120575,
        "max_ms": 0.13746921718120575,
        "compile_time": 1.1031553745269775
    },
    {
        "BLOCK_SIZE_M": 64,
        "BLOCK_SIZE_N": 256,
        "BLOCK_SIZE_K": 16,
        "GROUP_SIZE_M": 8,
        "num_stages": 5,
        "num_warps": 8,
        "ms": 0.13759472966194153,
        "min_ms": 0.13759472966194153,
        "max_ms": 0.13759472966194153,
        "compile_time": 1.0729880332946777
    },
    {
        "BLOCK_SIZE_M": 64,
        "BLOCK_SIZE_N": 256,
        "BLOCK_SIZE_K": 16,
        "GROUP_SIZE_M": 8,
        "num_stages": 3,
        "num_warps": 8,
        "ms": 0.1379121094942093,
        "min_ms": 0.1379121094942093,
        "max_ms": 0.1379121094942093,
        "compile_time": 1.0567779541015625
    },
    {
        "BLOCK_SIZE_M": 64,
        "BLOCK_SIZE_N": 256,
        "BLOCK_SIZE_K": 16,
        "GROUP_SIZE_M": 8,
        "num_stages": 4,
        "num_warps": 8,
        "ms": 0.13804323971271515,
        "min_ms": 0.13804323971271515,
        "max_ms": 0.13804323971271515,
        "compile_time": 1.06907057762146
    },
    {
        "BLOCK_SIZE_M": 256,
        "BLOCK_SIZE_N": 32,
        "BLOCK_SIZE_K": 32,
        "GROUP_SIZE_M": 8,
        "num_stages": 5,
        "num_warps": 8,
        "ms": 0.13823267817497253,
        "min_ms": 0.13823267817497253,
        "max_ms": 0.13823267817497253,
        "compile_time": 1.15948486328125
    },
    {
        "BLOCK_SIZE_M": 32,
        "BLOCK_SIZE_N": 256,
        "BLOCK_SIZE_K": 16,
        "GROUP_SIZE_M": 8,
        "num_stages": 7,
        "num_warps": 2,
        "ms": 0.13826517760753632,
        "min_ms": 0.13826517760753632,
        "max_ms": 0.13826517760753632,
        "compile_time": 2.121506452560425
    },
    {
        "BLOCK_SIZE_M": 32,
        "BLOCK_SIZE_N": 256,
        "BLOCK_SIZE_K": 32,
        "GROUP_SIZE_M": 8,
        "num_stages": 7,
        "num_warps": 8,
        "ms": 0.13831543922424316,
        "min_ms": 0.13831543922424316,
        "max_ms": 0.13831543922424316,
        "compile_time": 1.0533010959625244
    },
    {
        "BLOCK_SIZE_M": 64,
        "BLOCK_SIZE_N": 256,
        "BLOCK_SIZE_K": 16,
        "GROUP_SIZE_M": 8,
        "num_stages": 7,
        "num_warps": 8,
        "ms": 0.1383836269378662,
        "min_ms": 0.1383836269378662,
        "max_ms": 0.1383836269378662,
        "compile_time": 1.0472972393035889
    },
    {
        "BLOCK_SIZE_M": 32,
        "BLOCK_SIZE_N": 128,
        "BLOCK_SIZE_K": 32,
        "GROUP_SIZE_M": 8,
        "num_stages": 5,
        "num_warps": 4,
        "ms": 0.1385008990764618,
        "min_ms": 0.1385008990764618,
        "max_ms": 0.1385008990764618,
        "compile_time": 1.0501368045806885
    },
    {
        "BLOCK_SIZE_M": 256,
        "BLOCK_SIZE_N": 64,
        "BLOCK_SIZE_K": 32,
        "GROUP_SIZE_M": 8,
        "num_stages": 2,
        "num_warps": 4,
        "ms": 0.13859012722969055,
        "min_ms": 0.13859012722969055,
        "max_ms": 0.13859012722969055,
        "compile_time": 1.1251964569091797
    },
    {
        "BLOCK_SIZE_M": 64,
        "BLOCK_SIZE_N": 256,
        "BLOCK_SIZE_K": 16,
        "GROUP_SIZE_M": 8,
        "num_stages": 6,
        "num_warps": 8,
        "ms": 0.1386495977640152,
        "min_ms": 0.1386495977640152,
        "max_ms": 0.1386495977640152,
        "compile_time": 1.073117971420288
    },
    {
        "BLOCK_SIZE_M": 64,
        "BLOCK_SIZE_N": 64,
        "BLOCK_SIZE_K": 16,
        "GROUP_SIZE_M": 8,
        "num_stages": 7,
        "num_warps": 2,
        "ms": 0.13869889080524445,
        "min_ms": 0.13869889080524445,
        "max_ms": 0.13869889080524445,
        "compile_time": 1.7083196640014648
    },
    {
        "BLOCK_SIZE_M": 64,
        "BLOCK_SIZE_N": 128,
        "BLOCK_SIZE_K": 64,
        "GROUP_SIZE_M": 8,
        "num_stages": 6,
        "num_warps": 16,
        "ms": 0.13874830305576324,
        "min_ms": 0.13874830305576324,
        "max_ms": 0.13874830305576324,
        "compile_time": 1.0535109043121338
    },
    {
        "BLOCK_SIZE_M": 64,
        "BLOCK_SIZE_N": 256,
        "BLOCK_SIZE_K": 16,
        "GROUP_SIZE_M": 8,
        "num_stages": 8,
        "num_warps": 8,
        "ms": 0.1387716829776764,
        "min_ms": 0.1387716829776764,
        "max_ms": 0.1387716829776764,
        "compile_time": 1.0847299098968506
    },
    {
        "BLOCK_SIZE_M": 32,
        "BLOCK_SIZE_N": 256,
        "BLOCK_SIZE_K": 32,
        "GROUP_SIZE_M": 8,
        "num_stages": 5,
        "num_warps": 4,
        "ms": 0.13879412412643433,
        "min_ms": 0.13879412412643433,
        "max_ms": 0.13879412412643433,
        "compile_time": 1.0581834316253662
    },
    {
        "BLOCK_SIZE_M": 64,
        "BLOCK_SIZE_N": 128,
        "BLOCK_SIZE_K": 64,
        "GROUP_SIZE_M": 8,
        "num_stages": 5,
        "num_warps": 16,
        "ms": 0.1389569789171219,
        "min_ms": 0.1389569789171219,
        "max_ms": 0.1389569789171219,
        "compile_time": 1.066218376159668
    },
    {
        "BLOCK_SIZE_M": 128,
        "BLOCK_SIZE_N": 128,
        "BLOCK_SIZE_K": 128,
        "GROUP_SIZE_M": 8,
        "num_stages": 2,
        "num_warps": 16,
        "ms": 0.13900500535964966,
        "min_ms": 0.13900500535964966,
        "max_ms": 0.13900500535964966,
        "compile_time": 1.0916082859039307
    },
    {
        "BLOCK_SIZE_M": 32,
        "BLOCK_SIZE_N": 128,
        "BLOCK_SIZE_K": 32,
        "GROUP_SIZE_M": 8,
        "num_stages": 3,
        "num_warps": 4,
        "ms": 0.13906168937683105,
        "min_ms": 0.13906168937683105,
        "max_ms": 0.13906168937683105,
        "compile_time": 1.04254150390625
    },
    {
        "BLOCK_SIZE_M": 128,
        "BLOCK_SIZE_N": 32,
        "BLOCK_SIZE_K": 32,
        "GROUP_SIZE_M": 8,
        "num_stages": 3,
        "num_warps": 2,
        "ms": 0.1390729397535324,
        "min_ms": 0.1390729397535324,
        "max_ms": 0.1390729397535324,
        "compile_time": 1.1240978240966797
    },
    {
        "BLOCK_SIZE_M": 256,
        "BLOCK_SIZE_N": 32,
        "BLOCK_SIZE_K": 32,
        "GROUP_SIZE_M": 8,
        "num_stages": 2,
        "num_warps": 4,
        "ms": 0.13921543955802917,
        "min_ms": 0.13921543955802917,
        "max_ms": 0.13921543955802917,
        "compile_time": 1.131772518157959
    },
    {
        "BLOCK_SIZE_M": 64,
        "BLOCK_SIZE_N": 64,
        "BLOCK_SIZE_K": 16,
        "GROUP_SIZE_M": 8,
        "num_stages": 8,
        "num_warps": 2,
        "ms": 0.13921579718589783,
        "min_ms": 0.13921579718589783,
        "max_ms": 0.13921579718589783,
        "compile_time": 1.7331678867340088
    },
    {
        "BLOCK_SIZE_M": 128,
        "BLOCK_SIZE_N": 32,
        "BLOCK_SIZE_K": 64,
        "GROUP_SIZE_M": 8,
        "num_stages": 3,
        "num_warps": 4,
        "ms": 0.13929924368858337,
        "min_ms": 0.13929924368858337,
        "max_ms": 0.13929924368858337,
        "compile_time": 1.124650478363037
    },
    {
        "BLOCK_SIZE_M": 32,
        "BLOCK_SIZE_N": 128,
        "BLOCK_SIZE_K": 32,
        "GROUP_SIZE_M": 8,
        "num_stages": 4,
        "num_warps": 2,
        "ms": 0.13944189250469208,
        "min_ms": 0.13944189250469208,
        "max_ms": 0.13944189250469208,
        "compile_time": 1.0351226329803467
    },
    {
        "BLOCK_SIZE_M": 32,
        "BLOCK_SIZE_N": 256,
        "BLOCK_SIZE_K": 32,
        "GROUP_SIZE_M": 8,
        "num_stages": 8,
        "num_warps": 8,
        "ms": 0.1394730806350708,
        "min_ms": 0.1394730806350708,
        "max_ms": 0.1394730806350708,
        "compile_time": 1.6788017749786377
    },
    {
        "BLOCK_SIZE_M": 32,
        "BLOCK_SIZE_N": 256,
        "BLOCK_SIZE_K": 16,
        "GROUP_SIZE_M": 8,
        "num_stages": 5,
        "num_warps": 2,
        "ms": 0.1396818608045578,
        "min_ms": 0.1396818608045578,
        "max_ms": 0.1396818608045578,
        "compile_time": 2.0241479873657227
    },
    {
        "BLOCK_SIZE_M": 64,
        "BLOCK_SIZE_N": 64,
        "BLOCK_SIZE_K": 16,
        "GROUP_SIZE_M": 8,
        "num_stages": 6,
        "num_warps": 4,
        "ms": 0.13970300555229187,
        "min_ms": 0.13970300555229187,
        "max_ms": 0.13970300555229187,
        "compile_time": 1.074418306350708
    },
    {
        "BLOCK_SIZE_M": 32,
        "BLOCK_SIZE_N": 256,
        "BLOCK_SIZE_K": 16,
        "GROUP_SIZE_M": 8,
        "num_stages": 5,
        "num_warps": 8,
        "ms": 0.13980315625667572,
        "min_ms": 0.13980315625667572,
        "max_ms": 0.13980315625667572,
        "compile_time": 1.5264239311218262
    },
    {
        "BLOCK_SIZE_M": 256,
        "BLOCK_SIZE_N": 32,
        "BLOCK_SIZE_K": 128,
        "GROUP_SIZE_M": 8,
        "num_stages": 3,
        "num_warps": 4,
        "ms": 0.13995316624641418,
        "min_ms": 0.13995316624641418,
        "max_ms": 0.13995316624641418,
        "compile_time": 1.0394058227539062
    },
    {
        "BLOCK_SIZE_M": 128,
        "BLOCK_SIZE_N": 128,
        "BLOCK_SIZE_K": 256,
        "GROUP_SIZE_M": 8,
        "num_stages": 1,
        "num_warps": 8,
        "ms": 0.14003238081932068,
        "min_ms": 0.14003238081932068,
        "max_ms": 0.14003238081932068,
        "compile_time": 1.1109592914581299
    },
    {
        "BLOCK_SIZE_M": 64,
        "BLOCK_SIZE_N": 64,
        "BLOCK_SIZE_K": 128,
        "GROUP_SIZE_M": 8,
        "num_stages": 3,
        "num_warps": 2,
        "ms": 0.1400355100631714,
        "min_ms": 0.1400355100631714,
        "max_ms": 0.1400355100631714,
        "compile_time": 1.0555555820465088
    },
    {
        "BLOCK_SIZE_M": 32,
        "BLOCK_SIZE_N": 256,
        "BLOCK_SIZE_K": 16,
        "GROUP_SIZE_M": 8,
        "num_stages": 8,
        "num_warps": 2,
        "ms": 0.14023661613464355,
        "min_ms": 0.14023661613464355,
        "max_ms": 0.14023661613464355,
        "compile_time": 2.1449906826019287
    },
    {
        "BLOCK_SIZE_M": 128,
        "BLOCK_SIZE_N": 32,
        "BLOCK_SIZE_K": 32,
        "GROUP_SIZE_M": 8,
        "num_stages": 4,
        "num_warps": 4,
        "ms": 0.14029286801815033,
        "min_ms": 0.14029286801815033,
        "max_ms": 0.14029286801815033,
        "compile_time": 1.1405608654022217
    },
    {
        "BLOCK_SIZE_M": 64,
        "BLOCK_SIZE_N": 128,
        "BLOCK_SIZE_K": 32,
        "GROUP_SIZE_M": 8,
        "num_stages": 2,
        "num_warps": 8,
        "ms": 0.14042934775352478,
        "min_ms": 0.14042934775352478,
        "max_ms": 0.14042934775352478,
        "compile_time": 1.039912462234497
    },
    {
        "BLOCK_SIZE_M": 64,
        "BLOCK_SIZE_N": 64,
        "BLOCK_SIZE_K": 64,
        "GROUP_SIZE_M": 8,
        "num_stages": 2,
        "num_warps": 2,
        "ms": 0.14044880867004395,
        "min_ms": 0.14044880867004395,
        "max_ms": 0.14044880867004395,
        "compile_time": 1.0594360828399658
    },
    {
        "BLOCK_SIZE_M": 64,
        "BLOCK_SIZE_N": 256,
        "BLOCK_SIZE_K": 32,
        "GROUP_SIZE_M": 8,
        "num_stages": 4,
        "num_warps": 16,
        "ms": 0.1406669169664383,
        "min_ms": 0.1406669169664383,
        "max_ms": 0.1406669169664383,
        "compile_time": 1.072126865386963
    },
    {
        "BLOCK_SIZE_M": 64,
        "BLOCK_SIZE_N": 64,
        "BLOCK_SIZE_K": 256,
        "GROUP_SIZE_M": 8,
        "num_stages": 3,
        "num_warps": 4,
        "ms": 0.14066791534423828,
        "min_ms": 0.14066791534423828,
        "max_ms": 0.14066791534423828,
        "compile_time": 1.0491886138916016
    },
    {
        "BLOCK_SIZE_M": 32,
        "BLOCK_SIZE_N": 256,
        "BLOCK_SIZE_K": 16,
        "GROUP_SIZE_M": 8,
        "num_stages": 4,
        "num_warps": 8,
        "ms": 0.14067785441875458,
        "min_ms": 0.14067785441875458,
        "max_ms": 0.14067785441875458,
        "compile_time": 0.9590044021606445
    },
    {
        "BLOCK_SIZE_M": 64,
        "BLOCK_SIZE_N": 256,
        "BLOCK_SIZE_K": 32,
        "GROUP_SIZE_M": 8,
        "num_stages": 3,
        "num_warps": 16,
        "ms": 0.14069128036499023,
        "min_ms": 0.14069128036499023,
        "max_ms": 0.14069128036499023,
        "compile_time": 1.0666770935058594
    },
    {
        "BLOCK_SIZE_M": 128,
        "BLOCK_SIZE_N": 32,
        "BLOCK_SIZE_K": 32,
        "GROUP_SIZE_M": 8,
        "num_stages": 3,
        "num_warps": 4,
        "ms": 0.14076857268810272,
        "min_ms": 0.14076857268810272,
        "max_ms": 0.14076857268810272,
        "compile_time": 1.1214416027069092
    },
    {
        "BLOCK_SIZE_M": 128,
        "BLOCK_SIZE_N": 32,
        "BLOCK_SIZE_K": 32,
        "GROUP_SIZE_M": 8,
        "num_stages": 4,
        "num_warps": 2,
        "ms": 0.14080950617790222,
        "min_ms": 0.14080950617790222,
        "max_ms": 0.14080950617790222,
        "compile_time": 1.1137421131134033
    },
    {
        "BLOCK_SIZE_M": 32,
        "BLOCK_SIZE_N": 256,
        "BLOCK_SIZE_K": 16,
        "GROUP_SIZE_M": 8,
        "num_stages": 6,
        "num_warps": 8,
        "ms": 0.1408127099275589,
        "min_ms": 0.1408127099275589,
        "max_ms": 0.1408127099275589,
        "compile_time": 1.0423545837402344
    },
    {
        "BLOCK_SIZE_M": 64,
        "BLOCK_SIZE_N": 256,
        "BLOCK_SIZE_K": 32,
        "GROUP_SIZE_M": 8,
        "num_stages": 6,
        "num_warps": 16,
        "ms": 0.14083179831504822,
        "min_ms": 0.14083179831504822,
        "max_ms": 0.14083179831504822,
        "compile_time": 1.0722315311431885
    },
    {
        "BLOCK_SIZE_M": 64,
        "BLOCK_SIZE_N": 64,
        "BLOCK_SIZE_K": 16,
        "GROUP_SIZE_M": 8,
        "num_stages": 6,
        "num_warps": 2,
        "ms": 0.140852689743042,
        "min_ms": 0.140852689743042,
        "max_ms": 0.140852689743042,
        "compile_time": 1.6869111061096191
    },
    {
        "BLOCK_SIZE_M": 64,
        "BLOCK_SIZE_N": 256,
        "BLOCK_SIZE_K": 32,
        "GROUP_SIZE_M": 8,
        "num_stages": 5,
        "num_warps": 16,
        "ms": 0.1408550888299942,
        "min_ms": 0.1408550888299942,
        "max_ms": 0.1408550888299942,
        "compile_time": 1.07319974899292
    },
    {
        "BLOCK_SIZE_M": 64,
        "BLOCK_SIZE_N": 256,
        "BLOCK_SIZE_K": 32,
        "GROUP_SIZE_M": 8,
        "num_stages": 7,
        "num_warps": 16,
        "ms": 0.14093086123466492,
        "min_ms": 0.14093086123466492,
        "max_ms": 0.14093086123466492,
        "compile_time": 1.0747945308685303
    },
    {
        "BLOCK_SIZE_M": 32,
        "BLOCK_SIZE_N": 256,
        "BLOCK_SIZE_K": 16,
        "GROUP_SIZE_M": 8,
        "num_stages": 4,
        "num_warps": 2,
        "ms": 0.14100196957588196,
        "min_ms": 0.14100196957588196,
        "max_ms": 0.14100196957588196,
        "compile_time": 1.979022741317749
    },
    {
        "BLOCK_SIZE_M": 256,
        "BLOCK_SIZE_N": 32,
        "BLOCK_SIZE_K": 128,
        "GROUP_SIZE_M": 8,
        "num_stages": 3,
        "num_warps": 8,
        "ms": 0.14101190865039825,
        "min_ms": 0.14101190865039825,
        "max_ms": 0.14101190865039825,
        "compile_time": 1.1239244937896729
    },
    {
        "BLOCK_SIZE_M": 128,
        "BLOCK_SIZE_N": 32,
        "BLOCK_SIZE_K": 32,
        "GROUP_SIZE_M": 8,
        "num_stages": 6,
        "num_warps": 2,
        "ms": 0.14126428961753845,
        "min_ms": 0.14126428961753845,
        "max_ms": 0.14126428961753845,
        "compile_time": 1.1167364120483398
    },
    {
        "BLOCK_SIZE_M": 32,
        "BLOCK_SIZE_N": 128,
        "BLOCK_SIZE_K": 16,
        "GROUP_SIZE_M": 8,
        "num_stages": 6,
        "num_warps": 2,
        "ms": 0.1413191854953766,
        "min_ms": 0.1413191854953766,
        "max_ms": 0.1413191854953766,
        "compile_time": 1.6623406410217285
    },
    {
        "BLOCK_SIZE_M": 64,
        "BLOCK_SIZE_N": 256,
        "BLOCK_SIZE_K": 32,
        "GROUP_SIZE_M": 8,
        "num_stages": 8,
        "num_warps": 16,
        "ms": 0.1413276046514511,
        "min_ms": 0.1413276046514511,
        "max_ms": 0.1413276046514511,
        "compile_time": 1.0724422931671143
    },
    {
        "BLOCK_SIZE_M": 256,
        "BLOCK_SIZE_N": 64,
        "BLOCK_SIZE_K": 32,
        "GROUP_SIZE_M": 8,
        "num_stages": 4,
        "num_warps": 16,
        "ms": 0.141341894865036,
        "min_ms": 0.141341894865036,
        "max_ms": 0.141341894865036,
        "compile_time": 1.1324396133422852
    },
    {
        "BLOCK_SIZE_M": 32,
        "BLOCK_SIZE_N": 256,
        "BLOCK_SIZE_K": 16,
        "GROUP_SIZE_M": 8,
        "num_stages": 6,
        "num_warps": 4,
        "ms": 0.14163623750209808,
        "min_ms": 0.14163623750209808,
        "max_ms": 0.14163623750209808,
        "compile_time": 1.6732518672943115
    },
    {
        "BLOCK_SIZE_M": 128,
        "BLOCK_SIZE_N": 32,
        "BLOCK_SIZE_K": 32,
        "GROUP_SIZE_M": 8,
        "num_stages": 5,
        "num_warps": 4,
        "ms": 0.1417388617992401,
        "min_ms": 0.1417388617992401,
        "max_ms": 0.1417388617992401,
        "compile_time": 1.1308565139770508
    },
    {
        "BLOCK_SIZE_M": 64,
        "BLOCK_SIZE_N": 128,
        "BLOCK_SIZE_K": 64,
        "GROUP_SIZE_M": 8,
        "num_stages": 7,
        "num_warps": 16,
        "ms": 0.14175757765769958,
        "min_ms": 0.14175757765769958,
        "max_ms": 0.14175757765769958,
        "compile_time": 1.0743463039398193
    },
    {
        "BLOCK_SIZE_M": 32,
        "BLOCK_SIZE_N": 128,
        "BLOCK_SIZE_K": 32,
        "GROUP_SIZE_M": 8,
        "num_stages": 6,
        "num_warps": 4,
        "ms": 0.141766756772995,
        "min_ms": 0.141766756772995,
        "max_ms": 0.141766756772995,
        "compile_time": 1.0558838844299316
    },
    {
        "BLOCK_SIZE_M": 256,
        "BLOCK_SIZE_N": 32,
        "BLOCK_SIZE_K": 64,
        "GROUP_SIZE_M": 8,
        "num_stages": 3,
        "num_warps": 4,
        "ms": 0.14180321991443634,
        "min_ms": 0.14180321991443634,
        "max_ms": 0.14180321991443634,
        "compile_time": 1.120356798171997
    },
    {
        "BLOCK_SIZE_M": 32,
        "BLOCK_SIZE_N": 256,
        "BLOCK_SIZE_K": 128,
        "GROUP_SIZE_M": 8,
        "num_stages": 3,
        "num_warps": 4,
        "ms": 0.1418072134256363,
        "min_ms": 0.1418072134256363,
        "max_ms": 0.1418072134256363,
        "compile_time": 0.9394075870513916
    },
    {
        "BLOCK_SIZE_M": 64,
        "BLOCK_SIZE_N": 128,
        "BLOCK_SIZE_K": 32,
        "GROUP_SIZE_M": 8,
        "num_stages": 1,
        "num_warps": 8,
        "ms": 0.14215053617954254,
        "min_ms": 0.14215053617954254,
        "max_ms": 0.14215053617954254,
        "compile_time": 1.0212442874908447
    },
    {
        "BLOCK_SIZE_M": 32,
        "BLOCK_SIZE_N": 256,
        "BLOCK_SIZE_K": 32,
        "GROUP_SIZE_M": 8,
        "num_stages": 3,
        "num_warps": 4,
        "ms": 0.14239457249641418,
        "min_ms": 0.14239457249641418,
        "max_ms": 0.14239457249641418,
        "compile_time": 1.018758773803711
    },
    {
        "BLOCK_SIZE_M": 64,
        "BLOCK_SIZE_N": 64,
        "BLOCK_SIZE_K": 16,
        "GROUP_SIZE_M": 8,
        "num_stages": 7,
        "num_warps": 4,
        "ms": 0.14242714643478394,
        "min_ms": 0.14242714643478394,
        "max_ms": 0.14242714643478394,
        "compile_time": 1.6013436317443848
    },
    {
        "BLOCK_SIZE_M": 512,
        "BLOCK_SIZE_N": 32,
        "BLOCK_SIZE_K": 32,
        "GROUP_SIZE_M": 8,
        "num_stages": 4,
        "num_warps": 8,
        "ms": 0.14243708550930023,
        "min_ms": 0.14243708550930023,
        "max_ms": 0.14243708550930023,
        "compile_time": 1.1647205352783203
    },
    {
        "BLOCK_SIZE_M": 256,
        "BLOCK_SIZE_N": 64,
        "BLOCK_SIZE_K": 32,
        "GROUP_SIZE_M": 8,
        "num_stages": 6,
        "num_warps": 16,
        "ms": 0.14250771701335907,
        "min_ms": 0.14250771701335907,
        "max_ms": 0.14250771701335907,
        "compile_time": 1.1422443389892578
    },
    {
        "BLOCK_SIZE_M": 64,
        "BLOCK_SIZE_N": 128,
        "BLOCK_SIZE_K": 16,
        "GROUP_SIZE_M": 8,
        "num_stages": 4,
        "num_warps": 8,
        "ms": 0.14255620539188385,
        "min_ms": 0.14255620539188385,
        "max_ms": 0.14255620539188385,
        "compile_time": 1.0647165775299072
    },
    {
        "BLOCK_SIZE_M": 64,
        "BLOCK_SIZE_N": 128,
        "BLOCK_SIZE_K": 16,
        "GROUP_SIZE_M": 8,
        "num_stages": 3,
        "num_warps": 8,
        "ms": 0.14267048239707947,
        "min_ms": 0.14267048239707947,
        "max_ms": 0.14267048239707947,
        "compile_time": 1.5404109954833984
    },
    {
        "BLOCK_SIZE_M": 32,
        "BLOCK_SIZE_N": 256,
        "BLOCK_SIZE_K": 64,
        "GROUP_SIZE_M": 8,
        "num_stages": 3,
        "num_warps": 4,
        "ms": 0.14270636439323425,
        "min_ms": 0.14270636439323425,
        "max_ms": 0.14270636439323425,
        "compile_time": 1.0327954292297363
    },
    {
        "BLOCK_SIZE_M": 64,
        "BLOCK_SIZE_N": 64,
        "BLOCK_SIZE_K": 64,
        "GROUP_SIZE_M": 8,
        "num_stages": 1,
        "num_warps": 4,
        "ms": 0.1427224725484848,
        "min_ms": 0.1427224725484848,
        "max_ms": 0.1427224725484848,
        "compile_time": 1.0874669551849365
    },
    {
        "BLOCK_SIZE_M": 32,
        "BLOCK_SIZE_N": 256,
        "BLOCK_SIZE_K": 128,
        "GROUP_SIZE_M": 8,
        "num_stages": 3,
        "num_warps": 8,
        "ms": 0.14279977977275848,
        "min_ms": 0.14279977977275848,
        "max_ms": 0.14279977977275848,
        "compile_time": 1.0324716567993164
    },
    {
        "BLOCK_SIZE_M": 32,
        "BLOCK_SIZE_N": 256,
        "BLOCK_SIZE_K": 16,
        "GROUP_SIZE_M": 8,
        "num_stages": 6,
        "num_warps": 2,
        "ms": 0.14292386174201965,
        "min_ms": 0.14292386174201965,
        "max_ms": 0.14292386174201965,
        "compile_time": 2.0707476139068604
    },
    {
        "BLOCK_SIZE_M": 128,
        "BLOCK_SIZE_N": 32,
        "BLOCK_SIZE_K": 32,
        "GROUP_SIZE_M": 8,
        "num_stages": 2,
        "num_warps": 4,
        "ms": 0.14305536448955536,
        "min_ms": 0.14305536448955536,
        "max_ms": 0.14305536448955536,
        "compile_time": 1.1295342445373535
    },
    {
        "BLOCK_SIZE_M": 256,
        "BLOCK_SIZE_N": 64,
        "BLOCK_SIZE_K": 32,
        "GROUP_SIZE_M": 8,
        "num_stages": 7,
        "num_warps": 16,
        "ms": 0.1430765986442566,
        "min_ms": 0.1430765986442566,
        "max_ms": 0.1430765986442566,
        "compile_time": 1.1326589584350586
    },
    {
        "BLOCK_SIZE_M": 128,
        "BLOCK_SIZE_N": 32,
        "BLOCK_SIZE_K": 64,
        "GROUP_SIZE_M": 8,
        "num_stages": 5,
        "num_warps": 4,
        "ms": 0.14312869310379028,
        "min_ms": 0.14312869310379028,
        "max_ms": 0.14312869310379028,
        "compile_time": 1.1180195808410645
    },
    {
        "BLOCK_SIZE_M": 64,
        "BLOCK_SIZE_N": 128,
        "BLOCK_SIZE_K": 16,
        "GROUP_SIZE_M": 8,
        "num_stages": 5,
        "num_warps": 8,
        "ms": 0.14325836300849915,
        "min_ms": 0.14325836300849915,
        "max_ms": 0.14325836300849915,
        "compile_time": 1.5515520572662354
    },
    {
        "BLOCK_SIZE_M": 256,
        "BLOCK_SIZE_N": 128,
        "BLOCK_SIZE_K": 64,
        "GROUP_SIZE_M": 8,
        "num_stages": 2,
        "num_warps": 8,
        "ms": 0.14331528544425964,
        "min_ms": 0.14331528544425964,
        "max_ms": 0.14331528544425964,
        "compile_time": 1.1381757259368896
    },
    {
        "BLOCK_SIZE_M": 32,
        "BLOCK_SIZE_N": 256,
        "BLOCK_SIZE_K": 64,
        "GROUP_SIZE_M": 8,
        "num_stages": 3,
        "num_warps": 8,
        "ms": 0.14345920085906982,
        "min_ms": 0.14345920085906982,
        "max_ms": 0.14345920085906982,
        "compile_time": 1.031242847442627
    },
    {
        "BLOCK_SIZE_M": 64,
        "BLOCK_SIZE_N": 64,
        "BLOCK_SIZE_K": 32,
        "GROUP_SIZE_M": 8,
        "num_stages": 3,
        "num_warps": 8,
        "ms": 0.1434808075428009,
        "min_ms": 0.1434808075428009,
        "max_ms": 0.1434808075428009,
        "compile_time": 1.0763764381408691
    },
    {
        "BLOCK_SIZE_M": 128,
        "BLOCK_SIZE_N": 64,
        "BLOCK_SIZE_K": 64,
        "GROUP_SIZE_M": 8,
        "num_stages": 5,
        "num_warps": 16,
        "ms": 0.1437404453754425,
        "min_ms": 0.1437404453754425,
        "max_ms": 0.1437404453754425,
        "compile_time": 1.1041560173034668
    },
    {
        "BLOCK_SIZE_M": 64,
        "BLOCK_SIZE_N": 64,
        "BLOCK_SIZE_K": 16,
        "GROUP_SIZE_M": 8,
        "num_stages": 5,
        "num_warps": 2,
        "ms": 0.14379768073558807,
        "min_ms": 0.14379768073558807,
        "max_ms": 0.14379768073558807,
        "compile_time": 1.5887620449066162
    },
    {
        "BLOCK_SIZE_M": 64,
        "BLOCK_SIZE_N": 128,
        "BLOCK_SIZE_K": 16,
        "GROUP_SIZE_M": 8,
        "num_stages": 6,
        "num_warps": 8,
        "ms": 0.1438678801059723,
        "min_ms": 0.1438678801059723,
        "max_ms": 0.1438678801059723,
        "compile_time": 1.0735514163970947
    },
    {
        "BLOCK_SIZE_M": 32,
        "BLOCK_SIZE_N": 256,
        "BLOCK_SIZE_K": 32,
        "GROUP_SIZE_M": 8,
        "num_stages": 4,
        "num_warps": 8,
        "ms": 0.14387567341327667,
        "min_ms": 0.14387567341327667,
        "max_ms": 0.14387567341327667,
        "compile_time": 1.051286220550537
    },
    {
        "BLOCK_SIZE_M": 32,
        "BLOCK_SIZE_N": 128,
        "BLOCK_SIZE_K": 64,
        "GROUP_SIZE_M": 8,
        "num_stages": 5,
        "num_warps": 2,
        "ms": 0.14390675723552704,
        "min_ms": 0.14390675723552704,
        "max_ms": 0.14390675723552704,
        "compile_time": 1.0455491542816162
    },
    {
        "BLOCK_SIZE_M": 32,
        "BLOCK_SIZE_N": 512,
        "BLOCK_SIZE_K": 32,
        "GROUP_SIZE_M": 8,
        "num_stages": 5,
        "num_warps": 8,
        "ms": 0.14412516355514526,
        "min_ms": 0.14412516355514526,
        "max_ms": 0.14412516355514526,
        "compile_time": 1.0397365093231201
    },
    {
        "BLOCK_SIZE_M": 128,
        "BLOCK_SIZE_N": 32,
        "BLOCK_SIZE_K": 64,
        "GROUP_SIZE_M": 8,
        "num_stages": 4,
        "num_warps": 4,
        "ms": 0.1442015916109085,
        "min_ms": 0.1442015916109085,
        "max_ms": 0.1442015916109085,
        "compile_time": 1.1144499778747559
    },
    {
        "BLOCK_SIZE_M": 128,
        "BLOCK_SIZE_N": 32,
        "BLOCK_SIZE_K": 128,
        "GROUP_SIZE_M": 8,
        "num_stages": 3,
        "num_warps": 4,
        "ms": 0.14427992701530457,
        "min_ms": 0.14427992701530457,
        "max_ms": 0.14427992701530457,
        "compile_time": 1.0963263511657715
    },
    {
        "BLOCK_SIZE_M": 256,
        "BLOCK_SIZE_N": 64,
        "BLOCK_SIZE_K": 64,
        "GROUP_SIZE_M": 8,
        "num_stages": 1,
        "num_warps": 4,
        "ms": 0.14431533217430115,
        "min_ms": 0.14431533217430115,
        "max_ms": 0.14431533217430115,
        "compile_time": 1.1152257919311523
    },
    {
        "BLOCK_SIZE_M": 512,
        "BLOCK_SIZE_N": 32,
        "BLOCK_SIZE_K": 32,
        "GROUP_SIZE_M": 8,
        "num_stages": 5,
        "num_warps": 8,
        "ms": 0.14434599876403809,
        "min_ms": 0.14434599876403809,
        "max_ms": 0.14434599876403809,
        "compile_time": 2.156665086746216
    },
    {
        "BLOCK_SIZE_M": 32,
        "BLOCK_SIZE_N": 256,
        "BLOCK_SIZE_K": 32,
        "GROUP_SIZE_M": 8,
        "num_stages": 4,
        "num_warps": 4,
        "ms": 0.14436796307563782,
        "min_ms": 0.14436796307563782,
        "max_ms": 0.14436796307563782,
        "compile_time": 1.0223147869110107
    },
    {
        "BLOCK_SIZE_M": 64,
        "BLOCK_SIZE_N": 64,
        "BLOCK_SIZE_K": 128,
        "GROUP_SIZE_M": 8,
        "num_stages": 2,
        "num_warps": 8,
        "ms": 0.14436933398246765,
        "min_ms": 0.14436933398246765,
        "max_ms": 0.14436933398246765,
        "compile_time": 1.0652198791503906
    },
    {
        "BLOCK_SIZE_M": 64,
        "BLOCK_SIZE_N": 64,
        "BLOCK_SIZE_K": 64,
        "GROUP_SIZE_M": 8,
        "num_stages": 1,
        "num_warps": 2,
        "ms": 0.14437870681285858,
        "min_ms": 0.14437870681285858,
        "max_ms": 0.14437870681285858,
        "compile_time": 1.060056447982788
    },
    {
        "BLOCK_SIZE_M": 512,
        "BLOCK_SIZE_N": 32,
        "BLOCK_SIZE_K": 32,
        "GROUP_SIZE_M": 8,
        "num_stages": 3,
        "num_warps": 8,
        "ms": 0.14439387619495392,
        "min_ms": 0.14439387619495392,
        "max_ms": 0.14439387619495392,
        "compile_time": 2.1022627353668213
    },
    {
        "BLOCK_SIZE_M": 256,
        "BLOCK_SIZE_N": 64,
        "BLOCK_SIZE_K": 32,
        "GROUP_SIZE_M": 8,
        "num_stages": 8,
        "num_warps": 16,
        "ms": 0.14441938698291779,
        "min_ms": 0.14441938698291779,
        "max_ms": 0.14441938698291779,
        "compile_time": 1.823533296585083
    },
    {
        "BLOCK_SIZE_M": 32,
        "BLOCK_SIZE_N": 128,
        "BLOCK_SIZE_K": 64,
        "GROUP_SIZE_M": 8,
        "num_stages": 5,
        "num_warps": 4,
        "ms": 0.1444535106420517,
        "min_ms": 0.1444535106420517,
        "max_ms": 0.1444535106420517,
        "compile_time": 1.0363152027130127
    },
    {
        "BLOCK_SIZE_M": 128,
        "BLOCK_SIZE_N": 64,
        "BLOCK_SIZE_K": 64,
        "GROUP_SIZE_M": 8,
        "num_stages": 6,
        "num_warps": 16,
        "ms": 0.14453311264514923,
        "min_ms": 0.14453311264514923,
        "max_ms": 0.14453311264514923,
        "compile_time": 1.1091489791870117
    },
    {
        "BLOCK_SIZE_M": 64,
        "BLOCK_SIZE_N": 64,
        "BLOCK_SIZE_K": 32,
        "GROUP_SIZE_M": 8,
        "num_stages": 4,
        "num_warps": 8,
        "ms": 0.14457140862941742,
        "min_ms": 0.14457140862941742,
        "max_ms": 0.14457140862941742,
        "compile_time": 1.0619494915008545
    },
    {
        "BLOCK_SIZE_M": 64,
        "BLOCK_SIZE_N": 128,
        "BLOCK_SIZE_K": 16,
        "GROUP_SIZE_M": 8,
        "num_stages": 7,
        "num_warps": 8,
        "ms": 0.14459672570228577,
        "min_ms": 0.14459672570228577,
        "max_ms": 0.14459672570228577,
        "compile_time": 1.587829351425171
    },
    {
        "BLOCK_SIZE_M": 64,
        "BLOCK_SIZE_N": 64,
        "BLOCK_SIZE_K": 16,
        "GROUP_SIZE_M": 8,
        "num_stages": 8,
        "num_warps": 4,
        "ms": 0.14466476440429688,
        "min_ms": 0.14466476440429688,
        "max_ms": 0.14466476440429688,
        "compile_time": 1.0838406085968018
    },
    {
        "BLOCK_SIZE_M": 32,
        "BLOCK_SIZE_N": 128,
        "BLOCK_SIZE_K": 64,
        "GROUP_SIZE_M": 8,
        "num_stages": 4,
        "num_warps": 4,
        "ms": 0.14472368359565735,
        "min_ms": 0.14472368359565735,
        "max_ms": 0.14472368359565735,
        "compile_time": 1.0251381397247314
    },
    {
        "BLOCK_SIZE_M": 64,
        "BLOCK_SIZE_N": 64,
        "BLOCK_SIZE_K": 32,
        "GROUP_SIZE_M": 8,
        "num_stages": 5,
        "num_warps": 8,
        "ms": 0.1447976678609848,
        "min_ms": 0.1447976678609848,
        "max_ms": 0.1447976678609848,
        "compile_time": 1.0792999267578125
    },
    {
        "BLOCK_SIZE_M": 32,
        "BLOCK_SIZE_N": 128,
        "BLOCK_SIZE_K": 16,
        "GROUP_SIZE_M": 8,
        "num_stages": 7,
        "num_warps": 2,
        "ms": 0.14482538402080536,
        "min_ms": 0.14482538402080536,
        "max_ms": 0.14482538402080536,
        "compile_time": 1.6887586116790771
    },
    {
        "BLOCK_SIZE_M": 128,
        "BLOCK_SIZE_N": 32,
        "BLOCK_SIZE_K": 64,
        "GROUP_SIZE_M": 8,
        "num_stages": 4,
        "num_warps": 2,
        "ms": 0.14484331011772156,
        "min_ms": 0.14484331011772156,
        "max_ms": 0.14484331011772156,
        "compile_time": 1.1063270568847656
    },
    {
        "BLOCK_SIZE_M": 64,
        "BLOCK_SIZE_N": 64,
        "BLOCK_SIZE_K": 32,
        "GROUP_SIZE_M": 8,
        "num_stages": 6,
        "num_warps": 8,
        "ms": 0.14498214423656464,
        "min_ms": 0.14498214423656464,
        "max_ms": 0.14498214423656464,
        "compile_time": 1.0690057277679443
    },
    {
        "BLOCK_SIZE_M": 64,
        "BLOCK_SIZE_N": 128,
        "BLOCK_SIZE_K": 16,
        "GROUP_SIZE_M": 8,
        "num_stages": 8,
        "num_warps": 8,
        "ms": 0.14514043927192688,
        "min_ms": 0.14514043927192688,
        "max_ms": 0.14514043927192688,
        "compile_time": 1.6084442138671875
    },
    {
        "BLOCK_SIZE_M": 64,
        "BLOCK_SIZE_N": 64,
        "BLOCK_SIZE_K": 64,
        "GROUP_SIZE_M": 8,
        "num_stages": 2,
        "num_warps": 8,
        "ms": 0.14515672624111176,
        "min_ms": 0.14515672624111176,
        "max_ms": 0.14515672624111176,
        "compile_time": 1.064145803451538
    },
    {
        "BLOCK_SIZE_M": 32,
        "BLOCK_SIZE_N": 128,
        "BLOCK_SIZE_K": 128,
        "GROUP_SIZE_M": 8,
        "num_stages": 3,
        "num_warps": 4,
        "ms": 0.14525040984153748,
        "min_ms": 0.14525040984153748,
        "max_ms": 0.14525040984153748,
        "compile_time": 1.0610826015472412
    },
    {
        "BLOCK_SIZE_M": 128,
        "BLOCK_SIZE_N": 32,
        "BLOCK_SIZE_K": 32,
        "GROUP_SIZE_M": 8,
        "num_stages": 7,
        "num_warps": 2,
        "ms": 0.14526936411857605,
        "min_ms": 0.14526936411857605,
        "max_ms": 0.14526936411857605,
        "compile_time": 1.1045057773590088
    },
    {
        "BLOCK_SIZE_M": 128,
        "BLOCK_SIZE_N": 128,
        "BLOCK_SIZE_K": 16,
        "GROUP_SIZE_M": 8,
        "num_stages": 4,
        "num_warps": 8,
        "ms": 0.14529070258140564,
        "min_ms": 0.14529070258140564,
        "max_ms": 0.14529070258140564,
        "compile_time": 1.7204105854034424
    },
    {
        "BLOCK_SIZE_M": 32,
        "BLOCK_SIZE_N": 128,
        "BLOCK_SIZE_K": 32,
        "GROUP_SIZE_M": 8,
        "num_stages": 6,
        "num_warps": 2,
        "ms": 0.14538049697875977,
        "min_ms": 0.14538049697875977,
        "max_ms": 0.14538049697875977,
        "compile_time": 1.0410802364349365
    },
    {
        "BLOCK_SIZE_M": 32,
        "BLOCK_SIZE_N": 128,
        "BLOCK_SIZE_K": 32,
        "GROUP_SIZE_M": 8,
        "num_stages": 7,
        "num_warps": 4,
        "ms": 0.1455313265323639,
        "min_ms": 0.1455313265323639,
        "max_ms": 0.1455313265323639,
        "compile_time": 1.0570242404937744
    },
    {
        "BLOCK_SIZE_M": 256,
        "BLOCK_SIZE_N": 64,
        "BLOCK_SIZE_K": 32,
        "GROUP_SIZE_M": 8,
        "num_stages": 3,
        "num_warps": 16,
        "ms": 0.14561660587787628,
        "min_ms": 0.14561660587787628,
        "max_ms": 0.14561660587787628,
        "compile_time": 1.141127109527588
    },
    {
        "BLOCK_SIZE_M": 128,
        "BLOCK_SIZE_N": 32,
        "BLOCK_SIZE_K": 32,
        "GROUP_SIZE_M": 8,
        "num_stages": 8,
        "num_warps": 2,
        "ms": 0.14592662453651428,
        "min_ms": 0.14592662453651428,
        "max_ms": 0.14592662453651428,
        "compile_time": 1.06113862991333
    },
    {
        "BLOCK_SIZE_M": 32,
        "BLOCK_SIZE_N": 128,
        "BLOCK_SIZE_K": 32,
        "GROUP_SIZE_M": 8,
        "num_stages": 8,
        "num_warps": 4,
        "ms": 0.14597120881080627,
        "min_ms": 0.14597120881080627,
        "max_ms": 0.14597120881080627,
        "compile_time": 1.0423352718353271
    },
    {
        "BLOCK_SIZE_M": 32,
        "BLOCK_SIZE_N": 128,
        "BLOCK_SIZE_K": 32,
        "GROUP_SIZE_M": 8,
        "num_stages": 7,
        "num_warps": 2,
        "ms": 0.14598575234413147,
        "min_ms": 0.14598575234413147,
        "max_ms": 0.14598575234413147,
        "compile_time": 1.0314662456512451
    },
    {
        "BLOCK_SIZE_M": 128,
        "BLOCK_SIZE_N": 128,
        "BLOCK_SIZE_K": 16,
        "GROUP_SIZE_M": 8,
        "num_stages": 7,
        "num_warps": 8,
        "ms": 0.14602088928222656,
        "min_ms": 0.14602088928222656,
        "max_ms": 0.14602088928222656,
        "compile_time": 1.1221435070037842
    },
    {
        "BLOCK_SIZE_M": 128,
        "BLOCK_SIZE_N": 128,
        "BLOCK_SIZE_K": 16,
        "GROUP_SIZE_M": 8,
        "num_stages": 6,
        "num_warps": 8,
        "ms": 0.14609003067016602,
        "min_ms": 0.14609003067016602,
        "max_ms": 0.14609003067016602,
        "compile_time": 1.1159899234771729
    },
    {
        "BLOCK_SIZE_M": 128,
        "BLOCK_SIZE_N": 128,
        "BLOCK_SIZE_K": 16,
        "GROUP_SIZE_M": 8,
        "num_stages": 5,
        "num_warps": 8,
        "ms": 0.1461561620235443,
        "min_ms": 0.1461561620235443,
        "max_ms": 0.1461561620235443,
        "compile_time": 1.138763189315796
    },
    {
        "BLOCK_SIZE_M": 64,
        "BLOCK_SIZE_N": 64,
        "BLOCK_SIZE_K": 128,
        "GROUP_SIZE_M": 8,
        "num_stages": 4,
        "num_warps": 8,
        "ms": 0.14628002047538757,
        "min_ms": 0.14628002047538757,
        "max_ms": 0.14628002047538757,
        "compile_time": 1.0681350231170654
    },
    {
        "BLOCK_SIZE_M": 128,
        "BLOCK_SIZE_N": 64,
        "BLOCK_SIZE_K": 64,
        "GROUP_SIZE_M": 8,
        "num_stages": 7,
        "num_warps": 16,
        "ms": 0.14628919959068298,
        "min_ms": 0.14628919959068298,
        "max_ms": 0.14628919959068298,
        "compile_time": 1.1131772994995117
    },
    {
        "BLOCK_SIZE_M": 256,
        "BLOCK_SIZE_N": 64,
        "BLOCK_SIZE_K": 32,
        "GROUP_SIZE_M": 8,
        "num_stages": 5,
        "num_warps": 16,
        "ms": 0.14631687104701996,
        "min_ms": 0.14631687104701996,
        "max_ms": 0.14631687104701996,
        "compile_time": 1.1440448760986328
    },
    {
        "BLOCK_SIZE_M": 128,
        "BLOCK_SIZE_N": 128,
        "BLOCK_SIZE_K": 16,
        "GROUP_SIZE_M": 8,
        "num_stages": 3,
        "num_warps": 8,
        "ms": 0.14637331664562225,
        "min_ms": 0.14637331664562225,
        "max_ms": 0.14637331664562225,
        "compile_time": 1.1293938159942627
    },
    {
        "BLOCK_SIZE_M": 32,
        "BLOCK_SIZE_N": 256,
        "BLOCK_SIZE_K": 16,
        "GROUP_SIZE_M": 8,
        "num_stages": 3,
        "num_warps": 8,
        "ms": 0.14646995067596436,
        "min_ms": 0.14646995067596436,
        "max_ms": 0.14646995067596436,
        "compile_time": 1.043886423110962
    },
    {
        "BLOCK_SIZE_M": 32,
        "BLOCK_SIZE_N": 512,
        "BLOCK_SIZE_K": 16,
        "GROUP_SIZE_M": 8,
        "num_stages": 5,
        "num_warps": 4,
        "ms": 0.1464872658252716,
        "min_ms": 0.1464872658252716,
        "max_ms": 0.1464872658252716,
        "compile_time": 2.069669485092163
    },
    {
        "BLOCK_SIZE_M": 32,
        "BLOCK_SIZE_N": 256,
        "BLOCK_SIZE_K": 32,
        "GROUP_SIZE_M": 8,
        "num_stages": 3,
        "num_warps": 8,
        "ms": 0.14651307463645935,
        "min_ms": 0.14651307463645935,
        "max_ms": 0.14651307463645935,
        "compile_time": 1.0264790058135986
    },
    {
        "BLOCK_SIZE_M": 128,
        "BLOCK_SIZE_N": 32,
        "BLOCK_SIZE_K": 64,
        "GROUP_SIZE_M": 8,
        "num_stages": 5,
        "num_warps": 2,
        "ms": 0.1465725600719452,
        "min_ms": 0.1465725600719452,
        "max_ms": 0.1465725600719452,
        "compile_time": 1.1060512065887451
    },
    {
        "BLOCK_SIZE_M": 32,
        "BLOCK_SIZE_N": 512,
        "BLOCK_SIZE_K": 32,
        "GROUP_SIZE_M": 8,
        "num_stages": 4,
        "num_warps": 16,
        "ms": 0.14659258723258972,
        "min_ms": 0.14659258723258972,
        "max_ms": 0.14659258723258972,
        "compile_time": 1.057741641998291
    },
    {
        "BLOCK_SIZE_M": 32,
        "BLOCK_SIZE_N": 256,
        "BLOCK_SIZE_K": 16,
        "GROUP_SIZE_M": 8,
        "num_stages": 5,
        "num_warps": 4,
        "ms": 0.14660146832466125,
        "min_ms": 0.14660146832466125,
        "max_ms": 0.14660146832466125,
        "compile_time": 1.0454752445220947
    },
    {
        "BLOCK_SIZE_M": 128,
        "BLOCK_SIZE_N": 128,
        "BLOCK_SIZE_K": 256,
        "GROUP_SIZE_M": 8,
        "num_stages": 2,
        "num_warps": 8,
        "ms": 0.14665332436561584,
        "min_ms": 0.14665332436561584,
        "max_ms": 0.14665332436561584,
        "compile_time": 1.1118004322052002
    },
    {
        "BLOCK_SIZE_M": 128,
        "BLOCK_SIZE_N": 32,
        "BLOCK_SIZE_K": 64,
        "GROUP_SIZE_M": 8,
        "num_stages": 3,
        "num_warps": 8,
        "ms": 0.14676162600517273,
        "min_ms": 0.14676162600517273,
        "max_ms": 0.14676162600517273,
        "compile_time": 1.1242172718048096
    },
    {
        "BLOCK_SIZE_M": 512,
        "BLOCK_SIZE_N": 32,
        "BLOCK_SIZE_K": 64,
        "GROUP_SIZE_M": 8,
        "num_stages": 3,
        "num_warps": 8,
        "ms": 0.1467909812927246,
        "min_ms": 0.1467909812927246,
        "max_ms": 0.1467909812927246,
        "compile_time": 2.4573261737823486
    },
    {
        "BLOCK_SIZE_M": 64,
        "BLOCK_SIZE_N": 256,
        "BLOCK_SIZE_K": 64,
        "GROUP_SIZE_M": 8,
        "num_stages": 2,
        "num_warps": 8,
        "ms": 0.14679273962974548,
        "min_ms": 0.14679273962974548,
        "max_ms": 0.14679273962974548,
        "compile_time": 1.094526767730713
    },
    {
        "BLOCK_SIZE_M": 128,
        "BLOCK_SIZE_N": 128,
        "BLOCK_SIZE_K": 128,
        "GROUP_SIZE_M": 8,
        "num_stages": 1,
        "num_warps": 8,
        "ms": 0.14708271622657776,
        "min_ms": 0.14708271622657776,
        "max_ms": 0.14708271622657776,
        "compile_time": 1.0923717021942139
    },
    {
        "BLOCK_SIZE_M": 32,
        "BLOCK_SIZE_N": 512,
        "BLOCK_SIZE_K": 32,
        "GROUP_SIZE_M": 8,
        "num_stages": 5,
        "num_warps": 16,
        "ms": 0.14710421860218048,
        "min_ms": 0.14710421860218048,
        "max_ms": 0.14710421860218048,
        "compile_time": 1.0552546977996826
    },
    {
        "BLOCK_SIZE_M": 64,
        "BLOCK_SIZE_N": 256,
        "BLOCK_SIZE_K": 128,
        "GROUP_SIZE_M": 8,
        "num_stages": 2,
        "num_warps": 8,
        "ms": 0.1471540480852127,
        "min_ms": 0.1471540480852127,
        "max_ms": 0.1471540480852127,
        "compile_time": 1.0764484405517578
    },
    {
        "BLOCK_SIZE_M": 128,
        "BLOCK_SIZE_N": 32,
        "BLOCK_SIZE_K": 32,
        "GROUP_SIZE_M": 8,
        "num_stages": 2,
        "num_warps": 2,
        "ms": 0.14719972014427185,
        "min_ms": 0.14719972014427185,
        "max_ms": 0.14719972014427185,
        "compile_time": 1.1305885314941406
    },
    {
        "BLOCK_SIZE_M": 64,
        "BLOCK_SIZE_N": 512,
        "BLOCK_SIZE_K": 16,
        "GROUP_SIZE_M": 8,
        "num_stages": 8,
        "num_warps": 8,
        "ms": 0.14721648395061493,
        "min_ms": 0.14721648395061493,
        "max_ms": 0.14721648395061493,
        "compile_time": 2.165935754776001
    },
    {
        "BLOCK_SIZE_M": 64,
        "BLOCK_SIZE_N": 64,
        "BLOCK_SIZE_K": 32,
        "GROUP_SIZE_M": 8,
        "num_stages": 7,
        "num_warps": 8,
        "ms": 0.14721962809562683,
        "min_ms": 0.14721962809562683,
        "max_ms": 0.14721962809562683,
        "compile_time": 1.0801548957824707
    },
    {
        "BLOCK_SIZE_M": 64,
        "BLOCK_SIZE_N": 512,
        "BLOCK_SIZE_K": 16,
        "GROUP_SIZE_M": 8,
        "num_stages": 4,
        "num_warps": 8,
        "ms": 0.14729005098342896,
        "min_ms": 0.14729005098342896,
        "max_ms": 0.14729005098342896,
        "compile_time": 2.0330429077148438
    },
    {
        "BLOCK_SIZE_M": 32,
        "BLOCK_SIZE_N": 128,
        "BLOCK_SIZE_K": 32,
        "GROUP_SIZE_M": 8,
        "num_stages": 8,
        "num_warps": 2,
        "ms": 0.14745111763477325,
        "min_ms": 0.14745111763477325,
        "max_ms": 0.14745111763477325,
        "compile_time": 1.0456619262695312
    },
    {
        "BLOCK_SIZE_M": 64,
        "BLOCK_SIZE_N": 512,
        "BLOCK_SIZE_K": 16,
        "GROUP_SIZE_M": 8,
        "num_stages": 5,
        "num_warps": 8,
        "ms": 0.1476510912179947,
        "min_ms": 0.1476510912179947,
        "max_ms": 0.1476510912179947,
        "compile_time": 2.0552608966827393
    },
    {
        "BLOCK_SIZE_M": 64,
        "BLOCK_SIZE_N": 64,
        "BLOCK_SIZE_K": 128,
        "GROUP_SIZE_M": 8,
        "num_stages": 5,
        "num_warps": 8,
        "ms": 0.1478274166584015,
        "min_ms": 0.1478274166584015,
        "max_ms": 0.1478274166584015,
        "compile_time": 1.0805649757385254
    },
    {
        "BLOCK_SIZE_M": 32,
        "BLOCK_SIZE_N": 128,
        "BLOCK_SIZE_K": 32,
        "GROUP_SIZE_M": 8,
        "num_stages": 3,
        "num_warps": 2,
        "ms": 0.14794906973838806,
        "min_ms": 0.14794906973838806,
        "max_ms": 0.14794906973838806,
        "compile_time": 1.0172266960144043
    },
    {
        "BLOCK_SIZE_M": 64,
        "BLOCK_SIZE_N": 64,
        "BLOCK_SIZE_K": 64,
        "GROUP_SIZE_M": 8,
        "num_stages": 7,
        "num_warps": 8,
        "ms": 0.14794957637786865,
        "min_ms": 0.14794957637786865,
        "max_ms": 0.14794957637786865,
        "compile_time": 1.0758414268493652
    },
    {
        "BLOCK_SIZE_M": 256,
        "BLOCK_SIZE_N": 128,
        "BLOCK_SIZE_K": 128,
        "GROUP_SIZE_M": 8,
        "num_stages": 2,
        "num_warps": 8,
        "ms": 0.14797958731651306,
        "min_ms": 0.14797958731651306,
        "max_ms": 0.14797958731651306,
        "compile_time": 1.1520261764526367
    },
    {
        "BLOCK_SIZE_M": 64,
        "BLOCK_SIZE_N": 512,
        "BLOCK_SIZE_K": 16,
        "GROUP_SIZE_M": 8,
        "num_stages": 7,
        "num_warps": 8,
        "ms": 0.14799433946609497,
        "min_ms": 0.14799433946609497,
        "max_ms": 0.14799433946609497,
        "compile_time": 2.0826315879821777
    },
    {
        "BLOCK_SIZE_M": 32,
        "BLOCK_SIZE_N": 128,
        "BLOCK_SIZE_K": 64,
        "GROUP_SIZE_M": 8,
        "num_stages": 4,
        "num_warps": 8,
        "ms": 0.1481786072254181,
        "min_ms": 0.1481786072254181,
        "max_ms": 0.1481786072254181,
        "compile_time": 1.0256743431091309
    },
    {
        "BLOCK_SIZE_M": 32,
        "BLOCK_SIZE_N": 256,
        "BLOCK_SIZE_K": 32,
        "GROUP_SIZE_M": 8,
        "num_stages": 2,
        "num_warps": 4,
        "ms": 0.14818720519542694,
        "min_ms": 0.14818720519542694,
        "max_ms": 0.14818720519542694,
        "compile_time": 1.0403647422790527
    },
    {
        "BLOCK_SIZE_M": 32,
        "BLOCK_SIZE_N": 128,
        "BLOCK_SIZE_K": 64,
        "GROUP_SIZE_M": 8,
        "num_stages": 5,
        "num_warps": 8,
        "ms": 0.14821943640708923,
        "min_ms": 0.14821943640708923,
        "max_ms": 0.14821943640708923,
        "compile_time": 1.0594234466552734
    },
    {
        "BLOCK_SIZE_M": 128,
        "BLOCK_SIZE_N": 32,
        "BLOCK_SIZE_K": 64,
        "GROUP_SIZE_M": 8,
        "num_stages": 4,
        "num_warps": 8,
        "ms": 0.14823654294013977,
        "min_ms": 0.14823654294013977,
        "max_ms": 0.14823654294013977,
        "compile_time": 1.1261296272277832
    },
    {
        "BLOCK_SIZE_M": 32,
        "BLOCK_SIZE_N": 128,
        "BLOCK_SIZE_K": 64,
        "GROUP_SIZE_M": 8,
        "num_stages": 3,
        "num_warps": 8,
        "ms": 0.14825251698493958,
        "min_ms": 0.14825251698493958,
        "max_ms": 0.14825251698493958,
        "compile_time": 1.0484819412231445
    },
    {
        "BLOCK_SIZE_M": 32,
        "BLOCK_SIZE_N": 128,
        "BLOCK_SIZE_K": 32,
        "GROUP_SIZE_M": 8,
        "num_stages": 5,
        "num_warps": 2,
        "ms": 0.14827826619148254,
        "min_ms": 0.14827826619148254,
        "max_ms": 0.14827826619148254,
        "compile_time": 1.037534236907959
    },
    {
        "BLOCK_SIZE_M": 32,
        "BLOCK_SIZE_N": 128,
        "BLOCK_SIZE_K": 16,
        "GROUP_SIZE_M": 8,
        "num_stages": 4,
        "num_warps": 4,
        "ms": 0.14829885959625244,
        "min_ms": 0.14829885959625244,
        "max_ms": 0.14829885959625244,
        "compile_time": 1.4919934272766113
    },
    {
        "BLOCK_SIZE_M": 64,
        "BLOCK_SIZE_N": 512,
        "BLOCK_SIZE_K": 16,
        "GROUP_SIZE_M": 8,
        "num_stages": 6,
        "num_warps": 8,
        "ms": 0.14830952882766724,
        "min_ms": 0.14830952882766724,
        "max_ms": 0.14830952882766724,
        "compile_time": 2.068282127380371
    },
    {
        "BLOCK_SIZE_M": 32,
        "BLOCK_SIZE_N": 512,
        "BLOCK_SIZE_K": 32,
        "GROUP_SIZE_M": 8,
        "num_stages": 4,
        "num_warps": 8,
        "ms": 0.14840850234031677,
        "min_ms": 0.14840850234031677,
        "max_ms": 0.14840850234031677,
        "compile_time": 1.836181640625
    },
    {
        "BLOCK_SIZE_M": 128,
        "BLOCK_SIZE_N": 256,
        "BLOCK_SIZE_K": 32,
        "GROUP_SIZE_M": 8,
        "num_stages": 2,
        "num_warps": 8,
        "ms": 0.14852945506572723,
        "min_ms": 0.14852945506572723,
        "max_ms": 0.14852945506572723,
        "compile_time": 1.1305625438690186
    },
    {
        "BLOCK_SIZE_M": 128,
        "BLOCK_SIZE_N": 32,
        "BLOCK_SIZE_K": 64,
        "GROUP_SIZE_M": 8,
        "num_stages": 6,
        "num_warps": 4,
        "ms": 0.14866693317890167,
        "min_ms": 0.14866693317890167,
        "max_ms": 0.14866693317890167,
        "compile_time": 1.0933642387390137
    },
    {
        "BLOCK_SIZE_M": 128,
        "BLOCK_SIZE_N": 64,
        "BLOCK_SIZE_K": 64,
        "GROUP_SIZE_M": 8,
        "num_stages": 2,
        "num_warps": 16,
        "ms": 0.14883743226528168,
        "min_ms": 0.14883743226528168,
        "max_ms": 0.14883743226528168,
        "compile_time": 1.1065428256988525
    },
    {
        "BLOCK_SIZE_M": 256,
        "BLOCK_SIZE_N": 64,
        "BLOCK_SIZE_K": 128,
        "GROUP_SIZE_M": 8,
        "num_stages": 2,
        "num_warps": 8,
        "ms": 0.1488378942012787,
        "min_ms": 0.1488378942012787,
        "max_ms": 0.1488378942012787,
        "compile_time": 1.1738884449005127
    },
    {
        "BLOCK_SIZE_M": 64,
        "BLOCK_SIZE_N": 64,
        "BLOCK_SIZE_K": 16,
        "GROUP_SIZE_M": 8,
        "num_stages": 3,
        "num_warps": 2,
        "ms": 0.14898541569709778,
        "min_ms": 0.14898541569709778,
        "max_ms": 0.14898541569709778,
        "compile_time": 1.633138656616211
    },
    {
        "BLOCK_SIZE_M": 256,
        "BLOCK_SIZE_N": 64,
        "BLOCK_SIZE_K": 64,
        "GROUP_SIZE_M": 8,
        "num_stages": 2,
        "num_warps": 8,
        "ms": 0.14900939166545868,
        "min_ms": 0.14900939166545868,
        "max_ms": 0.14900939166545868,
        "compile_time": 1.1469306945800781
    },
    {
        "BLOCK_SIZE_M": 32,
        "BLOCK_SIZE_N": 128,
        "BLOCK_SIZE_K": 64,
        "GROUP_SIZE_M": 8,
        "num_stages": 4,
        "num_warps": 2,
        "ms": 0.1490650177001953,
        "min_ms": 0.1490650177001953,
        "max_ms": 0.1490650177001953,
        "compile_time": 1.032780408859253
    },
    {
        "BLOCK_SIZE_M": 64,
        "BLOCK_SIZE_N": 64,
        "BLOCK_SIZE_K": 16,
        "GROUP_SIZE_M": 8,
        "num_stages": 4,
        "num_warps": 2,
        "ms": 0.14908358454704285,
        "min_ms": 0.14908358454704285,
        "max_ms": 0.14908358454704285,
        "compile_time": 1.6573402881622314
    },
    {
        "BLOCK_SIZE_M": 128,
        "BLOCK_SIZE_N": 32,
        "BLOCK_SIZE_K": 64,
        "GROUP_SIZE_M": 8,
        "num_stages": 7,
        "num_warps": 4,
        "ms": 0.1491762399673462,
        "min_ms": 0.1491762399673462,
        "max_ms": 0.1491762399673462,
        "compile_time": 1.1135756969451904
    },
    {
        "BLOCK_SIZE_M": 128,
        "BLOCK_SIZE_N": 32,
        "BLOCK_SIZE_K": 32,
        "GROUP_SIZE_M": 8,
        "num_stages": 6,
        "num_warps": 4,
        "ms": 0.1492573320865631,
        "min_ms": 0.1492573320865631,
        "max_ms": 0.1492573320865631,
        "compile_time": 1.1266429424285889
    },
    {
        "BLOCK_SIZE_M": 32,
        "BLOCK_SIZE_N": 256,
        "BLOCK_SIZE_K": 16,
        "GROUP_SIZE_M": 8,
        "num_stages": 7,
        "num_warps": 8,
        "ms": 0.14943215250968933,
        "min_ms": 0.14943215250968933,
        "max_ms": 0.14943215250968933,
        "compile_time": 1.5525834560394287
    },
    {
        "BLOCK_SIZE_M": 64,
        "BLOCK_SIZE_N": 64,
        "BLOCK_SIZE_K": 64,
        "GROUP_SIZE_M": 8,
        "num_stages": 8,
        "num_warps": 8,
        "ms": 0.1494414359331131,
        "min_ms": 0.1494414359331131,
        "max_ms": 0.1494414359331131,
        "compile_time": 1.064054250717163
    },
    {
        "BLOCK_SIZE_M": 128,
        "BLOCK_SIZE_N": 32,
        "BLOCK_SIZE_K": 32,
        "GROUP_SIZE_M": 8,
        "num_stages": 7,
        "num_warps": 4,
        "ms": 0.14949634671211243,
        "min_ms": 0.14949634671211243,
        "max_ms": 0.14949634671211243,
        "compile_time": 1.111994743347168
    },
    {
        "BLOCK_SIZE_M": 128,
        "BLOCK_SIZE_N": 128,
        "BLOCK_SIZE_K": 64,
        "GROUP_SIZE_M": 8,
        "num_stages": 2,
        "num_warps": 16,
        "ms": 0.1495627909898758,
        "min_ms": 0.1495627909898758,
        "max_ms": 0.1495627909898758,
        "compile_time": 1.1025922298431396
    },
    {
        "BLOCK_SIZE_M": 64,
        "BLOCK_SIZE_N": 64,
        "BLOCK_SIZE_K": 256,
        "GROUP_SIZE_M": 8,
        "num_stages": 2,
        "num_warps": 8,
        "ms": 0.14963267743587494,
        "min_ms": 0.14963267743587494,
        "max_ms": 0.14963267743587494,
        "compile_time": 1.0736284255981445
    },
    {
        "BLOCK_SIZE_M": 32,
        "BLOCK_SIZE_N": 512,
        "BLOCK_SIZE_K": 32,
        "GROUP_SIZE_M": 8,
        "num_stages": 3,
        "num_warps": 16,
        "ms": 0.14977745711803436,
        "min_ms": 0.14977745711803436,
        "max_ms": 0.14977745711803436,
        "compile_time": 1.5772249698638916
    },
    {
        "BLOCK_SIZE_M": 32,
        "BLOCK_SIZE_N": 128,
        "BLOCK_SIZE_K": 32,
        "GROUP_SIZE_M": 8,
        "num_stages": 2,
        "num_warps": 4,
        "ms": 0.1498497724533081,
        "min_ms": 0.1498497724533081,
        "max_ms": 0.1498497724533081,
        "compile_time": 1.0483603477478027
    },
    {
        "BLOCK_SIZE_M": 64,
        "BLOCK_SIZE_N": 64,
        "BLOCK_SIZE_K": 16,
        "GROUP_SIZE_M": 8,
        "num_stages": 5,
        "num_warps": 4,
        "ms": 0.1499858796596527,
        "min_ms": 0.1499858796596527,
        "max_ms": 0.1499858796596527,
        "compile_time": 1.067697286605835
    },
    {
        "BLOCK_SIZE_M": 128,
        "BLOCK_SIZE_N": 32,
        "BLOCK_SIZE_K": 32,
        "GROUP_SIZE_M": 8,
        "num_stages": 5,
        "num_warps": 2,
        "ms": 0.14998939633369446,
        "min_ms": 0.14998939633369446,
        "max_ms": 0.14998939633369446,
        "compile_time": 1.0845222473144531
    },
    {
        "BLOCK_SIZE_M": 32,
        "BLOCK_SIZE_N": 128,
        "BLOCK_SIZE_K": 64,
        "GROUP_SIZE_M": 8,
        "num_stages": 6,
        "num_warps": 4,
        "ms": 0.15019838511943817,
        "min_ms": 0.15019838511943817,
        "max_ms": 0.15019838511943817,
        "compile_time": 1.039499044418335
    },
    {
        "BLOCK_SIZE_M": 32,
        "BLOCK_SIZE_N": 512,
        "BLOCK_SIZE_K": 64,
        "GROUP_SIZE_M": 8,
        "num_stages": 3,
        "num_warps": 8,
        "ms": 0.15057851374149323,
        "min_ms": 0.15057851374149323,
        "max_ms": 0.15057851374149323,
        "compile_time": 2.07639217376709
    },
    {
        "BLOCK_SIZE_M": 32,
        "BLOCK_SIZE_N": 512,
        "BLOCK_SIZE_K": 64,
        "GROUP_SIZE_M": 8,
        "num_stages": 3,
        "num_warps": 16,
        "ms": 0.15060140192508698,
        "min_ms": 0.15060140192508698,
        "max_ms": 0.15060140192508698,
        "compile_time": 1.0397334098815918
    },
    {
        "BLOCK_SIZE_M": 32,
        "BLOCK_SIZE_N": 256,
        "BLOCK_SIZE_K": 16,
        "GROUP_SIZE_M": 8,
        "num_stages": 8,
        "num_warps": 4,
        "ms": 0.15076155960559845,
        "min_ms": 0.15076155960559845,
        "max_ms": 0.15076155960559845,
        "compile_time": 1.7128255367279053
    },
    {
        "BLOCK_SIZE_M": 64,
        "BLOCK_SIZE_N": 64,
        "BLOCK_SIZE_K": 32,
        "GROUP_SIZE_M": 8,
        "num_stages": 8,
        "num_warps": 8,
        "ms": 0.1507967859506607,
        "min_ms": 0.1507967859506607,
        "max_ms": 0.1507967859506607,
        "compile_time": 1.0691726207733154
    },
    {
        "BLOCK_SIZE_M": 32,
        "BLOCK_SIZE_N": 256,
        "BLOCK_SIZE_K": 16,
        "GROUP_SIZE_M": 8,
        "num_stages": 8,
        "num_warps": 8,
        "ms": 0.15083615481853485,
        "min_ms": 0.15083615481853485,
        "max_ms": 0.15083615481853485,
        "compile_time": 1.0596404075622559
    },
    {
        "BLOCK_SIZE_M": 32,
        "BLOCK_SIZE_N": 256,
        "BLOCK_SIZE_K": 16,
        "GROUP_SIZE_M": 8,
        "num_stages": 7,
        "num_warps": 4,
        "ms": 0.1508367657661438,
        "min_ms": 0.1508367657661438,
        "max_ms": 0.1508367657661438,
        "compile_time": 1.0375595092773438
    },
    {
        "BLOCK_SIZE_M": 32,
        "BLOCK_SIZE_N": 128,
        "BLOCK_SIZE_K": 64,
        "GROUP_SIZE_M": 8,
        "num_stages": 8,
        "num_warps": 4,
        "ms": 0.15083889663219452,
        "min_ms": 0.15083889663219452,
        "max_ms": 0.15083889663219452,
        "compile_time": 1.038555383682251
    },
    {
        "BLOCK_SIZE_M": 128,
        "BLOCK_SIZE_N": 32,
        "BLOCK_SIZE_K": 32,
        "GROUP_SIZE_M": 8,
        "num_stages": 8,
        "num_warps": 4,
        "ms": 0.1509632170200348,
        "min_ms": 0.1509632170200348,
        "max_ms": 0.1509632170200348,
        "compile_time": 1.121903896331787
    },
    {
        "BLOCK_SIZE_M": 128,
        "BLOCK_SIZE_N": 32,
        "BLOCK_SIZE_K": 64,
        "GROUP_SIZE_M": 8,
        "num_stages": 5,
        "num_warps": 8,
        "ms": 0.15107551217079163,
        "min_ms": 0.15107551217079163,
        "max_ms": 0.15107551217079163,
        "compile_time": 1.142935037612915
    },
    {
        "BLOCK_SIZE_M": 128,
        "BLOCK_SIZE_N": 32,
        "BLOCK_SIZE_K": 64,
        "GROUP_SIZE_M": 8,
        "num_stages": 8,
        "num_warps": 4,
        "ms": 0.15109975636005402,
        "min_ms": 0.15109975636005402,
        "max_ms": 0.15109975636005402,
        "compile_time": 1.1138625144958496
    },
    {
        "BLOCK_SIZE_M": 128,
        "BLOCK_SIZE_N": 32,
        "BLOCK_SIZE_K": 128,
        "GROUP_SIZE_M": 8,
        "num_stages": 3,
        "num_warps": 8,
        "ms": 0.15110337734222412,
        "min_ms": 0.15110337734222412,
        "max_ms": 0.15110337734222412,
        "compile_time": 1.1130497455596924
    },
    {
        "BLOCK_SIZE_M": 32,
        "BLOCK_SIZE_N": 256,
        "BLOCK_SIZE_K": 128,
        "GROUP_SIZE_M": 8,
        "num_stages": 3,
        "num_warps": 16,
        "ms": 0.1511993259191513,
        "min_ms": 0.1511993259191513,
        "max_ms": 0.1511993259191513,
        "compile_time": 1.0646216869354248
    },
    {
        "BLOCK_SIZE_M": 512,
        "BLOCK_SIZE_N": 32,
        "BLOCK_SIZE_K": 64,
        "GROUP_SIZE_M": 8,
        "num_stages": 3,
        "num_warps": 16,
        "ms": 0.15120188891887665,
        "min_ms": 0.15120188891887665,
        "max_ms": 0.15120188891887665,
        "compile_time": 1.1594960689544678
    },
    {
        "BLOCK_SIZE_M": 32,
        "BLOCK_SIZE_N": 128,
        "BLOCK_SIZE_K": 128,
        "GROUP_SIZE_M": 8,
        "num_stages": 3,
        "num_warps": 8,
        "ms": 0.15121003985404968,
        "min_ms": 0.15121003985404968,
        "max_ms": 0.15121003985404968,
        "compile_time": 1.0723702907562256
    },
    {
        "BLOCK_SIZE_M": 256,
        "BLOCK_SIZE_N": 32,
        "BLOCK_SIZE_K": 32,
        "GROUP_SIZE_M": 8,
        "num_stages": 7,
        "num_warps": 8,
        "ms": 0.15121003985404968,
        "min_ms": 0.15121003985404968,
        "max_ms": 0.15121003985404968,
        "compile_time": 1.1708018779754639
    },
    {
        "BLOCK_SIZE_M": 128,
        "BLOCK_SIZE_N": 64,
        "BLOCK_SIZE_K": 16,
        "GROUP_SIZE_M": 8,
        "num_stages": 8,
        "num_warps": 4,
        "ms": 0.1512189358472824,
        "min_ms": 0.1512189358472824,
        "max_ms": 0.1512189358472824,
        "compile_time": 1.8231322765350342
    },
    {
        "BLOCK_SIZE_M": 64,
        "BLOCK_SIZE_N": 64,
        "BLOCK_SIZE_K": 128,
        "GROUP_SIZE_M": 8,
        "num_stages": 6,
        "num_warps": 8,
        "ms": 0.1514584720134735,
        "min_ms": 0.1514584720134735,
        "max_ms": 0.1514584720134735,
        "compile_time": 1.027357578277588
    },
    {
        "BLOCK_SIZE_M": 32,
        "BLOCK_SIZE_N": 512,
        "BLOCK_SIZE_K": 16,
        "GROUP_SIZE_M": 8,
        "num_stages": 5,
        "num_warps": 8,
        "ms": 0.151592418551445,
        "min_ms": 0.151592418551445,
        "max_ms": 0.151592418551445,
        "compile_time": 1.0528504848480225
    },
    {
        "BLOCK_SIZE_M": 128,
        "BLOCK_SIZE_N": 64,
        "BLOCK_SIZE_K": 16,
        "GROUP_SIZE_M": 8,
        "num_stages": 4,
        "num_warps": 8,
        "ms": 0.15172168612480164,
        "min_ms": 0.15172168612480164,
        "max_ms": 0.15172168612480164,
        "compile_time": 1.115004301071167
    },
    {
        "BLOCK_SIZE_M": 32,
        "BLOCK_SIZE_N": 128,
        "BLOCK_SIZE_K": 64,
        "GROUP_SIZE_M": 8,
        "num_stages": 7,
        "num_warps": 4,
        "ms": 0.151724711060524,
        "min_ms": 0.151724711060524,
        "max_ms": 0.151724711060524,
        "compile_time": 0.983588457107544
    },
    {
        "BLOCK_SIZE_M": 32,
        "BLOCK_SIZE_N": 128,
        "BLOCK_SIZE_K": 16,
        "GROUP_SIZE_M": 8,
        "num_stages": 5,
        "num_warps": 4,
        "ms": 0.15187431871891022,
        "min_ms": 0.15187431871891022,
        "max_ms": 0.15187431871891022,
        "compile_time": 1.06736159324646
    },
    {
        "BLOCK_SIZE_M": 128,
        "BLOCK_SIZE_N": 32,
        "BLOCK_SIZE_K": 128,
        "GROUP_SIZE_M": 8,
        "num_stages": 4,
        "num_warps": 4,
        "ms": 0.15194950997829437,
        "min_ms": 0.15194950997829437,
        "max_ms": 0.15194950997829437,
        "compile_time": 1.111830234527588
    },
    {
        "BLOCK_SIZE_M": 64,
        "BLOCK_SIZE_N": 512,
        "BLOCK_SIZE_K": 16,
        "GROUP_SIZE_M": 8,
        "num_stages": 3,
        "num_warps": 8,
        "ms": 0.15199001133441925,
        "min_ms": 0.15199001133441925,
        "max_ms": 0.15199001133441925,
        "compile_time": 2.009086847305298
    },
    {
        "BLOCK_SIZE_M": 256,
        "BLOCK_SIZE_N": 32,
        "BLOCK_SIZE_K": 128,
        "GROUP_SIZE_M": 8,
        "num_stages": 3,
        "num_warps": 16,
        "ms": 0.15216445922851562,
        "min_ms": 0.15216445922851562,
        "max_ms": 0.15216445922851562,
        "compile_time": 1.1564838886260986
    },
    {
        "BLOCK_SIZE_M": 64,
        "BLOCK_SIZE_N": 128,
        "BLOCK_SIZE_K": 128,
        "GROUP_SIZE_M": 8,
        "num_stages": 1,
        "num_warps": 4,
        "ms": 0.15225282311439514,
        "min_ms": 0.15225282311439514,
        "max_ms": 0.15225282311439514,
        "compile_time": 1.089797019958496
    },
    {
        "BLOCK_SIZE_M": 128,
        "BLOCK_SIZE_N": 32,
        "BLOCK_SIZE_K": 128,
        "GROUP_SIZE_M": 8,
        "num_stages": 5,
        "num_warps": 4,
        "ms": 0.15228527784347534,
        "min_ms": 0.15228527784347534,
        "max_ms": 0.15228527784347534,
        "compile_time": 1.0197649002075195
    },
    {
        "BLOCK_SIZE_M": 32,
        "BLOCK_SIZE_N": 512,
        "BLOCK_SIZE_K": 16,
        "GROUP_SIZE_M": 8,
        "num_stages": 4,
        "num_warps": 8,
        "ms": 0.1523100733757019,
        "min_ms": 0.1523100733757019,
        "max_ms": 0.1523100733757019,
        "compile_time": 1.0448977947235107
    },
    {
        "BLOCK_SIZE_M": 128,
        "BLOCK_SIZE_N": 64,
        "BLOCK_SIZE_K": 16,
        "GROUP_SIZE_M": 8,
        "num_stages": 3,
        "num_warps": 8,
        "ms": 0.15243148803710938,
        "min_ms": 0.15243148803710938,
        "max_ms": 0.15243148803710938,
        "compile_time": 1.1033523082733154
    },
    {
        "BLOCK_SIZE_M": 128,
        "BLOCK_SIZE_N": 32,
        "BLOCK_SIZE_K": 128,
        "GROUP_SIZE_M": 8,
        "num_stages": 3,
        "num_warps": 2,
        "ms": 0.1525755375623703,
        "min_ms": 0.1525755375623703,
        "max_ms": 0.1525755375623703,
        "compile_time": 1.0151028633117676
    },
    {
        "BLOCK_SIZE_M": 64,
        "BLOCK_SIZE_N": 128,
        "BLOCK_SIZE_K": 256,
        "GROUP_SIZE_M": 8,
        "num_stages": 2,
        "num_warps": 4,
        "ms": 0.15258029103279114,
        "min_ms": 0.15258029103279114,
        "max_ms": 0.15258029103279114,
        "compile_time": 1.0998735427856445
    },
    {
        "BLOCK_SIZE_M": 256,
        "BLOCK_SIZE_N": 32,
        "BLOCK_SIZE_K": 32,
        "GROUP_SIZE_M": 8,
        "num_stages": 6,
        "num_warps": 8,
        "ms": 0.15260085463523865,
        "min_ms": 0.15260085463523865,
        "max_ms": 0.15260085463523865,
        "compile_time": 1.1541430950164795
    },
    {
        "BLOCK_SIZE_M": 32,
        "BLOCK_SIZE_N": 128,
        "BLOCK_SIZE_K": 16,
        "GROUP_SIZE_M": 8,
        "num_stages": 3,
        "num_warps": 4,
        "ms": 0.1526120901107788,
        "min_ms": 0.1526120901107788,
        "max_ms": 0.1526120901107788,
        "compile_time": 1.0501017570495605
    },
    {
        "BLOCK_SIZE_M": 128,
        "BLOCK_SIZE_N": 32,
        "BLOCK_SIZE_K": 256,
        "GROUP_SIZE_M": 8,
        "num_stages": 2,
        "num_warps": 4,
        "ms": 0.15262600779533386,
        "min_ms": 0.15262600779533386,
        "max_ms": 0.15262600779533386,
        "compile_time": 1.1004610061645508
    },
    {
        "BLOCK_SIZE_M": 32,
        "BLOCK_SIZE_N": 128,
        "BLOCK_SIZE_K": 256,
        "GROUP_SIZE_M": 8,
        "num_stages": 2,
        "num_warps": 4,
        "ms": 0.1527300924062729,
        "min_ms": 0.1527300924062729,
        "max_ms": 0.1527300924062729,
        "compile_time": 1.0300941467285156
    },
    {
        "BLOCK_SIZE_M": 128,
        "BLOCK_SIZE_N": 128,
        "BLOCK_SIZE_K": 128,
        "GROUP_SIZE_M": 8,
        "num_stages": 3,
        "num_warps": 32,
        "ms": 0.15274706482887268,
        "min_ms": 0.15274706482887268,
        "max_ms": 0.15274706482887268,
        "compile_time": 1.1250708103179932
    },
    {
        "BLOCK_SIZE_M": 32,
        "BLOCK_SIZE_N": 128,
        "BLOCK_SIZE_K": 32,
        "GROUP_SIZE_M": 8,
        "num_stages": 2,
        "num_warps": 2,
        "ms": 0.1528196930885315,
        "min_ms": 0.1528196930885315,
        "max_ms": 0.1528196930885315,
        "compile_time": 1.0309813022613525
    },
    {
        "BLOCK_SIZE_M": 32,
        "BLOCK_SIZE_N": 128,
        "BLOCK_SIZE_K": 64,
        "GROUP_SIZE_M": 8,
        "num_stages": 3,
        "num_warps": 4,
        "ms": 0.15291564166545868,
        "min_ms": 0.15291564166545868,
        "max_ms": 0.15291564166545868,
        "compile_time": 1.0458381175994873
    },
    {
        "BLOCK_SIZE_M": 64,
        "BLOCK_SIZE_N": 64,
        "BLOCK_SIZE_K": 16,
        "GROUP_SIZE_M": 8,
        "num_stages": 4,
        "num_warps": 4,
        "ms": 0.1529994159936905,
        "min_ms": 0.1529994159936905,
        "max_ms": 0.1529994159936905,
        "compile_time": 1.0677917003631592
    },
    {
        "BLOCK_SIZE_M": 32,
        "BLOCK_SIZE_N": 128,
        "BLOCK_SIZE_K": 16,
        "GROUP_SIZE_M": 8,
        "num_stages": 6,
        "num_warps": 4,
        "ms": 0.15303963422775269,
        "min_ms": 0.15303963422775269,
        "max_ms": 0.15303963422775269,
        "compile_time": 1.0652539730072021
    },
    {
        "BLOCK_SIZE_M": 64,
        "BLOCK_SIZE_N": 64,
        "BLOCK_SIZE_K": 128,
        "GROUP_SIZE_M": 8,
        "num_stages": 1,
        "num_warps": 4,
        "ms": 0.15306855738162994,
        "min_ms": 0.15306855738162994,
        "max_ms": 0.15306855738162994,
        "compile_time": 1.0657517910003662
    },
    {
        "BLOCK_SIZE_M": 256,
        "BLOCK_SIZE_N": 32,
        "BLOCK_SIZE_K": 32,
        "GROUP_SIZE_M": 8,
        "num_stages": 8,
        "num_warps": 8,
        "ms": 0.15309379994869232,
        "min_ms": 0.15309379994869232,
        "max_ms": 0.15309379994869232,
        "compile_time": 1.9194433689117432
    },
    {
        "BLOCK_SIZE_M": 64,
        "BLOCK_SIZE_N": 64,
        "BLOCK_SIZE_K": 16,
        "GROUP_SIZE_M": 8,
        "num_stages": 3,
        "num_warps": 4,
        "ms": 0.1531461626291275,
        "min_ms": 0.1531461626291275,
        "max_ms": 0.1531461626291275,
        "compile_time": 1.040703296661377
    },
    {
        "BLOCK_SIZE_M": 32,
        "BLOCK_SIZE_N": 128,
        "BLOCK_SIZE_K": 16,
        "GROUP_SIZE_M": 8,
        "num_stages": 7,
        "num_warps": 4,
        "ms": 0.15328577160835266,
        "min_ms": 0.15328577160835266,
        "max_ms": 0.15328577160835266,
        "compile_time": 1.0621569156646729
    },
    {
        "BLOCK_SIZE_M": 128,
        "BLOCK_SIZE_N": 64,
        "BLOCK_SIZE_K": 16,
        "GROUP_SIZE_M": 8,
        "num_stages": 5,
        "num_warps": 8,
        "ms": 0.15329678356647491,
        "min_ms": 0.15329678356647491,
        "max_ms": 0.15329678356647491,
        "compile_time": 1.1124482154846191
    },
    {
        "BLOCK_SIZE_M": 128,
        "BLOCK_SIZE_N": 32,
        "BLOCK_SIZE_K": 64,
        "GROUP_SIZE_M": 8,
        "num_stages": 3,
        "num_warps": 2,
        "ms": 0.1533060222864151,
        "min_ms": 0.1533060222864151,
        "max_ms": 0.1533060222864151,
        "compile_time": 1.1070454120635986
    },
    {
        "BLOCK_SIZE_M": 128,
        "BLOCK_SIZE_N": 64,
        "BLOCK_SIZE_K": 128,
        "GROUP_SIZE_M": 8,
        "num_stages": 1,
        "num_warps": 4,
        "ms": 0.15349942445755005,
        "min_ms": 0.15349942445755005,
        "max_ms": 0.15349942445755005,
        "compile_time": 1.092240571975708
    },
    {
        "BLOCK_SIZE_M": 32,
        "BLOCK_SIZE_N": 128,
        "BLOCK_SIZE_K": 64,
        "GROUP_SIZE_M": 8,
        "num_stages": 2,
        "num_warps": 4,
        "ms": 0.15352821350097656,
        "min_ms": 0.15352821350097656,
        "max_ms": 0.15352821350097656,
        "compile_time": 1.0446186065673828
    },
    {
        "BLOCK_SIZE_M": 128,
        "BLOCK_SIZE_N": 64,
        "BLOCK_SIZE_K": 16,
        "GROUP_SIZE_M": 8,
        "num_stages": 7,
        "num_warps": 2,
        "ms": 0.1535368710756302,
        "min_ms": 0.1535368710756302,
        "max_ms": 0.1535368710756302,
        "compile_time": 2.2912018299102783
    },
    {
        "BLOCK_SIZE_M": 256,
        "BLOCK_SIZE_N": 32,
        "BLOCK_SIZE_K": 128,
        "GROUP_SIZE_M": 8,
        "num_stages": 2,
        "num_warps": 4,
        "ms": 0.15360666811466217,
        "min_ms": 0.15360666811466217,
        "max_ms": 0.15360666811466217,
        "compile_time": 1.1570065021514893
    },
    {
        "BLOCK_SIZE_M": 32,
        "BLOCK_SIZE_N": 128,
        "BLOCK_SIZE_K": 16,
        "GROUP_SIZE_M": 8,
        "num_stages": 5,
        "num_warps": 2,
        "ms": 0.1536080241203308,
        "min_ms": 0.1536080241203308,
        "max_ms": 0.1536080241203308,
        "compile_time": 1.6647944450378418
    },
    {
        "BLOCK_SIZE_M": 64,
        "BLOCK_SIZE_N": 256,
        "BLOCK_SIZE_K": 256,
        "GROUP_SIZE_M": 8,
        "num_stages": 1,
        "num_warps": 16,
        "ms": 0.15374130010604858,
        "min_ms": 0.15374130010604858,
        "max_ms": 0.15374130010604858,
        "compile_time": 1.091749668121338
    },
    {
        "BLOCK_SIZE_M": 128,
        "BLOCK_SIZE_N": 64,
        "BLOCK_SIZE_K": 16,
        "GROUP_SIZE_M": 8,
        "num_stages": 8,
        "num_warps": 2,
        "ms": 0.1538224220275879,
        "min_ms": 0.1538224220275879,
        "max_ms": 0.1538224220275879,
        "compile_time": 2.211747646331787
    },
    {
        "BLOCK_SIZE_M": 128,
        "BLOCK_SIZE_N": 64,
        "BLOCK_SIZE_K": 16,
        "GROUP_SIZE_M": 8,
        "num_stages": 7,
        "num_warps": 8,
        "ms": 0.15393854677677155,
        "min_ms": 0.15393854677677155,
        "max_ms": 0.15393854677677155,
        "compile_time": 1.687002420425415
    },
    {
        "BLOCK_SIZE_M": 128,
        "BLOCK_SIZE_N": 128,
        "BLOCK_SIZE_K": 256,
        "GROUP_SIZE_M": 8,
        "num_stages": 1,
        "num_warps": 16,
        "ms": 0.15404419600963593,
        "min_ms": 0.15404419600963593,
        "max_ms": 0.15404419600963593,
        "compile_time": 1.1017258167266846
    },
    {
        "BLOCK_SIZE_M": 128,
        "BLOCK_SIZE_N": 64,
        "BLOCK_SIZE_K": 32,
        "GROUP_SIZE_M": 8,
        "num_stages": 3,
        "num_warps": 16,
        "ms": 0.15408727526664734,
        "min_ms": 0.15408727526664734,
        "max_ms": 0.15408727526664734,
        "compile_time": 1.120774507522583
    },
    {
        "BLOCK_SIZE_M": 128,
        "BLOCK_SIZE_N": 64,
        "BLOCK_SIZE_K": 16,
        "GROUP_SIZE_M": 8,
        "num_stages": 6,
        "num_warps": 8,
        "ms": 0.154122456908226,
        "min_ms": 0.154122456908226,
        "max_ms": 0.154122456908226,
        "compile_time": 1.7205965518951416
    },
    {
        "BLOCK_SIZE_M": 128,
        "BLOCK_SIZE_N": 32,
        "BLOCK_SIZE_K": 64,
        "GROUP_SIZE_M": 8,
        "num_stages": 2,
        "num_warps": 4,
        "ms": 0.15419477224349976,
        "min_ms": 0.15419477224349976,
        "max_ms": 0.15419477224349976,
        "compile_time": 1.1153233051300049
    },
    {
        "BLOCK_SIZE_M": 128,
        "BLOCK_SIZE_N": 64,
        "BLOCK_SIZE_K": 128,
        "GROUP_SIZE_M": 8,
        "num_stages": 2,
        "num_warps": 2,
        "ms": 0.15420566499233246,
        "min_ms": 0.15420566499233246,
        "max_ms": 0.15420566499233246,
        "compile_time": 1.1271781921386719
    },
    {
        "BLOCK_SIZE_M": 128,
        "BLOCK_SIZE_N": 128,
        "BLOCK_SIZE_K": 16,
        "GROUP_SIZE_M": 8,
        "num_stages": 4,
        "num_warps": 4,
        "ms": 0.15424932539463043,
        "min_ms": 0.15424932539463043,
        "max_ms": 0.15424932539463043,
        "compile_time": 1.955038070678711
    },
    {
        "BLOCK_SIZE_M": 32,
        "BLOCK_SIZE_N": 128,
        "BLOCK_SIZE_K": 64,
        "GROUP_SIZE_M": 8,
        "num_stages": 3,
        "num_warps": 2,
        "ms": 0.15428981184959412,
        "min_ms": 0.15428981184959412,
        "max_ms": 0.15428981184959412,
        "compile_time": 1.0397555828094482
    },
    {
        "BLOCK_SIZE_M": 32,
        "BLOCK_SIZE_N": 512,
        "BLOCK_SIZE_K": 16,
        "GROUP_SIZE_M": 8,
        "num_stages": 6,
        "num_warps": 4,
        "ms": 0.15429018437862396,
        "min_ms": 0.15429018437862396,
        "max_ms": 0.15429018437862396,
        "compile_time": 2.114093780517578
    },
    {
        "BLOCK_SIZE_M": 128,
        "BLOCK_SIZE_N": 128,
        "BLOCK_SIZE_K": 128,
        "GROUP_SIZE_M": 8,
        "num_stages": 1,
        "num_warps": 16,
        "ms": 0.1543123722076416,
        "min_ms": 0.1543123722076416,
        "max_ms": 0.1543123722076416,
        "compile_time": 1.0757474899291992
    },
    {
        "BLOCK_SIZE_M": 64,
        "BLOCK_SIZE_N": 64,
        "BLOCK_SIZE_K": 256,
        "GROUP_SIZE_M": 8,
        "num_stages": 3,
        "num_warps": 8,
        "ms": 0.15433457493782043,
        "min_ms": 0.15433457493782043,
        "max_ms": 0.15433457493782043,
        "compile_time": 1.0727202892303467
    },
    {
        "BLOCK_SIZE_M": 32,
        "BLOCK_SIZE_N": 512,
        "BLOCK_SIZE_K": 32,
        "GROUP_SIZE_M": 8,
        "num_stages": 3,
        "num_warps": 8,
        "ms": 0.15439994633197784,
        "min_ms": 0.15439994633197784,
        "max_ms": 0.15439994633197784,
        "compile_time": 1.0302386283874512
    },
    {
        "BLOCK_SIZE_M": 32,
        "BLOCK_SIZE_N": 512,
        "BLOCK_SIZE_K": 16,
        "GROUP_SIZE_M": 8,
        "num_stages": 3,
        "num_warps": 8,
        "ms": 0.15445691347122192,
        "min_ms": 0.15445691347122192,
        "max_ms": 0.15445691347122192,
        "compile_time": 1.0466313362121582
    },
    {
        "BLOCK_SIZE_M": 32,
        "BLOCK_SIZE_N": 512,
        "BLOCK_SIZE_K": 16,
        "GROUP_SIZE_M": 8,
        "num_stages": 8,
        "num_warps": 4,
        "ms": 0.15448303520679474,
        "min_ms": 0.15448303520679474,
        "max_ms": 0.15448303520679474,
        "compile_time": 2.120795249938965
    },
    {
        "BLOCK_SIZE_M": 128,
        "BLOCK_SIZE_N": 64,
        "BLOCK_SIZE_K": 32,
        "GROUP_SIZE_M": 8,
        "num_stages": 4,
        "num_warps": 16,
        "ms": 0.15452061593532562,
        "min_ms": 0.15452061593532562,
        "max_ms": 0.15452061593532562,
        "compile_time": 1.117485761642456
    },
    {
        "BLOCK_SIZE_M": 128,
        "BLOCK_SIZE_N": 64,
        "BLOCK_SIZE_K": 16,
        "GROUP_SIZE_M": 8,
        "num_stages": 8,
        "num_warps": 8,
        "ms": 0.15455254912376404,
        "min_ms": 0.15455254912376404,
        "max_ms": 0.15455254912376404,
        "compile_time": 1.1161181926727295
    },
    {
        "BLOCK_SIZE_M": 32,
        "BLOCK_SIZE_N": 128,
        "BLOCK_SIZE_K": 16,
        "GROUP_SIZE_M": 8,
        "num_stages": 4,
        "num_warps": 2,
        "ms": 0.1546008586883545,
        "min_ms": 0.1546008586883545,
        "max_ms": 0.1546008586883545,
        "compile_time": 0.9843606948852539
    },
    {
        "BLOCK_SIZE_M": 32,
        "BLOCK_SIZE_N": 128,
        "BLOCK_SIZE_K": 16,
        "GROUP_SIZE_M": 8,
        "num_stages": 8,
        "num_warps": 4,
        "ms": 0.15468856692314148,
        "min_ms": 0.15468856692314148,
        "max_ms": 0.15468856692314148,
        "compile_time": 1.0690882205963135
    },
    {
        "BLOCK_SIZE_M": 32,
        "BLOCK_SIZE_N": 512,
        "BLOCK_SIZE_K": 16,
        "GROUP_SIZE_M": 8,
        "num_stages": 7,
        "num_warps": 4,
        "ms": 0.15474623441696167,
        "min_ms": 0.15474623441696167,
        "max_ms": 0.15474623441696167,
        "compile_time": 2.1522955894470215
    },
    {
        "BLOCK_SIZE_M": 128,
        "BLOCK_SIZE_N": 128,
        "BLOCK_SIZE_K": 16,
        "GROUP_SIZE_M": 8,
        "num_stages": 5,
        "num_warps": 4,
        "ms": 0.15485210716724396,
        "min_ms": 0.15485210716724396,
        "max_ms": 0.15485210716724396,
        "compile_time": 2.109776735305786
    },
    {
        "BLOCK_SIZE_M": 32,
        "BLOCK_SIZE_N": 256,
        "BLOCK_SIZE_K": 64,
        "GROUP_SIZE_M": 8,
        "num_stages": 3,
        "num_warps": 16,
        "ms": 0.15501639246940613,
        "min_ms": 0.15501639246940613,
        "max_ms": 0.15501639246940613,
        "compile_time": 1.016075611114502
    },
    {
        "BLOCK_SIZE_M": 128,
        "BLOCK_SIZE_N": 256,
        "BLOCK_SIZE_K": 16,
        "GROUP_SIZE_M": 8,
        "num_stages": 6,
        "num_warps": 8,
        "ms": 0.15517470240592957,
        "min_ms": 0.15517470240592957,
        "max_ms": 0.15517470240592957,
        "compile_time": 1.1362733840942383
    },
    {
        "BLOCK_SIZE_M": 32,
        "BLOCK_SIZE_N": 128,
        "BLOCK_SIZE_K": 128,
        "GROUP_SIZE_M": 8,
        "num_stages": 5,
        "num_warps": 4,
        "ms": 0.15522781014442444,
        "min_ms": 0.15522781014442444,
        "max_ms": 0.15522781014442444,
        "compile_time": 1.0536248683929443
    },
    {
        "BLOCK_SIZE_M": 128,
        "BLOCK_SIZE_N": 128,
        "BLOCK_SIZE_K": 16,
        "GROUP_SIZE_M": 8,
        "num_stages": 6,
        "num_warps": 4,
        "ms": 0.15536978840827942,
        "min_ms": 0.15536978840827942,
        "max_ms": 0.15536978840827942,
        "compile_time": 2.1167306900024414
    },
    {
        "BLOCK_SIZE_M": 64,
        "BLOCK_SIZE_N": 256,
        "BLOCK_SIZE_K": 128,
        "GROUP_SIZE_M": 8,
        "num_stages": 2,
        "num_warps": 16,
        "ms": 0.15540249645709991,
        "min_ms": 0.15540249645709991,
        "max_ms": 0.15540249645709991,
        "compile_time": 1.0923006534576416
    },
    {
        "BLOCK_SIZE_M": 128,
        "BLOCK_SIZE_N": 32,
        "BLOCK_SIZE_K": 128,
        "GROUP_SIZE_M": 8,
        "num_stages": 2,
        "num_warps": 4,
        "ms": 0.15544798970222473,
        "min_ms": 0.15544798970222473,
        "max_ms": 0.15544798970222473,
        "compile_time": 1.1147305965423584
    },
    {
        "BLOCK_SIZE_M": 128,
        "BLOCK_SIZE_N": 64,
        "BLOCK_SIZE_K": 32,
        "GROUP_SIZE_M": 8,
        "num_stages": 5,
        "num_warps": 16,
        "ms": 0.15552213788032532,
        "min_ms": 0.15552213788032532,
        "max_ms": 0.15552213788032532,
        "compile_time": 1.1213102340698242
    },
    {
        "BLOCK_SIZE_M": 64,
        "BLOCK_SIZE_N": 128,
        "BLOCK_SIZE_K": 256,
        "GROUP_SIZE_M": 8,
        "num_stages": 1,
        "num_warps": 8,
        "ms": 0.15556776523590088,
        "min_ms": 0.15556776523590088,
        "max_ms": 0.15556776523590088,
        "compile_time": 1.1041090488433838
    },
    {
        "BLOCK_SIZE_M": 256,
        "BLOCK_SIZE_N": 64,
        "BLOCK_SIZE_K": 128,
        "GROUP_SIZE_M": 8,
        "num_stages": 2,
        "num_warps": 16,
        "ms": 0.15556901693344116,
        "min_ms": 0.15556901693344116,
        "max_ms": 0.15556901693344116,
        "compile_time": 1.1387019157409668
    },
    {
        "BLOCK_SIZE_M": 128,
        "BLOCK_SIZE_N": 256,
        "BLOCK_SIZE_K": 32,
        "GROUP_SIZE_M": 8,
        "num_stages": 4,
        "num_warps": 16,
        "ms": 0.15564078092575073,
        "min_ms": 0.15564078092575073,
        "max_ms": 0.15564078092575073,
        "compile_time": 1.127955436706543
    },
    {
        "BLOCK_SIZE_M": 128,
        "BLOCK_SIZE_N": 256,
        "BLOCK_SIZE_K": 32,
        "GROUP_SIZE_M": 8,
        "num_stages": 5,
        "num_warps": 16,
        "ms": 0.1557837426662445,
        "min_ms": 0.1557837426662445,
        "max_ms": 0.1557837426662445,
        "compile_time": 1.130279779434204
    },
    {
        "BLOCK_SIZE_M": 128,
        "BLOCK_SIZE_N": 64,
        "BLOCK_SIZE_K": 32,
        "GROUP_SIZE_M": 8,
        "num_stages": 6,
        "num_warps": 16,
        "ms": 0.15581567585468292,
        "min_ms": 0.15581567585468292,
        "max_ms": 0.15581567585468292,
        "compile_time": 1.1142668724060059
    },
    {
        "BLOCK_SIZE_M": 128,
        "BLOCK_SIZE_N": 256,
        "BLOCK_SIZE_K": 32,
        "GROUP_SIZE_M": 8,
        "num_stages": 3,
        "num_warps": 16,
        "ms": 0.15592214465141296,
        "min_ms": 0.15592214465141296,
        "max_ms": 0.15592214465141296,
        "compile_time": 1.1250941753387451
    },
    {
        "BLOCK_SIZE_M": 32,
        "BLOCK_SIZE_N": 256,
        "BLOCK_SIZE_K": 32,
        "GROUP_SIZE_M": 8,
        "num_stages": 4,
        "num_warps": 2,
        "ms": 0.15604181587696075,
        "min_ms": 0.15604181587696075,
        "max_ms": 0.15604181587696075,
        "compile_time": 1.0590498447418213
    },
    {
        "BLOCK_SIZE_M": 256,
        "BLOCK_SIZE_N": 32,
        "BLOCK_SIZE_K": 64,
        "GROUP_SIZE_M": 8,
        "num_stages": 3,
        "num_warps": 16,
        "ms": 0.15614637732505798,
        "min_ms": 0.15614637732505798,
        "max_ms": 0.15614637732505798,
        "compile_time": 1.1574773788452148
    },
    {
        "BLOCK_SIZE_M": 128,
        "BLOCK_SIZE_N": 128,
        "BLOCK_SIZE_K": 16,
        "GROUP_SIZE_M": 8,
        "num_stages": 7,
        "num_warps": 4,
        "ms": 0.15620127320289612,
        "min_ms": 0.15620127320289612,
        "max_ms": 0.15620127320289612,
        "compile_time": 2.1495089530944824
    },
    {
        "BLOCK_SIZE_M": 32,
        "BLOCK_SIZE_N": 256,
        "BLOCK_SIZE_K": 128,
        "GROUP_SIZE_M": 8,
        "num_stages": 2,
        "num_warps": 4,
        "ms": 0.15626643598079681,
        "min_ms": 0.15626643598079681,
        "max_ms": 0.15626643598079681,
        "compile_time": 1.046058177947998
    },
    {
        "BLOCK_SIZE_M": 64,
        "BLOCK_SIZE_N": 256,
        "BLOCK_SIZE_K": 256,
        "GROUP_SIZE_M": 8,
        "num_stages": 1,
        "num_warps": 8,
        "ms": 0.1563435047864914,
        "min_ms": 0.1563435047864914,
        "max_ms": 0.1563435047864914,
        "compile_time": 1.0828907489776611
    },
    {
        "BLOCK_SIZE_M": 32,
        "BLOCK_SIZE_N": 256,
        "BLOCK_SIZE_K": 64,
        "GROUP_SIZE_M": 8,
        "num_stages": 4,
        "num_warps": 16,
        "ms": 0.15652363002300262,
        "min_ms": 0.15652363002300262,
        "max_ms": 0.15652363002300262,
        "compile_time": 1.0635063648223877
    },
    {
        "BLOCK_SIZE_M": 128,
        "BLOCK_SIZE_N": 256,
        "BLOCK_SIZE_K": 16,
        "GROUP_SIZE_M": 8,
        "num_stages": 7,
        "num_warps": 8,
        "ms": 0.15665821731090546,
        "min_ms": 0.15665821731090546,
        "max_ms": 0.15665821731090546,
        "compile_time": 1.1142711639404297
    },
    {
        "BLOCK_SIZE_M": 64,
        "BLOCK_SIZE_N": 64,
        "BLOCK_SIZE_K": 64,
        "GROUP_SIZE_M": 8,
        "num_stages": 8,
        "num_warps": 2,
        "ms": 0.15670618414878845,
        "min_ms": 0.15670618414878845,
        "max_ms": 0.15670618414878845,
        "compile_time": 1.0740866661071777
    },
    {
        "BLOCK_SIZE_M": 128,
        "BLOCK_SIZE_N": 64,
        "BLOCK_SIZE_K": 32,
        "GROUP_SIZE_M": 8,
        "num_stages": 7,
        "num_warps": 16,
        "ms": 0.1567990481853485,
        "min_ms": 0.1567990481853485,
        "max_ms": 0.1567990481853485,
        "compile_time": 1.131958246231079
    },
    {
        "BLOCK_SIZE_M": 128,
        "BLOCK_SIZE_N": 256,
        "BLOCK_SIZE_K": 32,
        "GROUP_SIZE_M": 8,
        "num_stages": 6,
        "num_warps": 16,
        "ms": 0.1568695604801178,
        "min_ms": 0.1568695604801178,
        "max_ms": 0.1568695604801178,
        "compile_time": 1.1283950805664062
    },
    {
        "BLOCK_SIZE_M": 64,
        "BLOCK_SIZE_N": 64,
        "BLOCK_SIZE_K": 64,
        "GROUP_SIZE_M": 8,
        "num_stages": 7,
        "num_warps": 2,
        "ms": 0.156987264752388,
        "min_ms": 0.156987264752388,
        "max_ms": 0.156987264752388,
        "compile_time": 1.0760424137115479
    },
    {
        "BLOCK_SIZE_M": 256,
        "BLOCK_SIZE_N": 32,
        "BLOCK_SIZE_K": 64,
        "GROUP_SIZE_M": 8,
        "num_stages": 4,
        "num_warps": 16,
        "ms": 0.15698900818824768,
        "min_ms": 0.15698900818824768,
        "max_ms": 0.15698900818824768,
        "compile_time": 1.148066520690918
    },
    {
        "BLOCK_SIZE_M": 32,
        "BLOCK_SIZE_N": 128,
        "BLOCK_SIZE_K": 16,
        "GROUP_SIZE_M": 8,
        "num_stages": 8,
        "num_warps": 2,
        "ms": 0.15699824690818787,
        "min_ms": 0.15699824690818787,
        "max_ms": 0.15699824690818787,
        "compile_time": 1.7178442478179932
    },
    {
        "BLOCK_SIZE_M": 64,
        "BLOCK_SIZE_N": 128,
        "BLOCK_SIZE_K": 32,
        "GROUP_SIZE_M": 8,
        "num_stages": 8,
        "num_warps": 2,
        "ms": 0.1570323407649994,
        "min_ms": 0.1570323407649994,
        "max_ms": 0.1570323407649994,
        "compile_time": 1.073763370513916
    },
    {
        "BLOCK_SIZE_M": 32,
        "BLOCK_SIZE_N": 128,
        "BLOCK_SIZE_K": 128,
        "GROUP_SIZE_M": 8,
        "num_stages": 4,
        "num_warps": 4,
        "ms": 0.1570340245962143,
        "min_ms": 0.1570340245962143,
        "max_ms": 0.1570340245962143,
        "compile_time": 1.042973279953003
    },
    {
        "BLOCK_SIZE_M": 128,
        "BLOCK_SIZE_N": 256,
        "BLOCK_SIZE_K": 16,
        "GROUP_SIZE_M": 8,
        "num_stages": 8,
        "num_warps": 8,
        "ms": 0.15715987980365753,
        "min_ms": 0.15715987980365753,
        "max_ms": 0.15715987980365753,
        "compile_time": 2.1285994052886963
    },
    {
        "BLOCK_SIZE_M": 32,
        "BLOCK_SIZE_N": 256,
        "BLOCK_SIZE_K": 64,
        "GROUP_SIZE_M": 8,
        "num_stages": 5,
        "num_warps": 16,
        "ms": 0.15720176696777344,
        "min_ms": 0.15720176696777344,
        "max_ms": 0.15720176696777344,
        "compile_time": 1.0546283721923828
    },
    {
        "BLOCK_SIZE_M": 256,
        "BLOCK_SIZE_N": 64,
        "BLOCK_SIZE_K": 16,
        "GROUP_SIZE_M": 8,
        "num_stages": 6,
        "num_warps": 8,
        "ms": 0.1573057621717453,
        "min_ms": 0.1573057621717453,
        "max_ms": 0.1573057621717453,
        "compile_time": 1.1215612888336182
    },
    {
        "BLOCK_SIZE_M": 128,
        "BLOCK_SIZE_N": 128,
        "BLOCK_SIZE_K": 256,
        "GROUP_SIZE_M": 8,
        "num_stages": 2,
        "num_warps": 16,
        "ms": 0.1573503017425537,
        "min_ms": 0.1573503017425537,
        "max_ms": 0.1573503017425537,
        "compile_time": 1.138472080230713
    },
    {
        "BLOCK_SIZE_M": 128,
        "BLOCK_SIZE_N": 64,
        "BLOCK_SIZE_K": 32,
        "GROUP_SIZE_M": 8,
        "num_stages": 2,
        "num_warps": 8,
        "ms": 0.1573929637670517,
        "min_ms": 0.1573929637670517,
        "max_ms": 0.1573929637670517,
        "compile_time": 1.0514113903045654
    },
    {
        "BLOCK_SIZE_M": 128,
        "BLOCK_SIZE_N": 256,
        "BLOCK_SIZE_K": 32,
        "GROUP_SIZE_M": 8,
        "num_stages": 7,
        "num_warps": 16,
        "ms": 0.15758320689201355,
        "min_ms": 0.15758320689201355,
        "max_ms": 0.15758320689201355,
        "compile_time": 1.9055204391479492
    },
    {
        "BLOCK_SIZE_M": 256,
        "BLOCK_SIZE_N": 32,
        "BLOCK_SIZE_K": 64,
        "GROUP_SIZE_M": 8,
        "num_stages": 2,
        "num_warps": 8,
        "ms": 0.15762610733509064,
        "min_ms": 0.15762610733509064,
        "max_ms": 0.15762610733509064,
        "compile_time": 1.0856983661651611
    },
    {
        "BLOCK_SIZE_M": 64,
        "BLOCK_SIZE_N": 256,
        "BLOCK_SIZE_K": 16,
        "GROUP_SIZE_M": 8,
        "num_stages": 4,
        "num_warps": 16,
        "ms": 0.1577880084514618,
        "min_ms": 0.1577880084514618,
        "max_ms": 0.1577880084514618,
        "compile_time": 1.0842230319976807
    },
    {
        "BLOCK_SIZE_M": 128,
        "BLOCK_SIZE_N": 128,
        "BLOCK_SIZE_K": 64,
        "GROUP_SIZE_M": 8,
        "num_stages": 3,
        "num_warps": 32,
        "ms": 0.1578177511692047,
        "min_ms": 0.1578177511692047,
        "max_ms": 0.1578177511692047,
        "compile_time": 1.1197388172149658
    },
    {
        "BLOCK_SIZE_M": 64,
        "BLOCK_SIZE_N": 128,
        "BLOCK_SIZE_K": 32,
        "GROUP_SIZE_M": 8,
        "num_stages": 3,
        "num_warps": 16,
        "ms": 0.15788085758686066,
        "min_ms": 0.15788085758686066,
        "max_ms": 0.15788085758686066,
        "compile_time": 1.0768897533416748
    },
    {
        "BLOCK_SIZE_M": 64,
        "BLOCK_SIZE_N": 256,
        "BLOCK_SIZE_K": 16,
        "GROUP_SIZE_M": 8,
        "num_stages": 3,
        "num_warps": 16,
        "ms": 0.15788328647613525,
        "min_ms": 0.15788328647613525,
        "max_ms": 0.15788328647613525,
        "compile_time": 1.0848503112792969
    },
    {
        "BLOCK_SIZE_M": 32,
        "BLOCK_SIZE_N": 64,
        "BLOCK_SIZE_K": 32,
        "GROUP_SIZE_M": 8,
        "num_stages": 5,
        "num_warps": 2,
        "ms": 0.15793178975582123,
        "min_ms": 0.15793178975582123,
        "max_ms": 0.15793178975582123,
        "compile_time": 1.078099012374878
    },
    {
        "BLOCK_SIZE_M": 32,
        "BLOCK_SIZE_N": 64,
        "BLOCK_SIZE_K": 32,
        "GROUP_SIZE_M": 8,
        "num_stages": 6,
        "num_warps": 2,
        "ms": 0.1580255627632141,
        "min_ms": 0.1580255627632141,
        "max_ms": 0.1580255627632141,
        "compile_time": 1.0602200031280518
    },
    {
        "BLOCK_SIZE_M": 256,
        "BLOCK_SIZE_N": 128,
        "BLOCK_SIZE_K": 32,
        "GROUP_SIZE_M": 8,
        "num_stages": 2,
        "num_warps": 8,
        "ms": 0.15803036093711853,
        "min_ms": 0.15803036093711853,
        "max_ms": 0.15803036093711853,
        "compile_time": 1.1369397640228271
    },
    {
        "BLOCK_SIZE_M": 64,
        "BLOCK_SIZE_N": 256,
        "BLOCK_SIZE_K": 16,
        "GROUP_SIZE_M": 8,
        "num_stages": 5,
        "num_warps": 16,
        "ms": 0.1581813395023346,
        "min_ms": 0.1581813395023346,
        "max_ms": 0.1581813395023346,
        "compile_time": 1.0872395038604736
    },
    {
        "BLOCK_SIZE_M": 32,
        "BLOCK_SIZE_N": 512,
        "BLOCK_SIZE_K": 32,
        "GROUP_SIZE_M": 8,
        "num_stages": 4,
        "num_warps": 4,
        "ms": 0.1582096517086029,
        "min_ms": 0.1582096517086029,
        "max_ms": 0.1582096517086029,
        "compile_time": 2.4631664752960205
    },
    {
        "BLOCK_SIZE_M": 256,
        "BLOCK_SIZE_N": 64,
        "BLOCK_SIZE_K": 16,
        "GROUP_SIZE_M": 8,
        "num_stages": 4,
        "num_warps": 8,
        "ms": 0.15821869671344757,
        "min_ms": 0.15821869671344757,
        "max_ms": 0.15821869671344757,
        "compile_time": 1.1459159851074219
    },
    {
        "BLOCK_SIZE_M": 256,
        "BLOCK_SIZE_N": 32,
        "BLOCK_SIZE_K": 64,
        "GROUP_SIZE_M": 8,
        "num_stages": 5,
        "num_warps": 16,
        "ms": 0.15823854506015778,
        "min_ms": 0.15823854506015778,
        "max_ms": 0.15823854506015778,
        "compile_time": 1.1625661849975586
    },
    {
        "BLOCK_SIZE_M": 32,
        "BLOCK_SIZE_N": 256,
        "BLOCK_SIZE_K": 32,
        "GROUP_SIZE_M": 8,
        "num_stages": 4,
        "num_warps": 16,
        "ms": 0.158267542719841,
        "min_ms": 0.158267542719841,
        "max_ms": 0.158267542719841,
        "compile_time": 0.9711034297943115
    },
    {
        "BLOCK_SIZE_M": 128,
        "BLOCK_SIZE_N": 32,
        "BLOCK_SIZE_K": 64,
        "GROUP_SIZE_M": 8,
        "num_stages": 2,
        "num_warps": 2,
        "ms": 0.15829934179782867,
        "min_ms": 0.15829934179782867,
        "max_ms": 0.15829934179782867,
        "compile_time": 1.1167140007019043
    },
    {
        "BLOCK_SIZE_M": 32,
        "BLOCK_SIZE_N": 256,
        "BLOCK_SIZE_K": 32,
        "GROUP_SIZE_M": 8,
        "num_stages": 5,
        "num_warps": 2,
        "ms": 0.15833015739917755,
        "min_ms": 0.15833015739917755,
        "max_ms": 0.15833015739917755,
        "compile_time": 1.0537829399108887
    },
    {
        "BLOCK_SIZE_M": 256,
        "BLOCK_SIZE_N": 64,
        "BLOCK_SIZE_K": 16,
        "GROUP_SIZE_M": 8,
        "num_stages": 7,
        "num_warps": 8,
        "ms": 0.15833450853824615,
        "min_ms": 0.15833450853824615,
        "max_ms": 0.15833450853824615,
        "compile_time": 1.137939214706421
    },
    {
        "BLOCK_SIZE_M": 256,
        "BLOCK_SIZE_N": 64,
        "BLOCK_SIZE_K": 16,
        "GROUP_SIZE_M": 8,
        "num_stages": 5,
        "num_warps": 8,
        "ms": 0.1584828495979309,
        "min_ms": 0.1584828495979309,
        "max_ms": 0.1584828495979309,
        "compile_time": 1.1486694812774658
    },
    {
        "BLOCK_SIZE_M": 128,
        "BLOCK_SIZE_N": 128,
        "BLOCK_SIZE_K": 128,
        "GROUP_SIZE_M": 8,
        "num_stages": 1,
        "num_warps": 4,
        "ms": 0.15853555500507355,
        "min_ms": 0.15853555500507355,
        "max_ms": 0.15853555500507355,
        "compile_time": 1.1285932064056396
    },
    {
        "BLOCK_SIZE_M": 128,
        "BLOCK_SIZE_N": 64,
        "BLOCK_SIZE_K": 16,
        "GROUP_SIZE_M": 8,
        "num_stages": 6,
        "num_warps": 4,
        "ms": 0.15855258703231812,
        "min_ms": 0.15855258703231812,
        "max_ms": 0.15855258703231812,
        "compile_time": 1.1117453575134277
    },
    {
        "BLOCK_SIZE_M": 64,
        "BLOCK_SIZE_N": 256,
        "BLOCK_SIZE_K": 16,
        "GROUP_SIZE_M": 8,
        "num_stages": 6,
        "num_warps": 16,
        "ms": 0.15857155621051788,
        "min_ms": 0.15857155621051788,
        "max_ms": 0.15857155621051788,
        "compile_time": 1.596322774887085
    },
    {
        "BLOCK_SIZE_M": 64,
        "BLOCK_SIZE_N": 256,
        "BLOCK_SIZE_K": 16,
        "GROUP_SIZE_M": 8,
        "num_stages": 7,
        "num_warps": 16,
        "ms": 0.1586003303527832,
        "min_ms": 0.1586003303527832,
        "max_ms": 0.1586003303527832,
        "compile_time": 1.603576421737671
    },
    {
        "BLOCK_SIZE_M": 64,
        "BLOCK_SIZE_N": 128,
        "BLOCK_SIZE_K": 32,
        "GROUP_SIZE_M": 8,
        "num_stages": 4,
        "num_warps": 16,
        "ms": 0.1586470901966095,
        "min_ms": 0.1586470901966095,
        "max_ms": 0.1586470901966095,
        "compile_time": 1.0760102272033691
    },
    {
        "BLOCK_SIZE_M": 32,
        "BLOCK_SIZE_N": 512,
        "BLOCK_SIZE_K": 32,
        "GROUP_SIZE_M": 8,
        "num_stages": 5,
        "num_warps": 4,
        "ms": 0.15870413184165955,
        "min_ms": 0.15870413184165955,
        "max_ms": 0.15870413184165955,
        "compile_time": 2.543046474456787
    },
    {
        "BLOCK_SIZE_M": 128,
        "BLOCK_SIZE_N": 128,
        "BLOCK_SIZE_K": 64,
        "GROUP_SIZE_M": 8,
        "num_stages": 4,
        "num_warps": 32,
        "ms": 0.15886254608631134,
        "min_ms": 0.15886254608631134,
        "max_ms": 0.15886254608631134,
        "compile_time": 1.1198086738586426
    },
    {
        "BLOCK_SIZE_M": 32,
        "BLOCK_SIZE_N": 128,
        "BLOCK_SIZE_K": 64,
        "GROUP_SIZE_M": 8,
        "num_stages": 6,
        "num_warps": 8,
        "ms": 0.15886875987052917,
        "min_ms": 0.15886875987052917,
        "max_ms": 0.15886875987052917,
        "compile_time": 1.0499823093414307
    },
    {
        "BLOCK_SIZE_M": 32,
        "BLOCK_SIZE_N": 256,
        "BLOCK_SIZE_K": 32,
        "GROUP_SIZE_M": 8,
        "num_stages": 3,
        "num_warps": 16,
        "ms": 0.15901143848896027,
        "min_ms": 0.15901143848896027,
        "max_ms": 0.15901143848896027,
        "compile_time": 1.0632820129394531
    },
    {
        "BLOCK_SIZE_M": 256,
        "BLOCK_SIZE_N": 64,
        "BLOCK_SIZE_K": 16,
        "GROUP_SIZE_M": 8,
        "num_stages": 8,
        "num_warps": 8,
        "ms": 0.15903155505657196,
        "min_ms": 0.15903155505657196,
        "max_ms": 0.15903155505657196,
        "compile_time": 1.1456820964813232
    },
    {
        "BLOCK_SIZE_M": 128,
        "BLOCK_SIZE_N": 128,
        "BLOCK_SIZE_K": 16,
        "GROUP_SIZE_M": 8,
        "num_stages": 3,
        "num_warps": 4,
        "ms": 0.1591375321149826,
        "min_ms": 0.1591375321149826,
        "max_ms": 0.1591375321149826,
        "compile_time": 2.0602471828460693
    },
    {
        "BLOCK_SIZE_M": 64,
        "BLOCK_SIZE_N": 256,
        "BLOCK_SIZE_K": 16,
        "GROUP_SIZE_M": 8,
        "num_stages": 8,
        "num_warps": 16,
        "ms": 0.1592135727405548,
        "min_ms": 0.1592135727405548,
        "max_ms": 0.1592135727405548,
        "compile_time": 1.6181185245513916
    },
    {
        "BLOCK_SIZE_M": 256,
        "BLOCK_SIZE_N": 32,
        "BLOCK_SIZE_K": 32,
        "GROUP_SIZE_M": 8,
        "num_stages": 3,
        "num_warps": 2,
        "ms": 0.15923559665679932,
        "min_ms": 0.15923559665679932,
        "max_ms": 0.15923559665679932,
        "compile_time": 1.1181681156158447
    },
    {
        "BLOCK_SIZE_M": 32,
        "BLOCK_SIZE_N": 64,
        "BLOCK_SIZE_K": 32,
        "GROUP_SIZE_M": 8,
        "num_stages": 4,
        "num_warps": 2,
        "ms": 0.15927468240261078,
        "min_ms": 0.15927468240261078,
        "max_ms": 0.15927468240261078,
        "compile_time": 1.0571930408477783
    },
    {
        "BLOCK_SIZE_M": 32,
        "BLOCK_SIZE_N": 256,
        "BLOCK_SIZE_K": 32,
        "GROUP_SIZE_M": 8,
        "num_stages": 5,
        "num_warps": 16,
        "ms": 0.15927931666374207,
        "min_ms": 0.15927931666374207,
        "max_ms": 0.15927931666374207,
        "compile_time": 1.064439058303833
    },
    {
        "BLOCK_SIZE_M": 64,
        "BLOCK_SIZE_N": 128,
        "BLOCK_SIZE_K": 32,
        "GROUP_SIZE_M": 8,
        "num_stages": 5,
        "num_warps": 16,
        "ms": 0.15933442115783691,
        "min_ms": 0.15933442115783691,
        "max_ms": 0.15933442115783691,
        "compile_time": 1.076887607574463
    },
    {
        "BLOCK_SIZE_M": 128,
        "BLOCK_SIZE_N": 128,
        "BLOCK_SIZE_K": 64,
        "GROUP_SIZE_M": 8,
        "num_stages": 5,
        "num_warps": 32,
        "ms": 0.1593472808599472,
        "min_ms": 0.1593472808599472,
        "max_ms": 0.1593472808599472,
        "compile_time": 1.1395995616912842
    },
    {
        "BLOCK_SIZE_M": 128,
        "BLOCK_SIZE_N": 128,
        "BLOCK_SIZE_K": 32,
        "GROUP_SIZE_M": 8,
        "num_stages": 1,
        "num_warps": 8,
        "ms": 0.15939797461032867,
        "min_ms": 0.15939797461032867,
        "max_ms": 0.15939797461032867,
        "compile_time": 1.1098220348358154
    },
    {
        "BLOCK_SIZE_M": 128,
        "BLOCK_SIZE_N": 32,
        "BLOCK_SIZE_K": 64,
        "GROUP_SIZE_M": 8,
        "num_stages": 2,
        "num_warps": 8,
        "ms": 0.1596214324235916,
        "min_ms": 0.1596214324235916,
        "max_ms": 0.1596214324235916,
        "compile_time": 1.1173875331878662
    },
    {
        "BLOCK_SIZE_M": 256,
        "BLOCK_SIZE_N": 128,
        "BLOCK_SIZE_K": 32,
        "GROUP_SIZE_M": 8,
        "num_stages": 4,
        "num_warps": 16,
        "ms": 0.16001541912555695,
        "min_ms": 0.16001541912555695,
        "max_ms": 0.16001541912555695,
        "compile_time": 1.1600158214569092
    },
    {
        "BLOCK_SIZE_M": 128,
        "BLOCK_SIZE_N": 64,
        "BLOCK_SIZE_K": 256,
        "GROUP_SIZE_M": 8,
        "num_stages": 2,
        "num_warps": 4,
        "ms": 0.16011591255664825,
        "min_ms": 0.16011591255664825,
        "max_ms": 0.16011591255664825,
        "compile_time": 1.1299867630004883
    },
    {
        "BLOCK_SIZE_M": 64,
        "BLOCK_SIZE_N": 128,
        "BLOCK_SIZE_K": 32,
        "GROUP_SIZE_M": 8,
        "num_stages": 6,
        "num_warps": 16,
        "ms": 0.16012758016586304,
        "min_ms": 0.16012758016586304,
        "max_ms": 0.16012758016586304,
        "compile_time": 1.063603401184082
    },
    {
        "BLOCK_SIZE_M": 64,
        "BLOCK_SIZE_N": 128,
        "BLOCK_SIZE_K": 32,
        "GROUP_SIZE_M": 8,
        "num_stages": 7,
        "num_warps": 16,
        "ms": 0.16022200882434845,
        "min_ms": 0.16022200882434845,
        "max_ms": 0.16022200882434845,
        "compile_time": 1.0855376720428467
    },
    {
        "BLOCK_SIZE_M": 32,
        "BLOCK_SIZE_N": 128,
        "BLOCK_SIZE_K": 64,
        "GROUP_SIZE_M": 8,
        "num_stages": 7,
        "num_warps": 8,
        "ms": 0.16033437848091125,
        "min_ms": 0.16033437848091125,
        "max_ms": 0.16033437848091125,
        "compile_time": 1.0487682819366455
    },
    {
        "BLOCK_SIZE_M": 64,
        "BLOCK_SIZE_N": 64,
        "BLOCK_SIZE_K": 128,
        "GROUP_SIZE_M": 8,
        "num_stages": 1,
        "num_warps": 2,
        "ms": 0.16035506129264832,
        "min_ms": 0.16035506129264832,
        "max_ms": 0.16035506129264832,
        "compile_time": 1.0637049674987793
    },
    {
        "BLOCK_SIZE_M": 256,
        "BLOCK_SIZE_N": 64,
        "BLOCK_SIZE_K": 128,
        "GROUP_SIZE_M": 8,
        "num_stages": 1,
        "num_warps": 8,
        "ms": 0.1604410707950592,
        "min_ms": 0.1604410707950592,
        "max_ms": 0.1604410707950592,
        "compile_time": 1.1489005088806152
    },
    {
        "BLOCK_SIZE_M": 256,
        "BLOCK_SIZE_N": 128,
        "BLOCK_SIZE_K": 32,
        "GROUP_SIZE_M": 8,
        "num_stages": 3,
        "num_warps": 16,
        "ms": 0.16046205163002014,
        "min_ms": 0.16046205163002014,
        "max_ms": 0.16046205163002014,
        "compile_time": 1.1826415061950684
    },
    {
        "BLOCK_SIZE_M": 128,
        "BLOCK_SIZE_N": 32,
        "BLOCK_SIZE_K": 64,
        "GROUP_SIZE_M": 8,
        "num_stages": 6,
        "num_warps": 8,
        "ms": 0.16049304604530334,
        "min_ms": 0.16049304604530334,
        "max_ms": 0.16049304604530334,
        "compile_time": 1.1251866817474365
    },
    {
        "BLOCK_SIZE_M": 64,
        "BLOCK_SIZE_N": 32,
        "BLOCK_SIZE_K": 64,
        "GROUP_SIZE_M": 8,
        "num_stages": 4,
        "num_warps": 4,
        "ms": 0.16054970026016235,
        "min_ms": 0.16054970026016235,
        "max_ms": 0.16054970026016235,
        "compile_time": 1.097736120223999
    },
    {
        "BLOCK_SIZE_M": 256,
        "BLOCK_SIZE_N": 128,
        "BLOCK_SIZE_K": 64,
        "GROUP_SIZE_M": 8,
        "num_stages": 4,
        "num_warps": 16,
        "ms": 0.16062043607234955,
        "min_ms": 0.16062043607234955,
        "max_ms": 0.16062043607234955,
        "compile_time": 1.1418228149414062
    },
    {
        "BLOCK_SIZE_M": 256,
        "BLOCK_SIZE_N": 128,
        "BLOCK_SIZE_K": 32,
        "GROUP_SIZE_M": 8,
        "num_stages": 5,
        "num_warps": 16,
        "ms": 0.1606416404247284,
        "min_ms": 0.1606416404247284,
        "max_ms": 0.1606416404247284,
        "compile_time": 1.1396770477294922
    },
    {
        "BLOCK_SIZE_M": 64,
        "BLOCK_SIZE_N": 32,
        "BLOCK_SIZE_K": 32,
        "GROUP_SIZE_M": 8,
        "num_stages": 4,
        "num_warps": 2,
        "ms": 0.16066838800907135,
        "min_ms": 0.16066838800907135,
        "max_ms": 0.16066838800907135,
        "compile_time": 1.095454454421997
    },
    {
        "BLOCK_SIZE_M": 32,
        "BLOCK_SIZE_N": 256,
        "BLOCK_SIZE_K": 64,
        "GROUP_SIZE_M": 8,
        "num_stages": 2,
        "num_warps": 4,
        "ms": 0.16072703897953033,
        "min_ms": 0.16072703897953033,
        "max_ms": 0.16072703897953033,
        "compile_time": 1.0609004497528076
    },
    {
        "BLOCK_SIZE_M": 256,
        "BLOCK_SIZE_N": 64,
        "BLOCK_SIZE_K": 16,
        "GROUP_SIZE_M": 8,
        "num_stages": 3,
        "num_warps": 8,
        "ms": 0.16091303527355194,
        "min_ms": 0.16091303527355194,
        "max_ms": 0.16091303527355194,
        "compile_time": 1.1503586769104004
    },
    {
        "BLOCK_SIZE_M": 64,
        "BLOCK_SIZE_N": 64,
        "BLOCK_SIZE_K": 128,
        "GROUP_SIZE_M": 8,
        "num_stages": 3,
        "num_warps": 16,
        "ms": 0.16102366149425507,
        "min_ms": 0.16102366149425507,
        "max_ms": 0.16102366149425507,
        "compile_time": 1.0545427799224854
    },
    {
        "BLOCK_SIZE_M": 32,
        "BLOCK_SIZE_N": 512,
        "BLOCK_SIZE_K": 16,
        "GROUP_SIZE_M": 8,
        "num_stages": 4,
        "num_warps": 4,
        "ms": 0.16105589270591736,
        "min_ms": 0.16105589270591736,
        "max_ms": 0.16105589270591736,
        "compile_time": 2.115699291229248
    },
    {
        "BLOCK_SIZE_M": 256,
        "BLOCK_SIZE_N": 128,
        "BLOCK_SIZE_K": 32,
        "GROUP_SIZE_M": 8,
        "num_stages": 6,
        "num_warps": 16,
        "ms": 0.16113562881946564,
        "min_ms": 0.16113562881946564,
        "max_ms": 0.16113562881946564,
        "compile_time": 1.150735855102539
    },
    {
        "BLOCK_SIZE_M": 256,
        "BLOCK_SIZE_N": 128,
        "BLOCK_SIZE_K": 64,
        "GROUP_SIZE_M": 8,
        "num_stages": 3,
        "num_warps": 16,
        "ms": 0.16131691634655,
        "min_ms": 0.16131691634655,
        "max_ms": 0.16131691634655,
        "compile_time": 1.1545302867889404
    },
    {
        "BLOCK_SIZE_M": 32,
        "BLOCK_SIZE_N": 64,
        "BLOCK_SIZE_K": 32,
        "GROUP_SIZE_M": 8,
        "num_stages": 4,
        "num_warps": 4,
        "ms": 0.1613323837518692,
        "min_ms": 0.1613323837518692,
        "max_ms": 0.1613323837518692,
        "compile_time": 1.0792310237884521
    },
    {
        "BLOCK_SIZE_M": 64,
        "BLOCK_SIZE_N": 32,
        "BLOCK_SIZE_K": 32,
        "GROUP_SIZE_M": 8,
        "num_stages": 3,
        "num_warps": 2,
        "ms": 0.16138598322868347,
        "min_ms": 0.16138598322868347,
        "max_ms": 0.16138598322868347,
        "compile_time": 1.0982565879821777
    },
    {
        "BLOCK_SIZE_M": 32,
        "BLOCK_SIZE_N": 128,
        "BLOCK_SIZE_K": 64,
        "GROUP_SIZE_M": 8,
        "num_stages": 2,
        "num_warps": 8,
        "ms": 0.16138604283332825,
        "min_ms": 0.16138604283332825,
        "max_ms": 0.16138604283332825,
        "compile_time": 1.0568780899047852
    },
    {
        "BLOCK_SIZE_M": 128,
        "BLOCK_SIZE_N": 128,
        "BLOCK_SIZE_K": 64,
        "GROUP_SIZE_M": 8,
        "num_stages": 6,
        "num_warps": 32,
        "ms": 0.16148069500923157,
        "min_ms": 0.16148069500923157,
        "max_ms": 0.16148069500923157,
        "compile_time": 1.1446537971496582
    },
    {
        "BLOCK_SIZE_M": 32,
        "BLOCK_SIZE_N": 64,
        "BLOCK_SIZE_K": 32,
        "GROUP_SIZE_M": 8,
        "num_stages": 5,
        "num_warps": 4,
        "ms": 0.1616126000881195,
        "min_ms": 0.1616126000881195,
        "max_ms": 0.1616126000881195,
        "compile_time": 1.0675227642059326
    },
    {
        "BLOCK_SIZE_M": 64,
        "BLOCK_SIZE_N": 32,
        "BLOCK_SIZE_K": 32,
        "GROUP_SIZE_M": 8,
        "num_stages": 6,
        "num_warps": 2,
        "ms": 0.16163194179534912,
        "min_ms": 0.16163194179534912,
        "max_ms": 0.16163194179534912,
        "compile_time": 1.088759422302246
    },
    {
        "BLOCK_SIZE_M": 64,
        "BLOCK_SIZE_N": 32,
        "BLOCK_SIZE_K": 64,
        "GROUP_SIZE_M": 8,
        "num_stages": 3,
        "num_warps": 4,
        "ms": 0.1618926078081131,
        "min_ms": 0.1618926078081131,
        "max_ms": 0.1618926078081131,
        "compile_time": 1.0970280170440674
    },
    {
        "BLOCK_SIZE_M": 32,
        "BLOCK_SIZE_N": 256,
        "BLOCK_SIZE_K": 64,
        "GROUP_SIZE_M": 8,
        "num_stages": 2,
        "num_warps": 8,
        "ms": 0.1619017869234085,
        "min_ms": 0.1619017869234085,
        "max_ms": 0.1619017869234085,
        "compile_time": 1.0345542430877686
    },
    {
        "BLOCK_SIZE_M": 32,
        "BLOCK_SIZE_N": 128,
        "BLOCK_SIZE_K": 128,
        "GROUP_SIZE_M": 8,
        "num_stages": 2,
        "num_warps": 4,
        "ms": 0.1619480550289154,
        "min_ms": 0.1619480550289154,
        "max_ms": 0.1619480550289154,
        "compile_time": 1.055807113647461
    },
    {
        "BLOCK_SIZE_M": 32,
        "BLOCK_SIZE_N": 128,
        "BLOCK_SIZE_K": 128,
        "GROUP_SIZE_M": 8,
        "num_stages": 4,
        "num_warps": 8,
        "ms": 0.16195279359817505,
        "min_ms": 0.16195279359817505,
        "max_ms": 0.16195279359817505,
        "compile_time": 1.0598130226135254
    },
    {
        "BLOCK_SIZE_M": 32,
        "BLOCK_SIZE_N": 128,
        "BLOCK_SIZE_K": 128,
        "GROUP_SIZE_M": 8,
        "num_stages": 5,
        "num_warps": 8,
        "ms": 0.16206777095794678,
        "min_ms": 0.16206777095794678,
        "max_ms": 0.16206777095794678,
        "compile_time": 1.0625584125518799
    },
    {
        "BLOCK_SIZE_M": 256,
        "BLOCK_SIZE_N": 64,
        "BLOCK_SIZE_K": 128,
        "GROUP_SIZE_M": 8,
        "num_stages": 3,
        "num_warps": 32,
        "ms": 0.16208791732788086,
        "min_ms": 0.16208791732788086,
        "max_ms": 0.16208791732788086,
        "compile_time": 1.1524531841278076
    },
    {
        "BLOCK_SIZE_M": 32,
        "BLOCK_SIZE_N": 128,
        "BLOCK_SIZE_K": 128,
        "GROUP_SIZE_M": 8,
        "num_stages": 3,
        "num_warps": 2,
        "ms": 0.1621280461549759,
        "min_ms": 0.1621280461549759,
        "max_ms": 0.1621280461549759,
        "compile_time": 1.038316249847412
    },
    {
        "BLOCK_SIZE_M": 32,
        "BLOCK_SIZE_N": 64,
        "BLOCK_SIZE_K": 32,
        "GROUP_SIZE_M": 8,
        "num_stages": 7,
        "num_warps": 2,
        "ms": 0.1621728539466858,
        "min_ms": 0.1621728539466858,
        "max_ms": 0.1621728539466858,
        "compile_time": 1.0623137950897217
    },
    {
        "BLOCK_SIZE_M": 64,
        "BLOCK_SIZE_N": 32,
        "BLOCK_SIZE_K": 32,
        "GROUP_SIZE_M": 8,
        "num_stages": 5,
        "num_warps": 2,
        "ms": 0.16217580437660217,
        "min_ms": 0.16217580437660217,
        "max_ms": 0.16217580437660217,
        "compile_time": 1.089566707611084
    },
    {
        "BLOCK_SIZE_M": 32,
        "BLOCK_SIZE_N": 64,
        "BLOCK_SIZE_K": 32,
        "GROUP_SIZE_M": 8,
        "num_stages": 8,
        "num_warps": 2,
        "ms": 0.16224312782287598,
        "min_ms": 0.16224312782287598,
        "max_ms": 0.16224312782287598,
        "compile_time": 1.0647351741790771
    },
    {
        "BLOCK_SIZE_M": 256,
        "BLOCK_SIZE_N": 128,
        "BLOCK_SIZE_K": 32,
        "GROUP_SIZE_M": 8,
        "num_stages": 7,
        "num_warps": 16,
        "ms": 0.1622546762228012,
        "min_ms": 0.1622546762228012,
        "max_ms": 0.1622546762228012,
        "compile_time": 1.9824573993682861
    },
    {
        "BLOCK_SIZE_M": 64,
        "BLOCK_SIZE_N": 256,
        "BLOCK_SIZE_K": 64,
        "GROUP_SIZE_M": 8,
        "num_stages": 2,
        "num_warps": 16,
        "ms": 0.16227972507476807,
        "min_ms": 0.16227972507476807,
        "max_ms": 0.16227972507476807,
        "compile_time": 1.0986251831054688
    },
    {
        "BLOCK_SIZE_M": 32,
        "BLOCK_SIZE_N": 512,
        "BLOCK_SIZE_K": 16,
        "GROUP_SIZE_M": 8,
        "num_stages": 7,
        "num_warps": 8,
        "ms": 0.1623302698135376,
        "min_ms": 0.1623302698135376,
        "max_ms": 0.1623302698135376,
        "compile_time": 1.0590038299560547
    },
    {
        "BLOCK_SIZE_M": 32,
        "BLOCK_SIZE_N": 128,
        "BLOCK_SIZE_K": 128,
        "GROUP_SIZE_M": 8,
        "num_stages": 2,
        "num_warps": 8,
        "ms": 0.1623660922050476,
        "min_ms": 0.1623660922050476,
        "max_ms": 0.1623660922050476,
        "compile_time": 1.0589470863342285
    },
    {
        "BLOCK_SIZE_M": 32,
        "BLOCK_SIZE_N": 64,
        "BLOCK_SIZE_K": 32,
        "GROUP_SIZE_M": 8,
        "num_stages": 6,
        "num_warps": 4,
        "ms": 0.16237124800682068,
        "min_ms": 0.16237124800682068,
        "max_ms": 0.16237124800682068,
        "compile_time": 1.0665836334228516
    },
    {
        "BLOCK_SIZE_M": 32,
        "BLOCK_SIZE_N": 64,
        "BLOCK_SIZE_K": 64,
        "GROUP_SIZE_M": 8,
        "num_stages": 4,
        "num_warps": 4,
        "ms": 0.16238930821418762,
        "min_ms": 0.16238930821418762,
        "max_ms": 0.16238930821418762,
        "compile_time": 1.0509426593780518
    },
    {
        "BLOCK_SIZE_M": 128,
        "BLOCK_SIZE_N": 32,
        "BLOCK_SIZE_K": 128,
        "GROUP_SIZE_M": 8,
        "num_stages": 4,
        "num_warps": 8,
        "ms": 0.16254016757011414,
        "min_ms": 0.16254016757011414,
        "max_ms": 0.16254016757011414,
        "compile_time": 1.113342046737671
    },
    {
        "BLOCK_SIZE_M": 128,
        "BLOCK_SIZE_N": 32,
        "BLOCK_SIZE_K": 128,
        "GROUP_SIZE_M": 8,
        "num_stages": 2,
        "num_warps": 2,
        "ms": 0.16254210472106934,
        "min_ms": 0.16254210472106934,
        "max_ms": 0.16254210472106934,
        "compile_time": 1.1178994178771973
    },
    {
        "BLOCK_SIZE_M": 32,
        "BLOCK_SIZE_N": 512,
        "BLOCK_SIZE_K": 16,
        "GROUP_SIZE_M": 8,
        "num_stages": 6,
        "num_warps": 8,
        "ms": 0.16264858841896057,
        "min_ms": 0.16264858841896057,
        "max_ms": 0.16264858841896057,
        "compile_time": 1.6911404132843018
    },
    {
        "BLOCK_SIZE_M": 32,
        "BLOCK_SIZE_N": 128,
        "BLOCK_SIZE_K": 64,
        "GROUP_SIZE_M": 8,
        "num_stages": 8,
        "num_warps": 8,
        "ms": 0.16265232861042023,
        "min_ms": 0.16265232861042023,
        "max_ms": 0.16265232861042023,
        "compile_time": 1.0500750541687012
    },
    {
        "BLOCK_SIZE_M": 128,
        "BLOCK_SIZE_N": 32,
        "BLOCK_SIZE_K": 64,
        "GROUP_SIZE_M": 8,
        "num_stages": 7,
        "num_warps": 8,
        "ms": 0.16288767755031586,
        "min_ms": 0.16288767755031586,
        "max_ms": 0.16288767755031586,
        "compile_time": 1.123702049255371
    },
    {
        "BLOCK_SIZE_M": 128,
        "BLOCK_SIZE_N": 32,
        "BLOCK_SIZE_K": 128,
        "GROUP_SIZE_M": 8,
        "num_stages": 2,
        "num_warps": 8,
        "ms": 0.1628902107477188,
        "min_ms": 0.1628902107477188,
        "max_ms": 0.1628902107477188,
        "compile_time": 1.1318233013153076
    },
    {
        "BLOCK_SIZE_M": 64,
        "BLOCK_SIZE_N": 32,
        "BLOCK_SIZE_K": 32,
        "GROUP_SIZE_M": 8,
        "num_stages": 3,
        "num_warps": 4,
        "ms": 0.16295871138572693,
        "min_ms": 0.16295871138572693,
        "max_ms": 0.16295871138572693,
        "compile_time": 1.1064071655273438
    },
    {
        "BLOCK_SIZE_M": 128,
        "BLOCK_SIZE_N": 64,
        "BLOCK_SIZE_K": 64,
        "GROUP_SIZE_M": 8,
        "num_stages": 1,
        "num_warps": 8,
        "ms": 0.16302810609340668,
        "min_ms": 0.16302810609340668,
        "max_ms": 0.16302810609340668,
        "compile_time": 1.0918126106262207
    },
    {
        "BLOCK_SIZE_M": 128,
        "BLOCK_SIZE_N": 64,
        "BLOCK_SIZE_K": 32,
        "GROUP_SIZE_M": 8,
        "num_stages": 1,
        "num_warps": 2,
        "ms": 0.1630287766456604,
        "min_ms": 0.1630287766456604,
        "max_ms": 0.1630287766456604,
        "compile_time": 1.0698282718658447
    },
    {
        "BLOCK_SIZE_M": 32,
        "BLOCK_SIZE_N": 128,
        "BLOCK_SIZE_K": 128,
        "GROUP_SIZE_M": 8,
        "num_stages": 2,
        "num_warps": 2,
        "ms": 0.1631031334400177,
        "min_ms": 0.1631031334400177,
        "max_ms": 0.1631031334400177,
        "compile_time": 1.0430405139923096
    },
    {
        "BLOCK_SIZE_M": 32,
        "BLOCK_SIZE_N": 64,
        "BLOCK_SIZE_K": 32,
        "GROUP_SIZE_M": 8,
        "num_stages": 3,
        "num_warps": 4,
        "ms": 0.16311302781105042,
        "min_ms": 0.16311302781105042,
        "max_ms": 0.16311302781105042,
        "compile_time": 1.0678315162658691
    },
    {
        "BLOCK_SIZE_M": 64,
        "BLOCK_SIZE_N": 32,
        "BLOCK_SIZE_K": 64,
        "GROUP_SIZE_M": 8,
        "num_stages": 5,
        "num_warps": 4,
        "ms": 0.16322335600852966,
        "min_ms": 0.16322335600852966,
        "max_ms": 0.16322335600852966,
        "compile_time": 1.021101474761963
    },
    {
        "BLOCK_SIZE_M": 64,
        "BLOCK_SIZE_N": 128,
        "BLOCK_SIZE_K": 64,
        "GROUP_SIZE_M": 8,
        "num_stages": 1,
        "num_warps": 8,
        "ms": 0.16325245797634125,
        "min_ms": 0.16325245797634125,
        "max_ms": 0.16325245797634125,
        "compile_time": 1.0796847343444824
    },
    {
        "BLOCK_SIZE_M": 32,
        "BLOCK_SIZE_N": 512,
        "BLOCK_SIZE_K": 16,
        "GROUP_SIZE_M": 8,
        "num_stages": 8,
        "num_warps": 8,
        "ms": 0.16325370967388153,
        "min_ms": 0.16325370967388153,
        "max_ms": 0.16325370967388153,
        "compile_time": 1.7470927238464355
    },
    {
        "BLOCK_SIZE_M": 64,
        "BLOCK_SIZE_N": 32,
        "BLOCK_SIZE_K": 64,
        "GROUP_SIZE_M": 8,
        "num_stages": 4,
        "num_warps": 2,
        "ms": 0.16325972974300385,
        "min_ms": 0.16325972974300385,
        "max_ms": 0.16325972974300385,
        "compile_time": 1.0812790393829346
    },
    {
        "BLOCK_SIZE_M": 32,
        "BLOCK_SIZE_N": 128,
        "BLOCK_SIZE_K": 256,
        "GROUP_SIZE_M": 8,
        "num_stages": 3,
        "num_warps": 4,
        "ms": 0.16351698338985443,
        "min_ms": 0.16351698338985443,
        "max_ms": 0.16351698338985443,
        "compile_time": 0.9183237552642822
    },
    {
        "BLOCK_SIZE_M": 32,
        "BLOCK_SIZE_N": 64,
        "BLOCK_SIZE_K": 32,
        "GROUP_SIZE_M": 8,
        "num_stages": 7,
        "num_warps": 4,
        "ms": 0.16355542838573456,
        "min_ms": 0.16355542838573456,
        "max_ms": 0.16355542838573456,
        "compile_time": 1.0783452987670898
    },
    {
        "BLOCK_SIZE_M": 64,
        "BLOCK_SIZE_N": 32,
        "BLOCK_SIZE_K": 64,
        "GROUP_SIZE_M": 8,
        "num_stages": 5,
        "num_warps": 2,
        "ms": 0.16362568736076355,
        "min_ms": 0.16362568736076355,
        "max_ms": 0.16362568736076355,
        "compile_time": 1.0768613815307617
    },
    {
        "BLOCK_SIZE_M": 128,
        "BLOCK_SIZE_N": 256,
        "BLOCK_SIZE_K": 64,
        "GROUP_SIZE_M": 8,
        "num_stages": 3,
        "num_warps": 16,
        "ms": 0.16365306079387665,
        "min_ms": 0.16365306079387665,
        "max_ms": 0.16365306079387665,
        "compile_time": 1.1425540447235107
    },
    {
        "BLOCK_SIZE_M": 256,
        "BLOCK_SIZE_N": 64,
        "BLOCK_SIZE_K": 64,
        "GROUP_SIZE_M": 8,
        "num_stages": 2,
        "num_warps": 16,
        "ms": 0.1636887788772583,
        "min_ms": 0.1636887788772583,
        "max_ms": 0.1636887788772583,
        "compile_time": 1.130192756652832
    },
    {
        "BLOCK_SIZE_M": 128,
        "BLOCK_SIZE_N": 128,
        "BLOCK_SIZE_K": 32,
        "GROUP_SIZE_M": 8,
        "num_stages": 2,
        "num_warps": 8,
        "ms": 0.1637495756149292,
        "min_ms": 0.1637495756149292,
        "max_ms": 0.1637495756149292,
        "compile_time": 1.079474687576294
    },
    {
        "BLOCK_SIZE_M": 128,
        "BLOCK_SIZE_N": 256,
        "BLOCK_SIZE_K": 64,
        "GROUP_SIZE_M": 8,
        "num_stages": 4,
        "num_warps": 16,
        "ms": 0.1638706475496292,
        "min_ms": 0.1638706475496292,
        "max_ms": 0.1638706475496292,
        "compile_time": 1.1329634189605713
    },
    {
        "BLOCK_SIZE_M": 64,
        "BLOCK_SIZE_N": 32,
        "BLOCK_SIZE_K": 32,
        "GROUP_SIZE_M": 8,
        "num_stages": 4,
        "num_warps": 4,
        "ms": 0.1639617532491684,
        "min_ms": 0.1639617532491684,
        "max_ms": 0.1639617532491684,
        "compile_time": 1.1072678565979004
    },
    {
        "BLOCK_SIZE_M": 32,
        "BLOCK_SIZE_N": 256,
        "BLOCK_SIZE_K": 16,
        "GROUP_SIZE_M": 8,
        "num_stages": 4,
        "num_warps": 4,
        "ms": 0.1639995574951172,
        "min_ms": 0.1639995574951172,
        "max_ms": 0.1639995574951172,
        "compile_time": 1.064563274383545
    },
    {
        "BLOCK_SIZE_M": 64,
        "BLOCK_SIZE_N": 128,
        "BLOCK_SIZE_K": 64,
        "GROUP_SIZE_M": 8,
        "num_stages": 1,
        "num_warps": 2,
        "ms": 0.16408690810203552,
        "min_ms": 0.16408690810203552,
        "max_ms": 0.16408690810203552,
        "compile_time": 1.0699660778045654
    },
    {
        "BLOCK_SIZE_M": 64,
        "BLOCK_SIZE_N": 32,
        "BLOCK_SIZE_K": 32,
        "GROUP_SIZE_M": 8,
        "num_stages": 5,
        "num_warps": 4,
        "ms": 0.16434741020202637,
        "min_ms": 0.16434741020202637,
        "max_ms": 0.16434741020202637,
        "compile_time": 1.1117055416107178
    },
    {
        "BLOCK_SIZE_M": 128,
        "BLOCK_SIZE_N": 32,
        "BLOCK_SIZE_K": 256,
        "GROUP_SIZE_M": 8,
        "num_stages": 3,
        "num_warps": 4,
        "ms": 0.1644209325313568,
        "min_ms": 0.1644209325313568,
        "max_ms": 0.1644209325313568,
        "compile_time": 1.0388405323028564
    },
    {
        "BLOCK_SIZE_M": 128,
        "BLOCK_SIZE_N": 32,
        "BLOCK_SIZE_K": 64,
        "GROUP_SIZE_M": 8,
        "num_stages": 8,
        "num_warps": 8,
        "ms": 0.16447101533412933,
        "min_ms": 0.16447101533412933,
        "max_ms": 0.16447101533412933,
        "compile_time": 1.1246378421783447
    },
    {
        "BLOCK_SIZE_M": 128,
        "BLOCK_SIZE_N": 256,
        "BLOCK_SIZE_K": 16,
        "GROUP_SIZE_M": 8,
        "num_stages": 5,
        "num_warps": 8,
        "ms": 0.16457809507846832,
        "min_ms": 0.16457809507846832,
        "max_ms": 0.16457809507846832,
        "compile_time": 1.1628360748291016
    },
    {
        "BLOCK_SIZE_M": 64,
        "BLOCK_SIZE_N": 128,
        "BLOCK_SIZE_K": 256,
        "GROUP_SIZE_M": 8,
        "num_stages": 2,
        "num_warps": 8,
        "ms": 0.16464641690254211,
        "min_ms": 0.16464641690254211,
        "max_ms": 0.16464641690254211,
        "compile_time": 1.080336570739746
    },
    {
        "BLOCK_SIZE_M": 128,
        "BLOCK_SIZE_N": 256,
        "BLOCK_SIZE_K": 16,
        "GROUP_SIZE_M": 8,
        "num_stages": 4,
        "num_warps": 8,
        "ms": 0.16469113528728485,
        "min_ms": 0.16469113528728485,
        "max_ms": 0.16469113528728485,
        "compile_time": 1.1560041904449463
    },
    {
        "BLOCK_SIZE_M": 128,
        "BLOCK_SIZE_N": 64,
        "BLOCK_SIZE_K": 256,
        "GROUP_SIZE_M": 8,
        "num_stages": 2,
        "num_warps": 8,
        "ms": 0.16474010050296783,
        "min_ms": 0.16474010050296783,
        "max_ms": 0.16474010050296783,
        "compile_time": 1.1109366416931152
    },
    {
        "BLOCK_SIZE_M": 64,
        "BLOCK_SIZE_N": 32,
        "BLOCK_SIZE_K": 32,
        "GROUP_SIZE_M": 8,
        "num_stages": 2,
        "num_warps": 2,
        "ms": 0.16485823690891266,
        "min_ms": 0.16485823690891266,
        "max_ms": 0.16485823690891266,
        "compile_time": 1.0876474380493164
    },
    {
        "BLOCK_SIZE_M": 64,
        "BLOCK_SIZE_N": 512,
        "BLOCK_SIZE_K": 32,
        "GROUP_SIZE_M": 8,
        "num_stages": 2,
        "num_warps": 8,
        "ms": 0.165055051445961,
        "min_ms": 0.165055051445961,
        "max_ms": 0.165055051445961,
        "compile_time": 2.1654622554779053
    },
    {
        "BLOCK_SIZE_M": 64,
        "BLOCK_SIZE_N": 256,
        "BLOCK_SIZE_K": 128,
        "GROUP_SIZE_M": 8,
        "num_stages": 1,
        "num_warps": 4,
        "ms": 0.165180504322052,
        "min_ms": 0.165180504322052,
        "max_ms": 0.165180504322052,
        "compile_time": 1.0601463317871094
    },
    {
        "BLOCK_SIZE_M": 128,
        "BLOCK_SIZE_N": 128,
        "BLOCK_SIZE_K": 64,
        "GROUP_SIZE_M": 8,
        "num_stages": 1,
        "num_warps": 16,
        "ms": 0.1652255654335022,
        "min_ms": 0.1652255654335022,
        "max_ms": 0.1652255654335022,
        "compile_time": 1.1163418292999268
    },
    {
        "BLOCK_SIZE_M": 32,
        "BLOCK_SIZE_N": 128,
        "BLOCK_SIZE_K": 32,
        "GROUP_SIZE_M": 8,
        "num_stages": 5,
        "num_warps": 8,
        "ms": 0.16529592871665955,
        "min_ms": 0.16529592871665955,
        "max_ms": 0.16529592871665955,
        "compile_time": 1.057591199874878
    },
    {
        "BLOCK_SIZE_M": 32,
        "BLOCK_SIZE_N": 64,
        "BLOCK_SIZE_K": 32,
        "GROUP_SIZE_M": 8,
        "num_stages": 8,
        "num_warps": 4,
        "ms": 0.1656586229801178,
        "min_ms": 0.1656586229801178,
        "max_ms": 0.1656586229801178,
        "compile_time": 1.0605170726776123
    },
    {
        "BLOCK_SIZE_M": 32,
        "BLOCK_SIZE_N": 128,
        "BLOCK_SIZE_K": 32,
        "GROUP_SIZE_M": 8,
        "num_stages": 3,
        "num_warps": 8,
        "ms": 0.16585490107536316,
        "min_ms": 0.16585490107536316,
        "max_ms": 0.16585490107536316,
        "compile_time": 1.0589420795440674
    },
    {
        "BLOCK_SIZE_M": 64,
        "BLOCK_SIZE_N": 32,
        "BLOCK_SIZE_K": 32,
        "GROUP_SIZE_M": 8,
        "num_stages": 6,
        "num_warps": 4,
        "ms": 0.16593940556049347,
        "min_ms": 0.16593940556049347,
        "max_ms": 0.16593940556049347,
        "compile_time": 1.095001220703125
    },
    {
        "BLOCK_SIZE_M": 32,
        "BLOCK_SIZE_N": 128,
        "BLOCK_SIZE_K": 32,
        "GROUP_SIZE_M": 8,
        "num_stages": 4,
        "num_warps": 8,
        "ms": 0.16595914959907532,
        "min_ms": 0.16595914959907532,
        "max_ms": 0.16595914959907532,
        "compile_time": 1.066084384918213
    },
    {
        "BLOCK_SIZE_M": 32,
        "BLOCK_SIZE_N": 256,
        "BLOCK_SIZE_K": 32,
        "GROUP_SIZE_M": 8,
        "num_stages": 2,
        "num_warps": 8,
        "ms": 0.1659838706254959,
        "min_ms": 0.1659838706254959,
        "max_ms": 0.1659838706254959,
        "compile_time": 1.053790807723999
    },
    {
        "BLOCK_SIZE_M": 64,
        "BLOCK_SIZE_N": 256,
        "BLOCK_SIZE_K": 128,
        "GROUP_SIZE_M": 8,
        "num_stages": 1,
        "num_warps": 16,
        "ms": 0.1660386621952057,
        "min_ms": 0.1660386621952057,
        "max_ms": 0.1660386621952057,
        "compile_time": 1.106947422027588
    },
    {
        "BLOCK_SIZE_M": 64,
        "BLOCK_SIZE_N": 32,
        "BLOCK_SIZE_K": 128,
        "GROUP_SIZE_M": 8,
        "num_stages": 3,
        "num_warps": 2,
        "ms": 0.16607913374900818,
        "min_ms": 0.16607913374900818,
        "max_ms": 0.16607913374900818,
        "compile_time": 1.0908994674682617
    },
    {
        "BLOCK_SIZE_M": 256,
        "BLOCK_SIZE_N": 32,
        "BLOCK_SIZE_K": 64,
        "GROUP_SIZE_M": 8,
        "num_stages": 2,
        "num_warps": 4,
        "ms": 0.16610287129878998,
        "min_ms": 0.16610287129878998,
        "max_ms": 0.16610287129878998,
        "compile_time": 1.1601758003234863
    },
    {
        "BLOCK_SIZE_M": 64,
        "BLOCK_SIZE_N": 64,
        "BLOCK_SIZE_K": 256,
        "GROUP_SIZE_M": 8,
        "num_stages": 1,
        "num_warps": 4,
        "ms": 0.16618093848228455,
        "min_ms": 0.16618093848228455,
        "max_ms": 0.16618093848228455,
        "compile_time": 1.0780766010284424
    },
    {
        "BLOCK_SIZE_M": 128,
        "BLOCK_SIZE_N": 32,
        "BLOCK_SIZE_K": 128,
        "GROUP_SIZE_M": 8,
        "num_stages": 5,
        "num_warps": 8,
        "ms": 0.1661910116672516,
        "min_ms": 0.1661910116672516,
        "max_ms": 0.1661910116672516,
        "compile_time": 1.1267657279968262
    },
    {
        "BLOCK_SIZE_M": 32,
        "BLOCK_SIZE_N": 256,
        "BLOCK_SIZE_K": 32,
        "GROUP_SIZE_M": 8,
        "num_stages": 3,
        "num_warps": 2,
        "ms": 0.16623780131340027,
        "min_ms": 0.16623780131340027,
        "max_ms": 0.16623780131340027,
        "compile_time": 1.051149606704712
    },
    {
        "BLOCK_SIZE_M": 128,
        "BLOCK_SIZE_N": 256,
        "BLOCK_SIZE_K": 16,
        "GROUP_SIZE_M": 8,
        "num_stages": 3,
        "num_warps": 8,
        "ms": 0.16639851033687592,
        "min_ms": 0.16639851033687592,
        "max_ms": 0.16639851033687592,
        "compile_time": 1.1328160762786865
    },
    {
        "BLOCK_SIZE_M": 64,
        "BLOCK_SIZE_N": 32,
        "BLOCK_SIZE_K": 64,
        "GROUP_SIZE_M": 8,
        "num_stages": 3,
        "num_warps": 2,
        "ms": 0.16651995480060577,
        "min_ms": 0.16651995480060577,
        "max_ms": 0.16651995480060577,
        "compile_time": 1.0928854942321777
    },
    {
        "BLOCK_SIZE_M": 64,
        "BLOCK_SIZE_N": 32,
        "BLOCK_SIZE_K": 128,
        "GROUP_SIZE_M": 8,
        "num_stages": 3,
        "num_warps": 4,
        "ms": 0.16659533977508545,
        "min_ms": 0.16659533977508545,
        "max_ms": 0.16659533977508545,
        "compile_time": 1.1073615550994873
    },
    {
        "BLOCK_SIZE_M": 64,
        "BLOCK_SIZE_N": 32,
        "BLOCK_SIZE_K": 32,
        "GROUP_SIZE_M": 8,
        "num_stages": 8,
        "num_warps": 2,
        "ms": 0.1666559875011444,
        "min_ms": 0.1666559875011444,
        "max_ms": 0.1666559875011444,
        "compile_time": 1.1017382144927979
    },
    {
        "BLOCK_SIZE_M": 32,
        "BLOCK_SIZE_N": 128,
        "BLOCK_SIZE_K": 32,
        "GROUP_SIZE_M": 8,
        "num_stages": 6,
        "num_warps": 8,
        "ms": 0.16669347882270813,
        "min_ms": 0.16669347882270813,
        "max_ms": 0.16669347882270813,
        "compile_time": 1.0603668689727783
    },
    {
        "BLOCK_SIZE_M": 32,
        "BLOCK_SIZE_N": 64,
        "BLOCK_SIZE_K": 64,
        "GROUP_SIZE_M": 8,
        "num_stages": 4,
        "num_warps": 2,
        "ms": 0.16672071814537048,
        "min_ms": 0.16672071814537048,
        "max_ms": 0.16672071814537048,
        "compile_time": 1.0466639995574951
    },
    {
        "BLOCK_SIZE_M": 32,
        "BLOCK_SIZE_N": 64,
        "BLOCK_SIZE_K": 16,
        "GROUP_SIZE_M": 8,
        "num_stages": 5,
        "num_warps": 2,
        "ms": 0.166744202375412,
        "min_ms": 0.166744202375412,
        "max_ms": 0.166744202375412,
        "compile_time": 1.5404722690582275
    },
    {
        "BLOCK_SIZE_M": 128,
        "BLOCK_SIZE_N": 32,
        "BLOCK_SIZE_K": 64,
        "GROUP_SIZE_M": 8,
        "num_stages": 6,
        "num_warps": 2,
        "ms": 0.16700397431850433,
        "min_ms": 0.16700397431850433,
        "max_ms": 0.16700397431850433,
        "compile_time": 1.1202609539031982
    },
    {
        "BLOCK_SIZE_M": 128,
        "BLOCK_SIZE_N": 64,
        "BLOCK_SIZE_K": 256,
        "GROUP_SIZE_M": 8,
        "num_stages": 1,
        "num_warps": 8,
        "ms": 0.16721412539482117,
        "min_ms": 0.16721412539482117,
        "max_ms": 0.16721412539482117,
        "compile_time": 1.1079702377319336
    },
    {
        "BLOCK_SIZE_M": 32,
        "BLOCK_SIZE_N": 64,
        "BLOCK_SIZE_K": 128,
        "GROUP_SIZE_M": 8,
        "num_stages": 3,
        "num_warps": 2,
        "ms": 0.1672854721546173,
        "min_ms": 0.1672854721546173,
        "max_ms": 0.1672854721546173,
        "compile_time": 1.063023328781128
    },
    {
        "BLOCK_SIZE_M": 32,
        "BLOCK_SIZE_N": 256,
        "BLOCK_SIZE_K": 16,
        "GROUP_SIZE_M": 8,
        "num_stages": 3,
        "num_warps": 2,
        "ms": 0.16734611988067627,
        "min_ms": 0.16734611988067627,
        "max_ms": 0.16734611988067627,
        "compile_time": 1.9874436855316162
    },
    {
        "BLOCK_SIZE_M": 64,
        "BLOCK_SIZE_N": 256,
        "BLOCK_SIZE_K": 32,
        "GROUP_SIZE_M": 8,
        "num_stages": 2,
        "num_warps": 8,
        "ms": 0.16735677421092987,
        "min_ms": 0.16735677421092987,
        "max_ms": 0.16735677421092987,
        "compile_time": 1.1005079746246338
    },
    {
        "BLOCK_SIZE_M": 64,
        "BLOCK_SIZE_N": 32,
        "BLOCK_SIZE_K": 32,
        "GROUP_SIZE_M": 8,
        "num_stages": 7,
        "num_warps": 2,
        "ms": 0.16765524446964264,
        "min_ms": 0.16765524446964264,
        "max_ms": 0.16765524446964264,
        "compile_time": 1.087538719177246
    },
    {
        "BLOCK_SIZE_M": 64,
        "BLOCK_SIZE_N": 128,
        "BLOCK_SIZE_K": 128,
        "GROUP_SIZE_M": 8,
        "num_stages": 3,
        "num_warps": 32,
        "ms": 0.16768351197242737,
        "min_ms": 0.16768351197242737,
        "max_ms": 0.16768351197242737,
        "compile_time": 1.0933825969696045
    },
    {
        "BLOCK_SIZE_M": 64,
        "BLOCK_SIZE_N": 32,
        "BLOCK_SIZE_K": 64,
        "GROUP_SIZE_M": 8,
        "num_stages": 6,
        "num_warps": 2,
        "ms": 0.16772539913654327,
        "min_ms": 0.16772539913654327,
        "max_ms": 0.16772539913654327,
        "compile_time": 1.095510721206665
    },
    {
        "BLOCK_SIZE_M": 128,
        "BLOCK_SIZE_N": 64,
        "BLOCK_SIZE_K": 64,
        "GROUP_SIZE_M": 8,
        "num_stages": 1,
        "num_warps": 16,
        "ms": 0.16796983778476715,
        "min_ms": 0.16796983778476715,
        "max_ms": 0.16796983778476715,
        "compile_time": 1.0886955261230469
    },
    {
        "BLOCK_SIZE_M": 64,
        "BLOCK_SIZE_N": 32,
        "BLOCK_SIZE_K": 32,
        "GROUP_SIZE_M": 8,
        "num_stages": 7,
        "num_warps": 4,
        "ms": 0.16798007488250732,
        "min_ms": 0.16798007488250732,
        "max_ms": 0.16798007488250732,
        "compile_time": 1.0722873210906982
    },
    {
        "BLOCK_SIZE_M": 128,
        "BLOCK_SIZE_N": 64,
        "BLOCK_SIZE_K": 32,
        "GROUP_SIZE_M": 8,
        "num_stages": 8,
        "num_warps": 16,
        "ms": 0.16818785667419434,
        "min_ms": 0.16818785667419434,
        "max_ms": 0.16818785667419434,
        "compile_time": 1.128523349761963
    },
    {
        "BLOCK_SIZE_M": 64,
        "BLOCK_SIZE_N": 32,
        "BLOCK_SIZE_K": 128,
        "GROUP_SIZE_M": 8,
        "num_stages": 2,
        "num_warps": 2,
        "ms": 0.16820712387561798,
        "min_ms": 0.16820712387561798,
        "max_ms": 0.16820712387561798,
        "compile_time": 1.0897071361541748
    },
    {
        "BLOCK_SIZE_M": 256,
        "BLOCK_SIZE_N": 128,
        "BLOCK_SIZE_K": 64,
        "GROUP_SIZE_M": 8,
        "num_stages": 1,
        "num_warps": 16,
        "ms": 0.16831664741039276,
        "min_ms": 0.16831664741039276,
        "max_ms": 0.16831664741039276,
        "compile_time": 1.15053391456604
    },
    {
        "BLOCK_SIZE_M": 128,
        "BLOCK_SIZE_N": 32,
        "BLOCK_SIZE_K": 64,
        "GROUP_SIZE_M": 8,
        "num_stages": 7,
        "num_warps": 2,
        "ms": 0.16835923492908478,
        "min_ms": 0.16835923492908478,
        "max_ms": 0.16835923492908478,
        "compile_time": 1.1216046810150146
    },
    {
        "BLOCK_SIZE_M": 512,
        "BLOCK_SIZE_N": 32,
        "BLOCK_SIZE_K": 32,
        "GROUP_SIZE_M": 8,
        "num_stages": 3,
        "num_warps": 4,
        "ms": 0.16852430999279022,
        "min_ms": 0.16852430999279022,
        "max_ms": 0.16852430999279022,
        "compile_time": 2.7742137908935547
    },
    {
        "BLOCK_SIZE_M": 32,
        "BLOCK_SIZE_N": 512,
        "BLOCK_SIZE_K": 32,
        "GROUP_SIZE_M": 8,
        "num_stages": 3,
        "num_warps": 4,
        "ms": 0.16878215968608856,
        "min_ms": 0.16878215968608856,
        "max_ms": 0.16878215968608856,
        "compile_time": 2.413814067840576
    },
    {
        "BLOCK_SIZE_M": 64,
        "BLOCK_SIZE_N": 64,
        "BLOCK_SIZE_K": 32,
        "GROUP_SIZE_M": 8,
        "num_stages": 2,
        "num_warps": 8,
        "ms": 0.16897284984588623,
        "min_ms": 0.16897284984588623,
        "max_ms": 0.16897284984588623,
        "compile_time": 1.0861496925354004
    },
    {
        "BLOCK_SIZE_M": 32,
        "BLOCK_SIZE_N": 64,
        "BLOCK_SIZE_K": 64,
        "GROUP_SIZE_M": 8,
        "num_stages": 5,
        "num_warps": 4,
        "ms": 0.1690022200345993,
        "min_ms": 0.1690022200345993,
        "max_ms": 0.1690022200345993,
        "compile_time": 1.0586488246917725
    },
    {
        "BLOCK_SIZE_M": 32,
        "BLOCK_SIZE_N": 64,
        "BLOCK_SIZE_K": 16,
        "GROUP_SIZE_M": 8,
        "num_stages": 4,
        "num_warps": 2,
        "ms": 0.16912300884723663,
        "min_ms": 0.16912300884723663,
        "max_ms": 0.16912300884723663,
        "compile_time": 1.5204880237579346
    },
    {
        "BLOCK_SIZE_M": 128,
        "BLOCK_SIZE_N": 64,
        "BLOCK_SIZE_K": 128,
        "GROUP_SIZE_M": 8,
        "num_stages": 3,
        "num_warps": 32,
        "ms": 0.16929343342781067,
        "min_ms": 0.16929343342781067,
        "max_ms": 0.16929343342781067,
        "compile_time": 1.126460075378418
    },
    {
        "BLOCK_SIZE_M": 32,
        "BLOCK_SIZE_N": 64,
        "BLOCK_SIZE_K": 64,
        "GROUP_SIZE_M": 8,
        "num_stages": 3,
        "num_warps": 4,
        "ms": 0.1693662703037262,
        "min_ms": 0.1693662703037262,
        "max_ms": 0.1693662703037262,
        "compile_time": 1.0688371658325195
    },
    {
        "BLOCK_SIZE_M": 256,
        "BLOCK_SIZE_N": 64,
        "BLOCK_SIZE_K": 128,
        "GROUP_SIZE_M": 8,
        "num_stages": 1,
        "num_warps": 16,
        "ms": 0.16942186653614044,
        "min_ms": 0.16942186653614044,
        "max_ms": 0.16942186653614044,
        "compile_time": 1.1663672924041748
    },
    {
        "BLOCK_SIZE_M": 128,
        "BLOCK_SIZE_N": 64,
        "BLOCK_SIZE_K": 16,
        "GROUP_SIZE_M": 8,
        "num_stages": 4,
        "num_warps": 4,
        "ms": 0.16950742900371552,
        "min_ms": 0.16950742900371552,
        "max_ms": 0.16950742900371552,
        "compile_time": 1.1341166496276855
    },
    {
        "BLOCK_SIZE_M": 32,
        "BLOCK_SIZE_N": 128,
        "BLOCK_SIZE_K": 64,
        "GROUP_SIZE_M": 8,
        "num_stages": 2,
        "num_warps": 2,
        "ms": 0.16958430409431458,
        "min_ms": 0.16958430409431458,
        "max_ms": 0.16958430409431458,
        "compile_time": 1.0504419803619385
    },
    {
        "BLOCK_SIZE_M": 128,
        "BLOCK_SIZE_N": 128,
        "BLOCK_SIZE_K": 32,
        "GROUP_SIZE_M": 8,
        "num_stages": 1,
        "num_warps": 4,
        "ms": 0.16979259252548218,
        "min_ms": 0.16979259252548218,
        "max_ms": 0.16979259252548218,
        "compile_time": 1.1276030540466309
    },
    {
        "BLOCK_SIZE_M": 64,
        "BLOCK_SIZE_N": 128,
        "BLOCK_SIZE_K": 128,
        "GROUP_SIZE_M": 8,
        "num_stages": 4,
        "num_warps": 32,
        "ms": 0.1697954684495926,
        "min_ms": 0.1697954684495926,
        "max_ms": 0.1697954684495926,
        "compile_time": 1.0972957611083984
    },
    {
        "BLOCK_SIZE_M": 128,
        "BLOCK_SIZE_N": 64,
        "BLOCK_SIZE_K": 16,
        "GROUP_SIZE_M": 8,
        "num_stages": 5,
        "num_warps": 4,
        "ms": 0.16980791091918945,
        "min_ms": 0.16980791091918945,
        "max_ms": 0.16980791091918945,
        "compile_time": 1.1347689628601074
    },
    {
        "BLOCK_SIZE_M": 128,
        "BLOCK_SIZE_N": 256,
        "BLOCK_SIZE_K": 128,
        "GROUP_SIZE_M": 8,
        "num_stages": 2,
        "num_warps": 8,
        "ms": 0.16984997689723969,
        "min_ms": 0.16984997689723969,
        "max_ms": 0.16984997689723969,
        "compile_time": 1.1155717372894287
    },
    {
        "BLOCK_SIZE_M": 32,
        "BLOCK_SIZE_N": 128,
        "BLOCK_SIZE_K": 32,
        "GROUP_SIZE_M": 8,
        "num_stages": 7,
        "num_warps": 8,
        "ms": 0.16990713775157928,
        "min_ms": 0.16990713775157928,
        "max_ms": 0.16990713775157928,
        "compile_time": 1.0654783248901367
    },
    {
        "BLOCK_SIZE_M": 128,
        "BLOCK_SIZE_N": 256,
        "BLOCK_SIZE_K": 128,
        "GROUP_SIZE_M": 8,
        "num_stages": 1,
        "num_warps": 16,
        "ms": 0.16993597149848938,
        "min_ms": 0.16993597149848938,
        "max_ms": 0.16993597149848938,
        "compile_time": 1.1329352855682373
    },
    {
        "BLOCK_SIZE_M": 32,
        "BLOCK_SIZE_N": 256,
        "BLOCK_SIZE_K": 32,
        "GROUP_SIZE_M": 8,
        "num_stages": 6,
        "num_warps": 16,
        "ms": 0.16997168958187103,
        "min_ms": 0.16997168958187103,
        "max_ms": 0.16997168958187103,
        "compile_time": 1.0666885375976562
    },
    {
        "BLOCK_SIZE_M": 128,
        "BLOCK_SIZE_N": 64,
        "BLOCK_SIZE_K": 16,
        "GROUP_SIZE_M": 8,
        "num_stages": 3,
        "num_warps": 4,
        "ms": 0.16997799277305603,
        "min_ms": 0.16997799277305603,
        "max_ms": 0.16997799277305603,
        "compile_time": 1.706552505493164
    },
    {
        "BLOCK_SIZE_M": 32,
        "BLOCK_SIZE_N": 64,
        "BLOCK_SIZE_K": 64,
        "GROUP_SIZE_M": 8,
        "num_stages": 5,
        "num_warps": 2,
        "ms": 0.17006370425224304,
        "min_ms": 0.17006370425224304,
        "max_ms": 0.17006370425224304,
        "compile_time": 1.0543031692504883
    },
    {
        "BLOCK_SIZE_M": 64,
        "BLOCK_SIZE_N": 32,
        "BLOCK_SIZE_K": 64,
        "GROUP_SIZE_M": 8,
        "num_stages": 7,
        "num_warps": 2,
        "ms": 0.17007263004779816,
        "min_ms": 0.17007263004779816,
        "max_ms": 0.17007263004779816,
        "compile_time": 1.0797216892242432
    },
    {
        "BLOCK_SIZE_M": 128,
        "BLOCK_SIZE_N": 256,
        "BLOCK_SIZE_K": 128,
        "GROUP_SIZE_M": 8,
        "num_stages": 1,
        "num_warps": 8,
        "ms": 0.17010323703289032,
        "min_ms": 0.17010323703289032,
        "max_ms": 0.17010323703289032,
        "compile_time": 1.1421504020690918
    },
    {
        "BLOCK_SIZE_M": 32,
        "BLOCK_SIZE_N": 128,
        "BLOCK_SIZE_K": 256,
        "GROUP_SIZE_M": 8,
        "num_stages": 3,
        "num_warps": 8,
        "ms": 0.17012052237987518,
        "min_ms": 0.17012052237987518,
        "max_ms": 0.17012052237987518,
        "compile_time": 1.0455694198608398
    },
    {
        "BLOCK_SIZE_M": 64,
        "BLOCK_SIZE_N": 256,
        "BLOCK_SIZE_K": 32,
        "GROUP_SIZE_M": 8,
        "num_stages": 1,
        "num_warps": 8,
        "ms": 0.17053158581256866,
        "min_ms": 0.17053158581256866,
        "max_ms": 0.17053158581256866,
        "compile_time": 1.0943546295166016
    },
    {
        "BLOCK_SIZE_M": 256,
        "BLOCK_SIZE_N": 128,
        "BLOCK_SIZE_K": 64,
        "GROUP_SIZE_M": 8,
        "num_stages": 2,
        "num_warps": 16,
        "ms": 0.1705503910779953,
        "min_ms": 0.1705503910779953,
        "max_ms": 0.1705503910779953,
        "compile_time": 1.1607191562652588
    },
    {
        "BLOCK_SIZE_M": 32,
        "BLOCK_SIZE_N": 64,
        "BLOCK_SIZE_K": 64,
        "GROUP_SIZE_M": 8,
        "num_stages": 7,
        "num_warps": 2,
        "ms": 0.17058983445167542,
        "min_ms": 0.17058983445167542,
        "max_ms": 0.17058983445167542,
        "compile_time": 1.0467631816864014
    },
    {
        "BLOCK_SIZE_M": 128,
        "BLOCK_SIZE_N": 32,
        "BLOCK_SIZE_K": 64,
        "GROUP_SIZE_M": 8,
        "num_stages": 1,
        "num_warps": 2,
        "ms": 0.17070366442203522,
        "min_ms": 0.17070366442203522,
        "max_ms": 0.17070366442203522,
        "compile_time": 1.106663703918457
    },
    {
        "BLOCK_SIZE_M": 32,
        "BLOCK_SIZE_N": 64,
        "BLOCK_SIZE_K": 16,
        "GROUP_SIZE_M": 8,
        "num_stages": 3,
        "num_warps": 2,
        "ms": 0.17079010605812073,
        "min_ms": 0.17079010605812073,
        "max_ms": 0.17079010605812073,
        "compile_time": 1.4988150596618652
    },
    {
        "BLOCK_SIZE_M": 32,
        "BLOCK_SIZE_N": 512,
        "BLOCK_SIZE_K": 16,
        "GROUP_SIZE_M": 8,
        "num_stages": 3,
        "num_warps": 4,
        "ms": 0.17082731425762177,
        "min_ms": 0.17082731425762177,
        "max_ms": 0.17082731425762177,
        "compile_time": 2.032350540161133
    },
    {
        "BLOCK_SIZE_M": 32,
        "BLOCK_SIZE_N": 128,
        "BLOCK_SIZE_K": 32,
        "GROUP_SIZE_M": 8,
        "num_stages": 8,
        "num_warps": 8,
        "ms": 0.17104534804821014,
        "min_ms": 0.17104534804821014,
        "max_ms": 0.17104534804821014,
        "compile_time": 1.0755040645599365
    },
    {
        "BLOCK_SIZE_M": 32,
        "BLOCK_SIZE_N": 64,
        "BLOCK_SIZE_K": 16,
        "GROUP_SIZE_M": 8,
        "num_stages": 6,
        "num_warps": 2,
        "ms": 0.17104831337928772,
        "min_ms": 0.17104831337928772,
        "max_ms": 0.17104831337928772,
        "compile_time": 1.4830992221832275
    },
    {
        "BLOCK_SIZE_M": 256,
        "BLOCK_SIZE_N": 64,
        "BLOCK_SIZE_K": 64,
        "GROUP_SIZE_M": 8,
        "num_stages": 3,
        "num_warps": 32,
        "ms": 0.1710566133260727,
        "min_ms": 0.1710566133260727,
        "max_ms": 0.1710566133260727,
        "compile_time": 1.1683173179626465
    },
    {
        "BLOCK_SIZE_M": 32,
        "BLOCK_SIZE_N": 256,
        "BLOCK_SIZE_K": 32,
        "GROUP_SIZE_M": 8,
        "num_stages": 7,
        "num_warps": 16,
        "ms": 0.17118367552757263,
        "min_ms": 0.17118367552757263,
        "max_ms": 0.17118367552757263,
        "compile_time": 1.0634703636169434
    },
    {
        "BLOCK_SIZE_M": 64,
        "BLOCK_SIZE_N": 256,
        "BLOCK_SIZE_K": 256,
        "GROUP_SIZE_M": 8,
        "num_stages": 2,
        "num_warps": 8,
        "ms": 0.17125630378723145,
        "min_ms": 0.17125630378723145,
        "max_ms": 0.17125630378723145,
        "compile_time": 1.0243701934814453
    },
    {
        "BLOCK_SIZE_M": 128,
        "BLOCK_SIZE_N": 64,
        "BLOCK_SIZE_K": 128,
        "GROUP_SIZE_M": 8,
        "num_stages": 4,
        "num_warps": 32,
        "ms": 0.1713329553604126,
        "min_ms": 0.1713329553604126,
        "max_ms": 0.1713329553604126,
        "compile_time": 1.1220111846923828
    },
    {
        "BLOCK_SIZE_M": 64,
        "BLOCK_SIZE_N": 256,
        "BLOCK_SIZE_K": 128,
        "GROUP_SIZE_M": 8,
        "num_stages": 3,
        "num_warps": 32,
        "ms": 0.1713700294494629,
        "min_ms": 0.1713700294494629,
        "max_ms": 0.1713700294494629,
        "compile_time": 1.1051251888275146
    },
    {
        "BLOCK_SIZE_M": 64,
        "BLOCK_SIZE_N": 32,
        "BLOCK_SIZE_K": 32,
        "GROUP_SIZE_M": 8,
        "num_stages": 8,
        "num_warps": 4,
        "ms": 0.17137816548347473,
        "min_ms": 0.17137816548347473,
        "max_ms": 0.17137816548347473,
        "compile_time": 1.0955641269683838
    },
    {
        "BLOCK_SIZE_M": 32,
        "BLOCK_SIZE_N": 64,
        "BLOCK_SIZE_K": 16,
        "GROUP_SIZE_M": 8,
        "num_stages": 7,
        "num_warps": 2,
        "ms": 0.1713823527097702,
        "min_ms": 0.1713823527097702,
        "max_ms": 0.1713823527097702,
        "compile_time": 1.5662055015563965
    },
    {
        "BLOCK_SIZE_M": 128,
        "BLOCK_SIZE_N": 32,
        "BLOCK_SIZE_K": 64,
        "GROUP_SIZE_M": 8,
        "num_stages": 8,
        "num_warps": 2,
        "ms": 0.17150411009788513,
        "min_ms": 0.17150411009788513,
        "max_ms": 0.17150411009788513,
        "compile_time": 1.1219308376312256
    },
    {
        "BLOCK_SIZE_M": 64,
        "BLOCK_SIZE_N": 32,
        "BLOCK_SIZE_K": 128,
        "GROUP_SIZE_M": 8,
        "num_stages": 2,
        "num_warps": 4,
        "ms": 0.1715082973241806,
        "min_ms": 0.1715082973241806,
        "max_ms": 0.1715082973241806,
        "compile_time": 1.106332540512085
    },
    {
        "BLOCK_SIZE_M": 128,
        "BLOCK_SIZE_N": 32,
        "BLOCK_SIZE_K": 256,
        "GROUP_SIZE_M": 8,
        "num_stages": 3,
        "num_warps": 8,
        "ms": 0.17162108421325684,
        "min_ms": 0.17162108421325684,
        "max_ms": 0.17162108421325684,
        "compile_time": 1.1289823055267334
    },
    {
        "BLOCK_SIZE_M": 64,
        "BLOCK_SIZE_N": 256,
        "BLOCK_SIZE_K": 64,
        "GROUP_SIZE_M": 8,
        "num_stages": 3,
        "num_warps": 32,
        "ms": 0.171662837266922,
        "min_ms": 0.171662837266922,
        "max_ms": 0.171662837266922,
        "compile_time": 1.0980701446533203
    },
    {
        "BLOCK_SIZE_M": 32,
        "BLOCK_SIZE_N": 128,
        "BLOCK_SIZE_K": 128,
        "GROUP_SIZE_M": 8,
        "num_stages": 3,
        "num_warps": 16,
        "ms": 0.17170201241970062,
        "min_ms": 0.17170201241970062,
        "max_ms": 0.17170201241970062,
        "compile_time": 1.0658149719238281
    },
    {
        "BLOCK_SIZE_M": 512,
        "BLOCK_SIZE_N": 64,
        "BLOCK_SIZE_K": 64,
        "GROUP_SIZE_M": 8,
        "num_stages": 2,
        "num_warps": 8,
        "ms": 0.17174752056598663,
        "min_ms": 0.17174752056598663,
        "max_ms": 0.17174752056598663,
        "compile_time": 2.7421865463256836
    },
    {
        "BLOCK_SIZE_M": 32,
        "BLOCK_SIZE_N": 64,
        "BLOCK_SIZE_K": 16,
        "GROUP_SIZE_M": 8,
        "num_stages": 8,
        "num_warps": 2,
        "ms": 0.171803280711174,
        "min_ms": 0.171803280711174,
        "max_ms": 0.171803280711174,
        "compile_time": 1.5692472457885742
    },
    {
        "BLOCK_SIZE_M": 32,
        "BLOCK_SIZE_N": 128,
        "BLOCK_SIZE_K": 16,
        "GROUP_SIZE_M": 8,
        "num_stages": 3,
        "num_warps": 2,
        "ms": 0.1718960553407669,
        "min_ms": 0.1718960553407669,
        "max_ms": 0.1718960553407669,
        "compile_time": 1.617018461227417
    },
    {
        "BLOCK_SIZE_M": 512,
        "BLOCK_SIZE_N": 32,
        "BLOCK_SIZE_K": 32,
        "GROUP_SIZE_M": 8,
        "num_stages": 4,
        "num_warps": 16,
        "ms": 0.17192021012306213,
        "min_ms": 0.17192021012306213,
        "max_ms": 0.17192021012306213,
        "compile_time": 1.9483165740966797
    },
    {
        "BLOCK_SIZE_M": 32,
        "BLOCK_SIZE_N": 64,
        "BLOCK_SIZE_K": 128,
        "GROUP_SIZE_M": 8,
        "num_stages": 4,
        "num_warps": 2,
        "ms": 0.17194166779518127,
        "min_ms": 0.17194166779518127,
        "max_ms": 0.17194166779518127,
        "compile_time": 1.0620269775390625
    },
    {
        "BLOCK_SIZE_M": 32,
        "BLOCK_SIZE_N": 64,
        "BLOCK_SIZE_K": 64,
        "GROUP_SIZE_M": 8,
        "num_stages": 6,
        "num_warps": 2,
        "ms": 0.17212149500846863,
        "min_ms": 0.17212149500846863,
        "max_ms": 0.17212149500846863,
        "compile_time": 1.0242841243743896
    },
    {
        "BLOCK_SIZE_M": 32,
        "BLOCK_SIZE_N": 256,
        "BLOCK_SIZE_K": 32,
        "GROUP_SIZE_M": 8,
        "num_stages": 8,
        "num_warps": 16,
        "ms": 0.17215539515018463,
        "min_ms": 0.17215539515018463,
        "max_ms": 0.17215539515018463,
        "compile_time": 1.066904067993164
    },
    {
        "BLOCK_SIZE_M": 64,
        "BLOCK_SIZE_N": 256,
        "BLOCK_SIZE_K": 64,
        "GROUP_SIZE_M": 8,
        "num_stages": 4,
        "num_warps": 32,
        "ms": 0.1721564531326294,
        "min_ms": 0.1721564531326294,
        "max_ms": 0.1721564531326294,
        "compile_time": 1.0971026420593262
    },
    {
        "BLOCK_SIZE_M": 256,
        "BLOCK_SIZE_N": 64,
        "BLOCK_SIZE_K": 64,
        "GROUP_SIZE_M": 8,
        "num_stages": 4,
        "num_warps": 32,
        "ms": 0.17218045890331268,
        "min_ms": 0.17218045890331268,
        "max_ms": 0.17218045890331268,
        "compile_time": 1.161879301071167
    },
    {
        "BLOCK_SIZE_M": 64,
        "BLOCK_SIZE_N": 32,
        "BLOCK_SIZE_K": 128,
        "GROUP_SIZE_M": 8,
        "num_stages": 4,
        "num_warps": 4,
        "ms": 0.17225950956344604,
        "min_ms": 0.17225950956344604,
        "max_ms": 0.17225950956344604,
        "compile_time": 1.0920021533966064
    },
    {
        "BLOCK_SIZE_M": 128,
        "BLOCK_SIZE_N": 32,
        "BLOCK_SIZE_K": 64,
        "GROUP_SIZE_M": 8,
        "num_stages": 1,
        "num_warps": 4,
        "ms": 0.17228606343269348,
        "min_ms": 0.17228606343269348,
        "max_ms": 0.17228606343269348,
        "compile_time": 1.1307501792907715
    },
    {
        "BLOCK_SIZE_M": 128,
        "BLOCK_SIZE_N": 32,
        "BLOCK_SIZE_K": 32,
        "GROUP_SIZE_M": 8,
        "num_stages": 3,
        "num_warps": 8,
        "ms": 0.1724170744419098,
        "min_ms": 0.1724170744419098,
        "max_ms": 0.1724170744419098,
        "compile_time": 1.131760597229004
    },
    {
        "BLOCK_SIZE_M": 64,
        "BLOCK_SIZE_N": 32,
        "BLOCK_SIZE_K": 32,
        "GROUP_SIZE_M": 8,
        "num_stages": 2,
        "num_warps": 4,
        "ms": 0.17258289456367493,
        "min_ms": 0.17258289456367493,
        "max_ms": 0.17258289456367493,
        "compile_time": 1.086975336074829
    },
    {
        "BLOCK_SIZE_M": 128,
        "BLOCK_SIZE_N": 64,
        "BLOCK_SIZE_K": 64,
        "GROUP_SIZE_M": 8,
        "num_stages": 1,
        "num_warps": 2,
        "ms": 0.17276166379451752,
        "min_ms": 0.17276166379451752,
        "max_ms": 0.17276166379451752,
        "compile_time": 1.1412553787231445
    },
    {
        "BLOCK_SIZE_M": 64,
        "BLOCK_SIZE_N": 256,
        "BLOCK_SIZE_K": 64,
        "GROUP_SIZE_M": 8,
        "num_stages": 5,
        "num_warps": 32,
        "ms": 0.17283061146736145,
        "min_ms": 0.17283061146736145,
        "max_ms": 0.17283061146736145,
        "compile_time": 1.0980253219604492
    },
    {
        "BLOCK_SIZE_M": 32,
        "BLOCK_SIZE_N": 256,
        "BLOCK_SIZE_K": 16,
        "GROUP_SIZE_M": 8,
        "num_stages": 3,
        "num_warps": 4,
        "ms": 0.1728462278842926,
        "min_ms": 0.1728462278842926,
        "max_ms": 0.1728462278842926,
        "compile_time": 1.1023228168487549
    },
    {
        "BLOCK_SIZE_M": 64,
        "BLOCK_SIZE_N": 64,
        "BLOCK_SIZE_K": 64,
        "GROUP_SIZE_M": 8,
        "num_stages": 3,
        "num_warps": 16,
        "ms": 0.17298513650894165,
        "min_ms": 0.17298513650894165,
        "max_ms": 0.17298513650894165,
        "compile_time": 1.0932250022888184
    },
    {
        "BLOCK_SIZE_M": 64,
        "BLOCK_SIZE_N": 128,
        "BLOCK_SIZE_K": 32,
        "GROUP_SIZE_M": 8,
        "num_stages": 1,
        "num_warps": 4,
        "ms": 0.17299748957157135,
        "min_ms": 0.17299748957157135,
        "max_ms": 0.17299748957157135,
        "compile_time": 1.081277847290039
    },
    {
        "BLOCK_SIZE_M": 64,
        "BLOCK_SIZE_N": 32,
        "BLOCK_SIZE_K": 128,
        "GROUP_SIZE_M": 8,
        "num_stages": 4,
        "num_warps": 2,
        "ms": 0.17308643460273743,
        "min_ms": 0.17308643460273743,
        "max_ms": 0.17308643460273743,
        "compile_time": 1.0811288356781006
    },
    {
        "BLOCK_SIZE_M": 256,
        "BLOCK_SIZE_N": 64,
        "BLOCK_SIZE_K": 16,
        "GROUP_SIZE_M": 8,
        "num_stages": 6,
        "num_warps": 4,
        "ms": 0.17320223152637482,
        "min_ms": 0.17320223152637482,
        "max_ms": 0.17320223152637482,
        "compile_time": 2.2339799404144287
    },
    {
        "BLOCK_SIZE_M": 32,
        "BLOCK_SIZE_N": 128,
        "BLOCK_SIZE_K": 64,
        "GROUP_SIZE_M": 8,
        "num_stages": 6,
        "num_warps": 2,
        "ms": 0.17321932315826416,
        "min_ms": 0.17321932315826416,
        "max_ms": 0.17321932315826416,
        "compile_time": 1.0573079586029053
    },
    {
        "BLOCK_SIZE_M": 256,
        "BLOCK_SIZE_N": 128,
        "BLOCK_SIZE_K": 16,
        "GROUP_SIZE_M": 8,
        "num_stages": 6,
        "num_warps": 8,
        "ms": 0.17323942482471466,
        "min_ms": 0.17323942482471466,
        "max_ms": 0.17323942482471466,
        "compile_time": 2.1974692344665527
    },
    {
        "BLOCK_SIZE_M": 128,
        "BLOCK_SIZE_N": 256,
        "BLOCK_SIZE_K": 64,
        "GROUP_SIZE_M": 8,
        "num_stages": 1,
        "num_warps": 16,
        "ms": 0.17360647022724152,
        "min_ms": 0.17360647022724152,
        "max_ms": 0.17360647022724152,
        "compile_time": 1.1527023315429688
    },
    {
        "BLOCK_SIZE_M": 256,
        "BLOCK_SIZE_N": 128,
        "BLOCK_SIZE_K": 16,
        "GROUP_SIZE_M": 8,
        "num_stages": 7,
        "num_warps": 8,
        "ms": 0.17361986637115479,
        "min_ms": 0.17361986637115479,
        "max_ms": 0.17361986637115479,
        "compile_time": 2.176841974258423
    },
    {
        "BLOCK_SIZE_M": 128,
        "BLOCK_SIZE_N": 32,
        "BLOCK_SIZE_K": 32,
        "GROUP_SIZE_M": 8,
        "num_stages": 5,
        "num_warps": 8,
        "ms": 0.17363885045051575,
        "min_ms": 0.17363885045051575,
        "max_ms": 0.17363885045051575,
        "compile_time": 1.1321742534637451
    },
    {
        "BLOCK_SIZE_M": 32,
        "BLOCK_SIZE_N": 64,
        "BLOCK_SIZE_K": 128,
        "GROUP_SIZE_M": 8,
        "num_stages": 3,
        "num_warps": 4,
        "ms": 0.17364144325256348,
        "min_ms": 0.17364144325256348,
        "max_ms": 0.17364144325256348,
        "compile_time": 1.0689101219177246
    },
    {
        "BLOCK_SIZE_M": 256,
        "BLOCK_SIZE_N": 64,
        "BLOCK_SIZE_K": 16,
        "GROUP_SIZE_M": 8,
        "num_stages": 7,
        "num_warps": 4,
        "ms": 0.1736450344324112,
        "min_ms": 0.1736450344324112,
        "max_ms": 0.1736450344324112,
        "compile_time": 2.232632875442505
    },
    {
        "BLOCK_SIZE_M": 256,
        "BLOCK_SIZE_N": 64,
        "BLOCK_SIZE_K": 64,
        "GROUP_SIZE_M": 8,
        "num_stages": 1,
        "num_warps": 16,
        "ms": 0.17373383045196533,
        "min_ms": 0.17373383045196533,
        "max_ms": 0.17373383045196533,
        "compile_time": 1.1615428924560547
    },
    {
        "BLOCK_SIZE_M": 128,
        "BLOCK_SIZE_N": 128,
        "BLOCK_SIZE_K": 64,
        "GROUP_SIZE_M": 8,
        "num_stages": 1,
        "num_warps": 4,
        "ms": 0.17394129931926727,
        "min_ms": 0.17394129931926727,
        "max_ms": 0.17394129931926727,
        "compile_time": 1.1443519592285156
    },
    {
        "BLOCK_SIZE_M": 256,
        "BLOCK_SIZE_N": 64,
        "BLOCK_SIZE_K": 256,
        "GROUP_SIZE_M": 8,
        "num_stages": 2,
        "num_warps": 8,
