simdata/FP16-R100/2560_fails.json
[
    {
        "BLOCK_SIZE_M": 16,
        "BLOCK_SIZE_N": 16,
        "BLOCK_SIZE_K": 512,
        "GROUP_SIZE_M": 8,
        "num_stages": 7,
        "num_warps": 2,
        "compile_time": 0.003954172134399414
    },
    {
        "BLOCK_SIZE_M": 16,
        "BLOCK_SIZE_N": 16,
        "BLOCK_SIZE_K": 512,
        "GROUP_SIZE_M": 8,
        "num_stages": 7,
        "num_warps": 4,
        "compile_time": 0.0028324127197265625
    },
    {
        "BLOCK_SIZE_M": 16,
        "BLOCK_SIZE_N": 16,
        "BLOCK_SIZE_K": 512,
        "GROUP_SIZE_M": 8,
        "num_stages": 7,
        "num_warps": 8,
        "compile_time": 0.0036253929138183594
    },
    {
        "BLOCK_SIZE_M": 16,
        "BLOCK_SIZE_N": 16,
        "BLOCK_SIZE_K": 512,
        "GROUP_SIZE_M": 8,
        "num_stages": 7,
        "num_warps": 16,
        "compile_time": 0.5175702571868896
    },
    {
        "BLOCK_SIZE_M": 16,
        "BLOCK_SIZE_N": 16,
        "BLOCK_SIZE_K": 512,
        "GROUP_SIZE_M": 8,
        "num_stages": 7,
        "num_warps": 32,
        "compile_time": 0.46344423294067383
    },
    {
        "BLOCK_SIZE_M": 16,
        "BLOCK_SIZE_N": 16,
        "BLOCK_SIZE_K": 512,
        "GROUP_SIZE_M": 8,
        "num_stages": 8,
        "num_warps": 2,
        "compile_time": 1.503931999206543
    },
    {
        "BLOCK_SIZE_M": 16,
        "BLOCK_SIZE_N": 16,
        "BLOCK_SIZE_K": 512,
        "GROUP_SIZE_M": 8,
        "num_stages": 8,
        "num_warps": 4,
        "compile_time": 0.9043838977813721
    },
    {
        "BLOCK_SIZE_M": 16,
        "BLOCK_SIZE_N": 16,
        "BLOCK_SIZE_K": 512,
        "GROUP_SIZE_M": 8,
        "num_stages": 8,
        "num_warps": 8,
        "compile_time": 0.613429069519043
    },
    {
        "BLOCK_SIZE_M": 16,
        "BLOCK_SIZE_N": 16,
        "BLOCK_SIZE_K": 512,
        "GROUP_SIZE_M": 8,
        "num_stages": 8,
        "num_warps": 16,
        "compile_time": 0.5307917594909668
    },
    {
        "BLOCK_SIZE_M": 16,
        "BLOCK_SIZE_N": 16,
        "BLOCK_SIZE_K": 512,
        "GROUP_SIZE_M": 8,
        "num_stages": 8,
        "num_warps": 32,
        "compile_time": 0.47869253158569336
    },
    {
        "BLOCK_SIZE_M": 16,
        "BLOCK_SIZE_N": 32,
        "BLOCK_SIZE_K": 256,
        "GROUP_SIZE_M": 8,
        "num_stages": 8,
        "num_warps": 2,
        "compile_time": 1.2005932331085205
    },
    {
        "BLOCK_SIZE_M": 16,
        "BLOCK_SIZE_N": 32,
        "BLOCK_SIZE_K": 256,
        "GROUP_SIZE_M": 8,
        "num_stages": 8,
        "num_warps": 4,
        "compile_time": 0.7254693508148193
    },
    {
        "BLOCK_SIZE_M": 16,
        "BLOCK_SIZE_N": 32,
        "BLOCK_SIZE_K": 256,
        "GROUP_SIZE_M": 8,
        "num_stages": 8,
        "num_warps": 8,
        "compile_time": 0.5237231254577637
    },
    {
        "BLOCK_SIZE_M": 16,
        "BLOCK_SIZE_N": 32,
        "BLOCK_SIZE_K": 256,
        "GROUP_SIZE_M": 8,
        "num_stages": 8,
        "num_warps": 16,
        "compile_time": 0.42233848571777344
    },
    {
        "BLOCK_SIZE_M": 16,
        "BLOCK_SIZE_N": 32,
        "BLOCK_SIZE_K": 256,
        "GROUP_SIZE_M": 8,
        "num_stages": 8,
        "num_warps": 32,
        "compile_time": 0.38512563705444336
    },
    {
        "BLOCK_SIZE_M": 16,
        "BLOCK_SIZE_N": 32,
        "BLOCK_SIZE_K": 512,
        "GROUP_SIZE_M": 8,
        "num_stages": 5,
        "num_warps": 2,
        "compile_time": 2.3821322917938232
    },
    {
        "BLOCK_SIZE_M": 16,
        "BLOCK_SIZE_N": 32,
        "BLOCK_SIZE_K": 512,
        "GROUP_SIZE_M": 8,
        "num_stages": 5,
        "num_warps": 4,
        "compile_time": 1.0580530166625977
    },
    {
        "BLOCK_SIZE_M": 16,
        "BLOCK_SIZE_N": 32,
        "BLOCK_SIZE_K": 512,
        "GROUP_SIZE_M": 8,
        "num_stages": 5,
        "num_warps": 8,
        "compile_time": 0.6987450122833252
    },
    {
        "BLOCK_SIZE_M": 16,
        "BLOCK_SIZE_N": 32,
        "BLOCK_SIZE_K": 512,
        "GROUP_SIZE_M": 8,
        "num_stages": 5,
        "num_warps": 16,
        "compile_time": 0.5596709251403809
    },
    {
        "BLOCK_SIZE_M": 16,
        "BLOCK_SIZE_N": 32,
        "BLOCK_SIZE_K": 512,
        "GROUP_SIZE_M": 8,
        "num_stages": 5,
        "num_warps": 32,
        "compile_time": 0.4941294193267822
    },
    {
        "BLOCK_SIZE_M": 16,
        "BLOCK_SIZE_N": 32,
        "BLOCK_SIZE_K": 512,
        "GROUP_SIZE_M": 8,
        "num_stages": 6,
        "num_warps": 2,
        "compile_time": 2.5177512168884277
    },
    {
        "BLOCK_SIZE_M": 16,
        "BLOCK_SIZE_N": 32,
        "BLOCK_SIZE_K": 512,
        "GROUP_SIZE_M": 8,
        "num_stages": 6,
        "num_warps": 4,
        "compile_time": 1.1329123973846436
    },
    {
        "BLOCK_SIZE_M": 16,
        "BLOCK_SIZE_N": 32,
        "BLOCK_SIZE_K": 512,
        "GROUP_SIZE_M": 8,
        "num_stages": 6,
        "num_warps": 8,
        "compile_time": 0.7399530410766602
    },
    {
        "BLOCK_SIZE_M": 16,
        "BLOCK_SIZE_N": 32,
        "BLOCK_SIZE_K": 512,
        "GROUP_SIZE_M": 8,
        "num_stages": 6,
        "num_warps": 16,
        "compile_time": 0.5912044048309326
    },
    {
        "BLOCK_SIZE_M": 16,
        "BLOCK_SIZE_N": 32,
        "BLOCK_SIZE_K": 512,
        "GROUP_SIZE_M": 8,
        "num_stages": 6,
        "num_warps": 32,
        "compile_time": 0.500312089920044
    },
    {
        "BLOCK_SIZE_M": 16,
        "BLOCK_SIZE_N": 32,
        "BLOCK_SIZE_K": 512,
        "GROUP_SIZE_M": 8,
        "num_stages": 7,
        "num_warps": 2,
        "compile_time": 2.7186222076416016
    },
    {
        "BLOCK_SIZE_M": 16,
        "BLOCK_SIZE_N": 32,
        "BLOCK_SIZE_K": 512,
        "GROUP_SIZE_M": 8,
        "num_stages": 7,
        "num_warps": 4,
        "compile_time": 1.2484266757965088
    },
    {
        "BLOCK_SIZE_M": 16,
        "BLOCK_SIZE_N": 32,
        "BLOCK_SIZE_K": 512,
        "GROUP_SIZE_M": 8,
        "num_stages": 7,
        "num_warps": 8,
        "compile_time": 0.7986507415771484
    },
    {
        "BLOCK_SIZE_M": 16,
        "BLOCK_SIZE_N": 32,
        "BLOCK_SIZE_K": 512,
        "GROUP_SIZE_M": 8,
        "num_stages": 7,
        "num_warps": 16,
        "compile_time": 0.6249895095825195
    },
    {
        "BLOCK_SIZE_M": 16,
        "BLOCK_SIZE_N": 32,
        "BLOCK_SIZE_K": 512,
        "GROUP_SIZE_M": 8,
        "num_stages": 7,
        "num_warps": 32,
        "compile_time": 0.5541424751281738
    },
    {
        "BLOCK_SIZE_M": 16,
        "BLOCK_SIZE_N": 32,
        "BLOCK_SIZE_K": 512,
        "GROUP_SIZE_M": 8,
        "num_stages": 8,
        "num_warps": 2,
        "compile_time": 2.875730037689209
    },
    {
        "BLOCK_SIZE_M": 16,
        "BLOCK_SIZE_N": 32,
        "BLOCK_SIZE_K": 512,
        "GROUP_SIZE_M": 8,
        "num_stages": 8,
        "num_warps": 4,
        "compile_time": 1.3460266590118408
    },
    {
        "BLOCK_SIZE_M": 16,
        "BLOCK_SIZE_N": 32,
        "BLOCK_SIZE_K": 512,
        "GROUP_SIZE_M": 8,
        "num_stages": 8,
        "num_warps": 8,
        "compile_time": 0.8323235511779785
    },
    {
        "BLOCK_SIZE_M": 16,
        "BLOCK_SIZE_N": 32,
        "BLOCK_SIZE_K": 512,
        "GROUP_SIZE_M": 8,
        "num_stages": 8,
        "num_warps": 16,
        "compile_time": 0.6267879009246826
    },
    {
        "BLOCK_SIZE_M": 16,
        "BLOCK_SIZE_N": 32,
        "BLOCK_SIZE_K": 512,
        "GROUP_SIZE_M": 8,
        "num_stages": 8,
        "num_warps": 32,
        "compile_time": 0.5538628101348877
    },
    {
        "BLOCK_SIZE_M": 16,
        "BLOCK_SIZE_N": 64,
        "BLOCK_SIZE_K": 256,
        "GROUP_SIZE_M": 8,
        "num_stages": 6,
        "num_warps": 2,
        "compile_time": 2.2370591163635254
    },
    {
        "BLOCK_SIZE_M": 16,
        "BLOCK_SIZE_N": 64,
        "BLOCK_SIZE_K": 256,
        "GROUP_SIZE_M": 8,
        "num_stages": 6,
        "num_warps": 4,
        "compile_time": 1.0129077434539795
    },
    {
        "BLOCK_SIZE_M": 16,
        "BLOCK_SIZE_N": 64,
        "BLOCK_SIZE_K": 256,
        "GROUP_SIZE_M": 8,
        "num_stages": 6,
        "num_warps": 8,
        "compile_time": 0.6328015327453613
    },
    {
        "BLOCK_SIZE_M": 16,
        "BLOCK_SIZE_N": 64,
        "BLOCK_SIZE_K": 256,
        "GROUP_SIZE_M": 8,
        "num_stages": 6,
        "num_warps": 16,
        "compile_time": 0.4971790313720703
    },
    {
        "BLOCK_SIZE_M": 16,
        "BLOCK_SIZE_N": 64,
        "BLOCK_SIZE_K": 256,
        "GROUP_SIZE_M": 8,
        "num_stages": 6,
        "num_warps": 32,
        "compile_time": 0.42382049560546875
    },
    {
        "BLOCK_SIZE_M": 16,
        "BLOCK_SIZE_N": 64,
        "BLOCK_SIZE_K": 256,
        "GROUP_SIZE_M": 8,
        "num_stages": 7,
        "num_warps": 2,
        "compile_time": 2.337625503540039
    },
    {
        "BLOCK_SIZE_M": 16,
        "BLOCK_SIZE_N": 64,
        "BLOCK_SIZE_K": 256,
        "GROUP_SIZE_M": 8,
        "num_stages": 7,
        "num_warps": 4,
        "compile_time": 1.057140827178955
    },
    {
        "BLOCK_SIZE_M": 16,
        "BLOCK_SIZE_N": 64,
        "BLOCK_SIZE_K": 256,
        "GROUP_SIZE_M": 8,
        "num_stages": 7,
        "num_warps": 8,
        "compile_time": 0.6590704917907715
    },
    {
        "BLOCK_SIZE_M": 16,
        "BLOCK_SIZE_N": 64,
        "BLOCK_SIZE_K": 256,
        "GROUP_SIZE_M": 8,
        "num_stages": 7,
        "num_warps": 16,
        "compile_time": 0.5058779716491699
    },
    {
        "BLOCK_SIZE_M": 16,
        "BLOCK_SIZE_N": 64,
        "BLOCK_SIZE_K": 256,
        "GROUP_SIZE_M": 8,
        "num_stages": 7,
        "num_warps": 32,
        "compile_time": 0.4349818229675293
    },
    {
        "BLOCK_SIZE_M": 16,
        "BLOCK_SIZE_N": 64,
        "BLOCK_SIZE_K": 256,
        "GROUP_SIZE_M": 8,
        "num_stages": 8,
        "num_warps": 2,
        "compile_time": 2.4601902961730957
    },
    {
        "BLOCK_SIZE_M": 16,
        "BLOCK_SIZE_N": 64,
        "BLOCK_SIZE_K": 256,
        "GROUP_SIZE_M": 8,
        "num_stages": 8,
        "num_warps": 4,
        "compile_time": 1.1555705070495605
    },
    {
        "BLOCK_SIZE_M": 16,
        "BLOCK_SIZE_N": 64,
        "BLOCK_SIZE_K": 256,
        "GROUP_SIZE_M": 8,
        "num_stages": 8,
        "num_warps": 8,
        "compile_time": 0.7073609828948975
    },
    {
        "BLOCK_SIZE_M": 16,
        "BLOCK_SIZE_N": 64,
        "BLOCK_SIZE_K": 256,
        "GROUP_SIZE_M": 8,
        "num_stages": 8,
        "num_warps": 16,
        "compile_time": 0.5451786518096924
    },
    {
        "BLOCK_SIZE_M": 16,
        "BLOCK_SIZE_N": 64,
        "BLOCK_SIZE_K": 256,
        "GROUP_SIZE_M": 8,
        "num_stages": 8,
        "num_warps": 32,
        "compile_time": 0.0041239261627197266
    },
    {
        "BLOCK_SIZE_M": 16,
        "BLOCK_SIZE_N": 64,
        "BLOCK_SIZE_K": 512,
        "GROUP_SIZE_M": 8,
        "num_stages": 3,
        "num_warps": 2,
        "compile_time": 10.783110857009888
    },
    {
        "BLOCK_SIZE_M": 16,
        "BLOCK_SIZE_N": 64,
        "BLOCK_SIZE_K": 512,
        "GROUP_SIZE_M": 8,
        "num_stages": 4,
        "num_warps": 2,
        "compile_time": 10.873734474182129
    },
    {
        "BLOCK_SIZE_M": 16,
        "BLOCK_SIZE_N": 64,
        "BLOCK_SIZE_K": 512,
        "GROUP_SIZE_M": 8,
        "num_stages": 4,
        "num_warps": 4,
        "compile_time": 2.01953387260437
    },
    {
        "BLOCK_SIZE_M": 16,
        "BLOCK_SIZE_N": 64,
        "BLOCK_SIZE_K": 512,
        "GROUP_SIZE_M": 8,
        "num_stages": 4,
        "num_warps": 8,
        "compile_time": 0.9492602348327637
    },
    {
        "BLOCK_SIZE_M": 16,
        "BLOCK_SIZE_N": 64,
        "BLOCK_SIZE_K": 512,
        "GROUP_SIZE_M": 8,
        "num_stages": 4,
        "num_warps": 16,
        "compile_time": 0.6673691272735596
    },
    {
        "BLOCK_SIZE_M": 16,
        "BLOCK_SIZE_N": 64,
        "BLOCK_SIZE_K": 512,
        "GROUP_SIZE_M": 8,
        "num_stages": 4,
        "num_warps": 32,
        "compile_time": 0.5622518062591553
    },
    {
        "BLOCK_SIZE_M": 16,
        "BLOCK_SIZE_N": 64,
        "BLOCK_SIZE_K": 512,
        "GROUP_SIZE_M": 8,
        "num_stages": 5,
        "num_warps": 2,
        "compile_time": 11.1179678440094
    },
    {
        "BLOCK_SIZE_M": 16,
        "BLOCK_SIZE_N": 64,
        "BLOCK_SIZE_K": 512,
        "GROUP_SIZE_M": 8,
        "num_stages": 5,
        "num_warps": 4,
        "compile_time": 2.1781535148620605
    },
    {
        "BLOCK_SIZE_M": 16,
        "BLOCK_SIZE_N": 64,
        "BLOCK_SIZE_K": 512,
        "GROUP_SIZE_M": 8,
        "num_stages": 5,
        "num_warps": 8,
        "compile_time": 1.0174641609191895
    },
    {
        "BLOCK_SIZE_M": 16,
        "BLOCK_SIZE_N": 64,
        "BLOCK_SIZE_K": 512,
        "GROUP_SIZE_M": 8,
        "num_stages": 5,
        "num_warps": 16,
        "compile_time": 0.7313225269317627
    },
    {
        "BLOCK_SIZE_M": 16,
        "BLOCK_SIZE_N": 64,
        "BLOCK_SIZE_K": 512,
        "GROUP_SIZE_M": 8,
        "num_stages": 5,
        "num_warps": 32,
        "compile_time": 0.6241421699523926
    },
    {
        "BLOCK_SIZE_M": 16,
        "BLOCK_SIZE_N": 64,
        "BLOCK_SIZE_K": 512,
        "GROUP_SIZE_M": 8,
        "num_stages": 6,
        "num_warps": 2,
        "compile_time": 11.51880168914795
    },
    {
        "BLOCK_SIZE_M": 16,
        "BLOCK_SIZE_N": 64,
        "BLOCK_SIZE_K": 512,
        "GROUP_SIZE_M": 8,
        "num_stages": 6,
        "num_warps": 4,
        "compile_time": 2.329294443130493
    },
    {
        "BLOCK_SIZE_M": 16,
        "BLOCK_SIZE_N": 64,
        "BLOCK_SIZE_K": 512,
        "GROUP_SIZE_M": 8,
        "num_stages": 6,
        "num_warps": 8,
        "compile_time": 1.0976002216339111
    },
    {
        "BLOCK_SIZE_M": 16,
        "BLOCK_SIZE_N": 64,
        "BLOCK_SIZE_K": 512,
        "GROUP_SIZE_M": 8,
        "num_stages": 6,
        "num_warps": 16,
        "compile_time": 0.005212068557739258
    },
    {
        "BLOCK_SIZE_M": 16,
        "BLOCK_SIZE_N": 64,
        "BLOCK_SIZE_K": 512,
        "GROUP_SIZE_M": 8,
        "num_stages": 6,
        "num_warps": 32,
        "compile_time": 0.6104919910430908
    },
    {
        "BLOCK_SIZE_M": 16,
        "BLOCK_SIZE_N": 64,
        "BLOCK_SIZE_K": 512,
        "GROUP_SIZE_M": 8,
        "num_stages": 7,
        "num_warps": 2,
        "compile_time": 11.494192361831665
    },
    {
        "BLOCK_SIZE_M": 16,
        "BLOCK_SIZE_N": 64,
        "BLOCK_SIZE_K": 512,
        "GROUP_SIZE_M": 8,
        "num_stages": 7,
        "num_warps": 4,
        "compile_time": 2.4617104530334473
    },
    {
        "BLOCK_SIZE_M": 16,
        "BLOCK_SIZE_N": 64,
        "BLOCK_SIZE_K": 512,
        "GROUP_SIZE_M": 8,
        "num_stages": 7,
        "num_warps": 8,
        "compile_time": 1.2070059776306152
    },
    {
        "BLOCK_SIZE_M": 16,
        "BLOCK_SIZE_N": 64,
        "BLOCK_SIZE_K": 512,
        "GROUP_SIZE_M": 8,
        "num_stages": 7,
        "num_warps": 16,
        "compile_time": 0.803908109664917
    },
    {
        "BLOCK_SIZE_M": 16,
        "BLOCK_SIZE_N": 64,
        "BLOCK_SIZE_K": 512,
        "GROUP_SIZE_M": 8,
        "num_stages": 7,
        "num_warps": 32,
        "compile_time": 0.6419119834899902
    },
    {
        "BLOCK_SIZE_M": 16,
        "BLOCK_SIZE_N": 64,
        "BLOCK_SIZE_K": 512,
        "GROUP_SIZE_M": 8,
        "num_stages": 8,
        "num_warps": 2,
        "compile_time": 11.734430074691772
    },
    {
        "BLOCK_SIZE_M": 16,
        "BLOCK_SIZE_N": 64,
        "BLOCK_SIZE_K": 512,
        "GROUP_SIZE_M": 8,
        "num_stages": 8,
        "num_warps": 4,
        "compile_time": 2.591783285140991
    },
    {
        "BLOCK_SIZE_M": 16,
        "BLOCK_SIZE_N": 64,
        "BLOCK_SIZE_K": 512,
        "GROUP_SIZE_M": 8,
        "num_stages": 8,
        "num_warps": 8,
        "compile_time": 1.2708702087402344
    },
    {
        "BLOCK_SIZE_M": 16,
        "BLOCK_SIZE_N": 64,
        "BLOCK_SIZE_K": 512,
        "GROUP_SIZE_M": 8,
        "num_stages": 8,
        "num_warps": 16,
        "compile_time": 0.8786571025848389
    },
    {
        "BLOCK_SIZE_M": 16,
        "BLOCK_SIZE_N": 64,
        "BLOCK_SIZE_K": 512,
        "GROUP_SIZE_M": 8,
        "num_stages": 8,
        "num_warps": 32,
        "compile_time": 0.005362987518310547
    },
    {
        "BLOCK_SIZE_M": 16,
        "BLOCK_SIZE_N": 128,
        "BLOCK_SIZE_K": 128,
        "GROUP_SIZE_M": 8,
        "num_stages": 6,
        "num_warps": 2,
        "compile_time": 2.13861346244812
    },
    {
        "BLOCK_SIZE_M": 16,
        "BLOCK_SIZE_N": 128,
        "BLOCK_SIZE_K": 128,
        "GROUP_SIZE_M": 8,
        "num_stages": 6,
        "num_warps": 4,
        "compile_time": 0.9880967140197754
    },
    {
        "BLOCK_SIZE_M": 16,
        "BLOCK_SIZE_N": 128,
        "BLOCK_SIZE_K": 128,
        "GROUP_SIZE_M": 8,
        "num_stages": 6,
        "num_warps": 8,
        "compile_time": 0.5900440216064453
    },
    {
        "BLOCK_SIZE_M": 16,
        "BLOCK_SIZE_N": 128,
        "BLOCK_SIZE_K": 128,
        "GROUP_SIZE_M": 8,
        "num_stages": 6,
        "num_warps": 16,
        "compile_time": 0.44354891777038574
    },
    {
        "BLOCK_SIZE_M": 16,
        "BLOCK_SIZE_N": 128,
        "BLOCK_SIZE_K": 128,
        "GROUP_SIZE_M": 8,
        "num_stages": 6,
        "num_warps": 32,
        "compile_time": 0.37711262702941895
    },
    {
        "BLOCK_SIZE_M": 16,
        "BLOCK_SIZE_N": 128,
        "BLOCK_SIZE_K": 128,
        "GROUP_SIZE_M": 8,
        "num_stages": 7,
        "num_warps": 2,
        "compile_time": 2.2414450645446777
    },
    {
        "BLOCK_SIZE_M": 16,
        "BLOCK_SIZE_N": 128,
        "BLOCK_SIZE_K": 128,
        "GROUP_SIZE_M": 8,
        "num_stages": 7,
        "num_warps": 4,
        "compile_time": 1.0661027431488037
    },
    {
        "BLOCK_SIZE_M": 16,
        "BLOCK_SIZE_N": 128,
        "BLOCK_SIZE_K": 128,
        "GROUP_SIZE_M": 8,
        "num_stages": 7,
        "num_warps": 8,
        "compile_time": 0.6257870197296143
    },
    {
        "BLOCK_SIZE_M": 16,
        "BLOCK_SIZE_N": 128,
        "BLOCK_SIZE_K": 128,
        "GROUP_SIZE_M": 8,
        "num_stages": 7,
        "num_warps": 16,
        "compile_time": 0.4600534439086914
    },
    {
        "BLOCK_SIZE_M": 16,
        "BLOCK_SIZE_N": 128,
        "BLOCK_SIZE_K": 128,
        "GROUP_SIZE_M": 8,
        "num_stages": 7,
        "num_warps": 32,
        "compile_time": 0.39673566818237305
    },
    {
        "BLOCK_SIZE_M": 16,
        "BLOCK_SIZE_N": 128,
        "BLOCK_SIZE_K": 128,
        "GROUP_SIZE_M": 8,
        "num_stages": 8,
        "num_warps": 2,
        "compile_time": 2.4111499786376953
    },
    {
        "BLOCK_SIZE_M": 16,
        "BLOCK_SIZE_N": 128,
        "BLOCK_SIZE_K": 128,
        "GROUP_SIZE_M": 8,
        "num_stages": 8,
        "num_warps": 4,
        "compile_time": 1.1006999015808105
    },
    {
        "BLOCK_SIZE_M": 16,
        "BLOCK_SIZE_N": 128,
        "BLOCK_SIZE_K": 128,
        "GROUP_SIZE_M": 8,
        "num_stages": 8,
        "num_warps": 8,
        "compile_time": 0.6503481864929199
    },
    {
        "BLOCK_SIZE_M": 16,
        "BLOCK_SIZE_N": 128,
        "BLOCK_SIZE_K": 128,
        "GROUP_SIZE_M": 8,
        "num_stages": 8,
        "num_warps": 16,
        "compile_time": 0.48290133476257324
    },
    {
        "BLOCK_SIZE_M": 16,
        "BLOCK_SIZE_N": 128,
        "BLOCK_SIZE_K": 128,
        "GROUP_SIZE_M": 8,
        "num_stages": 8,
        "num_warps": 32,
        "compile_time": 0.40364885330200195
    },
    {
        "BLOCK_SIZE_M": 16,
        "BLOCK_SIZE_N": 128,
        "BLOCK_SIZE_K": 256,
        "GROUP_SIZE_M": 8,
        "num_stages": 3,
        "num_warps": 2,
        "compile_time": 10.606103897094727
    },
    {
        "BLOCK_SIZE_M": 16,
        "BLOCK_SIZE_N": 128,
        "BLOCK_SIZE_K": 256,
        "GROUP_SIZE_M": 8,
        "num_stages": 4,
        "num_warps": 2,
        "compile_time": 10.83907437324524
    },
    {
        "BLOCK_SIZE_M": 16,
        "BLOCK_SIZE_N": 128,
        "BLOCK_SIZE_K": 256,
        "GROUP_SIZE_M": 8,
        "num_stages": 4,
        "num_warps": 4,
        "compile_time": 1.932584524154663
    },
    {
        "BLOCK_SIZE_M": 16,
        "BLOCK_SIZE_N": 128,
        "BLOCK_SIZE_K": 256,
        "GROUP_SIZE_M": 8,
        "num_stages": 4,
        "num_warps": 8,
        "compile_time": 0.8914637565612793
    },
    {
        "BLOCK_SIZE_M": 16,
        "BLOCK_SIZE_N": 128,
        "BLOCK_SIZE_K": 256,
        "GROUP_SIZE_M": 8,
        "num_stages": 4,
        "num_warps": 16,
        "compile_time": 0.57413649559021
    },
    {
        "BLOCK_SIZE_M": 16,
        "BLOCK_SIZE_N": 128,
        "BLOCK_SIZE_K": 256,
        "GROUP_SIZE_M": 8,
        "num_stages": 4,
        "num_warps": 32,
        "compile_time": 0.4762101173400879
    },
    {
        "BLOCK_SIZE_M": 16,
        "BLOCK_SIZE_N": 128,
        "BLOCK_SIZE_K": 256,
        "GROUP_SIZE_M": 8,
        "num_stages": 5,
        "num_warps": 2,
        "compile_time": 10.847477436065674
    },
    {
        "BLOCK_SIZE_M": 16,
        "BLOCK_SIZE_N": 128,
        "BLOCK_SIZE_K": 256,
        "GROUP_SIZE_M": 8,
        "num_stages": 5,
        "num_warps": 4,
        "compile_time": 2.059840440750122
    },
    {
        "BLOCK_SIZE_M": 16,
        "BLOCK_SIZE_N": 128,
        "BLOCK_SIZE_K": 256,
        "GROUP_SIZE_M": 8,
        "num_stages": 5,
        "num_warps": 8,
        "compile_time": 0.9772067070007324
    },
    {
        "BLOCK_SIZE_M": 16,
        "BLOCK_SIZE_N": 128,
        "BLOCK_SIZE_K": 256,
        "GROUP_SIZE_M": 8,
        "num_stages": 5,
        "num_warps": 16,
        "compile_time": 0.6149542331695557
    },
    {
        "BLOCK_SIZE_M": 16,
        "BLOCK_SIZE_N": 128,
        "BLOCK_SIZE_K": 256,
        "GROUP_SIZE_M": 8,
        "num_stages": 5,
        "num_warps": 32,
        "compile_time": 0.4886918067932129
    },
    {
        "BLOCK_SIZE_M": 16,
        "BLOCK_SIZE_N": 128,
        "BLOCK_SIZE_K": 256,
        "GROUP_SIZE_M": 8,
        "num_stages": 6,
        "num_warps": 2,
        "compile_time": 11.13783884048462
    },
    {
        "BLOCK_SIZE_M": 16,
        "BLOCK_SIZE_N": 128,
        "BLOCK_SIZE_K": 256,
        "GROUP_SIZE_M": 8,
        "num_stages": 6,
        "num_warps": 4,
        "compile_time": 2.220090627670288
    },
    {
        "BLOCK_SIZE_M": 16,
        "BLOCK_SIZE_N": 128,
        "BLOCK_SIZE_K": 256,
        "GROUP_SIZE_M": 8,
        "num_stages": 6,
        "num_warps": 8,
        "compile_time": 1.028304100036621
    },
    {
        "BLOCK_SIZE_M": 16,
        "BLOCK_SIZE_N": 128,
        "BLOCK_SIZE_K": 256,
        "GROUP_SIZE_M": 8,
        "num_stages": 6,
        "num_warps": 16,
        "compile_time": 0.6534485816955566
    },
    {
        "BLOCK_SIZE_M": 16,
        "BLOCK_SIZE_N": 128,
        "BLOCK_SIZE_K": 256,
        "GROUP_SIZE_M": 8,
        "num_stages": 6,
        "num_warps": 32,
        "compile_time": 0.005269527435302734
    },
    {
        "BLOCK_SIZE_M": 16,
        "BLOCK_SIZE_N": 128,
        "BLOCK_SIZE_K": 256,
        "GROUP_SIZE_M": 8,
        "num_stages": 7,
        "num_warps": 2,
        "compile_time": 11.190696716308594
    },
    {
        "BLOCK_SIZE_M": 16,
        "BLOCK_SIZE_N": 128,
        "BLOCK_SIZE_K": 256,
        "GROUP_SIZE_M": 8,
        "num_stages": 7,
        "num_warps": 4,
        "compile_time": 2.3302931785583496
    },
    {
        "BLOCK_SIZE_M": 16,
        "BLOCK_SIZE_N": 128,
        "BLOCK_SIZE_K": 256,
        "GROUP_SIZE_M": 8,
        "num_stages": 7,
        "num_warps": 8,
        "compile_time": 1.1206669807434082
    },
    {
        "BLOCK_SIZE_M": 16,
        "BLOCK_SIZE_N": 128,
        "BLOCK_SIZE_K": 256,
        "GROUP_SIZE_M": 8,
        "num_stages": 7,
        "num_warps": 16,
        "compile_time": 0.6979002952575684
    },
    {
        "BLOCK_SIZE_M": 16,
        "BLOCK_SIZE_N": 128,
        "BLOCK_SIZE_K": 256,
        "GROUP_SIZE_M": 8,
        "num_stages": 7,
        "num_warps": 32,
        "compile_time": 0.5463285446166992
    },
    {
        "BLOCK_SIZE_M": 16,
        "BLOCK_SIZE_N": 128,
        "BLOCK_SIZE_K": 256,
        "GROUP_SIZE_M": 8,
        "num_stages": 8,
        "num_warps": 2,
        "compile_time": 11.34478211402893
    },
    {
        "BLOCK_SIZE_M": 16,
        "BLOCK_SIZE_N": 128,
        "BLOCK_SIZE_K": 256,
        "GROUP_SIZE_M": 8,
        "num_stages": 8,
        "num_warps": 4,
        "compile_time": 2.5090999603271484
    },
    {
        "BLOCK_SIZE_M": 16,
        "BLOCK_SIZE_N": 128,
        "BLOCK_SIZE_K": 256,
        "GROUP_SIZE_M": 8,
        "num_stages": 8,
        "num_warps": 8,
        "compile_time": 1.20463228225708
    },
    {
        "BLOCK_SIZE_M": 16,
        "BLOCK_SIZE_N": 128,
        "BLOCK_SIZE_K": 256,
        "GROUP_SIZE_M": 8,
        "num_stages": 8,
        "num_warps": 16,
        "compile_time": 0.766577959060669
    },
    {
        "BLOCK_SIZE_M": 16,
        "BLOCK_SIZE_N": 128,
        "BLOCK_SIZE_K": 256,
        "GROUP_SIZE_M": 8,
        "num_stages": 8,
        "num_warps": 32,
        "compile_time": 0.5673666000366211
    },
    {
        "BLOCK_SIZE_M": 16,
        "BLOCK_SIZE_N": 128,
        "BLOCK_SIZE_K": 512,
        "GROUP_SIZE_M": 8,
        "num_stages": 1,
        "num_warps": 2,
        "compile_time": 7.787388563156128
    },
    {
        "BLOCK_SIZE_M": 16,
        "BLOCK_SIZE_N": 128,
        "BLOCK_SIZE_K": 512,
        "GROUP_SIZE_M": 8,
        "num_stages": 2,
        "num_warps": 2,
        "compile_time": 7.8978800773620605
    },
    {
        "BLOCK_SIZE_M": 16,
        "BLOCK_SIZE_N": 128,
        "BLOCK_SIZE_K": 512,
        "GROUP_SIZE_M": 8,
        "num_stages": 3,
        "num_warps": 2,
        "compile_time": 99.0490665435791
    },
    {
        "BLOCK_SIZE_M": 16,
        "BLOCK_SIZE_N": 128,
        "BLOCK_SIZE_K": 512,
        "GROUP_SIZE_M": 8,
        "num_stages": 3,
        "num_warps": 4,
        "compile_time": 10.623557090759277
    },
    {
        "BLOCK_SIZE_M": 16,
        "BLOCK_SIZE_N": 128,
        "BLOCK_SIZE_K": 512,
        "GROUP_SIZE_M": 8,
        "num_stages": 3,
        "num_warps": 8,
        "compile_time": 1.8873701095581055
    },
    {
        "BLOCK_SIZE_M": 16,
        "BLOCK_SIZE_N": 128,
        "BLOCK_SIZE_K": 512,
        "GROUP_SIZE_M": 8,
        "num_stages": 3,
        "num_warps": 16,
        "compile_time": 0.004718303680419922
    },
    {
        "BLOCK_SIZE_M": 16,
        "BLOCK_SIZE_N": 128,
        "BLOCK_SIZE_K": 512,
        "GROUP_SIZE_M": 8,
        "num_stages": 3,
        "num_warps": 32,
        "compile_time": 0.6487941741943359
    },
    {
        "BLOCK_SIZE_M": 16,
        "BLOCK_SIZE_N": 128,
        "BLOCK_SIZE_K": 512,
        "GROUP_SIZE_M": 8,
        "num_stages": 4,
        "num_warps": 2,
        "compile_time": 6.083524703979492
    },
    {
        "BLOCK_SIZE_M": 16,
        "BLOCK_SIZE_N": 128,
        "BLOCK_SIZE_K": 512,
        "GROUP_SIZE_M": 8,
        "num_stages": 4,
        "num_warps": 4,
        "compile_time": 10.982308864593506
    },
    {
        "BLOCK_SIZE_M": 16,
        "BLOCK_SIZE_N": 128,
        "BLOCK_SIZE_K": 512,
        "GROUP_SIZE_M": 8,
        "num_stages": 4,
        "num_warps": 8,
        "compile_time": 2.0625672340393066
    },
    {
        "BLOCK_SIZE_M": 16,
        "BLOCK_SIZE_N": 128,
        "BLOCK_SIZE_K": 512,
        "GROUP_SIZE_M": 8,
        "num_stages": 4,
        "num_warps": 16,
        "compile_time": 1.0072021484375
    },
    {
        "BLOCK_SIZE_M": 16,
        "BLOCK_SIZE_N": 128,
        "BLOCK_SIZE_K": 512,
        "GROUP_SIZE_M": 8,
        "num_stages": 4,
        "num_warps": 32,
        "compile_time": 0.7030816078186035
    },
    {
        "BLOCK_SIZE_M": 16,
        "BLOCK_SIZE_N": 128,
        "BLOCK_SIZE_K": 512,
        "GROUP_SIZE_M": 8,
        "num_stages": 5,
        "num_warps": 2,
        "compile_time": 6.609147787094116
    },
    {
        "BLOCK_SIZE_M": 16,
        "BLOCK_SIZE_N": 128,
        "BLOCK_SIZE_K": 512,
        "GROUP_SIZE_M": 8,
        "num_stages": 5,
        "num_warps": 4,
        "compile_time": 11.249637365341187
    },
    {
        "BLOCK_SIZE_M": 16,
        "BLOCK_SIZE_N": 128,
        "BLOCK_SIZE_K": 512,
        "GROUP_SIZE_M": 8,
        "num_stages": 5,
        "num_warps": 8,
        "compile_time": 2.204007387161255
    },
    {
        "BLOCK_SIZE_M": 16,
        "BLOCK_SIZE_N": 128,
        "BLOCK_SIZE_K": 512,
        "GROUP_SIZE_M": 8,
        "num_stages": 5,
        "num_warps": 16,
        "compile_time": 1.0738890171051025
    },
    {
        "BLOCK_SIZE_M": 16,
        "BLOCK_SIZE_N": 128,
        "BLOCK_SIZE_K": 512,
        "GROUP_SIZE_M": 8,
        "num_stages": 5,
        "num_warps": 32,
        "compile_time": 0.7261738777160645
    },
    {
        "BLOCK_SIZE_M": 16,
        "BLOCK_SIZE_N": 128,
        "BLOCK_SIZE_K": 512,
        "GROUP_SIZE_M": 8,
        "num_stages": 6,
        "num_warps": 2,
        "compile_time": 6.725786209106445
    },
    {
        "BLOCK_SIZE_M": 16,
        "BLOCK_SIZE_N": 128,
        "BLOCK_SIZE_K": 512,
        "GROUP_SIZE_M": 8,
        "num_stages": 6,
        "num_warps": 4,
        "compile_time": 11.303986549377441
    },
    {
        "BLOCK_SIZE_M": 16,
        "BLOCK_SIZE_N": 128,
        "BLOCK_SIZE_K": 512,
        "GROUP_SIZE_M": 8,
        "num_stages": 6,
        "num_warps": 8,
        "compile_time": 2.3095123767852783
    },
    {
        "BLOCK_SIZE_M": 16,
        "BLOCK_SIZE_N": 128,
        "BLOCK_SIZE_K": 512,
        "GROUP_SIZE_M": 8,
        "num_stages": 6,
        "num_warps": 16,
        "compile_time": 1.1478474140167236
    },
    {
        "BLOCK_SIZE_M": 16,
        "BLOCK_SIZE_N": 128,
        "BLOCK_SIZE_K": 512,
        "GROUP_SIZE_M": 8,
        "num_stages": 6,
        "num_warps": 32,
        "compile_time": 0.7984216213226318
    },
    {
        "BLOCK_SIZE_M": 16,
        "BLOCK_SIZE_N": 128,
        "BLOCK_SIZE_K": 512,
        "GROUP_SIZE_M": 8,
        "num_stages": 7,
        "num_warps": 2,
        "compile_time": 7.024662017822266
    },
    {
        "BLOCK_SIZE_M": 16,
        "BLOCK_SIZE_N": 128,
        "BLOCK_SIZE_K": 512,
        "GROUP_SIZE_M": 8,
        "num_stages": 7,
        "num_warps": 4,
        "compile_time": 11.489405393600464
    },
    {
        "BLOCK_SIZE_M": 16,
        "BLOCK_SIZE_N": 128,
        "BLOCK_SIZE_K": 512,
        "GROUP_SIZE_M": 8,
        "num_stages": 7,
        "num_warps": 8,
        "compile_time": 2.4686100482940674
    },
    {
        "BLOCK_SIZE_M": 16,
        "BLOCK_SIZE_N": 128,
        "BLOCK_SIZE_K": 512,
        "GROUP_SIZE_M": 8,
        "num_stages": 7,
        "num_warps": 16,
        "compile_time": 1.2599751949310303
    },
    {
        "BLOCK_SIZE_M": 16,
        "BLOCK_SIZE_N": 128,
        "BLOCK_SIZE_K": 512,
        "GROUP_SIZE_M": 8,
        "num_stages": 7,
        "num_warps": 32,
        "compile_time": 0.00518488883972168
    },
    {
        "BLOCK_SIZE_M": 16,
        "BLOCK_SIZE_N": 128,
        "BLOCK_SIZE_K": 512,
        "GROUP_SIZE_M": 8,
        "num_stages": 8,
        "num_warps": 2,
        "compile_time": 7.435089588165283
    },
    {
        "BLOCK_SIZE_M": 16,
        "BLOCK_SIZE_N": 128,
        "BLOCK_SIZE_K": 512,
        "GROUP_SIZE_M": 8,
        "num_stages": 8,
        "num_warps": 4,
        "compile_time": 11.677321195602417
    },
    {
        "BLOCK_SIZE_M": 16,
        "BLOCK_SIZE_N": 128,
        "BLOCK_SIZE_K": 512,
        "GROUP_SIZE_M": 8,
        "num_stages": 8,
        "num_warps": 8,
        "compile_time": 2.605630874633789
    },
    {
        "BLOCK_SIZE_M": 16,
        "BLOCK_SIZE_N": 128,
        "BLOCK_SIZE_K": 512,
        "GROUP_SIZE_M": 8,
        "num_stages": 8,
        "num_warps": 16,
        "compile_time": 1.331841230392456
    },
    {
        "BLOCK_SIZE_M": 16,
        "BLOCK_SIZE_N": 128,
        "BLOCK_SIZE_K": 512,
        "GROUP_SIZE_M": 8,
        "num_stages": 8,
        "num_warps": 32,
        "compile_time": 0.9011297225952148
    },
    {
        "BLOCK_SIZE_M": 16,
        "BLOCK_SIZE_N": 256,
        "BLOCK_SIZE_K": 64,
        "GROUP_SIZE_M": 8,
        "num_stages": 6,
        "num_warps": 2,
        "compile_time": 2.3217203617095947
    },
    {
        "BLOCK_SIZE_M": 16,
        "BLOCK_SIZE_N": 256,
        "BLOCK_SIZE_K": 64,
        "GROUP_SIZE_M": 8,
        "num_stages": 6,
        "num_warps": 4,
        "compile_time": 1.0404701232910156
    },
    {
        "BLOCK_SIZE_M": 16,
        "BLOCK_SIZE_N": 256,
        "BLOCK_SIZE_K": 64,
        "GROUP_SIZE_M": 8,
        "num_stages": 6,
        "num_warps": 8,
        "compile_time": 0.6151375770568848
    },
    {
        "BLOCK_SIZE_M": 16,
        "BLOCK_SIZE_N": 256,
        "BLOCK_SIZE_K": 64,
        "GROUP_SIZE_M": 8,
        "num_stages": 6,
        "num_warps": 16,
        "compile_time": 0.454315185546875
    },
    {
        "BLOCK_SIZE_M": 16,
        "BLOCK_SIZE_N": 256,
        "BLOCK_SIZE_K": 64,
        "GROUP_SIZE_M": 8,
        "num_stages": 7,
        "num_warps": 2,
        "compile_time": 2.4293112754821777
    },
    {
        "BLOCK_SIZE_M": 16,
        "BLOCK_SIZE_N": 256,
        "BLOCK_SIZE_K": 64,
        "GROUP_SIZE_M": 8,
        "num_stages": 7,
        "num_warps": 4,
        "compile_time": 1.0852854251861572
    },
    {
        "BLOCK_SIZE_M": 16,
        "BLOCK_SIZE_N": 256,
        "BLOCK_SIZE_K": 64,
        "GROUP_SIZE_M": 8,
        "num_stages": 7,
        "num_warps": 8,
        "compile_time": 0.6482572555541992
    },
    {
        "BLOCK_SIZE_M": 16,
        "BLOCK_SIZE_N": 256,
        "BLOCK_SIZE_K": 64,
        "GROUP_SIZE_M": 8,
        "num_stages": 7,
        "num_warps": 16,
        "compile_time": 0.47193217277526855
    },
    {
        "BLOCK_SIZE_M": 16,
        "BLOCK_SIZE_N": 256,
        "BLOCK_SIZE_K": 64,
        "GROUP_SIZE_M": 8,
        "num_stages": 7,
        "num_warps": 32,
        "compile_time": 0.37212514877319336
    },
    {
        "BLOCK_SIZE_M": 16,
        "BLOCK_SIZE_N": 256,
        "BLOCK_SIZE_K": 64,
        "GROUP_SIZE_M": 8,
        "num_stages": 8,
        "num_warps": 2,
        "compile_time": 2.5493013858795166
    },
    {
        "BLOCK_SIZE_M": 16,
        "BLOCK_SIZE_N": 256,
        "BLOCK_SIZE_K": 64,
        "GROUP_SIZE_M": 8,
        "num_stages": 8,
        "num_warps": 4,
        "compile_time": 1.1740736961364746
    },
    {
        "BLOCK_SIZE_M": 16,
        "BLOCK_SIZE_N": 256,
        "BLOCK_SIZE_K": 64,
        "GROUP_SIZE_M": 8,
        "num_stages": 8,
        "num_warps": 8,
        "compile_time": 0.6925554275512695
    },
    {
        "BLOCK_SIZE_M": 16,
        "BLOCK_SIZE_N": 256,
        "BLOCK_SIZE_K": 64,
        "GROUP_SIZE_M": 8,
        "num_stages": 8,
        "num_warps": 16,
        "compile_time": 0.49434685707092285
    },
    {
        "BLOCK_SIZE_M": 16,
        "BLOCK_SIZE_N": 256,
        "BLOCK_SIZE_K": 64,
        "GROUP_SIZE_M": 8,
        "num_stages": 8,
        "num_warps": 32,
        "compile_time": 0.004538536071777344
    },
    {
        "BLOCK_SIZE_M": 16,
        "BLOCK_SIZE_N": 256,
        "BLOCK_SIZE_K": 128,
        "GROUP_SIZE_M": 8,
        "num_stages": 3,
        "num_warps": 2,
        "compile_time": 10.551356077194214
    },
    {
        "BLOCK_SIZE_M": 16,
        "BLOCK_SIZE_N": 256,
        "BLOCK_SIZE_K": 128,
        "GROUP_SIZE_M": 8,
        "num_stages": 4,
        "num_warps": 2,
        "compile_time": 10.740615844726562
    },
    {
        "BLOCK_SIZE_M": 16,
        "BLOCK_SIZE_N": 256,
        "BLOCK_SIZE_K": 128,
        "GROUP_SIZE_M": 8,
        "num_stages": 4,
        "num_warps": 4,
        "compile_time": 1.919004201889038
    },
    {
        "BLOCK_SIZE_M": 16,
        "BLOCK_SIZE_N": 256,
        "BLOCK_SIZE_K": 128,
        "GROUP_SIZE_M": 8,
        "num_stages": 4,
        "num_warps": 8,
        "compile_time": 0.9102463722229004
    },
    {
        "BLOCK_SIZE_M": 16,
        "BLOCK_SIZE_N": 256,
        "BLOCK_SIZE_K": 128,
        "GROUP_SIZE_M": 8,
        "num_stages": 4,
        "num_warps": 16,
        "compile_time": 0.5442829132080078
    },
    {
        "BLOCK_SIZE_M": 16,
        "BLOCK_SIZE_N": 256,
        "BLOCK_SIZE_K": 128,
        "GROUP_SIZE_M": 8,
        "num_stages": 4,
        "num_warps": 32,
        "compile_time": 0.44146227836608887
    },
    {
        "BLOCK_SIZE_M": 16,
        "BLOCK_SIZE_N": 256,
        "BLOCK_SIZE_K": 128,
        "GROUP_SIZE_M": 8,
        "num_stages": 5,
        "num_warps": 2,
        "compile_time": 10.917574882507324
    },
    {
        "BLOCK_SIZE_M": 16,
        "BLOCK_SIZE_N": 256,
        "BLOCK_SIZE_K": 128,
        "GROUP_SIZE_M": 8,
        "num_stages": 5,
        "num_warps": 4,
        "compile_time": 2.033961296081543
    },
    {
        "BLOCK_SIZE_M": 16,
        "BLOCK_SIZE_N": 256,
        "BLOCK_SIZE_K": 128,
        "GROUP_SIZE_M": 8,
        "num_stages": 5,
        "num_warps": 8,
        "compile_time": 0.9741256237030029
    },
    {
        "BLOCK_SIZE_M": 16,
        "BLOCK_SIZE_N": 256,
        "BLOCK_SIZE_K": 128,
        "GROUP_SIZE_M": 8,
        "num_stages": 5,
        "num_warps": 16,
        "compile_time": 0.5900857448577881
    },
    {
        "BLOCK_SIZE_M": 16,
        "BLOCK_SIZE_N": 256,
        "BLOCK_SIZE_K": 128,
        "GROUP_SIZE_M": 8,
        "num_stages": 5,
        "num_warps": 32,
        "compile_time": 0.45737528800964355
    },
    {
        "BLOCK_SIZE_M": 16,
        "BLOCK_SIZE_N": 256,
        "BLOCK_SIZE_K": 128,
        "GROUP_SIZE_M": 8,
        "num_stages": 6,
        "num_warps": 2,
        "compile_time": 11.069166898727417
    },
    {
        "BLOCK_SIZE_M": 16,
        "BLOCK_SIZE_N": 256,
        "BLOCK_SIZE_K": 128,
        "GROUP_SIZE_M": 8,
        "num_stages": 6,
        "num_warps": 4,
        "compile_time": 2.166929244995117
    },
    {
        "BLOCK_SIZE_M": 16,
        "BLOCK_SIZE_N": 256,
        "BLOCK_SIZE_K": 128,
        "GROUP_SIZE_M": 8,
        "num_stages": 6,
        "num_warps": 8,
        "compile_time": 1.0548999309539795
    },
    {
        "BLOCK_SIZE_M": 16,
        "BLOCK_SIZE_N": 256,
        "BLOCK_SIZE_K": 128,
        "GROUP_SIZE_M": 8,
        "num_stages": 6,
        "num_warps": 16,
        "compile_time": 0.6274130344390869
    },
    {
        "BLOCK_SIZE_M": 16,
        "BLOCK_SIZE_N": 256,
        "BLOCK_SIZE_K": 128,
        "GROUP_SIZE_M": 8,
        "num_stages": 6,
        "num_warps": 32,
        "compile_time": 0.4748673439025879
    },
    {
        "BLOCK_SIZE_M": 16,
        "BLOCK_SIZE_N": 256,
        "BLOCK_SIZE_K": 128,
        "GROUP_SIZE_M": 8,
        "num_stages": 7,
        "num_warps": 2,
        "compile_time": 11.229055166244507
    },
    {
        "BLOCK_SIZE_M": 16,
        "BLOCK_SIZE_N": 256,
        "BLOCK_SIZE_K": 128,
        "GROUP_SIZE_M": 8,
        "num_stages": 7,
        "num_warps": 4,
        "compile_time": 2.2659425735473633
    },
    {
        "BLOCK_SIZE_M": 16,
        "BLOCK_SIZE_N": 256,
        "BLOCK_SIZE_K": 128,
        "GROUP_SIZE_M": 8,
        "num_stages": 7,
        "num_warps": 8,
        "compile_time": 1.1122372150421143
    },
    {
        "BLOCK_SIZE_M": 16,
        "BLOCK_SIZE_N": 256,
        "BLOCK_SIZE_K": 128,
        "GROUP_SIZE_M": 8,
        "num_stages": 7,
        "num_warps": 16,
        "compile_time": 0.6701529026031494
    },
    {
        "BLOCK_SIZE_M": 16,
        "BLOCK_SIZE_N": 256,
        "BLOCK_SIZE_K": 128,
        "GROUP_SIZE_M": 8,
        "num_stages": 7,
        "num_warps": 32,
        "compile_time": 0.5073766708374023
    },
    {
        "BLOCK_SIZE_M": 16,
        "BLOCK_SIZE_N": 256,
        "BLOCK_SIZE_K": 128,
        "GROUP_SIZE_M": 8,
        "num_stages": 8,
        "num_warps": 2,
        "compile_time": 11.549371004104614
    },
    {
        "BLOCK_SIZE_M": 16,
        "BLOCK_SIZE_N": 256,
        "BLOCK_SIZE_K": 128,
        "GROUP_SIZE_M": 8,
        "num_stages": 8,
        "num_warps": 4,
        "compile_time": 2.442394495010376
    },
    {
        "BLOCK_SIZE_M": 16,
        "BLOCK_SIZE_N": 256,
        "BLOCK_SIZE_K": 128,
        "GROUP_SIZE_M": 8,
        "num_stages": 8,
        "num_warps": 8,
        "compile_time": 1.2522273063659668
    },
    {
        "BLOCK_SIZE_M": 16,
        "BLOCK_SIZE_N": 256,
        "BLOCK_SIZE_K": 128,
        "GROUP_SIZE_M": 8,
        "num_stages": 8,
        "num_warps": 16,
        "compile_time": 0.7354097366333008
    },
    {
        "BLOCK_SIZE_M": 16,
        "BLOCK_SIZE_N": 256,
        "BLOCK_SIZE_K": 128,
        "GROUP_SIZE_M": 8,
        "num_stages": 8,
        "num_warps": 32,
        "compile_time": 0.5335838794708252
    },
    {
        "BLOCK_SIZE_M": 16,
        "BLOCK_SIZE_N": 256,
        "BLOCK_SIZE_K": 256,
        "GROUP_SIZE_M": 8,
        "num_stages": 1,
        "num_warps": 2,
        "compile_time": 7.798571348190308
    },
    {
        "BLOCK_SIZE_M": 16,
        "BLOCK_SIZE_N": 256,
        "BLOCK_SIZE_K": 256,
        "GROUP_SIZE_M": 8,
        "num_stages": 2,
        "num_warps": 2,
        "compile_time": 7.776963233947754
    },
    {
        "BLOCK_SIZE_M": 16,
        "BLOCK_SIZE_N": 256,
        "BLOCK_SIZE_K": 256,
        "GROUP_SIZE_M": 8,
        "num_stages": 3,
        "num_warps": 2,
        "compile_time": 99.79730582237244
    },
    {
        "BLOCK_SIZE_M": 16,
        "BLOCK_SIZE_N": 256,
        "BLOCK_SIZE_K": 256,
        "GROUP_SIZE_M": 8,
        "num_stages": 3,
        "num_warps": 4,
        "compile_time": 10.815321683883667
    },
    {
        "BLOCK_SIZE_M": 16,
        "BLOCK_SIZE_N": 256,
        "BLOCK_SIZE_K": 256,
        "GROUP_SIZE_M": 8,
        "num_stages": 3,
        "num_warps": 8,
        "compile_time": 0.004381418228149414
    },
    {
        "BLOCK_SIZE_M": 16,
        "BLOCK_SIZE_N": 256,
        "BLOCK_SIZE_K": 256,
        "GROUP_SIZE_M": 8,
        "num_stages": 3,
        "num_warps": 16,
        "compile_time": 0.8528633117675781
    },
    {
        "BLOCK_SIZE_M": 16,
        "BLOCK_SIZE_N": 256,
        "BLOCK_SIZE_K": 256,
        "GROUP_SIZE_M": 8,
        "num_stages": 3,
        "num_warps": 32,
        "compile_time": 0.5528066158294678
    },
    {
        "BLOCK_SIZE_M": 16,
        "BLOCK_SIZE_N": 256,
        "BLOCK_SIZE_K": 256,
        "GROUP_SIZE_M": 8,
        "num_stages": 4,
        "num_warps": 2,
        "compile_time": 6.027803421020508
    },
    {
        "BLOCK_SIZE_M": 16,
        "BLOCK_SIZE_N": 256,
        "BLOCK_SIZE_K": 256,
        "GROUP_SIZE_M": 8,
        "num_stages": 4,
        "num_warps": 4,
        "compile_time": 10.738422870635986
    },
    {
        "BLOCK_SIZE_M": 16,
        "BLOCK_SIZE_N": 256,
        "BLOCK_SIZE_K": 256,
        "GROUP_SIZE_M": 8,
        "num_stages": 4,
        "num_warps": 8,
        "compile_time": 1.946639060974121
    },
    {
        "BLOCK_SIZE_M": 16,
        "BLOCK_SIZE_N": 256,
        "BLOCK_SIZE_K": 256,
        "GROUP_SIZE_M": 8,
        "num_stages": 4,
        "num_warps": 16,
        "compile_time": 0.9281702041625977
    },
    {
        "BLOCK_SIZE_M": 16,
        "BLOCK_SIZE_N": 256,
        "BLOCK_SIZE_K": 256,
        "GROUP_SIZE_M": 8,
        "num_stages": 4,
        "num_warps": 32,
        "compile_time": 0.6014745235443115
    },
    {
        "BLOCK_SIZE_M": 16,
        "BLOCK_SIZE_N": 256,
        "BLOCK_SIZE_K": 256,
        "GROUP_SIZE_M": 8,
        "num_stages": 5,
        "num_warps": 2,
        "compile_time": 6.266322612762451
    },
    {
        "BLOCK_SIZE_M": 16,
        "BLOCK_SIZE_N": 256,
        "BLOCK_SIZE_K": 256,
        "GROUP_SIZE_M": 8,
        "num_stages": 5,
        "num_warps": 4,
        "compile_time": 10.922477006912231
    },
    {
        "BLOCK_SIZE_M": 16,
        "BLOCK_SIZE_N": 256,
        "BLOCK_SIZE_K": 256,
        "GROUP_SIZE_M": 8,
        "num_stages": 5,
        "num_warps": 8,
        "compile_time": 2.103644847869873
    },
    {
        "BLOCK_SIZE_M": 16,
        "BLOCK_SIZE_N": 256,
        "BLOCK_SIZE_K": 256,
        "GROUP_SIZE_M": 8,
        "num_stages": 5,
        "num_warps": 16,
        "compile_time": 1.0124528408050537
    },
    {
        "BLOCK_SIZE_M": 16,
        "BLOCK_SIZE_N": 256,
        "BLOCK_SIZE_K": 256,
        "GROUP_SIZE_M": 8,
        "num_stages": 5,
        "num_warps": 32,
        "compile_time": 0.6441106796264648
    },
    {
        "BLOCK_SIZE_M": 16,
        "BLOCK_SIZE_N": 256,
        "BLOCK_SIZE_K": 256,
        "GROUP_SIZE_M": 8,
        "num_stages": 6,
        "num_warps": 2,
        "compile_time": 6.731182098388672
    },
    {
        "BLOCK_SIZE_M": 16,
        "BLOCK_SIZE_N": 256,
        "BLOCK_SIZE_K": 256,
        "GROUP_SIZE_M": 8,
        "num_stages": 6,
        "num_warps": 4,
        "compile_time": 11.215734720230103
    },
    {
        "BLOCK_SIZE_M": 16,
        "BLOCK_SIZE_N": 256,
        "BLOCK_SIZE_K": 256,
        "GROUP_SIZE_M": 8,
        "num_stages": 6,
        "num_warps": 8,
        "compile_time": 2.2812063694000244
    },
    {
        "BLOCK_SIZE_M": 16,
        "BLOCK_SIZE_N": 256,
        "BLOCK_SIZE_K": 256,
        "GROUP_SIZE_M": 8,
        "num_stages": 6,
        "num_warps": 16,
        "compile_time": 1.09163236618042
    },
    {
        "BLOCK_SIZE_M": 16,
        "BLOCK_SIZE_N": 256,
        "BLOCK_SIZE_K": 256,
        "GROUP_SIZE_M": 8,
        "num_stages": 6,
        "num_warps": 32,
        "compile_time": 0.6874244213104248
    },
    {
        "BLOCK_SIZE_M": 16,
        "BLOCK_SIZE_N": 256,
        "BLOCK_SIZE_K": 256,
        "GROUP_SIZE_M": 8,
        "num_stages": 7,
        "num_warps": 2,
        "compile_time": 6.994163513183594
    },
    {
        "BLOCK_SIZE_M": 16,
        "BLOCK_SIZE_N": 256,
        "BLOCK_SIZE_K": 256,
        "GROUP_SIZE_M": 8,
        "num_stages": 7,
        "num_warps": 4,
        "compile_time": 11.27844786643982
    },
    {
        "BLOCK_SIZE_M": 16,
        "BLOCK_SIZE_N": 256,
        "BLOCK_SIZE_K": 256,
        "GROUP_SIZE_M": 8,
        "num_stages": 7,
        "num_warps": 8,
        "compile_time": 2.3879804611206055
    },
    {
        "BLOCK_SIZE_M": 16,
        "BLOCK_SIZE_N": 256,
        "BLOCK_SIZE_K": 256,
        "GROUP_SIZE_M": 8,
        "num_stages": 7,
        "num_warps": 16,
        "compile_time": 1.2176637649536133
    },
    {
        "BLOCK_SIZE_M": 16,
        "BLOCK_SIZE_N": 256,
        "BLOCK_SIZE_K": 256,
        "GROUP_SIZE_M": 8,
        "num_stages": 7,
        "num_warps": 32,
        "compile_time": 0.7458629608154297
    },
    {
        "BLOCK_SIZE_M": 16,
        "BLOCK_SIZE_N": 256,
        "BLOCK_SIZE_K": 256,
        "GROUP_SIZE_M": 8,
        "num_stages": 8,
        "num_warps": 2,
        "compile_time": 7.257071018218994
    },
    {
        "BLOCK_SIZE_M": 16,
        "BLOCK_SIZE_N": 256,
        "BLOCK_SIZE_K": 256,
        "GROUP_SIZE_M": 8,
        "num_stages": 8,
        "num_warps": 4,
        "compile_time": 11.662351369857788
    },
    {
        "BLOCK_SIZE_M": 16,
        "BLOCK_SIZE_N": 256,
        "BLOCK_SIZE_K": 256,
        "GROUP_SIZE_M": 8,
        "num_stages": 8,
        "num_warps": 8,
        "compile_time": 2.622954845428467
    },
    {
        "BLOCK_SIZE_M": 16,
        "BLOCK_SIZE_N": 256,
        "BLOCK_SIZE_K": 256,
        "GROUP_SIZE_M": 8,
        "num_stages": 8,
        "num_warps": 16,
        "compile_time": 1.28147292137146
    },
    {
        "BLOCK_SIZE_M": 16,
        "BLOCK_SIZE_N": 256,
        "BLOCK_SIZE_K": 256,
        "GROUP_SIZE_M": 8,
        "num_stages": 8,
        "num_warps": 32,
        "compile_time": 0.0052852630615234375
    },
    {
        "BLOCK_SIZE_M": 16,
        "BLOCK_SIZE_N": 256,
        "BLOCK_SIZE_K": 512,
        "GROUP_SIZE_M": 8,
        "num_stages": 1,
        "num_warps": 2,
        "compile_time": 19.71309471130371
    },
    {
        "BLOCK_SIZE_M": 16,
        "BLOCK_SIZE_N": 256,
        "BLOCK_SIZE_K": 512,
        "GROUP_SIZE_M": 8,
        "num_stages": 1,
        "num_warps": 4,
        "compile_time": 7.905789852142334
    },
    {
        "BLOCK_SIZE_M": 16,
        "BLOCK_SIZE_N": 256,
        "BLOCK_SIZE_K": 512,
        "GROUP_SIZE_M": 8,
        "num_stages": 1,
        "num_warps": 8,
        "compile_time": 2.7811622619628906
    },
    {
        "BLOCK_SIZE_M": 16,
        "BLOCK_SIZE_N": 256,
        "BLOCK_SIZE_K": 512,
        "GROUP_SIZE_M": 8,
        "num_stages": 1,
        "num_warps": 16,
        "compile_time": 1.148672103881836
    },
    {
        "BLOCK_SIZE_M": 16,
        "BLOCK_SIZE_N": 256,
        "BLOCK_SIZE_K": 512,
        "GROUP_SIZE_M": 8,
        "num_stages": 1,
        "num_warps": 32,
        "compile_time": 0.004120349884033203
    },
    {
        "BLOCK_SIZE_M": 16,
        "BLOCK_SIZE_N": 256,
        "BLOCK_SIZE_K": 512,
        "GROUP_SIZE_M": 8,
        "num_stages": 2,
        "num_warps": 2,
        "compile_time": 19.345696687698364
    },
    {
        "BLOCK_SIZE_M": 16,
        "BLOCK_SIZE_N": 256,
        "BLOCK_SIZE_K": 512,
        "GROUP_SIZE_M": 8,
        "num_stages": 2,
        "num_warps": 4,
        "compile_time": 7.8093249797821045
    },
    {
        "BLOCK_SIZE_M": 16,
        "BLOCK_SIZE_N": 256,
        "BLOCK_SIZE_K": 512,
        "GROUP_SIZE_M": 8,
        "num_stages": 2,
        "num_warps": 8,
        "compile_time": 3.0664777755737305
    },
    {
        "BLOCK_SIZE_M": 16,
        "BLOCK_SIZE_N": 256,
        "BLOCK_SIZE_K": 512,
        "GROUP_SIZE_M": 8,
        "num_stages": 2,
        "num_warps": 16,
        "compile_time": 1.3254008293151855
    },
    {
        "BLOCK_SIZE_M": 16,
        "BLOCK_SIZE_N": 256,
        "BLOCK_SIZE_K": 512,
        "GROUP_SIZE_M": 8,
        "num_stages": 2,
        "num_warps": 32,
        "compile_time": 0.809584379196167
    },
    {
        "BLOCK_SIZE_M": 16,
        "BLOCK_SIZE_N": 256,
        "BLOCK_SIZE_K": 512,
        "GROUP_SIZE_M": 8,
        "num_stages": 3,
        "num_warps": 2,
        "compile_time": 20.00652289390564
    },
    {
        "BLOCK_SIZE_M": 16,
        "BLOCK_SIZE_N": 256,
        "BLOCK_SIZE_K": 512,
        "GROUP_SIZE_M": 8,
        "num_stages": 3,
        "num_warps": 4,
        "compile_time": 99.29928493499756
    },
    {
        "BLOCK_SIZE_M": 16,
        "BLOCK_SIZE_N": 256,
        "BLOCK_SIZE_K": 512,
        "GROUP_SIZE_M": 8,
        "num_stages": 3,
        "num_warps": 8,
        "compile_time": 10.669692277908325
    },
    {
        "BLOCK_SIZE_M": 16,
        "BLOCK_SIZE_N": 256,
        "BLOCK_SIZE_K": 512,
        "GROUP_SIZE_M": 8,
        "num_stages": 3,
        "num_warps": 16,
        "compile_time": 1.9856135845184326
    },
    {
        "BLOCK_SIZE_M": 16,
        "BLOCK_SIZE_N": 256,
        "BLOCK_SIZE_K": 512,
        "GROUP_SIZE_M": 8,
        "num_stages": 3,
        "num_warps": 32,
        "compile_time": 0.003949403762817383
    },
    {
        "BLOCK_SIZE_M": 16,
        "BLOCK_SIZE_N": 256,
        "BLOCK_SIZE_K": 512,
        "GROUP_SIZE_M": 8,
        "num_stages": 4,
        "num_warps": 2,
        "compile_time": 20.808760404586792
    },
    {
        "BLOCK_SIZE_M": 16,
        "BLOCK_SIZE_N": 256,
        "BLOCK_SIZE_K": 512,
        "GROUP_SIZE_M": 8,
        "num_stages": 4,
        "num_warps": 4,
        "compile_time": 6.090381860733032
    },
    {
        "BLOCK_SIZE_M": 16,
        "BLOCK_SIZE_N": 256,
        "BLOCK_SIZE_K": 512,
        "GROUP_SIZE_M": 8,
        "num_stages": 4,
        "num_warps": 8,
        "compile_time": 10.828000783920288
    },
    {
        "BLOCK_SIZE_M": 16,
        "BLOCK_SIZE_N": 256,
        "BLOCK_SIZE_K": 512,
        "GROUP_SIZE_M": 8,
        "num_stages": 4,
        "num_warps": 16,
        "compile_time": 2.153486490249634
    },
    {
        "BLOCK_SIZE_M": 16,
        "BLOCK_SIZE_N": 256,
        "BLOCK_SIZE_K": 512,
        "GROUP_SIZE_M": 8,
        "num_stages": 4,
        "num_warps": 32,
        "compile_time": 1.038111925125122
    },
    {
        "BLOCK_SIZE_M": 16,
        "BLOCK_SIZE_N": 256,
        "BLOCK_SIZE_K": 512,
        "GROUP_SIZE_M": 8,
        "num_stages": 5,
        "num_warps": 2,
        "compile_time": 21.817601203918457
    },
    {
        "BLOCK_SIZE_M": 16,
        "BLOCK_SIZE_N": 256,
        "BLOCK_SIZE_K": 512,
        "GROUP_SIZE_M": 8,
        "num_stages": 5,
        "num_warps": 4,
        "compile_time": 6.660872936248779
    },
    {
        "BLOCK_SIZE_M": 16,
        "BLOCK_SIZE_N": 256,
        "BLOCK_SIZE_K": 512,
        "GROUP_SIZE_M": 8,
        "num_stages": 5,
        "num_warps": 8,
        "compile_time": 11.171607732772827
    },
    {
        "BLOCK_SIZE_M": 16,
        "BLOCK_SIZE_N": 256,
        "BLOCK_SIZE_K": 512,
        "GROUP_SIZE_M": 8,
        "num_stages": 5,
        "num_warps": 16,
        "compile_time": 2.337238311767578
    },
    {
        "BLOCK_SIZE_M": 16,
        "BLOCK_SIZE_N": 256,
        "BLOCK_SIZE_K": 512,
        "GROUP_SIZE_M": 8,
        "num_stages": 5,
        "num_warps": 32,
        "compile_time": 0.004258632659912109
    },
    {
        "BLOCK_SIZE_M": 16,
        "BLOCK_SIZE_N": 256,
        "BLOCK_SIZE_K": 512,
        "GROUP_SIZE_M": 8,
        "num_stages": 6,
        "num_warps": 2,
        "compile_time": 22.59338641166687
    },
    {
        "BLOCK_SIZE_M": 16,
        "BLOCK_SIZE_N": 256,
        "BLOCK_SIZE_K": 512,
        "GROUP_SIZE_M": 8,
        "num_stages": 6,
        "num_warps": 4,
        "compile_time": 6.994967222213745
    },
    {
        "BLOCK_SIZE_M": 16,
        "BLOCK_SIZE_N": 256,
        "BLOCK_SIZE_K": 512,
        "GROUP_SIZE_M": 8,
        "num_stages": 6,
        "num_warps": 8,
        "compile_time": 11.33870553970337
    },
    {
        "BLOCK_SIZE_M": 16,
        "BLOCK_SIZE_N": 256,
        "BLOCK_SIZE_K": 512,
        "GROUP_SIZE_M": 8,
        "num_stages": 6,
        "num_warps": 16,
        "compile_time": 2.5324814319610596
    },
    {
        "BLOCK_SIZE_M": 16,
        "BLOCK_SIZE_N": 256,
        "BLOCK_SIZE_K": 512,
        "GROUP_SIZE_M": 8,
        "num_stages": 6,
        "num_warps": 32,
        "compile_time": 1.229541301727295
    },
    {
        "BLOCK_SIZE_M": 16,
        "BLOCK_SIZE_N": 256,
        "BLOCK_SIZE_K": 512,
        "GROUP_SIZE_M": 8,
        "num_stages": 7,
        "num_warps": 2,
        "compile_time": 23.02479338645935
    },
    {
        "BLOCK_SIZE_M": 16,
        "BLOCK_SIZE_N": 256,
        "BLOCK_SIZE_K": 512,
        "GROUP_SIZE_M": 8,
        "num_stages": 7,
        "num_warps": 4,
        "compile_time": 7.179623126983643
    },
    {
        "BLOCK_SIZE_M": 16,
        "BLOCK_SIZE_N": 256,
        "BLOCK_SIZE_K": 512,
        "GROUP_SIZE_M": 8,
        "num_stages": 7,
        "num_warps": 8,
        "compile_time": 11.580945253372192
    },
    {
        "BLOCK_SIZE_M": 16,
        "BLOCK_SIZE_N": 256,
        "BLOCK_SIZE_K": 512,
        "GROUP_SIZE_M": 8,
        "num_stages": 7,
        "num_warps": 16,
        "compile_time": 2.731761932373047
    },
    {
        "BLOCK_SIZE_M": 16,
        "BLOCK_SIZE_N": 256,
        "BLOCK_SIZE_K": 512,
        "GROUP_SIZE_M": 8,
        "num_stages": 7,
        "num_warps": 32,
        "compile_time": 0.0061647891998291016
    },
    {
        "BLOCK_SIZE_M": 16,
        "BLOCK_SIZE_N": 256,
        "BLOCK_SIZE_K": 512,
        "GROUP_SIZE_M": 8,
        "num_stages": 8,
        "num_warps": 2,
        "compile_time": 6.1292030811309814
    },
    {
        "BLOCK_SIZE_M": 16,
        "BLOCK_SIZE_N": 256,
        "BLOCK_SIZE_K": 512,
        "GROUP_SIZE_M": 8,
        "num_stages": 8,
        "num_warps": 4,
        "compile_time": 7.855472087860107
    },
    {
        "BLOCK_SIZE_M": 16,
        "BLOCK_SIZE_N": 256,
        "BLOCK_SIZE_K": 512,
        "GROUP_SIZE_M": 8,
        "num_stages": 8,
        "num_warps": 8,
        "compile_time": 11.922574520111084
    },
    {
        "BLOCK_SIZE_M": 16,
        "BLOCK_SIZE_N": 256,
        "BLOCK_SIZE_K": 512,
        "GROUP_SIZE_M": 8,
        "num_stages": 8,
        "num_warps": 16,
        "compile_time": 2.9169278144836426
    },
    {
        "BLOCK_SIZE_M": 16,
        "BLOCK_SIZE_N": 256,
        "BLOCK_SIZE_K": 512,
        "GROUP_SIZE_M": 8,
        "num_stages": 8,
        "num_warps": 32,
        "compile_time": 1.4207415580749512
    },
    {
        "BLOCK_SIZE_M": 16,
        "BLOCK_SIZE_N": 512,
        "BLOCK_SIZE_K": 32,
        "GROUP_SIZE_M": 8,
        "num_stages": 6,
        "num_warps": 2,
        "compile_time": 2.566464424133301
    },
    {
        "BLOCK_SIZE_M": 16,
        "BLOCK_SIZE_N": 512,
        "BLOCK_SIZE_K": 32,
        "GROUP_SIZE_M": 8,
        "num_stages": 6,
        "num_warps": 4,
        "compile_time": 1.2035527229309082
    },
    {
        "BLOCK_SIZE_M": 16,
        "BLOCK_SIZE_N": 512,
        "BLOCK_SIZE_K": 32,
        "GROUP_SIZE_M": 8,
        "num_stages": 6,
        "num_warps": 8,
        "compile_time": 0.6954782009124756
    },
    {
        "BLOCK_SIZE_M": 16,
        "BLOCK_SIZE_N": 512,
        "BLOCK_SIZE_K": 32,
        "GROUP_SIZE_M": 8,
        "num_stages": 7,
        "num_warps": 2,
        "compile_time": 2.707779884338379
    },
    {
        "BLOCK_SIZE_M": 16,
        "BLOCK_SIZE_N": 512,
        "BLOCK_SIZE_K": 32,
        "GROUP_SIZE_M": 8,
        "num_stages": 7,
        "num_warps": 4,
        "compile_time": 1.246896743774414
    },
    {
        "BLOCK_SIZE_M": 16,
        "BLOCK_SIZE_N": 512,
        "BLOCK_SIZE_K": 32,
        "GROUP_SIZE_M": 8,
        "num_stages": 7,
        "num_warps": 8,
        "compile_time": 0.7131059169769287
    },
    {
        "BLOCK_SIZE_M": 16,
        "BLOCK_SIZE_N": 512,
        "BLOCK_SIZE_K": 32,
        "GROUP_SIZE_M": 8,
        "num_stages": 7,
        "num_warps": 16,
        "compile_time": 0.485684871673584
    },
    {
        "BLOCK_SIZE_M": 16,
        "BLOCK_SIZE_N": 512,
        "BLOCK_SIZE_K": 32,
        "GROUP_SIZE_M": 8,
        "num_stages": 7,
        "num_warps": 32,
        "compile_time": 0.005078792572021484
    },
    {
        "BLOCK_SIZE_M": 16,
        "BLOCK_SIZE_N": 512,
        "BLOCK_SIZE_K": 32,
        "GROUP_SIZE_M": 8,
        "num_stages": 8,
        "num_warps": 2,
        "compile_time": 2.779208183288574
    },
    {
        "BLOCK_SIZE_M": 16,
        "BLOCK_SIZE_N": 512,
        "BLOCK_SIZE_K": 32,
        "GROUP_SIZE_M": 8,
        "num_stages": 8,
        "num_warps": 4,
        "compile_time": 1.3332884311676025
    },
    {
        "BLOCK_SIZE_M": 16,
        "BLOCK_SIZE_N": 512,
        "BLOCK_SIZE_K": 32,
        "GROUP_SIZE_M": 8,
        "num_stages": 8,
        "num_warps": 8,
        "compile_time": 0.7555615901947021
    },
    {
        "BLOCK_SIZE_M": 16,
        "BLOCK_SIZE_N": 512,
        "BLOCK_SIZE_K": 32,
        "GROUP_SIZE_M": 8,
        "num_stages": 8,
        "num_warps": 16,
        "compile_time": 0.49752187728881836
    },
    {
        "BLOCK_SIZE_M": 16,
        "BLOCK_SIZE_N": 512,
        "BLOCK_SIZE_K": 32,
        "GROUP_SIZE_M": 8,
        "num_stages": 8,
        "num_warps": 32,
        "compile_time": 0.40850090980529785
    },
    {
        "BLOCK_SIZE_M": 16,
        "BLOCK_SIZE_N": 512,
        "BLOCK_SIZE_K": 64,
        "GROUP_SIZE_M": 8,
        "num_stages": 3,
        "num_warps": 2,
        "compile_time": 10.866811275482178
    },
    {
        "BLOCK_SIZE_M": 16,
        "BLOCK_SIZE_N": 512,
        "BLOCK_SIZE_K": 64,
        "GROUP_SIZE_M": 8,
        "num_stages": 4,
        "num_warps": 2,
        "compile_time": 11.070269107818604
    },
    {
        "BLOCK_SIZE_M": 16,
        "BLOCK_SIZE_N": 512,
        "BLOCK_SIZE_K": 64,
        "GROUP_SIZE_M": 8,
        "num_stages": 4,
        "num_warps": 4,
        "compile_time": 2.0829904079437256
    },
    {
        "BLOCK_SIZE_M": 16,
        "BLOCK_SIZE_N": 512,
        "BLOCK_SIZE_K": 64,
        "GROUP_SIZE_M": 8,
        "num_stages": 4,
        "num_warps": 8,
        "compile_time": 0.9636588096618652
    },
    {
        "BLOCK_SIZE_M": 16,
        "BLOCK_SIZE_N": 512,
        "BLOCK_SIZE_K": 64,
        "GROUP_SIZE_M": 8,
        "num_stages": 4,
        "num_warps": 16,
        "compile_time": 0.5870370864868164
    },
    {
        "BLOCK_SIZE_M": 16,
        "BLOCK_SIZE_N": 512,
        "BLOCK_SIZE_K": 64,
        "GROUP_SIZE_M": 8,
        "num_stages": 4,
        "num_warps": 32,
        "compile_time": 0.004613161087036133
    },
    {
        "BLOCK_SIZE_M": 16,
        "BLOCK_SIZE_N": 512,
        "BLOCK_SIZE_K": 64,
        "GROUP_SIZE_M": 8,
        "num_stages": 5,
        "num_warps": 2,
        "compile_time": 11.206937789916992
    },
    {
        "BLOCK_SIZE_M": 16,
        "BLOCK_SIZE_N": 512,
        "BLOCK_SIZE_K": 64,
        "GROUP_SIZE_M": 8,
        "num_stages": 5,
        "num_warps": 4,
        "compile_time": 2.2514803409576416
    },
    {
        "BLOCK_SIZE_M": 16,
        "BLOCK_SIZE_N": 512,
        "BLOCK_SIZE_K": 64,
        "GROUP_SIZE_M": 8,
        "num_stages": 5,
        "num_warps": 8,
        "compile_time": 1.0300958156585693
    },
    {
        "BLOCK_SIZE_M": 16,
        "BLOCK_SIZE_N": 512,
        "BLOCK_SIZE_K": 64,
        "GROUP_SIZE_M": 8,
        "num_stages": 5,
        "num_warps": 16,
        "compile_time": 0.616790771484375
    },
    {
        "BLOCK_SIZE_M": 16,
        "BLOCK_SIZE_N": 512,
        "BLOCK_SIZE_K": 64,
        "GROUP_SIZE_M": 8,
        "num_stages": 5,
        "num_warps": 32,
        "compile_time": 0.4276435375213623
    },
    {
        "BLOCK_SIZE_M": 16,
        "BLOCK_SIZE_N": 512,
        "BLOCK_SIZE_K": 64,
        "GROUP_SIZE_M": 8,
        "num_stages": 6,
        "num_warps": 2,
        "compile_time": 11.463951587677002
    },
    {
        "BLOCK_SIZE_M": 16,
        "BLOCK_SIZE_N": 512,
        "BLOCK_SIZE_K": 64,
        "GROUP_SIZE_M": 8,
        "num_stages": 6,
        "num_warps": 4,
        "compile_time": 2.400486469268799
    },
    {
        "BLOCK_SIZE_M": 16,
        "BLOCK_SIZE_N": 512,
        "BLOCK_SIZE_K": 64,
        "GROUP_SIZE_M": 8,
        "num_stages": 6,
        "num_warps": 8,
        "compile_time": 1.1099283695220947
    },
    {
        "BLOCK_SIZE_M": 16,
        "BLOCK_SIZE_N": 512,
        "BLOCK_SIZE_K": 64,
        "GROUP_SIZE_M": 8,
        "num_stages": 6,
        "num_warps": 16,
        "compile_time": 0.6665430068969727
    },
    {
        "BLOCK_SIZE_M": 16,
        "BLOCK_SIZE_N": 512,
        "BLOCK_SIZE_K": 64,
        "GROUP_SIZE_M": 8,
        "num_stages": 6,
        "num_warps": 32,
        "compile_time": 0.4605121612548828
    },
    {
        "BLOCK_SIZE_M": 16,
        "BLOCK_SIZE_N": 512,
        "BLOCK_SIZE_K": 64,
        "GROUP_SIZE_M": 8,
        "num_stages": 7,
        "num_warps": 2,
        "compile_time": 11.579576253890991
    },
    {
        "BLOCK_SIZE_M": 16,
        "BLOCK_SIZE_N": 512,
        "BLOCK_SIZE_K": 64,
        "GROUP_SIZE_M": 8,
        "num_stages": 7,
        "num_warps": 4,
        "compile_time": 2.464362144470215
    },
    {
        "BLOCK_SIZE_M": 16,
        "BLOCK_SIZE_N": 512,
        "BLOCK_SIZE_K": 64,
        "GROUP_SIZE_M": 8,
        "num_stages": 7,
        "num_warps": 8,
        "compile_time": 1.2050585746765137
    },
    {
        "BLOCK_SIZE_M": 16,
        "BLOCK_SIZE_N": 512,
        "BLOCK_SIZE_K": 64,
        "GROUP_SIZE_M": 8,
        "num_stages": 7,
        "num_warps": 16,
        "compile_time": 0.708061695098877
    },
    {
        "BLOCK_SIZE_M": 16,
        "BLOCK_SIZE_N": 512,
        "BLOCK_SIZE_K": 64,
        "GROUP_SIZE_M": 8,
        "num_stages": 7,
        "num_warps": 32,
        "compile_time": 0.004499673843383789
    },
    {
        "BLOCK_SIZE_M": 16,
        "BLOCK_SIZE_N": 512,
        "BLOCK_SIZE_K": 64,
        "GROUP_SIZE_M": 8,
        "num_stages": 8,
        "num_warps": 2,
        "compile_time": 11.87487530708313
    },
    {
        "BLOCK_SIZE_M": 16,
        "BLOCK_SIZE_N": 512,
        "BLOCK_SIZE_K": 64,
        "GROUP_SIZE_M": 8,
        "num_stages": 8,
        "num_warps": 4,
        "compile_time": 2.6378016471862793
    },
    {
        "BLOCK_SIZE_M": 16,
        "BLOCK_SIZE_N": 512,
        "BLOCK_SIZE_K": 64,
        "GROUP_SIZE_M": 8,
        "num_stages": 8,
        "num_warps": 8,
        "compile_time": 1.2883343696594238
    },
    {
        "BLOCK_SIZE_M": 16,
        "BLOCK_SIZE_N": 512,
        "BLOCK_SIZE_K": 64,
        "GROUP_SIZE_M": 8,
        "num_stages": 8,
        "num_warps": 16,
        "compile_time": 0.7451434135437012
    },
    {
        "BLOCK_SIZE_M": 16,
        "BLOCK_SIZE_N": 512,
        "BLOCK_SIZE_K": 64,
        "GROUP_SIZE_M": 8,
        "num_stages": 8,
        "num_warps": 32,
        "compile_time": 0.5362706184387207
    },
    {
        "BLOCK_SIZE_M": 16,
        "BLOCK_SIZE_N": 512,
        "BLOCK_SIZE_K": 128,
        "GROUP_SIZE_M": 8,
        "num_stages": 1,
        "num_warps": 2,
        "compile_time": 8.168181657791138
    },
    {
        "BLOCK_SIZE_M": 16,
        "BLOCK_SIZE_N": 512,
        "BLOCK_SIZE_K": 128,
        "GROUP_SIZE_M": 8,
        "num_stages": 2,
        "num_warps": 2,
        "compile_time": 7.963106393814087
    },
    {
        "BLOCK_SIZE_M": 16,
        "BLOCK_SIZE_N": 512,
        "BLOCK_SIZE_K": 128,
        "GROUP_SIZE_M": 8,
        "num_stages": 3,
        "num_warps": 2,
        "compile_time": 99.40801644325256
    },
    {
        "BLOCK_SIZE_M": 16,
        "BLOCK_SIZE_N": 512,
        "BLOCK_SIZE_K": 128,
        "GROUP_SIZE_M": 8,
        "num_stages": 3,
        "num_warps": 4,
        "compile_time": 10.78745436668396
    },
    {
        "BLOCK_SIZE_M": 16,
        "BLOCK_SIZE_N": 512,
        "BLOCK_SIZE_K": 128,
        "GROUP_SIZE_M": 8,
        "num_stages": 3,
        "num_warps": 8,
        "compile_time": 0.004271268844604492
    },
    {
        "BLOCK_SIZE_M": 16,
        "BLOCK_SIZE_N": 512,
        "BLOCK_SIZE_K": 128,
        "GROUP_SIZE_M": 8,
        "num_stages": 3,
        "num_warps": 16,
        "compile_time": 0.003067493438720703
    },
    {
        "BLOCK_SIZE_M": 16,
        "BLOCK_SIZE_N": 512,
        "BLOCK_SIZE_K": 128,
        "GROUP_SIZE_M": 8,
        "num_stages": 3,
        "num_warps": 32,
        "compile_time": 0.004194498062133789
    },
    {
        "BLOCK_SIZE_M": 16,
        "BLOCK_SIZE_N": 512,
        "BLOCK_SIZE_K": 128,
        "GROUP_SIZE_M": 8,
        "num_stages": 4,
        "num_warps": 2,
        "compile_time": 6.193382740020752
    },
    {
        "BLOCK_SIZE_M": 16,
        "BLOCK_SIZE_N": 512,
        "BLOCK_SIZE_K": 128,
        "GROUP_SIZE_M": 8,
        "num_stages": 4,
        "num_warps": 4,
        "compile_time": 10.798608541488647
    },
    {
        "BLOCK_SIZE_M": 16,
        "BLOCK_SIZE_N": 512,
        "BLOCK_SIZE_K": 128,
        "GROUP_SIZE_M": 8,
        "num_stages": 4,
        "num_warps": 8,
        "compile_time": 0.004595518112182617
    },
    {
        "BLOCK_SIZE_M": 16,
        "BLOCK_SIZE_N": 512,
        "BLOCK_SIZE_K": 128,
        "GROUP_SIZE_M": 8,
        "num_stages": 4,
        "num_warps": 16,
        "compile_time": 0.004265308380126953
    },
    {
        "BLOCK_SIZE_M": 16,
        "BLOCK_SIZE_N": 512,
        "BLOCK_SIZE_K": 128,
        "GROUP_SIZE_M": 8,
        "num_stages": 4,
        "num_warps": 32,
        "compile_time": 0.0030591487884521484
    },
    {
        "BLOCK_SIZE_M": 16,
        "BLOCK_SIZE_N": 512,
        "BLOCK_SIZE_K": 128,
        "GROUP_SIZE_M": 8,
        "num_stages": 5,
        "num_warps": 2,
        "compile_time": 6.325432062149048
    },
    {
        "BLOCK_SIZE_M": 16,
        "BLOCK_SIZE_N": 512,
        "BLOCK_SIZE_K": 128,
        "GROUP_SIZE_M": 8,
        "num_stages": 5,
        "num_warps": 4,
        "compile_time": 10.960400581359863
    },
    {
        "BLOCK_SIZE_M": 16,
        "BLOCK_SIZE_N": 512,
        "BLOCK_SIZE_K": 128,
        "GROUP_SIZE_M": 8,
        "num_stages": 5,
        "num_warps": 8,
        "compile_time": 0.00426793098449707
    },
    {
        "BLOCK_SIZE_M": 16,
        "BLOCK_SIZE_N": 512,
        "BLOCK_SIZE_K": 128,
        "GROUP_SIZE_M": 8,
        "num_stages": 5,
        "num_warps": 16,
        "compile_time": 0.003097057342529297
    },
    {
        "BLOCK_SIZE_M": 16,
        "BLOCK_SIZE_N": 512,
        "BLOCK_SIZE_K": 128,
        "GROUP_SIZE_M": 8,
        "num_stages": 5,
        "num_warps": 32,
        "compile_time": 0.003003835678100586
    },
    {
        "BLOCK_SIZE_M": 16,
        "BLOCK_SIZE_N": 512,
        "BLOCK_SIZE_K": 128,
        "GROUP_SIZE_M": 8,
        "num_stages": 6,
        "num_warps": 2,
        "compile_time": 6.70157527923584
    },
    {
        "BLOCK_SIZE_M": 16,
        "BLOCK_SIZE_N": 512,
        "BLOCK_SIZE_K": 128,
        "GROUP_SIZE_M": 8,
        "num_stages": 6,
        "num_warps": 4,
        "compile_time": 11.2619469165802
    },
    {
        "BLOCK_SIZE_M": 16,
        "BLOCK_SIZE_N": 512,
        "BLOCK_SIZE_K": 128,
        "GROUP_SIZE_M": 8,
        "num_stages": 6,
        "num_warps": 8,
        "compile_time": 0.0041980743408203125
    },
    {
        "BLOCK_SIZE_M": 16,
        "BLOCK_SIZE_N": 512,
        "BLOCK_SIZE_K": 128,
        "GROUP_SIZE_M": 8,
        "num_stages": 6,
        "num_warps": 16,
        "compile_time": 0.004134178161621094
    },
    {
        "BLOCK_SIZE_M": 16,
        "BLOCK_SIZE_N": 512,
        "BLOCK_SIZE_K": 128,
        "GROUP_SIZE_M": 8,
        "num_stages": 6,
        "num_warps": 32,
        "compile_time": 0.0030846595764160156
    },
    {
        "BLOCK_SIZE_M": 16,
        "BLOCK_SIZE_N": 512,
        "BLOCK_SIZE_K": 128,
        "GROUP_SIZE_M": 8,
        "num_stages": 7,
        "num_warps": 2,
        "compile_time": 7.156475067138672
    },
    {
        "BLOCK_SIZE_M": 16,
        "BLOCK_SIZE_N": 512,
        "BLOCK_SIZE_K": 128,
        "GROUP_SIZE_M": 8,
        "num_stages": 7,
        "num_warps": 4,
        "compile_time": 11.452964782714844
    },
    {
        "BLOCK_SIZE_M": 16,
        "BLOCK_SIZE_N": 512,
        "BLOCK_SIZE_K": 128,
        "GROUP_SIZE_M": 8,
        "num_stages": 7,
        "num_warps": 8,
        "compile_time": 0.004624366760253906
    },
    {
        "BLOCK_SIZE_M": 16,
        "BLOCK_SIZE_N": 512,
        "BLOCK_SIZE_K": 128,
        "GROUP_SIZE_M": 8,
        "num_stages": 7,
        "num_warps": 16,
        "compile_time": 0.0031142234802246094
    },
    {
        "BLOCK_SIZE_M": 16,
        "BLOCK_SIZE_N": 512,
        "BLOCK_SIZE_K": 128,
        "GROUP_SIZE_M": 8,
        "num_stages": 7,
        "num_warps": 32,
        "compile_time": 0.0032210350036621094
    },
    {
        "BLOCK_SIZE_M": 16,
        "BLOCK_SIZE_N": 512,
        "BLOCK_SIZE_K": 128,
        "GROUP_SIZE_M": 8,
        "num_stages": 8,
        "num_warps": 2,
        "compile_time": 7.38853120803833
    },
    {
        "BLOCK_SIZE_M": 16,
        "BLOCK_SIZE_N": 512,
        "BLOCK_SIZE_K": 128,
        "GROUP_SIZE_M": 8,
        "num_stages": 8,
        "num_warps": 4,
        "compile_time": 11.73616647720337
    },
    {
        "BLOCK_SIZE_M": 16,
        "BLOCK_SIZE_N": 512,
        "BLOCK_SIZE_K": 128,
        "GROUP_SIZE_M": 8,
        "num_stages": 8,
        "num_warps": 8,
        "compile_time": 0.0042247772216796875
    },
    {
        "BLOCK_SIZE_M": 16,
        "BLOCK_SIZE_N": 512,
        "BLOCK_SIZE_K": 128,
        "GROUP_SIZE_M": 8,
        "num_stages": 8,
        "num_warps": 16,
        "compile_time": 0.0031616687774658203
    },
    {
        "BLOCK_SIZE_M": 16,
        "BLOCK_SIZE_N": 512,
        "BLOCK_SIZE_K": 128,
        "GROUP_SIZE_M": 8,
        "num_stages": 8,
        "num_warps": 32,
        "compile_time": 0.0030975341796875
    },
    {
        "BLOCK_SIZE_M": 16,
        "BLOCK_SIZE_N": 512,
        "BLOCK_SIZE_K": 256,
        "GROUP_SIZE_M": 8,
        "num_stages": 1,
        "num_warps": 2,
        "compile_time": 19.488056898117065
    },
    {
        "BLOCK_SIZE_M": 16,
        "BLOCK_SIZE_N": 512,
        "BLOCK_SIZE_K": 256,
        "GROUP_SIZE_M": 8,
        "num_stages": 1,
        "num_warps": 4,
        "compile_time": 7.94982647895813
    },
    {
        "BLOCK_SIZE_M": 16,
        "BLOCK_SIZE_N": 512,
        "BLOCK_SIZE_K": 256,
        "GROUP_SIZE_M": 8,
        "num_stages": 1,
        "num_warps": 8,
        "compile_time": 0.003739595413208008
    },
    {
        "BLOCK_SIZE_M": 16,
        "BLOCK_SIZE_N": 512,
        "BLOCK_SIZE_K": 256,
        "GROUP_SIZE_M": 8,
        "num_stages": 1,
        "num_warps": 16,
        "compile_time": 0.0029358863830566406
    },
    {
        "BLOCK_SIZE_M": 16,
        "BLOCK_SIZE_N": 512,
        "BLOCK_SIZE_K": 256,
        "GROUP_SIZE_M": 8,
        "num_stages": 1,
        "num_warps": 32,
        "compile_time": 0.0038313865661621094
    },
    {
        "BLOCK_SIZE_M": 16,
        "BLOCK_SIZE_N": 512,
        "BLOCK_SIZE_K": 256,
        "GROUP_SIZE_M": 8,
        "num_stages": 2,
        "num_warps": 2,
        "compile_time": 19.386623859405518
    },
    {
        "BLOCK_SIZE_M": 16,
        "BLOCK_SIZE_N": 512,
        "BLOCK_SIZE_K": 256,
        "GROUP_SIZE_M": 8,
        "num_stages": 2,
        "num_warps": 4,
        "compile_time": 7.831722736358643
    },
    {
        "BLOCK_SIZE_M": 16,
        "BLOCK_SIZE_N": 512,
        "BLOCK_SIZE_K": 256,
        "GROUP_SIZE_M": 8,
        "num_stages": 2,
        "num_warps": 8,
        "compile_time": 0.003871917724609375
    },
    {
        "BLOCK_SIZE_M": 16,
        "BLOCK_SIZE_N": 512,
        "BLOCK_SIZE_K": 256,
        "GROUP_SIZE_M": 8,
        "num_stages": 2,
        "num_warps": 16,
        "compile_time": 0.002887248992919922
    },
    {
        "BLOCK_SIZE_M": 16,
        "BLOCK_SIZE_N": 512,
        "BLOCK_SIZE_K": 256,
        "GROUP_SIZE_M": 8,
        "num_stages": 2,
        "num_warps": 32,
        "compile_time": 0.002838611602783203
    },
    {
        "BLOCK_SIZE_M": 16,
        "BLOCK_SIZE_N": 512,
        "BLOCK_SIZE_K": 256,
        "GROUP_SIZE_M": 8,
        "num_stages": 3,
        "num_warps": 2,
        "compile_time": 20.28465509414673
    },
    {
        "BLOCK_SIZE_M": 16,
        "BLOCK_SIZE_N": 512,
        "BLOCK_SIZE_K": 256,
        "GROUP_SIZE_M": 8,
        "num_stages": 3,
        "num_warps": 4,
        "compile_time": 99.73227071762085
    },
    {
        "BLOCK_SIZE_M": 16,
        "BLOCK_SIZE_N": 512,
        "BLOCK_SIZE_K": 256,
        "GROUP_SIZE_M": 8,
        "num_stages": 3,
        "num_warps": 8,
        "compile_time": 10.774178743362427
    },
    {
        "BLOCK_SIZE_M": 16,
        "BLOCK_SIZE_N": 512,
        "BLOCK_SIZE_K": 256,
        "GROUP_SIZE_M": 8,
        "num_stages": 3,
        "num_warps": 16,
        "compile_time": 0.0039825439453125
    },
    {
        "BLOCK_SIZE_M": 16,
        "BLOCK_SIZE_N": 512,
        "BLOCK_SIZE_K": 256,
        "GROUP_SIZE_M": 8,
        "num_stages": 3,
        "num_warps": 32,
        "compile_time": 0.002866983413696289
    },
    {
        "BLOCK_SIZE_M": 16,
        "BLOCK_SIZE_N": 512,
        "BLOCK_SIZE_K": 256,
        "GROUP_SIZE_M": 8,
        "num_stages": 4,
        "num_warps": 2,
        "compile_time": 21.041255712509155
    },
    {
        "BLOCK_SIZE_M": 16,
        "BLOCK_SIZE_N": 512,
        "BLOCK_SIZE_K": 256,
        "GROUP_SIZE_M": 8,
        "num_stages": 4,
        "num_warps": 4,
        "compile_time": 6.187742471694946
    },
    {
        "BLOCK_SIZE_M": 16,
        "BLOCK_SIZE_N": 512,
        "BLOCK_SIZE_K": 256,
        "GROUP_SIZE_M": 8,
        "num_stages": 4,
        "num_warps": 8,
        "compile_time": 10.862579822540283
    },
    {
        "BLOCK_SIZE_M": 16,
        "BLOCK_SIZE_N": 512,
        "BLOCK_SIZE_K": 256,
        "GROUP_SIZE_M": 8,
        "num_stages": 4,
        "num_warps": 16,
        "compile_time": 0.005507707595825195
    },
    {
        "BLOCK_SIZE_M": 16,
        "BLOCK_SIZE_N": 512,
        "BLOCK_SIZE_K": 256,
        "GROUP_SIZE_M": 8,
        "num_stages": 4,
        "num_warps": 32,
        "compile_time": 0.002894878387451172
    },
    {
        "BLOCK_SIZE_M": 16,
        "BLOCK_SIZE_N": 512,
        "BLOCK_SIZE_K": 256,
        "GROUP_SIZE_M": 8,
        "num_stages": 5,
        "num_warps": 2,
        "compile_time": 21.651743173599243
    },
    {
        "BLOCK_SIZE_M": 16,
        "BLOCK_SIZE_N": 512,
        "BLOCK_SIZE_K": 256,
        "GROUP_SIZE_M": 8,
        "num_stages": 5,
        "num_warps": 4,
        "compile_time": 6.453063726425171
    },
    {
        "BLOCK_SIZE_M": 16,
        "BLOCK_SIZE_N": 512,
        "BLOCK_SIZE_K": 256,
        "GROUP_SIZE_M": 8,
        "num_stages": 5,
        "num_warps": 8,
        "compile_time": 11.212146759033203
    },
    {
        "BLOCK_SIZE_M": 16,
        "BLOCK_SIZE_N": 512,
        "BLOCK_SIZE_K": 256,
        "GROUP_SIZE_M": 8,
        "num_stages": 5,
        "num_warps": 16,
        "compile_time": 0.004137754440307617
    },
    {
        "BLOCK_SIZE_M": 16,
        "BLOCK_SIZE_N": 512,
        "BLOCK_SIZE_K": 256,
        "GROUP_SIZE_M": 8,
        "num_stages": 5,
        "num_warps": 32,
        "compile_time": 0.0034580230712890625
    },
    {
        "BLOCK_SIZE_M": 16,
        "BLOCK_SIZE_N": 512,
        "BLOCK_SIZE_K": 256,
        "GROUP_SIZE_M": 8,
        "num_stages": 6,
        "num_warps": 2,
        "compile_time": 22.717817068099976
    },
    {
        "BLOCK_SIZE_M": 16,
        "BLOCK_SIZE_N": 512,
        "BLOCK_SIZE_K": 256,
        "GROUP_SIZE_M": 8,
        "num_stages": 6,
        "num_warps": 4,
        "compile_time": 7.023933172225952
    },
    {
        "BLOCK_SIZE_M": 16,
        "BLOCK_SIZE_N": 512,
        "BLOCK_SIZE_K": 256,
        "GROUP_SIZE_M": 8,
        "num_stages": 6,
        "num_warps": 8,
        "compile_time": 11.530202388763428
    },
    {
        "BLOCK_SIZE_M": 16,
        "BLOCK_SIZE_N": 512,
        "BLOCK_SIZE_K": 256,
        "GROUP_SIZE_M": 8,
        "num_stages": 6,
        "num_warps": 16,
        "compile_time": 0.003862619400024414
    },
    {
        "BLOCK_SIZE_M": 16,
        "BLOCK_SIZE_N": 512,
        "BLOCK_SIZE_K": 256,
        "GROUP_SIZE_M": 8,
        "num_stages": 6,
        "num_warps": 32,
        "compile_time": 0.0029213428497314453
    },
    {
        "BLOCK_SIZE_M": 16,
        "BLOCK_SIZE_N": 512,
        "BLOCK_SIZE_K": 256,
        "GROUP_SIZE_M": 8,
        "num_stages": 7,
        "num_warps": 2,
        "compile_time": 23.527390241622925
    },
    {
        "BLOCK_SIZE_M": 16,
        "BLOCK_SIZE_N": 512,
        "BLOCK_SIZE_K": 256,
        "GROUP_SIZE_M": 8,
        "num_stages": 7,
        "num_warps": 4,
        "compile_time": 7.465877532958984
    },
    {
        "BLOCK_SIZE_M": 16,
        "BLOCK_SIZE_N": 512,
        "BLOCK_SIZE_K": 256,
        "GROUP_SIZE_M": 8,
        "num_stages": 7,
        "num_warps": 8,
        "compile_time": 11.642918825149536
    },
    {
        "BLOCK_SIZE_M": 16,
        "BLOCK_SIZE_N": 512,
        "BLOCK_SIZE_K": 256,
        "GROUP_SIZE_M": 8,
        "num_stages": 7,
        "num_warps": 16,
        "compile_time": 0.003920555114746094
    },
    {
        "BLOCK_SIZE_M": 16,
        "BLOCK_SIZE_N": 512,
        "BLOCK_SIZE_K": 256,
        "GROUP_SIZE_M": 8,
        "num_stages": 7,
        "num_warps": 32,
        "compile_time": 0.002902507781982422
    },
    {
        "BLOCK_SIZE_M": 16,
        "BLOCK_SIZE_N": 512,
        "BLOCK_SIZE_K": 256,
        "GROUP_SIZE_M": 8,
        "num_stages": 8,
        "num_warps": 2,
        "compile_time": 6.113095045089722
    },
    {
        "BLOCK_SIZE_M": 16,
        "BLOCK_SIZE_N": 512,
        "BLOCK_SIZE_K": 256,
        "GROUP_SIZE_M": 8,
        "num_stages": 8,
        "num_warps": 4,
        "compile_time": 7.700333118438721
    },
    {
        "BLOCK_SIZE_M": 16,
        "BLOCK_SIZE_N": 512,
        "BLOCK_SIZE_K": 256,
        "GROUP_SIZE_M": 8,
        "num_stages": 8,
        "num_warps": 8,
        "compile_time": 12.199937105178833
    },
    {
        "BLOCK_SIZE_M": 16,
        "BLOCK_SIZE_N": 512,
        "BLOCK_SIZE_K": 256,
        "GROUP_SIZE_M": 8,
        "num_stages": 8,
        "num_warps": 16,
        "compile_time": 0.0044841766357421875
    },
    {
        "BLOCK_SIZE_M": 16,
        "BLOCK_SIZE_N": 512,
        "BLOCK_SIZE_K": 256,
        "GROUP_SIZE_M": 8,
        "num_stages": 8,
        "num_warps": 32,
        "compile_time": 0.0029153823852539062
    },
    {
        "BLOCK_SIZE_M": 16,
        "BLOCK_SIZE_N": 512,
        "BLOCK_SIZE_K": 512,
        "GROUP_SIZE_M": 8,
        "num_stages": 1,
        "num_warps": 2,
        "compile_time": 73.46690154075623
    },
    {
        "BLOCK_SIZE_M": 16,
        "BLOCK_SIZE_N": 512,
        "BLOCK_SIZE_K": 512,
        "GROUP_SIZE_M": 8,
        "num_stages": 1,
        "num_warps": 4,
        "compile_time": 19.403674125671387
    },
    {
        "BLOCK_SIZE_M": 16,
        "BLOCK_SIZE_N": 512,
        "BLOCK_SIZE_K": 512,
        "GROUP_SIZE_M": 8,
        "num_stages": 1,
        "num_warps": 8,
        "compile_time": 7.910815954208374
    },
    {
        "BLOCK_SIZE_M": 16,
        "BLOCK_SIZE_N": 512,
        "BLOCK_SIZE_K": 512,
        "GROUP_SIZE_M": 8,
        "num_stages": 1,
        "num_warps": 16,
        "compile_time": 0.004017829895019531
    },
    {
        "BLOCK_SIZE_M": 16,
        "BLOCK_SIZE_N": 512,
        "BLOCK_SIZE_K": 512,
        "GROUP_SIZE_M": 8,
        "num_stages": 1,
        "num_warps": 32,
        "compile_time": 0.004109859466552734
    },
    {
        "BLOCK_SIZE_M": 16,
        "BLOCK_SIZE_N": 512,
        "BLOCK_SIZE_K": 512,
        "GROUP_SIZE_M": 8,
        "num_stages": 2,
        "num_warps": 2,
        "compile_time": 73.49552059173584
    },
    {
        "BLOCK_SIZE_M": 16,
        "BLOCK_SIZE_N": 512,
        "BLOCK_SIZE_K": 512,
        "GROUP_SIZE_M": 8,
        "num_stages": 2,
        "num_warps": 4,
        "compile_time": 19.58526372909546
    },
    {
        "BLOCK_SIZE_M": 16,
        "BLOCK_SIZE_N": 512,
        "BLOCK_SIZE_K": 512,
        "GROUP_SIZE_M": 8,
        "num_stages": 2,
        "num_warps": 8,
        "compile_time": 7.9989659786224365
    },
    {
        "BLOCK_SIZE_M": 16,
        "BLOCK_SIZE_N": 512,
        "BLOCK_SIZE_K": 512,
        "GROUP_SIZE_M": 8,
        "num_stages": 2,
        "num_warps": 16,
        "compile_time": 0.004250288009643555
    },
    {
        "BLOCK_SIZE_M": 16,
        "BLOCK_SIZE_N": 512,
        "BLOCK_SIZE_K": 512,
        "GROUP_SIZE_M": 8,
        "num_stages": 2,
        "num_warps": 32,
        "compile_time": 0.002939939498901367
    },
    {
        "BLOCK_SIZE_M": 16,
        "BLOCK_SIZE_N": 512,
        "BLOCK_SIZE_K": 512,
        "GROUP_SIZE_M": 8,
        "num_stages": 3,
        "num_warps": 2,
        "compile_time": 7.0354979038238525
    },
    {
        "BLOCK_SIZE_M": 16,
        "BLOCK_SIZE_N": 512,
        "BLOCK_SIZE_K": 512,
        "GROUP_SIZE_M": 8,
        "num_stages": 3,
        "num_warps": 4,
        "compile_time": 20.331827402114868
    },
    {
        "BLOCK_SIZE_M": 16,
        "BLOCK_SIZE_N": 512,
        "BLOCK_SIZE_K": 512,
        "GROUP_SIZE_M": 8,
        "num_stages": 3,
        "num_warps": 8,
        "compile_time": 6.032454252243042
    },
    {
        "BLOCK_SIZE_M": 16,
        "BLOCK_SIZE_N": 512,
        "BLOCK_SIZE_K": 512,
        "GROUP_SIZE_M": 8,
        "num_stages": 3,
        "num_warps": 16,
        "compile_time": 10.814533948898315
    },
    {
        "BLOCK_SIZE_M": 16,
        "BLOCK_SIZE_N": 512,
        "BLOCK_SIZE_K": 512,
        "GROUP_SIZE_M": 8,
        "num_stages": 3,
        "num_warps": 32,
        "compile_time": 0.003712177276611328
    },
    {
        "BLOCK_SIZE_M": 16,
        "BLOCK_SIZE_N": 512,
        "BLOCK_SIZE_K": 512,
        "GROUP_SIZE_M": 8,
        "num_stages": 4,
        "num_warps": 2,
        "compile_time": 8.557259798049927
    },
    {
        "BLOCK_SIZE_M": 16,
        "BLOCK_SIZE_N": 512,
        "BLOCK_SIZE_K": 512,
        "GROUP_SIZE_M": 8,
        "num_stages": 4,
        "num_warps": 4,
        "compile_time": 21.470749139785767
    },
    {
        "BLOCK_SIZE_M": 16,
        "BLOCK_SIZE_N": 512,
        "BLOCK_SIZE_K": 512,
        "GROUP_SIZE_M": 8,
        "num_stages": 4,
        "num_warps": 8,
        "compile_time": 6.524410724639893
    },
    {
        "BLOCK_SIZE_M": 16,
        "BLOCK_SIZE_N": 512,
        "BLOCK_SIZE_K": 512,
        "GROUP_SIZE_M": 8,
        "num_stages": 4,
        "num_warps": 16,
        "compile_time": 11.165866613388062
    },
    {
        "BLOCK_SIZE_M": 16,
        "BLOCK_SIZE_N": 512,
        "BLOCK_SIZE_K": 512,
        "GROUP_SIZE_M": 8,
        "num_stages": 4,
        "num_warps": 32,
        "compile_time": 0.004024505615234375
    },
    {
        "BLOCK_SIZE_M": 16,
        "BLOCK_SIZE_N": 512,
        "BLOCK_SIZE_K": 512,
        "GROUP_SIZE_M": 8,
        "num_stages": 5,
        "num_warps": 2,
        "compile_time": 10.361607551574707
    },
    {
        "BLOCK_SIZE_M": 16,
        "BLOCK_SIZE_N": 512,
        "BLOCK_SIZE_K": 512,
        "GROUP_SIZE_M": 8,
        "num_stages": 5,
        "num_warps": 4,
        "compile_time": 22.09902811050415
    },
    {
        "BLOCK_SIZE_M": 16,
        "BLOCK_SIZE_N": 512,
        "BLOCK_SIZE_K": 512,
        "GROUP_SIZE_M": 8,
        "num_stages": 5,
        "num_warps": 8,
        "compile_time": 6.8635265827178955
    },
    {
        "BLOCK_SIZE_M": 16,
        "BLOCK_SIZE_N": 512,
        "BLOCK_SIZE_K": 512,
        "GROUP_SIZE_M": 8,
        "num_stages": 5,
        "num_warps": 16,
        "compile_time": 11.3210289478302
    },
    {
        "BLOCK_SIZE_M": 16,
        "BLOCK_SIZE_N": 512,
        "BLOCK_SIZE_K": 512,
        "GROUP_SIZE_M": 8,
        "num_stages": 5,
        "num_warps": 32,
        "compile_time": 0.003953456878662109
    },
    {
        "BLOCK_SIZE_M": 16,
        "BLOCK_SIZE_N": 512,
        "BLOCK_SIZE_K": 512,
        "GROUP_SIZE_M": 8,
        "num_stages": 6,
        "num_warps": 2,
        "compile_time": 11.994845390319824
    },
    {
        "BLOCK_SIZE_M": 16,
        "BLOCK_SIZE_N": 512,
        "BLOCK_SIZE_K": 512,
        "GROUP_SIZE_M": 8,
        "num_stages": 6,
        "num_warps": 4,
        "compile_time": 22.65009307861328
    },
    {
        "BLOCK_SIZE_M": 16,
        "BLOCK_SIZE_N": 512,
        "BLOCK_SIZE_K": 512,
        "GROUP_SIZE_M": 8,
        "num_stages": 6,
        "num_warps": 8,
        "compile_time": 7.2521891593933105
    },
    {
        "BLOCK_SIZE_M": 16,
        "BLOCK_SIZE_N": 512,
        "BLOCK_SIZE_K": 512,
        "GROUP_SIZE_M": 8,
        "num_stages": 6,
        "num_warps": 16,
        "compile_time": 11.65808367729187
    },
    {
        "BLOCK_SIZE_M": 16,
        "BLOCK_SIZE_N": 512,
        "BLOCK_SIZE_K": 512,
        "GROUP_SIZE_M": 8,
        "num_stages": 6,
        "num_warps": 32,
        "compile_time": 0.004026651382446289
    },
    {
        "BLOCK_SIZE_M": 16,
        "BLOCK_SIZE_N": 512,
        "BLOCK_SIZE_K": 512,
        "GROUP_SIZE_M": 8,
        "num_stages": 7,
        "num_warps": 2,
        "compile_time": 13.926683902740479
    },
    {
        "BLOCK_SIZE_M": 16,
        "BLOCK_SIZE_N": 512,
        "BLOCK_SIZE_K": 512,
        "GROUP_SIZE_M": 8,
        "num_stages": 7,
        "num_warps": 4,
        "compile_time": 6.043569326400757
    },
    {
        "BLOCK_SIZE_M": 16,
        "BLOCK_SIZE_N": 512,
        "BLOCK_SIZE_K": 512,
        "GROUP_SIZE_M": 8,
        "num_stages": 7,
        "num_warps": 8,
        "compile_time": 7.760305166244507
    },
    {
        "BLOCK_SIZE_M": 16,
        "BLOCK_SIZE_N": 512,
        "BLOCK_SIZE_K": 512,
        "GROUP_SIZE_M": 8,
        "num_stages": 7,
        "num_warps": 16,
        "compile_time": 11.715719938278198
    },
    {
        "BLOCK_SIZE_M": 16,
        "BLOCK_SIZE_N": 512,
        "BLOCK_SIZE_K": 512,
        "GROUP_SIZE_M": 8,
        "num_stages": 7,
        "num_warps": 32,
        "compile_time": 0.003947257995605469
    },
    {
        "BLOCK_SIZE_M": 16,
        "BLOCK_SIZE_N": 512,
        "BLOCK_SIZE_K": 512,
        "GROUP_SIZE_M": 8,
        "num_stages": 8,
        "num_warps": 2,
        "compile_time": 15.751489877700806
    },
    {
        "BLOCK_SIZE_M": 16,
        "BLOCK_SIZE_N": 512,
        "BLOCK_SIZE_K": 512,
        "GROUP_SIZE_M": 8,
        "num_stages": 8,
        "num_warps": 4,
        "compile_time": 6.7628772258758545
    },
    {
        "BLOCK_SIZE_M": 16,
        "BLOCK_SIZE_N": 512,
        "BLOCK_SIZE_K": 512,
        "GROUP_SIZE_M": 8,
        "num_stages": 8,
        "num_warps": 8,
        "compile_time": 8.166871309280396
    },
    {
        "BLOCK_SIZE_M": 16,
        "BLOCK_SIZE_N": 512,
        "BLOCK_SIZE_K": 512,
        "GROUP_SIZE_M": 8,
        "num_stages": 8,
        "num_warps": 16,
        "compile_time": 11.832589626312256
    },
    {
        "BLOCK_SIZE_M": 16,
        "BLOCK_SIZE_N": 512,
        "BLOCK_SIZE_K": 512,
        "GROUP_SIZE_M": 8,
        "num_stages": 8,
        "num_warps": 32,
        "compile_time": 0.003857135772705078
    },
    {
        "BLOCK_SIZE_M": 32,
        "BLOCK_SIZE_N": 16,
        "BLOCK_SIZE_K": 256,
        "GROUP_SIZE_M": 8,
        "num_stages": 8,
        "num_warps": 2,
        "compile_time": 1.4653687477111816
    },
    {
        "BLOCK_SIZE_M": 32,
        "BLOCK_SIZE_N": 16,
        "BLOCK_SIZE_K": 256,
        "GROUP_SIZE_M": 8,
        "num_stages": 8,
        "num_warps": 4,
        "compile_time": 0.9083178043365479
    },
    {
        "BLOCK_SIZE_M": 32,
        "BLOCK_SIZE_N": 16,
        "BLOCK_SIZE_K": 256,
        "GROUP_SIZE_M": 8,
        "num_stages": 8,
        "num_warps": 8,
        "compile_time": 0.6818521022796631
    },
    {
        "BLOCK_SIZE_M": 32,
        "BLOCK_SIZE_N": 16,
        "BLOCK_SIZE_K": 256,
        "GROUP_SIZE_M": 8,
        "num_stages": 8,
        "num_warps": 16,
        "compile_time": 0.5755338668823242
    },
    {
        "BLOCK_SIZE_M": 32,
        "BLOCK_SIZE_N": 16,
        "BLOCK_SIZE_K": 256,
        "GROUP_SIZE_M": 8,
        "num_stages": 8,
        "num_warps": 32,
        "compile_time": 0.5444440841674805
    },
    {
        "BLOCK_SIZE_M": 32,
        "BLOCK_SIZE_N": 16,
        "BLOCK_SIZE_K": 512,
        "GROUP_SIZE_M": 8,
        "num_stages": 5,
        "num_warps": 2,
        "compile_time": 2.6845741271972656
    },
    {
        "BLOCK_SIZE_M": 32,
        "BLOCK_SIZE_N": 16,
        "BLOCK_SIZE_K": 512,
        "GROUP_SIZE_M": 8,
        "num_stages": 5,
        "num_warps": 4,
        "compile_time": 1.2712900638580322
    },
    {
        "BLOCK_SIZE_M": 32,
        "BLOCK_SIZE_N": 16,
        "BLOCK_SIZE_K": 512,
        "GROUP_SIZE_M": 8,
        "num_stages": 5,
        "num_warps": 8,
        "compile_time": 0.8631460666656494
    },
    {
        "BLOCK_SIZE_M": 32,
        "BLOCK_SIZE_N": 16,
        "BLOCK_SIZE_K": 512,
        "GROUP_SIZE_M": 8,
        "num_stages": 5,
        "num_warps": 16,
        "compile_time": 0.7017316818237305
    },
    {
        "BLOCK_SIZE_M": 32,
        "BLOCK_SIZE_N": 16,
        "BLOCK_SIZE_K": 512,
        "GROUP_SIZE_M": 8,
        "num_stages": 5,
        "num_warps": 32,
        "compile_time": 0.6524233818054199
    },
    {
        "BLOCK_SIZE_M": 32,
        "BLOCK_SIZE_N": 16,
        "BLOCK_SIZE_K": 512,
        "GROUP_SIZE_M": 8,
        "num_stages": 6,
        "num_warps": 2,
        "compile_time": 2.866424560546875
    },
    {
        "BLOCK_SIZE_M": 32,
        "BLOCK_SIZE_N": 16,
        "BLOCK_SIZE_K": 512,
        "GROUP_SIZE_M": 8,
        "num_stages": 6,
        "num_warps": 4,
        "compile_time": 1.3707776069641113
    },
    {
        "BLOCK_SIZE_M": 32,
        "BLOCK_SIZE_N": 16,
        "BLOCK_SIZE_K": 512,
        "GROUP_SIZE_M": 8,
        "num_stages": 6,
        "num_warps": 8,
        "compile_time": 0.9106202125549316
    },
    {
        "BLOCK_SIZE_M": 32,
        "BLOCK_SIZE_N": 16,
        "BLOCK_SIZE_K": 512,
        "GROUP_SIZE_M": 8,
        "num_stages": 6,
        "num_warps": 16,
        "compile_time": 0.7252814769744873
    },
    {
        "BLOCK_SIZE_M": 32,
        "BLOCK_SIZE_N": 16,
        "BLOCK_SIZE_K": 512,
        "GROUP_SIZE_M": 8,
        "num_stages": 6,
        "num_warps": 32,
        "compile_time": 0.6485602855682373
    },
    {
        "BLOCK_SIZE_M": 32,
        "BLOCK_SIZE_N": 16,
        "BLOCK_SIZE_K": 512,
        "GROUP_SIZE_M": 8,
        "num_stages": 7,
        "num_warps": 2,
        "compile_time": 3.077024459838867
    },
    {
        "BLOCK_SIZE_M": 32,
        "BLOCK_SIZE_N": 16,
        "BLOCK_SIZE_K": 512,
        "GROUP_SIZE_M": 8,
        "num_stages": 7,
        "num_warps": 4,
        "compile_time": 1.4549083709716797
    },
    {
        "BLOCK_SIZE_M": 32,
        "BLOCK_SIZE_N": 16,
        "BLOCK_SIZE_K": 512,
        "GROUP_SIZE_M": 8,
        "num_stages": 7,
        "num_warps": 8,
        "compile_time": 0.9584140777587891
    },
    {
        "BLOCK_SIZE_M": 32,
        "BLOCK_SIZE_N": 16,
        "BLOCK_SIZE_K": 512,
        "GROUP_SIZE_M": 8,
        "num_stages": 7,
        "num_warps": 16,
        "compile_time": 0.7683110237121582
    },
    {
        "BLOCK_SIZE_M": 32,
        "BLOCK_SIZE_N": 16,
        "BLOCK_SIZE_K": 512,
        "GROUP_SIZE_M": 8,
        "num_stages": 7,
        "num_warps": 32,
        "compile_time": 0.667374849319458
    },
    {
        "BLOCK_SIZE_M": 32,
        "BLOCK_SIZE_N": 16,
        "BLOCK_SIZE_K": 512,
        "GROUP_SIZE_M": 8,
        "num_stages": 8,
        "num_warps": 2,
        "compile_time": 3.2051525115966797
    },
    {
        "BLOCK_SIZE_M": 32,
        "BLOCK_SIZE_N": 16,
        "BLOCK_SIZE_K": 512,
        "GROUP_SIZE_M": 8,
        "num_stages": 8,
        "num_warps": 4,
        "compile_time": 1.5473344326019287
    },
    {
        "BLOCK_SIZE_M": 32,
        "BLOCK_SIZE_N": 16,
        "BLOCK_SIZE_K": 512,
        "GROUP_SIZE_M": 8,
        "num_stages": 8,
        "num_warps": 8,
        "compile_time": 1.0158147811889648
    },
    {
        "BLOCK_SIZE_M": 32,
        "BLOCK_SIZE_N": 16,
        "BLOCK_SIZE_K": 512,
        "GROUP_SIZE_M": 8,
        "num_stages": 8,
        "num_warps": 16,
        "compile_time": 0.7921264171600342
    },
    {
        "BLOCK_SIZE_M": 32,
        "BLOCK_SIZE_N": 16,
        "BLOCK_SIZE_K": 512,
        "GROUP_SIZE_M": 8,
        "num_stages": 8,
        "num_warps": 32,
        "compile_time": 0.6807243824005127
    },
    {
        "BLOCK_SIZE_M": 32,
        "BLOCK_SIZE_N": 32,
        "BLOCK_SIZE_K": 256,
        "GROUP_SIZE_M": 8,
        "num_stages": 7,
        "num_warps": 2,
        "compile_time": 1.7845873832702637
    },
    {
        "BLOCK_SIZE_M": 32,
        "BLOCK_SIZE_N": 32,
        "BLOCK_SIZE_K": 256,
        "GROUP_SIZE_M": 8,
        "num_stages": 7,
        "num_warps": 4,
        "compile_time": 1.035902738571167
    },
    {
        "BLOCK_SIZE_M": 32,
        "BLOCK_SIZE_N": 32,
        "BLOCK_SIZE_K": 256,
        "GROUP_SIZE_M": 8,
        "num_stages": 7,
        "num_warps": 8,
        "compile_time": 0.706984281539917
    },
    {
        "BLOCK_SIZE_M": 32,
        "BLOCK_SIZE_N": 32,
        "BLOCK_SIZE_K": 256,
        "GROUP_SIZE_M": 8,
        "num_stages": 7,
        "num_warps": 16,
        "compile_time": 0.5914342403411865
    },
    {
        "BLOCK_SIZE_M": 32,
        "BLOCK_SIZE_N": 32,
        "BLOCK_SIZE_K": 256,
        "GROUP_SIZE_M": 8,
        "num_stages": 7,
        "num_warps": 32,
        "compile_time": 0.5658199787139893
    },
    {
        "BLOCK_SIZE_M": 32,
        "BLOCK_SIZE_N": 32,
        "BLOCK_SIZE_K": 256,
        "GROUP_SIZE_M": 8,
        "num_stages": 8,
        "num_warps": 2,
        "compile_time": 1.8592510223388672
    },
    {
        "BLOCK_SIZE_M": 32,
        "BLOCK_SIZE_N": 32,
        "BLOCK_SIZE_K": 256,
        "GROUP_SIZE_M": 8,
        "num_stages": 8,
        "num_warps": 4,
        "compile_time": 1.1031053066253662
    },
    {
        "BLOCK_SIZE_M": 32,
        "BLOCK_SIZE_N": 32,
        "BLOCK_SIZE_K": 256,
        "GROUP_SIZE_M": 8,
        "num_stages": 8,
        "num_warps": 8,
        "compile_time": 0.7405221462249756
    },
    {
        "BLOCK_SIZE_M": 32,
        "BLOCK_SIZE_N": 32,
        "BLOCK_SIZE_K": 256,
        "GROUP_SIZE_M": 8,
        "num_stages": 8,
        "num_warps": 16,
        "compile_time": 0.5913958549499512
    },
    {
        "BLOCK_SIZE_M": 32,
        "BLOCK_SIZE_N": 32,
        "BLOCK_SIZE_K": 256,
        "GROUP_SIZE_M": 8,
        "num_stages": 8,
        "num_warps": 32,
        "compile_time": 0.5051052570343018
    },
    {
        "BLOCK_SIZE_M": 32,
        "BLOCK_SIZE_N": 32,
        "BLOCK_SIZE_K": 512,
        "GROUP_SIZE_M": 8,
        "num_stages": 4,
        "num_warps": 2,
        "compile_time": 3.7692112922668457
    },
    {
        "BLOCK_SIZE_M": 32,
        "BLOCK_SIZE_N": 32,
        "BLOCK_SIZE_K": 512,
        "GROUP_SIZE_M": 8,
        "num_stages": 4,
        "num_warps": 4,
        "compile_time": 1.499290943145752
    },
    {
        "BLOCK_SIZE_M": 32,
        "BLOCK_SIZE_N": 32,
        "BLOCK_SIZE_K": 512,
        "GROUP_SIZE_M": 8,
        "num_stages": 4,
        "num_warps": 8,
        "compile_time": 0.9327297210693359
    },
    {
        "BLOCK_SIZE_M": 32,
        "BLOCK_SIZE_N": 32,
        "BLOCK_SIZE_K": 512,
        "GROUP_SIZE_M": 8,
        "num_stages": 4,
        "num_warps": 16,
        "compile_time": 0.7259564399719238
    },
    {
        "BLOCK_SIZE_M": 32,
        "BLOCK_SIZE_N": 32,
        "BLOCK_SIZE_K": 512,
        "GROUP_SIZE_M": 8,
        "num_stages": 4,
        "num_warps": 32,
        "compile_time": 0.6202609539031982
    },
    {
        "BLOCK_SIZE_M": 32,
        "BLOCK_SIZE_N": 32,
        "BLOCK_SIZE_K": 512,
        "GROUP_SIZE_M": 8,
        "num_stages": 5,
        "num_warps": 2,
        "compile_time": 3.9830713272094727
    },
    {
        "BLOCK_SIZE_M": 32,
        "BLOCK_SIZE_N": 32,
        "BLOCK_SIZE_K": 512,
        "GROUP_SIZE_M": 8,
        "num_stages": 5,
        "num_warps": 4,
        "compile_time": 1.614464521408081
    },
    {
        "BLOCK_SIZE_M": 32,
        "BLOCK_SIZE_N": 32,
        "BLOCK_SIZE_K": 512,
        "GROUP_SIZE_M": 8,
        "num_stages": 5,
        "num_warps": 8,
        "compile_time": 0.9834749698638916
    },
    {
        "BLOCK_SIZE_M": 32,
        "BLOCK_SIZE_N": 32,
        "BLOCK_SIZE_K": 512,
        "GROUP_SIZE_M": 8,
        "num_stages": 5,
        "num_warps": 16,
        "compile_time": 0.7644398212432861
    },
    {
        "BLOCK_SIZE_M": 32,
        "BLOCK_SIZE_N": 32,
        "BLOCK_SIZE_K": 512,
        "GROUP_SIZE_M": 8,
        "num_stages": 5,
        "num_warps": 32,
        "compile_time": 0.6490762233734131
    },
    {
        "BLOCK_SIZE_M": 32,
        "BLOCK_SIZE_N": 32,
        "BLOCK_SIZE_K": 512,
        "GROUP_SIZE_M": 8,
        "num_stages": 6,
        "num_warps": 2,
        "compile_time": 4.189380645751953
    },
    {
        "BLOCK_SIZE_M": 32,
        "BLOCK_SIZE_N": 32,
        "BLOCK_SIZE_K": 512,
        "GROUP_SIZE_M": 8,
        "num_stages": 6,
        "num_warps": 4,
        "compile_time": 1.7171869277954102
    },
    {
        "BLOCK_SIZE_M": 32,
        "BLOCK_SIZE_N": 32,
        "BLOCK_SIZE_K": 512,
        "GROUP_SIZE_M": 8,
        "num_stages": 6,
        "num_warps": 8,
        "compile_time": 1.037034511566162
    },
    {
        "BLOCK_SIZE_M": 32,
        "BLOCK_SIZE_N": 32,
        "BLOCK_SIZE_K": 512,
        "GROUP_SIZE_M": 8,
        "num_stages": 6,
        "num_warps": 16,
        "compile_time": 0.7911412715911865
    },
    {
        "BLOCK_SIZE_M": 32,
        "BLOCK_SIZE_N": 32,
        "BLOCK_SIZE_K": 512,
        "GROUP_SIZE_M": 8,
        "num_stages": 6,
        "num_warps": 32,
        "compile_time": 0.6722686290740967
    },
    {
        "BLOCK_SIZE_M": 32,
        "BLOCK_SIZE_N": 32,
        "BLOCK_SIZE_K": 512,
        "GROUP_SIZE_M": 8,
        "num_stages": 7,
        "num_warps": 2,
        "compile_time": 4.389084100723267
    },
    {
        "BLOCK_SIZE_M": 32,
        "BLOCK_SIZE_N": 32,
        "BLOCK_SIZE_K": 512,
        "GROUP_SIZE_M": 8,
        "num_stages": 7,
        "num_warps": 4,
        "compile_time": 1.8802719116210938
    },
    {
        "BLOCK_SIZE_M": 32,
        "BLOCK_SIZE_N": 32,
        "BLOCK_SIZE_K": 512,
        "GROUP_SIZE_M": 8,
        "num_stages": 7,
        "num_warps": 8,
        "compile_time": 1.1173620223999023
    },
    {
        "BLOCK_SIZE_M": 32,
        "BLOCK_SIZE_N": 32,
        "BLOCK_SIZE_K": 512,
        "GROUP_SIZE_M": 8,
        "num_stages": 7,
        "num_warps": 16,
        "compile_time": 0.843299150466919
    },
    {
        "BLOCK_SIZE_M": 32,
        "BLOCK_SIZE_N": 32,
        "BLOCK_SIZE_K": 512,
        "GROUP_SIZE_M": 8,
        "num_stages": 7,
        "num_warps": 32,
        "compile_time": 0.7154672145843506
    },
    {
        "BLOCK_SIZE_M": 32,
        "BLOCK_SIZE_N": 32,
        "BLOCK_SIZE_K": 512,
        "GROUP_SIZE_M": 8,
        "num_stages": 8,
        "num_warps": 2,
        "compile_time": 4.6470787525177
    },
    {
        "BLOCK_SIZE_M": 32,
        "BLOCK_SIZE_N": 32,
        "BLOCK_SIZE_K": 512,
        "GROUP_SIZE_M": 8,
        "num_stages": 8,
        "num_warps": 4,
        "compile_time": 1.9770479202270508
    },
    {
        "BLOCK_SIZE_M": 32,
        "BLOCK_SIZE_N": 32,
        "BLOCK_SIZE_K": 512,
        "GROUP_SIZE_M": 8,
        "num_stages": 8,
        "num_warps": 8,
        "compile_time": 1.2331948280334473
    },
    {
        "BLOCK_SIZE_M": 32,
        "BLOCK_SIZE_N": 32,
        "BLOCK_SIZE_K": 512,
        "GROUP_SIZE_M": 8,
        "num_stages": 8,
        "num_warps": 16,
        "compile_time": 0.8789200782775879
    },
    {
        "BLOCK_SIZE_M": 32,
        "BLOCK_SIZE_N": 32,
        "BLOCK_SIZE_K": 512,
        "GROUP_SIZE_M": 8,
        "num_stages": 8,
        "num_warps": 32,
        "compile_time": 0.722435474395752
    },
    {
        "BLOCK_SIZE_M": 32,
        "BLOCK_SIZE_N": 64,
        "BLOCK_SIZE_K": 128,
        "GROUP_SIZE_M": 8,
        "num_stages": 8,
        "num_warps": 2,
        "compile_time": 1.505934238433838
    },
    {
        "BLOCK_SIZE_M": 32,
        "BLOCK_SIZE_N": 64,
        "BLOCK_SIZE_K": 128,
        "GROUP_SIZE_M": 8,
        "num_stages": 8,
        "num_warps": 4,
        "compile_time": 0.9207134246826172
    },
    {
        "BLOCK_SIZE_M": 32,
        "BLOCK_SIZE_N": 64,
        "BLOCK_SIZE_K": 128,
        "GROUP_SIZE_M": 8,
        "num_stages": 8,
        "num_warps": 8,
        "compile_time": 0.6302344799041748
    },
    {
        "BLOCK_SIZE_M": 32,
        "BLOCK_SIZE_N": 64,
        "BLOCK_SIZE_K": 128,
        "GROUP_SIZE_M": 8,
        "num_stages": 8,
        "num_warps": 16,
        "compile_time": 0.5019431114196777
    },
    {
        "BLOCK_SIZE_M": 32,
        "BLOCK_SIZE_N": 64,
        "BLOCK_SIZE_K": 128,
        "GROUP_SIZE_M": 8,
        "num_stages": 8,
        "num_warps": 32,
        "compile_time": 0.005148172378540039
    },
    {
        "BLOCK_SIZE_M": 32,
        "BLOCK_SIZE_N": 64,
        "BLOCK_SIZE_K": 256,
        "GROUP_SIZE_M": 8,
        "num_stages": 5,
        "num_warps": 2,
        "compile_time": 2.7805821895599365
    },
    {
        "BLOCK_SIZE_M": 32,
        "BLOCK_SIZE_N": 64,
        "BLOCK_SIZE_K": 256,
        "GROUP_SIZE_M": 8,
        "num_stages": 5,
        "num_warps": 4,
        "compile_time": 1.2690913677215576
    },
    {
        "BLOCK_SIZE_M": 32,
        "BLOCK_SIZE_N": 64,
        "BLOCK_SIZE_K": 256,
        "GROUP_SIZE_M": 8,
        "num_stages": 5,
        "num_warps": 8,
        "compile_time": 0.7994368076324463
    },
    {
        "BLOCK_SIZE_M": 32,
        "BLOCK_SIZE_N": 64,
        "BLOCK_SIZE_K": 256,
        "GROUP_SIZE_M": 8,
        "num_stages": 5,
        "num_warps": 16,
        "compile_time": 0.0049440860748291016
    },
    {
        "BLOCK_SIZE_M": 32,
        "BLOCK_SIZE_N": 64,
        "BLOCK_SIZE_K": 256,
        "GROUP_SIZE_M": 8,
        "num_stages": 5,
        "num_warps": 32,
        "compile_time": 0.5130574703216553
    },
    {
        "BLOCK_SIZE_M": 32,
        "BLOCK_SIZE_N": 64,
        "BLOCK_SIZE_K": 256,
        "GROUP_SIZE_M": 8,
        "num_stages": 6,
        "num_warps": 2,
        "compile_time": 2.857758045196533
    },
    {
        "BLOCK_SIZE_M": 32,
        "BLOCK_SIZE_N": 64,
        "BLOCK_SIZE_K": 256,
        "GROUP_SIZE_M": 8,
        "num_stages": 6,
        "num_warps": 4,
        "compile_time": 1.3547377586364746
    },
    {
        "BLOCK_SIZE_M": 32,
        "BLOCK_SIZE_N": 64,
        "BLOCK_SIZE_K": 256,
        "GROUP_SIZE_M": 8,
        "num_stages": 6,
        "num_warps": 8,
        "compile_time": 0.9036664962768555
    },
    {
        "BLOCK_SIZE_M": 32,
        "BLOCK_SIZE_N": 64,
        "BLOCK_SIZE_K": 256,
        "GROUP_SIZE_M": 8,
        "num_stages": 6,
        "num_warps": 16,
        "compile_time": 0.6336879730224609
    },
    {
        "BLOCK_SIZE_M": 32,
        "BLOCK_SIZE_N": 64,
        "BLOCK_SIZE_K": 256,
        "GROUP_SIZE_M": 8,
        "num_stages": 6,
        "num_warps": 32,
        "compile_time": 0.5269339084625244
    },
    {
        "BLOCK_SIZE_M": 32,
        "BLOCK_SIZE_N": 64,
        "BLOCK_SIZE_K": 256,
        "GROUP_SIZE_M": 8,
        "num_stages": 7,
        "num_warps": 2,
        "compile_time": 3.033200740814209
    },
    {
        "BLOCK_SIZE_M": 32,
        "BLOCK_SIZE_N": 64,
        "BLOCK_SIZE_K": 256,
        "GROUP_SIZE_M": 8,
        "num_stages": 7,
        "num_warps": 4,
        "compile_time": 1.4995229244232178
    },
    {
        "BLOCK_SIZE_M": 32,
        "BLOCK_SIZE_N": 64,
        "BLOCK_SIZE_K": 256,
        "GROUP_SIZE_M": 8,
        "num_stages": 7,
        "num_warps": 8,
        "compile_time": 0.9262697696685791
    },
    {
        "BLOCK_SIZE_M": 32,
        "BLOCK_SIZE_N": 64,
        "BLOCK_SIZE_K": 256,
        "GROUP_SIZE_M": 8,
        "num_stages": 7,
        "num_warps": 16,
        "compile_time": 0.6578714847564697
    },
    {
        "BLOCK_SIZE_M": 32,
        "BLOCK_SIZE_N": 64,
        "BLOCK_SIZE_K": 256,
        "GROUP_SIZE_M": 8,
        "num_stages": 7,
        "num_warps": 32,
        "compile_time": 0.569746732711792
    },
    {
        "BLOCK_SIZE_M": 32,
        "BLOCK_SIZE_N": 64,
        "BLOCK_SIZE_K": 256,
        "GROUP_SIZE_M": 8,
        "num_stages": 8,
        "num_warps": 2,
        "compile_time": 3.199491262435913
    },
    {
        "BLOCK_SIZE_M": 32,
        "BLOCK_SIZE_N": 64,
        "BLOCK_SIZE_K": 256,
        "GROUP_SIZE_M": 8,
        "num_stages": 8,
        "num_warps": 4,
        "compile_time": 1.551598072052002
    },
    {
        "BLOCK_SIZE_M": 32,
        "BLOCK_SIZE_N": 64,
        "BLOCK_SIZE_K": 256,
        "GROUP_SIZE_M": 8,
        "num_stages": 8,
        "num_warps": 8,
        "compile_time": 0.9679758548736572
    },
    {
        "BLOCK_SIZE_M": 32,
        "BLOCK_SIZE_N": 64,
        "BLOCK_SIZE_K": 256,
        "GROUP_SIZE_M": 8,
        "num_stages": 8,
        "num_warps": 16,
        "compile_time": 0.6924402713775635
    },
    {
        "BLOCK_SIZE_M": 32,
        "BLOCK_SIZE_N": 64,
        "BLOCK_SIZE_K": 256,
        "GROUP_SIZE_M": 8,
        "num_stages": 8,
        "num_warps": 32,
        "compile_time": 0.5741899013519287
    },
    {
        "BLOCK_SIZE_M": 32,
        "BLOCK_SIZE_N": 64,
        "BLOCK_SIZE_K": 512,
        "GROUP_SIZE_M": 8,
        "num_stages": 3,
        "num_warps": 2,
        "compile_time": 12.535457134246826
    },
    {
        "BLOCK_SIZE_M": 32,
        "BLOCK_SIZE_N": 64,
        "BLOCK_SIZE_K": 512,
        "GROUP_SIZE_M": 8,
        "num_stages": 3,
        "num_warps": 4,
        "compile_time": 2.499041795730591
    },
    {
        "BLOCK_SIZE_M": 32,
        "BLOCK_SIZE_N": 64,
        "BLOCK_SIZE_K": 512,
        "GROUP_SIZE_M": 8,
        "num_stages": 3,
        "num_warps": 8,
        "compile_time": 1.1517772674560547
    },
    {
        "BLOCK_SIZE_M": 32,
        "BLOCK_SIZE_N": 64,
        "BLOCK_SIZE_K": 512,
        "GROUP_SIZE_M": 8,
        "num_stages": 3,
        "num_warps": 16,
        "compile_time": 0.7838737964630127
    },
    {
        "BLOCK_SIZE_M": 32,
        "BLOCK_SIZE_N": 64,
        "BLOCK_SIZE_K": 512,
        "GROUP_SIZE_M": 8,
        "num_stages": 3,
        "num_warps": 32,
        "compile_time": 0.6582558155059814
    },
    {
        "BLOCK_SIZE_M": 32,
        "BLOCK_SIZE_N": 64,
        "BLOCK_SIZE_K": 512,
        "GROUP_SIZE_M": 8,
        "num_stages": 4,
        "num_warps": 2,
        "compile_time": 12.622387886047363
    },
    {
        "BLOCK_SIZE_M": 32,
        "BLOCK_SIZE_N": 64,
        "BLOCK_SIZE_K": 512,
        "GROUP_SIZE_M": 8,
        "num_stages": 4,
        "num_warps": 4,
        "compile_time": 2.6670117378234863
    },
    {
        "BLOCK_SIZE_M": 32,
        "BLOCK_SIZE_N": 64,
        "BLOCK_SIZE_K": 512,
        "GROUP_SIZE_M": 8,
        "num_stages": 4,
        "num_warps": 8,
        "compile_time": 1.22450590133667
    },
    {
        "BLOCK_SIZE_M": 32,
        "BLOCK_SIZE_N": 64,
        "BLOCK_SIZE_K": 512,
        "GROUP_SIZE_M": 8,
        "num_stages": 4,
        "num_warps": 16,
        "compile_time": 0.8404073715209961
    },
    {
        "BLOCK_SIZE_M": 32,
        "BLOCK_SIZE_N": 64,
        "BLOCK_SIZE_K": 512,
        "GROUP_SIZE_M": 8,
        "num_stages": 4,
        "num_warps": 32,
        "compile_time": 0.6887249946594238
    },
    {
        "BLOCK_SIZE_M": 32,
        "BLOCK_SIZE_N": 64,
        "BLOCK_SIZE_K": 512,
        "GROUP_SIZE_M": 8,
        "num_stages": 5,
        "num_warps": 2,
        "compile_time": 13.045199394226074
    },
    {
        "BLOCK_SIZE_M": 32,
        "BLOCK_SIZE_N": 64,
        "BLOCK_SIZE_K": 512,
        "GROUP_SIZE_M": 8,
        "num_stages": 5,
        "num_warps": 4,
        "compile_time": 2.82022762298584
    },
    {
        "BLOCK_SIZE_M": 32,
        "BLOCK_SIZE_N": 64,
        "BLOCK_SIZE_K": 512,
        "GROUP_SIZE_M": 8,
        "num_stages": 5,
        "num_warps": 8,
        "compile_time": 1.330568552017212
    },
    {
        "BLOCK_SIZE_M": 32,
        "BLOCK_SIZE_N": 64,
        "BLOCK_SIZE_K": 512,
        "GROUP_SIZE_M": 8,
        "num_stages": 5,
        "num_warps": 16,
        "compile_time": 0.8955435752868652
    },
    {
        "BLOCK_SIZE_M": 32,
        "BLOCK_SIZE_N": 64,
        "BLOCK_SIZE_K": 512,
        "GROUP_SIZE_M": 8,
        "num_stages": 5,
        "num_warps": 32,
        "compile_time": 0.7164874076843262
    },
    {
        "BLOCK_SIZE_M": 32,
        "BLOCK_SIZE_N": 64,
        "BLOCK_SIZE_K": 512,
        "GROUP_SIZE_M": 8,
        "num_stages": 6,
        "num_warps": 2,
        "compile_time": 13.163002729415894
    },
    {
        "BLOCK_SIZE_M": 32,
        "BLOCK_SIZE_N": 64,
        "BLOCK_SIZE_K": 512,
        "GROUP_SIZE_M": 8,
        "num_stages": 6,
        "num_warps": 4,
        "compile_time": 3.010601282119751
    },
    {
        "BLOCK_SIZE_M": 32,
        "BLOCK_SIZE_N": 64,
        "BLOCK_SIZE_K": 512,
        "GROUP_SIZE_M": 8,
        "num_stages": 6,
        "num_warps": 8,
        "compile_time": 1.440192461013794
    },
    {
        "BLOCK_SIZE_M": 32,
        "BLOCK_SIZE_N": 64,
        "BLOCK_SIZE_K": 512,
        "GROUP_SIZE_M": 8,
        "num_stages": 6,
        "num_warps": 16,
        "compile_time": 0.9411041736602783
    },
    {
        "BLOCK_SIZE_M": 32,
        "BLOCK_SIZE_N": 64,
        "BLOCK_SIZE_K": 512,
        "GROUP_SIZE_M": 8,
        "num_stages": 6,
        "num_warps": 32,
        "compile_time": 0.7384276390075684
    },
    {
        "BLOCK_SIZE_M": 32,
        "BLOCK_SIZE_N": 64,
        "BLOCK_SIZE_K": 512,
        "GROUP_SIZE_M": 8,
        "num_stages": 7,
        "num_warps": 2,
        "compile_time": 13.538349628448486
    },
    {
        "BLOCK_SIZE_M": 32,
        "BLOCK_SIZE_N": 64,
        "BLOCK_SIZE_K": 512,
        "GROUP_SIZE_M": 8,
        "num_stages": 7,
        "num_warps": 4,
        "compile_time": 3.200394868850708
    },
    {
        "BLOCK_SIZE_M": 32,
        "BLOCK_SIZE_N": 64,
        "BLOCK_SIZE_K": 512,
        "GROUP_SIZE_M": 8,
        "num_stages": 7,
        "num_warps": 8,
        "compile_time": 1.6221981048583984
    },
    {
        "BLOCK_SIZE_M": 32,
        "BLOCK_SIZE_N": 64,
        "BLOCK_SIZE_K": 512,
        "GROUP_SIZE_M": 8,
        "num_stages": 7,
        "num_warps": 16,
        "compile_time": 1.0081050395965576
    },
    {
        "BLOCK_SIZE_M": 32,
        "BLOCK_SIZE_N": 64,
        "BLOCK_SIZE_K": 512,
        "GROUP_SIZE_M": 8,
        "num_stages": 7,
        "num_warps": 32,
        "compile_time": 0.7710487842559814
    },
    {
        "BLOCK_SIZE_M": 32,
        "BLOCK_SIZE_N": 64,
        "BLOCK_SIZE_K": 512,
        "GROUP_SIZE_M": 8,
        "num_stages": 8,
        "num_warps": 2,
        "compile_time": 13.729605674743652
    },
    {
        "BLOCK_SIZE_M": 32,
        "BLOCK_SIZE_N": 64,
        "BLOCK_SIZE_K": 512,
        "GROUP_SIZE_M": 8,
        "num_stages": 8,
        "num_warps": 4,
        "compile_time": 3.357207775115967
    },
    {
        "BLOCK_SIZE_M": 32,
        "BLOCK_SIZE_N": 64,
        "BLOCK_SIZE_K": 512,
        "GROUP_SIZE_M": 8,
        "num_stages": 8,
        "num_warps": 8,
        "compile_time": 1.663029670715332
    },
    {
        "BLOCK_SIZE_M": 32,
        "BLOCK_SIZE_N": 64,
        "BLOCK_SIZE_K": 512,
        "GROUP_SIZE_M": 8,
        "num_stages": 8,
        "num_warps": 16,
        "compile_time": 1.0610475540161133
    },
    {
        "BLOCK_SIZE_M": 32,
        "BLOCK_SIZE_N": 64,
        "BLOCK_SIZE_K": 512,
        "GROUP_SIZE_M": 8,
        "num_stages": 8,
        "num_warps": 32,
        "compile_time": 0.794417142868042
    },
    {
        "BLOCK_SIZE_M": 32,
        "BLOCK_SIZE_N": 128,
        "BLOCK_SIZE_K": 128,
        "GROUP_SIZE_M": 8,
        "num_stages": 6,
        "num_warps": 2,
        "compile_time": 2.5825693607330322
    },
    {
        "BLOCK_SIZE_M": 32,
        "BLOCK_SIZE_N": 128,
        "BLOCK_SIZE_K": 128,
        "GROUP_SIZE_M": 8,
        "num_stages": 6,
        "num_warps": 4,
        "compile_time": 1.2119686603546143
    },
    {
        "BLOCK_SIZE_M": 32,
        "BLOCK_SIZE_N": 128,
        "BLOCK_SIZE_K": 128,
        "GROUP_SIZE_M": 8,
        "num_stages": 6,
        "num_warps": 8,
        "compile_time": 0.7741553783416748
    },
    {
        "BLOCK_SIZE_M": 32,
        "BLOCK_SIZE_N": 128,
        "BLOCK_SIZE_K": 128,
        "GROUP_SIZE_M": 8,
        "num_stages": 6,
        "num_warps": 16,
        "compile_time": 0.005324363708496094
    },
    {
        "BLOCK_SIZE_M": 32,
        "BLOCK_SIZE_N": 128,
        "BLOCK_SIZE_K": 128,
        "GROUP_SIZE_M": 8,
        "num_stages": 6,
        "num_warps": 32,
        "compile_time": 0.4711735248565674
    },
    {
        "BLOCK_SIZE_M": 32,
        "BLOCK_SIZE_N": 128,
        "BLOCK_SIZE_K": 128,
        "GROUP_SIZE_M": 8,
        "num_stages": 7,
        "num_warps": 2,
        "compile_time": 2.732652187347412
    },
    {
        "BLOCK_SIZE_M": 32,
        "BLOCK_SIZE_N": 128,
        "BLOCK_SIZE_K": 128,
        "GROUP_SIZE_M": 8,
        "num_stages": 7,
        "num_warps": 4,
        "compile_time": 1.2865900993347168
    },
    {
        "BLOCK_SIZE_M": 32,
        "BLOCK_SIZE_N": 128,
        "BLOCK_SIZE_K": 128,
        "GROUP_SIZE_M": 8,
        "num_stages": 7,
        "num_warps": 8,
        "compile_time": 0.82391357421875
    },
    {
        "BLOCK_SIZE_M": 32,
        "BLOCK_SIZE_N": 128,
        "BLOCK_SIZE_K": 128,
        "GROUP_SIZE_M": 8,
        "num_stages": 7,
        "num_warps": 16,
        "compile_time": 0.5890121459960938
    },
    {
        "BLOCK_SIZE_M": 32,
        "BLOCK_SIZE_N": 128,
        "BLOCK_SIZE_K": 128,
        "GROUP_SIZE_M": 8,
        "num_stages": 7,
        "num_warps": 32,
        "compile_time": 0.49382805824279785
    },
    {
        "BLOCK_SIZE_M": 32,
        "BLOCK_SIZE_N": 128,
        "BLOCK_SIZE_K": 128,
        "GROUP_SIZE_M": 8,
        "num_stages": 8,
        "num_warps": 2,
        "compile_time": 2.9520323276519775
    },
    {
        "BLOCK_SIZE_M": 32,
        "BLOCK_SIZE_N": 128,
        "BLOCK_SIZE_K": 128,
        "GROUP_SIZE_M": 8,
        "num_stages": 8,
        "num_warps": 4,
        "compile_time": 1.4787285327911377
    },
    {
        "BLOCK_SIZE_M": 32,
        "BLOCK_SIZE_N": 128,
        "BLOCK_SIZE_K": 128,
        "GROUP_SIZE_M": 8,
        "num_stages": 8,
        "num_warps": 8,
        "compile_time": 0.9134171009063721
    },
    {
        "BLOCK_SIZE_M": 32,
        "BLOCK_SIZE_N": 128,
        "BLOCK_SIZE_K": 128,
        "GROUP_SIZE_M": 8,
        "num_stages": 8,
        "num_warps": 16,
        "compile_time": 0.633204460144043
    },
    {
        "BLOCK_SIZE_M": 32,
        "BLOCK_SIZE_N": 128,
        "BLOCK_SIZE_K": 128,
        "GROUP_SIZE_M": 8,
        "num_stages": 8,
        "num_warps": 32,
        "compile_time": 0.5390667915344238
    },
    {
        "BLOCK_SIZE_M": 32,
        "BLOCK_SIZE_N": 128,
        "BLOCK_SIZE_K": 256,
        "GROUP_SIZE_M": 8,
        "num_stages": 3,
        "num_warps": 2,
        "compile_time": 11.218445301055908
    },
    {
        "BLOCK_SIZE_M": 32,
        "BLOCK_SIZE_N": 128,
        "BLOCK_SIZE_K": 256,
        "GROUP_SIZE_M": 8,
        "num_stages": 4,
        "num_warps": 2,
        "compile_time": 11.221238136291504
    },
    {
        "BLOCK_SIZE_M": 32,
        "BLOCK_SIZE_N": 128,
        "BLOCK_SIZE_K": 256,
        "GROUP_SIZE_M": 8,
        "num_stages": 4,
        "num_warps": 4,
        "compile_time": 2.291699171066284
    },
    {
        "BLOCK_SIZE_M": 32,
        "BLOCK_SIZE_N": 128,
        "BLOCK_SIZE_K": 256,
        "GROUP_SIZE_M": 8,
        "num_stages": 4,
        "num_warps": 8,
        "compile_time": 1.125718355178833
    },
    {
        "BLOCK_SIZE_M": 32,
        "BLOCK_SIZE_N": 128,
        "BLOCK_SIZE_K": 256,
        "GROUP_SIZE_M": 8,
        "num_stages": 4,
        "num_warps": 16,
        "compile_time": 0.7524595260620117
    },
    {
        "BLOCK_SIZE_M": 32,
        "BLOCK_SIZE_N": 128,
        "BLOCK_SIZE_K": 256,
        "GROUP_SIZE_M": 8,
        "num_stages": 4,
        "num_warps": 32,
        "compile_time": 0.5667355060577393
    },
    {
        "BLOCK_SIZE_M": 32,
        "BLOCK_SIZE_N": 128,
        "BLOCK_SIZE_K": 256,
        "GROUP_SIZE_M": 8,
        "num_stages": 5,
        "num_warps": 2,
        "compile_time": 11.33106279373169
    },
    {
        "BLOCK_SIZE_M": 32,
        "BLOCK_SIZE_N": 128,
        "BLOCK_SIZE_K": 256,
        "GROUP_SIZE_M": 8,
        "num_stages": 5,
        "num_warps": 4,
        "compile_time": 2.424659013748169
    },
    {
        "BLOCK_SIZE_M": 32,
        "BLOCK_SIZE_N": 128,
        "BLOCK_SIZE_K": 256,
        "GROUP_SIZE_M": 8,
        "num_stages": 5,
        "num_warps": 8,
        "compile_time": 1.1930267810821533
    },
    {
        "BLOCK_SIZE_M": 32,
        "BLOCK_SIZE_N": 128,
        "BLOCK_SIZE_K": 256,
        "GROUP_SIZE_M": 8,
        "num_stages": 5,
        "num_warps": 16,
        "compile_time": 0.7973206043243408
    },
    {
        "BLOCK_SIZE_M": 32,
        "BLOCK_SIZE_N": 128,
        "BLOCK_SIZE_K": 256,
        "GROUP_SIZE_M": 8,
        "num_stages": 5,
        "num_warps": 32,
        "compile_time": 0.5966107845306396
    },
    {
        "BLOCK_SIZE_M": 32,
        "BLOCK_SIZE_N": 128,
        "BLOCK_SIZE_K": 256,
        "GROUP_SIZE_M": 8,
        "num_stages": 6,
        "num_warps": 2,
        "compile_time": 11.594448566436768
    },
    {
        "BLOCK_SIZE_M": 32,
        "BLOCK_SIZE_N": 128,
        "BLOCK_SIZE_K": 256,
        "GROUP_SIZE_M": 8,
        "num_stages": 6,
        "num_warps": 4,
        "compile_time": 2.580861806869507
    },
    {
        "BLOCK_SIZE_M": 32,
        "BLOCK_SIZE_N": 128,
        "BLOCK_SIZE_K": 256,
        "GROUP_SIZE_M": 8,
        "num_stages": 6,
        "num_warps": 8,
        "compile_time": 1.2810571193695068
    },
    {
        "BLOCK_SIZE_M": 32,
        "BLOCK_SIZE_N": 128,
        "BLOCK_SIZE_K": 256,
        "GROUP_SIZE_M": 8,
        "num_stages": 6,
        "num_warps": 16,
        "compile_time": 0.844165563583374
    },
    {
        "BLOCK_SIZE_M": 32,
        "BLOCK_SIZE_N": 128,
        "BLOCK_SIZE_K": 256,
        "GROUP_SIZE_M": 8,
        "num_stages": 6,
        "num_warps": 32,
        "compile_time": 0.6224238872528076
    },
    {
        "BLOCK_SIZE_M": 32,
        "BLOCK_SIZE_N": 128,
        "BLOCK_SIZE_K": 256,
        "GROUP_SIZE_M": 8,
        "num_stages": 7,
        "num_warps": 2,
        "compile_time": 11.836478471755981
    },
    {
        "BLOCK_SIZE_M": 32,
        "BLOCK_SIZE_N": 128,
        "BLOCK_SIZE_K": 256,
        "GROUP_SIZE_M": 8,
        "num_stages": 7,
        "num_warps": 4,
        "compile_time": 2.7734060287475586
    },
    {
        "BLOCK_SIZE_M": 32,
        "BLOCK_SIZE_N": 128,
        "BLOCK_SIZE_K": 256,
        "GROUP_SIZE_M": 8,
        "num_stages": 7,
        "num_warps": 8,
        "compile_time": 1.4062168598175049
    },
    {
        "BLOCK_SIZE_M": 32,
        "BLOCK_SIZE_N": 128,
        "BLOCK_SIZE_K": 256,
        "GROUP_SIZE_M": 8,
        "num_stages": 7,
        "num_warps": 16,
        "compile_time": 0.9003307819366455
    },
    {
        "BLOCK_SIZE_M": 32,
        "BLOCK_SIZE_N": 128,
        "BLOCK_SIZE_K": 256,
        "GROUP_SIZE_M": 8,
        "num_stages": 7,
        "num_warps": 32,
        "compile_time": 0.005602836608886719
    },
    {
        "BLOCK_SIZE_M": 32,
        "BLOCK_SIZE_N": 128,
        "BLOCK_SIZE_K": 256,
        "GROUP_SIZE_M": 8,
        "num_stages": 8,
        "num_warps": 2,
        "compile_time": 12.129276037216187
    },
    {
        "BLOCK_SIZE_M": 32,
        "BLOCK_SIZE_N": 128,
        "BLOCK_SIZE_K": 256,
        "GROUP_SIZE_M": 8,
        "num_stages": 8,
        "num_warps": 4,
        "compile_time": 3.0243587493896484
    },
    {
        "BLOCK_SIZE_M": 32,
        "BLOCK_SIZE_N": 128,
        "BLOCK_SIZE_K": 256,
        "GROUP_SIZE_M": 8,
        "num_stages": 8,
        "num_warps": 8,
        "compile_time": 1.4805712699890137
    },
    {
        "BLOCK_SIZE_M": 32,
        "BLOCK_SIZE_N": 128,
        "BLOCK_SIZE_K": 256,
        "GROUP_SIZE_M": 8,
        "num_stages": 8,
        "num_warps": 16,
        "compile_time": 0.999079704284668
    },
    {
        "BLOCK_SIZE_M": 32,
        "BLOCK_SIZE_N": 128,
        "BLOCK_SIZE_K": 256,
        "GROUP_SIZE_M": 8,
        "num_stages": 8,
        "num_warps": 32,
        "compile_time": 0.0047376155853271484
    },
    {
        "BLOCK_SIZE_M": 32,
        "BLOCK_SIZE_N": 128,
        "BLOCK_SIZE_K": 512,
        "GROUP_SIZE_M": 8,
        "num_stages": 1,
        "num_warps": 2,
        "compile_time": 8.513052463531494
    },
    {
        "BLOCK_SIZE_M": 32,
        "BLOCK_SIZE_N": 128,
        "BLOCK_SIZE_K": 512,
        "GROUP_SIZE_M": 8,
        "num_stages": 2,
        "num_warps": 2,
        "compile_time": 6.029956102371216
    },
    {
        "BLOCK_SIZE_M": 32,
        "BLOCK_SIZE_N": 128,
        "BLOCK_SIZE_K": 512,
        "GROUP_SIZE_M": 8,
        "num_stages": 3,
        "num_warps": 2,
        "compile_time": 6.338508129119873
    },
    {
        "BLOCK_SIZE_M": 32,
        "BLOCK_SIZE_N": 128,
        "BLOCK_SIZE_K": 512,
        "GROUP_SIZE_M": 8,
        "num_stages": 3,
        "num_warps": 4,
        "compile_time": 10.984346866607666
    },
    {
        "BLOCK_SIZE_M": 32,
        "BLOCK_SIZE_N": 128,
        "BLOCK_SIZE_K": 512,
        "GROUP_SIZE_M": 8,
        "num_stages": 3,
        "num_warps": 8,
        "compile_time": 2.2217042446136475
    },
    {
        "BLOCK_SIZE_M": 32,
        "BLOCK_SIZE_N": 128,
        "BLOCK_SIZE_K": 512,
        "GROUP_SIZE_M": 8,
        "num_stages": 3,
        "num_warps": 16,
        "compile_time": 1.119757890701294
    },
    {
        "BLOCK_SIZE_M": 32,
        "BLOCK_SIZE_N": 128,
        "BLOCK_SIZE_K": 512,
        "GROUP_SIZE_M": 8,
        "num_stages": 3,
        "num_warps": 32,
        "compile_time": 0.7647016048431396
    },
    {
        "BLOCK_SIZE_M": 32,
        "BLOCK_SIZE_N": 128,
        "BLOCK_SIZE_K": 512,
        "GROUP_SIZE_M": 8,
        "num_stages": 4,
        "num_warps": 2,
        "compile_time": 6.674276351928711
    },
    {
        "BLOCK_SIZE_M": 32,
        "BLOCK_SIZE_N": 128,
        "BLOCK_SIZE_K": 512,
        "GROUP_SIZE_M": 8,
        "num_stages": 4,
        "num_warps": 4,
        "compile_time": 11.181337356567383
    },
    {
        "BLOCK_SIZE_M": 32,
        "BLOCK_SIZE_N": 128,
        "BLOCK_SIZE_K": 512,
        "GROUP_SIZE_M": 8,
        "num_stages": 4,
        "num_warps": 8,
        "compile_time": 2.3622171878814697
    },
    {
        "BLOCK_SIZE_M": 32,
        "BLOCK_SIZE_N": 128,
        "BLOCK_SIZE_K": 512,
        "GROUP_SIZE_M": 8,
        "num_stages": 4,
        "num_warps": 16,
        "compile_time": 1.19700026512146
    },
    {
        "BLOCK_SIZE_M": 32,
        "BLOCK_SIZE_N": 128,
        "BLOCK_SIZE_K": 512,
        "GROUP_SIZE_M": 8,
        "num_stages": 4,
        "num_warps": 32,
        "compile_time": 0.81732177734375
    },
    {
        "BLOCK_SIZE_M": 32,
        "BLOCK_SIZE_N": 128,
        "BLOCK_SIZE_K": 512,
        "GROUP_SIZE_M": 8,
        "num_stages": 5,
        "num_warps": 2,
        "compile_time": 7.197326183319092
    },
    {
        "BLOCK_SIZE_M": 32,
        "BLOCK_SIZE_N": 128,
        "BLOCK_SIZE_K": 512,
        "GROUP_SIZE_M": 8,
        "num_stages": 5,
        "num_warps": 4,
        "compile_time": 11.547355651855469
    },
    {
        "BLOCK_SIZE_M": 32,
        "BLOCK_SIZE_N": 128,
        "BLOCK_SIZE_K": 512,
        "GROUP_SIZE_M": 8,
        "num_stages": 5,
        "num_warps": 8,
        "compile_time": 2.5815584659576416
    },
    {
        "BLOCK_SIZE_M": 32,
        "BLOCK_SIZE_N": 128,
        "BLOCK_SIZE_K": 512,
        "GROUP_SIZE_M": 8,
        "num_stages": 5,
        "num_warps": 16,
        "compile_time": 0.005849599838256836
    },
    {
        "BLOCK_SIZE_M": 32,
        "BLOCK_SIZE_N": 128,
        "BLOCK_SIZE_K": 512,
        "GROUP_SIZE_M": 8,
        "num_stages": 5,
        "num_warps": 32,
        "compile_time": 0.8801462650299072
    },
    {
        "BLOCK_SIZE_M": 32,
        "BLOCK_SIZE_N": 128,
        "BLOCK_SIZE_K": 512,
        "GROUP_SIZE_M": 8,
        "num_stages": 6,
        "num_warps": 2,
        "compile_time": 7.57872748374939
    },
    {
        "BLOCK_SIZE_M": 32,
        "BLOCK_SIZE_N": 128,
        "BLOCK_SIZE_K": 512,
        "GROUP_SIZE_M": 8,
        "num_stages": 6,
        "num_warps": 4,
        "compile_time": 11.656758785247803
    },
    {
        "BLOCK_SIZE_M": 32,
        "BLOCK_SIZE_N": 128,
        "BLOCK_SIZE_K": 512,
        "GROUP_SIZE_M": 8,
        "num_stages": 6,
        "num_warps": 8,
        "compile_time": 2.71110200881958
    },
    {
        "BLOCK_SIZE_M": 32,
        "BLOCK_SIZE_N": 128,
        "BLOCK_SIZE_K": 512,
        "GROUP_SIZE_M": 8,
        "num_stages": 6,
        "num_warps": 16,
        "compile_time": 1.4004261493682861
    },
    {
        "BLOCK_SIZE_M": 32,
        "BLOCK_SIZE_N": 128,
        "BLOCK_SIZE_K": 512,
        "GROUP_SIZE_M": 8,
        "num_stages": 6,
        "num_warps": 32,
        "compile_time": 0.9298958778381348
    },
    {
        "BLOCK_SIZE_M": 32,
        "BLOCK_SIZE_N": 128,
        "BLOCK_SIZE_K": 512,
        "GROUP_SIZE_M": 8,
        "num_stages": 7,
        "num_warps": 2,
        "compile_time": 7.94651460647583
    },
    {
        "BLOCK_SIZE_M": 32,
        "BLOCK_SIZE_N": 128,
        "BLOCK_SIZE_K": 512,
        "GROUP_SIZE_M": 8,
        "num_stages": 7,
        "num_warps": 4,
        "compile_time": 11.892175912857056
    },
    {
        "BLOCK_SIZE_M": 32,
        "BLOCK_SIZE_N": 128,
        "BLOCK_SIZE_K": 512,
        "GROUP_SIZE_M": 8,
        "num_stages": 7,
        "num_warps": 8,
        "compile_time": 2.9408321380615234
    },
    {
        "BLOCK_SIZE_M": 32,
        "BLOCK_SIZE_N": 128,
        "BLOCK_SIZE_K": 512,
        "GROUP_SIZE_M": 8,
        "num_stages": 7,
        "num_warps": 16,
        "compile_time": 1.5854876041412354
    },
    {
        "BLOCK_SIZE_M": 32,
        "BLOCK_SIZE_N": 128,
        "BLOCK_SIZE_K": 512,
        "GROUP_SIZE_M": 8,
        "num_stages": 7,
        "num_warps": 32,
        "compile_time": 0.005149126052856445
    },
    {
        "BLOCK_SIZE_M": 32,
        "BLOCK_SIZE_N": 128,
        "BLOCK_SIZE_K": 512,
        "GROUP_SIZE_M": 8,
        "num_stages": 8,
        "num_warps": 2,
        "compile_time": 8.497159719467163
    },
    {
        "BLOCK_SIZE_M": 32,
        "BLOCK_SIZE_N": 128,
        "BLOCK_SIZE_K": 512,
        "GROUP_SIZE_M": 8,
        "num_stages": 8,
        "num_warps": 4,
        "compile_time": 12.289921283721924
    },
    {
        "BLOCK_SIZE_M": 32,
        "BLOCK_SIZE_N": 128,
        "BLOCK_SIZE_K": 512,
        "GROUP_SIZE_M": 8,
        "num_stages": 8,
        "num_warps": 8,
        "compile_time": 3.0837433338165283
    },
    {
        "BLOCK_SIZE_M": 32,
        "BLOCK_SIZE_N": 128,
        "BLOCK_SIZE_K": 512,
        "GROUP_SIZE_M": 8,
        "num_stages": 8,
        "num_warps": 16,
        "compile_time": 1.6542682647705078
    },
    {
        "BLOCK_SIZE_M": 32,
        "BLOCK_SIZE_N": 128,
        "BLOCK_SIZE_K": 512,
        "GROUP_SIZE_M": 8,
        "num_stages": 8,
        "num_warps": 32,
        "compile_time": 0.0073375701904296875
    },
    {
        "BLOCK_SIZE_M": 32,
        "BLOCK_SIZE_N": 256,
        "BLOCK_SIZE_K": 64,
        "GROUP_SIZE_M": 8,
        "num_stages": 6,
        "num_warps": 2,
        "compile_time": 2.8437602519989014
    },
    {
        "BLOCK_SIZE_M": 32,
        "BLOCK_SIZE_N": 256,
        "BLOCK_SIZE_K": 64,
        "GROUP_SIZE_M": 8,
        "num_stages": 6,
        "num_warps": 4,
        "compile_time": 1.253436803817749
    },
    {
        "BLOCK_SIZE_M": 32,
        "BLOCK_SIZE_N": 256,
        "BLOCK_SIZE_K": 64,
        "GROUP_SIZE_M": 8,
        "num_stages": 6,
        "num_warps": 8,
        "compile_time": 0.781381368637085
    },
    {
        "BLOCK_SIZE_M": 32,
        "BLOCK_SIZE_N": 256,
        "BLOCK_SIZE_K": 64,
        "GROUP_SIZE_M": 8,
        "num_stages": 6,
        "num_warps": 16,
        "compile_time": 0.5752553939819336
    },
    {
        "BLOCK_SIZE_M": 32,
        "BLOCK_SIZE_N": 256,
        "BLOCK_SIZE_K": 64,
        "GROUP_SIZE_M": 8,
        "num_stages": 6,
        "num_warps": 32,
        "compile_time": 0.46671199798583984
    },
    {
        "BLOCK_SIZE_M": 32,
        "BLOCK_SIZE_N": 256,
        "BLOCK_SIZE_K": 64,
        "GROUP_SIZE_M": 8,
        "num_stages": 7,
        "num_warps": 2,
        "compile_time": 2.9726524353027344
    },
    {
        "BLOCK_SIZE_M": 32,
        "BLOCK_SIZE_N": 256,
        "BLOCK_SIZE_K": 64,
        "GROUP_SIZE_M": 8,
        "num_stages": 7,
        "num_warps": 4,
        "compile_time": 1.3141205310821533
    },
    {
        "BLOCK_SIZE_M": 32,
        "BLOCK_SIZE_N": 256,
        "BLOCK_SIZE_K": 64,
        "GROUP_SIZE_M": 8,
        "num_stages": 7,
        "num_warps": 8,
        "compile_time": 0.8294281959533691
    },
    {
        "BLOCK_SIZE_M": 32,
        "BLOCK_SIZE_N": 256,
        "BLOCK_SIZE_K": 64,
        "GROUP_SIZE_M": 8,
        "num_stages": 7,
        "num_warps": 16,
        "compile_time": 0.5922727584838867
    },
    {
        "BLOCK_SIZE_M": 32,
        "BLOCK_SIZE_N": 256,
        "BLOCK_SIZE_K": 64,
        "GROUP_SIZE_M": 8,
        "num_stages": 7,
        "num_warps": 32,
        "compile_time": 0.005375385284423828
    },
    {
        "BLOCK_SIZE_M": 32,
        "BLOCK_SIZE_N": 256,
        "BLOCK_SIZE_K": 64,
        "GROUP_SIZE_M": 8,
        "num_stages": 8,
        "num_warps": 2,
        "compile_time": 3.090766191482544
    },
    {
        "BLOCK_SIZE_M": 32,
        "BLOCK_SIZE_N": 256,
        "BLOCK_SIZE_K": 64,
        "GROUP_SIZE_M": 8,
        "num_stages": 8,
        "num_warps": 4,
        "compile_time": 1.4618651866912842
    },
    {
        "BLOCK_SIZE_M": 32,
        "BLOCK_SIZE_N": 256,
        "BLOCK_SIZE_K": 64,
        "GROUP_SIZE_M": 8,
        "num_stages": 8,
        "num_warps": 8,
        "compile_time": 0.858966588973999
    },
    {
        "BLOCK_SIZE_M": 32,
        "BLOCK_SIZE_N": 256,
        "BLOCK_SIZE_K": 64,
        "GROUP_SIZE_M": 8,
        "num_stages": 8,
        "num_warps": 16,
        "compile_time": 0.6189589500427246
    },
    {
        "BLOCK_SIZE_M": 32,
        "BLOCK_SIZE_N": 256,
        "BLOCK_SIZE_K": 64,
        "GROUP_SIZE_M": 8,
        "num_stages": 8,
        "num_warps": 32,
        "compile_time": 0.4901418685913086
    },
    {
        "BLOCK_SIZE_M": 32,
        "BLOCK_SIZE_N": 256,
        "BLOCK_SIZE_K": 128,
        "GROUP_SIZE_M": 8,
        "num_stages": 3,
        "num_warps": 2,
        "compile_time": 11.149812936782837
    },
    {
        "BLOCK_SIZE_M": 32,
        "BLOCK_SIZE_N": 256,
        "BLOCK_SIZE_K": 128,
        "GROUP_SIZE_M": 8,
        "num_stages": 4,
        "num_warps": 2,
        "compile_time": 11.271469831466675
    },
    {
        "BLOCK_SIZE_M": 32,
        "BLOCK_SIZE_N": 256,
        "BLOCK_SIZE_K": 128,
        "GROUP_SIZE_M": 8,
        "num_stages": 4,
        "num_warps": 4,
        "compile_time": 2.3033008575439453
    },
    {
        "BLOCK_SIZE_M": 32,
        "BLOCK_SIZE_N": 256,
        "BLOCK_SIZE_K": 128,
        "GROUP_SIZE_M": 8,
        "num_stages": 4,
        "num_warps": 8,
        "compile_time": 1.0857110023498535
    },
    {
        "BLOCK_SIZE_M": 32,
        "BLOCK_SIZE_N": 256,
        "BLOCK_SIZE_K": 128,
        "GROUP_SIZE_M": 8,
        "num_stages": 4,
        "num_warps": 16,
        "compile_time": 0.727468729019165
    },
    {
        "BLOCK_SIZE_M": 32,
        "BLOCK_SIZE_N": 256,
        "BLOCK_SIZE_K": 128,
        "GROUP_SIZE_M": 8,
        "num_stages": 4,
        "num_warps": 32,
        "compile_time": 0.531494140625
    },
    {
        "BLOCK_SIZE_M": 32,
        "BLOCK_SIZE_N": 256,
        "BLOCK_SIZE_K": 128,
        "GROUP_SIZE_M": 8,
        "num_stages": 5,
        "num_warps": 2,
        "compile_time": 11.385017395019531
    },
    {
        "BLOCK_SIZE_M": 32,
        "BLOCK_SIZE_N": 256,
        "BLOCK_SIZE_K": 128,
        "GROUP_SIZE_M": 8,
        "num_stages": 5,
        "num_warps": 4,
        "compile_time": 2.4154927730560303
    },
    {
        "BLOCK_SIZE_M": 32,
        "BLOCK_SIZE_N": 256,
        "BLOCK_SIZE_K": 128,
        "GROUP_SIZE_M": 8,
        "num_stages": 5,
        "num_warps": 8,
        "compile_time": 1.143171787261963
    },
    {
        "BLOCK_SIZE_M": 32,
        "BLOCK_SIZE_N": 256,
        "BLOCK_SIZE_K": 128,
        "GROUP_SIZE_M": 8,
        "num_stages": 5,
        "num_warps": 16,
        "compile_time": 0.749488353729248
    },
    {
        "BLOCK_SIZE_M": 32,
        "BLOCK_SIZE_N": 256,
        "BLOCK_SIZE_K": 128,
        "GROUP_SIZE_M": 8,
        "num_stages": 5,
        "num_warps": 32,
        "compile_time": 0.5441248416900635
    },
    {
        "BLOCK_SIZE_M": 32,
        "BLOCK_SIZE_N": 256,
        "BLOCK_SIZE_K": 128,
        "GROUP_SIZE_M": 8,
        "num_stages": 6,
        "num_warps": 2,
        "compile_time": 11.556522607803345
    },
    {
        "BLOCK_SIZE_M": 32,
        "BLOCK_SIZE_N": 256,
        "BLOCK_SIZE_K": 128,
        "GROUP_SIZE_M": 8,
        "num_stages": 6,
        "num_warps": 4,
        "compile_time": 2.5460360050201416
    },
    {
        "BLOCK_SIZE_M": 32,
        "BLOCK_SIZE_N": 256,
        "BLOCK_SIZE_K": 128,
        "GROUP_SIZE_M": 8,
        "num_stages": 6,
        "num_warps": 8,
        "compile_time": 1.233987808227539
    },
    {
        "BLOCK_SIZE_M": 32,
        "BLOCK_SIZE_N": 256,
        "BLOCK_SIZE_K": 128,
        "GROUP_SIZE_M": 8,
        "num_stages": 6,
        "num_warps": 16,
        "compile_time": 0.8045437335968018
    },
    {
        "BLOCK_SIZE_M": 32,
        "BLOCK_SIZE_N": 256,
        "BLOCK_SIZE_K": 128,
        "GROUP_SIZE_M": 8,
        "num_stages": 6,
        "num_warps": 32,
        "compile_time": 0.5832173824310303
    },
    {
        "BLOCK_SIZE_M": 32,
        "BLOCK_SIZE_N": 256,
        "BLOCK_SIZE_K": 128,
        "GROUP_SIZE_M": 8,
        "num_stages": 7,
        "num_warps": 2,
        "compile_time": 11.827098608016968
    },
    {
        "BLOCK_SIZE_M": 32,
        "BLOCK_SIZE_N": 256,
        "BLOCK_SIZE_K": 128,
        "GROUP_SIZE_M": 8,
        "num_stages": 7,
        "num_warps": 4,
        "compile_time": 2.7035715579986572
    },
    {
        "BLOCK_SIZE_M": 32,
        "BLOCK_SIZE_N": 256,
        "BLOCK_SIZE_K": 128,
        "GROUP_SIZE_M": 8,
        "num_stages": 7,
        "num_warps": 8,
        "compile_time": 1.30314302444458
    },
    {
        "BLOCK_SIZE_M": 32,
        "BLOCK_SIZE_N": 256,
        "BLOCK_SIZE_K": 128,
        "GROUP_SIZE_M": 8,
        "num_stages": 7,
        "num_warps": 16,
        "compile_time": 0.8529670238494873
    },
    {
        "BLOCK_SIZE_M": 32,
        "BLOCK_SIZE_N": 256,
        "BLOCK_SIZE_K": 128,
        "GROUP_SIZE_M": 8,
        "num_stages": 7,
        "num_warps": 32,
        "compile_time": 0.004521369934082031
    },
    {
        "BLOCK_SIZE_M": 32,
        "BLOCK_SIZE_N": 256,
        "BLOCK_SIZE_K": 128,
        "GROUP_SIZE_M": 8,
        "num_stages": 8,
        "num_warps": 2,
        "compile_time": 11.932434797286987
    },
    {
        "BLOCK_SIZE_M": 32,
        "BLOCK_SIZE_N": 256,
        "BLOCK_SIZE_K": 128,
        "GROUP_SIZE_M": 8,
        "num_stages": 8,
        "num_warps": 4,
        "compile_time": 2.829448938369751
    },
    {
        "BLOCK_SIZE_M": 32,
        "BLOCK_SIZE_N": 256,
        "BLOCK_SIZE_K": 128,
        "GROUP_SIZE_M": 8,
        "num_stages": 8,
        "num_warps": 8,
        "compile_time": 1.3943498134613037
    },
    {
        "BLOCK_SIZE_M": 32,
        "BLOCK_SIZE_N": 256,
        "BLOCK_SIZE_K": 128,
        "GROUP_SIZE_M": 8,
        "num_stages": 8,
        "num_warps": 16,
        "compile_time": 0.9429314136505127
    },
    {
        "BLOCK_SIZE_M": 32,
        "BLOCK_SIZE_N": 256,
        "BLOCK_SIZE_K": 128,
        "GROUP_SIZE_M": 8,
        "num_stages": 8,
        "num_warps": 32,
        "compile_time": 0.6382174491882324
    },
    {
        "BLOCK_SIZE_M": 32,
        "BLOCK_SIZE_N": 256,
        "BLOCK_SIZE_K": 256,
        "GROUP_SIZE_M": 8,
        "num_stages": 1,
        "num_warps": 2,
        "compile_time": 8.231297731399536
    },
    {
        "BLOCK_SIZE_M": 32,
        "BLOCK_SIZE_N": 256,
        "BLOCK_SIZE_K": 256,
        "GROUP_SIZE_M": 8,
        "num_stages": 2,
        "num_warps": 2,
        "compile_time": 8.336230278015137
    },
    {
        "BLOCK_SIZE_M": 32,
        "BLOCK_SIZE_N": 256,
        "BLOCK_SIZE_K": 256,
        "GROUP_SIZE_M": 8,
        "num_stages": 3,
        "num_warps": 2,
        "compile_time": 6.156107664108276
    },
    {
        "BLOCK_SIZE_M": 32,
        "BLOCK_SIZE_N": 256,
        "BLOCK_SIZE_K": 256,
        "GROUP_SIZE_M": 8,
        "num_stages": 3,
        "num_warps": 4,
        "compile_time": 10.786030054092407
    },
    {
        "BLOCK_SIZE_M": 32,
        "BLOCK_SIZE_N": 256,
        "BLOCK_SIZE_K": 256,
        "GROUP_SIZE_M": 8,
        "num_stages": 3,
        "num_warps": 8,
        "compile_time": 2.084868907928467
    },
    {
        "BLOCK_SIZE_M": 32,
        "BLOCK_SIZE_N": 256,
        "BLOCK_SIZE_K": 256,
        "GROUP_SIZE_M": 8,
        "num_stages": 3,
        "num_warps": 16,
        "compile_time": 1.0344882011413574
    },
    {
        "BLOCK_SIZE_M": 32,
        "BLOCK_SIZE_N": 256,
        "BLOCK_SIZE_K": 256,
        "GROUP_SIZE_M": 8,
        "num_stages": 3,
        "num_warps": 32,
        "compile_time": 0.7107880115509033
    },
    {
        "BLOCK_SIZE_M": 32,
        "BLOCK_SIZE_N": 256,
        "BLOCK_SIZE_K": 256,
        "GROUP_SIZE_M": 8,
        "num_stages": 4,
        "num_warps": 2,
        "compile_time": 6.472928762435913
    },
    {
        "BLOCK_SIZE_M": 32,
        "BLOCK_SIZE_N": 256,
        "BLOCK_SIZE_K": 256,
        "GROUP_SIZE_M": 8,
        "num_stages": 4,
        "num_warps": 4,
        "compile_time": 10.672616004943848
    },
    {
        "BLOCK_SIZE_M": 32,
        "BLOCK_SIZE_N": 256,
        "BLOCK_SIZE_K": 256,
        "GROUP_SIZE_M": 8,
        "num_stages": 4,
        "num_warps": 8,
        "compile_time": 2.201223373413086
    },
    {
        "BLOCK_SIZE_M": 32,
        "BLOCK_SIZE_N": 256,
        "BLOCK_SIZE_K": 256,
        "GROUP_SIZE_M": 8,
        "num_stages": 4,
        "num_warps": 16,
        "compile_time": 1.1103649139404297
    },
    {
        "BLOCK_SIZE_M": 32,
        "BLOCK_SIZE_N": 256,
        "BLOCK_SIZE_K": 256,
        "GROUP_SIZE_M": 8,
        "num_stages": 4,
        "num_warps": 32,
        "compile_time": 0.7389202117919922
    },
    {
        "BLOCK_SIZE_M": 32,
        "BLOCK_SIZE_N": 256,
        "BLOCK_SIZE_K": 256,
        "GROUP_SIZE_M": 8,
        "num_stages": 5,
        "num_warps": 2,
        "compile_time": 6.826230764389038
    },
    {
        "BLOCK_SIZE_M": 32,
        "BLOCK_SIZE_N": 256,
        "BLOCK_SIZE_K": 256,
        "GROUP_SIZE_M": 8,
        "num_stages": 5,
        "num_warps": 4,
        "compile_time": 10.660189390182495
    },
    {
        "BLOCK_SIZE_M": 32,
        "BLOCK_SIZE_N": 256,
        "BLOCK_SIZE_K": 256,
        "GROUP_SIZE_M": 8,
        "num_stages": 5,
        "num_warps": 8,
        "compile_time": 2.3803372383117676
    },
    {
        "BLOCK_SIZE_M": 32,
        "BLOCK_SIZE_N": 256,
        "BLOCK_SIZE_K": 256,
        "GROUP_SIZE_M": 8,
        "num_stages": 5,
        "num_warps": 16,
        "compile_time": 1.2000014781951904
    },
    {
        "BLOCK_SIZE_M": 32,
        "BLOCK_SIZE_N": 256,
        "BLOCK_SIZE_K": 256,
        "GROUP_SIZE_M": 8,
        "num_stages": 5,
        "num_warps": 32,
        "compile_time": 0.7969915866851807
    },
    {
        "BLOCK_SIZE_M": 32,
        "BLOCK_SIZE_N": 256,
        "BLOCK_SIZE_K": 256,
        "GROUP_SIZE_M": 8,
        "num_stages": 6,
        "num_warps": 2,
        "compile_time": 7.224247455596924
    },
    {
        "BLOCK_SIZE_M": 32,
        "BLOCK_SIZE_N": 256,
        "BLOCK_SIZE_K": 256,
        "GROUP_SIZE_M": 8,
        "num_stages": 6,
        "num_warps": 4,
        "compile_time": 11.525363445281982
    },
    {
        "BLOCK_SIZE_M": 32,
        "BLOCK_SIZE_N": 256,
        "BLOCK_SIZE_K": 256,
        "GROUP_SIZE_M": 8,
        "num_stages": 6,
        "num_warps": 8,
        "compile_time": 2.577328681945801
    },
    {
        "BLOCK_SIZE_M": 32,
        "BLOCK_SIZE_N": 256,
        "BLOCK_SIZE_K": 256,
        "GROUP_SIZE_M": 8,
        "num_stages": 6,
        "num_warps": 16,
        "compile_time": 1.3135910034179688
    },
    {
        "BLOCK_SIZE_M": 32,
        "BLOCK_SIZE_N": 256,
        "BLOCK_SIZE_K": 256,
        "GROUP_SIZE_M": 8,
        "num_stages": 6,
        "num_warps": 32,
        "compile_time": 0.8466994762420654
    },
    {
        "BLOCK_SIZE_M": 32,
        "BLOCK_SIZE_N": 256,
        "BLOCK_SIZE_K": 256,
        "GROUP_SIZE_M": 8,
        "num_stages": 7,
        "num_warps": 2,
        "compile_time": 7.532074451446533
    },
    {
        "BLOCK_SIZE_M": 32,
        "BLOCK_SIZE_N": 256,
        "BLOCK_SIZE_K": 256,
        "GROUP_SIZE_M": 8,
        "num_stages": 7,
        "num_warps": 4,
        "compile_time": 11.541102409362793
    },
    {
        "BLOCK_SIZE_M": 32,
        "BLOCK_SIZE_N": 256,
        "BLOCK_SIZE_K": 256,
        "GROUP_SIZE_M": 8,
        "num_stages": 7,
        "num_warps": 8,
        "compile_time": 2.7238993644714355
    },
    {
        "BLOCK_SIZE_M": 32,
        "BLOCK_SIZE_N": 256,
        "BLOCK_SIZE_K": 256,
        "GROUP_SIZE_M": 8,
        "num_stages": 7,
        "num_warps": 16,
        "compile_time": 1.3921740055084229
    },
    {
        "BLOCK_SIZE_M": 32,
        "BLOCK_SIZE_N": 256,
        "BLOCK_SIZE_K": 256,
        "GROUP_SIZE_M": 8,
        "num_stages": 7,
        "num_warps": 32,
        "compile_time": 0.8966357707977295
    },
    {
        "BLOCK_SIZE_M": 32,
        "BLOCK_SIZE_N": 256,
        "BLOCK_SIZE_K": 256,
        "GROUP_SIZE_M": 8,
        "num_stages": 8,
        "num_warps": 2,
        "compile_time": 7.952344179153442
    },
    {
        "BLOCK_SIZE_M": 32,
        "BLOCK_SIZE_N": 256,
        "BLOCK_SIZE_K": 256,
        "GROUP_SIZE_M": 8,
        "num_stages": 8,
        "num_warps": 4,
        "compile_time": 11.993510484695435
    },
    {
        "BLOCK_SIZE_M": 32,
        "BLOCK_SIZE_N": 256,
        "BLOCK_SIZE_K": 256,
        "GROUP_SIZE_M": 8,
        "num_stages": 8,
        "num_warps": 8,
        "compile_time": 2.9139602184295654
    },
    {
        "BLOCK_SIZE_M": 32,
        "BLOCK_SIZE_N": 256,
        "BLOCK_SIZE_K": 256,
        "GROUP_SIZE_M": 8,
        "num_stages": 8,
        "num_warps": 16,
        "compile_time": 1.5201683044433594
    },
    {
        "BLOCK_SIZE_M": 32,
        "BLOCK_SIZE_N": 256,
        "BLOCK_SIZE_K": 256,
        "GROUP_SIZE_M": 8,
        "num_stages": 8,
        "num_warps": 32,
        "compile_time": 0.9567151069641113
    },
    {
        "BLOCK_SIZE_M": 32,
        "BLOCK_SIZE_N": 256,
        "BLOCK_SIZE_K": 512,
        "GROUP_SIZE_M": 8,
        "num_stages": 1,
        "num_warps": 2,
        "compile_time": 20.07918667793274
    },
    {
        "BLOCK_SIZE_M": 32,
        "BLOCK_SIZE_N": 256,
        "BLOCK_SIZE_K": 512,
        "GROUP_SIZE_M": 8,
        "num_stages": 1,
        "num_warps": 4,
        "compile_time": 8.38410472869873
    },
    {
        "BLOCK_SIZE_M": 32,
        "BLOCK_SIZE_N": 256,
        "BLOCK_SIZE_K": 512,
        "GROUP_SIZE_M": 8,
        "num_stages": 1,
        "num_warps": 8,
        "compile_time": 3.192512273788452
    },
    {
        "BLOCK_SIZE_M": 32,
        "BLOCK_SIZE_N": 256,
        "BLOCK_SIZE_K": 512,
        "GROUP_SIZE_M": 8,
        "num_stages": 1,
        "num_warps": 16,
        "compile_time": 1.3726086616516113
    },
    {
        "BLOCK_SIZE_M": 32,
        "BLOCK_SIZE_N": 256,
        "BLOCK_SIZE_K": 512,
        "GROUP_SIZE_M": 8,
        "num_stages": 1,
        "num_warps": 32,
        "compile_time": 0.004647254943847656
    },
    {
        "BLOCK_SIZE_M": 32,
        "BLOCK_SIZE_N": 256,
        "BLOCK_SIZE_K": 512,
        "GROUP_SIZE_M": 8,
        "num_stages": 2,
        "num_warps": 2,
        "compile_time": 20.128455638885498
    },
    {
        "BLOCK_SIZE_M": 32,
        "BLOCK_SIZE_N": 256,
        "BLOCK_SIZE_K": 512,
        "GROUP_SIZE_M": 8,
        "num_stages": 2,
        "num_warps": 4,
        "compile_time": 8.305117130279541
    },
    {
        "BLOCK_SIZE_M": 32,
        "BLOCK_SIZE_N": 256,
        "BLOCK_SIZE_K": 512,
        "GROUP_SIZE_M": 8,
        "num_stages": 2,
        "num_warps": 8,
        "compile_time": 3.5157647132873535
    },
    {
        "BLOCK_SIZE_M": 32,
        "BLOCK_SIZE_N": 256,
        "BLOCK_SIZE_K": 512,
        "GROUP_SIZE_M": 8,
        "num_stages": 2,
        "num_warps": 16,
        "compile_time": 1.58962082862854
    },
    {
        "BLOCK_SIZE_M": 32,
        "BLOCK_SIZE_N": 256,
        "BLOCK_SIZE_K": 512,
        "GROUP_SIZE_M": 8,
        "num_stages": 2,
        "num_warps": 32,
        "compile_time": 0.004945278167724609
    },
    {
        "BLOCK_SIZE_M": 32,
        "BLOCK_SIZE_N": 256,
        "BLOCK_SIZE_K": 512,
        "GROUP_SIZE_M": 8,
        "num_stages": 3,
        "num_warps": 2,
        "compile_time": 20.87792444229126
    },
    {
        "BLOCK_SIZE_M": 32,
        "BLOCK_SIZE_N": 256,
        "BLOCK_SIZE_K": 512,
        "GROUP_SIZE_M": 8,
        "num_stages": 3,
        "num_warps": 4,
        "compile_time": 6.02459716796875
    },
    {
        "BLOCK_SIZE_M": 32,
        "BLOCK_SIZE_N": 256,
        "BLOCK_SIZE_K": 512,
        "GROUP_SIZE_M": 8,
        "num_stages": 3,
        "num_warps": 8,
        "compile_time": 10.846808910369873
    },
    {
        "BLOCK_SIZE_M": 32,
        "BLOCK_SIZE_N": 256,
        "BLOCK_SIZE_K": 512,
        "GROUP_SIZE_M": 8,
        "num_stages": 3,
        "num_warps": 16,
        "compile_time": 2.2224318981170654
    },
    {
        "BLOCK_SIZE_M": 32,
        "BLOCK_SIZE_N": 256,
        "BLOCK_SIZE_K": 512,
        "GROUP_SIZE_M": 8,
        "num_stages": 3,
        "num_warps": 32,
        "compile_time": 1.0954205989837646
    },
    {
        "BLOCK_SIZE_M": 32,
        "BLOCK_SIZE_N": 256,
        "BLOCK_SIZE_K": 512,
        "GROUP_SIZE_M": 8,
        "num_stages": 4,
        "num_warps": 2,
        "compile_time": 22.02867317199707
    },
    {
        "BLOCK_SIZE_M": 32,
        "BLOCK_SIZE_N": 256,
        "BLOCK_SIZE_K": 512,
        "GROUP_SIZE_M": 8,
        "num_stages": 4,
        "num_warps": 4,
        "compile_time": 6.659194469451904
    },
    {
        "BLOCK_SIZE_M": 32,
        "BLOCK_SIZE_N": 256,
        "BLOCK_SIZE_K": 512,
        "GROUP_SIZE_M": 8,
        "num_stages": 4,
        "num_warps": 8,
        "compile_time": 11.234770059585571
    },
    {
        "BLOCK_SIZE_M": 32,
        "BLOCK_SIZE_N": 256,
        "BLOCK_SIZE_K": 512,
        "GROUP_SIZE_M": 8,
        "num_stages": 4,
        "num_warps": 16,
        "compile_time": 2.4845216274261475
    },
    {
        "BLOCK_SIZE_M": 32,
        "BLOCK_SIZE_N": 256,
        "BLOCK_SIZE_K": 512,
        "GROUP_SIZE_M": 8,
        "num_stages": 4,
        "num_warps": 32,
        "compile_time": 0.0041217803955078125
    },
    {
        "BLOCK_SIZE_M": 32,
        "BLOCK_SIZE_N": 256,
        "BLOCK_SIZE_K": 512,
        "GROUP_SIZE_M": 8,
        "num_stages": 5,
        "num_warps": 2,
        "compile_time": 23.040119171142578
    },
    {
        "BLOCK_SIZE_M": 32,
        "BLOCK_SIZE_N": 256,
        "BLOCK_SIZE_K": 512,
        "GROUP_SIZE_M": 8,
        "num_stages": 5,
        "num_warps": 4,
        "compile_time": 6.943100690841675
    },
    {
        "BLOCK_SIZE_M": 32,
        "BLOCK_SIZE_N": 256,
        "BLOCK_SIZE_K": 512,
        "GROUP_SIZE_M": 8,
        "num_stages": 5,
        "num_warps": 8,
        "compile_time": 11.566335678100586
    },
    {
        "BLOCK_SIZE_M": 32,
        "BLOCK_SIZE_N": 256,
        "BLOCK_SIZE_K": 512,
        "GROUP_SIZE_M": 8,
        "num_stages": 5,
        "num_warps": 16,
        "compile_time": 2.693572521209717
    },
    {
        "BLOCK_SIZE_M": 32,
        "BLOCK_SIZE_N": 256,
        "BLOCK_SIZE_K": 512,
        "GROUP_SIZE_M": 8,
        "num_stages": 5,
        "num_warps": 32,
        "compile_time": 0.00419163703918457
    },
    {
        "BLOCK_SIZE_M": 32,
        "BLOCK_SIZE_N": 256,
        "BLOCK_SIZE_K": 512,
        "GROUP_SIZE_M": 8,
        "num_stages": 6,
        "num_warps": 2,
        "compile_time": 23.413841247558594
    },
    {
        "BLOCK_SIZE_M": 32,
        "BLOCK_SIZE_N": 256,
        "BLOCK_SIZE_K": 512,
        "GROUP_SIZE_M": 8,
        "num_stages": 6,
        "num_warps": 4,
        "compile_time": 7.2348926067352295
    },
    {
        "BLOCK_SIZE_M": 32,
        "BLOCK_SIZE_N": 256,
        "BLOCK_SIZE_K": 512,
        "GROUP_SIZE_M": 8,
        "num_stages": 6,
        "num_warps": 8,
        "compile_time": 11.460168600082397
    },
    {
        "BLOCK_SIZE_M": 32,
        "BLOCK_SIZE_N": 256,
        "BLOCK_SIZE_K": 512,
        "GROUP_SIZE_M": 8,
        "num_stages": 6,
        "num_warps": 16,
        "compile_time": 2.8422436714172363
    },
    {
        "BLOCK_SIZE_M": 32,
        "BLOCK_SIZE_N": 256,
        "BLOCK_SIZE_K": 512,
        "GROUP_SIZE_M": 8,
        "num_stages": 6,
        "num_warps": 32,
        "compile_time": 1.405212163925171
    },
    {
        "BLOCK_SIZE_M": 32,
        "BLOCK_SIZE_N": 256,
        "BLOCK_SIZE_K": 512,
        "GROUP_SIZE_M": 8,
        "num_stages": 7,
        "num_warps": 2,
        "compile_time": 6.1794984340667725
    },
    {
        "BLOCK_SIZE_M": 32,
        "BLOCK_SIZE_N": 256,
        "BLOCK_SIZE_K": 512,
        "GROUP_SIZE_M": 8,
        "num_stages": 7,
        "num_warps": 4,
        "compile_time": 7.936550140380859
    },
    {
        "BLOCK_SIZE_M": 32,
        "BLOCK_SIZE_N": 256,
        "BLOCK_SIZE_K": 512,
        "GROUP_SIZE_M": 8,
        "num_stages": 7,
        "num_warps": 8,
        "compile_time": 12.092983722686768
    },
    {
        "BLOCK_SIZE_M": 32,
        "BLOCK_SIZE_N": 256,
        "BLOCK_SIZE_K": 512,
        "GROUP_SIZE_M": 8,
        "num_stages": 7,
        "num_warps": 16,
        "compile_time": 3.071059465408325
    },
    {
        "BLOCK_SIZE_M": 32,
        "BLOCK_SIZE_N": 256,
        "BLOCK_SIZE_K": 512,
        "GROUP_SIZE_M": 8,
        "num_stages": 7,
        "num_warps": 32,
        "compile_time": 1.5384306907653809
    },
    {
        "BLOCK_SIZE_M": 32,
        "BLOCK_SIZE_N": 256,
        "BLOCK_SIZE_K": 512,
        "GROUP_SIZE_M": 8,
        "num_stages": 8,
        "num_warps": 2,
        "compile_time": 6.862876892089844
    },
    {
        "BLOCK_SIZE_M": 32,
        "BLOCK_SIZE_N": 256,
        "BLOCK_SIZE_K": 512,
        "GROUP_SIZE_M": 8,
        "num_stages": 8,
        "num_warps": 4,
        "compile_time": 8.186089992523193
    },
    {
        "BLOCK_SIZE_M": 32,
        "BLOCK_SIZE_N": 256,
        "BLOCK_SIZE_K": 512,
        "GROUP_SIZE_M": 8,
        "num_stages": 8,
        "num_warps": 8,
        "compile_time": 12.113803625106812
    },
    {
        "BLOCK_SIZE_M": 32,
        "BLOCK_SIZE_N": 256,
        "BLOCK_SIZE_K": 512,
        "GROUP_SIZE_M": 8,
        "num_stages": 8,
        "num_warps": 16,
        "compile_time": 3.2304649353027344
    },
    {
        "BLOCK_SIZE_M": 32,
        "BLOCK_SIZE_N": 256,
        "BLOCK_SIZE_K": 512,
        "GROUP_SIZE_M": 8,
        "num_stages": 8,
        "num_warps": 32,
        "compile_time": 1.6271698474884033
    },
    {
        "BLOCK_SIZE_M": 32,
        "BLOCK_SIZE_N": 512,
        "BLOCK_SIZE_K": 32,
        "GROUP_SIZE_M": 8,
        "num_stages": 6,
        "num_warps": 2,
        "compile_time": 4.163022994995117
    },
    {
        "BLOCK_SIZE_M": 32,
        "BLOCK_SIZE_N": 512,
        "BLOCK_SIZE_K": 32,
        "GROUP_SIZE_M": 8,
        "num_stages": 6,
        "num_warps": 4,
        "compile_time": 1.566368818283081
    },
    {
        "BLOCK_SIZE_M": 32,
        "BLOCK_SIZE_N": 512,
        "BLOCK_SIZE_K": 32,
        "GROUP_SIZE_M": 8,
        "num_stages": 6,
        "num_warps": 8,
        "compile_time": 0.861973762512207
    },
    {
        "BLOCK_SIZE_M": 32,
        "BLOCK_SIZE_N": 512,
        "BLOCK_SIZE_K": 32,
        "GROUP_SIZE_M": 8,
        "num_stages": 6,
        "num_warps": 16,
        "compile_time": 0.6081092357635498
    },
    {
        "BLOCK_SIZE_M": 32,
        "BLOCK_SIZE_N": 512,
        "BLOCK_SIZE_K": 32,
        "GROUP_SIZE_M": 8,
        "num_stages": 7,
        "num_warps": 2,
        "compile_time": 4.279400587081909
    },
    {
        "BLOCK_SIZE_M": 32,
        "BLOCK_SIZE_N": 512,
        "BLOCK_SIZE_K": 32,
        "GROUP_SIZE_M": 8,
        "num_stages": 7,
        "num_warps": 4,
        "compile_time": 1.6271238327026367
    },
    {
        "BLOCK_SIZE_M": 32,
        "BLOCK_SIZE_N": 512,
        "BLOCK_SIZE_K": 32,
        "GROUP_SIZE_M": 8,
        "num_stages": 7,
        "num_warps": 8,
        "compile_time": 0.91200852394104
    },
    {
        "BLOCK_SIZE_M": 32,
        "BLOCK_SIZE_N": 512,
        "BLOCK_SIZE_K": 32,
        "GROUP_SIZE_M": 8,
        "num_stages": 7,
        "num_warps": 16,
        "compile_time": 0.6222841739654541
    },
    {
        "BLOCK_SIZE_M": 32,
        "BLOCK_SIZE_N": 512,
        "BLOCK_SIZE_K": 32,
        "GROUP_SIZE_M": 8,
        "num_stages": 7,
        "num_warps": 32,
        "compile_time": 0.4777991771697998
    },
    {
        "BLOCK_SIZE_M": 32,
        "BLOCK_SIZE_N": 512,
        "BLOCK_SIZE_K": 32,
        "GROUP_SIZE_M": 8,
        "num_stages": 8,
        "num_warps": 2,
        "compile_time": 4.39460015296936
    },
    {
        "BLOCK_SIZE_M": 32,
        "BLOCK_SIZE_N": 512,
        "BLOCK_SIZE_K": 32,
        "GROUP_SIZE_M": 8,
        "num_stages": 8,
        "num_warps": 4,
        "compile_time": 1.7109248638153076
    },
    {
        "BLOCK_SIZE_M": 32,
        "BLOCK_SIZE_N": 512,
        "BLOCK_SIZE_K": 32,
        "GROUP_SIZE_M": 8,
        "num_stages": 8,
        "num_warps": 8,
        "compile_time": 0.9337668418884277
    },
    {
        "BLOCK_SIZE_M": 32,
        "BLOCK_SIZE_N": 512,
        "BLOCK_SIZE_K": 32,
        "GROUP_SIZE_M": 8,
        "num_stages": 8,
        "num_warps": 16,
        "compile_time": 0.6538019180297852
    },
    {
        "BLOCK_SIZE_M": 32,
        "BLOCK_SIZE_N": 512,
        "BLOCK_SIZE_K": 32,
        "GROUP_SIZE_M": 8,
        "num_stages": 8,
        "num_warps": 32,
        "compile_time": 0.49097657203674316
    },
    {
        "BLOCK_SIZE_M": 32,
        "BLOCK_SIZE_N": 512,
        "BLOCK_SIZE_K": 64,
        "GROUP_SIZE_M": 8,
        "num_stages": 2,
        "num_warps": 2,
        "compile_time": 6.030278921127319
    },
    {
        "BLOCK_SIZE_M": 32,
        "BLOCK_SIZE_N": 512,
        "BLOCK_SIZE_K": 64,
        "GROUP_SIZE_M": 8,
        "num_stages": 3,
        "num_warps": 2,
        "compile_time": 12.462172985076904
    },
    {
        "BLOCK_SIZE_M": 32,
        "BLOCK_SIZE_N": 512,
        "BLOCK_SIZE_K": 64,
        "GROUP_SIZE_M": 8,
        "num_stages": 4,
        "num_warps": 2,
        "compile_time": 12.437997102737427
    },
    {
        "BLOCK_SIZE_M": 32,
        "BLOCK_SIZE_N": 512,
        "BLOCK_SIZE_K": 64,
        "GROUP_SIZE_M": 8,
        "num_stages": 4,
        "num_warps": 4,
        "compile_time": 2.5716140270233154
    },
    {
        "BLOCK_SIZE_M": 32,
        "BLOCK_SIZE_N": 512,
        "BLOCK_SIZE_K": 64,
        "GROUP_SIZE_M": 8,
        "num_stages": 4,
        "num_warps": 8,
        "compile_time": 1.1387341022491455
    },
    {
        "BLOCK_SIZE_M": 32,
        "BLOCK_SIZE_N": 512,
        "BLOCK_SIZE_K": 64,
        "GROUP_SIZE_M": 8,
        "num_stages": 4,
        "num_warps": 16,
        "compile_time": 0.005251169204711914
    },
    {
        "BLOCK_SIZE_M": 32,
        "BLOCK_SIZE_N": 512,
        "BLOCK_SIZE_K": 64,
        "GROUP_SIZE_M": 8,
        "num_stages": 4,
        "num_warps": 32,
        "compile_time": 0.5503134727478027
    },
    {
        "BLOCK_SIZE_M": 32,
        "BLOCK_SIZE_N": 512,
        "BLOCK_SIZE_K": 64,
        "GROUP_SIZE_M": 8,
        "num_stages": 5,
        "num_warps": 2,
        "compile_time": 12.755894660949707
    },
    {
        "BLOCK_SIZE_M": 32,
        "BLOCK_SIZE_N": 512,
        "BLOCK_SIZE_K": 64,
        "GROUP_SIZE_M": 8,
        "num_stages": 5,
        "num_warps": 4,
        "compile_time": 2.7072629928588867
    },
    {
        "BLOCK_SIZE_M": 32,
        "BLOCK_SIZE_N": 512,
        "BLOCK_SIZE_K": 64,
        "GROUP_SIZE_M": 8,
        "num_stages": 5,
        "num_warps": 8,
        "compile_time": 1.1962311267852783
    },
    {
        "BLOCK_SIZE_M": 32,
        "BLOCK_SIZE_N": 512,
        "BLOCK_SIZE_K": 64,
        "GROUP_SIZE_M": 8,
        "num_stages": 5,
        "num_warps": 16,
        "compile_time": 0.7545151710510254
    },
    {
        "BLOCK_SIZE_M": 32,
        "BLOCK_SIZE_N": 512,
        "BLOCK_SIZE_K": 64,
        "GROUP_SIZE_M": 8,
        "num_stages": 5,
        "num_warps": 32,
        "compile_time": 0.004305839538574219
    },
    {
        "BLOCK_SIZE_M": 32,
        "BLOCK_SIZE_N": 512,
        "BLOCK_SIZE_K": 64,
        "GROUP_SIZE_M": 8,
        "num_stages": 6,
        "num_warps": 2,
        "compile_time": 12.785139799118042
    },
    {
        "BLOCK_SIZE_M": 32,
        "BLOCK_SIZE_N": 512,
        "BLOCK_SIZE_K": 64,
        "GROUP_SIZE_M": 8,
        "num_stages": 6,
        "num_warps": 4,
        "compile_time": 2.858384370803833
    },
    {
        "BLOCK_SIZE_M": 32,
        "BLOCK_SIZE_N": 512,
        "BLOCK_SIZE_K": 64,
        "GROUP_SIZE_M": 8,
        "num_stages": 6,
        "num_warps": 8,
        "compile_time": 1.3377857208251953
    },
    {
        "BLOCK_SIZE_M": 32,
        "BLOCK_SIZE_N": 512,
        "BLOCK_SIZE_K": 64,
        "GROUP_SIZE_M": 8,
        "num_stages": 6,
        "num_warps": 16,
        "compile_time": 0.8121566772460938
    },
    {
        "BLOCK_SIZE_M": 32,
        "BLOCK_SIZE_N": 512,
        "BLOCK_SIZE_K": 64,
        "GROUP_SIZE_M": 8,
        "num_stages": 6,
        "num_warps": 32,
        "compile_time": 0.005368471145629883
    },
    {
        "BLOCK_SIZE_M": 32,
        "BLOCK_SIZE_N": 512,
        "BLOCK_SIZE_K": 64,
        "GROUP_SIZE_M": 8,
        "num_stages": 7,
        "num_warps": 2,
        "compile_time": 13.010048389434814
    },
    {
        "BLOCK_SIZE_M": 32,
        "BLOCK_SIZE_N": 512,
        "BLOCK_SIZE_K": 64,
        "GROUP_SIZE_M": 8,
        "num_stages": 7,
        "num_warps": 4,
        "compile_time": 3.045762538909912
    },
    {
        "BLOCK_SIZE_M": 32,
        "BLOCK_SIZE_N": 512,
        "BLOCK_SIZE_K": 64,
        "GROUP_SIZE_M": 8,
        "num_stages": 7,
        "num_warps": 8,
        "compile_time": 1.3682763576507568
    },
    {
        "BLOCK_SIZE_M": 32,
        "BLOCK_SIZE_N": 512,
        "BLOCK_SIZE_K": 64,
        "GROUP_SIZE_M": 8,
        "num_stages": 7,
        "num_warps": 16,
        "compile_time": 0.005251646041870117
    },
    {
        "BLOCK_SIZE_M": 32,
        "BLOCK_SIZE_N": 512,
        "BLOCK_SIZE_K": 64,
        "GROUP_SIZE_M": 8,
        "num_stages": 7,
        "num_warps": 32,
        "compile_time": 0.6242902278900146
    },
    {
        "BLOCK_SIZE_M": 32,
        "BLOCK_SIZE_N": 512,
        "BLOCK_SIZE_K": 64,
        "GROUP_SIZE_M": 8,
        "num_stages": 8,
        "num_warps": 2,
        "compile_time": 13.142945051193237
    },
    {
        "BLOCK_SIZE_M": 32,
        "BLOCK_SIZE_N": 512,
        "BLOCK_SIZE_K": 64,
        "GROUP_SIZE_M": 8,
        "num_stages": 8,
        "num_warps": 4,
        "compile_time": 3.1403262615203857
    },
    {
        "BLOCK_SIZE_M": 32,
        "BLOCK_SIZE_N": 512,
        "BLOCK_SIZE_K": 64,
        "GROUP_SIZE_M": 8,
        "num_stages": 8,
        "num_warps": 8,
        "compile_time": 1.4527454376220703
    },
    {
        "BLOCK_SIZE_M": 32,
        "BLOCK_SIZE_N": 512,
        "BLOCK_SIZE_K": 64,
        "GROUP_SIZE_M": 8,
        "num_stages": 8,
        "num_warps": 16,
        "compile_time": 0.8997437953948975
    },
    {
        "BLOCK_SIZE_M": 32,
        "BLOCK_SIZE_N": 512,
        "BLOCK_SIZE_K": 64,
        "GROUP_SIZE_M": 8,
        "num_stages": 8,
        "num_warps": 32,
        "compile_time": 0.6466286182403564
    },
    {
        "BLOCK_SIZE_M": 32,
        "BLOCK_SIZE_N": 512,
        "BLOCK_SIZE_K": 128,
        "GROUP_SIZE_M": 8,
        "num_stages": 1,
        "num_warps": 2,
        "compile_time": 9.581331729888916
    },
    {
        "BLOCK_SIZE_M": 32,
        "BLOCK_SIZE_N": 512,
        "BLOCK_SIZE_K": 128,
        "GROUP_SIZE_M": 8,
        "num_stages": 2,
        "num_warps": 2,
        "compile_time": 6.064678192138672
    },
    {
        "BLOCK_SIZE_M": 32,
        "BLOCK_SIZE_N": 512,
        "BLOCK_SIZE_K": 128,
        "GROUP_SIZE_M": 8,
        "num_stages": 3,
        "num_warps": 2,
        "compile_time": 6.381212949752808
    },
    {
        "BLOCK_SIZE_M": 32,
        "BLOCK_SIZE_N": 512,
        "BLOCK_SIZE_K": 128,
        "GROUP_SIZE_M": 8,
        "num_stages": 3,
        "num_warps": 4,
        "compile_time": 11.06183385848999
    },
    {
        "BLOCK_SIZE_M": 32,
        "BLOCK_SIZE_N": 512,
        "BLOCK_SIZE_K": 128,
        "GROUP_SIZE_M": 8,
        "num_stages": 3,
        "num_warps": 8,
        "compile_time": 2.1422829627990723
    },
    {
        "BLOCK_SIZE_M": 32,
        "BLOCK_SIZE_N": 512,
        "BLOCK_SIZE_K": 128,
        "GROUP_SIZE_M": 8,
        "num_stages": 3,
        "num_warps": 16,
        "compile_time": 1.0181026458740234
    },
    {
        "BLOCK_SIZE_M": 32,
        "BLOCK_SIZE_N": 512,
        "BLOCK_SIZE_K": 128,
        "GROUP_SIZE_M": 8,
        "num_stages": 3,
        "num_warps": 32,
        "compile_time": 0.00503993034362793
    },
    {
        "BLOCK_SIZE_M": 32,
        "BLOCK_SIZE_N": 512,
        "BLOCK_SIZE_K": 128,
        "GROUP_SIZE_M": 8,
        "num_stages": 4,
        "num_warps": 2,
        "compile_time": 6.654717445373535
    },
    {
        "BLOCK_SIZE_M": 32,
        "BLOCK_SIZE_N": 512,
        "BLOCK_SIZE_K": 128,
        "GROUP_SIZE_M": 8,
        "num_stages": 4,
        "num_warps": 4,
        "compile_time": 11.184350728988647
    },
    {
        "BLOCK_SIZE_M": 32,
        "BLOCK_SIZE_N": 512,
        "BLOCK_SIZE_K": 128,
        "GROUP_SIZE_M": 8,
        "num_stages": 4,
        "num_warps": 8,
        "compile_time": 2.317467212677002
    },
    {
        "BLOCK_SIZE_M": 32,
        "BLOCK_SIZE_N": 512,
        "BLOCK_SIZE_K": 128,
        "GROUP_SIZE_M": 8,
        "num_stages": 4,
        "num_warps": 16,
        "compile_time": 1.103672981262207
    },
    {
        "BLOCK_SIZE_M": 32,
        "BLOCK_SIZE_N": 512,
        "BLOCK_SIZE_K": 128,
        "GROUP_SIZE_M": 8,
        "num_stages": 4,
        "num_warps": 32,
        "compile_time": 0.7259688377380371
    },
    {
        "BLOCK_SIZE_M": 32,
        "BLOCK_SIZE_N": 512,
        "BLOCK_SIZE_K": 128,
        "GROUP_SIZE_M": 8,
        "num_stages": 5,
        "num_warps": 2,
        "compile_time": 7.023399114608765
    },
    {
        "BLOCK_SIZE_M": 32,
        "BLOCK_SIZE_N": 512,
        "BLOCK_SIZE_K": 128,
        "GROUP_SIZE_M": 8,
        "num_stages": 5,
        "num_warps": 4,
        "compile_time": 11.072104930877686
    },
    {
        "BLOCK_SIZE_M": 32,
        "BLOCK_SIZE_N": 512,
        "BLOCK_SIZE_K": 128,
        "GROUP_SIZE_M": 8,
        "num_stages": 5,
        "num_warps": 8,
        "compile_time": 2.4550302028656006
    },
    {
        "BLOCK_SIZE_M": 32,
        "BLOCK_SIZE_N": 512,
        "BLOCK_SIZE_K": 128,
        "GROUP_SIZE_M": 8,
        "num_stages": 5,
        "num_warps": 16,
        "compile_time": 1.2037169933319092
    },
    {
        "BLOCK_SIZE_M": 32,
        "BLOCK_SIZE_N": 512,
        "BLOCK_SIZE_K": 128,
        "GROUP_SIZE_M": 8,
        "num_stages": 5,
        "num_warps": 32,
        "compile_time": 0.005451202392578125
    },
    {
        "BLOCK_SIZE_M": 32,
        "BLOCK_SIZE_N": 512,
        "BLOCK_SIZE_K": 128,
        "GROUP_SIZE_M": 8,
        "num_stages": 6,
        "num_warps": 2,
        "compile_time": 7.3380818367004395
    },
    {
        "BLOCK_SIZE_M": 32,
        "BLOCK_SIZE_N": 512,
        "BLOCK_SIZE_K": 128,
        "GROUP_SIZE_M": 8,
        "num_stages": 6,
        "num_warps": 4,
        "compile_time": 11.140188694000244
    },
    {
        "BLOCK_SIZE_M": 32,
        "BLOCK_SIZE_N": 512,
        "BLOCK_SIZE_K": 128,
        "GROUP_SIZE_M": 8,
        "num_stages": 6,
        "num_warps": 8,
        "compile_time": 2.6134352684020996
    },
    {
        "BLOCK_SIZE_M": 32,
        "BLOCK_SIZE_N": 512,
        "BLOCK_SIZE_K": 128,
        "GROUP_SIZE_M": 8,
        "num_stages": 6,
        "num_warps": 16,
        "compile_time": 1.2857000827789307
    },
    {
        "BLOCK_SIZE_M": 32,
        "BLOCK_SIZE_N": 512,
        "BLOCK_SIZE_K": 128,
        "GROUP_SIZE_M": 8,
        "num_stages": 6,
        "num_warps": 32,
        "compile_time": 0.8411428928375244
    },
    {
        "BLOCK_SIZE_M": 32,
        "BLOCK_SIZE_N": 512,
        "BLOCK_SIZE_K": 128,
        "GROUP_SIZE_M": 8,
        "num_stages": 7,
        "num_warps": 2,
        "compile_time": 7.716708183288574
    },
    {
        "BLOCK_SIZE_M": 32,
        "BLOCK_SIZE_N": 512,
        "BLOCK_SIZE_K": 128,
        "GROUP_SIZE_M": 8,
        "num_stages": 7,
        "num_warps": 4,
        "compile_time": 11.799335718154907
    },
    {
        "BLOCK_SIZE_M": 32,
        "BLOCK_SIZE_N": 512,
        "BLOCK_SIZE_K": 128,
        "GROUP_SIZE_M": 8,
        "num_stages": 7,
        "num_warps": 8,
        "compile_time": 2.758542537689209
    },
    {
        "BLOCK_SIZE_M": 32,
        "BLOCK_SIZE_N": 512,
        "BLOCK_SIZE_K": 128,
        "GROUP_SIZE_M": 8,
        "num_stages": 7,
        "num_warps": 16,
        "compile_time": 1.3752195835113525
    },
    {
        "BLOCK_SIZE_M": 32,
        "BLOCK_SIZE_N": 512,
        "BLOCK_SIZE_K": 128,
        "GROUP_SIZE_M": 8,
        "num_stages": 7,
        "num_warps": 32,
        "compile_time": 0.0057468414306640625
    },
    {
        "BLOCK_SIZE_M": 32,
        "BLOCK_SIZE_N": 512,
        "BLOCK_SIZE_K": 128,
        "GROUP_SIZE_M": 8,
        "num_stages": 8,
        "num_warps": 2,
        "compile_time": 8.230045318603516
    },
    {
        "BLOCK_SIZE_M": 32,
        "BLOCK_SIZE_N": 512,
        "BLOCK_SIZE_K": 128,
        "GROUP_SIZE_M": 8,
        "num_stages": 8,
        "num_warps": 4,
        "compile_time": 12.226890325546265
    },
    {
        "BLOCK_SIZE_M": 32,
        "BLOCK_SIZE_N": 512,
        "BLOCK_SIZE_K": 128,
        "GROUP_SIZE_M": 8,
        "num_stages": 8,
        "num_warps": 8,
        "compile_time": 2.9696176052093506
    },
    {
        "BLOCK_SIZE_M": 32,
        "BLOCK_SIZE_N": 512,
        "BLOCK_SIZE_K": 128,
        "GROUP_SIZE_M": 8,
        "num_stages": 8,
        "num_warps": 16,
        "compile_time": 1.505641222000122
    },
    {
        "BLOCK_SIZE_M": 32,
        "BLOCK_SIZE_N": 512,
        "BLOCK_SIZE_K": 128,
        "GROUP_SIZE_M": 8,
        "num_stages": 8,
        "num_warps": 32,
        "compile_time": 0.0051364898681640625
    },
    {
        "BLOCK_SIZE_M": 32,
        "BLOCK_SIZE_N": 512,
        "BLOCK_SIZE_K": 256,
        "GROUP_SIZE_M": 8,
        "num_stages": 1,
        "num_warps": 2,
        "compile_time": 19.96944785118103
    },
    {
        "BLOCK_SIZE_M": 32,
        "BLOCK_SIZE_N": 512,
        "BLOCK_SIZE_K": 256,
        "GROUP_SIZE_M": 8,
        "num_stages": 1,
        "num_warps": 4,
        "compile_time": 8.419359683990479
    },
    {
        "BLOCK_SIZE_M": 32,
        "BLOCK_SIZE_N": 512,
        "BLOCK_SIZE_K": 256,
        "GROUP_SIZE_M": 8,
        "num_stages": 1,
        "num_warps": 8,
        "compile_time": 3.071643829345703
    },
    {
        "BLOCK_SIZE_M": 32,
        "BLOCK_SIZE_N": 512,
        "BLOCK_SIZE_K": 256,
        "GROUP_SIZE_M": 8,
        "num_stages": 1,
        "num_warps": 16,
        "compile_time": 0.004787921905517578
    },
    {
        "BLOCK_SIZE_M": 32,
        "BLOCK_SIZE_N": 512,
        "BLOCK_SIZE_K": 256,
        "GROUP_SIZE_M": 8,
        "num_stages": 1,
        "num_warps": 32,
        "compile_time": 0.7728984355926514
    },
    {
        "BLOCK_SIZE_M": 32,
        "BLOCK_SIZE_N": 512,
        "BLOCK_SIZE_K": 256,
        "GROUP_SIZE_M": 8,
        "num_stages": 2,
        "num_warps": 2,
        "compile_time": 20.24370503425598
    },
    {
        "BLOCK_SIZE_M": 32,
        "BLOCK_SIZE_N": 512,
        "BLOCK_SIZE_K": 256,
        "GROUP_SIZE_M": 8,
        "num_stages": 2,
        "num_warps": 4,
        "compile_time": 8.450557470321655
    },
    {
        "BLOCK_SIZE_M": 32,
        "BLOCK_SIZE_N": 512,
        "BLOCK_SIZE_K": 256,
        "GROUP_SIZE_M": 8,
        "num_stages": 2,
        "num_warps": 8,
        "compile_time": 3.4565672874450684
    },
    {
        "BLOCK_SIZE_M": 32,
        "BLOCK_SIZE_N": 512,
        "BLOCK_SIZE_K": 256,
        "GROUP_SIZE_M": 8,
        "num_stages": 2,
        "num_warps": 16,
        "compile_time": 0.0033321380615234375
    },
    {
        "BLOCK_SIZE_M": 32,
        "BLOCK_SIZE_N": 512,
        "BLOCK_SIZE_K": 256,
        "GROUP_SIZE_M": 8,
        "num_stages": 2,
        "num_warps": 32,
        "compile_time": 0.9081628322601318
    },
    {
        "BLOCK_SIZE_M": 32,
        "BLOCK_SIZE_N": 512,
        "BLOCK_SIZE_K": 256,
        "GROUP_SIZE_M": 8,
        "num_stages": 3,
        "num_warps": 2,
        "compile_time": 21.143787622451782
    },
    {
        "BLOCK_SIZE_M": 32,
        "BLOCK_SIZE_N": 512,
        "BLOCK_SIZE_K": 256,
        "GROUP_SIZE_M": 8,
        "num_stages": 3,
        "num_warps": 4,
        "compile_time": 6.092965602874756
    },
    {
        "BLOCK_SIZE_M": 32,
        "BLOCK_SIZE_N": 512,
        "BLOCK_SIZE_K": 256,
        "GROUP_SIZE_M": 8,
        "num_stages": 3,
        "num_warps": 8,
        "compile_time": 10.795403003692627
    },
    {
        "BLOCK_SIZE_M": 32,
        "BLOCK_SIZE_N": 512,
        "BLOCK_SIZE_K": 256,
        "GROUP_SIZE_M": 8,
        "num_stages": 3,
        "num_warps": 16,
        "compile_time": 2.1673974990844727
    },
    {
        "BLOCK_SIZE_M": 32,
        "BLOCK_SIZE_N": 512,
        "BLOCK_SIZE_K": 256,
        "GROUP_SIZE_M": 8,
        "num_stages": 3,
        "num_warps": 32,
        "compile_time": 1.0743906497955322
    },
    {
        "BLOCK_SIZE_M": 32,
        "BLOCK_SIZE_N": 512,
        "BLOCK_SIZE_K": 256,
        "GROUP_SIZE_M": 8,
        "num_stages": 4,
        "num_warps": 2,
        "compile_time": 21.819897413253784
    },
    {
        "BLOCK_SIZE_M": 32,
        "BLOCK_SIZE_N": 512,
        "BLOCK_SIZE_K": 256,
        "GROUP_SIZE_M": 8,
        "num_stages": 4,
        "num_warps": 4,
        "compile_time": 6.490157842636108
    },
    {
        "BLOCK_SIZE_M": 32,
        "BLOCK_SIZE_N": 512,
        "BLOCK_SIZE_K": 256,
        "GROUP_SIZE_M": 8,
        "num_stages": 4,
        "num_warps": 8,
        "compile_time": 11.15688681602478
    },
    {
        "BLOCK_SIZE_M": 32,
        "BLOCK_SIZE_N": 512,
        "BLOCK_SIZE_K": 256,
        "GROUP_SIZE_M": 8,
        "num_stages": 4,
        "num_warps": 16,
        "compile_time": 2.3295211791992188
    },
    {
        "BLOCK_SIZE_M": 32,
        "BLOCK_SIZE_N": 512,
        "BLOCK_SIZE_K": 256,
        "GROUP_SIZE_M": 8,
        "num_stages": 4,
        "num_warps": 32,
        "compile_time": 1.1643693447113037
    },
    {
        "BLOCK_SIZE_M": 32,
        "BLOCK_SIZE_N": 512,
        "BLOCK_SIZE_K": 256,
        "GROUP_SIZE_M": 8,
        "num_stages": 5,
        "num_warps": 2,
        "compile_time": 22.7385036945343
    },
    {
        "BLOCK_SIZE_M": 32,
        "BLOCK_SIZE_N": 512,
        "BLOCK_SIZE_K": 256,
        "GROUP_SIZE_M": 8,
        "num_stages": 5,
        "num_warps": 4,
        "compile_time": 6.841844797134399
    },
    {
        "BLOCK_SIZE_M": 32,
        "BLOCK_SIZE_N": 512,
        "BLOCK_SIZE_K": 256,
        "GROUP_SIZE_M": 8,
        "num_stages": 5,
        "num_warps": 8,
        "compile_time": 11.413472890853882
    },
    {
        "BLOCK_SIZE_M": 32,
        "BLOCK_SIZE_N": 512,
        "BLOCK_SIZE_K": 256,
        "GROUP_SIZE_M": 8,
        "num_stages": 5,
        "num_warps": 16,
        "compile_time": 2.520461320877075
    },
    {
        "BLOCK_SIZE_M": 32,
        "BLOCK_SIZE_N": 512,
        "BLOCK_SIZE_K": 256,
        "GROUP_SIZE_M": 8,
        "num_stages": 5,
        "num_warps": 32,
        "compile_time": 0.0043447017669677734
    },
    {
        "BLOCK_SIZE_M": 32,
        "BLOCK_SIZE_N": 512,
        "BLOCK_SIZE_K": 256,
        "GROUP_SIZE_M": 8,
        "num_stages": 6,
        "num_warps": 2,
        "compile_time": 23.46709418296814
    },
    {
        "BLOCK_SIZE_M": 32,
        "BLOCK_SIZE_N": 512,
        "BLOCK_SIZE_K": 256,
        "GROUP_SIZE_M": 8,
        "num_stages": 6,
        "num_warps": 4,
        "compile_time": 7.203026056289673
    },
    {
        "BLOCK_SIZE_M": 32,
        "BLOCK_SIZE_N": 512,
        "BLOCK_SIZE_K": 256,
        "GROUP_SIZE_M": 8,
        "num_stages": 6,
        "num_warps": 8,
        "compile_time": 11.741586446762085
    },
    {
        "BLOCK_SIZE_M": 32,
        "BLOCK_SIZE_N": 512,
        "BLOCK_SIZE_K": 256,
        "GROUP_SIZE_M": 8,
        "num_stages": 6,
        "num_warps": 16,
        "compile_time": 2.7338457107543945
    },
    {
        "BLOCK_SIZE_M": 32,
        "BLOCK_SIZE_N": 512,
        "BLOCK_SIZE_K": 256,
        "GROUP_SIZE_M": 8,
        "num_stages": 6,
        "num_warps": 32,
        "compile_time": 0.003273487091064453
    },
    {
        "BLOCK_SIZE_M": 32,
        "BLOCK_SIZE_N": 512,
        "BLOCK_SIZE_K": 256,
        "GROUP_SIZE_M": 8,
        "num_stages": 7,
        "num_warps": 2,
        "compile_time": 6.2186431884765625
    },
    {
        "BLOCK_SIZE_M": 32,
        "BLOCK_SIZE_N": 512,
        "BLOCK_SIZE_K": 256,
        "GROUP_SIZE_M": 8,
        "num_stages": 7,
        "num_warps": 4,
        "compile_time": 7.800987958908081
    },
    {
        "BLOCK_SIZE_M": 32,
        "BLOCK_SIZE_N": 512,
        "BLOCK_SIZE_K": 256,
        "GROUP_SIZE_M": 8,
        "num_stages": 7,
        "num_warps": 8,
        "compile_time": 11.826272249221802
    },
    {
        "BLOCK_SIZE_M": 32,
        "BLOCK_SIZE_N": 512,
        "BLOCK_SIZE_K": 256,
        "GROUP_SIZE_M": 8,
        "num_stages": 7,
        "num_warps": 16,
        "compile_time": 2.886484146118164
    },
    {
        "BLOCK_SIZE_M": 32,
        "BLOCK_SIZE_N": 512,
        "BLOCK_SIZE_K": 256,
        "GROUP_SIZE_M": 8,
        "num_stages": 7,
        "num_warps": 32,
        "compile_time": 1.4714272022247314
    },
    {
        "BLOCK_SIZE_M": 32,
        "BLOCK_SIZE_N": 512,
        "BLOCK_SIZE_K": 256,
        "GROUP_SIZE_M": 8,
        "num_stages": 8,
        "num_warps": 2,
        "compile_time": 6.830674171447754
    },
    {
        "BLOCK_SIZE_M": 32,
        "BLOCK_SIZE_N": 512,
        "BLOCK_SIZE_K": 256,
        "GROUP_SIZE_M": 8,
        "num_stages": 8,
        "num_warps": 4,
        "compile_time": 8.18763256072998
    },
    {
        "BLOCK_SIZE_M": 32,
        "BLOCK_SIZE_N": 512,
        "BLOCK_SIZE_K": 256,
        "GROUP_SIZE_M": 8,
        "num_stages": 8,
        "num_warps": 8,
        "compile_time": 12.311034679412842
    },
    {
        "BLOCK_SIZE_M": 32,
        "BLOCK_SIZE_N": 512,
        "BLOCK_SIZE_K": 256,
        "GROUP_SIZE_M": 8,
        "num_stages": 8,
        "num_warps": 16,
        "compile_time": 3.065908193588257
    },
    {
        "BLOCK_SIZE_M": 32,
        "BLOCK_SIZE_N": 512,
        "BLOCK_SIZE_K": 256,
        "GROUP_SIZE_M": 8,
        "num_stages": 8,
        "num_warps": 32,
        "compile_time": 1.5646910667419434
    },
    {
        "BLOCK_SIZE_M": 32,
        "BLOCK_SIZE_N": 512,
        "BLOCK_SIZE_K": 512,
        "GROUP_SIZE_M": 8,
        "num_stages": 1,
        "num_warps": 2,
        "compile_time": 73.92432427406311
    },
    {
        "BLOCK_SIZE_M": 32,
        "BLOCK_SIZE_N": 512,
        "BLOCK_SIZE_K": 512,
        "GROUP_SIZE_M": 8,
        "num_stages": 1,
        "num_warps": 4,
        "compile_time": 19.9855637550354
    },
    {
        "BLOCK_SIZE_M": 32,
        "BLOCK_SIZE_N": 512,
        "BLOCK_SIZE_K": 512,
        "GROUP_SIZE_M": 8,
        "num_stages": 1,
        "num_warps": 8,
        "compile_time": 8.373081684112549
    },
    {
        "BLOCK_SIZE_M": 32,
        "BLOCK_SIZE_N": 512,
        "BLOCK_SIZE_K": 512,
        "GROUP_SIZE_M": 8,
        "num_stages": 1,
        "num_warps": 16,
        "compile_time": 0.0046999454498291016
    },
    {
        "BLOCK_SIZE_M": 32,
        "BLOCK_SIZE_N": 512,
        "BLOCK_SIZE_K": 512,
        "GROUP_SIZE_M": 8,
        "num_stages": 1,
        "num_warps": 32,
        "compile_time": 1.3478083610534668
    },
    {
        "BLOCK_SIZE_M": 32,
        "BLOCK_SIZE_N": 512,
        "BLOCK_SIZE_K": 512,
        "GROUP_SIZE_M": 8,
        "num_stages": 2,
        "num_warps": 2,
        "compile_time": 73.68710708618164
    },
    {
        "BLOCK_SIZE_M": 32,
        "BLOCK_SIZE_N": 512,
        "BLOCK_SIZE_K": 512,
        "GROUP_SIZE_M": 8,
        "num_stages": 2,
        "num_warps": 4,
        "compile_time": 20.434022903442383
    },
    {
        "BLOCK_SIZE_M": 32,
        "BLOCK_SIZE_N": 512,
        "BLOCK_SIZE_K": 512,
        "GROUP_SIZE_M": 8,
        "num_stages": 2,
        "num_warps": 8,
        "compile_time": 8.364942789077759
    },
    {
        "BLOCK_SIZE_M": 32,
        "BLOCK_SIZE_N": 512,
        "BLOCK_SIZE_K": 512,
        "GROUP_SIZE_M": 8,
        "num_stages": 2,
        "num_warps": 16,
        "compile_time": 3.548921585083008
    },
    {
        "BLOCK_SIZE_M": 32,
        "BLOCK_SIZE_N": 512,
        "BLOCK_SIZE_K": 512,
        "GROUP_SIZE_M": 8,
        "num_stages": 2,
        "num_warps": 32,
        "compile_time": 0.004712820053100586
    },
    {
        "BLOCK_SIZE_M": 32,
        "BLOCK_SIZE_N": 512,
        "BLOCK_SIZE_K": 512,
        "GROUP_SIZE_M": 8,
        "num_stages": 3,
        "num_warps": 2,
        "compile_time": 7.771633863449097
    },
    {
        "BLOCK_SIZE_M": 32,
        "BLOCK_SIZE_N": 512,
        "BLOCK_SIZE_K": 512,
        "GROUP_SIZE_M": 8,
        "num_stages": 3,
        "num_warps": 4,
        "compile_time": 21.00242257118225
    },
    {
        "BLOCK_SIZE_M": 32,
        "BLOCK_SIZE_N": 512,
        "BLOCK_SIZE_K": 512,
        "GROUP_SIZE_M": 8,
        "num_stages": 3,
        "num_warps": 8,
        "compile_time": 6.254220008850098
    },
    {
        "BLOCK_SIZE_M": 32,
        "BLOCK_SIZE_N": 512,
        "BLOCK_SIZE_K": 512,
        "GROUP_SIZE_M": 8,
        "num_stages": 3,
        "num_warps": 16,
        "compile_time": 11.083777666091919
    },
    {
        "BLOCK_SIZE_M": 32,
        "BLOCK_SIZE_N": 512,
        "BLOCK_SIZE_K": 512,
        "GROUP_SIZE_M": 8,
        "num_stages": 3,
        "num_warps": 32,
        "compile_time": 0.0036389827728271484
    },
    {
        "BLOCK_SIZE_M": 32,
        "BLOCK_SIZE_N": 512,
        "BLOCK_SIZE_K": 512,
        "GROUP_SIZE_M": 8,
        "num_stages": 4,
        "num_warps": 2,
        "compile_time": 9.13040542602539
    },
    {
        "BLOCK_SIZE_M": 32,
        "BLOCK_SIZE_N": 512,
        "BLOCK_SIZE_K": 512,
        "GROUP_SIZE_M": 8,
        "num_stages": 4,
        "num_warps": 4,
        "compile_time": 21.56986355781555
    },
    {
        "BLOCK_SIZE_M": 32,
        "BLOCK_SIZE_N": 512,
        "BLOCK_SIZE_K": 512,
        "GROUP_SIZE_M": 8,
        "num_stages": 4,
        "num_warps": 8,
        "compile_time": 6.751315355300903
    },
    {
        "BLOCK_SIZE_M": 32,
        "BLOCK_SIZE_N": 512,
        "BLOCK_SIZE_K": 512,
        "GROUP_SIZE_M": 8,
        "num_stages": 4,
        "num_warps": 16,
        "compile_time": 11.338931322097778
    },
    {
        "BLOCK_SIZE_M": 32,
        "BLOCK_SIZE_N": 512,
        "BLOCK_SIZE_K": 512,
        "GROUP_SIZE_M": 8,
        "num_stages": 4,
        "num_warps": 32,
        "compile_time": 2.4350526332855225
    },
    {
        "BLOCK_SIZE_M": 32,
        "BLOCK_SIZE_N": 512,
        "BLOCK_SIZE_K": 512,
        "GROUP_SIZE_M": 8,
        "num_stages": 5,
        "num_warps": 2,
        "compile_time": 11.060766696929932
    },
    {
        "BLOCK_SIZE_M": 32,
        "BLOCK_SIZE_N": 512,
        "BLOCK_SIZE_K": 512,
        "GROUP_SIZE_M": 8,
        "num_stages": 5,
        "num_warps": 4,
        "compile_time": 22.61938977241516
    },
    {
        "BLOCK_SIZE_M": 32,
        "BLOCK_SIZE_N": 512,
        "BLOCK_SIZE_K": 512,
        "GROUP_SIZE_M": 8,
        "num_stages": 5,
        "num_warps": 8,
        "compile_time": 7.1917736530303955
    },
    {
        "BLOCK_SIZE_M": 32,
        "BLOCK_SIZE_N": 512,
        "BLOCK_SIZE_K": 512,
        "GROUP_SIZE_M": 8,
        "num_stages": 5,
        "num_warps": 16,
        "compile_time": 11.56376338005066
    },
    {
        "BLOCK_SIZE_M": 32,
        "BLOCK_SIZE_N": 512,
        "BLOCK_SIZE_K": 512,
        "GROUP_SIZE_M": 8,
        "num_stages": 5,
        "num_warps": 32,
        "compile_time": 2.6194217205047607
    },
    {
        "BLOCK_SIZE_M": 32,
        "BLOCK_SIZE_N": 512,
        "BLOCK_SIZE_K": 512,
        "GROUP_SIZE_M": 8,
        "num_stages": 6,
        "num_warps": 2,
        "compile_time": 12.805166721343994
    },
    {
        "BLOCK_SIZE_M": 32,
        "BLOCK_SIZE_N": 512,
        "BLOCK_SIZE_K": 512,
        "GROUP_SIZE_M": 8,
        "num_stages": 6,
        "num_warps": 4,
        "compile_time": 23.516592502593994
    },
    {
        "BLOCK_SIZE_M": 32,
        "BLOCK_SIZE_N": 512,
        "BLOCK_SIZE_K": 512,
        "GROUP_SIZE_M": 8,
        "num_stages": 6,
        "num_warps": 8,
        "compile_time": 7.607674837112427
    },
    {
        "BLOCK_SIZE_M": 32,
        "BLOCK_SIZE_N": 512,
        "BLOCK_SIZE_K": 512,
        "GROUP_SIZE_M": 8,
        "num_stages": 6,
        "num_warps": 16,
        "compile_time": 11.758152723312378
    },
    {
        "BLOCK_SIZE_M": 32,
        "BLOCK_SIZE_N": 512,
        "BLOCK_SIZE_K": 512,
        "GROUP_SIZE_M": 8,
        "num_stages": 6,
        "num_warps": 32,
        "compile_time": 0.004143238067626953
    },
    {
        "BLOCK_SIZE_M": 32,
        "BLOCK_SIZE_N": 512,
        "BLOCK_SIZE_K": 512,
        "GROUP_SIZE_M": 8,
        "num_stages": 7,
        "num_warps": 2,
        "compile_time": 14.4217689037323
    },
    {
        "BLOCK_SIZE_M": 32,
        "BLOCK_SIZE_N": 512,
        "BLOCK_SIZE_K": 512,
        "GROUP_SIZE_M": 8,
        "num_stages": 7,
        "num_warps": 4,
        "compile_time": 6.230529546737671
    },
    {
        "BLOCK_SIZE_M": 32,
        "BLOCK_SIZE_N": 512,
        "BLOCK_SIZE_K": 512,
        "GROUP_SIZE_M": 8,
        "num_stages": 7,
        "num_warps": 8,
        "compile_time": 8.118987083435059
    },
    {
        "BLOCK_SIZE_M": 32,
        "BLOCK_SIZE_N": 512,
        "BLOCK_SIZE_K": 512,
        "GROUP_SIZE_M": 8,
        "num_stages": 7,
        "num_warps": 16,
        "compile_time": 12.057552099227905
    },
    {
        "BLOCK_SIZE_M": 32,
        "BLOCK_SIZE_N": 512,
        "BLOCK_SIZE_K": 512,
        "GROUP_SIZE_M": 8,
        "num_stages": 7,
        "num_warps": 32,
        "compile_time": 0.0040056705474853516
    },
    {
        "BLOCK_SIZE_M": 32,
        "BLOCK_SIZE_N": 512,
        "BLOCK_SIZE_K": 512,
        "GROUP_SIZE_M": 8,
        "num_stages": 8,
        "num_warps": 2,
        "compile_time": 16.474352598190308
    },
    {
        "BLOCK_SIZE_M": 32,
        "BLOCK_SIZE_N": 512,
        "BLOCK_SIZE_K": 512,
        "GROUP_SIZE_M": 8,
        "num_stages": 8,
        "num_warps": 4,
        "compile_time": 7.166694641113281
    },
    {
        "BLOCK_SIZE_M": 32,
        "BLOCK_SIZE_N": 512,
        "BLOCK_SIZE_K": 512,
        "GROUP_SIZE_M": 8,
        "num_stages": 8,
        "num_warps": 8,
        "compile_time": 8.611833810806274
    },
    {
        "BLOCK_SIZE_M": 32,
        "BLOCK_SIZE_N": 512,
        "BLOCK_SIZE_K": 512,
        "GROUP_SIZE_M": 8,
        "num_stages": 8,
        "num_warps": 16,
        "compile_time": 12.168625831604004
    },
    {
        "BLOCK_SIZE_M": 32,
        "BLOCK_SIZE_N": 512,
        "BLOCK_SIZE_K": 512,
        "GROUP_SIZE_M": 8,
        "num_stages": 8,
        "num_warps": 32,
        "compile_time": 0.004210472106933594
    },
    {
        "BLOCK_SIZE_M": 64,
        "BLOCK_SIZE_N": 16,
        "BLOCK_SIZE_K": 256,
        "GROUP_SIZE_M": 8,
        "num_stages": 6,
        "num_warps": 2,
        "compile_time": 2.55605411529541
    },
    {
        "BLOCK_SIZE_M": 64,
        "BLOCK_SIZE_N": 16,
        "BLOCK_SIZE_K": 256,
        "GROUP_SIZE_M": 8,
        "num_stages": 6,
        "num_warps": 4,
        "compile_time": 1.2540414333343506
    },
    {
        "BLOCK_SIZE_M": 64,
        "BLOCK_SIZE_N": 16,
        "BLOCK_SIZE_K": 256,
        "GROUP_SIZE_M": 8,
        "num_stages": 6,
        "num_warps": 8,
        "compile_time": 0.8370490074157715
    },
    {
        "BLOCK_SIZE_M": 64,
        "BLOCK_SIZE_N": 16,
        "BLOCK_SIZE_K": 256,
        "GROUP_SIZE_M": 8,
        "num_stages": 6,
        "num_warps": 16,
        "compile_time": 0.6786320209503174
    },
    {
        "BLOCK_SIZE_M": 64,
        "BLOCK_SIZE_N": 16,
        "BLOCK_SIZE_K": 256,
        "GROUP_SIZE_M": 8,
        "num_stages": 6,
        "num_warps": 32,
        "compile_time": 0.6014113426208496
    },
    {
        "BLOCK_SIZE_M": 64,
        "BLOCK_SIZE_N": 16,
        "BLOCK_SIZE_K": 256,
        "GROUP_SIZE_M": 8,
        "num_stages": 7,
        "num_warps": 2,
        "compile_time": 2.678245782852173
    },
    {
        "BLOCK_SIZE_M": 64,
        "BLOCK_SIZE_N": 16,
        "BLOCK_SIZE_K": 256,
        "GROUP_SIZE_M": 8,
        "num_stages": 7,
        "num_warps": 4,
        "compile_time": 1.3317971229553223
    },
    {
        "BLOCK_SIZE_M": 64,
        "BLOCK_SIZE_N": 16,
        "BLOCK_SIZE_K": 256,
        "GROUP_SIZE_M": 8,
        "num_stages": 7,
        "num_warps": 8,
        "compile_time": 0.8652968406677246
    },
    {
        "BLOCK_SIZE_M": 64,
        "BLOCK_SIZE_N": 16,
        "BLOCK_SIZE_K": 256,
        "GROUP_SIZE_M": 8,
        "num_stages": 7,
        "num_warps": 16,
        "compile_time": 0.6881134510040283
    },
    {
        "BLOCK_SIZE_M": 64,
        "BLOCK_SIZE_N": 16,
        "BLOCK_SIZE_K": 256,
        "GROUP_SIZE_M": 8,
        "num_stages": 7,
        "num_warps": 32,
        "compile_time": 0.5958266258239746
    },
    {
        "BLOCK_SIZE_M": 64,
        "BLOCK_SIZE_N": 16,
        "BLOCK_SIZE_K": 256,
        "GROUP_SIZE_M": 8,
        "num_stages": 8,
        "num_warps": 2,
        "compile_time": 2.9002082347869873
    },
    {
        "BLOCK_SIZE_M": 64,
        "BLOCK_SIZE_N": 16,
        "BLOCK_SIZE_K": 256,
        "GROUP_SIZE_M": 8,
        "num_stages": 8,
        "num_warps": 4,
        "compile_time": 1.4193065166473389
    },
    {
        "BLOCK_SIZE_M": 64,
        "BLOCK_SIZE_N": 16,
        "BLOCK_SIZE_K": 256,
        "GROUP_SIZE_M": 8,
        "num_stages": 8,
        "num_warps": 8,
        "compile_time": 0.9226922988891602
    },
    {
        "BLOCK_SIZE_M": 64,
        "BLOCK_SIZE_N": 16,
        "BLOCK_SIZE_K": 256,
        "GROUP_SIZE_M": 8,
        "num_stages": 8,
        "num_warps": 16,
        "compile_time": 0.7182960510253906
    },
    {
        "BLOCK_SIZE_M": 64,
        "BLOCK_SIZE_N": 16,
        "BLOCK_SIZE_K": 256,
        "GROUP_SIZE_M": 8,
        "num_stages": 8,
        "num_warps": 32,
        "compile_time": 0.004883289337158203
    },
    {
        "BLOCK_SIZE_M": 64,
        "BLOCK_SIZE_N": 16,
        "BLOCK_SIZE_K": 512,
        "GROUP_SIZE_M": 8,
        "num_stages": 3,
        "num_warps": 2,
        "compile_time": 11.237642526626587
    },
    {
        "BLOCK_SIZE_M": 64,
        "BLOCK_SIZE_N": 16,
        "BLOCK_SIZE_K": 512,
        "GROUP_SIZE_M": 8,
        "num_stages": 4,
        "num_warps": 2,
        "compile_time": 11.429626226425171
    },
    {
        "BLOCK_SIZE_M": 64,
        "BLOCK_SIZE_N": 16,
        "BLOCK_SIZE_K": 512,
        "GROUP_SIZE_M": 8,
        "num_stages": 4,
        "num_warps": 4,
        "compile_time": 2.3301305770874023
    },
    {
        "BLOCK_SIZE_M": 64,
        "BLOCK_SIZE_N": 16,
        "BLOCK_SIZE_K": 512,
        "GROUP_SIZE_M": 8,
        "num_stages": 4,
        "num_warps": 8,
        "compile_time": 1.1753039360046387
    },
    {
        "BLOCK_SIZE_M": 64,
        "BLOCK_SIZE_N": 16,
        "BLOCK_SIZE_K": 512,
        "GROUP_SIZE_M": 8,
        "num_stages": 4,
        "num_warps": 16,
        "compile_time": 0.8555312156677246
    },
    {
        "BLOCK_SIZE_M": 64,
        "BLOCK_SIZE_N": 16,
        "BLOCK_SIZE_K": 512,
        "GROUP_SIZE_M": 8,
        "num_stages": 4,
        "num_warps": 32,
        "compile_time": 0.005658388137817383
    },
    {
        "BLOCK_SIZE_M": 64,
        "BLOCK_SIZE_N": 16,
        "BLOCK_SIZE_K": 512,
        "GROUP_SIZE_M": 8,
        "num_stages": 5,
        "num_warps": 2,
        "compile_time": 11.600147485733032
    },
    {
        "BLOCK_SIZE_M": 64,
        "BLOCK_SIZE_N": 16,
        "BLOCK_SIZE_K": 512,
        "GROUP_SIZE_M": 8,
        "num_stages": 5,
        "num_warps": 4,
        "compile_time": 2.3975489139556885
    },
    {
        "BLOCK_SIZE_M": 64,
        "BLOCK_SIZE_N": 16,
        "BLOCK_SIZE_K": 512,
        "GROUP_SIZE_M": 8,
        "num_stages": 5,
        "num_warps": 8,
        "compile_time": 1.2639052867889404
    },
    {
        "BLOCK_SIZE_M": 64,
        "BLOCK_SIZE_N": 16,
        "BLOCK_SIZE_K": 512,
        "GROUP_SIZE_M": 8,
        "num_stages": 5,
        "num_warps": 16,
        "compile_time": 0.8796494007110596
    },
    {
        "BLOCK_SIZE_M": 64,
        "BLOCK_SIZE_N": 16,
        "BLOCK_SIZE_K": 512,
        "GROUP_SIZE_M": 8,
        "num_stages": 5,
        "num_warps": 32,
        "compile_time": 0.7605886459350586
    },
    {
        "BLOCK_SIZE_M": 64,
        "BLOCK_SIZE_N": 16,
        "BLOCK_SIZE_K": 512,
        "GROUP_SIZE_M": 8,
        "num_stages": 6,
        "num_warps": 2,
        "compile_time": 11.82004189491272
    },
    {
        "BLOCK_SIZE_M": 64,
        "BLOCK_SIZE_N": 16,
        "BLOCK_SIZE_K": 512,
        "GROUP_SIZE_M": 8,
        "num_stages": 6,
        "num_warps": 4,
        "compile_time": 2.623525619506836
    },
    {
        "BLOCK_SIZE_M": 64,
        "BLOCK_SIZE_N": 16,
        "BLOCK_SIZE_K": 512,
        "GROUP_SIZE_M": 8,
        "num_stages": 6,
        "num_warps": 8,
        "compile_time": 1.3243117332458496
    },
    {
        "BLOCK_SIZE_M": 64,
        "BLOCK_SIZE_N": 16,
        "BLOCK_SIZE_K": 512,
        "GROUP_SIZE_M": 8,
        "num_stages": 6,
        "num_warps": 16,
        "compile_time": 0.9323217868804932
    },
    {
        "BLOCK_SIZE_M": 64,
        "BLOCK_SIZE_N": 16,
        "BLOCK_SIZE_K": 512,
        "GROUP_SIZE_M": 8,
        "num_stages": 6,
        "num_warps": 32,
        "compile_time": 0.7789962291717529
    },
    {
        "BLOCK_SIZE_M": 64,
        "BLOCK_SIZE_N": 16,
        "BLOCK_SIZE_K": 512,
        "GROUP_SIZE_M": 8,
        "num_stages": 7,
        "num_warps": 2,
        "compile_time": 12.289811849594116
    },
    {
        "BLOCK_SIZE_M": 64,
        "BLOCK_SIZE_N": 16,
        "BLOCK_SIZE_K": 512,
        "GROUP_SIZE_M": 8,
        "num_stages": 7,
        "num_warps": 4,
        "compile_time": 2.851994514465332
    },
    {
        "BLOCK_SIZE_M": 64,
        "BLOCK_SIZE_N": 16,
        "BLOCK_SIZE_K": 512,
        "GROUP_SIZE_M": 8,
        "num_stages": 7,
        "num_warps": 8,
        "compile_time": 1.4634840488433838
    },
    {
        "BLOCK_SIZE_M": 64,
        "BLOCK_SIZE_N": 16,
        "BLOCK_SIZE_K": 512,
        "GROUP_SIZE_M": 8,
        "num_stages": 7,
        "num_warps": 16,
        "compile_time": 1.0120539665222168
    },
    {
        "BLOCK_SIZE_M": 64,
        "BLOCK_SIZE_N": 16,
        "BLOCK_SIZE_K": 512,
        "GROUP_SIZE_M": 8,
        "num_stages": 7,
        "num_warps": 32,
        "compile_time": 0.8210186958312988
    },
    {
        "BLOCK_SIZE_M": 64,
        "BLOCK_SIZE_N": 16,
        "BLOCK_SIZE_K": 512,
        "GROUP_SIZE_M": 8,
        "num_stages": 8,
        "num_warps": 2,
        "compile_time": 12.203508377075195
    },
    {
        "BLOCK_SIZE_M": 64,
        "BLOCK_SIZE_N": 16,
        "BLOCK_SIZE_K": 512,
        "GROUP_SIZE_M": 8,
        "num_stages": 8,
        "num_warps": 4,
        "compile_time": 2.963254690170288
    },
    {
        "BLOCK_SIZE_M": 64,
        "BLOCK_SIZE_N": 16,
        "BLOCK_SIZE_K": 512,
        "GROUP_SIZE_M": 8,
        "num_stages": 8,
        "num_warps": 8,
        "compile_time": 1.5090274810791016
    },
    {
        "BLOCK_SIZE_M": 64,
        "BLOCK_SIZE_N": 16,
        "BLOCK_SIZE_K": 512,
        "GROUP_SIZE_M": 8,
        "num_stages": 8,
        "num_warps": 16,
        "compile_time": 1.1085646152496338
    },
    {
        "BLOCK_SIZE_M": 64,
        "BLOCK_SIZE_N": 16,
        "BLOCK_SIZE_K": 512,
        "GROUP_SIZE_M": 8,
        "num_stages": 8,
        "num_warps": 32,
        "compile_time": 0.0059778690338134766
    },
    {
        "BLOCK_SIZE_M": 64,
        "BLOCK_SIZE_N": 32,
        "BLOCK_SIZE_K": 128,
        "GROUP_SIZE_M": 8,
        "num_stages": 8,
        "num_warps": 2,
        "compile_time": 1.5419418811798096
    },
    {
        "BLOCK_SIZE_M": 64,
        "BLOCK_SIZE_N": 32,
        "BLOCK_SIZE_K": 128,
        "GROUP_SIZE_M": 8,
        "num_stages": 8,
        "num_warps": 4,
        "compile_time": 0.969641923904419
    },
    {
        "BLOCK_SIZE_M": 64,
        "BLOCK_SIZE_N": 32,
        "BLOCK_SIZE_K": 128,
        "GROUP_SIZE_M": 8,
        "num_stages": 8,
        "num_warps": 8,
        "compile_time": 0.6784090995788574
    },
    {
        "BLOCK_SIZE_M": 64,
        "BLOCK_SIZE_N": 32,
        "BLOCK_SIZE_K": 128,
        "GROUP_SIZE_M": 8,
        "num_stages": 8,
        "num_warps": 16,
        "compile_time": 0.5599424839019775
    },
    {
        "BLOCK_SIZE_M": 64,
        "BLOCK_SIZE_N": 32,
        "BLOCK_SIZE_K": 128,
        "GROUP_SIZE_M": 8,
        "num_stages": 8,
        "num_warps": 32,
        "compile_time": 0.5152485370635986
    },
    {
        "BLOCK_SIZE_M": 64,
        "BLOCK_SIZE_N": 32,
        "BLOCK_SIZE_K": 256,
        "GROUP_SIZE_M": 8,
        "num_stages": 5,
        "num_warps": 2,
        "compile_time": 2.8833580017089844
    },
    {
        "BLOCK_SIZE_M": 64,
        "BLOCK_SIZE_N": 32,
        "BLOCK_SIZE_K": 256,
        "GROUP_SIZE_M": 8,
        "num_stages": 5,
        "num_warps": 4,
        "compile_time": 1.297598123550415
    },
    {
        "BLOCK_SIZE_M": 64,
        "BLOCK_SIZE_N": 32,
        "BLOCK_SIZE_K": 256,
        "GROUP_SIZE_M": 8,
        "num_stages": 5,
        "num_warps": 8,
        "compile_time": 0.8762538433074951
    },
    {
        "BLOCK_SIZE_M": 64,
        "BLOCK_SIZE_N": 32,
        "BLOCK_SIZE_K": 256,
        "GROUP_SIZE_M": 8,
        "num_stages": 5,
        "num_warps": 16,
        "compile_time": 0.006147146224975586
    },
    {
        "BLOCK_SIZE_M": 64,
        "BLOCK_SIZE_N": 32,
        "BLOCK_SIZE_K": 256,
        "GROUP_SIZE_M": 8,
        "num_stages": 5,
        "num_warps": 32,
        "compile_time": 0.5887472629547119
    },
    {
        "BLOCK_SIZE_M": 64,
        "BLOCK_SIZE_N": 32,
        "BLOCK_SIZE_K": 256,
        "GROUP_SIZE_M": 8,
        "num_stages": 6,
        "num_warps": 2,
        "compile_time": 3.0855202674865723
    },
    {
        "BLOCK_SIZE_M": 64,
        "BLOCK_SIZE_N": 32,
        "BLOCK_SIZE_K": 256,
        "GROUP_SIZE_M": 8,
        "num_stages": 6,
        "num_warps": 4,
        "compile_time": 1.4208931922912598
    },
    {
        "BLOCK_SIZE_M": 64,
        "BLOCK_SIZE_N": 32,
        "BLOCK_SIZE_K": 256,
        "GROUP_SIZE_M": 8,
        "num_stages": 6,
        "num_warps": 8,
        "compile_time": 0.924793004989624
    },
    {
        "BLOCK_SIZE_M": 64,
        "BLOCK_SIZE_N": 32,
        "BLOCK_SIZE_K": 256,
        "GROUP_SIZE_M": 8,
        "num_stages": 6,
        "num_warps": 16,
        "compile_time": 0.6856255531311035
    },
    {
        "BLOCK_SIZE_M": 64,
        "BLOCK_SIZE_N": 32,
        "BLOCK_SIZE_K": 256,
        "GROUP_SIZE_M": 8,
        "num_stages": 6,
        "num_warps": 32,
        "compile_time": 0.5816521644592285
    },
    {
        "BLOCK_SIZE_M": 64,
        "BLOCK_SIZE_N": 32,
        "BLOCK_SIZE_K": 256,
        "GROUP_SIZE_M": 8,
        "num_stages": 7,
        "num_warps": 2,
        "compile_time": 3.233064889907837
    },
    {
        "BLOCK_SIZE_M": 64,
        "BLOCK_SIZE_N": 32,
        "BLOCK_SIZE_K": 256,
        "GROUP_SIZE_M": 8,
        "num_stages": 7,
        "num_warps": 4,
        "compile_time": 1.5646483898162842
    },
    {
        "BLOCK_SIZE_M": 64,
        "BLOCK_SIZE_N": 32,
        "BLOCK_SIZE_K": 256,
        "GROUP_SIZE_M": 8,
        "num_stages": 7,
        "num_warps": 8,
        "compile_time": 0.9793751239776611
    },
    {
        "BLOCK_SIZE_M": 64,
        "BLOCK_SIZE_N": 32,
        "BLOCK_SIZE_K": 256,
        "GROUP_SIZE_M": 8,
        "num_stages": 7,
        "num_warps": 16,
        "compile_time": 0.7007362842559814
    },
    {
        "BLOCK_SIZE_M": 64,
        "BLOCK_SIZE_N": 32,
        "BLOCK_SIZE_K": 256,
        "GROUP_SIZE_M": 8,
        "num_stages": 7,
        "num_warps": 32,
        "compile_time": 0.6051347255706787
    },
    {
        "BLOCK_SIZE_M": 64,
        "BLOCK_SIZE_N": 32,
        "BLOCK_SIZE_K": 256,
        "GROUP_SIZE_M": 8,
        "num_stages": 8,
        "num_warps": 2,
        "compile_time": 3.41973876953125
    },
    {
        "BLOCK_SIZE_M": 64,
        "BLOCK_SIZE_N": 32,
        "BLOCK_SIZE_K": 256,
        "GROUP_SIZE_M": 8,
        "num_stages": 8,
        "num_warps": 4,
        "compile_time": 1.5967297554016113
    },
    {
        "BLOCK_SIZE_M": 64,
        "BLOCK_SIZE_N": 32,
        "BLOCK_SIZE_K": 256,
        "GROUP_SIZE_M": 8,
        "num_stages": 8,
        "num_warps": 8,
        "compile_time": 1.0270588397979736
    },
    {
        "BLOCK_SIZE_M": 64,
        "BLOCK_SIZE_N": 32,
        "BLOCK_SIZE_K": 256,
        "GROUP_SIZE_M": 8,
        "num_stages": 8,
        "num_warps": 16,
        "compile_time": 0.7015340328216553
    },
    {
        "BLOCK_SIZE_M": 64,
        "BLOCK_SIZE_N": 32,
        "BLOCK_SIZE_K": 256,
        "GROUP_SIZE_M": 8,
        "num_stages": 8,
        "num_warps": 32,
        "compile_time": 0.616593599319458
    },
    {
        "BLOCK_SIZE_M": 64,
        "BLOCK_SIZE_N": 32,
        "BLOCK_SIZE_K": 512,
        "GROUP_SIZE_M": 8,
        "num_stages": 3,
        "num_warps": 2,
        "compile_time": 13.027652263641357
    },
    {
        "BLOCK_SIZE_M": 64,
        "BLOCK_SIZE_N": 32,
        "BLOCK_SIZE_K": 512,
        "GROUP_SIZE_M": 8,
        "num_stages": 3,
        "num_warps": 4,
        "compile_time": 2.597308874130249
    },
    {
        "BLOCK_SIZE_M": 64,
        "BLOCK_SIZE_N": 32,
        "BLOCK_SIZE_K": 512,
        "GROUP_SIZE_M": 8,
        "num_stages": 3,
        "num_warps": 8,
        "compile_time": 1.2067935466766357
    },
    {
        "BLOCK_SIZE_M": 64,
        "BLOCK_SIZE_N": 32,
        "BLOCK_SIZE_K": 512,
        "GROUP_SIZE_M": 8,
        "num_stages": 3,
        "num_warps": 16,
        "compile_time": 0.8487548828125
    },
    {
        "BLOCK_SIZE_M": 64,
        "BLOCK_SIZE_N": 32,
        "BLOCK_SIZE_K": 512,
        "GROUP_SIZE_M": 8,
        "num_stages": 3,
        "num_warps": 32,
        "compile_time": 0.7225284576416016
    },
    {
        "BLOCK_SIZE_M": 64,
        "BLOCK_SIZE_N": 32,
        "BLOCK_SIZE_K": 512,
        "GROUP_SIZE_M": 8,
        "num_stages": 4,
        "num_warps": 2,
        "compile_time": 13.259268999099731
    },
    {
        "BLOCK_SIZE_M": 64,
        "BLOCK_SIZE_N": 32,
        "BLOCK_SIZE_K": 512,
        "GROUP_SIZE_M": 8,
        "num_stages": 4,
        "num_warps": 4,
        "compile_time": 2.820301055908203
    },
    {
        "BLOCK_SIZE_M": 64,
        "BLOCK_SIZE_N": 32,
        "BLOCK_SIZE_K": 512,
        "GROUP_SIZE_M": 8,
        "num_stages": 4,
        "num_warps": 8,
        "compile_time": 1.3056142330169678
    },
    {
        "BLOCK_SIZE_M": 64,
        "BLOCK_SIZE_N": 32,
        "BLOCK_SIZE_K": 512,
        "GROUP_SIZE_M": 8,
        "num_stages": 4,
        "num_warps": 16,
        "compile_time": 0.8800380229949951
    },
    {
        "BLOCK_SIZE_M": 64,
        "BLOCK_SIZE_N": 32,
        "BLOCK_SIZE_K": 512,
        "GROUP_SIZE_M": 8,
        "num_stages": 4,
        "num_warps": 32,
        "compile_time": 0.7446949481964111
    },
    {
        "BLOCK_SIZE_M": 64,
        "BLOCK_SIZE_N": 32,
        "BLOCK_SIZE_K": 512,
        "GROUP_SIZE_M": 8,
        "num_stages": 5,
        "num_warps": 2,
        "compile_time": 13.674937725067139
    },
    {
        "BLOCK_SIZE_M": 64,
        "BLOCK_SIZE_N": 32,
        "BLOCK_SIZE_K": 512,
        "GROUP_SIZE_M": 8,
        "num_stages": 5,
        "num_warps": 4,
        "compile_time": 2.9477012157440186
    },
    {
        "BLOCK_SIZE_M": 64,
        "BLOCK_SIZE_N": 32,
        "BLOCK_SIZE_K": 512,
        "GROUP_SIZE_M": 8,
        "num_stages": 5,
        "num_warps": 8,
        "compile_time": 1.3880274295806885
    },
    {
        "BLOCK_SIZE_M": 64,
        "BLOCK_SIZE_N": 32,
        "BLOCK_SIZE_K": 512,
        "GROUP_SIZE_M": 8,
        "num_stages": 5,
        "num_warps": 16,
        "compile_time": 0.9456095695495605
    },
    {
        "BLOCK_SIZE_M": 64,
        "BLOCK_SIZE_N": 32,
        "BLOCK_SIZE_K": 512,
        "GROUP_SIZE_M": 8,
        "num_stages": 5,
        "num_warps": 32,
        "compile_time": 0.7818520069122314
    },
    {
        "BLOCK_SIZE_M": 64,
        "BLOCK_SIZE_N": 32,
        "BLOCK_SIZE_K": 512,
        "GROUP_SIZE_M": 8,
        "num_stages": 6,
        "num_warps": 2,
        "compile_time": 13.694990158081055
    },
    {
        "BLOCK_SIZE_M": 64,
        "BLOCK_SIZE_N": 32,
        "BLOCK_SIZE_K": 512,
        "GROUP_SIZE_M": 8,
        "num_stages": 6,
        "num_warps": 4,
        "compile_time": 3.144784450531006
    },
    {
        "BLOCK_SIZE_M": 64,
        "BLOCK_SIZE_N": 32,
        "BLOCK_SIZE_K": 512,
        "GROUP_SIZE_M": 8,
        "num_stages": 6,
        "num_warps": 8,
        "compile_time": 1.4725470542907715
    },
    {
        "BLOCK_SIZE_M": 64,
        "BLOCK_SIZE_N": 32,
        "BLOCK_SIZE_K": 512,
        "GROUP_SIZE_M": 8,
        "num_stages": 6,
        "num_warps": 16,
        "compile_time": 0.994936466217041
    },
    {
        "BLOCK_SIZE_M": 64,
        "BLOCK_SIZE_N": 32,
        "BLOCK_SIZE_K": 512,
        "GROUP_SIZE_M": 8,
        "num_stages": 6,
        "num_warps": 32,
        "compile_time": 0.8025074005126953
    },
    {
        "BLOCK_SIZE_M": 64,
        "BLOCK_SIZE_N": 32,
        "BLOCK_SIZE_K": 512,
        "GROUP_SIZE_M": 8,
        "num_stages": 7,
        "num_warps": 2,
        "compile_time": 14.061866760253906
    },
    {
        "BLOCK_SIZE_M": 64,
        "BLOCK_SIZE_N": 32,
        "BLOCK_SIZE_K": 512,
        "GROUP_SIZE_M": 8,
        "num_stages": 7,
        "num_warps": 4,
        "compile_time": 3.3658416271209717
    },
    {
        "BLOCK_SIZE_M": 64,
        "BLOCK_SIZE_N": 32,
        "BLOCK_SIZE_K": 512,
        "GROUP_SIZE_M": 8,
        "num_stages": 7,
        "num_warps": 8,
        "compile_time": 1.6493825912475586
    },
    {
        "BLOCK_SIZE_M": 64,
        "BLOCK_SIZE_N": 32,
        "BLOCK_SIZE_K": 512,
        "GROUP_SIZE_M": 8,
        "num_stages": 7,
        "num_warps": 16,
        "compile_time": 1.046170711517334
    },
    {
        "BLOCK_SIZE_M": 64,
        "BLOCK_SIZE_N": 32,
        "BLOCK_SIZE_K": 512,
        "GROUP_SIZE_M": 8,
        "num_stages": 7,
        "num_warps": 32,
        "compile_time": 0.0053675174713134766
    },
    {
        "BLOCK_SIZE_M": 64,
        "BLOCK_SIZE_N": 32,
        "BLOCK_SIZE_K": 512,
        "GROUP_SIZE_M": 8,
        "num_stages": 8,
        "num_warps": 2,
        "compile_time": 14.132320880889893
    },
    {
        "BLOCK_SIZE_M": 64,
        "BLOCK_SIZE_N": 32,
        "BLOCK_SIZE_K": 512,
        "GROUP_SIZE_M": 8,
        "num_stages": 8,
        "num_warps": 4,
        "compile_time": 3.467383623123169
    },
    {
        "BLOCK_SIZE_M": 64,
        "BLOCK_SIZE_N": 32,
        "BLOCK_SIZE_K": 512,
        "GROUP_SIZE_M": 8,
        "num_stages": 8,
        "num_warps": 8,
        "compile_time": 1.6910667419433594
    },
    {
        "BLOCK_SIZE_M": 64,
        "BLOCK_SIZE_N": 32,
        "BLOCK_SIZE_K": 512,
        "GROUP_SIZE_M": 8,
        "num_stages": 8,
        "num_warps": 16,
        "compile_time": 1.0992021560668945
    },
    {
        "BLOCK_SIZE_M": 64,
        "BLOCK_SIZE_N": 32,
        "BLOCK_SIZE_K": 512,
        "GROUP_SIZE_M": 8,
        "num_stages": 8,
        "num_warps": 32,
        "compile_time": 0.8699145317077637
    },
    {
        "BLOCK_SIZE_M": 64,
        "BLOCK_SIZE_N": 64,
        "BLOCK_SIZE_K": 128,
        "GROUP_SIZE_M": 8,
        "num_stages": 7,
        "num_warps": 2,
        "compile_time": 1.959000587463379
    },
    {
        "BLOCK_SIZE_M": 64,
        "BLOCK_SIZE_N": 64,
        "BLOCK_SIZE_K": 128,
        "GROUP_SIZE_M": 8,
        "num_stages": 7,
        "num_warps": 4,
        "compile_time": 1.146047592163086
    },
    {
        "BLOCK_SIZE_M": 64,
        "BLOCK_SIZE_N": 64,
        "BLOCK_SIZE_K": 128,
        "GROUP_SIZE_M": 8,
        "num_stages": 7,
        "num_warps": 8,
        "compile_time": 0.7966363430023193
    },
    {
        "BLOCK_SIZE_M": 64,
        "BLOCK_SIZE_N": 64,
        "BLOCK_SIZE_K": 128,
        "GROUP_SIZE_M": 8,
        "num_stages": 7,
        "num_warps": 16,
        "compile_time": 0.632420539855957
    },
    {
        "BLOCK_SIZE_M": 64,
        "BLOCK_SIZE_N": 64,
        "BLOCK_SIZE_K": 128,
        "GROUP_SIZE_M": 8,
        "num_stages": 7,
        "num_warps": 32,
        "compile_time": 0.5197062492370605
    },
    {
        "BLOCK_SIZE_M": 64,
        "BLOCK_SIZE_N": 64,
        "BLOCK_SIZE_K": 128,
        "GROUP_SIZE_M": 8,
        "num_stages": 8,
        "num_warps": 2,
        "compile_time": 2.076582908630371
    },
    {
        "BLOCK_SIZE_M": 64,
        "BLOCK_SIZE_N": 64,
        "BLOCK_SIZE_K": 128,
        "GROUP_SIZE_M": 8,
        "num_stages": 8,
        "num_warps": 4,
        "compile_time": 1.1770122051239014
    },
    {
        "BLOCK_SIZE_M": 64,
        "BLOCK_SIZE_N": 64,
        "BLOCK_SIZE_K": 128,
        "GROUP_SIZE_M": 8,
        "num_stages": 8,
        "num_warps": 8,
        "compile_time": 0.8169317245483398
    },
    {
        "BLOCK_SIZE_M": 64,
        "BLOCK_SIZE_N": 64,
        "BLOCK_SIZE_K": 128,
        "GROUP_SIZE_M": 8,
        "num_stages": 8,
        "num_warps": 16,
        "compile_time": 0.6132981777191162
    },
    {
        "BLOCK_SIZE_M": 64,
        "BLOCK_SIZE_N": 64,
        "BLOCK_SIZE_K": 128,
        "GROUP_SIZE_M": 8,
        "num_stages": 8,
        "num_warps": 32,
        "compile_time": 0.004639387130737305
    },
    {
        "BLOCK_SIZE_M": 64,
        "BLOCK_SIZE_N": 64,
        "BLOCK_SIZE_K": 256,
        "GROUP_SIZE_M": 8,
        "num_stages": 4,
        "num_warps": 2,
        "compile_time": 4.28467583656311
    },
    {
        "BLOCK_SIZE_M": 64,
        "BLOCK_SIZE_N": 64,
        "BLOCK_SIZE_K": 256,
        "GROUP_SIZE_M": 8,
        "num_stages": 4,
        "num_warps": 4,
        "compile_time": 1.595184326171875
    },
    {
        "BLOCK_SIZE_M": 64,
        "BLOCK_SIZE_N": 64,
        "BLOCK_SIZE_K": 256,
        "GROUP_SIZE_M": 8,
        "num_stages": 4,
        "num_warps": 8,
        "compile_time": 0.9829237461090088
    },
    {
        "BLOCK_SIZE_M": 64,
        "BLOCK_SIZE_N": 64,
        "BLOCK_SIZE_K": 256,
        "GROUP_SIZE_M": 8,
        "num_stages": 4,
        "num_warps": 16,
        "compile_time": 0.005222797393798828
    },
    {
        "BLOCK_SIZE_M": 64,
        "BLOCK_SIZE_N": 64,
        "BLOCK_SIZE_K": 256,
        "GROUP_SIZE_M": 8,
        "num_stages": 4,
        "num_warps": 32,
        "compile_time": 0.5822815895080566
    },
    {
        "BLOCK_SIZE_M": 64,
        "BLOCK_SIZE_N": 64,
        "BLOCK_SIZE_K": 256,
        "GROUP_SIZE_M": 8,
        "num_stages": 5,
        "num_warps": 2,
        "compile_time": 4.362566232681274
    },
    {
        "BLOCK_SIZE_M": 64,
        "BLOCK_SIZE_N": 64,
        "BLOCK_SIZE_K": 256,
        "GROUP_SIZE_M": 8,
        "num_stages": 5,
        "num_warps": 4,
        "compile_time": 1.7126736640930176
    },
    {
        "BLOCK_SIZE_M": 64,
        "BLOCK_SIZE_N": 64,
        "BLOCK_SIZE_K": 256,
        "GROUP_SIZE_M": 8,
        "num_stages": 5,
        "num_warps": 8,
        "compile_time": 1.0485615730285645
    },
    {
        "BLOCK_SIZE_M": 64,
        "BLOCK_SIZE_N": 64,
        "BLOCK_SIZE_K": 256,
        "GROUP_SIZE_M": 8,
        "num_stages": 5,
        "num_warps": 16,
        "compile_time": 0.7480959892272949
    },
    {
        "BLOCK_SIZE_M": 64,
        "BLOCK_SIZE_N": 64,
        "BLOCK_SIZE_K": 256,
        "GROUP_SIZE_M": 8,
        "num_stages": 5,
        "num_warps": 32,
        "compile_time": 0.6111204624176025
    },
    {
        "BLOCK_SIZE_M": 64,
        "BLOCK_SIZE_N": 64,
        "BLOCK_SIZE_K": 256,
        "GROUP_SIZE_M": 8,
        "num_stages": 6,
        "num_warps": 2,
        "compile_time": 4.609286785125732
    },
    {
        "BLOCK_SIZE_M": 64,
        "BLOCK_SIZE_N": 64,
        "BLOCK_SIZE_K": 256,
        "GROUP_SIZE_M": 8,
        "num_stages": 6,
        "num_warps": 4,
        "compile_time": 1.87998628616333
    },
    {
        "BLOCK_SIZE_M": 64,
        "BLOCK_SIZE_N": 64,
        "BLOCK_SIZE_K": 256,
        "GROUP_SIZE_M": 8,
        "num_stages": 6,
        "num_warps": 8,
        "compile_time": 1.118647575378418
    },
    {
        "BLOCK_SIZE_M": 64,
        "BLOCK_SIZE_N": 64,
        "BLOCK_SIZE_K": 256,
        "GROUP_SIZE_M": 8,
        "num_stages": 6,
        "num_warps": 16,
        "compile_time": 0.7944190502166748
    },
    {
        "BLOCK_SIZE_M": 64,
        "BLOCK_SIZE_N": 64,
        "BLOCK_SIZE_K": 256,
        "GROUP_SIZE_M": 8,
        "num_stages": 6,
        "num_warps": 32,
        "compile_time": 0.0045299530029296875
    },
    {
        "BLOCK_SIZE_M": 64,
        "BLOCK_SIZE_N": 64,
        "BLOCK_SIZE_K": 256,
        "GROUP_SIZE_M": 8,
        "num_stages": 7,
        "num_warps": 2,
        "compile_time": 4.8159873485565186
    },
    {
        "BLOCK_SIZE_M": 64,
        "BLOCK_SIZE_N": 64,
        "BLOCK_SIZE_K": 256,
        "GROUP_SIZE_M": 8,
        "num_stages": 7,
        "num_warps": 4,
        "compile_time": 1.971402645111084
    },
    {
        "BLOCK_SIZE_M": 64,
        "BLOCK_SIZE_N": 64,
        "BLOCK_SIZE_K": 256,
        "GROUP_SIZE_M": 8,
        "num_stages": 7,
        "num_warps": 8,
        "compile_time": 1.1879963874816895
    },
    {
        "BLOCK_SIZE_M": 64,
        "BLOCK_SIZE_N": 64,
        "BLOCK_SIZE_K": 256,
        "GROUP_SIZE_M": 8,
        "num_stages": 7,
        "num_warps": 16,
        "compile_time": 0.8294918537139893
    },
    {
        "BLOCK_SIZE_M": 64,
        "BLOCK_SIZE_N": 64,
        "BLOCK_SIZE_K": 256,
        "GROUP_SIZE_M": 8,
        "num_stages": 7,
        "num_warps": 32,
        "compile_time": 0.6283061504364014
    },
    {
        "BLOCK_SIZE_M": 64,
        "BLOCK_SIZE_N": 64,
        "BLOCK_SIZE_K": 256,
        "GROUP_SIZE_M": 8,
        "num_stages": 8,
        "num_warps": 2,
        "compile_time": 5.051853895187378
    },
    {
        "BLOCK_SIZE_M": 64,
        "BLOCK_SIZE_N": 64,
        "BLOCK_SIZE_K": 256,
        "GROUP_SIZE_M": 8,
        "num_stages": 8,
        "num_warps": 4,
        "compile_time": 2.080286979675293
    },
    {
        "BLOCK_SIZE_M": 64,
        "BLOCK_SIZE_N": 64,
        "BLOCK_SIZE_K": 256,
        "GROUP_SIZE_M": 8,
        "num_stages": 8,
        "num_warps": 8,
        "compile_time": 1.2694170475006104
    },
    {
        "BLOCK_SIZE_M": 64,
        "BLOCK_SIZE_N": 64,
        "BLOCK_SIZE_K": 256,
        "GROUP_SIZE_M": 8,
        "num_stages": 8,
        "num_warps": 16,
        "compile_time": 0.8713562488555908
    },
    {
        "BLOCK_SIZE_M": 64,
        "BLOCK_SIZE_N": 64,
        "BLOCK_SIZE_K": 256,
        "GROUP_SIZE_M": 8,
        "num_stages": 8,
        "num_warps": 32,
        "compile_time": 0.7256805896759033
    },
    {
        "BLOCK_SIZE_M": 64,
        "BLOCK_SIZE_N": 64,
        "BLOCK_SIZE_K": 512,
        "GROUP_SIZE_M": 8,
        "num_stages": 1,
        "num_warps": 2,
        "compile_time": 6.001069784164429
    },
    {
        "BLOCK_SIZE_M": 64,
        "BLOCK_SIZE_N": 64,
        "BLOCK_SIZE_K": 512,
        "GROUP_SIZE_M": 8,
        "num_stages": 2,
        "num_warps": 2,
        "compile_time": 6.000972747802734
    },
    {
        "BLOCK_SIZE_M": 64,
        "BLOCK_SIZE_N": 64,
        "BLOCK_SIZE_K": 512,
        "GROUP_SIZE_M": 8,
        "num_stages": 3,
        "num_warps": 2,
        "compile_time": 23.863401412963867
    },
    {
        "BLOCK_SIZE_M": 64,
        "BLOCK_SIZE_N": 64,
        "BLOCK_SIZE_K": 512,
        "GROUP_SIZE_M": 8,
        "num_stages": 3,
        "num_warps": 4,
        "compile_time": 3.890228271484375
    },
    {
        "BLOCK_SIZE_M": 64,
        "BLOCK_SIZE_N": 64,
        "BLOCK_SIZE_K": 512,
        "GROUP_SIZE_M": 8,
        "num_stages": 3,
        "num_warps": 8,
        "compile_time": 1.5581302642822266
    },
    {
        "BLOCK_SIZE_M": 64,
        "BLOCK_SIZE_N": 64,
        "BLOCK_SIZE_K": 512,
        "GROUP_SIZE_M": 8,
        "num_stages": 3,
        "num_warps": 16,
        "compile_time": 0.9608571529388428
    },
    {
        "BLOCK_SIZE_M": 64,
        "BLOCK_SIZE_N": 64,
        "BLOCK_SIZE_K": 512,
        "GROUP_SIZE_M": 8,
        "num_stages": 3,
        "num_warps": 32,
        "compile_time": 0.005223512649536133
    },
    {
        "BLOCK_SIZE_M": 64,
        "BLOCK_SIZE_N": 64,
        "BLOCK_SIZE_K": 512,
        "GROUP_SIZE_M": 8,
        "num_stages": 4,
        "num_warps": 2,
        "compile_time": 24.26805830001831
    },
    {
        "BLOCK_SIZE_M": 64,
        "BLOCK_SIZE_N": 64,
        "BLOCK_SIZE_K": 512,
        "GROUP_SIZE_M": 8,
        "num_stages": 4,
        "num_warps": 4,
        "compile_time": 4.1919636726379395
    },
    {
        "BLOCK_SIZE_M": 64,
        "BLOCK_SIZE_N": 64,
        "BLOCK_SIZE_K": 512,
        "GROUP_SIZE_M": 8,
        "num_stages": 4,
        "num_warps": 8,
        "compile_time": 1.69521164894104
    },
    {
        "BLOCK_SIZE_M": 64,
        "BLOCK_SIZE_N": 64,
        "BLOCK_SIZE_K": 512,
        "GROUP_SIZE_M": 8,
        "num_stages": 4,
        "num_warps": 16,
        "compile_time": 1.0397355556488037
    },
    {
        "BLOCK_SIZE_M": 64,
        "BLOCK_SIZE_N": 64,
        "BLOCK_SIZE_K": 512,
        "GROUP_SIZE_M": 8,
        "num_stages": 4,
        "num_warps": 32,
        "compile_time": 0.7777121067047119
    },
    {
        "BLOCK_SIZE_M": 64,
        "BLOCK_SIZE_N": 64,
        "BLOCK_SIZE_K": 512,
        "GROUP_SIZE_M": 8,
        "num_stages": 5,
        "num_warps": 2,
        "compile_time": 25.55441975593567
    },
    {
        "BLOCK_SIZE_M": 64,
        "BLOCK_SIZE_N": 64,
        "BLOCK_SIZE_K": 512,
        "GROUP_SIZE_M": 8,
        "num_stages": 5,
        "num_warps": 4,
        "compile_time": 4.596545696258545
    },
    {
        "BLOCK_SIZE_M": 64,
        "BLOCK_SIZE_N": 64,
        "BLOCK_SIZE_K": 512,
        "GROUP_SIZE_M": 8,
        "num_stages": 5,
        "num_warps": 8,
        "compile_time": 0.006867170333862305
    },
    {
        "BLOCK_SIZE_M": 64,
        "BLOCK_SIZE_N": 64,
        "BLOCK_SIZE_K": 512,
        "GROUP_SIZE_M": 8,
        "num_stages": 5,
        "num_warps": 16,
        "compile_time": 1.1189994812011719
    },
    {
        "BLOCK_SIZE_M": 64,
        "BLOCK_SIZE_N": 64,
        "BLOCK_SIZE_K": 512,
        "GROUP_SIZE_M": 8,
        "num_stages": 5,
        "num_warps": 32,
        "compile_time": 0.8209905624389648
    },
    {
        "BLOCK_SIZE_M": 64,
        "BLOCK_SIZE_N": 64,
        "BLOCK_SIZE_K": 512,
        "GROUP_SIZE_M": 8,
        "num_stages": 6,
        "num_warps": 2,
        "compile_time": 25.455984354019165
    },
    {
        "BLOCK_SIZE_M": 64,
        "BLOCK_SIZE_N": 64,
        "BLOCK_SIZE_K": 512,
        "GROUP_SIZE_M": 8,
        "num_stages": 6,
        "num_warps": 4,
        "compile_time": 4.8911824226379395
    },
    {
        "BLOCK_SIZE_M": 64,
        "BLOCK_SIZE_N": 64,
        "BLOCK_SIZE_K": 512,
        "GROUP_SIZE_M": 8,
        "num_stages": 6,
        "num_warps": 8,
        "compile_time": 0.0052411556243896484
    },
    {
        "BLOCK_SIZE_M": 64,
        "BLOCK_SIZE_N": 64,
        "BLOCK_SIZE_K": 512,
        "GROUP_SIZE_M": 8,
        "num_stages": 6,
        "num_warps": 16,
        "compile_time": 1.211782455444336
    },
    {
        "BLOCK_SIZE_M": 64,
        "BLOCK_SIZE_N": 64,
        "BLOCK_SIZE_K": 512,
        "GROUP_SIZE_M": 8,
        "num_stages": 6,
        "num_warps": 32,
        "compile_time": 0.8829019069671631
    },
    {
        "BLOCK_SIZE_M": 64,
        "BLOCK_SIZE_N": 64,
        "BLOCK_SIZE_K": 512,
        "GROUP_SIZE_M": 8,
        "num_stages": 7,
        "num_warps": 2,
        "compile_time": 25.22767686843872
    },
    {
        "BLOCK_SIZE_M": 64,
        "BLOCK_SIZE_N": 64,
        "BLOCK_SIZE_K": 512,
        "GROUP_SIZE_M": 8,
        "num_stages": 7,
        "num_warps": 4,
        "compile_time": 5.116251707077026
    },
    {
        "BLOCK_SIZE_M": 64,
        "BLOCK_SIZE_N": 64,
        "BLOCK_SIZE_K": 512,
        "GROUP_SIZE_M": 8,
        "num_stages": 7,
        "num_warps": 8,
        "compile_time": 2.1462607383728027
    },
    {
        "BLOCK_SIZE_M": 64,
        "BLOCK_SIZE_N": 64,
        "BLOCK_SIZE_K": 512,
        "GROUP_SIZE_M": 8,
        "num_stages": 7,
        "num_warps": 16,
        "compile_time": 1.2734215259552002
    },
    {
        "BLOCK_SIZE_M": 64,
        "BLOCK_SIZE_N": 64,
        "BLOCK_SIZE_K": 512,
        "GROUP_SIZE_M": 8,
        "num_stages": 7,
        "num_warps": 32,
        "compile_time": 0.9267065525054932
    },
    {
        "BLOCK_SIZE_M": 64,
        "BLOCK_SIZE_N": 64,
        "BLOCK_SIZE_K": 512,
        "GROUP_SIZE_M": 8,
        "num_stages": 8,
        "num_warps": 2,
        "compile_time": 26.156078338623047
    },
    {
        "BLOCK_SIZE_M": 64,
        "BLOCK_SIZE_N": 64,
        "BLOCK_SIZE_K": 512,
        "GROUP_SIZE_M": 8,
        "num_stages": 8,
        "num_warps": 4,
        "compile_time": 5.3226096630096436
    },
    {
        "BLOCK_SIZE_M": 64,
        "BLOCK_SIZE_N": 64,
        "BLOCK_SIZE_K": 512,
        "GROUP_SIZE_M": 8,
        "num_stages": 8,
        "num_warps": 8,
        "compile_time": 2.2832677364349365
    },
    {
        "BLOCK_SIZE_M": 64,
        "BLOCK_SIZE_N": 64,
        "BLOCK_SIZE_K": 512,
        "GROUP_SIZE_M": 8,
        "num_stages": 8,
        "num_warps": 16,
        "compile_time": 0.006800651550292969
    },
    {
        "BLOCK_SIZE_M": 64,
        "BLOCK_SIZE_N": 64,
        "BLOCK_SIZE_K": 512,
        "GROUP_SIZE_M": 8,
        "num_stages": 8,
        "num_warps": 32,
        "compile_time": 0.9889976978302002
    },
    {
        "BLOCK_SIZE_M": 64,
        "BLOCK_SIZE_N": 128,
        "BLOCK_SIZE_K": 64,
        "GROUP_SIZE_M": 8,
        "num_stages": 8,
        "num_warps": 2,
        "compile_time": 1.9565939903259277
    },
    {
        "BLOCK_SIZE_M": 64,
        "BLOCK_SIZE_N": 128,
        "BLOCK_SIZE_K": 64,
        "GROUP_SIZE_M": 8,
        "num_stages": 8,
        "num_warps": 4,
        "compile_time": 1.1172583103179932
    },
    {
        "BLOCK_SIZE_M": 64,
        "BLOCK_SIZE_N": 128,
        "BLOCK_SIZE_K": 64,
        "GROUP_SIZE_M": 8,
        "num_stages": 8,
        "num_warps": 8,
        "compile_time": 0.7649405002593994
    },
    {
        "BLOCK_SIZE_M": 64,
        "BLOCK_SIZE_N": 128,
        "BLOCK_SIZE_K": 64,
        "GROUP_SIZE_M": 8,
        "num_stages": 8,
        "num_warps": 16,
        "compile_time": 0.5887351036071777
    },
    {
        "BLOCK_SIZE_M": 64,
        "BLOCK_SIZE_N": 128,
        "BLOCK_SIZE_K": 64,
        "GROUP_SIZE_M": 8,
        "num_stages": 8,
        "num_warps": 32,
        "compile_time": 0.004602909088134766
    },
    {
        "BLOCK_SIZE_M": 64,
        "BLOCK_SIZE_N": 128,
        "BLOCK_SIZE_K": 128,
        "GROUP_SIZE_M": 8,
        "num_stages": 5,
        "num_warps": 2,
        "compile_time": 3.266681671142578
    },
    {
        "BLOCK_SIZE_M": 64,
        "BLOCK_SIZE_N": 128,
        "BLOCK_SIZE_K": 128,
        "GROUP_SIZE_M": 8,
        "num_stages": 5,
        "num_warps": 4,
        "compile_time": 1.4429996013641357
    },
    {
        "BLOCK_SIZE_M": 64,
        "BLOCK_SIZE_N": 128,
        "BLOCK_SIZE_K": 128,
        "GROUP_SIZE_M": 8,
        "num_stages": 5,
        "num_warps": 8,
        "compile_time": 0.9179632663726807
    },
    {
        "BLOCK_SIZE_M": 64,
        "BLOCK_SIZE_N": 128,
        "BLOCK_SIZE_K": 128,
        "GROUP_SIZE_M": 8,
        "num_stages": 5,
        "num_warps": 16,
        "compile_time": 0.6795649528503418
    },
    {
        "BLOCK_SIZE_M": 64,
        "BLOCK_SIZE_N": 128,
        "BLOCK_SIZE_K": 128,
        "GROUP_SIZE_M": 8,
        "num_stages": 5,
        "num_warps": 32,
        "compile_time": 0.5317513942718506
    },
    {
        "BLOCK_SIZE_M": 64,
        "BLOCK_SIZE_N": 128,
        "BLOCK_SIZE_K": 128,
        "GROUP_SIZE_M": 8,
        "num_stages": 6,
        "num_warps": 2,
        "compile_time": 3.434187650680542
    },
    {
        "BLOCK_SIZE_M": 64,
        "BLOCK_SIZE_N": 128,
        "BLOCK_SIZE_K": 128,
        "GROUP_SIZE_M": 8,
        "num_stages": 6,
        "num_warps": 4,
        "compile_time": 1.5446138381958008
    },
    {
        "BLOCK_SIZE_M": 64,
        "BLOCK_SIZE_N": 128,
        "BLOCK_SIZE_K": 128,
        "GROUP_SIZE_M": 8,
        "num_stages": 6,
        "num_warps": 8,
        "compile_time": 0.9795620441436768
    },
    {
        "BLOCK_SIZE_M": 64,
        "BLOCK_SIZE_N": 128,
        "BLOCK_SIZE_K": 128,
        "GROUP_SIZE_M": 8,
        "num_stages": 6,
        "num_warps": 16,
        "compile_time": 0.7066209316253662
    },
    {
        "BLOCK_SIZE_M": 64,
        "BLOCK_SIZE_N": 128,
        "BLOCK_SIZE_K": 128,
        "GROUP_SIZE_M": 8,
        "num_stages": 6,
        "num_warps": 32,
        "compile_time": 0.5461897850036621
    },
    {
        "BLOCK_SIZE_M": 64,
        "BLOCK_SIZE_N": 128,
        "BLOCK_SIZE_K": 128,
        "GROUP_SIZE_M": 8,
        "num_stages": 7,
        "num_warps": 2,
        "compile_time": 3.708282232284546
    },
    {
        "BLOCK_SIZE_M": 64,
        "BLOCK_SIZE_N": 128,
        "BLOCK_SIZE_K": 128,
        "GROUP_SIZE_M": 8,
        "num_stages": 7,
        "num_warps": 4,
        "compile_time": 1.6374902725219727
    },
    {
        "BLOCK_SIZE_M": 64,
        "BLOCK_SIZE_N": 128,
        "BLOCK_SIZE_K": 128,
        "GROUP_SIZE_M": 8,
        "num_stages": 7,
        "num_warps": 8,
        "compile_time": 1.0406370162963867
    },
    {
        "BLOCK_SIZE_M": 64,
        "BLOCK_SIZE_N": 128,
        "BLOCK_SIZE_K": 128,
        "GROUP_SIZE_M": 8,
        "num_stages": 7,
        "num_warps": 16,
        "compile_time": 0.7270009517669678
    },
    {
        "BLOCK_SIZE_M": 64,
        "BLOCK_SIZE_N": 128,
        "BLOCK_SIZE_K": 128,
        "GROUP_SIZE_M": 8,
        "num_stages": 7,
        "num_warps": 32,
        "compile_time": 0.5642437934875488
    },
    {
        "BLOCK_SIZE_M": 64,
        "BLOCK_SIZE_N": 128,
        "BLOCK_SIZE_K": 128,
        "GROUP_SIZE_M": 8,
        "num_stages": 8,
        "num_warps": 2,
        "compile_time": 3.8369085788726807
    },
    {
        "BLOCK_SIZE_M": 64,
        "BLOCK_SIZE_N": 128,
        "BLOCK_SIZE_K": 128,
        "GROUP_SIZE_M": 8,
        "num_stages": 8,
        "num_warps": 4,
        "compile_time": 1.761810064315796
    },
    {
        "BLOCK_SIZE_M": 64,
        "BLOCK_SIZE_N": 128,
        "BLOCK_SIZE_K": 128,
        "GROUP_SIZE_M": 8,
        "num_stages": 8,
        "num_warps": 8,
        "compile_time": 1.0939199924468994
    },
    {
        "BLOCK_SIZE_M": 64,
        "BLOCK_SIZE_N": 128,
        "BLOCK_SIZE_K": 128,
        "GROUP_SIZE_M": 8,
        "num_stages": 8,
        "num_warps": 16,
        "compile_time": 0.767967700958252
    },
    {
        "BLOCK_SIZE_M": 64,
        "BLOCK_SIZE_N": 128,
        "BLOCK_SIZE_K": 128,
        "GROUP_SIZE_M": 8,
        "num_stages": 8,
        "num_warps": 32,
        "compile_time": 0.006110429763793945
    },
    {
        "BLOCK_SIZE_M": 64,
        "BLOCK_SIZE_N": 128,
        "BLOCK_SIZE_K": 256,
        "GROUP_SIZE_M": 8,
        "num_stages": 2,
        "num_warps": 2,
        "compile_time": 6.0748374462127686
    },
    {
        "BLOCK_SIZE_M": 64,
        "BLOCK_SIZE_N": 128,
        "BLOCK_SIZE_K": 256,
        "GROUP_SIZE_M": 8,
        "num_stages": 3,
        "num_warps": 2,
        "compile_time": 13.199074745178223
    },
    {
        "BLOCK_SIZE_M": 64,
        "BLOCK_SIZE_N": 128,
        "BLOCK_SIZE_K": 256,
        "GROUP_SIZE_M": 8,
        "num_stages": 3,
        "num_warps": 4,
        "compile_time": 2.793177366256714
    },
    {
        "BLOCK_SIZE_M": 64,
        "BLOCK_SIZE_N": 128,
        "BLOCK_SIZE_K": 256,
        "GROUP_SIZE_M": 8,
        "num_stages": 3,
        "num_warps": 8,
        "compile_time": 1.266350269317627
    },
    {
        "BLOCK_SIZE_M": 64,
        "BLOCK_SIZE_N": 128,
        "BLOCK_SIZE_K": 256,
        "GROUP_SIZE_M": 8,
        "num_stages": 3,
        "num_warps": 16,
        "compile_time": 0.005257129669189453
    },
    {
        "BLOCK_SIZE_M": 64,
        "BLOCK_SIZE_N": 128,
        "BLOCK_SIZE_K": 256,
        "GROUP_SIZE_M": 8,
        "num_stages": 3,
        "num_warps": 32,
        "compile_time": 0.6559839248657227
    },
    {
        "BLOCK_SIZE_M": 64,
        "BLOCK_SIZE_N": 128,
        "BLOCK_SIZE_K": 256,
        "GROUP_SIZE_M": 8,
        "num_stages": 4,
        "num_warps": 2,
        "compile_time": 13.784806966781616
    },
    {
        "BLOCK_SIZE_M": 64,
        "BLOCK_SIZE_N": 128,
        "BLOCK_SIZE_K": 256,
        "GROUP_SIZE_M": 8,
        "num_stages": 4,
        "num_warps": 4,
        "compile_time": 2.981775999069214
    },
    {
        "BLOCK_SIZE_M": 64,
        "BLOCK_SIZE_N": 128,
        "BLOCK_SIZE_K": 256,
        "GROUP_SIZE_M": 8,
        "num_stages": 4,
        "num_warps": 8,
        "compile_time": 1.3611536026000977
    },
    {
        "BLOCK_SIZE_M": 64,
        "BLOCK_SIZE_N": 128,
        "BLOCK_SIZE_K": 256,
        "GROUP_SIZE_M": 8,
        "num_stages": 4,
        "num_warps": 16,
        "compile_time": 0.00519251823425293
    },
    {
        "BLOCK_SIZE_M": 64,
        "BLOCK_SIZE_N": 128,
        "BLOCK_SIZE_K": 256,
        "GROUP_SIZE_M": 8,
        "num_stages": 4,
        "num_warps": 32,
        "compile_time": 0.6858639717102051
    },
    {
        "BLOCK_SIZE_M": 64,
        "BLOCK_SIZE_N": 128,
        "BLOCK_SIZE_K": 256,
        "GROUP_SIZE_M": 8,
        "num_stages": 5,
        "num_warps": 2,
        "compile_time": 14.286561489105225
    },
    {
        "BLOCK_SIZE_M": 64,
        "BLOCK_SIZE_N": 128,
        "BLOCK_SIZE_K": 256,
        "GROUP_SIZE_M": 8,
        "num_stages": 5,
        "num_warps": 4,
        "compile_time": 3.1752912998199463
    },
    {
        "BLOCK_SIZE_M": 64,
        "BLOCK_SIZE_N": 128,
        "BLOCK_SIZE_K": 256,
        "GROUP_SIZE_M": 8,
        "num_stages": 5,
        "num_warps": 8,
        "compile_time": 1.5218088626861572
    },
    {
        "BLOCK_SIZE_M": 64,
        "BLOCK_SIZE_N": 128,
        "BLOCK_SIZE_K": 256,
        "GROUP_SIZE_M": 8,
        "num_stages": 5,
        "num_warps": 16,
        "compile_time": 0.005652904510498047
    },
    {
        "BLOCK_SIZE_M": 64,
        "BLOCK_SIZE_N": 128,
        "BLOCK_SIZE_K": 256,
        "GROUP_SIZE_M": 8,
        "num_stages": 5,
        "num_warps": 32,
        "compile_time": 0.7265036106109619
    },
    {
        "BLOCK_SIZE_M": 64,
        "BLOCK_SIZE_N": 128,
        "BLOCK_SIZE_K": 256,
        "GROUP_SIZE_M": 8,
        "num_stages": 6,
        "num_warps": 2,
        "compile_time": 14.083422183990479
    },
    {
        "BLOCK_SIZE_M": 64,
        "BLOCK_SIZE_N": 128,
        "BLOCK_SIZE_K": 256,
        "GROUP_SIZE_M": 8,
        "num_stages": 6,
        "num_warps": 4,
        "compile_time": 3.3849527835845947
    },
    {
        "BLOCK_SIZE_M": 64,
        "BLOCK_SIZE_N": 128,
        "BLOCK_SIZE_K": 256,
        "GROUP_SIZE_M": 8,
        "num_stages": 6,
        "num_warps": 8,
        "compile_time": 1.5808625221252441
    },
    {
        "BLOCK_SIZE_M": 64,
        "BLOCK_SIZE_N": 128,
        "BLOCK_SIZE_K": 256,
        "GROUP_SIZE_M": 8,
        "num_stages": 6,
        "num_warps": 16,
        "compile_time": 1.0304458141326904
    },
    {
        "BLOCK_SIZE_M": 64,
        "BLOCK_SIZE_N": 128,
        "BLOCK_SIZE_K": 256,
        "GROUP_SIZE_M": 8,
        "num_stages": 6,
        "num_warps": 32,
        "compile_time": 0.7610852718353271
    },
    {
        "BLOCK_SIZE_M": 64,
        "BLOCK_SIZE_N": 128,
        "BLOCK_SIZE_K": 256,
        "GROUP_SIZE_M": 8,
        "num_stages": 7,
        "num_warps": 2,
        "compile_time": 14.163607597351074
    },
    {
        "BLOCK_SIZE_M": 64,
        "BLOCK_SIZE_N": 128,
        "BLOCK_SIZE_K": 256,
        "GROUP_SIZE_M": 8,
        "num_stages": 7,
        "num_warps": 4,
        "compile_time": 3.5977578163146973
    },
    {
        "BLOCK_SIZE_M": 64,
        "BLOCK_SIZE_N": 128,
        "BLOCK_SIZE_K": 256,
        "GROUP_SIZE_M": 8,
        "num_stages": 7,
        "num_warps": 8,
        "compile_time": 1.6834430694580078
    },
    {
        "BLOCK_SIZE_M": 64,
        "BLOCK_SIZE_N": 128,
        "BLOCK_SIZE_K": 256,
        "GROUP_SIZE_M": 8,
        "num_stages": 7,
        "num_warps": 16,
        "compile_time": 0.005639076232910156
    },
    {
        "BLOCK_SIZE_M": 64,
        "BLOCK_SIZE_N": 128,
        "BLOCK_SIZE_K": 256,
        "GROUP_SIZE_M": 8,
        "num_stages": 7,
        "num_warps": 32,
        "compile_time": 0.8015396595001221
    },
    {
        "BLOCK_SIZE_M": 64,
        "BLOCK_SIZE_N": 128,
        "BLOCK_SIZE_K": 256,
        "GROUP_SIZE_M": 8,
        "num_stages": 8,
        "num_warps": 2,
        "compile_time": 14.82251238822937
    },
    {
        "BLOCK_SIZE_M": 64,
        "BLOCK_SIZE_N": 128,
        "BLOCK_SIZE_K": 256,
        "GROUP_SIZE_M": 8,
        "num_stages": 8,
        "num_warps": 4,
        "compile_time": 3.86228084564209
    },
    {
        "BLOCK_SIZE_M": 64,
        "BLOCK_SIZE_N": 128,
        "BLOCK_SIZE_K": 256,
        "GROUP_SIZE_M": 8,
        "num_stages": 8,
        "num_warps": 8,
        "compile_time": 1.8211078643798828
    },
    {
        "BLOCK_SIZE_M": 64,
        "BLOCK_SIZE_N": 128,
        "BLOCK_SIZE_K": 256,
        "GROUP_SIZE_M": 8,
        "num_stages": 8,
        "num_warps": 16,
        "compile_time": 1.1443133354187012
    },
    {
        "BLOCK_SIZE_M": 64,
        "BLOCK_SIZE_N": 128,
        "BLOCK_SIZE_K": 256,
        "GROUP_SIZE_M": 8,
        "num_stages": 8,
        "num_warps": 32,
        "compile_time": 0.004137754440307617
    },
    {
        "BLOCK_SIZE_M": 64,
        "BLOCK_SIZE_N": 128,
        "BLOCK_SIZE_K": 512,
        "GROUP_SIZE_M": 8,
        "num_stages": 1,
        "num_warps": 2,
        "compile_time": 7.1947832107543945
    },
    {
        "BLOCK_SIZE_M": 64,
        "BLOCK_SIZE_N": 128,
        "BLOCK_SIZE_K": 512,
        "GROUP_SIZE_M": 8,
        "num_stages": 1,
        "num_warps": 4,
        "compile_time": 4.414147138595581
    },
    {
        "BLOCK_SIZE_M": 64,
        "BLOCK_SIZE_N": 128,
        "BLOCK_SIZE_K": 512,
        "GROUP_SIZE_M": 8,
        "num_stages": 1,
        "num_warps": 8,
        "compile_time": 1.8594107627868652
    },
    {
        "BLOCK_SIZE_M": 64,
        "BLOCK_SIZE_N": 128,
        "BLOCK_SIZE_K": 512,
        "GROUP_SIZE_M": 8,
        "num_stages": 1,
        "num_warps": 16,
        "compile_time": 1.0447146892547607
    },
    {
        "BLOCK_SIZE_M": 64,
        "BLOCK_SIZE_N": 128,
        "BLOCK_SIZE_K": 512,
        "GROUP_SIZE_M": 8,
        "num_stages": 1,
        "num_warps": 32,
        "compile_time": 0.7264025211334229
    },
    {
        "BLOCK_SIZE_M": 64,
        "BLOCK_SIZE_N": 128,
        "BLOCK_SIZE_K": 512,
        "GROUP_SIZE_M": 8,
        "num_stages": 2,
        "num_warps": 2,
        "compile_time": 7.355004787445068
    },
    {
        "BLOCK_SIZE_M": 64,
        "BLOCK_SIZE_N": 128,
        "BLOCK_SIZE_K": 512,
        "GROUP_SIZE_M": 8,
        "num_stages": 2,
        "num_warps": 4,
        "compile_time": 4.844362735748291
    },
    {
        "BLOCK_SIZE_M": 64,
        "BLOCK_SIZE_N": 128,
        "BLOCK_SIZE_K": 512,
        "GROUP_SIZE_M": 8,
        "num_stages": 2,
        "num_warps": 8,
        "compile_time": 2.04465913772583
    },
    {
        "BLOCK_SIZE_M": 64,
        "BLOCK_SIZE_N": 128,
        "BLOCK_SIZE_K": 512,
        "GROUP_SIZE_M": 8,
        "num_stages": 2,
        "num_warps": 16,
        "compile_time": 1.1970789432525635
    },
    {
        "BLOCK_SIZE_M": 64,
        "BLOCK_SIZE_N": 128,
        "BLOCK_SIZE_K": 512,
        "GROUP_SIZE_M": 8,
        "num_stages": 2,
        "num_warps": 32,
        "compile_time": 0.8949999809265137
    },
    {
        "BLOCK_SIZE_M": 64,
        "BLOCK_SIZE_N": 128,
        "BLOCK_SIZE_K": 512,
        "GROUP_SIZE_M": 8,
        "num_stages": 3,
        "num_warps": 2,
        "compile_time": 7.857220411300659
    },
    {
        "BLOCK_SIZE_M": 64,
        "BLOCK_SIZE_N": 128,
        "BLOCK_SIZE_K": 512,
        "GROUP_SIZE_M": 8,
        "num_stages": 3,
        "num_warps": 4,
        "compile_time": 13.461397886276245
    },
    {
        "BLOCK_SIZE_M": 64,
        "BLOCK_SIZE_N": 128,
        "BLOCK_SIZE_K": 512,
        "GROUP_SIZE_M": 8,
        "num_stages": 3,
        "num_warps": 8,
        "compile_time": 2.8611648082733154
    },
    {
        "BLOCK_SIZE_M": 64,
        "BLOCK_SIZE_N": 128,
        "BLOCK_SIZE_K": 512,
        "GROUP_SIZE_M": 8,
        "num_stages": 3,
        "num_warps": 16,
        "compile_time": 0.0047075748443603516
    },
    {
        "BLOCK_SIZE_M": 64,
        "BLOCK_SIZE_N": 128,
        "BLOCK_SIZE_K": 512,
        "GROUP_SIZE_M": 8,
        "num_stages": 3,
        "num_warps": 32,
        "compile_time": 0.9225053787231445
    },
    {
        "BLOCK_SIZE_M": 64,
        "BLOCK_SIZE_N": 128,
        "BLOCK_SIZE_K": 512,
        "GROUP_SIZE_M": 8,
        "num_stages": 4,
        "num_warps": 2,
        "compile_time": 8.612863063812256
    },
    {
        "BLOCK_SIZE_M": 64,
        "BLOCK_SIZE_N": 128,
        "BLOCK_SIZE_K": 512,
        "GROUP_SIZE_M": 8,
        "num_stages": 4,
        "num_warps": 4,
        "compile_time": 13.41355013847351
    },
    {
        "BLOCK_SIZE_M": 64,
        "BLOCK_SIZE_N": 128,
        "BLOCK_SIZE_K": 512,
        "GROUP_SIZE_M": 8,
        "num_stages": 4,
        "num_warps": 8,
        "compile_time": 3.04703426361084
    },
    {
        "BLOCK_SIZE_M": 64,
        "BLOCK_SIZE_N": 128,
        "BLOCK_SIZE_K": 512,
        "GROUP_SIZE_M": 8,
        "num_stages": 4,
        "num_warps": 16,
        "compile_time": 1.5089261531829834
    },
    {
        "BLOCK_SIZE_M": 64,
        "BLOCK_SIZE_N": 128,
        "BLOCK_SIZE_K": 512,
        "GROUP_SIZE_M": 8,
        "num_stages": 4,
        "num_warps": 32,
        "compile_time": 0.004788398742675781
    },
    {
        "BLOCK_SIZE_M": 64,
        "BLOCK_SIZE_N": 128,
        "BLOCK_SIZE_K": 512,
        "GROUP_SIZE_M": 8,
        "num_stages": 5,
        "num_warps": 2,
        "compile_time": 9.017491579055786
    },
    {
        "BLOCK_SIZE_M": 64,
        "BLOCK_SIZE_N": 128,
        "BLOCK_SIZE_K": 512,
        "GROUP_SIZE_M": 8,
        "num_stages": 5,
        "num_warps": 4,
        "compile_time": 13.780012369155884
    },
    {
        "BLOCK_SIZE_M": 64,
        "BLOCK_SIZE_N": 128,
        "BLOCK_SIZE_K": 512,
        "GROUP_SIZE_M": 8,
        "num_stages": 5,
        "num_warps": 8,
        "compile_time": 3.275573492050171
    },
    {
        "BLOCK_SIZE_M": 64,
        "BLOCK_SIZE_N": 128,
        "BLOCK_SIZE_K": 512,
        "GROUP_SIZE_M": 8,
        "num_stages": 5,
        "num_warps": 16,
        "compile_time": 1.7081077098846436
    },
    {
        "BLOCK_SIZE_M": 64,
        "BLOCK_SIZE_N": 128,
        "BLOCK_SIZE_K": 512,
        "GROUP_SIZE_M": 8,
        "num_stages": 5,
        "num_warps": 32,
        "compile_time": 1.053614616394043
    },
    {
        "BLOCK_SIZE_M": 64,
        "BLOCK_SIZE_N": 128,
        "BLOCK_SIZE_K": 512,
        "GROUP_SIZE_M": 8,
        "num_stages": 6,
        "num_warps": 2,
        "compile_time": 9.593559503555298
    },
    {
        "BLOCK_SIZE_M": 64,
        "BLOCK_SIZE_N": 128,
        "BLOCK_SIZE_K": 512,
        "GROUP_SIZE_M": 8,
        "num_stages": 6,
        "num_warps": 4,
        "compile_time": 13.957650899887085
    },
    {
        "BLOCK_SIZE_M": 64,
        "BLOCK_SIZE_N": 128,
        "BLOCK_SIZE_K": 512,
        "GROUP_SIZE_M": 8,
        "num_stages": 6,
        "num_warps": 8,
        "compile_time": 3.499264717102051
    },
    {
        "BLOCK_SIZE_M": 64,
        "BLOCK_SIZE_N": 128,
        "BLOCK_SIZE_K": 512,
        "GROUP_SIZE_M": 8,
        "num_stages": 6,
        "num_warps": 16,
        "compile_time": 0.003568887710571289
    },
    {
        "BLOCK_SIZE_M": 64,
        "BLOCK_SIZE_N": 128,
        "BLOCK_SIZE_K": 512,
        "GROUP_SIZE_M": 8,
        "num_stages": 6,
        "num_warps": 32,
        "compile_time": 1.1163487434387207
    },
    {
        "BLOCK_SIZE_M": 64,
        "BLOCK_SIZE_N": 128,
        "BLOCK_SIZE_K": 512,
        "GROUP_SIZE_M": 8,
        "num_stages": 7,
        "num_warps": 2,
        "compile_time": 9.984930992126465
    },
    {
        "BLOCK_SIZE_M": 64,
        "BLOCK_SIZE_N": 128,
        "BLOCK_SIZE_K": 512,
        "GROUP_SIZE_M": 8,
        "num_stages": 7,
        "num_warps": 4,
        "compile_time": 14.398587942123413
    },
    {
        "BLOCK_SIZE_M": 64,
        "BLOCK_SIZE_N": 128,
        "BLOCK_SIZE_K": 512,
        "GROUP_SIZE_M": 8,
        "num_stages": 7,
        "num_warps": 8,
        "compile_time": 3.691601514816284
    },
    {
        "BLOCK_SIZE_M": 64,
        "BLOCK_SIZE_N": 128,
        "BLOCK_SIZE_K": 512,
        "GROUP_SIZE_M": 8,
        "num_stages": 7,
        "num_warps": 16,
        "compile_time": 1.9025020599365234
    },
    {
        "BLOCK_SIZE_M": 64,
        "BLOCK_SIZE_N": 128,
        "BLOCK_SIZE_K": 512,
        "GROUP_SIZE_M": 8,
        "num_stages": 7,
        "num_warps": 32,
        "compile_time": 0.004597187042236328
    },
    {
        "BLOCK_SIZE_M": 64,
        "BLOCK_SIZE_N": 128,
        "BLOCK_SIZE_K": 512,
        "GROUP_SIZE_M": 8,
        "num_stages": 8,
        "num_warps": 2,
        "compile_time": 10.354018926620483
    },
    {
        "BLOCK_SIZE_M": 64,
        "BLOCK_SIZE_N": 128,
        "BLOCK_SIZE_K": 512,
        "GROUP_SIZE_M": 8,
        "num_stages": 8,
        "num_warps": 4,
        "compile_time": 14.812453985214233
    },
    {
        "BLOCK_SIZE_M": 64,
        "BLOCK_SIZE_N": 128,
        "BLOCK_SIZE_K": 512,
        "GROUP_SIZE_M": 8,
        "num_stages": 8,
        "num_warps": 8,
        "compile_time": 3.9480342864990234
    },
    {
        "BLOCK_SIZE_M": 64,
        "BLOCK_SIZE_N": 128,
        "BLOCK_SIZE_K": 512,
        "GROUP_SIZE_M": 8,
        "num_stages": 8,
        "num_warps": 16,
        "compile_time": 2.025939702987671
    },
    {
        "BLOCK_SIZE_M": 64,
        "BLOCK_SIZE_N": 128,
        "BLOCK_SIZE_K": 512,
        "GROUP_SIZE_M": 8,
        "num_stages": 8,
        "num_warps": 32,
        "compile_time": 0.004149436950683594
    },
    {
        "BLOCK_SIZE_M": 64,
        "BLOCK_SIZE_N": 256,
        "BLOCK_SIZE_K": 64,
        "GROUP_SIZE_M": 8,
        "num_stages": 6,
        "num_warps": 2,
        "compile_time": 4.599734783172607
    },
    {
        "BLOCK_SIZE_M": 64,
        "BLOCK_SIZE_N": 256,
        "BLOCK_SIZE_K": 64,
        "GROUP_SIZE_M": 8,
        "num_stages": 6,
        "num_warps": 4,
        "compile_time": 1.7125580310821533
    },
    {
        "BLOCK_SIZE_M": 64,
        "BLOCK_SIZE_N": 256,
        "BLOCK_SIZE_K": 64,
        "GROUP_SIZE_M": 8,
        "num_stages": 6,
        "num_warps": 8,
        "compile_time": 1.0419790744781494
    },
    {
        "BLOCK_SIZE_M": 64,
        "BLOCK_SIZE_N": 256,
        "BLOCK_SIZE_K": 64,
        "GROUP_SIZE_M": 8,
        "num_stages": 6,
        "num_warps": 16,
        "compile_time": 0.7018659114837646
    },
    {
        "BLOCK_SIZE_M": 64,
        "BLOCK_SIZE_N": 256,
        "BLOCK_SIZE_K": 64,
        "GROUP_SIZE_M": 8,
        "num_stages": 6,
        "num_warps": 32,
        "compile_time": 0.5610344409942627
    },
    {
        "BLOCK_SIZE_M": 64,
        "BLOCK_SIZE_N": 256,
        "BLOCK_SIZE_K": 64,
        "GROUP_SIZE_M": 8,
        "num_stages": 7,
        "num_warps": 2,
        "compile_time": 4.735812664031982
    },
    {
        "BLOCK_SIZE_M": 64,
        "BLOCK_SIZE_N": 256,
        "BLOCK_SIZE_K": 64,
        "GROUP_SIZE_M": 8,
        "num_stages": 7,
        "num_warps": 4,
        "compile_time": 1.8184747695922852
    },
    {
        "BLOCK_SIZE_M": 64,
        "BLOCK_SIZE_N": 256,
        "BLOCK_SIZE_K": 64,
        "GROUP_SIZE_M": 8,
        "num_stages": 7,
        "num_warps": 8,
        "compile_time": 1.06965970993042
    },
    {
        "BLOCK_SIZE_M": 64,
        "BLOCK_SIZE_N": 256,
        "BLOCK_SIZE_K": 64,
        "GROUP_SIZE_M": 8,
        "num_stages": 7,
        "num_warps": 16,
        "compile_time": 0.7287132740020752
    },
    {
        "BLOCK_SIZE_M": 64,
        "BLOCK_SIZE_N": 256,
        "BLOCK_SIZE_K": 64,
        "GROUP_SIZE_M": 8,
        "num_stages": 7,
        "num_warps": 32,
        "compile_time": 0.564521074295044
    },
    {
        "BLOCK_SIZE_M": 64,
        "BLOCK_SIZE_N": 256,
        "BLOCK_SIZE_K": 64,
        "GROUP_SIZE_M": 8,
        "num_stages": 8,
        "num_warps": 2,
        "compile_time": 4.904409646987915
    },
    {
        "BLOCK_SIZE_M": 64,
        "BLOCK_SIZE_N": 256,
        "BLOCK_SIZE_K": 64,
        "GROUP_SIZE_M": 8,
        "num_stages": 8,
        "num_warps": 4,
        "compile_time": 1.877579689025879
    },
    {
        "BLOCK_SIZE_M": 64,
        "BLOCK_SIZE_N": 256,
        "BLOCK_SIZE_K": 64,
        "GROUP_SIZE_M": 8,
        "num_stages": 8,
        "num_warps": 8,
        "compile_time": 1.1257655620574951
    },
    {
        "BLOCK_SIZE_M": 64,
        "BLOCK_SIZE_N": 256,
        "BLOCK_SIZE_K": 64,
        "GROUP_SIZE_M": 8,
        "num_stages": 8,
        "num_warps": 16,
        "compile_time": 0.7539615631103516
    },
    {
        "BLOCK_SIZE_M": 64,
        "BLOCK_SIZE_N": 256,
        "BLOCK_SIZE_K": 64,
        "GROUP_SIZE_M": 8,
        "num_stages": 8,
        "num_warps": 32,
        "compile_time": 0.6012237071990967
    },
    {
        "BLOCK_SIZE_M": 64,
        "BLOCK_SIZE_N": 256,
        "BLOCK_SIZE_K": 128,
        "GROUP_SIZE_M": 8,
        "num_stages": 1,
        "num_warps": 2,
        "compile_time": 6.083807945251465
    },
    {
        "BLOCK_SIZE_M": 64,
        "BLOCK_SIZE_N": 256,
        "BLOCK_SIZE_K": 128,
        "GROUP_SIZE_M": 8,
        "num_stages": 2,
        "num_warps": 2,
        "compile_time": 6.081689119338989
    },
    {
        "BLOCK_SIZE_M": 64,
        "BLOCK_SIZE_N": 256,
        "BLOCK_SIZE_K": 128,
        "GROUP_SIZE_M": 8,
        "num_stages": 3,
        "num_warps": 2,
        "compile_time": 12.881415128707886
    },
    {
        "BLOCK_SIZE_M": 64,
        "BLOCK_SIZE_N": 256,
        "BLOCK_SIZE_K": 128,
        "GROUP_SIZE_M": 8,
        "num_stages": 4,
        "num_warps": 2,
        "compile_time": 13.44907808303833
    },
    {
        "BLOCK_SIZE_M": 64,
        "BLOCK_SIZE_N": 256,
        "BLOCK_SIZE_K": 128,
        "GROUP_SIZE_M": 8,
        "num_stages": 4,
        "num_warps": 4,
        "compile_time": 2.9125242233276367
    },
    {
        "BLOCK_SIZE_M": 64,
        "BLOCK_SIZE_N": 256,
        "BLOCK_SIZE_K": 128,
        "GROUP_SIZE_M": 8,
        "num_stages": 4,
        "num_warps": 8,
        "compile_time": 1.3308556079864502
    },
    {
        "BLOCK_SIZE_M": 64,
        "BLOCK_SIZE_N": 256,
        "BLOCK_SIZE_K": 128,
        "GROUP_SIZE_M": 8,
        "num_stages": 4,
        "num_warps": 16,
        "compile_time": 0.005324125289916992
    },
    {
        "BLOCK_SIZE_M": 64,
        "BLOCK_SIZE_N": 256,
        "BLOCK_SIZE_K": 128,
        "GROUP_SIZE_M": 8,
        "num_stages": 4,
        "num_warps": 32,
        "compile_time": 0.651313304901123
    },
    {
        "BLOCK_SIZE_M": 64,
        "BLOCK_SIZE_N": 256,
        "BLOCK_SIZE_K": 128,
        "GROUP_SIZE_M": 8,
        "num_stages": 5,
        "num_warps": 2,
        "compile_time": 13.375099420547485
    },
    {
        "BLOCK_SIZE_M": 64,
        "BLOCK_SIZE_N": 256,
        "BLOCK_SIZE_K": 128,
        "GROUP_SIZE_M": 8,
        "num_stages": 5,
        "num_warps": 4,
        "compile_time": 3.066316604614258
    },
    {
        "BLOCK_SIZE_M": 64,
        "BLOCK_SIZE_N": 256,
        "BLOCK_SIZE_K": 128,
        "GROUP_SIZE_M": 8,
        "num_stages": 5,
        "num_warps": 8,
        "compile_time": 1.421820878982544
    },
    {
        "BLOCK_SIZE_M": 64,
        "BLOCK_SIZE_N": 256,
        "BLOCK_SIZE_K": 128,
        "GROUP_SIZE_M": 8,
        "num_stages": 5,
        "num_warps": 16,
        "compile_time": 0.9406657218933105
    },
    {
        "BLOCK_SIZE_M": 64,
        "BLOCK_SIZE_N": 256,
        "BLOCK_SIZE_K": 128,
        "GROUP_SIZE_M": 8,
        "num_stages": 5,
        "num_warps": 32,
        "compile_time": 0.7005012035369873
    },
    {
        "BLOCK_SIZE_M": 64,
        "BLOCK_SIZE_N": 256,
        "BLOCK_SIZE_K": 128,
        "GROUP_SIZE_M": 8,
        "num_stages": 6,
        "num_warps": 2,
        "compile_time": 13.038100242614746
    },
    {
        "BLOCK_SIZE_M": 64,
        "BLOCK_SIZE_N": 256,
        "BLOCK_SIZE_K": 128,
        "GROUP_SIZE_M": 8,
        "num_stages": 6,
        "num_warps": 4,
        "compile_time": 3.2677855491638184
    },
    {
        "BLOCK_SIZE_M": 64,
        "BLOCK_SIZE_N": 256,
        "BLOCK_SIZE_K": 128,
        "GROUP_SIZE_M": 8,
        "num_stages": 6,
        "num_warps": 8,
        "compile_time": 1.5179669857025146
    },
    {
        "BLOCK_SIZE_M": 64,
        "BLOCK_SIZE_N": 256,
        "BLOCK_SIZE_K": 128,
        "GROUP_SIZE_M": 8,
        "num_stages": 6,
        "num_warps": 16,
        "compile_time": 0.9927570819854736
    },
    {
        "BLOCK_SIZE_M": 64,
        "BLOCK_SIZE_N": 256,
        "BLOCK_SIZE_K": 128,
        "GROUP_SIZE_M": 8,
        "num_stages": 6,
        "num_warps": 32,
        "compile_time": 0.7220442295074463
    },
    {
        "BLOCK_SIZE_M": 64,
        "BLOCK_SIZE_N": 256,
        "BLOCK_SIZE_K": 128,
        "GROUP_SIZE_M": 8,
        "num_stages": 7,
        "num_warps": 2,
        "compile_time": 13.899650573730469
    },
    {
        "BLOCK_SIZE_M": 64,
        "BLOCK_SIZE_N": 256,
        "BLOCK_SIZE_K": 128,
        "GROUP_SIZE_M": 8,
        "num_stages": 7,
        "num_warps": 4,
        "compile_time": 3.426966667175293
    },
    {
        "BLOCK_SIZE_M": 64,
        "BLOCK_SIZE_N": 256,
        "BLOCK_SIZE_K": 128,
        "GROUP_SIZE_M": 8,
        "num_stages": 7,
        "num_warps": 8,
        "compile_time": 1.6142218112945557
    },
    {
        "BLOCK_SIZE_M": 64,
        "BLOCK_SIZE_N": 256,
        "BLOCK_SIZE_K": 128,
        "GROUP_SIZE_M": 8,
        "num_stages": 7,
        "num_warps": 16,
        "compile_time": 1.0321681499481201
    },
    {
        "BLOCK_SIZE_M": 64,
        "BLOCK_SIZE_N": 256,
        "BLOCK_SIZE_K": 128,
        "GROUP_SIZE_M": 8,
        "num_stages": 7,
        "num_warps": 32,
        "compile_time": 0.005805015563964844
    },
    {
        "BLOCK_SIZE_M": 64,
        "BLOCK_SIZE_N": 256,
        "BLOCK_SIZE_K": 128,
        "GROUP_SIZE_M": 8,
        "num_stages": 8,
        "num_warps": 2,
        "compile_time": 14.180573225021362
    },
    {
        "BLOCK_SIZE_M": 64,
        "BLOCK_SIZE_N": 256,
        "BLOCK_SIZE_K": 128,
        "GROUP_SIZE_M": 8,
        "num_stages": 8,
        "num_warps": 4,
        "compile_time": 3.5448412895202637
    },
    {
        "BLOCK_SIZE_M": 64,
        "BLOCK_SIZE_N": 256,
        "BLOCK_SIZE_K": 128,
        "GROUP_SIZE_M": 8,
        "num_stages": 8,
        "num_warps": 8,
        "compile_time": 1.7182343006134033
    },
    {
        "BLOCK_SIZE_M": 64,
        "BLOCK_SIZE_N": 256,
        "BLOCK_SIZE_K": 128,
        "GROUP_SIZE_M": 8,
        "num_stages": 8,
        "num_warps": 16,
        "compile_time": 1.1099140644073486
    },
    {
        "BLOCK_SIZE_M": 64,
        "BLOCK_SIZE_N": 256,
        "BLOCK_SIZE_K": 128,
        "GROUP_SIZE_M": 8,
        "num_stages": 8,
        "num_warps": 32,
        "compile_time": 0.830641508102417
    },
    {
        "BLOCK_SIZE_M": 64,
        "BLOCK_SIZE_N": 256,
        "BLOCK_SIZE_K": 256,
        "GROUP_SIZE_M": 8,
        "num_stages": 1,
        "num_warps": 2,
        "compile_time": 6.286389112472534
    },
    {
        "BLOCK_SIZE_M": 64,
        "BLOCK_SIZE_N": 256,
        "BLOCK_SIZE_K": 256,
        "GROUP_SIZE_M": 8,
        "num_stages": 2,
        "num_warps": 2,
        "compile_time": 6.425559043884277
    },
    {
        "BLOCK_SIZE_M": 64,
        "BLOCK_SIZE_N": 256,
        "BLOCK_SIZE_K": 256,
        "GROUP_SIZE_M": 8,
        "num_stages": 3,
        "num_warps": 2,
        "compile_time": 6.886879920959473
    },
    {
        "BLOCK_SIZE_M": 64,
        "BLOCK_SIZE_N": 256,
        "BLOCK_SIZE_K": 256,
        "GROUP_SIZE_M": 8,
        "num_stages": 3,
        "num_warps": 4,
        "compile_time": 11.609610557556152
    },
    {
        "BLOCK_SIZE_M": 64,
        "BLOCK_SIZE_N": 256,
        "BLOCK_SIZE_K": 256,
        "GROUP_SIZE_M": 8,
        "num_stages": 3,
        "num_warps": 8,
        "compile_time": 2.5366015434265137
    },
    {
        "BLOCK_SIZE_M": 64,
        "BLOCK_SIZE_N": 256,
        "BLOCK_SIZE_K": 256,
        "GROUP_SIZE_M": 8,
        "num_stages": 3,
        "num_warps": 16,
        "compile_time": 1.217313528060913
    },
    {
        "BLOCK_SIZE_M": 64,
        "BLOCK_SIZE_N": 256,
        "BLOCK_SIZE_K": 256,
        "GROUP_SIZE_M": 8,
        "num_stages": 3,
        "num_warps": 32,
