simdata/FP16-R100/2560_results.json
[
    {
        "BLOCK_SIZE_M": 128,
        "BLOCK_SIZE_N": 256,
        "BLOCK_SIZE_K": 32,
        "GROUP_SIZE_M": 8,
        "num_stages": 4,
        "num_warps": 8,
        "ms": 0.14261752367019653,
        "min_ms": 0.14261752367019653,
        "max_ms": 0.14261752367019653,
        "compile_time": 2.339489459991455
    },
    {
        "BLOCK_SIZE_M": 128,
        "BLOCK_SIZE_N": 256,
        "BLOCK_SIZE_K": 32,
        "GROUP_SIZE_M": 8,
        "num_stages": 3,
        "num_warps": 8,
        "ms": 0.14290329813957214,
        "min_ms": 0.14290329813957214,
        "max_ms": 0.14290329813957214,
        "compile_time": 2.3120310306549072
    },
    {
        "BLOCK_SIZE_M": 256,
        "BLOCK_SIZE_N": 128,
        "BLOCK_SIZE_K": 32,
        "GROUP_SIZE_M": 8,
        "num_stages": 4,
        "num_warps": 8,
        "ms": 0.14347393810749054,
        "min_ms": 0.14347393810749054,
        "max_ms": 0.14347393810749054,
        "compile_time": 2.426194190979004
    },
    {
        "BLOCK_SIZE_M": 128,
        "BLOCK_SIZE_N": 256,
        "BLOCK_SIZE_K": 32,
        "GROUP_SIZE_M": 8,
        "num_stages": 7,
        "num_warps": 8,
        "ms": 0.14357870817184448,
        "min_ms": 0.14357870817184448,
        "max_ms": 0.14357870817184448,
        "compile_time": 2.457658290863037
    },
    {
        "BLOCK_SIZE_M": 128,
        "BLOCK_SIZE_N": 256,
        "BLOCK_SIZE_K": 32,
        "GROUP_SIZE_M": 8,
        "num_stages": 6,
        "num_warps": 8,
        "ms": 0.14382311701774597,
        "min_ms": 0.14382311701774597,
        "max_ms": 0.14382311701774597,
        "compile_time": 2.4166781902313232
    },
    {
        "BLOCK_SIZE_M": 128,
        "BLOCK_SIZE_N": 256,
        "BLOCK_SIZE_K": 32,
        "GROUP_SIZE_M": 8,
        "num_stages": 5,
        "num_warps": 8,
        "ms": 0.14383560419082642,
        "min_ms": 0.14383560419082642,
        "max_ms": 0.14383560419082642,
        "compile_time": 2.3908278942108154
    },
    {
        "BLOCK_SIZE_M": 256,
        "BLOCK_SIZE_N": 128,
        "BLOCK_SIZE_K": 32,
        "GROUP_SIZE_M": 8,
        "num_stages": 6,
        "num_warps": 8,
        "ms": 0.14474919438362122,
        "min_ms": 0.14474919438362122,
        "max_ms": 0.14474919438362122,
        "compile_time": 2.376488208770752
    },
    {
        "BLOCK_SIZE_M": 256,
        "BLOCK_SIZE_N": 128,
        "BLOCK_SIZE_K": 32,
        "GROUP_SIZE_M": 8,
        "num_stages": 5,
        "num_warps": 8,
        "ms": 0.14503473043441772,
        "min_ms": 0.14503473043441772,
        "max_ms": 0.14503473043441772,
        "compile_time": 2.470496654510498
    },
    {
        "BLOCK_SIZE_M": 256,
        "BLOCK_SIZE_N": 128,
        "BLOCK_SIZE_K": 32,
        "GROUP_SIZE_M": 8,
        "num_stages": 3,
        "num_warps": 8,
        "ms": 0.14504897594451904,
        "min_ms": 0.14504897594451904,
        "max_ms": 0.14504897594451904,
        "compile_time": 2.432077169418335
    },
    {
        "BLOCK_SIZE_M": 256,
        "BLOCK_SIZE_N": 128,
        "BLOCK_SIZE_K": 32,
        "GROUP_SIZE_M": 8,
        "num_stages": 7,
        "num_warps": 8,
        "ms": 0.1454419493675232,
        "min_ms": 0.1454419493675232,
        "max_ms": 0.1454419493675232,
        "compile_time": 2.5416247844696045
    },
    {
        "BLOCK_SIZE_M": 128,
        "BLOCK_SIZE_N": 128,
        "BLOCK_SIZE_K": 32,
        "GROUP_SIZE_M": 8,
        "num_stages": 5,
        "num_warps": 4,
        "ms": 0.14702320098876953,
        "min_ms": 0.14702320098876953,
        "max_ms": 0.14702320098876953,
        "compile_time": 2.415637731552124
    },
    {
        "BLOCK_SIZE_M": 128,
        "BLOCK_SIZE_N": 128,
        "BLOCK_SIZE_K": 32,
        "GROUP_SIZE_M": 8,
        "num_stages": 6,
        "num_warps": 4,
        "ms": 0.14734788239002228,
        "min_ms": 0.14734788239002228,
        "max_ms": 0.14734788239002228,
        "compile_time": 2.449308156967163
    },
    {
        "BLOCK_SIZE_M": 128,
        "BLOCK_SIZE_N": 128,
        "BLOCK_SIZE_K": 32,
        "GROUP_SIZE_M": 8,
        "num_stages": 4,
        "num_warps": 4,
        "ms": 0.14797228574752808,
        "min_ms": 0.14797228574752808,
        "max_ms": 0.14797228574752808,
        "compile_time": 2.385371446609497
    },
    {
        "BLOCK_SIZE_M": 128,
        "BLOCK_SIZE_N": 128,
        "BLOCK_SIZE_K": 64,
        "GROUP_SIZE_M": 8,
        "num_stages": 3,
        "num_warps": 4,
        "ms": 0.1491156965494156,
        "min_ms": 0.1491156965494156,
        "max_ms": 0.1491156965494156,
        "compile_time": 2.6104187965393066
    },
    {
        "BLOCK_SIZE_M": 128,
        "BLOCK_SIZE_N": 128,
        "BLOCK_SIZE_K": 32,
        "GROUP_SIZE_M": 8,
        "num_stages": 3,
        "num_warps": 4,
        "ms": 0.14943671226501465,
        "min_ms": 0.14943671226501465,
        "max_ms": 0.14943671226501465,
        "compile_time": 2.336217164993286
    },
    {
        "BLOCK_SIZE_M": 256,
        "BLOCK_SIZE_N": 128,
        "BLOCK_SIZE_K": 64,
        "GROUP_SIZE_M": 8,
        "num_stages": 3,
        "num_warps": 8,
        "ms": 0.150967076420784,
        "min_ms": 0.150967076420784,
        "max_ms": 0.150967076420784,
        "compile_time": 2.547736167907715
    },
    {
        "BLOCK_SIZE_M": 256,
        "BLOCK_SIZE_N": 128,
        "BLOCK_SIZE_K": 64,
        "GROUP_SIZE_M": 8,
        "num_stages": 4,
        "num_warps": 8,
        "ms": 0.15198048949241638,
        "min_ms": 0.15198048949241638,
        "max_ms": 0.15198048949241638,
        "compile_time": 2.6067209243774414
    },
    {
        "BLOCK_SIZE_M": 128,
        "BLOCK_SIZE_N": 256,
        "BLOCK_SIZE_K": 64,
        "GROUP_SIZE_M": 8,
        "num_stages": 4,
        "num_warps": 8,
        "ms": 0.1542316973209381,
        "min_ms": 0.1542316973209381,
        "max_ms": 0.1542316973209381,
        "compile_time": 2.513824224472046
    },
    {
        "BLOCK_SIZE_M": 128,
        "BLOCK_SIZE_N": 256,
        "BLOCK_SIZE_K": 64,
        "GROUP_SIZE_M": 8,
        "num_stages": 3,
        "num_warps": 8,
        "ms": 0.15430404245853424,
        "min_ms": 0.15430404245853424,
        "max_ms": 0.15430404245853424,
        "compile_time": 2.486046314239502
    },
    {
        "BLOCK_SIZE_M": 128,
        "BLOCK_SIZE_N": 128,
        "BLOCK_SIZE_K": 32,
        "GROUP_SIZE_M": 8,
        "num_stages": 7,
        "num_warps": 4,
        "ms": 0.15463443100452423,
        "min_ms": 0.15463443100452423,
        "max_ms": 0.15463443100452423,
        "compile_time": 2.4499287605285645
    },
    {
        "BLOCK_SIZE_M": 64,
        "BLOCK_SIZE_N": 512,
        "BLOCK_SIZE_K": 32,
        "GROUP_SIZE_M": 8,
        "num_stages": 3,
        "num_warps": 8,
        "ms": 0.15480059385299683,
        "min_ms": 0.15480059385299683,
        "max_ms": 0.15480059385299683,
        "compile_time": 2.332455635070801
    },
    {
        "BLOCK_SIZE_M": 64,
        "BLOCK_SIZE_N": 512,
        "BLOCK_SIZE_K": 32,
        "GROUP_SIZE_M": 8,
        "num_stages": 5,
        "num_warps": 8,
        "ms": 0.15488849580287933,
        "min_ms": 0.15488849580287933,
        "max_ms": 0.15488849580287933,
        "compile_time": 2.4329965114593506
    },
    {
        "BLOCK_SIZE_M": 64,
        "BLOCK_SIZE_N": 256,
        "BLOCK_SIZE_K": 32,
        "GROUP_SIZE_M": 8,
        "num_stages": 4,
        "num_warps": 4,
        "ms": 0.15632256865501404,
        "min_ms": 0.15632256865501404,
        "max_ms": 0.15632256865501404,
        "compile_time": 2.3870179653167725
    },
    {
        "BLOCK_SIZE_M": 128,
        "BLOCK_SIZE_N": 128,
        "BLOCK_SIZE_K": 32,
        "GROUP_SIZE_M": 8,
        "num_stages": 8,
        "num_warps": 4,
        "ms": 0.15639185905456543,
        "min_ms": 0.15639185905456543,
        "max_ms": 0.15639185905456543,
        "compile_time": 2.5145888328552246
    },
    {
        "BLOCK_SIZE_M": 64,
        "BLOCK_SIZE_N": 256,
        "BLOCK_SIZE_K": 32,
        "GROUP_SIZE_M": 8,
        "num_stages": 5,
        "num_warps": 4,
        "ms": 0.15746308863162994,
        "min_ms": 0.15746308863162994,
        "max_ms": 0.15746308863162994,
        "compile_time": 2.4201860427856445
    },
    {
        "BLOCK_SIZE_M": 128,
        "BLOCK_SIZE_N": 128,
        "BLOCK_SIZE_K": 64,
        "GROUP_SIZE_M": 8,
        "num_stages": 3,
        "num_warps": 8,
        "ms": 0.15757465362548828,
        "min_ms": 0.15757465362548828,
        "max_ms": 0.15757465362548828,
        "compile_time": 1.1775786876678467
    },
    {
        "BLOCK_SIZE_M": 64,
        "BLOCK_SIZE_N": 256,
        "BLOCK_SIZE_K": 32,
        "GROUP_SIZE_M": 8,
        "num_stages": 3,
        "num_warps": 4,
        "ms": 0.1579442173242569,
        "min_ms": 0.1579442173242569,
        "max_ms": 0.1579442173242569,
        "compile_time": 2.363508701324463
    },
    {
        "BLOCK_SIZE_M": 128,
        "BLOCK_SIZE_N": 128,
        "BLOCK_SIZE_K": 64,
        "GROUP_SIZE_M": 8,
        "num_stages": 4,
        "num_warps": 8,
        "ms": 0.15830373764038086,
        "min_ms": 0.15830373764038086,
        "max_ms": 0.15830373764038086,
        "compile_time": 2.154452323913574
    },
    {
        "BLOCK_SIZE_M": 128,
        "BLOCK_SIZE_N": 128,
        "BLOCK_SIZE_K": 64,
        "GROUP_SIZE_M": 8,
        "num_stages": 2,
        "num_warps": 4,
        "ms": 0.15935994684696198,
        "min_ms": 0.15935994684696198,
        "max_ms": 0.15935994684696198,
        "compile_time": 2.416046619415283
    },
    {
        "BLOCK_SIZE_M": 128,
        "BLOCK_SIZE_N": 128,
        "BLOCK_SIZE_K": 64,
        "GROUP_SIZE_M": 8,
        "num_stages": 5,
        "num_warps": 8,
        "ms": 0.16030709445476532,
        "min_ms": 0.16030709445476532,
        "max_ms": 0.16030709445476532,
        "compile_time": 2.1861062049865723
    },
    {
        "BLOCK_SIZE_M": 128,
        "BLOCK_SIZE_N": 128,
        "BLOCK_SIZE_K": 64,
        "GROUP_SIZE_M": 8,
        "num_stages": 6,
        "num_warps": 8,
        "ms": 0.1619163602590561,
        "min_ms": 0.1619163602590561,
        "max_ms": 0.1619163602590561,
        "compile_time": 2.226839303970337
    },
    {
        "BLOCK_SIZE_M": 512,
        "BLOCK_SIZE_N": 64,
        "BLOCK_SIZE_K": 32,
        "GROUP_SIZE_M": 8,
        "num_stages": 3,
        "num_warps": 8,
        "ms": 0.16306617856025696,
        "min_ms": 0.16306617856025696,
        "max_ms": 0.16306617856025696,
        "compile_time": 2.7139642238616943
    },
    {
        "BLOCK_SIZE_M": 128,
        "BLOCK_SIZE_N": 128,
        "BLOCK_SIZE_K": 128,
        "GROUP_SIZE_M": 8,
        "num_stages": 3,
        "num_warps": 8,
        "ms": 0.16336075961589813,
        "min_ms": 0.16336075961589813,
        "max_ms": 0.16336075961589813,
        "compile_time": 2.1361355781555176
    },
    {
        "BLOCK_SIZE_M": 512,
        "BLOCK_SIZE_N": 64,
        "BLOCK_SIZE_K": 32,
        "GROUP_SIZE_M": 8,
        "num_stages": 4,
        "num_warps": 8,
        "ms": 0.1636132448911667,
        "min_ms": 0.1636132448911667,
        "max_ms": 0.1636132448911667,
        "compile_time": 2.789423942565918
    },
    {
        "BLOCK_SIZE_M": 512,
        "BLOCK_SIZE_N": 64,
        "BLOCK_SIZE_K": 32,
        "GROUP_SIZE_M": 8,
        "num_stages": 5,
        "num_warps": 8,
        "ms": 0.16495995223522186,
        "min_ms": 0.16495995223522186,
        "max_ms": 0.16495995223522186,
        "compile_time": 2.9582560062408447
    },
    {
        "BLOCK_SIZE_M": 128,
        "BLOCK_SIZE_N": 128,
        "BLOCK_SIZE_K": 64,
        "GROUP_SIZE_M": 8,
        "num_stages": 4,
        "num_warps": 4,
        "ms": 0.1656370908021927,
        "min_ms": 0.1656370908021927,
        "max_ms": 0.1656370908021927,
        "compile_time": 2.6526291370391846
    },
    {
        "BLOCK_SIZE_M": 128,
        "BLOCK_SIZE_N": 128,
        "BLOCK_SIZE_K": 64,
        "GROUP_SIZE_M": 8,
        "num_stages": 5,
        "num_warps": 4,
        "ms": 0.16708660125732422,
        "min_ms": 0.16708660125732422,
        "max_ms": 0.16708660125732422,
        "compile_time": 2.668684244155884
    },
    {
        "BLOCK_SIZE_M": 256,
        "BLOCK_SIZE_N": 64,
        "BLOCK_SIZE_K": 32,
        "GROUP_SIZE_M": 8,
        "num_stages": 5,
        "num_warps": 4,
        "ms": 0.16746962070465088,
        "min_ms": 0.16746962070465088,
        "max_ms": 0.16746962070465088,
        "compile_time": 2.6065845489501953
    },
    {
        "BLOCK_SIZE_M": 256,
        "BLOCK_SIZE_N": 64,
        "BLOCK_SIZE_K": 32,
        "GROUP_SIZE_M": 8,
        "num_stages": 4,
        "num_warps": 4,
        "ms": 0.1675887107849121,
        "min_ms": 0.1675887107849121,
        "max_ms": 0.1675887107849121,
        "compile_time": 2.579676389694214
    },
    {
        "BLOCK_SIZE_M": 64,
        "BLOCK_SIZE_N": 256,
        "BLOCK_SIZE_K": 64,
        "GROUP_SIZE_M": 8,
        "num_stages": 4,
        "num_warps": 8,
        "ms": 0.16764163970947266,
        "min_ms": 0.16764163970947266,
        "max_ms": 0.16764163970947266,
        "compile_time": 2.0999295711517334
    },
    {
        "BLOCK_SIZE_M": 128,
        "BLOCK_SIZE_N": 128,
        "BLOCK_SIZE_K": 32,
        "GROUP_SIZE_M": 8,
        "num_stages": 6,
        "num_warps": 8,
        "ms": 0.16859810054302216,
        "min_ms": 0.16859810054302216,
        "max_ms": 0.16859810054302216,
        "compile_time": 1.1780040264129639
    },
    {
        "BLOCK_SIZE_M": 64,
        "BLOCK_SIZE_N": 256,
        "BLOCK_SIZE_K": 64,
        "GROUP_SIZE_M": 8,
        "num_stages": 5,
        "num_warps": 8,
        "ms": 0.16919101774692535,
        "min_ms": 0.16919101774692535,
        "max_ms": 0.16919101774692535,
        "compile_time": 2.1400034427642822
    },
    {
        "BLOCK_SIZE_M": 128,
        "BLOCK_SIZE_N": 128,
        "BLOCK_SIZE_K": 32,
        "GROUP_SIZE_M": 8,
        "num_stages": 5,
        "num_warps": 8,
        "ms": 0.1693190336227417,
        "min_ms": 0.1693190336227417,
        "max_ms": 0.1693190336227417,
        "compile_time": 1.9251837730407715
    },
    {
        "BLOCK_SIZE_M": 64,
        "BLOCK_SIZE_N": 256,
        "BLOCK_SIZE_K": 64,
        "GROUP_SIZE_M": 8,
        "num_stages": 3,
        "num_warps": 4,
        "ms": 0.1694105565547943,
        "min_ms": 0.1694105565547943,
        "max_ms": 0.1694105565547943,
        "compile_time": 2.683964729309082
    },
    {
        "BLOCK_SIZE_M": 64,
        "BLOCK_SIZE_N": 256,
        "BLOCK_SIZE_K": 64,
        "GROUP_SIZE_M": 8,
        "num_stages": 3,
        "num_warps": 8,
        "ms": 0.16966870427131653,
        "min_ms": 0.16966870427131653,
        "max_ms": 0.16966870427131653,
        "compile_time": 2.0462849140167236
    },
    {
        "BLOCK_SIZE_M": 128,
        "BLOCK_SIZE_N": 128,
        "BLOCK_SIZE_K": 32,
        "GROUP_SIZE_M": 8,
        "num_stages": 7,
        "num_warps": 8,
        "ms": 0.16968569159507751,
        "min_ms": 0.16968569159507751,
        "max_ms": 0.16968569159507751,
        "compile_time": 1.9889857769012451
    },
    {
        "BLOCK_SIZE_M": 256,
        "BLOCK_SIZE_N": 64,
        "BLOCK_SIZE_K": 32,
        "GROUP_SIZE_M": 8,
        "num_stages": 3,
        "num_warps": 4,
        "ms": 0.1699049472808838,
        "min_ms": 0.1699049472808838,
        "max_ms": 0.1699049472808838,
        "compile_time": 2.5108911991119385
    },
    {
        "BLOCK_SIZE_M": 128,
        "BLOCK_SIZE_N": 128,
        "BLOCK_SIZE_K": 64,
        "GROUP_SIZE_M": 8,
        "num_stages": 6,
        "num_warps": 4,
        "ms": 0.17002300918102264,
        "min_ms": 0.17002300918102264,
        "max_ms": 0.17002300918102264,
        "compile_time": 2.758193254470825
    },
    {
        "BLOCK_SIZE_M": 64,
        "BLOCK_SIZE_N": 512,
        "BLOCK_SIZE_K": 32,
        "GROUP_SIZE_M": 8,
        "num_stages": 4,
        "num_warps": 8,
        "ms": 0.1713227480649948,
        "min_ms": 0.1713227480649948,
        "max_ms": 0.1713227480649948,
        "compile_time": 2.3859925270080566
    },
    {
        "BLOCK_SIZE_M": 128,
        "BLOCK_SIZE_N": 128,
        "BLOCK_SIZE_K": 32,
        "GROUP_SIZE_M": 8,
        "num_stages": 8,
        "num_warps": 8,
        "ms": 0.17156116664409637,
        "min_ms": 0.17156116664409637,
        "max_ms": 0.17156116664409637,
        "compile_time": 2.0122714042663574
    },
    {
        "BLOCK_SIZE_M": 256,
        "BLOCK_SIZE_N": 64,
        "BLOCK_SIZE_K": 64,
        "GROUP_SIZE_M": 8,
        "num_stages": 4,
        "num_warps": 8,
        "ms": 0.17176374793052673,
        "min_ms": 0.17176374793052673,
        "max_ms": 0.17176374793052673,
        "compile_time": 2.199223041534424
    },
    {
        "BLOCK_SIZE_M": 256,
        "BLOCK_SIZE_N": 64,
        "BLOCK_SIZE_K": 64,
        "GROUP_SIZE_M": 8,
        "num_stages": 3,
        "num_warps": 8,
        "ms": 0.17205527424812317,
        "min_ms": 0.17205527424812317,
        "max_ms": 0.17205527424812317,
        "compile_time": 2.2660725116729736
    },
    {
        "BLOCK_SIZE_M": 512,
        "BLOCK_SIZE_N": 64,
        "BLOCK_SIZE_K": 64,
        "GROUP_SIZE_M": 8,
        "num_stages": 3,
        "num_warps": 8,
        "ms": 0.17215695977210999,
        "min_ms": 0.17215695977210999,
        "max_ms": 0.17215695977210999,
        "compile_time": 2.804492235183716
    },
    {
        "BLOCK_SIZE_M": 64,
        "BLOCK_SIZE_N": 256,
        "BLOCK_SIZE_K": 32,
        "GROUP_SIZE_M": 8,
        "num_stages": 4,
        "num_warps": 8,
        "ms": 0.17255282402038574,
        "min_ms": 0.17255282402038574,
        "max_ms": 0.17255282402038574,
        "compile_time": 1.135453701019287
    },
    {
        "BLOCK_SIZE_M": 64,
        "BLOCK_SIZE_N": 256,
        "BLOCK_SIZE_K": 32,
        "GROUP_SIZE_M": 8,
        "num_stages": 6,
        "num_warps": 8,
        "ms": 0.17325782775878906,
        "min_ms": 0.17325782775878906,
        "max_ms": 0.17325782775878906,
        "compile_time": 1.9185028076171875
    },
    {
        "BLOCK_SIZE_M": 128,
        "BLOCK_SIZE_N": 128,
        "BLOCK_SIZE_K": 32,
        "GROUP_SIZE_M": 8,
        "num_stages": 4,
        "num_warps": 8,
        "ms": 0.17332015931606293,
        "min_ms": 0.17332015931606293,
        "max_ms": 0.17332015931606293,
        "compile_time": 1.1625866889953613
    },
    {
        "BLOCK_SIZE_M": 64,
        "BLOCK_SIZE_N": 256,
        "BLOCK_SIZE_K": 32,
        "GROUP_SIZE_M": 8,
        "num_stages": 5,
        "num_warps": 8,
        "ms": 0.17341789603233337,
        "min_ms": 0.17341789603233337,
        "max_ms": 0.17341789603233337,
        "compile_time": 1.8950109481811523
    },
    {
        "BLOCK_SIZE_M": 64,
        "BLOCK_SIZE_N": 256,
        "BLOCK_SIZE_K": 16,
        "GROUP_SIZE_M": 8,
        "num_stages": 4,
        "num_warps": 4,
        "ms": 0.17398762702941895,
        "min_ms": 0.17398762702941895,
        "max_ms": 0.17398762702941895,
        "compile_time": 2.088146686553955
    },
    {
        "BLOCK_SIZE_M": 256,
        "BLOCK_SIZE_N": 64,
        "BLOCK_SIZE_K": 64,
        "GROUP_SIZE_M": 8,
        "num_stages": 5,
        "num_warps": 8,
        "ms": 0.17416557669639587,
        "min_ms": 0.17416557669639587,
        "max_ms": 0.17416557669639587,
        "compile_time": 2.3402326107025146
    },
    {
        "BLOCK_SIZE_M": 256,
        "BLOCK_SIZE_N": 64,
        "BLOCK_SIZE_K": 64,
        "GROUP_SIZE_M": 8,
        "num_stages": 3,
        "num_warps": 4,
        "ms": 0.17447051405906677,
        "min_ms": 0.17447051405906677,
        "max_ms": 0.17447051405906677,
        "compile_time": 2.804154634475708
    },
    {
        "BLOCK_SIZE_M": 64,
        "BLOCK_SIZE_N": 256,
        "BLOCK_SIZE_K": 32,
        "GROUP_SIZE_M": 8,
        "num_stages": 7,
        "num_warps": 8,
        "ms": 0.17450527846813202,
        "min_ms": 0.17450527846813202,
        "max_ms": 0.17450527846813202,
        "compile_time": 1.9598941802978516
    },
    {
        "BLOCK_SIZE_M": 64,
        "BLOCK_SIZE_N": 256,
        "BLOCK_SIZE_K": 32,
        "GROUP_SIZE_M": 8,
        "num_stages": 8,
        "num_warps": 8,
        "ms": 0.17594747245311737,
        "min_ms": 0.17594747245311737,
        "max_ms": 0.17594747245311737,
        "compile_time": 1.9809741973876953
    },
    {
        "BLOCK_SIZE_M": 64,
        "BLOCK_SIZE_N": 256,
        "BLOCK_SIZE_K": 64,
        "GROUP_SIZE_M": 8,
        "num_stages": 2,
        "num_warps": 4,
        "ms": 0.17633791267871857,
        "min_ms": 0.17633791267871857,
        "max_ms": 0.17633791267871857,
        "compile_time": 2.488605499267578
    },
    {
        "BLOCK_SIZE_M": 64,
        "BLOCK_SIZE_N": 512,
        "BLOCK_SIZE_K": 64,
        "GROUP_SIZE_M": 8,
        "num_stages": 3,
        "num_warps": 8,
        "ms": 0.17640452086925507,
        "min_ms": 0.17640452086925507,
        "max_ms": 0.17640452086925507,
        "compile_time": 2.659174919128418
    },
    {
        "BLOCK_SIZE_M": 256,
        "BLOCK_SIZE_N": 64,
        "BLOCK_SIZE_K": 128,
        "GROUP_SIZE_M": 8,
        "num_stages": 3,
        "num_warps": 8,
        "ms": 0.1767449676990509,
        "min_ms": 0.1767449676990509,
        "max_ms": 0.1767449676990509,
        "compile_time": 1.2131240367889404
    },
    {
        "BLOCK_SIZE_M": 256,
        "BLOCK_SIZE_N": 64,
        "BLOCK_SIZE_K": 32,
        "GROUP_SIZE_M": 8,
        "num_stages": 6,
        "num_warps": 4,
        "ms": 0.1770244836807251,
        "min_ms": 0.1770244836807251,
        "max_ms": 0.1770244836807251,
        "compile_time": 2.6018409729003906
    },
    {
        "BLOCK_SIZE_M": 64,
        "BLOCK_SIZE_N": 256,
        "BLOCK_SIZE_K": 16,
        "GROUP_SIZE_M": 8,
        "num_stages": 6,
        "num_warps": 4,
        "ms": 0.1771140992641449,
        "min_ms": 0.1771140992641449,
        "max_ms": 0.1771140992641449,
        "compile_time": 2.197753429412842
    },
    {
        "BLOCK_SIZE_M": 64,
        "BLOCK_SIZE_N": 256,
        "BLOCK_SIZE_K": 16,
        "GROUP_SIZE_M": 8,
        "num_stages": 8,
        "num_warps": 4,
        "ms": 0.177451491355896,
        "min_ms": 0.177451491355896,
        "max_ms": 0.177451491355896,
        "compile_time": 2.2085211277008057
    },
    {
        "BLOCK_SIZE_M": 64,
        "BLOCK_SIZE_N": 256,
        "BLOCK_SIZE_K": 16,
        "GROUP_SIZE_M": 8,
        "num_stages": 7,
        "num_warps": 4,
        "ms": 0.17771805822849274,
        "min_ms": 0.17771805822849274,
        "max_ms": 0.17771805822849274,
        "compile_time": 2.184943914413452
    },
    {
        "BLOCK_SIZE_M": 64,
        "BLOCK_SIZE_N": 256,
        "BLOCK_SIZE_K": 16,
        "GROUP_SIZE_M": 8,
        "num_stages": 5,
        "num_warps": 4,
        "ms": 0.1778421252965927,
        "min_ms": 0.1778421252965927,
        "max_ms": 0.1778421252965927,
        "compile_time": 2.1737825870513916
    },
    {
        "BLOCK_SIZE_M": 256,
        "BLOCK_SIZE_N": 64,
        "BLOCK_SIZE_K": 32,
        "GROUP_SIZE_M": 8,
        "num_stages": 7,
        "num_warps": 4,
        "ms": 0.17816872894763947,
        "min_ms": 0.17816872894763947,
        "max_ms": 0.17816872894763947,
        "compile_time": 2.580695390701294
    },
    {
        "BLOCK_SIZE_M": 64,
        "BLOCK_SIZE_N": 128,
        "BLOCK_SIZE_K": 32,
        "GROUP_SIZE_M": 8,
        "num_stages": 3,
        "num_warps": 2,
        "ms": 0.17880728840827942,
        "min_ms": 0.17880728840827942,
        "max_ms": 0.17880728840827942,
        "compile_time": 2.3598906993865967
    },
    {
        "BLOCK_SIZE_M": 256,
        "BLOCK_SIZE_N": 64,
        "BLOCK_SIZE_K": 32,
        "GROUP_SIZE_M": 8,
        "num_stages": 8,
        "num_warps": 4,
        "ms": 0.1789817363023758,
        "min_ms": 0.1789817363023758,
        "max_ms": 0.1789817363023758,
        "compile_time": 2.75180721282959
    },
    {
        "BLOCK_SIZE_M": 256,
        "BLOCK_SIZE_N": 64,
        "BLOCK_SIZE_K": 64,
        "GROUP_SIZE_M": 8,
        "num_stages": 5,
        "num_warps": 4,
        "ms": 0.17921729385852814,
        "min_ms": 0.17921729385852814,
        "max_ms": 0.17921729385852814,
        "compile_time": 2.7743964195251465
    },
    {
        "BLOCK_SIZE_M": 64,
        "BLOCK_SIZE_N": 128,
        "BLOCK_SIZE_K": 32,
        "GROUP_SIZE_M": 8,
        "num_stages": 4,
        "num_warps": 2,
        "ms": 0.17936581373214722,
        "min_ms": 0.17936581373214722,
        "max_ms": 0.17936581373214722,
        "compile_time": 2.3903727531433105
    },
    {
        "BLOCK_SIZE_M": 64,
        "BLOCK_SIZE_N": 256,
        "BLOCK_SIZE_K": 128,
        "GROUP_SIZE_M": 8,
        "num_stages": 3,
        "num_warps": 8,
        "ms": 0.18023023009300232,
        "min_ms": 0.18023023009300232,
        "max_ms": 0.18023023009300232,
        "compile_time": 2.3832249641418457
    },
    {
        "BLOCK_SIZE_M": 256,
        "BLOCK_SIZE_N": 64,
        "BLOCK_SIZE_K": 64,
        "GROUP_SIZE_M": 8,
        "num_stages": 2,
        "num_warps": 4,
        "ms": 0.18058060109615326,
        "min_ms": 0.18058060109615326,
        "max_ms": 0.18058060109615326,
        "compile_time": 2.6079111099243164
    },
    {
        "BLOCK_SIZE_M": 64,
        "BLOCK_SIZE_N": 128,
        "BLOCK_SIZE_K": 64,
        "GROUP_SIZE_M": 8,
        "num_stages": 4,
        "num_warps": 4,
        "ms": 0.18089580535888672,
        "min_ms": 0.18089580535888672,
        "max_ms": 0.18089580535888672,
        "compile_time": 2.1212472915649414
    },
    {
        "BLOCK_SIZE_M": 128,
        "BLOCK_SIZE_N": 128,
        "BLOCK_SIZE_K": 16,
        "GROUP_SIZE_M": 8,
        "num_stages": 8,
        "num_warps": 4,
        "ms": 0.1813008040189743,
        "min_ms": 0.1813008040189743,
        "max_ms": 0.1813008040189743,
        "compile_time": 2.1578052043914795
    },
    {
        "BLOCK_SIZE_M": 64,
        "BLOCK_SIZE_N": 128,
        "BLOCK_SIZE_K": 32,
        "GROUP_SIZE_M": 8,
        "num_stages": 4,
        "num_warps": 4,
        "ms": 0.18154992163181305,
        "min_ms": 0.18154992163181305,
        "max_ms": 0.18154992163181305,
        "compile_time": 1.1634676456451416
    },
    {
        "BLOCK_SIZE_M": 128,
        "BLOCK_SIZE_N": 64,
        "BLOCK_SIZE_K": 32,
        "GROUP_SIZE_M": 8,
        "num_stages": 3,
        "num_warps": 2,
        "ms": 0.18196289241313934,
        "min_ms": 0.18196289241313934,
        "max_ms": 0.18196289241313934,
        "compile_time": 2.452713966369629
    },
    {
        "BLOCK_SIZE_M": 128,
        "BLOCK_SIZE_N": 128,
        "BLOCK_SIZE_K": 128,
        "GROUP_SIZE_M": 8,
        "num_stages": 3,
        "num_warps": 16,
        "ms": 0.18212875723838806,
        "min_ms": 0.18212875723838806,
        "max_ms": 0.18212875723838806,
        "compile_time": 1.9914679527282715
    },
    {
        "BLOCK_SIZE_M": 128,
        "BLOCK_SIZE_N": 64,
        "BLOCK_SIZE_K": 32,
        "GROUP_SIZE_M": 8,
        "num_stages": 4,
        "num_warps": 2,
        "ms": 0.18227636814117432,
        "min_ms": 0.18227636814117432,
        "max_ms": 0.18227636814117432,
        "compile_time": 2.4467899799346924
    },
    {
        "BLOCK_SIZE_M": 64,
        "BLOCK_SIZE_N": 128,
        "BLOCK_SIZE_K": 32,
        "GROUP_SIZE_M": 8,
        "num_stages": 5,
        "num_warps": 4,
        "ms": 0.1824263036251068,
        "min_ms": 0.1824263036251068,
        "max_ms": 0.1824263036251068,
        "compile_time": 1.8551485538482666
    },
    {
        "BLOCK_SIZE_M": 64,
        "BLOCK_SIZE_N": 128,
        "BLOCK_SIZE_K": 32,
        "GROUP_SIZE_M": 8,
        "num_stages": 3,
        "num_warps": 4,
        "ms": 0.18257322907447815,
        "min_ms": 0.18257322907447815,
        "max_ms": 0.18257322907447815,
        "compile_time": 1.762270450592041
    },
    {
        "BLOCK_SIZE_M": 128,
        "BLOCK_SIZE_N": 64,
        "BLOCK_SIZE_K": 64,
        "GROUP_SIZE_M": 8,
        "num_stages": 3,
        "num_warps": 4,
        "ms": 0.1834692656993866,
        "min_ms": 0.1834692656993866,
        "max_ms": 0.1834692656993866,
        "compile_time": 2.134016990661621
    },
    {
        "BLOCK_SIZE_M": 64,
        "BLOCK_SIZE_N": 256,
        "BLOCK_SIZE_K": 32,
        "GROUP_SIZE_M": 8,
        "num_stages": 6,
        "num_warps": 4,
        "ms": 0.18350856006145477,
        "min_ms": 0.18350856006145477,
        "max_ms": 0.18350856006145477,
        "compile_time": 2.4030497074127197
    },
    {
        "BLOCK_SIZE_M": 64,
        "BLOCK_SIZE_N": 128,
        "BLOCK_SIZE_K": 32,
        "GROUP_SIZE_M": 8,
        "num_stages": 6,
        "num_warps": 4,
        "ms": 0.18361297249794006,
        "min_ms": 0.18361297249794006,
        "max_ms": 0.18361297249794006,
        "compile_time": 1.9452078342437744
    },
    {
        "BLOCK_SIZE_M": 64,
        "BLOCK_SIZE_N": 256,
        "BLOCK_SIZE_K": 32,
        "GROUP_SIZE_M": 8,
        "num_stages": 7,
        "num_warps": 4,
        "ms": 0.18443146347999573,
        "min_ms": 0.18443146347999573,
        "max_ms": 0.18443146347999573,
        "compile_time": 2.497924327850342
    },
    {
        "BLOCK_SIZE_M": 64,
        "BLOCK_SIZE_N": 256,
        "BLOCK_SIZE_K": 32,
        "GROUP_SIZE_M": 8,
        "num_stages": 3,
        "num_warps": 8,
        "ms": 0.18465472757816315,
        "min_ms": 0.18465472757816315,
        "max_ms": 0.18465472757816315,
        "compile_time": 1.0767686367034912
    },
    {
        "BLOCK_SIZE_M": 128,
        "BLOCK_SIZE_N": 64,
        "BLOCK_SIZE_K": 32,
        "GROUP_SIZE_M": 8,
        "num_stages": 4,
        "num_warps": 4,
        "ms": 0.18477433919906616,
        "min_ms": 0.18477433919906616,
        "max_ms": 0.18477433919906616,
        "compile_time": 1.1803429126739502
    },
    {
        "BLOCK_SIZE_M": 128,
        "BLOCK_SIZE_N": 64,
        "BLOCK_SIZE_K": 32,
        "GROUP_SIZE_M": 8,
        "num_stages": 5,
        "num_warps": 4,
        "ms": 0.1852726936340332,
        "min_ms": 0.1852726936340332,
        "max_ms": 0.1852726936340332,
        "compile_time": 1.1949734687805176
    },
    {
        "BLOCK_SIZE_M": 128,
        "BLOCK_SIZE_N": 256,
        "BLOCK_SIZE_K": 64,
        "GROUP_SIZE_M": 8,
        "num_stages": 2,
        "num_warps": 8,
        "ms": 0.18528074026107788,
        "min_ms": 0.18528074026107788,
        "max_ms": 0.18528074026107788,
        "compile_time": 2.391058921813965
    },
    {
        "BLOCK_SIZE_M": 64,
        "BLOCK_SIZE_N": 128,
        "BLOCK_SIZE_K": 32,
        "GROUP_SIZE_M": 8,
        "num_stages": 7,
        "num_warps": 4,
        "ms": 0.18530656397342682,
        "min_ms": 0.18530656397342682,
        "max_ms": 0.18530656397342682,
        "compile_time": 1.147817611694336
    },
    {
        "BLOCK_SIZE_M": 128,
        "BLOCK_SIZE_N": 128,
        "BLOCK_SIZE_K": 128,
        "GROUP_SIZE_M": 8,
        "num_stages": 3,
        "num_warps": 4,
        "ms": 0.18533368408679962,
        "min_ms": 0.18533368408679962,
        "max_ms": 0.18533368408679962,
        "compile_time": 3.0137829780578613
    },
    {
        "BLOCK_SIZE_M": 64,
        "BLOCK_SIZE_N": 128,
        "BLOCK_SIZE_K": 64,
        "GROUP_SIZE_M": 8,
        "num_stages": 3,
        "num_warps": 4,
        "ms": 0.18537470698356628,
        "min_ms": 0.18537470698356628,
        "max_ms": 0.18537470698356628,
        "compile_time": 2.0494611263275146
    },
    {
        "BLOCK_SIZE_M": 256,
        "BLOCK_SIZE_N": 64,
        "BLOCK_SIZE_K": 64,
        "GROUP_SIZE_M": 8,
        "num_stages": 4,
        "num_warps": 4,
        "ms": 0.1858137995004654,
        "min_ms": 0.1858137995004654,
        "max_ms": 0.1858137995004654,
        "compile_time": 2.7075536251068115
    },
    {
        "BLOCK_SIZE_M": 64,
        "BLOCK_SIZE_N": 256,
        "BLOCK_SIZE_K": 32,
        "GROUP_SIZE_M": 8,
        "num_stages": 8,
        "num_warps": 4,
        "ms": 0.185824453830719,
        "min_ms": 0.185824453830719,
        "max_ms": 0.185824453830719,
        "compile_time": 2.496992588043213
    },
    {
        "BLOCK_SIZE_M": 128,
        "BLOCK_SIZE_N": 128,
        "BLOCK_SIZE_K": 128,
        "GROUP_SIZE_M": 8,
        "num_stages": 2,
        "num_warps": 4,
        "ms": 0.1859949678182602,
        "min_ms": 0.1859949678182602,
        "max_ms": 0.1859949678182602,
        "compile_time": 2.7536096572875977
    },
    {
        "BLOCK_SIZE_M": 64,
        "BLOCK_SIZE_N": 128,
        "BLOCK_SIZE_K": 32,
        "GROUP_SIZE_M": 8,
        "num_stages": 5,
        "num_warps": 2,
        "ms": 0.18600670993328094,
        "min_ms": 0.18600670993328094,
        "max_ms": 0.18600670993328094,
        "compile_time": 2.460508108139038
    },
    {
        "BLOCK_SIZE_M": 128,
        "BLOCK_SIZE_N": 128,
        "BLOCK_SIZE_K": 16,
        "GROUP_SIZE_M": 8,
        "num_stages": 4,
        "num_warps": 4,
        "ms": 0.1864776909351349,
        "min_ms": 0.1864776909351349,
        "max_ms": 0.1864776909351349,
        "compile_time": 2.127195119857788
    },
    {
        "BLOCK_SIZE_M": 128,
        "BLOCK_SIZE_N": 128,
        "BLOCK_SIZE_K": 16,
        "GROUP_SIZE_M": 8,
        "num_stages": 5,
        "num_warps": 4,
        "ms": 0.18694964051246643,
        "min_ms": 0.18694964051246643,
        "max_ms": 0.18694964051246643,
        "compile_time": 2.1105611324310303
    },
    {
        "BLOCK_SIZE_M": 128,
        "BLOCK_SIZE_N": 64,
        "BLOCK_SIZE_K": 32,
        "GROUP_SIZE_M": 8,
        "num_stages": 3,
        "num_warps": 4,
        "ms": 0.18699637055397034,
        "min_ms": 0.18699637055397034,
        "max_ms": 0.18699637055397034,
        "compile_time": 1.198347568511963
    },
    {
        "BLOCK_SIZE_M": 128,
        "BLOCK_SIZE_N": 64,
        "BLOCK_SIZE_K": 32,
        "GROUP_SIZE_M": 8,
        "num_stages": 6,
        "num_warps": 4,
        "ms": 0.18733367323875427,
        "min_ms": 0.18733367323875427,
        "max_ms": 0.18733367323875427,
        "compile_time": 2.043687582015991
    },
    {
        "BLOCK_SIZE_M": 64,
        "BLOCK_SIZE_N": 512,
        "BLOCK_SIZE_K": 16,
        "GROUP_SIZE_M": 8,
        "num_stages": 6,
        "num_warps": 8,
        "ms": 0.18757469952106476,
        "min_ms": 0.18757469952106476,
        "max_ms": 0.18757469952106476,
        "compile_time": 2.147684097290039
    },
    {
        "BLOCK_SIZE_M": 128,
        "BLOCK_SIZE_N": 128,
        "BLOCK_SIZE_K": 16,
        "GROUP_SIZE_M": 8,
        "num_stages": 6,
        "num_warps": 4,
        "ms": 0.1875958889722824,
        "min_ms": 0.1875958889722824,
        "max_ms": 0.1875958889722824,
        "compile_time": 2.207409143447876
    },
    {
        "BLOCK_SIZE_M": 256,
        "BLOCK_SIZE_N": 64,
        "BLOCK_SIZE_K": 32,
        "GROUP_SIZE_M": 8,
        "num_stages": 4,
        "num_warps": 8,
        "ms": 0.1876085102558136,
        "min_ms": 0.1876085102558136,
        "max_ms": 0.1876085102558136,
        "compile_time": 2.044977903366089
    },
    {
        "BLOCK_SIZE_M": 64,
        "BLOCK_SIZE_N": 128,
        "BLOCK_SIZE_K": 64,
        "GROUP_SIZE_M": 8,
        "num_stages": 6,
        "num_warps": 4,
        "ms": 0.18782062828540802,
        "min_ms": 0.18782062828540802,
        "max_ms": 0.18782062828540802,
        "compile_time": 2.1613070964813232
    },
    {
        "BLOCK_SIZE_M": 64,
        "BLOCK_SIZE_N": 128,
        "BLOCK_SIZE_K": 64,
        "GROUP_SIZE_M": 8,
        "num_stages": 5,
        "num_warps": 4,
        "ms": 0.18788468837738037,
        "min_ms": 0.18788468837738037,
        "max_ms": 0.18788468837738037,
        "compile_time": 1.144124984741211
    },
    {
        "BLOCK_SIZE_M": 256,
        "BLOCK_SIZE_N": 64,
        "BLOCK_SIZE_K": 32,
        "GROUP_SIZE_M": 8,
        "num_stages": 5,
        "num_warps": 8,
        "ms": 0.18815414607524872,
        "min_ms": 0.18815414607524872,
        "max_ms": 0.18815414607524872,
        "compile_time": 2.048894166946411
    },
    {
        "BLOCK_SIZE_M": 128,
        "BLOCK_SIZE_N": 128,
        "BLOCK_SIZE_K": 16,
        "GROUP_SIZE_M": 8,
        "num_stages": 7,
        "num_warps": 4,
        "ms": 0.1883465051651001,
        "min_ms": 0.1883465051651001,
        "max_ms": 0.1883465051651001,
        "compile_time": 2.1864466667175293
    },
    {
        "BLOCK_SIZE_M": 128,
        "BLOCK_SIZE_N": 64,
        "BLOCK_SIZE_K": 64,
        "GROUP_SIZE_M": 8,
        "num_stages": 4,
        "num_warps": 4,
        "ms": 0.18885332345962524,
        "min_ms": 0.18885332345962524,
        "max_ms": 0.18885332345962524,
        "compile_time": 2.181779384613037
    },
    {
        "BLOCK_SIZE_M": 64,
        "BLOCK_SIZE_N": 256,
        "BLOCK_SIZE_K": 16,
        "GROUP_SIZE_M": 8,
        "num_stages": 3,
        "num_warps": 4,
        "ms": 0.18892212212085724,
        "min_ms": 0.18892212212085724,
        "max_ms": 0.18892212212085724,
        "compile_time": 2.030134677886963
    },
    {
        "BLOCK_SIZE_M": 128,
        "BLOCK_SIZE_N": 128,
        "BLOCK_SIZE_K": 32,
        "GROUP_SIZE_M": 8,
        "num_stages": 3,
        "num_warps": 8,
        "ms": 0.18910107016563416,
        "min_ms": 0.18910107016563416,
        "max_ms": 0.18910107016563416,
        "compile_time": 1.8618109226226807
    },
    {
        "BLOCK_SIZE_M": 128,
        "BLOCK_SIZE_N": 64,
        "BLOCK_SIZE_K": 32,
        "GROUP_SIZE_M": 8,
        "num_stages": 7,
        "num_warps": 4,
        "ms": 0.18936876952648163,
        "min_ms": 0.18936876952648163,
        "max_ms": 0.18936876952648163,
        "compile_time": 2.0493390560150146
    },
    {
        "BLOCK_SIZE_M": 256,
        "BLOCK_SIZE_N": 64,
        "BLOCK_SIZE_K": 32,
        "GROUP_SIZE_M": 8,
        "num_stages": 7,
        "num_warps": 8,
        "ms": 0.189397394657135,
        "min_ms": 0.189397394657135,
        "max_ms": 0.189397394657135,
        "compile_time": 2.1050357818603516
    },
    {
        "BLOCK_SIZE_M": 256,
        "BLOCK_SIZE_N": 64,
        "BLOCK_SIZE_K": 32,
        "GROUP_SIZE_M": 8,
        "num_stages": 6,
        "num_warps": 8,
        "ms": 0.18969352543354034,
        "min_ms": 0.18969352543354034,
        "max_ms": 0.18969352543354034,
        "compile_time": 2.0958118438720703
    },
    {
        "BLOCK_SIZE_M": 64,
        "BLOCK_SIZE_N": 512,
        "BLOCK_SIZE_K": 16,
        "GROUP_SIZE_M": 8,
        "num_stages": 4,
        "num_warps": 8,
        "ms": 0.1898890733718872,
        "min_ms": 0.1898890733718872,
        "max_ms": 0.1898890733718872,
        "compile_time": 2.0880699157714844
    },
    {
        "BLOCK_SIZE_M": 128,
        "BLOCK_SIZE_N": 256,
        "BLOCK_SIZE_K": 16,
        "GROUP_SIZE_M": 8,
        "num_stages": 6,
        "num_warps": 8,
        "ms": 0.19033336639404297,
        "min_ms": 0.19033336639404297,
        "max_ms": 0.19033336639404297,
        "compile_time": 2.149718761444092
    },
    {
        "BLOCK_SIZE_M": 64,
        "BLOCK_SIZE_N": 512,
        "BLOCK_SIZE_K": 16,
        "GROUP_SIZE_M": 8,
        "num_stages": 5,
        "num_warps": 8,
        "ms": 0.19069211184978485,
        "min_ms": 0.19069211184978485,
        "max_ms": 0.19069211184978485,
        "compile_time": 2.118467092514038
    },
    {
        "BLOCK_SIZE_M": 256,
        "BLOCK_SIZE_N": 64,
        "BLOCK_SIZE_K": 32,
        "GROUP_SIZE_M": 8,
        "num_stages": 8,
        "num_warps": 8,
        "ms": 0.19088001549243927,
        "min_ms": 0.19088001549243927,
        "max_ms": 0.19088001549243927,
        "compile_time": 1.21299409866333
    },
    {
        "BLOCK_SIZE_M": 128,
        "BLOCK_SIZE_N": 64,
        "BLOCK_SIZE_K": 32,
        "GROUP_SIZE_M": 8,
        "num_stages": 5,
        "num_warps": 2,
        "ms": 0.19090703129768372,
        "min_ms": 0.19090703129768372,
        "max_ms": 0.19090703129768372,
        "compile_time": 2.503350019454956
    },
    {
        "BLOCK_SIZE_M": 64,
        "BLOCK_SIZE_N": 128,
        "BLOCK_SIZE_K": 64,
        "GROUP_SIZE_M": 8,
        "num_stages": 7,
        "num_warps": 4,
        "ms": 0.19128131866455078,
        "min_ms": 0.19128131866455078,
        "max_ms": 0.19128131866455078,
        "compile_time": 2.225919485092163
    },
    {
        "BLOCK_SIZE_M": 64,
        "BLOCK_SIZE_N": 256,
        "BLOCK_SIZE_K": 128,
        "GROUP_SIZE_M": 8,
        "num_stages": 3,
        "num_warps": 16,
        "ms": 0.19150526821613312,
        "min_ms": 0.19150526821613312,
        "max_ms": 0.19150526821613312,
        "compile_time": 1.1361126899719238
    },
    {
        "BLOCK_SIZE_M": 64,
        "BLOCK_SIZE_N": 512,
        "BLOCK_SIZE_K": 16,
        "GROUP_SIZE_M": 8,
        "num_stages": 8,
        "num_warps": 8,
        "ms": 0.1915585994720459,
        "min_ms": 0.1915585994720459,
        "max_ms": 0.1915585994720459,
        "compile_time": 2.190528154373169
    },
    {
        "BLOCK_SIZE_M": 128,
        "BLOCK_SIZE_N": 64,
        "BLOCK_SIZE_K": 64,
        "GROUP_SIZE_M": 8,
        "num_stages": 7,
        "num_warps": 4,
        "ms": 0.19190041720867157,
        "min_ms": 0.19190041720867157,
        "max_ms": 0.19190041720867157,
        "compile_time": 2.2771835327148438
    },
    {
        "BLOCK_SIZE_M": 64,
        "BLOCK_SIZE_N": 512,
        "BLOCK_SIZE_K": 16,
        "GROUP_SIZE_M": 8,
        "num_stages": 7,
        "num_warps": 8,
        "ms": 0.19193866848945618,
        "min_ms": 0.19193866848945618,
        "max_ms": 0.19193866848945618,
        "compile_time": 2.196072578430176
    },
    {
        "BLOCK_SIZE_M": 128,
        "BLOCK_SIZE_N": 256,
        "BLOCK_SIZE_K": 16,
        "GROUP_SIZE_M": 8,
        "num_stages": 7,
        "num_warps": 8,
        "ms": 0.19230099022388458,
        "min_ms": 0.19230099022388458,
        "max_ms": 0.19230099022388458,
        "compile_time": 2.1514225006103516
    },
    {
        "BLOCK_SIZE_M": 128,
        "BLOCK_SIZE_N": 128,
        "BLOCK_SIZE_K": 64,
        "GROUP_SIZE_M": 8,
        "num_stages": 3,
        "num_warps": 16,
        "ms": 0.19239115715026855,
        "min_ms": 0.19239115715026855,
        "max_ms": 0.19239115715026855,
        "compile_time": 1.8640167713165283
    },
    {
        "BLOCK_SIZE_M": 128,
        "BLOCK_SIZE_N": 64,
        "BLOCK_SIZE_K": 64,
        "GROUP_SIZE_M": 8,
        "num_stages": 3,
        "num_warps": 2,
        "ms": 0.19241675734519958,
        "min_ms": 0.19241675734519958,
        "max_ms": 0.19241675734519958,
        "compile_time": 2.763408899307251
    },
    {
        "BLOCK_SIZE_M": 128,
        "BLOCK_SIZE_N": 256,
        "BLOCK_SIZE_K": 16,
        "GROUP_SIZE_M": 8,
        "num_stages": 8,
        "num_warps": 8,
        "ms": 0.19272351264953613,
        "min_ms": 0.19272351264953613,
        "max_ms": 0.19272351264953613,
        "compile_time": 2.1888837814331055
    },
    {
        "BLOCK_SIZE_M": 64,
        "BLOCK_SIZE_N": 128,
        "BLOCK_SIZE_K": 16,
        "GROUP_SIZE_M": 8,
        "num_stages": 4,
        "num_warps": 2,
        "ms": 0.19288018345832825,
        "min_ms": 0.19288018345832825,
        "max_ms": 0.19288018345832825,
        "compile_time": 2.0870728492736816
    },
    {
        "BLOCK_SIZE_M": 128,
        "BLOCK_SIZE_N": 256,
        "BLOCK_SIZE_K": 16,
        "GROUP_SIZE_M": 8,
        "num_stages": 4,
        "num_warps": 8,
        "ms": 0.1929699331521988,
        "min_ms": 0.1929699331521988,
        "max_ms": 0.1929699331521988,
        "compile_time": 1.1597471237182617
    },
    {
        "BLOCK_SIZE_M": 128,
        "BLOCK_SIZE_N": 128,
        "BLOCK_SIZE_K": 64,
        "GROUP_SIZE_M": 8,
        "num_stages": 4,
        "num_warps": 16,
        "ms": 0.1931414008140564,
        "min_ms": 0.1931414008140564,
        "max_ms": 0.1931414008140564,
        "compile_time": 1.177168607711792
    },
    {
        "BLOCK_SIZE_M": 128,
        "BLOCK_SIZE_N": 256,
        "BLOCK_SIZE_K": 16,
        "GROUP_SIZE_M": 8,
        "num_stages": 5,
        "num_warps": 8,
        "ms": 0.19332355260849,
        "min_ms": 0.19332355260849,
        "max_ms": 0.19332355260849,
        "compile_time": 1.161071538925171
    },
    {
        "BLOCK_SIZE_M": 128,
        "BLOCK_SIZE_N": 128,
        "BLOCK_SIZE_K": 64,
        "GROUP_SIZE_M": 8,
        "num_stages": 5,
        "num_warps": 16,
        "ms": 0.19432410597801208,
        "min_ms": 0.19432410597801208,
        "max_ms": 0.19432410597801208,
        "compile_time": 1.1736576557159424
    },
    {
        "BLOCK_SIZE_M": 128,
        "BLOCK_SIZE_N": 256,
        "BLOCK_SIZE_K": 32,
        "GROUP_SIZE_M": 8,
        "num_stages": 4,
        "num_warps": 16,
        "ms": 0.19435951113700867,
        "min_ms": 0.19435951113700867,
        "max_ms": 0.19435951113700867,
        "compile_time": 1.1683802604675293
    },
    {
        "BLOCK_SIZE_M": 128,
        "BLOCK_SIZE_N": 256,
        "BLOCK_SIZE_K": 32,
        "GROUP_SIZE_M": 8,
        "num_stages": 3,
        "num_warps": 16,
        "ms": 0.19454653561115265,
        "min_ms": 0.19454653561115265,
        "max_ms": 0.19454653561115265,
        "compile_time": 1.1697518825531006
    },
    {
        "BLOCK_SIZE_M": 256,
        "BLOCK_SIZE_N": 64,
        "BLOCK_SIZE_K": 128,
        "GROUP_SIZE_M": 8,
        "num_stages": 3,
        "num_warps": 16,
        "ms": 0.19476482272148132,
        "min_ms": 0.19476482272148132,
        "max_ms": 0.19476482272148132,
        "compile_time": 2.1552000045776367
    },
    {
        "BLOCK_SIZE_M": 128,
        "BLOCK_SIZE_N": 256,
        "BLOCK_SIZE_K": 32,
        "GROUP_SIZE_M": 8,
        "num_stages": 5,
        "num_warps": 16,
        "ms": 0.1947934329509735,
        "min_ms": 0.1947934329509735,
        "max_ms": 0.1947934329509735,
        "compile_time": 1.9206149578094482
    },
    {
        "BLOCK_SIZE_M": 64,
        "BLOCK_SIZE_N": 128,
        "BLOCK_SIZE_K": 64,
        "GROUP_SIZE_M": 8,
        "num_stages": 4,
        "num_warps": 8,
        "ms": 0.19494441151618958,
        "min_ms": 0.19494441151618958,
        "max_ms": 0.19494441151618958,
        "compile_time": 1.1583600044250488
    },
    {
        "BLOCK_SIZE_M": 64,
        "BLOCK_SIZE_N": 128,
        "BLOCK_SIZE_K": 16,
        "GROUP_SIZE_M": 8,
        "num_stages": 6,
        "num_warps": 2,
        "ms": 0.19534607231616974,
        "min_ms": 0.19534607231616974,
        "max_ms": 0.19534607231616974,
        "compile_time": 2.1352646350860596
    },
    {
        "BLOCK_SIZE_M": 64,
        "BLOCK_SIZE_N": 128,
        "BLOCK_SIZE_K": 16,
        "GROUP_SIZE_M": 8,
        "num_stages": 5,
        "num_warps": 2,
        "ms": 0.1954864263534546,
        "min_ms": 0.1954864263534546,
        "max_ms": 0.1954864263534546,
        "compile_time": 2.1121127605438232
    },
    {
        "BLOCK_SIZE_M": 128,
        "BLOCK_SIZE_N": 256,
        "BLOCK_SIZE_K": 32,
        "GROUP_SIZE_M": 8,
        "num_stages": 6,
        "num_warps": 16,
        "ms": 0.1958441287279129,
        "min_ms": 0.1958441287279129,
        "max_ms": 0.1958441287279129,
        "compile_time": 1.9483647346496582
    },
    {
        "BLOCK_SIZE_M": 64,
        "BLOCK_SIZE_N": 128,
        "BLOCK_SIZE_K": 16,
        "GROUP_SIZE_M": 8,
        "num_stages": 7,
        "num_warps": 2,
        "ms": 0.1958877146244049,
        "min_ms": 0.1958877146244049,
        "max_ms": 0.1958877146244049,
        "compile_time": 2.163482904434204
    },
    {
        "BLOCK_SIZE_M": 64,
        "BLOCK_SIZE_N": 128,
        "BLOCK_SIZE_K": 32,
        "GROUP_SIZE_M": 8,
        "num_stages": 8,
        "num_warps": 4,
        "ms": 0.19606956839561462,
        "min_ms": 0.19606956839561462,
        "max_ms": 0.19606956839561462,
        "compile_time": 1.980928659439087
    },
    {
        "BLOCK_SIZE_M": 64,
        "BLOCK_SIZE_N": 128,
        "BLOCK_SIZE_K": 16,
        "GROUP_SIZE_M": 8,
        "num_stages": 3,
        "num_warps": 2,
        "ms": 0.19642065465450287,
        "min_ms": 0.19642065465450287,
        "max_ms": 0.19642065465450287,
        "compile_time": 2.0595200061798096
    },
    {
        "BLOCK_SIZE_M": 64,
        "BLOCK_SIZE_N": 128,
        "BLOCK_SIZE_K": 64,
        "GROUP_SIZE_M": 8,
        "num_stages": 3,
        "num_warps": 8,
        "ms": 0.19643093645572662,
        "min_ms": 0.19643093645572662,
        "max_ms": 0.19643093645572662,
        "compile_time": 1.1562445163726807
    },
    {
        "BLOCK_SIZE_M": 256,
        "BLOCK_SIZE_N": 128,
        "BLOCK_SIZE_K": 64,
        "GROUP_SIZE_M": 8,
        "num_stages": 2,
        "num_warps": 8,
        "ms": 0.19657018780708313,
        "min_ms": 0.19657018780708313,
        "max_ms": 0.19657018780708313,
        "compile_time": 2.4877943992614746
    },
    {
        "BLOCK_SIZE_M": 128,
        "BLOCK_SIZE_N": 256,
        "BLOCK_SIZE_K": 32,
        "GROUP_SIZE_M": 8,
        "num_stages": 7,
        "num_warps": 16,
        "ms": 0.19673624634742737,
        "min_ms": 0.19673624634742737,
        "max_ms": 0.19673624634742737,
        "compile_time": 1.9728071689605713
    },
    {
        "BLOCK_SIZE_M": 128,
        "BLOCK_SIZE_N": 128,
        "BLOCK_SIZE_K": 64,
        "GROUP_SIZE_M": 8,
        "num_stages": 6,
        "num_warps": 16,
        "ms": 0.19750399887561798,
        "min_ms": 0.19750399887561798,
        "max_ms": 0.19750399887561798,
        "compile_time": 1.886127233505249
    },
    {
        "BLOCK_SIZE_M": 128,
        "BLOCK_SIZE_N": 64,
        "BLOCK_SIZE_K": 32,
        "GROUP_SIZE_M": 8,
        "num_stages": 6,
        "num_warps": 2,
        "ms": 0.19752533733844757,
        "min_ms": 0.19752533733844757,
        "max_ms": 0.19752533733844757,
        "compile_time": 2.540203332901001
    },
    {
        "BLOCK_SIZE_M": 64,
        "BLOCK_SIZE_N": 256,
        "BLOCK_SIZE_K": 32,
        "GROUP_SIZE_M": 8,
        "num_stages": 2,
        "num_warps": 4,
        "ms": 0.19789591431617737,
        "min_ms": 0.19789591431617737,
        "max_ms": 0.19789591431617737,
        "compile_time": 2.222136974334717
    },
    {
        "BLOCK_SIZE_M": 128,
        "BLOCK_SIZE_N": 64,
        "BLOCK_SIZE_K": 64,
        "GROUP_SIZE_M": 8,
        "num_stages": 5,
        "num_warps": 4,
        "ms": 0.19880691170692444,
        "min_ms": 0.19880691170692444,
        "max_ms": 0.19880691170692444,
        "compile_time": 2.1965529918670654
    },
    {
        "BLOCK_SIZE_M": 128,
        "BLOCK_SIZE_N": 64,
        "BLOCK_SIZE_K": 32,
        "GROUP_SIZE_M": 8,
        "num_stages": 7,
        "num_warps": 2,
        "ms": 0.1988522708415985,
        "min_ms": 0.1988522708415985,
        "max_ms": 0.1988522708415985,
        "compile_time": 2.5724284648895264
    },
    {
        "BLOCK_SIZE_M": 256,
        "BLOCK_SIZE_N": 128,
        "BLOCK_SIZE_K": 32,
        "GROUP_SIZE_M": 8,
        "num_stages": 4,
        "num_warps": 16,
        "ms": 0.19885240495204926,
        "min_ms": 0.19885240495204926,
        "max_ms": 0.19885240495204926,
        "compile_time": 2.0020923614501953
    },
    {
        "BLOCK_SIZE_M": 128,
        "BLOCK_SIZE_N": 64,
        "BLOCK_SIZE_K": 64,
        "GROUP_SIZE_M": 8,
        "num_stages": 3,
        "num_warps": 8,
        "ms": 0.1988823562860489,
        "min_ms": 0.1988823562860489,
        "max_ms": 0.1988823562860489,
        "compile_time": 1.1967451572418213
    },
    {
        "BLOCK_SIZE_M": 256,
        "BLOCK_SIZE_N": 128,
        "BLOCK_SIZE_K": 128,
        "GROUP_SIZE_M": 8,
        "num_stages": 2,
        "num_warps": 8,
        "ms": 0.1993996798992157,
        "min_ms": 0.1993996798992157,
        "max_ms": 0.1993996798992157,
        "compile_time": 2.751512050628662
    },
    {
        "BLOCK_SIZE_M": 128,
        "BLOCK_SIZE_N": 64,
        "BLOCK_SIZE_K": 64,
        "GROUP_SIZE_M": 8,
        "num_stages": 6,
        "num_warps": 4,
        "ms": 0.19950564205646515,
        "min_ms": 0.19950564205646515,
        "max_ms": 0.19950564205646515,
        "compile_time": 2.2390565872192383
    },
    {
        "BLOCK_SIZE_M": 256,
        "BLOCK_SIZE_N": 128,
        "BLOCK_SIZE_K": 32,
        "GROUP_SIZE_M": 8,
        "num_stages": 5,
        "num_warps": 16,
        "ms": 0.19993886351585388,
        "min_ms": 0.19993886351585388,
        "max_ms": 0.19993886351585388,
        "compile_time": 2.0125572681427
    },
    {
        "BLOCK_SIZE_M": 64,
        "BLOCK_SIZE_N": 256,
        "BLOCK_SIZE_K": 64,
        "GROUP_SIZE_M": 8,
        "num_stages": 3,
        "num_warps": 16,
        "ms": 0.2002088576555252,
        "min_ms": 0.2002088576555252,
        "max_ms": 0.2002088576555252,
        "compile_time": 1.1327264308929443
    },
    {
        "BLOCK_SIZE_M": 256,
        "BLOCK_SIZE_N": 128,
        "BLOCK_SIZE_K": 32,
        "GROUP_SIZE_M": 8,
        "num_stages": 3,
        "num_warps": 16,
        "ms": 0.2002314031124115,
        "min_ms": 0.2002314031124115,
        "max_ms": 0.2002314031124115,
        "compile_time": 1.9981017112731934
    },
    {
        "BLOCK_SIZE_M": 128,
        "BLOCK_SIZE_N": 128,
        "BLOCK_SIZE_K": 16,
        "GROUP_SIZE_M": 8,
        "num_stages": 8,
        "num_warps": 8,
        "ms": 0.2003294974565506,
        "min_ms": 0.2003294974565506,
        "max_ms": 0.2003294974565506,
        "compile_time": 1.1813347339630127
    },
    {
        "BLOCK_SIZE_M": 128,
        "BLOCK_SIZE_N": 64,
        "BLOCK_SIZE_K": 64,
        "GROUP_SIZE_M": 8,
        "num_stages": 4,
        "num_warps": 8,
        "ms": 0.2004213035106659,
        "min_ms": 0.2004213035106659,
        "max_ms": 0.2004213035106659,
        "compile_time": 1.1717190742492676
    },
    {
        "BLOCK_SIZE_M": 64,
        "BLOCK_SIZE_N": 128,
        "BLOCK_SIZE_K": 128,
        "GROUP_SIZE_M": 8,
        "num_stages": 4,
        "num_warps": 4,
        "ms": 0.20042145252227783,
        "min_ms": 0.20042145252227783,
        "max_ms": 0.20042145252227783,
        "compile_time": 2.4883008003234863
    },
    {
        "BLOCK_SIZE_M": 128,
        "BLOCK_SIZE_N": 128,
        "BLOCK_SIZE_K": 16,
        "GROUP_SIZE_M": 8,
        "num_stages": 3,
        "num_warps": 4,
        "ms": 0.20055446028709412,
        "min_ms": 0.20055446028709412,
        "max_ms": 0.20055446028709412,
        "compile_time": 2.096963405609131
    },
    {
        "BLOCK_SIZE_M": 256,
        "BLOCK_SIZE_N": 128,
        "BLOCK_SIZE_K": 32,
        "GROUP_SIZE_M": 8,
        "num_stages": 6,
        "num_warps": 16,
        "ms": 0.200605109333992,
        "min_ms": 0.200605109333992,
        "max_ms": 0.200605109333992,
        "compile_time": 2.0152060985565186
    },
    {
        "BLOCK_SIZE_M": 64,
        "BLOCK_SIZE_N": 256,
        "BLOCK_SIZE_K": 64,
        "GROUP_SIZE_M": 8,
        "num_stages": 4,
        "num_warps": 4,
        "ms": 0.20064136385917664,
        "min_ms": 0.20064136385917664,
        "max_ms": 0.20064136385917664,
        "compile_time": 2.783416986465454
    },
    {
        "BLOCK_SIZE_M": 256,
        "BLOCK_SIZE_N": 64,
        "BLOCK_SIZE_K": 64,
        "GROUP_SIZE_M": 8,
        "num_stages": 4,
        "num_warps": 16,
        "ms": 0.20073910057544708,
        "min_ms": 0.20073910057544708,
        "max_ms": 0.20073910057544708,
        "compile_time": 1.9667508602142334
    },
    {
        "BLOCK_SIZE_M": 64,
        "BLOCK_SIZE_N": 256,
        "BLOCK_SIZE_K": 64,
        "GROUP_SIZE_M": 8,
        "num_stages": 4,
        "num_warps": 16,
        "ms": 0.20140042901039124,
        "min_ms": 0.20140042901039124,
        "max_ms": 0.20140042901039124,
        "compile_time": 1.1349406242370605
    },
    {
        "BLOCK_SIZE_M": 256,
        "BLOCK_SIZE_N": 128,
        "BLOCK_SIZE_K": 32,
        "GROUP_SIZE_M": 8,
        "num_stages": 7,
        "num_warps": 16,
        "ms": 0.2016240805387497,
        "min_ms": 0.2016240805387497,
        "max_ms": 0.2016240805387497,
        "compile_time": 2.054807186126709
    },
    {
        "BLOCK_SIZE_M": 256,
        "BLOCK_SIZE_N": 128,
        "BLOCK_SIZE_K": 16,
        "GROUP_SIZE_M": 8,
        "num_stages": 6,
        "num_warps": 8,
        "ms": 0.20195463299751282,
        "min_ms": 0.20195463299751282,
        "max_ms": 0.20195463299751282,
        "compile_time": 2.2852022647857666
    },
    {
        "BLOCK_SIZE_M": 64,
        "BLOCK_SIZE_N": 256,
        "BLOCK_SIZE_K": 64,
        "GROUP_SIZE_M": 8,
        "num_stages": 5,
        "num_warps": 4,
        "ms": 0.20206642150878906,
        "min_ms": 0.20206642150878906,
        "max_ms": 0.20206642150878906,
        "compile_time": 2.681980609893799
    },
    {
        "BLOCK_SIZE_M": 256,
        "BLOCK_SIZE_N": 128,
        "BLOCK_SIZE_K": 16,
        "GROUP_SIZE_M": 8,
        "num_stages": 7,
        "num_warps": 8,
        "ms": 0.20252008736133575,
        "min_ms": 0.20252008736133575,
        "max_ms": 0.20252008736133575,
        "compile_time": 2.256746530532837
    },
    {
        "BLOCK_SIZE_M": 64,
        "BLOCK_SIZE_N": 128,
        "BLOCK_SIZE_K": 64,
        "GROUP_SIZE_M": 8,
        "num_stages": 2,
        "num_warps": 2,
        "ms": 0.2026483714580536,
        "min_ms": 0.2026483714580536,
        "max_ms": 0.2026483714580536,
        "compile_time": 2.506047248840332
    },
    {
        "BLOCK_SIZE_M": 64,
        "BLOCK_SIZE_N": 128,
        "BLOCK_SIZE_K": 16,
        "GROUP_SIZE_M": 8,
        "num_stages": 7,
        "num_warps": 4,
        "ms": 0.20268133282661438,
        "min_ms": 0.20268133282661438,
        "max_ms": 0.20268133282661438,
        "compile_time": 1.146043300628662
    },
    {
        "BLOCK_SIZE_M": 64,
        "BLOCK_SIZE_N": 128,
        "BLOCK_SIZE_K": 128,
        "GROUP_SIZE_M": 8,
        "num_stages": 2,
        "num_warps": 4,
        "ms": 0.20279788970947266,
        "min_ms": 0.20279788970947266,
        "max_ms": 0.20279788970947266,
        "compile_time": 2.2180254459381104
    },
    {
        "BLOCK_SIZE_M": 128,
        "BLOCK_SIZE_N": 64,
        "BLOCK_SIZE_K": 32,
        "GROUP_SIZE_M": 8,
        "num_stages": 8,
        "num_warps": 4,
        "ms": 0.20297321677207947,
        "min_ms": 0.20297321677207947,
        "max_ms": 0.20297321677207947,
        "compile_time": 2.0700595378875732
    },
    {
        "BLOCK_SIZE_M": 64,
        "BLOCK_SIZE_N": 256,
        "BLOCK_SIZE_K": 64,
        "GROUP_SIZE_M": 8,
        "num_stages": 5,
        "num_warps": 16,
        "ms": 0.2031327486038208,
        "min_ms": 0.2031327486038208,
        "max_ms": 0.2031327486038208,
        "compile_time": 1.1577959060668945
    },
    {
        "BLOCK_SIZE_M": 256,
        "BLOCK_SIZE_N": 128,
        "BLOCK_SIZE_K": 16,
        "GROUP_SIZE_M": 8,
        "num_stages": 8,
        "num_warps": 8,
        "ms": 0.20317217707633972,
        "min_ms": 0.20317217707633972,
        "max_ms": 0.20317217707633972,
        "compile_time": 2.2994282245635986
    },
    {
        "BLOCK_SIZE_M": 256,
        "BLOCK_SIZE_N": 64,
        "BLOCK_SIZE_K": 64,
        "GROUP_SIZE_M": 8,
        "num_stages": 3,
        "num_warps": 16,
        "ms": 0.2033410519361496,
        "min_ms": 0.2033410519361496,
        "max_ms": 0.2033410519361496,
        "compile_time": 1.2164454460144043
    },
    {
        "BLOCK_SIZE_M": 128,
        "BLOCK_SIZE_N": 64,
        "BLOCK_SIZE_K": 128,
        "GROUP_SIZE_M": 8,
        "num_stages": 3,
        "num_warps": 4,
        "ms": 0.20334705710411072,
        "min_ms": 0.20334705710411072,
        "max_ms": 0.20334705710411072,
        "compile_time": 2.4863016605377197
    },
    {
        "BLOCK_SIZE_M": 64,
        "BLOCK_SIZE_N": 512,
        "BLOCK_SIZE_K": 16,
        "GROUP_SIZE_M": 8,
        "num_stages": 3,
        "num_warps": 8,
        "ms": 0.2034931182861328,
        "min_ms": 0.2034931182861328,
        "max_ms": 0.2034931182861328,
        "compile_time": 2.0635898113250732
    },
    {
        "BLOCK_SIZE_M": 64,
        "BLOCK_SIZE_N": 128,
        "BLOCK_SIZE_K": 32,
        "GROUP_SIZE_M": 8,
        "num_stages": 6,
        "num_warps": 2,
        "ms": 0.20360080897808075,
        "min_ms": 0.20360080897808075,
        "max_ms": 0.20360080897808075,
        "compile_time": 2.4760117530822754
    },
    {
        "BLOCK_SIZE_M": 256,
        "BLOCK_SIZE_N": 64,
        "BLOCK_SIZE_K": 32,
        "GROUP_SIZE_M": 8,
        "num_stages": 2,
        "num_warps": 4,
        "ms": 0.20364320278167725,
        "min_ms": 0.20364320278167725,
        "max_ms": 0.20364320278167725,
        "compile_time": 2.3943605422973633
    },
    {
        "BLOCK_SIZE_M": 128,
        "BLOCK_SIZE_N": 64,
        "BLOCK_SIZE_K": 32,
        "GROUP_SIZE_M": 8,
        "num_stages": 2,
        "num_warps": 2,
        "ms": 0.20366647839546204,
        "min_ms": 0.20366647839546204,
        "max_ms": 0.20366647839546204,
        "compile_time": 2.3523707389831543
    },
    {
        "BLOCK_SIZE_M": 64,
        "BLOCK_SIZE_N": 128,
        "BLOCK_SIZE_K": 128,
        "GROUP_SIZE_M": 8,
        "num_stages": 3,
        "num_warps": 4,
        "ms": 0.20393864810466766,
        "min_ms": 0.20393864810466766,
        "max_ms": 0.20393864810466766,
        "compile_time": 2.3932738304138184
    },
    {
        "BLOCK_SIZE_M": 64,
        "BLOCK_SIZE_N": 128,
        "BLOCK_SIZE_K": 64,
        "GROUP_SIZE_M": 8,
        "num_stages": 3,
        "num_warps": 2,
        "ms": 0.20419493317604065,
        "min_ms": 0.20419493317604065,
        "max_ms": 0.20419493317604065,
        "compile_time": 2.6836187839508057
    },
    {
        "BLOCK_SIZE_M": 128,
        "BLOCK_SIZE_N": 64,
        "BLOCK_SIZE_K": 64,
        "GROUP_SIZE_M": 8,
        "num_stages": 2,
        "num_warps": 4,
        "ms": 0.20438942313194275,
        "min_ms": 0.20438942313194275,
        "max_ms": 0.20438942313194275,
        "compile_time": 2.1071810722351074
    },
    {
        "BLOCK_SIZE_M": 128,
        "BLOCK_SIZE_N": 64,
        "BLOCK_SIZE_K": 128,
        "GROUP_SIZE_M": 8,
        "num_stages": 2,
        "num_warps": 4,
        "ms": 0.20448465645313263,
        "min_ms": 0.20448465645313263,
        "max_ms": 0.20448465645313263,
        "compile_time": 2.3211123943328857
    },
    {
        "BLOCK_SIZE_M": 128,
        "BLOCK_SIZE_N": 64,
        "BLOCK_SIZE_K": 128,
        "GROUP_SIZE_M": 8,
        "num_stages": 4,
        "num_warps": 4,
        "ms": 0.2046341598033905,
        "min_ms": 0.2046341598033905,
        "max_ms": 0.2046341598033905,
        "compile_time": 2.6295738220214844
    },
    {
        "BLOCK_SIZE_M": 128,
        "BLOCK_SIZE_N": 64,
        "BLOCK_SIZE_K": 64,
        "GROUP_SIZE_M": 8,
        "num_stages": 2,
        "num_warps": 2,
        "ms": 0.20469394326210022,
        "min_ms": 0.20469394326210022,
        "max_ms": 0.20469394326210022,
        "compile_time": 2.5683674812316895
    },
    {
        "BLOCK_SIZE_M": 64,
        "BLOCK_SIZE_N": 128,
        "BLOCK_SIZE_K": 32,
        "GROUP_SIZE_M": 8,
        "num_stages": 7,
        "num_warps": 2,
        "ms": 0.2047239989042282,
        "min_ms": 0.2047239989042282,
        "max_ms": 0.2047239989042282,
        "compile_time": 2.5304229259490967
    },
    {
        "BLOCK_SIZE_M": 64,
        "BLOCK_SIZE_N": 128,
        "BLOCK_SIZE_K": 64,
        "GROUP_SIZE_M": 8,
        "num_stages": 5,
        "num_warps": 8,
        "ms": 0.2049909085035324,
        "min_ms": 0.2049909085035324,
        "max_ms": 0.2049909085035324,
        "compile_time": 1.8265841007232666
    },
    {
        "BLOCK_SIZE_M": 64,
        "BLOCK_SIZE_N": 128,
        "BLOCK_SIZE_K": 64,
        "GROUP_SIZE_M": 8,
        "num_stages": 6,
        "num_warps": 8,
        "ms": 0.20617170631885529,
        "min_ms": 0.20617170631885529,
        "max_ms": 0.20617170631885529,
        "compile_time": 1.1518189907073975
    },
    {
        "BLOCK_SIZE_M": 64,
        "BLOCK_SIZE_N": 128,
        "BLOCK_SIZE_K": 128,
        "GROUP_SIZE_M": 8,
        "num_stages": 4,
        "num_warps": 8,
        "ms": 0.20627455413341522,
        "min_ms": 0.20627455413341522,
        "max_ms": 0.20627455413341522,
        "compile_time": 1.1417896747589111
    },
    {
        "BLOCK_SIZE_M": 64,
        "BLOCK_SIZE_N": 128,
        "BLOCK_SIZE_K": 32,
        "GROUP_SIZE_M": 8,
        "num_stages": 2,
        "num_warps": 2,
        "ms": 0.20662300288677216,
        "min_ms": 0.20662300288677216,
        "max_ms": 0.20662300288677216,
        "compile_time": 2.2891900539398193
    },
    {
        "BLOCK_SIZE_M": 64,
        "BLOCK_SIZE_N": 128,
        "BLOCK_SIZE_K": 16,
        "GROUP_SIZE_M": 8,
        "num_stages": 8,
        "num_warps": 2,
        "ms": 0.20715396106243134,
        "min_ms": 0.20715396106243134,
        "max_ms": 0.20715396106243134,
        "compile_time": 2.1764509677886963
    },
    {
        "BLOCK_SIZE_M": 256,
        "BLOCK_SIZE_N": 64,
        "BLOCK_SIZE_K": 64,
        "GROUP_SIZE_M": 8,
        "num_stages": 5,
        "num_warps": 16,
        "ms": 0.2073444426059723,
        "min_ms": 0.2073444426059723,
        "max_ms": 0.2073444426059723,
        "compile_time": 2.0194756984710693
    },
    {
        "BLOCK_SIZE_M": 128,
        "BLOCK_SIZE_N": 64,
        "BLOCK_SIZE_K": 128,
        "GROUP_SIZE_M": 8,
        "num_stages": 3,
        "num_warps": 8,
        "ms": 0.20738331973552704,
        "min_ms": 0.20738331973552704,
        "max_ms": 0.20738331973552704,
        "compile_time": 2.066380262374878
    },
    {
        "BLOCK_SIZE_M": 64,
        "BLOCK_SIZE_N": 128,
        "BLOCK_SIZE_K": 16,
        "GROUP_SIZE_M": 8,
        "num_stages": 6,
        "num_warps": 4,
        "ms": 0.2076486051082611,
        "min_ms": 0.2076486051082611,
        "max_ms": 0.2076486051082611,
        "compile_time": 1.1757285594940186
    },
    {
        "BLOCK_SIZE_M": 128,
        "BLOCK_SIZE_N": 128,
        "BLOCK_SIZE_K": 32,
        "GROUP_SIZE_M": 8,
        "num_stages": 2,
        "num_warps": 4,
        "ms": 0.20773978531360626,
        "min_ms": 0.20773978531360626,
        "max_ms": 0.20773978531360626,
        "compile_time": 2.291445255279541
    },
    {
        "BLOCK_SIZE_M": 256,
        "BLOCK_SIZE_N": 64,
        "BLOCK_SIZE_K": 32,
        "GROUP_SIZE_M": 8,
        "num_stages": 3,
        "num_warps": 8,
        "ms": 0.20801472663879395,
        "min_ms": 0.20801472663879395,
        "max_ms": 0.20801472663879395,
        "compile_time": 2.0033390522003174
    },
    {
        "BLOCK_SIZE_M": 256,
        "BLOCK_SIZE_N": 128,
        "BLOCK_SIZE_K": 64,
        "GROUP_SIZE_M": 8,
        "num_stages": 3,
        "num_warps": 16,
        "ms": 0.20802819728851318,
        "min_ms": 0.20802819728851318,
        "max_ms": 0.20802819728851318,
        "compile_time": 2.162625312805176
    },
    {
        "BLOCK_SIZE_M": 64,
        "BLOCK_SIZE_N": 128,
        "BLOCK_SIZE_K": 128,
        "GROUP_SIZE_M": 8,
        "num_stages": 3,
        "num_warps": 8,
        "ms": 0.2080868035554886,
        "min_ms": 0.2080868035554886,
        "max_ms": 0.2080868035554886,
        "compile_time": 1.1407654285430908
    },
    {
        "BLOCK_SIZE_M": 128,
        "BLOCK_SIZE_N": 256,
        "BLOCK_SIZE_K": 64,
        "GROUP_SIZE_M": 8,
        "num_stages": 3,
        "num_warps": 16,
        "ms": 0.20840518176555634,
        "min_ms": 0.20840518176555634,
        "max_ms": 0.20840518176555634,
        "compile_time": 2.101785182952881
    },
    {
        "BLOCK_SIZE_M": 256,
        "BLOCK_SIZE_N": 128,
        "BLOCK_SIZE_K": 64,
        "GROUP_SIZE_M": 8,
        "num_stages": 4,
        "num_warps": 16,
        "ms": 0.20857223868370056,
        "min_ms": 0.20857223868370056,
        "max_ms": 0.20857223868370056,
        "compile_time": 2.1948039531707764
    },
    {
        "BLOCK_SIZE_M": 64,
        "BLOCK_SIZE_N": 128,
        "BLOCK_SIZE_K": 128,
        "GROUP_SIZE_M": 8,
        "num_stages": 2,
        "num_warps": 8,
        "ms": 0.20867815613746643,
        "min_ms": 0.20867815613746643,
        "max_ms": 0.20867815613746643,
        "compile_time": 1.137972354888916
    },
    {
        "BLOCK_SIZE_M": 128,
        "BLOCK_SIZE_N": 256,
        "BLOCK_SIZE_K": 16,
        "GROUP_SIZE_M": 8,
        "num_stages": 3,
        "num_warps": 8,
        "ms": 0.20879855751991272,
        "min_ms": 0.20879855751991272,
        "max_ms": 0.20879855751991272,
        "compile_time": 1.1585276126861572
    },
    {
        "BLOCK_SIZE_M": 128,
        "BLOCK_SIZE_N": 64,
        "BLOCK_SIZE_K": 128,
        "GROUP_SIZE_M": 8,
        "num_stages": 4,
        "num_warps": 8,
        "ms": 0.20886187255382538,
        "min_ms": 0.20886187255382538,
        "max_ms": 0.20886187255382538,
        "compile_time": 2.1057491302490234
    },
    {
        "BLOCK_SIZE_M": 128,
        "BLOCK_SIZE_N": 256,
        "BLOCK_SIZE_K": 64,
        "GROUP_SIZE_M": 8,
        "num_stages": 4,
        "num_warps": 16,
        "ms": 0.20887026190757751,
        "min_ms": 0.20887026190757751,
        "max_ms": 0.20887026190757751,
        "compile_time": 2.1565985679626465
    },
    {
        "BLOCK_SIZE_M": 64,
        "BLOCK_SIZE_N": 128,
        "BLOCK_SIZE_K": 64,
        "GROUP_SIZE_M": 8,
        "num_stages": 7,
        "num_warps": 8,
        "ms": 0.20927751064300537,
        "min_ms": 0.20927751064300537,
        "max_ms": 0.20927751064300537,
        "compile_time": 1.1244418621063232
    },
    {
        "BLOCK_SIZE_M": 64,
        "BLOCK_SIZE_N": 128,
        "BLOCK_SIZE_K": 64,
        "GROUP_SIZE_M": 8,
        "num_stages": 2,
        "num_warps": 4,
        "ms": 0.2093917429447174,
        "min_ms": 0.2093917429447174,
        "max_ms": 0.2093917429447174,
        "compile_time": 1.9152746200561523
    },
    {
        "BLOCK_SIZE_M": 64,
        "BLOCK_SIZE_N": 128,
        "BLOCK_SIZE_K": 16,
        "GROUP_SIZE_M": 8,
        "num_stages": 3,
        "num_warps": 4,
        "ms": 0.20943045616149902,
        "min_ms": 0.20943045616149902,
        "max_ms": 0.20943045616149902,
        "compile_time": 1.1636345386505127
    },
    {
        "BLOCK_SIZE_M": 128,
        "BLOCK_SIZE_N": 64,
        "BLOCK_SIZE_K": 64,
        "GROUP_SIZE_M": 8,
        "num_stages": 5,
        "num_warps": 8,
        "ms": 0.20948442816734314,
        "min_ms": 0.20948442816734314,
        "max_ms": 0.20948442816734314,
        "compile_time": 1.2031817436218262
    },
    {
        "BLOCK_SIZE_M": 64,
        "BLOCK_SIZE_N": 128,
        "BLOCK_SIZE_K": 16,
        "GROUP_SIZE_M": 8,
        "num_stages": 8,
        "num_warps": 4,
        "ms": 0.20950599014759064,
        "min_ms": 0.20950599014759064,
        "max_ms": 0.20950599014759064,
        "compile_time": 1.822660207748413
    },
    {
        "BLOCK_SIZE_M": 128,
        "BLOCK_SIZE_N": 128,
        "BLOCK_SIZE_K": 16,
        "GROUP_SIZE_M": 8,
        "num_stages": 4,
        "num_warps": 8,
        "ms": 0.20951858162879944,
        "min_ms": 0.20951858162879944,
        "max_ms": 0.20951858162879944,
        "compile_time": 1.8135781288146973
    },
    {
        "BLOCK_SIZE_M": 64,
        "BLOCK_SIZE_N": 128,
        "BLOCK_SIZE_K": 16,
        "GROUP_SIZE_M": 8,
        "num_stages": 4,
        "num_warps": 4,
        "ms": 0.20973679423332214,
        "min_ms": 0.20973679423332214,
        "max_ms": 0.20973679423332214,
        "compile_time": 1.1538639068603516
    },
    {
        "BLOCK_SIZE_M": 64,
        "BLOCK_SIZE_N": 128,
        "BLOCK_SIZE_K": 32,
        "GROUP_SIZE_M": 8,
        "num_stages": 6,
        "num_warps": 8,
        "ms": 0.20974799990653992,
        "min_ms": 0.20974799990653992,
        "max_ms": 0.20974799990653992,
        "compile_time": 1.1480228900909424
    },
    {
        "BLOCK_SIZE_M": 64,
        "BLOCK_SIZE_N": 128,
        "BLOCK_SIZE_K": 32,
        "GROUP_SIZE_M": 8,
        "num_stages": 4,
        "num_warps": 8,
        "ms": 0.20976033806800842,
        "min_ms": 0.20976033806800842,
        "max_ms": 0.20976033806800842,
        "compile_time": 1.7049431800842285
    },
    {
        "BLOCK_SIZE_M": 128,
        "BLOCK_SIZE_N": 128,
        "BLOCK_SIZE_K": 16,
        "GROUP_SIZE_M": 8,
        "num_stages": 7,
        "num_warps": 8,
        "ms": 0.21020753681659698,
        "min_ms": 0.21020753681659698,
        "max_ms": 0.21020753681659698,
        "compile_time": 1.1797854900360107
    },
    {
        "BLOCK_SIZE_M": 128,
        "BLOCK_SIZE_N": 128,
        "BLOCK_SIZE_K": 16,
        "GROUP_SIZE_M": 8,
        "num_stages": 5,
        "num_warps": 8,
        "ms": 0.21027621626853943,
        "min_ms": 0.21027621626853943,
        "max_ms": 0.21027621626853943,
        "compile_time": 1.1842467784881592
    },
    {
        "BLOCK_SIZE_M": 128,
        "BLOCK_SIZE_N": 128,
        "BLOCK_SIZE_K": 16,
        "GROUP_SIZE_M": 8,
        "num_stages": 6,
        "num_warps": 8,
        "ms": 0.2103784829378128,
        "min_ms": 0.2103784829378128,
        "max_ms": 0.2103784829378128,
        "compile_time": 1.175114631652832
    },
    {
        "BLOCK_SIZE_M": 64,
        "BLOCK_SIZE_N": 128,
        "BLOCK_SIZE_K": 32,
        "GROUP_SIZE_M": 8,
        "num_stages": 5,
        "num_warps": 8,
        "ms": 0.21091468632221222,
        "min_ms": 0.21091468632221222,
        "max_ms": 0.21091468632221222,
        "compile_time": 1.1532199382781982
    },
    {
        "BLOCK_SIZE_M": 64,
        "BLOCK_SIZE_N": 128,
        "BLOCK_SIZE_K": 32,
        "GROUP_SIZE_M": 8,
        "num_stages": 3,
        "num_warps": 8,
        "ms": 0.21104088425636292,
        "min_ms": 0.21104088425636292,
        "max_ms": 0.21104088425636292,
        "compile_time": 1.1706695556640625
    },
    {
        "BLOCK_SIZE_M": 64,
        "BLOCK_SIZE_N": 128,
        "BLOCK_SIZE_K": 16,
        "GROUP_SIZE_M": 8,
        "num_stages": 5,
        "num_warps": 4,
        "ms": 0.21121804416179657,
        "min_ms": 0.21121804416179657,
        "max_ms": 0.21121804416179657,
        "compile_time": 1.7711131572723389
    },
    {
        "BLOCK_SIZE_M": 64,
        "BLOCK_SIZE_N": 128,
        "BLOCK_SIZE_K": 32,
        "GROUP_SIZE_M": 8,
        "num_stages": 7,
        "num_warps": 8,
        "ms": 0.21145948767662048,
        "min_ms": 0.21145948767662048,
        "max_ms": 0.21145948767662048,
        "compile_time": 1.7460427284240723
    },
    {
        "BLOCK_SIZE_M": 128,
        "BLOCK_SIZE_N": 64,
        "BLOCK_SIZE_K": 128,
        "GROUP_SIZE_M": 8,
        "num_stages": 2,
        "num_warps": 8,
        "ms": 0.21250908076763153,
        "min_ms": 0.21250908076763153,
        "max_ms": 0.21250908076763153,
        "compile_time": 1.1836071014404297
    },
    {
        "BLOCK_SIZE_M": 128,
        "BLOCK_SIZE_N": 64,
        "BLOCK_SIZE_K": 64,
        "GROUP_SIZE_M": 8,
        "num_stages": 6,
        "num_warps": 8,
        "ms": 0.21282482147216797,
        "min_ms": 0.21282482147216797,
        "max_ms": 0.21282482147216797,
        "compile_time": 1.1790180206298828
    },
    {
        "BLOCK_SIZE_M": 128,
        "BLOCK_SIZE_N": 128,
        "BLOCK_SIZE_K": 16,
        "GROUP_SIZE_M": 8,
        "num_stages": 3,
        "num_warps": 8,
        "ms": 0.21289870142936707,
        "min_ms": 0.21289870142936707,
        "max_ms": 0.21289870142936707,
        "compile_time": 1.7665419578552246
    },
    {
        "BLOCK_SIZE_M": 64,
        "BLOCK_SIZE_N": 128,
        "BLOCK_SIZE_K": 64,
        "GROUP_SIZE_M": 8,
        "num_stages": 2,
        "num_warps": 8,
        "ms": 0.21293076872825623,
        "min_ms": 0.21293076872825623,
        "max_ms": 0.21293076872825623,
        "compile_time": 1.0917882919311523
    },
    {
        "BLOCK_SIZE_M": 128,
        "BLOCK_SIZE_N": 64,
        "BLOCK_SIZE_K": 64,
        "GROUP_SIZE_M": 8,
        "num_stages": 7,
        "num_warps": 8,
        "ms": 0.21426625549793243,
        "min_ms": 0.21426625549793243,
        "max_ms": 0.21426625549793243,
        "compile_time": 1.1835641860961914
    },
    {
        "BLOCK_SIZE_M": 128,
        "BLOCK_SIZE_N": 64,
        "BLOCK_SIZE_K": 32,
        "GROUP_SIZE_M": 8,
        "num_stages": 7,
        "num_warps": 8,
        "ms": 0.21632857620716095,
        "min_ms": 0.21632857620716095,
        "max_ms": 0.21632857620716095,
        "compile_time": 1.1875481605529785
    },
    {
        "BLOCK_SIZE_M": 128,
        "BLOCK_SIZE_N": 128,
        "BLOCK_SIZE_K": 32,
        "GROUP_SIZE_M": 8,
        "num_stages": 5,
        "num_warps": 16,
        "ms": 0.21680960059165955,
        "min_ms": 0.21680960059165955,
        "max_ms": 0.21680960059165955,
        "compile_time": 1.1699278354644775
    },
    {
        "BLOCK_SIZE_M": 128,
        "BLOCK_SIZE_N": 64,
        "BLOCK_SIZE_K": 32,
        "GROUP_SIZE_M": 8,
        "num_stages": 6,
        "num_warps": 8,
        "ms": 0.21683451533317566,
        "min_ms": 0.21683451533317566,
        "max_ms": 0.21683451533317566,
        "compile_time": 1.2051777839660645
    },
    {
        "BLOCK_SIZE_M": 64,
        "BLOCK_SIZE_N": 256,
        "BLOCK_SIZE_K": 16,
        "GROUP_SIZE_M": 8,
        "num_stages": 3,
        "num_warps": 8,
        "ms": 0.21688011288642883,
        "min_ms": 0.21688011288642883,
        "max_ms": 0.21688011288642883,
        "compile_time": 1.757392168045044
    },
    {
        "BLOCK_SIZE_M": 256,
        "BLOCK_SIZE_N": 64,
        "BLOCK_SIZE_K": 64,
        "GROUP_SIZE_M": 8,
        "num_stages": 1,
        "num_warps": 4,
        "ms": 0.2172844409942627,
        "min_ms": 0.2172844409942627,
        "max_ms": 0.2172844409942627,
        "compile_time": 2.5203139781951904
    },
    {
        "BLOCK_SIZE_M": 64,
        "BLOCK_SIZE_N": 256,
        "BLOCK_SIZE_K": 16,
        "GROUP_SIZE_M": 8,
        "num_stages": 5,
        "num_warps": 8,
        "ms": 0.2180013209581375,
        "min_ms": 0.2180013209581375,
        "max_ms": 0.2180013209581375,
        "compile_time": 1.1912217140197754
    },
    {
        "BLOCK_SIZE_M": 64,
        "BLOCK_SIZE_N": 256,
        "BLOCK_SIZE_K": 16,
        "GROUP_SIZE_M": 8,
        "num_stages": 4,
        "num_warps": 8,
        "ms": 0.21829959750175476,
        "min_ms": 0.21829959750175476,
        "max_ms": 0.21829959750175476,
        "compile_time": 1.1511480808258057
    },
    {
        "BLOCK_SIZE_M": 256,
        "BLOCK_SIZE_N": 128,
        "BLOCK_SIZE_K": 16,
        "GROUP_SIZE_M": 8,
        "num_stages": 4,
        "num_warps": 8,
        "ms": 0.21837052702903748,
        "min_ms": 0.21837052702903748,
        "max_ms": 0.21837052702903748,
        "compile_time": 1.2076914310455322
    },
    {
        "BLOCK_SIZE_M": 256,
        "BLOCK_SIZE_N": 128,
        "BLOCK_SIZE_K": 16,
        "GROUP_SIZE_M": 8,
        "num_stages": 5,
        "num_warps": 8,
        "ms": 0.21883626282215118,
        "min_ms": 0.21883626282215118,
        "max_ms": 0.21883626282215118,
        "compile_time": 2.2449042797088623
    },
    {
        "BLOCK_SIZE_M": 128,
        "BLOCK_SIZE_N": 128,
        "BLOCK_SIZE_K": 32,
        "GROUP_SIZE_M": 8,
        "num_stages": 6,
        "num_warps": 16,
        "ms": 0.21944646537303925,
        "min_ms": 0.21944646537303925,
        "max_ms": 0.21944646537303925,
        "compile_time": 1.759584665298462
    },
    {
        "BLOCK_SIZE_M": 64,
        "BLOCK_SIZE_N": 64,
        "BLOCK_SIZE_K": 64,
        "GROUP_SIZE_M": 8,
        "num_stages": 4,
        "num_warps": 2,
        "ms": 0.22004206478595734,
        "min_ms": 0.22004206478595734,
        "max_ms": 0.22004206478595734,
        "compile_time": 2.132073163986206
    },
    {
        "BLOCK_SIZE_M": 128,
        "BLOCK_SIZE_N": 64,
        "BLOCK_SIZE_K": 32,
        "GROUP_SIZE_M": 8,
        "num_stages": 4,
        "num_warps": 8,
        "ms": 0.22039242088794708,
        "min_ms": 0.22039242088794708,
        "max_ms": 0.22039242088794708,
        "compile_time": 1.7723925113677979
    },
    {
        "BLOCK_SIZE_M": 128,
        "BLOCK_SIZE_N": 128,
        "BLOCK_SIZE_K": 32,
        "GROUP_SIZE_M": 8,
        "num_stages": 7,
        "num_warps": 16,
        "ms": 0.2205973118543625,
        "min_ms": 0.2205973118543625,
        "max_ms": 0.2205973118543625,
        "compile_time": 1.210019826889038
    },
    {
        "BLOCK_SIZE_M": 128,
        "BLOCK_SIZE_N": 128,
        "BLOCK_SIZE_K": 32,
        "GROUP_SIZE_M": 8,
        "num_stages": 3,
        "num_warps": 16,
        "ms": 0.22059807181358337,
        "min_ms": 0.22059807181358337,
        "max_ms": 0.22059807181358337,
        "compile_time": 1.1668312549591064
    },
    {
        "BLOCK_SIZE_M": 128,
        "BLOCK_SIZE_N": 64,
        "BLOCK_SIZE_K": 32,
        "GROUP_SIZE_M": 8,
        "num_stages": 5,
        "num_warps": 8,
        "ms": 0.22098283469676971,
        "min_ms": 0.22098283469676971,
        "max_ms": 0.22098283469676971,
        "compile_time": 1.797236680984497
    },
    {
        "BLOCK_SIZE_M": 64,
        "BLOCK_SIZE_N": 128,
        "BLOCK_SIZE_K": 32,
        "GROUP_SIZE_M": 8,
        "num_stages": 2,
        "num_warps": 4,
        "ms": 0.22108498215675354,
        "min_ms": 0.22108498215675354,
        "max_ms": 0.22108498215675354,
        "compile_time": 1.0865817070007324
    },
    {
        "BLOCK_SIZE_M": 64,
        "BLOCK_SIZE_N": 64,
        "BLOCK_SIZE_K": 64,
        "GROUP_SIZE_M": 8,
        "num_stages": 4,
        "num_warps": 4,
        "ms": 0.22140160202980042,
        "min_ms": 0.22140160202980042,
        "max_ms": 0.22140160202980042,
        "compile_time": 1.161637544631958
    },
    {
        "BLOCK_SIZE_M": 128,
        "BLOCK_SIZE_N": 64,
        "BLOCK_SIZE_K": 32,
        "GROUP_SIZE_M": 8,
        "num_stages": 3,
        "num_warps": 8,
        "ms": 0.2215450257062912,
        "min_ms": 0.2215450257062912,
        "max_ms": 0.2215450257062912,
        "compile_time": 1.7566945552825928
    },
    {
        "BLOCK_SIZE_M": 128,
        "BLOCK_SIZE_N": 128,
        "BLOCK_SIZE_K": 32,
        "GROUP_SIZE_M": 8,
        "num_stages": 8,
        "num_warps": 16,
        "ms": 0.2220904380083084,
        "min_ms": 0.2220904380083084,
        "max_ms": 0.2220904380083084,
        "compile_time": 1.1679253578186035
    },
    {
        "BLOCK_SIZE_M": 128,
        "BLOCK_SIZE_N": 64,
        "BLOCK_SIZE_K": 64,
        "GROUP_SIZE_M": 8,
        "num_stages": 4,
        "num_warps": 2,
        "ms": 0.22266778349876404,
        "min_ms": 0.22266778349876404,
        "max_ms": 0.22266778349876404,
        "compile_time": 2.6852571964263916
    },
    {
        "BLOCK_SIZE_M": 128,
        "BLOCK_SIZE_N": 128,
        "BLOCK_SIZE_K": 32,
        "GROUP_SIZE_M": 8,
        "num_stages": 4,
        "num_warps": 16,
        "ms": 0.22272029519081116,
        "min_ms": 0.22272029519081116,
        "max_ms": 0.22272029519081116,
        "compile_time": 1.754084825515747
    },
    {
        "BLOCK_SIZE_M": 64,
        "BLOCK_SIZE_N": 64,
        "BLOCK_SIZE_K": 32,
        "GROUP_SIZE_M": 8,
        "num_stages": 4,
        "num_warps": 4,
        "ms": 0.22275345027446747,
        "min_ms": 0.22275345027446747,
        "max_ms": 0.22275345027446747,
        "compile_time": 1.7371084690093994
    },
    {
        "BLOCK_SIZE_M": 64,
        "BLOCK_SIZE_N": 64,
        "BLOCK_SIZE_K": 64,
        "GROUP_SIZE_M": 8,
        "num_stages": 3,
        "num_warps": 4,
        "ms": 0.22285990417003632,
        "min_ms": 0.22285990417003632,
        "max_ms": 0.22285990417003632,
        "compile_time": 1.8062989711761475
    },
    {
        "BLOCK_SIZE_M": 128,
        "BLOCK_SIZE_N": 64,
        "BLOCK_SIZE_K": 64,
        "GROUP_SIZE_M": 8,
        "num_stages": 2,
        "num_warps": 8,
        "ms": 0.22297215461730957,
        "min_ms": 0.22297215461730957,
        "max_ms": 0.22297215461730957,
        "compile_time": 1.1495585441589355
    },
    {
        "BLOCK_SIZE_M": 64,
        "BLOCK_SIZE_N": 512,
        "BLOCK_SIZE_K": 16,
        "GROUP_SIZE_M": 8,
        "num_stages": 4,
        "num_warps": 16,
        "ms": 0.22310924530029297,
        "min_ms": 0.22310924530029297,
        "max_ms": 0.22310924530029297,
        "compile_time": 1.1506288051605225
    },
    {
        "BLOCK_SIZE_M": 64,
        "BLOCK_SIZE_N": 256,
        "BLOCK_SIZE_K": 16,
        "GROUP_SIZE_M": 8,
        "num_stages": 6,
        "num_warps": 8,
        "ms": 0.2231990098953247,
        "min_ms": 0.2231990098953247,
        "max_ms": 0.2231990098953247,
        "compile_time": 1.154590368270874
    },
    {
        "BLOCK_SIZE_M": 64,
        "BLOCK_SIZE_N": 64,
        "BLOCK_SIZE_K": 32,
        "GROUP_SIZE_M": 8,
        "num_stages": 7,
        "num_warps": 2,
        "ms": 0.22332265973091125,
        "min_ms": 0.22332265973091125,
        "max_ms": 0.22332265973091125,
        "compile_time": 2.0122406482696533
    },
    {
        "BLOCK_SIZE_M": 128,
        "BLOCK_SIZE_N": 128,
        "BLOCK_SIZE_K": 128,
        "GROUP_SIZE_M": 8,
        "num_stages": 2,
        "num_warps": 8,
        "ms": 0.22339949011802673,
        "min_ms": 0.22339949011802673,
        "max_ms": 0.22339949011802673,
        "compile_time": 2.171565294265747
    },
    {
        "BLOCK_SIZE_M": 64,
        "BLOCK_SIZE_N": 64,
        "BLOCK_SIZE_K": 32,
        "GROUP_SIZE_M": 8,
        "num_stages": 4,
        "num_warps": 2,
        "ms": 0.22347454726696014,
        "min_ms": 0.22347454726696014,
        "max_ms": 0.22347454726696014,
        "compile_time": 1.9383888244628906
    },
    {
        "BLOCK_SIZE_M": 64,
        "BLOCK_SIZE_N": 256,
        "BLOCK_SIZE_K": 16,
        "GROUP_SIZE_M": 8,
        "num_stages": 7,
        "num_warps": 8,
        "ms": 0.22361473739147186,
        "min_ms": 0.22361473739147186,
        "max_ms": 0.22361473739147186,
        "compile_time": 1.8441476821899414
    },
    {
        "BLOCK_SIZE_M": 64,
        "BLOCK_SIZE_N": 256,
        "BLOCK_SIZE_K": 16,
        "GROUP_SIZE_M": 8,
        "num_stages": 8,
        "num_warps": 8,
        "ms": 0.22379493713378906,
        "min_ms": 0.22379493713378906,
        "max_ms": 0.22379493713378906,
        "compile_time": 1.8234035968780518
    },
    {
        "BLOCK_SIZE_M": 512,
        "BLOCK_SIZE_N": 64,
        "BLOCK_SIZE_K": 64,
        "GROUP_SIZE_M": 8,
        "num_stages": 2,
        "num_warps": 8,
        "ms": 0.22382505238056183,
        "min_ms": 0.22382505238056183,
        "max_ms": 0.22382505238056183,
        "compile_time": 2.802171468734741
    },
    {
        "BLOCK_SIZE_M": 64,
        "BLOCK_SIZE_N": 512,
        "BLOCK_SIZE_K": 16,
        "GROUP_SIZE_M": 8,
        "num_stages": 5,
        "num_warps": 16,
        "ms": 0.2238769829273224,
        "min_ms": 0.2238769829273224,
        "max_ms": 0.2238769829273224,
        "compile_time": 1.7989914417266846
    },
    {
        "BLOCK_SIZE_M": 64,
        "BLOCK_SIZE_N": 64,
        "BLOCK_SIZE_K": 32,
        "GROUP_SIZE_M": 8,
        "num_stages": 3,
        "num_warps": 2,
        "ms": 0.22400712966918945,
        "min_ms": 0.22400712966918945,
        "max_ms": 0.22400712966918945,
        "compile_time": 1.9002625942230225
    },
    {
        "BLOCK_SIZE_M": 64,
        "BLOCK_SIZE_N": 512,
        "BLOCK_SIZE_K": 16,
        "GROUP_SIZE_M": 8,
        "num_stages": 7,
        "num_warps": 16,
        "ms": 0.22404956817626953,
        "min_ms": 0.22404956817626953,
        "max_ms": 0.22404956817626953,
        "compile_time": 1.1727371215820312
    },
    {
        "BLOCK_SIZE_M": 64,
        "BLOCK_SIZE_N": 512,
        "BLOCK_SIZE_K": 16,
        "GROUP_SIZE_M": 8,
        "num_stages": 6,
        "num_warps": 16,
        "ms": 0.2242131233215332,
        "min_ms": 0.2242131233215332,
        "max_ms": 0.2242131233215332,
        "compile_time": 1.1656949520111084
    },
    {
        "BLOCK_SIZE_M": 128,
        "BLOCK_SIZE_N": 128,
        "BLOCK_SIZE_K": 32,
        "GROUP_SIZE_M": 8,
        "num_stages": 1,
        "num_warps": 8,
        "ms": 0.22423145174980164,
        "min_ms": 0.22423145174980164,
        "max_ms": 0.22423145174980164,
        "compile_time": 1.8053390979766846
    },
    {
        "BLOCK_SIZE_M": 128,
        "BLOCK_SIZE_N": 256,
        "BLOCK_SIZE_K": 32,
        "GROUP_SIZE_M": 8,
        "num_stages": 2,
        "num_warps": 8,
        "ms": 0.22424545884132385,
        "min_ms": 0.22424545884132385,
        "max_ms": 0.22424545884132385,
        "compile_time": 2.322662115097046
    },
    {
        "BLOCK_SIZE_M": 256,
        "BLOCK_SIZE_N": 128,
        "BLOCK_SIZE_K": 16,
        "GROUP_SIZE_M": 8,
        "num_stages": 3,
        "num_warps": 8,
        "ms": 0.2242685854434967,
        "min_ms": 0.2242685854434967,
        "max_ms": 0.2242685854434967,
        "compile_time": 1.2067666053771973
    },
    {
        "BLOCK_SIZE_M": 64,
        "BLOCK_SIZE_N": 512,
        "BLOCK_SIZE_K": 16,
        "GROUP_SIZE_M": 8,
        "num_stages": 8,
        "num_warps": 16,
        "ms": 0.22439484298229218,
        "min_ms": 0.22439484298229218,
        "max_ms": 0.22439484298229218,
        "compile_time": 1.1531693935394287
    },
    {
        "BLOCK_SIZE_M": 64,
        "BLOCK_SIZE_N": 128,
        "BLOCK_SIZE_K": 32,
        "GROUP_SIZE_M": 8,
        "num_stages": 8,
        "num_warps": 8,
        "ms": 0.22456026077270508,
        "min_ms": 0.22456026077270508,
        "max_ms": 0.22456026077270508,
        "compile_time": 1.1502492427825928
    },
    {
        "BLOCK_SIZE_M": 64,
        "BLOCK_SIZE_N": 64,
        "BLOCK_SIZE_K": 32,
        "GROUP_SIZE_M": 8,
        "num_stages": 3,
        "num_warps": 4,
        "ms": 0.22495660185813904,
        "min_ms": 0.22495660185813904,
        "max_ms": 0.22495660185813904,
        "compile_time": 1.1571731567382812
    },
    {
        "BLOCK_SIZE_M": 64,
        "BLOCK_SIZE_N": 64,
        "BLOCK_SIZE_K": 32,
        "GROUP_SIZE_M": 8,
        "num_stages": 5,
        "num_warps": 2,
        "ms": 0.22538527846336365,
        "min_ms": 0.22538527846336365,
        "max_ms": 0.22538527846336365,
        "compile_time": 1.9490118026733398
    },
    {
        "BLOCK_SIZE_M": 64,
        "BLOCK_SIZE_N": 64,
        "BLOCK_SIZE_K": 32,
        "GROUP_SIZE_M": 8,
        "num_stages": 6,
        "num_warps": 2,
        "ms": 0.22571846842765808,
        "min_ms": 0.22571846842765808,
        "max_ms": 0.22571846842765808,
        "compile_time": 1.9959478378295898
    },
    {
        "BLOCK_SIZE_M": 64,
        "BLOCK_SIZE_N": 64,
        "BLOCK_SIZE_K": 64,
        "GROUP_SIZE_M": 8,
        "num_stages": 3,
        "num_warps": 2,
        "ms": 0.225995734333992,
        "min_ms": 0.225995734333992,
        "max_ms": 0.225995734333992,
        "compile_time": 2.06394100189209
    },
    {
        "BLOCK_SIZE_M": 64,
        "BLOCK_SIZE_N": 512,
        "BLOCK_SIZE_K": 16,
        "GROUP_SIZE_M": 8,
        "num_stages": 3,
        "num_warps": 16,
        "ms": 0.22601673007011414,
        "min_ms": 0.22601673007011414,
        "max_ms": 0.22601673007011414,
        "compile_time": 1.1481897830963135
    },
    {
        "BLOCK_SIZE_M": 64,
        "BLOCK_SIZE_N": 64,
        "BLOCK_SIZE_K": 32,
        "GROUP_SIZE_M": 8,
        "num_stages": 5,
        "num_warps": 4,
        "ms": 0.2262585461139679,
        "min_ms": 0.2262585461139679,
        "max_ms": 0.2262585461139679,
        "compile_time": 1.7445969581604004
    },
    {
        "BLOCK_SIZE_M": 256,
        "BLOCK_SIZE_N": 128,
        "BLOCK_SIZE_K": 64,
        "GROUP_SIZE_M": 8,
        "num_stages": 2,
        "num_warps": 16,
        "ms": 0.22637681663036346,
        "min_ms": 0.22637681663036346,
        "max_ms": 0.22637681663036346,
        "compile_time": 2.153456926345825
    },
    {
        "BLOCK_SIZE_M": 64,
        "BLOCK_SIZE_N": 64,
        "BLOCK_SIZE_K": 64,
        "GROUP_SIZE_M": 8,
        "num_stages": 5,
        "num_warps": 4,
        "ms": 0.22714731097221375,
        "min_ms": 0.22714731097221375,
        "max_ms": 0.22714731097221375,
        "compile_time": 1.8620779514312744
    },
    {
        "BLOCK_SIZE_M": 64,
        "BLOCK_SIZE_N": 64,
        "BLOCK_SIZE_K": 32,
        "GROUP_SIZE_M": 8,
        "num_stages": 6,
        "num_warps": 4,
        "ms": 0.22749683260917664,
        "min_ms": 0.22749683260917664,
        "max_ms": 0.22749683260917664,
        "compile_time": 1.1702656745910645
    },
    {
        "BLOCK_SIZE_M": 256,
        "BLOCK_SIZE_N": 128,
        "BLOCK_SIZE_K": 32,
        "GROUP_SIZE_M": 8,
        "num_stages": 2,
        "num_warps": 8,
        "ms": 0.22794070839881897,
        "min_ms": 0.22794070839881897,
        "max_ms": 0.22794070839881897,
        "compile_time": 2.3748221397399902
    },
    {
        "BLOCK_SIZE_M": 64,
        "BLOCK_SIZE_N": 64,
        "BLOCK_SIZE_K": 64,
        "GROUP_SIZE_M": 8,
        "num_stages": 6,
        "num_warps": 4,
        "ms": 0.227986142039299,
        "min_ms": 0.227986142039299,
        "max_ms": 0.227986142039299,
        "compile_time": 1.8864526748657227
    },
    {
        "BLOCK_SIZE_M": 64,
        "BLOCK_SIZE_N": 512,
        "BLOCK_SIZE_K": 32,
        "GROUP_SIZE_M": 8,
        "num_stages": 3,
        "num_warps": 16,
        "ms": 0.2288820445537567,
        "min_ms": 0.2288820445537567,
        "max_ms": 0.2288820445537567,
        "compile_time": 1.1432225704193115
    },
    {
        "BLOCK_SIZE_M": 64,
        "BLOCK_SIZE_N": 64,
        "BLOCK_SIZE_K": 32,
        "GROUP_SIZE_M": 8,
        "num_stages": 7,
        "num_warps": 4,
        "ms": 0.2291516363620758,
        "min_ms": 0.2291516363620758,
        "max_ms": 0.2291516363620758,
        "compile_time": 1.158933401107788
    },
    {
        "BLOCK_SIZE_M": 128,
        "BLOCK_SIZE_N": 64,
        "BLOCK_SIZE_K": 32,
        "GROUP_SIZE_M": 8,
        "num_stages": 2,
        "num_warps": 4,
        "ms": 0.22918248176574707,
        "min_ms": 0.22918248176574707,
        "max_ms": 0.22918248176574707,
        "compile_time": 1.8764550685882568
    },
    {
        "BLOCK_SIZE_M": 64,
        "BLOCK_SIZE_N": 64,
        "BLOCK_SIZE_K": 64,
        "GROUP_SIZE_M": 8,
        "num_stages": 5,
        "num_warps": 2,
        "ms": 0.22938692569732666,
        "min_ms": 0.22938692569732666,
        "max_ms": 0.22938692569732666,
        "compile_time": 2.2038519382476807
    },
    {
        "BLOCK_SIZE_M": 64,
        "BLOCK_SIZE_N": 512,
        "BLOCK_SIZE_K": 32,
        "GROUP_SIZE_M": 8,
        "num_stages": 4,
        "num_warps": 16,
        "ms": 0.23019687831401825,
        "min_ms": 0.23019687831401825,
        "max_ms": 0.23019687831401825,
        "compile_time": 1.147202968597412
    },
    {
        "BLOCK_SIZE_M": 64,
        "BLOCK_SIZE_N": 64,
        "BLOCK_SIZE_K": 128,
        "GROUP_SIZE_M": 8,
        "num_stages": 2,
        "num_warps": 4,
        "ms": 0.23106229305267334,
        "min_ms": 0.23106229305267334,
        "max_ms": 0.23106229305267334,
        "compile_time": 1.984013319015503
    },
    {
        "BLOCK_SIZE_M": 64,
        "BLOCK_SIZE_N": 256,
        "BLOCK_SIZE_K": 32,
        "GROUP_SIZE_M": 8,
        "num_stages": 3,
        "num_warps": 16,
        "ms": 0.2318211793899536,
        "min_ms": 0.2318211793899536,
        "max_ms": 0.2318211793899536,
        "compile_time": 1.691631555557251
    },
    {
        "BLOCK_SIZE_M": 64,
        "BLOCK_SIZE_N": 512,
        "BLOCK_SIZE_K": 32,
        "GROUP_SIZE_M": 8,
        "num_stages": 5,
        "num_warps": 16,
        "ms": 0.23194129765033722,
        "min_ms": 0.23194129765033722,
        "max_ms": 0.23194129765033722,
        "compile_time": 1.1571011543273926
    },
    {
        "BLOCK_SIZE_M": 64,
        "BLOCK_SIZE_N": 512,
        "BLOCK_SIZE_K": 32,
        "GROUP_SIZE_M": 8,
        "num_stages": 2,
        "num_warps": 8,
        "ms": 0.23195752501487732,
        "min_ms": 0.23195752501487732,
        "max_ms": 0.23195752501487732,
        "compile_time": 2.26935076713562
    },
    {
        "BLOCK_SIZE_M": 128,
        "BLOCK_SIZE_N": 64,
        "BLOCK_SIZE_K": 32,
        "GROUP_SIZE_M": 8,
        "num_stages": 8,
        "num_warps": 8,
        "ms": 0.232267826795578,
        "min_ms": 0.232267826795578,
        "max_ms": 0.232267826795578,
        "compile_time": 1.189178228378296
    },
    {
        "BLOCK_SIZE_M": 64,
        "BLOCK_SIZE_N": 256,
        "BLOCK_SIZE_K": 32,
        "GROUP_SIZE_M": 8,
        "num_stages": 4,
        "num_warps": 16,
        "ms": 0.23230397701263428,
        "min_ms": 0.23230397701263428,
        "max_ms": 0.23230397701263428,
        "compile_time": 1.7108182907104492
    },
    {
        "BLOCK_SIZE_M": 64,
        "BLOCK_SIZE_N": 256,
        "BLOCK_SIZE_K": 32,
        "GROUP_SIZE_M": 8,
        "num_stages": 5,
        "num_warps": 16,
        "ms": 0.23259946703910828,
        "min_ms": 0.23259946703910828,
        "max_ms": 0.23259946703910828,
        "compile_time": 1.1369295120239258
    },
    {
        "BLOCK_SIZE_M": 64,
        "BLOCK_SIZE_N": 64,
        "BLOCK_SIZE_K": 64,
        "GROUP_SIZE_M": 8,
        "num_stages": 6,
        "num_warps": 2,
        "ms": 0.2330026924610138,
        "min_ms": 0.2330026924610138,
        "max_ms": 0.2330026924610138,
        "compile_time": 2.2678990364074707
    },
    {
        "BLOCK_SIZE_M": 64,
        "BLOCK_SIZE_N": 256,
        "BLOCK_SIZE_K": 32,
        "GROUP_SIZE_M": 8,
        "num_stages": 6,
        "num_warps": 16,
        "ms": 0.2331109344959259,
        "min_ms": 0.2331109344959259,
        "max_ms": 0.2331109344959259,
        "compile_time": 1.138892412185669
    },
    {
        "BLOCK_SIZE_M": 64,
        "BLOCK_SIZE_N": 64,
        "BLOCK_SIZE_K": 32,
        "GROUP_SIZE_M": 8,
        "num_stages": 8,
        "num_warps": 2,
        "ms": 0.23323819041252136,
        "min_ms": 0.23323819041252136,
        "max_ms": 0.23323819041252136,
        "compile_time": 2.0224969387054443
    },
    {
        "BLOCK_SIZE_M": 64,
        "BLOCK_SIZE_N": 256,
        "BLOCK_SIZE_K": 32,
        "GROUP_SIZE_M": 8,
        "num_stages": 7,
        "num_warps": 16,
        "ms": 0.23354344069957733,
        "min_ms": 0.23354344069957733,
        "max_ms": 0.23354344069957733,
        "compile_time": 1.141554832458496
    },
    {
        "BLOCK_SIZE_M": 128,
        "BLOCK_SIZE_N": 128,
        "BLOCK_SIZE_K": 128,
        "GROUP_SIZE_M": 8,
        "num_stages": 1,
        "num_warps": 4,
        "ms": 0.2337549477815628,
        "min_ms": 0.2337549477815628,
        "max_ms": 0.2337549477815628,
        "compile_time": 2.7743778228759766
    },
    {
        "BLOCK_SIZE_M": 64,
        "BLOCK_SIZE_N": 256,
        "BLOCK_SIZE_K": 32,
        "GROUP_SIZE_M": 8,
        "num_stages": 8,
        "num_warps": 16,
        "ms": 0.2346327304840088,
        "min_ms": 0.2346327304840088,
        "max_ms": 0.2346327304840088,
        "compile_time": 1.1513090133666992
    },
    {
        "BLOCK_SIZE_M": 128,
        "BLOCK_SIZE_N": 256,
        "BLOCK_SIZE_K": 128,
        "GROUP_SIZE_M": 8,
        "num_stages": 2,
        "num_warps": 8,
        "ms": 0.23533418774604797,
        "min_ms": 0.23533418774604797,
        "max_ms": 0.23533418774604797,
        "compile_time": 2.815897226333618
    },
    {
        "BLOCK_SIZE_M": 128,
        "BLOCK_SIZE_N": 64,
        "BLOCK_SIZE_K": 16,
        "GROUP_SIZE_M": 8,
        "num_stages": 7,
        "num_warps": 4,
        "ms": 0.23554682731628418,
        "min_ms": 0.23554682731628418,
        "max_ms": 0.23554682731628418,
        "compile_time": 1.883568286895752
    },
    {
        "BLOCK_SIZE_M": 64,
        "BLOCK_SIZE_N": 64,
        "BLOCK_SIZE_K": 64,
        "GROUP_SIZE_M": 8,
        "num_stages": 7,
        "num_warps": 4,
        "ms": 0.23591427505016327,
        "min_ms": 0.23591427505016327,
        "max_ms": 0.23591427505016327,
        "compile_time": 1.9378790855407715
    },
    {
        "BLOCK_SIZE_M": 128,
        "BLOCK_SIZE_N": 64,
        "BLOCK_SIZE_K": 32,
        "GROUP_SIZE_M": 8,
        "num_stages": 1,
        "num_warps": 2,
        "ms": 0.23593536019325256,
        "min_ms": 0.23593536019325256,
        "max_ms": 0.23593536019325256,
        "compile_time": 2.1875369548797607
    },
    {
        "BLOCK_SIZE_M": 256,
        "BLOCK_SIZE_N": 64,
        "BLOCK_SIZE_K": 32,
        "GROUP_SIZE_M": 8,
        "num_stages": 4,
        "num_warps": 16,
        "ms": 0.23718015849590302,
        "min_ms": 0.23718015849590302,
        "max_ms": 0.23718015849590302,
        "compile_time": 1.2291028499603271
    },
    {
        "BLOCK_SIZE_M": 256,
        "BLOCK_SIZE_N": 128,
        "BLOCK_SIZE_K": 128,
        "GROUP_SIZE_M": 8,
        "num_stages": 2,
        "num_warps": 16,
        "ms": 0.2372310906648636,
        "min_ms": 0.2372310906648636,
        "max_ms": 0.2372310906648636,
        "compile_time": 2.2699549198150635
    },
    {
        "BLOCK_SIZE_M": 128,
        "BLOCK_SIZE_N": 64,
        "BLOCK_SIZE_K": 16,
        "GROUP_SIZE_M": 8,
        "num_stages": 6,
        "num_warps": 4,
        "ms": 0.23756298422813416,
        "min_ms": 0.23756298422813416,
        "max_ms": 0.23756298422813416,
        "compile_time": 1.8658149242401123
    },
    {
        "BLOCK_SIZE_M": 64,
        "BLOCK_SIZE_N": 64,
        "BLOCK_SIZE_K": 32,
        "GROUP_SIZE_M": 8,
        "num_stages": 2,
        "num_warps": 2,
        "ms": 0.23764356970787048,
        "min_ms": 0.23764356970787048,
        "max_ms": 0.23764356970787048,
        "compile_time": 1.814408540725708
    },
    {
        "BLOCK_SIZE_M": 64,
        "BLOCK_SIZE_N": 64,
        "BLOCK_SIZE_K": 128,
        "GROUP_SIZE_M": 8,
        "num_stages": 3,
        "num_warps": 4,
        "ms": 0.23766560852527618,
        "min_ms": 0.23766560852527618,
        "max_ms": 0.23766560852527618,
        "compile_time": 2.054222345352173
    },
    {
        "BLOCK_SIZE_M": 64,
        "BLOCK_SIZE_N": 64,
        "BLOCK_SIZE_K": 128,
        "GROUP_SIZE_M": 8,
        "num_stages": 2,
        "num_warps": 2,
        "ms": 0.2377893030643463,
        "min_ms": 0.2377893030643463,
        "max_ms": 0.2377893030643463,
        "compile_time": 2.433838129043579
    },
    {
        "BLOCK_SIZE_M": 128,
        "BLOCK_SIZE_N": 256,
        "BLOCK_SIZE_K": 64,
        "GROUP_SIZE_M": 8,
        "num_stages": 2,
        "num_warps": 16,
        "ms": 0.23802801966667175,
        "min_ms": 0.23802801966667175,
        "max_ms": 0.23802801966667175,
        "compile_time": 1.1299986839294434
    },
    {
        "BLOCK_SIZE_M": 256,
        "BLOCK_SIZE_N": 64,
        "BLOCK_SIZE_K": 16,
        "GROUP_SIZE_M": 8,
        "num_stages": 6,
        "num_warps": 4,
        "ms": 0.23817090690135956,
        "min_ms": 0.23817090690135956,
        "max_ms": 0.23817090690135956,
        "compile_time": 2.3217923641204834
    },
    {
        "BLOCK_SIZE_M": 64,
        "BLOCK_SIZE_N": 64,
        "BLOCK_SIZE_K": 64,
        "GROUP_SIZE_M": 8,
        "num_stages": 2,
        "num_warps": 4,
        "ms": 0.23836293816566467,
        "min_ms": 0.23836293816566467,
        "max_ms": 0.23836293816566467,
        "compile_time": 1.7533621788024902
    },
    {
        "BLOCK_SIZE_M": 64,
        "BLOCK_SIZE_N": 64,
        "BLOCK_SIZE_K": 64,
        "GROUP_SIZE_M": 8,
        "num_stages": 8,
        "num_warps": 4,
        "ms": 0.23846682906150818,
        "min_ms": 0.23846682906150818,
        "max_ms": 0.23846682906150818,
        "compile_time": 1.9873101711273193
    },
    {
        "BLOCK_SIZE_M": 64,
        "BLOCK_SIZE_N": 64,
        "BLOCK_SIZE_K": 32,
        "GROUP_SIZE_M": 8,
        "num_stages": 8,
        "num_warps": 4,
        "ms": 0.2386002540588379,
        "min_ms": 0.2386002540588379,
        "max_ms": 0.2386002540588379,
        "compile_time": 1.1629443168640137
    },
    {
        "BLOCK_SIZE_M": 256,
        "BLOCK_SIZE_N": 64,
        "BLOCK_SIZE_K": 16,
        "GROUP_SIZE_M": 8,
        "num_stages": 7,
        "num_warps": 4,
        "ms": 0.23885789513587952,
        "min_ms": 0.23885789513587952,
        "max_ms": 0.23885789513587952,
        "compile_time": 2.3075380325317383
    },
    {
        "BLOCK_SIZE_M": 128,
        "BLOCK_SIZE_N": 128,
        "BLOCK_SIZE_K": 32,
        "GROUP_SIZE_M": 8,
        "num_stages": 1,
        "num_warps": 4,
        "ms": 0.23929600417613983,
        "min_ms": 0.23929600417613983,
        "max_ms": 0.23929600417613983,
        "compile_time": 2.1731719970703125
    },
    {
        "BLOCK_SIZE_M": 256,
        "BLOCK_SIZE_N": 64,
        "BLOCK_SIZE_K": 16,
        "GROUP_SIZE_M": 8,
        "num_stages": 8,
        "num_warps": 4,
        "ms": 0.23984035849571228,
        "min_ms": 0.23984035849571228,
        "max_ms": 0.23984035849571228,
        "compile_time": 2.345715045928955
    },
    {
        "BLOCK_SIZE_M": 128,
        "BLOCK_SIZE_N": 128,
        "BLOCK_SIZE_K": 128,
        "GROUP_SIZE_M": 8,
        "num_stages": 2,
        "num_warps": 16,
        "ms": 0.2399120032787323,
        "min_ms": 0.2399120032787323,
        "max_ms": 0.2399120032787323,
        "compile_time": 1.9473700523376465
    },
    {
        "BLOCK_SIZE_M": 256,
        "BLOCK_SIZE_N": 64,
        "BLOCK_SIZE_K": 32,
        "GROUP_SIZE_M": 8,
        "num_stages": 7,
        "num_warps": 16,
        "ms": 0.24007491767406464,
        "min_ms": 0.24007491767406464,
        "max_ms": 0.24007491767406464,
        "compile_time": 1.925445556640625
    },
    {
        "BLOCK_SIZE_M": 256,
        "BLOCK_SIZE_N": 64,
        "BLOCK_SIZE_K": 32,
        "GROUP_SIZE_M": 8,
        "num_stages": 6,
        "num_warps": 16,
        "ms": 0.24019618332386017,
        "min_ms": 0.24019618332386017,
        "max_ms": 0.24019618332386017,
        "compile_time": 1.9015426635742188
    },
    {
        "BLOCK_SIZE_M": 128,
        "BLOCK_SIZE_N": 64,
        "BLOCK_SIZE_K": 16,
        "GROUP_SIZE_M": 8,
        "num_stages": 4,
        "num_warps": 4,
        "ms": 0.24024128913879395,
        "min_ms": 0.24024128913879395,
        "max_ms": 0.24024128913879395,
        "compile_time": 1.832313060760498
    },
    {
        "BLOCK_SIZE_M": 256,
        "BLOCK_SIZE_N": 64,
        "BLOCK_SIZE_K": 32,
        "GROUP_SIZE_M": 8,
        "num_stages": 8,
        "num_warps": 16,
        "ms": 0.24045011401176453,
        "min_ms": 0.24045011401176453,
        "max_ms": 0.24045011401176453,
        "compile_time": 1.9305610656738281
    },
    {
        "BLOCK_SIZE_M": 128,
        "BLOCK_SIZE_N": 128,
        "BLOCK_SIZE_K": 64,
        "GROUP_SIZE_M": 8,
        "num_stages": 2,
        "num_warps": 8,
        "ms": 0.24069444835186005,
        "min_ms": 0.24069444835186005,
        "max_ms": 0.24069444835186005,
        "compile_time": 2.0928547382354736
    },
    {
        "BLOCK_SIZE_M": 64,
        "BLOCK_SIZE_N": 64,
        "BLOCK_SIZE_K": 128,
        "GROUP_SIZE_M": 8,
        "num_stages": 5,
        "num_warps": 4,
        "ms": 0.24099484086036682,
        "min_ms": 0.24099484086036682,
        "max_ms": 0.24099484086036682,
        "compile_time": 2.174482822418213
    },
    {
        "BLOCK_SIZE_M": 64,
        "BLOCK_SIZE_N": 64,
        "BLOCK_SIZE_K": 32,
        "GROUP_SIZE_M": 8,
        "num_stages": 2,
        "num_warps": 4,
        "ms": 0.24099913239479065,
        "min_ms": 0.24099913239479065,
        "max_ms": 0.24099913239479065,
        "compile_time": 1.649827241897583
    },
    {
        "BLOCK_SIZE_M": 64,
        "BLOCK_SIZE_N": 256,
        "BLOCK_SIZE_K": 32,
        "GROUP_SIZE_M": 8,
        "num_stages": 1,
        "num_warps": 8,
        "ms": 0.24110572040081024,
        "min_ms": 0.24110572040081024,
        "max_ms": 0.24110572040081024,
        "compile_time": 1.0906221866607666
    },
    {
        "BLOCK_SIZE_M": 128,
        "BLOCK_SIZE_N": 64,
        "BLOCK_SIZE_K": 16,
        "GROUP_SIZE_M": 8,
        "num_stages": 5,
        "num_warps": 4,
        "ms": 0.24124190211296082,
        "min_ms": 0.24124190211296082,
        "max_ms": 0.24124190211296082,
        "compile_time": 1.8592987060546875
    },
    {
        "BLOCK_SIZE_M": 64,
        "BLOCK_SIZE_N": 64,
        "BLOCK_SIZE_K": 128,
        "GROUP_SIZE_M": 8,
        "num_stages": 4,
        "num_warps": 4,
        "ms": 0.2412521094083786,
        "min_ms": 0.2412521094083786,
        "max_ms": 0.2412521094083786,
        "compile_time": 2.120701313018799
    },
    {
        "BLOCK_SIZE_M": 256,
        "BLOCK_SIZE_N": 64,
        "BLOCK_SIZE_K": 32,
        "GROUP_SIZE_M": 8,
        "num_stages": 3,
        "num_warps": 16,
        "ms": 0.2414487600326538,
        "min_ms": 0.2414487600326538,
        "max_ms": 0.2414487600326538,
        "compile_time": 1.2096891403198242
    },
    {
        "BLOCK_SIZE_M": 256,
        "BLOCK_SIZE_N": 64,
        "BLOCK_SIZE_K": 16,
        "GROUP_SIZE_M": 8,
        "num_stages": 4,
        "num_warps": 4,
        "ms": 0.2416568249464035,
        "min_ms": 0.2416568249464035,
        "max_ms": 0.2416568249464035,
        "compile_time": 2.3006627559661865
    },
    {
        "BLOCK_SIZE_M": 512,
        "BLOCK_SIZE_N": 64,
        "BLOCK_SIZE_K": 64,
        "GROUP_SIZE_M": 8,
        "num_stages": 3,
        "num_warps": 16,
        "ms": 0.2418966293334961,
        "min_ms": 0.2418966293334961,
        "max_ms": 0.2418966293334961,
        "compile_time": 2.379909038543701
    },
    {
        "BLOCK_SIZE_M": 256,
        "BLOCK_SIZE_N": 64,
        "BLOCK_SIZE_K": 32,
        "GROUP_SIZE_M": 8,
        "num_stages": 5,
        "num_warps": 16,
        "ms": 0.24207301437854767,
        "min_ms": 0.24207301437854767,
        "max_ms": 0.24207301437854767,
        "compile_time": 1.2182159423828125
    },
    {
        "BLOCK_SIZE_M": 256,
        "BLOCK_SIZE_N": 64,
        "BLOCK_SIZE_K": 16,
        "GROUP_SIZE_M": 8,
        "num_stages": 5,
        "num_warps": 4,
        "ms": 0.2424890249967575,
        "min_ms": 0.2424890249967575,
        "max_ms": 0.2424890249967575,
        "compile_time": 2.3117005825042725
    },
    {
        "BLOCK_SIZE_M": 128,
        "BLOCK_SIZE_N": 64,
        "BLOCK_SIZE_K": 64,
        "GROUP_SIZE_M": 8,
        "num_stages": 1,
        "num_warps": 2,
        "ms": 0.24267049133777618,
        "min_ms": 0.24267049133777618,
        "max_ms": 0.24267049133777618,
        "compile_time": 2.43232798576355
    },
    {
        "BLOCK_SIZE_M": 256,
        "BLOCK_SIZE_N": 64,
        "BLOCK_SIZE_K": 16,
        "GROUP_SIZE_M": 8,
        "num_stages": 3,
        "num_warps": 4,
        "ms": 0.24275895953178406,
        "min_ms": 0.24275895953178406,
        "max_ms": 0.24275895953178406,
        "compile_time": 2.248333215713501
    },
    {
        "BLOCK_SIZE_M": 128,
        "BLOCK_SIZE_N": 128,
        "BLOCK_SIZE_K": 64,
        "GROUP_SIZE_M": 8,
        "num_stages": 1,
        "num_warps": 4,
        "ms": 0.2428516149520874,
        "min_ms": 0.2428516149520874,
        "max_ms": 0.2428516149520874,
        "compile_time": 2.3092432022094727
    },
    {
        "BLOCK_SIZE_M": 256,
        "BLOCK_SIZE_N": 128,
        "BLOCK_SIZE_K": 64,
        "GROUP_SIZE_M": 8,
        "num_stages": 1,
        "num_warps": 16,
        "ms": 0.24303194880485535,
        "min_ms": 0.24303194880485535,
        "max_ms": 0.24303194880485535,
        "compile_time": 1.9760570526123047
    },
    {
        "BLOCK_SIZE_M": 128,
        "BLOCK_SIZE_N": 64,
        "BLOCK_SIZE_K": 16,
        "GROUP_SIZE_M": 8,
        "num_stages": 3,
        "num_warps": 4,
        "ms": 0.24319739639759064,
        "min_ms": 0.24319739639759064,
        "max_ms": 0.24319739639759064,
        "compile_time": 1.8171679973602295
    },
    {
        "BLOCK_SIZE_M": 256,
        "BLOCK_SIZE_N": 128,
        "BLOCK_SIZE_K": 64,
        "GROUP_SIZE_M": 8,
        "num_stages": 1,
        "num_warps": 8,
        "ms": 0.24414131045341492,
        "min_ms": 0.24414131045341492,
        "max_ms": 0.24414131045341492,
        "compile_time": 2.3796639442443848
    },
    {
        "BLOCK_SIZE_M": 256,
        "BLOCK_SIZE_N": 64,
        "BLOCK_SIZE_K": 16,
        "GROUP_SIZE_M": 8,
        "num_stages": 3,
        "num_warps": 8,
        "ms": 0.24438515305519104,
        "min_ms": 0.24438515305519104,
        "max_ms": 0.24438515305519104,
        "compile_time": 1.9103219509124756
    },
    {
        "BLOCK_SIZE_M": 32,
        "BLOCK_SIZE_N": 512,
        "BLOCK_SIZE_K": 32,
        "GROUP_SIZE_M": 8,
        "num_stages": 5,
        "num_warps": 8,
        "ms": 0.24446682631969452,
        "min_ms": 0.24446682631969452,
        "max_ms": 0.24446682631969452,
        "compile_time": 1.9396109580993652
    },
    {
        "BLOCK_SIZE_M": 128,
        "BLOCK_SIZE_N": 256,
        "BLOCK_SIZE_K": 16,
        "GROUP_SIZE_M": 8,
        "num_stages": 5,
        "num_warps": 16,
        "ms": 0.24461300671100616,
        "min_ms": 0.24461300671100616,
        "max_ms": 0.24461300671100616,
        "compile_time": 1.8477449417114258
    },
    {
        "BLOCK_SIZE_M": 32,
        "BLOCK_SIZE_N": 512,
        "BLOCK_SIZE_K": 16,
        "GROUP_SIZE_M": 8,
        "num_stages": 5,
        "num_warps": 4,
        "ms": 0.24477973580360413,
        "min_ms": 0.24477973580360413,
        "max_ms": 0.24477973580360413,
        "compile_time": 2.193871021270752
    },
    {
        "BLOCK_SIZE_M": 256,
        "BLOCK_SIZE_N": 64,
        "BLOCK_SIZE_K": 32,
        "GROUP_SIZE_M": 8,
        "num_stages": 1,
        "num_warps": 8,
        "ms": 0.24504497647285461,
        "min_ms": 0.24504497647285461,
        "max_ms": 0.24504497647285461,
        "compile_time": 1.9326817989349365
    },
    {
        "BLOCK_SIZE_M": 64,
        "BLOCK_SIZE_N": 64,
        "BLOCK_SIZE_K": 128,
        "GROUP_SIZE_M": 8,
        "num_stages": 6,
        "num_warps": 4,
        "ms": 0.2451332062482834,
        "min_ms": 0.2451332062482834,
        "max_ms": 0.2451332062482834,
        "compile_time": 2.213740825653076
    },
    {
        "BLOCK_SIZE_M": 128,
        "BLOCK_SIZE_N": 64,
        "BLOCK_SIZE_K": 16,
        "GROUP_SIZE_M": 8,
        "num_stages": 3,
        "num_warps": 2,
        "ms": 0.24579569697380066,
        "min_ms": 0.24579569697380066,
        "max_ms": 0.24579569697380066,
        "compile_time": 2.1483683586120605
    },
    {
        "BLOCK_SIZE_M": 128,
        "BLOCK_SIZE_N": 256,
        "BLOCK_SIZE_K": 16,
        "GROUP_SIZE_M": 8,
        "num_stages": 3,
        "num_warps": 16,
        "ms": 0.24596071243286133,
        "min_ms": 0.24596071243286133,
        "max_ms": 0.24596071243286133,
        "compile_time": 1.2251484394073486
    },
    {
        "BLOCK_SIZE_M": 128,
        "BLOCK_SIZE_N": 64,
        "BLOCK_SIZE_K": 16,
        "GROUP_SIZE_M": 8,
        "num_stages": 4,
        "num_warps": 2,
        "ms": 0.2465043067932129,
        "min_ms": 0.2465043067932129,
        "max_ms": 0.2465043067932129,
        "compile_time": 2.177638292312622
    },
    {
        "BLOCK_SIZE_M": 128,
        "BLOCK_SIZE_N": 64,
        "BLOCK_SIZE_K": 16,
        "GROUP_SIZE_M": 8,
        "num_stages": 5,
        "num_warps": 2,
        "ms": 0.24668335914611816,
        "min_ms": 0.24668335914611816,
        "max_ms": 0.24668335914611816,
        "compile_time": 2.1808948516845703
    },
    {
        "BLOCK_SIZE_M": 128,
        "BLOCK_SIZE_N": 256,
        "BLOCK_SIZE_K": 128,
        "GROUP_SIZE_M": 8,
        "num_stages": 1,
        "num_warps": 16,
        "ms": 0.24669389426708221,
        "min_ms": 0.24669389426708221,
        "max_ms": 0.24669389426708221,
        "compile_time": 2.0725491046905518
    },
    {
        "BLOCK_SIZE_M": 32,
        "BLOCK_SIZE_N": 256,
        "BLOCK_SIZE_K": 16,
        "GROUP_SIZE_M": 8,
        "num_stages": 5,
        "num_warps": 2,
        "ms": 0.24683403968811035,
        "min_ms": 0.24683403968811035,
        "max_ms": 0.24683403968811035,
        "compile_time": 2.146085023880005
    },
    {
        "BLOCK_SIZE_M": 64,
        "BLOCK_SIZE_N": 64,
        "BLOCK_SIZE_K": 128,
        "GROUP_SIZE_M": 8,
        "num_stages": 3,
        "num_warps": 8,
        "ms": 0.2473112791776657,
        "min_ms": 0.2473112791776657,
        "max_ms": 0.2473112791776657,
        "compile_time": 1.1852893829345703
    },
    {
        "BLOCK_SIZE_M": 32,
        "BLOCK_SIZE_N": 512,
        "BLOCK_SIZE_K": 16,
        "GROUP_SIZE_M": 8,
        "num_stages": 4,
        "num_warps": 4,
        "ms": 0.24736957252025604,
        "min_ms": 0.24736957252025604,
        "max_ms": 0.24736957252025604,
        "compile_time": 2.1389076709747314
    },
    {
        "BLOCK_SIZE_M": 128,
        "BLOCK_SIZE_N": 64,
        "BLOCK_SIZE_K": 16,
        "GROUP_SIZE_M": 8,
        "num_stages": 7,
        "num_warps": 2,
        "ms": 0.24751678109169006,
        "min_ms": 0.24751678109169006,
        "max_ms": 0.24751678109169006,
        "compile_time": 2.230210304260254
    },
    {
        "BLOCK_SIZE_M": 128,
        "BLOCK_SIZE_N": 64,
        "BLOCK_SIZE_K": 16,
        "GROUP_SIZE_M": 8,
        "num_stages": 6,
        "num_warps": 2,
        "ms": 0.24757547676563263,
        "min_ms": 0.24757547676563263,
        "max_ms": 0.24757547676563263,
        "compile_time": 2.21146559715271
    },
    {
        "BLOCK_SIZE_M": 256,
        "BLOCK_SIZE_N": 128,
        "BLOCK_SIZE_K": 16,
        "GROUP_SIZE_M": 8,
        "num_stages": 5,
        "num_warps": 16,
        "ms": 0.2476685345172882,
        "min_ms": 0.2476685345172882,
        "max_ms": 0.2476685345172882,
        "compile_time": 1.2295842170715332
    },
    {
        "BLOCK_SIZE_M": 32,
        "BLOCK_SIZE_N": 256,
        "BLOCK_SIZE_K": 32,
        "GROUP_SIZE_M": 8,
        "num_stages": 5,
        "num_warps": 4,
        "ms": 0.24769744277000427,
        "min_ms": 0.24769744277000427,
        "max_ms": 0.24769744277000427,
        "compile_time": 1.9269821643829346
    },
    {
        "BLOCK_SIZE_M": 64,
        "BLOCK_SIZE_N": 64,
        "BLOCK_SIZE_K": 64,
        "GROUP_SIZE_M": 8,
        "num_stages": 3,
        "num_warps": 8,
        "ms": 0.24787549674510956,
        "min_ms": 0.24787549674510956,
        "max_ms": 0.24787549674510956,
        "compile_time": 1.1593914031982422
    },
    {
        "BLOCK_SIZE_M": 256,
        "BLOCK_SIZE_N": 128,
        "BLOCK_SIZE_K": 16,
        "GROUP_SIZE_M": 8,
        "num_stages": 3,
        "num_warps": 16,
        "ms": 0.24792790412902832,
        "min_ms": 0.24792790412902832,
        "max_ms": 0.24792790412902832,
        "compile_time": 1.2196955680847168
    },
    {
        "BLOCK_SIZE_M": 256,
        "BLOCK_SIZE_N": 64,
        "BLOCK_SIZE_K": 16,
        "GROUP_SIZE_M": 8,
        "num_stages": 4,
        "num_warps": 8,
        "ms": 0.24805104732513428,
        "min_ms": 0.24805104732513428,
        "max_ms": 0.24805104732513428,
        "compile_time": 1.992581844329834
    },
    {
        "BLOCK_SIZE_M": 128,
        "BLOCK_SIZE_N": 64,
        "BLOCK_SIZE_K": 64,
        "GROUP_SIZE_M": 8,
        "num_stages": 1,
        "num_warps": 4,
        "ms": 0.24811908602714539,
        "min_ms": 0.24811908602714539,
        "max_ms": 0.24811908602714539,
        "compile_time": 1.9039368629455566
    },
    {
        "BLOCK_SIZE_M": 32,
        "BLOCK_SIZE_N": 256,
        "BLOCK_SIZE_K": 16,
        "GROUP_SIZE_M": 8,
        "num_stages": 4,
        "num_warps": 2,
        "ms": 0.24815960228443146,
        "min_ms": 0.24815960228443146,
        "max_ms": 0.24815960228443146,
        "compile_time": 2.149747133255005
    },
    {
        "BLOCK_SIZE_M": 64,
        "BLOCK_SIZE_N": 64,
        "BLOCK_SIZE_K": 64,
        "GROUP_SIZE_M": 8,
        "num_stages": 2,
        "num_warps": 2,
        "ms": 0.2481677085161209,
        "min_ms": 0.2481677085161209,
        "max_ms": 0.2481677085161209,
        "compile_time": 1.933215618133545
    },
    {
        "BLOCK_SIZE_M": 32,
        "BLOCK_SIZE_N": 256,
        "BLOCK_SIZE_K": 64,
        "GROUP_SIZE_M": 8,
        "num_stages": 3,
        "num_warps": 4,
        "ms": 0.2482258826494217,
        "min_ms": 0.2482258826494217,
        "max_ms": 0.2482258826494217,
        "compile_time": 2.147163152694702
    },
    {
        "BLOCK_SIZE_M": 32,
        "BLOCK_SIZE_N": 256,
        "BLOCK_SIZE_K": 32,
        "GROUP_SIZE_M": 8,
        "num_stages": 4,
        "num_warps": 4,
        "ms": 0.24830058217048645,
        "min_ms": 0.24830058217048645,
        "max_ms": 0.24830058217048645,
        "compile_time": 1.8700141906738281
    },
    {
        "BLOCK_SIZE_M": 64,
        "BLOCK_SIZE_N": 64,
        "BLOCK_SIZE_K": 64,
        "GROUP_SIZE_M": 8,
        "num_stages": 4,
        "num_warps": 8,
        "ms": 0.24846439063549042,
        "min_ms": 0.24846439063549042,
        "max_ms": 0.24846439063549042,
        "compile_time": 1.6929700374603271
    },
    {
        "BLOCK_SIZE_M": 128,
        "BLOCK_SIZE_N": 256,
        "BLOCK_SIZE_K": 128,
        "GROUP_SIZE_M": 8,
        "num_stages": 1,
        "num_warps": 8,
        "ms": 0.24848926067352295,
        "min_ms": 0.24848926067352295,
        "max_ms": 0.24848926067352295,
        "compile_time": 2.685084581375122
    },
    {
        "BLOCK_SIZE_M": 32,
        "BLOCK_SIZE_N": 512,
        "BLOCK_SIZE_K": 16,
        "GROUP_SIZE_M": 8,
        "num_stages": 5,
        "num_warps": 8,
        "ms": 0.24911169707775116,
        "min_ms": 0.24911169707775116,
        "max_ms": 0.24911169707775116,
        "compile_time": 1.7692854404449463
    },
    {
        "BLOCK_SIZE_M": 256,
        "BLOCK_SIZE_N": 64,
        "BLOCK_SIZE_K": 16,
        "GROUP_SIZE_M": 8,
        "num_stages": 5,
        "num_warps": 8,
        "ms": 0.24933309853076935,
        "min_ms": 0.24933309853076935,
        "max_ms": 0.24933309853076935,
        "compile_time": 1.979489803314209
    },
    {
        "BLOCK_SIZE_M": 32,
        "BLOCK_SIZE_N": 512,
        "BLOCK_SIZE_K": 16,
        "GROUP_SIZE_M": 8,
        "num_stages": 4,
        "num_warps": 8,
        "ms": 0.2493346482515335,
        "min_ms": 0.2493346482515335,
        "max_ms": 0.2493346482515335,
        "compile_time": 1.1260485649108887
    },
    {
        "BLOCK_SIZE_M": 256,
        "BLOCK_SIZE_N": 32,
        "BLOCK_SIZE_K": 32,
        "GROUP_SIZE_M": 8,
        "num_stages": 3,
        "num_warps": 4,
        "ms": 0.24939267337322235,
        "min_ms": 0.24939267337322235,
        "max_ms": 0.24939267337322235,
        "compile_time": 2.0239036083221436
    },
    {
        "BLOCK_SIZE_M": 32,
        "BLOCK_SIZE_N": 512,
        "BLOCK_SIZE_K": 32,
        "GROUP_SIZE_M": 8,
        "num_stages": 4,
        "num_warps": 8,
        "ms": 0.2497621476650238,
        "min_ms": 0.2497621476650238,
        "max_ms": 0.2497621476650238,
        "compile_time": 1.1269657611846924
    },
    {
        "BLOCK_SIZE_M": 512,
        "BLOCK_SIZE_N": 32,
        "BLOCK_SIZE_K": 32,
        "GROUP_SIZE_M": 8,
        "num_stages": 3,
        "num_warps": 4,
        "ms": 0.24984946846961975,
        "min_ms": 0.24984946846961975,
        "max_ms": 0.24984946846961975,
        "compile_time": 2.991731882095337
    },
    {
        "BLOCK_SIZE_M": 64,
        "BLOCK_SIZE_N": 64,
        "BLOCK_SIZE_K": 256,
        "GROUP_SIZE_M": 8,
        "num_stages": 2,
        "num_warps": 4,
        "ms": 0.2501092255115509,
        "min_ms": 0.2501092255115509,
        "max_ms": 0.2501092255115509,
        "compile_time": 2.3676881790161133
    },
    {
        "BLOCK_SIZE_M": 128,
        "BLOCK_SIZE_N": 128,
        "BLOCK_SIZE_K": 128,
        "GROUP_SIZE_M": 8,
        "num_stages": 3,
        "num_warps": 32,
        "ms": 0.25020793080329895,
        "min_ms": 0.25020793080329895,
        "max_ms": 0.25020793080329895,
        "compile_time": 1.815263271331787
    },
    {
        "BLOCK_SIZE_M": 256,
        "BLOCK_SIZE_N": 64,
        "BLOCK_SIZE_K": 16,
        "GROUP_SIZE_M": 8,
        "num_stages": 6,
        "num_warps": 8,
        "ms": 0.2505408525466919,
        "min_ms": 0.2505408525466919,
        "max_ms": 0.2505408525466919,
        "compile_time": 1.9908370971679688
    },
    {
        "BLOCK_SIZE_M": 32,
        "BLOCK_SIZE_N": 256,
        "BLOCK_SIZE_K": 64,
        "GROUP_SIZE_M": 8,
        "num_stages": 3,
        "num_warps": 8,
        "ms": 0.25083598494529724,
        "min_ms": 0.25083598494529724,
        "max_ms": 0.25083598494529724,
        "compile_time": 1.7256748676300049
    },
    {
        "BLOCK_SIZE_M": 256,
        "BLOCK_SIZE_N": 32,
        "BLOCK_SIZE_K": 32,
        "GROUP_SIZE_M": 8,
        "num_stages": 4,
        "num_warps": 4,
        "ms": 0.2511571943759918,
        "min_ms": 0.2511571943759918,
        "max_ms": 0.2511571943759918,
        "compile_time": 2.107762098312378
    },
    {
        "BLOCK_SIZE_M": 256,
        "BLOCK_SIZE_N": 64,
        "BLOCK_SIZE_K": 16,
        "GROUP_SIZE_M": 8,
        "num_stages": 7,
        "num_warps": 8,
        "ms": 0.2515237629413605,
        "min_ms": 0.2515237629413605,
        "max_ms": 0.2515237629413605,
        "compile_time": 1.9756009578704834
    },
    {
        "BLOCK_SIZE_M": 128,
        "BLOCK_SIZE_N": 256,
        "BLOCK_SIZE_K": 16,
        "GROUP_SIZE_M": 8,
        "num_stages": 4,
        "num_warps": 16,
        "ms": 0.25179678201675415,
        "min_ms": 0.25179678201675415,
        "max_ms": 0.25179678201675415,
        "compile_time": 1.1926522254943848
    },
    {
        "BLOCK_SIZE_M": 32,
        "BLOCK_SIZE_N": 512,
        "BLOCK_SIZE_K": 32,
        "GROUP_SIZE_M": 8,
        "num_stages": 5,
        "num_warps": 16,
        "ms": 0.25217685103416443,
        "min_ms": 0.25217685103416443,
        "max_ms": 0.25217685103416443,
        "compile_time": 1.1252803802490234
    },
    {
        "BLOCK_SIZE_M": 32,
        "BLOCK_SIZE_N": 512,
        "BLOCK_SIZE_K": 32,
        "GROUP_SIZE_M": 8,
        "num_stages": 3,
        "num_warps": 4,
        "ms": 0.2522362768650055,
        "min_ms": 0.2522362768650055,
        "max_ms": 0.2522362768650055,
        "compile_time": 2.4535701274871826
    },
    {
        "BLOCK_SIZE_M": 64,
        "BLOCK_SIZE_N": 256,
        "BLOCK_SIZE_K": 64,
        "GROUP_SIZE_M": 8,
        "num_stages": 2,
        "num_warps": 8,
        "ms": 0.2523036599159241,
        "min_ms": 0.2523036599159241,
        "max_ms": 0.2523036599159241,
        "compile_time": 1.1262192726135254
    },
    {
        "BLOCK_SIZE_M": 128,
        "BLOCK_SIZE_N": 128,
        "BLOCK_SIZE_K": 256,
        "GROUP_SIZE_M": 8,
        "num_stages": 2,
        "num_warps": 8,
        "ms": 0.2523748576641083,
        "min_ms": 0.2523748576641083,
        "max_ms": 0.2523748576641083,
        "compile_time": 2.7809078693389893
    },
    {
        "BLOCK_SIZE_M": 256,
        "BLOCK_SIZE_N": 64,
        "BLOCK_SIZE_K": 16,
        "GROUP_SIZE_M": 8,
        "num_stages": 8,
        "num_warps": 8,
        "ms": 0.25246039032936096,
        "min_ms": 0.25246039032936096,
        "max_ms": 0.25246039032936096,
        "compile_time": 1.9898531436920166
    },
    {
        "BLOCK_SIZE_M": 64,
        "BLOCK_SIZE_N": 64,
        "BLOCK_SIZE_K": 128,
        "GROUP_SIZE_M": 8,
        "num_stages": 3,
        "num_warps": 2,
        "ms": 0.2525196075439453,
        "min_ms": 0.2525196075439453,
        "max_ms": 0.2525196075439453,
        "compile_time": 2.731137990951538
    },
    {
        "BLOCK_SIZE_M": 32,
        "BLOCK_SIZE_N": 256,
        "BLOCK_SIZE_K": 16,
        "GROUP_SIZE_M": 8,
        "num_stages": 6,
        "num_warps": 2,
        "ms": 0.2526341378688812,
        "min_ms": 0.2526341378688812,
        "max_ms": 0.2526341378688812,
        "compile_time": 2.201253890991211
    },
    {
        "BLOCK_SIZE_M": 256,
        "BLOCK_SIZE_N": 128,
        "BLOCK_SIZE_K": 16,
        "GROUP_SIZE_M": 8,
        "num_stages": 4,
        "num_warps": 16,
        "ms": 0.25280463695526123,
        "min_ms": 0.25280463695526123,
        "max_ms": 0.25280463695526123,
        "compile_time": 1.227637529373169
    },
    {
        "BLOCK_SIZE_M": 256,
        "BLOCK_SIZE_N": 32,
        "BLOCK_SIZE_K": 32,
        "GROUP_SIZE_M": 8,
        "num_stages": 5,
        "num_warps": 4,
        "ms": 0.2528873085975647,
        "min_ms": 0.2528873085975647,
        "max_ms": 0.2528873085975647,
        "compile_time": 2.1497604846954346
    },
    {
        "BLOCK_SIZE_M": 32,
        "BLOCK_SIZE_N": 256,
        "BLOCK_SIZE_K": 16,
        "GROUP_SIZE_M": 8,
        "num_stages": 4,
        "num_warps": 4,
        "ms": 0.2529413402080536,
        "min_ms": 0.2529413402080536,
        "max_ms": 0.2529413402080536,
        "compile_time": 1.72212553024292
    },
    {
        "BLOCK_SIZE_M": 64,
        "BLOCK_SIZE_N": 256,
        "BLOCK_SIZE_K": 16,
        "GROUP_SIZE_M": 8,
        "num_stages": 4,
        "num_warps": 16,
        "ms": 0.25326114892959595,
        "min_ms": 0.25326114892959595,
        "max_ms": 0.25326114892959595,
        "compile_time": 1.1681058406829834
    },
    {
        "BLOCK_SIZE_M": 64,
        "BLOCK_SIZE_N": 256,
        "BLOCK_SIZE_K": 16,
        "GROUP_SIZE_M": 8,
        "num_stages": 3,
        "num_warps": 16,
        "ms": 0.25326892733573914,
        "min_ms": 0.25326892733573914,
        "max_ms": 0.25326892733573914,
        "compile_time": 1.1656601428985596
    },
    {
        "BLOCK_SIZE_M": 512,
        "BLOCK_SIZE_N": 64,
        "BLOCK_SIZE_K": 16,
        "GROUP_SIZE_M": 8,
        "num_stages": 4,
        "num_warps": 8,
        "ms": 0.2533881962299347,
        "min_ms": 0.2533881962299347,
        "max_ms": 0.2533881962299347,
        "compile_time": 1.2530441284179688
    },
    {
        "BLOCK_SIZE_M": 64,
        "BLOCK_SIZE_N": 64,
        "BLOCK_SIZE_K": 64,
        "GROUP_SIZE_M": 8,
        "num_stages": 5,
        "num_warps": 8,
        "ms": 0.2534061074256897,
        "min_ms": 0.2534061074256897,
        "max_ms": 0.2534061074256897,
        "compile_time": 1.1098809242248535
    },
    {
        "BLOCK_SIZE_M": 512,
        "BLOCK_SIZE_N": 32,
        "BLOCK_SIZE_K": 32,
        "GROUP_SIZE_M": 8,
        "num_stages": 4,
        "num_warps": 8,
        "ms": 0.2537051737308502,
        "min_ms": 0.2537051737308502,
        "max_ms": 0.2537051737308502,
        "compile_time": 2.296177864074707
    },
    {
        "BLOCK_SIZE_M": 64,
        "BLOCK_SIZE_N": 512,
        "BLOCK_SIZE_K": 64,
        "GROUP_SIZE_M": 8,
        "num_stages": 2,
        "num_warps": 8,
        "ms": 0.2537417709827423,
        "min_ms": 0.2537417709827423,
        "max_ms": 0.2537417709827423,
        "compile_time": 2.4897470474243164
    },
    {
        "BLOCK_SIZE_M": 32,
        "BLOCK_SIZE_N": 512,
        "BLOCK_SIZE_K": 16,
        "GROUP_SIZE_M": 8,
        "num_stages": 7,
        "num_warps": 4,
        "ms": 0.253764808177948,
        "min_ms": 0.253764808177948,
        "max_ms": 0.253764808177948,
        "compile_time": 2.237874984741211
    },
    {
        "BLOCK_SIZE_M": 512,
        "BLOCK_SIZE_N": 32,
        "BLOCK_SIZE_K": 32,
        "GROUP_SIZE_M": 8,
        "num_stages": 3,
        "num_warps": 8,
        "ms": 0.2538444399833679,
        "min_ms": 0.2538444399833679,
        "max_ms": 0.2538444399833679,
        "compile_time": 2.2905526161193848
    },
    {
        "BLOCK_SIZE_M": 256,
        "BLOCK_SIZE_N": 128,
        "BLOCK_SIZE_K": 16,
        "GROUP_SIZE_M": 8,
        "num_stages": 6,
        "num_warps": 16,
        "ms": 0.2538492977619171,
        "min_ms": 0.2538492977619171,
        "max_ms": 0.2538492977619171,
        "compile_time": 1.9534354209899902
    },
    {
        "BLOCK_SIZE_M": 32,
        "BLOCK_SIZE_N": 256,
        "BLOCK_SIZE_K": 32,
        "GROUP_SIZE_M": 8,
        "num_stages": 7,
        "num_warps": 4,
        "ms": 0.2539578974246979,
        "min_ms": 0.2539578974246979,
        "max_ms": 0.2539578974246979,
        "compile_time": 1.9384393692016602
    },
    {
        "BLOCK_SIZE_M": 64,
        "BLOCK_SIZE_N": 256,
        "BLOCK_SIZE_K": 16,
        "GROUP_SIZE_M": 8,
        "num_stages": 5,
        "num_warps": 16,
        "ms": 0.2539765536785126,
        "min_ms": 0.2539765536785126,
        "max_ms": 0.2539765536785126,
        "compile_time": 1.1501586437225342
    },
    {
        "BLOCK_SIZE_M": 32,
        "BLOCK_SIZE_N": 256,
        "BLOCK_SIZE_K": 32,
        "GROUP_SIZE_M": 8,
        "num_stages": 8,
        "num_warps": 4,
        "ms": 0.254055917263031,
        "min_ms": 0.254055917263031,
        "max_ms": 0.254055917263031,
        "compile_time": 2.0524072647094727
    },
    {
        "BLOCK_SIZE_M": 32,
        "BLOCK_SIZE_N": 512,
        "BLOCK_SIZE_K": 32,
        "GROUP_SIZE_M": 8,
        "num_stages": 4,
        "num_warps": 16,
        "ms": 0.25408053398132324,
        "min_ms": 0.25408053398132324,
        "max_ms": 0.25408053398132324,
        "compile_time": 1.6779077053070068
    },
    {
        "BLOCK_SIZE_M": 32,
        "BLOCK_SIZE_N": 512,
        "BLOCK_SIZE_K": 16,
        "GROUP_SIZE_M": 8,
        "num_stages": 6,
        "num_warps": 4,
        "ms": 0.25415802001953125,
        "min_ms": 0.25415802001953125,
        "max_ms": 0.25415802001953125,
        "compile_time": 2.190260410308838
    },
    {
        "BLOCK_SIZE_M": 32,
        "BLOCK_SIZE_N": 512,
        "BLOCK_SIZE_K": 16,
        "GROUP_SIZE_M": 8,
        "num_stages": 8,
        "num_warps": 4,
        "ms": 0.25418800115585327,
        "min_ms": 0.25418800115585327,
        "max_ms": 0.25418800115585327,
        "compile_time": 2.290783405303955
    },
    {
        "BLOCK_SIZE_M": 512,
        "BLOCK_SIZE_N": 64,
        "BLOCK_SIZE_K": 16,
        "GROUP_SIZE_M": 8,
        "num_stages": 5,
        "num_warps": 8,
        "ms": 0.2542383670806885,
        "min_ms": 0.2542383670806885,
        "max_ms": 0.2542383670806885,
        "compile_time": 1.248727798461914
    },
    {
        "BLOCK_SIZE_M": 128,
        "BLOCK_SIZE_N": 128,
        "BLOCK_SIZE_K": 256,
        "GROUP_SIZE_M": 8,
        "num_stages": 1,
        "num_warps": 8,
        "ms": 0.25429627299308777,
        "min_ms": 0.25429627299308777,
        "max_ms": 0.25429627299308777,
        "compile_time": 2.5867602825164795
    },
    {
        "BLOCK_SIZE_M": 64,
        "BLOCK_SIZE_N": 128,
        "BLOCK_SIZE_K": 128,
        "GROUP_SIZE_M": 8,
        "num_stages": 3,
        "num_warps": 16,
        "ms": 0.2544829249382019,
        "min_ms": 0.2544829249382019,
        "max_ms": 0.2544829249382019,
        "compile_time": 1.7848279476165771
    },
    {
        "BLOCK_SIZE_M": 256,
        "BLOCK_SIZE_N": 128,
        "BLOCK_SIZE_K": 16,
        "GROUP_SIZE_M": 8,
        "num_stages": 7,
        "num_warps": 16,
        "ms": 0.25453439354896545,
        "min_ms": 0.25453439354896545,
        "max_ms": 0.25453439354896545,
        "compile_time": 1.9721806049346924
    },
    {
        "BLOCK_SIZE_M": 32,
        "BLOCK_SIZE_N": 512,
        "BLOCK_SIZE_K": 16,
        "GROUP_SIZE_M": 8,
        "num_stages": 3,
        "num_warps": 4,
        "ms": 0.254650741815567,
        "min_ms": 0.254650741815567,
        "max_ms": 0.254650741815567,
        "compile_time": 2.0995078086853027
    },
    {
        "BLOCK_SIZE_M": 32,
        "BLOCK_SIZE_N": 256,
        "BLOCK_SIZE_K": 64,
        "GROUP_SIZE_M": 8,
        "num_stages": 5,
        "num_warps": 4,
        "ms": 0.2551560401916504,
        "min_ms": 0.2551560401916504,
        "max_ms": 0.2551560401916504,
        "compile_time": 2.2992849349975586
    },
    {
        "BLOCK_SIZE_M": 32,
        "BLOCK_SIZE_N": 256,
        "BLOCK_SIZE_K": 32,
        "GROUP_SIZE_M": 8,
        "num_stages": 4,
        "num_warps": 8,
        "ms": 0.2552652060985565,
        "min_ms": 0.2552652060985565,
        "max_ms": 0.2552652060985565,
        "compile_time": 1.1314616203308105
    },
    {
        "BLOCK_SIZE_M": 256,
        "BLOCK_SIZE_N": 128,
        "BLOCK_SIZE_K": 16,
        "GROUP_SIZE_M": 8,
        "num_stages": 8,
        "num_warps": 16,
        "ms": 0.25535669922828674,
        "min_ms": 0.25535669922828674,
        "max_ms": 0.25535669922828674,
        "compile_time": 1.9885015487670898
    },
    {
        "BLOCK_SIZE_M": 32,
        "BLOCK_SIZE_N": 256,
        "BLOCK_SIZE_K": 32,
        "GROUP_SIZE_M": 8,
        "num_stages": 5,
        "num_warps": 8,
        "ms": 0.2554128170013428,
        "min_ms": 0.2554128170013428,
        "max_ms": 0.2554128170013428,
        "compile_time": 1.1317477226257324
    },
    {
        "BLOCK_SIZE_M": 512,
        "BLOCK_SIZE_N": 32,
        "BLOCK_SIZE_K": 32,
        "GROUP_SIZE_M": 8,
        "num_stages": 5,
        "num_warps": 8,
        "ms": 0.25582343339920044,
        "min_ms": 0.25582343339920044,
        "max_ms": 0.25582343339920044,
        "compile_time": 2.313985586166382
    },
    {
        "BLOCK_SIZE_M": 32,
        "BLOCK_SIZE_N": 256,
        "BLOCK_SIZE_K": 16,
        "GROUP_SIZE_M": 8,
        "num_stages": 3,
        "num_warps": 2,
        "ms": 0.2558881640434265,
        "min_ms": 0.2558881640434265,
        "max_ms": 0.2558881640434265,
        "compile_time": 2.0763983726501465
    },
    {
        "BLOCK_SIZE_M": 512,
        "BLOCK_SIZE_N": 64,
        "BLOCK_SIZE_K": 16,
        "GROUP_SIZE_M": 8,
        "num_stages": 6,
        "num_warps": 8,
        "ms": 0.2559061348438263,
        "min_ms": 0.2559061348438263,
        "max_ms": 0.2559061348438263,
        "compile_time": 1.2493269443511963
    },
    {
        "BLOCK_SIZE_M": 32,
        "BLOCK_SIZE_N": 256,
        "BLOCK_SIZE_K": 32,
        "GROUP_SIZE_M": 8,
        "num_stages": 6,
        "num_warps": 4,
        "ms": 0.2559471130371094,
        "min_ms": 0.2559471130371094,
        "max_ms": 0.2559471130371094,
        "compile_time": 1.9650852680206299
    },
    {
        "BLOCK_SIZE_M": 128,
        "BLOCK_SIZE_N": 64,
        "BLOCK_SIZE_K": 32,
        "GROUP_SIZE_M": 8,
        "num_stages": 1,
        "num_warps": 4,
        "ms": 0.2559666633605957,
        "min_ms": 0.2559666633605957,
        "max_ms": 0.2559666633605957,
        "compile_time": 1.1659183502197266
    },
    {
        "BLOCK_SIZE_M": 128,
        "BLOCK_SIZE_N": 64,
        "BLOCK_SIZE_K": 128,
        "GROUP_SIZE_M": 8,
        "num_stages": 3,
        "num_warps": 16,
        "ms": 0.2561318576335907,
        "min_ms": 0.2561318576335907,
        "max_ms": 0.2561318576335907,
        "compile_time": 1.1844542026519775
    },
    {
        "BLOCK_SIZE_M": 128,
        "BLOCK_SIZE_N": 256,
        "BLOCK_SIZE_K": 64,
        "GROUP_SIZE_M": 8,
        "num_stages": 1,
        "num_warps": 16,
        "ms": 0.2562691569328308,
        "min_ms": 0.2562691569328308,
        "max_ms": 0.2562691569328308,
        "compile_time": 1.180983066558838
    },
    {
        "BLOCK_SIZE_M": 32,
        "BLOCK_SIZE_N": 512,
        "BLOCK_SIZE_K": 64,
        "GROUP_SIZE_M": 8,
        "num_stages": 3,
        "num_warps": 8,
        "ms": 0.25649064779281616,
        "min_ms": 0.25649064779281616,
        "max_ms": 0.25649064779281616,
        "compile_time": 1.1200127601623535
    },
    {
        "BLOCK_SIZE_M": 512,
        "BLOCK_SIZE_N": 64,
        "BLOCK_SIZE_K": 16,
        "GROUP_SIZE_M": 8,
        "num_stages": 8,
        "num_warps": 8,
        "ms": 0.2565346658229828,
        "min_ms": 0.2565346658229828,
        "max_ms": 0.2565346658229828,
        "compile_time": 1.2627460956573486
    },
    {
        "BLOCK_SIZE_M": 512,
        "BLOCK_SIZE_N": 64,
        "BLOCK_SIZE_K": 16,
        "GROUP_SIZE_M": 8,
        "num_stages": 7,
        "num_warps": 8,
        "ms": 0.2565748989582062,
        "min_ms": 0.2565748989582062,
        "max_ms": 0.2565748989582062,
        "compile_time": 1.2548978328704834
    },
    {
        "BLOCK_SIZE_M": 64,
        "BLOCK_SIZE_N": 64,
        "BLOCK_SIZE_K": 256,
        "GROUP_SIZE_M": 8,
        "num_stages": 3,
        "num_warps": 4,
        "ms": 0.25659123063087463,
        "min_ms": 0.25659123063087463,
        "max_ms": 0.25659123063087463,
        "compile_time": 2.678999662399292
    },
    {
        "BLOCK_SIZE_M": 512,
        "BLOCK_SIZE_N": 64,
        "BLOCK_SIZE_K": 16,
        "GROUP_SIZE_M": 8,
        "num_stages": 3,
        "num_warps": 8,
        "ms": 0.2566494345664978,
        "min_ms": 0.2566494345664978,
        "max_ms": 0.2566494345664978,
        "compile_time": 1.24192476272583
    },
    {
        "BLOCK_SIZE_M": 64,
        "BLOCK_SIZE_N": 256,
        "BLOCK_SIZE_K": 16,
        "GROUP_SIZE_M": 8,
        "num_stages": 6,
        "num_warps": 16,
        "ms": 0.25673168897628784,
        "min_ms": 0.25673168897628784,
        "max_ms": 0.25673168897628784,
        "compile_time": 1.1660773754119873
    },
    {
        "BLOCK_SIZE_M": 32,
        "BLOCK_SIZE_N": 512,
        "BLOCK_SIZE_K": 16,
        "GROUP_SIZE_M": 8,
        "num_stages": 3,
        "num_warps": 8,
        "ms": 0.25678735971450806,
        "min_ms": 0.25678735971450806,
        "max_ms": 0.25678735971450806,
        "compile_time": 1.1284279823303223
    },
    {
        "BLOCK_SIZE_M": 64,
        "BLOCK_SIZE_N": 256,
        "BLOCK_SIZE_K": 16,
        "GROUP_SIZE_M": 8,
        "num_stages": 7,
        "num_warps": 16,
        "ms": 0.2568383812904358,
        "min_ms": 0.2568383812904358,
        "max_ms": 0.2568383812904358,
        "compile_time": 1.1591846942901611
    },
    {
        "BLOCK_SIZE_M": 64,
        "BLOCK_SIZE_N": 256,
        "BLOCK_SIZE_K": 16,
        "GROUP_SIZE_M": 8,
        "num_stages": 8,
        "num_warps": 16,
        "ms": 0.25723737478256226,
        "min_ms": 0.25723737478256226,
        "max_ms": 0.25723737478256226,
        "compile_time": 1.15087890625
    },
    {
        "BLOCK_SIZE_M": 256,
        "BLOCK_SIZE_N": 32,
        "BLOCK_SIZE_K": 64,
        "GROUP_SIZE_M": 8,
        "num_stages": 3,
        "num_warps": 4,
        "ms": 0.2580598294734955,
        "min_ms": 0.2580598294734955,
        "max_ms": 0.2580598294734955,
        "compile_time": 2.4084372520446777
    },
    {
        "BLOCK_SIZE_M": 32,
        "BLOCK_SIZE_N": 256,
        "BLOCK_SIZE_K": 16,
        "GROUP_SIZE_M": 8,
        "num_stages": 8,
        "num_warps": 4,
        "ms": 0.2582239806652069,
        "min_ms": 0.2582239806652069,
        "max_ms": 0.2582239806652069,
        "compile_time": 1.126990556716919
    },
    {
        "BLOCK_SIZE_M": 64,
        "BLOCK_SIZE_N": 128,
        "BLOCK_SIZE_K": 128,
        "GROUP_SIZE_M": 8,
        "num_stages": 1,
        "num_warps": 8,
        "ms": 0.25839415192604065,
        "min_ms": 0.25839415192604065,
        "max_ms": 0.25839415192604065,
        "compile_time": 1.7803997993469238
    },
    {
        "BLOCK_SIZE_M": 32,
        "BLOCK_SIZE_N": 256,
        "BLOCK_SIZE_K": 16,
        "GROUP_SIZE_M": 8,
        "num_stages": 7,
        "num_warps": 4,
        "ms": 0.2584134638309479,
        "min_ms": 0.2584134638309479,
        "max_ms": 0.2584134638309479,
        "compile_time": 1.1425683498382568
    },
    {
        "BLOCK_SIZE_M": 64,
        "BLOCK_SIZE_N": 64,
        "BLOCK_SIZE_K": 64,
        "GROUP_SIZE_M": 8,
        "num_stages": 6,
        "num_warps": 8,
        "ms": 0.25848984718322754,
        "min_ms": 0.25848984718322754,
        "max_ms": 0.25848984718322754,
        "compile_time": 1.1643304824829102
    },
    {
        "BLOCK_SIZE_M": 128,
        "BLOCK_SIZE_N": 64,
        "BLOCK_SIZE_K": 128,
        "GROUP_SIZE_M": 8,
        "num_stages": 4,
        "num_warps": 16,
        "ms": 0.2585175931453705,
        "min_ms": 0.2585175931453705,
        "max_ms": 0.2585175931453705,
        "compile_time": 1.178882122039795
    },
    {
        "BLOCK_SIZE_M": 128,
        "BLOCK_SIZE_N": 64,
        "BLOCK_SIZE_K": 16,
        "GROUP_SIZE_M": 8,
        "num_stages": 8,
        "num_warps": 2,
        "ms": 0.2585187554359436,
        "min_ms": 0.2585187554359436,
        "max_ms": 0.2585187554359436,
        "compile_time": 2.257457971572876
    },
    {
        "BLOCK_SIZE_M": 512,
        "BLOCK_SIZE_N": 64,
        "BLOCK_SIZE_K": 16,
        "GROUP_SIZE_M": 8,
        "num_stages": 4,
        "num_warps": 16,
        "ms": 0.2585517466068268,
        "min_ms": 0.2585517466068268,
        "max_ms": 0.2585517466068268,
        "compile_time": 1.2571775913238525
    },
    {
        "BLOCK_SIZE_M": 64,
        "BLOCK_SIZE_N": 128,
        "BLOCK_SIZE_K": 128,
        "GROUP_SIZE_M": 8,
        "num_stages": 4,
        "num_warps": 16,
        "ms": 0.2585710883140564,
        "min_ms": 0.2585710883140564,
        "max_ms": 0.2585710883140564,
        "compile_time": 1.8046438694000244
    },
    {
        "BLOCK_SIZE_M": 512,
        "BLOCK_SIZE_N": 32,
        "BLOCK_SIZE_K": 64,
        "GROUP_SIZE_M": 8,
        "num_stages": 3,
        "num_warps": 8,
        "ms": 0.2586669921875,
        "min_ms": 0.2586669921875,
        "max_ms": 0.2586669921875,
        "compile_time": 2.5331969261169434
    },
    {
        "BLOCK_SIZE_M": 64,
        "BLOCK_SIZE_N": 128,
        "BLOCK_SIZE_K": 64,
        "GROUP_SIZE_M": 8,
        "num_stages": 1,
        "num_warps": 2,
        "ms": 0.2589302361011505,
        "min_ms": 0.2589302361011505,
        "max_ms": 0.2589302361011505,
        "compile_time": 2.372884750366211
    },
    {
        "BLOCK_SIZE_M": 256,
        "BLOCK_SIZE_N": 64,
        "BLOCK_SIZE_K": 32,
        "GROUP_SIZE_M": 8,
        "num_stages": 1,
        "num_warps": 4,
        "ms": 0.2592085003852844,
        "min_ms": 0.2592085003852844,
        "max_ms": 0.2592085003852844,
        "compile_time": 2.298693895339966
    },
    {
        "BLOCK_SIZE_M": 32,
        "BLOCK_SIZE_N": 512,
        "BLOCK_SIZE_K": 64,
        "GROUP_SIZE_M": 8,
        "num_stages": 3,
        "num_warps": 16,
        "ms": 0.25962698459625244,
        "min_ms": 0.25962698459625244,
        "max_ms": 0.25962698459625244,
        "compile_time": 1.8406293392181396
    },
    {
        "BLOCK_SIZE_M": 64,
        "BLOCK_SIZE_N": 128,
        "BLOCK_SIZE_K": 64,
        "GROUP_SIZE_M": 8,
        "num_stages": 1,
        "num_warps": 4,
        "ms": 0.2596718668937683,
        "min_ms": 0.2596718668937683,
        "max_ms": 0.2596718668937683,
        "compile_time": 1.82523512840271
    },
    {
        "BLOCK_SIZE_M": 32,
        "BLOCK_SIZE_N": 256,
        "BLOCK_SIZE_K": 64,
        "GROUP_SIZE_M": 8,
        "num_stages": 5,
        "num_warps": 8,
        "ms": 0.259715735912323,
        "min_ms": 0.259715735912323,
        "max_ms": 0.259715735912323,
        "compile_time": 1.8671653270721436
    },
    {
        "BLOCK_SIZE_M": 512,
        "BLOCK_SIZE_N": 64,
        "BLOCK_SIZE_K": 16,
        "GROUP_SIZE_M": 8,
        "num_stages": 5,
        "num_warps": 16,
        "ms": 0.2597431540489197,
        "min_ms": 0.2597431540489197,
        "max_ms": 0.2597431540489197,
        "compile_time": 1.253446340560913
    },
    {
        "BLOCK_SIZE_M": 128,
        "BLOCK_SIZE_N": 64,
        "BLOCK_SIZE_K": 16,
        "GROUP_SIZE_M": 8,
        "num_stages": 8,
        "num_warps": 4,
        "ms": 0.2598194479942322,
        "min_ms": 0.2598194479942322,
        "max_ms": 0.2598194479942322,
        "compile_time": 1.187788724899292
    },
    {
        "BLOCK_SIZE_M": 32,
        "BLOCK_SIZE_N": 256,
        "BLOCK_SIZE_K": 16,
        "GROUP_SIZE_M": 8,
        "num_stages": 6,
        "num_warps": 4,
        "ms": 0.2600511610507965,
        "min_ms": 0.2600511610507965,
        "max_ms": 0.2600511610507965,
        "compile_time": 1.1466522216796875
    },
    {
        "BLOCK_SIZE_M": 32,
        "BLOCK_SIZE_N": 128,
        "BLOCK_SIZE_K": 32,
        "GROUP_SIZE_M": 8,
        "num_stages": 4,
        "num_warps": 2,
        "ms": 0.26019415259361267,
        "min_ms": 0.26019415259361267,
        "max_ms": 0.26019415259361267,
        "compile_time": 1.8795833587646484
    },
    {
        "BLOCK_SIZE_M": 512,
        "BLOCK_SIZE_N": 64,
        "BLOCK_SIZE_K": 16,
        "GROUP_SIZE_M": 8,
        "num_stages": 3,
        "num_warps": 16,
        "ms": 0.2602103352546692,
        "min_ms": 0.2602103352546692,
        "max_ms": 0.2602103352546692,
        "compile_time": 1.2606425285339355
    },
    {
        "BLOCK_SIZE_M": 256,
        "BLOCK_SIZE_N": 32,
        "BLOCK_SIZE_K": 64,
        "GROUP_SIZE_M": 8,
        "num_stages": 4,
        "num_warps": 4,
        "ms": 0.260301411151886,
        "min_ms": 0.260301411151886,
        "max_ms": 0.260301411151886,
        "compile_time": 2.498501777648926
    },
    {
        "BLOCK_SIZE_M": 32,
        "BLOCK_SIZE_N": 128,
        "BLOCK_SIZE_K": 64,
        "GROUP_SIZE_M": 8,
        "num_stages": 3,
        "num_warps": 4,
        "ms": 0.2603849172592163,
        "min_ms": 0.2603849172592163,
        "max_ms": 0.2603849172592163,
        "compile_time": 1.7813751697540283
    },
    {
        "BLOCK_SIZE_M": 512,
        "BLOCK_SIZE_N": 64,
        "BLOCK_SIZE_K": 16,
        "GROUP_SIZE_M": 8,
        "num_stages": 6,
        "num_warps": 16,
        "ms": 0.2605671286582947,
        "min_ms": 0.2605671286582947,
        "max_ms": 0.2605671286582947,
        "compile_time": 1.2551777362823486
    },
    {
        "BLOCK_SIZE_M": 64,
        "BLOCK_SIZE_N": 512,
        "BLOCK_SIZE_K": 64,
        "GROUP_SIZE_M": 8,
        "num_stages": 3,
        "num_warps": 16,
        "ms": 0.26063257455825806,
        "min_ms": 0.26063257455825806,
        "max_ms": 0.26063257455825806,
        "compile_time": 1.1552274227142334
    },
    {
        "BLOCK_SIZE_M": 32,
        "BLOCK_SIZE_N": 256,
        "BLOCK_SIZE_K": 16,
        "GROUP_SIZE_M": 8,
        "num_stages": 3,
        "num_warps": 4,
        "ms": 0.26081040501594543,
        "min_ms": 0.26081040501594543,
        "max_ms": 0.26081040501594543,
        "compile_time": 1.7135584354400635
    },
    {
        "BLOCK_SIZE_M": 256,
        "BLOCK_SIZE_N": 64,
        "BLOCK_SIZE_K": 64,
        "GROUP_SIZE_M": 8,
        "num_stages": 2,
        "num_warps": 8,
        "ms": 0.26133233308792114,
        "min_ms": 0.26133233308792114,
        "max_ms": 0.26133233308792114,
        "compile_time": 2.1907405853271484
    },
    {
        "BLOCK_SIZE_M": 32,
        "BLOCK_SIZE_N": 256,
        "BLOCK_SIZE_K": 32,
        "GROUP_SIZE_M": 8,
        "num_stages": 6,
        "num_warps": 8,
        "ms": 0.26201632618904114,
        "min_ms": 0.26201632618904114,
        "max_ms": 0.26201632618904114,
        "compile_time": 1.1191964149475098
    },
    {
        "BLOCK_SIZE_M": 512,
        "BLOCK_SIZE_N": 64,
        "BLOCK_SIZE_K": 16,
        "GROUP_SIZE_M": 8,
        "num_stages": 7,
        "num_warps": 16,
        "ms": 0.26210206747055054,
        "min_ms": 0.26210206747055054,
        "max_ms": 0.26210206747055054,
        "compile_time": 1.2573063373565674
    },
    {
        "BLOCK_SIZE_M": 32,
        "BLOCK_SIZE_N": 128,
        "BLOCK_SIZE_K": 32,
        "GROUP_SIZE_M": 8,
        "num_stages": 3,
        "num_warps": 2,
        "ms": 0.2621397376060486,
        "min_ms": 0.2621397376060486,
        "max_ms": 0.2621397376060486,
        "compile_time": 1.8317883014678955
    },
    {
        "BLOCK_SIZE_M": 128,
        "BLOCK_SIZE_N": 64,
        "BLOCK_SIZE_K": 64,
        "GROUP_SIZE_M": 8,
        "num_stages": 4,
        "num_warps": 16,
        "ms": 0.26246243715286255,
        "min_ms": 0.26246243715286255,
        "max_ms": 0.26246243715286255,
        "compile_time": 1.1799798011779785
    },
    {
        "BLOCK_SIZE_M": 256,
        "BLOCK_SIZE_N": 32,
        "BLOCK_SIZE_K": 32,
        "GROUP_SIZE_M": 8,
        "num_stages": 6,
        "num_warps": 4,
        "ms": 0.26248759031295776,
        "min_ms": 0.26248759031295776,
        "max_ms": 0.26248759031295776,
        "compile_time": 2.1825764179229736
    },
    {
        "BLOCK_SIZE_M": 128,
        "BLOCK_SIZE_N": 64,
        "BLOCK_SIZE_K": 128,
        "GROUP_SIZE_M": 8,
        "num_stages": 1,
        "num_warps": 8,
        "ms": 0.26258376240730286,
        "min_ms": 0.26258376240730286,
        "max_ms": 0.26258376240730286,
        "compile_time": 1.2363190650939941
    },
    {
        "BLOCK_SIZE_M": 256,
        "BLOCK_SIZE_N": 32,
        "BLOCK_SIZE_K": 64,
        "GROUP_SIZE_M": 8,
        "num_stages": 5,
        "num_warps": 4,
        "ms": 0.2626325190067291,
        "min_ms": 0.2626325190067291,
        "max_ms": 0.2626325190067291,
        "compile_time": 2.524967908859253
    },
    {
        "BLOCK_SIZE_M": 128,
        "BLOCK_SIZE_N": 128,
        "BLOCK_SIZE_K": 64,
        "GROUP_SIZE_M": 8,
        "num_stages": 3,
        "num_warps": 32,
        "ms": 0.2626757025718689,
        "min_ms": 0.2626757025718689,
        "max_ms": 0.2626757025718689,
        "compile_time": 1.190021276473999
    },
    {
        "BLOCK_SIZE_M": 32,
        "BLOCK_SIZE_N": 128,
        "BLOCK_SIZE_K": 32,
        "GROUP_SIZE_M": 8,
        "num_stages": 4,
        "num_warps": 4,
        "ms": 0.2627801299095154,
        "min_ms": 0.2627801299095154,
        "max_ms": 0.2627801299095154,
        "compile_time": 1.1277694702148438
    },
    {
        "BLOCK_SIZE_M": 32,
        "BLOCK_SIZE_N": 128,
        "BLOCK_SIZE_K": 32,
        "GROUP_SIZE_M": 8,
        "num_stages": 3,
        "num_warps": 4,
        "ms": 0.2627852261066437,
        "min_ms": 0.2627852261066437,
        "max_ms": 0.2627852261066437,
        "compile_time": 1.1265311241149902
    },
    {
        "BLOCK_SIZE_M": 32,
        "BLOCK_SIZE_N": 128,
        "BLOCK_SIZE_K": 32,
        "GROUP_SIZE_M": 8,
        "num_stages": 6,
        "num_warps": 2,
        "ms": 0.2628481090068817,
        "min_ms": 0.2628481090068817,
        "max_ms": 0.2628481090068817,
        "compile_time": 1.9513566493988037
    },
    {
        "BLOCK_SIZE_M": 512,
        "BLOCK_SIZE_N": 64,
        "BLOCK_SIZE_K": 16,
        "GROUP_SIZE_M": 8,
        "num_stages": 8,
        "num_warps": 16,
        "ms": 0.2630489468574524,
        "min_ms": 0.2630489468574524,
        "max_ms": 0.2630489468574524,
        "compile_time": 1.2629890441894531
    },
    {
        "BLOCK_SIZE_M": 32,
        "BLOCK_SIZE_N": 256,
        "BLOCK_SIZE_K": 32,
        "GROUP_SIZE_M": 8,
        "num_stages": 3,
        "num_warps": 4,
        "ms": 0.26305943727493286,
        "min_ms": 0.26305943727493286,
        "max_ms": 0.26305943727493286,
        "compile_time": 1.846609115600586
    },
    {
        "BLOCK_SIZE_M": 32,
        "BLOCK_SIZE_N": 512,
        "BLOCK_SIZE_K": 32,
        "GROUP_SIZE_M": 8,
        "num_stages": 3,
        "num_warps": 16,
        "ms": 0.26311203837394714,
        "min_ms": 0.26311203837394714,
        "max_ms": 0.26311203837394714,
        "compile_time": 1.1275439262390137
    },
    {
        "BLOCK_SIZE_M": 512,
        "BLOCK_SIZE_N": 64,
        "BLOCK_SIZE_K": 32,
        "GROUP_SIZE_M": 8,
        "num_stages": 2,
        "num_warps": 8,
        "ms": 0.2633422911167145,
        "min_ms": 0.2633422911167145,
        "max_ms": 0.2633422911167145,
        "compile_time": 2.690824031829834
    },
    {
        "BLOCK_SIZE_M": 256,
        "BLOCK_SIZE_N": 32,
        "BLOCK_SIZE_K": 64,
        "GROUP_SIZE_M": 8,
        "num_stages": 3,
        "num_warps": 8,
        "ms": 0.2635567784309387,
        "min_ms": 0.2635567784309387,
        "max_ms": 0.2635567784309387,
        "compile_time": 2.044811964035034
    },
    {
        "BLOCK_SIZE_M": 32,
        "BLOCK_SIZE_N": 256,
        "BLOCK_SIZE_K": 32,
        "GROUP_SIZE_M": 8,
        "num_stages": 7,
        "num_warps": 8,
        "ms": 0.2635745406150818,
        "min_ms": 0.2635745406150818,
        "max_ms": 0.2635745406150818,
        "compile_time": 1.1241710186004639
    },
    {
        "BLOCK_SIZE_M": 128,
        "BLOCK_SIZE_N": 64,
        "BLOCK_SIZE_K": 64,
        "GROUP_SIZE_M": 8,
        "num_stages": 3,
        "num_warps": 16,
        "ms": 0.2635769844055176,
        "min_ms": 0.2635769844055176,
        "max_ms": 0.2635769844055176,
        "compile_time": 1.198939561843872
    },
    {
        "BLOCK_SIZE_M": 32,
        "BLOCK_SIZE_N": 256,
        "BLOCK_SIZE_K": 32,
        "GROUP_SIZE_M": 8,
        "num_stages": 8,
        "num_warps": 8,
        "ms": 0.2635825276374817,
        "min_ms": 0.2635825276374817,
        "max_ms": 0.2635825276374817,
        "compile_time": 1.124464988708496
    },
    {
        "BLOCK_SIZE_M": 256,
        "BLOCK_SIZE_N": 32,
        "BLOCK_SIZE_K": 32,
        "GROUP_SIZE_M": 8,
        "num_stages": 8,
        "num_warps": 4,
        "ms": 0.2637942433357239,
        "min_ms": 0.2637942433357239,
        "max_ms": 0.2637942433357239,
        "compile_time": 2.271883726119995
    },
    {
        "BLOCK_SIZE_M": 64,
        "BLOCK_SIZE_N": 64,
        "BLOCK_SIZE_K": 16,
        "GROUP_SIZE_M": 8,
        "num_stages": 8,
        "num_warps": 2,
        "ms": 0.26380455493927,
        "min_ms": 0.26380455493927,
        "max_ms": 0.26380455493927,
        "compile_time": 1.8414463996887207
    },
    {
        "BLOCK_SIZE_M": 256,
        "BLOCK_SIZE_N": 32,
        "BLOCK_SIZE_K": 32,
        "GROUP_SIZE_M": 8,
        "num_stages": 7,
        "num_warps": 4,
        "ms": 0.26382920145988464,
        "min_ms": 0.26382920145988464,
        "max_ms": 0.26382920145988464,
        "compile_time": 2.3019230365753174
    },
    {
        "BLOCK_SIZE_M": 128,
        "BLOCK_SIZE_N": 128,
        "BLOCK_SIZE_K": 64,
        "GROUP_SIZE_M": 8,
        "num_stages": 4,
        "num_warps": 32,
        "ms": 0.2640323042869568,
        "min_ms": 0.2640323042869568,
        "max_ms": 0.2640323042869568,
        "compile_time": 1.7755141258239746
    },
    {
        "BLOCK_SIZE_M": 64,
        "BLOCK_SIZE_N": 64,
        "BLOCK_SIZE_K": 16,
        "GROUP_SIZE_M": 8,
        "num_stages": 7,
        "num_warps": 4,
        "ms": 0.2640753984451294,
        "min_ms": 0.2640753984451294,
        "max_ms": 0.2640753984451294,
        "compile_time": 1.177842140197754
    },
    {
        "BLOCK_SIZE_M": 256,
        "BLOCK_SIZE_N": 32,
        "BLOCK_SIZE_K": 32,
        "GROUP_SIZE_M": 8,
        "num_stages": 3,
        "num_warps": 2,
        "ms": 0.2641156017780304,
        "min_ms": 0.2641156017780304,
        "max_ms": 0.2641156017780304,
        "compile_time": 2.7266688346862793
    },
    {
        "BLOCK_SIZE_M": 32,
        "BLOCK_SIZE_N": 512,
        "BLOCK_SIZE_K": 32,
        "GROUP_SIZE_M": 8,
        "num_stages": 4,
        "num_warps": 4,
        "ms": 0.26427116990089417,
        "min_ms": 0.26427116990089417,
        "max_ms": 0.26427116990089417,
        "compile_time": 2.5378050804138184
    },
    {
        "BLOCK_SIZE_M": 32,
        "BLOCK_SIZE_N": 512,
        "BLOCK_SIZE_K": 32,
        "GROUP_SIZE_M": 8,
        "num_stages": 3,
        "num_warps": 8,
        "ms": 0.2643201947212219,
        "min_ms": 0.2643201947212219,
        "max_ms": 0.2643201947212219,
        "compile_time": 1.8735289573669434
    },
    {
        "BLOCK_SIZE_M": 64,
        "BLOCK_SIZE_N": 64,
        "BLOCK_SIZE_K": 64,
        "GROUP_SIZE_M": 8,
        "num_stages": 1,
        "num_warps": 4,
        "ms": 0.26440414786338806,
        "min_ms": 0.26440414786338806,
        "max_ms": 0.26440414786338806,
        "compile_time": 1.1627633571624756
    },
    {
        "BLOCK_SIZE_M": 128,
        "BLOCK_SIZE_N": 64,
        "BLOCK_SIZE_K": 128,
        "GROUP_SIZE_M": 8,
        "num_stages": 1,
        "num_warps": 4,
        "ms": 0.26442569494247437,
        "min_ms": 0.26442569494247437,
        "max_ms": 0.26442569494247437,
        "compile_time": 2.2192811965942383
    },
    {
        "BLOCK_SIZE_M": 32,
        "BLOCK_SIZE_N": 128,
        "BLOCK_SIZE_K": 32,
        "GROUP_SIZE_M": 8,
        "num_stages": 5,
        "num_warps": 4,
        "ms": 0.26449427008628845,
        "min_ms": 0.26449427008628845,
        "max_ms": 0.26449427008628845,
        "compile_time": 1.1249232292175293
    },
    {
        "BLOCK_SIZE_M": 32,
        "BLOCK_SIZE_N": 128,
        "BLOCK_SIZE_K": 32,
        "GROUP_SIZE_M": 8,
        "num_stages": 6,
        "num_warps": 4,
        "ms": 0.26477059721946716,
        "min_ms": 0.26477059721946716,
        "max_ms": 0.26477059721946716,
        "compile_time": 1.1164631843566895
    },
    {
        "BLOCK_SIZE_M": 32,
        "BLOCK_SIZE_N": 256,
        "BLOCK_SIZE_K": 32,
        "GROUP_SIZE_M": 8,
        "num_stages": 3,
        "num_warps": 8,
        "ms": 0.2648482024669647,
        "min_ms": 0.2648482024669647,
        "max_ms": 0.2648482024669647,
        "compile_time": 1.1273744106292725
    },
    {
        "BLOCK_SIZE_M": 32,
        "BLOCK_SIZE_N": 128,
        "BLOCK_SIZE_K": 64,
        "GROUP_SIZE_M": 8,
        "num_stages": 3,
        "num_warps": 2,
        "ms": 0.26488831639289856,
        "min_ms": 0.26488831639289856,
        "max_ms": 0.26488831639289856,
        "compile_time": 2.1449806690216064
    },
    {
        "BLOCK_SIZE_M": 64,
        "BLOCK_SIZE_N": 64,
        "BLOCK_SIZE_K": 16,
        "GROUP_SIZE_M": 8,
        "num_stages": 7,
        "num_warps": 2,
        "ms": 0.2649686336517334,
        "min_ms": 0.2649686336517334,
        "max_ms": 0.2649686336517334,
        "compile_time": 1.8262901306152344
    },
    {
        "BLOCK_SIZE_M": 64,
        "BLOCK_SIZE_N": 64,
        "BLOCK_SIZE_K": 16,
        "GROUP_SIZE_M": 8,
        "num_stages": 3,
        "num_warps": 2,
        "ms": 0.2651035189628601,
        "min_ms": 0.2651035189628601,
        "max_ms": 0.2651035189628601,
        "compile_time": 1.780665636062622
    },
    {
        "BLOCK_SIZE_M": 32,
        "BLOCK_SIZE_N": 128,
        "BLOCK_SIZE_K": 32,
        "GROUP_SIZE_M": 8,
        "num_stages": 5,
        "num_warps": 2,
        "ms": 0.2654682993888855,
        "min_ms": 0.2654682993888855,
        "max_ms": 0.2654682993888855,
        "compile_time": 1.927969217300415
    },
    {
        "BLOCK_SIZE_M": 32,
        "BLOCK_SIZE_N": 256,
        "BLOCK_SIZE_K": 16,
        "GROUP_SIZE_M": 8,
        "num_stages": 5,
        "num_warps": 4,
        "ms": 0.26582980155944824,
        "min_ms": 0.26582980155944824,
        "max_ms": 0.26582980155944824,
        "compile_time": 1.1302683353424072
    },
    {
        "BLOCK_SIZE_M": 64,
        "BLOCK_SIZE_N": 64,
        "BLOCK_SIZE_K": 16,
        "GROUP_SIZE_M": 8,
        "num_stages": 6,
        "num_warps": 2,
        "ms": 0.26590996980667114,
        "min_ms": 0.26590996980667114,
        "max_ms": 0.26590996980667114,
        "compile_time": 1.8281245231628418
    },
    {
        "BLOCK_SIZE_M": 128,
        "BLOCK_SIZE_N": 128,
        "BLOCK_SIZE_K": 64,
        "GROUP_SIZE_M": 8,
        "num_stages": 5,
        "num_warps": 32,
        "ms": 0.2660648226737976,
        "min_ms": 0.2660648226737976,
        "max_ms": 0.2660648226737976,
        "compile_time": 1.7822558879852295
    },
    {
        "BLOCK_SIZE_M": 32,
        "BLOCK_SIZE_N": 512,
        "BLOCK_SIZE_K": 16,
        "GROUP_SIZE_M": 8,
        "num_stages": 6,
        "num_warps": 8,
        "ms": 0.26611191034317017,
        "min_ms": 0.26611191034317017,
        "max_ms": 0.26611191034317017,
        "compile_time": 1.7733728885650635
    },
    {
        "BLOCK_SIZE_M": 64,
        "BLOCK_SIZE_N": 128,
        "BLOCK_SIZE_K": 64,
        "GROUP_SIZE_M": 8,
        "num_stages": 4,
        "num_warps": 16,
        "ms": 0.2663372755050659,
        "min_ms": 0.2663372755050659,
        "max_ms": 0.2663372755050659,
        "compile_time": 1.139841079711914
    },
    {
        "BLOCK_SIZE_M": 256,
        "BLOCK_SIZE_N": 64,
        "BLOCK_SIZE_K": 128,
        "GROUP_SIZE_M": 8,
        "num_stages": 2,
        "num_warps": 8,
        "ms": 0.26634177565574646,
        "min_ms": 0.26634177565574646,
        "max_ms": 0.26634177565574646,
        "compile_time": 2.4473986625671387
    },
    {
        "BLOCK_SIZE_M": 32,
        "BLOCK_SIZE_N": 256,
        "BLOCK_SIZE_K": 64,
        "GROUP_SIZE_M": 8,
        "num_stages": 4,
        "num_warps": 4,
        "ms": 0.26643723249435425,
        "min_ms": 0.26643723249435425,
        "max_ms": 0.26643723249435425,
        "compile_time": 2.2192680835723877
    },
    {
        "BLOCK_SIZE_M": 32,
        "BLOCK_SIZE_N": 256,
        "BLOCK_SIZE_K": 64,
        "GROUP_SIZE_M": 8,
        "num_stages": 4,
        "num_warps": 8,
        "ms": 0.26648828387260437,
        "min_ms": 0.26648828387260437,
        "max_ms": 0.26648828387260437,
        "compile_time": 1.767486810684204
    },
    {
        "BLOCK_SIZE_M": 128,
        "BLOCK_SIZE_N": 256,
        "BLOCK_SIZE_K": 64,
        "GROUP_SIZE_M": 8,
        "num_stages": 1,
        "num_warps": 8,
        "ms": 0.2665395140647888,
        "min_ms": 0.2665395140647888,
        "max_ms": 0.2665395140647888,
        "compile_time": 2.304152250289917
    },
    {
        "BLOCK_SIZE_M": 32,
        "BLOCK_SIZE_N": 512,
        "BLOCK_SIZE_K": 32,
        "GROUP_SIZE_M": 8,
        "num_stages": 5,
        "num_warps": 4,
        "ms": 0.26660341024398804,
        "min_ms": 0.26660341024398804,
        "max_ms": 0.26660341024398804,
        "compile_time": 2.5770716667175293
    },
    {
        "BLOCK_SIZE_M": 64,
        "BLOCK_SIZE_N": 256,
        "BLOCK_SIZE_K": 128,
        "GROUP_SIZE_M": 8,
        "num_stages": 2,
        "num_warps": 8,
        "ms": 0.2666286826133728,
        "min_ms": 0.2666286826133728,
        "max_ms": 0.2666286826133728,
        "compile_time": 2.249875068664551
    },
    {
        "BLOCK_SIZE_M": 32,
        "BLOCK_SIZE_N": 512,
        "BLOCK_SIZE_K": 16,
        "GROUP_SIZE_M": 8,
        "num_stages": 8,
        "num_warps": 8,
        "ms": 0.26700833439826965,
        "min_ms": 0.26700833439826965,
        "max_ms": 0.26700833439826965,
        "compile_time": 1.1139907836914062
    },
    {
        "BLOCK_SIZE_M": 128,
        "BLOCK_SIZE_N": 128,
        "BLOCK_SIZE_K": 256,
        "GROUP_SIZE_M": 8,
        "num_stages": 2,
        "num_warps": 16,
        "ms": 0.2672449052333832,
        "min_ms": 0.2672449052333832,
        "max_ms": 0.2672449052333832,
        "compile_time": 2.186688184738159
    },
    {
        "BLOCK_SIZE_M": 256,
        "BLOCK_SIZE_N": 32,
        "BLOCK_SIZE_K": 64,
        "GROUP_SIZE_M": 8,
        "num_stages": 4,
        "num_warps": 8,
        "ms": 0.26732197403907776,
        "min_ms": 0.26732197403907776,
        "max_ms": 0.26732197403907776,
        "compile_time": 2.0397703647613525
    },
    {
        "BLOCK_SIZE_M": 128,
        "BLOCK_SIZE_N": 128,
        "BLOCK_SIZE_K": 64,
        "GROUP_SIZE_M": 8,
        "num_stages": 2,
        "num_warps": 16,
        "ms": 0.26733312010765076,
        "min_ms": 0.26733312010765076,
        "max_ms": 0.26733312010765076,
        "compile_time": 1.1993827819824219
    },
    {
        "BLOCK_SIZE_M": 32,
        "BLOCK_SIZE_N": 512,
        "BLOCK_SIZE_K": 16,
        "GROUP_SIZE_M": 8,
        "num_stages": 7,
        "num_warps": 8,
        "ms": 0.2675468325614929,
        "min_ms": 0.2675468325614929,
        "max_ms": 0.2675468325614929,
        "compile_time": 1.1289012432098389
    },
    {
        "BLOCK_SIZE_M": 64,
        "BLOCK_SIZE_N": 128,
        "BLOCK_SIZE_K": 64,
        "GROUP_SIZE_M": 8,
        "num_stages": 3,
        "num_warps": 16,
        "ms": 0.267631471157074,
        "min_ms": 0.267631471157074,
        "max_ms": 0.267631471157074,
        "compile_time": 1.131089210510254
    },
    {
        "BLOCK_SIZE_M": 64,
        "BLOCK_SIZE_N": 64,
        "BLOCK_SIZE_K": 16,
        "GROUP_SIZE_M": 8,
        "num_stages": 4,
        "num_warps": 2,
        "ms": 0.267887681722641,
        "min_ms": 0.267887681722641,
        "max_ms": 0.267887681722641,
        "compile_time": 1.837796688079834
    },
    {
        "BLOCK_SIZE_M": 64,
        "BLOCK_SIZE_N": 128,
        "BLOCK_SIZE_K": 64,
        "GROUP_SIZE_M": 8,
        "num_stages": 5,
        "num_warps": 16,
        "ms": 0.2679322361946106,
        "min_ms": 0.2679322361946106,
        "max_ms": 0.2679322361946106,
        "compile_time": 1.118661880493164
    },
    {
        "BLOCK_SIZE_M": 64,
        "BLOCK_SIZE_N": 64,
        "BLOCK_SIZE_K": 16,
        "GROUP_SIZE_M": 8,
        "num_stages": 6,
        "num_warps": 4,
        "ms": 0.26796865463256836,
        "min_ms": 0.26796865463256836,
        "max_ms": 0.26796865463256836,
        "compile_time": 1.173732042312622
    },
    {
        "BLOCK_SIZE_M": 32,
        "BLOCK_SIZE_N": 256,
        "BLOCK_SIZE_K": 16,
        "GROUP_SIZE_M": 8,
        "num_stages": 5,
        "num_warps": 8,
        "ms": 0.26801204681396484,
        "min_ms": 0.26801204681396484,
        "max_ms": 0.26801204681396484,
        "compile_time": 1.5560760498046875
    },
    {
        "BLOCK_SIZE_M": 32,
        "BLOCK_SIZE_N": 256,
        "BLOCK_SIZE_K": 128,
        "GROUP_SIZE_M": 8,
        "num_stages": 2,
        "num_warps": 4,
        "ms": 0.26803311705589294,
        "min_ms": 0.26803311705589294,
        "max_ms": 0.26803311705589294,
        "compile_time": 2.5751023292541504
    },
    {
        "BLOCK_SIZE_M": 32,
        "BLOCK_SIZE_N": 128,
        "BLOCK_SIZE_K": 128,
        "GROUP_SIZE_M": 8,
        "num_stages": 2,
        "num_warps": 4,
        "ms": 0.26817548274993896,
        "min_ms": 0.26817548274993896,
        "max_ms": 0.26817548274993896,
        "compile_time": 1.9573214054107666
    },
    {
        "BLOCK_SIZE_M": 32,
        "BLOCK_SIZE_N": 256,
        "BLOCK_SIZE_K": 16,
        "GROUP_SIZE_M": 8,
        "num_stages": 4,
        "num_warps": 8,
        "ms": 0.26838645339012146,
        "min_ms": 0.26838645339012146,
        "max_ms": 0.26838645339012146,
        "compile_time": 1.1463608741760254
    },
    {
        "BLOCK_SIZE_M": 256,
        "BLOCK_SIZE_N": 32,
        "BLOCK_SIZE_K": 32,
        "GROUP_SIZE_M": 8,
        "num_stages": 2,
        "num_warps": 2,
        "ms": 0.2685631513595581,
        "min_ms": 0.2685631513595581,
        "max_ms": 0.2685631513595581,
        "compile_time": 2.639954090118408
    },
    {
        "BLOCK_SIZE_M": 256,
        "BLOCK_SIZE_N": 32,
        "BLOCK_SIZE_K": 64,
        "GROUP_SIZE_M": 8,
        "num_stages": 5,
        "num_warps": 8,
        "ms": 0.26868677139282227,
        "min_ms": 0.26868677139282227,
        "max_ms": 0.26868677139282227,
        "compile_time": 2.096611499786377
    },
    {
        "BLOCK_SIZE_M": 64,
        "BLOCK_SIZE_N": 64,
        "BLOCK_SIZE_K": 16,
        "GROUP_SIZE_M": 8,
        "num_stages": 5,
        "num_warps": 2,
        "ms": 0.2689105272293091,
        "min_ms": 0.2689105272293091,
        "max_ms": 0.2689105272293091,
        "compile_time": 1.7946696281433105
    },
    {
        "BLOCK_SIZE_M": 32,
        "BLOCK_SIZE_N": 128,
        "BLOCK_SIZE_K": 64,
        "GROUP_SIZE_M": 8,
        "num_stages": 5,
        "num_warps": 2,
        "ms": 0.2694095969200134,
        "min_ms": 0.2694095969200134,
        "max_ms": 0.2694095969200134,
        "compile_time": 2.274358034133911
    },
    {
        "BLOCK_SIZE_M": 128,
        "BLOCK_SIZE_N": 32,
        "BLOCK_SIZE_K": 64,
        "GROUP_SIZE_M": 8,
        "num_stages": 3,
        "num_warps": 4,
        "ms": 0.2694264054298401,
        "min_ms": 0.2694264054298401,
        "max_ms": 0.2694264054298401,
        "compile_time": 1.9600894451141357
    },
    {
        "BLOCK_SIZE_M": 64,
        "BLOCK_SIZE_N": 128,
        "BLOCK_SIZE_K": 64,
        "GROUP_SIZE_M": 8,
        "num_stages": 4,
        "num_warps": 2,
        "ms": 0.26948174834251404,
        "min_ms": 0.26948174834251404,
        "max_ms": 0.26948174834251404,
        "compile_time": 2.6794097423553467
    },
    {
        "BLOCK_SIZE_M": 32,
        "BLOCK_SIZE_N": 256,
        "BLOCK_SIZE_K": 16,
        "GROUP_SIZE_M": 8,
        "num_stages": 6,
        "num_warps": 8,
        "ms": 0.2696705460548401,
        "min_ms": 0.2696705460548401,
        "max_ms": 0.2696705460548401,
        "compile_time": 1.6388282775878906
    },
    {
        "BLOCK_SIZE_M": 128,
        "BLOCK_SIZE_N": 64,
        "BLOCK_SIZE_K": 32,
        "GROUP_SIZE_M": 8,
        "num_stages": 8,
        "num_warps": 2,
        "ms": 0.2696935534477234,
        "min_ms": 0.2696935534477234,
        "max_ms": 0.2696935534477234,
        "compile_time": 2.709352493286133
    },
    {
        "BLOCK_SIZE_M": 64,
        "BLOCK_SIZE_N": 128,
        "BLOCK_SIZE_K": 32,
        "GROUP_SIZE_M": 8,
        "num_stages": 1,
        "num_warps": 4,
        "ms": 0.2697008550167084,
        "min_ms": 0.2697008550167084,
        "max_ms": 0.2697008550167084,
        "compile_time": 1.7602581977844238
    },
    {
        "BLOCK_SIZE_M": 64,
        "BLOCK_SIZE_N": 128,
        "BLOCK_SIZE_K": 16,
        "GROUP_SIZE_M": 8,
        "num_stages": 4,
        "num_warps": 8,
        "ms": 0.26974624395370483,
        "min_ms": 0.26974624395370483,
        "max_ms": 0.26974624395370483,
        "compile_time": 1.6614470481872559
    },
    {
        "BLOCK_SIZE_M": 128,
        "BLOCK_SIZE_N": 128,
        "BLOCK_SIZE_K": 64,
        "GROUP_SIZE_M": 8,
        "num_stages": 6,
        "num_warps": 32,
        "ms": 0.2698211073875427,
        "min_ms": 0.2698211073875427,
        "max_ms": 0.2698211073875427,
        "compile_time": 1.7831816673278809
    },
    {
        "BLOCK_SIZE_M": 64,
        "BLOCK_SIZE_N": 64,
        "BLOCK_SIZE_K": 128,
        "GROUP_SIZE_M": 8,
        "num_stages": 4,
        "num_warps": 8,
        "ms": 0.2699987292289734,
        "min_ms": 0.2699987292289734,
        "max_ms": 0.2699987292289734,
        "compile_time": 1.1403090953826904
    },
    {
        "BLOCK_SIZE_M": 64,
        "BLOCK_SIZE_N": 128,
        "BLOCK_SIZE_K": 64,
        "GROUP_SIZE_M": 8,
        "num_stages": 6,
        "num_warps": 16,
        "ms": 0.270070344209671,
        "min_ms": 0.270070344209671,
        "max_ms": 0.270070344209671,
        "compile_time": 1.157034158706665
    },
    {
        "BLOCK_SIZE_M": 512,
        "BLOCK_SIZE_N": 64,
        "BLOCK_SIZE_K": 32,
        "GROUP_SIZE_M": 8,
        "num_stages": 4,
        "num_warps": 16,
        "ms": 0.2701479494571686,
        "min_ms": 0.2701479494571686,
        "max_ms": 0.2701479494571686,
        "compile_time": 2.259042263031006
    },
    {
        "BLOCK_SIZE_M": 128,
        "BLOCK_SIZE_N": 32,
        "BLOCK_SIZE_K": 64,
        "GROUP_SIZE_M": 8,
        "num_stages": 4,
        "num_warps": 2,
        "ms": 0.2701728045940399,
        "min_ms": 0.2701728045940399,
        "max_ms": 0.2701728045940399,
        "compile_time": 2.3945226669311523
    },
    {
        "BLOCK_SIZE_M": 256,
        "BLOCK_SIZE_N": 64,
        "BLOCK_SIZE_K": 128,
        "GROUP_SIZE_M": 8,
        "num_stages": 3,
        "num_warps": 32,
        "ms": 0.27036112546920776,
        "min_ms": 0.27036112546920776,
        "max_ms": 0.27036112546920776,
        "compile_time": 2.1039671897888184
    },
    {
        "BLOCK_SIZE_M": 64,
        "BLOCK_SIZE_N": 64,
        "BLOCK_SIZE_K": 16,
        "GROUP_SIZE_M": 8,
        "num_stages": 5,
        "num_warps": 4,
        "ms": 0.2707135081291199,
        "min_ms": 0.2707135081291199,
        "max_ms": 0.2707135081291199,
        "compile_time": 1.1709654331207275
    },
    {
        "BLOCK_SIZE_M": 64,
        "BLOCK_SIZE_N": 128,
        "BLOCK_SIZE_K": 128,
        "GROUP_SIZE_M": 8,
        "num_stages": 1,
        "num_warps": 4,
        "ms": 0.27087220549583435,
        "min_ms": 0.27087220549583435,
        "max_ms": 0.27087220549583435,
        "compile_time": 2.136003017425537
    },
    {
        "BLOCK_SIZE_M": 256,
        "BLOCK_SIZE_N": 32,
        "BLOCK_SIZE_K": 32,
        "GROUP_SIZE_M": 8,
        "num_stages": 4,
        "num_warps": 8,
        "ms": 0.2708982527256012,
        "min_ms": 0.2708982527256012,
        "max_ms": 0.2708982527256012,
        "compile_time": 1.9350407123565674
    },
    {
        "BLOCK_SIZE_M": 64,
        "BLOCK_SIZE_N": 64,
        "BLOCK_SIZE_K": 64,
        "GROUP_SIZE_M": 8,
        "num_stages": 2,
        "num_warps": 8,
        "ms": 0.27096661925315857,
        "min_ms": 0.27096661925315857,
        "max_ms": 0.27096661925315857,
        "compile_time": 1.1315009593963623
    },
    {
        "BLOCK_SIZE_M": 64,
        "BLOCK_SIZE_N": 128,
        "BLOCK_SIZE_K": 16,
        "GROUP_SIZE_M": 8,
        "num_stages": 5,
        "num_warps": 8,
        "ms": 0.27108141779899597,
        "min_ms": 0.27108141779899597,
        "max_ms": 0.27108141779899597,
        "compile_time": 1.1539208889007568
    },
    {
        "BLOCK_SIZE_M": 64,
        "BLOCK_SIZE_N": 128,
        "BLOCK_SIZE_K": 16,
        "GROUP_SIZE_M": 8,
        "num_stages": 6,
        "num_warps": 8,
        "ms": 0.2716180682182312,
        "min_ms": 0.2716180682182312,
        "max_ms": 0.2716180682182312,
        "compile_time": 1.6124060153961182
    },
    {
        "BLOCK_SIZE_M": 64,
        "BLOCK_SIZE_N": 64,
        "BLOCK_SIZE_K": 16,
        "GROUP_SIZE_M": 8,
        "num_stages": 4,
        "num_warps": 4,
        "ms": 0.27165231108665466,
        "min_ms": 0.27165231108665466,
        "max_ms": 0.27165231108665466,
        "compile_time": 1.20713210105896
    },
    {
        "BLOCK_SIZE_M": 32,
        "BLOCK_SIZE_N": 128,
        "BLOCK_SIZE_K": 16,
        "GROUP_SIZE_M": 8,
        "num_stages": 3,
        "num_warps": 2,
        "ms": 0.2720473110675812,
        "min_ms": 0.2720473110675812,
        "max_ms": 0.2720473110675812,
        "compile_time": 1.6576778888702393
    },
    {
        "BLOCK_SIZE_M": 64,
        "BLOCK_SIZE_N": 64,
        "BLOCK_SIZE_K": 128,
        "GROUP_SIZE_M": 8,
        "num_stages": 5,
        "num_warps": 8,
        "ms": 0.2720675766468048,
        "min_ms": 0.2720675766468048,
        "max_ms": 0.2720675766468048,
        "compile_time": 1.1500730514526367
    },
    {
        "BLOCK_SIZE_M": 32,
        "BLOCK_SIZE_N": 256,
        "BLOCK_SIZE_K": 32,
        "GROUP_SIZE_M": 8,
        "num_stages": 3,
        "num_warps": 2,
        "ms": 0.2721056342124939,
        "min_ms": 0.2721056342124939,
        "max_ms": 0.2721056342124939,
        "compile_time": 2.4730005264282227
    },
    {
        "BLOCK_SIZE_M": 128,
        "BLOCK_SIZE_N": 32,
        "BLOCK_SIZE_K": 32,
        "GROUP_SIZE_M": 8,
        "num_stages": 6,
        "num_warps": 2,
        "ms": 0.2725249230861664,
        "min_ms": 0.2725249230861664,
        "max_ms": 0.2725249230861664,
        "compile_time": 2.135408639907837
    },
    {
        "BLOCK_SIZE_M": 32,
        "BLOCK_SIZE_N": 128,
        "BLOCK_SIZE_K": 64,
        "GROUP_SIZE_M": 8,
        "num_stages": 4,
        "num_warps": 2,
        "ms": 0.27283406257629395,
        "min_ms": 0.27283406257629395,
        "max_ms": 0.27283406257629395,
        "compile_time": 2.2265195846557617
    },
    {
        "BLOCK_SIZE_M": 64,
        "BLOCK_SIZE_N": 128,
        "BLOCK_SIZE_K": 16,
        "GROUP_SIZE_M": 8,
        "num_stages": 7,
        "num_warps": 8,
        "ms": 0.27284127473831177,
        "min_ms": 0.27284127473831177,
        "max_ms": 0.27284127473831177,
        "compile_time": 1.6850931644439697
    },
    {
        "BLOCK_SIZE_M": 64,
        "BLOCK_SIZE_N": 256,
        "BLOCK_SIZE_K": 64,
        "GROUP_SIZE_M": 8,
        "num_stages": 1,
        "num_warps": 4,
        "ms": 0.27289044857025146,
        "min_ms": 0.27289044857025146,
        "max_ms": 0.27289044857025146,
        "compile_time": 2.35172438621521
    },
    {
        "BLOCK_SIZE_M": 32,
        "BLOCK_SIZE_N": 128,
        "BLOCK_SIZE_K": 16,
        "GROUP_SIZE_M": 8,
        "num_stages": 4,
        "num_warps": 2,
        "ms": 0.27304911613464355,
        "min_ms": 0.27304911613464355,
        "max_ms": 0.27304911613464355,
        "compile_time": 1.7160124778747559
    },
    {
        "BLOCK_SIZE_M": 32,
        "BLOCK_SIZE_N": 128,
        "BLOCK_SIZE_K": 32,
        "GROUP_SIZE_M": 8,
        "num_stages": 7,
        "num_warps": 2,
        "ms": 0.27304989099502563,
        "min_ms": 0.27304989099502563,
        "max_ms": 0.27304989099502563,
        "compile_time": 1.9747447967529297
    },
    {
        "BLOCK_SIZE_M": 256,
        "BLOCK_SIZE_N": 32,
        "BLOCK_SIZE_K": 32,
        "GROUP_SIZE_M": 8,
        "num_stages": 5,
        "num_warps": 8,
        "ms": 0.2730801999568939,
        "min_ms": 0.2730801999568939,
        "max_ms": 0.2730801999568939,
        "compile_time": 1.924187183380127
    },
    {
        "BLOCK_SIZE_M": 256,
        "BLOCK_SIZE_N": 32,
        "BLOCK_SIZE_K": 32,
        "GROUP_SIZE_M": 8,
        "num_stages": 3,
        "num_warps": 8,
        "ms": 0.27316832542419434,
        "min_ms": 0.27316832542419434,
        "max_ms": 0.27316832542419434,
        "compile_time": 1.8973736763000488
    },
    {
        "BLOCK_SIZE_M": 64,
        "BLOCK_SIZE_N": 128,
        "BLOCK_SIZE_K": 16,
        "GROUP_SIZE_M": 8,
        "num_stages": 3,
        "num_warps": 8,
        "ms": 0.2733011245727539,
        "min_ms": 0.2733011245727539,
        "max_ms": 0.2733011245727539,
        "compile_time": 1.6621944904327393
    },
    {
        "BLOCK_SIZE_M": 64,
        "BLOCK_SIZE_N": 128,
        "BLOCK_SIZE_K": 64,
        "GROUP_SIZE_M": 8,
        "num_stages": 7,
        "num_warps": 16,
        "ms": 0.2733176350593567,
        "min_ms": 0.2733176350593567,
        "max_ms": 0.2733176350593567,
        "compile_time": 1.7121362686157227
    },
    {
        "BLOCK_SIZE_M": 64,
        "BLOCK_SIZE_N": 128,
        "BLOCK_SIZE_K": 16,
        "GROUP_SIZE_M": 8,
        "num_stages": 8,
        "num_warps": 8,
        "ms": 0.2733856737613678,
        "min_ms": 0.2733856737613678,
        "max_ms": 0.2733856737613678,
        "compile_time": 1.1598236560821533
    },
    {
        "BLOCK_SIZE_M": 64,
        "BLOCK_SIZE_N": 64,
        "BLOCK_SIZE_K": 32,
        "GROUP_SIZE_M": 8,
        "num_stages": 6,
        "num_warps": 8,
        "ms": 0.27359455823898315,
        "min_ms": 0.27359455823898315,
        "max_ms": 0.27359455823898315,
        "compile_time": 1.6106665134429932
    },
    {
        "BLOCK_SIZE_M": 128,
        "BLOCK_SIZE_N": 32,
        "BLOCK_SIZE_K": 32,
        "GROUP_SIZE_M": 8,
        "num_stages": 4,
        "num_warps": 4,
        "ms": 0.27410760521888733,
        "min_ms": 0.27410760521888733,
        "max_ms": 0.27410760521888733,
        "compile_time": 1.2070517539978027
    },
    {
        "BLOCK_SIZE_M": 256,
        "BLOCK_SIZE_N": 128,
        "BLOCK_SIZE_K": 128,
        "GROUP_SIZE_M": 8,
        "num_stages": 1,
        "num_warps": 8,
        "ms": 0.27411073446273804,
        "min_ms": 0.27411073446273804,
        "max_ms": 0.27411073446273804,
        "compile_time": 2.7788333892822266
    },
    {
        "BLOCK_SIZE_M": 128,
        "BLOCK_SIZE_N": 32,
        "BLOCK_SIZE_K": 32,
        "GROUP_SIZE_M": 8,
        "num_stages": 3,
        "num_warps": 4,
        "ms": 0.2743944227695465,
        "min_ms": 0.2743944227695465,
        "max_ms": 0.2743944227695465,
        "compile_time": 1.8246800899505615
    },
    {
        "BLOCK_SIZE_M": 128,
        "BLOCK_SIZE_N": 128,
        "BLOCK_SIZE_K": 128,
        "GROUP_SIZE_M": 8,
        "num_stages": 1,
        "num_warps": 8,
        "ms": 0.2745034694671631,
        "min_ms": 0.2745034694671631,
        "max_ms": 0.2745034694671631,
        "compile_time": 2.0507795810699463
    },
    {
        "BLOCK_SIZE_M": 128,
        "BLOCK_SIZE_N": 32,
        "BLOCK_SIZE_K": 32,
        "GROUP_SIZE_M": 8,
        "num_stages": 4,
        "num_warps": 2,
        "ms": 0.2745044231414795,
        "min_ms": 0.2745044231414795,
        "max_ms": 0.2745044231414795,
        "compile_time": 2.060805559158325
    },
    {
        "BLOCK_SIZE_M": 64,
        "BLOCK_SIZE_N": 64,
        "BLOCK_SIZE_K": 32,
        "GROUP_SIZE_M": 8,
        "num_stages": 3,
        "num_warps": 8,
        "ms": 0.27456021308898926,
        "min_ms": 0.27456021308898926,
        "max_ms": 0.27456021308898926,
        "compile_time": 1.6320617198944092
    },
    {
        "BLOCK_SIZE_M": 128,
        "BLOCK_SIZE_N": 32,
        "BLOCK_SIZE_K": 64,
        "GROUP_SIZE_M": 8,
        "num_stages": 5,
        "num_warps": 2,
        "ms": 0.2746214270591736,
        "min_ms": 0.2746214270591736,
        "max_ms": 0.2746214270591736,
        "compile_time": 2.497840166091919
    },
    {
        "BLOCK_SIZE_M": 128,
        "BLOCK_SIZE_N": 32,
        "BLOCK_SIZE_K": 32,
        "GROUP_SIZE_M": 8,
        "num_stages": 3,
        "num_warps": 2,
        "ms": 0.2747519016265869,
        "min_ms": 0.2747519016265869,
        "max_ms": 0.2747519016265869,
        "compile_time": 2.0148444175720215
    },
    {
        "BLOCK_SIZE_M": 32,
        "BLOCK_SIZE_N": 256,
        "BLOCK_SIZE_K": 16,
        "GROUP_SIZE_M": 8,
        "num_stages": 3,
        "num_warps": 8,
        "ms": 0.27479085326194763,
        "min_ms": 0.27479085326194763,
        "max_ms": 0.27479085326194763,
        "compile_time": 1.1310393810272217
    },
    {
        "BLOCK_SIZE_M": 64,
        "BLOCK_SIZE_N": 64,
        "BLOCK_SIZE_K": 16,
        "GROUP_SIZE_M": 8,
        "num_stages": 8,
        "num_warps": 4,
        "ms": 0.2747979760169983,
        "min_ms": 0.2747979760169983,
        "max_ms": 0.2747979760169983,
        "compile_time": 1.1630148887634277
    },
    {
        "BLOCK_SIZE_M": 32,
        "BLOCK_SIZE_N": 128,
        "BLOCK_SIZE_K": 16,
        "GROUP_SIZE_M": 8,
        "num_stages": 7,
        "num_warps": 2,
        "ms": 0.2748751938343048,
        "min_ms": 0.2748751938343048,
        "max_ms": 0.2748751938343048,
        "compile_time": 1.7792887687683105
    },
    {
        "BLOCK_SIZE_M": 64,
        "BLOCK_SIZE_N": 64,
        "BLOCK_SIZE_K": 32,
        "GROUP_SIZE_M": 8,
        "num_stages": 7,
        "num_warps": 8,
        "ms": 0.2749796211719513,
        "min_ms": 0.2749796211719513,
        "max_ms": 0.2749796211719513,
        "compile_time": 1.6677637100219727
    },
    {
        "BLOCK_SIZE_M": 64,
        "BLOCK_SIZE_N": 256,
        "BLOCK_SIZE_K": 256,
        "GROUP_SIZE_M": 8,
        "num_stages": 1,
        "num_warps": 16,
        "ms": 0.2750083804130554,
        "min_ms": 0.2750083804130554,
        "max_ms": 0.2750083804130554,
        "compile_time": 1.1387484073638916
    },
    {
        "BLOCK_SIZE_M": 64,
        "BLOCK_SIZE_N": 64,
        "BLOCK_SIZE_K": 64,
        "GROUP_SIZE_M": 8,
        "num_stages": 7,
        "num_warps": 8,
        "ms": 0.2753591239452362,
        "min_ms": 0.2753591239452362,
        "max_ms": 0.2753591239452362,
        "compile_time": 1.1491000652313232
    },
    {
        "BLOCK_SIZE_M": 128,
        "BLOCK_SIZE_N": 32,
        "BLOCK_SIZE_K": 32,
        "GROUP_SIZE_M": 8,
        "num_stages": 5,
        "num_warps": 4,
        "ms": 0.27555209398269653,
        "min_ms": 0.27555209398269653,
        "max_ms": 0.27555209398269653,
        "compile_time": 1.8744747638702393
    },
    {
        "BLOCK_SIZE_M": 64,
        "BLOCK_SIZE_N": 64,
        "BLOCK_SIZE_K": 32,
        "GROUP_SIZE_M": 8,
        "num_stages": 5,
        "num_warps": 8,
        "ms": 0.2757123112678528,
        "min_ms": 0.2757123112678528,
        "max_ms": 0.2757123112678528,
        "compile_time": 1.162510871887207
    },
    {
        "BLOCK_SIZE_M": 32,
        "BLOCK_SIZE_N": 128,
        "BLOCK_SIZE_K": 16,
        "GROUP_SIZE_M": 8,
        "num_stages": 6,
        "num_warps": 2,
        "ms": 0.27592188119888306,
        "min_ms": 0.27592188119888306,
        "max_ms": 0.27592188119888306,
        "compile_time": 1.7713782787322998
    },
    {
        "BLOCK_SIZE_M": 256,
        "BLOCK_SIZE_N": 32,
        "BLOCK_SIZE_K": 64,
        "GROUP_SIZE_M": 8,
        "num_stages": 2,
        "num_warps": 4,
        "ms": 0.27614736557006836,
        "min_ms": 0.27614736557006836,
        "max_ms": 0.27614736557006836,
        "compile_time": 2.2862701416015625
    },
    {
        "BLOCK_SIZE_M": 64,
        "BLOCK_SIZE_N": 64,
        "BLOCK_SIZE_K": 32,
        "GROUP_SIZE_M": 8,
        "num_stages": 4,
        "num_warps": 8,
        "ms": 0.2765553593635559,
        "min_ms": 0.2765553593635559,
        "max_ms": 0.2765553593635559,
        "compile_time": 1.1540424823760986
    },
    {
        "BLOCK_SIZE_M": 256,
        "BLOCK_SIZE_N": 32,
        "BLOCK_SIZE_K": 128,
        "GROUP_SIZE_M": 8,
        "num_stages": 2,
        "num_warps": 4,
        "ms": 0.27658528089523315,
        "min_ms": 0.27658528089523315,
        "max_ms": 0.27658528089523315,
        "compile_time": 2.674811601638794
    },
    {
        "BLOCK_SIZE_M": 32,
        "BLOCK_SIZE_N": 128,
        "BLOCK_SIZE_K": 32,
        "GROUP_SIZE_M": 8,
        "num_stages": 8,
        "num_warps": 2,
        "ms": 0.2766045928001404,
        "min_ms": 0.2766045928001404,
        "max_ms": 0.2766045928001404,
        "compile_time": 2.0254836082458496
    },
    {
        "BLOCK_SIZE_M": 32,
        "BLOCK_SIZE_N": 128,
        "BLOCK_SIZE_K": 64,
        "GROUP_SIZE_M": 8,
        "num_stages": 4,
        "num_warps": 4,
        "ms": 0.27674558758735657,
        "min_ms": 0.27674558758735657,
        "max_ms": 0.27674558758735657,
        "compile_time": 1.7834546566009521
    },
    {
        "BLOCK_SIZE_M": 64,
        "BLOCK_SIZE_N": 256,
        "BLOCK_SIZE_K": 128,
        "GROUP_SIZE_M": 8,
        "num_stages": 1,
        "num_warps": 4,
        "ms": 0.2768791615962982,
        "min_ms": 0.2768791615962982,
        "max_ms": 0.2768791615962982,
        "compile_time": 2.8846333026885986
    },
    {
        "BLOCK_SIZE_M": 32,
        "BLOCK_SIZE_N": 128,
        "BLOCK_SIZE_K": 64,
        "GROUP_SIZE_M": 8,
        "num_stages": 4,
        "num_warps": 8,
        "ms": 0.27690765261650085,
        "min_ms": 0.27690765261650085,
        "max_ms": 0.27690765261650085,
        "compile_time": 1.0636157989501953
    },
    {
        "BLOCK_SIZE_M": 128,
        "BLOCK_SIZE_N": 32,
        "BLOCK_SIZE_K": 64,
        "GROUP_SIZE_M": 8,
        "num_stages": 3,
        "num_warps": 2,
        "ms": 0.27708470821380615,
        "min_ms": 0.27708470821380615,
        "max_ms": 0.27708470821380615,
        "compile_time": 2.353195905685425
    },
    {
        "BLOCK_SIZE_M": 64,
        "BLOCK_SIZE_N": 128,
        "BLOCK_SIZE_K": 16,
        "GROUP_SIZE_M": 8,
        "num_stages": 2,
        "num_warps": 4,
        "ms": 0.27708643674850464,
        "min_ms": 0.27708643674850464,
        "max_ms": 0.27708643674850464,
        "compile_time": 1.138014554977417
    },
    {
        "BLOCK_SIZE_M": 32,
        "BLOCK_SIZE_N": 256,
        "BLOCK_SIZE_K": 128,
        "GROUP_SIZE_M": 8,
        "num_stages": 3,
        "num_warps": 4,
        "ms": 0.2773440480232239,
        "min_ms": 0.2773440480232239,
        "max_ms": 0.2773440480232239,
        "compile_time": 3.198967456817627
    },
    {
        "BLOCK_SIZE_M": 128,
        "BLOCK_SIZE_N": 256,
        "BLOCK_SIZE_K": 16,
        "GROUP_SIZE_M": 8,
        "num_stages": 6,
        "num_warps": 16,
        "ms": 0.27742600440979004,
        "min_ms": 0.27742600440979004,
        "max_ms": 0.27742600440979004,
        "compile_time": 1.204246997833252
    },
    {
        "BLOCK_SIZE_M": 32,
        "BLOCK_SIZE_N": 128,
        "BLOCK_SIZE_K": 64,
        "GROUP_SIZE_M": 8,
        "num_stages": 5,
        "num_warps": 4,
        "ms": 0.277470201253891,
        "min_ms": 0.277470201253891,
        "max_ms": 0.277470201253891,
        "compile_time": 1.1339747905731201
    },
    {
        "BLOCK_SIZE_M": 128,
        "BLOCK_SIZE_N": 256,
        "BLOCK_SIZE_K": 128,
        "GROUP_SIZE_M": 8,
        "num_stages": 2,
        "num_warps": 16,
        "ms": 0.2774771749973297,
        "min_ms": 0.2774771749973297,
        "max_ms": 0.2774771749973297,
        "compile_time": 2.2045984268188477
    },
    {
        "BLOCK_SIZE_M": 32,
        "BLOCK_SIZE_N": 128,
        "BLOCK_SIZE_K": 64,
        "GROUP_SIZE_M": 8,
        "num_stages": 7,
        "num_warps": 4,
        "ms": 0.27754154801368713,
        "min_ms": 0.27754154801368713,
        "max_ms": 0.27754154801368713,
        "compile_time": 1.9329962730407715
    },
    {
        "BLOCK_SIZE_M": 32,
        "BLOCK_SIZE_N": 128,
        "BLOCK_SIZE_K": 64,
        "GROUP_SIZE_M": 8,
        "num_stages": 3,
        "num_warps": 8,
        "ms": 0.27770692110061646,
        "min_ms": 0.27770692110061646,
        "max_ms": 0.27770692110061646,
        "compile_time": 1.136418342590332
    },
    {
        "BLOCK_SIZE_M": 128,
        "BLOCK_SIZE_N": 256,
        "BLOCK_SIZE_K": 16,
        "GROUP_SIZE_M": 8,
        "num_stages": 7,
        "num_warps": 16,
        "ms": 0.27792808413505554,
        "min_ms": 0.27792808413505554,
        "max_ms": 0.27792808413505554,
        "compile_time": 1.2053313255310059
    },
    {
        "BLOCK_SIZE_M": 32,
        "BLOCK_SIZE_N": 128,
        "BLOCK_SIZE_K": 16,
        "GROUP_SIZE_M": 8,
        "num_stages": 8,
        "num_warps": 2,
        "ms": 0.2780136466026306,
        "min_ms": 0.2780136466026306,
        "max_ms": 0.2780136466026306,
        "compile_time": 1.73970365524292
    },
    {
        "BLOCK_SIZE_M": 32,
        "BLOCK_SIZE_N": 256,
        "BLOCK_SIZE_K": 128,
        "GROUP_SIZE_M": 8,
        "num_stages": 3,
        "num_warps": 8,
        "ms": 0.27813148498535156,
        "min_ms": 0.27813148498535156,
        "max_ms": 0.27813148498535156,
        "compile_time": 2.157047986984253
    },
    {
        "BLOCK_SIZE_M": 128,
        "BLOCK_SIZE_N": 256,
        "BLOCK_SIZE_K": 16,
        "GROUP_SIZE_M": 8,
        "num_stages": 8,
        "num_warps": 16,
        "ms": 0.2783106565475464,
        "min_ms": 0.2783106565475464,
        "max_ms": 0.2783106565475464,
        "compile_time": 1.8922569751739502
    },
    {
        "BLOCK_SIZE_M": 256,
        "BLOCK_SIZE_N": 32,
        "BLOCK_SIZE_K": 32,
        "GROUP_SIZE_M": 8,
        "num_stages": 4,
        "num_warps": 2,
        "ms": 0.2783888280391693,
        "min_ms": 0.2783888280391693,
        "max_ms": 0.2783888280391693,
        "compile_time": 2.761167049407959
    },
    {
        "BLOCK_SIZE_M": 64,
        "BLOCK_SIZE_N": 64,
        "BLOCK_SIZE_K": 16,
        "GROUP_SIZE_M": 8,
        "num_stages": 3,
        "num_warps": 4,
        "ms": 0.2783890962600708,
        "min_ms": 0.2783890962600708,
        "max_ms": 0.2783890962600708,
        "compile_time": 1.155562162399292
    },
    {
        "BLOCK_SIZE_M": 32,
        "BLOCK_SIZE_N": 256,
        "BLOCK_SIZE_K": 32,
        "GROUP_SIZE_M": 8,
        "num_stages": 2,
        "num_warps": 4,
        "ms": 0.27841702103614807,
        "min_ms": 0.27841702103614807,
        "max_ms": 0.27841702103614807,
        "compile_time": 1.7931194305419922
    },
    {
        "BLOCK_SIZE_M": 256,
        "BLOCK_SIZE_N": 32,
        "BLOCK_SIZE_K": 128,
        "GROUP_SIZE_M": 8,
        "num_stages": 3,
        "num_warps": 4,
        "ms": 0.2784810960292816,
        "min_ms": 0.2784810960292816,
        "max_ms": 0.2784810960292816,
        "compile_time": 3.348111152648926
    },
    {
        "BLOCK_SIZE_M": 32,
        "BLOCK_SIZE_N": 256,
        "BLOCK_SIZE_K": 16,
        "GROUP_SIZE_M": 8,
        "num_stages": 7,
        "num_warps": 8,
        "ms": 0.2784947156906128,
        "min_ms": 0.2784947156906128,
        "max_ms": 0.2784947156906128,
        "compile_time": 1.6389026641845703
    },
    {
        "BLOCK_SIZE_M": 128,
        "BLOCK_SIZE_N": 64,
        "BLOCK_SIZE_K": 16,
        "GROUP_SIZE_M": 8,
        "num_stages": 4,
        "num_warps": 8,
        "ms": 0.27850961685180664,
        "min_ms": 0.27850961685180664,
        "max_ms": 0.27850961685180664,
        "compile_time": 1.1865181922912598
    },
    {
        "BLOCK_SIZE_M": 128,
        "BLOCK_SIZE_N": 128,
        "BLOCK_SIZE_K": 256,
        "GROUP_SIZE_M": 8,
        "num_stages": 1,
        "num_warps": 16,
        "ms": 0.2786571979522705,
        "min_ms": 0.2786571979522705,
        "max_ms": 0.2786571979522705,
        "compile_time": 2.0731379985809326
    },
    {
        "BLOCK_SIZE_M": 32,
        "BLOCK_SIZE_N": 128,
        "BLOCK_SIZE_K": 64,
        "GROUP_SIZE_M": 8,
        "num_stages": 6,
        "num_warps": 4,
        "ms": 0.27873149514198303,
        "min_ms": 0.27873149514198303,
        "max_ms": 0.27873149514198303,
        "compile_time": 1.8953914642333984
    },
    {
        "BLOCK_SIZE_M": 256,
        "BLOCK_SIZE_N": 32,
        "BLOCK_SIZE_K": 128,
        "GROUP_SIZE_M": 8,
        "num_stages": 3,
        "num_warps": 8,
        "ms": 0.2788161635398865,
        "min_ms": 0.2788161635398865,
        "max_ms": 0.2788161635398865,
        "compile_time": 2.34725022315979
    },
    {
        "BLOCK_SIZE_M": 64,
        "BLOCK_SIZE_N": 256,
        "BLOCK_SIZE_K": 64,
        "GROUP_SIZE_M": 8,
        "num_stages": 2,
        "num_warps": 16,
        "ms": 0.27882009744644165,
        "min_ms": 0.27882009744644165,
        "max_ms": 0.27882009744644165,
        "compile_time": 1.755059003829956
    },
    {
        "BLOCK_SIZE_M": 128,
        "BLOCK_SIZE_N": 32,
        "BLOCK_SIZE_K": 64,
        "GROUP_SIZE_M": 8,
        "num_stages": 6,
        "num_warps": 4,
        "ms": 0.27897128462791443,
        "min_ms": 0.27897128462791443,
        "max_ms": 0.27897128462791443,
        "compile_time": 2.082819938659668
    },
    {
        "BLOCK_SIZE_M": 32,
        "BLOCK_SIZE_N": 128,
        "BLOCK_SIZE_K": 128,
        "GROUP_SIZE_M": 8,
        "num_stages": 3,
        "num_warps": 4,
        "ms": 0.279121994972229,
        "min_ms": 0.279121994972229,
        "max_ms": 0.279121994972229,
        "compile_time": 2.0977840423583984
    },
    {
        "BLOCK_SIZE_M": 64,
        "BLOCK_SIZE_N": 64,
        "BLOCK_SIZE_K": 128,
        "GROUP_SIZE_M": 8,
        "num_stages": 2,
        "num_warps": 8,
        "ms": 0.2791690528392792,
        "min_ms": 0.2791690528392792,
        "max_ms": 0.2791690528392792,
        "compile_time": 1.161153793334961
    },
    {
        "BLOCK_SIZE_M": 128,
        "BLOCK_SIZE_N": 32,
        "BLOCK_SIZE_K": 64,
        "GROUP_SIZE_M": 8,
        "num_stages": 5,
        "num_warps": 4,
        "ms": 0.279180109500885,
        "min_ms": 0.279180109500885,
        "max_ms": 0.279180109500885,
        "compile_time": 2.040581226348877
    },
    {
        "BLOCK_SIZE_M": 512,
        "BLOCK_SIZE_N": 32,
        "BLOCK_SIZE_K": 32,
        "GROUP_SIZE_M": 8,
        "num_stages": 2,
        "num_warps": 4,
        "ms": 0.2792815864086151,
        "min_ms": 0.2792815864086151,
        "max_ms": 0.2792815864086151,
        "compile_time": 2.906585454940796
    },
    {
        "BLOCK_SIZE_M": 32,
        "BLOCK_SIZE_N": 256,
        "BLOCK_SIZE_K": 16,
        "GROUP_SIZE_M": 8,
        "num_stages": 8,
        "num_warps": 8,
        "ms": 0.2792872190475464,
        "min_ms": 0.2792872190475464,
        "max_ms": 0.2792872190475464,
        "compile_time": 1.6779897212982178
    },
    {
        "BLOCK_SIZE_M": 64,
        "BLOCK_SIZE_N": 64,
        "BLOCK_SIZE_K": 64,
        "GROUP_SIZE_M": 8,
        "num_stages": 8,
        "num_warps": 8,
        "ms": 0.2792966365814209,
        "min_ms": 0.2792966365814209,
        "max_ms": 0.2792966365814209,
        "compile_time": 1.1492919921875
    },
    {
        "BLOCK_SIZE_M": 128,
        "BLOCK_SIZE_N": 64,
        "BLOCK_SIZE_K": 64,
        "GROUP_SIZE_M": 8,
        "num_stages": 5,
        "num_warps": 16,
        "ms": 0.2793354392051697,
        "min_ms": 0.2793354392051697,
        "max_ms": 0.2793354392051697,
        "compile_time": 1.1947379112243652
    },
    {
        "BLOCK_SIZE_M": 64,
        "BLOCK_SIZE_N": 64,
        "BLOCK_SIZE_K": 128,
        "GROUP_SIZE_M": 8,
        "num_stages": 1,
        "num_warps": 2,
        "ms": 0.27946001291275024,
        "min_ms": 0.27946001291275024,
        "max_ms": 0.27946001291275024,
        "compile_time": 2.3294546604156494
    },
    {
        "BLOCK_SIZE_M": 128,
        "BLOCK_SIZE_N": 64,
        "BLOCK_SIZE_K": 16,
        "GROUP_SIZE_M": 8,
        "num_stages": 7,
        "num_warps": 8,
        "ms": 0.2795487344264984,
        "min_ms": 0.2795487344264984,
        "max_ms": 0.2795487344264984,
        "compile_time": 1.1919162273406982
    },
    {
        "BLOCK_SIZE_M": 256,
        "BLOCK_SIZE_N": 32,
        "BLOCK_SIZE_K": 64,
        "GROUP_SIZE_M": 8,
        "num_stages": 2,
        "num_warps": 8,
        "ms": 0.27955594658851624,
        "min_ms": 0.27955594658851624,
        "max_ms": 0.27955594658851624,
        "compile_time": 1.9887633323669434
    },
    {
        "BLOCK_SIZE_M": 32,
        "BLOCK_SIZE_N": 128,
        "BLOCK_SIZE_K": 16,
        "GROUP_SIZE_M": 8,
        "num_stages": 5,
        "num_warps": 2,
        "ms": 0.27958041429519653,
        "min_ms": 0.27958041429519653,
        "max_ms": 0.27958041429519653,
        "compile_time": 1.7345867156982422
    },
    {
        "BLOCK_SIZE_M": 64,
        "BLOCK_SIZE_N": 256,
        "BLOCK_SIZE_K": 128,
        "GROUP_SIZE_M": 8,
        "num_stages": 2,
        "num_warps": 16,
        "ms": 0.2796463668346405,
        "min_ms": 0.2796463668346405,
        "max_ms": 0.2796463668346405,
        "compile_time": 1.1494650840759277
    },
    {
        "BLOCK_SIZE_M": 256,
        "BLOCK_SIZE_N": 128,
        "BLOCK_SIZE_K": 64,
        "GROUP_SIZE_M": 8,
        "num_stages": 1,
        "num_warps": 32,
        "ms": 0.2796614468097687,
        "min_ms": 0.2796614468097687,
        "max_ms": 0.2796614468097687,
        "compile_time": 1.8399779796600342
    },
    {
        "BLOCK_SIZE_M": 128,
        "BLOCK_SIZE_N": 64,
        "BLOCK_SIZE_K": 16,
        "GROUP_SIZE_M": 8,
        "num_stages": 6,
        "num_warps": 8,
        "ms": 0.2797626852989197,
        "min_ms": 0.2797626852989197,
        "max_ms": 0.2797626852989197,
        "compile_time": 1.1953120231628418
    },
    {
        "BLOCK_SIZE_M": 32,
        "BLOCK_SIZE_N": 128,
        "BLOCK_SIZE_K": 128,
        "GROUP_SIZE_M": 8,
        "num_stages": 2,
        "num_warps": 2,
        "ms": 0.27977773547172546,
        "min_ms": 0.27977773547172546,
        "max_ms": 0.27977773547172546,
        "compile_time": 2.6310253143310547
    },
    {
        "BLOCK_SIZE_M": 32,
        "BLOCK_SIZE_N": 128,
        "BLOCK_SIZE_K": 64,
        "GROUP_SIZE_M": 8,
        "num_stages": 2,
        "num_warps": 4,
        "ms": 0.27981624007225037,
        "min_ms": 0.27981624007225037,
        "max_ms": 0.27981624007225037,
        "compile_time": 1.7075350284576416
    },
    {
        "BLOCK_SIZE_M": 32,
        "BLOCK_SIZE_N": 128,
        "BLOCK_SIZE_K": 64,
        "GROUP_SIZE_M": 8,
        "num_stages": 8,
        "num_warps": 4,
        "ms": 0.27982771396636963,
        "min_ms": 0.27982771396636963,
        "max_ms": 0.27982771396636963,
        "compile_time": 1.9597868919372559
    },
    {
        "BLOCK_SIZE_M": 128,
        "BLOCK_SIZE_N": 32,
        "BLOCK_SIZE_K": 32,
        "GROUP_SIZE_M": 8,
        "num_stages": 5,
        "num_warps": 2,
        "ms": 0.27986663579940796,
        "min_ms": 0.27986663579940796,
        "max_ms": 0.27986663579940796,
        "compile_time": 2.095574378967285
    },
    {
        "BLOCK_SIZE_M": 128,
        "BLOCK_SIZE_N": 64,
        "BLOCK_SIZE_K": 16,
        "GROUP_SIZE_M": 8,
        "num_stages": 5,
        "num_warps": 8,
        "ms": 0.2801361680030823,
        "min_ms": 0.2801361680030823,
        "max_ms": 0.2801361680030823,
        "compile_time": 1.2062690258026123
    },
    {
        "BLOCK_SIZE_M": 32,
        "BLOCK_SIZE_N": 128,
        "BLOCK_SIZE_K": 64,
        "GROUP_SIZE_M": 8,
        "num_stages": 5,
        "num_warps": 8,
        "ms": 0.2801625430583954,
        "min_ms": 0.2801625430583954,
        "max_ms": 0.2801625430583954,
        "compile_time": 1.679065465927124
    },
    {
        "BLOCK_SIZE_M": 64,
        "BLOCK_SIZE_N": 64,
        "BLOCK_SIZE_K": 256,
        "GROUP_SIZE_M": 8,
        "num_stages": 3,
        "num_warps": 8,
        "ms": 0.28039753437042236,
        "min_ms": 0.28039753437042236,
        "max_ms": 0.28039753437042236,
        "compile_time": 2.0692999362945557
    },
    {
        "BLOCK_SIZE_M": 64,
        "BLOCK_SIZE_N": 64,
        "BLOCK_SIZE_K": 16,
        "GROUP_SIZE_M": 8,
        "num_stages": 2,
        "num_warps": 2,
        "ms": 0.28046298027038574,
        "min_ms": 0.28046298027038574,
        "max_ms": 0.28046298027038574,
        "compile_time": 1.7131013870239258
    },
    {
        "BLOCK_SIZE_M": 128,
        "BLOCK_SIZE_N": 64,
        "BLOCK_SIZE_K": 16,
        "GROUP_SIZE_M": 8,
        "num_stages": 8,
        "num_warps": 8,
        "ms": 0.2806397080421448,
        "min_ms": 0.2806397080421448,
        "max_ms": 0.2806397080421448,
        "compile_time": 1.7872724533081055
    },
    {
        "BLOCK_SIZE_M": 64,
        "BLOCK_SIZE_N": 64,
        "BLOCK_SIZE_K": 64,
        "GROUP_SIZE_M": 8,
        "num_stages": 1,
        "num_warps": 2,
        "ms": 0.2806561589241028,
        "min_ms": 0.2806561589241028,
        "max_ms": 0.2806561589241028,
        "compile_time": 1.859224557876587
    },
    {
        "BLOCK_SIZE_M": 256,
        "BLOCK_SIZE_N": 64,
        "BLOCK_SIZE_K": 128,
        "GROUP_SIZE_M": 8,
        "num_stages": 2,
        "num_warps": 16,
        "ms": 0.2809517979621887,
        "min_ms": 0.2809517979621887,
        "max_ms": 0.2809517979621887,
        "compile_time": 2.1783039569854736
    },
    {
        "BLOCK_SIZE_M": 128,
        "BLOCK_SIZE_N": 32,
        "BLOCK_SIZE_K": 32,
        "GROUP_SIZE_M": 8,
        "num_stages": 6,
        "num_warps": 4,
        "ms": 0.28102248907089233,
        "min_ms": 0.28102248907089233,
        "max_ms": 0.28102248907089233,
        "compile_time": 1.213637351989746
    },
    {
        "BLOCK_SIZE_M": 32,
        "BLOCK_SIZE_N": 128,
        "BLOCK_SIZE_K": 32,
        "GROUP_SIZE_M": 8,
        "num_stages": 7,
        "num_warps": 4,
        "ms": 0.2811596393585205,
        "min_ms": 0.2811596393585205,
        "max_ms": 0.2811596393585205,
        "compile_time": 1.1173017024993896
    },
    {
        "BLOCK_SIZE_M": 128,
        "BLOCK_SIZE_N": 64,
        "BLOCK_SIZE_K": 64,
        "GROUP_SIZE_M": 8,
        "num_stages": 6,
        "num_warps": 16,
        "ms": 0.2816409468650818,
        "min_ms": 0.2816409468650818,
        "max_ms": 0.2816409468650818,
        "compile_time": 1.7890326976776123
    },
    {
        "BLOCK_SIZE_M": 64,
        "BLOCK_SIZE_N": 64,
        "BLOCK_SIZE_K": 128,
        "GROUP_SIZE_M": 8,
        "num_stages": 6,
        "num_warps": 8,
        "ms": 0.281700074672699,
        "min_ms": 0.281700074672699,
        "max_ms": 0.281700074672699,
        "compile_time": 1.154083251953125
    },
    {
        "BLOCK_SIZE_M": 256,
        "BLOCK_SIZE_N": 32,
        "BLOCK_SIZE_K": 32,
        "GROUP_SIZE_M": 8,
        "num_stages": 2,
        "num_warps": 4,
        "ms": 0.2817904055118561,
        "min_ms": 0.2817904055118561,
        "max_ms": 0.2817904055118561,
        "compile_time": 2.000058174133301
    },
    {
        "BLOCK_SIZE_M": 128,
        "BLOCK_SIZE_N": 32,
        "BLOCK_SIZE_K": 64,
        "GROUP_SIZE_M": 8,
        "num_stages": 4,
        "num_warps": 4,
        "ms": 0.2819690406322479,
        "min_ms": 0.2819690406322479,
        "max_ms": 0.2819690406322479,
        "compile_time": 2.016436815261841
    },
    {
        "BLOCK_SIZE_M": 64,
        "BLOCK_SIZE_N": 256,
        "BLOCK_SIZE_K": 256,
        "GROUP_SIZE_M": 8,
        "num_stages": 1,
        "num_warps": 8,
        "ms": 0.28198671340942383,
        "min_ms": 0.28198671340942383,
        "max_ms": 0.28198671340942383,
        "compile_time": 2.8377602100372314
    },
    {
        "BLOCK_SIZE_M": 32,
        "BLOCK_SIZE_N": 128,
        "BLOCK_SIZE_K": 32,
        "GROUP_SIZE_M": 8,
        "num_stages": 2,
        "num_warps": 4,
        "ms": 0.28222760558128357,
        "min_ms": 0.28222760558128357,
        "max_ms": 0.28222760558128357,
        "compile_time": 1.1108782291412354
    },
    {
        "BLOCK_SIZE_M": 64,
        "BLOCK_SIZE_N": 256,
        "BLOCK_SIZE_K": 128,
        "GROUP_SIZE_M": 8,
        "num_stages": 3,
        "num_warps": 32,
        "ms": 0.2825372815132141,
        "min_ms": 0.2825372815132141,
        "max_ms": 0.2825372815132141,
        "compile_time": 1.1607046127319336
    },
    {
        "BLOCK_SIZE_M": 64,
        "BLOCK_SIZE_N": 64,
        "BLOCK_SIZE_K": 128,
        "GROUP_SIZE_M": 8,
        "num_stages": 1,
        "num_warps": 4,
        "ms": 0.28275060653686523,
        "min_ms": 0.28275060653686523,
        "max_ms": 0.28275060653686523,
        "compile_time": 1.1527926921844482
    },
    {
        "BLOCK_SIZE_M": 128,
        "BLOCK_SIZE_N": 32,
        "BLOCK_SIZE_K": 64,
        "GROUP_SIZE_M": 8,
        "num_stages": 7,
        "num_warps": 4,
        "ms": 0.28280001878738403,
        "min_ms": 0.28280001878738403,
        "max_ms": 0.28280001878738403,
        "compile_time": 2.120386838912964
    },
    {
        "BLOCK_SIZE_M": 32,
        "BLOCK_SIZE_N": 128,
        "BLOCK_SIZE_K": 128,
        "GROUP_SIZE_M": 8,
        "num_stages": 5,
        "num_warps": 4,
        "ms": 0.2828846573829651,
        "min_ms": 0.2828846573829651,
        "max_ms": 0.2828846573829651,
        "compile_time": 2.253980875015259
    },
    {
        "BLOCK_SIZE_M": 128,
        "BLOCK_SIZE_N": 32,
        "BLOCK_SIZE_K": 64,
        "GROUP_SIZE_M": 8,
        "num_stages": 3,
        "num_warps": 8,
        "ms": 0.2829250991344452,
        "min_ms": 0.2829250991344452,
        "max_ms": 0.2829250991344452,
        "compile_time": 1.8179726600646973
    },
    {
        "BLOCK_SIZE_M": 32,
        "BLOCK_SIZE_N": 128,
        "BLOCK_SIZE_K": 128,
        "GROUP_SIZE_M": 8,
        "num_stages": 3,
        "num_warps": 8,
        "ms": 0.2829686105251312,
        "min_ms": 0.2829686105251312,
        "max_ms": 0.2829686105251312,
        "compile_time": 1.122689962387085
    },
    {
        "BLOCK_SIZE_M": 128,
        "BLOCK_SIZE_N": 32,
        "BLOCK_SIZE_K": 64,
        "GROUP_SIZE_M": 8,
        "num_stages": 2,
        "num_warps": 4,
        "ms": 0.28300923109054565,
        "min_ms": 0.28300923109054565,
        "max_ms": 0.28300923109054565,
        "compile_time": 1.9117467403411865
    },
    {
        "BLOCK_SIZE_M": 512,
        "BLOCK_SIZE_N": 32,
        "BLOCK_SIZE_K": 32,
        "GROUP_SIZE_M": 8,
        "num_stages": 4,
        "num_warps": 16,
        "ms": 0.2832116186618805,
        "min_ms": 0.2832116186618805,
        "max_ms": 0.2832116186618805,
        "compile_time": 2.0371932983398438
    },
    {
        "BLOCK_SIZE_M": 64,
        "BLOCK_SIZE_N": 64,
        "BLOCK_SIZE_K": 256,
        "GROUP_SIZE_M": 8,
        "num_stages": 2,
        "num_warps": 8,
        "ms": 0.2832242548465729,
        "min_ms": 0.2832242548465729,
        "max_ms": 0.2832242548465729,
        "compile_time": 1.9828383922576904
    },
    {
        "BLOCK_SIZE_M": 32,
        "BLOCK_SIZE_N": 128,
        "BLOCK_SIZE_K": 16,
        "GROUP_SIZE_M": 8,
        "num_stages": 4,
        "num_warps": 4,
        "ms": 0.2832396626472473,
        "min_ms": 0.2832396626472473,
        "max_ms": 0.2832396626472473,
        "compile_time": 1.1552846431732178
    },
    {
        "BLOCK_SIZE_M": 128,
        "BLOCK_SIZE_N": 64,
        "BLOCK_SIZE_K": 16,
        "GROUP_SIZE_M": 8,
        "num_stages": 3,
        "num_warps": 8,
        "ms": 0.28327155113220215,
        "min_ms": 0.28327155113220215,
        "max_ms": 0.28327155113220215,
        "compile_time": 1.1901965141296387
    },
    {
        "BLOCK_SIZE_M": 32,
        "BLOCK_SIZE_N": 128,
        "BLOCK_SIZE_K": 32,
        "GROUP_SIZE_M": 8,
        "num_stages": 8,
        "num_warps": 4,
        "ms": 0.28354430198669434,
        "min_ms": 0.28354430198669434,
        "max_ms": 0.28354430198669434,
        "compile_time": 1.1284022331237793
    },
    {
        "BLOCK_SIZE_M": 128,
        "BLOCK_SIZE_N": 32,
        "BLOCK_SIZE_K": 32,
        "GROUP_SIZE_M": 8,
        "num_stages": 7,
        "num_warps": 2,
        "ms": 0.2836361527442932,
        "min_ms": 0.2836361527442932,
        "max_ms": 0.2836361527442932,
        "compile_time": 2.1691582202911377
    },
    {
        "BLOCK_SIZE_M": 64,
        "BLOCK_SIZE_N": 128,
        "BLOCK_SIZE_K": 32,
        "GROUP_SIZE_M": 8,
        "num_stages": 1,
        "num_warps": 8,
        "ms": 0.2838699519634247,
        "min_ms": 0.2838699519634247,
        "max_ms": 0.2838699519634247,
        "compile_time": 1.1293089389801025
    },
    {
        "BLOCK_SIZE_M": 32,
        "BLOCK_SIZE_N": 256,
        "BLOCK_SIZE_K": 32,
        "GROUP_SIZE_M": 8,
        "num_stages": 2,
        "num_warps": 2,
        "ms": 0.28390565514564514,
        "min_ms": 0.28390565514564514,
        "max_ms": 0.28390565514564514,
        "compile_time": 2.3262155055999756
    },
    {
        "BLOCK_SIZE_M": 64,
        "BLOCK_SIZE_N": 256,
        "BLOCK_SIZE_K": 64,
        "GROUP_SIZE_M": 8,
        "num_stages": 3,
        "num_warps": 32,
        "ms": 0.28408369421958923,
        "min_ms": 0.28408369421958923,
        "max_ms": 0.28408369421958923,
        "compile_time": 1.16172456741333
    },
    {
        "BLOCK_SIZE_M": 256,
        "BLOCK_SIZE_N": 128,
        "BLOCK_SIZE_K": 128,
        "GROUP_SIZE_M": 8,
        "num_stages": 1,
        "num_warps": 16,
        "ms": 0.28412383794784546,
        "min_ms": 0.28412383794784546,
        "max_ms": 0.28412383794784546,
        "compile_time": 2.166415214538574
    },
    {
        "BLOCK_SIZE_M": 64,
        "BLOCK_SIZE_N": 64,
        "BLOCK_SIZE_K": 32,
        "GROUP_SIZE_M": 8,
        "num_stages": 8,
        "num_warps": 8,
        "ms": 0.28425976634025574,
        "min_ms": 0.28425976634025574,
        "max_ms": 0.28425976634025574,
        "compile_time": 1.6756930351257324
    },
    {
        "BLOCK_SIZE_M": 128,
        "BLOCK_SIZE_N": 32,
        "BLOCK_SIZE_K": 64,
        "GROUP_SIZE_M": 8,
        "num_stages": 4,
        "num_warps": 8,
        "ms": 0.2844794988632202,
        "min_ms": 0.2844794988632202,
        "max_ms": 0.2844794988632202,
        "compile_time": 1.2101364135742188
    },
    {
        "BLOCK_SIZE_M": 128,
        "BLOCK_SIZE_N": 32,
        "BLOCK_SIZE_K": 128,
        "GROUP_SIZE_M": 8,
        "num_stages": 3,
        "num_warps": 4,
        "ms": 0.2845553755760193,
        "min_ms": 0.2845553755760193,
        "max_ms": 0.2845553755760193,
        "compile_time": 2.2520179748535156
    },
    {
        "BLOCK_SIZE_M": 64,
        "BLOCK_SIZE_N": 256,
        "BLOCK_SIZE_K": 64,
        "GROUP_SIZE_M": 8,
        "num_stages": 4,
        "num_warps": 32,
        "ms": 0.28461021184921265,
        "min_ms": 0.28461021184921265,
        "max_ms": 0.28461021184921265,
        "compile_time": 1.7083654403686523
    },
    {
        "BLOCK_SIZE_M": 128,
        "BLOCK_SIZE_N": 256,
        "BLOCK_SIZE_K": 32,
        "GROUP_SIZE_M": 8,
        "num_stages": 2,
        "num_warps": 16,
        "ms": 0.28472456336021423,
        "min_ms": 0.28472456336021423,
        "max_ms": 0.28472456336021423,
        "compile_time": 1.9056077003479004
    },
    {
        "BLOCK_SIZE_M": 64,
        "BLOCK_SIZE_N": 256,
        "BLOCK_SIZE_K": 128,
        "GROUP_SIZE_M": 8,
        "num_stages": 2,
        "num_warps": 4,
        "ms": 0.2848176062107086,
        "min_ms": 0.2848176062107086,
        "max_ms": 0.2848176062107086,
        "compile_time": 3.091120719909668
    },
    {
        "BLOCK_SIZE_M": 128,
        "BLOCK_SIZE_N": 32,
        "BLOCK_SIZE_K": 64,
        "GROUP_SIZE_M": 8,
        "num_stages": 2,
        "num_warps": 2,
        "ms": 0.2848190665245056,
        "min_ms": 0.2848190665245056,
        "max_ms": 0.2848190665245056,
        "compile_time": 2.227198600769043
    },
    {
        "BLOCK_SIZE_M": 128,
        "BLOCK_SIZE_N": 64,
        "BLOCK_SIZE_K": 16,
        "GROUP_SIZE_M": 8,
        "num_stages": 2,
        "num_warps": 4,
        "ms": 0.2848653197288513,
        "min_ms": 0.2848653197288513,
        "max_ms": 0.2848653197288513,
        "compile_time": 1.1839306354522705
    },
    {
        "BLOCK_SIZE_M": 64,
        "BLOCK_SIZE_N": 256,
        "BLOCK_SIZE_K": 64,
        "GROUP_SIZE_M": 8,
        "num_stages": 5,
        "num_warps": 32,
        "ms": 0.28533071279525757,
        "min_ms": 0.28533071279525757,
        "max_ms": 0.28533071279525757,
        "compile_time": 1.1292495727539062
    },
    {
        "BLOCK_SIZE_M": 32,
        "BLOCK_SIZE_N": 128,
        "BLOCK_SIZE_K": 32,
        "GROUP_SIZE_M": 8,
        "num_stages": 2,
        "num_warps": 2,
        "ms": 0.28540024161338806,
        "min_ms": 0.28540024161338806,
        "max_ms": 0.28540024161338806,
        "compile_time": 1.7782983779907227
    },
    {
        "BLOCK_SIZE_M": 128,
        "BLOCK_SIZE_N": 32,
        "BLOCK_SIZE_K": 32,
        "GROUP_SIZE_M": 8,
        "num_stages": 8,
        "num_warps": 2,
        "ms": 0.285636842250824,
        "min_ms": 0.285636842250824,
        "max_ms": 0.285636842250824,
        "compile_time": 2.1982975006103516
    },
    {
        "BLOCK_SIZE_M": 32,
        "BLOCK_SIZE_N": 128,
        "BLOCK_SIZE_K": 128,
        "GROUP_SIZE_M": 8,
        "num_stages": 4,
        "num_warps": 4,
        "ms": 0.28566616773605347,
        "min_ms": 0.28566616773605347,
        "max_ms": 0.28566616773605347,
        "compile_time": 2.166475772857666
    },
    {
        "BLOCK_SIZE_M": 512,
        "BLOCK_SIZE_N": 64,
        "BLOCK_SIZE_K": 32,
        "GROUP_SIZE_M": 8,
        "num_stages": 3,
        "num_warps": 16,
        "ms": 0.2859595715999603,
        "min_ms": 0.2859595715999603,
        "max_ms": 0.2859595715999603,
        "compile_time": 2.252495527267456
    },
    {
        "BLOCK_SIZE_M": 128,
        "BLOCK_SIZE_N": 32,
        "BLOCK_SIZE_K": 32,
        "GROUP_SIZE_M": 8,
        "num_stages": 2,
        "num_warps": 4,
        "ms": 0.2860097885131836,
        "min_ms": 0.2860097885131836,
        "max_ms": 0.2860097885131836,
        "compile_time": 1.7869212627410889
    },
    {
        "BLOCK_SIZE_M": 256,
        "BLOCK_SIZE_N": 32,
        "BLOCK_SIZE_K": 32,
        "GROUP_SIZE_M": 8,
        "num_stages": 5,
        "num_warps": 2,
        "ms": 0.28613391518592834,
        "min_ms": 0.28613391518592834,
        "max_ms": 0.28613391518592834,
        "compile_time": 2.8129351139068604
    },
    {
        "BLOCK_SIZE_M": 128,
        "BLOCK_SIZE_N": 256,
        "BLOCK_SIZE_K": 16,
        "GROUP_SIZE_M": 8,
        "num_stages": 3,
        "num_warps": 32,
        "ms": 0.28642818331718445,
        "min_ms": 0.28642818331718445,
        "max_ms": 0.28642818331718445,
        "compile_time": 1.2071499824523926
    },
    {
        "BLOCK_SIZE_M": 128,
        "BLOCK_SIZE_N": 64,
        "BLOCK_SIZE_K": 64,
        "GROUP_SIZE_M": 8,
        "num_stages": 2,
        "num_warps": 16,
        "ms": 0.2864978015422821,
        "min_ms": 0.2864978015422821,
        "max_ms": 0.2864978015422821,
        "compile_time": 1.7626945972442627
    },
    {
        "BLOCK_SIZE_M": 256,
        "BLOCK_SIZE_N": 64,
        "BLOCK_SIZE_K": 64,
        "GROUP_SIZE_M": 8,
        "num_stages": 3,
        "num_warps": 32,
        "ms": 0.2866038382053375,
        "min_ms": 0.2866038382053375,
        "max_ms": 0.2866038382053375,
        "compile_time": 1.864220380783081
    },
    {
        "BLOCK_SIZE_M": 128,
        "BLOCK_SIZE_N": 32,
        "BLOCK_SIZE_K": 64,
        "GROUP_SIZE_M": 8,
        "num_stages": 8,
        "num_warps": 4,
        "ms": 0.2868913412094116,
        "min_ms": 0.2868913412094116,
        "max_ms": 0.2868913412094116,
        "compile_time": 2.14564847946167
    },
    {
        "BLOCK_SIZE_M": 128,
        "BLOCK_SIZE_N": 256,
        "BLOCK_SIZE_K": 16,
        "GROUP_SIZE_M": 8,
        "num_stages": 4,
        "num_warps": 32,
        "ms": 0.2869950830936432,
        "min_ms": 0.2869950830936432,
        "max_ms": 0.2869950830936432,
        "compile_time": 1.208465337753296
    },
    {
        "BLOCK_SIZE_M": 256,
        "BLOCK_SIZE_N": 64,
        "BLOCK_SIZE_K": 64,
        "GROUP_SIZE_M": 8,
        "num_stages": 2,
        "num_warps": 16,
        "ms": 0.28722280263900757,
        "min_ms": 0.28722280263900757,
        "max_ms": 0.28722280263900757,
        "compile_time": 1.2230122089385986
    },
    {
        "BLOCK_SIZE_M": 128,
        "BLOCK_SIZE_N": 64,
        "BLOCK_SIZE_K": 64,
        "GROUP_SIZE_M": 8,
        "num_stages": 7,
        "num_warps": 16,
        "ms": 0.2873154580593109,
        "min_ms": 0.2873154580593109,
        "max_ms": 0.2873154580593109,
        "compile_time": 1.8061943054199219
    },
    {
        "BLOCK_SIZE_M": 256,
        "BLOCK_SIZE_N": 64,
        "BLOCK_SIZE_K": 16,
        "GROUP_SIZE_M": 8,
        "num_stages": 7,
        "num_warps": 16,
        "ms": 0.2877514660358429,
        "min_ms": 0.2877514660358429,
        "max_ms": 0.2877514660358429,
        "compile_time": 1.227219581604004
    },
    {
        "BLOCK_SIZE_M": 32,
        "BLOCK_SIZE_N": 256,
        "BLOCK_SIZE_K": 128,
        "GROUP_SIZE_M": 8,
        "num_stages": 3,
        "num_warps": 16,
        "ms": 0.2880481481552124,
        "min_ms": 0.2880481481552124,
        "max_ms": 0.2880481481552124,
        "compile_time": 1.1216106414794922
    },
    {
        "BLOCK_SIZE_M": 128,
        "BLOCK_SIZE_N": 256,
        "BLOCK_SIZE_K": 16,
        "GROUP_SIZE_M": 8,
        "num_stages": 5,
        "num_warps": 32,
        "ms": 0.28805527091026306,
        "min_ms": 0.28805527091026306,
        "max_ms": 0.28805527091026306,
        "compile_time": 1.779496192932129
    },
    {
        "BLOCK_SIZE_M": 32,
        "BLOCK_SIZE_N": 256,
        "BLOCK_SIZE_K": 64,
        "GROUP_SIZE_M": 8,
        "num_stages": 2,
        "num_warps": 4,
        "ms": 0.288056343793869,
        "min_ms": 0.288056343793869,
        "max_ms": 0.288056343793869,
        "compile_time": 2.0186691284179688
    },
    {
        "BLOCK_SIZE_M": 128,
        "BLOCK_SIZE_N": 32,
        "BLOCK_SIZE_K": 128,
        "GROUP_SIZE_M": 8,
        "num_stages": 4,
        "num_warps": 4,
        "ms": 0.28822436928749084,
        "min_ms": 0.28822436928749084,
        "max_ms": 0.28822436928749084,
        "compile_time": 2.3776605129241943
    },
    {
        "BLOCK_SIZE_M": 256,
        "BLOCK_SIZE_N": 64,
        "BLOCK_SIZE_K": 16,
        "GROUP_SIZE_M": 8,
        "num_stages": 8,
        "num_warps": 16,
        "ms": 0.2882831394672394,
        "min_ms": 0.2882831394672394,
        "max_ms": 0.2882831394672394,
        "compile_time": 1.227543830871582
    },
    {
        "BLOCK_SIZE_M": 128,
        "BLOCK_SIZE_N": 32,
        "BLOCK_SIZE_K": 64,
        "GROUP_SIZE_M": 8,
        "num_stages": 5,
        "num_warps": 8,
        "ms": 0.2892511188983917,
        "min_ms": 0.2892511188983917,
        "max_ms": 0.2892511188983917,
        "compile_time": 1.2134480476379395
    },
    {
        "BLOCK_SIZE_M": 64,
        "BLOCK_SIZE_N": 128,
        "BLOCK_SIZE_K": 32,
        "GROUP_SIZE_M": 8,
        "num_stages": 2,
        "num_warps": 8,
        "ms": 0.2892538607120514,
        "min_ms": 0.2892538607120514,
        "max_ms": 0.2892538607120514,
        "compile_time": 1.6120178699493408
    },
    {
        "BLOCK_SIZE_M": 128,
        "BLOCK_SIZE_N": 32,
        "BLOCK_SIZE_K": 32,
        "GROUP_SIZE_M": 8,
        "num_stages": 2,
        "num_warps": 2,
        "ms": 0.28929391503334045,
        "min_ms": 0.28929391503334045,
        "max_ms": 0.28929391503334045,
        "compile_time": 1.9465808868408203
    },
    {
        "BLOCK_SIZE_M": 256,
        "BLOCK_SIZE_N": 64,
        "BLOCK_SIZE_K": 64,
        "GROUP_SIZE_M": 8,
        "num_stages": 4,
        "num_warps": 32,
        "ms": 0.2895330786705017,
        "min_ms": 0.2895330786705017,
        "max_ms": 0.2895330786705017,
        "compile_time": 1.2011406421661377
    },
    {
        "BLOCK_SIZE_M": 128,
        "BLOCK_SIZE_N": 32,
        "BLOCK_SIZE_K": 128,
        "GROUP_SIZE_M": 8,
        "num_stages": 2,
        "num_warps": 4,
        "ms": 0.2897284924983978,
        "min_ms": 0.2897284924983978,
        "max_ms": 0.2897284924983978,
        "compile_time": 2.1253976821899414
    },
    {
        "BLOCK_SIZE_M": 64,
        "BLOCK_SIZE_N": 128,
        "BLOCK_SIZE_K": 16,
        "GROUP_SIZE_M": 8,
        "num_stages": 2,
        "num_warps": 2,
        "ms": 0.2898135185241699,
        "min_ms": 0.2898135185241699,
        "max_ms": 0.2898135185241699,
        "compile_time": 2.0300304889678955
    },
    {
        "BLOCK_SIZE_M": 256,
        "BLOCK_SIZE_N": 64,
        "BLOCK_SIZE_K": 256,
        "GROUP_SIZE_M": 8,
        "num_stages": 2,
        "num_warps": 16,
        "ms": 0.29038599133491516,
        "min_ms": 0.29038599133491516,
        "max_ms": 0.29038599133491516,
        "compile_time": 2.4119622707366943
    },
    {
        "BLOCK_SIZE_M": 32,
        "BLOCK_SIZE_N": 256,
        "BLOCK_SIZE_K": 16,
        "GROUP_SIZE_M": 8,
        "num_stages": 7,
        "num_warps": 2,
        "ms": 0.29056698083877563,
        "min_ms": 0.29056698083877563,
        "max_ms": 0.29056698083877563,
        "compile_time": 2.231699228286743
    },
    {
        "BLOCK_SIZE_M": 128,
        "BLOCK_SIZE_N": 128,
        "BLOCK_SIZE_K": 128,
        "GROUP_SIZE_M": 8,
        "num_stages": 1,
        "num_warps": 16,
        "ms": 0.29059484601020813,
        "min_ms": 0.29059484601020813,
        "max_ms": 0.29059484601020813,
        "compile_time": 1.8136684894561768
    },
    {
        "BLOCK_SIZE_M": 32,
        "BLOCK_SIZE_N": 128,
        "BLOCK_SIZE_K": 256,
        "GROUP_SIZE_M": 8,
        "num_stages": 2,
        "num_warps": 4,
        "ms": 0.29083314538002014,
        "min_ms": 0.29083314538002014,
        "max_ms": 0.29083314538002014,
        "compile_time": 2.6236040592193604
    },
    {
        "BLOCK_SIZE_M": 64,
        "BLOCK_SIZE_N": 64,
        "BLOCK_SIZE_K": 64,
        "GROUP_SIZE_M": 8,
        "num_stages": 7,
        "num_warps": 2,
        "ms": 0.29113996028900146,
        "min_ms": 0.29113996028900146,
        "max_ms": 0.29113996028900146,
        "compile_time": 2.3121423721313477
    },
    {
        "BLOCK_SIZE_M": 32,
        "BLOCK_SIZE_N": 256,
        "BLOCK_SIZE_K": 16,
        "GROUP_SIZE_M": 8,
        "num_stages": 8,
        "num_warps": 2,
        "ms": 0.29122626781463623,
        "min_ms": 0.29122626781463623,
        "max_ms": 0.29122626781463623,
        "compile_time": 2.2526986598968506
    },
    {
        "BLOCK_SIZE_M": 64,
        "BLOCK_SIZE_N": 256,
        "BLOCK_SIZE_K": 256,
        "GROUP_SIZE_M": 8,
        "num_stages": 2,
        "num_warps": 8,
        "ms": 0.2912927269935608,
        "min_ms": 0.2912927269935608,
        "max_ms": 0.2912927269935608,
        "compile_time": 2.9508395195007324
    },
    {
        "BLOCK_SIZE_M": 512,
        "BLOCK_SIZE_N": 32,
        "BLOCK_SIZE_K": 32,
        "GROUP_SIZE_M": 8,
        "num_stages": 4,
        "num_warps": 4,
        "ms": 0.29130086302757263,
        "min_ms": 0.29130086302757263,
        "max_ms": 0.29130086302757263,
        "compile_time": 2.7914185523986816
    },
    {
        "BLOCK_SIZE_M": 512,
        "BLOCK_SIZE_N": 64,
        "BLOCK_SIZE_K": 64,
        "GROUP_SIZE_M": 8,
        "num_stages": 2,
        "num_warps": 16,
        "ms": 0.2915153205394745,
        "min_ms": 0.2915153205394745,
        "max_ms": 0.2915153205394745,
        "compile_time": 2.3659822940826416
    },
    {
        "BLOCK_SIZE_M": 32,
        "BLOCK_SIZE_N": 128,
        "BLOCK_SIZE_K": 128,
        "GROUP_SIZE_M": 8,
        "num_stages": 3,
        "num_warps": 2,
        "ms": 0.29167017340660095,
        "min_ms": 0.29167017340660095,
        "max_ms": 0.29167017340660095,
        "compile_time": 3.1265060901641846
    },
    {
        "BLOCK_SIZE_M": 32,
        "BLOCK_SIZE_N": 512,
        "BLOCK_SIZE_K": 32,
        "GROUP_SIZE_M": 8,
        "num_stages": 2,
        "num_warps": 4,
        "ms": 0.2916860580444336,
        "min_ms": 0.2916860580444336,
        "max_ms": 0.2916860580444336,
        "compile_time": 2.3252015113830566
    },
    {
        "BLOCK_SIZE_M": 32,
        "BLOCK_SIZE_N": 256,
        "BLOCK_SIZE_K": 16,
        "GROUP_SIZE_M": 8,
        "num_stages": 2,
        "num_warps": 4,
        "ms": 0.29188331961631775,
        "min_ms": 0.29188331961631775,
        "max_ms": 0.29188331961631775,
        "compile_time": 1.6526033878326416
    },
    {
        "BLOCK_SIZE_M": 256,
        "BLOCK_SIZE_N": 128,
        "BLOCK_SIZE_K": 32,
        "GROUP_SIZE_M": 8,
        "num_stages": 1,
        "num_warps": 16,
        "ms": 0.29288211464881897,
        "min_ms": 0.29288211464881897,
        "max_ms": 0.29288211464881897,
        "compile_time": 1.9365675449371338
    },
    {
        "BLOCK_SIZE_M": 64,
        "BLOCK_SIZE_N": 128,
        "BLOCK_SIZE_K": 16,
        "GROUP_SIZE_M": 8,
        "num_stages": 1,
        "num_warps": 4,
        "ms": 0.2930554449558258,
        "min_ms": 0.2930554449558258,
        "max_ms": 0.2930554449558258,
        "compile_time": 1.7004375457763672
    },
    {
        "BLOCK_SIZE_M": 128,
        "BLOCK_SIZE_N": 32,
        "BLOCK_SIZE_K": 128,
        "GROUP_SIZE_M": 8,
        "num_stages": 5,
        "num_warps": 4,
        "ms": 0.2930811643600464,
        "min_ms": 0.2930811643600464,
        "max_ms": 0.2930811643600464,
        "compile_time": 2.46327543258667
    },
    {
        "BLOCK_SIZE_M": 32,
        "BLOCK_SIZE_N": 128,
        "BLOCK_SIZE_K": 16,
        "GROUP_SIZE_M": 8,
        "num_stages": 3,
        "num_warps": 4,
        "ms": 0.29313260316848755,
        "min_ms": 0.29313260316848755,
        "max_ms": 0.29313260316848755,
        "compile_time": 1.592843770980835
    },
    {
        "BLOCK_SIZE_M": 64,
        "BLOCK_SIZE_N": 256,
        "BLOCK_SIZE_K": 32,
        "GROUP_SIZE_M": 8,
        "num_stages": 1,
        "num_warps": 4,
        "ms": 0.29330235719680786,
        "min_ms": 0.29330235719680786,
        "max_ms": 0.29330235719680786,
        "compile_time": 2.1312999725341797
    },
    {
        "BLOCK_SIZE_M": 512,
        "BLOCK_SIZE_N": 64,
        "BLOCK_SIZE_K": 32,
        "GROUP_SIZE_M": 8,
        "num_stages": 5,
        "num_warps": 16,
        "ms": 0.2934964597225189,
        "min_ms": 0.2934964597225189,
        "max_ms": 0.2934964597225189,
        "compile_time": 2.351260185241699
    },
    {
        "BLOCK_SIZE_M": 512,
        "BLOCK_SIZE_N": 32,
        "BLOCK_SIZE_K": 32,
        "GROUP_SIZE_M": 8,
        "num_stages": 5,
        "num_warps": 4,
        "ms": 0.2935360372066498,
        "min_ms": 0.2935360372066498,
        "max_ms": 0.2935360372066498,
        "compile_time": 2.862607002258301
    },
    {
        "BLOCK_SIZE_M": 32,
        "BLOCK_SIZE_N": 128,
        "BLOCK_SIZE_K": 16,
        "GROUP_SIZE_M": 8,
        "num_stages": 2,
        "num_warps": 2,
        "ms": 0.29356449842453003,
        "min_ms": 0.29356449842453003,
        "max_ms": 0.29356449842453003,
        "compile_time": 1.6489222049713135
    },
    {
        "BLOCK_SIZE_M": 128,
        "BLOCK_SIZE_N": 32,
        "BLOCK_SIZE_K": 64,
        "GROUP_SIZE_M": 8,
        "num_stages": 1,
        "num_warps": 2,
        "ms": 0.2937530279159546,
        "min_ms": 0.2937530279159546,
        "max_ms": 0.2937530279159546,
        "compile_time": 2.147773265838623
    },
    {
        "BLOCK_SIZE_M": 256,
        "BLOCK_SIZE_N": 64,
        "BLOCK_SIZE_K": 64,
        "GROUP_SIZE_M": 8,
        "num_stages": 5,
        "num_warps": 32,
        "ms": 0.293782502412796,
        "min_ms": 0.293782502412796,
        "max_ms": 0.293782502412796,
        "compile_time": 1.8903310298919678
    },
    {
        "BLOCK_SIZE_M": 32,
        "BLOCK_SIZE_N": 128,
        "BLOCK_SIZE_K": 64,
        "GROUP_SIZE_M": 8,
        "num_stages": 6,
        "num_warps": 8,
        "ms": 0.29394739866256714,
        "min_ms": 0.29394739866256714,
        "max_ms": 0.29394739866256714,
        "compile_time": 1.123412847518921
    },
    {
        "BLOCK_SIZE_M": 128,
        "BLOCK_SIZE_N": 32,
        "BLOCK_SIZE_K": 128,
        "GROUP_SIZE_M": 8,
        "num_stages": 2,
        "num_warps": 2,
        "ms": 0.2940921187400818,
        "min_ms": 0.2940921187400818,
        "max_ms": 0.2940921187400818,
        "compile_time": 2.81672739982605
    },
    {
        "BLOCK_SIZE_M": 32,
        "BLOCK_SIZE_N": 256,
        "BLOCK_SIZE_K": 64,
        "GROUP_SIZE_M": 8,
        "num_stages": 4,
        "num_warps": 16,
        "ms": 0.29411959648132324,
        "min_ms": 0.29411959648132324,
        "max_ms": 0.29411959648132324,
        "compile_time": 1.1240570545196533
    },
    {
        "BLOCK_SIZE_M": 32,
        "BLOCK_SIZE_N": 256,
        "BLOCK_SIZE_K": 64,
        "GROUP_SIZE_M": 8,
        "num_stages": 2,
        "num_warps": 8,
        "ms": 0.2944265604019165,
        "min_ms": 0.2944265604019165,
        "max_ms": 0.2944265604019165,
        "compile_time": 1.1336932182312012
    },
    {
        "BLOCK_SIZE_M": 512,
        "BLOCK_SIZE_N": 32,
        "BLOCK_SIZE_K": 32,
        "GROUP_SIZE_M": 8,
        "num_stages": 3,
        "num_warps": 16,
        "ms": 0.29463011026382446,
        "min_ms": 0.29463011026382446,
        "max_ms": 0.29463011026382446,
        "compile_time": 2.071223020553589
    },
    {
        "BLOCK_SIZE_M": 32,
        "BLOCK_SIZE_N": 256,
        "BLOCK_SIZE_K": 64,
        "GROUP_SIZE_M": 8,
        "num_stages": 3,
        "num_warps": 16,
        "ms": 0.2947368323802948,
        "min_ms": 0.2947368323802948,
        "max_ms": 0.2947368323802948,
        "compile_time": 1.1226654052734375
    },
    {
        "BLOCK_SIZE_M": 64,
        "BLOCK_SIZE_N": 64,
        "BLOCK_SIZE_K": 64,
        "GROUP_SIZE_M": 8,
        "num_stages": 8,
        "num_warps": 2,
        "ms": 0.29495781660079956,
        "min_ms": 0.29495781660079956,
        "max_ms": 0.29495781660079956,
        "compile_time": 2.4109580516815186
    },
    {
        "BLOCK_SIZE_M": 32,
        "BLOCK_SIZE_N": 128,
        "BLOCK_SIZE_K": 128,
        "GROUP_SIZE_M": 8,
        "num_stages": 4,
        "num_warps": 8,
        "ms": 0.2951146960258484,
        "min_ms": 0.2951146960258484,
        "max_ms": 0.2951146960258484,
        "compile_time": 1.1126112937927246
    },
    {
        "BLOCK_SIZE_M": 32,
        "BLOCK_SIZE_N": 128,
        "BLOCK_SIZE_K": 16,
        "GROUP_SIZE_M": 8,
        "num_stages": 8,
        "num_warps": 4,
        "ms": 0.2951681613922119,
        "min_ms": 0.2951681613922119,
        "max_ms": 0.2951681613922119,
        "compile_time": 1.6341540813446045
    },
    {
        "BLOCK_SIZE_M": 32,
        "BLOCK_SIZE_N": 256,
        "BLOCK_SIZE_K": 64,
        "GROUP_SIZE_M": 8,
        "num_stages": 5,
        "num_warps": 16,
        "ms": 0.29531607031822205,
        "min_ms": 0.29531607031822205,
        "max_ms": 0.29531607031822205,
        "compile_time": 1.1238248348236084
    },
    {
        "BLOCK_SIZE_M": 32,
        "BLOCK_SIZE_N": 128,
        "BLOCK_SIZE_K": 64,
        "GROUP_SIZE_M": 8,
        "num_stages": 7,
        "num_warps": 8,
        "ms": 0.29545676708221436,
        "min_ms": 0.29545676708221436,
        "max_ms": 0.29545676708221436,
        "compile_time": 1.1163229942321777
    },
    {
        "BLOCK_SIZE_M": 128,
        "BLOCK_SIZE_N": 32,
        "BLOCK_SIZE_K": 128,
        "GROUP_SIZE_M": 8,
        "num_stages": 3,
        "num_warps": 2,
        "ms": 0.2955958843231201,
        "min_ms": 0.2955958843231201,
        "max_ms": 0.2955958843231201,
        "compile_time": 3.3135883808135986
    },
    {
        "BLOCK_SIZE_M": 64,
        "BLOCK_SIZE_N": 128,
        "BLOCK_SIZE_K": 32,
        "GROUP_SIZE_M": 8,
        "num_stages": 1,
        "num_warps": 2,
        "ms": 0.29577314853668213,
        "min_ms": 0.29577314853668213,
        "max_ms": 0.29577314853668213,
        "compile_time": 2.1193296909332275
    },
    {
        "BLOCK_SIZE_M": 32,
        "BLOCK_SIZE_N": 128,
        "BLOCK_SIZE_K": 16,
        "GROUP_SIZE_M": 8,
        "num_stages": 6,
        "num_warps": 4,
        "ms": 0.2959684133529663,
        "min_ms": 0.2959684133529663,
        "max_ms": 0.2959684133529663,
        "compile_time": 1.6191792488098145
    },
    {
        "BLOCK_SIZE_M": 256,
        "BLOCK_SIZE_N": 32,
        "BLOCK_SIZE_K": 32,
        "GROUP_SIZE_M": 8,
        "num_stages": 7,
        "num_warps": 8,
        "ms": 0.29614976048469543,
        "min_ms": 0.29614976048469543,
        "max_ms": 0.29614976048469543,
        "compile_time": 2.0547494888305664
    },
    {
        "BLOCK_SIZE_M": 32,
        "BLOCK_SIZE_N": 128,
        "BLOCK_SIZE_K": 16,
        "GROUP_SIZE_M": 8,
        "num_stages": 7,
        "num_warps": 4,
        "ms": 0.29627111554145813,
        "min_ms": 0.29627111554145813,
        "max_ms": 0.29627111554145813,
        "compile_time": 1.615074634552002
    },
    {
        "BLOCK_SIZE_M": 64,
        "BLOCK_SIZE_N": 128,
        "BLOCK_SIZE_K": 64,
        "GROUP_SIZE_M": 8,
        "num_stages": 1,
        "num_warps": 8,
        "ms": 0.2968432903289795,
        "min_ms": 0.2968432903289795,
        "max_ms": 0.2968432903289795,
        "compile_time": 1.1340134143829346
    },
    {
        "BLOCK_SIZE_M": 128,
        "BLOCK_SIZE_N": 64,
        "BLOCK_SIZE_K": 128,
        "GROUP_SIZE_M": 8,
        "num_stages": 2,
        "num_warps": 2,
        "ms": 0.29700180888175964,
        "min_ms": 0.29700180888175964,
        "max_ms": 0.29700180888175964,
        "compile_time": 3.2583835124969482
    },
    {
        "BLOCK_SIZE_M": 128,
        "BLOCK_SIZE_N": 64,
        "BLOCK_SIZE_K": 64,
        "GROUP_SIZE_M": 8,
        "num_stages": 1,
        "num_warps": 8,
        "ms": 0.2970321774482727,
        "min_ms": 0.2970321774482727,
        "max_ms": 0.2970321774482727,
        "compile_time": 1.1530523300170898
    },
    {
        "BLOCK_SIZE_M": 32,
        "BLOCK_SIZE_N": 128,
        "BLOCK_SIZE_K": 16,
        "GROUP_SIZE_M": 8,
        "num_stages": 5,
        "num_warps": 4,
        "ms": 0.2971973121166229,
        "min_ms": 0.2971973121166229,
        "max_ms": 0.2971973121166229,
        "compile_time": 1.592498779296875
    },
    {
        "BLOCK_SIZE_M": 256,
        "BLOCK_SIZE_N": 32,
        "BLOCK_SIZE_K": 128,
        "GROUP_SIZE_M": 8,
        "num_stages": 3,
        "num_warps": 16,
        "ms": 0.2982805371284485,
        "min_ms": 0.2982805371284485,
        "max_ms": 0.2982805371284485,
        "compile_time": 2.0279135704040527
    },
    {
        "BLOCK_SIZE_M": 128,
        "BLOCK_SIZE_N": 32,
        "BLOCK_SIZE_K": 32,
        "GROUP_SIZE_M": 8,
        "num_stages": 7,
        "num_warps": 4,
        "ms": 0.29829806089401245,
        "min_ms": 0.29829806089401245,
        "max_ms": 0.29829806089401245,
        "compile_time": 1.9005184173583984
    },
    {
        "BLOCK_SIZE_M": 256,
        "BLOCK_SIZE_N": 128,
        "BLOCK_SIZE_K": 32,
        "GROUP_SIZE_M": 8,
        "num_stages": 1,
        "num_warps": 32,
        "ms": 0.29831963777542114,
        "min_ms": 0.29831963777542114,
        "max_ms": 0.29831963777542114,
        "compile_time": 1.8255126476287842
    },
    {
        "BLOCK_SIZE_M": 32,
        "BLOCK_SIZE_N": 128,
        "BLOCK_SIZE_K": 256,
        "GROUP_SIZE_M": 8,
        "num_stages": 3,
        "num_warps": 4,
        "ms": 0.29842323064804077,
        "min_ms": 0.29842323064804077,
        "max_ms": 0.29842323064804077,
        "compile_time": 3.1663002967834473
    },
    {
        "BLOCK_SIZE_M": 64,
        "BLOCK_SIZE_N": 64,
        "BLOCK_SIZE_K": 128,
        "GROUP_SIZE_M": 8,
        "num_stages": 3,
        "num_warps": 16,
        "ms": 0.29852381348609924,
        "min_ms": 0.29852381348609924,
        "max_ms": 0.29852381348609924,
        "compile_time": 1.1530649662017822
    },
    {
        "BLOCK_SIZE_M": 128,
        "BLOCK_SIZE_N": 32,
        "BLOCK_SIZE_K": 32,
        "GROUP_SIZE_M": 8,
        "num_stages": 8,
        "num_warps": 4,
        "ms": 0.29873931407928467,
        "min_ms": 0.29873931407928467,
        "max_ms": 0.29873931407928467,
        "compile_time": 1.9090709686279297
    },
    {
        "BLOCK_SIZE_M": 256,
        "BLOCK_SIZE_N": 64,
        "BLOCK_SIZE_K": 256,
        "GROUP_SIZE_M": 8,
        "num_stages": 2,
        "num_warps": 8,
        "ms": 0.29876744747161865,
        "min_ms": 0.29876744747161865,
        "max_ms": 0.29876744747161865,
        "compile_time": 3.0740036964416504
    },
    {
        "BLOCK_SIZE_M": 512,
        "BLOCK_SIZE_N": 32,
        "BLOCK_SIZE_K": 32,
        "GROUP_SIZE_M": 8,
        "num_stages": 5,
        "num_warps": 16,
        "ms": 0.2989799380302429,
        "min_ms": 0.2989799380302429,
        "max_ms": 0.2989799380302429,
        "compile_time": 2.0873444080352783
    },
    {
        "BLOCK_SIZE_M": 128,
        "BLOCK_SIZE_N": 32,
        "BLOCK_SIZE_K": 128,
        "GROUP_SIZE_M": 8,
        "num_stages": 3,
        "num_warps": 8,
        "ms": 0.29904061555862427,
        "min_ms": 0.29904061555862427,
        "max_ms": 0.29904061555862427,
        "compile_time": 1.9581363201141357
    },
    {
        "BLOCK_SIZE_M": 256,
        "BLOCK_SIZE_N": 32,
        "BLOCK_SIZE_K": 32,
        "GROUP_SIZE_M": 8,
        "num_stages": 6,
        "num_warps": 8,
        "ms": 0.2991405725479126,
        "min_ms": 0.2991405725479126,
        "max_ms": 0.2991405725479126,
        "compile_time": 1.937774658203125
    },
    {
        "BLOCK_SIZE_M": 256,
        "BLOCK_SIZE_N": 32,
        "BLOCK_SIZE_K": 32,
        "GROUP_SIZE_M": 8,
        "num_stages": 8,
        "num_warps": 8,
        "ms": 0.29967978596687317,
        "min_ms": 0.29967978596687317,
        "max_ms": 0.29967978596687317,
        "compile_time": 2.01704478263855
    },
    {
        "BLOCK_SIZE_M": 512,
        "BLOCK_SIZE_N": 32,
        "BLOCK_SIZE_K": 64,
        "GROUP_SIZE_M": 8,
        "num_stages": 3,
        "num_warps": 16,
        "ms": 0.2997643053531647,
        "min_ms": 0.2997643053531647,
        "max_ms": 0.2997643053531647,
        "compile_time": 2.211643695831299
    },
    {
        "BLOCK_SIZE_M": 32,
        "BLOCK_SIZE_N": 128,
        "BLOCK_SIZE_K": 128,
        "GROUP_SIZE_M": 8,
        "num_stages": 5,
        "num_warps": 8,
        "ms": 0.3004394769668579,
        "min_ms": 0.3004394769668579,
        "max_ms": 0.3004394769668579,
        "compile_time": 1.8557093143463135
    },
    {
        "BLOCK_SIZE_M": 32,
        "BLOCK_SIZE_N": 128,
        "BLOCK_SIZE_K": 64,
        "GROUP_SIZE_M": 8,
        "num_stages": 8,
        "num_warps": 8,
        "ms": 0.3007831871509552,
        "min_ms": 0.3007831871509552,
        "max_ms": 0.3007831871509552,
        "compile_time": 1.1098694801330566
    },
    {
        "BLOCK_SIZE_M": 64,
        "BLOCK_SIZE_N": 256,
        "BLOCK_SIZE_K": 16,
        "GROUP_SIZE_M": 8,
        "num_stages": 2,
        "num_warps": 8,
        "ms": 0.30108800530433655,
        "min_ms": 0.30108800530433655,
        "max_ms": 0.30108800530433655,
        "compile_time": 1.1541974544525146
    },
    {
        "BLOCK_SIZE_M": 32,
        "BLOCK_SIZE_N": 256,
        "BLOCK_SIZE_K": 32,
        "GROUP_SIZE_M": 8,
        "num_stages": 2,
        "num_warps": 8,
        "ms": 0.3014603555202484,
        "min_ms": 0.3014603555202484,
        "max_ms": 0.3014603555202484,
        "compile_time": 1.075552225112915
    },
    {
        "BLOCK_SIZE_M": 128,
        "BLOCK_SIZE_N": 256,
        "BLOCK_SIZE_K": 32,
        "GROUP_SIZE_M": 8,
        "num_stages": 1,
        "num_warps": 16,
        "ms": 0.3015778958797455,
        "min_ms": 0.3015778958797455,
        "max_ms": 0.3015778958797455,
        "compile_time": 1.2069931030273438
    },
    {
        "BLOCK_SIZE_M": 32,
        "BLOCK_SIZE_N": 128,
        "BLOCK_SIZE_K": 64,
        "GROUP_SIZE_M": 8,
        "num_stages": 2,
        "num_warps": 8,
        "ms": 0.30161258578300476,
        "min_ms": 0.30161258578300476,
        "max_ms": 0.30161258578300476,
        "compile_time": 1.126213788986206
    },
    {
        "BLOCK_SIZE_M": 128,
        "BLOCK_SIZE_N": 128,
        "BLOCK_SIZE_K": 16,
        "GROUP_SIZE_M": 8,
        "num_stages": 6,
        "num_warps": 16,
        "ms": 0.3016323745250702,
        "min_ms": 0.3016323745250702,
        "max_ms": 0.3016323745250702,
        "compile_time": 1.2267670631408691
    },
    {
        "BLOCK_SIZE_M": 128,
        "BLOCK_SIZE_N": 128,
        "BLOCK_SIZE_K": 16,
        "GROUP_SIZE_M": 8,
        "num_stages": 5,
        "num_warps": 16,
        "ms": 0.3016994595527649,
        "min_ms": 0.3016994595527649,
        "max_ms": 0.3016994595527649,
        "compile_time": 1.7595643997192383
    },
    {
        "BLOCK_SIZE_M": 256,
        "BLOCK_SIZE_N": 32,
        "BLOCK_SIZE_K": 64,
        "GROUP_SIZE_M": 8,
        "num_stages": 3,
        "num_warps": 16,
        "ms": 0.30205804109573364,
        "min_ms": 0.30205804109573364,
        "max_ms": 0.30205804109573364,
        "compile_time": 1.8843295574188232
    },
    {
        "BLOCK_SIZE_M": 32,
        "BLOCK_SIZE_N": 128,
        "BLOCK_SIZE_K": 64,
        "GROUP_SIZE_M": 8,
        "num_stages": 2,
        "num_warps": 2,
        "ms": 0.3022647202014923,
        "min_ms": 0.3022647202014923,
        "max_ms": 0.3022647202014923,
        "compile_time": 2.042177200317383
    },
    {
        "BLOCK_SIZE_M": 128,
        "BLOCK_SIZE_N": 128,
        "BLOCK_SIZE_K": 16,
        "GROUP_SIZE_M": 8,
        "num_stages": 7,
        "num_warps": 16,
        "ms": 0.3026140332221985,
        "min_ms": 0.3026140332221985,
        "max_ms": 0.3026140332221985,
        "compile_time": 1.8116824626922607
    },
    {
        "BLOCK_SIZE_M": 128,
        "BLOCK_SIZE_N": 128,
        "BLOCK_SIZE_K": 16,
        "GROUP_SIZE_M": 8,
        "num_stages": 4,
        "num_warps": 16,
        "ms": 0.3031039834022522,
        "min_ms": 0.3031039834022522,
        "max_ms": 0.3031039834022522,
        "compile_time": 1.1982285976409912
    },
    {
        "BLOCK_SIZE_M": 256,
        "BLOCK_SIZE_N": 128,
        "BLOCK_SIZE_K": 32,
        "GROUP_SIZE_M": 8,
        "num_stages": 2,
        "num_warps": 16,
        "ms": 0.30341947078704834,
        "min_ms": 0.30341947078704834,
        "max_ms": 0.30341947078704834,
        "compile_time": 1.9990861415863037
    },
    {
        "BLOCK_SIZE_M": 64,
        "BLOCK_SIZE_N": 512,
        "BLOCK_SIZE_K": 32,
        "GROUP_SIZE_M": 8,
        "num_stages": 2,
        "num_warps": 16,
        "ms": 0.3035005033016205,
        "min_ms": 0.3035005033016205,
        "max_ms": 0.3035005033016205,
        "compile_time": 1.1612143516540527
    },
    {
        "BLOCK_SIZE_M": 256,
        "BLOCK_SIZE_N": 32,
        "BLOCK_SIZE_K": 64,
        "GROUP_SIZE_M": 8,
        "num_stages": 4,
        "num_warps": 16,
        "ms": 0.30361175537109375,
        "min_ms": 0.30361175537109375,
        "max_ms": 0.30361175537109375,
        "compile_time": 1.9177625179290771
    },
    {
        "BLOCK_SIZE_M": 32,
        "BLOCK_SIZE_N": 128,
        "BLOCK_SIZE_K": 32,
        "GROUP_SIZE_M": 8,
        "num_stages": 3,
        "num_warps": 8,
        "ms": 0.30364224314689636,
        "min_ms": 0.30364224314689636,
        "max_ms": 0.30364224314689636,
        "compile_time": 1.5111510753631592
    },
    {
        "BLOCK_SIZE_M": 64,
        "BLOCK_SIZE_N": 128,
        "BLOCK_SIZE_K": 256,
        "GROUP_SIZE_M": 8,
        "num_stages": 2,
        "num_warps": 4,
        "ms": 0.30388718843460083,
        "min_ms": 0.30388718843460083,
        "max_ms": 0.30388718843460083,
        "compile_time": 3.054633617401123
    },
    {
        "BLOCK_SIZE_M": 128,
        "BLOCK_SIZE_N": 64,
        "BLOCK_SIZE_K": 32,
        "GROUP_SIZE_M": 8,
        "num_stages": 3,
        "num_warps": 16,
        "ms": 0.3039514422416687,
        "min_ms": 0.3039514422416687,
        "max_ms": 0.3039514422416687,
        "compile_time": 1.198683261871338
    },
    {
        "BLOCK_SIZE_M": 32,
        "BLOCK_SIZE_N": 128,
        "BLOCK_SIZE_K": 32,
        "GROUP_SIZE_M": 8,
        "num_stages": 5,
        "num_warps": 8,
        "ms": 0.30415627360343933,
        "min_ms": 0.30415627360343933,
        "max_ms": 0.30415627360343933,
        "compile_time": 1.6029961109161377
    },
    {
        "BLOCK_SIZE_M": 128,
        "BLOCK_SIZE_N": 32,
        "BLOCK_SIZE_K": 64,
        "GROUP_SIZE_M": 8,
        "num_stages": 6,
        "num_warps": 8,
        "ms": 0.3041744530200958,
        "min_ms": 0.3041744530200958,
        "max_ms": 0.3041744530200958,
        "compile_time": 1.8783535957336426
    },
    {
        "BLOCK_SIZE_M": 128,
        "BLOCK_SIZE_N": 32,
        "BLOCK_SIZE_K": 64,
        "GROUP_SIZE_M": 8,
        "num_stages": 2,
        "num_warps": 8,
        "ms": 0.30429354310035706,
        "min_ms": 0.30429354310035706,
        "max_ms": 0.30429354310035706,
        "compile_time": 1.196399211883545
    },
    {
        "BLOCK_SIZE_M": 128,
        "BLOCK_SIZE_N": 64,
        "BLOCK_SIZE_K": 32,
        "GROUP_SIZE_M": 8,
        "num_stages": 4,
        "num_warps": 16,
        "ms": 0.30454474687576294,
        "min_ms": 0.30454474687576294,
        "max_ms": 0.30454474687576294,
        "compile_time": 1.1965606212615967
    },
    {
        "BLOCK_SIZE_M": 32,
        "BLOCK_SIZE_N": 64,
        "BLOCK_SIZE_K": 64,
        "GROUP_SIZE_M": 8,
        "num_stages": 3,
        "num_warps": 2,
        "ms": 0.30466988682746887,
        "min_ms": 0.30466988682746887,
        "max_ms": 0.30466988682746887,
        "compile_time": 1.770601511001587
    },
    {
        "BLOCK_SIZE_M": 32,
        "BLOCK_SIZE_N": 64,
        "BLOCK_SIZE_K": 32,
        "GROUP_SIZE_M": 8,
        "num_stages": 6,
        "num_warps": 2,
        "ms": 0.30494022369384766,
        "min_ms": 0.30494022369384766,
        "max_ms": 0.30494022369384766,
        "compile_time": 1.7107949256896973
    },
    {
        "BLOCK_SIZE_M": 64,
        "BLOCK_SIZE_N": 256,
        "BLOCK_SIZE_K": 128,
        "GROUP_SIZE_M": 8,
        "num_stages": 1,
        "num_warps": 16,
        "ms": 0.30511313676834106,
        "min_ms": 0.30511313676834106,
        "max_ms": 0.30511313676834106,
        "compile_time": 1.127446174621582
    },
    {
        "BLOCK_SIZE_M": 32,
        "BLOCK_SIZE_N": 128,
        "BLOCK_SIZE_K": 32,
        "GROUP_SIZE_M": 8,
        "num_stages": 4,
        "num_warps": 8,
        "ms": 0.3051232695579529,
        "min_ms": 0.3051232695579529,
        "max_ms": 0.3051232695579529,
        "compile_time": 1.553443193435669
    },
    {
        "BLOCK_SIZE_M": 128,
        "BLOCK_SIZE_N": 32,
        "BLOCK_SIZE_K": 256,
        "GROUP_SIZE_M": 8,
        "num_stages": 2,
        "num_warps": 4,
        "ms": 0.30518031120300293,
        "min_ms": 0.30518031120300293,
        "max_ms": 0.30518031120300293,
        "compile_time": 2.7534050941467285
    },
    {
        "BLOCK_SIZE_M": 32,
        "BLOCK_SIZE_N": 256,
        "BLOCK_SIZE_K": 32,
        "GROUP_SIZE_M": 8,
        "num_stages": 4,
        "num_warps": 16,
        "ms": 0.305197536945343,
        "min_ms": 0.305197536945343,
        "max_ms": 0.305197536945343,
        "compile_time": 1.5775861740112305
    },
    {
        "BLOCK_SIZE_M": 256,
        "BLOCK_SIZE_N": 64,
        "BLOCK_SIZE_K": 128,
        "GROUP_SIZE_M": 8,
        "num_stages": 2,
        "num_warps": 4,
        "ms": 0.30543485283851624,
        "min_ms": 0.30543485283851624,
        "max_ms": 0.30543485283851624,
        "compile_time": 3.3147387504577637
    },
    {
        "BLOCK_SIZE_M": 256,
        "BLOCK_SIZE_N": 64,
        "BLOCK_SIZE_K": 16,
        "GROUP_SIZE_M": 8,
        "num_stages": 6,
        "num_warps": 16,
        "ms": 0.3055815100669861,
        "min_ms": 0.3055815100669861,
        "max_ms": 0.3055815100669861,
        "compile_time": 1.2385337352752686
    },
    {
        "BLOCK_SIZE_M": 256,
        "BLOCK_SIZE_N": 128,
        "BLOCK_SIZE_K": 32,
        "GROUP_SIZE_M": 8,
        "num_stages": 1,
        "num_warps": 8,
        "ms": 0.30566221475601196,
        "min_ms": 0.30566221475601196,
        "max_ms": 0.30566221475601196,
        "compile_time": 2.269033432006836
    },
    {
        "BLOCK_SIZE_M": 128,
        "BLOCK_SIZE_N": 32,
        "BLOCK_SIZE_K": 256,
        "GROUP_SIZE_M": 8,
        "num_stages": 3,
        "num_warps": 4,
        "ms": 0.3056921660900116,
        "min_ms": 0.3056921660900116,
        "max_ms": 0.3056921660900116,
        "compile_time": 3.361416816711426
    },
    {
        "BLOCK_SIZE_M": 128,
        "BLOCK_SIZE_N": 64,
        "BLOCK_SIZE_K": 32,
        "GROUP_SIZE_M": 8,
        "num_stages": 5,
        "num_warps": 16,
        "ms": 0.30636245012283325,
        "min_ms": 0.30636245012283325,
        "max_ms": 0.30636245012283325,
        "compile_time": 1.206568717956543
    },
    {
        "BLOCK_SIZE_M": 64,
        "BLOCK_SIZE_N": 128,
        "BLOCK_SIZE_K": 32,
        "GROUP_SIZE_M": 8,
        "num_stages": 3,
        "num_warps": 16,
        "ms": 0.30647504329681396,
        "min_ms": 0.30647504329681396,
        "max_ms": 0.30647504329681396,
        "compile_time": 1.1698968410491943
    },
    {
        "BLOCK_SIZE_M": 128,
        "BLOCK_SIZE_N": 64,
        "BLOCK_SIZE_K": 32,
        "GROUP_SIZE_M": 8,
        "num_stages": 6,
        "num_warps": 16,
        "ms": 0.3066723346710205,
        "min_ms": 0.3066723346710205,
        "max_ms": 0.3066723346710205,
        "compile_time": 1.2020621299743652
    },
    {
        "BLOCK_SIZE_M": 32,
        "BLOCK_SIZE_N": 256,
        "BLOCK_SIZE_K": 32,
        "GROUP_SIZE_M": 8,
        "num_stages": 5,
        "num_warps": 16,
        "ms": 0.3067363500595093,
        "min_ms": 0.3067363500595093,
        "max_ms": 0.3067363500595093,
        "compile_time": 1.1302363872528076
    },
    {
        "BLOCK_SIZE_M": 32,
        "BLOCK_SIZE_N": 256,
        "BLOCK_SIZE_K": 32,
        "GROUP_SIZE_M": 8,
        "num_stages": 3,
        "num_warps": 16,
        "ms": 0.30678194761276245,
        "min_ms": 0.30678194761276245,
