simdata/FP16-R100/3072_results.json
[
    {
        "BLOCK_SIZE_M": 128,
        "BLOCK_SIZE_N": 256,
        "BLOCK_SIZE_K": 32,
        "GROUP_SIZE_M": 8,
        "num_stages": 4,
        "num_warps": 8,
        "ms": 0.2485758513212204,
        "min_ms": 0.2485758513212204,
        "max_ms": 0.2485758513212204,
        "compile_time": 2.4429190158843994
    },
    {
        "BLOCK_SIZE_M": 256,
        "BLOCK_SIZE_N": 128,
        "BLOCK_SIZE_K": 32,
        "GROUP_SIZE_M": 8,
        "num_stages": 4,
        "num_warps": 8,
        "ms": 0.2496573030948639,
        "min_ms": 0.2496573030948639,
        "max_ms": 0.2496573030948639,
        "compile_time": 2.569267511367798
    },
    {
        "BLOCK_SIZE_M": 128,
        "BLOCK_SIZE_N": 256,
        "BLOCK_SIZE_K": 32,
        "GROUP_SIZE_M": 8,
        "num_stages": 5,
        "num_warps": 8,
        "ms": 0.2500912547111511,
        "min_ms": 0.2500912547111511,
        "max_ms": 0.2500912547111511,
        "compile_time": 2.377129554748535
    },
    {
        "BLOCK_SIZE_M": 128,
        "BLOCK_SIZE_N": 256,
        "BLOCK_SIZE_K": 32,
        "GROUP_SIZE_M": 8,
        "num_stages": 6,
        "num_warps": 8,
        "ms": 0.2510097622871399,
        "min_ms": 0.2510097622871399,
        "max_ms": 0.2510097622871399,
        "compile_time": 2.5108070373535156
    },
    {
        "BLOCK_SIZE_M": 128,
        "BLOCK_SIZE_N": 256,
        "BLOCK_SIZE_K": 32,
        "GROUP_SIZE_M": 8,
        "num_stages": 3,
        "num_warps": 8,
        "ms": 0.25108930468559265,
        "min_ms": 0.25108930468559265,
        "max_ms": 0.25108930468559265,
        "compile_time": 2.41951060295105
    },
    {
        "BLOCK_SIZE_M": 256,
        "BLOCK_SIZE_N": 128,
        "BLOCK_SIZE_K": 32,
        "GROUP_SIZE_M": 8,
        "num_stages": 5,
        "num_warps": 8,
        "ms": 0.25174662470817566,
        "min_ms": 0.25174662470817566,
        "max_ms": 0.25174662470817566,
        "compile_time": 2.5859785079956055
    },
    {
        "BLOCK_SIZE_M": 256,
        "BLOCK_SIZE_N": 128,
        "BLOCK_SIZE_K": 32,
        "GROUP_SIZE_M": 8,
        "num_stages": 3,
        "num_warps": 8,
        "ms": 0.25188177824020386,
        "min_ms": 0.25188177824020386,
        "max_ms": 0.25188177824020386,
        "compile_time": 2.522847890853882
    },
    {
        "BLOCK_SIZE_M": 256,
        "BLOCK_SIZE_N": 128,
        "BLOCK_SIZE_K": 32,
        "GROUP_SIZE_M": 8,
        "num_stages": 7,
        "num_warps": 8,
        "ms": 0.2522425055503845,
        "min_ms": 0.2522425055503845,
        "max_ms": 0.2522425055503845,
        "compile_time": 2.6029579639434814
    },
    {
        "BLOCK_SIZE_M": 128,
        "BLOCK_SIZE_N": 256,
        "BLOCK_SIZE_K": 32,
        "GROUP_SIZE_M": 8,
        "num_stages": 7,
        "num_warps": 8,
        "ms": 0.2528872787952423,
        "min_ms": 0.2528872787952423,
        "max_ms": 0.2528872787952423,
        "compile_time": 2.5389304161071777
    },
    {
        "BLOCK_SIZE_M": 256,
        "BLOCK_SIZE_N": 128,
        "BLOCK_SIZE_K": 32,
        "GROUP_SIZE_M": 8,
        "num_stages": 6,
        "num_warps": 8,
        "ms": 0.25376227498054504,
        "min_ms": 0.25376227498054504,
        "max_ms": 0.25376227498054504,
        "compile_time": 2.5799596309661865
    },
    {
        "BLOCK_SIZE_M": 128,
        "BLOCK_SIZE_N": 128,
        "BLOCK_SIZE_K": 32,
        "GROUP_SIZE_M": 8,
        "num_stages": 4,
        "num_warps": 4,
        "ms": 0.25754299759864807,
        "min_ms": 0.25754299759864807,
        "max_ms": 0.25754299759864807,
        "compile_time": 2.4981770515441895
    },
    {
        "BLOCK_SIZE_M": 128,
        "BLOCK_SIZE_N": 128,
        "BLOCK_SIZE_K": 32,
        "GROUP_SIZE_M": 8,
        "num_stages": 5,
        "num_warps": 4,
        "ms": 0.2589888572692871,
        "min_ms": 0.2589888572692871,
        "max_ms": 0.2589888572692871,
        "compile_time": 2.5325024127960205
    },
    {
        "BLOCK_SIZE_M": 128,
        "BLOCK_SIZE_N": 128,
        "BLOCK_SIZE_K": 32,
        "GROUP_SIZE_M": 8,
        "num_stages": 6,
        "num_warps": 4,
        "ms": 0.2607435882091522,
        "min_ms": 0.2607435882091522,
        "max_ms": 0.2607435882091522,
        "compile_time": 2.546269178390503
    },
    {
        "BLOCK_SIZE_M": 128,
        "BLOCK_SIZE_N": 128,
        "BLOCK_SIZE_K": 64,
        "GROUP_SIZE_M": 8,
        "num_stages": 3,
        "num_warps": 4,
        "ms": 0.26088327169418335,
        "min_ms": 0.26088327169418335,
        "max_ms": 0.26088327169418335,
        "compile_time": 2.6054186820983887
    },
    {
        "BLOCK_SIZE_M": 128,
        "BLOCK_SIZE_N": 128,
        "BLOCK_SIZE_K": 32,
        "GROUP_SIZE_M": 8,
        "num_stages": 3,
        "num_warps": 4,
        "ms": 0.2612634301185608,
        "min_ms": 0.2612634301185608,
        "max_ms": 0.2612634301185608,
        "compile_time": 2.4676101207733154
    },
    {
        "BLOCK_SIZE_M": 256,
        "BLOCK_SIZE_N": 128,
        "BLOCK_SIZE_K": 64,
        "GROUP_SIZE_M": 8,
        "num_stages": 3,
        "num_warps": 8,
        "ms": 0.2624448835849762,
        "min_ms": 0.2624448835849762,
        "max_ms": 0.2624448835849762,
        "compile_time": 2.6673800945281982
    },
    {
        "BLOCK_SIZE_M": 256,
        "BLOCK_SIZE_N": 128,
        "BLOCK_SIZE_K": 64,
        "GROUP_SIZE_M": 8,
        "num_stages": 4,
        "num_warps": 8,
        "ms": 0.26305508613586426,
        "min_ms": 0.26305508613586426,
        "max_ms": 0.26305508613586426,
        "compile_time": 2.701166868209839
    },
    {
        "BLOCK_SIZE_M": 64,
        "BLOCK_SIZE_N": 256,
        "BLOCK_SIZE_K": 32,
        "GROUP_SIZE_M": 8,
        "num_stages": 4,
        "num_warps": 4,
        "ms": 0.27078357338905334,
        "min_ms": 0.27078357338905334,
        "max_ms": 0.27078357338905334,
        "compile_time": 2.508439064025879
    },
    {
        "BLOCK_SIZE_M": 128,
        "BLOCK_SIZE_N": 256,
        "BLOCK_SIZE_K": 64,
        "GROUP_SIZE_M": 8,
        "num_stages": 4,
        "num_warps": 8,
        "ms": 0.2709583640098572,
        "min_ms": 0.2709583640098572,
        "max_ms": 0.2709583640098572,
        "compile_time": 2.623342752456665
    },
    {
        "BLOCK_SIZE_M": 128,
        "BLOCK_SIZE_N": 256,
        "BLOCK_SIZE_K": 64,
        "GROUP_SIZE_M": 8,
        "num_stages": 3,
        "num_warps": 8,
        "ms": 0.27140122652053833,
        "min_ms": 0.27140122652053833,
        "max_ms": 0.27140122652053833,
        "compile_time": 2.644094944000244
    },
    {
        "BLOCK_SIZE_M": 128,
        "BLOCK_SIZE_N": 128,
        "BLOCK_SIZE_K": 32,
        "GROUP_SIZE_M": 8,
        "num_stages": 8,
        "num_warps": 4,
        "ms": 0.27158522605895996,
        "min_ms": 0.27158522605895996,
        "max_ms": 0.27158522605895996,
        "compile_time": 2.5832879543304443
    },
    {
        "BLOCK_SIZE_M": 64,
        "BLOCK_SIZE_N": 512,
        "BLOCK_SIZE_K": 32,
        "GROUP_SIZE_M": 8,
        "num_stages": 3,
        "num_warps": 8,
        "ms": 0.2719510495662689,
        "min_ms": 0.2719510495662689,
        "max_ms": 0.2719510495662689,
        "compile_time": 1.3955817222595215
    },
    {
        "BLOCK_SIZE_M": 128,
        "BLOCK_SIZE_N": 128,
        "BLOCK_SIZE_K": 32,
        "GROUP_SIZE_M": 8,
        "num_stages": 7,
        "num_warps": 4,
        "ms": 0.2720552384853363,
        "min_ms": 0.2720552384853363,
        "max_ms": 0.2720552384853363,
        "compile_time": 2.5599212646484375
    },
    {
        "BLOCK_SIZE_M": 64,
        "BLOCK_SIZE_N": 256,
        "BLOCK_SIZE_K": 32,
        "GROUP_SIZE_M": 8,
        "num_stages": 3,
        "num_warps": 4,
        "ms": 0.27247580885887146,
        "min_ms": 0.27247580885887146,
        "max_ms": 0.27247580885887146,
        "compile_time": 2.3717312812805176
    },
    {
        "BLOCK_SIZE_M": 128,
        "BLOCK_SIZE_N": 128,
        "BLOCK_SIZE_K": 64,
        "GROUP_SIZE_M": 8,
        "num_stages": 2,
        "num_warps": 4,
        "ms": 0.27303895354270935,
        "min_ms": 0.27303895354270935,
        "max_ms": 0.27303895354270935,
        "compile_time": 2.4299261569976807
    },
    {
        "BLOCK_SIZE_M": 64,
        "BLOCK_SIZE_N": 512,
        "BLOCK_SIZE_K": 32,
        "GROUP_SIZE_M": 8,
        "num_stages": 5,
        "num_warps": 8,
        "ms": 0.2738003134727478,
        "min_ms": 0.2738003134727478,
        "max_ms": 0.2738003134727478,
        "compile_time": 1.3339464664459229
    },
    {
        "BLOCK_SIZE_M": 64,
        "BLOCK_SIZE_N": 256,
        "BLOCK_SIZE_K": 32,
        "GROUP_SIZE_M": 8,
        "num_stages": 5,
        "num_warps": 4,
        "ms": 0.2739845812320709,
        "min_ms": 0.2739845812320709,
        "max_ms": 0.2739845812320709,
        "compile_time": 2.5431015491485596
    },
    {
        "BLOCK_SIZE_M": 128,
        "BLOCK_SIZE_N": 128,
        "BLOCK_SIZE_K": 64,
        "GROUP_SIZE_M": 8,
        "num_stages": 4,
        "num_warps": 8,
        "ms": 0.2775910496711731,
        "min_ms": 0.2775910496711731,
        "max_ms": 0.2775910496711731,
        "compile_time": 1.2525925636291504
    },
    {
        "BLOCK_SIZE_M": 128,
        "BLOCK_SIZE_N": 128,
        "BLOCK_SIZE_K": 64,
        "GROUP_SIZE_M": 8,
        "num_stages": 3,
        "num_warps": 8,
        "ms": 0.27855321764945984,
        "min_ms": 0.27855321764945984,
        "max_ms": 0.27855321764945984,
        "compile_time": 2.1794703006744385
    },
    {
        "BLOCK_SIZE_M": 128,
        "BLOCK_SIZE_N": 128,
        "BLOCK_SIZE_K": 64,
        "GROUP_SIZE_M": 8,
        "num_stages": 5,
        "num_warps": 8,
        "ms": 0.28006798028945923,
        "min_ms": 0.28006798028945923,
        "max_ms": 0.28006798028945923,
        "compile_time": 1.2682571411132812
    },
    {
        "BLOCK_SIZE_M": 128,
        "BLOCK_SIZE_N": 128,
        "BLOCK_SIZE_K": 64,
        "GROUP_SIZE_M": 8,
        "num_stages": 6,
        "num_warps": 8,
        "ms": 0.2823026776313782,
        "min_ms": 0.2823026776313782,
        "max_ms": 0.2823026776313782,
        "compile_time": 2.3160455226898193
    },
    {
        "BLOCK_SIZE_M": 512,
        "BLOCK_SIZE_N": 64,
        "BLOCK_SIZE_K": 64,
        "GROUP_SIZE_M": 8,
        "num_stages": 3,
        "num_warps": 8,
        "ms": 0.28374722599983215,
        "min_ms": 0.28374722599983215,
        "max_ms": 0.28374722599983215,
        "compile_time": 2.77492094039917
    },
    {
        "BLOCK_SIZE_M": 512,
        "BLOCK_SIZE_N": 64,
        "BLOCK_SIZE_K": 32,
        "GROUP_SIZE_M": 8,
        "num_stages": 3,
        "num_warps": 8,
        "ms": 0.2845219671726227,
        "min_ms": 0.2845219671726227,
        "max_ms": 0.2845219671726227,
        "compile_time": 2.6197073459625244
    },
    {
        "BLOCK_SIZE_M": 128,
        "BLOCK_SIZE_N": 128,
        "BLOCK_SIZE_K": 128,
        "GROUP_SIZE_M": 8,
        "num_stages": 3,
        "num_warps": 8,
        "ms": 0.28515392541885376,
        "min_ms": 0.28515392541885376,
        "max_ms": 0.28515392541885376,
        "compile_time": 2.3146347999572754
    },
    {
        "BLOCK_SIZE_M": 256,
        "BLOCK_SIZE_N": 64,
        "BLOCK_SIZE_K": 32,
        "GROUP_SIZE_M": 8,
        "num_stages": 5,
        "num_warps": 4,
        "ms": 0.2851952612400055,
        "min_ms": 0.2851952612400055,
        "max_ms": 0.2851952612400055,
        "compile_time": 2.7305095195770264
    },
    {
        "BLOCK_SIZE_M": 512,
        "BLOCK_SIZE_N": 64,
        "BLOCK_SIZE_K": 32,
        "GROUP_SIZE_M": 8,
        "num_stages": 4,
        "num_warps": 8,
        "ms": 0.28529641032218933,
        "min_ms": 0.28529641032218933,
        "max_ms": 0.28529641032218933,
        "compile_time": 2.7840769290924072
    },
    {
        "BLOCK_SIZE_M": 256,
        "BLOCK_SIZE_N": 64,
        "BLOCK_SIZE_K": 32,
        "GROUP_SIZE_M": 8,
        "num_stages": 4,
        "num_warps": 4,
        "ms": 0.28745412826538086,
        "min_ms": 0.28745412826538086,
        "max_ms": 0.28745412826538086,
        "compile_time": 2.651871919631958
    },
    {
        "BLOCK_SIZE_M": 512,
        "BLOCK_SIZE_N": 64,
        "BLOCK_SIZE_K": 32,
        "GROUP_SIZE_M": 8,
        "num_stages": 5,
        "num_warps": 8,
        "ms": 0.2876022458076477,
        "min_ms": 0.2876022458076477,
        "max_ms": 0.2876022458076477,
        "compile_time": 2.7220687866210938
    },
    {
        "BLOCK_SIZE_M": 256,
        "BLOCK_SIZE_N": 64,
        "BLOCK_SIZE_K": 64,
        "GROUP_SIZE_M": 8,
        "num_stages": 3,
        "num_warps": 4,
        "ms": 0.2900179326534271,
        "min_ms": 0.2900179326534271,
        "max_ms": 0.2900179326534271,
        "compile_time": 2.9388952255249023
    },
    {
        "BLOCK_SIZE_M": 128,
        "BLOCK_SIZE_N": 128,
        "BLOCK_SIZE_K": 64,
        "GROUP_SIZE_M": 8,
        "num_stages": 4,
        "num_warps": 4,
        "ms": 0.2903459966182709,
        "min_ms": 0.2903459966182709,
        "max_ms": 0.2903459966182709,
        "compile_time": 2.6828808784484863
    },
    {
        "BLOCK_SIZE_M": 128,
        "BLOCK_SIZE_N": 128,
        "BLOCK_SIZE_K": 64,
        "GROUP_SIZE_M": 8,
        "num_stages": 5,
        "num_warps": 4,
        "ms": 0.2909013330936432,
        "min_ms": 0.2909013330936432,
        "max_ms": 0.2909013330936432,
        "compile_time": 2.7885072231292725
    },
    {
        "BLOCK_SIZE_M": 256,
        "BLOCK_SIZE_N": 64,
        "BLOCK_SIZE_K": 32,
        "GROUP_SIZE_M": 8,
        "num_stages": 3,
        "num_warps": 4,
        "ms": 0.29120779037475586,
        "min_ms": 0.29120779037475586,
        "max_ms": 0.29120779037475586,
        "compile_time": 2.620863437652588
    },
    {
        "BLOCK_SIZE_M": 256,
        "BLOCK_SIZE_N": 64,
        "BLOCK_SIZE_K": 64,
        "GROUP_SIZE_M": 8,
        "num_stages": 4,
        "num_warps": 8,
        "ms": 0.29220253229141235,
        "min_ms": 0.29220253229141235,
        "max_ms": 0.29220253229141235,
        "compile_time": 2.433375358581543
    },
    {
        "BLOCK_SIZE_M": 64,
        "BLOCK_SIZE_N": 256,
        "BLOCK_SIZE_K": 64,
        "GROUP_SIZE_M": 8,
        "num_stages": 3,
        "num_warps": 4,
        "ms": 0.2933712303638458,
        "min_ms": 0.2933712303638458,
        "max_ms": 0.2933712303638458,
        "compile_time": 2.7689881324768066
    },
    {
        "BLOCK_SIZE_M": 256,
        "BLOCK_SIZE_N": 64,
        "BLOCK_SIZE_K": 64,
        "GROUP_SIZE_M": 8,
        "num_stages": 3,
        "num_warps": 8,
        "ms": 0.2942538261413574,
        "min_ms": 0.2942538261413574,
        "max_ms": 0.2942538261413574,
        "compile_time": 2.363835096359253
    },
    {
        "BLOCK_SIZE_M": 128,
        "BLOCK_SIZE_N": 128,
        "BLOCK_SIZE_K": 64,
        "GROUP_SIZE_M": 8,
        "num_stages": 6,
        "num_warps": 4,
        "ms": 0.295705109834671,
        "min_ms": 0.295705109834671,
        "max_ms": 0.295705109834671,
        "compile_time": 2.8308682441711426
    },
    {
        "BLOCK_SIZE_M": 128,
        "BLOCK_SIZE_N": 128,
        "BLOCK_SIZE_K": 32,
        "GROUP_SIZE_M": 8,
        "num_stages": 4,
        "num_warps": 8,
        "ms": 0.2975921928882599,
        "min_ms": 0.2975921928882599,
        "max_ms": 0.2975921928882599,
        "compile_time": 1.2607519626617432
    },
    {
        "BLOCK_SIZE_M": 256,
        "BLOCK_SIZE_N": 64,
        "BLOCK_SIZE_K": 64,
        "GROUP_SIZE_M": 8,
        "num_stages": 5,
        "num_warps": 8,
        "ms": 0.2976922392845154,
        "min_ms": 0.2976922392845154,
        "max_ms": 0.2976922392845154,
        "compile_time": 2.4494810104370117
    },
    {
        "BLOCK_SIZE_M": 128,
        "BLOCK_SIZE_N": 128,
        "BLOCK_SIZE_K": 32,
        "GROUP_SIZE_M": 8,
        "num_stages": 5,
        "num_warps": 8,
        "ms": 0.2989436388015747,
        "min_ms": 0.2989436388015747,
        "max_ms": 0.2989436388015747,
        "compile_time": 1.2672579288482666
    },
    {
        "BLOCK_SIZE_M": 128,
        "BLOCK_SIZE_N": 128,
        "BLOCK_SIZE_K": 32,
        "GROUP_SIZE_M": 8,
        "num_stages": 7,
        "num_warps": 8,
        "ms": 0.2990277111530304,
        "min_ms": 0.2990277111530304,
        "max_ms": 0.2990277111530304,
        "compile_time": 2.0707859992980957
    },
    {
        "BLOCK_SIZE_M": 128,
        "BLOCK_SIZE_N": 128,
        "BLOCK_SIZE_K": 32,
        "GROUP_SIZE_M": 8,
        "num_stages": 6,
        "num_warps": 8,
        "ms": 0.2991195321083069,
        "min_ms": 0.2991195321083069,
        "max_ms": 0.2991195321083069,
        "compile_time": 1.257448673248291
    },
    {
        "BLOCK_SIZE_M": 128,
        "BLOCK_SIZE_N": 128,
        "BLOCK_SIZE_K": 32,
        "GROUP_SIZE_M": 8,
        "num_stages": 8,
        "num_warps": 8,
        "ms": 0.29980748891830444,
        "min_ms": 0.29980748891830444,
        "max_ms": 0.29980748891830444,
        "compile_time": 2.0638954639434814
    },
    {
        "BLOCK_SIZE_M": 64,
        "BLOCK_SIZE_N": 256,
        "BLOCK_SIZE_K": 64,
        "GROUP_SIZE_M": 8,
        "num_stages": 4,
        "num_warps": 8,
        "ms": 0.2999308705329895,
        "min_ms": 0.2999308705329895,
        "max_ms": 0.2999308705329895,
        "compile_time": 1.2746715545654297
    },
    {
        "BLOCK_SIZE_M": 64,
        "BLOCK_SIZE_N": 256,
        "BLOCK_SIZE_K": 64,
        "GROUP_SIZE_M": 8,
        "num_stages": 3,
        "num_warps": 8,
        "ms": 0.3001024127006531,
        "min_ms": 0.3001024127006531,
        "max_ms": 0.3001024127006531,
        "compile_time": 1.2917041778564453
    },
    {
        "BLOCK_SIZE_M": 128,
        "BLOCK_SIZE_N": 64,
        "BLOCK_SIZE_K": 64,
        "GROUP_SIZE_M": 8,
        "num_stages": 3,
        "num_warps": 4,
        "ms": 0.30085963010787964,
        "min_ms": 0.30085963010787964,
        "max_ms": 0.30085963010787964,
        "compile_time": 2.1180176734924316
    },
    {
        "BLOCK_SIZE_M": 64,
        "BLOCK_SIZE_N": 512,
        "BLOCK_SIZE_K": 32,
        "GROUP_SIZE_M": 8,
        "num_stages": 4,
        "num_warps": 8,
        "ms": 0.30105599761009216,
        "min_ms": 0.30105599761009216,
        "max_ms": 0.30105599761009216,
        "compile_time": 1.430612564086914
    },
    {
        "BLOCK_SIZE_M": 64,
        "BLOCK_SIZE_N": 256,
        "BLOCK_SIZE_K": 64,
        "GROUP_SIZE_M": 8,
        "num_stages": 5,
        "num_warps": 8,
        "ms": 0.3012607991695404,
        "min_ms": 0.3012607991695404,
        "max_ms": 0.3012607991695404,
        "compile_time": 2.264936923980713
    },
    {
        "BLOCK_SIZE_M": 256,
        "BLOCK_SIZE_N": 64,
        "BLOCK_SIZE_K": 64,
        "GROUP_SIZE_M": 8,
        "num_stages": 2,
        "num_warps": 4,
        "ms": 0.3030180335044861,
        "min_ms": 0.3030180335044861,
        "max_ms": 0.3030180335044861,
        "compile_time": 2.7483646869659424
    },
    {
        "BLOCK_SIZE_M": 256,
        "BLOCK_SIZE_N": 64,
        "BLOCK_SIZE_K": 128,
        "GROUP_SIZE_M": 8,
        "num_stages": 3,
        "num_warps": 8,
        "ms": 0.3034302294254303,
        "min_ms": 0.3034302294254303,
        "max_ms": 0.3034302294254303,
        "compile_time": 2.709047555923462
    },
    {
        "BLOCK_SIZE_M": 64,
        "BLOCK_SIZE_N": 256,
        "BLOCK_SIZE_K": 64,
        "GROUP_SIZE_M": 8,
        "num_stages": 2,
        "num_warps": 4,
        "ms": 0.3040662407875061,
        "min_ms": 0.3040662407875061,
        "max_ms": 0.3040662407875061,
        "compile_time": 2.5472412109375
    },
    {
        "BLOCK_SIZE_M": 64,
        "BLOCK_SIZE_N": 128,
        "BLOCK_SIZE_K": 32,
        "GROUP_SIZE_M": 8,
        "num_stages": 4,
        "num_warps": 4,
        "ms": 0.3042345345020294,
        "min_ms": 0.3042345345020294,
        "max_ms": 0.3042345345020294,
        "compile_time": 1.2781805992126465
    },
    {
        "BLOCK_SIZE_M": 64,
        "BLOCK_SIZE_N": 256,
        "BLOCK_SIZE_K": 16,
        "GROUP_SIZE_M": 8,
        "num_stages": 4,
        "num_warps": 4,
        "ms": 0.30480846762657166,
        "min_ms": 0.30480846762657166,
        "max_ms": 0.30480846762657166,
        "compile_time": 2.195319175720215
    },
    {
        "BLOCK_SIZE_M": 128,
        "BLOCK_SIZE_N": 64,
        "BLOCK_SIZE_K": 32,
        "GROUP_SIZE_M": 8,
        "num_stages": 5,
        "num_warps": 2,
        "ms": 0.30502772331237793,
        "min_ms": 0.30502772331237793,
        "max_ms": 0.30502772331237793,
        "compile_time": 2.5739641189575195
    },
    {
        "BLOCK_SIZE_M": 64,
        "BLOCK_SIZE_N": 128,
        "BLOCK_SIZE_K": 32,
        "GROUP_SIZE_M": 8,
        "num_stages": 5,
        "num_warps": 4,
        "ms": 0.30581727623939514,
        "min_ms": 0.30581727623939514,
        "max_ms": 0.30581727623939514,
        "compile_time": 1.2772300243377686
    },
    {
        "BLOCK_SIZE_M": 64,
        "BLOCK_SIZE_N": 128,
        "BLOCK_SIZE_K": 32,
        "GROUP_SIZE_M": 8,
        "num_stages": 3,
        "num_warps": 2,
        "ms": 0.30623573064804077,
        "min_ms": 0.30623573064804077,
        "max_ms": 0.30623573064804077,
        "compile_time": 2.4551615715026855
    },
    {
        "BLOCK_SIZE_M": 64,
        "BLOCK_SIZE_N": 128,
        "BLOCK_SIZE_K": 64,
        "GROUP_SIZE_M": 8,
        "num_stages": 4,
        "num_warps": 4,
        "ms": 0.30683979392051697,
        "min_ms": 0.30683979392051697,
        "max_ms": 0.30683979392051697,
        "compile_time": 2.2011282444000244
    },
    {
        "BLOCK_SIZE_M": 64,
        "BLOCK_SIZE_N": 128,
        "BLOCK_SIZE_K": 32,
        "GROUP_SIZE_M": 8,
        "num_stages": 4,
        "num_warps": 2,
        "ms": 0.30711477994918823,
        "min_ms": 0.30711477994918823,
        "max_ms": 0.30711477994918823,
        "compile_time": 2.530283212661743
    },
    {
        "BLOCK_SIZE_M": 128,
        "BLOCK_SIZE_N": 64,
        "BLOCK_SIZE_K": 32,
        "GROUP_SIZE_M": 8,
        "num_stages": 5,
        "num_warps": 4,
        "ms": 0.30805864930152893,
        "min_ms": 0.30805864930152893,
        "max_ms": 0.30805864930152893,
        "compile_time": 2.019711494445801
    },
    {
        "BLOCK_SIZE_M": 64,
        "BLOCK_SIZE_N": 128,
        "BLOCK_SIZE_K": 32,
        "GROUP_SIZE_M": 8,
        "num_stages": 5,
        "num_warps": 2,
        "ms": 0.30848148465156555,
        "min_ms": 0.30848148465156555,
        "max_ms": 0.30848148465156555,
        "compile_time": 2.5552642345428467
    },
    {
        "BLOCK_SIZE_M": 64,
        "BLOCK_SIZE_N": 128,
        "BLOCK_SIZE_K": 32,
        "GROUP_SIZE_M": 8,
        "num_stages": 6,
        "num_warps": 4,
        "ms": 0.3092208504676819,
        "min_ms": 0.3092208504676819,
        "max_ms": 0.3092208504676819,
        "compile_time": 2.0136337280273438
    },
    {
        "BLOCK_SIZE_M": 256,
        "BLOCK_SIZE_N": 64,
        "BLOCK_SIZE_K": 32,
        "GROUP_SIZE_M": 8,
        "num_stages": 6,
        "num_warps": 4,
        "ms": 0.30983465909957886,
        "min_ms": 0.30983465909957886,
        "max_ms": 0.30983465909957886,
        "compile_time": 2.7307651042938232
    },
    {
        "BLOCK_SIZE_M": 64,
        "BLOCK_SIZE_N": 256,
        "BLOCK_SIZE_K": 16,
        "GROUP_SIZE_M": 8,
        "num_stages": 6,
        "num_warps": 4,
        "ms": 0.3099343180656433,
        "min_ms": 0.3099343180656433,
        "max_ms": 0.3099343180656433,
        "compile_time": 2.215111255645752
    },
    {
        "BLOCK_SIZE_M": 128,
        "BLOCK_SIZE_N": 64,
        "BLOCK_SIZE_K": 32,
        "GROUP_SIZE_M": 8,
        "num_stages": 4,
        "num_warps": 4,
        "ms": 0.31015467643737793,
        "min_ms": 0.31015467643737793,
        "max_ms": 0.31015467643737793,
        "compile_time": 1.290079116821289
    },
    {
        "BLOCK_SIZE_M": 64,
        "BLOCK_SIZE_N": 512,
        "BLOCK_SIZE_K": 64,
        "GROUP_SIZE_M": 8,
        "num_stages": 3,
        "num_warps": 8,
        "ms": 0.3105017840862274,
        "min_ms": 0.3105017840862274,
        "max_ms": 0.3105017840862274,
        "compile_time": 2.8339450359344482
    },
    {
        "BLOCK_SIZE_M": 64,
        "BLOCK_SIZE_N": 256,
        "BLOCK_SIZE_K": 16,
        "GROUP_SIZE_M": 8,
        "num_stages": 7,
        "num_warps": 4,
        "ms": 0.31118208169937134,
        "min_ms": 0.31118208169937134,
        "max_ms": 0.31118208169937134,
        "compile_time": 2.2531843185424805
    },
    {
        "BLOCK_SIZE_M": 64,
        "BLOCK_SIZE_N": 128,
        "BLOCK_SIZE_K": 64,
        "GROUP_SIZE_M": 8,
        "num_stages": 6,
        "num_warps": 4,
        "ms": 0.3112846314907074,
        "min_ms": 0.3112846314907074,
        "max_ms": 0.3112846314907074,
        "compile_time": 2.3062262535095215
    },
    {
        "BLOCK_SIZE_M": 128,
        "BLOCK_SIZE_N": 64,
        "BLOCK_SIZE_K": 32,
        "GROUP_SIZE_M": 8,
        "num_stages": 3,
        "num_warps": 2,
        "ms": 0.31135696172714233,
        "min_ms": 0.31135696172714233,
        "max_ms": 0.31135696172714233,
        "compile_time": 2.4710633754730225
    },
    {
        "BLOCK_SIZE_M": 64,
        "BLOCK_SIZE_N": 256,
        "BLOCK_SIZE_K": 32,
        "GROUP_SIZE_M": 8,
        "num_stages": 4,
        "num_warps": 8,
        "ms": 0.31136900186538696,
        "min_ms": 0.31136900186538696,
        "max_ms": 0.31136900186538696,
        "compile_time": 1.2479054927825928
    },
    {
        "BLOCK_SIZE_M": 128,
        "BLOCK_SIZE_N": 64,
        "BLOCK_SIZE_K": 64,
        "GROUP_SIZE_M": 8,
        "num_stages": 4,
        "num_warps": 4,
        "ms": 0.3116799294948578,
        "min_ms": 0.3116799294948578,
        "max_ms": 0.3116799294948578,
        "compile_time": 2.211306095123291
    },
    {
        "BLOCK_SIZE_M": 64,
        "BLOCK_SIZE_N": 256,
        "BLOCK_SIZE_K": 16,
        "GROUP_SIZE_M": 8,
        "num_stages": 8,
        "num_warps": 4,
        "ms": 0.3117518723011017,
        "min_ms": 0.3117518723011017,
        "max_ms": 0.3117518723011017,
        "compile_time": 2.2756967544555664
    },
    {
        "BLOCK_SIZE_M": 256,
        "BLOCK_SIZE_N": 64,
        "BLOCK_SIZE_K": 32,
        "GROUP_SIZE_M": 8,
        "num_stages": 8,
        "num_warps": 4,
        "ms": 0.31176480650901794,
        "min_ms": 0.31176480650901794,
        "max_ms": 0.31176480650901794,
        "compile_time": 2.7510735988616943
    },
    {
        "BLOCK_SIZE_M": 256,
        "BLOCK_SIZE_N": 64,
        "BLOCK_SIZE_K": 32,
        "GROUP_SIZE_M": 8,
        "num_stages": 7,
        "num_warps": 4,
        "ms": 0.3119712471961975,
        "min_ms": 0.3119712471961975,
        "max_ms": 0.3119712471961975,
        "compile_time": 2.6980886459350586
    },
    {
        "BLOCK_SIZE_M": 64,
        "BLOCK_SIZE_N": 128,
        "BLOCK_SIZE_K": 32,
        "GROUP_SIZE_M": 8,
        "num_stages": 7,
        "num_warps": 4,
        "ms": 0.31205466389656067,
        "min_ms": 0.31205466389656067,
        "max_ms": 0.31205466389656067,
        "compile_time": 1.2906382083892822
    },
    {
        "BLOCK_SIZE_M": 128,
        "BLOCK_SIZE_N": 64,
        "BLOCK_SIZE_K": 32,
        "GROUP_SIZE_M": 8,
        "num_stages": 4,
        "num_warps": 2,
        "ms": 0.3120672106742859,
        "min_ms": 0.3120672106742859,
        "max_ms": 0.3120672106742859,
        "compile_time": 2.517533540725708
    },
    {
        "BLOCK_SIZE_M": 256,
        "BLOCK_SIZE_N": 64,
        "BLOCK_SIZE_K": 64,
        "GROUP_SIZE_M": 8,
        "num_stages": 5,
        "num_warps": 4,
        "ms": 0.3123217523097992,
        "min_ms": 0.3123217523097992,
        "max_ms": 0.3123217523097992,
        "compile_time": 2.855731725692749
    },
    {
        "BLOCK_SIZE_M": 64,
        "BLOCK_SIZE_N": 256,
        "BLOCK_SIZE_K": 16,
        "GROUP_SIZE_M": 8,
        "num_stages": 5,
        "num_warps": 4,
        "ms": 0.3124186396598816,
        "min_ms": 0.3124186396598816,
        "max_ms": 0.3124186396598816,
        "compile_time": 2.1966137886047363
    },
    {
        "BLOCK_SIZE_M": 64,
        "BLOCK_SIZE_N": 256,
        "BLOCK_SIZE_K": 32,
        "GROUP_SIZE_M": 8,
        "num_stages": 6,
        "num_warps": 8,
        "ms": 0.3129276931285858,
        "min_ms": 0.3129276931285858,
        "max_ms": 0.3129276931285858,
        "compile_time": 1.27803373336792
    },
    {
        "BLOCK_SIZE_M": 64,
        "BLOCK_SIZE_N": 256,
        "BLOCK_SIZE_K": 32,
        "GROUP_SIZE_M": 8,
        "num_stages": 5,
        "num_warps": 8,
        "ms": 0.3135308623313904,
        "min_ms": 0.3135308623313904,
        "max_ms": 0.3135308623313904,
        "compile_time": 1.2672839164733887
    },
    {
        "BLOCK_SIZE_M": 64,
        "BLOCK_SIZE_N": 256,
        "BLOCK_SIZE_K": 32,
        "GROUP_SIZE_M": 8,
        "num_stages": 7,
        "num_warps": 8,
        "ms": 0.3138659596443176,
        "min_ms": 0.3138659596443176,
        "max_ms": 0.3138659596443176,
        "compile_time": 1.2724580764770508
    },
    {
        "BLOCK_SIZE_M": 128,
        "BLOCK_SIZE_N": 64,
        "BLOCK_SIZE_K": 64,
        "GROUP_SIZE_M": 8,
        "num_stages": 7,
        "num_warps": 4,
        "ms": 0.31417056918144226,
        "min_ms": 0.31417056918144226,
        "max_ms": 0.31417056918144226,
        "compile_time": 2.31131649017334
    },
    {
        "BLOCK_SIZE_M": 64,
        "BLOCK_SIZE_N": 128,
        "BLOCK_SIZE_K": 64,
        "GROUP_SIZE_M": 8,
        "num_stages": 5,
        "num_warps": 4,
        "ms": 0.31430715322494507,
        "min_ms": 0.31430715322494507,
        "max_ms": 0.31430715322494507,
        "compile_time": 2.250178575515747
    },
    {
        "BLOCK_SIZE_M": 128,
        "BLOCK_SIZE_N": 64,
        "BLOCK_SIZE_K": 32,
        "GROUP_SIZE_M": 8,
        "num_stages": 6,
        "num_warps": 4,
        "ms": 0.3147006928920746,
        "min_ms": 0.3147006928920746,
        "max_ms": 0.3147006928920746,
        "compile_time": 2.0764780044555664
    },
    {
        "BLOCK_SIZE_M": 64,
        "BLOCK_SIZE_N": 256,
        "BLOCK_SIZE_K": 32,
        "GROUP_SIZE_M": 8,
        "num_stages": 8,
        "num_warps": 8,
        "ms": 0.3155696988105774,
        "min_ms": 0.3155696988105774,
        "max_ms": 0.3155696988105774,
        "compile_time": 1.2578940391540527
    },
    {
        "BLOCK_SIZE_M": 64,
        "BLOCK_SIZE_N": 128,
        "BLOCK_SIZE_K": 32,
        "GROUP_SIZE_M": 8,
        "num_stages": 3,
        "num_warps": 4,
        "ms": 0.31559813022613525,
        "min_ms": 0.31559813022613525,
        "max_ms": 0.31559813022613525,
        "compile_time": 2.0092811584472656
    },
    {
        "BLOCK_SIZE_M": 64,
        "BLOCK_SIZE_N": 128,
        "BLOCK_SIZE_K": 64,
        "GROUP_SIZE_M": 8,
        "num_stages": 7,
        "num_warps": 4,
        "ms": 0.31573358178138733,
        "min_ms": 0.31573358178138733,
        "max_ms": 0.31573358178138733,
        "compile_time": 2.350679397583008
    },
    {
        "BLOCK_SIZE_M": 128,
        "BLOCK_SIZE_N": 64,
        "BLOCK_SIZE_K": 32,
        "GROUP_SIZE_M": 8,
        "num_stages": 3,
        "num_warps": 4,
        "ms": 0.316008985042572,
        "min_ms": 0.316008985042572,
        "max_ms": 0.316008985042572,
        "compile_time": 1.29616117477417
    },
    {
        "BLOCK_SIZE_M": 128,
        "BLOCK_SIZE_N": 64,
        "BLOCK_SIZE_K": 32,
        "GROUP_SIZE_M": 8,
        "num_stages": 7,
        "num_warps": 4,
        "ms": 0.31612229347229004,
        "min_ms": 0.31612229347229004,
        "max_ms": 0.31612229347229004,
        "compile_time": 1.2929739952087402
    },
    {
        "BLOCK_SIZE_M": 64,
        "BLOCK_SIZE_N": 128,
        "BLOCK_SIZE_K": 64,
        "GROUP_SIZE_M": 8,
        "num_stages": 3,
        "num_warps": 4,
        "ms": 0.31648293137550354,
        "min_ms": 0.31648293137550354,
        "max_ms": 0.31648293137550354,
        "compile_time": 2.1644771099090576
    },
    {
        "BLOCK_SIZE_M": 128,
        "BLOCK_SIZE_N": 128,
        "BLOCK_SIZE_K": 16,
        "GROUP_SIZE_M": 8,
        "num_stages": 8,
        "num_warps": 4,
        "ms": 0.31738582253456116,
        "min_ms": 0.31738582253456116,
        "max_ms": 0.31738582253456116,
        "compile_time": 2.3076183795928955
    },
    {
        "BLOCK_SIZE_M": 64,
        "BLOCK_SIZE_N": 256,
        "BLOCK_SIZE_K": 128,
        "GROUP_SIZE_M": 8,
        "num_stages": 3,
        "num_warps": 8,
        "ms": 0.3181683421134949,
        "min_ms": 0.3181683421134949,
        "max_ms": 0.3181683421134949,
        "compile_time": 1.331739902496338
    },
    {
        "BLOCK_SIZE_M": 128,
        "BLOCK_SIZE_N": 128,
        "BLOCK_SIZE_K": 128,
        "GROUP_SIZE_M": 8,
        "num_stages": 3,
        "num_warps": 16,
        "ms": 0.318541944026947,
        "min_ms": 0.318541944026947,
        "max_ms": 0.318541944026947,
        "compile_time": 2.0629963874816895
    },
    {
        "BLOCK_SIZE_M": 128,
        "BLOCK_SIZE_N": 128,
        "BLOCK_SIZE_K": 16,
        "GROUP_SIZE_M": 8,
        "num_stages": 4,
        "num_warps": 4,
        "ms": 0.31953176856040955,
        "min_ms": 0.31953176856040955,
        "max_ms": 0.31953176856040955,
        "compile_time": 2.1735329627990723
    },
    {
        "BLOCK_SIZE_M": 128,
        "BLOCK_SIZE_N": 128,
        "BLOCK_SIZE_K": 128,
        "GROUP_SIZE_M": 8,
        "num_stages": 2,
        "num_warps": 4,
        "ms": 0.3197630047798157,
        "min_ms": 0.3197630047798157,
        "max_ms": 0.3197630047798157,
        "compile_time": 3.001328706741333
    },
    {
        "BLOCK_SIZE_M": 128,
        "BLOCK_SIZE_N": 64,
        "BLOCK_SIZE_K": 32,
        "GROUP_SIZE_M": 8,
        "num_stages": 7,
        "num_warps": 2,
        "ms": 0.3198692500591278,
        "min_ms": 0.3198692500591278,
        "max_ms": 0.3198692500591278,
        "compile_time": 2.6865179538726807
    },
    {
        "BLOCK_SIZE_M": 128,
        "BLOCK_SIZE_N": 64,
        "BLOCK_SIZE_K": 32,
        "GROUP_SIZE_M": 8,
        "num_stages": 6,
        "num_warps": 2,
        "ms": 0.32012584805488586,
        "min_ms": 0.32012584805488586,
        "max_ms": 0.32012584805488586,
        "compile_time": 2.612750768661499
    },
    {
        "BLOCK_SIZE_M": 128,
        "BLOCK_SIZE_N": 128,
        "BLOCK_SIZE_K": 16,
        "GROUP_SIZE_M": 8,
        "num_stages": 5,
        "num_warps": 4,
        "ms": 0.3206300139427185,
        "min_ms": 0.3206300139427185,
        "max_ms": 0.3206300139427185,
        "compile_time": 2.2324748039245605
    },
    {
        "BLOCK_SIZE_M": 128,
        "BLOCK_SIZE_N": 128,
        "BLOCK_SIZE_K": 16,
        "GROUP_SIZE_M": 8,
        "num_stages": 6,
        "num_warps": 4,
        "ms": 0.3230910301208496,
        "min_ms": 0.3230910301208496,
        "max_ms": 0.3230910301208496,
        "compile_time": 2.2269937992095947
    },
    {
        "BLOCK_SIZE_M": 128,
        "BLOCK_SIZE_N": 128,
        "BLOCK_SIZE_K": 128,
        "GROUP_SIZE_M": 8,
        "num_stages": 3,
        "num_warps": 4,
        "ms": 0.32363471388816833,
        "min_ms": 0.32363471388816833,
        "max_ms": 0.32363471388816833,
        "compile_time": 3.0531129837036133
    },
    {
        "BLOCK_SIZE_M": 128,
        "BLOCK_SIZE_N": 128,
        "BLOCK_SIZE_K": 16,
        "GROUP_SIZE_M": 8,
        "num_stages": 7,
        "num_warps": 4,
        "ms": 0.3243151307106018,
        "min_ms": 0.3243151307106018,
        "max_ms": 0.3243151307106018,
        "compile_time": 2.2761502265930176
    },
    {
        "BLOCK_SIZE_M": 256,
        "BLOCK_SIZE_N": 64,
        "BLOCK_SIZE_K": 64,
        "GROUP_SIZE_M": 8,
        "num_stages": 4,
        "num_warps": 4,
        "ms": 0.3252040445804596,
        "min_ms": 0.3252040445804596,
        "max_ms": 0.3252040445804596,
        "compile_time": 2.85776424407959
    },
    {
        "BLOCK_SIZE_M": 128,
        "BLOCK_SIZE_N": 256,
        "BLOCK_SIZE_K": 64,
        "GROUP_SIZE_M": 8,
        "num_stages": 2,
        "num_warps": 8,
        "ms": 0.32587385177612305,
        "min_ms": 0.32587385177612305,
        "max_ms": 0.32587385177612305,
        "compile_time": 2.4471662044525146
    },
    {
        "BLOCK_SIZE_M": 64,
        "BLOCK_SIZE_N": 256,
        "BLOCK_SIZE_K": 16,
        "GROUP_SIZE_M": 8,
        "num_stages": 3,
        "num_warps": 4,
        "ms": 0.3260385990142822,
        "min_ms": 0.3260385990142822,
        "max_ms": 0.3260385990142822,
        "compile_time": 2.118135929107666
    },
    {
        "BLOCK_SIZE_M": 128,
        "BLOCK_SIZE_N": 64,
        "BLOCK_SIZE_K": 64,
        "GROUP_SIZE_M": 8,
        "num_stages": 3,
        "num_warps": 2,
        "ms": 0.3267354667186737,
        "min_ms": 0.3267354667186737,
        "max_ms": 0.3267354667186737,
        "compile_time": 2.798513174057007
    },
    {
        "BLOCK_SIZE_M": 128,
        "BLOCK_SIZE_N": 64,
        "BLOCK_SIZE_K": 64,
        "GROUP_SIZE_M": 8,
        "num_stages": 5,
        "num_warps": 4,
        "ms": 0.32701510190963745,
        "min_ms": 0.32701510190963745,
        "max_ms": 0.32701510190963745,
        "compile_time": 2.2386529445648193
    },
    {
        "BLOCK_SIZE_M": 128,
        "BLOCK_SIZE_N": 64,
        "BLOCK_SIZE_K": 64,
        "GROUP_SIZE_M": 8,
        "num_stages": 6,
        "num_warps": 4,
        "ms": 0.32704633474349976,
        "min_ms": 0.32704633474349976,
        "max_ms": 0.32704633474349976,
        "compile_time": 2.319208860397339
    },
    {
        "BLOCK_SIZE_M": 64,
        "BLOCK_SIZE_N": 256,
        "BLOCK_SIZE_K": 32,
        "GROUP_SIZE_M": 8,
        "num_stages": 6,
        "num_warps": 4,
        "ms": 0.327083021402359,
        "min_ms": 0.327083021402359,
        "max_ms": 0.327083021402359,
        "compile_time": 2.5452916622161865
    },
    {
        "BLOCK_SIZE_M": 64,
        "BLOCK_SIZE_N": 256,
        "BLOCK_SIZE_K": 32,
        "GROUP_SIZE_M": 8,
        "num_stages": 7,
        "num_warps": 4,
        "ms": 0.32764941453933716,
        "min_ms": 0.32764941453933716,
        "max_ms": 0.32764941453933716,
        "compile_time": 2.588345766067505
    },
    {
        "BLOCK_SIZE_M": 128,
        "BLOCK_SIZE_N": 64,
        "BLOCK_SIZE_K": 64,
        "GROUP_SIZE_M": 8,
        "num_stages": 3,
        "num_warps": 8,
        "ms": 0.32787784934043884,
        "min_ms": 0.32787784934043884,
        "max_ms": 0.32787784934043884,
        "compile_time": 1.2772212028503418
    },
    {
        "BLOCK_SIZE_M": 64,
        "BLOCK_SIZE_N": 128,
        "BLOCK_SIZE_K": 64,
        "GROUP_SIZE_M": 8,
        "num_stages": 3,
        "num_warps": 8,
        "ms": 0.32814639806747437,
        "min_ms": 0.32814639806747437,
        "max_ms": 0.32814639806747437,
        "compile_time": 1.2535135746002197
    },
    {
        "BLOCK_SIZE_M": 256,
        "BLOCK_SIZE_N": 64,
        "BLOCK_SIZE_K": 32,
        "GROUP_SIZE_M": 8,
        "num_stages": 4,
        "num_warps": 8,
        "ms": 0.3291369080543518,
        "min_ms": 0.3291369080543518,
        "max_ms": 0.3291369080543518,
        "compile_time": 2.115522861480713
    },
    {
        "BLOCK_SIZE_M": 64,
        "BLOCK_SIZE_N": 128,
        "BLOCK_SIZE_K": 32,
        "GROUP_SIZE_M": 8,
        "num_stages": 8,
        "num_warps": 4,
        "ms": 0.32926881313323975,
        "min_ms": 0.32926881313323975,
        "max_ms": 0.32926881313323975,
        "compile_time": 2.1045567989349365
    },
    {
        "BLOCK_SIZE_M": 64,
        "BLOCK_SIZE_N": 256,
        "BLOCK_SIZE_K": 32,
        "GROUP_SIZE_M": 8,
        "num_stages": 8,
        "num_warps": 4,
        "ms": 0.3297470211982727,
        "min_ms": 0.3297470211982727,
        "max_ms": 0.3297470211982727,
        "compile_time": 2.660644054412842
    },
    {
        "BLOCK_SIZE_M": 256,
        "BLOCK_SIZE_N": 64,
        "BLOCK_SIZE_K": 32,
        "GROUP_SIZE_M": 8,
        "num_stages": 5,
        "num_warps": 8,
        "ms": 0.32978516817092896,
        "min_ms": 0.32978516817092896,
        "max_ms": 0.32978516817092896,
        "compile_time": 2.160952568054199
    },
    {
        "BLOCK_SIZE_M": 128,
        "BLOCK_SIZE_N": 64,
        "BLOCK_SIZE_K": 128,
        "GROUP_SIZE_M": 8,
        "num_stages": 4,
        "num_warps": 4,
        "ms": 0.3298223614692688,
        "min_ms": 0.3298223614692688,
        "max_ms": 0.3298223614692688,
        "compile_time": 2.6647448539733887
    },
    {
        "BLOCK_SIZE_M": 128,
        "BLOCK_SIZE_N": 64,
        "BLOCK_SIZE_K": 64,
        "GROUP_SIZE_M": 8,
        "num_stages": 4,
        "num_warps": 8,
        "ms": 0.3304281532764435,
        "min_ms": 0.3304281532764435,
        "max_ms": 0.3304281532764435,
        "compile_time": 1.2666685581207275
    },
    {
        "BLOCK_SIZE_M": 64,
        "BLOCK_SIZE_N": 128,
        "BLOCK_SIZE_K": 64,
        "GROUP_SIZE_M": 8,
        "num_stages": 4,
        "num_warps": 8,
        "ms": 0.3306277394294739,
        "min_ms": 0.3306277394294739,
        "max_ms": 0.3306277394294739,
        "compile_time": 1.2670574188232422
    },
    {
        "BLOCK_SIZE_M": 128,
        "BLOCK_SIZE_N": 64,
        "BLOCK_SIZE_K": 64,
        "GROUP_SIZE_M": 8,
        "num_stages": 2,
        "num_warps": 4,
        "ms": 0.3306470513343811,
        "min_ms": 0.3306470513343811,
        "max_ms": 0.3306470513343811,
        "compile_time": 2.1461386680603027
    },
    {
        "BLOCK_SIZE_M": 64,
        "BLOCK_SIZE_N": 512,
        "BLOCK_SIZE_K": 16,
        "GROUP_SIZE_M": 8,
        "num_stages": 4,
        "num_warps": 8,
        "ms": 0.3307817876338959,
        "min_ms": 0.3307817876338959,
        "max_ms": 0.3307817876338959,
        "compile_time": 1.3205831050872803
    },
    {
        "BLOCK_SIZE_M": 128,
        "BLOCK_SIZE_N": 64,
        "BLOCK_SIZE_K": 32,
        "GROUP_SIZE_M": 8,
        "num_stages": 8,
        "num_warps": 4,
        "ms": 0.33112049102783203,
        "min_ms": 0.33112049102783203,
        "max_ms": 0.33112049102783203,
        "compile_time": 2.102233409881592
    },
    {
        "BLOCK_SIZE_M": 64,
        "BLOCK_SIZE_N": 128,
        "BLOCK_SIZE_K": 128,
        "GROUP_SIZE_M": 8,
        "num_stages": 4,
        "num_warps": 4,
        "ms": 0.3311889171600342,
        "min_ms": 0.3311889171600342,
        "max_ms": 0.3311889171600342,
        "compile_time": 2.6116223335266113
    },
    {
        "BLOCK_SIZE_M": 64,
        "BLOCK_SIZE_N": 512,
        "BLOCK_SIZE_K": 16,
        "GROUP_SIZE_M": 8,
        "num_stages": 6,
        "num_warps": 8,
        "ms": 0.3318236768245697,
        "min_ms": 0.3318236768245697,
        "max_ms": 0.3318236768245697,
        "compile_time": 1.319373607635498
    },
    {
        "BLOCK_SIZE_M": 128,
        "BLOCK_SIZE_N": 64,
        "BLOCK_SIZE_K": 128,
        "GROUP_SIZE_M": 8,
        "num_stages": 3,
        "num_warps": 4,
        "ms": 0.33186808228492737,
        "min_ms": 0.33186808228492737,
        "max_ms": 0.33186808228492737,
        "compile_time": 2.5793161392211914
    },
    {
        "BLOCK_SIZE_M": 256,
        "BLOCK_SIZE_N": 64,
        "BLOCK_SIZE_K": 32,
        "GROUP_SIZE_M": 8,
        "num_stages": 6,
        "num_warps": 8,
        "ms": 0.33259516954421997,
        "min_ms": 0.33259516954421997,
        "max_ms": 0.33259516954421997,
        "compile_time": 2.1915833950042725
    },
    {
        "BLOCK_SIZE_M": 64,
        "BLOCK_SIZE_N": 512,
        "BLOCK_SIZE_K": 16,
        "GROUP_SIZE_M": 8,
        "num_stages": 5,
        "num_warps": 8,
        "ms": 0.33283737301826477,
        "min_ms": 0.33283737301826477,
        "max_ms": 0.33283737301826477,
        "compile_time": 2.3028016090393066
    },
    {
        "BLOCK_SIZE_M": 64,
        "BLOCK_SIZE_N": 512,
        "BLOCK_SIZE_K": 16,
        "GROUP_SIZE_M": 8,
        "num_stages": 7,
        "num_warps": 8,
        "ms": 0.3339422047138214,
        "min_ms": 0.3339422047138214,
        "max_ms": 0.3339422047138214,
        "compile_time": 1.3050498962402344
    },
    {
        "BLOCK_SIZE_M": 64,
        "BLOCK_SIZE_N": 512,
        "BLOCK_SIZE_K": 16,
        "GROUP_SIZE_M": 8,
        "num_stages": 8,
        "num_warps": 8,
        "ms": 0.3341476321220398,
        "min_ms": 0.3341476321220398,
        "max_ms": 0.3341476321220398,
        "compile_time": 1.4334580898284912
    },
    {
        "BLOCK_SIZE_M": 256,
        "BLOCK_SIZE_N": 64,
        "BLOCK_SIZE_K": 32,
        "GROUP_SIZE_M": 8,
        "num_stages": 7,
        "num_warps": 8,
        "ms": 0.33443477749824524,
        "min_ms": 0.33443477749824524,
        "max_ms": 0.33443477749824524,
        "compile_time": 1.2929542064666748
    },
    {
        "BLOCK_SIZE_M": 256,
        "BLOCK_SIZE_N": 64,
        "BLOCK_SIZE_K": 32,
        "GROUP_SIZE_M": 8,
        "num_stages": 8,
        "num_warps": 8,
        "ms": 0.3345798850059509,
        "min_ms": 0.3345798850059509,
        "max_ms": 0.3345798850059509,
        "compile_time": 2.2005622386932373
    },
    {
        "BLOCK_SIZE_M": 64,
        "BLOCK_SIZE_N": 128,
        "BLOCK_SIZE_K": 16,
        "GROUP_SIZE_M": 8,
        "num_stages": 6,
        "num_warps": 2,
        "ms": 0.3348638117313385,
        "min_ms": 0.3348638117313385,
        "max_ms": 0.3348638117313385,
        "compile_time": 2.249506711959839
    },
    {
        "BLOCK_SIZE_M": 64,
        "BLOCK_SIZE_N": 128,
        "BLOCK_SIZE_K": 16,
        "GROUP_SIZE_M": 8,
        "num_stages": 4,
        "num_warps": 2,
        "ms": 0.3348875045776367,
        "min_ms": 0.3348875045776367,
        "max_ms": 0.3348875045776367,
        "compile_time": 2.1809113025665283
    },
    {
        "BLOCK_SIZE_M": 64,
        "BLOCK_SIZE_N": 128,
        "BLOCK_SIZE_K": 128,
        "GROUP_SIZE_M": 8,
        "num_stages": 3,
        "num_warps": 4,
        "ms": 0.33527883887290955,
        "min_ms": 0.33527883887290955,
        "max_ms": 0.33527883887290955,
        "compile_time": 2.457005739212036
    },
    {
        "BLOCK_SIZE_M": 64,
        "BLOCK_SIZE_N": 128,
        "BLOCK_SIZE_K": 16,
        "GROUP_SIZE_M": 8,
        "num_stages": 5,
        "num_warps": 2,
        "ms": 0.3352964222431183,
        "min_ms": 0.3352964222431183,
        "max_ms": 0.3352964222431183,
        "compile_time": 2.2221360206604004
    },
    {
        "BLOCK_SIZE_M": 64,
        "BLOCK_SIZE_N": 128,
        "BLOCK_SIZE_K": 16,
        "GROUP_SIZE_M": 8,
        "num_stages": 7,
        "num_warps": 2,
        "ms": 0.335304319858551,
        "min_ms": 0.335304319858551,
        "max_ms": 0.335304319858551,
        "compile_time": 2.2965779304504395
    },
    {
        "BLOCK_SIZE_M": 128,
        "BLOCK_SIZE_N": 256,
        "BLOCK_SIZE_K": 16,
        "GROUP_SIZE_M": 8,
        "num_stages": 6,
        "num_warps": 8,
        "ms": 0.3374289572238922,
        "min_ms": 0.3374289572238922,
        "max_ms": 0.3374289572238922,
        "compile_time": 1.2222838401794434
    },
    {
        "BLOCK_SIZE_M": 256,
        "BLOCK_SIZE_N": 64,
        "BLOCK_SIZE_K": 128,
        "GROUP_SIZE_M": 8,
        "num_stages": 3,
        "num_warps": 16,
        "ms": 0.3388426899909973,
        "min_ms": 0.3388426899909973,
        "max_ms": 0.3388426899909973,
        "compile_time": 1.2898268699645996
    },
    {
        "BLOCK_SIZE_M": 64,
        "BLOCK_SIZE_N": 256,
        "BLOCK_SIZE_K": 128,
        "GROUP_SIZE_M": 8,
        "num_stages": 3,
        "num_warps": 16,
        "ms": 0.3390941023826599,
        "min_ms": 0.3390941023826599,
        "max_ms": 0.3390941023826599,
        "compile_time": 1.320793867111206
    },
    {
        "BLOCK_SIZE_M": 128,
        "BLOCK_SIZE_N": 128,
        "BLOCK_SIZE_K": 64,
        "GROUP_SIZE_M": 8,
        "num_stages": 3,
        "num_warps": 16,
        "ms": 0.339167058467865,
        "min_ms": 0.339167058467865,
        "max_ms": 0.339167058467865,
        "compile_time": 1.235929250717163
    },
    {
        "BLOCK_SIZE_M": 64,
        "BLOCK_SIZE_N": 128,
        "BLOCK_SIZE_K": 64,
        "GROUP_SIZE_M": 8,
        "num_stages": 2,
        "num_warps": 2,
        "ms": 0.33944669365882874,
        "min_ms": 0.33944669365882874,
        "max_ms": 0.33944669365882874,
        "compile_time": 2.5915935039520264
    },
    {
        "BLOCK_SIZE_M": 64,
        "BLOCK_SIZE_N": 128,
        "BLOCK_SIZE_K": 16,
        "GROUP_SIZE_M": 8,
        "num_stages": 7,
        "num_warps": 4,
        "ms": 0.3394757807254791,
        "min_ms": 0.3394757807254791,
        "max_ms": 0.3394757807254791,
        "compile_time": 1.2798006534576416
    },
    {
        "BLOCK_SIZE_M": 128,
        "BLOCK_SIZE_N": 64,
        "BLOCK_SIZE_K": 128,
        "GROUP_SIZE_M": 8,
        "num_stages": 3,
        "num_warps": 8,
        "ms": 0.33949726819992065,
        "min_ms": 0.33949726819992065,
        "max_ms": 0.33949726819992065,
        "compile_time": 1.2580509185791016
    },
    {
        "BLOCK_SIZE_M": 64,
        "BLOCK_SIZE_N": 128,
        "BLOCK_SIZE_K": 16,
        "GROUP_SIZE_M": 8,
        "num_stages": 6,
        "num_warps": 4,
        "ms": 0.3396639823913574,
        "min_ms": 0.3396639823913574,
        "max_ms": 0.3396639823913574,
        "compile_time": 1.3399572372436523
    },
    {
        "BLOCK_SIZE_M": 128,
        "BLOCK_SIZE_N": 256,
        "BLOCK_SIZE_K": 16,
        "GROUP_SIZE_M": 8,
        "num_stages": 5,
        "num_warps": 8,
        "ms": 0.33969467878341675,
        "min_ms": 0.33969467878341675,
        "max_ms": 0.33969467878341675,
        "compile_time": 1.224029779434204
    },
    {
        "BLOCK_SIZE_M": 128,
        "BLOCK_SIZE_N": 128,
        "BLOCK_SIZE_K": 32,
        "GROUP_SIZE_M": 8,
        "num_stages": 3,
        "num_warps": 8,
        "ms": 0.33974218368530273,
        "min_ms": 0.33974218368530273,
        "max_ms": 0.33974218368530273,
        "compile_time": 1.2378876209259033
    },
    {
        "BLOCK_SIZE_M": 128,
        "BLOCK_SIZE_N": 256,
        "BLOCK_SIZE_K": 16,
        "GROUP_SIZE_M": 8,
        "num_stages": 4,
        "num_warps": 8,
        "ms": 0.33991193771362305,
        "min_ms": 0.33991193771362305,
        "max_ms": 0.33991193771362305,
        "compile_time": 1.225294589996338
    },
    {
        "BLOCK_SIZE_M": 64,
        "BLOCK_SIZE_N": 128,
        "BLOCK_SIZE_K": 16,
        "GROUP_SIZE_M": 8,
        "num_stages": 3,
        "num_warps": 2,
        "ms": 0.34011009335517883,
        "min_ms": 0.34011009335517883,
        "max_ms": 0.34011009335517883,
        "compile_time": 2.124803066253662
    },
    {
        "BLOCK_SIZE_M": 128,
        "BLOCK_SIZE_N": 256,
        "BLOCK_SIZE_K": 16,
        "GROUP_SIZE_M": 8,
        "num_stages": 7,
        "num_warps": 8,
        "ms": 0.34018057584762573,
        "min_ms": 0.34018057584762573,
        "max_ms": 0.34018057584762573,
        "compile_time": 1.2309491634368896
    },
    {
        "BLOCK_SIZE_M": 256,
        "BLOCK_SIZE_N": 128,
        "BLOCK_SIZE_K": 128,
        "GROUP_SIZE_M": 8,
        "num_stages": 2,
        "num_warps": 8,
        "ms": 0.34025391936302185,
        "min_ms": 0.34025391936302185,
        "max_ms": 0.34025391936302185,
        "compile_time": 2.772770404815674
    },
    {
        "BLOCK_SIZE_M": 128,
        "BLOCK_SIZE_N": 128,
        "BLOCK_SIZE_K": 64,
        "GROUP_SIZE_M": 8,
        "num_stages": 5,
        "num_warps": 16,
        "ms": 0.34039729833602905,
        "min_ms": 0.34039729833602905,
        "max_ms": 0.34039729833602905,
        "compile_time": 1.976522445678711
    },
    {
        "BLOCK_SIZE_M": 128,
        "BLOCK_SIZE_N": 64,
        "BLOCK_SIZE_K": 128,
        "GROUP_SIZE_M": 8,
        "num_stages": 4,
        "num_warps": 8,
        "ms": 0.34049683809280396,
        "min_ms": 0.34049683809280396,
        "max_ms": 0.34049683809280396,
        "compile_time": 1.2804484367370605
    },
    {
        "BLOCK_SIZE_M": 128,
        "BLOCK_SIZE_N": 128,
        "BLOCK_SIZE_K": 64,
        "GROUP_SIZE_M": 8,
        "num_stages": 4,
        "num_warps": 16,
        "ms": 0.3405838906764984,
        "min_ms": 0.3405838906764984,
        "max_ms": 0.3405838906764984,
        "compile_time": 1.9150872230529785
    },
    {
        "BLOCK_SIZE_M": 128,
        "BLOCK_SIZE_N": 64,
        "BLOCK_SIZE_K": 64,
        "GROUP_SIZE_M": 8,
        "num_stages": 2,
        "num_warps": 2,
        "ms": 0.34067675471305847,
        "min_ms": 0.34067675471305847,
        "max_ms": 0.34067675471305847,
        "compile_time": 2.5474915504455566
    },
    {
        "BLOCK_SIZE_M": 128,
        "BLOCK_SIZE_N": 256,
        "BLOCK_SIZE_K": 16,
        "GROUP_SIZE_M": 8,
        "num_stages": 8,
        "num_warps": 8,
        "ms": 0.34097951650619507,
        "min_ms": 0.34097951650619507,
        "max_ms": 0.34097951650619507,
        "compile_time": 1.2283475399017334
    },
    {
        "BLOCK_SIZE_M": 64,
        "BLOCK_SIZE_N": 128,
        "BLOCK_SIZE_K": 16,
        "GROUP_SIZE_M": 8,
        "num_stages": 4,
        "num_warps": 4,
        "ms": 0.3412555158138275,
        "min_ms": 0.3412555158138275,
        "max_ms": 0.3412555158138275,
        "compile_time": 1.272388219833374
    },
    {
        "BLOCK_SIZE_M": 256,
        "BLOCK_SIZE_N": 128,
        "BLOCK_SIZE_K": 64,
        "GROUP_SIZE_M": 8,
        "num_stages": 2,
        "num_warps": 8,
        "ms": 0.34239882230758667,
        "min_ms": 0.34239882230758667,
        "max_ms": 0.34239882230758667,
        "compile_time": 2.573725700378418
    },
    {
        "BLOCK_SIZE_M": 64,
        "BLOCK_SIZE_N": 128,
        "BLOCK_SIZE_K": 128,
        "GROUP_SIZE_M": 8,
        "num_stages": 4,
        "num_warps": 8,
        "ms": 0.3424145579338074,
        "min_ms": 0.3424145579338074,
        "max_ms": 0.3424145579338074,
        "compile_time": 1.2622408866882324
    },
    {
        "BLOCK_SIZE_M": 64,
        "BLOCK_SIZE_N": 128,
        "BLOCK_SIZE_K": 128,
        "GROUP_SIZE_M": 8,
        "num_stages": 3,
        "num_warps": 8,
        "ms": 0.342966228723526,
        "min_ms": 0.342966228723526,
        "max_ms": 0.342966228723526,
        "compile_time": 1.232208490371704
    },
    {
        "BLOCK_SIZE_M": 64,
        "BLOCK_SIZE_N": 256,
        "BLOCK_SIZE_K": 32,
        "GROUP_SIZE_M": 8,
        "num_stages": 3,
        "num_warps": 8,
        "ms": 0.34331539273262024,
        "min_ms": 0.34331539273262024,
        "max_ms": 0.34331539273262024,
        "compile_time": 1.2165396213531494
    },
    {
        "BLOCK_SIZE_M": 128,
        "BLOCK_SIZE_N": 256,
        "BLOCK_SIZE_K": 32,
        "GROUP_SIZE_M": 8,
        "num_stages": 3,
        "num_warps": 16,
        "ms": 0.34394127130508423,
        "min_ms": 0.34394127130508423,
        "max_ms": 0.34394127130508423,
        "compile_time": 1.215421199798584
    },
    {
        "BLOCK_SIZE_M": 128,
        "BLOCK_SIZE_N": 256,
        "BLOCK_SIZE_K": 32,
        "GROUP_SIZE_M": 8,
        "num_stages": 4,
        "num_warps": 16,
        "ms": 0.3439461588859558,
        "min_ms": 0.3439461588859558,
        "max_ms": 0.3439461588859558,
        "compile_time": 1.2206742763519287
    },
    {
        "BLOCK_SIZE_M": 128,
        "BLOCK_SIZE_N": 256,
        "BLOCK_SIZE_K": 32,
        "GROUP_SIZE_M": 8,
        "num_stages": 5,
        "num_warps": 16,
        "ms": 0.34432730078697205,
        "min_ms": 0.34432730078697205,
        "max_ms": 0.34432730078697205,
        "compile_time": 1.2238407135009766
    },
    {
        "BLOCK_SIZE_M": 64,
        "BLOCK_SIZE_N": 128,
        "BLOCK_SIZE_K": 32,
        "GROUP_SIZE_M": 8,
        "num_stages": 6,
        "num_warps": 2,
        "ms": 0.3443370461463928,
        "min_ms": 0.3443370461463928,
        "max_ms": 0.3443370461463928,
        "compile_time": 2.584946632385254
    },
    {
        "BLOCK_SIZE_M": 64,
        "BLOCK_SIZE_N": 128,
        "BLOCK_SIZE_K": 16,
        "GROUP_SIZE_M": 8,
        "num_stages": 5,
        "num_warps": 4,
        "ms": 0.3447149693965912,
        "min_ms": 0.3447149693965912,
        "max_ms": 0.3447149693965912,
        "compile_time": 1.2839839458465576
    },
    {
        "BLOCK_SIZE_M": 128,
        "BLOCK_SIZE_N": 64,
        "BLOCK_SIZE_K": 64,
        "GROUP_SIZE_M": 8,
        "num_stages": 5,
        "num_warps": 8,
        "ms": 0.34506481885910034,
        "min_ms": 0.34506481885910034,
        "max_ms": 0.34506481885910034,
        "compile_time": 1.2589552402496338
    },
    {
        "BLOCK_SIZE_M": 128,
        "BLOCK_SIZE_N": 128,
        "BLOCK_SIZE_K": 16,
        "GROUP_SIZE_M": 8,
        "num_stages": 3,
        "num_warps": 4,
        "ms": 0.34559088945388794,
        "min_ms": 0.34559088945388794,
        "max_ms": 0.34559088945388794,
        "compile_time": 2.149975299835205
    },
    {
        "BLOCK_SIZE_M": 128,
        "BLOCK_SIZE_N": 128,
        "BLOCK_SIZE_K": 64,
        "GROUP_SIZE_M": 8,
        "num_stages": 6,
        "num_warps": 16,
        "ms": 0.34565505385398865,
        "min_ms": 0.34565505385398865,
        "max_ms": 0.34565505385398865,
        "compile_time": 1.2491660118103027
    },
    {
        "BLOCK_SIZE_M": 64,
        "BLOCK_SIZE_N": 128,
        "BLOCK_SIZE_K": 64,
        "GROUP_SIZE_M": 8,
        "num_stages": 6,
        "num_warps": 8,
        "ms": 0.34568578004837036,
        "min_ms": 0.34568578004837036,
        "max_ms": 0.34568578004837036,
        "compile_time": 1.2408115863800049
    },
    {
        "BLOCK_SIZE_M": 128,
        "BLOCK_SIZE_N": 256,
        "BLOCK_SIZE_K": 32,
        "GROUP_SIZE_M": 8,
        "num_stages": 6,
        "num_warps": 16,
        "ms": 0.3457430303096771,
        "min_ms": 0.3457430303096771,
        "max_ms": 0.3457430303096771,
        "compile_time": 1.2197411060333252
    },
    {
        "BLOCK_SIZE_M": 64,
        "BLOCK_SIZE_N": 128,
        "BLOCK_SIZE_K": 16,
        "GROUP_SIZE_M": 8,
        "num_stages": 3,
        "num_warps": 4,
        "ms": 0.34594446420669556,
        "min_ms": 0.34594446420669556,
        "max_ms": 0.34594446420669556,
        "compile_time": 1.8449032306671143
    },
    {
        "BLOCK_SIZE_M": 64,
        "BLOCK_SIZE_N": 128,
        "BLOCK_SIZE_K": 32,
        "GROUP_SIZE_M": 8,
        "num_stages": 7,
        "num_warps": 2,
        "ms": 0.34612560272216797,
        "min_ms": 0.34612560272216797,
        "max_ms": 0.34612560272216797,
        "compile_time": 2.639671564102173
    },
    {
        "BLOCK_SIZE_M": 128,
        "BLOCK_SIZE_N": 128,
        "BLOCK_SIZE_K": 32,
        "GROUP_SIZE_M": 8,
        "num_stages": 2,
        "num_warps": 4,
        "ms": 0.346750408411026,
        "min_ms": 0.346750408411026,
        "max_ms": 0.346750408411026,
        "compile_time": 2.3598554134368896
    },
    {
        "BLOCK_SIZE_M": 128,
        "BLOCK_SIZE_N": 64,
        "BLOCK_SIZE_K": 32,
        "GROUP_SIZE_M": 8,
        "num_stages": 2,
        "num_warps": 2,
        "ms": 0.34684789180755615,
        "min_ms": 0.34684789180755615,
        "max_ms": 0.34684789180755615,
        "compile_time": 2.348590850830078
    },
    {
        "BLOCK_SIZE_M": 64,
        "BLOCK_SIZE_N": 128,
        "BLOCK_SIZE_K": 16,
        "GROUP_SIZE_M": 8,
        "num_stages": 8,
        "num_warps": 4,
        "ms": 0.34728652238845825,
        "min_ms": 0.34728652238845825,
        "max_ms": 0.34728652238845825,
        "compile_time": 1.9484541416168213
    },
    {
        "BLOCK_SIZE_M": 64,
        "BLOCK_SIZE_N": 128,
        "BLOCK_SIZE_K": 64,
        "GROUP_SIZE_M": 8,
        "num_stages": 5,
        "num_warps": 8,
        "ms": 0.3473542630672455,
        "min_ms": 0.3473542630672455,
        "max_ms": 0.3473542630672455,
        "compile_time": 1.25242280960083
    },
    {
        "BLOCK_SIZE_M": 128,
        "BLOCK_SIZE_N": 256,
        "BLOCK_SIZE_K": 32,
        "GROUP_SIZE_M": 8,
        "num_stages": 7,
        "num_warps": 16,
        "ms": 0.3475615978240967,
        "min_ms": 0.3475615978240967,
        "max_ms": 0.3475615978240967,
        "compile_time": 1.2215490341186523
    },
    {
        "BLOCK_SIZE_M": 64,
        "BLOCK_SIZE_N": 256,
        "BLOCK_SIZE_K": 32,
        "GROUP_SIZE_M": 8,
        "num_stages": 2,
        "num_warps": 4,
        "ms": 0.34759533405303955,
        "min_ms": 0.34759533405303955,
        "max_ms": 0.34759533405303955,
        "compile_time": 2.303807258605957
    },
    {
        "BLOCK_SIZE_M": 128,
        "BLOCK_SIZE_N": 64,
        "BLOCK_SIZE_K": 64,
        "GROUP_SIZE_M": 8,
        "num_stages": 6,
        "num_warps": 8,
        "ms": 0.34835273027420044,
        "min_ms": 0.34835273027420044,
        "max_ms": 0.34835273027420044,
        "compile_time": 1.255300760269165
    },
    {
        "BLOCK_SIZE_M": 64,
        "BLOCK_SIZE_N": 128,
        "BLOCK_SIZE_K": 64,
        "GROUP_SIZE_M": 8,
        "num_stages": 7,
        "num_warps": 8,
        "ms": 0.3499888479709625,
        "min_ms": 0.3499888479709625,
        "max_ms": 0.3499888479709625,
        "compile_time": 1.2481980323791504
    },
    {
        "BLOCK_SIZE_M": 64,
        "BLOCK_SIZE_N": 128,
        "BLOCK_SIZE_K": 16,
        "GROUP_SIZE_M": 8,
        "num_stages": 8,
        "num_warps": 2,
        "ms": 0.35015925765037537,
        "min_ms": 0.35015925765037537,
        "max_ms": 0.35015925765037537,
        "compile_time": 2.280229330062866
    },
    {
        "BLOCK_SIZE_M": 64,
        "BLOCK_SIZE_N": 128,
        "BLOCK_SIZE_K": 128,
        "GROUP_SIZE_M": 8,
        "num_stages": 2,
        "num_warps": 4,
        "ms": 0.3503313660621643,
        "min_ms": 0.3503313660621643,
        "max_ms": 0.3503313660621643,
        "compile_time": 2.3332996368408203
    },
    {
        "BLOCK_SIZE_M": 128,
        "BLOCK_SIZE_N": 64,
        "BLOCK_SIZE_K": 64,
        "GROUP_SIZE_M": 8,
        "num_stages": 7,
        "num_warps": 8,
        "ms": 0.35053184628486633,
        "min_ms": 0.35053184628486633,
        "max_ms": 0.35053184628486633,
        "compile_time": 1.2430517673492432
    },
    {
        "BLOCK_SIZE_M": 256,
        "BLOCK_SIZE_N": 64,
        "BLOCK_SIZE_K": 64,
        "GROUP_SIZE_M": 8,
        "num_stages": 4,
        "num_warps": 16,
        "ms": 0.3507886528968811,
        "min_ms": 0.3507886528968811,
        "max_ms": 0.3507886528968811,
        "compile_time": 1.273618221282959
    },
    {
        "BLOCK_SIZE_M": 128,
        "BLOCK_SIZE_N": 128,
        "BLOCK_SIZE_K": 16,
        "GROUP_SIZE_M": 8,
        "num_stages": 8,
        "num_warps": 8,
        "ms": 0.3510707914829254,
        "min_ms": 0.3510707914829254,
        "max_ms": 0.3510707914829254,
        "compile_time": 1.9613869190216064
    },
    {
        "BLOCK_SIZE_M": 256,
        "BLOCK_SIZE_N": 128,
        "BLOCK_SIZE_K": 32,
        "GROUP_SIZE_M": 8,
        "num_stages": 4,
        "num_warps": 16,
        "ms": 0.3521227240562439,
        "min_ms": 0.3521227240562439,
        "max_ms": 0.3521227240562439,
        "compile_time": 1.253978967666626
    },
    {
        "BLOCK_SIZE_M": 128,
        "BLOCK_SIZE_N": 64,
        "BLOCK_SIZE_K": 128,
        "GROUP_SIZE_M": 8,
        "num_stages": 2,
        "num_warps": 4,
        "ms": 0.3528377115726471,
        "min_ms": 0.3528377115726471,
        "max_ms": 0.3528377115726471,
        "compile_time": 2.3764121532440186
    },
    {
        "BLOCK_SIZE_M": 256,
        "BLOCK_SIZE_N": 128,
        "BLOCK_SIZE_K": 32,
        "GROUP_SIZE_M": 8,
        "num_stages": 3,
        "num_warps": 16,
        "ms": 0.3533273935317993,
        "min_ms": 0.3533273935317993,
        "max_ms": 0.3533273935317993,
        "compile_time": 2.0907645225524902
    },
    {
        "BLOCK_SIZE_M": 256,
        "BLOCK_SIZE_N": 128,
        "BLOCK_SIZE_K": 32,
        "GROUP_SIZE_M": 8,
        "num_stages": 5,
        "num_warps": 16,
        "ms": 0.3536107540130615,
        "min_ms": 0.3536107540130615,
        "max_ms": 0.3536107540130615,
        "compile_time": 2.1028449535369873
    },
    {
        "BLOCK_SIZE_M": 64,
        "BLOCK_SIZE_N": 128,
        "BLOCK_SIZE_K": 32,
        "GROUP_SIZE_M": 8,
        "num_stages": 4,
        "num_warps": 8,
        "ms": 0.3539937436580658,
        "min_ms": 0.3539937436580658,
        "max_ms": 0.3539937436580658,
        "compile_time": 1.2648780345916748
    },
    {
        "BLOCK_SIZE_M": 256,
        "BLOCK_SIZE_N": 64,
        "BLOCK_SIZE_K": 32,
        "GROUP_SIZE_M": 8,
        "num_stages": 2,
        "num_warps": 4,
        "ms": 0.3543276786804199,
        "min_ms": 0.3543276786804199,
        "max_ms": 0.3543276786804199,
        "compile_time": 2.5587856769561768
    },
    {
        "BLOCK_SIZE_M": 256,
        "BLOCK_SIZE_N": 128,
        "BLOCK_SIZE_K": 32,
        "GROUP_SIZE_M": 8,
        "num_stages": 6,
        "num_warps": 16,
        "ms": 0.35461926460266113,
        "min_ms": 0.35461926460266113,
        "max_ms": 0.35461926460266113,
        "compile_time": 2.094700574874878
    },
    {
        "BLOCK_SIZE_M": 64,
        "BLOCK_SIZE_N": 128,
        "BLOCK_SIZE_K": 32,
        "GROUP_SIZE_M": 8,
        "num_stages": 5,
        "num_warps": 8,
        "ms": 0.3550223112106323,
        "min_ms": 0.3550223112106323,
        "max_ms": 0.3550223112106323,
        "compile_time": 1.2611627578735352
    },
    {
        "BLOCK_SIZE_M": 64,
        "BLOCK_SIZE_N": 128,
        "BLOCK_SIZE_K": 32,
        "GROUP_SIZE_M": 8,
        "num_stages": 6,
        "num_warps": 8,
        "ms": 0.3556423783302307,
        "min_ms": 0.3556423783302307,
        "max_ms": 0.3556423783302307,
        "compile_time": 1.2609071731567383
    },
    {
        "BLOCK_SIZE_M": 64,
        "BLOCK_SIZE_N": 512,
        "BLOCK_SIZE_K": 16,
        "GROUP_SIZE_M": 8,
        "num_stages": 3,
        "num_warps": 8,
        "ms": 0.3556961417198181,
        "min_ms": 0.3556961417198181,
        "max_ms": 0.3556961417198181,
        "compile_time": 2.265453815460205
    },
    {
        "BLOCK_SIZE_M": 256,
        "BLOCK_SIZE_N": 128,
        "BLOCK_SIZE_K": 32,
        "GROUP_SIZE_M": 8,
        "num_stages": 7,
        "num_warps": 16,
        "ms": 0.3563552498817444,
        "min_ms": 0.3563552498817444,
        "max_ms": 0.3563552498817444,
        "compile_time": 2.1001429557800293
    },
    {
        "BLOCK_SIZE_M": 64,
        "BLOCK_SIZE_N": 256,
        "BLOCK_SIZE_K": 64,
        "GROUP_SIZE_M": 8,
        "num_stages": 4,
        "num_warps": 4,
        "ms": 0.3567194938659668,
        "min_ms": 0.3567194938659668,
        "max_ms": 0.3567194938659668,
        "compile_time": 2.889857292175293
    },
    {
        "BLOCK_SIZE_M": 128,
        "BLOCK_SIZE_N": 64,
        "BLOCK_SIZE_K": 32,
        "GROUP_SIZE_M": 8,
        "num_stages": 6,
        "num_warps": 8,
        "ms": 0.3568430244922638,
        "min_ms": 0.3568430244922638,
        "max_ms": 0.3568430244922638,
        "compile_time": 1.2002322673797607
    },
    {
        "BLOCK_SIZE_M": 64,
        "BLOCK_SIZE_N": 128,
        "BLOCK_SIZE_K": 32,
        "GROUP_SIZE_M": 8,
        "num_stages": 7,
        "num_warps": 8,
        "ms": 0.3574473261833191,
        "min_ms": 0.3574473261833191,
        "max_ms": 0.3574473261833191,
        "compile_time": 1.862898588180542
    },
    {
        "BLOCK_SIZE_M": 64,
        "BLOCK_SIZE_N": 256,
        "BLOCK_SIZE_K": 64,
        "GROUP_SIZE_M": 8,
        "num_stages": 3,
        "num_warps": 16,
        "ms": 0.35745003819465637,
        "min_ms": 0.35745003819465637,
        "max_ms": 0.35745003819465637,
        "compile_time": 1.2402207851409912
    },
    {
        "BLOCK_SIZE_M": 256,
        "BLOCK_SIZE_N": 128,
        "BLOCK_SIZE_K": 16,
        "GROUP_SIZE_M": 8,
        "num_stages": 6,
        "num_warps": 8,
        "ms": 0.35762813687324524,
        "min_ms": 0.35762813687324524,
        "max_ms": 0.35762813687324524,
        "compile_time": 2.321821928024292
    },
    {
        "BLOCK_SIZE_M": 256,
        "BLOCK_SIZE_N": 64,
        "BLOCK_SIZE_K": 64,
        "GROUP_SIZE_M": 8,
        "num_stages": 3,
        "num_warps": 16,
        "ms": 0.35765331983566284,
        "min_ms": 0.35765331983566284,
        "max_ms": 0.35765331983566284,
        "compile_time": 1.2757725715637207
    },
    {
        "BLOCK_SIZE_M": 128,
        "BLOCK_SIZE_N": 64,
        "BLOCK_SIZE_K": 128,
        "GROUP_SIZE_M": 8,
        "num_stages": 2,
        "num_warps": 8,
        "ms": 0.35774508118629456,
        "min_ms": 0.35774508118629456,
        "max_ms": 0.35774508118629456,
        "compile_time": 1.2588884830474854
    },
    {
        "BLOCK_SIZE_M": 256,
        "BLOCK_SIZE_N": 128,
        "BLOCK_SIZE_K": 16,
        "GROUP_SIZE_M": 8,
        "num_stages": 7,
        "num_warps": 8,
        "ms": 0.35824963450431824,
        "min_ms": 0.35824963450431824,
        "max_ms": 0.35824963450431824,
        "compile_time": 2.3367178440093994
    },
    {
        "BLOCK_SIZE_M": 128,
        "BLOCK_SIZE_N": 128,
        "BLOCK_SIZE_K": 16,
        "GROUP_SIZE_M": 8,
        "num_stages": 4,
        "num_warps": 8,
        "ms": 0.35828420519828796,
        "min_ms": 0.35828420519828796,
        "max_ms": 0.35828420519828796,
        "compile_time": 1.2512562274932861
    },
    {
        "BLOCK_SIZE_M": 64,
        "BLOCK_SIZE_N": 256,
        "BLOCK_SIZE_K": 64,
        "GROUP_SIZE_M": 8,
        "num_stages": 4,
        "num_warps": 16,
        "ms": 0.35857370495796204,
        "min_ms": 0.35857370495796204,
        "max_ms": 0.35857370495796204,
        "compile_time": 1.2371959686279297
    },
    {
        "BLOCK_SIZE_M": 64,
        "BLOCK_SIZE_N": 256,
        "BLOCK_SIZE_K": 64,
        "GROUP_SIZE_M": 8,
        "num_stages": 5,
        "num_warps": 4,
        "ms": 0.3586404323577881,
        "min_ms": 0.3586404323577881,
        "max_ms": 0.3586404323577881,
        "compile_time": 2.7430124282836914
    },
    {
        "BLOCK_SIZE_M": 64,
        "BLOCK_SIZE_N": 128,
        "BLOCK_SIZE_K": 64,
        "GROUP_SIZE_M": 8,
        "num_stages": 3,
        "num_warps": 2,
        "ms": 0.3587896227836609,
        "min_ms": 0.3587896227836609,
        "max_ms": 0.3587896227836609,
        "compile_time": 2.7495429515838623
    },
    {
        "BLOCK_SIZE_M": 64,
        "BLOCK_SIZE_N": 128,
        "BLOCK_SIZE_K": 32,
        "GROUP_SIZE_M": 8,
        "num_stages": 3,
        "num_warps": 8,
        "ms": 0.3590385317802429,
        "min_ms": 0.3590385317802429,
        "max_ms": 0.3590385317802429,
        "compile_time": 1.2468125820159912
    },
    {
        "BLOCK_SIZE_M": 256,
        "BLOCK_SIZE_N": 128,
        "BLOCK_SIZE_K": 16,
        "GROUP_SIZE_M": 8,
        "num_stages": 8,
        "num_warps": 8,
        "ms": 0.3590955138206482,
        "min_ms": 0.3590955138206482,
        "max_ms": 0.3590955138206482,
        "compile_time": 2.330460786819458
    },
    {
        "BLOCK_SIZE_M": 128,
        "BLOCK_SIZE_N": 64,
        "BLOCK_SIZE_K": 32,
        "GROUP_SIZE_M": 8,
        "num_stages": 7,
        "num_warps": 8,
        "ms": 0.3593135476112366,
        "min_ms": 0.3593135476112366,
        "max_ms": 0.3593135476112366,
        "compile_time": 1.2715420722961426
    },
    {
        "BLOCK_SIZE_M": 128,
        "BLOCK_SIZE_N": 128,
        "BLOCK_SIZE_K": 16,
        "GROUP_SIZE_M": 8,
        "num_stages": 5,
        "num_warps": 8,
        "ms": 0.35955923795700073,
        "min_ms": 0.35955923795700073,
        "max_ms": 0.35955923795700073,
        "compile_time": 1.2644803524017334
    },
    {
        "BLOCK_SIZE_M": 128,
        "BLOCK_SIZE_N": 128,
        "BLOCK_SIZE_K": 16,
        "GROUP_SIZE_M": 8,
        "num_stages": 6,
        "num_warps": 8,
        "ms": 0.3595984876155853,
        "min_ms": 0.3595984876155853,
        "max_ms": 0.3595984876155853,
        "compile_time": 1.9061965942382812
    },
    {
        "BLOCK_SIZE_M": 128,
        "BLOCK_SIZE_N": 128,
        "BLOCK_SIZE_K": 16,
        "GROUP_SIZE_M": 8,
        "num_stages": 7,
        "num_warps": 8,
        "ms": 0.35970431566238403,
        "min_ms": 0.35970431566238403,
        "max_ms": 0.35970431566238403,
        "compile_time": 1.9628818035125732
    },
    {
        "BLOCK_SIZE_M": 128,
        "BLOCK_SIZE_N": 64,
        "BLOCK_SIZE_K": 32,
        "GROUP_SIZE_M": 8,
        "num_stages": 4,
        "num_warps": 8,
        "ms": 0.360079824924469,
        "min_ms": 0.360079824924469,
        "max_ms": 0.360079824924469,
        "compile_time": 1.8333053588867188
    },
    {
        "BLOCK_SIZE_M": 64,
        "BLOCK_SIZE_N": 256,
        "BLOCK_SIZE_K": 64,
        "GROUP_SIZE_M": 8,
        "num_stages": 5,
        "num_warps": 16,
        "ms": 0.3611485958099365,
        "min_ms": 0.3611485958099365,
        "max_ms": 0.3611485958099365,
        "compile_time": 1.24770188331604
    },
    {
        "BLOCK_SIZE_M": 128,
        "BLOCK_SIZE_N": 64,
        "BLOCK_SIZE_K": 32,
        "GROUP_SIZE_M": 8,
        "num_stages": 5,
        "num_warps": 8,
        "ms": 0.36131763458251953,
        "min_ms": 0.36131763458251953,
        "max_ms": 0.36131763458251953,
        "compile_time": 1.2820205688476562
    },
    {
        "BLOCK_SIZE_M": 256,
        "BLOCK_SIZE_N": 64,
        "BLOCK_SIZE_K": 64,
        "GROUP_SIZE_M": 8,
        "num_stages": 5,
        "num_warps": 16,
        "ms": 0.36221539974212646,
        "min_ms": 0.36221539974212646,
        "max_ms": 0.36221539974212646,
        "compile_time": 1.3156118392944336
    },
    {
        "BLOCK_SIZE_M": 64,
        "BLOCK_SIZE_N": 128,
        "BLOCK_SIZE_K": 128,
        "GROUP_SIZE_M": 8,
        "num_stages": 2,
        "num_warps": 8,
        "ms": 0.36351126432418823,
        "min_ms": 0.36351126432418823,
        "max_ms": 0.36351126432418823,
        "compile_time": 1.2408709526062012
    },
    {
        "BLOCK_SIZE_M": 256,
        "BLOCK_SIZE_N": 128,
        "BLOCK_SIZE_K": 64,
        "GROUP_SIZE_M": 8,
        "num_stages": 3,
        "num_warps": 16,
        "ms": 0.36428213119506836,
        "min_ms": 0.36428213119506836,
        "max_ms": 0.36428213119506836,
        "compile_time": 2.26128888130188
    },
    {
        "BLOCK_SIZE_M": 256,
        "BLOCK_SIZE_N": 128,
        "BLOCK_SIZE_K": 64,
        "GROUP_SIZE_M": 8,
        "num_stages": 4,
        "num_warps": 16,
        "ms": 0.3646927773952484,
        "min_ms": 0.3646927773952484,
        "max_ms": 0.3646927773952484,
        "compile_time": 2.2818729877471924
    },
    {
        "BLOCK_SIZE_M": 128,
        "BLOCK_SIZE_N": 256,
        "BLOCK_SIZE_K": 64,
        "GROUP_SIZE_M": 8,
        "num_stages": 3,
        "num_warps": 16,
        "ms": 0.36494535207748413,
        "min_ms": 0.36494535207748413,
        "max_ms": 0.36494535207748413,
        "compile_time": 2.200033664703369
    },
    {
        "BLOCK_SIZE_M": 128,
        "BLOCK_SIZE_N": 256,
        "BLOCK_SIZE_K": 64,
        "GROUP_SIZE_M": 8,
        "num_stages": 4,
        "num_warps": 16,
        "ms": 0.3661716878414154,
        "min_ms": 0.3661716878414154,
        "max_ms": 0.3661716878414154,
        "compile_time": 1.2474005222320557
    },
    {
        "BLOCK_SIZE_M": 128,
        "BLOCK_SIZE_N": 256,
        "BLOCK_SIZE_K": 16,
        "GROUP_SIZE_M": 8,
        "num_stages": 3,
        "num_warps": 8,
        "ms": 0.3661908507347107,
        "min_ms": 0.3661908507347107,
        "max_ms": 0.3661908507347107,
        "compile_time": 1.2168331146240234
    },
    {
        "BLOCK_SIZE_M": 128,
        "BLOCK_SIZE_N": 128,
        "BLOCK_SIZE_K": 16,
        "GROUP_SIZE_M": 8,
        "num_stages": 3,
        "num_warps": 8,
        "ms": 0.36641353368759155,
        "min_ms": 0.36641353368759155,
        "max_ms": 0.36641353368759155,
        "compile_time": 1.2289745807647705
    },
    {
        "BLOCK_SIZE_M": 128,
        "BLOCK_SIZE_N": 64,
        "BLOCK_SIZE_K": 32,
        "GROUP_SIZE_M": 8,
        "num_stages": 3,
        "num_warps": 8,
        "ms": 0.3675784170627594,
        "min_ms": 0.3675784170627594,
        "max_ms": 0.3675784170627594,
        "compile_time": 1.7829182147979736
    },
    {
        "BLOCK_SIZE_M": 64,
        "BLOCK_SIZE_N": 128,
        "BLOCK_SIZE_K": 32,
        "GROUP_SIZE_M": 8,
        "num_stages": 2,
        "num_warps": 2,
        "ms": 0.36801567673683167,
        "min_ms": 0.36801567673683167,
        "max_ms": 0.36801567673683167,
        "compile_time": 2.3760569095611572
    },
    {
        "BLOCK_SIZE_M": 256,
        "BLOCK_SIZE_N": 64,
        "BLOCK_SIZE_K": 32,
        "GROUP_SIZE_M": 8,
        "num_stages": 3,
        "num_warps": 8,
        "ms": 0.3692878186702728,
        "min_ms": 0.3692878186702728,
        "max_ms": 0.3692878186702728,
        "compile_time": 1.2659060955047607
    },
    {
        "BLOCK_SIZE_M": 256,
        "BLOCK_SIZE_N": 128,
        "BLOCK_SIZE_K": 16,
        "GROUP_SIZE_M": 8,
        "num_stages": 4,
        "num_warps": 8,
        "ms": 0.3705352246761322,
        "min_ms": 0.3705352246761322,
        "max_ms": 0.3705352246761322,
        "compile_time": 2.3050739765167236
    },
    {
        "BLOCK_SIZE_M": 256,
        "BLOCK_SIZE_N": 128,
        "BLOCK_SIZE_K": 16,
        "GROUP_SIZE_M": 8,
        "num_stages": 5,
        "num_warps": 8,
        "ms": 0.37092310190200806,
        "min_ms": 0.37092310190200806,
        "max_ms": 0.37092310190200806,
        "compile_time": 2.304945230484009
    },
    {
        "BLOCK_SIZE_M": 256,
        "BLOCK_SIZE_N": 64,
        "BLOCK_SIZE_K": 64,
        "GROUP_SIZE_M": 8,
        "num_stages": 1,
        "num_warps": 4,
        "ms": 0.371288001537323,
        "min_ms": 0.371288001537323,
        "max_ms": 0.371288001537323,
        "compile_time": 2.574122905731201
    },
    {
        "BLOCK_SIZE_M": 128,
        "BLOCK_SIZE_N": 64,
        "BLOCK_SIZE_K": 64,
        "GROUP_SIZE_M": 8,
        "num_stages": 4,
        "num_warps": 2,
        "ms": 0.3714144229888916,
        "min_ms": 0.3714144229888916,
        "max_ms": 0.3714144229888916,
        "compile_time": 2.865185499191284
    },
    {
        "BLOCK_SIZE_M": 64,
        "BLOCK_SIZE_N": 64,
        "BLOCK_SIZE_K": 32,
        "GROUP_SIZE_M": 8,
        "num_stages": 4,
        "num_warps": 2,
        "ms": 0.37608811259269714,
        "min_ms": 0.37608811259269714,
        "max_ms": 0.37608811259269714,
        "compile_time": 2.0202250480651855
    },
    {
        "BLOCK_SIZE_M": 64,
        "BLOCK_SIZE_N": 64,
        "BLOCK_SIZE_K": 64,
        "GROUP_SIZE_M": 8,
        "num_stages": 4,
        "num_warps": 2,
        "ms": 0.3767799735069275,
        "min_ms": 0.3767799735069275,
        "max_ms": 0.3767799735069275,
        "compile_time": 2.2449722290039062
    },
    {
        "BLOCK_SIZE_M": 64,
        "BLOCK_SIZE_N": 128,
        "BLOCK_SIZE_K": 32,
        "GROUP_SIZE_M": 8,
        "num_stages": 8,
        "num_warps": 8,
        "ms": 0.377696692943573,
        "min_ms": 0.377696692943573,
        "max_ms": 0.377696692943573,
        "compile_time": 1.245086908340454
    },
    {
        "BLOCK_SIZE_M": 64,
        "BLOCK_SIZE_N": 64,
        "BLOCK_SIZE_K": 64,
        "GROUP_SIZE_M": 8,
        "num_stages": 4,
        "num_warps": 4,
        "ms": 0.37957286834716797,
        "min_ms": 0.37957286834716797,
        "max_ms": 0.37957286834716797,
        "compile_time": 1.2756953239440918
    },
    {
        "BLOCK_SIZE_M": 64,
        "BLOCK_SIZE_N": 64,
        "BLOCK_SIZE_K": 32,
        "GROUP_SIZE_M": 8,
        "num_stages": 3,
        "num_warps": 2,
        "ms": 0.3798416256904602,
        "min_ms": 0.3798416256904602,
        "max_ms": 0.3798416256904602,
        "compile_time": 1.9762952327728271
    },
    {
        "BLOCK_SIZE_M": 128,
        "BLOCK_SIZE_N": 64,
        "BLOCK_SIZE_K": 32,
        "GROUP_SIZE_M": 8,
        "num_stages": 8,
        "num_warps": 8,
        "ms": 0.3800366520881653,
        "min_ms": 0.3800366520881653,
        "max_ms": 0.3800366520881653,
        "compile_time": 1.2534527778625488
    },
    {
        "BLOCK_SIZE_M": 128,
        "BLOCK_SIZE_N": 128,
        "BLOCK_SIZE_K": 128,
        "GROUP_SIZE_M": 8,
        "num_stages": 2,
        "num_warps": 8,
        "ms": 0.38043028116226196,
        "min_ms": 0.38043028116226196,
        "max_ms": 0.38043028116226196,
        "compile_time": 2.21869158744812
    },
    {
        "BLOCK_SIZE_M": 64,
        "BLOCK_SIZE_N": 64,
        "BLOCK_SIZE_K": 64,
        "GROUP_SIZE_M": 8,
        "num_stages": 5,
        "num_warps": 4,
        "ms": 0.380732923746109,
        "min_ms": 0.380732923746109,
        "max_ms": 0.380732923746109,
        "compile_time": 1.2573208808898926
    },
    {
        "BLOCK_SIZE_M": 64,
        "BLOCK_SIZE_N": 64,
        "BLOCK_SIZE_K": 32,
        "GROUP_SIZE_M": 8,
        "num_stages": 5,
        "num_warps": 2,
        "ms": 0.38150811195373535,
        "min_ms": 0.38150811195373535,
        "max_ms": 0.38150811195373535,
        "compile_time": 2.1332027912139893
    },
    {
        "BLOCK_SIZE_M": 64,
        "BLOCK_SIZE_N": 64,
        "BLOCK_SIZE_K": 32,
        "GROUP_SIZE_M": 8,
        "num_stages": 6,
        "num_warps": 2,
        "ms": 0.3818874955177307,
        "min_ms": 0.3818874955177307,
        "max_ms": 0.3818874955177307,
        "compile_time": 2.1076152324676514
    },
    {
        "BLOCK_SIZE_M": 64,
        "BLOCK_SIZE_N": 64,
        "BLOCK_SIZE_K": 64,
        "GROUP_SIZE_M": 8,
        "num_stages": 3,
        "num_warps": 4,
        "ms": 0.38196879625320435,
        "min_ms": 0.38196879625320435,
        "max_ms": 0.38196879625320435,
        "compile_time": 1.2611403465270996
    },
    {
        "BLOCK_SIZE_M": 64,
        "BLOCK_SIZE_N": 256,
        "BLOCK_SIZE_K": 16,
        "GROUP_SIZE_M": 8,
        "num_stages": 3,
        "num_warps": 8,
        "ms": 0.3821601867675781,
        "min_ms": 0.3821601867675781,
        "max_ms": 0.3821601867675781,
        "compile_time": 1.2321083545684814
    },
    {
        "BLOCK_SIZE_M": 128,
        "BLOCK_SIZE_N": 128,
        "BLOCK_SIZE_K": 32,
        "GROUP_SIZE_M": 8,
        "num_stages": 5,
        "num_warps": 16,
        "ms": 0.3825637996196747,
        "min_ms": 0.3825637996196747,
        "max_ms": 0.3825637996196747,
        "compile_time": 1.8197240829467773
    },
    {
        "BLOCK_SIZE_M": 64,
        "BLOCK_SIZE_N": 128,
        "BLOCK_SIZE_K": 64,
        "GROUP_SIZE_M": 8,
        "num_stages": 2,
        "num_warps": 4,
        "ms": 0.38260167837142944,
        "min_ms": 0.38260167837142944,
        "max_ms": 0.38260167837142944,
        "compile_time": 2.0381202697753906
    },
    {
        "BLOCK_SIZE_M": 64,
        "BLOCK_SIZE_N": 64,
        "BLOCK_SIZE_K": 32,
        "GROUP_SIZE_M": 8,
        "num_stages": 7,
        "num_warps": 2,
        "ms": 0.382988840341568,
        "min_ms": 0.382988840341568,
        "max_ms": 0.382988840341568,
        "compile_time": 2.1078739166259766
    },
    {
        "BLOCK_SIZE_M": 128,
        "BLOCK_SIZE_N": 64,
        "BLOCK_SIZE_K": 32,
        "GROUP_SIZE_M": 8,
        "num_stages": 2,
        "num_warps": 4,
        "ms": 0.38362568616867065,
        "min_ms": 0.38362568616867065,
        "max_ms": 0.38362568616867065,
        "compile_time": 1.9113216400146484
    },
    {
        "BLOCK_SIZE_M": 64,
        "BLOCK_SIZE_N": 64,
        "BLOCK_SIZE_K": 32,
        "GROUP_SIZE_M": 8,
        "num_stages": 4,
        "num_warps": 4,
        "ms": 0.3839651942253113,
        "min_ms": 0.3839651942253113,
        "max_ms": 0.3839651942253113,
        "compile_time": 1.2756550312042236
    },
    {
        "BLOCK_SIZE_M": 64,
        "BLOCK_SIZE_N": 64,
        "BLOCK_SIZE_K": 64,
        "GROUP_SIZE_M": 8,
        "num_stages": 3,
        "num_warps": 2,
        "ms": 0.3842238485813141,
        "min_ms": 0.3842238485813141,
        "max_ms": 0.3842238485813141,
        "compile_time": 2.1590399742126465
    },
    {
        "BLOCK_SIZE_M": 128,
        "BLOCK_SIZE_N": 128,
        "BLOCK_SIZE_K": 32,
        "GROUP_SIZE_M": 8,
        "num_stages": 6,
        "num_warps": 16,
        "ms": 0.3845181465148926,
        "min_ms": 0.3845181465148926,
        "max_ms": 0.3845181465148926,
        "compile_time": 1.828108310699463
    },
    {
        "BLOCK_SIZE_M": 64,
        "BLOCK_SIZE_N": 64,
        "BLOCK_SIZE_K": 32,
        "GROUP_SIZE_M": 8,
        "num_stages": 5,
        "num_warps": 4,
        "ms": 0.38520723581314087,
        "min_ms": 0.38520723581314087,
        "max_ms": 0.38520723581314087,
        "compile_time": 1.3345222473144531
    },
    {
        "BLOCK_SIZE_M": 64,
        "BLOCK_SIZE_N": 64,
        "BLOCK_SIZE_K": 32,
        "GROUP_SIZE_M": 8,
        "num_stages": 3,
        "num_warps": 4,
        "ms": 0.38558802008628845,
        "min_ms": 0.38558802008628845,
        "max_ms": 0.38558802008628845,
        "compile_time": 1.2754755020141602
    },
    {
        "BLOCK_SIZE_M": 64,
        "BLOCK_SIZE_N": 256,
        "BLOCK_SIZE_K": 16,
        "GROUP_SIZE_M": 8,
        "num_stages": 4,
        "num_warps": 8,
        "ms": 0.3858020603656769,
        "min_ms": 0.3858020603656769,
        "max_ms": 0.3858020603656769,
        "compile_time": 1.2258944511413574
    },
    {
        "BLOCK_SIZE_M": 128,
        "BLOCK_SIZE_N": 128,
        "BLOCK_SIZE_K": 32,
        "GROUP_SIZE_M": 8,
        "num_stages": 7,
        "num_warps": 16,
        "ms": 0.3860488533973694,
        "min_ms": 0.3860488533973694,
        "max_ms": 0.3860488533973694,
        "compile_time": 1.2301852703094482
    },
    {
        "BLOCK_SIZE_M": 64,
        "BLOCK_SIZE_N": 256,
        "BLOCK_SIZE_K": 16,
        "GROUP_SIZE_M": 8,
        "num_stages": 6,
        "num_warps": 8,
        "ms": 0.3861806392669678,
        "min_ms": 0.3861806392669678,
        "max_ms": 0.3861806392669678,
        "compile_time": 1.2167084217071533
    },
    {
        "BLOCK_SIZE_M": 64,
        "BLOCK_SIZE_N": 64,
        "BLOCK_SIZE_K": 64,
        "GROUP_SIZE_M": 8,
        "num_stages": 6,
        "num_warps": 4,
        "ms": 0.3863980174064636,
        "min_ms": 0.3863980174064636,
        "max_ms": 0.3863980174064636,
        "compile_time": 1.2563002109527588
    },
    {
        "BLOCK_SIZE_M": 64,
        "BLOCK_SIZE_N": 256,
        "BLOCK_SIZE_K": 16,
        "GROUP_SIZE_M": 8,
        "num_stages": 5,
        "num_warps": 8,
        "ms": 0.3865349292755127,
        "min_ms": 0.3865349292755127,
        "max_ms": 0.3865349292755127,
        "compile_time": 1.2354133129119873
    },
    {
        "BLOCK_SIZE_M": 64,
        "BLOCK_SIZE_N": 128,
        "BLOCK_SIZE_K": 32,
        "GROUP_SIZE_M": 8,
        "num_stages": 2,
        "num_warps": 4,
        "ms": 0.3868531584739685,
        "min_ms": 0.3868531584739685,
        "max_ms": 0.3868531584739685,
        "compile_time": 1.2079792022705078
    },
    {
        "BLOCK_SIZE_M": 128,
        "BLOCK_SIZE_N": 128,
        "BLOCK_SIZE_K": 32,
        "GROUP_SIZE_M": 8,
        "num_stages": 4,
        "num_warps": 16,
        "ms": 0.38710176944732666,
        "min_ms": 0.38710176944732666,
        "max_ms": 0.38710176944732666,
        "compile_time": 1.8153660297393799
    },
    {
        "BLOCK_SIZE_M": 128,
        "BLOCK_SIZE_N": 128,
        "BLOCK_SIZE_K": 32,
        "GROUP_SIZE_M": 8,
        "num_stages": 8,
        "num_warps": 16,
        "ms": 0.3871186077594757,
        "min_ms": 0.3871186077594757,
        "max_ms": 0.3871186077594757,
        "compile_time": 1.235832691192627
    },
    {
        "BLOCK_SIZE_M": 64,
        "BLOCK_SIZE_N": 64,
        "BLOCK_SIZE_K": 32,
        "GROUP_SIZE_M": 8,
        "num_stages": 6,
        "num_warps": 4,
        "ms": 0.3872736096382141,
        "min_ms": 0.3872736096382141,
        "max_ms": 0.3872736096382141,
        "compile_time": 1.2966468334197998
    },
    {
        "BLOCK_SIZE_M": 128,
        "BLOCK_SIZE_N": 128,
        "BLOCK_SIZE_K": 32,
        "GROUP_SIZE_M": 8,
        "num_stages": 3,
        "num_warps": 16,
        "ms": 0.3875204026699066,
        "min_ms": 0.3875204026699066,
        "max_ms": 0.3875204026699066,
        "compile_time": 1.7945053577423096
    },
    {
        "BLOCK_SIZE_M": 128,
        "BLOCK_SIZE_N": 64,
        "BLOCK_SIZE_K": 64,
        "GROUP_SIZE_M": 8,
        "num_stages": 2,
        "num_warps": 8,
        "ms": 0.38778790831565857,
        "min_ms": 0.38778790831565857,
        "max_ms": 0.38778790831565857,
        "compile_time": 1.2231032848358154
    },
    {
        "BLOCK_SIZE_M": 64,
        "BLOCK_SIZE_N": 256,
        "BLOCK_SIZE_K": 16,
        "GROUP_SIZE_M": 8,
        "num_stages": 7,
        "num_warps": 8,
        "ms": 0.3885660767555237,
        "min_ms": 0.3885660767555237,
        "max_ms": 0.3885660767555237,
        "compile_time": 1.228637933731079
    },
    {
        "BLOCK_SIZE_M": 256,
        "BLOCK_SIZE_N": 128,
        "BLOCK_SIZE_K": 16,
        "GROUP_SIZE_M": 8,
        "num_stages": 3,
        "num_warps": 8,
        "ms": 0.3887467682361603,
        "min_ms": 0.3887467682361603,
        "max_ms": 0.3887467682361603,
        "compile_time": 1.256579875946045
    },
    {
        "BLOCK_SIZE_M": 64,
        "BLOCK_SIZE_N": 64,
        "BLOCK_SIZE_K": 32,
        "GROUP_SIZE_M": 8,
        "num_stages": 7,
        "num_warps": 4,
        "ms": 0.38889279961586,
        "min_ms": 0.38889279961586,
        "max_ms": 0.38889279961586,
        "compile_time": 1.2788681983947754
    },
    {
        "BLOCK_SIZE_M": 128,
        "BLOCK_SIZE_N": 64,
        "BLOCK_SIZE_K": 16,
        "GROUP_SIZE_M": 8,
        "num_stages": 7,
        "num_warps": 2,
        "ms": 0.3889143466949463,
        "min_ms": 0.3889143466949463,
        "max_ms": 0.3889143466949463,
        "compile_time": 2.260812520980835
    },
    {
        "BLOCK_SIZE_M": 64,
        "BLOCK_SIZE_N": 256,
        "BLOCK_SIZE_K": 16,
        "GROUP_SIZE_M": 8,
        "num_stages": 8,
        "num_warps": 8,
        "ms": 0.3899994492530823,
        "min_ms": 0.3899994492530823,
        "max_ms": 0.3899994492530823,
        "compile_time": 1.2430343627929688
    },
    {
        "BLOCK_SIZE_M": 64,
        "BLOCK_SIZE_N": 64,
        "BLOCK_SIZE_K": 64,
        "GROUP_SIZE_M": 8,
        "num_stages": 5,
        "num_warps": 2,
        "ms": 0.3922846019268036,
        "min_ms": 0.3922846019268036,
        "max_ms": 0.3922846019268036,
        "compile_time": 2.310764789581299
    },
    {
        "BLOCK_SIZE_M": 512,
        "BLOCK_SIZE_N": 64,
        "BLOCK_SIZE_K": 64,
        "GROUP_SIZE_M": 8,
        "num_stages": 2,
        "num_warps": 8,
        "ms": 0.39309167861938477,
        "min_ms": 0.39309167861938477,
        "max_ms": 0.39309167861938477,
        "compile_time": 2.8350584506988525
    },
    {
        "BLOCK_SIZE_M": 64,
        "BLOCK_SIZE_N": 512,
        "BLOCK_SIZE_K": 16,
        "GROUP_SIZE_M": 8,
        "num_stages": 4,
        "num_warps": 16,
        "ms": 0.39322397112846375,
        "min_ms": 0.39322397112846375,
        "max_ms": 0.39322397112846375,
        "compile_time": 1.2985217571258545
    },
    {
        "BLOCK_SIZE_M": 128,
        "BLOCK_SIZE_N": 64,
        "BLOCK_SIZE_K": 16,
        "GROUP_SIZE_M": 8,
        "num_stages": 7,
        "num_warps": 4,
        "ms": 0.3933081328868866,
        "min_ms": 0.3933081328868866,
        "max_ms": 0.3933081328868866,
        "compile_time": 1.8427622318267822
    },
    {
        "BLOCK_SIZE_M": 128,
        "BLOCK_SIZE_N": 64,
        "BLOCK_SIZE_K": 16,
        "GROUP_SIZE_M": 8,
        "num_stages": 4,
        "num_warps": 2,
        "ms": 0.39344149827957153,
        "min_ms": 0.39344149827957153,
        "max_ms": 0.39344149827957153,
        "compile_time": 2.193258762359619
    },
    {
        "BLOCK_SIZE_M": 64,
        "BLOCK_SIZE_N": 128,
        "BLOCK_SIZE_K": 64,
        "GROUP_SIZE_M": 8,
        "num_stages": 2,
        "num_warps": 8,
        "ms": 0.39378947019577026,
        "min_ms": 0.39378947019577026,
        "max_ms": 0.39378947019577026,
        "compile_time": 1.2045576572418213
    },
    {
        "BLOCK_SIZE_M": 64,
        "BLOCK_SIZE_N": 512,
        "BLOCK_SIZE_K": 16,
        "GROUP_SIZE_M": 8,
        "num_stages": 7,
        "num_warps": 16,
        "ms": 0.3938482105731964,
        "min_ms": 0.3938482105731964,
        "max_ms": 0.3938482105731964,
        "compile_time": 1.3320472240447998
    },
    {
        "BLOCK_SIZE_M": 128,
        "BLOCK_SIZE_N": 128,
        "BLOCK_SIZE_K": 128,
        "GROUP_SIZE_M": 8,
        "num_stages": 1,
        "num_warps": 4,
        "ms": 0.3940630555152893,
        "min_ms": 0.3940630555152893,
        "max_ms": 0.3940630555152893,
        "compile_time": 2.8329896926879883
    },
    {
        "BLOCK_SIZE_M": 64,
        "BLOCK_SIZE_N": 512,
        "BLOCK_SIZE_K": 16,
        "GROUP_SIZE_M": 8,
        "num_stages": 8,
        "num_warps": 16,
        "ms": 0.3942444622516632,
        "min_ms": 0.3942444622516632,
        "max_ms": 0.3942444622516632,
        "compile_time": 2.013251304626465
    },
    {
        "BLOCK_SIZE_M": 256,
        "BLOCK_SIZE_N": 128,
        "BLOCK_SIZE_K": 32,
        "GROUP_SIZE_M": 8,
        "num_stages": 2,
        "num_warps": 8,
        "ms": 0.3942939043045044,
        "min_ms": 0.3942939043045044,
        "max_ms": 0.3942939043045044,
        "compile_time": 2.445241928100586
    },
    {
        "BLOCK_SIZE_M": 64,
        "BLOCK_SIZE_N": 512,
        "BLOCK_SIZE_K": 16,
        "GROUP_SIZE_M": 8,
        "num_stages": 5,
        "num_warps": 16,
        "ms": 0.3950999975204468,
        "min_ms": 0.3950999975204468,
        "max_ms": 0.3950999975204468,
        "compile_time": 1.2917773723602295
    },
    {
        "BLOCK_SIZE_M": 128,
        "BLOCK_SIZE_N": 128,
        "BLOCK_SIZE_K": 32,
        "GROUP_SIZE_M": 8,
        "num_stages": 1,
        "num_warps": 8,
        "ms": 0.39576786756515503,
        "min_ms": 0.39576786756515503,
        "max_ms": 0.39576786756515503,
        "compile_time": 1.8729524612426758
    },
    {
        "BLOCK_SIZE_M": 128,
        "BLOCK_SIZE_N": 64,
        "BLOCK_SIZE_K": 16,
        "GROUP_SIZE_M": 8,
        "num_stages": 5,
        "num_warps": 2,
        "ms": 0.3959541916847229,
        "min_ms": 0.3959541916847229,
        "max_ms": 0.3959541916847229,
        "compile_time": 2.2178711891174316
    },
    {
        "BLOCK_SIZE_M": 128,
        "BLOCK_SIZE_N": 256,
        "BLOCK_SIZE_K": 32,
        "GROUP_SIZE_M": 8,
        "num_stages": 2,
        "num_warps": 8,
        "ms": 0.3959617614746094,
        "min_ms": 0.3959617614746094,
        "max_ms": 0.3959617614746094,
        "compile_time": 2.3480114936828613
    },
    {
        "BLOCK_SIZE_M": 64,
        "BLOCK_SIZE_N": 64,
        "BLOCK_SIZE_K": 32,
        "GROUP_SIZE_M": 8,
        "num_stages": 8,
        "num_warps": 2,
        "ms": 0.3962011933326721,
        "min_ms": 0.3962011933326721,
        "max_ms": 0.3962011933326721,
        "compile_time": 2.107621192932129
    },
    {
        "BLOCK_SIZE_M": 256,
        "BLOCK_SIZE_N": 128,
        "BLOCK_SIZE_K": 64,
        "GROUP_SIZE_M": 8,
        "num_stages": 2,
        "num_warps": 16,
        "ms": 0.3962302803993225,
        "min_ms": 0.3962302803993225,
        "max_ms": 0.3962302803993225,
        "compile_time": 2.221989870071411
    },
    {
        "BLOCK_SIZE_M": 64,
        "BLOCK_SIZE_N": 64,
        "BLOCK_SIZE_K": 64,
        "GROUP_SIZE_M": 8,
        "num_stages": 6,
        "num_warps": 2,
        "ms": 0.3964911103248596,
        "min_ms": 0.3964911103248596,
        "max_ms": 0.3964911103248596,
        "compile_time": 2.3626387119293213
    },
    {
        "BLOCK_SIZE_M": 64,
        "BLOCK_SIZE_N": 64,
        "BLOCK_SIZE_K": 32,
        "GROUP_SIZE_M": 8,
        "num_stages": 8,
        "num_warps": 4,
        "ms": 0.3969355523586273,
        "min_ms": 0.3969355523586273,
        "max_ms": 0.3969355523586273,
        "compile_time": 1.2651727199554443
    },
    {
        "BLOCK_SIZE_M": 64,
        "BLOCK_SIZE_N": 512,
        "BLOCK_SIZE_K": 16,
        "GROUP_SIZE_M": 8,
        "num_stages": 6,
        "num_warps": 16,
        "ms": 0.3974379897117615,
        "min_ms": 0.3974379897117615,
        "max_ms": 0.3974379897117615,
        "compile_time": 2.0704469680786133
    },
    {
        "BLOCK_SIZE_M": 64,
        "BLOCK_SIZE_N": 64,
        "BLOCK_SIZE_K": 128,
        "GROUP_SIZE_M": 8,
        "num_stages": 3,
        "num_warps": 4,
        "ms": 0.3996792435646057,
        "min_ms": 0.3996792435646057,
        "max_ms": 0.3996792435646057,
        "compile_time": 2.1498630046844482
    },
    {
        "BLOCK_SIZE_M": 64,
        "BLOCK_SIZE_N": 64,
        "BLOCK_SIZE_K": 32,
        "GROUP_SIZE_M": 8,
        "num_stages": 2,
        "num_warps": 2,
        "ms": 0.40067481994628906,
        "min_ms": 0.40067481994628906,
        "max_ms": 0.40067481994628906,
        "compile_time": 1.8925437927246094
    },
    {
        "BLOCK_SIZE_M": 64,
        "BLOCK_SIZE_N": 512,
        "BLOCK_SIZE_K": 16,
        "GROUP_SIZE_M": 8,
        "num_stages": 3,
        "num_warps": 16,
        "ms": 0.40142956376075745,
        "min_ms": 0.40142956376075745,
        "max_ms": 0.40142956376075745,
        "compile_time": 1.3860890865325928
    },
    {
        "BLOCK_SIZE_M": 128,
        "BLOCK_SIZE_N": 64,
        "BLOCK_SIZE_K": 16,
        "GROUP_SIZE_M": 8,
        "num_stages": 6,
        "num_warps": 2,
        "ms": 0.40269455313682556,
        "min_ms": 0.40269455313682556,
        "max_ms": 0.40269455313682556,
        "compile_time": 2.242406129837036
    },
    {
        "BLOCK_SIZE_M": 64,
        "BLOCK_SIZE_N": 64,
        "BLOCK_SIZE_K": 64,
        "GROUP_SIZE_M": 8,
        "num_stages": 7,
        "num_warps": 4,
        "ms": 0.40317806601524353,
        "min_ms": 0.40317806601524353,
        "max_ms": 0.40317806601524353,
        "compile_time": 2.066910982131958
    },
    {
        "BLOCK_SIZE_M": 128,
        "BLOCK_SIZE_N": 64,
        "BLOCK_SIZE_K": 16,
        "GROUP_SIZE_M": 8,
        "num_stages": 6,
        "num_warps": 4,
        "ms": 0.40389561653137207,
        "min_ms": 0.40389561653137207,
        "max_ms": 0.40389561653137207,
        "compile_time": 1.2514221668243408
    },
    {
        "BLOCK_SIZE_M": 64,
        "BLOCK_SIZE_N": 64,
        "BLOCK_SIZE_K": 128,
        "GROUP_SIZE_M": 8,
        "num_stages": 5,
        "num_warps": 4,
        "ms": 0.40464964509010315,
        "min_ms": 0.40464964509010315,
        "max_ms": 0.40464964509010315,
        "compile_time": 2.2766597270965576
    },
    {
        "BLOCK_SIZE_M": 64,
        "BLOCK_SIZE_N": 64,
        "BLOCK_SIZE_K": 64,
        "GROUP_SIZE_M": 8,
        "num_stages": 8,
        "num_warps": 4,
        "ms": 0.40497860312461853,
        "min_ms": 0.40497860312461853,
        "max_ms": 0.40497860312461853,
        "compile_time": 1.2453725337982178
    },
    {
        "BLOCK_SIZE_M": 128,
        "BLOCK_SIZE_N": 64,
        "BLOCK_SIZE_K": 16,
        "GROUP_SIZE_M": 8,
        "num_stages": 4,
        "num_warps": 4,
        "ms": 0.40785518288612366,
        "min_ms": 0.40785518288612366,
        "max_ms": 0.40785518288612366,
        "compile_time": 1.2527272701263428
    },
    {
        "BLOCK_SIZE_M": 256,
        "BLOCK_SIZE_N": 64,
        "BLOCK_SIZE_K": 16,
        "GROUP_SIZE_M": 8,
        "num_stages": 6,
        "num_warps": 4,
        "ms": 0.4079285264015198,
        "min_ms": 0.4079285264015198,
        "max_ms": 0.4079285264015198,
        "compile_time": 2.341923236846924
    },
    {
        "BLOCK_SIZE_M": 128,
        "BLOCK_SIZE_N": 64,
        "BLOCK_SIZE_K": 16,
        "GROUP_SIZE_M": 8,
        "num_stages": 3,
        "num_warps": 2,
        "ms": 0.40830478072166443,
        "min_ms": 0.40830478072166443,
        "max_ms": 0.40830478072166443,
        "compile_time": 2.149434804916382
    },
    {
        "BLOCK_SIZE_M": 256,
        "BLOCK_SIZE_N": 64,
        "BLOCK_SIZE_K": 16,
        "GROUP_SIZE_M": 8,
        "num_stages": 7,
        "num_warps": 4,
        "ms": 0.40846672654151917,
        "min_ms": 0.40846672654151917,
        "max_ms": 0.40846672654151917,
        "compile_time": 2.4405946731567383
    },
    {
        "BLOCK_SIZE_M": 256,
        "BLOCK_SIZE_N": 64,
        "BLOCK_SIZE_K": 16,
        "GROUP_SIZE_M": 8,
        "num_stages": 4,
        "num_warps": 4,
        "ms": 0.4086482524871826,
        "min_ms": 0.4086482524871826,
        "max_ms": 0.4086482524871826,
        "compile_time": 2.3210575580596924
    },
    {
        "BLOCK_SIZE_M": 64,
        "BLOCK_SIZE_N": 64,
        "BLOCK_SIZE_K": 128,
        "GROUP_SIZE_M": 8,
        "num_stages": 4,
        "num_warps": 4,
        "ms": 0.40884464979171753,
        "min_ms": 0.40884464979171753,
        "max_ms": 0.40884464979171753,
        "compile_time": 2.1570255756378174
    },
    {
        "BLOCK_SIZE_M": 256,
        "BLOCK_SIZE_N": 64,
        "BLOCK_SIZE_K": 16,
        "GROUP_SIZE_M": 8,
        "num_stages": 8,
        "num_warps": 4,
        "ms": 0.4090801775455475,
        "min_ms": 0.4090801775455475,
        "max_ms": 0.4090801775455475,
        "compile_time": 2.4659173488616943
    },
    {
        "BLOCK_SIZE_M": 256,
        "BLOCK_SIZE_N": 64,
        "BLOCK_SIZE_K": 16,
        "GROUP_SIZE_M": 8,
        "num_stages": 5,
        "num_warps": 4,
        "ms": 0.4097420573234558,
        "min_ms": 0.4097420573234558,
        "max_ms": 0.4097420573234558,
        "compile_time": 2.359673261642456
    },
    {
        "BLOCK_SIZE_M": 128,
        "BLOCK_SIZE_N": 64,
        "BLOCK_SIZE_K": 16,
        "GROUP_SIZE_M": 8,
        "num_stages": 5,
        "num_warps": 4,
        "ms": 0.41018766164779663,
        "min_ms": 0.41018766164779663,
        "max_ms": 0.41018766164779663,
        "compile_time": 1.2663419246673584
    },
    {
        "BLOCK_SIZE_M": 64,
        "BLOCK_SIZE_N": 128,
        "BLOCK_SIZE_K": 64,
        "GROUP_SIZE_M": 8,
        "num_stages": 4,
        "num_warps": 2,
        "ms": 0.41033539175987244,
        "min_ms": 0.41033539175987244,
        "max_ms": 0.41033539175987244,
        "compile_time": 2.711103677749634
    },
    {
        "BLOCK_SIZE_M": 128,
        "BLOCK_SIZE_N": 128,
        "BLOCK_SIZE_K": 128,
        "GROUP_SIZE_M": 8,
        "num_stages": 2,
        "num_warps": 16,
        "ms": 0.41057413816452026,
        "min_ms": 0.41057413816452026,
        "max_ms": 0.41057413816452026,
        "compile_time": 1.2381591796875
    },
    {
        "BLOCK_SIZE_M": 64,
        "BLOCK_SIZE_N": 64,
        "BLOCK_SIZE_K": 128,
        "GROUP_SIZE_M": 8,
        "num_stages": 2,
        "num_warps": 2,
        "ms": 0.4109199047088623,
        "min_ms": 0.4109199047088623,
        "max_ms": 0.4109199047088623,
        "compile_time": 2.503364324569702
    },
    {
        "BLOCK_SIZE_M": 64,
        "BLOCK_SIZE_N": 512,
        "BLOCK_SIZE_K": 32,
        "GROUP_SIZE_M": 8,
        "num_stages": 3,
        "num_warps": 16,
        "ms": 0.4111862778663635,
        "min_ms": 0.4111862778663635,
        "max_ms": 0.4111862778663635,
        "compile_time": 1.3348021507263184
    },
    {
        "BLOCK_SIZE_M": 64,
        "BLOCK_SIZE_N": 64,
        "BLOCK_SIZE_K": 128,
        "GROUP_SIZE_M": 8,
        "num_stages": 2,
        "num_warps": 4,
        "ms": 0.41156983375549316,
        "min_ms": 0.41156983375549316,
        "max_ms": 0.41156983375549316,
        "compile_time": 2.0302047729492188
    },
    {
        "BLOCK_SIZE_M": 64,
        "BLOCK_SIZE_N": 64,
        "BLOCK_SIZE_K": 128,
        "GROUP_SIZE_M": 8,
        "num_stages": 6,
        "num_warps": 4,
        "ms": 0.41178393363952637,
        "min_ms": 0.41178393363952637,
        "max_ms": 0.41178393363952637,
        "compile_time": 2.339365005493164
    },
    {
        "BLOCK_SIZE_M": 128,
        "BLOCK_SIZE_N": 64,
        "BLOCK_SIZE_K": 16,
        "GROUP_SIZE_M": 8,
        "num_stages": 8,
        "num_warps": 4,
        "ms": 0.41221165657043457,
        "min_ms": 0.41221165657043457,
        "max_ms": 0.41221165657043457,
        "compile_time": 1.915710210800171
    },
    {
        "BLOCK_SIZE_M": 128,
        "BLOCK_SIZE_N": 64,
        "BLOCK_SIZE_K": 16,
        "GROUP_SIZE_M": 8,
        "num_stages": 8,
        "num_warps": 2,
        "ms": 0.4124080538749695,
        "min_ms": 0.4124080538749695,
        "max_ms": 0.4124080538749695,
        "compile_time": 2.2861506938934326
    },
    {
        "BLOCK_SIZE_M": 64,
        "BLOCK_SIZE_N": 64,
        "BLOCK_SIZE_K": 256,
        "GROUP_SIZE_M": 8,
        "num_stages": 2,
        "num_warps": 4,
        "ms": 0.41319456696510315,
        "min_ms": 0.41319456696510315,
        "max_ms": 0.41319456696510315,
        "compile_time": 2.4181785583496094
    },
    {
        "BLOCK_SIZE_M": 64,
        "BLOCK_SIZE_N": 512,
        "BLOCK_SIZE_K": 32,
        "GROUP_SIZE_M": 8,
        "num_stages": 2,
        "num_warps": 8,
        "ms": 0.4135335087776184,
        "min_ms": 0.4135335087776184,
        "max_ms": 0.4135335087776184,
        "compile_time": 2.554621934890747
    },
    {
        "BLOCK_SIZE_M": 256,
        "BLOCK_SIZE_N": 128,
        "BLOCK_SIZE_K": 128,
        "GROUP_SIZE_M": 8,
        "num_stages": 2,
        "num_warps": 16,
        "ms": 0.41355443000793457,
        "min_ms": 0.41355443000793457,
        "max_ms": 0.41355443000793457,
        "compile_time": 2.3043582439422607
    },
    {
        "BLOCK_SIZE_M": 128,
        "BLOCK_SIZE_N": 64,
        "BLOCK_SIZE_K": 16,
        "GROUP_SIZE_M": 8,
        "num_stages": 3,
        "num_warps": 4,
        "ms": 0.41362470388412476,
        "min_ms": 0.41362470388412476,
        "max_ms": 0.41362470388412476,
        "compile_time": 1.250889778137207
    },
    {
        "BLOCK_SIZE_M": 64,
        "BLOCK_SIZE_N": 256,
        "BLOCK_SIZE_K": 32,
        "GROUP_SIZE_M": 8,
        "num_stages": 4,
        "num_warps": 16,
        "ms": 0.4140041470527649,
        "min_ms": 0.4140041470527649,
        "max_ms": 0.4140041470527649,
        "compile_time": 1.2182791233062744
    },
    {
        "BLOCK_SIZE_M": 64,
        "BLOCK_SIZE_N": 64,
        "BLOCK_SIZE_K": 64,
        "GROUP_SIZE_M": 8,
        "num_stages": 2,
        "num_warps": 4,
        "ms": 0.4140335023403168,
        "min_ms": 0.4140335023403168,
        "max_ms": 0.4140335023403168,
        "compile_time": 1.2514188289642334
    },
    {
        "BLOCK_SIZE_M": 256,
        "BLOCK_SIZE_N": 64,
        "BLOCK_SIZE_K": 16,
        "GROUP_SIZE_M": 8,
        "num_stages": 3,
        "num_warps": 4,
        "ms": 0.4143468737602234,
        "min_ms": 0.4143468737602234,
        "max_ms": 0.4143468737602234,
        "compile_time": 2.3046469688415527
    },
    {
        "BLOCK_SIZE_M": 128,
        "BLOCK_SIZE_N": 64,
        "BLOCK_SIZE_K": 64,
        "GROUP_SIZE_M": 8,
        "num_stages": 1,
        "num_warps": 4,
        "ms": 0.4144856929779053,
        "min_ms": 0.4144856929779053,
        "max_ms": 0.4144856929779053,
        "compile_time": 1.9704327583312988
    },
    {
        "BLOCK_SIZE_M": 128,
        "BLOCK_SIZE_N": 256,
        "BLOCK_SIZE_K": 64,
        "GROUP_SIZE_M": 8,
        "num_stages": 2,
        "num_warps": 16,
        "ms": 0.41466084122657776,
        "min_ms": 0.41466084122657776,
        "max_ms": 0.41466084122657776,
        "compile_time": 1.2353308200836182
    },
    {
        "BLOCK_SIZE_M": 128,
        "BLOCK_SIZE_N": 256,
        "BLOCK_SIZE_K": 128,
        "GROUP_SIZE_M": 8,
        "num_stages": 2,
        "num_warps": 8,
        "ms": 0.41466909646987915,
        "min_ms": 0.41466909646987915,
        "max_ms": 0.41466909646987915,
        "compile_time": 2.7145426273345947
    },
    {
        "BLOCK_SIZE_M": 64,
        "BLOCK_SIZE_N": 256,
        "BLOCK_SIZE_K": 32,
        "GROUP_SIZE_M": 8,
        "num_stages": 3,
        "num_warps": 16,
        "ms": 0.4146951138973236,
        "min_ms": 0.4146951138973236,
        "max_ms": 0.4146951138973236,
        "compile_time": 1.231503963470459
    },
    {
        "BLOCK_SIZE_M": 128,
        "BLOCK_SIZE_N": 64,
        "BLOCK_SIZE_K": 32,
        "GROUP_SIZE_M": 8,
        "num_stages": 1,
        "num_warps": 2,
        "ms": 0.4151744842529297,
        "min_ms": 0.4151744842529297,
        "max_ms": 0.4151744842529297,
        "compile_time": 2.212268829345703
    },
    {
        "BLOCK_SIZE_M": 64,
        "BLOCK_SIZE_N": 256,
        "BLOCK_SIZE_K": 32,
        "GROUP_SIZE_M": 8,
        "num_stages": 6,
        "num_warps": 16,
        "ms": 0.41522082686424255,
        "min_ms": 0.41522082686424255,
        "max_ms": 0.41522082686424255,
        "compile_time": 1.2208812236785889
    },
    {
        "BLOCK_SIZE_M": 64,
        "BLOCK_SIZE_N": 256,
        "BLOCK_SIZE_K": 32,
        "GROUP_SIZE_M": 8,
        "num_stages": 5,
        "num_warps": 16,
        "ms": 0.4152599275112152,
        "min_ms": 0.4152599275112152,
        "max_ms": 0.4152599275112152,
        "compile_time": 1.22074556350708
    },
    {
        "BLOCK_SIZE_M": 64,
        "BLOCK_SIZE_N": 256,
        "BLOCK_SIZE_K": 32,
        "GROUP_SIZE_M": 8,
        "num_stages": 7,
        "num_warps": 16,
        "ms": 0.4153445363044739,
        "min_ms": 0.4153445363044739,
        "max_ms": 0.4153445363044739,
        "compile_time": 1.817392110824585
    },
    {
        "BLOCK_SIZE_M": 64,
        "BLOCK_SIZE_N": 256,
        "BLOCK_SIZE_K": 32,
        "GROUP_SIZE_M": 8,
        "num_stages": 8,
        "num_warps": 16,
        "ms": 0.41535383462905884,
        "min_ms": 0.41535383462905884,
        "max_ms": 0.41535383462905884,
        "compile_time": 1.854236125946045
    },
    {
        "BLOCK_SIZE_M": 64,
        "BLOCK_SIZE_N": 512,
        "BLOCK_SIZE_K": 32,
        "GROUP_SIZE_M": 8,
        "num_stages": 5,
        "num_warps": 16,
        "ms": 0.41558924317359924,
        "min_ms": 0.41558924317359924,
        "max_ms": 0.41558924317359924,
        "compile_time": 2.1155316829681396
    },
    {
        "BLOCK_SIZE_M": 64,
        "BLOCK_SIZE_N": 512,
        "BLOCK_SIZE_K": 32,
        "GROUP_SIZE_M": 8,
        "num_stages": 4,
        "num_warps": 16,
        "ms": 0.41571539640426636,
        "min_ms": 0.41571539640426636,
        "max_ms": 0.41571539640426636,
        "compile_time": 2.045527458190918
    },
    {
        "BLOCK_SIZE_M": 32,
        "BLOCK_SIZE_N": 256,
        "BLOCK_SIZE_K": 32,
        "GROUP_SIZE_M": 8,
        "num_stages": 5,
        "num_warps": 4,
        "ms": 0.41612109541893005,
        "min_ms": 0.41612109541893005,
        "max_ms": 0.41612109541893005,
        "compile_time": 1.2220127582550049
    },
    {
        "BLOCK_SIZE_M": 256,
        "BLOCK_SIZE_N": 64,
        "BLOCK_SIZE_K": 32,
        "GROUP_SIZE_M": 8,
        "num_stages": 4,
        "num_warps": 16,
        "ms": 0.41632360219955444,
        "min_ms": 0.41632360219955444,
        "max_ms": 0.41632360219955444,
        "compile_time": 1.2621839046478271
    },
    {
        "BLOCK_SIZE_M": 32,
        "BLOCK_SIZE_N": 512,
        "BLOCK_SIZE_K": 16,
        "GROUP_SIZE_M": 8,
        "num_stages": 5,
        "num_warps": 4,
        "ms": 0.4167366623878479,
        "min_ms": 0.4167366623878479,
        "max_ms": 0.4167366623878479,
        "compile_time": 2.2567853927612305
    },
    {
        "BLOCK_SIZE_M": 64,
        "BLOCK_SIZE_N": 64,
        "BLOCK_SIZE_K": 128,
        "GROUP_SIZE_M": 8,
        "num_stages": 3,
        "num_warps": 2,
        "ms": 0.4169088900089264,
        "min_ms": 0.4169088900089264,
        "max_ms": 0.4169088900089264,
        "compile_time": 2.768679618835449
    },
    {
        "BLOCK_SIZE_M": 32,
        "BLOCK_SIZE_N": 256,
        "BLOCK_SIZE_K": 32,
        "GROUP_SIZE_M": 8,
        "num_stages": 8,
        "num_warps": 4,
        "ms": 0.4172609746456146,
        "min_ms": 0.4172609746456146,
        "max_ms": 0.4172609746456146,
        "compile_time": 2.129045248031616
    },
    {
        "BLOCK_SIZE_M": 32,
        "BLOCK_SIZE_N": 256,
        "BLOCK_SIZE_K": 32,
        "GROUP_SIZE_M": 8,
        "num_stages": 6,
        "num_warps": 4,
        "ms": 0.4173648953437805,
        "min_ms": 0.4173648953437805,
        "max_ms": 0.4173648953437805,
        "compile_time": 2.025404930114746
    },
    {
        "BLOCK_SIZE_M": 32,
        "BLOCK_SIZE_N": 256,
        "BLOCK_SIZE_K": 32,
        "GROUP_SIZE_M": 8,
        "num_stages": 7,
        "num_warps": 4,
        "ms": 0.4183531403541565,
        "min_ms": 0.4183531403541565,
        "max_ms": 0.4183531403541565,
        "compile_time": 2.075309991836548
    },
    {
        "BLOCK_SIZE_M": 128,
        "BLOCK_SIZE_N": 64,
        "BLOCK_SIZE_K": 64,
        "GROUP_SIZE_M": 8,
        "num_stages": 1,
        "num_warps": 2,
        "ms": 0.41898488998413086,
        "min_ms": 0.41898488998413086,
        "max_ms": 0.41898488998413086,
        "compile_time": 2.440276861190796
    },
    {
        "BLOCK_SIZE_M": 256,
        "BLOCK_SIZE_N": 32,
        "BLOCK_SIZE_K": 64,
        "GROUP_SIZE_M": 8,
        "num_stages": 4,
        "num_warps": 4,
        "ms": 0.41907915472984314,
        "min_ms": 0.41907915472984314,
        "max_ms": 0.41907915472984314,
        "compile_time": 2.5801918506622314
    },
    {
        "BLOCK_SIZE_M": 32,
        "BLOCK_SIZE_N": 256,
        "BLOCK_SIZE_K": 16,
        "GROUP_SIZE_M": 8,
        "num_stages": 6,
        "num_warps": 2,
        "ms": 0.41972097754478455,
        "min_ms": 0.41972097754478455,
        "max_ms": 0.41972097754478455,
        "compile_time": 2.276125192642212
    },
    {
        "BLOCK_SIZE_M": 256,
        "BLOCK_SIZE_N": 32,
        "BLOCK_SIZE_K": 64,
        "GROUP_SIZE_M": 8,
        "num_stages": 5,
        "num_warps": 4,
        "ms": 0.42007526755332947,
        "min_ms": 0.42007526755332947,
        "max_ms": 0.42007526755332947,
        "compile_time": 2.7114980220794678
    },
    {
        "BLOCK_SIZE_M": 256,
        "BLOCK_SIZE_N": 64,
        "BLOCK_SIZE_K": 16,
        "GROUP_SIZE_M": 8,
        "num_stages": 4,
        "num_warps": 8,
        "ms": 0.4201606214046478,
        "min_ms": 0.4201606214046478,
        "max_ms": 0.4201606214046478,
        "compile_time": 1.2781791687011719
    },
    {
        "BLOCK_SIZE_M": 256,
        "BLOCK_SIZE_N": 64,
        "BLOCK_SIZE_K": 32,
        "GROUP_SIZE_M": 8,
        "num_stages": 6,
        "num_warps": 16,
        "ms": 0.42019230127334595,
        "min_ms": 0.42019230127334595,
        "max_ms": 0.42019230127334595,
        "compile_time": 1.2669401168823242
    },
    {
        "BLOCK_SIZE_M": 32,
        "BLOCK_SIZE_N": 512,
        "BLOCK_SIZE_K": 16,
        "GROUP_SIZE_M": 8,
        "num_stages": 4,
        "num_warps": 4,
        "ms": 0.4203678071498871,
        "min_ms": 0.4203678071498871,
        "max_ms": 0.4203678071498871,
        "compile_time": 2.188457727432251
    },
    {
        "BLOCK_SIZE_M": 256,
        "BLOCK_SIZE_N": 64,
        "BLOCK_SIZE_K": 16,
        "GROUP_SIZE_M": 8,
        "num_stages": 6,
        "num_warps": 8,
        "ms": 0.4204421937465668,
        "min_ms": 0.4204421937465668,
        "max_ms": 0.4204421937465668,
        "compile_time": 1.2736380100250244
    },
    {
        "BLOCK_SIZE_M": 32,
        "BLOCK_SIZE_N": 512,
        "BLOCK_SIZE_K": 32,
        "GROUP_SIZE_M": 8,
        "num_stages": 5,
        "num_warps": 8,
        "ms": 0.42050838470458984,
        "min_ms": 0.42050838470458984,
        "max_ms": 0.42050838470458984,
        "compile_time": 1.1915926933288574
    },
    {
        "BLOCK_SIZE_M": 256,
        "BLOCK_SIZE_N": 64,
        "BLOCK_SIZE_K": 16,
        "GROUP_SIZE_M": 8,
        "num_stages": 5,
        "num_warps": 8,
        "ms": 0.420543372631073,
        "min_ms": 0.420543372631073,
        "max_ms": 0.420543372631073,
        "compile_time": 1.2840549945831299
    },
    {
        "BLOCK_SIZE_M": 256,
        "BLOCK_SIZE_N": 64,
        "BLOCK_SIZE_K": 32,
        "GROUP_SIZE_M": 8,
        "num_stages": 7,
        "num_warps": 16,
        "ms": 0.4207615852355957,
        "min_ms": 0.4207615852355957,
        "max_ms": 0.4207615852355957,
        "compile_time": 1.9811632633209229
    },
    {
        "BLOCK_SIZE_M": 32,
        "BLOCK_SIZE_N": 256,
        "BLOCK_SIZE_K": 64,
        "GROUP_SIZE_M": 8,
        "num_stages": 5,
        "num_warps": 4,
        "ms": 0.42103713750839233,
        "min_ms": 0.42103713750839233,
        "max_ms": 0.42103713750839233,
        "compile_time": 2.378628730773926
    },
    {
        "BLOCK_SIZE_M": 256,
        "BLOCK_SIZE_N": 32,
        "BLOCK_SIZE_K": 64,
        "GROUP_SIZE_M": 8,
        "num_stages": 3,
        "num_warps": 4,
        "ms": 0.4211985468864441,
        "min_ms": 0.4211985468864441,
        "max_ms": 0.4211985468864441,
        "compile_time": 2.5485193729400635
    },
    {
        "BLOCK_SIZE_M": 256,
        "BLOCK_SIZE_N": 32,
        "BLOCK_SIZE_K": 32,
        "GROUP_SIZE_M": 8,
        "num_stages": 3,
        "num_warps": 4,
        "ms": 0.42122238874435425,
        "min_ms": 0.42122238874435425,
        "max_ms": 0.42122238874435425,
        "compile_time": 1.301053762435913
    },
    {
        "BLOCK_SIZE_M": 128,
        "BLOCK_SIZE_N": 64,
        "BLOCK_SIZE_K": 128,
        "GROUP_SIZE_M": 8,
        "num_stages": 3,
        "num_warps": 16,
        "ms": 0.4221077859401703,
        "min_ms": 0.4221077859401703,
        "max_ms": 0.4221077859401703,
        "compile_time": 1.916717290878296
    },
    {
        "BLOCK_SIZE_M": 256,
        "BLOCK_SIZE_N": 64,
        "BLOCK_SIZE_K": 32,
        "GROUP_SIZE_M": 8,
        "num_stages": 8,
        "num_warps": 16,
        "ms": 0.4223596155643463,
        "min_ms": 0.4223596155643463,
        "max_ms": 0.4223596155643463,
        "compile_time": 1.2771048545837402
    },
    {
        "BLOCK_SIZE_M": 64,
        "BLOCK_SIZE_N": 256,
        "BLOCK_SIZE_K": 32,
        "GROUP_SIZE_M": 8,
        "num_stages": 1,
        "num_warps": 8,
        "ms": 0.4223671555519104,
        "min_ms": 0.4223671555519104,
        "max_ms": 0.4223671555519104,
        "compile_time": 1.216688632965088
    },
    {
        "BLOCK_SIZE_M": 256,
        "BLOCK_SIZE_N": 64,
        "BLOCK_SIZE_K": 16,
        "GROUP_SIZE_M": 8,
        "num_stages": 7,
        "num_warps": 8,
        "ms": 0.42252475023269653,
        "min_ms": 0.42252475023269653,
        "max_ms": 0.42252475023269653,
        "compile_time": 1.2916486263275146
    },
    {
        "BLOCK_SIZE_M": 64,
        "BLOCK_SIZE_N": 128,
        "BLOCK_SIZE_K": 128,
        "GROUP_SIZE_M": 8,
        "num_stages": 3,
        "num_warps": 16,
        "ms": 0.42262306809425354,
        "min_ms": 0.42262306809425354,
        "max_ms": 0.42262306809425354,
        "compile_time": 1.2266461849212646
    },
    {
        "BLOCK_SIZE_M": 256,
        "BLOCK_SIZE_N": 64,
        "BLOCK_SIZE_K": 32,
        "GROUP_SIZE_M": 8,
        "num_stages": 1,
        "num_warps": 8,
        "ms": 0.4228629469871521,
        "min_ms": 0.4228629469871521,
        "max_ms": 0.4228629469871521,
        "compile_time": 1.25529146194458
    },
    {
        "BLOCK_SIZE_M": 512,
        "BLOCK_SIZE_N": 64,
        "BLOCK_SIZE_K": 64,
        "GROUP_SIZE_M": 8,
        "num_stages": 3,
        "num_warps": 16,
        "ms": 0.4229767918586731,
        "min_ms": 0.4229767918586731,
        "max_ms": 0.4229767918586731,
        "compile_time": 2.4137370586395264
    },
    {
        "BLOCK_SIZE_M": 256,
        "BLOCK_SIZE_N": 32,
        "BLOCK_SIZE_K": 32,
        "GROUP_SIZE_M": 8,
        "num_stages": 4,
        "num_warps": 4,
        "ms": 0.4231537878513336,
        "min_ms": 0.4231537878513336,
        "max_ms": 0.4231537878513336,
        "compile_time": 1.3032441139221191
    },
    {
        "BLOCK_SIZE_M": 256,
        "BLOCK_SIZE_N": 64,
        "BLOCK_SIZE_K": 16,
        "GROUP_SIZE_M": 8,
        "num_stages": 8,
        "num_warps": 8,
        "ms": 0.423407644033432,
        "min_ms": 0.423407644033432,
        "max_ms": 0.423407644033432,
        "compile_time": 2.0953195095062256
    },
    {
        "BLOCK_SIZE_M": 128,
        "BLOCK_SIZE_N": 128,
        "BLOCK_SIZE_K": 256,
        "GROUP_SIZE_M": 8,
        "num_stages": 2,
        "num_warps": 8,
        "ms": 0.4236215651035309,
        "min_ms": 0.4236215651035309,
        "max_ms": 0.4236215651035309,
        "compile_time": 2.8318374156951904
    },
    {
        "BLOCK_SIZE_M": 32,
        "BLOCK_SIZE_N": 512,
        "BLOCK_SIZE_K": 32,
        "GROUP_SIZE_M": 8,
        "num_stages": 3,
        "num_warps": 4,
        "ms": 0.42386236786842346,
        "min_ms": 0.42386236786842346,
        "max_ms": 0.42386236786842346,
        "compile_time": 2.5263376235961914
    },
    {
        "BLOCK_SIZE_M": 128,
        "BLOCK_SIZE_N": 256,
        "BLOCK_SIZE_K": 128,
        "GROUP_SIZE_M": 8,
        "num_stages": 1,
        "num_warps": 16,
        "ms": 0.4239572584629059,
        "min_ms": 0.4239572584629059,
        "max_ms": 0.4239572584629059,
        "compile_time": 2.123516321182251
    },
    {
        "BLOCK_SIZE_M": 128,
        "BLOCK_SIZE_N": 64,
        "BLOCK_SIZE_K": 128,
        "GROUP_SIZE_M": 8,
        "num_stages": 4,
        "num_warps": 16,
        "ms": 0.4241107106208801,
        "min_ms": 0.4241107106208801,
        "max_ms": 0.4241107106208801,
        "compile_time": 1.9732017517089844
    },
    {
        "BLOCK_SIZE_M": 256,
        "BLOCK_SIZE_N": 32,
        "BLOCK_SIZE_K": 32,
        "GROUP_SIZE_M": 8,
        "num_stages": 5,
        "num_warps": 4,
        "ms": 0.4249962270259857,
        "min_ms": 0.4249962270259857,
        "max_ms": 0.4249962270259857,
        "compile_time": 1.3506784439086914
    },
    {
        "BLOCK_SIZE_M": 256,
        "BLOCK_SIZE_N": 64,
        "BLOCK_SIZE_K": 16,
        "GROUP_SIZE_M": 8,
        "num_stages": 3,
        "num_warps": 8,
        "ms": 0.4254947602748871,
        "min_ms": 0.4254947602748871,
        "max_ms": 0.4254947602748871,
        "compile_time": 2.007943868637085
    },
    {
        "BLOCK_SIZE_M": 32,
        "BLOCK_SIZE_N": 256,
        "BLOCK_SIZE_K": 32,
        "GROUP_SIZE_M": 8,
        "num_stages": 5,
        "num_warps": 8,
        "ms": 0.42641353607177734,
        "min_ms": 0.42641353607177734,
        "max_ms": 0.42641353607177734,
        "compile_time": 1.7928357124328613
    },
    {
        "BLOCK_SIZE_M": 256,
        "BLOCK_SIZE_N": 64,
        "BLOCK_SIZE_K": 32,
        "GROUP_SIZE_M": 8,
        "num_stages": 5,
        "num_warps": 16,
        "ms": 0.4264988303184509,
        "min_ms": 0.4264988303184509,
        "max_ms": 0.4264988303184509,
        "compile_time": 1.283066749572754
    },
    {
        "BLOCK_SIZE_M": 256,
        "BLOCK_SIZE_N": 64,
        "BLOCK_SIZE_K": 32,
        "GROUP_SIZE_M": 8,
        "num_stages": 3,
        "num_warps": 16,
        "ms": 0.4265781044960022,
        "min_ms": 0.4265781044960022,
        "max_ms": 0.4265781044960022,
        "compile_time": 1.9184329509735107
    },
    {
        "BLOCK_SIZE_M": 512,
        "BLOCK_SIZE_N": 32,
        "BLOCK_SIZE_K": 64,
        "GROUP_SIZE_M": 8,
        "num_stages": 3,
        "num_warps": 8,
        "ms": 0.4268325865268707,
        "min_ms": 0.4268325865268707,
        "max_ms": 0.4268325865268707,
        "compile_time": 2.6657917499542236
    },
    {
        "BLOCK_SIZE_M": 128,
        "BLOCK_SIZE_N": 128,
        "BLOCK_SIZE_K": 32,
        "GROUP_SIZE_M": 8,
        "num_stages": 1,
        "num_warps": 4,
        "ms": 0.42686405777931213,
        "min_ms": 0.42686405777931213,
        "max_ms": 0.42686405777931213,
        "compile_time": 2.232694387435913
    },
    {
        "BLOCK_SIZE_M": 64,
        "BLOCK_SIZE_N": 64,
        "BLOCK_SIZE_K": 128,
        "GROUP_SIZE_M": 8,
        "num_stages": 3,
        "num_warps": 8,
        "ms": 0.4271049499511719,
        "min_ms": 0.4271049499511719,
        "max_ms": 0.4271049499511719,
        "compile_time": 1.2583987712860107
    },
    {
        "BLOCK_SIZE_M": 32,
        "BLOCK_SIZE_N": 512,
        "BLOCK_SIZE_K": 16,
        "GROUP_SIZE_M": 8,
        "num_stages": 5,
        "num_warps": 8,
        "ms": 0.42726001143455505,
        "min_ms": 0.42726001143455505,
        "max_ms": 0.42726001143455505,
        "compile_time": 1.1900570392608643
    },
    {
        "BLOCK_SIZE_M": 32,
        "BLOCK_SIZE_N": 256,
        "BLOCK_SIZE_K": 32,
        "GROUP_SIZE_M": 8,
        "num_stages": 3,
        "num_warps": 4,
        "ms": 0.42771682143211365,
        "min_ms": 0.42771682143211365,
        "max_ms": 0.42771682143211365,
        "compile_time": 1.9268057346343994
    },
    {
        "BLOCK_SIZE_M": 32,
        "BLOCK_SIZE_N": 512,
        "BLOCK_SIZE_K": 16,
        "GROUP_SIZE_M": 8,
        "num_stages": 4,
        "num_warps": 8,
        "ms": 0.4278087615966797,
        "min_ms": 0.4278087615966797,
        "max_ms": 0.4278087615966797,
        "compile_time": 1.8208942413330078
    },
    {
        "BLOCK_SIZE_M": 64,
        "BLOCK_SIZE_N": 128,
        "BLOCK_SIZE_K": 128,
        "GROUP_SIZE_M": 8,
        "num_stages": 4,
        "num_warps": 16,
        "ms": 0.4279305338859558,
        "min_ms": 0.4279305338859558,
        "max_ms": 0.4279305338859558,
        "compile_time": 1.2254767417907715
    },
    {
        "BLOCK_SIZE_M": 256,
        "BLOCK_SIZE_N": 32,
        "BLOCK_SIZE_K": 64,
        "GROUP_SIZE_M": 8,
        "num_stages": 4,
        "num_warps": 8,
        "ms": 0.42796188592910767,
        "min_ms": 0.42796188592910767,
        "max_ms": 0.42796188592910767,
        "compile_time": 2.1543915271759033
    },
    {
        "BLOCK_SIZE_M": 64,
        "BLOCK_SIZE_N": 64,
        "BLOCK_SIZE_K": 16,
        "GROUP_SIZE_M": 8,
        "num_stages": 5,
        "num_warps": 2,
        "ms": 0.4282967448234558,
        "min_ms": 0.4282967448234558,
        "max_ms": 0.4282967448234558,
        "compile_time": 1.8588876724243164
    },
    {
        "BLOCK_SIZE_M": 64,
        "BLOCK_SIZE_N": 64,
        "BLOCK_SIZE_K": 16,
        "GROUP_SIZE_M": 8,
        "num_stages": 4,
        "num_warps": 2,
        "ms": 0.42881888151168823,
        "min_ms": 0.42881888151168823,
        "max_ms": 0.42881888151168823,
        "compile_time": 1.8539340496063232
    },
    {
        "BLOCK_SIZE_M": 32,
        "BLOCK_SIZE_N": 256,
        "BLOCK_SIZE_K": 16,
        "GROUP_SIZE_M": 8,
        "num_stages": 4,
        "num_warps": 4,
        "ms": 0.4290845990180969,
        "min_ms": 0.4290845990180969,
        "max_ms": 0.4290845990180969,
        "compile_time": 1.204442024230957
    },
    {
        "BLOCK_SIZE_M": 32,
        "BLOCK_SIZE_N": 256,
        "BLOCK_SIZE_K": 64,
        "GROUP_SIZE_M": 8,
        "num_stages": 3,
        "num_warps": 4,
        "ms": 0.4292892515659332,
        "min_ms": 0.4292892515659332,
        "max_ms": 0.4292892515659332,
        "compile_time": 2.219308376312256
    },
    {
        "BLOCK_SIZE_M": 128,
        "BLOCK_SIZE_N": 128,
        "BLOCK_SIZE_K": 64,
        "GROUP_SIZE_M": 8,
        "num_stages": 1,
        "num_warps": 4,
        "ms": 0.4293462336063385,
        "min_ms": 0.4293462336063385,
        "max_ms": 0.4293462336063385,
        "compile_time": 2.375314474105835
    },
    {
        "BLOCK_SIZE_M": 64,
        "BLOCK_SIZE_N": 64,
        "BLOCK_SIZE_K": 256,
        "GROUP_SIZE_M": 8,
        "num_stages": 3,
        "num_warps": 4,
        "ms": 0.429417222738266,
        "min_ms": 0.429417222738266,
        "max_ms": 0.429417222738266,
        "compile_time": 2.7017714977264404
    },
    {
        "BLOCK_SIZE_M": 32,
        "BLOCK_SIZE_N": 256,
        "BLOCK_SIZE_K": 64,
        "GROUP_SIZE_M": 8,
        "num_stages": 5,
        "num_warps": 8,
        "ms": 0.4299556314945221,
        "min_ms": 0.4299556314945221,
        "max_ms": 0.4299556314945221,
        "compile_time": 1.1949844360351562
    },
    {
        "BLOCK_SIZE_M": 32,
        "BLOCK_SIZE_N": 512,
        "BLOCK_SIZE_K": 16,
        "GROUP_SIZE_M": 8,
        "num_stages": 3,
        "num_warps": 4,
        "ms": 0.43048015236854553,
        "min_ms": 0.43048015236854553,
        "max_ms": 0.43048015236854553,
        "compile_time": 2.1663143634796143
    },
    {
        "BLOCK_SIZE_M": 32,
        "BLOCK_SIZE_N": 256,
        "BLOCK_SIZE_K": 32,
        "GROUP_SIZE_M": 8,
        "num_stages": 4,
        "num_warps": 4,
        "ms": 0.4306192398071289,
        "min_ms": 0.4306192398071289,
        "max_ms": 0.4306192398071289,
        "compile_time": 1.9536516666412354
    },
    {
        "BLOCK_SIZE_M": 256,
        "BLOCK_SIZE_N": 32,
        "BLOCK_SIZE_K": 32,
        "GROUP_SIZE_M": 8,
        "num_stages": 6,
        "num_warps": 4,
        "ms": 0.4307800233364105,
        "min_ms": 0.4307800233364105,
        "max_ms": 0.4307800233364105,
        "compile_time": 1.3093340396881104
    },
    {
        "BLOCK_SIZE_M": 256,
        "BLOCK_SIZE_N": 32,
        "BLOCK_SIZE_K": 64,
        "GROUP_SIZE_M": 8,
        "num_stages": 5,
        "num_warps": 8,
        "ms": 0.43100109696388245,
        "min_ms": 0.43100109696388245,
        "max_ms": 0.43100109696388245,
        "compile_time": 2.189817190170288
    },
    {
        "BLOCK_SIZE_M": 32,
        "BLOCK_SIZE_N": 256,
        "BLOCK_SIZE_K": 16,
        "GROUP_SIZE_M": 8,
        "num_stages": 5,
        "num_warps": 2,
        "ms": 0.43140512704849243,
        "min_ms": 0.43140512704849243,
        "max_ms": 0.43140512704849243,
        "compile_time": 2.2234723567962646
    },
    {
        "BLOCK_SIZE_M": 64,
        "BLOCK_SIZE_N": 64,
        "BLOCK_SIZE_K": 64,
        "GROUP_SIZE_M": 8,
        "num_stages": 3,
        "num_warps": 8,
        "ms": 0.4314325749874115,
        "min_ms": 0.4314325749874115,
        "max_ms": 0.4314325749874115,
        "compile_time": 1.757314920425415
    },
    {
        "BLOCK_SIZE_M": 64,
        "BLOCK_SIZE_N": 64,
        "BLOCK_SIZE_K": 64,
        "GROUP_SIZE_M": 8,
        "num_stages": 4,
        "num_warps": 8,
        "ms": 0.4316803514957428,
        "min_ms": 0.4316803514957428,
        "max_ms": 0.4316803514957428,
        "compile_time": 1.2626116275787354
    },
    {
        "BLOCK_SIZE_M": 256,
        "BLOCK_SIZE_N": 32,
        "BLOCK_SIZE_K": 32,
        "GROUP_SIZE_M": 8,
        "num_stages": 7,
        "num_warps": 4,
        "ms": 0.4321749806404114,
        "min_ms": 0.4321749806404114,
        "max_ms": 0.4321749806404114,
        "compile_time": 1.2873539924621582
    },
    {
        "BLOCK_SIZE_M": 256,
        "BLOCK_SIZE_N": 128,
        "BLOCK_SIZE_K": 64,
        "GROUP_SIZE_M": 8,
        "num_stages": 1,
        "num_warps": 8,
        "ms": 0.4322294294834137,
        "min_ms": 0.4322294294834137,
        "max_ms": 0.4322294294834137,
        "compile_time": 2.451082706451416
    },
    {
        "BLOCK_SIZE_M": 128,
        "BLOCK_SIZE_N": 128,
        "BLOCK_SIZE_K": 64,
        "GROUP_SIZE_M": 8,
        "num_stages": 2,
        "num_warps": 8,
        "ms": 0.43252748250961304,
        "min_ms": 0.43252748250961304,
        "max_ms": 0.43252748250961304,
        "compile_time": 2.071699619293213
    },
    {
        "BLOCK_SIZE_M": 512,
        "BLOCK_SIZE_N": 32,
        "BLOCK_SIZE_K": 32,
        "GROUP_SIZE_M": 8,
        "num_stages": 3,
        "num_warps": 4,
        "ms": 0.4325764775276184,
        "min_ms": 0.4325764775276184,
        "max_ms": 0.4325764775276184,
        "compile_time": 2.8818721771240234
    },
    {
        "BLOCK_SIZE_M": 32,
        "BLOCK_SIZE_N": 256,
        "BLOCK_SIZE_K": 16,
        "GROUP_SIZE_M": 8,
        "num_stages": 6,
        "num_warps": 4,
        "ms": 0.4329116940498352,
        "min_ms": 0.4329116940498352,
        "max_ms": 0.4329116940498352,
        "compile_time": 1.2284281253814697
    },
    {
        "BLOCK_SIZE_M": 128,
        "BLOCK_SIZE_N": 64,
        "BLOCK_SIZE_K": 64,
        "GROUP_SIZE_M": 8,
        "num_stages": 4,
        "num_warps": 16,
        "ms": 0.43330368399620056,
        "min_ms": 0.43330368399620056,
        "max_ms": 0.43330368399620056,
        "compile_time": 1.2478265762329102
    },
    {
        "BLOCK_SIZE_M": 32,
        "BLOCK_SIZE_N": 256,
        "BLOCK_SIZE_K": 16,
        "GROUP_SIZE_M": 8,
        "num_stages": 4,
        "num_warps": 2,
        "ms": 0.43339109420776367,
        "min_ms": 0.43339109420776367,
        "max_ms": 0.43339109420776367,
        "compile_time": 2.202025890350342
    },
    {
        "BLOCK_SIZE_M": 128,
        "BLOCK_SIZE_N": 64,
        "BLOCK_SIZE_K": 64,
        "GROUP_SIZE_M": 8,
        "num_stages": 3,
        "num_warps": 16,
        "ms": 0.43361324071884155,
        "min_ms": 0.43361324071884155,
        "max_ms": 0.43361324071884155,
        "compile_time": 1.2572669982910156
    },
    {
        "BLOCK_SIZE_M": 32,
        "BLOCK_SIZE_N": 256,
        "BLOCK_SIZE_K": 16,
        "GROUP_SIZE_M": 8,
        "num_stages": 5,
        "num_warps": 4,
        "ms": 0.43369659781455994,
        "min_ms": 0.43369659781455994,
        "max_ms": 0.43369659781455994,
        "compile_time": 1.2161827087402344
    },
    {
        "BLOCK_SIZE_M": 32,
        "BLOCK_SIZE_N": 512,
        "BLOCK_SIZE_K": 32,
        "GROUP_SIZE_M": 8,
        "num_stages": 4,
        "num_warps": 8,
        "ms": 0.4337000250816345,
        "min_ms": 0.4337000250816345,
        "max_ms": 0.4337000250816345,
        "compile_time": 1.199000358581543
    },
    {
        "BLOCK_SIZE_M": 256,
        "BLOCK_SIZE_N": 128,
        "BLOCK_SIZE_K": 64,
        "GROUP_SIZE_M": 8,
        "num_stages": 1,
        "num_warps": 16,
        "ms": 0.43383264541625977,
        "min_ms": 0.43383264541625977,
        "max_ms": 0.43383264541625977,
        "compile_time": 2.019062042236328
    },
    {
        "BLOCK_SIZE_M": 128,
        "BLOCK_SIZE_N": 256,
        "BLOCK_SIZE_K": 16,
        "GROUP_SIZE_M": 8,
        "num_stages": 5,
        "num_warps": 16,
        "ms": 0.43396520614624023,
        "min_ms": 0.43396520614624023,
        "max_ms": 0.43396520614624023,
        "compile_time": 1.232240915298462
    },
    {
        "BLOCK_SIZE_M": 64,
        "BLOCK_SIZE_N": 64,
        "BLOCK_SIZE_K": 64,
        "GROUP_SIZE_M": 8,
        "num_stages": 2,
        "num_warps": 2,
        "ms": 0.43398651480674744,
        "min_ms": 0.43398651480674744,
        "max_ms": 0.43398651480674744,
        "compile_time": 2.096290111541748
    },
    {
        "BLOCK_SIZE_M": 256,
        "BLOCK_SIZE_N": 32,
        "BLOCK_SIZE_K": 32,
        "GROUP_SIZE_M": 8,
        "num_stages": 8,
        "num_warps": 4,
        "ms": 0.43458372354507446,
        "min_ms": 0.43458372354507446,
        "max_ms": 0.43458372354507446,
        "compile_time": 1.29304838180542
    },
    {
        "BLOCK_SIZE_M": 32,
        "BLOCK_SIZE_N": 256,
        "BLOCK_SIZE_K": 32,
        "GROUP_SIZE_M": 8,
        "num_stages": 7,
        "num_warps": 8,
        "ms": 0.4346223771572113,
        "min_ms": 0.4346223771572113,
        "max_ms": 0.4346223771572113,
        "compile_time": 1.2016937732696533
    },
    {
        "BLOCK_SIZE_M": 64,
        "BLOCK_SIZE_N": 64,
        "BLOCK_SIZE_K": 16,
        "GROUP_SIZE_M": 8,
        "num_stages": 8,
        "num_warps": 2,
        "ms": 0.4356355667114258,
        "min_ms": 0.4356355667114258,
        "max_ms": 0.4356355667114258,
        "compile_time": 1.9331433773040771
    },
    {
        "BLOCK_SIZE_M": 32,
        "BLOCK_SIZE_N": 512,
        "BLOCK_SIZE_K": 16,
        "GROUP_SIZE_M": 8,
        "num_stages": 3,
        "num_warps": 8,
        "ms": 0.43565958738327026,
        "min_ms": 0.43565958738327026,
        "max_ms": 0.43565958738327026,
        "compile_time": 1.1952316761016846
    },
    {
        "BLOCK_SIZE_M": 256,
        "BLOCK_SIZE_N": 32,
        "BLOCK_SIZE_K": 64,
        "GROUP_SIZE_M": 8,
        "num_stages": 3,
        "num_warps": 8,
        "ms": 0.4358493387699127,
        "min_ms": 0.4358493387699127,
        "max_ms": 0.4358493387699127,
        "compile_time": 2.1247241497039795
    },
    {
        "BLOCK_SIZE_M": 128,
        "BLOCK_SIZE_N": 256,
        "BLOCK_SIZE_K": 16,
        "GROUP_SIZE_M": 8,
        "num_stages": 3,
        "num_warps": 16,
        "ms": 0.4362955689430237,
        "min_ms": 0.4362955689430237,
        "max_ms": 0.4362955689430237,
        "compile_time": 1.2398483753204346
    },
    {
        "BLOCK_SIZE_M": 32,
        "BLOCK_SIZE_N": 256,
        "BLOCK_SIZE_K": 16,
        "GROUP_SIZE_M": 8,
        "num_stages": 3,
        "num_warps": 2,
        "ms": 0.43648743629455566,
        "min_ms": 0.43648743629455566,
        "max_ms": 0.43648743629455566,
        "compile_time": 2.101707935333252
    },
    {
        "BLOCK_SIZE_M": 32,
        "BLOCK_SIZE_N": 256,
        "BLOCK_SIZE_K": 32,
        "GROUP_SIZE_M": 8,
        "num_stages": 6,
        "num_warps": 8,
        "ms": 0.436488538980484,
        "min_ms": 0.436488538980484,
        "max_ms": 0.436488538980484,
        "compile_time": 1.1952948570251465
    },
    {
        "BLOCK_SIZE_M": 32,
        "BLOCK_SIZE_N": 512,
        "BLOCK_SIZE_K": 32,
        "GROUP_SIZE_M": 8,
        "num_stages": 5,
        "num_warps": 16,
        "ms": 0.4369436204433441,
        "min_ms": 0.4369436204433441,
        "max_ms": 0.4369436204433441,
        "compile_time": 1.7887542247772217
    },
    {
        "BLOCK_SIZE_M": 512,
        "BLOCK_SIZE_N": 32,
        "BLOCK_SIZE_K": 32,
        "GROUP_SIZE_M": 8,
        "num_stages": 4,
        "num_warps": 8,
        "ms": 0.4370778203010559,
        "min_ms": 0.4370778203010559,
        "max_ms": 0.4370778203010559,
        "compile_time": 2.2989368438720703
    },
    {
        "BLOCK_SIZE_M": 128,
        "BLOCK_SIZE_N": 256,
        "BLOCK_SIZE_K": 128,
        "GROUP_SIZE_M": 8,
        "num_stages": 1,
        "num_warps": 8,
        "ms": 0.4372042715549469,
        "min_ms": 0.4372042715549469,
        "max_ms": 0.4372042715549469,
        "compile_time": 2.694204568862915
    },
    {
        "BLOCK_SIZE_M": 32,
        "BLOCK_SIZE_N": 256,
        "BLOCK_SIZE_K": 32,
        "GROUP_SIZE_M": 8,
        "num_stages": 8,
        "num_warps": 8,
        "ms": 0.4374527931213379,
        "min_ms": 0.4374527931213379,
        "max_ms": 0.4374527931213379,
        "compile_time": 1.1942968368530273
    },
    {
        "BLOCK_SIZE_M": 32,
        "BLOCK_SIZE_N": 256,
        "BLOCK_SIZE_K": 64,
        "GROUP_SIZE_M": 8,
        "num_stages": 3,
        "num_warps": 8,
        "ms": 0.437509685754776,
        "min_ms": 0.437509685754776,
        "max_ms": 0.437509685754776,
        "compile_time": 1.1982691287994385
    },
    {
        "BLOCK_SIZE_M": 32,
        "BLOCK_SIZE_N": 256,
        "BLOCK_SIZE_K": 32,
        "GROUP_SIZE_M": 8,
        "num_stages": 4,
        "num_warps": 8,
        "ms": 0.43802696466445923,
        "min_ms": 0.43802696466445923,
        "max_ms": 0.43802696466445923,
        "compile_time": 1.2108371257781982
    },
    {
        "BLOCK_SIZE_M": 64,
        "BLOCK_SIZE_N": 64,
        "BLOCK_SIZE_K": 16,
        "GROUP_SIZE_M": 8,
        "num_stages": 6,
        "num_warps": 2,
        "ms": 0.43819084763526917,
        "min_ms": 0.43819084763526917,
        "max_ms": 0.43819084763526917,
        "compile_time": 1.888334035873413
    },
    {
        "BLOCK_SIZE_M": 32,
        "BLOCK_SIZE_N": 256,
        "BLOCK_SIZE_K": 64,
        "GROUP_SIZE_M": 8,
        "num_stages": 4,
        "num_warps": 8,
        "ms": 0.4383026659488678,
        "min_ms": 0.4383026659488678,
        "max_ms": 0.4383026659488678,
        "compile_time": 1.1633341312408447
    },
    {
        "BLOCK_SIZE_M": 128,
        "BLOCK_SIZE_N": 64,
        "BLOCK_SIZE_K": 32,
        "GROUP_SIZE_M": 8,
        "num_stages": 8,
        "num_warps": 2,
        "ms": 0.4384225010871887,
        "min_ms": 0.4384225010871887,
        "max_ms": 0.4384225010871887,
        "compile_time": 2.654247522354126
    },
    {
        "BLOCK_SIZE_M": 256,
        "BLOCK_SIZE_N": 32,
        "BLOCK_SIZE_K": 128,
        "GROUP_SIZE_M": 8,
        "num_stages": 3,
        "num_warps": 4,
        "ms": 0.43900805711746216,
        "min_ms": 0.43900805711746216,
        "max_ms": 0.43900805711746216,
        "compile_time": 3.4058167934417725
    },
    {
        "BLOCK_SIZE_M": 256,
        "BLOCK_SIZE_N": 128,
        "BLOCK_SIZE_K": 16,
        "GROUP_SIZE_M": 8,
        "num_stages": 5,
        "num_warps": 16,
        "ms": 0.4390736520290375,
        "min_ms": 0.4390736520290375,
        "max_ms": 0.4390736520290375,
        "compile_time": 1.2797701358795166
    },
    {
        "BLOCK_SIZE_M": 64,
        "BLOCK_SIZE_N": 64,
        "BLOCK_SIZE_K": 32,
        "GROUP_SIZE_M": 8,
        "num_stages": 2,
        "num_warps": 4,
        "ms": 0.4394075870513916,
        "min_ms": 0.4394075870513916,
        "max_ms": 0.4394075870513916,
        "compile_time": 1.22641921043396
    },
    {
        "BLOCK_SIZE_M": 64,
        "BLOCK_SIZE_N": 64,
        "BLOCK_SIZE_K": 64,
        "GROUP_SIZE_M": 8,
        "num_stages": 5,
        "num_warps": 8,
        "ms": 0.439521461725235,
        "min_ms": 0.439521461725235,
        "max_ms": 0.439521461725235,
        "compile_time": 1.2475223541259766
    },
    {
        "BLOCK_SIZE_M": 32,
        "BLOCK_SIZE_N": 512,
        "BLOCK_SIZE_K": 32,
        "GROUP_SIZE_M": 8,
        "num_stages": 4,
        "num_warps": 16,
        "ms": 0.43971604108810425,
        "min_ms": 0.43971604108810425,
        "max_ms": 0.43971604108810425,
        "compile_time": 1.7752220630645752
    },
    {
        "BLOCK_SIZE_M": 128,
        "BLOCK_SIZE_N": 64,
        "BLOCK_SIZE_K": 128,
        "GROUP_SIZE_M": 8,
        "num_stages": 1,
        "num_warps": 8,
        "ms": 0.4399349093437195,
        "min_ms": 0.4399349093437195,
        "max_ms": 0.4399349093437195,
        "compile_time": 1.2531836032867432
    },
    {
        "BLOCK_SIZE_M": 64,
        "BLOCK_SIZE_N": 64,
        "BLOCK_SIZE_K": 16,
        "GROUP_SIZE_M": 8,
        "num_stages": 7,
        "num_warps": 2,
        "ms": 0.4401935636997223,
        "min_ms": 0.4401935636997223,
        "max_ms": 0.4401935636997223,
        "compile_time": 1.8976311683654785
    },
    {
        "BLOCK_SIZE_M": 64,
        "BLOCK_SIZE_N": 64,
        "BLOCK_SIZE_K": 16,
        "GROUP_SIZE_M": 8,
        "num_stages": 3,
        "num_warps": 2,
        "ms": 0.44039368629455566,
        "min_ms": 0.44039368629455566,
        "max_ms": 0.44039368629455566,
        "compile_time": 1.8099761009216309
    },
    {
        "BLOCK_SIZE_M": 64,
        "BLOCK_SIZE_N": 512,
        "BLOCK_SIZE_K": 64,
        "GROUP_SIZE_M": 8,
        "num_stages": 2,
        "num_warps": 8,
        "ms": 0.4404452443122864,
        "min_ms": 0.4404452443122864,
        "max_ms": 0.4404452443122864,
        "compile_time": 2.657775402069092
    },
    {
        "BLOCK_SIZE_M": 256,
        "BLOCK_SIZE_N": 128,
        "BLOCK_SIZE_K": 16,
        "GROUP_SIZE_M": 8,
        "num_stages": 3,
        "num_warps": 16,
        "ms": 0.44055238366127014,
        "min_ms": 0.44055238366127014,
        "max_ms": 0.44055238366127014,
        "compile_time": 1.2743029594421387
    },
    {
        "BLOCK_SIZE_M": 128,
        "BLOCK_SIZE_N": 128,
        "BLOCK_SIZE_K": 128,
        "GROUP_SIZE_M": 8,
        "num_stages": 3,
        "num_warps": 32,
        "ms": 0.4406401216983795,
        "min_ms": 0.4406401216983795,
        "max_ms": 0.4406401216983795,
        "compile_time": 1.9181880950927734
    },
    {
        "BLOCK_SIZE_M": 32,
        "BLOCK_SIZE_N": 256,
        "BLOCK_SIZE_K": 64,
        "GROUP_SIZE_M": 8,
        "num_stages": 4,
        "num_warps": 4,
        "ms": 0.44101300835609436,
        "min_ms": 0.44101300835609436,
        "max_ms": 0.44101300835609436,
        "compile_time": 2.305248498916626
    },
    {
        "BLOCK_SIZE_M": 64,
        "BLOCK_SIZE_N": 128,
        "BLOCK_SIZE_K": 64,
        "GROUP_SIZE_M": 8,
        "num_stages": 4,
        "num_warps": 16,
        "ms": 0.4418349266052246,
        "min_ms": 0.4418349266052246,
        "max_ms": 0.4418349266052246,
        "compile_time": 1.2217533588409424
    },
    {
        "BLOCK_SIZE_M": 64,
        "BLOCK_SIZE_N": 128,
        "BLOCK_SIZE_K": 64,
        "GROUP_SIZE_M": 8,
        "num_stages": 3,
        "num_warps": 16,
        "ms": 0.44192495942115784,
        "min_ms": 0.44192495942115784,
        "max_ms": 0.44192495942115784,
        "compile_time": 1.2181479930877686
    },
    {
        "BLOCK_SIZE_M": 512,
        "BLOCK_SIZE_N": 32,
        "BLOCK_SIZE_K": 32,
        "GROUP_SIZE_M": 8,
        "num_stages": 5,
        "num_warps": 8,
        "ms": 0.44221171736717224,
        "min_ms": 0.44221171736717224,
        "max_ms": 0.44221171736717224,
        "compile_time": 2.3888607025146484
    },
    {
        "BLOCK_SIZE_M": 32,
        "BLOCK_SIZE_N": 512,
        "BLOCK_SIZE_K": 64,
        "GROUP_SIZE_M": 8,
        "num_stages": 3,
        "num_warps": 8,
        "ms": 0.4429386258125305,
        "min_ms": 0.4429386258125305,
        "max_ms": 0.4429386258125305,
        "compile_time": 2.2508490085601807
    },
    {
        "BLOCK_SIZE_M": 512,
        "BLOCK_SIZE_N": 32,
        "BLOCK_SIZE_K": 64,
        "GROUP_SIZE_M": 8,
        "num_stages": 3,
        "num_warps": 16,
        "ms": 0.4430809020996094,
        "min_ms": 0.4430809020996094,
        "max_ms": 0.4430809020996094,
        "compile_time": 2.236908435821533
    },
    {
        "BLOCK_SIZE_M": 64,
        "BLOCK_SIZE_N": 256,
        "BLOCK_SIZE_K": 16,
        "GROUP_SIZE_M": 8,
        "num_stages": 3,
        "num_warps": 16,
        "ms": 0.4434276521205902,
        "min_ms": 0.4434276521205902,
        "max_ms": 0.4434276521205902,
        "compile_time": 1.2243108749389648
    },
    {
        "BLOCK_SIZE_M": 64,
        "BLOCK_SIZE_N": 64,
        "BLOCK_SIZE_K": 64,
        "GROUP_SIZE_M": 8,
        "num_stages": 6,
        "num_warps": 8,
        "ms": 0.443727970123291,
        "min_ms": 0.443727970123291,
        "max_ms": 0.443727970123291,
        "compile_time": 1.8062083721160889
    },
    {
        "BLOCK_SIZE_M": 256,
        "BLOCK_SIZE_N": 32,
        "BLOCK_SIZE_K": 32,
        "GROUP_SIZE_M": 8,
        "num_stages": 3,
        "num_warps": 2,
        "ms": 0.44375139474868774,
        "min_ms": 0.44375139474868774,
        "max_ms": 0.44375139474868774,
        "compile_time": 1.285181999206543
    },
    {
        "BLOCK_SIZE_M": 256,
        "BLOCK_SIZE_N": 32,
        "BLOCK_SIZE_K": 128,
        "GROUP_SIZE_M": 8,
        "num_stages": 3,
        "num_warps": 8,
        "ms": 0.4438794255256653,
        "min_ms": 0.4438794255256653,
        "max_ms": 0.4438794255256653,
        "compile_time": 2.4841487407684326
    },
    {
        "BLOCK_SIZE_M": 64,
        "BLOCK_SIZE_N": 128,
        "BLOCK_SIZE_K": 64,
        "GROUP_SIZE_M": 8,
        "num_stages": 5,
        "num_warps": 16,
        "ms": 0.4446079730987549,
        "min_ms": 0.4446079730987549,
        "max_ms": 0.4446079730987549,
        "compile_time": 1.2584261894226074
    },
    {
        "BLOCK_SIZE_M": 32,
        "BLOCK_SIZE_N": 256,
        "BLOCK_SIZE_K": 16,
        "GROUP_SIZE_M": 8,
        "num_stages": 3,
        "num_warps": 4,
        "ms": 0.4452495574951172,
        "min_ms": 0.4452495574951172,
        "max_ms": 0.4452495574951172,
        "compile_time": 1.2077569961547852
    },
    {
        "BLOCK_SIZE_M": 32,
        "BLOCK_SIZE_N": 256,
        "BLOCK_SIZE_K": 16,
        "GROUP_SIZE_M": 8,
        "num_stages": 7,
        "num_warps": 4,
        "ms": 0.4459953308105469,
        "min_ms": 0.4459953308105469,
        "max_ms": 0.4459953308105469,
        "compile_time": 1.8755922317504883
    },
    {
        "BLOCK_SIZE_M": 64,
        "BLOCK_SIZE_N": 128,
        "BLOCK_SIZE_K": 64,
        "GROUP_SIZE_M": 8,
        "num_stages": 7,
        "num_warps": 16,
        "ms": 0.44628605246543884,
        "min_ms": 0.44628605246543884,
        "max_ms": 0.44628605246543884,
        "compile_time": 1.219538927078247
    },
    {
        "BLOCK_SIZE_M": 64,
        "BLOCK_SIZE_N": 128,
        "BLOCK_SIZE_K": 64,
        "GROUP_SIZE_M": 8,
        "num_stages": 6,
        "num_warps": 16,
        "ms": 0.44648486375808716,
        "min_ms": 0.44648486375808716,
        "max_ms": 0.44648486375808716,
        "compile_time": 1.193147897720337
    },
    {
        "BLOCK_SIZE_M": 128,
        "BLOCK_SIZE_N": 256,
        "BLOCK_SIZE_K": 16,
        "GROUP_SIZE_M": 8,
        "num_stages": 4,
        "num_warps": 16,
        "ms": 0.4466796815395355,
        "min_ms": 0.4466796815395355,
        "max_ms": 0.4466796815395355,
        "compile_time": 1.2525782585144043
    },
    {
        "BLOCK_SIZE_M": 32,
        "BLOCK_SIZE_N": 256,
        "BLOCK_SIZE_K": 128,
        "GROUP_SIZE_M": 8,
        "num_stages": 3,
        "num_warps": 4,
        "ms": 0.4469452500343323,
        "min_ms": 0.4469452500343323,
        "max_ms": 0.4469452500343323,
        "compile_time": 3.268186330795288
    },
    {
        "BLOCK_SIZE_M": 32,
        "BLOCK_SIZE_N": 256,
        "BLOCK_SIZE_K": 16,
        "GROUP_SIZE_M": 8,
        "num_stages": 5,
        "num_warps": 8,
        "ms": 0.4470474123954773,
        "min_ms": 0.4470474123954773,
        "max_ms": 0.4470474123954773,
        "compile_time": 1.7128798961639404
    },
    {
        "BLOCK_SIZE_M": 128,
        "BLOCK_SIZE_N": 32,
        "BLOCK_SIZE_K": 32,
        "GROUP_SIZE_M": 8,
        "num_stages": 4,
        "num_warps": 2,
        "ms": 0.44712957739830017,
        "min_ms": 0.44712957739830017,
        "max_ms": 0.44712957739830017,
        "compile_time": 2.1028575897216797
    },
    {
        "BLOCK_SIZE_M": 128,
        "BLOCK_SIZE_N": 32,
        "BLOCK_SIZE_K": 64,
        "GROUP_SIZE_M": 8,
        "num_stages": 3,
        "num_warps": 4,
        "ms": 0.447152704000473,
        "min_ms": 0.447152704000473,
        "max_ms": 0.447152704000473,
        "compile_time": 1.9985764026641846
    },
    {
        "BLOCK_SIZE_M": 32,
        "BLOCK_SIZE_N": 256,
        "BLOCK_SIZE_K": 16,
        "GROUP_SIZE_M": 8,
        "num_stages": 4,
        "num_warps": 8,
        "ms": 0.44716519117355347,
        "min_ms": 0.44716519117355347,
        "max_ms": 0.44716519117355347,
        "compile_time": 1.6996896266937256
    },
    {
        "BLOCK_SIZE_M": 64,
        "BLOCK_SIZE_N": 128,
        "BLOCK_SIZE_K": 64,
        "GROUP_SIZE_M": 8,
        "num_stages": 1,
        "num_warps": 4,
        "ms": 0.4471712112426758,
        "min_ms": 0.4471712112426758,
        "max_ms": 0.4471712112426758,
        "compile_time": 1.2152314186096191
    },
    {
        "BLOCK_SIZE_M": 32,
        "BLOCK_SIZE_N": 128,
        "BLOCK_SIZE_K": 32,
        "GROUP_SIZE_M": 8,
        "num_stages": 5,
        "num_warps": 4,
        "ms": 0.4472671151161194,
        "min_ms": 0.4472671151161194,
        "max_ms": 0.4472671151161194,
        "compile_time": 1.205538034439087
    },
    {
        "BLOCK_SIZE_M": 64,
        "BLOCK_SIZE_N": 64,
        "BLOCK_SIZE_K": 16,
        "GROUP_SIZE_M": 8,
        "num_stages": 7,
        "num_warps": 4,
        "ms": 0.447427362203598,
        "min_ms": 0.447427362203598,
        "max_ms": 0.447427362203598,
        "compile_time": 1.2602462768554688
    },
    {
        "BLOCK_SIZE_M": 32,
        "BLOCK_SIZE_N": 128,
        "BLOCK_SIZE_K": 32,
        "GROUP_SIZE_M": 8,
        "num_stages": 4,
        "num_warps": 2,
        "ms": 0.44755274057388306,
        "min_ms": 0.44755274057388306,
        "max_ms": 0.44755274057388306,
        "compile_time": 1.9593894481658936
    },
    {
        "BLOCK_SIZE_M": 128,
        "BLOCK_SIZE_N": 32,
        "BLOCK_SIZE_K": 32,
        "GROUP_SIZE_M": 8,
        "num_stages": 6,
        "num_warps": 2,
        "ms": 0.4478357434272766,
        "min_ms": 0.4478357434272766,
        "max_ms": 0.4478357434272766,
        "compile_time": 2.1727139949798584
    },
    {
        "BLOCK_SIZE_M": 32,
        "BLOCK_SIZE_N": 128,
        "BLOCK_SIZE_K": 32,
        "GROUP_SIZE_M": 8,
        "num_stages": 6,
        "num_warps": 2,
        "ms": 0.44804635643959045,
        "min_ms": 0.44804635643959045,
        "max_ms": 0.44804635643959045,
        "compile_time": 2.044469118118286
    },
    {
        "BLOCK_SIZE_M": 256,
        "BLOCK_SIZE_N": 128,
        "BLOCK_SIZE_K": 16,
        "GROUP_SIZE_M": 8,
        "num_stages": 4,
        "num_warps": 16,
        "ms": 0.448397696018219,
        "min_ms": 0.448397696018219,
        "max_ms": 0.448397696018219,
        "compile_time": 1.2845377922058105
    },
    {
        "BLOCK_SIZE_M": 256,
        "BLOCK_SIZE_N": 64,
        "BLOCK_SIZE_K": 32,
        "GROUP_SIZE_M": 8,
        "num_stages": 1,
        "num_warps": 4,
        "ms": 0.4484615921974182,
        "min_ms": 0.4484615921974182,
        "max_ms": 0.4484615921974182,
        "compile_time": 2.42118501663208
    },
    {
        "BLOCK_SIZE_M": 64,
        "BLOCK_SIZE_N": 256,
        "BLOCK_SIZE_K": 16,
        "GROUP_SIZE_M": 8,
        "num_stages": 4,
        "num_warps": 16,
        "ms": 0.44857892394065857,
        "min_ms": 0.44857892394065857,
        "max_ms": 0.44857892394065857,
        "compile_time": 1.2528338432312012
    },
    {
        "BLOCK_SIZE_M": 512,
        "BLOCK_SIZE_N": 32,
        "BLOCK_SIZE_K": 32,
        "GROUP_SIZE_M": 8,
        "num_stages": 3,
        "num_warps": 8,
        "ms": 0.44860634207725525,
        "min_ms": 0.44860634207725525,
        "max_ms": 0.44860634207725525,
        "compile_time": 2.2768218517303467
    },
    {
        "BLOCK_SIZE_M": 256,
        "BLOCK_SIZE_N": 64,
        "BLOCK_SIZE_K": 128,
        "GROUP_SIZE_M": 8,
        "num_stages": 2,
        "num_warps": 8,
        "ms": 0.44868263602256775,
        "min_ms": 0.44868263602256775,
        "max_ms": 0.44868263602256775,
        "compile_time": 2.482853412628174
    },
    {
        "BLOCK_SIZE_M": 256,
        "BLOCK_SIZE_N": 128,
        "BLOCK_SIZE_K": 16,
        "GROUP_SIZE_M": 8,
        "num_stages": 6,
        "num_warps": 16,
        "ms": 0.4488041400909424,
        "min_ms": 0.4488041400909424,
        "max_ms": 0.4488041400909424,
        "compile_time": 1.2742326259613037
    },
    {
        "BLOCK_SIZE_M": 128,
        "BLOCK_SIZE_N": 128,
        "BLOCK_SIZE_K": 256,
        "GROUP_SIZE_M": 8,
        "num_stages": 2,
        "num_warps": 16,
        "ms": 0.4489307403564453,
        "min_ms": 0.4489307403564453,
        "max_ms": 0.4489307403564453,
        "compile_time": 1.2541413307189941
    },
    {
        "BLOCK_SIZE_M": 32,
        "BLOCK_SIZE_N": 128,
        "BLOCK_SIZE_K": 64,
        "GROUP_SIZE_M": 8,
        "num_stages": 3,
        "num_warps": 4,
        "ms": 0.4490883946418762,
        "min_ms": 0.4490883946418762,
        "max_ms": 0.4490883946418762,
        "compile_time": 1.189497947692871
    },
    {
        "BLOCK_SIZE_M": 32,
        "BLOCK_SIZE_N": 256,
        "BLOCK_SIZE_K": 16,
        "GROUP_SIZE_M": 8,
        "num_stages": 8,
        "num_warps": 4,
        "ms": 0.4492083191871643,
        "min_ms": 0.4492083191871643,
        "max_ms": 0.4492083191871643,
        "compile_time": 1.2164576053619385
    },
    {
        "BLOCK_SIZE_M": 64,
        "BLOCK_SIZE_N": 64,
        "BLOCK_SIZE_K": 16,
        "GROUP_SIZE_M": 8,
        "num_stages": 8,
        "num_warps": 4,
        "ms": 0.4494898319244385,
        "min_ms": 0.4494898319244385,
        "max_ms": 0.4494898319244385,
        "compile_time": 1.2411906719207764
    },
    {
        "BLOCK_SIZE_M": 256,
        "BLOCK_SIZE_N": 128,
        "BLOCK_SIZE_K": 16,
        "GROUP_SIZE_M": 8,
        "num_stages": 7,
        "num_warps": 16,
        "ms": 0.44950103759765625,
        "min_ms": 0.44950103759765625,
        "max_ms": 0.44950103759765625,
        "compile_time": 2.031320333480835
    },
    {
        "BLOCK_SIZE_M": 32,
        "BLOCK_SIZE_N": 256,
        "BLOCK_SIZE_K": 32,
        "GROUP_SIZE_M": 8,
        "num_stages": 3,
        "num_warps": 8,
        "ms": 0.44956621527671814,
        "min_ms": 0.44956621527671814,
        "max_ms": 0.44956621527671814,
        "compile_time": 1.1970207691192627
    },
    {
        "BLOCK_SIZE_M": 128,
        "BLOCK_SIZE_N": 32,
        "BLOCK_SIZE_K": 64,
        "GROUP_SIZE_M": 8,
        "num_stages": 4,
        "num_warps": 2,
        "ms": 0.44963303208351135,
        "min_ms": 0.44963303208351135,
        "max_ms": 0.44963303208351135,
        "compile_time": 2.4500045776367188
    },
    {
        "BLOCK_SIZE_M": 32,
        "BLOCK_SIZE_N": 256,
        "BLOCK_SIZE_K": 16,
        "GROUP_SIZE_M": 8,
        "num_stages": 6,
        "num_warps": 8,
        "ms": 0.44980305433273315,
        "min_ms": 0.44980305433273315,
        "max_ms": 0.44980305433273315,
        "compile_time": 1.7349164485931396
    },
    {
        "BLOCK_SIZE_M": 256,
        "BLOCK_SIZE_N": 32,
        "BLOCK_SIZE_K": 32,
        "GROUP_SIZE_M": 8,
        "num_stages": 4,
        "num_warps": 8,
        "ms": 0.4498654007911682,
        "min_ms": 0.4498654007911682,
        "max_ms": 0.4498654007911682,
        "compile_time": 1.3294949531555176
    },
    {
        "BLOCK_SIZE_M": 256,
        "BLOCK_SIZE_N": 32,
        "BLOCK_SIZE_K": 32,
        "GROUP_SIZE_M": 8,
        "num_stages": 5,
        "num_warps": 8,
        "ms": 0.4503256678581238,
        "min_ms": 0.4503256678581238,
        "max_ms": 0.4503256678581238,
        "compile_time": 1.3211500644683838
    },
    {
        "BLOCK_SIZE_M": 256,
        "BLOCK_SIZE_N": 128,
        "BLOCK_SIZE_K": 16,
        "GROUP_SIZE_M": 8,
        "num_stages": 8,
        "num_warps": 16,
        "ms": 0.45036226511001587,
        "min_ms": 0.45036226511001587,
        "max_ms": 0.45036226511001587,
        "compile_time": 2.0402157306671143
    },
    {
        "BLOCK_SIZE_M": 32,
        "BLOCK_SIZE_N": 128,
        "BLOCK_SIZE_K": 32,
        "GROUP_SIZE_M": 8,
        "num_stages": 4,
        "num_warps": 4,
        "ms": 0.45045900344848633,
        "min_ms": 0.45045900344848633,
        "max_ms": 0.45045900344848633,
        "compile_time": 1.2162363529205322
    },
    {
        "BLOCK_SIZE_M": 512,
        "BLOCK_SIZE_N": 64,
        "BLOCK_SIZE_K": 16,
        "GROUP_SIZE_M": 8,
        "num_stages": 4,
        "num_warps": 8,
        "ms": 0.450460821390152,
        "min_ms": 0.450460821390152,
        "max_ms": 0.450460821390152,
        "compile_time": 1.2853362560272217
    },
    {
        "BLOCK_SIZE_M": 64,
        "BLOCK_SIZE_N": 256,
        "BLOCK_SIZE_K": 16,
        "GROUP_SIZE_M": 8,
        "num_stages": 5,
        "num_warps": 16,
        "ms": 0.45057183504104614,
        "min_ms": 0.45057183504104614,
        "max_ms": 0.45057183504104614,
        "compile_time": 1.2427198886871338
    },
    {
        "BLOCK_SIZE_M": 128,
        "BLOCK_SIZE_N": 32,
        "BLOCK_SIZE_K": 64,
        "GROUP_SIZE_M": 8,
        "num_stages": 3,
        "num_warps": 2,
        "ms": 0.45072346925735474,
        "min_ms": 0.45072346925735474,
        "max_ms": 0.45072346925735474,
        "compile_time": 2.373375177383423
    },
    {
        "BLOCK_SIZE_M": 64,
        "BLOCK_SIZE_N": 256,
        "BLOCK_SIZE_K": 64,
        "GROUP_SIZE_M": 8,
        "num_stages": 2,
        "num_warps": 8,
        "ms": 0.4508497714996338,
        "min_ms": 0.4508497714996338,
        "max_ms": 0.4508497714996338,
        "compile_time": 1.214979887008667
    },
    {
        "BLOCK_SIZE_M": 32,
        "BLOCK_SIZE_N": 128,
        "BLOCK_SIZE_K": 32,
        "GROUP_SIZE_M": 8,
        "num_stages": 6,
        "num_warps": 4,
        "ms": 0.4508795142173767,
        "min_ms": 0.4508795142173767,
        "max_ms": 0.4508795142173767,
        "compile_time": 1.7982890605926514
    },
    {
        "BLOCK_SIZE_M": 32,
        "BLOCK_SIZE_N": 512,
        "BLOCK_SIZE_K": 32,
        "GROUP_SIZE_M": 8,
        "num_stages": 3,
        "num_warps": 8,
        "ms": 0.4509564936161041,
        "min_ms": 0.4509564936161041,
        "max_ms": 0.4509564936161041,
        "compile_time": 1.1842882633209229
    },
    {
        "BLOCK_SIZE_M": 32,
        "BLOCK_SIZE_N": 256,
        "BLOCK_SIZE_K": 32,
        "GROUP_SIZE_M": 8,
        "num_stages": 3,
        "num_warps": 2,
        "ms": 0.4516046643257141,
        "min_ms": 0.4516046643257141,
        "max_ms": 0.4516046643257141,
        "compile_time": 2.511665105819702
    },
    {
        "BLOCK_SIZE_M": 32,
        "BLOCK_SIZE_N": 512,
        "BLOCK_SIZE_K": 16,
        "GROUP_SIZE_M": 8,
        "num_stages": 6,
        "num_warps": 4,
        "ms": 0.45170044898986816,
        "min_ms": 0.45170044898986816,
        "max_ms": 0.45170044898986816,
        "compile_time": 2.2848267555236816
    },
    {
        "BLOCK_SIZE_M": 64,
        "BLOCK_SIZE_N": 64,
        "BLOCK_SIZE_K": 16,
        "GROUP_SIZE_M": 8,
        "num_stages": 4,
        "num_warps": 4,
        "ms": 0.4517735540866852,
        "min_ms": 0.4517735540866852,
        "max_ms": 0.4517735540866852,
        "compile_time": 1.2849557399749756
    },
    {
        "BLOCK_SIZE_M": 32,
        "BLOCK_SIZE_N": 256,
        "BLOCK_SIZE_K": 16,
        "GROUP_SIZE_M": 8,
        "num_stages": 7,
        "num_warps": 2,
        "ms": 0.4518198072910309,
        "min_ms": 0.4518198072910309,
        "max_ms": 0.4518198072910309,
        "compile_time": 2.2841105461120605
    },
    {
        "BLOCK_SIZE_M": 64,
        "BLOCK_SIZE_N": 256,
        "BLOCK_SIZE_K": 16,
        "GROUP_SIZE_M": 8,
        "num_stages": 7,
        "num_warps": 16,
        "ms": 0.45183753967285156,
        "min_ms": 0.45183753967285156,
        "max_ms": 0.45183753967285156,
        "compile_time": 1.7725107669830322
    },
    {
        "BLOCK_SIZE_M": 64,
        "BLOCK_SIZE_N": 256,
        "BLOCK_SIZE_K": 16,
        "GROUP_SIZE_M": 8,
        "num_stages": 6,
        "num_warps": 16,
        "ms": 0.45185279846191406,
        "min_ms": 0.45185279846191406,
        "max_ms": 0.45185279846191406,
        "compile_time": 1.251417875289917
    },
    {
        "BLOCK_SIZE_M": 128,
        "BLOCK_SIZE_N": 64,
        "BLOCK_SIZE_K": 32,
        "GROUP_SIZE_M": 8,
        "num_stages": 1,
        "num_warps": 4,
        "ms": 0.45192259550094604,
        "min_ms": 0.45192259550094604,
        "max_ms": 0.45192259550094604,
        "compile_time": 1.2240121364593506
    },
    {
        "BLOCK_SIZE_M": 512,
        "BLOCK_SIZE_N": 64,
        "BLOCK_SIZE_K": 16,
        "GROUP_SIZE_M": 8,
        "num_stages": 5,
        "num_warps": 8,
        "ms": 0.4519229829311371,
        "min_ms": 0.4519229829311371,
        "max_ms": 0.4519229829311371,
        "compile_time": 1.3000590801239014
    },
    {
        "BLOCK_SIZE_M": 128,
        "BLOCK_SIZE_N": 256,
        "BLOCK_SIZE_K": 64,
        "GROUP_SIZE_M": 8,
        "num_stages": 1,
        "num_warps": 16,
        "ms": 0.45211029052734375,
        "min_ms": 0.45211029052734375,
        "max_ms": 0.45211029052734375,
        "compile_time": 1.2339529991149902
    },
    {
        "BLOCK_SIZE_M": 32,
        "BLOCK_SIZE_N": 512,
        "BLOCK_SIZE_K": 16,
        "GROUP_SIZE_M": 8,
        "num_stages": 7,
        "num_warps": 4,
        "ms": 0.45233625173568726,
        "min_ms": 0.45233625173568726,
        "max_ms": 0.45233625173568726,
        "compile_time": 2.318004846572876
    },
    {
        "BLOCK_SIZE_M": 256,
        "BLOCK_SIZE_N": 32,
        "BLOCK_SIZE_K": 32,
        "GROUP_SIZE_M": 8,
        "num_stages": 3,
        "num_warps": 8,
        "ms": 0.4525570273399353,
        "min_ms": 0.4525570273399353,
        "max_ms": 0.4525570273399353,
        "compile_time": 1.3061962127685547
    },
    {
        "BLOCK_SIZE_M": 64,
        "BLOCK_SIZE_N": 64,
        "BLOCK_SIZE_K": 16,
        "GROUP_SIZE_M": 8,
        "num_stages": 6,
        "num_warps": 4,
        "ms": 0.45263490080833435,
        "min_ms": 0.45263490080833435,
        "max_ms": 0.45263490080833435,
        "compile_time": 1.2497203350067139
    },
    {
        "BLOCK_SIZE_M": 64,
        "BLOCK_SIZE_N": 256,
        "BLOCK_SIZE_K": 128,
        "GROUP_SIZE_M": 8,
        "num_stages": 2,
        "num_warps": 8,
        "ms": 0.45288974046707153,
        "min_ms": 0.45288974046707153,
        "max_ms": 0.45288974046707153,
        "compile_time": 1.4750103950500488
    },
    {
        "BLOCK_SIZE_M": 64,
        "BLOCK_SIZE_N": 256,
        "BLOCK_SIZE_K": 16,
        "GROUP_SIZE_M": 8,
        "num_stages": 8,
        "num_warps": 16,
        "ms": 0.4529072344303131,
        "min_ms": 0.4529072344303131,
        "max_ms": 0.4529072344303131,
        "compile_time": 1.2374253273010254
    },
    {
        "BLOCK_SIZE_M": 64,
        "BLOCK_SIZE_N": 128,
        "BLOCK_SIZE_K": 16,
        "GROUP_SIZE_M": 8,
        "num_stages": 4,
        "num_warps": 8,
        "ms": 0.4530549943447113,
        "min_ms": 0.4530549943447113,
        "max_ms": 0.4530549943447113,
        "compile_time": 1.238572120666504
    },
    {
        "BLOCK_SIZE_M": 128,
        "BLOCK_SIZE_N": 32,
        "BLOCK_SIZE_K": 64,
        "GROUP_SIZE_M": 8,
        "num_stages": 5,
        "num_warps": 2,
        "ms": 0.4531314969062805,
        "min_ms": 0.4531314969062805,
        "max_ms": 0.4531314969062805,
        "compile_time": 2.4913971424102783
    },
    {
        "BLOCK_SIZE_M": 128,
        "BLOCK_SIZE_N": 32,
        "BLOCK_SIZE_K": 32,
        "GROUP_SIZE_M": 8,
        "num_stages": 4,
        "num_warps": 4,
        "ms": 0.4533633589744568,
        "min_ms": 0.4533633589744568,
        "max_ms": 0.4533633589744568,
        "compile_time": 1.2823266983032227
    },
    {
        "BLOCK_SIZE_M": 64,
        "BLOCK_SIZE_N": 128,
        "BLOCK_SIZE_K": 16,
        "GROUP_SIZE_M": 8,
        "num_stages": 5,
        "num_warps": 8,
        "ms": 0.45348358154296875,
        "min_ms": 0.45348358154296875,
        "max_ms": 0.45348358154296875,
        "compile_time": 1.2303612232208252
    },
    {
        "BLOCK_SIZE_M": 128,
        "BLOCK_SIZE_N": 64,
        "BLOCK_SIZE_K": 16,
        "GROUP_SIZE_M": 8,
        "num_stages": 4,
        "num_warps": 8,
        "ms": 0.4535430371761322,
        "min_ms": 0.4535430371761322,
        "max_ms": 0.4535430371761322,
        "compile_time": 1.7217004299163818
    },
    {
        "BLOCK_SIZE_M": 32,
        "BLOCK_SIZE_N": 256,
        "BLOCK_SIZE_K": 128,
        "GROUP_SIZE_M": 8,
        "num_stages": 3,
        "num_warps": 8,
        "ms": 0.45371270179748535,
        "min_ms": 0.45371270179748535,
        "max_ms": 0.45371270179748535,
        "compile_time": 2.2107949256896973
    },
    {
        "BLOCK_SIZE_M": 64,
        "BLOCK_SIZE_N": 512,
        "BLOCK_SIZE_K": 64,
        "GROUP_SIZE_M": 8,
        "num_stages": 3,
        "num_warps": 16,
        "ms": 0.4538736939430237,
        "min_ms": 0.4538736939430237,
        "max_ms": 0.4538736939430237,
        "compile_time": 1.3025097846984863
    },
    {
        "BLOCK_SIZE_M": 64,
        "BLOCK_SIZE_N": 128,
        "BLOCK_SIZE_K": 16,
        "GROUP_SIZE_M": 8,
        "num_stages": 7,
        "num_warps": 8,
        "ms": 0.4539279341697693,
        "min_ms": 0.4539279341697693,
        "max_ms": 0.4539279341697693,
        "compile_time": 1.2821857929229736
    },
    {
        "BLOCK_SIZE_M": 32,
        "BLOCK_SIZE_N": 256,
        "BLOCK_SIZE_K": 32,
        "GROUP_SIZE_M": 8,
        "num_stages": 2,
        "num_warps": 4,
        "ms": 0.45402947068214417,
        "min_ms": 0.45402947068214417,
        "max_ms": 0.45402947068214417,
        "compile_time": 1.852731704711914
    },
    {
        "BLOCK_SIZE_M": 32,
        "BLOCK_SIZE_N": 512,
        "BLOCK_SIZE_K": 16,
        "GROUP_SIZE_M": 8,
        "num_stages": 8,
        "num_warps": 4,
        "ms": 0.4540998339653015,
        "min_ms": 0.4540998339653015,
        "max_ms": 0.4540998339653015,
        "compile_time": 2.360997438430786
    },
    {
        "BLOCK_SIZE_M": 64,
        "BLOCK_SIZE_N": 64,
        "BLOCK_SIZE_K": 16,
        "GROUP_SIZE_M": 8,
        "num_stages": 5,
        "num_warps": 4,
        "ms": 0.45431527495384216,
        "min_ms": 0.45431527495384216,
        "max_ms": 0.45431527495384216,
        "compile_time": 1.2668263912200928
    },
    {
        "BLOCK_SIZE_M": 128,
        "BLOCK_SIZE_N": 32,
        "BLOCK_SIZE_K": 64,
        "GROUP_SIZE_M": 8,
        "num_stages": 5,
        "num_warps": 4,
        "ms": 0.4545477330684662,
        "min_ms": 0.4545477330684662,
        "max_ms": 0.4545477330684662,
        "compile_time": 2.0650229454040527
    },
    {
        "BLOCK_SIZE_M": 512,
        "BLOCK_SIZE_N": 64,
        "BLOCK_SIZE_K": 16,
        "GROUP_SIZE_M": 8,
        "num_stages": 6,
        "num_warps": 8,
        "ms": 0.4546191692352295,
        "min_ms": 0.4546191692352295,
        "max_ms": 0.4546191692352295,
        "compile_time": 2.4745678901672363
    },
    {
        "BLOCK_SIZE_M": 32,
        "BLOCK_SIZE_N": 128,
        "BLOCK_SIZE_K": 32,
        "GROUP_SIZE_M": 8,
        "num_stages": 3,
        "num_warps": 2,
        "ms": 0.454634428024292,
        "min_ms": 0.454634428024292,
        "max_ms": 0.454634428024292,
        "compile_time": 1.9114460945129395
    },
    {
        "BLOCK_SIZE_M": 512,
        "BLOCK_SIZE_N": 64,
        "BLOCK_SIZE_K": 16,
        "GROUP_SIZE_M": 8,
        "num_stages": 3,
        "num_warps": 8,
        "ms": 0.4546457827091217,
        "min_ms": 0.4546457827091217,
        "max_ms": 0.4546457827091217,
        "compile_time": 1.295764446258545
    },
    {
        "BLOCK_SIZE_M": 128,
        "BLOCK_SIZE_N": 32,
        "BLOCK_SIZE_K": 64,
        "GROUP_SIZE_M": 8,
        "num_stages": 4,
        "num_warps": 4,
        "ms": 0.454734742641449,
        "min_ms": 0.454734742641449,
        "max_ms": 0.454734742641449,
        "compile_time": 2.027498722076416
    },
    {
        "BLOCK_SIZE_M": 512,
        "BLOCK_SIZE_N": 64,
        "BLOCK_SIZE_K": 16,
        "GROUP_SIZE_M": 8,
        "num_stages": 8,
        "num_warps": 8,
        "ms": 0.45525312423706055,
        "min_ms": 0.45525312423706055,
        "max_ms": 0.45525312423706055,
        "compile_time": 2.547039747238159
    },
    {
        "BLOCK_SIZE_M": 64,
        "BLOCK_SIZE_N": 64,
        "BLOCK_SIZE_K": 16,
        "GROUP_SIZE_M": 8,
        "num_stages": 3,
        "num_warps": 4,
        "ms": 0.4552535116672516,
        "min_ms": 0.4552535116672516,
        "max_ms": 0.4552535116672516,
        "compile_time": 1.2273321151733398
    },
    {
        "BLOCK_SIZE_M": 32,
        "BLOCK_SIZE_N": 128,
        "BLOCK_SIZE_K": 32,
        "GROUP_SIZE_M": 8,
        "num_stages": 5,
        "num_warps": 2,
        "ms": 0.455278217792511,
        "min_ms": 0.455278217792511,
        "max_ms": 0.455278217792511,
        "compile_time": 2.0127055644989014
    },
    {
        "BLOCK_SIZE_M": 64,
        "BLOCK_SIZE_N": 128,
        "BLOCK_SIZE_K": 16,
        "GROUP_SIZE_M": 8,
        "num_stages": 6,
        "num_warps": 8,
        "ms": 0.45531195402145386,
        "min_ms": 0.45531195402145386,
        "max_ms": 0.45531195402145386,
        "compile_time": 1.279421329498291
    },
    {
        "BLOCK_SIZE_M": 128,
        "BLOCK_SIZE_N": 32,
        "BLOCK_SIZE_K": 32,
        "GROUP_SIZE_M": 8,
        "num_stages": 5,
        "num_warps": 4,
        "ms": 0.45534640550613403,
        "min_ms": 0.45534640550613403,
        "max_ms": 0.45534640550613403,
        "compile_time": 1.9066152572631836
    },
    {
        "BLOCK_SIZE_M": 512,
        "BLOCK_SIZE_N": 64,
        "BLOCK_SIZE_K": 16,
        "GROUP_SIZE_M": 8,
        "num_stages": 7,
        "num_warps": 8,
        "ms": 0.4554293751716614,
        "min_ms": 0.4554293751716614,
        "max_ms": 0.4554293751716614,
        "compile_time": 2.5488429069519043
    },
    {
        "BLOCK_SIZE_M": 128,
        "BLOCK_SIZE_N": 32,
        "BLOCK_SIZE_K": 32,
        "GROUP_SIZE_M": 8,
        "num_stages": 3,
        "num_warps": 2,
        "ms": 0.45544761419296265,
        "min_ms": 0.45544761419296265,
        "max_ms": 0.45544761419296265,
        "compile_time": 2.086320400238037
    },
    {
        "BLOCK_SIZE_M": 32,
        "BLOCK_SIZE_N": 512,
        "BLOCK_SIZE_K": 64,
        "GROUP_SIZE_M": 8,
        "num_stages": 3,
        "num_warps": 16,
        "ms": 0.4555015563964844,
        "min_ms": 0.4555015563964844,
        "max_ms": 0.4555015563964844,
        "compile_time": 1.1943645477294922
    },
    {
        "BLOCK_SIZE_M": 128,
        "BLOCK_SIZE_N": 32,
        "BLOCK_SIZE_K": 32,
        "GROUP_SIZE_M": 8,
        "num_stages": 3,
        "num_warps": 4,
        "ms": 0.45587238669395447,
        "min_ms": 0.45587238669395447,
        "max_ms": 0.45587238669395447,
        "compile_time": 1.8923556804656982
    },
    {
        "BLOCK_SIZE_M": 32,
        "BLOCK_SIZE_N": 512,
        "BLOCK_SIZE_K": 32,
        "GROUP_SIZE_M": 8,
        "num_stages": 3,
        "num_warps": 16,
        "ms": 0.45609158277511597,
        "min_ms": 0.45609158277511597,
        "max_ms": 0.45609158277511597,
        "compile_time": 1.1991565227508545
    },
    {
        "BLOCK_SIZE_M": 128,
        "BLOCK_SIZE_N": 64,
        "BLOCK_SIZE_K": 64,
        "GROUP_SIZE_M": 8,
        "num_stages": 5,
        "num_warps": 16,
        "ms": 0.45622244477272034,
        "min_ms": 0.45622244477272034,
        "max_ms": 0.45622244477272034,
        "compile_time": 1.2363381385803223
    },
    {
        "BLOCK_SIZE_M": 64,
        "BLOCK_SIZE_N": 128,
        "BLOCK_SIZE_K": 16,
        "GROUP_SIZE_M": 8,
        "num_stages": 8,
        "num_warps": 8,
        "ms": 0.456270307302475,
        "min_ms": 0.456270307302475,
        "max_ms": 0.456270307302475,
        "compile_time": 1.2377300262451172
    },
    {
        "BLOCK_SIZE_M": 32,
        "BLOCK_SIZE_N": 128,
        "BLOCK_SIZE_K": 16,
        "GROUP_SIZE_M": 8,
        "num_stages": 5,
        "num_warps": 2,
        "ms": 0.45643481612205505,
        "min_ms": 0.45643481612205505,
        "max_ms": 0.45643481612205505,
        "compile_time": 1.8290891647338867
    },
    {
        "BLOCK_SIZE_M": 128,
        "BLOCK_SIZE_N": 256,
        "BLOCK_SIZE_K": 16,
        "GROUP_SIZE_M": 8,
        "num_stages": 6,
        "num_warps": 16,
        "ms": 0.45693737268447876,
        "min_ms": 0.45693737268447876,
        "max_ms": 0.45693737268447876,
        "compile_time": 1.2470099925994873
    },
    {
        "BLOCK_SIZE_M": 64,
        "BLOCK_SIZE_N": 128,
        "BLOCK_SIZE_K": 64,
        "GROUP_SIZE_M": 8,
        "num_stages": 1,
        "num_warps": 2,
        "ms": 0.45730099081993103,
        "min_ms": 0.45730099081993103,
        "max_ms": 0.45730099081993103,
        "compile_time": 2.4289636611938477
    },
    {
        "BLOCK_SIZE_M": 32,
        "BLOCK_SIZE_N": 256,
        "BLOCK_SIZE_K": 16,
        "GROUP_SIZE_M": 8,
        "num_stages": 8,
        "num_warps": 2,
        "ms": 0.4578273892402649,
        "min_ms": 0.4578273892402649,
        "max_ms": 0.4578273892402649,
        "compile_time": 2.326162099838257
    },
    {
        "BLOCK_SIZE_M": 128,
        "BLOCK_SIZE_N": 256,
        "BLOCK_SIZE_K": 16,
        "GROUP_SIZE_M": 8,
        "num_stages": 7,
        "num_warps": 16,
        "ms": 0.457843154668808,
        "min_ms": 0.457843154668808,
        "max_ms": 0.457843154668808,
        "compile_time": 1.2486679553985596
    },
    {
        "BLOCK_SIZE_M": 128,
        "BLOCK_SIZE_N": 256,
        "BLOCK_SIZE_K": 16,
        "GROUP_SIZE_M": 8,
        "num_stages": 8,
        "num_warps": 16,
        "ms": 0.4582420289516449,
        "min_ms": 0.4582420289516449,
        "max_ms": 0.4582420289516449,
        "compile_time": 1.917649745941162
    },
    {
        "BLOCK_SIZE_M": 256,
        "BLOCK_SIZE_N": 64,
        "BLOCK_SIZE_K": 64,
        "GROUP_SIZE_M": 8,
        "num_stages": 2,
        "num_warps": 8,
        "ms": 0.45832425355911255,
        "min_ms": 0.45832425355911255,
        "max_ms": 0.45832425355911255,
        "compile_time": 2.2807955741882324
    },
    {
        "BLOCK_SIZE_M": 32,
        "BLOCK_SIZE_N": 128,
        "BLOCK_SIZE_K": 16,
        "GROUP_SIZE_M": 8,
        "num_stages": 4,
        "num_warps": 2,
        "ms": 0.45855507254600525,
        "min_ms": 0.45855507254600525,
        "max_ms": 0.45855507254600525,
        "compile_time": 1.7897520065307617
    },
    {
        "BLOCK_SIZE_M": 64,
        "BLOCK_SIZE_N": 128,
        "BLOCK_SIZE_K": 16,
        "GROUP_SIZE_M": 8,
        "num_stages": 3,
        "num_warps": 8,
        "ms": 0.45856016874313354,
        "min_ms": 0.45856016874313354,
        "max_ms": 0.45856016874313354,
        "compile_time": 1.253706932067871
    },
    {
        "BLOCK_SIZE_M": 128,
        "BLOCK_SIZE_N": 64,
        "BLOCK_SIZE_K": 16,
        "GROUP_SIZE_M": 8,
        "num_stages": 6,
        "num_warps": 8,
        "ms": 0.4586712419986725,
        "min_ms": 0.4586712419986725,
        "max_ms": 0.4586712419986725,
        "compile_time": 1.7865893840789795
    },
    {
        "BLOCK_SIZE_M": 512,
        "BLOCK_SIZE_N": 64,
        "BLOCK_SIZE_K": 16,
        "GROUP_SIZE_M": 8,
        "num_stages": 3,
        "num_warps": 16,
        "ms": 0.4587540626525879,
        "min_ms": 0.4587540626525879,
        "max_ms": 0.4587540626525879,
        "compile_time": 1.3169288635253906
    },
    {
        "BLOCK_SIZE_M": 128,
        "BLOCK_SIZE_N": 64,
        "BLOCK_SIZE_K": 16,
        "GROUP_SIZE_M": 8,
        "num_stages": 5,
        "num_warps": 8,
        "ms": 0.45881009101867676,
        "min_ms": 0.45881009101867676,
        "max_ms": 0.45881009101867676,
        "compile_time": 1.7773175239562988
    },
    {
        "BLOCK_SIZE_M": 512,
        "BLOCK_SIZE_N": 64,
        "BLOCK_SIZE_K": 16,
        "GROUP_SIZE_M": 8,
        "num_stages": 4,
        "num_warps": 16,
        "ms": 0.4589230418205261,
        "min_ms": 0.4589230418205261,
        "max_ms": 0.4589230418205261,
        "compile_time": 1.3024733066558838
    },
    {
        "BLOCK_SIZE_M": 128,
        "BLOCK_SIZE_N": 64,
        "BLOCK_SIZE_K": 16,
        "GROUP_SIZE_M": 8,
        "num_stages": 7,
        "num_warps": 8,
        "ms": 0.45897945761680603,
        "min_ms": 0.45897945761680603,
        "max_ms": 0.45897945761680603,
        "compile_time": 1.265587568283081
    },
    {
        "BLOCK_SIZE_M": 128,
        "BLOCK_SIZE_N": 64,
        "BLOCK_SIZE_K": 64,
        "GROUP_SIZE_M": 8,
        "num_stages": 6,
        "num_warps": 16,
        "ms": 0.4590018391609192,
        "min_ms": 0.4590018391609192,
        "max_ms": 0.4590018391609192,
        "compile_time": 1.2308127880096436
    },
    {
        "BLOCK_SIZE_M": 32,
        "BLOCK_SIZE_N": 128,
        "BLOCK_SIZE_K": 64,
        "GROUP_SIZE_M": 8,
        "num_stages": 3,
        "num_warps": 2,
        "ms": 0.4595039486885071,
        "min_ms": 0.4595039486885071,
        "max_ms": 0.4595039486885071,
        "compile_time": 2.225048303604126
    },
    {
        "BLOCK_SIZE_M": 128,
        "BLOCK_SIZE_N": 32,
        "BLOCK_SIZE_K": 64,
        "GROUP_SIZE_M": 8,
        "num_stages": 6,
        "num_warps": 4,
        "ms": 0.4598769247531891,
        "min_ms": 0.4598769247531891,
        "max_ms": 0.4598769247531891,
        "compile_time": 2.1170778274536133
    },
    {
        "BLOCK_SIZE_M": 512,
        "BLOCK_SIZE_N": 64,
        "BLOCK_SIZE_K": 16,
        "GROUP_SIZE_M": 8,
        "num_stages": 5,
        "num_warps": 16,
        "ms": 0.4599777162075043,
        "min_ms": 0.4599777162075043,
        "max_ms": 0.4599777162075043,
        "compile_time": 1.3023927211761475
    },
    {
        "BLOCK_SIZE_M": 32,
        "BLOCK_SIZE_N": 128,
        "BLOCK_SIZE_K": 16,
        "GROUP_SIZE_M": 8,
        "num_stages": 6,
        "num_warps": 2,
        "ms": 0.46004167199134827,
        "min_ms": 0.46004167199134827,
        "max_ms": 0.46004167199134827,
        "compile_time": 1.8332874774932861
    },
    {
        "BLOCK_SIZE_M": 32,
        "BLOCK_SIZE_N": 128,
        "BLOCK_SIZE_K": 64,
        "GROUP_SIZE_M": 8,
        "num_stages": 5,
        "num_warps": 2,
        "ms": 0.4601028561592102,
        "min_ms": 0.4601028561592102,
        "max_ms": 0.4601028561592102,
        "compile_time": 2.3912570476531982
    },
    {
        "BLOCK_SIZE_M": 32,
        "BLOCK_SIZE_N": 128,
        "BLOCK_SIZE_K": 64,
        "GROUP_SIZE_M": 8,
        "num_stages": 5,
        "num_warps": 4,
        "ms": 0.46011003851890564,
        "min_ms": 0.46011003851890564,
        "max_ms": 0.46011003851890564,
        "compile_time": 1.2033886909484863
    },
    {
        "BLOCK_SIZE_M": 32,
        "BLOCK_SIZE_N": 128,
        "BLOCK_SIZE_K": 64,
        "GROUP_SIZE_M": 8,
        "num_stages": 4,
        "num_warps": 4,
        "ms": 0.4606391489505768,
        "min_ms": 0.4606391489505768,
        "max_ms": 0.4606391489505768,
        "compile_time": 1.9009029865264893
    },
    {
        "BLOCK_SIZE_M": 128,
        "BLOCK_SIZE_N": 32,
        "BLOCK_SIZE_K": 128,
        "GROUP_SIZE_M": 8,
        "num_stages": 3,
        "num_warps": 4,
        "ms": 0.46073275804519653,
        "min_ms": 0.46073275804519653,
        "max_ms": 0.46073275804519653,
        "compile_time": 2.3424856662750244
    },
    {
        "BLOCK_SIZE_M": 128,
        "BLOCK_SIZE_N": 64,
        "BLOCK_SIZE_K": 16,
        "GROUP_SIZE_M": 8,
        "num_stages": 8,
        "num_warps": 8,
        "ms": 0.46090537309646606,
        "min_ms": 0.46090537309646606,
        "max_ms": 0.46090537309646606,
        "compile_time": 1.266526460647583
    },
    {
        "BLOCK_SIZE_M": 32,
        "BLOCK_SIZE_N": 128,
        "BLOCK_SIZE_K": 32,
        "GROUP_SIZE_M": 8,
        "num_stages": 7,
        "num_warps": 4,
        "ms": 0.46104174852371216,
        "min_ms": 0.46104174852371216,
        "max_ms": 0.46104174852371216,
        "compile_time": 1.1966581344604492
    },
    {
        "BLOCK_SIZE_M": 128,
        "BLOCK_SIZE_N": 32,
        "BLOCK_SIZE_K": 32,
        "GROUP_SIZE_M": 8,
        "num_stages": 6,
        "num_warps": 4,
        "ms": 0.4613288342952728,
        "min_ms": 0.4613288342952728,
        "max_ms": 0.4613288342952728,
        "compile_time": 1.2860040664672852
    },
    {
        "BLOCK_SIZE_M": 128,
        "BLOCK_SIZE_N": 64,
        "BLOCK_SIZE_K": 64,
        "GROUP_SIZE_M": 8,
        "num_stages": 7,
        "num_warps": 16,
        "ms": 0.46134576201438904,
        "min_ms": 0.46134576201438904,
        "max_ms": 0.46134576201438904,
        "compile_time": 1.8142335414886475
    },
    {
        "BLOCK_SIZE_M": 512,
        "BLOCK_SIZE_N": 64,
        "BLOCK_SIZE_K": 16,
        "GROUP_SIZE_M": 8,
        "num_stages": 6,
        "num_warps": 16,
        "ms": 0.4615260064601898,
        "min_ms": 0.4615260064601898,
        "max_ms": 0.4615260064601898,
        "compile_time": 2.162505865097046
    },
    {
        "BLOCK_SIZE_M": 32,
        "BLOCK_SIZE_N": 128,
        "BLOCK_SIZE_K": 32,
        "GROUP_SIZE_M": 8,
        "num_stages": 7,
        "num_warps": 2,
        "ms": 0.4618719220161438,
        "min_ms": 0.4618719220161438,
        "max_ms": 0.4618719220161438,
        "compile_time": 2.0683822631835938
    },
    {
        "BLOCK_SIZE_M": 32,
        "BLOCK_SIZE_N": 128,
        "BLOCK_SIZE_K": 32,
        "GROUP_SIZE_M": 8,
        "num_stages": 8,
        "num_warps": 2,
        "ms": 0.46194300055503845,
        "min_ms": 0.46194300055503845,
        "max_ms": 0.46194300055503845,
        "compile_time": 2.1452887058258057
    },
    {
        "BLOCK_SIZE_M": 256,
        "BLOCK_SIZE_N": 32,
        "BLOCK_SIZE_K": 128,
        "GROUP_SIZE_M": 8,
        "num_stages": 2,
        "num_warps": 4,
        "ms": 0.4622167646884918,
        "min_ms": 0.4622167646884918,
        "max_ms": 0.4622167646884918,
        "compile_time": 2.759838581085205
    },
    {
        "BLOCK_SIZE_M": 256,
        "BLOCK_SIZE_N": 32,
        "BLOCK_SIZE_K": 32,
        "GROUP_SIZE_M": 8,
        "num_stages": 2,
        "num_warps": 2,
        "ms": 0.4624353349208832,
        "min_ms": 0.4624353349208832,
        "max_ms": 0.4624353349208832,
        "compile_time": 1.2781710624694824
    },
    {
        "BLOCK_SIZE_M": 32,
        "BLOCK_SIZE_N": 128,
        "BLOCK_SIZE_K": 64,
        "GROUP_SIZE_M": 8,
        "num_stages": 4,
        "num_warps": 2,
        "ms": 0.4624832272529602,
        "min_ms": 0.4624832272529602,
        "max_ms": 0.4624832272529602,
        "compile_time": 2.290079355239868
    },
    {
        "BLOCK_SIZE_M": 128,
        "BLOCK_SIZE_N": 32,
        "BLOCK_SIZE_K": 32,
        "GROUP_SIZE_M": 8,
        "num_stages": 5,
        "num_warps": 2,
        "ms": 0.46248388290405273,
        "min_ms": 0.46248388290405273,
        "max_ms": 0.46248388290405273,
        "compile_time": 2.1383466720581055
    },
    {
        "BLOCK_SIZE_M": 32,
        "BLOCK_SIZE_N": 256,
        "BLOCK_SIZE_K": 128,
        "GROUP_SIZE_M": 8,
        "num_stages": 2,
        "num_warps": 4,
        "ms": 0.4625263214111328,
        "min_ms": 0.4625263214111328,
        "max_ms": 0.4625263214111328,
        "compile_time": 2.731574058532715
    },
    {
        "BLOCK_SIZE_M": 128,
        "BLOCK_SIZE_N": 128,
        "BLOCK_SIZE_K": 64,
        "GROUP_SIZE_M": 8,
        "num_stages": 3,
        "num_warps": 32,
        "ms": 0.46268147230148315,
        "min_ms": 0.46268147230148315,
        "max_ms": 0.46268147230148315,
        "compile_time": 1.7976069450378418
    },
    {
        "BLOCK_SIZE_M": 128,
        "BLOCK_SIZE_N": 64,
        "BLOCK_SIZE_K": 128,
        "GROUP_SIZE_M": 8,
        "num_stages": 1,
        "num_warps": 4,
        "ms": 0.46342286467552185,
        "min_ms": 0.46342286467552185,
        "max_ms": 0.46342286467552185,
        "compile_time": 2.2565321922302246
    },
    {
        "BLOCK_SIZE_M": 32,
        "BLOCK_SIZE_N": 256,
        "BLOCK_SIZE_K": 16,
        "GROUP_SIZE_M": 8,
        "num_stages": 3,
        "num_warps": 8,
        "ms": 0.46372270584106445,
        "min_ms": 0.46372270584106445,
        "max_ms": 0.46372270584106445,
        "compile_time": 1.1960179805755615
    },
    {
        "BLOCK_SIZE_M": 512,
        "BLOCK_SIZE_N": 64,
        "BLOCK_SIZE_K": 32,
        "GROUP_SIZE_M": 8,
        "num_stages": 2,
        "num_warps": 8,
        "ms": 0.46386265754699707,
        "min_ms": 0.46386265754699707,
        "max_ms": 0.46386265754699707,
        "compile_time": 2.6498618125915527
    },
    {
        "BLOCK_SIZE_M": 128,
        "BLOCK_SIZE_N": 32,
        "BLOCK_SIZE_K": 64,
        "GROUP_SIZE_M": 8,
        "num_stages": 7,
        "num_warps": 4,
        "ms": 0.4639635980129242,
        "min_ms": 0.4639635980129242,
        "max_ms": 0.4639635980129242,
        "compile_time": 2.1494064331054688
    },
    {
        "BLOCK_SIZE_M": 256,
        "BLOCK_SIZE_N": 64,
        "BLOCK_SIZE_K": 128,
        "GROUP_SIZE_M": 8,
        "num_stages": 2,
        "num_warps": 16,
        "ms": 0.463996946811676,
        "min_ms": 0.463996946811676,
        "max_ms": 0.463996946811676,
        "compile_time": 1.2837228775024414
    },
    {
        "BLOCK_SIZE_M": 256,
        "BLOCK_SIZE_N": 32,
        "BLOCK_SIZE_K": 32,
        "GROUP_SIZE_M": 8,
        "num_stages": 2,
        "num_warps": 4,
        "ms": 0.46419453620910645,
        "min_ms": 0.46419453620910645,
        "max_ms": 0.46419453620910645,
        "compile_time": 1.2736241817474365
    },
    {
        "BLOCK_SIZE_M": 128,
        "BLOCK_SIZE_N": 128,
        "BLOCK_SIZE_K": 256,
        "GROUP_SIZE_M": 8,
        "num_stages": 1,
        "num_warps": 8,
        "ms": 0.46438607573509216,
        "min_ms": 0.46438607573509216,
        "max_ms": 0.46438607573509216,
        "compile_time": 2.6597821712493896
    },
    {
        "BLOCK_SIZE_M": 32,
        "BLOCK_SIZE_N": 128,
        "BLOCK_SIZE_K": 32,
        "GROUP_SIZE_M": 8,
        "num_stages": 8,
        "num_warps": 4,
        "ms": 0.4644327163696289,
        "min_ms": 0.4644327163696289,
        "max_ms": 0.4644327163696289,
        "compile_time": 1.198307752609253
    },
    {
        "BLOCK_SIZE_M": 128,
        "BLOCK_SIZE_N": 128,
        "BLOCK_SIZE_K": 64,
        "GROUP_SIZE_M": 8,
        "num_stages": 4,
        "num_warps": 32,
        "ms": 0.4645623564720154,
        "min_ms": 0.4645623564720154,
        "max_ms": 0.4645623564720154,
        "compile_time": 1.7790923118591309
    },
    {
        "BLOCK_SIZE_M": 512,
        "BLOCK_SIZE_N": 64,
        "BLOCK_SIZE_K": 16,
        "GROUP_SIZE_M": 8,
        "num_stages": 7,
        "num_warps": 16,
        "ms": 0.4646632671356201,
        "min_ms": 0.4646632671356201,
        "max_ms": 0.4646632671356201,
        "compile_time": 2.176370859146118
    },
    {
        "BLOCK_SIZE_M": 32,
        "BLOCK_SIZE_N": 128,
        "BLOCK_SIZE_K": 16,
        "GROUP_SIZE_M": 8,
        "num_stages": 7,
        "num_warps": 2,
        "ms": 0.4647678732872009,
        "min_ms": 0.4647678732872009,
        "max_ms": 0.4647678732872009,
        "compile_time": 1.8365895748138428
    },
    {
        "BLOCK_SIZE_M": 128,
        "BLOCK_SIZE_N": 64,
        "BLOCK_SIZE_K": 64,
        "GROUP_SIZE_M": 8,
        "num_stages": 2,
        "num_warps": 16,
        "ms": 0.4654466509819031,
        "min_ms": 0.4654466509819031,
        "max_ms": 0.4654466509819031,
        "compile_time": 1.727159023284912
    },
    {
        "BLOCK_SIZE_M": 32,
        "BLOCK_SIZE_N": 128,
        "BLOCK_SIZE_K": 32,
        "GROUP_SIZE_M": 8,
        "num_stages": 3,
        "num_warps": 4,
        "ms": 0.46569007635116577,
        "min_ms": 0.46569007635116577,
        "max_ms": 0.46569007635116577,
        "compile_time": 1.1903655529022217
    },
    {
        "BLOCK_SIZE_M": 512,
        "BLOCK_SIZE_N": 64,
        "BLOCK_SIZE_K": 16,
        "GROUP_SIZE_M": 8,
        "num_stages": 8,
        "num_warps": 16,
        "ms": 0.4660457670688629,
        "min_ms": 0.4660457670688629,
        "max_ms": 0.4660457670688629,
        "compile_time": 2.183349847793579
    },
    {
        "BLOCK_SIZE_M": 64,
        "BLOCK_SIZE_N": 128,
        "BLOCK_SIZE_K": 128,
        "GROUP_SIZE_M": 8,
        "num_stages": 1,
        "num_warps": 8,
        "ms": 0.46614640951156616,
        "min_ms": 0.46614640951156616,
        "max_ms": 0.46614640951156616,
        "compile_time": 1.2304496765136719
    },
    {
        "BLOCK_SIZE_M": 64,
        "BLOCK_SIZE_N": 64,
        "BLOCK_SIZE_K": 128,
        "GROUP_SIZE_M": 8,
        "num_stages": 5,
        "num_warps": 8,
        "ms": 0.4661896824836731,
        "min_ms": 0.4661896824836731,
        "max_ms": 0.4661896824836731,
        "compile_time": 1.2326946258544922
    },
    {
        "BLOCK_SIZE_M": 64,
        "BLOCK_SIZE_N": 64,
        "BLOCK_SIZE_K": 128,
        "GROUP_SIZE_M": 8,
        "num_stages": 4,
        "num_warps": 8,
        "ms": 0.46622419357299805,
        "min_ms": 0.46622419357299805,
        "max_ms": 0.46622419357299805,
        "compile_time": 1.2430815696716309
    },
    {
        "BLOCK_SIZE_M": 128,
        "BLOCK_SIZE_N": 128,
        "BLOCK_SIZE_K": 64,
        "GROUP_SIZE_M": 8,
        "num_stages": 5,
        "num_warps": 32,
        "ms": 0.46653851866722107,
        "min_ms": 0.46653851866722107,
        "max_ms": 0.46653851866722107,
        "compile_time": 1.8438029289245605
    },
    {
        "BLOCK_SIZE_M": 128,
        "BLOCK_SIZE_N": 32,
        "BLOCK_SIZE_K": 32,
        "GROUP_SIZE_M": 8,
        "num_stages": 7,
        "num_warps": 2,
        "ms": 0.4665444791316986,
        "min_ms": 0.4665444791316986,
        "max_ms": 0.4665444791316986,
        "compile_time": 2.1817994117736816
    },
    {
        "BLOCK_SIZE_M": 256,
        "BLOCK_SIZE_N": 64,
        "BLOCK_SIZE_K": 128,
        "GROUP_SIZE_M": 8,
        "num_stages": 3,
        "num_warps": 32,
        "ms": 0.4674507975578308,
        "min_ms": 0.4674507975578308,
        "max_ms": 0.4674507975578308,
        "compile_time": 2.0202267169952393
    },
    {
        "BLOCK_SIZE_M": 32,
        "BLOCK_SIZE_N": 512,
        "BLOCK_SIZE_K": 32,
        "GROUP_SIZE_M": 8,
        "num_stages": 4,
        "num_warps": 4,
        "ms": 0.46763119101524353,
        "min_ms": 0.46763119101524353,
        "max_ms": 0.46763119101524353,
        "compile_time": 2.6241607666015625
    },
    {
        "BLOCK_SIZE_M": 32,
        "BLOCK_SIZE_N": 256,
        "BLOCK_SIZE_K": 16,
        "GROUP_SIZE_M": 8,
        "num_stages": 8,
        "num_warps": 8,
        "ms": 0.46801966428756714,
        "min_ms": 0.46801966428756714,
        "max_ms": 0.46801966428756714,
        "compile_time": 1.7305469512939453
    },
    {
        "BLOCK_SIZE_M": 64,
        "BLOCK_SIZE_N": 64,
        "BLOCK_SIZE_K": 128,
        "GROUP_SIZE_M": 8,
        "num_stages": 2,
        "num_warps": 8,
        "ms": 0.46815839409828186,
        "min_ms": 0.46815839409828186,
        "max_ms": 0.46815839409828186,
        "compile_time": 1.2230234146118164
    },
    {
        "BLOCK_SIZE_M": 32,
        "BLOCK_SIZE_N": 256,
        "BLOCK_SIZE_K": 16,
        "GROUP_SIZE_M": 8,
        "num_stages": 7,
        "num_warps": 8,
        "ms": 0.468165785074234,
        "min_ms": 0.468165785074234,
        "max_ms": 0.468165785074234,
        "compile_time": 1.2261688709259033
    },
    {
        "BLOCK_SIZE_M": 128,
        "BLOCK_SIZE_N": 32,
        "BLOCK_SIZE_K": 32,
        "GROUP_SIZE_M": 8,
        "num_stages": 8,
        "num_warps": 2,
        "ms": 0.4683755934238434,
        "min_ms": 0.4683755934238434,
        "max_ms": 0.4683755934238434,
        "compile_time": 2.226641893386841
    },
    {
        "BLOCK_SIZE_M": 32,
        "BLOCK_SIZE_N": 128,
        "BLOCK_SIZE_K": 16,
        "GROUP_SIZE_M": 8,
        "num_stages": 3,
        "num_warps": 2,
        "ms": 0.4688313901424408,
        "min_ms": 0.4688313901424408,
        "max_ms": 0.4688313901424408,
        "compile_time": 1.7701873779296875
    },
    {
        "BLOCK_SIZE_M": 128,
        "BLOCK_SIZE_N": 32,
        "BLOCK_SIZE_K": 64,
        "GROUP_SIZE_M": 8,
        "num_stages": 8,
        "num_warps": 4,
        "ms": 0.4692420959472656,
        "min_ms": 0.4692420959472656,
        "max_ms": 0.4692420959472656,
        "compile_time": 2.213632822036743
    },
    {
        "BLOCK_SIZE_M": 128,
        "BLOCK_SIZE_N": 32,
        "BLOCK_SIZE_K": 32,
        "GROUP_SIZE_M": 8,
        "num_stages": 2,
        "num_warps": 2,
        "ms": 0.4692772924900055,
        "min_ms": 0.4692772924900055,
        "max_ms": 0.4692772924900055,
        "compile_time": 2.0248491764068604
    },
    {
        "BLOCK_SIZE_M": 32,
        "BLOCK_SIZE_N": 512,
        "BLOCK_SIZE_K": 32,
        "GROUP_SIZE_M": 8,
        "num_stages": 5,
        "num_warps": 4,
        "ms": 0.47017985582351685,
        "min_ms": 0.47017985582351685,
        "max_ms": 0.47017985582351685,
        "compile_time": 2.673602342605591
    },
    {
        "BLOCK_SIZE_M": 128,
        "BLOCK_SIZE_N": 64,
        "BLOCK_SIZE_K": 16,
        "GROUP_SIZE_M": 8,
        "num_stages": 3,
        "num_warps": 8,
        "ms": 0.4701952040195465,
        "min_ms": 0.4701952040195465,
        "max_ms": 0.4701952040195465,
        "compile_time": 1.716676950454712
    },
    {
        "BLOCK_SIZE_M": 128,
        "BLOCK_SIZE_N": 128,
        "BLOCK_SIZE_K": 64,
        "GROUP_SIZE_M": 8,
        "num_stages": 6,
        "num_warps": 32,
        "ms": 0.47057127952575684,
        "min_ms": 0.47057127952575684,
        "max_ms": 0.47057127952575684,
        "compile_time": 1.8351125717163086
    },
    {
        "BLOCK_SIZE_M": 32,
        "BLOCK_SIZE_N": 128,
        "BLOCK_SIZE_K": 64,
        "GROUP_SIZE_M": 8,
        "num_stages": 7,
        "num_warps": 4,
        "ms": 0.470571905374527,
        "min_ms": 0.470571905374527,
        "max_ms": 0.470571905374527,
        "compile_time": 1.1986145973205566
    },
    {
        "BLOCK_SIZE_M": 64,
        "BLOCK_SIZE_N": 256,
        "BLOCK_SIZE_K": 128,
        "GROUP_SIZE_M": 8,
        "num_stages": 2,
        "num_warps": 16,
        "ms": 0.47119998931884766,
        "min_ms": 0.47119998931884766,
        "max_ms": 0.47119998931884766,
        "compile_time": 2.2273306846618652
    },
    {
        "BLOCK_SIZE_M": 32,
        "BLOCK_SIZE_N": 128,
        "BLOCK_SIZE_K": 128,
        "GROUP_SIZE_M": 8,
        "num_stages": 3,
        "num_warps": 4,
        "ms": 0.4712957441806793,
        "min_ms": 0.4712957441806793,
        "max_ms": 0.4712957441806793,
        "compile_time": 2.233224630355835
    },
    {
        "BLOCK_SIZE_M": 128,
        "BLOCK_SIZE_N": 256,
        "BLOCK_SIZE_K": 64,
        "GROUP_SIZE_M": 8,
        "num_stages": 1,
        "num_warps": 8,
        "ms": 0.4716426730155945,
        "min_ms": 0.4716426730155945,
        "max_ms": 0.4716426730155945,
        "compile_time": 2.3623251914978027
    },
    {
        "BLOCK_SIZE_M": 32,
        "BLOCK_SIZE_N": 128,
        "BLOCK_SIZE_K": 64,
        "GROUP_SIZE_M": 8,
        "num_stages": 3,
        "num_warps": 8,
        "ms": 0.4718397259712219,
        "min_ms": 0.4718397259712219,
        "max_ms": 0.4718397259712219,
        "compile_time": 1.6723864078521729
    },
    {
        "BLOCK_SIZE_M": 32,
        "BLOCK_SIZE_N": 128,
        "BLOCK_SIZE_K": 64,
        "GROUP_SIZE_M": 8,
        "num_stages": 8,
        "num_warps": 4,
        "ms": 0.47201642394065857,
        "min_ms": 0.47201642394065857,
        "max_ms": 0.47201642394065857,
        "compile_time": 2.0652947425842285
    },
    {
        "BLOCK_SIZE_M": 256,
        "BLOCK_SIZE_N": 128,
        "BLOCK_SIZE_K": 128,
        "GROUP_SIZE_M": 8,
        "num_stages": 1,
        "num_warps": 8,
        "ms": 0.4722762107849121,
        "min_ms": 0.4722762107849121,
        "max_ms": 0.4722762107849121,
        "compile_time": 2.826270580291748
    },
    {
        "BLOCK_SIZE_M": 256,
        "BLOCK_SIZE_N": 32,
        "BLOCK_SIZE_K": 64,
        "GROUP_SIZE_M": 8,
        "num_stages": 2,
        "num_warps": 8,
        "ms": 0.4722907543182373,
        "min_ms": 0.4722907543182373,
        "max_ms": 0.4722907543182373,
        "compile_time": 1.272925853729248
    },
    {
        "BLOCK_SIZE_M": 128,
        "BLOCK_SIZE_N": 32,
        "BLOCK_SIZE_K": 128,
        "GROUP_SIZE_M": 8,
        "num_stages": 2,
        "num_warps": 4,
        "ms": 0.47253328561782837,
        "min_ms": 0.47253328561782837,
        "max_ms": 0.47253328561782837,
        "compile_time": 2.227217435836792
    },
    {
        "BLOCK_SIZE_M": 32,
        "BLOCK_SIZE_N": 128,
        "BLOCK_SIZE_K": 16,
        "GROUP_SIZE_M": 8,
        "num_stages": 8,
        "num_warps": 2,
        "ms": 0.47284990549087524,
        "min_ms": 0.47284990549087524,
        "max_ms": 0.47284990549087524,
        "compile_time": 1.8683388233184814
    },
    {
        "BLOCK_SIZE_M": 128,
        "BLOCK_SIZE_N": 32,
        "BLOCK_SIZE_K": 128,
        "GROUP_SIZE_M": 8,
        "num_stages": 5,
        "num_warps": 4,
        "ms": 0.472919762134552,
        "min_ms": 0.472919762134552,
        "max_ms": 0.472919762134552,
        "compile_time": 2.4700329303741455
    },
    {
        "BLOCK_SIZE_M": 128,
        "BLOCK_SIZE_N": 32,
        "BLOCK_SIZE_K": 128,
        "GROUP_SIZE_M": 8,
        "num_stages": 4,
        "num_warps": 4,
        "ms": 0.4734840989112854,
        "min_ms": 0.4734840989112854,
        "max_ms": 0.4734840989112854,
        "compile_time": 2.4102559089660645
    },
    {
        "BLOCK_SIZE_M": 32,
        "BLOCK_SIZE_N": 128,
        "BLOCK_SIZE_K": 64,
        "GROUP_SIZE_M": 8,
        "num_stages": 6,
        "num_warps": 4,
        "ms": 0.4739154875278473,
        "min_ms": 0.4739154875278473,
        "max_ms": 0.4739154875278473,
        "compile_time": 1.9869537353515625
    },
    {
        "BLOCK_SIZE_M": 256,
        "BLOCK_SIZE_N": 32,
        "BLOCK_SIZE_K": 64,
        "GROUP_SIZE_M": 8,
        "num_stages": 2,
        "num_warps": 4,
        "ms": 0.4741976857185364,
        "min_ms": 0.4741976857185364,
        "max_ms": 0.4741976857185364,
        "compile_time": 2.4103686809539795
    },
    {
        "BLOCK_SIZE_M": 32,
        "BLOCK_SIZE_N": 128,
        "BLOCK_SIZE_K": 64,
        "GROUP_SIZE_M": 8,
        "num_stages": 4,
        "num_warps": 8,
        "ms": 0.4742255210876465,
        "min_ms": 0.4742255210876465,
        "max_ms": 0.4742255210876465,
        "compile_time": 1.1980469226837158
    },
    {
        "BLOCK_SIZE_M": 128,
        "BLOCK_SIZE_N": 32,
        "BLOCK_SIZE_K": 256,
        "GROUP_SIZE_M": 8,
        "num_stages": 2,
        "num_warps": 4,
        "ms": 0.47441181540489197,
        "min_ms": 0.47441181540489197,
        "max_ms": 0.47441181540489197,
        "compile_time": 2.808479070663452
    },
    {
        "BLOCK_SIZE_M": 32,
        "BLOCK_SIZE_N": 128,
        "BLOCK_SIZE_K": 16,
        "GROUP_SIZE_M": 8,
        "num_stages": 4,
        "num_warps": 4,
        "ms": 0.4751090109348297,
        "min_ms": 0.4751090109348297,
        "max_ms": 0.4751090109348297,
        "compile_time": 1.2140817642211914
    },
    {
        "BLOCK_SIZE_M": 32,
        "BLOCK_SIZE_N": 512,
        "BLOCK_SIZE_K": 16,
        "GROUP_SIZE_M": 8,
        "num_stages": 7,
        "num_warps": 8,
        "ms": 0.47536587715148926,
        "min_ms": 0.47536587715148926,
        "max_ms": 0.47536587715148926,
        "compile_time": 1.8779239654541016
    },
    {
        "BLOCK_SIZE_M": 128,
        "BLOCK_SIZE_N": 32,
        "BLOCK_SIZE_K": 64,
        "GROUP_SIZE_M": 8,
        "num_stages": 3,
        "num_warps": 8,
        "ms": 0.47551488876342773,
        "min_ms": 0.47551488876342773,
        "max_ms": 0.47551488876342773,
        "compile_time": 1.2570881843566895
    },
    {
        "BLOCK_SIZE_M": 128,
        "BLOCK_SIZE_N": 32,
        "BLOCK_SIZE_K": 64,
        "GROUP_SIZE_M": 8,
        "num_stages": 2,
        "num_warps": 2,
        "ms": 0.4757556915283203,
        "min_ms": 0.4757556915283203,
        "max_ms": 0.4757556915283203,
        "compile_time": 2.2352802753448486
    },
    {
        "BLOCK_SIZE_M": 32,
        "BLOCK_SIZE_N": 512,
        "BLOCK_SIZE_K": 16,
        "GROUP_SIZE_M": 8,
        "num_stages": 6,
        "num_warps": 8,
        "ms": 0.47592267394065857,
        "min_ms": 0.47592267394065857,
        "max_ms": 0.47592267394065857,
        "compile_time": 1.8497846126556396
    },
    {
        "BLOCK_SIZE_M": 64,
        "BLOCK_SIZE_N": 64,
        "BLOCK_SIZE_K": 32,
        "GROUP_SIZE_M": 8,
        "num_stages": 6,
        "num_warps": 8,
        "ms": 0.47596845030784607,
        "min_ms": 0.47596845030784607,
        "max_ms": 0.47596845030784607,
        "compile_time": 1.2425909042358398
    },
    {
        "BLOCK_SIZE_M": 128,
        "BLOCK_SIZE_N": 32,
        "BLOCK_SIZE_K": 64,
        "GROUP_SIZE_M": 8,
        "num_stages": 4,
        "num_warps": 8,
        "ms": 0.47630834579467773,
        "min_ms": 0.47630834579467773,
        "max_ms": 0.47630834579467773,
        "compile_time": 1.2699511051177979
    },
    {
        "BLOCK_SIZE_M": 128,
        "BLOCK_SIZE_N": 256,
        "BLOCK_SIZE_K": 128,
        "GROUP_SIZE_M": 8,
        "num_stages": 2,
        "num_warps": 16,
        "ms": 0.47639304399490356,
        "min_ms": 0.47639304399490356,
        "max_ms": 0.47639304399490356,
        "compile_time": 2.2610955238342285
    },
    {
        "BLOCK_SIZE_M": 64,
        "BLOCK_SIZE_N": 64,
        "BLOCK_SIZE_K": 128,
        "GROUP_SIZE_M": 8,
        "num_stages": 6,
        "num_warps": 8,
        "ms": 0.4766264855861664,
        "min_ms": 0.4766264855861664,
        "max_ms": 0.4766264855861664,
        "compile_time": 1.2378427982330322
    },
    {
        "BLOCK_SIZE_M": 32,
        "BLOCK_SIZE_N": 128,
        "BLOCK_SIZE_K": 32,
        "GROUP_SIZE_M": 8,
        "num_stages": 2,
        "num_warps": 2,
        "ms": 0.4766998291015625,
        "min_ms": 0.4766998291015625,
        "max_ms": 0.4766998291015625,
        "compile_time": 1.8413679599761963
    },
    {
        "BLOCK_SIZE_M": 64,
        "BLOCK_SIZE_N": 64,
        "BLOCK_SIZE_K": 64,
        "GROUP_SIZE_M": 8,
        "num_stages": 7,
        "num_warps": 8,
        "ms": 0.47677645087242126,
        "min_ms": 0.47677645087242126,
        "max_ms": 0.47677645087242126,
        "compile_time": 1.2392826080322266
    },
    {
        "BLOCK_SIZE_M": 64,
        "BLOCK_SIZE_N": 64,
        "BLOCK_SIZE_K": 32,
        "GROUP_SIZE_M": 8,
        "num_stages": 5,
        "num_warps": 8,
        "ms": 0.4769548773765564,
        "min_ms": 0.4769548773765564,
        "max_ms": 0.4769548773765564,
        "compile_time": 1.3074846267700195
    },
    {
        "BLOCK_SIZE_M": 64,
        "BLOCK_SIZE_N": 64,
        "BLOCK_SIZE_K": 256,
        "GROUP_SIZE_M": 8,
        "num_stages": 3,
        "num_warps": 8,
        "ms": 0.4772734045982361,
        "min_ms": 0.4772734045982361,
        "max_ms": 0.4772734045982361,
        "compile_time": 1.2304720878601074
    },
    {
        "BLOCK_SIZE_M": 64,
        "BLOCK_SIZE_N": 64,
        "BLOCK_SIZE_K": 32,
        "GROUP_SIZE_M": 8,
        "num_stages": 3,
        "num_warps": 8,
        "ms": 0.47741204500198364,
        "min_ms": 0.47741204500198364,
        "max_ms": 0.47741204500198364,
        "compile_time": 1.2131094932556152
    },
    {
        "BLOCK_SIZE_M": 32,
        "BLOCK_SIZE_N": 128,
        "BLOCK_SIZE_K": 128,
        "GROUP_SIZE_M": 8,
        "num_stages": 5,
        "num_warps": 4,
        "ms": 0.4775225520133972,
        "min_ms": 0.4775225520133972,
        "max_ms": 0.4775225520133972,
        "compile_time": 2.411816120147705
    },
    {
        "BLOCK_SIZE_M": 32,
        "BLOCK_SIZE_N": 256,
        "BLOCK_SIZE_K": 32,
        "GROUP_SIZE_M": 8,
        "num_stages": 5,
        "num_warps": 2,
        "ms": 0.4776710569858551,
        "min_ms": 0.4776710569858551,
        "max_ms": 0.4776710569858551,
        "compile_time": 2.7120039463043213
    },
    {
        "BLOCK_SIZE_M": 32,
        "BLOCK_SIZE_N": 128,
        "BLOCK_SIZE_K": 64,
        "GROUP_SIZE_M": 8,
        "num_stages": 5,
        "num_warps": 8,
        "ms": 0.4778541624546051,
        "min_ms": 0.4778541624546051,
        "max_ms": 0.4778541624546051,
        "compile_time": 1.7442107200622559
    },
    {
        "BLOCK_SIZE_M": 128,
        "BLOCK_SIZE_N": 32,
        "BLOCK_SIZE_K": 64,
        "GROUP_SIZE_M": 8,
        "num_stages": 2,
        "num_warps": 4,
        "ms": 0.4779894948005676,
        "min_ms": 0.4779894948005676,
        "max_ms": 0.4779894948005676,
        "compile_time": 1.910193920135498
    },
    {
        "BLOCK_SIZE_M": 256,
        "BLOCK_SIZE_N": 32,
        "BLOCK_SIZE_K": 128,
        "GROUP_SIZE_M": 8,
        "num_stages": 3,
        "num_warps": 16,
        "ms": 0.47803592681884766,
        "min_ms": 0.47803592681884766,
        "max_ms": 0.47803592681884766,
        "compile_time": 2.0967185497283936
    },
    {
        "BLOCK_SIZE_M": 64,
        "BLOCK_SIZE_N": 64,
        "BLOCK_SIZE_K": 64,
        "GROUP_SIZE_M": 8,
        "num_stages": 2,
        "num_warps": 8,
        "ms": 0.4780387282371521,
        "min_ms": 0.4780387282371521,
        "max_ms": 0.4780387282371521,
        "compile_time": 1.712303638458252
    },
    {
        "BLOCK_SIZE_M": 64,
        "BLOCK_SIZE_N": 64,
        "BLOCK_SIZE_K": 32,
        "GROUP_SIZE_M": 8,
        "num_stages": 4,
        "num_warps": 8,
        "ms": 0.47820696234703064,
        "min_ms": 0.47820696234703064,
        "max_ms": 0.47820696234703064,
        "compile_time": 1.2434883117675781
    },
    {
        "BLOCK_SIZE_M": 256,
        "BLOCK_SIZE_N": 32,
        "BLOCK_SIZE_K": 32,
        "GROUP_SIZE_M": 8,
        "num_stages": 4,
        "num_warps": 2,
        "ms": 0.4783010482788086,
        "min_ms": 0.4783010482788086,
        "max_ms": 0.4783010482788086,
        "compile_time": 1.2825953960418701
    },
    {
        "BLOCK_SIZE_M": 64,
        "BLOCK_SIZE_N": 64,
        "BLOCK_SIZE_K": 64,
        "GROUP_SIZE_M": 8,
        "num_stages": 1,
        "num_warps": 2,
        "ms": 0.4784192144870758,
        "min_ms": 0.4784192144870758,
        "max_ms": 0.4784192144870758,
        "compile_time": 1.9484572410583496
    },
    {
        "BLOCK_SIZE_M": 128,
        "BLOCK_SIZE_N": 64,
        "BLOCK_SIZE_K": 128,
        "GROUP_SIZE_M": 8,
        "num_stages": 2,
        "num_warps": 2,
        "ms": 0.4785768985748291,
        "min_ms": 0.4785768985748291,
        "max_ms": 0.4785768985748291,
        "compile_time": 3.339447021484375
    },
    {
        "BLOCK_SIZE_M": 64,
        "BLOCK_SIZE_N": 64,
        "BLOCK_SIZE_K": 256,
        "GROUP_SIZE_M": 8,
        "num_stages": 2,
        "num_warps": 8,
        "ms": 0.4786667227745056,
        "min_ms": 0.4786667227745056,
        "max_ms": 0.4786667227745056,
        "compile_time": 2.0555429458618164
    },
    {
        "BLOCK_SIZE_M": 32,
        "BLOCK_SIZE_N": 512,
        "BLOCK_SIZE_K": 16,
        "GROUP_SIZE_M": 8,
        "num_stages": 8,
        "num_warps": 8,
        "ms": 0.47871631383895874,
        "min_ms": 0.47871631383895874,
        "max_ms": 0.47871631383895874,
        "compile_time": 1.2146375179290771
    },
    {
        "BLOCK_SIZE_M": 512,
        "BLOCK_SIZE_N": 64,
        "BLOCK_SIZE_K": 32,
        "GROUP_SIZE_M": 8,
        "num_stages": 4,
        "num_warps": 16,
        "ms": 0.47899308800697327,
        "min_ms": 0.47899308800697327,
        "max_ms": 0.47899308800697327,
        "compile_time": 2.2508187294006348
    },
    {
        "BLOCK_SIZE_M": 64,
        "BLOCK_SIZE_N": 64,
        "BLOCK_SIZE_K": 64,
        "GROUP_SIZE_M": 8,
        "num_stages": 8,
        "num_warps": 8,
        "ms": 0.4790229797363281,
        "min_ms": 0.4790229797363281,
        "max_ms": 0.4790229797363281,
        "compile_time": 1.8325283527374268
    },
    {
        "BLOCK_SIZE_M": 64,
        "BLOCK_SIZE_N": 128,
        "BLOCK_SIZE_K": 32,
        "GROUP_SIZE_M": 8,
        "num_stages": 1,
        "num_warps": 8,
        "ms": 0.47944536805152893,
        "min_ms": 0.47944536805152893,
        "max_ms": 0.47944536805152893,
        "compile_time": 1.6999952793121338
    },
    {
        "BLOCK_SIZE_M": 32,
        "BLOCK_SIZE_N": 256,
        "BLOCK_SIZE_K": 32,
        "GROUP_SIZE_M": 8,
        "num_stages": 4,
        "num_warps": 2,
        "ms": 0.47955188155174255,
        "min_ms": 0.47955188155174255,
        "max_ms": 0.47955188155174255,
        "compile_time": 2.609682559967041
    },
    {
        "BLOCK_SIZE_M": 128,
        "BLOCK_SIZE_N": 32,
        "BLOCK_SIZE_K": 64,
        "GROUP_SIZE_M": 8,
        "num_stages": 5,
        "num_warps": 8,
        "ms": 0.480149507522583,
        "min_ms": 0.480149507522583,
        "max_ms": 0.480149507522583,
        "compile_time": 1.2659318447113037
    },
    {
        "BLOCK_SIZE_M": 64,
        "BLOCK_SIZE_N": 128,
        "BLOCK_SIZE_K": 32,
        "GROUP_SIZE_M": 8,
        "num_stages": 1,
        "num_warps": 4,
        "ms": 0.48036327958106995,
        "min_ms": 0.48036327958106995,
        "max_ms": 0.48036327958106995,
        "compile_time": 1.231173038482666
    },
    {
        "BLOCK_SIZE_M": 128,
        "BLOCK_SIZE_N": 128,
        "BLOCK_SIZE_K": 64,
        "GROUP_SIZE_M": 8,
        "num_stages": 2,
        "num_warps": 16,
        "ms": 0.4808093011379242,
        "min_ms": 0.4808093011379242,
        "max_ms": 0.4808093011379242,
        "compile_time": 1.2438757419586182
    },
    {
        "BLOCK_SIZE_M": 64,
        "BLOCK_SIZE_N": 64,
        "BLOCK_SIZE_K": 32,
        "GROUP_SIZE_M": 8,
        "num_stages": 7,
        "num_warps": 8,
        "ms": 0.48104533553123474,
        "min_ms": 0.48104533553123474,
        "max_ms": 0.48104533553123474,
        "compile_time": 1.2461879253387451
    },
    {
        "BLOCK_SIZE_M": 32,
        "BLOCK_SIZE_N": 128,
        "BLOCK_SIZE_K": 128,
        "GROUP_SIZE_M": 8,
        "num_stages": 2,
        "num_warps": 2,
        "ms": 0.48122334480285645,
        "min_ms": 0.48122334480285645,
        "max_ms": 0.48122334480285645,
        "compile_time": 2.8031747341156006
    },
    {
        "BLOCK_SIZE_M": 32,
        "BLOCK_SIZE_N": 256,
        "BLOCK_SIZE_K": 128,
        "GROUP_SIZE_M": 8,
        "num_stages": 3,
        "num_warps": 16,
        "ms": 0.4818112254142761,
        "min_ms": 0.4818112254142761,
        "max_ms": 0.4818112254142761,
        "compile_time": 1.2127041816711426
    },
    {
        "BLOCK_SIZE_M": 128,
        "BLOCK_SIZE_N": 32,
        "BLOCK_SIZE_K": 128,
        "GROUP_SIZE_M": 8,
        "num_stages": 3,
        "num_warps": 2,
        "ms": 0.48229169845581055,
        "min_ms": 0.48229169845581055,
        "max_ms": 0.48229169845581055,
        "compile_time": 3.336974859237671
    },
    {
        "BLOCK_SIZE_M": 32,
        "BLOCK_SIZE_N": 256,
        "BLOCK_SIZE_K": 32,
        "GROUP_SIZE_M": 8,
        "num_stages": 2,
        "num_warps": 2,
        "ms": 0.4828181266784668,
        "min_ms": 0.4828181266784668,
        "max_ms": 0.4828181266784668,
        "compile_time": 2.3889682292938232
    },
    {
        "BLOCK_SIZE_M": 32,
        "BLOCK_SIZE_N": 128,
        "BLOCK_SIZE_K": 128,
        "GROUP_SIZE_M": 8,
        "num_stages": 2,
        "num_warps": 4,
        "ms": 0.48379793763160706,
        "min_ms": 0.48379793763160706,
        "max_ms": 0.48379793763160706,
        "compile_time": 2.028061628341675
    },
    {
        "BLOCK_SIZE_M": 32,
        "BLOCK_SIZE_N": 128,
        "BLOCK_SIZE_K": 64,
        "GROUP_SIZE_M": 8,
        "num_stages": 2,
        "num_warps": 4,
        "ms": 0.48384109139442444,
        "min_ms": 0.48384109139442444,
        "max_ms": 0.48384109139442444,
        "compile_time": 1.1854970455169678
    },
    {
        "BLOCK_SIZE_M": 32,
        "BLOCK_SIZE_N": 128,
        "BLOCK_SIZE_K": 256,
        "GROUP_SIZE_M": 8,
        "num_stages": 2,
        "num_warps": 4,
        "ms": 0.48440665006637573,
        "min_ms": 0.48440665006637573,
        "max_ms": 0.48440665006637573,
        "compile_time": 2.653838872909546
    },
    {
        "BLOCK_SIZE_M": 32,
        "BLOCK_SIZE_N": 128,
        "BLOCK_SIZE_K": 128,
        "GROUP_SIZE_M": 8,
        "num_stages": 3,
        "num_warps": 2,
        "ms": 0.48510295152664185,
        "min_ms": 0.48510295152664185,
        "max_ms": 0.48510295152664185,
        "compile_time": 3.203885078430176
    },
    {
        "BLOCK_SIZE_M": 32,
        "BLOCK_SIZE_N": 128,
        "BLOCK_SIZE_K": 128,
        "GROUP_SIZE_M": 8,
        "num_stages": 4,
        "num_warps": 4,
        "ms": 0.4862528443336487,
        "min_ms": 0.4862528443336487,
        "max_ms": 0.4862528443336487,
        "compile_time": 2.2622973918914795
    },
    {
        "BLOCK_SIZE_M": 64,
        "BLOCK_SIZE_N": 64,
        "BLOCK_SIZE_K": 64,
        "GROUP_SIZE_M": 8,
        "num_stages": 1,
        "num_warps": 4,
        "ms": 0.48676300048828125,
        "min_ms": 0.48676300048828125,
        "max_ms": 0.48676300048828125,
        "compile_time": 1.2202582359313965
    },
    {
        "BLOCK_SIZE_M": 64,
        "BLOCK_SIZE_N": 128,
        "BLOCK_SIZE_K": 16,
        "GROUP_SIZE_M": 8,
        "num_stages": 2,
        "num_warps": 4,
        "ms": 0.486884742975235,
        "min_ms": 0.486884742975235,
        "max_ms": 0.486884742975235,
        "compile_time": 1.234168291091919
    },
    {
        "BLOCK_SIZE_M": 64,
        "BLOCK_SIZE_N": 256,
        "BLOCK_SIZE_K": 64,
        "GROUP_SIZE_M": 8,
        "num_stages": 1,
        "num_warps": 4,
        "ms": 0.48696622252464294,
        "min_ms": 0.48696622252464294,
        "max_ms": 0.48696622252464294,
        "compile_time": 2.4143123626708984
    },
    {
        "BLOCK_SIZE_M": 64,
        "BLOCK_SIZE_N": 256,
        "BLOCK_SIZE_K": 128,
        "GROUP_SIZE_M": 8,
        "num_stages": 1,
        "num_warps": 4,
        "ms": 0.4879206120967865,
        "min_ms": 0.4879206120967865,
        "max_ms": 0.4879206120967865,
        "compile_time": 2.9493653774261475
    },
    {
        "BLOCK_SIZE_M": 64,
        "BLOCK_SIZE_N": 128,
        "BLOCK_SIZE_K": 128,
        "GROUP_SIZE_M": 8,
        "num_stages": 1,
        "num_warps": 4,
        "ms": 0.4882597029209137,
        "min_ms": 0.4882597029209137,
        "max_ms": 0.4882597029209137,
        "compile_time": 2.200047254562378
    },
    {
        "BLOCK_SIZE_M": 32,
        "BLOCK_SIZE_N": 128,
        "BLOCK_SIZE_K": 16,
        "GROUP_SIZE_M": 8,
        "num_stages": 3,
        "num_warps": 4,
        "ms": 0.4887723922729492,
        "min_ms": 0.4887723922729492,
        "max_ms": 0.4887723922729492,
        "compile_time": 1.2005748748779297
    },
    {
        "BLOCK_SIZE_M": 256,
        "BLOCK_SIZE_N": 32,
        "BLOCK_SIZE_K": 32,
        "GROUP_SIZE_M": 8,
        "num_stages": 5,
        "num_warps": 2,
        "ms": 0.48895519971847534,
        "min_ms": 0.48895519971847534,
        "max_ms": 0.48895519971847534,
        "compile_time": 1.2775375843048096
    },
    {
        "BLOCK_SIZE_M": 256,
        "BLOCK_SIZE_N": 32,
        "BLOCK_SIZE_K": 32,
        "GROUP_SIZE_M": 8,
        "num_stages": 7,
        "num_warps": 8,
        "ms": 0.48929476737976074,
        "min_ms": 0.48929476737976074,
        "max_ms": 0.48929476737976074,
        "compile_time": 1.2900362014770508
    },
    {
        "BLOCK_SIZE_M": 256,
        "BLOCK_SIZE_N": 128,
        "BLOCK_SIZE_K": 128,
        "GROUP_SIZE_M": 8,
        "num_stages": 1,
        "num_warps": 16,
        "ms": 0.4894587993621826,
        "min_ms": 0.4894587993621826,
        "max_ms": 0.4894587993621826,
        "compile_time": 2.1936252117156982
    },
    {
        "BLOCK_SIZE_M": 128,
        "BLOCK_SIZE_N": 32,
        "BLOCK_SIZE_K": 32,
        "GROUP_SIZE_M": 8,
        "num_stages": 7,
        "num_warps": 4,
        "ms": 0.4895454943180084,
        "min_ms": 0.4895454943180084,
        "max_ms": 0.4895454943180084,
        "compile_time": 1.2545843124389648
    },
    {
        "BLOCK_SIZE_M": 32,
        "BLOCK_SIZE_N": 128,
        "BLOCK_SIZE_K": 128,
        "GROUP_SIZE_M": 8,
        "num_stages": 3,
        "num_warps": 8,
        "ms": 0.4899164140224457,
        "min_ms": 0.4899164140224457,
        "max_ms": 0.4899164140224457,
        "compile_time": 1.199505090713501
    },
    {
        "BLOCK_SIZE_M": 128,
        "BLOCK_SIZE_N": 32,
        "BLOCK_SIZE_K": 128,
        "GROUP_SIZE_M": 8,
        "num_stages": 2,
        "num_warps": 2,
        "ms": 0.490098237991333,
        "min_ms": 0.490098237991333,
        "max_ms": 0.490098237991333,
        "compile_time": 2.8665199279785156
    },
    {
        "BLOCK_SIZE_M": 64,
        "BLOCK_SIZE_N": 128,
        "BLOCK_SIZE_K": 256,
        "GROUP_SIZE_M": 8,
        "num_stages": 2,
        "num_warps": 4,
        "ms": 0.49033719301223755,
        "min_ms": 0.49033719301223755,
        "max_ms": 0.49033719301223755,
        "compile_time": 3.08161997795105
    },
    {
        "BLOCK_SIZE_M": 128,
        "BLOCK_SIZE_N": 32,
        "BLOCK_SIZE_K": 128,
        "GROUP_SIZE_M": 8,
        "num_stages": 3,
        "num_warps": 8,
        "ms": 0.4905840754508972,
        "min_ms": 0.4905840754508972,
        "max_ms": 0.4905840754508972,
        "compile_time": 1.2556955814361572
    },
    {
        "BLOCK_SIZE_M": 256,
        "BLOCK_SIZE_N": 32,
        "BLOCK_SIZE_K": 64,
        "GROUP_SIZE_M": 8,
        "num_stages": 3,
        "num_warps": 16,
        "ms": 0.4917367994785309,
        "min_ms": 0.4917367994785309,
        "max_ms": 0.4917367994785309,
        "compile_time": 1.2718381881713867
    },
    {
        "BLOCK_SIZE_M": 128,
        "BLOCK_SIZE_N": 32,
        "BLOCK_SIZE_K": 32,
        "GROUP_SIZE_M": 8,
        "num_stages": 8,
        "num_warps": 4,
        "ms": 0.4918099045753479,
        "min_ms": 0.4918099045753479,
        "max_ms": 0.4918099045753479,
        "compile_time": 1.9590466022491455
    },
    {
        "BLOCK_SIZE_M": 128,
        "BLOCK_SIZE_N": 64,
        "BLOCK_SIZE_K": 256,
        "GROUP_SIZE_M": 8,
        "num_stages": 2,
        "num_warps": 4,
        "ms": 0.49195146560668945,
        "min_ms": 0.49195146560668945,
        "max_ms": 0.49195146560668945,
        "compile_time": 3.1423499584198
    },
    {
        "BLOCK_SIZE_M": 512,
        "BLOCK_SIZE_N": 32,
        "BLOCK_SIZE_K": 32,
        "GROUP_SIZE_M": 8,
        "num_stages": 2,
        "num_warps": 4,
        "ms": 0.49245476722717285,
        "min_ms": 0.49245476722717285,
        "max_ms": 0.49245476722717285,
        "compile_time": 2.8437235355377197
    },
    {
        "BLOCK_SIZE_M": 256,
        "BLOCK_SIZE_N": 32,
        "BLOCK_SIZE_K": 32,
        "GROUP_SIZE_M": 8,
        "num_stages": 8,
        "num_warps": 8,
        "ms": 0.49371886253356934,
        "min_ms": 0.49371886253356934,
        "max_ms": 0.49371886253356934,
        "compile_time": 1.2713651657104492
    },
    {
        "BLOCK_SIZE_M": 256,
        "BLOCK_SIZE_N": 128,
        "BLOCK_SIZE_K": 64,
        "GROUP_SIZE_M": 8,
        "num_stages": 1,
        "num_warps": 32,
        "ms": 0.4937761425971985,
        "min_ms": 0.4937761425971985,
        "max_ms": 0.4937761425971985,
        "compile_time": 1.8777399063110352
    },
    {
        "BLOCK_SIZE_M": 256,
        "BLOCK_SIZE_N": 32,
        "BLOCK_SIZE_K": 64,
        "GROUP_SIZE_M": 8,
        "num_stages": 4,
        "num_warps": 16,
        "ms": 0.49388113617897034,
        "min_ms": 0.49388113617897034,
        "max_ms": 0.49388113617897034,
        "compile_time": 1.9914617538452148
    },
    {
        "BLOCK_SIZE_M": 64,
        "BLOCK_SIZE_N": 64,
        "BLOCK_SIZE_K": 32,
        "GROUP_SIZE_M": 8,
        "num_stages": 8,
        "num_warps": 8,
        "ms": 0.4940597116947174,
        "min_ms": 0.4940597116947174,
        "max_ms": 0.4940597116947174,
        "compile_time": 1.2415039539337158
    },
    {
        "BLOCK_SIZE_M": 128,
        "BLOCK_SIZE_N": 32,
        "BLOCK_SIZE_K": 256,
        "GROUP_SIZE_M": 8,
        "num_stages": 3,
        "num_warps": 4,
        "ms": 0.494376003742218,
        "min_ms": 0.494376003742218,
        "max_ms": 0.494376003742218,
        "compile_time": 3.2711021900177
    },
    {
        "BLOCK_SIZE_M": 64,
        "BLOCK_SIZE_N": 64,
        "BLOCK_SIZE_K": 64,
        "GROUP_SIZE_M": 8,
        "num_stages": 7,
        "num_warps": 2,
        "ms": 0.495584100484848,
        "min_ms": 0.495584100484848,
        "max_ms": 0.495584100484848,
        "compile_time": 2.4425888061523438
    },
    {
        "BLOCK_SIZE_M": 64,
        "BLOCK_SIZE_N": 256,
        "BLOCK_SIZE_K": 128,
        "GROUP_SIZE_M": 8,
        "num_stages": 3,
        "num_warps": 32,
        "ms": 0.496614545583725,
        "min_ms": 0.496614545583725,
        "max_ms": 0.496614545583725,
        "compile_time": 1.315068006515503
    },
    {
        "BLOCK_SIZE_M": 256,
        "BLOCK_SIZE_N": 32,
        "BLOCK_SIZE_K": 32,
        "GROUP_SIZE_M": 8,
        "num_stages": 6,
        "num_warps": 8,
        "ms": 0.49667859077453613,
        "min_ms": 0.49667859077453613,
        "max_ms": 0.49667859077453613,
        "compile_time": 1.2963101863861084
    },
    {
        "BLOCK_SIZE_M": 64,
        "BLOCK_SIZE_N": 256,
        "BLOCK_SIZE_K": 128,
        "GROUP_SIZE_M": 8,
        "num_stages": 2,
        "num_warps": 4,
        "ms": 0.4967498779296875,
        "min_ms": 0.4967498779296875,
        "max_ms": 0.4967498779296875,
        "compile_time": 3.4315507411956787
    },
    {
        "BLOCK_SIZE_M": 128,
        "BLOCK_SIZE_N": 32,
        "BLOCK_SIZE_K": 32,
        "GROUP_SIZE_M": 8,
        "num_stages": 2,
        "num_warps": 4,
        "ms": 0.4969162344932556,
        "min_ms": 0.4969162344932556,
        "max_ms": 0.4969162344932556,
        "compile_time": 1.2558510303497314
    },
    {
        "BLOCK_SIZE_M": 64,
        "BLOCK_SIZE_N": 256,
        "BLOCK_SIZE_K": 256,
        "GROUP_SIZE_M": 8,
        "num_stages": 2,
        "num_warps": 8,
        "ms": 0.4970064163208008,
        "min_ms": 0.4970064163208008,
        "max_ms": 0.4970064163208008,
        "compile_time": 3.01533579826355
    },
    {
        "BLOCK_SIZE_M": 128,
        "BLOCK_SIZE_N": 64,
        "BLOCK_SIZE_K": 16,
        "GROUP_SIZE_M": 8,
        "num_stages": 2,
        "num_warps": 4,
        "ms": 0.497342973947525,
        "min_ms": 0.497342973947525,
        "max_ms": 0.497342973947525,
        "compile_time": 1.2334017753601074
    },
    {
        "BLOCK_SIZE_M": 256,
        "BLOCK_SIZE_N": 64,
        "BLOCK_SIZE_K": 256,
        "GROUP_SIZE_M": 8,
        "num_stages": 2,
        "num_warps": 16,
        "ms": 0.4977084696292877,
        "min_ms": 0.4977084696292877,
        "max_ms": 0.4977084696292877,
        "compile_time": 2.443451404571533
    },
    {
        "BLOCK_SIZE_M": 128,
        "BLOCK_SIZE_N": 64,
        "BLOCK_SIZE_K": 32,
        "GROUP_SIZE_M": 8,
        "num_stages": 3,
        "num_warps": 16,
        "ms": 0.4984525144100189,
        "min_ms": 0.4984525144100189,
        "max_ms": 0.4984525144100189,
        "compile_time": 1.24375319480896
    },
    {
        "BLOCK_SIZE_M": 32,
        "BLOCK_SIZE_N": 256,
        "BLOCK_SIZE_K": 64,
        "GROUP_SIZE_M": 8,
        "num_stages": 3,
        "num_warps": 16,
        "ms": 0.49896249175071716,
        "min_ms": 0.49896249175071716,
        "max_ms": 0.49896249175071716,
        "compile_time": 1.7126553058624268
    },
    {
        "BLOCK_SIZE_M": 32,
        "BLOCK_SIZE_N": 128,
        "BLOCK_SIZE_K": 64,
        "GROUP_SIZE_M": 8,
        "num_stages": 6,
        "num_warps": 8,
        "ms": 0.49902787804603577,
        "min_ms": 0.49902787804603577,
        "max_ms": 0.49902787804603577,
        "compile_time": 1.201923131942749
    },
    {
        "BLOCK_SIZE_M": 128,
        "BLOCK_SIZE_N": 64,
        "BLOCK_SIZE_K": 32,
        "GROUP_SIZE_M": 8,
        "num_stages": 4,
        "num_warps": 16,
        "ms": 0.4991140365600586,
        "min_ms": 0.4991140365600586,
        "max_ms": 0.4991140365600586,
        "compile_time": 1.2477571964263916
    },
    {
        "BLOCK_SIZE_M": 32,
        "BLOCK_SIZE_N": 256,
        "BLOCK_SIZE_K": 64,
        "GROUP_SIZE_M": 8,
        "num_stages": 5,
        "num_warps": 16,
        "ms": 0.499663770198822,
        "min_ms": 0.499663770198822,
        "max_ms": 0.499663770198822,
        "compile_time": 1.7543880939483643
    },
    {
        "BLOCK_SIZE_M": 64,
        "BLOCK_SIZE_N": 64,
        "BLOCK_SIZE_K": 64,
        "GROUP_SIZE_M": 8,
        "num_stages": 8,
        "num_warps": 2,
        "ms": 0.4997498393058777,
        "min_ms": 0.4997498393058777,
        "max_ms": 0.4997498393058777,
        "compile_time": 2.537663221359253
    },
    {
        "BLOCK_SIZE_M": 64,
        "BLOCK_SIZE_N": 64,
        "BLOCK_SIZE_K": 16,
        "GROUP_SIZE_M": 8,
        "num_stages": 2,
        "num_warps": 2,
        "ms": 0.49979931116104126,
        "min_ms": 0.49979931116104126,
        "max_ms": 0.49979931116104126,
        "compile_time": 1.7727954387664795
    },
    {
        "BLOCK_SIZE_M": 128,
        "BLOCK_SIZE_N": 256,
        "BLOCK_SIZE_K": 32,
        "GROUP_SIZE_M": 8,
        "num_stages": 2,
        "num_warps": 16,
        "ms": 0.5001749992370605,
        "min_ms": 0.5001749992370605,
        "max_ms": 0.5001749992370605,
        "compile_time": 1.9444572925567627
    },
    {
        "BLOCK_SIZE_M": 32,
        "BLOCK_SIZE_N": 256,
        "BLOCK_SIZE_K": 64,
        "GROUP_SIZE_M": 8,
        "num_stages": 4,
        "num_warps": 16,
        "ms": 0.5014843940734863,
        "min_ms": 0.5014843940734863,
        "max_ms": 0.5014843940734863,
        "compile_time": 1.2123606204986572
    },
    {
        "BLOCK_SIZE_M": 32,
        "BLOCK_SIZE_N": 128,
        "BLOCK_SIZE_K": 256,
        "GROUP_SIZE_M": 8,
        "num_stages": 3,
        "num_warps": 4,
        "ms": 0.5015436410903931,
        "min_ms": 0.5015436410903931,
        "max_ms": 0.5015436410903931,
        "compile_time": 3.2209551334381104
    },
    {
        "BLOCK_SIZE_M": 128,
        "BLOCK_SIZE_N": 64,
        "BLOCK_SIZE_K": 32,
        "GROUP_SIZE_M": 8,
        "num_stages": 5,
        "num_warps": 16,
        "ms": 0.5017254948616028,
        "min_ms": 0.5017254948616028,
        "max_ms": 0.5017254948616028,
        "compile_time": 1.2360594272613525
    },
    {
        "BLOCK_SIZE_M": 32,
        "BLOCK_SIZE_N": 128,
        "BLOCK_SIZE_K": 128,
        "GROUP_SIZE_M": 8,
        "num_stages": 4,
        "num_warps": 8,
        "ms": 0.5021933913230896,
        "min_ms": 0.5021933913230896,
        "max_ms": 0.5021933913230896,
        "compile_time": 1.2046840190887451
    },
    {
        "BLOCK_SIZE_M": 128,
        "BLOCK_SIZE_N": 64,
        "BLOCK_SIZE_K": 32,
        "GROUP_SIZE_M": 8,
        "num_stages": 6,
        "num_warps": 16,
        "ms": 0.5022374391555786,
        "min_ms": 0.5022374391555786,
        "max_ms": 0.5022374391555786,
        "compile_time": 1.2352228164672852
    },
    {
        "BLOCK_SIZE_M": 64,
        "BLOCK_SIZE_N": 256,
        "BLOCK_SIZE_K": 64,
        "GROUP_SIZE_M": 8,
        "num_stages": 2,
        "num_warps": 16,
        "ms": 0.5022526979446411,
        "min_ms": 0.5022526979446411,
        "max_ms": 0.5022526979446411,
        "compile_time": 1.8098931312561035
    },
    {
        "BLOCK_SIZE_M": 64,
        "BLOCK_SIZE_N": 64,
        "BLOCK_SIZE_K": 128,
        "GROUP_SIZE_M": 8,
        "num_stages": 1,
        "num_warps": 4,
        "ms": 0.5023743510246277,
        "min_ms": 0.5023743510246277,
        "max_ms": 0.5023743510246277,
        "compile_time": 1.9556961059570312
    },
    {
        "BLOCK_SIZE_M": 64,
        "BLOCK_SIZE_N": 256,
        "BLOCK_SIZE_K": 64,
        "GROUP_SIZE_M": 8,
        "num_stages": 4,
        "num_warps": 32,
        "ms": 0.5024267435073853,
        "min_ms": 0.5024267435073853,
        "max_ms": 0.5024267435073853,
        "compile_time": 1.7732703685760498
    },
    {
        "BLOCK_SIZE_M": 64,
        "BLOCK_SIZE_N": 256,
        "BLOCK_SIZE_K": 64,
        "GROUP_SIZE_M": 8,
        "num_stages": 3,
        "num_warps": 32,
        "ms": 0.5024834871292114,
        "min_ms": 0.5024834871292114,
        "max_ms": 0.5024834871292114,
        "compile_time": 1.7302110195159912
    },
    {
        "BLOCK_SIZE_M": 128,
        "BLOCK_SIZE_N": 128,
        "BLOCK_SIZE_K": 256,
        "GROUP_SIZE_M": 8,
        "num_stages": 1,
        "num_warps": 16,
        "ms": 0.5025666952133179,
        "min_ms": 0.5025666952133179,
        "max_ms": 0.5025666952133179,
        "compile_time": 1.2382302284240723
    },
    {
        "BLOCK_SIZE_M": 256,
        "BLOCK_SIZE_N": 32,
        "BLOCK_SIZE_K": 64,
        "GROUP_SIZE_M": 8,
        "num_stages": 5,
        "num_warps": 16,
        "ms": 0.5026471018791199,
        "min_ms": 0.5026471018791199,
        "max_ms": 0.5026471018791199,
        "compile_time": 1.985762596130371
    },
    {
        "BLOCK_SIZE_M": 32,
        "BLOCK_SIZE_N": 128,
        "BLOCK_SIZE_K": 64,
        "GROUP_SIZE_M": 8,
        "num_stages": 7,
        "num_warps": 8,
        "ms": 0.5026496648788452,
        "min_ms": 0.5026496648788452,
        "max_ms": 0.5026496648788452,
        "compile_time": 1.8346209526062012
    },
    {
        "BLOCK_SIZE_M": 64,
        "BLOCK_SIZE_N": 128,
        "BLOCK_SIZE_K": 32,
        "GROUP_SIZE_M": 8,
        "num_stages": 8,
        "num_warps": 2,
        "ms": 0.5026989579200745,
        "min_ms": 0.5026989579200745,
        "max_ms": 0.5026989579200745,
        "compile_time": 2.659557342529297
    },
    {
        "BLOCK_SIZE_M": 32,
        "BLOCK_SIZE_N": 512,
        "BLOCK_SIZE_K": 32,
        "GROUP_SIZE_M": 8,
        "num_stages": 2,
        "num_warps": 4,
        "ms": 0.5027662515640259,
        "min_ms": 0.5027662515640259,
        "max_ms": 0.5027662515640259,
        "compile_time": 2.410534620285034
    },
    {
        "BLOCK_SIZE_M": 64,
        "BLOCK_SIZE_N": 256,
        "BLOCK_SIZE_K": 64,
        "GROUP_SIZE_M": 8,
        "num_stages": 5,
        "num_warps": 32,
        "ms": 0.5033729076385498,
        "min_ms": 0.5033729076385498,
        "max_ms": 0.5033729076385498,
        "compile_time": 1.2428410053253174
    },
    {
        "BLOCK_SIZE_M": 32,
        "BLOCK_SIZE_N": 128,
        "BLOCK_SIZE_K": 16,
        "GROUP_SIZE_M": 8,
        "num_stages": 8,
        "num_warps": 4,
        "ms": 0.503998875617981,
        "min_ms": 0.503998875617981,
        "max_ms": 0.503998875617981,
        "compile_time": 1.7164180278778076
    },
    {
        "BLOCK_SIZE_M": 128,
        "BLOCK_SIZE_N": 64,
        "BLOCK_SIZE_K": 32,
        "GROUP_SIZE_M": 8,
        "num_stages": 7,
        "num_warps": 16,
        "ms": 0.50421541929245,
        "min_ms": 0.50421541929245,
        "max_ms": 0.50421541929245,
        "compile_time": 1.7875697612762451
    },
    {
        "BLOCK_SIZE_M": 512,
        "BLOCK_SIZE_N": 32,
        "BLOCK_SIZE_K": 32,
        "GROUP_SIZE_M": 8,
        "num_stages": 4,
        "num_warps": 16,
        "ms": 0.5045092105865479,
        "min_ms": 0.5045092105865479,
        "max_ms": 0.5045092105865479,
        "compile_time": 2.118147611618042
    },
    {
        "BLOCK_SIZE_M": 256,
        "BLOCK_SIZE_N": 64,
        "BLOCK_SIZE_K": 64,
        "GROUP_SIZE_M": 8,
        "num_stages": 3,
        "num_warps": 32,
        "ms": 0.5045813322067261,
        "min_ms": 0.5045813322067261,
        "max_ms": 0.5045813322067261,
        "compile_time": 1.2835006713867188
    },
    {
        "BLOCK_SIZE_M": 256,
        "BLOCK_SIZE_N": 64,
        "BLOCK_SIZE_K": 256,
        "GROUP_SIZE_M": 8,
        "num_stages": 2,
        "num_warps": 8,
        "ms": 0.5049394369125366,
        "min_ms": 0.5049394369125366,
        "max_ms": 0.5049394369125366,
        "compile_time": 3.1397440433502197
    },
    {
        "BLOCK_SIZE_M": 64,
        "BLOCK_SIZE_N": 128,
        "BLOCK_SIZE_K": 32,
        "GROUP_SIZE_M": 8,
        "num_stages": 3,
        "num_warps": 16,
        "ms": 0.5054085850715637,
        "min_ms": 0.5054085850715637,
        "max_ms": 0.5054085850715637,
        "compile_time": 1.2263402938842773
    },
    {
        "BLOCK_SIZE_M": 32,
        "BLOCK_SIZE_N": 128,
        "BLOCK_SIZE_K": 32,
        "GROUP_SIZE_M": 8,
        "num_stages": 2,
        "num_warps": 4,
        "ms": 0.5058683156967163,
        "min_ms": 0.5058683156967163,
        "max_ms": 0.5058683156967163,
        "compile_time": 1.1679890155792236
    },
    {
        "BLOCK_SIZE_M": 32,
        "BLOCK_SIZE_N": 128,
        "BLOCK_SIZE_K": 128,
        "GROUP_SIZE_M": 8,
        "num_stages": 5,
        "num_warps": 8,
        "ms": 0.5064222812652588,
        "min_ms": 0.5064222812652588,
        "max_ms": 0.5064222812652588,
        "compile_time": 1.1862549781799316
    },
    {
        "BLOCK_SIZE_M": 256,
        "BLOCK_SIZE_N": 64,
        "BLOCK_SIZE_K": 16,
        "GROUP_SIZE_M": 8,
        "num_stages": 7,
        "num_warps": 16,
        "ms": 0.5064783096313477,
        "min_ms": 0.5064783096313477,
        "max_ms": 0.5064783096313477,
        "compile_time": 1.954629898071289
    },
    {
        "BLOCK_SIZE_M": 64,
        "BLOCK_SIZE_N": 64,
        "BLOCK_SIZE_K": 128,
        "GROUP_SIZE_M": 8,
        "num_stages": 1,
        "num_warps": 2,
        "ms": 0.5065789222717285,
        "min_ms": 0.5065789222717285,
        "max_ms": 0.5065789222717285,
        "compile_time": 2.4217240810394287
    },
    {
        "BLOCK_SIZE_M": 256,
        "BLOCK_SIZE_N": 64,
        "BLOCK_SIZE_K": 16,
        "GROUP_SIZE_M": 8,
        "num_stages": 8,
        "num_warps": 16,
        "ms": 0.5066192746162415,
        "min_ms": 0.5066192746162415,
        "max_ms": 0.5066192746162415,
        "compile_time": 1.307692050933838
    },
    {
        "BLOCK_SIZE_M": 256,
        "BLOCK_SIZE_N": 64,
        "BLOCK_SIZE_K": 64,
        "GROUP_SIZE_M": 8,
        "num_stages": 2,
        "num_warps": 16,
        "ms": 0.5069149136543274,
        "min_ms": 0.5069149136543274,
        "max_ms": 0.5069149136543274,
        "compile_time": 1.28475022315979
    },
    {
        "BLOCK_SIZE_M": 64,
        "BLOCK_SIZE_N": 128,
        "BLOCK_SIZE_K": 32,
        "GROUP_SIZE_M": 8,
        "num_stages": 4,
        "num_warps": 16,
        "ms": 0.507097065448761,
        "min_ms": 0.507097065448761,
        "max_ms": 0.507097065448761,
        "compile_time": 1.230139970779419
    },
    {
        "BLOCK_SIZE_M": 64,
        "BLOCK_SIZE_N": 256,
        "BLOCK_SIZE_K": 256,
        "GROUP_SIZE_M": 8,
        "num_stages": 1,
        "num_warps": 16,
        "ms": 0.5072803497314453,
        "min_ms": 0.5072803497314453,
        "max_ms": 0.5072803497314453,
        "compile_time": 2.319843292236328
    },
    {
        "BLOCK_SIZE_M": 256,
        "BLOCK_SIZE_N": 64,
        "BLOCK_SIZE_K": 64,
        "GROUP_SIZE_M": 8,
        "num_stages": 4,
        "num_warps": 32,
        "ms": 0.5080963969230652,
        "min_ms": 0.5080963969230652,
        "max_ms": 0.5080963969230652,
        "compile_time": 1.9706146717071533
    },
    {
        "BLOCK_SIZE_M": 32,
        "BLOCK_SIZE_N": 256,
        "BLOCK_SIZE_K": 64,
        "GROUP_SIZE_M": 8,
        "num_stages": 2,
        "num_warps": 4,
        "ms": 0.5087054967880249,
        "min_ms": 0.5087054967880249,
        "max_ms": 0.5087054967880249,
        "compile_time": 2.0641050338745117
    },
    {
        "BLOCK_SIZE_M": 64,
        "BLOCK_SIZE_N": 128,
        "BLOCK_SIZE_K": 32,
        "GROUP_SIZE_M": 8,
        "num_stages": 5,
        "num_warps": 16,
        "ms": 0.5087085366249084,
        "min_ms": 0.5087085366249084,
        "max_ms": 0.5087085366249084,
        "compile_time": 1.21836256980896
    },
    {
        "BLOCK_SIZE_M": 32,
        "BLOCK_SIZE_N": 128,
        "BLOCK_SIZE_K": 16,
        "GROUP_SIZE_M": 8,
        "num_stages": 7,
        "num_warps": 4,
        "ms": 0.5091097950935364,
        "min_ms": 0.5091097950935364,
        "max_ms": 0.5091097950935364,
        "compile_time": 1.1935274600982666
    },
    {
        "BLOCK_SIZE_M": 32,
        "BLOCK_SIZE_N": 128,
        "BLOCK_SIZE_K": 64,
        "GROUP_SIZE_M": 8,
        "num_stages": 8,
        "num_warps": 8,
        "ms": 0.5097965002059937,
        "min_ms": 0.5097965002059937,
        "max_ms": 0.5097965002059937,
        "compile_time": 1.242903232574463
    },
    {
        "BLOCK_SIZE_M": 128,
        "BLOCK_SIZE_N": 32,
        "BLOCK_SIZE_K": 128,
        "GROUP_SIZE_M": 8,
        "num_stages": 4,
        "num_warps": 8,
        "ms": 0.5098050832748413,
        "min_ms": 0.5098050832748413,
        "max_ms": 0.5098050832748413,
        "compile_time": 1.2441141605377197
    },
    {
        "BLOCK_SIZE_M": 128,
        "BLOCK_SIZE_N": 256,
        "BLOCK_SIZE_K": 16,
        "GROUP_SIZE_M": 8,
        "num_stages": 3,
        "num_warps": 32,
        "ms": 0.5104249715805054,
        "min_ms": 0.5104249715805054,
        "max_ms": 0.5104249715805054,
        "compile_time": 1.2520911693572998
    },
    {
        "BLOCK_SIZE_M": 128,
        "BLOCK_SIZE_N": 32,
        "BLOCK_SIZE_K": 64,
        "GROUP_SIZE_M": 8,
        "num_stages": 6,
        "num_warps": 8,
        "ms": 0.5104522109031677,
        "min_ms": 0.5104522109031677,
        "max_ms": 0.5104522109031677,
        "compile_time": 1.2468664646148682
    },
    {
        "BLOCK_SIZE_M": 128,
        "BLOCK_SIZE_N": 256,
        "BLOCK_SIZE_K": 16,
        "GROUP_SIZE_M": 8,
        "num_stages": 4,
        "num_warps": 32,
        "ms": 0.5110688209533691,
        "min_ms": 0.5110688209533691,
        "max_ms": 0.5110688209533691,
        "compile_time": 1.2520034313201904
    },
    {
        "BLOCK_SIZE_M": 64,
        "BLOCK_SIZE_N": 128,
        "BLOCK_SIZE_K": 32,
        "GROUP_SIZE_M": 8,
        "num_stages": 6,
        "num_warps": 16,
        "ms": 0.5116279721260071,
        "min_ms": 0.5116279721260071,
        "max_ms": 0.5116279721260071,
        "compile_time": 1.2189605236053467
    },
    {
        "BLOCK_SIZE_M": 128,
        "BLOCK_SIZE_N": 32,
        "BLOCK_SIZE_K": 64,
        "GROUP_SIZE_M": 8,
        "num_stages": 7,
        "num_warps": 8,
        "ms": 0.5122353434562683,
        "min_ms": 0.5122353434562683,
        "max_ms": 0.5122353434562683,
        "compile_time": 1.2369465827941895
    },
    {
        "BLOCK_SIZE_M": 32,
        "BLOCK_SIZE_N": 256,
        "BLOCK_SIZE_K": 16,
        "GROUP_SIZE_M": 8,
        "num_stages": 2,
        "num_warps": 4,
        "ms": 0.5124130845069885,
        "min_ms": 0.5124130845069885,
        "max_ms": 0.5124130845069885,
        "compile_time": 1.1665849685668945
    },
    {
        "BLOCK_SIZE_M": 512,
        "BLOCK_SIZE_N": 64,
        "BLOCK_SIZE_K": 32,
        "GROUP_SIZE_M": 8,
        "num_stages": 3,
        "num_warps": 16,
        "ms": 0.5125266313552856,
        "min_ms": 0.5125266313552856,
        "max_ms": 0.5125266313552856,
        "compile_time": 2.192237138748169
    },
    {
        "BLOCK_SIZE_M": 64,
        "BLOCK_SIZE_N": 128,
        "BLOCK_SIZE_K": 32,
        "GROUP_SIZE_M": 8,
        "num_stages": 7,
        "num_warps": 16,
        "ms": 0.5128203630447388,
        "min_ms": 0.5128203630447388,
        "max_ms": 0.5128203630447388,
        "compile_time": 1.22176194190979
    },
    {
        "BLOCK_SIZE_M": 128,
        "BLOCK_SIZE_N": 256,
        "BLOCK_SIZE_K": 16,
        "GROUP_SIZE_M": 8,
        "num_stages": 5,
        "num_warps": 32,
        "ms": 0.5129278302192688,
        "min_ms": 0.5129278302192688,
        "max_ms": 0.5129278302192688,
        "compile_time": 1.2568519115447998
    },
    {
        "BLOCK_SIZE_M": 32,
        "BLOCK_SIZE_N": 128,
        "BLOCK_SIZE_K": 16,
        "GROUP_SIZE_M": 8,
        "num_stages": 2,
        "num_warps": 2,
        "ms": 0.5129618048667908,
        "min_ms": 0.5129618048667908,
        "max_ms": 0.5129618048667908,
        "compile_time": 1.690687894821167
    },
    {
        "BLOCK_SIZE_M": 32,
        "BLOCK_SIZE_N": 256,
        "BLOCK_SIZE_K": 32,
        "GROUP_SIZE_M": 8,
        "num_stages": 4,
        "num_warps": 16,
        "ms": 0.5134512186050415,
        "min_ms": 0.5134512186050415,
        "max_ms": 0.5134512186050415,
        "compile_time": 1.2073984146118164
    },
    {
        "BLOCK_SIZE_M": 256,
        "BLOCK_SIZE_N": 64,
        "BLOCK_SIZE_K": 64,
        "GROUP_SIZE_M": 8,
        "num_stages": 5,
        "num_warps": 32,
        "ms": 0.513463020324707,
        "min_ms": 0.513463020324707,
        "max_ms": 0.513463020324707,
        "compile_time": 1.9594500064849854
    },
    {
        "BLOCK_SIZE_M": 128,
        "BLOCK_SIZE_N": 128,
        "BLOCK_SIZE_K": 128,
        "GROUP_SIZE_M": 8,
        "num_stages": 1,
        "num_warps": 8,
        "ms": 0.5135493278503418,
        "min_ms": 0.5135493278503418,
        "max_ms": 0.5135493278503418,
        "compile_time": 2.1382200717926025
    },
    {
        "BLOCK_SIZE_M": 64,
        "BLOCK_SIZE_N": 128,
        "BLOCK_SIZE_K": 16,
        "GROUP_SIZE_M": 8,
        "num_stages": 2,
        "num_warps": 2,
        "ms": 0.5145599842071533,
        "min_ms": 0.5145599842071533,
        "max_ms": 0.5145599842071533,
        "compile_time": 2.097970962524414
    },
    {
        "BLOCK_SIZE_M": 128,
        "BLOCK_SIZE_N": 32,
        "BLOCK_SIZE_K": 64,
        "GROUP_SIZE_M": 8,
        "num_stages": 2,
        "num_warps": 8,
        "ms": 0.5146804451942444,
        "min_ms": 0.5146804451942444,
        "max_ms": 0.5146804451942444,
        "compile_time": 1.2455816268920898
    },
    {
        "BLOCK_SIZE_M": 32,
        "BLOCK_SIZE_N": 256,
        "BLOCK_SIZE_K": 64,
        "GROUP_SIZE_M": 8,
        "num_stages": 2,
        "num_warps": 8,
        "ms": 0.5147456526756287,
        "min_ms": 0.5147456526756287,
        "max_ms": 0.5147456526756287,
        "compile_time": 1.1961236000061035
    },
    {
        "BLOCK_SIZE_M": 512,
        "BLOCK_SIZE_N": 64,
        "BLOCK_SIZE_K": 64,
        "GROUP_SIZE_M": 8,
        "num_stages": 2,
        "num_warps": 16,
        "ms": 0.5149695873260498,
        "min_ms": 0.5149695873260498,
        "max_ms": 0.5149695873260498,
        "compile_time": 2.3606531620025635
    },
    {
        "BLOCK_SIZE_M": 512,
        "BLOCK_SIZE_N": 32,
        "BLOCK_SIZE_K": 32,
        "GROUP_SIZE_M": 8,
        "num_stages": 4,
        "num_warps": 4,
        "ms": 0.5156359076499939,
        "min_ms": 0.5156359076499939,
        "max_ms": 0.5156359076499939,
        "compile_time": 2.7824857234954834
    },
    {
        "BLOCK_SIZE_M": 32,
        "BLOCK_SIZE_N": 128,
        "BLOCK_SIZE_K": 64,
        "GROUP_SIZE_M": 8,
        "num_stages": 2,
        "num_warps": 8,
        "ms": 0.5157995223999023,
        "min_ms": 0.5157995223999023,
        "max_ms": 0.5157995223999023,
        "compile_time": 1.6411161422729492
    },
    {
        "BLOCK_SIZE_M": 32,
        "BLOCK_SIZE_N": 256,
        "BLOCK_SIZE_K": 32,
        "GROUP_SIZE_M": 8,
        "num_stages": 5,
        "num_warps": 16,
        "ms": 0.5160698890686035,
        "min_ms": 0.5160698890686035,
        "max_ms": 0.5160698890686035,
        "compile_time": 1.2267284393310547
    },
    {
        "BLOCK_SIZE_M": 32,
        "BLOCK_SIZE_N": 128,
        "BLOCK_SIZE_K": 16,
        "GROUP_SIZE_M": 8,
        "num_stages": 5,
        "num_warps": 4,
        "ms": 0.5162261724472046,
        "min_ms": 0.5162261724472046,
        "max_ms": 0.5162261724472046,
        "compile_time": 1.1914997100830078
    },
    {
        "BLOCK_SIZE_M": 32,
        "BLOCK_SIZE_N": 128,
        "BLOCK_SIZE_K": 16,
        "GROUP_SIZE_M": 8,
        "num_stages": 6,
        "num_warps": 4,
        "ms": 0.5164015293121338,
        "min_ms": 0.5164015293121338,
        "max_ms": 0.5164015293121338,
        "compile_time": 1.1929733753204346
    },
    {
        "BLOCK_SIZE_M": 32,
        "BLOCK_SIZE_N": 256,
        "BLOCK_SIZE_K": 32,
        "GROUP_SIZE_M": 8,
        "num_stages": 3,
        "num_warps": 16,
        "ms": 0.5168501734733582,
        "min_ms": 0.5168501734733582,
        "max_ms": 0.5168501734733582,
        "compile_time": 1.211409330368042
    },
    {
        "BLOCK_SIZE_M": 128,
        "BLOCK_SIZE_N": 32,
        "BLOCK_SIZE_K": 64,
        "GROUP_SIZE_M": 8,
        "num_stages": 1,
        "num_warps": 2,
        "ms": 0.5169641375541687,
        "min_ms": 0.5169641375541687,
        "max_ms": 0.5169641375541687,
        "compile_time": 2.152829647064209
    },
    {
        "BLOCK_SIZE_M": 128,
        "BLOCK_SIZE_N": 32,
        "BLOCK_SIZE_K": 128,
        "GROUP_SIZE_M": 8,
        "num_stages": 5,
        "num_warps": 8,
        "ms": 0.5180308222770691,
        "min_ms": 0.5180308222770691,
        "max_ms": 0.5180308222770691,
        "compile_time": 1.2463586330413818
    },
    {
        "BLOCK_SIZE_M": 256,
        "BLOCK_SIZE_N": 128,
        "BLOCK_SIZE_K": 32,
        "GROUP_SIZE_M": 8,
        "num_stages": 1,
        "num_warps": 16,
        "ms": 0.51873379945755,
        "min_ms": 0.51873379945755,
        "max_ms": 0.51873379945755,
        "compile_time": 1.9803466796875
    },
    {
        "BLOCK_SIZE_M": 128,
        "BLOCK_SIZE_N": 32,
        "BLOCK_SIZE_K": 64,
        "GROUP_SIZE_M": 8,
        "num_stages": 8,
        "num_warps": 8,
        "ms": 0.518871545791626,
        "min_ms": 0.518871545791626,
        "max_ms": 0.518871545791626,
        "compile_time": 1.2505030632019043
    },
    {
        "BLOCK_SIZE_M": 512,
        "BLOCK_SIZE_N": 32,
        "BLOCK_SIZE_K": 32,
        "GROUP_SIZE_M": 8,
        "num_stages": 5,
        "num_warps": 4,
        "ms": 0.5191360712051392,
        "min_ms": 0.5191360712051392,
        "max_ms": 0.5191360712051392,
        "compile_time": 2.9222488403320312
    },
    {
        "BLOCK_SIZE_M": 32,
        "BLOCK_SIZE_N": 128,
        "BLOCK_SIZE_K": 64,
        "GROUP_SIZE_M": 8,
        "num_stages": 2,
        "num_warps": 2,
        "ms": 0.5209203362464905,
        "min_ms": 0.5209203362464905,
        "max_ms": 0.5209203362464905,
        "compile_time": 2.1192469596862793
    },
    {
        "BLOCK_SIZE_M": 64,
        "BLOCK_SIZE_N": 64,
        "BLOCK_SIZE_K": 128,
        "GROUP_SIZE_M": 8,
        "num_stages": 3,
        "num_warps": 16,
        "ms": 0.5210438370704651,
        "min_ms": 0.5210438370704651,
        "max_ms": 0.5210438370704651,
        "compile_time": 1.2413699626922607
    },
    {
        "BLOCK_SIZE_M": 32,
        "BLOCK_SIZE_N": 64,
        "BLOCK_SIZE_K": 32,
        "GROUP_SIZE_M": 8,
        "num_stages": 5,
        "num_warps": 2,
        "ms": 0.521192729473114,
        "min_ms": 0.521192729473114,
        "max_ms": 0.521192729473114,
        "compile_time": 1.7643814086914062
    },
    {
        "BLOCK_SIZE_M": 32,
        "BLOCK_SIZE_N": 64,
        "BLOCK_SIZE_K": 64,
        "GROUP_SIZE_M": 8,
        "num_stages": 3,
        "num_warps": 2,
        "ms": 0.5215595364570618,
        "min_ms": 0.5215595364570618,
        "max_ms": 0.5215595364570618,
        "compile_time": 1.8503906726837158
    },
    {
        "BLOCK_SIZE_M": 512,
        "BLOCK_SIZE_N": 32,
        "BLOCK_SIZE_K": 32,
        "GROUP_SIZE_M": 8,
        "num_stages": 3,
        "num_warps": 16,
        "ms": 0.5216649174690247,
        "min_ms": 0.5216649174690247,
        "max_ms": 0.5216649174690247,
        "compile_time": 2.091235399246216
    },
    {
        "BLOCK_SIZE_M": 32,
        "BLOCK_SIZE_N": 64,
        "BLOCK_SIZE_K": 32,
        "GROUP_SIZE_M": 8,
        "num_stages": 4,
        "num_warps": 2,
        "ms": 0.5227105021476746,
        "min_ms": 0.5227105021476746,
        "max_ms": 0.5227105021476746,
        "compile_time": 1.7386231422424316
    },
    {
        "BLOCK_SIZE_M": 128,
        "BLOCK_SIZE_N": 32,
        "BLOCK_SIZE_K": 256,
        "GROUP_SIZE_M": 8,
        "num_stages": 3,
        "num_warps": 8,
        "ms": 0.5235642790794373,
        "min_ms": 0.5235642790794373,
        "max_ms": 0.5235642790794373,
        "compile_time": 2.3239402770996094
    },
    {
        "BLOCK_SIZE_M": 64,
        "BLOCK_SIZE_N": 32,
        "BLOCK_SIZE_K": 64,
        "GROUP_SIZE_M": 8,
        "num_stages": 3,
        "num_warps": 2,
        "ms": 0.5245073437690735,
        "min_ms": 0.5245073437690735,
        "max_ms": 0.5245073437690735,
        "compile_time": 1.956819772720337
    },
    {
        "BLOCK_SIZE_M": 512,
        "BLOCK_SIZE_N": 64,
        "BLOCK_SIZE_K": 32,
        "GROUP_SIZE_M": 8,
        "num_stages": 5,
        "num_warps": 16,
        "ms": 0.5256006717681885,
        "min_ms": 0.5256006717681885,
        "max_ms": 0.5256006717681885,
        "compile_time": 2.2474894523620605
    },
    {
        "BLOCK_SIZE_M": 32,
        "BLOCK_SIZE_N": 64,
        "BLOCK_SIZE_K": 32,
        "GROUP_SIZE_M": 8,
        "num_stages": 6,
        "num_warps": 2,
        "ms": 0.525611400604248,
        "min_ms": 0.525611400604248,
        "max_ms": 0.525611400604248,
        "compile_time": 1.7812938690185547
    },
    {
        "BLOCK_SIZE_M": 32,
        "BLOCK_SIZE_N": 64,
        "BLOCK_SIZE_K": 64,
        "GROUP_SIZE_M": 8,
        "num_stages": 5,
        "num_warps": 2,
        "ms": 0.5256408452987671,
        "min_ms": 0.5256408452987671,
        "max_ms": 0.5256408452987671,
        "compile_time": 1.922149419784546
    },
    {
        "BLOCK_SIZE_M": 64,
        "BLOCK_SIZE_N": 128,
        "BLOCK_SIZE_K": 32,
        "GROUP_SIZE_M": 8,
        "num_stages": 1,
        "num_warps": 2,
        "ms": 0.5259016752243042,
        "min_ms": 0.5259016752243042,
        "max_ms": 0.5259016752243042,
        "compile_time": 2.2144949436187744
    },
    {
        "BLOCK_SIZE_M": 32,
        "BLOCK_SIZE_N": 64,
        "BLOCK_SIZE_K": 64,
        "GROUP_SIZE_M": 8,
        "num_stages": 4,
        "num_warps": 2,
        "ms": 0.5260970592498779,
        "min_ms": 0.5260970592498779,
        "max_ms": 0.5260970592498779,
        "compile_time": 1.8903658390045166
    },
    {
        "BLOCK_SIZE_M": 128,
        "BLOCK_SIZE_N": 128,
        "BLOCK_SIZE_K": 128,
        "GROUP_SIZE_M": 8,
        "num_stages": 1,
        "num_warps": 16,
        "ms": 0.526416003704071,
        "min_ms": 0.526416003704071,
        "max_ms": 0.526416003704071,
        "compile_time": 1.8831629753112793
    },
    {
        "BLOCK_SIZE_M": 64,
        "BLOCK_SIZE_N": 256,
        "BLOCK_SIZE_K": 32,
        "GROUP_SIZE_M": 8,
        "num_stages": 1,
        "num_warps": 4,
        "ms": 0.5269137620925903,
        "min_ms": 0.5269137620925903,
        "max_ms": 0.5269137620925903,
        "compile_time": 2.172710418701172
    },
    {
        "BLOCK_SIZE_M": 64,
        "BLOCK_SIZE_N": 32,
        "BLOCK_SIZE_K": 64,
        "GROUP_SIZE_M": 8,
        "num_stages": 5,
        "num_warps": 2,
        "ms": 0.527044951915741,
        "min_ms": 0.527044951915741,
        "max_ms": 0.527044951915741,
        "compile_time": 2.0658111572265625
    },
    {
        "BLOCK_SIZE_M": 512,
        "BLOCK_SIZE_N": 32,
        "BLOCK_SIZE_K": 32,
        "GROUP_SIZE_M": 8,
        "num_stages": 5,
        "num_warps": 16,
        "ms": 0.5270492434501648,
        "min_ms": 0.5270492434501648,
        "max_ms": 0.5270492434501648,
        "compile_time": 2.160231113433838
    },
    {
        "BLOCK_SIZE_M": 32,
        "BLOCK_SIZE_N": 64,
        "BLOCK_SIZE_K": 32,
        "GROUP_SIZE_M": 8,
        "num_stages": 3,
        "num_warps": 2,
        "ms": 0.527411162853241,
        "min_ms": 0.527411162853241,
        "max_ms": 0.527411162853241,
        "compile_time": 1.702726125717163
    },
    {
        "BLOCK_SIZE_M": 32,
        "BLOCK_SIZE_N": 64,
        "BLOCK_SIZE_K": 32,
        "GROUP_SIZE_M": 8,
        "num_stages": 7,
        "num_warps": 2,
        "ms": 0.527523398399353,
        "min_ms": 0.527523398399353,
        "max_ms": 0.527523398399353,
        "compile_time": 1.7975831031799316
    },
    {
        "BLOCK_SIZE_M": 64,
        "BLOCK_SIZE_N": 32,
        "BLOCK_SIZE_K": 64,
        "GROUP_SIZE_M": 8,
        "num_stages": 4,
