simdata/FP16-R100/3072_fails.json
[
    {
        "BLOCK_SIZE_M": 16,
        "BLOCK_SIZE_N": 16,
        "BLOCK_SIZE_K": 512,
        "GROUP_SIZE_M": 8,
        "num_stages": 7,
        "num_warps": 2,
        "compile_time": 1.430650234222412
    },
    {
        "BLOCK_SIZE_M": 16,
        "BLOCK_SIZE_N": 16,
        "BLOCK_SIZE_K": 512,
        "GROUP_SIZE_M": 8,
        "num_stages": 7,
        "num_warps": 4,
        "compile_time": 0.8652865886688232
    },
    {
        "BLOCK_SIZE_M": 16,
        "BLOCK_SIZE_N": 16,
        "BLOCK_SIZE_K": 512,
        "GROUP_SIZE_M": 8,
        "num_stages": 7,
        "num_warps": 8,
        "compile_time": 0.644984245300293
    },
    {
        "BLOCK_SIZE_M": 16,
        "BLOCK_SIZE_N": 16,
        "BLOCK_SIZE_K": 512,
        "GROUP_SIZE_M": 8,
        "num_stages": 7,
        "num_warps": 16,
        "compile_time": 0.5293526649475098
    },
    {
        "BLOCK_SIZE_M": 16,
        "BLOCK_SIZE_N": 16,
        "BLOCK_SIZE_K": 512,
        "GROUP_SIZE_M": 8,
        "num_stages": 7,
        "num_warps": 32,
        "compile_time": 0.480637788772583
    },
    {
        "BLOCK_SIZE_M": 16,
        "BLOCK_SIZE_N": 16,
        "BLOCK_SIZE_K": 512,
        "GROUP_SIZE_M": 8,
        "num_stages": 8,
        "num_warps": 2,
        "compile_time": 1.5458238124847412
    },
    {
        "BLOCK_SIZE_M": 16,
        "BLOCK_SIZE_N": 16,
        "BLOCK_SIZE_K": 512,
        "GROUP_SIZE_M": 8,
        "num_stages": 8,
        "num_warps": 4,
        "compile_time": 0.9177732467651367
    },
    {
        "BLOCK_SIZE_M": 16,
        "BLOCK_SIZE_N": 16,
        "BLOCK_SIZE_K": 512,
        "GROUP_SIZE_M": 8,
        "num_stages": 8,
        "num_warps": 8,
        "compile_time": 0.6667394638061523
    },
    {
        "BLOCK_SIZE_M": 16,
        "BLOCK_SIZE_N": 16,
        "BLOCK_SIZE_K": 512,
        "GROUP_SIZE_M": 8,
        "num_stages": 8,
        "num_warps": 16,
        "compile_time": 0.5472300052642822
    },
    {
        "BLOCK_SIZE_M": 16,
        "BLOCK_SIZE_N": 16,
        "BLOCK_SIZE_K": 512,
        "GROUP_SIZE_M": 8,
        "num_stages": 8,
        "num_warps": 32,
        "compile_time": 0.4962930679321289
    },
    {
        "BLOCK_SIZE_M": 16,
        "BLOCK_SIZE_N": 32,
        "BLOCK_SIZE_K": 256,
        "GROUP_SIZE_M": 8,
        "num_stages": 8,
        "num_warps": 2,
        "compile_time": 1.212996244430542
    },
    {
        "BLOCK_SIZE_M": 16,
        "BLOCK_SIZE_N": 32,
        "BLOCK_SIZE_K": 256,
        "GROUP_SIZE_M": 8,
        "num_stages": 8,
        "num_warps": 4,
        "compile_time": 0.7249517440795898
    },
    {
        "BLOCK_SIZE_M": 16,
        "BLOCK_SIZE_N": 32,
        "BLOCK_SIZE_K": 256,
        "GROUP_SIZE_M": 8,
        "num_stages": 8,
        "num_warps": 8,
        "compile_time": 0.5316071510314941
    },
    {
        "BLOCK_SIZE_M": 16,
        "BLOCK_SIZE_N": 32,
        "BLOCK_SIZE_K": 256,
        "GROUP_SIZE_M": 8,
        "num_stages": 8,
        "num_warps": 16,
        "compile_time": 0.44006943702697754
    },
    {
        "BLOCK_SIZE_M": 16,
        "BLOCK_SIZE_N": 32,
        "BLOCK_SIZE_K": 256,
        "GROUP_SIZE_M": 8,
        "num_stages": 8,
        "num_warps": 32,
        "compile_time": 0.39085841178894043
    },
    {
        "BLOCK_SIZE_M": 16,
        "BLOCK_SIZE_N": 32,
        "BLOCK_SIZE_K": 512,
        "GROUP_SIZE_M": 8,
        "num_stages": 5,
        "num_warps": 2,
        "compile_time": 2.390507459640503
    },
    {
        "BLOCK_SIZE_M": 16,
        "BLOCK_SIZE_N": 32,
        "BLOCK_SIZE_K": 512,
        "GROUP_SIZE_M": 8,
        "num_stages": 5,
        "num_warps": 4,
        "compile_time": 1.0733838081359863
    },
    {
        "BLOCK_SIZE_M": 16,
        "BLOCK_SIZE_N": 32,
        "BLOCK_SIZE_K": 512,
        "GROUP_SIZE_M": 8,
        "num_stages": 5,
        "num_warps": 8,
        "compile_time": 0.7153916358947754
    },
    {
        "BLOCK_SIZE_M": 16,
        "BLOCK_SIZE_N": 32,
        "BLOCK_SIZE_K": 512,
        "GROUP_SIZE_M": 8,
        "num_stages": 5,
        "num_warps": 16,
        "compile_time": 0.5774397850036621
    },
    {
        "BLOCK_SIZE_M": 16,
        "BLOCK_SIZE_N": 32,
        "BLOCK_SIZE_K": 512,
        "GROUP_SIZE_M": 8,
        "num_stages": 5,
        "num_warps": 32,
        "compile_time": 0.5099802017211914
    },
    {
        "BLOCK_SIZE_M": 16,
        "BLOCK_SIZE_N": 32,
        "BLOCK_SIZE_K": 512,
        "GROUP_SIZE_M": 8,
        "num_stages": 6,
        "num_warps": 2,
        "compile_time": 2.5142507553100586
    },
    {
        "BLOCK_SIZE_M": 16,
        "BLOCK_SIZE_N": 32,
        "BLOCK_SIZE_K": 512,
        "GROUP_SIZE_M": 8,
        "num_stages": 6,
        "num_warps": 4,
        "compile_time": 1.1395542621612549
    },
    {
        "BLOCK_SIZE_M": 16,
        "BLOCK_SIZE_N": 32,
        "BLOCK_SIZE_K": 512,
        "GROUP_SIZE_M": 8,
        "num_stages": 6,
        "num_warps": 8,
        "compile_time": 0.7472031116485596
    },
    {
        "BLOCK_SIZE_M": 16,
        "BLOCK_SIZE_N": 32,
        "BLOCK_SIZE_K": 512,
        "GROUP_SIZE_M": 8,
        "num_stages": 6,
        "num_warps": 16,
        "compile_time": 0.5819735527038574
    },
    {
        "BLOCK_SIZE_M": 16,
        "BLOCK_SIZE_N": 32,
        "BLOCK_SIZE_K": 512,
        "GROUP_SIZE_M": 8,
        "num_stages": 6,
        "num_warps": 32,
        "compile_time": 0.5188026428222656
    },
    {
        "BLOCK_SIZE_M": 16,
        "BLOCK_SIZE_N": 32,
        "BLOCK_SIZE_K": 512,
        "GROUP_SIZE_M": 8,
        "num_stages": 7,
        "num_warps": 2,
        "compile_time": 2.7364234924316406
    },
    {
        "BLOCK_SIZE_M": 16,
        "BLOCK_SIZE_N": 32,
        "BLOCK_SIZE_K": 512,
        "GROUP_SIZE_M": 8,
        "num_stages": 7,
        "num_warps": 4,
        "compile_time": 1.232259750366211
    },
    {
        "BLOCK_SIZE_M": 16,
        "BLOCK_SIZE_N": 32,
        "BLOCK_SIZE_K": 512,
        "GROUP_SIZE_M": 8,
        "num_stages": 7,
        "num_warps": 8,
        "compile_time": 0.8201394081115723
    },
    {
        "BLOCK_SIZE_M": 16,
        "BLOCK_SIZE_N": 32,
        "BLOCK_SIZE_K": 512,
        "GROUP_SIZE_M": 8,
        "num_stages": 7,
        "num_warps": 16,
        "compile_time": 0.6451480388641357
    },
    {
        "BLOCK_SIZE_M": 16,
        "BLOCK_SIZE_N": 32,
        "BLOCK_SIZE_K": 512,
        "GROUP_SIZE_M": 8,
        "num_stages": 7,
        "num_warps": 32,
        "compile_time": 0.559678316116333
    },
    {
        "BLOCK_SIZE_M": 16,
        "BLOCK_SIZE_N": 32,
        "BLOCK_SIZE_K": 512,
        "GROUP_SIZE_M": 8,
        "num_stages": 8,
        "num_warps": 2,
        "compile_time": 2.8394973278045654
    },
    {
        "BLOCK_SIZE_M": 16,
        "BLOCK_SIZE_N": 32,
        "BLOCK_SIZE_K": 512,
        "GROUP_SIZE_M": 8,
        "num_stages": 8,
        "num_warps": 4,
        "compile_time": 1.3306598663330078
    },
    {
        "BLOCK_SIZE_M": 16,
        "BLOCK_SIZE_N": 32,
        "BLOCK_SIZE_K": 512,
        "GROUP_SIZE_M": 8,
        "num_stages": 8,
        "num_warps": 8,
        "compile_time": 0.8599505424499512
    },
    {
        "BLOCK_SIZE_M": 16,
        "BLOCK_SIZE_N": 32,
        "BLOCK_SIZE_K": 512,
        "GROUP_SIZE_M": 8,
        "num_stages": 8,
        "num_warps": 16,
        "compile_time": 0.642383337020874
    },
    {
        "BLOCK_SIZE_M": 16,
        "BLOCK_SIZE_N": 32,
        "BLOCK_SIZE_K": 512,
        "GROUP_SIZE_M": 8,
        "num_stages": 8,
        "num_warps": 32,
        "compile_time": 0.5657520294189453
    },
    {
        "BLOCK_SIZE_M": 16,
        "BLOCK_SIZE_N": 64,
        "BLOCK_SIZE_K": 256,
        "GROUP_SIZE_M": 8,
        "num_stages": 6,
        "num_warps": 2,
        "compile_time": 2.22027325630188
    },
    {
        "BLOCK_SIZE_M": 16,
        "BLOCK_SIZE_N": 64,
        "BLOCK_SIZE_K": 256,
        "GROUP_SIZE_M": 8,
        "num_stages": 6,
        "num_warps": 4,
        "compile_time": 1.0150291919708252
    },
    {
        "BLOCK_SIZE_M": 16,
        "BLOCK_SIZE_N": 64,
        "BLOCK_SIZE_K": 256,
        "GROUP_SIZE_M": 8,
        "num_stages": 6,
        "num_warps": 8,
        "compile_time": 0.643496036529541
    },
    {
        "BLOCK_SIZE_M": 16,
        "BLOCK_SIZE_N": 64,
        "BLOCK_SIZE_K": 256,
        "GROUP_SIZE_M": 8,
        "num_stages": 6,
        "num_warps": 16,
        "compile_time": 0.5017232894897461
    },
    {
        "BLOCK_SIZE_M": 16,
        "BLOCK_SIZE_N": 64,
        "BLOCK_SIZE_K": 256,
        "GROUP_SIZE_M": 8,
        "num_stages": 6,
        "num_warps": 32,
        "compile_time": 0.43328332901000977
    },
    {
        "BLOCK_SIZE_M": 16,
        "BLOCK_SIZE_N": 64,
        "BLOCK_SIZE_K": 256,
        "GROUP_SIZE_M": 8,
        "num_stages": 7,
        "num_warps": 2,
        "compile_time": 2.3399510383605957
    },
    {
        "BLOCK_SIZE_M": 16,
        "BLOCK_SIZE_N": 64,
        "BLOCK_SIZE_K": 256,
        "GROUP_SIZE_M": 8,
        "num_stages": 7,
        "num_warps": 4,
        "compile_time": 1.1052742004394531
    },
    {
        "BLOCK_SIZE_M": 16,
        "BLOCK_SIZE_N": 64,
        "BLOCK_SIZE_K": 256,
        "GROUP_SIZE_M": 8,
        "num_stages": 7,
        "num_warps": 8,
        "compile_time": 0.6779377460479736
    },
    {
        "BLOCK_SIZE_M": 16,
        "BLOCK_SIZE_N": 64,
        "BLOCK_SIZE_K": 256,
        "GROUP_SIZE_M": 8,
        "num_stages": 7,
        "num_warps": 16,
        "compile_time": 0.5138599872589111
    },
    {
        "BLOCK_SIZE_M": 16,
        "BLOCK_SIZE_N": 64,
        "BLOCK_SIZE_K": 256,
        "GROUP_SIZE_M": 8,
        "num_stages": 7,
        "num_warps": 32,
        "compile_time": 0.4346468448638916
    },
    {
        "BLOCK_SIZE_M": 16,
        "BLOCK_SIZE_N": 64,
        "BLOCK_SIZE_K": 256,
        "GROUP_SIZE_M": 8,
        "num_stages": 8,
        "num_warps": 2,
        "compile_time": 2.510124683380127
    },
    {
        "BLOCK_SIZE_M": 16,
        "BLOCK_SIZE_N": 64,
        "BLOCK_SIZE_K": 256,
        "GROUP_SIZE_M": 8,
        "num_stages": 8,
        "num_warps": 4,
        "compile_time": 1.2001421451568604
    },
    {
        "BLOCK_SIZE_M": 16,
        "BLOCK_SIZE_N": 64,
        "BLOCK_SIZE_K": 256,
        "GROUP_SIZE_M": 8,
        "num_stages": 8,
        "num_warps": 8,
        "compile_time": 0.7347695827484131
    },
    {
        "BLOCK_SIZE_M": 16,
        "BLOCK_SIZE_N": 64,
        "BLOCK_SIZE_K": 256,
        "GROUP_SIZE_M": 8,
        "num_stages": 8,
        "num_warps": 16,
        "compile_time": 0.0065402984619140625
    },
    {
        "BLOCK_SIZE_M": 16,
        "BLOCK_SIZE_N": 64,
        "BLOCK_SIZE_K": 256,
        "GROUP_SIZE_M": 8,
        "num_stages": 8,
        "num_warps": 32,
        "compile_time": 0.463620662689209
    },
    {
        "BLOCK_SIZE_M": 16,
        "BLOCK_SIZE_N": 64,
        "BLOCK_SIZE_K": 512,
        "GROUP_SIZE_M": 8,
        "num_stages": 3,
        "num_warps": 2,
        "compile_time": 10.74049687385559
    },
    {
        "BLOCK_SIZE_M": 16,
        "BLOCK_SIZE_N": 64,
        "BLOCK_SIZE_K": 512,
        "GROUP_SIZE_M": 8,
        "num_stages": 4,
        "num_warps": 2,
        "compile_time": 10.78139591217041
    },
    {
        "BLOCK_SIZE_M": 16,
        "BLOCK_SIZE_N": 64,
        "BLOCK_SIZE_K": 512,
        "GROUP_SIZE_M": 8,
        "num_stages": 4,
        "num_warps": 4,
        "compile_time": 2.0199503898620605
    },
    {
        "BLOCK_SIZE_M": 16,
        "BLOCK_SIZE_N": 64,
        "BLOCK_SIZE_K": 512,
        "GROUP_SIZE_M": 8,
        "num_stages": 4,
        "num_warps": 8,
        "compile_time": 0.9379043579101562
    },
    {
        "BLOCK_SIZE_M": 16,
        "BLOCK_SIZE_N": 64,
        "BLOCK_SIZE_K": 512,
        "GROUP_SIZE_M": 8,
        "num_stages": 4,
        "num_warps": 16,
        "compile_time": 0.68096923828125
    },
    {
        "BLOCK_SIZE_M": 16,
        "BLOCK_SIZE_N": 64,
        "BLOCK_SIZE_K": 512,
        "GROUP_SIZE_M": 8,
        "num_stages": 4,
        "num_warps": 32,
        "compile_time": 0.005304574966430664
    },
    {
        "BLOCK_SIZE_M": 16,
        "BLOCK_SIZE_N": 64,
        "BLOCK_SIZE_K": 512,
        "GROUP_SIZE_M": 8,
        "num_stages": 5,
        "num_warps": 2,
        "compile_time": 10.872092485427856
    },
    {
        "BLOCK_SIZE_M": 16,
        "BLOCK_SIZE_N": 64,
        "BLOCK_SIZE_K": 512,
        "GROUP_SIZE_M": 8,
        "num_stages": 5,
        "num_warps": 4,
        "compile_time": 2.18268084526062
    },
    {
        "BLOCK_SIZE_M": 16,
        "BLOCK_SIZE_N": 64,
        "BLOCK_SIZE_K": 512,
        "GROUP_SIZE_M": 8,
        "num_stages": 5,
        "num_warps": 8,
        "compile_time": 1.0479822158813477
    },
    {
        "BLOCK_SIZE_M": 16,
        "BLOCK_SIZE_N": 64,
        "BLOCK_SIZE_K": 512,
        "GROUP_SIZE_M": 8,
        "num_stages": 5,
        "num_warps": 16,
        "compile_time": 0.7272295951843262
    },
    {
        "BLOCK_SIZE_M": 16,
        "BLOCK_SIZE_N": 64,
        "BLOCK_SIZE_K": 512,
        "GROUP_SIZE_M": 8,
        "num_stages": 5,
        "num_warps": 32,
        "compile_time": 0.5869472026824951
    },
    {
        "BLOCK_SIZE_M": 16,
        "BLOCK_SIZE_N": 64,
        "BLOCK_SIZE_K": 512,
        "GROUP_SIZE_M": 8,
        "num_stages": 6,
        "num_warps": 2,
        "compile_time": 11.363241195678711
    },
    {
        "BLOCK_SIZE_M": 16,
        "BLOCK_SIZE_N": 64,
        "BLOCK_SIZE_K": 512,
        "GROUP_SIZE_M": 8,
        "num_stages": 6,
        "num_warps": 4,
        "compile_time": 2.3826889991760254
    },
    {
        "BLOCK_SIZE_M": 16,
        "BLOCK_SIZE_N": 64,
        "BLOCK_SIZE_K": 512,
        "GROUP_SIZE_M": 8,
        "num_stages": 6,
        "num_warps": 8,
        "compile_time": 1.1272366046905518
    },
    {
        "BLOCK_SIZE_M": 16,
        "BLOCK_SIZE_N": 64,
        "BLOCK_SIZE_K": 512,
        "GROUP_SIZE_M": 8,
        "num_stages": 6,
        "num_warps": 16,
        "compile_time": 0.7711014747619629
    },
    {
        "BLOCK_SIZE_M": 16,
        "BLOCK_SIZE_N": 64,
        "BLOCK_SIZE_K": 512,
        "GROUP_SIZE_M": 8,
        "num_stages": 6,
        "num_warps": 32,
        "compile_time": 0.6221086978912354
    },
    {
        "BLOCK_SIZE_M": 16,
        "BLOCK_SIZE_N": 64,
        "BLOCK_SIZE_K": 512,
        "GROUP_SIZE_M": 8,
        "num_stages": 7,
        "num_warps": 2,
        "compile_time": 11.35549259185791
    },
    {
        "BLOCK_SIZE_M": 16,
        "BLOCK_SIZE_N": 64,
        "BLOCK_SIZE_K": 512,
        "GROUP_SIZE_M": 8,
        "num_stages": 7,
        "num_warps": 4,
        "compile_time": 2.496044158935547
    },
    {
        "BLOCK_SIZE_M": 16,
        "BLOCK_SIZE_N": 64,
        "BLOCK_SIZE_K": 512,
        "GROUP_SIZE_M": 8,
        "num_stages": 7,
        "num_warps": 8,
        "compile_time": 1.214888572692871
    },
    {
        "BLOCK_SIZE_M": 16,
        "BLOCK_SIZE_N": 64,
        "BLOCK_SIZE_K": 512,
        "GROUP_SIZE_M": 8,
        "num_stages": 7,
        "num_warps": 16,
        "compile_time": 0.8192977905273438
    },
    {
        "BLOCK_SIZE_M": 16,
        "BLOCK_SIZE_N": 64,
        "BLOCK_SIZE_K": 512,
        "GROUP_SIZE_M": 8,
        "num_stages": 7,
        "num_warps": 32,
        "compile_time": 0.005440950393676758
    },
    {
        "BLOCK_SIZE_M": 16,
        "BLOCK_SIZE_N": 64,
        "BLOCK_SIZE_K": 512,
        "GROUP_SIZE_M": 8,
        "num_stages": 8,
        "num_warps": 2,
        "compile_time": 11.7962064743042
    },
    {
        "BLOCK_SIZE_M": 16,
        "BLOCK_SIZE_N": 64,
        "BLOCK_SIZE_K": 512,
        "GROUP_SIZE_M": 8,
        "num_stages": 8,
        "num_warps": 4,
        "compile_time": 2.622716188430786
    },
    {
        "BLOCK_SIZE_M": 16,
        "BLOCK_SIZE_N": 64,
        "BLOCK_SIZE_K": 512,
        "GROUP_SIZE_M": 8,
        "num_stages": 8,
        "num_warps": 8,
        "compile_time": 1.2865431308746338
    },
    {
        "BLOCK_SIZE_M": 16,
        "BLOCK_SIZE_N": 64,
        "BLOCK_SIZE_K": 512,
        "GROUP_SIZE_M": 8,
        "num_stages": 8,
        "num_warps": 16,
        "compile_time": 0.8629076480865479
    },
    {
        "BLOCK_SIZE_M": 16,
        "BLOCK_SIZE_N": 64,
        "BLOCK_SIZE_K": 512,
        "GROUP_SIZE_M": 8,
        "num_stages": 8,
        "num_warps": 32,
        "compile_time": 0.6992614269256592
    },
    {
        "BLOCK_SIZE_M": 16,
        "BLOCK_SIZE_N": 128,
        "BLOCK_SIZE_K": 128,
        "GROUP_SIZE_M": 8,
        "num_stages": 6,
        "num_warps": 2,
        "compile_time": 2.1786141395568848
    },
    {
        "BLOCK_SIZE_M": 16,
        "BLOCK_SIZE_N": 128,
        "BLOCK_SIZE_K": 128,
        "GROUP_SIZE_M": 8,
        "num_stages": 6,
        "num_warps": 4,
        "compile_time": 0.9991843700408936
    },
    {
        "BLOCK_SIZE_M": 16,
        "BLOCK_SIZE_N": 128,
        "BLOCK_SIZE_K": 128,
        "GROUP_SIZE_M": 8,
        "num_stages": 6,
        "num_warps": 8,
        "compile_time": 0.584068775177002
    },
    {
        "BLOCK_SIZE_M": 16,
        "BLOCK_SIZE_N": 128,
        "BLOCK_SIZE_K": 128,
        "GROUP_SIZE_M": 8,
        "num_stages": 6,
        "num_warps": 16,
        "compile_time": 0.45199060440063477
    },
    {
        "BLOCK_SIZE_M": 16,
        "BLOCK_SIZE_N": 128,
        "BLOCK_SIZE_K": 128,
        "GROUP_SIZE_M": 8,
        "num_stages": 6,
        "num_warps": 32,
        "compile_time": 0.39597129821777344
    },
    {
        "BLOCK_SIZE_M": 16,
        "BLOCK_SIZE_N": 128,
        "BLOCK_SIZE_K": 128,
        "GROUP_SIZE_M": 8,
        "num_stages": 7,
        "num_warps": 2,
        "compile_time": 2.28774356842041
    },
    {
        "BLOCK_SIZE_M": 16,
        "BLOCK_SIZE_N": 128,
        "BLOCK_SIZE_K": 128,
        "GROUP_SIZE_M": 8,
        "num_stages": 7,
        "num_warps": 4,
        "compile_time": 1.0771851539611816
    },
    {
        "BLOCK_SIZE_M": 16,
        "BLOCK_SIZE_N": 128,
        "BLOCK_SIZE_K": 128,
        "GROUP_SIZE_M": 8,
        "num_stages": 7,
        "num_warps": 8,
        "compile_time": 0.6317594051361084
    },
    {
        "BLOCK_SIZE_M": 16,
        "BLOCK_SIZE_N": 128,
        "BLOCK_SIZE_K": 128,
        "GROUP_SIZE_M": 8,
        "num_stages": 7,
        "num_warps": 16,
        "compile_time": 0.4668877124786377
    },
    {
        "BLOCK_SIZE_M": 16,
        "BLOCK_SIZE_N": 128,
        "BLOCK_SIZE_K": 128,
        "GROUP_SIZE_M": 8,
        "num_stages": 7,
        "num_warps": 32,
        "compile_time": 0.4019768238067627
    },
    {
        "BLOCK_SIZE_M": 16,
        "BLOCK_SIZE_N": 128,
        "BLOCK_SIZE_K": 128,
        "GROUP_SIZE_M": 8,
        "num_stages": 8,
        "num_warps": 2,
        "compile_time": 2.420750141143799
    },
    {
        "BLOCK_SIZE_M": 16,
        "BLOCK_SIZE_N": 128,
        "BLOCK_SIZE_K": 128,
        "GROUP_SIZE_M": 8,
        "num_stages": 8,
        "num_warps": 4,
        "compile_time": 1.1468312740325928
    },
    {
        "BLOCK_SIZE_M": 16,
        "BLOCK_SIZE_N": 128,
        "BLOCK_SIZE_K": 128,
        "GROUP_SIZE_M": 8,
        "num_stages": 8,
        "num_warps": 8,
        "compile_time": 0.670297384262085
    },
    {
        "BLOCK_SIZE_M": 16,
        "BLOCK_SIZE_N": 128,
        "BLOCK_SIZE_K": 128,
        "GROUP_SIZE_M": 8,
        "num_stages": 8,
        "num_warps": 16,
        "compile_time": 0.4932072162628174
    },
    {
        "BLOCK_SIZE_M": 16,
        "BLOCK_SIZE_N": 128,
        "BLOCK_SIZE_K": 128,
        "GROUP_SIZE_M": 8,
        "num_stages": 8,
        "num_warps": 32,
        "compile_time": 0.41387486457824707
    },
    {
        "BLOCK_SIZE_M": 16,
        "BLOCK_SIZE_N": 128,
        "BLOCK_SIZE_K": 256,
        "GROUP_SIZE_M": 8,
        "num_stages": 3,
        "num_warps": 2,
        "compile_time": 10.99239706993103
    },
    {
        "BLOCK_SIZE_M": 16,
        "BLOCK_SIZE_N": 128,
        "BLOCK_SIZE_K": 256,
        "GROUP_SIZE_M": 8,
        "num_stages": 4,
        "num_warps": 2,
        "compile_time": 10.910336971282959
    },
    {
        "BLOCK_SIZE_M": 16,
        "BLOCK_SIZE_N": 128,
        "BLOCK_SIZE_K": 256,
        "GROUP_SIZE_M": 8,
        "num_stages": 4,
        "num_warps": 4,
        "compile_time": 1.9212026596069336
    },
    {
        "BLOCK_SIZE_M": 16,
        "BLOCK_SIZE_N": 128,
        "BLOCK_SIZE_K": 256,
        "GROUP_SIZE_M": 8,
        "num_stages": 4,
        "num_warps": 8,
        "compile_time": 0.9131221771240234
    },
    {
        "BLOCK_SIZE_M": 16,
        "BLOCK_SIZE_N": 128,
        "BLOCK_SIZE_K": 256,
        "GROUP_SIZE_M": 8,
        "num_stages": 4,
        "num_warps": 16,
        "compile_time": 0.585014820098877
    },
    {
        "BLOCK_SIZE_M": 16,
        "BLOCK_SIZE_N": 128,
        "BLOCK_SIZE_K": 256,
        "GROUP_SIZE_M": 8,
        "num_stages": 4,
        "num_warps": 32,
        "compile_time": 0.4750652313232422
    },
    {
        "BLOCK_SIZE_M": 16,
        "BLOCK_SIZE_N": 128,
        "BLOCK_SIZE_K": 256,
        "GROUP_SIZE_M": 8,
        "num_stages": 5,
        "num_warps": 2,
        "compile_time": 10.857329607009888
    },
    {
        "BLOCK_SIZE_M": 16,
        "BLOCK_SIZE_N": 128,
        "BLOCK_SIZE_K": 256,
        "GROUP_SIZE_M": 8,
        "num_stages": 5,
        "num_warps": 4,
        "compile_time": 2.047003984451294
    },
    {
        "BLOCK_SIZE_M": 16,
        "BLOCK_SIZE_N": 128,
        "BLOCK_SIZE_K": 256,
        "GROUP_SIZE_M": 8,
        "num_stages": 5,
        "num_warps": 8,
        "compile_time": 0.9799718856811523
    },
    {
        "BLOCK_SIZE_M": 16,
        "BLOCK_SIZE_N": 128,
        "BLOCK_SIZE_K": 256,
        "GROUP_SIZE_M": 8,
        "num_stages": 5,
        "num_warps": 16,
        "compile_time": 0.631279706954956
    },
    {
        "BLOCK_SIZE_M": 16,
        "BLOCK_SIZE_N": 128,
        "BLOCK_SIZE_K": 256,
        "GROUP_SIZE_M": 8,
        "num_stages": 5,
        "num_warps": 32,
        "compile_time": 0.4987607002258301
    },
    {
        "BLOCK_SIZE_M": 16,
        "BLOCK_SIZE_N": 128,
        "BLOCK_SIZE_K": 256,
        "GROUP_SIZE_M": 8,
        "num_stages": 6,
        "num_warps": 2,
        "compile_time": 11.054878950119019
    },
    {
        "BLOCK_SIZE_M": 16,
        "BLOCK_SIZE_N": 128,
        "BLOCK_SIZE_K": 256,
        "GROUP_SIZE_M": 8,
        "num_stages": 6,
        "num_warps": 4,
        "compile_time": 2.2113256454467773
    },
    {
        "BLOCK_SIZE_M": 16,
        "BLOCK_SIZE_N": 128,
        "BLOCK_SIZE_K": 256,
        "GROUP_SIZE_M": 8,
        "num_stages": 6,
        "num_warps": 8,
        "compile_time": 1.0548672676086426
    },
    {
        "BLOCK_SIZE_M": 16,
        "BLOCK_SIZE_N": 128,
        "BLOCK_SIZE_K": 256,
        "GROUP_SIZE_M": 8,
        "num_stages": 6,
        "num_warps": 16,
        "compile_time": 0.6686420440673828
    },
    {
        "BLOCK_SIZE_M": 16,
        "BLOCK_SIZE_N": 128,
        "BLOCK_SIZE_K": 256,
        "GROUP_SIZE_M": 8,
        "num_stages": 6,
        "num_warps": 32,
        "compile_time": 0.005214214324951172
    },
    {
        "BLOCK_SIZE_M": 16,
        "BLOCK_SIZE_N": 128,
        "BLOCK_SIZE_K": 256,
        "GROUP_SIZE_M": 8,
        "num_stages": 7,
        "num_warps": 2,
        "compile_time": 11.256661176681519
    },
    {
        "BLOCK_SIZE_M": 16,
        "BLOCK_SIZE_N": 128,
        "BLOCK_SIZE_K": 256,
        "GROUP_SIZE_M": 8,
        "num_stages": 7,
        "num_warps": 4,
        "compile_time": 2.3840837478637695
    },
    {
        "BLOCK_SIZE_M": 16,
        "BLOCK_SIZE_N": 128,
        "BLOCK_SIZE_K": 256,
        "GROUP_SIZE_M": 8,
        "num_stages": 7,
        "num_warps": 8,
        "compile_time": 1.1363482475280762
    },
    {
        "BLOCK_SIZE_M": 16,
        "BLOCK_SIZE_N": 128,
        "BLOCK_SIZE_K": 256,
        "GROUP_SIZE_M": 8,
        "num_stages": 7,
        "num_warps": 16,
        "compile_time": 0.7154138088226318
    },
    {
        "BLOCK_SIZE_M": 16,
        "BLOCK_SIZE_N": 128,
        "BLOCK_SIZE_K": 256,
        "GROUP_SIZE_M": 8,
        "num_stages": 7,
        "num_warps": 32,
        "compile_time": 0.5535633563995361
    },
    {
        "BLOCK_SIZE_M": 16,
        "BLOCK_SIZE_N": 128,
        "BLOCK_SIZE_K": 256,
        "GROUP_SIZE_M": 8,
        "num_stages": 8,
        "num_warps": 2,
        "compile_time": 11.437949895858765
    },
    {
        "BLOCK_SIZE_M": 16,
        "BLOCK_SIZE_N": 128,
        "BLOCK_SIZE_K": 256,
        "GROUP_SIZE_M": 8,
        "num_stages": 8,
        "num_warps": 4,
        "compile_time": 2.4945895671844482
    },
    {
        "BLOCK_SIZE_M": 16,
        "BLOCK_SIZE_N": 128,
        "BLOCK_SIZE_K": 256,
        "GROUP_SIZE_M": 8,
        "num_stages": 8,
        "num_warps": 8,
        "compile_time": 1.219228982925415
    },
    {
        "BLOCK_SIZE_M": 16,
        "BLOCK_SIZE_N": 128,
        "BLOCK_SIZE_K": 256,
        "GROUP_SIZE_M": 8,
        "num_stages": 8,
        "num_warps": 16,
        "compile_time": 0.7627482414245605
    },
    {
        "BLOCK_SIZE_M": 16,
        "BLOCK_SIZE_N": 128,
        "BLOCK_SIZE_K": 256,
        "GROUP_SIZE_M": 8,
        "num_stages": 8,
        "num_warps": 32,
        "compile_time": 0.5817983150482178
    },
    {
        "BLOCK_SIZE_M": 16,
        "BLOCK_SIZE_N": 128,
        "BLOCK_SIZE_K": 512,
        "GROUP_SIZE_M": 8,
        "num_stages": 1,
        "num_warps": 2,
        "compile_time": 7.9786741733551025
    },
    {
        "BLOCK_SIZE_M": 16,
        "BLOCK_SIZE_N": 128,
        "BLOCK_SIZE_K": 512,
        "GROUP_SIZE_M": 8,
        "num_stages": 2,
        "num_warps": 2,
        "compile_time": 7.97059178352356
    },
    {
        "BLOCK_SIZE_M": 16,
        "BLOCK_SIZE_N": 128,
        "BLOCK_SIZE_K": 512,
        "GROUP_SIZE_M": 8,
        "num_stages": 3,
        "num_warps": 2,
        "compile_time": 118.1112949848175
    },
    {
        "BLOCK_SIZE_M": 16,
        "BLOCK_SIZE_N": 128,
        "BLOCK_SIZE_K": 512,
        "GROUP_SIZE_M": 8,
        "num_stages": 3,
        "num_warps": 4,
        "compile_time": 10.663347005844116
    },
    {
        "BLOCK_SIZE_M": 16,
        "BLOCK_SIZE_N": 128,
        "BLOCK_SIZE_K": 512,
        "GROUP_SIZE_M": 8,
        "num_stages": 3,
        "num_warps": 8,
        "compile_time": 0.004367351531982422
    },
    {
        "BLOCK_SIZE_M": 16,
        "BLOCK_SIZE_N": 128,
        "BLOCK_SIZE_K": 512,
        "GROUP_SIZE_M": 8,
        "num_stages": 3,
        "num_warps": 16,
        "compile_time": 0.0034334659576416016
    },
    {
        "BLOCK_SIZE_M": 16,
        "BLOCK_SIZE_N": 128,
        "BLOCK_SIZE_K": 512,
        "GROUP_SIZE_M": 8,
        "num_stages": 3,
        "num_warps": 32,
        "compile_time": 0.003195047378540039
    },
    {
        "BLOCK_SIZE_M": 16,
        "BLOCK_SIZE_N": 128,
        "BLOCK_SIZE_K": 512,
        "GROUP_SIZE_M": 8,
        "num_stages": 4,
        "num_warps": 2,
        "compile_time": 6.0391387939453125
    },
    {
        "BLOCK_SIZE_M": 16,
        "BLOCK_SIZE_N": 128,
        "BLOCK_SIZE_K": 512,
        "GROUP_SIZE_M": 8,
        "num_stages": 4,
        "num_warps": 4,
        "compile_time": 10.902978897094727
    },
    {
        "BLOCK_SIZE_M": 16,
        "BLOCK_SIZE_N": 128,
        "BLOCK_SIZE_K": 512,
        "GROUP_SIZE_M": 8,
        "num_stages": 4,
        "num_warps": 8,
        "compile_time": 0.006147623062133789
    },
    {
        "BLOCK_SIZE_M": 16,
        "BLOCK_SIZE_N": 128,
        "BLOCK_SIZE_K": 512,
        "GROUP_SIZE_M": 8,
        "num_stages": 4,
        "num_warps": 16,
        "compile_time": 0.003253459930419922
    },
    {
        "BLOCK_SIZE_M": 16,
        "BLOCK_SIZE_N": 128,
        "BLOCK_SIZE_K": 512,
        "GROUP_SIZE_M": 8,
        "num_stages": 4,
        "num_warps": 32,
        "compile_time": 0.0031859874725341797
    },
    {
        "BLOCK_SIZE_M": 16,
        "BLOCK_SIZE_N": 128,
        "BLOCK_SIZE_K": 512,
        "GROUP_SIZE_M": 8,
        "num_stages": 5,
        "num_warps": 2,
        "compile_time": 6.279541254043579
    },
    {
        "BLOCK_SIZE_M": 16,
        "BLOCK_SIZE_N": 128,
        "BLOCK_SIZE_K": 512,
        "GROUP_SIZE_M": 8,
        "num_stages": 5,
        "num_warps": 4,
        "compile_time": 11.452780961990356
    },
    {
        "BLOCK_SIZE_M": 16,
        "BLOCK_SIZE_N": 128,
        "BLOCK_SIZE_K": 512,
        "GROUP_SIZE_M": 8,
        "num_stages": 5,
        "num_warps": 8,
        "compile_time": 0.004271030426025391
    },
    {
        "BLOCK_SIZE_M": 16,
        "BLOCK_SIZE_N": 128,
        "BLOCK_SIZE_K": 512,
        "GROUP_SIZE_M": 8,
        "num_stages": 5,
        "num_warps": 16,
        "compile_time": 0.003261089324951172
    },
    {
        "BLOCK_SIZE_M": 16,
        "BLOCK_SIZE_N": 128,
        "BLOCK_SIZE_K": 512,
        "GROUP_SIZE_M": 8,
        "num_stages": 5,
        "num_warps": 32,
        "compile_time": 0.0031511783599853516
    },
    {
        "BLOCK_SIZE_M": 16,
        "BLOCK_SIZE_N": 128,
        "BLOCK_SIZE_K": 512,
        "GROUP_SIZE_M": 8,
        "num_stages": 6,
        "num_warps": 2,
        "compile_time": 6.633535623550415
    },
    {
        "BLOCK_SIZE_M": 16,
        "BLOCK_SIZE_N": 128,
        "BLOCK_SIZE_K": 512,
        "GROUP_SIZE_M": 8,
        "num_stages": 6,
        "num_warps": 4,
        "compile_time": 10.817015409469604
    },
    {
        "BLOCK_SIZE_M": 16,
        "BLOCK_SIZE_N": 128,
        "BLOCK_SIZE_K": 512,
        "GROUP_SIZE_M": 8,
        "num_stages": 6,
        "num_warps": 8,
        "compile_time": 0.004441022872924805
    },
    {
        "BLOCK_SIZE_M": 16,
        "BLOCK_SIZE_N": 128,
        "BLOCK_SIZE_K": 512,
        "GROUP_SIZE_M": 8,
        "num_stages": 6,
        "num_warps": 16,
        "compile_time": 0.003237485885620117
    },
    {
        "BLOCK_SIZE_M": 16,
        "BLOCK_SIZE_N": 128,
        "BLOCK_SIZE_K": 512,
        "GROUP_SIZE_M": 8,
        "num_stages": 6,
        "num_warps": 32,
        "compile_time": 0.003173351287841797
    },
    {
        "BLOCK_SIZE_M": 16,
        "BLOCK_SIZE_N": 128,
        "BLOCK_SIZE_K": 512,
        "GROUP_SIZE_M": 8,
        "num_stages": 7,
        "num_warps": 2,
        "compile_time": 6.967973947525024
    },
    {
        "BLOCK_SIZE_M": 16,
        "BLOCK_SIZE_N": 128,
        "BLOCK_SIZE_K": 512,
        "GROUP_SIZE_M": 8,
        "num_stages": 7,
        "num_warps": 4,
        "compile_time": 11.140270471572876
    },
    {
        "BLOCK_SIZE_M": 16,
        "BLOCK_SIZE_N": 128,
        "BLOCK_SIZE_K": 512,
        "GROUP_SIZE_M": 8,
        "num_stages": 7,
        "num_warps": 8,
        "compile_time": 0.0045621395111083984
    },
    {
        "BLOCK_SIZE_M": 16,
        "BLOCK_SIZE_N": 128,
        "BLOCK_SIZE_K": 512,
        "GROUP_SIZE_M": 8,
        "num_stages": 7,
        "num_warps": 16,
        "compile_time": 0.00328826904296875
    },
    {
        "BLOCK_SIZE_M": 16,
        "BLOCK_SIZE_N": 128,
        "BLOCK_SIZE_K": 512,
        "GROUP_SIZE_M": 8,
        "num_stages": 7,
        "num_warps": 32,
        "compile_time": 0.8311600685119629
    },
    {
        "BLOCK_SIZE_M": 16,
        "BLOCK_SIZE_N": 128,
        "BLOCK_SIZE_K": 512,
        "GROUP_SIZE_M": 8,
        "num_stages": 8,
        "num_warps": 2,
        "compile_time": 7.35947322845459
    },
    {
        "BLOCK_SIZE_M": 16,
        "BLOCK_SIZE_N": 128,
        "BLOCK_SIZE_K": 512,
        "GROUP_SIZE_M": 8,
        "num_stages": 8,
        "num_warps": 4,
        "compile_time": 11.651879787445068
    },
    {
        "BLOCK_SIZE_M": 16,
        "BLOCK_SIZE_N": 128,
        "BLOCK_SIZE_K": 512,
        "GROUP_SIZE_M": 8,
        "num_stages": 8,
        "num_warps": 8,
        "compile_time": 2.629643440246582
    },
    {
        "BLOCK_SIZE_M": 16,
        "BLOCK_SIZE_N": 128,
        "BLOCK_SIZE_K": 512,
        "GROUP_SIZE_M": 8,
        "num_stages": 8,
        "num_warps": 16,
        "compile_time": 1.3496086597442627
    },
    {
        "BLOCK_SIZE_M": 16,
        "BLOCK_SIZE_N": 128,
        "BLOCK_SIZE_K": 512,
        "GROUP_SIZE_M": 8,
        "num_stages": 8,
        "num_warps": 32,
        "compile_time": 0.8751788139343262
    },
    {
        "BLOCK_SIZE_M": 16,
        "BLOCK_SIZE_N": 256,
        "BLOCK_SIZE_K": 64,
        "GROUP_SIZE_M": 8,
        "num_stages": 6,
        "num_warps": 2,
        "compile_time": 2.311946392059326
    },
    {
        "BLOCK_SIZE_M": 16,
        "BLOCK_SIZE_N": 256,
        "BLOCK_SIZE_K": 64,
        "GROUP_SIZE_M": 8,
        "num_stages": 6,
        "num_warps": 4,
        "compile_time": 1.045161247253418
    },
    {
        "BLOCK_SIZE_M": 16,
        "BLOCK_SIZE_N": 256,
        "BLOCK_SIZE_K": 64,
        "GROUP_SIZE_M": 8,
        "num_stages": 6,
        "num_warps": 8,
        "compile_time": 0.6059796810150146
    },
    {
        "BLOCK_SIZE_M": 16,
        "BLOCK_SIZE_N": 256,
        "BLOCK_SIZE_K": 64,
        "GROUP_SIZE_M": 8,
        "num_stages": 6,
        "num_warps": 16,
        "compile_time": 0.4474644660949707
    },
    {
        "BLOCK_SIZE_M": 16,
        "BLOCK_SIZE_N": 256,
        "BLOCK_SIZE_K": 64,
        "GROUP_SIZE_M": 8,
        "num_stages": 7,
        "num_warps": 2,
        "compile_time": 2.4662320613861084
    },
    {
        "BLOCK_SIZE_M": 16,
        "BLOCK_SIZE_N": 256,
        "BLOCK_SIZE_K": 64,
        "GROUP_SIZE_M": 8,
        "num_stages": 7,
        "num_warps": 4,
        "compile_time": 1.119267463684082
    },
    {
        "BLOCK_SIZE_M": 16,
        "BLOCK_SIZE_N": 256,
        "BLOCK_SIZE_K": 64,
        "GROUP_SIZE_M": 8,
        "num_stages": 7,
        "num_warps": 8,
        "compile_time": 0.6582355499267578
    },
    {
        "BLOCK_SIZE_M": 16,
        "BLOCK_SIZE_N": 256,
        "BLOCK_SIZE_K": 64,
        "GROUP_SIZE_M": 8,
        "num_stages": 7,
        "num_warps": 16,
        "compile_time": 0.46886563301086426
    },
    {
        "BLOCK_SIZE_M": 16,
        "BLOCK_SIZE_N": 256,
        "BLOCK_SIZE_K": 64,
        "GROUP_SIZE_M": 8,
        "num_stages": 7,
        "num_warps": 32,
        "compile_time": 0.36785888671875
    },
    {
        "BLOCK_SIZE_M": 16,
        "BLOCK_SIZE_N": 256,
        "BLOCK_SIZE_K": 64,
        "GROUP_SIZE_M": 8,
        "num_stages": 8,
        "num_warps": 2,
        "compile_time": 2.5817410945892334
    },
    {
        "BLOCK_SIZE_M": 16,
        "BLOCK_SIZE_N": 256,
        "BLOCK_SIZE_K": 64,
        "GROUP_SIZE_M": 8,
        "num_stages": 8,
        "num_warps": 4,
        "compile_time": 1.166095495223999
    },
    {
        "BLOCK_SIZE_M": 16,
        "BLOCK_SIZE_N": 256,
        "BLOCK_SIZE_K": 64,
        "GROUP_SIZE_M": 8,
        "num_stages": 8,
        "num_warps": 8,
        "compile_time": 0.68886399269104
    },
    {
        "BLOCK_SIZE_M": 16,
        "BLOCK_SIZE_N": 256,
        "BLOCK_SIZE_K": 64,
        "GROUP_SIZE_M": 8,
        "num_stages": 8,
        "num_warps": 16,
        "compile_time": 0.5020005702972412
    },
    {
        "BLOCK_SIZE_M": 16,
        "BLOCK_SIZE_N": 256,
        "BLOCK_SIZE_K": 64,
        "GROUP_SIZE_M": 8,
        "num_stages": 8,
        "num_warps": 32,
        "compile_time": 0.39134931564331055
    },
    {
        "BLOCK_SIZE_M": 16,
        "BLOCK_SIZE_N": 256,
        "BLOCK_SIZE_K": 128,
        "GROUP_SIZE_M": 8,
        "num_stages": 3,
        "num_warps": 2,
        "compile_time": 10.481384992599487
    },
    {
        "BLOCK_SIZE_M": 16,
        "BLOCK_SIZE_N": 256,
        "BLOCK_SIZE_K": 128,
        "GROUP_SIZE_M": 8,
        "num_stages": 4,
        "num_warps": 2,
        "compile_time": 10.926679849624634
    },
    {
        "BLOCK_SIZE_M": 16,
        "BLOCK_SIZE_N": 256,
        "BLOCK_SIZE_K": 128,
        "GROUP_SIZE_M": 8,
        "num_stages": 4,
        "num_warps": 4,
        "compile_time": 1.928924560546875
    },
    {
        "BLOCK_SIZE_M": 16,
        "BLOCK_SIZE_N": 256,
        "BLOCK_SIZE_K": 128,
        "GROUP_SIZE_M": 8,
        "num_stages": 4,
        "num_warps": 8,
        "compile_time": 0.9096505641937256
    },
    {
        "BLOCK_SIZE_M": 16,
        "BLOCK_SIZE_N": 256,
        "BLOCK_SIZE_K": 128,
        "GROUP_SIZE_M": 8,
        "num_stages": 4,
        "num_warps": 16,
        "compile_time": 0.01022958755493164
    },
    {
        "BLOCK_SIZE_M": 16,
        "BLOCK_SIZE_N": 256,
        "BLOCK_SIZE_K": 128,
        "GROUP_SIZE_M": 8,
        "num_stages": 4,
        "num_warps": 32,
        "compile_time": 0.43560147285461426
    },
    {
        "BLOCK_SIZE_M": 16,
        "BLOCK_SIZE_N": 256,
        "BLOCK_SIZE_K": 128,
        "GROUP_SIZE_M": 8,
        "num_stages": 5,
        "num_warps": 2,
        "compile_time": 11.332948684692383
    },
    {
        "BLOCK_SIZE_M": 16,
        "BLOCK_SIZE_N": 256,
        "BLOCK_SIZE_K": 128,
        "GROUP_SIZE_M": 8,
        "num_stages": 5,
        "num_warps": 4,
        "compile_time": 2.048267126083374
    },
    {
        "BLOCK_SIZE_M": 16,
        "BLOCK_SIZE_N": 256,
        "BLOCK_SIZE_K": 128,
        "GROUP_SIZE_M": 8,
        "num_stages": 5,
        "num_warps": 8,
        "compile_time": 0.9733610153198242
    },
    {
        "BLOCK_SIZE_M": 16,
        "BLOCK_SIZE_N": 256,
        "BLOCK_SIZE_K": 128,
        "GROUP_SIZE_M": 8,
        "num_stages": 5,
        "num_warps": 16,
        "compile_time": 0.006043434143066406
    },
    {
        "BLOCK_SIZE_M": 16,
        "BLOCK_SIZE_N": 256,
        "BLOCK_SIZE_K": 128,
        "GROUP_SIZE_M": 8,
        "num_stages": 5,
        "num_warps": 32,
        "compile_time": 0.45012426376342773
    },
    {
        "BLOCK_SIZE_M": 16,
        "BLOCK_SIZE_N": 256,
        "BLOCK_SIZE_K": 128,
        "GROUP_SIZE_M": 8,
        "num_stages": 6,
        "num_warps": 2,
        "compile_time": 11.384942293167114
    },
    {
        "BLOCK_SIZE_M": 16,
        "BLOCK_SIZE_N": 256,
        "BLOCK_SIZE_K": 128,
        "GROUP_SIZE_M": 8,
        "num_stages": 6,
        "num_warps": 4,
        "compile_time": 2.1685891151428223
    },
    {
        "BLOCK_SIZE_M": 16,
        "BLOCK_SIZE_N": 256,
        "BLOCK_SIZE_K": 128,
        "GROUP_SIZE_M": 8,
        "num_stages": 6,
        "num_warps": 8,
        "compile_time": 1.087156057357788
    },
    {
        "BLOCK_SIZE_M": 16,
        "BLOCK_SIZE_N": 256,
        "BLOCK_SIZE_K": 128,
        "GROUP_SIZE_M": 8,
        "num_stages": 6,
        "num_warps": 16,
        "compile_time": 0.6268963813781738
    },
    {
        "BLOCK_SIZE_M": 16,
        "BLOCK_SIZE_N": 256,
        "BLOCK_SIZE_K": 128,
        "GROUP_SIZE_M": 8,
        "num_stages": 6,
        "num_warps": 32,
        "compile_time": 0.4853534698486328
    },
    {
        "BLOCK_SIZE_M": 16,
        "BLOCK_SIZE_N": 256,
        "BLOCK_SIZE_K": 128,
        "GROUP_SIZE_M": 8,
        "num_stages": 7,
        "num_warps": 2,
        "compile_time": 11.585824728012085
    },
    {
        "BLOCK_SIZE_M": 16,
        "BLOCK_SIZE_N": 256,
        "BLOCK_SIZE_K": 128,
        "GROUP_SIZE_M": 8,
        "num_stages": 7,
        "num_warps": 4,
        "compile_time": 2.3058836460113525
    },
    {
        "BLOCK_SIZE_M": 16,
        "BLOCK_SIZE_N": 256,
        "BLOCK_SIZE_K": 128,
        "GROUP_SIZE_M": 8,
        "num_stages": 7,
        "num_warps": 8,
        "compile_time": 1.1350958347320557
    },
    {
        "BLOCK_SIZE_M": 16,
        "BLOCK_SIZE_N": 256,
        "BLOCK_SIZE_K": 128,
        "GROUP_SIZE_M": 8,
        "num_stages": 7,
        "num_warps": 16,
        "compile_time": 0.005347013473510742
    },
    {
        "BLOCK_SIZE_M": 16,
        "BLOCK_SIZE_N": 256,
        "BLOCK_SIZE_K": 128,
        "GROUP_SIZE_M": 8,
        "num_stages": 7,
        "num_warps": 32,
        "compile_time": 0.5003008842468262
    },
    {
        "BLOCK_SIZE_M": 16,
        "BLOCK_SIZE_N": 256,
        "BLOCK_SIZE_K": 128,
        "GROUP_SIZE_M": 8,
        "num_stages": 8,
        "num_warps": 2,
        "compile_time": 11.950546026229858
    },
    {
        "BLOCK_SIZE_M": 16,
        "BLOCK_SIZE_N": 256,
        "BLOCK_SIZE_K": 128,
        "GROUP_SIZE_M": 8,
        "num_stages": 8,
        "num_warps": 4,
        "compile_time": 2.426623821258545
    },
    {
        "BLOCK_SIZE_M": 16,
        "BLOCK_SIZE_N": 256,
        "BLOCK_SIZE_K": 128,
        "GROUP_SIZE_M": 8,
        "num_stages": 8,
        "num_warps": 8,
        "compile_time": 1.211129903793335
    },
    {
        "BLOCK_SIZE_M": 16,
        "BLOCK_SIZE_N": 256,
        "BLOCK_SIZE_K": 128,
        "GROUP_SIZE_M": 8,
        "num_stages": 8,
        "num_warps": 16,
        "compile_time": 0.7280282974243164
    },
    {
        "BLOCK_SIZE_M": 16,
        "BLOCK_SIZE_N": 256,
        "BLOCK_SIZE_K": 128,
        "GROUP_SIZE_M": 8,
        "num_stages": 8,
        "num_warps": 32,
        "compile_time": 0.00497889518737793
    },
    {
        "BLOCK_SIZE_M": 16,
        "BLOCK_SIZE_N": 256,
        "BLOCK_SIZE_K": 256,
        "GROUP_SIZE_M": 8,
        "num_stages": 1,
        "num_warps": 2,
        "compile_time": 7.856485366821289
    },
    {
        "BLOCK_SIZE_M": 16,
        "BLOCK_SIZE_N": 256,
        "BLOCK_SIZE_K": 256,
        "GROUP_SIZE_M": 8,
        "num_stages": 2,
        "num_warps": 2,
        "compile_time": 8.029627323150635
    },
    {
        "BLOCK_SIZE_M": 16,
        "BLOCK_SIZE_N": 256,
        "BLOCK_SIZE_K": 256,
        "GROUP_SIZE_M": 8,
        "num_stages": 3,
        "num_warps": 2,
        "compile_time": 117.69045066833496
    },
    {
        "BLOCK_SIZE_M": 16,
        "BLOCK_SIZE_N": 256,
        "BLOCK_SIZE_K": 256,
        "GROUP_SIZE_M": 8,
        "num_stages": 3,
        "num_warps": 4,
        "compile_time": 11.106189966201782
    },
    {
        "BLOCK_SIZE_M": 16,
        "BLOCK_SIZE_N": 256,
        "BLOCK_SIZE_K": 256,
        "GROUP_SIZE_M": 8,
        "num_stages": 3,
        "num_warps": 8,
        "compile_time": 0.0045354366302490234
    },
    {
        "BLOCK_SIZE_M": 16,
        "BLOCK_SIZE_N": 256,
        "BLOCK_SIZE_K": 256,
        "GROUP_SIZE_M": 8,
        "num_stages": 3,
        "num_warps": 16,
        "compile_time": 0.003248929977416992
    },
    {
        "BLOCK_SIZE_M": 16,
        "BLOCK_SIZE_N": 256,
        "BLOCK_SIZE_K": 256,
        "GROUP_SIZE_M": 8,
        "num_stages": 3,
        "num_warps": 32,
        "compile_time": 0.003153562545776367
    },
    {
        "BLOCK_SIZE_M": 16,
        "BLOCK_SIZE_N": 256,
        "BLOCK_SIZE_K": 256,
        "GROUP_SIZE_M": 8,
        "num_stages": 4,
        "num_warps": 2,
        "compile_time": 118.5176191329956
    },
    {
        "BLOCK_SIZE_M": 16,
        "BLOCK_SIZE_N": 256,
        "BLOCK_SIZE_K": 256,
        "GROUP_SIZE_M": 8,
        "num_stages": 4,
        "num_warps": 4,
        "compile_time": 10.647976160049438
    },
    {
        "BLOCK_SIZE_M": 16,
        "BLOCK_SIZE_N": 256,
        "BLOCK_SIZE_K": 256,
        "GROUP_SIZE_M": 8,
        "num_stages": 4,
        "num_warps": 8,
        "compile_time": 0.004675388336181641
    },
    {
        "BLOCK_SIZE_M": 16,
        "BLOCK_SIZE_N": 256,
        "BLOCK_SIZE_K": 256,
        "GROUP_SIZE_M": 8,
        "num_stages": 4,
        "num_warps": 16,
        "compile_time": 0.0033919811248779297
    },
    {
        "BLOCK_SIZE_M": 16,
        "BLOCK_SIZE_N": 256,
        "BLOCK_SIZE_K": 256,
        "GROUP_SIZE_M": 8,
        "num_stages": 4,
        "num_warps": 32,
        "compile_time": 0.003152132034301758
    },
    {
        "BLOCK_SIZE_M": 16,
        "BLOCK_SIZE_N": 256,
        "BLOCK_SIZE_K": 256,
        "GROUP_SIZE_M": 8,
        "num_stages": 5,
        "num_warps": 2,
        "compile_time": 6.273113965988159
    },
    {
        "BLOCK_SIZE_M": 16,
        "BLOCK_SIZE_N": 256,
        "BLOCK_SIZE_K": 256,
        "GROUP_SIZE_M": 8,
        "num_stages": 5,
        "num_warps": 4,
        "compile_time": 10.455012083053589
    },
    {
        "BLOCK_SIZE_M": 16,
        "BLOCK_SIZE_N": 256,
        "BLOCK_SIZE_K": 256,
        "GROUP_SIZE_M": 8,
        "num_stages": 5,
        "num_warps": 8,
        "compile_time": 0.004502296447753906
    },
    {
        "BLOCK_SIZE_M": 16,
        "BLOCK_SIZE_N": 256,
        "BLOCK_SIZE_K": 256,
        "GROUP_SIZE_M": 8,
        "num_stages": 5,
        "num_warps": 16,
        "compile_time": 0.003244638442993164
    },
    {
        "BLOCK_SIZE_M": 16,
        "BLOCK_SIZE_N": 256,
        "BLOCK_SIZE_K": 256,
        "GROUP_SIZE_M": 8,
        "num_stages": 5,
        "num_warps": 32,
        "compile_time": 0.0044667720794677734
    },
    {
        "BLOCK_SIZE_M": 16,
        "BLOCK_SIZE_N": 256,
        "BLOCK_SIZE_K": 256,
        "GROUP_SIZE_M": 8,
        "num_stages": 6,
        "num_warps": 2,
        "compile_time": 6.6043291091918945
    },
    {
        "BLOCK_SIZE_M": 16,
        "BLOCK_SIZE_N": 256,
        "BLOCK_SIZE_K": 256,
        "GROUP_SIZE_M": 8,
        "num_stages": 6,
        "num_warps": 4,
        "compile_time": 10.745683670043945
    },
    {
        "BLOCK_SIZE_M": 16,
        "BLOCK_SIZE_N": 256,
        "BLOCK_SIZE_K": 256,
        "GROUP_SIZE_M": 8,
        "num_stages": 6,
        "num_warps": 8,
        "compile_time": 0.004748821258544922
    },
    {
        "BLOCK_SIZE_M": 16,
        "BLOCK_SIZE_N": 256,
        "BLOCK_SIZE_K": 256,
        "GROUP_SIZE_M": 8,
        "num_stages": 6,
        "num_warps": 16,
        "compile_time": 0.003215789794921875
    },
    {
        "BLOCK_SIZE_M": 16,
        "BLOCK_SIZE_N": 256,
        "BLOCK_SIZE_K": 256,
        "GROUP_SIZE_M": 8,
        "num_stages": 6,
        "num_warps": 32,
        "compile_time": 0.004409313201904297
    },
    {
        "BLOCK_SIZE_M": 16,
        "BLOCK_SIZE_N": 256,
        "BLOCK_SIZE_K": 256,
        "GROUP_SIZE_M": 8,
        "num_stages": 7,
        "num_warps": 2,
        "compile_time": 6.913737535476685
    },
    {
        "BLOCK_SIZE_M": 16,
        "BLOCK_SIZE_N": 256,
        "BLOCK_SIZE_K": 256,
        "GROUP_SIZE_M": 8,
        "num_stages": 7,
        "num_warps": 4,
        "compile_time": 11.814899206161499
    },
    {
        "BLOCK_SIZE_M": 16,
        "BLOCK_SIZE_N": 256,
        "BLOCK_SIZE_K": 256,
        "GROUP_SIZE_M": 8,
        "num_stages": 7,
        "num_warps": 8,
        "compile_time": 0.004503726959228516
    },
    {
        "BLOCK_SIZE_M": 16,
        "BLOCK_SIZE_N": 256,
        "BLOCK_SIZE_K": 256,
        "GROUP_SIZE_M": 8,
        "num_stages": 7,
        "num_warps": 16,
        "compile_time": 0.003250598907470703
    },
    {
        "BLOCK_SIZE_M": 16,
        "BLOCK_SIZE_N": 256,
        "BLOCK_SIZE_K": 256,
        "GROUP_SIZE_M": 8,
        "num_stages": 7,
        "num_warps": 32,
        "compile_time": 0.0031592845916748047
    },
    {
        "BLOCK_SIZE_M": 16,
        "BLOCK_SIZE_N": 256,
        "BLOCK_SIZE_K": 256,
        "GROUP_SIZE_M": 8,
        "num_stages": 8,
        "num_warps": 2,
        "compile_time": 7.43122410774231
    },
    {
        "BLOCK_SIZE_M": 16,
        "BLOCK_SIZE_N": 256,
        "BLOCK_SIZE_K": 256,
        "GROUP_SIZE_M": 8,
        "num_stages": 8,
        "num_warps": 4,
        "compile_time": 11.956894874572754
    },
    {
        "BLOCK_SIZE_M": 16,
        "BLOCK_SIZE_N": 256,
        "BLOCK_SIZE_K": 256,
        "GROUP_SIZE_M": 8,
        "num_stages": 8,
        "num_warps": 8,
        "compile_time": 0.00431370735168457
    },
    {
        "BLOCK_SIZE_M": 16,
        "BLOCK_SIZE_N": 256,
        "BLOCK_SIZE_K": 256,
        "GROUP_SIZE_M": 8,
        "num_stages": 8,
        "num_warps": 16,
        "compile_time": 0.0032389163970947266
    },
    {
        "BLOCK_SIZE_M": 16,
        "BLOCK_SIZE_N": 256,
        "BLOCK_SIZE_K": 256,
        "GROUP_SIZE_M": 8,
        "num_stages": 8,
        "num_warps": 32,
        "compile_time": 0.0031280517578125
    },
    {
        "BLOCK_SIZE_M": 16,
        "BLOCK_SIZE_N": 256,
        "BLOCK_SIZE_K": 512,
        "GROUP_SIZE_M": 8,
        "num_stages": 1,
        "num_warps": 2,
        "compile_time": 18.5848286151886
    },
    {
        "BLOCK_SIZE_M": 16,
        "BLOCK_SIZE_N": 256,
        "BLOCK_SIZE_K": 512,
        "GROUP_SIZE_M": 8,
        "num_stages": 1,
        "num_warps": 4,
        "compile_time": 8.01009726524353
    },
    {
        "BLOCK_SIZE_M": 16,
        "BLOCK_SIZE_N": 256,
        "BLOCK_SIZE_K": 512,
        "GROUP_SIZE_M": 8,
        "num_stages": 1,
        "num_warps": 8,
        "compile_time": 0.0042493343353271484
    },
    {
        "BLOCK_SIZE_M": 16,
        "BLOCK_SIZE_N": 256,
        "BLOCK_SIZE_K": 512,
        "GROUP_SIZE_M": 8,
        "num_stages": 1,
        "num_warps": 16,
        "compile_time": 0.003021240234375
    },
    {
        "BLOCK_SIZE_M": 16,
        "BLOCK_SIZE_N": 256,
        "BLOCK_SIZE_K": 512,
        "GROUP_SIZE_M": 8,
        "num_stages": 1,
        "num_warps": 32,
        "compile_time": 0.002979278564453125
    },
    {
        "BLOCK_SIZE_M": 16,
        "BLOCK_SIZE_N": 256,
        "BLOCK_SIZE_K": 512,
        "GROUP_SIZE_M": 8,
        "num_stages": 2,
        "num_warps": 2,
        "compile_time": 19.171692371368408
    },
    {
        "BLOCK_SIZE_M": 16,
        "BLOCK_SIZE_N": 256,
        "BLOCK_SIZE_K": 512,
        "GROUP_SIZE_M": 8,
        "num_stages": 2,
        "num_warps": 4,
        "compile_time": 8.122784852981567
    },
    {
        "BLOCK_SIZE_M": 16,
        "BLOCK_SIZE_N": 256,
        "BLOCK_SIZE_K": 512,
        "GROUP_SIZE_M": 8,
        "num_stages": 2,
        "num_warps": 8,
        "compile_time": 0.003799915313720703
    },
    {
        "BLOCK_SIZE_M": 16,
        "BLOCK_SIZE_N": 256,
        "BLOCK_SIZE_K": 512,
        "GROUP_SIZE_M": 8,
        "num_stages": 2,
        "num_warps": 16,
        "compile_time": 0.0030221939086914062
    },
    {
        "BLOCK_SIZE_M": 16,
        "BLOCK_SIZE_N": 256,
        "BLOCK_SIZE_K": 512,
        "GROUP_SIZE_M": 8,
        "num_stages": 2,
        "num_warps": 32,
        "compile_time": 0.0029649734497070312
    },
    {
        "BLOCK_SIZE_M": 16,
        "BLOCK_SIZE_N": 256,
        "BLOCK_SIZE_K": 512,
        "GROUP_SIZE_M": 8,
        "num_stages": 3,
        "num_warps": 2,
        "compile_time": 19.67610788345337
    },
    {
        "BLOCK_SIZE_M": 16,
        "BLOCK_SIZE_N": 256,
        "BLOCK_SIZE_K": 512,
        "GROUP_SIZE_M": 8,
        "num_stages": 3,
        "num_warps": 4,
        "compile_time": 116.74206352233887
    },
    {
        "BLOCK_SIZE_M": 16,
        "BLOCK_SIZE_N": 256,
        "BLOCK_SIZE_K": 512,
        "GROUP_SIZE_M": 8,
        "num_stages": 3,
        "num_warps": 8,
        "compile_time": 10.834436416625977
    },
    {
        "BLOCK_SIZE_M": 16,
        "BLOCK_SIZE_N": 256,
        "BLOCK_SIZE_K": 512,
        "GROUP_SIZE_M": 8,
        "num_stages": 3,
        "num_warps": 16,
        "compile_time": 0.005239725112915039
    },
    {
        "BLOCK_SIZE_M": 16,
        "BLOCK_SIZE_N": 256,
        "BLOCK_SIZE_K": 512,
        "GROUP_SIZE_M": 8,
        "num_stages": 3,
        "num_warps": 32,
        "compile_time": 0.003091573715209961
    },
    {
        "BLOCK_SIZE_M": 16,
        "BLOCK_SIZE_N": 256,
        "BLOCK_SIZE_K": 512,
        "GROUP_SIZE_M": 8,
        "num_stages": 4,
        "num_warps": 2,
        "compile_time": 20.475602626800537
    },
    {
        "BLOCK_SIZE_M": 16,
        "BLOCK_SIZE_N": 256,
        "BLOCK_SIZE_K": 512,
        "GROUP_SIZE_M": 8,
        "num_stages": 4,
        "num_warps": 4,
        "compile_time": 6.1189610958099365
    },
    {
        "BLOCK_SIZE_M": 16,
        "BLOCK_SIZE_N": 256,
        "BLOCK_SIZE_K": 512,
        "GROUP_SIZE_M": 8,
        "num_stages": 4,
        "num_warps": 8,
        "compile_time": 10.723196983337402
    },
    {
        "BLOCK_SIZE_M": 16,
        "BLOCK_SIZE_N": 256,
        "BLOCK_SIZE_K": 512,
        "GROUP_SIZE_M": 8,
        "num_stages": 4,
        "num_warps": 16,
        "compile_time": 0.004038095474243164
    },
    {
        "BLOCK_SIZE_M": 16,
        "BLOCK_SIZE_N": 256,
        "BLOCK_SIZE_K": 512,
        "GROUP_SIZE_M": 8,
        "num_stages": 4,
        "num_warps": 32,
        "compile_time": 0.003012418746948242
    },
    {
        "BLOCK_SIZE_M": 16,
        "BLOCK_SIZE_N": 256,
        "BLOCK_SIZE_K": 512,
        "GROUP_SIZE_M": 8,
        "num_stages": 5,
        "num_warps": 2,
        "compile_time": 21.303206205368042
    },
    {
        "BLOCK_SIZE_M": 16,
        "BLOCK_SIZE_N": 256,
        "BLOCK_SIZE_K": 512,
        "GROUP_SIZE_M": 8,
        "num_stages": 5,
        "num_warps": 4,
        "compile_time": 6.499184608459473
    },
    {
        "BLOCK_SIZE_M": 16,
        "BLOCK_SIZE_N": 256,
        "BLOCK_SIZE_K": 512,
        "GROUP_SIZE_M": 8,
        "num_stages": 5,
        "num_warps": 8,
        "compile_time": 11.522045135498047
    },
    {
        "BLOCK_SIZE_M": 16,
        "BLOCK_SIZE_N": 256,
        "BLOCK_SIZE_K": 512,
        "GROUP_SIZE_M": 8,
        "num_stages": 5,
        "num_warps": 16,
        "compile_time": 0.004046916961669922
    },
    {
        "BLOCK_SIZE_M": 16,
        "BLOCK_SIZE_N": 256,
        "BLOCK_SIZE_K": 512,
        "GROUP_SIZE_M": 8,
        "num_stages": 5,
        "num_warps": 32,
        "compile_time": 0.002988576889038086
    },
    {
        "BLOCK_SIZE_M": 16,
        "BLOCK_SIZE_N": 256,
        "BLOCK_SIZE_K": 512,
        "GROUP_SIZE_M": 8,
        "num_stages": 6,
        "num_warps": 2,
        "compile_time": 22.03408980369568
    },
    {
        "BLOCK_SIZE_M": 16,
        "BLOCK_SIZE_N": 256,
        "BLOCK_SIZE_K": 512,
        "GROUP_SIZE_M": 8,
        "num_stages": 6,
        "num_warps": 4,
        "compile_time": 6.929908275604248
    },
    {
        "BLOCK_SIZE_M": 16,
        "BLOCK_SIZE_N": 256,
        "BLOCK_SIZE_K": 512,
        "GROUP_SIZE_M": 8,
        "num_stages": 6,
        "num_warps": 8,
        "compile_time": 11.50119662284851
    },
    {
        "BLOCK_SIZE_M": 16,
        "BLOCK_SIZE_N": 256,
        "BLOCK_SIZE_K": 512,
        "GROUP_SIZE_M": 8,
        "num_stages": 6,
        "num_warps": 16,
        "compile_time": 0.0038480758666992188
    },
    {
        "BLOCK_SIZE_M": 16,
        "BLOCK_SIZE_N": 256,
        "BLOCK_SIZE_K": 512,
        "GROUP_SIZE_M": 8,
        "num_stages": 6,
        "num_warps": 32,
        "compile_time": 0.003077268600463867
    },
    {
        "BLOCK_SIZE_M": 16,
        "BLOCK_SIZE_N": 256,
        "BLOCK_SIZE_K": 512,
        "GROUP_SIZE_M": 8,
        "num_stages": 7,
        "num_warps": 2,
        "compile_time": 23.260864973068237
    },
    {
        "BLOCK_SIZE_M": 16,
        "BLOCK_SIZE_N": 256,
        "BLOCK_SIZE_K": 512,
        "GROUP_SIZE_M": 8,
        "num_stages": 7,
        "num_warps": 4,
        "compile_time": 7.442578315734863
    },
    {
        "BLOCK_SIZE_M": 16,
        "BLOCK_SIZE_N": 256,
        "BLOCK_SIZE_K": 512,
        "GROUP_SIZE_M": 8,
        "num_stages": 7,
        "num_warps": 8,
        "compile_time": 11.473490953445435
    },
    {
        "BLOCK_SIZE_M": 16,
        "BLOCK_SIZE_N": 256,
        "BLOCK_SIZE_K": 512,
        "GROUP_SIZE_M": 8,
        "num_stages": 7,
        "num_warps": 16,
        "compile_time": 0.004157543182373047
    },
    {
        "BLOCK_SIZE_M": 16,
        "BLOCK_SIZE_N": 256,
        "BLOCK_SIZE_K": 512,
        "GROUP_SIZE_M": 8,
        "num_stages": 7,
        "num_warps": 32,
        "compile_time": 0.003020763397216797
    },
    {
        "BLOCK_SIZE_M": 16,
        "BLOCK_SIZE_N": 256,
        "BLOCK_SIZE_K": 512,
        "GROUP_SIZE_M": 8,
        "num_stages": 8,
        "num_warps": 2,
        "compile_time": 6.494105339050293
    },
    {
        "BLOCK_SIZE_M": 16,
        "BLOCK_SIZE_N": 256,
        "BLOCK_SIZE_K": 512,
        "GROUP_SIZE_M": 8,
        "num_stages": 8,
        "num_warps": 4,
        "compile_time": 7.912067413330078
    },
    {
        "BLOCK_SIZE_M": 16,
        "BLOCK_SIZE_N": 256,
        "BLOCK_SIZE_K": 512,
        "GROUP_SIZE_M": 8,
        "num_stages": 8,
        "num_warps": 8,
        "compile_time": 11.762306213378906
    },
    {
        "BLOCK_SIZE_M": 16,
        "BLOCK_SIZE_N": 256,
        "BLOCK_SIZE_K": 512,
        "GROUP_SIZE_M": 8,
        "num_stages": 8,
        "num_warps": 16,
        "compile_time": 0.0042726993560791016
    },
    {
        "BLOCK_SIZE_M": 16,
        "BLOCK_SIZE_N": 256,
        "BLOCK_SIZE_K": 512,
        "GROUP_SIZE_M": 8,
        "num_stages": 8,
        "num_warps": 32,
        "compile_time": 0.0030252933502197266
    },
    {
        "BLOCK_SIZE_M": 16,
        "BLOCK_SIZE_N": 512,
        "BLOCK_SIZE_K": 32,
        "GROUP_SIZE_M": 8,
        "num_stages": 6,
        "num_warps": 2,
        "compile_time": 0.0038177967071533203
    },
    {
        "BLOCK_SIZE_M": 16,
        "BLOCK_SIZE_N": 512,
        "BLOCK_SIZE_K": 32,
        "GROUP_SIZE_M": 8,
        "num_stages": 6,
        "num_warps": 4,
        "compile_time": 0.002882719039916992
    },
    {
        "BLOCK_SIZE_M": 16,
        "BLOCK_SIZE_N": 512,
        "BLOCK_SIZE_K": 32,
        "GROUP_SIZE_M": 8,
        "num_stages": 6,
        "num_warps": 8,
        "compile_time": 0.002794981002807617
    },
    {
        "BLOCK_SIZE_M": 16,
        "BLOCK_SIZE_N": 512,
        "BLOCK_SIZE_K": 32,
        "GROUP_SIZE_M": 8,
        "num_stages": 7,
        "num_warps": 2,
        "compile_time": 0.0036454200744628906
    },
    {
        "BLOCK_SIZE_M": 16,
        "BLOCK_SIZE_N": 512,
        "BLOCK_SIZE_K": 32,
        "GROUP_SIZE_M": 8,
        "num_stages": 7,
        "num_warps": 4,
        "compile_time": 0.0028409957885742188
    },
    {
        "BLOCK_SIZE_M": 16,
        "BLOCK_SIZE_N": 512,
        "BLOCK_SIZE_K": 32,
        "GROUP_SIZE_M": 8,
        "num_stages": 7,
        "num_warps": 8,
        "compile_time": 0.0027871131896972656
    },
    {
        "BLOCK_SIZE_M": 16,
        "BLOCK_SIZE_N": 512,
        "BLOCK_SIZE_K": 32,
        "GROUP_SIZE_M": 8,
        "num_stages": 7,
        "num_warps": 16,
        "compile_time": 0.0027909278869628906
    },
    {
        "BLOCK_SIZE_M": 16,
        "BLOCK_SIZE_N": 512,
        "BLOCK_SIZE_K": 32,
        "GROUP_SIZE_M": 8,
        "num_stages": 7,
        "num_warps": 32,
        "compile_time": 0.0027649402618408203
    },
    {
        "BLOCK_SIZE_M": 16,
        "BLOCK_SIZE_N": 512,
        "BLOCK_SIZE_K": 32,
        "GROUP_SIZE_M": 8,
        "num_stages": 8,
        "num_warps": 2,
        "compile_time": 0.003914356231689453
    },
    {
        "BLOCK_SIZE_M": 16,
        "BLOCK_SIZE_N": 512,
        "BLOCK_SIZE_K": 32,
        "GROUP_SIZE_M": 8,
        "num_stages": 8,
        "num_warps": 4,
        "compile_time": 0.0028710365295410156
    },
    {
        "BLOCK_SIZE_M": 16,
        "BLOCK_SIZE_N": 512,
        "BLOCK_SIZE_K": 32,
        "GROUP_SIZE_M": 8,
        "num_stages": 8,
        "num_warps": 8,
        "compile_time": 0.0028247833251953125
    },
    {
        "BLOCK_SIZE_M": 16,
        "BLOCK_SIZE_N": 512,
        "BLOCK_SIZE_K": 32,
        "GROUP_SIZE_M": 8,
        "num_stages": 8,
        "num_warps": 16,
        "compile_time": 0.0027894973754882812
    },
    {
        "BLOCK_SIZE_M": 16,
        "BLOCK_SIZE_N": 512,
        "BLOCK_SIZE_K": 32,
        "GROUP_SIZE_M": 8,
        "num_stages": 8,
        "num_warps": 32,
        "compile_time": 0.0027365684509277344
    },
    {
        "BLOCK_SIZE_M": 16,
        "BLOCK_SIZE_N": 512,
        "BLOCK_SIZE_K": 64,
        "GROUP_SIZE_M": 8,
        "num_stages": 3,
        "num_warps": 2,
        "compile_time": 10.929363489151001
    },
    {
        "BLOCK_SIZE_M": 16,
        "BLOCK_SIZE_N": 512,
        "BLOCK_SIZE_K": 64,
        "GROUP_SIZE_M": 8,
        "num_stages": 4,
        "num_warps": 2,
        "compile_time": 11.032899141311646
    },
    {
        "BLOCK_SIZE_M": 16,
        "BLOCK_SIZE_N": 512,
        "BLOCK_SIZE_K": 64,
        "GROUP_SIZE_M": 8,
        "num_stages": 4,
        "num_warps": 4,
        "compile_time": 0.004812479019165039
    },
    {
        "BLOCK_SIZE_M": 16,
        "BLOCK_SIZE_N": 512,
        "BLOCK_SIZE_K": 64,
        "GROUP_SIZE_M": 8,
        "num_stages": 4,
        "num_warps": 8,
        "compile_time": 0.0032618045806884766
    },
    {
        "BLOCK_SIZE_M": 16,
        "BLOCK_SIZE_N": 512,
        "BLOCK_SIZE_K": 64,
        "GROUP_SIZE_M": 8,
        "num_stages": 4,
        "num_warps": 16,
        "compile_time": 0.003565549850463867
    },
    {
        "BLOCK_SIZE_M": 16,
        "BLOCK_SIZE_N": 512,
        "BLOCK_SIZE_K": 64,
        "GROUP_SIZE_M": 8,
        "num_stages": 4,
        "num_warps": 32,
        "compile_time": 0.003119230270385742
    },
    {
        "BLOCK_SIZE_M": 16,
        "BLOCK_SIZE_N": 512,
        "BLOCK_SIZE_K": 64,
        "GROUP_SIZE_M": 8,
        "num_stages": 5,
        "num_warps": 2,
        "compile_time": 11.285107612609863
    },
    {
        "BLOCK_SIZE_M": 16,
        "BLOCK_SIZE_N": 512,
        "BLOCK_SIZE_K": 64,
        "GROUP_SIZE_M": 8,
        "num_stages": 5,
        "num_warps": 4,
        "compile_time": 0.004206180572509766
    },
    {
        "BLOCK_SIZE_M": 16,
        "BLOCK_SIZE_N": 512,
        "BLOCK_SIZE_K": 64,
        "GROUP_SIZE_M": 8,
        "num_stages": 5,
        "num_warps": 8,
        "compile_time": 0.0031981468200683594
    },
    {
        "BLOCK_SIZE_M": 16,
        "BLOCK_SIZE_N": 512,
        "BLOCK_SIZE_K": 64,
        "GROUP_SIZE_M": 8,
        "num_stages": 5,
        "num_warps": 16,
        "compile_time": 0.0031838417053222656
    },
    {
        "BLOCK_SIZE_M": 16,
        "BLOCK_SIZE_N": 512,
        "BLOCK_SIZE_K": 64,
        "GROUP_SIZE_M": 8,
        "num_stages": 5,
        "num_warps": 32,
        "compile_time": 0.004408836364746094
    },
    {
        "BLOCK_SIZE_M": 16,
        "BLOCK_SIZE_N": 512,
        "BLOCK_SIZE_K": 64,
        "GROUP_SIZE_M": 8,
        "num_stages": 6,
        "num_warps": 2,
        "compile_time": 11.500393867492676
    },
    {
        "BLOCK_SIZE_M": 16,
        "BLOCK_SIZE_N": 512,
        "BLOCK_SIZE_K": 64,
        "GROUP_SIZE_M": 8,
        "num_stages": 6,
        "num_warps": 4,
        "compile_time": 0.004756927490234375
    },
    {
        "BLOCK_SIZE_M": 16,
        "BLOCK_SIZE_N": 512,
        "BLOCK_SIZE_K": 64,
        "GROUP_SIZE_M": 8,
        "num_stages": 6,
        "num_warps": 8,
        "compile_time": 0.003208160400390625
    },
    {
        "BLOCK_SIZE_M": 16,
        "BLOCK_SIZE_N": 512,
        "BLOCK_SIZE_K": 64,
        "GROUP_SIZE_M": 8,
        "num_stages": 6,
        "num_warps": 16,
        "compile_time": 0.0031270980834960938
    },
    {
        "BLOCK_SIZE_M": 16,
        "BLOCK_SIZE_N": 512,
        "BLOCK_SIZE_K": 64,
        "GROUP_SIZE_M": 8,
        "num_stages": 6,
        "num_warps": 32,
        "compile_time": 0.003112316131591797
    },
    {
        "BLOCK_SIZE_M": 16,
        "BLOCK_SIZE_N": 512,
        "BLOCK_SIZE_K": 64,
        "GROUP_SIZE_M": 8,
        "num_stages": 7,
        "num_warps": 2,
        "compile_time": 11.659430980682373
    },
    {
        "BLOCK_SIZE_M": 16,
        "BLOCK_SIZE_N": 512,
        "BLOCK_SIZE_K": 64,
        "GROUP_SIZE_M": 8,
        "num_stages": 7,
        "num_warps": 4,
        "compile_time": 0.004262208938598633
    },
    {
        "BLOCK_SIZE_M": 16,
        "BLOCK_SIZE_N": 512,
        "BLOCK_SIZE_K": 64,
        "GROUP_SIZE_M": 8,
        "num_stages": 7,
        "num_warps": 8,
        "compile_time": 0.008561372756958008
    },
    {
        "BLOCK_SIZE_M": 16,
        "BLOCK_SIZE_N": 512,
        "BLOCK_SIZE_K": 64,
        "GROUP_SIZE_M": 8,
        "num_stages": 7,
        "num_warps": 16,
        "compile_time": 0.003183126449584961
    },
    {
        "BLOCK_SIZE_M": 16,
        "BLOCK_SIZE_N": 512,
        "BLOCK_SIZE_K": 64,
        "GROUP_SIZE_M": 8,
        "num_stages": 7,
        "num_warps": 32,
        "compile_time": 0.003107786178588867
    },
    {
        "BLOCK_SIZE_M": 16,
        "BLOCK_SIZE_N": 512,
        "BLOCK_SIZE_K": 64,
        "GROUP_SIZE_M": 8,
        "num_stages": 8,
        "num_warps": 2,
        "compile_time": 11.822129487991333
    },
    {
        "BLOCK_SIZE_M": 16,
        "BLOCK_SIZE_N": 512,
        "BLOCK_SIZE_K": 64,
        "GROUP_SIZE_M": 8,
        "num_stages": 8,
        "num_warps": 4,
        "compile_time": 0.004273653030395508
    },
    {
        "BLOCK_SIZE_M": 16,
        "BLOCK_SIZE_N": 512,
        "BLOCK_SIZE_K": 64,
        "GROUP_SIZE_M": 8,
        "num_stages": 8,
        "num_warps": 8,
        "compile_time": 0.003256559371948242
    },
    {
        "BLOCK_SIZE_M": 16,
        "BLOCK_SIZE_N": 512,
        "BLOCK_SIZE_K": 64,
        "GROUP_SIZE_M": 8,
        "num_stages": 8,
        "num_warps": 16,
        "compile_time": 0.0037555694580078125
    },
    {
        "BLOCK_SIZE_M": 16,
        "BLOCK_SIZE_N": 512,
        "BLOCK_SIZE_K": 64,
        "GROUP_SIZE_M": 8,
        "num_stages": 8,
        "num_warps": 32,
        "compile_time": 0.0031430721282958984
    },
    {
        "BLOCK_SIZE_M": 16,
        "BLOCK_SIZE_N": 512,
        "BLOCK_SIZE_K": 128,
        "GROUP_SIZE_M": 8,
        "num_stages": 1,
        "num_warps": 2,
        "compile_time": 8.41609263420105
    },
    {
        "BLOCK_SIZE_M": 16,
        "BLOCK_SIZE_N": 512,
        "BLOCK_SIZE_K": 128,
        "GROUP_SIZE_M": 8,
        "num_stages": 2,
        "num_warps": 2,
        "compile_time": 8.46082615852356
    },
    {
        "BLOCK_SIZE_M": 16,
        "BLOCK_SIZE_N": 512,
        "BLOCK_SIZE_K": 128,
        "GROUP_SIZE_M": 8,
        "num_stages": 3,
        "num_warps": 2,
        "compile_time": 6.0118749141693115
    },
    {
        "BLOCK_SIZE_M": 16,
        "BLOCK_SIZE_N": 512,
        "BLOCK_SIZE_K": 128,
        "GROUP_SIZE_M": 8,
        "num_stages": 3,
        "num_warps": 4,
        "compile_time": 10.560713291168213
    },
    {
        "BLOCK_SIZE_M": 16,
        "BLOCK_SIZE_N": 512,
        "BLOCK_SIZE_K": 128,
        "GROUP_SIZE_M": 8,
        "num_stages": 3,
        "num_warps": 8,
        "compile_time": 1.901944875717163
    },
    {
        "BLOCK_SIZE_M": 16,
        "BLOCK_SIZE_N": 512,
        "BLOCK_SIZE_K": 128,
        "GROUP_SIZE_M": 8,
        "num_stages": 3,
        "num_warps": 16,
        "compile_time": 0.8854217529296875
    },
    {
        "BLOCK_SIZE_M": 16,
        "BLOCK_SIZE_N": 512,
        "BLOCK_SIZE_K": 128,
        "GROUP_SIZE_M": 8,
        "num_stages": 3,
        "num_warps": 32,
        "compile_time": 0.5607569217681885
    },
    {
        "BLOCK_SIZE_M": 16,
        "BLOCK_SIZE_N": 512,
        "BLOCK_SIZE_K": 128,
        "GROUP_SIZE_M": 8,
        "num_stages": 4,
        "num_warps": 2,
        "compile_time": 6.279726028442383
    },
    {
        "BLOCK_SIZE_M": 16,
        "BLOCK_SIZE_N": 512,
        "BLOCK_SIZE_K": 128,
        "GROUP_SIZE_M": 8,
        "num_stages": 4,
        "num_warps": 4,
        "compile_time": 10.933284997940063
    },
    {
        "BLOCK_SIZE_M": 16,
        "BLOCK_SIZE_N": 512,
        "BLOCK_SIZE_K": 128,
        "GROUP_SIZE_M": 8,
        "num_stages": 4,
        "num_warps": 8,
        "compile_time": 2.053879737854004
    },
    {
        "BLOCK_SIZE_M": 16,
        "BLOCK_SIZE_N": 512,
        "BLOCK_SIZE_K": 128,
        "GROUP_SIZE_M": 8,
        "num_stages": 4,
        "num_warps": 16,
        "compile_time": 0.9709713459014893
    },
    {
        "BLOCK_SIZE_M": 16,
        "BLOCK_SIZE_N": 512,
        "BLOCK_SIZE_K": 128,
        "GROUP_SIZE_M": 8,
        "num_stages": 4,
        "num_warps": 32,
        "compile_time": 0.5989675521850586
    },
    {
        "BLOCK_SIZE_M": 16,
        "BLOCK_SIZE_N": 512,
        "BLOCK_SIZE_K": 128,
        "GROUP_SIZE_M": 8,
        "num_stages": 5,
        "num_warps": 2,
        "compile_time": 6.693995714187622
    },
    {
        "BLOCK_SIZE_M": 16,
        "BLOCK_SIZE_N": 512,
        "BLOCK_SIZE_K": 128,
        "GROUP_SIZE_M": 8,
        "num_stages": 5,
        "num_warps": 4,
        "compile_time": 11.017499685287476
    },
    {
        "BLOCK_SIZE_M": 16,
        "BLOCK_SIZE_N": 512,
        "BLOCK_SIZE_K": 128,
        "GROUP_SIZE_M": 8,
        "num_stages": 5,
        "num_warps": 8,
        "compile_time": 2.2009706497192383
    },
    {
        "BLOCK_SIZE_M": 16,
        "BLOCK_SIZE_N": 512,
        "BLOCK_SIZE_K": 128,
        "GROUP_SIZE_M": 8,
        "num_stages": 5,
        "num_warps": 16,
        "compile_time": 1.059598445892334
    },
    {
        "BLOCK_SIZE_M": 16,
        "BLOCK_SIZE_N": 512,
        "BLOCK_SIZE_K": 128,
        "GROUP_SIZE_M": 8,
        "num_stages": 5,
        "num_warps": 32,
        "compile_time": 0.6459674835205078
    },
    {
        "BLOCK_SIZE_M": 16,
        "BLOCK_SIZE_N": 512,
        "BLOCK_SIZE_K": 128,
        "GROUP_SIZE_M": 8,
        "num_stages": 6,
        "num_warps": 2,
        "compile_time": 6.976423740386963
    },
    {
        "BLOCK_SIZE_M": 16,
        "BLOCK_SIZE_N": 512,
        "BLOCK_SIZE_K": 128,
        "GROUP_SIZE_M": 8,
        "num_stages": 6,
        "num_warps": 4,
        "compile_time": 11.319824457168579
    },
    {
        "BLOCK_SIZE_M": 16,
        "BLOCK_SIZE_N": 512,
        "BLOCK_SIZE_K": 128,
        "GROUP_SIZE_M": 8,
        "num_stages": 6,
        "num_warps": 8,
        "compile_time": 2.3419089317321777
    },
    {
        "BLOCK_SIZE_M": 16,
        "BLOCK_SIZE_N": 512,
        "BLOCK_SIZE_K": 128,
        "GROUP_SIZE_M": 8,
        "num_stages": 6,
        "num_warps": 16,
        "compile_time": 1.1421515941619873
    },
    {
        "BLOCK_SIZE_M": 16,
        "BLOCK_SIZE_N": 512,
        "BLOCK_SIZE_K": 128,
        "GROUP_SIZE_M": 8,
        "num_stages": 6,
        "num_warps": 32,
        "compile_time": 0.6926462650299072
    },
    {
        "BLOCK_SIZE_M": 16,
        "BLOCK_SIZE_N": 512,
        "BLOCK_SIZE_K": 128,
        "GROUP_SIZE_M": 8,
        "num_stages": 7,
        "num_warps": 2,
        "compile_time": 7.240426063537598
    },
    {
        "BLOCK_SIZE_M": 16,
        "BLOCK_SIZE_N": 512,
        "BLOCK_SIZE_K": 128,
        "GROUP_SIZE_M": 8,
        "num_stages": 7,
        "num_warps": 4,
        "compile_time": 11.3699049949646
    },
    {
        "BLOCK_SIZE_M": 16,
        "BLOCK_SIZE_N": 512,
        "BLOCK_SIZE_K": 128,
        "GROUP_SIZE_M": 8,
        "num_stages": 7,
        "num_warps": 8,
        "compile_time": 2.5078766345977783
    },
    {
        "BLOCK_SIZE_M": 16,
        "BLOCK_SIZE_N": 512,
        "BLOCK_SIZE_K": 128,
        "GROUP_SIZE_M": 8,
        "num_stages": 7,
        "num_warps": 16,
        "compile_time": 1.2281384468078613
    },
    {
        "BLOCK_SIZE_M": 16,
        "BLOCK_SIZE_N": 512,
        "BLOCK_SIZE_K": 128,
        "GROUP_SIZE_M": 8,
        "num_stages": 7,
        "num_warps": 32,
        "compile_time": 0.7475829124450684
    },
    {
        "BLOCK_SIZE_M": 16,
        "BLOCK_SIZE_N": 512,
        "BLOCK_SIZE_K": 128,
        "GROUP_SIZE_M": 8,
        "num_stages": 8,
        "num_warps": 2,
        "compile_time": 7.689665079116821
    },
    {
        "BLOCK_SIZE_M": 16,
        "BLOCK_SIZE_N": 512,
        "BLOCK_SIZE_K": 128,
        "GROUP_SIZE_M": 8,
        "num_stages": 8,
        "num_warps": 4,
        "compile_time": 11.585039138793945
    },
    {
        "BLOCK_SIZE_M": 16,
        "BLOCK_SIZE_N": 512,
        "BLOCK_SIZE_K": 128,
        "GROUP_SIZE_M": 8,
        "num_stages": 8,
        "num_warps": 8,
        "compile_time": 2.6299078464508057
    },
    {
        "BLOCK_SIZE_M": 16,
        "BLOCK_SIZE_N": 512,
        "BLOCK_SIZE_K": 128,
        "GROUP_SIZE_M": 8,
        "num_stages": 8,
        "num_warps": 16,
        "compile_time": 1.337306022644043
    },
    {
        "BLOCK_SIZE_M": 16,
        "BLOCK_SIZE_N": 512,
        "BLOCK_SIZE_K": 128,
        "GROUP_SIZE_M": 8,
        "num_stages": 8,
        "num_warps": 32,
        "compile_time": 0.7867677211761475
    },
    {
        "BLOCK_SIZE_M": 16,
        "BLOCK_SIZE_N": 512,
        "BLOCK_SIZE_K": 256,
        "GROUP_SIZE_M": 8,
        "num_stages": 1,
        "num_warps": 2,
        "compile_time": 19.120306253433228
    },
    {
        "BLOCK_SIZE_M": 16,
        "BLOCK_SIZE_N": 512,
        "BLOCK_SIZE_K": 256,
        "GROUP_SIZE_M": 8,
        "num_stages": 1,
        "num_warps": 4,
        "compile_time": 8.215835094451904
    },
    {
        "BLOCK_SIZE_M": 16,
        "BLOCK_SIZE_N": 512,
        "BLOCK_SIZE_K": 256,
        "GROUP_SIZE_M": 8,
        "num_stages": 1,
        "num_warps": 8,
        "compile_time": 2.7702789306640625
    },
    {
        "BLOCK_SIZE_M": 16,
        "BLOCK_SIZE_N": 512,
        "BLOCK_SIZE_K": 256,
        "GROUP_SIZE_M": 8,
        "num_stages": 1,
        "num_warps": 16,
        "compile_time": 1.1189839839935303
    },
    {
        "BLOCK_SIZE_M": 16,
        "BLOCK_SIZE_N": 512,
        "BLOCK_SIZE_K": 256,
        "GROUP_SIZE_M": 8,
        "num_stages": 1,
        "num_warps": 32,
        "compile_time": 0.6801362037658691
    },
    {
        "BLOCK_SIZE_M": 16,
        "BLOCK_SIZE_N": 512,
        "BLOCK_SIZE_K": 256,
        "GROUP_SIZE_M": 8,
        "num_stages": 2,
        "num_warps": 2,
        "compile_time": 19.058281421661377
    },
    {
        "BLOCK_SIZE_M": 16,
        "BLOCK_SIZE_N": 512,
        "BLOCK_SIZE_K": 256,
        "GROUP_SIZE_M": 8,
        "num_stages": 2,
        "num_warps": 4,
        "compile_time": 8.306414604187012
    },
    {
        "BLOCK_SIZE_M": 16,
        "BLOCK_SIZE_N": 512,
        "BLOCK_SIZE_K": 256,
        "GROUP_SIZE_M": 8,
        "num_stages": 2,
        "num_warps": 8,
        "compile_time": 3.099959135055542
    },
    {
        "BLOCK_SIZE_M": 16,
        "BLOCK_SIZE_N": 512,
        "BLOCK_SIZE_K": 256,
        "GROUP_SIZE_M": 8,
        "num_stages": 2,
        "num_warps": 16,
        "compile_time": 1.2929391860961914
    },
    {
        "BLOCK_SIZE_M": 16,
        "BLOCK_SIZE_N": 512,
        "BLOCK_SIZE_K": 256,
        "GROUP_SIZE_M": 8,
        "num_stages": 2,
        "num_warps": 32,
        "compile_time": 0.7626869678497314
    },
    {
        "BLOCK_SIZE_M": 16,
        "BLOCK_SIZE_N": 512,
        "BLOCK_SIZE_K": 256,
        "GROUP_SIZE_M": 8,
        "num_stages": 3,
        "num_warps": 2,
        "compile_time": 19.999905586242676
    },
    {
        "BLOCK_SIZE_M": 16,
        "BLOCK_SIZE_N": 512,
        "BLOCK_SIZE_K": 256,
        "GROUP_SIZE_M": 8,
        "num_stages": 3,
        "num_warps": 4,
        "compile_time": 118.64905381202698
    },
    {
        "BLOCK_SIZE_M": 16,
        "BLOCK_SIZE_N": 512,
        "BLOCK_SIZE_K": 256,
        "GROUP_SIZE_M": 8,
        "num_stages": 3,
        "num_warps": 8,
        "compile_time": 10.46950626373291
    },
    {
        "BLOCK_SIZE_M": 16,
        "BLOCK_SIZE_N": 512,
        "BLOCK_SIZE_K": 256,
        "GROUP_SIZE_M": 8,
        "num_stages": 3,
        "num_warps": 16,
        "compile_time": 1.935950517654419
    },
    {
        "BLOCK_SIZE_M": 16,
        "BLOCK_SIZE_N": 512,
        "BLOCK_SIZE_K": 256,
        "GROUP_SIZE_M": 8,
        "num_stages": 3,
        "num_warps": 32,
        "compile_time": 0.924872636795044
    },
    {
        "BLOCK_SIZE_M": 16,
        "BLOCK_SIZE_N": 512,
        "BLOCK_SIZE_K": 256,
        "GROUP_SIZE_M": 8,
        "num_stages": 4,
        "num_warps": 2,
        "compile_time": 20.505794525146484
    },
    {
        "BLOCK_SIZE_M": 16,
        "BLOCK_SIZE_N": 512,
        "BLOCK_SIZE_K": 256,
        "GROUP_SIZE_M": 8,
        "num_stages": 4,
        "num_warps": 4,
        "compile_time": 6.2154271602630615
    },
    {
        "BLOCK_SIZE_M": 16,
        "BLOCK_SIZE_N": 512,
        "BLOCK_SIZE_K": 256,
        "GROUP_SIZE_M": 8,
        "num_stages": 4,
        "num_warps": 8,
        "compile_time": 10.40799331665039
    },
    {
        "BLOCK_SIZE_M": 16,
        "BLOCK_SIZE_N": 512,
        "BLOCK_SIZE_K": 256,
        "GROUP_SIZE_M": 8,
        "num_stages": 4,
        "num_warps": 16,
        "compile_time": 2.093942642211914
    },
    {
        "BLOCK_SIZE_M": 16,
        "BLOCK_SIZE_N": 512,
        "BLOCK_SIZE_K": 256,
        "GROUP_SIZE_M": 8,
        "num_stages": 4,
        "num_warps": 32,
        "compile_time": 1.0107135772705078
    },
    {
        "BLOCK_SIZE_M": 16,
        "BLOCK_SIZE_N": 512,
        "BLOCK_SIZE_K": 256,
        "GROUP_SIZE_M": 8,
        "num_stages": 5,
        "num_warps": 2,
        "compile_time": 21.59833860397339
    },
    {
        "BLOCK_SIZE_M": 16,
        "BLOCK_SIZE_N": 512,
        "BLOCK_SIZE_K": 256,
        "GROUP_SIZE_M": 8,
        "num_stages": 5,
        "num_warps": 4,
        "compile_time": 6.533328294754028
    },
    {
        "BLOCK_SIZE_M": 16,
        "BLOCK_SIZE_N": 512,
        "BLOCK_SIZE_K": 256,
        "GROUP_SIZE_M": 8,
        "num_stages": 5,
        "num_warps": 8,
        "compile_time": 10.897013664245605
    },
    {
        "BLOCK_SIZE_M": 16,
        "BLOCK_SIZE_N": 512,
        "BLOCK_SIZE_K": 256,
        "GROUP_SIZE_M": 8,
        "num_stages": 5,
        "num_warps": 16,
        "compile_time": 2.271270513534546
    },
    {
        "BLOCK_SIZE_M": 16,
        "BLOCK_SIZE_N": 512,
        "BLOCK_SIZE_K": 256,
        "GROUP_SIZE_M": 8,
        "num_stages": 5,
        "num_warps": 32,
        "compile_time": 1.097456455230713
    },
    {
        "BLOCK_SIZE_M": 16,
        "BLOCK_SIZE_N": 512,
        "BLOCK_SIZE_K": 256,
        "GROUP_SIZE_M": 8,
        "num_stages": 6,
        "num_warps": 2,
        "compile_time": 22.503564596176147
    },
    {
        "BLOCK_SIZE_M": 16,
        "BLOCK_SIZE_N": 512,
        "BLOCK_SIZE_K": 256,
        "GROUP_SIZE_M": 8,
        "num_stages": 6,
        "num_warps": 4,
        "compile_time": 6.822472095489502
    },
    {
        "BLOCK_SIZE_M": 16,
        "BLOCK_SIZE_N": 512,
        "BLOCK_SIZE_K": 256,
        "GROUP_SIZE_M": 8,
        "num_stages": 6,
        "num_warps": 8,
        "compile_time": 11.227225065231323
    },
    {
        "BLOCK_SIZE_M": 16,
        "BLOCK_SIZE_N": 512,
        "BLOCK_SIZE_K": 256,
        "GROUP_SIZE_M": 8,
        "num_stages": 6,
        "num_warps": 16,
        "compile_time": 2.463736057281494
    },
    {
        "BLOCK_SIZE_M": 16,
        "BLOCK_SIZE_N": 512,
        "BLOCK_SIZE_K": 256,
        "GROUP_SIZE_M": 8,
        "num_stages": 6,
        "num_warps": 32,
        "compile_time": 1.1979072093963623
    },
    {
        "BLOCK_SIZE_M": 16,
        "BLOCK_SIZE_N": 512,
        "BLOCK_SIZE_K": 256,
        "GROUP_SIZE_M": 8,
        "num_stages": 7,
        "num_warps": 2,
        "compile_time": 23.22779154777527
    },
    {
        "BLOCK_SIZE_M": 16,
        "BLOCK_SIZE_N": 512,
        "BLOCK_SIZE_K": 256,
        "GROUP_SIZE_M": 8,
        "num_stages": 7,
        "num_warps": 4,
        "compile_time": 7.390069246292114
    },
    {
        "BLOCK_SIZE_M": 16,
        "BLOCK_SIZE_N": 512,
        "BLOCK_SIZE_K": 256,
        "GROUP_SIZE_M": 8,
        "num_stages": 7,
        "num_warps": 8,
        "compile_time": 11.510132789611816
    },
    {
        "BLOCK_SIZE_M": 16,
        "BLOCK_SIZE_N": 512,
        "BLOCK_SIZE_K": 256,
        "GROUP_SIZE_M": 8,
        "num_stages": 7,
        "num_warps": 16,
        "compile_time": 2.628145456314087
    },
    {
        "BLOCK_SIZE_M": 16,
        "BLOCK_SIZE_N": 512,
        "BLOCK_SIZE_K": 256,
        "GROUP_SIZE_M": 8,
        "num_stages": 7,
        "num_warps": 32,
        "compile_time": 1.2870450019836426
    },
    {
        "BLOCK_SIZE_M": 16,
        "BLOCK_SIZE_N": 512,
        "BLOCK_SIZE_K": 256,
        "GROUP_SIZE_M": 8,
        "num_stages": 8,
        "num_warps": 2,
        "compile_time": 6.563180208206177
    },
    {
        "BLOCK_SIZE_M": 16,
        "BLOCK_SIZE_N": 512,
        "BLOCK_SIZE_K": 256,
        "GROUP_SIZE_M": 8,
        "num_stages": 8,
        "num_warps": 4,
        "compile_time": 7.732784748077393
    },
    {
        "BLOCK_SIZE_M": 16,
        "BLOCK_SIZE_N": 512,
        "BLOCK_SIZE_K": 256,
        "GROUP_SIZE_M": 8,
        "num_stages": 8,
        "num_warps": 8,
        "compile_time": 11.217792749404907
    },
    {
        "BLOCK_SIZE_M": 16,
        "BLOCK_SIZE_N": 512,
        "BLOCK_SIZE_K": 256,
        "GROUP_SIZE_M": 8,
        "num_stages": 8,
        "num_warps": 16,
        "compile_time": 2.821739912033081
    },
    {
        "BLOCK_SIZE_M": 16,
        "BLOCK_SIZE_N": 512,
        "BLOCK_SIZE_K": 256,
        "GROUP_SIZE_M": 8,
        "num_stages": 8,
        "num_warps": 32,
        "compile_time": 1.4160382747650146
    },
    {
        "BLOCK_SIZE_M": 16,
        "BLOCK_SIZE_N": 512,
        "BLOCK_SIZE_K": 512,
        "GROUP_SIZE_M": 8,
        "num_stages": 1,
        "num_warps": 2,
        "compile_time": 70.59135389328003
    },
    {
        "BLOCK_SIZE_M": 16,
        "BLOCK_SIZE_N": 512,
        "BLOCK_SIZE_K": 512,
        "GROUP_SIZE_M": 8,
        "num_stages": 1,
        "num_warps": 4,
        "compile_time": 18.819525718688965
    },
    {
        "BLOCK_SIZE_M": 16,
        "BLOCK_SIZE_N": 512,
        "BLOCK_SIZE_K": 512,
        "GROUP_SIZE_M": 8,
        "num_stages": 1,
        "num_warps": 8,
        "compile_time": 8.091806888580322
    },
    {
        "BLOCK_SIZE_M": 16,
        "BLOCK_SIZE_N": 512,
        "BLOCK_SIZE_K": 512,
        "GROUP_SIZE_M": 8,
        "num_stages": 1,
        "num_warps": 16,
        "compile_time": 2.8318216800689697
    },
    {
        "BLOCK_SIZE_M": 16,
        "BLOCK_SIZE_N": 512,
        "BLOCK_SIZE_K": 512,
        "GROUP_SIZE_M": 8,
        "num_stages": 1,
        "num_warps": 32,
        "compile_time": 1.1853032112121582
    },
    {
        "BLOCK_SIZE_M": 16,
        "BLOCK_SIZE_N": 512,
        "BLOCK_SIZE_K": 512,
        "GROUP_SIZE_M": 8,
        "num_stages": 2,
        "num_warps": 2,
        "compile_time": 71.88615608215332
    },
    {
        "BLOCK_SIZE_M": 16,
        "BLOCK_SIZE_N": 512,
        "BLOCK_SIZE_K": 512,
        "GROUP_SIZE_M": 8,
        "num_stages": 2,
        "num_warps": 4,
        "compile_time": 19.355672359466553
    },
    {
        "BLOCK_SIZE_M": 16,
        "BLOCK_SIZE_N": 512,
        "BLOCK_SIZE_K": 512,
        "GROUP_SIZE_M": 8,
        "num_stages": 2,
        "num_warps": 8,
        "compile_time": 8.208082675933838
    },
    {
        "BLOCK_SIZE_M": 16,
        "BLOCK_SIZE_N": 512,
        "BLOCK_SIZE_K": 512,
        "GROUP_SIZE_M": 8,
        "num_stages": 2,
        "num_warps": 16,
        "compile_time": 3.1873717308044434
    },
    {
        "BLOCK_SIZE_M": 16,
        "BLOCK_SIZE_N": 512,
        "BLOCK_SIZE_K": 512,
        "GROUP_SIZE_M": 8,
        "num_stages": 2,
        "num_warps": 32,
        "compile_time": 1.3411986827850342
    },
    {
        "BLOCK_SIZE_M": 16,
        "BLOCK_SIZE_N": 512,
        "BLOCK_SIZE_K": 512,
        "GROUP_SIZE_M": 8,
        "num_stages": 3,
        "num_warps": 2,
        "compile_time": 7.242588758468628
    },
    {
        "BLOCK_SIZE_M": 16,
        "BLOCK_SIZE_N": 512,
        "BLOCK_SIZE_K": 512,
        "GROUP_SIZE_M": 8,
        "num_stages": 3,
        "num_warps": 4,
        "compile_time": 20.04286289215088
    },
    {
        "BLOCK_SIZE_M": 16,
        "BLOCK_SIZE_N": 512,
        "BLOCK_SIZE_K": 512,
        "GROUP_SIZE_M": 8,
        "num_stages": 3,
        "num_warps": 8,
        "compile_time": 6.0493245124816895
    },
    {
        "BLOCK_SIZE_M": 16,
        "BLOCK_SIZE_N": 512,
        "BLOCK_SIZE_K": 512,
        "GROUP_SIZE_M": 8,
        "num_stages": 3,
        "num_warps": 16,
        "compile_time": 10.696112394332886
    },
    {
        "BLOCK_SIZE_M": 16,
        "BLOCK_SIZE_N": 512,
        "BLOCK_SIZE_K": 512,
        "GROUP_SIZE_M": 8,
        "num_stages": 3,
        "num_warps": 32,
        "compile_time": 1.9843590259552002
    },
    {
        "BLOCK_SIZE_M": 16,
        "BLOCK_SIZE_N": 512,
        "BLOCK_SIZE_K": 512,
        "GROUP_SIZE_M": 8,
        "num_stages": 4,
        "num_warps": 2,
        "compile_time": 8.9714195728302
    },
    {
        "BLOCK_SIZE_M": 16,
        "BLOCK_SIZE_N": 512,
        "BLOCK_SIZE_K": 512,
        "GROUP_SIZE_M": 8,
        "num_stages": 4,
        "num_warps": 4,
        "compile_time": 21.107471227645874
    },
    {
        "BLOCK_SIZE_M": 16,
        "BLOCK_SIZE_N": 512,
        "BLOCK_SIZE_K": 512,
        "GROUP_SIZE_M": 8,
        "num_stages": 4,
        "num_warps": 8,
        "compile_time": 6.364708185195923
    },
    {
        "BLOCK_SIZE_M": 16,
        "BLOCK_SIZE_N": 512,
        "BLOCK_SIZE_K": 512,
        "GROUP_SIZE_M": 8,
        "num_stages": 4,
        "num_warps": 16,
        "compile_time": 10.841549634933472
    },
    {
        "BLOCK_SIZE_M": 16,
        "BLOCK_SIZE_N": 512,
        "BLOCK_SIZE_K": 512,
        "GROUP_SIZE_M": 8,
        "num_stages": 4,
        "num_warps": 32,
        "compile_time": 2.2143726348876953
    },
    {
        "BLOCK_SIZE_M": 16,
        "BLOCK_SIZE_N": 512,
        "BLOCK_SIZE_K": 512,
        "GROUP_SIZE_M": 8,
        "num_stages": 5,
        "num_warps": 2,
        "compile_time": 10.804274559020996
    },
    {
        "BLOCK_SIZE_M": 16,
        "BLOCK_SIZE_N": 512,
        "BLOCK_SIZE_K": 512,
        "GROUP_SIZE_M": 8,
        "num_stages": 5,
        "num_warps": 4,
        "compile_time": 21.83970594406128
    },
    {
        "BLOCK_SIZE_M": 16,
        "BLOCK_SIZE_N": 512,
        "BLOCK_SIZE_K": 512,
        "GROUP_SIZE_M": 8,
        "num_stages": 5,
        "num_warps": 8,
        "compile_time": 6.7970545291900635
    },
    {
        "BLOCK_SIZE_M": 16,
        "BLOCK_SIZE_N": 512,
        "BLOCK_SIZE_K": 512,
        "GROUP_SIZE_M": 8,
        "num_stages": 5,
        "num_warps": 16,
        "compile_time": 11.050515174865723
    },
    {
        "BLOCK_SIZE_M": 16,
        "BLOCK_SIZE_N": 512,
        "BLOCK_SIZE_K": 512,
        "GROUP_SIZE_M": 8,
        "num_stages": 5,
        "num_warps": 32,
        "compile_time": 2.437959671020508
    },
    {
        "BLOCK_SIZE_M": 16,
        "BLOCK_SIZE_N": 512,
        "BLOCK_SIZE_K": 512,
        "GROUP_SIZE_M": 8,
        "num_stages": 6,
        "num_warps": 2,
        "compile_time": 12.653477430343628
    },
    {
        "BLOCK_SIZE_M": 16,
        "BLOCK_SIZE_N": 512,
        "BLOCK_SIZE_K": 512,
        "GROUP_SIZE_M": 8,
        "num_stages": 6,
        "num_warps": 4,
        "compile_time": 23.14888906478882
    },
    {
        "BLOCK_SIZE_M": 16,
        "BLOCK_SIZE_N": 512,
        "BLOCK_SIZE_K": 512,
        "GROUP_SIZE_M": 8,
        "num_stages": 6,
        "num_warps": 8,
        "compile_time": 7.290618658065796
    },
    {
        "BLOCK_SIZE_M": 16,
        "BLOCK_SIZE_N": 512,
        "BLOCK_SIZE_K": 512,
        "GROUP_SIZE_M": 8,
        "num_stages": 6,
        "num_warps": 16,
        "compile_time": 11.341021299362183
    },
    {
        "BLOCK_SIZE_M": 16,
        "BLOCK_SIZE_N": 512,
        "BLOCK_SIZE_K": 512,
        "GROUP_SIZE_M": 8,
        "num_stages": 6,
        "num_warps": 32,
        "compile_time": 2.5713021755218506
    },
    {
        "BLOCK_SIZE_M": 16,
        "BLOCK_SIZE_N": 512,
        "BLOCK_SIZE_K": 512,
        "GROUP_SIZE_M": 8,
        "num_stages": 7,
        "num_warps": 2,
        "compile_time": 14.943873643875122
    },
    {
        "BLOCK_SIZE_M": 16,
        "BLOCK_SIZE_N": 512,
        "BLOCK_SIZE_K": 512,
        "GROUP_SIZE_M": 8,
        "num_stages": 7,
        "num_warps": 4,
        "compile_time": 6.492305040359497
    },
    {
        "BLOCK_SIZE_M": 16,
        "BLOCK_SIZE_N": 512,
        "BLOCK_SIZE_K": 512,
        "GROUP_SIZE_M": 8,
        "num_stages": 7,
        "num_warps": 8,
        "compile_time": 7.8332743644714355
    },
    {
        "BLOCK_SIZE_M": 16,
        "BLOCK_SIZE_N": 512,
        "BLOCK_SIZE_K": 512,
        "GROUP_SIZE_M": 8,
        "num_stages": 7,
        "num_warps": 16,
        "compile_time": 11.741709232330322
    },
    {
        "BLOCK_SIZE_M": 16,
        "BLOCK_SIZE_N": 512,
        "BLOCK_SIZE_K": 512,
        "GROUP_SIZE_M": 8,
        "num_stages": 7,
        "num_warps": 32,
        "compile_time": 2.7924280166625977
    },
    {
        "BLOCK_SIZE_M": 16,
        "BLOCK_SIZE_N": 512,
        "BLOCK_SIZE_K": 512,
        "GROUP_SIZE_M": 8,
        "num_stages": 8,
        "num_warps": 2,
        "compile_time": 16.516520738601685
    },
    {
        "BLOCK_SIZE_M": 16,
        "BLOCK_SIZE_N": 512,
        "BLOCK_SIZE_K": 512,
        "GROUP_SIZE_M": 8,
        "num_stages": 8,
        "num_warps": 4,
        "compile_time": 7.752456188201904
    },
    {
        "BLOCK_SIZE_M": 16,
        "BLOCK_SIZE_N": 512,
        "BLOCK_SIZE_K": 512,
        "GROUP_SIZE_M": 8,
        "num_stages": 8,
        "num_warps": 8,
        "compile_time": 8.603708505630493
    },
    {
        "BLOCK_SIZE_M": 16,
        "BLOCK_SIZE_N": 512,
        "BLOCK_SIZE_K": 512,
        "GROUP_SIZE_M": 8,
        "num_stages": 8,
        "num_warps": 16,
        "compile_time": 12.301797866821289
    },
    {
        "BLOCK_SIZE_M": 16,
        "BLOCK_SIZE_N": 512,
        "BLOCK_SIZE_K": 512,
        "GROUP_SIZE_M": 8,
        "num_stages": 8,
        "num_warps": 32,
        "compile_time": 0.0045397281646728516
    },
    {
        "BLOCK_SIZE_M": 32,
        "BLOCK_SIZE_N": 16,
        "BLOCK_SIZE_K": 256,
        "GROUP_SIZE_M": 8,
        "num_stages": 8,
        "num_warps": 2,
        "compile_time": 1.4871106147766113
    },
    {
        "BLOCK_SIZE_M": 32,
        "BLOCK_SIZE_N": 16,
        "BLOCK_SIZE_K": 256,
        "GROUP_SIZE_M": 8,
        "num_stages": 8,
        "num_warps": 4,
        "compile_time": 0.9102611541748047
    },
    {
        "BLOCK_SIZE_M": 32,
        "BLOCK_SIZE_N": 16,
        "BLOCK_SIZE_K": 256,
        "GROUP_SIZE_M": 8,
        "num_stages": 8,
        "num_warps": 8,
        "compile_time": 0.6616902351379395
    },
    {
        "BLOCK_SIZE_M": 32,
        "BLOCK_SIZE_N": 16,
        "BLOCK_SIZE_K": 256,
        "GROUP_SIZE_M": 8,
        "num_stages": 8,
        "num_warps": 16,
        "compile_time": 0.5548598766326904
    },
    {
        "BLOCK_SIZE_M": 32,
        "BLOCK_SIZE_N": 16,
        "BLOCK_SIZE_K": 256,
        "GROUP_SIZE_M": 8,
        "num_stages": 8,
        "num_warps": 32,
        "compile_time": 0.5211102962493896
    },
    {
        "BLOCK_SIZE_M": 32,
        "BLOCK_SIZE_N": 16,
        "BLOCK_SIZE_K": 512,
        "GROUP_SIZE_M": 8,
        "num_stages": 5,
        "num_warps": 2,
        "compile_time": 2.7507104873657227
    },
    {
        "BLOCK_SIZE_M": 32,
        "BLOCK_SIZE_N": 16,
        "BLOCK_SIZE_K": 512,
        "GROUP_SIZE_M": 8,
        "num_stages": 5,
        "num_warps": 4,
        "compile_time": 1.2779064178466797
    },
    {
        "BLOCK_SIZE_M": 32,
        "BLOCK_SIZE_N": 16,
        "BLOCK_SIZE_K": 512,
        "GROUP_SIZE_M": 8,
        "num_stages": 5,
        "num_warps": 8,
        "compile_time": 0.8534555435180664
    },
    {
        "BLOCK_SIZE_M": 32,
        "BLOCK_SIZE_N": 16,
        "BLOCK_SIZE_K": 512,
        "GROUP_SIZE_M": 8,
        "num_stages": 5,
        "num_warps": 16,
        "compile_time": 0.7009994983673096
    },
    {
        "BLOCK_SIZE_M": 32,
        "BLOCK_SIZE_N": 16,
        "BLOCK_SIZE_K": 512,
        "GROUP_SIZE_M": 8,
        "num_stages": 5,
        "num_warps": 32,
        "compile_time": 0.6255712509155273
    },
    {
        "BLOCK_SIZE_M": 32,
        "BLOCK_SIZE_N": 16,
        "BLOCK_SIZE_K": 512,
        "GROUP_SIZE_M": 8,
        "num_stages": 6,
        "num_warps": 2,
        "compile_time": 2.8982834815979004
    },
    {
        "BLOCK_SIZE_M": 32,
        "BLOCK_SIZE_N": 16,
        "BLOCK_SIZE_K": 512,
        "GROUP_SIZE_M": 8,
        "num_stages": 6,
        "num_warps": 4,
        "compile_time": 1.3638033866882324
    },
    {
        "BLOCK_SIZE_M": 32,
        "BLOCK_SIZE_N": 16,
        "BLOCK_SIZE_K": 512,
        "GROUP_SIZE_M": 8,
        "num_stages": 6,
        "num_warps": 8,
        "compile_time": 0.9153108596801758
    },
    {
        "BLOCK_SIZE_M": 32,
        "BLOCK_SIZE_N": 16,
        "BLOCK_SIZE_K": 512,
        "GROUP_SIZE_M": 8,
        "num_stages": 6,
        "num_warps": 16,
        "compile_time": 0.7344257831573486
    },
    {
        "BLOCK_SIZE_M": 32,
        "BLOCK_SIZE_N": 16,
        "BLOCK_SIZE_K": 512,
        "GROUP_SIZE_M": 8,
        "num_stages": 6,
        "num_warps": 32,
        "compile_time": 0.650458574295044
    },
    {
        "BLOCK_SIZE_M": 32,
        "BLOCK_SIZE_N": 16,
        "BLOCK_SIZE_K": 512,
        "GROUP_SIZE_M": 8,
        "num_stages": 7,
        "num_warps": 2,
        "compile_time": 3.2034361362457275
    },
    {
        "BLOCK_SIZE_M": 32,
        "BLOCK_SIZE_N": 16,
        "BLOCK_SIZE_K": 512,
        "GROUP_SIZE_M": 8,
        "num_stages": 7,
        "num_warps": 4,
        "compile_time": 1.5048043727874756
    },
    {
        "BLOCK_SIZE_M": 32,
        "BLOCK_SIZE_N": 16,
        "BLOCK_SIZE_K": 512,
        "GROUP_SIZE_M": 8,
        "num_stages": 7,
        "num_warps": 8,
        "compile_time": 0.9673867225646973
    },
    {
        "BLOCK_SIZE_M": 32,
        "BLOCK_SIZE_N": 16,
        "BLOCK_SIZE_K": 512,
        "GROUP_SIZE_M": 8,
        "num_stages": 7,
        "num_warps": 16,
        "compile_time": 0.7628188133239746
    },
    {
        "BLOCK_SIZE_M": 32,
        "BLOCK_SIZE_N": 16,
        "BLOCK_SIZE_K": 512,
        "GROUP_SIZE_M": 8,
        "num_stages": 7,
        "num_warps": 32,
        "compile_time": 0.005487680435180664
    },
    {
        "BLOCK_SIZE_M": 32,
        "BLOCK_SIZE_N": 16,
        "BLOCK_SIZE_K": 512,
        "GROUP_SIZE_M": 8,
        "num_stages": 8,
        "num_warps": 2,
        "compile_time": 3.32692813873291
    },
    {
        "BLOCK_SIZE_M": 32,
        "BLOCK_SIZE_N": 16,
        "BLOCK_SIZE_K": 512,
        "GROUP_SIZE_M": 8,
        "num_stages": 8,
        "num_warps": 4,
        "compile_time": 1.5978400707244873
    },
    {
        "BLOCK_SIZE_M": 32,
        "BLOCK_SIZE_N": 16,
        "BLOCK_SIZE_K": 512,
        "GROUP_SIZE_M": 8,
        "num_stages": 8,
        "num_warps": 8,
        "compile_time": 1.0081045627593994
    },
    {
        "BLOCK_SIZE_M": 32,
        "BLOCK_SIZE_N": 16,
        "BLOCK_SIZE_K": 512,
        "GROUP_SIZE_M": 8,
        "num_stages": 8,
        "num_warps": 16,
        "compile_time": 0.7857840061187744
    },
    {
        "BLOCK_SIZE_M": 32,
        "BLOCK_SIZE_N": 16,
        "BLOCK_SIZE_K": 512,
        "GROUP_SIZE_M": 8,
        "num_stages": 8,
        "num_warps": 32,
        "compile_time": 0.6752557754516602
    },
    {
        "BLOCK_SIZE_M": 32,
        "BLOCK_SIZE_N": 32,
        "BLOCK_SIZE_K": 256,
        "GROUP_SIZE_M": 8,
        "num_stages": 7,
        "num_warps": 2,
        "compile_time": 1.7666659355163574
    },
    {
        "BLOCK_SIZE_M": 32,
        "BLOCK_SIZE_N": 32,
        "BLOCK_SIZE_K": 256,
        "GROUP_SIZE_M": 8,
        "num_stages": 7,
        "num_warps": 4,
        "compile_time": 1.0358636379241943
    },
    {
        "BLOCK_SIZE_M": 32,
        "BLOCK_SIZE_N": 32,
        "BLOCK_SIZE_K": 256,
        "GROUP_SIZE_M": 8,
        "num_stages": 7,
        "num_warps": 8,
        "compile_time": 0.7183408737182617
    },
    {
        "BLOCK_SIZE_M": 32,
        "BLOCK_SIZE_N": 32,
        "BLOCK_SIZE_K": 256,
        "GROUP_SIZE_M": 8,
        "num_stages": 7,
        "num_warps": 16,
        "compile_time": 0.5661017894744873
    },
    {
        "BLOCK_SIZE_M": 32,
        "BLOCK_SIZE_N": 32,
        "BLOCK_SIZE_K": 256,
        "GROUP_SIZE_M": 8,
        "num_stages": 7,
        "num_warps": 32,
        "compile_time": 0.5033166408538818
    },
    {
        "BLOCK_SIZE_M": 32,
        "BLOCK_SIZE_N": 32,
        "BLOCK_SIZE_K": 256,
        "GROUP_SIZE_M": 8,
        "num_stages": 8,
        "num_warps": 2,
        "compile_time": 1.9110188484191895
    },
    {
        "BLOCK_SIZE_M": 32,
        "BLOCK_SIZE_N": 32,
        "BLOCK_SIZE_K": 256,
        "GROUP_SIZE_M": 8,
        "num_stages": 8,
        "num_warps": 4,
        "compile_time": 1.1279711723327637
    },
    {
        "BLOCK_SIZE_M": 32,
        "BLOCK_SIZE_N": 32,
        "BLOCK_SIZE_K": 256,
        "GROUP_SIZE_M": 8,
        "num_stages": 8,
        "num_warps": 8,
        "compile_time": 0.7556109428405762
    },
    {
        "BLOCK_SIZE_M": 32,
        "BLOCK_SIZE_N": 32,
        "BLOCK_SIZE_K": 256,
        "GROUP_SIZE_M": 8,
        "num_stages": 8,
        "num_warps": 16,
        "compile_time": 0.5871455669403076
    },
    {
        "BLOCK_SIZE_M": 32,
        "BLOCK_SIZE_N": 32,
        "BLOCK_SIZE_K": 256,
        "GROUP_SIZE_M": 8,
        "num_stages": 8,
        "num_warps": 32,
        "compile_time": 0.5152919292449951
    },
    {
        "BLOCK_SIZE_M": 32,
        "BLOCK_SIZE_N": 32,
        "BLOCK_SIZE_K": 512,
        "GROUP_SIZE_M": 8,
        "num_stages": 4,
        "num_warps": 2,
        "compile_time": 3.7936761379241943
    },
    {
        "BLOCK_SIZE_M": 32,
        "BLOCK_SIZE_N": 32,
        "BLOCK_SIZE_K": 512,
        "GROUP_SIZE_M": 8,
        "num_stages": 4,
        "num_warps": 4,
        "compile_time": 1.5025396347045898
    },
    {
        "BLOCK_SIZE_M": 32,
        "BLOCK_SIZE_N": 32,
        "BLOCK_SIZE_K": 512,
        "GROUP_SIZE_M": 8,
        "num_stages": 4,
        "num_warps": 8,
        "compile_time": 0.9324421882629395
    },
    {
        "BLOCK_SIZE_M": 32,
        "BLOCK_SIZE_N": 32,
        "BLOCK_SIZE_K": 512,
        "GROUP_SIZE_M": 8,
        "num_stages": 4,
        "num_warps": 16,
        "compile_time": 0.720325231552124
    },
    {
        "BLOCK_SIZE_M": 32,
        "BLOCK_SIZE_N": 32,
        "BLOCK_SIZE_K": 512,
        "GROUP_SIZE_M": 8,
        "num_stages": 4,
        "num_warps": 32,
        "compile_time": 0.6233334541320801
    },
    {
        "BLOCK_SIZE_M": 32,
        "BLOCK_SIZE_N": 32,
        "BLOCK_SIZE_K": 512,
        "GROUP_SIZE_M": 8,
        "num_stages": 5,
        "num_warps": 2,
        "compile_time": 4.013369798660278
    },
    {
        "BLOCK_SIZE_M": 32,
        "BLOCK_SIZE_N": 32,
        "BLOCK_SIZE_K": 512,
        "GROUP_SIZE_M": 8,
        "num_stages": 5,
        "num_warps": 4,
        "compile_time": 1.653712511062622
    },
    {
        "BLOCK_SIZE_M": 32,
        "BLOCK_SIZE_N": 32,
        "BLOCK_SIZE_K": 512,
        "GROUP_SIZE_M": 8,
        "num_stages": 5,
        "num_warps": 8,
        "compile_time": 0.9843835830688477
    },
    {
        "BLOCK_SIZE_M": 32,
        "BLOCK_SIZE_N": 32,
        "BLOCK_SIZE_K": 512,
        "GROUP_SIZE_M": 8,
        "num_stages": 5,
        "num_warps": 16,
        "compile_time": 0.7609302997589111
    },
    {
        "BLOCK_SIZE_M": 32,
        "BLOCK_SIZE_N": 32,
        "BLOCK_SIZE_K": 512,
        "GROUP_SIZE_M": 8,
        "num_stages": 5,
        "num_warps": 32,
        "compile_time": 0.004097700119018555
    },
    {
        "BLOCK_SIZE_M": 32,
        "BLOCK_SIZE_N": 32,
        "BLOCK_SIZE_K": 512,
        "GROUP_SIZE_M": 8,
        "num_stages": 6,
        "num_warps": 2,
        "compile_time": 4.225654125213623
    },
    {
        "BLOCK_SIZE_M": 32,
        "BLOCK_SIZE_N": 32,
        "BLOCK_SIZE_K": 512,
        "GROUP_SIZE_M": 8,
        "num_stages": 6,
        "num_warps": 4,
        "compile_time": 1.793656587600708
    },
    {
        "BLOCK_SIZE_M": 32,
        "BLOCK_SIZE_N": 32,
        "BLOCK_SIZE_K": 512,
        "GROUP_SIZE_M": 8,
        "num_stages": 6,
        "num_warps": 8,
        "compile_time": 1.0782625675201416
    },
    {
        "BLOCK_SIZE_M": 32,
        "BLOCK_SIZE_N": 32,
        "BLOCK_SIZE_K": 512,
        "GROUP_SIZE_M": 8,
        "num_stages": 6,
        "num_warps": 16,
        "compile_time": 0.8010199069976807
    },
    {
        "BLOCK_SIZE_M": 32,
        "BLOCK_SIZE_N": 32,
        "BLOCK_SIZE_K": 512,
        "GROUP_SIZE_M": 8,
        "num_stages": 6,
        "num_warps": 32,
        "compile_time": 0.6779208183288574
    },
    {
        "BLOCK_SIZE_M": 32,
        "BLOCK_SIZE_N": 32,
        "BLOCK_SIZE_K": 512,
        "GROUP_SIZE_M": 8,
        "num_stages": 7,
        "num_warps": 2,
        "compile_time": 4.45447039604187
    },
    {
        "BLOCK_SIZE_M": 32,
        "BLOCK_SIZE_N": 32,
        "BLOCK_SIZE_K": 512,
        "GROUP_SIZE_M": 8,
        "num_stages": 7,
        "num_warps": 4,
        "compile_time": 1.8994245529174805
    },
    {
        "BLOCK_SIZE_M": 32,
        "BLOCK_SIZE_N": 32,
        "BLOCK_SIZE_K": 512,
        "GROUP_SIZE_M": 8,
        "num_stages": 7,
        "num_warps": 8,
        "compile_time": 1.1326334476470947
    },
    {
        "BLOCK_SIZE_M": 32,
        "BLOCK_SIZE_N": 32,
        "BLOCK_SIZE_K": 512,
        "GROUP_SIZE_M": 8,
        "num_stages": 7,
        "num_warps": 16,
        "compile_time": 0.8233838081359863
    },
    {
        "BLOCK_SIZE_M": 32,
        "BLOCK_SIZE_N": 32,
        "BLOCK_SIZE_K": 512,
        "GROUP_SIZE_M": 8,
        "num_stages": 7,
        "num_warps": 32,
        "compile_time": 0.6976346969604492
    },
    {
        "BLOCK_SIZE_M": 32,
        "BLOCK_SIZE_N": 32,
        "BLOCK_SIZE_K": 512,
        "GROUP_SIZE_M": 8,
        "num_stages": 8,
        "num_warps": 2,
        "compile_time": 4.703619480133057
    },
    {
        "BLOCK_SIZE_M": 32,
        "BLOCK_SIZE_N": 32,
        "BLOCK_SIZE_K": 512,
        "GROUP_SIZE_M": 8,
        "num_stages": 8,
        "num_warps": 4,
        "compile_time": 2.0533087253570557
    },
    {
        "BLOCK_SIZE_M": 32,
        "BLOCK_SIZE_N": 32,
        "BLOCK_SIZE_K": 512,
        "GROUP_SIZE_M": 8,
        "num_stages": 8,
        "num_warps": 8,
        "compile_time": 1.2199947834014893
    },
    {
        "BLOCK_SIZE_M": 32,
        "BLOCK_SIZE_N": 32,
        "BLOCK_SIZE_K": 512,
        "GROUP_SIZE_M": 8,
        "num_stages": 8,
        "num_warps": 16,
        "compile_time": 0.937385082244873
    },
    {
        "BLOCK_SIZE_M": 32,
        "BLOCK_SIZE_N": 32,
        "BLOCK_SIZE_K": 512,
        "GROUP_SIZE_M": 8,
        "num_stages": 8,
        "num_warps": 32,
        "compile_time": 0.7255425453186035
    },
    {
        "BLOCK_SIZE_M": 32,
        "BLOCK_SIZE_N": 64,
        "BLOCK_SIZE_K": 128,
        "GROUP_SIZE_M": 8,
        "num_stages": 8,
        "num_warps": 2,
        "compile_time": 1.4982433319091797
    },
    {
        "BLOCK_SIZE_M": 32,
        "BLOCK_SIZE_N": 64,
        "BLOCK_SIZE_K": 128,
        "GROUP_SIZE_M": 8,
        "num_stages": 8,
        "num_warps": 4,
        "compile_time": 0.9251689910888672
    },
    {
        "BLOCK_SIZE_M": 32,
        "BLOCK_SIZE_N": 64,
        "BLOCK_SIZE_K": 128,
        "GROUP_SIZE_M": 8,
        "num_stages": 8,
        "num_warps": 8,
        "compile_time": 0.6195499897003174
    },
    {
        "BLOCK_SIZE_M": 32,
        "BLOCK_SIZE_N": 64,
        "BLOCK_SIZE_K": 128,
        "GROUP_SIZE_M": 8,
        "num_stages": 8,
        "num_warps": 16,
        "compile_time": 0.4843277931213379
    },
    {
        "BLOCK_SIZE_M": 32,
        "BLOCK_SIZE_N": 64,
        "BLOCK_SIZE_K": 128,
        "GROUP_SIZE_M": 8,
        "num_stages": 8,
        "num_warps": 32,
        "compile_time": 0.4525935649871826
    },
    {
        "BLOCK_SIZE_M": 32,
        "BLOCK_SIZE_N": 64,
        "BLOCK_SIZE_K": 256,
        "GROUP_SIZE_M": 8,
        "num_stages": 5,
        "num_warps": 2,
        "compile_time": 2.789229154586792
    },
    {
        "BLOCK_SIZE_M": 32,
        "BLOCK_SIZE_N": 64,
        "BLOCK_SIZE_K": 256,
        "GROUP_SIZE_M": 8,
        "num_stages": 5,
        "num_warps": 4,
        "compile_time": 1.2629551887512207
    },
    {
        "BLOCK_SIZE_M": 32,
        "BLOCK_SIZE_N": 64,
        "BLOCK_SIZE_K": 256,
        "GROUP_SIZE_M": 8,
        "num_stages": 5,
        "num_warps": 8,
        "compile_time": 0.819706916809082
    },
    {
        "BLOCK_SIZE_M": 32,
        "BLOCK_SIZE_N": 64,
        "BLOCK_SIZE_K": 256,
        "GROUP_SIZE_M": 8,
        "num_stages": 5,
        "num_warps": 16,
        "compile_time": 0.004873514175415039
    },
    {
        "BLOCK_SIZE_M": 32,
        "BLOCK_SIZE_N": 64,
        "BLOCK_SIZE_K": 256,
        "GROUP_SIZE_M": 8,
        "num_stages": 5,
        "num_warps": 32,
        "compile_time": 0.5134332180023193
    },
    {
        "BLOCK_SIZE_M": 32,
        "BLOCK_SIZE_N": 64,
        "BLOCK_SIZE_K": 256,
        "GROUP_SIZE_M": 8,
        "num_stages": 6,
        "num_warps": 2,
        "compile_time": 2.9474973678588867
    },
    {
        "BLOCK_SIZE_M": 32,
        "BLOCK_SIZE_N": 64,
        "BLOCK_SIZE_K": 256,
        "GROUP_SIZE_M": 8,
        "num_stages": 6,
        "num_warps": 4,
        "compile_time": 1.3825645446777344
    },
    {
        "BLOCK_SIZE_M": 32,
        "BLOCK_SIZE_N": 64,
        "BLOCK_SIZE_K": 256,
        "GROUP_SIZE_M": 8,
        "num_stages": 6,
        "num_warps": 8,
        "compile_time": 0.8634014129638672
    },
    {
        "BLOCK_SIZE_M": 32,
        "BLOCK_SIZE_N": 64,
        "BLOCK_SIZE_K": 256,
        "GROUP_SIZE_M": 8,
        "num_stages": 6,
        "num_warps": 16,
        "compile_time": 0.6228711605072021
    },
    {
        "BLOCK_SIZE_M": 32,
        "BLOCK_SIZE_N": 64,
        "BLOCK_SIZE_K": 256,
        "GROUP_SIZE_M": 8,
        "num_stages": 6,
        "num_warps": 32,
        "compile_time": 0.5223908424377441
    },
    {
        "BLOCK_SIZE_M": 32,
        "BLOCK_SIZE_N": 64,
        "BLOCK_SIZE_K": 256,
        "GROUP_SIZE_M": 8,
        "num_stages": 7,
        "num_warps": 2,
        "compile_time": 3.1022374629974365
    },
    {
        "BLOCK_SIZE_M": 32,
        "BLOCK_SIZE_N": 64,
        "BLOCK_SIZE_K": 256,
        "GROUP_SIZE_M": 8,
        "num_stages": 7,
        "num_warps": 4,
        "compile_time": 1.513692855834961
    },
    {
        "BLOCK_SIZE_M": 32,
        "BLOCK_SIZE_N": 64,
        "BLOCK_SIZE_K": 256,
        "GROUP_SIZE_M": 8,
        "num_stages": 7,
        "num_warps": 8,
        "compile_time": 0.9185457229614258
    },
    {
        "BLOCK_SIZE_M": 32,
        "BLOCK_SIZE_N": 64,
        "BLOCK_SIZE_K": 256,
        "GROUP_SIZE_M": 8,
        "num_stages": 7,
        "num_warps": 16,
        "compile_time": 0.6538364887237549
    },
    {
        "BLOCK_SIZE_M": 32,
        "BLOCK_SIZE_N": 64,
        "BLOCK_SIZE_K": 256,
        "GROUP_SIZE_M": 8,
        "num_stages": 7,
        "num_warps": 32,
        "compile_time": 0.5461940765380859
    },
    {
        "BLOCK_SIZE_M": 32,
        "BLOCK_SIZE_N": 64,
        "BLOCK_SIZE_K": 256,
        "GROUP_SIZE_M": 8,
        "num_stages": 8,
        "num_warps": 2,
        "compile_time": 3.263406991958618
    },
    {
        "BLOCK_SIZE_M": 32,
        "BLOCK_SIZE_N": 64,
        "BLOCK_SIZE_K": 256,
        "GROUP_SIZE_M": 8,
        "num_stages": 8,
        "num_warps": 4,
        "compile_time": 1.5733835697174072
    },
    {
        "BLOCK_SIZE_M": 32,
        "BLOCK_SIZE_N": 64,
        "BLOCK_SIZE_K": 256,
        "GROUP_SIZE_M": 8,
        "num_stages": 8,
        "num_warps": 8,
        "compile_time": 0.9739618301391602
    },
    {
        "BLOCK_SIZE_M": 32,
        "BLOCK_SIZE_N": 64,
        "BLOCK_SIZE_K": 256,
        "GROUP_SIZE_M": 8,
        "num_stages": 8,
        "num_warps": 16,
        "compile_time": 0.6956017017364502
    },
    {
        "BLOCK_SIZE_M": 32,
        "BLOCK_SIZE_N": 64,
        "BLOCK_SIZE_K": 256,
        "GROUP_SIZE_M": 8,
        "num_stages": 8,
        "num_warps": 32,
        "compile_time": 0.5671935081481934
    },
    {
        "BLOCK_SIZE_M": 32,
        "BLOCK_SIZE_N": 64,
        "BLOCK_SIZE_K": 512,
        "GROUP_SIZE_M": 8,
        "num_stages": 3,
        "num_warps": 2,
        "compile_time": 12.515328168869019
    },
    {
        "BLOCK_SIZE_M": 32,
        "BLOCK_SIZE_N": 64,
        "BLOCK_SIZE_K": 512,
        "GROUP_SIZE_M": 8,
        "num_stages": 3,
        "num_warps": 4,
        "compile_time": 2.4561095237731934
    },
    {
        "BLOCK_SIZE_M": 32,
        "BLOCK_SIZE_N": 64,
        "BLOCK_SIZE_K": 512,
        "GROUP_SIZE_M": 8,
        "num_stages": 3,
        "num_warps": 8,
        "compile_time": 1.1195096969604492
    },
    {
        "BLOCK_SIZE_M": 32,
        "BLOCK_SIZE_N": 64,
        "BLOCK_SIZE_K": 512,
        "GROUP_SIZE_M": 8,
        "num_stages": 3,
        "num_warps": 16,
        "compile_time": 0.7521746158599854
    },
    {
        "BLOCK_SIZE_M": 32,
        "BLOCK_SIZE_N": 64,
        "BLOCK_SIZE_K": 512,
        "GROUP_SIZE_M": 8,
        "num_stages": 3,
        "num_warps": 32,
        "compile_time": 0.6161229610443115
    },
    {
        "BLOCK_SIZE_M": 32,
        "BLOCK_SIZE_N": 64,
        "BLOCK_SIZE_K": 512,
        "GROUP_SIZE_M": 8,
        "num_stages": 4,
        "num_warps": 2,
        "compile_time": 12.632810115814209
    },
    {
        "BLOCK_SIZE_M": 32,
        "BLOCK_SIZE_N": 64,
        "BLOCK_SIZE_K": 512,
        "GROUP_SIZE_M": 8,
        "num_stages": 4,
        "num_warps": 4,
        "compile_time": 2.622365713119507
    },
    {
        "BLOCK_SIZE_M": 32,
        "BLOCK_SIZE_N": 64,
        "BLOCK_SIZE_K": 512,
        "GROUP_SIZE_M": 8,
        "num_stages": 4,
        "num_warps": 8,
        "compile_time": 1.221379041671753
    },
    {
        "BLOCK_SIZE_M": 32,
        "BLOCK_SIZE_N": 64,
        "BLOCK_SIZE_K": 512,
        "GROUP_SIZE_M": 8,
        "num_stages": 4,
        "num_warps": 16,
        "compile_time": 0.8150107860565186
    },
    {
        "BLOCK_SIZE_M": 32,
        "BLOCK_SIZE_N": 64,
        "BLOCK_SIZE_K": 512,
        "GROUP_SIZE_M": 8,
        "num_stages": 4,
        "num_warps": 32,
        "compile_time": 0.6691288948059082
    },
    {
        "BLOCK_SIZE_M": 32,
        "BLOCK_SIZE_N": 64,
        "BLOCK_SIZE_K": 512,
        "GROUP_SIZE_M": 8,
        "num_stages": 5,
        "num_warps": 2,
        "compile_time": 12.94122838973999
    },
    {
        "BLOCK_SIZE_M": 32,
        "BLOCK_SIZE_N": 64,
        "BLOCK_SIZE_K": 512,
        "GROUP_SIZE_M": 8,
        "num_stages": 5,
        "num_warps": 4,
        "compile_time": 2.8093817234039307
    },
    {
        "BLOCK_SIZE_M": 32,
        "BLOCK_SIZE_N": 64,
        "BLOCK_SIZE_K": 512,
        "GROUP_SIZE_M": 8,
        "num_stages": 5,
        "num_warps": 8,
        "compile_time": 1.310931921005249
    },
    {
        "BLOCK_SIZE_M": 32,
        "BLOCK_SIZE_N": 64,
        "BLOCK_SIZE_K": 512,
        "GROUP_SIZE_M": 8,
        "num_stages": 5,
        "num_warps": 16,
        "compile_time": 0.8648281097412109
    },
    {
        "BLOCK_SIZE_M": 32,
        "BLOCK_SIZE_N": 64,
        "BLOCK_SIZE_K": 512,
        "GROUP_SIZE_M": 8,
        "num_stages": 5,
        "num_warps": 32,
        "compile_time": 0.6950876712799072
    },
    {
        "BLOCK_SIZE_M": 32,
        "BLOCK_SIZE_N": 64,
        "BLOCK_SIZE_K": 512,
        "GROUP_SIZE_M": 8,
        "num_stages": 6,
        "num_warps": 2,
        "compile_time": 13.091164350509644
    },
    {
        "BLOCK_SIZE_M": 32,
        "BLOCK_SIZE_N": 64,
        "BLOCK_SIZE_K": 512,
        "GROUP_SIZE_M": 8,
        "num_stages": 6,
        "num_warps": 4,
        "compile_time": 3.11217999458313
    },
    {
        "BLOCK_SIZE_M": 32,
        "BLOCK_SIZE_N": 64,
        "BLOCK_SIZE_K": 512,
        "GROUP_SIZE_M": 8,
        "num_stages": 6,
        "num_warps": 8,
        "compile_time": 1.479447841644287
    },
    {
        "BLOCK_SIZE_M": 32,
        "BLOCK_SIZE_N": 64,
        "BLOCK_SIZE_K": 512,
        "GROUP_SIZE_M": 8,
        "num_stages": 6,
        "num_warps": 16,
        "compile_time": 0.9646086692810059
    },
    {
        "BLOCK_SIZE_M": 32,
        "BLOCK_SIZE_N": 64,
        "BLOCK_SIZE_K": 512,
        "GROUP_SIZE_M": 8,
        "num_stages": 6,
        "num_warps": 32,
        "compile_time": 0.7533073425292969
    },
    {
        "BLOCK_SIZE_M": 32,
        "BLOCK_SIZE_N": 64,
        "BLOCK_SIZE_K": 512,
        "GROUP_SIZE_M": 8,
        "num_stages": 7,
        "num_warps": 2,
        "compile_time": 13.219972133636475
    },
    {
        "BLOCK_SIZE_M": 32,
        "BLOCK_SIZE_N": 64,
        "BLOCK_SIZE_K": 512,
        "GROUP_SIZE_M": 8,
        "num_stages": 7,
        "num_warps": 4,
        "compile_time": 3.3017380237579346
    },
    {
        "BLOCK_SIZE_M": 32,
        "BLOCK_SIZE_N": 64,
        "BLOCK_SIZE_K": 512,
        "GROUP_SIZE_M": 8,
        "num_stages": 7,
        "num_warps": 8,
        "compile_time": 1.6670005321502686
    },
    {
        "BLOCK_SIZE_M": 32,
        "BLOCK_SIZE_N": 64,
        "BLOCK_SIZE_K": 512,
        "GROUP_SIZE_M": 8,
        "num_stages": 7,
        "num_warps": 16,
        "compile_time": 0.9953744411468506
    },
    {
        "BLOCK_SIZE_M": 32,
        "BLOCK_SIZE_N": 64,
        "BLOCK_SIZE_K": 512,
        "GROUP_SIZE_M": 8,
        "num_stages": 7,
        "num_warps": 32,
        "compile_time": 0.7598354816436768
    },
    {
        "BLOCK_SIZE_M": 32,
        "BLOCK_SIZE_N": 64,
        "BLOCK_SIZE_K": 512,
        "GROUP_SIZE_M": 8,
        "num_stages": 8,
        "num_warps": 2,
        "compile_time": 13.664870023727417
    },
    {
        "BLOCK_SIZE_M": 32,
        "BLOCK_SIZE_N": 64,
        "BLOCK_SIZE_K": 512,
        "GROUP_SIZE_M": 8,
        "num_stages": 8,
        "num_warps": 4,
        "compile_time": 3.507510185241699
    },
    {
        "BLOCK_SIZE_M": 32,
        "BLOCK_SIZE_N": 64,
        "BLOCK_SIZE_K": 512,
        "GROUP_SIZE_M": 8,
        "num_stages": 8,
        "num_warps": 8,
        "compile_time": 1.7263243198394775
    },
    {
        "BLOCK_SIZE_M": 32,
        "BLOCK_SIZE_N": 64,
        "BLOCK_SIZE_K": 512,
        "GROUP_SIZE_M": 8,
        "num_stages": 8,
        "num_warps": 16,
        "compile_time": 1.1182050704956055
    },
    {
        "BLOCK_SIZE_M": 32,
        "BLOCK_SIZE_N": 64,
        "BLOCK_SIZE_K": 512,
        "GROUP_SIZE_M": 8,
        "num_stages": 8,
        "num_warps": 32,
        "compile_time": 0.8540983200073242
    },
    {
        "BLOCK_SIZE_M": 32,
        "BLOCK_SIZE_N": 128,
        "BLOCK_SIZE_K": 128,
        "GROUP_SIZE_M": 8,
        "num_stages": 6,
        "num_warps": 2,
        "compile_time": 2.6568803787231445
    },
    {
        "BLOCK_SIZE_M": 32,
        "BLOCK_SIZE_N": 128,
        "BLOCK_SIZE_K": 128,
        "GROUP_SIZE_M": 8,
        "num_stages": 6,
        "num_warps": 4,
        "compile_time": 1.2224454879760742
    },
    {
        "BLOCK_SIZE_M": 32,
        "BLOCK_SIZE_N": 128,
        "BLOCK_SIZE_K": 128,
        "GROUP_SIZE_M": 8,
        "num_stages": 6,
        "num_warps": 8,
        "compile_time": 0.7881486415863037
    },
    {
        "BLOCK_SIZE_M": 32,
        "BLOCK_SIZE_N": 128,
        "BLOCK_SIZE_K": 128,
        "GROUP_SIZE_M": 8,
        "num_stages": 6,
        "num_warps": 16,
        "compile_time": 0.003931760787963867
    },
    {
        "BLOCK_SIZE_M": 32,
        "BLOCK_SIZE_N": 128,
        "BLOCK_SIZE_K": 128,
        "GROUP_SIZE_M": 8,
        "num_stages": 6,
        "num_warps": 32,
        "compile_time": 0.4862682819366455
    },
    {
        "BLOCK_SIZE_M": 32,
        "BLOCK_SIZE_N": 128,
        "BLOCK_SIZE_K": 128,
        "GROUP_SIZE_M": 8,
        "num_stages": 7,
        "num_warps": 2,
        "compile_time": 2.740540027618408
    },
    {
        "BLOCK_SIZE_M": 32,
        "BLOCK_SIZE_N": 128,
        "BLOCK_SIZE_K": 128,
        "GROUP_SIZE_M": 8,
        "num_stages": 7,
        "num_warps": 4,
        "compile_time": 1.2898626327514648
    },
    {
        "BLOCK_SIZE_M": 32,
        "BLOCK_SIZE_N": 128,
        "BLOCK_SIZE_K": 128,
        "GROUP_SIZE_M": 8,
        "num_stages": 7,
        "num_warps": 8,
        "compile_time": 0.8310720920562744
    },
    {
        "BLOCK_SIZE_M": 32,
        "BLOCK_SIZE_N": 128,
        "BLOCK_SIZE_K": 128,
        "GROUP_SIZE_M": 8,
        "num_stages": 7,
        "num_warps": 16,
        "compile_time": 0.5774428844451904
    },
    {
        "BLOCK_SIZE_M": 32,
        "BLOCK_SIZE_N": 128,
        "BLOCK_SIZE_K": 128,
        "GROUP_SIZE_M": 8,
        "num_stages": 7,
        "num_warps": 32,
        "compile_time": 0.4852793216705322
    },
    {
        "BLOCK_SIZE_M": 32,
        "BLOCK_SIZE_N": 128,
        "BLOCK_SIZE_K": 128,
        "GROUP_SIZE_M": 8,
        "num_stages": 8,
        "num_warps": 2,
        "compile_time": 2.927541494369507
    },
    {
        "BLOCK_SIZE_M": 32,
        "BLOCK_SIZE_N": 128,
        "BLOCK_SIZE_K": 128,
        "GROUP_SIZE_M": 8,
        "num_stages": 8,
        "num_warps": 4,
        "compile_time": 1.4519333839416504
    },
    {
        "BLOCK_SIZE_M": 32,
        "BLOCK_SIZE_N": 128,
        "BLOCK_SIZE_K": 128,
        "GROUP_SIZE_M": 8,
        "num_stages": 8,
        "num_warps": 8,
        "compile_time": 0.8934047222137451
    },
    {
        "BLOCK_SIZE_M": 32,
        "BLOCK_SIZE_N": 128,
        "BLOCK_SIZE_K": 128,
        "GROUP_SIZE_M": 8,
        "num_stages": 8,
        "num_warps": 16,
        "compile_time": 0.6067135334014893
    },
    {
        "BLOCK_SIZE_M": 32,
        "BLOCK_SIZE_N": 128,
        "BLOCK_SIZE_K": 128,
        "GROUP_SIZE_M": 8,
        "num_stages": 8,
        "num_warps": 32,
        "compile_time": 0.5147531032562256
    },
    {
        "BLOCK_SIZE_M": 32,
        "BLOCK_SIZE_N": 128,
        "BLOCK_SIZE_K": 256,
        "GROUP_SIZE_M": 8,
        "num_stages": 3,
        "num_warps": 2,
        "compile_time": 11.103630542755127
    },
    {
        "BLOCK_SIZE_M": 32,
        "BLOCK_SIZE_N": 128,
        "BLOCK_SIZE_K": 256,
        "GROUP_SIZE_M": 8,
        "num_stages": 4,
        "num_warps": 2,
        "compile_time": 11.369365453720093
    },
    {
        "BLOCK_SIZE_M": 32,
        "BLOCK_SIZE_N": 128,
        "BLOCK_SIZE_K": 256,
        "GROUP_SIZE_M": 8,
        "num_stages": 4,
        "num_warps": 4,
        "compile_time": 2.3370935916900635
    },
    {
        "BLOCK_SIZE_M": 32,
        "BLOCK_SIZE_N": 128,
        "BLOCK_SIZE_K": 256,
        "GROUP_SIZE_M": 8,
        "num_stages": 4,
        "num_warps": 8,
        "compile_time": 1.1219615936279297
    },
    {
        "BLOCK_SIZE_M": 32,
        "BLOCK_SIZE_N": 128,
        "BLOCK_SIZE_K": 256,
        "GROUP_SIZE_M": 8,
        "num_stages": 4,
        "num_warps": 16,
        "compile_time": 0.7233049869537354
    },
    {
        "BLOCK_SIZE_M": 32,
        "BLOCK_SIZE_N": 128,
        "BLOCK_SIZE_K": 256,
        "GROUP_SIZE_M": 8,
        "num_stages": 4,
        "num_warps": 32,
        "compile_time": 0.5567071437835693
    },
    {
        "BLOCK_SIZE_M": 32,
        "BLOCK_SIZE_N": 128,
        "BLOCK_SIZE_K": 256,
        "GROUP_SIZE_M": 8,
        "num_stages": 5,
        "num_warps": 2,
        "compile_time": 11.771358013153076
    },
    {
        "BLOCK_SIZE_M": 32,
        "BLOCK_SIZE_N": 128,
        "BLOCK_SIZE_K": 256,
        "GROUP_SIZE_M": 8,
        "num_stages": 5,
        "num_warps": 4,
        "compile_time": 2.397794723510742
    },
    {
        "BLOCK_SIZE_M": 32,
        "BLOCK_SIZE_N": 128,
        "BLOCK_SIZE_K": 256,
        "GROUP_SIZE_M": 8,
        "num_stages": 5,
        "num_warps": 8,
        "compile_time": 1.2052335739135742
    },
    {
        "BLOCK_SIZE_M": 32,
        "BLOCK_SIZE_N": 128,
        "BLOCK_SIZE_K": 256,
        "GROUP_SIZE_M": 8,
        "num_stages": 5,
        "num_warps": 16,
        "compile_time": 0.006868124008178711
    },
    {
        "BLOCK_SIZE_M": 32,
        "BLOCK_SIZE_N": 128,
        "BLOCK_SIZE_K": 256,
        "GROUP_SIZE_M": 8,
        "num_stages": 5,
        "num_warps": 32,
        "compile_time": 0.5719332695007324
    },
    {
        "BLOCK_SIZE_M": 32,
        "BLOCK_SIZE_N": 128,
        "BLOCK_SIZE_K": 256,
        "GROUP_SIZE_M": 8,
        "num_stages": 6,
        "num_warps": 2,
        "compile_time": 12.053716659545898
    },
    {
        "BLOCK_SIZE_M": 32,
        "BLOCK_SIZE_N": 128,
        "BLOCK_SIZE_K": 256,
        "GROUP_SIZE_M": 8,
        "num_stages": 6,
        "num_warps": 4,
        "compile_time": 2.703162431716919
    },
    {
        "BLOCK_SIZE_M": 32,
        "BLOCK_SIZE_N": 128,
        "BLOCK_SIZE_K": 256,
        "GROUP_SIZE_M": 8,
        "num_stages": 6,
        "num_warps": 8,
        "compile_time": 1.3021719455718994
    },
    {
        "BLOCK_SIZE_M": 32,
        "BLOCK_SIZE_N": 128,
        "BLOCK_SIZE_K": 256,
        "GROUP_SIZE_M": 8,
        "num_stages": 6,
        "num_warps": 16,
        "compile_time": 0.8401212692260742
    },
    {
        "BLOCK_SIZE_M": 32,
        "BLOCK_SIZE_N": 128,
        "BLOCK_SIZE_K": 256,
        "GROUP_SIZE_M": 8,
        "num_stages": 6,
        "num_warps": 32,
        "compile_time": 0.006588459014892578
    },
    {
        "BLOCK_SIZE_M": 32,
        "BLOCK_SIZE_N": 128,
        "BLOCK_SIZE_K": 256,
        "GROUP_SIZE_M": 8,
        "num_stages": 7,
        "num_warps": 2,
        "compile_time": 12.490635395050049
    },
    {
        "BLOCK_SIZE_M": 32,
        "BLOCK_SIZE_N": 128,
        "BLOCK_SIZE_K": 256,
        "GROUP_SIZE_M": 8,
        "num_stages": 7,
        "num_warps": 4,
        "compile_time": 2.810131072998047
    },
    {
        "BLOCK_SIZE_M": 32,
        "BLOCK_SIZE_N": 128,
        "BLOCK_SIZE_K": 256,
        "GROUP_SIZE_M": 8,
        "num_stages": 7,
        "num_warps": 8,
        "compile_time": 1.3950471878051758
    },
    {
        "BLOCK_SIZE_M": 32,
        "BLOCK_SIZE_N": 128,
        "BLOCK_SIZE_K": 256,
        "GROUP_SIZE_M": 8,
        "num_stages": 7,
        "num_warps": 16,
        "compile_time": 0.0057713985443115234
    },
    {
        "BLOCK_SIZE_M": 32,
        "BLOCK_SIZE_N": 128,
        "BLOCK_SIZE_K": 256,
        "GROUP_SIZE_M": 8,
        "num_stages": 7,
        "num_warps": 32,
        "compile_time": 0.6244792938232422
    },
    {
        "BLOCK_SIZE_M": 32,
        "BLOCK_SIZE_N": 128,
        "BLOCK_SIZE_K": 256,
        "GROUP_SIZE_M": 8,
        "num_stages": 8,
        "num_warps": 2,
        "compile_time": 12.617467403411865
    },
    {
        "BLOCK_SIZE_M": 32,
        "BLOCK_SIZE_N": 128,
        "BLOCK_SIZE_K": 256,
        "GROUP_SIZE_M": 8,
        "num_stages": 8,
        "num_warps": 4,
        "compile_time": 2.9255740642547607
    },
    {
        "BLOCK_SIZE_M": 32,
        "BLOCK_SIZE_N": 128,
        "BLOCK_SIZE_K": 256,
        "GROUP_SIZE_M": 8,
        "num_stages": 8,
        "num_warps": 8,
        "compile_time": 1.4928882122039795
    },
    {
        "BLOCK_SIZE_M": 32,
        "BLOCK_SIZE_N": 128,
        "BLOCK_SIZE_K": 256,
        "GROUP_SIZE_M": 8,
        "num_stages": 8,
        "num_warps": 16,
        "compile_time": 0.005507469177246094
    },
    {
        "BLOCK_SIZE_M": 32,
        "BLOCK_SIZE_N": 128,
        "BLOCK_SIZE_K": 256,
        "GROUP_SIZE_M": 8,
        "num_stages": 8,
        "num_warps": 32,
        "compile_time": 0.6656076908111572
    },
    {
        "BLOCK_SIZE_M": 32,
        "BLOCK_SIZE_N": 128,
        "BLOCK_SIZE_K": 512,
        "GROUP_SIZE_M": 8,
        "num_stages": 1,
        "num_warps": 2,
        "compile_time": 8.767857789993286
    },
    {
        "BLOCK_SIZE_M": 32,
        "BLOCK_SIZE_N": 128,
        "BLOCK_SIZE_K": 512,
        "GROUP_SIZE_M": 8,
        "num_stages": 2,
        "num_warps": 2,
        "compile_time": 8.782428979873657
    },
    {
        "BLOCK_SIZE_M": 32,
        "BLOCK_SIZE_N": 128,
        "BLOCK_SIZE_K": 512,
        "GROUP_SIZE_M": 8,
        "num_stages": 3,
        "num_warps": 2,
        "compile_time": 6.348178863525391
    },
    {
        "BLOCK_SIZE_M": 32,
        "BLOCK_SIZE_N": 128,
        "BLOCK_SIZE_K": 512,
        "GROUP_SIZE_M": 8,
        "num_stages": 3,
        "num_warps": 4,
        "compile_time": 11.493614912033081
    },
    {
        "BLOCK_SIZE_M": 32,
        "BLOCK_SIZE_N": 128,
        "BLOCK_SIZE_K": 512,
        "GROUP_SIZE_M": 8,
        "num_stages": 3,
        "num_warps": 8,
        "compile_time": 2.1744842529296875
    },
    {
        "BLOCK_SIZE_M": 32,
        "BLOCK_SIZE_N": 128,
        "BLOCK_SIZE_K": 512,
        "GROUP_SIZE_M": 8,
        "num_stages": 3,
        "num_warps": 16,
        "compile_time": 0.0054128170013427734
    },
    {
        "BLOCK_SIZE_M": 32,
        "BLOCK_SIZE_N": 128,
        "BLOCK_SIZE_K": 512,
        "GROUP_SIZE_M": 8,
        "num_stages": 3,
        "num_warps": 32,
        "compile_time": 0.7493078708648682
    },
    {
        "BLOCK_SIZE_M": 32,
        "BLOCK_SIZE_N": 128,
        "BLOCK_SIZE_K": 512,
        "GROUP_SIZE_M": 8,
        "num_stages": 4,
        "num_warps": 2,
        "compile_time": 6.739778280258179
    },
    {
        "BLOCK_SIZE_M": 32,
        "BLOCK_SIZE_N": 128,
        "BLOCK_SIZE_K": 512,
        "GROUP_SIZE_M": 8,
        "num_stages": 4,
        "num_warps": 4,
        "compile_time": 11.76341199874878
    },
    {
        "BLOCK_SIZE_M": 32,
        "BLOCK_SIZE_N": 128,
        "BLOCK_SIZE_K": 512,
        "GROUP_SIZE_M": 8,
        "num_stages": 4,
        "num_warps": 8,
        "compile_time": 2.3964107036590576
    },
    {
        "BLOCK_SIZE_M": 32,
        "BLOCK_SIZE_N": 128,
        "BLOCK_SIZE_K": 512,
        "GROUP_SIZE_M": 8,
        "num_stages": 4,
        "num_warps": 16,
        "compile_time": 1.2062199115753174
    },
    {
        "BLOCK_SIZE_M": 32,
        "BLOCK_SIZE_N": 128,
        "BLOCK_SIZE_K": 512,
        "GROUP_SIZE_M": 8,
        "num_stages": 4,
        "num_warps": 32,
        "compile_time": 0.00542759895324707
    },
    {
        "BLOCK_SIZE_M": 32,
        "BLOCK_SIZE_N": 128,
        "BLOCK_SIZE_K": 512,
        "GROUP_SIZE_M": 8,
        "num_stages": 5,
        "num_warps": 2,
        "compile_time": 7.243061304092407
    },
    {
        "BLOCK_SIZE_M": 32,
        "BLOCK_SIZE_N": 128,
        "BLOCK_SIZE_K": 512,
        "GROUP_SIZE_M": 8,
        "num_stages": 5,
        "num_warps": 4,
        "compile_time": 11.328585624694824
    },
    {
        "BLOCK_SIZE_M": 32,
        "BLOCK_SIZE_N": 128,
        "BLOCK_SIZE_K": 512,
        "GROUP_SIZE_M": 8,
        "num_stages": 5,
        "num_warps": 8,
        "compile_time": 2.6383538246154785
    },
    {
        "BLOCK_SIZE_M": 32,
        "BLOCK_SIZE_N": 128,
        "BLOCK_SIZE_K": 512,
        "GROUP_SIZE_M": 8,
        "num_stages": 5,
        "num_warps": 16,
        "compile_time": 1.3236243724822998
    },
    {
        "BLOCK_SIZE_M": 32,
        "BLOCK_SIZE_N": 128,
        "BLOCK_SIZE_K": 512,
        "GROUP_SIZE_M": 8,
        "num_stages": 5,
        "num_warps": 32,
        "compile_time": 0.8710489273071289
    },
    {
        "BLOCK_SIZE_M": 32,
        "BLOCK_SIZE_N": 128,
        "BLOCK_SIZE_K": 512,
        "GROUP_SIZE_M": 8,
        "num_stages": 6,
        "num_warps": 2,
        "compile_time": 7.606088638305664
    },
    {
        "BLOCK_SIZE_M": 32,
        "BLOCK_SIZE_N": 128,
        "BLOCK_SIZE_K": 512,
        "GROUP_SIZE_M": 8,
        "num_stages": 6,
        "num_warps": 4,
        "compile_time": 11.48715353012085
    },
    {
        "BLOCK_SIZE_M": 32,
        "BLOCK_SIZE_N": 128,
        "BLOCK_SIZE_K": 512,
        "GROUP_SIZE_M": 8,
        "num_stages": 6,
        "num_warps": 8,
        "compile_time": 2.7337872982025146
    },
    {
        "BLOCK_SIZE_M": 32,
        "BLOCK_SIZE_N": 128,
        "BLOCK_SIZE_K": 512,
        "GROUP_SIZE_M": 8,
        "num_stages": 6,
        "num_warps": 16,
        "compile_time": 1.4100072383880615
    },
    {
        "BLOCK_SIZE_M": 32,
        "BLOCK_SIZE_N": 128,
        "BLOCK_SIZE_K": 512,
        "GROUP_SIZE_M": 8,
        "num_stages": 6,
        "num_warps": 32,
        "compile_time": 0.004629373550415039
    },
    {
        "BLOCK_SIZE_M": 32,
        "BLOCK_SIZE_N": 128,
        "BLOCK_SIZE_K": 512,
        "GROUP_SIZE_M": 8,
        "num_stages": 7,
        "num_warps": 2,
        "compile_time": 8.014477491378784
    },
    {
        "BLOCK_SIZE_M": 32,
        "BLOCK_SIZE_N": 128,
        "BLOCK_SIZE_K": 512,
        "GROUP_SIZE_M": 8,
        "num_stages": 7,
        "num_warps": 4,
        "compile_time": 11.897022247314453
    },
    {
        "BLOCK_SIZE_M": 32,
        "BLOCK_SIZE_N": 128,
        "BLOCK_SIZE_K": 512,
        "GROUP_SIZE_M": 8,
        "num_stages": 7,
        "num_warps": 8,
        "compile_time": 2.9305200576782227
    },
    {
        "BLOCK_SIZE_M": 32,
        "BLOCK_SIZE_N": 128,
        "BLOCK_SIZE_K": 512,
        "GROUP_SIZE_M": 8,
        "num_stages": 7,
        "num_warps": 16,
        "compile_time": 1.5333807468414307
    },
    {
        "BLOCK_SIZE_M": 32,
        "BLOCK_SIZE_N": 128,
        "BLOCK_SIZE_K": 512,
        "GROUP_SIZE_M": 8,
        "num_stages": 7,
        "num_warps": 32,
        "compile_time": 0.004243135452270508
    },
    {
        "BLOCK_SIZE_M": 32,
        "BLOCK_SIZE_N": 128,
        "BLOCK_SIZE_K": 512,
        "GROUP_SIZE_M": 8,
        "num_stages": 8,
        "num_warps": 2,
        "compile_time": 8.419464826583862
    },
    {
        "BLOCK_SIZE_M": 32,
        "BLOCK_SIZE_N": 128,
        "BLOCK_SIZE_K": 512,
        "GROUP_SIZE_M": 8,
        "num_stages": 8,
        "num_warps": 4,
        "compile_time": 12.75446629524231
    },
    {
        "BLOCK_SIZE_M": 32,
        "BLOCK_SIZE_N": 128,
        "BLOCK_SIZE_K": 512,
        "GROUP_SIZE_M": 8,
        "num_stages": 8,
        "num_warps": 8,
        "compile_time": 3.1641969680786133
    },
    {
        "BLOCK_SIZE_M": 32,
        "BLOCK_SIZE_N": 128,
        "BLOCK_SIZE_K": 512,
        "GROUP_SIZE_M": 8,
        "num_stages": 8,
        "num_warps": 16,
        "compile_time": 1.7053616046905518
    },
    {
        "BLOCK_SIZE_M": 32,
        "BLOCK_SIZE_N": 128,
        "BLOCK_SIZE_K": 512,
        "GROUP_SIZE_M": 8,
        "num_stages": 8,
        "num_warps": 32,
        "compile_time": 0.005896329879760742
    },
    {
        "BLOCK_SIZE_M": 32,
        "BLOCK_SIZE_N": 256,
        "BLOCK_SIZE_K": 64,
        "GROUP_SIZE_M": 8,
        "num_stages": 6,
        "num_warps": 2,
        "compile_time": 2.8850221633911133
    },
    {
        "BLOCK_SIZE_M": 32,
        "BLOCK_SIZE_N": 256,
        "BLOCK_SIZE_K": 64,
        "GROUP_SIZE_M": 8,
        "num_stages": 6,
        "num_warps": 4,
        "compile_time": 1.2629406452178955
    },
    {
        "BLOCK_SIZE_M": 32,
        "BLOCK_SIZE_N": 256,
        "BLOCK_SIZE_K": 64,
        "GROUP_SIZE_M": 8,
        "num_stages": 6,
        "num_warps": 8,
        "compile_time": 0.7733712196350098
    },
    {
        "BLOCK_SIZE_M": 32,
        "BLOCK_SIZE_N": 256,
        "BLOCK_SIZE_K": 64,
        "GROUP_SIZE_M": 8,
        "num_stages": 6,
        "num_warps": 16,
        "compile_time": 0.005076885223388672
    },
    {
        "BLOCK_SIZE_M": 32,
        "BLOCK_SIZE_N": 256,
        "BLOCK_SIZE_K": 64,
        "GROUP_SIZE_M": 8,
        "num_stages": 6,
        "num_warps": 32,
        "compile_time": 0.4526245594024658
    },
    {
        "BLOCK_SIZE_M": 32,
        "BLOCK_SIZE_N": 256,
        "BLOCK_SIZE_K": 64,
        "GROUP_SIZE_M": 8,
        "num_stages": 7,
        "num_warps": 2,
        "compile_time": 3.0064170360565186
    },
    {
        "BLOCK_SIZE_M": 32,
        "BLOCK_SIZE_N": 256,
        "BLOCK_SIZE_K": 64,
        "GROUP_SIZE_M": 8,
        "num_stages": 7,
        "num_warps": 4,
        "compile_time": 1.3368959426879883
    },
    {
        "BLOCK_SIZE_M": 32,
        "BLOCK_SIZE_N": 256,
        "BLOCK_SIZE_K": 64,
        "GROUP_SIZE_M": 8,
        "num_stages": 7,
        "num_warps": 8,
        "compile_time": 0.8198904991149902
    },
    {
        "BLOCK_SIZE_M": 32,
        "BLOCK_SIZE_N": 256,
        "BLOCK_SIZE_K": 64,
        "GROUP_SIZE_M": 8,
        "num_stages": 7,
        "num_warps": 16,
        "compile_time": 0.5850718021392822
    },
    {
        "BLOCK_SIZE_M": 32,
        "BLOCK_SIZE_N": 256,
        "BLOCK_SIZE_K": 64,
        "GROUP_SIZE_M": 8,
        "num_stages": 7,
        "num_warps": 32,
        "compile_time": 0.48071742057800293
    },
    {
        "BLOCK_SIZE_M": 32,
        "BLOCK_SIZE_N": 256,
        "BLOCK_SIZE_K": 64,
        "GROUP_SIZE_M": 8,
        "num_stages": 8,
        "num_warps": 2,
        "compile_time": 3.140782117843628
    },
    {
        "BLOCK_SIZE_M": 32,
        "BLOCK_SIZE_N": 256,
        "BLOCK_SIZE_K": 64,
        "GROUP_SIZE_M": 8,
        "num_stages": 8,
        "num_warps": 4,
        "compile_time": 1.4849696159362793
    },
    {
        "BLOCK_SIZE_M": 32,
        "BLOCK_SIZE_N": 256,
        "BLOCK_SIZE_K": 64,
        "GROUP_SIZE_M": 8,
        "num_stages": 8,
        "num_warps": 8,
        "compile_time": 0.8743321895599365
    },
    {
        "BLOCK_SIZE_M": 32,
        "BLOCK_SIZE_N": 256,
        "BLOCK_SIZE_K": 64,
        "GROUP_SIZE_M": 8,
        "num_stages": 8,
        "num_warps": 16,
        "compile_time": 0.6113901138305664
    },
    {
        "BLOCK_SIZE_M": 32,
        "BLOCK_SIZE_N": 256,
        "BLOCK_SIZE_K": 64,
        "GROUP_SIZE_M": 8,
        "num_stages": 8,
        "num_warps": 32,
        "compile_time": 0.5212037563323975
    },
    {
        "BLOCK_SIZE_M": 32,
        "BLOCK_SIZE_N": 256,
        "BLOCK_SIZE_K": 128,
        "GROUP_SIZE_M": 8,
        "num_stages": 3,
        "num_warps": 2,
        "compile_time": 10.896369695663452
    },
    {
        "BLOCK_SIZE_M": 32,
        "BLOCK_SIZE_N": 256,
        "BLOCK_SIZE_K": 128,
        "GROUP_SIZE_M": 8,
        "num_stages": 4,
        "num_warps": 2,
        "compile_time": 10.888463258743286
    },
    {
        "BLOCK_SIZE_M": 32,
        "BLOCK_SIZE_N": 256,
        "BLOCK_SIZE_K": 128,
        "GROUP_SIZE_M": 8,
        "num_stages": 4,
        "num_warps": 4,
        "compile_time": 2.3227829933166504
    },
    {
        "BLOCK_SIZE_M": 32,
        "BLOCK_SIZE_N": 256,
        "BLOCK_SIZE_K": 128,
        "GROUP_SIZE_M": 8,
        "num_stages": 4,
        "num_warps": 8,
        "compile_time": 1.0934603214263916
    },
    {
        "BLOCK_SIZE_M": 32,
        "BLOCK_SIZE_N": 256,
        "BLOCK_SIZE_K": 128,
        "GROUP_SIZE_M": 8,
        "num_stages": 4,
        "num_warps": 16,
        "compile_time": 0.7276196479797363
    },
    {
        "BLOCK_SIZE_M": 32,
        "BLOCK_SIZE_N": 256,
        "BLOCK_SIZE_K": 128,
        "GROUP_SIZE_M": 8,
        "num_stages": 4,
        "num_warps": 32,
        "compile_time": 0.5238826274871826
    },
    {
        "BLOCK_SIZE_M": 32,
        "BLOCK_SIZE_N": 256,
        "BLOCK_SIZE_K": 128,
        "GROUP_SIZE_M": 8,
        "num_stages": 5,
        "num_warps": 2,
        "compile_time": 11.234143733978271
    },
    {
        "BLOCK_SIZE_M": 32,
        "BLOCK_SIZE_N": 256,
        "BLOCK_SIZE_K": 128,
        "GROUP_SIZE_M": 8,
        "num_stages": 5,
        "num_warps": 4,
        "compile_time": 2.400191068649292
    },
    {
        "BLOCK_SIZE_M": 32,
        "BLOCK_SIZE_N": 256,
        "BLOCK_SIZE_K": 128,
        "GROUP_SIZE_M": 8,
        "num_stages": 5,
        "num_warps": 8,
        "compile_time": 1.1273877620697021
    },
    {
        "BLOCK_SIZE_M": 32,
        "BLOCK_SIZE_N": 256,
        "BLOCK_SIZE_K": 128,
        "GROUP_SIZE_M": 8,
        "num_stages": 5,
        "num_warps": 16,
        "compile_time": 0.7302348613739014
    },
    {
        "BLOCK_SIZE_M": 32,
        "BLOCK_SIZE_N": 256,
        "BLOCK_SIZE_K": 128,
        "GROUP_SIZE_M": 8,
        "num_stages": 5,
        "num_warps": 32,
        "compile_time": 0.5441393852233887
    },
    {
        "BLOCK_SIZE_M": 32,
        "BLOCK_SIZE_N": 256,
        "BLOCK_SIZE_K": 128,
        "GROUP_SIZE_M": 8,
        "num_stages": 6,
        "num_warps": 2,
        "compile_time": 11.39574646949768
    },
    {
        "BLOCK_SIZE_M": 32,
        "BLOCK_SIZE_N": 256,
        "BLOCK_SIZE_K": 128,
        "GROUP_SIZE_M": 8,
        "num_stages": 6,
        "num_warps": 4,
        "compile_time": 2.5686933994293213
    },
    {
        "BLOCK_SIZE_M": 32,
        "BLOCK_SIZE_N": 256,
        "BLOCK_SIZE_K": 128,
        "GROUP_SIZE_M": 8,
        "num_stages": 6,
        "num_warps": 8,
        "compile_time": 1.212618112564087
    },
    {
        "BLOCK_SIZE_M": 32,
        "BLOCK_SIZE_N": 256,
        "BLOCK_SIZE_K": 128,
        "GROUP_SIZE_M": 8,
        "num_stages": 6,
        "num_warps": 16,
        "compile_time": 0.802323579788208
    },
    {
        "BLOCK_SIZE_M": 32,
        "BLOCK_SIZE_N": 256,
        "BLOCK_SIZE_K": 128,
        "GROUP_SIZE_M": 8,
        "num_stages": 6,
        "num_warps": 32,
        "compile_time": 0.5740320682525635
    },
    {
        "BLOCK_SIZE_M": 32,
        "BLOCK_SIZE_N": 256,
        "BLOCK_SIZE_K": 128,
        "GROUP_SIZE_M": 8,
        "num_stages": 7,
        "num_warps": 2,
        "compile_time": 11.538869142532349
    },
    {
        "BLOCK_SIZE_M": 32,
        "BLOCK_SIZE_N": 256,
        "BLOCK_SIZE_K": 128,
        "GROUP_SIZE_M": 8,
        "num_stages": 7,
        "num_warps": 4,
        "compile_time": 2.6978776454925537
    },
    {
        "BLOCK_SIZE_M": 32,
        "BLOCK_SIZE_N": 256,
        "BLOCK_SIZE_K": 128,
        "GROUP_SIZE_M": 8,
        "num_stages": 7,
        "num_warps": 8,
        "compile_time": 1.3618242740631104
    },
    {
        "BLOCK_SIZE_M": 32,
        "BLOCK_SIZE_N": 256,
        "BLOCK_SIZE_K": 128,
        "GROUP_SIZE_M": 8,
        "num_stages": 7,
        "num_warps": 16,
        "compile_time": 0.8543498516082764
    },
    {
        "BLOCK_SIZE_M": 32,
        "BLOCK_SIZE_N": 256,
        "BLOCK_SIZE_K": 128,
        "GROUP_SIZE_M": 8,
        "num_stages": 7,
        "num_warps": 32,
        "compile_time": 0.6090915203094482
    },
    {
        "BLOCK_SIZE_M": 32,
        "BLOCK_SIZE_N": 256,
        "BLOCK_SIZE_K": 128,
        "GROUP_SIZE_M": 8,
        "num_stages": 8,
        "num_warps": 2,
        "compile_time": 12.481954574584961
    },
    {
        "BLOCK_SIZE_M": 32,
        "BLOCK_SIZE_N": 256,
        "BLOCK_SIZE_K": 128,
        "GROUP_SIZE_M": 8,
        "num_stages": 8,
        "num_warps": 4,
        "compile_time": 2.936724901199341
    },
    {
        "BLOCK_SIZE_M": 32,
        "BLOCK_SIZE_N": 256,
        "BLOCK_SIZE_K": 128,
        "GROUP_SIZE_M": 8,
        "num_stages": 8,
        "num_warps": 8,
        "compile_time": 1.4940807819366455
    },
    {
        "BLOCK_SIZE_M": 32,
        "BLOCK_SIZE_N": 256,
        "BLOCK_SIZE_K": 128,
        "GROUP_SIZE_M": 8,
        "num_stages": 8,
        "num_warps": 16,
        "compile_time": 0.005117177963256836
    },
    {
        "BLOCK_SIZE_M": 32,
        "BLOCK_SIZE_N": 256,
        "BLOCK_SIZE_K": 128,
        "GROUP_SIZE_M": 8,
        "num_stages": 8,
        "num_warps": 32,
        "compile_time": 0.6286237239837646
    },
    {
        "BLOCK_SIZE_M": 32,
        "BLOCK_SIZE_N": 256,
        "BLOCK_SIZE_K": 256,
        "GROUP_SIZE_M": 8,
        "num_stages": 1,
        "num_warps": 2,
        "compile_time": 8.45247483253479
    },
    {
        "BLOCK_SIZE_M": 32,
        "BLOCK_SIZE_N": 256,
        "BLOCK_SIZE_K": 256,
        "GROUP_SIZE_M": 8,
        "num_stages": 2,
        "num_warps": 2,
        "compile_time": 8.454202890396118
    },
    {
        "BLOCK_SIZE_M": 32,
        "BLOCK_SIZE_N": 256,
        "BLOCK_SIZE_K": 256,
        "GROUP_SIZE_M": 8,
        "num_stages": 3,
        "num_warps": 2,
        "compile_time": 6.144052982330322
    },
    {
        "BLOCK_SIZE_M": 32,
        "BLOCK_SIZE_N": 256,
        "BLOCK_SIZE_K": 256,
        "GROUP_SIZE_M": 8,
        "num_stages": 3,
        "num_warps": 4,
        "compile_time": 11.039838790893555
    },
    {
        "BLOCK_SIZE_M": 32,
        "BLOCK_SIZE_N": 256,
        "BLOCK_SIZE_K": 256,
        "GROUP_SIZE_M": 8,
        "num_stages": 3,
        "num_warps": 8,
        "compile_time": 2.0922019481658936
    },
    {
        "BLOCK_SIZE_M": 32,
        "BLOCK_SIZE_N": 256,
        "BLOCK_SIZE_K": 256,
        "GROUP_SIZE_M": 8,
        "num_stages": 3,
        "num_warps": 16,
        "compile_time": 0.0056688785552978516
    },
    {
        "BLOCK_SIZE_M": 32,
        "BLOCK_SIZE_N": 256,
        "BLOCK_SIZE_K": 256,
        "GROUP_SIZE_M": 8,
        "num_stages": 3,
        "num_warps": 32,
        "compile_time": 0.683819055557251
    },
    {
        "BLOCK_SIZE_M": 32,
        "BLOCK_SIZE_N": 256,
        "BLOCK_SIZE_K": 256,
        "GROUP_SIZE_M": 8,
        "num_stages": 4,
        "num_warps": 2,
        "compile_time": 6.55006742477417
    },
    {
        "BLOCK_SIZE_M": 32,
        "BLOCK_SIZE_N": 256,
        "BLOCK_SIZE_K": 256,
        "GROUP_SIZE_M": 8,
        "num_stages": 4,
        "num_warps": 4,
        "compile_time": 11.141334056854248
    },
    {
        "BLOCK_SIZE_M": 32,
        "BLOCK_SIZE_N": 256,
        "BLOCK_SIZE_K": 256,
        "GROUP_SIZE_M": 8,
        "num_stages": 4,
        "num_warps": 8,
        "compile_time": 2.26650333404541
    },
    {
        "BLOCK_SIZE_M": 32,
        "BLOCK_SIZE_N": 256,
        "BLOCK_SIZE_K": 256,
        "GROUP_SIZE_M": 8,
        "num_stages": 4,
        "num_warps": 16,
        "compile_time": 1.1158545017242432
    },
    {
        "BLOCK_SIZE_M": 32,
        "BLOCK_SIZE_N": 256,
        "BLOCK_SIZE_K": 256,
        "GROUP_SIZE_M": 8,
        "num_stages": 4,
        "num_warps": 32,
        "compile_time": 0.7360384464263916
    },
    {
        "BLOCK_SIZE_M": 32,
        "BLOCK_SIZE_N": 256,
        "BLOCK_SIZE_K": 256,
        "GROUP_SIZE_M": 8,
        "num_stages": 5,
        "num_warps": 2,
        "compile_time": 6.985271453857422
    },
    {
        "BLOCK_SIZE_M": 32,
        "BLOCK_SIZE_N": 256,
        "BLOCK_SIZE_K": 256,
        "GROUP_SIZE_M": 8,
        "num_stages": 5,
        "num_warps": 4,
        "compile_time": 11.32800841331482
    },
    {
        "BLOCK_SIZE_M": 32,
        "BLOCK_SIZE_N": 256,
        "BLOCK_SIZE_K": 256,
        "GROUP_SIZE_M": 8,
        "num_stages": 5,
        "num_warps": 8,
        "compile_time": 2.4194416999816895
    },
    {
        "BLOCK_SIZE_M": 32,
        "BLOCK_SIZE_N": 256,
        "BLOCK_SIZE_K": 256,
        "GROUP_SIZE_M": 8,
        "num_stages": 5,
        "num_warps": 16,
        "compile_time": 1.2090198993682861
    },
    {
        "BLOCK_SIZE_M": 32,
        "BLOCK_SIZE_N": 256,
        "BLOCK_SIZE_K": 256,
        "GROUP_SIZE_M": 8,
        "num_stages": 5,
        "num_warps": 32,
        "compile_time": 0.005377531051635742
    },
    {
        "BLOCK_SIZE_M": 32,
        "BLOCK_SIZE_N": 256,
        "BLOCK_SIZE_K": 256,
        "GROUP_SIZE_M": 8,
        "num_stages": 6,
        "num_warps": 2,
        "compile_time": 7.177902698516846
    },
    {
        "BLOCK_SIZE_M": 32,
        "BLOCK_SIZE_N": 256,
        "BLOCK_SIZE_K": 256,
        "GROUP_SIZE_M": 8,
        "num_stages": 6,
        "num_warps": 4,
        "compile_time": 11.429479598999023
    },
    {
        "BLOCK_SIZE_M": 32,
        "BLOCK_SIZE_N": 256,
        "BLOCK_SIZE_K": 256,
        "GROUP_SIZE_M": 8,
        "num_stages": 6,
        "num_warps": 8,
        "compile_time": 2.5789945125579834
    },
    {
        "BLOCK_SIZE_M": 32,
        "BLOCK_SIZE_N": 256,
        "BLOCK_SIZE_K": 256,
        "GROUP_SIZE_M": 8,
        "num_stages": 6,
        "num_warps": 16,
        "compile_time": 1.3069007396697998
    },
    {
        "BLOCK_SIZE_M": 32,
        "BLOCK_SIZE_N": 256,
        "BLOCK_SIZE_K": 256,
        "GROUP_SIZE_M": 8,
        "num_stages": 6,
        "num_warps": 32,
        "compile_time": 0.8396427631378174
    },
    {
        "BLOCK_SIZE_M": 32,
        "BLOCK_SIZE_N": 256,
        "BLOCK_SIZE_K": 256,
        "GROUP_SIZE_M": 8,
        "num_stages": 7,
        "num_warps": 2,
        "compile_time": 7.598645210266113
    },
    {
        "BLOCK_SIZE_M": 32,
        "BLOCK_SIZE_N": 256,
        "BLOCK_SIZE_K": 256,
        "GROUP_SIZE_M": 8,
        "num_stages": 7,
        "num_warps": 4,
        "compile_time": 11.684457063674927
    },
    {
        "BLOCK_SIZE_M": 32,
        "BLOCK_SIZE_N": 256,
        "BLOCK_SIZE_K": 256,
        "GROUP_SIZE_M": 8,
        "num_stages": 7,
        "num_warps": 8,
        "compile_time": 2.7741901874542236
    },
    {
        "BLOCK_SIZE_M": 32,
        "BLOCK_SIZE_N": 256,
        "BLOCK_SIZE_K": 256,
        "GROUP_SIZE_M": 8,
        "num_stages": 7,
        "num_warps": 16,
        "compile_time": 1.4046604633331299
    },
    {
        "BLOCK_SIZE_M": 32,
        "BLOCK_SIZE_N": 256,
        "BLOCK_SIZE_K": 256,
        "GROUP_SIZE_M": 8,
        "num_stages": 7,
        "num_warps": 32,
        "compile_time": 0.004672050476074219
    },
    {
        "BLOCK_SIZE_M": 32,
        "BLOCK_SIZE_N": 256,
        "BLOCK_SIZE_K": 256,
        "GROUP_SIZE_M": 8,
        "num_stages": 8,
        "num_warps": 2,
        "compile_time": 8.022057056427002
    },
    {
        "BLOCK_SIZE_M": 32,
        "BLOCK_SIZE_N": 256,
        "BLOCK_SIZE_K": 256,
        "GROUP_SIZE_M": 8,
        "num_stages": 8,
        "num_warps": 4,
        "compile_time": 12.006401300430298
    },
    {
        "BLOCK_SIZE_M": 32,
        "BLOCK_SIZE_N": 256,
        "BLOCK_SIZE_K": 256,
        "GROUP_SIZE_M": 8,
        "num_stages": 8,
        "num_warps": 8,
        "compile_time": 2.8854317665100098
    },
    {
        "BLOCK_SIZE_M": 32,
        "BLOCK_SIZE_N": 256,
        "BLOCK_SIZE_K": 256,
        "GROUP_SIZE_M": 8,
        "num_stages": 8,
        "num_warps": 16,
        "compile_time": 1.510915756225586
    },
    {
        "BLOCK_SIZE_M": 32,
        "BLOCK_SIZE_N": 256,
        "BLOCK_SIZE_K": 256,
        "GROUP_SIZE_M": 8,
        "num_stages": 8,
        "num_warps": 32,
        "compile_time": 0.9377450942993164
    },
    {
        "BLOCK_SIZE_M": 32,
        "BLOCK_SIZE_N": 256,
        "BLOCK_SIZE_K": 512,
        "GROUP_SIZE_M": 8,
        "num_stages": 1,
        "num_warps": 2,
        "compile_time": 19.480278730392456
    },
    {
        "BLOCK_SIZE_M": 32,
        "BLOCK_SIZE_N": 256,
        "BLOCK_SIZE_K": 512,
        "GROUP_SIZE_M": 8,
        "num_stages": 1,
        "num_warps": 4,
        "compile_time": 8.38672423362732
    },
    {
        "BLOCK_SIZE_M": 32,
        "BLOCK_SIZE_N": 256,
        "BLOCK_SIZE_K": 512,
        "GROUP_SIZE_M": 8,
        "num_stages": 1,
        "num_warps": 8,
        "compile_time": 3.2056405544281006
    },
    {
        "BLOCK_SIZE_M": 32,
        "BLOCK_SIZE_N": 256,
        "BLOCK_SIZE_K": 512,
        "GROUP_SIZE_M": 8,
        "num_stages": 1,
        "num_warps": 16,
        "compile_time": 1.3660752773284912
    },
    {
        "BLOCK_SIZE_M": 32,
        "BLOCK_SIZE_N": 256,
        "BLOCK_SIZE_K": 512,
        "GROUP_SIZE_M": 8,
        "num_stages": 1,
        "num_warps": 32,
        "compile_time": 0.8081684112548828
    },
    {
        "BLOCK_SIZE_M": 32,
        "BLOCK_SIZE_N": 256,
        "BLOCK_SIZE_K": 512,
        "GROUP_SIZE_M": 8,
        "num_stages": 2,
        "num_warps": 2,
        "compile_time": 19.561641931533813
    },
    {
        "BLOCK_SIZE_M": 32,
        "BLOCK_SIZE_N": 256,
        "BLOCK_SIZE_K": 512,
        "GROUP_SIZE_M": 8,
        "num_stages": 2,
        "num_warps": 4,
        "compile_time": 8.390816688537598
    },
    {
        "BLOCK_SIZE_M": 32,
        "BLOCK_SIZE_N": 256,
        "BLOCK_SIZE_K": 512,
        "GROUP_SIZE_M": 8,
        "num_stages": 2,
        "num_warps": 8,
        "compile_time": 3.523563861846924
    },
    {
        "BLOCK_SIZE_M": 32,
        "BLOCK_SIZE_N": 256,
        "BLOCK_SIZE_K": 512,
        "GROUP_SIZE_M": 8,
        "num_stages": 2,
        "num_warps": 16,
        "compile_time": 1.5713071823120117
    },
    {
        "BLOCK_SIZE_M": 32,
        "BLOCK_SIZE_N": 256,
        "BLOCK_SIZE_K": 512,
        "GROUP_SIZE_M": 8,
        "num_stages": 2,
        "num_warps": 32,
        "compile_time": 0.9389848709106445
    },
    {
        "BLOCK_SIZE_M": 32,
        "BLOCK_SIZE_N": 256,
        "BLOCK_SIZE_K": 512,
        "GROUP_SIZE_M": 8,
        "num_stages": 3,
        "num_warps": 2,
        "compile_time": 20.5659658908844
    },
    {
        "BLOCK_SIZE_M": 32,
        "BLOCK_SIZE_N": 256,
        "BLOCK_SIZE_K": 512,
        "GROUP_SIZE_M": 8,
        "num_stages": 3,
        "num_warps": 4,
        "compile_time": 6.060029745101929
    },
    {
        "BLOCK_SIZE_M": 32,
        "BLOCK_SIZE_N": 256,
        "BLOCK_SIZE_K": 512,
        "GROUP_SIZE_M": 8,
        "num_stages": 3,
        "num_warps": 8,
        "compile_time": 10.94020938873291
    },
    {
        "BLOCK_SIZE_M": 32,
        "BLOCK_SIZE_N": 256,
        "BLOCK_SIZE_K": 512,
        "GROUP_SIZE_M": 8,
        "num_stages": 3,
        "num_warps": 16,
        "compile_time": 2.2215917110443115
    },
    {
        "BLOCK_SIZE_M": 32,
        "BLOCK_SIZE_N": 256,
        "BLOCK_SIZE_K": 512,
        "GROUP_SIZE_M": 8,
        "num_stages": 3,
        "num_warps": 32,
        "compile_time": 1.1092746257781982
    },
    {
        "BLOCK_SIZE_M": 32,
        "BLOCK_SIZE_N": 256,
        "BLOCK_SIZE_K": 512,
        "GROUP_SIZE_M": 8,
        "num_stages": 4,
        "num_warps": 2,
        "compile_time": 21.39051866531372
    },
    {
        "BLOCK_SIZE_M": 32,
        "BLOCK_SIZE_N": 256,
        "BLOCK_SIZE_K": 512,
        "GROUP_SIZE_M": 8,
        "num_stages": 4,
        "num_warps": 4,
        "compile_time": 6.44033408164978
    },
    {
        "BLOCK_SIZE_M": 32,
        "BLOCK_SIZE_N": 256,
        "BLOCK_SIZE_K": 512,
        "GROUP_SIZE_M": 8,
        "num_stages": 4,
        "num_warps": 8,
        "compile_time": 10.809951305389404
    },
    {
        "BLOCK_SIZE_M": 32,
        "BLOCK_SIZE_N": 256,
        "BLOCK_SIZE_K": 512,
        "GROUP_SIZE_M": 8,
        "num_stages": 4,
        "num_warps": 16,
        "compile_time": 2.4178836345672607
    },
    {
        "BLOCK_SIZE_M": 32,
        "BLOCK_SIZE_N": 256,
        "BLOCK_SIZE_K": 512,
        "GROUP_SIZE_M": 8,
        "num_stages": 4,
        "num_warps": 32,
        "compile_time": 1.2539536952972412
    },
    {
        "BLOCK_SIZE_M": 32,
        "BLOCK_SIZE_N": 256,
        "BLOCK_SIZE_K": 512,
        "GROUP_SIZE_M": 8,
        "num_stages": 5,
        "num_warps": 2,
        "compile_time": 22.36499571800232
    },
    {
        "BLOCK_SIZE_M": 32,
        "BLOCK_SIZE_N": 256,
        "BLOCK_SIZE_K": 512,
        "GROUP_SIZE_M": 8,
        "num_stages": 5,
        "num_warps": 4,
        "compile_time": 6.9218430519104
    },
    {
        "BLOCK_SIZE_M": 32,
        "BLOCK_SIZE_N": 256,
        "BLOCK_SIZE_K": 512,
        "GROUP_SIZE_M": 8,
        "num_stages": 5,
        "num_warps": 8,
        "compile_time": 10.940967559814453
    },
    {
        "BLOCK_SIZE_M": 32,
        "BLOCK_SIZE_N": 256,
        "BLOCK_SIZE_K": 512,
        "GROUP_SIZE_M": 8,
        "num_stages": 5,
        "num_warps": 16,
        "compile_time": 2.6053225994110107
    },
    {
        "BLOCK_SIZE_M": 32,
        "BLOCK_SIZE_N": 256,
        "BLOCK_SIZE_K": 512,
        "GROUP_SIZE_M": 8,
        "num_stages": 5,
        "num_warps": 32,
        "compile_time": 1.302546501159668
    },
    {
        "BLOCK_SIZE_M": 32,
        "BLOCK_SIZE_N": 256,
        "BLOCK_SIZE_K": 512,
        "GROUP_SIZE_M": 8,
        "num_stages": 6,
        "num_warps": 2,
        "compile_time": 22.983150005340576
    },
    {
        "BLOCK_SIZE_M": 32,
        "BLOCK_SIZE_N": 256,
        "BLOCK_SIZE_K": 512,
        "GROUP_SIZE_M": 8,
        "num_stages": 6,
        "num_warps": 4,
        "compile_time": 7.393338918685913
    },
    {
        "BLOCK_SIZE_M": 32,
        "BLOCK_SIZE_N": 256,
        "BLOCK_SIZE_K": 512,
        "GROUP_SIZE_M": 8,
        "num_stages": 6,
        "num_warps": 8,
        "compile_time": 11.695115566253662
    },
    {
        "BLOCK_SIZE_M": 32,
        "BLOCK_SIZE_N": 256,
        "BLOCK_SIZE_K": 512,
        "GROUP_SIZE_M": 8,
        "num_stages": 6,
        "num_warps": 16,
        "compile_time": 2.874687671661377
    },
    {
        "BLOCK_SIZE_M": 32,
        "BLOCK_SIZE_N": 256,
        "BLOCK_SIZE_K": 512,
        "GROUP_SIZE_M": 8,
        "num_stages": 6,
        "num_warps": 32,
        "compile_time": 1.4080910682678223
    },
    {
        "BLOCK_SIZE_M": 32,
        "BLOCK_SIZE_N": 256,
        "BLOCK_SIZE_K": 512,
        "GROUP_SIZE_M": 8,
        "num_stages": 7,
        "num_warps": 2,
        "compile_time": 6.31621789932251
    },
    {
        "BLOCK_SIZE_M": 32,
        "BLOCK_SIZE_N": 256,
        "BLOCK_SIZE_K": 512,
        "GROUP_SIZE_M": 8,
        "num_stages": 7,
        "num_warps": 4,
        "compile_time": 7.885640382766724
    },
    {
        "BLOCK_SIZE_M": 32,
        "BLOCK_SIZE_N": 256,
        "BLOCK_SIZE_K": 512,
        "GROUP_SIZE_M": 8,
        "num_stages": 7,
        "num_warps": 8,
        "compile_time": 11.595889568328857
    },
    {
        "BLOCK_SIZE_M": 32,
        "BLOCK_SIZE_N": 256,
        "BLOCK_SIZE_K": 512,
        "GROUP_SIZE_M": 8,
        "num_stages": 7,
        "num_warps": 16,
        "compile_time": 3.0413384437561035
    },
    {
        "BLOCK_SIZE_M": 32,
        "BLOCK_SIZE_N": 256,
        "BLOCK_SIZE_K": 512,
        "GROUP_SIZE_M": 8,
        "num_stages": 7,
        "num_warps": 32,
        "compile_time": 1.5378084182739258
    },
    {
        "BLOCK_SIZE_M": 32,
        "BLOCK_SIZE_N": 256,
        "BLOCK_SIZE_K": 512,
        "GROUP_SIZE_M": 8,
        "num_stages": 8,
        "num_warps": 2,
        "compile_time": 7.1007208824157715
    },
    {
        "BLOCK_SIZE_M": 32,
        "BLOCK_SIZE_N": 256,
        "BLOCK_SIZE_K": 512,
        "GROUP_SIZE_M": 8,
        "num_stages": 8,
        "num_warps": 4,
        "compile_time": 8.279980659484863
    },
    {
        "BLOCK_SIZE_M": 32,
        "BLOCK_SIZE_N": 256,
        "BLOCK_SIZE_K": 512,
        "GROUP_SIZE_M": 8,
        "num_stages": 8,
        "num_warps": 8,
        "compile_time": 11.718412399291992
    },
    {
        "BLOCK_SIZE_M": 32,
        "BLOCK_SIZE_N": 256,
        "BLOCK_SIZE_K": 512,
        "GROUP_SIZE_M": 8,
        "num_stages": 8,
        "num_warps": 16,
        "compile_time": 3.25496768951416
    },
    {
        "BLOCK_SIZE_M": 32,
        "BLOCK_SIZE_N": 256,
        "BLOCK_SIZE_K": 512,
        "GROUP_SIZE_M": 8,
        "num_stages": 8,
        "num_warps": 32,
        "compile_time": 1.6505651473999023
    },
    {
        "BLOCK_SIZE_M": 32,
        "BLOCK_SIZE_N": 512,
        "BLOCK_SIZE_K": 32,
        "GROUP_SIZE_M": 8,
        "num_stages": 6,
        "num_warps": 2,
        "compile_time": 4.205766439437866
    },
    {
        "BLOCK_SIZE_M": 32,
        "BLOCK_SIZE_N": 512,
        "BLOCK_SIZE_K": 32,
        "GROUP_SIZE_M": 8,
        "num_stages": 6,
        "num_warps": 4,
        "compile_time": 1.5827679634094238
    },
    {
        "BLOCK_SIZE_M": 32,
        "BLOCK_SIZE_N": 512,
        "BLOCK_SIZE_K": 32,
        "GROUP_SIZE_M": 8,
        "num_stages": 6,
        "num_warps": 8,
        "compile_time": 0.8495609760284424
    },
    {
        "BLOCK_SIZE_M": 32,
        "BLOCK_SIZE_N": 512,
        "BLOCK_SIZE_K": 32,
        "GROUP_SIZE_M": 8,
        "num_stages": 6,
        "num_warps": 16,
        "compile_time": 0.5842969417572021
    },
    {
        "BLOCK_SIZE_M": 32,
        "BLOCK_SIZE_N": 512,
        "BLOCK_SIZE_K": 32,
        "GROUP_SIZE_M": 8,
        "num_stages": 7,
        "num_warps": 2,
        "compile_time": 4.289622068405151
    },
    {
        "BLOCK_SIZE_M": 32,
        "BLOCK_SIZE_N": 512,
        "BLOCK_SIZE_K": 32,
        "GROUP_SIZE_M": 8,
        "num_stages": 7,
        "num_warps": 4,
        "compile_time": 1.6602227687835693
    },
    {
        "BLOCK_SIZE_M": 32,
        "BLOCK_SIZE_N": 512,
        "BLOCK_SIZE_K": 32,
        "GROUP_SIZE_M": 8,
        "num_stages": 7,
        "num_warps": 8,
        "compile_time": 0.8850052356719971
    },
    {
        "BLOCK_SIZE_M": 32,
        "BLOCK_SIZE_N": 512,
        "BLOCK_SIZE_K": 32,
        "GROUP_SIZE_M": 8,
        "num_stages": 7,
        "num_warps": 16,
        "compile_time": 0.6133158206939697
    },
    {
        "BLOCK_SIZE_M": 32,
        "BLOCK_SIZE_N": 512,
        "BLOCK_SIZE_K": 32,
        "GROUP_SIZE_M": 8,
        "num_stages": 7,
        "num_warps": 32,
        "compile_time": 0.4569892883300781
    },
    {
        "BLOCK_SIZE_M": 32,
        "BLOCK_SIZE_N": 512,
        "BLOCK_SIZE_K": 32,
        "GROUP_SIZE_M": 8,
        "num_stages": 8,
        "num_warps": 2,
        "compile_time": 4.415499925613403
    },
    {
        "BLOCK_SIZE_M": 32,
        "BLOCK_SIZE_N": 512,
        "BLOCK_SIZE_K": 32,
        "GROUP_SIZE_M": 8,
        "num_stages": 8,
        "num_warps": 4,
        "compile_time": 1.7088623046875
    },
    {
        "BLOCK_SIZE_M": 32,
        "BLOCK_SIZE_N": 512,
        "BLOCK_SIZE_K": 32,
        "GROUP_SIZE_M": 8,
        "num_stages": 8,
        "num_warps": 8,
        "compile_time": 0.9515979290008545
    },
    {
        "BLOCK_SIZE_M": 32,
        "BLOCK_SIZE_N": 512,
        "BLOCK_SIZE_K": 32,
        "GROUP_SIZE_M": 8,
        "num_stages": 8,
        "num_warps": 16,
        "compile_time": 0.6394903659820557
    },
    {
        "BLOCK_SIZE_M": 32,
        "BLOCK_SIZE_N": 512,
        "BLOCK_SIZE_K": 32,
        "GROUP_SIZE_M": 8,
        "num_stages": 8,
        "num_warps": 32,
        "compile_time": 0.0053369998931884766
    },
    {
        "BLOCK_SIZE_M": 32,
        "BLOCK_SIZE_N": 512,
        "BLOCK_SIZE_K": 64,
        "GROUP_SIZE_M": 8,
        "num_stages": 2,
        "num_warps": 2,
        "compile_time": 6.044219732284546
    },
    {
        "BLOCK_SIZE_M": 32,
        "BLOCK_SIZE_N": 512,
        "BLOCK_SIZE_K": 64,
        "GROUP_SIZE_M": 8,
        "num_stages": 3,
        "num_warps": 2,
        "compile_time": 11.881563663482666
    },
    {
        "BLOCK_SIZE_M": 32,
        "BLOCK_SIZE_N": 512,
        "BLOCK_SIZE_K": 64,
        "GROUP_SIZE_M": 8,
        "num_stages": 4,
        "num_warps": 2,
        "compile_time": 12.11980390548706
    },
    {
        "BLOCK_SIZE_M": 32,
        "BLOCK_SIZE_N": 512,
        "BLOCK_SIZE_K": 64,
        "GROUP_SIZE_M": 8,
        "num_stages": 4,
        "num_warps": 4,
        "compile_time": 2.565467357635498
    },
    {
        "BLOCK_SIZE_M": 32,
        "BLOCK_SIZE_N": 512,
        "BLOCK_SIZE_K": 64,
        "GROUP_SIZE_M": 8,
        "num_stages": 4,
        "num_warps": 8,
        "compile_time": 1.1325242519378662
    },
    {
        "BLOCK_SIZE_M": 32,
        "BLOCK_SIZE_N": 512,
        "BLOCK_SIZE_K": 64,
        "GROUP_SIZE_M": 8,
        "num_stages": 4,
        "num_warps": 16,
        "compile_time": 0.0045528411865234375
    },
    {
        "BLOCK_SIZE_M": 32,
        "BLOCK_SIZE_N": 512,
        "BLOCK_SIZE_K": 64,
        "GROUP_SIZE_M": 8,
        "num_stages": 4,
        "num_warps": 32,
        "compile_time": 0.5342316627502441
    },
    {
        "BLOCK_SIZE_M": 32,
        "BLOCK_SIZE_N": 512,
        "BLOCK_SIZE_K": 64,
        "GROUP_SIZE_M": 8,
        "num_stages": 5,
        "num_warps": 2,
        "compile_time": 12.299610376358032
    },
    {
        "BLOCK_SIZE_M": 32,
        "BLOCK_SIZE_N": 512,
        "BLOCK_SIZE_K": 64,
        "GROUP_SIZE_M": 8,
        "num_stages": 5,
        "num_warps": 4,
        "compile_time": 2.690518617630005
    },
    {
        "BLOCK_SIZE_M": 32,
        "BLOCK_SIZE_N": 512,
        "BLOCK_SIZE_K": 64,
        "GROUP_SIZE_M": 8,
        "num_stages": 5,
        "num_warps": 8,
        "compile_time": 1.2000906467437744
    },
    {
        "BLOCK_SIZE_M": 32,
        "BLOCK_SIZE_N": 512,
        "BLOCK_SIZE_K": 64,
        "GROUP_SIZE_M": 8,
        "num_stages": 5,
        "num_warps": 16,
        "compile_time": 0.7550208568572998
    },
    {
        "BLOCK_SIZE_M": 32,
        "BLOCK_SIZE_N": 512,
        "BLOCK_SIZE_K": 64,
        "GROUP_SIZE_M": 8,
        "num_stages": 5,
        "num_warps": 32,
        "compile_time": 0.559168815612793
    },
    {
        "BLOCK_SIZE_M": 32,
        "BLOCK_SIZE_N": 512,
        "BLOCK_SIZE_K": 64,
        "GROUP_SIZE_M": 8,
        "num_stages": 6,
        "num_warps": 2,
        "compile_time": 12.388625383377075
    },
    {
        "BLOCK_SIZE_M": 32,
        "BLOCK_SIZE_N": 512,
        "BLOCK_SIZE_K": 64,
        "GROUP_SIZE_M": 8,
        "num_stages": 6,
        "num_warps": 4,
        "compile_time": 2.9255318641662598
    },
    {
        "BLOCK_SIZE_M": 32,
        "BLOCK_SIZE_N": 512,
        "BLOCK_SIZE_K": 64,
        "GROUP_SIZE_M": 8,
        "num_stages": 6,
        "num_warps": 8,
        "compile_time": 1.28951096534729
    },
    {
        "BLOCK_SIZE_M": 32,
        "BLOCK_SIZE_N": 512,
        "BLOCK_SIZE_K": 64,
        "GROUP_SIZE_M": 8,
        "num_stages": 6,
        "num_warps": 16,
        "compile_time": 0.8088316917419434
    },
    {
        "BLOCK_SIZE_M": 32,
        "BLOCK_SIZE_N": 512,
        "BLOCK_SIZE_K": 64,
        "GROUP_SIZE_M": 8,
        "num_stages": 6,
        "num_warps": 32,
        "compile_time": 0.5923149585723877
    },
    {
        "BLOCK_SIZE_M": 32,
        "BLOCK_SIZE_N": 512,
        "BLOCK_SIZE_K": 64,
        "GROUP_SIZE_M": 8,
        "num_stages": 7,
        "num_warps": 2,
        "compile_time": 12.51423954963684
    },
    {
        "BLOCK_SIZE_M": 32,
        "BLOCK_SIZE_N": 512,
        "BLOCK_SIZE_K": 64,
        "GROUP_SIZE_M": 8,
        "num_stages": 7,
        "num_warps": 4,
        "compile_time": 2.996752977371216
    },
    {
        "BLOCK_SIZE_M": 32,
        "BLOCK_SIZE_N": 512,
        "BLOCK_SIZE_K": 64,
        "GROUP_SIZE_M": 8,
        "num_stages": 7,
        "num_warps": 8,
        "compile_time": 1.3620328903198242
    },
    {
        "BLOCK_SIZE_M": 32,
        "BLOCK_SIZE_N": 512,
        "BLOCK_SIZE_K": 64,
        "GROUP_SIZE_M": 8,
        "num_stages": 7,
        "num_warps": 16,
        "compile_time": 0.8471641540527344
    },
    {
        "BLOCK_SIZE_M": 32,
        "BLOCK_SIZE_N": 512,
        "BLOCK_SIZE_K": 64,
        "GROUP_SIZE_M": 8,
        "num_stages": 7,
        "num_warps": 32,
        "compile_time": 0.005575656890869141
    },
    {
        "BLOCK_SIZE_M": 32,
        "BLOCK_SIZE_N": 512,
        "BLOCK_SIZE_K": 64,
        "GROUP_SIZE_M": 8,
        "num_stages": 8,
        "num_warps": 2,
        "compile_time": 12.728971719741821
    },
    {
        "BLOCK_SIZE_M": 32,
        "BLOCK_SIZE_N": 512,
        "BLOCK_SIZE_K": 64,
        "GROUP_SIZE_M": 8,
        "num_stages": 8,
        "num_warps": 4,
        "compile_time": 3.171208620071411
    },
    {
        "BLOCK_SIZE_M": 32,
        "BLOCK_SIZE_N": 512,
        "BLOCK_SIZE_K": 64,
        "GROUP_SIZE_M": 8,
        "num_stages": 8,
        "num_warps": 8,
        "compile_time": 1.4661574363708496
    },
    {
        "BLOCK_SIZE_M": 32,
        "BLOCK_SIZE_N": 512,
        "BLOCK_SIZE_K": 64,
        "GROUP_SIZE_M": 8,
        "num_stages": 8,
        "num_warps": 16,
        "compile_time": 0.8896853923797607
    },
    {
        "BLOCK_SIZE_M": 32,
        "BLOCK_SIZE_N": 512,
        "BLOCK_SIZE_K": 64,
        "GROUP_SIZE_M": 8,
        "num_stages": 8,
        "num_warps": 32,
        "compile_time": 0.6837418079376221
    },
    {
        "BLOCK_SIZE_M": 32,
        "BLOCK_SIZE_N": 512,
        "BLOCK_SIZE_K": 128,
        "GROUP_SIZE_M": 8,
        "num_stages": 1,
        "num_warps": 2,
        "compile_time": 9.72303056716919
    },
    {
        "BLOCK_SIZE_M": 32,
        "BLOCK_SIZE_N": 512,
        "BLOCK_SIZE_K": 128,
        "GROUP_SIZE_M": 8,
        "num_stages": 2,
        "num_warps": 2,
        "compile_time": 6.037551164627075
    },
    {
        "BLOCK_SIZE_M": 32,
        "BLOCK_SIZE_N": 512,
        "BLOCK_SIZE_K": 128,
        "GROUP_SIZE_M": 8,
        "num_stages": 3,
        "num_warps": 2,
        "compile_time": 6.213257789611816
    },
    {
        "BLOCK_SIZE_M": 32,
        "BLOCK_SIZE_N": 512,
        "BLOCK_SIZE_K": 128,
        "GROUP_SIZE_M": 8,
        "num_stages": 3,
        "num_warps": 4,
        "compile_time": 10.493529319763184
    },
    {
        "BLOCK_SIZE_M": 32,
        "BLOCK_SIZE_N": 512,
        "BLOCK_SIZE_K": 128,
        "GROUP_SIZE_M": 8,
        "num_stages": 3,
        "num_warps": 8,
        "compile_time": 2.1535086631774902
    },
    {
        "BLOCK_SIZE_M": 32,
        "BLOCK_SIZE_N": 512,
        "BLOCK_SIZE_K": 128,
        "GROUP_SIZE_M": 8,
        "num_stages": 3,
        "num_warps": 16,
        "compile_time": 1.0186882019042969
    },
    {
        "BLOCK_SIZE_M": 32,
        "BLOCK_SIZE_N": 512,
        "BLOCK_SIZE_K": 128,
        "GROUP_SIZE_M": 8,
        "num_stages": 3,
        "num_warps": 32,
        "compile_time": 0.6827287673950195
    },
    {
        "BLOCK_SIZE_M": 32,
        "BLOCK_SIZE_N": 512,
        "BLOCK_SIZE_K": 128,
        "GROUP_SIZE_M": 8,
        "num_stages": 4,
        "num_warps": 2,
        "compile_time": 6.562928915023804
    },
    {
        "BLOCK_SIZE_M": 32,
        "BLOCK_SIZE_N": 512,
        "BLOCK_SIZE_K": 128,
        "GROUP_SIZE_M": 8,
        "num_stages": 4,
        "num_warps": 4,
        "compile_time": 11.021259546279907
    },
    {
        "BLOCK_SIZE_M": 32,
        "BLOCK_SIZE_N": 512,
        "BLOCK_SIZE_K": 128,
        "GROUP_SIZE_M": 8,
        "num_stages": 4,
        "num_warps": 8,
        "compile_time": 2.3003311157226562
    },
    {
        "BLOCK_SIZE_M": 32,
        "BLOCK_SIZE_N": 512,
        "BLOCK_SIZE_K": 128,
        "GROUP_SIZE_M": 8,
        "num_stages": 4,
        "num_warps": 16,
        "compile_time": 1.1054117679595947
    },
    {
        "BLOCK_SIZE_M": 32,
        "BLOCK_SIZE_N": 512,
        "BLOCK_SIZE_K": 128,
        "GROUP_SIZE_M": 8,
        "num_stages": 4,
        "num_warps": 32,
        "compile_time": 0.7336468696594238
    },
    {
        "BLOCK_SIZE_M": 32,
        "BLOCK_SIZE_N": 512,
        "BLOCK_SIZE_K": 128,
        "GROUP_SIZE_M": 8,
        "num_stages": 5,
        "num_warps": 2,
        "compile_time": 7.078667402267456
    },
    {
        "BLOCK_SIZE_M": 32,
        "BLOCK_SIZE_N": 512,
        "BLOCK_SIZE_K": 128,
        "GROUP_SIZE_M": 8,
        "num_stages": 5,
        "num_warps": 4,
        "compile_time": 11.469527959823608
    },
    {
        "BLOCK_SIZE_M": 32,
        "BLOCK_SIZE_N": 512,
        "BLOCK_SIZE_K": 128,
        "GROUP_SIZE_M": 8,
        "num_stages": 5,
        "num_warps": 8,
        "compile_time": 2.466013193130493
    },
    {
        "BLOCK_SIZE_M": 32,
        "BLOCK_SIZE_N": 512,
        "BLOCK_SIZE_K": 128,
        "GROUP_SIZE_M": 8,
        "num_stages": 5,
        "num_warps": 16,
        "compile_time": 1.209336757659912
    },
    {
        "BLOCK_SIZE_M": 32,
        "BLOCK_SIZE_N": 512,
        "BLOCK_SIZE_K": 128,
        "GROUP_SIZE_M": 8,
        "num_stages": 5,
        "num_warps": 32,
        "compile_time": 0.005277395248413086
    },
    {
        "BLOCK_SIZE_M": 32,
        "BLOCK_SIZE_N": 512,
        "BLOCK_SIZE_K": 128,
        "GROUP_SIZE_M": 8,
        "num_stages": 6,
        "num_warps": 2,
        "compile_time": 7.461314916610718
    },
    {
        "BLOCK_SIZE_M": 32,
        "BLOCK_SIZE_N": 512,
        "BLOCK_SIZE_K": 128,
        "GROUP_SIZE_M": 8,
        "num_stages": 6,
        "num_warps": 4,
        "compile_time": 12.160836458206177
    },
    {
        "BLOCK_SIZE_M": 32,
        "BLOCK_SIZE_N": 512,
        "BLOCK_SIZE_K": 128,
        "GROUP_SIZE_M": 8,
        "num_stages": 6,
        "num_warps": 8,
        "compile_time": 2.6678013801574707
    },
    {
        "BLOCK_SIZE_M": 32,
        "BLOCK_SIZE_N": 512,
        "BLOCK_SIZE_K": 128,
        "GROUP_SIZE_M": 8,
        "num_stages": 6,
        "num_warps": 16,
        "compile_time": 0.0056552886962890625
    },
    {
        "BLOCK_SIZE_M": 32,
        "BLOCK_SIZE_N": 512,
        "BLOCK_SIZE_K": 128,
        "GROUP_SIZE_M": 8,
        "num_stages": 6,
        "num_warps": 32,
        "compile_time": 0.8308744430541992
    },
    {
        "BLOCK_SIZE_M": 32,
        "BLOCK_SIZE_N": 512,
        "BLOCK_SIZE_K": 128,
        "GROUP_SIZE_M": 8,
        "num_stages": 7,
        "num_warps": 2,
        "compile_time": 7.884371042251587
    },
    {
        "BLOCK_SIZE_M": 32,
        "BLOCK_SIZE_N": 512,
        "BLOCK_SIZE_K": 128,
        "GROUP_SIZE_M": 8,
        "num_stages": 7,
        "num_warps": 4,
        "compile_time": 11.57102084159851
    },
    {
        "BLOCK_SIZE_M": 32,
        "BLOCK_SIZE_N": 512,
        "BLOCK_SIZE_K": 128,
        "GROUP_SIZE_M": 8,
        "num_stages": 7,
        "num_warps": 8,
        "compile_time": 2.8243908882141113
    },
    {
        "BLOCK_SIZE_M": 32,
        "BLOCK_SIZE_N": 512,
        "BLOCK_SIZE_K": 128,
        "GROUP_SIZE_M": 8,
        "num_stages": 7,
        "num_warps": 16,
        "compile_time": 1.4132211208343506
    },
    {
        "BLOCK_SIZE_M": 32,
        "BLOCK_SIZE_N": 512,
        "BLOCK_SIZE_K": 128,
        "GROUP_SIZE_M": 8,
        "num_stages": 7,
        "num_warps": 32,
        "compile_time": 0.005410909652709961
    },
    {
        "BLOCK_SIZE_M": 32,
        "BLOCK_SIZE_N": 512,
        "BLOCK_SIZE_K": 128,
        "GROUP_SIZE_M": 8,
        "num_stages": 8,
        "num_warps": 2,
        "compile_time": 8.316815853118896
    },
    {
        "BLOCK_SIZE_M": 32,
        "BLOCK_SIZE_N": 512,
        "BLOCK_SIZE_K": 128,
        "GROUP_SIZE_M": 8,
        "num_stages": 8,
        "num_warps": 4,
        "compile_time": 12.460347652435303
    },
    {
        "BLOCK_SIZE_M": 32,
        "BLOCK_SIZE_N": 512,
        "BLOCK_SIZE_K": 128,
        "GROUP_SIZE_M": 8,
        "num_stages": 8,
        "num_warps": 8,
        "compile_time": 2.9672207832336426
    },
    {
        "BLOCK_SIZE_M": 32,
        "BLOCK_SIZE_N": 512,
        "BLOCK_SIZE_K": 128,
        "GROUP_SIZE_M": 8,
        "num_stages": 8,
        "num_warps": 16,
        "compile_time": 0.004369497299194336
    },
    {
        "BLOCK_SIZE_M": 32,
        "BLOCK_SIZE_N": 512,
        "BLOCK_SIZE_K": 128,
        "GROUP_SIZE_M": 8,
        "num_stages": 8,
        "num_warps": 32,
        "compile_time": 0.9508039951324463
    },
    {
        "BLOCK_SIZE_M": 32,
        "BLOCK_SIZE_N": 512,
        "BLOCK_SIZE_K": 256,
        "GROUP_SIZE_M": 8,
        "num_stages": 1,
        "num_warps": 2,
        "compile_time": 19.792635202407837
    },
    {
        "BLOCK_SIZE_M": 32,
        "BLOCK_SIZE_N": 512,
        "BLOCK_SIZE_K": 256,
        "GROUP_SIZE_M": 8,
        "num_stages": 1,
        "num_warps": 4,
        "compile_time": 8.612438201904297
    },
    {
        "BLOCK_SIZE_M": 32,
        "BLOCK_SIZE_N": 512,
        "BLOCK_SIZE_K": 256,
        "GROUP_SIZE_M": 8,
        "num_stages": 1,
        "num_warps": 8,
        "compile_time": 3.1105425357818604
    },
    {
        "BLOCK_SIZE_M": 32,
        "BLOCK_SIZE_N": 512,
        "BLOCK_SIZE_K": 256,
        "GROUP_SIZE_M": 8,
        "num_stages": 1,
        "num_warps": 16,
        "compile_time": 0.0037903785705566406
    },
    {
        "BLOCK_SIZE_M": 32,
        "BLOCK_SIZE_N": 512,
        "BLOCK_SIZE_K": 256,
        "GROUP_SIZE_M": 8,
        "num_stages": 1,
        "num_warps": 32,
        "compile_time": 0.7630641460418701
    },
    {
        "BLOCK_SIZE_M": 32,
        "BLOCK_SIZE_N": 512,
        "BLOCK_SIZE_K": 256,
        "GROUP_SIZE_M": 8,
        "num_stages": 2,
        "num_warps": 2,
        "compile_time": 20.046301126480103
    },
    {
        "BLOCK_SIZE_M": 32,
        "BLOCK_SIZE_N": 512,
        "BLOCK_SIZE_K": 256,
        "GROUP_SIZE_M": 8,
        "num_stages": 2,
        "num_warps": 4,
        "compile_time": 8.64066743850708
    },
    {
        "BLOCK_SIZE_M": 32,
        "BLOCK_SIZE_N": 512,
        "BLOCK_SIZE_K": 256,
        "GROUP_SIZE_M": 8,
        "num_stages": 2,
        "num_warps": 8,
        "compile_time": 3.459272623062134
    },
    {
        "BLOCK_SIZE_M": 32,
        "BLOCK_SIZE_N": 512,
        "BLOCK_SIZE_K": 256,
        "GROUP_SIZE_M": 8,
        "num_stages": 2,
        "num_warps": 16,
        "compile_time": 0.004724979400634766
    },
    {
        "BLOCK_SIZE_M": 32,
        "BLOCK_SIZE_N": 512,
        "BLOCK_SIZE_K": 256,
        "GROUP_SIZE_M": 8,
        "num_stages": 2,
        "num_warps": 32,
        "compile_time": 0.9129481315612793
    },
    {
        "BLOCK_SIZE_M": 32,
        "BLOCK_SIZE_N": 512,
        "BLOCK_SIZE_K": 256,
        "GROUP_SIZE_M": 8,
        "num_stages": 3,
        "num_warps": 2,
        "compile_time": 20.783916473388672
    },
    {
        "BLOCK_SIZE_M": 32,
        "BLOCK_SIZE_N": 512,
        "BLOCK_SIZE_K": 256,
        "GROUP_SIZE_M": 8,
        "num_stages": 3,
        "num_warps": 4,
        "compile_time": 6.212259292602539
    },
    {
        "BLOCK_SIZE_M": 32,
        "BLOCK_SIZE_N": 512,
        "BLOCK_SIZE_K": 256,
        "GROUP_SIZE_M": 8,
        "num_stages": 3,
        "num_warps": 8,
        "compile_time": 10.591462850570679
    },
    {
        "BLOCK_SIZE_M": 32,
        "BLOCK_SIZE_N": 512,
        "BLOCK_SIZE_K": 256,
        "GROUP_SIZE_M": 8,
        "num_stages": 3,
        "num_warps": 16,
        "compile_time": 2.1412787437438965
    },
    {
        "BLOCK_SIZE_M": 32,
        "BLOCK_SIZE_N": 512,
        "BLOCK_SIZE_K": 256,
        "GROUP_SIZE_M": 8,
        "num_stages": 3,
        "num_warps": 32,
        "compile_time": 1.061556339263916
    },
    {
        "BLOCK_SIZE_M": 32,
        "BLOCK_SIZE_N": 512,
        "BLOCK_SIZE_K": 256,
        "GROUP_SIZE_M": 8,
        "num_stages": 4,
        "num_warps": 2,
        "compile_time": 21.65767478942871
    },
    {
        "BLOCK_SIZE_M": 32,
        "BLOCK_SIZE_N": 512,
        "BLOCK_SIZE_K": 256,
        "GROUP_SIZE_M": 8,
        "num_stages": 4,
        "num_warps": 4,
        "compile_time": 6.383872747421265
    },
    {
        "BLOCK_SIZE_M": 32,
        "BLOCK_SIZE_N": 512,
        "BLOCK_SIZE_K": 256,
        "GROUP_SIZE_M": 8,
        "num_stages": 4,
        "num_warps": 8,
        "compile_time": 10.898059368133545
    },
    {
        "BLOCK_SIZE_M": 32,
        "BLOCK_SIZE_N": 512,
        "BLOCK_SIZE_K": 256,
        "GROUP_SIZE_M": 8,
        "num_stages": 4,
        "num_warps": 16,
        "compile_time": 2.3454513549804688
    },
    {
        "BLOCK_SIZE_M": 32,
        "BLOCK_SIZE_N": 512,
        "BLOCK_SIZE_K": 256,
        "GROUP_SIZE_M": 8,
        "num_stages": 4,
        "num_warps": 32,
        "compile_time": 1.1716816425323486
    },
    {
        "BLOCK_SIZE_M": 32,
        "BLOCK_SIZE_N": 512,
        "BLOCK_SIZE_K": 256,
        "GROUP_SIZE_M": 8,
        "num_stages": 5,
        "num_warps": 2,
        "compile_time": 22.52036428451538
    },
    {
        "BLOCK_SIZE_M": 32,
        "BLOCK_SIZE_N": 512,
        "BLOCK_SIZE_K": 256,
        "GROUP_SIZE_M": 8,
        "num_stages": 5,
        "num_warps": 4,
        "compile_time": 6.889820575714111
    },
    {
        "BLOCK_SIZE_M": 32,
        "BLOCK_SIZE_N": 512,
        "BLOCK_SIZE_K": 256,
        "GROUP_SIZE_M": 8,
        "num_stages": 5,
        "num_warps": 8,
        "compile_time": 10.762160301208496
    },
    {
        "BLOCK_SIZE_M": 32,
        "BLOCK_SIZE_N": 512,
        "BLOCK_SIZE_K": 256,
        "GROUP_SIZE_M": 8,
        "num_stages": 5,
        "num_warps": 16,
        "compile_time": 2.514354705810547
    },
    {
        "BLOCK_SIZE_M": 32,
        "BLOCK_SIZE_N": 512,
        "BLOCK_SIZE_K": 256,
        "GROUP_SIZE_M": 8,
        "num_stages": 5,
        "num_warps": 32,
        "compile_time": 1.2694919109344482
    },
    {
        "BLOCK_SIZE_M": 32,
        "BLOCK_SIZE_N": 512,
        "BLOCK_SIZE_K": 256,
        "GROUP_SIZE_M": 8,
        "num_stages": 6,
        "num_warps": 2,
        "compile_time": 23.51269769668579
    },
    {
        "BLOCK_SIZE_M": 32,
        "BLOCK_SIZE_N": 512,
        "BLOCK_SIZE_K": 256,
        "GROUP_SIZE_M": 8,
        "num_stages": 6,
        "num_warps": 4,
        "compile_time": 7.408072233200073
    },
    {
        "BLOCK_SIZE_M": 32,
        "BLOCK_SIZE_N": 512,
        "BLOCK_SIZE_K": 256,
        "GROUP_SIZE_M": 8,
        "num_stages": 6,
        "num_warps": 8,
        "compile_time": 12.250940799713135
    },
    {
        "BLOCK_SIZE_M": 32,
        "BLOCK_SIZE_N": 512,
        "BLOCK_SIZE_K": 256,
        "GROUP_SIZE_M": 8,
        "num_stages": 6,
        "num_warps": 16,
        "compile_time": 2.7287797927856445
    },
    {
        "BLOCK_SIZE_M": 32,
        "BLOCK_SIZE_N": 512,
        "BLOCK_SIZE_K": 256,
        "GROUP_SIZE_M": 8,
        "num_stages": 6,
        "num_warps": 32,
        "compile_time": 0.004311323165893555
    },
    {
        "BLOCK_SIZE_M": 32,
        "BLOCK_SIZE_N": 512,
        "BLOCK_SIZE_K": 256,
        "GROUP_SIZE_M": 8,
        "num_stages": 7,
        "num_warps": 2,
        "compile_time": 6.5839550495147705
    },
    {
        "BLOCK_SIZE_M": 32,
        "BLOCK_SIZE_N": 512,
        "BLOCK_SIZE_K": 256,
        "GROUP_SIZE_M": 8,
        "num_stages": 7,
        "num_warps": 4,
        "compile_time": 7.742990970611572
    },
    {
        "BLOCK_SIZE_M": 32,
        "BLOCK_SIZE_N": 512,
        "BLOCK_SIZE_K": 256,
        "GROUP_SIZE_M": 8,
        "num_stages": 7,
        "num_warps": 8,
        "compile_time": 11.42764163017273
    },
    {
        "BLOCK_SIZE_M": 32,
        "BLOCK_SIZE_N": 512,
        "BLOCK_SIZE_K": 256,
        "GROUP_SIZE_M": 8,
        "num_stages": 7,
        "num_warps": 16,
        "compile_time": 2.8923614025115967
    },
    {
        "BLOCK_SIZE_M": 32,
        "BLOCK_SIZE_N": 512,
        "BLOCK_SIZE_K": 256,
        "GROUP_SIZE_M": 8,
        "num_stages": 7,
        "num_warps": 32,
        "compile_time": 1.4787001609802246
    },
    {
        "BLOCK_SIZE_M": 32,
        "BLOCK_SIZE_N": 512,
        "BLOCK_SIZE_K": 256,
        "GROUP_SIZE_M": 8,
        "num_stages": 8,
        "num_warps": 2,
        "compile_time": 7.354800701141357
    },
    {
        "BLOCK_SIZE_M": 32,
        "BLOCK_SIZE_N": 512,
        "BLOCK_SIZE_K": 256,
        "GROUP_SIZE_M": 8,
        "num_stages": 8,
        "num_warps": 4,
        "compile_time": 8.321455955505371
    },
    {
        "BLOCK_SIZE_M": 32,
        "BLOCK_SIZE_N": 512,
        "BLOCK_SIZE_K": 256,
        "GROUP_SIZE_M": 8,
        "num_stages": 8,
        "num_warps": 8,
        "compile_time": 11.812148094177246
    },
    {
        "BLOCK_SIZE_M": 32,
        "BLOCK_SIZE_N": 512,
        "BLOCK_SIZE_K": 256,
        "GROUP_SIZE_M": 8,
        "num_stages": 8,
        "num_warps": 16,
        "compile_time": 3.188884735107422
    },
    {
        "BLOCK_SIZE_M": 32,
        "BLOCK_SIZE_N": 512,
        "BLOCK_SIZE_K": 256,
        "GROUP_SIZE_M": 8,
        "num_stages": 8,
        "num_warps": 32,
        "compile_time": 1.601886510848999
    },
    {
        "BLOCK_SIZE_M": 32,
        "BLOCK_SIZE_N": 512,
        "BLOCK_SIZE_K": 512,
        "GROUP_SIZE_M": 8,
        "num_stages": 1,
        "num_warps": 2,
        "compile_time": 72.19538474082947
    },
    {
        "BLOCK_SIZE_M": 32,
        "BLOCK_SIZE_N": 512,
        "BLOCK_SIZE_K": 512,
        "GROUP_SIZE_M": 8,
        "num_stages": 1,
        "num_warps": 4,
        "compile_time": 19.515379428863525
    },
    {
        "BLOCK_SIZE_M": 32,
        "BLOCK_SIZE_N": 512,
        "BLOCK_SIZE_K": 512,
        "GROUP_SIZE_M": 8,
        "num_stages": 1,
        "num_warps": 8,
        "compile_time": 8.596779108047485
    },
    {
        "BLOCK_SIZE_M": 32,
        "BLOCK_SIZE_N": 512,
        "BLOCK_SIZE_K": 512,
        "GROUP_SIZE_M": 8,
        "num_stages": 1,
        "num_warps": 16,
        "compile_time": 3.1977615356445312
    },
    {
        "BLOCK_SIZE_M": 32,
        "BLOCK_SIZE_N": 512,
        "BLOCK_SIZE_K": 512,
        "GROUP_SIZE_M": 8,
        "num_stages": 1,
        "num_warps": 32,
        "compile_time": 0.0036749839782714844
    },
    {
        "BLOCK_SIZE_M": 32,
        "BLOCK_SIZE_N": 512,
        "BLOCK_SIZE_K": 512,
        "GROUP_SIZE_M": 8,
        "num_stages": 2,
        "num_warps": 2,
        "compile_time": 72.84650993347168
    },
    {
        "BLOCK_SIZE_M": 32,
        "BLOCK_SIZE_N": 512,
        "BLOCK_SIZE_K": 512,
        "GROUP_SIZE_M": 8,
        "num_stages": 2,
        "num_warps": 4,
        "compile_time": 19.676419734954834
    },
    {
        "BLOCK_SIZE_M": 32,
        "BLOCK_SIZE_N": 512,
        "BLOCK_SIZE_K": 512,
        "GROUP_SIZE_M": 8,
        "num_stages": 2,
        "num_warps": 8,
        "compile_time": 8.765070915222168
    },
    {
        "BLOCK_SIZE_M": 32,
        "BLOCK_SIZE_N": 512,
        "BLOCK_SIZE_K": 512,
        "GROUP_SIZE_M": 8,
        "num_stages": 2,
        "num_warps": 16,
        "compile_time": 3.5953378677368164
    },
    {
        "BLOCK_SIZE_M": 32,
        "BLOCK_SIZE_N": 512,
        "BLOCK_SIZE_K": 512,
        "GROUP_SIZE_M": 8,
        "num_stages": 2,
        "num_warps": 32,
        "compile_time": 0.0040128231048583984
    },
    {
        "BLOCK_SIZE_M": 32,
        "BLOCK_SIZE_N": 512,
        "BLOCK_SIZE_K": 512,
        "GROUP_SIZE_M": 8,
        "num_stages": 3,
        "num_warps": 2,
        "compile_time": 8.302362203598022
    },
    {
        "BLOCK_SIZE_M": 32,
        "BLOCK_SIZE_N": 512,
        "BLOCK_SIZE_K": 512,
        "GROUP_SIZE_M": 8,
        "num_stages": 3,
        "num_warps": 4,
        "compile_time": 20.816006660461426
    },
    {
        "BLOCK_SIZE_M": 32,
        "BLOCK_SIZE_N": 512,
        "BLOCK_SIZE_K": 512,
        "GROUP_SIZE_M": 8,
        "num_stages": 3,
        "num_warps": 8,
        "compile_time": 6.246229648590088
    },
    {
        "BLOCK_SIZE_M": 32,
        "BLOCK_SIZE_N": 512,
        "BLOCK_SIZE_K": 512,
        "GROUP_SIZE_M": 8,
        "num_stages": 3,
        "num_warps": 16,
        "compile_time": 10.771543025970459
    },
    {
        "BLOCK_SIZE_M": 32,
        "BLOCK_SIZE_N": 512,
        "BLOCK_SIZE_K": 512,
        "GROUP_SIZE_M": 8,
        "num_stages": 3,
        "num_warps": 32,
        "compile_time": 2.2596707344055176
    },
    {
        "BLOCK_SIZE_M": 32,
        "BLOCK_SIZE_N": 512,
        "BLOCK_SIZE_K": 512,
        "GROUP_SIZE_M": 8,
        "num_stages": 4,
        "num_warps": 2,
        "compile_time": 9.952754497528076
    },
    {
        "BLOCK_SIZE_M": 32,
        "BLOCK_SIZE_N": 512,
        "BLOCK_SIZE_K": 512,
        "GROUP_SIZE_M": 8,
        "num_stages": 4,
        "num_warps": 4,
        "compile_time": 21.512258052825928
    },
    {
        "BLOCK_SIZE_M": 32,
        "BLOCK_SIZE_N": 512,
        "BLOCK_SIZE_K": 512,
        "GROUP_SIZE_M": 8,
        "num_stages": 4,
        "num_warps": 8,
        "compile_time": 6.700848579406738
    },
    {
        "BLOCK_SIZE_M": 32,
        "BLOCK_SIZE_N": 512,
        "BLOCK_SIZE_K": 512,
        "GROUP_SIZE_M": 8,
        "num_stages": 4,
        "num_warps": 16,
        "compile_time": 11.033533096313477
    },
    {
        "BLOCK_SIZE_M": 32,
        "BLOCK_SIZE_N": 512,
        "BLOCK_SIZE_K": 512,
        "GROUP_SIZE_M": 8,
        "num_stages": 4,
        "num_warps": 32,
        "compile_time": 0.0044138431549072266
    },
    {
        "BLOCK_SIZE_M": 32,
        "BLOCK_SIZE_N": 512,
        "BLOCK_SIZE_K": 512,
        "GROUP_SIZE_M": 8,
        "num_stages": 5,
        "num_warps": 2,
        "compile_time": 11.680378198623657
    },
    {
        "BLOCK_SIZE_M": 32,
        "BLOCK_SIZE_N": 512,
        "BLOCK_SIZE_K": 512,
        "GROUP_SIZE_M": 8,
        "num_stages": 5,
        "num_warps": 4,
        "compile_time": 22.399887800216675
    },
    {
        "BLOCK_SIZE_M": 32,
        "BLOCK_SIZE_N": 512,
        "BLOCK_SIZE_K": 512,
        "GROUP_SIZE_M": 8,
        "num_stages": 5,
        "num_warps": 8,
        "compile_time": 7.351427793502808
    },
    {
        "BLOCK_SIZE_M": 32,
        "BLOCK_SIZE_N": 512,
        "BLOCK_SIZE_K": 512,
        "GROUP_SIZE_M": 8,
        "num_stages": 5,
        "num_warps": 16,
        "compile_time": 11.636087894439697
    },
    {
        "BLOCK_SIZE_M": 32,
        "BLOCK_SIZE_N": 512,
        "BLOCK_SIZE_K": 512,
        "GROUP_SIZE_M": 8,
        "num_stages": 5,
        "num_warps": 32,
        "compile_time": 2.6282577514648438
    },
    {
        "BLOCK_SIZE_M": 32,
        "BLOCK_SIZE_N": 512,
        "BLOCK_SIZE_K": 512,
        "GROUP_SIZE_M": 8,
        "num_stages": 6,
        "num_warps": 2,
        "compile_time": 14.02069902420044
    },
    {
        "BLOCK_SIZE_M": 32,
        "BLOCK_SIZE_N": 512,
        "BLOCK_SIZE_K": 512,
        "GROUP_SIZE_M": 8,
        "num_stages": 6,
        "num_warps": 4,
        "compile_time": 6.299772024154663
    },
    {
        "BLOCK_SIZE_M": 32,
        "BLOCK_SIZE_N": 512,
        "BLOCK_SIZE_K": 512,
        "GROUP_SIZE_M": 8,
        "num_stages": 6,
        "num_warps": 8,
        "compile_time": 7.672922372817993
    },
    {
        "BLOCK_SIZE_M": 32,
        "BLOCK_SIZE_N": 512,
        "BLOCK_SIZE_K": 512,
        "GROUP_SIZE_M": 8,
        "num_stages": 6,
        "num_warps": 16,
        "compile_time": 11.649449586868286
    },
    {
        "BLOCK_SIZE_M": 32,
        "BLOCK_SIZE_N": 512,
        "BLOCK_SIZE_K": 512,
        "GROUP_SIZE_M": 8,
        "num_stages": 6,
        "num_warps": 32,
        "compile_time": 2.951460361480713
    },
    {
        "BLOCK_SIZE_M": 32,
        "BLOCK_SIZE_N": 512,
        "BLOCK_SIZE_K": 512,
        "GROUP_SIZE_M": 8,
        "num_stages": 7,
        "num_warps": 2,
        "compile_time": 15.71055269241333
    },
    {
        "BLOCK_SIZE_M": 32,
        "BLOCK_SIZE_N": 512,
        "BLOCK_SIZE_K": 512,
        "GROUP_SIZE_M": 8,
        "num_stages": 7,
        "num_warps": 4,
        "compile_time": 6.904785633087158
    },
    {
        "BLOCK_SIZE_M": 32,
        "BLOCK_SIZE_N": 512,
        "BLOCK_SIZE_K": 512,
        "GROUP_SIZE_M": 8,
        "num_stages": 7,
        "num_warps": 8,
        "compile_time": 8.206871509552002
    },
    {
        "BLOCK_SIZE_M": 32,
        "BLOCK_SIZE_N": 512,
        "BLOCK_SIZE_K": 512,
        "GROUP_SIZE_M": 8,
        "num_stages": 7,
        "num_warps": 16,
        "compile_time": 11.805904626846313
    },
    {
        "BLOCK_SIZE_M": 32,
        "BLOCK_SIZE_N": 512,
        "BLOCK_SIZE_K": 512,
        "GROUP_SIZE_M": 8,
        "num_stages": 7,
        "num_warps": 32,
        "compile_time": 3.148282527923584
    },
    {
        "BLOCK_SIZE_M": 32,
        "BLOCK_SIZE_N": 512,
        "BLOCK_SIZE_K": 512,
        "GROUP_SIZE_M": 8,
        "num_stages": 8,
        "num_warps": 2,
        "compile_time": 17.955657482147217
    },
    {
        "BLOCK_SIZE_M": 32,
        "BLOCK_SIZE_N": 512,
        "BLOCK_SIZE_K": 512,
        "GROUP_SIZE_M": 8,
        "num_stages": 8,
        "num_warps": 4,
        "compile_time": 8.102936506271362
    },
    {
        "BLOCK_SIZE_M": 32,
        "BLOCK_SIZE_N": 512,
        "BLOCK_SIZE_K": 512,
        "GROUP_SIZE_M": 8,
        "num_stages": 8,
        "num_warps": 8,
        "compile_time": 8.825554609298706
    },
    {
        "BLOCK_SIZE_M": 32,
        "BLOCK_SIZE_N": 512,
        "BLOCK_SIZE_K": 512,
        "GROUP_SIZE_M": 8,
        "num_stages": 8,
        "num_warps": 16,
        "compile_time": 12.138602018356323
    },
    {
        "BLOCK_SIZE_M": 32,
        "BLOCK_SIZE_N": 512,
        "BLOCK_SIZE_K": 512,
        "GROUP_SIZE_M": 8,
        "num_stages": 8,
        "num_warps": 32,
        "compile_time": 3.3547110557556152
    },
    {
        "BLOCK_SIZE_M": 64,
        "BLOCK_SIZE_N": 16,
        "BLOCK_SIZE_K": 256,
        "GROUP_SIZE_M": 8,
        "num_stages": 6,
        "num_warps": 2,
        "compile_time": 2.5706722736358643
    },
    {
        "BLOCK_SIZE_M": 64,
        "BLOCK_SIZE_N": 16,
        "BLOCK_SIZE_K": 256,
        "GROUP_SIZE_M": 8,
        "num_stages": 6,
        "num_warps": 4,
        "compile_time": 1.2588515281677246
    },
    {
        "BLOCK_SIZE_M": 64,
        "BLOCK_SIZE_N": 16,
        "BLOCK_SIZE_K": 256,
        "GROUP_SIZE_M": 8,
        "num_stages": 6,
        "num_warps": 8,
        "compile_time": 0.819688081741333
    },
    {
        "BLOCK_SIZE_M": 64,
        "BLOCK_SIZE_N": 16,
        "BLOCK_SIZE_K": 256,
        "GROUP_SIZE_M": 8,
        "num_stages": 6,
        "num_warps": 16,
        "compile_time": 0.6612274646759033
    },
    {
        "BLOCK_SIZE_M": 64,
        "BLOCK_SIZE_N": 16,
        "BLOCK_SIZE_K": 256,
        "GROUP_SIZE_M": 8,
        "num_stages": 6,
        "num_warps": 32,
        "compile_time": 0.5799152851104736
    },
    {
        "BLOCK_SIZE_M": 64,
        "BLOCK_SIZE_N": 16,
        "BLOCK_SIZE_K": 256,
        "GROUP_SIZE_M": 8,
        "num_stages": 7,
        "num_warps": 2,
        "compile_time": 2.739577531814575
    },
    {
        "BLOCK_SIZE_M": 64,
        "BLOCK_SIZE_N": 16,
        "BLOCK_SIZE_K": 256,
        "GROUP_SIZE_M": 8,
        "num_stages": 7,
        "num_warps": 4,
        "compile_time": 1.3505468368530273
    },
    {
        "BLOCK_SIZE_M": 64,
        "BLOCK_SIZE_N": 16,
        "BLOCK_SIZE_K": 256,
        "GROUP_SIZE_M": 8,
        "num_stages": 7,
        "num_warps": 8,
        "compile_time": 0.8588695526123047
    },
    {
        "BLOCK_SIZE_M": 64,
        "BLOCK_SIZE_N": 16,
        "BLOCK_SIZE_K": 256,
        "GROUP_SIZE_M": 8,
        "num_stages": 7,
        "num_warps": 16,
        "compile_time": 0.005312204360961914
    },
    {
        "BLOCK_SIZE_M": 64,
        "BLOCK_SIZE_N": 16,
        "BLOCK_SIZE_K": 256,
        "GROUP_SIZE_M": 8,
        "num_stages": 7,
        "num_warps": 32,
        "compile_time": 0.5805277824401855
    },
    {
        "BLOCK_SIZE_M": 64,
        "BLOCK_SIZE_N": 16,
        "BLOCK_SIZE_K": 256,
        "GROUP_SIZE_M": 8,
        "num_stages": 8,
        "num_warps": 2,
        "compile_time": 2.8763656616210938
    },
    {
        "BLOCK_SIZE_M": 64,
        "BLOCK_SIZE_N": 16,
        "BLOCK_SIZE_K": 256,
        "GROUP_SIZE_M": 8,
        "num_stages": 8,
        "num_warps": 4,
        "compile_time": 1.4706699848175049
    },
    {
        "BLOCK_SIZE_M": 64,
        "BLOCK_SIZE_N": 16,
        "BLOCK_SIZE_K": 256,
        "GROUP_SIZE_M": 8,
        "num_stages": 8,
        "num_warps": 8,
        "compile_time": 0.908292293548584
    },
    {
        "BLOCK_SIZE_M": 64,
        "BLOCK_SIZE_N": 16,
        "BLOCK_SIZE_K": 256,
        "GROUP_SIZE_M": 8,
        "num_stages": 8,
        "num_warps": 16,
        "compile_time": 0.70271897315979
    },
    {
        "BLOCK_SIZE_M": 64,
        "BLOCK_SIZE_N": 16,
        "BLOCK_SIZE_K": 256,
        "GROUP_SIZE_M": 8,
        "num_stages": 8,
        "num_warps": 32,
        "compile_time": 0.604762077331543
    },
    {
        "BLOCK_SIZE_M": 64,
        "BLOCK_SIZE_N": 16,
        "BLOCK_SIZE_K": 512,
        "GROUP_SIZE_M": 8,
        "num_stages": 3,
        "num_warps": 2,
        "compile_time": 11.148102283477783
    },
    {
        "BLOCK_SIZE_M": 64,
        "BLOCK_SIZE_N": 16,
        "BLOCK_SIZE_K": 512,
        "GROUP_SIZE_M": 8,
        "num_stages": 4,
        "num_warps": 2,
        "compile_time": 11.88324785232544
    },
    {
        "BLOCK_SIZE_M": 64,
        "BLOCK_SIZE_N": 16,
        "BLOCK_SIZE_K": 512,
        "GROUP_SIZE_M": 8,
        "num_stages": 4,
        "num_warps": 4,
        "compile_time": 2.356916666030884
    },
    {
        "BLOCK_SIZE_M": 64,
        "BLOCK_SIZE_N": 16,
        "BLOCK_SIZE_K": 512,
        "GROUP_SIZE_M": 8,
        "num_stages": 4,
        "num_warps": 8,
        "compile_time": 1.2202351093292236
    },
    {
        "BLOCK_SIZE_M": 64,
        "BLOCK_SIZE_N": 16,
        "BLOCK_SIZE_K": 512,
        "GROUP_SIZE_M": 8,
        "num_stages": 4,
        "num_warps": 16,
        "compile_time": 0.0054416656494140625
    },
    {
        "BLOCK_SIZE_M": 64,
        "BLOCK_SIZE_N": 16,
        "BLOCK_SIZE_K": 512,
        "GROUP_SIZE_M": 8,
        "num_stages": 4,
        "num_warps": 32,
        "compile_time": 0.7299985885620117
    },
    {
        "BLOCK_SIZE_M": 64,
        "BLOCK_SIZE_N": 16,
        "BLOCK_SIZE_K": 512,
        "GROUP_SIZE_M": 8,
        "num_stages": 5,
        "num_warps": 2,
        "compile_time": 11.907312393188477
    },
    {
        "BLOCK_SIZE_M": 64,
        "BLOCK_SIZE_N": 16,
        "BLOCK_SIZE_K": 512,
        "GROUP_SIZE_M": 8,
        "num_stages": 5,
        "num_warps": 4,
        "compile_time": 2.4876532554626465
    },
    {
        "BLOCK_SIZE_M": 64,
        "BLOCK_SIZE_N": 16,
        "BLOCK_SIZE_K": 512,
        "GROUP_SIZE_M": 8,
        "num_stages": 5,
        "num_warps": 8,
        "compile_time": 1.2537131309509277
    },
    {
        "BLOCK_SIZE_M": 64,
        "BLOCK_SIZE_N": 16,
        "BLOCK_SIZE_K": 512,
        "GROUP_SIZE_M": 8,
        "num_stages": 5,
        "num_warps": 16,
        "compile_time": 0.8896059989929199
    },
    {
        "BLOCK_SIZE_M": 64,
        "BLOCK_SIZE_N": 16,
        "BLOCK_SIZE_K": 512,
        "GROUP_SIZE_M": 8,
        "num_stages": 5,
        "num_warps": 32,
        "compile_time": 0.004863262176513672
    },
    {
        "BLOCK_SIZE_M": 64,
        "BLOCK_SIZE_N": 16,
        "BLOCK_SIZE_K": 512,
        "GROUP_SIZE_M": 8,
        "num_stages": 6,
        "num_warps": 2,
        "compile_time": 12.14093804359436
    },
    {
        "BLOCK_SIZE_M": 64,
        "BLOCK_SIZE_N": 16,
        "BLOCK_SIZE_K": 512,
        "GROUP_SIZE_M": 8,
        "num_stages": 6,
        "num_warps": 4,
        "compile_time": 2.6232213973999023
    },
    {
        "BLOCK_SIZE_M": 64,
        "BLOCK_SIZE_N": 16,
        "BLOCK_SIZE_K": 512,
        "GROUP_SIZE_M": 8,
        "num_stages": 6,
        "num_warps": 8,
        "compile_time": 1.3784451484680176
    },
    {
        "BLOCK_SIZE_M": 64,
        "BLOCK_SIZE_N": 16,
        "BLOCK_SIZE_K": 512,
        "GROUP_SIZE_M": 8,
        "num_stages": 6,
        "num_warps": 16,
        "compile_time": 0.9362144470214844
    },
    {
        "BLOCK_SIZE_M": 64,
        "BLOCK_SIZE_N": 16,
        "BLOCK_SIZE_K": 512,
        "GROUP_SIZE_M": 8,
        "num_stages": 6,
        "num_warps": 32,
        "compile_time": 0.7723395824432373
    },
    {
        "BLOCK_SIZE_M": 64,
        "BLOCK_SIZE_N": 16,
        "BLOCK_SIZE_K": 512,
        "GROUP_SIZE_M": 8,
        "num_stages": 7,
        "num_warps": 2,
        "compile_time": 12.225819826126099
    },
    {
        "BLOCK_SIZE_M": 64,
        "BLOCK_SIZE_N": 16,
        "BLOCK_SIZE_K": 512,
        "GROUP_SIZE_M": 8,
        "num_stages": 7,
        "num_warps": 4,
        "compile_time": 2.8646740913391113
    },
    {
        "BLOCK_SIZE_M": 64,
        "BLOCK_SIZE_N": 16,
        "BLOCK_SIZE_K": 512,
        "GROUP_SIZE_M": 8,
        "num_stages": 7,
        "num_warps": 8,
        "compile_time": 1.4458808898925781
    },
    {
        "BLOCK_SIZE_M": 64,
        "BLOCK_SIZE_N": 16,
        "BLOCK_SIZE_K": 512,
        "GROUP_SIZE_M": 8,
        "num_stages": 7,
        "num_warps": 16,
        "compile_time": 0.9883511066436768
    },
    {
        "BLOCK_SIZE_M": 64,
        "BLOCK_SIZE_N": 16,
        "BLOCK_SIZE_K": 512,
        "GROUP_SIZE_M": 8,
        "num_stages": 7,
        "num_warps": 32,
        "compile_time": 0.00548243522644043
    },
    {
        "BLOCK_SIZE_M": 64,
        "BLOCK_SIZE_N": 16,
        "BLOCK_SIZE_K": 512,
        "GROUP_SIZE_M": 8,
        "num_stages": 8,
        "num_warps": 2,
        "compile_time": 12.588478803634644
    },
    {
        "BLOCK_SIZE_M": 64,
        "BLOCK_SIZE_N": 16,
        "BLOCK_SIZE_K": 512,
        "GROUP_SIZE_M": 8,
        "num_stages": 8,
        "num_warps": 4,
        "compile_time": 2.9457449913024902
    },
    {
        "BLOCK_SIZE_M": 64,
        "BLOCK_SIZE_N": 16,
        "BLOCK_SIZE_K": 512,
        "GROUP_SIZE_M": 8,
        "num_stages": 8,
        "num_warps": 8,
        "compile_time": 1.5240464210510254
    },
    {
        "BLOCK_SIZE_M": 64,
        "BLOCK_SIZE_N": 16,
        "BLOCK_SIZE_K": 512,
        "GROUP_SIZE_M": 8,
        "num_stages": 8,
        "num_warps": 16,
        "compile_time": 0.9996569156646729
    },
    {
        "BLOCK_SIZE_M": 64,
        "BLOCK_SIZE_N": 16,
        "BLOCK_SIZE_K": 512,
        "GROUP_SIZE_M": 8,
        "num_stages": 8,
        "num_warps": 32,
        "compile_time": 0.8214569091796875
    },
    {
        "BLOCK_SIZE_M": 64,
        "BLOCK_SIZE_N": 32,
        "BLOCK_SIZE_K": 128,
        "GROUP_SIZE_M": 8,
        "num_stages": 8,
        "num_warps": 2,
        "compile_time": 1.6442992687225342
    },
    {
        "BLOCK_SIZE_M": 64,
        "BLOCK_SIZE_N": 32,
        "BLOCK_SIZE_K": 128,
        "GROUP_SIZE_M": 8,
        "num_stages": 8,
        "num_warps": 4,
        "compile_time": 0.9881250858306885
    },
    {
        "BLOCK_SIZE_M": 64,
        "BLOCK_SIZE_N": 32,
        "BLOCK_SIZE_K": 128,
        "GROUP_SIZE_M": 8,
        "num_stages": 8,
        "num_warps": 8,
        "compile_time": 0.6820125579833984
    },
    {
        "BLOCK_SIZE_M": 64,
        "BLOCK_SIZE_N": 32,
        "BLOCK_SIZE_K": 128,
        "GROUP_SIZE_M": 8,
        "num_stages": 8,
        "num_warps": 16,
        "compile_time": 0.5457236766815186
    },
    {
        "BLOCK_SIZE_M": 64,
        "BLOCK_SIZE_N": 32,
        "BLOCK_SIZE_K": 128,
        "GROUP_SIZE_M": 8,
        "num_stages": 8,
        "num_warps": 32,
        "compile_time": 0.5063648223876953
    },
    {
        "BLOCK_SIZE_M": 64,
        "BLOCK_SIZE_N": 32,
        "BLOCK_SIZE_K": 256,
        "GROUP_SIZE_M": 8,
        "num_stages": 5,
        "num_warps": 2,
        "compile_time": 2.919825553894043
    },
    {
        "BLOCK_SIZE_M": 64,
        "BLOCK_SIZE_N": 32,
        "BLOCK_SIZE_K": 256,
        "GROUP_SIZE_M": 8,
        "num_stages": 5,
        "num_warps": 4,
        "compile_time": 1.322671890258789
    },
    {
        "BLOCK_SIZE_M": 64,
        "BLOCK_SIZE_N": 32,
        "BLOCK_SIZE_K": 256,
        "GROUP_SIZE_M": 8,
        "num_stages": 5,
        "num_warps": 8,
        "compile_time": 0.8577544689178467
    },
    {
        "BLOCK_SIZE_M": 64,
        "BLOCK_SIZE_N": 32,
        "BLOCK_SIZE_K": 256,
        "GROUP_SIZE_M": 8,
        "num_stages": 5,
        "num_warps": 16,
        "compile_time": 0.6622962951660156
    },
    {
        "BLOCK_SIZE_M": 64,
        "BLOCK_SIZE_N": 32,
        "BLOCK_SIZE_K": 256,
        "GROUP_SIZE_M": 8,
        "num_stages": 5,
        "num_warps": 32,
        "compile_time": 0.5734021663665771
    },
    {
        "BLOCK_SIZE_M": 64,
        "BLOCK_SIZE_N": 32,
        "BLOCK_SIZE_K": 256,
        "GROUP_SIZE_M": 8,
        "num_stages": 6,
        "num_warps": 2,
        "compile_time": 3.1974074840545654
    },
    {
        "BLOCK_SIZE_M": 64,
        "BLOCK_SIZE_N": 32,
        "BLOCK_SIZE_K": 256,
        "GROUP_SIZE_M": 8,
        "num_stages": 6,
        "num_warps": 4,
        "compile_time": 1.452578067779541
    },
    {
        "BLOCK_SIZE_M": 64,
        "BLOCK_SIZE_N": 32,
        "BLOCK_SIZE_K": 256,
        "GROUP_SIZE_M": 8,
        "num_stages": 6,
        "num_warps": 8,
        "compile_time": 0.9440484046936035
    },
    {
        "BLOCK_SIZE_M": 64,
        "BLOCK_SIZE_N": 32,
        "BLOCK_SIZE_K": 256,
        "GROUP_SIZE_M": 8,
        "num_stages": 6,
        "num_warps": 16,
        "compile_time": 0.6668543815612793
    },
    {
        "BLOCK_SIZE_M": 64,
        "BLOCK_SIZE_N": 32,
        "BLOCK_SIZE_K": 256,
        "GROUP_SIZE_M": 8,
        "num_stages": 6,
        "num_warps": 32,
        "compile_time": 0.5845291614532471
    },
    {
        "BLOCK_SIZE_M": 64,
        "BLOCK_SIZE_N": 32,
        "BLOCK_SIZE_K": 256,
        "GROUP_SIZE_M": 8,
        "num_stages": 7,
        "num_warps": 2,
        "compile_time": 3.263226270675659
    },
    {
        "BLOCK_SIZE_M": 64,
        "BLOCK_SIZE_N": 32,
        "BLOCK_SIZE_K": 256,
        "GROUP_SIZE_M": 8,
        "num_stages": 7,
        "num_warps": 4,
        "compile_time": 1.5114078521728516
    },
    {
        "BLOCK_SIZE_M": 64,
        "BLOCK_SIZE_N": 32,
        "BLOCK_SIZE_K": 256,
        "GROUP_SIZE_M": 8,
        "num_stages": 7,
        "num_warps": 8,
        "compile_time": 0.9293832778930664
    },
    {
        "BLOCK_SIZE_M": 64,
        "BLOCK_SIZE_N": 32,
        "BLOCK_SIZE_K": 256,
        "GROUP_SIZE_M": 8,
        "num_stages": 7,
        "num_warps": 16,
        "compile_time": 0.6871459484100342
    },
    {
        "BLOCK_SIZE_M": 64,
        "BLOCK_SIZE_N": 32,
        "BLOCK_SIZE_K": 256,
        "GROUP_SIZE_M": 8,
        "num_stages": 7,
        "num_warps": 32,
        "compile_time": 0.5742754936218262
    },
    {
        "BLOCK_SIZE_M": 64,
        "BLOCK_SIZE_N": 32,
        "BLOCK_SIZE_K": 256,
        "GROUP_SIZE_M": 8,
        "num_stages": 8,
        "num_warps": 2,
        "compile_time": 3.344022512435913
    },
    {
        "BLOCK_SIZE_M": 64,
        "BLOCK_SIZE_N": 32,
        "BLOCK_SIZE_K": 256,
        "GROUP_SIZE_M": 8,
        "num_stages": 8,
        "num_warps": 4,
        "compile_time": 1.5792524814605713
    },
    {
        "BLOCK_SIZE_M": 64,
        "BLOCK_SIZE_N": 32,
        "BLOCK_SIZE_K": 256,
        "GROUP_SIZE_M": 8,
        "num_stages": 8,
        "num_warps": 8,
        "compile_time": 0.9892611503601074
    },
    {
        "BLOCK_SIZE_M": 64,
        "BLOCK_SIZE_N": 32,
        "BLOCK_SIZE_K": 256,
        "GROUP_SIZE_M": 8,
        "num_stages": 8,
        "num_warps": 16,
        "compile_time": 0.7336339950561523
    },
    {
        "BLOCK_SIZE_M": 64,
        "BLOCK_SIZE_N": 32,
        "BLOCK_SIZE_K": 256,
        "GROUP_SIZE_M": 8,
        "num_stages": 8,
        "num_warps": 32,
        "compile_time": 0.5817275047302246
    },
    {
        "BLOCK_SIZE_M": 64,
        "BLOCK_SIZE_N": 32,
        "BLOCK_SIZE_K": 512,
        "GROUP_SIZE_M": 8,
        "num_stages": 3,
        "num_warps": 2,
        "compile_time": 15.185621976852417
    },
    {
        "BLOCK_SIZE_M": 64,
        "BLOCK_SIZE_N": 32,
        "BLOCK_SIZE_K": 512,
        "GROUP_SIZE_M": 8,
        "num_stages": 3,
        "num_warps": 4,
        "compile_time": 2.652404546737671
    },
    {
        "BLOCK_SIZE_M": 64,
        "BLOCK_SIZE_N": 32,
        "BLOCK_SIZE_K": 512,
        "GROUP_SIZE_M": 8,
        "num_stages": 3,
        "num_warps": 8,
        "compile_time": 0.005573272705078125
    },
    {
        "BLOCK_SIZE_M": 64,
        "BLOCK_SIZE_N": 32,
        "BLOCK_SIZE_K": 512,
        "GROUP_SIZE_M": 8,
        "num_stages": 3,
        "num_warps": 16,
        "compile_time": 0.0032358169555664062
    },
    {
        "BLOCK_SIZE_M": 64,
        "BLOCK_SIZE_N": 32,
        "BLOCK_SIZE_K": 512,
        "GROUP_SIZE_M": 8,
        "num_stages": 3,
        "num_warps": 32,
        "compile_time": 0.70847487449646
    },
    {
        "BLOCK_SIZE_M": 64,
        "BLOCK_SIZE_N": 32,
        "BLOCK_SIZE_K": 512,
        "GROUP_SIZE_M": 8,
        "num_stages": 4,
        "num_warps": 2,
        "compile_time": 14.465602159500122
    },
    {
        "BLOCK_SIZE_M": 64,
        "BLOCK_SIZE_N": 32,
        "BLOCK_SIZE_K": 512,
        "GROUP_SIZE_M": 8,
        "num_stages": 4,
        "num_warps": 4,
        "compile_time": 2.8516411781311035
    },
    {
        "BLOCK_SIZE_M": 64,
        "BLOCK_SIZE_N": 32,
        "BLOCK_SIZE_K": 512,
        "GROUP_SIZE_M": 8,
        "num_stages": 4,
        "num_warps": 8,
        "compile_time": 0.005609989166259766
    },
    {
        "BLOCK_SIZE_M": 64,
        "BLOCK_SIZE_N": 32,
        "BLOCK_SIZE_K": 512,
        "GROUP_SIZE_M": 8,
        "num_stages": 4,
        "num_warps": 16,
        "compile_time": 0.888009786605835
    },
    {
        "BLOCK_SIZE_M": 64,
        "BLOCK_SIZE_N": 32,
        "BLOCK_SIZE_K": 512,
        "GROUP_SIZE_M": 8,
        "num_stages": 4,
        "num_warps": 32,
        "compile_time": 0.7411396503448486
    },
    {
        "BLOCK_SIZE_M": 64,
        "BLOCK_SIZE_N": 32,
        "BLOCK_SIZE_K": 512,
        "GROUP_SIZE_M": 8,
        "num_stages": 5,
        "num_warps": 2,
        "compile_time": 15.930733680725098
    },
    {
        "BLOCK_SIZE_M": 64,
        "BLOCK_SIZE_N": 32,
        "BLOCK_SIZE_K": 512,
        "GROUP_SIZE_M": 8,
        "num_stages": 5,
        "num_warps": 4,
        "compile_time": 3.0402755737304688
    },
    {
        "BLOCK_SIZE_M": 64,
        "BLOCK_SIZE_N": 32,
        "BLOCK_SIZE_K": 512,
        "GROUP_SIZE_M": 8,
        "num_stages": 5,
        "num_warps": 8,
        "compile_time": 0.004003047943115234
    },
    {
        "BLOCK_SIZE_M": 64,
        "BLOCK_SIZE_N": 32,
        "BLOCK_SIZE_K": 512,
        "GROUP_SIZE_M": 8,
        "num_stages": 5,
        "num_warps": 16,
        "compile_time": 0.004713773727416992
    },
    {
        "BLOCK_SIZE_M": 64,
        "BLOCK_SIZE_N": 32,
        "BLOCK_SIZE_K": 512,
        "GROUP_SIZE_M": 8,
        "num_stages": 5,
        "num_warps": 32,
        "compile_time": 0.766880989074707
    },
    {
        "BLOCK_SIZE_M": 64,
        "BLOCK_SIZE_N": 32,
        "BLOCK_SIZE_K": 512,
        "GROUP_SIZE_M": 8,
        "num_stages": 6,
        "num_warps": 2,
        "compile_time": 14.766032218933105
    },
    {
        "BLOCK_SIZE_M": 64,
        "BLOCK_SIZE_N": 32,
        "BLOCK_SIZE_K": 512,
        "GROUP_SIZE_M": 8,
        "num_stages": 6,
        "num_warps": 4,
        "compile_time": 3.1910107135772705
    },
    {
        "BLOCK_SIZE_M": 64,
        "BLOCK_SIZE_N": 32,
        "BLOCK_SIZE_K": 512,
        "GROUP_SIZE_M": 8,
        "num_stages": 6,
        "num_warps": 8,
        "compile_time": 0.0052225589752197266
    },
    {
        "BLOCK_SIZE_M": 64,
        "BLOCK_SIZE_N": 32,
        "BLOCK_SIZE_K": 512,
        "GROUP_SIZE_M": 8,
        "num_stages": 6,
        "num_warps": 16,
        "compile_time": 0.9902560710906982
    },
    {
        "BLOCK_SIZE_M": 64,
        "BLOCK_SIZE_N": 32,
        "BLOCK_SIZE_K": 512,
        "GROUP_SIZE_M": 8,
        "num_stages": 6,
        "num_warps": 32,
        "compile_time": 0.7874405384063721
    },
    {
        "BLOCK_SIZE_M": 64,
        "BLOCK_SIZE_N": 32,
        "BLOCK_SIZE_K": 512,
        "GROUP_SIZE_M": 8,
        "num_stages": 7,
        "num_warps": 2,
        "compile_time": 15.007444620132446
    },
    {
        "BLOCK_SIZE_M": 64,
        "BLOCK_SIZE_N": 32,
        "BLOCK_SIZE_K": 512,
        "GROUP_SIZE_M": 8,
        "num_stages": 7,
        "num_warps": 4,
        "compile_time": 3.408663272857666
    },
    {
        "BLOCK_SIZE_M": 64,
        "BLOCK_SIZE_N": 32,
        "BLOCK_SIZE_K": 512,
        "GROUP_SIZE_M": 8,
        "num_stages": 7,
        "num_warps": 8,
        "compile_time": 1.6153907775878906
    },
    {
        "BLOCK_SIZE_M": 64,
        "BLOCK_SIZE_N": 32,
        "BLOCK_SIZE_K": 512,
        "GROUP_SIZE_M": 8,
        "num_stages": 7,
        "num_warps": 16,
        "compile_time": 0.004235267639160156
    },
    {
        "BLOCK_SIZE_M": 64,
        "BLOCK_SIZE_N": 32,
        "BLOCK_SIZE_K": 512,
        "GROUP_SIZE_M": 8,
        "num_stages": 7,
        "num_warps": 32,
        "compile_time": 0.8339369297027588
    },
    {
        "BLOCK_SIZE_M": 64,
        "BLOCK_SIZE_N": 32,
        "BLOCK_SIZE_K": 512,
        "GROUP_SIZE_M": 8,
        "num_stages": 8,
        "num_warps": 2,
        "compile_time": 15.35938549041748
    },
    {
        "BLOCK_SIZE_M": 64,
        "BLOCK_SIZE_N": 32,
        "BLOCK_SIZE_K": 512,
        "GROUP_SIZE_M": 8,
        "num_stages": 8,
        "num_warps": 4,
        "compile_time": 3.599137306213379
    },
    {
        "BLOCK_SIZE_M": 64,
        "BLOCK_SIZE_N": 32,
        "BLOCK_SIZE_K": 512,
        "GROUP_SIZE_M": 8,
        "num_stages": 8,
        "num_warps": 8,
        "compile_time": 0.005755186080932617
    },
    {
        "BLOCK_SIZE_M": 64,
        "BLOCK_SIZE_N": 32,
        "BLOCK_SIZE_K": 512,
        "GROUP_SIZE_M": 8,
        "num_stages": 8,
        "num_warps": 16,
        "compile_time": 1.111849308013916
    },
    {
        "BLOCK_SIZE_M": 64,
        "BLOCK_SIZE_N": 32,
        "BLOCK_SIZE_K": 512,
        "GROUP_SIZE_M": 8,
        "num_stages": 8,
        "num_warps": 32,
        "compile_time": 0.8614976406097412
    },
    {
        "BLOCK_SIZE_M": 64,
        "BLOCK_SIZE_N": 64,
        "BLOCK_SIZE_K": 128,
        "GROUP_SIZE_M": 8,
        "num_stages": 7,
        "num_warps": 2,
        "compile_time": 2.01745343208313
    },
    {
        "BLOCK_SIZE_M": 64,
        "BLOCK_SIZE_N": 64,
        "BLOCK_SIZE_K": 128,
        "GROUP_SIZE_M": 8,
        "num_stages": 7,
        "num_warps": 4,
        "compile_time": 1.1469886302947998
    },
    {
        "BLOCK_SIZE_M": 64,
        "BLOCK_SIZE_N": 64,
        "BLOCK_SIZE_K": 128,
        "GROUP_SIZE_M": 8,
        "num_stages": 7,
        "num_warps": 8,
        "compile_time": 0.7905516624450684
    },
    {
        "BLOCK_SIZE_M": 64,
        "BLOCK_SIZE_N": 64,
        "BLOCK_SIZE_K": 128,
        "GROUP_SIZE_M": 8,
        "num_stages": 7,
        "num_warps": 16,
        "compile_time": 0.5790235996246338
    },
    {
        "BLOCK_SIZE_M": 64,
        "BLOCK_SIZE_N": 64,
        "BLOCK_SIZE_K": 128,
        "GROUP_SIZE_M": 8,
        "num_stages": 7,
        "num_warps": 32,
        "compile_time": 0.00548243522644043
    },
    {
        "BLOCK_SIZE_M": 64,
        "BLOCK_SIZE_N": 64,
        "BLOCK_SIZE_K": 128,
        "GROUP_SIZE_M": 8,
        "num_stages": 8,
        "num_warps": 2,
        "compile_time": 2.112319231033325
    },
    {
        "BLOCK_SIZE_M": 64,
        "BLOCK_SIZE_N": 64,
        "BLOCK_SIZE_K": 128,
        "GROUP_SIZE_M": 8,
        "num_stages": 8,
        "num_warps": 4,
        "compile_time": 1.2162418365478516
    },
    {
        "BLOCK_SIZE_M": 64,
        "BLOCK_SIZE_N": 64,
        "BLOCK_SIZE_K": 128,
        "GROUP_SIZE_M": 8,
        "num_stages": 8,
        "num_warps": 8,
        "compile_time": 0.8224127292633057
    },
    {
        "BLOCK_SIZE_M": 64,
        "BLOCK_SIZE_N": 64,
        "BLOCK_SIZE_K": 128,
        "GROUP_SIZE_M": 8,
        "num_stages": 8,
        "num_warps": 16,
        "compile_time": 0.601783275604248
    },
    {
        "BLOCK_SIZE_M": 64,
        "BLOCK_SIZE_N": 64,
        "BLOCK_SIZE_K": 128,
        "GROUP_SIZE_M": 8,
        "num_stages": 8,
        "num_warps": 32,
        "compile_time": 0.5051853656768799
    },
    {
        "BLOCK_SIZE_M": 64,
        "BLOCK_SIZE_N": 64,
        "BLOCK_SIZE_K": 256,
        "GROUP_SIZE_M": 8,
        "num_stages": 4,
        "num_warps": 2,
        "compile_time": 4.090780019760132
    },
    {
        "BLOCK_SIZE_M": 64,
        "BLOCK_SIZE_N": 64,
        "BLOCK_SIZE_K": 256,
        "GROUP_SIZE_M": 8,
        "num_stages": 4,
        "num_warps": 4,
        "compile_time": 1.6137721538543701
    },
    {
        "BLOCK_SIZE_M": 64,
        "BLOCK_SIZE_N": 64,
        "BLOCK_SIZE_K": 256,
        "GROUP_SIZE_M": 8,
        "num_stages": 4,
        "num_warps": 8,
        "compile_time": 0.9694418907165527
    },
    {
        "BLOCK_SIZE_M": 64,
        "BLOCK_SIZE_N": 64,
        "BLOCK_SIZE_K": 256,
        "GROUP_SIZE_M": 8,
        "num_stages": 4,
        "num_warps": 16,
        "compile_time": 0.696850061416626
    },
    {
        "BLOCK_SIZE_M": 64,
        "BLOCK_SIZE_N": 64,
        "BLOCK_SIZE_K": 256,
        "GROUP_SIZE_M": 8,
        "num_stages": 4,
        "num_warps": 32,
        "compile_time": 0.5662038326263428
    },
    {
        "BLOCK_SIZE_M": 64,
        "BLOCK_SIZE_N": 64,
        "BLOCK_SIZE_K": 256,
        "GROUP_SIZE_M": 8,
        "num_stages": 5,
        "num_warps": 2,
        "compile_time": 4.328029155731201
    },
    {
        "BLOCK_SIZE_M": 64,
        "BLOCK_SIZE_N": 64,
        "BLOCK_SIZE_K": 256,
        "GROUP_SIZE_M": 8,
        "num_stages": 5,
        "num_warps": 4,
        "compile_time": 1.7222142219543457
    },
    {
        "BLOCK_SIZE_M": 64,
        "BLOCK_SIZE_N": 64,
        "BLOCK_SIZE_K": 256,
        "GROUP_SIZE_M": 8,
        "num_stages": 5,
        "num_warps": 8,
        "compile_time": 1.0537071228027344
    },
    {
        "BLOCK_SIZE_M": 64,
        "BLOCK_SIZE_N": 64,
        "BLOCK_SIZE_K": 256,
        "GROUP_SIZE_M": 8,
        "num_stages": 5,
        "num_warps": 16,
        "compile_time": 0.7422969341278076
    },
    {
        "BLOCK_SIZE_M": 64,
        "BLOCK_SIZE_N": 64,
        "BLOCK_SIZE_K": 256,
        "GROUP_SIZE_M": 8,
        "num_stages": 5,
        "num_warps": 32,
        "compile_time": 0.5911481380462646
    },
    {
        "BLOCK_SIZE_M": 64,
        "BLOCK_SIZE_N": 64,
        "BLOCK_SIZE_K": 256,
        "GROUP_SIZE_M": 8,
        "num_stages": 6,
        "num_warps": 2,
        "compile_time": 4.608623266220093
    },
    {
        "BLOCK_SIZE_M": 64,
        "BLOCK_SIZE_N": 64,
        "BLOCK_SIZE_K": 256,
        "GROUP_SIZE_M": 8,
        "num_stages": 6,
        "num_warps": 4,
        "compile_time": 1.8877058029174805
    },
    {
        "BLOCK_SIZE_M": 64,
        "BLOCK_SIZE_N": 64,
        "BLOCK_SIZE_K": 256,
        "GROUP_SIZE_M": 8,
        "num_stages": 6,
        "num_warps": 8,
        "compile_time": 1.1167948246002197
    },
    {
        "BLOCK_SIZE_M": 64,
        "BLOCK_SIZE_N": 64,
        "BLOCK_SIZE_K": 256,
        "GROUP_SIZE_M": 8,
        "num_stages": 6,
        "num_warps": 16,
        "compile_time": 0.7744619846343994
    },
    {
        "BLOCK_SIZE_M": 64,
        "BLOCK_SIZE_N": 64,
        "BLOCK_SIZE_K": 256,
        "GROUP_SIZE_M": 8,
        "num_stages": 6,
        "num_warps": 32,
        "compile_time": 0.6110060214996338
    },
    {
        "BLOCK_SIZE_M": 64,
        "BLOCK_SIZE_N": 64,
        "BLOCK_SIZE_K": 256,
        "GROUP_SIZE_M": 8,
        "num_stages": 7,
        "num_warps": 2,
        "compile_time": 4.785419225692749
    },
    {
        "BLOCK_SIZE_M": 64,
        "BLOCK_SIZE_N": 64,
        "BLOCK_SIZE_K": 256,
        "GROUP_SIZE_M": 8,
        "num_stages": 7,
        "num_warps": 4,
        "compile_time": 1.9913272857666016
    },
    {
        "BLOCK_SIZE_M": 64,
        "BLOCK_SIZE_N": 64,
        "BLOCK_SIZE_K": 256,
        "GROUP_SIZE_M": 8,
        "num_stages": 7,
        "num_warps": 8,
        "compile_time": 1.1879496574401855
    },
    {
        "BLOCK_SIZE_M": 64,
        "BLOCK_SIZE_N": 64,
        "BLOCK_SIZE_K": 256,
        "GROUP_SIZE_M": 8,
        "num_stages": 7,
        "num_warps": 16,
        "compile_time": 0.8145856857299805
    },
    {
        "BLOCK_SIZE_M": 64,
        "BLOCK_SIZE_N": 64,
        "BLOCK_SIZE_K": 256,
        "GROUP_SIZE_M": 8,
        "num_stages": 7,
        "num_warps": 32,
        "compile_time": 0.005272626876831055
    },
    {
        "BLOCK_SIZE_M": 64,
        "BLOCK_SIZE_N": 64,
        "BLOCK_SIZE_K": 256,
        "GROUP_SIZE_M": 8,
        "num_stages": 8,
        "num_warps": 2,
        "compile_time": 5.108700513839722
    },
    {
        "BLOCK_SIZE_M": 64,
        "BLOCK_SIZE_N": 64,
        "BLOCK_SIZE_K": 256,
        "GROUP_SIZE_M": 8,
        "num_stages": 8,
        "num_warps": 4,
        "compile_time": 2.16084885597229
    },
    {
        "BLOCK_SIZE_M": 64,
        "BLOCK_SIZE_N": 64,
        "BLOCK_SIZE_K": 256,
        "GROUP_SIZE_M": 8,
        "num_stages": 8,
        "num_warps": 8,
        "compile_time": 1.2599527835845947
    },
    {
        "BLOCK_SIZE_M": 64,
        "BLOCK_SIZE_N": 64,
        "BLOCK_SIZE_K": 256,
        "GROUP_SIZE_M": 8,
        "num_stages": 8,
        "num_warps": 16,
        "compile_time": 0.9187324047088623
    },
    {
        "BLOCK_SIZE_M": 64,
        "BLOCK_SIZE_N": 64,
        "BLOCK_SIZE_K": 256,
        "GROUP_SIZE_M": 8,
        "num_stages": 8,
        "num_warps": 32,
        "compile_time": 0.6613419055938721
    },
    {
        "BLOCK_SIZE_M": 64,
        "BLOCK_SIZE_N": 64,
        "BLOCK_SIZE_K": 512,
        "GROUP_SIZE_M": 8,
        "num_stages": 1,
        "num_warps": 2,
        "compile_time": 6.001104116439819
    },
    {
        "BLOCK_SIZE_M": 64,
        "BLOCK_SIZE_N": 64,
        "BLOCK_SIZE_K": 512,
        "GROUP_SIZE_M": 8,
        "num_stages": 2,
        "num_warps": 2,
        "compile_time": 6.000999450683594
    },
    {
        "BLOCK_SIZE_M": 64,
        "BLOCK_SIZE_N": 64,
        "BLOCK_SIZE_K": 512,
        "GROUP_SIZE_M": 8,
        "num_stages": 3,
        "num_warps": 2,
        "compile_time": 27.91472840309143
    },
    {
        "BLOCK_SIZE_M": 64,
        "BLOCK_SIZE_N": 64,
        "BLOCK_SIZE_K": 512,
        "GROUP_SIZE_M": 8,
        "num_stages": 3,
        "num_warps": 4,
        "compile_time": 0.0058062076568603516
    },
    {
        "BLOCK_SIZE_M": 64,
        "BLOCK_SIZE_N": 64,
        "BLOCK_SIZE_K": 512,
        "GROUP_SIZE_M": 8,
        "num_stages": 3,
        "num_warps": 8,
        "compile_time": 1.552154541015625
    },
    {
        "BLOCK_SIZE_M": 64,
        "BLOCK_SIZE_N": 64,
        "BLOCK_SIZE_K": 512,
        "GROUP_SIZE_M": 8,
        "num_stages": 3,
        "num_warps": 16,
        "compile_time": 0.9754736423492432
    },
    {
        "BLOCK_SIZE_M": 64,
        "BLOCK_SIZE_N": 64,
        "BLOCK_SIZE_K": 512,
        "GROUP_SIZE_M": 8,
        "num_stages": 3,
        "num_warps": 32,
        "compile_time": 0.00527191162109375
    },
    {
        "BLOCK_SIZE_M": 64,
        "BLOCK_SIZE_N": 64,
        "BLOCK_SIZE_K": 512,
        "GROUP_SIZE_M": 8,
        "num_stages": 4,
        "num_warps": 2,
        "compile_time": 25.218043327331543
    },
    {
        "BLOCK_SIZE_M": 64,
        "BLOCK_SIZE_N": 64,
        "BLOCK_SIZE_K": 512,
        "GROUP_SIZE_M": 8,
        "num_stages": 4,
        "num_warps": 4,
        "compile_time": 4.189098596572876
    },
    {
        "BLOCK_SIZE_M": 64,
        "BLOCK_SIZE_N": 64,
        "BLOCK_SIZE_K": 512,
        "GROUP_SIZE_M": 8,
        "num_stages": 4,
        "num_warps": 8,
        "compile_time": 1.7169079780578613
    },
    {
        "BLOCK_SIZE_M": 64,
        "BLOCK_SIZE_N": 64,
        "BLOCK_SIZE_K": 512,
        "GROUP_SIZE_M": 8,
        "num_stages": 4,
        "num_warps": 16,
        "compile_time": 0.004839420318603516
    },
    {
        "BLOCK_SIZE_M": 64,
        "BLOCK_SIZE_N": 64,
        "BLOCK_SIZE_K": 512,
        "GROUP_SIZE_M": 8,
        "num_stages": 4,
        "num_warps": 32,
        "compile_time": 0.7888059616088867
    },
    {
        "BLOCK_SIZE_M": 64,
        "BLOCK_SIZE_N": 64,
        "BLOCK_SIZE_K": 512,
        "GROUP_SIZE_M": 8,
        "num_stages": 5,
        "num_warps": 2,
        "compile_time": 25.84552836418152
    },
    {
        "BLOCK_SIZE_M": 64,
        "BLOCK_SIZE_N": 64,
        "BLOCK_SIZE_K": 512,
        "GROUP_SIZE_M": 8,
        "num_stages": 5,
        "num_warps": 4,
        "compile_time": 4.467983245849609
    },
    {
        "BLOCK_SIZE_M": 64,
        "BLOCK_SIZE_N": 64,
        "BLOCK_SIZE_K": 512,
        "GROUP_SIZE_M": 8,
        "num_stages": 5,
        "num_warps": 8,
        "compile_time": 0.009062767028808594
    },
    {
        "BLOCK_SIZE_M": 64,
        "BLOCK_SIZE_N": 64,
        "BLOCK_SIZE_K": 512,
        "GROUP_SIZE_M": 8,
        "num_stages": 5,
        "num_warps": 16,
        "compile_time": 1.1118836402893066
    },
    {
        "BLOCK_SIZE_M": 64,
        "BLOCK_SIZE_N": 64,
        "BLOCK_SIZE_K": 512,
        "GROUP_SIZE_M": 8,
        "num_stages": 5,
        "num_warps": 32,
        "compile_time": 0.869020938873291
    },
    {
        "BLOCK_SIZE_M": 64,
        "BLOCK_SIZE_N": 64,
        "BLOCK_SIZE_K": 512,
        "GROUP_SIZE_M": 8,
        "num_stages": 6,
        "num_warps": 2,
        "compile_time": 26.0214786529541
    },
    {
        "BLOCK_SIZE_M": 64,
        "BLOCK_SIZE_N": 64,
        "BLOCK_SIZE_K": 512,
        "GROUP_SIZE_M": 8,
        "num_stages": 6,
        "num_warps": 4,
        "compile_time": 4.708722352981567
    },
    {
        "BLOCK_SIZE_M": 64,
        "BLOCK_SIZE_N": 64,
        "BLOCK_SIZE_K": 512,
        "GROUP_SIZE_M": 8,
        "num_stages": 6,
        "num_warps": 8,
        "compile_time": 0.005750894546508789
    },
    {
        "BLOCK_SIZE_M": 64,
        "BLOCK_SIZE_N": 64,
        "BLOCK_SIZE_K": 512,
        "GROUP_SIZE_M": 8,
        "num_stages": 6,
        "num_warps": 16,
        "compile_time": 1.200629711151123
    },
    {
        "BLOCK_SIZE_M": 64,
        "BLOCK_SIZE_N": 64,
        "BLOCK_SIZE_K": 512,
        "GROUP_SIZE_M": 8,
        "num_stages": 6,
        "num_warps": 32,
        "compile_time": 0.8886158466339111
    },
    {
        "BLOCK_SIZE_M": 64,
        "BLOCK_SIZE_N": 64,
        "BLOCK_SIZE_K": 512,
        "GROUP_SIZE_M": 8,
        "num_stages": 7,
        "num_warps": 2,
        "compile_time": 27.09691548347473
    },
    {
        "BLOCK_SIZE_M": 64,
        "BLOCK_SIZE_N": 64,
        "BLOCK_SIZE_K": 512,
        "GROUP_SIZE_M": 8,
        "num_stages": 7,
        "num_warps": 4,
        "compile_time": 4.977733850479126
    },
    {
        "BLOCK_SIZE_M": 64,
        "BLOCK_SIZE_N": 64,
        "BLOCK_SIZE_K": 512,
        "GROUP_SIZE_M": 8,
        "num_stages": 7,
        "num_warps": 8,
        "compile_time": 0.004309415817260742
    },
    {
        "BLOCK_SIZE_M": 64,
        "BLOCK_SIZE_N": 64,
        "BLOCK_SIZE_K": 512,
        "GROUP_SIZE_M": 8,
        "num_stages": 7,
        "num_warps": 16,
        "compile_time": 1.2768981456756592
    },
    {
        "BLOCK_SIZE_M": 64,
        "BLOCK_SIZE_N": 64,
        "BLOCK_SIZE_K": 512,
        "GROUP_SIZE_M": 8,
        "num_stages": 7,
        "num_warps": 32,
        "compile_time": 0.9123251438140869
    },
    {
        "BLOCK_SIZE_M": 64,
        "BLOCK_SIZE_N": 64,
        "BLOCK_SIZE_K": 512,
        "GROUP_SIZE_M": 8,
        "num_stages": 8,
        "num_warps": 2,
        "compile_time": 26.88066840171814
    },
    {
        "BLOCK_SIZE_M": 64,
        "BLOCK_SIZE_N": 64,
        "BLOCK_SIZE_K": 512,
        "GROUP_SIZE_M": 8,
        "num_stages": 8,
        "num_warps": 4,
        "compile_time": 5.224685192108154
    },
    {
        "BLOCK_SIZE_M": 64,
        "BLOCK_SIZE_N": 64,
        "BLOCK_SIZE_K": 512,
        "GROUP_SIZE_M": 8,
        "num_stages": 8,
        "num_warps": 8,
        "compile_time": 0.006193876266479492
    },
    {
        "BLOCK_SIZE_M": 64,
        "BLOCK_SIZE_N": 64,
        "BLOCK_SIZE_K": 512,
        "GROUP_SIZE_M": 8,
        "num_stages": 8,
        "num_warps": 16,
        "compile_time": 1.3648200035095215
    },
    {
        "BLOCK_SIZE_M": 64,
        "BLOCK_SIZE_N": 64,
        "BLOCK_SIZE_K": 512,
        "GROUP_SIZE_M": 8,
        "num_stages": 8,
        "num_warps": 32,
        "compile_time": 1.0254287719726562
    },
    {
        "BLOCK_SIZE_M": 64,
        "BLOCK_SIZE_N": 128,
        "BLOCK_SIZE_K": 64,
        "GROUP_SIZE_M": 8,
        "num_stages": 8,
        "num_warps": 2,
        "compile_time": 1.9928948879241943
    },
    {
        "BLOCK_SIZE_M": 64,
        "BLOCK_SIZE_N": 128,
        "BLOCK_SIZE_K": 64,
        "GROUP_SIZE_M": 8,
        "num_stages": 8,
        "num_warps": 4,
        "compile_time": 1.1318237781524658
    },
    {
        "BLOCK_SIZE_M": 64,
        "BLOCK_SIZE_N": 128,
        "BLOCK_SIZE_K": 64,
        "GROUP_SIZE_M": 8,
        "num_stages": 8,
        "num_warps": 8,
        "compile_time": 0.754284143447876
    },
    {
        "BLOCK_SIZE_M": 64,
        "BLOCK_SIZE_N": 128,
        "BLOCK_SIZE_K": 64,
        "GROUP_SIZE_M": 8,
        "num_stages": 8,
        "num_warps": 16,
        "compile_time": 0.5596344470977783
    },
    {
        "BLOCK_SIZE_M": 64,
        "BLOCK_SIZE_N": 128,
        "BLOCK_SIZE_K": 64,
        "GROUP_SIZE_M": 8,
        "num_stages": 8,
        "num_warps": 32,
        "compile_time": 0.493821382522583
    },
    {
        "BLOCK_SIZE_M": 64,
        "BLOCK_SIZE_N": 128,
        "BLOCK_SIZE_K": 128,
        "GROUP_SIZE_M": 8,
        "num_stages": 5,
        "num_warps": 2,
        "compile_time": 3.328202247619629
    },
    {
        "BLOCK_SIZE_M": 64,
        "BLOCK_SIZE_N": 128,
        "BLOCK_SIZE_K": 128,
        "GROUP_SIZE_M": 8,
        "num_stages": 5,
        "num_warps": 4,
        "compile_time": 1.4683506488800049
    },
    {
        "BLOCK_SIZE_M": 64,
        "BLOCK_SIZE_N": 128,
        "BLOCK_SIZE_K": 128,
        "GROUP_SIZE_M": 8,
        "num_stages": 5,
        "num_warps": 8,
        "compile_time": 0.9342308044433594
    },
    {
        "BLOCK_SIZE_M": 64,
        "BLOCK_SIZE_N": 128,
        "BLOCK_SIZE_K": 128,
        "GROUP_SIZE_M": 8,
        "num_stages": 5,
        "num_warps": 16,
        "compile_time": 0.6687417030334473
    },
    {
        "BLOCK_SIZE_M": 64,
        "BLOCK_SIZE_N": 128,
        "BLOCK_SIZE_K": 128,
        "GROUP_SIZE_M": 8,
        "num_stages": 5,
        "num_warps": 32,
        "compile_time": 0.5202319622039795
    },
    {
        "BLOCK_SIZE_M": 64,
        "BLOCK_SIZE_N": 128,
        "BLOCK_SIZE_K": 128,
        "GROUP_SIZE_M": 8,
        "num_stages": 6,
        "num_warps": 2,
        "compile_time": 3.50870943069458
    },
    {
        "BLOCK_SIZE_M": 64,
        "BLOCK_SIZE_N": 128,
        "BLOCK_SIZE_K": 128,
        "GROUP_SIZE_M": 8,
        "num_stages": 6,
        "num_warps": 4,
        "compile_time": 1.5807170867919922
    },
    {
        "BLOCK_SIZE_M": 64,
        "BLOCK_SIZE_N": 128,
        "BLOCK_SIZE_K": 128,
        "GROUP_SIZE_M": 8,
        "num_stages": 6,
        "num_warps": 8,
        "compile_time": 0.9893271923065186
    },
    {
        "BLOCK_SIZE_M": 64,
        "BLOCK_SIZE_N": 128,
        "BLOCK_SIZE_K": 128,
        "GROUP_SIZE_M": 8,
        "num_stages": 6,
        "num_warps": 16,
        "compile_time": 0.6927323341369629
    },
    {
        "BLOCK_SIZE_M": 64,
        "BLOCK_SIZE_N": 128,
        "BLOCK_SIZE_K": 128,
        "GROUP_SIZE_M": 8,
        "num_stages": 6,
        "num_warps": 32,
        "compile_time": 0.004601001739501953
    },
    {
        "BLOCK_SIZE_M": 64,
        "BLOCK_SIZE_N": 128,
        "BLOCK_SIZE_K": 128,
        "GROUP_SIZE_M": 8,
        "num_stages": 7,
        "num_warps": 2,
        "compile_time": 3.7080001831054688
    },
    {
        "BLOCK_SIZE_M": 64,
        "BLOCK_SIZE_N": 128,
        "BLOCK_SIZE_K": 128,
        "GROUP_SIZE_M": 8,
        "num_stages": 7,
        "num_warps": 4,
        "compile_time": 1.7162888050079346
    },
    {
        "BLOCK_SIZE_M": 64,
        "BLOCK_SIZE_N": 128,
        "BLOCK_SIZE_K": 128,
        "GROUP_SIZE_M": 8,
        "num_stages": 7,
        "num_warps": 8,
        "compile_time": 1.058734655380249
    },
    {
        "BLOCK_SIZE_M": 64,
        "BLOCK_SIZE_N": 128,
        "BLOCK_SIZE_K": 128,
        "GROUP_SIZE_M": 8,
        "num_stages": 7,
        "num_warps": 16,
        "compile_time": 0.7431082725524902
    },
    {
        "BLOCK_SIZE_M": 64,
        "BLOCK_SIZE_N": 128,
        "BLOCK_SIZE_K": 128,
        "GROUP_SIZE_M": 8,
        "num_stages": 7,
        "num_warps": 32,
        "compile_time": 0.5570039749145508
    },
    {
        "BLOCK_SIZE_M": 64,
        "BLOCK_SIZE_N": 128,
        "BLOCK_SIZE_K": 128,
        "GROUP_SIZE_M": 8,
        "num_stages": 8,
        "num_warps": 2,
        "compile_time": 3.888718366622925
    },
    {
        "BLOCK_SIZE_M": 64,
        "BLOCK_SIZE_N": 128,
        "BLOCK_SIZE_K": 128,
        "GROUP_SIZE_M": 8,
        "num_stages": 8,
        "num_warps": 4,
        "compile_time": 1.7937533855438232
    },
    {
        "BLOCK_SIZE_M": 64,
        "BLOCK_SIZE_N": 128,
        "BLOCK_SIZE_K": 128,
        "GROUP_SIZE_M": 8,
        "num_stages": 8,
        "num_warps": 8,
        "compile_time": 1.1064426898956299
    },
    {
        "BLOCK_SIZE_M": 64,
        "BLOCK_SIZE_N": 128,
        "BLOCK_SIZE_K": 128,
        "GROUP_SIZE_M": 8,
        "num_stages": 8,
        "num_warps": 16,
        "compile_time": 0.7750148773193359
    },
    {
        "BLOCK_SIZE_M": 64,
        "BLOCK_SIZE_N": 128,
        "BLOCK_SIZE_K": 128,
        "GROUP_SIZE_M": 8,
        "num_stages": 8,
        "num_warps": 32,
        "compile_time": 0.004621267318725586
    },
    {
        "BLOCK_SIZE_M": 64,
        "BLOCK_SIZE_N": 128,
        "BLOCK_SIZE_K": 256,
        "GROUP_SIZE_M": 8,
        "num_stages": 2,
        "num_warps": 2,
        "compile_time": 6.012277126312256
    },
    {
        "BLOCK_SIZE_M": 64,
        "BLOCK_SIZE_N": 128,
        "BLOCK_SIZE_K": 256,
        "GROUP_SIZE_M": 8,
        "num_stages": 3,
        "num_warps": 2,
        "compile_time": 12.524950742721558
    },
    {
        "BLOCK_SIZE_M": 64,
        "BLOCK_SIZE_N": 128,
        "BLOCK_SIZE_K": 256,
        "GROUP_SIZE_M": 8,
        "num_stages": 3,
        "num_warps": 4,
        "compile_time": 2.772453784942627
    },
    {
        "BLOCK_SIZE_M": 64,
        "BLOCK_SIZE_N": 128,
        "BLOCK_SIZE_K": 256,
        "GROUP_SIZE_M": 8,
        "num_stages": 3,
        "num_warps": 8,
        "compile_time": 1.258948802947998
    },
    {
        "BLOCK_SIZE_M": 64,
        "BLOCK_SIZE_N": 128,
        "BLOCK_SIZE_K": 256,
        "GROUP_SIZE_M": 8,
        "num_stages": 3,
        "num_warps": 16,
        "compile_time": 0.8413076400756836
    },
    {
        "BLOCK_SIZE_M": 64,
        "BLOCK_SIZE_N": 128,
        "BLOCK_SIZE_K": 256,
        "GROUP_SIZE_M": 8,
        "num_stages": 3,
        "num_warps": 32,
        "compile_time": 0.6469855308532715
    },
    {
        "BLOCK_SIZE_M": 64,
        "BLOCK_SIZE_N": 128,
        "BLOCK_SIZE_K": 256,
        "GROUP_SIZE_M": 8,
        "num_stages": 4,
        "num_warps": 2,
        "compile_time": 13.515978813171387
    },
    {
        "BLOCK_SIZE_M": 64,
        "BLOCK_SIZE_N": 128,
        "BLOCK_SIZE_K": 256,
        "GROUP_SIZE_M": 8,
        "num_stages": 4,
        "num_warps": 4,
        "compile_time": 2.992363929748535
    },
    {
        "BLOCK_SIZE_M": 64,
        "BLOCK_SIZE_N": 128,
        "BLOCK_SIZE_K": 256,
        "GROUP_SIZE_M": 8,
        "num_stages": 4,
        "num_warps": 8,
        "compile_time": 1.354426622390747
    },
    {
        "BLOCK_SIZE_M": 64,
        "BLOCK_SIZE_N": 128,
        "BLOCK_SIZE_K": 256,
        "GROUP_SIZE_M": 8,
        "num_stages": 4,
        "num_warps": 16,
        "compile_time": 0.8997530937194824
    },
    {
        "BLOCK_SIZE_M": 64,
        "BLOCK_SIZE_N": 128,
        "BLOCK_SIZE_K": 256,
        "GROUP_SIZE_M": 8,
        "num_stages": 4,
        "num_warps": 32,
        "compile_time": 0.6782877445220947
    },
    {
        "BLOCK_SIZE_M": 64,
        "BLOCK_SIZE_N": 128,
        "BLOCK_SIZE_K": 256,
        "GROUP_SIZE_M": 8,
        "num_stages": 5,
        "num_warps": 2,
        "compile_time": 13.246997594833374
    },
    {
        "BLOCK_SIZE_M": 64,
        "BLOCK_SIZE_N": 128,
        "BLOCK_SIZE_K": 256,
        "GROUP_SIZE_M": 8,
        "num_stages": 5,
        "num_warps": 4,
        "compile_time": 3.2070207595825195
    },
    {
        "BLOCK_SIZE_M": 64,
        "BLOCK_SIZE_N": 128,
        "BLOCK_SIZE_K": 256,
        "GROUP_SIZE_M": 8,
        "num_stages": 5,
        "num_warps": 8,
        "compile_time": 1.4757616519927979
    },
    {
        "BLOCK_SIZE_M": 64,
        "BLOCK_SIZE_N": 128,
        "BLOCK_SIZE_K": 256,
        "GROUP_SIZE_M": 8,
        "num_stages": 5,
        "num_warps": 16,
        "compile_time": 0.9722051620483398
    },
    {
        "BLOCK_SIZE_M": 64,
        "BLOCK_SIZE_N": 128,
        "BLOCK_SIZE_K": 256,
        "GROUP_SIZE_M": 8,
        "num_stages": 5,
        "num_warps": 32,
        "compile_time": 0.7075650691986084
    },
    {
        "BLOCK_SIZE_M": 64,
        "BLOCK_SIZE_N": 128,
        "BLOCK_SIZE_K": 256,
        "GROUP_SIZE_M": 8,
        "num_stages": 6,
        "num_warps": 2,
        "compile_time": 13.489645004272461
    },
    {
        "BLOCK_SIZE_M": 64,
        "BLOCK_SIZE_N": 128,
        "BLOCK_SIZE_K": 256,
        "GROUP_SIZE_M": 8,
        "num_stages": 6,
        "num_warps": 4,
        "compile_time": 3.3755486011505127
    },
    {
        "BLOCK_SIZE_M": 64,
        "BLOCK_SIZE_N": 128,
        "BLOCK_SIZE_K": 256,
        "GROUP_SIZE_M": 8,
        "num_stages": 6,
        "num_warps": 8,
        "compile_time": 1.580136775970459
    },
    {
        "BLOCK_SIZE_M": 64,
        "BLOCK_SIZE_N": 128,
        "BLOCK_SIZE_K": 256,
        "GROUP_SIZE_M": 8,
        "num_stages": 6,
        "num_warps": 16,
        "compile_time": 1.015899896621704
    },
    {
        "BLOCK_SIZE_M": 64,
        "BLOCK_SIZE_N": 128,
        "BLOCK_SIZE_K": 256,
        "GROUP_SIZE_M": 8,
        "num_stages": 6,
        "num_warps": 32,
        "compile_time": 0.7462427616119385
    },
    {
        "BLOCK_SIZE_M": 64,
        "BLOCK_SIZE_N": 128,
        "BLOCK_SIZE_K": 256,
        "GROUP_SIZE_M": 8,
        "num_stages": 7,
        "num_warps": 2,
        "compile_time": 13.745314359664917
    },
    {
        "BLOCK_SIZE_M": 64,
        "BLOCK_SIZE_N": 128,
        "BLOCK_SIZE_K": 256,
        "GROUP_SIZE_M": 8,
        "num_stages": 7,
        "num_warps": 4,
        "compile_time": 3.6079890727996826
    },
    {
        "BLOCK_SIZE_M": 64,
        "BLOCK_SIZE_N": 128,
        "BLOCK_SIZE_K": 256,
        "GROUP_SIZE_M": 8,
        "num_stages": 7,
        "num_warps": 8,
        "compile_time": 1.7606751918792725
    },
    {
        "BLOCK_SIZE_M": 64,
        "BLOCK_SIZE_N": 128,
        "BLOCK_SIZE_K": 256,
        "GROUP_SIZE_M": 8,
        "num_stages": 7,
        "num_warps": 16,
        "compile_time": 1.084782361984253
    },
    {
        "BLOCK_SIZE_M": 64,
        "BLOCK_SIZE_N": 128,
        "BLOCK_SIZE_K": 256,
        "GROUP_SIZE_M": 8,
        "num_stages": 7,
        "num_warps": 32,
        "compile_time": 0.7901763916015625
    },
    {
        "BLOCK_SIZE_M": 64,
        "BLOCK_SIZE_N": 128,
        "BLOCK_SIZE_K": 256,
        "GROUP_SIZE_M": 8,
        "num_stages": 8,
        "num_warps": 2,
        "compile_time": 13.942232370376587
    },
    {
        "BLOCK_SIZE_M": 64,
        "BLOCK_SIZE_N": 128,
        "BLOCK_SIZE_K": 256,
        "GROUP_SIZE_M": 8,
        "num_stages": 8,
        "num_warps": 4,
        "compile_time": 3.830317497253418
    },
    {
        "BLOCK_SIZE_M": 64,
        "BLOCK_SIZE_N": 128,
        "BLOCK_SIZE_K": 256,
        "GROUP_SIZE_M": 8,
        "num_stages": 8,
        "num_warps": 8,
        "compile_time": 1.8545403480529785
    },
    {
        "BLOCK_SIZE_M": 64,
        "BLOCK_SIZE_N": 128,
        "BLOCK_SIZE_K": 256,
        "GROUP_SIZE_M": 8,
        "num_stages": 8,
        "num_warps": 16,
        "compile_time": 1.1696231365203857
    },
    {
        "BLOCK_SIZE_M": 64,
        "BLOCK_SIZE_N": 128,
        "BLOCK_SIZE_K": 256,
        "GROUP_SIZE_M": 8,
        "num_stages": 8,
        "num_warps": 32,
        "compile_time": 0.8285796642303467
    },
    {
        "BLOCK_SIZE_M": 64,
        "BLOCK_SIZE_N": 128,
        "BLOCK_SIZE_K": 512,
        "GROUP_SIZE_M": 8,
        "num_stages": 1,
        "num_warps": 2,
        "compile_time": 7.163574934005737
    },
    {
        "BLOCK_SIZE_M": 64,
        "BLOCK_SIZE_N": 128,
        "BLOCK_SIZE_K": 512,
        "GROUP_SIZE_M": 8,
        "num_stages": 1,
        "num_warps": 4,
        "compile_time": 4.544729232788086
    },
    {
        "BLOCK_SIZE_M": 64,
        "BLOCK_SIZE_N": 128,
        "BLOCK_SIZE_K": 512,
        "GROUP_SIZE_M": 8,
        "num_stages": 1,
        "num_warps": 8,
        "compile_time": 1.8433010578155518
    },
    {
        "BLOCK_SIZE_M": 64,
        "BLOCK_SIZE_N": 128,
        "BLOCK_SIZE_K": 512,
        "GROUP_SIZE_M": 8,
        "num_stages": 1,
        "num_warps": 16,
        "compile_time": 1.0511536598205566
    },
    {
        "BLOCK_SIZE_M": 64,
        "BLOCK_SIZE_N": 128,
        "BLOCK_SIZE_K": 512,
        "GROUP_SIZE_M": 8,
        "num_stages": 1,
        "num_warps": 32,
        "compile_time": 0.0047953128814697266
    },
    {
        "BLOCK_SIZE_M": 64,
        "BLOCK_SIZE_N": 128,
        "BLOCK_SIZE_K": 512,
        "GROUP_SIZE_M": 8,
        "num_stages": 2,
        "num_warps": 2,
        "compile_time": 7.323352336883545
    },
    {
        "BLOCK_SIZE_M": 64,
        "BLOCK_SIZE_N": 128,
        "BLOCK_SIZE_K": 512,
        "GROUP_SIZE_M": 8,
        "num_stages": 2,
        "num_warps": 4,
        "compile_time": 4.936461687088013
    },
    {
        "BLOCK_SIZE_M": 64,
        "BLOCK_SIZE_N": 128,
        "BLOCK_SIZE_K": 512,
        "GROUP_SIZE_M": 8,
        "num_stages": 2,
        "num_warps": 8,
        "compile_time": 2.041747570037842
    },
    {
        "BLOCK_SIZE_M": 64,
        "BLOCK_SIZE_N": 128,
        "BLOCK_SIZE_K": 512,
        "GROUP_SIZE_M": 8,
        "num_stages": 2,
        "num_warps": 16,
        "compile_time": 1.1880626678466797
    },
    {
        "BLOCK_SIZE_M": 64,
        "BLOCK_SIZE_N": 128,
        "BLOCK_SIZE_K": 512,
        "GROUP_SIZE_M": 8,
        "num_stages": 2,
        "num_warps": 32,
        "compile_time": 0.8208403587341309
    },
    {
        "BLOCK_SIZE_M": 64,
        "BLOCK_SIZE_N": 128,
        "BLOCK_SIZE_K": 512,
        "GROUP_SIZE_M": 8,
        "num_stages": 3,
        "num_warps": 2,
        "compile_time": 7.894170761108398
    },
    {
        "BLOCK_SIZE_M": 64,
        "BLOCK_SIZE_N": 128,
        "BLOCK_SIZE_K": 512,
        "GROUP_SIZE_M": 8,
        "num_stages": 3,
        "num_warps": 4,
        "compile_time": 12.84522032737732
    },
    {
        "BLOCK_SIZE_M": 64,
        "BLOCK_SIZE_N": 128,
        "BLOCK_SIZE_K": 512,
        "GROUP_SIZE_M": 8,
        "num_stages": 3,
        "num_warps": 8,
        "compile_time": 2.793537139892578
    },
    {
        "BLOCK_SIZE_M": 64,
        "BLOCK_SIZE_N": 128,
        "BLOCK_SIZE_K": 512,
        "GROUP_SIZE_M": 8,
        "num_stages": 3,
        "num_warps": 16,
        "compile_time": 1.3504986763000488
    },
    {
        "BLOCK_SIZE_M": 64,
        "BLOCK_SIZE_N": 128,
        "BLOCK_SIZE_K": 512,
        "GROUP_SIZE_M": 8,
        "num_stages": 3,
        "num_warps": 32,
        "compile_time": 0.877873420715332
    },
    {
        "BLOCK_SIZE_M": 64,
        "BLOCK_SIZE_N": 128,
        "BLOCK_SIZE_K": 512,
        "GROUP_SIZE_M": 8,
        "num_stages": 4,
        "num_warps": 2,
        "compile_time": 8.37425184249878
    },
    {
        "BLOCK_SIZE_M": 64,
        "BLOCK_SIZE_N": 128,
        "BLOCK_SIZE_K": 512,
        "GROUP_SIZE_M": 8,
        "num_stages": 4,
        "num_warps": 4,
        "compile_time": 13.047510385513306
    },
    {
        "BLOCK_SIZE_M": 64,
        "BLOCK_SIZE_N": 128,
        "BLOCK_SIZE_K": 512,
        "GROUP_SIZE_M": 8,
        "num_stages": 4,
        "num_warps": 8,
        "compile_time": 3.1614084243774414
    },
    {
        "BLOCK_SIZE_M": 64,
        "BLOCK_SIZE_N": 128,
        "BLOCK_SIZE_K": 512,
        "GROUP_SIZE_M": 8,
        "num_stages": 4,
        "num_warps": 16,
        "compile_time": 1.5177395343780518
    },
    {
        "BLOCK_SIZE_M": 64,
        "BLOCK_SIZE_N": 128,
        "BLOCK_SIZE_K": 512,
        "GROUP_SIZE_M": 8,
        "num_stages": 4,
        "num_warps": 32,
        "compile_time": 0.9686200618743896
    },
    {
        "BLOCK_SIZE_M": 64,
        "BLOCK_SIZE_N": 128,
        "BLOCK_SIZE_K": 512,
        "GROUP_SIZE_M": 8,
        "num_stages": 5,
        "num_warps": 2,
        "compile_time": 9.199025392532349
    },
    {
        "BLOCK_SIZE_M": 64,
        "BLOCK_SIZE_N": 128,
        "BLOCK_SIZE_K": 512,
        "GROUP_SIZE_M": 8,
        "num_stages": 5,
        "num_warps": 4,
        "compile_time": 14.159430027008057
    },
    {
        "BLOCK_SIZE_M": 64,
        "BLOCK_SIZE_N": 128,
        "BLOCK_SIZE_K": 512,
        "GROUP_SIZE_M": 8,
        "num_stages": 5,
        "num_warps": 8,
        "compile_time": 3.403507947921753
    },
    {
        "BLOCK_SIZE_M": 64,
        "BLOCK_SIZE_N": 128,
        "BLOCK_SIZE_K": 512,
        "GROUP_SIZE_M": 8,
        "num_stages": 5,
        "num_warps": 16,
        "compile_time": 0.0049669742584228516
    },
    {
        "BLOCK_SIZE_M": 64,
        "BLOCK_SIZE_N": 128,
        "BLOCK_SIZE_K": 512,
        "GROUP_SIZE_M": 8,
        "num_stages": 5,
        "num_warps": 32,
        "compile_time": 1.0729882717132568
    },
    {
        "BLOCK_SIZE_M": 64,
        "BLOCK_SIZE_N": 128,
        "BLOCK_SIZE_K": 512,
        "GROUP_SIZE_M": 8,
        "num_stages": 6,
        "num_warps": 2,
        "compile_time": 9.878040313720703
    },
    {
        "BLOCK_SIZE_M": 64,
        "BLOCK_SIZE_N": 128,
        "BLOCK_SIZE_K": 512,
        "GROUP_SIZE_M": 8,
        "num_stages": 6,
        "num_warps": 4,
        "compile_time": 14.254777669906616
    },
    {
        "BLOCK_SIZE_M": 64,
        "BLOCK_SIZE_N": 128,
        "BLOCK_SIZE_K": 512,
        "GROUP_SIZE_M": 8,
        "num_stages": 6,
        "num_warps": 8,
        "compile_time": 3.530991792678833
    },
    {
        "BLOCK_SIZE_M": 64,
        "BLOCK_SIZE_N": 128,
        "BLOCK_SIZE_K": 512,
        "GROUP_SIZE_M": 8,
        "num_stages": 6,
        "num_warps": 16,
        "compile_time": 0.0061457157135009766
    },
    {
        "BLOCK_SIZE_M": 64,
        "BLOCK_SIZE_N": 128,
        "BLOCK_SIZE_K": 512,
        "GROUP_SIZE_M": 8,
        "num_stages": 6,
        "num_warps": 32,
        "compile_time": 0.0030705928802490234
    },
    {
        "BLOCK_SIZE_M": 64,
        "BLOCK_SIZE_N": 128,
        "BLOCK_SIZE_K": 512,
        "GROUP_SIZE_M": 8,
        "num_stages": 7,
        "num_warps": 2,
        "compile_time": 10.023486852645874
    },
    {
        "BLOCK_SIZE_M": 64,
        "BLOCK_SIZE_N": 128,
        "BLOCK_SIZE_K": 512,
        "GROUP_SIZE_M": 8,
        "num_stages": 7,
        "num_warps": 4,
        "compile_time": 14.916008472442627
    },
    {
        "BLOCK_SIZE_M": 64,
        "BLOCK_SIZE_N": 128,
        "BLOCK_SIZE_K": 512,
        "GROUP_SIZE_M": 8,
        "num_stages": 7,
        "num_warps": 8,
        "compile_time": 3.756520986557007
    },
    {
        "BLOCK_SIZE_M": 64,
        "BLOCK_SIZE_N": 128,
        "BLOCK_SIZE_K": 512,
        "GROUP_SIZE_M": 8,
        "num_stages": 7,
        "num_warps": 16,
        "compile_time": 0.0043032169342041016
    },
    {
        "BLOCK_SIZE_M": 64,
        "BLOCK_SIZE_N": 128,
        "BLOCK_SIZE_K": 512,
        "GROUP_SIZE_M": 8,
        "num_stages": 7,
        "num_warps": 32,
        "compile_time": 1.167997121810913
    },
    {
        "BLOCK_SIZE_M": 64,
        "BLOCK_SIZE_N": 128,
        "BLOCK_SIZE_K": 512,
        "GROUP_SIZE_M": 8,
        "num_stages": 8,
        "num_warps": 2,
        "compile_time": 10.357404470443726
    },
    {
        "BLOCK_SIZE_M": 64,
        "BLOCK_SIZE_N": 128,
        "BLOCK_SIZE_K": 512,
        "GROUP_SIZE_M": 8,
        "num_stages": 8,
        "num_warps": 4,
        "compile_time": 14.46310043334961
    },
    {
        "BLOCK_SIZE_M": 64,
        "BLOCK_SIZE_N": 128,
        "BLOCK_SIZE_K": 512,
        "GROUP_SIZE_M": 8,
        "num_stages": 8,
        "num_warps": 8,
        "compile_time": 4.062891721725464
    },
    {
        "BLOCK_SIZE_M": 64,
        "BLOCK_SIZE_N": 128,
        "BLOCK_SIZE_K": 512,
        "GROUP_SIZE_M": 8,
        "num_stages": 8,
        "num_warps": 16,
        "compile_time": 2.1338095664978027
    },
    {
        "BLOCK_SIZE_M": 64,
        "BLOCK_SIZE_N": 128,
        "BLOCK_SIZE_K": 512,
        "GROUP_SIZE_M": 8,
        "num_stages": 8,
        "num_warps": 32,
        "compile_time": 1.3095340728759766
    },
    {
        "BLOCK_SIZE_M": 64,
        "BLOCK_SIZE_N": 256,
        "BLOCK_SIZE_K": 64,
        "GROUP_SIZE_M": 8,
        "num_stages": 6,
        "num_warps": 2,
        "compile_time": 4.683271408081055
    },
    {
        "BLOCK_SIZE_M": 64,
        "BLOCK_SIZE_N": 256,
        "BLOCK_SIZE_K": 64,
        "GROUP_SIZE_M": 8,
        "num_stages": 6,
        "num_warps": 4,
        "compile_time": 1.7082605361938477
    },
    {
        "BLOCK_SIZE_M": 64,
        "BLOCK_SIZE_N": 256,
        "BLOCK_SIZE_K": 64,
        "GROUP_SIZE_M": 8,
        "num_stages": 6,
        "num_warps": 8,
        "compile_time": 1.0311260223388672
    },
    {
        "BLOCK_SIZE_M": 64,
        "BLOCK_SIZE_N": 256,
        "BLOCK_SIZE_K": 64,
        "GROUP_SIZE_M": 8,
        "num_stages": 6,
        "num_warps": 16,
        "compile_time": 0.0041048526763916016
    },
    {
        "BLOCK_SIZE_M": 64,
        "BLOCK_SIZE_N": 256,
        "BLOCK_SIZE_K": 64,
        "GROUP_SIZE_M": 8,
        "num_stages": 6,
        "num_warps": 32,
        "compile_time": 0.5538575649261475
    },
    {
        "BLOCK_SIZE_M": 64,
        "BLOCK_SIZE_N": 256,
        "BLOCK_SIZE_K": 64,
        "GROUP_SIZE_M": 8,
        "num_stages": 7,
        "num_warps": 2,
        "compile_time": 4.7622950077056885
    },
    {
        "BLOCK_SIZE_M": 64,
        "BLOCK_SIZE_N": 256,
        "BLOCK_SIZE_K": 64,
        "GROUP_SIZE_M": 8,
        "num_stages": 7,
        "num_warps": 4,
        "compile_time": 1.8016080856323242
    },
    {
        "BLOCK_SIZE_M": 64,
        "BLOCK_SIZE_N": 256,
        "BLOCK_SIZE_K": 64,
        "GROUP_SIZE_M": 8,
        "num_stages": 7,
        "num_warps": 8,
        "compile_time": 1.0800347328186035
    },
    {
        "BLOCK_SIZE_M": 64,
        "BLOCK_SIZE_N": 256,
        "BLOCK_SIZE_K": 64,
        "GROUP_SIZE_M": 8,
        "num_stages": 7,
        "num_warps": 16,
        "compile_time": 0.7020218372344971
    },
    {
        "BLOCK_SIZE_M": 64,
        "BLOCK_SIZE_N": 256,
        "BLOCK_SIZE_K": 64,
        "GROUP_SIZE_M": 8,
        "num_stages": 7,
        "num_warps": 32,
        "compile_time": 0.5541069507598877
    },
    {
        "BLOCK_SIZE_M": 64,
        "BLOCK_SIZE_N": 256,
        "BLOCK_SIZE_K": 64,
        "GROUP_SIZE_M": 8,
        "num_stages": 8,
        "num_warps": 2,
        "compile_time": 4.921294689178467
    },
    {
        "BLOCK_SIZE_M": 64,
        "BLOCK_SIZE_N": 256,
        "BLOCK_SIZE_K": 64,
        "GROUP_SIZE_M": 8,
        "num_stages": 8,
        "num_warps": 4,
        "compile_time": 1.9959380626678467
    },
    {
        "BLOCK_SIZE_M": 64,
        "BLOCK_SIZE_N": 256,
        "BLOCK_SIZE_K": 64,
        "GROUP_SIZE_M": 8,
        "num_stages": 8,
        "num_warps": 8,
        "compile_time": 1.0993821620941162
    },
    {
        "BLOCK_SIZE_M": 64,
        "BLOCK_SIZE_N": 256,
        "BLOCK_SIZE_K": 64,
        "GROUP_SIZE_M": 8,
        "num_stages": 8,
        "num_warps": 16,
        "compile_time": 0.7211322784423828
    },
    {
        "BLOCK_SIZE_M": 64,
        "BLOCK_SIZE_N": 256,
        "BLOCK_SIZE_K": 64,
        "GROUP_SIZE_M": 8,
        "num_stages": 8,
        "num_warps": 32,
        "compile_time": 0.559089183807373
    },
    {
        "BLOCK_SIZE_M": 64,
        "BLOCK_SIZE_N": 256,
        "BLOCK_SIZE_K": 128,
        "GROUP_SIZE_M": 8,
        "num_stages": 1,
        "num_warps": 2,
        "compile_time": 6.00907039642334
    },
    {
        "BLOCK_SIZE_M": 64,
        "BLOCK_SIZE_N": 256,
        "BLOCK_SIZE_K": 128,
        "GROUP_SIZE_M": 8,
        "num_stages": 2,
        "num_warps": 2,
        "compile_time": 6.246297597885132
    },
    {
        "BLOCK_SIZE_M": 64,
        "BLOCK_SIZE_N": 256,
        "BLOCK_SIZE_K": 128,
        "GROUP_SIZE_M": 8,
        "num_stages": 3,
        "num_warps": 2,
        "compile_time": 13.069767713546753
    },
    {
        "BLOCK_SIZE_M": 64,
        "BLOCK_SIZE_N": 256,
        "BLOCK_SIZE_K": 128,
        "GROUP_SIZE_M": 8,
        "num_stages": 4,
        "num_warps": 2,
        "compile_time": 13.090267896652222
    },
    {
        "BLOCK_SIZE_M": 64,
        "BLOCK_SIZE_N": 256,
        "BLOCK_SIZE_K": 128,
        "GROUP_SIZE_M": 8,
        "num_stages": 4,
        "num_warps": 4,
        "compile_time": 2.949652910232544
    },
    {
        "BLOCK_SIZE_M": 64,
        "BLOCK_SIZE_N": 256,
        "BLOCK_SIZE_K": 128,
        "GROUP_SIZE_M": 8,
        "num_stages": 4,
        "num_warps": 8,
        "compile_time": 1.343867540359497
    },
    {
        "BLOCK_SIZE_M": 64,
        "BLOCK_SIZE_N": 256,
        "BLOCK_SIZE_K": 128,
        "GROUP_SIZE_M": 8,
        "num_stages": 4,
        "num_warps": 16,
        "compile_time": 0.8903195858001709
    },
    {
        "BLOCK_SIZE_M": 64,
        "BLOCK_SIZE_N": 256,
        "BLOCK_SIZE_K": 128,
        "GROUP_SIZE_M": 8,
        "num_stages": 4,
        "num_warps": 32,
        "compile_time": 0.004898548126220703
    },
    {
        "BLOCK_SIZE_M": 64,
        "BLOCK_SIZE_N": 256,
        "BLOCK_SIZE_K": 128,
        "GROUP_SIZE_M": 8,
        "num_stages": 5,
        "num_warps": 2,
        "compile_time": 13.254340887069702
    },
    {
        "BLOCK_SIZE_M": 64,
        "BLOCK_SIZE_N": 256,
        "BLOCK_SIZE_K": 128,
        "GROUP_SIZE_M": 8,
        "num_stages": 5,
        "num_warps": 4,
        "compile_time": 3.0876781940460205
    },
    {
        "BLOCK_SIZE_M": 64,
        "BLOCK_SIZE_N": 256,
        "BLOCK_SIZE_K": 128,
        "GROUP_SIZE_M": 8,
        "num_stages": 5,
        "num_warps": 8,
        "compile_time": 1.4301249980926514
    },
    {
        "BLOCK_SIZE_M": 64,
        "BLOCK_SIZE_N": 256,
        "BLOCK_SIZE_K": 128,
        "GROUP_SIZE_M": 8,
        "num_stages": 5,
        "num_warps": 16,
        "compile_time": 0.9231116771697998
    },
    {
        "BLOCK_SIZE_M": 64,
        "BLOCK_SIZE_N": 256,
        "BLOCK_SIZE_K": 128,
        "GROUP_SIZE_M": 8,
        "num_stages": 5,
        "num_warps": 32,
        "compile_time": 0.6680812835693359
    },
    {
        "BLOCK_SIZE_M": 64,
        "BLOCK_SIZE_N": 256,
        "BLOCK_SIZE_K": 128,
        "GROUP_SIZE_M": 8,
        "num_stages": 6,
        "num_warps": 2,
        "compile_time": 13.557560920715332
    },
    {
        "BLOCK_SIZE_M": 64,
        "BLOCK_SIZE_N": 256,
        "BLOCK_SIZE_K": 128,
        "GROUP_SIZE_M": 8,
        "num_stages": 6,
        "num_warps": 4,
        "compile_time": 3.2991456985473633
    },
    {
        "BLOCK_SIZE_M": 64,
        "BLOCK_SIZE_N": 256,
        "BLOCK_SIZE_K": 128,
        "GROUP_SIZE_M": 8,
        "num_stages": 6,
        "num_warps": 8,
        "compile_time": 1.5296926498413086
    },
    {
        "BLOCK_SIZE_M": 64,
        "BLOCK_SIZE_N": 256,
        "BLOCK_SIZE_K": 128,
        "GROUP_SIZE_M": 8,
        "num_stages": 6,
        "num_warps": 16,
        "compile_time": 0.9820594787597656
    },
    {
        "BLOCK_SIZE_M": 64,
        "BLOCK_SIZE_N": 256,
        "BLOCK_SIZE_K": 128,
        "GROUP_SIZE_M": 8,
        "num_stages": 6,
        "num_warps": 32,
        "compile_time": 0.004001617431640625
    },
    {
        "BLOCK_SIZE_M": 64,
        "BLOCK_SIZE_N": 256,
        "BLOCK_SIZE_K": 128,
        "GROUP_SIZE_M": 8,
        "num_stages": 7,
        "num_warps": 2,
        "compile_time": 13.819247722625732
    },
    {
        "BLOCK_SIZE_M": 64,
        "BLOCK_SIZE_N": 256,
        "BLOCK_SIZE_K": 128,
        "GROUP_SIZE_M": 8,
        "num_stages": 7,
        "num_warps": 4,
        "compile_time": 3.4204089641571045
    },
    {
        "BLOCK_SIZE_M": 64,
        "BLOCK_SIZE_N": 256,
        "BLOCK_SIZE_K": 128,
        "GROUP_SIZE_M": 8,
        "num_stages": 7,
        "num_warps": 8,
        "compile_time": 1.6408412456512451
    },
    {
        "BLOCK_SIZE_M": 64,
        "BLOCK_SIZE_N": 256,
        "BLOCK_SIZE_K": 128,
        "GROUP_SIZE_M": 8,
        "num_stages": 7,
        "num_warps": 16,
        "compile_time": 1.0358350276947021
    },
    {
        "BLOCK_SIZE_M": 64,
        "BLOCK_SIZE_N": 256,
        "BLOCK_SIZE_K": 128,
        "GROUP_SIZE_M": 8,
        "num_stages": 7,
        "num_warps": 32,
        "compile_time": 0.7254667282104492
    },
    {
        "BLOCK_SIZE_M": 64,
        "BLOCK_SIZE_N": 256,
        "BLOCK_SIZE_K": 128,
        "GROUP_SIZE_M": 8,
        "num_stages": 8,
        "num_warps": 2,
        "compile_time": 13.976092100143433
    },
    {
        "BLOCK_SIZE_M": 64,
        "BLOCK_SIZE_N": 256,
        "BLOCK_SIZE_K": 128,
        "GROUP_SIZE_M": 8,
        "num_stages": 8,
        "num_warps": 4,
        "compile_time": 3.5934765338897705
    },
    {
        "BLOCK_SIZE_M": 64,
        "BLOCK_SIZE_N": 256,
        "BLOCK_SIZE_K": 128,
        "GROUP_SIZE_M": 8,
        "num_stages": 8,
        "num_warps": 8,
        "compile_time": 1.7329037189483643
    },
    {
        "BLOCK_SIZE_M": 64,
        "BLOCK_SIZE_N": 256,
        "BLOCK_SIZE_K": 128,
        "GROUP_SIZE_M": 8,
        "num_stages": 8,
        "num_warps": 16,
        "compile_time": 1.093379259109497
    },
    {
        "BLOCK_SIZE_M": 64,
        "BLOCK_SIZE_N": 256,
        "BLOCK_SIZE_K": 128,
        "GROUP_SIZE_M": 8,
        "num_stages": 8,
        "num_warps": 32,
        "compile_time": 0.005293846130371094
    },
    {
        "BLOCK_SIZE_M": 64,
        "BLOCK_SIZE_N": 256,
        "BLOCK_SIZE_K": 256,
        "GROUP_SIZE_M": 8,
        "num_stages": 1,
        "num_warps": 2,
        "compile_time": 6.271626710891724
    },
    {
        "BLOCK_SIZE_M": 64,
        "BLOCK_SIZE_N": 256,
        "BLOCK_SIZE_K": 256,
        "GROUP_SIZE_M": 8,
        "num_stages": 2,
        "num_warps": 2,
        "compile_time": 6.418195962905884
    },
    {
        "BLOCK_SIZE_M": 64,
        "BLOCK_SIZE_N": 256,
        "BLOCK_SIZE_K": 256,
        "GROUP_SIZE_M": 8,
        "num_stages": 3,
        "num_warps": 2,
        "compile_time": 6.802762508392334
    },
    {
        "BLOCK_SIZE_M": 64,
        "BLOCK_SIZE_N": 256,
        "BLOCK_SIZE_K": 256,
        "GROUP_SIZE_M": 8,
        "num_stages": 3,
        "num_warps": 4,
        "compile_time": 11.46088433265686
    },
    {
        "BLOCK_SIZE_M": 64,
        "BLOCK_SIZE_N": 256,
        "BLOCK_SIZE_K": 256,
        "GROUP_SIZE_M": 8,
        "num_stages": 3,
        "num_warps": 8,
        "compile_time": 2.5621354579925537
    },
    {
        "BLOCK_SIZE_M": 64,
        "BLOCK_SIZE_N": 256,
        "BLOCK_SIZE_K": 256,
        "GROUP_SIZE_M": 8,
        "num_stages": 3,
        "num_warps": 16,
        "compile_time": 1.221724510192871
    },
    {
        "BLOCK_SIZE_M": 64,
        "BLOCK_SIZE_N": 256,
        "BLOCK_SIZE_K": 256,
