simdata/FP16-R100/3584_results.json
[
    {
        "BLOCK_SIZE_M": 128,
        "BLOCK_SIZE_N": 256,
        "BLOCK_SIZE_K": 32,
        "GROUP_SIZE_M": 8,
        "num_stages": 6,
        "num_warps": 8,
        "ms": 0.39159709215164185,
        "min_ms": 0.39159709215164185,
        "max_ms": 0.39159709215164185,
        "compile_time": 3.249614715576172
    },
    {
        "BLOCK_SIZE_M": 256,
        "BLOCK_SIZE_N": 128,
        "BLOCK_SIZE_K": 32,
        "GROUP_SIZE_M": 8,
        "num_stages": 4,
        "num_warps": 8,
        "ms": 0.3919549584388733,
        "min_ms": 0.3919549584388733,
        "max_ms": 0.3919549584388733,
        "compile_time": 2.64861798286438
    },
    {
        "BLOCK_SIZE_M": 128,
        "BLOCK_SIZE_N": 256,
        "BLOCK_SIZE_K": 32,
        "GROUP_SIZE_M": 8,
        "num_stages": 5,
        "num_warps": 8,
        "ms": 0.3922269940376282,
        "min_ms": 0.3922269940376282,
        "max_ms": 0.3922269940376282,
        "compile_time": 3.1085333824157715
    },
    {
        "BLOCK_SIZE_M": 256,
        "BLOCK_SIZE_N": 128,
        "BLOCK_SIZE_K": 32,
        "GROUP_SIZE_M": 8,
        "num_stages": 6,
        "num_warps": 8,
        "ms": 0.39255446195602417,
        "min_ms": 0.39255446195602417,
        "max_ms": 0.39255446195602417,
        "compile_time": 2.7300188541412354
    },
    {
        "BLOCK_SIZE_M": 128,
        "BLOCK_SIZE_N": 256,
        "BLOCK_SIZE_K": 32,
        "GROUP_SIZE_M": 8,
        "num_stages": 4,
        "num_warps": 8,
        "ms": 0.39336007833480835,
        "min_ms": 0.39336007833480835,
        "max_ms": 0.39336007833480835,
        "compile_time": 1.934831142425537
    },
    {
        "BLOCK_SIZE_M": 128,
        "BLOCK_SIZE_N": 256,
        "BLOCK_SIZE_K": 32,
        "GROUP_SIZE_M": 8,
        "num_stages": 7,
        "num_warps": 8,
        "ms": 0.3941081464290619,
        "min_ms": 0.3941081464290619,
        "max_ms": 0.3941081464290619,
        "compile_time": 1.8155443668365479
    },
    {
        "BLOCK_SIZE_M": 128,
        "BLOCK_SIZE_N": 256,
        "BLOCK_SIZE_K": 32,
        "GROUP_SIZE_M": 8,
        "num_stages": 3,
        "num_warps": 8,
        "ms": 0.39566537737846375,
        "min_ms": 0.39566537737846375,
        "max_ms": 0.39566537737846375,
        "compile_time": 1.8859729766845703
    },
    {
        "BLOCK_SIZE_M": 256,
        "BLOCK_SIZE_N": 128,
        "BLOCK_SIZE_K": 32,
        "GROUP_SIZE_M": 8,
        "num_stages": 7,
        "num_warps": 8,
        "ms": 0.39566701650619507,
        "min_ms": 0.39566701650619507,
        "max_ms": 0.39566701650619507,
        "compile_time": 2.733412742614746
    },
    {
        "BLOCK_SIZE_M": 256,
        "BLOCK_SIZE_N": 128,
        "BLOCK_SIZE_K": 32,
        "GROUP_SIZE_M": 8,
        "num_stages": 3,
        "num_warps": 8,
        "ms": 0.39732855558395386,
        "min_ms": 0.39732855558395386,
        "max_ms": 0.39732855558395386,
        "compile_time": 2.616732597351074
    },
    {
        "BLOCK_SIZE_M": 256,
        "BLOCK_SIZE_N": 128,
        "BLOCK_SIZE_K": 32,
        "GROUP_SIZE_M": 8,
        "num_stages": 5,
        "num_warps": 8,
        "ms": 0.3993583619594574,
        "min_ms": 0.3993583619594574,
        "max_ms": 0.3993583619594574,
        "compile_time": 2.6812827587127686
    },
    {
        "BLOCK_SIZE_M": 128,
        "BLOCK_SIZE_N": 128,
        "BLOCK_SIZE_K": 32,
        "GROUP_SIZE_M": 8,
        "num_stages": 4,
        "num_warps": 4,
        "ms": 0.40705832839012146,
        "min_ms": 0.40705832839012146,
        "max_ms": 0.40705832839012146,
        "compile_time": 2.624199390411377
    },
    {
        "BLOCK_SIZE_M": 128,
        "BLOCK_SIZE_N": 128,
        "BLOCK_SIZE_K": 32,
        "GROUP_SIZE_M": 8,
        "num_stages": 3,
        "num_warps": 4,
        "ms": 0.40794453024864197,
        "min_ms": 0.40794453024864197,
        "max_ms": 0.40794453024864197,
        "compile_time": 2.5061302185058594
    },
    {
        "BLOCK_SIZE_M": 256,
        "BLOCK_SIZE_N": 128,
        "BLOCK_SIZE_K": 64,
        "GROUP_SIZE_M": 8,
        "num_stages": 4,
        "num_warps": 8,
        "ms": 0.4081250727176666,
        "min_ms": 0.4081250727176666,
        "max_ms": 0.4081250727176666,
        "compile_time": 2.802279472351074
    },
    {
        "BLOCK_SIZE_M": 128,
        "BLOCK_SIZE_N": 128,
        "BLOCK_SIZE_K": 32,
        "GROUP_SIZE_M": 8,
        "num_stages": 5,
        "num_warps": 4,
        "ms": 0.40860629081726074,
        "min_ms": 0.40860629081726074,
        "max_ms": 0.40860629081726074,
        "compile_time": 2.664604663848877
    },
    {
        "BLOCK_SIZE_M": 128,
        "BLOCK_SIZE_N": 128,
        "BLOCK_SIZE_K": 32,
        "GROUP_SIZE_M": 8,
        "num_stages": 6,
        "num_warps": 4,
        "ms": 0.4091464579105377,
        "min_ms": 0.4091464579105377,
        "max_ms": 0.4091464579105377,
        "compile_time": 2.679145336151123
    },
    {
        "BLOCK_SIZE_M": 128,
        "BLOCK_SIZE_N": 128,
        "BLOCK_SIZE_K": 64,
        "GROUP_SIZE_M": 8,
        "num_stages": 3,
        "num_warps": 4,
        "ms": 0.4094318449497223,
        "min_ms": 0.4094318449497223,
        "max_ms": 0.4094318449497223,
        "compile_time": 2.787165880203247
    },
    {
        "BLOCK_SIZE_M": 256,
        "BLOCK_SIZE_N": 128,
        "BLOCK_SIZE_K": 64,
        "GROUP_SIZE_M": 8,
        "num_stages": 3,
        "num_warps": 8,
        "ms": 0.41119375824928284,
        "min_ms": 0.41119375824928284,
        "max_ms": 0.41119375824928284,
        "compile_time": 2.70908784866333
    },
    {
        "BLOCK_SIZE_M": 128,
        "BLOCK_SIZE_N": 256,
        "BLOCK_SIZE_K": 64,
        "GROUP_SIZE_M": 8,
        "num_stages": 4,
        "num_warps": 8,
        "ms": 0.4241688847541809,
        "min_ms": 0.4241688847541809,
        "max_ms": 0.4241688847541809,
        "compile_time": 1.8741822242736816
    },
    {
        "BLOCK_SIZE_M": 128,
        "BLOCK_SIZE_N": 256,
        "BLOCK_SIZE_K": 64,
        "GROUP_SIZE_M": 8,
        "num_stages": 3,
        "num_warps": 8,
        "ms": 0.42541423439979553,
        "min_ms": 0.42541423439979553,
        "max_ms": 0.42541423439979553,
        "compile_time": 1.2979717254638672
    },
    {
        "BLOCK_SIZE_M": 64,
        "BLOCK_SIZE_N": 256,
        "BLOCK_SIZE_K": 32,
        "GROUP_SIZE_M": 8,
        "num_stages": 4,
        "num_warps": 4,
        "ms": 0.429065465927124,
        "min_ms": 0.429065465927124,
        "max_ms": 0.429065465927124,
        "compile_time": 2.5373213291168213
    },
    {
        "BLOCK_SIZE_M": 64,
        "BLOCK_SIZE_N": 512,
        "BLOCK_SIZE_K": 32,
        "GROUP_SIZE_M": 8,
        "num_stages": 3,
        "num_warps": 8,
        "ms": 0.4291377663612366,
        "min_ms": 0.4291377663612366,
        "max_ms": 0.4291377663612366,
        "compile_time": 2.457587957382202
    },
    {
        "BLOCK_SIZE_M": 128,
        "BLOCK_SIZE_N": 128,
        "BLOCK_SIZE_K": 32,
        "GROUP_SIZE_M": 8,
        "num_stages": 7,
        "num_warps": 4,
        "ms": 0.42931851744651794,
        "min_ms": 0.42931851744651794,
        "max_ms": 0.42931851744651794,
        "compile_time": 2.6887636184692383
    },
    {
        "BLOCK_SIZE_M": 64,
        "BLOCK_SIZE_N": 512,
        "BLOCK_SIZE_K": 32,
        "GROUP_SIZE_M": 8,
        "num_stages": 5,
        "num_warps": 8,
        "ms": 0.42995697259902954,
        "min_ms": 0.42995697259902954,
        "max_ms": 0.42995697259902954,
        "compile_time": 2.5442702770233154
    },
    {
        "BLOCK_SIZE_M": 128,
        "BLOCK_SIZE_N": 128,
        "BLOCK_SIZE_K": 32,
        "GROUP_SIZE_M": 8,
        "num_stages": 8,
        "num_warps": 4,
        "ms": 0.4316749572753906,
        "min_ms": 0.4316749572753906,
        "max_ms": 0.4316749572753906,
        "compile_time": 1.5983972549438477
    },
    {
        "BLOCK_SIZE_M": 128,
        "BLOCK_SIZE_N": 128,
        "BLOCK_SIZE_K": 64,
        "GROUP_SIZE_M": 8,
        "num_stages": 2,
        "num_warps": 4,
        "ms": 0.4319811761379242,
        "min_ms": 0.4319811761379242,
        "max_ms": 0.4319811761379242,
        "compile_time": 2.666229009628296
    },
    {
        "BLOCK_SIZE_M": 64,
        "BLOCK_SIZE_N": 256,
        "BLOCK_SIZE_K": 32,
        "GROUP_SIZE_M": 8,
        "num_stages": 3,
        "num_warps": 4,
        "ms": 0.43352919816970825,
        "min_ms": 0.43352919816970825,
        "max_ms": 0.43352919816970825,
        "compile_time": 2.514852523803711
    },
    {
        "BLOCK_SIZE_M": 64,
        "BLOCK_SIZE_N": 256,
        "BLOCK_SIZE_K": 32,
        "GROUP_SIZE_M": 8,
        "num_stages": 5,
        "num_warps": 4,
        "ms": 0.43403857946395874,
        "min_ms": 0.43403857946395874,
        "max_ms": 0.43403857946395874,
        "compile_time": 2.5701887607574463
    },
    {
        "BLOCK_SIZE_M": 128,
        "BLOCK_SIZE_N": 128,
        "BLOCK_SIZE_K": 64,
        "GROUP_SIZE_M": 8,
        "num_stages": 4,
        "num_warps": 8,
        "ms": 0.43938684463500977,
        "min_ms": 0.43938684463500977,
        "max_ms": 0.43938684463500977,
        "compile_time": 1.3406059741973877
    },
    {
        "BLOCK_SIZE_M": 128,
        "BLOCK_SIZE_N": 128,
        "BLOCK_SIZE_K": 64,
        "GROUP_SIZE_M": 8,
        "num_stages": 3,
        "num_warps": 8,
        "ms": 0.4408378601074219,
        "min_ms": 0.4408378601074219,
        "max_ms": 0.4408378601074219,
        "compile_time": 1.3290624618530273
    },
    {
        "BLOCK_SIZE_M": 512,
        "BLOCK_SIZE_N": 64,
        "BLOCK_SIZE_K": 64,
        "GROUP_SIZE_M": 8,
        "num_stages": 3,
        "num_warps": 8,
        "ms": 0.44129571318626404,
        "min_ms": 0.44129571318626404,
        "max_ms": 0.44129571318626404,
        "compile_time": 2.958069086074829
    },
    {
        "BLOCK_SIZE_M": 128,
        "BLOCK_SIZE_N": 128,
        "BLOCK_SIZE_K": 64,
        "GROUP_SIZE_M": 8,
        "num_stages": 5,
        "num_warps": 8,
        "ms": 0.441880464553833,
        "min_ms": 0.441880464553833,
        "max_ms": 0.441880464553833,
        "compile_time": 1.3517143726348877
    },
    {
        "BLOCK_SIZE_M": 512,
        "BLOCK_SIZE_N": 64,
        "BLOCK_SIZE_K": 32,
        "GROUP_SIZE_M": 8,
        "num_stages": 3,
        "num_warps": 8,
        "ms": 0.4425005316734314,
        "min_ms": 0.4425005316734314,
        "max_ms": 0.4425005316734314,
        "compile_time": 2.88558292388916
    },
    {
        "BLOCK_SIZE_M": 256,
        "BLOCK_SIZE_N": 64,
        "BLOCK_SIZE_K": 32,
        "GROUP_SIZE_M": 8,
        "num_stages": 4,
        "num_warps": 4,
        "ms": 0.4431026875972748,
        "min_ms": 0.4431026875972748,
        "max_ms": 0.4431026875972748,
        "compile_time": 2.780224323272705
    },
    {
        "BLOCK_SIZE_M": 512,
        "BLOCK_SIZE_N": 64,
        "BLOCK_SIZE_K": 32,
        "GROUP_SIZE_M": 8,
        "num_stages": 4,
        "num_warps": 8,
        "ms": 0.4432462751865387,
        "min_ms": 0.4432462751865387,
        "max_ms": 0.4432462751865387,
        "compile_time": 2.943481206893921
    },
    {
        "BLOCK_SIZE_M": 128,
        "BLOCK_SIZE_N": 128,
        "BLOCK_SIZE_K": 64,
        "GROUP_SIZE_M": 8,
        "num_stages": 6,
        "num_warps": 8,
        "ms": 0.4443988800048828,
        "min_ms": 0.4443988800048828,
        "max_ms": 0.4443988800048828,
        "compile_time": 2.4731605052948
    },
    {
        "BLOCK_SIZE_M": 256,
        "BLOCK_SIZE_N": 64,
        "BLOCK_SIZE_K": 32,
        "GROUP_SIZE_M": 8,
        "num_stages": 5,
        "num_warps": 4,
        "ms": 0.445730060338974,
        "min_ms": 0.445730060338974,
        "max_ms": 0.445730060338974,
        "compile_time": 2.803496837615967
    },
    {
        "BLOCK_SIZE_M": 256,
        "BLOCK_SIZE_N": 64,
        "BLOCK_SIZE_K": 32,
        "GROUP_SIZE_M": 8,
        "num_stages": 3,
        "num_warps": 4,
        "ms": 0.4474991261959076,
        "min_ms": 0.4474991261959076,
        "max_ms": 0.4474991261959076,
        "compile_time": 2.794726848602295
    },
    {
        "BLOCK_SIZE_M": 512,
        "BLOCK_SIZE_N": 64,
        "BLOCK_SIZE_K": 32,
        "GROUP_SIZE_M": 8,
        "num_stages": 5,
        "num_warps": 8,
        "ms": 0.44847601652145386,
        "min_ms": 0.44847601652145386,
        "max_ms": 0.44847601652145386,
        "compile_time": 2.9394772052764893
    },
    {
        "BLOCK_SIZE_M": 256,
        "BLOCK_SIZE_N": 64,
        "BLOCK_SIZE_K": 64,
        "GROUP_SIZE_M": 8,
        "num_stages": 3,
        "num_warps": 4,
        "ms": 0.4503852427005768,
        "min_ms": 0.4503852427005768,
        "max_ms": 0.4503852427005768,
        "compile_time": 3.0089399814605713
    },
    {
        "BLOCK_SIZE_M": 128,
        "BLOCK_SIZE_N": 128,
        "BLOCK_SIZE_K": 128,
        "GROUP_SIZE_M": 8,
        "num_stages": 3,
        "num_warps": 8,
        "ms": 0.4514331817626953,
        "min_ms": 0.4514331817626953,
        "max_ms": 0.4514331817626953,
        "compile_time": 2.523930311203003
    },
    {
        "BLOCK_SIZE_M": 128,
        "BLOCK_SIZE_N": 128,
        "BLOCK_SIZE_K": 64,
        "GROUP_SIZE_M": 8,
        "num_stages": 4,
        "num_warps": 4,
        "ms": 0.4563581347465515,
        "min_ms": 0.4563581347465515,
        "max_ms": 0.4563581347465515,
        "compile_time": 2.8639793395996094
    },
    {
        "BLOCK_SIZE_M": 128,
        "BLOCK_SIZE_N": 128,
        "BLOCK_SIZE_K": 64,
        "GROUP_SIZE_M": 8,
        "num_stages": 5,
        "num_warps": 4,
        "ms": 0.4573245942592621,
        "min_ms": 0.4573245942592621,
        "max_ms": 0.4573245942592621,
        "compile_time": 2.917983293533325
    },
    {
        "BLOCK_SIZE_M": 128,
        "BLOCK_SIZE_N": 128,
        "BLOCK_SIZE_K": 64,
        "GROUP_SIZE_M": 8,
        "num_stages": 6,
        "num_warps": 4,
        "ms": 0.45929449796676636,
        "min_ms": 0.45929449796676636,
        "max_ms": 0.45929449796676636,
        "compile_time": 3.057621717453003
    },
    {
        "BLOCK_SIZE_M": 256,
        "BLOCK_SIZE_N": 64,
        "BLOCK_SIZE_K": 64,
        "GROUP_SIZE_M": 8,
        "num_stages": 4,
        "num_warps": 8,
        "ms": 0.46062326431274414,
        "min_ms": 0.46062326431274414,
        "max_ms": 0.46062326431274414,
        "compile_time": 2.512155771255493
    },
    {
        "BLOCK_SIZE_M": 64,
        "BLOCK_SIZE_N": 256,
        "BLOCK_SIZE_K": 64,
        "GROUP_SIZE_M": 8,
        "num_stages": 3,
        "num_warps": 4,
        "ms": 0.4624251425266266,
        "min_ms": 0.4624251425266266,
        "max_ms": 0.4624251425266266,
        "compile_time": 2.7150087356567383
    },
    {
        "BLOCK_SIZE_M": 256,
        "BLOCK_SIZE_N": 64,
        "BLOCK_SIZE_K": 64,
        "GROUP_SIZE_M": 8,
        "num_stages": 3,
        "num_warps": 8,
        "ms": 0.46318650245666504,
        "min_ms": 0.46318650245666504,
        "max_ms": 0.46318650245666504,
        "compile_time": 2.4234418869018555
    },
    {
        "BLOCK_SIZE_M": 256,
        "BLOCK_SIZE_N": 64,
        "BLOCK_SIZE_K": 64,
        "GROUP_SIZE_M": 8,
        "num_stages": 5,
        "num_warps": 8,
        "ms": 0.46520647406578064,
        "min_ms": 0.46520647406578064,
        "max_ms": 0.46520647406578064,
        "compile_time": 2.5192744731903076
    },
    {
        "BLOCK_SIZE_M": 128,
        "BLOCK_SIZE_N": 128,
        "BLOCK_SIZE_K": 32,
        "GROUP_SIZE_M": 8,
        "num_stages": 6,
        "num_warps": 8,
        "ms": 0.46923965215682983,
        "min_ms": 0.46923965215682983,
        "max_ms": 0.46923965215682983,
        "compile_time": 1.3317906856536865
    },
    {
        "BLOCK_SIZE_M": 128,
        "BLOCK_SIZE_N": 128,
        "BLOCK_SIZE_K": 32,
        "GROUP_SIZE_M": 8,
        "num_stages": 5,
        "num_warps": 8,
        "ms": 0.4692653715610504,
        "min_ms": 0.4692653715610504,
        "max_ms": 0.4692653715610504,
        "compile_time": 1.315981388092041
    },
    {
        "BLOCK_SIZE_M": 64,
        "BLOCK_SIZE_N": 512,
        "BLOCK_SIZE_K": 32,
        "GROUP_SIZE_M": 8,
        "num_stages": 4,
        "num_warps": 8,
        "ms": 0.46962833404541016,
        "min_ms": 0.46962833404541016,
        "max_ms": 0.46962833404541016,
        "compile_time": 2.4742374420166016
    },
    {
        "BLOCK_SIZE_M": 128,
        "BLOCK_SIZE_N": 128,
        "BLOCK_SIZE_K": 32,
        "GROUP_SIZE_M": 8,
        "num_stages": 7,
        "num_warps": 8,
        "ms": 0.46991315484046936,
        "min_ms": 0.46991315484046936,
        "max_ms": 0.46991315484046936,
        "compile_time": 1.3266654014587402
    },
    {
        "BLOCK_SIZE_M": 128,
        "BLOCK_SIZE_N": 128,
        "BLOCK_SIZE_K": 32,
        "GROUP_SIZE_M": 8,
        "num_stages": 4,
        "num_warps": 8,
        "ms": 0.470073938369751,
        "min_ms": 0.470073938369751,
        "max_ms": 0.470073938369751,
        "compile_time": 1.3197107315063477
    },
    {
        "BLOCK_SIZE_M": 128,
        "BLOCK_SIZE_N": 128,
        "BLOCK_SIZE_K": 32,
        "GROUP_SIZE_M": 8,
        "num_stages": 8,
        "num_warps": 8,
        "ms": 0.4710457921028137,
        "min_ms": 0.4710457921028137,
        "max_ms": 0.4710457921028137,
        "compile_time": 1.6021292209625244
    },
    {
        "BLOCK_SIZE_M": 64,
        "BLOCK_SIZE_N": 256,
        "BLOCK_SIZE_K": 64,
        "GROUP_SIZE_M": 8,
        "num_stages": 4,
        "num_warps": 8,
        "ms": 0.4729077219963074,
        "min_ms": 0.4729077219963074,
        "max_ms": 0.4729077219963074,
        "compile_time": 2.223247528076172
    },
    {
        "BLOCK_SIZE_M": 64,
        "BLOCK_SIZE_N": 256,
        "BLOCK_SIZE_K": 16,
        "GROUP_SIZE_M": 8,
        "num_stages": 4,
        "num_warps": 4,
        "ms": 0.4744701385498047,
        "min_ms": 0.4744701385498047,
        "max_ms": 0.4744701385498047,
        "compile_time": 2.1855409145355225
    },
    {
        "BLOCK_SIZE_M": 64,
        "BLOCK_SIZE_N": 256,
        "BLOCK_SIZE_K": 64,
        "GROUP_SIZE_M": 8,
        "num_stages": 3,
        "num_warps": 8,
        "ms": 0.4746817648410797,
        "min_ms": 0.4746817648410797,
        "max_ms": 0.4746817648410797,
        "compile_time": 1.279165267944336
    },
    {
        "BLOCK_SIZE_M": 256,
        "BLOCK_SIZE_N": 64,
        "BLOCK_SIZE_K": 128,
        "GROUP_SIZE_M": 8,
        "num_stages": 3,
        "num_warps": 8,
        "ms": 0.4763234257698059,
        "min_ms": 0.4763234257698059,
        "max_ms": 0.4763234257698059,
        "compile_time": 2.87750244140625
    },
    {
        "BLOCK_SIZE_M": 64,
        "BLOCK_SIZE_N": 256,
        "BLOCK_SIZE_K": 64,
        "GROUP_SIZE_M": 8,
        "num_stages": 5,
        "num_warps": 8,
        "ms": 0.47706037759780884,
        "min_ms": 0.47706037759780884,
        "max_ms": 0.47706037759780884,
        "compile_time": 2.2929675579071045
    },
    {
        "BLOCK_SIZE_M": 256,
        "BLOCK_SIZE_N": 64,
        "BLOCK_SIZE_K": 64,
        "GROUP_SIZE_M": 8,
        "num_stages": 2,
        "num_warps": 4,
        "ms": 0.47733426094055176,
        "min_ms": 0.47733426094055176,
        "max_ms": 0.47733426094055176,
        "compile_time": 2.829258918762207
    },
    {
        "BLOCK_SIZE_M": 64,
        "BLOCK_SIZE_N": 256,
        "BLOCK_SIZE_K": 64,
        "GROUP_SIZE_M": 8,
        "num_stages": 2,
        "num_warps": 4,
        "ms": 0.4786418378353119,
        "min_ms": 0.4786418378353119,
        "max_ms": 0.4786418378353119,
        "compile_time": 2.559847831726074
    },
    {
        "BLOCK_SIZE_M": 256,
        "BLOCK_SIZE_N": 64,
        "BLOCK_SIZE_K": 32,
        "GROUP_SIZE_M": 8,
        "num_stages": 6,
        "num_warps": 4,
        "ms": 0.47937193512916565,
        "min_ms": 0.47937193512916565,
        "max_ms": 0.47937193512916565,
        "compile_time": 2.8236243724823
    },
    {
        "BLOCK_SIZE_M": 64,
        "BLOCK_SIZE_N": 512,
        "BLOCK_SIZE_K": 64,
        "GROUP_SIZE_M": 8,
        "num_stages": 3,
        "num_warps": 8,
        "ms": 0.4823572635650635,
        "min_ms": 0.4823572635650635,
        "max_ms": 0.4823572635650635,
        "compile_time": 2.6861839294433594
    },
    {
        "BLOCK_SIZE_M": 256,
        "BLOCK_SIZE_N": 64,
        "BLOCK_SIZE_K": 32,
        "GROUP_SIZE_M": 8,
        "num_stages": 7,
        "num_warps": 4,
        "ms": 0.4825097918510437,
        "min_ms": 0.4825097918510437,
        "max_ms": 0.4825097918510437,
        "compile_time": 2.8628244400024414
    },
    {
        "BLOCK_SIZE_M": 256,
        "BLOCK_SIZE_N": 64,
        "BLOCK_SIZE_K": 64,
        "GROUP_SIZE_M": 8,
        "num_stages": 5,
        "num_warps": 4,
        "ms": 0.4834114909172058,
        "min_ms": 0.4834114909172058,
        "max_ms": 0.4834114909172058,
        "compile_time": 2.9559569358825684
    },
    {
        "BLOCK_SIZE_M": 256,
        "BLOCK_SIZE_N": 64,
        "BLOCK_SIZE_K": 32,
        "GROUP_SIZE_M": 8,
        "num_stages": 8,
        "num_warps": 4,
        "ms": 0.48621049523353577,
        "min_ms": 0.48621049523353577,
        "max_ms": 0.48621049523353577,
        "compile_time": 2.9290311336517334
    },
    {
        "BLOCK_SIZE_M": 128,
        "BLOCK_SIZE_N": 64,
        "BLOCK_SIZE_K": 32,
        "GROUP_SIZE_M": 8,
        "num_stages": 4,
        "num_warps": 2,
        "ms": 0.48835697770118713,
        "min_ms": 0.48835697770118713,
        "max_ms": 0.48835697770118713,
        "compile_time": 2.9648497104644775
    },
    {
        "BLOCK_SIZE_M": 64,
        "BLOCK_SIZE_N": 256,
        "BLOCK_SIZE_K": 16,
        "GROUP_SIZE_M": 8,
        "num_stages": 6,
        "num_warps": 4,
        "ms": 0.49062347412109375,
        "min_ms": 0.49062347412109375,
        "max_ms": 0.49062347412109375,
        "compile_time": 2.235079526901245
    },
    {
        "BLOCK_SIZE_M": 128,
        "BLOCK_SIZE_N": 64,
        "BLOCK_SIZE_K": 32,
        "GROUP_SIZE_M": 8,
        "num_stages": 5,
        "num_warps": 2,
        "ms": 0.4913347363471985,
        "min_ms": 0.4913347363471985,
        "max_ms": 0.4913347363471985,
        "compile_time": 1.7075183391571045
    },
    {
        "BLOCK_SIZE_M": 64,
        "BLOCK_SIZE_N": 256,
        "BLOCK_SIZE_K": 16,
        "GROUP_SIZE_M": 8,
        "num_stages": 7,
        "num_warps": 4,
        "ms": 0.49136820435523987,
        "min_ms": 0.49136820435523987,
        "max_ms": 0.49136820435523987,
        "compile_time": 2.2541279792785645
    },
    {
        "BLOCK_SIZE_M": 128,
        "BLOCK_SIZE_N": 64,
        "BLOCK_SIZE_K": 64,
        "GROUP_SIZE_M": 8,
        "num_stages": 3,
        "num_warps": 4,
        "ms": 0.49171024560928345,
        "min_ms": 0.49171024560928345,
        "max_ms": 0.49171024560928345,
        "compile_time": 1.609544038772583
    },
    {
        "BLOCK_SIZE_M": 64,
        "BLOCK_SIZE_N": 128,
        "BLOCK_SIZE_K": 32,
        "GROUP_SIZE_M": 8,
        "num_stages": 4,
        "num_warps": 2,
        "ms": 0.4920654296875,
        "min_ms": 0.4920654296875,
        "max_ms": 0.4920654296875,
        "compile_time": 2.5154857635498047
    },
    {
        "BLOCK_SIZE_M": 64,
        "BLOCK_SIZE_N": 256,
        "BLOCK_SIZE_K": 16,
        "GROUP_SIZE_M": 8,
        "num_stages": 5,
        "num_warps": 4,
        "ms": 0.49233517050743103,
        "min_ms": 0.49233517050743103,
        "max_ms": 0.49233517050743103,
        "compile_time": 2.22763991355896
    },
    {
        "BLOCK_SIZE_M": 64,
        "BLOCK_SIZE_N": 256,
        "BLOCK_SIZE_K": 16,
        "GROUP_SIZE_M": 8,
        "num_stages": 8,
        "num_warps": 4,
        "ms": 0.4926413893699646,
        "min_ms": 0.4926413893699646,
        "max_ms": 0.4926413893699646,
        "compile_time": 2.295088768005371
    },
    {
        "BLOCK_SIZE_M": 64,
        "BLOCK_SIZE_N": 128,
        "BLOCK_SIZE_K": 32,
        "GROUP_SIZE_M": 8,
        "num_stages": 3,
        "num_warps": 2,
        "ms": 0.4927126467227936,
        "min_ms": 0.4927126467227936,
        "max_ms": 0.4927126467227936,
        "compile_time": 2.490354537963867
    },
    {
        "BLOCK_SIZE_M": 64,
        "BLOCK_SIZE_N": 128,
        "BLOCK_SIZE_K": 32,
        "GROUP_SIZE_M": 8,
        "num_stages": 4,
        "num_warps": 4,
        "ms": 0.49317869544029236,
        "min_ms": 0.49317869544029236,
        "max_ms": 0.49317869544029236,
        "compile_time": 1.313399076461792
    },
    {
        "BLOCK_SIZE_M": 64,
        "BLOCK_SIZE_N": 128,
        "BLOCK_SIZE_K": 32,
        "GROUP_SIZE_M": 8,
        "num_stages": 5,
        "num_warps": 4,
        "ms": 0.49329718947410583,
        "min_ms": 0.49329718947410583,
        "max_ms": 0.49329718947410583,
        "compile_time": 1.3279385566711426
    },
    {
        "BLOCK_SIZE_M": 64,
        "BLOCK_SIZE_N": 256,
        "BLOCK_SIZE_K": 32,
        "GROUP_SIZE_M": 8,
        "num_stages": 4,
        "num_warps": 8,
        "ms": 0.4933362603187561,
        "min_ms": 0.4933362603187561,
        "max_ms": 0.4933362603187561,
        "compile_time": 1.2893297672271729
    },
    {
        "BLOCK_SIZE_M": 128,
        "BLOCK_SIZE_N": 64,
        "BLOCK_SIZE_K": 32,
        "GROUP_SIZE_M": 8,
        "num_stages": 4,
        "num_warps": 4,
        "ms": 0.4933709502220154,
        "min_ms": 0.4933709502220154,
        "max_ms": 0.4933709502220154,
        "compile_time": 1.7892467975616455
    },
    {
        "BLOCK_SIZE_M": 128,
        "BLOCK_SIZE_N": 64,
        "BLOCK_SIZE_K": 32,
        "GROUP_SIZE_M": 8,
        "num_stages": 5,
        "num_warps": 4,
        "ms": 0.49426785111427307,
        "min_ms": 0.49426785111427307,
        "max_ms": 0.49426785111427307,
        "compile_time": 1.6591806411743164
    },
    {
        "BLOCK_SIZE_M": 64,
        "BLOCK_SIZE_N": 256,
        "BLOCK_SIZE_K": 32,
        "GROUP_SIZE_M": 8,
        "num_stages": 5,
        "num_warps": 8,
        "ms": 0.4951179623603821,
        "min_ms": 0.4951179623603821,
        "max_ms": 0.4951179623603821,
        "compile_time": 1.301880121231079
    },
    {
        "BLOCK_SIZE_M": 64,
        "BLOCK_SIZE_N": 128,
        "BLOCK_SIZE_K": 64,
        "GROUP_SIZE_M": 8,
        "num_stages": 4,
        "num_warps": 4,
        "ms": 0.4956842362880707,
        "min_ms": 0.4956842362880707,
        "max_ms": 0.4956842362880707,
        "compile_time": 2.2415964603424072
    },
    {
        "BLOCK_SIZE_M": 128,
        "BLOCK_SIZE_N": 64,
        "BLOCK_SIZE_K": 32,
        "GROUP_SIZE_M": 8,
        "num_stages": 3,
        "num_warps": 2,
        "ms": 0.4963679313659668,
        "min_ms": 0.4963679313659668,
        "max_ms": 0.4963679313659668,
        "compile_time": 1.6288392543792725
    },
    {
        "BLOCK_SIZE_M": 64,
        "BLOCK_SIZE_N": 256,
        "BLOCK_SIZE_K": 32,
        "GROUP_SIZE_M": 8,
        "num_stages": 6,
        "num_warps": 8,
        "ms": 0.49645406007766724,
        "min_ms": 0.49645406007766724,
        "max_ms": 0.49645406007766724,
        "compile_time": 1.3010337352752686
    },
    {
        "BLOCK_SIZE_M": 64,
        "BLOCK_SIZE_N": 256,
        "BLOCK_SIZE_K": 32,
        "GROUP_SIZE_M": 8,
        "num_stages": 7,
        "num_warps": 8,
        "ms": 0.4977485239505768,
        "min_ms": 0.4977485239505768,
        "max_ms": 0.4977485239505768,
        "compile_time": 2.0886080265045166
    },
    {
        "BLOCK_SIZE_M": 128,
        "BLOCK_SIZE_N": 64,
        "BLOCK_SIZE_K": 64,
        "GROUP_SIZE_M": 8,
        "num_stages": 4,
        "num_warps": 4,
        "ms": 0.4978598952293396,
        "min_ms": 0.4978598952293396,
        "max_ms": 0.4978598952293396,
        "compile_time": 1.6115200519561768
    },
    {
        "BLOCK_SIZE_M": 128,
        "BLOCK_SIZE_N": 128,
        "BLOCK_SIZE_K": 128,
        "GROUP_SIZE_M": 8,
        "num_stages": 3,
        "num_warps": 16,
        "ms": 0.4991406500339508,
        "min_ms": 0.4991406500339508,
        "max_ms": 0.4991406500339508,
        "compile_time": 2.196153402328491
    },
    {
        "BLOCK_SIZE_M": 64,
        "BLOCK_SIZE_N": 256,
        "BLOCK_SIZE_K": 32,
        "GROUP_SIZE_M": 8,
        "num_stages": 8,
        "num_warps": 8,
        "ms": 0.49981889128685,
        "min_ms": 0.49981889128685,
        "max_ms": 0.49981889128685,
        "compile_time": 1.3014321327209473
    },
    {
        "BLOCK_SIZE_M": 128,
        "BLOCK_SIZE_N": 128,
        "BLOCK_SIZE_K": 128,
        "GROUP_SIZE_M": 8,
        "num_stages": 3,
        "num_warps": 4,
        "ms": 0.5002508163452148,
        "min_ms": 0.5002508163452148,
        "max_ms": 0.5002508163452148,
        "compile_time": 3.2428665161132812
    },
    {
        "BLOCK_SIZE_M": 128,
        "BLOCK_SIZE_N": 128,
        "BLOCK_SIZE_K": 128,
        "GROUP_SIZE_M": 8,
        "num_stages": 2,
        "num_warps": 4,
        "ms": 0.5005964040756226,
        "min_ms": 0.5005964040756226,
        "max_ms": 0.5005964040756226,
        "compile_time": 2.9844167232513428
    },
    {
        "BLOCK_SIZE_M": 128,
        "BLOCK_SIZE_N": 64,
        "BLOCK_SIZE_K": 32,
        "GROUP_SIZE_M": 8,
        "num_stages": 6,
        "num_warps": 4,
        "ms": 0.5009527206420898,
        "min_ms": 0.5009527206420898,
        "max_ms": 0.5009527206420898,
        "compile_time": 1.5985589027404785
    },
    {
        "BLOCK_SIZE_M": 128,
        "BLOCK_SIZE_N": 128,
        "BLOCK_SIZE_K": 16,
        "GROUP_SIZE_M": 8,
        "num_stages": 4,
        "num_warps": 4,
        "ms": 0.500993549823761,
        "min_ms": 0.500993549823761,
        "max_ms": 0.500993549823761,
        "compile_time": 2.395521402359009
    },
    {
        "BLOCK_SIZE_M": 64,
        "BLOCK_SIZE_N": 128,
        "BLOCK_SIZE_K": 32,
        "GROUP_SIZE_M": 8,
        "num_stages": 6,
        "num_warps": 4,
        "ms": 0.5011545419692993,
        "min_ms": 0.5011545419692993,
        "max_ms": 0.5011545419692993,
        "compile_time": 1.3304095268249512
    },
    {
        "BLOCK_SIZE_M": 128,
        "BLOCK_SIZE_N": 64,
        "BLOCK_SIZE_K": 64,
        "GROUP_SIZE_M": 8,
        "num_stages": 7,
        "num_warps": 4,
        "ms": 0.50123530626297,
        "min_ms": 0.50123530626297,
        "max_ms": 0.50123530626297,
        "compile_time": 1.7137322425842285
    },
    {
        "BLOCK_SIZE_M": 128,
        "BLOCK_SIZE_N": 128,
        "BLOCK_SIZE_K": 16,
        "GROUP_SIZE_M": 8,
        "num_stages": 8,
        "num_warps": 4,
        "ms": 0.5019721984863281,
        "min_ms": 0.5019721984863281,
        "max_ms": 0.5019721984863281,
        "compile_time": 2.449077606201172
    },
    {
        "BLOCK_SIZE_M": 64,
        "BLOCK_SIZE_N": 128,
        "BLOCK_SIZE_K": 32,
        "GROUP_SIZE_M": 8,
        "num_stages": 3,
        "num_warps": 4,
        "ms": 0.5026860237121582,
        "min_ms": 0.5026860237121582,
        "max_ms": 0.5026860237121582,
        "compile_time": 2.0063729286193848
    },
    {
        "BLOCK_SIZE_M": 64,
        "BLOCK_SIZE_N": 256,
        "BLOCK_SIZE_K": 128,
        "GROUP_SIZE_M": 8,
        "num_stages": 3,
        "num_warps": 8,
        "ms": 0.5030688047409058,
        "min_ms": 0.5030688047409058,
        "max_ms": 0.5030688047409058,
        "compile_time": 2.500941276550293
    },
    {
        "BLOCK_SIZE_M": 64,
        "BLOCK_SIZE_N": 128,
        "BLOCK_SIZE_K": 32,
        "GROUP_SIZE_M": 8,
        "num_stages": 7,
        "num_warps": 4,
        "ms": 0.503179669380188,
        "min_ms": 0.503179669380188,
        "max_ms": 0.503179669380188,
        "compile_time": 2.145693063735962
    },
    {
        "BLOCK_SIZE_M": 128,
        "BLOCK_SIZE_N": 256,
        "BLOCK_SIZE_K": 64,
        "GROUP_SIZE_M": 8,
        "num_stages": 2,
        "num_warps": 8,
        "ms": 0.503487765789032,
        "min_ms": 0.503487765789032,
        "max_ms": 0.503487765789032,
        "compile_time": 1.7558388710021973
    },
    {
        "BLOCK_SIZE_M": 128,
        "BLOCK_SIZE_N": 64,
        "BLOCK_SIZE_K": 64,
        "GROUP_SIZE_M": 8,
        "num_stages": 3,
        "num_warps": 2,
        "ms": 0.5060158967971802,
        "min_ms": 0.5060158967971802,
        "max_ms": 0.5060158967971802,
        "compile_time": 3.032672643661499
    },
    {
        "BLOCK_SIZE_M": 128,
        "BLOCK_SIZE_N": 64,
        "BLOCK_SIZE_K": 32,
        "GROUP_SIZE_M": 8,
        "num_stages": 7,
        "num_warps": 4,
        "ms": 0.5061960220336914,
        "min_ms": 0.5061960220336914,
        "max_ms": 0.5061960220336914,
        "compile_time": 1.6128625869750977
    },
    {
        "BLOCK_SIZE_M": 64,
        "BLOCK_SIZE_N": 128,
        "BLOCK_SIZE_K": 32,
        "GROUP_SIZE_M": 8,
        "num_stages": 5,
        "num_warps": 2,
        "ms": 0.5062483549118042,
        "min_ms": 0.5062483549118042,
        "max_ms": 0.5062483549118042,
        "compile_time": 2.5547659397125244
    },
    {
        "BLOCK_SIZE_M": 128,
        "BLOCK_SIZE_N": 128,
        "BLOCK_SIZE_K": 16,
        "GROUP_SIZE_M": 8,
        "num_stages": 5,
        "num_warps": 4,
        "ms": 0.5062729120254517,
        "min_ms": 0.5062729120254517,
        "max_ms": 0.5062729120254517,
        "compile_time": 2.3681588172912598
    },
    {
        "BLOCK_SIZE_M": 64,
        "BLOCK_SIZE_N": 128,
        "BLOCK_SIZE_K": 64,
        "GROUP_SIZE_M": 8,
        "num_stages": 6,
        "num_warps": 4,
        "ms": 0.5073731541633606,
        "min_ms": 0.5073731541633606,
        "max_ms": 0.5073731541633606,
        "compile_time": 2.297795057296753
    },
    {
        "BLOCK_SIZE_M": 256,
        "BLOCK_SIZE_N": 64,
        "BLOCK_SIZE_K": 64,
        "GROUP_SIZE_M": 8,
        "num_stages": 4,
        "num_warps": 4,
        "ms": 0.5075534582138062,
        "min_ms": 0.5075534582138062,
        "max_ms": 0.5075534582138062,
        "compile_time": 2.880312919616699
    },
    {
        "BLOCK_SIZE_M": 128,
        "BLOCK_SIZE_N": 128,
        "BLOCK_SIZE_K": 16,
        "GROUP_SIZE_M": 8,
        "num_stages": 7,
        "num_warps": 4,
        "ms": 0.5077952146530151,
        "min_ms": 0.5077952146530151,
        "max_ms": 0.5077952146530151,
        "compile_time": 2.396078109741211
    },
    {
        "BLOCK_SIZE_M": 128,
        "BLOCK_SIZE_N": 128,
        "BLOCK_SIZE_K": 16,
        "GROUP_SIZE_M": 8,
        "num_stages": 6,
        "num_warps": 4,
        "ms": 0.5079082250595093,
        "min_ms": 0.5079082250595093,
        "max_ms": 0.5079082250595093,
        "compile_time": 2.401858329772949
    },
    {
        "BLOCK_SIZE_M": 128,
        "BLOCK_SIZE_N": 64,
        "BLOCK_SIZE_K": 32,
        "GROUP_SIZE_M": 8,
        "num_stages": 3,
        "num_warps": 4,
        "ms": 0.5090886354446411,
        "min_ms": 0.5090886354446411,
        "max_ms": 0.5090886354446411,
        "compile_time": 1.6108734607696533
    },
    {
        "BLOCK_SIZE_M": 64,
        "BLOCK_SIZE_N": 128,
        "BLOCK_SIZE_K": 64,
        "GROUP_SIZE_M": 8,
        "num_stages": 5,
        "num_warps": 4,
        "ms": 0.5112324953079224,
        "min_ms": 0.5112324953079224,
        "max_ms": 0.5112324953079224,
        "compile_time": 1.2842447757720947
    },
    {
        "BLOCK_SIZE_M": 64,
        "BLOCK_SIZE_N": 128,
        "BLOCK_SIZE_K": 64,
        "GROUP_SIZE_M": 8,
        "num_stages": 7,
        "num_warps": 4,
        "ms": 0.5128539800643921,
        "min_ms": 0.5128539800643921,
        "max_ms": 0.5128539800643921,
        "compile_time": 2.3438665866851807
    },
    {
        "BLOCK_SIZE_M": 64,
        "BLOCK_SIZE_N": 256,
        "BLOCK_SIZE_K": 32,
        "GROUP_SIZE_M": 8,
        "num_stages": 8,
        "num_warps": 4,
        "ms": 0.5129655003547668,
        "min_ms": 0.5129655003547668,
        "max_ms": 0.5129655003547668,
        "compile_time": 2.6743080615997314
    },
    {
        "BLOCK_SIZE_M": 64,
        "BLOCK_SIZE_N": 128,
        "BLOCK_SIZE_K": 64,
        "GROUP_SIZE_M": 8,
        "num_stages": 3,
        "num_warps": 4,
        "ms": 0.5132442712783813,
        "min_ms": 0.5132442712783813,
        "max_ms": 0.5132442712783813,
        "compile_time": 1.291813850402832
    },
    {
        "BLOCK_SIZE_M": 64,
        "BLOCK_SIZE_N": 256,
        "BLOCK_SIZE_K": 16,
        "GROUP_SIZE_M": 8,
        "num_stages": 3,
        "num_warps": 4,
        "ms": 0.5147614479064941,
        "min_ms": 0.5147614479064941,
        "max_ms": 0.5147614479064941,
        "compile_time": 2.124124050140381
    },
    {
        "BLOCK_SIZE_M": 64,
        "BLOCK_SIZE_N": 256,
        "BLOCK_SIZE_K": 32,
        "GROUP_SIZE_M": 8,
        "num_stages": 6,
        "num_warps": 4,
        "ms": 0.5158997774124146,
        "min_ms": 0.5158997774124146,
        "max_ms": 0.5158997774124146,
        "compile_time": 2.566588878631592
    },
    {
        "BLOCK_SIZE_M": 64,
        "BLOCK_SIZE_N": 256,
        "BLOCK_SIZE_K": 32,
        "GROUP_SIZE_M": 8,
        "num_stages": 7,
        "num_warps": 4,
        "ms": 0.5168390870094299,
        "min_ms": 0.5168390870094299,
        "max_ms": 0.5168390870094299,
        "compile_time": 2.618110179901123
    },
    {
        "BLOCK_SIZE_M": 256,
        "BLOCK_SIZE_N": 64,
        "BLOCK_SIZE_K": 32,
        "GROUP_SIZE_M": 8,
        "num_stages": 5,
        "num_warps": 8,
        "ms": 0.5170650482177734,
        "min_ms": 0.5170650482177734,
        "max_ms": 0.5170650482177734,
        "compile_time": 1.33957839012146
    },
    {
        "BLOCK_SIZE_M": 256,
        "BLOCK_SIZE_N": 64,
        "BLOCK_SIZE_K": 32,
        "GROUP_SIZE_M": 8,
        "num_stages": 4,
        "num_warps": 8,
        "ms": 0.5173013806343079,
        "min_ms": 0.5173013806343079,
        "max_ms": 0.5173013806343079,
        "compile_time": 1.3663287162780762
    },
    {
        "BLOCK_SIZE_M": 256,
        "BLOCK_SIZE_N": 64,
        "BLOCK_SIZE_K": 32,
        "GROUP_SIZE_M": 8,
        "num_stages": 6,
        "num_warps": 8,
        "ms": 0.517606794834137,
        "min_ms": 0.517606794834137,
        "max_ms": 0.517606794834137,
        "compile_time": 2.2604103088378906
    },
    {
        "BLOCK_SIZE_M": 64,
        "BLOCK_SIZE_N": 512,
        "BLOCK_SIZE_K": 16,
        "GROUP_SIZE_M": 8,
        "num_stages": 4,
        "num_warps": 8,
        "ms": 0.5182569026947021,
        "min_ms": 0.5182569026947021,
        "max_ms": 0.5182569026947021,
        "compile_time": 2.1736881732940674
    },
    {
        "BLOCK_SIZE_M": 64,
        "BLOCK_SIZE_N": 512,
        "BLOCK_SIZE_K": 16,
        "GROUP_SIZE_M": 8,
        "num_stages": 6,
        "num_warps": 8,
        "ms": 0.5188997387886047,
        "min_ms": 0.5188997387886047,
        "max_ms": 0.5188997387886047,
        "compile_time": 2.206843137741089
    },
    {
        "BLOCK_SIZE_M": 128,
        "BLOCK_SIZE_N": 64,
        "BLOCK_SIZE_K": 32,
        "GROUP_SIZE_M": 8,
        "num_stages": 6,
        "num_warps": 2,
        "ms": 0.5190629363059998,
        "min_ms": 0.5190629363059998,
        "max_ms": 0.5190629363059998,
        "compile_time": 1.581657886505127
    },
    {
        "BLOCK_SIZE_M": 128,
        "BLOCK_SIZE_N": 64,
        "BLOCK_SIZE_K": 64,
        "GROUP_SIZE_M": 8,
        "num_stages": 5,
        "num_warps": 4,
        "ms": 0.5200880169868469,
        "min_ms": 0.5200880169868469,
        "max_ms": 0.5200880169868469,
        "compile_time": 2.5956742763519287
    },
    {
        "BLOCK_SIZE_M": 256,
        "BLOCK_SIZE_N": 64,
        "BLOCK_SIZE_K": 32,
        "GROUP_SIZE_M": 8,
        "num_stages": 7,
        "num_warps": 8,
        "ms": 0.5208975076675415,
        "min_ms": 0.5208975076675415,
        "max_ms": 0.5208975076675415,
        "compile_time": 2.278228521347046
    },
    {
        "BLOCK_SIZE_M": 64,
        "BLOCK_SIZE_N": 512,
        "BLOCK_SIZE_K": 16,
        "GROUP_SIZE_M": 8,
        "num_stages": 5,
        "num_warps": 8,
        "ms": 0.5210768580436707,
        "min_ms": 0.5210768580436707,
        "max_ms": 0.5210768580436707,
        "compile_time": 2.1906955242156982
    },
    {
        "BLOCK_SIZE_M": 128,
        "BLOCK_SIZE_N": 64,
        "BLOCK_SIZE_K": 64,
        "GROUP_SIZE_M": 8,
        "num_stages": 6,
        "num_warps": 4,
        "ms": 0.5214560627937317,
        "min_ms": 0.5214560627937317,
        "max_ms": 0.5214560627937317,
        "compile_time": 1.6438357830047607
    },
    {
        "BLOCK_SIZE_M": 64,
        "BLOCK_SIZE_N": 512,
        "BLOCK_SIZE_K": 16,
        "GROUP_SIZE_M": 8,
        "num_stages": 8,
        "num_warps": 8,
        "ms": 0.5216077566146851,
        "min_ms": 0.5216077566146851,
        "max_ms": 0.5216077566146851,
        "compile_time": 2.2594945430755615
    },
    {
        "BLOCK_SIZE_M": 128,
        "BLOCK_SIZE_N": 64,
        "BLOCK_SIZE_K": 32,
        "GROUP_SIZE_M": 8,
        "num_stages": 7,
        "num_warps": 2,
        "ms": 0.5219906568527222,
        "min_ms": 0.5219906568527222,
        "max_ms": 0.5219906568527222,
        "compile_time": 1.586977243423462
    },
    {
        "BLOCK_SIZE_M": 256,
        "BLOCK_SIZE_N": 64,
        "BLOCK_SIZE_K": 32,
        "GROUP_SIZE_M": 8,
        "num_stages": 8,
        "num_warps": 8,
        "ms": 0.5223733186721802,
        "min_ms": 0.5223733186721802,
        "max_ms": 0.5223733186721802,
        "compile_time": 1.3429815769195557
    },
    {
        "BLOCK_SIZE_M": 64,
        "BLOCK_SIZE_N": 512,
        "BLOCK_SIZE_K": 16,
        "GROUP_SIZE_M": 8,
        "num_stages": 7,
        "num_warps": 8,
        "ms": 0.5227853655815125,
        "min_ms": 0.5227853655815125,
        "max_ms": 0.5227853655815125,
        "compile_time": 2.2363240718841553
    },
    {
        "BLOCK_SIZE_M": 64,
        "BLOCK_SIZE_N": 128,
        "BLOCK_SIZE_K": 16,
        "GROUP_SIZE_M": 8,
        "num_stages": 5,
        "num_warps": 2,
        "ms": 0.5239295959472656,
        "min_ms": 0.5239295959472656,
        "max_ms": 0.5239295959472656,
        "compile_time": 2.231865406036377
    },
    {
        "BLOCK_SIZE_M": 128,
        "BLOCK_SIZE_N": 256,
        "BLOCK_SIZE_K": 16,
        "GROUP_SIZE_M": 8,
        "num_stages": 6,
        "num_warps": 8,
        "ms": 0.5249703526496887,
        "min_ms": 0.5249703526496887,
        "max_ms": 0.5249703526496887,
        "compile_time": 1.862419843673706
    },
    {
        "BLOCK_SIZE_M": 128,
        "BLOCK_SIZE_N": 64,
        "BLOCK_SIZE_K": 64,
        "GROUP_SIZE_M": 8,
        "num_stages": 4,
        "num_warps": 8,
        "ms": 0.5255341529846191,
        "min_ms": 0.5255341529846191,
        "max_ms": 0.5255341529846191,
        "compile_time": 1.5742225646972656
    },
    {
        "BLOCK_SIZE_M": 64,
        "BLOCK_SIZE_N": 128,
        "BLOCK_SIZE_K": 16,
        "GROUP_SIZE_M": 8,
        "num_stages": 6,
        "num_warps": 2,
        "ms": 0.5255593061447144,
        "min_ms": 0.5255593061447144,
        "max_ms": 0.5255593061447144,
        "compile_time": 2.238312244415283
    },
    {
        "BLOCK_SIZE_M": 128,
        "BLOCK_SIZE_N": 256,
        "BLOCK_SIZE_K": 16,
        "GROUP_SIZE_M": 8,
        "num_stages": 4,
        "num_warps": 8,
        "ms": 0.5262758135795593,
        "min_ms": 0.5262758135795593,
        "max_ms": 0.5262758135795593,
        "compile_time": 2.9814910888671875
    },
    {
        "BLOCK_SIZE_M": 128,
        "BLOCK_SIZE_N": 256,
        "BLOCK_SIZE_K": 16,
        "GROUP_SIZE_M": 8,
        "num_stages": 5,
        "num_warps": 8,
        "ms": 0.5264476537704468,
        "min_ms": 0.5264476537704468,
        "max_ms": 0.5264476537704468,
        "compile_time": 2.9904568195343018
    },
    {
        "BLOCK_SIZE_M": 128,
        "BLOCK_SIZE_N": 64,
        "BLOCK_SIZE_K": 64,
        "GROUP_SIZE_M": 8,
        "num_stages": 2,
        "num_warps": 4,
        "ms": 0.5267358422279358,
        "min_ms": 0.5267358422279358,
        "max_ms": 0.5267358422279358,
        "compile_time": 1.587594985961914
    },
    {
        "BLOCK_SIZE_M": 128,
        "BLOCK_SIZE_N": 64,
        "BLOCK_SIZE_K": 64,
        "GROUP_SIZE_M": 8,
        "num_stages": 3,
        "num_warps": 8,
        "ms": 0.5269128084182739,
        "min_ms": 0.5269128084182739,
        "max_ms": 0.5269128084182739,
        "compile_time": 1.5978200435638428
    },
    {
        "BLOCK_SIZE_M": 128,
        "BLOCK_SIZE_N": 256,
        "BLOCK_SIZE_K": 16,
        "GROUP_SIZE_M": 8,
        "num_stages": 7,
        "num_warps": 8,
        "ms": 0.5269188284873962,
        "min_ms": 0.5269188284873962,
        "max_ms": 0.5269188284873962,
        "compile_time": 1.934075117111206
    },
    {
        "BLOCK_SIZE_M": 256,
        "BLOCK_SIZE_N": 128,
        "BLOCK_SIZE_K": 64,
        "GROUP_SIZE_M": 8,
        "num_stages": 2,
        "num_warps": 8,
        "ms": 0.5275330543518066,
        "min_ms": 0.5275330543518066,
        "max_ms": 0.5275330543518066,
        "compile_time": 2.648157835006714
    },
    {
        "BLOCK_SIZE_M": 128,
        "BLOCK_SIZE_N": 64,
        "BLOCK_SIZE_K": 128,
        "GROUP_SIZE_M": 8,
        "num_stages": 4,
        "num_warps": 4,
        "ms": 0.5278884768486023,
        "min_ms": 0.5278884768486023,
        "max_ms": 0.5278884768486023,
        "compile_time": 1.3420968055725098
    },
    {
        "BLOCK_SIZE_M": 64,
        "BLOCK_SIZE_N": 128,
        "BLOCK_SIZE_K": 16,
        "GROUP_SIZE_M": 8,
        "num_stages": 7,
        "num_warps": 2,
        "ms": 0.5279363989830017,
        "min_ms": 0.5279363989830017,
        "max_ms": 0.5279363989830017,
        "compile_time": 2.273185968399048
    },
    {
        "BLOCK_SIZE_M": 256,
        "BLOCK_SIZE_N": 64,
        "BLOCK_SIZE_K": 128,
        "GROUP_SIZE_M": 8,
        "num_stages": 3,
        "num_warps": 16,
        "ms": 0.5282672643661499,
        "min_ms": 0.5282672643661499,
        "max_ms": 0.5282672643661499,
        "compile_time": 1.3760950565338135
    },
    {
        "BLOCK_SIZE_M": 64,
        "BLOCK_SIZE_N": 128,
        "BLOCK_SIZE_K": 32,
        "GROUP_SIZE_M": 8,
        "num_stages": 8,
        "num_warps": 4,
        "ms": 0.5288890600204468,
        "min_ms": 0.5288890600204468,
        "max_ms": 0.5288890600204468,
        "compile_time": 1.3637328147888184
    },
    {
        "BLOCK_SIZE_M": 64,
        "BLOCK_SIZE_N": 128,
        "BLOCK_SIZE_K": 64,
        "GROUP_SIZE_M": 8,
        "num_stages": 4,
        "num_warps": 8,
        "ms": 0.530342698097229,
        "min_ms": 0.530342698097229,
        "max_ms": 0.530342698097229,
        "compile_time": 1.3035509586334229
    },
    {
        "BLOCK_SIZE_M": 64,
        "BLOCK_SIZE_N": 128,
        "BLOCK_SIZE_K": 128,
        "GROUP_SIZE_M": 8,
        "num_stages": 4,
        "num_warps": 4,
        "ms": 0.5303826332092285,
        "min_ms": 0.5303826332092285,
        "max_ms": 0.5303826332092285,
        "compile_time": 2.6184890270233154
    },
    {
        "BLOCK_SIZE_M": 128,
        "BLOCK_SIZE_N": 64,
        "BLOCK_SIZE_K": 32,
        "GROUP_SIZE_M": 8,
        "num_stages": 8,
        "num_warps": 4,
        "ms": 0.5306121706962585,
        "min_ms": 0.5306121706962585,
        "max_ms": 0.5306121706962585,
        "compile_time": 1.5923526287078857
    },
    {
        "BLOCK_SIZE_M": 128,
        "BLOCK_SIZE_N": 256,
        "BLOCK_SIZE_K": 16,
        "GROUP_SIZE_M": 8,
        "num_stages": 8,
        "num_warps": 8,
        "ms": 0.5312231183052063,
        "min_ms": 0.5312231183052063,
        "max_ms": 0.5312231183052063,
        "compile_time": 1.878784418106079
    },
    {
        "BLOCK_SIZE_M": 128,
        "BLOCK_SIZE_N": 128,
        "BLOCK_SIZE_K": 64,
        "GROUP_SIZE_M": 8,
        "num_stages": 3,
        "num_warps": 16,
        "ms": 0.5323210954666138,
        "min_ms": 0.5323210954666138,
        "max_ms": 0.5323210954666138,
        "compile_time": 2.0559380054473877
    },
    {
        "BLOCK_SIZE_M": 256,
        "BLOCK_SIZE_N": 128,
        "BLOCK_SIZE_K": 128,
        "GROUP_SIZE_M": 8,
        "num_stages": 2,
        "num_warps": 8,
        "ms": 0.533128023147583,
        "min_ms": 0.533128023147583,
        "max_ms": 0.533128023147583,
        "compile_time": 2.8504176139831543
    },
    {
        "BLOCK_SIZE_M": 64,
        "BLOCK_SIZE_N": 128,
        "BLOCK_SIZE_K": 16,
        "GROUP_SIZE_M": 8,
        "num_stages": 4,
        "num_warps": 2,
        "ms": 0.5336809158325195,
        "min_ms": 0.5336809158325195,
        "max_ms": 0.5336809158325195,
        "compile_time": 2.1894259452819824
    },
    {
        "BLOCK_SIZE_M": 128,
        "BLOCK_SIZE_N": 256,
        "BLOCK_SIZE_K": 32,
        "GROUP_SIZE_M": 8,
        "num_stages": 3,
        "num_warps": 16,
        "ms": 0.5345019102096558,
        "min_ms": 0.5345019102096558,
        "max_ms": 0.5345019102096558,
        "compile_time": 1.8206958770751953
    },
    {
        "BLOCK_SIZE_M": 64,
        "BLOCK_SIZE_N": 128,
        "BLOCK_SIZE_K": 64,
        "GROUP_SIZE_M": 8,
        "num_stages": 3,
        "num_warps": 8,
        "ms": 0.5346800088882446,
        "min_ms": 0.5346800088882446,
        "max_ms": 0.5346800088882446,
        "compile_time": 1.928518533706665
    },
    {
        "BLOCK_SIZE_M": 128,
        "BLOCK_SIZE_N": 64,
        "BLOCK_SIZE_K": 128,
        "GROUP_SIZE_M": 8,
        "num_stages": 3,
        "num_warps": 4,
        "ms": 0.5352923274040222,
        "min_ms": 0.5352923274040222,
        "max_ms": 0.5352923274040222,
        "compile_time": 1.5746545791625977
    },
    {
        "BLOCK_SIZE_M": 128,
        "BLOCK_SIZE_N": 128,
        "BLOCK_SIZE_K": 64,
        "GROUP_SIZE_M": 8,
        "num_stages": 4,
        "num_warps": 16,
        "ms": 0.5354644060134888,
        "min_ms": 0.5354644060134888,
        "max_ms": 0.5354644060134888,
        "compile_time": 1.3040916919708252
    },
    {
        "BLOCK_SIZE_M": 128,
        "BLOCK_SIZE_N": 256,
        "BLOCK_SIZE_K": 32,
        "GROUP_SIZE_M": 8,
        "num_stages": 5,
        "num_warps": 16,
        "ms": 0.5358085632324219,
        "min_ms": 0.5358085632324219,
        "max_ms": 0.5358085632324219,
        "compile_time": 1.7867178916931152
    },
    {
        "BLOCK_SIZE_M": 128,
        "BLOCK_SIZE_N": 128,
        "BLOCK_SIZE_K": 32,
        "GROUP_SIZE_M": 8,
        "num_stages": 3,
        "num_warps": 8,
        "ms": 0.5359110236167908,
        "min_ms": 0.5359110236167908,
        "max_ms": 0.5359110236167908,
        "compile_time": 1.2601871490478516
    },
    {
        "BLOCK_SIZE_M": 64,
        "BLOCK_SIZE_N": 256,
        "BLOCK_SIZE_K": 128,
        "GROUP_SIZE_M": 8,
        "num_stages": 3,
        "num_warps": 16,
        "ms": 0.5362258553504944,
        "min_ms": 0.5362258553504944,
        "max_ms": 0.5362258553504944,
        "compile_time": 1.2756459712982178
    },
    {
        "BLOCK_SIZE_M": 128,
        "BLOCK_SIZE_N": 128,
        "BLOCK_SIZE_K": 64,
        "GROUP_SIZE_M": 8,
        "num_stages": 5,
        "num_warps": 16,
        "ms": 0.5364305377006531,
        "min_ms": 0.5364305377006531,
        "max_ms": 0.5364305377006531,
        "compile_time": 2.1184842586517334
    },
    {
        "BLOCK_SIZE_M": 128,
        "BLOCK_SIZE_N": 256,
        "BLOCK_SIZE_K": 32,
        "GROUP_SIZE_M": 8,
        "num_stages": 4,
        "num_warps": 16,
        "ms": 0.5365926027297974,
        "min_ms": 0.5365926027297974,
        "max_ms": 0.5365926027297974,
        "compile_time": 1.910773754119873
    },
    {
        "BLOCK_SIZE_M": 128,
        "BLOCK_SIZE_N": 256,
        "BLOCK_SIZE_K": 32,
        "GROUP_SIZE_M": 8,
        "num_stages": 6,
        "num_warps": 16,
        "ms": 0.5376167297363281,
        "min_ms": 0.5376167297363281,
        "max_ms": 0.5376167297363281,
        "compile_time": 1.9461925029754639
    },
    {
        "BLOCK_SIZE_M": 128,
        "BLOCK_SIZE_N": 256,
        "BLOCK_SIZE_K": 32,
        "GROUP_SIZE_M": 8,
        "num_stages": 7,
        "num_warps": 16,
        "ms": 0.5382060408592224,
        "min_ms": 0.5382060408592224,
        "max_ms": 0.5382060408592224,
        "compile_time": 1.8251688480377197
    },
    {
        "BLOCK_SIZE_M": 128,
        "BLOCK_SIZE_N": 128,
        "BLOCK_SIZE_K": 32,
        "GROUP_SIZE_M": 8,
        "num_stages": 2,
        "num_warps": 4,
        "ms": 0.5403390526771545,
        "min_ms": 0.5403390526771545,
        "max_ms": 0.5403390526771545,
        "compile_time": 2.444983720779419
    },
    {
        "BLOCK_SIZE_M": 128,
        "BLOCK_SIZE_N": 128,
        "BLOCK_SIZE_K": 64,
        "GROUP_SIZE_M": 8,
        "num_stages": 6,
        "num_warps": 16,
        "ms": 0.5413228273391724,
        "min_ms": 0.5413228273391724,
        "max_ms": 0.5413228273391724,
        "compile_time": 1.3163073062896729
    },
    {
        "BLOCK_SIZE_M": 128,
        "BLOCK_SIZE_N": 64,
        "BLOCK_SIZE_K": 128,
        "GROUP_SIZE_M": 8,
        "num_stages": 4,
        "num_warps": 8,
        "ms": 0.5416814684867859,
        "min_ms": 0.5416814684867859,
        "max_ms": 0.5416814684867859,
        "compile_time": 1.3652057647705078
    },
    {
        "BLOCK_SIZE_M": 128,
        "BLOCK_SIZE_N": 128,
        "BLOCK_SIZE_K": 16,
        "GROUP_SIZE_M": 8,
        "num_stages": 3,
        "num_warps": 4,
        "ms": 0.542709469795227,
        "min_ms": 0.542709469795227,
        "max_ms": 0.542709469795227,
        "compile_time": 2.291907787322998
    },
    {
        "BLOCK_SIZE_M": 64,
        "BLOCK_SIZE_N": 256,
        "BLOCK_SIZE_K": 32,
        "GROUP_SIZE_M": 8,
        "num_stages": 3,
        "num_warps": 8,
        "ms": 0.5431799292564392,
        "min_ms": 0.5431799292564392,
        "max_ms": 0.5431799292564392,
        "compile_time": 1.2365617752075195
    },
    {
        "BLOCK_SIZE_M": 64,
        "BLOCK_SIZE_N": 128,
        "BLOCK_SIZE_K": 128,
        "GROUP_SIZE_M": 8,
        "num_stages": 4,
        "num_warps": 8,
        "ms": 0.5446511507034302,
        "min_ms": 0.5446511507034302,
        "max_ms": 0.5446511507034302,
        "compile_time": 1.2772033214569092
    },
    {
        "BLOCK_SIZE_M": 64,
        "BLOCK_SIZE_N": 128,
        "BLOCK_SIZE_K": 64,
        "GROUP_SIZE_M": 8,
        "num_stages": 2,
        "num_warps": 2,
        "ms": 0.5447275042533875,
        "min_ms": 0.5447275042533875,
        "max_ms": 0.5447275042533875,
        "compile_time": 2.648224353790283
    },
    {
        "BLOCK_SIZE_M": 64,
        "BLOCK_SIZE_N": 128,
        "BLOCK_SIZE_K": 16,
        "GROUP_SIZE_M": 8,
        "num_stages": 3,
        "num_warps": 2,
        "ms": 0.5447555184364319,
        "min_ms": 0.5447555184364319,
        "max_ms": 0.5447555184364319,
        "compile_time": 2.1384639739990234
    },
    {
        "BLOCK_SIZE_M": 128,
        "BLOCK_SIZE_N": 64,
        "BLOCK_SIZE_K": 128,
        "GROUP_SIZE_M": 8,
        "num_stages": 3,
        "num_warps": 8,
        "ms": 0.5448788404464722,
        "min_ms": 0.5448788404464722,
        "max_ms": 0.5448788404464722,
        "compile_time": 2.5019783973693848
    },
    {
        "BLOCK_SIZE_M": 64,
        "BLOCK_SIZE_N": 128,
        "BLOCK_SIZE_K": 128,
        "GROUP_SIZE_M": 8,
        "num_stages": 3,
        "num_warps": 4,
        "ms": 0.5455510020256042,
        "min_ms": 0.5455510020256042,
        "max_ms": 0.5455510020256042,
        "compile_time": 2.4987494945526123
    },
    {
        "BLOCK_SIZE_M": 256,
        "BLOCK_SIZE_N": 128,
        "BLOCK_SIZE_K": 32,
        "GROUP_SIZE_M": 8,
        "num_stages": 4,
        "num_warps": 16,
        "ms": 0.5456872582435608,
        "min_ms": 0.5456872582435608,
        "max_ms": 0.5456872582435608,
        "compile_time": 1.2952256202697754
    },
    {
        "BLOCK_SIZE_M": 256,
        "BLOCK_SIZE_N": 128,
        "BLOCK_SIZE_K": 32,
        "GROUP_SIZE_M": 8,
        "num_stages": 3,
        "num_warps": 16,
        "ms": 0.5463858246803284,
        "min_ms": 0.5463858246803284,
        "max_ms": 0.5463858246803284,
        "compile_time": 2.1252658367156982
    },
    {
        "BLOCK_SIZE_M": 64,
        "BLOCK_SIZE_N": 128,
        "BLOCK_SIZE_K": 16,
        "GROUP_SIZE_M": 8,
        "num_stages": 4,
        "num_warps": 4,
        "ms": 0.5480141639709473,
        "min_ms": 0.5480141639709473,
        "max_ms": 0.5480141639709473,
        "compile_time": 1.3008501529693604
    },
    {
        "BLOCK_SIZE_M": 256,
        "BLOCK_SIZE_N": 128,
        "BLOCK_SIZE_K": 32,
        "GROUP_SIZE_M": 8,
        "num_stages": 5,
        "num_warps": 16,
        "ms": 0.5485807657241821,
        "min_ms": 0.5485807657241821,
        "max_ms": 0.5485807657241821,
        "compile_time": 1.2858331203460693
    },
    {
        "BLOCK_SIZE_M": 64,
        "BLOCK_SIZE_N": 256,
        "BLOCK_SIZE_K": 32,
        "GROUP_SIZE_M": 8,
        "num_stages": 2,
        "num_warps": 4,
        "ms": 0.5488072037696838,
        "min_ms": 0.5488072037696838,
        "max_ms": 0.5488072037696838,
        "compile_time": 2.399930477142334
    },
    {
        "BLOCK_SIZE_M": 256,
        "BLOCK_SIZE_N": 64,
        "BLOCK_SIZE_K": 32,
        "GROUP_SIZE_M": 8,
        "num_stages": 2,
        "num_warps": 4,
        "ms": 0.548816978931427,
        "min_ms": 0.548816978931427,
        "max_ms": 0.548816978931427,
        "compile_time": 2.5620458126068115
    },
    {
        "BLOCK_SIZE_M": 256,
        "BLOCK_SIZE_N": 128,
        "BLOCK_SIZE_K": 32,
        "GROUP_SIZE_M": 8,
        "num_stages": 6,
        "num_warps": 16,
        "ms": 0.549329400062561,
        "min_ms": 0.549329400062561,
        "max_ms": 0.549329400062561,
        "compile_time": 1.2996840476989746
    },
    {
        "BLOCK_SIZE_M": 128,
        "BLOCK_SIZE_N": 64,
        "BLOCK_SIZE_K": 64,
        "GROUP_SIZE_M": 8,
        "num_stages": 5,
        "num_warps": 8,
        "ms": 0.5498812794685364,
        "min_ms": 0.5498812794685364,
        "max_ms": 0.5498812794685364,
        "compile_time": 1.5434722900390625
    },
    {
        "BLOCK_SIZE_M": 256,
        "BLOCK_SIZE_N": 128,
        "BLOCK_SIZE_K": 32,
        "GROUP_SIZE_M": 8,
        "num_stages": 7,
        "num_warps": 16,
        "ms": 0.5503061413764954,
        "min_ms": 0.5503061413764954,
        "max_ms": 0.5503061413764954,
        "compile_time": 1.294548511505127
    },
    {
        "BLOCK_SIZE_M": 256,
        "BLOCK_SIZE_N": 128,
        "BLOCK_SIZE_K": 16,
        "GROUP_SIZE_M": 8,
        "num_stages": 6,
        "num_warps": 8,
        "ms": 0.55159991979599,
        "min_ms": 0.55159991979599,
        "max_ms": 0.55159991979599,
        "compile_time": 2.3883397579193115
    },
    {
        "BLOCK_SIZE_M": 256,
        "BLOCK_SIZE_N": 64,
        "BLOCK_SIZE_K": 64,
        "GROUP_SIZE_M": 8,
        "num_stages": 4,
        "num_warps": 16,
        "ms": 0.5516675710678101,
        "min_ms": 0.5516675710678101,
        "max_ms": 0.5516675710678101,
        "compile_time": 1.3306944370269775
    },
    {
        "BLOCK_SIZE_M": 64,
        "BLOCK_SIZE_N": 128,
        "BLOCK_SIZE_K": 64,
        "GROUP_SIZE_M": 8,
        "num_stages": 5,
        "num_warps": 8,
        "ms": 0.5520350337028503,
        "min_ms": 0.5520350337028503,
        "max_ms": 0.5520350337028503,
        "compile_time": 1.2809898853302002
    },
    {
        "BLOCK_SIZE_M": 256,
        "BLOCK_SIZE_N": 128,
        "BLOCK_SIZE_K": 16,
        "GROUP_SIZE_M": 8,
        "num_stages": 7,
        "num_warps": 8,
        "ms": 0.5524121522903442,
        "min_ms": 0.5524121522903442,
        "max_ms": 0.5524121522903442,
        "compile_time": 2.374345541000366
    },
    {
        "BLOCK_SIZE_M": 64,
        "BLOCK_SIZE_N": 128,
        "BLOCK_SIZE_K": 16,
        "GROUP_SIZE_M": 8,
        "num_stages": 6,
        "num_warps": 4,
        "ms": 0.5527431964874268,
        "min_ms": 0.5527431964874268,
        "max_ms": 0.5527431964874268,
        "compile_time": 1.3046412467956543
    },
    {
        "BLOCK_SIZE_M": 64,
        "BLOCK_SIZE_N": 128,
        "BLOCK_SIZE_K": 16,
        "GROUP_SIZE_M": 8,
        "num_stages": 7,
        "num_warps": 4,
        "ms": 0.5528774261474609,
        "min_ms": 0.5528774261474609,
        "max_ms": 0.5528774261474609,
        "compile_time": 1.2938401699066162
    },
    {
        "BLOCK_SIZE_M": 64,
        "BLOCK_SIZE_N": 128,
        "BLOCK_SIZE_K": 16,
        "GROUP_SIZE_M": 8,
        "num_stages": 5,
        "num_warps": 4,
        "ms": 0.5533607602119446,
        "min_ms": 0.5533607602119446,
        "max_ms": 0.5533607602119446,
        "compile_time": 1.294823408126831
    },
    {
        "BLOCK_SIZE_M": 128,
        "BLOCK_SIZE_N": 128,
        "BLOCK_SIZE_K": 16,
        "GROUP_SIZE_M": 8,
        "num_stages": 8,
        "num_warps": 8,
        "ms": 0.553380012512207,
        "min_ms": 0.553380012512207,
        "max_ms": 0.553380012512207,
        "compile_time": 1.3087613582611084
    },
    {
        "BLOCK_SIZE_M": 64,
        "BLOCK_SIZE_N": 128,
        "BLOCK_SIZE_K": 64,
        "GROUP_SIZE_M": 8,
        "num_stages": 6,
        "num_warps": 8,
        "ms": 0.5535553097724915,
        "min_ms": 0.5535553097724915,
        "max_ms": 0.5535553097724915,
        "compile_time": 1.2849431037902832
    },
    {
        "BLOCK_SIZE_M": 128,
        "BLOCK_SIZE_N": 64,
        "BLOCK_SIZE_K": 64,
        "GROUP_SIZE_M": 8,
        "num_stages": 2,
        "num_warps": 2,
        "ms": 0.553942084312439,
        "min_ms": 0.553942084312439,
        "max_ms": 0.553942084312439,
        "compile_time": 1.5708398818969727
    },
    {
        "BLOCK_SIZE_M": 64,
        "BLOCK_SIZE_N": 128,
        "BLOCK_SIZE_K": 32,
        "GROUP_SIZE_M": 8,
        "num_stages": 6,
        "num_warps": 2,
        "ms": 0.5539430379867554,
        "min_ms": 0.5539430379867554,
        "max_ms": 0.5539430379867554,
        "compile_time": 2.602581024169922
    },
    {
        "BLOCK_SIZE_M": 128,
        "BLOCK_SIZE_N": 64,
        "BLOCK_SIZE_K": 64,
        "GROUP_SIZE_M": 8,
        "num_stages": 6,
        "num_warps": 8,
        "ms": 0.5542855262756348,
        "min_ms": 0.5542855262756348,
        "max_ms": 0.5542855262756348,
        "compile_time": 1.546877145767212
    },
    {
        "BLOCK_SIZE_M": 256,
        "BLOCK_SIZE_N": 128,
        "BLOCK_SIZE_K": 16,
        "GROUP_SIZE_M": 8,
        "num_stages": 8,
        "num_warps": 8,
        "ms": 0.5543729066848755,
        "min_ms": 0.5543729066848755,
        "max_ms": 0.5543729066848755,
        "compile_time": 2.4103198051452637
    },
    {
        "BLOCK_SIZE_M": 64,
        "BLOCK_SIZE_N": 128,
        "BLOCK_SIZE_K": 16,
        "GROUP_SIZE_M": 8,
        "num_stages": 3,
        "num_warps": 4,
        "ms": 0.554601788520813,
        "min_ms": 0.554601788520813,
        "max_ms": 0.554601788520813,
        "compile_time": 1.2868397235870361
    },
    {
        "BLOCK_SIZE_M": 128,
        "BLOCK_SIZE_N": 64,
        "BLOCK_SIZE_K": 32,
        "GROUP_SIZE_M": 8,
        "num_stages": 2,
        "num_warps": 2,
        "ms": 0.5547151565551758,
        "min_ms": 0.5547151565551758,
        "max_ms": 0.5547151565551758,
        "compile_time": 1.5789868831634521
    },
    {
        "BLOCK_SIZE_M": 64,
        "BLOCK_SIZE_N": 128,
        "BLOCK_SIZE_K": 128,
        "GROUP_SIZE_M": 8,
        "num_stages": 3,
        "num_warps": 8,
        "ms": 0.554894745349884,
        "min_ms": 0.554894745349884,
        "max_ms": 0.554894745349884,
        "compile_time": 1.2683844566345215
    },
    {
        "BLOCK_SIZE_M": 128,
        "BLOCK_SIZE_N": 64,
        "BLOCK_SIZE_K": 64,
        "GROUP_SIZE_M": 8,
        "num_stages": 7,
        "num_warps": 8,
        "ms": 0.5561264753341675,
        "min_ms": 0.5561264753341675,
        "max_ms": 0.5561264753341675,
        "compile_time": 1.5940275192260742
    },
    {
        "BLOCK_SIZE_M": 64,
        "BLOCK_SIZE_N": 512,
        "BLOCK_SIZE_K": 16,
        "GROUP_SIZE_M": 8,
        "num_stages": 3,
        "num_warps": 8,
        "ms": 0.5564526915550232,
        "min_ms": 0.5564526915550232,
        "max_ms": 0.5564526915550232,
        "compile_time": 2.138488292694092
    },
    {
        "BLOCK_SIZE_M": 128,
        "BLOCK_SIZE_N": 128,
        "BLOCK_SIZE_K": 16,
        "GROUP_SIZE_M": 8,
        "num_stages": 4,
        "num_warps": 8,
        "ms": 0.557548463344574,
        "min_ms": 0.557548463344574,
        "max_ms": 0.557548463344574,
        "compile_time": 1.2915000915527344
    },
    {
        "BLOCK_SIZE_M": 64,
        "BLOCK_SIZE_N": 128,
        "BLOCK_SIZE_K": 32,
        "GROUP_SIZE_M": 8,
        "num_stages": 7,
        "num_warps": 2,
        "ms": 0.5582315921783447,
        "min_ms": 0.5582315921783447,
        "max_ms": 0.5582315921783447,
        "compile_time": 2.6782026290893555
    },
    {
        "BLOCK_SIZE_M": 64,
        "BLOCK_SIZE_N": 128,
        "BLOCK_SIZE_K": 16,
        "GROUP_SIZE_M": 8,
        "num_stages": 8,
        "num_warps": 4,
        "ms": 0.5583493709564209,
        "min_ms": 0.5583493709564209,
        "max_ms": 0.5583493709564209,
        "compile_time": 1.2966084480285645
    },
    {
        "BLOCK_SIZE_M": 64,
        "BLOCK_SIZE_N": 128,
        "BLOCK_SIZE_K": 64,
        "GROUP_SIZE_M": 8,
        "num_stages": 3,
        "num_warps": 2,
        "ms": 0.5585047006607056,
        "min_ms": 0.5585047006607056,
        "max_ms": 0.5585047006607056,
        "compile_time": 2.770768642425537
    },
    {
        "BLOCK_SIZE_M": 256,
        "BLOCK_SIZE_N": 64,
        "BLOCK_SIZE_K": 64,
        "GROUP_SIZE_M": 8,
        "num_stages": 3,
        "num_warps": 16,
        "ms": 0.5589714050292969,
        "min_ms": 0.5589714050292969,
        "max_ms": 0.5589714050292969,
        "compile_time": 1.3287277221679688
    },
    {
        "BLOCK_SIZE_M": 64,
        "BLOCK_SIZE_N": 256,
        "BLOCK_SIZE_K": 64,
        "GROUP_SIZE_M": 8,
        "num_stages": 4,
        "num_warps": 4,
        "ms": 0.5603364109992981,
        "min_ms": 0.5603364109992981,
        "max_ms": 0.5603364109992981,
        "compile_time": 2.788987636566162
    },
    {
        "BLOCK_SIZE_M": 128,
        "BLOCK_SIZE_N": 128,
        "BLOCK_SIZE_K": 16,
        "GROUP_SIZE_M": 8,
        "num_stages": 5,
        "num_warps": 8,
        "ms": 0.5604681372642517,
        "min_ms": 0.5604681372642517,
        "max_ms": 0.5604681372642517,
        "compile_time": 1.2967100143432617
    },
    {
        "BLOCK_SIZE_M": 128,
        "BLOCK_SIZE_N": 128,
        "BLOCK_SIZE_K": 16,
        "GROUP_SIZE_M": 8,
        "num_stages": 7,
        "num_warps": 8,
        "ms": 0.5606511235237122,
        "min_ms": 0.5606511235237122,
        "max_ms": 0.5606511235237122,
        "compile_time": 1.317413091659546
    },
    {
        "BLOCK_SIZE_M": 64,
        "BLOCK_SIZE_N": 128,
        "BLOCK_SIZE_K": 64,
        "GROUP_SIZE_M": 8,
        "num_stages": 7,
        "num_warps": 8,
        "ms": 0.5606576800346375,
        "min_ms": 0.5606576800346375,
        "max_ms": 0.5606576800346375,
        "compile_time": 1.2752652168273926
    },
    {
        "BLOCK_SIZE_M": 64,
        "BLOCK_SIZE_N": 256,
        "BLOCK_SIZE_K": 64,
        "GROUP_SIZE_M": 8,
        "num_stages": 3,
        "num_warps": 16,
        "ms": 0.5612846612930298,
        "min_ms": 0.5612846612930298,
        "max_ms": 0.5612846612930298,
        "compile_time": 1.8715407848358154
    },
    {
        "BLOCK_SIZE_M": 64,
        "BLOCK_SIZE_N": 256,
        "BLOCK_SIZE_K": 64,
        "GROUP_SIZE_M": 8,
        "num_stages": 5,
        "num_warps": 4,
        "ms": 0.5613844990730286,
        "min_ms": 0.5613844990730286,
        "max_ms": 0.5613844990730286,
        "compile_time": 2.8772542476654053
    },
    {
        "BLOCK_SIZE_M": 128,
        "BLOCK_SIZE_N": 64,
        "BLOCK_SIZE_K": 128,
        "GROUP_SIZE_M": 8,
        "num_stages": 2,
        "num_warps": 4,
        "ms": 0.5617149472236633,
        "min_ms": 0.5617149472236633,
        "max_ms": 0.5617149472236633,
        "compile_time": 1.5066251754760742
    },
    {
        "BLOCK_SIZE_M": 64,
        "BLOCK_SIZE_N": 128,
        "BLOCK_SIZE_K": 128,
        "GROUP_SIZE_M": 8,
        "num_stages": 2,
        "num_warps": 4,
        "ms": 0.562512993812561,
        "min_ms": 0.562512993812561,
        "max_ms": 0.562512993812561,
        "compile_time": 2.309340476989746
    },
    {
        "BLOCK_SIZE_M": 256,
        "BLOCK_SIZE_N": 128,
        "BLOCK_SIZE_K": 64,
        "GROUP_SIZE_M": 8,
        "num_stages": 3,
        "num_warps": 16,
        "ms": 0.563288152217865,
        "min_ms": 0.563288152217865,
        "max_ms": 0.563288152217865,
        "compile_time": 1.290628433227539
    },
    {
        "BLOCK_SIZE_M": 128,
        "BLOCK_SIZE_N": 128,
        "BLOCK_SIZE_K": 16,
        "GROUP_SIZE_M": 8,
        "num_stages": 6,
        "num_warps": 8,
        "ms": 0.5633907318115234,
        "min_ms": 0.5633907318115234,
        "max_ms": 0.5633907318115234,
        "compile_time": 1.305866003036499
    },
    {
        "BLOCK_SIZE_M": 64,
        "BLOCK_SIZE_N": 256,
        "BLOCK_SIZE_K": 64,
        "GROUP_SIZE_M": 8,
        "num_stages": 4,
        "num_warps": 16,
        "ms": 0.5642098188400269,
        "min_ms": 0.5642098188400269,
        "max_ms": 0.5642098188400269,
        "compile_time": 1.2587528228759766
    },
    {
        "BLOCK_SIZE_M": 256,
        "BLOCK_SIZE_N": 128,
        "BLOCK_SIZE_K": 64,
        "GROUP_SIZE_M": 8,
        "num_stages": 4,
        "num_warps": 16,
        "ms": 0.5646882057189941,
        "min_ms": 0.5646882057189941,
        "max_ms": 0.5646882057189941,
        "compile_time": 2.3666739463806152
    },
    {
        "BLOCK_SIZE_M": 64,
        "BLOCK_SIZE_N": 256,
        "BLOCK_SIZE_K": 64,
        "GROUP_SIZE_M": 8,
        "num_stages": 5,
        "num_warps": 16,
        "ms": 0.5657747983932495,
        "min_ms": 0.5657747983932495,
        "max_ms": 0.5657747983932495,
        "compile_time": 1.265455961227417
    },
    {
        "BLOCK_SIZE_M": 256,
        "BLOCK_SIZE_N": 64,
        "BLOCK_SIZE_K": 64,
        "GROUP_SIZE_M": 8,
        "num_stages": 5,
        "num_warps": 16,
        "ms": 0.5658671259880066,
        "min_ms": 0.5658671259880066,
        "max_ms": 0.5658671259880066,
        "compile_time": 1.3569660186767578
    },
    {
        "BLOCK_SIZE_M": 64,
        "BLOCK_SIZE_N": 128,
        "BLOCK_SIZE_K": 16,
        "GROUP_SIZE_M": 8,
        "num_stages": 8,
        "num_warps": 2,
        "ms": 0.5658823251724243,
        "min_ms": 0.5658823251724243,
        "max_ms": 0.5658823251724243,
        "compile_time": 2.263794422149658
    },
    {
        "BLOCK_SIZE_M": 256,
        "BLOCK_SIZE_N": 128,
        "BLOCK_SIZE_K": 16,
        "GROUP_SIZE_M": 8,
        "num_stages": 4,
        "num_warps": 8,
        "ms": 0.56592857837677,
        "min_ms": 0.56592857837677,
        "max_ms": 0.56592857837677,
        "compile_time": 1.3715431690216064
    },
    {
        "BLOCK_SIZE_M": 64,
        "BLOCK_SIZE_N": 128,
        "BLOCK_SIZE_K": 32,
        "GROUP_SIZE_M": 8,
        "num_stages": 4,
        "num_warps": 8,
        "ms": 0.567280113697052,
        "min_ms": 0.567280113697052,
        "max_ms": 0.567280113697052,
        "compile_time": 1.2962608337402344
    },
    {
        "BLOCK_SIZE_M": 128,
        "BLOCK_SIZE_N": 64,
        "BLOCK_SIZE_K": 32,
        "GROUP_SIZE_M": 8,
        "num_stages": 5,
        "num_warps": 8,
        "ms": 0.5673067569732666,
        "min_ms": 0.5673067569732666,
        "max_ms": 0.5673067569732666,
        "compile_time": 1.577622652053833
    },
    {
        "BLOCK_SIZE_M": 256,
        "BLOCK_SIZE_N": 128,
        "BLOCK_SIZE_K": 16,
        "GROUP_SIZE_M": 8,
        "num_stages": 5,
        "num_warps": 8,
        "ms": 0.5676306486129761,
        "min_ms": 0.5676306486129761,
        "max_ms": 0.5676306486129761,
        "compile_time": 1.360860824584961
    },
    {
        "BLOCK_SIZE_M": 64,
        "BLOCK_SIZE_N": 128,
        "BLOCK_SIZE_K": 32,
        "GROUP_SIZE_M": 8,
        "num_stages": 5,
        "num_warps": 8,
        "ms": 0.5678390860557556,
        "min_ms": 0.5678390860557556,
        "max_ms": 0.5678390860557556,
        "compile_time": 1.8411388397216797
    },
    {
        "BLOCK_SIZE_M": 128,
        "BLOCK_SIZE_N": 64,
        "BLOCK_SIZE_K": 32,
        "GROUP_SIZE_M": 8,
        "num_stages": 4,
        "num_warps": 8,
        "ms": 0.5687930583953857,
        "min_ms": 0.5687930583953857,
        "max_ms": 0.5687930583953857,
        "compile_time": 1.7565910816192627
    },
    {
        "BLOCK_SIZE_M": 128,
        "BLOCK_SIZE_N": 64,
        "BLOCK_SIZE_K": 32,
        "GROUP_SIZE_M": 8,
        "num_stages": 6,
        "num_warps": 8,
        "ms": 0.5693985819816589,
        "min_ms": 0.5693985819816589,
        "max_ms": 0.5693985819816589,
        "compile_time": 1.569045066833496
    },
    {
        "BLOCK_SIZE_M": 128,
        "BLOCK_SIZE_N": 256,
        "BLOCK_SIZE_K": 16,
        "GROUP_SIZE_M": 8,
        "num_stages": 3,
        "num_warps": 8,
        "ms": 0.5701771974563599,
        "min_ms": 0.5701771974563599,
        "max_ms": 0.5701771974563599,
        "compile_time": 2.9958598613739014
    },
    {
        "BLOCK_SIZE_M": 128,
        "BLOCK_SIZE_N": 128,
        "BLOCK_SIZE_K": 16,
        "GROUP_SIZE_M": 8,
        "num_stages": 3,
        "num_warps": 8,
        "ms": 0.5714668035507202,
        "min_ms": 0.5714668035507202,
        "max_ms": 0.5714668035507202,
        "compile_time": 1.2860572338104248
    },
    {
        "BLOCK_SIZE_M": 64,
        "BLOCK_SIZE_N": 128,
        "BLOCK_SIZE_K": 32,
        "GROUP_SIZE_M": 8,
        "num_stages": 7,
        "num_warps": 8,
        "ms": 0.5717135667800903,
        "min_ms": 0.5717135667800903,
        "max_ms": 0.5717135667800903,
        "compile_time": 1.3435778617858887
    },
    {
        "BLOCK_SIZE_M": 128,
        "BLOCK_SIZE_N": 64,
        "BLOCK_SIZE_K": 32,
        "GROUP_SIZE_M": 8,
        "num_stages": 7,
        "num_warps": 8,
        "ms": 0.5719960331916809,
        "min_ms": 0.5719960331916809,
        "max_ms": 0.5719960331916809,
        "compile_time": 1.5853559970855713
    },
    {
        "BLOCK_SIZE_M": 64,
        "BLOCK_SIZE_N": 128,
        "BLOCK_SIZE_K": 32,
        "GROUP_SIZE_M": 8,
        "num_stages": 6,
        "num_warps": 8,
        "ms": 0.5720378756523132,
        "min_ms": 0.5720378756523132,
        "max_ms": 0.5720378756523132,
        "compile_time": 1.3327510356903076
    },
    {
        "BLOCK_SIZE_M": 128,
        "BLOCK_SIZE_N": 256,
        "BLOCK_SIZE_K": 64,
        "GROUP_SIZE_M": 8,
        "num_stages": 3,
        "num_warps": 16,
        "ms": 0.5726659893989563,
        "min_ms": 0.5726659893989563,
        "max_ms": 0.5726659893989563,
        "compile_time": 1.2821555137634277
    },
    {
        "BLOCK_SIZE_M": 128,
        "BLOCK_SIZE_N": 256,
        "BLOCK_SIZE_K": 64,
        "GROUP_SIZE_M": 8,
        "num_stages": 4,
        "num_warps": 16,
        "ms": 0.5735386610031128,
        "min_ms": 0.5735386610031128,
        "max_ms": 0.5735386610031128,
        "compile_time": 1.8245062828063965
    },
    {
        "BLOCK_SIZE_M": 128,
        "BLOCK_SIZE_N": 64,
        "BLOCK_SIZE_K": 128,
        "GROUP_SIZE_M": 8,
        "num_stages": 2,
        "num_warps": 8,
        "ms": 0.5745202302932739,
        "min_ms": 0.5745202302932739,
        "max_ms": 0.5745202302932739,
        "compile_time": 1.5498826503753662
    },
    {
        "BLOCK_SIZE_M": 64,
        "BLOCK_SIZE_N": 128,
        "BLOCK_SIZE_K": 32,
        "GROUP_SIZE_M": 8,
        "num_stages": 3,
        "num_warps": 8,
        "ms": 0.5757921934127808,
        "min_ms": 0.5757921934127808,
        "max_ms": 0.5757921934127808,
        "compile_time": 1.2704541683197021
    },
    {
        "BLOCK_SIZE_M": 256,
        "BLOCK_SIZE_N": 64,
        "BLOCK_SIZE_K": 32,
        "GROUP_SIZE_M": 8,
        "num_stages": 3,
        "num_warps": 8,
        "ms": 0.57645583152771,
        "min_ms": 0.57645583152771,
        "max_ms": 0.57645583152771,
        "compile_time": 1.323986291885376
    },
    {
        "BLOCK_SIZE_M": 128,
        "BLOCK_SIZE_N": 64,
        "BLOCK_SIZE_K": 32,
        "GROUP_SIZE_M": 8,
        "num_stages": 3,
        "num_warps": 8,
        "ms": 0.5800650119781494,
        "min_ms": 0.5800650119781494,
        "max_ms": 0.5800650119781494,
        "compile_time": 1.5666682720184326
    },
    {
        "BLOCK_SIZE_M": 64,
        "BLOCK_SIZE_N": 128,
        "BLOCK_SIZE_K": 128,
        "GROUP_SIZE_M": 8,
        "num_stages": 2,
        "num_warps": 8,
        "ms": 0.5805591940879822,
        "min_ms": 0.5805591940879822,
        "max_ms": 0.5805591940879822,
        "compile_time": 1.2707562446594238
    },
    {
        "BLOCK_SIZE_M": 128,
        "BLOCK_SIZE_N": 64,
        "BLOCK_SIZE_K": 64,
        "GROUP_SIZE_M": 8,
        "num_stages": 4,
        "num_warps": 2,
        "ms": 0.5812128782272339,
        "min_ms": 0.5812128782272339,
        "max_ms": 0.5812128782272339,
        "compile_time": 3.1433122158050537
    },
    {
        "BLOCK_SIZE_M": 64,
        "BLOCK_SIZE_N": 128,
        "BLOCK_SIZE_K": 32,
        "GROUP_SIZE_M": 8,
        "num_stages": 2,
        "num_warps": 2,
        "ms": 0.5819154977798462,
        "min_ms": 0.5819154977798462,
        "max_ms": 0.5819154977798462,
        "compile_time": 2.343498468399048
    },
    {
        "BLOCK_SIZE_M": 64,
        "BLOCK_SIZE_N": 128,
        "BLOCK_SIZE_K": 32,
        "GROUP_SIZE_M": 8,
        "num_stages": 2,
        "num_warps": 4,
        "ms": 0.5849596858024597,
        "min_ms": 0.5849596858024597,
        "max_ms": 0.5849596858024597,
        "compile_time": 1.8515121936798096
    },
    {
        "BLOCK_SIZE_M": 128,
        "BLOCK_SIZE_N": 64,
        "BLOCK_SIZE_K": 32,
        "GROUP_SIZE_M": 8,
        "num_stages": 2,
        "num_warps": 4,
        "ms": 0.5865271091461182,
        "min_ms": 0.5865271091461182,
        "max_ms": 0.5865271091461182,
        "compile_time": 1.571894645690918
    },
    {
        "BLOCK_SIZE_M": 256,
        "BLOCK_SIZE_N": 64,
        "BLOCK_SIZE_K": 64,
        "GROUP_SIZE_M": 8,
        "num_stages": 1,
        "num_warps": 4,
        "ms": 0.5876141786575317,
        "min_ms": 0.5876141786575317,
        "max_ms": 0.5876141786575317,
        "compile_time": 2.636767625808716
    },
    {
        "BLOCK_SIZE_M": 128,
        "BLOCK_SIZE_N": 128,
        "BLOCK_SIZE_K": 128,
        "GROUP_SIZE_M": 8,
        "num_stages": 2,
        "num_warps": 8,
        "ms": 0.5953797101974487,
        "min_ms": 0.5953797101974487,
        "max_ms": 0.5953797101974487,
        "compile_time": 1.2800400257110596
    },
    {
        "BLOCK_SIZE_M": 256,
        "BLOCK_SIZE_N": 128,
        "BLOCK_SIZE_K": 16,
        "GROUP_SIZE_M": 8,
        "num_stages": 3,
        "num_warps": 8,
        "ms": 0.5971649289131165,
        "min_ms": 0.5971649289131165,
        "max_ms": 0.5971649289131165,
        "compile_time": 1.301950216293335
    },
    {
        "BLOCK_SIZE_M": 128,
        "BLOCK_SIZE_N": 128,
        "BLOCK_SIZE_K": 32,
        "GROUP_SIZE_M": 8,
        "num_stages": 5,
        "num_warps": 16,
        "ms": 0.6006758213043213,
        "min_ms": 0.6006758213043213,
        "max_ms": 0.6006758213043213,
        "compile_time": 1.277592658996582
    },
    {
        "BLOCK_SIZE_M": 64,
        "BLOCK_SIZE_N": 256,
        "BLOCK_SIZE_K": 16,
        "GROUP_SIZE_M": 8,
        "num_stages": 3,
        "num_warps": 8,
        "ms": 0.6017190217971802,
        "min_ms": 0.6017190217971802,
        "max_ms": 0.6017190217971802,
        "compile_time": 1.2427737712860107
    },
    {
        "BLOCK_SIZE_M": 128,
        "BLOCK_SIZE_N": 128,
        "BLOCK_SIZE_K": 32,
        "GROUP_SIZE_M": 8,
        "num_stages": 7,
        "num_warps": 16,
        "ms": 0.6021537184715271,
        "min_ms": 0.6021537184715271,
        "max_ms": 0.6021537184715271,
        "compile_time": 2.350235939025879
    },
    {
        "BLOCK_SIZE_M": 64,
        "BLOCK_SIZE_N": 128,
        "BLOCK_SIZE_K": 32,
        "GROUP_SIZE_M": 8,
        "num_stages": 8,
        "num_warps": 8,
        "ms": 0.60243159532547,
        "min_ms": 0.60243159532547,
        "max_ms": 0.60243159532547,
        "compile_time": 1.336855411529541
    },
    {
        "BLOCK_SIZE_M": 64,
        "BLOCK_SIZE_N": 64,
        "BLOCK_SIZE_K": 64,
        "GROUP_SIZE_M": 8,
        "num_stages": 4,
        "num_warps": 2,
        "ms": 0.6027324795722961,
        "min_ms": 0.6027324795722961,
        "max_ms": 0.6027324795722961,
        "compile_time": 2.2375316619873047
    },
    {
        "BLOCK_SIZE_M": 128,
        "BLOCK_SIZE_N": 128,
        "BLOCK_SIZE_K": 32,
        "GROUP_SIZE_M": 8,
        "num_stages": 6,
        "num_warps": 16,
        "ms": 0.6028720140457153,
        "min_ms": 0.6028720140457153,
        "max_ms": 0.6028720140457153,
        "compile_time": 1.2859055995941162
    },
    {
        "BLOCK_SIZE_M": 64,
        "BLOCK_SIZE_N": 256,
        "BLOCK_SIZE_K": 16,
        "GROUP_SIZE_M": 8,
        "num_stages": 5,
        "num_warps": 8,
        "ms": 0.6035455465316772,
        "min_ms": 0.6035455465316772,
        "max_ms": 0.6035455465316772,
        "compile_time": 1.2547929286956787
    },
    {
        "BLOCK_SIZE_M": 64,
        "BLOCK_SIZE_N": 256,
        "BLOCK_SIZE_K": 16,
        "GROUP_SIZE_M": 8,
        "num_stages": 4,
        "num_warps": 8,
        "ms": 0.60404372215271,
        "min_ms": 0.60404372215271,
        "max_ms": 0.60404372215271,
        "compile_time": 1.2627787590026855
    },
    {
        "BLOCK_SIZE_M": 128,
        "BLOCK_SIZE_N": 128,
        "BLOCK_SIZE_K": 32,
        "GROUP_SIZE_M": 8,
        "num_stages": 4,
        "num_warps": 16,
        "ms": 0.6050350666046143,
        "min_ms": 0.6050350666046143,
        "max_ms": 0.6050350666046143,
        "compile_time": 1.2568566799163818
    },
    {
        "BLOCK_SIZE_M": 128,
        "BLOCK_SIZE_N": 64,
        "BLOCK_SIZE_K": 32,
        "GROUP_SIZE_M": 8,
        "num_stages": 8,
        "num_warps": 8,
        "ms": 0.605604887008667,
        "min_ms": 0.605604887008667,
        "max_ms": 0.605604887008667,
        "compile_time": 1.563798189163208
    },
    {
        "BLOCK_SIZE_M": 128,
        "BLOCK_SIZE_N": 128,
        "BLOCK_SIZE_K": 32,
        "GROUP_SIZE_M": 8,
        "num_stages": 8,
        "num_warps": 16,
        "ms": 0.6059092283248901,
        "min_ms": 0.6059092283248901,
        "max_ms": 0.6059092283248901,
        "compile_time": 1.5430805683135986
    },
    {
        "BLOCK_SIZE_M": 128,
        "BLOCK_SIZE_N": 128,
        "BLOCK_SIZE_K": 32,
        "GROUP_SIZE_M": 8,
        "num_stages": 3,
        "num_warps": 16,
        "ms": 0.606004536151886,
        "min_ms": 0.606004536151886,
        "max_ms": 0.606004536151886,
        "compile_time": 1.271073818206787
    },
    {
        "BLOCK_SIZE_M": 64,
        "BLOCK_SIZE_N": 256,
        "BLOCK_SIZE_K": 16,
        "GROUP_SIZE_M": 8,
        "num_stages": 6,
        "num_warps": 8,
        "ms": 0.6062741279602051,
        "min_ms": 0.6062741279602051,
        "max_ms": 0.6062741279602051,
        "compile_time": 1.257627010345459
    },
    {
        "BLOCK_SIZE_M": 64,
        "BLOCK_SIZE_N": 256,
        "BLOCK_SIZE_K": 16,
        "GROUP_SIZE_M": 8,
        "num_stages": 7,
        "num_warps": 8,
        "ms": 0.6066291332244873,
        "min_ms": 0.6066291332244873,
        "max_ms": 0.6066291332244873,
        "compile_time": 1.2705247402191162
    },
    {
        "BLOCK_SIZE_M": 128,
        "BLOCK_SIZE_N": 128,
        "BLOCK_SIZE_K": 128,
        "GROUP_SIZE_M": 8,
        "num_stages": 1,
        "num_warps": 4,
        "ms": 0.6082358360290527,
        "min_ms": 0.6082358360290527,
        "max_ms": 0.6082358360290527,
        "compile_time": 2.9303388595581055
    },
    {
        "BLOCK_SIZE_M": 64,
        "BLOCK_SIZE_N": 64,
        "BLOCK_SIZE_K": 32,
        "GROUP_SIZE_M": 8,
        "num_stages": 4,
        "num_warps": 2,
        "ms": 0.609618067741394,
        "min_ms": 0.609618067741394,
        "max_ms": 0.609618067741394,
        "compile_time": 2.031280517578125
    },
    {
        "BLOCK_SIZE_M": 256,
        "BLOCK_SIZE_N": 128,
        "BLOCK_SIZE_K": 32,
        "GROUP_SIZE_M": 8,
        "num_stages": 2,
        "num_warps": 8,
        "ms": 0.6098728179931641,
        "min_ms": 0.6098728179931641,
        "max_ms": 0.6098728179931641,
        "compile_time": 2.5012152194976807
    },
    {
        "BLOCK_SIZE_M": 64,
        "BLOCK_SIZE_N": 256,
        "BLOCK_SIZE_K": 16,
        "GROUP_SIZE_M": 8,
        "num_stages": 8,
        "num_warps": 8,
        "ms": 0.6099525690078735,
        "min_ms": 0.6099525690078735,
        "max_ms": 0.6099525690078735,
        "compile_time": 1.269392967224121
    },
    {
        "BLOCK_SIZE_M": 128,
        "BLOCK_SIZE_N": 256,
        "BLOCK_SIZE_K": 32,
        "GROUP_SIZE_M": 8,
        "num_stages": 2,
        "num_warps": 8,
        "ms": 0.6110450029373169,
        "min_ms": 0.6110450029373169,
        "max_ms": 0.6110450029373169,
        "compile_time": 1.8739893436431885
    },
    {
        "BLOCK_SIZE_M": 256,
        "BLOCK_SIZE_N": 128,
        "BLOCK_SIZE_K": 64,
        "GROUP_SIZE_M": 8,
        "num_stages": 2,
        "num_warps": 16,
        "ms": 0.6116548776626587,
        "min_ms": 0.6116548776626587,
        "max_ms": 0.6116548776626587,
        "compile_time": 2.280188798904419
    },
    {
        "BLOCK_SIZE_M": 64,
        "BLOCK_SIZE_N": 64,
        "BLOCK_SIZE_K": 64,
        "GROUP_SIZE_M": 8,
        "num_stages": 4,
        "num_warps": 4,
        "ms": 0.6116604804992676,
        "min_ms": 0.6116604804992676,
        "max_ms": 0.6116604804992676,
        "compile_time": 1.3179240226745605
    },
    {
        "BLOCK_SIZE_M": 64,
        "BLOCK_SIZE_N": 64,
        "BLOCK_SIZE_K": 32,
        "GROUP_SIZE_M": 8,
        "num_stages": 7,
        "num_warps": 2,
        "ms": 0.6116815805435181,
        "min_ms": 0.6116815805435181,
        "max_ms": 0.6116815805435181,
        "compile_time": 2.1274213790893555
    },
    {
        "BLOCK_SIZE_M": 64,
        "BLOCK_SIZE_N": 64,
        "BLOCK_SIZE_K": 32,
        "GROUP_SIZE_M": 8,
        "num_stages": 5,
        "num_warps": 2,
        "ms": 0.6118729114532471,
        "min_ms": 0.6118729114532471,
        "max_ms": 0.6118729114532471,
        "compile_time": 2.0639538764953613
    },
    {
        "BLOCK_SIZE_M": 64,
        "BLOCK_SIZE_N": 64,
        "BLOCK_SIZE_K": 32,
        "GROUP_SIZE_M": 8,
        "num_stages": 6,
        "num_warps": 2,
        "ms": 0.613336980342865,
        "min_ms": 0.613336980342865,
        "max_ms": 0.613336980342865,
        "compile_time": 2.093518018722534
    },
    {
        "BLOCK_SIZE_M": 64,
        "BLOCK_SIZE_N": 512,
        "BLOCK_SIZE_K": 16,
        "GROUP_SIZE_M": 8,
        "num_stages": 4,
        "num_warps": 16,
        "ms": 0.6137377619743347,
        "min_ms": 0.6137377619743347,
        "max_ms": 0.6137377619743347,
        "compile_time": 1.2357144355773926
    },
    {
        "BLOCK_SIZE_M": 64,
        "BLOCK_SIZE_N": 512,
        "BLOCK_SIZE_K": 16,
        "GROUP_SIZE_M": 8,
        "num_stages": 8,
        "num_warps": 16,
        "ms": 0.6151108741760254,
        "min_ms": 0.6151108741760254,
        "max_ms": 0.6151108741760254,
        "compile_time": 1.2431845664978027
    },
    {
        "BLOCK_SIZE_M": 64,
        "BLOCK_SIZE_N": 64,
        "BLOCK_SIZE_K": 64,
        "GROUP_SIZE_M": 8,
        "num_stages": 3,
        "num_warps": 2,
        "ms": 0.6152104139328003,
        "min_ms": 0.6152104139328003,
        "max_ms": 0.6152104139328003,
        "compile_time": 2.179727792739868
    },
    {
        "BLOCK_SIZE_M": 64,
        "BLOCK_SIZE_N": 512,
        "BLOCK_SIZE_K": 16,
        "GROUP_SIZE_M": 8,
        "num_stages": 7,
        "num_warps": 16,
        "ms": 0.6158520579338074,
        "min_ms": 0.6158520579338074,
        "max_ms": 0.6158520579338074,
        "compile_time": 1.2433490753173828
    },
    {
        "BLOCK_SIZE_M": 64,
        "BLOCK_SIZE_N": 64,
        "BLOCK_SIZE_K": 64,
        "GROUP_SIZE_M": 8,
        "num_stages": 5,
        "num_warps": 4,
        "ms": 0.616873562335968,
        "min_ms": 0.616873562335968,
        "max_ms": 0.616873562335968,
        "compile_time": 1.335575819015503
    },
    {
        "BLOCK_SIZE_M": 64,
        "BLOCK_SIZE_N": 64,
        "BLOCK_SIZE_K": 64,
        "GROUP_SIZE_M": 8,
        "num_stages": 3,
        "num_warps": 4,
        "ms": 0.6180535554885864,
        "min_ms": 0.6180535554885864,
        "max_ms": 0.6180535554885864,
        "compile_time": 1.2980749607086182
    },
    {
        "BLOCK_SIZE_M": 64,
        "BLOCK_SIZE_N": 64,
        "BLOCK_SIZE_K": 64,
        "GROUP_SIZE_M": 8,
        "num_stages": 6,
        "num_warps": 4,
        "ms": 0.6183232665061951,
        "min_ms": 0.6183232665061951,
        "max_ms": 0.6183232665061951,
        "compile_time": 1.3345301151275635
    },
    {
        "BLOCK_SIZE_M": 64,
        "BLOCK_SIZE_N": 64,
        "BLOCK_SIZE_K": 32,
        "GROUP_SIZE_M": 8,
        "num_stages": 4,
        "num_warps": 4,
        "ms": 0.6189468502998352,
        "min_ms": 0.6189468502998352,
        "max_ms": 0.6189468502998352,
        "compile_time": 1.3084499835968018
    },
    {
        "BLOCK_SIZE_M": 128,
        "BLOCK_SIZE_N": 64,
        "BLOCK_SIZE_K": 64,
        "GROUP_SIZE_M": 8,
        "num_stages": 2,
        "num_warps": 8,
        "ms": 0.6196184158325195,
        "min_ms": 0.6196184158325195,
        "max_ms": 0.6196184158325195,
        "compile_time": 1.6541783809661865
    },
    {
        "BLOCK_SIZE_M": 64,
        "BLOCK_SIZE_N": 128,
        "BLOCK_SIZE_K": 64,
        "GROUP_SIZE_M": 8,
        "num_stages": 2,
        "num_warps": 4,
        "ms": 0.6200670003890991,
        "min_ms": 0.6200670003890991,
        "max_ms": 0.6200670003890991,
        "compile_time": 1.2956583499908447
    },
    {
        "BLOCK_SIZE_M": 64,
        "BLOCK_SIZE_N": 64,
        "BLOCK_SIZE_K": 32,
        "GROUP_SIZE_M": 8,
        "num_stages": 5,
        "num_warps": 4,
        "ms": 0.6202392578125,
        "min_ms": 0.6202392578125,
        "max_ms": 0.6202392578125,
        "compile_time": 1.3179726600646973
    },
    {
        "BLOCK_SIZE_M": 64,
        "BLOCK_SIZE_N": 512,
        "BLOCK_SIZE_K": 16,
        "GROUP_SIZE_M": 8,
        "num_stages": 6,
        "num_warps": 16,
        "ms": 0.6206537485122681,
        "min_ms": 0.6206537485122681,
        "max_ms": 0.6206537485122681,
        "compile_time": 1.2398526668548584
    },
    {
        "BLOCK_SIZE_M": 64,
        "BLOCK_SIZE_N": 512,
        "BLOCK_SIZE_K": 16,
        "GROUP_SIZE_M": 8,
        "num_stages": 5,
        "num_warps": 16,
        "ms": 0.6210041642189026,
        "min_ms": 0.6210041642189026,
        "max_ms": 0.6210041642189026,
        "compile_time": 1.2472724914550781
    },
    {
        "BLOCK_SIZE_M": 64,
        "BLOCK_SIZE_N": 64,
        "BLOCK_SIZE_K": 32,
        "GROUP_SIZE_M": 8,
        "num_stages": 3,
        "num_warps": 2,
        "ms": 0.621411919593811,
        "min_ms": 0.621411919593811,
        "max_ms": 0.621411919593811,
        "compile_time": 1.9930188655853271
    },
    {
        "BLOCK_SIZE_M": 64,
        "BLOCK_SIZE_N": 64,
        "BLOCK_SIZE_K": 32,
        "GROUP_SIZE_M": 8,
        "num_stages": 6,
        "num_warps": 4,
        "ms": 0.6229059100151062,
        "min_ms": 0.6229059100151062,
        "max_ms": 0.6229059100151062,
        "compile_time": 1.3029260635375977
    },
    {
        "BLOCK_SIZE_M": 64,
        "BLOCK_SIZE_N": 64,
        "BLOCK_SIZE_K": 64,
        "GROUP_SIZE_M": 8,
        "num_stages": 5,
        "num_warps": 2,
        "ms": 0.623329758644104,
        "min_ms": 0.623329758644104,
        "max_ms": 0.623329758644104,
        "compile_time": 2.3133935928344727
    },
    {
        "BLOCK_SIZE_M": 64,
        "BLOCK_SIZE_N": 64,
        "BLOCK_SIZE_K": 32,
        "GROUP_SIZE_M": 8,
        "num_stages": 7,
        "num_warps": 4,
        "ms": 0.6237951517105103,
        "min_ms": 0.6237951517105103,
        "max_ms": 0.6237951517105103,
        "compile_time": 1.8969440460205078
    },
    {
        "BLOCK_SIZE_M": 64,
        "BLOCK_SIZE_N": 512,
        "BLOCK_SIZE_K": 16,
        "GROUP_SIZE_M": 8,
        "num_stages": 3,
        "num_warps": 16,
        "ms": 0.6256450414657593,
        "min_ms": 0.6256450414657593,
        "max_ms": 0.6256450414657593,
        "compile_time": 1.2335386276245117
    },
    {
        "BLOCK_SIZE_M": 512,
        "BLOCK_SIZE_N": 64,
        "BLOCK_SIZE_K": 64,
        "GROUP_SIZE_M": 8,
        "num_stages": 2,
        "num_warps": 8,
        "ms": 0.6267663240432739,
        "min_ms": 0.6267663240432739,
        "max_ms": 0.6267663240432739,
        "compile_time": 3.024657964706421
    },
    {
        "BLOCK_SIZE_M": 64,
        "BLOCK_SIZE_N": 64,
        "BLOCK_SIZE_K": 32,
        "GROUP_SIZE_M": 8,
        "num_stages": 3,
        "num_warps": 4,
        "ms": 0.6303244233131409,
        "min_ms": 0.6303244233131409,
        "max_ms": 0.6303244233131409,
        "compile_time": 1.2935066223144531
    },
    {
        "BLOCK_SIZE_M": 64,
        "BLOCK_SIZE_N": 512,
        "BLOCK_SIZE_K": 32,
        "GROUP_SIZE_M": 8,
        "num_stages": 3,
        "num_warps": 16,
        "ms": 0.6311687231063843,
        "min_ms": 0.6311687231063843,
        "max_ms": 0.6311687231063843,
        "compile_time": 1.2216005325317383
    },
    {
        "BLOCK_SIZE_M": 64,
        "BLOCK_SIZE_N": 128,
        "BLOCK_SIZE_K": 64,
        "GROUP_SIZE_M": 8,
        "num_stages": 2,
        "num_warps": 8,
        "ms": 0.6315574049949646,
        "min_ms": 0.6315574049949646,
        "max_ms": 0.6315574049949646,
        "compile_time": 1.8400332927703857
    },
    {
        "BLOCK_SIZE_M": 64,
        "BLOCK_SIZE_N": 512,
        "BLOCK_SIZE_K": 32,
        "GROUP_SIZE_M": 8,
        "num_stages": 4,
        "num_warps": 16,
        "ms": 0.6325324773788452,
        "min_ms": 0.6325324773788452,
        "max_ms": 0.6325324773788452,
        "compile_time": 1.2240195274353027
    },
    {
        "BLOCK_SIZE_M": 64,
        "BLOCK_SIZE_N": 64,
        "BLOCK_SIZE_K": 32,
        "GROUP_SIZE_M": 8,
        "num_stages": 8,
        "num_warps": 2,
        "ms": 0.6327518820762634,
        "min_ms": 0.6327518820762634,
        "max_ms": 0.6327518820762634,
        "compile_time": 2.126554012298584
    },
    {
        "BLOCK_SIZE_M": 64,
        "BLOCK_SIZE_N": 512,
        "BLOCK_SIZE_K": 32,
        "GROUP_SIZE_M": 8,
        "num_stages": 5,
        "num_warps": 16,
        "ms": 0.6327893137931824,
        "min_ms": 0.6327893137931824,
        "max_ms": 0.6327893137931824,
        "compile_time": 1.2056677341461182
    },
    {
        "BLOCK_SIZE_M": 128,
        "BLOCK_SIZE_N": 64,
        "BLOCK_SIZE_K": 64,
        "GROUP_SIZE_M": 8,
        "num_stages": 1,
        "num_warps": 4,
        "ms": 0.6329516768455505,
        "min_ms": 0.6329516768455505,
        "max_ms": 0.6329516768455505,
        "compile_time": 1.5699899196624756
    },
    {
        "BLOCK_SIZE_M": 64,
        "BLOCK_SIZE_N": 64,
        "BLOCK_SIZE_K": 32,
        "GROUP_SIZE_M": 8,
        "num_stages": 8,
        "num_warps": 4,
        "ms": 0.6358556747436523,
        "min_ms": 0.6358556747436523,
        "max_ms": 0.6358556747436523,
        "compile_time": 1.2879981994628906
    },
    {
        "BLOCK_SIZE_M": 64,
        "BLOCK_SIZE_N": 64,
        "BLOCK_SIZE_K": 64,
        "GROUP_SIZE_M": 8,
        "num_stages": 6,
        "num_warps": 2,
        "ms": 0.6360523104667664,
        "min_ms": 0.6360523104667664,
        "max_ms": 0.6360523104667664,
        "compile_time": 2.36403226852417
    },
    {
        "BLOCK_SIZE_M": 256,
        "BLOCK_SIZE_N": 128,
        "BLOCK_SIZE_K": 128,
        "GROUP_SIZE_M": 8,
        "num_stages": 2,
        "num_warps": 16,
        "ms": 0.6364096403121948,
        "min_ms": 0.6364096403121948,
        "max_ms": 0.6364096403121948,
        "compile_time": 1.2928884029388428
    },
    {
        "BLOCK_SIZE_M": 64,
        "BLOCK_SIZE_N": 64,
        "BLOCK_SIZE_K": 64,
        "GROUP_SIZE_M": 8,
        "num_stages": 7,
        "num_warps": 4,
        "ms": 0.6379688382148743,
        "min_ms": 0.6379688382148743,
        "max_ms": 0.6379688382148743,
        "compile_time": 2.017596483230591
    },
    {
        "BLOCK_SIZE_M": 64,
        "BLOCK_SIZE_N": 64,
        "BLOCK_SIZE_K": 64,
        "GROUP_SIZE_M": 8,
        "num_stages": 8,
        "num_warps": 4,
        "ms": 0.63865065574646,
        "min_ms": 0.63865065574646,
        "max_ms": 0.63865065574646,
        "compile_time": 2.062160015106201
    },
    {
        "BLOCK_SIZE_M": 64,
        "BLOCK_SIZE_N": 64,
        "BLOCK_SIZE_K": 128,
        "GROUP_SIZE_M": 8,
        "num_stages": 3,
        "num_warps": 4,
        "ms": 0.639197826385498,
        "min_ms": 0.639197826385498,
        "max_ms": 0.639197826385498,
        "compile_time": 2.1593377590179443
    },
    {
        "BLOCK_SIZE_M": 128,
        "BLOCK_SIZE_N": 128,
        "BLOCK_SIZE_K": 32,
        "GROUP_SIZE_M": 8,
        "num_stages": 1,
        "num_warps": 8,
        "ms": 0.6392574310302734,
        "min_ms": 0.6392574310302734,
        "max_ms": 0.6392574310302734,
        "compile_time": 1.9701025485992432
    },
    {
        "BLOCK_SIZE_M": 64,
        "BLOCK_SIZE_N": 512,
        "BLOCK_SIZE_K": 32,
        "GROUP_SIZE_M": 8,
        "num_stages": 2,
        "num_warps": 8,
        "ms": 0.6402838826179504,
        "min_ms": 0.6402838826179504,
        "max_ms": 0.6402838826179504,
        "compile_time": 2.334949254989624
    },
    {
        "BLOCK_SIZE_M": 128,
        "BLOCK_SIZE_N": 256,
        "BLOCK_SIZE_K": 128,
        "GROUP_SIZE_M": 8,
        "num_stages": 2,
        "num_warps": 8,
        "ms": 0.6417592763900757,
        "min_ms": 0.6417592763900757,
        "max_ms": 0.6417592763900757,
        "compile_time": 1.771688461303711
    },
    {
        "BLOCK_SIZE_M": 128,
        "BLOCK_SIZE_N": 256,
        "BLOCK_SIZE_K": 64,
        "GROUP_SIZE_M": 8,
        "num_stages": 2,
        "num_warps": 16,
        "ms": 0.642523467540741,
        "min_ms": 0.642523467540741,
        "max_ms": 0.642523467540741,
        "compile_time": 1.7861814498901367
    },
    {
        "BLOCK_SIZE_M": 64,
        "BLOCK_SIZE_N": 128,
        "BLOCK_SIZE_K": 64,
        "GROUP_SIZE_M": 8,
        "num_stages": 4,
        "num_warps": 2,
        "ms": 0.6448835730552673,
        "min_ms": 0.6448835730552673,
        "max_ms": 0.6448835730552673,
        "compile_time": 2.875767230987549
    },
    {
        "BLOCK_SIZE_M": 64,
        "BLOCK_SIZE_N": 64,
        "BLOCK_SIZE_K": 128,
        "GROUP_SIZE_M": 8,
        "num_stages": 5,
        "num_warps": 4,
        "ms": 0.6457225680351257,
        "min_ms": 0.6457225680351257,
        "max_ms": 0.6457225680351257,
        "compile_time": 2.2573306560516357
    },
    {
        "BLOCK_SIZE_M": 128,
        "BLOCK_SIZE_N": 128,
        "BLOCK_SIZE_K": 128,
        "GROUP_SIZE_M": 8,
        "num_stages": 2,
        "num_warps": 16,
        "ms": 0.645927906036377,
        "min_ms": 0.645927906036377,
        "max_ms": 0.645927906036377,
        "compile_time": 2.1437642574310303
    },
    {
        "BLOCK_SIZE_M": 128,
        "BLOCK_SIZE_N": 64,
        "BLOCK_SIZE_K": 16,
        "GROUP_SIZE_M": 8,
        "num_stages": 5,
        "num_warps": 4,
        "ms": 0.6473032236099243,
        "min_ms": 0.6473032236099243,
        "max_ms": 0.6473032236099243,
        "compile_time": 1.5264699459075928
    },
    {
        "BLOCK_SIZE_M": 128,
        "BLOCK_SIZE_N": 64,
        "BLOCK_SIZE_K": 16,
        "GROUP_SIZE_M": 8,
        "num_stages": 4,
        "num_warps": 4,
        "ms": 0.6475452780723572,
        "min_ms": 0.6475452780723572,
        "max_ms": 0.6475452780723572,
        "compile_time": 1.5641913414001465
    },
    {
        "BLOCK_SIZE_M": 128,
        "BLOCK_SIZE_N": 64,
        "BLOCK_SIZE_K": 16,
        "GROUP_SIZE_M": 8,
        "num_stages": 8,
        "num_warps": 2,
        "ms": 0.6488926410675049,
        "min_ms": 0.6488926410675049,
        "max_ms": 0.6488926410675049,
        "compile_time": 1.5223758220672607
    },
    {
        "BLOCK_SIZE_M": 128,
        "BLOCK_SIZE_N": 64,
        "BLOCK_SIZE_K": 16,
        "GROUP_SIZE_M": 8,
        "num_stages": 4,
        "num_warps": 2,
        "ms": 0.649960458278656,
        "min_ms": 0.649960458278656,
        "max_ms": 0.649960458278656,
        "compile_time": 2.50980806350708
    },
    {
        "BLOCK_SIZE_M": 128,
        "BLOCK_SIZE_N": 64,
        "BLOCK_SIZE_K": 16,
        "GROUP_SIZE_M": 8,
        "num_stages": 6,
        "num_warps": 2,
        "ms": 0.6509401798248291,
        "min_ms": 0.6509401798248291,
        "max_ms": 0.6509401798248291,
        "compile_time": 2.572618007659912
    },
    {
        "BLOCK_SIZE_M": 64,
        "BLOCK_SIZE_N": 256,
        "BLOCK_SIZE_K": 32,
        "GROUP_SIZE_M": 8,
        "num_stages": 3,
        "num_warps": 16,
        "ms": 0.6510606408119202,
        "min_ms": 0.6510606408119202,
        "max_ms": 0.6510606408119202,
        "compile_time": 1.2395789623260498
    },
    {
        "BLOCK_SIZE_M": 64,
        "BLOCK_SIZE_N": 256,
        "BLOCK_SIZE_K": 32,
        "GROUP_SIZE_M": 8,
        "num_stages": 8,
        "num_warps": 16,
        "ms": 0.6510940194129944,
        "min_ms": 0.6510940194129944,
        "max_ms": 0.6510940194129944,
        "compile_time": 1.240206003189087
    },
    {
        "BLOCK_SIZE_M": 128,
        "BLOCK_SIZE_N": 64,
        "BLOCK_SIZE_K": 16,
        "GROUP_SIZE_M": 8,
        "num_stages": 5,
        "num_warps": 2,
        "ms": 0.6517828702926636,
        "min_ms": 0.6517828702926636,
        "max_ms": 0.6517828702926636,
        "compile_time": 1.494384765625
    },
    {
        "BLOCK_SIZE_M": 128,
        "BLOCK_SIZE_N": 64,
        "BLOCK_SIZE_K": 16,
        "GROUP_SIZE_M": 8,
        "num_stages": 6,
        "num_warps": 4,
        "ms": 0.6518797278404236,
        "min_ms": 0.6518797278404236,
        "max_ms": 0.6518797278404236,
        "compile_time": 1.5235013961791992
    },
    {
        "BLOCK_SIZE_M": 128,
        "BLOCK_SIZE_N": 64,
        "BLOCK_SIZE_K": 16,
        "GROUP_SIZE_M": 8,
        "num_stages": 7,
        "num_warps": 2,
        "ms": 0.6524041891098022,
        "min_ms": 0.6524041891098022,
        "max_ms": 0.6524041891098022,
        "compile_time": 2.577310800552368
    },
    {
        "BLOCK_SIZE_M": 256,
        "BLOCK_SIZE_N": 64,
        "BLOCK_SIZE_K": 32,
        "GROUP_SIZE_M": 8,
        "num_stages": 4,
        "num_warps": 16,
        "ms": 0.6524844765663147,
        "min_ms": 0.6524844765663147,
        "max_ms": 0.6524844765663147,
        "compile_time": 1.3258306980133057
    },
    {
        "BLOCK_SIZE_M": 64,
        "BLOCK_SIZE_N": 64,
        "BLOCK_SIZE_K": 128,
        "GROUP_SIZE_M": 8,
        "num_stages": 2,
        "num_warps": 2,
        "ms": 0.6527276039123535,
        "min_ms": 0.6527276039123535,
        "max_ms": 0.6527276039123535,
        "compile_time": 2.479067802429199
    },
    {
        "BLOCK_SIZE_M": 64,
        "BLOCK_SIZE_N": 256,
        "BLOCK_SIZE_K": 32,
        "GROUP_SIZE_M": 8,
        "num_stages": 5,
        "num_warps": 16,
        "ms": 0.6528299450874329,
        "min_ms": 0.6528299450874329,
        "max_ms": 0.6528299450874329,
        "compile_time": 1.2455968856811523
    },
    {
        "BLOCK_SIZE_M": 64,
        "BLOCK_SIZE_N": 256,
        "BLOCK_SIZE_K": 32,
        "GROUP_SIZE_M": 8,
        "num_stages": 6,
        "num_warps": 16,
        "ms": 0.6530076265335083,
        "min_ms": 0.6530076265335083,
        "max_ms": 0.6530076265335083,
        "compile_time": 1.2456376552581787
    },
    {
        "BLOCK_SIZE_M": 64,
        "BLOCK_SIZE_N": 256,
        "BLOCK_SIZE_K": 32,
        "GROUP_SIZE_M": 8,
        "num_stages": 7,
        "num_warps": 16,
        "ms": 0.6530723571777344,
        "min_ms": 0.6530723571777344,
        "max_ms": 0.6530723571777344,
        "compile_time": 1.2393596172332764
    },
    {
        "BLOCK_SIZE_M": 256,
        "BLOCK_SIZE_N": 64,
        "BLOCK_SIZE_K": 32,
        "GROUP_SIZE_M": 8,
        "num_stages": 6,
        "num_warps": 16,
        "ms": 0.6542266011238098,
        "min_ms": 0.6542266011238098,
        "max_ms": 0.6542266011238098,
        "compile_time": 1.3135101795196533
    },
    {
        "BLOCK_SIZE_M": 128,
        "BLOCK_SIZE_N": 64,
        "BLOCK_SIZE_K": 16,
        "GROUP_SIZE_M": 8,
        "num_stages": 7,
        "num_warps": 4,
        "ms": 0.6543118953704834,
        "min_ms": 0.6543118953704834,
        "max_ms": 0.6543118953704834,
        "compile_time": 1.5604465007781982
    },
    {
        "BLOCK_SIZE_M": 256,
        "BLOCK_SIZE_N": 64,
        "BLOCK_SIZE_K": 16,
        "GROUP_SIZE_M": 8,
        "num_stages": 4,
        "num_warps": 8,
        "ms": 0.6543304324150085,
        "min_ms": 0.6543304324150085,
        "max_ms": 0.6543304324150085,
        "compile_time": 1.3260612487792969
    },
    {
        "BLOCK_SIZE_M": 64,
        "BLOCK_SIZE_N": 256,
        "BLOCK_SIZE_K": 32,
        "GROUP_SIZE_M": 8,
        "num_stages": 4,
        "num_warps": 16,
        "ms": 0.6546049118041992,
        "min_ms": 0.6546049118041992,
        "max_ms": 0.6546049118041992,
        "compile_time": 1.2396190166473389
    },
    {
        "BLOCK_SIZE_M": 256,
        "BLOCK_SIZE_N": 64,
        "BLOCK_SIZE_K": 32,
        "GROUP_SIZE_M": 8,
        "num_stages": 7,
        "num_warps": 16,
        "ms": 0.6546438932418823,
        "min_ms": 0.6546438932418823,
        "max_ms": 0.6546438932418823,
        "compile_time": 1.3108351230621338
    },
    {
        "BLOCK_SIZE_M": 64,
        "BLOCK_SIZE_N": 64,
        "BLOCK_SIZE_K": 128,
        "GROUP_SIZE_M": 8,
        "num_stages": 4,
        "num_warps": 4,
        "ms": 0.6550056338310242,
        "min_ms": 0.6550056338310242,
        "max_ms": 0.6550056338310242,
        "compile_time": 2.1781716346740723
    },
    {
        "BLOCK_SIZE_M": 256,
        "BLOCK_SIZE_N": 64,
        "BLOCK_SIZE_K": 16,
        "GROUP_SIZE_M": 8,
        "num_stages": 6,
        "num_warps": 8,
        "ms": 0.6552694439888,
        "min_ms": 0.6552694439888,
        "max_ms": 0.6552694439888,
        "compile_time": 1.3313660621643066
    },
    {
        "BLOCK_SIZE_M": 256,
        "BLOCK_SIZE_N": 64,
        "BLOCK_SIZE_K": 16,
        "GROUP_SIZE_M": 8,
        "num_stages": 5,
        "num_warps": 8,
        "ms": 0.6556121110916138,
        "min_ms": 0.6556121110916138,
        "max_ms": 0.6556121110916138,
        "compile_time": 2.1047956943511963
    },
    {
        "BLOCK_SIZE_M": 64,
        "BLOCK_SIZE_N": 64,
        "BLOCK_SIZE_K": 128,
        "GROUP_SIZE_M": 8,
        "num_stages": 6,
        "num_warps": 4,
        "ms": 0.6557456851005554,
        "min_ms": 0.6557456851005554,
        "max_ms": 0.6557456851005554,
        "compile_time": 2.3411238193511963
    },
    {
        "BLOCK_SIZE_M": 64,
        "BLOCK_SIZE_N": 64,
        "BLOCK_SIZE_K": 128,
        "GROUP_SIZE_M": 8,
        "num_stages": 2,
        "num_warps": 4,
        "ms": 0.6559309959411621,
        "min_ms": 0.6559309959411621,
        "max_ms": 0.6559309959411621,
        "compile_time": 2.0567445755004883
    },
    {
        "BLOCK_SIZE_M": 128,
        "BLOCK_SIZE_N": 64,
        "BLOCK_SIZE_K": 32,
        "GROUP_SIZE_M": 8,
        "num_stages": 1,
        "num_warps": 2,
        "ms": 0.6566897630691528,
        "min_ms": 0.6566897630691528,
        "max_ms": 0.6566897630691528,
        "compile_time": 2.63234543800354
    },
    {
        "BLOCK_SIZE_M": 256,
        "BLOCK_SIZE_N": 64,
        "BLOCK_SIZE_K": 16,
        "GROUP_SIZE_M": 8,
        "num_stages": 7,
        "num_warps": 8,
        "ms": 0.6568674445152283,
        "min_ms": 0.6568674445152283,
        "max_ms": 0.6568674445152283,
        "compile_time": 1.3322844505310059
    },
    {
        "BLOCK_SIZE_M": 128,
        "BLOCK_SIZE_N": 256,
        "BLOCK_SIZE_K": 128,
        "GROUP_SIZE_M": 8,
        "num_stages": 1,
        "num_warps": 16,
        "ms": 0.6574994921684265,
        "min_ms": 0.6574994921684265,
        "max_ms": 0.6574994921684265,
        "compile_time": 1.8564479351043701
    },
    {
        "BLOCK_SIZE_M": 128,
        "BLOCK_SIZE_N": 128,
        "BLOCK_SIZE_K": 256,
        "GROUP_SIZE_M": 8,
        "num_stages": 2,
        "num_warps": 8,
        "ms": 0.6577375531196594,
        "min_ms": 0.6577375531196594,
        "max_ms": 0.6577375531196594,
        "compile_time": 2.761276960372925
    },
    {
        "BLOCK_SIZE_M": 256,
        "BLOCK_SIZE_N": 64,
        "BLOCK_SIZE_K": 16,
        "GROUP_SIZE_M": 8,
        "num_stages": 8,
        "num_warps": 8,
        "ms": 0.6579982042312622,
        "min_ms": 0.6579982042312622,
        "max_ms": 0.6579982042312622,
        "compile_time": 1.3182950019836426
    },
    {
        "BLOCK_SIZE_M": 256,
        "BLOCK_SIZE_N": 64,
        "BLOCK_SIZE_K": 32,
        "GROUP_SIZE_M": 8,
        "num_stages": 8,
        "num_warps": 16,
        "ms": 0.658273458480835,
        "min_ms": 0.658273458480835,
        "max_ms": 0.658273458480835,
        "compile_time": 2.0586178302764893
    },
    {
        "BLOCK_SIZE_M": 32,
        "BLOCK_SIZE_N": 512,
        "BLOCK_SIZE_K": 16,
        "GROUP_SIZE_M": 8,
        "num_stages": 5,
        "num_warps": 4,
        "ms": 0.6595010161399841,
        "min_ms": 0.6595010161399841,
        "max_ms": 0.6595010161399841,
        "compile_time": 1.2338755130767822
    },
    {
        "BLOCK_SIZE_M": 256,
        "BLOCK_SIZE_N": 32,
        "BLOCK_SIZE_K": 64,
        "GROUP_SIZE_M": 8,
        "num_stages": 4,
        "num_warps": 4,
        "ms": 0.6595697999000549,
        "min_ms": 0.6595697999000549,
        "max_ms": 0.6595697999000549,
        "compile_time": 2.7304940223693848
    },
    {
        "BLOCK_SIZE_M": 512,
        "BLOCK_SIZE_N": 64,
        "BLOCK_SIZE_K": 64,
        "GROUP_SIZE_M": 8,
        "num_stages": 3,
        "num_warps": 16,
        "ms": 0.6597703695297241,
        "min_ms": 0.6597703695297241,
        "max_ms": 0.6597703695297241,
        "compile_time": 2.55552339553833
    },
    {
        "BLOCK_SIZE_M": 128,
        "BLOCK_SIZE_N": 64,
        "BLOCK_SIZE_K": 16,
        "GROUP_SIZE_M": 8,
        "num_stages": 8,
        "num_warps": 4,
        "ms": 0.6610916256904602,
        "min_ms": 0.6610916256904602,
        "max_ms": 0.6610916256904602,
        "compile_time": 1.5374603271484375
    },
    {
        "BLOCK_SIZE_M": 128,
        "BLOCK_SIZE_N": 64,
        "BLOCK_SIZE_K": 64,
        "GROUP_SIZE_M": 8,
        "num_stages": 1,
        "num_warps": 2,
        "ms": 0.6625539064407349,
        "min_ms": 0.6625539064407349,
        "max_ms": 0.6625539064407349,
        "compile_time": 2.942887544631958
    },
    {
        "BLOCK_SIZE_M": 32,
        "BLOCK_SIZE_N": 256,
        "BLOCK_SIZE_K": 32,
        "GROUP_SIZE_M": 8,
        "num_stages": 3,
        "num_warps": 4,
        "ms": 0.663272500038147,
        "min_ms": 0.663272500038147,
        "max_ms": 0.663272500038147,
        "compile_time": 1.2190814018249512
    },
    {
        "BLOCK_SIZE_M": 256,
        "BLOCK_SIZE_N": 32,
        "BLOCK_SIZE_K": 64,
        "GROUP_SIZE_M": 8,
        "num_stages": 5,
        "num_warps": 4,
        "ms": 0.6646115779876709,
        "min_ms": 0.6646115779876709,
        "max_ms": 0.6646115779876709,
        "compile_time": 2.7257142066955566
    },
    {
        "BLOCK_SIZE_M": 32,
        "BLOCK_SIZE_N": 512,
        "BLOCK_SIZE_K": 16,
        "GROUP_SIZE_M": 8,
        "num_stages": 4,
        "num_warps": 4,
        "ms": 0.6650763750076294,
        "min_ms": 0.6650763750076294,
        "max_ms": 0.6650763750076294,
        "compile_time": 1.2303619384765625
    },
    {
        "BLOCK_SIZE_M": 256,
        "BLOCK_SIZE_N": 32,
        "BLOCK_SIZE_K": 32,
        "GROUP_SIZE_M": 8,
        "num_stages": 4,
        "num_warps": 4,
        "ms": 0.6652191877365112,
        "min_ms": 0.6652191877365112,
        "max_ms": 0.6652191877365112,
        "compile_time": 1.3409755229949951
    },
    {
        "BLOCK_SIZE_M": 256,
        "BLOCK_SIZE_N": 64,
        "BLOCK_SIZE_K": 32,
        "GROUP_SIZE_M": 8,
        "num_stages": 5,
        "num_warps": 16,
        "ms": 0.6656215190887451,
        "min_ms": 0.6656215190887451,
        "max_ms": 0.6656215190887451,
        "compile_time": 2.0252881050109863
    },
    {
        "BLOCK_SIZE_M": 256,
        "BLOCK_SIZE_N": 32,
        "BLOCK_SIZE_K": 32,
        "GROUP_SIZE_M": 8,
        "num_stages": 3,
        "num_warps": 4,
        "ms": 0.6665420532226562,
        "min_ms": 0.6665420532226562,
        "max_ms": 0.6665420532226562,
        "compile_time": 1.3479042053222656
    },
    {
        "BLOCK_SIZE_M": 32,
        "BLOCK_SIZE_N": 256,
        "BLOCK_SIZE_K": 32,
        "GROUP_SIZE_M": 8,
        "num_stages": 5,
        "num_warps": 4,
        "ms": 0.6668615937232971,
        "min_ms": 0.6668615937232971,
        "max_ms": 0.6668615937232971,
        "compile_time": 2.014843225479126
    },
    {
        "BLOCK_SIZE_M": 256,
        "BLOCK_SIZE_N": 32,
        "BLOCK_SIZE_K": 64,
        "GROUP_SIZE_M": 8,
        "num_stages": 3,
        "num_warps": 4,
        "ms": 0.6673191785812378,
        "min_ms": 0.6673191785812378,
        "max_ms": 0.6673191785812378,
        "compile_time": 2.6311635971069336
    },
    {
        "BLOCK_SIZE_M": 128,
        "BLOCK_SIZE_N": 128,
        "BLOCK_SIZE_K": 32,
        "GROUP_SIZE_M": 8,
        "num_stages": 1,
        "num_warps": 4,
        "ms": 0.6676846146583557,
        "min_ms": 0.6676846146583557,
        "max_ms": 0.6676846146583557,
        "compile_time": 2.3186163902282715
    },
    {
        "BLOCK_SIZE_M": 64,
        "BLOCK_SIZE_N": 64,
        "BLOCK_SIZE_K": 64,
        "GROUP_SIZE_M": 8,
        "num_stages": 2,
        "num_warps": 4,
        "ms": 0.6682375073432922,
        "min_ms": 0.6682375073432922,
        "max_ms": 0.6682375073432922,
        "compile_time": 1.2546191215515137
    },
    {
        "BLOCK_SIZE_M": 128,
        "BLOCK_SIZE_N": 128,
        "BLOCK_SIZE_K": 64,
        "GROUP_SIZE_M": 8,
        "num_stages": 1,
        "num_warps": 4,
        "ms": 0.6684595942497253,
        "min_ms": 0.6684595942497253,
        "max_ms": 0.6684595942497253,
        "compile_time": 2.8102853298187256
    },
    {
        "BLOCK_SIZE_M": 256,
        "BLOCK_SIZE_N": 64,
        "BLOCK_SIZE_K": 16,
        "GROUP_SIZE_M": 8,
        "num_stages": 3,
        "num_warps": 8,
        "ms": 0.6685832738876343,
        "min_ms": 0.6685832738876343,
        "max_ms": 0.6685832738876343,
        "compile_time": 1.3109865188598633
    },
    {
        "BLOCK_SIZE_M": 256,
        "BLOCK_SIZE_N": 32,
        "BLOCK_SIZE_K": 32,
        "GROUP_SIZE_M": 8,
        "num_stages": 5,
        "num_warps": 4,
        "ms": 0.6688550114631653,
        "min_ms": 0.6688550114631653,
        "max_ms": 0.6688550114631653,
        "compile_time": 1.3491857051849365
    },
    {
        "BLOCK_SIZE_M": 256,
        "BLOCK_SIZE_N": 128,
        "BLOCK_SIZE_K": 64,
        "GROUP_SIZE_M": 8,
        "num_stages": 1,
        "num_warps": 8,
        "ms": 0.6698757410049438,
        "min_ms": 0.6698757410049438,
        "max_ms": 0.6698757410049438,
        "compile_time": 2.509593963623047
    },
    {
        "BLOCK_SIZE_M": 128,
        "BLOCK_SIZE_N": 256,
        "BLOCK_SIZE_K": 16,
        "GROUP_SIZE_M": 8,
        "num_stages": 5,
        "num_warps": 16,
        "ms": 0.6699549555778503,
        "min_ms": 0.6699549555778503,
        "max_ms": 0.6699549555778503,
        "compile_time": 1.8877878189086914
    },
    {
        "BLOCK_SIZE_M": 256,
        "BLOCK_SIZE_N": 64,
        "BLOCK_SIZE_K": 32,
        "GROUP_SIZE_M": 8,
        "num_stages": 3,
        "num_warps": 16,
        "ms": 0.6700402498245239,
        "min_ms": 0.6700402498245239,
        "max_ms": 0.6700402498245239,
        "compile_time": 1.3501195907592773
    },
    {
        "BLOCK_SIZE_M": 64,
        "BLOCK_SIZE_N": 64,
        "BLOCK_SIZE_K": 32,
        "GROUP_SIZE_M": 8,
        "num_stages": 2,
        "num_warps": 2,
        "ms": 0.6701255440711975,
        "min_ms": 0.6701255440711975,
        "max_ms": 0.6701255440711975,
        "compile_time": 1.919316291809082
    },
    {
        "BLOCK_SIZE_M": 64,
        "BLOCK_SIZE_N": 256,
        "BLOCK_SIZE_K": 32,
        "GROUP_SIZE_M": 8,
        "num_stages": 1,
        "num_warps": 8,
        "ms": 0.6707726716995239,
        "min_ms": 0.6707726716995239,
        "max_ms": 0.6707726716995239,
        "compile_time": 1.240995168685913
    },
    {
        "BLOCK_SIZE_M": 64,
        "BLOCK_SIZE_N": 128,
        "BLOCK_SIZE_K": 128,
        "GROUP_SIZE_M": 8,
        "num_stages": 3,
        "num_warps": 16,
        "ms": 0.670806884765625,
        "min_ms": 0.670806884765625,
        "max_ms": 0.670806884765625,
        "compile_time": 1.2166917324066162
    },
    {
        "BLOCK_SIZE_M": 128,
        "BLOCK_SIZE_N": 64,
        "BLOCK_SIZE_K": 128,
        "GROUP_SIZE_M": 8,
        "num_stages": 3,
        "num_warps": 16,
        "ms": 0.6709345579147339,
        "min_ms": 0.6709345579147339,
        "max_ms": 0.6709345579147339,
        "compile_time": 1.5280215740203857
    },
    {
        "BLOCK_SIZE_M": 64,
        "BLOCK_SIZE_N": 128,
        "BLOCK_SIZE_K": 64,
        "GROUP_SIZE_M": 8,
        "num_stages": 1,
        "num_warps": 4,
        "ms": 0.6710537075996399,
        "min_ms": 0.6710537075996399,
        "max_ms": 0.6710537075996399,
        "compile_time": 1.2952723503112793
    },
    {
        "BLOCK_SIZE_M": 64,
        "BLOCK_SIZE_N": 64,
        "BLOCK_SIZE_K": 128,
        "GROUP_SIZE_M": 8,
        "num_stages": 3,
        "num_warps": 2,
        "ms": 0.6713218092918396,
        "min_ms": 0.6713218092918396,
        "max_ms": 0.6713218092918396,
        "compile_time": 2.7125532627105713
    },
    {
        "BLOCK_SIZE_M": 128,
        "BLOCK_SIZE_N": 64,
        "BLOCK_SIZE_K": 128,
        "GROUP_SIZE_M": 8,
        "num_stages": 4,
        "num_warps": 16,
        "ms": 0.6725243330001831,
        "min_ms": 0.6725243330001831,
        "max_ms": 0.6725243330001831,
        "compile_time": 2.3098814487457275
    },
    {
        "BLOCK_SIZE_M": 32,
        "BLOCK_SIZE_N": 512,
        "BLOCK_SIZE_K": 32,
        "GROUP_SIZE_M": 8,
        "num_stages": 5,
        "num_warps": 8,
        "ms": 0.6728577613830566,
        "min_ms": 0.6728577613830566,
        "max_ms": 0.6728577613830566,
        "compile_time": 1.22214674949646
    },
    {
        "BLOCK_SIZE_M": 256,
        "BLOCK_SIZE_N": 128,
        "BLOCK_SIZE_K": 64,
        "GROUP_SIZE_M": 8,
        "num_stages": 1,
        "num_warps": 16,
        "ms": 0.6728867292404175,
        "min_ms": 0.6728867292404175,
        "max_ms": 0.6728867292404175,
        "compile_time": 2.110372304916382
    },
    {
        "BLOCK_SIZE_M": 128,
        "BLOCK_SIZE_N": 256,
        "BLOCK_SIZE_K": 16,
        "GROUP_SIZE_M": 8,
        "num_stages": 3,
        "num_warps": 16,
        "ms": 0.6738736033439636,
        "min_ms": 0.6738736033439636,
        "max_ms": 0.6738736033439636,
        "compile_time": 2.626533269882202
    },
    {
        "BLOCK_SIZE_M": 128,
        "BLOCK_SIZE_N": 128,
        "BLOCK_SIZE_K": 64,
        "GROUP_SIZE_M": 8,
        "num_stages": 2,
        "num_warps": 8,
        "ms": 0.6742820143699646,
        "min_ms": 0.6742820143699646,
        "max_ms": 0.6742820143699646,
        "compile_time": 1.2440168857574463
    },
    {
        "BLOCK_SIZE_M": 32,
        "BLOCK_SIZE_N": 512,
        "BLOCK_SIZE_K": 16,
        "GROUP_SIZE_M": 8,
        "num_stages": 4,
        "num_warps": 8,
        "ms": 0.6754840612411499,
        "min_ms": 0.6754840612411499,
        "max_ms": 0.6754840612411499,
        "compile_time": 1.2212440967559814
    },
    {
        "BLOCK_SIZE_M": 512,
        "BLOCK_SIZE_N": 32,
        "BLOCK_SIZE_K": 32,
        "GROUP_SIZE_M": 8,
        "num_stages": 3,
        "num_warps": 4,
        "ms": 0.6755668520927429,
        "min_ms": 0.6755668520927429,
        "max_ms": 0.6755668520927429,
        "compile_time": 2.81982421875
    },
    {
        "BLOCK_SIZE_M": 32,
        "BLOCK_SIZE_N": 512,
        "BLOCK_SIZE_K": 16,
        "GROUP_SIZE_M": 8,
        "num_stages": 5,
        "num_warps": 8,
        "ms": 0.6763421893119812,
        "min_ms": 0.6763421893119812,
        "max_ms": 0.6763421893119812,
        "compile_time": 1.2318320274353027
    },
    {
        "BLOCK_SIZE_M": 64,
        "BLOCK_SIZE_N": 64,
        "BLOCK_SIZE_K": 256,
        "GROUP_SIZE_M": 8,
        "num_stages": 2,
        "num_warps": 4,
        "ms": 0.6764167547225952,
        "min_ms": 0.6764167547225952,
        "max_ms": 0.6764167547225952,
        "compile_time": 2.441119432449341
    },
    {
        "BLOCK_SIZE_M": 128,
        "BLOCK_SIZE_N": 128,
        "BLOCK_SIZE_K": 128,
        "GROUP_SIZE_M": 8,
        "num_stages": 3,
        "num_warps": 32,
        "ms": 0.6766698956489563,
        "min_ms": 0.6766698956489563,
        "max_ms": 0.6766698956489563,
        "compile_time": 1.2454886436462402
    },
    {
        "BLOCK_SIZE_M": 128,
        "BLOCK_SIZE_N": 256,
        "BLOCK_SIZE_K": 128,
        "GROUP_SIZE_M": 8,
        "num_stages": 1,
        "num_warps": 8,
        "ms": 0.6767907738685608,
        "min_ms": 0.6767907738685608,
        "max_ms": 0.6767907738685608,
        "compile_time": 1.9398188591003418
    },
    {
        "BLOCK_SIZE_M": 256,
        "BLOCK_SIZE_N": 64,
        "BLOCK_SIZE_K": 32,
        "GROUP_SIZE_M": 8,
        "num_stages": 1,
        "num_warps": 8,
        "ms": 0.6771765947341919,
        "min_ms": 0.6771765947341919,
        "max_ms": 0.6771765947341919,
        "compile_time": 2.0081911087036133
    },
    {
        "BLOCK_SIZE_M": 256,
        "BLOCK_SIZE_N": 128,
        "BLOCK_SIZE_K": 16,
        "GROUP_SIZE_M": 8,
        "num_stages": 5,
        "num_warps": 16,
        "ms": 0.6778093576431274,
        "min_ms": 0.6778093576431274,
        "max_ms": 0.6778093576431274,
        "compile_time": 2.086899757385254
    },
    {
        "BLOCK_SIZE_M": 32,
        "BLOCK_SIZE_N": 256,
        "BLOCK_SIZE_K": 16,
        "GROUP_SIZE_M": 8,
        "num_stages": 4,
        "num_warps": 2,
        "ms": 0.6782431602478027,
        "min_ms": 0.6782431602478027,
        "max_ms": 0.6782431602478027,
        "compile_time": 2.1746859550476074
    },
    {
        "BLOCK_SIZE_M": 32,
        "BLOCK_SIZE_N": 512,
        "BLOCK_SIZE_K": 32,
        "GROUP_SIZE_M": 8,
        "num_stages": 3,
        "num_warps": 4,
        "ms": 0.6782492399215698,
        "min_ms": 0.6782492399215698,
        "max_ms": 0.6782492399215698,
        "compile_time": 1.2227981090545654
    },
    {
        "BLOCK_SIZE_M": 256,
        "BLOCK_SIZE_N": 64,
        "BLOCK_SIZE_K": 16,
        "GROUP_SIZE_M": 8,
        "num_stages": 3,
        "num_warps": 4,
        "ms": 0.6787351369857788,
        "min_ms": 0.6787351369857788,
        "max_ms": 0.6787351369857788,
        "compile_time": 2.4261794090270996
    },
    {
        "BLOCK_SIZE_M": 256,
        "BLOCK_SIZE_N": 64,
        "BLOCK_SIZE_K": 16,
        "GROUP_SIZE_M": 8,
        "num_stages": 4,
        "num_warps": 4,
        "ms": 0.6795679330825806,
        "min_ms": 0.6795679330825806,
        "max_ms": 0.6795679330825806,
        "compile_time": 2.419267416000366
    },
    {
        "BLOCK_SIZE_M": 64,
        "BLOCK_SIZE_N": 64,
        "BLOCK_SIZE_K": 32,
        "GROUP_SIZE_M": 8,
        "num_stages": 2,
        "num_warps": 4,
        "ms": 0.6800320744514465,
        "min_ms": 0.6800320744514465,
        "max_ms": 0.6800320744514465,
        "compile_time": 1.2613105773925781
    },
    {
        "BLOCK_SIZE_M": 256,
        "BLOCK_SIZE_N": 128,
        "BLOCK_SIZE_K": 16,
        "GROUP_SIZE_M": 8,
        "num_stages": 3,
        "num_warps": 16,
        "ms": 0.6801512837409973,
        "min_ms": 0.6801512837409973,
        "max_ms": 0.6801512837409973,
        "compile_time": 2.1187171936035156
    },
    {
        "BLOCK_SIZE_M": 32,
        "BLOCK_SIZE_N": 512,
        "BLOCK_SIZE_K": 16,
        "GROUP_SIZE_M": 8,
        "num_stages": 3,
        "num_warps": 4,
        "ms": 0.6802057027816772,
        "min_ms": 0.6802057027816772,
        "max_ms": 0.6802057027816772,
        "compile_time": 1.2088453769683838
    },
    {
        "BLOCK_SIZE_M": 64,
        "BLOCK_SIZE_N": 128,
        "BLOCK_SIZE_K": 128,
        "GROUP_SIZE_M": 8,
        "num_stages": 4,
        "num_warps": 16,
        "ms": 0.6802701950073242,
        "min_ms": 0.6802701950073242,
        "max_ms": 0.6802701950073242,
        "compile_time": 1.887500524520874
    },
    {
        "BLOCK_SIZE_M": 256,
        "BLOCK_SIZE_N": 64,
        "BLOCK_SIZE_K": 16,
        "GROUP_SIZE_M": 8,
        "num_stages": 5,
        "num_warps": 4,
        "ms": 0.6803263425827026,
        "min_ms": 0.6803263425827026,
        "max_ms": 0.6803263425827026,
        "compile_time": 2.4267191886901855
    },
    {
        "BLOCK_SIZE_M": 256,
        "BLOCK_SIZE_N": 32,
        "BLOCK_SIZE_K": 64,
        "GROUP_SIZE_M": 8,
        "num_stages": 5,
        "num_warps": 8,
        "ms": 0.6806191205978394,
        "min_ms": 0.6806191205978394,
        "max_ms": 0.6806191205978394,
        "compile_time": 2.290393352508545
    },
    {
        "BLOCK_SIZE_M": 64,
        "BLOCK_SIZE_N": 64,
        "BLOCK_SIZE_K": 128,
        "GROUP_SIZE_M": 8,
        "num_stages": 3,
        "num_warps": 8,
        "ms": 0.680808424949646,
        "min_ms": 0.680808424949646,
        "max_ms": 0.680808424949646,
        "compile_time": 1.296832799911499
    },
    {
        "BLOCK_SIZE_M": 32,
        "BLOCK_SIZE_N": 256,
        "BLOCK_SIZE_K": 64,
        "GROUP_SIZE_M": 8,
        "num_stages": 3,
        "num_warps": 4,
        "ms": 0.682249903678894,
        "min_ms": 0.682249903678894,
        "max_ms": 0.682249903678894,
        "compile_time": 2.2374656200408936
    },
    {
        "BLOCK_SIZE_M": 256,
        "BLOCK_SIZE_N": 32,
        "BLOCK_SIZE_K": 64,
        "GROUP_SIZE_M": 8,
        "num_stages": 4,
        "num_warps": 8,
        "ms": 0.6826041340827942,
        "min_ms": 0.6826041340827942,
        "max_ms": 0.6826041340827942,
        "compile_time": 1.3302772045135498
    },
    {
        "BLOCK_SIZE_M": 128,
        "BLOCK_SIZE_N": 64,
        "BLOCK_SIZE_K": 16,
        "GROUP_SIZE_M": 8,
        "num_stages": 3,
        "num_warps": 4,
        "ms": 0.6829149127006531,
        "min_ms": 0.6829149127006531,
        "max_ms": 0.6829149127006531,
        "compile_time": 1.5167884826660156
    },
    {
        "BLOCK_SIZE_M": 256,
        "BLOCK_SIZE_N": 32,
        "BLOCK_SIZE_K": 64,
        "GROUP_SIZE_M": 8,
        "num_stages": 3,
        "num_warps": 8,
        "ms": 0.6831687688827515,
        "min_ms": 0.6831687688827515,
        "max_ms": 0.6831687688827515,
        "compile_time": 1.3318231105804443
    },
    {
        "BLOCK_SIZE_M": 32,
        "BLOCK_SIZE_N": 256,
        "BLOCK_SIZE_K": 16,
        "GROUP_SIZE_M": 8,
        "num_stages": 5,
        "num_warps": 4,
        "ms": 0.6837366819381714,
        "min_ms": 0.6837366819381714,
        "max_ms": 0.6837366819381714,
        "compile_time": 1.238459825515747
    },
    {
        "BLOCK_SIZE_M": 256,
        "BLOCK_SIZE_N": 64,
        "BLOCK_SIZE_K": 16,
        "GROUP_SIZE_M": 8,
        "num_stages": 6,
        "num_warps": 4,
        "ms": 0.684196412563324,
        "min_ms": 0.684196412563324,
        "max_ms": 0.684196412563324,
        "compile_time": 2.451166868209839
    },
    {
        "BLOCK_SIZE_M": 32,
        "BLOCK_SIZE_N": 256,
        "BLOCK_SIZE_K": 32,
        "GROUP_SIZE_M": 8,
        "num_stages": 4,
        "num_warps": 4,
        "ms": 0.6847735047340393,
        "min_ms": 0.6847735047340393,
        "max_ms": 0.6847735047340393,
        "compile_time": 1.2264933586120605
    },
    {
        "BLOCK_SIZE_M": 64,
        "BLOCK_SIZE_N": 64,
        "BLOCK_SIZE_K": 64,
        "GROUP_SIZE_M": 8,
        "num_stages": 3,
        "num_warps": 8,
        "ms": 0.6848009824752808,
        "min_ms": 0.6848009824752808,
        "max_ms": 0.6848009824752808,
        "compile_time": 1.2669322490692139
    },
    {
        "BLOCK_SIZE_M": 256,
        "BLOCK_SIZE_N": 64,
        "BLOCK_SIZE_K": 16,
        "GROUP_SIZE_M": 8,
        "num_stages": 7,
        "num_warps": 4,
        "ms": 0.6849431991577148,
        "min_ms": 0.6849431991577148,
        "max_ms": 0.6849431991577148,
        "compile_time": 2.4643821716308594
    },
    {
        "BLOCK_SIZE_M": 32,
        "BLOCK_SIZE_N": 256,
        "BLOCK_SIZE_K": 16,
        "GROUP_SIZE_M": 8,
        "num_stages": 5,
        "num_warps": 2,
        "ms": 0.6849692463874817,
        "min_ms": 0.6849692463874817,
        "max_ms": 0.6849692463874817,
        "compile_time": 2.225062131881714
    },
    {
        "BLOCK_SIZE_M": 64,
        "BLOCK_SIZE_N": 64,
        "BLOCK_SIZE_K": 64,
        "GROUP_SIZE_M": 8,
        "num_stages": 4,
        "num_warps": 8,
        "ms": 0.6855701208114624,
        "min_ms": 0.6855701208114624,
        "max_ms": 0.6855701208114624,
        "compile_time": 1.2694754600524902
    },
    {
        "BLOCK_SIZE_M": 64,
        "BLOCK_SIZE_N": 512,
        "BLOCK_SIZE_K": 64,
        "GROUP_SIZE_M": 8,
        "num_stages": 2,
        "num_warps": 8,
        "ms": 0.6855717897415161,
        "min_ms": 0.6855717897415161,
        "max_ms": 0.6855717897415161,
        "compile_time": 2.540445566177368
    },
    {
        "BLOCK_SIZE_M": 256,
        "BLOCK_SIZE_N": 64,
        "BLOCK_SIZE_K": 16,
        "GROUP_SIZE_M": 8,
        "num_stages": 8,
        "num_warps": 4,
        "ms": 0.6860201954841614,
        "min_ms": 0.6860201954841614,
        "max_ms": 0.6860201954841614,
        "compile_time": 2.5132670402526855
    },
    {
        "BLOCK_SIZE_M": 128,
        "BLOCK_SIZE_N": 64,
        "BLOCK_SIZE_K": 16,
        "GROUP_SIZE_M": 8,
        "num_stages": 3,
        "num_warps": 2,
        "ms": 0.6865044236183167,
        "min_ms": 0.6865044236183167,
        "max_ms": 0.6865044236183167,
        "compile_time": 1.4704828262329102
    },
    {
        "BLOCK_SIZE_M": 32,
        "BLOCK_SIZE_N": 256,
        "BLOCK_SIZE_K": 16,
        "GROUP_SIZE_M": 8,
        "num_stages": 4,
        "num_warps": 4,
        "ms": 0.6869118213653564,
        "min_ms": 0.6869118213653564,
        "max_ms": 0.6869118213653564,
        "compile_time": 1.2372403144836426
    },
    {
        "BLOCK_SIZE_M": 32,
        "BLOCK_SIZE_N": 512,
        "BLOCK_SIZE_K": 32,
        "GROUP_SIZE_M": 8,
        "num_stages": 4,
        "num_warps": 8,
        "ms": 0.6871480941772461,
        "min_ms": 0.6871480941772461,
        "max_ms": 0.6871480941772461,
        "compile_time": 1.231557846069336
    },
    {
        "BLOCK_SIZE_M": 128,
        "BLOCK_SIZE_N": 64,
        "BLOCK_SIZE_K": 32,
        "GROUP_SIZE_M": 8,
        "num_stages": 8,
        "num_warps": 2,
        "ms": 0.6875382661819458,
        "min_ms": 0.6875382661819458,
        "max_ms": 0.6875382661819458,
        "compile_time": 2.908832550048828
    },
    {
        "BLOCK_SIZE_M": 128,
        "BLOCK_SIZE_N": 64,
        "BLOCK_SIZE_K": 64,
        "GROUP_SIZE_M": 8,
        "num_stages": 3,
        "num_warps": 16,
        "ms": 0.6880292892456055,
        "min_ms": 0.6880292892456055,
        "max_ms": 0.6880292892456055,
        "compile_time": 1.5375635623931885
    },
    {
        "BLOCK_SIZE_M": 32,
        "BLOCK_SIZE_N": 256,
        "BLOCK_SIZE_K": 16,
        "GROUP_SIZE_M": 8,
        "num_stages": 6,
        "num_warps": 2,
        "ms": 0.6880480051040649,
        "min_ms": 0.6880480051040649,
        "max_ms": 0.6880480051040649,
        "compile_time": 2.289539098739624
    },
    {
        "BLOCK_SIZE_M": 64,
        "BLOCK_SIZE_N": 64,
        "BLOCK_SIZE_K": 256,
        "GROUP_SIZE_M": 8,
        "num_stages": 3,
        "num_warps": 4,
        "ms": 0.6883547902107239,
        "min_ms": 0.6883547902107239,
        "max_ms": 0.6883547902107239,
        "compile_time": 2.6757609844207764
    },
    {
        "BLOCK_SIZE_M": 32,
        "BLOCK_SIZE_N": 256,
        "BLOCK_SIZE_K": 16,
        "GROUP_SIZE_M": 8,
        "num_stages": 3,
        "num_warps": 2,
        "ms": 0.6891549229621887,
        "min_ms": 0.6891549229621887,
        "max_ms": 0.6891549229621887,
        "compile_time": 2.1557834148406982
    },
    {
        "BLOCK_SIZE_M": 32,
        "BLOCK_SIZE_N": 512,
        "BLOCK_SIZE_K": 16,
        "GROUP_SIZE_M": 8,
        "num_stages": 3,
        "num_warps": 8,
        "ms": 0.6891651153564453,
        "min_ms": 0.6891651153564453,
        "max_ms": 0.6891651153564453,
        "compile_time": 1.2116978168487549
    },
    {
        "BLOCK_SIZE_M": 256,
        "BLOCK_SIZE_N": 32,
        "BLOCK_SIZE_K": 128,
        "GROUP_SIZE_M": 8,
        "num_stages": 3,
        "num_warps": 4,
        "ms": 0.6899712681770325,
        "min_ms": 0.6899712681770325,
        "max_ms": 0.6899712681770325,
        "compile_time": 3.5940661430358887
    },
    {
        "BLOCK_SIZE_M": 32,
        "BLOCK_SIZE_N": 256,
        "BLOCK_SIZE_K": 32,
        "GROUP_SIZE_M": 8,
        "num_stages": 8,
        "num_warps": 4,
        "ms": 0.6901392340660095,
        "min_ms": 0.6901392340660095,
        "max_ms": 0.6901392340660095,
        "compile_time": 2.1384191513061523
    },
    {
        "BLOCK_SIZE_M": 128,
        "BLOCK_SIZE_N": 64,
        "BLOCK_SIZE_K": 64,
        "GROUP_SIZE_M": 8,
        "num_stages": 4,
        "num_warps": 16,
        "ms": 0.6901645660400391,
        "min_ms": 0.6901645660400391,
        "max_ms": 0.6901645660400391,
        "compile_time": 1.5712378025054932
    },
    {
        "BLOCK_SIZE_M": 128,
        "BLOCK_SIZE_N": 256,
        "BLOCK_SIZE_K": 16,
        "GROUP_SIZE_M": 8,
        "num_stages": 4,
        "num_warps": 16,
        "ms": 0.6906169652938843,
        "min_ms": 0.6906169652938843,
        "max_ms": 0.6906169652938843,
        "compile_time": 2.680324077606201
    },
    {
        "BLOCK_SIZE_M": 256,
        "BLOCK_SIZE_N": 128,
        "BLOCK_SIZE_K": 16,
        "GROUP_SIZE_M": 8,
        "num_stages": 4,
        "num_warps": 16,
        "ms": 0.691219687461853,
        "min_ms": 0.691219687461853,
        "max_ms": 0.691219687461853,
        "compile_time": 2.0830483436584473
    },
    {
        "BLOCK_SIZE_M": 256,
        "BLOCK_SIZE_N": 128,
        "BLOCK_SIZE_K": 16,
        "GROUP_SIZE_M": 8,
        "num_stages": 6,
        "num_warps": 16,
        "ms": 0.6924197673797607,
        "min_ms": 0.6924197673797607,
        "max_ms": 0.6924197673797607,
        "compile_time": 1.3131260871887207
    },
    {
        "BLOCK_SIZE_M": 256,
        "BLOCK_SIZE_N": 32,
        "BLOCK_SIZE_K": 32,
        "GROUP_SIZE_M": 8,
        "num_stages": 7,
        "num_warps": 4,
        "ms": 0.6926105618476868,
        "min_ms": 0.6926105618476868,
        "max_ms": 0.6926105618476868,
        "compile_time": 1.3332021236419678
    },
    {
        "BLOCK_SIZE_M": 256,
        "BLOCK_SIZE_N": 64,
        "BLOCK_SIZE_K": 32,
        "GROUP_SIZE_M": 8,
        "num_stages": 1,
        "num_warps": 4,
        "ms": 0.6926427483558655,
        "min_ms": 0.6926427483558655,
        "max_ms": 0.6926427483558655,
        "compile_time": 2.4504451751708984
    },
    {
        "BLOCK_SIZE_M": 512,
        "BLOCK_SIZE_N": 32,
        "BLOCK_SIZE_K": 64,
        "GROUP_SIZE_M": 8,
        "num_stages": 3,
        "num_warps": 8,
        "ms": 0.6929408311843872,
        "min_ms": 0.6929408311843872,
        "max_ms": 0.6929408311843872,
        "compile_time": 2.732067823410034
    },
    {
        "BLOCK_SIZE_M": 32,
        "BLOCK_SIZE_N": 256,
        "BLOCK_SIZE_K": 64,
        "GROUP_SIZE_M": 8,
        "num_stages": 5,
        "num_warps": 4,
        "ms": 0.6929706335067749,
        "min_ms": 0.6929706335067749,
        "max_ms": 0.6929706335067749,
        "compile_time": 2.4039371013641357
    },
    {
        "BLOCK_SIZE_M": 256,
        "BLOCK_SIZE_N": 32,
        "BLOCK_SIZE_K": 32,
        "GROUP_SIZE_M": 8,
        "num_stages": 6,
        "num_warps": 4,
        "ms": 0.693006157875061,
        "min_ms": 0.693006157875061,
        "max_ms": 0.693006157875061,
        "compile_time": 1.3459928035736084
    },
    {
        "BLOCK_SIZE_M": 128,
        "BLOCK_SIZE_N": 256,
        "BLOCK_SIZE_K": 16,
        "GROUP_SIZE_M": 8,
        "num_stages": 6,
        "num_warps": 16,
        "ms": 0.6930221319198608,
        "min_ms": 0.6930221319198608,
        "max_ms": 0.6930221319198608,
        "compile_time": 1.8428618907928467
    },
    {
        "BLOCK_SIZE_M": 256,
        "BLOCK_SIZE_N": 128,
        "BLOCK_SIZE_K": 16,
        "GROUP_SIZE_M": 8,
        "num_stages": 7,
        "num_warps": 16,
        "ms": 0.6930341720581055,
        "min_ms": 0.6930341720581055,
        "max_ms": 0.6930341720581055,
        "compile_time": 1.3083045482635498
    },
    {
        "BLOCK_SIZE_M": 32,
        "BLOCK_SIZE_N": 256,
        "BLOCK_SIZE_K": 16,
        "GROUP_SIZE_M": 8,
        "num_stages": 6,
        "num_warps": 4,
        "ms": 0.693039059638977,
        "min_ms": 0.693039059638977,
        "max_ms": 0.693039059638977,
        "compile_time": 1.8592734336853027
    },
    {
        "BLOCK_SIZE_M": 512,
        "BLOCK_SIZE_N": 32,
        "BLOCK_SIZE_K": 32,
        "GROUP_SIZE_M": 8,
        "num_stages": 4,
        "num_warps": 8,
        "ms": 0.6932754516601562,
        "min_ms": 0.6932754516601562,
        "max_ms": 0.6932754516601562,
        "compile_time": 2.4360296726226807
    },
    {
        "BLOCK_SIZE_M": 32,
        "BLOCK_SIZE_N": 256,
        "BLOCK_SIZE_K": 32,
        "GROUP_SIZE_M": 8,
        "num_stages": 6,
        "num_warps": 4,
        "ms": 0.6935387849807739,
        "min_ms": 0.6935387849807739,
        "max_ms": 0.6935387849807739,
        "compile_time": 1.2293217182159424
    },
    {
        "BLOCK_SIZE_M": 128,
        "BLOCK_SIZE_N": 256,
        "BLOCK_SIZE_K": 16,
        "GROUP_SIZE_M": 8,
        "num_stages": 7,
        "num_warps": 16,
        "ms": 0.6938684582710266,
        "min_ms": 0.6938684582710266,
        "max_ms": 0.6938684582710266,
        "compile_time": 1.8845784664154053
    },
    {
        "BLOCK_SIZE_M": 128,
        "BLOCK_SIZE_N": 256,
        "BLOCK_SIZE_K": 16,
        "GROUP_SIZE_M": 8,
        "num_stages": 8,
        "num_warps": 16,
        "ms": 0.6942960619926453,
        "min_ms": 0.6942960619926453,
        "max_ms": 0.6942960619926453,
        "compile_time": 1.8583424091339111
    },
    {
        "BLOCK_SIZE_M": 256,
        "BLOCK_SIZE_N": 128,
        "BLOCK_SIZE_K": 16,
        "GROUP_SIZE_M": 8,
        "num_stages": 8,
        "num_warps": 16,
        "ms": 0.6948758363723755,
        "min_ms": 0.6948758363723755,
        "max_ms": 0.6948758363723755,
        "compile_time": 1.3085408210754395
    },
    {
        "BLOCK_SIZE_M": 32,
        "BLOCK_SIZE_N": 256,
        "BLOCK_SIZE_K": 64,
        "GROUP_SIZE_M": 8,
        "num_stages": 3,
        "num_warps": 8,
        "ms": 0.6950623393058777,
        "min_ms": 0.6950623393058777,
        "max_ms": 0.6950623393058777,
        "compile_time": 1.231342077255249
    },
    {
        "BLOCK_SIZE_M": 32,
        "BLOCK_SIZE_N": 512,
        "BLOCK_SIZE_K": 32,
        "GROUP_SIZE_M": 8,
        "num_stages": 5,
        "num_warps": 16,
        "ms": 0.6952354311943054,
        "min_ms": 0.6952354311943054,
        "max_ms": 0.6952354311943054,
        "compile_time": 1.2279446125030518
    },
    {
        "BLOCK_SIZE_M": 32,
        "BLOCK_SIZE_N": 256,
        "BLOCK_SIZE_K": 32,
        "GROUP_SIZE_M": 8,
        "num_stages": 7,
        "num_warps": 4,
        "ms": 0.6966812610626221,
        "min_ms": 0.6966812610626221,
        "max_ms": 0.6966812610626221,
        "compile_time": 2.1037261486053467
    },
    {
        "BLOCK_SIZE_M": 256,
        "BLOCK_SIZE_N": 32,
        "BLOCK_SIZE_K": 32,
        "GROUP_SIZE_M": 8,
        "num_stages": 8,
        "num_warps": 4,
        "ms": 0.6971161365509033,
        "min_ms": 0.6971161365509033,
        "max_ms": 0.6971161365509033,
        "compile_time": 1.3393957614898682
    },
    {
        "BLOCK_SIZE_M": 32,
        "BLOCK_SIZE_N": 256,
        "BLOCK_SIZE_K": 16,
        "GROUP_SIZE_M": 8,
        "num_stages": 3,
        "num_warps": 4,
        "ms": 0.6974450349807739,
        "min_ms": 0.6974450349807739,
        "max_ms": 0.6974450349807739,
        "compile_time": 1.2287964820861816
    },
    {
        "BLOCK_SIZE_M": 64,
        "BLOCK_SIZE_N": 64,
        "BLOCK_SIZE_K": 64,
        "GROUP_SIZE_M": 8,
        "num_stages": 5,
        "num_warps": 8,
        "ms": 0.6979993581771851,
        "min_ms": 0.6979993581771851,
        "max_ms": 0.6979993581771851,
        "compile_time": 1.3175010681152344
    },
    {
        "BLOCK_SIZE_M": 64,
        "BLOCK_SIZE_N": 512,
        "BLOCK_SIZE_K": 64,
        "GROUP_SIZE_M": 8,
        "num_stages": 3,
        "num_warps": 16,
        "ms": 0.6980600357055664,
        "min_ms": 0.6980600357055664,
        "max_ms": 0.6980600357055664,
        "compile_time": 2.1268458366394043
    },
    {
        "BLOCK_SIZE_M": 64,
        "BLOCK_SIZE_N": 256,
        "BLOCK_SIZE_K": 16,
        "GROUP_SIZE_M": 8,
        "num_stages": 3,
        "num_warps": 16,
        "ms": 0.6983872652053833,
        "min_ms": 0.6983872652053833,
        "max_ms": 0.6983872652053833,
        "compile_time": 1.2449226379394531
    },
    {
        "BLOCK_SIZE_M": 128,
        "BLOCK_SIZE_N": 128,
        "BLOCK_SIZE_K": 256,
        "GROUP_SIZE_M": 8,
        "num_stages": 2,
        "num_warps": 16,
        "ms": 0.6984214782714844,
        "min_ms": 0.6984214782714844,
        "max_ms": 0.6984214782714844,
        "compile_time": 1.2779383659362793
    },
    {
        "BLOCK_SIZE_M": 32,
        "BLOCK_SIZE_N": 256,
        "BLOCK_SIZE_K": 32,
        "GROUP_SIZE_M": 8,
        "num_stages": 4,
        "num_warps": 8,
        "ms": 0.6984654664993286,
        "min_ms": 0.6984654664993286,
        "max_ms": 0.6984654664993286,
        "compile_time": 1.7785704135894775
    },
    {
        "BLOCK_SIZE_M": 64,
        "BLOCK_SIZE_N": 256,
        "BLOCK_SIZE_K": 16,
        "GROUP_SIZE_M": 8,
        "num_stages": 4,
        "num_warps": 16,
        "ms": 0.6989765167236328,
        "min_ms": 0.6989765167236328,
        "max_ms": 0.6989765167236328,
        "compile_time": 1.2517690658569336
    },
    {
        "BLOCK_SIZE_M": 32,
        "BLOCK_SIZE_N": 512,
        "BLOCK_SIZE_K": 32,
        "GROUP_SIZE_M": 8,
        "num_stages": 4,
        "num_warps": 16,
        "ms": 0.699220597743988,
        "min_ms": 0.699220597743988,
        "max_ms": 0.699220597743988,
        "compile_time": 1.2259349822998047
    },
    {
        "BLOCK_SIZE_M": 256,
        "BLOCK_SIZE_N": 32,
        "BLOCK_SIZE_K": 128,
        "GROUP_SIZE_M": 8,
        "num_stages": 3,
        "num_warps": 8,
        "ms": 0.6995818614959717,
        "min_ms": 0.6995818614959717,
        "max_ms": 0.6995818614959717,
        "compile_time": 2.542966842651367
    },
    {
        "BLOCK_SIZE_M": 512,
        "BLOCK_SIZE_N": 32,
        "BLOCK_SIZE_K": 32,
        "GROUP_SIZE_M": 8,
        "num_stages": 5,
        "num_warps": 8,
        "ms": 0.6999566555023193,
        "min_ms": 0.6999566555023193,
        "max_ms": 0.6999566555023193,
        "compile_time": 2.462860107421875
    },
    {
        "BLOCK_SIZE_M": 64,
        "BLOCK_SIZE_N": 64,
        "BLOCK_SIZE_K": 64,
        "GROUP_SIZE_M": 8,
        "num_stages": 2,
        "num_warps": 2,
        "ms": 0.7003432512283325,
        "min_ms": 0.7003432512283325,
        "max_ms": 0.7003432512283325,
        "compile_time": 2.094686985015869
    },
    {
        "BLOCK_SIZE_M": 64,
        "BLOCK_SIZE_N": 256,
        "BLOCK_SIZE_K": 16,
        "GROUP_SIZE_M": 8,
        "num_stages": 6,
        "num_warps": 16,
        "ms": 0.7010393142700195,
        "min_ms": 0.7010393142700195,
        "max_ms": 0.7010393142700195,
        "compile_time": 1.2480418682098389
    },
    {
        "BLOCK_SIZE_M": 512,
        "BLOCK_SIZE_N": 64,
        "BLOCK_SIZE_K": 16,
        "GROUP_SIZE_M": 8,
        "num_stages": 4,
        "num_warps": 8,
        "ms": 0.7012079358100891,
        "min_ms": 0.7012079358100891,
        "max_ms": 0.7012079358100891,
        "compile_time": 1.33418869972229
    },
    {
        "BLOCK_SIZE_M": 64,
        "BLOCK_SIZE_N": 64,
        "BLOCK_SIZE_K": 64,
        "GROUP_SIZE_M": 8,
        "num_stages": 6,
        "num_warps": 8,
        "ms": 0.7013731598854065,
        "min_ms": 0.7013731598854065,
        "max_ms": 0.7013731598854065,
        "compile_time": 1.3171155452728271
    },
    {
        "BLOCK_SIZE_M": 64,
        "BLOCK_SIZE_N": 256,
        "BLOCK_SIZE_K": 16,
        "GROUP_SIZE_M": 8,
        "num_stages": 5,
        "num_warps": 16,
        "ms": 0.7017399072647095,
        "min_ms": 0.7017399072647095,
        "max_ms": 0.7017399072647095,
        "compile_time": 1.2645139694213867
    },
    {
        "BLOCK_SIZE_M": 64,
        "BLOCK_SIZE_N": 256,
        "BLOCK_SIZE_K": 16,
        "GROUP_SIZE_M": 8,
        "num_stages": 7,
        "num_warps": 16,
        "ms": 0.7023484110832214,
        "min_ms": 0.7023484110832214,
        "max_ms": 0.7023484110832214,
        "compile_time": 1.3182933330535889
    },
    {
        "BLOCK_SIZE_M": 128,
        "BLOCK_SIZE_N": 256,
        "BLOCK_SIZE_K": 64,
        "GROUP_SIZE_M": 8,
        "num_stages": 1,
        "num_warps": 16,
        "ms": 0.7025104761123657,
        "min_ms": 0.7025104761123657,
        "max_ms": 0.7025104761123657,
        "compile_time": 1.8274099826812744
    },
    {
        "BLOCK_SIZE_M": 512,
        "BLOCK_SIZE_N": 64,
        "BLOCK_SIZE_K": 16,
        "GROUP_SIZE_M": 8,
        "num_stages": 5,
        "num_warps": 8,
        "ms": 0.70258629322052,
        "min_ms": 0.70258629322052,
        "max_ms": 0.70258629322052,
        "compile_time": 1.3307075500488281
    },
    {
        "BLOCK_SIZE_M": 64,
        "BLOCK_SIZE_N": 128,
        "BLOCK_SIZE_K": 64,
        "GROUP_SIZE_M": 8,
        "num_stages": 1,
        "num_warps": 2,
        "ms": 0.703721821308136,
        "min_ms": 0.703721821308136,
        "max_ms": 0.703721821308136,
        "compile_time": 2.477231502532959
    },
    {
        "BLOCK_SIZE_M": 256,
        "BLOCK_SIZE_N": 32,
        "BLOCK_SIZE_K": 32,
        "GROUP_SIZE_M": 8,
        "num_stages": 3,
        "num_warps": 2,
        "ms": 0.7047683596611023,
        "min_ms": 0.7047683596611023,
        "max_ms": 0.7047683596611023,
        "compile_time": 1.328416109085083
    },
    {
        "BLOCK_SIZE_M": 64,
        "BLOCK_SIZE_N": 256,
        "BLOCK_SIZE_K": 16,
        "GROUP_SIZE_M": 8,
        "num_stages": 8,
        "num_warps": 16,
        "ms": 0.7050144076347351,
        "min_ms": 0.7050144076347351,
        "max_ms": 0.7050144076347351,
        "compile_time": 1.2558515071868896
    },
    {
        "BLOCK_SIZE_M": 32,
        "BLOCK_SIZE_N": 256,
        "BLOCK_SIZE_K": 64,
        "GROUP_SIZE_M": 8,
        "num_stages": 5,
        "num_warps": 8,
        "ms": 0.7051307559013367,
        "min_ms": 0.7051307559013367,
        "max_ms": 0.7051307559013367,
        "compile_time": 1.2327768802642822
    },
    {
        "BLOCK_SIZE_M": 512,
        "BLOCK_SIZE_N": 64,
        "BLOCK_SIZE_K": 16,
        "GROUP_SIZE_M": 8,
        "num_stages": 6,
        "num_warps": 8,
        "ms": 0.7054928541183472,
        "min_ms": 0.7054928541183472,
        "max_ms": 0.7054928541183472,
        "compile_time": 1.328319787979126
    },
    {
        "BLOCK_SIZE_M": 64,
        "BLOCK_SIZE_N": 256,
        "BLOCK_SIZE_K": 64,
        "GROUP_SIZE_M": 8,
        "num_stages": 2,
        "num_warps": 8,
        "ms": 0.705520510673523,
        "min_ms": 0.705520510673523,
        "max_ms": 0.705520510673523,
        "compile_time": 1.2173855304718018
    },
    {
        "BLOCK_SIZE_M": 32,
        "BLOCK_SIZE_N": 512,
        "BLOCK_SIZE_K": 64,
        "GROUP_SIZE_M": 8,
        "num_stages": 3,
        "num_warps": 8,
        "ms": 0.7056413888931274,
        "min_ms": 0.7056413888931274,
        "max_ms": 0.7056413888931274,
        "compile_time": 1.2176103591918945
    },
    {
        "BLOCK_SIZE_M": 32,
        "BLOCK_SIZE_N": 256,
        "BLOCK_SIZE_K": 32,
        "GROUP_SIZE_M": 8,
        "num_stages": 5,
        "num_warps": 8,
        "ms": 0.7063283324241638,
        "min_ms": 0.7063283324241638,
        "max_ms": 0.7063283324241638,
        "compile_time": 1.2566120624542236
    },
    {
        "BLOCK_SIZE_M": 512,
        "BLOCK_SIZE_N": 64,
        "BLOCK_SIZE_K": 16,
        "GROUP_SIZE_M": 8,
        "num_stages": 8,
        "num_warps": 8,
        "ms": 0.7064968943595886,
        "min_ms": 0.7064968943595886,
        "max_ms": 0.7064968943595886,
        "compile_time": 1.3419549465179443
    },
    {
        "BLOCK_SIZE_M": 512,
        "BLOCK_SIZE_N": 64,
        "BLOCK_SIZE_K": 16,
        "GROUP_SIZE_M": 8,
        "num_stages": 7,
        "num_warps": 8,
        "ms": 0.706618070602417,
        "min_ms": 0.706618070602417,
        "max_ms": 0.706618070602417,
        "compile_time": 1.3371598720550537
    },
    {
        "BLOCK_SIZE_M": 64,
        "BLOCK_SIZE_N": 128,
        "BLOCK_SIZE_K": 64,
        "GROUP_SIZE_M": 8,
        "num_stages": 3,
        "num_warps": 16,
        "ms": 0.7068126201629639,
        "min_ms": 0.7068126201629639,
        "max_ms": 0.7068126201629639,
        "compile_time": 1.2430548667907715
    },
    {
        "BLOCK_SIZE_M": 64,
        "BLOCK_SIZE_N": 128,
        "BLOCK_SIZE_K": 64,
        "GROUP_SIZE_M": 8,
        "num_stages": 4,
        "num_warps": 16,
        "ms": 0.7068345546722412,
        "min_ms": 0.7068345546722412,
        "max_ms": 0.7068345546722412,
        "compile_time": 1.2485675811767578
    },
    {
        "BLOCK_SIZE_M": 32,
        "BLOCK_SIZE_N": 256,
        "BLOCK_SIZE_K": 16,
        "GROUP_SIZE_M": 8,
        "num_stages": 7,
        "num_warps": 4,
        "ms": 0.7069926857948303,
        "min_ms": 0.7069926857948303,
        "max_ms": 0.7069926857948303,
        "compile_time": 1.2410430908203125
    },
    {
        "BLOCK_SIZE_M": 128,
        "BLOCK_SIZE_N": 64,
        "BLOCK_SIZE_K": 128,
        "GROUP_SIZE_M": 8,
        "num_stages": 1,
        "num_warps": 8,
        "ms": 0.7073639631271362,
        "min_ms": 0.7073639631271362,
        "max_ms": 0.7073639631271362,
        "compile_time": 1.5182671546936035
    },
    {
        "BLOCK_SIZE_M": 512,
        "BLOCK_SIZE_N": 64,
        "BLOCK_SIZE_K": 16,
        "GROUP_SIZE_M": 8,
        "num_stages": 3,
        "num_warps": 8,
        "ms": 0.7074469327926636,
        "min_ms": 0.7074469327926636,
        "max_ms": 0.7074469327926636,
        "compile_time": 1.3350765705108643
    },
    {
        "BLOCK_SIZE_M": 64,
        "BLOCK_SIZE_N": 128,
        "BLOCK_SIZE_K": 64,
        "GROUP_SIZE_M": 8,
        "num_stages": 5,
        "num_warps": 16,
        "ms": 0.7075380086898804,
        "min_ms": 0.7075380086898804,
        "max_ms": 0.7075380086898804,
        "compile_time": 1.7869389057159424
    },
    {
        "BLOCK_SIZE_M": 256,
        "BLOCK_SIZE_N": 64,
        "BLOCK_SIZE_K": 64,
        "GROUP_SIZE_M": 8,
        "num_stages": 2,
        "num_warps": 8,
        "ms": 0.7079781293869019,
        "min_ms": 0.7079781293869019,
        "max_ms": 0.7079781293869019,
        "compile_time": 2.336967945098877
    },
    {
        "BLOCK_SIZE_M": 64,
        "BLOCK_SIZE_N": 64,
        "BLOCK_SIZE_K": 16,
        "GROUP_SIZE_M": 8,
        "num_stages": 8,
        "num_warps": 2,
        "ms": 0.7080604434013367,
        "min_ms": 0.7080604434013367,
        "max_ms": 0.7080604434013367,
        "compile_time": 1.927990436553955
    },
    {
        "BLOCK_SIZE_M": 32,
        "BLOCK_SIZE_N": 512,
        "BLOCK_SIZE_K": 32,
        "GROUP_SIZE_M": 8,
        "num_stages": 3,
        "num_warps": 8,
        "ms": 0.7097569704055786,
        "min_ms": 0.7097569704055786,
        "max_ms": 0.7097569704055786,
        "compile_time": 1.2100574970245361
    },
    {
        "BLOCK_SIZE_M": 32,
        "BLOCK_SIZE_N": 512,
        "BLOCK_SIZE_K": 16,
        "GROUP_SIZE_M": 8,
        "num_stages": 6,
        "num_warps": 4,
        "ms": 0.7099810838699341,
        "min_ms": 0.7099810838699341,
        "max_ms": 0.7099810838699341,
        "compile_time": 1.1913940906524658
    },
    {
        "BLOCK_SIZE_M": 32,
        "BLOCK_SIZE_N": 256,
        "BLOCK_SIZE_K": 16,
        "GROUP_SIZE_M": 8,
        "num_stages": 8,
        "num_warps": 4,
        "ms": 0.7104713916778564,
        "min_ms": 0.7104713916778564,
        "max_ms": 0.7104713916778564,
        "compile_time": 1.2418439388275146
    },
    {
        "BLOCK_SIZE_M": 64,
        "BLOCK_SIZE_N": 128,
        "BLOCK_SIZE_K": 64,
        "GROUP_SIZE_M": 8,
        "num_stages": 6,
        "num_warps": 16,
        "ms": 0.7107278108596802,
        "min_ms": 0.7107278108596802,
        "max_ms": 0.7107278108596802,
        "compile_time": 1.2659947872161865
    },
    {
        "BLOCK_SIZE_M": 32,
        "BLOCK_SIZE_N": 512,
        "BLOCK_SIZE_K": 16,
        "GROUP_SIZE_M": 8,
        "num_stages": 7,
        "num_warps": 4,
        "ms": 0.7109888195991516,
        "min_ms": 0.7109888195991516,
        "max_ms": 0.7109888195991516,
        "compile_time": 1.2270143032073975
    },
    {
        "BLOCK_SIZE_M": 32,
        "BLOCK_SIZE_N": 512,
        "BLOCK_SIZE_K": 16,
        "GROUP_SIZE_M": 8,
        "num_stages": 8,
        "num_warps": 4,
        "ms": 0.7114333510398865,
        "min_ms": 0.7114333510398865,
        "max_ms": 0.7114333510398865,
        "compile_time": 1.2179560661315918
    },
    {
        "BLOCK_SIZE_M": 64,
        "BLOCK_SIZE_N": 64,
        "BLOCK_SIZE_K": 16,
        "GROUP_SIZE_M": 8,
        "num_stages": 6,
        "num_warps": 2,
        "ms": 0.7116929888725281,
        "min_ms": 0.7116929888725281,
        "max_ms": 0.7116929888725281,
        "compile_time": 1.8789076805114746
    },
    {
        "BLOCK_SIZE_M": 512,
        "BLOCK_SIZE_N": 64,
        "BLOCK_SIZE_K": 16,
        "GROUP_SIZE_M": 8,
        "num_stages": 4,
        "num_warps": 16,
        "ms": 0.7119325399398804,
        "min_ms": 0.7119325399398804,
        "max_ms": 0.7119325399398804,
        "compile_time": 1.3355329036712646
    },
    {
        "BLOCK_SIZE_M": 32,
        "BLOCK_SIZE_N": 256,
        "BLOCK_SIZE_K": 64,
        "GROUP_SIZE_M": 8,
        "num_stages": 4,
        "num_warps": 4,
        "ms": 0.7120388150215149,
        "min_ms": 0.7120388150215149,
        "max_ms": 0.7120388150215149,
        "compile_time": 2.3026671409606934
    },
    {
        "BLOCK_SIZE_M": 128,
        "BLOCK_SIZE_N": 128,
        "BLOCK_SIZE_K": 64,
        "GROUP_SIZE_M": 8,
        "num_stages": 3,
        "num_warps": 32,
        "ms": 0.712873101234436,
        "min_ms": 0.712873101234436,
        "max_ms": 0.712873101234436,
        "compile_time": 1.2853236198425293
    },
    {
        "BLOCK_SIZE_M": 32,
        "BLOCK_SIZE_N": 256,
        "BLOCK_SIZE_K": 32,
        "GROUP_SIZE_M": 8,
        "num_stages": 2,
        "num_warps": 4,
        "ms": 0.7130952477455139,
        "min_ms": 0.7130952477455139,
        "max_ms": 0.7130952477455139,
        "compile_time": 1.840515375137329
    },
    {
        "BLOCK_SIZE_M": 64,
        "BLOCK_SIZE_N": 128,
        "BLOCK_SIZE_K": 64,
        "GROUP_SIZE_M": 8,
        "num_stages": 7,
        "num_warps": 16,
        "ms": 0.7133365869522095,
        "min_ms": 0.7133365869522095,
        "max_ms": 0.7133365869522095,
        "compile_time": 1.2391948699951172
    },
    {
        "BLOCK_SIZE_M": 512,
        "BLOCK_SIZE_N": 64,
        "BLOCK_SIZE_K": 16,
        "GROUP_SIZE_M": 8,
        "num_stages": 5,
        "num_warps": 16,
        "ms": 0.7138335108757019,
        "min_ms": 0.7138335108757019,
        "max_ms": 0.7138335108757019,
        "compile_time": 1.3311052322387695
    },
    {
        "BLOCK_SIZE_M": 512,
        "BLOCK_SIZE_N": 64,
        "BLOCK_SIZE_K": 32,
        "GROUP_SIZE_M": 8,
        "num_stages": 2,
        "num_warps": 8,
        "ms": 0.7139722108840942,
        "min_ms": 0.7139722108840942,
        "max_ms": 0.7139722108840942,
        "compile_time": 2.7432777881622314
    },
    {
        "BLOCK_SIZE_M": 512,
        "BLOCK_SIZE_N": 64,
        "BLOCK_SIZE_K": 16,
        "GROUP_SIZE_M": 8,
        "num_stages": 6,
        "num_warps": 16,
        "ms": 0.7149428129196167,
        "min_ms": 0.7149428129196167,
        "max_ms": 0.7149428129196167,
        "compile_time": 1.3373661041259766
    },
    {
        "BLOCK_SIZE_M": 512,
        "BLOCK_SIZE_N": 64,
        "BLOCK_SIZE_K": 16,
        "GROUP_SIZE_M": 8,
        "num_stages": 3,
        "num_warps": 16,
        "ms": 0.7151709794998169,
        "min_ms": 0.7151709794998169,
        "max_ms": 0.7151709794998169,
        "compile_time": 1.3259599208831787
    },
    {
        "BLOCK_SIZE_M": 128,
        "BLOCK_SIZE_N": 128,
        "BLOCK_SIZE_K": 64,
        "GROUP_SIZE_M": 8,
        "num_stages": 4,
        "num_warps": 32,
        "ms": 0.7152577638626099,
        "min_ms": 0.7152577638626099,
        "max_ms": 0.7152577638626099,
        "compile_time": 1.8980205059051514
    },
    {
        "BLOCK_SIZE_M": 64,
        "BLOCK_SIZE_N": 64,
        "BLOCK_SIZE_K": 16,
        "GROUP_SIZE_M": 8,
        "num_stages": 7,
        "num_warps": 2,
        "ms": 0.7153064608573914,
        "min_ms": 0.7153064608573914,
        "max_ms": 0.7153064608573914,
        "compile_time": 1.8978040218353271
    },
    {
        "BLOCK_SIZE_M": 32,
        "BLOCK_SIZE_N": 256,
        "BLOCK_SIZE_K": 16,
        "GROUP_SIZE_M": 8,
        "num_stages": 7,
        "num_warps": 2,
        "ms": 0.7156299352645874,
        "min_ms": 0.7156299352645874,
        "max_ms": 0.7156299352645874,
        "compile_time": 2.278263807296753
    },
    {
        "BLOCK_SIZE_M": 64,
        "BLOCK_SIZE_N": 64,
        "BLOCK_SIZE_K": 16,
        "GROUP_SIZE_M": 8,
        "num_stages": 5,
        "num_warps": 2,
        "ms": 0.7159778475761414,
        "min_ms": 0.7159778475761414,
        "max_ms": 0.7159778475761414,
        "compile_time": 1.888420581817627
    },
    {
        "BLOCK_SIZE_M": 64,
        "BLOCK_SIZE_N": 64,
        "BLOCK_SIZE_K": 16,
        "GROUP_SIZE_M": 8,
        "num_stages": 4,
        "num_warps": 2,
        "ms": 0.7160876393318176,
        "min_ms": 0.7160876393318176,
        "max_ms": 0.7160876393318176,
        "compile_time": 1.8519642353057861
    },
    {
        "BLOCK_SIZE_M": 256,
        "BLOCK_SIZE_N": 32,
        "BLOCK_SIZE_K": 32,
        "GROUP_SIZE_M": 8,
        "num_stages": 4,
        "num_warps": 8,
        "ms": 0.7162984609603882,
        "min_ms": 0.7162984609603882,
        "max_ms": 0.7162984609603882,
        "compile_time": 1.337425708770752
    },
    {
        "BLOCK_SIZE_M": 32,
        "BLOCK_SIZE_N": 256,
        "BLOCK_SIZE_K": 32,
        "GROUP_SIZE_M": 8,
        "num_stages": 6,
        "num_warps": 8,
        "ms": 0.7164430618286133,
        "min_ms": 0.7164430618286133,
        "max_ms": 0.7164430618286133,
        "compile_time": 1.8138809204101562
    },
    {
        "BLOCK_SIZE_M": 512,
        "BLOCK_SIZE_N": 32,
        "BLOCK_SIZE_K": 32,
        "GROUP_SIZE_M": 8,
        "num_stages": 3,
        "num_warps": 8,
        "ms": 0.7170378565788269,
        "min_ms": 0.7170378565788269,
        "max_ms": 0.7170378565788269,
        "compile_time": 2.345041275024414
    },
    {
        "BLOCK_SIZE_M": 32,
        "BLOCK_SIZE_N": 256,
        "BLOCK_SIZE_K": 32,
        "GROUP_SIZE_M": 8,
        "num_stages": 3,
        "num_warps": 8,
        "ms": 0.7173728346824646,
        "min_ms": 0.7173728346824646,
        "max_ms": 0.7173728346824646,
        "compile_time": 1.2259342670440674
    },
    {
        "BLOCK_SIZE_M": 256,
        "BLOCK_SIZE_N": 64,
        "BLOCK_SIZE_K": 128,
        "GROUP_SIZE_M": 8,
        "num_stages": 2,
        "num_warps": 8,
        "ms": 0.7174479961395264,
        "min_ms": 0.7174479961395264,
        "max_ms": 0.7174479961395264,
        "compile_time": 2.556861400604248
    },
    {
        "BLOCK_SIZE_M": 256,
        "BLOCK_SIZE_N": 64,
        "BLOCK_SIZE_K": 128,
        "GROUP_SIZE_M": 8,
        "num_stages": 3,
        "num_warps": 32,
        "ms": 0.7177042961120605,
        "min_ms": 0.7177042961120605,
        "max_ms": 0.7177042961120605,
        "compile_time": 1.325085163116455
    },
    {
        "BLOCK_SIZE_M": 512,
        "BLOCK_SIZE_N": 64,
        "BLOCK_SIZE_K": 16,
        "GROUP_SIZE_M": 8,
        "num_stages": 7,
        "num_warps": 16,
        "ms": 0.7179232239723206,
        "min_ms": 0.7179232239723206,
        "max_ms": 0.7179232239723206,
        "compile_time": 1.3196134567260742
    },
    {
        "BLOCK_SIZE_M": 128,
        "BLOCK_SIZE_N": 128,
        "BLOCK_SIZE_K": 64,
        "GROUP_SIZE_M": 8,
        "num_stages": 5,
        "num_warps": 32,
        "ms": 0.7179775834083557,
        "min_ms": 0.7179775834083557,
        "max_ms": 0.7179775834083557,
        "compile_time": 1.2949023246765137
    },
    {
        "BLOCK_SIZE_M": 512,
        "BLOCK_SIZE_N": 32,
        "BLOCK_SIZE_K": 64,
        "GROUP_SIZE_M": 8,
        "num_stages": 3,
        "num_warps": 16,
        "ms": 0.7185468077659607,
        "min_ms": 0.7185468077659607,
        "max_ms": 0.7185468077659607,
        "compile_time": 2.339275360107422
    },
    {
        "BLOCK_SIZE_M": 32,
        "BLOCK_SIZE_N": 256,
        "BLOCK_SIZE_K": 16,
        "GROUP_SIZE_M": 8,
        "num_stages": 5,
        "num_warps": 8,
        "ms": 0.7198241353034973,
        "min_ms": 0.7198241353034973,
        "max_ms": 0.7198241353034973,
        "compile_time": 1.7115442752838135
    },
    {
        "BLOCK_SIZE_M": 512,
        "BLOCK_SIZE_N": 64,
        "BLOCK_SIZE_K": 16,
        "GROUP_SIZE_M": 8,
        "num_stages": 8,
        "num_warps": 16,
        "ms": 0.7199971079826355,
        "min_ms": 0.7199971079826355,
        "max_ms": 0.7199971079826355,
        "compile_time": 2.3320233821868896
    },
    {
        "BLOCK_SIZE_M": 32,
        "BLOCK_SIZE_N": 256,
        "BLOCK_SIZE_K": 16,
        "GROUP_SIZE_M": 8,
        "num_stages": 4,
        "num_warps": 8,
        "ms": 0.7200273871421814,
        "min_ms": 0.7200273871421814,
        "max_ms": 0.7200273871421814,
        "compile_time": 1.6967482566833496
    },
    {
        "BLOCK_SIZE_M": 32,
        "BLOCK_SIZE_N": 256,
        "BLOCK_SIZE_K": 64,
        "GROUP_SIZE_M": 8,
        "num_stages": 4,
        "num_warps": 8,
        "ms": 0.7209141254425049,
        "min_ms": 0.7209141254425049,
        "max_ms": 0.7209141254425049,
        "compile_time": 1.219167947769165
    },
    {
        "BLOCK_SIZE_M": 256,
        "BLOCK_SIZE_N": 32,
        "BLOCK_SIZE_K": 32,
        "GROUP_SIZE_M": 8,
        "num_stages": 5,
        "num_warps": 8,
        "ms": 0.7209240198135376,
        "min_ms": 0.7209240198135376,
        "max_ms": 0.7209240198135376,
        "compile_time": 1.3493893146514893
    },
    {
        "BLOCK_SIZE_M": 128,
        "BLOCK_SIZE_N": 32,
        "BLOCK_SIZE_K": 32,
        "GROUP_SIZE_M": 8,
        "num_stages": 6,
        "num_warps": 2,
        "ms": 0.7210021018981934,
        "min_ms": 0.7210021018981934,
        "max_ms": 0.7210021018981934,
        "compile_time": 1.3806819915771484
    },
    {
        "BLOCK_SIZE_M": 256,
        "BLOCK_SIZE_N": 32,
        "BLOCK_SIZE_K": 32,
        "GROUP_SIZE_M": 8,
        "num_stages": 3,
        "num_warps": 8,
        "ms": 0.7213114500045776,
        "min_ms": 0.7213114500045776,
        "max_ms": 0.7213114500045776,
        "compile_time": 1.347346544265747
    },
    {
        "BLOCK_SIZE_M": 256,
        "BLOCK_SIZE_N": 32,
        "BLOCK_SIZE_K": 128,
        "GROUP_SIZE_M": 8,
        "num_stages": 2,
        "num_warps": 4,
        "ms": 0.7216395735740662,
        "min_ms": 0.7216395735740662,
        "max_ms": 0.7216395735740662,
        "compile_time": 2.812659740447998
    },
    {
        "BLOCK_SIZE_M": 64,
        "BLOCK_SIZE_N": 256,
        "BLOCK_SIZE_K": 128,
        "GROUP_SIZE_M": 8,
        "num_stages": 2,
        "num_warps": 8,
        "ms": 0.721643328666687,
        "min_ms": 0.721643328666687,
        "max_ms": 0.721643328666687,
        "compile_time": 2.3019778728485107
    },
    {
        "BLOCK_SIZE_M": 32,
        "BLOCK_SIZE_N": 256,
        "BLOCK_SIZE_K": 32,
        "GROUP_SIZE_M": 8,
        "num_stages": 3,
        "num_warps": 2,
        "ms": 0.72173011302948,
        "min_ms": 0.72173011302948,
        "max_ms": 0.72173011302948,
        "compile_time": 2.555652618408203
    },
    {
        "BLOCK_SIZE_M": 32,
        "BLOCK_SIZE_N": 512,
        "BLOCK_SIZE_K": 64,
        "GROUP_SIZE_M": 8,
        "num_stages": 3,
        "num_warps": 16,
        "ms": 0.7219501733779907,
        "min_ms": 0.7219501733779907,
        "max_ms": 0.7219501733779907,
        "compile_time": 1.2255501747131348
    },
    {
        "BLOCK_SIZE_M": 32,
        "BLOCK_SIZE_N": 256,
        "BLOCK_SIZE_K": 16,
        "GROUP_SIZE_M": 8,
        "num_stages": 6,
        "num_warps": 8,
        "ms": 0.7221886515617371,
        "min_ms": 0.7221886515617371,
        "max_ms": 0.7221886515617371,
        "compile_time": 1.2492833137512207
    },
    {
        "BLOCK_SIZE_M": 128,
        "BLOCK_SIZE_N": 64,
        "BLOCK_SIZE_K": 128,
        "GROUP_SIZE_M": 8,
        "num_stages": 2,
        "num_warps": 2,
        "ms": 0.7224583625793457,
        "min_ms": 0.7224583625793457,
        "max_ms": 0.7224583625793457,
        "compile_time": 3.659973621368408
    },
    {
        "BLOCK_SIZE_M": 128,
        "BLOCK_SIZE_N": 32,
        "BLOCK_SIZE_K": 64,
        "GROUP_SIZE_M": 8,
        "num_stages": 3,
        "num_warps": 4,
        "ms": 0.7224631905555725,
        "min_ms": 0.7224631905555725,
        "max_ms": 0.7224631905555725,
        "compile_time": 1.601034164428711
    },
    {
        "BLOCK_SIZE_M": 256,
        "BLOCK_SIZE_N": 32,
        "BLOCK_SIZE_K": 32,
        "GROUP_SIZE_M": 8,
        "num_stages": 2,
        "num_warps": 4,
        "ms": 0.7225481271743774,
        "min_ms": 0.7225481271743774,
        "max_ms": 0.7225481271743774,
        "compile_time": 1.315760612487793
    },
    {
        "BLOCK_SIZE_M": 128,
        "BLOCK_SIZE_N": 32,
        "BLOCK_SIZE_K": 64,
        "GROUP_SIZE_M": 8,
        "num_stages": 4,
        "num_warps": 2,
        "ms": 0.7225859761238098,
        "min_ms": 0.7225859761238098,
        "max_ms": 0.7225859761238098,
        "compile_time": 1.5134656429290771
    },
    {
        "BLOCK_SIZE_M": 32,
        "BLOCK_SIZE_N": 256,
        "BLOCK_SIZE_K": 32,
        "GROUP_SIZE_M": 8,
        "num_stages": 8,
        "num_warps": 8,
        "ms": 0.7226777076721191,
        "min_ms": 0.7226777076721191,
        "max_ms": 0.7226777076721191,
        "compile_time": 1.2476887702941895
    },
    {
        "BLOCK_SIZE_M": 128,
        "BLOCK_SIZE_N": 128,
        "BLOCK_SIZE_K": 64,
        "GROUP_SIZE_M": 8,
        "num_stages": 6,
        "num_warps": 32,
        "ms": 0.7228126525878906,
        "min_ms": 0.7228126525878906,
        "max_ms": 0.7228126525878906,
        "compile_time": 1.2850258350372314
    },
    {
        "BLOCK_SIZE_M": 64,
        "BLOCK_SIZE_N": 128,
        "BLOCK_SIZE_K": 16,
        "GROUP_SIZE_M": 8,
        "num_stages": 4,
        "num_warps": 8,
        "ms": 0.7231488227844238,
        "min_ms": 0.7231488227844238,
        "max_ms": 0.7231488227844238,
        "compile_time": 1.256810188293457
    },
    {
        "BLOCK_SIZE_M": 128,
        "BLOCK_SIZE_N": 64,
        "BLOCK_SIZE_K": 64,
        "GROUP_SIZE_M": 8,
        "num_stages": 5,
        "num_warps": 16,
        "ms": 0.7236027121543884,
        "min_ms": 0.7236027121543884,
        "max_ms": 0.7236027121543884,
        "compile_time": 1.5171129703521729
    },
    {
        "BLOCK_SIZE_M": 128,
        "BLOCK_SIZE_N": 64,
        "BLOCK_SIZE_K": 128,
        "GROUP_SIZE_M": 8,
        "num_stages": 1,
        "num_warps": 4,
        "ms": 0.7236167192459106,
        "min_ms": 0.7236167192459106,
        "max_ms": 0.7236167192459106,
        "compile_time": 2.5840935707092285
    },
    {
        "BLOCK_SIZE_M": 32,
        "BLOCK_SIZE_N": 256,
        "BLOCK_SIZE_K": 32,
        "GROUP_SIZE_M": 8,
        "num_stages": 7,
        "num_warps": 8,
        "ms": 0.724034309387207,
        "min_ms": 0.724034309387207,
        "max_ms": 0.724034309387207,
        "compile_time": 1.2372643947601318
    },
    {
        "BLOCK_SIZE_M": 32,
        "BLOCK_SIZE_N": 128,
        "BLOCK_SIZE_K": 32,
        "GROUP_SIZE_M": 8,
        "num_stages": 4,
        "num_warps": 2,
        "ms": 0.7240475416183472,
        "min_ms": 0.7240475416183472,
        "max_ms": 0.7240475416183472,
        "compile_time": 1.975036859512329
    },
    {
        "BLOCK_SIZE_M": 64,
        "BLOCK_SIZE_N": 128,
        "BLOCK_SIZE_K": 16,
        "GROUP_SIZE_M": 8,
        "num_stages": 5,
        "num_warps": 8,
        "ms": 0.7243472337722778,
        "min_ms": 0.7243472337722778,
        "max_ms": 0.7243472337722778,
        "compile_time": 1.2492995262145996
    },
    {
        "BLOCK_SIZE_M": 32,
        "BLOCK_SIZE_N": 512,
        "BLOCK_SIZE_K": 32,
        "GROUP_SIZE_M": 8,
        "num_stages": 3,
        "num_warps": 16,
        "ms": 0.7246461510658264,
        "min_ms": 0.7246461510658264,
        "max_ms": 0.7246461510658264,
        "compile_time": 1.2215020656585693
    },
    {
        "BLOCK_SIZE_M": 32,
        "BLOCK_SIZE_N": 256,
        "BLOCK_SIZE_K": 16,
        "GROUP_SIZE_M": 8,
        "num_stages": 8,
        "num_warps": 2,
        "ms": 0.7261379957199097,
        "min_ms": 0.7261379957199097,
        "max_ms": 0.7261379957199097,
        "compile_time": 2.3449292182922363
    },
    {
        "BLOCK_SIZE_M": 32,
        "BLOCK_SIZE_N": 128,
        "BLOCK_SIZE_K": 32,
        "GROUP_SIZE_M": 8,
        "num_stages": 3,
        "num_warps": 4,
        "ms": 0.7267624139785767,
        "min_ms": 0.7267624139785767,
        "max_ms": 0.7267624139785767,
        "compile_time": 1.233212947845459
    },
    {
        "BLOCK_SIZE_M": 128,
        "BLOCK_SIZE_N": 64,
        "BLOCK_SIZE_K": 64,
        "GROUP_SIZE_M": 8,
        "num_stages": 6,
        "num_warps": 16,
        "ms": 0.7267782688140869,
        "min_ms": 0.7267782688140869,
        "max_ms": 0.7267782688140869,
        "compile_time": 1.5004136562347412
    },
    {
        "BLOCK_SIZE_M": 32,
        "BLOCK_SIZE_N": 128,
        "BLOCK_SIZE_K": 32,
        "GROUP_SIZE_M": 8,
        "num_stages": 5,
        "num_warps": 2,
        "ms": 0.7267832159996033,
        "min_ms": 0.7267832159996033,
        "max_ms": 0.7267832159996033,
        "compile_time": 2.0212953090667725
    },
    {
        "BLOCK_SIZE_M": 128,
        "BLOCK_SIZE_N": 32,
        "BLOCK_SIZE_K": 32,
        "GROUP_SIZE_M": 8,
        "num_stages": 4,
        "num_warps": 2,
        "ms": 0.7269242405891418,
        "min_ms": 0.7269242405891418,
        "max_ms": 0.7269242405891418,
        "compile_time": 1.3767902851104736
    },
    {
        "BLOCK_SIZE_M": 64,
        "BLOCK_SIZE_N": 128,
        "BLOCK_SIZE_K": 16,
        "GROUP_SIZE_M": 8,
        "num_stages": 6,
        "num_warps": 8,
        "ms": 0.7283018827438354,
        "min_ms": 0.7283018827438354,
        "max_ms": 0.7283018827438354,
        "compile_time": 1.7557013034820557
    },
    {
        "BLOCK_SIZE_M": 128,
        "BLOCK_SIZE_N": 32,
        "BLOCK_SIZE_K": 64,
        "GROUP_SIZE_M": 8,
        "num_stages": 5,
        "num_warps": 2,
        "ms": 0.7283273339271545,
        "min_ms": 0.7283273339271545,
        "max_ms": 0.7283273339271545,
        "compile_time": 1.5168287754058838
    },
    {
        "BLOCK_SIZE_M": 64,
        "BLOCK_SIZE_N": 64,
        "BLOCK_SIZE_K": 16,
        "GROUP_SIZE_M": 8,
        "num_stages": 3,
        "num_warps": 2,
        "ms": 0.7285009026527405,
        "min_ms": 0.7285009026527405,
        "max_ms": 0.7285009026527405,
        "compile_time": 1.8311376571655273
    },
    {
        "BLOCK_SIZE_M": 128,
        "BLOCK_SIZE_N": 64,
        "BLOCK_SIZE_K": 16,
        "GROUP_SIZE_M": 8,
        "num_stages": 4,
        "num_warps": 8,
        "ms": 0.7288635969161987,
        "min_ms": 0.7288635969161987,
        "max_ms": 0.7288635969161987,
        "compile_time": 1.5271110534667969
    },
    {
        "BLOCK_SIZE_M": 128,
        "BLOCK_SIZE_N": 32,
        "BLOCK_SIZE_K": 64,
        "GROUP_SIZE_M": 8,
        "num_stages": 3,
        "num_warps": 2,
        "ms": 0.7289687991142273,
        "min_ms": 0.7289687991142273,
        "max_ms": 0.7289687991142273,
        "compile_time": 1.5310773849487305
    },
    {
        "BLOCK_SIZE_M": 64,
        "BLOCK_SIZE_N": 64,
        "BLOCK_SIZE_K": 16,
        "GROUP_SIZE_M": 8,
        "num_stages": 6,
        "num_warps": 4,
        "ms": 0.729019284248352,
        "min_ms": 0.729019284248352,
        "max_ms": 0.729019284248352,
        "compile_time": 1.2530686855316162
    },
    {
        "BLOCK_SIZE_M": 64,
        "BLOCK_SIZE_N": 128,
        "BLOCK_SIZE_K": 16,
        "GROUP_SIZE_M": 8,
        "num_stages": 7,
        "num_warps": 8,
        "ms": 0.7295985221862793,
        "min_ms": 0.7295985221862793,
        "max_ms": 0.7295985221862793,
        "compile_time": 1.2687463760375977
    },
    {
        "BLOCK_SIZE_M": 64,
        "BLOCK_SIZE_N": 128,
        "BLOCK_SIZE_K": 128,
        "GROUP_SIZE_M": 8,
        "num_stages": 1,
        "num_warps": 8,
        "ms": 0.7297742366790771,
        "min_ms": 0.7297742366790771,
        "max_ms": 0.7297742366790771,
        "compile_time": 1.2527530193328857
    },
    {
        "BLOCK_SIZE_M": 64,
        "BLOCK_SIZE_N": 64,
        "BLOCK_SIZE_K": 16,
        "GROUP_SIZE_M": 8,
        "num_stages": 4,
        "num_warps": 4,
        "ms": 0.7301490902900696,
        "min_ms": 0.7301490902900696,
        "max_ms": 0.7301490902900696,
        "compile_time": 1.30765962600708
    },
    {
        "BLOCK_SIZE_M": 128,
        "BLOCK_SIZE_N": 64,
        "BLOCK_SIZE_K": 16,
        "GROUP_SIZE_M": 8,
        "num_stages": 5,
        "num_warps": 8,
        "ms": 0.7306641340255737,
        "min_ms": 0.7306641340255737,
        "max_ms": 0.7306641340255737,
        "compile_time": 1.5384881496429443
    },
    {
        "BLOCK_SIZE_M": 32,
        "BLOCK_SIZE_N": 128,
        "BLOCK_SIZE_K": 32,
        "GROUP_SIZE_M": 8,
        "num_stages": 3,
        "num_warps": 2,
        "ms": 0.7308675050735474,
        "min_ms": 0.7308675050735474,
        "max_ms": 0.7308675050735474,
        "compile_time": 1.9309425354003906
    },
    {
        "BLOCK_SIZE_M": 128,
        "BLOCK_SIZE_N": 64,
        "BLOCK_SIZE_K": 32,
        "GROUP_SIZE_M": 8,
        "num_stages": 1,
        "num_warps": 4,
        "ms": 0.7309216856956482,
        "min_ms": 0.7309216856956482,
        "max_ms": 0.7309216856956482,
        "compile_time": 1.565868854522705
    },
    {
        "BLOCK_SIZE_M": 64,
        "BLOCK_SIZE_N": 64,
        "BLOCK_SIZE_K": 16,
        "GROUP_SIZE_M": 8,
        "num_stages": 5,
        "num_warps": 4,
        "ms": 0.7310373187065125,
        "min_ms": 0.7310373187065125,
        "max_ms": 0.7310373187065125,
        "compile_time": 1.2993807792663574
    },
    {
        "BLOCK_SIZE_M": 128,
        "BLOCK_SIZE_N": 256,
        "BLOCK_SIZE_K": 128,
        "GROUP_SIZE_M": 8,
        "num_stages": 2,
        "num_warps": 16,
        "ms": 0.7311328649520874,
        "min_ms": 0.7311328649520874,
        "max_ms": 0.7311328649520874,
        "compile_time": 1.7794890403747559
    },
    {
        "BLOCK_SIZE_M": 128,
        "BLOCK_SIZE_N": 64,
        "BLOCK_SIZE_K": 16,
        "GROUP_SIZE_M": 8,
        "num_stages": 7,
        "num_warps": 8,
        "ms": 0.7312955856323242,
        "min_ms": 0.7312955856323242,
        "max_ms": 0.7312955856323242,
        "compile_time": 1.5375194549560547
    },
    {
        "BLOCK_SIZE_M": 128,
        "BLOCK_SIZE_N": 64,
        "BLOCK_SIZE_K": 64,
        "GROUP_SIZE_M": 8,
        "num_stages": 7,
        "num_warps": 16,
        "ms": 0.731745719909668,
        "min_ms": 0.731745719909668,
        "max_ms": 0.731745719909668,
        "compile_time": 1.5292346477508545
    },
    {
        "BLOCK_SIZE_M": 32,
        "BLOCK_SIZE_N": 512,
        "BLOCK_SIZE_K": 32,
        "GROUP_SIZE_M": 8,
        "num_stages": 4,
        "num_warps": 4,
        "ms": 0.7319286465644836,
        "min_ms": 0.7319286465644836,
        "max_ms": 0.7319286465644836,
        "compile_time": 1.2021746635437012
    },
    {
        "BLOCK_SIZE_M": 128,
        "BLOCK_SIZE_N": 32,
        "BLOCK_SIZE_K": 64,
        "GROUP_SIZE_M": 8,
        "num_stages": 5,
        "num_warps": 4,
        "ms": 0.7319642901420593,
        "min_ms": 0.7319642901420593,
        "max_ms": 0.7319642901420593,
        "compile_time": 1.539625644683838
    },
    {
        "BLOCK_SIZE_M": 128,
        "BLOCK_SIZE_N": 32,
        "BLOCK_SIZE_K": 32,
        "GROUP_SIZE_M": 8,
        "num_stages": 3,
        "num_warps": 2,
        "ms": 0.7322735786437988,
        "min_ms": 0.7322735786437988,
        "max_ms": 0.7322735786437988,
        "compile_time": 1.3776452541351318
    },
    {
        "BLOCK_SIZE_M": 128,
        "BLOCK_SIZE_N": 64,
        "BLOCK_SIZE_K": 16,
        "GROUP_SIZE_M": 8,
        "num_stages": 6,
        "num_warps": 8,
        "ms": 0.7331433296203613,
        "min_ms": 0.7331433296203613,
        "max_ms": 0.7331433296203613,
        "compile_time": 1.5305709838867188
    },
    {
        "BLOCK_SIZE_M": 128,
        "BLOCK_SIZE_N": 256,
        "BLOCK_SIZE_K": 64,
        "GROUP_SIZE_M": 8,
        "num_stages": 1,
        "num_warps": 8,
        "ms": 0.7333968281745911,
        "min_ms": 0.7333968281745911,
        "max_ms": 0.7333968281745911,
        "compile_time": 1.8401296138763428
    },
    {
        "BLOCK_SIZE_M": 64,
        "BLOCK_SIZE_N": 128,
        "BLOCK_SIZE_K": 16,
        "GROUP_SIZE_M": 8,
        "num_stages": 8,
        "num_warps": 8,
        "ms": 0.7339060306549072,
        "min_ms": 0.7339060306549072,
        "max_ms": 0.7339060306549072,
        "compile_time": 1.8086049556732178
    },
    {
        "BLOCK_SIZE_M": 32,
        "BLOCK_SIZE_N": 256,
        "BLOCK_SIZE_K": 128,
        "GROUP_SIZE_M": 8,
        "num_stages": 2,
        "num_warps": 4,
        "ms": 0.7339701056480408,
        "min_ms": 0.7339701056480408,
        "max_ms": 0.7339701056480408,
        "compile_time": 2.695887327194214
    },
    {
        "BLOCK_SIZE_M": 64,
        "BLOCK_SIZE_N": 64,
        "BLOCK_SIZE_K": 16,
        "GROUP_SIZE_M": 8,
        "num_stages": 7,
        "num_warps": 4,
        "ms": 0.7340636253356934,
        "min_ms": 0.7340636253356934,
        "max_ms": 0.7340636253356934,
        "compile_time": 1.2825396060943604
    },
    {
        "BLOCK_SIZE_M": 64,
        "BLOCK_SIZE_N": 64,
        "BLOCK_SIZE_K": 128,
        "GROUP_SIZE_M": 8,
        "num_stages": 4,
        "num_warps": 8,
        "ms": 0.7340918779373169,
        "min_ms": 0.7340918779373169,
        "max_ms": 0.7340918779373169,
        "compile_time": 1.249267816543579
    },
    {
        "BLOCK_SIZE_M": 32,
        "BLOCK_SIZE_N": 128,
        "BLOCK_SIZE_K": 64,
        "GROUP_SIZE_M": 8,
        "num_stages": 3,
        "num_warps": 2,
        "ms": 0.7342489957809448,
        "min_ms": 0.7342489957809448,
        "max_ms": 0.7342489957809448,
        "compile_time": 2.244990348815918
    },
    {
        "BLOCK_SIZE_M": 32,
        "BLOCK_SIZE_N": 512,
        "BLOCK_SIZE_K": 32,
        "GROUP_SIZE_M": 8,
        "num_stages": 5,
        "num_warps": 4,
        "ms": 0.7344127893447876,
        "min_ms": 0.7344127893447876,
        "max_ms": 0.7344127893447876,
        "compile_time": 1.2078857421875
    },
    {
        "BLOCK_SIZE_M": 128,
        "BLOCK_SIZE_N": 32,
        "BLOCK_SIZE_K": 64,
        "GROUP_SIZE_M": 8,
        "num_stages": 4,
        "num_warps": 4,
        "ms": 0.7344871759414673,
        "min_ms": 0.7344871759414673,
        "max_ms": 0.7344871759414673,
        "compile_time": 1.5466196537017822
    },
    {
        "BLOCK_SIZE_M": 64,
        "BLOCK_SIZE_N": 64,
        "BLOCK_SIZE_K": 16,
        "GROUP_SIZE_M": 8,
        "num_stages": 8,
        "num_warps": 4,
        "ms": 0.7345359921455383,
        "min_ms": 0.7345359921455383,
        "max_ms": 0.7345359921455383,
        "compile_time": 1.2726950645446777
    },
    {
        "BLOCK_SIZE_M": 64,
        "BLOCK_SIZE_N": 128,
        "BLOCK_SIZE_K": 16,
        "GROUP_SIZE_M": 8,
        "num_stages": 3,
        "num_warps": 8,
        "ms": 0.734542727470398,
        "min_ms": 0.734542727470398,
        "max_ms": 0.734542727470398,
        "compile_time": 1.2542569637298584
    },
    {
        "BLOCK_SIZE_M": 256,
        "BLOCK_SIZE_N": 128,
        "BLOCK_SIZE_K": 128,
        "GROUP_SIZE_M": 8,
        "num_stages": 1,
        "num_warps": 8,
        "ms": 0.734634280204773,
        "min_ms": 0.734634280204773,
        "max_ms": 0.734634280204773,
        "compile_time": 2.8787853717803955
    },
    {
        "BLOCK_SIZE_M": 64,
        "BLOCK_SIZE_N": 64,
        "BLOCK_SIZE_K": 128,
        "GROUP_SIZE_M": 8,
        "num_stages": 5,
        "num_warps": 8,
        "ms": 0.7347747087478638,
        "min_ms": 0.7347747087478638,
        "max_ms": 0.7347747087478638,
        "compile_time": 1.2442700862884521
    },
    {
        "BLOCK_SIZE_M": 128,
        "BLOCK_SIZE_N": 64,
        "BLOCK_SIZE_K": 64,
        "GROUP_SIZE_M": 8,
        "num_stages": 2,
        "num_warps": 16,
        "ms": 0.7358108758926392,
        "min_ms": 0.7358108758926392,
        "max_ms": 0.7358108758926392,
        "compile_time": 1.5354371070861816
    },
    {
        "BLOCK_SIZE_M": 32,
        "BLOCK_SIZE_N": 128,
        "BLOCK_SIZE_K": 16,
        "GROUP_SIZE_M": 8,
        "num_stages": 4,
        "num_warps": 2,
        "ms": 0.7373958826065063,
        "min_ms": 0.7373958826065063,
        "max_ms": 0.7373958826065063,
        "compile_time": 1.8029532432556152
    },
    {
        "BLOCK_SIZE_M": 128,
        "BLOCK_SIZE_N": 32,
        "BLOCK_SIZE_K": 128,
        "GROUP_SIZE_M": 8,
        "num_stages": 3,
        "num_warps": 4,
        "ms": 0.7375540137290955,
        "min_ms": 0.7375540137290955,
        "max_ms": 0.7375540137290955,
        "compile_time": 1.5245578289031982
    },
    {
        "BLOCK_SIZE_M": 128,
        "BLOCK_SIZE_N": 64,
        "BLOCK_SIZE_K": 16,
        "GROUP_SIZE_M": 8,
        "num_stages": 8,
        "num_warps": 8,
        "ms": 0.7376323938369751,
        "min_ms": 0.7376323938369751,
        "max_ms": 0.7376323938369751,
        "compile_time": 1.5112993717193604
    },
    {
        "BLOCK_SIZE_M": 128,
        "BLOCK_SIZE_N": 128,
        "BLOCK_SIZE_K": 256,
        "GROUP_SIZE_M": 8,
        "num_stages": 1,
        "num_warps": 8,
        "ms": 0.7377315759658813,
        "min_ms": 0.7377315759658813,
        "max_ms": 0.7377315759658813,
        "compile_time": 2.840301752090454
    },
    {
        "BLOCK_SIZE_M": 32,
        "BLOCK_SIZE_N": 128,
        "BLOCK_SIZE_K": 32,
        "GROUP_SIZE_M": 8,
        "num_stages": 6,
        "num_warps": 2,
        "ms": 0.7377801537513733,
        "min_ms": 0.7377801537513733,
        "max_ms": 0.7377801537513733,
        "compile_time": 2.071624994277954
    },
    {
        "BLOCK_SIZE_M": 256,
        "BLOCK_SIZE_N": 64,
        "BLOCK_SIZE_K": 128,
        "GROUP_SIZE_M": 8,
        "num_stages": 2,
        "num_warps": 16,
        "ms": 0.7379114627838135,
        "min_ms": 0.7379114627838135,
        "max_ms": 0.7379114627838135,
        "compile_time": 2.2755730152130127
    },
    {
        "BLOCK_SIZE_M": 128,
        "BLOCK_SIZE_N": 32,
        "BLOCK_SIZE_K": 32,
        "GROUP_SIZE_M": 8,
        "num_stages": 4,
        "num_warps": 4,
        "ms": 0.7388299703598022,
        "min_ms": 0.7388299703598022,
        "max_ms": 0.7388299703598022,
        "compile_time": 1.3975398540496826
    },
    {
        "BLOCK_SIZE_M": 64,
        "BLOCK_SIZE_N": 128,
        "BLOCK_SIZE_K": 32,
        "GROUP_SIZE_M": 8,
        "num_stages": 1,
        "num_warps": 8,
        "ms": 0.73896723985672,
        "min_ms": 0.73896723985672,
        "max_ms": 0.73896723985672,
        "compile_time": 1.6943957805633545
    },
    {
        "BLOCK_SIZE_M": 128,
        "BLOCK_SIZE_N": 32,
        "BLOCK_SIZE_K": 32,
        "GROUP_SIZE_M": 8,
        "num_stages": 3,
        "num_warps": 4,
        "ms": 0.7391924262046814,
        "min_ms": 0.7391924262046814,
        "max_ms": 0.7391924262046814,
        "compile_time": 1.3989951610565186
    },
    {
        "BLOCK_SIZE_M": 64,
        "BLOCK_SIZE_N": 256,
        "BLOCK_SIZE_K": 128,
        "GROUP_SIZE_M": 8,
        "num_stages": 2,
        "num_warps": 16,
        "ms": 0.7408773303031921,
        "min_ms": 0.7408773303031921,
        "max_ms": 0.7408773303031921,
        "compile_time": 2.041726589202881
    },
    {
        "BLOCK_SIZE_M": 32,
        "BLOCK_SIZE_N": 128,
        "BLOCK_SIZE_K": 16,
        "GROUP_SIZE_M": 8,
        "num_stages": 6,
        "num_warps": 2,
        "ms": 0.7414799332618713,
        "min_ms": 0.7414799332618713,
        "max_ms": 0.7414799332618713,
        "compile_time": 1.8455286026000977
    },
    {
        "BLOCK_SIZE_M": 512,
        "BLOCK_SIZE_N": 64,
        "BLOCK_SIZE_K": 32,
        "GROUP_SIZE_M": 8,
        "num_stages": 4,
        "num_warps": 16,
        "ms": 0.7415001392364502,
        "min_ms": 0.7415001392364502,
        "max_ms": 0.7415001392364502,
        "compile_time": 1.344865322113037
    },
    {
        "BLOCK_SIZE_M": 128,
        "BLOCK_SIZE_N": 32,
        "BLOCK_SIZE_K": 32,
        "GROUP_SIZE_M": 8,
        "num_stages": 5,
        "num_warps": 4,
        "ms": 0.7418032884597778,
        "min_ms": 0.7418032884597778,
        "max_ms": 0.7418032884597778,
        "compile_time": 1.397850751876831
    },
    {
        "BLOCK_SIZE_M": 32,
        "BLOCK_SIZE_N": 256,
        "BLOCK_SIZE_K": 128,
        "GROUP_SIZE_M": 8,
        "num_stages": 3,
        "num_warps": 4,
        "ms": 0.7422293424606323,
        "min_ms": 0.7422293424606323,
        "max_ms": 0.7422293424606323,
        "compile_time": 3.156907796859741
    },
    {
        "BLOCK_SIZE_M": 32,
        "BLOCK_SIZE_N": 128,
        "BLOCK_SIZE_K": 16,
        "GROUP_SIZE_M": 8,
        "num_stages": 5,
        "num_warps": 2,
        "ms": 0.742445170879364,
        "min_ms": 0.742445170879364,
        "max_ms": 0.742445170879364,
        "compile_time": 1.8290197849273682
    },
    {
        "BLOCK_SIZE_M": 128,
        "BLOCK_SIZE_N": 32,
        "BLOCK_SIZE_K": 64,
        "GROUP_SIZE_M": 8,
        "num_stages": 6,
        "num_warps": 4,
        "ms": 0.7424477338790894,
        "min_ms": 0.7424477338790894,
        "max_ms": 0.7424477338790894,
        "compile_time": 1.5249764919281006
    },
    {
        "BLOCK_SIZE_M": 64,
        "BLOCK_SIZE_N": 64,
        "BLOCK_SIZE_K": 16,
        "GROUP_SIZE_M": 8,
        "num_stages": 3,
        "num_warps": 4,
        "ms": 0.742531418800354,
        "min_ms": 0.742531418800354,
        "max_ms": 0.742531418800354,
        "compile_time": 1.2566418647766113
    },
    {
        "BLOCK_SIZE_M": 32,
        "BLOCK_SIZE_N": 128,
        "BLOCK_SIZE_K": 32,
        "GROUP_SIZE_M": 8,
        "num_stages": 4,
        "num_warps": 4,
        "ms": 0.7429877519607544,
        "min_ms": 0.7429877519607544,
        "max_ms": 0.7429877519607544,
        "compile_time": 1.247699499130249
    },
    {
        "BLOCK_SIZE_M": 32,
        "BLOCK_SIZE_N": 128,
        "BLOCK_SIZE_K": 32,
        "GROUP_SIZE_M": 8,
        "num_stages": 6,
        "num_warps": 4,
        "ms": 0.7435047030448914,
        "min_ms": 0.7435047030448914,
        "max_ms": 0.7435047030448914,
        "compile_time": 1.2478511333465576
    },
    {
        "BLOCK_SIZE_M": 32,
        "BLOCK_SIZE_N": 128,
        "BLOCK_SIZE_K": 64,
        "GROUP_SIZE_M": 8,
        "num_stages": 3,
        "num_warps": 4,
        "ms": 0.7435165643692017,
        "min_ms": 0.7435165643692017,
        "max_ms": 0.7435165643692017,
        "compile_time": 1.2306039333343506
    },
    {
        "BLOCK_SIZE_M": 64,
        "BLOCK_SIZE_N": 128,
        "BLOCK_SIZE_K": 32,
        "GROUP_SIZE_M": 8,
        "num_stages": 1,
        "num_warps": 4,
        "ms": 0.7441319227218628,
        "min_ms": 0.7441319227218628,
        "max_ms": 0.7441319227218628,
        "compile_time": 1.223616600036621
    },
    {
        "BLOCK_SIZE_M": 128,
        "BLOCK_SIZE_N": 32,
        "BLOCK_SIZE_K": 32,
        "GROUP_SIZE_M": 8,
        "num_stages": 6,
        "num_warps": 4,
        "ms": 0.7442865371704102,
        "min_ms": 0.7442865371704102,
        "max_ms": 0.7442865371704102,
        "compile_time": 1.404372215270996
    },
    {
        "BLOCK_SIZE_M": 128,
        "BLOCK_SIZE_N": 32,
        "BLOCK_SIZE_K": 32,
        "GROUP_SIZE_M": 8,
        "num_stages": 7,
        "num_warps": 2,
        "ms": 0.7443124651908875,
        "min_ms": 0.7443124651908875,
        "max_ms": 0.7443124651908875,
        "compile_time": 1.3681108951568604
    },
    {
        "BLOCK_SIZE_M": 32,
        "BLOCK_SIZE_N": 256,
        "BLOCK_SIZE_K": 16,
        "GROUP_SIZE_M": 8,
        "num_stages": 3,
        "num_warps": 8,
        "ms": 0.7443944811820984,
        "min_ms": 0.7443944811820984,
        "max_ms": 0.7443944811820984,
        "compile_time": 1.2292108535766602
    },
    {
        "BLOCK_SIZE_M": 32,
        "BLOCK_SIZE_N": 128,
        "BLOCK_SIZE_K": 32,
        "GROUP_SIZE_M": 8,
        "num_stages": 5,
        "num_warps": 4,
        "ms": 0.7449837327003479,
        "min_ms": 0.7449837327003479,
        "max_ms": 0.7449837327003479,
        "compile_time": 1.7869560718536377
    },
    {
        "BLOCK_SIZE_M": 128,
        "BLOCK_SIZE_N": 32,
        "BLOCK_SIZE_K": 64,
        "GROUP_SIZE_M": 8,
        "num_stages": 7,
        "num_warps": 4,
        "ms": 0.7454285621643066,
        "min_ms": 0.7454285621643066,
        "max_ms": 0.7454285621643066,
        "compile_time": 1.5388095378875732
    },
    {
        "BLOCK_SIZE_M": 32,
        "BLOCK_SIZE_N": 512,
        "BLOCK_SIZE_K": 16,
        "GROUP_SIZE_M": 8,
        "num_stages": 7,
        "num_warps": 8,
        "ms": 0.7457393407821655,
        "min_ms": 0.7457393407821655,
        "max_ms": 0.7457393407821655,
        "compile_time": 1.2222628593444824
    },
    {
        "BLOCK_SIZE_M": 128,
        "BLOCK_SIZE_N": 32,
        "BLOCK_SIZE_K": 32,
        "GROUP_SIZE_M": 8,
        "num_stages": 5,
        "num_warps": 2,
        "ms": 0.7465923428535461,
        "min_ms": 0.7465923428535461,
        "max_ms": 0.7465923428535461,
        "compile_time": 1.3745613098144531
    },
    {
        "BLOCK_SIZE_M": 128,
        "BLOCK_SIZE_N": 64,
        "BLOCK_SIZE_K": 16,
        "GROUP_SIZE_M": 8,
        "num_stages": 3,
        "num_warps": 8,
        "ms": 0.7468441724777222,
        "min_ms": 0.7468441724777222,
        "max_ms": 0.7468441724777222,
        "compile_time": 1.5442938804626465
    },
    {
        "BLOCK_SIZE_M": 32,
        "BLOCK_SIZE_N": 512,
        "BLOCK_SIZE_K": 16,
        "GROUP_SIZE_M": 8,
        "num_stages": 6,
        "num_warps": 8,
        "ms": 0.7477855682373047,
        "min_ms": 0.7477855682373047,
        "max_ms": 0.7477855682373047,
        "compile_time": 1.2004814147949219
    },
    {
        "BLOCK_SIZE_M": 32,
        "BLOCK_SIZE_N": 512,
        "BLOCK_SIZE_K": 16,
        "GROUP_SIZE_M": 8,
        "num_stages": 8,
        "num_warps": 8,
        "ms": 0.747860312461853,
        "min_ms": 0.747860312461853,
        "max_ms": 0.747860312461853,
        "compile_time": 1.2176191806793213
    },
    {
        "BLOCK_SIZE_M": 32,
        "BLOCK_SIZE_N": 256,
        "BLOCK_SIZE_K": 16,
        "GROUP_SIZE_M": 8,
        "num_stages": 7,
        "num_warps": 8,
        "ms": 0.747887134552002,
        "min_ms": 0.747887134552002,
        "max_ms": 0.747887134552002,
        "compile_time": 1.7414751052856445
    },
    {
        "BLOCK_SIZE_M": 64,
        "BLOCK_SIZE_N": 64,
        "BLOCK_SIZE_K": 256,
        "GROUP_SIZE_M": 8,
        "num_stages": 3,
        "num_warps": 8,
        "ms": 0.7483798265457153,
        "min_ms": 0.7483798265457153,
        "max_ms": 0.7483798265457153,
        "compile_time": 2.126837968826294
    },
    {
        "BLOCK_SIZE_M": 128,
        "BLOCK_SIZE_N": 32,
        "BLOCK_SIZE_K": 32,
        "GROUP_SIZE_M": 8,
        "num_stages": 8,
        "num_warps": 2,
        "ms": 0.7492293119430542,
        "min_ms": 0.7492293119430542,
        "max_ms": 0.7492293119430542,
        "compile_time": 1.5529258251190186
    },
    {
        "BLOCK_SIZE_M": 128,
        "BLOCK_SIZE_N": 32,
        "BLOCK_SIZE_K": 64,
        "GROUP_SIZE_M": 8,
        "num_stages": 8,
        "num_warps": 4,
        "ms": 0.749381959438324,
        "min_ms": 0.749381959438324,
        "max_ms": 0.749381959438324,
        "compile_time": 1.511260747909546
    },
    {
        "BLOCK_SIZE_M": 64,
        "BLOCK_SIZE_N": 64,
        "BLOCK_SIZE_K": 128,
        "GROUP_SIZE_M": 8,
        "num_stages": 6,
        "num_warps": 8,
        "ms": 0.7496861219406128,
        "min_ms": 0.7496861219406128,
        "max_ms": 0.7496861219406128,
        "compile_time": 1.2427473068237305
    },
    {
        "BLOCK_SIZE_M": 128,
        "BLOCK_SIZE_N": 128,
        "BLOCK_SIZE_K": 64,
        "GROUP_SIZE_M": 8,
        "num_stages": 2,
        "num_warps": 16,
        "ms": 0.7502118945121765,
        "min_ms": 0.7502118945121765,
        "max_ms": 0.7502118945121765,
        "compile_time": 1.97591233253479
    },
    {
        "BLOCK_SIZE_M": 32,
        "BLOCK_SIZE_N": 256,
        "BLOCK_SIZE_K": 16,
        "GROUP_SIZE_M": 8,
        "num_stages": 8,
        "num_warps": 8,
        "ms": 0.7502764463424683,
        "min_ms": 0.7502764463424683,
        "max_ms": 0.7502764463424683,
        "compile_time": 1.761432409286499
    },
    {
        "BLOCK_SIZE_M": 64,
        "BLOCK_SIZE_N": 64,
        "BLOCK_SIZE_K": 64,
        "GROUP_SIZE_M": 8,
        "num_stages": 2,
        "num_warps": 8,
        "ms": 0.7507623434066772,
        "min_ms": 0.7507623434066772,
        "max_ms": 0.7507623434066772,
        "compile_time": 1.726658821105957
    },
    {
        "BLOCK_SIZE_M": 64,
        "BLOCK_SIZE_N": 64,
        "BLOCK_SIZE_K": 128,
        "GROUP_SIZE_M": 8,
        "num_stages": 2,
        "num_warps": 8,
        "ms": 0.7516541481018066,
        "min_ms": 0.7516541481018066,
        "max_ms": 0.7516541481018066,
        "compile_time": 1.2402987480163574
    },
    {
        "BLOCK_SIZE_M": 32,
        "BLOCK_SIZE_N": 128,
        "BLOCK_SIZE_K": 16,
        "GROUP_SIZE_M": 8,
        "num_stages": 3,
        "num_warps": 2,
        "ms": 0.7517874240875244,
        "min_ms": 0.7517874240875244,
        "max_ms": 0.7517874240875244,
        "compile_time": 1.755789041519165
    },
    {
        "BLOCK_SIZE_M": 64,
        "BLOCK_SIZE_N": 128,
        "BLOCK_SIZE_K": 16,
        "GROUP_SIZE_M": 8,
        "num_stages": 2,
        "num_warps": 4,
        "ms": 0.7520108222961426,
        "min_ms": 0.7520108222961426,
        "max_ms": 0.7520108222961426,
        "compile_time": 1.7572345733642578
    },
    {
        "BLOCK_SIZE_M": 128,
        "BLOCK_SIZE_N": 32,
        "BLOCK_SIZE_K": 128,
        "GROUP_SIZE_M": 8,
        "num_stages": 4,
        "num_warps": 4,
        "ms": 0.7524431347846985,
        "min_ms": 0.7524431347846985,
        "max_ms": 0.7524431347846985,
        "compile_time": 1.5193986892700195
    },
    {
        "BLOCK_SIZE_M": 256,
        "BLOCK_SIZE_N": 32,
        "BLOCK_SIZE_K": 32,
        "GROUP_SIZE_M": 8,
        "num_stages": 4,
        "num_warps": 2,
        "ms": 0.7530432343482971,
        "min_ms": 0.7530432343482971,
        "max_ms": 0.7530432343482971,
        "compile_time": 1.3137545585632324
    },
    {
        "BLOCK_SIZE_M": 64,
        "BLOCK_SIZE_N": 64,
        "BLOCK_SIZE_K": 64,
        "GROUP_SIZE_M": 8,
        "num_stages": 7,
        "num_warps": 8,
        "ms": 0.7532373070716858,
        "min_ms": 0.7532373070716858,
        "max_ms": 0.7532373070716858,
        "compile_time": 1.259225606918335
    },
    {
        "BLOCK_SIZE_M": 64,
        "BLOCK_SIZE_N": 64,
        "BLOCK_SIZE_K": 32,
        "GROUP_SIZE_M": 8,
        "num_stages": 3,
        "num_warps": 8,
        "ms": 0.7533528804779053,
        "min_ms": 0.7533528804779053,
        "max_ms": 0.7533528804779053,
        "compile_time": 1.2589943408966064
    },
    {
        "BLOCK_SIZE_M": 32,
        "BLOCK_SIZE_N": 128,
        "BLOCK_SIZE_K": 64,
        "GROUP_SIZE_M": 8,
        "num_stages": 5,
        "num_warps": 2,
        "ms": 0.7536965608596802,
        "min_ms": 0.7536965608596802,
        "max_ms": 0.7536965608596802,
        "compile_time": 2.393850803375244
    },
    {
        "BLOCK_SIZE_M": 32,
        "BLOCK_SIZE_N": 256,
        "BLOCK_SIZE_K": 128,
        "GROUP_SIZE_M": 8,
        "num_stages": 3,
        "num_warps": 8,
        "ms": 0.7539680600166321,
        "min_ms": 0.7539680600166321,
        "max_ms": 0.7539680600166321,
        "compile_time": 2.239490270614624
    },
    {
        "BLOCK_SIZE_M": 64,
        "BLOCK_SIZE_N": 256,
        "BLOCK_SIZE_K": 64,
        "GROUP_SIZE_M": 8,
        "num_stages": 1,
        "num_warps": 4,
        "ms": 0.7542069554328918,
        "min_ms": 0.7542069554328918,
        "max_ms": 0.7542069554328918,
        "compile_time": 2.424860954284668
    },
    {
        "BLOCK_SIZE_M": 32,
        "BLOCK_SIZE_N": 256,
        "BLOCK_SIZE_K": 32,
        "GROUP_SIZE_M": 8,
        "num_stages": 2,
        "num_warps": 2,
        "ms": 0.754294753074646,
        "min_ms": 0.754294753074646,
        "max_ms": 0.754294753074646,
        "compile_time": 2.370185375213623
    },
    {
        "BLOCK_SIZE_M": 128,
        "BLOCK_SIZE_N": 32,
        "BLOCK_SIZE_K": 128,
        "GROUP_SIZE_M": 8,
        "num_stages": 3,
        "num_warps": 2,
        "ms": 0.7547785043716431,
        "min_ms": 0.7547785043716431,
        "max_ms": 0.7547785043716431,
        "compile_time": 1.5226733684539795
    },
    {
        "BLOCK_SIZE_M": 64,
        "BLOCK_SIZE_N": 64,
        "BLOCK_SIZE_K": 32,
        "GROUP_SIZE_M": 8,
        "num_stages": 6,
        "num_warps": 8,
        "ms": 0.7548508644104004,
        "min_ms": 0.7548508644104004,
        "max_ms": 0.7548508644104004,
        "compile_time": 1.2637336254119873
    },
    {
        "BLOCK_SIZE_M": 32,
        "BLOCK_SIZE_N": 128,
        "BLOCK_SIZE_K": 32,
        "GROUP_SIZE_M": 8,
        "num_stages": 8,
        "num_warps": 2,
        "ms": 0.7548758387565613,
        "min_ms": 0.7548758387565613,
        "max_ms": 0.7548758387565613,
        "compile_time": 2.138545513153076
    },
    {
        "BLOCK_SIZE_M": 64,
        "BLOCK_SIZE_N": 256,
        "BLOCK_SIZE_K": 128,
        "GROUP_SIZE_M": 8,
        "num_stages": 1,
        "num_warps": 4,
        "ms": 0.7548867464065552,
        "min_ms": 0.7548867464065552,
        "max_ms": 0.7548867464065552,
        "compile_time": 2.8584482669830322
    },
    {
        "BLOCK_SIZE_M": 32,
        "BLOCK_SIZE_N": 128,
        "BLOCK_SIZE_K": 32,
        "GROUP_SIZE_M": 8,
        "num_stages": 7,
        "num_warps": 2,
        "ms": 0.7549790143966675,
        "min_ms": 0.7549790143966675,
        "max_ms": 0.7549790143966675,
        "compile_time": 2.132387399673462
    },
    {
        "BLOCK_SIZE_M": 32,
        "BLOCK_SIZE_N": 128,
        "BLOCK_SIZE_K": 16,
        "GROUP_SIZE_M": 8,
        "num_stages": 7,
        "num_warps": 2,
        "ms": 0.7553436756134033,
        "min_ms": 0.7553436756134033,
        "max_ms": 0.7553436756134033,
        "compile_time": 1.8688256740570068
    },
    {
        "BLOCK_SIZE_M": 64,
        "BLOCK_SIZE_N": 64,
        "BLOCK_SIZE_K": 64,
        "GROUP_SIZE_M": 8,
        "num_stages": 8,
        "num_warps": 8,
        "ms": 0.7557040452957153,
        "min_ms": 0.7557040452957153,
        "max_ms": 0.7557040452957153,
        "compile_time": 1.244143009185791
    },
    {
        "BLOCK_SIZE_M": 256,
        "BLOCK_SIZE_N": 32,
        "BLOCK_SIZE_K": 32,
        "GROUP_SIZE_M": 8,
        "num_stages": 2,
        "num_warps": 2,
        "ms": 0.756600022315979,
        "min_ms": 0.756600022315979,
        "max_ms": 0.756600022315979,
        "compile_time": 1.3187341690063477
    },
    {
        "BLOCK_SIZE_M": 128,
        "BLOCK_SIZE_N": 32,
        "BLOCK_SIZE_K": 128,
        "GROUP_SIZE_M": 8,
        "num_stages": 5,
        "num_warps": 4,
        "ms": 0.7570511698722839,
        "min_ms": 0.7570511698722839,
        "max_ms": 0.7570511698722839,
        "compile_time": 1.5127274990081787
    },
    {
        "BLOCK_SIZE_M": 64,
        "BLOCK_SIZE_N": 64,
        "BLOCK_SIZE_K": 32,
        "GROUP_SIZE_M": 8,
        "num_stages": 5,
        "num_warps": 8,
        "ms": 0.7571595907211304,
        "min_ms": 0.7571595907211304,
        "max_ms": 0.7571595907211304,
        "compile_time": 1.2688305377960205
    },
    {
        "BLOCK_SIZE_M": 64,
        "BLOCK_SIZE_N": 64,
        "BLOCK_SIZE_K": 256,
        "GROUP_SIZE_M": 8,
        "num_stages": 2,
        "num_warps": 8,
        "ms": 0.7572575807571411,
        "min_ms": 0.7572575807571411,
        "max_ms": 0.7572575807571411,
        "compile_time": 1.2406196594238281
    },
    {
        "BLOCK_SIZE_M": 128,
        "BLOCK_SIZE_N": 32,
        "BLOCK_SIZE_K": 64,
        "GROUP_SIZE_M": 8,
        "num_stages": 4,
        "num_warps": 8,
        "ms": 0.7577276825904846,
        "min_ms": 0.7577276825904846,
        "max_ms": 0.7577276825904846,
        "compile_time": 1.5336730480194092
    },
    {
        "BLOCK_SIZE_M": 256,
        "BLOCK_SIZE_N": 32,
        "BLOCK_SIZE_K": 128,
        "GROUP_SIZE_M": 8,
        "num_stages": 3,
        "num_warps": 16,
        "ms": 0.7581164240837097,
        "min_ms": 0.7581164240837097,
        "max_ms": 0.7581164240837097,
        "compile_time": 2.2071645259857178
    },
    {
        "BLOCK_SIZE_M": 64,
        "BLOCK_SIZE_N": 64,
        "BLOCK_SIZE_K": 32,
        "GROUP_SIZE_M": 8,
        "num_stages": 4,
        "num_warps": 8,
        "ms": 0.7583231925964355,
        "min_ms": 0.7583231925964355,
        "max_ms": 0.7583231925964355,
        "compile_time": 1.2652459144592285
    },
    {
        "BLOCK_SIZE_M": 32,
        "BLOCK_SIZE_N": 128,
        "BLOCK_SIZE_K": 16,
        "GROUP_SIZE_M": 8,
        "num_stages": 8,
        "num_warps": 2,
        "ms": 0.758446216583252,
        "min_ms": 0.758446216583252,
        "max_ms": 0.758446216583252,
        "compile_time": 1.8849596977233887
    },
    {
        "BLOCK_SIZE_M": 32,
        "BLOCK_SIZE_N": 128,
        "BLOCK_SIZE_K": 64,
        "GROUP_SIZE_M": 8,
        "num_stages": 4,
        "num_warps": 2,
        "ms": 0.7585342526435852,
        "min_ms": 0.7585342526435852,
        "max_ms": 0.7585342526435852,
        "compile_time": 2.3245577812194824
    },
    {
        "BLOCK_SIZE_M": 32,
        "BLOCK_SIZE_N": 128,
        "BLOCK_SIZE_K": 64,
        "GROUP_SIZE_M": 8,
        "num_stages": 4,
        "num_warps": 4,
        "ms": 0.7586057782173157,
        "min_ms": 0.7586057782173157,
        "max_ms": 0.7586057782173157,
        "compile_time": 1.22515869140625
    },
    {
        "BLOCK_SIZE_M": 64,
        "BLOCK_SIZE_N": 64,
        "BLOCK_SIZE_K": 64,
        "GROUP_SIZE_M": 8,
        "num_stages": 1,
        "num_warps": 4,
        "ms": 0.7591983079910278,
        "min_ms": 0.7591983079910278,
        "max_ms": 0.7591983079910278,
        "compile_time": 1.779151201248169
    },
    {
        "BLOCK_SIZE_M": 32,
        "BLOCK_SIZE_N": 128,
        "BLOCK_SIZE_K": 32,
        "GROUP_SIZE_M": 8,
        "num_stages": 7,
        "num_warps": 4,
        "ms": 0.7594327926635742,
        "min_ms": 0.7594327926635742,
        "max_ms": 0.7594327926635742,
        "compile_time": 1.2236158847808838
    },
    {
        "BLOCK_SIZE_M": 32,
        "BLOCK_SIZE_N": 128,
        "BLOCK_SIZE_K": 64,
        "GROUP_SIZE_M": 8,
        "num_stages": 5,
        "num_warps": 4,
        "ms": 0.7597953677177429,
        "min_ms": 0.7597953677177429,
        "max_ms": 0.7597953677177429,
        "compile_time": 1.2166738510131836
    },
    {
        "BLOCK_SIZE_M": 64,
        "BLOCK_SIZE_N": 128,
        "BLOCK_SIZE_K": 128,
        "GROUP_SIZE_M": 8,
        "num_stages": 1,
        "num_warps": 4,
        "ms": 0.7609988451004028,
        "min_ms": 0.7609988451004028,
        "max_ms": 0.7609988451004028,
        "compile_time": 2.1641736030578613
    },
    {
        "BLOCK_SIZE_M": 128,
        "BLOCK_SIZE_N": 32,
        "BLOCK_SIZE_K": 64,
        "GROUP_SIZE_M": 8,
        "num_stages": 3,
        "num_warps": 8,
        "ms": 0.7612881660461426,
        "min_ms": 0.7612881660461426,
        "max_ms": 0.7612881660461426,
        "compile_time": 1.5453789234161377
    },
    {
        "BLOCK_SIZE_M": 128,
        "BLOCK_SIZE_N": 32,
        "BLOCK_SIZE_K": 64,
        "GROUP_SIZE_M": 8,
        "num_stages": 5,
        "num_warps": 8,
        "ms": 0.7618761658668518,
        "min_ms": 0.7618761658668518,
        "max_ms": 0.7618761658668518,
        "compile_time": 1.5608470439910889
    },
    {
        "BLOCK_SIZE_M": 512,
        "BLOCK_SIZE_N": 32,
        "BLOCK_SIZE_K": 32,
        "GROUP_SIZE_M": 8,
        "num_stages": 2,
        "num_warps": 4,
        "ms": 0.7624171376228333,
        "min_ms": 0.7624171376228333,
        "max_ms": 0.7624171376228333,
        "compile_time": 2.772019624710083
    },
    {
        "BLOCK_SIZE_M": 256,
        "BLOCK_SIZE_N": 128,
        "BLOCK_SIZE_K": 128,
        "GROUP_SIZE_M": 8,
        "num_stages": 1,
        "num_warps": 16,
        "ms": 0.762597918510437,
        "min_ms": 0.762597918510437,
        "max_ms": 0.762597918510437,
        "compile_time": 2.2723782062530518
    },
    {
        "BLOCK_SIZE_M": 256,
        "BLOCK_SIZE_N": 32,
        "BLOCK_SIZE_K": 32,
        "GROUP_SIZE_M": 8,
        "num_stages": 5,
        "num_warps": 2,
        "ms": 0.7631824016571045,
        "min_ms": 0.7631824016571045,
        "max_ms": 0.7631824016571045,
        "compile_time": 1.3304665088653564
    },
    {
        "BLOCK_SIZE_M": 256,
        "BLOCK_SIZE_N": 128,
        "BLOCK_SIZE_K": 64,
        "GROUP_SIZE_M": 8,
        "num_stages": 1,
        "num_warps": 32,
        "ms": 0.7637092471122742,
        "min_ms": 0.7637092471122742,
        "max_ms": 0.7637092471122742,
        "compile_time": 1.2979240417480469
    },
    {
        "BLOCK_SIZE_M": 32,
        "BLOCK_SIZE_N": 128,
        "BLOCK_SIZE_K": 128,
        "GROUP_SIZE_M": 8,
        "num_stages": 2,
        "num_warps": 4,
        "ms": 0.7638515830039978,
        "min_ms": 0.7638515830039978,
        "max_ms": 0.7638515830039978,
        "compile_time": 2.026254892349243
    },
    {
        "BLOCK_SIZE_M": 64,
        "BLOCK_SIZE_N": 256,
        "BLOCK_SIZE_K": 128,
        "GROUP_SIZE_M": 8,
        "num_stages": 3,
        "num_warps": 32,
        "ms": 0.7643102407455444,
        "min_ms": 0.7643102407455444,
        "max_ms": 0.7643102407455444,
        "compile_time": 1.226278305053711
    },
    {
        "BLOCK_SIZE_M": 256,
        "BLOCK_SIZE_N": 32,
        "BLOCK_SIZE_K": 64,
        "GROUP_SIZE_M": 8,
        "num_stages": 2,
        "num_warps": 4,
        "ms": 0.7651344537734985,
        "min_ms": 0.7651344537734985,
        "max_ms": 0.7651344537734985,
        "compile_time": 2.4464845657348633
    },
    {
        "BLOCK_SIZE_M": 128,
        "BLOCK_SIZE_N": 32,
        "BLOCK_SIZE_K": 128,
        "GROUP_SIZE_M": 8,
        "num_stages": 2,
        "num_warps": 4,
        "ms": 0.7653650045394897,
        "min_ms": 0.7653650045394897,
        "max_ms": 0.7653650045394897,
        "compile_time": 1.4972622394561768
    },
    {
        "BLOCK_SIZE_M": 64,
        "BLOCK_SIZE_N": 64,
        "BLOCK_SIZE_K": 32,
        "GROUP_SIZE_M": 8,
        "num_stages": 7,
        "num_warps": 8,
        "ms": 0.7655643224716187,
        "min_ms": 0.7655643224716187,
        "max_ms": 0.7655643224716187,
        "compile_time": 1.274728536605835
    },
    {
        "BLOCK_SIZE_M": 256,
        "BLOCK_SIZE_N": 64,
        "BLOCK_SIZE_K": 256,
        "GROUP_SIZE_M": 8,
        "num_stages": 2,
        "num_warps": 16,
        "ms": 0.7656472325325012,
        "min_ms": 0.7656472325325012,
        "max_ms": 0.7656472325325012,
        "compile_time": 2.506821870803833
    },
    {
        "BLOCK_SIZE_M": 64,
        "BLOCK_SIZE_N": 256,
        "BLOCK_SIZE_K": 256,
        "GROUP_SIZE_M": 8,
        "num_stages": 2,
        "num_warps": 8,
        "ms": 0.7660223841667175,
        "min_ms": 0.7660223841667175,
        "max_ms": 0.7660223841667175,
        "compile_time": 2.917189598083496
    },
    {
        "BLOCK_SIZE_M": 32,
        "BLOCK_SIZE_N": 128,
        "BLOCK_SIZE_K": 32,
        "GROUP_SIZE_M": 8,
        "num_stages": 8,
        "num_warps": 4,
        "ms": 0.7679734230041504,
        "min_ms": 0.7679734230041504,
        "max_ms": 0.7679734230041504,
        "compile_time": 1.2310054302215576
    },
    {
        "BLOCK_SIZE_M": 128,
        "BLOCK_SIZE_N": 32,
        "BLOCK_SIZE_K": 64,
        "GROUP_SIZE_M": 8,
        "num_stages": 2,
        "num_warps": 2,
        "ms": 0.770506739616394,
        "min_ms": 0.770506739616394,
        "max_ms": 0.770506739616394,
        "compile_time": 1.4921011924743652
    },
    {
        "BLOCK_SIZE_M": 32,
        "BLOCK_SIZE_N": 128,
        "BLOCK_SIZE_K": 128,
        "GROUP_SIZE_M": 8,
        "num_stages": 2,
        "num_warps": 2,
        "ms": 0.7709386944770813,
        "min_ms": 0.7709386944770813,
        "max_ms": 0.7709386944770813,
        "compile_time": 2.663961172103882
    },
    {
        "BLOCK_SIZE_M": 128,
        "BLOCK_SIZE_N": 32,
        "BLOCK_SIZE_K": 256,
        "GROUP_SIZE_M": 8,
        "num_stages": 2,
        "num_warps": 4,
        "ms": 0.77193284034729,
        "min_ms": 0.77193284034729,
        "max_ms": 0.77193284034729,
        "compile_time": 1.5121848583221436
    },
    {
        "BLOCK_SIZE_M": 64,
        "BLOCK_SIZE_N": 64,
        "BLOCK_SIZE_K": 64,
        "GROUP_SIZE_M": 8,
        "num_stages": 7,
        "num_warps": 2,
        "ms": 0.7724450826644897,
        "min_ms": 0.7724450826644897,
        "max_ms": 0.7724450826644897,
        "compile_time": 2.3951849937438965
    },
    {
        "BLOCK_SIZE_M": 256,
        "BLOCK_SIZE_N": 64,
        "BLOCK_SIZE_K": 256,
        "GROUP_SIZE_M": 8,
        "num_stages": 2,
        "num_warps": 8,
        "ms": 0.7731653451919556,
        "min_ms": 0.7731653451919556,
        "max_ms": 0.7731653451919556,
        "compile_time": 3.0829694271087646
    },
    {
        "BLOCK_SIZE_M": 32,
        "BLOCK_SIZE_N": 128,
        "BLOCK_SIZE_K": 64,
        "GROUP_SIZE_M": 8,
        "num_stages": 7,
        "num_warps": 4,
        "ms": 0.7731688618659973,
        "min_ms": 0.7731688618659973,
        "max_ms": 0.7731688618659973,
        "compile_time": 2.0504188537597656
    },
    {
        "BLOCK_SIZE_M": 256,
        "BLOCK_SIZE_N": 32,
        "BLOCK_SIZE_K": 64,
        "GROUP_SIZE_M": 8,
        "num_stages": 2,
        "num_warps": 8,
        "ms": 0.7732642292976379,
        "min_ms": 0.7732642292976379,
        "max_ms": 0.7732642292976379,
        "compile_time": 1.3176500797271729
    },
    {
        "BLOCK_SIZE_M": 32,
        "BLOCK_SIZE_N": 128,
        "BLOCK_SIZE_K": 16,
        "GROUP_SIZE_M": 8,
        "num_stages": 4,
        "num_warps": 4,
        "ms": 0.7737929224967957,
        "min_ms": 0.7737929224967957,
        "max_ms": 0.7737929224967957,
        "compile_time": 1.2549481391906738
    },
    {
        "BLOCK_SIZE_M": 256,
        "BLOCK_SIZE_N": 64,
        "BLOCK_SIZE_K": 64,
        "GROUP_SIZE_M": 8,
        "num_stages": 3,
        "num_warps": 32,
        "ms": 0.7738342881202698,
        "min_ms": 0.7738342881202698,
        "max_ms": 0.7738342881202698,
        "compile_time": 1.3122239112854004
    },
    {
        "BLOCK_SIZE_M": 32,
        "BLOCK_SIZE_N": 128,
        "BLOCK_SIZE_K": 128,
        "GROUP_SIZE_M": 8,
        "num_stages": 3,
        "num_warps": 4,
        "ms": 0.7738438844680786,
        "min_ms": 0.7738438844680786,
        "max_ms": 0.7738438844680786,
        "compile_time": 2.2637746334075928
    },
    {
        "BLOCK_SIZE_M": 64,
        "BLOCK_SIZE_N": 256,
        "BLOCK_SIZE_K": 64,
        "GROUP_SIZE_M": 8,
        "num_stages": 4,
        "num_warps": 32,
        "ms": 0.7742878198623657,
        "min_ms": 0.7742878198623657,
        "max_ms": 0.7742878198623657,
        "compile_time": 1.221818447113037
    },
    {
        "BLOCK_SIZE_M": 64,
        "BLOCK_SIZE_N": 256,
        "BLOCK_SIZE_K": 64,
        "GROUP_SIZE_M": 8,
        "num_stages": 5,
        "num_warps": 32,
        "ms": 0.774612307548523,
        "min_ms": 0.774612307548523,
        "max_ms": 0.774612307548523,
        "compile_time": 1.238884449005127
    },
    {
        "BLOCK_SIZE_M": 64,
        "BLOCK_SIZE_N": 256,
        "BLOCK_SIZE_K": 64,
        "GROUP_SIZE_M": 8,
        "num_stages": 3,
        "num_warps": 32,
        "ms": 0.7747883200645447,
        "min_ms": 0.7747883200645447,
        "max_ms": 0.7747883200645447,
        "compile_time": 1.2407808303833008
    },
    {
        "BLOCK_SIZE_M": 128,
        "BLOCK_SIZE_N": 32,
        "BLOCK_SIZE_K": 64,
        "GROUP_SIZE_M": 8,
        "num_stages": 2,
        "num_warps": 4,
        "ms": 0.7750903367996216,
        "min_ms": 0.7750903367996216,
        "max_ms": 0.7750903367996216,
        "compile_time": 1.5187056064605713
    },
    {
        "BLOCK_SIZE_M": 64,
        "BLOCK_SIZE_N": 64,
        "BLOCK_SIZE_K": 64,
        "GROUP_SIZE_M": 8,
        "num_stages": 8,
        "num_warps": 2,
        "ms": 0.775812566280365,
        "min_ms": 0.775812566280365,
        "max_ms": 0.775812566280365,
        "compile_time": 2.4305543899536133
    },
    {
        "BLOCK_SIZE_M": 32,
        "BLOCK_SIZE_N": 128,
        "BLOCK_SIZE_K": 64,
        "GROUP_SIZE_M": 8,
        "num_stages": 6,
        "num_warps": 4,
        "ms": 0.7763698101043701,
        "min_ms": 0.7763698101043701,
        "max_ms": 0.7763698101043701,
        "compile_time": 1.9964544773101807
    },
    {
        "BLOCK_SIZE_M": 32,
        "BLOCK_SIZE_N": 128,
        "BLOCK_SIZE_K": 64,
        "GROUP_SIZE_M": 8,
        "num_stages": 8,
        "num_warps": 4,
        "ms": 0.7765094637870789,
        "min_ms": 0.7765094637870789,
        "max_ms": 0.7765094637870789,
        "compile_time": 2.0683035850524902
    },
    {
        "BLOCK_SIZE_M": 128,
        "BLOCK_SIZE_N": 256,
        "BLOCK_SIZE_K": 32,
        "GROUP_SIZE_M": 8,
        "num_stages": 2,
        "num_warps": 16,
        "ms": 0.7766256928443909,
        "min_ms": 0.7766256928443909,
        "max_ms": 0.7766256928443909,
        "compile_time": 1.8056631088256836
    },
    {
        "BLOCK_SIZE_M": 256,
        "BLOCK_SIZE_N": 32,
        "BLOCK_SIZE_K": 32,
        "GROUP_SIZE_M": 8,
        "num_stages": 7,
        "num_warps": 8,
        "ms": 0.7772859334945679,
        "min_ms": 0.7772859334945679,
        "max_ms": 0.7772859334945679,
        "compile_time": 1.327014446258545
    },
    {
        "BLOCK_SIZE_M": 64,
        "BLOCK_SIZE_N": 128,
        "BLOCK_SIZE_K": 256,
        "GROUP_SIZE_M": 8,
        "num_stages": 2,
        "num_warps": 4,
        "ms": 0.7774357199668884,
        "min_ms": 0.7774357199668884,
        "max_ms": 0.7774357199668884,
        "compile_time": 3.0350098609924316
    },
    {
        "BLOCK_SIZE_M": 32,
        "BLOCK_SIZE_N": 512,
        "BLOCK_SIZE_K": 32,
        "GROUP_SIZE_M": 8,
        "num_stages": 2,
        "num_warps": 4,
        "ms": 0.7774834036827087,
        "min_ms": 0.7774834036827087,
        "max_ms": 0.7774834036827087,
        "compile_time": 1.1881487369537354
    },
    {
        "BLOCK_SIZE_M": 256,
        "BLOCK_SIZE_N": 64,
        "BLOCK_SIZE_K": 64,
        "GROUP_SIZE_M": 8,
        "num_stages": 4,
        "num_warps": 32,
        "ms": 0.7782955169677734,
        "min_ms": 0.7782955169677734,
        "max_ms": 0.7782955169677734,
        "compile_time": 1.3101539611816406
    },
    {
        "BLOCK_SIZE_M": 128,
        "BLOCK_SIZE_N": 32,
        "BLOCK_SIZE_K": 32,
        "GROUP_SIZE_M": 8,
        "num_stages": 2,
        "num_warps": 2,
        "ms": 0.7797161936759949,
        "min_ms": 0.7797161936759949,
        "max_ms": 0.7797161936759949,
        "compile_time": 1.353376865386963
    },
    {
        "BLOCK_SIZE_M": 32,
        "BLOCK_SIZE_N": 128,
        "BLOCK_SIZE_K": 64,
        "GROUP_SIZE_M": 8,
        "num_stages": 3,
        "num_warps": 8,
        "ms": 0.7800660133361816,
        "min_ms": 0.7800660133361816,
        "max_ms": 0.7800660133361816,
        "compile_time": 1.7274506092071533
    },
    {
        "BLOCK_SIZE_M": 32,
        "BLOCK_SIZE_N": 256,
        "BLOCK_SIZE_K": 64,
        "GROUP_SIZE_M": 8,
        "num_stages": 2,
        "num_warps": 4,
        "ms": 0.780083179473877,
        "min_ms": 0.780083179473877,
        "max_ms": 0.780083179473877,
        "compile_time": 2.0506129264831543
    },
    {
        "BLOCK_SIZE_M": 32,
        "BLOCK_SIZE_N": 128,
        "BLOCK_SIZE_K": 64,
        "GROUP_SIZE_M": 8,
        "num_stages": 2,
        "num_warps": 4,
        "ms": 0.7800945043563843,
        "min_ms": 0.7800945043563843,
        "max_ms": 0.7800945043563843,
        "compile_time": 1.2127742767333984
    },
    {
        "BLOCK_SIZE_M": 128,
        "BLOCK_SIZE_N": 32,
        "BLOCK_SIZE_K": 32,
        "GROUP_SIZE_M": 8,
        "num_stages": 7,
        "num_warps": 4,
        "ms": 0.7808797955513,
        "min_ms": 0.7808797955513,
        "max_ms": 0.7808797955513,
        "compile_time": 1.797729730606079
    },
    {
        "BLOCK_SIZE_M": 32,
        "BLOCK_SIZE_N": 128,
        "BLOCK_SIZE_K": 64,
        "GROUP_SIZE_M": 8,
        "num_stages": 4,
        "num_warps": 8,
        "ms": 0.7815152406692505,
        "min_ms": 0.7815152406692505,
        "max_ms": 0.7815152406692505,
        "compile_time": 1.7680771350860596
    },
    {
        "BLOCK_SIZE_M": 128,
        "BLOCK_SIZE_N": 32,
        "BLOCK_SIZE_K": 256,
        "GROUP_SIZE_M": 8,
        "num_stages": 3,
        "num_warps": 4,
        "ms": 0.7815338373184204,
        "min_ms": 0.7815338373184204,
        "max_ms": 0.7815338373184204,
        "compile_time": 1.3235771656036377
    },
    {
        "BLOCK_SIZE_M": 128,
        "BLOCK_SIZE_N": 32,
        "BLOCK_SIZE_K": 128,
        "GROUP_SIZE_M": 8,
        "num_stages": 2,
        "num_warps": 2,
        "ms": 0.7819935083389282,
        "min_ms": 0.7819935083389282,
        "max_ms": 0.7819935083389282,
        "compile_time": 1.4926462173461914
    },
    {
        "BLOCK_SIZE_M": 512,
        "BLOCK_SIZE_N": 64,
        "BLOCK_SIZE_K": 64,
        "GROUP_SIZE_M": 8,
        "num_stages": 2,
        "num_warps": 16,
        "ms": 0.7820857167243958,
        "min_ms": 0.7820857167243958,
        "max_ms": 0.7820857167243958,
        "compile_time": 2.4755008220672607
    },
    {
        "BLOCK_SIZE_M": 256,
        "BLOCK_SIZE_N": 64,
        "BLOCK_SIZE_K": 64,
        "GROUP_SIZE_M": 8,
        "num_stages": 2,
        "num_warps": 16,
        "ms": 0.7821413278579712,
        "min_ms": 0.7821413278579712,
        "max_ms": 0.7821413278579712,
        "compile_time": 1.3115522861480713
    },
    {
        "BLOCK_SIZE_M": 256,
        "BLOCK_SIZE_N": 32,
        "BLOCK_SIZE_K": 32,
        "GROUP_SIZE_M": 8,
        "num_stages": 8,
        "num_warps": 8,
        "ms": 0.7822475433349609,
        "min_ms": 0.7822475433349609,
        "max_ms": 0.7822475433349609,
        "compile_time": 1.3271815776824951
    },
    {
        "BLOCK_SIZE_M": 32,
        "BLOCK_SIZE_N": 256,
        "BLOCK_SIZE_K": 32,
        "GROUP_SIZE_M": 8,
        "num_stages": 4,
        "num_warps": 2,
        "ms": 0.7822831869125366,
        "min_ms": 0.7822831869125366,
        "max_ms": 0.7822831869125366,
        "compile_time": 2.5875816345214844
    },
    {
        "BLOCK_SIZE_M": 64,
        "BLOCK_SIZE_N": 256,
        "BLOCK_SIZE_K": 128,
        "GROUP_SIZE_M": 8,
        "num_stages": 2,
        "num_warps": 4,
        "ms": 0.7826959490776062,
        "min_ms": 0.7826959490776062,
        "max_ms": 0.7826959490776062,
        "compile_time": 3.1206774711608887
    },
    {
        "BLOCK_SIZE_M": 128,
        "BLOCK_SIZE_N": 64,
        "BLOCK_SIZE_K": 256,
        "GROUP_SIZE_M": 8,
        "num_stages": 2,
        "num_warps": 4,
        "ms": 0.7830668091773987,
        "min_ms": 0.7830668091773987,
        "max_ms": 0.7830668091773987,
        "compile_time": 3.372882843017578
    },
    {
        "BLOCK_SIZE_M": 64,
        "BLOCK_SIZE_N": 64,
        "BLOCK_SIZE_K": 32,
        "GROUP_SIZE_M": 8,
        "num_stages": 8,
        "num_warps": 8,
        "ms": 0.783464789390564,
        "min_ms": 0.783464789390564,
        "max_ms": 0.783464789390564,
        "compile_time": 1.7595670223236084
    },
    {
        "BLOCK_SIZE_M": 32,
        "BLOCK_SIZE_N": 128,
        "BLOCK_SIZE_K": 32,
        "GROUP_SIZE_M": 8,
        "num_stages": 2,
        "num_warps": 2,
        "ms": 0.7839307188987732,
        "min_ms": 0.7839307188987732,
        "max_ms": 0.7839307188987732,
        "compile_time": 1.8465163707733154
    },
    {
        "BLOCK_SIZE_M": 256,
        "BLOCK_SIZE_N": 64,
        "BLOCK_SIZE_K": 64,
        "GROUP_SIZE_M": 8,
        "num_stages": 5,
        "num_warps": 32,
        "ms": 0.7843396663665771,
        "min_ms": 0.7843396663665771,
        "max_ms": 0.7843396663665771,
        "compile_time": 1.9944777488708496
    },
    {
        "BLOCK_SIZE_M": 32,
        "BLOCK_SIZE_N": 128,
        "BLOCK_SIZE_K": 128,
        "GROUP_SIZE_M": 8,
        "num_stages": 5,
        "num_warps": 4,
        "ms": 0.7843840718269348,
        "min_ms": 0.7843840718269348,
        "max_ms": 0.7843840718269348,
        "compile_time": 2.3892645835876465
    },
    {
        "BLOCK_SIZE_M": 128,
        "BLOCK_SIZE_N": 32,
        "BLOCK_SIZE_K": 32,
        "GROUP_SIZE_M": 8,
        "num_stages": 8,
        "num_warps": 4,
        "ms": 0.7844517230987549,
        "min_ms": 0.7844517230987549,
        "max_ms": 0.7844517230987549,
        "compile_time": 1.5437653064727783
    },
    {
        "BLOCK_SIZE_M": 32,
        "BLOCK_SIZE_N": 128,
        "BLOCK_SIZE_K": 64,
        "GROUP_SIZE_M": 8,
        "num_stages": 5,
        "num_warps": 8,
        "ms": 0.7850724458694458,
        "min_ms": 0.7850724458694458,
        "max_ms": 0.7850724458694458,
        "compile_time": 1.7618298530578613
    },
    {
        "BLOCK_SIZE_M": 64,
        "BLOCK_SIZE_N": 256,
        "BLOCK_SIZE_K": 64,
        "GROUP_SIZE_M": 8,
        "num_stages": 2,
        "num_warps": 16,
        "ms": 0.7859643697738647,
        "min_ms": 0.7859643697738647,
        "max_ms": 0.7859643697738647,
        "compile_time": 1.8072524070739746
    },
    {
        "BLOCK_SIZE_M": 256,
        "BLOCK_SIZE_N": 32,
        "BLOCK_SIZE_K": 64,
        "GROUP_SIZE_M": 8,
        "num_stages": 4,
        "num_warps": 16,
        "ms": 0.7867705821990967,
        "min_ms": 0.7867705821990967,
        "max_ms": 0.7867705821990967,
        "compile_time": 2.077108383178711
    },
    {
        "BLOCK_SIZE_M": 32,
        "BLOCK_SIZE_N": 128,
        "BLOCK_SIZE_K": 16,
        "GROUP_SIZE_M": 8,
        "num_stages": 3,
        "num_warps": 4,
        "ms": 0.7867839932441711,
        "min_ms": 0.7867839932441711,
        "max_ms": 0.7867839932441711,
        "compile_time": 1.2361321449279785
    },
    {
        "BLOCK_SIZE_M": 32,
        "BLOCK_SIZE_N": 256,
        "BLOCK_SIZE_K": 32,
        "GROUP_SIZE_M": 8,
        "num_stages": 5,
        "num_warps": 2,
        "ms": 0.7872145771980286,
        "min_ms": 0.7872145771980286,
        "max_ms": 0.7872145771980286,
        "compile_time": 2.6615028381347656
    },
    {
        "BLOCK_SIZE_M": 256,
        "BLOCK_SIZE_N": 32,
        "BLOCK_SIZE_K": 32,
        "GROUP_SIZE_M": 8,
        "num_stages": 6,
        "num_warps": 8,
        "ms": 0.7875036001205444,
        "min_ms": 0.7875036001205444,
        "max_ms": 0.7875036001205444,
        "compile_time": 1.3332042694091797
    },
    {
        "BLOCK_SIZE_M": 512,
        "BLOCK_SIZE_N": 32,
        "BLOCK_SIZE_K": 32,
        "GROUP_SIZE_M": 8,
        "num_stages": 4,
        "num_warps": 16,
        "ms": 0.787830650806427,
        "min_ms": 0.787830650806427,
        "max_ms": 0.787830650806427,
        "compile_time": 2.2056684494018555
    },
    {
        "BLOCK_SIZE_M": 256,
        "BLOCK_SIZE_N": 32,
        "BLOCK_SIZE_K": 64,
        "GROUP_SIZE_M": 8,
        "num_stages": 3,
        "num_warps": 16,
        "ms": 0.7885085344314575,
        "min_ms": 0.7885085344314575,
        "max_ms": 0.7885085344314575,
        "compile_time": 2.0402965545654297
    },
    {
        "BLOCK_SIZE_M": 32,
        "BLOCK_SIZE_N": 128,
        "BLOCK_SIZE_K": 32,
        "GROUP_SIZE_M": 8,
        "num_stages": 2,
        "num_warps": 4,
        "ms": 0.7888079881668091,
        "min_ms": 0.7888079881668091,
        "max_ms": 0.7888079881668091,
        "compile_time": 1.19809889793396
    },
    {
        "BLOCK_SIZE_M": 256,
        "BLOCK_SIZE_N": 64,
        "BLOCK_SIZE_K": 16,
        "GROUP_SIZE_M": 8,
        "num_stages": 8,
        "num_warps": 16,
        "ms": 0.7891080379486084,
        "min_ms": 0.7891080379486084,
        "max_ms": 0.7891080379486084,
        "compile_time": 2.0014424324035645
    },
    {
        "BLOCK_SIZE_M": 256,
        "BLOCK_SIZE_N": 64,
        "BLOCK_SIZE_K": 16,
        "GROUP_SIZE_M": 8,
        "num_stages": 7,
        "num_warps": 16,
        "ms": 0.7892027497291565,
        "min_ms": 0.7892027497291565,
        "max_ms": 0.7892027497291565,
        "compile_time": 1.316692590713501
    },
    {
        "BLOCK_SIZE_M": 32,
        "BLOCK_SIZE_N": 128,
        "BLOCK_SIZE_K": 128,
        "GROUP_SIZE_M": 8,
        "num_stages": 3,
        "num_warps": 2,
        "ms": 0.7898290753364563,
        "min_ms": 0.7898290753364563,
        "max_ms": 0.7898290753364563,
        "compile_time": 3.240619659423828
    },
    {
        "BLOCK_SIZE_M": 32,
        "BLOCK_SIZE_N": 128,
        "BLOCK_SIZE_K": 128,
        "GROUP_SIZE_M": 8,
        "num_stages": 4,
        "num_warps": 4,
        "ms": 0.7900277376174927,
        "min_ms": 0.7900277376174927,
        "max_ms": 0.7900277376174927,
        "compile_time": 1.2838244438171387
    },
    {
        "BLOCK_SIZE_M": 128,
        "BLOCK_SIZE_N": 256,
        "BLOCK_SIZE_K": 16,
        "GROUP_SIZE_M": 8,
        "num_stages": 3,
        "num_warps": 32,
        "ms": 0.7901679277420044,
        "min_ms": 0.7901679277420044,
        "max_ms": 0.7901679277420044,
        "compile_time": 2.57126784324646
    },
    {
        "BLOCK_SIZE_M": 128,
        "BLOCK_SIZE_N": 64,
        "BLOCK_SIZE_K": 32,
        "GROUP_SIZE_M": 8,
        "num_stages": 3,
        "num_warps": 16,
        "ms": 0.7904430627822876,
        "min_ms": 0.7904430627822876,
        "max_ms": 0.7904430627822876,
        "compile_time": 1.5710642337799072
    },
    {
        "BLOCK_SIZE_M": 128,
        "BLOCK_SIZE_N": 64,
        "BLOCK_SIZE_K": 32,
        "GROUP_SIZE_M": 8,
        "num_stages": 4,
        "num_warps": 16,
        "ms": 0.7905598878860474,
        "min_ms": 0.7905598878860474,
        "max_ms": 0.7905598878860474,
        "compile_time": 1.7218875885009766
    },
    {
        "BLOCK_SIZE_M": 32,
        "BLOCK_SIZE_N": 128,
        "BLOCK_SIZE_K": 256,
        "GROUP_SIZE_M": 8,
        "num_stages": 2,
        "num_warps": 4,
        "ms": 0.7913788557052612,
        "min_ms": 0.7913788557052612,
        "max_ms": 0.7913788557052612,
        "compile_time": 2.6306569576263428
    },
    {
        "BLOCK_SIZE_M": 128,
        "BLOCK_SIZE_N": 32,
        "BLOCK_SIZE_K": 128,
        "GROUP_SIZE_M": 8,
        "num_stages": 3,
        "num_warps": 8,
        "ms": 0.7914045453071594,
        "min_ms": 0.7914045453071594,
        "max_ms": 0.7914045453071594,
        "compile_time": 1.5366237163543701
    },
    {
        "BLOCK_SIZE_M": 64,
        "BLOCK_SIZE_N": 128,
        "BLOCK_SIZE_K": 32,
        "GROUP_SIZE_M": 8,
        "num_stages": 8,
        "num_warps": 2,
        "ms": 0.7916544079780579,
        "min_ms": 0.7916544079780579,
        "max_ms": 0.7916544079780579,
        "compile_time": 2.784703493118286
    },
    {
        "BLOCK_SIZE_M": 32,
        "BLOCK_SIZE_N": 256,
        "BLOCK_SIZE_K": 128,
        "GROUP_SIZE_M": 8,
        "num_stages": 3,
        "num_warps": 16,
        "ms": 0.7918509244918823,
        "min_ms": 0.7918509244918823,
        "max_ms": 0.7918509244918823,
        "compile_time": 1.2400152683258057
    },
    {
        "BLOCK_SIZE_M": 128,
        "BLOCK_SIZE_N": 256,
        "BLOCK_SIZE_K": 16,
        "GROUP_SIZE_M": 8,
        "num_stages": 4,
        "num_warps": 32,
        "ms": 0.792279064655304,
        "min_ms": 0.792279064655304,
        "max_ms": 0.792279064655304,
        "compile_time": 2.6039936542510986
    },
    {
        "BLOCK_SIZE_M": 256,
        "BLOCK_SIZE_N": 32,
        "BLOCK_SIZE_K": 64,
        "GROUP_SIZE_M": 8,
        "num_stages": 5,
        "num_warps": 16,
        "ms": 0.7930711507797241,
        "min_ms": 0.7930711507797241,
        "max_ms": 0.7930711507797241,
        "compile_time": 1.3210804462432861
    },
    {
        "BLOCK_SIZE_M": 128,
        "BLOCK_SIZE_N": 32,
        "BLOCK_SIZE_K": 32,
        "GROUP_SIZE_M": 8,
        "num_stages": 2,
        "num_warps": 4,
        "ms": 0.793454647064209,
        "min_ms": 0.793454647064209,
        "max_ms": 0.793454647064209,
        "compile_time": 1.3585083484649658
    },
    {
        "BLOCK_SIZE_M": 64,
        "BLOCK_SIZE_N": 64,
        "BLOCK_SIZE_K": 128,
        "GROUP_SIZE_M": 8,
        "num_stages": 1,
        "num_warps": 4,
        "ms": 0.7947288751602173,
        "min_ms": 0.7947288751602173,
        "max_ms": 0.7947288751602173,
        "compile_time": 1.2474937438964844
    },
    {
        "BLOCK_SIZE_M": 64,
        "BLOCK_SIZE_N": 128,
        "BLOCK_SIZE_K": 16,
        "GROUP_SIZE_M": 8,
        "num_stages": 2,
        "num_warps": 2,
        "ms": 0.7947794198989868,
        "min_ms": 0.7947794198989868,
        "max_ms": 0.7947794198989868,
        "compile_time": 2.0692644119262695
    },
    {
        "BLOCK_SIZE_M": 512,
        "BLOCK_SIZE_N": 32,
        "BLOCK_SIZE_K": 32,
        "GROUP_SIZE_M": 8,
        "num_stages": 4,
        "num_warps": 4,
        "ms": 0.795035719871521,
        "min_ms": 0.795035719871521,
        "max_ms": 0.795035719871521,
        "compile_time": 2.856964111328125
    },
    {
        "BLOCK_SIZE_M": 128,
        "BLOCK_SIZE_N": 256,
        "BLOCK_SIZE_K": 16,
        "GROUP_SIZE_M": 8,
        "num_stages": 5,
        "num_warps": 32,
        "ms": 0.7950881719589233,
        "min_ms": 0.7950881719589233,
        "max_ms": 0.7950881719589233,
        "compile_time": 1.8532075881958008
    },
    {
        "BLOCK_SIZE_M": 128,
        "BLOCK_SIZE_N": 128,
        "BLOCK_SIZE_K": 256,
        "GROUP_SIZE_M": 8,
        "num_stages": 1,
        "num_warps": 16,
        "ms": 0.7954970002174377,
        "min_ms": 0.7954970002174377,
        "max_ms": 0.7954970002174377,
        "compile_time": 1.2701432704925537
    },
    {
        "BLOCK_SIZE_M": 512,
        "BLOCK_SIZE_N": 64,
        "BLOCK_SIZE_K": 32,
        "GROUP_SIZE_M": 8,
        "num_stages": 3,
        "num_warps": 16,
        "ms": 0.7955912351608276,
        "min_ms": 0.7955912351608276,
        "max_ms": 0.7955912351608276,
        "compile_time": 1.3382103443145752
    },
    {
        "BLOCK_SIZE_M": 32,
        "BLOCK_SIZE_N": 256,
        "BLOCK_SIZE_K": 64,
        "GROUP_SIZE_M": 8,
        "num_stages": 2,
        "num_warps": 8,
        "ms": 0.7961694598197937,
        "min_ms": 0.7961694598197937,
        "max_ms": 0.7961694598197937,
        "compile_time": 1.1891818046569824
    },
    {
        "BLOCK_SIZE_M": 128,
        "BLOCK_SIZE_N": 64,
        "BLOCK_SIZE_K": 32,
        "GROUP_SIZE_M": 8,
        "num_stages": 6,
        "num_warps": 16,
        "ms": 0.7964450120925903,
        "min_ms": 0.7964450120925903,
        "max_ms": 0.7964450120925903,
        "compile_time": 1.5074114799499512
    },
    {
        "BLOCK_SIZE_M": 128,
        "BLOCK_SIZE_N": 64,
        "BLOCK_SIZE_K": 32,
        "GROUP_SIZE_M": 8,
        "num_stages": 5,
        "num_warps": 16,
        "ms": 0.7969406247138977,
        "min_ms": 0.7969406247138977,
        "max_ms": 0.7969406247138977,
        "compile_time": 1.5473427772521973
    },
    {
        "BLOCK_SIZE_M": 128,
        "BLOCK_SIZE_N": 64,
        "BLOCK_SIZE_K": 32,
        "GROUP_SIZE_M": 8,
        "num_stages": 7,
        "num_warps": 16,
        "ms": 0.7987064719200134,
        "min_ms": 0.7987064719200134,
        "max_ms": 0.7987064719200134,
        "compile_time": 1.5591137409210205
    },
    {
        "BLOCK_SIZE_M": 512,
        "BLOCK_SIZE_N": 32,
        "BLOCK_SIZE_K": 32,
        "GROUP_SIZE_M": 8,
        "num_stages": 5,
        "num_warps": 4,
        "ms": 0.7995656132698059,
        "min_ms": 0.7995656132698059,
        "max_ms": 0.7995656132698059,
        "compile_time": 2.915733575820923
    },
    {
        "BLOCK_SIZE_M": 128,
        "BLOCK_SIZE_N": 32,
        "BLOCK_SIZE_K": 64,
        "GROUP_SIZE_M": 8,
        "num_stages": 6,
        "num_warps": 8,
        "ms": 0.8004082441329956,
        "min_ms": 0.8004082441329956,
        "max_ms": 0.8004082441329956,
        "compile_time": 1.5264480113983154
    },
    {
        "BLOCK_SIZE_M": 64,
        "BLOCK_SIZE_N": 64,
        "BLOCK_SIZE_K": 128,
        "GROUP_SIZE_M": 8,
        "num_stages": 1,
        "num_warps": 2,
        "ms": 0.8009117841720581,
        "min_ms": 0.8009117841720581,
        "max_ms": 0.8009117841720581,
        "compile_time": 2.3661048412323
    },
    {
        "BLOCK_SIZE_M": 64,
        "BLOCK_SIZE_N": 256,
        "BLOCK_SIZE_K": 256,
        "GROUP_SIZE_M": 8,
        "num_stages": 1,
        "num_warps": 16,
        "ms": 0.8011406064033508,
        "min_ms": 0.8011406064033508,
        "max_ms": 0.8011406064033508,
        "compile_time": 2.1181037425994873
    },
    {
        "BLOCK_SIZE_M": 32,
        "BLOCK_SIZE_N": 128,
        "BLOCK_SIZE_K": 64,
        "GROUP_SIZE_M": 8,
        "num_stages": 6,
        "num_warps": 8,
        "ms": 0.8011660575866699,
        "min_ms": 0.8011660575866699,
        "max_ms": 0.8011660575866699,
        "compile_time": 1.2229182720184326
    },
    {
        "BLOCK_SIZE_M": 32,
        "BLOCK_SIZE_N": 256,
        "BLOCK_SIZE_K": 16,
        "GROUP_SIZE_M": 8,
        "num_stages": 2,
        "num_warps": 4,
        "ms": 0.8012158274650574,
        "min_ms": 0.8012158274650574,
        "max_ms": 0.8012158274650574,
        "compile_time": 1.1885428428649902
    },
    {
        "BLOCK_SIZE_M": 32,
        "BLOCK_SIZE_N": 128,
        "BLOCK_SIZE_K": 128,
        "GROUP_SIZE_M": 8,
        "num_stages": 3,
        "num_warps": 8,
        "ms": 0.8017318844795227,
        "min_ms": 0.8017318844795227,
        "max_ms": 0.8017318844795227,
        "compile_time": 1.321528673171997
    },
    {
        "BLOCK_SIZE_M": 256,
        "BLOCK_SIZE_N": 128,
        "BLOCK_SIZE_K": 32,
        "GROUP_SIZE_M": 8,
        "num_stages": 1,
        "num_warps": 16,
        "ms": 0.80230313539505,
        "min_ms": 0.80230313539505,
        "max_ms": 0.80230313539505,
        "compile_time": 1.303558588027954
    },
    {
        "BLOCK_SIZE_M": 32,
        "BLOCK_SIZE_N": 256,
        "BLOCK_SIZE_K": 64,
        "GROUP_SIZE_M": 8,
        "num_stages": 5,
        "num_warps": 16,
        "ms": 0.8051306009292603,
        "min_ms": 0.8051306009292603,
        "max_ms": 0.8051306009292603,
        "compile_time": 1.7958223819732666
    },
    {
        "BLOCK_SIZE_M": 128,
        "BLOCK_SIZE_N": 32,
        "BLOCK_SIZE_K": 128,
        "GROUP_SIZE_M": 8,
        "num_stages": 4,
        "num_warps": 8,
        "ms": 0.8056443333625793,
        "min_ms": 0.8056443333625793,
        "max_ms": 0.8056443333625793,
        "compile_time": 1.5290324687957764
    },
    {
        "BLOCK_SIZE_M": 32,
        "BLOCK_SIZE_N": 128,
        "BLOCK_SIZE_K": 16,
        "GROUP_SIZE_M": 8,
        "num_stages": 2,
        "num_warps": 2,
        "ms": 0.8063799142837524,
        "min_ms": 0.8063799142837524,
        "max_ms": 0.8063799142837524,
        "compile_time": 1.7042734622955322
    },
    {
        "BLOCK_SIZE_M": 32,
        "BLOCK_SIZE_N": 128,
        "BLOCK_SIZE_K": 16,
        "GROUP_SIZE_M": 8,
        "num_stages": 7,
        "num_warps": 4,
        "ms": 0.8067153096199036,
        "min_ms": 0.8067153096199036,
        "max_ms": 0.8067153096199036,
        "compile_time": 1.7274525165557861
    },
    {
        "BLOCK_SIZE_M": 32,
        "BLOCK_SIZE_N": 128,
        "BLOCK_SIZE_K": 64,
        "GROUP_SIZE_M": 8,
        "num_stages": 7,
        "num_warps": 8,
        "ms": 0.8072217106819153,
        "min_ms": 0.8072217106819153,
        "max_ms": 0.8072217106819153,
        "compile_time": 1.2239301204681396
    },
    {
        "BLOCK_SIZE_M": 64,
        "BLOCK_SIZE_N": 128,
        "BLOCK_SIZE_K": 32,
        "GROUP_SIZE_M": 8,
        "num_stages": 3,
        "num_warps": 16,
        "ms": 0.807452380657196,
        "min_ms": 0.807452380657196,
        "max_ms": 0.807452380657196,
        "compile_time": 1.2432103157043457
    },
    {
        "BLOCK_SIZE_M": 32,
        "BLOCK_SIZE_N": 256,
        "BLOCK_SIZE_K": 64,
        "GROUP_SIZE_M": 8,
        "num_stages": 4,
        "num_warps": 16,
        "ms": 0.8081129789352417,
        "min_ms": 0.8081129789352417,
        "max_ms": 0.8081129789352417,
        "compile_time": 1.2455058097839355
    },
    {
        "BLOCK_SIZE_M": 64,
        "BLOCK_SIZE_N": 64,
        "BLOCK_SIZE_K": 64,
        "GROUP_SIZE_M": 8,
        "num_stages": 1,
        "num_warps": 2,
        "ms": 0.8085001111030579,
        "min_ms": 0.8085001111030579,
        "max_ms": 0.8085001111030579,
        "compile_time": 1.9449896812438965
    },
    {
        "BLOCK_SIZE_M": 32,
        "BLOCK_SIZE_N": 256,
        "BLOCK_SIZE_K": 64,
        "GROUP_SIZE_M": 8,
        "num_stages": 3,
        "num_warps": 16,
        "ms": 0.8086263537406921,
        "min_ms": 0.8086263537406921,
        "max_ms": 0.8086263537406921,
        "compile_time": 1.7437520027160645
    },
    {
        "BLOCK_SIZE_M": 128,
        "BLOCK_SIZE_N": 64,
        "BLOCK_SIZE_K": 16,
        "GROUP_SIZE_M": 8,
        "num_stages": 2,
        "num_warps": 4,
        "ms": 0.8090103268623352,
        "min_ms": 0.8090103268623352,
        "max_ms": 0.8090103268623352,
        "compile_time": 2.159785509109497
    },
    {
        "BLOCK_SIZE_M": 128,
        "BLOCK_SIZE_N": 32,
        "BLOCK_SIZE_K": 64,
        "GROUP_SIZE_M": 8,
        "num_stages": 7,
        "num_warps": 8,
        "ms": 0.8094938397407532,
        "min_ms": 0.8094938397407532,
        "max_ms": 0.8094938397407532,
        "compile_time": 1.5292747020721436
    },
    {
        "BLOCK_SIZE_M": 64,
        "BLOCK_SIZE_N": 128,
        "BLOCK_SIZE_K": 32,
        "GROUP_SIZE_M": 8,
        "num_stages": 5,
        "num_warps": 16,
        "ms": 0.8106904029846191,
        "min_ms": 0.8106904029846191,
        "max_ms": 0.8106904029846191,
        "compile_time": 1.24708890914917
    },
    {
        "BLOCK_SIZE_M": 64,
        "BLOCK_SIZE_N": 128,
        "BLOCK_SIZE_K": 32,
        "GROUP_SIZE_M": 8,
        "num_stages": 4,
        "num_warps": 16,
        "ms": 0.8107205629348755,
        "min_ms": 0.8107205629348755,
        "max_ms": 0.8107205629348755,
        "compile_time": 1.2368714809417725
    },
    {
        "BLOCK_SIZE_M": 32,
        "BLOCK_SIZE_N": 128,
        "BLOCK_SIZE_K": 64,
        "GROUP_SIZE_M": 8,
        "num_stages": 2,
        "num_warps": 2,
        "ms": 0.8112648725509644,
        "min_ms": 0.8112648725509644,
        "max_ms": 0.8112648725509644,
        "compile_time": 2.077538013458252
    },
    {
        "BLOCK_SIZE_M": 32,
        "BLOCK_SIZE_N": 128,
        "BLOCK_SIZE_K": 16,
        "GROUP_SIZE_M": 8,
        "num_stages": 8,
        "num_warps": 4,
        "ms": 0.8118578195571899,
        "min_ms": 0.8118578195571899,
        "max_ms": 0.8118578195571899,
        "compile_time": 1.7546110153198242
    },
    {
        "BLOCK_SIZE_M": 128,
        "BLOCK_SIZE_N": 32,
        "BLOCK_SIZE_K": 128,
        "GROUP_SIZE_M": 8,
        "num_stages": 5,
        "num_warps": 8,
        "ms": 0.8121651411056519,
        "min_ms": 0.8121651411056519,
        "max_ms": 0.8121651411056519,
        "compile_time": 1.5379927158355713
    },
    {
        "BLOCK_SIZE_M": 512,
        "BLOCK_SIZE_N": 64,
        "BLOCK_SIZE_K": 32,
        "GROUP_SIZE_M": 8,
        "num_stages": 5,
        "num_warps": 16,
        "ms": 0.8133155703544617,
        "min_ms": 0.8133155703544617,
        "max_ms": 0.8133155703544617,
        "compile_time": 1.3331482410430908
    },
    {
        "BLOCK_SIZE_M": 64,
        "BLOCK_SIZE_N": 128,
        "BLOCK_SIZE_K": 32,
        "GROUP_SIZE_M": 8,
        "num_stages": 7,
        "num_warps": 16,
        "ms": 0.813323974609375,
        "min_ms": 0.813323974609375,
        "max_ms": 0.813323974609375,
        "compile_time": 1.3024015426635742
    },
    {
        "BLOCK_SIZE_M": 64,
        "BLOCK_SIZE_N": 128,
        "BLOCK_SIZE_K": 32,
        "GROUP_SIZE_M": 8,
        "num_stages": 6,
        "num_warps": 16,
        "ms": 0.8134013414382935,
        "min_ms": 0.8134013414382935,
        "max_ms": 0.8134013414382935,
        "compile_time": 1.234764814376831
    },
    {
        "BLOCK_SIZE_M": 128,
        "BLOCK_SIZE_N": 32,
        "BLOCK_SIZE_K": 64,
        "GROUP_SIZE_M": 8,
        "num_stages": 8,
        "num_warps": 8,
        "ms": 0.8149026036262512,
        "min_ms": 0.8149026036262512,
        "max_ms": 0.8149026036262512,
        "compile_time": 1.5234124660491943
    },
    {
        "BLOCK_SIZE_M": 32,
        "BLOCK_SIZE_N": 128,
        "BLOCK_SIZE_K": 64,
        "GROUP_SIZE_M": 8,
        "num_stages": 8,
        "num_warps": 8,
        "ms": 0.8154128789901733,
        "min_ms": 0.8154128789901733,
        "max_ms": 0.8154128789901733,
        "compile_time": 1.2289717197418213
    },
    {
        "BLOCK_SIZE_M": 128,
        "BLOCK_SIZE_N": 32,
        "BLOCK_SIZE_K": 64,
        "GROUP_SIZE_M": 8,
        "num_stages": 1,
        "num_warps": 2,
        "ms": 0.8162590265274048,
        "min_ms": 0.8162590265274048,
        "max_ms": 0.8162590265274048,
        "compile_time": 1.5505692958831787
    },
    {
        "BLOCK_SIZE_M": 32,
        "BLOCK_SIZE_N": 128,
        "BLOCK_SIZE_K": 256,
        "GROUP_SIZE_M": 8,
        "num_stages": 3,
        "num_warps": 4,
        "ms": 0.8166147470474243,
        "min_ms": 0.8166147470474243,
        "max_ms": 0.8166147470474243,
        "compile_time": 3.1515374183654785
    },
    {
        "BLOCK_SIZE_M": 512,
        "BLOCK_SIZE_N": 32,
        "BLOCK_SIZE_K": 32,
        "GROUP_SIZE_M": 8,
        "num_stages": 3,
        "num_warps": 16,
        "ms": 0.817027747631073,
        "min_ms": 0.817027747631073,
        "max_ms": 0.817027747631073,
        "compile_time": 2.1423683166503906
    },
    {
        "BLOCK_SIZE_M": 32,
        "BLOCK_SIZE_N": 128,
        "BLOCK_SIZE_K": 128,
        "GROUP_SIZE_M": 8,
        "num_stages": 4,
        "num_warps": 8,
        "ms": 0.8171353340148926,
        "min_ms": 0.8171353340148926,
        "max_ms": 0.8171353340148926,
        "compile_time": 1.9940268993377686
    },
    {
        "BLOCK_SIZE_M": 64,
        "BLOCK_SIZE_N": 128,
        "BLOCK_SIZE_K": 32,
        "GROUP_SIZE_M": 8,
        "num_stages": 1,
        "num_warps": 2,
        "ms": 0.8184466361999512,
        "min_ms": 0.8184466361999512,
        "max_ms": 0.8184466361999512,
        "compile_time": 2.180415630340576
    },
    {
        "BLOCK_SIZE_M": 64,
        "BLOCK_SIZE_N": 128,
        "BLOCK_SIZE_K": 16,
        "GROUP_SIZE_M": 8,
        "num_stages": 1,
        "num_warps": 4,
        "ms": 0.8197067379951477,
        "min_ms": 0.8197067379951477,
        "max_ms": 0.8197067379951477,
        "compile_time": 1.7503902912139893
    },
    {
        "BLOCK_SIZE_M": 256,
        "BLOCK_SIZE_N": 128,
        "BLOCK_SIZE_K": 32,
        "GROUP_SIZE_M": 8,
        "num_stages": 1,
        "num_warps": 32,
        "ms": 0.8208109736442566,
        "min_ms": 0.8208109736442566,
        "max_ms": 0.8208109736442566,
        "compile_time": 1.912430763244629
    },
    {
        "BLOCK_SIZE_M": 64,
        "BLOCK_SIZE_N": 256,
        "BLOCK_SIZE_K": 32,
        "GROUP_SIZE_M": 8,
        "num_stages": 1,
        "num_warps": 4,
        "ms": 0.821101188659668,
        "min_ms": 0.821101188659668,
        "max_ms": 0.821101188659668,
        "compile_time": 2.1879723072052
    },
    {
        "BLOCK_SIZE_M": 32,
        "BLOCK_SIZE_N": 128,
        "BLOCK_SIZE_K": 128,
        "GROUP_SIZE_M": 8,
        "num_stages": 5,
        "num_warps": 8,
        "ms": 0.8214645385742188,
        "min_ms": 0.8214645385742188,
        "max_ms": 0.8214645385742188,
        "compile_time": 1.2581586837768555
    },
    {
        "BLOCK_SIZE_M": 128,
        "BLOCK_SIZE_N": 32,
        "BLOCK_SIZE_K": 64,
        "GROUP_SIZE_M": 8,
        "num_stages": 2,
        "num_warps": 8,
        "ms": 0.8215905427932739,
        "min_ms": 0.8215905427932739,
        "max_ms": 0.8215905427932739,
        "compile_time": 1.5447983741760254
    },
    {
        "BLOCK_SIZE_M": 128,
        "BLOCK_SIZE_N": 128,
        "BLOCK_SIZE_K": 128,
        "GROUP_SIZE_M": 8,
        "num_stages": 1,
        "num_warps": 8,
        "ms": 0.8220672607421875,
        "min_ms": 0.8220672607421875,
        "max_ms": 0.8220672607421875,
        "compile_time": 2.2467234134674072
    },
    {
        "BLOCK_SIZE_M": 128,
        "BLOCK_SIZE_N": 32,
        "BLOCK_SIZE_K": 64,
        "GROUP_SIZE_M": 8,
        "num_stages": 6,
        "num_warps": 2,
        "ms": 0.8223143815994263,
        "min_ms": 0.8223143815994263,
        "max_ms": 0.8223143815994263,
        "compile_time": 1.4921464920043945
    },
    {
        "BLOCK_SIZE_M": 64,
        "BLOCK_SIZE_N": 512,
        "BLOCK_SIZE_K": 64,
        "GROUP_SIZE_M": 8,
        "num_stages": 2,
        "num_warps": 16,
        "ms": 0.8226710557937622,
        "min_ms": 0.8226710557937622,
        "max_ms": 0.8226710557937622,
        "compile_time": 1.2460544109344482
    },
    {
        "BLOCK_SIZE_M": 128,
        "BLOCK_SIZE_N": 32,
        "BLOCK_SIZE_K": 256,
        "GROUP_SIZE_M": 8,
        "num_stages": 3,
        "num_warps": 8,
        "ms": 0.8238264322280884,
        "min_ms": 0.8238264322280884,
        "max_ms": 0.8238264322280884,
        "compile_time": 1.5130667686462402
    },
    {
        "BLOCK_SIZE_M": 32,
        "BLOCK_SIZE_N": 128,
        "BLOCK_SIZE_K": 16,
        "GROUP_SIZE_M": 8,
        "num_stages": 6,
        "num_warps": 4,
        "ms": 0.824754536151886,
        "min_ms": 0.824754536151886,
        "max_ms": 0.824754536151886,
        "compile_time": 1.7117061614990234
    },
    {
        "BLOCK_SIZE_M": 64,
        "BLOCK_SIZE_N": 64,
        "BLOCK_SIZE_K": 16,
        "GROUP_SIZE_M": 8,
        "num_stages": 2,
        "num_warps": 2,
        "ms": 0.8257197141647339,
        "min_ms": 0.8257197141647339,
        "max_ms": 0.8257197141647339,
        "compile_time": 1.7805628776550293
    },
    {
        "BLOCK_SIZE_M": 512,
        "BLOCK_SIZE_N": 32,
        "BLOCK_SIZE_K": 32,
        "GROUP_SIZE_M": 8,
        "num_stages": 5,
        "num_warps": 16,
        "ms": 0.8279538154602051,
        "min_ms": 0.8279538154602051,
        "max_ms": 0.8279538154602051,
        "compile_time": 2.1979868412017822
    },
    {
        "BLOCK_SIZE_M": 128,
        "BLOCK_SIZE_N": 32,
        "BLOCK_SIZE_K": 64,
        "GROUP_SIZE_M": 8,
        "num_stages": 7,
        "num_warps": 2,
        "ms": 0.8289573788642883,
        "min_ms": 0.8289573788642883,
        "max_ms": 0.8289573788642883,
        "compile_time": 1.488036870956421
    },
    {
        "BLOCK_SIZE_M": 128,
        "BLOCK_SIZE_N": 128,
        "BLOCK_SIZE_K": 16,
        "GROUP_SIZE_M": 8,
        "num_stages": 6,
        "num_warps": 16,
        "ms": 0.8291093707084656,
        "min_ms": 0.8291093707084656,
        "max_ms": 0.8291093707084656,
        "compile_time": 1.28232741355896
    },
    {
        "BLOCK_SIZE_M": 64,
        "BLOCK_SIZE_N": 64,
        "BLOCK_SIZE_K": 128,
        "GROUP_SIZE_M": 8,
        "num_stages": 3,
        "num_warps": 16,
        "ms": 0.8297853469848633,
        "min_ms": 0.8297853469848633,
        "max_ms": 0.8297853469848633,
        "compile_time": 1.2451205253601074
    },
    {
        "BLOCK_SIZE_M": 128,
        "BLOCK_SIZE_N": 128,
        "BLOCK_SIZE_K": 16,
        "GROUP_SIZE_M": 8,
        "num_stages": 5,
        "num_warps": 16,
        "ms": 0.8299902677536011,
        "min_ms": 0.8299902677536011,
        "max_ms": 0.8299902677536011,
        "compile_time": 1.282416820526123
    },
    {
        "BLOCK_SIZE_M": 32,
        "BLOCK_SIZE_N": 128,
        "BLOCK_SIZE_K": 16,
        "GROUP_SIZE_M": 8,
        "num_stages": 5,
        "num_warps": 4,
        "ms": 0.8306134343147278,
        "min_ms": 0.8306134343147278,
        "max_ms": 0.8306134343147278,
        "compile_time": 1.2385084629058838
    },
    {
        "BLOCK_SIZE_M": 256,
        "BLOCK_SIZE_N": 128,
        "BLOCK_SIZE_K": 32,
        "GROUP_SIZE_M": 8,
        "num_stages": 2,
        "num_warps": 16,
        "ms": 0.830632209777832,
        "min_ms": 0.830632209777832,
        "max_ms": 0.830632209777832,
        "compile_time": 2.081613779067993
    },
    {
        "BLOCK_SIZE_M": 128,
        "BLOCK_SIZE_N": 128,
        "BLOCK_SIZE_K": 16,
        "GROUP_SIZE_M": 8,
        "num_stages": 7,
        "num_warps": 16,
        "ms": 0.8310089111328125,
        "min_ms": 0.8310089111328125,
        "max_ms": 0.8310089111328125,
        "compile_time": 1.2816250324249268
    },
    {
        "BLOCK_SIZE_M": 32,
        "BLOCK_SIZE_N": 256,
        "BLOCK_SIZE_K": 32,
        "GROUP_SIZE_M": 8,
        "num_stages": 4,
        "num_warps": 16,
        "ms": 0.8316132426261902,
        "min_ms": 0.8316132426261902,
        "max_ms": 0.8316132426261902,
        "compile_time": 1.2447071075439453
    },
    {
        "BLOCK_SIZE_M": 128,
        "BLOCK_SIZE_N": 64,
        "BLOCK_SIZE_K": 256,
        "GROUP_SIZE_M": 8,
        "num_stages": 2,
        "num_warps": 8,
        "ms": 0.8326901197433472,
        "min_ms": 0.8326901197433472,
        "max_ms": 0.8326901197433472,
        "compile_time": 1.2869999408721924
    },
    {
        "BLOCK_SIZE_M": 128,
        "BLOCK_SIZE_N": 256,
        "BLOCK_SIZE_K": 128,
        "GROUP_SIZE_M": 8,
        "num_stages": 1,
        "num_warps": 32,
        "ms": 0.8330322504043579,
        "min_ms": 0.8330322504043579,
        "max_ms": 0.8330322504043579,
        "compile_time": 1.9238340854644775
    },
    {
        "BLOCK_SIZE_M": 64,
        "BLOCK_SIZE_N": 256,
        "BLOCK_SIZE_K": 16,
        "GROUP_SIZE_M": 8,
        "num_stages": 2,
        "num_warps": 8,
        "ms": 0.8333837389945984,
        "min_ms": 0.8333837389945984,
        "max_ms": 0.8333837389945984,
        "compile_time": 1.241239070892334
    },
    {
        "BLOCK_SIZE_M": 64,
        "BLOCK_SIZE_N": 128,
        "BLOCK_SIZE_K": 128,
        "GROUP_SIZE_M": 8,
        "num_stages": 3,
        "num_warps": 32,
        "ms": 0.8335396647453308,
        "min_ms": 0.8335396647453308,
        "max_ms": 0.8335396647453308,
        "compile_time": 1.222463607788086
    },
    {
        "BLOCK_SIZE_M": 32,
        "BLOCK_SIZE_N": 256,
        "BLOCK_SIZE_K": 32,
        "GROUP_SIZE_M": 8,
        "num_stages": 5,
        "num_warps": 16,
        "ms": 0.8336782455444336,
        "min_ms": 0.8336782455444336,
        "max_ms": 0.8336782455444336,
        "compile_time": 1.2500457763671875
    },
    {
        "BLOCK_SIZE_M": 64,
        "BLOCK_SIZE_N": 512,
        "BLOCK_SIZE_K": 32,
        "GROUP_SIZE_M": 8,
        "num_stages": 2,
        "num_warps": 16,
        "ms": 0.8338024020195007,
        "min_ms": 0.8338024020195007,
        "max_ms": 0.8338024020195007,
        "compile_time": 1.2361950874328613
    },
    {
        "BLOCK_SIZE_M": 32,
        "BLOCK_SIZE_N": 128,
        "BLOCK_SIZE_K": 64,
        "GROUP_SIZE_M": 8,
        "num_stages": 2,
        "num_warps": 8,
        "ms": 0.8341292142868042,
        "min_ms": 0.8341292142868042,
        "max_ms": 0.8341292142868042,
        "compile_time": 1.19757080078125
    },
    {
        "BLOCK_SIZE_M": 128,
        "BLOCK_SIZE_N": 128,
        "BLOCK_SIZE_K": 16,
        "GROUP_SIZE_M": 8,
        "num_stages": 4,
        "num_warps": 16,
        "ms": 0.8349769711494446,
        "min_ms": 0.8349769711494446,
        "max_ms": 0.8349769711494446,
        "compile_time": 1.2691783905029297
    },
    {
        "BLOCK_SIZE_M": 256,
        "BLOCK_SIZE_N": 64,
        "BLOCK_SIZE_K": 16,
