simdata/FP16-R100/4096_results.json
[
    {
        "BLOCK_SIZE_M": 256,
        "BLOCK_SIZE_N": 128,
        "BLOCK_SIZE_K": 32,
        "GROUP_SIZE_M": 8,
        "num_stages": 4,
        "num_warps": 8,
        "ms": 0.5612967014312744,
        "min_ms": 0.5612967014312744,
        "max_ms": 0.5612967014312744,
        "compile_time": 1.3788375854492188
    },
    {
        "BLOCK_SIZE_M": 128,
        "BLOCK_SIZE_N": 256,
        "BLOCK_SIZE_K": 32,
        "GROUP_SIZE_M": 8,
        "num_stages": 4,
        "num_warps": 8,
        "ms": 0.5622822642326355,
        "min_ms": 0.5622822642326355,
        "max_ms": 0.5622822642326355,
        "compile_time": 1.346740484237671
    },
    {
        "BLOCK_SIZE_M": 128,
        "BLOCK_SIZE_N": 256,
        "BLOCK_SIZE_K": 32,
        "GROUP_SIZE_M": 8,
        "num_stages": 3,
        "num_warps": 8,
        "ms": 0.5651838183403015,
        "min_ms": 0.5651838183403015,
        "max_ms": 0.5651838183403015,
        "compile_time": 1.348311185836792
    },
    {
        "BLOCK_SIZE_M": 256,
        "BLOCK_SIZE_N": 128,
        "BLOCK_SIZE_K": 32,
        "GROUP_SIZE_M": 8,
        "num_stages": 6,
        "num_warps": 8,
        "ms": 0.5655871033668518,
        "min_ms": 0.5655871033668518,
        "max_ms": 0.5655871033668518,
        "compile_time": 1.3814892768859863
    },
    {
        "BLOCK_SIZE_M": 128,
        "BLOCK_SIZE_N": 256,
        "BLOCK_SIZE_K": 32,
        "GROUP_SIZE_M": 8,
        "num_stages": 6,
        "num_warps": 8,
        "ms": 0.5656872987747192,
        "min_ms": 0.5656872987747192,
        "max_ms": 0.5656872987747192,
        "compile_time": 1.337015151977539
    },
    {
        "BLOCK_SIZE_M": 128,
        "BLOCK_SIZE_N": 256,
        "BLOCK_SIZE_K": 32,
        "GROUP_SIZE_M": 8,
        "num_stages": 7,
        "num_warps": 8,
        "ms": 0.5660132169723511,
        "min_ms": 0.5660132169723511,
        "max_ms": 0.5660132169723511,
        "compile_time": 2.5656447410583496
    },
    {
        "BLOCK_SIZE_M": 256,
        "BLOCK_SIZE_N": 128,
        "BLOCK_SIZE_K": 32,
        "GROUP_SIZE_M": 8,
        "num_stages": 3,
        "num_warps": 8,
        "ms": 0.566353440284729,
        "min_ms": 0.566353440284729,
        "max_ms": 0.566353440284729,
        "compile_time": 1.3733623027801514
    },
    {
        "BLOCK_SIZE_M": 128,
        "BLOCK_SIZE_N": 256,
        "BLOCK_SIZE_K": 32,
        "GROUP_SIZE_M": 8,
        "num_stages": 5,
        "num_warps": 8,
        "ms": 0.5681141018867493,
        "min_ms": 0.5681141018867493,
        "max_ms": 0.5681141018867493,
        "compile_time": 1.357161045074463
    },
    {
        "BLOCK_SIZE_M": 256,
        "BLOCK_SIZE_N": 128,
        "BLOCK_SIZE_K": 32,
        "GROUP_SIZE_M": 8,
        "num_stages": 5,
        "num_warps": 8,
        "ms": 0.5688650012016296,
        "min_ms": 0.5688650012016296,
        "max_ms": 0.5688650012016296,
        "compile_time": 1.389662265777588
    },
    {
        "BLOCK_SIZE_M": 256,
        "BLOCK_SIZE_N": 128,
        "BLOCK_SIZE_K": 32,
        "GROUP_SIZE_M": 8,
        "num_stages": 7,
        "num_warps": 8,
        "ms": 0.5695778727531433,
        "min_ms": 0.5695778727531433,
        "max_ms": 0.5695778727531433,
        "compile_time": 1.3866608142852783
    },
    {
        "BLOCK_SIZE_M": 128,
        "BLOCK_SIZE_N": 128,
        "BLOCK_SIZE_K": 32,
        "GROUP_SIZE_M": 8,
        "num_stages": 3,
        "num_warps": 4,
        "ms": 0.5861684679985046,
        "min_ms": 0.5861684679985046,
        "max_ms": 0.5861684679985046,
        "compile_time": 1.3570318222045898
    },
    {
        "BLOCK_SIZE_M": 128,
        "BLOCK_SIZE_N": 128,
        "BLOCK_SIZE_K": 32,
        "GROUP_SIZE_M": 8,
        "num_stages": 4,
        "num_warps": 4,
        "ms": 0.5874046683311462,
        "min_ms": 0.5874046683311462,
        "max_ms": 0.5874046683311462,
        "compile_time": 1.3746068477630615
    },
    {
        "BLOCK_SIZE_M": 128,
        "BLOCK_SIZE_N": 128,
        "BLOCK_SIZE_K": 32,
        "GROUP_SIZE_M": 8,
        "num_stages": 5,
        "num_warps": 4,
        "ms": 0.5895727872848511,
        "min_ms": 0.5895727872848511,
        "max_ms": 0.5895727872848511,
        "compile_time": 1.369077205657959
    },
    {
        "BLOCK_SIZE_M": 128,
        "BLOCK_SIZE_N": 128,
        "BLOCK_SIZE_K": 64,
        "GROUP_SIZE_M": 8,
        "num_stages": 3,
        "num_warps": 4,
        "ms": 0.5901947021484375,
        "min_ms": 0.5901947021484375,
        "max_ms": 0.5901947021484375,
        "compile_time": 1.361196756362915
    },
    {
        "BLOCK_SIZE_M": 128,
        "BLOCK_SIZE_N": 128,
        "BLOCK_SIZE_K": 32,
        "GROUP_SIZE_M": 8,
        "num_stages": 6,
        "num_warps": 4,
        "ms": 0.5908958315849304,
        "min_ms": 0.5908958315849304,
        "max_ms": 0.5908958315849304,
        "compile_time": 1.368408203125
    },
    {
        "BLOCK_SIZE_M": 256,
        "BLOCK_SIZE_N": 128,
        "BLOCK_SIZE_K": 64,
        "GROUP_SIZE_M": 8,
        "num_stages": 3,
        "num_warps": 8,
        "ms": 0.5922028422355652,
        "min_ms": 0.5922028422355652,
        "max_ms": 0.5922028422355652,
        "compile_time": 1.3468961715698242
    },
    {
        "BLOCK_SIZE_M": 256,
        "BLOCK_SIZE_N": 128,
        "BLOCK_SIZE_K": 64,
        "GROUP_SIZE_M": 8,
        "num_stages": 4,
        "num_warps": 8,
        "ms": 0.5931044220924377,
        "min_ms": 0.5931044220924377,
        "max_ms": 0.5931044220924377,
        "compile_time": 1.3486387729644775
    },
    {
        "BLOCK_SIZE_M": 128,
        "BLOCK_SIZE_N": 256,
        "BLOCK_SIZE_K": 64,
        "GROUP_SIZE_M": 8,
        "num_stages": 4,
        "num_warps": 8,
        "ms": 0.6082622408866882,
        "min_ms": 0.6082622408866882,
        "max_ms": 0.6082622408866882,
        "compile_time": 1.3105549812316895
    },
    {
        "BLOCK_SIZE_M": 128,
        "BLOCK_SIZE_N": 256,
        "BLOCK_SIZE_K": 64,
        "GROUP_SIZE_M": 8,
        "num_stages": 3,
        "num_warps": 8,
        "ms": 0.6099278926849365,
        "min_ms": 0.6099278926849365,
        "max_ms": 0.6099278926849365,
        "compile_time": 1.3172709941864014
    },
    {
        "BLOCK_SIZE_M": 64,
        "BLOCK_SIZE_N": 512,
        "BLOCK_SIZE_K": 32,
        "GROUP_SIZE_M": 8,
        "num_stages": 5,
        "num_warps": 8,
        "ms": 0.6148229837417603,
        "min_ms": 0.6148229837417603,
        "max_ms": 0.6148229837417603,
        "compile_time": 2.555133104324341
    },
    {
        "BLOCK_SIZE_M": 64,
        "BLOCK_SIZE_N": 512,
        "BLOCK_SIZE_K": 32,
        "GROUP_SIZE_M": 8,
        "num_stages": 3,
        "num_warps": 8,
        "ms": 0.6154657006263733,
        "min_ms": 0.6154657006263733,
        "max_ms": 0.6154657006263733,
        "compile_time": 2.483825922012329
    },
    {
        "BLOCK_SIZE_M": 128,
        "BLOCK_SIZE_N": 128,
        "BLOCK_SIZE_K": 32,
        "GROUP_SIZE_M": 8,
        "num_stages": 7,
        "num_warps": 4,
        "ms": 0.6166191101074219,
        "min_ms": 0.6166191101074219,
        "max_ms": 0.6166191101074219,
        "compile_time": 1.3519749641418457
    },
    {
        "BLOCK_SIZE_M": 128,
        "BLOCK_SIZE_N": 128,
        "BLOCK_SIZE_K": 32,
        "GROUP_SIZE_M": 8,
        "num_stages": 8,
        "num_warps": 4,
        "ms": 0.6173238754272461,
        "min_ms": 0.6173238754272461,
        "max_ms": 0.6173238754272461,
        "compile_time": 1.3549716472625732
    },
    {
        "BLOCK_SIZE_M": 128,
        "BLOCK_SIZE_N": 128,
        "BLOCK_SIZE_K": 64,
        "GROUP_SIZE_M": 8,
        "num_stages": 2,
        "num_warps": 4,
        "ms": 0.623207688331604,
        "min_ms": 0.623207688331604,
        "max_ms": 0.623207688331604,
        "compile_time": 1.3576045036315918
    },
    {
        "BLOCK_SIZE_M": 128,
        "BLOCK_SIZE_N": 128,
        "BLOCK_SIZE_K": 64,
        "GROUP_SIZE_M": 8,
        "num_stages": 3,
        "num_warps": 8,
        "ms": 0.630196750164032,
        "min_ms": 0.630196750164032,
        "max_ms": 0.630196750164032,
        "compile_time": 1.3615729808807373
    },
    {
        "BLOCK_SIZE_M": 512,
        "BLOCK_SIZE_N": 64,
        "BLOCK_SIZE_K": 64,
        "GROUP_SIZE_M": 8,
        "num_stages": 3,
        "num_warps": 8,
        "ms": 0.6313726305961609,
        "min_ms": 0.6313726305961609,
        "max_ms": 0.6313726305961609,
        "compile_time": 3.013007879257202
    },
    {
        "BLOCK_SIZE_M": 128,
        "BLOCK_SIZE_N": 128,
        "BLOCK_SIZE_K": 64,
        "GROUP_SIZE_M": 8,
        "num_stages": 4,
        "num_warps": 8,
        "ms": 0.6318622827529907,
        "min_ms": 0.6318622827529907,
        "max_ms": 0.6318622827529907,
        "compile_time": 1.353729486465454
    },
    {
        "BLOCK_SIZE_M": 128,
        "BLOCK_SIZE_N": 128,
        "BLOCK_SIZE_K": 64,
        "GROUP_SIZE_M": 8,
        "num_stages": 5,
        "num_warps": 8,
        "ms": 0.6319128274917603,
        "min_ms": 0.6319128274917603,
        "max_ms": 0.6319128274917603,
        "compile_time": 1.356818675994873
    },
    {
        "BLOCK_SIZE_M": 128,
        "BLOCK_SIZE_N": 128,
        "BLOCK_SIZE_K": 64,
        "GROUP_SIZE_M": 8,
        "num_stages": 6,
        "num_warps": 8,
        "ms": 0.6335175633430481,
        "min_ms": 0.6335175633430481,
        "max_ms": 0.6335175633430481,
        "compile_time": 1.3487987518310547
    },
    {
        "BLOCK_SIZE_M": 64,
        "BLOCK_SIZE_N": 256,
        "BLOCK_SIZE_K": 32,
        "GROUP_SIZE_M": 8,
        "num_stages": 4,
        "num_warps": 4,
        "ms": 0.633598804473877,
        "min_ms": 0.633598804473877,
        "max_ms": 0.633598804473877,
        "compile_time": 1.3346903324127197
    },
    {
        "BLOCK_SIZE_M": 512,
        "BLOCK_SIZE_N": 64,
        "BLOCK_SIZE_K": 32,
        "GROUP_SIZE_M": 8,
        "num_stages": 4,
        "num_warps": 8,
        "ms": 0.6406194567680359,
        "min_ms": 0.6406194567680359,
        "max_ms": 0.6406194567680359,
        "compile_time": 2.742131471633911
    },
    {
        "BLOCK_SIZE_M": 512,
        "BLOCK_SIZE_N": 64,
        "BLOCK_SIZE_K": 32,
        "GROUP_SIZE_M": 8,
        "num_stages": 3,
        "num_warps": 8,
        "ms": 0.6409772038459778,
        "min_ms": 0.6409772038459778,
        "max_ms": 0.6409772038459778,
        "compile_time": 2.7241804599761963
    },
    {
        "BLOCK_SIZE_M": 512,
        "BLOCK_SIZE_N": 64,
        "BLOCK_SIZE_K": 32,
        "GROUP_SIZE_M": 8,
        "num_stages": 5,
        "num_warps": 8,
        "ms": 0.6416012644767761,
        "min_ms": 0.6416012644767761,
        "max_ms": 0.6416012644767761,
        "compile_time": 2.811763286590576
    },
    {
        "BLOCK_SIZE_M": 64,
        "BLOCK_SIZE_N": 256,
        "BLOCK_SIZE_K": 32,
        "GROUP_SIZE_M": 8,
        "num_stages": 5,
        "num_warps": 4,
        "ms": 0.6417965888977051,
        "min_ms": 0.6417965888977051,
        "max_ms": 0.6417965888977051,
        "compile_time": 1.345104694366455
    },
    {
        "BLOCK_SIZE_M": 256,
        "BLOCK_SIZE_N": 64,
        "BLOCK_SIZE_K": 64,
        "GROUP_SIZE_M": 8,
        "num_stages": 3,
        "num_warps": 4,
        "ms": 0.6425110101699829,
        "min_ms": 0.6425110101699829,
        "max_ms": 0.6425110101699829,
        "compile_time": 1.3915746212005615
    },
    {
        "BLOCK_SIZE_M": 64,
        "BLOCK_SIZE_N": 256,
        "BLOCK_SIZE_K": 32,
        "GROUP_SIZE_M": 8,
        "num_stages": 3,
        "num_warps": 4,
        "ms": 0.6429979801177979,
        "min_ms": 0.6429979801177979,
        "max_ms": 0.6429979801177979,
        "compile_time": 1.3439292907714844
    },
    {
        "BLOCK_SIZE_M": 128,
        "BLOCK_SIZE_N": 128,
        "BLOCK_SIZE_K": 128,
        "GROUP_SIZE_M": 8,
        "num_stages": 3,
        "num_warps": 8,
        "ms": 0.6446911096572876,
        "min_ms": 0.6446911096572876,
        "max_ms": 0.6446911096572876,
        "compile_time": 1.3374130725860596
    },
    {
        "BLOCK_SIZE_M": 256,
        "BLOCK_SIZE_N": 64,
        "BLOCK_SIZE_K": 32,
        "GROUP_SIZE_M": 8,
        "num_stages": 3,
        "num_warps": 4,
        "ms": 0.6484362483024597,
        "min_ms": 0.6484362483024597,
        "max_ms": 0.6484362483024597,
        "compile_time": 1.3884587287902832
    },
    {
        "BLOCK_SIZE_M": 256,
        "BLOCK_SIZE_N": 64,
        "BLOCK_SIZE_K": 32,
        "GROUP_SIZE_M": 8,
        "num_stages": 4,
        "num_warps": 4,
        "ms": 0.6499522924423218,
        "min_ms": 0.6499522924423218,
        "max_ms": 0.6499522924423218,
        "compile_time": 1.4020347595214844
    },
    {
        "BLOCK_SIZE_M": 256,
        "BLOCK_SIZE_N": 64,
        "BLOCK_SIZE_K": 32,
        "GROUP_SIZE_M": 8,
        "num_stages": 5,
        "num_warps": 4,
        "ms": 0.653823971748352,
        "min_ms": 0.653823971748352,
        "max_ms": 0.653823971748352,
        "compile_time": 1.3960280418395996
    },
    {
        "BLOCK_SIZE_M": 128,
        "BLOCK_SIZE_N": 128,
        "BLOCK_SIZE_K": 64,
        "GROUP_SIZE_M": 8,
        "num_stages": 4,
        "num_warps": 4,
        "ms": 0.656852126121521,
        "min_ms": 0.656852126121521,
        "max_ms": 0.656852126121521,
        "compile_time": 1.326085090637207
    },
    {
        "BLOCK_SIZE_M": 128,
        "BLOCK_SIZE_N": 128,
        "BLOCK_SIZE_K": 64,
        "GROUP_SIZE_M": 8,
        "num_stages": 5,
        "num_warps": 4,
        "ms": 0.6589200496673584,
        "min_ms": 0.6589200496673584,
        "max_ms": 0.6589200496673584,
        "compile_time": 1.3207149505615234
    },
    {
        "BLOCK_SIZE_M": 128,
        "BLOCK_SIZE_N": 128,
        "BLOCK_SIZE_K": 64,
        "GROUP_SIZE_M": 8,
        "num_stages": 6,
        "num_warps": 4,
        "ms": 0.6632542610168457,
        "min_ms": 0.6632542610168457,
        "max_ms": 0.6632542610168457,
        "compile_time": 1.3195397853851318
    },
    {
        "BLOCK_SIZE_M": 256,
        "BLOCK_SIZE_N": 64,
        "BLOCK_SIZE_K": 64,
        "GROUP_SIZE_M": 8,
        "num_stages": 4,
        "num_warps": 8,
        "ms": 0.6653977632522583,
        "min_ms": 0.6653977632522583,
        "max_ms": 0.6653977632522583,
        "compile_time": 1.4028215408325195
    },
    {
        "BLOCK_SIZE_M": 256,
        "BLOCK_SIZE_N": 64,
        "BLOCK_SIZE_K": 64,
        "GROUP_SIZE_M": 8,
        "num_stages": 5,
        "num_warps": 8,
        "ms": 0.6682456135749817,
        "min_ms": 0.6682456135749817,
        "max_ms": 0.6682456135749817,
        "compile_time": 1.394310712814331
    },
    {
        "BLOCK_SIZE_M": 128,
        "BLOCK_SIZE_N": 128,
        "BLOCK_SIZE_K": 32,
        "GROUP_SIZE_M": 8,
        "num_stages": 6,
        "num_warps": 8,
        "ms": 0.6684392690658569,
        "min_ms": 0.6684392690658569,
        "max_ms": 0.6684392690658569,
        "compile_time": 1.3381264209747314
    },
    {
        "BLOCK_SIZE_M": 256,
        "BLOCK_SIZE_N": 64,
        "BLOCK_SIZE_K": 64,
        "GROUP_SIZE_M": 8,
        "num_stages": 3,
        "num_warps": 8,
        "ms": 0.6689015626907349,
        "min_ms": 0.6689015626907349,
        "max_ms": 0.6689015626907349,
        "compile_time": 1.4026038646697998
    },
    {
        "BLOCK_SIZE_M": 128,
        "BLOCK_SIZE_N": 128,
        "BLOCK_SIZE_K": 32,
        "GROUP_SIZE_M": 8,
        "num_stages": 7,
        "num_warps": 8,
        "ms": 0.669910192489624,
        "min_ms": 0.669910192489624,
        "max_ms": 0.669910192489624,
        "compile_time": 1.3341097831726074
    },
    {
        "BLOCK_SIZE_M": 128,
        "BLOCK_SIZE_N": 128,
        "BLOCK_SIZE_K": 32,
        "GROUP_SIZE_M": 8,
        "num_stages": 5,
        "num_warps": 8,
        "ms": 0.6711590886116028,
        "min_ms": 0.6711590886116028,
        "max_ms": 0.6711590886116028,
        "compile_time": 1.3351545333862305
    },
    {
        "BLOCK_SIZE_M": 256,
        "BLOCK_SIZE_N": 64,
        "BLOCK_SIZE_K": 64,
        "GROUP_SIZE_M": 8,
        "num_stages": 2,
        "num_warps": 4,
        "ms": 0.6719051599502563,
        "min_ms": 0.6719051599502563,
        "max_ms": 0.6719051599502563,
        "compile_time": 1.36555814743042
    },
    {
        "BLOCK_SIZE_M": 64,
        "BLOCK_SIZE_N": 256,
        "BLOCK_SIZE_K": 64,
        "GROUP_SIZE_M": 8,
        "num_stages": 3,
        "num_warps": 4,
        "ms": 0.6721851229667664,
        "min_ms": 0.6721851229667664,
        "max_ms": 0.6721851229667664,
        "compile_time": 1.324784517288208
    },
    {
        "BLOCK_SIZE_M": 128,
        "BLOCK_SIZE_N": 128,
        "BLOCK_SIZE_K": 32,
        "GROUP_SIZE_M": 8,
        "num_stages": 4,
        "num_warps": 8,
        "ms": 0.675316572189331,
        "min_ms": 0.675316572189331,
        "max_ms": 0.675316572189331,
        "compile_time": 1.3377110958099365
    },
    {
        "BLOCK_SIZE_M": 64,
        "BLOCK_SIZE_N": 512,
        "BLOCK_SIZE_K": 32,
        "GROUP_SIZE_M": 8,
        "num_stages": 4,
        "num_warps": 8,
        "ms": 0.6758385896682739,
        "min_ms": 0.6758385896682739,
        "max_ms": 0.6758385896682739,
        "compile_time": 2.4972686767578125
    },
    {
        "BLOCK_SIZE_M": 128,
        "BLOCK_SIZE_N": 128,
        "BLOCK_SIZE_K": 32,
        "GROUP_SIZE_M": 8,
        "num_stages": 8,
        "num_warps": 8,
        "ms": 0.6759694814682007,
        "min_ms": 0.6759694814682007,
        "max_ms": 0.6759694814682007,
        "compile_time": 1.3509759902954102
    },
    {
        "BLOCK_SIZE_M": 256,
        "BLOCK_SIZE_N": 64,
        "BLOCK_SIZE_K": 128,
        "GROUP_SIZE_M": 8,
        "num_stages": 3,
        "num_warps": 8,
        "ms": 0.680103063583374,
        "min_ms": 0.680103063583374,
        "max_ms": 0.680103063583374,
        "compile_time": 1.3750364780426025
    },
    {
        "BLOCK_SIZE_M": 64,
        "BLOCK_SIZE_N": 256,
        "BLOCK_SIZE_K": 64,
        "GROUP_SIZE_M": 8,
        "num_stages": 5,
        "num_warps": 8,
        "ms": 0.6820753216743469,
        "min_ms": 0.6820753216743469,
        "max_ms": 0.6820753216743469,
        "compile_time": 1.3430163860321045
    },
    {
        "BLOCK_SIZE_M": 64,
        "BLOCK_SIZE_N": 256,
        "BLOCK_SIZE_K": 64,
        "GROUP_SIZE_M": 8,
        "num_stages": 4,
        "num_warps": 8,
        "ms": 0.6828292608261108,
        "min_ms": 0.6828292608261108,
        "max_ms": 0.6828292608261108,
        "compile_time": 1.3414065837860107
    },
    {
        "BLOCK_SIZE_M": 64,
        "BLOCK_SIZE_N": 256,
        "BLOCK_SIZE_K": 64,
        "GROUP_SIZE_M": 8,
        "num_stages": 3,
        "num_warps": 8,
        "ms": 0.6893998980522156,
        "min_ms": 0.6893998980522156,
        "max_ms": 0.6893998980522156,
        "compile_time": 1.321491003036499
    },
    {
        "BLOCK_SIZE_M": 64,
        "BLOCK_SIZE_N": 512,
        "BLOCK_SIZE_K": 64,
        "GROUP_SIZE_M": 8,
        "num_stages": 3,
        "num_warps": 8,
        "ms": 0.6904759407043457,
        "min_ms": 0.6904759407043457,
        "max_ms": 0.6904759407043457,
        "compile_time": 2.6951873302459717
    },
    {
        "BLOCK_SIZE_M": 64,
        "BLOCK_SIZE_N": 256,
        "BLOCK_SIZE_K": 16,
        "GROUP_SIZE_M": 8,
        "num_stages": 4,
        "num_warps": 4,
        "ms": 0.6997462511062622,
        "min_ms": 0.6997462511062622,
        "max_ms": 0.6997462511062622,
        "compile_time": 1.3105425834655762
    },
    {
        "BLOCK_SIZE_M": 256,
        "BLOCK_SIZE_N": 64,
        "BLOCK_SIZE_K": 32,
        "GROUP_SIZE_M": 8,
        "num_stages": 7,
        "num_warps": 4,
        "ms": 0.700623631477356,
        "min_ms": 0.700623631477356,
        "max_ms": 0.700623631477356,
        "compile_time": 1.372652530670166
    },
    {
        "BLOCK_SIZE_M": 256,
        "BLOCK_SIZE_N": 64,
        "BLOCK_SIZE_K": 32,
        "GROUP_SIZE_M": 8,
        "num_stages": 6,
        "num_warps": 4,
        "ms": 0.7017771005630493,
        "min_ms": 0.7017771005630493,
        "max_ms": 0.7017771005630493,
        "compile_time": 1.3694682121276855
    },
    {
        "BLOCK_SIZE_M": 256,
        "BLOCK_SIZE_N": 64,
        "BLOCK_SIZE_K": 32,
        "GROUP_SIZE_M": 8,
        "num_stages": 8,
        "num_warps": 4,
        "ms": 0.7031415700912476,
        "min_ms": 0.7031415700912476,
        "max_ms": 0.7031415700912476,
        "compile_time": 1.3696482181549072
    },
    {
        "BLOCK_SIZE_M": 256,
        "BLOCK_SIZE_N": 64,
        "BLOCK_SIZE_K": 64,
        "GROUP_SIZE_M": 8,
        "num_stages": 5,
        "num_warps": 4,
        "ms": 0.7039695978164673,
        "min_ms": 0.7039695978164673,
        "max_ms": 0.7039695978164673,
        "compile_time": 1.3625342845916748
    },
    {
        "BLOCK_SIZE_M": 64,
        "BLOCK_SIZE_N": 256,
        "BLOCK_SIZE_K": 64,
        "GROUP_SIZE_M": 8,
        "num_stages": 2,
        "num_warps": 4,
        "ms": 0.7044413685798645,
        "min_ms": 0.7044413685798645,
        "max_ms": 0.7044413685798645,
        "compile_time": 1.3049952983856201
    },
    {
        "BLOCK_SIZE_M": 64,
        "BLOCK_SIZE_N": 256,
        "BLOCK_SIZE_K": 32,
        "GROUP_SIZE_M": 8,
        "num_stages": 5,
        "num_warps": 8,
        "ms": 0.7059131860733032,
        "min_ms": 0.7059131860733032,
        "max_ms": 0.7059131860733032,
        "compile_time": 1.2573425769805908
    },
    {
        "BLOCK_SIZE_M": 128,
        "BLOCK_SIZE_N": 64,
        "BLOCK_SIZE_K": 32,
        "GROUP_SIZE_M": 8,
        "num_stages": 4,
        "num_warps": 2,
        "ms": 0.7074039578437805,
        "min_ms": 0.7074039578437805,
        "max_ms": 0.7074039578437805,
        "compile_time": 1.3515124320983887
    },
    {
        "BLOCK_SIZE_M": 64,
        "BLOCK_SIZE_N": 256,
        "BLOCK_SIZE_K": 32,
        "GROUP_SIZE_M": 8,
        "num_stages": 4,
        "num_warps": 8,
        "ms": 0.7079694271087646,
        "min_ms": 0.7079694271087646,
        "max_ms": 0.7079694271087646,
        "compile_time": 1.3020100593566895
    },
    {
        "BLOCK_SIZE_M": 128,
        "BLOCK_SIZE_N": 64,
        "BLOCK_SIZE_K": 32,
        "GROUP_SIZE_M": 8,
        "num_stages": 5,
        "num_warps": 2,
        "ms": 0.7085697054862976,
        "min_ms": 0.7085697054862976,
        "max_ms": 0.7085697054862976,
        "compile_time": 1.3609552383422852
    },
    {
        "BLOCK_SIZE_M": 128,
        "BLOCK_SIZE_N": 64,
        "BLOCK_SIZE_K": 32,
        "GROUP_SIZE_M": 8,
        "num_stages": 3,
        "num_warps": 2,
        "ms": 0.7089055180549622,
        "min_ms": 0.7089055180549622,
        "max_ms": 0.7089055180549622,
        "compile_time": 1.3502168655395508
    },
    {
        "BLOCK_SIZE_M": 64,
        "BLOCK_SIZE_N": 256,
        "BLOCK_SIZE_K": 32,
        "GROUP_SIZE_M": 8,
        "num_stages": 6,
        "num_warps": 8,
        "ms": 0.7100047469139099,
        "min_ms": 0.7100047469139099,
        "max_ms": 0.7100047469139099,
        "compile_time": 1.3449363708496094
    },
    {
        "BLOCK_SIZE_M": 128,
        "BLOCK_SIZE_N": 64,
        "BLOCK_SIZE_K": 32,
        "GROUP_SIZE_M": 8,
        "num_stages": 4,
        "num_warps": 4,
        "ms": 0.7107993960380554,
        "min_ms": 0.7107993960380554,
        "max_ms": 0.7107993960380554,
        "compile_time": 1.3693737983703613
    },
    {
        "BLOCK_SIZE_M": 64,
        "BLOCK_SIZE_N": 128,
        "BLOCK_SIZE_K": 32,
        "GROUP_SIZE_M": 8,
        "num_stages": 4,
        "num_warps": 2,
        "ms": 0.7125927209854126,
        "min_ms": 0.7125927209854126,
        "max_ms": 0.7125927209854126,
        "compile_time": 1.32609224319458
    },
    {
        "BLOCK_SIZE_M": 128,
        "BLOCK_SIZE_N": 64,
        "BLOCK_SIZE_K": 32,
        "GROUP_SIZE_M": 8,
        "num_stages": 5,
        "num_warps": 4,
        "ms": 0.7129156589508057,
        "min_ms": 0.7129156589508057,
        "max_ms": 0.7129156589508057,
        "compile_time": 1.36659836769104
    },
    {
        "BLOCK_SIZE_M": 64,
        "BLOCK_SIZE_N": 256,
        "BLOCK_SIZE_K": 32,
        "GROUP_SIZE_M": 8,
        "num_stages": 7,
        "num_warps": 8,
        "ms": 0.7132450342178345,
        "min_ms": 0.7132450342178345,
        "max_ms": 0.7132450342178345,
        "compile_time": 1.3229732513427734
    },
    {
        "BLOCK_SIZE_M": 64,
        "BLOCK_SIZE_N": 128,
        "BLOCK_SIZE_K": 32,
        "GROUP_SIZE_M": 8,
        "num_stages": 3,
        "num_warps": 2,
        "ms": 0.7142788171768188,
        "min_ms": 0.7142788171768188,
        "max_ms": 0.7142788171768188,
        "compile_time": 1.3267202377319336
    },
    {
        "BLOCK_SIZE_M": 64,
        "BLOCK_SIZE_N": 256,
        "BLOCK_SIZE_K": 32,
        "GROUP_SIZE_M": 8,
        "num_stages": 8,
        "num_warps": 8,
        "ms": 0.7155712246894836,
        "min_ms": 0.7155712246894836,
        "max_ms": 0.7155712246894836,
        "compile_time": 1.3520317077636719
    },
    {
        "BLOCK_SIZE_M": 64,
        "BLOCK_SIZE_N": 256,
        "BLOCK_SIZE_K": 16,
        "GROUP_SIZE_M": 8,
        "num_stages": 6,
        "num_warps": 4,
        "ms": 0.7167336344718933,
        "min_ms": 0.7167336344718933,
        "max_ms": 0.7167336344718933,
        "compile_time": 2.2642927169799805
    },
    {
        "BLOCK_SIZE_M": 64,
        "BLOCK_SIZE_N": 256,
        "BLOCK_SIZE_K": 128,
        "GROUP_SIZE_M": 8,
        "num_stages": 3,
        "num_warps": 8,
        "ms": 0.716808557510376,
        "min_ms": 0.716808557510376,
        "max_ms": 0.716808557510376,
        "compile_time": 1.3190820217132568
    },
    {
        "BLOCK_SIZE_M": 128,
        "BLOCK_SIZE_N": 64,
        "BLOCK_SIZE_K": 64,
        "GROUP_SIZE_M": 8,
        "num_stages": 4,
        "num_warps": 4,
        "ms": 0.7170020341873169,
        "min_ms": 0.7170020341873169,
        "max_ms": 0.7170020341873169,
        "compile_time": 1.3544626235961914
    },
    {
        "BLOCK_SIZE_M": 128,
        "BLOCK_SIZE_N": 128,
        "BLOCK_SIZE_K": 128,
        "GROUP_SIZE_M": 8,
        "num_stages": 3,
        "num_warps": 4,
        "ms": 0.7176012992858887,
        "min_ms": 0.7176012992858887,
        "max_ms": 0.7176012992858887,
        "compile_time": 1.29547119140625
    },
    {
        "BLOCK_SIZE_M": 128,
        "BLOCK_SIZE_N": 64,
        "BLOCK_SIZE_K": 32,
        "GROUP_SIZE_M": 8,
        "num_stages": 6,
        "num_warps": 4,
        "ms": 0.717699408531189,
        "min_ms": 0.717699408531189,
        "max_ms": 0.717699408531189,
        "compile_time": 1.3600828647613525
    },
    {
        "BLOCK_SIZE_M": 64,
        "BLOCK_SIZE_N": 256,
        "BLOCK_SIZE_K": 16,
        "GROUP_SIZE_M": 8,
        "num_stages": 7,
        "num_warps": 4,
        "ms": 0.7180118560791016,
        "min_ms": 0.7180118560791016,
        "max_ms": 0.7180118560791016,
        "compile_time": 1.3156054019927979
    },
    {
        "BLOCK_SIZE_M": 128,
        "BLOCK_SIZE_N": 64,
        "BLOCK_SIZE_K": 32,
        "GROUP_SIZE_M": 8,
        "num_stages": 7,
        "num_warps": 4,
        "ms": 0.7181704044342041,
        "min_ms": 0.7181704044342041,
        "max_ms": 0.7181704044342041,
        "compile_time": 1.3690717220306396
    },
    {
        "BLOCK_SIZE_M": 128,
        "BLOCK_SIZE_N": 128,
        "BLOCK_SIZE_K": 128,
        "GROUP_SIZE_M": 8,
        "num_stages": 3,
        "num_warps": 16,
        "ms": 0.7183018922805786,
        "min_ms": 0.7183018922805786,
        "max_ms": 0.7183018922805786,
        "compile_time": 1.322511911392212
    },
    {
        "BLOCK_SIZE_M": 128,
        "BLOCK_SIZE_N": 64,
        "BLOCK_SIZE_K": 64,
        "GROUP_SIZE_M": 8,
        "num_stages": 3,
        "num_warps": 4,
        "ms": 0.7196841835975647,
        "min_ms": 0.7196841835975647,
        "max_ms": 0.7196841835975647,
        "compile_time": 1.3408989906311035
    },
    {
        "BLOCK_SIZE_M": 64,
        "BLOCK_SIZE_N": 128,
        "BLOCK_SIZE_K": 32,
        "GROUP_SIZE_M": 8,
        "num_stages": 5,
        "num_warps": 2,
        "ms": 0.7199262976646423,
        "min_ms": 0.7199262976646423,
        "max_ms": 0.7199262976646423,
        "compile_time": 1.3216211795806885
    },
    {
        "BLOCK_SIZE_M": 64,
        "BLOCK_SIZE_N": 256,
        "BLOCK_SIZE_K": 16,
        "GROUP_SIZE_M": 8,
        "num_stages": 8,
        "num_warps": 4,
        "ms": 0.7206727266311646,
        "min_ms": 0.7206727266311646,
        "max_ms": 0.7206727266311646,
        "compile_time": 2.3996059894561768
    },
    {
        "BLOCK_SIZE_M": 128,
        "BLOCK_SIZE_N": 128,
        "BLOCK_SIZE_K": 128,
        "GROUP_SIZE_M": 8,
        "num_stages": 2,
        "num_warps": 4,
        "ms": 0.7209879755973816,
        "min_ms": 0.7209879755973816,
        "max_ms": 0.7209879755973816,
        "compile_time": 1.3070993423461914
    },
    {
        "BLOCK_SIZE_M": 128,
        "BLOCK_SIZE_N": 64,
        "BLOCK_SIZE_K": 64,
        "GROUP_SIZE_M": 8,
        "num_stages": 7,
        "num_warps": 4,
        "ms": 0.7213923931121826,
        "min_ms": 0.7213923931121826,
        "max_ms": 0.7213923931121826,
        "compile_time": 1.3397018909454346
    },
    {
        "BLOCK_SIZE_M": 128,
        "BLOCK_SIZE_N": 64,
        "BLOCK_SIZE_K": 32,
        "GROUP_SIZE_M": 8,
        "num_stages": 3,
        "num_warps": 4,
        "ms": 0.7221873998641968,
        "min_ms": 0.7221873998641968,
        "max_ms": 0.7221873998641968,
        "compile_time": 1.3575153350830078
    },
    {
        "BLOCK_SIZE_M": 64,
        "BLOCK_SIZE_N": 256,
        "BLOCK_SIZE_K": 16,
        "GROUP_SIZE_M": 8,
        "num_stages": 5,
        "num_warps": 4,
        "ms": 0.7236267328262329,
        "min_ms": 0.7236267328262329,
        "max_ms": 0.7236267328262329,
        "compile_time": 1.3111095428466797
    },
    {
        "BLOCK_SIZE_M": 64,
        "BLOCK_SIZE_N": 128,
        "BLOCK_SIZE_K": 64,
        "GROUP_SIZE_M": 8,
        "num_stages": 4,
        "num_warps": 4,
        "ms": 0.7237828373908997,
        "min_ms": 0.7237828373908997,
        "max_ms": 0.7237828373908997,
        "compile_time": 1.3169012069702148
    },
    {
        "BLOCK_SIZE_M": 64,
        "BLOCK_SIZE_N": 128,
        "BLOCK_SIZE_K": 32,
        "GROUP_SIZE_M": 8,
        "num_stages": 5,
        "num_warps": 4,
        "ms": 0.7243000864982605,
        "min_ms": 0.7243000864982605,
        "max_ms": 0.7243000864982605,
        "compile_time": 1.3363621234893799
    },
    {
        "BLOCK_SIZE_M": 64,
        "BLOCK_SIZE_N": 128,
        "BLOCK_SIZE_K": 32,
        "GROUP_SIZE_M": 8,
        "num_stages": 4,
        "num_warps": 4,
        "ms": 0.7245463728904724,
        "min_ms": 0.7245463728904724,
        "max_ms": 0.7245463728904724,
        "compile_time": 1.3398149013519287
    },
    {
        "BLOCK_SIZE_M": 128,
        "BLOCK_SIZE_N": 256,
        "BLOCK_SIZE_K": 64,
        "GROUP_SIZE_M": 8,
        "num_stages": 2,
        "num_warps": 8,
        "ms": 0.7265192270278931,
        "min_ms": 0.7265192270278931,
        "max_ms": 0.7265192270278931,
        "compile_time": 1.2589375972747803
    },
    {
        "BLOCK_SIZE_M": 64,
        "BLOCK_SIZE_N": 128,
        "BLOCK_SIZE_K": 32,
        "GROUP_SIZE_M": 8,
        "num_stages": 6,
        "num_warps": 4,
        "ms": 0.7286240458488464,
        "min_ms": 0.7286240458488464,
        "max_ms": 0.7286240458488464,
        "compile_time": 1.331855297088623
    },
    {
        "BLOCK_SIZE_M": 64,
        "BLOCK_SIZE_N": 128,
        "BLOCK_SIZE_K": 64,
        "GROUP_SIZE_M": 8,
        "num_stages": 5,
        "num_warps": 4,
        "ms": 0.7314929962158203,
        "min_ms": 0.7314929962158203,
        "max_ms": 0.7314929962158203,
        "compile_time": 1.3201310634613037
    },
    {
        "BLOCK_SIZE_M": 64,
        "BLOCK_SIZE_N": 128,
        "BLOCK_SIZE_K": 32,
        "GROUP_SIZE_M": 8,
        "num_stages": 7,
        "num_warps": 4,
        "ms": 0.7332968711853027,
        "min_ms": 0.7332968711853027,
        "max_ms": 0.7332968711853027,
        "compile_time": 1.3325271606445312
    },
    {
        "BLOCK_SIZE_M": 64,
        "BLOCK_SIZE_N": 128,
        "BLOCK_SIZE_K": 64,
        "GROUP_SIZE_M": 8,
        "num_stages": 6,
        "num_warps": 4,
        "ms": 0.7342776656150818,
        "min_ms": 0.7342776656150818,
        "max_ms": 0.7342776656150818,
        "compile_time": 1.3202002048492432
    },
    {
        "BLOCK_SIZE_M": 256,
        "BLOCK_SIZE_N": 64,
        "BLOCK_SIZE_K": 64,
        "GROUP_SIZE_M": 8,
        "num_stages": 4,
        "num_warps": 4,
        "ms": 0.7343947291374207,
        "min_ms": 0.7343947291374207,
        "max_ms": 0.7343947291374207,
        "compile_time": 1.340404987335205
    },
    {
        "BLOCK_SIZE_M": 128,
        "BLOCK_SIZE_N": 128,
        "BLOCK_SIZE_K": 16,
        "GROUP_SIZE_M": 8,
        "num_stages": 8,
        "num_warps": 4,
        "ms": 0.7353665232658386,
        "min_ms": 0.7353665232658386,
        "max_ms": 0.7353665232658386,
        "compile_time": 1.3136773109436035
    },
    {
        "BLOCK_SIZE_M": 256,
        "BLOCK_SIZE_N": 128,
        "BLOCK_SIZE_K": 128,
        "GROUP_SIZE_M": 8,
        "num_stages": 2,
        "num_warps": 8,
        "ms": 0.7355690002441406,
        "min_ms": 0.7355690002441406,
        "max_ms": 0.7355690002441406,
        "compile_time": 1.2868483066558838
    },
    {
        "BLOCK_SIZE_M": 64,
        "BLOCK_SIZE_N": 128,
        "BLOCK_SIZE_K": 64,
        "GROUP_SIZE_M": 8,
        "num_stages": 7,
        "num_warps": 4,
        "ms": 0.7357776761054993,
        "min_ms": 0.7357776761054993,
        "max_ms": 0.7357776761054993,
        "compile_time": 1.3226046562194824
    },
    {
        "BLOCK_SIZE_M": 128,
        "BLOCK_SIZE_N": 64,
        "BLOCK_SIZE_K": 64,
        "GROUP_SIZE_M": 8,
        "num_stages": 3,
        "num_warps": 2,
        "ms": 0.7364357709884644,
        "min_ms": 0.7364357709884644,
        "max_ms": 0.7364357709884644,
        "compile_time": 1.3262913227081299
    },
    {
        "BLOCK_SIZE_M": 64,
        "BLOCK_SIZE_N": 128,
        "BLOCK_SIZE_K": 32,
        "GROUP_SIZE_M": 8,
        "num_stages": 3,
        "num_warps": 4,
        "ms": 0.7395427823066711,
        "min_ms": 0.7395427823066711,
        "max_ms": 0.7395427823066711,
        "compile_time": 1.322202444076538
    },
    {
        "BLOCK_SIZE_M": 64,
        "BLOCK_SIZE_N": 128,
        "BLOCK_SIZE_K": 64,
        "GROUP_SIZE_M": 8,
        "num_stages": 3,
        "num_warps": 4,
        "ms": 0.7402604818344116,
        "min_ms": 0.7402604818344116,
        "max_ms": 0.7402604818344116,
        "compile_time": 1.3073461055755615
    },
    {
        "BLOCK_SIZE_M": 64,
        "BLOCK_SIZE_N": 256,
        "BLOCK_SIZE_K": 32,
        "GROUP_SIZE_M": 8,
        "num_stages": 7,
        "num_warps": 4,
        "ms": 0.740514874458313,
        "min_ms": 0.740514874458313,
        "max_ms": 0.740514874458313,
        "compile_time": 1.3010990619659424
    },
    {
        "BLOCK_SIZE_M": 128,
        "BLOCK_SIZE_N": 128,
        "BLOCK_SIZE_K": 16,
        "GROUP_SIZE_M": 8,
        "num_stages": 4,
        "num_warps": 4,
        "ms": 0.7423785924911499,
        "min_ms": 0.7423785924911499,
        "max_ms": 0.7423785924911499,
        "compile_time": 2.212153911590576
    },
    {
        "BLOCK_SIZE_M": 64,
        "BLOCK_SIZE_N": 256,
        "BLOCK_SIZE_K": 16,
        "GROUP_SIZE_M": 8,
        "num_stages": 3,
        "num_warps": 4,
        "ms": 0.7425349950790405,
        "min_ms": 0.7425349950790405,
        "max_ms": 0.7425349950790405,
        "compile_time": 2.135873556137085
    },
    {
        "BLOCK_SIZE_M": 64,
        "BLOCK_SIZE_N": 256,
        "BLOCK_SIZE_K": 32,
        "GROUP_SIZE_M": 8,
        "num_stages": 6,
        "num_warps": 4,
        "ms": 0.7427124381065369,
        "min_ms": 0.7427124381065369,
        "max_ms": 0.7427124381065369,
        "compile_time": 1.2908473014831543
    },
    {
        "BLOCK_SIZE_M": 64,
        "BLOCK_SIZE_N": 256,
        "BLOCK_SIZE_K": 32,
        "GROUP_SIZE_M": 8,
        "num_stages": 8,
        "num_warps": 4,
        "ms": 0.7430745959281921,
        "min_ms": 0.7430745959281921,
        "max_ms": 0.7430745959281921,
        "compile_time": 2.7217674255371094
    },
    {
        "BLOCK_SIZE_M": 64,
        "BLOCK_SIZE_N": 512,
        "BLOCK_SIZE_K": 16,
        "GROUP_SIZE_M": 8,
        "num_stages": 4,
        "num_warps": 8,
        "ms": 0.7441315054893494,
        "min_ms": 0.7441315054893494,
        "max_ms": 0.7441315054893494,
        "compile_time": 2.1681840419769287
    },
    {
        "BLOCK_SIZE_M": 128,
        "BLOCK_SIZE_N": 128,
        "BLOCK_SIZE_K": 16,
        "GROUP_SIZE_M": 8,
        "num_stages": 5,
        "num_warps": 4,
        "ms": 0.7457975149154663,
        "min_ms": 0.7457975149154663,
        "max_ms": 0.7457975149154663,
        "compile_time": 1.3101763725280762
    },
    {
        "BLOCK_SIZE_M": 64,
        "BLOCK_SIZE_N": 512,
        "BLOCK_SIZE_K": 16,
        "GROUP_SIZE_M": 8,
        "num_stages": 5,
        "num_warps": 8,
        "ms": 0.746311366558075,
        "min_ms": 0.746311366558075,
        "max_ms": 0.746311366558075,
        "compile_time": 2.2039008140563965
    },
    {
        "BLOCK_SIZE_M": 128,
        "BLOCK_SIZE_N": 128,
        "BLOCK_SIZE_K": 16,
        "GROUP_SIZE_M": 8,
        "num_stages": 7,
        "num_warps": 4,
        "ms": 0.7465735673904419,
        "min_ms": 0.7465735673904419,
        "max_ms": 0.7465735673904419,
        "compile_time": 2.265970230102539
    },
    {
        "BLOCK_SIZE_M": 64,
        "BLOCK_SIZE_N": 512,
        "BLOCK_SIZE_K": 16,
        "GROUP_SIZE_M": 8,
        "num_stages": 6,
        "num_warps": 8,
        "ms": 0.7468279600143433,
        "min_ms": 0.7468279600143433,
        "max_ms": 0.7468279600143433,
        "compile_time": 2.234708547592163
    },
    {
        "BLOCK_SIZE_M": 128,
        "BLOCK_SIZE_N": 128,
        "BLOCK_SIZE_K": 16,
        "GROUP_SIZE_M": 8,
        "num_stages": 6,
        "num_warps": 4,
        "ms": 0.7471550703048706,
        "min_ms": 0.7471550703048706,
        "max_ms": 0.7471550703048706,
        "compile_time": 2.252674102783203
    },
    {
        "BLOCK_SIZE_M": 64,
        "BLOCK_SIZE_N": 512,
        "BLOCK_SIZE_K": 16,
        "GROUP_SIZE_M": 8,
        "num_stages": 7,
        "num_warps": 8,
        "ms": 0.7472624182701111,
        "min_ms": 0.7472624182701111,
        "max_ms": 0.7472624182701111,
        "compile_time": 2.249157190322876
    },
    {
        "BLOCK_SIZE_M": 256,
        "BLOCK_SIZE_N": 64,
        "BLOCK_SIZE_K": 32,
        "GROUP_SIZE_M": 8,
        "num_stages": 5,
        "num_warps": 8,
        "ms": 0.7476996183395386,
        "min_ms": 0.7476996183395386,
        "max_ms": 0.7476996183395386,
        "compile_time": 1.3768870830535889
    },
    {
        "BLOCK_SIZE_M": 128,
        "BLOCK_SIZE_N": 64,
        "BLOCK_SIZE_K": 32,
        "GROUP_SIZE_M": 8,
        "num_stages": 6,
        "num_warps": 2,
        "ms": 0.7479833960533142,
        "min_ms": 0.7479833960533142,
        "max_ms": 0.7479833960533142,
        "compile_time": 1.3262784481048584
    },
    {
        "BLOCK_SIZE_M": 128,
        "BLOCK_SIZE_N": 64,
        "BLOCK_SIZE_K": 32,
        "GROUP_SIZE_M": 8,
        "num_stages": 7,
        "num_warps": 2,
        "ms": 0.748137354850769,
        "min_ms": 0.748137354850769,
        "max_ms": 0.748137354850769,
        "compile_time": 1.33428955078125
    },
    {
        "BLOCK_SIZE_M": 256,
        "BLOCK_SIZE_N": 64,
        "BLOCK_SIZE_K": 32,
        "GROUP_SIZE_M": 8,
        "num_stages": 4,
        "num_warps": 8,
        "ms": 0.7487637400627136,
        "min_ms": 0.7487637400627136,
        "max_ms": 0.7487637400627136,
        "compile_time": 1.36639404296875
    },
    {
        "BLOCK_SIZE_M": 64,
        "BLOCK_SIZE_N": 512,
        "BLOCK_SIZE_K": 16,
        "GROUP_SIZE_M": 8,
        "num_stages": 8,
        "num_warps": 8,
        "ms": 0.7490776777267456,
        "min_ms": 0.7490776777267456,
        "max_ms": 0.7490776777267456,
        "compile_time": 2.263721227645874
    },
    {
        "BLOCK_SIZE_M": 256,
        "BLOCK_SIZE_N": 128,
        "BLOCK_SIZE_K": 64,
        "GROUP_SIZE_M": 8,
        "num_stages": 2,
        "num_warps": 8,
        "ms": 0.7494723796844482,
        "min_ms": 0.7494723796844482,
        "max_ms": 0.7494723796844482,
        "compile_time": 1.2703924179077148
    },
    {
        "BLOCK_SIZE_M": 128,
        "BLOCK_SIZE_N": 64,
        "BLOCK_SIZE_K": 64,
        "GROUP_SIZE_M": 8,
        "num_stages": 5,
        "num_warps": 4,
        "ms": 0.7501360774040222,
        "min_ms": 0.7501360774040222,
        "max_ms": 0.7501360774040222,
        "compile_time": 1.3282561302185059
    },
    {
        "BLOCK_SIZE_M": 256,
        "BLOCK_SIZE_N": 64,
        "BLOCK_SIZE_K": 32,
        "GROUP_SIZE_M": 8,
        "num_stages": 6,
        "num_warps": 8,
        "ms": 0.7506024241447449,
        "min_ms": 0.7506024241447449,
        "max_ms": 0.7506024241447449,
        "compile_time": 1.3701679706573486
    },
    {
        "BLOCK_SIZE_M": 256,
        "BLOCK_SIZE_N": 64,
        "BLOCK_SIZE_K": 32,
        "GROUP_SIZE_M": 8,
        "num_stages": 7,
        "num_warps": 8,
        "ms": 0.752415657043457,
        "min_ms": 0.752415657043457,
        "max_ms": 0.752415657043457,
        "compile_time": 1.367278814315796
    },
    {
        "BLOCK_SIZE_M": 256,
        "BLOCK_SIZE_N": 64,
        "BLOCK_SIZE_K": 32,
        "GROUP_SIZE_M": 8,
        "num_stages": 8,
        "num_warps": 8,
        "ms": 0.7540720701217651,
        "min_ms": 0.7540720701217651,
        "max_ms": 0.7540720701217651,
        "compile_time": 1.3698952198028564
    },
    {
        "BLOCK_SIZE_M": 128,
        "BLOCK_SIZE_N": 256,
        "BLOCK_SIZE_K": 16,
        "GROUP_SIZE_M": 8,
        "num_stages": 6,
        "num_warps": 8,
        "ms": 0.7542993426322937,
        "min_ms": 0.7542993426322937,
        "max_ms": 0.7542993426322937,
        "compile_time": 1.2745726108551025
    },
    {
        "BLOCK_SIZE_M": 128,
        "BLOCK_SIZE_N": 64,
        "BLOCK_SIZE_K": 64,
        "GROUP_SIZE_M": 8,
        "num_stages": 6,
        "num_warps": 4,
        "ms": 0.7548700571060181,
        "min_ms": 0.7548700571060181,
        "max_ms": 0.7548700571060181,
        "compile_time": 1.3218333721160889
    },
    {
        "BLOCK_SIZE_M": 128,
        "BLOCK_SIZE_N": 64,
        "BLOCK_SIZE_K": 64,
        "GROUP_SIZE_M": 8,
        "num_stages": 3,
        "num_warps": 8,
        "ms": 0.7557090520858765,
        "min_ms": 0.7557090520858765,
        "max_ms": 0.7557090520858765,
        "compile_time": 1.3399338722229004
    },
    {
        "BLOCK_SIZE_M": 128,
        "BLOCK_SIZE_N": 64,
        "BLOCK_SIZE_K": 64,
        "GROUP_SIZE_M": 8,
        "num_stages": 4,
        "num_warps": 8,
        "ms": 0.7567790150642395,
        "min_ms": 0.7567790150642395,
        "max_ms": 0.7567790150642395,
        "compile_time": 1.3483388423919678
    },
    {
        "BLOCK_SIZE_M": 128,
        "BLOCK_SIZE_N": 64,
        "BLOCK_SIZE_K": 128,
        "GROUP_SIZE_M": 8,
        "num_stages": 3,
        "num_warps": 4,
        "ms": 0.7574772834777832,
        "min_ms": 0.7574772834777832,
        "max_ms": 0.7574772834777832,
        "compile_time": 1.3201065063476562
    },
    {
        "BLOCK_SIZE_M": 128,
        "BLOCK_SIZE_N": 256,
        "BLOCK_SIZE_K": 16,
        "GROUP_SIZE_M": 8,
        "num_stages": 7,
        "num_warps": 8,
        "ms": 0.7575990557670593,
        "min_ms": 0.7575990557670593,
        "max_ms": 0.7575990557670593,
        "compile_time": 1.2741546630859375
    },
    {
        "BLOCK_SIZE_M": 128,
        "BLOCK_SIZE_N": 128,
        "BLOCK_SIZE_K": 32,
        "GROUP_SIZE_M": 8,
        "num_stages": 3,
        "num_warps": 8,
        "ms": 0.7578176259994507,
        "min_ms": 0.7578176259994507,
        "max_ms": 0.7578176259994507,
        "compile_time": 1.281682014465332
    },
    {
        "BLOCK_SIZE_M": 128,
        "BLOCK_SIZE_N": 64,
        "BLOCK_SIZE_K": 128,
        "GROUP_SIZE_M": 8,
        "num_stages": 4,
        "num_warps": 4,
        "ms": 0.758777916431427,
        "min_ms": 0.758777916431427,
        "max_ms": 0.758777916431427,
        "compile_time": 1.3184220790863037
    },
    {
        "BLOCK_SIZE_M": 256,
        "BLOCK_SIZE_N": 64,
        "BLOCK_SIZE_K": 128,
        "GROUP_SIZE_M": 8,
        "num_stages": 3,
        "num_warps": 16,
        "ms": 0.7590057253837585,
        "min_ms": 0.7590057253837585,
        "max_ms": 0.7590057253837585,
        "compile_time": 1.354367733001709
    },
    {
        "BLOCK_SIZE_M": 128,
        "BLOCK_SIZE_N": 256,
        "BLOCK_SIZE_K": 16,
        "GROUP_SIZE_M": 8,
        "num_stages": 8,
        "num_warps": 8,
        "ms": 0.760113537311554,
        "min_ms": 0.760113537311554,
        "max_ms": 0.760113537311554,
        "compile_time": 2.2658965587615967
    },
    {
        "BLOCK_SIZE_M": 64,
        "BLOCK_SIZE_N": 128,
        "BLOCK_SIZE_K": 64,
        "GROUP_SIZE_M": 8,
        "num_stages": 4,
        "num_warps": 8,
        "ms": 0.760392963886261,
        "min_ms": 0.760392963886261,
        "max_ms": 0.760392963886261,
        "compile_time": 1.3258628845214844
    },
    {
        "BLOCK_SIZE_M": 128,
        "BLOCK_SIZE_N": 128,
        "BLOCK_SIZE_K": 32,
        "GROUP_SIZE_M": 8,
        "num_stages": 2,
        "num_warps": 4,
        "ms": 0.7620965838432312,
        "min_ms": 0.7620965838432312,
        "max_ms": 0.7620965838432312,
        "compile_time": 1.2731595039367676
    },
    {
        "BLOCK_SIZE_M": 64,
        "BLOCK_SIZE_N": 128,
        "BLOCK_SIZE_K": 32,
        "GROUP_SIZE_M": 8,
        "num_stages": 8,
        "num_warps": 4,
        "ms": 0.7637912034988403,
        "min_ms": 0.7637912034988403,
        "max_ms": 0.7637912034988403,
        "compile_time": 1.3201847076416016
    },
    {
        "BLOCK_SIZE_M": 128,
        "BLOCK_SIZE_N": 128,
        "BLOCK_SIZE_K": 64,
        "GROUP_SIZE_M": 8,
        "num_stages": 3,
        "num_warps": 16,
        "ms": 0.7638173699378967,
        "min_ms": 0.7638173699378967,
        "max_ms": 0.7638173699378967,
        "compile_time": 1.3035998344421387
    },
    {
        "BLOCK_SIZE_M": 64,
        "BLOCK_SIZE_N": 128,
        "BLOCK_SIZE_K": 64,
        "GROUP_SIZE_M": 8,
        "num_stages": 3,
        "num_warps": 8,
        "ms": 0.7640702128410339,
        "min_ms": 0.7640702128410339,
        "max_ms": 0.7640702128410339,
        "compile_time": 1.32021164894104
    },
    {
        "BLOCK_SIZE_M": 128,
        "BLOCK_SIZE_N": 64,
        "BLOCK_SIZE_K": 32,
        "GROUP_SIZE_M": 8,
        "num_stages": 8,
        "num_warps": 4,
        "ms": 0.7645620703697205,
        "min_ms": 0.7645620703697205,
        "max_ms": 0.7645620703697205,
        "compile_time": 1.3379287719726562
    },
    {
        "BLOCK_SIZE_M": 64,
        "BLOCK_SIZE_N": 256,
        "BLOCK_SIZE_K": 128,
        "GROUP_SIZE_M": 8,
        "num_stages": 3,
        "num_warps": 16,
        "ms": 0.7646543979644775,
        "min_ms": 0.7646543979644775,
        "max_ms": 0.7646543979644775,
        "compile_time": 1.3010430335998535
    },
    {
        "BLOCK_SIZE_M": 128,
        "BLOCK_SIZE_N": 128,
        "BLOCK_SIZE_K": 64,
        "GROUP_SIZE_M": 8,
        "num_stages": 4,
        "num_warps": 16,
        "ms": 0.7649502754211426,
        "min_ms": 0.7649502754211426,
        "max_ms": 0.7649502754211426,
        "compile_time": 1.2998948097229004
    },
    {
        "BLOCK_SIZE_M": 128,
        "BLOCK_SIZE_N": 256,
        "BLOCK_SIZE_K": 32,
        "GROUP_SIZE_M": 8,
        "num_stages": 7,
        "num_warps": 16,
        "ms": 0.76518315076828,
        "min_ms": 0.76518315076828,
        "max_ms": 0.76518315076828,
        "compile_time": 1.2546391487121582
    },
    {
        "BLOCK_SIZE_M": 128,
        "BLOCK_SIZE_N": 256,
        "BLOCK_SIZE_K": 32,
        "GROUP_SIZE_M": 8,
        "num_stages": 3,
        "num_warps": 16,
        "ms": 0.7655705213546753,
        "min_ms": 0.7655705213546753,
        "max_ms": 0.7655705213546753,
        "compile_time": 1.2684133052825928
    },
    {
        "BLOCK_SIZE_M": 128,
        "BLOCK_SIZE_N": 256,
        "BLOCK_SIZE_K": 32,
        "GROUP_SIZE_M": 8,
        "num_stages": 4,
        "num_warps": 16,
        "ms": 0.7662883400917053,
        "min_ms": 0.7662883400917053,
        "max_ms": 0.7662883400917053,
        "compile_time": 1.2656960487365723
    },
    {
        "BLOCK_SIZE_M": 128,
        "BLOCK_SIZE_N": 128,
        "BLOCK_SIZE_K": 64,
        "GROUP_SIZE_M": 8,
        "num_stages": 5,
        "num_warps": 16,
        "ms": 0.7663646936416626,
        "min_ms": 0.7663646936416626,
        "max_ms": 0.7663646936416626,
        "compile_time": 1.3076801300048828
    },
    {
        "BLOCK_SIZE_M": 128,
        "BLOCK_SIZE_N": 64,
        "BLOCK_SIZE_K": 64,
        "GROUP_SIZE_M": 8,
        "num_stages": 2,
        "num_warps": 4,
        "ms": 0.7677332162857056,
        "min_ms": 0.7677332162857056,
        "max_ms": 0.7677332162857056,
        "compile_time": 1.3114275932312012
    },
    {
        "BLOCK_SIZE_M": 128,
        "BLOCK_SIZE_N": 256,
        "BLOCK_SIZE_K": 32,
        "GROUP_SIZE_M": 8,
        "num_stages": 6,
        "num_warps": 16,
        "ms": 0.7678951025009155,
        "min_ms": 0.7678951025009155,
        "max_ms": 0.7678951025009155,
        "compile_time": 1.2646172046661377
    },
    {
        "BLOCK_SIZE_M": 256,
        "BLOCK_SIZE_N": 64,
        "BLOCK_SIZE_K": 32,
        "GROUP_SIZE_M": 8,
        "num_stages": 2,
        "num_warps": 4,
        "ms": 0.7687135934829712,
        "min_ms": 0.7687135934829712,
        "max_ms": 0.7687135934829712,
        "compile_time": 1.3146474361419678
    },
    {
        "BLOCK_SIZE_M": 128,
        "BLOCK_SIZE_N": 256,
        "BLOCK_SIZE_K": 32,
        "GROUP_SIZE_M": 8,
        "num_stages": 5,
        "num_warps": 16,
        "ms": 0.7687200903892517,
        "min_ms": 0.7687200903892517,
        "max_ms": 0.7687200903892517,
        "compile_time": 1.2733392715454102
    },
    {
        "BLOCK_SIZE_M": 64,
        "BLOCK_SIZE_N": 128,
        "BLOCK_SIZE_K": 128,
        "GROUP_SIZE_M": 8,
        "num_stages": 4,
        "num_warps": 4,
        "ms": 0.7687733769416809,
        "min_ms": 0.7687733769416809,
        "max_ms": 0.7687733769416809,
        "compile_time": 1.2994146347045898
    },
    {
        "BLOCK_SIZE_M": 128,
        "BLOCK_SIZE_N": 128,
        "BLOCK_SIZE_K": 64,
        "GROUP_SIZE_M": 8,
        "num_stages": 6,
        "num_warps": 16,
        "ms": 0.7734287977218628,
        "min_ms": 0.7734287977218628,
        "max_ms": 0.7734287977218628,
        "compile_time": 1.3171446323394775
    },
    {
        "BLOCK_SIZE_M": 64,
        "BLOCK_SIZE_N": 128,
        "BLOCK_SIZE_K": 128,
        "GROUP_SIZE_M": 8,
        "num_stages": 3,
        "num_warps": 4,
        "ms": 0.7745751738548279,
        "min_ms": 0.7745751738548279,
        "max_ms": 0.7745751738548279,
        "compile_time": 1.294557809829712
    },
    {
        "BLOCK_SIZE_M": 128,
        "BLOCK_SIZE_N": 64,
        "BLOCK_SIZE_K": 128,
        "GROUP_SIZE_M": 8,
        "num_stages": 3,
        "num_warps": 8,
        "ms": 0.7754666209220886,
        "min_ms": 0.7754666209220886,
        "max_ms": 0.7754666209220886,
        "compile_time": 1.314981460571289
    },
    {
        "BLOCK_SIZE_M": 64,
        "BLOCK_SIZE_N": 128,
        "BLOCK_SIZE_K": 16,
        "GROUP_SIZE_M": 8,
        "num_stages": 4,
        "num_warps": 2,
        "ms": 0.7786604166030884,
        "min_ms": 0.7786604166030884,
        "max_ms": 0.7786604166030884,
        "compile_time": 2.1952340602874756
    },
    {
        "BLOCK_SIZE_M": 64,
        "BLOCK_SIZE_N": 256,
        "BLOCK_SIZE_K": 32,
        "GROUP_SIZE_M": 8,
        "num_stages": 3,
        "num_warps": 8,
        "ms": 0.7799580693244934,
        "min_ms": 0.7799580693244934,
        "max_ms": 0.7799580693244934,
        "compile_time": 1.2700977325439453
    },
    {
        "BLOCK_SIZE_M": 256,
        "BLOCK_SIZE_N": 128,
        "BLOCK_SIZE_K": 32,
        "GROUP_SIZE_M": 8,
        "num_stages": 4,
        "num_warps": 16,
        "ms": 0.7803165316581726,
        "min_ms": 0.7803165316581726,
        "max_ms": 0.7803165316581726,
        "compile_time": 1.302168607711792
    },
    {
        "BLOCK_SIZE_M": 128,
        "BLOCK_SIZE_N": 256,
        "BLOCK_SIZE_K": 16,
        "GROUP_SIZE_M": 8,
        "num_stages": 5,
        "num_warps": 8,
        "ms": 0.780335009098053,
        "min_ms": 0.780335009098053,
        "max_ms": 0.780335009098053,
        "compile_time": 1.268465518951416
    },
    {
        "BLOCK_SIZE_M": 128,
        "BLOCK_SIZE_N": 64,
        "BLOCK_SIZE_K": 128,
        "GROUP_SIZE_M": 8,
        "num_stages": 4,
        "num_warps": 8,
        "ms": 0.7806557416915894,
        "min_ms": 0.7806557416915894,
        "max_ms": 0.7806557416915894,
        "compile_time": 1.3302514553070068
    },
    {
        "BLOCK_SIZE_M": 64,
        "BLOCK_SIZE_N": 128,
        "BLOCK_SIZE_K": 16,
        "GROUP_SIZE_M": 8,
        "num_stages": 6,
        "num_warps": 2,
        "ms": 0.7807761430740356,
        "min_ms": 0.7807761430740356,
        "max_ms": 0.7807761430740356,
        "compile_time": 2.2665462493896484
    },
    {
        "BLOCK_SIZE_M": 64,
        "BLOCK_SIZE_N": 128,
        "BLOCK_SIZE_K": 16,
        "GROUP_SIZE_M": 8,
        "num_stages": 7,
        "num_warps": 2,
        "ms": 0.7808085680007935,
        "min_ms": 0.7808085680007935,
        "max_ms": 0.7808085680007935,
        "compile_time": 2.265857696533203
    },
    {
        "BLOCK_SIZE_M": 64,
        "BLOCK_SIZE_N": 128,
        "BLOCK_SIZE_K": 64,
        "GROUP_SIZE_M": 8,
        "num_stages": 2,
        "num_warps": 2,
        "ms": 0.7812579870223999,
        "min_ms": 0.7812579870223999,
        "max_ms": 0.7812579870223999,
        "compile_time": 1.2954463958740234
    },
    {
        "BLOCK_SIZE_M": 128,
        "BLOCK_SIZE_N": 256,
        "BLOCK_SIZE_K": 16,
        "GROUP_SIZE_M": 8,
        "num_stages": 4,
        "num_warps": 8,
        "ms": 0.7813422679901123,
        "min_ms": 0.7813422679901123,
        "max_ms": 0.7813422679901123,
        "compile_time": 1.272409439086914
    },
    {
        "BLOCK_SIZE_M": 256,
        "BLOCK_SIZE_N": 128,
        "BLOCK_SIZE_K": 32,
        "GROUP_SIZE_M": 8,
        "num_stages": 3,
        "num_warps": 16,
        "ms": 0.7813438177108765,
        "min_ms": 0.7813438177108765,
        "max_ms": 0.7813438177108765,
        "compile_time": 1.3042576313018799
    },
    {
        "BLOCK_SIZE_M": 256,
        "BLOCK_SIZE_N": 128,
        "BLOCK_SIZE_K": 32,
        "GROUP_SIZE_M": 8,
        "num_stages": 6,
        "num_warps": 16,
        "ms": 0.7831125259399414,
        "min_ms": 0.7831125259399414,
        "max_ms": 0.7831125259399414,
        "compile_time": 1.2928135395050049
    },
    {
        "BLOCK_SIZE_M": 64,
        "BLOCK_SIZE_N": 256,
        "BLOCK_SIZE_K": 32,
        "GROUP_SIZE_M": 8,
        "num_stages": 2,
        "num_warps": 4,
        "ms": 0.7833783030509949,
        "min_ms": 0.7833783030509949,
        "max_ms": 0.7833783030509949,
        "compile_time": 1.2484965324401855
    },
    {
        "BLOCK_SIZE_M": 256,
        "BLOCK_SIZE_N": 128,
        "BLOCK_SIZE_K": 32,
        "GROUP_SIZE_M": 8,
        "num_stages": 5,
        "num_warps": 16,
        "ms": 0.7837086915969849,
        "min_ms": 0.7837086915969849,
        "max_ms": 0.7837086915969849,
        "compile_time": 1.3188567161560059
    },
    {
        "BLOCK_SIZE_M": 64,
        "BLOCK_SIZE_N": 128,
        "BLOCK_SIZE_K": 16,
        "GROUP_SIZE_M": 8,
        "num_stages": 5,
        "num_warps": 2,
        "ms": 0.784265398979187,
        "min_ms": 0.784265398979187,
        "max_ms": 0.784265398979187,
        "compile_time": 1.3153269290924072
    },
    {
        "BLOCK_SIZE_M": 64,
        "BLOCK_SIZE_N": 128,
        "BLOCK_SIZE_K": 128,
        "GROUP_SIZE_M": 8,
        "num_stages": 4,
        "num_warps": 8,
        "ms": 0.7848156690597534,
        "min_ms": 0.7848156690597534,
        "max_ms": 0.7848156690597534,
        "compile_time": 1.2918145656585693
    },
    {
        "BLOCK_SIZE_M": 64,
        "BLOCK_SIZE_N": 128,
        "BLOCK_SIZE_K": 128,
        "GROUP_SIZE_M": 8,
        "num_stages": 2,
        "num_warps": 4,
        "ms": 0.7851031422615051,
        "min_ms": 0.7851031422615051,
        "max_ms": 0.7851031422615051,
        "compile_time": 1.2828731536865234
    },
    {
        "BLOCK_SIZE_M": 64,
        "BLOCK_SIZE_N": 128,
        "BLOCK_SIZE_K": 128,
        "GROUP_SIZE_M": 8,
        "num_stages": 3,
        "num_warps": 8,
        "ms": 0.7853459119796753,
        "min_ms": 0.7853459119796753,
        "max_ms": 0.7853459119796753,
        "compile_time": 1.3085646629333496
    },
    {
        "BLOCK_SIZE_M": 128,
        "BLOCK_SIZE_N": 64,
        "BLOCK_SIZE_K": 32,
        "GROUP_SIZE_M": 8,
        "num_stages": 2,
        "num_warps": 2,
        "ms": 0.7857837080955505,
        "min_ms": 0.7857837080955505,
        "max_ms": 0.7857837080955505,
        "compile_time": 1.2983183860778809
    },
    {
        "BLOCK_SIZE_M": 64,
        "BLOCK_SIZE_N": 128,
        "BLOCK_SIZE_K": 16,
        "GROUP_SIZE_M": 8,
        "num_stages": 3,
        "num_warps": 2,
        "ms": 0.7871327996253967,
        "min_ms": 0.7871327996253967,
        "max_ms": 0.7871327996253967,
        "compile_time": 2.1593494415283203
    },
    {
        "BLOCK_SIZE_M": 128,
        "BLOCK_SIZE_N": 128,
        "BLOCK_SIZE_K": 16,
        "GROUP_SIZE_M": 8,
        "num_stages": 3,
        "num_warps": 4,
        "ms": 0.7877141237258911,
        "min_ms": 0.7877141237258911,
        "max_ms": 0.7877141237258911,
        "compile_time": 2.1818456649780273
    },
    {
        "BLOCK_SIZE_M": 256,
        "BLOCK_SIZE_N": 128,
        "BLOCK_SIZE_K": 32,
        "GROUP_SIZE_M": 8,
        "num_stages": 7,
        "num_warps": 16,
        "ms": 0.7879806756973267,
        "min_ms": 0.7879806756973267,
        "max_ms": 0.7879806756973267,
        "compile_time": 1.300018072128296
    },
    {
        "BLOCK_SIZE_M": 64,
        "BLOCK_SIZE_N": 512,
        "BLOCK_SIZE_K": 16,
        "GROUP_SIZE_M": 8,
        "num_stages": 3,
        "num_warps": 8,
        "ms": 0.7911407351493835,
        "min_ms": 0.7911407351493835,
        "max_ms": 0.7911407351493835,
        "compile_time": 2.1537530422210693
    },
    {
        "BLOCK_SIZE_M": 128,
        "BLOCK_SIZE_N": 64,
        "BLOCK_SIZE_K": 64,
        "GROUP_SIZE_M": 8,
        "num_stages": 5,
        "num_warps": 8,
        "ms": 0.7946304082870483,
        "min_ms": 0.7946304082870483,
        "max_ms": 0.7946304082870483,
        "compile_time": 1.3155276775360107
    },
    {
        "BLOCK_SIZE_M": 128,
        "BLOCK_SIZE_N": 64,
        "BLOCK_SIZE_K": 128,
        "GROUP_SIZE_M": 8,
        "num_stages": 2,
        "num_warps": 4,
        "ms": 0.7953587174415588,
        "min_ms": 0.7953587174415588,
        "max_ms": 0.7953587174415588,
        "compile_time": 1.320033073425293
    },
    {
        "BLOCK_SIZE_M": 256,
        "BLOCK_SIZE_N": 64,
        "BLOCK_SIZE_K": 64,
        "GROUP_SIZE_M": 8,
        "num_stages": 4,
        "num_warps": 16,
        "ms": 0.7958028316497803,
        "min_ms": 0.7958028316497803,
        "max_ms": 0.7958028316497803,
        "compile_time": 1.3550515174865723
    },
    {
        "BLOCK_SIZE_M": 128,
        "BLOCK_SIZE_N": 64,
        "BLOCK_SIZE_K": 64,
        "GROUP_SIZE_M": 8,
        "num_stages": 7,
        "num_warps": 8,
        "ms": 0.7972880601882935,
        "min_ms": 0.7972880601882935,
        "max_ms": 0.7972880601882935,
        "compile_time": 1.3249142169952393
    },
    {
        "BLOCK_SIZE_M": 256,
        "BLOCK_SIZE_N": 128,
        "BLOCK_SIZE_K": 64,
        "GROUP_SIZE_M": 8,
        "num_stages": 3,
        "num_warps": 16,
        "ms": 0.7978957295417786,
        "min_ms": 0.7978957295417786,
        "max_ms": 0.7978957295417786,
        "compile_time": 1.3046026229858398
    },
    {
        "BLOCK_SIZE_M": 256,
        "BLOCK_SIZE_N": 128,
        "BLOCK_SIZE_K": 64,
        "GROUP_SIZE_M": 8,
        "num_stages": 4,
        "num_warps": 16,
        "ms": 0.798260509967804,
        "min_ms": 0.798260509967804,
        "max_ms": 0.798260509967804,
        "compile_time": 1.3030803203582764
    },
    {
        "BLOCK_SIZE_M": 128,
        "BLOCK_SIZE_N": 64,
        "BLOCK_SIZE_K": 64,
        "GROUP_SIZE_M": 8,
        "num_stages": 2,
        "num_warps": 2,
        "ms": 0.7983152866363525,
        "min_ms": 0.7983152866363525,
        "max_ms": 0.7983152866363525,
        "compile_time": 1.2941336631774902
    },
    {
        "BLOCK_SIZE_M": 128,
        "BLOCK_SIZE_N": 64,
        "BLOCK_SIZE_K": 64,
        "GROUP_SIZE_M": 8,
        "num_stages": 6,
        "num_warps": 8,
        "ms": 0.7993054389953613,
        "min_ms": 0.7993054389953613,
        "max_ms": 0.7993054389953613,
        "compile_time": 1.3128163814544678
    },
    {
        "BLOCK_SIZE_M": 64,
        "BLOCK_SIZE_N": 128,
        "BLOCK_SIZE_K": 64,
        "GROUP_SIZE_M": 8,
        "num_stages": 5,
        "num_warps": 8,
        "ms": 0.7994201183319092,
        "min_ms": 0.7994201183319092,
        "max_ms": 0.7994201183319092,
        "compile_time": 1.2963945865631104
    },
    {
        "BLOCK_SIZE_M": 64,
        "BLOCK_SIZE_N": 128,
        "BLOCK_SIZE_K": 64,
        "GROUP_SIZE_M": 8,
        "num_stages": 6,
        "num_warps": 8,
        "ms": 0.7999759912490845,
        "min_ms": 0.7999759912490845,
        "max_ms": 0.7999759912490845,
        "compile_time": 1.2877764701843262
    },
    {
        "BLOCK_SIZE_M": 64,
        "BLOCK_SIZE_N": 128,
        "BLOCK_SIZE_K": 32,
        "GROUP_SIZE_M": 8,
        "num_stages": 7,
        "num_warps": 2,
        "ms": 0.8000068664550781,
        "min_ms": 0.8000068664550781,
        "max_ms": 0.8000068664550781,
        "compile_time": 1.2829267978668213
    },
    {
        "BLOCK_SIZE_M": 256,
        "BLOCK_SIZE_N": 64,
        "BLOCK_SIZE_K": 64,
        "GROUP_SIZE_M": 8,
        "num_stages": 3,
        "num_warps": 16,
        "ms": 0.8036662936210632,
        "min_ms": 0.8036662936210632,
        "max_ms": 0.8036662936210632,
        "compile_time": 1.3604841232299805
    },
    {
        "BLOCK_SIZE_M": 64,
        "BLOCK_SIZE_N": 128,
        "BLOCK_SIZE_K": 32,
        "GROUP_SIZE_M": 8,
        "num_stages": 6,
        "num_warps": 2,
        "ms": 0.8057710528373718,
        "min_ms": 0.8057710528373718,
        "max_ms": 0.8057710528373718,
        "compile_time": 1.2455618381500244
    },
    {
        "BLOCK_SIZE_M": 64,
        "BLOCK_SIZE_N": 128,
        "BLOCK_SIZE_K": 64,
        "GROUP_SIZE_M": 8,
        "num_stages": 7,
        "num_warps": 8,
        "ms": 0.8061863780021667,
        "min_ms": 0.8061863780021667,
        "max_ms": 0.8061863780021667,
        "compile_time": 1.2884573936462402
    },
    {
        "BLOCK_SIZE_M": 64,
        "BLOCK_SIZE_N": 256,
        "BLOCK_SIZE_K": 64,
        "GROUP_SIZE_M": 8,
        "num_stages": 3,
        "num_warps": 16,
        "ms": 0.8072199821472168,
        "min_ms": 0.8072199821472168,
        "max_ms": 0.8072199821472168,
        "compile_time": 1.288774013519287
    },
    {
        "BLOCK_SIZE_M": 128,
        "BLOCK_SIZE_N": 256,
        "BLOCK_SIZE_K": 16,
        "GROUP_SIZE_M": 8,
        "num_stages": 3,
        "num_warps": 8,
        "ms": 0.8084056973457336,
        "min_ms": 0.8084056973457336,
        "max_ms": 0.8084056973457336,
        "compile_time": 1.261216402053833
    },
    {
        "BLOCK_SIZE_M": 64,
        "BLOCK_SIZE_N": 128,
        "BLOCK_SIZE_K": 16,
        "GROUP_SIZE_M": 8,
        "num_stages": 7,
        "num_warps": 4,
        "ms": 0.8112616539001465,
        "min_ms": 0.8112616539001465,
        "max_ms": 0.8112616539001465,
        "compile_time": 1.316502571105957
    },
    {
        "BLOCK_SIZE_M": 256,
        "BLOCK_SIZE_N": 64,
        "BLOCK_SIZE_K": 64,
        "GROUP_SIZE_M": 8,
        "num_stages": 5,
        "num_warps": 16,
        "ms": 0.8114026784896851,
        "min_ms": 0.8114026784896851,
        "max_ms": 0.8114026784896851,
        "compile_time": 1.347738265991211
    },
    {
        "BLOCK_SIZE_M": 64,
        "BLOCK_SIZE_N": 256,
        "BLOCK_SIZE_K": 64,
        "GROUP_SIZE_M": 8,
        "num_stages": 4,
        "num_warps": 4,
        "ms": 0.8119514584541321,
        "min_ms": 0.8119514584541321,
        "max_ms": 0.8119514584541321,
        "compile_time": 1.2687442302703857
    },
    {
        "BLOCK_SIZE_M": 64,
        "BLOCK_SIZE_N": 256,
        "BLOCK_SIZE_K": 64,
        "GROUP_SIZE_M": 8,
        "num_stages": 4,
        "num_warps": 16,
        "ms": 0.8121095895767212,
        "min_ms": 0.8121095895767212,
        "max_ms": 0.8121095895767212,
        "compile_time": 1.2839207649230957
    },
    {
        "BLOCK_SIZE_M": 128,
        "BLOCK_SIZE_N": 64,
        "BLOCK_SIZE_K": 128,
        "GROUP_SIZE_M": 8,
        "num_stages": 2,
        "num_warps": 8,
        "ms": 0.8125548362731934,
        "min_ms": 0.8125548362731934,
        "max_ms": 0.8125548362731934,
        "compile_time": 1.30149507522583
    },
    {
        "BLOCK_SIZE_M": 128,
        "BLOCK_SIZE_N": 64,
        "BLOCK_SIZE_K": 32,
        "GROUP_SIZE_M": 8,
        "num_stages": 5,
        "num_warps": 8,
        "ms": 0.812735915184021,
        "min_ms": 0.812735915184021,
        "max_ms": 0.812735915184021,
        "compile_time": 1.3388214111328125
    },
    {
        "BLOCK_SIZE_M": 64,
        "BLOCK_SIZE_N": 256,
        "BLOCK_SIZE_K": 64,
        "GROUP_SIZE_M": 8,
        "num_stages": 5,
        "num_warps": 16,
        "ms": 0.8145928382873535,
        "min_ms": 0.8145928382873535,
        "max_ms": 0.8145928382873535,
        "compile_time": 1.2932898998260498
    },
    {
        "BLOCK_SIZE_M": 64,
        "BLOCK_SIZE_N": 256,
        "BLOCK_SIZE_K": 64,
        "GROUP_SIZE_M": 8,
        "num_stages": 5,
        "num_warps": 4,
        "ms": 0.8154069781303406,
        "min_ms": 0.8154069781303406,
        "max_ms": 0.8154069781303406,
        "compile_time": 1.2668092250823975
    },
    {
        "BLOCK_SIZE_M": 64,
        "BLOCK_SIZE_N": 128,
        "BLOCK_SIZE_K": 16,
        "GROUP_SIZE_M": 8,
        "num_stages": 6,
        "num_warps": 4,
        "ms": 0.8157087564468384,
        "min_ms": 0.8157087564468384,
        "max_ms": 0.8157087564468384,
        "compile_time": 1.3040237426757812
    },
    {
        "BLOCK_SIZE_M": 64,
        "BLOCK_SIZE_N": 128,
        "BLOCK_SIZE_K": 32,
        "GROUP_SIZE_M": 8,
        "num_stages": 4,
        "num_warps": 8,
        "ms": 0.8158336877822876,
        "min_ms": 0.8158336877822876,
        "max_ms": 0.8158336877822876,
        "compile_time": 1.310788869857788
    },
    {
        "BLOCK_SIZE_M": 128,
        "BLOCK_SIZE_N": 64,
        "BLOCK_SIZE_K": 32,
        "GROUP_SIZE_M": 8,
        "num_stages": 4,
        "num_warps": 8,
        "ms": 0.8159040212631226,
        "min_ms": 0.8159040212631226,
        "max_ms": 0.8159040212631226,
        "compile_time": 1.3472669124603271
    },
    {
        "BLOCK_SIZE_M": 64,
        "BLOCK_SIZE_N": 128,
        "BLOCK_SIZE_K": 64,
        "GROUP_SIZE_M": 8,
        "num_stages": 3,
        "num_warps": 2,
        "ms": 0.8161114454269409,
        "min_ms": 0.8161114454269409,
        "max_ms": 0.8161114454269409,
        "compile_time": 1.2805726528167725
    },
    {
        "BLOCK_SIZE_M": 64,
        "BLOCK_SIZE_N": 128,
        "BLOCK_SIZE_K": 128,
        "GROUP_SIZE_M": 8,
        "num_stages": 2,
        "num_warps": 8,
        "ms": 0.8167077302932739,
        "min_ms": 0.8167077302932739,
        "max_ms": 0.8167077302932739,
        "compile_time": 1.2808103561401367
    },
    {
        "BLOCK_SIZE_M": 64,
        "BLOCK_SIZE_N": 128,
        "BLOCK_SIZE_K": 32,
        "GROUP_SIZE_M": 8,
        "num_stages": 5,
        "num_warps": 8,
        "ms": 0.8173872232437134,
        "min_ms": 0.8173872232437134,
        "max_ms": 0.8173872232437134,
        "compile_time": 1.3128960132598877
    },
    {
        "BLOCK_SIZE_M": 128,
        "BLOCK_SIZE_N": 64,
        "BLOCK_SIZE_K": 32,
        "GROUP_SIZE_M": 8,
        "num_stages": 6,
        "num_warps": 8,
        "ms": 0.8177404403686523,
        "min_ms": 0.8177404403686523,
        "max_ms": 0.8177404403686523,
        "compile_time": 1.329925298690796
    },
    {
        "BLOCK_SIZE_M": 64,
        "BLOCK_SIZE_N": 128,
        "BLOCK_SIZE_K": 32,
        "GROUP_SIZE_M": 8,
        "num_stages": 6,
        "num_warps": 8,
        "ms": 0.8198256492614746,
        "min_ms": 0.8198256492614746,
        "max_ms": 0.8198256492614746,
        "compile_time": 1.305281162261963
    },
    {
        "BLOCK_SIZE_M": 128,
        "BLOCK_SIZE_N": 256,
        "BLOCK_SIZE_K": 64,
        "GROUP_SIZE_M": 8,
        "num_stages": 3,
        "num_warps": 16,
        "ms": 0.8199175596237183,
        "min_ms": 0.8199175596237183,
        "max_ms": 0.8199175596237183,
        "compile_time": 1.3063397407531738
    },
    {
        "BLOCK_SIZE_M": 256,
        "BLOCK_SIZE_N": 64,
        "BLOCK_SIZE_K": 32,
        "GROUP_SIZE_M": 8,
        "num_stages": 3,
        "num_warps": 8,
        "ms": 0.8203065991401672,
        "min_ms": 0.8203065991401672,
        "max_ms": 0.8203065991401672,
        "compile_time": 1.3272416591644287
    },
    {
        "BLOCK_SIZE_M": 64,
        "BLOCK_SIZE_N": 128,
        "BLOCK_SIZE_K": 16,
        "GROUP_SIZE_M": 8,
        "num_stages": 4,
        "num_warps": 4,
        "ms": 0.8203670382499695,
        "min_ms": 0.8203670382499695,
        "max_ms": 0.8203670382499695,
        "compile_time": 1.3063769340515137
    },
    {
        "BLOCK_SIZE_M": 128,
        "BLOCK_SIZE_N": 64,
        "BLOCK_SIZE_K": 32,
        "GROUP_SIZE_M": 8,
        "num_stages": 7,
        "num_warps": 8,
        "ms": 0.8209196925163269,
        "min_ms": 0.8209196925163269,
        "max_ms": 0.8209196925163269,
        "compile_time": 1.3345060348510742
    },
    {
        "BLOCK_SIZE_M": 128,
        "BLOCK_SIZE_N": 64,
        "BLOCK_SIZE_K": 32,
        "GROUP_SIZE_M": 8,
        "num_stages": 3,
        "num_warps": 8,
        "ms": 0.8216625452041626,
        "min_ms": 0.8216625452041626,
        "max_ms": 0.8216625452041626,
        "compile_time": 1.3274950981140137
    },
    {
        "BLOCK_SIZE_M": 128,
        "BLOCK_SIZE_N": 256,
        "BLOCK_SIZE_K": 64,
        "GROUP_SIZE_M": 8,
        "num_stages": 4,
        "num_warps": 16,
        "ms": 0.8227728009223938,
        "min_ms": 0.8227728009223938,
        "max_ms": 0.8227728009223938,
        "compile_time": 1.2965381145477295
    },
    {
        "BLOCK_SIZE_M": 128,
        "BLOCK_SIZE_N": 128,
        "BLOCK_SIZE_K": 16,
        "GROUP_SIZE_M": 8,
        "num_stages": 8,
        "num_warps": 8,
        "ms": 0.8245366215705872,
        "min_ms": 0.8245366215705872,
        "max_ms": 0.8245366215705872,
        "compile_time": 1.933152198791504
    },
    {
        "BLOCK_SIZE_M": 64,
        "BLOCK_SIZE_N": 128,
        "BLOCK_SIZE_K": 32,
        "GROUP_SIZE_M": 8,
        "num_stages": 2,
        "num_warps": 2,
        "ms": 0.825776219367981,
        "min_ms": 0.825776219367981,
        "max_ms": 0.825776219367981,
        "compile_time": 1.2423853874206543
    },
    {
        "BLOCK_SIZE_M": 64,
        "BLOCK_SIZE_N": 128,
        "BLOCK_SIZE_K": 16,
        "GROUP_SIZE_M": 8,
        "num_stages": 5,
        "num_warps": 4,
        "ms": 0.8260542750358582,
        "min_ms": 0.8260542750358582,
        "max_ms": 0.8260542750358582,
        "compile_time": 1.3084063529968262
    },
    {
        "BLOCK_SIZE_M": 256,
        "BLOCK_SIZE_N": 128,
        "BLOCK_SIZE_K": 16,
        "GROUP_SIZE_M": 8,
        "num_stages": 6,
        "num_warps": 8,
        "ms": 0.8269429206848145,
        "min_ms": 0.8269429206848145,
        "max_ms": 0.8269429206848145,
        "compile_time": 2.274991035461426
    },
    {
        "BLOCK_SIZE_M": 64,
        "BLOCK_SIZE_N": 128,
        "BLOCK_SIZE_K": 32,
        "GROUP_SIZE_M": 8,
        "num_stages": 7,
        "num_warps": 8,
        "ms": 0.8272164463996887,
        "min_ms": 0.8272164463996887,
        "max_ms": 0.8272164463996887,
        "compile_time": 1.302079439163208
    },
    {
        "BLOCK_SIZE_M": 256,
        "BLOCK_SIZE_N": 128,
        "BLOCK_SIZE_K": 16,
        "GROUP_SIZE_M": 8,
        "num_stages": 7,
        "num_warps": 8,
        "ms": 0.8274405598640442,
        "min_ms": 0.8274405598640442,
        "max_ms": 0.8274405598640442,
        "compile_time": 2.281920909881592
    },
    {
        "BLOCK_SIZE_M": 64,
        "BLOCK_SIZE_N": 128,
        "BLOCK_SIZE_K": 32,
        "GROUP_SIZE_M": 8,
        "num_stages": 3,
        "num_warps": 8,
        "ms": 0.8284193277359009,
        "min_ms": 0.8284193277359009,
        "max_ms": 0.8284193277359009,
        "compile_time": 1.2845160961151123
    },
    {
        "BLOCK_SIZE_M": 256,
        "BLOCK_SIZE_N": 128,
        "BLOCK_SIZE_K": 16,
        "GROUP_SIZE_M": 8,
        "num_stages": 8,
        "num_warps": 8,
        "ms": 0.8286675214767456,
        "min_ms": 0.8286675214767456,
        "max_ms": 0.8286675214767456,
        "compile_time": 2.294102907180786
    },
    {
        "BLOCK_SIZE_M": 64,
        "BLOCK_SIZE_N": 128,
        "BLOCK_SIZE_K": 16,
        "GROUP_SIZE_M": 8,
        "num_stages": 3,
        "num_warps": 4,
        "ms": 0.8322781324386597,
        "min_ms": 0.8322781324386597,
        "max_ms": 0.8322781324386597,
        "compile_time": 1.281951904296875
    },
    {
        "BLOCK_SIZE_M": 64,
        "BLOCK_SIZE_N": 128,
        "BLOCK_SIZE_K": 16,
        "GROUP_SIZE_M": 8,
        "num_stages": 8,
        "num_warps": 2,
        "ms": 0.8356026411056519,
        "min_ms": 0.8356026411056519,
        "max_ms": 0.8356026411056519,
        "compile_time": 2.290692090988159
    },
    {
        "BLOCK_SIZE_M": 64,
        "BLOCK_SIZE_N": 128,
        "BLOCK_SIZE_K": 16,
        "GROUP_SIZE_M": 8,
        "num_stages": 8,
        "num_warps": 4,
        "ms": 0.8360149264335632,
        "min_ms": 0.8360149264335632,
        "max_ms": 0.8360149264335632,
        "compile_time": 1.3089916706085205
    },
    {
        "BLOCK_SIZE_M": 128,
        "BLOCK_SIZE_N": 128,
        "BLOCK_SIZE_K": 16,
        "GROUP_SIZE_M": 8,
        "num_stages": 4,
        "num_warps": 8,
        "ms": 0.8373439908027649,
        "min_ms": 0.8373439908027649,
        "max_ms": 0.8373439908027649,
        "compile_time": 1.3006138801574707
    },
    {
        "BLOCK_SIZE_M": 128,
        "BLOCK_SIZE_N": 128,
        "BLOCK_SIZE_K": 16,
        "GROUP_SIZE_M": 8,
        "num_stages": 5,
        "num_warps": 8,
        "ms": 0.8379062414169312,
        "min_ms": 0.8379062414169312,
        "max_ms": 0.8379062414169312,
        "compile_time": 1.3056564331054688
    },
    {
        "BLOCK_SIZE_M": 128,
        "BLOCK_SIZE_N": 128,
        "BLOCK_SIZE_K": 16,
        "GROUP_SIZE_M": 8,
        "num_stages": 7,
        "num_warps": 8,
        "ms": 0.838184654712677,
        "min_ms": 0.838184654712677,
        "max_ms": 0.838184654712677,
        "compile_time": 1.2848289012908936
    },
    {
        "BLOCK_SIZE_M": 128,
        "BLOCK_SIZE_N": 128,
        "BLOCK_SIZE_K": 16,
        "GROUP_SIZE_M": 8,
        "num_stages": 6,
        "num_warps": 8,
        "ms": 0.8388940691947937,
        "min_ms": 0.8388940691947937,
        "max_ms": 0.8388940691947937,
        "compile_time": 1.294201135635376
    },
    {
        "BLOCK_SIZE_M": 128,
        "BLOCK_SIZE_N": 128,
        "BLOCK_SIZE_K": 16,
        "GROUP_SIZE_M": 8,
        "num_stages": 3,
        "num_warps": 8,
        "ms": 0.843530535697937,
        "min_ms": 0.843530535697937,
        "max_ms": 0.843530535697937,
        "compile_time": 1.2872374057769775
    },
    {
        "BLOCK_SIZE_M": 256,
        "BLOCK_SIZE_N": 64,
        "BLOCK_SIZE_K": 64,
        "GROUP_SIZE_M": 8,
        "num_stages": 1,
        "num_warps": 4,
        "ms": 0.850577175617218,
        "min_ms": 0.850577175617218,
        "max_ms": 0.850577175617218,
        "compile_time": 1.3215830326080322
    },
    {
        "BLOCK_SIZE_M": 256,
        "BLOCK_SIZE_N": 128,
        "BLOCK_SIZE_K": 32,
        "GROUP_SIZE_M": 8,
        "num_stages": 2,
        "num_warps": 8,
        "ms": 0.8561175465583801,
        "min_ms": 0.8561175465583801,
        "max_ms": 0.8561175465583801,
        "compile_time": 1.302365779876709
    },
    {
        "BLOCK_SIZE_M": 128,
        "BLOCK_SIZE_N": 128,
        "BLOCK_SIZE_K": 32,
        "GROUP_SIZE_M": 8,
        "num_stages": 5,
        "num_warps": 16,
        "ms": 0.8569973707199097,
        "min_ms": 0.8569973707199097,
        "max_ms": 0.8569973707199097,
        "compile_time": 1.279191017150879
    },
    {
        "BLOCK_SIZE_M": 256,
        "BLOCK_SIZE_N": 128,
        "BLOCK_SIZE_K": 16,
        "GROUP_SIZE_M": 8,
        "num_stages": 4,
        "num_warps": 8,
        "ms": 0.8577433824539185,
        "min_ms": 0.8577433824539185,
        "max_ms": 0.8577433824539185,
        "compile_time": 2.221017599105835
    },
    {
        "BLOCK_SIZE_M": 128,
        "BLOCK_SIZE_N": 256,
        "BLOCK_SIZE_K": 32,
        "GROUP_SIZE_M": 8,
        "num_stages": 2,
        "num_warps": 8,
        "ms": 0.858254075050354,
        "min_ms": 0.858254075050354,
        "max_ms": 0.858254075050354,
        "compile_time": 1.274543285369873
    },
    {
        "BLOCK_SIZE_M": 128,
        "BLOCK_SIZE_N": 128,
        "BLOCK_SIZE_K": 32,
        "GROUP_SIZE_M": 8,
        "num_stages": 3,
        "num_warps": 16,
        "ms": 0.8588840365409851,
        "min_ms": 0.8588840365409851,
        "max_ms": 0.8588840365409851,
        "compile_time": 1.279858112335205
    },
    {
        "BLOCK_SIZE_M": 128,
        "BLOCK_SIZE_N": 128,
        "BLOCK_SIZE_K": 128,
        "GROUP_SIZE_M": 8,
        "num_stages": 2,
        "num_warps": 8,
        "ms": 0.8600040674209595,
        "min_ms": 0.8600040674209595,
        "max_ms": 0.8600040674209595,
        "compile_time": 1.255354404449463
    },
    {
        "BLOCK_SIZE_M": 128,
        "BLOCK_SIZE_N": 128,
        "BLOCK_SIZE_K": 32,
        "GROUP_SIZE_M": 8,
        "num_stages": 6,
        "num_warps": 16,
        "ms": 0.8600338101387024,
        "min_ms": 0.8600338101387024,
        "max_ms": 0.8600338101387024,
        "compile_time": 1.2740890979766846
    },
    {
        "BLOCK_SIZE_M": 128,
        "BLOCK_SIZE_N": 128,
        "BLOCK_SIZE_K": 32,
        "GROUP_SIZE_M": 8,
        "num_stages": 4,
        "num_warps": 16,
        "ms": 0.8606101870536804,
        "min_ms": 0.8606101870536804,
        "max_ms": 0.8606101870536804,
        "compile_time": 1.2662746906280518
    },
    {
        "BLOCK_SIZE_M": 256,
        "BLOCK_SIZE_N": 128,
        "BLOCK_SIZE_K": 16,
        "GROUP_SIZE_M": 8,
        "num_stages": 5,
        "num_warps": 8,
        "ms": 0.8608675003051758,
        "min_ms": 0.8608675003051758,
        "max_ms": 0.8608675003051758,
        "compile_time": 1.2987146377563477
    },
    {
        "BLOCK_SIZE_M": 128,
        "BLOCK_SIZE_N": 128,
        "BLOCK_SIZE_K": 32,
        "GROUP_SIZE_M": 8,
        "num_stages": 7,
        "num_warps": 16,
        "ms": 0.8614214658737183,
        "min_ms": 0.8614214658737183,
        "max_ms": 0.8614214658737183,
        "compile_time": 1.285966157913208
    },
    {
        "BLOCK_SIZE_M": 64,
        "BLOCK_SIZE_N": 256,
        "BLOCK_SIZE_K": 16,
        "GROUP_SIZE_M": 8,
        "num_stages": 3,
        "num_warps": 8,
        "ms": 0.8643511533737183,
        "min_ms": 0.8643511533737183,
        "max_ms": 0.8643511533737183,
        "compile_time": 1.2782511711120605
    },
    {
        "BLOCK_SIZE_M": 128,
        "BLOCK_SIZE_N": 64,
        "BLOCK_SIZE_K": 64,
        "GROUP_SIZE_M": 8,
        "num_stages": 2,
        "num_warps": 8,
        "ms": 0.8645695447921753,
        "min_ms": 0.8645695447921753,
        "max_ms": 0.8645695447921753,
        "compile_time": 1.300908088684082
    },
    {
        "BLOCK_SIZE_M": 128,
        "BLOCK_SIZE_N": 128,
        "BLOCK_SIZE_K": 128,
        "GROUP_SIZE_M": 8,
        "num_stages": 1,
        "num_warps": 4,
        "ms": 0.8654330968856812,
        "min_ms": 0.8654330968856812,
        "max_ms": 0.8654330968856812,
        "compile_time": 1.2742853164672852
    },
    {
        "BLOCK_SIZE_M": 128,
        "BLOCK_SIZE_N": 64,
        "BLOCK_SIZE_K": 32,
        "GROUP_SIZE_M": 8,
        "num_stages": 8,
        "num_warps": 8,
        "ms": 0.8655993342399597,
        "min_ms": 0.8655993342399597,
        "max_ms": 0.8655993342399597,
        "compile_time": 1.3204145431518555
    },
    {
        "BLOCK_SIZE_M": 128,
        "BLOCK_SIZE_N": 128,
        "BLOCK_SIZE_K": 32,
        "GROUP_SIZE_M": 8,
        "num_stages": 8,
        "num_warps": 16,
        "ms": 0.8666656613349915,
        "min_ms": 0.8666656613349915,
        "max_ms": 0.8666656613349915,
        "compile_time": 1.271153450012207
    },
    {
        "BLOCK_SIZE_M": 64,
        "BLOCK_SIZE_N": 128,
        "BLOCK_SIZE_K": 32,
        "GROUP_SIZE_M": 8,
        "num_stages": 8,
        "num_warps": 8,
        "ms": 0.8675063252449036,
        "min_ms": 0.8675063252449036,
        "max_ms": 0.8675063252449036,
        "compile_time": 1.2759528160095215
    },
    {
        "BLOCK_SIZE_M": 128,
        "BLOCK_SIZE_N": 64,
        "BLOCK_SIZE_K": 64,
        "GROUP_SIZE_M": 8,
        "num_stages": 4,
        "num_warps": 2,
        "ms": 0.8676223754882812,
        "min_ms": 0.8676223754882812,
        "max_ms": 0.8676223754882812,
        "compile_time": 1.2747588157653809
    },
    {
        "BLOCK_SIZE_M": 256,
        "BLOCK_SIZE_N": 128,
        "BLOCK_SIZE_K": 64,
        "GROUP_SIZE_M": 8,
        "num_stages": 2,
        "num_warps": 16,
        "ms": 0.8710826635360718,
        "min_ms": 0.8710826635360718,
        "max_ms": 0.8710826635360718,
        "compile_time": 1.2951476573944092
    },
    {
        "BLOCK_SIZE_M": 512,
        "BLOCK_SIZE_N": 64,
        "BLOCK_SIZE_K": 64,
        "GROUP_SIZE_M": 8,
        "num_stages": 2,
        "num_warps": 8,
        "ms": 0.876143753528595,
        "min_ms": 0.876143753528595,
        "max_ms": 0.876143753528595,
        "compile_time": 2.845351219177246
    },
    {
        "BLOCK_SIZE_M": 64,
        "BLOCK_SIZE_N": 256,
        "BLOCK_SIZE_K": 16,
        "GROUP_SIZE_M": 8,
        "num_stages": 5,
        "num_warps": 8,
        "ms": 0.8788965344429016,
        "min_ms": 0.8788965344429016,
        "max_ms": 0.8788965344429016,
        "compile_time": 1.2922673225402832
    },
    {
        "BLOCK_SIZE_M": 64,
        "BLOCK_SIZE_N": 256,
        "BLOCK_SIZE_K": 16,
        "GROUP_SIZE_M": 8,
        "num_stages": 4,
        "num_warps": 8,
        "ms": 0.8797633051872253,
        "min_ms": 0.8797633051872253,
        "max_ms": 0.8797633051872253,
        "compile_time": 1.282566785812378
    },
    {
        "BLOCK_SIZE_M": 256,
        "BLOCK_SIZE_N": 128,
        "BLOCK_SIZE_K": 16,
        "GROUP_SIZE_M": 8,
        "num_stages": 3,
        "num_warps": 8,
        "ms": 0.8802304267883301,
        "min_ms": 0.8802304267883301,
        "max_ms": 0.8802304267883301,
        "compile_time": 1.302121877670288
    },
    {
        "BLOCK_SIZE_M": 64,
        "BLOCK_SIZE_N": 256,
        "BLOCK_SIZE_K": 16,
        "GROUP_SIZE_M": 8,
        "num_stages": 6,
        "num_warps": 8,
        "ms": 0.8810693621635437,
        "min_ms": 0.8810693621635437,
        "max_ms": 0.8810693621635437,
        "compile_time": 1.2968215942382812
    },
    {
        "BLOCK_SIZE_M": 64,
        "BLOCK_SIZE_N": 256,
        "BLOCK_SIZE_K": 16,
        "GROUP_SIZE_M": 8,
        "num_stages": 7,
        "num_warps": 8,
        "ms": 0.8814197778701782,
        "min_ms": 0.8814197778701782,
        "max_ms": 0.8814197778701782,
        "compile_time": 1.2835140228271484
    },
    {
        "BLOCK_SIZE_M": 64,
        "BLOCK_SIZE_N": 128,
        "BLOCK_SIZE_K": 32,
        "GROUP_SIZE_M": 8,
        "num_stages": 2,
        "num_warps": 4,
        "ms": 0.8817721605300903,
        "min_ms": 0.8817721605300903,
        "max_ms": 0.8817721605300903,
        "compile_time": 1.2217745780944824
    },
    {
        "BLOCK_SIZE_M": 64,
        "BLOCK_SIZE_N": 128,
        "BLOCK_SIZE_K": 64,
        "GROUP_SIZE_M": 8,
        "num_stages": 2,
        "num_warps": 4,
        "ms": 0.8829962015151978,
        "min_ms": 0.8829962015151978,
        "max_ms": 0.8829962015151978,
        "compile_time": 1.2334926128387451
    },
    {
        "BLOCK_SIZE_M": 64,
        "BLOCK_SIZE_N": 256,
        "BLOCK_SIZE_K": 16,
        "GROUP_SIZE_M": 8,
        "num_stages": 8,
        "num_warps": 8,
        "ms": 0.8845258951187134,
        "min_ms": 0.8845258951187134,
        "max_ms": 0.8845258951187134,
        "compile_time": 1.3012137413024902
    },
    {
        "BLOCK_SIZE_M": 64,
        "BLOCK_SIZE_N": 512,
        "BLOCK_SIZE_K": 16,
        "GROUP_SIZE_M": 8,
        "num_stages": 7,
        "num_warps": 16,
        "ms": 0.8857320547103882,
        "min_ms": 0.8857320547103882,
        "max_ms": 0.8857320547103882,
        "compile_time": 1.2583537101745605
    },
    {
        "BLOCK_SIZE_M": 64,
        "BLOCK_SIZE_N": 512,
        "BLOCK_SIZE_K": 16,
        "GROUP_SIZE_M": 8,
        "num_stages": 8,
        "num_warps": 16,
        "ms": 0.8878229260444641,
        "min_ms": 0.8878229260444641,
        "max_ms": 0.8878229260444641,
        "compile_time": 1.2735135555267334
    },
    {
        "BLOCK_SIZE_M": 64,
        "BLOCK_SIZE_N": 512,
        "BLOCK_SIZE_K": 16,
        "GROUP_SIZE_M": 8,
        "num_stages": 4,
        "num_warps": 16,
        "ms": 0.8879550695419312,
        "min_ms": 0.8879550695419312,
        "max_ms": 0.8879550695419312,
        "compile_time": 1.2613751888275146
    },
    {
        "BLOCK_SIZE_M": 64,
        "BLOCK_SIZE_N": 512,
        "BLOCK_SIZE_K": 16,
        "GROUP_SIZE_M": 8,
        "num_stages": 6,
        "num_warps": 16,
        "ms": 0.8880146741867065,
        "min_ms": 0.8880146741867065,
        "max_ms": 0.8880146741867065,
        "compile_time": 1.2463335990905762
    },
    {
        "BLOCK_SIZE_M": 64,
        "BLOCK_SIZE_N": 128,
        "BLOCK_SIZE_K": 64,
        "GROUP_SIZE_M": 8,
        "num_stages": 2,
        "num_warps": 8,
        "ms": 0.8889315724372864,
        "min_ms": 0.8889315724372864,
        "max_ms": 0.8889315724372864,
        "compile_time": 1.2640907764434814
    },
    {
        "BLOCK_SIZE_M": 64,
        "BLOCK_SIZE_N": 64,
        "BLOCK_SIZE_K": 32,
        "GROUP_SIZE_M": 8,
        "num_stages": 7,
        "num_warps": 2,
        "ms": 0.8897935152053833,
        "min_ms": 0.8897935152053833,
        "max_ms": 0.8897935152053833,
        "compile_time": 1.3176815509796143
    },
    {
        "BLOCK_SIZE_M": 64,
        "BLOCK_SIZE_N": 64,
        "BLOCK_SIZE_K": 64,
        "GROUP_SIZE_M": 8,
        "num_stages": 4,
        "num_warps": 2,
        "ms": 0.8904050588607788,
        "min_ms": 0.8904050588607788,
        "max_ms": 0.8904050588607788,
        "compile_time": 1.2935380935668945
    },
    {
        "BLOCK_SIZE_M": 64,
        "BLOCK_SIZE_N": 64,
        "BLOCK_SIZE_K": 32,
        "GROUP_SIZE_M": 8,
        "num_stages": 5,
        "num_warps": 2,
        "ms": 0.8913653492927551,
        "min_ms": 0.8913653492927551,
        "max_ms": 0.8913653492927551,
        "compile_time": 1.329796314239502
    },
    {
        "BLOCK_SIZE_M": 64,
        "BLOCK_SIZE_N": 64,
        "BLOCK_SIZE_K": 32,
        "GROUP_SIZE_M": 8,
        "num_stages": 4,
        "num_warps": 2,
        "ms": 0.89141845703125,
        "min_ms": 0.89141845703125,
        "max_ms": 0.89141845703125,
        "compile_time": 1.2937557697296143
    },
    {
        "BLOCK_SIZE_M": 64,
        "BLOCK_SIZE_N": 64,
        "BLOCK_SIZE_K": 32,
        "GROUP_SIZE_M": 8,
        "num_stages": 6,
        "num_warps": 2,
        "ms": 0.8921782374382019,
        "min_ms": 0.8921782374382019,
        "max_ms": 0.8921782374382019,
        "compile_time": 1.312962532043457
    },
    {
        "BLOCK_SIZE_M": 128,
        "BLOCK_SIZE_N": 64,
        "BLOCK_SIZE_K": 32,
        "GROUP_SIZE_M": 8,
        "num_stages": 2,
        "num_warps": 4,
        "ms": 0.8923004269599915,
        "min_ms": 0.8923004269599915,
        "max_ms": 0.8923004269599915,
        "compile_time": 1.2795898914337158
    },
    {
        "BLOCK_SIZE_M": 64,
        "BLOCK_SIZE_N": 64,
        "BLOCK_SIZE_K": 32,
        "GROUP_SIZE_M": 8,
        "num_stages": 5,
        "num_warps": 4,
        "ms": 0.8938582539558411,
        "min_ms": 0.8938582539558411,
        "max_ms": 0.8938582539558411,
        "compile_time": 1.320258378982544
    },
    {
        "BLOCK_SIZE_M": 64,
        "BLOCK_SIZE_N": 512,
        "BLOCK_SIZE_K": 16,
        "GROUP_SIZE_M": 8,
        "num_stages": 5,
        "num_warps": 16,
        "ms": 0.8940046429634094,
        "min_ms": 0.8940046429634094,
        "max_ms": 0.8940046429634094,
        "compile_time": 1.2665972709655762
    },
    {
        "BLOCK_SIZE_M": 64,
        "BLOCK_SIZE_N": 64,
        "BLOCK_SIZE_K": 64,
        "GROUP_SIZE_M": 8,
        "num_stages": 4,
        "num_warps": 4,
        "ms": 0.8942041397094727,
        "min_ms": 0.8942041397094727,
        "max_ms": 0.8942041397094727,
        "compile_time": 1.3087866306304932
    },
    {
        "BLOCK_SIZE_M": 64,
        "BLOCK_SIZE_N": 64,
        "BLOCK_SIZE_K": 32,
        "GROUP_SIZE_M": 8,
        "num_stages": 3,
        "num_warps": 2,
        "ms": 0.8943827748298645,
        "min_ms": 0.8943827748298645,
        "max_ms": 0.8943827748298645,
        "compile_time": 1.2986102104187012
    },
    {
        "BLOCK_SIZE_M": 64,
        "BLOCK_SIZE_N": 64,
        "BLOCK_SIZE_K": 32,
        "GROUP_SIZE_M": 8,
        "num_stages": 4,
        "num_warps": 4,
        "ms": 0.8948990106582642,
        "min_ms": 0.8948990106582642,
        "max_ms": 0.8948990106582642,
        "compile_time": 1.3133363723754883
    },
    {
        "BLOCK_SIZE_M": 64,
        "BLOCK_SIZE_N": 64,
        "BLOCK_SIZE_K": 64,
        "GROUP_SIZE_M": 8,
        "num_stages": 3,
        "num_warps": 2,
        "ms": 0.897591233253479,
        "min_ms": 0.897591233253479,
        "max_ms": 0.897591233253479,
        "compile_time": 1.2875466346740723
    },
    {
        "BLOCK_SIZE_M": 64,
        "BLOCK_SIZE_N": 64,
        "BLOCK_SIZE_K": 64,
        "GROUP_SIZE_M": 8,
        "num_stages": 6,
        "num_warps": 4,
        "ms": 0.8995010256767273,
        "min_ms": 0.8995010256767273,
        "max_ms": 0.8995010256767273,
        "compile_time": 1.3077738285064697
    },
    {
        "BLOCK_SIZE_M": 64,
        "BLOCK_SIZE_N": 64,
        "BLOCK_SIZE_K": 32,
        "GROUP_SIZE_M": 8,
        "num_stages": 7,
        "num_warps": 4,
        "ms": 0.9016976356506348,
        "min_ms": 0.9016976356506348,
        "max_ms": 0.9016976356506348,
        "compile_time": 1.3170299530029297
    },
    {
        "BLOCK_SIZE_M": 64,
        "BLOCK_SIZE_N": 512,
        "BLOCK_SIZE_K": 16,
        "GROUP_SIZE_M": 8,
        "num_stages": 3,
        "num_warps": 16,
        "ms": 0.9022672772407532,
        "min_ms": 0.9022672772407532,
        "max_ms": 0.9022672772407532,
        "compile_time": 1.2590110301971436
    },
    {
        "BLOCK_SIZE_M": 64,
        "BLOCK_SIZE_N": 512,
        "BLOCK_SIZE_K": 32,
        "GROUP_SIZE_M": 8,
        "num_stages": 2,
        "num_warps": 8,
        "ms": 0.9029437303543091,
        "min_ms": 0.9029437303543091,
        "max_ms": 0.9029437303543091,
        "compile_time": 1.2377135753631592
    },
    {
        "BLOCK_SIZE_M": 128,
        "BLOCK_SIZE_N": 128,
        "BLOCK_SIZE_K": 32,
        "GROUP_SIZE_M": 8,
        "num_stages": 1,
        "num_warps": 8,
        "ms": 0.9033399820327759,
        "min_ms": 0.9033399820327759,
        "max_ms": 0.9033399820327759,
        "compile_time": 1.2678866386413574
    },
    {
        "BLOCK_SIZE_M": 64,
        "BLOCK_SIZE_N": 64,
        "BLOCK_SIZE_K": 32,
        "GROUP_SIZE_M": 8,
        "num_stages": 6,
        "num_warps": 4,
        "ms": 0.9080709218978882,
        "min_ms": 0.9080709218978882,
        "max_ms": 0.9080709218978882,
        "compile_time": 1.314852237701416
    },
    {
        "BLOCK_SIZE_M": 256,
        "BLOCK_SIZE_N": 128,
        "BLOCK_SIZE_K": 128,
        "GROUP_SIZE_M": 8,
        "num_stages": 2,
        "num_warps": 16,
        "ms": 0.9097668528556824,
        "min_ms": 0.9097668528556824,
        "max_ms": 0.9097668528556824,
        "compile_time": 1.3008532524108887
    },
    {
        "BLOCK_SIZE_M": 64,
        "BLOCK_SIZE_N": 64,
        "BLOCK_SIZE_K": 64,
        "GROUP_SIZE_M": 8,
        "num_stages": 3,
        "num_warps": 4,
        "ms": 0.9113208055496216,
        "min_ms": 0.9113208055496216,
        "max_ms": 0.9113208055496216,
        "compile_time": 1.304229974746704
    },
    {
        "BLOCK_SIZE_M": 64,
        "BLOCK_SIZE_N": 64,
        "BLOCK_SIZE_K": 128,
        "GROUP_SIZE_M": 8,
        "num_stages": 3,
        "num_warps": 4,
        "ms": 0.9140169024467468,
        "min_ms": 0.9140169024467468,
        "max_ms": 0.9140169024467468,
        "compile_time": 1.2913150787353516
    },
    {
        "BLOCK_SIZE_M": 64,
        "BLOCK_SIZE_N": 64,
        "BLOCK_SIZE_K": 64,
        "GROUP_SIZE_M": 8,
        "num_stages": 5,
        "num_warps": 4,
        "ms": 0.9144665002822876,
        "min_ms": 0.9144665002822876,
        "max_ms": 0.9144665002822876,
        "compile_time": 1.293550968170166
    },
    {
        "BLOCK_SIZE_M": 128,
        "BLOCK_SIZE_N": 256,
        "BLOCK_SIZE_K": 128,
        "GROUP_SIZE_M": 8,
        "num_stages": 2,
        "num_warps": 8,
        "ms": 0.9148057699203491,
        "min_ms": 0.9148057699203491,
        "max_ms": 0.9148057699203491,
        "compile_time": 1.265976905822754
    },
    {
        "BLOCK_SIZE_M": 64,
        "BLOCK_SIZE_N": 64,
        "BLOCK_SIZE_K": 32,
        "GROUP_SIZE_M": 8,
        "num_stages": 3,
        "num_warps": 4,
        "ms": 0.9149457812309265,
        "min_ms": 0.9149457812309265,
        "max_ms": 0.9149457812309265,
        "compile_time": 1.3222944736480713
    },
    {
        "BLOCK_SIZE_M": 256,
        "BLOCK_SIZE_N": 64,
        "BLOCK_SIZE_K": 16,
        "GROUP_SIZE_M": 8,
        "num_stages": 6,
        "num_warps": 4,
        "ms": 0.915428638458252,
        "min_ms": 0.915428638458252,
        "max_ms": 0.915428638458252,
        "compile_time": 2.4291436672210693
    },
    {
        "BLOCK_SIZE_M": 256,
        "BLOCK_SIZE_N": 64,
        "BLOCK_SIZE_K": 16,
        "GROUP_SIZE_M": 8,
        "num_stages": 7,
        "num_warps": 4,
        "ms": 0.9155067205429077,
        "min_ms": 0.9155067205429077,
        "max_ms": 0.9155067205429077,
        "compile_time": 2.413928747177124
    },
    {
        "BLOCK_SIZE_M": 256,
        "BLOCK_SIZE_N": 64,
        "BLOCK_SIZE_K": 16,
        "GROUP_SIZE_M": 8,
        "num_stages": 8,
        "num_warps": 4,
        "ms": 0.9167453050613403,
        "min_ms": 0.9167453050613403,
        "max_ms": 0.9167453050613403,
        "compile_time": 2.4013848304748535
    },
    {
        "BLOCK_SIZE_M": 64,
        "BLOCK_SIZE_N": 64,
        "BLOCK_SIZE_K": 64,
        "GROUP_SIZE_M": 8,
        "num_stages": 5,
        "num_warps": 2,
        "ms": 0.918939471244812,
        "min_ms": 0.918939471244812,
        "max_ms": 0.918939471244812,
        "compile_time": 1.2806065082550049
    },
    {
        "BLOCK_SIZE_M": 64,
        "BLOCK_SIZE_N": 64,
        "BLOCK_SIZE_K": 32,
        "GROUP_SIZE_M": 8,
        "num_stages": 8,
        "num_warps": 4,
        "ms": 0.9199180603027344,
        "min_ms": 0.9199180603027344,
        "max_ms": 0.9199180603027344,
        "compile_time": 1.2965919971466064
    },
    {
        "BLOCK_SIZE_M": 128,
        "BLOCK_SIZE_N": 256,
        "BLOCK_SIZE_K": 64,
        "GROUP_SIZE_M": 8,
        "num_stages": 2,
        "num_warps": 16,
        "ms": 0.9205899238586426,
        "min_ms": 0.9205899238586426,
        "max_ms": 0.9205899238586426,
        "compile_time": 1.2702467441558838
    },
    {
        "BLOCK_SIZE_M": 64,
        "BLOCK_SIZE_N": 64,
        "BLOCK_SIZE_K": 64,
        "GROUP_SIZE_M": 8,
        "num_stages": 6,
        "num_warps": 2,
        "ms": 0.9234890937805176,
        "min_ms": 0.9234890937805176,
        "max_ms": 0.9234890937805176,
        "compile_time": 1.262695550918579
    },
    {
        "BLOCK_SIZE_M": 64,
        "BLOCK_SIZE_N": 64,
        "BLOCK_SIZE_K": 32,
        "GROUP_SIZE_M": 8,
        "num_stages": 8,
        "num_warps": 2,
        "ms": 0.9265152215957642,
        "min_ms": 0.9265152215957642,
        "max_ms": 0.9265152215957642,
        "compile_time": 1.2823801040649414
    },
    {
        "BLOCK_SIZE_M": 128,
        "BLOCK_SIZE_N": 128,
        "BLOCK_SIZE_K": 32,
        "GROUP_SIZE_M": 8,
        "num_stages": 1,
        "num_warps": 4,
        "ms": 0.926644504070282,
        "min_ms": 0.926644504070282,
        "max_ms": 0.926644504070282,
        "compile_time": 1.2717180252075195
    },
    {
        "BLOCK_SIZE_M": 128,
        "BLOCK_SIZE_N": 256,
        "BLOCK_SIZE_K": 128,
        "GROUP_SIZE_M": 8,
        "num_stages": 1,
        "num_warps": 16,
        "ms": 0.927581787109375,
        "min_ms": 0.927581787109375,
        "max_ms": 0.927581787109375,
        "compile_time": 1.2602958679199219
    },
    {
        "BLOCK_SIZE_M": 64,
        "BLOCK_SIZE_N": 512,
        "BLOCK_SIZE_K": 32,
        "GROUP_SIZE_M": 8,
        "num_stages": 3,
        "num_warps": 16,
        "ms": 0.9290558695793152,
        "min_ms": 0.9290558695793152,
        "max_ms": 0.9290558695793152,
        "compile_time": 1.225017786026001
    },
    {
        "BLOCK_SIZE_M": 128,
        "BLOCK_SIZE_N": 128,
        "BLOCK_SIZE_K": 128,
        "GROUP_SIZE_M": 8,
        "num_stages": 2,
        "num_warps": 16,
        "ms": 0.9319464564323425,
        "min_ms": 0.9319464564323425,
        "max_ms": 0.9319464564323425,
        "compile_time": 1.270488977432251
    },
    {
        "BLOCK_SIZE_M": 64,
        "BLOCK_SIZE_N": 64,
        "BLOCK_SIZE_K": 64,
        "GROUP_SIZE_M": 8,
        "num_stages": 7,
        "num_warps": 4,
        "ms": 0.9350210428237915,
        "min_ms": 0.9350210428237915,
        "max_ms": 0.9350210428237915,
        "compile_time": 1.284282922744751
    },
    {
        "BLOCK_SIZE_M": 128,
        "BLOCK_SIZE_N": 64,
        "BLOCK_SIZE_K": 16,
        "GROUP_SIZE_M": 8,
        "num_stages": 7,
        "num_warps": 2,
        "ms": 0.9353100061416626,
        "min_ms": 0.9353100061416626,
        "max_ms": 0.9353100061416626,
        "compile_time": 1.2920737266540527
    },
    {
        "BLOCK_SIZE_M": 64,
        "BLOCK_SIZE_N": 512,
        "BLOCK_SIZE_K": 32,
        "GROUP_SIZE_M": 8,
        "num_stages": 4,
        "num_warps": 16,
        "ms": 0.937602698802948,
        "min_ms": 0.937602698802948,
        "max_ms": 0.937602698802948,
        "compile_time": 1.2366738319396973
    },
    {
        "BLOCK_SIZE_M": 128,
        "BLOCK_SIZE_N": 64,
        "BLOCK_SIZE_K": 16,
        "GROUP_SIZE_M": 8,
        "num_stages": 6,
        "num_warps": 2,
        "ms": 0.9382160902023315,
        "min_ms": 0.9382160902023315,
        "max_ms": 0.9382160902023315,
        "compile_time": 1.2897953987121582
    },
    {
        "BLOCK_SIZE_M": 64,
        "BLOCK_SIZE_N": 256,
        "BLOCK_SIZE_K": 32,
        "GROUP_SIZE_M": 8,
        "num_stages": 3,
        "num_warps": 16,
        "ms": 0.9383147954940796,
        "min_ms": 0.9383147954940796,
        "max_ms": 0.9383147954940796,
        "compile_time": 1.2644803524017334
    },
    {
        "BLOCK_SIZE_M": 64,
        "BLOCK_SIZE_N": 512,
        "BLOCK_SIZE_K": 32,
        "GROUP_SIZE_M": 8,
        "num_stages": 5,
        "num_warps": 16,
        "ms": 0.9384077191352844,
        "min_ms": 0.9384077191352844,
        "max_ms": 0.9384077191352844,
        "compile_time": 1.235112190246582
    },
    {
        "BLOCK_SIZE_M": 64,
        "BLOCK_SIZE_N": 256,
        "BLOCK_SIZE_K": 32,
        "GROUP_SIZE_M": 8,
        "num_stages": 7,
        "num_warps": 16,
        "ms": 0.9384657740592957,
        "min_ms": 0.9384657740592957,
        "max_ms": 0.9384657740592957,
        "compile_time": 1.281172275543213
    },
    {
        "BLOCK_SIZE_M": 64,
        "BLOCK_SIZE_N": 256,
        "BLOCK_SIZE_K": 32,
        "GROUP_SIZE_M": 8,
        "num_stages": 8,
        "num_warps": 16,
        "ms": 0.9394766688346863,
        "min_ms": 0.9394766688346863,
        "max_ms": 0.9394766688346863,
        "compile_time": 1.253425121307373
    },
    {
        "BLOCK_SIZE_M": 64,
        "BLOCK_SIZE_N": 256,
        "BLOCK_SIZE_K": 32,
        "GROUP_SIZE_M": 8,
        "num_stages": 4,
        "num_warps": 16,
        "ms": 0.9395554661750793,
        "min_ms": 0.9395554661750793,
        "max_ms": 0.9395554661750793,
        "compile_time": 1.2603635787963867
    },
    {
        "BLOCK_SIZE_M": 128,
        "BLOCK_SIZE_N": 128,
        "BLOCK_SIZE_K": 64,
        "GROUP_SIZE_M": 8,
        "num_stages": 1,
        "num_warps": 4,
        "ms": 0.9398558735847473,
        "min_ms": 0.9398558735847473,
        "max_ms": 0.9398558735847473,
        "compile_time": 1.255274772644043
    },
    {
        "BLOCK_SIZE_M": 256,
        "BLOCK_SIZE_N": 64,
        "BLOCK_SIZE_K": 32,
        "GROUP_SIZE_M": 8,
        "num_stages": 4,
        "num_warps": 16,
        "ms": 0.940090537071228,
        "min_ms": 0.940090537071228,
        "max_ms": 0.940090537071228,
        "compile_time": 1.331958293914795
    },
    {
        "BLOCK_SIZE_M": 64,
        "BLOCK_SIZE_N": 64,
        "BLOCK_SIZE_K": 64,
        "GROUP_SIZE_M": 8,
        "num_stages": 8,
        "num_warps": 4,
        "ms": 0.9403656721115112,
        "min_ms": 0.9403656721115112,
        "max_ms": 0.9403656721115112,
        "compile_time": 1.27846360206604
    },
    {
        "BLOCK_SIZE_M": 64,
        "BLOCK_SIZE_N": 64,
        "BLOCK_SIZE_K": 128,
        "GROUP_SIZE_M": 8,
        "num_stages": 5,
        "num_warps": 4,
        "ms": 0.9404586553573608,
        "min_ms": 0.9404586553573608,
        "max_ms": 0.9404586553573608,
        "compile_time": 1.2800889015197754
    },
    {
        "BLOCK_SIZE_M": 128,
        "BLOCK_SIZE_N": 64,
        "BLOCK_SIZE_K": 16,
        "GROUP_SIZE_M": 8,
        "num_stages": 4,
        "num_warps": 2,
        "ms": 0.9407004117965698,
        "min_ms": 0.9407004117965698,
        "max_ms": 0.9407004117965698,
        "compile_time": 1.299546718597412
    },
    {
        "BLOCK_SIZE_M": 128,
        "BLOCK_SIZE_N": 64,
        "BLOCK_SIZE_K": 16,
        "GROUP_SIZE_M": 8,
        "num_stages": 5,
        "num_warps": 2,
        "ms": 0.9411062002182007,
        "min_ms": 0.9411062002182007,
        "max_ms": 0.9411062002182007,
        "compile_time": 1.317495346069336
    },
    {
        "BLOCK_SIZE_M": 64,
        "BLOCK_SIZE_N": 256,
        "BLOCK_SIZE_K": 32,
        "GROUP_SIZE_M": 8,
        "num_stages": 5,
        "num_warps": 16,
        "ms": 0.9411977529525757,
        "min_ms": 0.9411977529525757,
        "max_ms": 0.9411977529525757,
        "compile_time": 1.260080337524414
    },
    {
        "BLOCK_SIZE_M": 128,
        "BLOCK_SIZE_N": 64,
        "BLOCK_SIZE_K": 32,
        "GROUP_SIZE_M": 8,
        "num_stages": 1,
        "num_warps": 2,
        "ms": 0.942089855670929,
        "min_ms": 0.942089855670929,
        "max_ms": 0.942089855670929,
        "compile_time": 1.2854564189910889
    },
    {
        "BLOCK_SIZE_M": 128,
        "BLOCK_SIZE_N": 64,
        "BLOCK_SIZE_K": 16,
        "GROUP_SIZE_M": 8,
        "num_stages": 3,
        "num_warps": 2,
        "ms": 0.9424226880073547,
        "min_ms": 0.9424226880073547,
        "max_ms": 0.9424226880073547,
        "compile_time": 1.280703067779541
    },
    {
        "BLOCK_SIZE_M": 128,
        "BLOCK_SIZE_N": 64,
        "BLOCK_SIZE_K": 16,
        "GROUP_SIZE_M": 8,
        "num_stages": 8,
        "num_warps": 2,
        "ms": 0.9428342580795288,
        "min_ms": 0.9428342580795288,
        "max_ms": 0.9428342580795288,
        "compile_time": 1.285144329071045
    },
    {
        "BLOCK_SIZE_M": 256,
        "BLOCK_SIZE_N": 64,
        "BLOCK_SIZE_K": 32,
        "GROUP_SIZE_M": 8,
        "num_stages": 6,
        "num_warps": 16,
        "ms": 0.9429382085800171,
        "min_ms": 0.9429382085800171,
        "max_ms": 0.9429382085800171,
        "compile_time": 1.3367764949798584
    },
    {
        "BLOCK_SIZE_M": 256,
        "BLOCK_SIZE_N": 64,
        "BLOCK_SIZE_K": 32,
        "GROUP_SIZE_M": 8,
        "num_stages": 7,
        "num_warps": 16,
        "ms": 0.9431827664375305,
        "min_ms": 0.9431827664375305,
        "max_ms": 0.9431827664375305,
        "compile_time": 1.3260736465454102
    },
    {
        "BLOCK_SIZE_M": 512,
        "BLOCK_SIZE_N": 64,
        "BLOCK_SIZE_K": 64,
        "GROUP_SIZE_M": 8,
        "num_stages": 3,
        "num_warps": 16,
        "ms": 0.9432385563850403,
        "min_ms": 0.9432385563850403,
        "max_ms": 0.9432385563850403,
        "compile_time": 2.4202845096588135
    },
    {
        "BLOCK_SIZE_M": 64,
        "BLOCK_SIZE_N": 256,
        "BLOCK_SIZE_K": 32,
        "GROUP_SIZE_M": 8,
        "num_stages": 6,
        "num_warps": 16,
        "ms": 0.9435392618179321,
        "min_ms": 0.9435392618179321,
        "max_ms": 0.9435392618179321,
        "compile_time": 1.2575509548187256
    },
    {
        "BLOCK_SIZE_M": 256,
        "BLOCK_SIZE_N": 64,
        "BLOCK_SIZE_K": 32,
        "GROUP_SIZE_M": 8,
        "num_stages": 8,
        "num_warps": 16,
        "ms": 0.9449905157089233,
        "min_ms": 0.9449905157089233,
        "max_ms": 0.9449905157089233,
        "compile_time": 1.3313124179840088
    },
    {
        "BLOCK_SIZE_M": 64,
        "BLOCK_SIZE_N": 64,
        "BLOCK_SIZE_K": 32,
        "GROUP_SIZE_M": 8,
        "num_stages": 2,
        "num_warps": 2,
        "ms": 0.9454747438430786,
        "min_ms": 0.9454747438430786,
        "max_ms": 0.9454747438430786,
        "compile_time": 1.2859055995941162
    },
    {
        "BLOCK_SIZE_M": 128,
        "BLOCK_SIZE_N": 64,
        "BLOCK_SIZE_K": 16,
        "GROUP_SIZE_M": 8,
        "num_stages": 7,
        "num_warps": 4,
        "ms": 0.9455152750015259,
        "min_ms": 0.9455152750015259,
        "max_ms": 0.9455152750015259,
        "compile_time": 1.304966926574707
    },
    {
        "BLOCK_SIZE_M": 64,
        "BLOCK_SIZE_N": 64,
        "BLOCK_SIZE_K": 128,
        "GROUP_SIZE_M": 8,
        "num_stages": 2,
        "num_warps": 2,
        "ms": 0.9462088346481323,
        "min_ms": 0.9462088346481323,
        "max_ms": 0.9462088346481323,
        "compile_time": 1.2783832550048828
    },
    {
        "BLOCK_SIZE_M": 64,
        "BLOCK_SIZE_N": 64,
        "BLOCK_SIZE_K": 128,
        "GROUP_SIZE_M": 8,
        "num_stages": 6,
        "num_warps": 4,
        "ms": 0.9464395642280579,
        "min_ms": 0.9464395642280579,
        "max_ms": 0.9464395642280579,
        "compile_time": 1.283769130706787
    },
    {
        "BLOCK_SIZE_M": 128,
        "BLOCK_SIZE_N": 64,
        "BLOCK_SIZE_K": 64,
        "GROUP_SIZE_M": 8,
        "num_stages": 1,
        "num_warps": 4,
        "ms": 0.9478719830513,
        "min_ms": 0.9478719830513,
        "max_ms": 0.9478719830513,
        "compile_time": 1.2783384323120117
    },
    {
        "BLOCK_SIZE_M": 256,
        "BLOCK_SIZE_N": 128,
        "BLOCK_SIZE_K": 64,
        "GROUP_SIZE_M": 8,
        "num_stages": 1,
        "num_warps": 16,
        "ms": 0.9483836889266968,
        "min_ms": 0.9483836889266968,
        "max_ms": 0.9483836889266968,
        "compile_time": 1.303189992904663
    },
    {
        "BLOCK_SIZE_M": 256,
        "BLOCK_SIZE_N": 128,
        "BLOCK_SIZE_K": 64,
        "GROUP_SIZE_M": 8,
        "num_stages": 1,
        "num_warps": 8,
        "ms": 0.948930561542511,
        "min_ms": 0.948930561542511,
        "max_ms": 0.948930561542511,
        "compile_time": 1.302433729171753
    },
    {
        "BLOCK_SIZE_M": 128,
        "BLOCK_SIZE_N": 128,
        "BLOCK_SIZE_K": 256,
        "GROUP_SIZE_M": 8,
        "num_stages": 2,
        "num_warps": 8,
        "ms": 0.9508520364761353,
        "min_ms": 0.9508520364761353,
        "max_ms": 0.9508520364761353,
        "compile_time": 1.2783522605895996
    },
    {
        "BLOCK_SIZE_M": 64,
        "BLOCK_SIZE_N": 64,
        "BLOCK_SIZE_K": 128,
        "GROUP_SIZE_M": 8,
        "num_stages": 4,
        "num_warps": 4,
        "ms": 0.9528358578681946,
        "min_ms": 0.9528358578681946,
        "max_ms": 0.9528358578681946,
        "compile_time": 1.2703166007995605
    },
    {
        "BLOCK_SIZE_M": 128,
        "BLOCK_SIZE_N": 128,
        "BLOCK_SIZE_K": 64,
        "GROUP_SIZE_M": 8,
        "num_stages": 2,
        "num_warps": 8,
        "ms": 0.9543059468269348,
        "min_ms": 0.9543059468269348,
        "max_ms": 0.9543059468269348,
        "compile_time": 1.2599282264709473
    },
    {
        "BLOCK_SIZE_M": 128,
        "BLOCK_SIZE_N": 64,
        "BLOCK_SIZE_K": 16,
        "GROUP_SIZE_M": 8,
        "num_stages": 6,
        "num_warps": 4,
        "ms": 0.9555090069770813,
        "min_ms": 0.9555090069770813,
        "max_ms": 0.9555090069770813,
        "compile_time": 1.3037879467010498
    },
    {
        "BLOCK_SIZE_M": 256,
        "BLOCK_SIZE_N": 64,
        "BLOCK_SIZE_K": 16,
        "GROUP_SIZE_M": 8,
        "num_stages": 4,
        "num_warps": 4,
        "ms": 0.9561764001846313,
        "min_ms": 0.9561764001846313,
        "max_ms": 0.9561764001846313,
        "compile_time": 2.2862844467163086
    },
    {
        "BLOCK_SIZE_M": 128,
        "BLOCK_SIZE_N": 64,
        "BLOCK_SIZE_K": 16,
        "GROUP_SIZE_M": 8,
        "num_stages": 4,
        "num_warps": 4,
        "ms": 0.9563702344894409,
        "min_ms": 0.9563702344894409,
        "max_ms": 0.9563702344894409,
        "compile_time": 1.2875945568084717
    },
    {
        "BLOCK_SIZE_M": 128,
        "BLOCK_SIZE_N": 64,
        "BLOCK_SIZE_K": 64,
        "GROUP_SIZE_M": 8,
        "num_stages": 1,
        "num_warps": 2,
        "ms": 0.9584519267082214,
        "min_ms": 0.9584519267082214,
        "max_ms": 0.9584519267082214,
        "compile_time": 1.2787599563598633
    },
    {
        "BLOCK_SIZE_M": 256,
        "BLOCK_SIZE_N": 64,
        "BLOCK_SIZE_K": 32,
        "GROUP_SIZE_M": 8,
        "num_stages": 3,
        "num_warps": 16,
        "ms": 0.9590904116630554,
        "min_ms": 0.9590904116630554,
        "max_ms": 0.9590904116630554,
        "compile_time": 1.3372583389282227
    },
    {
        "BLOCK_SIZE_M": 128,
        "BLOCK_SIZE_N": 64,
        "BLOCK_SIZE_K": 16,
        "GROUP_SIZE_M": 8,
        "num_stages": 5,
        "num_warps": 4,
        "ms": 0.9591158628463745,
        "min_ms": 0.9591158628463745,
        "max_ms": 0.9591158628463745,
        "compile_time": 1.299760341644287
    },
    {
        "BLOCK_SIZE_M": 256,
        "BLOCK_SIZE_N": 64,
        "BLOCK_SIZE_K": 32,
        "GROUP_SIZE_M": 8,
        "num_stages": 5,
        "num_warps": 16,
        "ms": 0.9591687917709351,
        "min_ms": 0.9591687917709351,
        "max_ms": 0.9591687917709351,
        "compile_time": 1.3231549263000488
    },
    {
        "BLOCK_SIZE_M": 128,
        "BLOCK_SIZE_N": 256,
        "BLOCK_SIZE_K": 16,
        "GROUP_SIZE_M": 8,
        "num_stages": 5,
        "num_warps": 16,
        "ms": 0.9592258334159851,
        "min_ms": 0.9592258334159851,
        "max_ms": 0.9592258334159851,
        "compile_time": 1.2796266078948975
    },
    {
        "BLOCK_SIZE_M": 256,
        "BLOCK_SIZE_N": 32,
        "BLOCK_SIZE_K": 32,
        "GROUP_SIZE_M": 8,
        "num_stages": 4,
        "num_warps": 4,
        "ms": 0.9593083262443542,
        "min_ms": 0.9593083262443542,
        "max_ms": 0.9593083262443542,
        "compile_time": 1.357353687286377
    },
    {
        "BLOCK_SIZE_M": 256,
        "BLOCK_SIZE_N": 32,
        "BLOCK_SIZE_K": 32,
        "GROUP_SIZE_M": 8,
        "num_stages": 3,
        "num_warps": 4,
        "ms": 0.9597999453544617,
        "min_ms": 0.9597999453544617,
        "max_ms": 0.9597999453544617,
        "compile_time": 1.363921880722046
    },
    {
        "BLOCK_SIZE_M": 64,
        "BLOCK_SIZE_N": 64,
        "BLOCK_SIZE_K": 128,
        "GROUP_SIZE_M": 8,
        "num_stages": 2,
        "num_warps": 4,
        "ms": 0.9602221250534058,
        "min_ms": 0.9602221250534058,
        "max_ms": 0.9602221250534058,
        "compile_time": 1.2845439910888672
    },
    {
        "BLOCK_SIZE_M": 512,
        "BLOCK_SIZE_N": 32,
        "BLOCK_SIZE_K": 32,
        "GROUP_SIZE_M": 8,
        "num_stages": 3,
        "num_warps": 4,
        "ms": 0.9603840112686157,
        "min_ms": 0.9603840112686157,
        "max_ms": 0.9603840112686157,
        "compile_time": 2.895069122314453
    },
    {
        "BLOCK_SIZE_M": 256,
        "BLOCK_SIZE_N": 64,
        "BLOCK_SIZE_K": 16,
        "GROUP_SIZE_M": 8,
        "num_stages": 5,
        "num_warps": 4,
        "ms": 0.9604669809341431,
        "min_ms": 0.9604669809341431,
        "max_ms": 0.9604669809341431,
        "compile_time": 2.3740251064300537
    },
    {
        "BLOCK_SIZE_M": 256,
        "BLOCK_SIZE_N": 64,
        "BLOCK_SIZE_K": 128,
        "GROUP_SIZE_M": 8,
        "num_stages": 2,
        "num_warps": 8,
        "ms": 0.961269736289978,
        "min_ms": 0.961269736289978,
        "max_ms": 0.961269736289978,
        "compile_time": 1.3122406005859375
    },
    {
        "BLOCK_SIZE_M": 256,
        "BLOCK_SIZE_N": 32,
        "BLOCK_SIZE_K": 32,
        "GROUP_SIZE_M": 8,
        "num_stages": 5,
        "num_warps": 4,
        "ms": 0.962621808052063,
        "min_ms": 0.962621808052063,
        "max_ms": 0.962621808052063,
        "compile_time": 1.351703405380249
    },
    {
        "BLOCK_SIZE_M": 128,
        "BLOCK_SIZE_N": 256,
        "BLOCK_SIZE_K": 128,
        "GROUP_SIZE_M": 8,
        "num_stages": 1,
        "num_warps": 8,
        "ms": 0.9628692865371704,
        "min_ms": 0.9628692865371704,
        "max_ms": 0.9628692865371704,
        "compile_time": 1.266890287399292
    },
    {
        "BLOCK_SIZE_M": 64,
        "BLOCK_SIZE_N": 64,
        "BLOCK_SIZE_K": 64,
        "GROUP_SIZE_M": 8,
        "num_stages": 2,
        "num_warps": 4,
        "ms": 0.9631978273391724,
        "min_ms": 0.9631978273391724,
        "max_ms": 0.9631978273391724,
        "compile_time": 1.2724063396453857
    },
    {
        "BLOCK_SIZE_M": 128,
        "BLOCK_SIZE_N": 256,
        "BLOCK_SIZE_K": 16,
        "GROUP_SIZE_M": 8,
        "num_stages": 3,
        "num_warps": 16,
        "ms": 0.9638260006904602,
        "min_ms": 0.9638260006904602,
        "max_ms": 0.9638260006904602,
        "compile_time": 1.2759759426116943
    },
    {
        "BLOCK_SIZE_M": 128,
        "BLOCK_SIZE_N": 64,
        "BLOCK_SIZE_K": 128,
        "GROUP_SIZE_M": 8,
        "num_stages": 3,
        "num_warps": 16,
        "ms": 0.9639374017715454,
        "min_ms": 0.9639374017715454,
        "max_ms": 0.9639374017715454,
        "compile_time": 1.2904465198516846
    },
    {
        "BLOCK_SIZE_M": 64,
        "BLOCK_SIZE_N": 128,
        "BLOCK_SIZE_K": 64,
        "GROUP_SIZE_M": 8,
        "num_stages": 4,
        "num_warps": 2,
        "ms": 0.9643519520759583,
        "min_ms": 0.9643519520759583,
        "max_ms": 0.9643519520759583,
        "compile_time": 1.2372219562530518
    },
    {
        "BLOCK_SIZE_M": 256,
        "BLOCK_SIZE_N": 64,
        "BLOCK_SIZE_K": 16,
        "GROUP_SIZE_M": 8,
        "num_stages": 3,
        "num_warps": 4,
        "ms": 0.9648107290267944,
        "min_ms": 0.9648107290267944,
        "max_ms": 0.9648107290267944,
        "compile_time": 2.2730517387390137
    },
    {
        "BLOCK_SIZE_M": 64,
        "BLOCK_SIZE_N": 256,
        "BLOCK_SIZE_K": 32,
        "GROUP_SIZE_M": 8,
        "num_stages": 1,
        "num_warps": 8,
        "ms": 0.9650217294692993,
        "min_ms": 0.9650217294692993,
        "max_ms": 0.9650217294692993,
        "compile_time": 1.2663769721984863
    },
    {
        "BLOCK_SIZE_M": 128,
        "BLOCK_SIZE_N": 64,
        "BLOCK_SIZE_K": 16,
        "GROUP_SIZE_M": 8,
        "num_stages": 3,
        "num_warps": 4,
        "ms": 0.965236485004425,
        "min_ms": 0.965236485004425,
        "max_ms": 0.965236485004425,
        "compile_time": 1.288400650024414
    },
    {
        "BLOCK_SIZE_M": 256,
        "BLOCK_SIZE_N": 64,
        "BLOCK_SIZE_K": 32,
        "GROUP_SIZE_M": 8,
        "num_stages": 1,
        "num_warps": 8,
        "ms": 0.9683998823165894,
        "min_ms": 0.9683998823165894,
        "max_ms": 0.9683998823165894,
        "compile_time": 1.3067686557769775
    },
    {
        "BLOCK_SIZE_M": 256,
        "BLOCK_SIZE_N": 32,
        "BLOCK_SIZE_K": 64,
        "GROUP_SIZE_M": 8,
        "num_stages": 5,
        "num_warps": 4,
        "ms": 0.9689903259277344,
        "min_ms": 0.9689903259277344,
        "max_ms": 0.9689903259277344,
        "compile_time": 1.344196081161499
    },
    {
        "BLOCK_SIZE_M": 128,
        "BLOCK_SIZE_N": 64,
        "BLOCK_SIZE_K": 128,
        "GROUP_SIZE_M": 8,
        "num_stages": 4,
        "num_warps": 16,
        "ms": 0.969272255897522,
        "min_ms": 0.969272255897522,
        "max_ms": 0.969272255897522,
        "compile_time": 1.2941362857818604
    },
    {
        "BLOCK_SIZE_M": 128,
        "BLOCK_SIZE_N": 128,
        "BLOCK_SIZE_K": 128,
        "GROUP_SIZE_M": 8,
        "num_stages": 3,
        "num_warps": 32,
        "ms": 0.9695314168930054,
        "min_ms": 0.9695314168930054,
        "max_ms": 0.9695314168930054,
        "compile_time": 1.2743794918060303
    },
    {
        "BLOCK_SIZE_M": 128,
        "BLOCK_SIZE_N": 64,
        "BLOCK_SIZE_K": 16,
        "GROUP_SIZE_M": 8,
        "num_stages": 8,
        "num_warps": 4,
        "ms": 0.9738441705703735,
        "min_ms": 0.9738441705703735,
        "max_ms": 0.9738441705703735,
        "compile_time": 1.2972087860107422
    },
    {
        "BLOCK_SIZE_M": 64,
        "BLOCK_SIZE_N": 128,
        "BLOCK_SIZE_K": 128,
        "GROUP_SIZE_M": 8,
        "num_stages": 3,
        "num_warps": 16,
        "ms": 0.9738621711730957,
        "min_ms": 0.9738621711730957,
        "max_ms": 0.9738621711730957,
        "compile_time": 1.2642269134521484
    },
    {
        "BLOCK_SIZE_M": 256,
        "BLOCK_SIZE_N": 64,
        "BLOCK_SIZE_K": 32,
        "GROUP_SIZE_M": 8,
        "num_stages": 1,
        "num_warps": 4,
        "ms": 0.9787740707397461,
        "min_ms": 0.9787740707397461,
        "max_ms": 0.9787740707397461,
        "compile_time": 1.2834033966064453
    },
    {
        "BLOCK_SIZE_M": 128,
        "BLOCK_SIZE_N": 64,
        "BLOCK_SIZE_K": 64,
        "GROUP_SIZE_M": 8,
        "num_stages": 3,
        "num_warps": 16,
        "ms": 0.981127142906189,
        "min_ms": 0.981127142906189,
        "max_ms": 0.981127142906189,
        "compile_time": 1.2863762378692627
    },
    {
        "BLOCK_SIZE_M": 128,
        "BLOCK_SIZE_N": 256,
        "BLOCK_SIZE_K": 64,
        "GROUP_SIZE_M": 8,
        "num_stages": 1,
        "num_warps": 16,
        "ms": 0.9834282994270325,
        "min_ms": 0.9834282994270325,
        "max_ms": 0.9834282994270325,
        "compile_time": 1.2667627334594727
    },
    {
        "BLOCK_SIZE_M": 64,
        "BLOCK_SIZE_N": 64,
        "BLOCK_SIZE_K": 128,
        "GROUP_SIZE_M": 8,
        "num_stages": 3,
        "num_warps": 8,
        "ms": 0.9838730096817017,
        "min_ms": 0.9838730096817017,
        "max_ms": 0.9838730096817017,
        "compile_time": 1.283665418624878
    },
    {
        "BLOCK_SIZE_M": 64,
        "BLOCK_SIZE_N": 128,
        "BLOCK_SIZE_K": 128,
        "GROUP_SIZE_M": 8,
        "num_stages": 4,
        "num_warps": 16,
        "ms": 0.9839390516281128,
        "min_ms": 0.9839390516281128,
        "max_ms": 0.9839390516281128,
        "compile_time": 1.2579212188720703
    },
    {
        "BLOCK_SIZE_M": 512,
        "BLOCK_SIZE_N": 32,
        "BLOCK_SIZE_K": 32,
        "GROUP_SIZE_M": 8,
        "num_stages": 4,
        "num_warps": 8,
        "ms": 0.9843476414680481,
        "min_ms": 0.9843476414680481,
        "max_ms": 0.9843476414680481,
        "compile_time": 2.317586660385132
    },
    {
        "BLOCK_SIZE_M": 128,
        "BLOCK_SIZE_N": 64,
        "BLOCK_SIZE_K": 64,
        "GROUP_SIZE_M": 8,
        "num_stages": 4,
        "num_warps": 16,
        "ms": 0.9849364161491394,
        "min_ms": 0.9849364161491394,
        "max_ms": 0.9849364161491394,
        "compile_time": 1.2900805473327637
    },
    {
        "BLOCK_SIZE_M": 128,
        "BLOCK_SIZE_N": 64,
        "BLOCK_SIZE_K": 32,
        "GROUP_SIZE_M": 8,
        "num_stages": 8,
        "num_warps": 2,
        "ms": 0.9852147102355957,
        "min_ms": 0.9852147102355957,
        "max_ms": 0.9852147102355957,
        "compile_time": 1.2623803615570068
    },
    {
        "BLOCK_SIZE_M": 256,
        "BLOCK_SIZE_N": 32,
        "BLOCK_SIZE_K": 64,
        "GROUP_SIZE_M": 8,
        "num_stages": 3,
        "num_warps": 4,
        "ms": 0.9853373765945435,
        "min_ms": 0.9853373765945435,
        "max_ms": 0.9853373765945435,
        "compile_time": 1.3302946090698242
    },
    {
        "BLOCK_SIZE_M": 256,
        "BLOCK_SIZE_N": 32,
        "BLOCK_SIZE_K": 32,
        "GROUP_SIZE_M": 8,
        "num_stages": 6,
        "num_warps": 4,
        "ms": 0.9855015873908997,
        "min_ms": 0.9855015873908997,
        "max_ms": 0.9855015873908997,
        "compile_time": 1.3487260341644287
    },
    {
        "BLOCK_SIZE_M": 64,
        "BLOCK_SIZE_N": 64,
        "BLOCK_SIZE_K": 64,
        "GROUP_SIZE_M": 8,
        "num_stages": 3,
        "num_warps": 8,
        "ms": 0.9866477251052856,
        "min_ms": 0.9866477251052856,
        "max_ms": 0.9866477251052856,
        "compile_time": 1.2869064807891846
    },
    {
        "BLOCK_SIZE_M": 256,
        "BLOCK_SIZE_N": 32,
        "BLOCK_SIZE_K": 64,
        "GROUP_SIZE_M": 8,
        "num_stages": 3,
        "num_warps": 8,
        "ms": 0.9875078201293945,
        "min_ms": 0.9875078201293945,
        "max_ms": 0.9875078201293945,
        "compile_time": 1.3481543064117432
    },
    {
        "BLOCK_SIZE_M": 64,
        "BLOCK_SIZE_N": 64,
        "BLOCK_SIZE_K": 128,
        "GROUP_SIZE_M": 8,
        "num_stages": 3,
        "num_warps": 2,
        "ms": 0.9880945086479187,
        "min_ms": 0.9880945086479187,
        "max_ms": 0.9880945086479187,
        "compile_time": 1.252821922302246
    },
    {
        "BLOCK_SIZE_M": 256,
        "BLOCK_SIZE_N": 32,
        "BLOCK_SIZE_K": 64,
        "GROUP_SIZE_M": 8,
        "num_stages": 5,
        "num_warps": 8,
        "ms": 0.9883426427841187,
        "min_ms": 0.9883426427841187,
        "max_ms": 0.9883426427841187,
        "compile_time": 1.3390483856201172
    },
    {
        "BLOCK_SIZE_M": 256,
        "BLOCK_SIZE_N": 128,
        "BLOCK_SIZE_K": 16,
        "GROUP_SIZE_M": 8,
        "num_stages": 5,
        "num_warps": 16,
        "ms": 0.9890750646591187,
        "min_ms": 0.9890750646591187,
        "max_ms": 0.9890750646591187,
        "compile_time": 1.9659311771392822
    },
    {
        "BLOCK_SIZE_M": 64,
        "BLOCK_SIZE_N": 64,
        "BLOCK_SIZE_K": 64,
        "GROUP_SIZE_M": 8,
        "num_stages": 4,
        "num_warps": 8,
        "ms": 0.9892942309379578,
        "min_ms": 0.9892942309379578,
        "max_ms": 0.9892942309379578,
        "compile_time": 1.2876203060150146
    },
    {
        "BLOCK_SIZE_M": 128,
        "BLOCK_SIZE_N": 256,
        "BLOCK_SIZE_K": 16,
        "GROUP_SIZE_M": 8,
        "num_stages": 4,
        "num_warps": 16,
        "ms": 0.9894648790359497,
        "min_ms": 0.9894648790359497,
        "max_ms": 0.9894648790359497,
        "compile_time": 1.2804527282714844
    },
    {
        "BLOCK_SIZE_M": 256,
        "BLOCK_SIZE_N": 128,
        "BLOCK_SIZE_K": 16,
        "GROUP_SIZE_M": 8,
        "num_stages": 3,
        "num_warps": 16,
        "ms": 0.9897493124008179,
        "min_ms": 0.9897493124008179,
        "max_ms": 0.9897493124008179,
        "compile_time": 1.9480507373809814
    },
    {
        "BLOCK_SIZE_M": 64,
        "BLOCK_SIZE_N": 128,
        "BLOCK_SIZE_K": 64,
        "GROUP_SIZE_M": 8,
        "num_stages": 1,
        "num_warps": 2,
        "ms": 0.9898975491523743,
        "min_ms": 0.9898975491523743,
        "max_ms": 0.9898975491523743,
        "compile_time": 1.231628179550171
    },
    {
        "BLOCK_SIZE_M": 64,
        "BLOCK_SIZE_N": 64,
        "BLOCK_SIZE_K": 32,
        "GROUP_SIZE_M": 8,
        "num_stages": 2,
        "num_warps": 4,
        "ms": 0.991123378276825,
        "min_ms": 0.991123378276825,
        "max_ms": 0.991123378276825,
        "compile_time": 1.2582879066467285
    },
    {
        "BLOCK_SIZE_M": 256,
        "BLOCK_SIZE_N": 32,
        "BLOCK_SIZE_K": 32,
        "GROUP_SIZE_M": 8,
        "num_stages": 7,
        "num_warps": 4,
        "ms": 0.9915251731872559,
        "min_ms": 0.9915251731872559,
        "max_ms": 0.9915251731872559,
        "compile_time": 1.345956563949585
    },
    {
        "BLOCK_SIZE_M": 256,
        "BLOCK_SIZE_N": 32,
        "BLOCK_SIZE_K": 32,
        "GROUP_SIZE_M": 8,
        "num_stages": 3,
        "num_warps": 2,
        "ms": 0.9920390844345093,
        "min_ms": 0.9920390844345093,
        "max_ms": 0.9920390844345093,
        "compile_time": 1.3477466106414795
    },
    {
        "BLOCK_SIZE_M": 64,
        "BLOCK_SIZE_N": 512,
        "BLOCK_SIZE_K": 64,
        "GROUP_SIZE_M": 8,
        "num_stages": 2,
        "num_warps": 8,
        "ms": 0.9926997423171997,
        "min_ms": 0.9926997423171997,
        "max_ms": 0.9926997423171997,
        "compile_time": 2.5142319202423096
    },
    {
        "BLOCK_SIZE_M": 256,
        "BLOCK_SIZE_N": 32,
        "BLOCK_SIZE_K": 64,
        "GROUP_SIZE_M": 8,
        "num_stages": 4,
        "num_warps": 4,
        "ms": 0.9928559064865112,
        "min_ms": 0.9928559064865112,
        "max_ms": 0.9928559064865112,
        "compile_time": 1.3168225288391113
    },
    {
        "BLOCK_SIZE_M": 256,
        "BLOCK_SIZE_N": 32,
        "BLOCK_SIZE_K": 32,
        "GROUP_SIZE_M": 8,
        "num_stages": 8,
        "num_warps": 4,
        "ms": 0.9935650825500488,
        "min_ms": 0.9935650825500488,
        "max_ms": 0.9935650825500488,
        "compile_time": 1.347034215927124
    },
    {
        "BLOCK_SIZE_M": 512,
        "BLOCK_SIZE_N": 32,
        "BLOCK_SIZE_K": 32,
        "GROUP_SIZE_M": 8,
        "num_stages": 5,
        "num_warps": 8,
        "ms": 0.9956172108650208,
        "min_ms": 0.9956172108650208,
        "max_ms": 0.9956172108650208,
        "compile_time": 1.3777379989624023
    },
    {
        "BLOCK_SIZE_M": 32,
        "BLOCK_SIZE_N": 512,
        "BLOCK_SIZE_K": 16,
        "GROUP_SIZE_M": 8,
        "num_stages": 5,
        "num_warps": 4,
        "ms": 0.9966530799865723,
        "min_ms": 0.9966530799865723,
        "max_ms": 0.9966530799865723,
        "compile_time": 1.2354626655578613
    },
    {
        "BLOCK_SIZE_M": 512,
        "BLOCK_SIZE_N": 32,
        "BLOCK_SIZE_K": 64,
        "GROUP_SIZE_M": 8,
        "num_stages": 3,
        "num_warps": 8,
        "ms": 0.9984248280525208,
        "min_ms": 0.9984248280525208,
        "max_ms": 0.9984248280525208,
        "compile_time": 2.6054770946502686
    },
    {
        "BLOCK_SIZE_M": 256,
        "BLOCK_SIZE_N": 32,
        "BLOCK_SIZE_K": 64,
        "GROUP_SIZE_M": 8,
        "num_stages": 4,
        "num_warps": 8,
        "ms": 0.9985781908035278,
        "min_ms": 0.9985781908035278,
        "max_ms": 0.9985781908035278,
        "compile_time": 1.3356568813323975
    },
    {
        "BLOCK_SIZE_M": 32,
        "BLOCK_SIZE_N": 512,
        "BLOCK_SIZE_K": 32,
        "GROUP_SIZE_M": 8,
        "num_stages": 5,
        "num_warps": 8,
        "ms": 1.0011265277862549,
        "min_ms": 1.0011265277862549,
        "max_ms": 1.0011265277862549,
        "compile_time": 1.231630802154541
    },
    {
        "BLOCK_SIZE_M": 256,
        "BLOCK_SIZE_N": 32,
        "BLOCK_SIZE_K": 128,
        "GROUP_SIZE_M": 8,
        "num_stages": 3,
        "num_warps": 4,
        "ms": 1.0015122890472412,
        "min_ms": 1.0015122890472412,
        "max_ms": 1.0015122890472412,
        "compile_time": 1.1393463611602783
    },
    {
        "BLOCK_SIZE_M": 128,
        "BLOCK_SIZE_N": 128,
        "BLOCK_SIZE_K": 256,
        "GROUP_SIZE_M": 8,
        "num_stages": 2,
        "num_warps": 16,
        "ms": 1.0025455951690674,
        "min_ms": 1.0025455951690674,
        "max_ms": 1.0025455951690674,
        "compile_time": 1.2736563682556152
    },
    {
        "BLOCK_SIZE_M": 128,
        "BLOCK_SIZE_N": 256,
        "BLOCK_SIZE_K": 16,
        "GROUP_SIZE_M": 8,
        "num_stages": 6,
        "num_warps": 16,
        "ms": 1.002567172050476,
        "min_ms": 1.002567172050476,
        "max_ms": 1.002567172050476,
        "compile_time": 1.272207260131836
    },
    {
        "BLOCK_SIZE_M": 128,
        "BLOCK_SIZE_N": 256,
        "BLOCK_SIZE_K": 16,
        "GROUP_SIZE_M": 8,
        "num_stages": 7,
        "num_warps": 16,
        "ms": 1.0036964416503906,
        "min_ms": 1.0036964416503906,
        "max_ms": 1.0036964416503906,
        "compile_time": 1.2637324333190918
    },
    {
        "BLOCK_SIZE_M": 128,
        "BLOCK_SIZE_N": 256,
        "BLOCK_SIZE_K": 16,
        "GROUP_SIZE_M": 8,
        "num_stages": 8,
        "num_warps": 16,
        "ms": 1.0040072202682495,
        "min_ms": 1.0040072202682495,
        "max_ms": 1.0040072202682495,
        "compile_time": 1.931056261062622
    },
    {
        "BLOCK_SIZE_M": 32,
        "BLOCK_SIZE_N": 512,
        "BLOCK_SIZE_K": 32,
        "GROUP_SIZE_M": 8,
        "num_stages": 3,
        "num_warps": 4,
        "ms": 1.0042368173599243,
        "min_ms": 1.0042368173599243,
        "max_ms": 1.0042368173599243,
        "compile_time": 1.2230703830718994
    },
    {
        "BLOCK_SIZE_M": 256,
        "BLOCK_SIZE_N": 128,
        "BLOCK_SIZE_K": 16,
        "GROUP_SIZE_M": 8,
        "num_stages": 4,
        "num_warps": 16,
        "ms": 1.0043565034866333,
        "min_ms": 1.0043565034866333,
        "max_ms": 1.0043565034866333,
        "compile_time": 1.3087775707244873
    },
    {
        "BLOCK_SIZE_M": 512,
        "BLOCK_SIZE_N": 64,
        "BLOCK_SIZE_K": 32,
        "GROUP_SIZE_M": 8,
        "num_stages": 2,
        "num_warps": 8,
        "ms": 1.004483938217163,
        "min_ms": 1.004483938217163,
        "max_ms": 1.004483938217163,
        "compile_time": 2.5516955852508545
    },
    {
        "BLOCK_SIZE_M": 256,
        "BLOCK_SIZE_N": 64,
        "BLOCK_SIZE_K": 64,
        "GROUP_SIZE_M": 8,
        "num_stages": 2,
        "num_warps": 8,
        "ms": 1.004822015762329,
        "min_ms": 1.004822015762329,
        "max_ms": 1.004822015762329,
        "compile_time": 1.303088903427124
    },
    {
        "BLOCK_SIZE_M": 32,
        "BLOCK_SIZE_N": 512,
        "BLOCK_SIZE_K": 16,
        "GROUP_SIZE_M": 8,
        "num_stages": 4,
        "num_warps": 4,
        "ms": 1.005348563194275,
        "min_ms": 1.005348563194275,
        "max_ms": 1.005348563194275,
        "compile_time": 1.238412857055664
    },
    {
        "BLOCK_SIZE_M": 256,
        "BLOCK_SIZE_N": 128,
        "BLOCK_SIZE_K": 16,
        "GROUP_SIZE_M": 8,
        "num_stages": 6,
        "num_warps": 16,
        "ms": 1.0056887865066528,
        "min_ms": 1.0056887865066528,
        "max_ms": 1.0056887865066528,
        "compile_time": 1.9822449684143066
    },
    {
        "BLOCK_SIZE_M": 256,
        "BLOCK_SIZE_N": 128,
        "BLOCK_SIZE_K": 16,
        "GROUP_SIZE_M": 8,
        "num_stages": 7,
        "num_warps": 16,
        "ms": 1.006803274154663,
        "min_ms": 1.006803274154663,
        "max_ms": 1.006803274154663,
        "compile_time": 1.3089666366577148
    },
    {
        "BLOCK_SIZE_M": 64,
        "BLOCK_SIZE_N": 64,
        "BLOCK_SIZE_K": 64,
        "GROUP_SIZE_M": 8,
        "num_stages": 5,
        "num_warps": 8,
        "ms": 1.0077710151672363,
        "min_ms": 1.0077710151672363,
        "max_ms": 1.0077710151672363,
        "compile_time": 1.2939658164978027
    },
    {
        "BLOCK_SIZE_M": 256,
        "BLOCK_SIZE_N": 128,
        "BLOCK_SIZE_K": 16,
        "GROUP_SIZE_M": 8,
        "num_stages": 8,
        "num_warps": 16,
        "ms": 1.008307933807373,
        "min_ms": 1.008307933807373,
        "max_ms": 1.008307933807373,
        "compile_time": 1.9860241413116455
    },
    {
        "BLOCK_SIZE_M": 128,
        "BLOCK_SIZE_N": 128,
        "BLOCK_SIZE_K": 64,
        "GROUP_SIZE_M": 8,
        "num_stages": 3,
        "num_warps": 32,
        "ms": 1.009508728981018,
        "min_ms": 1.009508728981018,
        "max_ms": 1.009508728981018,
        "compile_time": 1.2751743793487549
    },
    {
        "BLOCK_SIZE_M": 256,
        "BLOCK_SIZE_N": 64,
        "BLOCK_SIZE_K": 16,
        "GROUP_SIZE_M": 8,
        "num_stages": 6,
        "num_warps": 8,
        "ms": 1.0095274448394775,
        "min_ms": 1.0095274448394775,
        "max_ms": 1.0095274448394775,
        "compile_time": 1.3280918598175049
    },
    {
        "BLOCK_SIZE_M": 64,
        "BLOCK_SIZE_N": 512,
        "BLOCK_SIZE_K": 64,
        "GROUP_SIZE_M": 8,
        "num_stages": 3,
        "num_warps": 16,
        "ms": 1.0096399784088135,
        "min_ms": 1.0096399784088135,
        "max_ms": 1.0096399784088135,
        "compile_time": 2.1417534351348877
    },
    {
        "BLOCK_SIZE_M": 64,
        "BLOCK_SIZE_N": 64,
        "BLOCK_SIZE_K": 64,
        "GROUP_SIZE_M": 8,
        "num_stages": 6,
        "num_warps": 8,
        "ms": 1.0097181797027588,
        "min_ms": 1.0097181797027588,
        "max_ms": 1.0097181797027588,
        "compile_time": 1.2905480861663818
    },
    {
        "BLOCK_SIZE_M": 256,
        "BLOCK_SIZE_N": 64,
        "BLOCK_SIZE_K": 16,
        "GROUP_SIZE_M": 8,
        "num_stages": 4,
        "num_warps": 8,
        "ms": 1.0102272033691406,
        "min_ms": 1.0102272033691406,
        "max_ms": 1.0102272033691406,
        "compile_time": 1.3209023475646973
    },
    {
        "BLOCK_SIZE_M": 256,
        "BLOCK_SIZE_N": 64,
        "BLOCK_SIZE_K": 16,
        "GROUP_SIZE_M": 8,
        "num_stages": 5,
        "num_warps": 8,
        "ms": 1.010536551475525,
        "min_ms": 1.010536551475525,
        "max_ms": 1.010536551475525,
        "compile_time": 1.3572807312011719
    },
    {
        "BLOCK_SIZE_M": 256,
        "BLOCK_SIZE_N": 64,
        "BLOCK_SIZE_K": 128,
        "GROUP_SIZE_M": 8,
        "num_stages": 2,
        "num_warps": 16,
        "ms": 1.0114309787750244,
        "min_ms": 1.0114309787750244,
        "max_ms": 1.0114309787750244,
        "compile_time": 1.3082327842712402
    },
    {
        "BLOCK_SIZE_M": 256,
        "BLOCK_SIZE_N": 32,
        "BLOCK_SIZE_K": 128,
        "GROUP_SIZE_M": 8,
        "num_stages": 2,
        "num_warps": 4,
        "ms": 1.0118207931518555,
        "min_ms": 1.0118207931518555,
        "max_ms": 1.0118207931518555,
        "compile_time": 1.3094820976257324
    },
    {
        "BLOCK_SIZE_M": 32,
        "BLOCK_SIZE_N": 256,
        "BLOCK_SIZE_K": 32,
        "GROUP_SIZE_M": 8,
        "num_stages": 5,
        "num_warps": 4,
        "ms": 1.0118746757507324,
        "min_ms": 1.0118746757507324,
        "max_ms": 1.0118746757507324,
        "compile_time": 1.287367343902588
    },
    {
        "BLOCK_SIZE_M": 64,
        "BLOCK_SIZE_N": 256,
        "BLOCK_SIZE_K": 64,
        "GROUP_SIZE_M": 8,
        "num_stages": 2,
        "num_warps": 8,
        "ms": 1.01276433467865,
        "min_ms": 1.01276433467865,
        "max_ms": 1.01276433467865,
        "compile_time": 1.240311861038208
    },
    {
        "BLOCK_SIZE_M": 64,
        "BLOCK_SIZE_N": 256,
        "BLOCK_SIZE_K": 16,
        "GROUP_SIZE_M": 8,
        "num_stages": 3,
        "num_warps": 16,
        "ms": 1.0129387378692627,
        "min_ms": 1.0129387378692627,
        "max_ms": 1.0129387378692627,
        "compile_time": 1.3096349239349365
    },
    {
        "BLOCK_SIZE_M": 256,
        "BLOCK_SIZE_N": 32,
        "BLOCK_SIZE_K": 128,
        "GROUP_SIZE_M": 8,
        "num_stages": 3,
        "num_warps": 8,
        "ms": 1.012951374053955,
        "min_ms": 1.012951374053955,
        "max_ms": 1.012951374053955,
        "compile_time": 1.3147122859954834
    },
    {
        "BLOCK_SIZE_M": 128,
        "BLOCK_SIZE_N": 128,
        "BLOCK_SIZE_K": 64,
        "GROUP_SIZE_M": 8,
        "num_stages": 4,
        "num_warps": 32,
        "ms": 1.0131433010101318,
        "min_ms": 1.0131433010101318,
        "max_ms": 1.0131433010101318,
        "compile_time": 1.2703673839569092
    },
    {
        "BLOCK_SIZE_M": 256,
        "BLOCK_SIZE_N": 64,
        "BLOCK_SIZE_K": 16,
        "GROUP_SIZE_M": 8,
        "num_stages": 7,
        "num_warps": 8,
        "ms": 1.0134245157241821,
        "min_ms": 1.0134245157241821,
        "max_ms": 1.0134245157241821,
        "compile_time": 1.3000869750976562
    },
    {
        "BLOCK_SIZE_M": 32,
        "BLOCK_SIZE_N": 512,
        "BLOCK_SIZE_K": 16,
        "GROUP_SIZE_M": 8,
        "num_stages": 5,
        "num_warps": 8,
        "ms": 1.0134868621826172,
        "min_ms": 1.0134868621826172,
        "max_ms": 1.0134868621826172,
        "compile_time": 1.2412073612213135
    },
    {
        "BLOCK_SIZE_M": 256,
        "BLOCK_SIZE_N": 64,
        "BLOCK_SIZE_K": 16,
        "GROUP_SIZE_M": 8,
        "num_stages": 3,
        "num_warps": 8,
        "ms": 1.0137685537338257,
        "min_ms": 1.0137685537338257,
        "max_ms": 1.0137685537338257,
        "compile_time": 1.3026611804962158
    },
    {
        "BLOCK_SIZE_M": 256,
        "BLOCK_SIZE_N": 64,
        "BLOCK_SIZE_K": 16,
        "GROUP_SIZE_M": 8,
        "num_stages": 8,
        "num_warps": 8,
        "ms": 1.0142271518707275,
        "min_ms": 1.0142271518707275,
        "max_ms": 1.0142271518707275,
        "compile_time": 1.3198347091674805
    },
    {
        "BLOCK_SIZE_M": 64,
        "BLOCK_SIZE_N": 128,
        "BLOCK_SIZE_K": 64,
        "GROUP_SIZE_M": 8,
        "num_stages": 1,
        "num_warps": 4,
        "ms": 1.0142484903335571,
        "min_ms": 1.0142484903335571,
        "max_ms": 1.0142484903335571,
        "compile_time": 1.243868112564087
    },
    {
        "BLOCK_SIZE_M": 128,
        "BLOCK_SIZE_N": 128,
        "BLOCK_SIZE_K": 64,
        "GROUP_SIZE_M": 8,
        "num_stages": 5,
        "num_warps": 32,
        "ms": 1.015852451324463,
        "min_ms": 1.015852451324463,
        "max_ms": 1.015852451324463,
        "compile_time": 1.2623651027679443
    },
    {
        "BLOCK_SIZE_M": 64,
        "BLOCK_SIZE_N": 256,
        "BLOCK_SIZE_K": 128,
        "GROUP_SIZE_M": 8,
        "num_stages": 2,
        "num_warps": 8,
        "ms": 1.0158733129501343,
        "min_ms": 1.0158733129501343,
        "max_ms": 1.0158733129501343,
        "compile_time": 1.2381412982940674
    },
    {
        "BLOCK_SIZE_M": 32,
        "BLOCK_SIZE_N": 256,
        "BLOCK_SIZE_K": 16,
        "GROUP_SIZE_M": 8,
        "num_stages": 4,
        "num_warps": 2,
        "ms": 1.0161402225494385,
        "min_ms": 1.0161402225494385,
        "max_ms": 1.0161402225494385,
        "compile_time": 2.1851766109466553
    },
    {
        "BLOCK_SIZE_M": 64,
        "BLOCK_SIZE_N": 256,
        "BLOCK_SIZE_K": 16,
        "GROUP_SIZE_M": 8,
        "num_stages": 4,
        "num_warps": 16,
        "ms": 1.0163556337356567,
        "min_ms": 1.0163556337356567,
        "max_ms": 1.0163556337356567,
        "compile_time": 1.2796306610107422
    },
    {
        "BLOCK_SIZE_M": 32,
        "BLOCK_SIZE_N": 512,
        "BLOCK_SIZE_K": 16,
        "GROUP_SIZE_M": 8,
        "num_stages": 4,
        "num_warps": 8,
        "ms": 1.0164579153060913,
        "min_ms": 1.0164579153060913,
        "max_ms": 1.0164579153060913,
        "compile_time": 1.2318215370178223
    },
    {
        "BLOCK_SIZE_M": 64,
        "BLOCK_SIZE_N": 128,
        "BLOCK_SIZE_K": 64,
        "GROUP_SIZE_M": 8,
        "num_stages": 3,
        "num_warps": 16,
        "ms": 1.0176153182983398,
        "min_ms": 1.0176153182983398,
        "max_ms": 1.0176153182983398,
        "compile_time": 1.255603313446045
    },
    {
        "BLOCK_SIZE_M": 128,
        "BLOCK_SIZE_N": 64,
        "BLOCK_SIZE_K": 128,
        "GROUP_SIZE_M": 8,
        "num_stages": 1,
        "num_warps": 8,
        "ms": 1.0179235935211182,
        "min_ms": 1.0179235935211182,
        "max_ms": 1.0179235935211182,
        "compile_time": 1.2930982112884521
    },
    {
        "BLOCK_SIZE_M": 32,
        "BLOCK_SIZE_N": 256,
        "BLOCK_SIZE_K": 32,
        "GROUP_SIZE_M": 8,
        "num_stages": 3,
        "num_warps": 4,
        "ms": 1.0180144309997559,
        "min_ms": 1.0180144309997559,
        "max_ms": 1.0180144309997559,
        "compile_time": 1.2272140979766846
    },
    {
        "BLOCK_SIZE_M": 64,
        "BLOCK_SIZE_N": 64,
        "BLOCK_SIZE_K": 256,
        "GROUP_SIZE_M": 8,
        "num_stages": 2,
        "num_warps": 4,
        "ms": 1.0181410312652588,
        "min_ms": 1.0181410312652588,
        "max_ms": 1.0181410312652588,
        "compile_time": 1.254516839981079
    },
    {
        "BLOCK_SIZE_M": 512,
        "BLOCK_SIZE_N": 32,
        "BLOCK_SIZE_K": 32,
        "GROUP_SIZE_M": 8,
        "num_stages": 3,
        "num_warps": 8,
        "ms": 1.0187442302703857,
        "min_ms": 1.0187442302703857,
        "max_ms": 1.0187442302703857,
        "compile_time": 1.3662135601043701
    },
    {
        "BLOCK_SIZE_M": 256,
        "BLOCK_SIZE_N": 32,
        "BLOCK_SIZE_K": 32,
        "GROUP_SIZE_M": 8,
        "num_stages": 4,
        "num_warps": 8,
        "ms": 1.0190587043762207,
        "min_ms": 1.0190587043762207,
        "max_ms": 1.0190587043762207,
        "compile_time": 1.372269868850708
    },
    {
        "BLOCK_SIZE_M": 64,
        "BLOCK_SIZE_N": 256,
        "BLOCK_SIZE_K": 16,
        "GROUP_SIZE_M": 8,
        "num_stages": 5,
        "num_warps": 16,
        "ms": 1.019167184829712,
        "min_ms": 1.019167184829712,
        "max_ms": 1.019167184829712,
        "compile_time": 1.2664005756378174
    },
    {
        "BLOCK_SIZE_M": 64,
        "BLOCK_SIZE_N": 256,
        "BLOCK_SIZE_K": 16,
        "GROUP_SIZE_M": 8,
        "num_stages": 7,
        "num_warps": 16,
        "ms": 1.0199229717254639,
        "min_ms": 1.0199229717254639,
        "max_ms": 1.0199229717254639,
        "compile_time": 1.268411636352539
    },
    {
        "BLOCK_SIZE_M": 64,
        "BLOCK_SIZE_N": 128,
        "BLOCK_SIZE_K": 64,
        "GROUP_SIZE_M": 8,
        "num_stages": 4,
        "num_warps": 16,
        "ms": 1.0199546813964844,
        "min_ms": 1.0199546813964844,
        "max_ms": 1.0199546813964844,
        "compile_time": 1.2579410076141357
    },
    {
        "BLOCK_SIZE_M": 32,
        "BLOCK_SIZE_N": 256,
        "BLOCK_SIZE_K": 32,
        "GROUP_SIZE_M": 8,
        "num_stages": 4,
        "num_warps": 4,
        "ms": 1.0199652910232544,
        "min_ms": 1.0199652910232544,
        "max_ms": 1.0199652910232544,
        "compile_time": 1.2321269512176514
    },
    {
        "BLOCK_SIZE_M": 64,
        "BLOCK_SIZE_N": 128,
        "BLOCK_SIZE_K": 64,
        "GROUP_SIZE_M": 8,
        "num_stages": 5,
        "num_warps": 16,
        "ms": 1.0201869010925293,
        "min_ms": 1.0201869010925293,
        "max_ms": 1.0201869010925293,
        "compile_time": 1.2590396404266357
    },
    {
        "BLOCK_SIZE_M": 64,
        "BLOCK_SIZE_N": 256,
        "BLOCK_SIZE_K": 16,
        "GROUP_SIZE_M": 8,
        "num_stages": 8,
        "num_warps": 16,
        "ms": 1.020508050918579,
        "min_ms": 1.020508050918579,
        "max_ms": 1.020508050918579,
        "compile_time": 1.2985203266143799
    },
    {
        "BLOCK_SIZE_M": 64,
        "BLOCK_SIZE_N": 256,
        "BLOCK_SIZE_K": 16,
        "GROUP_SIZE_M": 8,
        "num_stages": 6,
        "num_warps": 16,
        "ms": 1.0213228464126587,
        "min_ms": 1.0213228464126587,
        "max_ms": 1.0213228464126587,
        "compile_time": 1.2775745391845703
    },
    {
        "BLOCK_SIZE_M": 64,
        "BLOCK_SIZE_N": 64,
        "BLOCK_SIZE_K": 64,
        "GROUP_SIZE_M": 8,
        "num_stages": 2,
        "num_warps": 2,
        "ms": 1.0216385126113892,
        "min_ms": 1.0216385126113892,
        "max_ms": 1.0216385126113892,
        "compile_time": 1.2472381591796875
    },
    {
        "BLOCK_SIZE_M": 128,
        "BLOCK_SIZE_N": 128,
        "BLOCK_SIZE_K": 64,
        "GROUP_SIZE_M": 8,
        "num_stages": 6,
        "num_warps": 32,
        "ms": 1.022078275680542,
        "min_ms": 1.022078275680542,
        "max_ms": 1.022078275680542,
        "compile_time": 1.2774124145507812
    },
    {
        "BLOCK_SIZE_M": 64,
        "BLOCK_SIZE_N": 128,
        "BLOCK_SIZE_K": 64,
        "GROUP_SIZE_M": 8,
        "num_stages": 6,
        "num_warps": 16,
        "ms": 1.022282361984253,
        "min_ms": 1.022282361984253,
        "max_ms": 1.022282361984253,
        "compile_time": 1.2526500225067139
    },
    {
        "BLOCK_SIZE_M": 32,
        "BLOCK_SIZE_N": 256,
        "BLOCK_SIZE_K": 64,
        "GROUP_SIZE_M": 8,
        "num_stages": 3,
        "num_warps": 4,
        "ms": 1.0232142210006714,
        "min_ms": 1.0232142210006714,
        "max_ms": 1.0232142210006714,
        "compile_time": 1.2328383922576904
    },
    {
        "BLOCK_SIZE_M": 32,
        "BLOCK_SIZE_N": 512,
        "BLOCK_SIZE_K": 32,
        "GROUP_SIZE_M": 8,
        "num_stages": 4,
        "num_warps": 8,
        "ms": 1.0232319831848145,
        "min_ms": 1.0232319831848145,
        "max_ms": 1.0232319831848145,
        "compile_time": 1.2216718196868896
    },
    {
        "BLOCK_SIZE_M": 32,
        "BLOCK_SIZE_N": 256,
        "BLOCK_SIZE_K": 16,
        "GROUP_SIZE_M": 8,
        "num_stages": 4,
        "num_warps": 4,
        "ms": 1.0232789516448975,
        "min_ms": 1.0232789516448975,
        "max_ms": 1.0232789516448975,
        "compile_time": 1.2325234413146973
    },
    {
        "BLOCK_SIZE_M": 32,
        "BLOCK_SIZE_N": 256,
        "BLOCK_SIZE_K": 16,
        "GROUP_SIZE_M": 8,
        "num_stages": 5,
        "num_warps": 2,
        "ms": 1.0236886739730835,
        "min_ms": 1.0236886739730835,
        "max_ms": 1.0236886739730835,
        "compile_time": 2.2316112518310547
    },
    {
        "BLOCK_SIZE_M": 32,
        "BLOCK_SIZE_N": 256,
        "BLOCK_SIZE_K": 64,
        "GROUP_SIZE_M": 8,
        "num_stages": 5,
        "num_warps": 4,
        "ms": 1.0242875814437866,
        "min_ms": 1.0242875814437866,
        "max_ms": 1.0242875814437866,
        "compile_time": 1.2442622184753418
    },
    {
        "BLOCK_SIZE_M": 32,
        "BLOCK_SIZE_N": 512,
        "BLOCK_SIZE_K": 16,
        "GROUP_SIZE_M": 8,
        "num_stages": 8,
        "num_warps": 4,
        "ms": 1.0251210927963257,
        "min_ms": 1.0251210927963257,
        "max_ms": 1.0251210927963257,
        "compile_time": 1.2331922054290771
    },
    {
        "BLOCK_SIZE_M": 32,
        "BLOCK_SIZE_N": 512,
        "BLOCK_SIZE_K": 16,
        "GROUP_SIZE_M": 8,
        "num_stages": 7,
        "num_warps": 4,
        "ms": 1.025389313697815,
        "min_ms": 1.025389313697815,
        "max_ms": 1.025389313697815,
        "compile_time": 1.238257884979248
    },
    {
        "BLOCK_SIZE_M": 32,
        "BLOCK_SIZE_N": 256,
        "BLOCK_SIZE_K": 32,
        "GROUP_SIZE_M": 8,
        "num_stages": 8,
        "num_warps": 4,
        "ms": 1.0255134105682373,
        "min_ms": 1.0255134105682373,
        "max_ms": 1.0255134105682373,
        "compile_time": 1.2584171295166016
    },
    {
        "BLOCK_SIZE_M": 32,
        "BLOCK_SIZE_N": 256,
        "BLOCK_SIZE_K": 32,
        "GROUP_SIZE_M": 8,
        "num_stages": 7,
        "num_warps": 4,
        "ms": 1.0264389514923096,
        "min_ms": 1.0264389514923096,
        "max_ms": 1.0264389514923096,
        "compile_time": 1.2477471828460693
    },
    {
        "BLOCK_SIZE_M": 32,
        "BLOCK_SIZE_N": 512,
        "BLOCK_SIZE_K": 16,
        "GROUP_SIZE_M": 8,
        "num_stages": 6,
        "num_warps": 4,
        "ms": 1.0265265703201294,
        "min_ms": 1.0265265703201294,
        "max_ms": 1.0265265703201294,
        "compile_time": 1.2170114517211914
    },
    {
        "BLOCK_SIZE_M": 256,
        "BLOCK_SIZE_N": 64,
        "BLOCK_SIZE_K": 128,
        "GROUP_SIZE_M": 8,
        "num_stages": 3,
        "num_warps": 32,
        "ms": 1.0269310474395752,
        "min_ms": 1.0269310474395752,
        "max_ms": 1.0269310474395752,
        "compile_time": 1.3033673763275146
    },
    {
        "BLOCK_SIZE_M": 256,
        "BLOCK_SIZE_N": 32,
        "BLOCK_SIZE_K": 32,
        "GROUP_SIZE_M": 8,
        "num_stages": 2,
        "num_warps": 2,
        "ms": 1.0271103382110596,
        "min_ms": 1.0271103382110596,
        "max_ms": 1.0271103382110596,
        "compile_time": 1.3279328346252441
    },
    {
        "BLOCK_SIZE_M": 512,
        "BLOCK_SIZE_N": 32,
        "BLOCK_SIZE_K": 64,
        "GROUP_SIZE_M": 8,
        "num_stages": 3,
        "num_warps": 16,
        "ms": 1.0277448892593384,
        "min_ms": 1.0277448892593384,
        "max_ms": 1.0277448892593384,
        "compile_time": 1.3719570636749268
    },
    {
        "BLOCK_SIZE_M": 32,
        "BLOCK_SIZE_N": 256,
        "BLOCK_SIZE_K": 16,
        "GROUP_SIZE_M": 8,
        "num_stages": 6,
        "num_warps": 2,
        "ms": 1.0280482769012451,
        "min_ms": 1.0280482769012451,
        "max_ms": 1.0280482769012451,
        "compile_time": 2.2933876514434814
    },
    {
        "BLOCK_SIZE_M": 256,
        "BLOCK_SIZE_N": 32,
        "BLOCK_SIZE_K": 32,
        "GROUP_SIZE_M": 8,
        "num_stages": 2,
        "num_warps": 4,
        "ms": 1.028106689453125,
        "min_ms": 1.028106689453125,
        "max_ms": 1.028106689453125,
        "compile_time": 1.328256607055664
    },
    {
        "BLOCK_SIZE_M": 512,
        "BLOCK_SIZE_N": 64,
        "BLOCK_SIZE_K": 32,
        "GROUP_SIZE_M": 8,
        "num_stages": 4,
        "num_warps": 16,
        "ms": 1.0282766819000244,
        "min_ms": 1.0282766819000244,
        "max_ms": 1.0282766819000244,
        "compile_time": 1.343533992767334
    },
    {
        "BLOCK_SIZE_M": 32,
        "BLOCK_SIZE_N": 256,
        "BLOCK_SIZE_K": 16,
        "GROUP_SIZE_M": 8,
        "num_stages": 3,
        "num_warps": 2,
        "ms": 1.0283482074737549,
        "min_ms": 1.0283482074737549,
        "max_ms": 1.0283482074737549,
        "compile_time": 2.1236636638641357
    },
    {
        "BLOCK_SIZE_M": 256,
        "BLOCK_SIZE_N": 32,
        "BLOCK_SIZE_K": 32,
        "GROUP_SIZE_M": 8,
        "num_stages": 5,
        "num_warps": 8,
        "ms": 1.0285999774932861,
        "min_ms": 1.0285999774932861,
        "max_ms": 1.0285999774932861,
        "compile_time": 1.3752388954162598
    },
    {
        "BLOCK_SIZE_M": 32,
        "BLOCK_SIZE_N": 512,
        "BLOCK_SIZE_K": 16,
        "GROUP_SIZE_M": 8,
        "num_stages": 3,
        "num_warps": 4,
        "ms": 1.0293571949005127,
        "min_ms": 1.0293571949005127,
        "max_ms": 1.0293571949005127,
        "compile_time": 1.214318037033081
    },
    {
        "BLOCK_SIZE_M": 64,
        "BLOCK_SIZE_N": 128,
        "BLOCK_SIZE_K": 64,
        "GROUP_SIZE_M": 8,
        "num_stages": 7,
        "num_warps": 16,
        "ms": 1.0296847820281982,
        "min_ms": 1.0296847820281982,
        "max_ms": 1.0296847820281982,
        "compile_time": 1.2494423389434814
    },
    {
        "BLOCK_SIZE_M": 32,
        "BLOCK_SIZE_N": 256,
        "BLOCK_SIZE_K": 32,
        "GROUP_SIZE_M": 8,
        "num_stages": 6,
        "num_warps": 4,
        "ms": 1.0303884744644165,
        "min_ms": 1.0303884744644165,
        "max_ms": 1.0303884744644165,
        "compile_time": 1.2418699264526367
    },
    {
        "BLOCK_SIZE_M": 32,
        "BLOCK_SIZE_N": 512,
        "BLOCK_SIZE_K": 16,
        "GROUP_SIZE_M": 8,
        "num_stages": 3,
        "num_warps": 8,
        "ms": 1.0306591987609863,
        "min_ms": 1.0306591987609863,
        "max_ms": 1.0306591987609863,
        "compile_time": 1.239621639251709
    },
    {
        "BLOCK_SIZE_M": 256,
        "BLOCK_SIZE_N": 32,
        "BLOCK_SIZE_K": 32,
        "GROUP_SIZE_M": 8,
        "num_stages": 3,
        "num_warps": 8,
        "ms": 1.0310430526733398,
        "min_ms": 1.0310430526733398,
        "max_ms": 1.0310430526733398,
        "compile_time": 1.3657829761505127
    },
    {
        "BLOCK_SIZE_M": 128,
        "BLOCK_SIZE_N": 64,
        "BLOCK_SIZE_K": 128,
        "GROUP_SIZE_M": 8,
        "num_stages": 1,
        "num_warps": 4,
        "ms": 1.0339603424072266,
        "min_ms": 1.0339603424072266,
        "max_ms": 1.0339603424072266,
        "compile_time": 1.2688984870910645
    },
    {
        "BLOCK_SIZE_M": 128,
        "BLOCK_SIZE_N": 64,
        "BLOCK_SIZE_K": 32,
        "GROUP_SIZE_M": 8,
        "num_stages": 1,
        "num_warps": 4,
        "ms": 1.0341910123825073,
        "min_ms": 1.0341910123825073,
        "max_ms": 1.0341910123825073,
        "compile_time": 1.2550148963928223
    },
    {
        "BLOCK_SIZE_M": 32,
        "BLOCK_SIZE_N": 256,
        "BLOCK_SIZE_K": 64,
        "GROUP_SIZE_M": 8,
        "num_stages": 3,
        "num_warps": 8,
        "ms": 1.0343223810195923,
        "min_ms": 1.0343223810195923,
        "max_ms": 1.0343223810195923,
        "compile_time": 1.2333121299743652
    },
    {
        "BLOCK_SIZE_M": 64,
        "BLOCK_SIZE_N": 64,
        "BLOCK_SIZE_K": 256,
        "GROUP_SIZE_M": 8,
        "num_stages": 3,
        "num_warps": 4,
        "ms": 1.036454439163208,
        "min_ms": 1.036454439163208,
        "max_ms": 1.036454439163208,
        "compile_time": 1.2714197635650635
    },
    {
        "BLOCK_SIZE_M": 128,
        "BLOCK_SIZE_N": 256,
        "BLOCK_SIZE_K": 64,
        "GROUP_SIZE_M": 8,
        "num_stages": 1,
        "num_warps": 8,
        "ms": 1.0368890762329102,
        "min_ms": 1.0368890762329102,
        "max_ms": 1.0368890762329102,
        "compile_time": 1.27604079246521
    },
    {
        "BLOCK_SIZE_M": 128,
        "BLOCK_SIZE_N": 64,
        "BLOCK_SIZE_K": 64,
        "GROUP_SIZE_M": 8,
        "num_stages": 5,
        "num_warps": 16,
        "ms": 1.0380505323410034,
        "min_ms": 1.0380505323410034,
        "max_ms": 1.0380505323410034,
        "compile_time": 1.2815613746643066
    },
    {
        "BLOCK_SIZE_M": 32,
        "BLOCK_SIZE_N": 512,
        "BLOCK_SIZE_K": 32,
        "GROUP_SIZE_M": 8,
        "num_stages": 5,
        "num_warps": 16,
        "ms": 1.038271188735962,
        "min_ms": 1.038271188735962,
        "max_ms": 1.038271188735962,
        "compile_time": 1.249450922012329
    },
    {
        "BLOCK_SIZE_M": 32,
        "BLOCK_SIZE_N": 512,
        "BLOCK_SIZE_K": 64,
        "GROUP_SIZE_M": 8,
        "num_stages": 3,
        "num_warps": 8,
        "ms": 1.0386970043182373,
        "min_ms": 1.0386970043182373,
        "max_ms": 1.0386970043182373,
        "compile_time": 1.207648515701294
    },
    {
        "BLOCK_SIZE_M": 128,
        "BLOCK_SIZE_N": 64,
        "BLOCK_SIZE_K": 64,
        "GROUP_SIZE_M": 8,
        "num_stages": 6,
        "num_warps": 16,
        "ms": 1.0394885540008545,
        "min_ms": 1.0394885540008545,
        "max_ms": 1.0394885540008545,
        "compile_time": 1.282362461090088
    },
    {
        "BLOCK_SIZE_M": 64,
        "BLOCK_SIZE_N": 64,
        "BLOCK_SIZE_K": 16,
        "GROUP_SIZE_M": 8,
        "num_stages": 5,
        "num_warps": 2,
        "ms": 1.040250301361084,
        "min_ms": 1.040250301361084,
        "max_ms": 1.040250301361084,
        "compile_time": 1.2767090797424316
    },
    {
        "BLOCK_SIZE_M": 32,
        "BLOCK_SIZE_N": 512,
        "BLOCK_SIZE_K": 32,
        "GROUP_SIZE_M": 8,
        "num_stages": 4,
        "num_warps": 16,
        "ms": 1.0419490337371826,
        "min_ms": 1.0419490337371826,
        "max_ms": 1.0419490337371826,
        "compile_time": 1.2269761562347412
    },
    {
        "BLOCK_SIZE_M": 32,
        "BLOCK_SIZE_N": 256,
        "BLOCK_SIZE_K": 64,
        "GROUP_SIZE_M": 8,
        "num_stages": 5,
        "num_warps": 8,
        "ms": 1.0423306226730347,
        "min_ms": 1.0423306226730347,
        "max_ms": 1.0423306226730347,
        "compile_time": 1.2405385971069336
    },
    {
        "BLOCK_SIZE_M": 256,
        "BLOCK_SIZE_N": 128,
        "BLOCK_SIZE_K": 128,
        "GROUP_SIZE_M": 8,
        "num_stages": 1,
        "num_warps": 8,
        "ms": 1.0427964925765991,
        "min_ms": 1.0427964925765991,
        "max_ms": 1.0427964925765991,
        "compile_time": 1.3001453876495361
    },
    {
        "BLOCK_SIZE_M": 32,
        "BLOCK_SIZE_N": 256,
        "BLOCK_SIZE_K": 32,
        "GROUP_SIZE_M": 8,
        "num_stages": 4,
        "num_warps": 8,
        "ms": 1.044076681137085,
        "min_ms": 1.044076681137085,
        "max_ms": 1.044076681137085,
        "compile_time": 1.2542760372161865
    },
    {
        "BLOCK_SIZE_M": 64,
        "BLOCK_SIZE_N": 64,
        "BLOCK_SIZE_K": 16,
        "GROUP_SIZE_M": 8,
        "num_stages": 7,
        "num_warps": 2,
        "ms": 1.044623613357544,
        "min_ms": 1.044623613357544,
        "max_ms": 1.044623613357544,
        "compile_time": 1.2871849536895752
    },
    {
        "BLOCK_SIZE_M": 32,
        "BLOCK_SIZE_N": 256,
        "BLOCK_SIZE_K": 16,
        "GROUP_SIZE_M": 8,
        "num_stages": 6,
        "num_warps": 4,
        "ms": 1.045512318611145,
        "min_ms": 1.045512318611145,
        "max_ms": 1.045512318611145,
        "compile_time": 1.2668092250823975
    },
    {
        "BLOCK_SIZE_M": 32,
        "BLOCK_SIZE_N": 256,
        "BLOCK_SIZE_K": 32,
        "GROUP_SIZE_M": 8,
        "num_stages": 5,
        "num_warps": 8,
        "ms": 1.0458204746246338,
        "min_ms": 1.0458204746246338,
        "max_ms": 1.0458204746246338,
        "compile_time": 1.264695405960083
    },
    {
        "BLOCK_SIZE_M": 128,
        "BLOCK_SIZE_N": 32,
        "BLOCK_SIZE_K": 32,
        "GROUP_SIZE_M": 8,
        "num_stages": 6,
        "num_warps": 2,
        "ms": 1.0461585521697998,
        "min_ms": 1.0461585521697998,
        "max_ms": 1.0461585521697998,
        "compile_time": 1.309084177017212
    },
    {
        "BLOCK_SIZE_M": 128,
        "BLOCK_SIZE_N": 128,
        "BLOCK_SIZE_K": 256,
        "GROUP_SIZE_M": 8,
        "num_stages": 1,
        "num_warps": 8,
        "ms": 1.0467058420181274,
        "min_ms": 1.0467058420181274,
        "max_ms": 1.0467058420181274,
        "compile_time": 1.2701375484466553
    },
    {
        "BLOCK_SIZE_M": 64,
        "BLOCK_SIZE_N": 64,
        "BLOCK_SIZE_K": 16,
        "GROUP_SIZE_M": 8,
        "num_stages": 8,
        "num_warps": 2,
        "ms": 1.04714035987854,
        "min_ms": 1.04714035987854,
        "max_ms": 1.04714035987854,
        "compile_time": 2.014706611633301
    },
    {
        "BLOCK_SIZE_M": 32,
        "BLOCK_SIZE_N": 256,
        "BLOCK_SIZE_K": 16,
        "GROUP_SIZE_M": 8,
        "num_stages": 5,
        "num_warps": 4,
        "ms": 1.0472726821899414,
        "min_ms": 1.0472726821899414,
        "max_ms": 1.0472726821899414,
        "compile_time": 1.2655279636383057
    },
    {
        "BLOCK_SIZE_M": 64,
        "BLOCK_SIZE_N": 64,
        "BLOCK_SIZE_K": 16,
        "GROUP_SIZE_M": 8,
        "num_stages": 4,
        "num_warps": 2,
        "ms": 1.0474631786346436,
        "min_ms": 1.0474631786346436,
        "max_ms": 1.0474631786346436,
        "compile_time": 1.270392894744873
    },
    {
        "BLOCK_SIZE_M": 64,
        "BLOCK_SIZE_N": 64,
        "BLOCK_SIZE_K": 16,
        "GROUP_SIZE_M": 8,
        "num_stages": 6,
        "num_warps": 2,
        "ms": 1.0478990077972412,
        "min_ms": 1.0478990077972412,
        "max_ms": 1.0478990077972412,
        "compile_time": 1.9460651874542236
    },
    {
        "BLOCK_SIZE_M": 128,
        "BLOCK_SIZE_N": 64,
        "BLOCK_SIZE_K": 64,
        "GROUP_SIZE_M": 8,
        "num_stages": 7,
        "num_warps": 16,
        "ms": 1.047990322113037,
        "min_ms": 1.047990322113037,
        "max_ms": 1.047990322113037,
        "compile_time": 1.279017448425293
    },
    {
        "BLOCK_SIZE_M": 128,
        "BLOCK_SIZE_N": 32,
        "BLOCK_SIZE_K": 32,
        "GROUP_SIZE_M": 8,
        "num_stages": 3,
        "num_warps": 2,
        "ms": 1.0483458042144775,
        "min_ms": 1.0483458042144775,
        "max_ms": 1.0483458042144775,
        "compile_time": 1.3188204765319824
    },
    {
        "BLOCK_SIZE_M": 128,
        "BLOCK_SIZE_N": 256,
        "BLOCK_SIZE_K": 128,
        "GROUP_SIZE_M": 8,
        "num_stages": 2,
        "num_warps": 16,
        "ms": 1.048882007598877,
        "min_ms": 1.048882007598877,
        "max_ms": 1.048882007598877,
        "compile_time": 1.2781975269317627
    },
    {
        "BLOCK_SIZE_M": 128,
        "BLOCK_SIZE_N": 32,
        "BLOCK_SIZE_K": 32,
        "GROUP_SIZE_M": 8,
        "num_stages": 4,
        "num_warps": 2,
        "ms": 1.0490963459014893,
        "min_ms": 1.0490963459014893,
        "max_ms": 1.0490963459014893,
        "compile_time": 1.3214547634124756
    },
    {
        "BLOCK_SIZE_M": 32,
        "BLOCK_SIZE_N": 256,
        "BLOCK_SIZE_K": 64,
        "GROUP_SIZE_M": 8,
        "num_stages": 4,
        "num_warps": 4,
        "ms": 1.0497725009918213,
        "min_ms": 1.0497725009918213,
        "max_ms": 1.0497725009918213,
        "compile_time": 1.2295172214508057
    },
    {
        "BLOCK_SIZE_M": 32,
        "BLOCK_SIZE_N": 512,
        "BLOCK_SIZE_K": 32,
        "GROUP_SIZE_M": 8,
        "num_stages": 4,
        "num_warps": 4,
        "ms": 1.049970030784607,
        "min_ms": 1.049970030784607,
        "max_ms": 1.049970030784607,
        "compile_time": 1.2183828353881836
    },
    {
        "BLOCK_SIZE_M": 64,
        "BLOCK_SIZE_N": 64,
        "BLOCK_SIZE_K": 16,
        "GROUP_SIZE_M": 8,
        "num_stages": 3,
        "num_warps": 2,
        "ms": 1.0506218671798706,
        "min_ms": 1.0506218671798706,
        "max_ms": 1.0506218671798706,
        "compile_time": 1.8254423141479492
    },
    {
        "BLOCK_SIZE_M": 128,
        "BLOCK_SIZE_N": 32,
        "BLOCK_SIZE_K": 64,
        "GROUP_SIZE_M": 8,
        "num_stages": 3,
        "num_warps": 2,
        "ms": 1.0515520572662354,
        "min_ms": 1.0515520572662354,
        "max_ms": 1.0515520572662354,
        "compile_time": 1.2842869758605957
    },
    {
        "BLOCK_SIZE_M": 64,
        "BLOCK_SIZE_N": 256,
        "BLOCK_SIZE_K": 64,
        "GROUP_SIZE_M": 8,
        "num_stages": 1,
        "num_warps": 4,
        "ms": 1.0516011714935303,
        "min_ms": 1.0516011714935303,
        "max_ms": 1.0516011714935303,
        "compile_time": 1.2494535446166992
    },
    {
        "BLOCK_SIZE_M": 32,
        "BLOCK_SIZE_N": 256,
        "BLOCK_SIZE_K": 16,
        "GROUP_SIZE_M": 8,
        "num_stages": 7,
        "num_warps": 4,
        "ms": 1.0523334741592407,
        "min_ms": 1.0523334741592407,
        "max_ms": 1.0523334741592407,
        "compile_time": 1.2604424953460693
    },
    {
        "BLOCK_SIZE_M": 32,
        "BLOCK_SIZE_N": 256,
        "BLOCK_SIZE_K": 32,
        "GROUP_SIZE_M": 8,
        "num_stages": 6,
        "num_warps": 8,
        "ms": 1.0528470277786255,
        "min_ms": 1.0528470277786255,
        "max_ms": 1.0528470277786255,
        "compile_time": 1.24241042137146
    },
    {
        "BLOCK_SIZE_M": 128,
        "BLOCK_SIZE_N": 32,
        "BLOCK_SIZE_K": 64,
        "GROUP_SIZE_M": 8,
        "num_stages": 3,
        "num_warps": 4,
        "ms": 1.0529066324234009,
        "min_ms": 1.0529066324234009,
        "max_ms": 1.0529066324234009,
        "compile_time": 1.3049094676971436
    },
    {
        "BLOCK_SIZE_M": 32,
        "BLOCK_SIZE_N": 512,
        "BLOCK_SIZE_K": 32,
        "GROUP_SIZE_M": 8,
        "num_stages": 5,
        "num_warps": 4,
        "ms": 1.0532886981964111,
        "min_ms": 1.0532886981964111,
        "max_ms": 1.0532886981964111,
        "compile_time": 1.2231450080871582
    },
    {
        "BLOCK_SIZE_M": 32,
        "BLOCK_SIZE_N": 256,
        "BLOCK_SIZE_K": 16,
        "GROUP_SIZE_M": 8,
        "num_stages": 3,
        "num_warps": 4,
        "ms": 1.053728699684143,
        "min_ms": 1.053728699684143,
        "max_ms": 1.053728699684143,
        "compile_time": 1.2206377983093262
    },
    {
        "BLOCK_SIZE_M": 32,
        "BLOCK_SIZE_N": 512,
        "BLOCK_SIZE_K": 32,
        "GROUP_SIZE_M": 8,
        "num_stages": 3,
        "num_warps": 8,
        "ms": 1.0550917387008667,
        "min_ms": 1.0550917387008667,
        "max_ms": 1.0550917387008667,
        "compile_time": 1.21980619430542
    },
    {
        "BLOCK_SIZE_M": 32,
        "BLOCK_SIZE_N": 256,
        "BLOCK_SIZE_K": 16,
        "GROUP_SIZE_M": 8,
        "num_stages": 8,
        "num_warps": 4,
        "ms": 1.0552308559417725,
        "min_ms": 1.0552308559417725,
        "max_ms": 1.0552308559417725,
        "compile_time": 1.2529253959655762
    },
    {
        "BLOCK_SIZE_M": 128,
        "BLOCK_SIZE_N": 32,
        "BLOCK_SIZE_K": 64,
        "GROUP_SIZE_M": 8,
        "num_stages": 5,
        "num_warps": 2,
        "ms": 1.0554665327072144,
        "min_ms": 1.0554665327072144,
        "max_ms": 1.0554665327072144,
        "compile_time": 1.287224531173706
    },
    {
        "BLOCK_SIZE_M": 32,
        "BLOCK_SIZE_N": 256,
        "BLOCK_SIZE_K": 32,
        "GROUP_SIZE_M": 8,
        "num_stages": 7,
        "num_warps": 8,
        "ms": 1.0560227632522583,
        "min_ms": 1.0560227632522583,
        "max_ms": 1.0560227632522583,
        "compile_time": 1.2570836544036865
    },
    {
        "BLOCK_SIZE_M": 128,
        "BLOCK_SIZE_N": 32,
        "BLOCK_SIZE_K": 32,
        "GROUP_SIZE_M": 8,
        "num_stages": 5,
        "num_warps": 2,
        "ms": 1.0563520193099976,
        "min_ms": 1.0563520193099976,
        "max_ms": 1.0563520193099976,
        "compile_time": 1.319077968597412
    },
    {
        "BLOCK_SIZE_M": 64,
        "BLOCK_SIZE_N": 128,
        "BLOCK_SIZE_K": 128,
        "GROUP_SIZE_M": 8,
        "num_stages": 1,
        "num_warps": 8,
        "ms": 1.057151198387146,
        "min_ms": 1.057151198387146,
        "max_ms": 1.057151198387146,
        "compile_time": 1.2824807167053223
    },
    {
        "BLOCK_SIZE_M": 64,
        "BLOCK_SIZE_N": 128,
        "BLOCK_SIZE_K": 16,
        "GROUP_SIZE_M": 8,
        "num_stages": 4,
        "num_warps": 8,
        "ms": 1.0573976039886475,
        "min_ms": 1.0573976039886475,
        "max_ms": 1.0573976039886475,
        "compile_time": 1.263922929763794
    },
    {
        "BLOCK_SIZE_M": 128,
        "BLOCK_SIZE_N": 32,
        "BLOCK_SIZE_K": 64,
        "GROUP_SIZE_M": 8,
        "num_stages": 5,
        "num_warps": 4,
        "ms": 1.0575203895568848,
        "min_ms": 1.0575203895568848,
        "max_ms": 1.0575203895568848,
        "compile_time": 1.3016114234924316
    },
    {
        "BLOCK_SIZE_M": 32,
        "BLOCK_SIZE_N": 256,
        "BLOCK_SIZE_K": 32,
        "GROUP_SIZE_M": 8,
        "num_stages": 8,
        "num_warps": 8,
        "ms": 1.0576540231704712,
        "min_ms": 1.0576540231704712,
        "max_ms": 1.0576540231704712,
        "compile_time": 1.2803795337677002
    },
    {
        "BLOCK_SIZE_M": 128,
        "BLOCK_SIZE_N": 32,
        "BLOCK_SIZE_K": 64,
        "GROUP_SIZE_M": 8,
        "num_stages": 4,
        "num_warps": 2,
        "ms": 1.0581707954406738,
        "min_ms": 1.0581707954406738,
        "max_ms": 1.0581707954406738,
        "compile_time": 1.2788012027740479
    },
    {
        "BLOCK_SIZE_M": 64,
        "BLOCK_SIZE_N": 128,
        "BLOCK_SIZE_K": 16,
        "GROUP_SIZE_M": 8,
        "num_stages": 2,
        "num_warps": 4,
        "ms": 1.0591959953308105,
        "min_ms": 1.0591959953308105,
        "max_ms": 1.0591959953308105,
        "compile_time": 1.2259471416473389
    },
    {
        "BLOCK_SIZE_M": 128,
        "BLOCK_SIZE_N": 64,
        "BLOCK_SIZE_K": 64,
        "GROUP_SIZE_M": 8,
        "num_stages": 2,
        "num_warps": 16,
        "ms": 1.0597230195999146,
        "min_ms": 1.0597230195999146,
        "max_ms": 1.0597230195999146,
        "compile_time": 1.2675411701202393
    },
    {
        "BLOCK_SIZE_M": 64,
        "BLOCK_SIZE_N": 64,
        "BLOCK_SIZE_K": 128,
        "GROUP_SIZE_M": 8,
        "num_stages": 4,
        "num_warps": 8,
        "ms": 1.0601086616516113,
        "min_ms": 1.0601086616516113,
        "max_ms": 1.0601086616516113,
        "compile_time": 1.250126600265503
    },
    {
        "BLOCK_SIZE_M": 64,
        "BLOCK_SIZE_N": 64,
        "BLOCK_SIZE_K": 128,
        "GROUP_SIZE_M": 8,
        "num_stages": 5,
        "num_warps": 8,
        "ms": 1.0606939792633057,
        "min_ms": 1.0606939792633057,
        "max_ms": 1.0606939792633057,
        "compile_time": 1.2625911235809326
    },
    {
        "BLOCK_SIZE_M": 32,
        "BLOCK_SIZE_N": 512,
        "BLOCK_SIZE_K": 64,
        "GROUP_SIZE_M": 8,
        "num_stages": 3,
        "num_warps": 16,
        "ms": 1.0609067678451538,
        "min_ms": 1.0609067678451538,
        "max_ms": 1.0609067678451538,
        "compile_time": 1.2231652736663818
    },
    {
        "BLOCK_SIZE_M": 64,
        "BLOCK_SIZE_N": 128,
        "BLOCK_SIZE_K": 32,
        "GROUP_SIZE_M": 8,
        "num_stages": 1,
        "num_warps": 4,
        "ms": 1.0617353916168213,
        "min_ms": 1.0617353916168213,
        "max_ms": 1.0617353916168213,
        "compile_time": 1.224588394165039
    },
    {
        "BLOCK_SIZE_M": 128,
        "BLOCK_SIZE_N": 128,
        "BLOCK_SIZE_K": 64,
        "GROUP_SIZE_M": 8,
        "num_stages": 2,
        "num_warps": 16,
        "ms": 1.0619041919708252,
        "min_ms": 1.0619041919708252,
        "max_ms": 1.0619041919708252,
        "compile_time": 1.2605926990509033
    },
    {
        "BLOCK_SIZE_M": 64,
        "BLOCK_SIZE_N": 128,
        "BLOCK_SIZE_K": 16,
        "GROUP_SIZE_M": 8,
        "num_stages": 6,
        "num_warps": 8,
        "ms": 1.0627269744873047,
        "min_ms": 1.0627269744873047,
        "max_ms": 1.0627269744873047,
        "compile_time": 1.257453203201294
    },
    {
        "BLOCK_SIZE_M": 64,
        "BLOCK_SIZE_N": 128,
        "BLOCK_SIZE_K": 16,
        "GROUP_SIZE_M": 8,
        "num_stages": 5,
        "num_warps": 8,
        "ms": 1.0643045902252197,
        "min_ms": 1.0643045902252197,
        "max_ms": 1.0643045902252197,
        "compile_time": 1.2783567905426025
    },
    {
        "BLOCK_SIZE_M": 32,
        "BLOCK_SIZE_N": 256,
        "BLOCK_SIZE_K": 64,
        "GROUP_SIZE_M": 8,
        "num_stages": 4,
        "num_warps": 8,
        "ms": 1.0645743608474731,
        "min_ms": 1.0645743608474731,
        "max_ms": 1.0645743608474731,
        "compile_time": 1.2325468063354492
    },
    {
        "BLOCK_SIZE_M": 64,
        "BLOCK_SIZE_N": 256,
        "BLOCK_SIZE_K": 128,
        "GROUP_SIZE_M": 8,
        "num_stages": 1,
        "num_warps": 4,
        "ms": 1.065307378768921,
        "min_ms": 1.065307378768921,
        "max_ms": 1.065307378768921,
        "compile_time": 1.2316820621490479
    },
    {
        "BLOCK_SIZE_M": 64,
        "BLOCK_SIZE_N": 128,
        "BLOCK_SIZE_K": 16,
        "GROUP_SIZE_M": 8,
        "num_stages": 3,
        "num_warps": 8,
        "ms": 1.06600821018219,
        "min_ms": 1.06600821018219,
        "max_ms": 1.06600821018219,
        "compile_time": 1.259202241897583
    },
    {
        "BLOCK_SIZE_M": 64,
        "BLOCK_SIZE_N": 128,
        "BLOCK_SIZE_K": 16,
        "GROUP_SIZE_M": 8,
        "num_stages": 7,
        "num_warps": 8,
        "ms": 1.0670894384384155,
        "min_ms": 1.0670894384384155,
        "max_ms": 1.0670894384384155,
        "compile_time": 1.2609403133392334
    },
    {
        "BLOCK_SIZE_M": 64,
        "BLOCK_SIZE_N": 128,
        "BLOCK_SIZE_K": 16,
        "GROUP_SIZE_M": 8,
        "num_stages": 8,
        "num_warps": 8,
        "ms": 1.0680842399597168,
        "min_ms": 1.0680842399597168,
        "max_ms": 1.0680842399597168,
        "compile_time": 1.2712419033050537
    },
    {
        "BLOCK_SIZE_M": 128,
        "BLOCK_SIZE_N": 32,
        "BLOCK_SIZE_K": 32,
        "GROUP_SIZE_M": 8,
        "num_stages": 3,
        "num_warps": 4,
        "ms": 1.0684245824813843,
        "min_ms": 1.0684245824813843,
        "max_ms": 1.0684245824813843,
        "compile_time": 1.3286285400390625
    },
    {
        "BLOCK_SIZE_M": 128,
        "BLOCK_SIZE_N": 32,
        "BLOCK_SIZE_K": 32,
        "GROUP_SIZE_M": 8,
        "num_stages": 7,
        "num_warps": 2,
        "ms": 1.0685135126113892,
        "min_ms": 1.0685135126113892,
        "max_ms": 1.0685135126113892,
        "compile_time": 1.3013341426849365
    },
    {
        "BLOCK_SIZE_M": 64,
        "BLOCK_SIZE_N": 256,
        "BLOCK_SIZE_K": 128,
        "GROUP_SIZE_M": 8,
        "num_stages": 2,
        "num_warps": 16,
        "ms": 1.0693109035491943,
        "min_ms": 1.0693109035491943,
        "max_ms": 1.0693109035491943,
        "compile_time": 1.2449920177459717
    },
    {
        "BLOCK_SIZE_M": 128,
        "BLOCK_SIZE_N": 32,
        "BLOCK_SIZE_K": 32,
        "GROUP_SIZE_M": 8,
        "num_stages": 4,
        "num_warps": 4,
        "ms": 1.0702953338623047,
        "min_ms": 1.0702953338623047,
        "max_ms": 1.0702953338623047,
        "compile_time": 1.3270912170410156
    },
    {
        "BLOCK_SIZE_M": 128,
        "BLOCK_SIZE_N": 32,
        "BLOCK_SIZE_K": 32,
        "GROUP_SIZE_M": 8,
        "num_stages": 6,
        "num_warps": 4,
        "ms": 1.070554256439209,
        "min_ms": 1.070554256439209,
        "max_ms": 1.070554256439209,
        "compile_time": 1.3110172748565674
    },
    {
        "BLOCK_SIZE_M": 128,
        "BLOCK_SIZE_N": 32,
        "BLOCK_SIZE_K": 32,
        "GROUP_SIZE_M": 8,
        "num_stages": 5,
        "num_warps": 4,
        "ms": 1.0706367492675781,
        "min_ms": 1.0706367492675781,
        "max_ms": 1.0706367492675781,
        "compile_time": 1.315969705581665
    },
    {
        "BLOCK_SIZE_M": 256,
        "BLOCK_SIZE_N": 128,
        "BLOCK_SIZE_K": 128,
        "GROUP_SIZE_M": 8,
        "num_stages": 1,
        "num_warps": 16,
        "ms": 1.0714237689971924,
        "min_ms": 1.0714237689971924,
        "max_ms": 1.0714237689971924,
        "compile_time": 1.3054001331329346
    },
    {
        "BLOCK_SIZE_M": 128,
        "BLOCK_SIZE_N": 32,
        "BLOCK_SIZE_K": 32,
        "GROUP_SIZE_M": 8,
        "num_stages": 8,
        "num_warps": 2,
        "ms": 1.0721698999404907,
        "min_ms": 1.0721698999404907,
        "max_ms": 1.0721698999404907,
        "compile_time": 1.295013427734375
    },
    {
        "BLOCK_SIZE_M": 32,
        "BLOCK_SIZE_N": 256,
        "BLOCK_SIZE_K": 128,
        "GROUP_SIZE_M": 8,
        "num_stages": 2,
        "num_warps": 4,
        "ms": 1.0739576816558838,
        "min_ms": 1.0739576816558838,
        "max_ms": 1.0739576816558838,
        "compile_time": 1.201761245727539
    },
    {
        "BLOCK_SIZE_M": 256,
        "BLOCK_SIZE_N": 128,
        "BLOCK_SIZE_K": 64,
        "GROUP_SIZE_M": 8,
        "num_stages": 1,
        "num_warps": 32,
        "ms": 1.075723648071289,
        "min_ms": 1.075723648071289,
        "max_ms": 1.075723648071289,
        "compile_time": 1.3012354373931885
    },
    {
        "BLOCK_SIZE_M": 32,
        "BLOCK_SIZE_N": 128,
        "BLOCK_SIZE_K": 32,
        "GROUP_SIZE_M": 8,
        "num_stages": 4,
        "num_warps": 2,
        "ms": 1.0757567882537842,
        "min_ms": 1.0757567882537842,
        "max_ms": 1.0757567882537842,
        "compile_time": 1.2575898170471191
    },
    {
        "BLOCK_SIZE_M": 32,
        "BLOCK_SIZE_N": 512,
        "BLOCK_SIZE_K": 32,
        "GROUP_SIZE_M": 8,
        "num_stages": 3,
        "num_warps": 16,
        "ms": 1.0757899284362793,
        "min_ms": 1.0757899284362793,
        "max_ms": 1.0757899284362793,
        "compile_time": 1.2260973453521729
    },
    {
        "BLOCK_SIZE_M": 128,
        "BLOCK_SIZE_N": 32,
        "BLOCK_SIZE_K": 64,
        "GROUP_SIZE_M": 8,
        "num_stages": 4,
        "num_warps": 4,
        "ms": 1.0761778354644775,
        "min_ms": 1.0761778354644775,
        "max_ms": 1.0761778354644775,
        "compile_time": 1.3068461418151855
    },
    {
        "BLOCK_SIZE_M": 32,
        "BLOCK_SIZE_N": 512,
        "BLOCK_SIZE_K": 16,
        "GROUP_SIZE_M": 8,
        "num_stages": 6,
        "num_warps": 8,
        "ms": 1.0764377117156982,
        "min_ms": 1.0764377117156982,
        "max_ms": 1.0764377117156982,
        "compile_time": 1.2197294235229492
    },
    {
        "BLOCK_SIZE_M": 32,
        "BLOCK_SIZE_N": 512,
        "BLOCK_SIZE_K": 16,
        "GROUP_SIZE_M": 8,
        "num_stages": 7,
        "num_warps": 8,
        "ms": 1.0771490335464478,
        "min_ms": 1.0771490335464478,
        "max_ms": 1.0771490335464478,
        "compile_time": 1.218480110168457
    },
    {
        "BLOCK_SIZE_M": 32,
        "BLOCK_SIZE_N": 128,
        "BLOCK_SIZE_K": 64,
        "GROUP_SIZE_M": 8,
        "num_stages": 3,
        "num_warps": 2,
        "ms": 1.078396201133728,
        "min_ms": 1.078396201133728,
        "max_ms": 1.078396201133728,
        "compile_time": 1.242344617843628
    },
    {
        "BLOCK_SIZE_M": 32,
        "BLOCK_SIZE_N": 256,
        "BLOCK_SIZE_K": 128,
        "GROUP_SIZE_M": 8,
        "num_stages": 3,
        "num_warps": 4,
        "ms": 1.07877516746521,
        "min_ms": 1.07877516746521,
        "max_ms": 1.07877516746521,
        "compile_time": 1.0314483642578125
    },
    {
        "BLOCK_SIZE_M": 64,
        "BLOCK_SIZE_N": 64,
        "BLOCK_SIZE_K": 32,
        "GROUP_SIZE_M": 8,
        "num_stages": 3,
        "num_warps": 8,
        "ms": 1.0789854526519775,
        "min_ms": 1.0789854526519775,
        "max_ms": 1.0789854526519775,
        "compile_time": 1.2699899673461914
    },
    {
        "BLOCK_SIZE_M": 32,
        "BLOCK_SIZE_N": 256,
        "BLOCK_SIZE_K": 16,
        "GROUP_SIZE_M": 8,
        "num_stages": 4,
        "num_warps": 8,
        "ms": 1.079116702079773,
        "min_ms": 1.079116702079773,
        "max_ms": 1.079116702079773,
        "compile_time": 1.2632157802581787
    },
    {
        "BLOCK_SIZE_M": 128,
        "BLOCK_SIZE_N": 32,
        "BLOCK_SIZE_K": 32,
        "GROUP_SIZE_M": 8,
        "num_stages": 2,
        "num_warps": 2,
        "ms": 1.0794391632080078,
        "min_ms": 1.0794391632080078,
        "max_ms": 1.0794391632080078,
        "compile_time": 1.3117685317993164
    },
    {
        "BLOCK_SIZE_M": 32,
        "BLOCK_SIZE_N": 256,
        "BLOCK_SIZE_K": 16,
        "GROUP_SIZE_M": 8,
        "num_stages": 6,
        "num_warps": 8,
        "ms": 1.0796949863433838,
        "min_ms": 1.0796949863433838,
        "max_ms": 1.0796949863433838,
        "compile_time": 1.2685987949371338
    },
    {
        "BLOCK_SIZE_M": 32,
        "BLOCK_SIZE_N": 256,
        "BLOCK_SIZE_K": 32,
        "GROUP_SIZE_M": 8,
        "num_stages": 3,
        "num_warps": 8,
        "ms": 1.079790711402893,
        "min_ms": 1.079790711402893,
        "max_ms": 1.079790711402893,
        "compile_time": 1.2466833591461182
    },
    {
        "BLOCK_SIZE_M": 512,
        "BLOCK_SIZE_N": 32,
        "BLOCK_SIZE_K": 32,
        "GROUP_SIZE_M": 8,
        "num_stages": 2,
        "num_warps": 4,
        "ms": 1.081125259399414,
        "min_ms": 1.081125259399414,
        "max_ms": 1.081125259399414,
        "compile_time": 2.7492637634277344
    },
    {
        "BLOCK_SIZE_M": 32,
        "BLOCK_SIZE_N": 512,
        "BLOCK_SIZE_K": 16,
        "GROUP_SIZE_M": 8,
        "num_stages": 8,
        "num_warps": 8,
        "ms": 1.0812113285064697,
        "min_ms": 1.0812113285064697,
        "max_ms": 1.0812113285064697,
        "compile_time": 1.2245566844940186
    },
    {
        "BLOCK_SIZE_M": 64,
        "BLOCK_SIZE_N": 64,
        "BLOCK_SIZE_K": 32,
        "GROUP_SIZE_M": 8,
        "num_stages": 6,
        "num_warps": 8,
        "ms": 1.0816490650177002,
        "min_ms": 1.0816490650177002,
        "max_ms": 1.0816490650177002,
        "compile_time": 1.2820465564727783
    },
    {
        "BLOCK_SIZE_M": 64,
        "BLOCK_SIZE_N": 64,
        "BLOCK_SIZE_K": 32,
        "GROUP_SIZE_M": 8,
        "num_stages": 5,
        "num_warps": 8,
        "ms": 1.0817078351974487,
        "min_ms": 1.0817078351974487,
        "max_ms": 1.0817078351974487,
        "compile_time": 1.2907640933990479
    },
    {
        "BLOCK_SIZE_M": 64,
        "BLOCK_SIZE_N": 64,
        "BLOCK_SIZE_K": 32,
        "GROUP_SIZE_M": 8,
        "num_stages": 4,
        "num_warps": 8,
        "ms": 1.0817229747772217,
        "min_ms": 1.0817229747772217,
        "max_ms": 1.0817229747772217,
        "compile_time": 1.2784366607666016
    },
    {
        "BLOCK_SIZE_M": 64,
        "BLOCK_SIZE_N": 64,
        "BLOCK_SIZE_K": 128,
        "GROUP_SIZE_M": 8,
        "num_stages": 6,
        "num_warps": 8,
        "ms": 1.0817580223083496,
        "min_ms": 1.0817580223083496,
        "max_ms": 1.0817580223083496,
        "compile_time": 1.2574269771575928
    },
    {
        "BLOCK_SIZE_M": 32,
        "BLOCK_SIZE_N": 128,
        "BLOCK_SIZE_K": 32,
        "GROUP_SIZE_M": 8,
        "num_stages": 6,
        "num_warps": 2,
        "ms": 1.0820037126541138,
        "min_ms": 1.0820037126541138,
        "max_ms": 1.0820037126541138,
        "compile_time": 1.2537102699279785
    },
    {
        "BLOCK_SIZE_M": 64,
        "BLOCK_SIZE_N": 64,
        "BLOCK_SIZE_K": 16,
        "GROUP_SIZE_M": 8,
        "num_stages": 6,
        "num_warps": 4,
        "ms": 1.082838535308838,
        "min_ms": 1.082838535308838,
        "max_ms": 1.082838535308838,
        "compile_time": 1.2852654457092285
    },
    {
        "BLOCK_SIZE_M": 128,
        "BLOCK_SIZE_N": 32,
        "BLOCK_SIZE_K": 64,
        "GROUP_SIZE_M": 8,
        "num_stages": 7,
        "num_warps": 4,
        "ms": 1.0834054946899414,
        "min_ms": 1.0834054946899414,
        "max_ms": 1.0834054946899414,
        "compile_time": 1.2847461700439453
    },
    {
        "BLOCK_SIZE_M": 64,
        "BLOCK_SIZE_N": 64,
        "BLOCK_SIZE_K": 64,
        "GROUP_SIZE_M": 8,
        "num_stages": 7,
        "num_warps": 8,
        "ms": 1.0837724208831787,
        "min_ms": 1.0837724208831787,
        "max_ms": 1.0837724208831787,
        "compile_time": 1.2480876445770264
    },
    {
        "BLOCK_SIZE_M": 128,
        "BLOCK_SIZE_N": 64,
        "BLOCK_SIZE_K": 128,
        "GROUP_SIZE_M": 8,
        "num_stages": 2,
        "num_warps": 2,
        "ms": 1.084093451499939,
        "min_ms": 1.084093451499939,
        "max_ms": 1.084093451499939,
        "compile_time": 1.2528221607208252
    },
    {
        "BLOCK_SIZE_M": 32,
        "BLOCK_SIZE_N": 256,
        "BLOCK_SIZE_K": 16,
        "GROUP_SIZE_M": 8,
        "num_stages": 5,
        "num_warps": 8,
        "ms": 1.0849987268447876,
        "min_ms": 1.0849987268447876,
        "max_ms": 1.0849987268447876,
        "compile_time": 1.2716360092163086
    },
    {
        "BLOCK_SIZE_M": 64,
        "BLOCK_SIZE_N": 64,
        "BLOCK_SIZE_K": 16,
        "GROUP_SIZE_M": 8,
        "num_stages": 7,
        "num_warps": 4,
        "ms": 1.0856273174285889,
        "min_ms": 1.0856273174285889,
        "max_ms": 1.0856273174285889,
        "compile_time": 1.3033039569854736
    },
    {
        "BLOCK_SIZE_M": 32,
        "BLOCK_SIZE_N": 256,
        "BLOCK_SIZE_K": 16,
        "GROUP_SIZE_M": 8,
        "num_stages": 7,
        "num_warps": 2,
        "ms": 1.086590051651001,
        "min_ms": 1.086590051651001,
        "max_ms": 1.086590051651001,
        "compile_time": 2.3343427181243896
    },
    {
        "BLOCK_SIZE_M": 32,
        "BLOCK_SIZE_N": 128,
        "BLOCK_SIZE_K": 32,
        "GROUP_SIZE_M": 8,
        "num_stages": 3,
        "num_warps": 4,
        "ms": 1.086594820022583,
        "min_ms": 1.086594820022583,
        "max_ms": 1.086594820022583,
        "compile_time": 1.2671384811401367
    },
    {
        "BLOCK_SIZE_M": 64,
        "BLOCK_SIZE_N": 64,
        "BLOCK_SIZE_K": 256,
        "GROUP_SIZE_M": 8,
        "num_stages": 3,
        "num_warps": 8,
        "ms": 1.0866912603378296,
        "min_ms": 1.0866912603378296,
        "max_ms": 1.0866912603378296,
        "compile_time": 1.2588813304901123
    },
    {
        "BLOCK_SIZE_M": 64,
        "BLOCK_SIZE_N": 256,
        "BLOCK_SIZE_K": 128,
        "GROUP_SIZE_M": 8,
        "num_stages": 3,
        "num_warps": 32,
        "ms": 1.087101697921753,
        "min_ms": 1.087101697921753,
        "max_ms": 1.087101697921753,
        "compile_time": 1.2372772693634033
    },
    {
        "BLOCK_SIZE_M": 32,
        "BLOCK_SIZE_N": 256,
        "BLOCK_SIZE_K": 16,
        "GROUP_SIZE_M": 8,
        "num_stages": 8,
        "num_warps": 2,
        "ms": 1.0874301195144653,
        "min_ms": 1.0874301195144653,
        "max_ms": 1.0874301195144653,
        "compile_time": 2.3572707176208496
    },
    {
        "BLOCK_SIZE_M": 128,
        "BLOCK_SIZE_N": 32,
        "BLOCK_SIZE_K": 128,
        "GROUP_SIZE_M": 8,
        "num_stages": 2,
        "num_warps": 2,
        "ms": 1.0880448818206787,
        "min_ms": 1.0880448818206787,
        "max_ms": 1.0880448818206787,
        "compile_time": 1.2678296566009521
    },
    {
        "BLOCK_SIZE_M": 32,
        "BLOCK_SIZE_N": 128,
        "BLOCK_SIZE_K": 32,
        "GROUP_SIZE_M": 8,
        "num_stages": 5,
        "num_warps": 2,
        "ms": 1.0882309675216675,
        "min_ms": 1.0882309675216675,
        "max_ms": 1.0882309675216675,
        "compile_time": 1.2439687252044678
    },
    {
        "BLOCK_SIZE_M": 128,
        "BLOCK_SIZE_N": 32,
        "BLOCK_SIZE_K": 64,
        "GROUP_SIZE_M": 8,
        "num_stages": 8,
        "num_warps": 4,
        "ms": 1.089394211769104,
        "min_ms": 1.089394211769104,
        "max_ms": 1.089394211769104,
        "compile_time": 1.315626859664917
    },
    {
        "BLOCK_SIZE_M": 64,
        "BLOCK_SIZE_N": 64,
        "BLOCK_SIZE_K": 64,
        "GROUP_SIZE_M": 8,
        "num_stages": 2,
        "num_warps": 8,
        "ms": 1.0899343490600586,
        "min_ms": 1.0899343490600586,
        "max_ms": 1.0899343490600586,
        "compile_time": 1.2514433860778809
    },
    {
        "BLOCK_SIZE_M": 64,
        "BLOCK_SIZE_N": 128,
        "BLOCK_SIZE_K": 128,
        "GROUP_SIZE_M": 8,
        "num_stages": 1,
        "num_warps": 4,
        "ms": 1.0902620553970337,
        "min_ms": 1.0902620553970337,
        "max_ms": 1.0902620553970337,
        "compile_time": 1.2328486442565918
    },
    {
        "BLOCK_SIZE_M": 64,
        "BLOCK_SIZE_N": 64,
        "BLOCK_SIZE_K": 64,
        "GROUP_SIZE_M": 8,
        "num_stages": 8,
        "num_warps": 8,
        "ms": 1.0906305313110352,
        "min_ms": 1.0906305313110352,
        "max_ms": 1.0906305313110352,
        "compile_time": 1.244760513305664
    },
    {
        "BLOCK_SIZE_M": 64,
        "BLOCK_SIZE_N": 64,
        "BLOCK_SIZE_K": 128,
        "GROUP_SIZE_M": 8,
        "num_stages": 2,
        "num_warps": 8,
        "ms": 1.0907490253448486,
        "min_ms": 1.0907490253448486,
        "max_ms": 1.0907490253448486,
        "compile_time": 1.2447187900543213
    },
    {
        "BLOCK_SIZE_M": 128,
        "BLOCK_SIZE_N": 32,
        "BLOCK_SIZE_K": 64,
        "GROUP_SIZE_M": 8,
        "num_stages": 6,
        "num_warps": 4,
        "ms": 1.091088891029358,
        "min_ms": 1.091088891029358,
        "max_ms": 1.091088891029358,
        "compile_time": 1.2867305278778076
    },
    {
        "BLOCK_SIZE_M": 32,
        "BLOCK_SIZE_N": 128,
        "BLOCK_SIZE_K": 32,
        "GROUP_SIZE_M": 8,
        "num_stages": 3,
        "num_warps": 2,
        "ms": 1.091421127319336,
        "min_ms": 1.091421127319336,
        "max_ms": 1.091421127319336,
        "compile_time": 1.234306812286377
    },
    {
        "BLOCK_SIZE_M": 64,
        "BLOCK_SIZE_N": 64,
        "BLOCK_SIZE_K": 16,
        "GROUP_SIZE_M": 8,
        "num_stages": 5,
        "num_warps": 4,
        "ms": 1.0914804935455322,
        "min_ms": 1.0914804935455322,
        "max_ms": 1.0914804935455322,
        "compile_time": 1.2725615501403809
    },
    {
        "BLOCK_SIZE_M": 32,
        "BLOCK_SIZE_N": 128,
        "BLOCK_SIZE_K": 64,
        "GROUP_SIZE_M": 8,
        "num_stages": 3,
        "num_warps": 4,
        "ms": 1.0920419692993164,
        "min_ms": 1.0920419692993164,
        "max_ms": 1.0920419692993164,
        "compile_time": 1.246354103088379
    },
    {
        "BLOCK_SIZE_M": 64,
        "BLOCK_SIZE_N": 64,
        "BLOCK_SIZE_K": 16,
        "GROUP_SIZE_M": 8,
        "num_stages": 8,
        "num_warps": 4,
        "ms": 1.0923421382904053,
        "min_ms": 1.0923421382904053,
        "max_ms": 1.0923421382904053,
        "compile_time": 1.2840187549591064
    },
    {
        "BLOCK_SIZE_M": 256,
        "BLOCK_SIZE_N": 32,
        "BLOCK_SIZE_K": 64,
        "GROUP_SIZE_M": 8,
        "num_stages": 2,
        "num_warps": 8,
        "ms": 1.0923939943313599,
        "min_ms": 1.0923939943313599,
        "max_ms": 1.0923939943313599,
        "compile_time": 1.3113722801208496
    },
    {
        "BLOCK_SIZE_M": 256,
        "BLOCK_SIZE_N": 64,
        "BLOCK_SIZE_K": 64,
        "GROUP_SIZE_M": 8,
        "num_stages": 3,
        "num_warps": 32,
        "ms": 1.092768669128418,
        "min_ms": 1.092768669128418,
        "max_ms": 1.092768669128418,
        "compile_time": 1.3130102157592773
    },
    {
        "BLOCK_SIZE_M": 128,
        "BLOCK_SIZE_N": 64,
        "BLOCK_SIZE_K": 16,
        "GROUP_SIZE_M": 8,
        "num_stages": 2,
        "num_warps": 4,
        "ms": 1.0931200981140137,
        "min_ms": 1.0931200981140137,
        "max_ms": 1.0931200981140137,
        "compile_time": 1.268606185913086
    },
    {
        "BLOCK_SIZE_M": 64,
        "BLOCK_SIZE_N": 64,
        "BLOCK_SIZE_K": 32,
        "GROUP_SIZE_M": 8,
        "num_stages": 7,
        "num_warps": 8,
        "ms": 1.093258023262024,
        "min_ms": 1.093258023262024,
        "max_ms": 1.093258023262024,
        "compile_time": 1.270961046218872
    },
    {
        "BLOCK_SIZE_M": 256,
        "BLOCK_SIZE_N": 64,
        "BLOCK_SIZE_K": 64,
        "GROUP_SIZE_M": 8,
        "num_stages": 4,
        "num_warps": 32,
        "ms": 1.0932742357254028,
        "min_ms": 1.0932742357254028,
        "max_ms": 1.0932742357254028,
        "compile_time": 1.3015522956848145
    },
    {
        "BLOCK_SIZE_M": 32,
        "BLOCK_SIZE_N": 128,
        "BLOCK_SIZE_K": 32,
        "GROUP_SIZE_M": 8,
        "num_stages": 6,
        "num_warps": 4,
        "ms": 1.0939513444900513,
        "min_ms": 1.0939513444900513,
        "max_ms": 1.0939513444900513,
        "compile_time": 1.2475426197052002
    },
    {
        "BLOCK_SIZE_M": 256,
        "BLOCK_SIZE_N": 32,
        "BLOCK_SIZE_K": 128,
        "GROUP_SIZE_M": 8,
        "num_stages": 3,
        "num_warps": 16,
        "ms": 1.0956710577011108,
        "min_ms": 1.0956710577011108,
        "max_ms": 1.0956710577011108,
        "compile_time": 1.3304522037506104
    },
    {
        "BLOCK_SIZE_M": 64,
        "BLOCK_SIZE_N": 256,
        "BLOCK_SIZE_K": 256,
        "GROUP_SIZE_M": 8,
        "num_stages": 2,
        "num_warps": 8,
        "ms": 1.0961248874664307,
        "min_ms": 1.0961248874664307,
        "max_ms": 1.0961248874664307,
        "compile_time": 1.2600769996643066
    },
    {
        "BLOCK_SIZE_M": 128,
        "BLOCK_SIZE_N": 32,
        "BLOCK_SIZE_K": 64,
        "GROUP_SIZE_M": 8,
        "num_stages": 3,
        "num_warps": 8,
        "ms": 1.0961607694625854,
        "min_ms": 1.0961607694625854,
        "max_ms": 1.0961607694625854,
        "compile_time": 1.3050963878631592
    },
    {
        "BLOCK_SIZE_M": 128,
        "BLOCK_SIZE_N": 32,
        "BLOCK_SIZE_K": 32,
        "GROUP_SIZE_M": 8,
        "num_stages": 2,
        "num_warps": 4,
        "ms": 1.0962464809417725,
        "min_ms": 1.0962464809417725,
        "max_ms": 1.0962464809417725,
        "compile_time": 1.2824535369873047
    },
    {
        "BLOCK_SIZE_M": 128,
        "BLOCK_SIZE_N": 256,
        "BLOCK_SIZE_K": 32,
        "GROUP_SIZE_M": 8,
        "num_stages": 2,
        "num_warps": 16,
        "ms": 1.0964568853378296,
        "min_ms": 1.0964568853378296,
        "max_ms": 1.0964568853378296,
        "compile_time": 1.2755670547485352
    },
    {
        "BLOCK_SIZE_M": 32,
        "BLOCK_SIZE_N": 128,
        "BLOCK_SIZE_K": 32,
        "GROUP_SIZE_M": 8,
        "num_stages": 4,
        "num_warps": 4,
        "ms": 1.096823811531067,
        "min_ms": 1.096823811531067,
        "max_ms": 1.096823811531067,
        "compile_time": 1.2528350353240967
    },
    {
        "BLOCK_SIZE_M": 256,
        "BLOCK_SIZE_N": 32,
        "BLOCK_SIZE_K": 32,
        "GROUP_SIZE_M": 8,
        "num_stages": 4,
        "num_warps": 2,
        "ms": 1.09703528881073,
        "min_ms": 1.09703528881073,
        "max_ms": 1.09703528881073,
        "compile_time": 1.316713571548462
    },
    {
        "BLOCK_SIZE_M": 32,
        "BLOCK_SIZE_N": 128,
        "BLOCK_SIZE_K": 16,
        "GROUP_SIZE_M": 8,
        "num_stages": 3,
        "num_warps": 2,
        "ms": 1.097146987915039,
        "min_ms": 1.097146987915039,
        "max_ms": 1.097146987915039,
        "compile_time": 1.7813520431518555
    },
    {
        "BLOCK_SIZE_M": 32,
        "BLOCK_SIZE_N": 128,
        "BLOCK_SIZE_K": 64,
        "GROUP_SIZE_M": 8,
        "num_stages": 4,
        "num_warps": 2,
        "ms": 1.0973094701766968,
        "min_ms": 1.0973094701766968,
        "max_ms": 1.0973094701766968,
        "compile_time": 1.2333133220672607
    },
    {
        "BLOCK_SIZE_M": 64,
        "BLOCK_SIZE_N": 64,
        "BLOCK_SIZE_K": 16,
        "GROUP_SIZE_M": 8,
        "num_stages": 4,
        "num_warps": 4,
        "ms": 1.0973094701766968,
        "min_ms": 1.0973094701766968,
        "max_ms": 1.0973094701766968,
        "compile_time": 1.273575782775879
    },
    {
        "BLOCK_SIZE_M": 32,
        "BLOCK_SIZE_N": 128,
        "BLOCK_SIZE_K": 32,
        "GROUP_SIZE_M": 8,
        "num_stages": 5,
        "num_warps": 4,
        "ms": 1.0974667072296143,
        "min_ms": 1.0974667072296143,
        "max_ms": 1.0974667072296143,
        "compile_time": 1.251866102218628
    },
    {
        "BLOCK_SIZE_M": 256,
        "BLOCK_SIZE_N": 64,
        "BLOCK_SIZE_K": 64,
        "GROUP_SIZE_M": 8,
        "num_stages": 5,
        "num_warps": 32,
        "ms": 1.099846601486206,
        "min_ms": 1.099846601486206,
        "max_ms": 1.099846601486206,
        "compile_time": 1.3042652606964111
    },
    {
        "BLOCK_SIZE_M": 128,
        "BLOCK_SIZE_N": 32,
        "BLOCK_SIZE_K": 128,
        "GROUP_SIZE_M": 8,
        "num_stages": 4,
        "num_warps": 4,
        "ms": 1.1005629301071167,
        "min_ms": 1.1005629301071167,
        "max_ms": 1.1005629301071167,
        "compile_time": 1.2792434692382812
    },
    {
        "BLOCK_SIZE_M": 64,
        "BLOCK_SIZE_N": 128,
        "BLOCK_SIZE_K": 256,
        "GROUP_SIZE_M": 8,
        "num_stages": 2,
        "num_warps": 4,
        "ms": 1.1005998849868774,
        "min_ms": 1.1005998849868774,
        "max_ms": 1.1005998849868774,
        "compile_time": 1.23781156539917
    },
    {
        "BLOCK_SIZE_M": 32,
        "BLOCK_SIZE_N": 256,
        "BLOCK_SIZE_K": 128,
        "GROUP_SIZE_M": 8,
        "num_stages": 3,
        "num_warps": 8,
        "ms": 1.1007483005523682,
        "min_ms": 1.1007483005523682,
        "max_ms": 1.1007483005523682,
        "compile_time": 1.2332465648651123
    },
    {
        "BLOCK_SIZE_M": 32,
        "BLOCK_SIZE_N": 256,
        "BLOCK_SIZE_K": 32,
        "GROUP_SIZE_M": 8,
        "num_stages": 3,
        "num_warps": 2,
        "ms": 1.1014411449432373,
        "min_ms": 1.1014411449432373,
        "max_ms": 1.1014411449432373,
        "compile_time": 1.2402803897857666
    },
    {
        "BLOCK_SIZE_M": 32,
        "BLOCK_SIZE_N": 128,
        "BLOCK_SIZE_K": 32,
        "GROUP_SIZE_M": 8,
        "num_stages": 8,
        "num_warps": 2,
        "ms": 1.1017571687698364,
        "min_ms": 1.1017571687698364,
        "max_ms": 1.1017571687698364,
        "compile_time": 1.2392206192016602
    },
    {
        "BLOCK_SIZE_M": 32,
        "BLOCK_SIZE_N": 256,
        "BLOCK_SIZE_K": 32,
        "GROUP_SIZE_M": 8,
        "num_stages": 2,
        "num_warps": 4,
        "ms": 1.101775050163269,
        "min_ms": 1.101775050163269,
        "max_ms": 1.101775050163269,
        "compile_time": 1.205765724182129
    },
    {
        "BLOCK_SIZE_M": 32,
        "BLOCK_SIZE_N": 128,
        "BLOCK_SIZE_K": 64,
        "GROUP_SIZE_M": 8,
        "num_stages": 5,
        "num_warps": 2,
        "ms": 1.1025919914245605,
        "min_ms": 1.1025919914245605,
        "max_ms": 1.1025919914245605,
        "compile_time": 1.2378003597259521
    },
    {
        "BLOCK_SIZE_M": 256,
        "BLOCK_SIZE_N": 32,
        "BLOCK_SIZE_K": 32,
        "GROUP_SIZE_M": 8,
        "num_stages": 5,
        "num_warps": 2,
        "ms": 1.1034761667251587,
        "min_ms": 1.1034761667251587,
        "max_ms": 1.1034761667251587,
        "compile_time": 1.316411018371582
    },
    {
        "BLOCK_SIZE_M": 64,
        "BLOCK_SIZE_N": 64,
        "BLOCK_SIZE_K": 16,
        "GROUP_SIZE_M": 8,
        "num_stages": 2,
        "num_warps": 2,
        "ms": 1.1034808158874512,
        "min_ms": 1.1034808158874512,
        "max_ms": 1.1034808158874512,
        "compile_time": 1.790339708328247
    },
    {
        "BLOCK_SIZE_M": 512,
        "BLOCK_SIZE_N": 64,
        "BLOCK_SIZE_K": 32,
        "GROUP_SIZE_M": 8,
        "num_stages": 3,
        "num_warps": 16,
        "ms": 1.103659987449646,
        "min_ms": 1.103659987449646,
        "max_ms": 1.103659987449646,
        "compile_time": 1.3375942707061768
    },
    {
        "BLOCK_SIZE_M": 128,
        "BLOCK_SIZE_N": 32,
        "BLOCK_SIZE_K": 64,
        "GROUP_SIZE_M": 8,
        "num_stages": 4,
        "num_warps": 8,
        "ms": 1.104038953781128,
        "min_ms": 1.104038953781128,
        "max_ms": 1.104038953781128,
        "compile_time": 1.3093230724334717
    },
    {
        "BLOCK_SIZE_M": 64,
        "BLOCK_SIZE_N": 256,
        "BLOCK_SIZE_K": 64,
        "GROUP_SIZE_M": 8,
        "num_stages": 4,
        "num_warps": 32,
        "ms": 1.1043435335159302,
        "min_ms": 1.1043435335159302,
        "max_ms": 1.1043435335159302,
        "compile_time": 1.2298502922058105
    },
    {
        "BLOCK_SIZE_M": 64,
        "BLOCK_SIZE_N": 256,
        "BLOCK_SIZE_K": 64,
        "GROUP_SIZE_M": 8,
        "num_stages": 5,
        "num_warps": 32,
        "ms": 1.1053317785263062,
        "min_ms": 1.1053317785263062,
        "max_ms": 1.1053317785263062,
        "compile_time": 1.2309134006500244
    },
    {
        "BLOCK_SIZE_M": 128,
        "BLOCK_SIZE_N": 32,
        "BLOCK_SIZE_K": 32,
        "GROUP_SIZE_M": 8,
        "num_stages": 7,
        "num_warps": 4,
        "ms": 1.1056232452392578,
        "min_ms": 1.1056232452392578,
        "max_ms": 1.1056232452392578,
        "compile_time": 1.3127343654632568
    },
    {
        "BLOCK_SIZE_M": 32,
        "BLOCK_SIZE_N": 256,
        "BLOCK_SIZE_K": 16,
        "GROUP_SIZE_M": 8,
        "num_stages": 7,
        "num_warps": 8,
        "ms": 1.1057283878326416,
        "min_ms": 1.1057283878326416,
        "max_ms": 1.1057283878326416,
        "compile_time": 1.2590758800506592
    },
    {
        "BLOCK_SIZE_M": 128,
        "BLOCK_SIZE_N": 32,
        "BLOCK_SIZE_K": 128,
        "GROUP_SIZE_M": 8,
        "num_stages": 2,
        "num_warps": 4,
        "ms": 1.1058385372161865,
        "min_ms": 1.1058385372161865,
        "max_ms": 1.1058385372161865,
        "compile_time": 1.2681314945220947
    },
    {
        "BLOCK_SIZE_M": 32,
        "BLOCK_SIZE_N": 128,
        "BLOCK_SIZE_K": 128,
        "GROUP_SIZE_M": 8,
        "num_stages": 2,
        "num_warps": 4,
        "ms": 1.1074879169464111,
        "min_ms": 1.1074879169464111,
        "max_ms": 1.1074879169464111,
        "compile_time": 1.227752923965454
    },
    {
        "BLOCK_SIZE_M": 64,
        "BLOCK_SIZE_N": 256,
        "BLOCK_SIZE_K": 64,
        "GROUP_SIZE_M": 8,
        "num_stages": 3,
        "num_warps": 32,
        "ms": 1.1074965000152588,
        "min_ms": 1.1074965000152588,
        "max_ms": 1.1074965000152588,
        "compile_time": 1.2322313785552979
    },
    {
        "BLOCK_SIZE_M": 64,
        "BLOCK_SIZE_N": 64,
        "BLOCK_SIZE_K": 16,
        "GROUP_SIZE_M": 8,
        "num_stages": 3,
        "num_warps": 4,
        "ms": 1.1076191663742065,
        "min_ms": 1.1076191663742065,
        "max_ms": 1.1076191663742065,
        "compile_time": 1.265211820602417
    },
    {
        "BLOCK_SIZE_M": 128,
        "BLOCK_SIZE_N": 32,
        "BLOCK_SIZE_K": 64,
        "GROUP_SIZE_M": 8,
        "num_stages": 5,
        "num_warps": 8,
        "ms": 1.1079410314559937,
        "min_ms": 1.1079410314559937,
        "max_ms": 1.1079410314559937,
        "compile_time": 1.3041110038757324
    },
    {
        "BLOCK_SIZE_M": 32,
        "BLOCK_SIZE_N": 128,
        "BLOCK_SIZE_K": 32,
        "GROUP_SIZE_M": 8,
        "num_stages": 7,
        "num_warps": 2,
        "ms": 1.108237385749817,
        "min_ms": 1.108237385749817,
        "max_ms": 1.108237385749817,
        "compile_time": 1.2417027950286865
    },
    {
        "BLOCK_SIZE_M": 32,
        "BLOCK_SIZE_N": 128,
        "BLOCK_SIZE_K": 16,
        "GROUP_SIZE_M": 8,
        "num_stages": 5,
        "num_warps": 2,
        "ms": 1.1087696552276611,
        "min_ms": 1.1087696552276611,
        "max_ms": 1.1087696552276611,
        "compile_time": 1.2510998249053955
    },
    {
        "BLOCK_SIZE_M": 128,
        "BLOCK_SIZE_N": 64,
        "BLOCK_SIZE_K": 16,
        "GROUP_SIZE_M": 8,
        "num_stages": 4,
        "num_warps": 8,
        "ms": 1.1087963581085205,
        "min_ms": 1.1087963581085205,
        "max_ms": 1.1087963581085205,
        "compile_time": 1.300424337387085
    },
    {
        "BLOCK_SIZE_M": 256,
        "BLOCK_SIZE_N": 64,
        "BLOCK_SIZE_K": 64,
        "GROUP_SIZE_M": 8,
        "num_stages": 2,
        "num_warps": 16,
        "ms": 1.109052300453186,
        "min_ms": 1.109052300453186,
        "max_ms": 1.109052300453186,
        "compile_time": 1.2960550785064697
    },
    {
        "BLOCK_SIZE_M": 32,
        "BLOCK_SIZE_N": 256,
        "BLOCK_SIZE_K": 16,
        "GROUP_SIZE_M": 8,
        "num_stages": 8,
        "num_warps": 8,
        "ms": 1.109399437904358,
        "min_ms": 1.109399437904358,
        "max_ms": 1.109399437904358,
        "compile_time": 1.2697913646697998
    },
    {
        "BLOCK_SIZE_M": 32,
        "BLOCK_SIZE_N": 128,
        "BLOCK_SIZE_K": 16,
        "GROUP_SIZE_M": 8,
        "num_stages": 4,
        "num_warps": 2,
        "ms": 1.110174536705017,
        "min_ms": 1.110174536705017,
        "max_ms": 1.110174536705017,
        "compile_time": 1.2530152797698975
    },
    {
        "BLOCK_SIZE_M": 32,
        "BLOCK_SIZE_N": 128,
        "BLOCK_SIZE_K": 64,
        "GROUP_SIZE_M": 8,
        "num_stages": 4,
        "num_warps": 4,
        "ms": 1.1105940341949463,
        "min_ms": 1.1105940341949463,
        "max_ms": 1.1105940341949463,
        "compile_time": 1.228079080581665
    },
    {
        "BLOCK_SIZE_M": 32,
        "BLOCK_SIZE_N": 256,
        "BLOCK_SIZE_K": 16,
        "GROUP_SIZE_M": 8,
        "num_stages": 3,
        "num_warps": 8,
        "ms": 1.110781192779541,
        "min_ms": 1.110781192779541,
        "max_ms": 1.110781192779541,
        "compile_time": 1.2533340454101562
    },
    {
        "BLOCK_SIZE_M": 128,
        "BLOCK_SIZE_N": 64,
        "BLOCK_SIZE_K": 16,
        "GROUP_SIZE_M": 8,
        "num_stages": 5,
        "num_warps": 8,
        "ms": 1.111491084098816,
        "min_ms": 1.111491084098816,
        "max_ms": 1.111491084098816,
        "compile_time": 1.2980387210845947
    },
    {
        "BLOCK_SIZE_M": 128,
        "BLOCK_SIZE_N": 64,
        "BLOCK_SIZE_K": 16,
        "GROUP_SIZE_M": 8,
        "num_stages": 6,
        "num_warps": 8,
        "ms": 1.1117141246795654,
        "min_ms": 1.1117141246795654,
        "max_ms": 1.1117141246795654,
        "compile_time": 1.2936577796936035
    },
    {
        "BLOCK_SIZE_M": 32,
        "BLOCK_SIZE_N": 128,
        "BLOCK_SIZE_K": 64,
        "GROUP_SIZE_M": 8,
        "num_stages": 5,
        "num_warps": 4,
        "ms": 1.1117174625396729,
        "min_ms": 1.1117174625396729,
        "max_ms": 1.1117174625396729,
        "compile_time": 1.2369441986083984
    },
    {
        "BLOCK_SIZE_M": 128,
        "BLOCK_SIZE_N": 32,
        "BLOCK_SIZE_K": 32,
        "GROUP_SIZE_M": 8,
        "num_stages": 8,
        "num_warps": 4,
        "ms": 1.1117870807647705,
        "min_ms": 1.1117870807647705,
        "max_ms": 1.1117870807647705,
        "compile_time": 1.3058381080627441
    },
    {
        "BLOCK_SIZE_M": 32,
        "BLOCK_SIZE_N": 128,
        "BLOCK_SIZE_K": 32,
        "GROUP_SIZE_M": 8,
        "num_stages": 7,
        "num_warps": 4,
        "ms": 1.1117970943450928,
        "min_ms": 1.1117970943450928,
        "max_ms": 1.1117970943450928,
        "compile_time": 1.2253787517547607
    },
    {
        "BLOCK_SIZE_M": 64,
        "BLOCK_SIZE_N": 64,
        "BLOCK_SIZE_K": 256,
        "GROUP_SIZE_M": 8,
        "num_stages": 2,
        "num_warps": 8,
        "ms": 1.1122223138809204,
        "min_ms": 1.1122223138809204,
        "max_ms": 1.1122223138809204,
        "compile_time": 1.2731831073760986
    },
    {
        "BLOCK_SIZE_M": 128,
        "BLOCK_SIZE_N": 32,
        "BLOCK_SIZE_K": 128,
        "GROUP_SIZE_M": 8,
        "num_stages": 3,
        "num_warps": 4,
        "ms": 1.1128668785095215,
        "min_ms": 1.1128668785095215,
        "max_ms": 1.1128668785095215,
        "compile_time": 1.279222011566162
    },
    {
        "BLOCK_SIZE_M": 128,
        "BLOCK_SIZE_N": 64,
        "BLOCK_SIZE_K": 16,
        "GROUP_SIZE_M": 8,
        "num_stages": 7,
        "num_warps": 8,
        "ms": 1.1132075786590576,
        "min_ms": 1.1132075786590576,
        "max_ms": 1.1132075786590576,
        "compile_time": 1.2947604656219482
    },
    {
        "BLOCK_SIZE_M": 32,
        "BLOCK_SIZE_N": 128,
        "BLOCK_SIZE_K": 32,
        "GROUP_SIZE_M": 8,
        "num_stages": 8,
        "num_warps": 4,
        "ms": 1.1139320135116577,
        "min_ms": 1.1139320135116577,
        "max_ms": 1.1139320135116577,
        "compile_time": 1.2544124126434326
    },
    {
        "BLOCK_SIZE_M": 256,
        "BLOCK_SIZE_N": 32,
        "BLOCK_SIZE_K": 32,
        "GROUP_SIZE_M": 8,
        "num_stages": 7,
        "num_warps": 8,
        "ms": 1.1147902011871338,
        "min_ms": 1.1147902011871338,
        "max_ms": 1.1147902011871338,
        "compile_time": 1.3393926620483398
    },
    {
        "BLOCK_SIZE_M": 128,
        "BLOCK_SIZE_N": 32,
        "BLOCK_SIZE_K": 128,
        "GROUP_SIZE_M": 8,
        "num_stages": 5,
        "num_warps": 4,
        "ms": 1.1148754358291626,
        "min_ms": 1.1148754358291626,
        "max_ms": 1.1148754358291626,
        "compile_time": 1.2806644439697266
    },
    {
        "BLOCK_SIZE_M": 64,
        "BLOCK_SIZE_N": 128,
        "BLOCK_SIZE_K": 256,
        "GROUP_SIZE_M": 8,
        "num_stages": 2,
        "num_warps": 8,
        "ms": 1.1157076358795166,
        "min_ms": 1.1157076358795166,
        "max_ms": 1.1157076358795166,
        "compile_time": 1.238133192062378
    },
    {
        "BLOCK_SIZE_M": 32,
        "BLOCK_SIZE_N": 256,
        "BLOCK_SIZE_K": 32,
        "GROUP_SIZE_M": 8,
        "num_stages": 2,
        "num_warps": 2,
        "ms": 1.1158186197280884,
        "min_ms": 1.1158186197280884,
        "max_ms": 1.1158186197280884,
        "compile_time": 1.2066617012023926
    },
    {
        "BLOCK_SIZE_M": 64,
        "BLOCK_SIZE_N": 128,
        "BLOCK_SIZE_K": 16,
        "GROUP_SIZE_M": 8,
        "num_stages": 2,
        "num_warps": 2,
        "ms": 1.1159961223602295,
        "min_ms": 1.1159961223602295,
        "max_ms": 1.1159961223602295,
        "compile_time": 2.0674402713775635
    },
    {
        "BLOCK_SIZE_M": 128,
        "BLOCK_SIZE_N": 64,
        "BLOCK_SIZE_K": 16,
        "GROUP_SIZE_M": 8,
        "num_stages": 8,
        "num_warps": 8,
        "ms": 1.1173381805419922,
        "min_ms": 1.1173381805419922,
        "max_ms": 1.1173381805419922,
        "compile_time": 1.295783281326294
    },
    {
        "BLOCK_SIZE_M": 64,
        "BLOCK_SIZE_N": 64,
        "BLOCK_SIZE_K": 64,
        "GROUP_SIZE_M": 8,
        "num_stages": 7,
        "num_warps": 2,
        "ms": 1.1176292896270752,
        "min_ms": 1.1176292896270752,
        "max_ms": 1.1176292896270752,
        "compile_time": 1.2303879261016846
    },
    {
        "BLOCK_SIZE_M": 128,
        "BLOCK_SIZE_N": 32,
        "BLOCK_SIZE_K": 256,
        "GROUP_SIZE_M": 8,
        "num_stages": 2,
        "num_warps": 4,
        "ms": 1.1182267665863037,
        "min_ms": 1.1182267665863037,
        "max_ms": 1.1182267665863037,
        "compile_time": 1.2735075950622559
    },
    {
        "BLOCK_SIZE_M": 512,
        "BLOCK_SIZE_N": 64,
        "BLOCK_SIZE_K": 16,
        "GROUP_SIZE_M": 8,
        "num_stages": 4,
        "num_warps": 8,
        "ms": 1.1184418201446533,
        "min_ms": 1.1184418201446533,
        "max_ms": 1.1184418201446533,
        "compile_time": 2.4073474407196045
    },
    {
        "BLOCK_SIZE_M": 32,
        "BLOCK_SIZE_N": 128,
        "BLOCK_SIZE_K": 16,
        "GROUP_SIZE_M": 8,
        "num_stages": 6,
        "num_warps": 2,
        "ms": 1.118445873260498,
        "min_ms": 1.118445873260498,
        "max_ms": 1.118445873260498,
        "compile_time": 1.2567427158355713
    },
    {
        "BLOCK_SIZE_M": 64,
        "BLOCK_SIZE_N": 256,
        "BLOCK_SIZE_K": 128,
        "GROUP_SIZE_M": 8,
        "num_stages": 2,
        "num_warps": 4,
        "ms": 1.1186273097991943,
        "min_ms": 1.1186273097991943,
        "max_ms": 1.1186273097991943,
        "compile_time": 1.2331936359405518
    },
    {
        "BLOCK_SIZE_M": 256,
        "BLOCK_SIZE_N": 64,
        "BLOCK_SIZE_K": 256,
        "GROUP_SIZE_M": 8,
        "num_stages": 2,
        "num_warps": 8,
        "ms": 1.119284987449646,
        "min_ms": 1.119284987449646,
        "max_ms": 1.119284987449646,
        "compile_time": 1.302922010421753
    },
    {
        "BLOCK_SIZE_M": 32,
        "BLOCK_SIZE_N": 128,
        "BLOCK_SIZE_K": 64,
        "GROUP_SIZE_M": 8,
        "num_stages": 6,
        "num_warps": 4,
        "ms": 1.1193701028823853,
        "min_ms": 1.1193701028823853,
        "max_ms": 1.1193701028823853,
        "compile_time": 1.2215049266815186
    },
    {
        "BLOCK_SIZE_M": 512,
        "BLOCK_SIZE_N": 64,
        "BLOCK_SIZE_K": 16,
        "GROUP_SIZE_M": 8,
        "num_stages": 3,
        "num_warps": 8,
        "ms": 1.120255947113037,
        "min_ms": 1.120255947113037,
        "max_ms": 1.120255947113037,
        "compile_time": 2.416381359100342
    },
    {
        "BLOCK_SIZE_M": 64,
        "BLOCK_SIZE_N": 64,
        "BLOCK_SIZE_K": 32,
        "GROUP_SIZE_M": 8,
        "num_stages": 8,
        "num_warps": 8,
        "ms": 1.1204379796981812,
        "min_ms": 1.1204379796981812,
        "max_ms": 1.1204379796981812,
        "compile_time": 1.2705790996551514
    },
    {
        "BLOCK_SIZE_M": 512,
        "BLOCK_SIZE_N": 64,
        "BLOCK_SIZE_K": 64,
        "GROUP_SIZE_M": 8,
        "num_stages": 2,
        "num_warps": 16,
        "ms": 1.12063467502594,
        "min_ms": 1.12063467502594,
        "max_ms": 1.12063467502594,
        "compile_time": 1.3442256450653076
    },
    {
        "BLOCK_SIZE_M": 512,
        "BLOCK_SIZE_N": 64,
        "BLOCK_SIZE_K": 16,
        "GROUP_SIZE_M": 8,
        "num_stages": 5,
        "num_warps": 8,
        "ms": 1.1209468841552734,
        "min_ms": 1.1209468841552734,
        "max_ms": 1.1209468841552734,
        "compile_time": 2.416290044784546
    },
    {
        "BLOCK_SIZE_M": 256,
        "BLOCK_SIZE_N": 32,
        "BLOCK_SIZE_K": 32,
        "GROUP_SIZE_M": 8,
        "num_stages": 8,
        "num_warps": 8,
        "ms": 1.1212775707244873,
        "min_ms": 1.1212775707244873,
        "max_ms": 1.1212775707244873,
        "compile_time": 1.3322815895080566
    },
    {
        "BLOCK_SIZE_M": 32,
        "BLOCK_SIZE_N": 128,
        "BLOCK_SIZE_K": 16,
        "GROUP_SIZE_M": 8,
        "num_stages": 7,
        "num_warps": 2,
        "ms": 1.1219053268432617,
        "min_ms": 1.1219053268432617,
        "max_ms": 1.1219053268432617,
        "compile_time": 1.2601447105407715
    },
    {
        "BLOCK_SIZE_M": 64,
        "BLOCK_SIZE_N": 64,
        "BLOCK_SIZE_K": 64,
        "GROUP_SIZE_M": 8,
        "num_stages": 8,
        "num_warps": 2,
        "ms": 1.1219570636749268,
        "min_ms": 1.1219570636749268,
        "max_ms": 1.1219570636749268,
        "compile_time": 1.2227685451507568
    },
    {
        "BLOCK_SIZE_M": 512,
        "BLOCK_SIZE_N": 64,
        "BLOCK_SIZE_K": 16,
        "GROUP_SIZE_M": 8,
        "num_stages": 6,
        "num_warps": 8,
        "ms": 1.1233062744140625,
        "min_ms": 1.1233062744140625,
        "max_ms": 1.1233062744140625,
        "compile_time": 2.4552040100097656
    },
    {
        "BLOCK_SIZE_M": 32,
        "BLOCK_SIZE_N": 128,
        "BLOCK_SIZE_K": 64,
        "GROUP_SIZE_M": 8,
        "num_stages": 7,
        "num_warps": 4,
        "ms": 1.1237735748291016,
        "min_ms": 1.1237735748291016,
        "max_ms": 1.1237735748291016,
        "compile_time": 1.2459948062896729
    },
    {
        "BLOCK_SIZE_M": 128,
        "BLOCK_SIZE_N": 32,
        "BLOCK_SIZE_K": 64,
        "GROUP_SIZE_M": 8,
        "num_stages": 2,
        "num_warps": 4,
        "ms": 1.1243171691894531,
        "min_ms": 1.1243171691894531,
        "max_ms": 1.1243171691894531,
        "compile_time": 1.2828960418701172
    },
    {
        "BLOCK_SIZE_M": 512,
        "BLOCK_SIZE_N": 64,
        "BLOCK_SIZE_K": 16,
        "GROUP_SIZE_M": 8,
        "num_stages": 8,
        "num_warps": 8,
        "ms": 1.1248700618743896,
        "min_ms": 1.1248700618743896,
        "max_ms": 1.1248700618743896,
        "compile_time": 2.496858835220337
    },
    {
        "BLOCK_SIZE_M": 32,
        "BLOCK_SIZE_N": 128,
        "BLOCK_SIZE_K": 128,
        "GROUP_SIZE_M": 8,
        "num_stages": 2,
        "num_warps": 2,
        "ms": 1.1255289316177368,
        "min_ms": 1.1255289316177368,
        "max_ms": 1.1255289316177368,
        "compile_time": 1.2076690196990967
    },
    {
        "BLOCK_SIZE_M": 64,
        "BLOCK_SIZE_N": 256,
        "BLOCK_SIZE_K": 64,
        "GROUP_SIZE_M": 8,
        "num_stages": 2,
        "num_warps": 16,
        "ms": 1.1257470846176147,
        "min_ms": 1.1257470846176147,
        "max_ms": 1.1257470846176147,
        "compile_time": 1.2404937744140625
    },
    {
        "BLOCK_SIZE_M": 32,
        "BLOCK_SIZE_N": 128,
        "BLOCK_SIZE_K": 16,
        "GROUP_SIZE_M": 8,
        "num_stages": 8,
        "num_warps": 2,
        "ms": 1.1257810592651367,
        "min_ms": 1.1257810592651367,
        "max_ms": 1.1257810592651367,
        "compile_time": 1.2526116371154785
    },
    {
        "BLOCK_SIZE_M": 512,
        "BLOCK_SIZE_N": 64,
        "BLOCK_SIZE_K": 16,
        "GROUP_SIZE_M": 8,
        "num_stages": 7,
        "num_warps": 8,
        "ms": 1.12599778175354,
        "min_ms": 1.12599778175354,
        "max_ms": 1.12599778175354,
        "compile_time": 2.479553699493408
    },
    {
        "BLOCK_SIZE_M": 32,
        "BLOCK_SIZE_N": 128,
        "BLOCK_SIZE_K": 32,
        "GROUP_SIZE_M": 8,
        "num_stages": 2,
        "num_warps": 2,
        "ms": 1.1261080503463745,
        "min_ms": 1.1261080503463745,
        "max_ms": 1.1261080503463745,
        "compile_time": 1.2077324390411377
    },
    {
        "BLOCK_SIZE_M": 128,
        "BLOCK_SIZE_N": 64,
        "BLOCK_SIZE_K": 16,
        "GROUP_SIZE_M": 8,
        "num_stages": 3,
        "num_warps": 8,
        "ms": 1.1265642642974854,
        "min_ms": 1.1265642642974854,
        "max_ms": 1.1265642642974854,
        "compile_time": 1.2740375995635986
    },
    {
        "BLOCK_SIZE_M": 32,
        "BLOCK_SIZE_N": 128,
        "BLOCK_SIZE_K": 64,
        "GROUP_SIZE_M": 8,
        "num_stages": 8,
        "num_warps": 4,
        "ms": 1.1273716688156128,
        "min_ms": 1.1273716688156128,
        "max_ms": 1.1273716688156128,
        "compile_time": 1.2435226440429688
    },
    {
        "BLOCK_SIZE_M": 256,
        "BLOCK_SIZE_N": 64,
        "BLOCK_SIZE_K": 256,
        "GROUP_SIZE_M": 8,
        "num_stages": 2,
        "num_warps": 16,
        "ms": 1.1274631023406982,
        "min_ms": 1.1274631023406982,
        "max_ms": 1.1274631023406982,
        "compile_time": 1.3023459911346436
    },
    {
        "BLOCK_SIZE_M": 128,
        "BLOCK_SIZE_N": 32,
        "BLOCK_SIZE_K": 128,
        "GROUP_SIZE_M": 8,
        "num_stages": 3,
        "num_warps": 2,
        "ms": 1.1276147365570068,
        "min_ms": 1.1276147365570068,
        "max_ms": 1.1276147365570068,
        "compile_time": 1.2794363498687744
    },
    {
        "BLOCK_SIZE_M": 32,
        "BLOCK_SIZE_N": 128,
        "BLOCK_SIZE_K": 128,
        "GROUP_SIZE_M": 8,
        "num_stages": 3,
        "num_warps": 4,
        "ms": 1.1288576126098633,
        "min_ms": 1.1288576126098633,
        "max_ms": 1.1288576126098633,
        "compile_time": 1.2452600002288818
    },
    {
        "BLOCK_SIZE_M": 64,
        "BLOCK_SIZE_N": 128,
        "BLOCK_SIZE_K": 32,
        "GROUP_SIZE_M": 8,
        "num_stages": 1,
        "num_warps": 8,
        "ms": 1.128963589668274,
        "min_ms": 1.128963589668274,
        "max_ms": 1.128963589668274,
        "compile_time": 1.251793384552002
    },
    {
        "BLOCK_SIZE_M": 512,
        "BLOCK_SIZE_N": 64,
        "BLOCK_SIZE_K": 32,
        "GROUP_SIZE_M": 8,
        "num_stages": 5,
        "num_warps": 16,
        "ms": 1.1294305324554443,
        "min_ms": 1.1294305324554443,
        "max_ms": 1.1294305324554443,
        "compile_time": 1.3267874717712402
    },
    {
        "BLOCK_SIZE_M": 32,
        "BLOCK_SIZE_N": 256,
        "BLOCK_SIZE_K": 32,
        "GROUP_SIZE_M": 8,
        "num_stages": 4,
        "num_warps": 2,
        "ms": 1.1300491094589233,
        "min_ms": 1.1300491094589233,
        "max_ms": 1.1300491094589233,
        "compile_time": 1.2259023189544678
    },
    {
        "BLOCK_SIZE_M": 128,
        "BLOCK_SIZE_N": 128,
        "BLOCK_SIZE_K": 256,
        "GROUP_SIZE_M": 8,
        "num_stages": 1,
        "num_warps": 16,
        "ms": 1.1302618980407715,
        "min_ms": 1.1302618980407715,
        "max_ms": 1.1302618980407715,
        "compile_time": 1.2676002979278564
    },
    {
        "BLOCK_SIZE_M": 128,
        "BLOCK_SIZE_N": 32,
        "BLOCK_SIZE_K": 64,
        "GROUP_SIZE_M": 8,
        "num_stages": 2,
        "num_warps": 2,
        "ms": 1.1315581798553467,
        "min_ms": 1.1315581798553467,
        "max_ms": 1.1315581798553467,
        "compile_time": 1.2750279903411865
    },
    {
        "BLOCK_SIZE_M": 256,
        "BLOCK_SIZE_N": 32,
        "BLOCK_SIZE_K": 32,
        "GROUP_SIZE_M": 8,
        "num_stages": 6,
        "num_warps": 8,
        "ms": 1.1324818134307861,
        "min_ms": 1.1324818134307861,
        "max_ms": 1.1324818134307861,
        "compile_time": 1.3619740009307861
    },
    {
        "BLOCK_SIZE_M": 128,
        "BLOCK_SIZE_N": 64,
        "BLOCK_SIZE_K": 256,
        "GROUP_SIZE_M": 8,
        "num_stages": 2,
        "num_warps": 4,
        "ms": 1.1328163146972656,
        "min_ms": 1.1328163146972656,
        "max_ms": 1.1328163146972656,
        "compile_time": 1.2733607292175293
    },
    {
        "BLOCK_SIZE_M": 32,
        "BLOCK_SIZE_N": 128,
        "BLOCK_SIZE_K": 64,
        "GROUP_SIZE_M": 8,
        "num_stages": 4,
        "num_warps": 8,
        "ms": 1.133777379989624,
        "min_ms": 1.133777379989624,
        "max_ms": 1.133777379989624,
        "compile_time": 1.2712743282318115
    },
    {
        "BLOCK_SIZE_M": 256,
        "BLOCK_SIZE_N": 128,
        "BLOCK_SIZE_K": 32,
        "GROUP_SIZE_M": 8,
        "num_stages": 1,
        "num_warps": 16,
        "ms": 1.1340075731277466,
        "min_ms": 1.1340075731277466,
        "max_ms": 1.1340075731277466,
        "compile_time": 1.2902708053588867
    },
    {
        "BLOCK_SIZE_M": 32,
        "BLOCK_SIZE_N": 128,
        "BLOCK_SIZE_K": 128,
        "GROUP_SIZE_M": 8,
        "num_stages": 4,
        "num_warps": 4,
        "ms": 1.1355791091918945,
        "min_ms": 1.1355791091918945,
        "max_ms": 1.1355791091918945,
        "compile_time": 1.235668420791626
    },
    {
        "BLOCK_SIZE_M": 32,
        "BLOCK_SIZE_N": 128,
        "BLOCK_SIZE_K": 128,
        "GROUP_SIZE_M": 8,
        "num_stages": 5,
        "num_warps": 4,
        "ms": 1.1356273889541626,
        "min_ms": 1.1356273889541626,
        "max_ms": 1.1356273889541626,
        "compile_time": 1.2507028579711914
    },
    {
        "BLOCK_SIZE_M": 128,
        "BLOCK_SIZE_N": 256,
        "BLOCK_SIZE_K": 16,
        "GROUP_SIZE_M": 8,
        "num_stages": 3,
        "num_warps": 32,
        "ms": 1.1368911266326904,
        "min_ms": 1.1368911266326904,
        "max_ms": 1.1368911266326904,
        "compile_time": 1.282381534576416
    },
    {
        "BLOCK_SIZE_M": 128,
        "BLOCK_SIZE_N": 64,
        "BLOCK_SIZE_K": 32,
        "GROUP_SIZE_M": 8,
        "num_stages": 3,
        "num_warps": 16,
        "ms": 1.13738214969635,
        "min_ms": 1.13738214969635,
        "max_ms": 1.13738214969635,
        "compile_time": 1.27101731300354
    },
    {
        "BLOCK_SIZE_M": 256,
        "BLOCK_SIZE_N": 32,
        "BLOCK_SIZE_K": 64,
        "GROUP_SIZE_M": 8,
        "num_stages": 3,
        "num_warps": 16,
        "ms": 1.137817144393921,
        "min_ms": 1.137817144393921,
        "max_ms": 1.137817144393921,
        "compile_time": 1.3244938850402832
    },
    {
        "BLOCK_SIZE_M": 128,
        "BLOCK_SIZE_N": 64,
        "BLOCK_SIZE_K": 32,
        "GROUP_SIZE_M": 8,
        "num_stages": 4,
        "num_warps": 16,
        "ms": 1.1386663913726807,
        "min_ms": 1.1386663913726807,
        "max_ms": 1.1386663913726807,
        "compile_time": 1.2709410190582275
    },
    {
        "BLOCK_SIZE_M": 512,
        "BLOCK_SIZE_N": 32,
        "BLOCK_SIZE_K": 32,
        "GROUP_SIZE_M": 8,
        "num_stages": 4,
        "num_warps": 16,
        "ms": 1.1393566131591797,
        "min_ms": 1.1393566131591797,
        "max_ms": 1.1393566131591797,
        "compile_time": 1.3575077056884766
    },
    {
        "BLOCK_SIZE_M": 512,
        "BLOCK_SIZE_N": 32,
        "BLOCK_SIZE_K": 32,
        "GROUP_SIZE_M": 8,
        "num_stages": 4,
        "num_warps": 4,
        "ms": 1.1394776105880737,
        "min_ms": 1.1394776105880737,
        "max_ms": 1.1394776105880737,
        "compile_time": 2.907316207885742
    },
    {
        "BLOCK_SIZE_M": 64,
        "BLOCK_SIZE_N": 128,
        "BLOCK_SIZE_K": 32,
        "GROUP_SIZE_M": 8,
        "num_stages": 8,
        "num_warps": 2,
        "ms": 1.140404462814331,
        "min_ms": 1.140404462814331,
        "max_ms": 1.140404462814331,
        "compile_time": 1.2305445671081543
    },
    {
        "BLOCK_SIZE_M": 128,
        "BLOCK_SIZE_N": 256,
        "BLOCK_SIZE_K": 16,
        "GROUP_SIZE_M": 8,
        "num_stages": 4,
        "num_warps": 32,
        "ms": 1.1406199932098389,
        "min_ms": 1.1406199932098389,
        "max_ms": 1.1406199932098389,
        "compile_time": 1.27211332321167
    },
    {
        "BLOCK_SIZE_M": 256,
        "BLOCK_SIZE_N": 32,
        "BLOCK_SIZE_K": 64,
        "GROUP_SIZE_M": 8,
        "num_stages": 4,
        "num_warps": 16,
        "ms": 1.1407736539840698,
        "min_ms": 1.1407736539840698,
        "max_ms": 1.1407736539840698,
        "compile_time": 1.3244709968566895
    },
    {
        "BLOCK_SIZE_M": 32,
        "BLOCK_SIZE_N": 128,
        "BLOCK_SIZE_K": 64,
        "GROUP_SIZE_M": 8,
        "num_stages": 2,
        "num_warps": 4,
        "ms": 1.1409980058670044,
        "min_ms": 1.1409980058670044,
        "max_ms": 1.1409980058670044,
        "compile_time": 1.2169218063354492
    },
    {
        "BLOCK_SIZE_M": 32,
        "BLOCK_SIZE_N": 128,
        "BLOCK_SIZE_K": 64,
        "GROUP_SIZE_M": 8,
        "num_stages": 5,
        "num_warps": 8,
        "ms": 1.1415324211120605,
        "min_ms": 1.1415324211120605,
        "max_ms": 1.1415324211120605,
        "compile_time": 1.2561254501342773
    },
    {
        "BLOCK_SIZE_M": 128,
        "BLOCK_SIZE_N": 64,
        "BLOCK_SIZE_K": 32,
        "GROUP_SIZE_M": 8,
        "num_stages": 6,
        "num_warps": 16,
        "ms": 1.1418453454971313,
        "min_ms": 1.1418453454971313,
        "max_ms": 1.1418453454971313,
        "compile_time": 1.2663373947143555
    },
    {
        "BLOCK_SIZE_M": 128,
        "BLOCK_SIZE_N": 64,
        "BLOCK_SIZE_K": 32,
        "GROUP_SIZE_M": 8,
        "num_stages": 5,
        "num_warps": 16,
        "ms": 1.1424434185028076,
        "min_ms": 1.1424434185028076,
        "max_ms": 1.1424434185028076,
        "compile_time": 1.2874081134796143
    },
    {
        "BLOCK_SIZE_M": 128,
        "BLOCK_SIZE_N": 256,
        "BLOCK_SIZE_K": 16,
        "GROUP_SIZE_M": 8,
        "num_stages": 5,
        "num_warps": 32,
        "ms": 1.1425182819366455,
        "min_ms": 1.1425182819366455,
        "max_ms": 1.1425182819366455,
        "compile_time": 1.2801895141601562
    },
    {
        "BLOCK_SIZE_M": 32,
        "BLOCK_SIZE_N": 128,
        "BLOCK_SIZE_K": 64,
        "GROUP_SIZE_M": 8,
        "num_stages": 3,
        "num_warps": 8,
        "ms": 1.143532633781433,
        "min_ms": 1.143532633781433,
        "max_ms": 1.143532633781433,
        "compile_time": 1.2523064613342285
    },
    {
        "BLOCK_SIZE_M": 64,
        "BLOCK_SIZE_N": 64,
        "BLOCK_SIZE_K": 64,
        "GROUP_SIZE_M": 8,
        "num_stages": 1,
        "num_warps": 4,
        "ms": 1.143665075302124,
        "min_ms": 1.143665075302124,
        "max_ms": 1.143665075302124,
        "compile_time": 1.2473065853118896
    },
    {
        "BLOCK_SIZE_M": 512,
        "BLOCK_SIZE_N": 32,
        "BLOCK_SIZE_K": 32,
        "GROUP_SIZE_M": 8,
        "num_stages": 5,
        "num_warps": 4,
        "ms": 1.1443212032318115,
        "min_ms": 1.1443212032318115,
        "max_ms": 1.1443212032318115,
        "compile_time": 2.998152732849121
    },
    {
        "BLOCK_SIZE_M": 64,
        "BLOCK_SIZE_N": 128,
        "BLOCK_SIZE_K": 32,
        "GROUP_SIZE_M": 8,
        "num_stages": 1,
        "num_warps": 2,
        "ms": 1.1444076299667358,
        "min_ms": 1.1444076299667358,
        "max_ms": 1.1444076299667358,
        "compile_time": 1.2224996089935303
    },
    {
        "BLOCK_SIZE_M": 128,
        "BLOCK_SIZE_N": 64,
        "BLOCK_SIZE_K": 32,
        "GROUP_SIZE_M": 8,
        "num_stages": 7,
        "num_warps": 16,
        "ms": 1.144970178604126,
        "min_ms": 1.144970178604126,
        "max_ms": 1.144970178604126,
        "compile_time": 1.2890751361846924
    },
    {
        "BLOCK_SIZE_M": 512,
        "BLOCK_SIZE_N": 64,
        "BLOCK_SIZE_K": 16,
        "GROUP_SIZE_M": 8,
        "num_stages": 3,
        "num_warps": 16,
        "ms": 1.1450245380401611,
        "min_ms": 1.1450245380401611,
        "max_ms": 1.1450245380401611,
        "compile_time": 2.101475238800049
    },
    {
        "BLOCK_SIZE_M": 512,
        "BLOCK_SIZE_N": 64,
        "BLOCK_SIZE_K": 16,
        "GROUP_SIZE_M": 8,
        "num_stages": 5,
        "num_warps": 16,
        "ms": 1.1451528072357178,
        "min_ms": 1.1451528072357178,
        "max_ms": 1.1451528072357178,
        "compile_time": 2.0860626697540283
    },
    {
        "BLOCK_SIZE_M": 32,
        "BLOCK_SIZE_N": 128,
        "BLOCK_SIZE_K": 256,
        "GROUP_SIZE_M": 8,
        "num_stages": 2,
        "num_warps": 4,
        "ms": 1.1453579664230347,
        "min_ms": 1.1453579664230347,
        "max_ms": 1.1453579664230347,
        "compile_time": 1.2403924465179443
    },
    {
        "BLOCK_SIZE_M": 128,
        "BLOCK_SIZE_N": 32,
        "BLOCK_SIZE_K": 256,
        "GROUP_SIZE_M": 8,
        "num_stages": 3,
        "num_warps": 4,
        "ms": 1.1454212665557861,
        "min_ms": 1.1454212665557861,
        "max_ms": 1.1454212665557861,
        "compile_time": 1.1059410572052002
    },
    {
        "BLOCK_SIZE_M": 512,
        "BLOCK_SIZE_N": 64,
        "BLOCK_SIZE_K": 16,
        "GROUP_SIZE_M": 8,
        "num_stages": 6,
        "num_warps": 16,
        "ms": 1.1460040807724,
        "min_ms": 1.1460040807724,
        "max_ms": 1.1460040807724,
        "compile_time": 2.1046295166015625
    },
    {
        "BLOCK_SIZE_M": 32,
        "BLOCK_SIZE_N": 256,
        "BLOCK_SIZE_K": 64,
        "GROUP_SIZE_M": 8,
        "num_stages": 2,
        "num_warps": 4,
        "ms": 1.1477601528167725,
        "min_ms": 1.1477601528167725,
        "max_ms": 1.1477601528167725,
        "compile_time": 1.2036306858062744
    },
    {
        "BLOCK_SIZE_M": 256,
        "BLOCK_SIZE_N": 32,
        "BLOCK_SIZE_K": 64,
        "GROUP_SIZE_M": 8,
        "num_stages": 5,
        "num_warps": 16,
        "ms": 1.148146390914917,
        "min_ms": 1.148146390914917,
        "max_ms": 1.148146390914917,
        "compile_time": 1.3515520095825195
    },
    {
        "BLOCK_SIZE_M": 32,
        "BLOCK_SIZE_N": 256,
        "BLOCK_SIZE_K": 128,
        "GROUP_SIZE_M": 8,
        "num_stages": 3,
        "num_warps": 16,
        "ms": 1.1484509706497192,
        "min_ms": 1.1484509706497192,
        "max_ms": 1.1484509706497192,
        "compile_time": 1.2412786483764648
    },
    {
        "BLOCK_SIZE_M": 32,
        "BLOCK_SIZE_N": 128,
        "BLOCK_SIZE_K": 16,
        "GROUP_SIZE_M": 8,
        "num_stages": 2,
        "num_warps": 2,
        "ms": 1.1488938331604004,
        "min_ms": 1.1488938331604004,
        "max_ms": 1.1488938331604004,
        "compile_time": 1.1943671703338623
    },
    {
        "BLOCK_SIZE_M": 512,
        "BLOCK_SIZE_N": 64,
        "BLOCK_SIZE_K": 16,
        "GROUP_SIZE_M": 8,
        "num_stages": 4,
        "num_warps": 16,
        "ms": 1.149221658706665,
        "min_ms": 1.149221658706665,
        "max_ms": 1.149221658706665,
        "compile_time": 1.3321034908294678
    },
    {
        "BLOCK_SIZE_M": 512,
        "BLOCK_SIZE_N": 64,
        "BLOCK_SIZE_K": 16,
        "GROUP_SIZE_M": 8,
        "num_stages": 7,
        "num_warps": 16,
        "ms": 1.1506057977676392,
        "min_ms": 1.1506057977676392,
        "max_ms": 1.1506057977676392,
        "compile_time": 2.1152048110961914
    },
    {
        "BLOCK_SIZE_M": 64,
        "BLOCK_SIZE_N": 64,
        "BLOCK_SIZE_K": 128,
        "GROUP_SIZE_M": 8,
        "num_stages": 1,
        "num_warps": 2,
        "ms": 1.1506097316741943,
        "min_ms": 1.1506097316741943,
        "max_ms": 1.1506097316741943,
        "compile_time": 1.24183988571167
    },
    {
        "BLOCK_SIZE_M": 32,
        "BLOCK_SIZE_N": 256,
        "BLOCK_SIZE_K": 16,
        "GROUP_SIZE_M": 8,
        "num_stages": 2,
        "num_warps": 4,
        "ms": 1.1507909297943115,
        "min_ms": 1.1507909297943115,
        "max_ms": 1.1507909297943115,
        "compile_time": 1.192255973815918
    },
    {
        "BLOCK_SIZE_M": 32,
        "BLOCK_SIZE_N": 256,
        "BLOCK_SIZE_K": 32,
        "GROUP_SIZE_M": 8,
        "num_stages": 5,
        "num_warps": 2,
        "ms": 1.1509616374969482,
        "min_ms": 1.1509616374969482,
        "max_ms": 1.1509616374969482,
        "compile_time": 1.2235794067382812
    },
    {
        "BLOCK_SIZE_M": 256,
        "BLOCK_SIZE_N": 128,
        "BLOCK_SIZE_K": 32,
        "GROUP_SIZE_M": 8,
        "num_stages": 1,
        "num_warps": 32,
        "ms": 1.151289463043213,
        "min_ms": 1.151289463043213,
        "max_ms": 1.151289463043213,
        "compile_time": 1.3065364360809326
    },
    {
        "BLOCK_SIZE_M": 64,
        "BLOCK_SIZE_N": 128,
        "BLOCK_SIZE_K": 16,
        "GROUP_SIZE_M": 8,
        "num_stages": 1,
        "num_warps": 4,
        "ms": 1.1524169445037842,
        "min_ms": 1.1524169445037842,
        "max_ms": 1.1524169445037842,
        "compile_time": 1.743562936782837
    },
    {
        "BLOCK_SIZE_M": 128,
        "BLOCK_SIZE_N": 32,
        "BLOCK_SIZE_K": 64,
        "GROUP_SIZE_M": 8,
        "num_stages": 6,
        "num_warps": 8,
        "ms": 1.154101014137268,
        "min_ms": 1.154101014137268,
        "max_ms": 1.154101014137268,
        "compile_time": 1.2792060375213623
    },
    {
        "BLOCK_SIZE_M": 32,
        "BLOCK_SIZE_N": 128,
        "BLOCK_SIZE_K": 16,
        "GROUP_SIZE_M": 8,
        "num_stages": 4,
        "num_warps": 4,
        "ms": 1.1546061038970947,
        "min_ms": 1.1546061038970947,
        "max_ms": 1.1546061038970947,
        "compile_time": 1.265157699584961
    },
    {
        "BLOCK_SIZE_M": 64,
        "BLOCK_SIZE_N": 256,
        "BLOCK_SIZE_K": 32,
        "GROUP_SIZE_M": 8,
        "num_stages": 1,
        "num_warps": 4,
        "ms": 1.1554248332977295,
        "min_ms": 1.1554248332977295,
        "max_ms": 1.1554248332977295,
        "compile_time": 1.246265172958374
    },
    {
        "BLOCK_SIZE_M": 64,
        "BLOCK_SIZE_N": 64,
        "BLOCK_SIZE_K": 64,
        "GROUP_SIZE_M": 8,
        "num_stages": 1,
        "num_warps": 2,
        "ms": 1.156410813331604,
        "min_ms": 1.156410813331604,
        "max_ms": 1.156410813331604,
        "compile_time": 1.2150826454162598
    },
    {
        "BLOCK_SIZE_M": 512,
        "BLOCK_SIZE_N": 64,
        "BLOCK_SIZE_K": 16,
        "GROUP_SIZE_M": 8,
        "num_stages": 8,
        "num_warps": 16,
        "ms": 1.157381534576416,
        "min_ms": 1.157381534576416,
        "max_ms": 1.157381534576416,
        "compile_time": 1.3398823738098145
    },
    {
        "BLOCK_SIZE_M": 32,
        "BLOCK_SIZE_N": 512,
        "BLOCK_SIZE_K": 32,
        "GROUP_SIZE_M": 8,
        "num_stages": 2,
        "num_warps": 4,
        "ms": 1.1583563089370728,
        "min_ms": 1.1583563089370728,
        "max_ms": 1.1583563089370728,
        "compile_time": 1.2037041187286377
    },
    {
        "BLOCK_SIZE_M": 64,
        "BLOCK_SIZE_N": 256,
        "BLOCK_SIZE_K": 256,
        "GROUP_SIZE_M": 8,
        "num_stages": 1,
        "num_warps": 16,
        "ms": 1.1584961414337158,
        "min_ms": 1.1584961414337158,
        "max_ms": 1.1584961414337158,
        "compile_time": 1.2407166957855225
    },
    {
        "BLOCK_SIZE_M": 64,
        "BLOCK_SIZE_N": 64,
        "BLOCK_SIZE_K": 128,
        "GROUP_SIZE_M": 8,
        "num_stages": 1,
        "num_warps": 4,
        "ms": 1.161313533782959,
        "min_ms": 1.161313533782959,
        "max_ms": 1.161313533782959,
        "compile_time": 1.241103172302246
    },
    {
        "BLOCK_SIZE_M": 32,
        "BLOCK_SIZE_N": 128,
        "BLOCK_SIZE_K": 128,
        "GROUP_SIZE_M": 8,
        "num_stages": 3,
        "num_warps": 8,
        "ms": 1.1617927551269531,
        "min_ms": 1.1617927551269531,
        "max_ms": 1.1617927551269531,
        "compile_time": 1.2436742782592773
    },
    {
        "BLOCK_SIZE_M": 128,
        "BLOCK_SIZE_N": 32,
        "BLOCK_SIZE_K": 64,
        "GROUP_SIZE_M": 8,
        "num_stages": 7,
        "num_warps": 8,
        "ms": 1.1626135110855103,
        "min_ms": 1.1626135110855103,
        "max_ms": 1.1626135110855103,
        "compile_time": 1.2854843139648438
    },
    {
        "BLOCK_SIZE_M": 32,
        "BLOCK_SIZE_N": 128,
        "BLOCK_SIZE_K": 256,
        "GROUP_SIZE_M": 8,
        "num_stages": 3,
        "num_warps": 4,
        "ms": 1.163224220275879,
        "min_ms": 1.163224220275879,
        "max_ms": 1.163224220275879,
        "compile_time": 1.0930852890014648
    },
    {
        "BLOCK_SIZE_M": 32,
        "BLOCK_SIZE_N": 128,
        "BLOCK_SIZE_K": 32,
        "GROUP_SIZE_M": 8,
        "num_stages": 2,
        "num_warps": 4,
        "ms": 1.163413405418396,
        "min_ms": 1.163413405418396,
        "max_ms": 1.163413405418396,
        "compile_time": 1.2154932022094727
    },
    {
        "BLOCK_SIZE_M": 256,
        "BLOCK_SIZE_N": 128,
        "BLOCK_SIZE_K": 32,
        "GROUP_SIZE_M": 8,
        "num_stages": 2,
        "num_warps": 16,
        "ms": 1.1634514331817627,
        "min_ms": 1.1634514331817627,
        "max_ms": 1.1634514331817627,
        "compile_time": 1.3231287002563477
    },
    {
        "BLOCK_SIZE_M": 32,
        "BLOCK_SIZE_N": 128,
        "BLOCK_SIZE_K": 16,
        "GROUP_SIZE_M": 8,
        "num_stages": 3,
        "num_warps": 4,
        "ms": 1.1646790504455566,
        "min_ms": 1.1646790504455566,
        "max_ms": 1.1646790504455566,
        "compile_time": 1.2475337982177734
    },
    {
        "BLOCK_SIZE_M": 256,
        "BLOCK_SIZE_N": 32,
        "BLOCK_SIZE_K": 64,
        "GROUP_SIZE_M": 8,
        "num_stages": 2,
        "num_warps": 4,
        "ms": 1.1655542850494385,
        "min_ms": 1.1655542850494385,
        "max_ms": 1.1655542850494385,
        "compile_time": 1.2945811748504639
    },
    {
        "BLOCK_SIZE_M": 64,
        "BLOCK_SIZE_N": 256,
        "BLOCK_SIZE_K": 16,
        "GROUP_SIZE_M": 8,
        "num_stages": 2,
        "num_warps": 8,
        "ms": 1.166316032409668,
        "min_ms": 1.166316032409668,
        "max_ms": 1.166316032409668,
        "compile_time": 1.235485553741455
    },
    {
        "BLOCK_SIZE_M": 32,
        "BLOCK_SIZE_N": 256,
        "BLOCK_SIZE_K": 64,
        "GROUP_SIZE_M": 8,
        "num_stages": 4,
        "num_warps": 16,
        "ms": 1.1666702032089233,
        "min_ms": 1.1666702032089233,
        "max_ms": 1.1666702032089233,
        "compile_time": 1.2522332668304443
    },
    {
        "BLOCK_SIZE_M": 128,
        "BLOCK_SIZE_N": 32,
        "BLOCK_SIZE_K": 128,
        "GROUP_SIZE_M": 8,
        "num_stages": 4,
        "num_warps": 8,
        "ms": 1.1667139530181885,
        "min_ms": 1.1667139530181885,
        "max_ms": 1.1667139530181885,
        "compile_time": 1.3096485137939453
    },
    {
        "BLOCK_SIZE_M": 128,
        "BLOCK_SIZE_N": 128,
        "BLOCK_SIZE_K": 128,
        "GROUP_SIZE_M": 8,
        "num_stages": 1,
        "num_warps": 8,
        "ms": 1.1673171520233154,
        "min_ms": 1.1673171520233154,
        "max_ms": 1.1673171520233154,
        "compile_time": 1.2630155086517334
    },
    {
        "BLOCK_SIZE_M": 32,
        "BLOCK_SIZE_N": 128,
        "BLOCK_SIZE_K": 128,
        "GROUP_SIZE_M": 8,
        "num_stages": 3,
        "num_warps": 2,
        "ms": 1.1695501804351807,
        "min_ms": 1.1695501804351807,
        "max_ms": 1.1695501804351807,
        "compile_time": 1.2213506698608398
    },
    {
        "BLOCK_SIZE_M": 32,
        "BLOCK_SIZE_N": 256,
        "BLOCK_SIZE_K": 64,
        "GROUP_SIZE_M": 8,
        "num_stages": 5,
        "num_warps": 16,
        "ms": 1.16972815990448,
        "min_ms": 1.16972815990448,
        "max_ms": 1.16972815990448,
        "compile_time": 1.2503132820129395
    },
    {
        "BLOCK_SIZE_M": 32,
        "BLOCK_SIZE_N": 128,
        "BLOCK_SIZE_K": 64,
        "GROUP_SIZE_M": 8,
        "num_stages": 6,
        "num_warps": 8,
        "ms": 1.170296311378479,
        "min_ms": 1.170296311378479,
        "max_ms": 1.170296311378479,
        "compile_time": 1.2280752658843994
    },
    {
        "BLOCK_SIZE_M": 32,
        "BLOCK_SIZE_N": 256,
        "BLOCK_SIZE_K": 64,
        "GROUP_SIZE_M": 8,
        "num_stages": 2,
        "num_warps": 8,
        "ms": 1.1714684963226318,
        "min_ms": 1.1714684963226318,
        "max_ms": 1.1714684963226318,
        "compile_time": 1.1946930885314941
    },
    {
        "BLOCK_SIZE_M": 128,
        "BLOCK_SIZE_N": 256,
        "BLOCK_SIZE_K": 128,
        "GROUP_SIZE_M": 8,
        "num_stages": 1,
        "num_warps": 32,
        "ms": 1.1716052293777466,
        "min_ms": 1.1716052293777466,
        "max_ms": 1.1716052293777466,
        "compile_time": 1.2826766967773438
    },
    {
        "BLOCK_SIZE_M": 128,
        "BLOCK_SIZE_N": 32,
        "BLOCK_SIZE_K": 64,
        "GROUP_SIZE_M": 8,
        "num_stages": 8,
        "num_warps": 8,
        "ms": 1.1753861904144287,
        "min_ms": 1.1753861904144287,
        "max_ms": 1.1753861904144287,
        "compile_time": 1.2808749675750732
    },
    {
        "BLOCK_SIZE_M": 128,
        "BLOCK_SIZE_N": 64,
        "BLOCK_SIZE_K": 256,
        "GROUP_SIZE_M": 8,
        "num_stages": 2,
        "num_warps": 8,
        "ms": 1.1764485836029053,
        "min_ms": 1.1764485836029053,
        "max_ms": 1.1764485836029053,
        "compile_time": 1.2758007049560547
    },
    {
        "BLOCK_SIZE_M": 64,
        "BLOCK_SIZE_N": 128,
        "BLOCK_SIZE_K": 32,
        "GROUP_SIZE_M": 8,
        "num_stages": 4,
        "num_warps": 16,
        "ms": 1.1768057346343994,
        "min_ms": 1.1768057346343994,
        "max_ms": 1.1768057346343994,
        "compile_time": 1.2363812923431396
    },
    {
        "BLOCK_SIZE_M": 128,
        "BLOCK_SIZE_N": 32,
        "BLOCK_SIZE_K": 128,
        "GROUP_SIZE_M": 8,
        "num_stages": 3,
        "num_warps": 8,
        "ms": 1.1771113872528076,
        "min_ms": 1.1771113872528076,
        "max_ms": 1.1771113872528076,
        "compile_time": 1.2748730182647705
    },
    {
        "BLOCK_SIZE_M": 64,
        "BLOCK_SIZE_N": 128,
        "BLOCK_SIZE_K": 32,
        "GROUP_SIZE_M": 8,
        "num_stages": 3,
        "num_warps": 16,
        "ms": 1.1772716045379639,
        "min_ms": 1.1772716045379639,
        "max_ms": 1.1772716045379639,
        "compile_time": 1.2430925369262695
    },
    {
        "BLOCK_SIZE_M": 128,
        "BLOCK_SIZE_N": 256,
        "BLOCK_SIZE_K": 32,
        "GROUP_SIZE_M": 8,
        "num_stages": 1,
        "num_warps": 16,
        "ms": 1.1772915124893188,
        "min_ms": 1.1772915124893188,
        "max_ms": 1.1772915124893188,
        "compile_time": 1.2752685546875
    },
    {
        "BLOCK_SIZE_M": 256,
        "BLOCK_SIZE_N": 64,
        "BLOCK_SIZE_K": 128,
        "GROUP_SIZE_M": 8,
        "num_stages": 2,
        "num_warps": 4,
        "ms": 1.1792434453964233,
        "min_ms": 1.1792434453964233,
        "max_ms": 1.1792434453964233,
        "compile_time": 1.3055932521820068
    },
    {
        "BLOCK_SIZE_M": 32,
        "BLOCK_SIZE_N": 128,
        "BLOCK_SIZE_K": 64,
        "GROUP_SIZE_M": 8,
        "num_stages": 7,
        "num_warps": 8,
        "ms": 1.1803696155548096,
        "min_ms": 1.1803696155548096,
        "max_ms": 1.1803696155548096,
        "compile_time": 1.2370243072509766
    },
    {
        "BLOCK_SIZE_M": 512,
        "BLOCK_SIZE_N": 32,
        "BLOCK_SIZE_K": 32,
        "GROUP_SIZE_M": 8,
        "num_stages": 3,
        "num_warps": 16,
        "ms": 1.18124258518219,
        "min_ms": 1.18124258518219,
        "max_ms": 1.18124258518219,
        "compile_time": 1.3576362133026123
    },
    {
        "BLOCK_SIZE_M": 32,
        "BLOCK_SIZE_N": 128,
        "BLOCK_SIZE_K": 128,
        "GROUP_SIZE_M": 8,
        "num_stages": 4,
        "num_warps": 8,
        "ms": 1.1813602447509766,
        "min_ms": 1.1813602447509766,
        "max_ms": 1.1813602447509766,
        "compile_time": 1.2418465614318848
    },
    {
        "BLOCK_SIZE_M": 128,
        "BLOCK_SIZE_N": 32,
        "BLOCK_SIZE_K": 128,
        "GROUP_SIZE_M": 8,
        "num_stages": 5,
        "num_warps": 8,
        "ms": 1.1819502115249634,
        "min_ms": 1.1819502115249634,
        "max_ms": 1.1819502115249634,
        "compile_time": 1.2826640605926514
    },
    {
        "BLOCK_SIZE_M": 64,
        "BLOCK_SIZE_N": 512,
        "BLOCK_SIZE_K": 32,
        "GROUP_SIZE_M": 8,
        "num_stages": 2,
        "num_warps": 16,
        "ms": 1.182005763053894,
        "min_ms": 1.182005763053894,
        "max_ms": 1.182005763053894,
        "compile_time": 1.8994941711425781
    },
    {
        "BLOCK_SIZE_M": 256,
        "BLOCK_SIZE_N": 128,
        "BLOCK_SIZE_K": 32,
        "GROUP_SIZE_M": 8,
        "num_stages": 1,
        "num_warps": 8,
        "ms": 1.1827806234359741,
        "min_ms": 1.1827806234359741,
        "max_ms": 1.1827806234359741,
        "compile_time": 1.3103713989257812
    },
    {
        "BLOCK_SIZE_M": 64,
        "BLOCK_SIZE_N": 128,
        "BLOCK_SIZE_K": 32,
        "GROUP_SIZE_M": 8,
        "num_stages": 5,
        "num_warps": 16,
        "ms": 1.1835317611694336,
        "min_ms": 1.1835317611694336,
        "max_ms": 1.1835317611694336,
        "compile_time": 1.2387845516204834
    },
    {
        "BLOCK_SIZE_M": 32,
        "BLOCK_SIZE_N": 256,
        "BLOCK_SIZE_K": 64,
        "GROUP_SIZE_M": 8,
        "num_stages": 3,
        "num_warps": 16,
        "ms": 1.1839560270309448,
        "min_ms": 1.1839560270309448,
        "max_ms": 1.1839560270309448,
        "compile_time": 1.2373266220092773
    },
    {
        "BLOCK_SIZE_M": 64,
        "BLOCK_SIZE_N": 128,
        "BLOCK_SIZE_K": 32,
        "GROUP_SIZE_M": 8,
        "num_stages": 7,
        "num_warps": 16,
        "ms": 1.1842036247253418,
        "min_ms": 1.1842036247253418,
        "max_ms": 1.1842036247253418,
        "compile_time": 1.239410638809204
    },
    {
        "BLOCK_SIZE_M": 64,
        "BLOCK_SIZE_N": 128,
        "BLOCK_SIZE_K": 32,
        "GROUP_SIZE_M": 8,
        "num_stages": 6,
        "num_warps": 16,
        "ms": 1.1843183040618896,
        "min_ms": 1.1843183040618896,
        "max_ms": 1.1843183040618896,
        "compile_time": 1.2393434047698975
    },
    {
        "BLOCK_SIZE_M": 512,
        "BLOCK_SIZE_N": 32,
        "BLOCK_SIZE_K": 32,
        "GROUP_SIZE_M": 8,
        "num_stages": 5,
        "num_warps": 16,
        "ms": 1.1850073337554932,
        "min_ms": 1.1850073337554932,
        "max_ms": 1.1850073337554932,
        "compile_time": 1.3582139015197754
    },
    {
        "BLOCK_SIZE_M": 128,
        "BLOCK_SIZE_N": 32,
        "BLOCK_SIZE_K": 64,
        "GROUP_SIZE_M": 8,
        "num_stages": 2,
        "num_warps": 8,
        "ms": 1.1852588653564453,
        "min_ms": 1.1852588653564453,
        "max_ms": 1.1852588653564453,
        "compile_time": 1.2854740619659424
    },
    {
        "BLOCK_SIZE_M": 128,
        "BLOCK_SIZE_N": 256,
        "BLOCK_SIZE_K": 64,
        "GROUP_SIZE_M": 8,
        "num_stages": 1,
        "num_warps": 32,
        "ms": 1.186626672744751,
        "min_ms": 1.186626672744751,
        "max_ms": 1.186626672744751,
        "compile_time": 1.2740769386291504
    },
    {
        "BLOCK_SIZE_M": 32,
        "BLOCK_SIZE_N": 128,
        "BLOCK_SIZE_K": 64,
        "GROUP_SIZE_M": 8,
        "num_stages": 2,
        "num_warps": 2,
        "ms": 1.1869593858718872,
        "min_ms": 1.1869593858718872,
        "max_ms": 1.1869593858718872,
        "compile_time": 1.1815698146820068
    },
    {
        "BLOCK_SIZE_M": 32,
        "BLOCK_SIZE_N": 128,
        "BLOCK_SIZE_K": 16,
        "GROUP_SIZE_M": 8,
        "num_stages": 8,
        "num_warps": 4,
        "ms": 1.1881705522537231,
        "min_ms": 1.1881705522537231,
        "max_ms": 1.1881705522537231,
        "compile_time": 1.270176887512207
    },
    {
        "BLOCK_SIZE_M": 32,
        "BLOCK_SIZE_N": 128,
        "BLOCK_SIZE_K": 64,
        "GROUP_SIZE_M": 8,
        "num_stages": 8,
        "num_warps": 8,
        "ms": 1.1886905431747437,
        "min_ms": 1.1886905431747437,
        "max_ms": 1.1886905431747437,
        "compile_time": 1.2349741458892822
    },
    {
        "BLOCK_SIZE_M": 128,
        "BLOCK_SIZE_N": 32,
        "BLOCK_SIZE_K": 64,
        "GROUP_SIZE_M": 8,
        "num_stages": 6,
        "num_warps": 2,
        "ms": 1.1919687986373901,
        "min_ms": 1.1919687986373901,
        "max_ms": 1.1919687986373901,
        "compile_time": 1.2662785053253174
    },
    {
        "BLOCK_SIZE_M": 32,
        "BLOCK_SIZE_N": 128,
        "BLOCK_SIZE_K": 128,
        "GROUP_SIZE_M": 8,
        "num_stages": 5,
        "num_warps": 8,
        "ms": 1.192509412765503,
        "min_ms": 1.192509412765503,
        "max_ms": 1.192509412765503,
        "compile_time": 1.2401611804962158
    },
    {
        "BLOCK_SIZE_M": 256,
        "BLOCK_SIZE_N": 64,
        "BLOCK_SIZE_K": 32,
        "GROUP_SIZE_M": 8,
        "num_stages": 4,
        "num_warps": 32,
        "ms": 1.1925325393676758,
        "min_ms": 1.1925325393676758,
        "max_ms": 1.1925325393676758,
        "compile_time": 1.3055131435394287
    },
    {
        "BLOCK_SIZE_M": 256,
        "BLOCK_SIZE_N": 64,
        "BLOCK_SIZE_K": 32,
        "GROUP_SIZE_M": 8,
        "num_stages": 7,
        "num_warps": 32,
        "ms": 1.1937968730926514,
        "min_ms": 1.1937968730926514,
        "max_ms": 1.1937968730926514,
        "compile_time": 1.3169238567352295
    },
    {
        "BLOCK_SIZE_M": 256,
        "BLOCK_SIZE_N": 64,
        "BLOCK_SIZE_K": 32,
        "GROUP_SIZE_M": 8,
        "num_stages": 6,
        "num_warps": 32,
        "ms": 1.1941375732421875,
        "min_ms": 1.1941375732421875,
        "max_ms": 1.1941375732421875,
        "compile_time": 1.3031566143035889
    },
    {
        "BLOCK_SIZE_M": 128,
        "BLOCK_SIZE_N": 64,
        "BLOCK_SIZE_K": 16,
        "GROUP_SIZE_M": 8,
        "num_stages": 1,
        "num_warps": 4,
        "ms": 1.1944472789764404,
        "min_ms": 1.1944472789764404,
        "max_ms": 1.1944472789764404,
        "compile_time": 1.2603809833526611
    },
    {
        "BLOCK_SIZE_M": 64,
        "BLOCK_SIZE_N": 64,
        "BLOCK_SIZE_K": 128,
        "GROUP_SIZE_M": 8,
        "num_stages": 3,
        "num_warps": 16,
        "ms": 1.1948283910751343,
        "min_ms": 1.1948283910751343,
        "max_ms": 1.1948283910751343,
        "compile_time": 1.2678656578063965
    },
    {
        "BLOCK_SIZE_M": 128,
        "BLOCK_SIZE_N": 128,
        "BLOCK_SIZE_K": 128,
        "GROUP_SIZE_M": 8,
        "num_stages": 1,
        "num_warps": 16,
        "ms": 1.1952000856399536,
        "min_ms": 1.1952000856399536,
        "max_ms": 1.1952000856399536,
        "compile_time": 1.3063349723815918
    },
    {
        "BLOCK_SIZE_M": 128,
        "BLOCK_SIZE_N": 64,
        "BLOCK_SIZE_K": 16,
        "GROUP_SIZE_M": 8,
        "num_stages": 2,
        "num_warps": 2,
        "ms": 1.1957504749298096,
        "min_ms": 1.1957504749298096,
        "max_ms": 1.1957504749298096,
        "compile_time": 1.261547327041626
    },
    {
        "BLOCK_SIZE_M": 128,
        "BLOCK_SIZE_N": 256,
        "BLOCK_SIZE_K": 32,
        "GROUP_SIZE_M": 8,
        "num_stages": 1,
        "num_warps": 32,
        "ms": 1.1964954137802124,
        "min_ms": 1.1964954137802124,
        "max_ms": 1.1964954137802124,
        "compile_time": 1.2788190841674805
    },
    {
        "BLOCK_SIZE_M": 512,
        "BLOCK_SIZE_N": 64,
        "BLOCK_SIZE_K": 128,
        "GROUP_SIZE_M": 8,
        "num_stages": 2,
        "num_warps": 8,
        "ms": 1.1968319416046143,
        "min_ms": 1.1968319416046143,
        "max_ms": 1.1968319416046143,
        "compile_time": 3.3395836353302
    },
    {
        "BLOCK_SIZE_M": 64,
        "BLOCK_SIZE_N": 256,
        "BLOCK_SIZE_K": 16,
        "GROUP_SIZE_M": 8,
        "num_stages": 2,
        "num_warps": 4,
        "ms": 1.197293996810913,
        "min_ms": 1.197293996810913,
        "max_ms": 1.197293996810913,
        "compile_time": 2.0777876377105713
    },
    {
        "BLOCK_SIZE_M": 256,
        "BLOCK_SIZE_N": 64,
        "BLOCK_SIZE_K": 32,
        "GROUP_SIZE_M": 8,
        "num_stages": 8,
        "num_warps": 32,
        "ms": 1.197759985923767,
        "min_ms": 1.197759985923767,
        "max_ms": 1.197759985923767,
        "compile_time": 1.3077106475830078
    },
    {
        "BLOCK_SIZE_M": 128,
        "BLOCK_SIZE_N": 32,
        "BLOCK_SIZE_K": 64,
        "GROUP_SIZE_M": 8,
        "num_stages": 7,
        "num_warps": 2,
        "ms": 1.1981645822525024,
        "min_ms": 1.1981645822525024,
        "max_ms": 1.1981645822525024,
        "compile_time": 1.2602663040161133
    },
    {
        "BLOCK_SIZE_M": 256,
        "BLOCK_SIZE_N": 64,
        "BLOCK_SIZE_K": 16,
        "GROUP_SIZE_M": 8,
        "num_stages": 7,
        "num_warps": 16,
        "ms": 1.1997363567352295,
        "min_ms": 1.1997363567352295,
        "max_ms": 1.1997363567352295,
        "compile_time": 1.3168630599975586
    },
    {
        "BLOCK_SIZE_M": 64,
        "BLOCK_SIZE_N": 128,
        "BLOCK_SIZE_K": 16,
        "GROUP_SIZE_M": 8,
        "num_stages": 2,
        "num_warps": 8,
        "ms": 1.2003897428512573,
        "min_ms": 1.2003897428512573,
        "max_ms": 1.2003897428512573,
