simdata/FP16-R100/512_results.json
[
    {
        "BLOCK_SIZE_M": 64,
        "BLOCK_SIZE_N": 64,
        "BLOCK_SIZE_K": 64,
        "GROUP_SIZE_M": 8,
        "num_stages": 4,
        "num_warps": 4,
        "ms": 0.005374074913561344,
        "min_ms": 0.005374074913561344,
        "max_ms": 0.005374074913561344,
        "compile_time": 0.4328913688659668
    },
    {
        "BLOCK_SIZE_M": 64,
        "BLOCK_SIZE_N": 64,
        "BLOCK_SIZE_K": 64,
        "GROUP_SIZE_M": 8,
        "num_stages": 3,
        "num_warps": 4,
        "ms": 0.0054108561016619205,
        "min_ms": 0.0054108561016619205,
        "max_ms": 0.0054108561016619205,
        "compile_time": 0.4388563632965088
    },
    {
        "BLOCK_SIZE_M": 64,
        "BLOCK_SIZE_N": 64,
        "BLOCK_SIZE_K": 64,
        "GROUP_SIZE_M": 8,
        "num_stages": 5,
        "num_warps": 4,
        "ms": 0.005411745049059391,
        "min_ms": 0.005411745049059391,
        "max_ms": 0.005411745049059391,
        "compile_time": 0.4397702217102051
    },
    {
        "BLOCK_SIZE_M": 64,
        "BLOCK_SIZE_N": 64,
        "BLOCK_SIZE_K": 32,
        "GROUP_SIZE_M": 8,
        "num_stages": 4,
        "num_warps": 4,
        "ms": 0.005486782640218735,
        "min_ms": 0.005486782640218735,
        "max_ms": 0.005486782640218735,
        "compile_time": 0.44298505783081055
    },
    {
        "BLOCK_SIZE_M": 64,
        "BLOCK_SIZE_N": 64,
        "BLOCK_SIZE_K": 32,
        "GROUP_SIZE_M": 8,
        "num_stages": 5,
        "num_warps": 4,
        "ms": 0.005489678587764502,
        "min_ms": 0.005489678587764502,
        "max_ms": 0.005489678587764502,
        "compile_time": 0.43747687339782715
    },
    {
        "BLOCK_SIZE_M": 64,
        "BLOCK_SIZE_N": 64,
        "BLOCK_SIZE_K": 64,
        "GROUP_SIZE_M": 8,
        "num_stages": 6,
        "num_warps": 4,
        "ms": 0.00549731682986021,
        "min_ms": 0.00549731682986021,
        "max_ms": 0.00549731682986021,
        "compile_time": 0.4376955032348633
    },
    {
        "BLOCK_SIZE_M": 64,
        "BLOCK_SIZE_N": 64,
        "BLOCK_SIZE_K": 32,
        "GROUP_SIZE_M": 8,
        "num_stages": 6,
        "num_warps": 4,
        "ms": 0.005547157488763332,
        "min_ms": 0.005547157488763332,
        "max_ms": 0.005547157488763332,
        "compile_time": 0.43822455406188965
    },
    {
        "BLOCK_SIZE_M": 64,
        "BLOCK_SIZE_N": 64,
        "BLOCK_SIZE_K": 32,
        "GROUP_SIZE_M": 8,
        "num_stages": 7,
        "num_warps": 4,
        "ms": 0.005559847690165043,
        "min_ms": 0.005559847690165043,
        "max_ms": 0.005559847690165043,
        "compile_time": 0.44406795501708984
    },
    {
        "BLOCK_SIZE_M": 64,
        "BLOCK_SIZE_N": 64,
        "BLOCK_SIZE_K": 128,
        "GROUP_SIZE_M": 8,
        "num_stages": 3,
        "num_warps": 4,
        "ms": 0.005572636611759663,
        "min_ms": 0.005572636611759663,
        "max_ms": 0.005572636611759663,
        "compile_time": 0.43459534645080566
    },
    {
        "BLOCK_SIZE_M": 64,
        "BLOCK_SIZE_N": 64,
        "BLOCK_SIZE_K": 32,
        "GROUP_SIZE_M": 8,
        "num_stages": 8,
        "num_warps": 4,
        "ms": 0.005607366096228361,
        "min_ms": 0.005607366096228361,
        "max_ms": 0.005607366096228361,
        "compile_time": 0.4384491443634033
    },
    {
        "BLOCK_SIZE_M": 64,
        "BLOCK_SIZE_N": 64,
        "BLOCK_SIZE_K": 128,
        "GROUP_SIZE_M": 8,
        "num_stages": 4,
        "num_warps": 4,
        "ms": 0.005630300845950842,
        "min_ms": 0.005630300845950842,
        "max_ms": 0.005630300845950842,
        "compile_time": 0.4434645175933838
    },
    {
        "BLOCK_SIZE_M": 64,
        "BLOCK_SIZE_N": 64,
        "BLOCK_SIZE_K": 64,
        "GROUP_SIZE_M": 8,
        "num_stages": 7,
        "num_warps": 4,
        "ms": 0.005664698779582977,
        "min_ms": 0.005664698779582977,
        "max_ms": 0.005664698779582977,
        "compile_time": 0.44069838523864746
    },
    {
        "BLOCK_SIZE_M": 64,
        "BLOCK_SIZE_N": 64,
        "BLOCK_SIZE_K": 64,
        "GROUP_SIZE_M": 8,
        "num_stages": 8,
        "num_warps": 4,
        "ms": 0.005681727081537247,
        "min_ms": 0.005681727081537247,
        "max_ms": 0.005681727081537247,
        "compile_time": 0.4408853054046631
    },
    {
        "BLOCK_SIZE_M": 128,
        "BLOCK_SIZE_N": 32,
        "BLOCK_SIZE_K": 64,
        "GROUP_SIZE_M": 8,
        "num_stages": 4,
        "num_warps": 4,
        "ms": 0.005701378919184208,
        "min_ms": 0.005701378919184208,
        "max_ms": 0.005701378919184208,
        "compile_time": 0.4809403419494629
    },
    {
        "BLOCK_SIZE_M": 128,
        "BLOCK_SIZE_N": 32,
        "BLOCK_SIZE_K": 64,
        "GROUP_SIZE_M": 8,
        "num_stages": 5,
        "num_warps": 4,
        "ms": 0.00576859200373292,
        "min_ms": 0.00576859200373292,
        "max_ms": 0.00576859200373292,
        "compile_time": 0.47194433212280273
    },
    {
        "BLOCK_SIZE_M": 64,
        "BLOCK_SIZE_N": 64,
        "BLOCK_SIZE_K": 32,
        "GROUP_SIZE_M": 8,
        "num_stages": 3,
        "num_warps": 4,
        "ms": 0.005817012395709753,
        "min_ms": 0.005817012395709753,
        "max_ms": 0.005817012395709753,
        "compile_time": 0.43895888328552246
    },
    {
        "BLOCK_SIZE_M": 128,
        "BLOCK_SIZE_N": 32,
        "BLOCK_SIZE_K": 64,
        "GROUP_SIZE_M": 8,
        "num_stages": 3,
        "num_warps": 4,
        "ms": 0.005820128135383129,
        "min_ms": 0.005820128135383129,
        "max_ms": 0.005820128135383129,
        "compile_time": 0.47458958625793457
    },
    {
        "BLOCK_SIZE_M": 64,
        "BLOCK_SIZE_N": 64,
        "BLOCK_SIZE_K": 128,
        "GROUP_SIZE_M": 8,
        "num_stages": 5,
        "num_warps": 4,
        "ms": 0.005826237611472607,
        "min_ms": 0.005826237611472607,
        "max_ms": 0.005826237611472607,
        "compile_time": 0.4529135227203369
    },
    {
        "BLOCK_SIZE_M": 32,
        "BLOCK_SIZE_N": 128,
        "BLOCK_SIZE_K": 64,
        "GROUP_SIZE_M": 8,
        "num_stages": 4,
        "num_warps": 4,
        "ms": 0.005871010012924671,
        "min_ms": 0.005871010012924671,
        "max_ms": 0.005871010012924671,
        "compile_time": 0.40221595764160156
    },
    {
        "BLOCK_SIZE_M": 64,
        "BLOCK_SIZE_N": 64,
        "BLOCK_SIZE_K": 128,
        "GROUP_SIZE_M": 8,
        "num_stages": 6,
        "num_warps": 4,
        "ms": 0.005885032936930656,
        "min_ms": 0.005885032936930656,
        "max_ms": 0.005885032936930656,
        "compile_time": 0.4390263557434082
    },
    {
        "BLOCK_SIZE_M": 128,
        "BLOCK_SIZE_N": 32,
        "BLOCK_SIZE_K": 64,
        "GROUP_SIZE_M": 8,
        "num_stages": 6,
        "num_warps": 4,
        "ms": 0.005932111293077469,
        "min_ms": 0.005932111293077469,
        "max_ms": 0.005932111293077469,
        "compile_time": 0.49002552032470703
    },
    {
        "BLOCK_SIZE_M": 64,
        "BLOCK_SIZE_N": 64,
        "BLOCK_SIZE_K": 64,
        "GROUP_SIZE_M": 8,
        "num_stages": 3,
        "num_warps": 8,
        "ms": 0.006018585059791803,
        "min_ms": 0.006018585059791803,
        "max_ms": 0.006018585059791803,
        "compile_time": 0.45627713203430176
    },
    {
        "BLOCK_SIZE_M": 32,
        "BLOCK_SIZE_N": 128,
        "BLOCK_SIZE_K": 64,
        "GROUP_SIZE_M": 8,
        "num_stages": 5,
        "num_warps": 4,
        "ms": 0.006030258256942034,
        "min_ms": 0.006030258256942034,
        "max_ms": 0.006030258256942034,
        "compile_time": 0.4136073589324951
    },
    {
        "BLOCK_SIZE_M": 128,
        "BLOCK_SIZE_N": 32,
        "BLOCK_SIZE_K": 64,
        "GROUP_SIZE_M": 8,
        "num_stages": 7,
        "num_warps": 4,
        "ms": 0.006037295330315828,
        "min_ms": 0.006037295330315828,
        "max_ms": 0.006037295330315828,
        "compile_time": 0.48283982276916504
    },
    {
        "BLOCK_SIZE_M": 32,
        "BLOCK_SIZE_N": 128,
        "BLOCK_SIZE_K": 64,
        "GROUP_SIZE_M": 8,
        "num_stages": 3,
        "num_warps": 4,
        "ms": 0.006041311658918858,
        "min_ms": 0.006041311658918858,
        "max_ms": 0.006041311658918858,
        "compile_time": 0.40027666091918945
    },
    {
        "BLOCK_SIZE_M": 64,
        "BLOCK_SIZE_N": 64,
        "BLOCK_SIZE_K": 64,
        "GROUP_SIZE_M": 8,
        "num_stages": 4,
        "num_warps": 8,
        "ms": 0.006099232472479343,
        "min_ms": 0.006099232472479343,
        "max_ms": 0.006099232472479343,
        "compile_time": 0.4417297840118408
    },
    {
        "BLOCK_SIZE_M": 64,
        "BLOCK_SIZE_N": 64,
        "BLOCK_SIZE_K": 32,
        "GROUP_SIZE_M": 8,
        "num_stages": 5,
        "num_warps": 2,
        "ms": 0.006103110499680042,
        "min_ms": 0.006103110499680042,
        "max_ms": 0.006103110499680042,
        "compile_time": 0.44276952743530273
    },
    {
        "BLOCK_SIZE_M": 32,
        "BLOCK_SIZE_N": 128,
        "BLOCK_SIZE_K": 32,
        "GROUP_SIZE_M": 8,
        "num_stages": 5,
        "num_warps": 4,
        "ms": 0.006103447172790766,
        "min_ms": 0.006103447172790766,
        "max_ms": 0.006103447172790766,
        "compile_time": 0.4144010543823242
    },
    {
        "BLOCK_SIZE_M": 32,
        "BLOCK_SIZE_N": 128,
        "BLOCK_SIZE_K": 32,
        "GROUP_SIZE_M": 8,
        "num_stages": 4,
        "num_warps": 4,
        "ms": 0.006130736321210861,
        "min_ms": 0.006130736321210861,
        "max_ms": 0.006130736321210861,
        "compile_time": 0.3914475440979004
    },
    {
        "BLOCK_SIZE_M": 32,
        "BLOCK_SIZE_N": 128,
        "BLOCK_SIZE_K": 64,
        "GROUP_SIZE_M": 8,
        "num_stages": 6,
        "num_warps": 4,
        "ms": 0.006149324122816324,
        "min_ms": 0.006149324122816324,
        "max_ms": 0.006149324122816324,
        "compile_time": 0.4073920249938965
    },
    {
        "BLOCK_SIZE_M": 128,
        "BLOCK_SIZE_N": 32,
        "BLOCK_SIZE_K": 128,
        "GROUP_SIZE_M": 8,
        "num_stages": 3,
        "num_warps": 4,
        "ms": 0.006150345783680677,
        "min_ms": 0.006150345783680677,
        "max_ms": 0.006150345783680677,
        "compile_time": 0.4942131042480469
    },
    {
        "BLOCK_SIZE_M": 64,
        "BLOCK_SIZE_N": 64,
        "BLOCK_SIZE_K": 64,
        "GROUP_SIZE_M": 8,
        "num_stages": 6,
        "num_warps": 8,
        "ms": 0.0061731887981295586,
        "min_ms": 0.0061731887981295586,
        "max_ms": 0.0061731887981295586,
        "compile_time": 0.40859246253967285
    },
    {
        "BLOCK_SIZE_M": 32,
        "BLOCK_SIZE_N": 128,
        "BLOCK_SIZE_K": 32,
        "GROUP_SIZE_M": 8,
        "num_stages": 6,
        "num_warps": 4,
        "ms": 0.00618248526006937,
        "min_ms": 0.00618248526006937,
        "max_ms": 0.00618248526006937,
        "compile_time": 0.41912364959716797
    },
    {
        "BLOCK_SIZE_M": 64,
        "BLOCK_SIZE_N": 64,
        "BLOCK_SIZE_K": 32,
        "GROUP_SIZE_M": 8,
        "num_stages": 3,
        "num_warps": 8,
        "ms": 0.006183193065226078,
        "min_ms": 0.006183193065226078,
        "max_ms": 0.006183193065226078,
        "compile_time": 0.45007777214050293
    },
    {
        "BLOCK_SIZE_M": 64,
        "BLOCK_SIZE_N": 64,
        "BLOCK_SIZE_K": 32,
        "GROUP_SIZE_M": 8,
        "num_stages": 4,
        "num_warps": 8,
        "ms": 0.006215756293386221,
        "min_ms": 0.006215756293386221,
        "max_ms": 0.006215756293386221,
        "compile_time": 0.4597034454345703
    },
    {
        "BLOCK_SIZE_M": 64,
        "BLOCK_SIZE_N": 64,
        "BLOCK_SIZE_K": 32,
        "GROUP_SIZE_M": 8,
        "num_stages": 6,
        "num_warps": 2,
        "ms": 0.006222548894584179,
        "min_ms": 0.006222548894584179,
        "max_ms": 0.006222548894584179,
        "compile_time": 0.4420166015625
    },
    {
        "BLOCK_SIZE_M": 64,
        "BLOCK_SIZE_N": 64,
        "BLOCK_SIZE_K": 32,
        "GROUP_SIZE_M": 8,
        "num_stages": 7,
        "num_warps": 2,
        "ms": 0.0062237451784312725,
        "min_ms": 0.0062237451784312725,
        "max_ms": 0.0062237451784312725,
        "compile_time": 0.4521505832672119
    },
    {
        "BLOCK_SIZE_M": 64,
        "BLOCK_SIZE_N": 64,
        "BLOCK_SIZE_K": 32,
        "GROUP_SIZE_M": 8,
        "num_stages": 8,
        "num_warps": 2,
        "ms": 0.006225896533578634,
        "min_ms": 0.006225896533578634,
        "max_ms": 0.006225896533578634,
        "compile_time": 0.44722843170166016
    },
    {
        "BLOCK_SIZE_M": 32,
        "BLOCK_SIZE_N": 128,
        "BLOCK_SIZE_K": 128,
        "GROUP_SIZE_M": 8,
        "num_stages": 3,
        "num_warps": 4,
        "ms": 0.006226831581443548,
        "min_ms": 0.006226831581443548,
        "max_ms": 0.006226831581443548,
        "compile_time": 0.41098546981811523
    },
    {
        "BLOCK_SIZE_M": 128,
        "BLOCK_SIZE_N": 32,
        "BLOCK_SIZE_K": 32,
        "GROUP_SIZE_M": 8,
        "num_stages": 4,
        "num_warps": 4,
        "ms": 0.0062319012358784676,
        "min_ms": 0.0062319012358784676,
        "max_ms": 0.0062319012358784676,
        "compile_time": 0.48368334770202637
    },
    {
        "BLOCK_SIZE_M": 128,
        "BLOCK_SIZE_N": 32,
        "BLOCK_SIZE_K": 32,
        "GROUP_SIZE_M": 8,
        "num_stages": 5,
        "num_warps": 4,
        "ms": 0.006251959595829248,
        "min_ms": 0.006251959595829248,
        "max_ms": 0.006251959595829248,
        "compile_time": 0.48702359199523926
    },
    {
        "BLOCK_SIZE_M": 32,
        "BLOCK_SIZE_N": 128,
        "BLOCK_SIZE_K": 64,
        "GROUP_SIZE_M": 8,
        "num_stages": 8,
        "num_warps": 4,
        "ms": 0.006255342159420252,
        "min_ms": 0.006255342159420252,
        "max_ms": 0.006255342159420252,
        "compile_time": 0.4181666374206543
    },
    {
        "BLOCK_SIZE_M": 128,
        "BLOCK_SIZE_N": 32,
        "BLOCK_SIZE_K": 32,
        "GROUP_SIZE_M": 8,
        "num_stages": 3,
        "num_warps": 4,
        "ms": 0.006255915854126215,
        "min_ms": 0.006255915854126215,
        "max_ms": 0.006255915854126215,
        "compile_time": 0.4831559658050537
    },
    {
        "BLOCK_SIZE_M": 128,
        "BLOCK_SIZE_N": 32,
        "BLOCK_SIZE_K": 128,
        "GROUP_SIZE_M": 8,
        "num_stages": 4,
        "num_warps": 4,
        "ms": 0.006257534027099609,
        "min_ms": 0.006257534027099609,
        "max_ms": 0.006257534027099609,
        "compile_time": 0.4857923984527588
    },
    {
        "BLOCK_SIZE_M": 64,
        "BLOCK_SIZE_N": 64,
        "BLOCK_SIZE_K": 64,
        "GROUP_SIZE_M": 8,
        "num_stages": 5,
        "num_warps": 8,
        "ms": 0.006258534733206034,
        "min_ms": 0.006258534733206034,
        "max_ms": 0.006258534733206034,
        "compile_time": 0.4416944980621338
    },
    {
        "BLOCK_SIZE_M": 64,
        "BLOCK_SIZE_N": 64,
        "BLOCK_SIZE_K": 32,
        "GROUP_SIZE_M": 8,
        "num_stages": 5,
        "num_warps": 8,
        "ms": 0.006283235736191273,
        "min_ms": 0.006283235736191273,
        "max_ms": 0.006283235736191273,
        "compile_time": 0.44609642028808594
    },
    {
        "BLOCK_SIZE_M": 64,
        "BLOCK_SIZE_N": 64,
        "BLOCK_SIZE_K": 32,
        "GROUP_SIZE_M": 8,
        "num_stages": 6,
        "num_warps": 8,
        "ms": 0.006286033429205418,
        "min_ms": 0.006286033429205418,
        "max_ms": 0.006286033429205418,
        "compile_time": 0.4430544376373291
    },
    {
        "BLOCK_SIZE_M": 32,
        "BLOCK_SIZE_N": 128,
        "BLOCK_SIZE_K": 32,
        "GROUP_SIZE_M": 8,
        "num_stages": 7,
        "num_warps": 4,
        "ms": 0.00628766929730773,
        "min_ms": 0.00628766929730773,
        "max_ms": 0.00628766929730773,
        "compile_time": 0.39133524894714355
    },
    {
        "BLOCK_SIZE_M": 64,
        "BLOCK_SIZE_N": 64,
        "BLOCK_SIZE_K": 64,
        "GROUP_SIZE_M": 8,
        "num_stages": 3,
        "num_warps": 2,
        "ms": 0.006296209990978241,
        "min_ms": 0.006296209990978241,
        "max_ms": 0.006296209990978241,
        "compile_time": 0.45942211151123047
    },
    {
        "BLOCK_SIZE_M": 64,
        "BLOCK_SIZE_N": 64,
        "BLOCK_SIZE_K": 32,
        "GROUP_SIZE_M": 8,
        "num_stages": 7,
        "num_warps": 8,
        "ms": 0.006312686018645763,
        "min_ms": 0.006312686018645763,
        "max_ms": 0.006312686018645763,
        "compile_time": 0.44953203201293945
    },
    {
        "BLOCK_SIZE_M": 128,
        "BLOCK_SIZE_N": 32,
        "BLOCK_SIZE_K": 64,
        "GROUP_SIZE_M": 8,
        "num_stages": 8,
        "num_warps": 4,
        "ms": 0.006313172169029713,
        "min_ms": 0.006313172169029713,
        "max_ms": 0.006313172169029713,
        "compile_time": 0.47830796241760254
    },
    {
        "BLOCK_SIZE_M": 64,
        "BLOCK_SIZE_N": 64,
        "BLOCK_SIZE_K": 64,
        "GROUP_SIZE_M": 8,
        "num_stages": 7,
        "num_warps": 8,
        "ms": 0.006328493356704712,
        "min_ms": 0.006328493356704712,
        "max_ms": 0.006328493356704712,
        "compile_time": 0.4583117961883545
    },
    {
        "BLOCK_SIZE_M": 32,
        "BLOCK_SIZE_N": 128,
        "BLOCK_SIZE_K": 64,
        "GROUP_SIZE_M": 8,
        "num_stages": 7,
        "num_warps": 4,
        "ms": 0.006333641707897186,
        "min_ms": 0.006333641707897186,
        "max_ms": 0.006333641707897186,
        "compile_time": 0.41567492485046387
    },
    {
        "BLOCK_SIZE_M": 128,
        "BLOCK_SIZE_N": 32,
        "BLOCK_SIZE_K": 32,
        "GROUP_SIZE_M": 8,
        "num_stages": 6,
        "num_warps": 4,
        "ms": 0.00635502627119422,
        "min_ms": 0.00635502627119422,
        "max_ms": 0.00635502627119422,
        "compile_time": 0.4879906177520752
    },
    {
        "BLOCK_SIZE_M": 32,
        "BLOCK_SIZE_N": 128,
        "BLOCK_SIZE_K": 128,
        "GROUP_SIZE_M": 8,
        "num_stages": 4,
        "num_warps": 4,
        "ms": 0.006362537387758493,
        "min_ms": 0.006362537387758493,
        "max_ms": 0.006362537387758493,
        "compile_time": 0.4247300624847412
    },
    {
        "BLOCK_SIZE_M": 32,
        "BLOCK_SIZE_N": 128,
        "BLOCK_SIZE_K": 32,
        "GROUP_SIZE_M": 8,
        "num_stages": 8,
        "num_warps": 4,
        "ms": 0.006368414498865604,
        "min_ms": 0.006368414498865604,
        "max_ms": 0.006368414498865604,
        "compile_time": 0.4050867557525635
    },
    {
        "BLOCK_SIZE_M": 64,
        "BLOCK_SIZE_N": 64,
        "BLOCK_SIZE_K": 64,
        "GROUP_SIZE_M": 8,
        "num_stages": 4,
        "num_warps": 2,
        "ms": 0.006378485821187496,
        "min_ms": 0.006378485821187496,
        "max_ms": 0.006378485821187496,
        "compile_time": 0.45564746856689453
    },
    {
        "BLOCK_SIZE_M": 128,
        "BLOCK_SIZE_N": 32,
        "BLOCK_SIZE_K": 64,
        "GROUP_SIZE_M": 8,
        "num_stages": 3,
        "num_warps": 8,
        "ms": 0.006382933352142572,
        "min_ms": 0.006382933352142572,
        "max_ms": 0.006382933352142572,
        "compile_time": 0.4926474094390869
    },
    {
        "BLOCK_SIZE_M": 64,
        "BLOCK_SIZE_N": 64,
        "BLOCK_SIZE_K": 64,
        "GROUP_SIZE_M": 8,
        "num_stages": 6,
        "num_warps": 2,
        "ms": 0.0063871582970023155,
        "min_ms": 0.0063871582970023155,
        "max_ms": 0.0063871582970023155,
        "compile_time": 0.457749605178833
    },
    {
        "BLOCK_SIZE_M": 64,
        "BLOCK_SIZE_N": 64,
        "BLOCK_SIZE_K": 256,
        "GROUP_SIZE_M": 8,
        "num_stages": 3,
        "num_warps": 4,
        "ms": 0.0063902586698532104,
        "min_ms": 0.0063902586698532104,
        "max_ms": 0.0063902586698532104,
        "compile_time": 0.45477294921875
    },
    {
        "BLOCK_SIZE_M": 64,
        "BLOCK_SIZE_N": 64,
        "BLOCK_SIZE_K": 64,
        "GROUP_SIZE_M": 8,
        "num_stages": 5,
        "num_warps": 2,
        "ms": 0.006393273361027241,
        "min_ms": 0.006393273361027241,
        "max_ms": 0.006393273361027241,
        "compile_time": 0.45867061614990234
    },
    {
        "BLOCK_SIZE_M": 64,
        "BLOCK_SIZE_N": 32,
        "BLOCK_SIZE_K": 32,
        "GROUP_SIZE_M": 8,
        "num_stages": 3,
        "num_warps": 2,
        "ms": 0.006393914110958576,
        "min_ms": 0.006393914110958576,
        "max_ms": 0.006393914110958576,
        "compile_time": 0.44355344772338867
    },
    {
        "BLOCK_SIZE_M": 64,
        "BLOCK_SIZE_N": 64,
        "BLOCK_SIZE_K": 64,
        "GROUP_SIZE_M": 8,
        "num_stages": 8,
        "num_warps": 8,
        "ms": 0.00640022661536932,
        "min_ms": 0.00640022661536932,
        "max_ms": 0.00640022661536932,
        "compile_time": 0.45462942123413086
    },
    {
        "BLOCK_SIZE_M": 32,
        "BLOCK_SIZE_N": 128,
        "BLOCK_SIZE_K": 128,
        "GROUP_SIZE_M": 8,
        "num_stages": 5,
        "num_warps": 4,
        "ms": 0.006403437349945307,
        "min_ms": 0.006403437349945307,
        "max_ms": 0.006403437349945307,
        "compile_time": 0.402069091796875
    },
    {
        "BLOCK_SIZE_M": 64,
        "BLOCK_SIZE_N": 64,
        "BLOCK_SIZE_K": 32,
        "GROUP_SIZE_M": 8,
        "num_stages": 8,
        "num_warps": 8,
        "ms": 0.0064090280793607235,
        "min_ms": 0.0064090280793607235,
        "max_ms": 0.0064090280793607235,
        "compile_time": 0.4521315097808838
    },
    {
        "BLOCK_SIZE_M": 64,
        "BLOCK_SIZE_N": 64,
        "BLOCK_SIZE_K": 128,
        "GROUP_SIZE_M": 8,
        "num_stages": 3,
        "num_warps": 8,
        "ms": 0.0064141759648919106,
        "min_ms": 0.0064141759648919106,
        "max_ms": 0.0064141759648919106,
        "compile_time": 0.4570891857147217
    },
    {
        "BLOCK_SIZE_M": 64,
        "BLOCK_SIZE_N": 64,
        "BLOCK_SIZE_K": 64,
        "GROUP_SIZE_M": 8,
        "num_stages": 7,
        "num_warps": 2,
        "ms": 0.006415891461074352,
        "min_ms": 0.006415891461074352,
        "max_ms": 0.006415891461074352,
        "compile_time": 0.4452822208404541
    },
    {
        "BLOCK_SIZE_M": 32,
        "BLOCK_SIZE_N": 128,
        "BLOCK_SIZE_K": 32,
        "GROUP_SIZE_M": 8,
        "num_stages": 3,
        "num_warps": 4,
        "ms": 0.006430869456380606,
        "min_ms": 0.006430869456380606,
        "max_ms": 0.006430869456380606,
        "compile_time": 0.42023706436157227
    },
    {
        "BLOCK_SIZE_M": 32,
        "BLOCK_SIZE_N": 128,
        "BLOCK_SIZE_K": 64,
        "GROUP_SIZE_M": 8,
        "num_stages": 4,
        "num_warps": 8,
        "ms": 0.006445965263992548,
        "min_ms": 0.006445965263992548,
        "max_ms": 0.006445965263992548,
        "compile_time": 0.4184834957122803
    },
    {
        "BLOCK_SIZE_M": 64,
        "BLOCK_SIZE_N": 64,
        "BLOCK_SIZE_K": 64,
        "GROUP_SIZE_M": 8,
        "num_stages": 8,
        "num_warps": 2,
        "ms": 0.0064689842984080315,
        "min_ms": 0.0064689842984080315,
        "max_ms": 0.0064689842984080315,
        "compile_time": 0.4563577175140381
    },
    {
        "BLOCK_SIZE_M": 128,
        "BLOCK_SIZE_N": 32,
        "BLOCK_SIZE_K": 32,
        "GROUP_SIZE_M": 8,
        "num_stages": 7,
        "num_warps": 4,
        "ms": 0.006469256244599819,
        "min_ms": 0.006469256244599819,
        "max_ms": 0.006469256244599819,
        "compile_time": 0.4852478504180908
    },
    {
        "BLOCK_SIZE_M": 64,
        "BLOCK_SIZE_N": 64,
        "BLOCK_SIZE_K": 128,
        "GROUP_SIZE_M": 8,
        "num_stages": 5,
        "num_warps": 8,
        "ms": 0.006492091808468103,
        "min_ms": 0.006492091808468103,
        "max_ms": 0.006492091808468103,
        "compile_time": 0.45702171325683594
    },
    {
        "BLOCK_SIZE_M": 64,
        "BLOCK_SIZE_N": 64,
        "BLOCK_SIZE_K": 128,
        "GROUP_SIZE_M": 8,
        "num_stages": 4,
        "num_warps": 8,
        "ms": 0.0065080635249614716,
        "min_ms": 0.0065080635249614716,
        "max_ms": 0.0065080635249614716,
        "compile_time": 0.45557332038879395
    },
    {
        "BLOCK_SIZE_M": 128,
        "BLOCK_SIZE_N": 32,
        "BLOCK_SIZE_K": 64,
        "GROUP_SIZE_M": 8,
        "num_stages": 4,
        "num_warps": 8,
        "ms": 0.006524178199470043,
        "min_ms": 0.006524178199470043,
        "max_ms": 0.006524178199470043,
        "compile_time": 0.4895970821380615
    },
    {
        "BLOCK_SIZE_M": 32,
        "BLOCK_SIZE_N": 128,
        "BLOCK_SIZE_K": 64,
        "GROUP_SIZE_M": 8,
        "num_stages": 3,
        "num_warps": 8,
        "ms": 0.006542046554386616,
        "min_ms": 0.006542046554386616,
        "max_ms": 0.006542046554386616,
        "compile_time": 0.4125838279724121
    },
    {
        "BLOCK_SIZE_M": 128,
        "BLOCK_SIZE_N": 32,
        "BLOCK_SIZE_K": 64,
        "GROUP_SIZE_M": 8,
        "num_stages": 5,
        "num_warps": 8,
        "ms": 0.006548275705426931,
        "min_ms": 0.006548275705426931,
        "max_ms": 0.006548275705426931,
        "compile_time": 0.49303245544433594
    },
    {
        "BLOCK_SIZE_M": 128,
        "BLOCK_SIZE_N": 32,
        "BLOCK_SIZE_K": 64,
        "GROUP_SIZE_M": 8,
        "num_stages": 6,
        "num_warps": 8,
        "ms": 0.0065789842046797276,
        "min_ms": 0.0065789842046797276,
        "max_ms": 0.0065789842046797276,
        "compile_time": 0.4909780025482178
    },
    {
        "BLOCK_SIZE_M": 64,
        "BLOCK_SIZE_N": 32,
        "BLOCK_SIZE_K": 32,
        "GROUP_SIZE_M": 8,
        "num_stages": 4,
        "num_warps": 2,
        "ms": 0.0065797665156424046,
        "min_ms": 0.0065797665156424046,
        "max_ms": 0.0065797665156424046,
        "compile_time": 0.4451930522918701
    },
    {
        "BLOCK_SIZE_M": 128,
        "BLOCK_SIZE_N": 32,
        "BLOCK_SIZE_K": 32,
        "GROUP_SIZE_M": 8,
        "num_stages": 8,
        "num_warps": 4,
        "ms": 0.00659155985340476,
        "min_ms": 0.00659155985340476,
        "max_ms": 0.00659155985340476,
        "compile_time": 0.4850952625274658
    },
    {
        "BLOCK_SIZE_M": 64,
        "BLOCK_SIZE_N": 64,
        "BLOCK_SIZE_K": 128,
        "GROUP_SIZE_M": 8,
        "num_stages": 6,
        "num_warps": 8,
        "ms": 0.006615906022489071,
        "min_ms": 0.006615906022489071,
        "max_ms": 0.006615906022489071,
        "compile_time": 0.46569371223449707
    },
    {
        "BLOCK_SIZE_M": 32,
        "BLOCK_SIZE_N": 64,
        "BLOCK_SIZE_K": 32,
        "GROUP_SIZE_M": 8,
        "num_stages": 5,
        "num_warps": 2,
        "ms": 0.006616461090743542,
        "min_ms": 0.006616461090743542,
        "max_ms": 0.006616461090743542,
        "compile_time": 0.3999466896057129
    },
    {
        "BLOCK_SIZE_M": 64,
        "BLOCK_SIZE_N": 128,
        "BLOCK_SIZE_K": 64,
        "GROUP_SIZE_M": 8,
        "num_stages": 3,
        "num_warps": 4,
        "ms": 0.006637570448219776,
        "min_ms": 0.006637570448219776,
        "max_ms": 0.006637570448219776,
        "compile_time": 0.4727022647857666
    },
    {
        "BLOCK_SIZE_M": 128,
        "BLOCK_SIZE_N": 32,
        "BLOCK_SIZE_K": 128,
        "GROUP_SIZE_M": 8,
        "num_stages": 5,
        "num_warps": 4,
        "ms": 0.006670595612376928,
        "min_ms": 0.006670595612376928,
        "max_ms": 0.006670595612376928,
        "compile_time": 0.49022841453552246
    },
    {
        "BLOCK_SIZE_M": 64,
        "BLOCK_SIZE_N": 64,
        "BLOCK_SIZE_K": 256,
        "GROUP_SIZE_M": 8,
        "num_stages": 2,
        "num_warps": 4,
        "ms": 0.0066847712732851505,
        "min_ms": 0.0066847712732851505,
        "max_ms": 0.0066847712732851505,
        "compile_time": 0.4608936309814453
    },
    {
        "BLOCK_SIZE_M": 32,
        "BLOCK_SIZE_N": 128,
        "BLOCK_SIZE_K": 64,
        "GROUP_SIZE_M": 8,
        "num_stages": 5,
        "num_warps": 8,
        "ms": 0.006686584558337927,
        "min_ms": 0.006686584558337927,
        "max_ms": 0.006686584558337927,
        "compile_time": 0.4154784679412842
    },
    {
        "BLOCK_SIZE_M": 32,
        "BLOCK_SIZE_N": 64,
        "BLOCK_SIZE_K": 32,
        "GROUP_SIZE_M": 8,
        "num_stages": 3,
        "num_warps": 2,
        "ms": 0.006694172974675894,
        "min_ms": 0.006694172974675894,
        "max_ms": 0.006694172974675894,
        "compile_time": 0.4075779914855957
    },
    {
        "BLOCK_SIZE_M": 64,
        "BLOCK_SIZE_N": 32,
        "BLOCK_SIZE_K": 32,
        "GROUP_SIZE_M": 8,
        "num_stages": 5,
        "num_warps": 2,
        "ms": 0.006709132343530655,
        "min_ms": 0.006709132343530655,
        "max_ms": 0.006709132343530655,
        "compile_time": 0.44648075103759766
    },
    {
        "BLOCK_SIZE_M": 32,
        "BLOCK_SIZE_N": 32,
        "BLOCK_SIZE_K": 64,
        "GROUP_SIZE_M": 8,
        "num_stages": 4,
        "num_warps": 2,
        "ms": 0.006714985705912113,
        "min_ms": 0.006714985705912113,
        "max_ms": 0.006714985705912113,
        "compile_time": 0.4185771942138672
    },
    {
        "BLOCK_SIZE_M": 32,
        "BLOCK_SIZE_N": 128,
        "BLOCK_SIZE_K": 64,
        "GROUP_SIZE_M": 8,
        "num_stages": 6,
        "num_warps": 8,
        "ms": 0.006726824678480625,
        "min_ms": 0.006726824678480625,
        "max_ms": 0.006726824678480625,
        "compile_time": 0.42081260681152344
    },
    {
        "BLOCK_SIZE_M": 64,
        "BLOCK_SIZE_N": 128,
        "BLOCK_SIZE_K": 32,
        "GROUP_SIZE_M": 8,
        "num_stages": 5,
        "num_warps": 4,
        "ms": 0.006735384464263916,
        "min_ms": 0.006735384464263916,
        "max_ms": 0.006735384464263916,
        "compile_time": 0.4673771858215332
    },
    {
        "BLOCK_SIZE_M": 128,
        "BLOCK_SIZE_N": 32,
        "BLOCK_SIZE_K": 64,
        "GROUP_SIZE_M": 8,
        "num_stages": 3,
        "num_warps": 2,
        "ms": 0.006742834113538265,
        "min_ms": 0.006742834113538265,
        "max_ms": 0.006742834113538265,
        "compile_time": 0.5306963920593262
    },
    {
        "BLOCK_SIZE_M": 32,
        "BLOCK_SIZE_N": 64,
        "BLOCK_SIZE_K": 64,
        "GROUP_SIZE_M": 8,
        "num_stages": 3,
        "num_warps": 4,
        "ms": 0.00674775242805481,
        "min_ms": 0.00674775242805481,
        "max_ms": 0.00674775242805481,
        "compile_time": 0.4101276397705078
    },
    {
        "BLOCK_SIZE_M": 64,
        "BLOCK_SIZE_N": 128,
        "BLOCK_SIZE_K": 64,
        "GROUP_SIZE_M": 8,
        "num_stages": 4,
        "num_warps": 4,
        "ms": 0.006749553140252829,
        "min_ms": 0.006749553140252829,
        "max_ms": 0.006749553140252829,
        "compile_time": 0.45671606063842773
    },
    {
        "BLOCK_SIZE_M": 64,
        "BLOCK_SIZE_N": 64,
        "BLOCK_SIZE_K": 128,
        "GROUP_SIZE_M": 8,
        "num_stages": 2,
        "num_warps": 4,
        "ms": 0.006762322969734669,
        "min_ms": 0.006762322969734669,
        "max_ms": 0.006762322969734669,
        "compile_time": 0.4572422504425049
    },
    {
        "BLOCK_SIZE_M": 32,
        "BLOCK_SIZE_N": 64,
        "BLOCK_SIZE_K": 32,
        "GROUP_SIZE_M": 8,
        "num_stages": 4,
        "num_warps": 4,
        "ms": 0.006764290388673544,
        "min_ms": 0.006764290388673544,
        "max_ms": 0.006764290388673544,
        "compile_time": 0.40890049934387207
    },
    {
        "BLOCK_SIZE_M": 64,
        "BLOCK_SIZE_N": 128,
        "BLOCK_SIZE_K": 32,
        "GROUP_SIZE_M": 8,
        "num_stages": 3,
        "num_warps": 4,
        "ms": 0.00677374517545104,
        "min_ms": 0.00677374517545104,
        "max_ms": 0.00677374517545104,
        "compile_time": 0.4632248878479004
    },
    {
        "BLOCK_SIZE_M": 64,
        "BLOCK_SIZE_N": 128,
        "BLOCK_SIZE_K": 64,
        "GROUP_SIZE_M": 8,
        "num_stages": 5,
        "num_warps": 4,
        "ms": 0.006779015995562077,
        "min_ms": 0.006779015995562077,
        "max_ms": 0.006779015995562077,
        "compile_time": 0.4669609069824219
    },
    {
        "BLOCK_SIZE_M": 64,
        "BLOCK_SIZE_N": 32,
        "BLOCK_SIZE_K": 64,
        "GROUP_SIZE_M": 8,
        "num_stages": 3,
        "num_warps": 2,
        "ms": 0.006792898289859295,
        "min_ms": 0.006792898289859295,
        "max_ms": 0.006792898289859295,
        "compile_time": 0.4499073028564453
    },
    {
        "BLOCK_SIZE_M": 64,
        "BLOCK_SIZE_N": 32,
        "BLOCK_SIZE_K": 32,
        "GROUP_SIZE_M": 8,
        "num_stages": 6,
        "num_warps": 2,
        "ms": 0.006794987712055445,
        "min_ms": 0.006794987712055445,
        "max_ms": 0.006794987712055445,
        "compile_time": 0.45191431045532227
    },
    {
        "BLOCK_SIZE_M": 128,
        "BLOCK_SIZE_N": 32,
        "BLOCK_SIZE_K": 64,
        "GROUP_SIZE_M": 8,
        "num_stages": 5,
        "num_warps": 2,
        "ms": 0.006795940455049276,
        "min_ms": 0.006795940455049276,
        "max_ms": 0.006795940455049276,
        "compile_time": 0.4881129264831543
    },
    {
        "BLOCK_SIZE_M": 64,
        "BLOCK_SIZE_N": 32,
        "BLOCK_SIZE_K": 32,
        "GROUP_SIZE_M": 8,
        "num_stages": 3,
        "num_warps": 4,
        "ms": 0.006803595926612616,
        "min_ms": 0.006803595926612616,
        "max_ms": 0.006803595926612616,
        "compile_time": 0.45381975173950195
    },
    {
        "BLOCK_SIZE_M": 128,
        "BLOCK_SIZE_N": 32,
        "BLOCK_SIZE_K": 128,
        "GROUP_SIZE_M": 8,
        "num_stages": 3,
        "num_warps": 8,
        "ms": 0.006815974600613117,
        "min_ms": 0.006815974600613117,
        "max_ms": 0.006815974600613117,
        "compile_time": 0.49198150634765625
    },
    {
        "BLOCK_SIZE_M": 32,
        "BLOCK_SIZE_N": 64,
        "BLOCK_SIZE_K": 64,
        "GROUP_SIZE_M": 8,
        "num_stages": 4,
        "num_warps": 4,
        "ms": 0.006816548760980368,
        "min_ms": 0.006816548760980368,
        "max_ms": 0.006816548760980368,
        "compile_time": 0.4152648448944092
    },
    {
        "BLOCK_SIZE_M": 32,
        "BLOCK_SIZE_N": 32,
        "BLOCK_SIZE_K": 32,
        "GROUP_SIZE_M": 8,
        "num_stages": 5,
        "num_warps": 2,
        "ms": 0.006826884113252163,
        "min_ms": 0.006826884113252163,
        "max_ms": 0.006826884113252163,
        "compile_time": 0.41088223457336426
    },
    {
        "BLOCK_SIZE_M": 128,
        "BLOCK_SIZE_N": 32,
        "BLOCK_SIZE_K": 64,
        "GROUP_SIZE_M": 8,
        "num_stages": 6,
        "num_warps": 2,
        "ms": 0.0068383715115487576,
        "min_ms": 0.0068383715115487576,
        "max_ms": 0.0068383715115487576,
        "compile_time": 0.5104196071624756
    },
    {
        "BLOCK_SIZE_M": 128,
        "BLOCK_SIZE_N": 64,
        "BLOCK_SIZE_K": 32,
        "GROUP_SIZE_M": 8,
        "num_stages": 3,
        "num_warps": 4,
        "ms": 0.006839974317699671,
        "min_ms": 0.006839974317699671,
        "max_ms": 0.006839974317699671,
        "compile_time": 0.49783825874328613
    },
    {
        "BLOCK_SIZE_M": 32,
        "BLOCK_SIZE_N": 64,
        "BLOCK_SIZE_K": 32,
        "GROUP_SIZE_M": 8,
        "num_stages": 5,
        "num_warps": 4,
        "ms": 0.006851511541754007,
        "min_ms": 0.006851511541754007,
        "max_ms": 0.006851511541754007,
        "compile_time": 0.4080357551574707
    },
    {
        "BLOCK_SIZE_M": 128,
        "BLOCK_SIZE_N": 32,
        "BLOCK_SIZE_K": 64,
        "GROUP_SIZE_M": 8,
        "num_stages": 7,
        "num_warps": 8,
        "ms": 0.006856835447251797,
        "min_ms": 0.006856835447251797,
        "max_ms": 0.006856835447251797,
        "compile_time": 0.49710559844970703
    },
    {
        "BLOCK_SIZE_M": 32,
        "BLOCK_SIZE_N": 128,
        "BLOCK_SIZE_K": 64,
        "GROUP_SIZE_M": 8,
        "num_stages": 3,
        "num_warps": 2,
        "ms": 0.006866237614303827,
        "min_ms": 0.006866237614303827,
        "max_ms": 0.006866237614303827,
        "compile_time": 0.41913914680480957
    },
    {
        "BLOCK_SIZE_M": 32,
        "BLOCK_SIZE_N": 32,
        "BLOCK_SIZE_K": 64,
        "GROUP_SIZE_M": 8,
        "num_stages": 3,
        "num_warps": 2,
        "ms": 0.006869511213153601,
        "min_ms": 0.006869511213153601,
        "max_ms": 0.006869511213153601,
        "compile_time": 0.4031491279602051
    },
    {
        "BLOCK_SIZE_M": 32,
        "BLOCK_SIZE_N": 64,
        "BLOCK_SIZE_K": 64,
        "GROUP_SIZE_M": 8,
        "num_stages": 3,
        "num_warps": 2,
        "ms": 0.006872920785099268,
        "min_ms": 0.006872920785099268,
        "max_ms": 0.006872920785099268,
        "compile_time": 0.41078925132751465
    },
    {
        "BLOCK_SIZE_M": 32,
        "BLOCK_SIZE_N": 128,
        "BLOCK_SIZE_K": 128,
        "GROUP_SIZE_M": 8,
        "num_stages": 3,
        "num_warps": 8,
        "ms": 0.006873697973787785,
        "min_ms": 0.006873697973787785,
        "max_ms": 0.006873697973787785,
        "compile_time": 0.4221043586730957
    },
    {
        "BLOCK_SIZE_M": 64,
        "BLOCK_SIZE_N": 128,
        "BLOCK_SIZE_K": 32,
        "GROUP_SIZE_M": 8,
        "num_stages": 4,
        "num_warps": 4,
        "ms": 0.006875848863273859,
        "min_ms": 0.006875848863273859,
        "max_ms": 0.006875848863273859,
        "compile_time": 0.47470974922180176
    },
    {
        "BLOCK_SIZE_M": 64,
        "BLOCK_SIZE_N": 128,
        "BLOCK_SIZE_K": 32,
        "GROUP_SIZE_M": 8,
        "num_stages": 6,
        "num_warps": 4,
        "ms": 0.006877811159938574,
        "min_ms": 0.006877811159938574,
        "max_ms": 0.006877811159938574,
        "compile_time": 0.4694828987121582
    },
    {
        "BLOCK_SIZE_M": 128,
        "BLOCK_SIZE_N": 32,
        "BLOCK_SIZE_K": 64,
        "GROUP_SIZE_M": 8,
        "num_stages": 4,
        "num_warps": 2,
        "ms": 0.006879149936139584,
        "min_ms": 0.006879149936139584,
        "max_ms": 0.006879149936139584,
        "compile_time": 0.5224711894989014
    },
    {
        "BLOCK_SIZE_M": 32,
        "BLOCK_SIZE_N": 64,
        "BLOCK_SIZE_K": 32,
        "GROUP_SIZE_M": 8,
        "num_stages": 4,
        "num_warps": 2,
        "ms": 0.006879490800201893,
        "min_ms": 0.006879490800201893,
        "max_ms": 0.006879490800201893,
        "compile_time": 0.411968469619751
    },
    {
        "BLOCK_SIZE_M": 128,
        "BLOCK_SIZE_N": 64,
        "BLOCK_SIZE_K": 32,
        "GROUP_SIZE_M": 8,
        "num_stages": 4,
        "num_warps": 4,
        "ms": 0.00689342338591814,
        "min_ms": 0.00689342338591814,
        "max_ms": 0.00689342338591814,
        "compile_time": 0.5031137466430664
    },
    {
        "BLOCK_SIZE_M": 64,
        "BLOCK_SIZE_N": 32,
        "BLOCK_SIZE_K": 64,
        "GROUP_SIZE_M": 8,
        "num_stages": 5,
        "num_warps": 2,
        "ms": 0.0069043561816215515,
        "min_ms": 0.0069043561816215515,
        "max_ms": 0.0069043561816215515,
        "compile_time": 0.45300769805908203
    },
    {
        "BLOCK_SIZE_M": 128,
        "BLOCK_SIZE_N": 64,
        "BLOCK_SIZE_K": 32,
        "GROUP_SIZE_M": 8,
        "num_stages": 5,
        "num_warps": 4,
        "ms": 0.006906800903379917,
        "min_ms": 0.006906800903379917,
        "max_ms": 0.006906800903379917,
        "compile_time": 0.5021145343780518
    },
    {
        "BLOCK_SIZE_M": 128,
        "BLOCK_SIZE_N": 32,
        "BLOCK_SIZE_K": 128,
        "GROUP_SIZE_M": 8,
        "num_stages": 4,
        "num_warps": 8,
        "ms": 0.006921201944351196,
        "min_ms": 0.006921201944351196,
        "max_ms": 0.006921201944351196,
        "compile_time": 0.49846458435058594
    },
    {
        "BLOCK_SIZE_M": 32,
        "BLOCK_SIZE_N": 128,
        "BLOCK_SIZE_K": 32,
        "GROUP_SIZE_M": 8,
        "num_stages": 5,
        "num_warps": 2,
        "ms": 0.0069257952272892,
        "min_ms": 0.0069257952272892,
        "max_ms": 0.0069257952272892,
        "compile_time": 0.42624855041503906
    },
    {
        "BLOCK_SIZE_M": 32,
        "BLOCK_SIZE_N": 128,
        "BLOCK_SIZE_K": 128,
        "GROUP_SIZE_M": 8,
        "num_stages": 4,
        "num_warps": 8,
        "ms": 0.006928621791303158,
        "min_ms": 0.006928621791303158,
        "max_ms": 0.006928621791303158,
        "compile_time": 0.42369675636291504
    },
    {
        "BLOCK_SIZE_M": 64,
        "BLOCK_SIZE_N": 32,
        "BLOCK_SIZE_K": 32,
        "GROUP_SIZE_M": 8,
        "num_stages": 7,
        "num_warps": 2,
        "ms": 0.006930178496986628,
        "min_ms": 0.006930178496986628,
        "max_ms": 0.006930178496986628,
        "compile_time": 0.4570479393005371
    },
    {
        "BLOCK_SIZE_M": 32,
        "BLOCK_SIZE_N": 32,
        "BLOCK_SIZE_K": 32,
        "GROUP_SIZE_M": 8,
        "num_stages": 4,
        "num_warps": 2,
        "ms": 0.006940408609807491,
        "min_ms": 0.006940408609807491,
        "max_ms": 0.006940408609807491,
        "compile_time": 0.4329032897949219
    },
    {
        "BLOCK_SIZE_M": 32,
        "BLOCK_SIZE_N": 128,
        "BLOCK_SIZE_K": 32,
        "GROUP_SIZE_M": 8,
        "num_stages": 6,
        "num_warps": 2,
        "ms": 0.006940816529095173,
        "min_ms": 0.006940816529095173,
        "max_ms": 0.006940816529095173,
        "compile_time": 0.41585373878479004
    },
    {
        "BLOCK_SIZE_M": 128,
        "BLOCK_SIZE_N": 64,
        "BLOCK_SIZE_K": 64,
        "GROUP_SIZE_M": 8,
        "num_stages": 7,
        "num_warps": 4,
        "ms": 0.0069430796429514885,
        "min_ms": 0.0069430796429514885,
        "max_ms": 0.0069430796429514885,
        "compile_time": 0.45984411239624023
    },
    {
        "BLOCK_SIZE_M": 64,
        "BLOCK_SIZE_N": 32,
        "BLOCK_SIZE_K": 64,
        "GROUP_SIZE_M": 8,
        "num_stages": 3,
        "num_warps": 4,
        "ms": 0.00694429874420166,
        "min_ms": 0.00694429874420166,
        "max_ms": 0.00694429874420166,
        "compile_time": 0.45855259895324707
    },
    {
        "BLOCK_SIZE_M": 32,
        "BLOCK_SIZE_N": 128,
        "BLOCK_SIZE_K": 32,
        "GROUP_SIZE_M": 8,
        "num_stages": 4,
        "num_warps": 2,
        "ms": 0.006944622844457626,
        "min_ms": 0.006944622844457626,
        "max_ms": 0.006944622844457626,
        "compile_time": 0.4271373748779297
    },
    {
        "BLOCK_SIZE_M": 64,
        "BLOCK_SIZE_N": 128,
        "BLOCK_SIZE_K": 32,
        "GROUP_SIZE_M": 8,
        "num_stages": 7,
        "num_warps": 4,
        "ms": 0.006953118834644556,
        "min_ms": 0.006953118834644556,
        "max_ms": 0.006953118834644556,
        "compile_time": 0.46976661682128906
    },
    {
        "BLOCK_SIZE_M": 64,
        "BLOCK_SIZE_N": 128,
        "BLOCK_SIZE_K": 64,
        "GROUP_SIZE_M": 8,
        "num_stages": 6,
        "num_warps": 4,
        "ms": 0.006955680437386036,
        "min_ms": 0.006955680437386036,
        "max_ms": 0.006955680437386036,
        "compile_time": 0.46352148056030273
    },
    {
        "BLOCK_SIZE_M": 32,
        "BLOCK_SIZE_N": 128,
        "BLOCK_SIZE_K": 64,
        "GROUP_SIZE_M": 8,
        "num_stages": 7,
        "num_warps": 8,
        "ms": 0.006960255093872547,
        "min_ms": 0.006960255093872547,
        "max_ms": 0.006960255093872547,
        "compile_time": 0.4197561740875244
    },
    {
        "BLOCK_SIZE_M": 32,
        "BLOCK_SIZE_N": 64,
        "BLOCK_SIZE_K": 32,
        "GROUP_SIZE_M": 8,
        "num_stages": 3,
        "num_warps": 4,
        "ms": 0.006960934493690729,
        "min_ms": 0.006960934493690729,
        "max_ms": 0.006960934493690729,
        "compile_time": 0.4132194519042969
    },
    {
        "BLOCK_SIZE_M": 32,
        "BLOCK_SIZE_N": 32,
        "BLOCK_SIZE_K": 64,
        "GROUP_SIZE_M": 8,
        "num_stages": 3,
        "num_warps": 4,
        "ms": 0.006964446045458317,
        "min_ms": 0.006964446045458317,
        "max_ms": 0.006964446045458317,
        "compile_time": 0.40843701362609863
    },
    {
        "BLOCK_SIZE_M": 64,
        "BLOCK_SIZE_N": 32,
        "BLOCK_SIZE_K": 32,
        "GROUP_SIZE_M": 8,
        "num_stages": 4,
        "num_warps": 4,
        "ms": 0.006966199725866318,
        "min_ms": 0.006966199725866318,
        "max_ms": 0.006966199725866318,
        "compile_time": 0.45142292976379395
    },
    {
        "BLOCK_SIZE_M": 64,
        "BLOCK_SIZE_N": 32,
        "BLOCK_SIZE_K": 32,
        "GROUP_SIZE_M": 8,
        "num_stages": 5,
        "num_warps": 4,
        "ms": 0.006970108952373266,
        "min_ms": 0.006970108952373266,
        "max_ms": 0.006970108952373266,
        "compile_time": 0.4547305107116699
    },
    {
        "BLOCK_SIZE_M": 64,
        "BLOCK_SIZE_N": 32,
        "BLOCK_SIZE_K": 64,
        "GROUP_SIZE_M": 8,
        "num_stages": 4,
        "num_warps": 2,
        "ms": 0.006975207477807999,
        "min_ms": 0.006975207477807999,
        "max_ms": 0.006975207477807999,
        "compile_time": 0.45807480812072754
    },
    {
        "BLOCK_SIZE_M": 32,
        "BLOCK_SIZE_N": 32,
        "BLOCK_SIZE_K": 32,
        "GROUP_SIZE_M": 8,
        "num_stages": 6,
        "num_warps": 2,
        "ms": 0.006987882312387228,
        "min_ms": 0.006987882312387228,
        "max_ms": 0.006987882312387228,
        "compile_time": 0.4099540710449219
    },
    {
        "BLOCK_SIZE_M": 32,
        "BLOCK_SIZE_N": 32,
        "BLOCK_SIZE_K": 128,
        "GROUP_SIZE_M": 8,
        "num_stages": 3,
        "num_warps": 2,
        "ms": 0.006991405040025711,
        "min_ms": 0.006991405040025711,
        "max_ms": 0.006991405040025711,
        "compile_time": 0.41226935386657715
    },
    {
        "BLOCK_SIZE_M": 32,
        "BLOCK_SIZE_N": 128,
        "BLOCK_SIZE_K": 32,
        "GROUP_SIZE_M": 8,
        "num_stages": 7,
        "num_warps": 2,
        "ms": 0.006994924508035183,
        "min_ms": 0.006994924508035183,
        "max_ms": 0.006994924508035183,
        "compile_time": 0.41525888442993164
    },
    {
        "BLOCK_SIZE_M": 32,
        "BLOCK_SIZE_N": 128,
        "BLOCK_SIZE_K": 32,
        "GROUP_SIZE_M": 8,
        "num_stages": 4,
        "num_warps": 8,
        "ms": 0.007003548555076122,
        "min_ms": 0.007003548555076122,
        "max_ms": 0.007003548555076122,
        "compile_time": 0.42700839042663574
    },
    {
        "BLOCK_SIZE_M": 32,
        "BLOCK_SIZE_N": 32,
        "BLOCK_SIZE_K": 64,
        "GROUP_SIZE_M": 8,
        "num_stages": 5,
        "num_warps": 2,
        "ms": 0.007006712257862091,
        "min_ms": 0.007006712257862091,
        "max_ms": 0.007006712257862091,
        "compile_time": 0.41666078567504883
    },
    {
        "BLOCK_SIZE_M": 128,
        "BLOCK_SIZE_N": 32,
        "BLOCK_SIZE_K": 32,
        "GROUP_SIZE_M": 8,
        "num_stages": 5,
        "num_warps": 2,
        "ms": 0.007015957031399012,
        "min_ms": 0.007015957031399012,
        "max_ms": 0.007015957031399012,
        "compile_time": 0.5022175312042236
    },
    {
        "BLOCK_SIZE_M": 64,
        "BLOCK_SIZE_N": 64,
        "BLOCK_SIZE_K": 32,
        "GROUP_SIZE_M": 8,
        "num_stages": 3,
        "num_warps": 2,
        "ms": 0.007016283459961414,
        "min_ms": 0.007016283459961414,
        "max_ms": 0.007016283459961414,
        "compile_time": 0.45500802993774414
    },
    {
        "BLOCK_SIZE_M": 32,
        "BLOCK_SIZE_N": 128,
        "BLOCK_SIZE_K": 64,
        "GROUP_SIZE_M": 8,
        "num_stages": 4,
        "num_warps": 2,
        "ms": 0.0070207929238677025,
        "min_ms": 0.0070207929238677025,
        "max_ms": 0.0070207929238677025,
        "compile_time": 0.42716383934020996
    },
    {
        "BLOCK_SIZE_M": 32,
        "BLOCK_SIZE_N": 128,
        "BLOCK_SIZE_K": 32,
        "GROUP_SIZE_M": 8,
        "num_stages": 8,
        "num_warps": 2,
        "ms": 0.007022782228887081,
        "min_ms": 0.007022782228887081,
        "max_ms": 0.007022782228887081,
        "compile_time": 0.42354846000671387
    },
    {
        "BLOCK_SIZE_M": 128,
        "BLOCK_SIZE_N": 64,
        "BLOCK_SIZE_K": 32,
        "GROUP_SIZE_M": 8,
        "num_stages": 6,
        "num_warps": 4,
        "ms": 0.007024064660072327,
        "min_ms": 0.007024064660072327,
        "max_ms": 0.007024064660072327,
        "compile_time": 0.5007648468017578
    },
    {
        "BLOCK_SIZE_M": 64,
        "BLOCK_SIZE_N": 64,
        "BLOCK_SIZE_K": 32,
        "GROUP_SIZE_M": 8,
        "num_stages": 4,
        "num_warps": 2,
        "ms": 0.00702677434310317,
        "min_ms": 0.00702677434310317,
        "max_ms": 0.00702677434310317,
        "compile_time": 0.46132969856262207
    },
    {
        "BLOCK_SIZE_M": 128,
        "BLOCK_SIZE_N": 32,
        "BLOCK_SIZE_K": 32,
        "GROUP_SIZE_M": 8,
        "num_stages": 4,
        "num_warps": 2,
        "ms": 0.00703402841463685,
        "min_ms": 0.00703402841463685,
        "max_ms": 0.00703402841463685,
        "compile_time": 0.4777548313140869
    },
    {
        "BLOCK_SIZE_M": 64,
        "BLOCK_SIZE_N": 128,
        "BLOCK_SIZE_K": 32,
        "GROUP_SIZE_M": 8,
        "num_stages": 8,
        "num_warps": 4,
        "ms": 0.007051120046526194,
        "min_ms": 0.007051120046526194,
        "max_ms": 0.007051120046526194,
        "compile_time": 0.47653627395629883
    },
    {
        "BLOCK_SIZE_M": 32,
        "BLOCK_SIZE_N": 64,
        "BLOCK_SIZE_K": 32,
        "GROUP_SIZE_M": 8,
        "num_stages": 6,
        "num_warps": 4,
        "ms": 0.007052640430629253,
        "min_ms": 0.007052640430629253,
        "max_ms": 0.007052640430629253,
        "compile_time": 0.38485074043273926
    },
    {
        "BLOCK_SIZE_M": 32,
        "BLOCK_SIZE_N": 128,
        "BLOCK_SIZE_K": 128,
        "GROUP_SIZE_M": 8,
        "num_stages": 5,
        "num_warps": 8,
        "ms": 0.007061953190714121,
        "min_ms": 0.007061953190714121,
        "max_ms": 0.007061953190714121,
        "compile_time": 0.4130582809448242
    },
    {
        "BLOCK_SIZE_M": 128,
        "BLOCK_SIZE_N": 32,
        "BLOCK_SIZE_K": 64,
        "GROUP_SIZE_M": 8,
        "num_stages": 7,
        "num_warps": 2,
        "ms": 0.007068542297929525,
        "min_ms": 0.007068542297929525,
        "max_ms": 0.007068542297929525,
        "compile_time": 0.506014347076416
    },
    {
        "BLOCK_SIZE_M": 32,
        "BLOCK_SIZE_N": 64,
        "BLOCK_SIZE_K": 64,
        "GROUP_SIZE_M": 8,
        "num_stages": 5,
        "num_warps": 4,
        "ms": 0.007072470150887966,
        "min_ms": 0.007072470150887966,
        "max_ms": 0.007072470150887966,
        "compile_time": 0.4244728088378906
    },
    {
        "BLOCK_SIZE_M": 32,
        "BLOCK_SIZE_N": 64,
        "BLOCK_SIZE_K": 128,
        "GROUP_SIZE_M": 8,
        "num_stages": 2,
        "num_warps": 4,
        "ms": 0.00707449484616518,
        "min_ms": 0.00707449484616518,
        "max_ms": 0.00707449484616518,
        "compile_time": 0.42021965980529785
    },
    {
        "BLOCK_SIZE_M": 32,
        "BLOCK_SIZE_N": 128,
        "BLOCK_SIZE_K": 32,
        "GROUP_SIZE_M": 8,
        "num_stages": 5,
        "num_warps": 8,
        "ms": 0.007078583352267742,
        "min_ms": 0.007078583352267742,
        "max_ms": 0.007078583352267742,
        "compile_time": 0.41503381729125977
    },
    {
        "BLOCK_SIZE_M": 32,
        "BLOCK_SIZE_N": 128,
        "BLOCK_SIZE_K": 64,
        "GROUP_SIZE_M": 8,
        "num_stages": 6,
        "num_warps": 2,
        "ms": 0.007083836942911148,
        "min_ms": 0.007083836942911148,
        "max_ms": 0.007083836942911148,
        "compile_time": 0.4348874092102051
    },
    {
        "BLOCK_SIZE_M": 32,
        "BLOCK_SIZE_N": 128,
        "BLOCK_SIZE_K": 64,
        "GROUP_SIZE_M": 8,
        "num_stages": 7,
        "num_warps": 2,
        "ms": 0.007088272366672754,
        "min_ms": 0.007088272366672754,
        "max_ms": 0.007088272366672754,
        "compile_time": 0.41971921920776367
    },
    {
        "BLOCK_SIZE_M": 32,
        "BLOCK_SIZE_N": 128,
        "BLOCK_SIZE_K": 32,
        "GROUP_SIZE_M": 8,
        "num_stages": 3,
        "num_warps": 8,
        "ms": 0.007096202112734318,
        "min_ms": 0.007096202112734318,
        "max_ms": 0.007096202112734318,
        "compile_time": 0.43657994270324707
    },
    {
        "BLOCK_SIZE_M": 64,
        "BLOCK_SIZE_N": 32,
        "BLOCK_SIZE_K": 32,
        "GROUP_SIZE_M": 8,
        "num_stages": 8,
        "num_warps": 2,
        "ms": 0.007097848691046238,
        "min_ms": 0.007097848691046238,
        "max_ms": 0.007097848691046238,
        "compile_time": 0.45461368560791016
    },
    {
        "BLOCK_SIZE_M": 32,
        "BLOCK_SIZE_N": 32,
        "BLOCK_SIZE_K": 32,
        "GROUP_SIZE_M": 8,
        "num_stages": 3,
        "num_warps": 2,
        "ms": 0.00709924241527915,
        "min_ms": 0.00709924241527915,
        "max_ms": 0.00709924241527915,
        "compile_time": 0.40813255310058594
    },
    {
        "BLOCK_SIZE_M": 32,
        "BLOCK_SIZE_N": 64,
        "BLOCK_SIZE_K": 128,
        "GROUP_SIZE_M": 8,
        "num_stages": 3,
        "num_warps": 4,
        "ms": 0.00710234884172678,
        "min_ms": 0.00710234884172678,
        "max_ms": 0.00710234884172678,
        "compile_time": 0.41446638107299805
    },
    {
        "BLOCK_SIZE_M": 32,
        "BLOCK_SIZE_N": 128,
        "BLOCK_SIZE_K": 64,
        "GROUP_SIZE_M": 8,
        "num_stages": 5,
        "num_warps": 2,
        "ms": 0.007102980278432369,
        "min_ms": 0.007102980278432369,
        "max_ms": 0.007102980278432369,
        "compile_time": 0.42380785942077637
    },
    {
        "BLOCK_SIZE_M": 128,
        "BLOCK_SIZE_N": 32,
        "BLOCK_SIZE_K": 32,
        "GROUP_SIZE_M": 8,
        "num_stages": 6,
        "num_warps": 2,
        "ms": 0.007104069925844669,
        "min_ms": 0.007104069925844669,
        "max_ms": 0.007104069925844669,
        "compile_time": 0.5034277439117432
    },
    {
        "BLOCK_SIZE_M": 64,
        "BLOCK_SIZE_N": 32,
        "BLOCK_SIZE_K": 64,
        "GROUP_SIZE_M": 8,
        "num_stages": 5,
        "num_warps": 4,
        "ms": 0.007104906253516674,
        "min_ms": 0.007104906253516674,
        "max_ms": 0.007104906253516674,
        "compile_time": 0.4589347839355469
    },
    {
        "BLOCK_SIZE_M": 32,
        "BLOCK_SIZE_N": 64,
        "BLOCK_SIZE_K": 64,
        "GROUP_SIZE_M": 8,
        "num_stages": 4,
        "num_warps": 2,
        "ms": 0.007105839904397726,
        "min_ms": 0.007105839904397726,
        "max_ms": 0.007105839904397726,
        "compile_time": 0.4254117012023926
    },
    {
        "BLOCK_SIZE_M": 64,
        "BLOCK_SIZE_N": 128,
        "BLOCK_SIZE_K": 64,
        "GROUP_SIZE_M": 8,
        "num_stages": 7,
        "num_warps": 4,
        "ms": 0.007121223956346512,
        "min_ms": 0.007121223956346512,
        "max_ms": 0.007121223956346512,
        "compile_time": 0.4569213390350342
    },
    {
        "BLOCK_SIZE_M": 32,
        "BLOCK_SIZE_N": 32,
        "BLOCK_SIZE_K": 64,
        "GROUP_SIZE_M": 8,
        "num_stages": 4,
        "num_warps": 4,
        "ms": 0.0071272216737270355,
        "min_ms": 0.0071272216737270355,
        "max_ms": 0.0071272216737270355,
        "compile_time": 0.41164374351501465
    },
    {
        "BLOCK_SIZE_M": 32,
        "BLOCK_SIZE_N": 128,
        "BLOCK_SIZE_K": 32,
        "GROUP_SIZE_M": 8,
        "num_stages": 6,
        "num_warps": 8,
        "ms": 0.007127231918275356,
        "min_ms": 0.007127231918275356,
        "max_ms": 0.007127231918275356,
        "compile_time": 0.41281747817993164
    },
    {
        "BLOCK_SIZE_M": 128,
        "BLOCK_SIZE_N": 64,
        "BLOCK_SIZE_K": 64,
        "GROUP_SIZE_M": 8,
        "num_stages": 3,
        "num_warps": 4,
        "ms": 0.0071295783855021,
        "min_ms": 0.0071295783855021,
        "max_ms": 0.0071295783855021,
        "compile_time": 0.5077588558197021
    },
    {
        "BLOCK_SIZE_M": 128,
        "BLOCK_SIZE_N": 64,
        "BLOCK_SIZE_K": 32,
        "GROUP_SIZE_M": 8,
        "num_stages": 7,
        "num_warps": 4,
        "ms": 0.007137869484722614,
        "min_ms": 0.007137869484722614,
        "max_ms": 0.007137869484722614,
        "compile_time": 0.5106134414672852
    },
    {
        "BLOCK_SIZE_M": 64,
        "BLOCK_SIZE_N": 32,
        "BLOCK_SIZE_K": 32,
        "GROUP_SIZE_M": 8,
        "num_stages": 6,
        "num_warps": 4,
        "ms": 0.007138664834201336,
        "min_ms": 0.007138664834201336,
        "max_ms": 0.007138664834201336,
        "compile_time": 0.4811556339263916
    },
    {
        "BLOCK_SIZE_M": 32,
        "BLOCK_SIZE_N": 128,
        "BLOCK_SIZE_K": 64,
        "GROUP_SIZE_M": 8,
        "num_stages": 8,
        "num_warps": 2,
        "ms": 0.007145862095057964,
        "min_ms": 0.007145862095057964,
        "max_ms": 0.007145862095057964,
        "compile_time": 0.4312779903411865
    },
    {
        "BLOCK_SIZE_M": 128,
        "BLOCK_SIZE_N": 32,
        "BLOCK_SIZE_K": 32,
        "GROUP_SIZE_M": 8,
        "num_stages": 4,
        "num_warps": 8,
        "ms": 0.007151802070438862,
        "min_ms": 0.007151802070438862,
        "max_ms": 0.007151802070438862,
        "compile_time": 0.49794435501098633
    },
    {
        "BLOCK_SIZE_M": 64,
        "BLOCK_SIZE_N": 32,
        "BLOCK_SIZE_K": 64,
        "GROUP_SIZE_M": 8,
        "num_stages": 4,
        "num_warps": 4,
        "ms": 0.00715366518124938,
        "min_ms": 0.00715366518124938,
        "max_ms": 0.00715366518124938,
        "compile_time": 0.45268917083740234
    },
    {
        "BLOCK_SIZE_M": 128,
        "BLOCK_SIZE_N": 32,
        "BLOCK_SIZE_K": 32,
        "GROUP_SIZE_M": 8,
        "num_stages": 6,
        "num_warps": 8,
        "ms": 0.0071674226783216,
        "min_ms": 0.0071674226783216,
        "max_ms": 0.0071674226783216,
        "compile_time": 0.4952075481414795
    },
    {
        "BLOCK_SIZE_M": 128,
        "BLOCK_SIZE_N": 32,
        "BLOCK_SIZE_K": 32,
        "GROUP_SIZE_M": 8,
        "num_stages": 3,
        "num_warps": 8,
        "ms": 0.007167999632656574,
        "min_ms": 0.007167999632656574,
        "max_ms": 0.007167999632656574,
        "compile_time": 0.4996511936187744
    },
    {
        "BLOCK_SIZE_M": 128,
        "BLOCK_SIZE_N": 32,
        "BLOCK_SIZE_K": 64,
        "GROUP_SIZE_M": 8,
        "num_stages": 8,
        "num_warps": 2,
        "ms": 0.0071693346835672855,
        "min_ms": 0.0071693346835672855,
        "max_ms": 0.0071693346835672855,
        "compile_time": 0.5083720684051514
    },
    {
        "BLOCK_SIZE_M": 32,
        "BLOCK_SIZE_N": 64,
        "BLOCK_SIZE_K": 32,
        "GROUP_SIZE_M": 8,
        "num_stages": 7,
        "num_warps": 4,
        "ms": 0.007172757294028997,
        "min_ms": 0.007172757294028997,
        "max_ms": 0.007172757294028997,
        "compile_time": 0.4169797897338867
    },
    {
        "BLOCK_SIZE_M": 32,
        "BLOCK_SIZE_N": 128,
        "BLOCK_SIZE_K": 64,
        "GROUP_SIZE_M": 8,
        "num_stages": 8,
        "num_warps": 8,
        "ms": 0.007172984071075916,
        "min_ms": 0.007172984071075916,
        "max_ms": 0.007172984071075916,
        "compile_time": 0.4361886978149414
    },
    {
        "BLOCK_SIZE_M": 128,
        "BLOCK_SIZE_N": 32,
        "BLOCK_SIZE_K": 64,
        "GROUP_SIZE_M": 8,
        "num_stages": 8,
        "num_warps": 8,
        "ms": 0.007193346507847309,
        "min_ms": 0.007193346507847309,
        "max_ms": 0.007193346507847309,
        "compile_time": 0.4932541847229004
    },
    {
        "BLOCK_SIZE_M": 64,
        "BLOCK_SIZE_N": 64,
        "BLOCK_SIZE_K": 64,
        "GROUP_SIZE_M": 8,
        "num_stages": 2,
        "num_warps": 4,
        "ms": 0.007201828993856907,
        "min_ms": 0.007201828993856907,
        "max_ms": 0.007201828993856907,
        "compile_time": 0.45600128173828125
    },
    {
        "BLOCK_SIZE_M": 32,
        "BLOCK_SIZE_N": 64,
        "BLOCK_SIZE_K": 32,
        "GROUP_SIZE_M": 8,
        "num_stages": 6,
        "num_warps": 2,
        "ms": 0.00721693504601717,
        "min_ms": 0.00721693504601717,
        "max_ms": 0.00721693504601717,
        "compile_time": 0.4184074401855469
    },
    {
        "BLOCK_SIZE_M": 128,
        "BLOCK_SIZE_N": 32,
        "BLOCK_SIZE_K": 32,
        "GROUP_SIZE_M": 8,
        "num_stages": 7,
        "num_warps": 2,
        "ms": 0.007221536245197058,
        "min_ms": 0.007221536245197058,
        "max_ms": 0.007221536245197058,
        "compile_time": 0.4964592456817627
    },
    {
        "BLOCK_SIZE_M": 64,
        "BLOCK_SIZE_N": 32,
        "BLOCK_SIZE_K": 64,
        "GROUP_SIZE_M": 8,
        "num_stages": 6,
        "num_warps": 2,
        "ms": 0.007228488568216562,
        "min_ms": 0.007228488568216562,
        "max_ms": 0.007228488568216562,
        "compile_time": 0.4627871513366699
    },
    {
        "BLOCK_SIZE_M": 32,
        "BLOCK_SIZE_N": 32,
        "BLOCK_SIZE_K": 32,
        "GROUP_SIZE_M": 8,
        "num_stages": 7,
        "num_warps": 2,
        "ms": 0.007231660187244415,
        "min_ms": 0.007231660187244415,
        "max_ms": 0.007231660187244415,
        "compile_time": 0.41120171546936035
    },
    {
        "BLOCK_SIZE_M": 32,
        "BLOCK_SIZE_N": 64,
        "BLOCK_SIZE_K": 64,
        "GROUP_SIZE_M": 8,
        "num_stages": 6,
        "num_warps": 4,
        "ms": 0.007232931442558765,
        "min_ms": 0.007232931442558765,
        "max_ms": 0.007232931442558765,
        "compile_time": 0.4241459369659424
    },
    {
        "BLOCK_SIZE_M": 64,
        "BLOCK_SIZE_N": 32,
        "BLOCK_SIZE_K": 128,
        "GROUP_SIZE_M": 8,
        "num_stages": 2,
        "num_warps": 4,
        "ms": 0.007235737983137369,
        "min_ms": 0.007235737983137369,
        "max_ms": 0.007235737983137369,
        "compile_time": 0.4602227210998535
    },
    {
        "BLOCK_SIZE_M": 32,
        "BLOCK_SIZE_N": 128,
        "BLOCK_SIZE_K": 32,
        "GROUP_SIZE_M": 8,
        "num_stages": 7,
        "num_warps": 8,
        "ms": 0.007237343583256006,
        "min_ms": 0.007237343583256006,
        "max_ms": 0.007237343583256006,
        "compile_time": 0.42159032821655273
    },
    {
        "BLOCK_SIZE_M": 128,
        "BLOCK_SIZE_N": 64,
        "BLOCK_SIZE_K": 32,
        "GROUP_SIZE_M": 8,
        "num_stages": 8,
        "num_warps": 4,
        "ms": 0.0072469525039196014,
        "min_ms": 0.0072469525039196014,
        "max_ms": 0.0072469525039196014,
        "compile_time": 0.5150911808013916
    },
    {
        "BLOCK_SIZE_M": 32,
        "BLOCK_SIZE_N": 128,
        "BLOCK_SIZE_K": 32,
        "GROUP_SIZE_M": 8,
        "num_stages": 8,
        "num_warps": 8,
        "ms": 0.007247178815305233,
        "min_ms": 0.007247178815305233,
        "max_ms": 0.007247178815305233,
        "compile_time": 0.4249875545501709
    },
    {
        "BLOCK_SIZE_M": 128,
        "BLOCK_SIZE_N": 32,
        "BLOCK_SIZE_K": 32,
        "GROUP_SIZE_M": 8,
        "num_stages": 5,
        "num_warps": 8,
        "ms": 0.007253722753375769,
        "min_ms": 0.007253722753375769,
        "max_ms": 0.007253722753375769,
        "compile_time": 0.5066330432891846
    },
    {
        "BLOCK_SIZE_M": 128,
        "BLOCK_SIZE_N": 32,
        "BLOCK_SIZE_K": 32,
        "GROUP_SIZE_M": 8,
        "num_stages": 7,
        "num_warps": 8,
        "ms": 0.007281649857759476,
        "min_ms": 0.007281649857759476,
        "max_ms": 0.007281649857759476,
        "compile_time": 0.49943089485168457
    },
    {
        "BLOCK_SIZE_M": 32,
        "BLOCK_SIZE_N": 64,
        "BLOCK_SIZE_K": 32,
        "GROUP_SIZE_M": 8,
        "num_stages": 8,
        "num_warps": 4,
        "ms": 0.007284379098564386,
        "min_ms": 0.007284379098564386,
        "max_ms": 0.007284379098564386,
        "compile_time": 0.3949272632598877
    },
    {
        "BLOCK_SIZE_M": 64,
        "BLOCK_SIZE_N": 64,
        "BLOCK_SIZE_K": 256,
        "GROUP_SIZE_M": 8,
        "num_stages": 3,
        "num_warps": 8,
        "ms": 0.007291608490049839,
        "min_ms": 0.007291608490049839,
        "max_ms": 0.007291608490049839,
        "compile_time": 0.46371030807495117
    },
    {
        "BLOCK_SIZE_M": 64,
        "BLOCK_SIZE_N": 32,
        "BLOCK_SIZE_K": 64,
        "GROUP_SIZE_M": 8,
        "num_stages": 2,
        "num_warps": 2,
        "ms": 0.0072943707928061485,
        "min_ms": 0.0072943707928061485,
        "max_ms": 0.0072943707928061485,
        "compile_time": 0.45750880241394043
    },
    {
        "BLOCK_SIZE_M": 64,
        "BLOCK_SIZE_N": 64,
        "BLOCK_SIZE_K": 64,
        "GROUP_SIZE_M": 8,
        "num_stages": 3,
        "num_warps": 16,
        "ms": 0.007300190627574921,
        "min_ms": 0.007300190627574921,
        "max_ms": 0.007300190627574921,
        "compile_time": 0.46842265129089355
    },
    {
        "BLOCK_SIZE_M": 128,
        "BLOCK_SIZE_N": 64,
        "BLOCK_SIZE_K": 64,
        "GROUP_SIZE_M": 8,
        "num_stages": 4,
        "num_warps": 4,
        "ms": 0.007302393205463886,
        "min_ms": 0.007302393205463886,
        "max_ms": 0.007302393205463886,
        "compile_time": 0.5235211849212646
    },
    {
        "BLOCK_SIZE_M": 32,
        "BLOCK_SIZE_N": 64,
        "BLOCK_SIZE_K": 32,
        "GROUP_SIZE_M": 8,
        "num_stages": 8,
        "num_warps": 2,
        "ms": 0.007310272194445133,
        "min_ms": 0.007310272194445133,
        "max_ms": 0.007310272194445133,
        "compile_time": 0.4107794761657715
    },
    {
        "BLOCK_SIZE_M": 32,
        "BLOCK_SIZE_N": 32,
        "BLOCK_SIZE_K": 32,
        "GROUP_SIZE_M": 8,
        "num_stages": 5,
        "num_warps": 4,
        "ms": 0.007322767283767462,
        "min_ms": 0.007322767283767462,
        "max_ms": 0.007322767283767462,
        "compile_time": 0.4157891273498535
    },
    {
        "BLOCK_SIZE_M": 128,
        "BLOCK_SIZE_N": 32,
        "BLOCK_SIZE_K": 128,
        "GROUP_SIZE_M": 8,
        "num_stages": 5,
        "num_warps": 8,
        "ms": 0.007328385021537542,
        "min_ms": 0.007328385021537542,
        "max_ms": 0.007328385021537542,
        "compile_time": 0.5037071704864502
    },
    {
        "BLOCK_SIZE_M": 32,
        "BLOCK_SIZE_N": 32,
        "BLOCK_SIZE_K": 128,
        "GROUP_SIZE_M": 8,
        "num_stages": 3,
        "num_warps": 4,
        "ms": 0.007331724278628826,
        "min_ms": 0.007331724278628826,
        "max_ms": 0.007331724278628826,
        "compile_time": 0.4100642204284668
    },
    {
        "BLOCK_SIZE_M": 128,
        "BLOCK_SIZE_N": 64,
        "BLOCK_SIZE_K": 64,
        "GROUP_SIZE_M": 8,
        "num_stages": 5,
        "num_warps": 4,
        "ms": 0.007334400899708271,
        "min_ms": 0.007334400899708271,
        "max_ms": 0.007334400899708271,
        "compile_time": 0.514216423034668
    },
    {
        "BLOCK_SIZE_M": 128,
        "BLOCK_SIZE_N": 32,
        "BLOCK_SIZE_K": 32,
        "GROUP_SIZE_M": 8,
        "num_stages": 8,
        "num_warps": 2,
        "ms": 0.007335192523896694,
        "min_ms": 0.007335192523896694,
        "max_ms": 0.007335192523896694,
        "compile_time": 0.529292106628418
    },
    {
        "BLOCK_SIZE_M": 64,
        "BLOCK_SIZE_N": 32,
        "BLOCK_SIZE_K": 32,
        "GROUP_SIZE_M": 8,
        "num_stages": 7,
        "num_warps": 4,
        "ms": 0.007356715388596058,
        "min_ms": 0.007356715388596058,
        "max_ms": 0.007356715388596058,
        "compile_time": 0.4623293876647949
    },
    {
        "BLOCK_SIZE_M": 128,
        "BLOCK_SIZE_N": 64,
        "BLOCK_SIZE_K": 64,
        "GROUP_SIZE_M": 8,
        "num_stages": 6,
        "num_warps": 4,
        "ms": 0.0073584928177297115,
        "min_ms": 0.0073584928177297115,
        "max_ms": 0.0073584928177297115,
        "compile_time": 0.5098044872283936
    },
    {
        "BLOCK_SIZE_M": 32,
        "BLOCK_SIZE_N": 32,
        "BLOCK_SIZE_K": 32,
        "GROUP_SIZE_M": 8,
        "num_stages": 4,
        "num_warps": 4,
        "ms": 0.007365045137703419,
        "min_ms": 0.007365045137703419,
        "max_ms": 0.007365045137703419,
        "compile_time": 0.41028618812561035
    },
    {
        "BLOCK_SIZE_M": 32,
        "BLOCK_SIZE_N": 64,
        "BLOCK_SIZE_K": 64,
        "GROUP_SIZE_M": 8,
        "num_stages": 5,
        "num_warps": 2,
        "ms": 0.0073921456933021545,
        "min_ms": 0.0073921456933021545,
        "max_ms": 0.0073921456933021545,
        "compile_time": 0.4255256652832031
    },
    {
        "BLOCK_SIZE_M": 64,
        "BLOCK_SIZE_N": 64,
        "BLOCK_SIZE_K": 64,
        "GROUP_SIZE_M": 8,
        "num_stages": 5,
        "num_warps": 16,
        "ms": 0.007394610438495874,
        "min_ms": 0.007394610438495874,
        "max_ms": 0.007394610438495874,
        "compile_time": 0.4806244373321533
    },
    {
        "BLOCK_SIZE_M": 32,
        "BLOCK_SIZE_N": 32,
        "BLOCK_SIZE_K": 64,
        "GROUP_SIZE_M": 8,
        "num_stages": 6,
        "num_warps": 2,
        "ms": 0.007395374123007059,
        "min_ms": 0.007395374123007059,
        "max_ms": 0.007395374123007059,
        "compile_time": 0.4284355640411377
    },
    {
        "BLOCK_SIZE_M": 32,
        "BLOCK_SIZE_N": 64,
        "BLOCK_SIZE_K": 64,
        "GROUP_SIZE_M": 8,
        "num_stages": 2,
        "num_warps": 2,
        "ms": 0.007404932286590338,
        "min_ms": 0.007404932286590338,
        "max_ms": 0.007404932286590338,
        "compile_time": 0.42711353302001953
    },
    {
        "BLOCK_SIZE_M": 32,
        "BLOCK_SIZE_N": 64,
        "BLOCK_SIZE_K": 32,
        "GROUP_SIZE_M": 8,
        "num_stages": 7,
        "num_warps": 2,
        "ms": 0.007415605243295431,
        "min_ms": 0.007415605243295431,
        "max_ms": 0.007415605243295431,
        "compile_time": 0.42627620697021484
    },
    {
        "BLOCK_SIZE_M": 64,
        "BLOCK_SIZE_N": 64,
        "BLOCK_SIZE_K": 256,
        "GROUP_SIZE_M": 8,
        "num_stages": 1,
        "num_warps": 4,
        "ms": 0.007419808767735958,
        "min_ms": 0.007419808767735958,
        "max_ms": 0.007419808767735958,
        "compile_time": 0.4764902591705322
    },
    {
        "BLOCK_SIZE_M": 32,
        "BLOCK_SIZE_N": 32,
        "BLOCK_SIZE_K": 32,
        "GROUP_SIZE_M": 8,
        "num_stages": 3,
        "num_warps": 4,
        "ms": 0.007427907083183527,
        "min_ms": 0.007427907083183527,
        "max_ms": 0.007427907083183527,
        "compile_time": 0.4051852226257324
    },
    {
        "BLOCK_SIZE_M": 64,
        "BLOCK_SIZE_N": 32,
        "BLOCK_SIZE_K": 128,
        "GROUP_SIZE_M": 8,
        "num_stages": 3,
        "num_warps": 4,
        "ms": 0.007438620086759329,
        "min_ms": 0.007438620086759329,
        "max_ms": 0.007438620086759329,
        "compile_time": 0.47684454917907715
    },
    {
        "BLOCK_SIZE_M": 64,
        "BLOCK_SIZE_N": 64,
        "BLOCK_SIZE_K": 128,
        "GROUP_SIZE_M": 8,
        "num_stages": 1,
        "num_warps": 4,
        "ms": 0.007438776548951864,
        "min_ms": 0.007438776548951864,
        "max_ms": 0.007438776548951864,
        "compile_time": 0.479428768157959
    },
    {
        "BLOCK_SIZE_M": 32,
        "BLOCK_SIZE_N": 128,
        "BLOCK_SIZE_K": 128,
        "GROUP_SIZE_M": 8,
        "num_stages": 2,
        "num_warps": 4,
        "ms": 0.007449738681316376,
        "min_ms": 0.007449738681316376,
        "max_ms": 0.007449738681316376,
        "compile_time": 0.4340827465057373
    },
    {
        "BLOCK_SIZE_M": 128,
        "BLOCK_SIZE_N": 64,
        "BLOCK_SIZE_K": 64,
        "GROUP_SIZE_M": 8,
        "num_stages": 4,
        "num_warps": 8,
        "ms": 0.007461635861545801,
        "min_ms": 0.007461635861545801,
        "max_ms": 0.007461635861545801,
        "compile_time": 0.5191495418548584
    },
    {
        "BLOCK_SIZE_M": 64,
        "BLOCK_SIZE_N": 32,
        "BLOCK_SIZE_K": 64,
        "GROUP_SIZE_M": 8,
        "num_stages": 6,
        "num_warps": 4,
        "ms": 0.007462513633072376,
        "min_ms": 0.007462513633072376,
        "max_ms": 0.007462513633072376,
        "compile_time": 0.46587347984313965
    },
    {
        "BLOCK_SIZE_M": 32,
        "BLOCK_SIZE_N": 128,
        "BLOCK_SIZE_K": 256,
        "GROUP_SIZE_M": 8,
        "num_stages": 2,
        "num_warps": 4,
        "ms": 0.00746608292683959,
        "min_ms": 0.00746608292683959,
        "max_ms": 0.00746608292683959,
        "compile_time": 0.44969606399536133
    },
    {
        "BLOCK_SIZE_M": 128,
        "BLOCK_SIZE_N": 32,
        "BLOCK_SIZE_K": 32,
        "GROUP_SIZE_M": 8,
        "num_stages": 8,
        "num_warps": 8,
        "ms": 0.00746772438287735,
        "min_ms": 0.00746772438287735,
        "max_ms": 0.00746772438287735,
        "compile_time": 0.504063606262207
    },
    {
        "BLOCK_SIZE_M": 32,
        "BLOCK_SIZE_N": 64,
        "BLOCK_SIZE_K": 64,
        "GROUP_SIZE_M": 8,
        "num_stages": 3,
        "num_warps": 8,
        "ms": 0.0074703083373606205,
        "min_ms": 0.0074703083373606205,
        "max_ms": 0.0074703083373606205,
        "compile_time": 0.42731189727783203
    },
    {
        "BLOCK_SIZE_M": 64,
        "BLOCK_SIZE_N": 64,
        "BLOCK_SIZE_K": 128,
        "GROUP_SIZE_M": 8,
        "num_stages": 4,
        "num_warps": 16,
        "ms": 0.0074747963808476925,
        "min_ms": 0.0074747963808476925,
        "max_ms": 0.0074747963808476925,
        "compile_time": 0.4708864688873291
    },
    {
        "BLOCK_SIZE_M": 64,
        "BLOCK_SIZE_N": 64,
        "BLOCK_SIZE_K": 64,
        "GROUP_SIZE_M": 8,
        "num_stages": 4,
        "num_warps": 16,
        "ms": 0.007478424347937107,
        "min_ms": 0.007478424347937107,
        "max_ms": 0.007478424347937107,
        "compile_time": 0.4762098789215088
    },
    {
        "BLOCK_SIZE_M": 32,
        "BLOCK_SIZE_N": 32,
        "BLOCK_SIZE_K": 64,
        "GROUP_SIZE_M": 8,
        "num_stages": 2,
        "num_warps": 2,
        "ms": 0.007485996000468731,
        "min_ms": 0.007485996000468731,
        "max_ms": 0.007485996000468731,
        "compile_time": 0.42836618423461914
    },
    {
        "BLOCK_SIZE_M": 32,
        "BLOCK_SIZE_N": 128,
        "BLOCK_SIZE_K": 256,
        "GROUP_SIZE_M": 8,
        "num_stages": 3,
        "num_warps": 8,
        "ms": 0.007490432355552912,
        "min_ms": 0.007490432355552912,
        "max_ms": 0.007490432355552912,
        "compile_time": 0.43702054023742676
    },
    {
        "BLOCK_SIZE_M": 32,
        "BLOCK_SIZE_N": 64,
        "BLOCK_SIZE_K": 64,
        "GROUP_SIZE_M": 8,
        "num_stages": 7,
        "num_warps": 4,
        "ms": 0.007494796998798847,
        "min_ms": 0.007494796998798847,
        "max_ms": 0.007494796998798847,
        "compile_time": 0.42395877838134766
    },
    {
        "BLOCK_SIZE_M": 32,
        "BLOCK_SIZE_N": 32,
        "BLOCK_SIZE_K": 64,
        "GROUP_SIZE_M": 8,
        "num_stages": 5,
        "num_warps": 4,
        "ms": 0.00749989366158843,
        "min_ms": 0.00749989366158843,
        "max_ms": 0.00749989366158843,
        "compile_time": 0.4173095226287842
    },
    {
        "BLOCK_SIZE_M": 64,
        "BLOCK_SIZE_N": 32,
        "BLOCK_SIZE_K": 64,
        "GROUP_SIZE_M": 8,
        "num_stages": 2,
        "num_warps": 4,
        "ms": 0.007508018519729376,
        "min_ms": 0.007508018519729376,
        "max_ms": 0.007508018519729376,
        "compile_time": 0.4561192989349365
    },
    {
        "BLOCK_SIZE_M": 32,
        "BLOCK_SIZE_N": 64,
        "BLOCK_SIZE_K": 128,
        "GROUP_SIZE_M": 8,
        "num_stages": 2,
        "num_warps": 2,
        "ms": 0.007510533090680838,
        "min_ms": 0.007510533090680838,
        "max_ms": 0.007510533090680838,
        "compile_time": 0.4324336051940918
    },
    {
        "BLOCK_SIZE_M": 32,
        "BLOCK_SIZE_N": 256,
        "BLOCK_SIZE_K": 64,
        "GROUP_SIZE_M": 8,
        "num_stages": 3,
        "num_warps": 4,
        "ms": 0.007512756623327732,
        "min_ms": 0.007512756623327732,
        "max_ms": 0.007512756623327732,
        "compile_time": 0.4401276111602783
    },
    {
        "BLOCK_SIZE_M": 32,
        "BLOCK_SIZE_N": 32,
        "BLOCK_SIZE_K": 64,
        "GROUP_SIZE_M": 8,
        "num_stages": 2,
        "num_warps": 4,
        "ms": 0.007519339676946402,
        "min_ms": 0.007519339676946402,
        "max_ms": 0.007519339676946402,
        "compile_time": 0.421234130859375
    },
    {
        "BLOCK_SIZE_M": 32,
        "BLOCK_SIZE_N": 64,
        "BLOCK_SIZE_K": 64,
        "GROUP_SIZE_M": 8,
        "num_stages": 6,
        "num_warps": 2,
        "ms": 0.007522102445363998,
        "min_ms": 0.007522102445363998,
        "max_ms": 0.007522102445363998,
        "compile_time": 0.421893835067749
    },
    {
        "BLOCK_SIZE_M": 64,
        "BLOCK_SIZE_N": 128,
        "BLOCK_SIZE_K": 64,
        "GROUP_SIZE_M": 8,
        "num_stages": 3,
        "num_warps": 8,
        "ms": 0.007525899447500706,
        "min_ms": 0.007525899447500706,
        "max_ms": 0.007525899447500706,
        "compile_time": 0.48319363594055176
    },
    {
        "BLOCK_SIZE_M": 32,
        "BLOCK_SIZE_N": 32,
        "BLOCK_SIZE_K": 32,
        "GROUP_SIZE_M": 8,
        "num_stages": 8,
        "num_warps": 2,
        "ms": 0.007527217268943787,
        "min_ms": 0.007527217268943787,
        "max_ms": 0.007527217268943787,
        "compile_time": 0.4271726608276367
    },
    {
        "BLOCK_SIZE_M": 64,
        "BLOCK_SIZE_N": 64,
        "BLOCK_SIZE_K": 128,
        "GROUP_SIZE_M": 8,
        "num_stages": 3,
        "num_warps": 16,
        "ms": 0.007529895752668381,
        "min_ms": 0.007529895752668381,
        "max_ms": 0.007529895752668381,
        "compile_time": 0.4658987522125244
    },
    {
        "BLOCK_SIZE_M": 128,
        "BLOCK_SIZE_N": 64,
        "BLOCK_SIZE_K": 64,
        "GROUP_SIZE_M": 8,
        "num_stages": 3,
        "num_warps": 8,
        "ms": 0.00753001356497407,
        "min_ms": 0.00753001356497407,
        "max_ms": 0.00753001356497407,
        "compile_time": 0.5186185836791992
    },
    {
        "BLOCK_SIZE_M": 32,
        "BLOCK_SIZE_N": 64,
        "BLOCK_SIZE_K": 64,
        "GROUP_SIZE_M": 8,
        "num_stages": 7,
        "num_warps": 2,
        "ms": 0.007536524441093206,
        "min_ms": 0.007536524441093206,
        "max_ms": 0.007536524441093206,
        "compile_time": 0.42455577850341797
    },
    {
        "BLOCK_SIZE_M": 32,
        "BLOCK_SIZE_N": 32,
        "BLOCK_SIZE_K": 32,
        "GROUP_SIZE_M": 8,
        "num_stages": 6,
        "num_warps": 4,
        "ms": 0.007539177779108286,
        "min_ms": 0.007539177779108286,
        "max_ms": 0.007539177779108286,
        "compile_time": 0.41178154945373535
    },
    {
        "BLOCK_SIZE_M": 64,
        "BLOCK_SIZE_N": 64,
        "BLOCK_SIZE_K": 64,
        "GROUP_SIZE_M": 8,
        "num_stages": 6,
        "num_warps": 16,
        "ms": 0.007539828773587942,
        "min_ms": 0.007539828773587942,
        "max_ms": 0.007539828773587942,
        "compile_time": 0.48613882064819336
    },
    {
        "BLOCK_SIZE_M": 64,
        "BLOCK_SIZE_N": 64,
        "BLOCK_SIZE_K": 128,
        "GROUP_SIZE_M": 8,
        "num_stages": 3,
        "num_warps": 2,
        "ms": 0.0075724078342318535,
        "min_ms": 0.0075724078342318535,
        "max_ms": 0.0075724078342318535,
        "compile_time": 0.4704582691192627
    },
    {
        "BLOCK_SIZE_M": 32,
        "BLOCK_SIZE_N": 64,
        "BLOCK_SIZE_K": 64,
        "GROUP_SIZE_M": 8,
        "num_stages": 2,
        "num_warps": 4,
        "ms": 0.0076001412235200405,
        "min_ms": 0.0076001412235200405,
        "max_ms": 0.0076001412235200405,
        "compile_time": 0.42639827728271484
    },
    {
        "BLOCK_SIZE_M": 32,
        "BLOCK_SIZE_N": 256,
        "BLOCK_SIZE_K": 64,
        "GROUP_SIZE_M": 8,
        "num_stages": 4,
        "num_warps": 4,
        "ms": 0.0076023549772799015,
        "min_ms": 0.0076023549772799015,
        "max_ms": 0.0076023549772799015,
        "compile_time": 0.4526247978210449
    },
    {
        "BLOCK_SIZE_M": 128,
        "BLOCK_SIZE_N": 64,
        "BLOCK_SIZE_K": 64,
        "GROUP_SIZE_M": 8,
        "num_stages": 6,
        "num_warps": 8,
        "ms": 0.007611242588609457,
        "min_ms": 0.007611242588609457,
        "max_ms": 0.007611242588609457,
        "compile_time": 0.5175955295562744
    },
    {
        "BLOCK_SIZE_M": 128,
        "BLOCK_SIZE_N": 64,
        "BLOCK_SIZE_K": 64,
        "GROUP_SIZE_M": 8,
        "num_stages": 5,
        "num_warps": 8,
        "ms": 0.0076193674467504025,
        "min_ms": 0.0076193674467504025,
        "max_ms": 0.0076193674467504025,
        "compile_time": 0.5156130790710449
    },
    {
        "BLOCK_SIZE_M": 64,
        "BLOCK_SIZE_N": 32,
        "BLOCK_SIZE_K": 64,
        "GROUP_SIZE_M": 8,
        "num_stages": 3,
        "num_warps": 8,
        "ms": 0.007622719742357731,
        "min_ms": 0.007622719742357731,
        "max_ms": 0.007622719742357731,
        "compile_time": 0.45972728729248047
    },
    {
        "BLOCK_SIZE_M": 64,
        "BLOCK_SIZE_N": 64,
        "BLOCK_SIZE_K": 128,
        "GROUP_SIZE_M": 8,
        "num_stages": 2,
        "num_warps": 8,
        "ms": 0.007625255733728409,
        "min_ms": 0.007625255733728409,
        "max_ms": 0.007625255733728409,
        "compile_time": 0.48259401321411133
    },
    {
        "BLOCK_SIZE_M": 64,
        "BLOCK_SIZE_N": 64,
        "BLOCK_SIZE_K": 128,
        "GROUP_SIZE_M": 8,
        "num_stages": 5,
        "num_warps": 2,
        "ms": 0.007629253901541233,
        "min_ms": 0.007629253901541233,
        "max_ms": 0.007629253901541233,
        "compile_time": 0.4778149127960205
    },
    {
        "BLOCK_SIZE_M": 32,
        "BLOCK_SIZE_N": 32,
        "BLOCK_SIZE_K": 128,
        "GROUP_SIZE_M": 8,
        "num_stages": 2,
        "num_warps": 2,
        "ms": 0.0076313018798828125,
        "min_ms": 0.0076313018798828125,
        "max_ms": 0.0076313018798828125,
        "compile_time": 0.4222426414489746
    },
    {
        "BLOCK_SIZE_M": 64,
        "BLOCK_SIZE_N": 128,
        "BLOCK_SIZE_K": 64,
        "GROUP_SIZE_M": 8,
        "num_stages": 5,
        "num_warps": 8,
        "ms": 0.0076321749947965145,
        "min_ms": 0.0076321749947965145,
        "max_ms": 0.0076321749947965145,
        "compile_time": 0.4808211326599121
    },
    {
        "BLOCK_SIZE_M": 32,
        "BLOCK_SIZE_N": 64,
        "BLOCK_SIZE_K": 64,
        "GROUP_SIZE_M": 8,
        "num_stages": 4,
        "num_warps": 8,
        "ms": 0.0076363892294466496,
        "min_ms": 0.0076363892294466496,
        "max_ms": 0.0076363892294466496,
        "compile_time": 0.43027544021606445
    },
    {
        "BLOCK_SIZE_M": 64,
        "BLOCK_SIZE_N": 64,
        "BLOCK_SIZE_K": 256,
        "GROUP_SIZE_M": 8,
        "num_stages": 2,
        "num_warps": 8,
        "ms": 0.007641146890819073,
        "min_ms": 0.007641146890819073,
        "max_ms": 0.007641146890819073,
        "compile_time": 0.4910132884979248
    },
    {
        "BLOCK_SIZE_M": 64,
        "BLOCK_SIZE_N": 32,
        "BLOCK_SIZE_K": 32,
        "GROUP_SIZE_M": 8,
        "num_stages": 8,
        "num_warps": 4,
        "ms": 0.007651002146303654,
        "min_ms": 0.007651002146303654,
        "max_ms": 0.007651002146303654,
        "compile_time": 0.467578649520874
    },
    {
        "BLOCK_SIZE_M": 32,
        "BLOCK_SIZE_N": 32,
        "BLOCK_SIZE_K": 128,
        "GROUP_SIZE_M": 8,
        "num_stages": 2,
        "num_warps": 4,
        "ms": 0.007656211964786053,
        "min_ms": 0.007656211964786053,
        "max_ms": 0.007656211964786053,
        "compile_time": 0.41847753524780273
    },
    {
        "BLOCK_SIZE_M": 64,
        "BLOCK_SIZE_N": 64,
        "BLOCK_SIZE_K": 64,
        "GROUP_SIZE_M": 8,
        "num_stages": 7,
        "num_warps": 16,
        "ms": 0.007667603902518749,
        "min_ms": 0.007667603902518749,
        "max_ms": 0.007667603902518749,
        "compile_time": 0.46974992752075195
    },
    {
        "BLOCK_SIZE_M": 16,
        "BLOCK_SIZE_N": 64,
        "BLOCK_SIZE_K": 64,
        "GROUP_SIZE_M": 8,
        "num_stages": 5,
        "num_warps": 2,
        "ms": 0.007676714565604925,
        "min_ms": 0.007676714565604925,
        "max_ms": 0.007676714565604925,
        "compile_time": 0.37241363525390625
    },
    {
        "BLOCK_SIZE_M": 32,
        "BLOCK_SIZE_N": 256,
        "BLOCK_SIZE_K": 32,
        "GROUP_SIZE_M": 8,
        "num_stages": 3,
        "num_warps": 4,
        "ms": 0.007694249507039785,
        "min_ms": 0.007694249507039785,
        "max_ms": 0.007694249507039785,
        "compile_time": 0.4414799213409424
    },
    {
        "BLOCK_SIZE_M": 64,
        "BLOCK_SIZE_N": 64,
        "BLOCK_SIZE_K": 128,
        "GROUP_SIZE_M": 8,
        "num_stages": 1,
        "num_warps": 8,
        "ms": 0.007701569702476263,
        "min_ms": 0.007701569702476263,
        "max_ms": 0.007701569702476263,
        "compile_time": 0.48304319381713867
    },
    {
        "BLOCK_SIZE_M": 64,
        "BLOCK_SIZE_N": 128,
        "BLOCK_SIZE_K": 64,
        "GROUP_SIZE_M": 8,
        "num_stages": 6,
        "num_warps": 8,
        "ms": 0.007709364406764507,
        "min_ms": 0.007709364406764507,
        "max_ms": 0.007709364406764507,
        "compile_time": 0.47948575019836426
    },
    {
        "BLOCK_SIZE_M": 32,
        "BLOCK_SIZE_N": 128,
        "BLOCK_SIZE_K": 128,
        "GROUP_SIZE_M": 8,
        "num_stages": 3,
        "num_warps": 16,
        "ms": 0.007715356536209583,
        "min_ms": 0.007715356536209583,
        "max_ms": 0.007715356536209583,
        "compile_time": 0.4395313262939453
    },
    {
        "BLOCK_SIZE_M": 256,
        "BLOCK_SIZE_N": 32,
        "BLOCK_SIZE_K": 64,
        "GROUP_SIZE_M": 8,
        "num_stages": 3,
        "num_warps": 4,
        "ms": 0.007716021034866571,
        "min_ms": 0.007716021034866571,
        "max_ms": 0.007716021034866571,
        "compile_time": 0.5376169681549072
    },
    {
        "BLOCK_SIZE_M": 256,
        "BLOCK_SIZE_N": 32,
        "BLOCK_SIZE_K": 64,
        "GROUP_SIZE_M": 8,
        "num_stages": 4,
        "num_warps": 4,
        "ms": 0.007718636188656092,
        "min_ms": 0.007718636188656092,
        "max_ms": 0.007718636188656092,
        "compile_time": 0.522036075592041
    },
    {
        "BLOCK_SIZE_M": 64,
        "BLOCK_SIZE_N": 64,
        "BLOCK_SIZE_K": 128,
        "GROUP_SIZE_M": 8,
        "num_stages": 5,
        "num_warps": 16,
        "ms": 0.007720671594142914,
        "min_ms": 0.007720671594142914,
        "max_ms": 0.007720671594142914,
        "compile_time": 0.48151469230651855
    },
    {
        "BLOCK_SIZE_M": 64,
        "BLOCK_SIZE_N": 64,
        "BLOCK_SIZE_K": 128,
        "GROUP_SIZE_M": 8,
        "num_stages": 4,
        "num_warps": 2,
        "ms": 0.0077216848731040955,
        "min_ms": 0.0077216848731040955,
        "max_ms": 0.0077216848731040955,
        "compile_time": 0.479198694229126
    },
    {
        "BLOCK_SIZE_M": 64,
        "BLOCK_SIZE_N": 128,
        "BLOCK_SIZE_K": 64,
        "GROUP_SIZE_M": 8,
        "num_stages": 4,
        "num_warps": 8,
        "ms": 0.007730708923190832,
        "min_ms": 0.007730708923190832,
        "max_ms": 0.007730708923190832,
        "compile_time": 0.48061370849609375
    },
    {
        "BLOCK_SIZE_M": 256,
        "BLOCK_SIZE_N": 16,
        "BLOCK_SIZE_K": 64,
        "GROUP_SIZE_M": 8,
        "num_stages": 4,
        "num_warps": 4,
        "ms": 0.007732043974101543,
        "min_ms": 0.007732043974101543,
        "max_ms": 0.007732043974101543,
        "compile_time": 0.48134756088256836
    },
    {
        "BLOCK_SIZE_M": 32,
        "BLOCK_SIZE_N": 32,
        "BLOCK_SIZE_K": 128,
        "GROUP_SIZE_M": 8,
        "num_stages": 4,
        "num_warps": 2,
        "ms": 0.0077323331497609615,
        "min_ms": 0.0077323331497609615,
        "max_ms": 0.0077323331497609615,
        "compile_time": 0.42096662521362305
    },
    {
        "BLOCK_SIZE_M": 32,
        "BLOCK_SIZE_N": 64,
        "BLOCK_SIZE_K": 128,
        "GROUP_SIZE_M": 8,
        "num_stages": 4,
        "num_warps": 4,
        "ms": 0.007735556457191706,
        "min_ms": 0.007735556457191706,
        "max_ms": 0.007735556457191706,
        "compile_time": 0.4259951114654541
    },
    {
        "BLOCK_SIZE_M": 128,
        "BLOCK_SIZE_N": 32,
        "BLOCK_SIZE_K": 128,
        "GROUP_SIZE_M": 8,
        "num_stages": 2,
        "num_warps": 4,
        "ms": 0.007735988590866327,
        "min_ms": 0.007735988590866327,
        "max_ms": 0.007735988590866327,
        "compile_time": 0.5066466331481934
    },
    {
        "BLOCK_SIZE_M": 16,
        "BLOCK_SIZE_N": 64,
        "BLOCK_SIZE_K": 64,
        "GROUP_SIZE_M": 8,
        "num_stages": 3,
        "num_warps": 2,
        "ms": 0.007739528082311153,
        "min_ms": 0.007739528082311153,
        "max_ms": 0.007739528082311153,
        "compile_time": 0.3345909118652344
    },
    {
        "BLOCK_SIZE_M": 64,
        "BLOCK_SIZE_N": 128,
        "BLOCK_SIZE_K": 128,
        "GROUP_SIZE_M": 8,
        "num_stages": 3,
        "num_warps": 4,
        "ms": 0.007749550044536591,
        "min_ms": 0.007749550044536591,
        "max_ms": 0.007749550044536591,
        "compile_time": 0.4855678081512451
    },
    {
        "BLOCK_SIZE_M": 64,
        "BLOCK_SIZE_N": 32,
        "BLOCK_SIZE_K": 128,
        "GROUP_SIZE_M": 8,
        "num_stages": 4,
        "num_warps": 4,
        "ms": 0.007750456687062979,
        "min_ms": 0.007750456687062979,
        "max_ms": 0.007750456687062979,
        "compile_time": 0.47013139724731445
    },
    {
        "BLOCK_SIZE_M": 128,
        "BLOCK_SIZE_N": 64,
        "BLOCK_SIZE_K": 128,
        "GROUP_SIZE_M": 8,
        "num_stages": 3,
        "num_warps": 4,
        "ms": 0.0077581703662872314,
        "min_ms": 0.0077581703662872314,
        "max_ms": 0.0077581703662872314,
        "compile_time": 0.5338578224182129
    },
    {
        "BLOCK_SIZE_M": 64,
        "BLOCK_SIZE_N": 128,
        "BLOCK_SIZE_K": 32,
        "GROUP_SIZE_M": 8,
        "num_stages": 4,
        "num_warps": 8,
        "ms": 0.007763315923511982,
        "min_ms": 0.007763315923511982,
        "max_ms": 0.007763315923511982,
        "compile_time": 0.4913206100463867
    },
    {
        "BLOCK_SIZE_M": 32,
        "BLOCK_SIZE_N": 64,
        "BLOCK_SIZE_K": 128,
        "GROUP_SIZE_M": 8,
        "num_stages": 3,
        "num_warps": 8,
        "ms": 0.0077710747718811035,
        "min_ms": 0.0077710747718811035,
        "max_ms": 0.0077710747718811035,
        "compile_time": 0.44610047340393066
    },
    {
        "BLOCK_SIZE_M": 64,
        "BLOCK_SIZE_N": 64,
        "BLOCK_SIZE_K": 128,
        "GROUP_SIZE_M": 8,
        "num_stages": 6,
        "num_warps": 2,
        "ms": 0.007777207996696234,
        "min_ms": 0.007777207996696234,
        "max_ms": 0.007777207996696234,
        "compile_time": 0.47640514373779297
    },
    {
        "BLOCK_SIZE_M": 64,
        "BLOCK_SIZE_N": 32,
        "BLOCK_SIZE_K": 64,
        "GROUP_SIZE_M": 8,
        "num_stages": 7,
        "num_warps": 2,
        "ms": 0.007791235111653805,
        "min_ms": 0.007791235111653805,
        "max_ms": 0.007791235111653805,
        "compile_time": 0.4714672565460205
    },
    {
        "BLOCK_SIZE_M": 128,
        "BLOCK_SIZE_N": 32,
        "BLOCK_SIZE_K": 256,
        "GROUP_SIZE_M": 8,
        "num_stages": 3,
        "num_warps": 8,
        "ms": 0.0077913738787174225,
        "min_ms": 0.0077913738787174225,
        "max_ms": 0.0077913738787174225,
        "compile_time": 0.47236180305480957
    },
    {
        "BLOCK_SIZE_M": 128,
        "BLOCK_SIZE_N": 64,
        "BLOCK_SIZE_K": 32,
        "GROUP_SIZE_M": 8,
        "num_stages": 4,
        "num_warps": 8,
        "ms": 0.007791575975716114,
        "min_ms": 0.007791575975716114,
        "max_ms": 0.007791575975716114,
        "compile_time": 0.5192246437072754
    },
    {
        "BLOCK_SIZE_M": 32,
        "BLOCK_SIZE_N": 32,
        "BLOCK_SIZE_K": 64,
        "GROUP_SIZE_M": 8,
        "num_stages": 7,
        "num_warps": 2,
        "ms": 0.007797463797032833,
        "min_ms": 0.007797463797032833,
        "max_ms": 0.007797463797032833,
        "compile_time": 0.4108297824859619
    },
    {
        "BLOCK_SIZE_M": 128,
        "BLOCK_SIZE_N": 64,
        "BLOCK_SIZE_K": 64,
        "GROUP_SIZE_M": 8,
        "num_stages": 7,
        "num_warps": 8,
        "ms": 0.0078016482293605804,
        "min_ms": 0.0078016482293605804,
        "max_ms": 0.0078016482293605804,
        "compile_time": 0.5122191905975342
    },
    {
        "BLOCK_SIZE_M": 32,
        "BLOCK_SIZE_N": 256,
        "BLOCK_SIZE_K": 32,
        "GROUP_SIZE_M": 8,
        "num_stages": 5,
        "num_warps": 4,
        "ms": 0.007805360946804285,
        "min_ms": 0.007805360946804285,
        "max_ms": 0.007805360946804285,
        "compile_time": 0.44333600997924805
    },
    {
        "BLOCK_SIZE_M": 32,
        "BLOCK_SIZE_N": 256,
        "BLOCK_SIZE_K": 32,
        "GROUP_SIZE_M": 8,
        "num_stages": 4,
        "num_warps": 4,
        "ms": 0.007805833127349615,
        "min_ms": 0.007805833127349615,
        "max_ms": 0.007805833127349615,
        "compile_time": 0.4363749027252197
    },
    {
        "BLOCK_SIZE_M": 64,
        "BLOCK_SIZE_N": 32,
        "BLOCK_SIZE_K": 64,
        "GROUP_SIZE_M": 8,
        "num_stages": 2,
        "num_warps": 8,
        "ms": 0.007806017063558102,
        "min_ms": 0.007806017063558102,
        "max_ms": 0.007806017063558102,
        "compile_time": 0.4626631736755371
    },
    {
        "BLOCK_SIZE_M": 256,
        "BLOCK_SIZE_N": 16,
        "BLOCK_SIZE_K": 64,
        "GROUP_SIZE_M": 8,
        "num_stages": 3,
        "num_warps": 4,
        "ms": 0.007806252688169479,
        "min_ms": 0.007806252688169479,
        "max_ms": 0.007806252688169479,
        "compile_time": 0.5234370231628418
    },
    {
        "BLOCK_SIZE_M": 64,
        "BLOCK_SIZE_N": 64,
        "BLOCK_SIZE_K": 16,
        "GROUP_SIZE_M": 8,
        "num_stages": 4,
        "num_warps": 4,
        "ms": 0.007812860421836376,
        "min_ms": 0.007812860421836376,
        "max_ms": 0.007812860421836376,
        "compile_time": 0.475799560546875
    },
    {
        "BLOCK_SIZE_M": 128,
        "BLOCK_SIZE_N": 64,
        "BLOCK_SIZE_K": 128,
        "GROUP_SIZE_M": 8,
        "num_stages": 4,
        "num_warps": 4,
        "ms": 0.007814706303179264,
        "min_ms": 0.007814706303179264,
        "max_ms": 0.007814706303179264,
        "compile_time": 0.5212075710296631
    },
    {
        "BLOCK_SIZE_M": 128,
        "BLOCK_SIZE_N": 64,
        "BLOCK_SIZE_K": 32,
        "GROUP_SIZE_M": 8,
        "num_stages": 3,
        "num_warps": 8,
        "ms": 0.007820980623364449,
        "min_ms": 0.007820980623364449,
        "max_ms": 0.007820980623364449,
        "compile_time": 0.5255918502807617
    },
    {
        "BLOCK_SIZE_M": 64,
        "BLOCK_SIZE_N": 128,
        "BLOCK_SIZE_K": 32,
        "GROUP_SIZE_M": 8,
        "num_stages": 3,
        "num_warps": 8,
        "ms": 0.007827874273061752,
        "min_ms": 0.007827874273061752,
        "max_ms": 0.007827874273061752,
        "compile_time": 0.4891805648803711
    },
    {
        "BLOCK_SIZE_M": 64,
        "BLOCK_SIZE_N": 64,
        "BLOCK_SIZE_K": 16,
        "GROUP_SIZE_M": 8,
        "num_stages": 6,
        "num_warps": 4,
        "ms": 0.007829541340470314,
        "min_ms": 0.007829541340470314,
        "max_ms": 0.007829541340470314,
        "compile_time": 0.4829714298248291
    },
    {
        "BLOCK_SIZE_M": 32,
        "BLOCK_SIZE_N": 64,
        "BLOCK_SIZE_K": 64,
        "GROUP_SIZE_M": 8,
        "num_stages": 2,
        "num_warps": 8,
        "ms": 0.007832655683159828,
        "min_ms": 0.007832655683159828,
        "max_ms": 0.007832655683159828,
        "compile_time": 0.44391870498657227
    },
    {
        "BLOCK_SIZE_M": 64,
        "BLOCK_SIZE_N": 128,
        "BLOCK_SIZE_K": 32,
        "GROUP_SIZE_M": 8,
        "num_stages": 6,
        "num_warps": 8,
        "ms": 0.007832862436771393,
        "min_ms": 0.007832862436771393,
        "max_ms": 0.007832862436771393,
        "compile_time": 0.42699670791625977
    },
    {
        "BLOCK_SIZE_M": 32,
        "BLOCK_SIZE_N": 128,
        "BLOCK_SIZE_K": 32,
        "GROUP_SIZE_M": 8,
        "num_stages": 3,
        "num_warps": 2,
        "ms": 0.007838040590286255,
        "min_ms": 0.007838040590286255,
        "max_ms": 0.007838040590286255,
        "compile_time": 0.4470078945159912
    },
    {
        "BLOCK_SIZE_M": 16,
        "BLOCK_SIZE_N": 64,
        "BLOCK_SIZE_K": 32,
        "GROUP_SIZE_M": 8,
        "num_stages": 7,
        "num_warps": 2,
        "ms": 0.007838244549930096,
        "min_ms": 0.007838244549930096,
        "max_ms": 0.007838244549930096,
        "compile_time": 0.3728601932525635
    },
    {
        "BLOCK_SIZE_M": 64,
        "BLOCK_SIZE_N": 64,
        "BLOCK_SIZE_K": 16,
        "GROUP_SIZE_M": 8,
        "num_stages": 5,
        "num_warps": 4,
        "ms": 0.007846331223845482,
        "min_ms": 0.007846331223845482,
        "max_ms": 0.007846331223845482,
        "compile_time": 0.48320436477661133
    },
    {
        "BLOCK_SIZE_M": 256,
        "BLOCK_SIZE_N": 32,
        "BLOCK_SIZE_K": 64,
        "GROUP_SIZE_M": 8,
        "num_stages": 5,
        "num_warps": 4,
        "ms": 0.007847821339964867,
        "min_ms": 0.007847821339964867,
        "max_ms": 0.007847821339964867,
        "compile_time": 0.5351967811584473
    },
    {
        "BLOCK_SIZE_M": 64,
        "BLOCK_SIZE_N": 32,
        "BLOCK_SIZE_K": 128,
        "GROUP_SIZE_M": 8,
        "num_stages": 3,
        "num_warps": 8,
        "ms": 0.007853779941797256,
        "min_ms": 0.007853779941797256,
        "max_ms": 0.007853779941797256,
        "compile_time": 0.4788937568664551
    },
    {
        "BLOCK_SIZE_M": 32,
        "BLOCK_SIZE_N": 32,
        "BLOCK_SIZE_K": 256,
        "GROUP_SIZE_M": 8,
        "num_stages": 2,
        "num_warps": 4,
        "ms": 0.007854779250919819,
        "min_ms": 0.007854779250919819,
        "max_ms": 0.007854779250919819,
        "compile_time": 0.41930294036865234
    },
    {
        "BLOCK_SIZE_M": 32,
        "BLOCK_SIZE_N": 32,
        "BLOCK_SIZE_K": 32,
        "GROUP_SIZE_M": 8,
        "num_stages": 7,
        "num_warps": 4,
        "ms": 0.00785591546446085,
        "min_ms": 0.00785591546446085,
        "max_ms": 0.00785591546446085,
        "compile_time": 0.4230492115020752
    },
    {
        "BLOCK_SIZE_M": 64,
        "BLOCK_SIZE_N": 16,
        "BLOCK_SIZE_K": 64,
        "GROUP_SIZE_M": 8,
        "num_stages": 3,
        "num_warps": 2,
        "ms": 0.00785852037370205,
        "min_ms": 0.00785852037370205,
        "max_ms": 0.00785852037370205,
        "compile_time": 0.4759492874145508
    },
    {
        "BLOCK_SIZE_M": 32,
        "BLOCK_SIZE_N": 128,
        "BLOCK_SIZE_K": 128,
        "GROUP_SIZE_M": 8,
        "num_stages": 4,
        "num_warps": 16,
        "ms": 0.007877221331000328,
        "min_ms": 0.007877221331000328,
        "max_ms": 0.007877221331000328,
        "compile_time": 0.43901801109313965
    },
    {
        "BLOCK_SIZE_M": 64,
        "BLOCK_SIZE_N": 64,
        "BLOCK_SIZE_K": 64,
        "GROUP_SIZE_M": 8,
        "num_stages": 8,
        "num_warps": 16,
        "ms": 0.007882687263190746,
        "min_ms": 0.007882687263190746,
        "max_ms": 0.007882687263190746,
        "compile_time": 0.4866969585418701
    },
    {
        "BLOCK_SIZE_M": 16,
        "BLOCK_SIZE_N": 64,
        "BLOCK_SIZE_K": 32,
        "GROUP_SIZE_M": 8,
        "num_stages": 5,
        "num_warps": 2,
        "ms": 0.007890247739851475,
        "min_ms": 0.007890247739851475,
        "max_ms": 0.007890247739851475,
        "compile_time": 0.3794708251953125
    },
    {
        "BLOCK_SIZE_M": 64,
        "BLOCK_SIZE_N": 32,
        "BLOCK_SIZE_K": 128,
        "GROUP_SIZE_M": 8,
        "num_stages": 2,
        "num_warps": 8,
        "ms": 0.00789182260632515,
        "min_ms": 0.00789182260632515,
        "max_ms": 0.00789182260632515,
        "compile_time": 0.4734537601470947
    },
    {
        "BLOCK_SIZE_M": 64,
        "BLOCK_SIZE_N": 128,
        "BLOCK_SIZE_K": 32,
        "GROUP_SIZE_M": 8,
        "num_stages": 5,
        "num_warps": 8,
        "ms": 0.00789272878319025,
        "min_ms": 0.00789272878319025,
        "max_ms": 0.00789272878319025,
        "compile_time": 0.49538564682006836
    },
    {
        "BLOCK_SIZE_M": 32,
        "BLOCK_SIZE_N": 128,
        "BLOCK_SIZE_K": 64,
        "GROUP_SIZE_M": 8,
        "num_stages": 3,
        "num_warps": 16,
        "ms": 0.007894473150372505,
        "min_ms": 0.007894473150372505,
        "max_ms": 0.007894473150372505,
        "compile_time": 0.43943142890930176
    },
    {
        "BLOCK_SIZE_M": 64,
        "BLOCK_SIZE_N": 128,
        "BLOCK_SIZE_K": 128,
        "GROUP_SIZE_M": 8,
        "num_stages": 4,
        "num_warps": 4,
        "ms": 0.007895788177847862,
        "min_ms": 0.007895788177847862,
        "max_ms": 0.007895788177847862,
        "compile_time": 0.4876539707183838
    },
    {
        "BLOCK_SIZE_M": 128,
        "BLOCK_SIZE_N": 32,
        "BLOCK_SIZE_K": 256,
        "GROUP_SIZE_M": 8,
        "num_stages": 2,
        "num_warps": 4,
        "ms": 0.0078971479088068,
        "min_ms": 0.0078971479088068,
        "max_ms": 0.0078971479088068,
        "compile_time": 0.528613805770874
    },
    {
        "BLOCK_SIZE_M": 64,
        "BLOCK_SIZE_N": 128,
        "BLOCK_SIZE_K": 32,
        "GROUP_SIZE_M": 8,
        "num_stages": 7,
        "num_warps": 8,
        "ms": 0.007899164222180843,
        "min_ms": 0.007899164222180843,
        "max_ms": 0.007899164222180843,
        "compile_time": 0.48378562927246094
    },
    {
        "BLOCK_SIZE_M": 128,
        "BLOCK_SIZE_N": 32,
        "BLOCK_SIZE_K": 256,
        "GROUP_SIZE_M": 8,
        "num_stages": 3,
        "num_warps": 4,
        "ms": 0.00790412537753582,
        "min_ms": 0.00790412537753582,
        "max_ms": 0.00790412537753582,
        "compile_time": 0.5532677173614502
    },
    {
        "BLOCK_SIZE_M": 64,
        "BLOCK_SIZE_N": 128,
        "BLOCK_SIZE_K": 64,
        "GROUP_SIZE_M": 8,
        "num_stages": 7,
        "num_warps": 8,
        "ms": 0.007905520498752594,
        "min_ms": 0.007905520498752594,
        "max_ms": 0.007905520498752594,
        "compile_time": 0.4946129322052002
    },
    {
        "BLOCK_SIZE_M": 128,
        "BLOCK_SIZE_N": 64,
        "BLOCK_SIZE_K": 128,
        "GROUP_SIZE_M": 8,
        "num_stages": 3,
        "num_warps": 8,
        "ms": 0.007911928929388523,
        "min_ms": 0.007911928929388523,
        "max_ms": 0.007911928929388523,
        "compile_time": 0.5340077877044678
    },
    {
        "BLOCK_SIZE_M": 32,
        "BLOCK_SIZE_N": 128,
        "BLOCK_SIZE_K": 64,
        "GROUP_SIZE_M": 8,
        "num_stages": 2,
        "num_warps": 4,
        "ms": 0.007917932234704494,
        "min_ms": 0.007917932234704494,
        "max_ms": 0.007917932234704494,
        "compile_time": 0.44095683097839355
    },
    {
        "BLOCK_SIZE_M": 16,
        "BLOCK_SIZE_N": 64,
        "BLOCK_SIZE_K": 64,
        "GROUP_SIZE_M": 8,
        "num_stages": 3,
        "num_warps": 4,
        "ms": 0.007918497547507286,
        "min_ms": 0.007918497547507286,
        "max_ms": 0.007918497547507286,
        "compile_time": 0.3842470645904541
    },
    {
        "BLOCK_SIZE_M": 128,
        "BLOCK_SIZE_N": 64,
        "BLOCK_SIZE_K": 32,
        "GROUP_SIZE_M": 8,
        "num_stages": 5,
        "num_warps": 8,
        "ms": 0.007921086624264717,
        "min_ms": 0.007921086624264717,
        "max_ms": 0.007921086624264717,
        "compile_time": 0.5189695358276367
    },
    {
        "BLOCK_SIZE_M": 64,
        "BLOCK_SIZE_N": 64,
        "BLOCK_SIZE_K": 64,
        "GROUP_SIZE_M": 8,
        "num_stages": 2,
        "num_warps": 8,
        "ms": 0.007931102067232132,
        "min_ms": 0.007931102067232132,
        "max_ms": 0.007931102067232132,
        "compile_time": 0.46843647956848145
    },
    {
        "BLOCK_SIZE_M": 64,
        "BLOCK_SIZE_N": 32,
        "BLOCK_SIZE_K": 64,
        "GROUP_SIZE_M": 8,
        "num_stages": 4,
        "num_warps": 8,
        "ms": 0.007933778688311577,
        "min_ms": 0.007933778688311577,
        "max_ms": 0.007933778688311577,
        "compile_time": 0.4674198627471924
    },
    {
        "BLOCK_SIZE_M": 64,
        "BLOCK_SIZE_N": 64,
        "BLOCK_SIZE_K": 16,
        "GROUP_SIZE_M": 8,
        "num_stages": 7,
        "num_warps": 4,
        "ms": 0.00793503038585186,
        "min_ms": 0.00793503038585186,
        "max_ms": 0.00793503038585186,
        "compile_time": 0.47143030166625977
    },
    {
        "BLOCK_SIZE_M": 128,
        "BLOCK_SIZE_N": 64,
        "BLOCK_SIZE_K": 128,
        "GROUP_SIZE_M": 8,
        "num_stages": 4,
        "num_warps": 8,
        "ms": 0.00794981699436903,
        "min_ms": 0.00794981699436903,
        "max_ms": 0.00794981699436903,
        "compile_time": 0.5215640068054199
    },
    {
        "BLOCK_SIZE_M": 32,
        "BLOCK_SIZE_N": 256,
        "BLOCK_SIZE_K": 32,
        "GROUP_SIZE_M": 8,
        "num_stages": 6,
        "num_warps": 4,
        "ms": 0.007952878251671791,
        "min_ms": 0.007952878251671791,
        "max_ms": 0.007952878251671791,
        "compile_time": 0.4508180618286133
    },
    {
        "BLOCK_SIZE_M": 64,
        "BLOCK_SIZE_N": 64,
        "BLOCK_SIZE_K": 64,
        "GROUP_SIZE_M": 8,
        "num_stages": 2,
        "num_warps": 2,
        "ms": 0.007960793562233448,
        "min_ms": 0.007960793562233448,
        "max_ms": 0.007960793562233448,
        "compile_time": 0.475905179977417
    },
    {
        "BLOCK_SIZE_M": 64,
        "BLOCK_SIZE_N": 64,
        "BLOCK_SIZE_K": 256,
        "GROUP_SIZE_M": 8,
        "num_stages": 1,
        "num_warps": 8,
        "ms": 0.00797319132834673,
        "min_ms": 0.00797319132834673,
        "max_ms": 0.00797319132834673,
        "compile_time": 0.4880819320678711
    },
    {
        "BLOCK_SIZE_M": 64,
        "BLOCK_SIZE_N": 64,
        "BLOCK_SIZE_K": 16,
        "GROUP_SIZE_M": 8,
        "num_stages": 8,
        "num_warps": 4,
        "ms": 0.00797598622739315,
        "min_ms": 0.00797598622739315,
        "max_ms": 0.00797598622739315,
        "compile_time": 0.4862947463989258
    },
    {
        "BLOCK_SIZE_M": 128,
        "BLOCK_SIZE_N": 64,
        "BLOCK_SIZE_K": 32,
        "GROUP_SIZE_M": 8,
        "num_stages": 6,
        "num_warps": 8,
        "ms": 0.007977571338415146,
        "min_ms": 0.007977571338415146,
        "max_ms": 0.007977571338415146,
        "compile_time": 0.5246233940124512
    },
    {
        "BLOCK_SIZE_M": 64,
        "BLOCK_SIZE_N": 64,
        "BLOCK_SIZE_K": 128,
        "GROUP_SIZE_M": 8,
        "num_stages": 6,
        "num_warps": 16,
        "ms": 0.00797983817756176,
        "min_ms": 0.00797983817756176,
        "max_ms": 0.00797983817756176,
        "compile_time": 0.4845407009124756
    },
    {
        "BLOCK_SIZE_M": 32,
        "BLOCK_SIZE_N": 128,
        "BLOCK_SIZE_K": 64,
        "GROUP_SIZE_M": 8,
        "num_stages": 4,
        "num_warps": 16,
        "ms": 0.007987434975802898,
        "min_ms": 0.007987434975802898,
        "max_ms": 0.007987434975802898,
        "compile_time": 0.4312121868133545
    },
    {
        "BLOCK_SIZE_M": 32,
        "BLOCK_SIZE_N": 64,
        "BLOCK_SIZE_K": 64,
        "GROUP_SIZE_M": 8,
        "num_stages": 5,
        "num_warps": 8,
        "ms": 0.007990090176463127,
        "min_ms": 0.007990090176463127,
        "max_ms": 0.007990090176463127,
        "compile_time": 0.43581700325012207
    },
    {
        "BLOCK_SIZE_M": 32,
        "BLOCK_SIZE_N": 256,
        "BLOCK_SIZE_K": 64,
        "GROUP_SIZE_M": 8,
        "num_stages": 5,
        "num_warps": 4,
        "ms": 0.007991759106516838,
        "min_ms": 0.007991759106516838,
        "max_ms": 0.007991759106516838,
        "compile_time": 0.4559962749481201
    },
    {
        "BLOCK_SIZE_M": 128,
        "BLOCK_SIZE_N": 32,
        "BLOCK_SIZE_K": 64,
        "GROUP_SIZE_M": 8,
        "num_stages": 2,
        "num_warps": 4,
        "ms": 0.007996375672519207,
        "min_ms": 0.007996375672519207,
        "max_ms": 0.007996375672519207,
        "compile_time": 0.5131726264953613
    },
    {
        "BLOCK_SIZE_M": 64,
        "BLOCK_SIZE_N": 128,
        "BLOCK_SIZE_K": 32,
        "GROUP_SIZE_M": 8,
        "num_stages": 8,
        "num_warps": 8,
        "ms": 0.00799989141523838,
        "min_ms": 0.00799989141523838,
        "max_ms": 0.00799989141523838,
        "compile_time": 0.4857344627380371
    },
    {
        "BLOCK_SIZE_M": 64,
        "BLOCK_SIZE_N": 32,
        "BLOCK_SIZE_K": 128,
        "GROUP_SIZE_M": 8,
        "num_stages": 2,
        "num_warps": 2,
        "ms": 0.00800857413560152,
        "min_ms": 0.00800857413560152,
        "max_ms": 0.00800857413560152,
        "compile_time": 0.48511743545532227
    },
    {
        "BLOCK_SIZE_M": 16,
        "BLOCK_SIZE_N": 64,
        "BLOCK_SIZE_K": 32,
        "GROUP_SIZE_M": 8,
        "num_stages": 8,
        "num_warps": 2,
        "ms": 0.00801780167967081,
        "min_ms": 0.00801780167967081,
        "max_ms": 0.00801780167967081,
        "compile_time": 0.39147400856018066
    },
    {
        "BLOCK_SIZE_M": 256,
        "BLOCK_SIZE_N": 16,
        "BLOCK_SIZE_K": 64,
        "GROUP_SIZE_M": 8,
        "num_stages": 5,
        "num_warps": 4,
        "ms": 0.008026444353163242,
        "min_ms": 0.008026444353163242,
        "max_ms": 0.008026444353163242,
        "compile_time": 0.5276975631713867
    },
    {
        "BLOCK_SIZE_M": 64,
        "BLOCK_SIZE_N": 128,
        "BLOCK_SIZE_K": 128,
        "GROUP_SIZE_M": 8,
        "num_stages": 3,
        "num_warps": 8,
        "ms": 0.008026659488677979,
        "min_ms": 0.008026659488677979,
        "max_ms": 0.008026659488677979,
        "compile_time": 0.4868755340576172
    },
    {
        "BLOCK_SIZE_M": 32,
        "BLOCK_SIZE_N": 64,
        "BLOCK_SIZE_K": 128,
        "GROUP_SIZE_M": 8,
        "num_stages": 3,
        "num_warps": 2,
        "ms": 0.008044570684432983,
        "min_ms": 0.008044570684432983,
        "max_ms": 0.008044570684432983,
        "compile_time": 0.4398655891418457
    },
    {
        "BLOCK_SIZE_M": 32,
        "BLOCK_SIZE_N": 32,
        "BLOCK_SIZE_K": 64,
        "GROUP_SIZE_M": 8,
        "num_stages": 6,
        "num_warps": 4,
        "ms": 0.008045126684010029,
        "min_ms": 0.008045126684010029,
        "max_ms": 0.008045126684010029,
        "compile_time": 0.4360065460205078
    },
    {
        "BLOCK_SIZE_M": 16,
        "BLOCK_SIZE_N": 64,
        "BLOCK_SIZE_K": 64,
        "GROUP_SIZE_M": 8,
        "num_stages": 5,
        "num_warps": 4,
        "ms": 0.008045349270105362,
        "min_ms": 0.008045349270105362,
        "max_ms": 0.008045349270105362,
        "compile_time": 0.34711456298828125
    },
    {
        "BLOCK_SIZE_M": 64,
        "BLOCK_SIZE_N": 64,
        "BLOCK_SIZE_K": 512,
        "GROUP_SIZE_M": 8,
        "num_stages": 1,
        "num_warps": 8,
        "ms": 0.008062312379479408,
        "min_ms": 0.008062312379479408,
        "max_ms": 0.008062312379479408,
        "compile_time": 0.4841592311859131
    },
    {
        "BLOCK_SIZE_M": 64,
        "BLOCK_SIZE_N": 32,
        "BLOCK_SIZE_K": 64,
        "GROUP_SIZE_M": 8,
        "num_stages": 7,
        "num_warps": 4,
        "ms": 0.008065036498010159,
        "min_ms": 0.008065036498010159,
        "max_ms": 0.008065036498010159,
        "compile_time": 0.46062541007995605
    },
    {
        "BLOCK_SIZE_M": 16,
        "BLOCK_SIZE_N": 256,
        "BLOCK_SIZE_K": 32,
        "GROUP_SIZE_M": 8,
        "num_stages": 5,
        "num_warps": 4,
        "ms": 0.00806637853384018,
        "min_ms": 0.00806637853384018,
        "max_ms": 0.00806637853384018,
        "compile_time": 0.39633965492248535
    },
    {
        "BLOCK_SIZE_M": 32,
        "BLOCK_SIZE_N": 64,
        "BLOCK_SIZE_K": 128,
        "GROUP_SIZE_M": 8,
        "num_stages": 2,
        "num_warps": 8,
        "ms": 0.008075441233813763,
        "min_ms": 0.008075441233813763,
        "max_ms": 0.008075441233813763,
        "compile_time": 0.42741847038269043
    },
    {
        "BLOCK_SIZE_M": 128,
        "BLOCK_SIZE_N": 64,
        "BLOCK_SIZE_K": 32,
        "GROUP_SIZE_M": 8,
        "num_stages": 7,
        "num_warps": 8,
        "ms": 0.008075910620391369,
        "min_ms": 0.008075910620391369,
        "max_ms": 0.008075910620391369,
        "compile_time": 0.5204160213470459
    },
    {
        "BLOCK_SIZE_M": 16,
        "BLOCK_SIZE_N": 64,
        "BLOCK_SIZE_K": 32,
        "GROUP_SIZE_M": 8,
        "num_stages": 6,
        "num_warps": 2,
        "ms": 0.008079705759882927,
        "min_ms": 0.008079705759882927,
        "max_ms": 0.008079705759882927,
        "compile_time": 0.3819870948791504
    },
    {
        "BLOCK_SIZE_M": 32,
        "BLOCK_SIZE_N": 64,
        "BLOCK_SIZE_K": 128,
        "GROUP_SIZE_M": 8,
        "num_stages": 4,
        "num_warps": 2,
        "ms": 0.00807973463088274,
        "min_ms": 0.00807973463088274,
        "max_ms": 0.00807973463088274,
        "compile_time": 0.4341752529144287
    },
    {
        "BLOCK_SIZE_M": 32,
        "BLOCK_SIZE_N": 128,
        "BLOCK_SIZE_K": 64,
        "GROUP_SIZE_M": 8,
        "num_stages": 5,
        "num_warps": 16,
        "ms": 0.008086931891739368,
        "min_ms": 0.008086931891739368,
        "max_ms": 0.008086931891739368,
        "compile_time": 0.4444310665130615
    },
    {
        "BLOCK_SIZE_M": 16,
        "BLOCK_SIZE_N": 64,
        "BLOCK_SIZE_K": 64,
        "GROUP_SIZE_M": 8,
        "num_stages": 6,
        "num_warps": 2,
        "ms": 0.00809934176504612,
        "min_ms": 0.00809934176504612,
        "max_ms": 0.00809934176504612,
        "compile_time": 0.37990450859069824
    },
    {
        "BLOCK_SIZE_M": 64,
        "BLOCK_SIZE_N": 64,
        "BLOCK_SIZE_K": 512,
        "GROUP_SIZE_M": 8,
        "num_stages": 2,
        "num_warps": 8,
        "ms": 0.008100814186036587,
        "min_ms": 0.008100814186036587,
        "max_ms": 0.008100814186036587,
        "compile_time": 0.4997129440307617
    },
    {
        "BLOCK_SIZE_M": 256,
        "BLOCK_SIZE_N": 16,
        "BLOCK_SIZE_K": 32,
        "GROUP_SIZE_M": 8,
        "num_stages": 4,
        "num_warps": 4,
        "ms": 0.008115038275718689,
        "min_ms": 0.008115038275718689,
        "max_ms": 0.008115038275718689,
        "compile_time": 0.5269393920898438
    },
    {
        "BLOCK_SIZE_M": 16,
        "BLOCK_SIZE_N": 64,
        "BLOCK_SIZE_K": 64,
        "GROUP_SIZE_M": 8,
        "num_stages": 4,
        "num_warps": 4,
        "ms": 0.008141463622450829,
        "min_ms": 0.008141463622450829,
        "max_ms": 0.008141463622450829,
        "compile_time": 0.3756530284881592
    },
    {
        "BLOCK_SIZE_M": 64,
        "BLOCK_SIZE_N": 128,
        "BLOCK_SIZE_K": 128,
        "GROUP_SIZE_M": 8,
        "num_stages": 4,
        "num_warps": 8,
        "ms": 0.008141579106450081,
        "min_ms": 0.008141579106450081,
        "max_ms": 0.008141579106450081,
        "compile_time": 0.48842549324035645
    },
    {
        "BLOCK_SIZE_M": 32,
        "BLOCK_SIZE_N": 32,
        "BLOCK_SIZE_K": 128,
        "GROUP_SIZE_M": 8,
        "num_stages": 4,
        "num_warps": 4,
        "ms": 0.008144889026880264,
        "min_ms": 0.008144889026880264,
        "max_ms": 0.008144889026880264,
        "compile_time": 0.43709707260131836
    },
    {
        "BLOCK_SIZE_M": 16,
        "BLOCK_SIZE_N": 64,
        "BLOCK_SIZE_K": 128,
        "GROUP_SIZE_M": 8,
        "num_stages": 3,
        "num_warps": 4,
        "ms": 0.008145970292389393,
        "min_ms": 0.008145970292389393,
        "max_ms": 0.008145970292389393,
        "compile_time": 0.3869190216064453
    },
    {
        "BLOCK_SIZE_M": 128,
        "BLOCK_SIZE_N": 32,
        "BLOCK_SIZE_K": 64,
        "GROUP_SIZE_M": 8,
        "num_stages": 4,
        "num_warps": 16,
        "ms": 0.008147595450282097,
        "min_ms": 0.008147595450282097,
        "max_ms": 0.008147595450282097,
        "compile_time": 0.5226438045501709
    },
    {
        "BLOCK_SIZE_M": 64,
        "BLOCK_SIZE_N": 64,
        "BLOCK_SIZE_K": 256,
        "GROUP_SIZE_M": 8,
        "num_stages": 3,
        "num_warps": 16,
        "ms": 0.008163784630596638,
        "min_ms": 0.008163784630596638,
        "max_ms": 0.008163784630596638,
        "compile_time": 0.47569942474365234
    },
    {
        "BLOCK_SIZE_M": 32,
        "BLOCK_SIZE_N": 256,
        "BLOCK_SIZE_K": 64,
        "GROUP_SIZE_M": 8,
        "num_stages": 3,
        "num_warps": 8,
        "ms": 0.008163917809724808,
        "min_ms": 0.008163917809724808,
        "max_ms": 0.008163917809724808,
        "compile_time": 0.4473531246185303
    },
    {
        "BLOCK_SIZE_M": 256,
        "BLOCK_SIZE_N": 16,
        "BLOCK_SIZE_K": 32,
        "GROUP_SIZE_M": 8,
        "num_stages": 3,
        "num_warps": 4,
        "ms": 0.008167913183569908,
        "min_ms": 0.008167913183569908,
        "max_ms": 0.008167913183569908,
        "compile_time": 0.5309655666351318
    },
    {
        "BLOCK_SIZE_M": 64,
        "BLOCK_SIZE_N": 32,
        "BLOCK_SIZE_K": 64,
        "GROUP_SIZE_M": 8,
        "num_stages": 5,
        "num_warps": 8,
        "ms": 0.00817465502768755,
        "min_ms": 0.00817465502768755,
        "max_ms": 0.00817465502768755,
        "compile_time": 0.48259592056274414
    },
    {
        "BLOCK_SIZE_M": 256,
        "BLOCK_SIZE_N": 16,
        "BLOCK_SIZE_K": 32,
        "GROUP_SIZE_M": 8,
        "num_stages": 4,
        "num_warps": 2,
        "ms": 0.008176458068192005,
        "min_ms": 0.008176458068192005,
        "max_ms": 0.008176458068192005,
        "compile_time": 0.5261459350585938
    },
    {
        "BLOCK_SIZE_M": 16,
        "BLOCK_SIZE_N": 64,
        "BLOCK_SIZE_K": 64,
        "GROUP_SIZE_M": 8,
        "num_stages": 4,
        "num_warps": 2,
        "ms": 0.008176865056157112,
        "min_ms": 0.008176865056157112,
        "max_ms": 0.008176865056157112,
        "compile_time": 0.3458371162414551
    },
    {
        "BLOCK_SIZE_M": 32,
        "BLOCK_SIZE_N": 32,
        "BLOCK_SIZE_K": 32,
        "GROUP_SIZE_M": 8,
        "num_stages": 8,
        "num_warps": 4,
        "ms": 0.008184616453945637,
        "min_ms": 0.008184616453945637,
        "max_ms": 0.008184616453945637,
        "compile_time": 0.4261925220489502
    },
    {
        "BLOCK_SIZE_M": 32,
        "BLOCK_SIZE_N": 32,
        "BLOCK_SIZE_K": 32,
        "GROUP_SIZE_M": 8,
        "num_stages": 2,
        "num_warps": 2,
        "ms": 0.008189432322978973,
        "min_ms": 0.008189432322978973,
        "max_ms": 0.008189432322978973,
        "compile_time": 0.44051527976989746
    },
    {
        "BLOCK_SIZE_M": 32,
        "BLOCK_SIZE_N": 128,
        "BLOCK_SIZE_K": 256,
        "GROUP_SIZE_M": 8,
        "num_stages": 1,
        "num_warps": 4,
        "ms": 0.008191564120352268,
        "min_ms": 0.008191564120352268,
        "max_ms": 0.008191564120352268,
        "compile_time": 0.45394134521484375
    },
    {
        "BLOCK_SIZE_M": 128,
        "BLOCK_SIZE_N": 64,
        "BLOCK_SIZE_K": 32,
        "GROUP_SIZE_M": 8,
        "num_stages": 8,
        "num_warps": 8,
        "ms": 0.008197670802474022,
        "min_ms": 0.008197670802474022,
        "max_ms": 0.008197670802474022,
        "compile_time": 0.534109354019165
    },
    {
        "BLOCK_SIZE_M": 64,
        "BLOCK_SIZE_N": 16,
        "BLOCK_SIZE_K": 64,
        "GROUP_SIZE_M": 8,
        "num_stages": 3,
        "num_warps": 4,
        "ms": 0.008204346522688866,
        "min_ms": 0.008204346522688866,
        "max_ms": 0.008204346522688866,
        "compile_time": 0.4689054489135742
    },
    {
        "BLOCK_SIZE_M": 32,
        "BLOCK_SIZE_N": 128,
        "BLOCK_SIZE_K": 256,
        "GROUP_SIZE_M": 8,
        "num_stages": 2,
        "num_warps": 8,
        "ms": 0.008212225511670113,
        "min_ms": 0.008212225511670113,
        "max_ms": 0.008212225511670113,
        "compile_time": 0.3858811855316162
    },
    {
        "BLOCK_SIZE_M": 32,
        "BLOCK_SIZE_N": 128,
        "BLOCK_SIZE_K": 128,
        "GROUP_SIZE_M": 8,
        "num_stages": 2,
        "num_warps": 8,
        "ms": 0.008213145658373833,
        "min_ms": 0.008213145658373833,
        "max_ms": 0.008213145658373833,
        "compile_time": 0.36223649978637695
    },
    {
        "BLOCK_SIZE_M": 64,
        "BLOCK_SIZE_N": 16,
        "BLOCK_SIZE_K": 64,
        "GROUP_SIZE_M": 8,
        "num_stages": 2,
        "num_warps": 4,
        "ms": 0.008213460445404053,
        "min_ms": 0.008213460445404053,
        "max_ms": 0.008213460445404053,
        "compile_time": 0.46599364280700684
    },
    {
        "BLOCK_SIZE_M": 128,
        "BLOCK_SIZE_N": 32,
        "BLOCK_SIZE_K": 128,
        "GROUP_SIZE_M": 8,
        "num_stages": 3,
        "num_warps": 16,
        "ms": 0.008225466124713421,
        "min_ms": 0.008225466124713421,
        "max_ms": 0.008225466124713421,
        "compile_time": 0.5299239158630371
    },
    {
        "BLOCK_SIZE_M": 64,
        "BLOCK_SIZE_N": 16,
        "BLOCK_SIZE_K": 64,
        "GROUP_SIZE_M": 8,
        "num_stages": 4,
        "num_warps": 2,
        "ms": 0.008240028284490108,
        "min_ms": 0.008240028284490108,
        "max_ms": 0.008240028284490108,
        "compile_time": 0.4730689525604248
    },
    {
        "BLOCK_SIZE_M": 32,
        "BLOCK_SIZE_N": 128,
        "BLOCK_SIZE_K": 64,
        "GROUP_SIZE_M": 8,
        "num_stages": 6,
        "num_warps": 16,
        "ms": 0.008246923796832561,
        "min_ms": 0.008246923796832561,
        "max_ms": 0.008246923796832561,
        "compile_time": 0.4470229148864746
    },
    {
        "BLOCK_SIZE_M": 256,
        "BLOCK_SIZE_N": 16,
        "BLOCK_SIZE_K": 32,
        "GROUP_SIZE_M": 8,
        "num_stages": 3,
        "num_warps": 2,
        "ms": 0.008254420943558216,
        "min_ms": 0.008254420943558216,
        "max_ms": 0.008254420943558216,
        "compile_time": 0.5327455997467041
    },
    {
        "BLOCK_SIZE_M": 128,
        "BLOCK_SIZE_N": 32,
        "BLOCK_SIZE_K": 64,
        "GROUP_SIZE_M": 8,
        "num_stages": 3,
        "num_warps": 16,
        "ms": 0.008255546912550926,
        "min_ms": 0.008255546912550926,
        "max_ms": 0.008255546912550926,
        "compile_time": 0.5234777927398682
    },
    {
        "BLOCK_SIZE_M": 256,
        "BLOCK_SIZE_N": 16,
        "BLOCK_SIZE_K": 32,
        "GROUP_SIZE_M": 8,
        "num_stages": 5,
        "num_warps": 4,
        "ms": 0.008261436596512794,
        "min_ms": 0.008261436596512794,
        "max_ms": 0.008261436596512794,
        "compile_time": 0.5394792556762695
    },
    {
        "BLOCK_SIZE_M": 32,
        "BLOCK_SIZE_N": 256,
        "BLOCK_SIZE_K": 32,
        "GROUP_SIZE_M": 8,
        "num_stages": 7,
        "num_warps": 4,
        "ms": 0.008263702504336834,
        "min_ms": 0.008263702504336834,
        "max_ms": 0.008263702504336834,
        "compile_time": 0.45290255546569824
    },
    {
        "BLOCK_SIZE_M": 64,
        "BLOCK_SIZE_N": 64,
        "BLOCK_SIZE_K": 16,
        "GROUP_SIZE_M": 8,
        "num_stages": 3,
        "num_warps": 4,
        "ms": 0.008266141638159752,
        "min_ms": 0.008266141638159752,
        "max_ms": 0.008266141638159752,
        "compile_time": 0.47811055183410645
    },
    {
        "BLOCK_SIZE_M": 16,
        "BLOCK_SIZE_N": 256,
        "BLOCK_SIZE_K": 32,
        "GROUP_SIZE_M": 8,
        "num_stages": 8,
        "num_warps": 4,
        "ms": 0.008268574252724648,
        "min_ms": 0.008268574252724648,
        "max_ms": 0.008268574252724648,
        "compile_time": 0.4039125442504883
    },
    {
        "BLOCK_SIZE_M": 64,
        "BLOCK_SIZE_N": 32,
        "BLOCK_SIZE_K": 128,
        "GROUP_SIZE_M": 8,
        "num_stages": 3,
        "num_warps": 2,
        "ms": 0.008286220952868462,
        "min_ms": 0.008286220952868462,
        "max_ms": 0.008286220952868462,
        "compile_time": 0.49460697174072266
    },
    {
        "BLOCK_SIZE_M": 32,
        "BLOCK_SIZE_N": 32,
        "BLOCK_SIZE_K": 32,
        "GROUP_SIZE_M": 8,
        "num_stages": 2,
        "num_warps": 4,
        "ms": 0.008290435187518597,
        "min_ms": 0.008290435187518597,
        "max_ms": 0.008290435187518597,
        "compile_time": 0.40605902671813965
    },
    {
        "BLOCK_SIZE_M": 64,
        "BLOCK_SIZE_N": 16,
        "BLOCK_SIZE_K": 64,
        "GROUP_SIZE_M": 8,
        "num_stages": 2,
        "num_warps": 2,
        "ms": 0.008304379880428314,
        "min_ms": 0.008304379880428314,
        "max_ms": 0.008304379880428314,
        "compile_time": 0.4709599018096924
    },
    {
        "BLOCK_SIZE_M": 256,
        "BLOCK_SIZE_N": 16,
        "BLOCK_SIZE_K": 32,
        "GROUP_SIZE_M": 8,
        "num_stages": 5,
        "num_warps": 2,
        "ms": 0.008309352211654186,
        "min_ms": 0.008309352211654186,
        "max_ms": 0.008309352211654186,
        "compile_time": 0.5397019386291504
    },
    {
        "BLOCK_SIZE_M": 16,
        "BLOCK_SIZE_N": 128,
        "BLOCK_SIZE_K": 64,
        "GROUP_SIZE_M": 8,
        "num_stages": 3,
        "num_warps": 4,
        "ms": 0.008312071673572063,
        "min_ms": 0.008312071673572063,
        "max_ms": 0.008312071673572063,
        "compile_time": 0.3958885669708252
    },
    {
        "BLOCK_SIZE_M": 16,
        "BLOCK_SIZE_N": 64,
        "BLOCK_SIZE_K": 32,
        "GROUP_SIZE_M": 8,
        "num_stages": 4,
        "num_warps": 2,
        "ms": 0.008313190191984177,
        "min_ms": 0.008313190191984177,
        "max_ms": 0.008313190191984177,
        "compile_time": 0.3894472122192383
    },
    {
        "BLOCK_SIZE_M": 16,
        "BLOCK_SIZE_N": 256,
        "BLOCK_SIZE_K": 64,
        "GROUP_SIZE_M": 8,
        "num_stages": 5,
        "num_warps": 4,
        "ms": 0.00831524282693863,
        "min_ms": 0.00831524282693863,
        "max_ms": 0.00831524282693863,
        "compile_time": 0.4016280174255371
    },
    {
        "BLOCK_SIZE_M": 16,
        "BLOCK_SIZE_N": 128,
        "BLOCK_SIZE_K": 64,
        "GROUP_SIZE_M": 8,
        "num_stages": 4,
        "num_warps": 4,
        "ms": 0.00833053421229124,
        "min_ms": 0.00833053421229124,
        "max_ms": 0.00833053421229124,
        "compile_time": 0.40126609802246094
    },
    {
        "BLOCK_SIZE_M": 16,
        "BLOCK_SIZE_N": 256,
        "BLOCK_SIZE_K": 32,
        "GROUP_SIZE_M": 8,
        "num_stages": 4,
        "num_warps": 4,
        "ms": 0.008330874145030975,
        "min_ms": 0.008330874145030975,
        "max_ms": 0.008330874145030975,
        "compile_time": 0.40151357650756836
    },
    {
        "BLOCK_SIZE_M": 128,
        "BLOCK_SIZE_N": 32,
        "BLOCK_SIZE_K": 128,
        "GROUP_SIZE_M": 8,
        "num_stages": 1,
        "num_warps": 4,
        "ms": 0.008332460187375546,
        "min_ms": 0.008332460187375546,
        "max_ms": 0.008332460187375546,
        "compile_time": 0.5256948471069336
    },
    {
        "BLOCK_SIZE_M": 128,
        "BLOCK_SIZE_N": 32,
        "BLOCK_SIZE_K": 128,
        "GROUP_SIZE_M": 8,
        "num_stages": 4,
        "num_warps": 16,
        "ms": 0.00833506602793932,
        "min_ms": 0.00833506602793932,
        "max_ms": 0.00833506602793932,
        "compile_time": 0.5286831855773926
    },
    {
        "BLOCK_SIZE_M": 32,
        "BLOCK_SIZE_N": 64,
        "BLOCK_SIZE_K": 64,
        "GROUP_SIZE_M": 8,
        "num_stages": 8,
        "num_warps": 4,
        "ms": 0.00833909586071968,
        "min_ms": 0.00833909586071968,
        "max_ms": 0.00833909586071968,
        "compile_time": 0.4426267147064209
    },
    {
        "BLOCK_SIZE_M": 32,
        "BLOCK_SIZE_N": 64,
        "BLOCK_SIZE_K": 128,
        "GROUP_SIZE_M": 8,
        "num_stages": 4,
        "num_warps": 8,
        "ms": 0.00834084115922451,
        "min_ms": 0.00834084115922451,
        "max_ms": 0.00834084115922451,
        "compile_time": 0.43692517280578613
    },
    {
        "BLOCK_SIZE_M": 32,
        "BLOCK_SIZE_N": 64,
        "BLOCK_SIZE_K": 16,
        "GROUP_SIZE_M": 8,
        "num_stages": 4,
        "num_warps": 2,
        "ms": 0.008344043046236038,
        "min_ms": 0.008344043046236038,
        "max_ms": 0.008344043046236038,
        "compile_time": 0.4471728801727295
    },
    {
        "BLOCK_SIZE_M": 256,
        "BLOCK_SIZE_N": 32,
        "BLOCK_SIZE_K": 32,
        "GROUP_SIZE_M": 8,
        "num_stages": 3,
        "num_warps": 4,
        "ms": 0.008345109410583973,
        "min_ms": 0.008345109410583973,
        "max_ms": 0.008345109410583973,
        "compile_time": 0.542292594909668
    },
    {
        "BLOCK_SIZE_M": 16,
        "BLOCK_SIZE_N": 64,
        "BLOCK_SIZE_K": 64,
        "GROUP_SIZE_M": 8,
        "num_stages": 6,
        "num_warps": 4,
        "ms": 0.008349609561264515,
        "min_ms": 0.008349609561264515,
        "max_ms": 0.008349609561264515,
        "compile_time": 0.38042330741882324
    },
    {
        "BLOCK_SIZE_M": 32,
        "BLOCK_SIZE_N": 64,
        "BLOCK_SIZE_K": 128,
        "GROUP_SIZE_M": 8,
        "num_stages": 5,
        "num_warps": 4,
        "ms": 0.008356134407222271,
        "min_ms": 0.008356134407222271,
        "max_ms": 0.008356134407222271,
        "compile_time": 0.4415700435638428
    },
    {
        "BLOCK_SIZE_M": 128,
        "BLOCK_SIZE_N": 16,
        "BLOCK_SIZE_K": 32,
        "GROUP_SIZE_M": 8,
        "num_stages": 3,
        "num_warps": 2,
        "ms": 0.008357774466276169,
        "min_ms": 0.008357774466276169,
        "max_ms": 0.008357774466276169,
        "compile_time": 0.519280195236206
    },
    {
        "BLOCK_SIZE_M": 256,
        "BLOCK_SIZE_N": 32,
        "BLOCK_SIZE_K": 64,
        "GROUP_SIZE_M": 8,
        "num_stages": 3,
        "num_warps": 8,
        "ms": 0.00836021639406681,
        "min_ms": 0.00836021639406681,
        "max_ms": 0.00836021639406681,
        "compile_time": 0.5377840995788574
    },
    {
        "BLOCK_SIZE_M": 16,
        "BLOCK_SIZE_N": 32,
        "BLOCK_SIZE_K": 64,
        "GROUP_SIZE_M": 8,
        "num_stages": 3,
        "num_warps": 2,
        "ms": 0.008360485546290874,
        "min_ms": 0.008360485546290874,
        "max_ms": 0.008360485546290874,
        "compile_time": 0.38204336166381836
    },
    {
        "BLOCK_SIZE_M": 32,
        "BLOCK_SIZE_N": 32,
        "BLOCK_SIZE_K": 256,
        "GROUP_SIZE_M": 8,
        "num_stages": 2,
        "num_warps": 2,
        "ms": 0.008361998945474625,
        "min_ms": 0.008361998945474625,
        "max_ms": 0.008361998945474625,
        "compile_time": 0.43798136711120605
    },
    {
        "BLOCK_SIZE_M": 256,
        "BLOCK_SIZE_N": 32,
        "BLOCK_SIZE_K": 64,
        "GROUP_SIZE_M": 8,
        "num_stages": 4,
        "num_warps": 8,
        "ms": 0.008366367779672146,
        "min_ms": 0.008366367779672146,
        "max_ms": 0.008366367779672146,
        "compile_time": 0.545896053314209
    },
    {
        "BLOCK_SIZE_M": 64,
        "BLOCK_SIZE_N": 16,
        "BLOCK_SIZE_K": 32,
        "GROUP_SIZE_M": 8,
        "num_stages": 3,
        "num_warps": 2,
        "ms": 0.008371531963348389,
        "min_ms": 0.008371531963348389,
        "max_ms": 0.008371531963348389,
        "compile_time": 0.4702162742614746
    },
    {
        "BLOCK_SIZE_M": 128,
        "BLOCK_SIZE_N": 16,
        "BLOCK_SIZE_K": 64,
        "GROUP_SIZE_M": 8,
        "num_stages": 3,
        "num_warps": 2,
        "ms": 0.0083769541233778,
        "min_ms": 0.0083769541233778,
        "max_ms": 0.0083769541233778,
        "compile_time": 0.5039756298065186
    },
    {
        "BLOCK_SIZE_M": 32,
        "BLOCK_SIZE_N": 128,
        "BLOCK_SIZE_K": 128,
        "GROUP_SIZE_M": 8,
        "num_stages": 1,
        "num_warps": 4,
        "ms": 0.0083791334182024,
        "min_ms": 0.0083791334182024,
        "max_ms": 0.0083791334182024,
        "compile_time": 0.4537546634674072
    },
    {
        "BLOCK_SIZE_M": 16,
        "BLOCK_SIZE_N": 256,
        "BLOCK_SIZE_K": 64,
        "GROUP_SIZE_M": 8,
        "num_stages": 5,
        "num_warps": 8,
        "ms": 0.008382012136280537,
        "min_ms": 0.008382012136280537,
        "max_ms": 0.008382012136280537,
        "compile_time": 0.40573763847351074
    },
    {
        "BLOCK_SIZE_M": 128,
        "BLOCK_SIZE_N": 32,
        "BLOCK_SIZE_K": 128,
        "GROUP_SIZE_M": 8,
        "num_stages": 2,
        "num_warps": 8,
        "ms": 0.008385014720261097,
        "min_ms": 0.008385014720261097,
        "max_ms": 0.008385014720261097,
        "compile_time": 0.5299272537231445
    },
    {
        "BLOCK_SIZE_M": 32,
        "BLOCK_SIZE_N": 256,
        "BLOCK_SIZE_K": 32,
        "GROUP_SIZE_M": 8,
        "num_stages": 8,
        "num_warps": 4,
        "ms": 0.008387953042984009,
        "min_ms": 0.008387953042984009,
        "max_ms": 0.008387953042984009,
        "compile_time": 0.4486207962036133
    },
    {
        "BLOCK_SIZE_M": 128,
        "BLOCK_SIZE_N": 32,
        "BLOCK_SIZE_K": 128,
        "GROUP_SIZE_M": 8,
        "num_stages": 3,
        "num_warps": 2,
        "ms": 0.008391146548092365,
        "min_ms": 0.008391146548092365,
        "max_ms": 0.008391146548092365,
        "compile_time": 0.5225808620452881
    },
    {
        "BLOCK_SIZE_M": 128,
        "BLOCK_SIZE_N": 32,
        "BLOCK_SIZE_K": 128,
        "GROUP_SIZE_M": 8,
        "num_stages": 4,
        "num_warps": 2,
        "ms": 0.00840235035866499,
        "min_ms": 0.00840235035866499,
        "max_ms": 0.00840235035866499,
        "compile_time": 0.5248935222625732
    },
    {
        "BLOCK_SIZE_M": 32,
        "BLOCK_SIZE_N": 64,
        "BLOCK_SIZE_K": 256,
        "GROUP_SIZE_M": 8,
        "num_stages": 2,
        "num_warps": 4,
        "ms": 0.008405633270740509,
        "min_ms": 0.008405633270740509,
        "max_ms": 0.008405633270740509,
        "compile_time": 0.4494950771331787
    },
    {
        "BLOCK_SIZE_M": 64,
        "BLOCK_SIZE_N": 16,
        "BLOCK_SIZE_K": 32,
        "GROUP_SIZE_M": 8,
        "num_stages": 4,
        "num_warps": 2,
        "ms": 0.0084071084856987,
        "min_ms": 0.0084071084856987,
        "max_ms": 0.0084071084856987,
        "compile_time": 0.47690463066101074
    },
    {
        "BLOCK_SIZE_M": 32,
        "BLOCK_SIZE_N": 128,
        "BLOCK_SIZE_K": 128,
        "GROUP_SIZE_M": 8,
        "num_stages": 5,
        "num_warps": 16,
        "ms": 0.00841237511485815,
        "min_ms": 0.00841237511485815,
        "max_ms": 0.00841237511485815,
        "compile_time": 0.38986849784851074
    },
    {
        "BLOCK_SIZE_M": 64,
        "BLOCK_SIZE_N": 64,
        "BLOCK_SIZE_K": 128,
        "GROUP_SIZE_M": 8,
        "num_stages": 2,
        "num_warps": 2,
        "ms": 0.008416702039539814,
        "min_ms": 0.008416702039539814,
        "max_ms": 0.008416702039539814,
        "compile_time": 0.4939231872558594
    },
    {
        "BLOCK_SIZE_M": 32,
        "BLOCK_SIZE_N": 64,
        "BLOCK_SIZE_K": 64,
        "GROUP_SIZE_M": 8,
        "num_stages": 6,
        "num_warps": 8,
        "ms": 0.008417479693889618,
        "min_ms": 0.008417479693889618,
        "max_ms": 0.008417479693889618,
        "compile_time": 0.4474308490753174
    },
    {
        "BLOCK_SIZE_M": 32,
        "BLOCK_SIZE_N": 64,
        "BLOCK_SIZE_K": 128,
        "GROUP_SIZE_M": 8,
        "num_stages": 6,
        "num_warps": 4,
        "ms": 0.008421594277024269,
        "min_ms": 0.008421594277024269,
        "max_ms": 0.008421594277024269,
        "compile_time": 0.4465193748474121
    },
    {
        "BLOCK_SIZE_M": 16,
        "BLOCK_SIZE_N": 256,
        "BLOCK_SIZE_K": 32,
        "GROUP_SIZE_M": 8,
        "num_stages": 6,
        "num_warps": 4,
        "ms": 0.008423109538853168,
        "min_ms": 0.008423109538853168,
        "max_ms": 0.008423109538853168,
        "compile_time": 0.3635547161102295
    },
    {
        "BLOCK_SIZE_M": 16,
        "BLOCK_SIZE_N": 64,
        "BLOCK_SIZE_K": 128,
        "GROUP_SIZE_M": 8,
        "num_stages": 2,
        "num_warps": 2,
        "ms": 0.00842409860342741,
        "min_ms": 0.00842409860342741,
        "max_ms": 0.00842409860342741,
        "compile_time": 0.3876986503601074
    },
    {
        "BLOCK_SIZE_M": 256,
        "BLOCK_SIZE_N": 16,
        "BLOCK_SIZE_K": 32,
        "GROUP_SIZE_M": 8,
        "num_stages": 6,
        "num_warps": 4,
        "ms": 0.008424260653555393,
        "min_ms": 0.008424260653555393,
        "max_ms": 0.008424260653555393,
        "compile_time": 0.5379042625427246
    },
    {
        "BLOCK_SIZE_M": 16,
        "BLOCK_SIZE_N": 32,
        "BLOCK_SIZE_K": 64,
        "GROUP_SIZE_M": 8,
        "num_stages": 4,
        "num_warps": 2,
        "ms": 0.008425818756222725,
        "min_ms": 0.008425818756222725,
        "max_ms": 0.008425818756222725,
        "compile_time": 0.3787660598754883
    },
    {
        "BLOCK_SIZE_M": 128,
        "BLOCK_SIZE_N": 16,
        "BLOCK_SIZE_K": 64,
        "GROUP_SIZE_M": 8,
        "num_stages": 3,
        "num_warps": 4,
        "ms": 0.008426705375313759,
        "min_ms": 0.008426705375313759,
        "max_ms": 0.008426705375313759,
        "compile_time": 0.5235409736633301
    },
    {
        "BLOCK_SIZE_M": 16,
        "BLOCK_SIZE_N": 256,
        "BLOCK_SIZE_K": 32,
        "GROUP_SIZE_M": 8,
        "num_stages": 7,
        "num_warps": 4,
        "ms": 0.008428004570305347,
        "min_ms": 0.008428004570305347,
        "max_ms": 0.008428004570305347,
        "compile_time": 0.35961461067199707
    },
    {
        "BLOCK_SIZE_M": 256,
        "BLOCK_SIZE_N": 32,
        "BLOCK_SIZE_K": 32,
        "GROUP_SIZE_M": 8,
        "num_stages": 4,
        "num_warps": 4,
        "ms": 0.008434407413005829,
        "min_ms": 0.008434407413005829,
        "max_ms": 0.008434407413005829,
        "compile_time": 0.5572786331176758
    },
    {
        "BLOCK_SIZE_M": 32,
        "BLOCK_SIZE_N": 64,
        "BLOCK_SIZE_K": 256,
        "GROUP_SIZE_M": 8,
        "num_stages": 1,
        "num_warps": 4,
        "ms": 0.008438031189143658,
        "min_ms": 0.008438031189143658,
        "max_ms": 0.008438031189143658,
        "compile_time": 0.44599246978759766
    },
    {
        "BLOCK_SIZE_M": 32,
        "BLOCK_SIZE_N": 256,
        "BLOCK_SIZE_K": 64,
        "GROUP_SIZE_M": 8,
        "num_stages": 4,
        "num_warps": 8,
        "ms": 0.00844108872115612,
        "min_ms": 0.00844108872115612,
        "max_ms": 0.00844108872115612,
        "compile_time": 0.46309947967529297
    },
    {
        "BLOCK_SIZE_M": 16,
        "BLOCK_SIZE_N": 64,
        "BLOCK_SIZE_K": 32,
        "GROUP_SIZE_M": 8,
        "num_stages": 5,
        "num_warps": 4,
        "ms": 0.008448945358395576,
        "min_ms": 0.008448945358395576,
        "max_ms": 0.008448945358395576,
        "compile_time": 0.3885478973388672
    },
    {
        "BLOCK_SIZE_M": 16,
        "BLOCK_SIZE_N": 128,
        "BLOCK_SIZE_K": 32,
        "GROUP_SIZE_M": 8,
        "num_stages": 4,
        "num_warps": 2,
        "ms": 0.008455815725028515,
        "min_ms": 0.008455815725028515,
        "max_ms": 0.008455815725028515,
        "compile_time": 0.4040811061859131
    },
    {
        "BLOCK_SIZE_M": 64,
        "BLOCK_SIZE_N": 32,
        "BLOCK_SIZE_K": 256,
        "GROUP_SIZE_M": 8,
        "num_stages": 2,
        "num_warps": 4,
        "ms": 0.00845789909362793,
        "min_ms": 0.00845789909362793,
        "max_ms": 0.00845789909362793,
        "compile_time": 0.4788830280303955
    },
    {
        "BLOCK_SIZE_M": 256,
        "BLOCK_SIZE_N": 16,
        "BLOCK_SIZE_K": 32,
        "GROUP_SIZE_M": 8,
        "num_stages": 6,
        "num_warps": 2,
        "ms": 0.00846262089908123,
        "min_ms": 0.00846262089908123,
        "max_ms": 0.00846262089908123,
        "compile_time": 0.5475575923919678
    },
    {
        "BLOCK_SIZE_M": 16,
        "BLOCK_SIZE_N": 128,
        "BLOCK_SIZE_K": 32,
        "GROUP_SIZE_M": 8,
        "num_stages": 5,
        "num_warps": 2,
        "ms": 0.008464198559522629,
        "min_ms": 0.008464198559522629,
        "max_ms": 0.008464198559522629,
        "compile_time": 0.3968629837036133
    },
    {
        "BLOCK_SIZE_M": 32,
        "BLOCK_SIZE_N": 64,
        "BLOCK_SIZE_K": 32,
        "GROUP_SIZE_M": 8,
        "num_stages": 2,
        "num_warps": 2,
        "ms": 0.008480928838253021,
        "min_ms": 0.008480928838253021,
        "max_ms": 0.008480928838253021,
        "compile_time": 0.43651890754699707
    },
    {
        "BLOCK_SIZE_M": 16,
        "BLOCK_SIZE_N": 64,
        "BLOCK_SIZE_K": 128,
        "GROUP_SIZE_M": 8,
        "num_stages": 3,
        "num_warps": 2,
        "ms": 0.008483652025461197,
        "min_ms": 0.008483652025461197,
        "max_ms": 0.008483652025461197,
        "compile_time": 0.3514237403869629
    },
    {
        "BLOCK_SIZE_M": 32,
        "BLOCK_SIZE_N": 128,
        "BLOCK_SIZE_K": 16,
        "GROUP_SIZE_M": 8,
        "num_stages": 4,
        "num_warps": 4,
        "ms": 0.008484861813485622,
        "min_ms": 0.008484861813485622,
        "max_ms": 0.008484861813485622,
        "compile_time": 0.4577200412750244
    },
    {
        "BLOCK_SIZE_M": 16,
        "BLOCK_SIZE_N": 32,
        "BLOCK_SIZE_K": 128,
        "GROUP_SIZE_M": 8,
        "num_stages": 3,
        "num_warps": 2,
        "ms": 0.008498286828398705,
        "min_ms": 0.008498286828398705,
        "max_ms": 0.008498286828398705,
        "compile_time": 0.3377089500427246
    },
    {
        "BLOCK_SIZE_M": 128,
        "BLOCK_SIZE_N": 32,
        "BLOCK_SIZE_K": 64,
        "GROUP_SIZE_M": 8,
        "num_stages": 5,
        "num_warps": 16,
        "ms": 0.008506792597472668,
        "min_ms": 0.008506792597472668,
        "max_ms": 0.008506792597472668,
        "compile_time": 0.5151619911193848
    },
    {
        "BLOCK_SIZE_M": 32,
        "BLOCK_SIZE_N": 128,
        "BLOCK_SIZE_K": 16,
        "GROUP_SIZE_M": 8,
        "num_stages": 6,
        "num_warps": 4,
        "ms": 0.008507582359015942,
        "min_ms": 0.008507582359015942,
        "max_ms": 0.008507582359015942,
        "compile_time": 0.44571566581726074
    },
    {
        "BLOCK_SIZE_M": 16,
        "BLOCK_SIZE_N": 128,
        "BLOCK_SIZE_K": 32,
        "GROUP_SIZE_M": 8,
        "num_stages": 5,
        "num_warps": 4,
        "ms": 0.00850860308855772,
        "min_ms": 0.00850860308855772,
        "max_ms": 0.00850860308855772,
        "compile_time": 0.39678096771240234
    },
    {
        "BLOCK_SIZE_M": 16,
        "BLOCK_SIZE_N": 128,
        "BLOCK_SIZE_K": 64,
        "GROUP_SIZE_M": 8,
        "num_stages": 5,
        "num_warps": 4,
        "ms": 0.008515511639416218,
        "min_ms": 0.008515511639416218,
        "max_ms": 0.008515511639416218,
        "compile_time": 0.40070080757141113
    },
    {
        "BLOCK_SIZE_M": 64,
        "BLOCK_SIZE_N": 32,
        "BLOCK_SIZE_K": 32,
        "GROUP_SIZE_M": 8,
        "num_stages": 2,
        "num_warps": 2,
        "ms": 0.008550024591386318,
        "min_ms": 0.008550024591386318,
        "max_ms": 0.008550024591386318,
        "compile_time": 0.48273181915283203
    },
    {
        "BLOCK_SIZE_M": 16,
        "BLOCK_SIZE_N": 32,
        "BLOCK_SIZE_K": 32,
        "GROUP_SIZE_M": 8,
        "num_stages": 5,
        "num_warps": 2,
        "ms": 0.008558349683880806,
        "min_ms": 0.008558349683880806,
        "max_ms": 0.008558349683880806,
        "compile_time": 0.37984180450439453
    },
    {
        "BLOCK_SIZE_M": 32,
        "BLOCK_SIZE_N": 32,
        "BLOCK_SIZE_K": 64,
        "GROUP_SIZE_M": 8,
        "num_stages": 7,
        "num_warps": 4,
        "ms": 0.008559915237128735,
        "min_ms": 0.008559915237128735,
        "max_ms": 0.008559915237128735,
        "compile_time": 0.4364640712738037
    },
    {
        "BLOCK_SIZE_M": 32,
        "BLOCK_SIZE_N": 128,
        "BLOCK_SIZE_K": 16,
        "GROUP_SIZE_M": 8,
        "num_stages": 5,
        "num_warps": 4,
        "ms": 0.008562438189983368,
        "min_ms": 0.008562438189983368,
        "max_ms": 0.008562438189983368,
        "compile_time": 0.45983028411865234
    },
    {
        "BLOCK_SIZE_M": 256,
        "BLOCK_SIZE_N": 32,
        "BLOCK_SIZE_K": 64,
        "GROUP_SIZE_M": 8,
        "num_stages": 5,
        "num_warps": 8,
        "ms": 0.008569717407226562,
        "min_ms": 0.008569717407226562,
        "max_ms": 0.008569717407226562,
        "compile_time": 0.5378749370574951
    },
    {
        "BLOCK_SIZE_M": 256,
        "BLOCK_SIZE_N": 16,
        "BLOCK_SIZE_K": 32,
        "GROUP_SIZE_M": 8,
        "num_stages": 7,
        "num_warps": 4,
        "ms": 0.008572155609726906,
        "min_ms": 0.008572155609726906,
        "max_ms": 0.008572155609726906,
        "compile_time": 0.5594639778137207
    },
    {
        "BLOCK_SIZE_M": 64,
        "BLOCK_SIZE_N": 16,
        "BLOCK_SIZE_K": 128,
        "GROUP_SIZE_M": 8,
        "num_stages": 2,
        "num_warps": 4,
        "ms": 0.008587740361690521,
        "min_ms": 0.008587740361690521,
        "max_ms": 0.008587740361690521,
        "compile_time": 0.46008753776550293
    },
    {
        "BLOCK_SIZE_M": 32,
        "BLOCK_SIZE_N": 128,
        "BLOCK_SIZE_K": 64,
        "GROUP_SIZE_M": 8,
        "num_stages": 2,
        "num_warps": 2,
        "ms": 0.008597930893301964,
        "min_ms": 0.008597930893301964,
        "max_ms": 0.008597930893301964,
        "compile_time": 0.45469164848327637
    },
    {
        "BLOCK_SIZE_M": 64,
        "BLOCK_SIZE_N": 32,
        "BLOCK_SIZE_K": 128,
        "GROUP_SIZE_M": 8,
        "num_stages": 5,
        "num_warps": 4,
        "ms": 0.008600425906479359,
        "min_ms": 0.008600425906479359,
        "max_ms": 0.008600425906479359,
        "compile_time": 0.4815995693206787
    },
    {
        "BLOCK_SIZE_M": 32,
        "BLOCK_SIZE_N": 128,
        "BLOCK_SIZE_K": 512,
        "GROUP_SIZE_M": 8,
        "num_stages": 2,
        "num_warps": 8,
        "ms": 0.008606621995568275,
        "min_ms": 0.008606621995568275,
        "max_ms": 0.008606621995568275,
        "compile_time": 0.4472212791442871
    },
    {
        "BLOCK_SIZE_M": 16,
        "BLOCK_SIZE_N": 256,
        "BLOCK_SIZE_K": 32,
        "GROUP_SIZE_M": 8,
        "num_stages": 4,
        "num_warps": 8,
        "ms": 0.008612718433141708,
        "min_ms": 0.008612718433141708,
        "max_ms": 0.008612718433141708,
        "compile_time": 0.4094851016998291
    },
    {
        "BLOCK_SIZE_M": 16,
        "BLOCK_SIZE_N": 256,
        "BLOCK_SIZE_K": 32,
        "GROUP_SIZE_M": 8,
        "num_stages": 5,
        "num_warps": 2,
        "ms": 0.008615231141448021,
        "min_ms": 0.008615231141448021,
        "max_ms": 0.008615231141448021,
        "compile_time": 0.41286325454711914
    },
    {
        "BLOCK_SIZE_M": 32,
        "BLOCK_SIZE_N": 128,
        "BLOCK_SIZE_K": 256,
        "GROUP_SIZE_M": 8,
        "num_stages": 3,
        "num_warps": 4,
        "ms": 0.008615231141448021,
        "min_ms": 0.008615231141448021,
        "max_ms": 0.008615231141448021,
        "compile_time": 0.47019171714782715
    },
    {
        "BLOCK_SIZE_M": 64,
        "BLOCK_SIZE_N": 64,
        "BLOCK_SIZE_K": 16,
        "GROUP_SIZE_M": 8,
        "num_stages": 8,
        "num_warps": 2,
        "ms": 0.008617522194981575,
        "min_ms": 0.008617522194981575,
        "max_ms": 0.008617522194981575,
        "compile_time": 0.48922300338745117
    },
    {
        "BLOCK_SIZE_M": 16,
        "BLOCK_SIZE_N": 256,
        "BLOCK_SIZE_K": 32,
        "GROUP_SIZE_M": 8,
        "num_stages": 5,
        "num_warps": 8,
        "ms": 0.008618389256298542,
        "min_ms": 0.008618389256298542,
        "max_ms": 0.008618389256298542,
        "compile_time": 0.35784244537353516
    },
    {
        "BLOCK_SIZE_M": 64,
        "BLOCK_SIZE_N": 16,
        "BLOCK_SIZE_K": 32,
        "GROUP_SIZE_M": 8,
        "num_stages": 5,
        "num_warps": 2,
        "ms": 0.008619611151516438,
        "min_ms": 0.008619611151516438,
        "max_ms": 0.008619611151516438,
        "compile_time": 0.4852159023284912
    },
    {
        "BLOCK_SIZE_M": 32,
        "BLOCK_SIZE_N": 32,
        "BLOCK_SIZE_K": 128,
        "GROUP_SIZE_M": 8,
        "num_stages": 1,
        "num_warps": 2,
        "ms": 0.008623736910521984,
        "min_ms": 0.008623736910521984,
        "max_ms": 0.008623736910521984,
        "compile_time": 0.4461994171142578
    },
    {
        "BLOCK_SIZE_M": 64,
        "BLOCK_SIZE_N": 32,
        "BLOCK_SIZE_K": 64,
        "GROUP_SIZE_M": 8,
        "num_stages": 8,
        "num_warps": 4,
        "ms": 0.008624481037259102,
        "min_ms": 0.008624481037259102,
        "max_ms": 0.008624481037259102,
        "compile_time": 0.4845883846282959
    },
    {
        "BLOCK_SIZE_M": 64,
        "BLOCK_SIZE_N": 32,
        "BLOCK_SIZE_K": 128,
        "GROUP_SIZE_M": 8,
        "num_stages": 4,
        "num_warps": 8,
        "ms": 0.008626291528344154,
        "min_ms": 0.008626291528344154,
        "max_ms": 0.008626291528344154,
        "compile_time": 0.4906594753265381
    },
    {
        "BLOCK_SIZE_M": 128,
        "BLOCK_SIZE_N": 16,
        "BLOCK_SIZE_K": 64,
        "GROUP_SIZE_M": 8,
        "num_stages": 4,
        "num_warps": 2,
        "ms": 0.008627061732113361,
        "min_ms": 0.008627061732113361,
        "max_ms": 0.008627061732113361,
        "compile_time": 0.5256378650665283
    },
    {
        "BLOCK_SIZE_M": 32,
        "BLOCK_SIZE_N": 128,
        "BLOCK_SIZE_K": 16,
        "GROUP_SIZE_M": 8,
        "num_stages": 8,
        "num_warps": 4,
        "ms": 0.008627993054687977,
        "min_ms": 0.008627993054687977,
        "max_ms": 0.008627993054687977,
        "compile_time": 0.4481997489929199
    },
    {
        "BLOCK_SIZE_M": 64,
        "BLOCK_SIZE_N": 64,
        "BLOCK_SIZE_K": 128,
        "GROUP_SIZE_M": 8,
        "num_stages": 2,
        "num_warps": 16,
        "ms": 0.008630285039544106,
        "min_ms": 0.008630285039544106,
        "max_ms": 0.008630285039544106,
        "compile_time": 0.4976353645324707
    },
    {
        "BLOCK_SIZE_M": 64,
        "BLOCK_SIZE_N": 32,
        "BLOCK_SIZE_K": 32,
        "GROUP_SIZE_M": 8,
        "num_stages": 2,
        "num_warps": 4,
        "ms": 0.00863240659236908,
        "min_ms": 0.00863240659236908,
        "max_ms": 0.00863240659236908,
        "compile_time": 0.4849865436553955
    },
    {
        "BLOCK_SIZE_M": 16,
        "BLOCK_SIZE_N": 32,
        "BLOCK_SIZE_K": 64,
        "GROUP_SIZE_M": 8,
        "num_stages": 5,
        "num_warps": 2,
        "ms": 0.008632953278720379,
        "min_ms": 0.008632953278720379,
        "max_ms": 0.008632953278720379,
        "compile_time": 0.38397216796875
    },
    {
        "BLOCK_SIZE_M": 64,
        "BLOCK_SIZE_N": 64,
        "BLOCK_SIZE_K": 256,
        "GROUP_SIZE_M": 8,
        "num_stages": 1,
        "num_warps": 16,
        "ms": 0.008633661083877087,
        "min_ms": 0.008633661083877087,
        "max_ms": 0.008633661083877087,
        "compile_time": 0.5042920112609863
    },
    {
        "BLOCK_SIZE_M": 32,
        "BLOCK_SIZE_N": 128,
        "BLOCK_SIZE_K": 64,
        "GROUP_SIZE_M": 8,
        "num_stages": 7,
        "num_warps": 16,
        "ms": 0.008634206838905811,
        "min_ms": 0.008634206838905811,
        "max_ms": 0.008634206838905811,
        "compile_time": 0.4594898223876953
    },
    {
        "BLOCK_SIZE_M": 64,
        "BLOCK_SIZE_N": 16,
        "BLOCK_SIZE_K": 128,
        "GROUP_SIZE_M": 8,
        "num_stages": 2,
        "num_warps": 2,
        "ms": 0.008634264580905437,
        "min_ms": 0.008634264580905437,
        "max_ms": 0.008634264580905437,
        "compile_time": 0.4834463596343994
    },
    {
        "BLOCK_SIZE_M": 32,
        "BLOCK_SIZE_N": 16,
        "BLOCK_SIZE_K": 64,
        "GROUP_SIZE_M": 8,
        "num_stages": 3,
        "num_warps": 2,
        "ms": 0.00863586738705635,
        "min_ms": 0.00863586738705635,
        "max_ms": 0.00863586738705635,
        "compile_time": 0.42478299140930176
    },
    {
        "BLOCK_SIZE_M": 32,
        "BLOCK_SIZE_N": 128,
        "BLOCK_SIZE_K": 16,
        "GROUP_SIZE_M": 8,
        "num_stages": 7,
        "num_warps": 4,
        "ms": 0.008637714199721813,
        "min_ms": 0.008637714199721813,
        "max_ms": 0.008637714199721813,
        "compile_time": 0.4518871307373047
    },
    {
        "BLOCK_SIZE_M": 256,
        "BLOCK_SIZE_N": 32,
        "BLOCK_SIZE_K": 32,
        "GROUP_SIZE_M": 8,
        "num_stages": 5,
        "num_warps": 4,
        "ms": 0.00863966066390276,
        "min_ms": 0.00863966066390276,
        "max_ms": 0.00863966066390276,
        "compile_time": 0.5580060482025146
    },
    {
        "BLOCK_SIZE_M": 32,
        "BLOCK_SIZE_N": 128,
        "BLOCK_SIZE_K": 512,
        "GROUP_SIZE_M": 8,
        "num_stages": 1,
        "num_warps": 8,
        "ms": 0.008644521236419678,
        "min_ms": 0.008644521236419678,
        "max_ms": 0.008644521236419678,
        "compile_time": 0.44498300552368164
    },
    {
        "BLOCK_SIZE_M": 32,
        "BLOCK_SIZE_N": 128,
        "BLOCK_SIZE_K": 64,
        "GROUP_SIZE_M": 8,
        "num_stages": 2,
        "num_warps": 8,
        "ms": 0.008645906113088131,
        "min_ms": 0.008645906113088131,
        "max_ms": 0.008645906113088131,
        "compile_time": 0.44681334495544434
    },
    {
        "BLOCK_SIZE_M": 128,
        "BLOCK_SIZE_N": 16,
        "BLOCK_SIZE_K": 32,
        "GROUP_SIZE_M": 8,
        "num_stages": 4,
        "num_warps": 2,
        "ms": 0.008647424168884754,
        "min_ms": 0.008647424168884754,
        "max_ms": 0.008647424168884754,
        "compile_time": 0.5116262435913086
    },
    {
        "BLOCK_SIZE_M": 128,
        "BLOCK_SIZE_N": 32,
        "BLOCK_SIZE_K": 256,
        "GROUP_SIZE_M": 8,
        "num_stages": 2,
        "num_warps": 8,
        "ms": 0.008651327341794968,
        "min_ms": 0.008651327341794968,
        "max_ms": 0.008651327341794968,
        "compile_time": 0.5330827236175537
    },
    {
        "BLOCK_SIZE_M": 16,
        "BLOCK_SIZE_N": 256,
        "BLOCK_SIZE_K": 64,
        "GROUP_SIZE_M": 8,
        "num_stages": 3,
        "num_warps": 4,
        "ms": 0.008655746467411518,
        "min_ms": 0.008655746467411518,
        "max_ms": 0.008655746467411518,
        "compile_time": 0.4108278751373291
    },
    {
        "BLOCK_SIZE_M": 64,
        "BLOCK_SIZE_N": 16,
        "BLOCK_SIZE_K": 64,
        "GROUP_SIZE_M": 8,
        "num_stages": 5,
        "num_warps": 2,
        "ms": 0.008658690378069878,
        "min_ms": 0.008658690378069878,
        "max_ms": 0.008658690378069878,
        "compile_time": 0.4907207489013672
    },
    {
        "BLOCK_SIZE_M": 128,
        "BLOCK_SIZE_N": 32,
        "BLOCK_SIZE_K": 64,
        "GROUP_SIZE_M": 8,
        "num_stages": 6,
        "num_warps": 16,
        "ms": 0.008658748120069504,
        "min_ms": 0.008658748120069504,
        "max_ms": 0.008658748120069504,
        "compile_time": 0.5372681617736816
    },
    {
        "BLOCK_SIZE_M": 64,
        "BLOCK_SIZE_N": 16,
        "BLOCK_SIZE_K": 64,
        "GROUP_SIZE_M": 8,
        "num_stages": 4,
        "num_warps": 4,
        "ms": 0.008662881329655647,
        "min_ms": 0.008662881329655647,
        "max_ms": 0.008662881329655647,
        "compile_time": 0.476881742477417
    },
    {
        "BLOCK_SIZE_M": 16,
        "BLOCK_SIZE_N": 256,
        "BLOCK_SIZE_K": 32,
        "GROUP_SIZE_M": 8,
        "num_stages": 4,
        "num_warps": 2,
        "ms": 0.008662931621074677,
        "min_ms": 0.008662931621074677,
        "max_ms": 0.008662931621074677,
        "compile_time": 0.3999142646789551
    },
    {
        "BLOCK_SIZE_M": 64,
        "BLOCK_SIZE_N": 32,
        "BLOCK_SIZE_K": 64,
        "GROUP_SIZE_M": 8,
        "num_stages": 6,
        "num_warps": 8,
        "ms": 0.00866321288049221,
        "min_ms": 0.00866321288049221,
        "max_ms": 0.00866321288049221,
        "compile_time": 0.48444056510925293
    },
    {
        "BLOCK_SIZE_M": 256,
        "BLOCK_SIZE_N": 16,
        "BLOCK_SIZE_K": 32,
        "GROUP_SIZE_M": 8,
        "num_stages": 7,
        "num_warps": 2,
        "ms": 0.008663447573781013,
        "min_ms": 0.008663447573781013,
        "max_ms": 0.008663447573781013,
        "compile_time": 0.5464491844177246
    },
    {
        "BLOCK_SIZE_M": 256,
        "BLOCK_SIZE_N": 16,
        "BLOCK_SIZE_K": 64,
        "GROUP_SIZE_M": 8,
        "num_stages": 3,
        "num_warps": 8,
        "ms": 0.008672850206494331,
        "min_ms": 0.008672850206494331,
        "max_ms": 0.008672850206494331,
        "compile_time": 0.5474226474761963
    },
    {
        "BLOCK_SIZE_M": 128,
        "BLOCK_SIZE_N": 32,
        "BLOCK_SIZE_K": 64,
        "GROUP_SIZE_M": 8,
        "num_stages": 2,
        "num_warps": 8,
        "ms": 0.008678833022713661,
        "min_ms": 0.008678833022713661,
        "max_ms": 0.008678833022713661,
        "compile_time": 0.5211324691772461
    },
    {
        "BLOCK_SIZE_M": 64,
        "BLOCK_SIZE_N": 32,
        "BLOCK_SIZE_K": 128,
        "GROUP_SIZE_M": 8,
        "num_stages": 1,
        "num_warps": 4,
        "ms": 0.008683562278747559,
        "min_ms": 0.008683562278747559,
        "max_ms": 0.008683562278747559,
        "compile_time": 0.5001623630523682
    },
    {
        "BLOCK_SIZE_M": 128,
        "BLOCK_SIZE_N": 64,
        "BLOCK_SIZE_K": 128,
        "GROUP_SIZE_M": 8,
        "num_stages": 2,
        "num_warps": 4,
        "ms": 0.00868383701890707,
        "min_ms": 0.00868383701890707,
        "max_ms": 0.00868383701890707,
        "compile_time": 0.5388116836547852
    },
    {
        "BLOCK_SIZE_M": 64,
        "BLOCK_SIZE_N": 32,
        "BLOCK_SIZE_K": 128,
        "GROUP_SIZE_M": 8,
        "num_stages": 4,
        "num_warps": 2,
        "ms": 0.00868999119848013,
        "min_ms": 0.00868999119848013,
        "max_ms": 0.00868999119848013,
        "compile_time": 0.492872953414917
    },
    {
        "BLOCK_SIZE_M": 16,
        "BLOCK_SIZE_N": 256,
        "BLOCK_SIZE_K": 32,
        "GROUP_SIZE_M": 8,
        "num_stages": 6,
        "num_warps": 2,
        "ms": 0.008691427297890186,
        "min_ms": 0.008691427297890186,
        "max_ms": 0.008691427297890186,
        "compile_time": 0.4102780818939209
    },
    {
        "BLOCK_SIZE_M": 16,
        "BLOCK_SIZE_N": 128,
        "BLOCK_SIZE_K": 32,
        "GROUP_SIZE_M": 8,
        "num_stages": 6,
        "num_warps": 4,
        "ms": 0.008691852912306786,
        "min_ms": 0.008691852912306786,
        "max_ms": 0.008691852912306786,
        "compile_time": 0.38009023666381836
    },
    {
        "BLOCK_SIZE_M": 16,
        "BLOCK_SIZE_N": 32,
        "BLOCK_SIZE_K": 32,
        "GROUP_SIZE_M": 8,
        "num_stages": 4,
        "num_warps": 2,
        "ms": 0.008695602416992188,
        "min_ms": 0.008695602416992188,
        "max_ms": 0.008695602416992188,
        "compile_time": 0.3880035877227783
    },
    {
        "BLOCK_SIZE_M": 32,
        "BLOCK_SIZE_N": 64,
        "BLOCK_SIZE_K": 32,
        "GROUP_SIZE_M": 8,
        "num_stages": 2,
        "num_warps": 4,
        "ms": 0.008700951002538204,
        "min_ms": 0.008700951002538204,
        "max_ms": 0.008700951002538204,
        "compile_time": 0.43163108825683594
    },
    {
        "BLOCK_SIZE_M": 64,
        "BLOCK_SIZE_N": 64,
        "BLOCK_SIZE_K": 256,
        "GROUP_SIZE_M": 8,
        "num_stages": 2,
        "num_warps": 16,
        "ms": 0.00870224554091692,
        "min_ms": 0.00870224554091692,
        "max_ms": 0.00870224554091692,
        "compile_time": 0.4353172779083252
    },
    {
        "BLOCK_SIZE_M": 256,
        "BLOCK_SIZE_N": 16,
        "BLOCK_SIZE_K": 32,
        "GROUP_SIZE_M": 8,
        "num_stages": 4,
        "num_warps": 8,
        "ms": 0.008705586194992065,
        "min_ms": 0.008705586194992065,
        "max_ms": 0.008705586194992065,
        "compile_time": 0.5389883518218994
    },
    {
        "BLOCK_SIZE_M": 256,
        "BLOCK_SIZE_N": 32,
        "BLOCK_SIZE_K": 32,
        "GROUP_SIZE_M": 8,
        "num_stages": 6,
        "num_warps": 4,
        "ms": 0.008709797635674477,
        "min_ms": 0.008709797635674477,
        "max_ms": 0.008709797635674477,
        "compile_time": 0.5454275608062744
    },
    {
        "BLOCK_SIZE_M": 128,
        "BLOCK_SIZE_N": 32,
        "BLOCK_SIZE_K": 64,
        "GROUP_SIZE_M": 8,
        "num_stages": 2,
        "num_warps": 2,
        "ms": 0.008713308721780777,
        "min_ms": 0.008713308721780777,
        "max_ms": 0.008713308721780777,
        "compile_time": 0.513530969619751
    },
    {
        "BLOCK_SIZE_M": 256,
        "BLOCK_SIZE_N": 16,
        "BLOCK_SIZE_K": 32,
        "GROUP_SIZE_M": 8,
        "num_stages": 3,
        "num_warps": 8,
        "ms": 0.008715929463505745,
        "min_ms": 0.008715929463505745,
        "max_ms": 0.008715929463505745,
        "compile_time": 0.4544379711151123
    },
    {
        "BLOCK_SIZE_M": 64,
        "BLOCK_SIZE_N": 16,
        "BLOCK_SIZE_K": 128,
        "GROUP_SIZE_M": 8,
        "num_stages": 3,
        "num_warps": 2,
        "ms": 0.008715941570699215,
        "min_ms": 0.008715941570699215,
        "max_ms": 0.008715941570699215,
        "compile_time": 0.4775378704071045
    },
    {
        "BLOCK_SIZE_M": 128,
        "BLOCK_SIZE_N": 16,
        "BLOCK_SIZE_K": 64,
        "GROUP_SIZE_M": 8,
        "num_stages": 4,
        "num_warps": 4,
        "ms": 0.0087183378636837,
        "min_ms": 0.0087183378636837,
        "max_ms": 0.0087183378636837,
        "compile_time": 0.5339453220367432
    },
    {
        "BLOCK_SIZE_M": 32,
        "BLOCK_SIZE_N": 128,
        "BLOCK_SIZE_K": 128,
        "GROUP_SIZE_M": 8,
        "num_stages": 3,
        "num_warps": 2,
        "ms": 0.008720683865249157,
        "min_ms": 0.008720683865249157,
        "max_ms": 0.008720683865249157,
        "compile_time": 0.46221351623535156
    },
    {
        "BLOCK_SIZE_M": 32,
        "BLOCK_SIZE_N": 256,
        "BLOCK_SIZE_K": 64,
        "GROUP_SIZE_M": 8,
        "num_stages": 5,
        "num_warps": 8,
        "ms": 0.008722803555428982,
        "min_ms": 0.008722803555428982,
        "max_ms": 0.008722803555428982,
        "compile_time": 0.4657711982727051
    },
    {
        "BLOCK_SIZE_M": 128,
        "BLOCK_SIZE_N": 32,
        "BLOCK_SIZE_K": 256,
        "GROUP_SIZE_M": 8,
        "num_stages": 1,
        "num_warps": 8,
        "ms": 0.008741267025470734,
        "min_ms": 0.008741267025470734,
        "max_ms": 0.008741267025470734,
        "compile_time": 0.5419118404388428
    },
    {
        "BLOCK_SIZE_M": 16,
        "BLOCK_SIZE_N": 128,
        "BLOCK_SIZE_K": 64,
        "GROUP_SIZE_M": 8,
        "num_stages": 3,
        "num_warps": 2,
        "ms": 0.008743863552808762,
        "min_ms": 0.008743863552808762,
        "max_ms": 0.008743863552808762,
        "compile_time": 0.4139566421508789
    },
    {
        "BLOCK_SIZE_M": 256,
        "BLOCK_SIZE_N": 16,
        "BLOCK_SIZE_K": 64,
        "GROUP_SIZE_M": 8,
        "num_stages": 4,
        "num_warps": 8,
        "ms": 0.008746633306145668,
        "min_ms": 0.008746633306145668,
        "max_ms": 0.008746633306145668,
        "compile_time": 0.5481116771697998
    },
    {
        "BLOCK_SIZE_M": 32,
        "BLOCK_SIZE_N": 64,
        "BLOCK_SIZE_K": 256,
        "GROUP_SIZE_M": 8,
        "num_stages": 1,
        "num_warps": 8,
        "ms": 0.008759617805480957,
        "min_ms": 0.008759617805480957,
        "max_ms": 0.008759617805480957,
        "compile_time": 0.447052001953125
    },
    {
        "BLOCK_SIZE_M": 16,
        "BLOCK_SIZE_N": 64,
        "BLOCK_SIZE_K": 32,
        "GROUP_SIZE_M": 8,
        "num_stages": 6,
        "num_warps": 4,
        "ms": 0.008764595724642277,
        "min_ms": 0.008764595724642277,
        "max_ms": 0.008764595724642277,
        "compile_time": 0.3946053981781006
    },
    {
        "BLOCK_SIZE_M": 16,
        "BLOCK_SIZE_N": 64,
        "BLOCK_SIZE_K": 32,
        "GROUP_SIZE_M": 8,
        "num_stages": 4,
        "num_warps": 4,
        "ms": 0.008774103596806526,
        "min_ms": 0.008774103596806526,
        "max_ms": 0.008774103596806526,
        "compile_time": 0.33778953552246094
    },
    {
        "BLOCK_SIZE_M": 32,
        "BLOCK_SIZE_N": 128,
        "BLOCK_SIZE_K": 256,
        "GROUP_SIZE_M": 8,
        "num_stages": 3,
        "num_warps": 16,
        "ms": 0.00877433829009533,
        "min_ms": 0.00877433829009533,
        "max_ms": 0.00877433829009533,
        "compile_time": 0.46751904487609863
    },
    {
        "BLOCK_SIZE_M": 64,
        "BLOCK_SIZE_N": 64,
        "BLOCK_SIZE_K": 512,
        "GROUP_SIZE_M": 8,
        "num_stages": 1,
        "num_warps": 16,
        "ms": 0.008785055950284004,
        "min_ms": 0.008785055950284004,
        "max_ms": 0.008785055950284004,
        "compile_time": 0.49684906005859375
    },
    {
        "BLOCK_SIZE_M": 128,
        "BLOCK_SIZE_N": 32,
        "BLOCK_SIZE_K": 32,
        "GROUP_SIZE_M": 8,
        "num_stages": 3,
        "num_warps": 2,
        "ms": 0.008790369145572186,
        "min_ms": 0.008790369145572186,
        "max_ms": 0.008790369145572186,
        "compile_time": 0.5446290969848633
    },
    {
        "BLOCK_SIZE_M": 256,
        "BLOCK_SIZE_N": 16,
        "BLOCK_SIZE_K": 32,
        "GROUP_SIZE_M": 8,
        "num_stages": 8,
        "num_warps": 4,
        "ms": 0.008802095428109169,
        "min_ms": 0.008802095428109169,
        "max_ms": 0.008802095428109169,
        "compile_time": 0.5505819320678711
    },
    {
        "BLOCK_SIZE_M": 128,
        "BLOCK_SIZE_N": 16,
        "BLOCK_SIZE_K": 64,
        "GROUP_SIZE_M": 8,
        "num_stages": 2,
        "num_warps": 4,
        "ms": 0.008808664977550507,
        "min_ms": 0.008808664977550507,
        "max_ms": 0.008808664977550507,
        "compile_time": 0.5239145755767822
    },
    {
        "BLOCK_SIZE_M": 64,
        "BLOCK_SIZE_N": 32,
        "BLOCK_SIZE_K": 256,
        "GROUP_SIZE_M": 8,
        "num_stages": 2,
        "num_warps": 8,
        "ms": 0.008816083893179893,
        "min_ms": 0.008816083893179893,
        "max_ms": 0.008816083893179893,
        "compile_time": 0.4893815517425537
    },
    {
        "BLOCK_SIZE_M": 16,
        "BLOCK_SIZE_N": 256,
        "BLOCK_SIZE_K": 32,
        "GROUP_SIZE_M": 8,
        "num_stages": 7,
        "num_warps": 8,
        "ms": 0.00882024597376585,
        "min_ms": 0.00882024597376585,
        "max_ms": 0.00882024597376585,
        "compile_time": 0.40459465980529785
    },
    {
        "BLOCK_SIZE_M": 64,
        "BLOCK_SIZE_N": 64,
        "BLOCK_SIZE_K": 32,
        "GROUP_SIZE_M": 8,
        "num_stages": 2,
        "num_warps": 4,
        "ms": 0.008826475590467453,
        "min_ms": 0.008826475590467453,
        "max_ms": 0.008826475590467453,
        "compile_time": 0.4915955066680908
    },
    {
        "BLOCK_SIZE_M": 64,
        "BLOCK_SIZE_N": 64,
        "BLOCK_SIZE_K": 128,
        "GROUP_SIZE_M": 8,
        "num_stages": 1,
        "num_warps": 16,
        "ms": 0.008830860257148743,
        "min_ms": 0.008830860257148743,
        "max_ms": 0.008830860257148743,
        "compile_time": 0.5011544227600098
    },
    {
        "BLOCK_SIZE_M": 64,
        "BLOCK_SIZE_N": 32,
        "BLOCK_SIZE_K": 256,
        "GROUP_SIZE_M": 8,
        "num_stages": 2,
        "num_warps": 2,
        "ms": 0.008830956183373928,
        "min_ms": 0.008830956183373928,
        "max_ms": 0.008830956183373928,
        "compile_time": 0.48424625396728516
    },
    {
        "BLOCK_SIZE_M": 256,
        "BLOCK_SIZE_N": 16,
        "BLOCK_SIZE_K": 32,
        "GROUP_SIZE_M": 8,
        "num_stages": 5,
        "num_warps": 8,
        "ms": 0.008831091225147247,
        "min_ms": 0.008831091225147247,
        "max_ms": 0.008831091225147247,
        "compile_time": 0.5432894229888916
    },
    {
        "BLOCK_SIZE_M": 32,
        "BLOCK_SIZE_N": 256,
        "BLOCK_SIZE_K": 32,
        "GROUP_SIZE_M": 8,
        "num_stages": 3,
        "num_warps": 8,
        "ms": 0.0088347177952528,
        "min_ms": 0.0088347177952528,
        "max_ms": 0.0088347177952528,
        "compile_time": 0.4659090042114258
    },
    {
        "BLOCK_SIZE_M": 128,
        "BLOCK_SIZE_N": 32,
        "BLOCK_SIZE_K": 128,
        "GROUP_SIZE_M": 8,
        "num_stages": 5,
        "num_warps": 2,
        "ms": 0.008837783709168434,
        "min_ms": 0.008837783709168434,
        "max_ms": 0.008837783709168434,
        "compile_time": 0.5280227661132812
    },
    {
        "BLOCK_SIZE_M": 32,
        "BLOCK_SIZE_N": 64,
        "BLOCK_SIZE_K": 256,
        "GROUP_SIZE_M": 8,
        "num_stages": 2,
        "num_warps": 8,
        "ms": 0.008840382099151611,
        "min_ms": 0.008840382099151611,
        "max_ms": 0.008840382099151611,
        "compile_time": 0.4508237838745117
    },
    {
        "BLOCK_SIZE_M": 256,
        "BLOCK_SIZE_N": 32,
        "BLOCK_SIZE_K": 32,
        "GROUP_SIZE_M": 8,
        "num_stages": 7,
        "num_warps": 4,
        "ms": 0.008852062746882439,
        "min_ms": 0.008852062746882439,
        "max_ms": 0.008852062746882439,
        "compile_time": 0.5373241901397705
    },
    {
        "BLOCK_SIZE_M": 16,
        "BLOCK_SIZE_N": 64,
        "BLOCK_SIZE_K": 32,
        "GROUP_SIZE_M": 8,
        "num_stages": 7,
        "num_warps": 4,
        "ms": 0.00885721854865551,
        "min_ms": 0.00885721854865551,
        "max_ms": 0.00885721854865551,
        "compile_time": 0.4011352062225342
    },
    {
        "BLOCK_SIZE_M": 256,
        "BLOCK_SIZE_N": 16,
        "BLOCK_SIZE_K": 128,
        "GROUP_SIZE_M": 8,
        "num_stages": 3,
        "num_warps": 8,
        "ms": 0.008857512846589088,
        "min_ms": 0.008857512846589088,
        "max_ms": 0.008857512846589088,
        "compile_time": 0.548027515411377
    },
    {
        "BLOCK_SIZE_M": 32,
        "BLOCK_SIZE_N": 64,
        "BLOCK_SIZE_K": 128,
        "GROUP_SIZE_M": 8,
        "num_stages": 7,
        "num_warps": 4,
        "ms": 0.0088584553450346,
        "min_ms": 0.0088584553450346,
        "max_ms": 0.0088584553450346,
        "compile_time": 0.4038710594177246
    },
    {
        "BLOCK_SIZE_M": 32,
        "BLOCK_SIZE_N": 64,
        "BLOCK_SIZE_K": 128,
        "GROUP_SIZE_M": 8,
        "num_stages": 1,
        "num_warps": 2,
        "ms": 0.00885994266718626,
        "min_ms": 0.00885994266718626,
        "max_ms": 0.00885994266718626,
        "compile_time": 0.4333760738372803
    },
    {
        "BLOCK_SIZE_M": 32,
        "BLOCK_SIZE_N": 32,
        "BLOCK_SIZE_K": 256,
        "GROUP_SIZE_M": 8,
        "num_stages": 3,
        "num_warps": 4,
        "ms": 0.008861991576850414,
        "min_ms": 0.008861991576850414,
        "max_ms": 0.008861991576850414,
        "compile_time": 0.44820284843444824
    },
    {
        "BLOCK_SIZE_M": 16,
        "BLOCK_SIZE_N": 64,
        "BLOCK_SIZE_K": 16,
        "GROUP_SIZE_M": 8,
        "num_stages": 8,
        "num_warps": 2,
        "ms": 0.00886416994035244,
        "min_ms": 0.00886416994035244,
        "max_ms": 0.00886416994035244,
        "compile_time": 0.4118988513946533
    },
    {
        "BLOCK_SIZE_M": 16,
        "BLOCK_SIZE_N": 64,
        "BLOCK_SIZE_K": 32,
        "GROUP_SIZE_M": 8,
        "num_stages": 3,
        "num_warps": 2,
        "ms": 0.008870059624314308,
        "min_ms": 0.008870059624314308,
        "max_ms": 0.008870059624314308,
        "compile_time": 0.39292216300964355
    },
    {
        "BLOCK_SIZE_M": 16,
        "BLOCK_SIZE_N": 128,
        "BLOCK_SIZE_K": 32,
        "GROUP_SIZE_M": 8,
        "num_stages": 3,
        "num_warps": 2,
        "ms": 0.0088734719902277,
        "min_ms": 0.0088734719902277,
        "max_ms": 0.0088734719902277,
        "compile_time": 0.39121246337890625
    },
    {
        "BLOCK_SIZE_M": 16,
        "BLOCK_SIZE_N": 256,
        "BLOCK_SIZE_K": 32,
        "GROUP_SIZE_M": 8,
        "num_stages": 7,
        "num_warps": 2,
        "ms": 0.008875111117959023,
        "min_ms": 0.008875111117959023,
        "max_ms": 0.008875111117959023,
        "compile_time": 0.41444826126098633
    },
    {
        "BLOCK_SIZE_M": 16,
        "BLOCK_SIZE_N": 128,
        "BLOCK_SIZE_K": 32,
        "GROUP_SIZE_M": 8,
        "num_stages": 7,
        "num_warps": 4,
        "ms": 0.008875397965312004,
        "min_ms": 0.008875397965312004,
        "max_ms": 0.008875397965312004,
        "compile_time": 0.40366244316101074
    },
    {
        "BLOCK_SIZE_M": 64,
        "BLOCK_SIZE_N": 16,
        "BLOCK_SIZE_K": 32,
        "GROUP_SIZE_M": 8,
        "num_stages": 6,
        "num_warps": 2,
        "ms": 0.008877935819327831,
        "min_ms": 0.008877935819327831,
        "max_ms": 0.008877935819327831,
        "compile_time": 0.479433536529541
    },
    {
        "BLOCK_SIZE_M": 32,
        "BLOCK_SIZE_N": 128,
        "BLOCK_SIZE_K": 128,
        "GROUP_SIZE_M": 8,
        "num_stages": 5,
        "num_warps": 2,
        "ms": 0.008878780528903008,
        "min_ms": 0.008878780528903008,
        "max_ms": 0.008878780528903008,
        "compile_time": 0.4615452289581299
    },
    {
        "BLOCK_SIZE_M": 64,
        "BLOCK_SIZE_N": 128,
        "BLOCK_SIZE_K": 64,
        "GROUP_SIZE_M": 8,
        "num_stages": 2,
        "num_warps": 4,
        "ms": 0.008880820125341415,
        "min_ms": 0.008880820125341415,
        "max_ms": 0.008880820125341415,
        "compile_time": 0.5007717609405518
    },
    {
        "BLOCK_SIZE_M": 16,
        "BLOCK_SIZE_N": 32,
        "BLOCK_SIZE_K": 128,
        "GROUP_SIZE_M": 8,
        "num_stages": 2,
        "num_warps": 2,
        "ms": 0.008882671594619751,
        "min_ms": 0.008882671594619751,
        "max_ms": 0.008882671594619751,
        "compile_time": 0.3909335136413574
    },
    {
        "BLOCK_SIZE_M": 16,
        "BLOCK_SIZE_N": 128,
        "BLOCK_SIZE_K": 32,
        "GROUP_SIZE_M": 8,
        "num_stages": 3,
        "num_warps": 4,
        "ms": 0.00888433214277029,
        "min_ms": 0.00888433214277029,
        "max_ms": 0.00888433214277029,
        "compile_time": 0.4046144485473633
    },
    {
        "BLOCK_SIZE_M": 32,
        "BLOCK_SIZE_N": 128,
        "BLOCK_SIZE_K": 16,
        "GROUP_SIZE_M": 8,
        "num_stages": 3,
        "num_warps": 4,
        "ms": 0.008891679346561432,
        "min_ms": 0.008891679346561432,
        "max_ms": 0.008891679346561432,
        "compile_time": 0.46676063537597656
    },
    {
        "BLOCK_SIZE_M": 128,
        "BLOCK_SIZE_N": 16,
        "BLOCK_SIZE_K": 32,
        "GROUP_SIZE_M": 8,
        "num_stages": 3,
        "num_warps": 4,
        "ms": 0.00889639649540186,
        "min_ms": 0.00889639649540186,
        "max_ms": 0.00889639649540186,
        "compile_time": 0.5347599983215332
    },
    {
        "BLOCK_SIZE_M": 16,
        "BLOCK_SIZE_N": 256,
        "BLOCK_SIZE_K": 32,
        "GROUP_SIZE_M": 8,
        "num_stages": 6,
        "num_warps": 8,
        "ms": 0.008899126201868057,
        "min_ms": 0.008899126201868057,
        "max_ms": 0.008899126201868057,
        "compile_time": 0.41510820388793945
    },
    {
        "BLOCK_SIZE_M": 16,
        "BLOCK_SIZE_N": 64,
        "BLOCK_SIZE_K": 16,
        "GROUP_SIZE_M": 8,
        "num_stages": 6,
        "num_warps": 2,
        "ms": 0.008909754455089569,
        "min_ms": 0.008909754455089569,
        "max_ms": 0.008909754455089569,
        "compile_time": 0.34192943572998047
    },
    {
        "BLOCK_SIZE_M": 256,
        "BLOCK_SIZE_N": 16,
        "BLOCK_SIZE_K": 32,
        "GROUP_SIZE_M": 8,
        "num_stages": 8,
        "num_warps": 2,
        "ms": 0.008910241536796093,
        "min_ms": 0.008910241536796093,
        "max_ms": 0.008910241536796093,
        "compile_time": 0.5474646091461182
    },
    {
        "BLOCK_SIZE_M": 64,
        "BLOCK_SIZE_N": 32,
        "BLOCK_SIZE_K": 128,
        "GROUP_SIZE_M": 8,
        "num_stages": 6,
        "num_warps": 4,
        "ms": 0.00891277939081192,
        "min_ms": 0.00891277939081192,
        "max_ms": 0.00891277939081192,
        "compile_time": 0.48999571800231934
    },
    {
        "BLOCK_SIZE_M": 16,
        "BLOCK_SIZE_N": 64,
        "BLOCK_SIZE_K": 128,
        "GROUP_SIZE_M": 8,
        "num_stages": 2,
        "num_warps": 4,
        "ms": 0.008913136087357998,
        "min_ms": 0.008913136087357998,
        "max_ms": 0.008913136087357998,
        "compile_time": 0.40027427673339844
    },
    {
        "BLOCK_SIZE_M": 32,
        "BLOCK_SIZE_N": 32,
        "BLOCK_SIZE_K": 128,
        "GROUP_SIZE_M": 8,
        "num_stages": 5,
        "num_warps": 4,
        "ms": 0.008916390128433704,
        "min_ms": 0.008916390128433704,
        "max_ms": 0.008916390128433704,
        "compile_time": 0.4429819583892822
    },
    {
        "BLOCK_SIZE_M": 16,
        "BLOCK_SIZE_N": 64,
        "BLOCK_SIZE_K": 16,
        "GROUP_SIZE_M": 8,
        "num_stages": 7,
        "num_warps": 2,
        "ms": 0.00891842320561409,
        "min_ms": 0.00891842320561409,
        "max_ms": 0.00891842320561409,
        "compile_time": 0.3532228469848633
    },
    {
        "BLOCK_SIZE_M": 32,
        "BLOCK_SIZE_N": 64,
        "BLOCK_SIZE_K": 16,
        "GROUP_SIZE_M": 8,
        "num_stages": 3,
        "num_warps": 2,
        "ms": 0.008922472596168518,
        "min_ms": 0.008922472596168518,
        "max_ms": 0.008922472596168518,
        "compile_time": 0.4786067008972168
    },
    {
        "BLOCK_SIZE_M": 128,
        "BLOCK_SIZE_N": 32,
        "BLOCK_SIZE_K": 128,
        "GROUP_SIZE_M": 8,
        "num_stages": 5,
        "num_warps": 16,
        "ms": 0.00892375223338604,
        "min_ms": 0.00892375223338604,
        "max_ms": 0.00892375223338604,
        "compile_time": 0.5422406196594238
    },
    {
        "BLOCK_SIZE_M": 64,
        "BLOCK_SIZE_N": 16,
        "BLOCK_SIZE_K": 128,
        "GROUP_SIZE_M": 8,
        "num_stages": 3,
        "num_warps": 4,
        "ms": 0.008925309404730797,
        "min_ms": 0.008925309404730797,
        "max_ms": 0.008925309404730797,
        "compile_time": 0.47895002365112305
    },
    {
        "BLOCK_SIZE_M": 32,
        "BLOCK_SIZE_N": 32,
        "BLOCK_SIZE_K": 256,
        "GROUP_SIZE_M": 8,
        "num_stages": 1,
        "num_warps": 4,
        "ms": 0.00892635714262724,
        "min_ms": 0.00892635714262724,
        "max_ms": 0.00892635714262724,
        "compile_time": 0.46051478385925293
    },
    {
        "BLOCK_SIZE_M": 256,
        "BLOCK_SIZE_N": 16,
        "BLOCK_SIZE_K": 64,
        "GROUP_SIZE_M": 8,
        "num_stages": 5,
        "num_warps": 8,
        "ms": 0.008940597996115685,
        "min_ms": 0.008940597996115685,
        "max_ms": 0.008940597996115685,
        "compile_time": 0.5583822727203369
    },
    {
        "BLOCK_SIZE_M": 32,
        "BLOCK_SIZE_N": 16,
        "BLOCK_SIZE_K": 64,
        "GROUP_SIZE_M": 8,
        "num_stages": 4,
        "num_warps": 2,
        "ms": 0.008942201733589172,
        "min_ms": 0.008942201733589172,
        "max_ms": 0.008942201733589172,
        "compile_time": 0.4313991069793701
    },
    {
        "BLOCK_SIZE_M": 16,
        "BLOCK_SIZE_N": 32,
        "BLOCK_SIZE_K": 64,
        "GROUP_SIZE_M": 8,
        "num_stages": 3,
        "num_warps": 4,
        "ms": 0.008947402238845825,
        "min_ms": 0.008947402238845825,
        "max_ms": 0.008947402238845825,
        "compile_time": 0.329714298248291
    },
    {
        "BLOCK_SIZE_M": 16,
        "BLOCK_SIZE_N": 256,
        "BLOCK_SIZE_K": 32,
        "GROUP_SIZE_M": 8,
        "num_stages": 8,
        "num_warps": 2,
        "ms": 0.008953978307545185,
        "min_ms": 0.008953978307545185,
        "max_ms": 0.008953978307545185,
        "compile_time": 0.40375256538391113
    },
    {
        "BLOCK_SIZE_M": 16,
        "BLOCK_SIZE_N": 128,
        "BLOCK_SIZE_K": 32,
        "GROUP_SIZE_M": 8,
        "num_stages": 7,
        "num_warps": 2,
        "ms": 0.008955026045441628,
        "min_ms": 0.008955026045441628,
        "max_ms": 0.008955026045441628,
        "compile_time": 0.38463497161865234
    },
    {
        "BLOCK_SIZE_M": 16,
        "BLOCK_SIZE_N": 256,
        "BLOCK_SIZE_K": 64,
        "GROUP_SIZE_M": 8,
        "num_stages": 3,
        "num_warps": 8,
        "ms": 0.008959382772445679,
        "min_ms": 0.008959382772445679,
        "max_ms": 0.008959382772445679,
        "compile_time": 0.41800975799560547
    },
    {
        "BLOCK_SIZE_M": 32,
        "BLOCK_SIZE_N": 64,
        "BLOCK_SIZE_K": 64,
        "GROUP_SIZE_M": 8,
        "num_stages": 7,
        "num_warps": 8,
        "ms": 0.00896239373832941,
        "min_ms": 0.00896239373832941,
        "max_ms": 0.00896239373832941,
        "compile_time": 0.44712328910827637
    },
    {
        "BLOCK_SIZE_M": 64,
        "BLOCK_SIZE_N": 16,
        "BLOCK_SIZE_K": 32,
        "GROUP_SIZE_M": 8,
        "num_stages": 3,
        "num_warps": 4,
        "ms": 0.008964083157479763,
        "min_ms": 0.008964083157479763,
        "max_ms": 0.008964083157479763,
        "compile_time": 0.4754335880279541
    },
    {
        "BLOCK_SIZE_M": 32,
        "BLOCK_SIZE_N": 128,
        "BLOCK_SIZE_K": 256,
        "GROUP_SIZE_M": 8,
        "num_stages": 1,
        "num_warps": 8,
        "ms": 0.008972760289907455,
        "min_ms": 0.008972760289907455,
        "max_ms": 0.008972760289907455,
        "compile_time": 0.40346288681030273
    },
    {
        "BLOCK_SIZE_M": 16,
        "BLOCK_SIZE_N": 256,
        "BLOCK_SIZE_K": 32,
        "GROUP_SIZE_M": 8,
        "num_stages": 8,
        "num_warps": 8,
        "ms": 0.008973898366093636,
        "min_ms": 0.008973898366093636,
        "max_ms": 0.008973898366093636,
        "compile_time": 0.402083158493042
    },
    {
        "BLOCK_SIZE_M": 64,
        "BLOCK_SIZE_N": 32,
        "BLOCK_SIZE_K": 128,
        "GROUP_SIZE_M": 8,
        "num_stages": 1,
        "num_warps": 8,
        "ms": 0.008975631557404995,
        "min_ms": 0.008975631557404995,
        "max_ms": 0.008975631557404995,
        "compile_time": 0.49274420738220215
    },
    {
        "BLOCK_SIZE_M": 32,
        "BLOCK_SIZE_N": 64,
        "BLOCK_SIZE_K": 256,
        "GROUP_SIZE_M": 8,
        "num_stages": 2,
        "num_warps": 2,
        "ms": 0.008980241604149342,
        "min_ms": 0.008980241604149342,
        "max_ms": 0.008980241604149342,
        "compile_time": 0.31053876876831055
    },
    {
        "BLOCK_SIZE_M": 256,
        "BLOCK_SIZE_N": 16,
        "BLOCK_SIZE_K": 32,
        "GROUP_SIZE_M": 8,
        "num_stages": 6,
        "num_warps": 8,
        "ms": 0.008980507962405682,
        "min_ms": 0.008980507962405682,
        "max_ms": 0.008980507962405682,
        "compile_time": 0.5461993217468262
    },
    {
        "BLOCK_SIZE_M": 64,
        "BLOCK_SIZE_N": 128,
        "BLOCK_SIZE_K": 128,
        "GROUP_SIZE_M": 8,
        "num_stages": 2,
        "num_warps": 4,
        "ms": 0.008983507752418518,
        "min_ms": 0.008983507752418518,
        "max_ms": 0.008983507752418518,
        "compile_time": 0.5075616836547852
    },
    {
        "BLOCK_SIZE_M": 32,
        "BLOCK_SIZE_N": 64,
        "BLOCK_SIZE_K": 32,
        "GROUP_SIZE_M": 8,
        "num_stages": 3,
        "num_warps": 8,
        "ms": 0.008987407200038433,
        "min_ms": 0.008987407200038433,
        "max_ms": 0.008987407200038433,
        "compile_time": 0.4530036449432373
    },
    {
        "BLOCK_SIZE_M": 32,
        "BLOCK_SIZE_N": 128,
        "BLOCK_SIZE_K": 128,
        "GROUP_SIZE_M": 8,
        "num_stages": 4,
        "num_warps": 2,
        "ms": 0.008988630026578903,
        "min_ms": 0.008988630026578903,
        "max_ms": 0.008988630026578903,
        "compile_time": 0.462186336517334
    },
    {
        "BLOCK_SIZE_M": 32,
        "BLOCK_SIZE_N": 16,
        "BLOCK_SIZE_K": 128,
        "GROUP_SIZE_M": 8,
        "num_stages": 2,
        "num_warps": 2,
        "ms": 0.008991929702460766,
        "min_ms": 0.008991929702460766,
        "max_ms": 0.008991929702460766,
        "compile_time": 0.45699071884155273
    },
    {
        "BLOCK_SIZE_M": 16,
        "BLOCK_SIZE_N": 128,
        "BLOCK_SIZE_K": 128,
        "GROUP_SIZE_M": 8,
        "num_stages": 3,
        "num_warps": 4,
        "ms": 0.008992739021778107,
        "min_ms": 0.008992739021778107,
        "max_ms": 0.008992739021778107,
        "compile_time": 0.40537285804748535
    },
    {
        "BLOCK_SIZE_M": 128,
        "BLOCK_SIZE_N": 32,
        "BLOCK_SIZE_K": 32,
        "GROUP_SIZE_M": 8,
        "num_stages": 3,
        "num_warps": 16,
        "ms": 0.008995046839118004,
        "min_ms": 0.008995046839118004,
        "max_ms": 0.008995046839118004,
        "compile_time": 0.5298707485198975
    },
    {
        "BLOCK_SIZE_M": 128,
        "BLOCK_SIZE_N": 32,
        "BLOCK_SIZE_K": 64,
        "GROUP_SIZE_M": 8,
        "num_stages": 7,
        "num_warps": 16,
        "ms": 0.009000098332762718,
        "min_ms": 0.009000098332762718,
        "max_ms": 0.009000098332762718,
        "compile_time": 0.5384261608123779
    },
    {
        "BLOCK_SIZE_M": 128,
        "BLOCK_SIZE_N": 64,
        "BLOCK_SIZE_K": 32,
        "GROUP_SIZE_M": 8,
        "num_stages": 4,
        "num_warps": 2,
        "ms": 0.009005661122500896,
        "min_ms": 0.009005661122500896,
        "max_ms": 0.009005661122500896,
        "compile_time": 0.5377295017242432
    },
    {
        "BLOCK_SIZE_M": 256,
        "BLOCK_SIZE_N": 32,
        "BLOCK_SIZE_K": 32,
        "GROUP_SIZE_M": 8,
        "num_stages": 8,
        "num_warps": 4,
        "ms": 0.009009202942252159,
        "min_ms": 0.009009202942252159,
        "max_ms": 0.009009202942252159,
        "compile_time": 0.5510959625244141
    },
    {
        "BLOCK_SIZE_M": 128,
        "BLOCK_SIZE_N": 64,
        "BLOCK_SIZE_K": 32,
        "GROUP_SIZE_M": 8,
        "num_stages": 3,
        "num_warps": 2,
        "ms": 0.009011199697852135,
        "min_ms": 0.009011199697852135,
        "max_ms": 0.009011199697852135,
        "compile_time": 0.5543859004974365
    },
    {
        "BLOCK_SIZE_M": 128,
        "BLOCK_SIZE_N": 64,
        "BLOCK_SIZE_K": 32,
        "GROUP_SIZE_M": 8,
        "num_stages": 5,
        "num_warps": 2,
        "ms": 0.009026988409459591,
        "min_ms": 0.009026988409459591,
        "max_ms": 0.009026988409459591,
        "compile_time": 0.5465078353881836
    },
    {
        "BLOCK_SIZE_M": 256,
        "BLOCK_SIZE_N": 16,
        "BLOCK_SIZE_K": 64,
        "GROUP_SIZE_M": 8,
        "num_stages": 4,
        "num_warps": 2,
        "ms": 0.009027994237840176,
        "min_ms": 0.009027994237840176,
        "max_ms": 0.009027994237840176,
        "compile_time": 0.5617203712463379
    },
    {
        "BLOCK_SIZE_M": 16,
        "BLOCK_SIZE_N": 64,
        "BLOCK_SIZE_K": 32,
        "GROUP_SIZE_M": 8,
        "num_stages": 8,
        "num_warps": 4,
        "ms": 0.00903300940990448,
        "min_ms": 0.00903300940990448,
        "max_ms": 0.00903300940990448,
        "compile_time": 0.4060361385345459
    },
    {
        "BLOCK_SIZE_M": 16,
        "BLOCK_SIZE_N": 128,
        "BLOCK_SIZE_K": 128,
        "GROUP_SIZE_M": 8,
        "num_stages": 3,
        "num_warps": 8,
        "ms": 0.009045636281371117,
        "min_ms": 0.009045636281371117,
        "max_ms": 0.009045636281371117,
        "compile_time": 0.4110746383666992
    },
    {
        "BLOCK_SIZE_M": 32,
        "BLOCK_SIZE_N": 64,
        "BLOCK_SIZE_K": 32,
        "GROUP_SIZE_M": 8,
        "num_stages": 4,
        "num_warps": 8,
        "ms": 0.009046000428497791,
        "min_ms": 0.009046000428497791,
        "max_ms": 0.009046000428497791,
        "compile_time": 0.4547696113586426
    },
    {
        "BLOCK_SIZE_M": 64,
        "BLOCK_SIZE_N": 32,
        "BLOCK_SIZE_K": 64,
        "GROUP_SIZE_M": 8,
        "num_stages": 7,
        "num_warps": 8,
        "ms": 0.009046556428074837,
        "min_ms": 0.009046556428074837,
        "max_ms": 0.009046556428074837,
        "compile_time": 0.49767231941223145
    },
    {
        "BLOCK_SIZE_M": 32,
        "BLOCK_SIZE_N": 128,
        "BLOCK_SIZE_K": 32,
        "GROUP_SIZE_M": 8,
        "num_stages": 5,
        "num_warps": 16,
        "ms": 0.009047036990523338,
        "min_ms": 0.009047036990523338,
        "max_ms": 0.009047036990523338,
        "compile_time": 0.453125
    },
    {
        "BLOCK_SIZE_M": 32,
        "BLOCK_SIZE_N": 64,
        "BLOCK_SIZE_K": 128,
        "GROUP_SIZE_M": 8,
        "num_stages": 1,
        "num_warps": 8,
        "ms": 0.009064273908734322,
        "min_ms": 0.009064273908734322,
        "max_ms": 0.009064273908734322,
        "compile_time": 0.467029333114624
    },
    {
        "BLOCK_SIZE_M": 64,
        "BLOCK_SIZE_N": 64,
        "BLOCK_SIZE_K": 64,
        "GROUP_SIZE_M": 8,
        "num_stages": 2,
        "num_warps": 16,
        "ms": 0.009071337059140205,
        "min_ms": 0.009071337059140205,
        "max_ms": 0.009071337059140205,
        "compile_time": 0.4917182922363281
    },
    {
        "BLOCK_SIZE_M": 32,
        "BLOCK_SIZE_N": 128,
        "BLOCK_SIZE_K": 256,
        "GROUP_SIZE_M": 8,
        "num_stages": 1,
        "num_warps": 16,
        "ms": 0.009072141721844673,
        "min_ms": 0.009072141721844673,
        "max_ms": 0.009072141721844673,
        "compile_time": 0.46437525749206543
    },
    {
        "BLOCK_SIZE_M": 32,
        "BLOCK_SIZE_N": 16,
        "BLOCK_SIZE_K": 128,
        "GROUP_SIZE_M": 8,
        "num_stages": 3,
        "num_warps": 2,
        "ms": 0.00907608587294817,
        "min_ms": 0.00907608587294817,
        "max_ms": 0.00907608587294817,
        "compile_time": 0.47588300704956055
    },
    {
        "BLOCK_SIZE_M": 32,
        "BLOCK_SIZE_N": 128,
        "BLOCK_SIZE_K": 64,
        "GROUP_SIZE_M": 8,
        "num_stages": 8,
        "num_warps": 16,
        "ms": 0.009076413698494434,
        "min_ms": 0.009076413698494434,
        "max_ms": 0.009076413698494434,
        "compile_time": 0.468050479888916
    },
    {
        "BLOCK_SIZE_M": 64,
        "BLOCK_SIZE_N": 16,
        "BLOCK_SIZE_K": 64,
        "GROUP_SIZE_M": 8,
        "num_stages": 6,
        "num_warps": 2,
        "ms": 0.009077692404389381,
        "min_ms": 0.009077692404389381,
        "max_ms": 0.009077692404389381,
        "compile_time": 0.4893677234649658
    },
    {
        "BLOCK_SIZE_M": 32,
        "BLOCK_SIZE_N": 64,
        "BLOCK_SIZE_K": 16,
        "GROUP_SIZE_M": 8,
        "num_stages": 5,
        "num_warps": 2,
        "ms": 0.009078236296772957,
        "min_ms": 0.009078236296772957,
        "max_ms": 0.009078236296772957,
        "compile_time": 0.4631526470184326
    },
    {
        "BLOCK_SIZE_M": 32,
        "BLOCK_SIZE_N": 128,
        "BLOCK_SIZE_K": 32,
        "GROUP_SIZE_M": 8,
        "num_stages": 4,
        "num_warps": 16,
        "ms": 0.009079021401703358,
        "min_ms": 0.009079021401703358,
        "max_ms": 0.009079021401703358,
        "compile_time": 0.4611382484436035
    },
    {
        "BLOCK_SIZE_M": 16,
        "BLOCK_SIZE_N": 128,
        "BLOCK_SIZE_K": 32,
        "GROUP_SIZE_M": 8,
        "num_stages": 8,
        "num_warps": 2,
        "ms": 0.009080405347049236,
        "min_ms": 0.009080405347049236,
        "max_ms": 0.009080405347049236,
        "compile_time": 0.4028005599975586
    },
    {
        "BLOCK_SIZE_M": 256,
        "BLOCK_SIZE_N": 16,
        "BLOCK_SIZE_K": 64,
        "GROUP_SIZE_M": 8,
        "num_stages": 3,
        "num_warps": 2,
        "ms": 0.009082335978746414,
        "min_ms": 0.009082335978746414,
        "max_ms": 0.009082335978746414,
        "compile_time": 0.5568621158599854
    },
    {
        "BLOCK_SIZE_M": 32,
        "BLOCK_SIZE_N": 256,
        "BLOCK_SIZE_K": 32,
        "GROUP_SIZE_M": 8,
        "num_stages": 6,
        "num_warps": 8,
        "ms": 0.009083242155611515,
        "min_ms": 0.009083242155611515,
        "max_ms": 0.009083242155611515,
        "compile_time": 0.4723930358886719
    },
    {
        "BLOCK_SIZE_M": 128,
        "BLOCK_SIZE_N": 32,
        "BLOCK_SIZE_K": 32,
        "GROUP_SIZE_M": 8,
        "num_stages": 4,
        "num_warps": 16,
        "ms": 0.009083469398319721,
        "min_ms": 0.009083469398319721,
        "max_ms": 0.009083469398319721,
        "compile_time": 0.534642219543457
    },
    {
        "BLOCK_SIZE_M": 64,
        "BLOCK_SIZE_N": 64,
        "BLOCK_SIZE_K": 16,
        "GROUP_SIZE_M": 8,
        "num_stages": 3,
        "num_warps": 2,
        "ms": 0.009084582328796387,
        "min_ms": 0.009084582328796387,
        "max_ms": 0.009084582328796387,
        "compile_time": 0.4995553493499756
    },
    {
        "BLOCK_SIZE_M": 32,
        "BLOCK_SIZE_N": 64,
        "BLOCK_SIZE_K": 256,
        "GROUP_SIZE_M": 8,
        "num_stages": 3,
        "num_warps": 4,
        "ms": 0.009085504338145256,
        "min_ms": 0.009085504338145256,
        "max_ms": 0.009085504338145256,
        "compile_time": 0.4526233673095703
    },
    {
        "BLOCK_SIZE_M": 16,
        "BLOCK_SIZE_N": 128,
        "BLOCK_SIZE_K": 64,
        "GROUP_SIZE_M": 8,
        "num_stages": 4,
        "num_warps": 2,
        "ms": 0.009085804224014282,
        "min_ms": 0.009085804224014282,
        "max_ms": 0.009085804224014282,
        "compile_time": 0.41377878189086914
    },
    {
        "BLOCK_SIZE_M": 64,
        "BLOCK_SIZE_N": 64,
        "BLOCK_SIZE_K": 16,
        "GROUP_SIZE_M": 8,
        "num_stages": 5,
        "num_warps": 2,
        "ms": 0.00908780936151743,
        "min_ms": 0.00908780936151743,
        "max_ms": 0.00908780936151743,
        "compile_time": 0.4937913417816162
    },
    {
        "BLOCK_SIZE_M": 32,
        "BLOCK_SIZE_N": 256,
        "BLOCK_SIZE_K": 32,
        "GROUP_SIZE_M": 8,
        "num_stages": 4,
        "num_warps": 8,
        "ms": 0.009096696972846985,
        "min_ms": 0.009096696972846985,
        "max_ms": 0.009096696972846985,
        "compile_time": 0.4819614887237549
    },
    {
        "BLOCK_SIZE_M": 64,
        "BLOCK_SIZE_N": 64,
        "BLOCK_SIZE_K": 16,
        "GROUP_SIZE_M": 8,
        "num_stages": 6,
        "num_warps": 2,
        "ms": 0.009100258350372314,
        "min_ms": 0.009100258350372314,
        "max_ms": 0.009100258350372314,
        "compile_time": 0.5073740482330322
    },
    {
        "BLOCK_SIZE_M": 64,
        "BLOCK_SIZE_N": 32,
        "BLOCK_SIZE_K": 32,
        "GROUP_SIZE_M": 8,
        "num_stages": 3,
        "num_warps": 8,
        "ms": 0.009103560820221901,
        "min_ms": 0.009103560820221901,
        "max_ms": 0.009103560820221901,
        "compile_time": 0.48001956939697266
    },
    {
        "BLOCK_SIZE_M": 16,
        "BLOCK_SIZE_N": 32,
        "BLOCK_SIZE_K": 64,
        "GROUP_SIZE_M": 8,
        "num_stages": 6,
        "num_warps": 2,
        "ms": 0.00910448282957077,
        "min_ms": 0.00910448282957077,
        "max_ms": 0.00910448282957077,
        "compile_time": 0.39133644104003906
    },
    {
        "BLOCK_SIZE_M": 16,
        "BLOCK_SIZE_N": 256,
        "BLOCK_SIZE_K": 32,
        "GROUP_SIZE_M": 8,
        "num_stages": 3,
        "num_warps": 4,
        "ms": 0.009106123819947243,
        "min_ms": 0.009106123819947243,
        "max_ms": 0.009106123819947243,
        "compile_time": 0.41277360916137695
    },
    {
        "BLOCK_SIZE_M": 32,
        "BLOCK_SIZE_N": 128,
        "BLOCK_SIZE_K": 32,
        "GROUP_SIZE_M": 8,
        "num_stages": 3,
        "num_warps": 16,
        "ms": 0.009109040722250938,
        "min_ms": 0.009109040722250938,
        "max_ms": 0.009109040722250938,
        "compile_time": 0.467318058013916
    },
    {
        "BLOCK_SIZE_M": 32,
        "BLOCK_SIZE_N": 256,
        "BLOCK_SIZE_K": 32,
        "GROUP_SIZE_M": 8,
        "num_stages": 7,
        "num_warps": 8,
        "ms": 0.009109272621572018,
        "min_ms": 0.009109272621572018,
        "max_ms": 0.009109272621572018,
        "compile_time": 0.4677436351776123
    },
    {
        "BLOCK_SIZE_M": 64,
        "BLOCK_SIZE_N": 32,
        "BLOCK_SIZE_K": 32,
        "GROUP_SIZE_M": 8,
        "num_stages": 4,
        "num_warps": 8,
        "ms": 0.009115273132920265,
        "min_ms": 0.009115273132920265,
        "max_ms": 0.009115273132920265,
        "compile_time": 0.48973822593688965
    },
    {
        "BLOCK_SIZE_M": 16,
        "BLOCK_SIZE_N": 128,
        "BLOCK_SIZE_K": 64,
        "GROUP_SIZE_M": 8,
        "num_stages": 3,
        "num_warps": 8,
        "ms": 0.009118733927607536,
        "min_ms": 0.009118733927607536,
        "max_ms": 0.009118733927607536,
        "compile_time": 0.4081234931945801
    },
    {
        "BLOCK_SIZE_M": 64,
        "BLOCK_SIZE_N": 64,
        "BLOCK_SIZE_K": 16,
        "GROUP_SIZE_M": 8,
        "num_stages": 4,
        "num_warps": 2,
        "ms": 0.009119657799601555,
        "min_ms": 0.009119657799601555,
        "max_ms": 0.009119657799601555,
        "compile_time": 0.4966623783111572
    },
    {
        "BLOCK_SIZE_M": 16,
        "BLOCK_SIZE_N": 32,
        "BLOCK_SIZE_K": 32,
        "GROUP_SIZE_M": 8,
        "num_stages": 7,
        "num_warps": 2,
        "ms": 0.00912322849035263,
        "min_ms": 0.00912322849035263,
        "max_ms": 0.00912322849035263,
        "compile_time": 0.38779330253601074
    },
    {
        "BLOCK_SIZE_M": 128,
        "BLOCK_SIZE_N": 32,
        "BLOCK_SIZE_K": 256,
        "GROUP_SIZE_M": 8,
        "num_stages": 3,
        "num_warps": 16,
        "ms": 0.009124718606472015,
        "min_ms": 0.009124718606472015,
        "max_ms": 0.009124718606472015,
        "compile_time": 0.5456767082214355
    },
    {
        "BLOCK_SIZE_M": 16,
        "BLOCK_SIZE_N": 64,
        "BLOCK_SIZE_K": 16,
        "GROUP_SIZE_M": 8,
        "num_stages": 5,
        "num_warps": 2,
        "ms": 0.009126400575041771,
        "min_ms": 0.009126400575041771,
        "max_ms": 0.009126400575041771,
        "compile_time": 0.39817190170288086
    },
    {
        "BLOCK_SIZE_M": 32,
        "BLOCK_SIZE_N": 256,
        "BLOCK_SIZE_K": 128,
        "GROUP_SIZE_M": 8,
        "num_stages": 3,
        "num_warps": 8,
        "ms": 0.009132111445069313,
        "min_ms": 0.009132111445069313,
        "max_ms": 0.009132111445069313,
        "compile_time": 0.4880802631378174
    },
    {
        "BLOCK_SIZE_M": 32,
        "BLOCK_SIZE_N": 64,
        "BLOCK_SIZE_K": 16,
        "GROUP_SIZE_M": 8,
        "num_stages": 7,
        "num_warps": 2,
        "ms": 0.009133309125900269,
        "min_ms": 0.009133309125900269,
        "max_ms": 0.009133309125900269,
        "compile_time": 0.4509694576263428
    },
    {
        "BLOCK_SIZE_M": 16,
        "BLOCK_SIZE_N": 128,
        "BLOCK_SIZE_K": 32,
        "GROUP_SIZE_M": 8,
        "num_stages": 6,
        "num_warps": 2,
        "ms": 0.009136136621236801,
        "min_ms": 0.009136136621236801,
        "max_ms": 0.009136136621236801,
        "compile_time": 0.3981039524078369
    },
    {
        "BLOCK_SIZE_M": 64,
        "BLOCK_SIZE_N": 16,
        "BLOCK_SIZE_K": 64,
        "GROUP_SIZE_M": 8,
        "num_stages": 5,
        "num_warps": 4,
        "ms": 0.009138118475675583,
        "min_ms": 0.009138118475675583,
        "max_ms": 0.009138118475675583,
        "compile_time": 0.48636698722839355
    },
    {
        "BLOCK_SIZE_M": 64,
        "BLOCK_SIZE_N": 32,
        "BLOCK_SIZE_K": 64,
        "GROUP_SIZE_M": 8,
        "num_stages": 8,
        "num_warps": 2,
        "ms": 0.009138633497059345,
        "min_ms": 0.009138633497059345,
        "max_ms": 0.009138633497059345,
        "compile_time": 0.4956390857696533
    },
    {
        "BLOCK_SIZE_M": 128,
        "BLOCK_SIZE_N": 64,
        "BLOCK_SIZE_K": 32,
        "GROUP_SIZE_M": 8,
        "num_stages": 6,
        "num_warps": 2,
        "ms": 0.009142092429101467,
        "min_ms": 0.009142092429101467,
        "max_ms": 0.009142092429101467,
        "compile_time": 0.537003755569458
    },
    {
        "BLOCK_SIZE_M": 32,
        "BLOCK_SIZE_N": 128,
        "BLOCK_SIZE_K": 128,
        "GROUP_SIZE_M": 8,
        "num_stages": 2,
        "num_warps": 2,
        "ms": 0.009143589064478874,
        "min_ms": 0.009143589064478874,
        "max_ms": 0.009143589064478874,
        "compile_time": 0.4770317077636719
    },
    {
        "BLOCK_SIZE_M": 16,
        "BLOCK_SIZE_N": 128,
        "BLOCK_SIZE_K": 32,
        "GROUP_SIZE_M": 8,
        "num_stages": 8,
        "num_warps": 4,
        "ms": 0.009150413796305656,
        "min_ms": 0.009150413796305656,
        "max_ms": 0.009150413796305656,
        "compile_time": 0.4141716957092285
    },
    {
        "BLOCK_SIZE_M": 32,
        "BLOCK_SIZE_N": 64,
        "BLOCK_SIZE_K": 32,
        "GROUP_SIZE_M": 8,
        "num_stages": 5,
        "num_warps": 8,
        "ms": 0.009151394478976727,
        "min_ms": 0.009151394478976727,
        "max_ms": 0.009151394478976727,
        "compile_time": 0.38396286964416504
    },
    {
        "BLOCK_SIZE_M": 64,
        "BLOCK_SIZE_N": 64,
        "BLOCK_SIZE_K": 32,
        "GROUP_SIZE_M": 8,
        "num_stages": 3,
        "num_warps": 16,
        "ms": 0.009156130254268646,
        "min_ms": 0.009156130254268646,
        "max_ms": 0.009156130254268646,
        "compile_time": 0.48883056640625
    },
    {
        "BLOCK_SIZE_M": 128,
        "BLOCK_SIZE_N": 16,
        "BLOCK_SIZE_K": 32,
        "GROUP_SIZE_M": 8,
        "num_stages": 5,
        "num_warps": 2,
        "ms": 0.009158420376479626,
        "min_ms": 0.009158420376479626,
        "max_ms": 0.009158420376479626,
        "compile_time": 0.5381128787994385
    },
    {
        "BLOCK_SIZE_M": 32,
        "BLOCK_SIZE_N": 256,
        "BLOCK_SIZE_K": 32,
        "GROUP_SIZE_M": 8,
        "num_stages": 5,
        "num_warps": 8,
        "ms": 0.009158683009445667,
        "min_ms": 0.009158683009445667,
        "max_ms": 0.009158683009445667,
        "compile_time": 0.4725348949432373
    },
    {
        "BLOCK_SIZE_M": 32,
        "BLOCK_SIZE_N": 16,
        "BLOCK_SIZE_K": 64,
        "GROUP_SIZE_M": 8,
        "num_stages": 5,
        "num_warps": 2,
        "ms": 0.009159589186310768,
        "min_ms": 0.009159589186310768,
        "max_ms": 0.009159589186310768,
        "compile_time": 0.4383220672607422
    },
    {
        "BLOCK_SIZE_M": 16,
        "BLOCK_SIZE_N": 64,
        "BLOCK_SIZE_K": 128,
        "GROUP_SIZE_M": 8,
        "num_stages": 5,
        "num_warps": 4,
        "ms": 0.009160386398434639,
        "min_ms": 0.009160386398434639,
        "max_ms": 0.009160386398434639,
        "compile_time": 0.4014925956726074
    },
    {
        "BLOCK_SIZE_M": 32,
        "BLOCK_SIZE_N": 64,
        "BLOCK_SIZE_K": 256,
        "GROUP_SIZE_M": 8,
        "num_stages": 4,
        "num_warps": 4,
        "ms": 0.009163076989352703,
        "min_ms": 0.009163076989352703,
        "max_ms": 0.009163076989352703,
        "compile_time": 0.45984697341918945
    },
    {
        "BLOCK_SIZE_M": 32,
        "BLOCK_SIZE_N": 32,
        "BLOCK_SIZE_K": 256,
        "GROUP_SIZE_M": 8,
        "num_stages": 1,
        "num_warps": 2,
        "ms": 0.009166600182652473,
        "min_ms": 0.009166600182652473,
        "max_ms": 0.009166600182652473,
        "compile_time": 0.45801377296447754
    },
    {
        "BLOCK_SIZE_M": 128,
        "BLOCK_SIZE_N": 16,
        "BLOCK_SIZE_K": 32,
        "GROUP_SIZE_M": 8,
        "num_stages": 4,
        "num_warps": 4,
        "ms": 0.00916927121579647,
        "min_ms": 0.00916927121579647,
        "max_ms": 0.00916927121579647,
        "compile_time": 0.5251188278198242
    },
    {
        "BLOCK_SIZE_M": 32,
        "BLOCK_SIZE_N": 128,
        "BLOCK_SIZE_K": 32,
        "GROUP_SIZE_M": 8,
        "num_stages": 6,
        "num_warps": 16,
        "ms": 0.009175221435725689,
        "min_ms": 0.009175221435725689,
        "max_ms": 0.009175221435725689,
        "compile_time": 0.4600837230682373
    },
    {
        "BLOCK_SIZE_M": 64,
        "BLOCK_SIZE_N": 64,
        "BLOCK_SIZE_K": 32,
        "GROUP_SIZE_M": 8,
        "num_stages": 4,
        "num_warps": 16,
        "ms": 0.009182078763842583,
        "min_ms": 0.009182078763842583,
        "max_ms": 0.009182078763842583,
        "compile_time": 0.5008363723754883
    },
    {
        "BLOCK_SIZE_M": 16,
        "BLOCK_SIZE_N": 32,
        "BLOCK_SIZE_K": 128,
        "GROUP_SIZE_M": 8,
        "num_stages": 2,
        "num_warps": 4,
        "ms": 0.009183116257190704,
        "min_ms": 0.009183116257190704,
        "max_ms": 0.009183116257190704,
        "compile_time": 0.3879127502441406
    },
    {
        "BLOCK_SIZE_M": 256,
        "BLOCK_SIZE_N": 16,
        "BLOCK_SIZE_K": 64,
        "GROUP_SIZE_M": 8,
        "num_stages": 3,
        "num_warps": 16,
        "ms": 0.009183603338897228,
        "min_ms": 0.009183603338897228,
        "max_ms": 0.009183603338897228,
        "compile_time": 0.5567989349365234
    },
    {
        "BLOCK_SIZE_M": 32,
        "BLOCK_SIZE_N": 64,
        "BLOCK_SIZE_K": 128,
        "GROUP_SIZE_M": 8,
        "num_stages": 1,
        "num_warps": 4,
        "ms": 0.00920014176517725,
        "min_ms": 0.00920014176517725,
        "max_ms": 0.00920014176517725,
        "compile_time": 0.4544968605041504
    },
    {
        "BLOCK_SIZE_M": 64,
        "BLOCK_SIZE_N": 64,
        "BLOCK_SIZE_K": 16,
        "GROUP_SIZE_M": 8,
        "num_stages": 7,
        "num_warps": 2,
        "ms": 0.00920040812343359,
        "min_ms": 0.00920040812343359,
        "max_ms": 0.00920040812343359,
        "compile_time": 0.48505330085754395
    },
    {
        "BLOCK_SIZE_M": 64,
        "BLOCK_SIZE_N": 16,
        "BLOCK_SIZE_K": 32,
        "GROUP_SIZE_M": 8,
        "num_stages": 7,
        "num_warps": 2,
        "ms": 0.009205011650919914,
        "min_ms": 0.009205011650919914,
        "max_ms": 0.009205011650919914,
        "compile_time": 0.48837852478027344
    },
    {
        "BLOCK_SIZE_M": 128,
        "BLOCK_SIZE_N": 32,
        "BLOCK_SIZE_K": 32,
        "GROUP_SIZE_M": 8,
        "num_stages": 6,
        "num_warps": 16,
        "ms": 0.009207327850162983,
        "min_ms": 0.009207327850162983,
        "max_ms": 0.009207327850162983,
        "compile_time": 0.5414774417877197
    },
    {
        "BLOCK_SIZE_M": 256,
        "BLOCK_SIZE_N": 16,
        "BLOCK_SIZE_K": 64,
        "GROUP_SIZE_M": 8,
        "num_stages": 5,
        "num_warps": 2,
        "ms": 0.009208127856254578,
        "min_ms": 0.009208127856254578,
        "max_ms": 0.009208127856254578,
        "compile_time": 0.5495460033416748
    },
    {
        "BLOCK_SIZE_M": 128,
        "BLOCK_SIZE_N": 32,
        "BLOCK_SIZE_K": 128,
        "GROUP_SIZE_M": 8,
        "num_stages": 1,
        "num_warps": 8,
        "ms": 0.00920826941728592,
        "min_ms": 0.00920826941728592,
        "max_ms": 0.00920826941728592,
        "compile_time": 0.5376925468444824
    },
    {
        "BLOCK_SIZE_M": 128,
        "BLOCK_SIZE_N": 64,
        "BLOCK_SIZE_K": 64,
        "GROUP_SIZE_M": 8,
        "num_stages": 2,
        "num_warps": 4,
        "ms": 0.00920902006328106,
        "min_ms": 0.00920902006328106,
        "max_ms": 0.00920902006328106,
        "compile_time": 0.562309741973877
    },
    {
        "BLOCK_SIZE_M": 16,
        "BLOCK_SIZE_N": 64,
        "BLOCK_SIZE_K": 256,
        "GROUP_SIZE_M": 8,
        "num_stages": 2,
        "num_warps": 4,
        "ms": 0.009211065247654915,
        "min_ms": 0.009211065247654915,
        "max_ms": 0.009211065247654915,
        "compile_time": 0.3978257179260254
    },
    {
        "BLOCK_SIZE_M": 64,
        "BLOCK_SIZE_N": 128,
        "BLOCK_SIZE_K": 128,
        "GROUP_SIZE_M": 8,
        "num_stages": 2,
        "num_warps": 8,
        "ms": 0.009221893735229969,
        "min_ms": 0.009221893735229969,
        "max_ms": 0.009221893735229969,
        "compile_time": 0.5147502422332764
    },
    {
        "BLOCK_SIZE_M": 32,
        "BLOCK_SIZE_N": 64,
        "BLOCK_SIZE_K": 16,
        "GROUP_SIZE_M": 8,
        "num_stages": 8,
        "num_warps": 2,
        "ms": 0.009222932159900665,
        "min_ms": 0.009222932159900665,
        "max_ms": 0.009222932159900665,
        "compile_time": 0.4446382522583008
    },
    {
        "BLOCK_SIZE_M": 64,
        "BLOCK_SIZE_N": 64,
        "BLOCK_SIZE_K": 64,
        "GROUP_SIZE_M": 8,
        "num_stages": 1,
        "num_warps": 4,
        "ms": 0.009227884002029896,
        "min_ms": 0.009227884002029896,
        "max_ms": 0.009227884002029896,
        "compile_time": 0.502418041229248
    },
    {
        "BLOCK_SIZE_M": 16,
        "BLOCK_SIZE_N": 32,
        "BLOCK_SIZE_K": 32,
        "GROUP_SIZE_M": 8,
        "num_stages": 8,
        "num_warps": 2,
        "ms": 0.009232197888195515,
        "min_ms": 0.009232197888195515,
        "max_ms": 0.009232197888195515,
        "compile_time": 0.3893728256225586
    },
    {
        "BLOCK_SIZE_M": 256,
        "BLOCK_SIZE_N": 16,
        "BLOCK_SIZE_K": 32,
        "GROUP_SIZE_M": 8,
        "num_stages": 7,
        "num_warps": 8,
        "ms": 0.009233122691512108,
        "min_ms": 0.009233122691512108,
        "max_ms": 0.009233122691512108,
        "compile_time": 0.5620412826538086
    },
    {
        "BLOCK_SIZE_M": 128,
        "BLOCK_SIZE_N": 16,
        "BLOCK_SIZE_K": 64,
        "GROUP_SIZE_M": 8,
        "num_stages": 2,
        "num_warps": 2,
        "ms": 0.009240863844752312,
        "min_ms": 0.009240863844752312,
        "max_ms": 0.009240863844752312,
        "compile_time": 0.5421559810638428
    },
    {
        "BLOCK_SIZE_M": 32,
        "BLOCK_SIZE_N": 64,
        "BLOCK_SIZE_K": 16,
        "GROUP_SIZE_M": 8,
        "num_stages": 6,
        "num_warps": 2,
        "ms": 0.009241127409040928,
        "min_ms": 0.009241127409040928,
        "max_ms": 0.009241127409040928,
        "compile_time": 0.4817984104156494
    },
    {
        "BLOCK_SIZE_M": 256,
        "BLOCK_SIZE_N": 16,
        "BLOCK_SIZE_K": 64,
        "GROUP_SIZE_M": 8,
        "num_stages": 4,
        "num_warps": 16,
        "ms": 0.009241844527423382,
        "min_ms": 0.009241844527423382,
        "max_ms": 0.009241844527423382,
        "compile_time": 0.5524039268493652
    },
    {
        "BLOCK_SIZE_M": 128,
        "BLOCK_SIZE_N": 16,
        "BLOCK_SIZE_K": 64,
        "GROUP_SIZE_M": 8,
        "num_stages": 5,
        "num_warps": 2,
        "ms": 0.009242016822099686,
        "min_ms": 0.009242016822099686,
        "max_ms": 0.009242016822099686,
        "compile_time": 0.5364975929260254
    },
    {
        "BLOCK_SIZE_M": 32,
        "BLOCK_SIZE_N": 64,
        "BLOCK_SIZE_K": 128,
        "GROUP_SIZE_M": 8,
        "num_stages": 5,
        "num_warps": 8,
        "ms": 0.009244092740118504,
        "min_ms": 0.009244092740118504,
        "max_ms": 0.009244092740118504,
        "compile_time": 0.45800065994262695
    },
    {
        "BLOCK_SIZE_M": 64,
        "BLOCK_SIZE_N": 128,
        "BLOCK_SIZE_K": 256,
        "GROUP_SIZE_M": 8,
        "num_stages": 2,
        "num_warps": 8,
        "ms": 0.009256212040781975,
        "min_ms": 0.009256212040781975,
        "max_ms": 0.009256212040781975,
        "compile_time": 0.5149130821228027
    },
    {
        "BLOCK_SIZE_M": 32,
        "BLOCK_SIZE_N": 64,
        "BLOCK_SIZE_K": 64,
        "GROUP_SIZE_M": 8,
        "num_stages": 8,
        "num_warps": 2,
        "ms": 0.009261585772037506,
        "min_ms": 0.009261585772037506,
        "max_ms": 0.009261585772037506,
        "compile_time": 0.460101842880249
    },
    {
        "BLOCK_SIZE_M": 32,
        "BLOCK_SIZE_N": 64,
        "BLOCK_SIZE_K": 128,
        "GROUP_SIZE_M": 8,
        "num_stages": 5,
        "num_warps": 2,
        "ms": 0.009266747161746025,
        "min_ms": 0.009266747161746025,
        "max_ms": 0.009266747161746025,
        "compile_time": 0.45789122581481934
    },
    {
        "BLOCK_SIZE_M": 32,
        "BLOCK_SIZE_N": 16,
        "BLOCK_SIZE_K": 128,
        "GROUP_SIZE_M": 8,
        "num_stages": 2,
        "num_warps": 4,
        "ms": 0.009273090399801731,
        "min_ms": 0.009273090399801731,
        "max_ms": 0.009273090399801731,
        "compile_time": 0.48517489433288574
    },
    {
        "BLOCK_SIZE_M": 64,
        "BLOCK_SIZE_N": 32,
        "BLOCK_SIZE_K": 32,
        "GROUP_SIZE_M": 8,
        "num_stages": 5,
        "num_warps": 8,
        "ms": 0.009275306016206741,
        "min_ms": 0.009275306016206741,
        "max_ms": 0.009275306016206741,
        "compile_time": 0.48850417137145996
    },
    {
        "BLOCK_SIZE_M": 64,
        "BLOCK_SIZE_N": 32,
        "BLOCK_SIZE_K": 256,
        "GROUP_SIZE_M": 8,
        "num_stages": 1,
        "num_warps": 4,
        "ms": 0.009280374273657799,
        "min_ms": 0.009280374273657799,
        "max_ms": 0.009280374273657799,
        "compile_time": 0.5168020725250244
    },
    {
        "BLOCK_SIZE_M": 64,
        "BLOCK_SIZE_N": 32,
        "BLOCK_SIZE_K": 64,
        "GROUP_SIZE_M": 8,
        "num_stages": 1,
        "num_warps": 4,
        "ms": 0.009284419938921928,
        "min_ms": 0.009284419938921928,
        "max_ms": 0.009284419938921928,
        "compile_time": 0.4939126968383789
    },
    {
        "BLOCK_SIZE_M": 128,
        "BLOCK_SIZE_N": 32,
        "BLOCK_SIZE_K": 32,
        "GROUP_SIZE_M": 8,
        "num_stages": 5,
        "num_warps": 16,
        "ms": 0.009285440668463707,
        "min_ms": 0.009285440668463707,
        "max_ms": 0.009285440668463707,
        "compile_time": 0.46196413040161133
    },
    {
        "BLOCK_SIZE_M": 32,
        "BLOCK_SIZE_N": 128,
        "BLOCK_SIZE_K": 128,
        "GROUP_SIZE_M": 8,
        "num_stages": 2,
        "num_warps": 16,
        "ms": 0.009288804605603218,
        "min_ms": 0.009288804605603218,
        "max_ms": 0.009288804605603218,
        "compile_time": 0.4597299098968506
    },
    {
        "BLOCK_SIZE_M": 16,
        "BLOCK_SIZE_N": 128,
        "BLOCK_SIZE_K": 128,
        "GROUP_SIZE_M": 8,
        "num_stages": 2,
        "num_warps": 8,
        "ms": 0.009289855137467384,
        "min_ms": 0.009289855137467384,
        "max_ms": 0.009289855137467384,
        "compile_time": 0.4201493263244629
    },
    {
        "BLOCK_SIZE_M": 32,
        "BLOCK_SIZE_N": 32,
        "BLOCK_SIZE_K": 64,
        "GROUP_SIZE_M": 8,
        "num_stages": 1,
        "num_warps": 4,
        "ms": 0.009290963411331177,
        "min_ms": 0.009290963411331177,
        "max_ms": 0.009290963411331177,
        "compile_time": 0.44220542907714844
    },
    {
        "BLOCK_SIZE_M": 128,
        "BLOCK_SIZE_N": 16,
        "BLOCK_SIZE_K": 128,
        "GROUP_SIZE_M": 8,
        "num_stages": 2,
        "num_warps": 4,
        "ms": 0.009294458664953709,
        "min_ms": 0.009294458664953709,
        "max_ms": 0.009294458664953709,
        "compile_time": 0.5399489402770996
    },
    {
        "BLOCK_SIZE_M": 128,
        "BLOCK_SIZE_N": 64,
        "BLOCK_SIZE_K": 128,
        "GROUP_SIZE_M": 8,
        "num_stages": 2,
        "num_warps": 8,
        "ms": 0.0092952661216259,
        "min_ms": 0.0092952661216259,
        "max_ms": 0.0092952661216259,
        "compile_time": 0.5461952686309814
    },
    {
        "BLOCK_SIZE_M": 16,
        "BLOCK_SIZE_N": 64,
        "BLOCK_SIZE_K": 64,
        "GROUP_SIZE_M": 8,
        "num_stages": 2,
        "num_warps": 2,
        "ms": 0.0093058617785573,
        "min_ms": 0.0093058617785573,
        "max_ms": 0.0093058617785573,
        "compile_time": 0.33310556411743164
    },
    {
        "BLOCK_SIZE_M": 256,
        "BLOCK_SIZE_N": 32,
        "BLOCK_SIZE_K": 128,
        "GROUP_SIZE_M": 8,
        "num_stages": 3,
        "num_warps": 8,
        "ms": 0.009306004270911217,
        "min_ms": 0.009306004270911217,
        "max_ms": 0.009306004270911217,
        "compile_time": 0.5658490657806396
    },
    {
        "BLOCK_SIZE_M": 32,
        "BLOCK_SIZE_N": 64,
        "BLOCK_SIZE_K": 32,
        "GROUP_SIZE_M": 8,
        "num_stages": 6,
        "num_warps": 8,
        "ms": 0.009315114468336105,
        "min_ms": 0.009315114468336105,
        "max_ms": 0.009315114468336105,
        "compile_time": 0.45661330223083496
    },
    {
        "BLOCK_SIZE_M": 16,
        "BLOCK_SIZE_N": 128,
        "BLOCK_SIZE_K": 64,
        "GROUP_SIZE_M": 8,
        "num_stages": 5,
        "num_warps": 2,
        "ms": 0.009318803437054157,
        "min_ms": 0.009318803437054157,
        "max_ms": 0.009318803437054157,
        "compile_time": 0.40987300872802734
    },
    {
        "BLOCK_SIZE_M": 16,
        "BLOCK_SIZE_N": 64,
        "BLOCK_SIZE_K": 32,
        "GROUP_SIZE_M": 8,
        "num_stages": 3,
        "num_warps": 4,
        "ms": 0.009319844655692577,
        "min_ms": 0.009319844655692577,
        "max_ms": 0.009319844655692577,
        "compile_time": 0.40596437454223633
    },
    {
        "BLOCK_SIZE_M": 16,
        "BLOCK_SIZE_N": 256,
        "BLOCK_SIZE_K": 128,
        "GROUP_SIZE_M": 8,
        "num_stages": 3,
        "num_warps": 4,
        "ms": 0.0093295993283391,
        "min_ms": 0.0093295993283391,
        "max_ms": 0.0093295993283391,
        "compile_time": 0.7352056503295898
    },
    {
        "BLOCK_SIZE_M": 16,
        "BLOCK_SIZE_N": 32,
        "BLOCK_SIZE_K": 32,
        "GROUP_SIZE_M": 8,
        "num_stages": 3,
        "num_warps": 2,
        "ms": 0.009329959750175476,
        "min_ms": 0.009329959750175476,
        "max_ms": 0.009329959750175476,
        "compile_time": 0.4007706642150879
    },
    {
        "BLOCK_SIZE_M": 32,
        "BLOCK_SIZE_N": 128,
        "BLOCK_SIZE_K": 512,
        "GROUP_SIZE_M": 8,
        "num_stages": 1,
        "num_warps": 16,
        "ms": 0.009330181404948235,
        "min_ms": 0.009330181404948235,
        "max_ms": 0.009330181404948235,
        "compile_time": 0.4705049991607666
    },
    {
        "BLOCK_SIZE_M": 32,
        "BLOCK_SIZE_N": 16,
        "BLOCK_SIZE_K": 64,
        "GROUP_SIZE_M": 8,
        "num_stages": 3,
        "num_warps": 4,
        "ms": 0.0093392264097929,
        "min_ms": 0.0093392264097929,
        "max_ms": 0.0093392264097929,
        "compile_time": 0.4378046989440918
    },
    {
        "BLOCK_SIZE_M": 16,
        "BLOCK_SIZE_N": 128,
        "BLOCK_SIZE_K": 64,
        "GROUP_SIZE_M": 8,
        "num_stages": 4,
        "num_warps": 8,
        "ms": 0.009341394528746605,
        "min_ms": 0.009341394528746605,
        "max_ms": 0.009341394528746605,
        "compile_time": 0.4165205955505371
    },
    {
        "BLOCK_SIZE_M": 16,
        "BLOCK_SIZE_N": 64,
        "BLOCK_SIZE_K": 256,
        "GROUP_SIZE_M": 8,
        "num_stages": 3,
        "num_warps": 4,
        "ms": 0.009345529600977898,
        "min_ms": 0.009345529600977898,
        "max_ms": 0.009345529600977898,
        "compile_time": 0.4104800224304199
    },
    {
        "BLOCK_SIZE_M": 64,
        "BLOCK_SIZE_N": 64,
        "BLOCK_SIZE_K": 512,
        "GROUP_SIZE_M": 8,
        "num_stages": 2,
        "num_warps": 16,
        "ms": 0.009349663741886616,
        "min_ms": 0.009349663741886616,
        "max_ms": 0.009349663741886616,
        "compile_time": 0.5079243183135986
    },
    {
        "BLOCK_SIZE_M": 64,
        "BLOCK_SIZE_N": 16,
        "BLOCK_SIZE_K": 32,
        "GROUP_SIZE_M": 8,
        "num_stages": 8,
        "num_warps": 2,
        "ms": 0.009350569918751717,
        "min_ms": 0.009350569918751717,
        "max_ms": 0.009350569918751717,
        "compile_time": 0.49103355407714844
    },
    {
        "BLOCK_SIZE_M": 128,
        "BLOCK_SIZE_N": 32,
        "BLOCK_SIZE_K": 32,
        "GROUP_SIZE_M": 8,
        "num_stages": 7,
        "num_warps": 16,
        "ms": 0.00935068354010582,
        "min_ms": 0.00935068354010582,
        "max_ms": 0.00935068354010582,
        "compile_time": 0.5393342971801758
    },
    {
        "BLOCK_SIZE_M": 64,
        "BLOCK_SIZE_N": 16,
        "BLOCK_SIZE_K": 32,
        "GROUP_SIZE_M": 8,
        "num_stages": 4,
        "num_warps": 4,
        "ms": 0.009351576678454876,
        "min_ms": 0.009351576678454876,
        "max_ms": 0.009351576678454876,
        "compile_time": 0.4828908443450928
    },
    {
        "BLOCK_SIZE_M": 128,
        "BLOCK_SIZE_N": 32,
        "BLOCK_SIZE_K": 64,
        "GROUP_SIZE_M": 8,
        "num_stages": 1,
        "num_warps": 4,
        "ms": 0.00935520138591528,
        "min_ms": 0.00935520138591528,
        "max_ms": 0.00935520138591528,
        "compile_time": 0.5431928634643555
    },
    {
        "BLOCK_SIZE_M": 32,
        "BLOCK_SIZE_N": 64,
        "BLOCK_SIZE_K": 64,
        "GROUP_SIZE_M": 8,
        "num_stages": 8,
        "num_warps": 8,
        "ms": 0.00935896672308445,
        "min_ms": 0.00935896672308445,
        "max_ms": 0.00935896672308445,
        "compile_time": 0.4798007011413574
    },
    {
        "BLOCK_SIZE_M": 128,
        "BLOCK_SIZE_N": 32,
        "BLOCK_SIZE_K": 64,
        "GROUP_SIZE_M": 8,
        "num_stages": 8,
        "num_warps": 16,
        "ms": 0.009364988654851913,
        "min_ms": 0.009364988654851913,
        "max_ms": 0.009364988654851913,
        "compile_time": 0.5362391471862793
    },
    {
        "BLOCK_SIZE_M": 32,
        "BLOCK_SIZE_N": 128,
        "BLOCK_SIZE_K": 256,
        "GROUP_SIZE_M": 8,
        "num_stages": 2,
        "num_warps": 16,
        "ms": 0.009367876686155796,
        "min_ms": 0.009367876686155796,
        "max_ms": 0.009367876686155796,
        "compile_time": 0.4698665142059326
    },
    {
        "BLOCK_SIZE_M": 32,
        "BLOCK_SIZE_N": 32,
        "BLOCK_SIZE_K": 64,
        "GROUP_SIZE_M": 8,
        "num_stages": 3,
        "num_warps": 8,
        "ms": 0.009370505809783936,
        "min_ms": 0.009370505809783936,
        "max_ms": 0.009370505809783936,
        "compile_time": 0.4497034549713135
    },
    {
        "BLOCK_SIZE_M": 32,
        "BLOCK_SIZE_N": 128,
        "BLOCK_SIZE_K": 32,
        "GROUP_SIZE_M": 8,
        "num_stages": 7,
        "num_warps": 16,
        "ms": 0.00937268603593111,
        "min_ms": 0.00937268603593111,
        "max_ms": 0.00937268603593111,
        "compile_time": 0.4610288143157959
    },
    {
        "BLOCK_SIZE_M": 64,
        "BLOCK_SIZE_N": 64,
        "BLOCK_SIZE_K": 32,
        "GROUP_SIZE_M": 8,
        "num_stages": 5,
        "num_warps": 16,
        "ms": 0.0093747703358531,
        "min_ms": 0.0093747703358531,
        "max_ms": 0.0093747703358531,
        "compile_time": 0.5010576248168945
    },
    {
        "BLOCK_SIZE_M": 64,
        "BLOCK_SIZE_N": 32,
        "BLOCK_SIZE_K": 128,
        "GROUP_SIZE_M": 8,
        "num_stages": 7,
        "num_warps": 4,
        "ms": 0.009376549161970615,
        "min_ms": 0.009376549161970615,
        "max_ms": 0.009376549161970615,
        "compile_time": 0.5077013969421387
    },
    {
        "BLOCK_SIZE_M": 64,
        "BLOCK_SIZE_N": 32,
        "BLOCK_SIZE_K": 128,
        "GROUP_SIZE_M": 8,
        "num_stages": 5,
        "num_warps": 8,
        "ms": 0.00937925186008215,
        "min_ms": 0.00937925186008215,
        "max_ms": 0.00937925186008215,
        "compile_time": 0.510528564453125
    },
    {
        "BLOCK_SIZE_M": 16,
        "BLOCK_SIZE_N": 64,
        "BLOCK_SIZE_K": 64,
        "GROUP_SIZE_M": 8,
        "num_stages": 2,
        "num_warps": 4,
        "ms": 0.009385344572365284,
        "min_ms": 0.009385344572365284,
        "max_ms": 0.009385344572365284,
        "compile_time": 0.4034914970397949
    },
    {
        "BLOCK_SIZE_M": 64,
        "BLOCK_SIZE_N": 128,
        "BLOCK_SIZE_K": 256,
        "GROUP_SIZE_M": 8,
        "num_stages": 1,
        "num_warps": 8,
        "ms": 0.009385576471686363,
        "min_ms": 0.009385576471686363,
        "max_ms": 0.009385576471686363,
        "compile_time": 0.5251622200012207
    },
    {
        "BLOCK_SIZE_M": 16,
        "BLOCK_SIZE_N": 128,
        "BLOCK_SIZE_K": 16,
        "GROUP_SIZE_M": 8,
        "num_stages": 6,
        "num_warps": 4,
        "ms": 0.009386364370584488,
        "min_ms": 0.009386364370584488,
        "max_ms": 0.009386364370584488,
        "compile_time": 0.4146108627319336
    },
    {
        "BLOCK_SIZE_M": 64,
        "BLOCK_SIZE_N": 16,
        "BLOCK_SIZE_K": 32,
        "GROUP_SIZE_M": 8,
        "num_stages": 2,
        "num_warps": 2,
        "ms": 0.00939300935715437,
        "min_ms": 0.00939300935715437,
        "max_ms": 0.00939300935715437,
        "compile_time": 0.42993998527526855
    },
    {
        "BLOCK_SIZE_M": 128,
        "BLOCK_SIZE_N": 64,
        "BLOCK_SIZE_K": 128,
        "GROUP_SIZE_M": 8,
        "num_stages": 3,
        "num_warps": 16,
        "ms": 0.009395116940140724,
        "min_ms": 0.009395116940140724,
        "max_ms": 0.009395116940140724,
        "compile_time": 0.5556011199951172
    },
    {
        "BLOCK_SIZE_M": 32,
        "BLOCK_SIZE_N": 128,
        "BLOCK_SIZE_K": 32,
        "GROUP_SIZE_M": 8,
        "num_stages": 2,
        "num_warps": 4,
        "ms": 0.009396898560225964,
        "min_ms": 0.009396898560225964,
        "max_ms": 0.009396898560225964,
        "compile_time": 0.4644920825958252
    },
    {
        "BLOCK_SIZE_M": 16,
        "BLOCK_SIZE_N": 256,
        "BLOCK_SIZE_K": 64,
        "GROUP_SIZE_M": 8,
        "num_stages": 4,
        "num_warps": 16,
        "ms": 0.009400276467204094,
        "min_ms": 0.009400276467204094,
        "max_ms": 0.009400276467204094,
        "compile_time": 0.810375452041626
    },
    {
        "BLOCK_SIZE_M": 128,
        "BLOCK_SIZE_N": 64,
        "BLOCK_SIZE_K": 256,
        "GROUP_SIZE_M": 8,
        "num_stages": 2,
        "num_warps": 8,
        "ms": 0.009400749579071999,
        "min_ms": 0.009400749579071999,
        "max_ms": 0.009400749579071999,
        "compile_time": 0.5587022304534912
    },
    {
        "BLOCK_SIZE_M": 32,
        "BLOCK_SIZE_N": 256,
        "BLOCK_SIZE_K": 32,
        "GROUP_SIZE_M": 8,
        "num_stages": 8,
        "num_warps": 8,
        "ms": 0.009402120485901833,
        "min_ms": 0.009402120485901833,
        "max_ms": 0.009402120485901833,
        "compile_time": 0.4835779666900635
    },
    {
        "BLOCK_SIZE_M": 64,
        "BLOCK_SIZE_N": 32,
        "BLOCK_SIZE_K": 256,
        "GROUP_SIZE_M": 8,
        "num_stages": 3,
        "num_warps": 4,
        "ms": 0.00940324179828167,
        "min_ms": 0.00940324179828167,
        "max_ms": 0.00940324179828167,
        "compile_time": 0.5035755634307861
    },
    {
        "BLOCK_SIZE_M": 16,
        "BLOCK_SIZE_N": 256,
        "BLOCK_SIZE_K": 32,
        "GROUP_SIZE_M": 8,
        "num_stages": 3,
        "num_warps": 8,
        "ms": 0.009410492144525051,
        "min_ms": 0.009410492144525051,
        "max_ms": 0.009410492144525051,
        "compile_time": 0.4193539619445801
    },
    {
        "BLOCK_SIZE_M": 128,
        "BLOCK_SIZE_N": 64,
        "BLOCK_SIZE_K": 32,
        "GROUP_SIZE_M": 8,
        "num_stages": 7,
        "num_warps": 2,
        "ms": 0.009413549676537514,
        "min_ms": 0.009413549676537514,
        "max_ms": 0.009413549676537514,
        "compile_time": 0.5544328689575195
    },
    {
        "BLOCK_SIZE_M": 32,
        "BLOCK_SIZE_N": 64,
        "BLOCK_SIZE_K": 16,
        "GROUP_SIZE_M": 8,
        "num_stages": 4,
        "num_warps": 4,
        "ms": 0.009418289177119732,
        "min_ms": 0.009418289177119732,
        "max_ms": 0.009418289177119732,
        "compile_time": 0.4450373649597168
    },
    {
        "BLOCK_SIZE_M": 32,
        "BLOCK_SIZE_N": 32,
        "BLOCK_SIZE_K": 64,
        "GROUP_SIZE_M": 8,
        "num_stages": 8,
        "num_warps": 2,
        "ms": 0.009421126917004585,
        "min_ms": 0.009421126917004585,
        "max_ms": 0.009421126917004585,
        "compile_time": 0.4642329216003418
    },
    {
        "BLOCK_SIZE_M": 16,
        "BLOCK_SIZE_N": 32,
        "BLOCK_SIZE_K": 256,
        "GROUP_SIZE_M": 8,
        "num_stages": 2,
        "num_warps": 4,
        "ms": 0.009424617514014244,
        "min_ms": 0.009424617514014244,
        "max_ms": 0.009424617514014244,
        "compile_time": 0.40467119216918945
    },
    {
        "BLOCK_SIZE_M": 64,
        "BLOCK_SIZE_N": 64,
        "BLOCK_SIZE_K": 32,
        "GROUP_SIZE_M": 8,
        "num_stages": 6,
        "num_warps": 16,
        "ms": 0.00942668505012989,
        "min_ms": 0.00942668505012989,
        "max_ms": 0.00942668505012989,
        "compile_time": 0.5053906440734863
    },
    {
        "BLOCK_SIZE_M": 32,
        "BLOCK_SIZE_N": 64,
        "BLOCK_SIZE_K": 32,
        "GROUP_SIZE_M": 8,
        "num_stages": 7,
        "num_warps": 8,
        "ms": 0.009439492598176003,
        "min_ms": 0.009439492598176003,
        "max_ms": 0.009439492598176003,
        "compile_time": 0.4566192626953125
    },
    {
        "BLOCK_SIZE_M": 128,
        "BLOCK_SIZE_N": 32,
        "BLOCK_SIZE_K": 128,
        "GROUP_SIZE_M": 8,
        "num_stages": 2,
        "num_warps": 2,
        "ms": 0.009446184150874615,
        "min_ms": 0.009446184150874615,
        "max_ms": 0.009446184150874615,
        "compile_time": 0.541313886642456
    },
    {
        "BLOCK_SIZE_M": 64,
        "BLOCK_SIZE_N": 128,
        "BLOCK_SIZE_K": 64,
        "GROUP_SIZE_M": 8,
        "num_stages": 4,
        "num_warps": 16,
        "ms": 0.009452315978705883,
        "min_ms": 0.009452315978705883,
        "max_ms": 0.009452315978705883,
        "compile_time": 0.5253744125366211
    },
    {
        "BLOCK_SIZE_M": 16,
        "BLOCK_SIZE_N": 32,
        "BLOCK_SIZE_K": 64,
        "GROUP_SIZE_M": 8,
        "num_stages": 2,
        "num_warps": 2,
        "ms": 0.009452743455767632,
        "min_ms": 0.009452743455767632,
        "max_ms": 0.009452743455767632,
        "compile_time": 0.3943464756011963
    },
    {
        "BLOCK_SIZE_M": 128,
        "BLOCK_SIZE_N": 32,
        "BLOCK_SIZE_K": 32,
        "GROUP_SIZE_M": 8,
        "num_stages": 2,
        "num_warps": 4,
        "ms": 0.009453536942601204,
        "min_ms": 0.009453536942601204,
        "max_ms": 0.009453536942601204,
        "compile_time": 0.5431618690490723
    },
    {
        "BLOCK_SIZE_M": 16,
        "BLOCK_SIZE_N": 32,
        "BLOCK_SIZE_K": 256,
        "GROUP_SIZE_M": 8,
        "num_stages": 2,
        "num_warps": 2,
        "ms": 0.009454497136175632,
        "min_ms": 0.009454497136175632,
        "max_ms": 0.009454497136175632,
        "compile_time": 0.4073367118835449
    },
    {
        "BLOCK_SIZE_M": 16,
        "BLOCK_SIZE_N": 128,
        "BLOCK_SIZE_K": 128,
        "GROUP_SIZE_M": 8,
        "num_stages": 2,
        "num_warps": 4,
        "ms": 0.009454782120883465,
        "min_ms": 0.009454782120883465,
        "max_ms": 0.009454782120883465,
        "compile_time": 0.41764187812805176
    },
    {
        "BLOCK_SIZE_M": 32,
        "BLOCK_SIZE_N": 32,
        "BLOCK_SIZE_K": 16,
        "GROUP_SIZE_M": 8,
        "num_stages": 5,
        "num_warps": 2,
        "ms": 0.009454824961721897,
        "min_ms": 0.009454824961721897,
        "max_ms": 0.009454824961721897,
        "compile_time": 0.4560065269470215
    },
    {
        "BLOCK_SIZE_M": 64,
        "BLOCK_SIZE_N": 128,
        "BLOCK_SIZE_K": 256,
        "GROUP_SIZE_M": 8,
        "num_stages": 2,
        "num_warps": 4,
        "ms": 0.009455414488911629,
        "min_ms": 0.009455414488911629,
        "max_ms": 0.009455414488911629,
        "compile_time": 0.5252795219421387
    },
    {
        "BLOCK_SIZE_M": 128,
        "BLOCK_SIZE_N": 32,
        "BLOCK_SIZE_K": 128,
        "GROUP_SIZE_M": 8,
        "num_stages": 2,
        "num_warps": 16,
        "ms": 0.009455874562263489,
        "min_ms": 0.009455874562263489,
        "max_ms": 0.009455874562263489,
        "compile_time": 0.541283369064331
    },
    {
        "BLOCK_SIZE_M": 64,
        "BLOCK_SIZE_N": 128,
        "BLOCK_SIZE_K": 64,
        "GROUP_SIZE_M": 8,
        "num_stages": 3,
        "num_warps": 16,
        "ms": 0.009458313696086407,
        "min_ms": 0.009458313696086407,
        "max_ms": 0.009458313696086407,
        "compile_time": 0.5243446826934814
    },
    {
        "BLOCK_SIZE_M": 32,
        "BLOCK_SIZE_N": 128,
        "BLOCK_SIZE_K": 32,
        "GROUP_SIZE_M": 8,
        "num_stages": 8,
        "num_warps": 16,
        "ms": 0.00946025364100933,
        "min_ms": 0.00946025364100933,
        "max_ms": 0.00946025364100933,
        "compile_time": 0.45330262184143066
    },
    {
        "BLOCK_SIZE_M": 128,
        "BLOCK_SIZE_N": 16,
        "BLOCK_SIZE_K": 64,
        "GROUP_SIZE_M": 8,
        "num_stages": 5,
        "num_warps": 4,
        "ms": 0.009463148191571236,
        "min_ms": 0.009463148191571236,
        "max_ms": 0.009463148191571236,
        "compile_time": 0.5192344188690186
    },
    {
        "BLOCK_SIZE_M": 32,
        "BLOCK_SIZE_N": 32,
        "BLOCK_SIZE_K": 16,
        "GROUP_SIZE_M": 8,
        "num_stages": 6,
        "num_warps": 2,
        "ms": 0.009471612051129341,
        "min_ms": 0.009471612051129341,
        "max_ms": 0.009471612051129341,
        "compile_time": 0.45566606521606445
    },
    {
        "BLOCK_SIZE_M": 64,
        "BLOCK_SIZE_N": 64,
        "BLOCK_SIZE_K": 32,
        "GROUP_SIZE_M": 8,
        "num_stages": 2,
        "num_warps": 8,
        "ms": 0.009473989717662334,
        "min_ms": 0.009473989717662334,
        "max_ms": 0.009473989717662334,
        "compile_time": 0.5082135200500488
    },
    {
        "BLOCK_SIZE_M": 16,
        "BLOCK_SIZE_N": 256,
        "BLOCK_SIZE_K": 32,
        "GROUP_SIZE_M": 8,
        "num_stages": 3,
        "num_warps": 2,
        "ms": 0.009478796273469925,
        "min_ms": 0.009478796273469925,
        "max_ms": 0.009478796273469925,
        "compile_time": 0.42059755325317383
    },
    {
        "BLOCK_SIZE_M": 128,
        "BLOCK_SIZE_N": 32,
        "BLOCK_SIZE_K": 32,
        "GROUP_SIZE_M": 8,
        "num_stages": 8,
        "num_warps": 16,
        "ms": 0.00948106124997139,
        "min_ms": 0.00948106124997139,
        "max_ms": 0.00948106124997139,
        "compile_time": 0.5580129623413086
    },
    {
        "BLOCK_SIZE_M": 16,
        "BLOCK_SIZE_N": 128,
        "BLOCK_SIZE_K": 128,
        "GROUP_SIZE_M": 8,
        "num_stages": 3,
        "num_warps": 2,
        "ms": 0.009482873603701591,
        "min_ms": 0.009482873603701591,
        "max_ms": 0.009482873603701591,
        "compile_time": 0.41861438751220703
    },
    {
        "BLOCK_SIZE_M": 128,
        "BLOCK_SIZE_N": 16,
        "BLOCK_SIZE_K": 128,
        "GROUP_SIZE_M": 8,
        "num_stages": 3,
        "num_warps": 4,
        "ms": 0.009483441710472107,
        "min_ms": 0.009483441710472107,
        "max_ms": 0.009483441710472107,
        "compile_time": 0.5372343063354492
    },
    {
        "BLOCK_SIZE_M": 64,
        "BLOCK_SIZE_N": 128,
        "BLOCK_SIZE_K": 64,
        "GROUP_SIZE_M": 8,
        "num_stages": 5,
        "num_warps": 16,
        "ms": 0.009491989389061928,
        "min_ms": 0.009491989389061928,
        "max_ms": 0.009491989389061928,
        "compile_time": 0.5105056762695312
    },
    {
        "BLOCK_SIZE_M": 32,
        "BLOCK_SIZE_N": 32,
        "BLOCK_SIZE_K": 16,
        "GROUP_SIZE_M": 8,
        "num_stages": 4,
        "num_warps": 2,
        "ms": 0.009497033432126045,
        "min_ms": 0.009497033432126045,
        "max_ms": 0.009497033432126045,
        "compile_time": 0.4479966163635254
    },
    {
        "BLOCK_SIZE_M": 128,
        "BLOCK_SIZE_N": 16,
        "BLOCK_SIZE_K": 32,
        "GROUP_SIZE_M": 8,
        "num_stages": 6,
        "num_warps": 2,
        "ms": 0.009499184787273407,
        "min_ms": 0.009499184787273407,
        "max_ms": 0.009499184787273407,
        "compile_time": 0.5404610633850098
    },
    {
        "BLOCK_SIZE_M": 16,
        "BLOCK_SIZE_N": 128,
        "BLOCK_SIZE_K": 16,
        "GROUP_SIZE_M": 8,
        "num_stages": 7,
        "num_warps": 4,
        "ms": 0.009505719877779484,
        "min_ms": 0.009505719877779484,
        "max_ms": 0.009505719877779484,
        "compile_time": 0.41121530532836914
    },
    {
        "BLOCK_SIZE_M": 32,
        "BLOCK_SIZE_N": 64,
        "BLOCK_SIZE_K": 32,
        "GROUP_SIZE_M": 8,
        "num_stages": 2,
        "num_warps": 8,
        "ms": 0.009513911791145802,
        "min_ms": 0.009513911791145802,
        "max_ms": 0.009513911791145802,
        "compile_time": 0.4588134288787842
    },
    {
        "BLOCK_SIZE_M": 64,
        "BLOCK_SIZE_N": 64,
        "BLOCK_SIZE_K": 32,
        "GROUP_SIZE_M": 8,
        "num_stages": 7,
        "num_warps": 16,
        "ms": 0.00951945036649704,
        "min_ms": 0.00951945036649704,
        "max_ms": 0.00951945036649704,
        "compile_time": 0.5067059993743896
    },
    {
        "BLOCK_SIZE_M": 64,
        "BLOCK_SIZE_N": 32,
        "BLOCK_SIZE_K": 32,
        "GROUP_SIZE_M": 8,
        "num_stages": 6,
        "num_warps": 8,
        "ms": 0.009524181485176086,
        "min_ms": 0.009524181485176086,
        "max_ms": 0.009524181485176086,
        "compile_time": 0.4961111545562744
    },
    {
        "BLOCK_SIZE_M": 64,
        "BLOCK_SIZE_N": 16,
        "BLOCK_SIZE_K": 256,
        "GROUP_SIZE_M": 8,
        "num_stages": 2,
        "num_warps": 4,
        "ms": 0.009529250673949718,
        "min_ms": 0.009529250673949718,
        "max_ms": 0.009529250673949718,
        "compile_time": 0.5070407390594482
    },
    {
        "BLOCK_SIZE_M": 32,
        "BLOCK_SIZE_N": 64,
        "BLOCK_SIZE_K": 16,
        "GROUP_SIZE_M": 8,
        "num_stages": 6,
        "num_warps": 4,
        "ms": 0.009529760107398033,
        "min_ms": 0.009529760107398033,
        "max_ms": 0.009529760107398033,
        "compile_time": 0.46244049072265625
    },
    {
        "BLOCK_SIZE_M": 256,
        "BLOCK_SIZE_N": 16,
        "BLOCK_SIZE_K": 32,
        "GROUP_SIZE_M": 8,
        "num_stages": 8,
        "num_warps": 8,
        "ms": 0.009533167816698551,
        "min_ms": 0.009533167816698551,
        "max_ms": 0.009533167816698551,
        "compile_time": 0.5642566680908203
    },
    {
        "BLOCK_SIZE_M": 128,
        "BLOCK_SIZE_N": 64,
        "BLOCK_SIZE_K": 32,
        "GROUP_SIZE_M": 8,
        "num_stages": 8,
        "num_warps": 2,
        "ms": 0.009533281438052654,
        "min_ms": 0.009533281438052654,
        "max_ms": 0.009533281438052654,
        "compile_time": 0.5528342723846436
    },
    {
        "BLOCK_SIZE_M": 128,
        "BLOCK_SIZE_N": 16,
        "BLOCK_SIZE_K": 64,
        "GROUP_SIZE_M": 8,
        "num_stages": 3,
        "num_warps": 8,
        "ms": 0.009535257704555988,
        "min_ms": 0.009535257704555988,
        "max_ms": 0.009535257704555988,
        "compile_time": 0.5329244136810303
    },
    {
        "BLOCK_SIZE_M": 16,
        "BLOCK_SIZE_N": 32,
        "BLOCK_SIZE_K": 128,
        "GROUP_SIZE_M": 8,
        "num_stages": 3,
        "num_warps": 4,
        "ms": 0.009535877034068108,
        "min_ms": 0.009535877034068108,
        "max_ms": 0.009535877034068108,
        "compile_time": 0.36649489402770996
    },
    {
        "BLOCK_SIZE_M": 32,
        "BLOCK_SIZE_N": 64,
        "BLOCK_SIZE_K": 128,
        "GROUP_SIZE_M": 8,
        "num_stages": 6,
        "num_warps": 8,
        "ms": 0.009545179083943367,
        "min_ms": 0.009545179083943367,
        "max_ms": 0.009545179083943367,
        "compile_time": 0.4568655490875244
    },
    {
        "BLOCK_SIZE_M": 16,
        "BLOCK_SIZE_N": 32,
        "BLOCK_SIZE_K": 64,
        "GROUP_SIZE_M": 8,
        "num_stages": 4,
        "num_warps": 4,
        "ms": 0.009548882022500038,
        "min_ms": 0.009548882022500038,
        "max_ms": 0.009548882022500038,
        "compile_time": 0.40119409561157227
    },
    {
        "BLOCK_SIZE_M": 16,
        "BLOCK_SIZE_N": 256,
        "BLOCK_SIZE_K": 128,
        "GROUP_SIZE_M": 8,
        "num_stages": 3,
        "num_warps": 8,
        "ms": 0.009551065042614937,
        "min_ms": 0.009551065042614937,
        "max_ms": 0.009551065042614937,
        "compile_time": 0.6386511325836182
    },
    {
        "BLOCK_SIZE_M": 32,
        "BLOCK_SIZE_N": 64,
        "BLOCK_SIZE_K": 256,
        "GROUP_SIZE_M": 8,
        "num_stages": 1,
        "num_warps": 2,
        "ms": 0.00955118052661419,
        "min_ms": 0.00955118052661419,
        "max_ms": 0.00955118052661419,
        "compile_time": 0.4607090950012207
    },
    {
        "BLOCK_SIZE_M": 64,
        "BLOCK_SIZE_N": 32,
        "BLOCK_SIZE_K": 256,
        "GROUP_SIZE_M": 8,
        "num_stages": 4,
        "num_warps": 4,
        "ms": 0.009551872499287128,
        "min_ms": 0.009551872499287128,
        "max_ms": 0.009551872499287128,
        "compile_time": 0.5030791759490967
    },
    {
        "BLOCK_SIZE_M": 32,
        "BLOCK_SIZE_N": 32,
        "BLOCK_SIZE_K": 128,
        "GROUP_SIZE_M": 8,
        "num_stages": 3,
        "num_warps": 8,
        "ms": 0.009564206004142761,
        "min_ms": 0.009564206004142761,
        "max_ms": 0.009564206004142761,
        "compile_time": 0.4532887935638428
    },
    {
        "BLOCK_SIZE_M": 32,
        "BLOCK_SIZE_N": 32,
        "BLOCK_SIZE_K": 16,
        "GROUP_SIZE_M": 8,
        "num_stages": 3,
        "num_warps": 2,
        "ms": 0.009565678425133228,
        "min_ms": 0.009565678425133228,
        "max_ms": 0.009565678425133228,
        "compile_time": 0.4490017890930176
    },
    {
        "BLOCK_SIZE_M": 128,
        "BLOCK_SIZE_N": 32,
        "BLOCK_SIZE_K": 256,
        "GROUP_SIZE_M": 8,
        "num_stages": 1,
        "num_warps": 4,
        "ms": 0.009566755965352058,
        "min_ms": 0.009566755965352058,
        "max_ms": 0.009566755965352058,
        "compile_time": 0.5450358390808105
    },
    {
        "BLOCK_SIZE_M": 128,
        "BLOCK_SIZE_N": 64,
        "BLOCK_SIZE_K": 64,
        "GROUP_SIZE_M": 8,
        "num_stages": 2,
        "num_warps": 8,
        "ms": 0.009573494084179401,
        "min_ms": 0.009573494084179401,
        "max_ms": 0.009573494084179401,
        "compile_time": 0.5530211925506592
    },
    {
        "BLOCK_SIZE_M": 16,
        "BLOCK_SIZE_N": 256,
        "BLOCK_SIZE_K": 128,
        "GROUP_SIZE_M": 8,
        "num_stages": 3,
        "num_warps": 16,
        "ms": 0.009576520882546902,
        "min_ms": 0.009576520882546902,
        "max_ms": 0.009576520882546902,
        "compile_time": 0.48131752014160156
    },
    {
        "BLOCK_SIZE_M": 16,
        "BLOCK_SIZE_N": 128,
        "BLOCK_SIZE_K": 16,
        "GROUP_SIZE_M": 8,
        "num_stages": 5,
        "num_warps": 4,
        "ms": 0.009579496458172798,
        "min_ms": 0.009579496458172798,
        "max_ms": 0.009579496458172798,
        "compile_time": 0.41770339012145996
    },
    {
        "BLOCK_SIZE_M": 64,
        "BLOCK_SIZE_N": 128,
        "BLOCK_SIZE_K": 128,
        "GROUP_SIZE_M": 8,
        "num_stages": 3,
        "num_warps": 16,
        "ms": 0.009582668542861938,
        "min_ms": 0.009582668542861938,
        "max_ms": 0.009582668542861938,
        "compile_time": 0.5265908241271973
    },
    {
        "BLOCK_SIZE_M": 32,
        "BLOCK_SIZE_N": 32,
        "BLOCK_SIZE_K": 16,
        "GROUP_SIZE_M": 8,
        "num_stages": 7,
        "num_warps": 2,
        "ms": 0.009587687440216541,
        "min_ms": 0.009587687440216541,
        "max_ms": 0.009587687440216541,
        "compile_time": 0.45622730255126953
    },
    {
        "BLOCK_SIZE_M": 16,
        "BLOCK_SIZE_N": 128,
        "BLOCK_SIZE_K": 16,
        "GROUP_SIZE_M": 8,
        "num_stages": 8,
        "num_warps": 4,
        "ms": 0.009599408134818077,
        "min_ms": 0.009599408134818077,
        "max_ms": 0.009599408134818077,
        "compile_time": 0.412947416305542
    },
    {
        "BLOCK_SIZE_M": 64,
        "BLOCK_SIZE_N": 128,
        "BLOCK_SIZE_K": 64,
        "GROUP_SIZE_M": 8,
        "num_stages": 2,
        "num_warps": 8,
        "ms": 0.009604530408978462,
        "min_ms": 0.009604530408978462,
        "max_ms": 0.009604530408978462,
        "compile_time": 0.5175209045410156
    },
    {
        "BLOCK_SIZE_M": 64,
        "BLOCK_SIZE_N": 32,
        "BLOCK_SIZE_K": 256,
        "GROUP_SIZE_M": 8,
        "num_stages": 1,
        "num_warps": 8,
        "ms": 0.009610813111066818,
        "min_ms": 0.009610813111066818,
        "max_ms": 0.009610813111066818,
        "compile_time": 0.5099496841430664
    },
    {
        "BLOCK_SIZE_M": 64,
        "BLOCK_SIZE_N": 64,
        "BLOCK_SIZE_K": 64,
        "GROUP_SIZE_M": 8,
        "num_stages": 1,
        "num_warps": 16,
        "ms": 0.00962254498153925,
        "min_ms": 0.00962254498153925,
        "max_ms": 0.00962254498153925,
        "compile_time": 0.5071589946746826
    },
    {
        "BLOCK_SIZE_M": 64,
        "BLOCK_SIZE_N": 16,
        "BLOCK_SIZE_K": 256,
        "GROUP_SIZE_M": 8,
        "num_stages": 2,
        "num_warps": 2,
        "ms": 0.009625477716326714,
        "min_ms": 0.009625477716326714,
        "max_ms": 0.009625477716326714,
        "compile_time": 0.48129868507385254
    },
    {
        "BLOCK_SIZE_M": 32,
        "BLOCK_SIZE_N": 32,
        "BLOCK_SIZE_K": 256,
        "GROUP_SIZE_M": 8,
        "num_stages": 2,
        "num_warps": 8,
        "ms": 0.009627832099795341,
        "min_ms": 0.009627832099795341,
        "max_ms": 0.009627832099795341,
        "compile_time": 0.4496605396270752
    },
    {
        "BLOCK_SIZE_M": 128,
        "BLOCK_SIZE_N": 128,
        "BLOCK_SIZE_K": 32,
        "GROUP_SIZE_M": 8,
        "num_stages": 4,
        "num_warps": 4,
        "ms": 0.009627832099795341,
        "min_ms": 0.009627832099795341,
        "max_ms": 0.009627832099795341,
        "compile_time": 0.5529108047485352
    },
    {
        "BLOCK_SIZE_M": 16,
        "BLOCK_SIZE_N": 64,
        "BLOCK_SIZE_K": 128,
        "GROUP_SIZE_M": 8,
        "num_stages": 3,
        "num_warps": 8,
        "ms": 0.009629450738430023,
        "min_ms": 0.009629450738430023,
        "max_ms": 0.009629450738430023,
        "compile_time": 0.41193675994873047
    },
    {
        "BLOCK_SIZE_M": 64,
        "BLOCK_SIZE_N": 16,
        "BLOCK_SIZE_K": 32,
        "GROUP_SIZE_M": 8,
        "num_stages": 5,
        "num_warps": 4,
        "ms": 0.009635116904973984,
        "min_ms": 0.009635116904973984,
        "max_ms": 0.009635116904973984,
        "compile_time": 0.4864320755004883
    },
    {
        "BLOCK_SIZE_M": 64,
        "BLOCK_SIZE_N": 32,
        "BLOCK_SIZE_K": 64,
        "GROUP_SIZE_M": 8,
        "num_stages": 8,
        "num_warps": 8,
        "ms": 0.009638385847210884,
        "min_ms": 0.009638385847210884,
        "max_ms": 0.009638385847210884,
        "compile_time": 0.5095818042755127
    },
    {
        "BLOCK_SIZE_M": 128,
        "BLOCK_SIZE_N": 128,
        "BLOCK_SIZE_K": 32,
        "GROUP_SIZE_M": 8,
        "num_stages": 3,
        "num_warps": 4,
        "ms": 0.009640325792133808,
        "min_ms": 0.009640325792133808,
        "max_ms": 0.009640325792133808,
        "compile_time": 0.5625090599060059
    },
    {
        "BLOCK_SIZE_M": 128,
        "BLOCK_SIZE_N": 64,
        "BLOCK_SIZE_K": 128,
        "GROUP_SIZE_M": 8,
        "num_stages": 1,
        "num_warps": 8,
        "ms": 0.009640720672905445,
        "min_ms": 0.009640720672905445,
        "max_ms": 0.009640720672905445,
        "compile_time": 0.5606858730316162
    },
    {
        "BLOCK_SIZE_M": 64,
        "BLOCK_SIZE_N": 128,
        "BLOCK_SIZE_K": 64,
        "GROUP_SIZE_M": 8,
        "num_stages": 6,
        "num_warps": 16,
        "ms": 0.009647238999605179,
        "min_ms": 0.009647238999605179,
        "max_ms": 0.009647238999605179,
        "compile_time": 0.5062692165374756
    },
    {
        "BLOCK_SIZE_M": 32,
        "BLOCK_SIZE_N": 32,
        "BLOCK_SIZE_K": 16,
        "GROUP_SIZE_M": 8,
        "num_stages": 8,
        "num_warps": 2,
        "ms": 0.009648059494793415,
        "min_ms": 0.009648059494793415,
        "max_ms": 0.009648059494793415,
        "compile_time": 0.4578053951263428
    },
    {
        "BLOCK_SIZE_M": 32,
        "BLOCK_SIZE_N": 32,
        "BLOCK_SIZE_K": 128,
        "GROUP_SIZE_M": 8,
        "num_stages": 2,
        "num_warps": 8,
        "ms": 0.009648283012211323,
        "min_ms": 0.009648283012211323,
        "max_ms": 0.009648283012211323,
        "compile_time": 0.46521520614624023
    },
    {
        "BLOCK_SIZE_M": 128,
        "BLOCK_SIZE_N": 64,
        "BLOCK_SIZE_K": 128,
        "GROUP_SIZE_M": 8,
        "num_stages": 4,
        "num_warps": 16,
        "ms": 0.009656731970608234,
        "min_ms": 0.009656731970608234,
        "max_ms": 0.009656731970608234,
        "compile_time": 0.5612764358520508
    },
    {
        "BLOCK_SIZE_M": 32,
        "BLOCK_SIZE_N": 64,
        "BLOCK_SIZE_K": 16,
        "GROUP_SIZE_M": 8,
        "num_stages": 7,
        "num_warps": 4,
        "ms": 0.00966395903378725,
        "min_ms": 0.00966395903378725,
        "max_ms": 0.00966395903378725,
        "compile_time": 0.4647402763366699
    },
    {
        "BLOCK_SIZE_M": 256,
        "BLOCK_SIZE_N": 16,
        "BLOCK_SIZE_K": 64,
        "GROUP_SIZE_M": 8,
        "num_stages": 5,
        "num_warps": 16,
        "ms": 0.00966651551425457,
        "min_ms": 0.00966651551425457,
        "max_ms": 0.00966651551425457,
        "compile_time": 0.5688779354095459
    },
    {
        "BLOCK_SIZE_M": 128,
        "BLOCK_SIZE_N": 32,
        "BLOCK_SIZE_K": 256,
        "GROUP_SIZE_M": 8,
        "num_stages": 1,
        "num_warps": 16,
        "ms": 0.0096671711653471,
        "min_ms": 0.0096671711653471,
        "max_ms": 0.0096671711653471,
        "compile_time": 0.5494856834411621
    },
    {
        "BLOCK_SIZE_M": 128,
        "BLOCK_SIZE_N": 32,
        "BLOCK_SIZE_K": 512,
        "GROUP_SIZE_M": 8,
        "num_stages": 2,
        "num_warps": 8,
        "ms": 0.009667584672570229,
        "min_ms": 0.009667584672570229,
        "max_ms": 0.009667584672570229,
        "compile_time": 0.5277366638183594
    },
    {
        "BLOCK_SIZE_M": 64,
        "BLOCK_SIZE_N": 32,
        "BLOCK_SIZE_K": 32,
        "GROUP_SIZE_M": 8,
        "num_stages": 2,
        "num_warps": 8,
        "ms": 0.009670251980423927,
        "min_ms": 0.009670251980423927,
        "max_ms": 0.009670251980423927,
        "compile_time": 0.5176312923431396
    },
    {
        "BLOCK_SIZE_M": 32,
        "BLOCK_SIZE_N": 64,
        "BLOCK_SIZE_K": 16,
        "GROUP_SIZE_M": 8,
        "num_stages": 8,
        "num_warps": 4,
        "ms": 0.009684955701231956,
        "min_ms": 0.009684955701231956,
        "max_ms": 0.009684955701231956,
        "compile_time": 0.4614989757537842
    },
    {
        "BLOCK_SIZE_M": 64,
        "BLOCK_SIZE_N": 16,
        "BLOCK_SIZE_K": 64,
        "GROUP_SIZE_M": 8,
        "num_stages": 6,
        "num_warps": 4,
        "ms": 0.009686669334769249,
        "min_ms": 0.009686669334769249,
        "max_ms": 0.009686669334769249,
        "compile_time": 0.5125138759613037
    },
    {
        "BLOCK_SIZE_M": 32,
        "BLOCK_SIZE_N": 64,
        "BLOCK_SIZE_K": 32,
        "GROUP_SIZE_M": 8,
        "num_stages": 8,
        "num_warps": 8,
        "ms": 0.00969286635518074,
        "min_ms": 0.00969286635518074,
        "max_ms": 0.00969286635518074,
        "compile_time": 0.4637610912322998
    },
    {
        "BLOCK_SIZE_M": 32,
        "BLOCK_SIZE_N": 64,
        "BLOCK_SIZE_K": 16,
        "GROUP_SIZE_M": 8,
        "num_stages": 3,
        "num_warps": 4,
        "ms": 0.009694336913526058,
        "min_ms": 0.009694336913526058,
        "max_ms": 0.009694336913526058,
        "compile_time": 0.45200395584106445
    },
    {
        "BLOCK_SIZE_M": 64,
        "BLOCK_SIZE_N": 64,
        "BLOCK_SIZE_K": 32,
        "GROUP_SIZE_M": 8,
        "num_stages": 8,
        "num_warps": 16,
        "ms": 0.00969594344496727,
        "min_ms": 0.00969594344496727,
        "max_ms": 0.00969594344496727,
        "compile_time": 0.5150210857391357
    },
    {
        "BLOCK_SIZE_M": 128,
        "BLOCK_SIZE_N": 32,
        "BLOCK_SIZE_K": 256,
        "GROUP_SIZE_M": 8,
        "num_stages": 2,
        "num_warps": 16,
        "ms": 0.00969964824616909,
        "min_ms": 0.00969964824616909,
        "max_ms": 0.00969964824616909,
        "compile_time": 0.5519111156463623
    },
    {
        "BLOCK_SIZE_M": 128,
        "BLOCK_SIZE_N": 16,
        "BLOCK_SIZE_K": 32,
        "GROUP_SIZE_M": 8,
        "num_stages": 5,
        "num_warps": 4,
        "ms": 0.009700092487037182,
        "min_ms": 0.009700092487037182,
        "max_ms": 0.009700092487037182,
        "compile_time": 0.543442964553833
    },
    {
        "BLOCK_SIZE_M": 32,
        "BLOCK_SIZE_N": 32,
        "BLOCK_SIZE_K": 128,
        "GROUP_SIZE_M": 8,
        "num_stages": 5,
        "num_warps": 2,
        "ms": 0.009702060371637344,
        "min_ms": 0.009702060371637344,
        "max_ms": 0.009702060371637344,
        "compile_time": 0.4576590061187744
    },
    {
        "BLOCK_SIZE_M": 32,
        "BLOCK_SIZE_N": 32,
        "BLOCK_SIZE_K": 64,
        "GROUP_SIZE_M": 8,
        "num_stages": 4,
        "num_warps": 8,
        "ms": 0.00971017312258482,
        "min_ms": 0.00971017312258482,
        "max_ms": 0.00971017312258482,
        "compile_time": 0.45328688621520996
    },
    {
        "BLOCK_SIZE_M": 16,
        "BLOCK_SIZE_N": 128,
        "BLOCK_SIZE_K": 64,
        "GROUP_SIZE_M": 8,
        "num_stages": 6,
        "num_warps": 4,
        "ms": 0.009712322615087032,
        "min_ms": 0.009712322615087032,
        "max_ms": 0.009712322615087032,
        "compile_time": 0.42664217948913574
    },
    {
        "BLOCK_SIZE_M": 64,
        "BLOCK_SIZE_N": 16,
        "BLOCK_SIZE_K": 64,
        "GROUP_SIZE_M": 8,
        "num_stages": 1,
        "num_warps": 4,
        "ms": 0.009717326611280441,
        "min_ms": 0.009717326611280441,
        "max_ms": 0.009717326611280441,
        "compile_time": 0.5046713352203369
    },
    {
        "BLOCK_SIZE_M": 256,
        "BLOCK_SIZE_N": 32,
        "BLOCK_SIZE_K": 32,
