simdata/FP16-R100/512_fails.json
[
    {
        "BLOCK_SIZE_M": 16,
        "BLOCK_SIZE_N": 16,
        "BLOCK_SIZE_K": 512,
        "GROUP_SIZE_M": 8,
        "num_stages": 7,
        "num_warps": 2,
        "compile_time": 0.0032095909118652344
    },
    {
        "BLOCK_SIZE_M": 16,
        "BLOCK_SIZE_N": 16,
        "BLOCK_SIZE_K": 512,
        "GROUP_SIZE_M": 8,
        "num_stages": 7,
        "num_warps": 4,
        "compile_time": 0.0026137828826904297
    },
    {
        "BLOCK_SIZE_M": 16,
        "BLOCK_SIZE_N": 16,
        "BLOCK_SIZE_K": 512,
        "GROUP_SIZE_M": 8,
        "num_stages": 7,
        "num_warps": 8,
        "compile_time": 0.0025730133056640625
    },
    {
        "BLOCK_SIZE_M": 16,
        "BLOCK_SIZE_N": 16,
        "BLOCK_SIZE_K": 512,
        "GROUP_SIZE_M": 8,
        "num_stages": 7,
        "num_warps": 16,
        "compile_time": 0.0026154518127441406
    },
    {
        "BLOCK_SIZE_M": 16,
        "BLOCK_SIZE_N": 16,
        "BLOCK_SIZE_K": 512,
        "GROUP_SIZE_M": 8,
        "num_stages": 7,
        "num_warps": 32,
        "compile_time": 0.0025587081909179688
    },
    {
        "BLOCK_SIZE_M": 16,
        "BLOCK_SIZE_N": 16,
        "BLOCK_SIZE_K": 512,
        "GROUP_SIZE_M": 8,
        "num_stages": 8,
        "num_warps": 2,
        "compile_time": 0.0026078224182128906
    },
    {
        "BLOCK_SIZE_M": 16,
        "BLOCK_SIZE_N": 16,
        "BLOCK_SIZE_K": 512,
        "GROUP_SIZE_M": 8,
        "num_stages": 8,
        "num_warps": 4,
        "compile_time": 0.0027115345001220703
    },
    {
        "BLOCK_SIZE_M": 16,
        "BLOCK_SIZE_N": 16,
        "BLOCK_SIZE_K": 512,
        "GROUP_SIZE_M": 8,
        "num_stages": 8,
        "num_warps": 8,
        "compile_time": 0.0026082992553710938
    },
    {
        "BLOCK_SIZE_M": 16,
        "BLOCK_SIZE_N": 16,
        "BLOCK_SIZE_K": 512,
        "GROUP_SIZE_M": 8,
        "num_stages": 8,
        "num_warps": 16,
        "compile_time": 0.002541780471801758
    },
    {
        "BLOCK_SIZE_M": 16,
        "BLOCK_SIZE_N": 16,
        "BLOCK_SIZE_K": 512,
        "GROUP_SIZE_M": 8,
        "num_stages": 8,
        "num_warps": 32,
        "compile_time": 0.0025353431701660156
    },
    {
        "BLOCK_SIZE_M": 16,
        "BLOCK_SIZE_N": 32,
        "BLOCK_SIZE_K": 256,
        "GROUP_SIZE_M": 8,
        "num_stages": 8,
        "num_warps": 2,
        "compile_time": 0.0032699108123779297
    },
    {
        "BLOCK_SIZE_M": 16,
        "BLOCK_SIZE_N": 32,
        "BLOCK_SIZE_K": 256,
        "GROUP_SIZE_M": 8,
        "num_stages": 8,
        "num_warps": 4,
        "compile_time": 0.0026397705078125
    },
    {
        "BLOCK_SIZE_M": 16,
        "BLOCK_SIZE_N": 32,
        "BLOCK_SIZE_K": 256,
        "GROUP_SIZE_M": 8,
        "num_stages": 8,
        "num_warps": 8,
        "compile_time": 0.0027201175689697266
    },
    {
        "BLOCK_SIZE_M": 16,
        "BLOCK_SIZE_N": 32,
        "BLOCK_SIZE_K": 256,
        "GROUP_SIZE_M": 8,
        "num_stages": 8,
        "num_warps": 16,
        "compile_time": 0.002595663070678711
    },
    {
        "BLOCK_SIZE_M": 16,
        "BLOCK_SIZE_N": 32,
        "BLOCK_SIZE_K": 256,
        "GROUP_SIZE_M": 8,
        "num_stages": 8,
        "num_warps": 32,
        "compile_time": 0.0025773048400878906
    },
    {
        "BLOCK_SIZE_M": 16,
        "BLOCK_SIZE_N": 32,
        "BLOCK_SIZE_K": 512,
        "GROUP_SIZE_M": 8,
        "num_stages": 5,
        "num_warps": 2,
        "compile_time": 0.0035419464111328125
    },
    {
        "BLOCK_SIZE_M": 16,
        "BLOCK_SIZE_N": 32,
        "BLOCK_SIZE_K": 512,
        "GROUP_SIZE_M": 8,
        "num_stages": 5,
        "num_warps": 4,
        "compile_time": 0.0027463436126708984
    },
    {
        "BLOCK_SIZE_M": 16,
        "BLOCK_SIZE_N": 32,
        "BLOCK_SIZE_K": 512,
        "GROUP_SIZE_M": 8,
        "num_stages": 5,
        "num_warps": 8,
        "compile_time": 0.0026390552520751953
    },
    {
        "BLOCK_SIZE_M": 16,
        "BLOCK_SIZE_N": 32,
        "BLOCK_SIZE_K": 512,
        "GROUP_SIZE_M": 8,
        "num_stages": 5,
        "num_warps": 16,
        "compile_time": 0.0025811195373535156
    },
    {
        "BLOCK_SIZE_M": 16,
        "BLOCK_SIZE_N": 32,
        "BLOCK_SIZE_K": 512,
        "GROUP_SIZE_M": 8,
        "num_stages": 5,
        "num_warps": 32,
        "compile_time": 0.003522634506225586
    },
    {
        "BLOCK_SIZE_M": 16,
        "BLOCK_SIZE_N": 32,
        "BLOCK_SIZE_K": 512,
        "GROUP_SIZE_M": 8,
        "num_stages": 6,
        "num_warps": 2,
        "compile_time": 0.002698183059692383
    },
    {
        "BLOCK_SIZE_M": 16,
        "BLOCK_SIZE_N": 32,
        "BLOCK_SIZE_K": 512,
        "GROUP_SIZE_M": 8,
        "num_stages": 6,
        "num_warps": 4,
        "compile_time": 0.0026178359985351562
    },
    {
        "BLOCK_SIZE_M": 16,
        "BLOCK_SIZE_N": 32,
        "BLOCK_SIZE_K": 512,
        "GROUP_SIZE_M": 8,
        "num_stages": 6,
        "num_warps": 8,
        "compile_time": 0.002748250961303711
    },
    {
        "BLOCK_SIZE_M": 16,
        "BLOCK_SIZE_N": 32,
        "BLOCK_SIZE_K": 512,
        "GROUP_SIZE_M": 8,
        "num_stages": 6,
        "num_warps": 16,
        "compile_time": 0.0026400089263916016
    },
    {
        "BLOCK_SIZE_M": 16,
        "BLOCK_SIZE_N": 32,
        "BLOCK_SIZE_K": 512,
        "GROUP_SIZE_M": 8,
        "num_stages": 6,
        "num_warps": 32,
        "compile_time": 0.002584218978881836
    },
    {
        "BLOCK_SIZE_M": 16,
        "BLOCK_SIZE_N": 32,
        "BLOCK_SIZE_K": 512,
        "GROUP_SIZE_M": 8,
        "num_stages": 7,
        "num_warps": 2,
        "compile_time": 0.002741098403930664
    },
    {
        "BLOCK_SIZE_M": 16,
        "BLOCK_SIZE_N": 32,
        "BLOCK_SIZE_K": 512,
        "GROUP_SIZE_M": 8,
        "num_stages": 7,
        "num_warps": 4,
        "compile_time": 0.004119873046875
    },
    {
        "BLOCK_SIZE_M": 16,
        "BLOCK_SIZE_N": 32,
        "BLOCK_SIZE_K": 512,
        "GROUP_SIZE_M": 8,
        "num_stages": 7,
        "num_warps": 8,
        "compile_time": 0.002630472183227539
    },
    {
        "BLOCK_SIZE_M": 16,
        "BLOCK_SIZE_N": 32,
        "BLOCK_SIZE_K": 512,
        "GROUP_SIZE_M": 8,
        "num_stages": 7,
        "num_warps": 16,
        "compile_time": 0.0025908946990966797
    },
    {
        "BLOCK_SIZE_M": 16,
        "BLOCK_SIZE_N": 32,
        "BLOCK_SIZE_K": 512,
        "GROUP_SIZE_M": 8,
        "num_stages": 7,
        "num_warps": 32,
        "compile_time": 0.002569913864135742
    },
    {
        "BLOCK_SIZE_M": 16,
        "BLOCK_SIZE_N": 32,
        "BLOCK_SIZE_K": 512,
        "GROUP_SIZE_M": 8,
        "num_stages": 8,
        "num_warps": 2,
        "compile_time": 0.002736806869506836
    },
    {
        "BLOCK_SIZE_M": 16,
        "BLOCK_SIZE_N": 32,
        "BLOCK_SIZE_K": 512,
        "GROUP_SIZE_M": 8,
        "num_stages": 8,
        "num_warps": 4,
        "compile_time": 0.0027327537536621094
    },
    {
        "BLOCK_SIZE_M": 16,
        "BLOCK_SIZE_N": 32,
        "BLOCK_SIZE_K": 512,
        "GROUP_SIZE_M": 8,
        "num_stages": 8,
        "num_warps": 8,
        "compile_time": 0.0026214122772216797
    },
    {
        "BLOCK_SIZE_M": 16,
        "BLOCK_SIZE_N": 32,
        "BLOCK_SIZE_K": 512,
        "GROUP_SIZE_M": 8,
        "num_stages": 8,
        "num_warps": 16,
        "compile_time": 0.0036156177520751953
    },
    {
        "BLOCK_SIZE_M": 16,
        "BLOCK_SIZE_N": 32,
        "BLOCK_SIZE_K": 512,
        "GROUP_SIZE_M": 8,
        "num_stages": 8,
        "num_warps": 32,
        "compile_time": 0.002615690231323242
    },
    {
        "BLOCK_SIZE_M": 16,
        "BLOCK_SIZE_N": 64,
        "BLOCK_SIZE_K": 256,
        "GROUP_SIZE_M": 8,
        "num_stages": 6,
        "num_warps": 2,
        "compile_time": 0.0033152103424072266
    },
    {
        "BLOCK_SIZE_M": 16,
        "BLOCK_SIZE_N": 64,
        "BLOCK_SIZE_K": 256,
        "GROUP_SIZE_M": 8,
        "num_stages": 6,
        "num_warps": 4,
        "compile_time": 0.003489255905151367
    },
    {
        "BLOCK_SIZE_M": 16,
        "BLOCK_SIZE_N": 64,
        "BLOCK_SIZE_K": 256,
        "GROUP_SIZE_M": 8,
        "num_stages": 6,
        "num_warps": 8,
        "compile_time": 0.002593517303466797
    },
    {
        "BLOCK_SIZE_M": 16,
        "BLOCK_SIZE_N": 64,
        "BLOCK_SIZE_K": 256,
        "GROUP_SIZE_M": 8,
        "num_stages": 6,
        "num_warps": 16,
        "compile_time": 0.002585887908935547
    },
    {
        "BLOCK_SIZE_M": 16,
        "BLOCK_SIZE_N": 64,
        "BLOCK_SIZE_K": 256,
        "GROUP_SIZE_M": 8,
        "num_stages": 6,
        "num_warps": 32,
        "compile_time": 0.002603292465209961
    },
    {
        "BLOCK_SIZE_M": 16,
        "BLOCK_SIZE_N": 64,
        "BLOCK_SIZE_K": 256,
        "GROUP_SIZE_M": 8,
        "num_stages": 7,
        "num_warps": 2,
        "compile_time": 0.0026960372924804688
    },
    {
        "BLOCK_SIZE_M": 16,
        "BLOCK_SIZE_N": 64,
        "BLOCK_SIZE_K": 256,
        "GROUP_SIZE_M": 8,
        "num_stages": 7,
        "num_warps": 4,
        "compile_time": 0.0026428699493408203
    },
    {
        "BLOCK_SIZE_M": 16,
        "BLOCK_SIZE_N": 64,
        "BLOCK_SIZE_K": 256,
        "GROUP_SIZE_M": 8,
        "num_stages": 7,
        "num_warps": 8,
        "compile_time": 0.002437114715576172
    },
    {
        "BLOCK_SIZE_M": 16,
        "BLOCK_SIZE_N": 64,
        "BLOCK_SIZE_K": 256,
        "GROUP_SIZE_M": 8,
        "num_stages": 7,
        "num_warps": 16,
        "compile_time": 0.003534078598022461
    },
    {
        "BLOCK_SIZE_M": 16,
        "BLOCK_SIZE_N": 64,
        "BLOCK_SIZE_K": 256,
        "GROUP_SIZE_M": 8,
        "num_stages": 7,
        "num_warps": 32,
        "compile_time": 0.0025777816772460938
    },
    {
        "BLOCK_SIZE_M": 16,
        "BLOCK_SIZE_N": 64,
        "BLOCK_SIZE_K": 256,
        "GROUP_SIZE_M": 8,
        "num_stages": 8,
        "num_warps": 2,
        "compile_time": 0.0027458667755126953
    },
    {
        "BLOCK_SIZE_M": 16,
        "BLOCK_SIZE_N": 64,
        "BLOCK_SIZE_K": 256,
        "GROUP_SIZE_M": 8,
        "num_stages": 8,
        "num_warps": 4,
        "compile_time": 0.0026628971099853516
    },
    {
        "BLOCK_SIZE_M": 16,
        "BLOCK_SIZE_N": 64,
        "BLOCK_SIZE_K": 256,
        "GROUP_SIZE_M": 8,
        "num_stages": 8,
        "num_warps": 8,
        "compile_time": 0.0025937557220458984
    },
    {
        "BLOCK_SIZE_M": 16,
        "BLOCK_SIZE_N": 64,
        "BLOCK_SIZE_K": 256,
        "GROUP_SIZE_M": 8,
        "num_stages": 8,
        "num_warps": 16,
        "compile_time": 0.002586841583251953
    },
    {
        "BLOCK_SIZE_M": 16,
        "BLOCK_SIZE_N": 64,
        "BLOCK_SIZE_K": 256,
        "GROUP_SIZE_M": 8,
        "num_stages": 8,
        "num_warps": 32,
        "compile_time": 0.002586841583251953
    },
    {
        "BLOCK_SIZE_M": 16,
        "BLOCK_SIZE_N": 64,
        "BLOCK_SIZE_K": 512,
        "GROUP_SIZE_M": 8,
        "num_stages": 3,
        "num_warps": 2,
        "compile_time": 10.638103008270264
    },
    {
        "BLOCK_SIZE_M": 16,
        "BLOCK_SIZE_N": 64,
        "BLOCK_SIZE_K": 512,
        "GROUP_SIZE_M": 8,
        "num_stages": 4,
        "num_warps": 2,
        "compile_time": 10.752330780029297
    },
    {
        "BLOCK_SIZE_M": 16,
        "BLOCK_SIZE_N": 64,
        "BLOCK_SIZE_K": 512,
        "GROUP_SIZE_M": 8,
        "num_stages": 4,
        "num_warps": 4,
        "compile_time": 0.004271984100341797
    },
    {
        "BLOCK_SIZE_M": 16,
        "BLOCK_SIZE_N": 64,
        "BLOCK_SIZE_K": 512,
        "GROUP_SIZE_M": 8,
        "num_stages": 4,
        "num_warps": 8,
        "compile_time": 0.0030832290649414062
    },
    {
        "BLOCK_SIZE_M": 16,
        "BLOCK_SIZE_N": 64,
        "BLOCK_SIZE_K": 512,
        "GROUP_SIZE_M": 8,
        "num_stages": 4,
        "num_warps": 16,
        "compile_time": 0.0030090808868408203
    },
    {
        "BLOCK_SIZE_M": 16,
        "BLOCK_SIZE_N": 64,
        "BLOCK_SIZE_K": 512,
        "GROUP_SIZE_M": 8,
        "num_stages": 4,
        "num_warps": 32,
        "compile_time": 0.0030012130737304688
    },
    {
        "BLOCK_SIZE_M": 16,
        "BLOCK_SIZE_N": 64,
        "BLOCK_SIZE_K": 512,
        "GROUP_SIZE_M": 8,
        "num_stages": 5,
        "num_warps": 2,
        "compile_time": 10.751603841781616
    },
    {
        "BLOCK_SIZE_M": 16,
        "BLOCK_SIZE_N": 64,
        "BLOCK_SIZE_K": 512,
        "GROUP_SIZE_M": 8,
        "num_stages": 5,
        "num_warps": 4,
        "compile_time": 0.004162788391113281
    },
    {
        "BLOCK_SIZE_M": 16,
        "BLOCK_SIZE_N": 64,
        "BLOCK_SIZE_K": 512,
        "GROUP_SIZE_M": 8,
        "num_stages": 5,
        "num_warps": 8,
        "compile_time": 0.003104686737060547
    },
    {
        "BLOCK_SIZE_M": 16,
        "BLOCK_SIZE_N": 64,
        "BLOCK_SIZE_K": 512,
        "GROUP_SIZE_M": 8,
        "num_stages": 5,
        "num_warps": 16,
        "compile_time": 0.0038683414459228516
    },
    {
        "BLOCK_SIZE_M": 16,
        "BLOCK_SIZE_N": 64,
        "BLOCK_SIZE_K": 512,
        "GROUP_SIZE_M": 8,
        "num_stages": 5,
        "num_warps": 32,
        "compile_time": 0.0027959346771240234
    },
    {
        "BLOCK_SIZE_M": 16,
        "BLOCK_SIZE_N": 64,
        "BLOCK_SIZE_K": 512,
        "GROUP_SIZE_M": 8,
        "num_stages": 6,
        "num_warps": 2,
        "compile_time": 10.745567798614502
    },
    {
        "BLOCK_SIZE_M": 16,
        "BLOCK_SIZE_N": 64,
        "BLOCK_SIZE_K": 512,
        "GROUP_SIZE_M": 8,
        "num_stages": 6,
        "num_warps": 4,
        "compile_time": 0.004302978515625
    },
    {
        "BLOCK_SIZE_M": 16,
        "BLOCK_SIZE_N": 64,
        "BLOCK_SIZE_K": 512,
        "GROUP_SIZE_M": 8,
        "num_stages": 6,
        "num_warps": 8,
        "compile_time": 0.0031151771545410156
    },
    {
        "BLOCK_SIZE_M": 16,
        "BLOCK_SIZE_N": 64,
        "BLOCK_SIZE_K": 512,
        "GROUP_SIZE_M": 8,
        "num_stages": 6,
        "num_warps": 16,
        "compile_time": 0.0046634674072265625
    },
    {
        "BLOCK_SIZE_M": 16,
        "BLOCK_SIZE_N": 64,
        "BLOCK_SIZE_K": 512,
        "GROUP_SIZE_M": 8,
        "num_stages": 6,
        "num_warps": 32,
        "compile_time": 0.0030257701873779297
    },
    {
        "BLOCK_SIZE_M": 16,
        "BLOCK_SIZE_N": 64,
        "BLOCK_SIZE_K": 512,
        "GROUP_SIZE_M": 8,
        "num_stages": 7,
        "num_warps": 2,
        "compile_time": 11.050418853759766
    },
    {
        "BLOCK_SIZE_M": 16,
        "BLOCK_SIZE_N": 64,
        "BLOCK_SIZE_K": 512,
        "GROUP_SIZE_M": 8,
        "num_stages": 7,
        "num_warps": 4,
        "compile_time": 0.0044023990631103516
    },
    {
        "BLOCK_SIZE_M": 16,
        "BLOCK_SIZE_N": 64,
        "BLOCK_SIZE_K": 512,
        "GROUP_SIZE_M": 8,
        "num_stages": 7,
        "num_warps": 8,
        "compile_time": 0.0035021305084228516
    },
    {
        "BLOCK_SIZE_M": 16,
        "BLOCK_SIZE_N": 64,
        "BLOCK_SIZE_K": 512,
        "GROUP_SIZE_M": 8,
        "num_stages": 7,
        "num_warps": 16,
        "compile_time": 0.003114938735961914
    },
    {
        "BLOCK_SIZE_M": 16,
        "BLOCK_SIZE_N": 64,
        "BLOCK_SIZE_K": 512,
        "GROUP_SIZE_M": 8,
        "num_stages": 7,
        "num_warps": 32,
        "compile_time": 0.003103971481323242
    },
    {
        "BLOCK_SIZE_M": 16,
        "BLOCK_SIZE_N": 64,
        "BLOCK_SIZE_K": 512,
        "GROUP_SIZE_M": 8,
        "num_stages": 8,
        "num_warps": 2,
        "compile_time": 11.514430284500122
    },
    {
        "BLOCK_SIZE_M": 16,
        "BLOCK_SIZE_N": 64,
        "BLOCK_SIZE_K": 512,
        "GROUP_SIZE_M": 8,
        "num_stages": 8,
        "num_warps": 4,
        "compile_time": 0.004130363464355469
    },
    {
        "BLOCK_SIZE_M": 16,
        "BLOCK_SIZE_N": 64,
        "BLOCK_SIZE_K": 512,
        "GROUP_SIZE_M": 8,
        "num_stages": 8,
        "num_warps": 8,
        "compile_time": 0.0032753944396972656
    },
    {
        "BLOCK_SIZE_M": 16,
        "BLOCK_SIZE_N": 64,
        "BLOCK_SIZE_K": 512,
        "GROUP_SIZE_M": 8,
        "num_stages": 8,
        "num_warps": 16,
        "compile_time": 0.003093719482421875
    },
    {
        "BLOCK_SIZE_M": 16,
        "BLOCK_SIZE_N": 64,
        "BLOCK_SIZE_K": 512,
        "GROUP_SIZE_M": 8,
        "num_stages": 8,
        "num_warps": 32,
        "compile_time": 0.0030236244201660156
    },
    {
        "BLOCK_SIZE_M": 16,
        "BLOCK_SIZE_N": 128,
        "BLOCK_SIZE_K": 128,
        "GROUP_SIZE_M": 8,
        "num_stages": 6,
        "num_warps": 2,
        "compile_time": 0.003481149673461914
    },
    {
        "BLOCK_SIZE_M": 16,
        "BLOCK_SIZE_N": 128,
        "BLOCK_SIZE_K": 128,
        "GROUP_SIZE_M": 8,
        "num_stages": 6,
        "num_warps": 4,
        "compile_time": 0.002657651901245117
    },
    {
        "BLOCK_SIZE_M": 16,
        "BLOCK_SIZE_N": 128,
        "BLOCK_SIZE_K": 128,
        "GROUP_SIZE_M": 8,
        "num_stages": 6,
        "num_warps": 8,
        "compile_time": 0.002593517303466797
    },
    {
        "BLOCK_SIZE_M": 16,
        "BLOCK_SIZE_N": 128,
        "BLOCK_SIZE_K": 128,
        "GROUP_SIZE_M": 8,
        "num_stages": 6,
        "num_warps": 16,
        "compile_time": 0.002585887908935547
    },
    {
        "BLOCK_SIZE_M": 16,
        "BLOCK_SIZE_N": 128,
        "BLOCK_SIZE_K": 128,
        "GROUP_SIZE_M": 8,
        "num_stages": 6,
        "num_warps": 32,
        "compile_time": 0.002568960189819336
    },
    {
        "BLOCK_SIZE_M": 16,
        "BLOCK_SIZE_N": 128,
        "BLOCK_SIZE_K": 128,
        "GROUP_SIZE_M": 8,
        "num_stages": 7,
        "num_warps": 2,
        "compile_time": 0.0028634071350097656
    },
    {
        "BLOCK_SIZE_M": 16,
        "BLOCK_SIZE_N": 128,
        "BLOCK_SIZE_K": 128,
        "GROUP_SIZE_M": 8,
        "num_stages": 7,
        "num_warps": 4,
        "compile_time": 0.0026886463165283203
    },
    {
        "BLOCK_SIZE_M": 16,
        "BLOCK_SIZE_N": 128,
        "BLOCK_SIZE_K": 128,
        "GROUP_SIZE_M": 8,
        "num_stages": 7,
        "num_warps": 8,
        "compile_time": 0.002681255340576172
    },
    {
        "BLOCK_SIZE_M": 16,
        "BLOCK_SIZE_N": 128,
        "BLOCK_SIZE_K": 128,
        "GROUP_SIZE_M": 8,
        "num_stages": 7,
        "num_warps": 16,
        "compile_time": 0.002614259719848633
    },
    {
        "BLOCK_SIZE_M": 16,
        "BLOCK_SIZE_N": 128,
        "BLOCK_SIZE_K": 128,
        "GROUP_SIZE_M": 8,
        "num_stages": 7,
        "num_warps": 32,
        "compile_time": 0.002583742141723633
    },
    {
        "BLOCK_SIZE_M": 16,
        "BLOCK_SIZE_N": 128,
        "BLOCK_SIZE_K": 128,
        "GROUP_SIZE_M": 8,
        "num_stages": 8,
        "num_warps": 2,
        "compile_time": 0.0027837753295898438
    },
    {
        "BLOCK_SIZE_M": 16,
        "BLOCK_SIZE_N": 128,
        "BLOCK_SIZE_K": 128,
        "GROUP_SIZE_M": 8,
        "num_stages": 8,
        "num_warps": 4,
        "compile_time": 0.0026531219482421875
    },
    {
        "BLOCK_SIZE_M": 16,
        "BLOCK_SIZE_N": 128,
        "BLOCK_SIZE_K": 128,
        "GROUP_SIZE_M": 8,
        "num_stages": 8,
        "num_warps": 8,
        "compile_time": 0.0028243064880371094
    },
    {
        "BLOCK_SIZE_M": 16,
        "BLOCK_SIZE_N": 128,
        "BLOCK_SIZE_K": 128,
        "GROUP_SIZE_M": 8,
        "num_stages": 8,
        "num_warps": 16,
        "compile_time": 0.0025739669799804688
    },
    {
        "BLOCK_SIZE_M": 16,
        "BLOCK_SIZE_N": 128,
        "BLOCK_SIZE_K": 128,
        "GROUP_SIZE_M": 8,
        "num_stages": 8,
        "num_warps": 32,
        "compile_time": 0.0025832653045654297
    },
    {
        "BLOCK_SIZE_M": 16,
        "BLOCK_SIZE_N": 128,
        "BLOCK_SIZE_K": 256,
        "GROUP_SIZE_M": 8,
        "num_stages": 3,
        "num_warps": 2,
        "compile_time": 10.41577696800232
    },
    {
        "BLOCK_SIZE_M": 16,
        "BLOCK_SIZE_N": 128,
        "BLOCK_SIZE_K": 256,
        "GROUP_SIZE_M": 8,
        "num_stages": 4,
        "num_warps": 2,
        "compile_time": 10.638039112091064
    },
    {
        "BLOCK_SIZE_M": 16,
        "BLOCK_SIZE_N": 128,
        "BLOCK_SIZE_K": 256,
        "GROUP_SIZE_M": 8,
        "num_stages": 4,
        "num_warps": 4,
        "compile_time": 0.003794431686401367
    },
    {
        "BLOCK_SIZE_M": 16,
        "BLOCK_SIZE_N": 128,
        "BLOCK_SIZE_K": 256,
        "GROUP_SIZE_M": 8,
        "num_stages": 4,
        "num_warps": 8,
        "compile_time": 0.0033729076385498047
    },
    {
        "BLOCK_SIZE_M": 16,
        "BLOCK_SIZE_N": 128,
        "BLOCK_SIZE_K": 256,
        "GROUP_SIZE_M": 8,
        "num_stages": 4,
        "num_warps": 16,
        "compile_time": 0.0029740333557128906
    },
    {
        "BLOCK_SIZE_M": 16,
        "BLOCK_SIZE_N": 128,
        "BLOCK_SIZE_K": 256,
        "GROUP_SIZE_M": 8,
        "num_stages": 4,
        "num_warps": 32,
        "compile_time": 0.0029773712158203125
    },
    {
        "BLOCK_SIZE_M": 16,
        "BLOCK_SIZE_N": 128,
        "BLOCK_SIZE_K": 256,
        "GROUP_SIZE_M": 8,
        "num_stages": 5,
        "num_warps": 2,
        "compile_time": 10.816604375839233
    },
    {
        "BLOCK_SIZE_M": 16,
        "BLOCK_SIZE_N": 128,
        "BLOCK_SIZE_K": 256,
        "GROUP_SIZE_M": 8,
        "num_stages": 5,
        "num_warps": 4,
        "compile_time": 0.0042133331298828125
    },
    {
        "BLOCK_SIZE_M": 16,
        "BLOCK_SIZE_N": 128,
        "BLOCK_SIZE_K": 256,
        "GROUP_SIZE_M": 8,
        "num_stages": 5,
        "num_warps": 8,
        "compile_time": 0.0031058788299560547
    },
    {
        "BLOCK_SIZE_M": 16,
        "BLOCK_SIZE_N": 128,
        "BLOCK_SIZE_K": 256,
        "GROUP_SIZE_M": 8,
        "num_stages": 5,
        "num_warps": 16,
        "compile_time": 0.0030095577239990234
    },
    {
        "BLOCK_SIZE_M": 16,
        "BLOCK_SIZE_N": 128,
        "BLOCK_SIZE_K": 256,
        "GROUP_SIZE_M": 8,
        "num_stages": 5,
        "num_warps": 32,
        "compile_time": 0.0030019283294677734
    },
    {
        "BLOCK_SIZE_M": 16,
        "BLOCK_SIZE_N": 128,
        "BLOCK_SIZE_K": 256,
        "GROUP_SIZE_M": 8,
        "num_stages": 6,
        "num_warps": 2,
        "compile_time": 10.748252153396606
    },
    {
        "BLOCK_SIZE_M": 16,
        "BLOCK_SIZE_N": 128,
        "BLOCK_SIZE_K": 256,
        "GROUP_SIZE_M": 8,
        "num_stages": 6,
        "num_warps": 4,
        "compile_time": 0.007914066314697266
    },
    {
        "BLOCK_SIZE_M": 16,
        "BLOCK_SIZE_N": 128,
        "BLOCK_SIZE_K": 256,
        "GROUP_SIZE_M": 8,
        "num_stages": 6,
        "num_warps": 8,
        "compile_time": 0.0054073333740234375
    },
    {
        "BLOCK_SIZE_M": 16,
        "BLOCK_SIZE_N": 128,
        "BLOCK_SIZE_K": 256,
        "GROUP_SIZE_M": 8,
        "num_stages": 6,
        "num_warps": 16,
        "compile_time": 0.0043582916259765625
    },
    {
        "BLOCK_SIZE_M": 16,
        "BLOCK_SIZE_N": 128,
        "BLOCK_SIZE_K": 256,
        "GROUP_SIZE_M": 8,
        "num_stages": 6,
        "num_warps": 32,
        "compile_time": 0.004477262496948242
    },
    {
        "BLOCK_SIZE_M": 16,
        "BLOCK_SIZE_N": 128,
        "BLOCK_SIZE_K": 256,
        "GROUP_SIZE_M": 8,
        "num_stages": 7,
        "num_warps": 2,
        "compile_time": 10.8809814453125
    },
    {
        "BLOCK_SIZE_M": 16,
        "BLOCK_SIZE_N": 128,
        "BLOCK_SIZE_K": 256,
        "GROUP_SIZE_M": 8,
        "num_stages": 7,
        "num_warps": 4,
        "compile_time": 0.004627704620361328
    },
    {
        "BLOCK_SIZE_M": 16,
        "BLOCK_SIZE_N": 128,
        "BLOCK_SIZE_K": 256,
        "GROUP_SIZE_M": 8,
        "num_stages": 7,
        "num_warps": 8,
        "compile_time": 0.0030794143676757812
    },
    {
        "BLOCK_SIZE_M": 16,
        "BLOCK_SIZE_N": 128,
        "BLOCK_SIZE_K": 256,
        "GROUP_SIZE_M": 8,
        "num_stages": 7,
        "num_warps": 16,
        "compile_time": 0.0042324066162109375
    },
    {
        "BLOCK_SIZE_M": 16,
        "BLOCK_SIZE_N": 128,
        "BLOCK_SIZE_K": 256,
        "GROUP_SIZE_M": 8,
        "num_stages": 7,
        "num_warps": 32,
        "compile_time": 0.0029954910278320312
    },
    {
        "BLOCK_SIZE_M": 16,
        "BLOCK_SIZE_N": 128,
        "BLOCK_SIZE_K": 256,
        "GROUP_SIZE_M": 8,
        "num_stages": 8,
        "num_warps": 2,
        "compile_time": 11.156843423843384
    },
    {
        "BLOCK_SIZE_M": 16,
        "BLOCK_SIZE_N": 128,
        "BLOCK_SIZE_K": 256,
        "GROUP_SIZE_M": 8,
        "num_stages": 8,
        "num_warps": 4,
        "compile_time": 0.004277706146240234
    },
    {
        "BLOCK_SIZE_M": 16,
        "BLOCK_SIZE_N": 128,
        "BLOCK_SIZE_K": 256,
        "GROUP_SIZE_M": 8,
        "num_stages": 8,
        "num_warps": 8,
        "compile_time": 0.003108501434326172
    },
    {
        "BLOCK_SIZE_M": 16,
        "BLOCK_SIZE_N": 128,
        "BLOCK_SIZE_K": 256,
        "GROUP_SIZE_M": 8,
        "num_stages": 8,
        "num_warps": 16,
        "compile_time": 0.003010272979736328
    },
    {
        "BLOCK_SIZE_M": 16,
        "BLOCK_SIZE_N": 128,
        "BLOCK_SIZE_K": 256,
        "GROUP_SIZE_M": 8,
        "num_stages": 8,
        "num_warps": 32,
        "compile_time": 0.0029973983764648438
    },
    {
        "BLOCK_SIZE_M": 16,
        "BLOCK_SIZE_N": 128,
        "BLOCK_SIZE_K": 512,
        "GROUP_SIZE_M": 8,
        "num_stages": 1,
        "num_warps": 2,
        "compile_time": 7.553041458129883
    },
    {
        "BLOCK_SIZE_M": 16,
        "BLOCK_SIZE_N": 128,
        "BLOCK_SIZE_K": 512,
        "GROUP_SIZE_M": 8,
        "num_stages": 2,
        "num_warps": 2,
        "compile_time": 7.711896657943726
    },
    {
        "BLOCK_SIZE_M": 16,
        "BLOCK_SIZE_N": 128,
        "BLOCK_SIZE_K": 512,
        "GROUP_SIZE_M": 8,
        "num_stages": 3,
        "num_warps": 2,
        "compile_time": 99.44891595840454
    },
    {
        "BLOCK_SIZE_M": 16,
        "BLOCK_SIZE_N": 128,
        "BLOCK_SIZE_K": 512,
        "GROUP_SIZE_M": 8,
        "num_stages": 3,
        "num_warps": 4,
        "compile_time": 10.536746740341187
    },
    {
        "BLOCK_SIZE_M": 16,
        "BLOCK_SIZE_N": 128,
        "BLOCK_SIZE_K": 512,
        "GROUP_SIZE_M": 8,
        "num_stages": 3,
        "num_warps": 8,
        "compile_time": 0.004439115524291992
    },
    {
        "BLOCK_SIZE_M": 16,
        "BLOCK_SIZE_N": 128,
        "BLOCK_SIZE_K": 512,
        "GROUP_SIZE_M": 8,
        "num_stages": 3,
        "num_warps": 16,
        "compile_time": 0.003052234649658203
    },
    {
        "BLOCK_SIZE_M": 16,
        "BLOCK_SIZE_N": 128,
        "BLOCK_SIZE_K": 512,
        "GROUP_SIZE_M": 8,
        "num_stages": 3,
        "num_warps": 32,
        "compile_time": 0.004044055938720703
    },
    {
        "BLOCK_SIZE_M": 16,
        "BLOCK_SIZE_N": 128,
        "BLOCK_SIZE_K": 512,
        "GROUP_SIZE_M": 8,
        "num_stages": 4,
        "num_warps": 2,
        "compile_time": 98.18996214866638
    },
    {
        "BLOCK_SIZE_M": 16,
        "BLOCK_SIZE_N": 128,
        "BLOCK_SIZE_K": 512,
        "GROUP_SIZE_M": 8,
        "num_stages": 4,
        "num_warps": 4,
        "compile_time": 10.732255220413208
    },
    {
        "BLOCK_SIZE_M": 16,
        "BLOCK_SIZE_N": 128,
        "BLOCK_SIZE_K": 512,
        "GROUP_SIZE_M": 8,
        "num_stages": 4,
        "num_warps": 8,
        "compile_time": 0.004275798797607422
    },
    {
        "BLOCK_SIZE_M": 16,
        "BLOCK_SIZE_N": 128,
        "BLOCK_SIZE_K": 512,
        "GROUP_SIZE_M": 8,
        "num_stages": 4,
        "num_warps": 16,
        "compile_time": 0.003220081329345703
    },
    {
        "BLOCK_SIZE_M": 16,
        "BLOCK_SIZE_N": 128,
        "BLOCK_SIZE_K": 512,
        "GROUP_SIZE_M": 8,
        "num_stages": 4,
        "num_warps": 32,
        "compile_time": 0.0030028820037841797
    },
    {
        "BLOCK_SIZE_M": 16,
        "BLOCK_SIZE_N": 128,
        "BLOCK_SIZE_K": 512,
        "GROUP_SIZE_M": 8,
        "num_stages": 5,
        "num_warps": 2,
        "compile_time": 6.160400629043579
    },
    {
        "BLOCK_SIZE_M": 16,
        "BLOCK_SIZE_N": 128,
        "BLOCK_SIZE_K": 512,
        "GROUP_SIZE_M": 8,
        "num_stages": 5,
        "num_warps": 4,
        "compile_time": 10.958243370056152
    },
    {
        "BLOCK_SIZE_M": 16,
        "BLOCK_SIZE_N": 128,
        "BLOCK_SIZE_K": 512,
        "GROUP_SIZE_M": 8,
        "num_stages": 5,
        "num_warps": 8,
        "compile_time": 0.00441431999206543
    },
    {
        "BLOCK_SIZE_M": 16,
        "BLOCK_SIZE_N": 128,
        "BLOCK_SIZE_K": 512,
        "GROUP_SIZE_M": 8,
        "num_stages": 5,
        "num_warps": 16,
        "compile_time": 0.0030939579010009766
    },
    {
        "BLOCK_SIZE_M": 16,
        "BLOCK_SIZE_N": 128,
        "BLOCK_SIZE_K": 512,
        "GROUP_SIZE_M": 8,
        "num_stages": 5,
        "num_warps": 32,
        "compile_time": 0.0030183792114257812
    },
    {
        "BLOCK_SIZE_M": 16,
        "BLOCK_SIZE_N": 128,
        "BLOCK_SIZE_K": 512,
        "GROUP_SIZE_M": 8,
        "num_stages": 6,
        "num_warps": 2,
        "compile_time": 6.503270626068115
    },
    {
        "BLOCK_SIZE_M": 16,
        "BLOCK_SIZE_N": 128,
        "BLOCK_SIZE_K": 512,
        "GROUP_SIZE_M": 8,
        "num_stages": 6,
        "num_warps": 4,
        "compile_time": 11.257031679153442
    },
    {
        "BLOCK_SIZE_M": 16,
        "BLOCK_SIZE_N": 128,
        "BLOCK_SIZE_K": 512,
        "GROUP_SIZE_M": 8,
        "num_stages": 6,
        "num_warps": 8,
        "compile_time": 0.004180192947387695
    },
    {
        "BLOCK_SIZE_M": 16,
        "BLOCK_SIZE_N": 128,
        "BLOCK_SIZE_K": 512,
        "GROUP_SIZE_M": 8,
        "num_stages": 6,
        "num_warps": 16,
        "compile_time": 0.003097057342529297
    },
    {
        "BLOCK_SIZE_M": 16,
        "BLOCK_SIZE_N": 128,
        "BLOCK_SIZE_K": 512,
        "GROUP_SIZE_M": 8,
        "num_stages": 6,
        "num_warps": 32,
        "compile_time": 0.0030748844146728516
    },
    {
        "BLOCK_SIZE_M": 16,
        "BLOCK_SIZE_N": 128,
        "BLOCK_SIZE_K": 512,
        "GROUP_SIZE_M": 8,
        "num_stages": 7,
        "num_warps": 2,
        "compile_time": 6.8973798751831055
    },
    {
        "BLOCK_SIZE_M": 16,
        "BLOCK_SIZE_N": 128,
        "BLOCK_SIZE_K": 512,
        "GROUP_SIZE_M": 8,
        "num_stages": 7,
        "num_warps": 4,
        "compile_time": 11.460196495056152
    },
    {
        "BLOCK_SIZE_M": 16,
        "BLOCK_SIZE_N": 128,
        "BLOCK_SIZE_K": 512,
        "GROUP_SIZE_M": 8,
        "num_stages": 7,
        "num_warps": 8,
        "compile_time": 0.004478931427001953
    },
    {
        "BLOCK_SIZE_M": 16,
        "BLOCK_SIZE_N": 128,
        "BLOCK_SIZE_K": 512,
        "GROUP_SIZE_M": 8,
        "num_stages": 7,
        "num_warps": 16,
        "compile_time": 0.0031135082244873047
    },
    {
        "BLOCK_SIZE_M": 16,
        "BLOCK_SIZE_N": 128,
        "BLOCK_SIZE_K": 512,
        "GROUP_SIZE_M": 8,
        "num_stages": 7,
        "num_warps": 32,
        "compile_time": 0.003116607666015625
    },
    {
        "BLOCK_SIZE_M": 16,
        "BLOCK_SIZE_N": 128,
        "BLOCK_SIZE_K": 512,
        "GROUP_SIZE_M": 8,
        "num_stages": 8,
        "num_warps": 2,
        "compile_time": 7.292834997177124
    },
    {
        "BLOCK_SIZE_M": 16,
        "BLOCK_SIZE_N": 128,
        "BLOCK_SIZE_K": 512,
        "GROUP_SIZE_M": 8,
        "num_stages": 8,
        "num_warps": 4,
        "compile_time": 11.701653003692627
    },
    {
        "BLOCK_SIZE_M": 16,
        "BLOCK_SIZE_N": 128,
        "BLOCK_SIZE_K": 512,
        "GROUP_SIZE_M": 8,
        "num_stages": 8,
        "num_warps": 8,
        "compile_time": 0.005261659622192383
    },
    {
        "BLOCK_SIZE_M": 16,
        "BLOCK_SIZE_N": 128,
        "BLOCK_SIZE_K": 512,
        "GROUP_SIZE_M": 8,
        "num_stages": 8,
        "num_warps": 16,
        "compile_time": 0.003094911575317383
    },
    {
        "BLOCK_SIZE_M": 16,
        "BLOCK_SIZE_N": 128,
        "BLOCK_SIZE_K": 512,
        "GROUP_SIZE_M": 8,
        "num_stages": 8,
        "num_warps": 32,
        "compile_time": 0.0042417049407958984
    },
    {
        "BLOCK_SIZE_M": 16,
        "BLOCK_SIZE_N": 256,
        "BLOCK_SIZE_K": 64,
        "GROUP_SIZE_M": 8,
        "num_stages": 6,
        "num_warps": 2,
        "compile_time": 0.0035910606384277344
    },
    {
        "BLOCK_SIZE_M": 16,
        "BLOCK_SIZE_N": 256,
        "BLOCK_SIZE_K": 64,
        "GROUP_SIZE_M": 8,
        "num_stages": 6,
        "num_warps": 4,
        "compile_time": 0.0026617050170898438
    },
    {
        "BLOCK_SIZE_M": 16,
        "BLOCK_SIZE_N": 256,
        "BLOCK_SIZE_K": 64,
        "GROUP_SIZE_M": 8,
        "num_stages": 6,
        "num_warps": 8,
        "compile_time": 0.0025887489318847656
    },
    {
        "BLOCK_SIZE_M": 16,
        "BLOCK_SIZE_N": 256,
        "BLOCK_SIZE_K": 64,
        "GROUP_SIZE_M": 8,
        "num_stages": 6,
        "num_warps": 16,
        "compile_time": 0.002568960189819336
    },
    {
        "BLOCK_SIZE_M": 16,
        "BLOCK_SIZE_N": 256,
        "BLOCK_SIZE_K": 64,
        "GROUP_SIZE_M": 8,
        "num_stages": 7,
        "num_warps": 2,
        "compile_time": 0.0045354366302490234
    },
    {
        "BLOCK_SIZE_M": 16,
        "BLOCK_SIZE_N": 256,
        "BLOCK_SIZE_K": 64,
        "GROUP_SIZE_M": 8,
        "num_stages": 7,
        "num_warps": 4,
        "compile_time": 0.002726316452026367
    },
    {
        "BLOCK_SIZE_M": 16,
        "BLOCK_SIZE_N": 256,
        "BLOCK_SIZE_K": 64,
        "GROUP_SIZE_M": 8,
        "num_stages": 7,
        "num_warps": 8,
        "compile_time": 0.0025959014892578125
    },
    {
        "BLOCK_SIZE_M": 16,
        "BLOCK_SIZE_N": 256,
        "BLOCK_SIZE_K": 64,
        "GROUP_SIZE_M": 8,
        "num_stages": 7,
        "num_warps": 16,
        "compile_time": 0.002568960189819336
    },
    {
        "BLOCK_SIZE_M": 16,
        "BLOCK_SIZE_N": 256,
        "BLOCK_SIZE_K": 64,
        "GROUP_SIZE_M": 8,
        "num_stages": 7,
        "num_warps": 32,
        "compile_time": 0.002535581588745117
    },
    {
        "BLOCK_SIZE_M": 16,
        "BLOCK_SIZE_N": 256,
        "BLOCK_SIZE_K": 64,
        "GROUP_SIZE_M": 8,
        "num_stages": 8,
        "num_warps": 2,
        "compile_time": 0.002773284912109375
    },
    {
        "BLOCK_SIZE_M": 16,
        "BLOCK_SIZE_N": 256,
        "BLOCK_SIZE_K": 64,
        "GROUP_SIZE_M": 8,
        "num_stages": 8,
        "num_warps": 4,
        "compile_time": 0.002630472183227539
    },
    {
        "BLOCK_SIZE_M": 16,
        "BLOCK_SIZE_N": 256,
        "BLOCK_SIZE_K": 64,
        "GROUP_SIZE_M": 8,
        "num_stages": 8,
        "num_warps": 8,
        "compile_time": 0.004201173782348633
    },
    {
        "BLOCK_SIZE_M": 16,
        "BLOCK_SIZE_N": 256,
        "BLOCK_SIZE_K": 64,
        "GROUP_SIZE_M": 8,
        "num_stages": 8,
        "num_warps": 16,
        "compile_time": 0.002615690231323242
    },
    {
        "BLOCK_SIZE_M": 16,
        "BLOCK_SIZE_N": 256,
        "BLOCK_SIZE_K": 64,
        "GROUP_SIZE_M": 8,
        "num_stages": 8,
        "num_warps": 32,
        "compile_time": 0.002573728561401367
    },
    {
        "BLOCK_SIZE_M": 16,
        "BLOCK_SIZE_N": 256,
        "BLOCK_SIZE_K": 128,
        "GROUP_SIZE_M": 8,
        "num_stages": 3,
        "num_warps": 2,
        "compile_time": 10.738140344619751
    },
    {
        "BLOCK_SIZE_M": 16,
        "BLOCK_SIZE_N": 256,
        "BLOCK_SIZE_K": 128,
        "GROUP_SIZE_M": 8,
        "num_stages": 4,
        "num_warps": 2,
        "compile_time": 10.983226299285889
    },
    {
        "BLOCK_SIZE_M": 16,
        "BLOCK_SIZE_N": 256,
        "BLOCK_SIZE_K": 128,
        "GROUP_SIZE_M": 8,
        "num_stages": 4,
        "num_warps": 4,
        "compile_time": 0.005515336990356445
    },
    {
        "BLOCK_SIZE_M": 16,
        "BLOCK_SIZE_N": 256,
        "BLOCK_SIZE_K": 128,
        "GROUP_SIZE_M": 8,
        "num_stages": 4,
        "num_warps": 8,
        "compile_time": 0.004187822341918945
    },
    {
        "BLOCK_SIZE_M": 16,
        "BLOCK_SIZE_N": 256,
        "BLOCK_SIZE_K": 128,
        "GROUP_SIZE_M": 8,
        "num_stages": 4,
        "num_warps": 16,
        "compile_time": 0.00302886962890625
    },
    {
        "BLOCK_SIZE_M": 16,
        "BLOCK_SIZE_N": 256,
        "BLOCK_SIZE_K": 128,
        "GROUP_SIZE_M": 8,
        "num_stages": 4,
        "num_warps": 32,
        "compile_time": 0.0030035972595214844
    },
    {
        "BLOCK_SIZE_M": 16,
        "BLOCK_SIZE_N": 256,
        "BLOCK_SIZE_K": 128,
        "GROUP_SIZE_M": 8,
        "num_stages": 5,
        "num_warps": 2,
        "compile_time": 11.061455726623535
    },
    {
        "BLOCK_SIZE_M": 16,
        "BLOCK_SIZE_N": 256,
        "BLOCK_SIZE_K": 128,
        "GROUP_SIZE_M": 8,
        "num_stages": 5,
        "num_warps": 4,
        "compile_time": 0.005486965179443359
    },
    {
        "BLOCK_SIZE_M": 16,
        "BLOCK_SIZE_N": 256,
        "BLOCK_SIZE_K": 128,
        "GROUP_SIZE_M": 8,
        "num_stages": 5,
        "num_warps": 8,
        "compile_time": 0.010062217712402344
    },
    {
        "BLOCK_SIZE_M": 16,
        "BLOCK_SIZE_N": 256,
        "BLOCK_SIZE_K": 128,
        "GROUP_SIZE_M": 8,
        "num_stages": 5,
        "num_warps": 16,
        "compile_time": 0.006547451019287109
    },
    {
        "BLOCK_SIZE_M": 16,
        "BLOCK_SIZE_N": 256,
        "BLOCK_SIZE_K": 128,
        "GROUP_SIZE_M": 8,
        "num_stages": 5,
        "num_warps": 32,
        "compile_time": 0.0036563873291015625
    },
    {
        "BLOCK_SIZE_M": 16,
        "BLOCK_SIZE_N": 256,
        "BLOCK_SIZE_K": 128,
        "GROUP_SIZE_M": 8,
        "num_stages": 6,
        "num_warps": 2,
        "compile_time": 11.200340747833252
    },
    {
        "BLOCK_SIZE_M": 16,
        "BLOCK_SIZE_N": 256,
        "BLOCK_SIZE_K": 128,
        "GROUP_SIZE_M": 8,
        "num_stages": 6,
        "num_warps": 4,
        "compile_time": 0.004238605499267578
    },
    {
        "BLOCK_SIZE_M": 16,
        "BLOCK_SIZE_N": 256,
        "BLOCK_SIZE_K": 128,
        "GROUP_SIZE_M": 8,
        "num_stages": 6,
        "num_warps": 8,
        "compile_time": 0.004019260406494141
    },
    {
        "BLOCK_SIZE_M": 16,
        "BLOCK_SIZE_N": 256,
        "BLOCK_SIZE_K": 128,
        "GROUP_SIZE_M": 8,
        "num_stages": 6,
        "num_warps": 16,
        "compile_time": 0.0029897689819335938
    },
    {
        "BLOCK_SIZE_M": 16,
        "BLOCK_SIZE_N": 256,
        "BLOCK_SIZE_K": 128,
        "GROUP_SIZE_M": 8,
        "num_stages": 6,
        "num_warps": 32,
        "compile_time": 0.0029633045196533203
    },
    {
        "BLOCK_SIZE_M": 16,
        "BLOCK_SIZE_N": 256,
        "BLOCK_SIZE_K": 128,
        "GROUP_SIZE_M": 8,
        "num_stages": 7,
        "num_warps": 2,
        "compile_time": 11.305504322052002
    },
    {
        "BLOCK_SIZE_M": 16,
        "BLOCK_SIZE_N": 256,
        "BLOCK_SIZE_K": 128,
        "GROUP_SIZE_M": 8,
        "num_stages": 7,
        "num_warps": 4,
        "compile_time": 0.0044019222259521484
    },
    {
        "BLOCK_SIZE_M": 16,
        "BLOCK_SIZE_N": 256,
        "BLOCK_SIZE_K": 128,
        "GROUP_SIZE_M": 8,
        "num_stages": 7,
        "num_warps": 8,
        "compile_time": 0.0030128955841064453
    },
    {
        "BLOCK_SIZE_M": 16,
        "BLOCK_SIZE_N": 256,
        "BLOCK_SIZE_K": 128,
        "GROUP_SIZE_M": 8,
        "num_stages": 7,
        "num_warps": 16,
        "compile_time": 0.0029969215393066406
    },
    {
        "BLOCK_SIZE_M": 16,
        "BLOCK_SIZE_N": 256,
        "BLOCK_SIZE_K": 128,
        "GROUP_SIZE_M": 8,
        "num_stages": 7,
        "num_warps": 32,
        "compile_time": 0.004416704177856445
    },
    {
        "BLOCK_SIZE_M": 16,
        "BLOCK_SIZE_N": 256,
        "BLOCK_SIZE_K": 128,
        "GROUP_SIZE_M": 8,
        "num_stages": 8,
        "num_warps": 2,
        "compile_time": 11.458791255950928
    },
    {
        "BLOCK_SIZE_M": 16,
        "BLOCK_SIZE_N": 256,
        "BLOCK_SIZE_K": 128,
        "GROUP_SIZE_M": 8,
        "num_stages": 8,
        "num_warps": 4,
        "compile_time": 0.004286050796508789
    },
    {
        "BLOCK_SIZE_M": 16,
        "BLOCK_SIZE_N": 256,
        "BLOCK_SIZE_K": 128,
        "GROUP_SIZE_M": 8,
        "num_stages": 8,
        "num_warps": 8,
        "compile_time": 0.003048419952392578
    },
    {
        "BLOCK_SIZE_M": 16,
        "BLOCK_SIZE_N": 256,
        "BLOCK_SIZE_K": 128,
        "GROUP_SIZE_M": 8,
        "num_stages": 8,
        "num_warps": 16,
        "compile_time": 0.0030329227447509766
    },
    {
        "BLOCK_SIZE_M": 16,
        "BLOCK_SIZE_N": 256,
        "BLOCK_SIZE_K": 128,
        "GROUP_SIZE_M": 8,
        "num_stages": 8,
        "num_warps": 32,
        "compile_time": 0.003108978271484375
    },
    {
        "BLOCK_SIZE_M": 16,
        "BLOCK_SIZE_N": 256,
        "BLOCK_SIZE_K": 256,
        "GROUP_SIZE_M": 8,
        "num_stages": 1,
        "num_warps": 2,
        "compile_time": 7.682594060897827
    },
    {
        "BLOCK_SIZE_M": 16,
        "BLOCK_SIZE_N": 256,
        "BLOCK_SIZE_K": 256,
        "GROUP_SIZE_M": 8,
        "num_stages": 2,
        "num_warps": 2,
        "compile_time": 7.649581432342529
    },
    {
        "BLOCK_SIZE_M": 16,
        "BLOCK_SIZE_N": 256,
        "BLOCK_SIZE_K": 256,
        "GROUP_SIZE_M": 8,
        "num_stages": 3,
        "num_warps": 2,
        "compile_time": 98.77195358276367
    },
    {
        "BLOCK_SIZE_M": 16,
        "BLOCK_SIZE_N": 256,
        "BLOCK_SIZE_K": 256,
        "GROUP_SIZE_M": 8,
        "num_stages": 3,
        "num_warps": 4,
        "compile_time": 10.543056726455688
    },
    {
        "BLOCK_SIZE_M": 16,
        "BLOCK_SIZE_N": 256,
        "BLOCK_SIZE_K": 256,
        "GROUP_SIZE_M": 8,
        "num_stages": 3,
        "num_warps": 8,
        "compile_time": 0.004288673400878906
    },
    {
        "BLOCK_SIZE_M": 16,
        "BLOCK_SIZE_N": 256,
        "BLOCK_SIZE_K": 256,
        "GROUP_SIZE_M": 8,
        "num_stages": 3,
        "num_warps": 16,
        "compile_time": 0.003034830093383789
    },
    {
        "BLOCK_SIZE_M": 16,
        "BLOCK_SIZE_N": 256,
        "BLOCK_SIZE_K": 256,
        "GROUP_SIZE_M": 8,
        "num_stages": 3,
        "num_warps": 32,
        "compile_time": 0.0029647350311279297
    },
    {
        "BLOCK_SIZE_M": 16,
        "BLOCK_SIZE_N": 256,
        "BLOCK_SIZE_K": 256,
        "GROUP_SIZE_M": 8,
        "num_stages": 4,
        "num_warps": 2,
        "compile_time": 98.20968866348267
    },
    {
        "BLOCK_SIZE_M": 16,
        "BLOCK_SIZE_N": 256,
        "BLOCK_SIZE_K": 256,
        "GROUP_SIZE_M": 8,
        "num_stages": 4,
        "num_warps": 4,
        "compile_time": 10.72403335571289
    },
    {
        "BLOCK_SIZE_M": 16,
        "BLOCK_SIZE_N": 256,
        "BLOCK_SIZE_K": 256,
        "GROUP_SIZE_M": 8,
        "num_stages": 4,
        "num_warps": 8,
        "compile_time": 0.004242897033691406
    },
    {
        "BLOCK_SIZE_M": 16,
        "BLOCK_SIZE_N": 256,
        "BLOCK_SIZE_K": 256,
        "GROUP_SIZE_M": 8,
        "num_stages": 4,
        "num_warps": 16,
        "compile_time": 0.0030062198638916016
    },
    {
        "BLOCK_SIZE_M": 16,
        "BLOCK_SIZE_N": 256,
        "BLOCK_SIZE_K": 256,
        "GROUP_SIZE_M": 8,
        "num_stages": 4,
        "num_warps": 32,
        "compile_time": 0.002971172332763672
    },
    {
        "BLOCK_SIZE_M": 16,
        "BLOCK_SIZE_N": 256,
        "BLOCK_SIZE_K": 256,
        "GROUP_SIZE_M": 8,
        "num_stages": 5,
        "num_warps": 2,
        "compile_time": 6.168335437774658
    },
    {
        "BLOCK_SIZE_M": 16,
        "BLOCK_SIZE_N": 256,
        "BLOCK_SIZE_K": 256,
        "GROUP_SIZE_M": 8,
        "num_stages": 5,
        "num_warps": 4,
        "compile_time": 10.684794425964355
    },
    {
        "BLOCK_SIZE_M": 16,
        "BLOCK_SIZE_N": 256,
        "BLOCK_SIZE_K": 256,
        "GROUP_SIZE_M": 8,
        "num_stages": 5,
        "num_warps": 8,
        "compile_time": 0.004225969314575195
    },
    {
        "BLOCK_SIZE_M": 16,
        "BLOCK_SIZE_N": 256,
        "BLOCK_SIZE_K": 256,
        "GROUP_SIZE_M": 8,
        "num_stages": 5,
        "num_warps": 16,
        "compile_time": 0.0030832290649414062
    },
    {
        "BLOCK_SIZE_M": 16,
        "BLOCK_SIZE_N": 256,
        "BLOCK_SIZE_K": 256,
        "GROUP_SIZE_M": 8,
        "num_stages": 5,
        "num_warps": 32,
        "compile_time": 0.002994060516357422
    },
    {
        "BLOCK_SIZE_M": 16,
        "BLOCK_SIZE_N": 256,
        "BLOCK_SIZE_K": 256,
        "GROUP_SIZE_M": 8,
        "num_stages": 6,
        "num_warps": 2,
        "compile_time": 6.473365545272827
    },
    {
        "BLOCK_SIZE_M": 16,
        "BLOCK_SIZE_N": 256,
        "BLOCK_SIZE_K": 256,
        "GROUP_SIZE_M": 8,
        "num_stages": 6,
        "num_warps": 4,
        "compile_time": 10.873172998428345
    },
    {
        "BLOCK_SIZE_M": 16,
        "BLOCK_SIZE_N": 256,
        "BLOCK_SIZE_K": 256,
        "GROUP_SIZE_M": 8,
        "num_stages": 6,
        "num_warps": 8,
        "compile_time": 0.004548311233520508
    },
    {
        "BLOCK_SIZE_M": 16,
        "BLOCK_SIZE_N": 256,
        "BLOCK_SIZE_K": 256,
        "GROUP_SIZE_M": 8,
        "num_stages": 6,
        "num_warps": 16,
        "compile_time": 0.0030736923217773438
    },
    {
        "BLOCK_SIZE_M": 16,
        "BLOCK_SIZE_N": 256,
        "BLOCK_SIZE_K": 256,
        "GROUP_SIZE_M": 8,
        "num_stages": 6,
        "num_warps": 32,
        "compile_time": 0.003027677536010742
    },
    {
        "BLOCK_SIZE_M": 16,
        "BLOCK_SIZE_N": 256,
        "BLOCK_SIZE_K": 256,
        "GROUP_SIZE_M": 8,
        "num_stages": 7,
        "num_warps": 2,
        "compile_time": 6.775027751922607
    },
    {
        "BLOCK_SIZE_M": 16,
        "BLOCK_SIZE_N": 256,
        "BLOCK_SIZE_K": 256,
        "GROUP_SIZE_M": 8,
        "num_stages": 7,
        "num_warps": 4,
        "compile_time": 11.223437309265137
    },
    {
        "BLOCK_SIZE_M": 16,
        "BLOCK_SIZE_N": 256,
        "BLOCK_SIZE_K": 256,
        "GROUP_SIZE_M": 8,
        "num_stages": 7,
        "num_warps": 8,
        "compile_time": 0.003784656524658203
    },
    {
        "BLOCK_SIZE_M": 16,
        "BLOCK_SIZE_N": 256,
        "BLOCK_SIZE_K": 256,
        "GROUP_SIZE_M": 8,
        "num_stages": 7,
        "num_warps": 16,
        "compile_time": 0.003306865692138672
    },
    {
        "BLOCK_SIZE_M": 16,
        "BLOCK_SIZE_N": 256,
        "BLOCK_SIZE_K": 256,
        "GROUP_SIZE_M": 8,
        "num_stages": 7,
        "num_warps": 32,
        "compile_time": 0.003129720687866211
    },
    {
        "BLOCK_SIZE_M": 16,
        "BLOCK_SIZE_N": 256,
        "BLOCK_SIZE_K": 256,
        "GROUP_SIZE_M": 8,
        "num_stages": 8,
        "num_warps": 2,
        "compile_time": 7.164570331573486
    },
    {
        "BLOCK_SIZE_M": 16,
        "BLOCK_SIZE_N": 256,
        "BLOCK_SIZE_K": 256,
        "GROUP_SIZE_M": 8,
        "num_stages": 8,
        "num_warps": 4,
        "compile_time": 11.508285284042358
    },
    {
        "BLOCK_SIZE_M": 16,
        "BLOCK_SIZE_N": 256,
        "BLOCK_SIZE_K": 256,
        "GROUP_SIZE_M": 8,
        "num_stages": 8,
        "num_warps": 8,
        "compile_time": 0.004083871841430664
    },
    {
        "BLOCK_SIZE_M": 16,
        "BLOCK_SIZE_N": 256,
        "BLOCK_SIZE_K": 256,
        "GROUP_SIZE_M": 8,
        "num_stages": 8,
        "num_warps": 16,
        "compile_time": 0.0030591487884521484
    },
    {
        "BLOCK_SIZE_M": 16,
        "BLOCK_SIZE_N": 256,
        "BLOCK_SIZE_K": 256,
        "GROUP_SIZE_M": 8,
        "num_stages": 8,
        "num_warps": 32,
        "compile_time": 0.002986431121826172
    },
    {
        "BLOCK_SIZE_M": 16,
        "BLOCK_SIZE_N": 256,
        "BLOCK_SIZE_K": 512,
        "GROUP_SIZE_M": 8,
        "num_stages": 1,
        "num_warps": 2,
        "compile_time": 18.51352882385254
    },
    {
        "BLOCK_SIZE_M": 16,
        "BLOCK_SIZE_N": 256,
        "BLOCK_SIZE_K": 512,
        "GROUP_SIZE_M": 8,
        "num_stages": 1,
        "num_warps": 4,
        "compile_time": 7.584815740585327
    },
    {
        "BLOCK_SIZE_M": 16,
        "BLOCK_SIZE_N": 256,
        "BLOCK_SIZE_K": 512,
        "GROUP_SIZE_M": 8,
        "num_stages": 1,
        "num_warps": 8,
        "compile_time": 0.003984928131103516
    },
    {
        "BLOCK_SIZE_M": 16,
        "BLOCK_SIZE_N": 256,
        "BLOCK_SIZE_K": 512,
        "GROUP_SIZE_M": 8,
        "num_stages": 1,
        "num_warps": 16,
        "compile_time": 0.0029239654541015625
    },
    {
        "BLOCK_SIZE_M": 16,
        "BLOCK_SIZE_N": 256,
        "BLOCK_SIZE_K": 512,
        "GROUP_SIZE_M": 8,
        "num_stages": 1,
        "num_warps": 32,
        "compile_time": 0.002804279327392578
    },
    {
        "BLOCK_SIZE_M": 16,
        "BLOCK_SIZE_N": 256,
        "BLOCK_SIZE_K": 512,
        "GROUP_SIZE_M": 8,
        "num_stages": 2,
        "num_warps": 2,
        "compile_time": 18.76703143119812
    },
    {
        "BLOCK_SIZE_M": 16,
        "BLOCK_SIZE_N": 256,
        "BLOCK_SIZE_K": 512,
        "GROUP_SIZE_M": 8,
        "num_stages": 2,
        "num_warps": 4,
        "compile_time": 7.682324647903442
    },
    {
        "BLOCK_SIZE_M": 16,
        "BLOCK_SIZE_N": 256,
        "BLOCK_SIZE_K": 512,
        "GROUP_SIZE_M": 8,
        "num_stages": 2,
        "num_warps": 8,
        "compile_time": 0.00491786003112793
    },
    {
        "BLOCK_SIZE_M": 16,
        "BLOCK_SIZE_N": 256,
        "BLOCK_SIZE_K": 512,
        "GROUP_SIZE_M": 8,
        "num_stages": 2,
        "num_warps": 16,
        "compile_time": 0.002906322479248047
    },
    {
        "BLOCK_SIZE_M": 16,
        "BLOCK_SIZE_N": 256,
        "BLOCK_SIZE_K": 512,
        "GROUP_SIZE_M": 8,
        "num_stages": 2,
        "num_warps": 32,
        "compile_time": 0.0028183460235595703
    },
    {
        "BLOCK_SIZE_M": 16,
        "BLOCK_SIZE_N": 256,
        "BLOCK_SIZE_K": 512,
        "GROUP_SIZE_M": 8,
        "num_stages": 3,
        "num_warps": 2,
        "compile_time": 19.496074676513672
    },
    {
        "BLOCK_SIZE_M": 16,
        "BLOCK_SIZE_N": 256,
        "BLOCK_SIZE_K": 512,
        "GROUP_SIZE_M": 8,
        "num_stages": 3,
        "num_warps": 4,
        "compile_time": 99.26678395271301
    },
    {
        "BLOCK_SIZE_M": 16,
        "BLOCK_SIZE_N": 256,
        "BLOCK_SIZE_K": 512,
        "GROUP_SIZE_M": 8,
        "num_stages": 3,
        "num_warps": 8,
        "compile_time": 10.658439636230469
    },
    {
        "BLOCK_SIZE_M": 16,
        "BLOCK_SIZE_N": 256,
        "BLOCK_SIZE_K": 512,
        "GROUP_SIZE_M": 8,
        "num_stages": 3,
        "num_warps": 16,
        "compile_time": 0.004063844680786133
    },
    {
        "BLOCK_SIZE_M": 16,
        "BLOCK_SIZE_N": 256,
        "BLOCK_SIZE_K": 512,
        "GROUP_SIZE_M": 8,
        "num_stages": 3,
        "num_warps": 32,
        "compile_time": 0.003787994384765625
    },
    {
        "BLOCK_SIZE_M": 16,
        "BLOCK_SIZE_N": 256,
        "BLOCK_SIZE_K": 512,
        "GROUP_SIZE_M": 8,
        "num_stages": 4,
        "num_warps": 2,
        "compile_time": 20.296250343322754
    },
    {
        "BLOCK_SIZE_M": 16,
        "BLOCK_SIZE_N": 256,
        "BLOCK_SIZE_K": 512,
        "GROUP_SIZE_M": 8,
        "num_stages": 4,
        "num_warps": 4,
        "compile_time": 6.034559726715088
    },
    {
        "BLOCK_SIZE_M": 16,
        "BLOCK_SIZE_N": 256,
        "BLOCK_SIZE_K": 512,
        "GROUP_SIZE_M": 8,
        "num_stages": 4,
        "num_warps": 8,
        "compile_time": 10.346197605133057
    },
    {
        "BLOCK_SIZE_M": 16,
        "BLOCK_SIZE_N": 256,
        "BLOCK_SIZE_K": 512,
        "GROUP_SIZE_M": 8,
        "num_stages": 4,
        "num_warps": 16,
        "compile_time": 0.0035829544067382812
    },
    {
        "BLOCK_SIZE_M": 16,
        "BLOCK_SIZE_N": 256,
        "BLOCK_SIZE_K": 512,
        "GROUP_SIZE_M": 8,
        "num_stages": 4,
        "num_warps": 32,
        "compile_time": 0.0028662681579589844
    },
    {
        "BLOCK_SIZE_M": 16,
        "BLOCK_SIZE_N": 256,
        "BLOCK_SIZE_K": 512,
        "GROUP_SIZE_M": 8,
        "num_stages": 5,
        "num_warps": 2,
        "compile_time": 21.020047426223755
    },
    {
        "BLOCK_SIZE_M": 16,
        "BLOCK_SIZE_N": 256,
        "BLOCK_SIZE_K": 512,
        "GROUP_SIZE_M": 8,
        "num_stages": 5,
        "num_warps": 4,
        "compile_time": 6.3819520473480225
    },
    {
        "BLOCK_SIZE_M": 16,
        "BLOCK_SIZE_N": 256,
        "BLOCK_SIZE_K": 512,
        "GROUP_SIZE_M": 8,
        "num_stages": 5,
        "num_warps": 8,
        "compile_time": 10.805421113967896
    },
    {
        "BLOCK_SIZE_M": 16,
        "BLOCK_SIZE_N": 256,
        "BLOCK_SIZE_K": 512,
        "GROUP_SIZE_M": 8,
        "num_stages": 5,
        "num_warps": 16,
        "compile_time": 0.0036971569061279297
    },
    {
        "BLOCK_SIZE_M": 16,
        "BLOCK_SIZE_N": 256,
        "BLOCK_SIZE_K": 512,
        "GROUP_SIZE_M": 8,
        "num_stages": 5,
        "num_warps": 32,
        "compile_time": 0.002833843231201172
    },
    {
        "BLOCK_SIZE_M": 16,
        "BLOCK_SIZE_N": 256,
        "BLOCK_SIZE_K": 512,
        "GROUP_SIZE_M": 8,
        "num_stages": 6,
        "num_warps": 2,
        "compile_time": 21.810657024383545
    },
    {
        "BLOCK_SIZE_M": 16,
        "BLOCK_SIZE_N": 256,
        "BLOCK_SIZE_K": 512,
        "GROUP_SIZE_M": 8,
        "num_stages": 6,
        "num_warps": 4,
        "compile_time": 6.781799077987671
    },
    {
        "BLOCK_SIZE_M": 16,
        "BLOCK_SIZE_N": 256,
        "BLOCK_SIZE_K": 512,
        "GROUP_SIZE_M": 8,
        "num_stages": 6,
        "num_warps": 8,
        "compile_time": 11.298364877700806
    },
    {
        "BLOCK_SIZE_M": 16,
        "BLOCK_SIZE_N": 256,
        "BLOCK_SIZE_K": 512,
        "GROUP_SIZE_M": 8,
        "num_stages": 6,
        "num_warps": 16,
        "compile_time": 0.006239891052246094
    },
    {
        "BLOCK_SIZE_M": 16,
        "BLOCK_SIZE_N": 256,
        "BLOCK_SIZE_K": 512,
        "GROUP_SIZE_M": 8,
        "num_stages": 6,
        "num_warps": 32,
        "compile_time": 0.005976676940917969
    },
    {
        "BLOCK_SIZE_M": 16,
        "BLOCK_SIZE_N": 256,
        "BLOCK_SIZE_K": 512,
        "GROUP_SIZE_M": 8,
        "num_stages": 7,
        "num_warps": 2,
        "compile_time": 22.49654793739319
    },
    {
        "BLOCK_SIZE_M": 16,
        "BLOCK_SIZE_N": 256,
        "BLOCK_SIZE_K": 512,
        "GROUP_SIZE_M": 8,
        "num_stages": 7,
        "num_warps": 4,
        "compile_time": 7.149294853210449
    },
    {
        "BLOCK_SIZE_M": 16,
        "BLOCK_SIZE_N": 256,
        "BLOCK_SIZE_K": 512,
        "GROUP_SIZE_M": 8,
        "num_stages": 7,
        "num_warps": 8,
        "compile_time": 11.477084636688232
    },
    {
        "BLOCK_SIZE_M": 16,
        "BLOCK_SIZE_N": 256,
        "BLOCK_SIZE_K": 512,
        "GROUP_SIZE_M": 8,
        "num_stages": 7,
        "num_warps": 16,
        "compile_time": 0.003933906555175781
    },
    {
        "BLOCK_SIZE_M": 16,
        "BLOCK_SIZE_N": 256,
        "BLOCK_SIZE_K": 512,
        "GROUP_SIZE_M": 8,
        "num_stages": 7,
        "num_warps": 32,
        "compile_time": 0.002899646759033203
    },
    {
        "BLOCK_SIZE_M": 16,
        "BLOCK_SIZE_N": 256,
        "BLOCK_SIZE_K": 512,
        "GROUP_SIZE_M": 8,
        "num_stages": 8,
        "num_warps": 2,
        "compile_time": 23.245738744735718
    },
    {
        "BLOCK_SIZE_M": 16,
        "BLOCK_SIZE_N": 256,
        "BLOCK_SIZE_K": 512,
        "GROUP_SIZE_M": 8,
        "num_stages": 8,
        "num_warps": 4,
        "compile_time": 7.5805981159210205
    },
    {
        "BLOCK_SIZE_M": 16,
        "BLOCK_SIZE_N": 256,
        "BLOCK_SIZE_K": 512,
        "GROUP_SIZE_M": 8,
        "num_stages": 8,
        "num_warps": 8,
        "compile_time": 12.177608251571655
    },
    {
        "BLOCK_SIZE_M": 16,
        "BLOCK_SIZE_N": 256,
        "BLOCK_SIZE_K": 512,
        "GROUP_SIZE_M": 8,
        "num_stages": 8,
        "num_warps": 16,
        "compile_time": 0.004235744476318359
    },
    {
        "BLOCK_SIZE_M": 16,
        "BLOCK_SIZE_N": 256,
        "BLOCK_SIZE_K": 512,
        "GROUP_SIZE_M": 8,
        "num_stages": 8,
        "num_warps": 32,
        "compile_time": 0.0028917789459228516
    },
    {
        "BLOCK_SIZE_M": 16,
        "BLOCK_SIZE_N": 512,
        "BLOCK_SIZE_K": 32,
        "GROUP_SIZE_M": 8,
        "num_stages": 6,
        "num_warps": 2,
        "compile_time": 0.0034809112548828125
    },
    {
        "BLOCK_SIZE_M": 16,
        "BLOCK_SIZE_N": 512,
        "BLOCK_SIZE_K": 32,
        "GROUP_SIZE_M": 8,
        "num_stages": 6,
        "num_warps": 4,
        "compile_time": 0.002651691436767578
    },
    {
        "BLOCK_SIZE_M": 16,
        "BLOCK_SIZE_N": 512,
        "BLOCK_SIZE_K": 32,
        "GROUP_SIZE_M": 8,
        "num_stages": 6,
        "num_warps": 8,
        "compile_time": 0.0026764869689941406
    },
    {
        "BLOCK_SIZE_M": 16,
        "BLOCK_SIZE_N": 512,
        "BLOCK_SIZE_K": 32,
        "GROUP_SIZE_M": 8,
        "num_stages": 7,
        "num_warps": 2,
        "compile_time": 0.003506183624267578
    },
    {
        "BLOCK_SIZE_M": 16,
        "BLOCK_SIZE_N": 512,
        "BLOCK_SIZE_K": 32,
        "GROUP_SIZE_M": 8,
        "num_stages": 7,
        "num_warps": 4,
        "compile_time": 0.0026597976684570312
    },
    {
        "BLOCK_SIZE_M": 16,
        "BLOCK_SIZE_N": 512,
        "BLOCK_SIZE_K": 32,
        "GROUP_SIZE_M": 8,
        "num_stages": 7,
        "num_warps": 8,
        "compile_time": 0.0026204586029052734
    },
    {
        "BLOCK_SIZE_M": 16,
        "BLOCK_SIZE_N": 512,
        "BLOCK_SIZE_K": 32,
        "GROUP_SIZE_M": 8,
        "num_stages": 7,
        "num_warps": 16,
        "compile_time": 0.0025610923767089844
    },
    {
        "BLOCK_SIZE_M": 16,
        "BLOCK_SIZE_N": 512,
        "BLOCK_SIZE_K": 32,
        "GROUP_SIZE_M": 8,
        "num_stages": 7,
        "num_warps": 32,
        "compile_time": 0.0025784969329833984
    },
    {
        "BLOCK_SIZE_M": 16,
        "BLOCK_SIZE_N": 512,
        "BLOCK_SIZE_K": 32,
        "GROUP_SIZE_M": 8,
        "num_stages": 8,
        "num_warps": 2,
        "compile_time": 0.0028281211853027344
    },
    {
        "BLOCK_SIZE_M": 16,
        "BLOCK_SIZE_N": 512,
        "BLOCK_SIZE_K": 32,
        "GROUP_SIZE_M": 8,
        "num_stages": 8,
        "num_warps": 4,
        "compile_time": 0.002672910690307617
    },
    {
        "BLOCK_SIZE_M": 16,
        "BLOCK_SIZE_N": 512,
        "BLOCK_SIZE_K": 32,
        "GROUP_SIZE_M": 8,
        "num_stages": 8,
        "num_warps": 8,
        "compile_time": 0.0036287307739257812
    },
    {
        "BLOCK_SIZE_M": 16,
        "BLOCK_SIZE_N": 512,
        "BLOCK_SIZE_K": 32,
        "GROUP_SIZE_M": 8,
        "num_stages": 8,
        "num_warps": 16,
        "compile_time": 0.002621173858642578
    },
    {
        "BLOCK_SIZE_M": 16,
        "BLOCK_SIZE_N": 512,
        "BLOCK_SIZE_K": 32,
        "GROUP_SIZE_M": 8,
        "num_stages": 8,
        "num_warps": 32,
        "compile_time": 0.002577543258666992
    },
    {
        "BLOCK_SIZE_M": 16,
        "BLOCK_SIZE_N": 512,
        "BLOCK_SIZE_K": 64,
        "GROUP_SIZE_M": 8,
        "num_stages": 3,
        "num_warps": 2,
        "compile_time": 11.21260142326355
    },
    {
        "BLOCK_SIZE_M": 16,
        "BLOCK_SIZE_N": 512,
        "BLOCK_SIZE_K": 64,
        "GROUP_SIZE_M": 8,
        "num_stages": 4,
        "num_warps": 2,
        "compile_time": 11.381128072738647
    },
    {
        "BLOCK_SIZE_M": 16,
        "BLOCK_SIZE_N": 512,
        "BLOCK_SIZE_K": 64,
        "GROUP_SIZE_M": 8,
        "num_stages": 4,
        "num_warps": 4,
        "compile_time": 0.004126548767089844
    },
    {
        "BLOCK_SIZE_M": 16,
        "BLOCK_SIZE_N": 512,
        "BLOCK_SIZE_K": 64,
        "GROUP_SIZE_M": 8,
        "num_stages": 4,
        "num_warps": 8,
        "compile_time": 0.0031075477600097656
    },
    {
        "BLOCK_SIZE_M": 16,
        "BLOCK_SIZE_N": 512,
        "BLOCK_SIZE_K": 64,
        "GROUP_SIZE_M": 8,
        "num_stages": 4,
        "num_warps": 16,
        "compile_time": 0.0030279159545898438
    },
    {
        "BLOCK_SIZE_M": 16,
        "BLOCK_SIZE_N": 512,
        "BLOCK_SIZE_K": 64,
        "GROUP_SIZE_M": 8,
        "num_stages": 4,
        "num_warps": 32,
        "compile_time": 0.003217935562133789
    },
    {
        "BLOCK_SIZE_M": 16,
        "BLOCK_SIZE_N": 512,
        "BLOCK_SIZE_K": 64,
        "GROUP_SIZE_M": 8,
        "num_stages": 5,
        "num_warps": 2,
        "compile_time": 11.595536947250366
    },
    {
        "BLOCK_SIZE_M": 16,
        "BLOCK_SIZE_N": 512,
        "BLOCK_SIZE_K": 64,
        "GROUP_SIZE_M": 8,
        "num_stages": 5,
        "num_warps": 4,
        "compile_time": 0.005255937576293945
    },
    {
        "BLOCK_SIZE_M": 16,
        "BLOCK_SIZE_N": 512,
        "BLOCK_SIZE_K": 64,
        "GROUP_SIZE_M": 8,
        "num_stages": 5,
        "num_warps": 8,
        "compile_time": 0.0031290054321289062
    },
    {
        "BLOCK_SIZE_M": 16,
        "BLOCK_SIZE_N": 512,
        "BLOCK_SIZE_K": 64,
        "GROUP_SIZE_M": 8,
        "num_stages": 5,
        "num_warps": 16,
        "compile_time": 0.0030193328857421875
    },
    {
        "BLOCK_SIZE_M": 16,
        "BLOCK_SIZE_N": 512,
        "BLOCK_SIZE_K": 64,
        "GROUP_SIZE_M": 8,
        "num_stages": 5,
        "num_warps": 32,
        "compile_time": 0.0030133724212646484
    },
    {
        "BLOCK_SIZE_M": 16,
        "BLOCK_SIZE_N": 512,
        "BLOCK_SIZE_K": 64,
        "GROUP_SIZE_M": 8,
        "num_stages": 6,
        "num_warps": 2,
        "compile_time": 11.736541509628296
    },
    {
        "BLOCK_SIZE_M": 16,
        "BLOCK_SIZE_N": 512,
        "BLOCK_SIZE_K": 64,
        "GROUP_SIZE_M": 8,
        "num_stages": 6,
        "num_warps": 4,
        "compile_time": 0.0047147274017333984
    },
    {
        "BLOCK_SIZE_M": 16,
        "BLOCK_SIZE_N": 512,
        "BLOCK_SIZE_K": 64,
        "GROUP_SIZE_M": 8,
        "num_stages": 6,
        "num_warps": 8,
        "compile_time": 0.0030701160430908203
    },
    {
        "BLOCK_SIZE_M": 16,
        "BLOCK_SIZE_N": 512,
        "BLOCK_SIZE_K": 64,
        "GROUP_SIZE_M": 8,
        "num_stages": 6,
        "num_warps": 16,
        "compile_time": 0.003028392791748047
    },
    {
        "BLOCK_SIZE_M": 16,
        "BLOCK_SIZE_N": 512,
        "BLOCK_SIZE_K": 64,
        "GROUP_SIZE_M": 8,
        "num_stages": 6,
        "num_warps": 32,
        "compile_time": 0.003003358840942383
    },
    {
        "BLOCK_SIZE_M": 16,
        "BLOCK_SIZE_N": 512,
        "BLOCK_SIZE_K": 64,
        "GROUP_SIZE_M": 8,
        "num_stages": 7,
        "num_warps": 2,
        "compile_time": 11.899293422698975
    },
    {
        "BLOCK_SIZE_M": 16,
        "BLOCK_SIZE_N": 512,
        "BLOCK_SIZE_K": 64,
        "GROUP_SIZE_M": 8,
        "num_stages": 7,
        "num_warps": 4,
        "compile_time": 0.004328727722167969
    },
    {
        "BLOCK_SIZE_M": 16,
        "BLOCK_SIZE_N": 512,
        "BLOCK_SIZE_K": 64,
        "GROUP_SIZE_M": 8,
        "num_stages": 7,
        "num_warps": 8,
        "compile_time": 0.0028891563415527344
    },
    {
        "BLOCK_SIZE_M": 16,
        "BLOCK_SIZE_N": 512,
        "BLOCK_SIZE_K": 64,
        "GROUP_SIZE_M": 8,
        "num_stages": 7,
        "num_warps": 16,
        "compile_time": 0.0029993057250976562
    },
    {
        "BLOCK_SIZE_M": 16,
        "BLOCK_SIZE_N": 512,
        "BLOCK_SIZE_K": 64,
        "GROUP_SIZE_M": 8,
        "num_stages": 7,
        "num_warps": 32,
        "compile_time": 0.0029807090759277344
    },
    {
        "BLOCK_SIZE_M": 16,
        "BLOCK_SIZE_N": 512,
        "BLOCK_SIZE_K": 64,
        "GROUP_SIZE_M": 8,
        "num_stages": 8,
        "num_warps": 2,
        "compile_time": 12.063127994537354
    },
    {
        "BLOCK_SIZE_M": 16,
        "BLOCK_SIZE_N": 512,
        "BLOCK_SIZE_K": 64,
        "GROUP_SIZE_M": 8,
        "num_stages": 8,
        "num_warps": 4,
        "compile_time": 0.007627725601196289
    },
    {
        "BLOCK_SIZE_M": 16,
        "BLOCK_SIZE_N": 512,
        "BLOCK_SIZE_K": 64,
        "GROUP_SIZE_M": 8,
        "num_stages": 8,
        "num_warps": 8,
        "compile_time": 0.0031290054321289062
    },
    {
        "BLOCK_SIZE_M": 16,
        "BLOCK_SIZE_N": 512,
        "BLOCK_SIZE_K": 64,
        "GROUP_SIZE_M": 8,
        "num_stages": 8,
        "num_warps": 16,
        "compile_time": 0.003030538558959961
    },
    {
        "BLOCK_SIZE_M": 16,
        "BLOCK_SIZE_N": 512,
        "BLOCK_SIZE_K": 64,
        "GROUP_SIZE_M": 8,
        "num_stages": 8,
        "num_warps": 32,
        "compile_time": 0.0030918121337890625
    },
    {
        "BLOCK_SIZE_M": 16,
        "BLOCK_SIZE_N": 512,
        "BLOCK_SIZE_K": 128,
        "GROUP_SIZE_M": 8,
        "num_stages": 1,
        "num_warps": 2,
        "compile_time": 8.271558046340942
    },
    {
        "BLOCK_SIZE_M": 16,
        "BLOCK_SIZE_N": 512,
        "BLOCK_SIZE_K": 128,
        "GROUP_SIZE_M": 8,
        "num_stages": 2,
        "num_warps": 2,
        "compile_time": 8.219930410385132
    },
    {
        "BLOCK_SIZE_M": 16,
        "BLOCK_SIZE_N": 512,
        "BLOCK_SIZE_K": 128,
        "GROUP_SIZE_M": 8,
        "num_stages": 3,
        "num_warps": 2,
        "compile_time": 119.33367395401001
    },
    {
        "BLOCK_SIZE_M": 16,
        "BLOCK_SIZE_N": 512,
        "BLOCK_SIZE_K": 128,
        "GROUP_SIZE_M": 8,
        "num_stages": 3,
        "num_warps": 4,
        "compile_time": 10.986580610275269
    },
    {
        "BLOCK_SIZE_M": 16,
        "BLOCK_SIZE_N": 512,
        "BLOCK_SIZE_K": 128,
        "GROUP_SIZE_M": 8,
        "num_stages": 3,
        "num_warps": 8,
        "compile_time": 0.004347085952758789
    },
    {
        "BLOCK_SIZE_M": 16,
        "BLOCK_SIZE_N": 512,
        "BLOCK_SIZE_K": 128,
        "GROUP_SIZE_M": 8,
        "num_stages": 3,
        "num_warps": 16,
        "compile_time": 0.003014087677001953
    },
    {
        "BLOCK_SIZE_M": 16,
        "BLOCK_SIZE_N": 512,
        "BLOCK_SIZE_K": 128,
        "GROUP_SIZE_M": 8,
        "num_stages": 3,
        "num_warps": 32,
        "compile_time": 0.0030112266540527344
    },
    {
        "BLOCK_SIZE_M": 16,
        "BLOCK_SIZE_N": 512,
        "BLOCK_SIZE_K": 128,
        "GROUP_SIZE_M": 8,
        "num_stages": 4,
        "num_warps": 2,
        "compile_time": 6.110602140426636
    },
    {
        "BLOCK_SIZE_M": 16,
        "BLOCK_SIZE_N": 512,
        "BLOCK_SIZE_K": 128,
        "GROUP_SIZE_M": 8,
        "num_stages": 4,
        "num_warps": 4,
        "compile_time": 11.135871171951294
    },
    {
        "BLOCK_SIZE_M": 16,
        "BLOCK_SIZE_N": 512,
        "BLOCK_SIZE_K": 128,
        "GROUP_SIZE_M": 8,
        "num_stages": 4,
        "num_warps": 8,
        "compile_time": 0.004483222961425781
    },
    {
        "BLOCK_SIZE_M": 16,
        "BLOCK_SIZE_N": 512,
        "BLOCK_SIZE_K": 128,
        "GROUP_SIZE_M": 8,
        "num_stages": 4,
        "num_warps": 16,
        "compile_time": 0.003069162368774414
    },
    {
        "BLOCK_SIZE_M": 16,
        "BLOCK_SIZE_N": 512,
        "BLOCK_SIZE_K": 128,
        "GROUP_SIZE_M": 8,
        "num_stages": 4,
        "num_warps": 32,
        "compile_time": 0.003014087677001953
    },
    {
        "BLOCK_SIZE_M": 16,
        "BLOCK_SIZE_N": 512,
        "BLOCK_SIZE_K": 128,
        "GROUP_SIZE_M": 8,
        "num_stages": 5,
        "num_warps": 2,
        "compile_time": 6.382439851760864
    },
    {
        "BLOCK_SIZE_M": 16,
        "BLOCK_SIZE_N": 512,
        "BLOCK_SIZE_K": 128,
        "GROUP_SIZE_M": 8,
        "num_stages": 5,
        "num_warps": 4,
        "compile_time": 11.32849407196045
    },
    {
        "BLOCK_SIZE_M": 16,
        "BLOCK_SIZE_N": 512,
        "BLOCK_SIZE_K": 128,
        "GROUP_SIZE_M": 8,
        "num_stages": 5,
        "num_warps": 8,
        "compile_time": 0.004094839096069336
    },
    {
        "BLOCK_SIZE_M": 16,
        "BLOCK_SIZE_N": 512,
        "BLOCK_SIZE_K": 128,
        "GROUP_SIZE_M": 8,
        "num_stages": 5,
        "num_warps": 16,
        "compile_time": 0.0030727386474609375
    },
    {
        "BLOCK_SIZE_M": 16,
        "BLOCK_SIZE_N": 512,
        "BLOCK_SIZE_K": 128,
        "GROUP_SIZE_M": 8,
        "num_stages": 5,
        "num_warps": 32,
        "compile_time": 0.002803325653076172
    },
    {
        "BLOCK_SIZE_M": 16,
        "BLOCK_SIZE_N": 512,
        "BLOCK_SIZE_K": 128,
        "GROUP_SIZE_M": 8,
        "num_stages": 6,
        "num_warps": 2,
        "compile_time": 6.700464963912964
    },
    {
        "BLOCK_SIZE_M": 16,
        "BLOCK_SIZE_N": 512,
        "BLOCK_SIZE_K": 128,
        "GROUP_SIZE_M": 8,
        "num_stages": 6,
        "num_warps": 4,
        "compile_time": 11.494266510009766
    },
    {
        "BLOCK_SIZE_M": 16,
        "BLOCK_SIZE_N": 512,
        "BLOCK_SIZE_K": 128,
        "GROUP_SIZE_M": 8,
        "num_stages": 6,
        "num_warps": 8,
        "compile_time": 0.004195213317871094
    },
    {
        "BLOCK_SIZE_M": 16,
        "BLOCK_SIZE_N": 512,
        "BLOCK_SIZE_K": 128,
        "GROUP_SIZE_M": 8,
        "num_stages": 6,
        "num_warps": 16,
        "compile_time": 0.0030744075775146484
    },
    {
        "BLOCK_SIZE_M": 16,
        "BLOCK_SIZE_N": 512,
        "BLOCK_SIZE_K": 128,
        "GROUP_SIZE_M": 8,
        "num_stages": 6,
        "num_warps": 32,
        "compile_time": 0.0030236244201660156
    },
    {
        "BLOCK_SIZE_M": 16,
        "BLOCK_SIZE_N": 512,
        "BLOCK_SIZE_K": 128,
        "GROUP_SIZE_M": 8,
        "num_stages": 7,
        "num_warps": 2,
        "compile_time": 6.979423761367798
    },
    {
        "BLOCK_SIZE_M": 16,
        "BLOCK_SIZE_N": 512,
        "BLOCK_SIZE_K": 128,
        "GROUP_SIZE_M": 8,
        "num_stages": 7,
        "num_warps": 4,
        "compile_time": 11.730575799942017
    },
    {
        "BLOCK_SIZE_M": 16,
        "BLOCK_SIZE_N": 512,
        "BLOCK_SIZE_K": 128,
        "GROUP_SIZE_M": 8,
        "num_stages": 7,
        "num_warps": 8,
        "compile_time": 0.0044324398040771484
    },
    {
        "BLOCK_SIZE_M": 16,
        "BLOCK_SIZE_N": 512,
        "BLOCK_SIZE_K": 128,
        "GROUP_SIZE_M": 8,
        "num_stages": 7,
        "num_warps": 16,
        "compile_time": 0.0031189918518066406
    },
    {
        "BLOCK_SIZE_M": 16,
        "BLOCK_SIZE_N": 512,
        "BLOCK_SIZE_K": 128,
        "GROUP_SIZE_M": 8,
        "num_stages": 7,
        "num_warps": 32,
        "compile_time": 0.003092527389526367
    },
    {
        "BLOCK_SIZE_M": 16,
        "BLOCK_SIZE_N": 512,
        "BLOCK_SIZE_K": 128,
        "GROUP_SIZE_M": 8,
        "num_stages": 8,
        "num_warps": 2,
        "compile_time": 7.347436428070068
    },
    {
        "BLOCK_SIZE_M": 16,
        "BLOCK_SIZE_N": 512,
        "BLOCK_SIZE_K": 128,
        "GROUP_SIZE_M": 8,
        "num_stages": 8,
        "num_warps": 4,
        "compile_time": 11.905770301818848
    },
    {
        "BLOCK_SIZE_M": 16,
        "BLOCK_SIZE_N": 512,
        "BLOCK_SIZE_K": 128,
        "GROUP_SIZE_M": 8,
        "num_stages": 8,
        "num_warps": 8,
        "compile_time": 0.004218101501464844
    },
    {
        "BLOCK_SIZE_M": 16,
        "BLOCK_SIZE_N": 512,
        "BLOCK_SIZE_K": 128,
        "GROUP_SIZE_M": 8,
        "num_stages": 8,
        "num_warps": 16,
        "compile_time": 0.0031366348266601562
    },
    {
        "BLOCK_SIZE_M": 16,
        "BLOCK_SIZE_N": 512,
        "BLOCK_SIZE_K": 128,
        "GROUP_SIZE_M": 8,
        "num_stages": 8,
        "num_warps": 32,
        "compile_time": 0.003072500228881836
    },
    {
        "BLOCK_SIZE_M": 16,
        "BLOCK_SIZE_N": 512,
        "BLOCK_SIZE_K": 256,
        "GROUP_SIZE_M": 8,
        "num_stages": 1,
        "num_warps": 2,
        "compile_time": 18.688223838806152
    },
    {
        "BLOCK_SIZE_M": 16,
        "BLOCK_SIZE_N": 512,
        "BLOCK_SIZE_K": 256,
        "GROUP_SIZE_M": 8,
        "num_stages": 1,
        "num_warps": 4,
        "compile_time": 8.13887882232666
    },
    {
        "BLOCK_SIZE_M": 16,
        "BLOCK_SIZE_N": 512,
        "BLOCK_SIZE_K": 256,
        "GROUP_SIZE_M": 8,
        "num_stages": 1,
        "num_warps": 8,
        "compile_time": 0.0062427520751953125
    },
    {
        "BLOCK_SIZE_M": 16,
        "BLOCK_SIZE_N": 512,
        "BLOCK_SIZE_K": 256,
        "GROUP_SIZE_M": 8,
        "num_stages": 1,
        "num_warps": 16,
        "compile_time": 0.0029582977294921875
    },
    {
        "BLOCK_SIZE_M": 16,
        "BLOCK_SIZE_N": 512,
        "BLOCK_SIZE_K": 256,
        "GROUP_SIZE_M": 8,
        "num_stages": 1,
        "num_warps": 32,
        "compile_time": 0.0028564929962158203
    },
    {
        "BLOCK_SIZE_M": 16,
        "BLOCK_SIZE_N": 512,
        "BLOCK_SIZE_K": 256,
        "GROUP_SIZE_M": 8,
        "num_stages": 2,
        "num_warps": 2,
        "compile_time": 18.971816301345825
    },
    {
        "BLOCK_SIZE_M": 16,
        "BLOCK_SIZE_N": 512,
        "BLOCK_SIZE_K": 256,
        "GROUP_SIZE_M": 8,
        "num_stages": 2,
        "num_warps": 4,
        "compile_time": 8.04141116142273
    },
    {
        "BLOCK_SIZE_M": 16,
        "BLOCK_SIZE_N": 512,
        "BLOCK_SIZE_K": 256,
        "GROUP_SIZE_M": 8,
        "num_stages": 2,
        "num_warps": 8,
        "compile_time": 0.0036635398864746094
    },
    {
        "BLOCK_SIZE_M": 16,
        "BLOCK_SIZE_N": 512,
        "BLOCK_SIZE_K": 256,
        "GROUP_SIZE_M": 8,
        "num_stages": 2,
        "num_warps": 16,
        "compile_time": 0.0039844512939453125
    },
    {
        "BLOCK_SIZE_M": 16,
        "BLOCK_SIZE_N": 512,
        "BLOCK_SIZE_K": 256,
        "GROUP_SIZE_M": 8,
        "num_stages": 2,
        "num_warps": 32,
        "compile_time": 0.0028030872344970703
    },
    {
        "BLOCK_SIZE_M": 16,
        "BLOCK_SIZE_N": 512,
        "BLOCK_SIZE_K": 256,
        "GROUP_SIZE_M": 8,
        "num_stages": 3,
        "num_warps": 2,
        "compile_time": 19.727312564849854
    },
    {
        "BLOCK_SIZE_M": 16,
        "BLOCK_SIZE_N": 512,
        "BLOCK_SIZE_K": 256,
        "GROUP_SIZE_M": 8,
        "num_stages": 3,
        "num_warps": 4,
        "compile_time": 118.79458951950073
    },
    {
        "BLOCK_SIZE_M": 16,
        "BLOCK_SIZE_N": 512,
        "BLOCK_SIZE_K": 256,
        "GROUP_SIZE_M": 8,
        "num_stages": 3,
        "num_warps": 8,
        "compile_time": 10.650729894638062
    },
    {
        "BLOCK_SIZE_M": 16,
        "BLOCK_SIZE_N": 512,
        "BLOCK_SIZE_K": 256,
        "GROUP_SIZE_M": 8,
        "num_stages": 3,
        "num_warps": 16,
        "compile_time": 0.004029750823974609
    },
    {
        "BLOCK_SIZE_M": 16,
        "BLOCK_SIZE_N": 512,
        "BLOCK_SIZE_K": 256,
        "GROUP_SIZE_M": 8,
        "num_stages": 3,
        "num_warps": 32,
        "compile_time": 0.0028066635131835938
    },
    {
        "BLOCK_SIZE_M": 16,
        "BLOCK_SIZE_N": 512,
        "BLOCK_SIZE_K": 256,
        "GROUP_SIZE_M": 8,
        "num_stages": 4,
        "num_warps": 2,
        "compile_time": 20.434338569641113
    },
    {
        "BLOCK_SIZE_M": 16,
        "BLOCK_SIZE_N": 512,
        "BLOCK_SIZE_K": 256,
        "GROUP_SIZE_M": 8,
        "num_stages": 4,
        "num_warps": 4,
        "compile_time": 6.045529127120972
    },
    {
        "BLOCK_SIZE_M": 16,
        "BLOCK_SIZE_N": 512,
        "BLOCK_SIZE_K": 256,
        "GROUP_SIZE_M": 8,
        "num_stages": 4,
        "num_warps": 8,
        "compile_time": 10.459238767623901
    },
    {
        "BLOCK_SIZE_M": 16,
        "BLOCK_SIZE_N": 512,
        "BLOCK_SIZE_K": 256,
        "GROUP_SIZE_M": 8,
        "num_stages": 4,
        "num_warps": 16,
        "compile_time": 0.004126787185668945
    },
    {
        "BLOCK_SIZE_M": 16,
        "BLOCK_SIZE_N": 512,
        "BLOCK_SIZE_K": 256,
        "GROUP_SIZE_M": 8,
        "num_stages": 4,
        "num_warps": 32,
        "compile_time": 0.003700733184814453
    },
    {
        "BLOCK_SIZE_M": 16,
        "BLOCK_SIZE_N": 512,
        "BLOCK_SIZE_K": 256,
        "GROUP_SIZE_M": 8,
        "num_stages": 5,
        "num_warps": 2,
        "compile_time": 21.08803153038025
    },
    {
        "BLOCK_SIZE_M": 16,
        "BLOCK_SIZE_N": 512,
        "BLOCK_SIZE_K": 256,
        "GROUP_SIZE_M": 8,
        "num_stages": 5,
        "num_warps": 4,
        "compile_time": 6.391840219497681
    },
    {
        "BLOCK_SIZE_M": 16,
        "BLOCK_SIZE_N": 512,
        "BLOCK_SIZE_K": 256,
        "GROUP_SIZE_M": 8,
        "num_stages": 5,
        "num_warps": 8,
        "compile_time": 10.568422794342041
    },
    {
        "BLOCK_SIZE_M": 16,
        "BLOCK_SIZE_N": 512,
        "BLOCK_SIZE_K": 256,
        "GROUP_SIZE_M": 8,
        "num_stages": 5,
        "num_warps": 16,
        "compile_time": 0.0036704540252685547
    },
    {
        "BLOCK_SIZE_M": 16,
        "BLOCK_SIZE_N": 512,
        "BLOCK_SIZE_K": 256,
        "GROUP_SIZE_M": 8,
        "num_stages": 5,
        "num_warps": 32,
        "compile_time": 0.0038635730743408203
    },
    {
        "BLOCK_SIZE_M": 16,
        "BLOCK_SIZE_N": 512,
        "BLOCK_SIZE_K": 256,
        "GROUP_SIZE_M": 8,
        "num_stages": 6,
        "num_warps": 2,
        "compile_time": 21.938379526138306
    },
    {
        "BLOCK_SIZE_M": 16,
        "BLOCK_SIZE_N": 512,
        "BLOCK_SIZE_K": 256,
        "GROUP_SIZE_M": 8,
        "num_stages": 6,
        "num_warps": 4,
        "compile_time": 6.773999929428101
    },
    {
        "BLOCK_SIZE_M": 16,
        "BLOCK_SIZE_N": 512,
        "BLOCK_SIZE_K": 256,
        "GROUP_SIZE_M": 8,
        "num_stages": 6,
        "num_warps": 8,
        "compile_time": 11.052169799804688
    },
    {
        "BLOCK_SIZE_M": 16,
        "BLOCK_SIZE_N": 512,
        "BLOCK_SIZE_K": 256,
        "GROUP_SIZE_M": 8,
        "num_stages": 6,
        "num_warps": 16,
        "compile_time": 0.0048558712005615234
    },
    {
        "BLOCK_SIZE_M": 16,
        "BLOCK_SIZE_N": 512,
        "BLOCK_SIZE_K": 256,
        "GROUP_SIZE_M": 8,
        "num_stages": 6,
        "num_warps": 32,
        "compile_time": 0.002888917922973633
    },
    {
        "BLOCK_SIZE_M": 16,
        "BLOCK_SIZE_N": 512,
        "BLOCK_SIZE_K": 256,
        "GROUP_SIZE_M": 8,
        "num_stages": 7,
        "num_warps": 2,
        "compile_time": 22.78229570388794
    },
    {
        "BLOCK_SIZE_M": 16,
        "BLOCK_SIZE_N": 512,
        "BLOCK_SIZE_K": 256,
        "GROUP_SIZE_M": 8,
        "num_stages": 7,
        "num_warps": 4,
        "compile_time": 7.185539245605469
    },
    {
        "BLOCK_SIZE_M": 16,
        "BLOCK_SIZE_N": 512,
        "BLOCK_SIZE_K": 256,
        "GROUP_SIZE_M": 8,
        "num_stages": 7,
        "num_warps": 8,
        "compile_time": 11.072220802307129
    },
    {
        "BLOCK_SIZE_M": 16,
        "BLOCK_SIZE_N": 512,
        "BLOCK_SIZE_K": 256,
        "GROUP_SIZE_M": 8,
        "num_stages": 7,
        "num_warps": 16,
        "compile_time": 0.003981113433837891
    },
    {
        "BLOCK_SIZE_M": 16,
        "BLOCK_SIZE_N": 512,
        "BLOCK_SIZE_K": 256,
        "GROUP_SIZE_M": 8,
        "num_stages": 7,
        "num_warps": 32,
        "compile_time": 0.002939462661743164
    },
    {
        "BLOCK_SIZE_M": 16,
        "BLOCK_SIZE_N": 512,
        "BLOCK_SIZE_K": 256,
        "GROUP_SIZE_M": 8,
        "num_stages": 8,
        "num_warps": 2,
        "compile_time": 6.181572675704956
    },
    {
        "BLOCK_SIZE_M": 16,
        "BLOCK_SIZE_N": 512,
        "BLOCK_SIZE_K": 256,
        "GROUP_SIZE_M": 8,
        "num_stages": 8,
        "num_warps": 4,
        "compile_time": 7.6141252517700195
    },
    {
        "BLOCK_SIZE_M": 16,
        "BLOCK_SIZE_N": 512,
        "BLOCK_SIZE_K": 256,
        "GROUP_SIZE_M": 8,
        "num_stages": 8,
        "num_warps": 8,
        "compile_time": 11.400180101394653
    },
    {
        "BLOCK_SIZE_M": 16,
        "BLOCK_SIZE_N": 512,
        "BLOCK_SIZE_K": 256,
        "GROUP_SIZE_M": 8,
        "num_stages": 8,
        "num_warps": 16,
        "compile_time": 0.005063295364379883
    },
    {
        "BLOCK_SIZE_M": 16,
        "BLOCK_SIZE_N": 512,
        "BLOCK_SIZE_K": 256,
        "GROUP_SIZE_M": 8,
        "num_stages": 8,
        "num_warps": 32,
        "compile_time": 0.0028734207153320312
    },
    {
        "BLOCK_SIZE_M": 16,
        "BLOCK_SIZE_N": 512,
        "BLOCK_SIZE_K": 512,
        "GROUP_SIZE_M": 8,
        "num_stages": 1,
        "num_warps": 2,
        "compile_time": 70.58248376846313
    },
    {
        "BLOCK_SIZE_M": 16,
        "BLOCK_SIZE_N": 512,
        "BLOCK_SIZE_K": 512,
        "GROUP_SIZE_M": 8,
        "num_stages": 1,
        "num_warps": 4,
        "compile_time": 18.65028166770935
    },
    {
        "BLOCK_SIZE_M": 16,
        "BLOCK_SIZE_N": 512,
        "BLOCK_SIZE_K": 512,
        "GROUP_SIZE_M": 8,
        "num_stages": 1,
        "num_warps": 8,
        "compile_time": 8.064191818237305
    },
    {
        "BLOCK_SIZE_M": 16,
        "BLOCK_SIZE_N": 512,
        "BLOCK_SIZE_K": 512,
        "GROUP_SIZE_M": 8,
        "num_stages": 1,
        "num_warps": 16,
        "compile_time": 0.0041124820709228516
    },
    {
        "BLOCK_SIZE_M": 16,
        "BLOCK_SIZE_N": 512,
        "BLOCK_SIZE_K": 512,
        "GROUP_SIZE_M": 8,
        "num_stages": 1,
        "num_warps": 32,
        "compile_time": 0.002961874008178711
    },
    {
        "BLOCK_SIZE_M": 16,
        "BLOCK_SIZE_N": 512,
        "BLOCK_SIZE_K": 512,
        "GROUP_SIZE_M": 8,
        "num_stages": 2,
        "num_warps": 2,
        "compile_time": 69.95451283454895
    },
    {
        "BLOCK_SIZE_M": 16,
        "BLOCK_SIZE_N": 512,
        "BLOCK_SIZE_K": 512,
        "GROUP_SIZE_M": 8,
        "num_stages": 2,
        "num_warps": 4,
        "compile_time": 18.980390548706055
    },
    {
        "BLOCK_SIZE_M": 16,
        "BLOCK_SIZE_N": 512,
        "BLOCK_SIZE_K": 512,
        "GROUP_SIZE_M": 8,
        "num_stages": 2,
        "num_warps": 8,
        "compile_time": 8.181252241134644
    },
    {
        "BLOCK_SIZE_M": 16,
        "BLOCK_SIZE_N": 512,
        "BLOCK_SIZE_K": 512,
        "GROUP_SIZE_M": 8,
        "num_stages": 2,
        "num_warps": 16,
        "compile_time": 0.003960371017456055
    },
    {
        "BLOCK_SIZE_M": 16,
        "BLOCK_SIZE_N": 512,
        "BLOCK_SIZE_K": 512,
        "GROUP_SIZE_M": 8,
        "num_stages": 2,
        "num_warps": 32,
        "compile_time": 0.0029404163360595703
    },
    {
        "BLOCK_SIZE_M": 16,
        "BLOCK_SIZE_N": 512,
        "BLOCK_SIZE_K": 512,
        "GROUP_SIZE_M": 8,
        "num_stages": 3,
        "num_warps": 2,
        "compile_time": 7.109217405319214
    },
    {
        "BLOCK_SIZE_M": 16,
        "BLOCK_SIZE_N": 512,
        "BLOCK_SIZE_K": 512,
        "GROUP_SIZE_M": 8,
        "num_stages": 3,
        "num_warps": 4,
        "compile_time": 19.788555145263672
    },
    {
        "BLOCK_SIZE_M": 16,
        "BLOCK_SIZE_N": 512,
        "BLOCK_SIZE_K": 512,
        "GROUP_SIZE_M": 8,
        "num_stages": 3,
        "num_warps": 8,
        "compile_time": 6.009837627410889
    },
    {
        "BLOCK_SIZE_M": 16,
        "BLOCK_SIZE_N": 512,
        "BLOCK_SIZE_K": 512,
        "GROUP_SIZE_M": 8,
        "num_stages": 3,
        "num_warps": 16,
        "compile_time": 10.50139594078064
    },
    {
        "BLOCK_SIZE_M": 16,
        "BLOCK_SIZE_N": 512,
        "BLOCK_SIZE_K": 512,
        "GROUP_SIZE_M": 8,
        "num_stages": 3,
        "num_warps": 32,
        "compile_time": 0.004120349884033203
    },
    {
        "BLOCK_SIZE_M": 16,
        "BLOCK_SIZE_N": 512,
        "BLOCK_SIZE_K": 512,
        "GROUP_SIZE_M": 8,
        "num_stages": 4,
        "num_warps": 2,
        "compile_time": 8.657419443130493
    },
    {
        "BLOCK_SIZE_M": 16,
        "BLOCK_SIZE_N": 512,
        "BLOCK_SIZE_K": 512,
        "GROUP_SIZE_M": 8,
        "num_stages": 4,
        "num_warps": 4,
        "compile_time": 20.624762773513794
    },
    {
        "BLOCK_SIZE_M": 16,
        "BLOCK_SIZE_N": 512,
        "BLOCK_SIZE_K": 512,
        "GROUP_SIZE_M": 8,
        "num_stages": 4,
        "num_warps": 8,
        "compile_time": 6.322268486022949
    },
    {
        "BLOCK_SIZE_M": 16,
        "BLOCK_SIZE_N": 512,
        "BLOCK_SIZE_K": 512,
        "GROUP_SIZE_M": 8,
        "num_stages": 4,
        "num_warps": 16,
        "compile_time": 10.36689019203186
    },
    {
        "BLOCK_SIZE_M": 16,
        "BLOCK_SIZE_N": 512,
        "BLOCK_SIZE_K": 512,
        "GROUP_SIZE_M": 8,
        "num_stages": 4,
        "num_warps": 32,
        "compile_time": 0.0036394596099853516
    },
    {
        "BLOCK_SIZE_M": 16,
        "BLOCK_SIZE_N": 512,
        "BLOCK_SIZE_K": 512,
        "GROUP_SIZE_M": 8,
        "num_stages": 5,
        "num_warps": 2,
        "compile_time": 10.420254230499268
    },
    {
        "BLOCK_SIZE_M": 16,
        "BLOCK_SIZE_N": 512,
        "BLOCK_SIZE_K": 512,
        "GROUP_SIZE_M": 8,
        "num_stages": 5,
        "num_warps": 4,
        "compile_time": 21.690253734588623
    },
    {
        "BLOCK_SIZE_M": 16,
        "BLOCK_SIZE_N": 512,
        "BLOCK_SIZE_K": 512,
        "GROUP_SIZE_M": 8,
        "num_stages": 5,
        "num_warps": 8,
        "compile_time": 6.701083421707153
    },
    {
        "BLOCK_SIZE_M": 16,
        "BLOCK_SIZE_N": 512,
        "BLOCK_SIZE_K": 512,
        "GROUP_SIZE_M": 8,
        "num_stages": 5,
        "num_warps": 16,
        "compile_time": 11.74974536895752
    },
    {
        "BLOCK_SIZE_M": 16,
        "BLOCK_SIZE_N": 512,
        "BLOCK_SIZE_K": 512,
        "GROUP_SIZE_M": 8,
        "num_stages": 5,
        "num_warps": 32,
        "compile_time": 0.003918886184692383
    },
    {
        "BLOCK_SIZE_M": 16,
        "BLOCK_SIZE_N": 512,
        "BLOCK_SIZE_K": 512,
        "GROUP_SIZE_M": 8,
        "num_stages": 6,
        "num_warps": 2,
        "compile_time": 12.305686712265015
    },
    {
        "BLOCK_SIZE_M": 16,
        "BLOCK_SIZE_N": 512,
        "BLOCK_SIZE_K": 512,
        "GROUP_SIZE_M": 8,
        "num_stages": 6,
        "num_warps": 4,
        "compile_time": 22.636002779006958
    },
    {
        "BLOCK_SIZE_M": 16,
        "BLOCK_SIZE_N": 512,
        "BLOCK_SIZE_K": 512,
        "GROUP_SIZE_M": 8,
        "num_stages": 6,
        "num_warps": 8,
        "compile_time": 7.206448316574097
    },
    {
        "BLOCK_SIZE_M": 16,
        "BLOCK_SIZE_N": 512,
        "BLOCK_SIZE_K": 512,
        "GROUP_SIZE_M": 8,
        "num_stages": 6,
        "num_warps": 16,
        "compile_time": 10.949641704559326
    },
    {
        "BLOCK_SIZE_M": 16,
        "BLOCK_SIZE_N": 512,
        "BLOCK_SIZE_K": 512,
        "GROUP_SIZE_M": 8,
        "num_stages": 6,
        "num_warps": 32,
        "compile_time": 0.004004240036010742
    },
    {
        "BLOCK_SIZE_M": 16,
        "BLOCK_SIZE_N": 512,
        "BLOCK_SIZE_K": 512,
        "GROUP_SIZE_M": 8,
        "num_stages": 7,
        "num_warps": 2,
        "compile_time": 14.145882844924927
    },
    {
        "BLOCK_SIZE_M": 16,
        "BLOCK_SIZE_N": 512,
        "BLOCK_SIZE_K": 512,
        "GROUP_SIZE_M": 8,
        "num_stages": 7,
        "num_warps": 4,
        "compile_time": 6.381715297698975
    },
    {
        "BLOCK_SIZE_M": 16,
        "BLOCK_SIZE_N": 512,
        "BLOCK_SIZE_K": 512,
        "GROUP_SIZE_M": 8,
        "num_stages": 7,
        "num_warps": 8,
        "compile_time": 7.720874786376953
    },
    {
        "BLOCK_SIZE_M": 16,
        "BLOCK_SIZE_N": 512,
        "BLOCK_SIZE_K": 512,
        "GROUP_SIZE_M": 8,
        "num_stages": 7,
        "num_warps": 16,
        "compile_time": 11.4628164768219
    },
    {
        "BLOCK_SIZE_M": 16,
        "BLOCK_SIZE_N": 512,
        "BLOCK_SIZE_K": 512,
        "GROUP_SIZE_M": 8,
        "num_stages": 7,
        "num_warps": 32,
        "compile_time": 0.003711223602294922
    },
    {
        "BLOCK_SIZE_M": 16,
        "BLOCK_SIZE_N": 512,
        "BLOCK_SIZE_K": 512,
        "GROUP_SIZE_M": 8,
        "num_stages": 8,
        "num_warps": 2,
        "compile_time": 16.126432418823242
    },
    {
        "BLOCK_SIZE_M": 16,
        "BLOCK_SIZE_N": 512,
        "BLOCK_SIZE_K": 512,
        "GROUP_SIZE_M": 8,
        "num_stages": 8,
        "num_warps": 4,
        "compile_time": 7.216379642486572
    },
    {
        "BLOCK_SIZE_M": 16,
        "BLOCK_SIZE_N": 512,
        "BLOCK_SIZE_K": 512,
        "GROUP_SIZE_M": 8,
        "num_stages": 8,
        "num_warps": 8,
        "compile_time": 8.163347005844116
    },
    {
        "BLOCK_SIZE_M": 16,
        "BLOCK_SIZE_N": 512,
        "BLOCK_SIZE_K": 512,
        "GROUP_SIZE_M": 8,
        "num_stages": 8,
        "num_warps": 16,
        "compile_time": 11.740333795547485
    },
    {
        "BLOCK_SIZE_M": 16,
        "BLOCK_SIZE_N": 512,
        "BLOCK_SIZE_K": 512,
        "GROUP_SIZE_M": 8,
        "num_stages": 8,
        "num_warps": 32,
        "compile_time": 0.004130125045776367
    },
    {
        "BLOCK_SIZE_M": 32,
        "BLOCK_SIZE_N": 16,
        "BLOCK_SIZE_K": 256,
        "GROUP_SIZE_M": 8,
        "num_stages": 8,
        "num_warps": 2,
        "compile_time": 0.0034933090209960938
    },
    {
        "BLOCK_SIZE_M": 32,
        "BLOCK_SIZE_N": 16,
        "BLOCK_SIZE_K": 256,
        "GROUP_SIZE_M": 8,
        "num_stages": 8,
        "num_warps": 4,
        "compile_time": 0.002757549285888672
    },
    {
        "BLOCK_SIZE_M": 32,
        "BLOCK_SIZE_N": 16,
        "BLOCK_SIZE_K": 256,
        "GROUP_SIZE_M": 8,
        "num_stages": 8,
        "num_warps": 8,
        "compile_time": 0.002670764923095703
    },
    {
        "BLOCK_SIZE_M": 32,
        "BLOCK_SIZE_N": 16,
        "BLOCK_SIZE_K": 256,
        "GROUP_SIZE_M": 8,
        "num_stages": 8,
        "num_warps": 16,
        "compile_time": 0.0026350021362304688
    },
    {
        "BLOCK_SIZE_M": 32,
        "BLOCK_SIZE_N": 16,
        "BLOCK_SIZE_K": 256,
        "GROUP_SIZE_M": 8,
        "num_stages": 8,
        "num_warps": 32,
        "compile_time": 0.0026378631591796875
    },
    {
        "BLOCK_SIZE_M": 32,
        "BLOCK_SIZE_N": 16,
        "BLOCK_SIZE_K": 512,
        "GROUP_SIZE_M": 8,
        "num_stages": 5,
        "num_warps": 2,
        "compile_time": 0.00506281852722168
    },
    {
        "BLOCK_SIZE_M": 32,
        "BLOCK_SIZE_N": 16,
        "BLOCK_SIZE_K": 512,
        "GROUP_SIZE_M": 8,
        "num_stages": 5,
        "num_warps": 4,
        "compile_time": 0.00272369384765625
    },
    {
        "BLOCK_SIZE_M": 32,
        "BLOCK_SIZE_N": 16,
        "BLOCK_SIZE_K": 512,
        "GROUP_SIZE_M": 8,
        "num_stages": 5,
        "num_warps": 8,
        "compile_time": 0.0027008056640625
    },
    {
        "BLOCK_SIZE_M": 32,
        "BLOCK_SIZE_N": 16,
        "BLOCK_SIZE_K": 512,
        "GROUP_SIZE_M": 8,
        "num_stages": 5,
        "num_warps": 16,
        "compile_time": 0.0026826858520507812
    },
    {
        "BLOCK_SIZE_M": 32,
        "BLOCK_SIZE_N": 16,
        "BLOCK_SIZE_K": 512,
        "GROUP_SIZE_M": 8,
        "num_stages": 5,
        "num_warps": 32,
        "compile_time": 0.0024962425231933594
    },
    {
        "BLOCK_SIZE_M": 32,
        "BLOCK_SIZE_N": 16,
        "BLOCK_SIZE_K": 512,
        "GROUP_SIZE_M": 8,
        "num_stages": 6,
        "num_warps": 2,
        "compile_time": 0.0028443336486816406
    },
    {
        "BLOCK_SIZE_M": 32,
        "BLOCK_SIZE_N": 16,
        "BLOCK_SIZE_K": 512,
        "GROUP_SIZE_M": 8,
        "num_stages": 6,
        "num_warps": 4,
        "compile_time": 0.0038177967071533203
    },
    {
        "BLOCK_SIZE_M": 32,
        "BLOCK_SIZE_N": 16,
        "BLOCK_SIZE_K": 512,
        "GROUP_SIZE_M": 8,
        "num_stages": 6,
        "num_warps": 8,
        "compile_time": 0.0027861595153808594
    },
    {
        "BLOCK_SIZE_M": 32,
        "BLOCK_SIZE_N": 16,
        "BLOCK_SIZE_K": 512,
        "GROUP_SIZE_M": 8,
        "num_stages": 6,
        "num_warps": 16,
        "compile_time": 0.0026590824127197266
    },
    {
        "BLOCK_SIZE_M": 32,
        "BLOCK_SIZE_N": 16,
        "BLOCK_SIZE_K": 512,
        "GROUP_SIZE_M": 8,
        "num_stages": 6,
        "num_warps": 32,
        "compile_time": 0.0026481151580810547
    },
    {
        "BLOCK_SIZE_M": 32,
        "BLOCK_SIZE_N": 16,
        "BLOCK_SIZE_K": 512,
        "GROUP_SIZE_M": 8,
        "num_stages": 7,
        "num_warps": 2,
        "compile_time": 0.0028319358825683594
    },
    {
        "BLOCK_SIZE_M": 32,
        "BLOCK_SIZE_N": 16,
        "BLOCK_SIZE_K": 512,
        "GROUP_SIZE_M": 8,
        "num_stages": 7,
        "num_warps": 4,
        "compile_time": 0.0026977062225341797
    },
    {
        "BLOCK_SIZE_M": 32,
        "BLOCK_SIZE_N": 16,
        "BLOCK_SIZE_K": 512,
        "GROUP_SIZE_M": 8,
        "num_stages": 7,
        "num_warps": 8,
        "compile_time": 0.0026853084564208984
    },
    {
        "BLOCK_SIZE_M": 32,
        "BLOCK_SIZE_N": 16,
        "BLOCK_SIZE_K": 512,
        "GROUP_SIZE_M": 8,
        "num_stages": 7,
        "num_warps": 16,
        "compile_time": 0.0033843517303466797
    },
    {
        "BLOCK_SIZE_M": 32,
        "BLOCK_SIZE_N": 16,
        "BLOCK_SIZE_K": 512,
        "GROUP_SIZE_M": 8,
        "num_stages": 7,
        "num_warps": 32,
        "compile_time": 0.002640962600708008
    },
    {
        "BLOCK_SIZE_M": 32,
        "BLOCK_SIZE_N": 16,
        "BLOCK_SIZE_K": 512,
        "GROUP_SIZE_M": 8,
        "num_stages": 8,
        "num_warps": 2,
        "compile_time": 0.0028994083404541016
    },
    {
        "BLOCK_SIZE_M": 32,
        "BLOCK_SIZE_N": 16,
        "BLOCK_SIZE_K": 512,
        "GROUP_SIZE_M": 8,
        "num_stages": 8,
        "num_warps": 4,
        "compile_time": 0.004157304763793945
    },
    {
        "BLOCK_SIZE_M": 32,
        "BLOCK_SIZE_N": 16,
        "BLOCK_SIZE_K": 512,
        "GROUP_SIZE_M": 8,
        "num_stages": 8,
        "num_warps": 8,
        "compile_time": 0.0027136802673339844
    },
    {
        "BLOCK_SIZE_M": 32,
        "BLOCK_SIZE_N": 16,
        "BLOCK_SIZE_K": 512,
        "GROUP_SIZE_M": 8,
        "num_stages": 8,
        "num_warps": 16,
        "compile_time": 0.0026712417602539062
    },
    {
        "BLOCK_SIZE_M": 32,
        "BLOCK_SIZE_N": 16,
        "BLOCK_SIZE_K": 512,
        "GROUP_SIZE_M": 8,
        "num_stages": 8,
        "num_warps": 32,
        "compile_time": 0.003627777099609375
    },
    {
        "BLOCK_SIZE_M": 32,
        "BLOCK_SIZE_N": 32,
        "BLOCK_SIZE_K": 256,
        "GROUP_SIZE_M": 8,
        "num_stages": 7,
        "num_warps": 2,
        "compile_time": 0.0034875869750976562
    },
    {
        "BLOCK_SIZE_M": 32,
        "BLOCK_SIZE_N": 32,
        "BLOCK_SIZE_K": 256,
        "GROUP_SIZE_M": 8,
        "num_stages": 7,
        "num_warps": 4,
        "compile_time": 0.0027451515197753906
    },
    {
        "BLOCK_SIZE_M": 32,
        "BLOCK_SIZE_N": 32,
        "BLOCK_SIZE_K": 256,
        "GROUP_SIZE_M": 8,
        "num_stages": 7,
        "num_warps": 8,
        "compile_time": 0.0026013851165771484
    },
    {
        "BLOCK_SIZE_M": 32,
        "BLOCK_SIZE_N": 32,
        "BLOCK_SIZE_K": 256,
        "GROUP_SIZE_M": 8,
        "num_stages": 7,
        "num_warps": 16,
        "compile_time": 0.002643108367919922
    },
    {
        "BLOCK_SIZE_M": 32,
        "BLOCK_SIZE_N": 32,
        "BLOCK_SIZE_K": 256,
        "GROUP_SIZE_M": 8,
        "num_stages": 7,
        "num_warps": 32,
        "compile_time": 0.002599954605102539
    },
    {
        "BLOCK_SIZE_M": 32,
        "BLOCK_SIZE_N": 32,
        "BLOCK_SIZE_K": 256,
        "GROUP_SIZE_M": 8,
        "num_stages": 8,
        "num_warps": 2,
        "compile_time": 0.0028035640716552734
    },
    {
        "BLOCK_SIZE_M": 32,
        "BLOCK_SIZE_N": 32,
        "BLOCK_SIZE_K": 256,
        "GROUP_SIZE_M": 8,
        "num_stages": 8,
        "num_warps": 4,
        "compile_time": 0.002685546875
    },
    {
        "BLOCK_SIZE_M": 32,
        "BLOCK_SIZE_N": 32,
        "BLOCK_SIZE_K": 256,
        "GROUP_SIZE_M": 8,
        "num_stages": 8,
        "num_warps": 8,
        "compile_time": 0.002654552459716797
    },
    {
        "BLOCK_SIZE_M": 32,
        "BLOCK_SIZE_N": 32,
        "BLOCK_SIZE_K": 256,
        "GROUP_SIZE_M": 8,
        "num_stages": 8,
        "num_warps": 16,
        "compile_time": 0.002623319625854492
    },
    {
        "BLOCK_SIZE_M": 32,
        "BLOCK_SIZE_N": 32,
        "BLOCK_SIZE_K": 256,
        "GROUP_SIZE_M": 8,
        "num_stages": 8,
        "num_warps": 32,
        "compile_time": 0.002607107162475586
    },
    {
        "BLOCK_SIZE_M": 32,
        "BLOCK_SIZE_N": 32,
        "BLOCK_SIZE_K": 512,
        "GROUP_SIZE_M": 8,
        "num_stages": 4,
        "num_warps": 2,
        "compile_time": 0.00366973876953125
    },
    {
        "BLOCK_SIZE_M": 32,
        "BLOCK_SIZE_N": 32,
        "BLOCK_SIZE_K": 512,
        "GROUP_SIZE_M": 8,
        "num_stages": 4,
        "num_warps": 4,
        "compile_time": 0.002783536911010742
    },
    {
        "BLOCK_SIZE_M": 32,
        "BLOCK_SIZE_N": 32,
        "BLOCK_SIZE_K": 512,
        "GROUP_SIZE_M": 8,
        "num_stages": 4,
        "num_warps": 8,
        "compile_time": 0.0036170482635498047
    },
    {
        "BLOCK_SIZE_M": 32,
        "BLOCK_SIZE_N": 32,
        "BLOCK_SIZE_K": 512,
        "GROUP_SIZE_M": 8,
        "num_stages": 4,
        "num_warps": 16,
        "compile_time": 0.0026793479919433594
    },
    {
        "BLOCK_SIZE_M": 32,
        "BLOCK_SIZE_N": 32,
        "BLOCK_SIZE_K": 512,
        "GROUP_SIZE_M": 8,
        "num_stages": 4,
        "num_warps": 32,
        "compile_time": 0.0026540756225585938
    },
    {
        "BLOCK_SIZE_M": 32,
        "BLOCK_SIZE_N": 32,
        "BLOCK_SIZE_K": 512,
        "GROUP_SIZE_M": 8,
        "num_stages": 5,
        "num_warps": 2,
        "compile_time": 0.0030541419982910156
    },
    {
        "BLOCK_SIZE_M": 32,
        "BLOCK_SIZE_N": 32,
        "BLOCK_SIZE_K": 512,
        "GROUP_SIZE_M": 8,
        "num_stages": 5,
        "num_warps": 4,
        "compile_time": 0.002766847610473633
    },
    {
        "BLOCK_SIZE_M": 32,
        "BLOCK_SIZE_N": 32,
        "BLOCK_SIZE_K": 512,
        "GROUP_SIZE_M": 8,
        "num_stages": 5,
        "num_warps": 8,
        "compile_time": 0.0027189254760742188
    },
    {
        "BLOCK_SIZE_M": 32,
        "BLOCK_SIZE_N": 32,
        "BLOCK_SIZE_K": 512,
        "GROUP_SIZE_M": 8,
        "num_stages": 5,
        "num_warps": 16,
        "compile_time": 0.002645254135131836
    },
    {
        "BLOCK_SIZE_M": 32,
        "BLOCK_SIZE_N": 32,
        "BLOCK_SIZE_K": 512,
        "GROUP_SIZE_M": 8,
        "num_stages": 5,
        "num_warps": 32,
        "compile_time": 0.003983974456787109
    },
    {
        "BLOCK_SIZE_M": 32,
        "BLOCK_SIZE_N": 32,
        "BLOCK_SIZE_K": 512,
        "GROUP_SIZE_M": 8,
        "num_stages": 6,
        "num_warps": 2,
        "compile_time": 0.002963542938232422
    },
    {
        "BLOCK_SIZE_M": 32,
        "BLOCK_SIZE_N": 32,
        "BLOCK_SIZE_K": 512,
        "GROUP_SIZE_M": 8,
        "num_stages": 6,
        "num_warps": 4,
        "compile_time": 0.002765178680419922
    },
    {
        "BLOCK_SIZE_M": 32,
        "BLOCK_SIZE_N": 32,
        "BLOCK_SIZE_K": 512,
        "GROUP_SIZE_M": 8,
        "num_stages": 6,
        "num_warps": 8,
        "compile_time": 0.0027146339416503906
    },
    {
        "BLOCK_SIZE_M": 32,
        "BLOCK_SIZE_N": 32,
        "BLOCK_SIZE_K": 512,
        "GROUP_SIZE_M": 8,
        "num_stages": 6,
        "num_warps": 16,
        "compile_time": 0.0026466846466064453
    },
    {
        "BLOCK_SIZE_M": 32,
        "BLOCK_SIZE_N": 32,
        "BLOCK_SIZE_K": 512,
        "GROUP_SIZE_M": 8,
        "num_stages": 6,
        "num_warps": 32,
        "compile_time": 0.0026407241821289062
    },
    {
        "BLOCK_SIZE_M": 32,
        "BLOCK_SIZE_N": 32,
        "BLOCK_SIZE_K": 512,
        "GROUP_SIZE_M": 8,
        "num_stages": 7,
        "num_warps": 2,
        "compile_time": 0.002895832061767578
    },
    {
        "BLOCK_SIZE_M": 32,
        "BLOCK_SIZE_N": 32,
        "BLOCK_SIZE_K": 512,
        "GROUP_SIZE_M": 8,
        "num_stages": 7,
        "num_warps": 4,
        "compile_time": 0.0028982162475585938
    },
    {
        "BLOCK_SIZE_M": 32,
        "BLOCK_SIZE_N": 32,
        "BLOCK_SIZE_K": 512,
        "GROUP_SIZE_M": 8,
        "num_stages": 7,
        "num_warps": 8,
        "compile_time": 0.002699613571166992
    },
    {
        "BLOCK_SIZE_M": 32,
        "BLOCK_SIZE_N": 32,
        "BLOCK_SIZE_K": 512,
        "GROUP_SIZE_M": 8,
        "num_stages": 7,
        "num_warps": 16,
        "compile_time": 0.002653360366821289
    },
    {
        "BLOCK_SIZE_M": 32,
        "BLOCK_SIZE_N": 32,
        "BLOCK_SIZE_K": 512,
        "GROUP_SIZE_M": 8,
        "num_stages": 7,
        "num_warps": 32,
        "compile_time": 0.0026504993438720703
    },
    {
        "BLOCK_SIZE_M": 32,
        "BLOCK_SIZE_N": 32,
        "BLOCK_SIZE_K": 512,
        "GROUP_SIZE_M": 8,
        "num_stages": 8,
        "num_warps": 2,
        "compile_time": 0.0030214786529541016
    },
    {
        "BLOCK_SIZE_M": 32,
        "BLOCK_SIZE_N": 32,
        "BLOCK_SIZE_K": 512,
        "GROUP_SIZE_M": 8,
        "num_stages": 8,
        "num_warps": 4,
        "compile_time": 0.0028476715087890625
    },
    {
        "BLOCK_SIZE_M": 32,
        "BLOCK_SIZE_N": 32,
        "BLOCK_SIZE_K": 512,
        "GROUP_SIZE_M": 8,
        "num_stages": 8,
        "num_warps": 8,
        "compile_time": 0.003392934799194336
    },
    {
        "BLOCK_SIZE_M": 32,
        "BLOCK_SIZE_N": 32,
        "BLOCK_SIZE_K": 512,
        "GROUP_SIZE_M": 8,
        "num_stages": 8,
        "num_warps": 16,
        "compile_time": 0.0026960372924804688
    },
    {
        "BLOCK_SIZE_M": 32,
        "BLOCK_SIZE_N": 32,
        "BLOCK_SIZE_K": 512,
        "GROUP_SIZE_M": 8,
        "num_stages": 8,
        "num_warps": 32,
        "compile_time": 0.002620220184326172
    },
    {
        "BLOCK_SIZE_M": 32,
        "BLOCK_SIZE_N": 64,
        "BLOCK_SIZE_K": 128,
        "GROUP_SIZE_M": 8,
        "num_stages": 8,
        "num_warps": 2,
        "compile_time": 0.003497600555419922
    },
    {
        "BLOCK_SIZE_M": 32,
        "BLOCK_SIZE_N": 64,
        "BLOCK_SIZE_K": 128,
        "GROUP_SIZE_M": 8,
        "num_stages": 8,
        "num_warps": 4,
        "compile_time": 0.002666950225830078
    },
    {
        "BLOCK_SIZE_M": 32,
        "BLOCK_SIZE_N": 64,
        "BLOCK_SIZE_K": 128,
        "GROUP_SIZE_M": 8,
        "num_stages": 8,
        "num_warps": 8,
        "compile_time": 0.002630472183227539
    },
    {
        "BLOCK_SIZE_M": 32,
        "BLOCK_SIZE_N": 64,
        "BLOCK_SIZE_K": 128,
        "GROUP_SIZE_M": 8,
        "num_stages": 8,
        "num_warps": 16,
        "compile_time": 0.0025773048400878906
    },
    {
        "BLOCK_SIZE_M": 32,
        "BLOCK_SIZE_N": 64,
        "BLOCK_SIZE_K": 128,
        "GROUP_SIZE_M": 8,
        "num_stages": 8,
        "num_warps": 32,
        "compile_time": 0.0029098987579345703
    },
    {
        "BLOCK_SIZE_M": 32,
        "BLOCK_SIZE_N": 64,
        "BLOCK_SIZE_K": 256,
        "GROUP_SIZE_M": 8,
        "num_stages": 5,
        "num_warps": 2,
        "compile_time": 0.004358768463134766
    },
    {
        "BLOCK_SIZE_M": 32,
        "BLOCK_SIZE_N": 64,
        "BLOCK_SIZE_K": 256,
        "GROUP_SIZE_M": 8,
        "num_stages": 5,
        "num_warps": 4,
        "compile_time": 0.0026748180389404297
    },
    {
        "BLOCK_SIZE_M": 32,
        "BLOCK_SIZE_N": 64,
        "BLOCK_SIZE_K": 256,
        "GROUP_SIZE_M": 8,
        "num_stages": 5,
        "num_warps": 8,
        "compile_time": 0.0026013851165771484
    },
    {
        "BLOCK_SIZE_M": 32,
        "BLOCK_SIZE_N": 64,
        "BLOCK_SIZE_K": 256,
        "GROUP_SIZE_M": 8,
        "num_stages": 5,
        "num_warps": 16,
        "compile_time": 0.0025544166564941406
    },
    {
        "BLOCK_SIZE_M": 32,
        "BLOCK_SIZE_N": 64,
        "BLOCK_SIZE_K": 256,
        "GROUP_SIZE_M": 8,
        "num_stages": 5,
        "num_warps": 32,
        "compile_time": 0.0026094913482666016
    },
    {
        "BLOCK_SIZE_M": 32,
        "BLOCK_SIZE_N": 64,
        "BLOCK_SIZE_K": 256,
        "GROUP_SIZE_M": 8,
        "num_stages": 6,
        "num_warps": 2,
        "compile_time": 0.0028493404388427734
    },
    {
        "BLOCK_SIZE_M": 32,
        "BLOCK_SIZE_N": 64,
        "BLOCK_SIZE_K": 256,
        "GROUP_SIZE_M": 8,
        "num_stages": 6,
        "num_warps": 4,
        "compile_time": 0.0026636123657226562
    },
    {
        "BLOCK_SIZE_M": 32,
        "BLOCK_SIZE_N": 64,
        "BLOCK_SIZE_K": 256,
        "GROUP_SIZE_M": 8,
        "num_stages": 6,
        "num_warps": 8,
        "compile_time": 0.0033278465270996094
    },
    {
        "BLOCK_SIZE_M": 32,
        "BLOCK_SIZE_N": 64,
        "BLOCK_SIZE_K": 256,
        "GROUP_SIZE_M": 8,
        "num_stages": 6,
        "num_warps": 16,
        "compile_time": 0.0026421546936035156
    },
    {
        "BLOCK_SIZE_M": 32,
        "BLOCK_SIZE_N": 64,
        "BLOCK_SIZE_K": 256,
        "GROUP_SIZE_M": 8,
        "num_stages": 6,
        "num_warps": 32,
        "compile_time": 0.002570629119873047
    },
    {
        "BLOCK_SIZE_M": 32,
        "BLOCK_SIZE_N": 64,
        "BLOCK_SIZE_K": 256,
        "GROUP_SIZE_M": 8,
        "num_stages": 7,
        "num_warps": 2,
        "compile_time": 0.0028281211853027344
    },
    {
        "BLOCK_SIZE_M": 32,
        "BLOCK_SIZE_N": 64,
        "BLOCK_SIZE_K": 256,
        "GROUP_SIZE_M": 8,
        "num_stages": 7,
        "num_warps": 4,
        "compile_time": 0.002684354782104492
    },
    {
        "BLOCK_SIZE_M": 32,
        "BLOCK_SIZE_N": 64,
        "BLOCK_SIZE_K": 256,
        "GROUP_SIZE_M": 8,
        "num_stages": 7,
        "num_warps": 8,
        "compile_time": 0.0024118423461914062
    },
    {
        "BLOCK_SIZE_M": 32,
        "BLOCK_SIZE_N": 64,
        "BLOCK_SIZE_K": 256,
        "GROUP_SIZE_M": 8,
        "num_stages": 7,
        "num_warps": 16,
        "compile_time": 0.002606630325317383
    },
    {
        "BLOCK_SIZE_M": 32,
        "BLOCK_SIZE_N": 64,
        "BLOCK_SIZE_K": 256,
        "GROUP_SIZE_M": 8,
        "num_stages": 7,
        "num_warps": 32,
        "compile_time": 0.003398418426513672
    },
    {
        "BLOCK_SIZE_M": 32,
        "BLOCK_SIZE_N": 64,
        "BLOCK_SIZE_K": 256,
        "GROUP_SIZE_M": 8,
        "num_stages": 8,
        "num_warps": 2,
        "compile_time": 0.0029489994049072266
    },
    {
        "BLOCK_SIZE_M": 32,
        "BLOCK_SIZE_N": 64,
        "BLOCK_SIZE_K": 256,
        "GROUP_SIZE_M": 8,
        "num_stages": 8,
        "num_warps": 4,
        "compile_time": 0.0027518272399902344
    },
    {
        "BLOCK_SIZE_M": 32,
        "BLOCK_SIZE_N": 64,
        "BLOCK_SIZE_K": 256,
        "GROUP_SIZE_M": 8,
        "num_stages": 8,
        "num_warps": 8,
        "compile_time": 0.0026514530181884766
    },
    {
        "BLOCK_SIZE_M": 32,
        "BLOCK_SIZE_N": 64,
        "BLOCK_SIZE_K": 256,
        "GROUP_SIZE_M": 8,
        "num_stages": 8,
        "num_warps": 16,
        "compile_time": 0.002650737762451172
    },
    {
        "BLOCK_SIZE_M": 32,
        "BLOCK_SIZE_N": 64,
        "BLOCK_SIZE_K": 256,
        "GROUP_SIZE_M": 8,
        "num_stages": 8,
        "num_warps": 32,
        "compile_time": 0.0026073455810546875
    },
    {
        "BLOCK_SIZE_M": 32,
        "BLOCK_SIZE_N": 64,
        "BLOCK_SIZE_K": 512,
        "GROUP_SIZE_M": 8,
        "num_stages": 3,
        "num_warps": 2,
        "compile_time": 12.347390413284302
    },
    {
        "BLOCK_SIZE_M": 32,
        "BLOCK_SIZE_N": 64,
        "BLOCK_SIZE_K": 512,
        "GROUP_SIZE_M": 8,
        "num_stages": 3,
        "num_warps": 4,
        "compile_time": 0.004239559173583984
    },
    {
        "BLOCK_SIZE_M": 32,
        "BLOCK_SIZE_N": 64,
        "BLOCK_SIZE_K": 512,
        "GROUP_SIZE_M": 8,
        "num_stages": 3,
        "num_warps": 8,
        "compile_time": 0.0031201839447021484
    },
    {
        "BLOCK_SIZE_M": 32,
        "BLOCK_SIZE_N": 64,
        "BLOCK_SIZE_K": 512,
        "GROUP_SIZE_M": 8,
        "num_stages": 3,
        "num_warps": 16,
        "compile_time": 0.0029914379119873047
    },
    {
        "BLOCK_SIZE_M": 32,
        "BLOCK_SIZE_N": 64,
        "BLOCK_SIZE_K": 512,
        "GROUP_SIZE_M": 8,
        "num_stages": 3,
        "num_warps": 32,
        "compile_time": 0.004059314727783203
    },
    {
        "BLOCK_SIZE_M": 32,
        "BLOCK_SIZE_N": 64,
        "BLOCK_SIZE_K": 512,
        "GROUP_SIZE_M": 8,
        "num_stages": 4,
        "num_warps": 2,
        "compile_time": 12.593959331512451
    },
    {
        "BLOCK_SIZE_M": 32,
        "BLOCK_SIZE_N": 64,
        "BLOCK_SIZE_K": 512,
        "GROUP_SIZE_M": 8,
        "num_stages": 4,
        "num_warps": 4,
        "compile_time": 0.004047393798828125
    },
    {
        "BLOCK_SIZE_M": 32,
        "BLOCK_SIZE_N": 64,
        "BLOCK_SIZE_K": 512,
        "GROUP_SIZE_M": 8,
        "num_stages": 4,
        "num_warps": 8,
        "compile_time": 0.004160881042480469
    },
    {
        "BLOCK_SIZE_M": 32,
        "BLOCK_SIZE_N": 64,
        "BLOCK_SIZE_K": 512,
        "GROUP_SIZE_M": 8,
        "num_stages": 4,
        "num_warps": 16,
        "compile_time": 0.0030553340911865234
    },
    {
        "BLOCK_SIZE_M": 32,
        "BLOCK_SIZE_N": 64,
        "BLOCK_SIZE_K": 512,
        "GROUP_SIZE_M": 8,
        "num_stages": 4,
        "num_warps": 32,
        "compile_time": 0.003030538558959961
    },
    {
        "BLOCK_SIZE_M": 32,
        "BLOCK_SIZE_N": 64,
        "BLOCK_SIZE_K": 512,
        "GROUP_SIZE_M": 8,
        "num_stages": 5,
        "num_warps": 2,
        "compile_time": 12.912307262420654
    },
    {
        "BLOCK_SIZE_M": 32,
        "BLOCK_SIZE_N": 64,
        "BLOCK_SIZE_K": 512,
        "GROUP_SIZE_M": 8,
        "num_stages": 5,
        "num_warps": 4,
        "compile_time": 0.004092693328857422
    },
    {
        "BLOCK_SIZE_M": 32,
        "BLOCK_SIZE_N": 64,
        "BLOCK_SIZE_K": 512,
        "GROUP_SIZE_M": 8,
        "num_stages": 5,
        "num_warps": 8,
        "compile_time": 0.003970623016357422
    },
    {
        "BLOCK_SIZE_M": 32,
        "BLOCK_SIZE_N": 64,
        "BLOCK_SIZE_K": 512,
        "GROUP_SIZE_M": 8,
        "num_stages": 5,
        "num_warps": 16,
        "compile_time": 0.003037691116333008
    },
    {
        "BLOCK_SIZE_M": 32,
        "BLOCK_SIZE_N": 64,
        "BLOCK_SIZE_K": 512,
        "GROUP_SIZE_M": 8,
        "num_stages": 5,
        "num_warps": 32,
        "compile_time": 0.00284576416015625
    },
    {
        "BLOCK_SIZE_M": 32,
        "BLOCK_SIZE_N": 64,
        "BLOCK_SIZE_K": 512,
        "GROUP_SIZE_M": 8,
        "num_stages": 6,
        "num_warps": 2,
        "compile_time": 13.198022603988647
    },
    {
        "BLOCK_SIZE_M": 32,
        "BLOCK_SIZE_N": 64,
        "BLOCK_SIZE_K": 512,
        "GROUP_SIZE_M": 8,
        "num_stages": 6,
        "num_warps": 4,
        "compile_time": 0.004504203796386719
    },
    {
        "BLOCK_SIZE_M": 32,
        "BLOCK_SIZE_N": 64,
        "BLOCK_SIZE_K": 512,
        "GROUP_SIZE_M": 8,
        "num_stages": 6,
        "num_warps": 8,
        "compile_time": 0.0030939579010009766
    },
    {
        "BLOCK_SIZE_M": 32,
        "BLOCK_SIZE_N": 64,
        "BLOCK_SIZE_K": 512,
        "GROUP_SIZE_M": 8,
        "num_stages": 6,
        "num_warps": 16,
        "compile_time": 0.003027677536010742
    },
    {
        "BLOCK_SIZE_M": 32,
        "BLOCK_SIZE_N": 64,
        "BLOCK_SIZE_K": 512,
        "GROUP_SIZE_M": 8,
        "num_stages": 6,
        "num_warps": 32,
        "compile_time": 0.003032684326171875
    },
    {
        "BLOCK_SIZE_M": 32,
        "BLOCK_SIZE_N": 64,
        "BLOCK_SIZE_K": 512,
        "GROUP_SIZE_M": 8,
        "num_stages": 7,
        "num_warps": 2,
        "compile_time": 13.460833549499512
    },
    {
        "BLOCK_SIZE_M": 32,
        "BLOCK_SIZE_N": 64,
        "BLOCK_SIZE_K": 512,
        "GROUP_SIZE_M": 8,
        "num_stages": 7,
        "num_warps": 4,
        "compile_time": 0.004937171936035156
    },
    {
        "BLOCK_SIZE_M": 32,
        "BLOCK_SIZE_N": 64,
        "BLOCK_SIZE_K": 512,
        "GROUP_SIZE_M": 8,
        "num_stages": 7,
        "num_warps": 8,
        "compile_time": 0.003154754638671875
    },
    {
        "BLOCK_SIZE_M": 32,
        "BLOCK_SIZE_N": 64,
        "BLOCK_SIZE_K": 512,
        "GROUP_SIZE_M": 8,
        "num_stages": 7,
        "num_warps": 16,
        "compile_time": 0.003070831298828125
    },
    {
        "BLOCK_SIZE_M": 32,
        "BLOCK_SIZE_N": 64,
        "BLOCK_SIZE_K": 512,
        "GROUP_SIZE_M": 8,
        "num_stages": 7,
        "num_warps": 32,
        "compile_time": 0.0030584335327148438
    },
    {
        "BLOCK_SIZE_M": 32,
        "BLOCK_SIZE_N": 64,
        "BLOCK_SIZE_K": 512,
        "GROUP_SIZE_M": 8,
        "num_stages": 8,
        "num_warps": 2,
        "compile_time": 13.76323914527893
    },
    {
        "BLOCK_SIZE_M": 32,
        "BLOCK_SIZE_N": 64,
        "BLOCK_SIZE_K": 512,
        "GROUP_SIZE_M": 8,
        "num_stages": 8,
        "num_warps": 4,
        "compile_time": 0.004325151443481445
    },
    {
        "BLOCK_SIZE_M": 32,
        "BLOCK_SIZE_N": 64,
        "BLOCK_SIZE_K": 512,
        "GROUP_SIZE_M": 8,
        "num_stages": 8,
        "num_warps": 8,
        "compile_time": 0.0031180381774902344
    },
    {
        "BLOCK_SIZE_M": 32,
        "BLOCK_SIZE_N": 64,
        "BLOCK_SIZE_K": 512,
        "GROUP_SIZE_M": 8,
        "num_stages": 8,
        "num_warps": 16,
        "compile_time": 0.0030651092529296875
    },
    {
        "BLOCK_SIZE_M": 32,
        "BLOCK_SIZE_N": 64,
        "BLOCK_SIZE_K": 512,
        "GROUP_SIZE_M": 8,
        "num_stages": 8,
        "num_warps": 32,
        "compile_time": 0.0032083988189697266
    },
    {
        "BLOCK_SIZE_M": 32,
        "BLOCK_SIZE_N": 128,
        "BLOCK_SIZE_K": 128,
        "GROUP_SIZE_M": 8,
        "num_stages": 6,
        "num_warps": 2,
        "compile_time": 0.0034942626953125
    },
    {
        "BLOCK_SIZE_M": 32,
        "BLOCK_SIZE_N": 128,
        "BLOCK_SIZE_K": 128,
        "GROUP_SIZE_M": 8,
        "num_stages": 6,
        "num_warps": 4,
        "compile_time": 0.0027396678924560547
    },
    {
        "BLOCK_SIZE_M": 32,
        "BLOCK_SIZE_N": 128,
        "BLOCK_SIZE_K": 128,
        "GROUP_SIZE_M": 8,
        "num_stages": 6,
        "num_warps": 8,
        "compile_time": 0.002651214599609375
    },
    {
        "BLOCK_SIZE_M": 32,
        "BLOCK_SIZE_N": 128,
        "BLOCK_SIZE_K": 128,
        "GROUP_SIZE_M": 8,
        "num_stages": 6,
        "num_warps": 16,
        "compile_time": 0.0026504993438720703
    },
    {
        "BLOCK_SIZE_M": 32,
        "BLOCK_SIZE_N": 128,
        "BLOCK_SIZE_K": 128,
        "GROUP_SIZE_M": 8,
        "num_stages": 6,
        "num_warps": 32,
        "compile_time": 0.0034410953521728516
    },
    {
        "BLOCK_SIZE_M": 32,
        "BLOCK_SIZE_N": 128,
        "BLOCK_SIZE_K": 128,
        "GROUP_SIZE_M": 8,
        "num_stages": 7,
        "num_warps": 2,
        "compile_time": 0.002849578857421875
    },
    {
        "BLOCK_SIZE_M": 32,
        "BLOCK_SIZE_N": 128,
        "BLOCK_SIZE_K": 128,
        "GROUP_SIZE_M": 8,
        "num_stages": 7,
        "num_warps": 4,
        "compile_time": 0.0027408599853515625
    },
    {
        "BLOCK_SIZE_M": 32,
        "BLOCK_SIZE_N": 128,
        "BLOCK_SIZE_K": 128,
        "GROUP_SIZE_M": 8,
        "num_stages": 7,
        "num_warps": 8,
        "compile_time": 0.0026798248291015625
    },
    {
        "BLOCK_SIZE_M": 32,
        "BLOCK_SIZE_N": 128,
        "BLOCK_SIZE_K": 128,
        "GROUP_SIZE_M": 8,
        "num_stages": 7,
        "num_warps": 16,
        "compile_time": 0.0026197433471679688
    },
    {
        "BLOCK_SIZE_M": 32,
        "BLOCK_SIZE_N": 128,
        "BLOCK_SIZE_K": 128,
        "GROUP_SIZE_M": 8,
        "num_stages": 7,
        "num_warps": 32,
        "compile_time": 0.0026149749755859375
    },
    {
        "BLOCK_SIZE_M": 32,
        "BLOCK_SIZE_N": 128,
        "BLOCK_SIZE_K": 128,
        "GROUP_SIZE_M": 8,
        "num_stages": 8,
        "num_warps": 2,
        "compile_time": 0.002897977828979492
    },
    {
        "BLOCK_SIZE_M": 32,
        "BLOCK_SIZE_N": 128,
        "BLOCK_SIZE_K": 128,
        "GROUP_SIZE_M": 8,
        "num_stages": 8,
        "num_warps": 4,
        "compile_time": 0.0035851001739501953
    },
    {
        "BLOCK_SIZE_M": 32,
        "BLOCK_SIZE_N": 128,
        "BLOCK_SIZE_K": 128,
        "GROUP_SIZE_M": 8,
        "num_stages": 8,
        "num_warps": 8,
        "compile_time": 0.00261688232421875
    },
    {
        "BLOCK_SIZE_M": 32,
        "BLOCK_SIZE_N": 128,
        "BLOCK_SIZE_K": 128,
        "GROUP_SIZE_M": 8,
        "num_stages": 8,
        "num_warps": 16,
        "compile_time": 0.002605438232421875
    },
    {
        "BLOCK_SIZE_M": 32,
        "BLOCK_SIZE_N": 128,
        "BLOCK_SIZE_K": 128,
        "GROUP_SIZE_M": 8,
        "num_stages": 8,
        "num_warps": 32,
        "compile_time": 0.002611875534057617
    },
    {
        "BLOCK_SIZE_M": 32,
        "BLOCK_SIZE_N": 128,
        "BLOCK_SIZE_K": 256,
        "GROUP_SIZE_M": 8,
        "num_stages": 3,
        "num_warps": 2,
        "compile_time": 10.990049362182617
    },
    {
        "BLOCK_SIZE_M": 32,
        "BLOCK_SIZE_N": 128,
        "BLOCK_SIZE_K": 256,
        "GROUP_SIZE_M": 8,
        "num_stages": 4,
        "num_warps": 2,
        "compile_time": 11.270950078964233
    },
    {
        "BLOCK_SIZE_M": 32,
        "BLOCK_SIZE_N": 128,
        "BLOCK_SIZE_K": 256,
        "GROUP_SIZE_M": 8,
        "num_stages": 4,
        "num_warps": 4,
        "compile_time": 0.00408625602722168
    },
    {
        "BLOCK_SIZE_M": 32,
        "BLOCK_SIZE_N": 128,
        "BLOCK_SIZE_K": 256,
        "GROUP_SIZE_M": 8,
        "num_stages": 4,
        "num_warps": 8,
        "compile_time": 0.003244638442993164
    },
    {
        "BLOCK_SIZE_M": 32,
        "BLOCK_SIZE_N": 128,
        "BLOCK_SIZE_K": 256,
        "GROUP_SIZE_M": 8,
        "num_stages": 4,
        "num_warps": 16,
        "compile_time": 0.0029668807983398438
    },
    {
        "BLOCK_SIZE_M": 32,
        "BLOCK_SIZE_N": 128,
        "BLOCK_SIZE_K": 256,
        "GROUP_SIZE_M": 8,
        "num_stages": 4,
        "num_warps": 32,
        "compile_time": 0.00408625602722168
    },
    {
        "BLOCK_SIZE_M": 32,
        "BLOCK_SIZE_N": 128,
        "BLOCK_SIZE_K": 256,
        "GROUP_SIZE_M": 8,
        "num_stages": 5,
        "num_warps": 2,
        "compile_time": 11.475753784179688
    },
    {
        "BLOCK_SIZE_M": 32,
        "BLOCK_SIZE_N": 128,
        "BLOCK_SIZE_K": 256,
        "GROUP_SIZE_M": 8,
        "num_stages": 5,
        "num_warps": 4,
        "compile_time": 0.004263162612915039
    },
    {
        "BLOCK_SIZE_M": 32,
        "BLOCK_SIZE_N": 128,
        "BLOCK_SIZE_K": 256,
        "GROUP_SIZE_M": 8,
        "num_stages": 5,
        "num_warps": 8,
        "compile_time": 0.0030274391174316406
    },
    {
        "BLOCK_SIZE_M": 32,
        "BLOCK_SIZE_N": 128,
        "BLOCK_SIZE_K": 256,
        "GROUP_SIZE_M": 8,
        "num_stages": 5,
        "num_warps": 16,
        "compile_time": 0.0029764175415039062
    },
    {
        "BLOCK_SIZE_M": 32,
        "BLOCK_SIZE_N": 128,
        "BLOCK_SIZE_K": 256,
        "GROUP_SIZE_M": 8,
        "num_stages": 5,
        "num_warps": 32,
        "compile_time": 0.003053903579711914
    },
    {
        "BLOCK_SIZE_M": 32,
        "BLOCK_SIZE_N": 128,
        "BLOCK_SIZE_K": 256,
        "GROUP_SIZE_M": 8,
        "num_stages": 6,
        "num_warps": 2,
        "compile_time": 11.677021980285645
    },
    {
        "BLOCK_SIZE_M": 32,
        "BLOCK_SIZE_N": 128,
        "BLOCK_SIZE_K": 256,
        "GROUP_SIZE_M": 8,
        "num_stages": 6,
        "num_warps": 4,
        "compile_time": 0.00403141975402832
    },
    {
        "BLOCK_SIZE_M": 32,
        "BLOCK_SIZE_N": 128,
        "BLOCK_SIZE_K": 256,
        "GROUP_SIZE_M": 8,
        "num_stages": 6,
        "num_warps": 8,
        "compile_time": 0.0034780502319335938
    },
    {
        "BLOCK_SIZE_M": 32,
        "BLOCK_SIZE_N": 128,
        "BLOCK_SIZE_K": 256,
        "GROUP_SIZE_M": 8,
        "num_stages": 6,
        "num_warps": 16,
        "compile_time": 0.002988100051879883
    },
    {
        "BLOCK_SIZE_M": 32,
        "BLOCK_SIZE_N": 128,
        "BLOCK_SIZE_K": 256,
        "GROUP_SIZE_M": 8,
        "num_stages": 6,
        "num_warps": 32,
        "compile_time": 0.002961397171020508
    },
    {
        "BLOCK_SIZE_M": 32,
        "BLOCK_SIZE_N": 128,
        "BLOCK_SIZE_K": 256,
        "GROUP_SIZE_M": 8,
        "num_stages": 7,
        "num_warps": 2,
        "compile_time": 11.936146974563599
    },
    {
        "BLOCK_SIZE_M": 32,
        "BLOCK_SIZE_N": 128,
        "BLOCK_SIZE_K": 256,
        "GROUP_SIZE_M": 8,
        "num_stages": 7,
        "num_warps": 4,
        "compile_time": 0.004023313522338867
    },
    {
        "BLOCK_SIZE_M": 32,
        "BLOCK_SIZE_N": 128,
        "BLOCK_SIZE_K": 256,
        "GROUP_SIZE_M": 8,
        "num_stages": 7,
        "num_warps": 8,
        "compile_time": 0.0030934810638427734
    },
    {
        "BLOCK_SIZE_M": 32,
        "BLOCK_SIZE_N": 128,
        "BLOCK_SIZE_K": 256,
        "GROUP_SIZE_M": 8,
        "num_stages": 7,
        "num_warps": 16,
        "compile_time": 0.0029764175415039062
    },
    {
        "BLOCK_SIZE_M": 32,
        "BLOCK_SIZE_N": 128,
        "BLOCK_SIZE_K": 256,
        "GROUP_SIZE_M": 8,
        "num_stages": 7,
        "num_warps": 32,
        "compile_time": 0.003843545913696289
    },
    {
        "BLOCK_SIZE_M": 32,
        "BLOCK_SIZE_N": 128,
        "BLOCK_SIZE_K": 256,
        "GROUP_SIZE_M": 8,
        "num_stages": 8,
        "num_warps": 2,
        "compile_time": 12.273669958114624
    },
    {
        "BLOCK_SIZE_M": 32,
        "BLOCK_SIZE_N": 128,
        "BLOCK_SIZE_K": 256,
        "GROUP_SIZE_M": 8,
        "num_stages": 8,
        "num_warps": 4,
        "compile_time": 0.0045261383056640625
    },
    {
        "BLOCK_SIZE_M": 32,
        "BLOCK_SIZE_N": 128,
        "BLOCK_SIZE_K": 256,
        "GROUP_SIZE_M": 8,
        "num_stages": 8,
        "num_warps": 8,
        "compile_time": 0.0030999183654785156
    },
    {
        "BLOCK_SIZE_M": 32,
        "BLOCK_SIZE_N": 128,
        "BLOCK_SIZE_K": 256,
        "GROUP_SIZE_M": 8,
        "num_stages": 8,
        "num_warps": 16,
        "compile_time": 0.003003358840942383
    },
    {
        "BLOCK_SIZE_M": 32,
        "BLOCK_SIZE_N": 128,
        "BLOCK_SIZE_K": 256,
        "GROUP_SIZE_M": 8,
        "num_stages": 8,
        "num_warps": 32,
        "compile_time": 0.002971172332763672
    },
    {
        "BLOCK_SIZE_M": 32,
        "BLOCK_SIZE_N": 128,
        "BLOCK_SIZE_K": 512,
        "GROUP_SIZE_M": 8,
        "num_stages": 1,
        "num_warps": 2,
        "compile_time": 8.92388129234314
    },
    {
        "BLOCK_SIZE_M": 32,
        "BLOCK_SIZE_N": 128,
        "BLOCK_SIZE_K": 512,
        "GROUP_SIZE_M": 8,
        "num_stages": 2,
        "num_warps": 2,
        "compile_time": 6.036314487457275
    },
    {
        "BLOCK_SIZE_M": 32,
        "BLOCK_SIZE_N": 128,
        "BLOCK_SIZE_K": 512,
        "GROUP_SIZE_M": 8,
        "num_stages": 3,
        "num_warps": 2,
        "compile_time": 6.3899078369140625
    },
    {
        "BLOCK_SIZE_M": 32,
        "BLOCK_SIZE_N": 128,
        "BLOCK_SIZE_K": 512,
        "GROUP_SIZE_M": 8,
        "num_stages": 3,
        "num_warps": 4,
        "compile_time": 11.027195453643799
    },
    {
        "BLOCK_SIZE_M": 32,
        "BLOCK_SIZE_N": 128,
        "BLOCK_SIZE_K": 512,
        "GROUP_SIZE_M": 8,
        "num_stages": 3,
        "num_warps": 8,
        "compile_time": 0.004040241241455078
    },
    {
        "BLOCK_SIZE_M": 32,
        "BLOCK_SIZE_N": 128,
        "BLOCK_SIZE_K": 512,
        "GROUP_SIZE_M": 8,
        "num_stages": 3,
        "num_warps": 16,
        "compile_time": 0.0031540393829345703
    },
    {
        "BLOCK_SIZE_M": 32,
        "BLOCK_SIZE_N": 128,
        "BLOCK_SIZE_K": 512,
        "GROUP_SIZE_M": 8,
        "num_stages": 3,
        "num_warps": 32,
        "compile_time": 0.003077268600463867
    },
    {
        "BLOCK_SIZE_M": 32,
        "BLOCK_SIZE_N": 128,
        "BLOCK_SIZE_K": 512,
        "GROUP_SIZE_M": 8,
        "num_stages": 4,
        "num_warps": 2,
        "compile_time": 6.788509368896484
    },
    {
        "BLOCK_SIZE_M": 32,
        "BLOCK_SIZE_N": 128,
        "BLOCK_SIZE_K": 512,
        "GROUP_SIZE_M": 8,
        "num_stages": 4,
        "num_warps": 4,
        "compile_time": 11.207552909851074
    },
    {
        "BLOCK_SIZE_M": 32,
        "BLOCK_SIZE_N": 128,
        "BLOCK_SIZE_K": 512,
        "GROUP_SIZE_M": 8,
        "num_stages": 4,
        "num_warps": 8,
        "compile_time": 0.004515886306762695
    },
    {
        "BLOCK_SIZE_M": 32,
        "BLOCK_SIZE_N": 128,
        "BLOCK_SIZE_K": 512,
        "GROUP_SIZE_M": 8,
        "num_stages": 4,
        "num_warps": 16,
        "compile_time": 0.003098726272583008
    },
    {
        "BLOCK_SIZE_M": 32,
        "BLOCK_SIZE_N": 128,
        "BLOCK_SIZE_K": 512,
        "GROUP_SIZE_M": 8,
        "num_stages": 4,
        "num_warps": 32,
        "compile_time": 0.004151344299316406
    },
    {
        "BLOCK_SIZE_M": 32,
        "BLOCK_SIZE_N": 128,
        "BLOCK_SIZE_K": 512,
        "GROUP_SIZE_M": 8,
        "num_stages": 5,
        "num_warps": 2,
        "compile_time": 7.211828231811523
    },
    {
        "BLOCK_SIZE_M": 32,
        "BLOCK_SIZE_N": 128,
        "BLOCK_SIZE_K": 512,
        "GROUP_SIZE_M": 8,
        "num_stages": 5,
        "num_warps": 4,
        "compile_time": 11.539161443710327
    },
    {
        "BLOCK_SIZE_M": 32,
        "BLOCK_SIZE_N": 128,
        "BLOCK_SIZE_K": 512,
        "GROUP_SIZE_M": 8,
        "num_stages": 5,
        "num_warps": 8,
        "compile_time": 0.0044062137603759766
    },
    {
        "BLOCK_SIZE_M": 32,
        "BLOCK_SIZE_N": 128,
        "BLOCK_SIZE_K": 512,
        "GROUP_SIZE_M": 8,
        "num_stages": 5,
        "num_warps": 16,
        "compile_time": 0.003100156784057617
    },
    {
        "BLOCK_SIZE_M": 32,
        "BLOCK_SIZE_N": 128,
        "BLOCK_SIZE_K": 512,
        "GROUP_SIZE_M": 8,
        "num_stages": 5,
        "num_warps": 32,
        "compile_time": 0.003906965255737305
    },
    {
        "BLOCK_SIZE_M": 32,
        "BLOCK_SIZE_N": 128,
        "BLOCK_SIZE_K": 512,
        "GROUP_SIZE_M": 8,
        "num_stages": 6,
        "num_warps": 2,
        "compile_time": 7.65117621421814
    },
    {
        "BLOCK_SIZE_M": 32,
        "BLOCK_SIZE_N": 128,
        "BLOCK_SIZE_K": 512,
        "GROUP_SIZE_M": 8,
        "num_stages": 6,
        "num_warps": 4,
        "compile_time": 11.708853721618652
    },
    {
        "BLOCK_SIZE_M": 32,
        "BLOCK_SIZE_N": 128,
        "BLOCK_SIZE_K": 512,
        "GROUP_SIZE_M": 8,
        "num_stages": 6,
        "num_warps": 8,
        "compile_time": 0.004230022430419922
    },
    {
        "BLOCK_SIZE_M": 32,
        "BLOCK_SIZE_N": 128,
        "BLOCK_SIZE_K": 512,
        "GROUP_SIZE_M": 8,
        "num_stages": 6,
        "num_warps": 16,
        "compile_time": 0.0031328201293945312
    },
    {
        "BLOCK_SIZE_M": 32,
        "BLOCK_SIZE_N": 128,
        "BLOCK_SIZE_K": 512,
        "GROUP_SIZE_M": 8,
        "num_stages": 6,
        "num_warps": 32,
        "compile_time": 0.0031938552856445312
    },
    {
        "BLOCK_SIZE_M": 32,
        "BLOCK_SIZE_N": 128,
        "BLOCK_SIZE_K": 512,
        "GROUP_SIZE_M": 8,
        "num_stages": 7,
        "num_warps": 2,
        "compile_time": 7.994544506072998
    },
    {
        "BLOCK_SIZE_M": 32,
        "BLOCK_SIZE_N": 128,
        "BLOCK_SIZE_K": 512,
        "GROUP_SIZE_M": 8,
        "num_stages": 7,
        "num_warps": 4,
        "compile_time": 11.990772724151611
    },
    {
        "BLOCK_SIZE_M": 32,
        "BLOCK_SIZE_N": 128,
        "BLOCK_SIZE_K": 512,
        "GROUP_SIZE_M": 8,
        "num_stages": 7,
        "num_warps": 8,
        "compile_time": 0.00513458251953125
    },
    {
        "BLOCK_SIZE_M": 32,
        "BLOCK_SIZE_N": 128,
        "BLOCK_SIZE_K": 512,
        "GROUP_SIZE_M": 8,
        "num_stages": 7,
        "num_warps": 16,
        "compile_time": 0.003135204315185547
    },
    {
        "BLOCK_SIZE_M": 32,
        "BLOCK_SIZE_N": 128,
        "BLOCK_SIZE_K": 512,
        "GROUP_SIZE_M": 8,
        "num_stages": 7,
        "num_warps": 32,
        "compile_time": 0.003060579299926758
    },
    {
        "BLOCK_SIZE_M": 32,
        "BLOCK_SIZE_N": 128,
        "BLOCK_SIZE_K": 512,
        "GROUP_SIZE_M": 8,
        "num_stages": 8,
        "num_warps": 2,
        "compile_time": 8.49733304977417
    },
    {
        "BLOCK_SIZE_M": 32,
        "BLOCK_SIZE_N": 128,
        "BLOCK_SIZE_K": 512,
        "GROUP_SIZE_M": 8,
        "num_stages": 8,
        "num_warps": 4,
        "compile_time": 12.21888279914856
    },
    {
        "BLOCK_SIZE_M": 32,
        "BLOCK_SIZE_N": 128,
        "BLOCK_SIZE_K": 512,
        "GROUP_SIZE_M": 8,
        "num_stages": 8,
        "num_warps": 8,
        "compile_time": 0.004048347473144531
    },
    {
        "BLOCK_SIZE_M": 32,
        "BLOCK_SIZE_N": 128,
        "BLOCK_SIZE_K": 512,
        "GROUP_SIZE_M": 8,
        "num_stages": 8,
        "num_warps": 16,
        "compile_time": 0.003135204315185547
    },
    {
        "BLOCK_SIZE_M": 32,
        "BLOCK_SIZE_N": 128,
        "BLOCK_SIZE_K": 512,
        "GROUP_SIZE_M": 8,
        "num_stages": 8,
        "num_warps": 32,
        "compile_time": 0.0030524730682373047
    },
    {
        "BLOCK_SIZE_M": 32,
        "BLOCK_SIZE_N": 256,
        "BLOCK_SIZE_K": 64,
        "GROUP_SIZE_M": 8,
        "num_stages": 6,
        "num_warps": 2,
        "compile_time": 0.0035915374755859375
    },
    {
        "BLOCK_SIZE_M": 32,
        "BLOCK_SIZE_N": 256,
        "BLOCK_SIZE_K": 64,
        "GROUP_SIZE_M": 8,
        "num_stages": 6,
        "num_warps": 4,
        "compile_time": 0.003309965133666992
    },
    {
        "BLOCK_SIZE_M": 32,
        "BLOCK_SIZE_N": 256,
        "BLOCK_SIZE_K": 64,
        "GROUP_SIZE_M": 8,
        "num_stages": 6,
        "num_warps": 8,
        "compile_time": 0.0027158260345458984
    },
    {
        "BLOCK_SIZE_M": 32,
        "BLOCK_SIZE_N": 256,
        "BLOCK_SIZE_K": 64,
        "GROUP_SIZE_M": 8,
        "num_stages": 6,
        "num_warps": 16,
        "compile_time": 0.0025959014892578125
    },
    {
        "BLOCK_SIZE_M": 32,
        "BLOCK_SIZE_N": 256,
        "BLOCK_SIZE_K": 64,
        "GROUP_SIZE_M": 8,
        "num_stages": 6,
        "num_warps": 32,
        "compile_time": 0.0026123523712158203
    },
    {
        "BLOCK_SIZE_M": 32,
        "BLOCK_SIZE_N": 256,
        "BLOCK_SIZE_K": 64,
        "GROUP_SIZE_M": 8,
        "num_stages": 7,
        "num_warps": 2,
        "compile_time": 0.0029239654541015625
    },
    {
        "BLOCK_SIZE_M": 32,
        "BLOCK_SIZE_N": 256,
        "BLOCK_SIZE_K": 64,
        "GROUP_SIZE_M": 8,
        "num_stages": 7,
        "num_warps": 4,
        "compile_time": 0.0026803016662597656
    },
    {
        "BLOCK_SIZE_M": 32,
        "BLOCK_SIZE_N": 256,
        "BLOCK_SIZE_K": 64,
        "GROUP_SIZE_M": 8,
        "num_stages": 7,
        "num_warps": 8,
        "compile_time": 0.004151344299316406
    },
    {
        "BLOCK_SIZE_M": 32,
        "BLOCK_SIZE_N": 256,
        "BLOCK_SIZE_K": 64,
        "GROUP_SIZE_M": 8,
        "num_stages": 7,
        "num_warps": 16,
        "compile_time": 0.0027008056640625
    },
    {
        "BLOCK_SIZE_M": 32,
        "BLOCK_SIZE_N": 256,
        "BLOCK_SIZE_K": 64,
        "GROUP_SIZE_M": 8,
        "num_stages": 7,
        "num_warps": 32,
        "compile_time": 0.002814769744873047
    },
    {
        "BLOCK_SIZE_M": 32,
        "BLOCK_SIZE_N": 256,
        "BLOCK_SIZE_K": 64,
        "GROUP_SIZE_M": 8,
        "num_stages": 8,
        "num_warps": 2,
        "compile_time": 0.0035178661346435547
    },
    {
        "BLOCK_SIZE_M": 32,
        "BLOCK_SIZE_N": 256,
        "BLOCK_SIZE_K": 64,
        "GROUP_SIZE_M": 8,
        "num_stages": 8,
        "num_warps": 4,
        "compile_time": 0.003255605697631836
    },
    {
        "BLOCK_SIZE_M": 32,
        "BLOCK_SIZE_N": 256,
        "BLOCK_SIZE_K": 64,
        "GROUP_SIZE_M": 8,
        "num_stages": 8,
        "num_warps": 8,
        "compile_time": 0.005551815032958984
    },
    {
        "BLOCK_SIZE_M": 32,
        "BLOCK_SIZE_N": 256,
        "BLOCK_SIZE_K": 64,
        "GROUP_SIZE_M": 8,
        "num_stages": 8,
        "num_warps": 16,
        "compile_time": 0.004403114318847656
    },
    {
        "BLOCK_SIZE_M": 32,
        "BLOCK_SIZE_N": 256,
        "BLOCK_SIZE_K": 64,
        "GROUP_SIZE_M": 8,
        "num_stages": 8,
        "num_warps": 32,
        "compile_time": 0.005208730697631836
    },
    {
        "BLOCK_SIZE_M": 32,
        "BLOCK_SIZE_N": 256,
        "BLOCK_SIZE_K": 128,
        "GROUP_SIZE_M": 8,
        "num_stages": 3,
        "num_warps": 2,
        "compile_time": 11.093637943267822
    },
    {
        "BLOCK_SIZE_M": 32,
        "BLOCK_SIZE_N": 256,
        "BLOCK_SIZE_K": 128,
        "GROUP_SIZE_M": 8,
        "num_stages": 4,
        "num_warps": 2,
        "compile_time": 11.23503828048706
    },
    {
        "BLOCK_SIZE_M": 32,
        "BLOCK_SIZE_N": 256,
        "BLOCK_SIZE_K": 128,
        "GROUP_SIZE_M": 8,
        "num_stages": 4,
        "num_warps": 4,
        "compile_time": 0.004682064056396484
    },
    {
        "BLOCK_SIZE_M": 32,
        "BLOCK_SIZE_N": 256,
        "BLOCK_SIZE_K": 128,
        "GROUP_SIZE_M": 8,
        "num_stages": 4,
        "num_warps": 8,
        "compile_time": 0.003095865249633789
    },
    {
        "BLOCK_SIZE_M": 32,
        "BLOCK_SIZE_N": 256,
        "BLOCK_SIZE_K": 128,
        "GROUP_SIZE_M": 8,
        "num_stages": 4,
        "num_warps": 16,
        "compile_time": 0.0030031204223632812
    },
    {
        "BLOCK_SIZE_M": 32,
        "BLOCK_SIZE_N": 256,
        "BLOCK_SIZE_K": 128,
        "GROUP_SIZE_M": 8,
        "num_stages": 4,
        "num_warps": 32,
        "compile_time": 0.002959728240966797
    },
    {
        "BLOCK_SIZE_M": 32,
        "BLOCK_SIZE_N": 256,
        "BLOCK_SIZE_K": 128,
        "GROUP_SIZE_M": 8,
        "num_stages": 5,
        "num_warps": 2,
        "compile_time": 10.944446086883545
    },
    {
        "BLOCK_SIZE_M": 32,
        "BLOCK_SIZE_N": 256,
        "BLOCK_SIZE_K": 128,
        "GROUP_SIZE_M": 8,
        "num_stages": 5,
        "num_warps": 4,
        "compile_time": 0.0049800872802734375
    },
    {
        "BLOCK_SIZE_M": 32,
        "BLOCK_SIZE_N": 256,
        "BLOCK_SIZE_K": 128,
        "GROUP_SIZE_M": 8,
        "num_stages": 5,
        "num_warps": 8,
        "compile_time": 0.003109455108642578
    },
    {
        "BLOCK_SIZE_M": 32,
        "BLOCK_SIZE_N": 256,
        "BLOCK_SIZE_K": 128,
        "GROUP_SIZE_M": 8,
        "num_stages": 5,
        "num_warps": 16,
        "compile_time": 0.0030481815338134766
    },
    {
        "BLOCK_SIZE_M": 32,
        "BLOCK_SIZE_N": 256,
        "BLOCK_SIZE_K": 128,
        "GROUP_SIZE_M": 8,
        "num_stages": 5,
        "num_warps": 32,
        "compile_time": 0.0029821395874023438
    },
    {
        "BLOCK_SIZE_M": 32,
        "BLOCK_SIZE_N": 256,
        "BLOCK_SIZE_K": 128,
        "GROUP_SIZE_M": 8,
        "num_stages": 6,
        "num_warps": 2,
        "compile_time": 11.733819484710693
    },
    {
        "BLOCK_SIZE_M": 32,
        "BLOCK_SIZE_N": 256,
        "BLOCK_SIZE_K": 128,
        "GROUP_SIZE_M": 8,
        "num_stages": 6,
        "num_warps": 4,
        "compile_time": 0.004052639007568359
    },
    {
        "BLOCK_SIZE_M": 32,
        "BLOCK_SIZE_N": 256,
        "BLOCK_SIZE_K": 128,
        "GROUP_SIZE_M": 8,
        "num_stages": 6,
        "num_warps": 8,
        "compile_time": 0.003110647201538086
    },
    {
        "BLOCK_SIZE_M": 32,
        "BLOCK_SIZE_N": 256,
        "BLOCK_SIZE_K": 128,
        "GROUP_SIZE_M": 8,
        "num_stages": 6,
        "num_warps": 16,
        "compile_time": 0.003003835678100586
    },
    {
        "BLOCK_SIZE_M": 32,
        "BLOCK_SIZE_N": 256,
        "BLOCK_SIZE_K": 128,
        "GROUP_SIZE_M": 8,
        "num_stages": 6,
        "num_warps": 32,
        "compile_time": 0.003004312515258789
    },
    {
        "BLOCK_SIZE_M": 32,
        "BLOCK_SIZE_N": 256,
        "BLOCK_SIZE_K": 128,
        "GROUP_SIZE_M": 8,
        "num_stages": 7,
        "num_warps": 2,
        "compile_time": 11.364405155181885
    },
    {
        "BLOCK_SIZE_M": 32,
        "BLOCK_SIZE_N": 256,
        "BLOCK_SIZE_K": 128,
        "GROUP_SIZE_M": 8,
        "num_stages": 7,
        "num_warps": 4,
        "compile_time": 0.0045354366302490234
    },
    {
        "BLOCK_SIZE_M": 32,
        "BLOCK_SIZE_N": 256,
        "BLOCK_SIZE_K": 128,
        "GROUP_SIZE_M": 8,
        "num_stages": 7,
        "num_warps": 8,
        "compile_time": 0.0031020641326904297
    },
    {
        "BLOCK_SIZE_M": 32,
        "BLOCK_SIZE_N": 256,
        "BLOCK_SIZE_K": 128,
        "GROUP_SIZE_M": 8,
        "num_stages": 7,
        "num_warps": 16,
        "compile_time": 0.0030775070190429688
    },
    {
        "BLOCK_SIZE_M": 32,
        "BLOCK_SIZE_N": 256,
        "BLOCK_SIZE_K": 128,
        "GROUP_SIZE_M": 8,
        "num_stages": 7,
        "num_warps": 32,
        "compile_time": 0.002985239028930664
    },
    {
        "BLOCK_SIZE_M": 32,
        "BLOCK_SIZE_N": 256,
        "BLOCK_SIZE_K": 128,
        "GROUP_SIZE_M": 8,
        "num_stages": 8,
        "num_warps": 2,
        "compile_time": 11.973527908325195
    },
    {
        "BLOCK_SIZE_M": 32,
        "BLOCK_SIZE_N": 256,
        "BLOCK_SIZE_K": 128,
        "GROUP_SIZE_M": 8,
        "num_stages": 8,
        "num_warps": 4,
        "compile_time": 0.004382610321044922
    },
    {
        "BLOCK_SIZE_M": 32,
        "BLOCK_SIZE_N": 256,
        "BLOCK_SIZE_K": 128,
        "GROUP_SIZE_M": 8,
        "num_stages": 8,
        "num_warps": 8,
        "compile_time": 0.0030701160430908203
    },
    {
        "BLOCK_SIZE_M": 32,
        "BLOCK_SIZE_N": 256,
        "BLOCK_SIZE_K": 128,
        "GROUP_SIZE_M": 8,
        "num_stages": 8,
        "num_warps": 16,
        "compile_time": 0.0030062198638916016
    },
    {
        "BLOCK_SIZE_M": 32,
        "BLOCK_SIZE_N": 256,
        "BLOCK_SIZE_K": 128,
        "GROUP_SIZE_M": 8,
        "num_stages": 8,
        "num_warps": 32,
        "compile_time": 0.0039174556732177734
    },
    {
        "BLOCK_SIZE_M": 32,
        "BLOCK_SIZE_N": 256,
        "BLOCK_SIZE_K": 256,
        "GROUP_SIZE_M": 8,
        "num_stages": 1,
        "num_warps": 2,
        "compile_time": 8.593414545059204
    },
    {
        "BLOCK_SIZE_M": 32,
        "BLOCK_SIZE_N": 256,
        "BLOCK_SIZE_K": 256,
        "GROUP_SIZE_M": 8,
        "num_stages": 2,
        "num_warps": 2,
        "compile_time": 8.705116271972656
    },
    {
        "BLOCK_SIZE_M": 32,
        "BLOCK_SIZE_N": 256,
        "BLOCK_SIZE_K": 256,
        "GROUP_SIZE_M": 8,
        "num_stages": 3,
        "num_warps": 2,
        "compile_time": 6.191636085510254
    },
    {
        "BLOCK_SIZE_M": 32,
        "BLOCK_SIZE_N": 256,
        "BLOCK_SIZE_K": 256,
        "GROUP_SIZE_M": 8,
        "num_stages": 3,
        "num_warps": 4,
        "compile_time": 10.463681697845459
    },
    {
        "BLOCK_SIZE_M": 32,
        "BLOCK_SIZE_N": 256,
        "BLOCK_SIZE_K": 256,
        "GROUP_SIZE_M": 8,
        "num_stages": 3,
        "num_warps": 8,
        "compile_time": 0.004742145538330078
    },
    {
        "BLOCK_SIZE_M": 32,
        "BLOCK_SIZE_N": 256,
        "BLOCK_SIZE_K": 256,
        "GROUP_SIZE_M": 8,
        "num_stages": 3,
        "num_warps": 16,
        "compile_time": 0.0030884742736816406
    },
    {
        "BLOCK_SIZE_M": 32,
        "BLOCK_SIZE_N": 256,
        "BLOCK_SIZE_K": 256,
        "GROUP_SIZE_M": 8,
        "num_stages": 3,
        "num_warps": 32,
        "compile_time": 0.003040313720703125
    },
    {
        "BLOCK_SIZE_M": 32,
        "BLOCK_SIZE_N": 256,
        "BLOCK_SIZE_K": 256,
        "GROUP_SIZE_M": 8,
        "num_stages": 4,
        "num_warps": 2,
        "compile_time": 6.449476480484009
    },
    {
        "BLOCK_SIZE_M": 32,
        "BLOCK_SIZE_N": 256,
        "BLOCK_SIZE_K": 256,
        "GROUP_SIZE_M": 8,
        "num_stages": 4,
        "num_warps": 4,
        "compile_time": 10.840461492538452
    },
    {
        "BLOCK_SIZE_M": 32,
        "BLOCK_SIZE_N": 256,
        "BLOCK_SIZE_K": 256,
        "GROUP_SIZE_M": 8,
        "num_stages": 4,
        "num_warps": 8,
        "compile_time": 0.0042836666107177734
    },
    {
        "BLOCK_SIZE_M": 32,
        "BLOCK_SIZE_N": 256,
        "BLOCK_SIZE_K": 256,
        "GROUP_SIZE_M": 8,
        "num_stages": 4,
        "num_warps": 16,
        "compile_time": 0.0030999183654785156
    },
    {
        "BLOCK_SIZE_M": 32,
        "BLOCK_SIZE_N": 256,
        "BLOCK_SIZE_K": 256,
        "GROUP_SIZE_M": 8,
        "num_stages": 4,
        "num_warps": 32,
        "compile_time": 0.003024578094482422
    },
    {
        "BLOCK_SIZE_M": 32,
        "BLOCK_SIZE_N": 256,
        "BLOCK_SIZE_K": 256,
        "GROUP_SIZE_M": 8,
        "num_stages": 5,
        "num_warps": 2,
        "compile_time": 6.787112236022949
    },
    {
        "BLOCK_SIZE_M": 32,
        "BLOCK_SIZE_N": 256,
        "BLOCK_SIZE_K": 256,
        "GROUP_SIZE_M": 8,
        "num_stages": 5,
        "num_warps": 4,
        "compile_time": 11.253995418548584
    },
    {
        "BLOCK_SIZE_M": 32,
        "BLOCK_SIZE_N": 256,
        "BLOCK_SIZE_K": 256,
        "GROUP_SIZE_M": 8,
        "num_stages": 5,
        "num_warps": 8,
        "compile_time": 0.003984689712524414
    },
    {
        "BLOCK_SIZE_M": 32,
        "BLOCK_SIZE_N": 256,
        "BLOCK_SIZE_K": 256,
        "GROUP_SIZE_M": 8,
        "num_stages": 5,
        "num_warps": 16,
        "compile_time": 0.0030710697174072266
    },
    {
        "BLOCK_SIZE_M": 32,
        "BLOCK_SIZE_N": 256,
        "BLOCK_SIZE_K": 256,
        "GROUP_SIZE_M": 8,
        "num_stages": 5,
        "num_warps": 32,
        "compile_time": 0.0030090808868408203
    },
    {
        "BLOCK_SIZE_M": 32,
        "BLOCK_SIZE_N": 256,
        "BLOCK_SIZE_K": 256,
        "GROUP_SIZE_M": 8,
        "num_stages": 6,
        "num_warps": 2,
        "compile_time": 7.1974756717681885
    },
    {
        "BLOCK_SIZE_M": 32,
        "BLOCK_SIZE_N": 256,
        "BLOCK_SIZE_K": 256,
        "GROUP_SIZE_M": 8,
        "num_stages": 6,
        "num_warps": 4,
        "compile_time": 11.46466875076294
    },
    {
        "BLOCK_SIZE_M": 32,
        "BLOCK_SIZE_N": 256,
        "BLOCK_SIZE_K": 256,
        "GROUP_SIZE_M": 8,
        "num_stages": 6,
        "num_warps": 8,
        "compile_time": 0.006166219711303711
    },
    {
        "BLOCK_SIZE_M": 32,
        "BLOCK_SIZE_N": 256,
        "BLOCK_SIZE_K": 256,
        "GROUP_SIZE_M": 8,
        "num_stages": 6,
        "num_warps": 16,
        "compile_time": 0.0032341480255126953
    },
    {
        "BLOCK_SIZE_M": 32,
        "BLOCK_SIZE_N": 256,
        "BLOCK_SIZE_K": 256,
        "GROUP_SIZE_M": 8,
        "num_stages": 6,
        "num_warps": 32,
        "compile_time": 0.0030417442321777344
    },
    {
        "BLOCK_SIZE_M": 32,
        "BLOCK_SIZE_N": 256,
        "BLOCK_SIZE_K": 256,
        "GROUP_SIZE_M": 8,
        "num_stages": 7,
        "num_warps": 2,
        "compile_time": 7.504318714141846
    },
    {
        "BLOCK_SIZE_M": 32,
        "BLOCK_SIZE_N": 256,
        "BLOCK_SIZE_K": 256,
        "GROUP_SIZE_M": 8,
        "num_stages": 7,
        "num_warps": 4,
        "compile_time": 11.572642087936401
    },
    {
        "BLOCK_SIZE_M": 32,
        "BLOCK_SIZE_N": 256,
        "BLOCK_SIZE_K": 256,
        "GROUP_SIZE_M": 8,
        "num_stages": 7,
        "num_warps": 8,
        "compile_time": 0.0038661956787109375
    },
    {
        "BLOCK_SIZE_M": 32,
        "BLOCK_SIZE_N": 256,
        "BLOCK_SIZE_K": 256,
        "GROUP_SIZE_M": 8,
        "num_stages": 7,
        "num_warps": 16,
        "compile_time": 0.003385782241821289
    },
    {
        "BLOCK_SIZE_M": 32,
        "BLOCK_SIZE_N": 256,
        "BLOCK_SIZE_K": 256,
        "GROUP_SIZE_M": 8,
        "num_stages": 7,
        "num_warps": 32,
        "compile_time": 0.0030579566955566406
    },
    {
        "BLOCK_SIZE_M": 32,
        "BLOCK_SIZE_N": 256,
        "BLOCK_SIZE_K": 256,
        "GROUP_SIZE_M": 8,
        "num_stages": 8,
        "num_warps": 2,
        "compile_time": 7.936052083969116
    },
    {
        "BLOCK_SIZE_M": 32,
        "BLOCK_SIZE_N": 256,
        "BLOCK_SIZE_K": 256,
        "GROUP_SIZE_M": 8,
        "num_stages": 8,
        "num_warps": 4,
        "compile_time": 11.824301958084106
    },
    {
        "BLOCK_SIZE_M": 32,
        "BLOCK_SIZE_N": 256,
        "BLOCK_SIZE_K": 256,
        "GROUP_SIZE_M": 8,
        "num_stages": 8,
        "num_warps": 8,
        "compile_time": 0.004225730895996094
    },
    {
        "BLOCK_SIZE_M": 32,
        "BLOCK_SIZE_N": 256,
        "BLOCK_SIZE_K": 256,
        "GROUP_SIZE_M": 8,
        "num_stages": 8,
        "num_warps": 16,
        "compile_time": 0.003640413284301758
    },
    {
        "BLOCK_SIZE_M": 32,
        "BLOCK_SIZE_N": 256,
        "BLOCK_SIZE_K": 256,
        "GROUP_SIZE_M": 8,
        "num_stages": 8,
        "num_warps": 32,
        "compile_time": 0.003062009811401367
    },
    {
        "BLOCK_SIZE_M": 32,
        "BLOCK_SIZE_N": 256,
        "BLOCK_SIZE_K": 512,
        "GROUP_SIZE_M": 8,
        "num_stages": 1,
        "num_warps": 2,
        "compile_time": 19.161560773849487
    },
    {
        "BLOCK_SIZE_M": 32,
        "BLOCK_SIZE_N": 256,
        "BLOCK_SIZE_K": 512,
        "GROUP_SIZE_M": 8,
        "num_stages": 1,
        "num_warps": 4,
        "compile_time": 8.54778528213501
    },
    {
        "BLOCK_SIZE_M": 32,
        "BLOCK_SIZE_N": 256,
        "BLOCK_SIZE_K": 512,
        "GROUP_SIZE_M": 8,
        "num_stages": 1,
        "num_warps": 8,
        "compile_time": 0.004117250442504883
    },
    {
        "BLOCK_SIZE_M": 32,
        "BLOCK_SIZE_N": 256,
        "BLOCK_SIZE_K": 512,
        "GROUP_SIZE_M": 8,
        "num_stages": 1,
        "num_warps": 16,
        "compile_time": 0.0031423568725585938
    },
    {
        "BLOCK_SIZE_M": 32,
        "BLOCK_SIZE_N": 256,
        "BLOCK_SIZE_K": 512,
        "GROUP_SIZE_M": 8,
        "num_stages": 1,
        "num_warps": 32,
        "compile_time": 0.003918647766113281
    },
    {
        "BLOCK_SIZE_M": 32,
        "BLOCK_SIZE_N": 256,
        "BLOCK_SIZE_K": 512,
        "GROUP_SIZE_M": 8,
        "num_stages": 2,
        "num_warps": 2,
        "compile_time": 19.51524329185486
    },
    {
        "BLOCK_SIZE_M": 32,
        "BLOCK_SIZE_N": 256,
        "BLOCK_SIZE_K": 512,
        "GROUP_SIZE_M": 8,
        "num_stages": 2,
        "num_warps": 4,
        "compile_time": 8.567099571228027
    },
    {
        "BLOCK_SIZE_M": 32,
        "BLOCK_SIZE_N": 256,
        "BLOCK_SIZE_K": 512,
        "GROUP_SIZE_M": 8,
        "num_stages": 2,
        "num_warps": 8,
        "compile_time": 0.004698038101196289
    },
    {
        "BLOCK_SIZE_M": 32,
        "BLOCK_SIZE_N": 256,
        "BLOCK_SIZE_K": 512,
        "GROUP_SIZE_M": 8,
        "num_stages": 2,
        "num_warps": 16,
        "compile_time": 0.0029649734497070312
    },
    {
        "BLOCK_SIZE_M": 32,
        "BLOCK_SIZE_N": 256,
        "BLOCK_SIZE_K": 512,
        "GROUP_SIZE_M": 8,
        "num_stages": 2,
        "num_warps": 32,
        "compile_time": 0.0028502941131591797
    },
    {
        "BLOCK_SIZE_M": 32,
        "BLOCK_SIZE_N": 256,
        "BLOCK_SIZE_K": 512,
        "GROUP_SIZE_M": 8,
        "num_stages": 3,
        "num_warps": 2,
        "compile_time": 20.35409164428711
    },
    {
        "BLOCK_SIZE_M": 32,
        "BLOCK_SIZE_N": 256,
        "BLOCK_SIZE_K": 512,
        "GROUP_SIZE_M": 8,
        "num_stages": 3,
        "num_warps": 4,
        "compile_time": 6.042418956756592
    },
    {
        "BLOCK_SIZE_M": 32,
        "BLOCK_SIZE_N": 256,
        "BLOCK_SIZE_K": 512,
        "GROUP_SIZE_M": 8,
        "num_stages": 3,
        "num_warps": 8,
        "compile_time": 10.75105333328247
    },
    {
        "BLOCK_SIZE_M": 32,
        "BLOCK_SIZE_N": 256,
        "BLOCK_SIZE_K": 512,
        "GROUP_SIZE_M": 8,
        "num_stages": 3,
        "num_warps": 16,
        "compile_time": 0.006430387496948242
    },
    {
        "BLOCK_SIZE_M": 32,
        "BLOCK_SIZE_N": 256,
        "BLOCK_SIZE_K": 512,
        "GROUP_SIZE_M": 8,
        "num_stages": 3,
        "num_warps": 32,
        "compile_time": 0.0028488636016845703
    },
    {
        "BLOCK_SIZE_M": 32,
        "BLOCK_SIZE_N": 256,
        "BLOCK_SIZE_K": 512,
        "GROUP_SIZE_M": 8,
        "num_stages": 4,
        "num_warps": 2,
        "compile_time": 21.193048000335693
    },
    {
        "BLOCK_SIZE_M": 32,
        "BLOCK_SIZE_N": 256,
        "BLOCK_SIZE_K": 512,
        "GROUP_SIZE_M": 8,
        "num_stages": 4,
        "num_warps": 4,
        "compile_time": 6.511896371841431
    },
    {
        "BLOCK_SIZE_M": 32,
        "BLOCK_SIZE_N": 256,
        "BLOCK_SIZE_K": 512,
        "GROUP_SIZE_M": 8,
        "num_stages": 4,
        "num_warps": 8,
        "compile_time": 10.855984210968018
    },
    {
        "BLOCK_SIZE_M": 32,
        "BLOCK_SIZE_N": 256,
        "BLOCK_SIZE_K": 512,
        "GROUP_SIZE_M": 8,
        "num_stages": 4,
        "num_warps": 16,
        "compile_time": 0.004166364669799805
    },
    {
        "BLOCK_SIZE_M": 32,
        "BLOCK_SIZE_N": 256,
        "BLOCK_SIZE_K": 512,
        "GROUP_SIZE_M": 8,
        "num_stages": 4,
        "num_warps": 32,
        "compile_time": 0.0029151439666748047
    },
    {
        "BLOCK_SIZE_M": 32,
        "BLOCK_SIZE_N": 256,
        "BLOCK_SIZE_K": 512,
        "GROUP_SIZE_M": 8,
        "num_stages": 5,
        "num_warps": 2,
        "compile_time": 22.049865245819092
    },
    {
        "BLOCK_SIZE_M": 32,
        "BLOCK_SIZE_N": 256,
        "BLOCK_SIZE_K": 512,
        "GROUP_SIZE_M": 8,
        "num_stages": 5,
        "num_warps": 4,
        "compile_time": 6.891348361968994
    },
    {
        "BLOCK_SIZE_M": 32,
        "BLOCK_SIZE_N": 256,
        "BLOCK_SIZE_K": 512,
        "GROUP_SIZE_M": 8,
        "num_stages": 5,
        "num_warps": 8,
        "compile_time": 11.968922138214111
    },
    {
        "BLOCK_SIZE_M": 32,
        "BLOCK_SIZE_N": 256,
        "BLOCK_SIZE_K": 512,
        "GROUP_SIZE_M": 8,
        "num_stages": 5,
        "num_warps": 16,
        "compile_time": 0.0036821365356445312
    },
    {
        "BLOCK_SIZE_M": 32,
        "BLOCK_SIZE_N": 256,
        "BLOCK_SIZE_K": 512,
        "GROUP_SIZE_M": 8,
        "num_stages": 5,
        "num_warps": 32,
        "compile_time": 0.0029659271240234375
    },
    {
        "BLOCK_SIZE_M": 32,
        "BLOCK_SIZE_N": 256,
        "BLOCK_SIZE_K": 512,
        "GROUP_SIZE_M": 8,
        "num_stages": 6,
        "num_warps": 2,
        "compile_time": 23.03197741508484
    },
    {
        "BLOCK_SIZE_M": 32,
        "BLOCK_SIZE_N": 256,
        "BLOCK_SIZE_K": 512,
        "GROUP_SIZE_M": 8,
        "num_stages": 6,
        "num_warps": 4,
        "compile_time": 7.31032133102417
    },
    {
        "BLOCK_SIZE_M": 32,
        "BLOCK_SIZE_N": 256,
        "BLOCK_SIZE_K": 512,
        "GROUP_SIZE_M": 8,
        "num_stages": 6,
        "num_warps": 8,
        "compile_time": 11.557044267654419
    },
    {
        "BLOCK_SIZE_M": 32,
        "BLOCK_SIZE_N": 256,
        "BLOCK_SIZE_K": 512,
        "GROUP_SIZE_M": 8,
        "num_stages": 6,
        "num_warps": 16,
        "compile_time": 0.0036661624908447266
    },
    {
        "BLOCK_SIZE_M": 32,
        "BLOCK_SIZE_N": 256,
        "BLOCK_SIZE_K": 512,
        "GROUP_SIZE_M": 8,
        "num_stages": 6,
        "num_warps": 32,
        "compile_time": 0.002584218978881836
    },
    {
        "BLOCK_SIZE_M": 32,
        "BLOCK_SIZE_N": 256,
        "BLOCK_SIZE_K": 512,
        "GROUP_SIZE_M": 8,
        "num_stages": 7,
        "num_warps": 2,
        "compile_time": 6.274866580963135
    },
    {
        "BLOCK_SIZE_M": 32,
        "BLOCK_SIZE_N": 256,
        "BLOCK_SIZE_K": 512,
        "GROUP_SIZE_M": 8,
        "num_stages": 7,
        "num_warps": 4,
        "compile_time": 7.752278089523315
    },
    {
        "BLOCK_SIZE_M": 32,
        "BLOCK_SIZE_N": 256,
        "BLOCK_SIZE_K": 512,
        "GROUP_SIZE_M": 8,
        "num_stages": 7,
        "num_warps": 8,
        "compile_time": 11.601030588150024
    },
    {
        "BLOCK_SIZE_M": 32,
        "BLOCK_SIZE_N": 256,
        "BLOCK_SIZE_K": 512,
        "GROUP_SIZE_M": 8,
        "num_stages": 7,
        "num_warps": 16,
        "compile_time": 0.004251718521118164
    },
    {
        "BLOCK_SIZE_M": 32,
        "BLOCK_SIZE_N": 256,
        "BLOCK_SIZE_K": 512,
        "GROUP_SIZE_M": 8,
        "num_stages": 7,
        "num_warps": 32,
        "compile_time": 0.0029058456420898438
    },
    {
        "BLOCK_SIZE_M": 32,
        "BLOCK_SIZE_N": 256,
        "BLOCK_SIZE_K": 512,
        "GROUP_SIZE_M": 8,
        "num_stages": 8,
        "num_warps": 2,
        "compile_time": 6.9901463985443115
    },
    {
        "BLOCK_SIZE_M": 32,
        "BLOCK_SIZE_N": 256,
        "BLOCK_SIZE_K": 512,
        "GROUP_SIZE_M": 8,
        "num_stages": 8,
        "num_warps": 4,
        "compile_time": 8.178765535354614
    },
    {
        "BLOCK_SIZE_M": 32,
        "BLOCK_SIZE_N": 256,
        "BLOCK_SIZE_K": 512,
        "GROUP_SIZE_M": 8,
        "num_stages": 8,
        "num_warps": 8,
        "compile_time": 11.980751991271973
    },
    {
        "BLOCK_SIZE_M": 32,
        "BLOCK_SIZE_N": 256,
        "BLOCK_SIZE_K": 512,
        "GROUP_SIZE_M": 8,
        "num_stages": 8,
        "num_warps": 16,
        "compile_time": 0.003726482391357422
    },
    {
        "BLOCK_SIZE_M": 32,
        "BLOCK_SIZE_N": 256,
        "BLOCK_SIZE_K": 512,
        "GROUP_SIZE_M": 8,
        "num_stages": 8,
        "num_warps": 32,
        "compile_time": 0.002895355224609375
    },
    {
        "BLOCK_SIZE_M": 32,
        "BLOCK_SIZE_N": 512,
        "BLOCK_SIZE_K": 32,
        "GROUP_SIZE_M": 8,
        "num_stages": 6,
        "num_warps": 2,
        "compile_time": 0.005928516387939453
    },
    {
        "BLOCK_SIZE_M": 32,
        "BLOCK_SIZE_N": 512,
        "BLOCK_SIZE_K": 32,
        "GROUP_SIZE_M": 8,
        "num_stages": 6,
        "num_warps": 4,
        "compile_time": 0.004400730133056641
    },
    {
        "BLOCK_SIZE_M": 32,
        "BLOCK_SIZE_N": 512,
        "BLOCK_SIZE_K": 32,
        "GROUP_SIZE_M": 8,
        "num_stages": 6,
        "num_warps": 8,
        "compile_time": 0.0033791065216064453
    },
    {
        "BLOCK_SIZE_M": 32,
        "BLOCK_SIZE_N": 512,
        "BLOCK_SIZE_K": 32,
        "GROUP_SIZE_M": 8,
        "num_stages": 6,
        "num_warps": 16,
        "compile_time": 0.002615213394165039
    },
    {
        "BLOCK_SIZE_M": 32,
        "BLOCK_SIZE_N": 512,
        "BLOCK_SIZE_K": 32,
        "GROUP_SIZE_M": 8,
        "num_stages": 7,
        "num_warps": 2,
        "compile_time": 0.0036783218383789062
    },
    {
        "BLOCK_SIZE_M": 32,
        "BLOCK_SIZE_N": 512,
        "BLOCK_SIZE_K": 32,
        "GROUP_SIZE_M": 8,
        "num_stages": 7,
        "num_warps": 4,
        "compile_time": 0.002771139144897461
    },
    {
        "BLOCK_SIZE_M": 32,
        "BLOCK_SIZE_N": 512,
        "BLOCK_SIZE_K": 32,
        "GROUP_SIZE_M": 8,
        "num_stages": 7,
        "num_warps": 8,
        "compile_time": 0.002655029296875
    },
    {
        "BLOCK_SIZE_M": 32,
        "BLOCK_SIZE_N": 512,
        "BLOCK_SIZE_K": 32,
        "GROUP_SIZE_M": 8,
        "num_stages": 7,
        "num_warps": 16,
        "compile_time": 0.0026140213012695312
    },
    {
        "BLOCK_SIZE_M": 32,
        "BLOCK_SIZE_N": 512,
        "BLOCK_SIZE_K": 32,
        "GROUP_SIZE_M": 8,
        "num_stages": 7,
        "num_warps": 32,
        "compile_time": 0.002620220184326172
    },
    {
        "BLOCK_SIZE_M": 32,
        "BLOCK_SIZE_N": 512,
        "BLOCK_SIZE_K": 32,
        "GROUP_SIZE_M": 8,
        "num_stages": 8,
        "num_warps": 2,
        "compile_time": 0.002930879592895508
    },
    {
        "BLOCK_SIZE_M": 32,
        "BLOCK_SIZE_N": 512,
        "BLOCK_SIZE_K": 32,
        "GROUP_SIZE_M": 8,
        "num_stages": 8,
        "num_warps": 4,
        "compile_time": 0.0028676986694335938
    },
    {
        "BLOCK_SIZE_M": 32,
        "BLOCK_SIZE_N": 512,
        "BLOCK_SIZE_K": 32,
        "GROUP_SIZE_M": 8,
        "num_stages": 8,
        "num_warps": 8,
        "compile_time": 0.0027027130126953125
    },
    {
        "BLOCK_SIZE_M": 32,
        "BLOCK_SIZE_N": 512,
        "BLOCK_SIZE_K": 32,
        "GROUP_SIZE_M": 8,
        "num_stages": 8,
        "num_warps": 16,
        "compile_time": 0.002607107162475586
    },
    {
        "BLOCK_SIZE_M": 32,
        "BLOCK_SIZE_N": 512,
        "BLOCK_SIZE_K": 32,
        "GROUP_SIZE_M": 8,
        "num_stages": 8,
        "num_warps": 32,
        "compile_time": 0.002576589584350586
    },
    {
        "BLOCK_SIZE_M": 32,
        "BLOCK_SIZE_N": 512,
        "BLOCK_SIZE_K": 64,
        "GROUP_SIZE_M": 8,
        "num_stages": 3,
        "num_warps": 2,
        "compile_time": 12.34817910194397
    },
    {
        "BLOCK_SIZE_M": 32,
        "BLOCK_SIZE_N": 512,
        "BLOCK_SIZE_K": 64,
        "GROUP_SIZE_M": 8,
        "num_stages": 4,
        "num_warps": 2,
        "compile_time": 12.46927547454834
    },
    {
        "BLOCK_SIZE_M": 32,
        "BLOCK_SIZE_N": 512,
        "BLOCK_SIZE_K": 64,
        "GROUP_SIZE_M": 8,
        "num_stages": 4,
        "num_warps": 4,
        "compile_time": 0.004284381866455078
    },
    {
        "BLOCK_SIZE_M": 32,
        "BLOCK_SIZE_N": 512,
        "BLOCK_SIZE_K": 64,
        "GROUP_SIZE_M": 8,
        "num_stages": 4,
        "num_warps": 8,
        "compile_time": 0.0031099319458007812
    },
    {
        "BLOCK_SIZE_M": 32,
        "BLOCK_SIZE_N": 512,
        "BLOCK_SIZE_K": 64,
        "GROUP_SIZE_M": 8,
        "num_stages": 4,
        "num_warps": 16,
        "compile_time": 0.003021717071533203
    },
    {
        "BLOCK_SIZE_M": 32,
        "BLOCK_SIZE_N": 512,
        "BLOCK_SIZE_K": 64,
        "GROUP_SIZE_M": 8,
        "num_stages": 4,
        "num_warps": 32,
        "compile_time": 0.0029611587524414062
    },
    {
        "BLOCK_SIZE_M": 32,
        "BLOCK_SIZE_N": 512,
        "BLOCK_SIZE_K": 64,
        "GROUP_SIZE_M": 8,
        "num_stages": 5,
        "num_warps": 2,
        "compile_time": 12.69086503982544
    },
    {
        "BLOCK_SIZE_M": 32,
        "BLOCK_SIZE_N": 512,
        "BLOCK_SIZE_K": 64,
        "GROUP_SIZE_M": 8,
        "num_stages": 5,
        "num_warps": 4,
        "compile_time": 0.004044771194458008
    },
    {
        "BLOCK_SIZE_M": 32,
        "BLOCK_SIZE_N": 512,
        "BLOCK_SIZE_K": 64,
        "GROUP_SIZE_M": 8,
        "num_stages": 5,
        "num_warps": 8,
        "compile_time": 0.0030946731567382812
    },
    {
        "BLOCK_SIZE_M": 32,
        "BLOCK_SIZE_N": 512,
        "BLOCK_SIZE_K": 64,
        "GROUP_SIZE_M": 8,
        "num_stages": 5,
        "num_warps": 16,
        "compile_time": 0.004073381423950195
    },
    {
        "BLOCK_SIZE_M": 32,
        "BLOCK_SIZE_N": 512,
        "BLOCK_SIZE_K": 64,
        "GROUP_SIZE_M": 8,
        "num_stages": 5,
        "num_warps": 32,
        "compile_time": 0.0030052661895751953
    },
    {
        "BLOCK_SIZE_M": 32,
        "BLOCK_SIZE_N": 512,
        "BLOCK_SIZE_K": 64,
        "GROUP_SIZE_M": 8,
        "num_stages": 6,
        "num_warps": 2,
        "compile_time": 13.008537292480469
    },
    {
        "BLOCK_SIZE_M": 32,
        "BLOCK_SIZE_N": 512,
        "BLOCK_SIZE_K": 64,
        "GROUP_SIZE_M": 8,
        "num_stages": 6,
        "num_warps": 4,
        "compile_time": 0.005184650421142578
    },
    {
        "BLOCK_SIZE_M": 32,
        "BLOCK_SIZE_N": 512,
        "BLOCK_SIZE_K": 64,
        "GROUP_SIZE_M": 8,
        "num_stages": 6,
        "num_warps": 8,
        "compile_time": 0.003154277801513672
    },
    {
        "BLOCK_SIZE_M": 32,
        "BLOCK_SIZE_N": 512,
        "BLOCK_SIZE_K": 64,
        "GROUP_SIZE_M": 8,
        "num_stages": 6,
        "num_warps": 16,
        "compile_time": 0.0030603408813476562
    },
    {
        "BLOCK_SIZE_M": 32,
        "BLOCK_SIZE_N": 512,
        "BLOCK_SIZE_K": 64,
        "GROUP_SIZE_M": 8,
        "num_stages": 6,
        "num_warps": 32,
        "compile_time": 0.003025054931640625
    },
    {
        "BLOCK_SIZE_M": 32,
        "BLOCK_SIZE_N": 512,
        "BLOCK_SIZE_K": 64,
        "GROUP_SIZE_M": 8,
        "num_stages": 7,
        "num_warps": 2,
        "compile_time": 13.187567234039307
    },
    {
        "BLOCK_SIZE_M": 32,
        "BLOCK_SIZE_N": 512,
        "BLOCK_SIZE_K": 64,
        "GROUP_SIZE_M": 8,
        "num_stages": 7,
        "num_warps": 4,
        "compile_time": 0.004573822021484375
    },
    {
        "BLOCK_SIZE_M": 32,
        "BLOCK_SIZE_N": 512,
        "BLOCK_SIZE_K": 64,
        "GROUP_SIZE_M": 8,
        "num_stages": 7,
        "num_warps": 8,
        "compile_time": 0.002916097640991211
    },
    {
        "BLOCK_SIZE_M": 32,
        "BLOCK_SIZE_N": 512,
        "BLOCK_SIZE_K": 64,
        "GROUP_SIZE_M": 8,
        "num_stages": 7,
        "num_warps": 16,
        "compile_time": 0.0030400753021240234
    },
    {
        "BLOCK_SIZE_M": 32,
        "BLOCK_SIZE_N": 512,
        "BLOCK_SIZE_K": 64,
        "GROUP_SIZE_M": 8,
        "num_stages": 7,
        "num_warps": 32,
        "compile_time": 0.0029764175415039062
    },
    {
        "BLOCK_SIZE_M": 32,
        "BLOCK_SIZE_N": 512,
        "BLOCK_SIZE_K": 64,
        "GROUP_SIZE_M": 8,
        "num_stages": 8,
        "num_warps": 2,
        "compile_time": 13.307823419570923
    },
    {
        "BLOCK_SIZE_M": 32,
        "BLOCK_SIZE_N": 512,
        "BLOCK_SIZE_K": 64,
        "GROUP_SIZE_M": 8,
        "num_stages": 8,
        "num_warps": 4,
        "compile_time": 0.004354000091552734
    },
    {
        "BLOCK_SIZE_M": 32,
        "BLOCK_SIZE_N": 512,
        "BLOCK_SIZE_K": 64,
        "GROUP_SIZE_M": 8,
        "num_stages": 8,
        "num_warps": 8,
        "compile_time": 0.0031464099884033203
    },
    {
        "BLOCK_SIZE_M": 32,
        "BLOCK_SIZE_N": 512,
        "BLOCK_SIZE_K": 64,
        "GROUP_SIZE_M": 8,
        "num_stages": 8,
        "num_warps": 16,
        "compile_time": 0.0030205249786376953
    },
    {
        "BLOCK_SIZE_M": 32,
        "BLOCK_SIZE_N": 512,
        "BLOCK_SIZE_K": 64,
        "GROUP_SIZE_M": 8,
        "num_stages": 8,
        "num_warps": 32,
        "compile_time": 0.003698587417602539
    },
    {
        "BLOCK_SIZE_M": 32,
        "BLOCK_SIZE_N": 512,
        "BLOCK_SIZE_K": 128,
        "GROUP_SIZE_M": 8,
        "num_stages": 1,
        "num_warps": 2,
        "compile_time": 9.907087802886963
    },
    {
        "BLOCK_SIZE_M": 32,
        "BLOCK_SIZE_N": 512,
        "BLOCK_SIZE_K": 128,
        "GROUP_SIZE_M": 8,
        "num_stages": 2,
        "num_warps": 2,
        "compile_time": 6.046083927154541
    },
    {
        "BLOCK_SIZE_M": 32,
        "BLOCK_SIZE_N": 512,
        "BLOCK_SIZE_K": 128,
        "GROUP_SIZE_M": 8,
        "num_stages": 3,
        "num_warps": 2,
        "compile_time": 6.342693090438843
    },
    {
        "BLOCK_SIZE_M": 32,
        "BLOCK_SIZE_N": 512,
        "BLOCK_SIZE_K": 128,
        "GROUP_SIZE_M": 8,
        "num_stages": 3,
        "num_warps": 4,
        "compile_time": 10.900413751602173
    },
    {
        "BLOCK_SIZE_M": 32,
        "BLOCK_SIZE_N": 512,
        "BLOCK_SIZE_K": 128,
        "GROUP_SIZE_M": 8,
        "num_stages": 3,
        "num_warps": 8,
        "compile_time": 0.004500389099121094
    },
    {
        "BLOCK_SIZE_M": 32,
        "BLOCK_SIZE_N": 512,
        "BLOCK_SIZE_K": 128,
        "GROUP_SIZE_M": 8,
        "num_stages": 3,
        "num_warps": 16,
        "compile_time": 0.0030570030212402344
    },
    {
        "BLOCK_SIZE_M": 32,
        "BLOCK_SIZE_N": 512,
        "BLOCK_SIZE_K": 128,
        "GROUP_SIZE_M": 8,
        "num_stages": 3,
        "num_warps": 32,
        "compile_time": 0.003034353256225586
    },
    {
        "BLOCK_SIZE_M": 32,
        "BLOCK_SIZE_N": 512,
        "BLOCK_SIZE_K": 128,
        "GROUP_SIZE_M": 8,
        "num_stages": 4,
        "num_warps": 2,
        "compile_time": 6.68477988243103
    },
    {
        "BLOCK_SIZE_M": 32,
        "BLOCK_SIZE_N": 512,
        "BLOCK_SIZE_K": 128,
        "GROUP_SIZE_M": 8,
        "num_stages": 4,
        "num_warps": 4,
        "compile_time": 11.11994218826294
    },
    {
        "BLOCK_SIZE_M": 32,
        "BLOCK_SIZE_N": 512,
        "BLOCK_SIZE_K": 128,
        "GROUP_SIZE_M": 8,
        "num_stages": 4,
        "num_warps": 8,
        "compile_time": 0.004294633865356445
    },
    {
        "BLOCK_SIZE_M": 32,
        "BLOCK_SIZE_N": 512,
        "BLOCK_SIZE_K": 128,
        "GROUP_SIZE_M": 8,
        "num_stages": 4,
        "num_warps": 16,
        "compile_time": 0.0031294822692871094
    },
    {
        "BLOCK_SIZE_M": 32,
        "BLOCK_SIZE_N": 512,
        "BLOCK_SIZE_K": 128,
        "GROUP_SIZE_M": 8,
        "num_stages": 4,
        "num_warps": 32,
        "compile_time": 0.003043651580810547
    },
    {
        "BLOCK_SIZE_M": 32,
        "BLOCK_SIZE_N": 512,
        "BLOCK_SIZE_K": 128,
        "GROUP_SIZE_M": 8,
        "num_stages": 5,
        "num_warps": 2,
        "compile_time": 7.035932540893555
    },
    {
        "BLOCK_SIZE_M": 32,
        "BLOCK_SIZE_N": 512,
        "BLOCK_SIZE_K": 128,
        "GROUP_SIZE_M": 8,
        "num_stages": 5,
        "num_warps": 4,
        "compile_time": 11.296504020690918
    },
    {
        "BLOCK_SIZE_M": 32,
        "BLOCK_SIZE_N": 512,
        "BLOCK_SIZE_K": 128,
        "GROUP_SIZE_M": 8,
        "num_stages": 5,
        "num_warps": 8,
        "compile_time": 0.004099845886230469
    },
    {
        "BLOCK_SIZE_M": 32,
        "BLOCK_SIZE_N": 512,
        "BLOCK_SIZE_K": 128,
        "GROUP_SIZE_M": 8,
        "num_stages": 5,
        "num_warps": 16,
        "compile_time": 0.003143787384033203
    },
    {
        "BLOCK_SIZE_M": 32,
        "BLOCK_SIZE_N": 512,
        "BLOCK_SIZE_K": 128,
        "GROUP_SIZE_M": 8,
        "num_stages": 5,
        "num_warps": 32,
        "compile_time": 0.002842426300048828
    },
    {
        "BLOCK_SIZE_M": 32,
        "BLOCK_SIZE_N": 512,
        "BLOCK_SIZE_K": 128,
        "GROUP_SIZE_M": 8,
        "num_stages": 6,
        "num_warps": 2,
        "compile_time": 7.353104591369629
    },
    {
        "BLOCK_SIZE_M": 32,
        "BLOCK_SIZE_N": 512,
        "BLOCK_SIZE_K": 128,
        "GROUP_SIZE_M": 8,
        "num_stages": 6,
        "num_warps": 4,
        "compile_time": 11.59351110458374
    },
    {
        "BLOCK_SIZE_M": 32,
        "BLOCK_SIZE_N": 512,
        "BLOCK_SIZE_K": 128,
        "GROUP_SIZE_M": 8,
        "num_stages": 6,
        "num_warps": 8,
        "compile_time": 0.0045244693756103516
    },
    {
        "BLOCK_SIZE_M": 32,
        "BLOCK_SIZE_N": 512,
        "BLOCK_SIZE_K": 128,
        "GROUP_SIZE_M": 8,
        "num_stages": 6,
        "num_warps": 16,
        "compile_time": 0.0031137466430664062
    },
    {
        "BLOCK_SIZE_M": 32,
        "BLOCK_SIZE_N": 512,
        "BLOCK_SIZE_K": 128,
        "GROUP_SIZE_M": 8,
        "num_stages": 6,
        "num_warps": 32,
        "compile_time": 0.0030679702758789062
    },
    {
        "BLOCK_SIZE_M": 32,
        "BLOCK_SIZE_N": 512,
        "BLOCK_SIZE_K": 128,
        "GROUP_SIZE_M": 8,
        "num_stages": 7,
        "num_warps": 2,
        "compile_time": 7.604206323623657
    },
    {
        "BLOCK_SIZE_M": 32,
        "BLOCK_SIZE_N": 512,
        "BLOCK_SIZE_K": 128,
        "GROUP_SIZE_M": 8,
        "num_stages": 7,
        "num_warps": 4,
        "compile_time": 11.85766863822937
    },
    {
        "BLOCK_SIZE_M": 32,
        "BLOCK_SIZE_N": 512,
        "BLOCK_SIZE_K": 128,
        "GROUP_SIZE_M": 8,
        "num_stages": 7,
        "num_warps": 8,
        "compile_time": 0.004067897796630859
    },
    {
        "BLOCK_SIZE_M": 32,
        "BLOCK_SIZE_N": 512,
        "BLOCK_SIZE_K": 128,
        "GROUP_SIZE_M": 8,
        "num_stages": 7,
        "num_warps": 16,
        "compile_time": 0.0036077499389648438
    },
    {
        "BLOCK_SIZE_M": 32,
        "BLOCK_SIZE_N": 512,
        "BLOCK_SIZE_K": 128,
        "GROUP_SIZE_M": 8,
        "num_stages": 7,
        "num_warps": 32,
        "compile_time": 0.0030443668365478516
    },
    {
        "BLOCK_SIZE_M": 32,
        "BLOCK_SIZE_N": 512,
        "BLOCK_SIZE_K": 128,
        "GROUP_SIZE_M": 8,
        "num_stages": 8,
        "num_warps": 2,
        "compile_time": 8.009382009506226
    },
    {
        "BLOCK_SIZE_M": 32,
        "BLOCK_SIZE_N": 512,
        "BLOCK_SIZE_K": 128,
        "GROUP_SIZE_M": 8,
        "num_stages": 8,
        "num_warps": 4,
        "compile_time": 11.980571985244751
    },
    {
        "BLOCK_SIZE_M": 32,
        "BLOCK_SIZE_N": 512,
        "BLOCK_SIZE_K": 128,
        "GROUP_SIZE_M": 8,
        "num_stages": 8,
        "num_warps": 8,
        "compile_time": 0.0041522979736328125
    },
    {
        "BLOCK_SIZE_M": 32,
        "BLOCK_SIZE_N": 512,
        "BLOCK_SIZE_K": 128,
        "GROUP_SIZE_M": 8,
        "num_stages": 8,
        "num_warps": 16,
        "compile_time": 0.0031671524047851562
    },
    {
        "BLOCK_SIZE_M": 32,
        "BLOCK_SIZE_N": 512,
        "BLOCK_SIZE_K": 128,
        "GROUP_SIZE_M": 8,
        "num_stages": 8,
        "num_warps": 32,
        "compile_time": 0.0030570030212402344
    },
    {
        "BLOCK_SIZE_M": 32,
        "BLOCK_SIZE_N": 512,
        "BLOCK_SIZE_K": 256,
        "GROUP_SIZE_M": 8,
        "num_stages": 1,
        "num_warps": 2,
        "compile_time": 19.427821397781372
    },
    {
        "BLOCK_SIZE_M": 32,
        "BLOCK_SIZE_N": 512,
        "BLOCK_SIZE_K": 256,
        "GROUP_SIZE_M": 8,
        "num_stages": 1,
        "num_warps": 4,
        "compile_time": 8.610660791397095
    },
    {
        "BLOCK_SIZE_M": 32,
        "BLOCK_SIZE_N": 512,
        "BLOCK_SIZE_K": 256,
        "GROUP_SIZE_M": 8,
        "num_stages": 1,
        "num_warps": 8,
        "compile_time": 0.004004001617431641
    },
    {
        "BLOCK_SIZE_M": 32,
        "BLOCK_SIZE_N": 512,
        "BLOCK_SIZE_K": 256,
        "GROUP_SIZE_M": 8,
        "num_stages": 1,
        "num_warps": 16,
        "compile_time": 0.003015756607055664
    },
    {
        "BLOCK_SIZE_M": 32,
        "BLOCK_SIZE_N": 512,
        "BLOCK_SIZE_K": 256,
        "GROUP_SIZE_M": 8,
        "num_stages": 1,
        "num_warps": 32,
        "compile_time": 0.0039026737213134766
    },
    {
        "BLOCK_SIZE_M": 32,
        "BLOCK_SIZE_N": 512,
        "BLOCK_SIZE_K": 256,
        "GROUP_SIZE_M": 8,
        "num_stages": 2,
        "num_warps": 2,
        "compile_time": 19.61776566505432
    },
    {
        "BLOCK_SIZE_M": 32,
        "BLOCK_SIZE_N": 512,
        "BLOCK_SIZE_K": 256,
        "GROUP_SIZE_M": 8,
        "num_stages": 2,
        "num_warps": 4,
        "compile_time": 8.633164644241333
    },
    {
        "BLOCK_SIZE_M": 32,
        "BLOCK_SIZE_N": 512,
        "BLOCK_SIZE_K": 256,
        "GROUP_SIZE_M": 8,
        "num_stages": 2,
        "num_warps": 8,
        "compile_time": 0.004171848297119141
    },
    {
        "BLOCK_SIZE_M": 32,
        "BLOCK_SIZE_N": 512,
        "BLOCK_SIZE_K": 256,
        "GROUP_SIZE_M": 8,
        "num_stages": 2,
        "num_warps": 16,
        "compile_time": 0.0029273033142089844
    },
    {
        "BLOCK_SIZE_M": 32,
        "BLOCK_SIZE_N": 512,
        "BLOCK_SIZE_K": 256,
        "GROUP_SIZE_M": 8,
        "num_stages": 2,
        "num_warps": 32,
        "compile_time": 0.0030219554901123047
    },
    {
        "BLOCK_SIZE_M": 32,
        "BLOCK_SIZE_N": 512,
        "BLOCK_SIZE_K": 256,
        "GROUP_SIZE_M": 8,
        "num_stages": 3,
        "num_warps": 2,
        "compile_time": 20.456619024276733
    },
    {
        "BLOCK_SIZE_M": 32,
        "BLOCK_SIZE_N": 512,
        "BLOCK_SIZE_K": 256,
        "GROUP_SIZE_M": 8,
        "num_stages": 3,
        "num_warps": 4,
        "compile_time": 6.0983076095581055
    },
    {
        "BLOCK_SIZE_M": 32,
        "BLOCK_SIZE_N": 512,
        "BLOCK_SIZE_K": 256,
        "GROUP_SIZE_M": 8,
        "num_stages": 3,
        "num_warps": 8,
        "compile_time": 10.797459125518799
    },
    {
        "BLOCK_SIZE_M": 32,
        "BLOCK_SIZE_N": 512,
        "BLOCK_SIZE_K": 256,
        "GROUP_SIZE_M": 8,
        "num_stages": 3,
        "num_warps": 16,
        "compile_time": 0.0038187503814697266
    },
    {
        "BLOCK_SIZE_M": 32,
        "BLOCK_SIZE_N": 512,
        "BLOCK_SIZE_K": 256,
        "GROUP_SIZE_M": 8,
        "num_stages": 3,
        "num_warps": 32,
        "compile_time": 0.002920389175415039
    },
    {
        "BLOCK_SIZE_M": 32,
        "BLOCK_SIZE_N": 512,
        "BLOCK_SIZE_K": 256,
        "GROUP_SIZE_M": 8,
        "num_stages": 4,
        "num_warps": 2,
        "compile_time": 21.253223657608032
    },
    {
        "BLOCK_SIZE_M": 32,
        "BLOCK_SIZE_N": 512,
        "BLOCK_SIZE_K": 256,
        "GROUP_SIZE_M": 8,
        "num_stages": 4,
        "num_warps": 4,
        "compile_time": 6.38534688949585
    },
    {
        "BLOCK_SIZE_M": 32,
        "BLOCK_SIZE_N": 512,
        "BLOCK_SIZE_K": 256,
        "GROUP_SIZE_M": 8,
        "num_stages": 4,
        "num_warps": 8,
        "compile_time": 11.08871603012085
    },
    {
        "BLOCK_SIZE_M": 32,
        "BLOCK_SIZE_N": 512,
        "BLOCK_SIZE_K": 256,
        "GROUP_SIZE_M": 8,
        "num_stages": 4,
        "num_warps": 16,
        "compile_time": 0.0039005279541015625
    },
    {
        "BLOCK_SIZE_M": 32,
        "BLOCK_SIZE_N": 512,
        "BLOCK_SIZE_K": 256,
        "GROUP_SIZE_M": 8,
        "num_stages": 4,
        "num_warps": 32,
        "compile_time": 0.002874135971069336
    },
    {
        "BLOCK_SIZE_M": 32,
        "BLOCK_SIZE_N": 512,
        "BLOCK_SIZE_K": 256,
        "GROUP_SIZE_M": 8,
        "num_stages": 5,
        "num_warps": 2,
        "compile_time": 22.3461971282959
    },
    {
        "BLOCK_SIZE_M": 32,
        "BLOCK_SIZE_N": 512,
        "BLOCK_SIZE_K": 256,
        "GROUP_SIZE_M": 8,
        "num_stages": 5,
        "num_warps": 4,
        "compile_time": 6.834851980209351
    },
    {
        "BLOCK_SIZE_M": 32,
        "BLOCK_SIZE_N": 512,
        "BLOCK_SIZE_K": 256,
        "GROUP_SIZE_M": 8,
        "num_stages": 5,
        "num_warps": 8,
        "compile_time": 11.179794073104858
    },
    {
        "BLOCK_SIZE_M": 32,
        "BLOCK_SIZE_N": 512,
        "BLOCK_SIZE_K": 256,
        "GROUP_SIZE_M": 8,
        "num_stages": 5,
        "num_warps": 16,
        "compile_time": 0.004697322845458984
    },
    {
        "BLOCK_SIZE_M": 32,
        "BLOCK_SIZE_N": 512,
        "BLOCK_SIZE_K": 256,
        "GROUP_SIZE_M": 8,
        "num_stages": 5,
        "num_warps": 32,
        "compile_time": 0.002942323684692383
    },
    {
        "BLOCK_SIZE_M": 32,
        "BLOCK_SIZE_N": 512,
        "BLOCK_SIZE_K": 256,
        "GROUP_SIZE_M": 8,
        "num_stages": 6,
        "num_warps": 2,
        "compile_time": 23.054568767547607
    },
    {
        "BLOCK_SIZE_M": 32,
        "BLOCK_SIZE_N": 512,
        "BLOCK_SIZE_K": 256,
        "GROUP_SIZE_M": 8,
        "num_stages": 6,
        "num_warps": 4,
        "compile_time": 7.262784719467163
    },
    {
        "BLOCK_SIZE_M": 32,
        "BLOCK_SIZE_N": 512,
        "BLOCK_SIZE_K": 256,
        "GROUP_SIZE_M": 8,
        "num_stages": 6,
        "num_warps": 8,
        "compile_time": 11.521141290664673
    },
    {
        "BLOCK_SIZE_M": 32,
        "BLOCK_SIZE_N": 512,
        "BLOCK_SIZE_K": 256,
        "GROUP_SIZE_M": 8,
        "num_stages": 6,
        "num_warps": 16,
        "compile_time": 0.005342006683349609
    },
    {
        "BLOCK_SIZE_M": 32,
        "BLOCK_SIZE_N": 512,
        "BLOCK_SIZE_K": 256,
        "GROUP_SIZE_M": 8,
        "num_stages": 6,
        "num_warps": 32,
        "compile_time": 0.005913972854614258
    },
    {
        "BLOCK_SIZE_M": 32,
        "BLOCK_SIZE_N": 512,
        "BLOCK_SIZE_K": 256,
        "GROUP_SIZE_M": 8,
        "num_stages": 7,
        "num_warps": 2,
        "compile_time": 6.3298609256744385
    },
    {
        "BLOCK_SIZE_M": 32,
        "BLOCK_SIZE_N": 512,
        "BLOCK_SIZE_K": 256,
        "GROUP_SIZE_M": 8,
        "num_stages": 7,
        "num_warps": 4,
        "compile_time": 7.591468572616577
    },
    {
        "BLOCK_SIZE_M": 32,
        "BLOCK_SIZE_N": 512,
        "BLOCK_SIZE_K": 256,
        "GROUP_SIZE_M": 8,
        "num_stages": 7,
        "num_warps": 8,
        "compile_time": 11.62085747718811
    },
    {
        "BLOCK_SIZE_M": 32,
        "BLOCK_SIZE_N": 512,
        "BLOCK_SIZE_K": 256,
        "GROUP_SIZE_M": 8,
        "num_stages": 7,
        "num_warps": 16,
        "compile_time": 0.003736257553100586
    },
    {
        "BLOCK_SIZE_M": 32,
        "BLOCK_SIZE_N": 512,
        "BLOCK_SIZE_K": 256,
        "GROUP_SIZE_M": 8,
        "num_stages": 7,
        "num_warps": 32,
        "compile_time": 0.0028655529022216797
    },
    {
        "BLOCK_SIZE_M": 32,
        "BLOCK_SIZE_N": 512,
        "BLOCK_SIZE_K": 256,
        "GROUP_SIZE_M": 8,
        "num_stages": 8,
        "num_warps": 2,
        "compile_time": 7.07268762588501
    },
    {
        "BLOCK_SIZE_M": 32,
        "BLOCK_SIZE_N": 512,
        "BLOCK_SIZE_K": 256,
        "GROUP_SIZE_M": 8,
        "num_stages": 8,
        "num_warps": 4,
        "compile_time": 8.09475564956665
    },
    {
        "BLOCK_SIZE_M": 32,
        "BLOCK_SIZE_N": 512,
        "BLOCK_SIZE_K": 256,
        "GROUP_SIZE_M": 8,
        "num_stages": 8,
        "num_warps": 8,
        "compile_time": 12.045337915420532
    },
    {
        "BLOCK_SIZE_M": 32,
        "BLOCK_SIZE_N": 512,
        "BLOCK_SIZE_K": 256,
        "GROUP_SIZE_M": 8,
        "num_stages": 8,
        "num_warps": 16,
        "compile_time": 0.0038301944732666016
    },
    {
        "BLOCK_SIZE_M": 32,
        "BLOCK_SIZE_N": 512,
        "BLOCK_SIZE_K": 256,
        "GROUP_SIZE_M": 8,
        "num_stages": 8,
        "num_warps": 32,
        "compile_time": 0.0029480457305908203
    },
    {
        "BLOCK_SIZE_M": 32,
        "BLOCK_SIZE_N": 512,
        "BLOCK_SIZE_K": 512,
        "GROUP_SIZE_M": 8,
        "num_stages": 1,
        "num_warps": 2,
        "compile_time": 72.39294934272766
    },
    {
        "BLOCK_SIZE_M": 32,
        "BLOCK_SIZE_N": 512,
        "BLOCK_SIZE_K": 512,
        "GROUP_SIZE_M": 8,
        "num_stages": 1,
        "num_warps": 4,
        "compile_time": 19.24794578552246
    },
    {
        "BLOCK_SIZE_M": 32,
        "BLOCK_SIZE_N": 512,
        "BLOCK_SIZE_K": 512,
        "GROUP_SIZE_M": 8,
        "num_stages": 1,
        "num_warps": 8,
        "compile_time": 8.362988948822021
    },
    {
        "BLOCK_SIZE_M": 32,
        "BLOCK_SIZE_N": 512,
        "BLOCK_SIZE_K": 512,
        "GROUP_SIZE_M": 8,
        "num_stages": 1,
        "num_warps": 16,
        "compile_time": 0.004277706146240234
    },
    {
        "BLOCK_SIZE_M": 32,
        "BLOCK_SIZE_N": 512,
        "BLOCK_SIZE_K": 512,
        "GROUP_SIZE_M": 8,
        "num_stages": 1,
        "num_warps": 32,
        "compile_time": 0.0032548904418945312
    },
    {
        "BLOCK_SIZE_M": 32,
        "BLOCK_SIZE_N": 512,
        "BLOCK_SIZE_K": 512,
        "GROUP_SIZE_M": 8,
        "num_stages": 2,
        "num_warps": 2,
        "compile_time": 71.5099425315857
    },
    {
        "BLOCK_SIZE_M": 32,
        "BLOCK_SIZE_N": 512,
        "BLOCK_SIZE_K": 512,
        "GROUP_SIZE_M": 8,
        "num_stages": 2,
        "num_warps": 4,
        "compile_time": 19.61940026283264
    },
    {
        "BLOCK_SIZE_M": 32,
        "BLOCK_SIZE_N": 512,
        "BLOCK_SIZE_K": 512,
        "GROUP_SIZE_M": 8,
        "num_stages": 2,
        "num_warps": 8,
        "compile_time": 8.53039026260376
    },
    {
        "BLOCK_SIZE_M": 32,
        "BLOCK_SIZE_N": 512,
        "BLOCK_SIZE_K": 512,
        "GROUP_SIZE_M": 8,
        "num_stages": 2,
        "num_warps": 16,
        "compile_time": 0.0042035579681396484
    },
    {
        "BLOCK_SIZE_M": 32,
        "BLOCK_SIZE_N": 512,
        "BLOCK_SIZE_K": 512,
        "GROUP_SIZE_M": 8,
        "num_stages": 2,
        "num_warps": 32,
        "compile_time": 0.0029871463775634766
    },
    {
        "BLOCK_SIZE_M": 32,
        "BLOCK_SIZE_N": 512,
        "BLOCK_SIZE_K": 512,
        "GROUP_SIZE_M": 8,
        "num_stages": 3,
        "num_warps": 2,
        "compile_time": 7.782343864440918
    },
    {
        "BLOCK_SIZE_M": 32,
        "BLOCK_SIZE_N": 512,
        "BLOCK_SIZE_K": 512,
        "GROUP_SIZE_M": 8,
        "num_stages": 3,
        "num_warps": 4,
        "compile_time": 20.30747938156128
    },
    {
        "BLOCK_SIZE_M": 32,
        "BLOCK_SIZE_N": 512,
        "BLOCK_SIZE_K": 512,
        "GROUP_SIZE_M": 8,
        "num_stages": 3,
        "num_warps": 8,
        "compile_time": 6.239506006240845
    },
    {
        "BLOCK_SIZE_M": 32,
        "BLOCK_SIZE_N": 512,
        "BLOCK_SIZE_K": 512,
        "GROUP_SIZE_M": 8,
        "num_stages": 3,
        "num_warps": 16,
        "compile_time": 10.755243062973022
    },
    {
        "BLOCK_SIZE_M": 32,
        "BLOCK_SIZE_N": 512,
        "BLOCK_SIZE_K": 512,
        "GROUP_SIZE_M": 8,
        "num_stages": 3,
        "num_warps": 32,
        "compile_time": 0.004099607467651367
    },
    {
        "BLOCK_SIZE_M": 32,
        "BLOCK_SIZE_N": 512,
        "BLOCK_SIZE_K": 512,
        "GROUP_SIZE_M": 8,
        "num_stages": 4,
        "num_warps": 2,
        "compile_time": 9.395626544952393
    },
    {
        "BLOCK_SIZE_M": 32,
        "BLOCK_SIZE_N": 512,
        "BLOCK_SIZE_K": 512,
        "GROUP_SIZE_M": 8,
        "num_stages": 4,
        "num_warps": 4,
        "compile_time": 21.029064655303955
    },
    {
        "BLOCK_SIZE_M": 32,
        "BLOCK_SIZE_N": 512,
        "BLOCK_SIZE_K": 512,
        "GROUP_SIZE_M": 8,
        "num_stages": 4,
        "num_warps": 8,
        "compile_time": 6.720299005508423
    },
    {
        "BLOCK_SIZE_M": 32,
        "BLOCK_SIZE_N": 512,
        "BLOCK_SIZE_K": 512,
        "GROUP_SIZE_M": 8,
        "num_stages": 4,
        "num_warps": 16,
        "compile_time": 10.95222520828247
    },
    {
        "BLOCK_SIZE_M": 32,
        "BLOCK_SIZE_N": 512,
        "BLOCK_SIZE_K": 512,
        "GROUP_SIZE_M": 8,
        "num_stages": 4,
        "num_warps": 32,
        "compile_time": 0.003805875778198242
    },
    {
        "BLOCK_SIZE_M": 32,
        "BLOCK_SIZE_N": 512,
        "BLOCK_SIZE_K": 512,
        "GROUP_SIZE_M": 8,
        "num_stages": 5,
        "num_warps": 2,
        "compile_time": 11.391115188598633
    },
    {
        "BLOCK_SIZE_M": 32,
        "BLOCK_SIZE_N": 512,
        "BLOCK_SIZE_K": 512,
        "GROUP_SIZE_M": 8,
        "num_stages": 5,
        "num_warps": 4,
        "compile_time": 22.007075309753418
    },
    {
        "BLOCK_SIZE_M": 32,
        "BLOCK_SIZE_N": 512,
        "BLOCK_SIZE_K": 512,
        "GROUP_SIZE_M": 8,
        "num_stages": 5,
        "num_warps": 8,
        "compile_time": 7.108460187911987
    },
    {
        "BLOCK_SIZE_M": 32,
        "BLOCK_SIZE_N": 512,
        "BLOCK_SIZE_K": 512,
        "GROUP_SIZE_M": 8,
        "num_stages": 5,
        "num_warps": 16,
        "compile_time": 11.313048601150513
    },
    {
        "BLOCK_SIZE_M": 32,
        "BLOCK_SIZE_N": 512,
        "BLOCK_SIZE_K": 512,
        "GROUP_SIZE_M": 8,
        "num_stages": 5,
        "num_warps": 32,
        "compile_time": 0.003857135772705078
    },
    {
        "BLOCK_SIZE_M": 32,
        "BLOCK_SIZE_N": 512,
        "BLOCK_SIZE_K": 512,
        "GROUP_SIZE_M": 8,
        "num_stages": 6,
        "num_warps": 2,
        "compile_time": 13.224607706069946
    },
    {
        "BLOCK_SIZE_M": 32,
        "BLOCK_SIZE_N": 512,
        "BLOCK_SIZE_K": 512,
        "GROUP_SIZE_M": 8,
        "num_stages": 6,
        "num_warps": 4,
        "compile_time": 23.21835207939148
    },
    {
        "BLOCK_SIZE_M": 32,
        "BLOCK_SIZE_N": 512,
        "BLOCK_SIZE_K": 512,
        "GROUP_SIZE_M": 8,
        "num_stages": 6,
        "num_warps": 8,
        "compile_time": 7.5997841358184814
    },
    {
        "BLOCK_SIZE_M": 32,
        "BLOCK_SIZE_N": 512,
        "BLOCK_SIZE_K": 512,
        "GROUP_SIZE_M": 8,
        "num_stages": 6,
        "num_warps": 16,
        "compile_time": 11.485432386398315
    },
    {
        "BLOCK_SIZE_M": 32,
        "BLOCK_SIZE_N": 512,
        "BLOCK_SIZE_K": 512,
        "GROUP_SIZE_M": 8,
        "num_stages": 6,
        "num_warps": 32,
        "compile_time": 0.004052400588989258
    },
    {
        "BLOCK_SIZE_M": 32,
        "BLOCK_SIZE_N": 512,
        "BLOCK_SIZE_K": 512,
        "GROUP_SIZE_M": 8,
        "num_stages": 7,
        "num_warps": 2,
        "compile_time": 15.161562204360962
    },
    {
        "BLOCK_SIZE_M": 32,
        "BLOCK_SIZE_N": 512,
        "BLOCK_SIZE_K": 512,
        "GROUP_SIZE_M": 8,
        "num_stages": 7,
        "num_warps": 4,
        "compile_time": 6.76755166053772
    },
    {
        "BLOCK_SIZE_M": 32,
        "BLOCK_SIZE_N": 512,
        "BLOCK_SIZE_K": 512,
        "GROUP_SIZE_M": 8,
        "num_stages": 7,
        "num_warps": 8,
        "compile_time": 8.181079387664795
    },
    {
        "BLOCK_SIZE_M": 32,
        "BLOCK_SIZE_N": 512,
        "BLOCK_SIZE_K": 512,
        "GROUP_SIZE_M": 8,
        "num_stages": 7,
        "num_warps": 16,
        "compile_time": 11.866769790649414
    },
    {
        "BLOCK_SIZE_M": 32,
        "BLOCK_SIZE_N": 512,
        "BLOCK_SIZE_K": 512,
        "GROUP_SIZE_M": 8,
        "num_stages": 7,
        "num_warps": 32,
        "compile_time": 0.005632638931274414
    },
    {
        "BLOCK_SIZE_M": 32,
        "BLOCK_SIZE_N": 512,
        "BLOCK_SIZE_K": 512,
        "GROUP_SIZE_M": 8,
        "num_stages": 8,
        "num_warps": 2,
        "compile_time": 17.407660484313965
    },
    {
        "BLOCK_SIZE_M": 32,
        "BLOCK_SIZE_N": 512,
        "BLOCK_SIZE_K": 512,
        "GROUP_SIZE_M": 8,
        "num_stages": 8,
        "num_warps": 4,
        "compile_time": 7.822443723678589
    },
    {
        "BLOCK_SIZE_M": 32,
        "BLOCK_SIZE_N": 512,
        "BLOCK_SIZE_K": 512,
        "GROUP_SIZE_M": 8,
        "num_stages": 8,
        "num_warps": 8,
        "compile_time": 8.651368618011475
    },
    {
        "BLOCK_SIZE_M": 32,
        "BLOCK_SIZE_N": 512,
        "BLOCK_SIZE_K": 512,
        "GROUP_SIZE_M": 8,
        "num_stages": 8,
        "num_warps": 16,
        "compile_time": 12.015921831130981
    },
    {
        "BLOCK_SIZE_M": 32,
        "BLOCK_SIZE_N": 512,
        "BLOCK_SIZE_K": 512,
        "GROUP_SIZE_M": 8,
        "num_stages": 8,
        "num_warps": 32,
        "compile_time": 0.00555872917175293
    },
    {
        "BLOCK_SIZE_M": 64,
        "BLOCK_SIZE_N": 16,
        "BLOCK_SIZE_K": 256,
        "GROUP_SIZE_M": 8,
        "num_stages": 6,
        "num_warps": 2,
        "compile_time": 0.0037763118743896484
    },
    {
        "BLOCK_SIZE_M": 64,
        "BLOCK_SIZE_N": 16,
        "BLOCK_SIZE_K": 256,
        "GROUP_SIZE_M": 8,
        "num_stages": 6,
        "num_warps": 4,
        "compile_time": 0.0028076171875
    },
    {
        "BLOCK_SIZE_M": 64,
        "BLOCK_SIZE_N": 16,
        "BLOCK_SIZE_K": 256,
        "GROUP_SIZE_M": 8,
        "num_stages": 6,
        "num_warps": 8,
        "compile_time": 0.0027599334716796875
    },
    {
        "BLOCK_SIZE_M": 64,
        "BLOCK_SIZE_N": 16,
        "BLOCK_SIZE_K": 256,
        "GROUP_SIZE_M": 8,
        "num_stages": 6,
        "num_warps": 16,
        "compile_time": 0.0026924610137939453
    },
    {
        "BLOCK_SIZE_M": 64,
        "BLOCK_SIZE_N": 16,
        "BLOCK_SIZE_K": 256,
        "GROUP_SIZE_M": 8,
        "num_stages": 6,
        "num_warps": 32,
        "compile_time": 0.0026595592498779297
    },
    {
        "BLOCK_SIZE_M": 64,
        "BLOCK_SIZE_N": 16,
        "BLOCK_SIZE_K": 256,
        "GROUP_SIZE_M": 8,
        "num_stages": 7,
        "num_warps": 2,
        "compile_time": 0.0037338733673095703
    },
    {
        "BLOCK_SIZE_M": 64,
        "BLOCK_SIZE_N": 16,
        "BLOCK_SIZE_K": 256,
        "GROUP_SIZE_M": 8,
        "num_stages": 7,
        "num_warps": 4,
        "compile_time": 0.0027780532836914062
    },
    {
        "BLOCK_SIZE_M": 64,
        "BLOCK_SIZE_N": 16,
        "BLOCK_SIZE_K": 256,
        "GROUP_SIZE_M": 8,
        "num_stages": 7,
        "num_warps": 8,
        "compile_time": 0.002562284469604492
    },
    {
        "BLOCK_SIZE_M": 64,
        "BLOCK_SIZE_N": 16,
        "BLOCK_SIZE_K": 256,
        "GROUP_SIZE_M": 8,
        "num_stages": 7,
        "num_warps": 16,
        "compile_time": 0.0026903152465820312
    },
    {
        "BLOCK_SIZE_M": 64,
        "BLOCK_SIZE_N": 16,
        "BLOCK_SIZE_K": 256,
        "GROUP_SIZE_M": 8,
        "num_stages": 7,
        "num_warps": 32,
        "compile_time": 0.0026912689208984375
    },
    {
        "BLOCK_SIZE_M": 64,
        "BLOCK_SIZE_N": 16,
        "BLOCK_SIZE_K": 256,
        "GROUP_SIZE_M": 8,
        "num_stages": 8,
        "num_warps": 2,
        "compile_time": 0.003247499465942383
    },
    {
        "BLOCK_SIZE_M": 64,
        "BLOCK_SIZE_N": 16,
        "BLOCK_SIZE_K": 256,
        "GROUP_SIZE_M": 8,
        "num_stages": 8,
        "num_warps": 4,
        "compile_time": 0.0027472972869873047
    },
    {
        "BLOCK_SIZE_M": 64,
        "BLOCK_SIZE_N": 16,
        "BLOCK_SIZE_K": 256,
        "GROUP_SIZE_M": 8,
        "num_stages": 8,
        "num_warps": 8,
        "compile_time": 0.0028023719787597656
    },
    {
        "BLOCK_SIZE_M": 64,
        "BLOCK_SIZE_N": 16,
        "BLOCK_SIZE_K": 256,
        "GROUP_SIZE_M": 8,
        "num_stages": 8,
        "num_warps": 16,
        "compile_time": 0.0027093887329101562
    },
    {
        "BLOCK_SIZE_M": 64,
        "BLOCK_SIZE_N": 16,
        "BLOCK_SIZE_K": 256,
        "GROUP_SIZE_M": 8,
        "num_stages": 8,
        "num_warps": 32,
        "compile_time": 0.00269317626953125
    },
    {
        "BLOCK_SIZE_M": 64,
        "BLOCK_SIZE_N": 16,
        "BLOCK_SIZE_K": 512,
        "GROUP_SIZE_M": 8,
        "num_stages": 3,
        "num_warps": 2,
        "compile_time": 11.539677619934082
    },
    {
        "BLOCK_SIZE_M": 64,
        "BLOCK_SIZE_N": 16,
        "BLOCK_SIZE_K": 512,
        "GROUP_SIZE_M": 8,
        "num_stages": 4,
        "num_warps": 2,
        "compile_time": 11.782029151916504
    },
    {
        "BLOCK_SIZE_M": 64,
        "BLOCK_SIZE_N": 16,
        "BLOCK_SIZE_K": 512,
        "GROUP_SIZE_M": 8,
        "num_stages": 4,
        "num_warps": 4,
        "compile_time": 0.004511117935180664
    },
    {
        "BLOCK_SIZE_M": 64,
        "BLOCK_SIZE_N": 16,
        "BLOCK_SIZE_K": 512,
        "GROUP_SIZE_M": 8,
        "num_stages": 4,
        "num_warps": 8,
        "compile_time": 0.0031409263610839844
    },
    {
        "BLOCK_SIZE_M": 64,
        "BLOCK_SIZE_N": 16,
        "BLOCK_SIZE_K": 512,
        "GROUP_SIZE_M": 8,
        "num_stages": 4,
        "num_warps": 16,
        "compile_time": 0.0031042098999023438
    },
    {
        "BLOCK_SIZE_M": 64,
        "BLOCK_SIZE_N": 16,
        "BLOCK_SIZE_K": 512,
        "GROUP_SIZE_M": 8,
        "num_stages": 4,
        "num_warps": 32,
        "compile_time": 0.0030548572540283203
    },
    {
        "BLOCK_SIZE_M": 64,
        "BLOCK_SIZE_N": 16,
        "BLOCK_SIZE_K": 512,
        "GROUP_SIZE_M": 8,
        "num_stages": 5,
        "num_warps": 2,
        "compile_time": 11.997941255569458
    },
    {
        "BLOCK_SIZE_M": 64,
        "BLOCK_SIZE_N": 16,
        "BLOCK_SIZE_K": 512,
        "GROUP_SIZE_M": 8,
        "num_stages": 5,
        "num_warps": 4,
        "compile_time": 0.004397392272949219
    },
    {
        "BLOCK_SIZE_M": 64,
        "BLOCK_SIZE_N": 16,
        "BLOCK_SIZE_K": 512,
        "GROUP_SIZE_M": 8,
        "num_stages": 5,
        "num_warps": 8,
        "compile_time": 0.0032134056091308594
    },
    {
        "BLOCK_SIZE_M": 64,
        "BLOCK_SIZE_N": 16,
        "BLOCK_SIZE_K": 512,
        "GROUP_SIZE_M": 8,
        "num_stages": 5,
        "num_warps": 16,
        "compile_time": 0.003103017807006836
    },
    {
        "BLOCK_SIZE_M": 64,
        "BLOCK_SIZE_N": 16,
        "BLOCK_SIZE_K": 512,
        "GROUP_SIZE_M": 8,
        "num_stages": 5,
        "num_warps": 32,
        "compile_time": 0.002949953079223633
    },
    {
        "BLOCK_SIZE_M": 64,
        "BLOCK_SIZE_N": 16,
        "BLOCK_SIZE_K": 512,
        "GROUP_SIZE_M": 8,
        "num_stages": 6,
        "num_warps": 2,
        "compile_time": 12.273118019104004
    },
    {
        "BLOCK_SIZE_M": 64,
        "BLOCK_SIZE_N": 16,
        "BLOCK_SIZE_K": 512,
        "GROUP_SIZE_M": 8,
        "num_stages": 6,
        "num_warps": 4,
        "compile_time": 0.004225969314575195
    },
    {
        "BLOCK_SIZE_M": 64,
        "BLOCK_SIZE_N": 16,
        "BLOCK_SIZE_K": 512,
        "GROUP_SIZE_M": 8,
        "num_stages": 6,
        "num_warps": 8,
        "compile_time": 0.003175973892211914
    },
    {
        "BLOCK_SIZE_M": 64,
        "BLOCK_SIZE_N": 16,
        "BLOCK_SIZE_K": 512,
        "GROUP_SIZE_M": 8,
        "num_stages": 6,
        "num_warps": 16,
        "compile_time": 0.003093719482421875
    },
    {
        "BLOCK_SIZE_M": 64,
        "BLOCK_SIZE_N": 16,
        "BLOCK_SIZE_K": 512,
        "GROUP_SIZE_M": 8,
        "num_stages": 6,
        "num_warps": 32,
        "compile_time": 0.003027200698852539
    },
    {
        "BLOCK_SIZE_M": 64,
        "BLOCK_SIZE_N": 16,
        "BLOCK_SIZE_K": 512,
        "GROUP_SIZE_M": 8,
        "num_stages": 7,
        "num_warps": 2,
        "compile_time": 12.527221918106079
    },
    {
        "BLOCK_SIZE_M": 64,
        "BLOCK_SIZE_N": 16,
        "BLOCK_SIZE_K": 512,
        "GROUP_SIZE_M": 8,
        "num_stages": 7,
        "num_warps": 4,
        "compile_time": 0.0042345523834228516
    },
    {
        "BLOCK_SIZE_M": 64,
        "BLOCK_SIZE_N": 16,
        "BLOCK_SIZE_K": 512,
        "GROUP_SIZE_M": 8,
        "num_stages": 7,
        "num_warps": 8,
        "compile_time": 0.0032138824462890625
    },
    {
        "BLOCK_SIZE_M": 64,
        "BLOCK_SIZE_N": 16,
        "BLOCK_SIZE_K": 512,
        "GROUP_SIZE_M": 8,
        "num_stages": 7,
        "num_warps": 16,
        "compile_time": 0.004007816314697266
    },
    {
        "BLOCK_SIZE_M": 64,
        "BLOCK_SIZE_N": 16,
        "BLOCK_SIZE_K": 512,
        "GROUP_SIZE_M": 8,
        "num_stages": 7,
        "num_warps": 32,
        "compile_time": 0.003082275390625
    },
    {
        "BLOCK_SIZE_M": 64,
        "BLOCK_SIZE_N": 16,
        "BLOCK_SIZE_K": 512,
        "GROUP_SIZE_M": 8,
        "num_stages": 8,
        "num_warps": 2,
        "compile_time": 12.717719554901123
    },
    {
        "BLOCK_SIZE_M": 64,
        "BLOCK_SIZE_N": 16,
        "BLOCK_SIZE_K": 512,
        "GROUP_SIZE_M": 8,
        "num_stages": 8,
        "num_warps": 4,
        "compile_time": 0.004914760589599609
    },
    {
        "BLOCK_SIZE_M": 64,
        "BLOCK_SIZE_N": 16,
        "BLOCK_SIZE_K": 512,
        "GROUP_SIZE_M": 8,
        "num_stages": 8,
        "num_warps": 8,
        "compile_time": 0.0032083988189697266
    },
    {
        "BLOCK_SIZE_M": 64,
        "BLOCK_SIZE_N": 16,
        "BLOCK_SIZE_K": 512,
        "GROUP_SIZE_M": 8,
        "num_stages": 8,
        "num_warps": 16,
        "compile_time": 0.003110170364379883
    },
    {
        "BLOCK_SIZE_M": 64,
        "BLOCK_SIZE_N": 16,
        "BLOCK_SIZE_K": 512,
        "GROUP_SIZE_M": 8,
        "num_stages": 8,
        "num_warps": 32,
        "compile_time": 0.0031020641326904297
    },
    {
        "BLOCK_SIZE_M": 64,
        "BLOCK_SIZE_N": 32,
        "BLOCK_SIZE_K": 128,
        "GROUP_SIZE_M": 8,
        "num_stages": 8,
        "num_warps": 2,
        "compile_time": 0.005142688751220703
    },
    {
        "BLOCK_SIZE_M": 64,
        "BLOCK_SIZE_N": 32,
        "BLOCK_SIZE_K": 128,
        "GROUP_SIZE_M": 8,
        "num_stages": 8,
        "num_warps": 4,
        "compile_time": 0.0037202835083007812
    },
    {
        "BLOCK_SIZE_M": 64,
        "BLOCK_SIZE_N": 32,
        "BLOCK_SIZE_K": 128,
        "GROUP_SIZE_M": 8,
        "num_stages": 8,
        "num_warps": 8,
        "compile_time": 0.0034542083740234375
    },
    {
        "BLOCK_SIZE_M": 64,
        "BLOCK_SIZE_N": 32,
        "BLOCK_SIZE_K": 128,
        "GROUP_SIZE_M": 8,
        "num_stages": 8,
        "num_warps": 16,
        "compile_time": 0.0034508705139160156
    },
    {
        "BLOCK_SIZE_M": 64,
        "BLOCK_SIZE_N": 32,
        "BLOCK_SIZE_K": 128,
        "GROUP_SIZE_M": 8,
        "num_stages": 8,
        "num_warps": 32,
        "compile_time": 0.0026488304138183594
    },
    {
        "BLOCK_SIZE_M": 64,
        "BLOCK_SIZE_N": 32,
        "BLOCK_SIZE_K": 256,
        "GROUP_SIZE_M": 8,
        "num_stages": 5,
        "num_warps": 2,
        "compile_time": 0.003614664077758789
    },
    {
        "BLOCK_SIZE_M": 64,
        "BLOCK_SIZE_N": 32,
        "BLOCK_SIZE_K": 256,
        "GROUP_SIZE_M": 8,
        "num_stages": 5,
        "num_warps": 4,
        "compile_time": 0.002763986587524414
    },
    {
        "BLOCK_SIZE_M": 64,
        "BLOCK_SIZE_N": 32,
        "BLOCK_SIZE_K": 256,
        "GROUP_SIZE_M": 8,
        "num_stages": 5,
        "num_warps": 8,
        "compile_time": 0.0027396678924560547
    },
    {
        "BLOCK_SIZE_M": 64,
        "BLOCK_SIZE_N": 32,
        "BLOCK_SIZE_K": 256,
        "GROUP_SIZE_M": 8,
        "num_stages": 5,
        "num_warps": 16,
        "compile_time": 0.004496574401855469
    },
    {
        "BLOCK_SIZE_M": 64,
        "BLOCK_SIZE_N": 32,
        "BLOCK_SIZE_K": 256,
        "GROUP_SIZE_M": 8,
        "num_stages": 5,
        "num_warps": 32,
        "compile_time": 0.0050504207611083984
    },
    {
        "BLOCK_SIZE_M": 64,
        "BLOCK_SIZE_N": 32,
        "BLOCK_SIZE_K": 256,
        "GROUP_SIZE_M": 8,
        "num_stages": 6,
        "num_warps": 2,
        "compile_time": 0.004858255386352539
    },
    {
        "BLOCK_SIZE_M": 64,
        "BLOCK_SIZE_N": 32,
        "BLOCK_SIZE_K": 256,
        "GROUP_SIZE_M": 8,
        "num_stages": 6,
        "num_warps": 4,
        "compile_time": 0.006524324417114258
    },
    {
        "BLOCK_SIZE_M": 64,
        "BLOCK_SIZE_N": 32,
        "BLOCK_SIZE_K": 256,
        "GROUP_SIZE_M": 8,
        "num_stages": 6,
        "num_warps": 8,
        "compile_time": 0.004156827926635742
    },
    {
        "BLOCK_SIZE_M": 64,
        "BLOCK_SIZE_N": 32,
        "BLOCK_SIZE_K": 256,
        "GROUP_SIZE_M": 8,
        "num_stages": 6,
        "num_warps": 16,
        "compile_time": 0.004615306854248047
    },
    {
        "BLOCK_SIZE_M": 64,
        "BLOCK_SIZE_N": 32,
        "BLOCK_SIZE_K": 256,
        "GROUP_SIZE_M": 8,
        "num_stages": 6,
        "num_warps": 32,
        "compile_time": 0.002629995346069336
    },
    {
        "BLOCK_SIZE_M": 64,
        "BLOCK_SIZE_N": 32,
        "BLOCK_SIZE_K": 256,
        "GROUP_SIZE_M": 8,
        "num_stages": 7,
        "num_warps": 2,
        "compile_time": 0.002925395965576172
    },
    {
        "BLOCK_SIZE_M": 64,
        "BLOCK_SIZE_N": 32,
        "BLOCK_SIZE_K": 256,
        "GROUP_SIZE_M": 8,
        "num_stages": 7,
        "num_warps": 4,
        "compile_time": 0.002681732177734375
    },
    {
        "BLOCK_SIZE_M": 64,
        "BLOCK_SIZE_N": 32,
        "BLOCK_SIZE_K": 256,
        "GROUP_SIZE_M": 8,
        "num_stages": 7,
        "num_warps": 8,
        "compile_time": 0.0035190582275390625
    },
    {
        "BLOCK_SIZE_M": 64,
        "BLOCK_SIZE_N": 32,
        "BLOCK_SIZE_K": 256,
        "GROUP_SIZE_M": 8,
        "num_stages": 7,
        "num_warps": 16,
        "compile_time": 0.0026679039001464844
    },
    {
        "BLOCK_SIZE_M": 64,
        "BLOCK_SIZE_N": 32,
        "BLOCK_SIZE_K": 256,
        "GROUP_SIZE_M": 8,
        "num_stages": 7,
        "num_warps": 32,
        "compile_time": 0.002699136734008789
    },
    {
        "BLOCK_SIZE_M": 64,
        "BLOCK_SIZE_N": 32,
        "BLOCK_SIZE_K": 256,
        "GROUP_SIZE_M": 8,
        "num_stages": 8,
        "num_warps": 2,
        "compile_time": 0.0028579235076904297
    },
    {
        "BLOCK_SIZE_M": 64,
        "BLOCK_SIZE_N": 32,
        "BLOCK_SIZE_K": 256,
        "GROUP_SIZE_M": 8,
        "num_stages": 8,
        "num_warps": 4,
        "compile_time": 0.0028083324432373047
    },
    {
        "BLOCK_SIZE_M": 64,
        "BLOCK_SIZE_N": 32,
        "BLOCK_SIZE_K": 256,
        "GROUP_SIZE_M": 8,
        "num_stages": 8,
        "num_warps": 8,
        "compile_time": 0.0026884078979492188
    },
    {
        "BLOCK_SIZE_M": 64,
        "BLOCK_SIZE_N": 32,
        "BLOCK_SIZE_K": 256,
        "GROUP_SIZE_M": 8,
        "num_stages": 8,
        "num_warps": 16,
        "compile_time": 0.0026979446411132812
    },
    {
        "BLOCK_SIZE_M": 64,
        "BLOCK_SIZE_N": 32,
        "BLOCK_SIZE_K": 256,
        "GROUP_SIZE_M": 8,
        "num_stages": 8,
        "num_warps": 32,
        "compile_time": 0.003267049789428711
    },
    {
        "BLOCK_SIZE_M": 64,
        "BLOCK_SIZE_N": 32,
        "BLOCK_SIZE_K": 512,
        "GROUP_SIZE_M": 8,
        "num_stages": 3,
        "num_warps": 2,
        "compile_time": 14.25399112701416
    },
    {
        "BLOCK_SIZE_M": 64,
        "BLOCK_SIZE_N": 32,
        "BLOCK_SIZE_K": 512,
        "GROUP_SIZE_M": 8,
        "num_stages": 3,
        "num_warps": 4,
        "compile_time": 0.004131317138671875
    },
    {
        "BLOCK_SIZE_M": 64,
        "BLOCK_SIZE_N": 32,
        "BLOCK_SIZE_K": 512,
        "GROUP_SIZE_M": 8,
        "num_stages": 3,
        "num_warps": 8,
        "compile_time": 0.0031838417053222656
    },
    {
        "BLOCK_SIZE_M": 64,
        "BLOCK_SIZE_N": 32,
        "BLOCK_SIZE_K": 512,
        "GROUP_SIZE_M": 8,
        "num_stages": 3,
        "num_warps": 16,
        "compile_time": 0.0030336380004882812
    },
    {
        "BLOCK_SIZE_M": 64,
        "BLOCK_SIZE_N": 32,
        "BLOCK_SIZE_K": 512,
        "GROUP_SIZE_M": 8,
        "num_stages": 3,
        "num_warps": 32,
        "compile_time": 0.0031108856201171875
    },
    {
        "BLOCK_SIZE_M": 64,
        "BLOCK_SIZE_N": 32,
        "BLOCK_SIZE_K": 512,
        "GROUP_SIZE_M": 8,
        "num_stages": 4,
        "num_warps": 2,
        "compile_time": 14.499650716781616
    },
    {
        "BLOCK_SIZE_M": 64,
        "BLOCK_SIZE_N": 32,
        "BLOCK_SIZE_K": 512,
        "GROUP_SIZE_M": 8,
        "num_stages": 4,
        "num_warps": 4,
        "compile_time": 0.004391908645629883
    },
    {
        "BLOCK_SIZE_M": 64,
        "BLOCK_SIZE_N": 32,
        "BLOCK_SIZE_K": 512,
        "GROUP_SIZE_M": 8,
        "num_stages": 4,
        "num_warps": 8,
        "compile_time": 0.003140687942504883
    },
    {
        "BLOCK_SIZE_M": 64,
        "BLOCK_SIZE_N": 32,
        "BLOCK_SIZE_K": 512,
        "GROUP_SIZE_M": 8,
        "num_stages": 4,
        "num_warps": 16,
        "compile_time": 0.003108978271484375
    },
    {
        "BLOCK_SIZE_M": 64,
        "BLOCK_SIZE_N": 32,
        "BLOCK_SIZE_K": 512,
        "GROUP_SIZE_M": 8,
        "num_stages": 4,
        "num_warps": 32,
        "compile_time": 0.0031812191009521484
    },
    {
        "BLOCK_SIZE_M": 64,
        "BLOCK_SIZE_N": 32,
        "BLOCK_SIZE_K": 512,
        "GROUP_SIZE_M": 8,
        "num_stages": 5,
        "num_warps": 2,
        "compile_time": 14.729059934616089
    },
    {
        "BLOCK_SIZE_M": 64,
        "BLOCK_SIZE_N": 32,
        "BLOCK_SIZE_K": 512,
        "GROUP_SIZE_M": 8,
        "num_stages": 5,
        "num_warps": 4,
        "compile_time": 0.004602670669555664
    },
    {
        "BLOCK_SIZE_M": 64,
        "BLOCK_SIZE_N": 32,
        "BLOCK_SIZE_K": 512,
        "GROUP_SIZE_M": 8,
        "num_stages": 5,
        "num_warps": 8,
        "compile_time": 0.0031261444091796875
    },
    {
        "BLOCK_SIZE_M": 64,
        "BLOCK_SIZE_N": 32,
        "BLOCK_SIZE_K": 512,
        "GROUP_SIZE_M": 8,
        "num_stages": 5,
        "num_warps": 16,
        "compile_time": 0.0031723976135253906
    },
    {
        "BLOCK_SIZE_M": 64,
        "BLOCK_SIZE_N": 32,
        "BLOCK_SIZE_K": 512,
        "GROUP_SIZE_M": 8,
        "num_stages": 5,
        "num_warps": 32,
        "compile_time": 0.0030939579010009766
    },
    {
        "BLOCK_SIZE_M": 64,
        "BLOCK_SIZE_N": 32,
        "BLOCK_SIZE_K": 512,
        "GROUP_SIZE_M": 8,
        "num_stages": 6,
        "num_warps": 2,
        "compile_time": 14.951472759246826
    },
    {
        "BLOCK_SIZE_M": 64,
        "BLOCK_SIZE_N": 32,
        "BLOCK_SIZE_K": 512,
        "GROUP_SIZE_M": 8,
        "num_stages": 6,
        "num_warps": 4,
        "compile_time": 0.004355907440185547
    },
    {
        "BLOCK_SIZE_M": 64,
        "BLOCK_SIZE_N": 32,
        "BLOCK_SIZE_K": 512,
        "GROUP_SIZE_M": 8,
        "num_stages": 6,
        "num_warps": 8,
        "compile_time": 0.003134012222290039
    },
    {
        "BLOCK_SIZE_M": 64,
        "BLOCK_SIZE_N": 32,
        "BLOCK_SIZE_K": 512,
        "GROUP_SIZE_M": 8,
        "num_stages": 6,
        "num_warps": 16,
        "compile_time": 0.00307464599609375
    },
    {
        "BLOCK_SIZE_M": 64,
        "BLOCK_SIZE_N": 32,
        "BLOCK_SIZE_K": 512,
        "GROUP_SIZE_M": 8,
        "num_stages": 6,
        "num_warps": 32,
        "compile_time": 0.003042936325073242
    },
    {
        "BLOCK_SIZE_M": 64,
        "BLOCK_SIZE_N": 32,
        "BLOCK_SIZE_K": 512,
        "GROUP_SIZE_M": 8,
        "num_stages": 7,
        "num_warps": 2,
        "compile_time": 15.34532642364502
    },
    {
        "BLOCK_SIZE_M": 64,
        "BLOCK_SIZE_N": 32,
        "BLOCK_SIZE_K": 512,
        "GROUP_SIZE_M": 8,
        "num_stages": 7,
        "num_warps": 4,
        "compile_time": 0.004278898239135742
    },
    {
        "BLOCK_SIZE_M": 64,
        "BLOCK_SIZE_N": 32,
        "BLOCK_SIZE_K": 512,
        "GROUP_SIZE_M": 8,
        "num_stages": 7,
        "num_warps": 8,
        "compile_time": 0.0033049583435058594
    },
    {
        "BLOCK_SIZE_M": 64,
        "BLOCK_SIZE_N": 32,
        "BLOCK_SIZE_K": 512,
        "GROUP_SIZE_M": 8,
        "num_stages": 7,
        "num_warps": 16,
        "compile_time": 0.003114461898803711
    },
    {
        "BLOCK_SIZE_M": 64,
        "BLOCK_SIZE_N": 32,
        "BLOCK_SIZE_K": 512,
        "GROUP_SIZE_M": 8,
        "num_stages": 7,
        "num_warps": 32,
        "compile_time": 0.003058195114135742
    },
    {
        "BLOCK_SIZE_M": 64,
        "BLOCK_SIZE_N": 32,
        "BLOCK_SIZE_K": 512,
        "GROUP_SIZE_M": 8,
        "num_stages": 8,
        "num_warps": 2,
        "compile_time": 15.560735702514648
    },
    {
        "BLOCK_SIZE_M": 64,
        "BLOCK_SIZE_N": 32,
        "BLOCK_SIZE_K": 512,
        "GROUP_SIZE_M": 8,
        "num_stages": 8,
        "num_warps": 4,
        "compile_time": 0.004861116409301758
    },
    {
        "BLOCK_SIZE_M": 64,
        "BLOCK_SIZE_N": 32,
        "BLOCK_SIZE_K": 512,
        "GROUP_SIZE_M": 8,
        "num_stages": 8,
        "num_warps": 8,
        "compile_time": 0.0031304359436035156
    },
    {
        "BLOCK_SIZE_M": 64,
        "BLOCK_SIZE_N": 32,
        "BLOCK_SIZE_K": 512,
        "GROUP_SIZE_M": 8,
        "num_stages": 8,
        "num_warps": 16,
        "compile_time": 0.0030617713928222656
    },
    {
        "BLOCK_SIZE_M": 64,
        "BLOCK_SIZE_N": 32,
        "BLOCK_SIZE_K": 512,
        "GROUP_SIZE_M": 8,
        "num_stages": 8,
        "num_warps": 32,
        "compile_time": 0.004042148590087891
    },
    {
        "BLOCK_SIZE_M": 64,
        "BLOCK_SIZE_N": 64,
        "BLOCK_SIZE_K": 128,
        "GROUP_SIZE_M": 8,
        "num_stages": 7,
        "num_warps": 2,
        "compile_time": 0.0036225318908691406
    },
    {
        "BLOCK_SIZE_M": 64,
        "BLOCK_SIZE_N": 64,
        "BLOCK_SIZE_K": 128,
        "GROUP_SIZE_M": 8,
        "num_stages": 7,
        "num_warps": 4,
        "compile_time": 0.0026738643646240234
    },
    {
        "BLOCK_SIZE_M": 64,
        "BLOCK_SIZE_N": 64,
        "BLOCK_SIZE_K": 128,
        "GROUP_SIZE_M": 8,
        "num_stages": 7,
        "num_warps": 8,
        "compile_time": 0.0026276111602783203
    },
    {
        "BLOCK_SIZE_M": 64,
        "BLOCK_SIZE_N": 64,
        "BLOCK_SIZE_K": 128,
        "GROUP_SIZE_M": 8,
        "num_stages": 7,
        "num_warps": 16,
        "compile_time": 0.0029625892639160156
    },
    {
        "BLOCK_SIZE_M": 64,
        "BLOCK_SIZE_N": 64,
        "BLOCK_SIZE_K": 128,
        "GROUP_SIZE_M": 8,
        "num_stages": 7,
        "num_warps": 32,
        "compile_time": 0.0025691986083984375
    },
    {
        "BLOCK_SIZE_M": 64,
        "BLOCK_SIZE_N": 64,
        "BLOCK_SIZE_K": 128,
        "GROUP_SIZE_M": 8,
        "num_stages": 8,
        "num_warps": 2,
        "compile_time": 0.0026946067810058594
    },
    {
        "BLOCK_SIZE_M": 64,
        "BLOCK_SIZE_N": 64,
        "BLOCK_SIZE_K": 128,
        "GROUP_SIZE_M": 8,
        "num_stages": 8,
        "num_warps": 4,
        "compile_time": 0.0026459693908691406
    },
    {
        "BLOCK_SIZE_M": 64,
        "BLOCK_SIZE_N": 64,
        "BLOCK_SIZE_K": 128,
        "GROUP_SIZE_M": 8,
        "num_stages": 8,
        "num_warps": 8,
        "compile_time": 0.002637147903442383
    },
    {
        "BLOCK_SIZE_M": 64,
        "BLOCK_SIZE_N": 64,
        "BLOCK_SIZE_K": 128,
        "GROUP_SIZE_M": 8,
        "num_stages": 8,
        "num_warps": 16,
        "compile_time": 0.0025916099548339844
    },
    {
        "BLOCK_SIZE_M": 64,
        "BLOCK_SIZE_N": 64,
        "BLOCK_SIZE_K": 128,
        "GROUP_SIZE_M": 8,
        "num_stages": 8,
        "num_warps": 32,
        "compile_time": 0.0028638839721679688
    },
    {
        "BLOCK_SIZE_M": 64,
        "BLOCK_SIZE_N": 64,
        "BLOCK_SIZE_K": 256,
        "GROUP_SIZE_M": 8,
        "num_stages": 4,
        "num_warps": 2,
        "compile_time": 0.0036630630493164062
    },
    {
        "BLOCK_SIZE_M": 64,
        "BLOCK_SIZE_N": 64,
        "BLOCK_SIZE_K": 256,
        "GROUP_SIZE_M": 8,
        "num_stages": 4,
        "num_warps": 4,
        "compile_time": 0.0027191638946533203
    },
    {
        "BLOCK_SIZE_M": 64,
        "BLOCK_SIZE_N": 64,
        "BLOCK_SIZE_K": 256,
        "GROUP_SIZE_M": 8,
        "num_stages": 4,
        "num_warps": 8,
        "compile_time": 0.003015279769897461
    },
    {
        "BLOCK_SIZE_M": 64,
        "BLOCK_SIZE_N": 64,
        "BLOCK_SIZE_K": 256,
        "GROUP_SIZE_M": 8,
        "num_stages": 4,
        "num_warps": 16,
        "compile_time": 0.0026006698608398438
    },
    {
        "BLOCK_SIZE_M": 64,
        "BLOCK_SIZE_N": 64,
        "BLOCK_SIZE_K": 256,
        "GROUP_SIZE_M": 8,
        "num_stages": 4,
        "num_warps": 32,
        "compile_time": 0.0025894641876220703
    },
    {
        "BLOCK_SIZE_M": 64,
        "BLOCK_SIZE_N": 64,
        "BLOCK_SIZE_K": 256,
        "GROUP_SIZE_M": 8,
        "num_stages": 5,
        "num_warps": 2,
        "compile_time": 0.0028738975524902344
    },
    {
        "BLOCK_SIZE_M": 64,
        "BLOCK_SIZE_N": 64,
        "BLOCK_SIZE_K": 256,
        "GROUP_SIZE_M": 8,
        "num_stages": 5,
        "num_warps": 4,
        "compile_time": 0.0027132034301757812
    },
    {
        "BLOCK_SIZE_M": 64,
        "BLOCK_SIZE_N": 64,
        "BLOCK_SIZE_K": 256,
        "GROUP_SIZE_M": 8,
        "num_stages": 5,
        "num_warps": 8,
        "compile_time": 0.0026488304138183594
    },
    {
        "BLOCK_SIZE_M": 64,
        "BLOCK_SIZE_N": 64,
        "BLOCK_SIZE_K": 256,
        "GROUP_SIZE_M": 8,
        "num_stages": 5,
        "num_warps": 16,
        "compile_time": 0.002608060836791992
    },
    {
        "BLOCK_SIZE_M": 64,
        "BLOCK_SIZE_N": 64,
        "BLOCK_SIZE_K": 256,
        "GROUP_SIZE_M": 8,
        "num_stages": 5,
        "num_warps": 32,
        "compile_time": 0.0026738643646240234
    },
    {
        "BLOCK_SIZE_M": 64,
        "BLOCK_SIZE_N": 64,
        "BLOCK_SIZE_K": 256,
        "GROUP_SIZE_M": 8,
        "num_stages": 6,
        "num_warps": 2,
        "compile_time": 0.0029296875
    },
    {
        "BLOCK_SIZE_M": 64,
        "BLOCK_SIZE_N": 64,
        "BLOCK_SIZE_K": 256,
        "GROUP_SIZE_M": 8,
        "num_stages": 6,
        "num_warps": 4,
        "compile_time": 0.002737760543823242
    },
    {
        "BLOCK_SIZE_M": 64,
        "BLOCK_SIZE_N": 64,
        "BLOCK_SIZE_K": 256,
        "GROUP_SIZE_M": 8,
        "num_stages": 6,
        "num_warps": 8,
        "compile_time": 0.0027039051055908203
    },
    {
        "BLOCK_SIZE_M": 64,
        "BLOCK_SIZE_N": 64,
        "BLOCK_SIZE_K": 256,
        "GROUP_SIZE_M": 8,
        "num_stages": 6,
        "num_warps": 16,
        "compile_time": 0.0025627613067626953
    },
    {
        "BLOCK_SIZE_M": 64,
        "BLOCK_SIZE_N": 64,
        "BLOCK_SIZE_K": 256,
        "GROUP_SIZE_M": 8,
        "num_stages": 6,
        "num_warps": 32,
        "compile_time": 0.0026352405548095703
    },
    {
        "BLOCK_SIZE_M": 64,
        "BLOCK_SIZE_N": 64,
        "BLOCK_SIZE_K": 256,
        "GROUP_SIZE_M": 8,
        "num_stages": 7,
        "num_warps": 2,
        "compile_time": 0.0031156539916992188
    },
    {
        "BLOCK_SIZE_M": 64,
        "BLOCK_SIZE_N": 64,
        "BLOCK_SIZE_K": 256,
        "GROUP_SIZE_M": 8,
        "num_stages": 7,
        "num_warps": 4,
        "compile_time": 0.0029163360595703125
    },
    {
        "BLOCK_SIZE_M": 64,
        "BLOCK_SIZE_N": 64,
        "BLOCK_SIZE_K": 256,
        "GROUP_SIZE_M": 8,
        "num_stages": 7,
        "num_warps": 8,
        "compile_time": 0.0024454593658447266
    },
    {
        "BLOCK_SIZE_M": 64,
        "BLOCK_SIZE_N": 64,
        "BLOCK_SIZE_K": 256,
        "GROUP_SIZE_M": 8,
        "num_stages": 7,
        "num_warps": 16,
        "compile_time": 0.002618551254272461
    },
    {
        "BLOCK_SIZE_M": 64,
        "BLOCK_SIZE_N": 64,
        "BLOCK_SIZE_K": 256,
        "GROUP_SIZE_M": 8,
        "num_stages": 7,
        "num_warps": 32,
        "compile_time": 0.002573728561401367
    },
    {
        "BLOCK_SIZE_M": 64,
        "BLOCK_SIZE_N": 64,
        "BLOCK_SIZE_K": 256,
        "GROUP_SIZE_M": 8,
        "num_stages": 8,
        "num_warps": 2,
        "compile_time": 0.003075122833251953
    },
    {
        "BLOCK_SIZE_M": 64,
        "BLOCK_SIZE_N": 64,
        "BLOCK_SIZE_K": 256,
        "GROUP_SIZE_M": 8,
        "num_stages": 8,
        "num_warps": 4,
        "compile_time": 0.002820253372192383
    },
    {
        "BLOCK_SIZE_M": 64,
        "BLOCK_SIZE_N": 64,
        "BLOCK_SIZE_K": 256,
        "GROUP_SIZE_M": 8,
        "num_stages": 8,
        "num_warps": 8,
        "compile_time": 0.002660989761352539
    },
    {
        "BLOCK_SIZE_M": 64,
        "BLOCK_SIZE_N": 64,
        "BLOCK_SIZE_K": 256,
        "GROUP_SIZE_M": 8,
        "num_stages": 8,
        "num_warps": 16,
        "compile_time": 0.0027256011962890625
    },
    {
        "BLOCK_SIZE_M": 64,
        "BLOCK_SIZE_N": 64,
        "BLOCK_SIZE_K": 256,
        "GROUP_SIZE_M": 8,
        "num_stages": 8,
        "num_warps": 32,
        "compile_time": 0.0026543140411376953
    },
    {
        "BLOCK_SIZE_M": 64,
        "BLOCK_SIZE_N": 64,
        "BLOCK_SIZE_K": 512,
        "GROUP_SIZE_M": 8,
        "num_stages": 2,
        "num_warps": 2,
        "compile_time": 6.000990390777588
    },
    {
        "BLOCK_SIZE_M": 64,
        "BLOCK_SIZE_N": 64,
        "BLOCK_SIZE_K": 512,
        "GROUP_SIZE_M": 8,
        "num_stages": 3,
        "num_warps": 2,
        "compile_time": 25.67188811302185
    },
    {
        "BLOCK_SIZE_M": 64,
        "BLOCK_SIZE_N": 64,
        "BLOCK_SIZE_K": 512,
        "GROUP_SIZE_M": 8,
        "num_stages": 3,
        "num_warps": 4,
        "compile_time": 0.00436091423034668
    },
    {
        "BLOCK_SIZE_M": 64,
        "BLOCK_SIZE_N": 64,
        "BLOCK_SIZE_K": 512,
        "GROUP_SIZE_M": 8,
        "num_stages": 3,
        "num_warps": 8,
        "compile_time": 0.0031905174255371094
    },
    {
        "BLOCK_SIZE_M": 64,
        "BLOCK_SIZE_N": 64,
        "BLOCK_SIZE_K": 512,
        "GROUP_SIZE_M": 8,
        "num_stages": 3,
        "num_warps": 16,
        "compile_time": 0.003249645233154297
    },
    {
        "BLOCK_SIZE_M": 64,
        "BLOCK_SIZE_N": 64,
        "BLOCK_SIZE_K": 512,
        "GROUP_SIZE_M": 8,
        "num_stages": 3,
        "num_warps": 32,
        "compile_time": 0.0030486583709716797
    },
    {
        "BLOCK_SIZE_M": 64,
        "BLOCK_SIZE_N": 64,
        "BLOCK_SIZE_K": 512,
        "GROUP_SIZE_M": 8,
        "num_stages": 4,
        "num_warps": 2,
        "compile_time": 25.713255882263184
    },
    {
        "BLOCK_SIZE_M": 64,
        "BLOCK_SIZE_N": 64,
        "BLOCK_SIZE_K": 512,
        "GROUP_SIZE_M": 8,
        "num_stages": 4,
        "num_warps": 4,
        "compile_time": 0.004671812057495117
    },
    {
        "BLOCK_SIZE_M": 64,
        "BLOCK_SIZE_N": 64,
        "BLOCK_SIZE_K": 512,
        "GROUP_SIZE_M": 8,
        "num_stages": 4,
        "num_warps": 8,
        "compile_time": 0.004289388656616211
    },
    {
        "BLOCK_SIZE_M": 64,
        "BLOCK_SIZE_N": 64,
        "BLOCK_SIZE_K": 512,
        "GROUP_SIZE_M": 8,
        "num_stages": 4,
        "num_warps": 16,
        "compile_time": 0.003077268600463867
    },
    {
        "BLOCK_SIZE_M": 64,
        "BLOCK_SIZE_N": 64,
        "BLOCK_SIZE_K": 512,
        "GROUP_SIZE_M": 8,
        "num_stages": 4,
        "num_warps": 32,
        "compile_time": 0.0030078887939453125
    },
    {
        "BLOCK_SIZE_M": 64,
        "BLOCK_SIZE_N": 64,
        "BLOCK_SIZE_K": 512,
        "GROUP_SIZE_M": 8,
        "num_stages": 5,
        "num_warps": 2,
        "compile_time": 26.359912872314453
    },
    {
        "BLOCK_SIZE_M": 64,
        "BLOCK_SIZE_N": 64,
        "BLOCK_SIZE_K": 512,
        "GROUP_SIZE_M": 8,
        "num_stages": 5,
        "num_warps": 4,
        "compile_time": 0.005311727523803711
    },
    {
        "BLOCK_SIZE_M": 64,
        "BLOCK_SIZE_N": 64,
        "BLOCK_SIZE_K": 512,
        "GROUP_SIZE_M": 8,
        "num_stages": 5,
        "num_warps": 8,
        "compile_time": 0.0031909942626953125
    },
    {
        "BLOCK_SIZE_M": 64,
        "BLOCK_SIZE_N": 64,
        "BLOCK_SIZE_K": 512,
        "GROUP_SIZE_M": 8,
        "num_stages": 5,
        "num_warps": 16,
        "compile_time": 0.0030832290649414062
    },
    {
        "BLOCK_SIZE_M": 64,
        "BLOCK_SIZE_N": 64,
        "BLOCK_SIZE_K": 512,
        "GROUP_SIZE_M": 8,
        "num_stages": 5,
        "num_warps": 32,
        "compile_time": 0.0028171539306640625
    },
    {
        "BLOCK_SIZE_M": 64,
        "BLOCK_SIZE_N": 64,
        "BLOCK_SIZE_K": 512,
        "GROUP_SIZE_M": 8,
        "num_stages": 6,
        "num_warps": 2,
        "compile_time": 26.608694314956665
    },
    {
        "BLOCK_SIZE_M": 64,
        "BLOCK_SIZE_N": 64,
        "BLOCK_SIZE_K": 512,
        "GROUP_SIZE_M": 8,
        "num_stages": 6,
        "num_warps": 4,
        "compile_time": 0.005070209503173828
    },
    {
        "BLOCK_SIZE_M": 64,
        "BLOCK_SIZE_N": 64,
        "BLOCK_SIZE_K": 512,
        "GROUP_SIZE_M": 8,
        "num_stages": 6,
        "num_warps": 8,
        "compile_time": 0.0032410621643066406
    },
    {
        "BLOCK_SIZE_M": 64,
        "BLOCK_SIZE_N": 64,
        "BLOCK_SIZE_K": 512,
        "GROUP_SIZE_M": 8,
        "num_stages": 6,
        "num_warps": 16,
        "compile_time": 0.0031757354736328125
    },
    {
        "BLOCK_SIZE_M": 64,
        "BLOCK_SIZE_N": 64,
        "BLOCK_SIZE_K": 512,
        "GROUP_SIZE_M": 8,
        "num_stages": 6,
        "num_warps": 32,
        "compile_time": 0.003047466278076172
    },
    {
        "BLOCK_SIZE_M": 64,
        "BLOCK_SIZE_N": 64,
        "BLOCK_SIZE_K": 512,
        "GROUP_SIZE_M": 8,
        "num_stages": 7,
        "num_warps": 2,
        "compile_time": 26.659475326538086
    },
    {
        "BLOCK_SIZE_M": 64,
        "BLOCK_SIZE_N": 64,
        "BLOCK_SIZE_K": 512,
        "GROUP_SIZE_M": 8,
        "num_stages": 7,
        "num_warps": 4,
        "compile_time": 0.004297018051147461
    },
    {
        "BLOCK_SIZE_M": 64,
        "BLOCK_SIZE_N": 64,
        "BLOCK_SIZE_K": 512,
        "GROUP_SIZE_M": 8,
        "num_stages": 7,
        "num_warps": 8,
        "compile_time": 0.0031859874725341797
    },
    {
        "BLOCK_SIZE_M": 64,
        "BLOCK_SIZE_N": 64,
        "BLOCK_SIZE_K": 512,
        "GROUP_SIZE_M": 8,
        "num_stages": 7,
        "num_warps": 16,
        "compile_time": 0.003082275390625
    },
    {
        "BLOCK_SIZE_M": 64,
        "BLOCK_SIZE_N": 64,
        "BLOCK_SIZE_K": 512,
        "GROUP_SIZE_M": 8,
        "num_stages": 7,
        "num_warps": 32,
        "compile_time": 0.0030243396759033203
    },
    {
        "BLOCK_SIZE_M": 64,
        "BLOCK_SIZE_N": 64,
        "BLOCK_SIZE_K": 512,
        "GROUP_SIZE_M": 8,
        "num_stages": 8,
        "num_warps": 2,
        "compile_time": 27.483125925064087
    },
    {
        "BLOCK_SIZE_M": 64,
        "BLOCK_SIZE_N": 64,
        "BLOCK_SIZE_K": 512,
        "GROUP_SIZE_M": 8,
        "num_stages": 8,
        "num_warps": 4,
        "compile_time": 0.005162477493286133
    },
    {
        "BLOCK_SIZE_M": 64,
        "BLOCK_SIZE_N": 64,
        "BLOCK_SIZE_K": 512,
        "GROUP_SIZE_M": 8,
        "num_stages": 8,
        "num_warps": 8,
        "compile_time": 0.003234386444091797
    },
    {
        "BLOCK_SIZE_M": 64,
        "BLOCK_SIZE_N": 64,
        "BLOCK_SIZE_K": 512,
        "GROUP_SIZE_M": 8,
        "num_stages": 8,
        "num_warps": 16,
        "compile_time": 0.0030982494354248047
    },
    {
        "BLOCK_SIZE_M": 64,
        "BLOCK_SIZE_N": 64,
        "BLOCK_SIZE_K": 512,
        "GROUP_SIZE_M": 8,
        "num_stages": 8,
        "num_warps": 32,
        "compile_time": 0.0030782222747802734
    },
    {
        "BLOCK_SIZE_M": 64,
        "BLOCK_SIZE_N": 128,
        "BLOCK_SIZE_K": 64,
        "GROUP_SIZE_M": 8,
        "num_stages": 8,
        "num_warps": 2,
        "compile_time": 0.003559112548828125
    },
    {
        "BLOCK_SIZE_M": 64,
        "BLOCK_SIZE_N": 128,
        "BLOCK_SIZE_K": 64,
        "GROUP_SIZE_M": 8,
        "num_stages": 8,
        "num_warps": 4,
        "compile_time": 0.0027370452880859375
    },
    {
        "BLOCK_SIZE_M": 64,
        "BLOCK_SIZE_N": 128,
        "BLOCK_SIZE_K": 64,
        "GROUP_SIZE_M": 8,
        "num_stages": 8,
        "num_warps": 8,
        "compile_time": 0.0026798248291015625
    },
    {
        "BLOCK_SIZE_M": 64,
        "BLOCK_SIZE_N": 128,
        "BLOCK_SIZE_K": 64,
        "GROUP_SIZE_M": 8,
        "num_stages": 8,
        "num_warps": 16,
        "compile_time": 0.002572298049926758
    },
    {
        "BLOCK_SIZE_M": 64,
        "BLOCK_SIZE_N": 128,
        "BLOCK_SIZE_K": 64,
        "GROUP_SIZE_M": 8,
        "num_stages": 8,
        "num_warps": 32,
        "compile_time": 0.0025823116302490234
    },
    {
        "BLOCK_SIZE_M": 64,
        "BLOCK_SIZE_N": 128,
        "BLOCK_SIZE_K": 128,
        "GROUP_SIZE_M": 8,
        "num_stages": 5,
        "num_warps": 2,
        "compile_time": 0.003717660903930664
    },
    {
        "BLOCK_SIZE_M": 64,
        "BLOCK_SIZE_N": 128,
        "BLOCK_SIZE_K": 128,
        "GROUP_SIZE_M": 8,
        "num_stages": 5,
        "num_warps": 4,
        "compile_time": 0.0026688575744628906
    },
    {
        "BLOCK_SIZE_M": 64,
        "BLOCK_SIZE_N": 128,
        "BLOCK_SIZE_K": 128,
        "GROUP_SIZE_M": 8,
        "num_stages": 5,
        "num_warps": 8,
        "compile_time": 0.0026581287384033203
    },
    {
        "BLOCK_SIZE_M": 64,
        "BLOCK_SIZE_N": 128,
        "BLOCK_SIZE_K": 128,
        "GROUP_SIZE_M": 8,
        "num_stages": 5,
        "num_warps": 16,
        "compile_time": 0.0026090145111083984
    },
    {
        "BLOCK_SIZE_M": 64,
        "BLOCK_SIZE_N": 128,
        "BLOCK_SIZE_K": 128,
        "GROUP_SIZE_M": 8,
        "num_stages": 5,
        "num_warps": 32,
        "compile_time": 0.0024149417877197266
    },
    {
        "BLOCK_SIZE_M": 64,
        "BLOCK_SIZE_N": 128,
        "BLOCK_SIZE_K": 128,
        "GROUP_SIZE_M": 8,
        "num_stages": 6,
        "num_warps": 2,
        "compile_time": 0.0031375885009765625
    },
    {
        "BLOCK_SIZE_M": 64,
        "BLOCK_SIZE_N": 128,
        "BLOCK_SIZE_K": 128,
        "GROUP_SIZE_M": 8,
        "num_stages": 6,
        "num_warps": 4,
        "compile_time": 0.0028641223907470703
    },
    {
        "BLOCK_SIZE_M": 64,
        "BLOCK_SIZE_N": 128,
        "BLOCK_SIZE_K": 128,
        "GROUP_SIZE_M": 8,
        "num_stages": 6,
        "num_warps": 8,
        "compile_time": 0.0027306079864501953
    },
    {
        "BLOCK_SIZE_M": 64,
        "BLOCK_SIZE_N": 128,
        "BLOCK_SIZE_K": 128,
        "GROUP_SIZE_M": 8,
        "num_stages": 6,
        "num_warps": 16,
        "compile_time": 0.002626657485961914
    },
    {
        "BLOCK_SIZE_M": 64,
        "BLOCK_SIZE_N": 128,
        "BLOCK_SIZE_K": 128,
        "GROUP_SIZE_M": 8,
        "num_stages": 6,
        "num_warps": 32,
        "compile_time": 0.0026254653930664062
    },
    {
        "BLOCK_SIZE_M": 64,
        "BLOCK_SIZE_N": 128,
        "BLOCK_SIZE_K": 128,
        "GROUP_SIZE_M": 8,
        "num_stages": 7,
        "num_warps": 2,
        "compile_time": 0.003035306930541992
    },
    {
        "BLOCK_SIZE_M": 64,
        "BLOCK_SIZE_N": 128,
        "BLOCK_SIZE_K": 128,
        "GROUP_SIZE_M": 8,
        "num_stages": 7,
        "num_warps": 4,
        "compile_time": 0.0028142929077148438
    },
    {
        "BLOCK_SIZE_M": 64,
        "BLOCK_SIZE_N": 128,
        "BLOCK_SIZE_K": 128,
        "GROUP_SIZE_M": 8,
        "num_stages": 7,
        "num_warps": 8,
        "compile_time": 0.0027637481689453125
    },
    {
        "BLOCK_SIZE_M": 64,
        "BLOCK_SIZE_N": 128,
        "BLOCK_SIZE_K": 128,
        "GROUP_SIZE_M": 8,
        "num_stages": 7,
        "num_warps": 16,
        "compile_time": 0.0026383399963378906
    },
    {
        "BLOCK_SIZE_M": 64,
        "BLOCK_SIZE_N": 128,
        "BLOCK_SIZE_K": 128,
        "GROUP_SIZE_M": 8,
        "num_stages": 7,
        "num_warps": 32,
        "compile_time": 0.0025763511657714844
    },
    {
        "BLOCK_SIZE_M": 64,
        "BLOCK_SIZE_N": 128,
        "BLOCK_SIZE_K": 128,
        "GROUP_SIZE_M": 8,
        "num_stages": 8,
        "num_warps": 2,
        "compile_time": 0.0031740665435791016
    },
    {
        "BLOCK_SIZE_M": 64,
        "BLOCK_SIZE_N": 128,
        "BLOCK_SIZE_K": 128,
        "GROUP_SIZE_M": 8,
        "num_stages": 8,
        "num_warps": 4,
        "compile_time": 0.002885103225708008
    },
    {
        "BLOCK_SIZE_M": 64,
        "BLOCK_SIZE_N": 128,
        "BLOCK_SIZE_K": 128,
        "GROUP_SIZE_M": 8,
        "num_stages": 8,
        "num_warps": 8,
        "compile_time": 0.0027115345001220703
    },
    {
        "BLOCK_SIZE_M": 64,
        "BLOCK_SIZE_N": 128,
        "BLOCK_SIZE_K": 128,
        "GROUP_SIZE_M": 8,
        "num_stages": 8,
        "num_warps": 16,
        "compile_time": 0.003599882125854492
    },
    {
        "BLOCK_SIZE_M": 64,
        "BLOCK_SIZE_N": 128,
        "BLOCK_SIZE_K": 128,
        "GROUP_SIZE_M": 8,
        "num_stages": 8,
        "num_warps": 32,
        "compile_time": 0.00261688232421875
    },
    {
        "BLOCK_SIZE_M": 64,
        "BLOCK_SIZE_N": 128,
        "BLOCK_SIZE_K": 256,
        "GROUP_SIZE_M": 8,
        "num_stages": 3,
        "num_warps": 2,
        "compile_time": 13.402082443237305
    },
    {
        "BLOCK_SIZE_M": 64,
        "BLOCK_SIZE_N": 128,
        "BLOCK_SIZE_K": 256,
        "GROUP_SIZE_M": 8,
        "num_stages": 3,
        "num_warps": 4,
        "compile_time": 0.005667209625244141
    },
    {
        "BLOCK_SIZE_M": 64,
        "BLOCK_SIZE_N": 128,
        "BLOCK_SIZE_K": 256,
        "GROUP_SIZE_M": 8,
        "num_stages": 3,
        "num_warps": 8,
        "compile_time": 0.0030946731567382812
    },
    {
        "BLOCK_SIZE_M": 64,
        "BLOCK_SIZE_N": 128,
        "BLOCK_SIZE_K": 256,
        "GROUP_SIZE_M": 8,
        "num_stages": 3,
        "num_warps": 16,
        "compile_time": 0.002987384796142578
    },
    {
        "BLOCK_SIZE_M": 64,
        "BLOCK_SIZE_N": 128,
        "BLOCK_SIZE_K": 256,
        "GROUP_SIZE_M": 8,
        "num_stages": 3,
        "num_warps": 32,
        "compile_time": 0.0029726028442382812
    },
    {
        "BLOCK_SIZE_M": 64,
        "BLOCK_SIZE_N": 128,
        "BLOCK_SIZE_K": 256,
        "GROUP_SIZE_M": 8,
        "num_stages": 4,
        "num_warps": 2,
        "compile_time": 13.802148818969727
    },
    {
        "BLOCK_SIZE_M": 64,
        "BLOCK_SIZE_N": 128,
        "BLOCK_SIZE_K": 256,
        "GROUP_SIZE_M": 8,
        "num_stages": 4,
        "num_warps": 4,
        "compile_time": 0.0040128231048583984
    },
    {
        "BLOCK_SIZE_M": 64,
        "BLOCK_SIZE_N": 128,
        "BLOCK_SIZE_K": 256,
        "GROUP_SIZE_M": 8,
        "num_stages": 4,
        "num_warps": 8,
        "compile_time": 0.0032842159271240234
    },
    {
        "BLOCK_SIZE_M": 64,
        "BLOCK_SIZE_N": 128,
        "BLOCK_SIZE_K": 256,
        "GROUP_SIZE_M": 8,
        "num_stages": 4,
        "num_warps": 16,
        "compile_time": 0.003016948699951172
    },
    {
        "BLOCK_SIZE_M": 64,
        "BLOCK_SIZE_N": 128,
        "BLOCK_SIZE_K": 256,
        "GROUP_SIZE_M": 8,
        "num_stages": 4,
        "num_warps": 32,
        "compile_time": 0.0029985904693603516
    },
    {
        "BLOCK_SIZE_M": 64,
        "BLOCK_SIZE_N": 128,
        "BLOCK_SIZE_K": 256,
        "GROUP_SIZE_M": 8,
        "num_stages": 5,
        "num_warps": 2,
        "compile_time": 13.941798686981201
    },
    {
        "BLOCK_SIZE_M": 64,
        "BLOCK_SIZE_N": 128,
        "BLOCK_SIZE_K": 256,
        "GROUP_SIZE_M": 8,
        "num_stages": 5,
        "num_warps": 4,
        "compile_time": 0.0041773319244384766
    },
    {
        "BLOCK_SIZE_M": 64,
        "BLOCK_SIZE_N": 128,
        "BLOCK_SIZE_K": 256,
        "GROUP_SIZE_M": 8,
        "num_stages": 5,
        "num_warps": 8,
        "compile_time": 0.0030989646911621094
    },
    {
        "BLOCK_SIZE_M": 64,
        "BLOCK_SIZE_N": 128,
        "BLOCK_SIZE_K": 256,
        "GROUP_SIZE_M": 8,
        "num_stages": 5,
        "num_warps": 16,
        "compile_time": 0.004194498062133789
    },
    {
        "BLOCK_SIZE_M": 64,
        "BLOCK_SIZE_N": 128,
        "BLOCK_SIZE_K": 256,
        "GROUP_SIZE_M": 8,
        "num_stages": 5,
        "num_warps": 32,
        "compile_time": 0.0029952526092529297
    },
    {
        "BLOCK_SIZE_M": 64,
        "BLOCK_SIZE_N": 128,
        "BLOCK_SIZE_K": 256,
        "GROUP_SIZE_M": 8,
        "num_stages": 6,
        "num_warps": 2,
        "compile_time": 14.278104305267334
    },
    {
        "BLOCK_SIZE_M": 64,
        "BLOCK_SIZE_N": 128,
        "BLOCK_SIZE_K": 256,
        "GROUP_SIZE_M": 8,
        "num_stages": 6,
        "num_warps": 4,
        "compile_time": 0.004621744155883789
    },
    {
        "BLOCK_SIZE_M": 64,
        "BLOCK_SIZE_N": 128,
        "BLOCK_SIZE_K": 256,
        "GROUP_SIZE_M": 8,
        "num_stages": 6,
        "num_warps": 8,
        "compile_time": 0.0031609535217285156
    },
    {
        "BLOCK_SIZE_M": 64,
        "BLOCK_SIZE_N": 128,
        "BLOCK_SIZE_K": 256,
        "GROUP_SIZE_M": 8,
        "num_stages": 6,
        "num_warps": 16,
        "compile_time": 0.0030798912048339844
    },
    {
        "BLOCK_SIZE_M": 64,
        "BLOCK_SIZE_N": 128,
        "BLOCK_SIZE_K": 256,
        "GROUP_SIZE_M": 8,
        "num_stages": 6,
        "num_warps": 32,
        "compile_time": 0.0030450820922851562
    },
    {
        "BLOCK_SIZE_M": 64,
        "BLOCK_SIZE_N": 128,
        "BLOCK_SIZE_K": 256,
        "GROUP_SIZE_M": 8,
        "num_stages": 7,
        "num_warps": 2,
        "compile_time": 14.471888542175293
    },
    {
        "BLOCK_SIZE_M": 64,
        "BLOCK_SIZE_N": 128,
        "BLOCK_SIZE_K": 256,
        "GROUP_SIZE_M": 8,
        "num_stages": 7,
        "num_warps": 4,
        "compile_time": 0.00450587272644043
    },
    {
        "BLOCK_SIZE_M": 64,
        "BLOCK_SIZE_N": 128,
        "BLOCK_SIZE_K": 256,
        "GROUP_SIZE_M": 8,
        "num_stages": 7,
        "num_warps": 8,
        "compile_time": 0.0031995773315429688
    },
    {
        "BLOCK_SIZE_M": 64,
        "BLOCK_SIZE_N": 128,
        "BLOCK_SIZE_K": 256,
        "GROUP_SIZE_M": 8,
        "num_stages": 7,
        "num_warps": 16,
        "compile_time": 0.0030596256256103516
    },
    {
        "BLOCK_SIZE_M": 64,
        "BLOCK_SIZE_N": 128,
        "BLOCK_SIZE_K": 256,
        "GROUP_SIZE_M": 8,
        "num_stages": 7,
        "num_warps": 32,
        "compile_time": 0.0034873485565185547
    },
    {
        "BLOCK_SIZE_M": 64,
        "BLOCK_SIZE_N": 128,
        "BLOCK_SIZE_K": 256,
        "GROUP_SIZE_M": 8,
        "num_stages": 8,
        "num_warps": 2,
        "compile_time": 14.897321939468384
    },
    {
        "BLOCK_SIZE_M": 64,
        "BLOCK_SIZE_N": 128,
        "BLOCK_SIZE_K": 256,
        "GROUP_SIZE_M": 8,
        "num_stages": 8,
        "num_warps": 4,
        "compile_time": 0.004317760467529297
    },
    {
        "BLOCK_SIZE_M": 64,
        "BLOCK_SIZE_N": 128,
        "BLOCK_SIZE_K": 256,
        "GROUP_SIZE_M": 8,
        "num_stages": 8,
        "num_warps": 8,
        "compile_time": 0.0031867027282714844
    },
    {
        "BLOCK_SIZE_M": 64,
        "BLOCK_SIZE_N": 128,
        "BLOCK_SIZE_K": 256,
        "GROUP_SIZE_M": 8,
        "num_stages": 8,
        "num_warps": 16,
        "compile_time": 0.0030677318572998047
    },
    {
        "BLOCK_SIZE_M": 64,
        "BLOCK_SIZE_N": 128,
        "BLOCK_SIZE_K": 256,
        "GROUP_SIZE_M": 8,
        "num_stages": 8,
        "num_warps": 32,
        "compile_time": 0.0030617713928222656
    },
    {
        "BLOCK_SIZE_M": 64,
        "BLOCK_SIZE_N": 128,
        "BLOCK_SIZE_K": 512,
        "GROUP_SIZE_M": 8,
        "num_stages": 1,
        "num_warps": 2,
        "compile_time": 7.247840404510498
    },
    {
        "BLOCK_SIZE_M": 64,
        "BLOCK_SIZE_N": 128,
        "BLOCK_SIZE_K": 512,
        "GROUP_SIZE_M": 8,
        "num_stages": 1,
        "num_warps": 4,
        "compile_time": 0.004391908645629883
    },
    {
        "BLOCK_SIZE_M": 64,
        "BLOCK_SIZE_N": 128,
        "BLOCK_SIZE_K": 512,
        "GROUP_SIZE_M": 8,
        "num_stages": 1,
        "num_warps": 8,
        "compile_time": 0.0030317306518554688
    },
    {
        "BLOCK_SIZE_M": 64,
        "BLOCK_SIZE_N": 128,
        "BLOCK_SIZE_K": 512,
        "GROUP_SIZE_M": 8,
        "num_stages": 1,
        "num_warps": 16,
        "compile_time": 0.002831697463989258
    },
    {
        "BLOCK_SIZE_M": 64,
        "BLOCK_SIZE_N": 128,
        "BLOCK_SIZE_K": 512,
        "GROUP_SIZE_M": 8,
        "num_stages": 1,
        "num_warps": 32,
        "compile_time": 0.0028107166290283203
    },
    {
        "BLOCK_SIZE_M": 64,
        "BLOCK_SIZE_N": 128,
        "BLOCK_SIZE_K": 512,
        "GROUP_SIZE_M": 8,
        "num_stages": 2,
        "num_warps": 2,
        "compile_time": 7.395083904266357
    },
    {
        "BLOCK_SIZE_M": 64,
        "BLOCK_SIZE_N": 128,
        "BLOCK_SIZE_K": 512,
        "GROUP_SIZE_M": 8,
        "num_stages": 2,
        "num_warps": 4,
        "compile_time": 0.0037424564361572266
    },
    {
        "BLOCK_SIZE_M": 64,
        "BLOCK_SIZE_N": 128,
        "BLOCK_SIZE_K": 512,
        "GROUP_SIZE_M": 8,
        "num_stages": 2,
        "num_warps": 8,
        "compile_time": 0.0037682056427001953
    },
    {
        "BLOCK_SIZE_M": 64,
        "BLOCK_SIZE_N": 128,
        "BLOCK_SIZE_K": 512,
        "GROUP_SIZE_M": 8,
        "num_stages": 2,
        "num_warps": 16,
        "compile_time": 0.0028395652770996094
    },
    {
        "BLOCK_SIZE_M": 64,
        "BLOCK_SIZE_N": 128,
        "BLOCK_SIZE_K": 512,
        "GROUP_SIZE_M": 8,
        "num_stages": 2,
        "num_warps": 32,
        "compile_time": 0.0028238296508789062
    },
    {
        "BLOCK_SIZE_M": 64,
        "BLOCK_SIZE_N": 128,
        "BLOCK_SIZE_K": 512,
        "GROUP_SIZE_M": 8,
        "num_stages": 3,
        "num_warps": 2,
        "compile_time": 7.835781097412109
    },
    {
        "BLOCK_SIZE_M": 64,
        "BLOCK_SIZE_N": 128,
        "BLOCK_SIZE_K": 512,
        "GROUP_SIZE_M": 8,
        "num_stages": 3,
        "num_warps": 4,
        "compile_time": 13.426396608352661
    },
    {
        "BLOCK_SIZE_M": 64,
        "BLOCK_SIZE_N": 128,
        "BLOCK_SIZE_K": 512,
        "GROUP_SIZE_M": 8,
        "num_stages": 3,
        "num_warps": 8,
        "compile_time": 0.004155158996582031
    },
    {
        "BLOCK_SIZE_M": 64,
        "BLOCK_SIZE_N": 128,
        "BLOCK_SIZE_K": 512,
        "GROUP_SIZE_M": 8,
        "num_stages": 3,
        "num_warps": 16,
        "compile_time": 0.0038530826568603516
    },
    {
        "BLOCK_SIZE_M": 64,
        "BLOCK_SIZE_N": 128,
        "BLOCK_SIZE_K": 512,
        "GROUP_SIZE_M": 8,
        "num_stages": 3,
        "num_warps": 32,
        "compile_time": 0.0028166770935058594
    },
    {
        "BLOCK_SIZE_M": 64,
        "BLOCK_SIZE_N": 128,
        "BLOCK_SIZE_K": 512,
        "GROUP_SIZE_M": 8,
        "num_stages": 4,
        "num_warps": 2,
        "compile_time": 8.343635082244873
    },
    {
        "BLOCK_SIZE_M": 64,
        "BLOCK_SIZE_N": 128,
        "BLOCK_SIZE_K": 512,
        "GROUP_SIZE_M": 8,
        "num_stages": 4,
        "num_warps": 4,
        "compile_time": 13.684825420379639
    },
    {
        "BLOCK_SIZE_M": 64,
        "BLOCK_SIZE_N": 128,
        "BLOCK_SIZE_K": 512,
        "GROUP_SIZE_M": 8,
        "num_stages": 4,
        "num_warps": 8,
        "compile_time": 0.0037267208099365234
    },
    {
        "BLOCK_SIZE_M": 64,
        "BLOCK_SIZE_N": 128,
        "BLOCK_SIZE_K": 512,
        "GROUP_SIZE_M": 8,
        "num_stages": 4,
        "num_warps": 16,
        "compile_time": 0.0029048919677734375
    },
    {
        "BLOCK_SIZE_M": 64,
        "BLOCK_SIZE_N": 128,
        "BLOCK_SIZE_K": 512,
        "GROUP_SIZE_M": 8,
        "num_stages": 4,
        "num_warps": 32,
        "compile_time": 0.0039746761322021484
    },
    {
        "BLOCK_SIZE_M": 64,
        "BLOCK_SIZE_N": 128,
        "BLOCK_SIZE_K": 512,
        "GROUP_SIZE_M": 8,
        "num_stages": 5,
        "num_warps": 2,
        "compile_time": 8.908519268035889
    },
    {
        "BLOCK_SIZE_M": 64,
        "BLOCK_SIZE_N": 128,
        "BLOCK_SIZE_K": 512,
        "GROUP_SIZE_M": 8,
        "num_stages": 5,
        "num_warps": 4,
        "compile_time": 12.997272729873657
    },
    {
        "BLOCK_SIZE_M": 64,
        "BLOCK_SIZE_N": 128,
        "BLOCK_SIZE_K": 512,
        "GROUP_SIZE_M": 8,
        "num_stages": 5,
        "num_warps": 8,
        "compile_time": 0.004267692565917969
    },
    {
        "BLOCK_SIZE_M": 64,
        "BLOCK_SIZE_N": 128,
        "BLOCK_SIZE_K": 512,
        "GROUP_SIZE_M": 8,
        "num_stages": 5,
        "num_warps": 16,
        "compile_time": 0.002948284149169922
    },
    {
        "BLOCK_SIZE_M": 64,
        "BLOCK_SIZE_N": 128,
        "BLOCK_SIZE_K": 512,
        "GROUP_SIZE_M": 8,
        "num_stages": 5,
        "num_warps": 32,
        "compile_time": 0.0028383731842041016
    },
    {
        "BLOCK_SIZE_M": 64,
        "BLOCK_SIZE_N": 128,
        "BLOCK_SIZE_K": 512,
        "GROUP_SIZE_M": 8,
        "num_stages": 6,
        "num_warps": 2,
        "compile_time": 9.411683559417725
    },
    {
        "BLOCK_SIZE_M": 64,
        "BLOCK_SIZE_N": 128,
        "BLOCK_SIZE_K": 512,
        "GROUP_SIZE_M": 8,
        "num_stages": 6,
        "num_warps": 4,
        "compile_time": 13.04671025276184
    },
    {
        "BLOCK_SIZE_M": 64,
        "BLOCK_SIZE_N": 128,
        "BLOCK_SIZE_K": 512,
        "GROUP_SIZE_M": 8,
        "num_stages": 6,
        "num_warps": 8,
        "compile_time": 0.003802776336669922
    },
    {
        "BLOCK_SIZE_M": 64,
        "BLOCK_SIZE_N": 128,
        "BLOCK_SIZE_K": 512,
        "GROUP_SIZE_M": 8,
        "num_stages": 6,
        "num_warps": 16,
        "compile_time": 0.003000974655151367
    },
    {
        "BLOCK_SIZE_M": 64,
        "BLOCK_SIZE_N": 128,
        "BLOCK_SIZE_K": 512,
        "GROUP_SIZE_M": 8,
        "num_stages": 6,
        "num_warps": 32,
        "compile_time": 0.0028548240661621094
    },
    {
        "BLOCK_SIZE_M": 64,
        "BLOCK_SIZE_N": 128,
        "BLOCK_SIZE_K": 512,
        "GROUP_SIZE_M": 8,
        "num_stages": 7,
        "num_warps": 2,
        "compile_time": 9.81942892074585
    },
    {
        "BLOCK_SIZE_M": 64,
        "BLOCK_SIZE_N": 128,
        "BLOCK_SIZE_K": 512,
        "GROUP_SIZE_M": 8,
        "num_stages": 7,
        "num_warps": 4,
        "compile_time": 13.751101970672607
    },
    {
        "BLOCK_SIZE_M": 64,
        "BLOCK_SIZE_N": 128,
        "BLOCK_SIZE_K": 512,
        "GROUP_SIZE_M": 8,
        "num_stages": 7,
        "num_warps": 8,
        "compile_time": 0.00455021858215332
    },
    {
        "BLOCK_SIZE_M": 64,
        "BLOCK_SIZE_N": 128,
        "BLOCK_SIZE_K": 512,
        "GROUP_SIZE_M": 8,
        "num_stages": 7,
        "num_warps": 16,
        "compile_time": 0.003019571304321289
    },
    {
        "BLOCK_SIZE_M": 64,
        "BLOCK_SIZE_N": 128,
        "BLOCK_SIZE_K": 512,
        "GROUP_SIZE_M": 8,
        "num_stages": 7,
        "num_warps": 32,
        "compile_time": 0.0028510093688964844
    },
    {
        "BLOCK_SIZE_M": 64,
        "BLOCK_SIZE_N": 128,
        "BLOCK_SIZE_K": 512,
        "GROUP_SIZE_M": 8,
        "num_stages": 8,
        "num_warps": 2,
        "compile_time": 10.285235404968262
    },
    {
        "BLOCK_SIZE_M": 64,
        "BLOCK_SIZE_N": 128,
        "BLOCK_SIZE_K": 512,
        "GROUP_SIZE_M": 8,
        "num_stages": 8,
        "num_warps": 4,
        "compile_time": 14.102001905441284
    },
    {
        "BLOCK_SIZE_M": 64,
        "BLOCK_SIZE_N": 128,
        "BLOCK_SIZE_K": 512,
        "GROUP_SIZE_M": 8,
        "num_stages": 8,
        "num_warps": 8,
        "compile_time": 0.005301713943481445
    },
    {
        "BLOCK_SIZE_M": 64,
        "BLOCK_SIZE_N": 128,
        "BLOCK_SIZE_K": 512,
        "GROUP_SIZE_M": 8,
        "num_stages": 8,
        "num_warps": 16,
        "compile_time": 0.00366973876953125
    },
    {
        "BLOCK_SIZE_M": 64,
        "BLOCK_SIZE_N": 128,
        "BLOCK_SIZE_K": 512,
        "GROUP_SIZE_M": 8,
        "num_stages": 8,
        "num_warps": 32,
        "compile_time": 0.006731986999511719
    },
    {
        "BLOCK_SIZE_M": 64,
        "BLOCK_SIZE_N": 256,
        "BLOCK_SIZE_K": 64,
        "GROUP_SIZE_M": 8,
        "num_stages": 6,
        "num_warps": 2,
        "compile_time": 0.0036945343017578125
    },
    {
        "BLOCK_SIZE_M": 64,
        "BLOCK_SIZE_N": 256,
        "BLOCK_SIZE_K": 64,
        "GROUP_SIZE_M": 8,
        "num_stages": 6,
        "num_warps": 4,
        "compile_time": 0.0026874542236328125
    },
    {
        "BLOCK_SIZE_M": 64,
        "BLOCK_SIZE_N": 256,
        "BLOCK_SIZE_K": 64,
        "GROUP_SIZE_M": 8,
        "num_stages": 6,
        "num_warps": 8,
        "compile_time": 0.0026350021362304688
    },
    {
        "BLOCK_SIZE_M": 64,
        "BLOCK_SIZE_N": 256,
        "BLOCK_SIZE_K": 64,
        "GROUP_SIZE_M": 8,
        "num_stages": 6,
        "num_warps": 16,
        "compile_time": 0.0033152103424072266
    },
    {
        "BLOCK_SIZE_M": 64,
        "BLOCK_SIZE_N": 256,
        "BLOCK_SIZE_K": 64,
        "GROUP_SIZE_M": 8,
        "num_stages": 6,
        "num_warps": 32,
        "compile_time": 0.002602100372314453
    },
    {
        "BLOCK_SIZE_M": 64,
        "BLOCK_SIZE_N": 256,
        "BLOCK_SIZE_K": 64,
        "GROUP_SIZE_M": 8,
        "num_stages": 7,
        "num_warps": 2,
        "compile_time": 0.0030202865600585938
    },
    {
        "BLOCK_SIZE_M": 64,
        "BLOCK_SIZE_N": 256,
        "BLOCK_SIZE_K": 64,
        "GROUP_SIZE_M": 8,
        "num_stages": 7,
        "num_warps": 4,
        "compile_time": 0.0027742385864257812
    },
    {
        "BLOCK_SIZE_M": 64,
        "BLOCK_SIZE_N": 256,
        "BLOCK_SIZE_K": 64,
        "GROUP_SIZE_M": 8,
        "num_stages": 7,
        "num_warps": 8,
        "compile_time": 0.0027604103088378906
    },
    {
        "BLOCK_SIZE_M": 64,
        "BLOCK_SIZE_N": 256,
        "BLOCK_SIZE_K": 64,
        "GROUP_SIZE_M": 8,
        "num_stages": 7,
        "num_warps": 16,
        "compile_time": 0.0026276111602783203
    },
    {
        "BLOCK_SIZE_M": 64,
        "BLOCK_SIZE_N": 256,
        "BLOCK_SIZE_K": 64,
        "GROUP_SIZE_M": 8,
        "num_stages": 7,
        "num_warps": 32,
        "compile_time": 0.002597332000732422
    },
    {
        "BLOCK_SIZE_M": 64,
        "BLOCK_SIZE_N": 256,
        "BLOCK_SIZE_K": 64,
        "GROUP_SIZE_M": 8,
        "num_stages": 8,
        "num_warps": 2,
        "compile_time": 0.003136873245239258
    },
    {
        "BLOCK_SIZE_M": 64,
        "BLOCK_SIZE_N": 256,
        "BLOCK_SIZE_K": 64,
        "GROUP_SIZE_M": 8,
        "num_stages": 8,
        "num_warps": 4,
        "compile_time": 0.0028314590454101562
    },
    {
        "BLOCK_SIZE_M": 64,
        "BLOCK_SIZE_N": 256,
        "BLOCK_SIZE_K": 64,
        "GROUP_SIZE_M": 8,
        "num_stages": 8,
        "num_warps": 8,
        "compile_time": 0.002674102783203125
    },
    {
        "BLOCK_SIZE_M": 64,
        "BLOCK_SIZE_N": 256,
        "BLOCK_SIZE_K": 64,
        "GROUP_SIZE_M": 8,
        "num_stages": 8,
        "num_warps": 16,
        "compile_time": 0.0026226043701171875
    },
    {
        "BLOCK_SIZE_M": 64,
        "BLOCK_SIZE_N": 256,
        "BLOCK_SIZE_K": 64,
        "GROUP_SIZE_M": 8,
        "num_stages": 8,
        "num_warps": 32,
        "compile_time": 0.0026102066040039062
    },
    {
        "BLOCK_SIZE_M": 64,
        "BLOCK_SIZE_N": 256,
        "BLOCK_SIZE_K": 128,
        "GROUP_SIZE_M": 8,
        "num_stages": 3,
        "num_warps": 2,
        "compile_time": 12.734272956848145
    },
    {
        "BLOCK_SIZE_M": 64,
        "BLOCK_SIZE_N": 256,
        "BLOCK_SIZE_K": 128,
        "GROUP_SIZE_M": 8,
        "num_stages": 4,
        "num_warps": 2,
        "compile_time": 12.874615907669067
    },
    {
        "BLOCK_SIZE_M": 64,
        "BLOCK_SIZE_N": 256,
        "BLOCK_SIZE_K": 128,
        "GROUP_SIZE_M": 8,
        "num_stages": 4,
        "num_warps": 4,
        "compile_time": 0.004916667938232422
    },
    {
        "BLOCK_SIZE_M": 64,
        "BLOCK_SIZE_N": 256,
        "BLOCK_SIZE_K": 128,
        "GROUP_SIZE_M": 8,
        "num_stages": 4,
        "num_warps": 8,
        "compile_time": 0.003160715103149414
    },
    {
        "BLOCK_SIZE_M": 64,
        "BLOCK_SIZE_N": 256,
        "BLOCK_SIZE_K": 128,
        "GROUP_SIZE_M": 8,
        "num_stages": 4,
        "num_warps": 16,
        "compile_time": 0.0030477046966552734
    },
    {
        "BLOCK_SIZE_M": 64,
        "BLOCK_SIZE_N": 256,
        "BLOCK_SIZE_K": 128,
        "GROUP_SIZE_M": 8,
        "num_stages": 4,
        "num_warps": 32,
        "compile_time": 0.0029850006103515625
    },
    {
        "BLOCK_SIZE_M": 64,
        "BLOCK_SIZE_N": 256,
        "BLOCK_SIZE_K": 128,
        "GROUP_SIZE_M": 8,
        "num_stages": 5,
        "num_warps": 2,
        "compile_time": 13.28057074546814
    },
    {
        "BLOCK_SIZE_M": 64,
        "BLOCK_SIZE_N": 256,
        "BLOCK_SIZE_K": 128,
        "GROUP_SIZE_M": 8,
        "num_stages": 5,
        "num_warps": 4,
        "compile_time": 0.0043408870697021484
    },
    {
        "BLOCK_SIZE_M": 64,
        "BLOCK_SIZE_N": 256,
        "BLOCK_SIZE_K": 128,
        "GROUP_SIZE_M": 8,
        "num_stages": 5,
        "num_warps": 8,
        "compile_time": 0.004275798797607422
    },
    {
        "BLOCK_SIZE_M": 64,
        "BLOCK_SIZE_N": 256,
        "BLOCK_SIZE_K": 128,
        "GROUP_SIZE_M": 8,
        "num_stages": 5,
        "num_warps": 16,
        "compile_time": 0.003048419952392578
    },
    {
        "BLOCK_SIZE_M": 64,
        "BLOCK_SIZE_N": 256,
        "BLOCK_SIZE_K": 128,
        "GROUP_SIZE_M": 8,
        "num_stages": 5,
        "num_warps": 32,
        "compile_time": 0.0030472278594970703
    },
    {
        "BLOCK_SIZE_M": 64,
        "BLOCK_SIZE_N": 256,
        "BLOCK_SIZE_K": 128,
        "GROUP_SIZE_M": 8,
        "num_stages": 6,
        "num_warps": 2,
        "compile_time": 13.588756322860718
    },
    {
        "BLOCK_SIZE_M": 64,
        "BLOCK_SIZE_N": 256,
        "BLOCK_SIZE_K": 128,
        "GROUP_SIZE_M": 8,
        "num_stages": 6,
        "num_warps": 4,
        "compile_time": 0.0041272640228271484
    },
    {
        "BLOCK_SIZE_M": 64,
        "BLOCK_SIZE_N": 256,
        "BLOCK_SIZE_K": 128,
        "GROUP_SIZE_M": 8,
        "num_stages": 6,
        "num_warps": 8,
        "compile_time": 0.0032160282135009766
    },
    {
        "BLOCK_SIZE_M": 64,
        "BLOCK_SIZE_N": 256,
        "BLOCK_SIZE_K": 128,
        "GROUP_SIZE_M": 8,
        "num_stages": 6,
        "num_warps": 16,
        "compile_time": 0.0030481815338134766
    },
    {
        "BLOCK_SIZE_M": 64,
        "BLOCK_SIZE_N": 256,
        "BLOCK_SIZE_K": 128,
        "GROUP_SIZE_M": 8,
        "num_stages": 6,
        "num_warps": 32,
        "compile_time": 0.0030121803283691406
    },
    {
        "BLOCK_SIZE_M": 64,
        "BLOCK_SIZE_N": 256,
        "BLOCK_SIZE_K": 128,
        "GROUP_SIZE_M": 8,
        "num_stages": 7,
        "num_warps": 2,
        "compile_time": 13.575131177902222
    },
    {
        "BLOCK_SIZE_M": 64,
        "BLOCK_SIZE_N": 256,
        "BLOCK_SIZE_K": 128,
        "GROUP_SIZE_M": 8,
        "num_stages": 7,
        "num_warps": 4,
        "compile_time": 0.004717588424682617
    },
    {
        "BLOCK_SIZE_M": 64,
        "BLOCK_SIZE_N": 256,
        "BLOCK_SIZE_K": 128,
        "GROUP_SIZE_M": 8,
        "num_stages": 7,
        "num_warps": 8,
        "compile_time": 0.0032050609588623047
    },
    {
        "BLOCK_SIZE_M": 64,
        "BLOCK_SIZE_N": 256,
        "BLOCK_SIZE_K": 128,
        "GROUP_SIZE_M": 8,
        "num_stages": 7,
        "num_warps": 16,
        "compile_time": 0.0041751861572265625
    },
    {
        "BLOCK_SIZE_M": 64,
        "BLOCK_SIZE_N": 256,
        "BLOCK_SIZE_K": 128,
        "GROUP_SIZE_M": 8,
        "num_stages": 7,
        "num_warps": 32,
        "compile_time": 0.003049612045288086
    },
    {
        "BLOCK_SIZE_M": 64,
        "BLOCK_SIZE_N": 256,
        "BLOCK_SIZE_K": 128,
        "GROUP_SIZE_M": 8,
        "num_stages": 8,
        "num_warps": 2,
        "compile_time": 13.861769199371338
    },
    {
        "BLOCK_SIZE_M": 64,
        "BLOCK_SIZE_N": 256,
        "BLOCK_SIZE_K": 128,
        "GROUP_SIZE_M": 8,
        "num_stages": 8,
        "num_warps": 4,
        "compile_time": 0.004477977752685547
    },
    {
        "BLOCK_SIZE_M": 64,
        "BLOCK_SIZE_N": 256,
        "BLOCK_SIZE_K": 128,
        "GROUP_SIZE_M": 8,
        "num_stages": 8,
        "num_warps": 8,
        "compile_time": 0.003190279006958008
    },
    {
        "BLOCK_SIZE_M": 64,
        "BLOCK_SIZE_N": 256,
        "BLOCK_SIZE_K": 128,
        "GROUP_SIZE_M": 8,
        "num_stages": 8,
        "num_warps": 16,
        "compile_time": 0.003070831298828125
    },
    {
        "BLOCK_SIZE_M": 64,
        "BLOCK_SIZE_N": 256,
        "BLOCK_SIZE_K": 128,
        "GROUP_SIZE_M": 8,
        "num_stages": 8,
        "num_warps": 32,
        "compile_time": 0.0038814544677734375
    },
    {
        "BLOCK_SIZE_M": 64,
        "BLOCK_SIZE_N": 256,
        "BLOCK_SIZE_K": 256,
        "GROUP_SIZE_M": 8,
        "num_stages": 1,
        "num_warps": 2,
        "compile_time": 6.273119211196899
    },
    {
        "BLOCK_SIZE_M": 64,
        "BLOCK_SIZE_N": 256,
        "BLOCK_SIZE_K": 256,
        "GROUP_SIZE_M": 8,
        "num_stages": 2,
        "num_warps": 2,
        "compile_time": 6.444757699966431
    },
    {
        "BLOCK_SIZE_M": 64,
        "BLOCK_SIZE_N": 256,
        "BLOCK_SIZE_K": 256,
        "GROUP_SIZE_M": 8,
        "num_stages": 3,
        "num_warps": 2,
