simdata/FP16-R100/8192_fails.json
[
    {
        "BLOCK_SIZE_M": 16,
        "BLOCK_SIZE_N": 16,
        "BLOCK_SIZE_K": 16,
        "GROUP_SIZE_M": 8,
        "num_stages": 1,
        "num_warps": 32,
        "compile_time": 6.0498268604278564
    },
    {
        "BLOCK_SIZE_M": 16,
        "BLOCK_SIZE_N": 16,
        "BLOCK_SIZE_K": 16,
        "GROUP_SIZE_M": 8,
        "num_stages": 2,
        "num_warps": 32,
        "compile_time": 6.043883323669434
    },
    {
        "BLOCK_SIZE_M": 16,
        "BLOCK_SIZE_N": 16,
        "BLOCK_SIZE_K": 16,
        "GROUP_SIZE_M": 8,
        "num_stages": 3,
        "num_warps": 32,
        "compile_time": 6.044804811477661
    },
    {
        "BLOCK_SIZE_M": 16,
        "BLOCK_SIZE_N": 16,
        "BLOCK_SIZE_K": 16,
        "GROUP_SIZE_M": 8,
        "num_stages": 4,
        "num_warps": 32,
        "compile_time": 6.329988479614258
    },
    {
        "BLOCK_SIZE_M": 16,
        "BLOCK_SIZE_N": 16,
        "BLOCK_SIZE_K": 16,
        "GROUP_SIZE_M": 8,
        "num_stages": 5,
        "num_warps": 32,
        "compile_time": 6.299384832382202
    },
    {
        "BLOCK_SIZE_M": 16,
        "BLOCK_SIZE_N": 16,
        "BLOCK_SIZE_K": 16,
        "GROUP_SIZE_M": 8,
        "num_stages": 6,
        "num_warps": 32,
        "compile_time": 6.215729236602783
    },
    {
        "BLOCK_SIZE_M": 16,
        "BLOCK_SIZE_N": 16,
        "BLOCK_SIZE_K": 16,
        "GROUP_SIZE_M": 8,
        "num_stages": 7,
        "num_warps": 32,
        "compile_time": 6.172026634216309
    },
    {
        "BLOCK_SIZE_M": 16,
        "BLOCK_SIZE_N": 16,
        "BLOCK_SIZE_K": 16,
        "GROUP_SIZE_M": 8,
        "num_stages": 8,
        "num_warps": 32,
        "compile_time": 6.09363055229187
    },
    {
        "BLOCK_SIZE_M": 16,
        "BLOCK_SIZE_N": 16,
        "BLOCK_SIZE_K": 512,
        "GROUP_SIZE_M": 8,
        "num_stages": 7,
        "num_warps": 2,
        "compile_time": 1.4316363334655762
    },
    {
        "BLOCK_SIZE_M": 16,
        "BLOCK_SIZE_N": 16,
        "BLOCK_SIZE_K": 512,
        "GROUP_SIZE_M": 8,
        "num_stages": 7,
        "num_warps": 4,
        "compile_time": 0.8566389083862305
    },
    {
        "BLOCK_SIZE_M": 16,
        "BLOCK_SIZE_N": 16,
        "BLOCK_SIZE_K": 512,
        "GROUP_SIZE_M": 8,
        "num_stages": 7,
        "num_warps": 8,
        "compile_time": 0.6458158493041992
    },
    {
        "BLOCK_SIZE_M": 16,
        "BLOCK_SIZE_N": 16,
        "BLOCK_SIZE_K": 512,
        "GROUP_SIZE_M": 8,
        "num_stages": 7,
        "num_warps": 16,
        "compile_time": 0.5390346050262451
    },
    {
        "BLOCK_SIZE_M": 16,
        "BLOCK_SIZE_N": 16,
        "BLOCK_SIZE_K": 512,
        "GROUP_SIZE_M": 8,
        "num_stages": 7,
        "num_warps": 32,
        "compile_time": 0.4878056049346924
    },
    {
        "BLOCK_SIZE_M": 16,
        "BLOCK_SIZE_N": 16,
        "BLOCK_SIZE_K": 512,
        "GROUP_SIZE_M": 8,
        "num_stages": 8,
        "num_warps": 2,
        "compile_time": 1.5250086784362793
    },
    {
        "BLOCK_SIZE_M": 16,
        "BLOCK_SIZE_N": 16,
        "BLOCK_SIZE_K": 512,
        "GROUP_SIZE_M": 8,
        "num_stages": 8,
        "num_warps": 4,
        "compile_time": 0.9100267887115479
    },
    {
        "BLOCK_SIZE_M": 16,
        "BLOCK_SIZE_N": 16,
        "BLOCK_SIZE_K": 512,
        "GROUP_SIZE_M": 8,
        "num_stages": 8,
        "num_warps": 8,
        "compile_time": 0.6505670547485352
    },
    {
        "BLOCK_SIZE_M": 16,
        "BLOCK_SIZE_N": 16,
        "BLOCK_SIZE_K": 512,
        "GROUP_SIZE_M": 8,
        "num_stages": 8,
        "num_warps": 16,
        "compile_time": 0.5300869941711426
    },
    {
        "BLOCK_SIZE_M": 16,
        "BLOCK_SIZE_N": 16,
        "BLOCK_SIZE_K": 512,
        "GROUP_SIZE_M": 8,
        "num_stages": 8,
        "num_warps": 32,
        "compile_time": 0.49593663215637207
    },
    {
        "BLOCK_SIZE_M": 16,
        "BLOCK_SIZE_N": 32,
        "BLOCK_SIZE_K": 256,
        "GROUP_SIZE_M": 8,
        "num_stages": 8,
        "num_warps": 2,
        "compile_time": 1.2034285068511963
    },
    {
        "BLOCK_SIZE_M": 16,
        "BLOCK_SIZE_N": 32,
        "BLOCK_SIZE_K": 256,
        "GROUP_SIZE_M": 8,
        "num_stages": 8,
        "num_warps": 4,
        "compile_time": 0.7450761795043945
    },
    {
        "BLOCK_SIZE_M": 16,
        "BLOCK_SIZE_N": 32,
        "BLOCK_SIZE_K": 256,
        "GROUP_SIZE_M": 8,
        "num_stages": 8,
        "num_warps": 8,
        "compile_time": 0.5400791168212891
    },
    {
        "BLOCK_SIZE_M": 16,
        "BLOCK_SIZE_N": 32,
        "BLOCK_SIZE_K": 256,
        "GROUP_SIZE_M": 8,
        "num_stages": 8,
        "num_warps": 16,
        "compile_time": 0.4463472366333008
    },
    {
        "BLOCK_SIZE_M": 16,
        "BLOCK_SIZE_N": 32,
        "BLOCK_SIZE_K": 256,
        "GROUP_SIZE_M": 8,
        "num_stages": 8,
        "num_warps": 32,
        "compile_time": 0.40436363220214844
    },
    {
        "BLOCK_SIZE_M": 16,
        "BLOCK_SIZE_N": 32,
        "BLOCK_SIZE_K": 512,
        "GROUP_SIZE_M": 8,
        "num_stages": 5,
        "num_warps": 2,
        "compile_time": 2.402681827545166
    },
    {
        "BLOCK_SIZE_M": 16,
        "BLOCK_SIZE_N": 32,
        "BLOCK_SIZE_K": 512,
        "GROUP_SIZE_M": 8,
        "num_stages": 5,
        "num_warps": 4,
        "compile_time": 1.0701425075531006
    },
    {
        "BLOCK_SIZE_M": 16,
        "BLOCK_SIZE_N": 32,
        "BLOCK_SIZE_K": 512,
        "GROUP_SIZE_M": 8,
        "num_stages": 5,
        "num_warps": 8,
        "compile_time": 0.7148747444152832
    },
    {
        "BLOCK_SIZE_M": 16,
        "BLOCK_SIZE_N": 32,
        "BLOCK_SIZE_K": 512,
        "GROUP_SIZE_M": 8,
        "num_stages": 5,
        "num_warps": 16,
        "compile_time": 0.5857565402984619
    },
    {
        "BLOCK_SIZE_M": 16,
        "BLOCK_SIZE_N": 32,
        "BLOCK_SIZE_K": 512,
        "GROUP_SIZE_M": 8,
        "num_stages": 5,
        "num_warps": 32,
        "compile_time": 0.5124430656433105
    },
    {
        "BLOCK_SIZE_M": 16,
        "BLOCK_SIZE_N": 32,
        "BLOCK_SIZE_K": 512,
        "GROUP_SIZE_M": 8,
        "num_stages": 6,
        "num_warps": 2,
        "compile_time": 2.5735690593719482
    },
    {
        "BLOCK_SIZE_M": 16,
        "BLOCK_SIZE_N": 32,
        "BLOCK_SIZE_K": 512,
        "GROUP_SIZE_M": 8,
        "num_stages": 6,
        "num_warps": 4,
        "compile_time": 1.1303198337554932
    },
    {
        "BLOCK_SIZE_M": 16,
        "BLOCK_SIZE_N": 32,
        "BLOCK_SIZE_K": 512,
        "GROUP_SIZE_M": 8,
        "num_stages": 6,
        "num_warps": 8,
        "compile_time": 0.754596471786499
    },
    {
        "BLOCK_SIZE_M": 16,
        "BLOCK_SIZE_N": 32,
        "BLOCK_SIZE_K": 512,
        "GROUP_SIZE_M": 8,
        "num_stages": 6,
        "num_warps": 16,
        "compile_time": 0.6014049053192139
    },
    {
        "BLOCK_SIZE_M": 16,
        "BLOCK_SIZE_N": 32,
        "BLOCK_SIZE_K": 512,
        "GROUP_SIZE_M": 8,
        "num_stages": 6,
        "num_warps": 32,
        "compile_time": 0.5279004573822021
    },
    {
        "BLOCK_SIZE_M": 16,
        "BLOCK_SIZE_N": 32,
        "BLOCK_SIZE_K": 512,
        "GROUP_SIZE_M": 8,
        "num_stages": 7,
        "num_warps": 2,
        "compile_time": 2.7827606201171875
    },
    {
        "BLOCK_SIZE_M": 16,
        "BLOCK_SIZE_N": 32,
        "BLOCK_SIZE_K": 512,
        "GROUP_SIZE_M": 8,
        "num_stages": 7,
        "num_warps": 4,
        "compile_time": 1.2568790912628174
    },
    {
        "BLOCK_SIZE_M": 16,
        "BLOCK_SIZE_N": 32,
        "BLOCK_SIZE_K": 512,
        "GROUP_SIZE_M": 8,
        "num_stages": 7,
        "num_warps": 8,
        "compile_time": 0.8054046630859375
    },
    {
        "BLOCK_SIZE_M": 16,
        "BLOCK_SIZE_N": 32,
        "BLOCK_SIZE_K": 512,
        "GROUP_SIZE_M": 8,
        "num_stages": 7,
        "num_warps": 16,
        "compile_time": 0.6357238292694092
    },
    {
        "BLOCK_SIZE_M": 16,
        "BLOCK_SIZE_N": 32,
        "BLOCK_SIZE_K": 512,
        "GROUP_SIZE_M": 8,
        "num_stages": 7,
        "num_warps": 32,
        "compile_time": 0.5427839756011963
    },
    {
        "BLOCK_SIZE_M": 16,
        "BLOCK_SIZE_N": 32,
        "BLOCK_SIZE_K": 512,
        "GROUP_SIZE_M": 8,
        "num_stages": 8,
        "num_warps": 2,
        "compile_time": 2.8370566368103027
    },
    {
        "BLOCK_SIZE_M": 16,
        "BLOCK_SIZE_N": 32,
        "BLOCK_SIZE_K": 512,
        "GROUP_SIZE_M": 8,
        "num_stages": 8,
        "num_warps": 4,
        "compile_time": 1.3205368518829346
    },
    {
        "BLOCK_SIZE_M": 16,
        "BLOCK_SIZE_N": 32,
        "BLOCK_SIZE_K": 512,
        "GROUP_SIZE_M": 8,
        "num_stages": 8,
        "num_warps": 8,
        "compile_time": 0.8573837280273438
    },
    {
        "BLOCK_SIZE_M": 16,
        "BLOCK_SIZE_N": 32,
        "BLOCK_SIZE_K": 512,
        "GROUP_SIZE_M": 8,
        "num_stages": 8,
        "num_warps": 16,
        "compile_time": 0.6560747623443604
    },
    {
        "BLOCK_SIZE_M": 16,
        "BLOCK_SIZE_N": 32,
        "BLOCK_SIZE_K": 512,
        "GROUP_SIZE_M": 8,
        "num_stages": 8,
        "num_warps": 32,
        "compile_time": 0.5604457855224609
    },
    {
        "BLOCK_SIZE_M": 16,
        "BLOCK_SIZE_N": 64,
        "BLOCK_SIZE_K": 256,
        "GROUP_SIZE_M": 8,
        "num_stages": 6,
        "num_warps": 2,
        "compile_time": 2.2090258598327637
    },
    {
        "BLOCK_SIZE_M": 16,
        "BLOCK_SIZE_N": 64,
        "BLOCK_SIZE_K": 256,
        "GROUP_SIZE_M": 8,
        "num_stages": 6,
        "num_warps": 4,
        "compile_time": 1.0197606086730957
    },
    {
        "BLOCK_SIZE_M": 16,
        "BLOCK_SIZE_N": 64,
        "BLOCK_SIZE_K": 256,
        "GROUP_SIZE_M": 8,
        "num_stages": 6,
        "num_warps": 8,
        "compile_time": 0.7050189971923828
    },
    {
        "BLOCK_SIZE_M": 16,
        "BLOCK_SIZE_N": 64,
        "BLOCK_SIZE_K": 256,
        "GROUP_SIZE_M": 8,
        "num_stages": 6,
        "num_warps": 16,
        "compile_time": 0.5269424915313721
    },
    {
        "BLOCK_SIZE_M": 16,
        "BLOCK_SIZE_N": 64,
        "BLOCK_SIZE_K": 256,
        "GROUP_SIZE_M": 8,
        "num_stages": 6,
        "num_warps": 32,
        "compile_time": 0.46286964416503906
    },
    {
        "BLOCK_SIZE_M": 16,
        "BLOCK_SIZE_N": 64,
        "BLOCK_SIZE_K": 256,
        "GROUP_SIZE_M": 8,
        "num_stages": 7,
        "num_warps": 2,
        "compile_time": 2.4905147552490234
    },
    {
        "BLOCK_SIZE_M": 16,
        "BLOCK_SIZE_N": 64,
        "BLOCK_SIZE_K": 256,
        "GROUP_SIZE_M": 8,
        "num_stages": 7,
        "num_warps": 4,
        "compile_time": 1.112401008605957
    },
    {
        "BLOCK_SIZE_M": 16,
        "BLOCK_SIZE_N": 64,
        "BLOCK_SIZE_K": 256,
        "GROUP_SIZE_M": 8,
        "num_stages": 7,
        "num_warps": 8,
        "compile_time": 0.692136287689209
    },
    {
        "BLOCK_SIZE_M": 16,
        "BLOCK_SIZE_N": 64,
        "BLOCK_SIZE_K": 256,
        "GROUP_SIZE_M": 8,
        "num_stages": 7,
        "num_warps": 16,
        "compile_time": 0.5265603065490723
    },
    {
        "BLOCK_SIZE_M": 16,
        "BLOCK_SIZE_N": 64,
        "BLOCK_SIZE_K": 256,
        "GROUP_SIZE_M": 8,
        "num_stages": 7,
        "num_warps": 32,
        "compile_time": 0.4595367908477783
    },
    {
        "BLOCK_SIZE_M": 16,
        "BLOCK_SIZE_N": 64,
        "BLOCK_SIZE_K": 256,
        "GROUP_SIZE_M": 8,
        "num_stages": 8,
        "num_warps": 2,
        "compile_time": 2.5010735988616943
    },
    {
        "BLOCK_SIZE_M": 16,
        "BLOCK_SIZE_N": 64,
        "BLOCK_SIZE_K": 256,
        "GROUP_SIZE_M": 8,
        "num_stages": 8,
        "num_warps": 4,
        "compile_time": 1.1998333930969238
    },
    {
        "BLOCK_SIZE_M": 16,
        "BLOCK_SIZE_N": 64,
        "BLOCK_SIZE_K": 256,
        "GROUP_SIZE_M": 8,
        "num_stages": 8,
        "num_warps": 8,
        "compile_time": 0.7149639129638672
    },
    {
        "BLOCK_SIZE_M": 16,
        "BLOCK_SIZE_N": 64,
        "BLOCK_SIZE_K": 256,
        "GROUP_SIZE_M": 8,
        "num_stages": 8,
        "num_warps": 16,
        "compile_time": 0.5571749210357666
    },
    {
        "BLOCK_SIZE_M": 16,
        "BLOCK_SIZE_N": 64,
        "BLOCK_SIZE_K": 256,
        "GROUP_SIZE_M": 8,
        "num_stages": 8,
        "num_warps": 32,
        "compile_time": 0.4621143341064453
    },
    {
        "BLOCK_SIZE_M": 16,
        "BLOCK_SIZE_N": 64,
        "BLOCK_SIZE_K": 512,
        "GROUP_SIZE_M": 8,
        "num_stages": 3,
        "num_warps": 2,
        "compile_time": 10.814270734786987
    },
    {
        "BLOCK_SIZE_M": 16,
        "BLOCK_SIZE_N": 64,
        "BLOCK_SIZE_K": 512,
        "GROUP_SIZE_M": 8,
        "num_stages": 4,
        "num_warps": 2,
        "compile_time": 10.76054573059082
    },
    {
        "BLOCK_SIZE_M": 16,
        "BLOCK_SIZE_N": 64,
        "BLOCK_SIZE_K": 512,
        "GROUP_SIZE_M": 8,
        "num_stages": 4,
        "num_warps": 4,
        "compile_time": 2.003812789916992
    },
    {
        "BLOCK_SIZE_M": 16,
        "BLOCK_SIZE_N": 64,
        "BLOCK_SIZE_K": 512,
        "GROUP_SIZE_M": 8,
        "num_stages": 4,
        "num_warps": 8,
        "compile_time": 0.9477763175964355
    },
    {
        "BLOCK_SIZE_M": 16,
        "BLOCK_SIZE_N": 64,
        "BLOCK_SIZE_K": 512,
        "GROUP_SIZE_M": 8,
        "num_stages": 4,
        "num_warps": 16,
        "compile_time": 0.6706862449645996
    },
    {
        "BLOCK_SIZE_M": 16,
        "BLOCK_SIZE_N": 64,
        "BLOCK_SIZE_K": 512,
        "GROUP_SIZE_M": 8,
        "num_stages": 4,
        "num_warps": 32,
        "compile_time": 0.5630931854248047
    },
    {
        "BLOCK_SIZE_M": 16,
        "BLOCK_SIZE_N": 64,
        "BLOCK_SIZE_K": 512,
        "GROUP_SIZE_M": 8,
        "num_stages": 5,
        "num_warps": 2,
        "compile_time": 11.035358667373657
    },
    {
        "BLOCK_SIZE_M": 16,
        "BLOCK_SIZE_N": 64,
        "BLOCK_SIZE_K": 512,
        "GROUP_SIZE_M": 8,
        "num_stages": 5,
        "num_warps": 4,
        "compile_time": 2.1837823390960693
    },
    {
        "BLOCK_SIZE_M": 16,
        "BLOCK_SIZE_N": 64,
        "BLOCK_SIZE_K": 512,
        "GROUP_SIZE_M": 8,
        "num_stages": 5,
        "num_warps": 8,
        "compile_time": 1.0357310771942139
    },
    {
        "BLOCK_SIZE_M": 16,
        "BLOCK_SIZE_N": 64,
        "BLOCK_SIZE_K": 512,
        "GROUP_SIZE_M": 8,
        "num_stages": 5,
        "num_warps": 16,
        "compile_time": 0.7150733470916748
    },
    {
        "BLOCK_SIZE_M": 16,
        "BLOCK_SIZE_N": 64,
        "BLOCK_SIZE_K": 512,
        "GROUP_SIZE_M": 8,
        "num_stages": 5,
        "num_warps": 32,
        "compile_time": 0.5826613903045654
    },
    {
        "BLOCK_SIZE_M": 16,
        "BLOCK_SIZE_N": 64,
        "BLOCK_SIZE_K": 512,
        "GROUP_SIZE_M": 8,
        "num_stages": 6,
        "num_warps": 2,
        "compile_time": 11.035008430480957
    },
    {
        "BLOCK_SIZE_M": 16,
        "BLOCK_SIZE_N": 64,
        "BLOCK_SIZE_K": 512,
        "GROUP_SIZE_M": 8,
        "num_stages": 6,
        "num_warps": 4,
        "compile_time": 2.2985823154449463
    },
    {
        "BLOCK_SIZE_M": 16,
        "BLOCK_SIZE_N": 64,
        "BLOCK_SIZE_K": 512,
        "GROUP_SIZE_M": 8,
        "num_stages": 6,
        "num_warps": 8,
        "compile_time": 1.0862047672271729
    },
    {
        "BLOCK_SIZE_M": 16,
        "BLOCK_SIZE_N": 64,
        "BLOCK_SIZE_K": 512,
        "GROUP_SIZE_M": 8,
        "num_stages": 6,
        "num_warps": 16,
        "compile_time": 0.7619216442108154
    },
    {
        "BLOCK_SIZE_M": 16,
        "BLOCK_SIZE_N": 64,
        "BLOCK_SIZE_K": 512,
        "GROUP_SIZE_M": 8,
        "num_stages": 6,
        "num_warps": 32,
        "compile_time": 0.6248791217803955
    },
    {
        "BLOCK_SIZE_M": 16,
        "BLOCK_SIZE_N": 64,
        "BLOCK_SIZE_K": 512,
        "GROUP_SIZE_M": 8,
        "num_stages": 7,
        "num_warps": 2,
        "compile_time": 11.39948296546936
    },
    {
        "BLOCK_SIZE_M": 16,
        "BLOCK_SIZE_N": 64,
        "BLOCK_SIZE_K": 512,
        "GROUP_SIZE_M": 8,
        "num_stages": 7,
        "num_warps": 4,
        "compile_time": 2.4327261447906494
    },
    {
        "BLOCK_SIZE_M": 16,
        "BLOCK_SIZE_N": 64,
        "BLOCK_SIZE_K": 512,
        "GROUP_SIZE_M": 8,
        "num_stages": 7,
        "num_warps": 8,
        "compile_time": 1.1830179691314697
    },
    {
        "BLOCK_SIZE_M": 16,
        "BLOCK_SIZE_N": 64,
        "BLOCK_SIZE_K": 512,
        "GROUP_SIZE_M": 8,
        "num_stages": 7,
        "num_warps": 16,
        "compile_time": 0.7922022342681885
    },
    {
        "BLOCK_SIZE_M": 16,
        "BLOCK_SIZE_N": 64,
        "BLOCK_SIZE_K": 512,
        "GROUP_SIZE_M": 8,
        "num_stages": 7,
        "num_warps": 32,
        "compile_time": 0.6423101425170898
    },
    {
        "BLOCK_SIZE_M": 16,
        "BLOCK_SIZE_N": 64,
        "BLOCK_SIZE_K": 512,
        "GROUP_SIZE_M": 8,
        "num_stages": 8,
        "num_warps": 2,
        "compile_time": 11.589014053344727
    },
    {
        "BLOCK_SIZE_M": 16,
        "BLOCK_SIZE_N": 64,
        "BLOCK_SIZE_K": 512,
        "GROUP_SIZE_M": 8,
        "num_stages": 8,
        "num_warps": 4,
        "compile_time": 2.5284149646759033
    },
    {
        "BLOCK_SIZE_M": 16,
        "BLOCK_SIZE_N": 64,
        "BLOCK_SIZE_K": 512,
        "GROUP_SIZE_M": 8,
        "num_stages": 8,
        "num_warps": 8,
        "compile_time": 1.2954802513122559
    },
    {
        "BLOCK_SIZE_M": 16,
        "BLOCK_SIZE_N": 64,
        "BLOCK_SIZE_K": 512,
        "GROUP_SIZE_M": 8,
        "num_stages": 8,
        "num_warps": 16,
        "compile_time": 0.8500847816467285
    },
    {
        "BLOCK_SIZE_M": 16,
        "BLOCK_SIZE_N": 64,
        "BLOCK_SIZE_K": 512,
        "GROUP_SIZE_M": 8,
        "num_stages": 8,
        "num_warps": 32,
        "compile_time": 0.6662173271179199
    },
    {
        "BLOCK_SIZE_M": 16,
        "BLOCK_SIZE_N": 128,
        "BLOCK_SIZE_K": 128,
        "GROUP_SIZE_M": 8,
        "num_stages": 6,
        "num_warps": 2,
        "compile_time": 2.1565473079681396
    },
    {
        "BLOCK_SIZE_M": 16,
        "BLOCK_SIZE_N": 128,
        "BLOCK_SIZE_K": 128,
        "GROUP_SIZE_M": 8,
        "num_stages": 6,
        "num_warps": 4,
        "compile_time": 0.9723200798034668
    },
    {
        "BLOCK_SIZE_M": 16,
        "BLOCK_SIZE_N": 128,
        "BLOCK_SIZE_K": 128,
        "GROUP_SIZE_M": 8,
        "num_stages": 6,
        "num_warps": 8,
        "compile_time": 0.5801739692687988
    },
    {
        "BLOCK_SIZE_M": 16,
        "BLOCK_SIZE_N": 128,
        "BLOCK_SIZE_K": 128,
        "GROUP_SIZE_M": 8,
        "num_stages": 6,
        "num_warps": 16,
        "compile_time": 0.44645047187805176
    },
    {
        "BLOCK_SIZE_M": 16,
        "BLOCK_SIZE_N": 128,
        "BLOCK_SIZE_K": 128,
        "GROUP_SIZE_M": 8,
        "num_stages": 6,
        "num_warps": 32,
        "compile_time": 0.38138699531555176
    },
    {
        "BLOCK_SIZE_M": 16,
        "BLOCK_SIZE_N": 128,
        "BLOCK_SIZE_K": 128,
        "GROUP_SIZE_M": 8,
        "num_stages": 7,
        "num_warps": 2,
        "compile_time": 2.2319858074188232
    },
    {
        "BLOCK_SIZE_M": 16,
        "BLOCK_SIZE_N": 128,
        "BLOCK_SIZE_K": 128,
        "GROUP_SIZE_M": 8,
        "num_stages": 7,
        "num_warps": 4,
        "compile_time": 1.0551857948303223
    },
    {
        "BLOCK_SIZE_M": 16,
        "BLOCK_SIZE_N": 128,
        "BLOCK_SIZE_K": 128,
        "GROUP_SIZE_M": 8,
        "num_stages": 7,
        "num_warps": 8,
        "compile_time": 0.6164300441741943
    },
    {
        "BLOCK_SIZE_M": 16,
        "BLOCK_SIZE_N": 128,
        "BLOCK_SIZE_K": 128,
        "GROUP_SIZE_M": 8,
        "num_stages": 7,
        "num_warps": 16,
        "compile_time": 0.46976161003112793
    },
    {
        "BLOCK_SIZE_M": 16,
        "BLOCK_SIZE_N": 128,
        "BLOCK_SIZE_K": 128,
        "GROUP_SIZE_M": 8,
        "num_stages": 7,
        "num_warps": 32,
        "compile_time": 0.39740967750549316
    },
    {
        "BLOCK_SIZE_M": 16,
        "BLOCK_SIZE_N": 128,
        "BLOCK_SIZE_K": 128,
        "GROUP_SIZE_M": 8,
        "num_stages": 8,
        "num_warps": 2,
        "compile_time": 2.3578832149505615
    },
    {
        "BLOCK_SIZE_M": 16,
        "BLOCK_SIZE_N": 128,
        "BLOCK_SIZE_K": 128,
        "GROUP_SIZE_M": 8,
        "num_stages": 8,
        "num_warps": 4,
        "compile_time": 1.1219582557678223
    },
    {
        "BLOCK_SIZE_M": 16,
        "BLOCK_SIZE_N": 128,
        "BLOCK_SIZE_K": 128,
        "GROUP_SIZE_M": 8,
        "num_stages": 8,
        "num_warps": 8,
        "compile_time": 0.6634743213653564
    },
    {
        "BLOCK_SIZE_M": 16,
        "BLOCK_SIZE_N": 128,
        "BLOCK_SIZE_K": 128,
        "GROUP_SIZE_M": 8,
        "num_stages": 8,
        "num_warps": 16,
        "compile_time": 0.4868154525756836
    },
    {
        "BLOCK_SIZE_M": 16,
        "BLOCK_SIZE_N": 128,
        "BLOCK_SIZE_K": 128,
        "GROUP_SIZE_M": 8,
        "num_stages": 8,
        "num_warps": 32,
        "compile_time": 0.4131197929382324
    },
    {
        "BLOCK_SIZE_M": 16,
        "BLOCK_SIZE_N": 128,
        "BLOCK_SIZE_K": 256,
        "GROUP_SIZE_M": 8,
        "num_stages": 3,
        "num_warps": 2,
        "compile_time": 10.582903385162354
    },
    {
        "BLOCK_SIZE_M": 16,
        "BLOCK_SIZE_N": 128,
        "BLOCK_SIZE_K": 256,
        "GROUP_SIZE_M": 8,
        "num_stages": 4,
        "num_warps": 2,
        "compile_time": 10.82818603515625
    },
    {
        "BLOCK_SIZE_M": 16,
        "BLOCK_SIZE_N": 128,
        "BLOCK_SIZE_K": 256,
        "GROUP_SIZE_M": 8,
        "num_stages": 4,
        "num_warps": 4,
        "compile_time": 1.9287309646606445
    },
    {
        "BLOCK_SIZE_M": 16,
        "BLOCK_SIZE_N": 128,
        "BLOCK_SIZE_K": 256,
        "GROUP_SIZE_M": 8,
        "num_stages": 4,
        "num_warps": 8,
        "compile_time": 0.9008848667144775
    },
    {
        "BLOCK_SIZE_M": 16,
        "BLOCK_SIZE_N": 128,
        "BLOCK_SIZE_K": 256,
        "GROUP_SIZE_M": 8,
        "num_stages": 4,
        "num_warps": 16,
        "compile_time": 0.5781781673431396
    },
    {
        "BLOCK_SIZE_M": 16,
        "BLOCK_SIZE_N": 128,
        "BLOCK_SIZE_K": 256,
        "GROUP_SIZE_M": 8,
        "num_stages": 4,
        "num_warps": 32,
        "compile_time": 0.46734118461608887
    },
    {
        "BLOCK_SIZE_M": 16,
        "BLOCK_SIZE_N": 128,
        "BLOCK_SIZE_K": 256,
        "GROUP_SIZE_M": 8,
        "num_stages": 5,
        "num_warps": 2,
        "compile_time": 10.856858730316162
    },
    {
        "BLOCK_SIZE_M": 16,
        "BLOCK_SIZE_N": 128,
        "BLOCK_SIZE_K": 256,
        "GROUP_SIZE_M": 8,
        "num_stages": 5,
        "num_warps": 4,
        "compile_time": 2.1087684631347656
    },
    {
        "BLOCK_SIZE_M": 16,
        "BLOCK_SIZE_N": 128,
        "BLOCK_SIZE_K": 256,
        "GROUP_SIZE_M": 8,
        "num_stages": 5,
        "num_warps": 8,
        "compile_time": 0.9558906555175781
    },
    {
        "BLOCK_SIZE_M": 16,
        "BLOCK_SIZE_N": 128,
        "BLOCK_SIZE_K": 256,
        "GROUP_SIZE_M": 8,
        "num_stages": 5,
        "num_warps": 16,
        "compile_time": 0.6125752925872803
    },
    {
        "BLOCK_SIZE_M": 16,
        "BLOCK_SIZE_N": 128,
        "BLOCK_SIZE_K": 256,
        "GROUP_SIZE_M": 8,
        "num_stages": 5,
        "num_warps": 32,
        "compile_time": 0.49152612686157227
    },
    {
        "BLOCK_SIZE_M": 16,
        "BLOCK_SIZE_N": 128,
        "BLOCK_SIZE_K": 256,
        "GROUP_SIZE_M": 8,
        "num_stages": 6,
        "num_warps": 2,
        "compile_time": 10.82979440689087
    },
    {
        "BLOCK_SIZE_M": 16,
        "BLOCK_SIZE_N": 128,
        "BLOCK_SIZE_K": 256,
        "GROUP_SIZE_M": 8,
        "num_stages": 6,
        "num_warps": 4,
        "compile_time": 2.2061045169830322
    },
    {
        "BLOCK_SIZE_M": 16,
        "BLOCK_SIZE_N": 128,
        "BLOCK_SIZE_K": 256,
        "GROUP_SIZE_M": 8,
        "num_stages": 6,
        "num_warps": 8,
        "compile_time": 1.0360186100006104
    },
    {
        "BLOCK_SIZE_M": 16,
        "BLOCK_SIZE_N": 128,
        "BLOCK_SIZE_K": 256,
        "GROUP_SIZE_M": 8,
        "num_stages": 6,
        "num_warps": 16,
        "compile_time": 0.6666793823242188
    },
    {
        "BLOCK_SIZE_M": 16,
        "BLOCK_SIZE_N": 128,
        "BLOCK_SIZE_K": 256,
        "GROUP_SIZE_M": 8,
        "num_stages": 6,
        "num_warps": 32,
        "compile_time": 0.5325708389282227
    },
    {
        "BLOCK_SIZE_M": 16,
        "BLOCK_SIZE_N": 128,
        "BLOCK_SIZE_K": 256,
        "GROUP_SIZE_M": 8,
        "num_stages": 7,
        "num_warps": 2,
        "compile_time": 11.319031238555908
    },
    {
        "BLOCK_SIZE_M": 16,
        "BLOCK_SIZE_N": 128,
        "BLOCK_SIZE_K": 256,
        "GROUP_SIZE_M": 8,
        "num_stages": 7,
        "num_warps": 4,
        "compile_time": 2.369532585144043
    },
    {
        "BLOCK_SIZE_M": 16,
        "BLOCK_SIZE_N": 128,
        "BLOCK_SIZE_K": 256,
        "GROUP_SIZE_M": 8,
        "num_stages": 7,
        "num_warps": 8,
        "compile_time": 1.1078920364379883
    },
    {
        "BLOCK_SIZE_M": 16,
        "BLOCK_SIZE_N": 128,
        "BLOCK_SIZE_K": 256,
        "GROUP_SIZE_M": 8,
        "num_stages": 7,
        "num_warps": 16,
        "compile_time": 0.6799936294555664
    },
    {
        "BLOCK_SIZE_M": 16,
        "BLOCK_SIZE_N": 128,
        "BLOCK_SIZE_K": 256,
        "GROUP_SIZE_M": 8,
        "num_stages": 7,
        "num_warps": 32,
        "compile_time": 0.5441858768463135
    },
    {
        "BLOCK_SIZE_M": 16,
        "BLOCK_SIZE_N": 128,
        "BLOCK_SIZE_K": 256,
        "GROUP_SIZE_M": 8,
        "num_stages": 8,
        "num_warps": 2,
        "compile_time": 11.34113597869873
    },
    {
        "BLOCK_SIZE_M": 16,
        "BLOCK_SIZE_N": 128,
        "BLOCK_SIZE_K": 256,
        "GROUP_SIZE_M": 8,
        "num_stages": 8,
        "num_warps": 4,
        "compile_time": 2.45025372505188
    },
    {
        "BLOCK_SIZE_M": 16,
        "BLOCK_SIZE_N": 128,
        "BLOCK_SIZE_K": 256,
        "GROUP_SIZE_M": 8,
        "num_stages": 8,
        "num_warps": 8,
        "compile_time": 1.2203874588012695
    },
    {
        "BLOCK_SIZE_M": 16,
        "BLOCK_SIZE_N": 128,
        "BLOCK_SIZE_K": 256,
        "GROUP_SIZE_M": 8,
        "num_stages": 8,
        "num_warps": 16,
        "compile_time": 0.731978178024292
    },
    {
        "BLOCK_SIZE_M": 16,
        "BLOCK_SIZE_N": 128,
        "BLOCK_SIZE_K": 256,
        "GROUP_SIZE_M": 8,
        "num_stages": 8,
        "num_warps": 32,
        "compile_time": 0.5731761455535889
    },
    {
        "BLOCK_SIZE_M": 16,
        "BLOCK_SIZE_N": 128,
        "BLOCK_SIZE_K": 512,
        "GROUP_SIZE_M": 8,
        "num_stages": 1,
        "num_warps": 2,
        "compile_time": 7.659933567047119
    },
    {
        "BLOCK_SIZE_M": 16,
        "BLOCK_SIZE_N": 128,
        "BLOCK_SIZE_K": 512,
        "GROUP_SIZE_M": 8,
        "num_stages": 2,
        "num_warps": 2,
        "compile_time": 7.603606224060059
    },
    {
        "BLOCK_SIZE_M": 16,
        "BLOCK_SIZE_N": 128,
        "BLOCK_SIZE_K": 512,
        "GROUP_SIZE_M": 8,
        "num_stages": 3,
        "num_warps": 2,
        "compile_time": 99.50519466400146
    },
    {
        "BLOCK_SIZE_M": 16,
        "BLOCK_SIZE_N": 128,
        "BLOCK_SIZE_K": 512,
        "GROUP_SIZE_M": 8,
        "num_stages": 3,
        "num_warps": 4,
        "compile_time": 10.538215160369873
    },
    {
        "BLOCK_SIZE_M": 16,
        "BLOCK_SIZE_N": 128,
        "BLOCK_SIZE_K": 512,
        "GROUP_SIZE_M": 8,
        "num_stages": 3,
        "num_warps": 8,
        "compile_time": 1.8715271949768066
    },
    {
        "BLOCK_SIZE_M": 16,
        "BLOCK_SIZE_N": 128,
        "BLOCK_SIZE_K": 512,
        "GROUP_SIZE_M": 8,
        "num_stages": 3,
        "num_warps": 16,
        "compile_time": 0.9030921459197998
    },
    {
        "BLOCK_SIZE_M": 16,
        "BLOCK_SIZE_N": 128,
        "BLOCK_SIZE_K": 512,
        "GROUP_SIZE_M": 8,
        "num_stages": 3,
        "num_warps": 32,
        "compile_time": 0.6421058177947998
    },
    {
        "BLOCK_SIZE_M": 16,
        "BLOCK_SIZE_N": 128,
        "BLOCK_SIZE_K": 512,
        "GROUP_SIZE_M": 8,
        "num_stages": 4,
        "num_warps": 2,
        "compile_time": 97.89076042175293
    },
    {
        "BLOCK_SIZE_M": 16,
        "BLOCK_SIZE_N": 128,
        "BLOCK_SIZE_K": 512,
        "GROUP_SIZE_M": 8,
        "num_stages": 4,
        "num_warps": 4,
        "compile_time": 10.77378511428833
    },
    {
        "BLOCK_SIZE_M": 16,
        "BLOCK_SIZE_N": 128,
        "BLOCK_SIZE_K": 512,
        "GROUP_SIZE_M": 8,
        "num_stages": 4,
        "num_warps": 8,
        "compile_time": 2.0067965984344482
    },
    {
        "BLOCK_SIZE_M": 16,
        "BLOCK_SIZE_N": 128,
        "BLOCK_SIZE_K": 512,
        "GROUP_SIZE_M": 8,
        "num_stages": 4,
        "num_warps": 16,
        "compile_time": 0.9620914459228516
    },
    {
        "BLOCK_SIZE_M": 16,
        "BLOCK_SIZE_N": 128,
        "BLOCK_SIZE_K": 512,
        "GROUP_SIZE_M": 8,
        "num_stages": 4,
        "num_warps": 32,
        "compile_time": 0.7020149230957031
    },
    {
        "BLOCK_SIZE_M": 16,
        "BLOCK_SIZE_N": 128,
        "BLOCK_SIZE_K": 512,
        "GROUP_SIZE_M": 8,
        "num_stages": 5,
        "num_warps": 2,
        "compile_time": 6.406998634338379
    },
    {
        "BLOCK_SIZE_M": 16,
        "BLOCK_SIZE_N": 128,
        "BLOCK_SIZE_K": 512,
        "GROUP_SIZE_M": 8,
        "num_stages": 5,
        "num_warps": 4,
        "compile_time": 11.205871343612671
    },
    {
        "BLOCK_SIZE_M": 16,
        "BLOCK_SIZE_N": 128,
        "BLOCK_SIZE_K": 512,
        "GROUP_SIZE_M": 8,
        "num_stages": 5,
        "num_warps": 8,
        "compile_time": 2.1935195922851562
    },
    {
        "BLOCK_SIZE_M": 16,
        "BLOCK_SIZE_N": 128,
        "BLOCK_SIZE_K": 512,
        "GROUP_SIZE_M": 8,
        "num_stages": 5,
        "num_warps": 16,
        "compile_time": 1.0673363208770752
    },
    {
        "BLOCK_SIZE_M": 16,
        "BLOCK_SIZE_N": 128,
        "BLOCK_SIZE_K": 512,
        "GROUP_SIZE_M": 8,
        "num_stages": 5,
        "num_warps": 32,
        "compile_time": 0.7442052364349365
    },
    {
        "BLOCK_SIZE_M": 16,
        "BLOCK_SIZE_N": 128,
        "BLOCK_SIZE_K": 512,
        "GROUP_SIZE_M": 8,
        "num_stages": 6,
        "num_warps": 2,
        "compile_time": 6.717178106307983
    },
    {
        "BLOCK_SIZE_M": 16,
        "BLOCK_SIZE_N": 128,
        "BLOCK_SIZE_K": 512,
        "GROUP_SIZE_M": 8,
        "num_stages": 6,
        "num_warps": 4,
        "compile_time": 11.370385646820068
    },
    {
        "BLOCK_SIZE_M": 16,
        "BLOCK_SIZE_N": 128,
        "BLOCK_SIZE_K": 512,
        "GROUP_SIZE_M": 8,
        "num_stages": 6,
        "num_warps": 8,
        "compile_time": 2.30729079246521
    },
    {
        "BLOCK_SIZE_M": 16,
        "BLOCK_SIZE_N": 128,
        "BLOCK_SIZE_K": 512,
        "GROUP_SIZE_M": 8,
        "num_stages": 6,
        "num_warps": 16,
        "compile_time": 1.13155198097229
    },
    {
        "BLOCK_SIZE_M": 16,
        "BLOCK_SIZE_N": 128,
        "BLOCK_SIZE_K": 512,
        "GROUP_SIZE_M": 8,
        "num_stages": 6,
        "num_warps": 32,
        "compile_time": 0.7666330337524414
    },
    {
        "BLOCK_SIZE_M": 16,
        "BLOCK_SIZE_N": 128,
        "BLOCK_SIZE_K": 512,
        "GROUP_SIZE_M": 8,
        "num_stages": 7,
        "num_warps": 2,
        "compile_time": 7.075377464294434
    },
    {
        "BLOCK_SIZE_M": 16,
        "BLOCK_SIZE_N": 128,
        "BLOCK_SIZE_K": 512,
        "GROUP_SIZE_M": 8,
        "num_stages": 7,
        "num_warps": 4,
        "compile_time": 11.292097568511963
    },
    {
        "BLOCK_SIZE_M": 16,
        "BLOCK_SIZE_N": 128,
        "BLOCK_SIZE_K": 512,
        "GROUP_SIZE_M": 8,
        "num_stages": 7,
        "num_warps": 8,
        "compile_time": 2.4925119876861572
    },
    {
        "BLOCK_SIZE_M": 16,
        "BLOCK_SIZE_N": 128,
        "BLOCK_SIZE_K": 512,
        "GROUP_SIZE_M": 8,
        "num_stages": 7,
        "num_warps": 16,
        "compile_time": 1.2310965061187744
    },
    {
        "BLOCK_SIZE_M": 16,
        "BLOCK_SIZE_N": 128,
        "BLOCK_SIZE_K": 512,
        "GROUP_SIZE_M": 8,
        "num_stages": 7,
        "num_warps": 32,
        "compile_time": 0.8352923393249512
    },
    {
        "BLOCK_SIZE_M": 16,
        "BLOCK_SIZE_N": 128,
        "BLOCK_SIZE_K": 512,
        "GROUP_SIZE_M": 8,
        "num_stages": 8,
        "num_warps": 2,
        "compile_time": 7.399508476257324
    },
    {
        "BLOCK_SIZE_M": 16,
        "BLOCK_SIZE_N": 128,
        "BLOCK_SIZE_K": 512,
        "GROUP_SIZE_M": 8,
        "num_stages": 8,
        "num_warps": 4,
        "compile_time": 11.78751826286316
    },
    {
        "BLOCK_SIZE_M": 16,
        "BLOCK_SIZE_N": 128,
        "BLOCK_SIZE_K": 512,
        "GROUP_SIZE_M": 8,
        "num_stages": 8,
        "num_warps": 8,
        "compile_time": 2.658383846282959
    },
    {
        "BLOCK_SIZE_M": 16,
        "BLOCK_SIZE_N": 128,
        "BLOCK_SIZE_K": 512,
        "GROUP_SIZE_M": 8,
        "num_stages": 8,
        "num_warps": 16,
        "compile_time": 1.352672815322876
    },
    {
        "BLOCK_SIZE_M": 16,
        "BLOCK_SIZE_N": 128,
        "BLOCK_SIZE_K": 512,
        "GROUP_SIZE_M": 8,
        "num_stages": 8,
        "num_warps": 32,
        "compile_time": 0.9111073017120361
    },
    {
        "BLOCK_SIZE_M": 16,
        "BLOCK_SIZE_N": 256,
        "BLOCK_SIZE_K": 64,
        "GROUP_SIZE_M": 8,
        "num_stages": 6,
        "num_warps": 2,
        "compile_time": 2.3214077949523926
    },
    {
        "BLOCK_SIZE_M": 16,
        "BLOCK_SIZE_N": 256,
        "BLOCK_SIZE_K": 64,
        "GROUP_SIZE_M": 8,
        "num_stages": 6,
        "num_warps": 4,
        "compile_time": 1.0133109092712402
    },
    {
        "BLOCK_SIZE_M": 16,
        "BLOCK_SIZE_N": 256,
        "BLOCK_SIZE_K": 64,
        "GROUP_SIZE_M": 8,
        "num_stages": 6,
        "num_warps": 8,
        "compile_time": 0.6223752498626709
    },
    {
        "BLOCK_SIZE_M": 16,
        "BLOCK_SIZE_N": 256,
        "BLOCK_SIZE_K": 64,
        "GROUP_SIZE_M": 8,
        "num_stages": 6,
        "num_warps": 16,
        "compile_time": 0.4588737487792969
    },
    {
        "BLOCK_SIZE_M": 16,
        "BLOCK_SIZE_N": 256,
        "BLOCK_SIZE_K": 64,
        "GROUP_SIZE_M": 8,
        "num_stages": 7,
        "num_warps": 2,
        "compile_time": 2.4697134494781494
    },
    {
        "BLOCK_SIZE_M": 16,
        "BLOCK_SIZE_N": 256,
        "BLOCK_SIZE_K": 64,
        "GROUP_SIZE_M": 8,
        "num_stages": 7,
        "num_warps": 4,
        "compile_time": 1.1025476455688477
    },
    {
        "BLOCK_SIZE_M": 16,
        "BLOCK_SIZE_N": 256,
        "BLOCK_SIZE_K": 64,
        "GROUP_SIZE_M": 8,
        "num_stages": 7,
        "num_warps": 8,
        "compile_time": 0.6452929973602295
    },
    {
        "BLOCK_SIZE_M": 16,
        "BLOCK_SIZE_N": 256,
        "BLOCK_SIZE_K": 64,
        "GROUP_SIZE_M": 8,
        "num_stages": 7,
        "num_warps": 16,
        "compile_time": 0.48474884033203125
    },
    {
        "BLOCK_SIZE_M": 16,
        "BLOCK_SIZE_N": 256,
        "BLOCK_SIZE_K": 64,
        "GROUP_SIZE_M": 8,
        "num_stages": 7,
        "num_warps": 32,
        "compile_time": 0.41864514350891113
    },
    {
        "BLOCK_SIZE_M": 16,
        "BLOCK_SIZE_N": 256,
        "BLOCK_SIZE_K": 64,
        "GROUP_SIZE_M": 8,
        "num_stages": 8,
        "num_warps": 2,
        "compile_time": 2.5830371379852295
    },
    {
        "BLOCK_SIZE_M": 16,
        "BLOCK_SIZE_N": 256,
        "BLOCK_SIZE_K": 64,
        "GROUP_SIZE_M": 8,
        "num_stages": 8,
        "num_warps": 4,
        "compile_time": 1.1640753746032715
    },
    {
        "BLOCK_SIZE_M": 16,
        "BLOCK_SIZE_N": 256,
        "BLOCK_SIZE_K": 64,
        "GROUP_SIZE_M": 8,
        "num_stages": 8,
        "num_warps": 8,
        "compile_time": 0.6926095485687256
    },
    {
        "BLOCK_SIZE_M": 16,
        "BLOCK_SIZE_N": 256,
        "BLOCK_SIZE_K": 64,
        "GROUP_SIZE_M": 8,
        "num_stages": 8,
        "num_warps": 16,
        "compile_time": 0.5076935291290283
    },
    {
        "BLOCK_SIZE_M": 16,
        "BLOCK_SIZE_N": 256,
        "BLOCK_SIZE_K": 64,
        "GROUP_SIZE_M": 8,
        "num_stages": 8,
        "num_warps": 32,
        "compile_time": 0.38509535789489746
    },
    {
        "BLOCK_SIZE_M": 16,
        "BLOCK_SIZE_N": 256,
        "BLOCK_SIZE_K": 128,
        "GROUP_SIZE_M": 8,
        "num_stages": 3,
        "num_warps": 2,
        "compile_time": 10.704432010650635
    },
    {
        "BLOCK_SIZE_M": 16,
        "BLOCK_SIZE_N": 256,
        "BLOCK_SIZE_K": 128,
        "GROUP_SIZE_M": 8,
        "num_stages": 4,
        "num_warps": 2,
        "compile_time": 10.700904846191406
    },
    {
        "BLOCK_SIZE_M": 16,
        "BLOCK_SIZE_N": 256,
        "BLOCK_SIZE_K": 128,
        "GROUP_SIZE_M": 8,
        "num_stages": 4,
        "num_warps": 4,
        "compile_time": 1.8717682361602783
    },
    {
        "BLOCK_SIZE_M": 16,
        "BLOCK_SIZE_N": 256,
        "BLOCK_SIZE_K": 128,
        "GROUP_SIZE_M": 8,
        "num_stages": 4,
        "num_warps": 8,
        "compile_time": 0.9102802276611328
    },
    {
        "BLOCK_SIZE_M": 16,
        "BLOCK_SIZE_N": 256,
        "BLOCK_SIZE_K": 128,
        "GROUP_SIZE_M": 8,
        "num_stages": 4,
        "num_warps": 16,
        "compile_time": 0.5487546920776367
    },
    {
        "BLOCK_SIZE_M": 16,
        "BLOCK_SIZE_N": 256,
        "BLOCK_SIZE_K": 128,
        "GROUP_SIZE_M": 8,
        "num_stages": 4,
        "num_warps": 32,
        "compile_time": 0.42744922637939453
    },
    {
        "BLOCK_SIZE_M": 16,
        "BLOCK_SIZE_N": 256,
        "BLOCK_SIZE_K": 128,
        "GROUP_SIZE_M": 8,
        "num_stages": 5,
        "num_warps": 2,
        "compile_time": 10.861080169677734
    },
    {
        "BLOCK_SIZE_M": 16,
        "BLOCK_SIZE_N": 256,
        "BLOCK_SIZE_K": 128,
        "GROUP_SIZE_M": 8,
        "num_stages": 5,
        "num_warps": 4,
        "compile_time": 2.0106074810028076
    },
    {
        "BLOCK_SIZE_M": 16,
        "BLOCK_SIZE_N": 256,
        "BLOCK_SIZE_K": 128,
        "GROUP_SIZE_M": 8,
        "num_stages": 5,
        "num_warps": 8,
        "compile_time": 0.9671831130981445
    },
    {
        "BLOCK_SIZE_M": 16,
        "BLOCK_SIZE_N": 256,
        "BLOCK_SIZE_K": 128,
        "GROUP_SIZE_M": 8,
        "num_stages": 5,
        "num_warps": 16,
        "compile_time": 0.579479455947876
    },
    {
        "BLOCK_SIZE_M": 16,
        "BLOCK_SIZE_N": 256,
        "BLOCK_SIZE_K": 128,
        "GROUP_SIZE_M": 8,
        "num_stages": 5,
        "num_warps": 32,
        "compile_time": 0.43987512588500977
    },
    {
        "BLOCK_SIZE_M": 16,
        "BLOCK_SIZE_N": 256,
        "BLOCK_SIZE_K": 128,
        "GROUP_SIZE_M": 8,
        "num_stages": 6,
        "num_warps": 2,
        "compile_time": 11.075369834899902
    },
    {
        "BLOCK_SIZE_M": 16,
        "BLOCK_SIZE_N": 256,
        "BLOCK_SIZE_K": 128,
        "GROUP_SIZE_M": 8,
        "num_stages": 6,
        "num_warps": 4,
        "compile_time": 2.168368101119995
    },
    {
        "BLOCK_SIZE_M": 16,
        "BLOCK_SIZE_N": 256,
        "BLOCK_SIZE_K": 128,
        "GROUP_SIZE_M": 8,
        "num_stages": 6,
        "num_warps": 8,
        "compile_time": 1.0698215961456299
    },
    {
        "BLOCK_SIZE_M": 16,
        "BLOCK_SIZE_N": 256,
        "BLOCK_SIZE_K": 128,
        "GROUP_SIZE_M": 8,
        "num_stages": 6,
        "num_warps": 16,
        "compile_time": 0.6427483558654785
    },
    {
        "BLOCK_SIZE_M": 16,
        "BLOCK_SIZE_N": 256,
        "BLOCK_SIZE_K": 128,
        "GROUP_SIZE_M": 8,
        "num_stages": 6,
        "num_warps": 32,
        "compile_time": 0.4871833324432373
    },
    {
        "BLOCK_SIZE_M": 16,
        "BLOCK_SIZE_N": 256,
        "BLOCK_SIZE_K": 128,
        "GROUP_SIZE_M": 8,
        "num_stages": 7,
        "num_warps": 2,
        "compile_time": 11.354915857315063
    },
    {
        "BLOCK_SIZE_M": 16,
        "BLOCK_SIZE_N": 256,
        "BLOCK_SIZE_K": 128,
        "GROUP_SIZE_M": 8,
        "num_stages": 7,
        "num_warps": 4,
        "compile_time": 2.319715738296509
    },
    {
        "BLOCK_SIZE_M": 16,
        "BLOCK_SIZE_N": 256,
        "BLOCK_SIZE_K": 128,
        "GROUP_SIZE_M": 8,
        "num_stages": 7,
        "num_warps": 8,
        "compile_time": 1.1264991760253906
    },
    {
        "BLOCK_SIZE_M": 16,
        "BLOCK_SIZE_N": 256,
        "BLOCK_SIZE_K": 128,
        "GROUP_SIZE_M": 8,
        "num_stages": 7,
        "num_warps": 16,
        "compile_time": 0.6822822093963623
    },
    {
        "BLOCK_SIZE_M": 16,
        "BLOCK_SIZE_N": 256,
        "BLOCK_SIZE_K": 128,
        "GROUP_SIZE_M": 8,
        "num_stages": 7,
        "num_warps": 32,
        "compile_time": 0.5057413578033447
    },
    {
        "BLOCK_SIZE_M": 16,
        "BLOCK_SIZE_N": 256,
        "BLOCK_SIZE_K": 128,
        "GROUP_SIZE_M": 8,
        "num_stages": 8,
        "num_warps": 2,
        "compile_time": 11.43330717086792
    },
    {
        "BLOCK_SIZE_M": 16,
        "BLOCK_SIZE_N": 256,
        "BLOCK_SIZE_K": 128,
        "GROUP_SIZE_M": 8,
        "num_stages": 8,
        "num_warps": 4,
        "compile_time": 2.4189324378967285
    },
    {
        "BLOCK_SIZE_M": 16,
        "BLOCK_SIZE_N": 256,
        "BLOCK_SIZE_K": 128,
        "GROUP_SIZE_M": 8,
        "num_stages": 8,
        "num_warps": 8,
        "compile_time": 1.2358624935150146
    },
    {
        "BLOCK_SIZE_M": 16,
        "BLOCK_SIZE_N": 256,
        "BLOCK_SIZE_K": 128,
        "GROUP_SIZE_M": 8,
        "num_stages": 8,
        "num_warps": 16,
        "compile_time": 0.6987624168395996
    },
    {
        "BLOCK_SIZE_M": 16,
        "BLOCK_SIZE_N": 256,
        "BLOCK_SIZE_K": 128,
        "GROUP_SIZE_M": 8,
        "num_stages": 8,
        "num_warps": 32,
        "compile_time": 0.5218088626861572
    },
    {
        "BLOCK_SIZE_M": 16,
        "BLOCK_SIZE_N": 256,
        "BLOCK_SIZE_K": 256,
        "GROUP_SIZE_M": 8,
        "num_stages": 1,
        "num_warps": 2,
        "compile_time": 7.639348983764648
    },
    {
        "BLOCK_SIZE_M": 16,
        "BLOCK_SIZE_N": 256,
        "BLOCK_SIZE_K": 256,
        "GROUP_SIZE_M": 8,
        "num_stages": 2,
        "num_warps": 2,
        "compile_time": 7.814908266067505
    },
    {
        "BLOCK_SIZE_M": 16,
        "BLOCK_SIZE_N": 256,
        "BLOCK_SIZE_K": 256,
        "GROUP_SIZE_M": 8,
        "num_stages": 3,
        "num_warps": 2,
        "compile_time": 100.88673138618469
    },
    {
        "BLOCK_SIZE_M": 16,
        "BLOCK_SIZE_N": 256,
        "BLOCK_SIZE_K": 256,
        "GROUP_SIZE_M": 8,
        "num_stages": 3,
        "num_warps": 4,
        "compile_time": 10.515740871429443
    },
    {
        "BLOCK_SIZE_M": 16,
        "BLOCK_SIZE_N": 256,
        "BLOCK_SIZE_K": 256,
        "GROUP_SIZE_M": 8,
        "num_stages": 3,
        "num_warps": 8,
        "compile_time": 1.799851894378662
    },
    {
        "BLOCK_SIZE_M": 16,
        "BLOCK_SIZE_N": 256,
        "BLOCK_SIZE_K": 256,
        "GROUP_SIZE_M": 8,
        "num_stages": 3,
        "num_warps": 16,
        "compile_time": 0.8521809577941895
    },
    {
        "BLOCK_SIZE_M": 16,
        "BLOCK_SIZE_N": 256,
        "BLOCK_SIZE_K": 256,
        "GROUP_SIZE_M": 8,
        "num_stages": 3,
        "num_warps": 32,
        "compile_time": 0.5299952030181885
    },
    {
        "BLOCK_SIZE_M": 16,
        "BLOCK_SIZE_N": 256,
        "BLOCK_SIZE_K": 256,
        "GROUP_SIZE_M": 8,
        "num_stages": 4,
        "num_warps": 2,
        "compile_time": 6.0469279289245605
    },
    {
        "BLOCK_SIZE_M": 16,
        "BLOCK_SIZE_N": 256,
        "BLOCK_SIZE_K": 256,
        "GROUP_SIZE_M": 8,
        "num_stages": 4,
        "num_warps": 4,
        "compile_time": 10.56659197807312
    },
    {
        "BLOCK_SIZE_M": 16,
        "BLOCK_SIZE_N": 256,
        "BLOCK_SIZE_K": 256,
        "GROUP_SIZE_M": 8,
        "num_stages": 4,
        "num_warps": 8,
        "compile_time": 1.9695844650268555
    },
    {
        "BLOCK_SIZE_M": 16,
        "BLOCK_SIZE_N": 256,
        "BLOCK_SIZE_K": 256,
        "GROUP_SIZE_M": 8,
        "num_stages": 4,
        "num_warps": 16,
        "compile_time": 0.9409489631652832
    },
    {
        "BLOCK_SIZE_M": 16,
        "BLOCK_SIZE_N": 256,
        "BLOCK_SIZE_K": 256,
        "GROUP_SIZE_M": 8,
        "num_stages": 4,
        "num_warps": 32,
        "compile_time": 0.6012794971466064
    },
    {
        "BLOCK_SIZE_M": 16,
        "BLOCK_SIZE_N": 256,
        "BLOCK_SIZE_K": 256,
        "GROUP_SIZE_M": 8,
        "num_stages": 5,
        "num_warps": 2,
        "compile_time": 6.232574462890625
    },
    {
        "BLOCK_SIZE_M": 16,
        "BLOCK_SIZE_N": 256,
        "BLOCK_SIZE_K": 256,
        "GROUP_SIZE_M": 8,
        "num_stages": 5,
        "num_warps": 4,
        "compile_time": 10.35046100616455
    },
    {
        "BLOCK_SIZE_M": 16,
        "BLOCK_SIZE_N": 256,
        "BLOCK_SIZE_K": 256,
        "GROUP_SIZE_M": 8,
        "num_stages": 5,
        "num_warps": 8,
        "compile_time": 2.074124336242676
    },
    {
        "BLOCK_SIZE_M": 16,
        "BLOCK_SIZE_N": 256,
        "BLOCK_SIZE_K": 256,
        "GROUP_SIZE_M": 8,
        "num_stages": 5,
        "num_warps": 16,
        "compile_time": 0.986914873123169
    },
    {
        "BLOCK_SIZE_M": 16,
        "BLOCK_SIZE_N": 256,
        "BLOCK_SIZE_K": 256,
        "GROUP_SIZE_M": 8,
        "num_stages": 5,
        "num_warps": 32,
        "compile_time": 0.6179187297821045
    },
    {
        "BLOCK_SIZE_M": 16,
        "BLOCK_SIZE_N": 256,
        "BLOCK_SIZE_K": 256,
        "GROUP_SIZE_M": 8,
        "num_stages": 6,
        "num_warps": 2,
        "compile_time": 6.566027641296387
    },
    {
        "BLOCK_SIZE_M": 16,
        "BLOCK_SIZE_N": 256,
        "BLOCK_SIZE_K": 256,
        "GROUP_SIZE_M": 8,
        "num_stages": 6,
        "num_warps": 4,
        "compile_time": 10.936134338378906
    },
    {
        "BLOCK_SIZE_M": 16,
        "BLOCK_SIZE_N": 256,
        "BLOCK_SIZE_K": 256,
        "GROUP_SIZE_M": 8,
        "num_stages": 6,
        "num_warps": 8,
        "compile_time": 2.214320182800293
    },
    {
        "BLOCK_SIZE_M": 16,
        "BLOCK_SIZE_N": 256,
        "BLOCK_SIZE_K": 256,
        "GROUP_SIZE_M": 8,
        "num_stages": 6,
        "num_warps": 16,
        "compile_time": 1.0749549865722656
    },
    {
        "BLOCK_SIZE_M": 16,
        "BLOCK_SIZE_N": 256,
        "BLOCK_SIZE_K": 256,
        "GROUP_SIZE_M": 8,
        "num_stages": 6,
        "num_warps": 32,
        "compile_time": 0.6997029781341553
    },
    {
        "BLOCK_SIZE_M": 16,
        "BLOCK_SIZE_N": 256,
        "BLOCK_SIZE_K": 256,
        "GROUP_SIZE_M": 8,
        "num_stages": 7,
        "num_warps": 2,
        "compile_time": 7.03426456451416
    },
    {
        "BLOCK_SIZE_M": 16,
        "BLOCK_SIZE_N": 256,
        "BLOCK_SIZE_K": 256,
        "GROUP_SIZE_M": 8,
        "num_stages": 7,
        "num_warps": 4,
        "compile_time": 11.301969766616821
    },
    {
        "BLOCK_SIZE_M": 16,
        "BLOCK_SIZE_N": 256,
        "BLOCK_SIZE_K": 256,
        "GROUP_SIZE_M": 8,
        "num_stages": 7,
        "num_warps": 8,
        "compile_time": 2.40360951423645
    },
    {
        "BLOCK_SIZE_M": 16,
        "BLOCK_SIZE_N": 256,
        "BLOCK_SIZE_K": 256,
        "GROUP_SIZE_M": 8,
        "num_stages": 7,
        "num_warps": 16,
        "compile_time": 1.1759397983551025
    },
    {
        "BLOCK_SIZE_M": 16,
        "BLOCK_SIZE_N": 256,
        "BLOCK_SIZE_K": 256,
        "GROUP_SIZE_M": 8,
        "num_stages": 7,
        "num_warps": 32,
        "compile_time": 0.7426764965057373
    },
    {
        "BLOCK_SIZE_M": 16,
        "BLOCK_SIZE_N": 256,
        "BLOCK_SIZE_K": 256,
        "GROUP_SIZE_M": 8,
        "num_stages": 8,
        "num_warps": 2,
        "compile_time": 7.427360534667969
    },
    {
        "BLOCK_SIZE_M": 16,
        "BLOCK_SIZE_N": 256,
        "BLOCK_SIZE_K": 256,
        "GROUP_SIZE_M": 8,
        "num_stages": 8,
        "num_warps": 4,
        "compile_time": 11.473560571670532
    },
    {
        "BLOCK_SIZE_M": 16,
        "BLOCK_SIZE_N": 256,
        "BLOCK_SIZE_K": 256,
        "GROUP_SIZE_M": 8,
        "num_stages": 8,
        "num_warps": 8,
        "compile_time": 2.513935089111328
    },
    {
        "BLOCK_SIZE_M": 16,
        "BLOCK_SIZE_N": 256,
        "BLOCK_SIZE_K": 256,
        "GROUP_SIZE_M": 8,
        "num_stages": 8,
        "num_warps": 16,
        "compile_time": 1.245420217514038
    },
    {
        "BLOCK_SIZE_M": 16,
        "BLOCK_SIZE_N": 256,
        "BLOCK_SIZE_K": 256,
        "GROUP_SIZE_M": 8,
        "num_stages": 8,
        "num_warps": 32,
        "compile_time": 0.7972400188446045
    },
    {
        "BLOCK_SIZE_M": 16,
        "BLOCK_SIZE_N": 256,
        "BLOCK_SIZE_K": 512,
        "GROUP_SIZE_M": 8,
        "num_stages": 1,
        "num_warps": 2,
        "compile_time": 18.48189949989319
    },
    {
        "BLOCK_SIZE_M": 16,
        "BLOCK_SIZE_N": 256,
        "BLOCK_SIZE_K": 512,
        "GROUP_SIZE_M": 8,
        "num_stages": 1,
        "num_warps": 4,
        "compile_time": 7.757182836532593
    },
    {
        "BLOCK_SIZE_M": 16,
        "BLOCK_SIZE_N": 256,
        "BLOCK_SIZE_K": 512,
        "GROUP_SIZE_M": 8,
        "num_stages": 1,
        "num_warps": 8,
        "compile_time": 2.734858512878418
    },
    {
        "BLOCK_SIZE_M": 16,
        "BLOCK_SIZE_N": 256,
        "BLOCK_SIZE_K": 512,
        "GROUP_SIZE_M": 8,
        "num_stages": 1,
        "num_warps": 16,
        "compile_time": 1.1038339138031006
    },
    {
        "BLOCK_SIZE_M": 16,
        "BLOCK_SIZE_N": 256,
        "BLOCK_SIZE_K": 512,
        "GROUP_SIZE_M": 8,
        "num_stages": 1,
        "num_warps": 32,
        "compile_time": 0.7352337837219238
    },
    {
        "BLOCK_SIZE_M": 16,
        "BLOCK_SIZE_N": 256,
        "BLOCK_SIZE_K": 512,
        "GROUP_SIZE_M": 8,
        "num_stages": 2,
        "num_warps": 2,
        "compile_time": 19.15609312057495
    },
    {
        "BLOCK_SIZE_M": 16,
        "BLOCK_SIZE_N": 256,
        "BLOCK_SIZE_K": 512,
        "GROUP_SIZE_M": 8,
        "num_stages": 2,
        "num_warps": 4,
        "compile_time": 7.784532070159912
    },
    {
        "BLOCK_SIZE_M": 16,
        "BLOCK_SIZE_N": 256,
        "BLOCK_SIZE_K": 512,
        "GROUP_SIZE_M": 8,
        "num_stages": 2,
        "num_warps": 8,
        "compile_time": 3.0638883113861084
    },
    {
        "BLOCK_SIZE_M": 16,
        "BLOCK_SIZE_N": 256,
        "BLOCK_SIZE_K": 512,
        "GROUP_SIZE_M": 8,
        "num_stages": 2,
        "num_warps": 16,
        "compile_time": 1.324803113937378
    },
    {
        "BLOCK_SIZE_M": 16,
        "BLOCK_SIZE_N": 256,
        "BLOCK_SIZE_K": 512,
        "GROUP_SIZE_M": 8,
        "num_stages": 2,
        "num_warps": 32,
        "compile_time": 0.7877576351165771
    },
    {
        "BLOCK_SIZE_M": 16,
        "BLOCK_SIZE_N": 256,
        "BLOCK_SIZE_K": 512,
        "GROUP_SIZE_M": 8,
        "num_stages": 3,
        "num_warps": 2,
        "compile_time": 19.709530353546143
    },
    {
        "BLOCK_SIZE_M": 16,
        "BLOCK_SIZE_N": 256,
        "BLOCK_SIZE_K": 512,
        "GROUP_SIZE_M": 8,
        "num_stages": 3,
        "num_warps": 4,
        "compile_time": 97.47532558441162
    },
    {
        "BLOCK_SIZE_M": 16,
        "BLOCK_SIZE_N": 256,
        "BLOCK_SIZE_K": 512,
        "GROUP_SIZE_M": 8,
        "num_stages": 3,
        "num_warps": 8,
        "compile_time": 10.625793218612671
    },
    {
        "BLOCK_SIZE_M": 16,
        "BLOCK_SIZE_N": 256,
        "BLOCK_SIZE_K": 512,
        "GROUP_SIZE_M": 8,
        "num_stages": 3,
        "num_warps": 16,
        "compile_time": 1.9388222694396973
    },
    {
        "BLOCK_SIZE_M": 16,
        "BLOCK_SIZE_N": 256,
        "BLOCK_SIZE_K": 512,
        "GROUP_SIZE_M": 8,
        "num_stages": 3,
        "num_warps": 32,
        "compile_time": 0.9259545803070068
    },
    {
        "BLOCK_SIZE_M": 16,
        "BLOCK_SIZE_N": 256,
        "BLOCK_SIZE_K": 512,
        "GROUP_SIZE_M": 8,
        "num_stages": 4,
        "num_warps": 2,
        "compile_time": 20.150942087173462
    },
    {
        "BLOCK_SIZE_M": 16,
        "BLOCK_SIZE_N": 256,
        "BLOCK_SIZE_K": 512,
        "GROUP_SIZE_M": 8,
        "num_stages": 4,
        "num_warps": 4,
        "compile_time": 6.041722536087036
    },
    {
        "BLOCK_SIZE_M": 16,
        "BLOCK_SIZE_N": 256,
        "BLOCK_SIZE_K": 512,
        "GROUP_SIZE_M": 8,
        "num_stages": 4,
        "num_warps": 8,
        "compile_time": 10.784790754318237
    },
    {
        "BLOCK_SIZE_M": 16,
        "BLOCK_SIZE_N": 256,
        "BLOCK_SIZE_K": 512,
        "GROUP_SIZE_M": 8,
        "num_stages": 4,
        "num_warps": 16,
        "compile_time": 2.1079373359680176
    },
    {
        "BLOCK_SIZE_M": 16,
        "BLOCK_SIZE_N": 256,
        "BLOCK_SIZE_K": 512,
        "GROUP_SIZE_M": 8,
        "num_stages": 4,
        "num_warps": 32,
        "compile_time": 1.016103982925415
    },
    {
        "BLOCK_SIZE_M": 16,
        "BLOCK_SIZE_N": 256,
        "BLOCK_SIZE_K": 512,
        "GROUP_SIZE_M": 8,
        "num_stages": 5,
        "num_warps": 2,
        "compile_time": 21.421454906463623
    },
    {
        "BLOCK_SIZE_M": 16,
        "BLOCK_SIZE_N": 256,
        "BLOCK_SIZE_K": 512,
        "GROUP_SIZE_M": 8,
        "num_stages": 5,
        "num_warps": 4,
        "compile_time": 6.482889652252197
    },
    {
        "BLOCK_SIZE_M": 16,
        "BLOCK_SIZE_N": 256,
        "BLOCK_SIZE_K": 512,
        "GROUP_SIZE_M": 8,
        "num_stages": 5,
        "num_warps": 8,
        "compile_time": 11.043959617614746
    },
    {
        "BLOCK_SIZE_M": 16,
        "BLOCK_SIZE_N": 256,
        "BLOCK_SIZE_K": 512,
        "GROUP_SIZE_M": 8,
        "num_stages": 5,
        "num_warps": 16,
        "compile_time": 2.3098766803741455
    },
    {
        "BLOCK_SIZE_M": 16,
        "BLOCK_SIZE_N": 256,
        "BLOCK_SIZE_K": 512,
        "GROUP_SIZE_M": 8,
        "num_stages": 5,
        "num_warps": 32,
        "compile_time": 1.1043808460235596
    },
    {
        "BLOCK_SIZE_M": 16,
        "BLOCK_SIZE_N": 256,
        "BLOCK_SIZE_K": 512,
        "GROUP_SIZE_M": 8,
        "num_stages": 6,
        "num_warps": 2,
        "compile_time": 22.255472421646118
    },
    {
        "BLOCK_SIZE_M": 16,
        "BLOCK_SIZE_N": 256,
        "BLOCK_SIZE_K": 512,
        "GROUP_SIZE_M": 8,
        "num_stages": 6,
        "num_warps": 4,
        "compile_time": 6.9088263511657715
    },
    {
        "BLOCK_SIZE_M": 16,
        "BLOCK_SIZE_N": 256,
        "BLOCK_SIZE_K": 512,
        "GROUP_SIZE_M": 8,
        "num_stages": 6,
        "num_warps": 8,
        "compile_time": 11.342183113098145
    },
    {
        "BLOCK_SIZE_M": 16,
        "BLOCK_SIZE_N": 256,
        "BLOCK_SIZE_K": 512,
        "GROUP_SIZE_M": 8,
        "num_stages": 6,
        "num_warps": 16,
        "compile_time": 2.5127010345458984
    },
    {
        "BLOCK_SIZE_M": 16,
        "BLOCK_SIZE_N": 256,
        "BLOCK_SIZE_K": 512,
        "GROUP_SIZE_M": 8,
        "num_stages": 6,
        "num_warps": 32,
        "compile_time": 1.1892614364624023
    },
    {
        "BLOCK_SIZE_M": 16,
        "BLOCK_SIZE_N": 256,
        "BLOCK_SIZE_K": 512,
        "GROUP_SIZE_M": 8,
        "num_stages": 7,
        "num_warps": 2,
        "compile_time": 22.578871488571167
    },
    {
        "BLOCK_SIZE_M": 16,
        "BLOCK_SIZE_N": 256,
        "BLOCK_SIZE_K": 512,
        "GROUP_SIZE_M": 8,
        "num_stages": 7,
        "num_warps": 4,
        "compile_time": 7.1855504512786865
    },
    {
        "BLOCK_SIZE_M": 16,
        "BLOCK_SIZE_N": 256,
        "BLOCK_SIZE_K": 512,
        "GROUP_SIZE_M": 8,
        "num_stages": 7,
        "num_warps": 8,
        "compile_time": 11.496315479278564
    },
    {
        "BLOCK_SIZE_M": 16,
        "BLOCK_SIZE_N": 256,
        "BLOCK_SIZE_K": 512,
        "GROUP_SIZE_M": 8,
        "num_stages": 7,
        "num_warps": 16,
        "compile_time": 2.64692759513855
    },
    {
        "BLOCK_SIZE_M": 16,
        "BLOCK_SIZE_N": 256,
        "BLOCK_SIZE_K": 512,
        "GROUP_SIZE_M": 8,
        "num_stages": 7,
        "num_warps": 32,
        "compile_time": 1.3034000396728516
    },
    {
        "BLOCK_SIZE_M": 16,
        "BLOCK_SIZE_N": 256,
        "BLOCK_SIZE_K": 512,
        "GROUP_SIZE_M": 8,
        "num_stages": 8,
        "num_warps": 2,
        "compile_time": 6.347271919250488
    },
    {
        "BLOCK_SIZE_M": 16,
        "BLOCK_SIZE_N": 256,
        "BLOCK_SIZE_K": 512,
        "GROUP_SIZE_M": 8,
        "num_stages": 8,
        "num_warps": 4,
        "compile_time": 7.7431440353393555
    },
    {
        "BLOCK_SIZE_M": 16,
        "BLOCK_SIZE_N": 256,
        "BLOCK_SIZE_K": 512,
        "GROUP_SIZE_M": 8,
        "num_stages": 8,
        "num_warps": 8,
        "compile_time": 11.873149394989014
    },
    {
        "BLOCK_SIZE_M": 16,
        "BLOCK_SIZE_N": 256,
        "BLOCK_SIZE_K": 512,
        "GROUP_SIZE_M": 8,
        "num_stages": 8,
        "num_warps": 16,
        "compile_time": 2.8991129398345947
    },
    {
        "BLOCK_SIZE_M": 16,
        "BLOCK_SIZE_N": 256,
        "BLOCK_SIZE_K": 512,
        "GROUP_SIZE_M": 8,
        "num_stages": 8,
        "num_warps": 32,
        "compile_time": 1.387298345565796
    },
    {
        "BLOCK_SIZE_M": 16,
        "BLOCK_SIZE_N": 512,
        "BLOCK_SIZE_K": 32,
        "GROUP_SIZE_M": 8,
        "num_stages": 6,
        "num_warps": 2,
        "compile_time": 2.5520267486572266
    },
    {
        "BLOCK_SIZE_M": 16,
        "BLOCK_SIZE_N": 512,
        "BLOCK_SIZE_K": 32,
        "GROUP_SIZE_M": 8,
        "num_stages": 6,
        "num_warps": 4,
        "compile_time": 1.1625781059265137
    },
    {
        "BLOCK_SIZE_M": 16,
        "BLOCK_SIZE_N": 512,
        "BLOCK_SIZE_K": 32,
        "GROUP_SIZE_M": 8,
        "num_stages": 6,
        "num_warps": 8,
        "compile_time": 0.6690483093261719
    },
    {
        "BLOCK_SIZE_M": 16,
        "BLOCK_SIZE_N": 512,
        "BLOCK_SIZE_K": 32,
        "GROUP_SIZE_M": 8,
        "num_stages": 7,
        "num_warps": 2,
        "compile_time": 2.656376838684082
    },
    {
        "BLOCK_SIZE_M": 16,
        "BLOCK_SIZE_N": 512,
        "BLOCK_SIZE_K": 32,
        "GROUP_SIZE_M": 8,
        "num_stages": 7,
        "num_warps": 4,
        "compile_time": 1.2185792922973633
    },
    {
        "BLOCK_SIZE_M": 16,
        "BLOCK_SIZE_N": 512,
        "BLOCK_SIZE_K": 32,
        "GROUP_SIZE_M": 8,
        "num_stages": 7,
        "num_warps": 8,
        "compile_time": 0.7100036144256592
    },
    {
        "BLOCK_SIZE_M": 16,
        "BLOCK_SIZE_N": 512,
        "BLOCK_SIZE_K": 32,
        "GROUP_SIZE_M": 8,
        "num_stages": 7,
        "num_warps": 16,
        "compile_time": 0.4693622589111328
    },
    {
        "BLOCK_SIZE_M": 16,
        "BLOCK_SIZE_N": 512,
        "BLOCK_SIZE_K": 32,
        "GROUP_SIZE_M": 8,
        "num_stages": 7,
        "num_warps": 32,
        "compile_time": 0.39026927947998047
    },
    {
        "BLOCK_SIZE_M": 16,
        "BLOCK_SIZE_N": 512,
        "BLOCK_SIZE_K": 32,
        "GROUP_SIZE_M": 8,
        "num_stages": 8,
        "num_warps": 2,
        "compile_time": 2.7476439476013184
    },
    {
        "BLOCK_SIZE_M": 16,
        "BLOCK_SIZE_N": 512,
        "BLOCK_SIZE_K": 32,
        "GROUP_SIZE_M": 8,
        "num_stages": 8,
        "num_warps": 4,
        "compile_time": 1.314058780670166
    },
    {
        "BLOCK_SIZE_M": 16,
        "BLOCK_SIZE_N": 512,
        "BLOCK_SIZE_K": 32,
        "GROUP_SIZE_M": 8,
        "num_stages": 8,
        "num_warps": 8,
        "compile_time": 0.7666771411895752
    },
    {
        "BLOCK_SIZE_M": 16,
        "BLOCK_SIZE_N": 512,
        "BLOCK_SIZE_K": 32,
        "GROUP_SIZE_M": 8,
        "num_stages": 8,
        "num_warps": 16,
        "compile_time": 0.5303187370300293
    },
    {
        "BLOCK_SIZE_M": 16,
        "BLOCK_SIZE_N": 512,
        "BLOCK_SIZE_K": 32,
        "GROUP_SIZE_M": 8,
        "num_stages": 8,
        "num_warps": 32,
        "compile_time": 0.4278285503387451
    },
    {
        "BLOCK_SIZE_M": 16,
        "BLOCK_SIZE_N": 512,
        "BLOCK_SIZE_K": 64,
        "GROUP_SIZE_M": 8,
        "num_stages": 3,
        "num_warps": 2,
        "compile_time": 10.861087322235107
    },
    {
        "BLOCK_SIZE_M": 16,
        "BLOCK_SIZE_N": 512,
        "BLOCK_SIZE_K": 64,
        "GROUP_SIZE_M": 8,
        "num_stages": 4,
        "num_warps": 2,
        "compile_time": 11.160537481307983
    },
    {
        "BLOCK_SIZE_M": 16,
        "BLOCK_SIZE_N": 512,
        "BLOCK_SIZE_K": 64,
        "GROUP_SIZE_M": 8,
        "num_stages": 4,
        "num_warps": 4,
        "compile_time": 2.1409413814544678
    },
    {
        "BLOCK_SIZE_M": 16,
        "BLOCK_SIZE_N": 512,
        "BLOCK_SIZE_K": 64,
        "GROUP_SIZE_M": 8,
        "num_stages": 4,
        "num_warps": 8,
        "compile_time": 0.9680900573730469
    },
    {
        "BLOCK_SIZE_M": 16,
        "BLOCK_SIZE_N": 512,
        "BLOCK_SIZE_K": 64,
        "GROUP_SIZE_M": 8,
        "num_stages": 4,
        "num_warps": 16,
        "compile_time": 0.5848557949066162
    },
    {
        "BLOCK_SIZE_M": 16,
        "BLOCK_SIZE_N": 512,
        "BLOCK_SIZE_K": 64,
        "GROUP_SIZE_M": 8,
        "num_stages": 4,
        "num_warps": 32,
        "compile_time": 0.40515589714050293
    },
    {
        "BLOCK_SIZE_M": 16,
        "BLOCK_SIZE_N": 512,
        "BLOCK_SIZE_K": 64,
        "GROUP_SIZE_M": 8,
        "num_stages": 5,
        "num_warps": 2,
        "compile_time": 11.215632438659668
    },
    {
        "BLOCK_SIZE_M": 16,
        "BLOCK_SIZE_N": 512,
        "BLOCK_SIZE_K": 64,
        "GROUP_SIZE_M": 8,
        "num_stages": 5,
        "num_warps": 4,
        "compile_time": 2.194075107574463
    },
    {
        "BLOCK_SIZE_M": 16,
        "BLOCK_SIZE_N": 512,
        "BLOCK_SIZE_K": 64,
        "GROUP_SIZE_M": 8,
        "num_stages": 5,
        "num_warps": 8,
        "compile_time": 1.0238609313964844
    },
    {
        "BLOCK_SIZE_M": 16,
        "BLOCK_SIZE_N": 512,
        "BLOCK_SIZE_K": 64,
        "GROUP_SIZE_M": 8,
        "num_stages": 5,
        "num_warps": 16,
        "compile_time": 0.6100871562957764
    },
    {
        "BLOCK_SIZE_M": 16,
        "BLOCK_SIZE_N": 512,
        "BLOCK_SIZE_K": 64,
        "GROUP_SIZE_M": 8,
        "num_stages": 5,
        "num_warps": 32,
        "compile_time": 0.4297151565551758
    },
    {
        "BLOCK_SIZE_M": 16,
        "BLOCK_SIZE_N": 512,
        "BLOCK_SIZE_K": 64,
        "GROUP_SIZE_M": 8,
        "num_stages": 6,
        "num_warps": 2,
        "compile_time": 11.586806774139404
    },
    {
        "BLOCK_SIZE_M": 16,
        "BLOCK_SIZE_N": 512,
        "BLOCK_SIZE_K": 64,
        "GROUP_SIZE_M": 8,
        "num_stages": 6,
        "num_warps": 4,
        "compile_time": 2.381488800048828
    },
    {
        "BLOCK_SIZE_M": 16,
        "BLOCK_SIZE_N": 512,
        "BLOCK_SIZE_K": 64,
        "GROUP_SIZE_M": 8,
        "num_stages": 6,
        "num_warps": 8,
        "compile_time": 1.0863926410675049
    },
    {
        "BLOCK_SIZE_M": 16,
        "BLOCK_SIZE_N": 512,
        "BLOCK_SIZE_K": 64,
        "GROUP_SIZE_M": 8,
        "num_stages": 6,
        "num_warps": 16,
        "compile_time": 0.6314878463745117
    },
    {
        "BLOCK_SIZE_M": 16,
        "BLOCK_SIZE_N": 512,
        "BLOCK_SIZE_K": 64,
        "GROUP_SIZE_M": 8,
        "num_stages": 6,
        "num_warps": 32,
        "compile_time": 0.4478278160095215
    },
    {
        "BLOCK_SIZE_M": 16,
        "BLOCK_SIZE_N": 512,
        "BLOCK_SIZE_K": 64,
        "GROUP_SIZE_M": 8,
        "num_stages": 7,
        "num_warps": 2,
        "compile_time": 11.575612545013428
    },
    {
        "BLOCK_SIZE_M": 16,
        "BLOCK_SIZE_N": 512,
        "BLOCK_SIZE_K": 64,
        "GROUP_SIZE_M": 8,
        "num_stages": 7,
        "num_warps": 4,
        "compile_time": 2.4301581382751465
    },
    {
        "BLOCK_SIZE_M": 16,
        "BLOCK_SIZE_N": 512,
        "BLOCK_SIZE_K": 64,
        "GROUP_SIZE_M": 8,
        "num_stages": 7,
        "num_warps": 8,
        "compile_time": 1.184091329574585
    },
    {
        "BLOCK_SIZE_M": 16,
        "BLOCK_SIZE_N": 512,
        "BLOCK_SIZE_K": 64,
        "GROUP_SIZE_M": 8,
        "num_stages": 7,
        "num_warps": 16,
        "compile_time": 0.706862211227417
    },
    {
        "BLOCK_SIZE_M": 16,
        "BLOCK_SIZE_N": 512,
        "BLOCK_SIZE_K": 64,
        "GROUP_SIZE_M": 8,
        "num_stages": 7,
        "num_warps": 32,
        "compile_time": 0.4707326889038086
    },
    {
        "BLOCK_SIZE_M": 16,
        "BLOCK_SIZE_N": 512,
        "BLOCK_SIZE_K": 64,
        "GROUP_SIZE_M": 8,
        "num_stages": 8,
        "num_warps": 2,
        "compile_time": 11.72652554512024
    },
    {
        "BLOCK_SIZE_M": 16,
        "BLOCK_SIZE_N": 512,
        "BLOCK_SIZE_K": 64,
        "GROUP_SIZE_M": 8,
        "num_stages": 8,
        "num_warps": 4,
        "compile_time": 2.5550875663757324
    },
    {
        "BLOCK_SIZE_M": 16,
        "BLOCK_SIZE_N": 512,
        "BLOCK_SIZE_K": 64,
        "GROUP_SIZE_M": 8,
        "num_stages": 8,
        "num_warps": 8,
        "compile_time": 1.2711749076843262
    },
    {
        "BLOCK_SIZE_M": 16,
        "BLOCK_SIZE_N": 512,
        "BLOCK_SIZE_K": 64,
        "GROUP_SIZE_M": 8,
        "num_stages": 8,
        "num_warps": 16,
        "compile_time": 0.7332155704498291
    },
    {
        "BLOCK_SIZE_M": 16,
        "BLOCK_SIZE_N": 512,
        "BLOCK_SIZE_K": 64,
        "GROUP_SIZE_M": 8,
        "num_stages": 8,
        "num_warps": 32,
        "compile_time": 0.4821178913116455
    },
    {
        "BLOCK_SIZE_M": 16,
        "BLOCK_SIZE_N": 512,
        "BLOCK_SIZE_K": 128,
        "GROUP_SIZE_M": 8,
        "num_stages": 1,
        "num_warps": 2,
        "compile_time": 7.923251152038574
    },
    {
        "BLOCK_SIZE_M": 16,
        "BLOCK_SIZE_N": 512,
        "BLOCK_SIZE_K": 128,
        "GROUP_SIZE_M": 8,
        "num_stages": 2,
        "num_warps": 2,
        "compile_time": 7.942071914672852
    },
    {
        "BLOCK_SIZE_M": 16,
        "BLOCK_SIZE_N": 512,
        "BLOCK_SIZE_K": 128,
        "GROUP_SIZE_M": 8,
        "num_stages": 3,
        "num_warps": 2,
        "compile_time": 99.4446291923523
    },
    {
        "BLOCK_SIZE_M": 16,
        "BLOCK_SIZE_N": 512,
        "BLOCK_SIZE_K": 128,
        "GROUP_SIZE_M": 8,
        "num_stages": 3,
        "num_warps": 4,
        "compile_time": 10.756542444229126
    },
    {
        "BLOCK_SIZE_M": 16,
        "BLOCK_SIZE_N": 512,
        "BLOCK_SIZE_K": 128,
        "GROUP_SIZE_M": 8,
        "num_stages": 3,
        "num_warps": 8,
        "compile_time": 1.8768010139465332
    },
    {
        "BLOCK_SIZE_M": 16,
        "BLOCK_SIZE_N": 512,
        "BLOCK_SIZE_K": 128,
        "GROUP_SIZE_M": 8,
        "num_stages": 3,
        "num_warps": 16,
        "compile_time": 0.8691890239715576
    },
    {
        "BLOCK_SIZE_M": 16,
        "BLOCK_SIZE_N": 512,
        "BLOCK_SIZE_K": 128,
        "GROUP_SIZE_M": 8,
        "num_stages": 3,
        "num_warps": 32,
        "compile_time": 0.5427091121673584
    },
    {
        "BLOCK_SIZE_M": 16,
        "BLOCK_SIZE_N": 512,
        "BLOCK_SIZE_K": 128,
        "GROUP_SIZE_M": 8,
        "num_stages": 4,
        "num_warps": 2,
        "compile_time": 6.104132890701294
    },
    {
        "BLOCK_SIZE_M": 16,
        "BLOCK_SIZE_N": 512,
        "BLOCK_SIZE_K": 128,
        "GROUP_SIZE_M": 8,
        "num_stages": 4,
        "num_warps": 4,
        "compile_time": 10.879002809524536
    },
    {
        "BLOCK_SIZE_M": 16,
        "BLOCK_SIZE_N": 512,
        "BLOCK_SIZE_K": 128,
        "GROUP_SIZE_M": 8,
        "num_stages": 4,
        "num_warps": 8,
        "compile_time": 2.0250260829925537
    },
    {
        "BLOCK_SIZE_M": 16,
        "BLOCK_SIZE_N": 512,
        "BLOCK_SIZE_K": 128,
        "GROUP_SIZE_M": 8,
        "num_stages": 4,
        "num_warps": 16,
        "compile_time": 0.9453122615814209
    },
    {
        "BLOCK_SIZE_M": 16,
        "BLOCK_SIZE_N": 512,
        "BLOCK_SIZE_K": 128,
        "GROUP_SIZE_M": 8,
        "num_stages": 4,
        "num_warps": 32,
        "compile_time": 0.5771927833557129
    },
    {
        "BLOCK_SIZE_M": 16,
        "BLOCK_SIZE_N": 512,
        "BLOCK_SIZE_K": 128,
        "GROUP_SIZE_M": 8,
        "num_stages": 5,
        "num_warps": 2,
        "compile_time": 6.341995000839233
    },
    {
        "BLOCK_SIZE_M": 16,
        "BLOCK_SIZE_N": 512,
        "BLOCK_SIZE_K": 128,
        "GROUP_SIZE_M": 8,
        "num_stages": 5,
        "num_warps": 4,
        "compile_time": 11.049196720123291
    },
    {
        "BLOCK_SIZE_M": 16,
        "BLOCK_SIZE_N": 512,
        "BLOCK_SIZE_K": 128,
        "GROUP_SIZE_M": 8,
        "num_stages": 5,
        "num_warps": 8,
        "compile_time": 2.1050572395324707
    },
    {
        "BLOCK_SIZE_M": 16,
        "BLOCK_SIZE_N": 512,
        "BLOCK_SIZE_K": 128,
        "GROUP_SIZE_M": 8,
        "num_stages": 5,
        "num_warps": 16,
        "compile_time": 1.0139424800872803
    },
    {
        "BLOCK_SIZE_M": 16,
        "BLOCK_SIZE_N": 512,
        "BLOCK_SIZE_K": 128,
        "GROUP_SIZE_M": 8,
        "num_stages": 5,
        "num_warps": 32,
        "compile_time": 0.6195504665374756
    },
    {
        "BLOCK_SIZE_M": 16,
        "BLOCK_SIZE_N": 512,
        "BLOCK_SIZE_K": 128,
        "GROUP_SIZE_M": 8,
        "num_stages": 6,
        "num_warps": 2,
        "compile_time": 6.674833059310913
    },
    {
        "BLOCK_SIZE_M": 16,
        "BLOCK_SIZE_N": 512,
        "BLOCK_SIZE_K": 128,
        "GROUP_SIZE_M": 8,
        "num_stages": 6,
        "num_warps": 4,
        "compile_time": 11.192957878112793
    },
    {
        "BLOCK_SIZE_M": 16,
        "BLOCK_SIZE_N": 512,
        "BLOCK_SIZE_K": 128,
        "GROUP_SIZE_M": 8,
        "num_stages": 6,
        "num_warps": 8,
        "compile_time": 2.2497973442077637
    },
    {
        "BLOCK_SIZE_M": 16,
        "BLOCK_SIZE_N": 512,
        "BLOCK_SIZE_K": 128,
        "GROUP_SIZE_M": 8,
        "num_stages": 6,
        "num_warps": 16,
        "compile_time": 1.1081457138061523
    },
    {
        "BLOCK_SIZE_M": 16,
        "BLOCK_SIZE_N": 512,
        "BLOCK_SIZE_K": 128,
        "GROUP_SIZE_M": 8,
        "num_stages": 6,
        "num_warps": 32,
        "compile_time": 0.67250657081604
    },
    {
        "BLOCK_SIZE_M": 16,
        "BLOCK_SIZE_N": 512,
        "BLOCK_SIZE_K": 128,
        "GROUP_SIZE_M": 8,
        "num_stages": 7,
        "num_warps": 2,
        "compile_time": 7.063200235366821
    },
    {
        "BLOCK_SIZE_M": 16,
        "BLOCK_SIZE_N": 512,
        "BLOCK_SIZE_K": 128,
        "GROUP_SIZE_M": 8,
        "num_stages": 7,
        "num_warps": 4,
        "compile_time": 11.40710973739624
    },
    {
        "BLOCK_SIZE_M": 16,
        "BLOCK_SIZE_N": 512,
        "BLOCK_SIZE_K": 128,
        "GROUP_SIZE_M": 8,
        "num_stages": 7,
        "num_warps": 8,
        "compile_time": 2.3909988403320312
    },
    {
        "BLOCK_SIZE_M": 16,
        "BLOCK_SIZE_N": 512,
        "BLOCK_SIZE_K": 128,
        "GROUP_SIZE_M": 8,
        "num_stages": 7,
        "num_warps": 16,
        "compile_time": 1.1749091148376465
    },
    {
        "BLOCK_SIZE_M": 16,
        "BLOCK_SIZE_N": 512,
        "BLOCK_SIZE_K": 128,
        "GROUP_SIZE_M": 8,
        "num_stages": 7,
        "num_warps": 32,
        "compile_time": 0.7065305709838867
    },
    {
        "BLOCK_SIZE_M": 16,
        "BLOCK_SIZE_N": 512,
        "BLOCK_SIZE_K": 128,
        "GROUP_SIZE_M": 8,
        "num_stages": 8,
        "num_warps": 2,
        "compile_time": 7.3552937507629395
    },
    {
        "BLOCK_SIZE_M": 16,
        "BLOCK_SIZE_N": 512,
        "BLOCK_SIZE_K": 128,
        "GROUP_SIZE_M": 8,
        "num_stages": 8,
        "num_warps": 4,
        "compile_time": 11.56566572189331
    },
    {
        "BLOCK_SIZE_M": 16,
        "BLOCK_SIZE_N": 512,
        "BLOCK_SIZE_K": 128,
        "GROUP_SIZE_M": 8,
        "num_stages": 8,
        "num_warps": 8,
        "compile_time": 2.512983560562134
    },
    {
        "BLOCK_SIZE_M": 16,
        "BLOCK_SIZE_N": 512,
        "BLOCK_SIZE_K": 128,
        "GROUP_SIZE_M": 8,
        "num_stages": 8,
        "num_warps": 16,
        "compile_time": 1.2558448314666748
    },
    {
        "BLOCK_SIZE_M": 16,
        "BLOCK_SIZE_N": 512,
        "BLOCK_SIZE_K": 128,
        "GROUP_SIZE_M": 8,
        "num_stages": 8,
        "num_warps": 32,
        "compile_time": 0.7772743701934814
    },
    {
        "BLOCK_SIZE_M": 16,
        "BLOCK_SIZE_N": 512,
        "BLOCK_SIZE_K": 256,
        "GROUP_SIZE_M": 8,
        "num_stages": 1,
        "num_warps": 2,
        "compile_time": 19.14008927345276
    },
    {
        "BLOCK_SIZE_M": 16,
        "BLOCK_SIZE_N": 512,
        "BLOCK_SIZE_K": 256,
        "GROUP_SIZE_M": 8,
        "num_stages": 1,
        "num_warps": 4,
        "compile_time": 7.886031627655029
    },
    {
        "BLOCK_SIZE_M": 16,
        "BLOCK_SIZE_N": 512,
        "BLOCK_SIZE_K": 256,
        "GROUP_SIZE_M": 8,
        "num_stages": 1,
        "num_warps": 8,
        "compile_time": 2.724311590194702
    },
    {
        "BLOCK_SIZE_M": 16,
        "BLOCK_SIZE_N": 512,
        "BLOCK_SIZE_K": 256,
        "GROUP_SIZE_M": 8,
        "num_stages": 1,
        "num_warps": 16,
        "compile_time": 1.0915629863739014
    },
    {
        "BLOCK_SIZE_M": 16,
        "BLOCK_SIZE_N": 512,
        "BLOCK_SIZE_K": 256,
        "GROUP_SIZE_M": 8,
        "num_stages": 1,
        "num_warps": 32,
        "compile_time": 0.6409718990325928
    },
    {
        "BLOCK_SIZE_M": 16,
        "BLOCK_SIZE_N": 512,
        "BLOCK_SIZE_K": 256,
        "GROUP_SIZE_M": 8,
        "num_stages": 2,
        "num_warps": 2,
        "compile_time": 18.808614015579224
    },
    {
        "BLOCK_SIZE_M": 16,
        "BLOCK_SIZE_N": 512,
        "BLOCK_SIZE_K": 256,
        "GROUP_SIZE_M": 8,
        "num_stages": 2,
        "num_warps": 4,
        "compile_time": 7.687626123428345
    },
    {
        "BLOCK_SIZE_M": 16,
        "BLOCK_SIZE_N": 512,
        "BLOCK_SIZE_K": 256,
        "GROUP_SIZE_M": 8,
        "num_stages": 2,
        "num_warps": 8,
        "compile_time": 2.9822185039520264
    },
    {
        "BLOCK_SIZE_M": 16,
        "BLOCK_SIZE_N": 512,
        "BLOCK_SIZE_K": 256,
        "GROUP_SIZE_M": 8,
        "num_stages": 2,
        "num_warps": 16,
        "compile_time": 1.2677936553955078
    },
    {
        "BLOCK_SIZE_M": 16,
        "BLOCK_SIZE_N": 512,
        "BLOCK_SIZE_K": 256,
        "GROUP_SIZE_M": 8,
        "num_stages": 2,
        "num_warps": 32,
        "compile_time": 0.752995491027832
    },
    {
        "BLOCK_SIZE_M": 16,
        "BLOCK_SIZE_N": 512,
        "BLOCK_SIZE_K": 256,
        "GROUP_SIZE_M": 8,
        "num_stages": 3,
        "num_warps": 2,
        "compile_time": 20.2094247341156
    },
    {
        "BLOCK_SIZE_M": 16,
        "BLOCK_SIZE_N": 512,
        "BLOCK_SIZE_K": 256,
        "GROUP_SIZE_M": 8,
        "num_stages": 3,
        "num_warps": 4,
        "compile_time": 100.45590376853943
    },
    {
        "BLOCK_SIZE_M": 16,
        "BLOCK_SIZE_N": 512,
        "BLOCK_SIZE_K": 256,
        "GROUP_SIZE_M": 8,
        "num_stages": 3,
        "num_warps": 8,
        "compile_time": 10.794337749481201
    },
    {
        "BLOCK_SIZE_M": 16,
        "BLOCK_SIZE_N": 512,
        "BLOCK_SIZE_K": 256,
        "GROUP_SIZE_M": 8,
        "num_stages": 3,
        "num_warps": 16,
        "compile_time": 1.942101240158081
    },
    {
        "BLOCK_SIZE_M": 16,
        "BLOCK_SIZE_N": 512,
        "BLOCK_SIZE_K": 256,
        "GROUP_SIZE_M": 8,
        "num_stages": 3,
        "num_warps": 32,
        "compile_time": 0.9048469066619873
    },
    {
        "BLOCK_SIZE_M": 16,
        "BLOCK_SIZE_N": 512,
        "BLOCK_SIZE_K": 256,
        "GROUP_SIZE_M": 8,
        "num_stages": 4,
        "num_warps": 2,
        "compile_time": 20.73682713508606
    },
    {
        "BLOCK_SIZE_M": 16,
        "BLOCK_SIZE_N": 512,
        "BLOCK_SIZE_K": 256,
        "GROUP_SIZE_M": 8,
        "num_stages": 4,
        "num_warps": 4,
        "compile_time": 6.160007476806641
    },
    {
        "BLOCK_SIZE_M": 16,
        "BLOCK_SIZE_N": 512,
        "BLOCK_SIZE_K": 256,
        "GROUP_SIZE_M": 8,
        "num_stages": 4,
        "num_warps": 8,
        "compile_time": 10.878145933151245
    },
    {
        "BLOCK_SIZE_M": 16,
        "BLOCK_SIZE_N": 512,
        "BLOCK_SIZE_K": 256,
        "GROUP_SIZE_M": 8,
        "num_stages": 4,
        "num_warps": 16,
        "compile_time": 2.0807337760925293
    },
    {
        "BLOCK_SIZE_M": 16,
        "BLOCK_SIZE_N": 512,
        "BLOCK_SIZE_K": 256,
        "GROUP_SIZE_M": 8,
        "num_stages": 4,
        "num_warps": 32,
        "compile_time": 0.9980289936065674
    },
    {
        "BLOCK_SIZE_M": 16,
        "BLOCK_SIZE_N": 512,
        "BLOCK_SIZE_K": 256,
        "GROUP_SIZE_M": 8,
        "num_stages": 5,
        "num_warps": 2,
        "compile_time": 21.19805359840393
    },
    {
        "BLOCK_SIZE_M": 16,
        "BLOCK_SIZE_N": 512,
        "BLOCK_SIZE_K": 256,
        "GROUP_SIZE_M": 8,
        "num_stages": 5,
        "num_warps": 4,
        "compile_time": 6.551870822906494
    },
    {
        "BLOCK_SIZE_M": 16,
        "BLOCK_SIZE_N": 512,
        "BLOCK_SIZE_K": 256,
        "GROUP_SIZE_M": 8,
        "num_stages": 5,
        "num_warps": 8,
        "compile_time": 10.911613464355469
    },
    {
        "BLOCK_SIZE_M": 16,
        "BLOCK_SIZE_N": 512,
        "BLOCK_SIZE_K": 256,
        "GROUP_SIZE_M": 8,
        "num_stages": 5,
        "num_warps": 16,
        "compile_time": 2.213073492050171
    },
    {
        "BLOCK_SIZE_M": 16,
        "BLOCK_SIZE_N": 512,
        "BLOCK_SIZE_K": 256,
        "GROUP_SIZE_M": 8,
        "num_stages": 5,
        "num_warps": 32,
        "compile_time": 1.0446374416351318
    },
    {
        "BLOCK_SIZE_M": 16,
        "BLOCK_SIZE_N": 512,
        "BLOCK_SIZE_K": 256,
        "GROUP_SIZE_M": 8,
        "num_stages": 6,
        "num_warps": 2,
        "compile_time": 22.337989330291748
    },
    {
        "BLOCK_SIZE_M": 16,
        "BLOCK_SIZE_N": 512,
        "BLOCK_SIZE_K": 256,
        "GROUP_SIZE_M": 8,
        "num_stages": 6,
        "num_warps": 4,
        "compile_time": 6.751985311508179
    },
    {
        "BLOCK_SIZE_M": 16,
        "BLOCK_SIZE_N": 512,
        "BLOCK_SIZE_K": 256,
        "GROUP_SIZE_M": 8,
        "num_stages": 6,
        "num_warps": 8,
        "compile_time": 11.236348867416382
    },
    {
        "BLOCK_SIZE_M": 16,
        "BLOCK_SIZE_N": 512,
        "BLOCK_SIZE_K": 256,
        "GROUP_SIZE_M": 8,
        "num_stages": 6,
        "num_warps": 16,
        "compile_time": 2.4264118671417236
    },
    {
        "BLOCK_SIZE_M": 16,
        "BLOCK_SIZE_N": 512,
        "BLOCK_SIZE_K": 256,
        "GROUP_SIZE_M": 8,
        "num_stages": 6,
        "num_warps": 32,
        "compile_time": 1.1859855651855469
    },
    {
        "BLOCK_SIZE_M": 16,
        "BLOCK_SIZE_N": 512,
        "BLOCK_SIZE_K": 256,
        "GROUP_SIZE_M": 8,
        "num_stages": 7,
        "num_warps": 2,
        "compile_time": 22.613105297088623
    },
    {
        "BLOCK_SIZE_M": 16,
        "BLOCK_SIZE_N": 512,
        "BLOCK_SIZE_K": 256,
        "GROUP_SIZE_M": 8,
        "num_stages": 7,
        "num_warps": 4,
        "compile_time": 7.177466869354248
    },
    {
        "BLOCK_SIZE_M": 16,
        "BLOCK_SIZE_N": 512,
        "BLOCK_SIZE_K": 256,
        "GROUP_SIZE_M": 8,
        "num_stages": 7,
        "num_warps": 8,
        "compile_time": 11.487154960632324
    },
    {
        "BLOCK_SIZE_M": 16,
        "BLOCK_SIZE_N": 512,
        "BLOCK_SIZE_K": 256,
        "GROUP_SIZE_M": 8,
        "num_stages": 7,
        "num_warps": 16,
        "compile_time": 2.6019675731658936
    },
    {
        "BLOCK_SIZE_M": 16,
        "BLOCK_SIZE_N": 512,
        "BLOCK_SIZE_K": 256,
        "GROUP_SIZE_M": 8,
        "num_stages": 7,
        "num_warps": 32,
        "compile_time": 1.2568602561950684
    },
    {
        "BLOCK_SIZE_M": 16,
        "BLOCK_SIZE_N": 512,
        "BLOCK_SIZE_K": 256,
        "GROUP_SIZE_M": 8,
        "num_stages": 8,
        "num_warps": 2,
        "compile_time": 6.115542650222778
    },
    {
        "BLOCK_SIZE_M": 16,
        "BLOCK_SIZE_N": 512,
        "BLOCK_SIZE_K": 256,
        "GROUP_SIZE_M": 8,
        "num_stages": 8,
        "num_warps": 4,
        "compile_time": 7.636962890625
    },
    {
        "BLOCK_SIZE_M": 16,
        "BLOCK_SIZE_N": 512,
        "BLOCK_SIZE_K": 256,
        "GROUP_SIZE_M": 8,
        "num_stages": 8,
        "num_warps": 8,
        "compile_time": 11.804742574691772
    },
    {
        "BLOCK_SIZE_M": 16,
        "BLOCK_SIZE_N": 512,
        "BLOCK_SIZE_K": 256,
        "GROUP_SIZE_M": 8,
        "num_stages": 8,
        "num_warps": 16,
        "compile_time": 2.7645983695983887
    },
    {
        "BLOCK_SIZE_M": 16,
        "BLOCK_SIZE_N": 512,
        "BLOCK_SIZE_K": 256,
        "GROUP_SIZE_M": 8,
        "num_stages": 8,
        "num_warps": 32,
        "compile_time": 1.3458490371704102
    },
    {
        "BLOCK_SIZE_M": 16,
        "BLOCK_SIZE_N": 512,
        "BLOCK_SIZE_K": 512,
        "GROUP_SIZE_M": 8,
        "num_stages": 1,
        "num_warps": 2,
        "compile_time": 71.09928011894226
    },
    {
        "BLOCK_SIZE_M": 16,
        "BLOCK_SIZE_N": 512,
        "BLOCK_SIZE_K": 512,
        "GROUP_SIZE_M": 8,
        "num_stages": 1,
        "num_warps": 4,
        "compile_time": 18.765290021896362
    },
    {
        "BLOCK_SIZE_M": 16,
        "BLOCK_SIZE_N": 512,
        "BLOCK_SIZE_K": 512,
        "GROUP_SIZE_M": 8,
        "num_stages": 1,
        "num_warps": 8,
        "compile_time": 7.814735174179077
    },
    {
        "BLOCK_SIZE_M": 16,
        "BLOCK_SIZE_N": 512,
        "BLOCK_SIZE_K": 512,
        "GROUP_SIZE_M": 8,
        "num_stages": 1,
        "num_warps": 16,
        "compile_time": 2.7595293521881104
    },
    {
        "BLOCK_SIZE_M": 16,
        "BLOCK_SIZE_N": 512,
        "BLOCK_SIZE_K": 512,
        "GROUP_SIZE_M": 8,
        "num_stages": 1,
        "num_warps": 32,
        "compile_time": 1.1769862174987793
    },
    {
        "BLOCK_SIZE_M": 16,
        "BLOCK_SIZE_N": 512,
        "BLOCK_SIZE_K": 512,
        "GROUP_SIZE_M": 8,
        "num_stages": 2,
        "num_warps": 2,
        "compile_time": 72.67698287963867
    },
    {
        "BLOCK_SIZE_M": 16,
        "BLOCK_SIZE_N": 512,
        "BLOCK_SIZE_K": 512,
        "GROUP_SIZE_M": 8,
        "num_stages": 2,
        "num_warps": 4,
        "compile_time": 19.11854577064514
    },
    {
        "BLOCK_SIZE_M": 16,
        "BLOCK_SIZE_N": 512,
        "BLOCK_SIZE_K": 512,
        "GROUP_SIZE_M": 8,
        "num_stages": 2,
        "num_warps": 8,
        "compile_time": 7.888325214385986
    },
    {
        "BLOCK_SIZE_M": 16,
        "BLOCK_SIZE_N": 512,
        "BLOCK_SIZE_K": 512,
        "GROUP_SIZE_M": 8,
        "num_stages": 2,
        "num_warps": 16,
        "compile_time": 3.104290008544922
    },
    {
        "BLOCK_SIZE_M": 16,
        "BLOCK_SIZE_N": 512,
        "BLOCK_SIZE_K": 512,
        "GROUP_SIZE_M": 8,
        "num_stages": 2,
        "num_warps": 32,
        "compile_time": 1.3205597400665283
    },
    {
        "BLOCK_SIZE_M": 16,
        "BLOCK_SIZE_N": 512,
        "BLOCK_SIZE_K": 512,
        "GROUP_SIZE_M": 8,
        "num_stages": 3,
        "num_warps": 2,
        "compile_time": 6.924700021743774
    },
    {
        "BLOCK_SIZE_M": 16,
        "BLOCK_SIZE_N": 512,
        "BLOCK_SIZE_K": 512,
        "GROUP_SIZE_M": 8,
        "num_stages": 3,
        "num_warps": 4,
        "compile_time": 19.71026062965393
    },
    {
        "BLOCK_SIZE_M": 16,
        "BLOCK_SIZE_N": 512,
        "BLOCK_SIZE_K": 512,
        "GROUP_SIZE_M": 8,
        "num_stages": 3,
        "num_warps": 8,
        "compile_time": 6.056506872177124
    },
    {
        "BLOCK_SIZE_M": 16,
        "BLOCK_SIZE_N": 512,
        "BLOCK_SIZE_K": 512,
        "GROUP_SIZE_M": 8,
        "num_stages": 3,
        "num_warps": 16,
        "compile_time": 10.881469249725342
    },
    {
        "BLOCK_SIZE_M": 16,
        "BLOCK_SIZE_N": 512,
        "BLOCK_SIZE_K": 512,
        "GROUP_SIZE_M": 8,
        "num_stages": 3,
        "num_warps": 32,
        "compile_time": 2.03080415725708
    },
    {
        "BLOCK_SIZE_M": 16,
        "BLOCK_SIZE_N": 512,
        "BLOCK_SIZE_K": 512,
        "GROUP_SIZE_M": 8,
        "num_stages": 4,
        "num_warps": 2,
        "compile_time": 8.622924566268921
    },
    {
        "BLOCK_SIZE_M": 16,
        "BLOCK_SIZE_N": 512,
        "BLOCK_SIZE_K": 512,
        "GROUP_SIZE_M": 8,
        "num_stages": 4,
        "num_warps": 4,
        "compile_time": 20.775527000427246
    },
    {
        "BLOCK_SIZE_M": 16,
        "BLOCK_SIZE_N": 512,
        "BLOCK_SIZE_K": 512,
        "GROUP_SIZE_M": 8,
        "num_stages": 4,
        "num_warps": 8,
        "compile_time": 6.229958772659302
    },
    {
        "BLOCK_SIZE_M": 16,
        "BLOCK_SIZE_N": 512,
        "BLOCK_SIZE_K": 512,
        "GROUP_SIZE_M": 8,
        "num_stages": 4,
        "num_warps": 16,
        "compile_time": 10.966368436813354
    },
    {
        "BLOCK_SIZE_M": 16,
        "BLOCK_SIZE_N": 512,
        "BLOCK_SIZE_K": 512,
        "GROUP_SIZE_M": 8,
        "num_stages": 4,
        "num_warps": 32,
        "compile_time": 2.1757869720458984
    },
    {
        "BLOCK_SIZE_M": 16,
        "BLOCK_SIZE_N": 512,
        "BLOCK_SIZE_K": 512,
        "GROUP_SIZE_M": 8,
        "num_stages": 5,
        "num_warps": 2,
        "compile_time": 10.169280767440796
    },
    {
        "BLOCK_SIZE_M": 16,
        "BLOCK_SIZE_N": 512,
        "BLOCK_SIZE_K": 512,
        "GROUP_SIZE_M": 8,
        "num_stages": 5,
        "num_warps": 4,
        "compile_time": 21.278671264648438
    },
    {
        "BLOCK_SIZE_M": 16,
        "BLOCK_SIZE_N": 512,
        "BLOCK_SIZE_K": 512,
        "GROUP_SIZE_M": 8,
        "num_stages": 5,
        "num_warps": 8,
        "compile_time": 6.676976442337036
    },
    {
        "BLOCK_SIZE_M": 16,
        "BLOCK_SIZE_N": 512,
        "BLOCK_SIZE_K": 512,
        "GROUP_SIZE_M": 8,
        "num_stages": 5,
        "num_warps": 16,
        "compile_time": 11.206639766693115
    },
    {
        "BLOCK_SIZE_M": 16,
        "BLOCK_SIZE_N": 512,
        "BLOCK_SIZE_K": 512,
        "GROUP_SIZE_M": 8,
        "num_stages": 5,
        "num_warps": 32,
        "compile_time": 2.409984827041626
    },
    {
        "BLOCK_SIZE_M": 16,
        "BLOCK_SIZE_N": 512,
        "BLOCK_SIZE_K": 512,
        "GROUP_SIZE_M": 8,
        "num_stages": 6,
        "num_warps": 2,
        "compile_time": 11.967289209365845
    },
    {
        "BLOCK_SIZE_M": 16,
        "BLOCK_SIZE_N": 512,
        "BLOCK_SIZE_K": 512,
        "GROUP_SIZE_M": 8,
        "num_stages": 6,
        "num_warps": 4,
        "compile_time": 22.738444566726685
    },
    {
        "BLOCK_SIZE_M": 16,
        "BLOCK_SIZE_N": 512,
        "BLOCK_SIZE_K": 512,
        "GROUP_SIZE_M": 8,
        "num_stages": 6,
        "num_warps": 8,
        "compile_time": 7.113739013671875
    },
    {
        "BLOCK_SIZE_M": 16,
        "BLOCK_SIZE_N": 512,
        "BLOCK_SIZE_K": 512,
        "GROUP_SIZE_M": 8,
        "num_stages": 6,
        "num_warps": 16,
        "compile_time": 11.471878290176392
    },
    {
        "BLOCK_SIZE_M": 16,
        "BLOCK_SIZE_N": 512,
        "BLOCK_SIZE_K": 512,
        "GROUP_SIZE_M": 8,
        "num_stages": 6,
        "num_warps": 32,
        "compile_time": 2.5494163036346436
    },
    {
        "BLOCK_SIZE_M": 16,
        "BLOCK_SIZE_N": 512,
        "BLOCK_SIZE_K": 512,
        "GROUP_SIZE_M": 8,
        "num_stages": 7,
        "num_warps": 2,
        "compile_time": 13.703223705291748
    },
    {
        "BLOCK_SIZE_M": 16,
        "BLOCK_SIZE_N": 512,
        "BLOCK_SIZE_K": 512,
        "GROUP_SIZE_M": 8,
        "num_stages": 7,
        "num_warps": 4,
        "compile_time": 23.12558126449585
    },
    {
        "BLOCK_SIZE_M": 16,
        "BLOCK_SIZE_N": 512,
        "BLOCK_SIZE_K": 512,
        "GROUP_SIZE_M": 8,
        "num_stages": 7,
        "num_warps": 8,
        "compile_time": 7.485749244689941
    },
    {
        "BLOCK_SIZE_M": 16,
        "BLOCK_SIZE_N": 512,
        "BLOCK_SIZE_K": 512,
        "GROUP_SIZE_M": 8,
        "num_stages": 7,
        "num_warps": 16,
        "compile_time": 11.617637395858765
    },
    {
        "BLOCK_SIZE_M": 16,
        "BLOCK_SIZE_N": 512,
        "BLOCK_SIZE_K": 512,
        "GROUP_SIZE_M": 8,
        "num_stages": 7,
        "num_warps": 32,
        "compile_time": 2.7636194229125977
    },
    {
        "BLOCK_SIZE_M": 16,
        "BLOCK_SIZE_N": 512,
        "BLOCK_SIZE_K": 512,
        "GROUP_SIZE_M": 8,
        "num_stages": 8,
        "num_warps": 2,
        "compile_time": 15.645081996917725
    },
    {
        "BLOCK_SIZE_M": 16,
        "BLOCK_SIZE_N": 512,
        "BLOCK_SIZE_K": 512,
        "GROUP_SIZE_M": 8,
        "num_stages": 8,
        "num_warps": 4,
        "compile_time": 6.720416784286499
    },
    {
        "BLOCK_SIZE_M": 16,
        "BLOCK_SIZE_N": 512,
        "BLOCK_SIZE_K": 512,
        "GROUP_SIZE_M": 8,
        "num_stages": 8,
        "num_warps": 8,
        "compile_time": 7.928741216659546
    },
    {
        "BLOCK_SIZE_M": 16,
        "BLOCK_SIZE_N": 512,
        "BLOCK_SIZE_K": 512,
        "GROUP_SIZE_M": 8,
        "num_stages": 8,
        "num_warps": 16,
        "compile_time": 12.092112302780151
    },
    {
        "BLOCK_SIZE_M": 16,
        "BLOCK_SIZE_N": 512,
        "BLOCK_SIZE_K": 512,
        "GROUP_SIZE_M": 8,
        "num_stages": 8,
        "num_warps": 32,
        "compile_time": 2.928264856338501
    },
    {
        "BLOCK_SIZE_M": 32,
        "BLOCK_SIZE_N": 16,
        "BLOCK_SIZE_K": 256,
        "GROUP_SIZE_M": 8,
        "num_stages": 8,
        "num_warps": 2,
        "compile_time": 1.4366414546966553
    },
    {
        "BLOCK_SIZE_M": 32,
        "BLOCK_SIZE_N": 16,
        "BLOCK_SIZE_K": 256,
        "GROUP_SIZE_M": 8,
        "num_stages": 8,
        "num_warps": 4,
        "compile_time": 0.9073383808135986
    },
    {
        "BLOCK_SIZE_M": 32,
        "BLOCK_SIZE_N": 16,
        "BLOCK_SIZE_K": 256,
        "GROUP_SIZE_M": 8,
        "num_stages": 8,
        "num_warps": 8,
        "compile_time": 0.6724884510040283
    },
    {
        "BLOCK_SIZE_M": 32,
        "BLOCK_SIZE_N": 16,
        "BLOCK_SIZE_K": 256,
        "GROUP_SIZE_M": 8,
        "num_stages": 8,
        "num_warps": 16,
        "compile_time": 0.5626957416534424
    },
    {
        "BLOCK_SIZE_M": 32,
        "BLOCK_SIZE_N": 16,
        "BLOCK_SIZE_K": 256,
        "GROUP_SIZE_M": 8,
        "num_stages": 8,
        "num_warps": 32,
        "compile_time": 0.530663013458252
    },
    {
        "BLOCK_SIZE_M": 32,
        "BLOCK_SIZE_N": 16,
        "BLOCK_SIZE_K": 512,
        "GROUP_SIZE_M": 8,
        "num_stages": 5,
        "num_warps": 2,
        "compile_time": 2.682175397872925
    },
    {
        "BLOCK_SIZE_M": 32,
        "BLOCK_SIZE_N": 16,
        "BLOCK_SIZE_K": 512,
        "GROUP_SIZE_M": 8,
        "num_stages": 5,
        "num_warps": 4,
        "compile_time": 1.2669439315795898
    },
    {
        "BLOCK_SIZE_M": 32,
        "BLOCK_SIZE_N": 16,
        "BLOCK_SIZE_K": 512,
        "GROUP_SIZE_M": 8,
        "num_stages": 5,
        "num_warps": 8,
        "compile_time": 0.8587477207183838
    },
    {
        "BLOCK_SIZE_M": 32,
        "BLOCK_SIZE_N": 16,
        "BLOCK_SIZE_K": 512,
        "GROUP_SIZE_M": 8,
        "num_stages": 5,
        "num_warps": 16,
        "compile_time": 0.6955952644348145
    },
    {
        "BLOCK_SIZE_M": 32,
        "BLOCK_SIZE_N": 16,
        "BLOCK_SIZE_K": 512,
        "GROUP_SIZE_M": 8,
        "num_stages": 5,
        "num_warps": 32,
        "compile_time": 0.6235473155975342
    },
    {
        "BLOCK_SIZE_M": 32,
        "BLOCK_SIZE_N": 16,
        "BLOCK_SIZE_K": 512,
        "GROUP_SIZE_M": 8,
        "num_stages": 6,
        "num_warps": 2,
        "compile_time": 2.8148958683013916
    },
    {
        "BLOCK_SIZE_M": 32,
        "BLOCK_SIZE_N": 16,
        "BLOCK_SIZE_K": 512,
        "GROUP_SIZE_M": 8,
        "num_stages": 6,
        "num_warps": 4,
        "compile_time": 1.3245482444763184
    },
    {
        "BLOCK_SIZE_M": 32,
        "BLOCK_SIZE_N": 16,
        "BLOCK_SIZE_K": 512,
        "GROUP_SIZE_M": 8,
        "num_stages": 6,
        "num_warps": 8,
        "compile_time": 0.8940505981445312
    },
    {
        "BLOCK_SIZE_M": 32,
        "BLOCK_SIZE_N": 16,
        "BLOCK_SIZE_K": 512,
        "GROUP_SIZE_M": 8,
        "num_stages": 6,
        "num_warps": 16,
        "compile_time": 0.7153904438018799
    },
    {
        "BLOCK_SIZE_M": 32,
        "BLOCK_SIZE_N": 16,
        "BLOCK_SIZE_K": 512,
        "GROUP_SIZE_M": 8,
        "num_stages": 6,
        "num_warps": 32,
        "compile_time": 0.6409192085266113
    },
    {
        "BLOCK_SIZE_M": 32,
        "BLOCK_SIZE_N": 16,
        "BLOCK_SIZE_K": 512,
        "GROUP_SIZE_M": 8,
        "num_stages": 7,
        "num_warps": 2,
        "compile_time": 3.0323023796081543
    },
    {
        "BLOCK_SIZE_M": 32,
        "BLOCK_SIZE_N": 16,
        "BLOCK_SIZE_K": 512,
        "GROUP_SIZE_M": 8,
        "num_stages": 7,
        "num_warps": 4,
        "compile_time": 1.4452555179595947
    },
    {
        "BLOCK_SIZE_M": 32,
        "BLOCK_SIZE_N": 16,
        "BLOCK_SIZE_K": 512,
        "GROUP_SIZE_M": 8,
        "num_stages": 7,
        "num_warps": 8,
        "compile_time": 0.9498574733734131
    },
    {
        "BLOCK_SIZE_M": 32,
        "BLOCK_SIZE_N": 16,
        "BLOCK_SIZE_K": 512,
        "GROUP_SIZE_M": 8,
        "num_stages": 7,
        "num_warps": 16,
        "compile_time": 0.7324864864349365
    },
    {
        "BLOCK_SIZE_M": 32,
        "BLOCK_SIZE_N": 16,
        "BLOCK_SIZE_K": 512,
        "GROUP_SIZE_M": 8,
        "num_stages": 7,
        "num_warps": 32,
        "compile_time": 0.6615157127380371
    },
    {
        "BLOCK_SIZE_M": 32,
        "BLOCK_SIZE_N": 16,
        "BLOCK_SIZE_K": 512,
        "GROUP_SIZE_M": 8,
        "num_stages": 8,
        "num_warps": 2,
        "compile_time": 3.145151138305664
    },
    {
        "BLOCK_SIZE_M": 32,
        "BLOCK_SIZE_N": 16,
        "BLOCK_SIZE_K": 512,
        "GROUP_SIZE_M": 8,
        "num_stages": 8,
        "num_warps": 4,
        "compile_time": 1.5580201148986816
    },
    {
        "BLOCK_SIZE_M": 32,
        "BLOCK_SIZE_N": 16,
        "BLOCK_SIZE_K": 512,
        "GROUP_SIZE_M": 8,
        "num_stages": 8,
        "num_warps": 8,
        "compile_time": 1.0021388530731201
    },
    {
        "BLOCK_SIZE_M": 32,
        "BLOCK_SIZE_N": 16,
        "BLOCK_SIZE_K": 512,
        "GROUP_SIZE_M": 8,
        "num_stages": 8,
        "num_warps": 16,
        "compile_time": 0.7699980735778809
    },
    {
        "BLOCK_SIZE_M": 32,
        "BLOCK_SIZE_N": 16,
        "BLOCK_SIZE_K": 512,
        "GROUP_SIZE_M": 8,
        "num_stages": 8,
        "num_warps": 32,
        "compile_time": 0.6728575229644775
    },
    {
        "BLOCK_SIZE_M": 32,
        "BLOCK_SIZE_N": 32,
        "BLOCK_SIZE_K": 256,
        "GROUP_SIZE_M": 8,
        "num_stages": 7,
        "num_warps": 2,
        "compile_time": 1.7924518585205078
    },
    {
        "BLOCK_SIZE_M": 32,
        "BLOCK_SIZE_N": 32,
        "BLOCK_SIZE_K": 256,
        "GROUP_SIZE_M": 8,
        "num_stages": 7,
        "num_warps": 4,
        "compile_time": 1.053530216217041
    },
    {
        "BLOCK_SIZE_M": 32,
        "BLOCK_SIZE_N": 32,
        "BLOCK_SIZE_K": 256,
        "GROUP_SIZE_M": 8,
        "num_stages": 7,
        "num_warps": 8,
        "compile_time": 0.7135908603668213
    },
    {
        "BLOCK_SIZE_M": 32,
        "BLOCK_SIZE_N": 32,
        "BLOCK_SIZE_K": 256,
        "GROUP_SIZE_M": 8,
        "num_stages": 7,
        "num_warps": 16,
        "compile_time": 0.5861854553222656
    },
    {
        "BLOCK_SIZE_M": 32,
        "BLOCK_SIZE_N": 32,
        "BLOCK_SIZE_K": 256,
        "GROUP_SIZE_M": 8,
        "num_stages": 7,
        "num_warps": 32,
        "compile_time": 0.5171101093292236
    },
    {
        "BLOCK_SIZE_M": 32,
        "BLOCK_SIZE_N": 32,
        "BLOCK_SIZE_K": 256,
        "GROUP_SIZE_M": 8,
        "num_stages": 8,
        "num_warps": 2,
        "compile_time": 1.8947088718414307
    },
    {
        "BLOCK_SIZE_M": 32,
        "BLOCK_SIZE_N": 32,
        "BLOCK_SIZE_K": 256,
        "GROUP_SIZE_M": 8,
        "num_stages": 8,
        "num_warps": 4,
        "compile_time": 1.115523099899292
    },
    {
        "BLOCK_SIZE_M": 32,
        "BLOCK_SIZE_N": 32,
        "BLOCK_SIZE_K": 256,
        "GROUP_SIZE_M": 8,
        "num_stages": 8,
        "num_warps": 8,
        "compile_time": 0.7618646621704102
    },
    {
        "BLOCK_SIZE_M": 32,
        "BLOCK_SIZE_N": 32,
        "BLOCK_SIZE_K": 256,
        "GROUP_SIZE_M": 8,
        "num_stages": 8,
        "num_warps": 16,
        "compile_time": 0.609567403793335
    },
    {
        "BLOCK_SIZE_M": 32,
        "BLOCK_SIZE_N": 32,
        "BLOCK_SIZE_K": 256,
        "GROUP_SIZE_M": 8,
        "num_stages": 8,
        "num_warps": 32,
        "compile_time": 0.5301151275634766
    },
    {
        "BLOCK_SIZE_M": 32,
        "BLOCK_SIZE_N": 32,
        "BLOCK_SIZE_K": 512,
        "GROUP_SIZE_M": 8,
        "num_stages": 4,
        "num_warps": 2,
        "compile_time": 3.6733803749084473
    },
    {
        "BLOCK_SIZE_M": 32,
        "BLOCK_SIZE_N": 32,
        "BLOCK_SIZE_K": 512,
        "GROUP_SIZE_M": 8,
        "num_stages": 4,
        "num_warps": 4,
        "compile_time": 1.4663887023925781
    },
    {
        "BLOCK_SIZE_M": 32,
        "BLOCK_SIZE_N": 32,
        "BLOCK_SIZE_K": 512,
        "GROUP_SIZE_M": 8,
        "num_stages": 4,
        "num_warps": 8,
        "compile_time": 0.893958330154419
    },
    {
        "BLOCK_SIZE_M": 32,
        "BLOCK_SIZE_N": 32,
        "BLOCK_SIZE_K": 512,
        "GROUP_SIZE_M": 8,
        "num_stages": 4,
        "num_warps": 16,
        "compile_time": 0.7037246227264404
    },
    {
        "BLOCK_SIZE_M": 32,
        "BLOCK_SIZE_N": 32,
        "BLOCK_SIZE_K": 512,
        "GROUP_SIZE_M": 8,
        "num_stages": 4,
        "num_warps": 32,
        "compile_time": 0.6186404228210449
    },
    {
        "BLOCK_SIZE_M": 32,
        "BLOCK_SIZE_N": 32,
        "BLOCK_SIZE_K": 512,
        "GROUP_SIZE_M": 8,
        "num_stages": 5,
        "num_warps": 2,
        "compile_time": 3.9077370166778564
    },
    {
        "BLOCK_SIZE_M": 32,
        "BLOCK_SIZE_N": 32,
        "BLOCK_SIZE_K": 512,
        "GROUP_SIZE_M": 8,
        "num_stages": 5,
        "num_warps": 4,
        "compile_time": 1.5752265453338623
    },
    {
        "BLOCK_SIZE_M": 32,
        "BLOCK_SIZE_N": 32,
        "BLOCK_SIZE_K": 512,
        "GROUP_SIZE_M": 8,
        "num_stages": 5,
        "num_warps": 8,
        "compile_time": 0.9237837791442871
    },
    {
        "BLOCK_SIZE_M": 32,
        "BLOCK_SIZE_N": 32,
        "BLOCK_SIZE_K": 512,
        "GROUP_SIZE_M": 8,
        "num_stages": 5,
        "num_warps": 16,
        "compile_time": 0.7165915966033936
    },
    {
        "BLOCK_SIZE_M": 32,
        "BLOCK_SIZE_N": 32,
        "BLOCK_SIZE_K": 512,
        "GROUP_SIZE_M": 8,
        "num_stages": 5,
        "num_warps": 32,
        "compile_time": 0.6414401531219482
    },
    {
        "BLOCK_SIZE_M": 32,
        "BLOCK_SIZE_N": 32,
        "BLOCK_SIZE_K": 512,
        "GROUP_SIZE_M": 8,
        "num_stages": 6,
        "num_warps": 2,
        "compile_time": 4.148831129074097
    },
    {
        "BLOCK_SIZE_M": 32,
        "BLOCK_SIZE_N": 32,
        "BLOCK_SIZE_K": 512,
        "GROUP_SIZE_M": 8,
        "num_stages": 6,
        "num_warps": 4,
        "compile_time": 1.7192904949188232
    },
    {
        "BLOCK_SIZE_M": 32,
        "BLOCK_SIZE_N": 32,
        "BLOCK_SIZE_K": 512,
        "GROUP_SIZE_M": 8,
        "num_stages": 6,
        "num_warps": 8,
        "compile_time": 1.043257713317871
    },
    {
        "BLOCK_SIZE_M": 32,
        "BLOCK_SIZE_N": 32,
        "BLOCK_SIZE_K": 512,
        "GROUP_SIZE_M": 8,
        "num_stages": 6,
        "num_warps": 16,
        "compile_time": 0.7936782836914062
    },
    {
        "BLOCK_SIZE_M": 32,
        "BLOCK_SIZE_N": 32,
        "BLOCK_SIZE_K": 512,
        "GROUP_SIZE_M": 8,
        "num_stages": 6,
        "num_warps": 32,
        "compile_time": 0.6708269119262695
    },
    {
        "BLOCK_SIZE_M": 32,
        "BLOCK_SIZE_N": 32,
        "BLOCK_SIZE_K": 512,
        "GROUP_SIZE_M": 8,
        "num_stages": 7,
        "num_warps": 2,
        "compile_time": 4.371668577194214
    },
    {
        "BLOCK_SIZE_M": 32,
        "BLOCK_SIZE_N": 32,
        "BLOCK_SIZE_K": 512,
        "GROUP_SIZE_M": 8,
        "num_stages": 7,
        "num_warps": 4,
        "compile_time": 1.8277251720428467
    },
    {
        "BLOCK_SIZE_M": 32,
        "BLOCK_SIZE_N": 32,
        "BLOCK_SIZE_K": 512,
        "GROUP_SIZE_M": 8,
        "num_stages": 7,
        "num_warps": 8,
        "compile_time": 1.0837533473968506
    },
    {
        "BLOCK_SIZE_M": 32,
        "BLOCK_SIZE_N": 32,
        "BLOCK_SIZE_K": 512,
        "GROUP_SIZE_M": 8,
        "num_stages": 7,
        "num_warps": 16,
        "compile_time": 0.8259117603302002
    },
    {
        "BLOCK_SIZE_M": 32,
        "BLOCK_SIZE_N": 32,
        "BLOCK_SIZE_K": 512,
        "GROUP_SIZE_M": 8,
        "num_stages": 7,
        "num_warps": 32,
        "compile_time": 0.6916451454162598
    },
    {
        "BLOCK_SIZE_M": 32,
        "BLOCK_SIZE_N": 32,
        "BLOCK_SIZE_K": 512,
        "GROUP_SIZE_M": 8,
        "num_stages": 8,
        "num_warps": 2,
        "compile_time": 4.633335828781128
    },
    {
        "BLOCK_SIZE_M": 32,
        "BLOCK_SIZE_N": 32,
        "BLOCK_SIZE_K": 512,
        "GROUP_SIZE_M": 8,
        "num_stages": 8,
        "num_warps": 4,
        "compile_time": 1.99574613571167
    },
    {
        "BLOCK_SIZE_M": 32,
        "BLOCK_SIZE_N": 32,
        "BLOCK_SIZE_K": 512,
        "GROUP_SIZE_M": 8,
        "num_stages": 8,
        "num_warps": 8,
        "compile_time": 1.2209184169769287
    },
    {
        "BLOCK_SIZE_M": 32,
        "BLOCK_SIZE_N": 32,
        "BLOCK_SIZE_K": 512,
        "GROUP_SIZE_M": 8,
        "num_stages": 8,
        "num_warps": 16,
        "compile_time": 0.8532097339630127
    },
    {
        "BLOCK_SIZE_M": 32,
        "BLOCK_SIZE_N": 32,
        "BLOCK_SIZE_K": 512,
        "GROUP_SIZE_M": 8,
        "num_stages": 8,
        "num_warps": 32,
        "compile_time": 0.7118353843688965
    },
    {
        "BLOCK_SIZE_M": 32,
        "BLOCK_SIZE_N": 64,
        "BLOCK_SIZE_K": 128,
        "GROUP_SIZE_M": 8,
        "num_stages": 8,
        "num_warps": 2,
        "compile_time": 1.4722695350646973
    },
    {
        "BLOCK_SIZE_M": 32,
        "BLOCK_SIZE_N": 64,
        "BLOCK_SIZE_K": 128,
        "GROUP_SIZE_M": 8,
        "num_stages": 8,
        "num_warps": 4,
        "compile_time": 0.9165327548980713
    },
    {
        "BLOCK_SIZE_M": 32,
        "BLOCK_SIZE_N": 64,
        "BLOCK_SIZE_K": 128,
        "GROUP_SIZE_M": 8,
        "num_stages": 8,
        "num_warps": 8,
        "compile_time": 0.6169648170471191
    },
    {
        "BLOCK_SIZE_M": 32,
        "BLOCK_SIZE_N": 64,
        "BLOCK_SIZE_K": 128,
        "GROUP_SIZE_M": 8,
        "num_stages": 8,
        "num_warps": 16,
        "compile_time": 0.5112655162811279
    },
    {
        "BLOCK_SIZE_M": 32,
        "BLOCK_SIZE_N": 64,
        "BLOCK_SIZE_K": 128,
        "GROUP_SIZE_M": 8,
        "num_stages": 8,
        "num_warps": 32,
        "compile_time": 0.4605896472930908
    },
    {
        "BLOCK_SIZE_M": 32,
        "BLOCK_SIZE_N": 64,
        "BLOCK_SIZE_K": 256,
        "GROUP_SIZE_M": 8,
        "num_stages": 5,
        "num_warps": 2,
        "compile_time": 2.727180004119873
    },
    {
        "BLOCK_SIZE_M": 32,
        "BLOCK_SIZE_N": 64,
        "BLOCK_SIZE_K": 256,
        "GROUP_SIZE_M": 8,
        "num_stages": 5,
        "num_warps": 4,
        "compile_time": 1.242584466934204
    },
    {
        "BLOCK_SIZE_M": 32,
        "BLOCK_SIZE_N": 64,
        "BLOCK_SIZE_K": 256,
        "GROUP_SIZE_M": 8,
        "num_stages": 5,
        "num_warps": 8,
        "compile_time": 0.7906064987182617
    },
    {
        "BLOCK_SIZE_M": 32,
        "BLOCK_SIZE_N": 64,
        "BLOCK_SIZE_K": 256,
        "GROUP_SIZE_M": 8,
        "num_stages": 5,
        "num_warps": 16,
        "compile_time": 0.572425127029419
    },
    {
        "BLOCK_SIZE_M": 32,
        "BLOCK_SIZE_N": 64,
        "BLOCK_SIZE_K": 256,
        "GROUP_SIZE_M": 8,
        "num_stages": 5,
        "num_warps": 32,
        "compile_time": 0.5078191757202148
    },
    {
        "BLOCK_SIZE_M": 32,
        "BLOCK_SIZE_N": 64,
        "BLOCK_SIZE_K": 256,
        "GROUP_SIZE_M": 8,
        "num_stages": 6,
        "num_warps": 2,
        "compile_time": 2.8714499473571777
    },
    {
        "BLOCK_SIZE_M": 32,
        "BLOCK_SIZE_N": 64,
        "BLOCK_SIZE_K": 256,
        "GROUP_SIZE_M": 8,
        "num_stages": 6,
        "num_warps": 4,
        "compile_time": 1.3263168334960938
    },
    {
        "BLOCK_SIZE_M": 32,
        "BLOCK_SIZE_N": 64,
        "BLOCK_SIZE_K": 256,
        "GROUP_SIZE_M": 8,
        "num_stages": 6,
        "num_warps": 8,
        "compile_time": 0.8313639163970947
    },
    {
        "BLOCK_SIZE_M": 32,
        "BLOCK_SIZE_N": 64,
        "BLOCK_SIZE_K": 256,
        "GROUP_SIZE_M": 8,
        "num_stages": 6,
        "num_warps": 16,
        "compile_time": 0.6250770092010498
    },
    {
        "BLOCK_SIZE_M": 32,
        "BLOCK_SIZE_N": 64,
        "BLOCK_SIZE_K": 256,
        "GROUP_SIZE_M": 8,
        "num_stages": 6,
        "num_warps": 32,
        "compile_time": 0.528296709060669
    },
    {
        "BLOCK_SIZE_M": 32,
        "BLOCK_SIZE_N": 64,
        "BLOCK_SIZE_K": 256,
        "GROUP_SIZE_M": 8,
        "num_stages": 7,
        "num_warps": 2,
        "compile_time": 3.0693111419677734
    },
    {
        "BLOCK_SIZE_M": 32,
        "BLOCK_SIZE_N": 64,
        "BLOCK_SIZE_K": 256,
        "GROUP_SIZE_M": 8,
        "num_stages": 7,
        "num_warps": 4,
        "compile_time": 1.439709186553955
    },
    {
        "BLOCK_SIZE_M": 32,
        "BLOCK_SIZE_N": 64,
        "BLOCK_SIZE_K": 256,
        "GROUP_SIZE_M": 8,
        "num_stages": 7,
        "num_warps": 8,
        "compile_time": 0.9026904106140137
    },
    {
        "BLOCK_SIZE_M": 32,
        "BLOCK_SIZE_N": 64,
        "BLOCK_SIZE_K": 256,
        "GROUP_SIZE_M": 8,
        "num_stages": 7,
        "num_warps": 16,
        "compile_time": 0.6411516666412354
    },
    {
        "BLOCK_SIZE_M": 32,
        "BLOCK_SIZE_N": 64,
        "BLOCK_SIZE_K": 256,
        "GROUP_SIZE_M": 8,
        "num_stages": 7,
        "num_warps": 32,
        "compile_time": 0.5252008438110352
    },
    {
        "BLOCK_SIZE_M": 32,
        "BLOCK_SIZE_N": 64,
        "BLOCK_SIZE_K": 256,
        "GROUP_SIZE_M": 8,
        "num_stages": 8,
        "num_warps": 2,
        "compile_time": 3.2062036991119385
    },
    {
        "BLOCK_SIZE_M": 32,
        "BLOCK_SIZE_N": 64,
        "BLOCK_SIZE_K": 256,
        "GROUP_SIZE_M": 8,
        "num_stages": 8,
        "num_warps": 4,
        "compile_time": 1.5331361293792725
    },
    {
        "BLOCK_SIZE_M": 32,
        "BLOCK_SIZE_N": 64,
        "BLOCK_SIZE_K": 256,
        "GROUP_SIZE_M": 8,
        "num_stages": 8,
        "num_warps": 8,
        "compile_time": 0.9611468315124512
    },
    {
        "BLOCK_SIZE_M": 32,
        "BLOCK_SIZE_N": 64,
        "BLOCK_SIZE_K": 256,
        "GROUP_SIZE_M": 8,
        "num_stages": 8,
        "num_warps": 16,
        "compile_time": 0.6749725341796875
    },
    {
        "BLOCK_SIZE_M": 32,
        "BLOCK_SIZE_N": 64,
        "BLOCK_SIZE_K": 256,
        "GROUP_SIZE_M": 8,
        "num_stages": 8,
        "num_warps": 32,
        "compile_time": 0.5490264892578125
    },
    {
        "BLOCK_SIZE_M": 32,
        "BLOCK_SIZE_N": 64,
        "BLOCK_SIZE_K": 512,
        "GROUP_SIZE_M": 8,
        "num_stages": 3,
        "num_warps": 2,
        "compile_time": 12.513589143753052
    },
    {
        "BLOCK_SIZE_M": 32,
        "BLOCK_SIZE_N": 64,
        "BLOCK_SIZE_K": 512,
        "GROUP_SIZE_M": 8,
        "num_stages": 3,
        "num_warps": 4,
        "compile_time": 2.412759780883789
    },
    {
        "BLOCK_SIZE_M": 32,
        "BLOCK_SIZE_N": 64,
        "BLOCK_SIZE_K": 512,
        "GROUP_SIZE_M": 8,
        "num_stages": 3,
        "num_warps": 8,
        "compile_time": 1.12247633934021
    },
    {
        "BLOCK_SIZE_M": 32,
        "BLOCK_SIZE_N": 64,
        "BLOCK_SIZE_K": 512,
        "GROUP_SIZE_M": 8,
        "num_stages": 3,
        "num_warps": 16,
        "compile_time": 0.7920000553131104
    },
    {
        "BLOCK_SIZE_M": 32,
        "BLOCK_SIZE_N": 64,
        "BLOCK_SIZE_K": 512,
        "GROUP_SIZE_M": 8,
        "num_stages": 3,
        "num_warps": 32,
        "compile_time": 0.6635396480560303
    },
    {
        "BLOCK_SIZE_M": 32,
        "BLOCK_SIZE_N": 64,
        "BLOCK_SIZE_K": 512,
        "GROUP_SIZE_M": 8,
        "num_stages": 4,
        "num_warps": 2,
        "compile_time": 12.928401231765747
    },
    {
        "BLOCK_SIZE_M": 32,
        "BLOCK_SIZE_N": 64,
        "BLOCK_SIZE_K": 512,
        "GROUP_SIZE_M": 8,
        "num_stages": 4,
        "num_warps": 4,
        "compile_time": 2.6819865703582764
    },
    {
        "BLOCK_SIZE_M": 32,
        "BLOCK_SIZE_N": 64,
        "BLOCK_SIZE_K": 512,
        "GROUP_SIZE_M": 8,
        "num_stages": 4,
        "num_warps": 8,
        "compile_time": 1.2353336811065674
    },
    {
        "BLOCK_SIZE_M": 32,
        "BLOCK_SIZE_N": 64,
        "BLOCK_SIZE_K": 512,
        "GROUP_SIZE_M": 8,
        "num_stages": 4,
        "num_warps": 16,
        "compile_time": 0.82785964012146
    },
    {
        "BLOCK_SIZE_M": 32,
        "BLOCK_SIZE_N": 64,
        "BLOCK_SIZE_K": 512,
        "GROUP_SIZE_M": 8,
        "num_stages": 4,
        "num_warps": 32,
        "compile_time": 0.6863551139831543
    },
    {
        "BLOCK_SIZE_M": 32,
        "BLOCK_SIZE_N": 64,
        "BLOCK_SIZE_K": 512,
        "GROUP_SIZE_M": 8,
        "num_stages": 5,
        "num_warps": 2,
        "compile_time": 13.014506578445435
    },
    {
        "BLOCK_SIZE_M": 32,
        "BLOCK_SIZE_N": 64,
        "BLOCK_SIZE_K": 512,
        "GROUP_SIZE_M": 8,
        "num_stages": 5,
        "num_warps": 4,
        "compile_time": 2.8547701835632324
    },
    {
        "BLOCK_SIZE_M": 32,
        "BLOCK_SIZE_N": 64,
        "BLOCK_SIZE_K": 512,
        "GROUP_SIZE_M": 8,
        "num_stages": 5,
        "num_warps": 8,
        "compile_time": 1.333021640777588
    },
    {
        "BLOCK_SIZE_M": 32,
        "BLOCK_SIZE_N": 64,
        "BLOCK_SIZE_K": 512,
        "GROUP_SIZE_M": 8,
        "num_stages": 5,
        "num_warps": 16,
        "compile_time": 0.8741304874420166
    },
    {
        "BLOCK_SIZE_M": 32,
        "BLOCK_SIZE_N": 64,
        "BLOCK_SIZE_K": 512,
        "GROUP_SIZE_M": 8,
        "num_stages": 5,
        "num_warps": 32,
        "compile_time": 0.7178621292114258
    },
    {
        "BLOCK_SIZE_M": 32,
        "BLOCK_SIZE_N": 64,
        "BLOCK_SIZE_K": 512,
        "GROUP_SIZE_M": 8,
        "num_stages": 6,
        "num_warps": 2,
        "compile_time": 13.312904119491577
    },
    {
        "BLOCK_SIZE_M": 32,
        "BLOCK_SIZE_N": 64,
        "BLOCK_SIZE_K": 512,
        "GROUP_SIZE_M": 8,
        "num_stages": 6,
        "num_warps": 4,
        "compile_time": 3.024216651916504
    },
    {
        "BLOCK_SIZE_M": 32,
        "BLOCK_SIZE_N": 64,
        "BLOCK_SIZE_K": 512,
        "GROUP_SIZE_M": 8,
        "num_stages": 6,
        "num_warps": 8,
        "compile_time": 1.413616418838501
    },
    {
        "BLOCK_SIZE_M": 32,
        "BLOCK_SIZE_N": 64,
        "BLOCK_SIZE_K": 512,
        "GROUP_SIZE_M": 8,
        "num_stages": 6,
        "num_warps": 16,
        "compile_time": 0.9212498664855957
    },
    {
        "BLOCK_SIZE_M": 32,
        "BLOCK_SIZE_N": 64,
        "BLOCK_SIZE_K": 512,
        "GROUP_SIZE_M": 8,
        "num_stages": 6,
        "num_warps": 32,
        "compile_time": 0.7075490951538086
    },
    {
        "BLOCK_SIZE_M": 32,
        "BLOCK_SIZE_N": 64,
        "BLOCK_SIZE_K": 512,
        "GROUP_SIZE_M": 8,
        "num_stages": 7,
        "num_warps": 2,
        "compile_time": 13.780008554458618
    },
    {
        "BLOCK_SIZE_M": 32,
        "BLOCK_SIZE_N": 64,
        "BLOCK_SIZE_K": 512,
        "GROUP_SIZE_M": 8,
        "num_stages": 7,
        "num_warps": 4,
        "compile_time": 3.2105190753936768
    },
    {
        "BLOCK_SIZE_M": 32,
        "BLOCK_SIZE_N": 64,
        "BLOCK_SIZE_K": 512,
        "GROUP_SIZE_M": 8,
        "num_stages": 7,
        "num_warps": 8,
        "compile_time": 1.6072938442230225
    },
    {
        "BLOCK_SIZE_M": 32,
        "BLOCK_SIZE_N": 64,
        "BLOCK_SIZE_K": 512,
        "GROUP_SIZE_M": 8,
        "num_stages": 7,
        "num_warps": 16,
        "compile_time": 1.0103299617767334
    },
    {
        "BLOCK_SIZE_M": 32,
        "BLOCK_SIZE_N": 64,
        "BLOCK_SIZE_K": 512,
        "GROUP_SIZE_M": 8,
        "num_stages": 7,
        "num_warps": 32,
        "compile_time": 0.7707479000091553
    },
    {
        "BLOCK_SIZE_M": 32,
        "BLOCK_SIZE_N": 64,
        "BLOCK_SIZE_K": 512,
        "GROUP_SIZE_M": 8,
        "num_stages": 8,
        "num_warps": 2,
        "compile_time": 13.748158693313599
    },
    {
        "BLOCK_SIZE_M": 32,
        "BLOCK_SIZE_N": 64,
        "BLOCK_SIZE_K": 512,
        "GROUP_SIZE_M": 8,
        "num_stages": 8,
        "num_warps": 4,
        "compile_time": 3.3232622146606445
    },
    {
        "BLOCK_SIZE_M": 32,
        "BLOCK_SIZE_N": 64,
        "BLOCK_SIZE_K": 512,
        "GROUP_SIZE_M": 8,
        "num_stages": 8,
        "num_warps": 8,
        "compile_time": 1.6563806533813477
    },
    {
        "BLOCK_SIZE_M": 32,
        "BLOCK_SIZE_N": 64,
        "BLOCK_SIZE_K": 512,
        "GROUP_SIZE_M": 8,
        "num_stages": 8,
        "num_warps": 16,
        "compile_time": 1.045577049255371
    },
    {
        "BLOCK_SIZE_M": 32,
        "BLOCK_SIZE_N": 64,
        "BLOCK_SIZE_K": 512,
        "GROUP_SIZE_M": 8,
        "num_stages": 8,
        "num_warps": 32,
        "compile_time": 0.794417142868042
    },
    {
        "BLOCK_SIZE_M": 32,
        "BLOCK_SIZE_N": 128,
        "BLOCK_SIZE_K": 128,
        "GROUP_SIZE_M": 8,
        "num_stages": 6,
        "num_warps": 2,
        "compile_time": 2.5684568881988525
    },
    {
        "BLOCK_SIZE_M": 32,
        "BLOCK_SIZE_N": 128,
        "BLOCK_SIZE_K": 128,
        "GROUP_SIZE_M": 8,
        "num_stages": 6,
        "num_warps": 4,
        "compile_time": 1.1939208507537842
    },
    {
        "BLOCK_SIZE_M": 32,
        "BLOCK_SIZE_N": 128,
        "BLOCK_SIZE_K": 128,
        "GROUP_SIZE_M": 8,
        "num_stages": 6,
        "num_warps": 8,
        "compile_time": 0.775362491607666
    },
    {
        "BLOCK_SIZE_M": 32,
        "BLOCK_SIZE_N": 128,
        "BLOCK_SIZE_K": 128,
        "GROUP_SIZE_M": 8,
        "num_stages": 6,
        "num_warps": 16,
        "compile_time": 0.5583651065826416
    },
    {
        "BLOCK_SIZE_M": 32,
        "BLOCK_SIZE_N": 128,
        "BLOCK_SIZE_K": 128,
        "GROUP_SIZE_M": 8,
        "num_stages": 6,
        "num_warps": 32,
        "compile_time": 0.47179484367370605
    },
    {
        "BLOCK_SIZE_M": 32,
        "BLOCK_SIZE_N": 128,
        "BLOCK_SIZE_K": 128,
        "GROUP_SIZE_M": 8,
        "num_stages": 7,
        "num_warps": 2,
        "compile_time": 2.7206945419311523
    },
    {
        "BLOCK_SIZE_M": 32,
        "BLOCK_SIZE_N": 128,
        "BLOCK_SIZE_K": 128,
        "GROUP_SIZE_M": 8,
        "num_stages": 7,
        "num_warps": 4,
        "compile_time": 1.2810304164886475
    },
    {
        "BLOCK_SIZE_M": 32,
        "BLOCK_SIZE_N": 128,
        "BLOCK_SIZE_K": 128,
        "GROUP_SIZE_M": 8,
        "num_stages": 7,
        "num_warps": 8,
        "compile_time": 0.8263251781463623
    },
    {
        "BLOCK_SIZE_M": 32,
        "BLOCK_SIZE_N": 128,
        "BLOCK_SIZE_K": 128,
        "GROUP_SIZE_M": 8,
        "num_stages": 7,
        "num_warps": 16,
        "compile_time": 0.5722544193267822
    },
    {
        "BLOCK_SIZE_M": 32,
        "BLOCK_SIZE_N": 128,
        "BLOCK_SIZE_K": 128,
        "GROUP_SIZE_M": 8,
        "num_stages": 7,
        "num_warps": 32,
        "compile_time": 0.48444604873657227
    },
    {
        "BLOCK_SIZE_M": 32,
        "BLOCK_SIZE_N": 128,
        "BLOCK_SIZE_K": 128,
        "GROUP_SIZE_M": 8,
        "num_stages": 8,
        "num_warps": 2,
        "compile_time": 2.8971405029296875
    },
    {
        "BLOCK_SIZE_M": 32,
        "BLOCK_SIZE_N": 128,
        "BLOCK_SIZE_K": 128,
        "GROUP_SIZE_M": 8,
        "num_stages": 8,
        "num_warps": 4,
        "compile_time": 1.3802564144134521
    },
    {
        "BLOCK_SIZE_M": 32,
        "BLOCK_SIZE_N": 128,
        "BLOCK_SIZE_K": 128,
        "GROUP_SIZE_M": 8,
        "num_stages": 8,
        "num_warps": 8,
        "compile_time": 0.8668324947357178
    },
    {
        "BLOCK_SIZE_M": 32,
        "BLOCK_SIZE_N": 128,
        "BLOCK_SIZE_K": 128,
        "GROUP_SIZE_M": 8,
        "num_stages": 8,
        "num_warps": 16,
        "compile_time": 0.5892348289489746
    },
    {
        "BLOCK_SIZE_M": 32,
        "BLOCK_SIZE_N": 128,
        "BLOCK_SIZE_K": 128,
        "GROUP_SIZE_M": 8,
        "num_stages": 8,
        "num_warps": 32,
        "compile_time": 0.5038905143737793
    },
    {
        "BLOCK_SIZE_M": 32,
        "BLOCK_SIZE_N": 128,
        "BLOCK_SIZE_K": 256,
        "GROUP_SIZE_M": 8,
        "num_stages": 3,
        "num_warps": 2,
        "compile_time": 10.687892436981201
    },
    {
        "BLOCK_SIZE_M": 32,
        "BLOCK_SIZE_N": 128,
        "BLOCK_SIZE_K": 256,
        "GROUP_SIZE_M": 8,
        "num_stages": 4,
        "num_warps": 2,
        "compile_time": 11.100472688674927
    },
    {
        "BLOCK_SIZE_M": 32,
        "BLOCK_SIZE_N": 128,
        "BLOCK_SIZE_K": 256,
        "GROUP_SIZE_M": 8,
        "num_stages": 4,
        "num_warps": 4,
        "compile_time": 2.2483346462249756
    },
    {
        "BLOCK_SIZE_M": 32,
        "BLOCK_SIZE_N": 128,
        "BLOCK_SIZE_K": 256,
        "GROUP_SIZE_M": 8,
        "num_stages": 4,
        "num_warps": 8,
        "compile_time": 1.1073684692382812
    },
    {
        "BLOCK_SIZE_M": 32,
        "BLOCK_SIZE_N": 128,
        "BLOCK_SIZE_K": 256,
        "GROUP_SIZE_M": 8,
        "num_stages": 4,
        "num_warps": 16,
        "compile_time": 0.7085540294647217
    },
    {
        "BLOCK_SIZE_M": 32,
        "BLOCK_SIZE_N": 128,
        "BLOCK_SIZE_K": 256,
        "GROUP_SIZE_M": 8,
        "num_stages": 4,
        "num_warps": 32,
        "compile_time": 0.5464110374450684
    },
    {
        "BLOCK_SIZE_M": 32,
        "BLOCK_SIZE_N": 128,
        "BLOCK_SIZE_K": 256,
        "GROUP_SIZE_M": 8,
        "num_stages": 5,
        "num_warps": 2,
        "compile_time": 11.381786346435547
    },
    {
        "BLOCK_SIZE_M": 32,
        "BLOCK_SIZE_N": 128,
        "BLOCK_SIZE_K": 256,
        "GROUP_SIZE_M": 8,
        "num_stages": 5,
        "num_warps": 4,
        "compile_time": 2.3866026401519775
    },
    {
        "BLOCK_SIZE_M": 32,
        "BLOCK_SIZE_N": 128,
        "BLOCK_SIZE_K": 256,
        "GROUP_SIZE_M": 8,
        "num_stages": 5,
        "num_warps": 8,
        "compile_time": 1.1552438735961914
    },
    {
        "BLOCK_SIZE_M": 32,
        "BLOCK_SIZE_N": 128,
        "BLOCK_SIZE_K": 256,
        "GROUP_SIZE_M": 8,
        "num_stages": 5,
        "num_warps": 16,
        "compile_time": 0.7771310806274414
    },
    {
        "BLOCK_SIZE_M": 32,
        "BLOCK_SIZE_N": 128,
        "BLOCK_SIZE_K": 256,
        "GROUP_SIZE_M": 8,
        "num_stages": 5,
        "num_warps": 32,
        "compile_time": 0.5861001014709473
    },
    {
        "BLOCK_SIZE_M": 32,
        "BLOCK_SIZE_N": 128,
        "BLOCK_SIZE_K": 256,
        "GROUP_SIZE_M": 8,
        "num_stages": 6,
        "num_warps": 2,
        "compile_time": 11.605212450027466
    },
    {
        "BLOCK_SIZE_M": 32,
        "BLOCK_SIZE_N": 128,
        "BLOCK_SIZE_K": 256,
        "GROUP_SIZE_M": 8,
        "num_stages": 6,
        "num_warps": 4,
        "compile_time": 2.5763027667999268
    },
    {
        "BLOCK_SIZE_M": 32,
        "BLOCK_SIZE_N": 128,
        "BLOCK_SIZE_K": 256,
        "GROUP_SIZE_M": 8,
        "num_stages": 6,
        "num_warps": 8,
        "compile_time": 1.2634475231170654
    },
    {
        "BLOCK_SIZE_M": 32,
        "BLOCK_SIZE_N": 128,
        "BLOCK_SIZE_K": 256,
        "GROUP_SIZE_M": 8,
        "num_stages": 6,
        "num_warps": 16,
        "compile_time": 0.8187661170959473
    },
    {
        "BLOCK_SIZE_M": 32,
        "BLOCK_SIZE_N": 128,
        "BLOCK_SIZE_K": 256,
        "GROUP_SIZE_M": 8,
        "num_stages": 6,
        "num_warps": 32,
        "compile_time": 0.6091549396514893
    },
    {
        "BLOCK_SIZE_M": 32,
        "BLOCK_SIZE_N": 128,
        "BLOCK_SIZE_K": 256,
        "GROUP_SIZE_M": 8,
        "num_stages": 7,
        "num_warps": 2,
        "compile_time": 11.88725209236145
    },
    {
        "BLOCK_SIZE_M": 32,
        "BLOCK_SIZE_N": 128,
        "BLOCK_SIZE_K": 256,
        "GROUP_SIZE_M": 8,
        "num_stages": 7,
        "num_warps": 4,
        "compile_time": 2.7515833377838135
    },
    {
        "BLOCK_SIZE_M": 32,
        "BLOCK_SIZE_N": 128,
        "BLOCK_SIZE_K": 256,
        "GROUP_SIZE_M": 8,
        "num_stages": 7,
        "num_warps": 8,
        "compile_time": 1.4221372604370117
    },
    {
        "BLOCK_SIZE_M": 32,
        "BLOCK_SIZE_N": 128,
        "BLOCK_SIZE_K": 256,
        "GROUP_SIZE_M": 8,
        "num_stages": 7,
        "num_warps": 16,
        "compile_time": 0.8952786922454834
    },
    {
        "BLOCK_SIZE_M": 32,
        "BLOCK_SIZE_N": 128,
        "BLOCK_SIZE_K": 256,
        "GROUP_SIZE_M": 8,
        "num_stages": 7,
        "num_warps": 32,
        "compile_time": 0.6588466167449951
    },
    {
        "BLOCK_SIZE_M": 32,
        "BLOCK_SIZE_N": 128,
        "BLOCK_SIZE_K": 256,
        "GROUP_SIZE_M": 8,
        "num_stages": 8,
        "num_warps": 2,
        "compile_time": 11.929462909698486
    },
    {
        "BLOCK_SIZE_M": 32,
        "BLOCK_SIZE_N": 128,
        "BLOCK_SIZE_K": 256,
        "GROUP_SIZE_M": 8,
        "num_stages": 8,
        "num_warps": 4,
        "compile_time": 2.9656457901000977
    },
    {
        "BLOCK_SIZE_M": 32,
        "BLOCK_SIZE_N": 128,
        "BLOCK_SIZE_K": 256,
        "GROUP_SIZE_M": 8,
        "num_stages": 8,
        "num_warps": 8,
        "compile_time": 1.5347309112548828
    },
    {
        "BLOCK_SIZE_M": 32,
        "BLOCK_SIZE_N": 128,
        "BLOCK_SIZE_K": 256,
        "GROUP_SIZE_M": 8,
        "num_stages": 8,
        "num_warps": 16,
        "compile_time": 0.9492502212524414
    },
    {
        "BLOCK_SIZE_M": 32,
        "BLOCK_SIZE_N": 128,
        "BLOCK_SIZE_K": 256,
        "GROUP_SIZE_M": 8,
        "num_stages": 8,
        "num_warps": 32,
        "compile_time": 0.6743757724761963
    },
    {
        "BLOCK_SIZE_M": 32,
        "BLOCK_SIZE_N": 128,
        "BLOCK_SIZE_K": 512,
        "GROUP_SIZE_M": 8,
        "num_stages": 1,
        "num_warps": 2,
        "compile_time": 8.452580213546753
    },
    {
        "BLOCK_SIZE_M": 32,
        "BLOCK_SIZE_N": 128,
        "BLOCK_SIZE_K": 512,
        "GROUP_SIZE_M": 8,
        "num_stages": 2,
        "num_warps": 2,
        "compile_time": 8.297479152679443
    },
    {
        "BLOCK_SIZE_M": 32,
        "BLOCK_SIZE_N": 128,
        "BLOCK_SIZE_K": 512,
        "GROUP_SIZE_M": 8,
        "num_stages": 3,
        "num_warps": 2,
        "compile_time": 6.198668718338013
    },
    {
        "BLOCK_SIZE_M": 32,
        "BLOCK_SIZE_N": 128,
        "BLOCK_SIZE_K": 512,
        "GROUP_SIZE_M": 8,
        "num_stages": 3,
        "num_warps": 4,
        "compile_time": 10.941787481307983
    },
    {
        "BLOCK_SIZE_M": 32,
        "BLOCK_SIZE_N": 128,
        "BLOCK_SIZE_K": 512,
        "GROUP_SIZE_M": 8,
        "num_stages": 3,
        "num_warps": 8,
        "compile_time": 2.2180492877960205
    },
    {
        "BLOCK_SIZE_M": 32,
        "BLOCK_SIZE_N": 128,
        "BLOCK_SIZE_K": 512,
        "GROUP_SIZE_M": 8,
        "num_stages": 3,
        "num_warps": 16,
        "compile_time": 1.1088073253631592
    },
    {
        "BLOCK_SIZE_M": 32,
        "BLOCK_SIZE_N": 128,
        "BLOCK_SIZE_K": 512,
        "GROUP_SIZE_M": 8,
        "num_stages": 3,
        "num_warps": 32,
        "compile_time": 0.7634098529815674
    },
    {
        "BLOCK_SIZE_M": 32,
        "BLOCK_SIZE_N": 128,
        "BLOCK_SIZE_K": 512,
        "GROUP_SIZE_M": 8,
        "num_stages": 4,
        "num_warps": 2,
        "compile_time": 6.794122695922852
    },
    {
        "BLOCK_SIZE_M": 32,
        "BLOCK_SIZE_N": 128,
        "BLOCK_SIZE_K": 512,
        "GROUP_SIZE_M": 8,
        "num_stages": 4,
        "num_warps": 4,
        "compile_time": 11.349570512771606
    },
    {
        "BLOCK_SIZE_M": 32,
        "BLOCK_SIZE_N": 128,
        "BLOCK_SIZE_K": 512,
        "GROUP_SIZE_M": 8,
        "num_stages": 4,
        "num_warps": 8,
        "compile_time": 2.345268726348877
    },
    {
        "BLOCK_SIZE_M": 32,
        "BLOCK_SIZE_N": 128,
        "BLOCK_SIZE_K": 512,
        "GROUP_SIZE_M": 8,
        "num_stages": 4,
        "num_warps": 16,
        "compile_time": 1.1767218112945557
    },
    {
        "BLOCK_SIZE_M": 32,
        "BLOCK_SIZE_N": 128,
        "BLOCK_SIZE_K": 512,
        "GROUP_SIZE_M": 8,
        "num_stages": 4,
        "num_warps": 32,
        "compile_time": 0.7903311252593994
    },
    {
        "BLOCK_SIZE_M": 32,
        "BLOCK_SIZE_N": 128,
        "BLOCK_SIZE_K": 512,
        "GROUP_SIZE_M": 8,
        "num_stages": 5,
        "num_warps": 2,
        "compile_time": 7.023481130599976
    },
    {
        "BLOCK_SIZE_M": 32,
        "BLOCK_SIZE_N": 128,
        "BLOCK_SIZE_K": 512,
        "GROUP_SIZE_M": 8,
        "num_stages": 5,
        "num_warps": 4,
        "compile_time": 11.21716022491455
    },
    {
        "BLOCK_SIZE_M": 32,
        "BLOCK_SIZE_N": 128,
        "BLOCK_SIZE_K": 512,
        "GROUP_SIZE_M": 8,
        "num_stages": 5,
        "num_warps": 8,
        "compile_time": 2.545713424682617
    },
    {
        "BLOCK_SIZE_M": 32,
        "BLOCK_SIZE_N": 128,
        "BLOCK_SIZE_K": 512,
        "GROUP_SIZE_M": 8,
        "num_stages": 5,
        "num_warps": 16,
        "compile_time": 1.2959189414978027
    },
    {
        "BLOCK_SIZE_M": 32,
        "BLOCK_SIZE_N": 128,
        "BLOCK_SIZE_K": 512,
        "GROUP_SIZE_M": 8,
        "num_stages": 5,
        "num_warps": 32,
        "compile_time": 0.8469467163085938
    },
    {
        "BLOCK_SIZE_M": 32,
        "BLOCK_SIZE_N": 128,
        "BLOCK_SIZE_K": 512,
        "GROUP_SIZE_M": 8,
        "num_stages": 6,
        "num_warps": 2,
        "compile_time": 7.497955083847046
    },
    {
        "BLOCK_SIZE_M": 32,
        "BLOCK_SIZE_N": 128,
        "BLOCK_SIZE_K": 512,
        "GROUP_SIZE_M": 8,
        "num_stages": 6,
        "num_warps": 4,
        "compile_time": 11.639574766159058
    },
    {
        "BLOCK_SIZE_M": 32,
        "BLOCK_SIZE_N": 128,
        "BLOCK_SIZE_K": 512,
        "GROUP_SIZE_M": 8,
        "num_stages": 6,
        "num_warps": 8,
        "compile_time": 2.650186777114868
    },
    {
        "BLOCK_SIZE_M": 32,
        "BLOCK_SIZE_N": 128,
        "BLOCK_SIZE_K": 512,
        "GROUP_SIZE_M": 8,
        "num_stages": 6,
        "num_warps": 16,
        "compile_time": 1.3864879608154297
    },
    {
        "BLOCK_SIZE_M": 32,
        "BLOCK_SIZE_N": 128,
        "BLOCK_SIZE_K": 512,
        "GROUP_SIZE_M": 8,
        "num_stages": 6,
        "num_warps": 32,
        "compile_time": 0.9180543422698975
    },
    {
        "BLOCK_SIZE_M": 32,
        "BLOCK_SIZE_N": 128,
        "BLOCK_SIZE_K": 512,
        "GROUP_SIZE_M": 8,
        "num_stages": 7,
        "num_warps": 2,
        "compile_time": 7.885120868682861
    },
    {
        "BLOCK_SIZE_M": 32,
        "BLOCK_SIZE_N": 128,
        "BLOCK_SIZE_K": 512,
        "GROUP_SIZE_M": 8,
        "num_stages": 7,
        "num_warps": 4,
        "compile_time": 11.872999668121338
    },
    {
        "BLOCK_SIZE_M": 32,
        "BLOCK_SIZE_N": 128,
        "BLOCK_SIZE_K": 512,
        "GROUP_SIZE_M": 8,
        "num_stages": 7,
        "num_warps": 8,
        "compile_time": 2.8839240074157715
    },
    {
        "BLOCK_SIZE_M": 32,
        "BLOCK_SIZE_N": 128,
        "BLOCK_SIZE_K": 512,
        "GROUP_SIZE_M": 8,
        "num_stages": 7,
        "num_warps": 16,
        "compile_time": 1.490879774093628
    },
    {
        "BLOCK_SIZE_M": 32,
        "BLOCK_SIZE_N": 128,
        "BLOCK_SIZE_K": 512,
        "GROUP_SIZE_M": 8,
        "num_stages": 7,
        "num_warps": 32,
        "compile_time": 0.9751536846160889
    },
    {
        "BLOCK_SIZE_M": 32,
        "BLOCK_SIZE_N": 128,
        "BLOCK_SIZE_K": 512,
        "GROUP_SIZE_M": 8,
        "num_stages": 8,
        "num_warps": 2,
        "compile_time": 8.257101774215698
    },
    {
        "BLOCK_SIZE_M": 32,
        "BLOCK_SIZE_N": 128,
        "BLOCK_SIZE_K": 512,
        "GROUP_SIZE_M": 8,
        "num_stages": 8,
        "num_warps": 4,
        "compile_time": 12.340404033660889
    },
    {
        "BLOCK_SIZE_M": 32,
        "BLOCK_SIZE_N": 128,
        "BLOCK_SIZE_K": 512,
        "GROUP_SIZE_M": 8,
        "num_stages": 8,
        "num_warps": 8,
        "compile_time": 3.0775306224823
    },
    {
        "BLOCK_SIZE_M": 32,
        "BLOCK_SIZE_N": 128,
        "BLOCK_SIZE_K": 512,
        "GROUP_SIZE_M": 8,
        "num_stages": 8,
        "num_warps": 16,
        "compile_time": 1.6421310901641846
    },
    {
        "BLOCK_SIZE_M": 32,
        "BLOCK_SIZE_N": 128,
        "BLOCK_SIZE_K": 512,
        "GROUP_SIZE_M": 8,
        "num_stages": 8,
        "num_warps": 32,
        "compile_time": 1.0378050804138184
    },
    {
        "BLOCK_SIZE_M": 32,
        "BLOCK_SIZE_N": 256,
        "BLOCK_SIZE_K": 64,
        "GROUP_SIZE_M": 8,
        "num_stages": 6,
        "num_warps": 2,
        "compile_time": 2.792163133621216
    },
    {
        "BLOCK_SIZE_M": 32,
        "BLOCK_SIZE_N": 256,
        "BLOCK_SIZE_K": 64,
        "GROUP_SIZE_M": 8,
        "num_stages": 6,
        "num_warps": 4,
        "compile_time": 1.216890573501587
    },
    {
        "BLOCK_SIZE_M": 32,
        "BLOCK_SIZE_N": 256,
        "BLOCK_SIZE_K": 64,
        "GROUP_SIZE_M": 8,
        "num_stages": 6,
        "num_warps": 8,
        "compile_time": 0.7416801452636719
    },
    {
        "BLOCK_SIZE_M": 32,
        "BLOCK_SIZE_N": 256,
        "BLOCK_SIZE_K": 64,
        "GROUP_SIZE_M": 8,
        "num_stages": 6,
        "num_warps": 16,
        "compile_time": 0.5574471950531006
    },
    {
        "BLOCK_SIZE_M": 32,
        "BLOCK_SIZE_N": 256,
        "BLOCK_SIZE_K": 64,
        "GROUP_SIZE_M": 8,
        "num_stages": 6,
        "num_warps": 32,
        "compile_time": 0.45824432373046875
    },
    {
        "BLOCK_SIZE_M": 32,
        "BLOCK_SIZE_N": 256,
        "BLOCK_SIZE_K": 64,
        "GROUP_SIZE_M": 8,
        "num_stages": 7,
        "num_warps": 2,
        "compile_time": 2.9123051166534424
    },
    {
        "BLOCK_SIZE_M": 32,
        "BLOCK_SIZE_N": 256,
        "BLOCK_SIZE_K": 64,
        "GROUP_SIZE_M": 8,
        "num_stages": 7,
        "num_warps": 4,
        "compile_time": 1.293506145477295
    },
    {
        "BLOCK_SIZE_M": 32,
        "BLOCK_SIZE_N": 256,
        "BLOCK_SIZE_K": 64,
        "GROUP_SIZE_M": 8,
        "num_stages": 7,
        "num_warps": 8,
        "compile_time": 0.8125026226043701
    },
    {
        "BLOCK_SIZE_M": 32,
        "BLOCK_SIZE_N": 256,
        "BLOCK_SIZE_K": 64,
        "GROUP_SIZE_M": 8,
        "num_stages": 7,
        "num_warps": 16,
        "compile_time": 0.5708045959472656
    },
    {
        "BLOCK_SIZE_M": 32,
        "BLOCK_SIZE_N": 256,
        "BLOCK_SIZE_K": 64,
        "GROUP_SIZE_M": 8,
        "num_stages": 7,
        "num_warps": 32,
        "compile_time": 0.470428466796875
    },
    {
        "BLOCK_SIZE_M": 32,
        "BLOCK_SIZE_N": 256,
        "BLOCK_SIZE_K": 64,
        "GROUP_SIZE_M": 8,
        "num_stages": 8,
        "num_warps": 2,
        "compile_time": 3.0883877277374268
    },
    {
        "BLOCK_SIZE_M": 32,
        "BLOCK_SIZE_N": 256,
        "BLOCK_SIZE_K": 64,
        "GROUP_SIZE_M": 8,
        "num_stages": 8,
        "num_warps": 4,
        "compile_time": 1.3879711627960205
    },
    {
        "BLOCK_SIZE_M": 32,
        "BLOCK_SIZE_N": 256,
        "BLOCK_SIZE_K": 64,
        "GROUP_SIZE_M": 8,
        "num_stages": 8,
        "num_warps": 8,
        "compile_time": 0.840688943862915
    },
    {
        "BLOCK_SIZE_M": 32,
        "BLOCK_SIZE_N": 256,
        "BLOCK_SIZE_K": 64,
        "GROUP_SIZE_M": 8,
        "num_stages": 8,
        "num_warps": 16,
        "compile_time": 0.6049413681030273
    },
    {
        "BLOCK_SIZE_M": 32,
        "BLOCK_SIZE_N": 256,
        "BLOCK_SIZE_K": 64,
        "GROUP_SIZE_M": 8,
        "num_stages": 8,
        "num_warps": 32,
        "compile_time": 0.5089325904846191
    },
    {
        "BLOCK_SIZE_M": 32,
        "BLOCK_SIZE_N": 256,
        "BLOCK_SIZE_K": 128,
        "GROUP_SIZE_M": 8,
        "num_stages": 3,
        "num_warps": 2,
        "compile_time": 11.142933368682861
    },
    {
        "BLOCK_SIZE_M": 32,
        "BLOCK_SIZE_N": 256,
        "BLOCK_SIZE_K": 128,
        "GROUP_SIZE_M": 8,
        "num_stages": 4,
        "num_warps": 2,
        "compile_time": 11.323843002319336
    },
    {
        "BLOCK_SIZE_M": 32,
        "BLOCK_SIZE_N": 256,
        "BLOCK_SIZE_K": 128,
        "GROUP_SIZE_M": 8,
        "num_stages": 4,
        "num_warps": 4,
        "compile_time": 2.2859344482421875
    },
    {
        "BLOCK_SIZE_M": 32,
        "BLOCK_SIZE_N": 256,
        "BLOCK_SIZE_K": 128,
        "GROUP_SIZE_M": 8,
        "num_stages": 4,
        "num_warps": 8,
        "compile_time": 1.0590934753417969
    },
    {
        "BLOCK_SIZE_M": 32,
        "BLOCK_SIZE_N": 256,
        "BLOCK_SIZE_K": 128,
        "GROUP_SIZE_M": 8,
        "num_stages": 4,
        "num_warps": 16,
        "compile_time": 0.6881983280181885
    },
    {
        "BLOCK_SIZE_M": 32,
        "BLOCK_SIZE_N": 256,
        "BLOCK_SIZE_K": 128,
        "GROUP_SIZE_M": 8,
        "num_stages": 4,
        "num_warps": 32,
        "compile_time": 0.5077211856842041
    },
    {
        "BLOCK_SIZE_M": 32,
        "BLOCK_SIZE_N": 256,
        "BLOCK_SIZE_K": 128,
        "GROUP_SIZE_M": 8,
        "num_stages": 5,
        "num_warps": 2,
        "compile_time": 11.46005916595459
    },
    {
        "BLOCK_SIZE_M": 32,
        "BLOCK_SIZE_N": 256,
        "BLOCK_SIZE_K": 128,
        "GROUP_SIZE_M": 8,
        "num_stages": 5,
        "num_warps": 4,
        "compile_time": 2.383174419403076
    },
    {
        "BLOCK_SIZE_M": 32,
        "BLOCK_SIZE_N": 256,
        "BLOCK_SIZE_K": 128,
        "GROUP_SIZE_M": 8,
        "num_stages": 5,
        "num_warps": 8,
        "compile_time": 1.1011736392974854
    },
    {
        "BLOCK_SIZE_M": 32,
        "BLOCK_SIZE_N": 256,
        "BLOCK_SIZE_K": 128,
        "GROUP_SIZE_M": 8,
        "num_stages": 5,
        "num_warps": 16,
        "compile_time": 0.7342698574066162
    },
    {
        "BLOCK_SIZE_M": 32,
        "BLOCK_SIZE_N": 256,
        "BLOCK_SIZE_K": 128,
        "GROUP_SIZE_M": 8,
        "num_stages": 5,
        "num_warps": 32,
        "compile_time": 0.5334558486938477
    },
    {
        "BLOCK_SIZE_M": 32,
        "BLOCK_SIZE_N": 256,
        "BLOCK_SIZE_K": 128,
        "GROUP_SIZE_M": 8,
        "num_stages": 6,
        "num_warps": 2,
        "compile_time": 11.723578214645386
    },
    {
        "BLOCK_SIZE_M": 32,
        "BLOCK_SIZE_N": 256,
        "BLOCK_SIZE_K": 128,
        "GROUP_SIZE_M": 8,
        "num_stages": 6,
        "num_warps": 4,
        "compile_time": 2.575317144393921
    },
    {
        "BLOCK_SIZE_M": 32,
        "BLOCK_SIZE_N": 256,
        "BLOCK_SIZE_K": 128,
        "GROUP_SIZE_M": 8,
        "num_stages": 6,
        "num_warps": 8,
        "compile_time": 1.2198419570922852
    },
    {
        "BLOCK_SIZE_M": 32,
        "BLOCK_SIZE_N": 256,
        "BLOCK_SIZE_K": 128,
        "GROUP_SIZE_M": 8,
        "num_stages": 6,
        "num_warps": 16,
        "compile_time": 0.8021180629730225
    },
    {
        "BLOCK_SIZE_M": 32,
        "BLOCK_SIZE_N": 256,
        "BLOCK_SIZE_K": 128,
        "GROUP_SIZE_M": 8,
        "num_stages": 6,
        "num_warps": 32,
        "compile_time": 0.5831449031829834
    },
    {
        "BLOCK_SIZE_M": 32,
        "BLOCK_SIZE_N": 256,
        "BLOCK_SIZE_K": 128,
        "GROUP_SIZE_M": 8,
        "num_stages": 7,
        "num_warps": 2,
        "compile_time": 11.925212144851685
    },
    {
        "BLOCK_SIZE_M": 32,
        "BLOCK_SIZE_N": 256,
        "BLOCK_SIZE_K": 128,
        "GROUP_SIZE_M": 8,
        "num_stages": 7,
        "num_warps": 4,
        "compile_time": 2.7044427394866943
    },
    {
        "BLOCK_SIZE_M": 32,
        "BLOCK_SIZE_N": 256,
        "BLOCK_SIZE_K": 128,
        "GROUP_SIZE_M": 8,
        "num_stages": 7,
        "num_warps": 8,
        "compile_time": 1.2878432273864746
    },
    {
        "BLOCK_SIZE_M": 32,
        "BLOCK_SIZE_N": 256,
        "BLOCK_SIZE_K": 128,
        "GROUP_SIZE_M": 8,
        "num_stages": 7,
        "num_warps": 16,
        "compile_time": 0.8247904777526855
    },
    {
        "BLOCK_SIZE_M": 32,
        "BLOCK_SIZE_N": 256,
        "BLOCK_SIZE_K": 128,
        "GROUP_SIZE_M": 8,
        "num_stages": 7,
        "num_warps": 32,
        "compile_time": 0.599724531173706
    },
    {
        "BLOCK_SIZE_M": 32,
        "BLOCK_SIZE_N": 256,
        "BLOCK_SIZE_K": 128,
        "GROUP_SIZE_M": 8,
        "num_stages": 8,
        "num_warps": 2,
        "compile_time": 11.973456859588623
    },
    {
        "BLOCK_SIZE_M": 32,
        "BLOCK_SIZE_N": 256,
        "BLOCK_SIZE_K": 128,
        "GROUP_SIZE_M": 8,
        "num_stages": 8,
        "num_warps": 4,
        "compile_time": 2.8066153526306152
    },
    {
        "BLOCK_SIZE_M": 32,
        "BLOCK_SIZE_N": 256,
        "BLOCK_SIZE_K": 128,
        "GROUP_SIZE_M": 8,
        "num_stages": 8,
        "num_warps": 8,
        "compile_time": 1.4352021217346191
    },
    {
        "BLOCK_SIZE_M": 32,
        "BLOCK_SIZE_N": 256,
        "BLOCK_SIZE_K": 128,
        "GROUP_SIZE_M": 8,
        "num_stages": 8,
        "num_warps": 16,
        "compile_time": 0.8826427459716797
    },
    {
        "BLOCK_SIZE_M": 32,
        "BLOCK_SIZE_N": 256,
        "BLOCK_SIZE_K": 128,
        "GROUP_SIZE_M": 8,
        "num_stages": 8,
        "num_warps": 32,
        "compile_time": 0.6207361221313477
    },
    {
        "BLOCK_SIZE_M": 32,
        "BLOCK_SIZE_N": 256,
        "BLOCK_SIZE_K": 256,
        "GROUP_SIZE_M": 8,
        "num_stages": 1,
        "num_warps": 2,
        "compile_time": 8.200749397277832
    },
    {
        "BLOCK_SIZE_M": 32,
        "BLOCK_SIZE_N": 256,
        "BLOCK_SIZE_K": 256,
        "GROUP_SIZE_M": 8,
        "num_stages": 2,
        "num_warps": 2,
        "compile_time": 8.351747989654541
    },
    {
        "BLOCK_SIZE_M": 32,
        "BLOCK_SIZE_N": 256,
        "BLOCK_SIZE_K": 256,
        "GROUP_SIZE_M": 8,
        "num_stages": 3,
        "num_warps": 2,
        "compile_time": 6.207819938659668
    },
    {
        "BLOCK_SIZE_M": 32,
        "BLOCK_SIZE_N": 256,
        "BLOCK_SIZE_K": 256,
        "GROUP_SIZE_M": 8,
        "num_stages": 3,
        "num_warps": 4,
        "compile_time": 10.833993196487427
    },
    {
        "BLOCK_SIZE_M": 32,
        "BLOCK_SIZE_N": 256,
        "BLOCK_SIZE_K": 256,
        "GROUP_SIZE_M": 8,
        "num_stages": 3,
        "num_warps": 8,
        "compile_time": 2.114158868789673
    },
    {
        "BLOCK_SIZE_M": 32,
        "BLOCK_SIZE_N": 256,
        "BLOCK_SIZE_K": 256,
        "GROUP_SIZE_M": 8,
        "num_stages": 3,
        "num_warps": 16,
        "compile_time": 1.0279247760772705
    },
    {
        "BLOCK_SIZE_M": 32,
        "BLOCK_SIZE_N": 256,
        "BLOCK_SIZE_K": 256,
        "GROUP_SIZE_M": 8,
        "num_stages": 3,
        "num_warps": 32,
        "compile_time": 0.6618590354919434
    },
    {
        "BLOCK_SIZE_M": 32,
        "BLOCK_SIZE_N": 256,
        "BLOCK_SIZE_K": 256,
        "GROUP_SIZE_M": 8,
        "num_stages": 4,
        "num_warps": 2,
        "compile_time": 6.457497596740723
    },
    {
        "BLOCK_SIZE_M": 32,
        "BLOCK_SIZE_N": 256,
        "BLOCK_SIZE_K": 256,
        "GROUP_SIZE_M": 8,
        "num_stages": 4,
        "num_warps": 4,
        "compile_time": 10.776031494140625
    },
    {
        "BLOCK_SIZE_M": 32,
        "BLOCK_SIZE_N": 256,
        "BLOCK_SIZE_K": 256,
        "GROUP_SIZE_M": 8,
        "num_stages": 4,
        "num_warps": 8,
        "compile_time": 2.2057881355285645
    },
    {
        "BLOCK_SIZE_M": 32,
        "BLOCK_SIZE_N": 256,
        "BLOCK_SIZE_K": 256,
        "GROUP_SIZE_M": 8,
        "num_stages": 4,
        "num_warps": 16,
        "compile_time": 1.0771420001983643
    },
    {
        "BLOCK_SIZE_M": 32,
        "BLOCK_SIZE_N": 256,
        "BLOCK_SIZE_K": 256,
        "GROUP_SIZE_M": 8,
        "num_stages": 4,
        "num_warps": 32,
        "compile_time": 0.7189786434173584
    },
    {
        "BLOCK_SIZE_M": 32,
        "BLOCK_SIZE_N": 256,
        "BLOCK_SIZE_K": 256,
        "GROUP_SIZE_M": 8,
        "num_stages": 5,
        "num_warps": 2,
        "compile_time": 6.716121673583984
    },
    {
        "BLOCK_SIZE_M": 32,
        "BLOCK_SIZE_N": 256,
        "BLOCK_SIZE_K": 256,
        "GROUP_SIZE_M": 8,
        "num_stages": 5,
        "num_warps": 4,
        "compile_time": 11.062116861343384
    },
    {
        "BLOCK_SIZE_M": 32,
        "BLOCK_SIZE_N": 256,
        "BLOCK_SIZE_K": 256,
        "GROUP_SIZE_M": 8,
        "num_stages": 5,
        "num_warps": 8,
        "compile_time": 2.382312536239624
    },
    {
        "BLOCK_SIZE_M": 32,
        "BLOCK_SIZE_N": 256,
        "BLOCK_SIZE_K": 256,
        "GROUP_SIZE_M": 8,
        "num_stages": 5,
        "num_warps": 16,
        "compile_time": 1.2061841487884521
    },
    {
        "BLOCK_SIZE_M": 32,
        "BLOCK_SIZE_N": 256,
        "BLOCK_SIZE_K": 256,
        "GROUP_SIZE_M": 8,
        "num_stages": 5,
        "num_warps": 32,
        "compile_time": 0.7848961353302002
    },
    {
        "BLOCK_SIZE_M": 32,
        "BLOCK_SIZE_N": 256,
        "BLOCK_SIZE_K": 256,
        "GROUP_SIZE_M": 8,
        "num_stages": 6,
        "num_warps": 2,
        "compile_time": 7.217975854873657
    },
    {
        "BLOCK_SIZE_M": 32,
        "BLOCK_SIZE_N": 256,
        "BLOCK_SIZE_K": 256,
        "GROUP_SIZE_M": 8,
        "num_stages": 6,
        "num_warps": 4,
        "compile_time": 11.350326776504517
    },
    {
        "BLOCK_SIZE_M": 32,
        "BLOCK_SIZE_N": 256,
        "BLOCK_SIZE_K": 256,
        "GROUP_SIZE_M": 8,
        "num_stages": 6,
        "num_warps": 8,
        "compile_time": 2.4831438064575195
    },
    {
        "BLOCK_SIZE_M": 32,
        "BLOCK_SIZE_N": 256,
        "BLOCK_SIZE_K": 256,
        "GROUP_SIZE_M": 8,
        "num_stages": 6,
        "num_warps": 16,
        "compile_time": 1.2714526653289795
    },
    {
        "BLOCK_SIZE_M": 32,
        "BLOCK_SIZE_N": 256,
        "BLOCK_SIZE_K": 256,
        "GROUP_SIZE_M": 8,
        "num_stages": 6,
        "num_warps": 32,
        "compile_time": 0.8304867744445801
    },
    {
        "BLOCK_SIZE_M": 32,
        "BLOCK_SIZE_N": 256,
        "BLOCK_SIZE_K": 256,
        "GROUP_SIZE_M": 8,
        "num_stages": 7,
        "num_warps": 2,
        "compile_time": 7.4448769092559814
    },
    {
        "BLOCK_SIZE_M": 32,
        "BLOCK_SIZE_N": 256,
        "BLOCK_SIZE_K": 256,
        "GROUP_SIZE_M": 8,
        "num_stages": 7,
        "num_warps": 4,
        "compile_time": 11.511539697647095
    },
    {
        "BLOCK_SIZE_M": 32,
        "BLOCK_SIZE_N": 256,
        "BLOCK_SIZE_K": 256,
        "GROUP_SIZE_M": 8,
        "num_stages": 7,
        "num_warps": 8,
        "compile_time": 2.685096025466919
    },
    {
        "BLOCK_SIZE_M": 32,
        "BLOCK_SIZE_N": 256,
        "BLOCK_SIZE_K": 256,
        "GROUP_SIZE_M": 8,
        "num_stages": 7,
        "num_warps": 16,
        "compile_time": 1.3623015880584717
    },
    {
        "BLOCK_SIZE_M": 32,
        "BLOCK_SIZE_N": 256,
        "BLOCK_SIZE_K": 256,
        "GROUP_SIZE_M": 8,
        "num_stages": 7,
        "num_warps": 32,
        "compile_time": 0.8766129016876221
    },
    {
        "BLOCK_SIZE_M": 32,
        "BLOCK_SIZE_N": 256,
        "BLOCK_SIZE_K": 256,
        "GROUP_SIZE_M": 8,
        "num_stages": 8,
        "num_warps": 2,
        "compile_time": 7.93178653717041
    },
    {
        "BLOCK_SIZE_M": 32,
        "BLOCK_SIZE_N": 256,
        "BLOCK_SIZE_K": 256,
        "GROUP_SIZE_M": 8,
        "num_stages": 8,
        "num_warps": 4,
        "compile_time": 11.64014744758606
    },
    {
        "BLOCK_SIZE_M": 32,
        "BLOCK_SIZE_N": 256,
        "BLOCK_SIZE_K": 256,
        "GROUP_SIZE_M": 8,
        "num_stages": 8,
        "num_warps": 8,
        "compile_time": 2.8738625049591064
    },
    {
        "BLOCK_SIZE_M": 32,
        "BLOCK_SIZE_N": 256,
        "BLOCK_SIZE_K": 256,
        "GROUP_SIZE_M": 8,
        "num_stages": 8,
        "num_warps": 16,
        "compile_time": 1.4876203536987305
    },
    {
        "BLOCK_SIZE_M": 32,
        "BLOCK_SIZE_N": 256,
        "BLOCK_SIZE_K": 256,
        "GROUP_SIZE_M": 8,
        "num_stages": 8,
        "num_warps": 32,
        "compile_time": 0.8925719261169434
    },
    {
        "BLOCK_SIZE_M": 32,
        "BLOCK_SIZE_N": 256,
        "BLOCK_SIZE_K": 512,
        "GROUP_SIZE_M": 8,
        "num_stages": 1,
        "num_warps": 2,
        "compile_time": 19.289662837982178
    },
    {
        "BLOCK_SIZE_M": 32,
        "BLOCK_SIZE_N": 256,
        "BLOCK_SIZE_K": 512,
        "GROUP_SIZE_M": 8,
        "num_stages": 1,
        "num_warps": 4,
        "compile_time": 8.165466785430908
    },
    {
        "BLOCK_SIZE_M": 32,
        "BLOCK_SIZE_N": 256,
        "BLOCK_SIZE_K": 512,
        "GROUP_SIZE_M": 8,
        "num_stages": 1,
        "num_warps": 8,
        "compile_time": 3.1352264881134033
    },
    {
        "BLOCK_SIZE_M": 32,
        "BLOCK_SIZE_N": 256,
        "BLOCK_SIZE_K": 512,
        "GROUP_SIZE_M": 8,
        "num_stages": 1,
        "num_warps": 16,
        "compile_time": 1.3502733707427979
    },
    {
        "BLOCK_SIZE_M": 32,
        "BLOCK_SIZE_N": 256,
        "BLOCK_SIZE_K": 512,
        "GROUP_SIZE_M": 8,
        "num_stages": 1,
        "num_warps": 32,
        "compile_time": 0.8488383293151855
    },
    {
        "BLOCK_SIZE_M": 32,
        "BLOCK_SIZE_N": 256,
        "BLOCK_SIZE_K": 512,
        "GROUP_SIZE_M": 8,
        "num_stages": 2,
        "num_warps": 2,
        "compile_time": 19.66779589653015
    },
    {
        "BLOCK_SIZE_M": 32,
        "BLOCK_SIZE_N": 256,
        "BLOCK_SIZE_K": 512,
        "GROUP_SIZE_M": 8,
        "num_stages": 2,
        "num_warps": 4,
        "compile_time": 8.21513819694519
    },
    {
        "BLOCK_SIZE_M": 32,
        "BLOCK_SIZE_N": 256,
        "BLOCK_SIZE_K": 512,
        "GROUP_SIZE_M": 8,
        "num_stages": 2,
        "num_warps": 8,
        "compile_time": 3.499527931213379
    },
    {
        "BLOCK_SIZE_M": 32,
        "BLOCK_SIZE_N": 256,
        "BLOCK_SIZE_K": 512,
        "GROUP_SIZE_M": 8,
        "num_stages": 2,
        "num_warps": 16,
        "compile_time": 1.575162649154663
    },
    {
        "BLOCK_SIZE_M": 32,
        "BLOCK_SIZE_N": 256,
        "BLOCK_SIZE_K": 512,
        "GROUP_SIZE_M": 8,
        "num_stages": 2,
        "num_warps": 32,
        "compile_time": 0.9263644218444824
    },
    {
        "BLOCK_SIZE_M": 32,
        "BLOCK_SIZE_N": 256,
        "BLOCK_SIZE_K": 512,
        "GROUP_SIZE_M": 8,
        "num_stages": 3,
        "num_warps": 2,
        "compile_time": 20.516448974609375
    },
    {
        "BLOCK_SIZE_M": 32,
        "BLOCK_SIZE_N": 256,
        "BLOCK_SIZE_K": 512,
        "GROUP_SIZE_M": 8,
        "num_stages": 3,
        "num_warps": 4,
        "compile_time": 6.025259256362915
    },
    {
        "BLOCK_SIZE_M": 32,
        "BLOCK_SIZE_N": 256,
        "BLOCK_SIZE_K": 512,
        "GROUP_SIZE_M": 8,
        "num_stages": 3,
        "num_warps": 8,
        "compile_time": 10.754836082458496
    },
    {
        "BLOCK_SIZE_M": 32,
        "BLOCK_SIZE_N": 256,
        "BLOCK_SIZE_K": 512,
        "GROUP_SIZE_M": 8,
        "num_stages": 3,
        "num_warps": 16,
        "compile_time": 2.1632750034332275
    },
    {
        "BLOCK_SIZE_M": 32,
        "BLOCK_SIZE_N": 256,
        "BLOCK_SIZE_K": 512,
        "GROUP_SIZE_M": 8,
        "num_stages": 3,
        "num_warps": 32,
        "compile_time": 1.0755326747894287
    },
    {
        "BLOCK_SIZE_M": 32,
        "BLOCK_SIZE_N": 256,
        "BLOCK_SIZE_K": 512,
        "GROUP_SIZE_M": 8,
        "num_stages": 4,
        "num_warps": 2,
        "compile_time": 21.73060154914856
    },
    {
        "BLOCK_SIZE_M": 32,
        "BLOCK_SIZE_N": 256,
        "BLOCK_SIZE_K": 512,
        "GROUP_SIZE_M": 8,
        "num_stages": 4,
        "num_warps": 4,
        "compile_time": 6.487947463989258
    },
    {
        "BLOCK_SIZE_M": 32,
        "BLOCK_SIZE_N": 256,
        "BLOCK_SIZE_K": 512,
        "GROUP_SIZE_M": 8,
        "num_stages": 4,
        "num_warps": 8,
        "compile_time": 11.008305072784424
    },
    {
        "BLOCK_SIZE_M": 32,
        "BLOCK_SIZE_N": 256,
        "BLOCK_SIZE_K": 512,
        "GROUP_SIZE_M": 8,
        "num_stages": 4,
        "num_warps": 16,
        "compile_time": 2.393838882446289
    },
    {
        "BLOCK_SIZE_M": 32,
        "BLOCK_SIZE_N": 256,
        "BLOCK_SIZE_K": 512,
        "GROUP_SIZE_M": 8,
        "num_stages": 4,
        "num_warps": 32,
        "compile_time": 1.18808913230896
    },
    {
        "BLOCK_SIZE_M": 32,
        "BLOCK_SIZE_N": 256,
        "BLOCK_SIZE_K": 512,
        "GROUP_SIZE_M": 8,
        "num_stages": 5,
        "num_warps": 2,
        "compile_time": 22.16874861717224
    },
    {
        "BLOCK_SIZE_M": 32,
        "BLOCK_SIZE_N": 256,
        "BLOCK_SIZE_K": 512,
        "GROUP_SIZE_M": 8,
        "num_stages": 5,
        "num_warps": 4,
        "compile_time": 6.919491291046143
    },
    {
        "BLOCK_SIZE_M": 32,
        "BLOCK_SIZE_N": 256,
        "BLOCK_SIZE_K": 512,
        "GROUP_SIZE_M": 8,
        "num_stages": 5,
        "num_warps": 8,
        "compile_time": 11.341423034667969
    },
    {
        "BLOCK_SIZE_M": 32,
        "BLOCK_SIZE_N": 256,
        "BLOCK_SIZE_K": 512,
        "GROUP_SIZE_M": 8,
        "num_stages": 5,
        "num_warps": 16,
        "compile_time": 2.5794520378112793
    },
    {
        "BLOCK_SIZE_M": 32,
        "BLOCK_SIZE_N": 256,
        "BLOCK_SIZE_K": 512,
        "GROUP_SIZE_M": 8,
        "num_stages": 5,
        "num_warps": 32,
        "compile_time": 1.2946228981018066
    },
    {
        "BLOCK_SIZE_M": 32,
        "BLOCK_SIZE_N": 256,
        "BLOCK_SIZE_K": 512,
        "GROUP_SIZE_M": 8,
        "num_stages": 6,
        "num_warps": 2,
        "compile_time": 23.054263591766357
    },
    {
        "BLOCK_SIZE_M": 32,
        "BLOCK_SIZE_N": 256,
        "BLOCK_SIZE_K": 512,
        "GROUP_SIZE_M": 8,
        "num_stages": 6,
        "num_warps": 4,
        "compile_time": 7.103763818740845
    },
    {
        "BLOCK_SIZE_M": 32,
        "BLOCK_SIZE_N": 256,
        "BLOCK_SIZE_K": 512,
        "GROUP_SIZE_M": 8,
        "num_stages": 6,
        "num_warps": 8,
        "compile_time": 11.699981451034546
    },
    {
        "BLOCK_SIZE_M": 32,
        "BLOCK_SIZE_N": 256,
        "BLOCK_SIZE_K": 512,
        "GROUP_SIZE_M": 8,
        "num_stages": 6,
        "num_warps": 16,
        "compile_time": 2.911202907562256
    },
    {
        "BLOCK_SIZE_M": 32,
        "BLOCK_SIZE_N": 256,
        "BLOCK_SIZE_K": 512,
        "GROUP_SIZE_M": 8,
        "num_stages": 6,
        "num_warps": 32,
        "compile_time": 1.3982157707214355
    },
    {
        "BLOCK_SIZE_M": 32,
        "BLOCK_SIZE_N": 256,
        "BLOCK_SIZE_K": 512,
        "GROUP_SIZE_M": 8,
        "num_stages": 7,
        "num_warps": 2,
        "compile_time": 6.11840033531189
    },
    {
        "BLOCK_SIZE_M": 32,
        "BLOCK_SIZE_N": 256,
        "BLOCK_SIZE_K": 512,
        "GROUP_SIZE_M": 8,
        "num_stages": 7,
        "num_warps": 4,
        "compile_time": 7.675190448760986
    },
    {
        "BLOCK_SIZE_M": 32,
        "BLOCK_SIZE_N": 256,
        "BLOCK_SIZE_K": 512,
        "GROUP_SIZE_M": 8,
        "num_stages": 7,
        "num_warps": 8,
        "compile_time": 11.6485116481781
    },
    {
        "BLOCK_SIZE_M": 32,
        "BLOCK_SIZE_N": 256,
        "BLOCK_SIZE_K": 512,
        "GROUP_SIZE_M": 8,
        "num_stages": 7,
        "num_warps": 16,
        "compile_time": 2.9546010494232178
    },
    {
        "BLOCK_SIZE_M": 32,
        "BLOCK_SIZE_N": 256,
        "BLOCK_SIZE_K": 512,
        "GROUP_SIZE_M": 8,
        "num_stages": 7,
        "num_warps": 32,
        "compile_time": 1.482722282409668
    },
    {
        "BLOCK_SIZE_M": 32,
        "BLOCK_SIZE_N": 256,
        "BLOCK_SIZE_K": 512,
        "GROUP_SIZE_M": 8,
        "num_stages": 8,
        "num_warps": 2,
        "compile_time": 6.801614046096802
    },
    {
        "BLOCK_SIZE_M": 32,
        "BLOCK_SIZE_N": 256,
        "BLOCK_SIZE_K": 512,
        "GROUP_SIZE_M": 8,
        "num_stages": 8,
        "num_warps": 4,
        "compile_time": 7.986806392669678
    },
    {
        "BLOCK_SIZE_M": 32,
        "BLOCK_SIZE_N": 256,
        "BLOCK_SIZE_K": 512,
        "GROUP_SIZE_M": 8,
        "num_stages": 8,
        "num_warps": 8,
        "compile_time": 12.038342237472534
    },
    {
        "BLOCK_SIZE_M": 32,
        "BLOCK_SIZE_N": 256,
        "BLOCK_SIZE_K": 512,
        "GROUP_SIZE_M": 8,
        "num_stages": 8,
        "num_warps": 16,
        "compile_time": 3.1716575622558594
    },
    {
        "BLOCK_SIZE_M": 32,
        "BLOCK_SIZE_N": 256,
        "BLOCK_SIZE_K": 512,
        "GROUP_SIZE_M": 8,
        "num_stages": 8,
        "num_warps": 32,
        "compile_time": 1.6053307056427002
    },
    {
        "BLOCK_SIZE_M": 32,
        "BLOCK_SIZE_N": 512,
        "BLOCK_SIZE_K": 32,
        "GROUP_SIZE_M": 8,
        "num_stages": 6,
        "num_warps": 2,
        "compile_time": 4.105542898178101
    },
    {
        "BLOCK_SIZE_M": 32,
        "BLOCK_SIZE_N": 512,
        "BLOCK_SIZE_K": 32,
        "GROUP_SIZE_M": 8,
        "num_stages": 6,
        "num_warps": 4,
        "compile_time": 1.5542423725128174
    },
    {
        "BLOCK_SIZE_M": 32,
        "BLOCK_SIZE_N": 512,
        "BLOCK_SIZE_K": 32,
        "GROUP_SIZE_M": 8,
        "num_stages": 6,
        "num_warps": 8,
        "compile_time": 0.8435497283935547
    },
    {
        "BLOCK_SIZE_M": 32,
        "BLOCK_SIZE_N": 512,
        "BLOCK_SIZE_K": 32,
        "GROUP_SIZE_M": 8,
        "num_stages": 6,
        "num_warps": 16,
        "compile_time": 0.5759851932525635
    },
    {
        "BLOCK_SIZE_M": 32,
        "BLOCK_SIZE_N": 512,
        "BLOCK_SIZE_K": 32,
        "GROUP_SIZE_M": 8,
        "num_stages": 7,
        "num_warps": 2,
        "compile_time": 4.220641136169434
    },
    {
        "BLOCK_SIZE_M": 32,
        "BLOCK_SIZE_N": 512,
        "BLOCK_SIZE_K": 32,
        "GROUP_SIZE_M": 8,
        "num_stages": 7,
        "num_warps": 4,
        "compile_time": 1.602372407913208
    },
    {
        "BLOCK_SIZE_M": 32,
        "BLOCK_SIZE_N": 512,
        "BLOCK_SIZE_K": 32,
        "GROUP_SIZE_M": 8,
        "num_stages": 7,
        "num_warps": 8,
        "compile_time": 0.8770866394042969
    },
    {
        "BLOCK_SIZE_M": 32,
        "BLOCK_SIZE_N": 512,
        "BLOCK_SIZE_K": 32,
        "GROUP_SIZE_M": 8,
        "num_stages": 7,
        "num_warps": 16,
        "compile_time": 0.5984482765197754
    },
    {
        "BLOCK_SIZE_M": 32,
        "BLOCK_SIZE_N": 512,
        "BLOCK_SIZE_K": 32,
        "GROUP_SIZE_M": 8,
        "num_stages": 7,
        "num_warps": 32,
        "compile_time": 0.45828747749328613
    },
    {
        "BLOCK_SIZE_M": 32,
        "BLOCK_SIZE_N": 512,
        "BLOCK_SIZE_K": 32,
        "GROUP_SIZE_M": 8,
        "num_stages": 8,
        "num_warps": 2,
        "compile_time": 4.327837228775024
    },
    {
        "BLOCK_SIZE_M": 32,
        "BLOCK_SIZE_N": 512,
        "BLOCK_SIZE_K": 32,
        "GROUP_SIZE_M": 8,
        "num_stages": 8,
        "num_warps": 4,
        "compile_time": 1.6770799160003662
    },
    {
        "BLOCK_SIZE_M": 32,
        "BLOCK_SIZE_N": 512,
        "BLOCK_SIZE_K": 32,
        "GROUP_SIZE_M": 8,
        "num_stages": 8,
        "num_warps": 8,
        "compile_time": 0.9094028472900391
    },
    {
        "BLOCK_SIZE_M": 32,
        "BLOCK_SIZE_N": 512,
        "BLOCK_SIZE_K": 32,
        "GROUP_SIZE_M": 8,
        "num_stages": 8,
        "num_warps": 16,
        "compile_time": 0.6228461265563965
    },
    {
        "BLOCK_SIZE_M": 32,
        "BLOCK_SIZE_N": 512,
        "BLOCK_SIZE_K": 32,
        "GROUP_SIZE_M": 8,
        "num_stages": 8,
        "num_warps": 32,
        "compile_time": 0.4664132595062256
    },
    {
        "BLOCK_SIZE_M": 32,
        "BLOCK_SIZE_N": 512,
        "BLOCK_SIZE_K": 64,
        "GROUP_SIZE_M": 8,
        "num_stages": 1,
        "num_warps": 2,
        "compile_time": 6.249774694442749
    },
    {
        "BLOCK_SIZE_M": 32,
        "BLOCK_SIZE_N": 512,
        "BLOCK_SIZE_K": 64,
        "GROUP_SIZE_M": 8,
        "num_stages": 2,
        "num_warps": 2,
        "compile_time": 6.038210868835449
    },
    {
        "BLOCK_SIZE_M": 32,
        "BLOCK_SIZE_N": 512,
        "BLOCK_SIZE_K": 64,
        "GROUP_SIZE_M": 8,
        "num_stages": 3,
        "num_warps": 2,
        "compile_time": 12.456330060958862
    },
    {
        "BLOCK_SIZE_M": 32,
        "BLOCK_SIZE_N": 512,
        "BLOCK_SIZE_K": 64,
        "GROUP_SIZE_M": 8,
        "num_stages": 4,
        "num_warps": 2,
        "compile_time": 12.366976261138916
    },
    {
        "BLOCK_SIZE_M": 32,
        "BLOCK_SIZE_N": 512,
        "BLOCK_SIZE_K": 64,
        "GROUP_SIZE_M": 8,
        "num_stages": 4,
        "num_warps": 4,
        "compile_time": 2.5054233074188232
    },
    {
        "BLOCK_SIZE_M": 32,
        "BLOCK_SIZE_N": 512,
        "BLOCK_SIZE_K": 64,
        "GROUP_SIZE_M": 8,
        "num_stages": 4,
        "num_warps": 8,
        "compile_time": 1.088778018951416
    },
    {
        "BLOCK_SIZE_M": 32,
        "BLOCK_SIZE_N": 512,
        "BLOCK_SIZE_K": 64,
        "GROUP_SIZE_M": 8,
        "num_stages": 4,
        "num_warps": 16,
        "compile_time": 0.697554349899292
    },
    {
        "BLOCK_SIZE_M": 32,
        "BLOCK_SIZE_N": 512,
        "BLOCK_SIZE_K": 64,
        "GROUP_SIZE_M": 8,
        "num_stages": 4,
        "num_warps": 32,
        "compile_time": 0.5334634780883789
    },
    {
        "BLOCK_SIZE_M": 32,
        "BLOCK_SIZE_N": 512,
        "BLOCK_SIZE_K": 64,
        "GROUP_SIZE_M": 8,
        "num_stages": 5,
        "num_warps": 2,
        "compile_time": 12.81194543838501
    },
    {
        "BLOCK_SIZE_M": 32,
        "BLOCK_SIZE_N": 512,
        "BLOCK_SIZE_K": 64,
        "GROUP_SIZE_M": 8,
        "num_stages": 5,
        "num_warps": 4,
        "compile_time": 2.7403900623321533
    },
    {
        "BLOCK_SIZE_M": 32,
        "BLOCK_SIZE_N": 512,
        "BLOCK_SIZE_K": 64,
        "GROUP_SIZE_M": 8,
        "num_stages": 5,
        "num_warps": 8,
        "compile_time": 1.2339041233062744
    },
    {
        "BLOCK_SIZE_M": 32,
        "BLOCK_SIZE_N": 512,
        "BLOCK_SIZE_K": 64,
        "GROUP_SIZE_M": 8,
        "num_stages": 5,
        "num_warps": 16,
        "compile_time": 0.8087151050567627
    },
    {
        "BLOCK_SIZE_M": 32,
        "BLOCK_SIZE_N": 512,
        "BLOCK_SIZE_K": 64,
        "GROUP_SIZE_M": 8,
        "num_stages": 5,
        "num_warps": 32,
        "compile_time": 0.5701608657836914
    },
    {
        "BLOCK_SIZE_M": 32,
        "BLOCK_SIZE_N": 512,
        "BLOCK_SIZE_K": 64,
        "GROUP_SIZE_M": 8,
        "num_stages": 6,
        "num_warps": 2,
        "compile_time": 13.019274234771729
    },
    {
        "BLOCK_SIZE_M": 32,
        "BLOCK_SIZE_N": 512,
        "BLOCK_SIZE_K": 64,
        "GROUP_SIZE_M": 8,
        "num_stages": 6,
        "num_warps": 4,
        "compile_time": 2.865896224975586
    },
    {
        "BLOCK_SIZE_M": 32,
        "BLOCK_SIZE_N": 512,
        "BLOCK_SIZE_K": 64,
        "GROUP_SIZE_M": 8,
        "num_stages": 6,
        "num_warps": 8,
        "compile_time": 1.2716705799102783
    },
    {
        "BLOCK_SIZE_M": 32,
        "BLOCK_SIZE_N": 512,
        "BLOCK_SIZE_K": 64,
        "GROUP_SIZE_M": 8,
        "num_stages": 6,
        "num_warps": 16,
        "compile_time": 0.8020679950714111
    },
    {
        "BLOCK_SIZE_M": 32,
        "BLOCK_SIZE_N": 512,
        "BLOCK_SIZE_K": 64,
        "GROUP_SIZE_M": 8,
        "num_stages": 6,
        "num_warps": 32,
        "compile_time": 0.5922255516052246
    },
    {
        "BLOCK_SIZE_M": 32,
        "BLOCK_SIZE_N": 512,
        "BLOCK_SIZE_K": 64,
        "GROUP_SIZE_M": 8,
        "num_stages": 7,
        "num_warps": 2,
        "compile_time": 13.102135419845581
    },
    {
        "BLOCK_SIZE_M": 32,
        "BLOCK_SIZE_N": 512,
        "BLOCK_SIZE_K": 64,
        "GROUP_SIZE_M": 8,
        "num_stages": 7,
        "num_warps": 4,
        "compile_time": 3.065011739730835
    },
    {
        "BLOCK_SIZE_M": 32,
        "BLOCK_SIZE_N": 512,
        "BLOCK_SIZE_K": 64,
        "GROUP_SIZE_M": 8,
        "num_stages": 7,
        "num_warps": 8,
        "compile_time": 1.3465020656585693
    },
    {
        "BLOCK_SIZE_M": 32,
        "BLOCK_SIZE_N": 512,
        "BLOCK_SIZE_K": 64,
        "GROUP_SIZE_M": 8,
        "num_stages": 7,
        "num_warps": 16,
        "compile_time": 0.8543107509613037
    },
    {
        "BLOCK_SIZE_M": 32,
        "BLOCK_SIZE_N": 512,
        "BLOCK_SIZE_K": 64,
        "GROUP_SIZE_M": 8,
        "num_stages": 7,
        "num_warps": 32,
        "compile_time": 0.6101217269897461
    },
    {
        "BLOCK_SIZE_M": 32,
        "BLOCK_SIZE_N": 512,
        "BLOCK_SIZE_K": 64,
        "GROUP_SIZE_M": 8,
        "num_stages": 8,
        "num_warps": 2,
        "compile_time": 13.309124946594238
    },
    {
        "BLOCK_SIZE_M": 32,
        "BLOCK_SIZE_N": 512,
        "BLOCK_SIZE_K": 64,
        "GROUP_SIZE_M": 8,
        "num_stages": 8,
        "num_warps": 4,
        "compile_time": 3.1348390579223633
    },
    {
        "BLOCK_SIZE_M": 32,
        "BLOCK_SIZE_N": 512,
        "BLOCK_SIZE_K": 64,
        "GROUP_SIZE_M": 8,
        "num_stages": 8,
        "num_warps": 8,
        "compile_time": 1.4936325550079346
    },
    {
        "BLOCK_SIZE_M": 32,
        "BLOCK_SIZE_N": 512,
        "BLOCK_SIZE_K": 64,
        "GROUP_SIZE_M": 8,
        "num_stages": 8,
        "num_warps": 16,
        "compile_time": 0.9007909297943115
    },
    {
        "BLOCK_SIZE_M": 32,
        "BLOCK_SIZE_N": 512,
        "BLOCK_SIZE_K": 64,
        "GROUP_SIZE_M": 8,
        "num_stages": 8,
        "num_warps": 32,
        "compile_time": 0.6430675983428955
    },
    {
        "BLOCK_SIZE_M": 32,
        "BLOCK_SIZE_N": 512,
        "BLOCK_SIZE_K": 128,
        "GROUP_SIZE_M": 8,
        "num_stages": 1,
        "num_warps": 2,
        "compile_time": 9.527480602264404
    },
    {
        "BLOCK_SIZE_M": 32,
        "BLOCK_SIZE_N": 512,
        "BLOCK_SIZE_K": 128,
        "GROUP_SIZE_M": 8,
        "num_stages": 2,
        "num_warps": 2,
        "compile_time": 9.533484935760498
    },
    {
        "BLOCK_SIZE_M": 32,
        "BLOCK_SIZE_N": 512,
        "BLOCK_SIZE_K": 128,
        "GROUP_SIZE_M": 8,
        "num_stages": 3,
        "num_warps": 2,
        "compile_time": 6.1826441287994385
    },
    {
        "BLOCK_SIZE_M": 32,
        "BLOCK_SIZE_N": 512,
        "BLOCK_SIZE_K": 128,
        "GROUP_SIZE_M": 8,
        "num_stages": 3,
        "num_warps": 4,
        "compile_time": 11.182687997817993
    },
    {
        "BLOCK_SIZE_M": 32,
        "BLOCK_SIZE_N": 512,
        "BLOCK_SIZE_K": 128,
        "GROUP_SIZE_M": 8,
        "num_stages": 3,
        "num_warps": 8,
        "compile_time": 2.129868507385254
    },
    {
        "BLOCK_SIZE_M": 32,
        "BLOCK_SIZE_N": 512,
        "BLOCK_SIZE_K": 128,
        "GROUP_SIZE_M": 8,
        "num_stages": 3,
        "num_warps": 16,
        "compile_time": 1.0263383388519287
    },
    {
        "BLOCK_SIZE_M": 32,
        "BLOCK_SIZE_N": 512,
        "BLOCK_SIZE_K": 128,
        "GROUP_SIZE_M": 8,
        "num_stages": 3,
        "num_warps": 32,
        "compile_time": 0.6939918994903564
    },
    {
        "BLOCK_SIZE_M": 32,
        "BLOCK_SIZE_N": 512,
        "BLOCK_SIZE_K": 128,
        "GROUP_SIZE_M": 8,
        "num_stages": 4,
        "num_warps": 2,
        "compile_time": 6.545926570892334
    },
    {
        "BLOCK_SIZE_M": 32,
        "BLOCK_SIZE_N": 512,
        "BLOCK_SIZE_K": 128,
        "GROUP_SIZE_M": 8,
        "num_stages": 4,
        "num_warps": 4,
        "compile_time": 11.202394962310791
    },
    {
        "BLOCK_SIZE_M": 32,
        "BLOCK_SIZE_N": 512,
        "BLOCK_SIZE_K": 128,
        "GROUP_SIZE_M": 8,
        "num_stages": 4,
        "num_warps": 8,
        "compile_time": 2.3029825687408447
    },
    {
        "BLOCK_SIZE_M": 32,
        "BLOCK_SIZE_N": 512,
        "BLOCK_SIZE_K": 128,
        "GROUP_SIZE_M": 8,
        "num_stages": 4,
        "num_warps": 16,
        "compile_time": 1.0786378383636475
    },
    {
        "BLOCK_SIZE_M": 32,
        "BLOCK_SIZE_N": 512,
        "BLOCK_SIZE_K": 128,
        "GROUP_SIZE_M": 8,
        "num_stages": 4,
        "num_warps": 32,
        "compile_time": 0.7235770225524902
    },
    {
        "BLOCK_SIZE_M": 32,
        "BLOCK_SIZE_N": 512,
        "BLOCK_SIZE_K": 128,
        "GROUP_SIZE_M": 8,
        "num_stages": 5,
        "num_warps": 2,
        "compile_time": 6.914971351623535
    },
    {
        "BLOCK_SIZE_M": 32,
        "BLOCK_SIZE_N": 512,
        "BLOCK_SIZE_K": 128,
        "GROUP_SIZE_M": 8,
        "num_stages": 5,
        "num_warps": 4,
        "compile_time": 10.847819805145264
    },
    {
        "BLOCK_SIZE_M": 32,
        "BLOCK_SIZE_N": 512,
        "BLOCK_SIZE_K": 128,
        "GROUP_SIZE_M": 8,
        "num_stages": 5,
        "num_warps": 8,
        "compile_time": 2.4068191051483154
    },
    {
        "BLOCK_SIZE_M": 32,
        "BLOCK_SIZE_N": 512,
        "BLOCK_SIZE_K": 128,
        "GROUP_SIZE_M": 8,
        "num_stages": 5,
        "num_warps": 16,
        "compile_time": 1.1738431453704834
    },
    {
        "BLOCK_SIZE_M": 32,
        "BLOCK_SIZE_N": 512,
        "BLOCK_SIZE_K": 128,
        "GROUP_SIZE_M": 8,
        "num_stages": 5,
        "num_warps": 32,
        "compile_time": 0.7708015441894531
    },
    {
        "BLOCK_SIZE_M": 32,
        "BLOCK_SIZE_N": 512,
        "BLOCK_SIZE_K": 128,
        "GROUP_SIZE_M": 8,
        "num_stages": 6,
        "num_warps": 2,
        "compile_time": 7.31738805770874
    },
    {
        "BLOCK_SIZE_M": 32,
        "BLOCK_SIZE_N": 512,
        "BLOCK_SIZE_K": 128,
        "GROUP_SIZE_M": 8,
        "num_stages": 6,
        "num_warps": 4,
        "compile_time": 11.660716772079468
    },
    {
        "BLOCK_SIZE_M": 32,
        "BLOCK_SIZE_N": 512,
        "BLOCK_SIZE_K": 128,
        "GROUP_SIZE_M": 8,
        "num_stages": 6,
        "num_warps": 8,
        "compile_time": 2.6555867195129395
    },
    {
        "BLOCK_SIZE_M": 32,
        "BLOCK_SIZE_N": 512,
        "BLOCK_SIZE_K": 128,
        "GROUP_SIZE_M": 8,
        "num_stages": 6,
        "num_warps": 16,
        "compile_time": 1.3336601257324219
    },
    {
        "BLOCK_SIZE_M": 32,
        "BLOCK_SIZE_N": 512,
        "BLOCK_SIZE_K": 128,
        "GROUP_SIZE_M": 8,
        "num_stages": 6,
        "num_warps": 32,
        "compile_time": 0.8709633350372314
    },
    {
        "BLOCK_SIZE_M": 32,
        "BLOCK_SIZE_N": 512,
        "BLOCK_SIZE_K": 128,
        "GROUP_SIZE_M": 8,
        "num_stages": 7,
        "num_warps": 2,
        "compile_time": 7.900197982788086
    },
    {
        "BLOCK_SIZE_M": 32,
        "BLOCK_SIZE_N": 512,
        "BLOCK_SIZE_K": 128,
        "GROUP_SIZE_M": 8,
        "num_stages": 7,
        "num_warps": 4,
        "compile_time": 12.11973524093628
    },
    {
        "BLOCK_SIZE_M": 32,
        "BLOCK_SIZE_N": 512,
        "BLOCK_SIZE_K": 128,
        "GROUP_SIZE_M": 8,
        "num_stages": 7,
        "num_warps": 8,
        "compile_time": 2.862872362136841
    },
    {
        "BLOCK_SIZE_M": 32,
        "BLOCK_SIZE_N": 512,
        "BLOCK_SIZE_K": 128,
        "GROUP_SIZE_M": 8,
        "num_stages": 7,
        "num_warps": 16,
        "compile_time": 1.3317780494689941
    },
    {
        "BLOCK_SIZE_M": 32,
        "BLOCK_SIZE_N": 512,
        "BLOCK_SIZE_K": 128,
        "GROUP_SIZE_M": 8,
        "num_stages": 7,
        "num_warps": 32,
        "compile_time": 0.8885867595672607
    },
    {
        "BLOCK_SIZE_M": 32,
        "BLOCK_SIZE_N": 512,
        "BLOCK_SIZE_K": 128,
        "GROUP_SIZE_M": 8,
        "num_stages": 8,
        "num_warps": 2,
        "compile_time": 8.024358034133911
    },
    {
        "BLOCK_SIZE_M": 32,
        "BLOCK_SIZE_N": 512,
        "BLOCK_SIZE_K": 128,
        "GROUP_SIZE_M": 8,
        "num_stages": 8,
        "num_warps": 4,
        "compile_time": 11.756738662719727
    },
    {
        "BLOCK_SIZE_M": 32,
        "BLOCK_SIZE_N": 512,
        "BLOCK_SIZE_K": 128,
        "GROUP_SIZE_M": 8,
        "num_stages": 8,
        "num_warps": 8,
        "compile_time": 2.8932111263275146
    },
    {
        "BLOCK_SIZE_M": 32,
        "BLOCK_SIZE_N": 512,
        "BLOCK_SIZE_K": 128,
        "GROUP_SIZE_M": 8,
        "num_stages": 8,
        "num_warps": 16,
        "compile_time": 1.4452755451202393
    },
    {
        "BLOCK_SIZE_M": 32,
        "BLOCK_SIZE_N": 512,
        "BLOCK_SIZE_K": 128,
        "GROUP_SIZE_M": 8,
        "num_stages": 8,
        "num_warps": 32,
        "compile_time": 0.9172089099884033
    },
    {
        "BLOCK_SIZE_M": 32,
        "BLOCK_SIZE_N": 512,
        "BLOCK_SIZE_K": 256,
        "GROUP_SIZE_M": 8,
        "num_stages": 1,
        "num_warps": 2,
        "compile_time": 19.045321226119995
    },
    {
        "BLOCK_SIZE_M": 32,
        "BLOCK_SIZE_N": 512,
        "BLOCK_SIZE_K": 256,
        "GROUP_SIZE_M": 8,
        "num_stages": 1,
        "num_warps": 4,
        "compile_time": 8.227463960647583
    },
    {
        "BLOCK_SIZE_M": 32,
        "BLOCK_SIZE_N": 512,
        "BLOCK_SIZE_K": 256,
        "GROUP_SIZE_M": 8,
        "num_stages": 1,
        "num_warps": 8,
        "compile_time": 3.02673077583313
    },
    {
        "BLOCK_SIZE_M": 32,
        "BLOCK_SIZE_N": 512,
        "BLOCK_SIZE_K": 256,
        "GROUP_SIZE_M": 8,
        "num_stages": 1,
        "num_warps": 16,
        "compile_time": 1.3257999420166016
    },
    {
        "BLOCK_SIZE_M": 32,
        "BLOCK_SIZE_N": 512,
        "BLOCK_SIZE_K": 256,
        "GROUP_SIZE_M": 8,
        "num_stages": 1,
        "num_warps": 32,
        "compile_time": 0.8646285533905029
    },
    {
        "BLOCK_SIZE_M": 32,
        "BLOCK_SIZE_N": 512,
        "BLOCK_SIZE_K": 256,
        "GROUP_SIZE_M": 8,
        "num_stages": 2,
        "num_warps": 2,
        "compile_time": 19.766530752182007
    },
    {
        "BLOCK_SIZE_M": 32,
        "BLOCK_SIZE_N": 512,
        "BLOCK_SIZE_K": 256,
        "GROUP_SIZE_M": 8,
        "num_stages": 2,
        "num_warps": 4,
        "compile_time": 8.27276349067688
    },
    {
        "BLOCK_SIZE_M": 32,
        "BLOCK_SIZE_N": 512,
        "BLOCK_SIZE_K": 256,
        "GROUP_SIZE_M": 8,
        "num_stages": 2,
        "num_warps": 8,
        "compile_time": 3.3903093338012695
    },
    {
        "BLOCK_SIZE_M": 32,
        "BLOCK_SIZE_N": 512,
        "BLOCK_SIZE_K": 256,
        "GROUP_SIZE_M": 8,
        "num_stages": 2,
        "num_warps": 16,
        "compile_time": 1.476135492324829
    },
    {
        "BLOCK_SIZE_M": 32,
        "BLOCK_SIZE_N": 512,
        "BLOCK_SIZE_K": 256,
        "GROUP_SIZE_M": 8,
        "num_stages": 2,
        "num_warps": 32,
        "compile_time": 0.8912684917449951
    },
    {
        "BLOCK_SIZE_M": 32,
        "BLOCK_SIZE_N": 512,
        "BLOCK_SIZE_K": 256,
        "GROUP_SIZE_M": 8,
        "num_stages": 3,
        "num_warps": 2,
        "compile_time": 20.692005157470703
    },
    {
        "BLOCK_SIZE_M": 32,
        "BLOCK_SIZE_N": 512,
        "BLOCK_SIZE_K": 256,
        "GROUP_SIZE_M": 8,
        "num_stages": 3,
        "num_warps": 4,
        "compile_time": 6.082882881164551
    },
    {
        "BLOCK_SIZE_M": 32,
        "BLOCK_SIZE_N": 512,
        "BLOCK_SIZE_K": 256,
        "GROUP_SIZE_M": 8,
        "num_stages": 3,
        "num_warps": 8,
        "compile_time": 10.901470422744751
    },
    {
        "BLOCK_SIZE_M": 32,
        "BLOCK_SIZE_N": 512,
        "BLOCK_SIZE_K": 256,
        "GROUP_SIZE_M": 8,
        "num_stages": 3,
        "num_warps": 16,
        "compile_time": 2.1053192615509033
    },
    {
        "BLOCK_SIZE_M": 32,
        "BLOCK_SIZE_N": 512,
        "BLOCK_SIZE_K": 256,
        "GROUP_SIZE_M": 8,
        "num_stages": 3,
        "num_warps": 32,
        "compile_time": 1.0500669479370117
    },
    {
        "BLOCK_SIZE_M": 32,
        "BLOCK_SIZE_N": 512,
        "BLOCK_SIZE_K": 256,
        "GROUP_SIZE_M": 8,
        "num_stages": 4,
        "num_warps": 2,
        "compile_time": 21.145698308944702
    },
    {
        "BLOCK_SIZE_M": 32,
        "BLOCK_SIZE_N": 512,
        "BLOCK_SIZE_K": 256,
        "GROUP_SIZE_M": 8,
        "num_stages": 4,
        "num_warps": 4,
        "compile_time": 6.326609373092651
    },
    {
        "BLOCK_SIZE_M": 32,
        "BLOCK_SIZE_N": 512,
        "BLOCK_SIZE_K": 256,
        "GROUP_SIZE_M": 8,
        "num_stages": 4,
        "num_warps": 8,
        "compile_time": 10.97101902961731
    },
    {
        "BLOCK_SIZE_M": 32,
        "BLOCK_SIZE_N": 512,
        "BLOCK_SIZE_K": 256,
        "GROUP_SIZE_M": 8,
        "num_stages": 4,
        "num_warps": 16,
        "compile_time": 2.266773223876953
    },
    {
        "BLOCK_SIZE_M": 32,
        "BLOCK_SIZE_N": 512,
        "BLOCK_SIZE_K": 256,
        "GROUP_SIZE_M": 8,
        "num_stages": 4,
        "num_warps": 32,
        "compile_time": 1.1460797786712646
    },
    {
        "BLOCK_SIZE_M": 32,
        "BLOCK_SIZE_N": 512,
        "BLOCK_SIZE_K": 256,
        "GROUP_SIZE_M": 8,
        "num_stages": 5,
        "num_warps": 2,
        "compile_time": 22.259942054748535
    },
    {
        "BLOCK_SIZE_M": 32,
        "BLOCK_SIZE_N": 512,
        "BLOCK_SIZE_K": 256,
        "GROUP_SIZE_M": 8,
        "num_stages": 5,
        "num_warps": 4,
        "compile_time": 6.876404762268066
    },
    {
        "BLOCK_SIZE_M": 32,
        "BLOCK_SIZE_N": 512,
        "BLOCK_SIZE_K": 256,
        "GROUP_SIZE_M": 8,
        "num_stages": 5,
        "num_warps": 8,
        "compile_time": 11.24786639213562
    },
    {
        "BLOCK_SIZE_M": 32,
        "BLOCK_SIZE_N": 512,
        "BLOCK_SIZE_K": 256,
        "GROUP_SIZE_M": 8,
        "num_stages": 5,
        "num_warps": 16,
        "compile_time": 2.4607479572296143
    },
    {
        "BLOCK_SIZE_M": 32,
        "BLOCK_SIZE_N": 512,
        "BLOCK_SIZE_K": 256,
        "GROUP_SIZE_M": 8,
        "num_stages": 5,
        "num_warps": 32,
        "compile_time": 1.2050457000732422
    },
    {
        "BLOCK_SIZE_M": 32,
        "BLOCK_SIZE_N": 512,
        "BLOCK_SIZE_K": 256,
        "GROUP_SIZE_M": 8,
        "num_stages": 6,
        "num_warps": 2,
        "compile_time": 23.373157739639282
    },
    {
        "BLOCK_SIZE_M": 32,
        "BLOCK_SIZE_N": 512,
        "BLOCK_SIZE_K": 256,
        "GROUP_SIZE_M": 8,
        "num_stages": 6,
        "num_warps": 4,
        "compile_time": 7.142682313919067
    },
    {
        "BLOCK_SIZE_M": 32,
        "BLOCK_SIZE_N": 512,
        "BLOCK_SIZE_K": 256,
        "GROUP_SIZE_M": 8,
        "num_stages": 6,
        "num_warps": 8,
        "compile_time": 11.588106155395508
    },
    {
        "BLOCK_SIZE_M": 32,
        "BLOCK_SIZE_N": 512,
        "BLOCK_SIZE_K": 256,
        "GROUP_SIZE_M": 8,
        "num_stages": 6,
        "num_warps": 16,
        "compile_time": 2.6890718936920166
    },
    {
        "BLOCK_SIZE_M": 32,
        "BLOCK_SIZE_N": 512,
        "BLOCK_SIZE_K": 256,
        "GROUP_SIZE_M": 8,
        "num_stages": 6,
        "num_warps": 32,
        "compile_time": 1.3254010677337646
    },
    {
        "BLOCK_SIZE_M": 32,
        "BLOCK_SIZE_N": 512,
        "BLOCK_SIZE_K": 256,
        "GROUP_SIZE_M": 8,
        "num_stages": 7,
        "num_warps": 2,
        "compile_time": 6.07877779006958
    },
    {
        "BLOCK_SIZE_M": 32,
        "BLOCK_SIZE_N": 512,
        "BLOCK_SIZE_K": 256,
        "GROUP_SIZE_M": 8,
        "num_stages": 7,
        "num_warps": 4,
        "compile_time": 7.49928879737854
    },
    {
        "BLOCK_SIZE_M": 32,
        "BLOCK_SIZE_N": 512,
        "BLOCK_SIZE_K": 256,
        "GROUP_SIZE_M": 8,
        "num_stages": 7,
        "num_warps": 8,
        "compile_time": 11.685534954071045
    },
    {
        "BLOCK_SIZE_M": 32,
        "BLOCK_SIZE_N": 512,
        "BLOCK_SIZE_K": 256,
        "GROUP_SIZE_M": 8,
        "num_stages": 7,
        "num_warps": 16,
        "compile_time": 2.8043642044067383
    },
    {
        "BLOCK_SIZE_M": 32,
        "BLOCK_SIZE_N": 512,
        "BLOCK_SIZE_K": 256,
        "GROUP_SIZE_M": 8,
        "num_stages": 7,
        "num_warps": 32,
        "compile_time": 1.418565034866333
    },
    {
        "BLOCK_SIZE_M": 32,
        "BLOCK_SIZE_N": 512,
        "BLOCK_SIZE_K": 256,
        "GROUP_SIZE_M": 8,
        "num_stages": 8,
        "num_warps": 2,
        "compile_time": 6.870336532592773
    },
    {
        "BLOCK_SIZE_M": 32,
        "BLOCK_SIZE_N": 512,
        "BLOCK_SIZE_K": 256,
        "GROUP_SIZE_M": 8,
        "num_stages": 8,
        "num_warps": 4,
        "compile_time": 7.868499755859375
    },
    {
        "BLOCK_SIZE_M": 32,
        "BLOCK_SIZE_N": 512,
        "BLOCK_SIZE_K": 256,
        "GROUP_SIZE_M": 8,
        "num_stages": 8,
        "num_warps": 8,
        "compile_time": 11.83509612083435
    },
    {
        "BLOCK_SIZE_M": 32,
        "BLOCK_SIZE_N": 512,
        "BLOCK_SIZE_K": 256,
        "GROUP_SIZE_M": 8,
        "num_stages": 8,
        "num_warps": 16,
        "compile_time": 3.0176777839660645
    },
    {
        "BLOCK_SIZE_M": 32,
        "BLOCK_SIZE_N": 512,
        "BLOCK_SIZE_K": 256,
        "GROUP_SIZE_M": 8,
        "num_stages": 8,
        "num_warps": 32,
        "compile_time": 1.5148544311523438
    },
    {
        "BLOCK_SIZE_M": 32,
        "BLOCK_SIZE_N": 512,
        "BLOCK_SIZE_K": 512,
        "GROUP_SIZE_M": 8,
        "num_stages": 1,
        "num_warps": 2,
        "compile_time": 73.21345043182373
    },
    {
        "BLOCK_SIZE_M": 32,
        "BLOCK_SIZE_N": 512,
        "BLOCK_SIZE_K": 512,
        "GROUP_SIZE_M": 8,
        "num_stages": 1,
        "num_warps": 4,
        "compile_time": 19.449281930923462
    },
    {
        "BLOCK_SIZE_M": 32,
        "BLOCK_SIZE_N": 512,
        "BLOCK_SIZE_K": 512,
        "GROUP_SIZE_M": 8,
        "num_stages": 1,
        "num_warps": 8,
        "compile_time": 8.192302465438843
    },
    {
        "BLOCK_SIZE_M": 32,
        "BLOCK_SIZE_N": 512,
        "BLOCK_SIZE_K": 512,
        "GROUP_SIZE_M": 8,
        "num_stages": 1,
        "num_warps": 16,
        "compile_time": 3.150344133377075
    },
    {
        "BLOCK_SIZE_M": 32,
        "BLOCK_SIZE_N": 512,
        "BLOCK_SIZE_K": 512,
        "GROUP_SIZE_M": 8,
        "num_stages": 1,
        "num_warps": 32,
        "compile_time": 1.3319034576416016
    },
    {
        "BLOCK_SIZE_M": 32,
        "BLOCK_SIZE_N": 512,
        "BLOCK_SIZE_K": 512,
        "GROUP_SIZE_M": 8,
        "num_stages": 2,
        "num_warps": 2,
        "compile_time": 73.2947998046875
    },
    {
        "BLOCK_SIZE_M": 32,
        "BLOCK_SIZE_N": 512,
        "BLOCK_SIZE_K": 512,
        "GROUP_SIZE_M": 8,
        "num_stages": 2,
        "num_warps": 4,
        "compile_time": 19.776059865951538
    },
    {
        "BLOCK_SIZE_M": 32,
        "BLOCK_SIZE_N": 512,
        "BLOCK_SIZE_K": 512,
        "GROUP_SIZE_M": 8,
        "num_stages": 2,
        "num_warps": 8,
        "compile_time": 8.177135467529297
    },
    {
        "BLOCK_SIZE_M": 32,
        "BLOCK_SIZE_N": 512,
        "BLOCK_SIZE_K": 512,
        "GROUP_SIZE_M": 8,
        "num_stages": 2,
        "num_warps": 16,
        "compile_time": 3.4344451427459717
    },
    {
        "BLOCK_SIZE_M": 32,
        "BLOCK_SIZE_N": 512,
        "BLOCK_SIZE_K": 512,
        "GROUP_SIZE_M": 8,
        "num_stages": 2,
        "num_warps": 32,
        "compile_time": 1.5139374732971191
    },
    {
        "BLOCK_SIZE_M": 32,
        "BLOCK_SIZE_N": 512,
        "BLOCK_SIZE_K": 512,
        "GROUP_SIZE_M": 8,
        "num_stages": 3,
        "num_warps": 2,
        "compile_time": 7.6165502071380615
    },
    {
        "BLOCK_SIZE_M": 32,
        "BLOCK_SIZE_N": 512,
        "BLOCK_SIZE_K": 512,
        "GROUP_SIZE_M": 8,
        "num_stages": 3,
        "num_warps": 4,
        "compile_time": 20.11216163635254
    },
    {
        "BLOCK_SIZE_M": 32,
        "BLOCK_SIZE_N": 512,
        "BLOCK_SIZE_K": 512,
        "GROUP_SIZE_M": 8,
        "num_stages": 3,
        "num_warps": 8,
        "compile_time": 6.087163209915161
    },
    {
        "BLOCK_SIZE_M": 32,
        "BLOCK_SIZE_N": 512,
        "BLOCK_SIZE_K": 512,
        "GROUP_SIZE_M": 8,
        "num_stages": 3,
        "num_warps": 16,
        "compile_time": 10.879680633544922
    },
    {
        "BLOCK_SIZE_M": 32,
        "BLOCK_SIZE_N": 512,
        "BLOCK_SIZE_K": 512,
        "GROUP_SIZE_M": 8,
        "num_stages": 3,
        "num_warps": 32,
        "compile_time": 2.1731626987457275
    },
    {
        "BLOCK_SIZE_M": 32,
        "BLOCK_SIZE_N": 512,
        "BLOCK_SIZE_K": 512,
        "GROUP_SIZE_M": 8,
        "num_stages": 4,
        "num_warps": 2,
        "compile_time": 9.240871667861938
    },
    {
        "BLOCK_SIZE_M": 32,
        "BLOCK_SIZE_N": 512,
        "BLOCK_SIZE_K": 512,
        "GROUP_SIZE_M": 8,
        "num_stages": 4,
        "num_warps": 4,
        "compile_time": 21.597647666931152
    },
    {
        "BLOCK_SIZE_M": 32,
        "BLOCK_SIZE_N": 512,
        "BLOCK_SIZE_K": 512,
        "GROUP_SIZE_M": 8,
        "num_stages": 4,
        "num_warps": 8,
        "compile_time": 6.599443674087524
    },
    {
        "BLOCK_SIZE_M": 32,
        "BLOCK_SIZE_N": 512,
        "BLOCK_SIZE_K": 512,
        "GROUP_SIZE_M": 8,
        "num_stages": 4,
        "num_warps": 16,
        "compile_time": 11.295624017715454
    },
    {
        "BLOCK_SIZE_M": 32,
        "BLOCK_SIZE_N": 512,
        "BLOCK_SIZE_K": 512,
        "GROUP_SIZE_M": 8,
        "num_stages": 4,
        "num_warps": 32,
        "compile_time": 2.4026219844818115
    },
    {
        "BLOCK_SIZE_M": 32,
        "BLOCK_SIZE_N": 512,
        "BLOCK_SIZE_K": 512,
        "GROUP_SIZE_M": 8,
        "num_stages": 5,
        "num_warps": 2,
        "compile_time": 11.006900787353516
    },
    {
        "BLOCK_SIZE_M": 32,
        "BLOCK_SIZE_N": 512,
        "BLOCK_SIZE_K": 512,
        "GROUP_SIZE_M": 8,
        "num_stages": 5,
        "num_warps": 4,
        "compile_time": 21.91230010986328
    },
    {
        "BLOCK_SIZE_M": 32,
        "BLOCK_SIZE_N": 512,
        "BLOCK_SIZE_K": 512,
        "GROUP_SIZE_M": 8,
        "num_stages": 5,
        "num_warps": 8,
        "compile_time": 6.996112823486328
    },
    {
        "BLOCK_SIZE_M": 32,
        "BLOCK_SIZE_N": 512,
        "BLOCK_SIZE_K": 512,
        "GROUP_SIZE_M": 8,
        "num_stages": 5,
        "num_warps": 16,
        "compile_time": 11.474906921386719
    },
    {
        "BLOCK_SIZE_M": 32,
        "BLOCK_SIZE_N": 512,
        "BLOCK_SIZE_K": 512,
        "GROUP_SIZE_M": 8,
        "num_stages": 5,
        "num_warps": 32,
        "compile_time": 2.6940441131591797
    },
    {
        "BLOCK_SIZE_M": 32,
        "BLOCK_SIZE_N": 512,
        "BLOCK_SIZE_K": 512,
        "GROUP_SIZE_M": 8,
        "num_stages": 6,
        "num_warps": 2,
        "compile_time": 13.155170917510986
    },
    {
        "BLOCK_SIZE_M": 32,
        "BLOCK_SIZE_N": 512,
        "BLOCK_SIZE_K": 512,
        "GROUP_SIZE_M": 8,
        "num_stages": 6,
        "num_warps": 4,
        "compile_time": 23.347092628479004
    },
    {
        "BLOCK_SIZE_M": 32,
        "BLOCK_SIZE_N": 512,
        "BLOCK_SIZE_K": 512,
        "GROUP_SIZE_M": 8,
        "num_stages": 6,
        "num_warps": 8,
        "compile_time": 7.587575197219849
    },
    {
        "BLOCK_SIZE_M": 32,
        "BLOCK_SIZE_N": 512,
        "BLOCK_SIZE_K": 512,
        "GROUP_SIZE_M": 8,
        "num_stages": 6,
        "num_warps": 16,
        "compile_time": 11.822558403015137
    },
    {
        "BLOCK_SIZE_M": 32,
        "BLOCK_SIZE_N": 512,
        "BLOCK_SIZE_K": 512,
        "GROUP_SIZE_M": 8,
        "num_stages": 6,
        "num_warps": 32,
        "compile_time": 2.8566253185272217
    },
    {
        "BLOCK_SIZE_M": 32,
        "BLOCK_SIZE_N": 512,
        "BLOCK_SIZE_K": 512,
        "GROUP_SIZE_M": 8,
        "num_stages": 7,
        "num_warps": 2,
        "compile_time": 14.603004932403564
    },
    {
        "BLOCK_SIZE_M": 32,
        "BLOCK_SIZE_N": 512,
        "BLOCK_SIZE_K": 512,
        "GROUP_SIZE_M": 8,
        "num_stages": 7,
        "num_warps": 4,
        "compile_time": 6.276787042617798
    },
    {
        "BLOCK_SIZE_M": 32,
        "BLOCK_SIZE_N": 512,
        "BLOCK_SIZE_K": 512,
        "GROUP_SIZE_M": 8,
        "num_stages": 7,
        "num_warps": 8,
        "compile_time": 7.865345478057861
    },
    {
        "BLOCK_SIZE_M": 32,
        "BLOCK_SIZE_N": 512,
        "BLOCK_SIZE_K": 512,
        "GROUP_SIZE_M": 8,
        "num_stages": 7,
        "num_warps": 16,
        "compile_time": 11.83686375617981
    },
    {
        "BLOCK_SIZE_M": 32,
        "BLOCK_SIZE_N": 512,
        "BLOCK_SIZE_K": 512,
        "GROUP_SIZE_M": 8,
        "num_stages": 7,
        "num_warps": 32,
        "compile_time": 2.980465888977051
    },
    {
        "BLOCK_SIZE_M": 32,
        "BLOCK_SIZE_N": 512,
        "BLOCK_SIZE_K": 512,
        "GROUP_SIZE_M": 8,
        "num_stages": 8,
        "num_warps": 2,
        "compile_time": 16.464823246002197
    },
    {
        "BLOCK_SIZE_M": 32,
        "BLOCK_SIZE_N": 512,
        "BLOCK_SIZE_K": 512,
        "GROUP_SIZE_M": 8,
        "num_stages": 8,
        "num_warps": 4,
        "compile_time": 7.078661918640137
    },
    {
        "BLOCK_SIZE_M": 32,
        "BLOCK_SIZE_N": 512,
        "BLOCK_SIZE_K": 512,
        "GROUP_SIZE_M": 8,
        "num_stages": 8,
        "num_warps": 8,
        "compile_time": 8.376466989517212
    },
    {
        "BLOCK_SIZE_M": 32,
        "BLOCK_SIZE_N": 512,
        "BLOCK_SIZE_K": 512,
        "GROUP_SIZE_M": 8,
        "num_stages": 8,
        "num_warps": 16,
        "compile_time": 12.175999164581299
    },
    {
        "BLOCK_SIZE_M": 32,
        "BLOCK_SIZE_N": 512,
        "BLOCK_SIZE_K": 512,
        "GROUP_SIZE_M": 8,
        "num_stages": 8,
        "num_warps": 32,
        "compile_time": 3.2092955112457275
    },
    {
        "BLOCK_SIZE_M": 64,
        "BLOCK_SIZE_N": 16,
        "BLOCK_SIZE_K": 256,
        "GROUP_SIZE_M": 8,
        "num_stages": 6,
        "num_warps": 2,
        "compile_time": 2.536661386489868
    },
    {
        "BLOCK_SIZE_M": 64,
        "BLOCK_SIZE_N": 16,
        "BLOCK_SIZE_K": 256,
        "GROUP_SIZE_M": 8,
        "num_stages": 6,
        "num_warps": 4,
        "compile_time": 1.2609601020812988
    },
    {
        "BLOCK_SIZE_M": 64,
        "BLOCK_SIZE_N": 16,
        "BLOCK_SIZE_K": 256,
        "GROUP_SIZE_M": 8,
        "num_stages": 6,
        "num_warps": 8,
        "compile_time": 0.8214142322540283
    },
    {
        "BLOCK_SIZE_M": 64,
        "BLOCK_SIZE_N": 16,
        "BLOCK_SIZE_K": 256,
        "GROUP_SIZE_M": 8,
        "num_stages": 6,
        "num_warps": 16,
        "compile_time": 0.6549348831176758
    },
    {
        "BLOCK_SIZE_M": 64,
        "BLOCK_SIZE_N": 16,
        "BLOCK_SIZE_K": 256,
        "GROUP_SIZE_M": 8,
        "num_stages": 6,
        "num_warps": 32,
        "compile_time": 0.5864360332489014
    },
    {
        "BLOCK_SIZE_M": 64,
        "BLOCK_SIZE_N": 16,
        "BLOCK_SIZE_K": 256,
        "GROUP_SIZE_M": 8,
        "num_stages": 7,
        "num_warps": 2,
        "compile_time": 2.65213942527771
    },
    {
        "BLOCK_SIZE_M": 64,
        "BLOCK_SIZE_N": 16,
        "BLOCK_SIZE_K": 256,
        "GROUP_SIZE_M": 8,
        "num_stages": 7,
        "num_warps": 4,
        "compile_time": 1.309661626815796
    },
    {
        "BLOCK_SIZE_M": 64,
        "BLOCK_SIZE_N": 16,
        "BLOCK_SIZE_K": 256,
        "GROUP_SIZE_M": 8,
        "num_stages": 7,
        "num_warps": 8,
        "compile_time": 0.8426094055175781
    },
    {
        "BLOCK_SIZE_M": 64,
        "BLOCK_SIZE_N": 16,
        "BLOCK_SIZE_K": 256,
        "GROUP_SIZE_M": 8,
        "num_stages": 7,
        "num_warps": 16,
        "compile_time": 0.6642889976501465
    },
    {
        "BLOCK_SIZE_M": 64,
        "BLOCK_SIZE_N": 16,
        "BLOCK_SIZE_K": 256,
        "GROUP_SIZE_M": 8,
        "num_stages": 7,
        "num_warps": 32,
        "compile_time": 0.5860340595245361
    },
    {
        "BLOCK_SIZE_M": 64,
        "BLOCK_SIZE_N": 16,
        "BLOCK_SIZE_K": 256,
        "GROUP_SIZE_M": 8,
        "num_stages": 8,
        "num_warps": 2,
        "compile_time": 2.8417325019836426
    },
    {
        "BLOCK_SIZE_M": 64,
        "BLOCK_SIZE_N": 16,
        "BLOCK_SIZE_K": 256,
        "GROUP_SIZE_M": 8,
        "num_stages": 8,
        "num_warps": 4,
        "compile_time": 1.400341510772705
    },
    {
        "BLOCK_SIZE_M": 64,
        "BLOCK_SIZE_N": 16,
        "BLOCK_SIZE_K": 256,
        "GROUP_SIZE_M": 8,
        "num_stages": 8,
        "num_warps": 8,
        "compile_time": 0.8936591148376465
    },
    {
        "BLOCK_SIZE_M": 64,
        "BLOCK_SIZE_N": 16,
        "BLOCK_SIZE_K": 256,
        "GROUP_SIZE_M": 8,
        "num_stages": 8,
        "num_warps": 16,
        "compile_time": 0.7025995254516602
    },
    {
        "BLOCK_SIZE_M": 64,
        "BLOCK_SIZE_N": 16,
        "BLOCK_SIZE_K": 256,
        "GROUP_SIZE_M": 8,
        "num_stages": 8,
        "num_warps": 32,
        "compile_time": 0.6091868877410889
    },
    {
        "BLOCK_SIZE_M": 64,
        "BLOCK_SIZE_N": 16,
        "BLOCK_SIZE_K": 512,
        "GROUP_SIZE_M": 8,
        "num_stages": 1,
        "num_warps": 2,
        "compile_time": 6.079956531524658
    },
    {
        "BLOCK_SIZE_M": 64,
        "BLOCK_SIZE_N": 16,
        "BLOCK_SIZE_K": 512,
        "GROUP_SIZE_M": 8,
        "num_stages": 3,
        "num_warps": 2,
        "compile_time": 11.079568147659302
    },
    {
        "BLOCK_SIZE_M": 64,
        "BLOCK_SIZE_N": 16,
        "BLOCK_SIZE_K": 512,
        "GROUP_SIZE_M": 8,
        "num_stages": 4,
        "num_warps": 2,
        "compile_time": 11.518804788589478
    },
    {
        "BLOCK_SIZE_M": 64,
        "BLOCK_SIZE_N": 16,
        "BLOCK_SIZE_K": 512,
        "GROUP_SIZE_M": 8,
        "num_stages": 4,
        "num_warps": 4,
        "compile_time": 2.2859625816345215
    },
    {
        "BLOCK_SIZE_M": 64,
        "BLOCK_SIZE_N": 16,
        "BLOCK_SIZE_K": 512,
        "GROUP_SIZE_M": 8,
        "num_stages": 4,
        "num_warps": 8,
        "compile_time": 1.1407299041748047
    },
    {
        "BLOCK_SIZE_M": 64,
        "BLOCK_SIZE_N": 16,
        "BLOCK_SIZE_K": 512,
        "GROUP_SIZE_M": 8,
        "num_stages": 4,
        "num_warps": 16,
        "compile_time": 0.8309581279754639
    },
    {
        "BLOCK_SIZE_M": 64,
        "BLOCK_SIZE_N": 16,
        "BLOCK_SIZE_K": 512,
        "GROUP_SIZE_M": 8,
        "num_stages": 4,
        "num_warps": 32,
        "compile_time": 0.7066206932067871
    },
    {
        "BLOCK_SIZE_M": 64,
        "BLOCK_SIZE_N": 16,
        "BLOCK_SIZE_K": 512,
        "GROUP_SIZE_M": 8,
        "num_stages": 5,
        "num_warps": 2,
        "compile_time": 11.652478218078613
    },
    {
        "BLOCK_SIZE_M": 64,
        "BLOCK_SIZE_N": 16,
        "BLOCK_SIZE_K": 512,
        "GROUP_SIZE_M": 8,
        "num_stages": 5,
        "num_warps": 4,
        "compile_time": 2.4267027378082275
    },
    {
        "BLOCK_SIZE_M": 64,
        "BLOCK_SIZE_N": 16,
        "BLOCK_SIZE_K": 512,
        "GROUP_SIZE_M": 8,
        "num_stages": 5,
        "num_warps": 8,
        "compile_time": 1.2202508449554443
    },
    {
        "BLOCK_SIZE_M": 64,
        "BLOCK_SIZE_N": 16,
        "BLOCK_SIZE_K": 512,
        "GROUP_SIZE_M": 8,
        "num_stages": 5,
        "num_warps": 16,
        "compile_time": 0.8482754230499268
    },
    {
        "BLOCK_SIZE_M": 64,
        "BLOCK_SIZE_N": 16,
        "BLOCK_SIZE_K": 512,
        "GROUP_SIZE_M": 8,
        "num_stages": 5,
        "num_warps": 32,
        "compile_time": 0.736572265625
    },
    {
        "BLOCK_SIZE_M": 64,
        "BLOCK_SIZE_N": 16,
        "BLOCK_SIZE_K": 512,
        "GROUP_SIZE_M": 8,
        "num_stages": 6,
        "num_warps": 2,
        "compile_time": 11.836678981781006
    },
    {
        "BLOCK_SIZE_M": 64,
        "BLOCK_SIZE_N": 16,
        "BLOCK_SIZE_K": 512,
        "GROUP_SIZE_M": 8,
        "num_stages": 6,
        "num_warps": 4,
        "compile_time": 2.5522336959838867
    },
    {
        "BLOCK_SIZE_M": 64,
        "BLOCK_SIZE_N": 16,
        "BLOCK_SIZE_K": 512,
        "GROUP_SIZE_M": 8,
        "num_stages": 6,
        "num_warps": 8,
        "compile_time": 1.315734624862671
    },
    {
        "BLOCK_SIZE_M": 64,
        "BLOCK_SIZE_N": 16,
        "BLOCK_SIZE_K": 512,
        "GROUP_SIZE_M": 8,
        "num_stages": 6,
        "num_warps": 16,
        "compile_time": 0.9100699424743652
    },
    {
        "BLOCK_SIZE_M": 64,
        "BLOCK_SIZE_N": 16,
        "BLOCK_SIZE_K": 512,
        "GROUP_SIZE_M": 8,
        "num_stages": 6,
        "num_warps": 32,
        "compile_time": 0.7625856399536133
    },
    {
        "BLOCK_SIZE_M": 64,
        "BLOCK_SIZE_N": 16,
        "BLOCK_SIZE_K": 512,
        "GROUP_SIZE_M": 8,
        "num_stages": 7,
        "num_warps": 2,
        "compile_time": 12.057840824127197
    },
    {
        "BLOCK_SIZE_M": 64,
        "BLOCK_SIZE_N": 16,
        "BLOCK_SIZE_K": 512,
        "GROUP_SIZE_M": 8,
        "num_stages": 7,
        "num_warps": 4,
        "compile_time": 2.709846019744873
    },
    {
        "BLOCK_SIZE_M": 64,
        "BLOCK_SIZE_N": 16,
        "BLOCK_SIZE_K": 512,
        "GROUP_SIZE_M": 8,
        "num_stages": 7,
        "num_warps": 8,
        "compile_time": 1.3503975868225098
    },
    {
        "BLOCK_SIZE_M": 64,
        "BLOCK_SIZE_N": 16,
        "BLOCK_SIZE_K": 512,
        "GROUP_SIZE_M": 8,
        "num_stages": 7,
        "num_warps": 16,
        "compile_time": 0.9482951164245605
    },
    {
        "BLOCK_SIZE_M": 64,
        "BLOCK_SIZE_N": 16,
        "BLOCK_SIZE_K": 512,
        "GROUP_SIZE_M": 8,
        "num_stages": 7,
        "num_warps": 32,
        "compile_time": 0.7756679058074951
    },
    {
        "BLOCK_SIZE_M": 64,
        "BLOCK_SIZE_N": 16,
        "BLOCK_SIZE_K": 512,
        "GROUP_SIZE_M": 8,
        "num_stages": 8,
        "num_warps": 2,
        "compile_time": 12.248128652572632
    },
    {
        "BLOCK_SIZE_M": 64,
        "BLOCK_SIZE_N": 16,
        "BLOCK_SIZE_K": 512,
        "GROUP_SIZE_M": 8,
        "num_stages": 8,
        "num_warps": 4,
        "compile_time": 2.824915885925293
    },
    {
        "BLOCK_SIZE_M": 64,
        "BLOCK_SIZE_N": 16,
        "BLOCK_SIZE_K": 512,
        "GROUP_SIZE_M": 8,
        "num_stages": 8,
        "num_warps": 8,
        "compile_time": 1.5220112800598145
    },
    {
        "BLOCK_SIZE_M": 64,
        "BLOCK_SIZE_N": 16,
        "BLOCK_SIZE_K": 512,
        "GROUP_SIZE_M": 8,
        "num_stages": 8,
        "num_warps": 16,
        "compile_time": 0.9933638572692871
    },
    {
        "BLOCK_SIZE_M": 64,
        "BLOCK_SIZE_N": 16,
        "BLOCK_SIZE_K": 512,
        "GROUP_SIZE_M": 8,
        "num_stages": 8,
        "num_warps": 32,
        "compile_time": 0.8140711784362793
    },
    {
        "BLOCK_SIZE_M": 64,
        "BLOCK_SIZE_N": 32,
        "BLOCK_SIZE_K": 128,
        "GROUP_SIZE_M": 8,
        "num_stages": 8,
        "num_warps": 2,
        "compile_time": 1.5475671291351318
    },
    {
        "BLOCK_SIZE_M": 64,
        "BLOCK_SIZE_N": 32,
        "BLOCK_SIZE_K": 128,
        "GROUP_SIZE_M": 8,
        "num_stages": 8,
        "num_warps": 4,
        "compile_time": 0.9707133769989014
    },
    {
        "BLOCK_SIZE_M": 64,
        "BLOCK_SIZE_N": 32,
        "BLOCK_SIZE_K": 128,
        "GROUP_SIZE_M": 8,
        "num_stages": 8,
        "num_warps": 8,
        "compile_time": 0.6604630947113037
    },
    {
        "BLOCK_SIZE_M": 64,
        "BLOCK_SIZE_N": 32,
        "BLOCK_SIZE_K": 128,
        "GROUP_SIZE_M": 8,
        "num_stages": 8,
        "num_warps": 16,
        "compile_time": 0.5461485385894775
    },
    {
        "BLOCK_SIZE_M": 64,
        "BLOCK_SIZE_N": 32,
        "BLOCK_SIZE_K": 128,
        "GROUP_SIZE_M": 8,
        "num_stages": 8,
        "num_warps": 32,
        "compile_time": 0.5111494064331055
    },
    {
        "BLOCK_SIZE_M": 64,
        "BLOCK_SIZE_N": 32,
        "BLOCK_SIZE_K": 256,
        "GROUP_SIZE_M": 8,
        "num_stages": 5,
        "num_warps": 2,
        "compile_time": 2.884971857070923
    },
    {
        "BLOCK_SIZE_M": 64,
        "BLOCK_SIZE_N": 32,
        "BLOCK_SIZE_K": 256,
        "GROUP_SIZE_M": 8,
        "num_stages": 5,
        "num_warps": 4,
        "compile_time": 1.2967925071716309
    },
    {
        "BLOCK_SIZE_M": 64,
        "BLOCK_SIZE_N": 32,
        "BLOCK_SIZE_K": 256,
        "GROUP_SIZE_M": 8,
        "num_stages": 5,
        "num_warps": 8,
        "compile_time": 0.8261055946350098
    },
    {
        "BLOCK_SIZE_M": 64,
        "BLOCK_SIZE_N": 32,
        "BLOCK_SIZE_K": 256,
        "GROUP_SIZE_M": 8,
        "num_stages": 5,
        "num_warps": 16,
        "compile_time": 0.6239850521087646
    },
    {
        "BLOCK_SIZE_M": 64,
        "BLOCK_SIZE_N": 32,
        "BLOCK_SIZE_K": 256,
        "GROUP_SIZE_M": 8,
        "num_stages": 5,
        "num_warps": 32,
        "compile_time": 0.5935192108154297
    },
    {
        "BLOCK_SIZE_M": 64,
        "BLOCK_SIZE_N": 32,
        "BLOCK_SIZE_K": 256,
        "GROUP_SIZE_M": 8,
        "num_stages": 6,
        "num_warps": 2,
        "compile_time": 3.127000331878662
    },
    {
        "BLOCK_SIZE_M": 64,
        "BLOCK_SIZE_N": 32,
        "BLOCK_SIZE_K": 256,
        "GROUP_SIZE_M": 8,
        "num_stages": 6,
        "num_warps": 4,
        "compile_time": 1.432917833328247
    },
    {
        "BLOCK_SIZE_M": 64,
        "BLOCK_SIZE_N": 32,
        "BLOCK_SIZE_K": 256,
        "GROUP_SIZE_M": 8,
        "num_stages": 6,
        "num_warps": 8,
        "compile_time": 0.952627420425415
    },
    {
        "BLOCK_SIZE_M": 64,
        "BLOCK_SIZE_N": 32,
        "BLOCK_SIZE_K": 256,
        "GROUP_SIZE_M": 8,
        "num_stages": 6,
        "num_warps": 16,
        "compile_time": 0.7212281227111816
    },
    {
        "BLOCK_SIZE_M": 64,
        "BLOCK_SIZE_N": 32,
        "BLOCK_SIZE_K": 256,
        "GROUP_SIZE_M": 8,
        "num_stages": 6,
        "num_warps": 32,
        "compile_time": 0.5970284938812256
    },
    {
        "BLOCK_SIZE_M": 64,
        "BLOCK_SIZE_N": 32,
        "BLOCK_SIZE_K": 256,
        "GROUP_SIZE_M": 8,
        "num_stages": 7,
        "num_warps": 2,
        "compile_time": 3.276477575302124
    },
    {
        "BLOCK_SIZE_M": 64,
        "BLOCK_SIZE_N": 32,
        "BLOCK_SIZE_K": 256,
        "GROUP_SIZE_M": 8,
        "num_stages": 7,
        "num_warps": 4,
        "compile_time": 1.5219614505767822
    },
    {
        "BLOCK_SIZE_M": 64,
        "BLOCK_SIZE_N": 32,
        "BLOCK_SIZE_K": 256,
        "GROUP_SIZE_M": 8,
        "num_stages": 7,
        "num_warps": 8,
        "compile_time": 0.9638059139251709
    },
    {
        "BLOCK_SIZE_M": 64,
        "BLOCK_SIZE_N": 32,
        "BLOCK_SIZE_K": 256,
        "GROUP_SIZE_M": 8,
        "num_stages": 7,
        "num_warps": 16,
        "compile_time": 0.7103736400604248
    },
    {
        "BLOCK_SIZE_M": 64,
        "BLOCK_SIZE_N": 32,
        "BLOCK_SIZE_K": 256,
        "GROUP_SIZE_M": 8,
        "num_stages": 7,
        "num_warps": 32,
        "compile_time": 0.613896369934082
    },
    {
        "BLOCK_SIZE_M": 64,
        "BLOCK_SIZE_N": 32,
        "BLOCK_SIZE_K": 256,
        "GROUP_SIZE_M": 8,
        "num_stages": 8,
        "num_warps": 2,
        "compile_time": 3.3874173164367676
    },
    {
        "BLOCK_SIZE_M": 64,
        "BLOCK_SIZE_N": 32,
        "BLOCK_SIZE_K": 256,
        "GROUP_SIZE_M": 8,
        "num_stages": 8,
        "num_warps": 4,
        "compile_time": 1.624466896057129
    },
    {
        "BLOCK_SIZE_M": 64,
        "BLOCK_SIZE_N": 32,
        "BLOCK_SIZE_K": 256,
        "GROUP_SIZE_M": 8,
        "num_stages": 8,
        "num_warps": 8,
        "compile_time": 0.9997038841247559
    },
    {
        "BLOCK_SIZE_M": 64,
        "BLOCK_SIZE_N": 32,
        "BLOCK_SIZE_K": 256,
        "GROUP_SIZE_M": 8,
        "num_stages": 8,
        "num_warps": 16,
        "compile_time": 0.7211709022521973
    },
    {
        "BLOCK_SIZE_M": 64,
        "BLOCK_SIZE_N": 32,
        "BLOCK_SIZE_K": 256,
        "GROUP_SIZE_M": 8,
        "num_stages": 8,
        "num_warps": 32,
        "compile_time": 0.6128087043762207
    },
    {
        "BLOCK_SIZE_M": 64,
        "BLOCK_SIZE_N": 32,
        "BLOCK_SIZE_K": 512,
        "GROUP_SIZE_M": 8,
        "num_stages": 3,
        "num_warps": 2,
        "compile_time": 13.10732626914978
    },
    {
        "BLOCK_SIZE_M": 64,
        "BLOCK_SIZE_N": 32,
        "BLOCK_SIZE_K": 512,
        "GROUP_SIZE_M": 8,
        "num_stages": 3,
        "num_warps": 4,
        "compile_time": 2.5767252445220947
    },
    {
        "BLOCK_SIZE_M": 64,
        "BLOCK_SIZE_N": 32,
        "BLOCK_SIZE_K": 512,
        "GROUP_SIZE_M": 8,
        "num_stages": 3,
        "num_warps": 8,
        "compile_time": 1.1824994087219238
    },
    {
        "BLOCK_SIZE_M": 64,
        "BLOCK_SIZE_N": 32,
        "BLOCK_SIZE_K": 512,
        "GROUP_SIZE_M": 8,
        "num_stages": 3,
        "num_warps": 16,
        "compile_time": 0.8134708404541016
    },
    {
        "BLOCK_SIZE_M": 64,
        "BLOCK_SIZE_N": 32,
        "BLOCK_SIZE_K": 512,
        "GROUP_SIZE_M": 8,
        "num_stages": 3,
        "num_warps": 32,
        "compile_time": 0.6912763118743896
    },
    {
        "BLOCK_SIZE_M": 64,
        "BLOCK_SIZE_N": 32,
        "BLOCK_SIZE_K": 512,
        "GROUP_SIZE_M": 8,
        "num_stages": 4,
        "num_warps": 2,
        "compile_time": 13.395894527435303
    },
    {
        "BLOCK_SIZE_M": 64,
        "BLOCK_SIZE_N": 32,
        "BLOCK_SIZE_K": 512,
        "GROUP_SIZE_M": 8,
        "num_stages": 4,
        "num_warps": 4,
        "compile_time": 2.8080248832702637
    },
    {
        "BLOCK_SIZE_M": 64,
        "BLOCK_SIZE_N": 32,
        "BLOCK_SIZE_K": 512,
        "GROUP_SIZE_M": 8,
        "num_stages": 4,
        "num_warps": 8,
        "compile_time": 1.3020339012145996
    },
    {
        "BLOCK_SIZE_M": 64,
        "BLOCK_SIZE_N": 32,
        "BLOCK_SIZE_K": 512,
        "GROUP_SIZE_M": 8,
        "num_stages": 4,
        "num_warps": 16,
        "compile_time": 0.9639756679534912
    },
    {
        "BLOCK_SIZE_M": 64,
        "BLOCK_SIZE_N": 32,
        "BLOCK_SIZE_K": 512,
        "GROUP_SIZE_M": 8,
        "num_stages": 4,
        "num_warps": 32,
        "compile_time": 0.7623028755187988
    },
    {
        "BLOCK_SIZE_M": 64,
        "BLOCK_SIZE_N": 32,
        "BLOCK_SIZE_K": 512,
        "GROUP_SIZE_M": 8,
        "num_stages": 5,
        "num_warps": 2,
        "compile_time": 13.851219892501831
    },
    {
        "BLOCK_SIZE_M": 64,
        "BLOCK_SIZE_N": 32,
        "BLOCK_SIZE_K": 512,
        "GROUP_SIZE_M": 8,
        "num_stages": 5,
        "num_warps": 4,
        "compile_time": 3.023196220397949
    },
    {
        "BLOCK_SIZE_M": 64,
        "BLOCK_SIZE_N": 32,
        "BLOCK_SIZE_K": 512,
        "GROUP_SIZE_M": 8,
        "num_stages": 5,
        "num_warps": 8,
        "compile_time": 1.3869154453277588
    },
    {
        "BLOCK_SIZE_M": 64,
        "BLOCK_SIZE_N": 32,
        "BLOCK_SIZE_K": 512,
        "GROUP_SIZE_M": 8,
        "num_stages": 5,
        "num_warps": 16,
        "compile_time": 0.9163415431976318
    },
    {
        "BLOCK_SIZE_M": 64,
        "BLOCK_SIZE_N": 32,
        "BLOCK_SIZE_K": 512,
        "GROUP_SIZE_M": 8,
        "num_stages": 5,
        "num_warps": 32,
        "compile_time": 0.7733235359191895
    },
    {
        "BLOCK_SIZE_M": 64,
        "BLOCK_SIZE_N": 32,
        "BLOCK_SIZE_K": 512,
        "GROUP_SIZE_M": 8,
        "num_stages": 6,
        "num_warps": 2,
        "compile_time": 13.885611295700073
    },
    {
        "BLOCK_SIZE_M": 64,
        "BLOCK_SIZE_N": 32,
        "BLOCK_SIZE_K": 512,
        "GROUP_SIZE_M": 8,
        "num_stages": 6,
        "num_warps": 4,
        "compile_time": 3.1360585689544678
    },
    {
        "BLOCK_SIZE_M": 64,
        "BLOCK_SIZE_N": 32,
        "BLOCK_SIZE_K": 512,
        "GROUP_SIZE_M": 8,
        "num_stages": 6,
        "num_warps": 8,
        "compile_time": 1.4767303466796875
    },
    {
        "BLOCK_SIZE_M": 64,
        "BLOCK_SIZE_N": 32,
        "BLOCK_SIZE_K": 512,
        "GROUP_SIZE_M": 8,
        "num_stages": 6,
        "num_warps": 16,
        "compile_time": 0.983647346496582
    },
    {
        "BLOCK_SIZE_M": 64,
        "BLOCK_SIZE_N": 32,
        "BLOCK_SIZE_K": 512,
        "GROUP_SIZE_M": 8,
        "num_stages": 6,
        "num_warps": 32,
        "compile_time": 0.7727241516113281
    },
    {
        "BLOCK_SIZE_M": 64,
        "BLOCK_SIZE_N": 32,
        "BLOCK_SIZE_K": 512,
        "GROUP_SIZE_M": 8,
        "num_stages": 7,
        "num_warps": 2,
        "compile_time": 13.906057119369507
    },
    {
        "BLOCK_SIZE_M": 64,
        "BLOCK_SIZE_N": 32,
        "BLOCK_SIZE_K": 512,
        "GROUP_SIZE_M": 8,
        "num_stages": 7,
        "num_warps": 4,
        "compile_time": 3.316392183303833
    },
    {
        "BLOCK_SIZE_M": 64,
        "BLOCK_SIZE_N": 32,
        "BLOCK_SIZE_K": 512,
        "GROUP_SIZE_M": 8,
        "num_stages": 7,
        "num_warps": 8,
        "compile_time": 1.70835542678833
    },
    {
        "BLOCK_SIZE_M": 64,
        "BLOCK_SIZE_N": 32,
        "BLOCK_SIZE_K": 512,
        "GROUP_SIZE_M": 8,
        "num_stages": 7,
        "num_warps": 16,
        "compile_time": 1.085939645767212
    },
    {
        "BLOCK_SIZE_M": 64,
        "BLOCK_SIZE_N": 32,
        "BLOCK_SIZE_K": 512,
        "GROUP_SIZE_M": 8,
        "num_stages": 7,
        "num_warps": 32,
        "compile_time": 0.8249413967132568
    },
    {
        "BLOCK_SIZE_M": 64,
        "BLOCK_SIZE_N": 32,
        "BLOCK_SIZE_K": 512,
        "GROUP_SIZE_M": 8,
        "num_stages": 8,
        "num_warps": 2,
        "compile_time": 14.194748878479004
    },
    {
        "BLOCK_SIZE_M": 64,
        "BLOCK_SIZE_N": 32,
        "BLOCK_SIZE_K": 512,
        "GROUP_SIZE_M": 8,
        "num_stages": 8,
        "num_warps": 4,
        "compile_time": 3.5199503898620605
    },
    {
        "BLOCK_SIZE_M": 64,
        "BLOCK_SIZE_N": 32,
        "BLOCK_SIZE_K": 512,
        "GROUP_SIZE_M": 8,
        "num_stages": 8,
        "num_warps": 8,
        "compile_time": 1.698209285736084
    },
    {
        "BLOCK_SIZE_M": 64,
        "BLOCK_SIZE_N": 32,
        "BLOCK_SIZE_K": 512,
        "GROUP_SIZE_M": 8,
        "num_stages": 8,
        "num_warps": 16,
        "compile_time": 1.09242582321167
    },
    {
        "BLOCK_SIZE_M": 64,
        "BLOCK_SIZE_N": 32,
        "BLOCK_SIZE_K": 512,
        "GROUP_SIZE_M": 8,
        "num_stages": 8,
        "num_warps": 32,
        "compile_time": 0.8594367504119873
    },
    {
        "BLOCK_SIZE_M": 64,
        "BLOCK_SIZE_N": 64,
        "BLOCK_SIZE_K": 128,
        "GROUP_SIZE_M": 8,
        "num_stages": 7,
        "num_warps": 2,
        "compile_time": 1.9004759788513184
    },
    {
        "BLOCK_SIZE_M": 64,
        "BLOCK_SIZE_N": 64,
        "BLOCK_SIZE_K": 128,
        "GROUP_SIZE_M": 8,
        "num_stages": 7,
        "num_warps": 4,
        "compile_time": 1.0885422229766846
    },
    {
        "BLOCK_SIZE_M": 64,
        "BLOCK_SIZE_N": 64,
        "BLOCK_SIZE_K": 128,
        "GROUP_SIZE_M": 8,
        "num_stages": 7,
        "num_warps": 8,
        "compile_time": 0.7588980197906494
    },
    {
        "BLOCK_SIZE_M": 64,
        "BLOCK_SIZE_N": 64,
        "BLOCK_SIZE_K": 128,
        "GROUP_SIZE_M": 8,
        "num_stages": 7,
        "num_warps": 16,
        "compile_time": 0.5599889755249023
    },
    {
        "BLOCK_SIZE_M": 64,
        "BLOCK_SIZE_N": 64,
        "BLOCK_SIZE_K": 128,
        "GROUP_SIZE_M": 8,
        "num_stages": 7,
        "num_warps": 32,
        "compile_time": 0.46521568298339844
    },
    {
        "BLOCK_SIZE_M": 64,
        "BLOCK_SIZE_N": 64,
        "BLOCK_SIZE_K": 128,
        "GROUP_SIZE_M": 8,
        "num_stages": 8,
        "num_warps": 2,
        "compile_time": 1.992220401763916
    },
    {
        "BLOCK_SIZE_M": 64,
        "BLOCK_SIZE_N": 64,
        "BLOCK_SIZE_K": 128,
        "GROUP_SIZE_M": 8,
        "num_stages": 8,
        "num_warps": 4,
        "compile_time": 1.1495776176452637
    },
    {
        "BLOCK_SIZE_M": 64,
        "BLOCK_SIZE_N": 64,
        "BLOCK_SIZE_K": 128,
        "GROUP_SIZE_M": 8,
        "num_stages": 8,
        "num_warps": 8,
        "compile_time": 0.8341219425201416
    },
    {
        "BLOCK_SIZE_M": 64,
        "BLOCK_SIZE_N": 64,
        "BLOCK_SIZE_K": 128,
        "GROUP_SIZE_M": 8,
        "num_stages": 8,
        "num_warps": 16,
        "compile_time": 0.6677556037902832
    },
    {
        "BLOCK_SIZE_M": 64,
        "BLOCK_SIZE_N": 64,
        "BLOCK_SIZE_K": 128,
        "GROUP_SIZE_M": 8,
        "num_stages": 8,
        "num_warps": 32,
        "compile_time": 0.552175760269165
    },
    {
        "BLOCK_SIZE_M": 64,
        "BLOCK_SIZE_N": 64,
        "BLOCK_SIZE_K": 256,
        "GROUP_SIZE_M": 8,
        "num_stages": 4,
        "num_warps": 2,
        "compile_time": 4.153156518936157
    },
    {
        "BLOCK_SIZE_M": 64,
        "BLOCK_SIZE_N": 64,
        "BLOCK_SIZE_K": 256,
        "GROUP_SIZE_M": 8,
        "num_stages": 4,
        "num_warps": 4,
        "compile_time": 1.6137118339538574
    },
    {
        "BLOCK_SIZE_M": 64,
        "BLOCK_SIZE_N": 64,
        "BLOCK_SIZE_K": 256,
        "GROUP_SIZE_M": 8,
        "num_stages": 4,
        "num_warps": 8,
        "compile_time": 0.9982891082763672
    },
    {
        "BLOCK_SIZE_M": 64,
        "BLOCK_SIZE_N": 64,
        "BLOCK_SIZE_K": 256,
        "GROUP_SIZE_M": 8,
        "num_stages": 4,
        "num_warps": 16,
        "compile_time": 0.7298049926757812
    },
    {
        "BLOCK_SIZE_M": 64,
        "BLOCK_SIZE_N": 64,
        "BLOCK_SIZE_K": 256,
        "GROUP_SIZE_M": 8,
        "num_stages": 4,
        "num_warps": 32,
        "compile_time": 0.5807030200958252
    },
    {
        "BLOCK_SIZE_M": 64,
        "BLOCK_SIZE_N": 64,
        "BLOCK_SIZE_K": 256,
        "GROUP_SIZE_M": 8,
        "num_stages": 5,
        "num_warps": 2,
        "compile_time": 4.341243505477905
    },
    {
        "BLOCK_SIZE_M": 64,
        "BLOCK_SIZE_N": 64,
        "BLOCK_SIZE_K": 256,
        "GROUP_SIZE_M": 8,
        "num_stages": 5,
        "num_warps": 4,
        "compile_time": 1.7279143333435059
    },
    {
        "BLOCK_SIZE_M": 64,
        "BLOCK_SIZE_N": 64,
        "BLOCK_SIZE_K": 256,
        "GROUP_SIZE_M": 8,
        "num_stages": 5,
        "num_warps": 8,
        "compile_time": 1.0118234157562256
    },
    {
        "BLOCK_SIZE_M": 64,
        "BLOCK_SIZE_N": 64,
        "BLOCK_SIZE_K": 256,
        "GROUP_SIZE_M": 8,
        "num_stages": 5,
        "num_warps": 16,
        "compile_time": 0.7423195838928223
    },
    {
        "BLOCK_SIZE_M": 64,
        "BLOCK_SIZE_N": 64,
        "BLOCK_SIZE_K": 256,
        "GROUP_SIZE_M": 8,
        "num_stages": 5,
        "num_warps": 32,
        "compile_time": 0.5955042839050293
    },
    {
        "BLOCK_SIZE_M": 64,
        "BLOCK_SIZE_N": 64,
        "BLOCK_SIZE_K": 256,
        "GROUP_SIZE_M": 8,
        "num_stages": 6,
        "num_warps": 2,
        "compile_time": 4.591383457183838
    },
    {
        "BLOCK_SIZE_M": 64,
        "BLOCK_SIZE_N": 64,
        "BLOCK_SIZE_K": 256,
        "GROUP_SIZE_M": 8,
        "num_stages": 6,
        "num_warps": 4,
        "compile_time": 1.8335740566253662
    },
    {
        "BLOCK_SIZE_M": 64,
        "BLOCK_SIZE_N": 64,
        "BLOCK_SIZE_K": 256,
        "GROUP_SIZE_M": 8,
        "num_stages": 6,
        "num_warps": 8,
        "compile_time": 1.1027796268463135
    },
    {
        "BLOCK_SIZE_M": 64,
        "BLOCK_SIZE_N": 64,
        "BLOCK_SIZE_K": 256,
        "GROUP_SIZE_M": 8,
        "num_stages": 6,
        "num_warps": 16,
        "compile_time": 0.7883882522583008
    },
    {
        "BLOCK_SIZE_M": 64,
        "BLOCK_SIZE_N": 64,
        "BLOCK_SIZE_K": 256,
        "GROUP_SIZE_M": 8,
        "num_stages": 6,
        "num_warps": 32,
        "compile_time": 0.6215622425079346
    },
    {
        "BLOCK_SIZE_M": 64,
        "BLOCK_SIZE_N": 64,
        "BLOCK_SIZE_K": 256,
        "GROUP_SIZE_M": 8,
        "num_stages": 7,
        "num_warps": 2,
        "compile_time": 4.81351113319397
    },
    {
        "BLOCK_SIZE_M": 64,
        "BLOCK_SIZE_N": 64,
        "BLOCK_SIZE_K": 256,
        "GROUP_SIZE_M": 8,
        "num_stages": 7,
        "num_warps": 4,
        "compile_time": 1.9200279712677002
    },
    {
        "BLOCK_SIZE_M": 64,
        "BLOCK_SIZE_N": 64,
        "BLOCK_SIZE_K": 256,
        "GROUP_SIZE_M": 8,
        "num_stages": 7,
        "num_warps": 8,
        "compile_time": 1.1514370441436768
    },
    {
        "BLOCK_SIZE_M": 64,
        "BLOCK_SIZE_N": 64,
        "BLOCK_SIZE_K": 256,
        "GROUP_SIZE_M": 8,
        "num_stages": 7,
        "num_warps": 16,
        "compile_time": 0.8053269386291504
    },
    {
        "BLOCK_SIZE_M": 64,
        "BLOCK_SIZE_N": 64,
        "BLOCK_SIZE_K": 256,
        "GROUP_SIZE_M": 8,
        "num_stages": 7,
        "num_warps": 32,
        "compile_time": 0.6303834915161133
    },
    {
        "BLOCK_SIZE_M": 64,
        "BLOCK_SIZE_N": 64,
        "BLOCK_SIZE_K": 256,
        "GROUP_SIZE_M": 8,
        "num_stages": 8,
        "num_warps": 2,
        "compile_time": 4.9962077140808105
    },
    {
        "BLOCK_SIZE_M": 64,
        "BLOCK_SIZE_N": 64,
        "BLOCK_SIZE_K": 256,
        "GROUP_SIZE_M": 8,
        "num_stages": 8,
        "num_warps": 4,
        "compile_time": 2.0585784912109375
    },
    {
        "BLOCK_SIZE_M": 64,
        "BLOCK_SIZE_N": 64,
        "BLOCK_SIZE_K": 256,
        "GROUP_SIZE_M": 8,
        "num_stages": 8,
        "num_warps": 8,
        "compile_time": 1.29400634765625
    },
    {
        "BLOCK_SIZE_M": 64,
        "BLOCK_SIZE_N": 64,
        "BLOCK_SIZE_K": 256,
        "GROUP_SIZE_M": 8,
        "num_stages": 8,
        "num_warps": 16,
        "compile_time": 0.8516714572906494
    },
    {
        "BLOCK_SIZE_M": 64,
        "BLOCK_SIZE_N": 64,
        "BLOCK_SIZE_K": 256,
        "GROUP_SIZE_M": 8,
        "num_stages": 8,
        "num_warps": 32,
        "compile_time": 0.6477410793304443
    },
    {
        "BLOCK_SIZE_M": 64,
        "BLOCK_SIZE_N": 64,
        "BLOCK_SIZE_K": 512,
        "GROUP_SIZE_M": 8,
        "num_stages": 1,
        "num_warps": 2,
        "compile_time": 6.074941396713257
    },
    {
        "BLOCK_SIZE_M": 64,
        "BLOCK_SIZE_N": 64,
        "BLOCK_SIZE_K": 512,
        "GROUP_SIZE_M": 8,
        "num_stages": 2,
        "num_warps": 2,
        "compile_time": 6.000941753387451
    },
    {
        "BLOCK_SIZE_M": 64,
        "BLOCK_SIZE_N": 64,
        "BLOCK_SIZE_K": 512,
        "GROUP_SIZE_M": 8,
        "num_stages": 3,
        "num_warps": 2,
        "compile_time": 23.74820876121521
    },
    {
        "BLOCK_SIZE_M": 64,
        "BLOCK_SIZE_N": 64,
        "BLOCK_SIZE_K": 512,
        "GROUP_SIZE_M": 8,
        "num_stages": 3,
        "num_warps": 4,
        "compile_time": 3.8730862140655518
    },
    {
        "BLOCK_SIZE_M": 64,
        "BLOCK_SIZE_N": 64,
        "BLOCK_SIZE_K": 512,
        "GROUP_SIZE_M": 8,
        "num_stages": 3,
        "num_warps": 8,
        "compile_time": 1.53578519821167
    },
    {
        "BLOCK_SIZE_M": 64,
        "BLOCK_SIZE_N": 64,
        "BLOCK_SIZE_K": 512,
        "GROUP_SIZE_M": 8,
        "num_stages": 3,
        "num_warps": 16,
        "compile_time": 0.9475061893463135
    },
    {
        "BLOCK_SIZE_M": 64,
        "BLOCK_SIZE_N": 64,
        "BLOCK_SIZE_K": 512,
        "GROUP_SIZE_M": 8,
        "num_stages": 3,
        "num_warps": 32,
        "compile_time": 0.726252555847168
    },
    {
        "BLOCK_SIZE_M": 64,
        "BLOCK_SIZE_N": 64,
        "BLOCK_SIZE_K": 512,
        "GROUP_SIZE_M": 8,
        "num_stages": 4,
        "num_warps": 2,
        "compile_time": 24.362958192825317
    },
    {
        "BLOCK_SIZE_M": 64,
        "BLOCK_SIZE_N": 64,
        "BLOCK_SIZE_K": 512,
        "GROUP_SIZE_M": 8,
        "num_stages": 4,
        "num_warps": 4,
        "compile_time": 4.126614809036255
    },
    {
        "BLOCK_SIZE_M": 64,
        "BLOCK_SIZE_N": 64,
        "BLOCK_SIZE_K": 512,
        "GROUP_SIZE_M": 8,
        "num_stages": 4,
        "num_warps": 8,
        "compile_time": 1.6190714836120605
    },
    {
        "BLOCK_SIZE_M": 64,
        "BLOCK_SIZE_N": 64,
        "BLOCK_SIZE_K": 512,
        "GROUP_SIZE_M": 8,
        "num_stages": 4,
        "num_warps": 16,
        "compile_time": 1.004443645477295
    },
    {
        "BLOCK_SIZE_M": 64,
        "BLOCK_SIZE_N": 64,
        "BLOCK_SIZE_K": 512,
        "GROUP_SIZE_M": 8,
        "num_stages": 4,
        "num_warps": 32,
        "compile_time": 0.7632286548614502
    },
    {
        "BLOCK_SIZE_M": 64,
        "BLOCK_SIZE_N": 64,
        "BLOCK_SIZE_K": 512,
        "GROUP_SIZE_M": 8,
        "num_stages": 5,
        "num_warps": 2,
        "compile_time": 24.342954874038696
    },
    {
        "BLOCK_SIZE_M": 64,
        "BLOCK_SIZE_N": 64,
        "BLOCK_SIZE_K": 512,
        "GROUP_SIZE_M": 8,
        "num_stages": 5,
        "num_warps": 4,
        "compile_time": 4.295919418334961
    },
    {
        "BLOCK_SIZE_M": 64,
        "BLOCK_SIZE_N": 64,
        "BLOCK_SIZE_K": 512,
        "GROUP_SIZE_M": 8,
        "num_stages": 5,
        "num_warps": 8,
        "compile_time": 1.8199706077575684
    },
    {
        "BLOCK_SIZE_M": 64,
        "BLOCK_SIZE_N": 64,
        "BLOCK_SIZE_K": 512,
        "GROUP_SIZE_M": 8,
        "num_stages": 5,
        "num_warps": 16,
        "compile_time": 1.105851650238037
    },
    {
        "BLOCK_SIZE_M": 64,
        "BLOCK_SIZE_N": 64,
        "BLOCK_SIZE_K": 512,
        "GROUP_SIZE_M": 8,
        "num_stages": 5,
        "num_warps": 32,
        "compile_time": 0.8103625774383545
    },
    {
        "BLOCK_SIZE_M": 64,
        "BLOCK_SIZE_N": 64,
        "BLOCK_SIZE_K": 512,
        "GROUP_SIZE_M": 8,
        "num_stages": 6,
        "num_warps": 2,
        "compile_time": 25.16955542564392
    },
    {
        "BLOCK_SIZE_M": 64,
        "BLOCK_SIZE_N": 64,
        "BLOCK_SIZE_K": 512,
        "GROUP_SIZE_M": 8,
        "num_stages": 6,
        "num_warps": 4,
        "compile_time": 4.598945140838623
    },
    {
        "BLOCK_SIZE_M": 64,
        "BLOCK_SIZE_N": 64,
        "BLOCK_SIZE_K": 512,
        "GROUP_SIZE_M": 8,
        "num_stages": 6,
        "num_warps": 8,
        "compile_time": 1.9400484561920166
    },
    {
        "BLOCK_SIZE_M": 64,
        "BLOCK_SIZE_N": 64,
        "BLOCK_SIZE_K": 512,
        "GROUP_SIZE_M": 8,
        "num_stages": 6,
        "num_warps": 16,
        "compile_time": 1.1543419361114502
    },
    {
        "BLOCK_SIZE_M": 64,
        "BLOCK_SIZE_N": 64,
        "BLOCK_SIZE_K": 512,
        "GROUP_SIZE_M": 8,
        "num_stages": 6,
        "num_warps": 32,
        "compile_time": 0.8478138446807861
    },
    {
        "BLOCK_SIZE_M": 64,
        "BLOCK_SIZE_N": 64,
        "BLOCK_SIZE_K": 512,
        "GROUP_SIZE_M": 8,
        "num_stages": 7,
        "num_warps": 2,
        "compile_time": 24.86611843109131
    },
    {
        "BLOCK_SIZE_M": 64,
        "BLOCK_SIZE_N": 64,
        "BLOCK_SIZE_K": 512,
        "GROUP_SIZE_M": 8,
        "num_stages": 7,
        "num_warps": 4,
        "compile_time": 4.838515758514404
    },
    {
        "BLOCK_SIZE_M": 64,
        "BLOCK_SIZE_N": 64,
        "BLOCK_SIZE_K": 512,
        "GROUP_SIZE_M": 8,
        "num_stages": 7,
        "num_warps": 8,
        "compile_time": 2.1689696311950684
    },
    {
        "BLOCK_SIZE_M": 64,
        "BLOCK_SIZE_N": 64,
        "BLOCK_SIZE_K": 512,
        "GROUP_SIZE_M": 8,
        "num_stages": 7,
        "num_warps": 16,
        "compile_time": 1.2576673030853271
    },
    {
        "BLOCK_SIZE_M": 64,
        "BLOCK_SIZE_N": 64,
        "BLOCK_SIZE_K": 512,
        "GROUP_SIZE_M": 8,
        "num_stages": 7,
        "num_warps": 32,
        "compile_time": 0.9033734798431396
    },
    {
        "BLOCK_SIZE_M": 64,
        "BLOCK_SIZE_N": 64,
        "BLOCK_SIZE_K": 512,
        "GROUP_SIZE_M": 8,
        "num_stages": 8,
        "num_warps": 2,
        "compile_time": 25.232705116271973
    },
    {
        "BLOCK_SIZE_M": 64,
        "BLOCK_SIZE_N": 64,
        "BLOCK_SIZE_K": 512,
        "GROUP_SIZE_M": 8,
        "num_stages": 8,
        "num_warps": 4,
        "compile_time": 5.086445569992065
    },
    {
        "BLOCK_SIZE_M": 64,
        "BLOCK_SIZE_N": 64,
        "BLOCK_SIZE_K": 512,
        "GROUP_SIZE_M": 8,
        "num_stages": 8,
        "num_warps": 8,
        "compile_time": 2.213076114654541
    },
    {
        "BLOCK_SIZE_M": 64,
        "BLOCK_SIZE_N": 64,
        "BLOCK_SIZE_K": 512,
        "GROUP_SIZE_M": 8,
        "num_stages": 8,
        "num_warps": 16,
        "compile_time": 1.326852798461914
    },
    {
        "BLOCK_SIZE_M": 64,
        "BLOCK_SIZE_N": 64,
        "BLOCK_SIZE_K": 512,
        "GROUP_SIZE_M": 8,
        "num_stages": 8,
        "num_warps": 32,
        "compile_time": 0.9448511600494385
    },
    {
        "BLOCK_SIZE_M": 64,
        "BLOCK_SIZE_N": 128,
        "BLOCK_SIZE_K": 64,
        "GROUP_SIZE_M": 8,
        "num_stages": 8,
        "num_warps": 2,
        "compile_time": 1.9270141124725342
    },
    {
        "BLOCK_SIZE_M": 64,
        "BLOCK_SIZE_N": 128,
        "BLOCK_SIZE_K": 64,
        "GROUP_SIZE_M": 8,
        "num_stages": 8,
        "num_warps": 4,
        "compile_time": 1.0759468078613281
    },
    {
        "BLOCK_SIZE_M": 64,
        "BLOCK_SIZE_N": 128,
        "BLOCK_SIZE_K": 64,
        "GROUP_SIZE_M": 8,
        "num_stages": 8,
        "num_warps": 8,
        "compile_time": 0.7124228477478027
    },
    {
        "BLOCK_SIZE_M": 64,
        "BLOCK_SIZE_N": 128,
        "BLOCK_SIZE_K": 64,
        "GROUP_SIZE_M": 8,
        "num_stages": 8,
        "num_warps": 16,
        "compile_time": 0.5423531532287598
    },
    {
        "BLOCK_SIZE_M": 64,
        "BLOCK_SIZE_N": 128,
        "BLOCK_SIZE_K": 64,
        "GROUP_SIZE_M": 8,
        "num_stages": 8,
        "num_warps": 32,
        "compile_time": 0.4831821918487549
    },
    {
        "BLOCK_SIZE_M": 64,
        "BLOCK_SIZE_N": 128,
        "BLOCK_SIZE_K": 128,
        "GROUP_SIZE_M": 8,
        "num_stages": 5,
        "num_warps": 2,
        "compile_time": 3.1892142295837402
    },
    {
        "BLOCK_SIZE_M": 64,
        "BLOCK_SIZE_N": 128,
        "BLOCK_SIZE_K": 128,
        "GROUP_SIZE_M": 8,
        "num_stages": 5,
        "num_warps": 4,
        "compile_time": 1.406749963760376
    },
    {
        "BLOCK_SIZE_M": 64,
        "BLOCK_SIZE_N": 128,
        "BLOCK_SIZE_K": 128,
        "GROUP_SIZE_M": 8,
        "num_stages": 5,
        "num_warps": 8,
        "compile_time": 0.8951671123504639
    },
    {
        "BLOCK_SIZE_M": 64,
        "BLOCK_SIZE_N": 128,
        "BLOCK_SIZE_K": 128,
        "GROUP_SIZE_M": 8,
        "num_stages": 5,
        "num_warps": 16,
        "compile_time": 0.6497485637664795
    },
    {
        "BLOCK_SIZE_M": 64,
        "BLOCK_SIZE_N": 128,
        "BLOCK_SIZE_K": 128,
        "GROUP_SIZE_M": 8,
        "num_stages": 5,
        "num_warps": 32,
        "compile_time": 0.5096561908721924
    },
    {
        "BLOCK_SIZE_M": 64,
        "BLOCK_SIZE_N": 128,
        "BLOCK_SIZE_K": 128,
        "GROUP_SIZE_M": 8,
        "num_stages": 6,
        "num_warps": 2,
        "compile_time": 3.4029016494750977
    },
    {
        "BLOCK_SIZE_M": 64,
        "BLOCK_SIZE_N": 128,
        "BLOCK_SIZE_K": 128,
        "GROUP_SIZE_M": 8,
        "num_stages": 6,
        "num_warps": 4,
        "compile_time": 1.502436876296997
    },
    {
        "BLOCK_SIZE_M": 64,
        "BLOCK_SIZE_N": 128,
        "BLOCK_SIZE_K": 128,
        "GROUP_SIZE_M": 8,
        "num_stages": 6,
        "num_warps": 8,
        "compile_time": 0.9363241195678711
    },
    {
        "BLOCK_SIZE_M": 64,
        "BLOCK_SIZE_N": 128,
        "BLOCK_SIZE_K": 128,
        "GROUP_SIZE_M": 8,
        "num_stages": 6,
        "num_warps": 16,
        "compile_time": 0.6572818756103516
    },
    {
        "BLOCK_SIZE_M": 64,
        "BLOCK_SIZE_N": 128,
        "BLOCK_SIZE_K": 128,
        "GROUP_SIZE_M": 8,
        "num_stages": 6,
        "num_warps": 32,
        "compile_time": 0.511216402053833
    },
    {
        "BLOCK_SIZE_M": 64,
        "BLOCK_SIZE_N": 128,
        "BLOCK_SIZE_K": 128,
        "GROUP_SIZE_M": 8,
        "num_stages": 7,
        "num_warps": 2,
        "compile_time": 3.6259539127349854
    },
    {
        "BLOCK_SIZE_M": 64,
        "BLOCK_SIZE_N": 128,
        "BLOCK_SIZE_K": 128,
        "GROUP_SIZE_M": 8,
        "num_stages": 7,
        "num_warps": 4,
        "compile_time": 1.61411452293396
    },
    {
        "BLOCK_SIZE_M": 64,
        "BLOCK_SIZE_N": 128,
        "BLOCK_SIZE_K": 128,
        "GROUP_SIZE_M": 8,
        "num_stages": 7,
        "num_warps": 8,
        "compile_time": 1.0179054737091064
    },
    {
        "BLOCK_SIZE_M": 64,
        "BLOCK_SIZE_N": 128,
        "BLOCK_SIZE_K": 128,
        "GROUP_SIZE_M": 8,
        "num_stages": 7,
        "num_warps": 16,
        "compile_time": 0.71042799949646
    },
    {
        "BLOCK_SIZE_M": 64,
        "BLOCK_SIZE_N": 128,
        "BLOCK_SIZE_K": 128,
        "GROUP_SIZE_M": 8,
        "num_stages": 7,
        "num_warps": 32,
        "compile_time": 0.5442154407501221
    },
    {
        "BLOCK_SIZE_M": 64,
        "BLOCK_SIZE_N": 128,
        "BLOCK_SIZE_K": 128,
        "GROUP_SIZE_M": 8,
        "num_stages": 8,
        "num_warps": 2,
        "compile_time": 3.7643802165985107
    },
    {
        "BLOCK_SIZE_M": 64,
        "BLOCK_SIZE_N": 128,
        "BLOCK_SIZE_K": 128,
        "GROUP_SIZE_M": 8,
        "num_stages": 8,
        "num_warps": 4,
        "compile_time": 1.7081069946289062
    },
    {
        "BLOCK_SIZE_M": 64,
        "BLOCK_SIZE_N": 128,
        "BLOCK_SIZE_K": 128,
        "GROUP_SIZE_M": 8,
        "num_stages": 8,
        "num_warps": 8,
        "compile_time": 1.0359394550323486
    },
    {
        "BLOCK_SIZE_M": 64,
        "BLOCK_SIZE_N": 128,
        "BLOCK_SIZE_K": 128,
        "GROUP_SIZE_M": 8,
        "num_stages": 8,
        "num_warps": 16,
        "compile_time": 0.7425379753112793
    },
    {
        "BLOCK_SIZE_M": 64,
        "BLOCK_SIZE_N": 128,
        "BLOCK_SIZE_K": 128,
        "GROUP_SIZE_M": 8,
        "num_stages": 8,
        "num_warps": 32,
        "compile_time": 0.562006950378418
    },
    {
        "BLOCK_SIZE_M": 64,
        "BLOCK_SIZE_N": 128,
        "BLOCK_SIZE_K": 256,
        "GROUP_SIZE_M": 8,
        "num_stages": 3,
        "num_warps": 2,
        "compile_time": 12.896727800369263
    },
    {
        "BLOCK_SIZE_M": 64,
        "BLOCK_SIZE_N": 128,
        "BLOCK_SIZE_K": 256,
        "GROUP_SIZE_M": 8,
        "num_stages": 3,
        "num_warps": 4,
        "compile_time": 2.696953058242798
    },
    {
        "BLOCK_SIZE_M": 64,
        "BLOCK_SIZE_N": 128,
        "BLOCK_SIZE_K": 256,
        "GROUP_SIZE_M": 8,
        "num_stages": 3,
        "num_warps": 8,
        "compile_time": 1.2203357219696045
    },
    {
        "BLOCK_SIZE_M": 64,
        "BLOCK_SIZE_N": 128,
        "BLOCK_SIZE_K": 256,
        "GROUP_SIZE_M": 8,
        "num_stages": 3,
        "num_warps": 16,
        "compile_time": 0.8325052261352539
    },
    {
        "BLOCK_SIZE_M": 64,
        "BLOCK_SIZE_N": 128,
        "BLOCK_SIZE_K": 256,
        "GROUP_SIZE_M": 8,
        "num_stages": 3,
        "num_warps": 32,
        "compile_time": 0.6273643970489502
    },
    {
        "BLOCK_SIZE_M": 64,
        "BLOCK_SIZE_N": 128,
        "BLOCK_SIZE_K": 256,
        "GROUP_SIZE_M": 8,
        "num_stages": 4,
        "num_warps": 2,
        "compile_time": 13.423457860946655
    },
    {
        "BLOCK_SIZE_M": 64,
        "BLOCK_SIZE_N": 128,
        "BLOCK_SIZE_K": 256,
        "GROUP_SIZE_M": 8,
        "num_stages": 4,
        "num_warps": 4,
        "compile_time": 2.9479591846466064
    },
    {
        "BLOCK_SIZE_M": 64,
        "BLOCK_SIZE_N": 128,
        "BLOCK_SIZE_K": 256,
        "GROUP_SIZE_M": 8,
        "num_stages": 4,
        "num_warps": 8,
        "compile_time": 1.3358769416809082
    },
    {
        "BLOCK_SIZE_M": 64,
        "BLOCK_SIZE_N": 128,
        "BLOCK_SIZE_K": 256,
        "GROUP_SIZE_M": 8,
        "num_stages": 4,
        "num_warps": 16,
        "compile_time": 0.8775224685668945
    },
    {
        "BLOCK_SIZE_M": 64,
        "BLOCK_SIZE_N": 128,
        "BLOCK_SIZE_K": 256,
        "GROUP_SIZE_M": 8,
        "num_stages": 4,
        "num_warps": 32,
        "compile_time": 0.6543862819671631
    },
    {
        "BLOCK_SIZE_M": 64,
        "BLOCK_SIZE_N": 128,
        "BLOCK_SIZE_K": 256,
        "GROUP_SIZE_M": 8,
        "num_stages": 5,
        "num_warps": 2,
        "compile_time": 13.42886757850647
    },
    {
        "BLOCK_SIZE_M": 64,
        "BLOCK_SIZE_N": 128,
        "BLOCK_SIZE_K": 256,
        "GROUP_SIZE_M": 8,
        "num_stages": 5,
        "num_warps": 4,
        "compile_time": 3.1187174320220947
    },
    {
        "BLOCK_SIZE_M": 64,
        "BLOCK_SIZE_N": 128,
        "BLOCK_SIZE_K": 256,
        "GROUP_SIZE_M": 8,
        "num_stages": 5,
        "num_warps": 8,
        "compile_time": 1.436918020248413
    },
    {
        "BLOCK_SIZE_M": 64,
        "BLOCK_SIZE_N": 128,
        "BLOCK_SIZE_K": 256,
        "GROUP_SIZE_M": 8,
        "num_stages": 5,
        "num_warps": 16,
        "compile_time": 0.9355342388153076
    },
    {
        "BLOCK_SIZE_M": 64,
        "BLOCK_SIZE_N": 128,
        "BLOCK_SIZE_K": 256,
        "GROUP_SIZE_M": 8,
        "num_stages": 5,
        "num_warps": 32,
        "compile_time": 0.7016506195068359
    },
    {
        "BLOCK_SIZE_M": 64,
        "BLOCK_SIZE_N": 128,
        "BLOCK_SIZE_K": 256,
        "GROUP_SIZE_M": 8,
        "num_stages": 6,
        "num_warps": 2,
        "compile_time": 13.671587228775024
    },
    {
        "BLOCK_SIZE_M": 64,
        "BLOCK_SIZE_N": 128,
        "BLOCK_SIZE_K": 256,
        "GROUP_SIZE_M": 8,
        "num_stages": 6,
        "num_warps": 4,
        "compile_time": 3.357351303100586
    },
    {
        "BLOCK_SIZE_M": 64,
        "BLOCK_SIZE_N": 128,
        "BLOCK_SIZE_K": 256,
        "GROUP_SIZE_M": 8,
        "num_stages": 6,
        "num_warps": 8,
        "compile_time": 1.5682449340820312
    },
    {
        "BLOCK_SIZE_M": 64,
        "BLOCK_SIZE_N": 128,
        "BLOCK_SIZE_K": 256,
        "GROUP_SIZE_M": 8,
        "num_stages": 6,
        "num_warps": 16,
        "compile_time": 1.0034854412078857
    },
    {
        "BLOCK_SIZE_M": 64,
        "BLOCK_SIZE_N": 128,
        "BLOCK_SIZE_K": 256,
        "GROUP_SIZE_M": 8,
        "num_stages": 6,
        "num_warps": 32,
        "compile_time": 0.7775979042053223
    },
    {
        "BLOCK_SIZE_M": 64,
        "BLOCK_SIZE_N": 128,
        "BLOCK_SIZE_K": 256,
        "GROUP_SIZE_M": 8,
        "num_stages": 7,
        "num_warps": 2,
        "compile_time": 13.984862804412842
    },
    {
        "BLOCK_SIZE_M": 64,
        "BLOCK_SIZE_N": 128,
        "BLOCK_SIZE_K": 256,
        "GROUP_SIZE_M": 8,
        "num_stages": 7,
        "num_warps": 4,
        "compile_time": 3.593651056289673
    },
    {
        "BLOCK_SIZE_M": 64,
        "BLOCK_SIZE_N": 128,
        "BLOCK_SIZE_K": 256,
        "GROUP_SIZE_M": 8,
        "num_stages": 7,
        "num_warps": 8,
        "compile_time": 1.7384281158447266
    },
    {
        "BLOCK_SIZE_M": 64,
        "BLOCK_SIZE_N": 128,
        "BLOCK_SIZE_K": 256,
        "GROUP_SIZE_M": 8,
        "num_stages": 7,
        "num_warps": 16,
        "compile_time": 1.0858111381530762
    },
    {
        "BLOCK_SIZE_M": 64,
        "BLOCK_SIZE_N": 128,
        "BLOCK_SIZE_K": 256,
        "GROUP_SIZE_M": 8,
        "num_stages": 7,
        "num_warps": 32,
        "compile_time": 0.7850518226623535
    },
    {
        "BLOCK_SIZE_M": 64,
        "BLOCK_SIZE_N": 128,
        "BLOCK_SIZE_K": 256,
        "GROUP_SIZE_M": 8,
        "num_stages": 8,
        "num_warps": 2,
        "compile_time": 14.04119873046875
    },
    {
        "BLOCK_SIZE_M": 64,
        "BLOCK_SIZE_N": 128,
        "BLOCK_SIZE_K": 256,
        "GROUP_SIZE_M": 8,
        "num_stages": 8,
        "num_warps": 4,
        "compile_time": 3.683183193206787
    },
    {
        "BLOCK_SIZE_M": 64,
        "BLOCK_SIZE_N": 128,
        "BLOCK_SIZE_K": 256,
        "GROUP_SIZE_M": 8,
        "num_stages": 8,
        "num_warps": 8,
        "compile_time": 1.791574478149414
    },
    {
        "BLOCK_SIZE_M": 64,
        "BLOCK_SIZE_N": 128,
        "BLOCK_SIZE_K": 256,
        "GROUP_SIZE_M": 8,
        "num_stages": 8,
        "num_warps": 16,
        "compile_time": 1.1306688785552979
    },
    {
        "BLOCK_SIZE_M": 64,
        "BLOCK_SIZE_N": 128,
        "BLOCK_SIZE_K": 256,
        "GROUP_SIZE_M": 8,
        "num_stages": 8,
        "num_warps": 32,
        "compile_time": 0.7987916469573975
    },
    {
        "BLOCK_SIZE_M": 64,
        "BLOCK_SIZE_N": 128,
        "BLOCK_SIZE_K": 512,
        "GROUP_SIZE_M": 8,
        "num_stages": 1,
        "num_warps": 2,
        "compile_time": 7.04227876663208
    },
    {
        "BLOCK_SIZE_M": 64,
        "BLOCK_SIZE_N": 128,
        "BLOCK_SIZE_K": 512,
        "GROUP_SIZE_M": 8,
        "num_stages": 1,
        "num_warps": 4,
        "compile_time": 4.3643598556518555
    },
    {
        "BLOCK_SIZE_M": 64,
        "BLOCK_SIZE_N": 128,
        "BLOCK_SIZE_K": 512,
        "GROUP_SIZE_M": 8,
        "num_stages": 1,
        "num_warps": 8,
        "compile_time": 1.80344820022583
    },
    {
        "BLOCK_SIZE_M": 64,
        "BLOCK_SIZE_N": 128,
        "BLOCK_SIZE_K": 512,
        "GROUP_SIZE_M": 8,
        "num_stages": 1,
        "num_warps": 16,
        "compile_time": 1.0745556354522705
    },
    {
        "BLOCK_SIZE_M": 64,
        "BLOCK_SIZE_N": 128,
        "BLOCK_SIZE_K": 512,
        "GROUP_SIZE_M": 8,
        "num_stages": 1,
        "num_warps": 32,
        "compile_time": 0.8234822750091553
    },
    {
        "BLOCK_SIZE_M": 64,
        "BLOCK_SIZE_N": 128,
        "BLOCK_SIZE_K": 512,
        "GROUP_SIZE_M": 8,
        "num_stages": 2,
        "num_warps": 2,
        "compile_time": 7.295719861984253
    },
    {
        "BLOCK_SIZE_M": 64,
        "BLOCK_SIZE_N": 128,
        "BLOCK_SIZE_K": 512,
        "GROUP_SIZE_M": 8,
        "num_stages": 2,
        "num_warps": 4,
        "compile_time": 4.838034391403198
    },
    {
        "BLOCK_SIZE_M": 64,
        "BLOCK_SIZE_N": 128,
        "BLOCK_SIZE_K": 512,
        "GROUP_SIZE_M": 8,
        "num_stages": 2,
        "num_warps": 8,
        "compile_time": 2.0505337715148926
    },
    {
        "BLOCK_SIZE_M": 64,
        "BLOCK_SIZE_N": 128,
        "BLOCK_SIZE_K": 512,
        "GROUP_SIZE_M": 8,
        "num_stages": 2,
        "num_warps": 16,
        "compile_time": 1.205791711807251
    },
    {
        "BLOCK_SIZE_M": 64,
        "BLOCK_SIZE_N": 128,
        "BLOCK_SIZE_K": 512,
        "GROUP_SIZE_M": 8,
        "num_stages": 2,
        "num_warps": 32,
        "compile_time": 0.8103861808776855
    },
    {
        "BLOCK_SIZE_M": 64,
        "BLOCK_SIZE_N": 128,
        "BLOCK_SIZE_K": 512,
        "GROUP_SIZE_M": 8,
        "num_stages": 3,
        "num_warps": 2,
        "compile_time": 7.983179092407227
    },
    {
        "BLOCK_SIZE_M": 64,
        "BLOCK_SIZE_N": 128,
        "BLOCK_SIZE_K": 512,
        "GROUP_SIZE_M": 8,
        "num_stages": 3,
        "num_warps": 4,
        "compile_time": 13.191602945327759
    },
    {
        "BLOCK_SIZE_M": 64,
        "BLOCK_SIZE_N": 128,
        "BLOCK_SIZE_K": 512,
        "GROUP_SIZE_M": 8,
        "num_stages": 3,
        "num_warps": 8,
        "compile_time": 2.8578426837921143
    },
    {
        "BLOCK_SIZE_M": 64,
        "BLOCK_SIZE_N": 128,
        "BLOCK_SIZE_K": 512,
        "GROUP_SIZE_M": 8,
        "num_stages": 3,
        "num_warps": 16,
        "compile_time": 1.3806452751159668
    },
    {
        "BLOCK_SIZE_M": 64,
        "BLOCK_SIZE_N": 128,
        "BLOCK_SIZE_K": 512,
        "GROUP_SIZE_M": 8,
        "num_stages": 3,
        "num_warps": 32,
        "compile_time": 0.9042408466339111
    },
    {
        "BLOCK_SIZE_M": 64,
        "BLOCK_SIZE_N": 128,
        "BLOCK_SIZE_K": 512,
        "GROUP_SIZE_M": 8,
        "num_stages": 4,
        "num_warps": 2,
        "compile_time": 8.391226291656494
    },
    {
        "BLOCK_SIZE_M": 64,
        "BLOCK_SIZE_N": 128,
        "BLOCK_SIZE_K": 512,
        "GROUP_SIZE_M": 8,
        "num_stages": 4,
        "num_warps": 4,
        "compile_time": 13.319758176803589
    },
    {
        "BLOCK_SIZE_M": 64,
        "BLOCK_SIZE_N": 128,
        "BLOCK_SIZE_K": 512,
        "GROUP_SIZE_M": 8,
        "num_stages": 4,
        "num_warps": 8,
        "compile_time": 3.078596830368042
    },
    {
        "BLOCK_SIZE_M": 64,
        "BLOCK_SIZE_N": 128,
        "BLOCK_SIZE_K": 512,
        "GROUP_SIZE_M": 8,
        "num_stages": 4,
        "num_warps": 16,
        "compile_time": 1.4978809356689453
    },
    {
        "BLOCK_SIZE_M": 64,
        "BLOCK_SIZE_N": 128,
        "BLOCK_SIZE_K": 512,
        "GROUP_SIZE_M": 8,
        "num_stages": 4,
        "num_warps": 32,
        "compile_time": 0.9664883613586426
    },
    {
        "BLOCK_SIZE_M": 64,
        "BLOCK_SIZE_N": 128,
        "BLOCK_SIZE_K": 512,
        "GROUP_SIZE_M": 8,
        "num_stages": 5,
        "num_warps": 2,
        "compile_time": 8.744359970092773
    },
    {
        "BLOCK_SIZE_M": 64,
        "BLOCK_SIZE_N": 128,
        "BLOCK_SIZE_K": 512,
        "GROUP_SIZE_M": 8,
        "num_stages": 5,
        "num_warps": 4,
        "compile_time": 13.360899925231934
    },
    {
        "BLOCK_SIZE_M": 64,
        "BLOCK_SIZE_N": 128,
        "BLOCK_SIZE_K": 512,
        "GROUP_SIZE_M": 8,
        "num_stages": 5,
        "num_warps": 8,
        "compile_time": 3.2080817222595215
    },
    {
        "BLOCK_SIZE_M": 64,
        "BLOCK_SIZE_N": 128,
        "BLOCK_SIZE_K": 512,
        "GROUP_SIZE_M": 8,
        "num_stages": 5,
        "num_warps": 16,
        "compile_time": 1.5973594188690186
    },
    {
        "BLOCK_SIZE_M": 64,
        "BLOCK_SIZE_N": 128,
        "BLOCK_SIZE_K": 512,
        "GROUP_SIZE_M": 8,
        "num_stages": 5,
        "num_warps": 32,
        "compile_time": 1.0329070091247559
    },
    {
        "BLOCK_SIZE_M": 64,
        "BLOCK_SIZE_N": 128,
        "BLOCK_SIZE_K": 512,
        "GROUP_SIZE_M": 8,
        "num_stages": 6,
        "num_warps": 2,
        "compile_time": 9.201725721359253
    },
    {
        "BLOCK_SIZE_M": 64,
        "BLOCK_SIZE_N": 128,
        "BLOCK_SIZE_K": 512,
        "GROUP_SIZE_M": 8,
        "num_stages": 6,
        "num_warps": 4,
        "compile_time": 13.687949419021606
    },
    {
        "BLOCK_SIZE_M": 64,
        "BLOCK_SIZE_N": 128,
        "BLOCK_SIZE_K": 512,
        "GROUP_SIZE_M": 8,
        "num_stages": 6,
        "num_warps": 8,
        "compile_time": 3.3989627361297607
    },
    {
        "BLOCK_SIZE_M": 64,
        "BLOCK_SIZE_N": 128,
        "BLOCK_SIZE_K": 512,
        "GROUP_SIZE_M": 8,
        "num_stages": 6,
        "num_warps": 16,
        "compile_time": 1.7716119289398193
    },
    {
        "BLOCK_SIZE_M": 64,
        "BLOCK_SIZE_N": 128,
        "BLOCK_SIZE_K": 512,
        "GROUP_SIZE_M": 8,
        "num_stages": 6,
        "num_warps": 32,
        "compile_time": 1.0871155261993408
    },
    {
        "BLOCK_SIZE_M": 64,
        "BLOCK_SIZE_N": 128,
        "BLOCK_SIZE_K": 512,
        "GROUP_SIZE_M": 8,
        "num_stages": 7,
        "num_warps": 2,
        "compile_time": 9.754372596740723
    },
    {
        "BLOCK_SIZE_M": 64,
        "BLOCK_SIZE_N": 128,
        "BLOCK_SIZE_K": 512,
        "GROUP_SIZE_M": 8,
        "num_stages": 7,
        "num_warps": 4,
        "compile_time": 14.165541887283325
    },
    {
        "BLOCK_SIZE_M": 64,
        "BLOCK_SIZE_N": 128,
        "BLOCK_SIZE_K": 512,
        "GROUP_SIZE_M": 8,
        "num_stages": 7,
        "num_warps": 8,
        "compile_time": 3.6314854621887207
    },
    {
        "BLOCK_SIZE_M": 64,
        "BLOCK_SIZE_N": 128,
        "BLOCK_SIZE_K": 512,
        "GROUP_SIZE_M": 8,
        "num_stages": 7,
        "num_warps": 16,
        "compile_time": 1.875755786895752
    },
    {
        "BLOCK_SIZE_M": 64,
        "BLOCK_SIZE_N": 128,
        "BLOCK_SIZE_K": 512,
        "GROUP_SIZE_M": 8,
        "num_stages": 7,
        "num_warps": 32,
        "compile_time": 1.1499295234680176
    },
    {
        "BLOCK_SIZE_M": 64,
        "BLOCK_SIZE_N": 128,
        "BLOCK_SIZE_K": 512,
        "GROUP_SIZE_M": 8,
        "num_stages": 8,
        "num_warps": 2,
        "compile_time": 10.297503232955933
    },
    {
        "BLOCK_SIZE_M": 64,
        "BLOCK_SIZE_N": 128,
        "BLOCK_SIZE_K": 512,
        "GROUP_SIZE_M": 8,
        "num_stages": 8,
        "num_warps": 4,
        "compile_time": 14.051877975463867
    },
    {
        "BLOCK_SIZE_M": 64,
        "BLOCK_SIZE_N": 128,
        "BLOCK_SIZE_K": 512,
        "GROUP_SIZE_M": 8,
        "num_stages": 8,
        "num_warps": 8,
        "compile_time": 3.821098804473877
    },
    {
        "BLOCK_SIZE_M": 64,
        "BLOCK_SIZE_N": 128,
        "BLOCK_SIZE_K": 512,
        "GROUP_SIZE_M": 8,
        "num_stages": 8,
        "num_warps": 16,
        "compile_time": 1.9860527515411377
    },
    {
        "BLOCK_SIZE_M": 64,
        "BLOCK_SIZE_N": 128,
        "BLOCK_SIZE_K": 512,
        "GROUP_SIZE_M": 8,
        "num_stages": 8,
        "num_warps": 32,
        "compile_time": 1.231839895248413
    },
    {
        "BLOCK_SIZE_M": 64,
        "BLOCK_SIZE_N": 256,
        "BLOCK_SIZE_K": 64,
        "GROUP_SIZE_M": 8,
        "num_stages": 1,
        "num_warps": 2,
        "compile_time": 6.279592514038086
    },
    {
        "BLOCK_SIZE_M": 64,
        "BLOCK_SIZE_N": 256,
        "BLOCK_SIZE_K": 64,
        "GROUP_SIZE_M": 8,
        "num_stages": 6,
        "num_warps": 2,
        "compile_time": 4.501208782196045
    },
    {
        "BLOCK_SIZE_M": 64,
        "BLOCK_SIZE_N": 256,
        "BLOCK_SIZE_K": 64,
        "GROUP_SIZE_M": 8,
        "num_stages": 6,
        "num_warps": 4,
        "compile_time": 1.6888103485107422
    },
    {
        "BLOCK_SIZE_M": 64,
        "BLOCK_SIZE_N": 256,
        "BLOCK_SIZE_K": 64,
        "GROUP_SIZE_M": 8,
        "num_stages": 6,
        "num_warps": 8,
        "compile_time": 0.971184253692627
    },
    {
        "BLOCK_SIZE_M": 64,
        "BLOCK_SIZE_N": 256,
        "BLOCK_SIZE_K": 64,
        "GROUP_SIZE_M": 8,
        "num_stages": 6,
        "num_warps": 16,
        "compile_time": 0.665071964263916
    },
    {
        "BLOCK_SIZE_M": 64,
        "BLOCK_SIZE_N": 256,
        "BLOCK_SIZE_K": 64,
        "GROUP_SIZE_M": 8,
        "num_stages": 6,
        "num_warps": 32,
        "compile_time": 0.5291070938110352
    },
    {
        "BLOCK_SIZE_M": 64,
        "BLOCK_SIZE_N": 256,
        "BLOCK_SIZE_K": 64,
        "GROUP_SIZE_M": 8,
        "num_stages": 7,
        "num_warps": 2,
        "compile_time": 4.665812730789185
    },
    {
        "BLOCK_SIZE_M": 64,
        "BLOCK_SIZE_N": 256,
        "BLOCK_SIZE_K": 64,
        "GROUP_SIZE_M": 8,
        "num_stages": 7,
        "num_warps": 4,
        "compile_time": 1.7704894542694092
    },
    {
        "BLOCK_SIZE_M": 64,
        "BLOCK_SIZE_N": 256,
        "BLOCK_SIZE_K": 64,
        "GROUP_SIZE_M": 8,
        "num_stages": 7,
        "num_warps": 8,
        "compile_time": 1.0436358451843262
    },
    {
        "BLOCK_SIZE_M": 64,
        "BLOCK_SIZE_N": 256,
        "BLOCK_SIZE_K": 64,
        "GROUP_SIZE_M": 8,
        "num_stages": 7,
        "num_warps": 16,
        "compile_time": 0.6939117908477783
    },
    {
        "BLOCK_SIZE_M": 64,
        "BLOCK_SIZE_N": 256,
        "BLOCK_SIZE_K": 64,
        "GROUP_SIZE_M": 8,
        "num_stages": 7,
        "num_warps": 32,
        "compile_time": 0.5292887687683105
    },
    {
        "BLOCK_SIZE_M": 64,
        "BLOCK_SIZE_N": 256,
        "BLOCK_SIZE_K": 64,
        "GROUP_SIZE_M": 8,
        "num_stages": 8,
        "num_warps": 2,
        "compile_time": 4.915355920791626
    },
    {
        "BLOCK_SIZE_M": 64,
        "BLOCK_SIZE_N": 256,
        "BLOCK_SIZE_K": 64,
        "GROUP_SIZE_M": 8,
        "num_stages": 8,
        "num_warps": 4,
        "compile_time": 1.857856035232544
    },
    {
        "BLOCK_SIZE_M": 64,
        "BLOCK_SIZE_N": 256,
        "BLOCK_SIZE_K": 64,
        "GROUP_SIZE_M": 8,
        "num_stages": 8,
        "num_warps": 8,
        "compile_time": 1.095513105392456
    },
    {
        "BLOCK_SIZE_M": 64,
        "BLOCK_SIZE_N": 256,
        "BLOCK_SIZE_K": 64,
        "GROUP_SIZE_M": 8,
        "num_stages": 8,
        "num_warps": 16,
        "compile_time": 0.7207834720611572
    },
    {
        "BLOCK_SIZE_M": 64,
        "BLOCK_SIZE_N": 256,
        "BLOCK_SIZE_K": 64,
        "GROUP_SIZE_M": 8,
        "num_stages": 8,
        "num_warps": 32,
        "compile_time": 0.5689387321472168
    },
    {
        "BLOCK_SIZE_M": 64,
        "BLOCK_SIZE_N": 256,
        "BLOCK_SIZE_K": 128,
        "GROUP_SIZE_M": 8,
        "num_stages": 1,
        "num_warps": 2,
        "compile_time": 6.101092100143433
    },
    {
        "BLOCK_SIZE_M": 64,
        "BLOCK_SIZE_N": 256,
        "BLOCK_SIZE_K": 128,
        "GROUP_SIZE_M": 8,
        "num_stages": 2,
        "num_warps": 2,
        "compile_time": 6.122280597686768
    },
    {
        "BLOCK_SIZE_M": 64,
        "BLOCK_SIZE_N": 256,
        "BLOCK_SIZE_K": 128,
        "GROUP_SIZE_M": 8,
        "num_stages": 3,
        "num_warps": 2,
        "compile_time": 12.708373785018921
    },
    {
        "BLOCK_SIZE_M": 64,
        "BLOCK_SIZE_N": 256,
        "BLOCK_SIZE_K": 128,
        "GROUP_SIZE_M": 8,
        "num_stages": 4,
        "num_warps": 2,
        "compile_time": 13.136712312698364
    },
    {
        "BLOCK_SIZE_M": 64,
        "BLOCK_SIZE_N": 256,
        "BLOCK_SIZE_K": 128,
        "GROUP_SIZE_M": 8,
        "num_stages": 4,
        "num_warps": 4,
        "compile_time": 2.9369852542877197
    },
    {
        "BLOCK_SIZE_M": 64,
        "BLOCK_SIZE_N": 256,
        "BLOCK_SIZE_K": 128,
        "GROUP_SIZE_M": 8,
        "num_stages": 4,
        "num_warps": 8,
        "compile_time": 1.2977428436279297
    },
    {
        "BLOCK_SIZE_M": 64,
        "BLOCK_SIZE_N": 256,
        "BLOCK_SIZE_K": 128,
        "GROUP_SIZE_M": 8,
        "num_stages": 4,
        "num_warps": 16,
        "compile_time": 0.8773820400238037
    },
    {
        "BLOCK_SIZE_M": 64,
        "BLOCK_SIZE_N": 256,
        "BLOCK_SIZE_K": 128,
        "GROUP_SIZE_M": 8,
        "num_stages": 4,
        "num_warps": 32,
        "compile_time": 0.6931917667388916
    },
    {
        "BLOCK_SIZE_M": 64,
        "BLOCK_SIZE_N": 256,
        "BLOCK_SIZE_K": 128,
        "GROUP_SIZE_M": 8,
        "num_stages": 5,
        "num_warps": 2,
        "compile_time": 13.37944769859314
    },
    {
        "BLOCK_SIZE_M": 64,
        "BLOCK_SIZE_N": 256,
        "BLOCK_SIZE_K": 128,
        "GROUP_SIZE_M": 8,
        "num_stages": 5,
        "num_warps": 4,
        "compile_time": 3.126206874847412
    },
    {
        "BLOCK_SIZE_M": 64,
        "BLOCK_SIZE_N": 256,
        "BLOCK_SIZE_K": 128,
        "GROUP_SIZE_M": 8,
        "num_stages": 5,
        "num_warps": 8,
        "compile_time": 1.433011770248413
    },
    {
        "BLOCK_SIZE_M": 64,
        "BLOCK_SIZE_N": 256,
        "BLOCK_SIZE_K": 128,
        "GROUP_SIZE_M": 8,
        "num_stages": 5,
        "num_warps": 16,
        "compile_time": 0.9415016174316406
    },
    {
        "BLOCK_SIZE_M": 64,
        "BLOCK_SIZE_N": 256,
        "BLOCK_SIZE_K": 128,
        "GROUP_SIZE_M": 8,
        "num_stages": 5,
        "num_warps": 32,
        "compile_time": 0.6921780109405518
    },
    {
        "BLOCK_SIZE_M": 64,
        "BLOCK_SIZE_N": 256,
        "BLOCK_SIZE_K": 128,
        "GROUP_SIZE_M": 8,
        "num_stages": 6,
        "num_warps": 2,
        "compile_time": 13.182547330856323
    },
    {
        "BLOCK_SIZE_M": 64,
        "BLOCK_SIZE_N": 256,
        "BLOCK_SIZE_K": 128,
        "GROUP_SIZE_M": 8,
        "num_stages": 6,
        "num_warps": 4,
        "compile_time": 3.184194803237915
    },
    {
        "BLOCK_SIZE_M": 64,
        "BLOCK_SIZE_N": 256,
        "BLOCK_SIZE_K": 128,
        "GROUP_SIZE_M": 8,
        "num_stages": 6,
        "num_warps": 8,
        "compile_time": 1.498948335647583
    },
    {
        "BLOCK_SIZE_M": 64,
        "BLOCK_SIZE_N": 256,
        "BLOCK_SIZE_K": 128,
        "GROUP_SIZE_M": 8,
        "num_stages": 6,
        "num_warps": 16,
        "compile_time": 0.977048397064209
    },
    {
        "BLOCK_SIZE_M": 64,
        "BLOCK_SIZE_N": 256,
        "BLOCK_SIZE_K": 128,
        "GROUP_SIZE_M": 8,
        "num_stages": 6,
        "num_warps": 32,
        "compile_time": 0.7113311290740967
    },
    {
        "BLOCK_SIZE_M": 64,
        "BLOCK_SIZE_N": 256,
        "BLOCK_SIZE_K": 128,
        "GROUP_SIZE_M": 8,
        "num_stages": 7,
        "num_warps": 2,
        "compile_time": 13.500125885009766
    },
    {
        "BLOCK_SIZE_M": 64,
        "BLOCK_SIZE_N": 256,
        "BLOCK_SIZE_K": 128,
        "GROUP_SIZE_M": 8,
        "num_stages": 7,
        "num_warps": 4,
        "compile_time": 3.3905162811279297
    },
    {
        "BLOCK_SIZE_M": 64,
        "BLOCK_SIZE_N": 256,
        "BLOCK_SIZE_K": 128,
        "GROUP_SIZE_M": 8,
        "num_stages": 7,
        "num_warps": 8,
        "compile_time": 1.5892863273620605
    },
    {
        "BLOCK_SIZE_M": 64,
        "BLOCK_SIZE_N": 256,
        "BLOCK_SIZE_K": 128,
        "GROUP_SIZE_M": 8,
        "num_stages": 7,
        "num_warps": 16,
        "compile_time": 1.0115406513214111
    },
    {
        "BLOCK_SIZE_M": 64,
        "BLOCK_SIZE_N": 256,
        "BLOCK_SIZE_K": 128,
        "GROUP_SIZE_M": 8,
        "num_stages": 7,
        "num_warps": 32,
        "compile_time": 0.717803955078125
    },
    {
        "BLOCK_SIZE_M": 64,
        "BLOCK_SIZE_N": 256,
        "BLOCK_SIZE_K": 128,
        "GROUP_SIZE_M": 8,
        "num_stages": 8,
        "num_warps": 2,
        "compile_time": 13.337894439697266
    },
    {
        "BLOCK_SIZE_M": 64,
        "BLOCK_SIZE_N": 256,
        "BLOCK_SIZE_K": 128,
        "GROUP_SIZE_M": 8,
        "num_stages": 8,
        "num_warps": 4,
        "compile_time": 3.457899570465088
    },
    {
        "BLOCK_SIZE_M": 64,
        "BLOCK_SIZE_N": 256,
        "BLOCK_SIZE_K": 128,
        "GROUP_SIZE_M": 8,
        "num_stages": 8,
        "num_warps": 8,
        "compile_time": 1.7101397514343262
    },
    {
        "BLOCK_SIZE_M": 64,
