simdata/FP16-R100/8192_results.json
[
    {
        "BLOCK_SIZE_M": 256,
        "BLOCK_SIZE_N": 128,
        "BLOCK_SIZE_K": 32,
        "GROUP_SIZE_M": 8,
        "num_stages": 7,
        "num_warps": 8,
        "ms": 4.24744176864624,
        "min_ms": 4.24744176864624,
        "max_ms": 4.24744176864624,
        "compile_time": 2.8181846141815186
    },
    {
        "BLOCK_SIZE_M": 128,
        "BLOCK_SIZE_N": 256,
        "BLOCK_SIZE_K": 32,
        "GROUP_SIZE_M": 8,
        "num_stages": 4,
        "num_warps": 8,
        "ms": 4.268276214599609,
        "min_ms": 4.268276214599609,
        "max_ms": 4.268276214599609,
        "compile_time": 2.619112014770508
    },
    {
        "BLOCK_SIZE_M": 128,
        "BLOCK_SIZE_N": 256,
        "BLOCK_SIZE_K": 32,
        "GROUP_SIZE_M": 8,
        "num_stages": 6,
        "num_warps": 8,
        "ms": 4.27646017074585,
        "min_ms": 4.27646017074585,
        "max_ms": 4.27646017074585,
        "compile_time": 2.6549553871154785
    },
    {
        "BLOCK_SIZE_M": 256,
        "BLOCK_SIZE_N": 128,
        "BLOCK_SIZE_K": 32,
        "GROUP_SIZE_M": 8,
        "num_stages": 4,
        "num_warps": 8,
        "ms": 4.276846408843994,
        "min_ms": 4.276846408843994,
        "max_ms": 4.276846408843994,
        "compile_time": 2.7088475227355957
    },
    {
        "BLOCK_SIZE_M": 128,
        "BLOCK_SIZE_N": 256,
        "BLOCK_SIZE_K": 32,
        "GROUP_SIZE_M": 8,
        "num_stages": 7,
        "num_warps": 8,
        "ms": 4.29415225982666,
        "min_ms": 4.29415225982666,
        "max_ms": 4.29415225982666,
        "compile_time": 2.6756033897399902
    },
    {
        "BLOCK_SIZE_M": 256,
        "BLOCK_SIZE_N": 128,
        "BLOCK_SIZE_K": 32,
        "GROUP_SIZE_M": 8,
        "num_stages": 6,
        "num_warps": 8,
        "ms": 4.295199394226074,
        "min_ms": 4.295199394226074,
        "max_ms": 4.295199394226074,
        "compile_time": 2.76259708404541
    },
    {
        "BLOCK_SIZE_M": 128,
        "BLOCK_SIZE_N": 256,
        "BLOCK_SIZE_K": 32,
        "GROUP_SIZE_M": 8,
        "num_stages": 5,
        "num_warps": 8,
        "ms": 4.312694072723389,
        "min_ms": 4.312694072723389,
        "max_ms": 4.312694072723389,
        "compile_time": 2.6061196327209473
    },
    {
        "BLOCK_SIZE_M": 128,
        "BLOCK_SIZE_N": 256,
        "BLOCK_SIZE_K": 32,
        "GROUP_SIZE_M": 8,
        "num_stages": 3,
        "num_warps": 8,
        "ms": 4.312938213348389,
        "min_ms": 4.312938213348389,
        "max_ms": 4.312938213348389,
        "compile_time": 2.609130620956421
    },
    {
        "BLOCK_SIZE_M": 256,
        "BLOCK_SIZE_N": 128,
        "BLOCK_SIZE_K": 32,
        "GROUP_SIZE_M": 8,
        "num_stages": 3,
        "num_warps": 8,
        "ms": 4.319066524505615,
        "min_ms": 4.319066524505615,
        "max_ms": 4.319066524505615,
        "compile_time": 2.7229583263397217
    },
    {
        "BLOCK_SIZE_M": 256,
        "BLOCK_SIZE_N": 128,
        "BLOCK_SIZE_K": 32,
        "GROUP_SIZE_M": 8,
        "num_stages": 5,
        "num_warps": 8,
        "ms": 4.330023288726807,
        "min_ms": 4.330023288726807,
        "max_ms": 4.330023288726807,
        "compile_time": 2.7400882244110107
    },
    {
        "BLOCK_SIZE_M": 256,
        "BLOCK_SIZE_N": 128,
        "BLOCK_SIZE_K": 64,
        "GROUP_SIZE_M": 8,
        "num_stages": 3,
        "num_warps": 8,
        "ms": 4.419925212860107,
        "min_ms": 4.419925212860107,
        "max_ms": 4.419925212860107,
        "compile_time": 2.807983160018921
    },
    {
        "BLOCK_SIZE_M": 256,
        "BLOCK_SIZE_N": 128,
        "BLOCK_SIZE_K": 64,
        "GROUP_SIZE_M": 8,
        "num_stages": 4,
        "num_warps": 8,
        "ms": 4.422339916229248,
        "min_ms": 4.422339916229248,
        "max_ms": 4.422339916229248,
        "compile_time": 2.8673813343048096
    },
    {
        "BLOCK_SIZE_M": 128,
        "BLOCK_SIZE_N": 128,
        "BLOCK_SIZE_K": 32,
        "GROUP_SIZE_M": 8,
        "num_stages": 4,
        "num_warps": 4,
        "ms": 4.492541790008545,
        "min_ms": 4.492541790008545,
        "max_ms": 4.492541790008545,
        "compile_time": 2.6057486534118652
    },
    {
        "BLOCK_SIZE_M": 128,
        "BLOCK_SIZE_N": 128,
        "BLOCK_SIZE_K": 32,
        "GROUP_SIZE_M": 8,
        "num_stages": 5,
        "num_warps": 4,
        "ms": 4.49984073638916,
        "min_ms": 4.49984073638916,
        "max_ms": 4.49984073638916,
        "compile_time": 2.655914783477783
    },
    {
        "BLOCK_SIZE_M": 128,
        "BLOCK_SIZE_N": 128,
        "BLOCK_SIZE_K": 32,
        "GROUP_SIZE_M": 8,
        "num_stages": 6,
        "num_warps": 4,
        "ms": 4.513439655303955,
        "min_ms": 4.513439655303955,
        "max_ms": 4.513439655303955,
        "compile_time": 2.6701903343200684
    },
    {
        "BLOCK_SIZE_M": 128,
        "BLOCK_SIZE_N": 128,
        "BLOCK_SIZE_K": 32,
        "GROUP_SIZE_M": 8,
        "num_stages": 3,
        "num_warps": 4,
        "ms": 4.5265960693359375,
        "min_ms": 4.5265960693359375,
        "max_ms": 4.5265960693359375,
        "compile_time": 2.5872795581817627
    },
    {
        "BLOCK_SIZE_M": 128,
        "BLOCK_SIZE_N": 128,
        "BLOCK_SIZE_K": 64,
        "GROUP_SIZE_M": 8,
        "num_stages": 3,
        "num_warps": 4,
        "ms": 4.572458267211914,
        "min_ms": 4.572458267211914,
        "max_ms": 4.572458267211914,
        "compile_time": 2.7480106353759766
    },
    {
        "BLOCK_SIZE_M": 128,
        "BLOCK_SIZE_N": 256,
        "BLOCK_SIZE_K": 64,
        "GROUP_SIZE_M": 8,
        "num_stages": 4,
        "num_warps": 8,
        "ms": 4.588170051574707,
        "min_ms": 4.588170051574707,
        "max_ms": 4.588170051574707,
        "compile_time": 2.741330623626709
    },
    {
        "BLOCK_SIZE_M": 128,
        "BLOCK_SIZE_N": 256,
        "BLOCK_SIZE_K": 64,
        "GROUP_SIZE_M": 8,
        "num_stages": 3,
        "num_warps": 8,
        "ms": 4.588944435119629,
        "min_ms": 4.588944435119629,
        "max_ms": 4.588944435119629,
        "compile_time": 2.7240941524505615
    },
    {
        "BLOCK_SIZE_M": 128,
        "BLOCK_SIZE_N": 128,
        "BLOCK_SIZE_K": 32,
        "GROUP_SIZE_M": 8,
        "num_stages": 7,
        "num_warps": 4,
        "ms": 4.67793083190918,
        "min_ms": 4.67793083190918,
        "max_ms": 4.67793083190918,
        "compile_time": 2.786425828933716
    },
    {
        "BLOCK_SIZE_M": 128,
        "BLOCK_SIZE_N": 128,
        "BLOCK_SIZE_K": 32,
        "GROUP_SIZE_M": 8,
        "num_stages": 8,
        "num_warps": 4,
        "ms": 4.679389953613281,
        "min_ms": 4.679389953613281,
        "max_ms": 4.679389953613281,
        "compile_time": 2.770143985748291
    },
    {
        "BLOCK_SIZE_M": 128,
        "BLOCK_SIZE_N": 128,
        "BLOCK_SIZE_K": 64,
        "GROUP_SIZE_M": 8,
        "num_stages": 4,
        "num_warps": 8,
        "ms": 4.7841901779174805,
        "min_ms": 4.7841901779174805,
        "max_ms": 4.7841901779174805,
        "compile_time": 2.3709115982055664
    },
    {
        "BLOCK_SIZE_M": 128,
        "BLOCK_SIZE_N": 128,
        "BLOCK_SIZE_K": 64,
        "GROUP_SIZE_M": 8,
        "num_stages": 5,
        "num_warps": 8,
        "ms": 4.791482925415039,
        "min_ms": 4.791482925415039,
        "max_ms": 4.791482925415039,
        "compile_time": 2.4040040969848633
    },
    {
        "BLOCK_SIZE_M": 128,
        "BLOCK_SIZE_N": 128,
        "BLOCK_SIZE_K": 64,
        "GROUP_SIZE_M": 8,
        "num_stages": 6,
        "num_warps": 8,
        "ms": 4.797947406768799,
        "min_ms": 4.797947406768799,
        "max_ms": 4.797947406768799,
        "compile_time": 2.4255740642547607
    },
    {
        "BLOCK_SIZE_M": 128,
        "BLOCK_SIZE_N": 128,
        "BLOCK_SIZE_K": 64,
        "GROUP_SIZE_M": 8,
        "num_stages": 3,
        "num_warps": 8,
        "ms": 4.8204755783081055,
        "min_ms": 4.8204755783081055,
        "max_ms": 4.8204755783081055,
        "compile_time": 2.3526902198791504
    },
    {
        "BLOCK_SIZE_M": 128,
        "BLOCK_SIZE_N": 128,
        "BLOCK_SIZE_K": 64,
        "GROUP_SIZE_M": 8,
        "num_stages": 2,
        "num_warps": 4,
        "ms": 4.883456230163574,
        "min_ms": 4.883456230163574,
        "max_ms": 4.883456230163574,
        "compile_time": 2.6442959308624268
    },
    {
        "BLOCK_SIZE_M": 128,
        "BLOCK_SIZE_N": 128,
        "BLOCK_SIZE_K": 128,
        "GROUP_SIZE_M": 8,
        "num_stages": 3,
        "num_warps": 8,
        "ms": 4.91907262802124,
        "min_ms": 4.91907262802124,
        "max_ms": 4.91907262802124,
        "compile_time": 2.44990873336792
    },
    {
        "BLOCK_SIZE_M": 128,
        "BLOCK_SIZE_N": 128,
        "BLOCK_SIZE_K": 64,
        "GROUP_SIZE_M": 8,
        "num_stages": 5,
        "num_warps": 4,
        "ms": 4.951167106628418,
        "min_ms": 4.951167106628418,
        "max_ms": 4.951167106628418,
        "compile_time": 2.8020083904266357
    },
    {
        "BLOCK_SIZE_M": 128,
        "BLOCK_SIZE_N": 128,
        "BLOCK_SIZE_K": 64,
        "GROUP_SIZE_M": 8,
        "num_stages": 4,
        "num_warps": 4,
        "ms": 4.957192897796631,
        "min_ms": 4.957192897796631,
        "max_ms": 4.957192897796631,
        "compile_time": 2.802582025527954
    },
    {
        "BLOCK_SIZE_M": 128,
        "BLOCK_SIZE_N": 128,
        "BLOCK_SIZE_K": 64,
        "GROUP_SIZE_M": 8,
        "num_stages": 6,
        "num_warps": 4,
        "ms": 4.970183849334717,
        "min_ms": 4.970183849334717,
        "max_ms": 4.970183849334717,
        "compile_time": 2.893620252609253
    },
    {
        "BLOCK_SIZE_M": 64,
        "BLOCK_SIZE_N": 512,
        "BLOCK_SIZE_K": 32,
        "GROUP_SIZE_M": 8,
        "num_stages": 5,
        "num_warps": 8,
        "ms": 5.0197224617004395,
        "min_ms": 5.0197224617004395,
        "max_ms": 5.0197224617004395,
        "compile_time": 2.6721880435943604
    },
    {
        "BLOCK_SIZE_M": 128,
        "BLOCK_SIZE_N": 128,
        "BLOCK_SIZE_K": 32,
        "GROUP_SIZE_M": 8,
        "num_stages": 4,
        "num_warps": 8,
        "ms": 5.038247585296631,
        "min_ms": 5.038247585296631,
        "max_ms": 5.038247585296631,
        "compile_time": 2.1341631412506104
    },
    {
        "BLOCK_SIZE_M": 128,
        "BLOCK_SIZE_N": 128,
        "BLOCK_SIZE_K": 32,
        "GROUP_SIZE_M": 8,
        "num_stages": 6,
        "num_warps": 8,
        "ms": 5.048301696777344,
        "min_ms": 5.048301696777344,
        "max_ms": 5.048301696777344,
        "compile_time": 2.265108346939087
    },
    {
        "BLOCK_SIZE_M": 128,
        "BLOCK_SIZE_N": 128,
        "BLOCK_SIZE_K": 32,
        "GROUP_SIZE_M": 8,
        "num_stages": 7,
        "num_warps": 8,
        "ms": 5.052313804626465,
        "min_ms": 5.052313804626465,
        "max_ms": 5.052313804626465,
        "compile_time": 2.2586121559143066
    },
    {
        "BLOCK_SIZE_M": 128,
        "BLOCK_SIZE_N": 128,
        "BLOCK_SIZE_K": 32,
        "GROUP_SIZE_M": 8,
        "num_stages": 8,
        "num_warps": 8,
        "ms": 5.065345764160156,
        "min_ms": 5.065345764160156,
        "max_ms": 5.065345764160156,
        "compile_time": 2.2325282096862793
    },
    {
        "BLOCK_SIZE_M": 128,
        "BLOCK_SIZE_N": 128,
        "BLOCK_SIZE_K": 32,
        "GROUP_SIZE_M": 8,
        "num_stages": 5,
        "num_warps": 8,
        "ms": 5.0717878341674805,
        "min_ms": 5.0717878341674805,
        "max_ms": 5.0717878341674805,
        "compile_time": 2.1798908710479736
    },
    {
        "BLOCK_SIZE_M": 512,
        "BLOCK_SIZE_N": 64,
        "BLOCK_SIZE_K": 32,
        "GROUP_SIZE_M": 8,
        "num_stages": 4,
        "num_warps": 8,
        "ms": 5.126407146453857,
        "min_ms": 5.126407146453857,
        "max_ms": 5.126407146453857,
        "compile_time": 2.9112768173217773
    },
    {
        "BLOCK_SIZE_M": 512,
        "BLOCK_SIZE_N": 64,
        "BLOCK_SIZE_K": 64,
        "GROUP_SIZE_M": 8,
        "num_stages": 3,
        "num_warps": 8,
        "ms": 5.193561553955078,
        "min_ms": 5.193561553955078,
        "max_ms": 5.193561553955078,
        "compile_time": 2.8981244564056396
    },
    {
        "BLOCK_SIZE_M": 64,
        "BLOCK_SIZE_N": 256,
        "BLOCK_SIZE_K": 32,
        "GROUP_SIZE_M": 8,
        "num_stages": 4,
        "num_warps": 4,
        "ms": 5.197180271148682,
        "min_ms": 5.197180271148682,
        "max_ms": 5.197180271148682,
        "compile_time": 2.632997512817383
    },
    {
        "BLOCK_SIZE_M": 512,
        "BLOCK_SIZE_N": 64,
        "BLOCK_SIZE_K": 32,
        "GROUP_SIZE_M": 8,
        "num_stages": 5,
        "num_warps": 8,
        "ms": 5.20596981048584,
        "min_ms": 5.20596981048584,
        "max_ms": 5.20596981048584,
        "compile_time": 3.068086624145508
    },
    {
        "BLOCK_SIZE_M": 64,
        "BLOCK_SIZE_N": 256,
        "BLOCK_SIZE_K": 32,
        "GROUP_SIZE_M": 8,
        "num_stages": 5,
        "num_warps": 4,
        "ms": 5.2096734046936035,
        "min_ms": 5.2096734046936035,
        "max_ms": 5.2096734046936035,
        "compile_time": 2.6362552642822266
    },
    {
        "BLOCK_SIZE_M": 512,
        "BLOCK_SIZE_N": 64,
        "BLOCK_SIZE_K": 32,
        "GROUP_SIZE_M": 8,
        "num_stages": 3,
        "num_warps": 8,
        "ms": 5.21944522857666,
        "min_ms": 5.21944522857666,
        "max_ms": 5.21944522857666,
        "compile_time": 2.860142707824707
    },
    {
        "BLOCK_SIZE_M": 64,
        "BLOCK_SIZE_N": 512,
        "BLOCK_SIZE_K": 32,
        "GROUP_SIZE_M": 8,
        "num_stages": 4,
        "num_warps": 8,
        "ms": 5.224386692047119,
        "min_ms": 5.224386692047119,
        "max_ms": 5.224386692047119,
        "compile_time": 2.573626756668091
    },
    {
        "BLOCK_SIZE_M": 64,
        "BLOCK_SIZE_N": 512,
        "BLOCK_SIZE_K": 32,
        "GROUP_SIZE_M": 8,
        "num_stages": 3,
        "num_warps": 8,
        "ms": 5.237915992736816,
        "min_ms": 5.237915992736816,
        "max_ms": 5.237915992736816,
        "compile_time": 2.570600986480713
    },
    {
        "BLOCK_SIZE_M": 256,
        "BLOCK_SIZE_N": 64,
        "BLOCK_SIZE_K": 32,
        "GROUP_SIZE_M": 8,
        "num_stages": 3,
        "num_warps": 4,
        "ms": 5.264422416687012,
        "min_ms": 5.264422416687012,
        "max_ms": 5.264422416687012,
        "compile_time": 2.7397313117980957
    },
    {
        "BLOCK_SIZE_M": 256,
        "BLOCK_SIZE_N": 64,
        "BLOCK_SIZE_K": 64,
        "GROUP_SIZE_M": 8,
        "num_stages": 5,
        "num_warps": 4,
        "ms": 5.289817810058594,
        "min_ms": 5.289817810058594,
        "max_ms": 5.289817810058594,
        "compile_time": 2.985670328140259
    },
    {
        "BLOCK_SIZE_M": 256,
        "BLOCK_SIZE_N": 64,
        "BLOCK_SIZE_K": 32,
        "GROUP_SIZE_M": 8,
        "num_stages": 5,
        "num_warps": 4,
        "ms": 5.303832054138184,
        "min_ms": 5.303832054138184,
        "max_ms": 5.303832054138184,
        "compile_time": 2.8643441200256348
    },
    {
        "BLOCK_SIZE_M": 64,
        "BLOCK_SIZE_N": 256,
        "BLOCK_SIZE_K": 32,
        "GROUP_SIZE_M": 8,
        "num_stages": 3,
        "num_warps": 4,
        "ms": 5.311380863189697,
        "min_ms": 5.311380863189697,
        "max_ms": 5.311380863189697,
        "compile_time": 2.671481132507324
    },
    {
        "BLOCK_SIZE_M": 64,
        "BLOCK_SIZE_N": 256,
        "BLOCK_SIZE_K": 64,
        "GROUP_SIZE_M": 8,
        "num_stages": 3,
        "num_warps": 4,
        "ms": 5.315369606018066,
        "min_ms": 5.315369606018066,
        "max_ms": 5.315369606018066,
        "compile_time": 2.876878499984741
    },
    {
        "BLOCK_SIZE_M": 256,
        "BLOCK_SIZE_N": 64,
        "BLOCK_SIZE_K": 32,
        "GROUP_SIZE_M": 8,
        "num_stages": 4,
        "num_warps": 4,
        "ms": 5.320674896240234,
        "min_ms": 5.320674896240234,
        "max_ms": 5.320674896240234,
        "compile_time": 2.8741414546966553
    },
    {
        "BLOCK_SIZE_M": 128,
        "BLOCK_SIZE_N": 128,
        "BLOCK_SIZE_K": 128,
        "GROUP_SIZE_M": 8,
        "num_stages": 3,
        "num_warps": 4,
        "ms": 5.346877098083496,
        "min_ms": 5.346877098083496,
        "max_ms": 5.346877098083496,
        "compile_time": 3.119351625442505
    },
    {
        "BLOCK_SIZE_M": 256,
        "BLOCK_SIZE_N": 64,
        "BLOCK_SIZE_K": 32,
        "GROUP_SIZE_M": 8,
        "num_stages": 6,
        "num_warps": 4,
        "ms": 5.379235744476318,
        "min_ms": 5.379235744476318,
        "max_ms": 5.379235744476318,
        "compile_time": 2.872925043106079
    },
    {
        "BLOCK_SIZE_M": 128,
        "BLOCK_SIZE_N": 128,
        "BLOCK_SIZE_K": 128,
        "GROUP_SIZE_M": 8,
        "num_stages": 3,
        "num_warps": 16,
        "ms": 5.414092540740967,
        "min_ms": 5.414092540740967,
        "max_ms": 5.414092540740967,
        "compile_time": 2.1825315952301025
    },
    {
        "BLOCK_SIZE_M": 256,
        "BLOCK_SIZE_N": 64,
        "BLOCK_SIZE_K": 32,
        "GROUP_SIZE_M": 8,
        "num_stages": 7,
        "num_warps": 4,
        "ms": 5.414769172668457,
        "min_ms": 5.414769172668457,
        "max_ms": 5.414769172668457,
        "compile_time": 2.909806966781616
    },
    {
        "BLOCK_SIZE_M": 64,
        "BLOCK_SIZE_N": 256,
        "BLOCK_SIZE_K": 64,
        "GROUP_SIZE_M": 8,
        "num_stages": 5,
        "num_warps": 8,
        "ms": 5.420093536376953,
        "min_ms": 5.420093536376953,
        "max_ms": 5.420093536376953,
        "compile_time": 2.331880807876587
    },
    {
        "BLOCK_SIZE_M": 256,
        "BLOCK_SIZE_N": 64,
        "BLOCK_SIZE_K": 64,
        "GROUP_SIZE_M": 8,
        "num_stages": 3,
        "num_warps": 4,
        "ms": 5.424010753631592,
        "min_ms": 5.424010753631592,
        "max_ms": 5.424010753631592,
        "compile_time": 3.062473773956299
    },
    {
        "BLOCK_SIZE_M": 256,
        "BLOCK_SIZE_N": 64,
        "BLOCK_SIZE_K": 32,
        "GROUP_SIZE_M": 8,
        "num_stages": 8,
        "num_warps": 4,
        "ms": 5.424619197845459,
        "min_ms": 5.424619197845459,
        "max_ms": 5.424619197845459,
        "compile_time": 2.915540933609009
    },
    {
        "BLOCK_SIZE_M": 64,
        "BLOCK_SIZE_N": 512,
        "BLOCK_SIZE_K": 64,
        "GROUP_SIZE_M": 8,
        "num_stages": 3,
        "num_warps": 8,
        "ms": 5.424710273742676,
        "min_ms": 5.424710273742676,
        "max_ms": 5.424710273742676,
        "compile_time": 2.7615017890930176
    },
    {
        "BLOCK_SIZE_M": 256,
        "BLOCK_SIZE_N": 64,
        "BLOCK_SIZE_K": 64,
        "GROUP_SIZE_M": 8,
        "num_stages": 4,
        "num_warps": 4,
        "ms": 5.464077949523926,
        "min_ms": 5.464077949523926,
        "max_ms": 5.464077949523926,
        "compile_time": 2.8808560371398926
    },
    {
        "BLOCK_SIZE_M": 64,
        "BLOCK_SIZE_N": 256,
        "BLOCK_SIZE_K": 16,
        "GROUP_SIZE_M": 8,
        "num_stages": 4,
        "num_warps": 4,
        "ms": 5.46886682510376,
        "min_ms": 5.46886682510376,
        "max_ms": 5.46886682510376,
        "compile_time": 2.2916252613067627
    },
    {
        "BLOCK_SIZE_M": 64,
        "BLOCK_SIZE_N": 256,
        "BLOCK_SIZE_K": 16,
        "GROUP_SIZE_M": 8,
        "num_stages": 5,
        "num_warps": 4,
        "ms": 5.4816155433654785,
        "min_ms": 5.4816155433654785,
        "max_ms": 5.4816155433654785,
        "compile_time": 2.311180591583252
    },
    {
        "BLOCK_SIZE_M": 64,
        "BLOCK_SIZE_N": 256,
        "BLOCK_SIZE_K": 32,
        "GROUP_SIZE_M": 8,
        "num_stages": 7,
        "num_warps": 8,
        "ms": 5.5083417892456055,
        "min_ms": 5.5083417892456055,
        "max_ms": 5.5083417892456055,
        "compile_time": 2.174126386642456
    },
    {
        "BLOCK_SIZE_M": 64,
        "BLOCK_SIZE_N": 256,
        "BLOCK_SIZE_K": 16,
        "GROUP_SIZE_M": 8,
        "num_stages": 8,
        "num_warps": 4,
        "ms": 5.514004707336426,
        "min_ms": 5.514004707336426,
        "max_ms": 5.514004707336426,
        "compile_time": 2.3683676719665527
    },
    {
        "BLOCK_SIZE_M": 64,
        "BLOCK_SIZE_N": 256,
        "BLOCK_SIZE_K": 16,
        "GROUP_SIZE_M": 8,
        "num_stages": 7,
        "num_warps": 4,
        "ms": 5.514034748077393,
        "min_ms": 5.514034748077393,
        "max_ms": 5.514034748077393,
        "compile_time": 2.3319413661956787
    },
    {
        "BLOCK_SIZE_M": 64,
        "BLOCK_SIZE_N": 256,
        "BLOCK_SIZE_K": 16,
        "GROUP_SIZE_M": 8,
        "num_stages": 6,
        "num_warps": 4,
        "ms": 5.530654430389404,
        "min_ms": 5.530654430389404,
        "max_ms": 5.530654430389404,
        "compile_time": 2.3350162506103516
    },
    {
        "BLOCK_SIZE_M": 64,
        "BLOCK_SIZE_N": 256,
        "BLOCK_SIZE_K": 32,
        "GROUP_SIZE_M": 8,
        "num_stages": 6,
        "num_warps": 8,
        "ms": 5.530838966369629,
        "min_ms": 5.530838966369629,
        "max_ms": 5.530838966369629,
        "compile_time": 2.1518056392669678
    },
    {
        "BLOCK_SIZE_M": 256,
        "BLOCK_SIZE_N": 64,
        "BLOCK_SIZE_K": 64,
        "GROUP_SIZE_M": 8,
        "num_stages": 5,
        "num_warps": 8,
        "ms": 5.5406694412231445,
        "min_ms": 5.5406694412231445,
        "max_ms": 5.5406694412231445,
        "compile_time": 2.6026980876922607
    },
    {
        "BLOCK_SIZE_M": 64,
        "BLOCK_SIZE_N": 256,
        "BLOCK_SIZE_K": 64,
        "GROUP_SIZE_M": 8,
        "num_stages": 4,
        "num_warps": 8,
        "ms": 5.551452159881592,
        "min_ms": 5.551452159881592,
        "max_ms": 5.551452159881592,
        "compile_time": 2.3164923191070557
    },
    {
        "BLOCK_SIZE_M": 64,
        "BLOCK_SIZE_N": 256,
        "BLOCK_SIZE_K": 32,
        "GROUP_SIZE_M": 8,
        "num_stages": 5,
        "num_warps": 8,
        "ms": 5.551810264587402,
        "min_ms": 5.551810264587402,
        "max_ms": 5.551810264587402,
        "compile_time": 2.132178544998169
    },
    {
        "BLOCK_SIZE_M": 128,
        "BLOCK_SIZE_N": 128,
        "BLOCK_SIZE_K": 16,
        "GROUP_SIZE_M": 8,
        "num_stages": 4,
        "num_warps": 4,
        "ms": 5.553194999694824,
        "min_ms": 5.553194999694824,
        "max_ms": 5.553194999694824,
        "compile_time": 2.365074634552002
    },
    {
        "BLOCK_SIZE_M": 128,
        "BLOCK_SIZE_N": 128,
        "BLOCK_SIZE_K": 16,
        "GROUP_SIZE_M": 8,
        "num_stages": 8,
        "num_warps": 4,
        "ms": 5.556763172149658,
        "min_ms": 5.556763172149658,
        "max_ms": 5.556763172149658,
        "compile_time": 2.3615784645080566
    },
    {
        "BLOCK_SIZE_M": 64,
        "BLOCK_SIZE_N": 256,
        "BLOCK_SIZE_K": 32,
        "GROUP_SIZE_M": 8,
        "num_stages": 8,
        "num_warps": 8,
        "ms": 5.557002067565918,
        "min_ms": 5.557002067565918,
        "max_ms": 5.557002067565918,
        "compile_time": 2.1869821548461914
    },
    {
        "BLOCK_SIZE_M": 128,
        "BLOCK_SIZE_N": 128,
        "BLOCK_SIZE_K": 128,
        "GROUP_SIZE_M": 8,
        "num_stages": 2,
        "num_warps": 4,
        "ms": 5.5595808029174805,
        "min_ms": 5.5595808029174805,
        "max_ms": 5.5595808029174805,
        "compile_time": 3.018527030944824
    },
    {
        "BLOCK_SIZE_M": 128,
        "BLOCK_SIZE_N": 128,
        "BLOCK_SIZE_K": 16,
        "GROUP_SIZE_M": 8,
        "num_stages": 5,
        "num_warps": 4,
        "ms": 5.563736915588379,
        "min_ms": 5.563736915588379,
        "max_ms": 5.563736915588379,
        "compile_time": 2.338564395904541
    },
    {
        "BLOCK_SIZE_M": 128,
        "BLOCK_SIZE_N": 128,
        "BLOCK_SIZE_K": 16,
        "GROUP_SIZE_M": 8,
        "num_stages": 6,
        "num_warps": 4,
        "ms": 5.5670247077941895,
        "min_ms": 5.5670247077941895,
        "max_ms": 5.5670247077941895,
        "compile_time": 2.333012819290161
    },
    {
        "BLOCK_SIZE_M": 256,
        "BLOCK_SIZE_N": 64,
        "BLOCK_SIZE_K": 64,
        "GROUP_SIZE_M": 8,
        "num_stages": 2,
        "num_warps": 4,
        "ms": 5.580304145812988,
        "min_ms": 5.580304145812988,
        "max_ms": 5.580304145812988,
        "compile_time": 2.8249459266662598
    },
    {
        "BLOCK_SIZE_M": 128,
        "BLOCK_SIZE_N": 128,
        "BLOCK_SIZE_K": 16,
        "GROUP_SIZE_M": 8,
        "num_stages": 7,
        "num_warps": 4,
        "ms": 5.582976818084717,
        "min_ms": 5.582976818084717,
        "max_ms": 5.582976818084717,
        "compile_time": 2.380953311920166
    },
    {
        "BLOCK_SIZE_M": 64,
        "BLOCK_SIZE_N": 256,
        "BLOCK_SIZE_K": 32,
        "GROUP_SIZE_M": 8,
        "num_stages": 6,
        "num_warps": 4,
        "ms": 5.587903022766113,
        "min_ms": 5.587903022766113,
        "max_ms": 5.587903022766113,
        "compile_time": 2.6317355632781982
    },
    {
        "BLOCK_SIZE_M": 64,
        "BLOCK_SIZE_N": 256,
        "BLOCK_SIZE_K": 32,
        "GROUP_SIZE_M": 8,
        "num_stages": 7,
        "num_warps": 4,
        "ms": 5.593594551086426,
        "min_ms": 5.593594551086426,
        "max_ms": 5.593594551086426,
        "compile_time": 2.6876420974731445
    },
    {
        "BLOCK_SIZE_M": 64,
        "BLOCK_SIZE_N": 256,
        "BLOCK_SIZE_K": 32,
        "GROUP_SIZE_M": 8,
        "num_stages": 8,
        "num_warps": 4,
        "ms": 5.596343040466309,
        "min_ms": 5.596343040466309,
        "max_ms": 5.596343040466309,
        "compile_time": 2.7049105167388916
    },
    {
        "BLOCK_SIZE_M": 128,
        "BLOCK_SIZE_N": 256,
        "BLOCK_SIZE_K": 64,
        "GROUP_SIZE_M": 8,
        "num_stages": 2,
        "num_warps": 8,
        "ms": 5.597461700439453,
        "min_ms": 5.597461700439453,
        "max_ms": 5.597461700439453,
        "compile_time": 2.5157899856567383
    },
    {
        "BLOCK_SIZE_M": 64,
        "BLOCK_SIZE_N": 256,
        "BLOCK_SIZE_K": 32,
        "GROUP_SIZE_M": 8,
        "num_stages": 4,
        "num_warps": 8,
        "ms": 5.609646320343018,
        "min_ms": 5.609646320343018,
        "max_ms": 5.609646320343018,
        "compile_time": 2.1484522819519043
    },
    {
        "BLOCK_SIZE_M": 64,
        "BLOCK_SIZE_N": 256,
        "BLOCK_SIZE_K": 64,
        "GROUP_SIZE_M": 8,
        "num_stages": 3,
        "num_warps": 8,
        "ms": 5.614678382873535,
        "min_ms": 5.614678382873535,
        "max_ms": 5.614678382873535,
        "compile_time": 2.2260589599609375
    },
    {
        "BLOCK_SIZE_M": 256,
        "BLOCK_SIZE_N": 64,
        "BLOCK_SIZE_K": 64,
        "GROUP_SIZE_M": 8,
        "num_stages": 3,
        "num_warps": 8,
        "ms": 5.651671409606934,
        "min_ms": 5.651671409606934,
        "max_ms": 5.651671409606934,
        "compile_time": 2.4779000282287598
    },
    {
        "BLOCK_SIZE_M": 256,
        "BLOCK_SIZE_N": 64,
        "BLOCK_SIZE_K": 64,
        "GROUP_SIZE_M": 8,
        "num_stages": 4,
        "num_warps": 8,
        "ms": 5.661051273345947,
        "min_ms": 5.661051273345947,
        "max_ms": 5.661051273345947,
        "compile_time": 2.5714428424835205
    },
    {
        "BLOCK_SIZE_M": 128,
        "BLOCK_SIZE_N": 128,
        "BLOCK_SIZE_K": 32,
        "GROUP_SIZE_M": 8,
        "num_stages": 3,
        "num_warps": 8,
        "ms": 5.691994667053223,
        "min_ms": 5.691994667053223,
        "max_ms": 5.691994667053223,
        "compile_time": 2.037144184112549
    },
    {
        "BLOCK_SIZE_M": 256,
        "BLOCK_SIZE_N": 64,
        "BLOCK_SIZE_K": 32,
        "GROUP_SIZE_M": 8,
        "num_stages": 6,
        "num_warps": 8,
        "ms": 5.6991963386535645,
        "min_ms": 5.6991963386535645,
        "max_ms": 5.6991963386535645,
        "compile_time": 2.3175933361053467
    },
    {
        "BLOCK_SIZE_M": 256,
        "BLOCK_SIZE_N": 64,
        "BLOCK_SIZE_K": 128,
        "GROUP_SIZE_M": 8,
        "num_stages": 3,
        "num_warps": 8,
        "ms": 5.699885368347168,
        "min_ms": 5.699885368347168,
        "max_ms": 5.699885368347168,
        "compile_time": 2.8693599700927734
    },
    {
        "BLOCK_SIZE_M": 128,
        "BLOCK_SIZE_N": 64,
        "BLOCK_SIZE_K": 32,
        "GROUP_SIZE_M": 8,
        "num_stages": 3,
        "num_warps": 2,
        "ms": 5.703334808349609,
        "min_ms": 5.703334808349609,
        "max_ms": 5.703334808349609,
        "compile_time": 2.627419948577881
    },
    {
        "BLOCK_SIZE_M": 256,
        "BLOCK_SIZE_N": 64,
        "BLOCK_SIZE_K": 32,
        "GROUP_SIZE_M": 8,
        "num_stages": 5,
        "num_warps": 8,
        "ms": 5.707160949707031,
        "min_ms": 5.707160949707031,
        "max_ms": 5.707160949707031,
        "compile_time": 2.3059074878692627
    },
    {
        "BLOCK_SIZE_M": 256,
        "BLOCK_SIZE_N": 64,
        "BLOCK_SIZE_K": 32,
        "GROUP_SIZE_M": 8,
        "num_stages": 4,
        "num_warps": 8,
        "ms": 5.709036827087402,
        "min_ms": 5.709036827087402,
        "max_ms": 5.709036827087402,
        "compile_time": 2.3192732334136963
    },
    {
        "BLOCK_SIZE_M": 64,
        "BLOCK_SIZE_N": 512,
        "BLOCK_SIZE_K": 16,
        "GROUP_SIZE_M": 8,
        "num_stages": 6,
        "num_warps": 8,
        "ms": 5.71404504776001,
        "min_ms": 5.71404504776001,
        "max_ms": 5.71404504776001,
        "compile_time": 2.2867467403411865
    },
    {
        "BLOCK_SIZE_M": 128,
        "BLOCK_SIZE_N": 256,
        "BLOCK_SIZE_K": 16,
        "GROUP_SIZE_M": 8,
        "num_stages": 6,
        "num_warps": 8,
        "ms": 5.720076084136963,
        "min_ms": 5.720076084136963,
        "max_ms": 5.720076084136963,
        "compile_time": 2.2591211795806885
    },
    {
        "BLOCK_SIZE_M": 128,
        "BLOCK_SIZE_N": 256,
        "BLOCK_SIZE_K": 16,
        "GROUP_SIZE_M": 8,
        "num_stages": 5,
        "num_warps": 8,
        "ms": 5.721991539001465,
        "min_ms": 5.721991539001465,
        "max_ms": 5.721991539001465,
        "compile_time": 2.2506027221679688
    },
    {
        "BLOCK_SIZE_M": 128,
        "BLOCK_SIZE_N": 256,
        "BLOCK_SIZE_K": 16,
        "GROUP_SIZE_M": 8,
        "num_stages": 4,
        "num_warps": 8,
        "ms": 5.724207878112793,
        "min_ms": 5.724207878112793,
        "max_ms": 5.724207878112793,
        "compile_time": 2.2569591999053955
    },
    {
        "BLOCK_SIZE_M": 256,
        "BLOCK_SIZE_N": 64,
        "BLOCK_SIZE_K": 32,
        "GROUP_SIZE_M": 8,
        "num_stages": 7,
        "num_warps": 8,
        "ms": 5.73048734664917,
        "min_ms": 5.73048734664917,
        "max_ms": 5.73048734664917,
        "compile_time": 2.3533051013946533
    },
    {
        "BLOCK_SIZE_M": 64,
        "BLOCK_SIZE_N": 256,
        "BLOCK_SIZE_K": 128,
        "GROUP_SIZE_M": 8,
        "num_stages": 3,
        "num_warps": 8,
        "ms": 5.733899116516113,
        "min_ms": 5.733899116516113,
        "max_ms": 5.733899116516113,
        "compile_time": 2.605379343032837
    },
    {
        "BLOCK_SIZE_M": 64,
        "BLOCK_SIZE_N": 512,
        "BLOCK_SIZE_K": 16,
        "GROUP_SIZE_M": 8,
        "num_stages": 4,
        "num_warps": 8,
        "ms": 5.736197471618652,
        "min_ms": 5.736197471618652,
        "max_ms": 5.736197471618652,
        "compile_time": 2.2509360313415527
    },
    {
        "BLOCK_SIZE_M": 64,
        "BLOCK_SIZE_N": 512,
        "BLOCK_SIZE_K": 16,
        "GROUP_SIZE_M": 8,
        "num_stages": 5,
        "num_warps": 8,
        "ms": 5.736948490142822,
        "min_ms": 5.736948490142822,
        "max_ms": 5.736948490142822,
        "compile_time": 2.2737653255462646
    },
    {
        "BLOCK_SIZE_M": 64,
        "BLOCK_SIZE_N": 256,
        "BLOCK_SIZE_K": 64,
        "GROUP_SIZE_M": 8,
        "num_stages": 2,
        "num_warps": 4,
        "ms": 5.736959934234619,
        "min_ms": 5.736959934234619,
        "max_ms": 5.736959934234619,
        "compile_time": 2.59795880317688
    },
    {
        "BLOCK_SIZE_M": 256,
        "BLOCK_SIZE_N": 64,
        "BLOCK_SIZE_K": 32,
        "GROUP_SIZE_M": 8,
        "num_stages": 8,
        "num_warps": 8,
        "ms": 5.737062454223633,
        "min_ms": 5.737062454223633,
        "max_ms": 5.737062454223633,
        "compile_time": 2.371661424636841
    },
    {
        "BLOCK_SIZE_M": 256,
        "BLOCK_SIZE_N": 128,
        "BLOCK_SIZE_K": 64,
        "GROUP_SIZE_M": 8,
        "num_stages": 2,
        "num_warps": 8,
        "ms": 5.743928909301758,
        "min_ms": 5.743928909301758,
        "max_ms": 5.743928909301758,
        "compile_time": 2.619210720062256
    },
    {
        "BLOCK_SIZE_M": 64,
        "BLOCK_SIZE_N": 512,
        "BLOCK_SIZE_K": 16,
        "GROUP_SIZE_M": 8,
        "num_stages": 8,
        "num_warps": 8,
        "ms": 5.750363349914551,
        "min_ms": 5.750363349914551,
        "max_ms": 5.750363349914551,
        "compile_time": 2.3387861251831055
    },
    {
        "BLOCK_SIZE_M": 64,
        "BLOCK_SIZE_N": 512,
        "BLOCK_SIZE_K": 16,
        "GROUP_SIZE_M": 8,
        "num_stages": 7,
        "num_warps": 8,
        "ms": 5.757633209228516,
        "min_ms": 5.757633209228516,
        "max_ms": 5.757633209228516,
        "compile_time": 2.298875570297241
    },
    {
        "BLOCK_SIZE_M": 128,
        "BLOCK_SIZE_N": 128,
        "BLOCK_SIZE_K": 64,
        "GROUP_SIZE_M": 8,
        "num_stages": 3,
        "num_warps": 16,
        "ms": 5.763310432434082,
        "min_ms": 5.763310432434082,
        "max_ms": 5.763310432434082,
        "compile_time": 2.006592035293579
    },
    {
        "BLOCK_SIZE_M": 128,
        "BLOCK_SIZE_N": 64,
        "BLOCK_SIZE_K": 64,
        "GROUP_SIZE_M": 8,
        "num_stages": 3,
        "num_warps": 4,
        "ms": 5.7646565437316895,
        "min_ms": 5.7646565437316895,
        "max_ms": 5.7646565437316895,
        "compile_time": 2.3137316703796387
    },
    {
        "BLOCK_SIZE_M": 64,
        "BLOCK_SIZE_N": 128,
        "BLOCK_SIZE_K": 32,
        "GROUP_SIZE_M": 8,
        "num_stages": 4,
        "num_warps": 2,
        "ms": 5.765195369720459,
        "min_ms": 5.765195369720459,
        "max_ms": 5.765195369720459,
        "compile_time": 2.6076254844665527
    },
    {
        "BLOCK_SIZE_M": 128,
        "BLOCK_SIZE_N": 256,
        "BLOCK_SIZE_K": 16,
        "GROUP_SIZE_M": 8,
        "num_stages": 7,
        "num_warps": 8,
        "ms": 5.765999794006348,
        "min_ms": 5.765999794006348,
        "max_ms": 5.765999794006348,
        "compile_time": 2.3767263889312744
    },
    {
        "BLOCK_SIZE_M": 128,
        "BLOCK_SIZE_N": 256,
        "BLOCK_SIZE_K": 16,
        "GROUP_SIZE_M": 8,
        "num_stages": 8,
        "num_warps": 8,
        "ms": 5.770108222961426,
        "min_ms": 5.770108222961426,
        "max_ms": 5.770108222961426,
        "compile_time": 2.3271079063415527
    },
    {
        "BLOCK_SIZE_M": 128,
        "BLOCK_SIZE_N": 128,
        "BLOCK_SIZE_K": 64,
        "GROUP_SIZE_M": 8,
        "num_stages": 5,
        "num_warps": 16,
        "ms": 5.780628204345703,
        "min_ms": 5.780628204345703,
        "max_ms": 5.780628204345703,
        "compile_time": 2.0217087268829346
    },
    {
        "BLOCK_SIZE_M": 128,
        "BLOCK_SIZE_N": 128,
        "BLOCK_SIZE_K": 32,
        "GROUP_SIZE_M": 8,
        "num_stages": 2,
        "num_warps": 4,
        "ms": 5.782515525817871,
        "min_ms": 5.782515525817871,
        "max_ms": 5.782515525817871,
        "compile_time": 2.404797315597534
    },
    {
        "BLOCK_SIZE_M": 128,
        "BLOCK_SIZE_N": 128,
        "BLOCK_SIZE_K": 64,
        "GROUP_SIZE_M": 8,
        "num_stages": 4,
        "num_warps": 16,
        "ms": 5.786134243011475,
        "min_ms": 5.786134243011475,
        "max_ms": 5.786134243011475,
        "compile_time": 2.0190985202789307
    },
    {
        "BLOCK_SIZE_M": 128,
        "BLOCK_SIZE_N": 256,
        "BLOCK_SIZE_K": 32,
        "GROUP_SIZE_M": 8,
        "num_stages": 4,
        "num_warps": 16,
        "ms": 5.7968034744262695,
        "min_ms": 5.7968034744262695,
        "max_ms": 5.7968034744262695,
        "compile_time": 2.0412561893463135
    },
    {
        "BLOCK_SIZE_M": 128,
        "BLOCK_SIZE_N": 256,
        "BLOCK_SIZE_K": 32,
        "GROUP_SIZE_M": 8,
        "num_stages": 3,
        "num_warps": 16,
        "ms": 5.798249244689941,
        "min_ms": 5.798249244689941,
        "max_ms": 5.798249244689941,
        "compile_time": 2.046689748764038
    },
    {
        "BLOCK_SIZE_M": 64,
        "BLOCK_SIZE_N": 128,
        "BLOCK_SIZE_K": 32,
        "GROUP_SIZE_M": 8,
        "num_stages": 3,
        "num_warps": 2,
        "ms": 5.79931116104126,
        "min_ms": 5.79931116104126,
        "max_ms": 5.79931116104126,
        "compile_time": 2.587491273880005
    },
    {
        "BLOCK_SIZE_M": 128,
        "BLOCK_SIZE_N": 256,
        "BLOCK_SIZE_K": 32,
        "GROUP_SIZE_M": 8,
        "num_stages": 7,
        "num_warps": 16,
        "ms": 5.802393436431885,
        "min_ms": 5.802393436431885,
        "max_ms": 5.802393436431885,
        "compile_time": 2.0770039558410645
    },
    {
        "BLOCK_SIZE_M": 128,
        "BLOCK_SIZE_N": 256,
        "BLOCK_SIZE_K": 32,
        "GROUP_SIZE_M": 8,
        "num_stages": 6,
        "num_warps": 16,
        "ms": 5.803597927093506,
        "min_ms": 5.803597927093506,
        "max_ms": 5.803597927093506,
        "compile_time": 2.0721826553344727
    },
    {
        "BLOCK_SIZE_M": 128,
        "BLOCK_SIZE_N": 256,
        "BLOCK_SIZE_K": 32,
        "GROUP_SIZE_M": 8,
        "num_stages": 5,
        "num_warps": 16,
        "ms": 5.8051042556762695,
        "min_ms": 5.8051042556762695,
        "max_ms": 5.8051042556762695,
        "compile_time": 2.0526487827301025
    },
    {
        "BLOCK_SIZE_M": 128,
        "BLOCK_SIZE_N": 64,
        "BLOCK_SIZE_K": 64,
        "GROUP_SIZE_M": 8,
        "num_stages": 4,
        "num_warps": 4,
        "ms": 5.806122779846191,
        "min_ms": 5.806122779846191,
        "max_ms": 5.806122779846191,
        "compile_time": 2.3574984073638916
    },
    {
        "BLOCK_SIZE_M": 128,
        "BLOCK_SIZE_N": 64,
        "BLOCK_SIZE_K": 32,
        "GROUP_SIZE_M": 8,
        "num_stages": 6,
        "num_warps": 4,
        "ms": 5.814854145050049,
        "min_ms": 5.814854145050049,
        "max_ms": 5.814854145050049,
        "compile_time": 2.258683443069458
    },
    {
        "BLOCK_SIZE_M": 128,
        "BLOCK_SIZE_N": 64,
        "BLOCK_SIZE_K": 32,
        "GROUP_SIZE_M": 8,
        "num_stages": 7,
        "num_warps": 4,
        "ms": 5.816956520080566,
        "min_ms": 5.816956520080566,
        "max_ms": 5.816956520080566,
        "compile_time": 2.283822774887085
    },
    {
        "BLOCK_SIZE_M": 64,
        "BLOCK_SIZE_N": 128,
        "BLOCK_SIZE_K": 32,
        "GROUP_SIZE_M": 8,
        "num_stages": 5,
        "num_warps": 2,
        "ms": 5.818023204803467,
        "min_ms": 5.818023204803467,
        "max_ms": 5.818023204803467,
        "compile_time": 2.687251329421997
    },
    {
        "BLOCK_SIZE_M": 128,
        "BLOCK_SIZE_N": 64,
        "BLOCK_SIZE_K": 32,
        "GROUP_SIZE_M": 8,
        "num_stages": 4,
        "num_warps": 2,
        "ms": 5.8196611404418945,
        "min_ms": 5.8196611404418945,
        "max_ms": 5.8196611404418945,
        "compile_time": 2.853140354156494
    },
    {
        "BLOCK_SIZE_M": 128,
        "BLOCK_SIZE_N": 128,
        "BLOCK_SIZE_K": 64,
        "GROUP_SIZE_M": 8,
        "num_stages": 6,
        "num_warps": 16,
        "ms": 5.83081579208374,
        "min_ms": 5.83081579208374,
        "max_ms": 5.83081579208374,
        "compile_time": 2.0444509983062744
    },
    {
        "BLOCK_SIZE_M": 128,
        "BLOCK_SIZE_N": 64,
        "BLOCK_SIZE_K": 64,
        "GROUP_SIZE_M": 8,
        "num_stages": 7,
        "num_warps": 4,
        "ms": 5.838125705718994,
        "min_ms": 5.838125705718994,
        "max_ms": 5.838125705718994,
        "compile_time": 2.522251844406128
    },
    {
        "BLOCK_SIZE_M": 128,
        "BLOCK_SIZE_N": 64,
        "BLOCK_SIZE_K": 32,
        "GROUP_SIZE_M": 8,
        "num_stages": 3,
        "num_warps": 4,
        "ms": 5.850208759307861,
        "min_ms": 5.850208759307861,
        "max_ms": 5.850208759307861,
        "compile_time": 2.142197370529175
    },
    {
        "BLOCK_SIZE_M": 256,
        "BLOCK_SIZE_N": 128,
        "BLOCK_SIZE_K": 128,
        "GROUP_SIZE_M": 8,
        "num_stages": 2,
        "num_warps": 8,
        "ms": 5.8536882400512695,
        "min_ms": 5.8536882400512695,
        "max_ms": 5.8536882400512695,
        "compile_time": 2.8684513568878174
    },
    {
        "BLOCK_SIZE_M": 128,
        "BLOCK_SIZE_N": 64,
        "BLOCK_SIZE_K": 32,
        "GROUP_SIZE_M": 8,
        "num_stages": 4,
        "num_warps": 4,
        "ms": 5.862302780151367,
        "min_ms": 5.862302780151367,
        "max_ms": 5.862302780151367,
        "compile_time": 2.2762317657470703
    },
    {
        "BLOCK_SIZE_M": 64,
        "BLOCK_SIZE_N": 128,
        "BLOCK_SIZE_K": 32,
        "GROUP_SIZE_M": 8,
        "num_stages": 4,
        "num_warps": 4,
        "ms": 5.866237163543701,
        "min_ms": 5.866237163543701,
        "max_ms": 5.866237163543701,
        "compile_time": 2.1050479412078857
    },
    {
        "BLOCK_SIZE_M": 256,
        "BLOCK_SIZE_N": 64,
        "BLOCK_SIZE_K": 32,
        "GROUP_SIZE_M": 8,
        "num_stages": 2,
        "num_warps": 4,
        "ms": 5.8797478675842285,
        "min_ms": 5.8797478675842285,
        "max_ms": 5.8797478675842285,
        "compile_time": 2.631035327911377
    },
    {
        "BLOCK_SIZE_M": 64,
        "BLOCK_SIZE_N": 128,
        "BLOCK_SIZE_K": 64,
        "GROUP_SIZE_M": 8,
        "num_stages": 4,
        "num_warps": 4,
        "ms": 5.885983943939209,
        "min_ms": 5.885983943939209,
        "max_ms": 5.885983943939209,
        "compile_time": 2.323514223098755
    },
    {
        "BLOCK_SIZE_M": 128,
        "BLOCK_SIZE_N": 64,
        "BLOCK_SIZE_K": 32,
        "GROUP_SIZE_M": 8,
        "num_stages": 5,
        "num_warps": 4,
        "ms": 5.8887763023376465,
        "min_ms": 5.8887763023376465,
        "max_ms": 5.8887763023376465,
        "compile_time": 2.2295610904693604
    },
    {
        "BLOCK_SIZE_M": 64,
        "BLOCK_SIZE_N": 128,
        "BLOCK_SIZE_K": 32,
        "GROUP_SIZE_M": 8,
        "num_stages": 6,
        "num_warps": 4,
        "ms": 5.889983177185059,
        "min_ms": 5.889983177185059,
        "max_ms": 5.889983177185059,
        "compile_time": 2.168470859527588
    },
    {
        "BLOCK_SIZE_M": 64,
        "BLOCK_SIZE_N": 128,
        "BLOCK_SIZE_K": 32,
        "GROUP_SIZE_M": 8,
        "num_stages": 7,
        "num_warps": 4,
        "ms": 5.898552894592285,
        "min_ms": 5.898552894592285,
        "max_ms": 5.898552894592285,
        "compile_time": 2.168984889984131
    },
    {
        "BLOCK_SIZE_M": 128,
        "BLOCK_SIZE_N": 64,
        "BLOCK_SIZE_K": 32,
        "GROUP_SIZE_M": 8,
        "num_stages": 5,
        "num_warps": 2,
        "ms": 5.898972988128662,
        "min_ms": 5.898972988128662,
        "max_ms": 5.898972988128662,
        "compile_time": 2.8000905513763428
    },
    {
        "BLOCK_SIZE_M": 64,
        "BLOCK_SIZE_N": 128,
        "BLOCK_SIZE_K": 32,
        "GROUP_SIZE_M": 8,
        "num_stages": 5,
        "num_warps": 4,
        "ms": 5.90108585357666,
        "min_ms": 5.90108585357666,
        "max_ms": 5.90108585357666,
        "compile_time": 2.146740436553955
    },
    {
        "BLOCK_SIZE_M": 256,
        "BLOCK_SIZE_N": 128,
        "BLOCK_SIZE_K": 32,
        "GROUP_SIZE_M": 8,
        "num_stages": 3,
        "num_warps": 16,
        "ms": 5.931272983551025,
        "min_ms": 5.931272983551025,
        "max_ms": 5.931272983551025,
        "compile_time": 2.1752936840057373
    },
    {
        "BLOCK_SIZE_M": 256,
        "BLOCK_SIZE_N": 128,
        "BLOCK_SIZE_K": 32,
        "GROUP_SIZE_M": 8,
        "num_stages": 4,
        "num_warps": 16,
        "ms": 5.933826923370361,
        "min_ms": 5.933826923370361,
        "max_ms": 5.933826923370361,
        "compile_time": 2.1680641174316406
    },
    {
        "BLOCK_SIZE_M": 256,
        "BLOCK_SIZE_N": 128,
        "BLOCK_SIZE_K": 32,
        "GROUP_SIZE_M": 8,
        "num_stages": 5,
        "num_warps": 16,
        "ms": 5.934911251068115,
        "min_ms": 5.934911251068115,
        "max_ms": 5.934911251068115,
        "compile_time": 2.2077412605285645
    },
    {
        "BLOCK_SIZE_M": 64,
        "BLOCK_SIZE_N": 256,
        "BLOCK_SIZE_K": 128,
        "GROUP_SIZE_M": 8,
        "num_stages": 3,
        "num_warps": 16,
        "ms": 5.937129020690918,
        "min_ms": 5.937129020690918,
        "max_ms": 5.937129020690918,
        "compile_time": 2.2446603775024414
    },
    {
        "BLOCK_SIZE_M": 256,
        "BLOCK_SIZE_N": 128,
        "BLOCK_SIZE_K": 32,
        "GROUP_SIZE_M": 8,
        "num_stages": 6,
        "num_warps": 16,
        "ms": 5.947958469390869,
        "min_ms": 5.947958469390869,
        "max_ms": 5.947958469390869,
        "compile_time": 2.2102973461151123
    },
    {
        "BLOCK_SIZE_M": 256,
        "BLOCK_SIZE_N": 64,
        "BLOCK_SIZE_K": 128,
        "GROUP_SIZE_M": 8,
        "num_stages": 3,
        "num_warps": 16,
        "ms": 5.948404788970947,
        "min_ms": 5.948404788970947,
        "max_ms": 5.948404788970947,
        "compile_time": 2.4171559810638428
    },
    {
        "BLOCK_SIZE_M": 128,
        "BLOCK_SIZE_N": 64,
        "BLOCK_SIZE_K": 64,
        "GROUP_SIZE_M": 8,
        "num_stages": 3,
        "num_warps": 2,
        "ms": 5.949849605560303,
        "min_ms": 5.949849605560303,
        "max_ms": 5.949849605560303,
        "compile_time": 2.89355731010437
    },
    {
        "BLOCK_SIZE_M": 128,
        "BLOCK_SIZE_N": 128,
        "BLOCK_SIZE_K": 16,
        "GROUP_SIZE_M": 8,
        "num_stages": 3,
        "num_warps": 4,
        "ms": 5.960077285766602,
        "min_ms": 5.960077285766602,
        "max_ms": 5.960077285766602,
        "compile_time": 2.290238857269287
    },
    {
        "BLOCK_SIZE_M": 256,
        "BLOCK_SIZE_N": 128,
        "BLOCK_SIZE_K": 64,
        "GROUP_SIZE_M": 8,
        "num_stages": 3,
        "num_warps": 16,
        "ms": 5.960173606872559,
        "min_ms": 5.960173606872559,
        "max_ms": 5.960173606872559,
        "compile_time": 2.3445982933044434
    },
    {
        "BLOCK_SIZE_M": 256,
        "BLOCK_SIZE_N": 128,
        "BLOCK_SIZE_K": 32,
        "GROUP_SIZE_M": 8,
        "num_stages": 7,
        "num_warps": 16,
        "ms": 5.962161540985107,
        "min_ms": 5.962161540985107,
        "max_ms": 5.962161540985107,
        "compile_time": 2.249730110168457
    },
    {
        "BLOCK_SIZE_M": 256,
        "BLOCK_SIZE_N": 128,
        "BLOCK_SIZE_K": 64,
        "GROUP_SIZE_M": 8,
        "num_stages": 4,
        "num_warps": 16,
        "ms": 5.9629926681518555,
        "min_ms": 5.9629926681518555,
        "max_ms": 5.9629926681518555,
        "compile_time": 2.3983445167541504
    },
    {
        "BLOCK_SIZE_M": 128,
        "BLOCK_SIZE_N": 64,
        "BLOCK_SIZE_K": 128,
        "GROUP_SIZE_M": 8,
        "num_stages": 4,
        "num_warps": 4,
        "ms": 5.97583532333374,
        "min_ms": 5.97583532333374,
        "max_ms": 5.97583532333374,
        "compile_time": 2.7360520362854004
    },
    {
        "BLOCK_SIZE_M": 256,
        "BLOCK_SIZE_N": 64,
        "BLOCK_SIZE_K": 64,
        "GROUP_SIZE_M": 8,
        "num_stages": 4,
        "num_warps": 16,
        "ms": 5.976700782775879,
        "min_ms": 5.976700782775879,
        "max_ms": 5.976700782775879,
        "compile_time": 2.1864511966705322
    },
    {
        "BLOCK_SIZE_M": 64,
        "BLOCK_SIZE_N": 256,
        "BLOCK_SIZE_K": 16,
        "GROUP_SIZE_M": 8,
        "num_stages": 3,
        "num_warps": 4,
        "ms": 5.982726097106934,
        "min_ms": 5.982726097106934,
        "max_ms": 5.982726097106934,
        "compile_time": 2.184619426727295
    },
    {
        "BLOCK_SIZE_M": 64,
        "BLOCK_SIZE_N": 256,
        "BLOCK_SIZE_K": 64,
        "GROUP_SIZE_M": 8,
        "num_stages": 5,
        "num_warps": 4,
        "ms": 5.987170219421387,
        "min_ms": 5.987170219421387,
        "max_ms": 5.987170219421387,
        "compile_time": 2.7406647205352783
    },
    {
        "BLOCK_SIZE_M": 128,
        "BLOCK_SIZE_N": 64,
        "BLOCK_SIZE_K": 64,
        "GROUP_SIZE_M": 8,
        "num_stages": 6,
        "num_warps": 4,
        "ms": 5.996794700622559,
        "min_ms": 5.996794700622559,
        "max_ms": 5.996794700622559,
        "compile_time": 2.4973959922790527
    },
    {
        "BLOCK_SIZE_M": 64,
        "BLOCK_SIZE_N": 128,
        "BLOCK_SIZE_K": 32,
        "GROUP_SIZE_M": 8,
        "num_stages": 3,
        "num_warps": 4,
        "ms": 6.006318092346191,
        "min_ms": 6.006318092346191,
        "max_ms": 6.006318092346191,
        "compile_time": 2.070575714111328
    },
    {
        "BLOCK_SIZE_M": 128,
        "BLOCK_SIZE_N": 256,
        "BLOCK_SIZE_K": 16,
        "GROUP_SIZE_M": 8,
        "num_stages": 3,
        "num_warps": 8,
        "ms": 6.008012771606445,
        "min_ms": 6.008012771606445,
        "max_ms": 6.008012771606445,
        "compile_time": 2.2924532890319824
    },
    {
        "BLOCK_SIZE_M": 64,
        "BLOCK_SIZE_N": 128,
        "BLOCK_SIZE_K": 64,
        "GROUP_SIZE_M": 8,
        "num_stages": 7,
        "num_warps": 4,
        "ms": 6.025830268859863,
        "min_ms": 6.025830268859863,
        "max_ms": 6.025830268859863,
        "compile_time": 2.395746946334839
    },
    {
        "BLOCK_SIZE_M": 128,
        "BLOCK_SIZE_N": 64,
        "BLOCK_SIZE_K": 64,
        "GROUP_SIZE_M": 8,
        "num_stages": 5,
        "num_warps": 4,
        "ms": 6.03786563873291,
        "min_ms": 6.03786563873291,
        "max_ms": 6.03786563873291,
        "compile_time": 2.3909659385681152
    },
    {
        "BLOCK_SIZE_M": 64,
        "BLOCK_SIZE_N": 128,
        "BLOCK_SIZE_K": 64,
        "GROUP_SIZE_M": 8,
        "num_stages": 3,
        "num_warps": 4,
        "ms": 6.0437846183776855,
        "min_ms": 6.0437846183776855,
        "max_ms": 6.0437846183776855,
        "compile_time": 2.2336745262145996
    },
    {
        "BLOCK_SIZE_M": 64,
        "BLOCK_SIZE_N": 128,
        "BLOCK_SIZE_K": 64,
        "GROUP_SIZE_M": 8,
        "num_stages": 6,
        "num_warps": 4,
        "ms": 6.045900821685791,
        "min_ms": 6.045900821685791,
        "max_ms": 6.045900821685791,
        "compile_time": 2.3042290210723877
    },
    {
        "BLOCK_SIZE_M": 64,
        "BLOCK_SIZE_N": 256,
        "BLOCK_SIZE_K": 64,
        "GROUP_SIZE_M": 8,
        "num_stages": 4,
        "num_warps": 4,
        "ms": 6.053598880767822,
        "min_ms": 6.053598880767822,
        "max_ms": 6.053598880767822,
        "compile_time": 2.8959462642669678
    },
    {
        "BLOCK_SIZE_M": 128,
        "BLOCK_SIZE_N": 64,
        "BLOCK_SIZE_K": 32,
        "GROUP_SIZE_M": 8,
        "num_stages": 6,
        "num_warps": 2,
        "ms": 6.057744979858398,
        "min_ms": 6.057744979858398,
        "max_ms": 6.057744979858398,
        "compile_time": 2.879842758178711
    },
    {
        "BLOCK_SIZE_M": 256,
        "BLOCK_SIZE_N": 64,
        "BLOCK_SIZE_K": 64,
        "GROUP_SIZE_M": 8,
        "num_stages": 5,
        "num_warps": 16,
        "ms": 6.074596405029297,
        "min_ms": 6.074596405029297,
        "max_ms": 6.074596405029297,
        "compile_time": 2.1888608932495117
    },
    {
        "BLOCK_SIZE_M": 128,
        "BLOCK_SIZE_N": 64,
        "BLOCK_SIZE_K": 32,
        "GROUP_SIZE_M": 8,
        "num_stages": 8,
        "num_warps": 4,
        "ms": 6.075005531311035,
        "min_ms": 6.075005531311035,
        "max_ms": 6.075005531311035,
        "compile_time": 2.271123170852661
    },
    {
        "BLOCK_SIZE_M": 256,
        "BLOCK_SIZE_N": 64,
        "BLOCK_SIZE_K": 64,
        "GROUP_SIZE_M": 8,
        "num_stages": 3,
        "num_warps": 16,
        "ms": 6.076319694519043,
        "min_ms": 6.076319694519043,
        "max_ms": 6.076319694519043,
        "compile_time": 2.1209516525268555
    },
    {
        "BLOCK_SIZE_M": 64,
        "BLOCK_SIZE_N": 256,
        "BLOCK_SIZE_K": 32,
        "GROUP_SIZE_M": 8,
        "num_stages": 3,
        "num_warps": 8,
        "ms": 6.095257759094238,
        "min_ms": 6.095257759094238,
        "max_ms": 6.095257759094238,
        "compile_time": 2.105724573135376
    },
    {
        "BLOCK_SIZE_M": 128,
        "BLOCK_SIZE_N": 64,
        "BLOCK_SIZE_K": 64,
        "GROUP_SIZE_M": 8,
        "num_stages": 4,
        "num_warps": 8,
        "ms": 6.096236228942871,
        "min_ms": 6.096236228942871,
        "max_ms": 6.096236228942871,
        "compile_time": 2.1434595584869385
    },
    {
        "BLOCK_SIZE_M": 64,
        "BLOCK_SIZE_N": 128,
        "BLOCK_SIZE_K": 64,
        "GROUP_SIZE_M": 8,
        "num_stages": 5,
        "num_warps": 4,
        "ms": 6.099799156188965,
        "min_ms": 6.099799156188965,
        "max_ms": 6.099799156188965,
        "compile_time": 2.277254343032837
    },
    {
        "BLOCK_SIZE_M": 64,
        "BLOCK_SIZE_N": 128,
        "BLOCK_SIZE_K": 16,
        "GROUP_SIZE_M": 8,
        "num_stages": 4,
        "num_warps": 2,
        "ms": 6.102686882019043,
        "min_ms": 6.102686882019043,
        "max_ms": 6.102686882019043,
        "compile_time": 2.2787094116210938
    },
    {
        "BLOCK_SIZE_M": 128,
        "BLOCK_SIZE_N": 64,
        "BLOCK_SIZE_K": 64,
        "GROUP_SIZE_M": 8,
        "num_stages": 2,
        "num_warps": 4,
        "ms": 6.107509613037109,
        "min_ms": 6.107509613037109,
        "max_ms": 6.107509613037109,
        "compile_time": 2.254855155944824
    },
    {
        "BLOCK_SIZE_M": 64,
        "BLOCK_SIZE_N": 256,
        "BLOCK_SIZE_K": 64,
        "GROUP_SIZE_M": 8,
        "num_stages": 3,
        "num_warps": 16,
        "ms": 6.109617710113525,
        "min_ms": 6.109617710113525,
        "max_ms": 6.109617710113525,
        "compile_time": 1.9451267719268799
    },
    {
        "BLOCK_SIZE_M": 64,
        "BLOCK_SIZE_N": 256,
        "BLOCK_SIZE_K": 64,
        "GROUP_SIZE_M": 8,
        "num_stages": 5,
        "num_warps": 16,
        "ms": 6.114701271057129,
        "min_ms": 6.114701271057129,
        "max_ms": 6.114701271057129,
        "compile_time": 1.984872579574585
    },
    {
        "BLOCK_SIZE_M": 64,
        "BLOCK_SIZE_N": 128,
        "BLOCK_SIZE_K": 16,
        "GROUP_SIZE_M": 8,
        "num_stages": 5,
        "num_warps": 2,
        "ms": 6.118628025054932,
        "min_ms": 6.118628025054932,
        "max_ms": 6.118628025054932,
        "compile_time": 2.2975785732269287
    },
    {
        "BLOCK_SIZE_M": 64,
        "BLOCK_SIZE_N": 256,
        "BLOCK_SIZE_K": 64,
        "GROUP_SIZE_M": 8,
        "num_stages": 4,
        "num_warps": 16,
        "ms": 6.125483512878418,
        "min_ms": 6.125483512878418,
        "max_ms": 6.125483512878418,
        "compile_time": 1.968480110168457
    },
    {
        "BLOCK_SIZE_M": 128,
        "BLOCK_SIZE_N": 64,
        "BLOCK_SIZE_K": 64,
        "GROUP_SIZE_M": 8,
        "num_stages": 3,
        "num_warps": 8,
        "ms": 6.127035617828369,
        "min_ms": 6.127035617828369,
        "max_ms": 6.127035617828369,
        "compile_time": 2.0498950481414795
    },
    {
        "BLOCK_SIZE_M": 64,
        "BLOCK_SIZE_N": 128,
        "BLOCK_SIZE_K": 16,
        "GROUP_SIZE_M": 8,
        "num_stages": 6,
        "num_warps": 2,
        "ms": 6.133418560028076,
        "min_ms": 6.133418560028076,
        "max_ms": 6.133418560028076,
        "compile_time": 2.31773042678833
    },
    {
        "BLOCK_SIZE_M": 64,
        "BLOCK_SIZE_N": 128,
        "BLOCK_SIZE_K": 16,
        "GROUP_SIZE_M": 8,
        "num_stages": 7,
        "num_warps": 2,
        "ms": 6.1340436935424805,
        "min_ms": 6.1340436935424805,
        "max_ms": 6.1340436935424805,
        "compile_time": 2.35241961479187
    },
    {
        "BLOCK_SIZE_M": 64,
        "BLOCK_SIZE_N": 128,
        "BLOCK_SIZE_K": 32,
        "GROUP_SIZE_M": 8,
        "num_stages": 8,
        "num_warps": 4,
        "ms": 6.147276878356934,
        "min_ms": 6.147276878356934,
        "max_ms": 6.147276878356934,
        "compile_time": 2.1160523891448975
    },
    {
        "BLOCK_SIZE_M": 256,
        "BLOCK_SIZE_N": 64,
        "BLOCK_SIZE_K": 32,
        "GROUP_SIZE_M": 8,
        "num_stages": 3,
        "num_warps": 8,
        "ms": 6.1559038162231445,
        "min_ms": 6.1559038162231445,
        "max_ms": 6.1559038162231445,
        "compile_time": 2.1524932384490967
    },
    {
        "BLOCK_SIZE_M": 64,
        "BLOCK_SIZE_N": 128,
        "BLOCK_SIZE_K": 64,
        "GROUP_SIZE_M": 8,
        "num_stages": 4,
        "num_warps": 8,
        "ms": 6.157960414886475,
        "min_ms": 6.157960414886475,
        "max_ms": 6.157960414886475,
        "compile_time": 2.0175585746765137
    },
    {
        "BLOCK_SIZE_M": 128,
        "BLOCK_SIZE_N": 64,
        "BLOCK_SIZE_K": 32,
        "GROUP_SIZE_M": 8,
        "num_stages": 7,
        "num_warps": 2,
        "ms": 6.159926414489746,
        "min_ms": 6.159926414489746,
        "max_ms": 6.159926414489746,
        "compile_time": 2.776167869567871
    },
    {
        "BLOCK_SIZE_M": 128,
        "BLOCK_SIZE_N": 64,
        "BLOCK_SIZE_K": 128,
        "GROUP_SIZE_M": 8,
        "num_stages": 4,
        "num_warps": 8,
        "ms": 6.171262264251709,
        "min_ms": 6.171262264251709,
        "max_ms": 6.171262264251709,
        "compile_time": 2.2742745876312256
    },
    {
        "BLOCK_SIZE_M": 256,
        "BLOCK_SIZE_N": 128,
        "BLOCK_SIZE_K": 16,
        "GROUP_SIZE_M": 8,
        "num_stages": 7,
        "num_warps": 8,
        "ms": 6.204095840454102,
        "min_ms": 6.204095840454102,
        "max_ms": 6.204095840454102,
        "compile_time": 2.484234571456909
    },
    {
        "BLOCK_SIZE_M": 128,
        "BLOCK_SIZE_N": 128,
        "BLOCK_SIZE_K": 16,
        "GROUP_SIZE_M": 8,
        "num_stages": 4,
        "num_warps": 8,
        "ms": 6.207705020904541,
        "min_ms": 6.207705020904541,
        "max_ms": 6.207705020904541,
        "compile_time": 2.0143346786499023
    },
    {
        "BLOCK_SIZE_M": 128,
        "BLOCK_SIZE_N": 128,
        "BLOCK_SIZE_K": 16,
        "GROUP_SIZE_M": 8,
        "num_stages": 8,
        "num_warps": 8,
        "ms": 6.209571361541748,
        "min_ms": 6.209571361541748,
        "max_ms": 6.209571361541748,
        "compile_time": 2.031454086303711
    },
    {
        "BLOCK_SIZE_M": 256,
        "BLOCK_SIZE_N": 128,
        "BLOCK_SIZE_K": 16,
        "GROUP_SIZE_M": 8,
        "num_stages": 8,
        "num_warps": 8,
        "ms": 6.2099199295043945,
        "min_ms": 6.2099199295043945,
        "max_ms": 6.2099199295043945,
        "compile_time": 2.442913055419922
    },
    {
        "BLOCK_SIZE_M": 256,
        "BLOCK_SIZE_N": 128,
        "BLOCK_SIZE_K": 16,
        "GROUP_SIZE_M": 8,
        "num_stages": 6,
        "num_warps": 8,
        "ms": 6.210508823394775,
        "min_ms": 6.210508823394775,
        "max_ms": 6.210508823394775,
        "compile_time": 2.390439748764038
    },
    {
        "BLOCK_SIZE_M": 128,
        "BLOCK_SIZE_N": 128,
        "BLOCK_SIZE_K": 16,
        "GROUP_SIZE_M": 8,
        "num_stages": 5,
        "num_warps": 8,
        "ms": 6.220041275024414,
        "min_ms": 6.220041275024414,
        "max_ms": 6.220041275024414,
        "compile_time": 2.0234529972076416
    },
    {
        "BLOCK_SIZE_M": 128,
        "BLOCK_SIZE_N": 128,
        "BLOCK_SIZE_K": 16,
        "GROUP_SIZE_M": 8,
        "num_stages": 6,
        "num_warps": 8,
        "ms": 6.228112697601318,
        "min_ms": 6.228112697601318,
        "max_ms": 6.228112697601318,
        "compile_time": 2.0033764839172363
    },
    {
        "BLOCK_SIZE_M": 64,
        "BLOCK_SIZE_N": 256,
        "BLOCK_SIZE_K": 32,
        "GROUP_SIZE_M": 8,
        "num_stages": 2,
        "num_warps": 4,
        "ms": 6.229196548461914,
        "min_ms": 6.229196548461914,
        "max_ms": 6.229196548461914,
        "compile_time": 2.5031800270080566
    },
    {
        "BLOCK_SIZE_M": 128,
        "BLOCK_SIZE_N": 128,
        "BLOCK_SIZE_K": 16,
        "GROUP_SIZE_M": 8,
        "num_stages": 7,
        "num_warps": 8,
        "ms": 6.231967926025391,
        "min_ms": 6.231967926025391,
        "max_ms": 6.231967926025391,
        "compile_time": 2.0434296131134033
    },
    {
        "BLOCK_SIZE_M": 64,
        "BLOCK_SIZE_N": 128,
        "BLOCK_SIZE_K": 128,
        "GROUP_SIZE_M": 8,
        "num_stages": 4,
        "num_warps": 4,
        "ms": 6.232209205627441,
        "min_ms": 6.232209205627441,
        "max_ms": 6.232209205627441,
        "compile_time": 2.653827428817749
    },
    {
        "BLOCK_SIZE_M": 64,
        "BLOCK_SIZE_N": 128,
        "BLOCK_SIZE_K": 64,
        "GROUP_SIZE_M": 8,
        "num_stages": 3,
        "num_warps": 2,
        "ms": 6.236605644226074,
        "min_ms": 6.236605644226074,
        "max_ms": 6.236605644226074,
        "compile_time": 2.8167974948883057
    },
    {
        "BLOCK_SIZE_M": 128,
        "BLOCK_SIZE_N": 64,
        "BLOCK_SIZE_K": 128,
        "GROUP_SIZE_M": 8,
        "num_stages": 3,
        "num_warps": 4,
        "ms": 6.2380547523498535,
        "min_ms": 6.2380547523498535,
        "max_ms": 6.2380547523498535,
        "compile_time": 2.617551565170288
    },
    {
        "BLOCK_SIZE_M": 128,
        "BLOCK_SIZE_N": 64,
        "BLOCK_SIZE_K": 64,
        "GROUP_SIZE_M": 8,
        "num_stages": 6,
        "num_warps": 8,
        "ms": 6.244665145874023,
        "min_ms": 6.244665145874023,
        "max_ms": 6.244665145874023,
        "compile_time": 2.119215726852417
    },
    {
        "BLOCK_SIZE_M": 64,
        "BLOCK_SIZE_N": 128,
        "BLOCK_SIZE_K": 64,
        "GROUP_SIZE_M": 8,
        "num_stages": 3,
        "num_warps": 8,
        "ms": 6.244929790496826,
        "min_ms": 6.244929790496826,
        "max_ms": 6.244929790496826,
        "compile_time": 1.9436326026916504
    },
    {
        "BLOCK_SIZE_M": 128,
        "BLOCK_SIZE_N": 64,
        "BLOCK_SIZE_K": 64,
        "GROUP_SIZE_M": 8,
        "num_stages": 5,
        "num_warps": 8,
        "ms": 6.258651256561279,
        "min_ms": 6.258651256561279,
        "max_ms": 6.258651256561279,
        "compile_time": 2.0984442234039307
    },
    {
        "BLOCK_SIZE_M": 128,
        "BLOCK_SIZE_N": 64,
        "BLOCK_SIZE_K": 32,
        "GROUP_SIZE_M": 8,
        "num_stages": 2,
        "num_warps": 2,
        "ms": 6.264217853546143,
        "min_ms": 6.264217853546143,
        "max_ms": 6.264217853546143,
        "compile_time": 2.473553419113159
    },
    {
        "BLOCK_SIZE_M": 256,
        "BLOCK_SIZE_N": 128,
        "BLOCK_SIZE_K": 16,
        "GROUP_SIZE_M": 8,
        "num_stages": 4,
        "num_warps": 8,
        "ms": 6.272332668304443,
        "min_ms": 6.272332668304443,
        "max_ms": 6.272332668304443,
        "compile_time": 2.415703535079956
    },
    {
        "BLOCK_SIZE_M": 64,
        "BLOCK_SIZE_N": 128,
        "BLOCK_SIZE_K": 16,
        "GROUP_SIZE_M": 8,
        "num_stages": 3,
        "num_warps": 2,
        "ms": 6.2726263999938965,
        "min_ms": 6.2726263999938965,
        "max_ms": 6.2726263999938965,
        "compile_time": 2.242403745651245
    },
    {
        "BLOCK_SIZE_M": 128,
        "BLOCK_SIZE_N": 64,
        "BLOCK_SIZE_K": 64,
        "GROUP_SIZE_M": 8,
        "num_stages": 7,
        "num_warps": 8,
        "ms": 6.284372329711914,
        "min_ms": 6.284372329711914,
        "max_ms": 6.284372329711914,
        "compile_time": 2.12790584564209
    },
    {
        "BLOCK_SIZE_M": 256,
        "BLOCK_SIZE_N": 128,
        "BLOCK_SIZE_K": 16,
        "GROUP_SIZE_M": 8,
        "num_stages": 5,
        "num_warps": 8,
        "ms": 6.287846565246582,
        "min_ms": 6.287846565246582,
        "max_ms": 6.287846565246582,
        "compile_time": 2.3854000568389893
    },
    {
        "BLOCK_SIZE_M": 128,
        "BLOCK_SIZE_N": 128,
        "BLOCK_SIZE_K": 16,
        "GROUP_SIZE_M": 8,
        "num_stages": 3,
        "num_warps": 8,
        "ms": 6.2886271476745605,
        "min_ms": 6.2886271476745605,
        "max_ms": 6.2886271476745605,
        "compile_time": 1.9654529094696045
    },
    {
        "BLOCK_SIZE_M": 64,
        "BLOCK_SIZE_N": 128,
        "BLOCK_SIZE_K": 128,
        "GROUP_SIZE_M": 8,
        "num_stages": 4,
        "num_warps": 8,
        "ms": 6.301815986633301,
        "min_ms": 6.301815986633301,
        "max_ms": 6.301815986633301,
        "compile_time": 2.1993391513824463
    },
    {
        "BLOCK_SIZE_M": 64,
        "BLOCK_SIZE_N": 128,
        "BLOCK_SIZE_K": 16,
        "GROUP_SIZE_M": 8,
        "num_stages": 4,
        "num_warps": 4,
        "ms": 6.305563449859619,
        "min_ms": 6.305563449859619,
        "max_ms": 6.305563449859619,
        "compile_time": 1.9437284469604492
    },
    {
        "BLOCK_SIZE_M": 64,
        "BLOCK_SIZE_N": 128,
        "BLOCK_SIZE_K": 64,
        "GROUP_SIZE_M": 8,
        "num_stages": 6,
        "num_warps": 8,
        "ms": 6.311068534851074,
        "min_ms": 6.311068534851074,
        "max_ms": 6.311068534851074,
        "compile_time": 2.023873805999756
    },
    {
        "BLOCK_SIZE_M": 64,
        "BLOCK_SIZE_N": 128,
        "BLOCK_SIZE_K": 64,
        "GROUP_SIZE_M": 8,
        "num_stages": 7,
        "num_warps": 8,
        "ms": 6.312297344207764,
        "min_ms": 6.312297344207764,
        "max_ms": 6.312297344207764,
        "compile_time": 2.065871000289917
    },
    {
        "BLOCK_SIZE_M": 64,
        "BLOCK_SIZE_N": 128,
        "BLOCK_SIZE_K": 16,
        "GROUP_SIZE_M": 8,
        "num_stages": 5,
        "num_warps": 4,
        "ms": 6.316380977630615,
        "min_ms": 6.316380977630615,
        "max_ms": 6.316380977630615,
        "compile_time": 1.9504194259643555
    },
    {
        "BLOCK_SIZE_M": 64,
        "BLOCK_SIZE_N": 128,
        "BLOCK_SIZE_K": 16,
        "GROUP_SIZE_M": 8,
        "num_stages": 7,
        "num_warps": 4,
        "ms": 6.333006381988525,
        "min_ms": 6.333006381988525,
        "max_ms": 6.333006381988525,
        "compile_time": 1.9530768394470215
    },
    {
        "BLOCK_SIZE_M": 64,
        "BLOCK_SIZE_N": 512,
        "BLOCK_SIZE_K": 16,
        "GROUP_SIZE_M": 8,
        "num_stages": 3,
        "num_warps": 8,
        "ms": 6.343884468078613,
        "min_ms": 6.343884468078613,
        "max_ms": 6.343884468078613,
        "compile_time": 2.1667351722717285
    },
    {
        "BLOCK_SIZE_M": 64,
        "BLOCK_SIZE_N": 128,
        "BLOCK_SIZE_K": 64,
        "GROUP_SIZE_M": 8,
        "num_stages": 2,
        "num_warps": 2,
        "ms": 6.344179153442383,
        "min_ms": 6.344179153442383,
        "max_ms": 6.344179153442383,
        "compile_time": 2.601325511932373
    },
    {
        "BLOCK_SIZE_M": 64,
        "BLOCK_SIZE_N": 128,
        "BLOCK_SIZE_K": 64,
        "GROUP_SIZE_M": 8,
        "num_stages": 5,
        "num_warps": 8,
        "ms": 6.344607353210449,
        "min_ms": 6.344607353210449,
        "max_ms": 6.344607353210449,
        "compile_time": 2.015354633331299
    },
    {
        "BLOCK_SIZE_M": 64,
        "BLOCK_SIZE_N": 128,
        "BLOCK_SIZE_K": 16,
        "GROUP_SIZE_M": 8,
        "num_stages": 6,
        "num_warps": 4,
        "ms": 6.346245765686035,
        "min_ms": 6.346245765686035,
        "max_ms": 6.346245765686035,
        "compile_time": 1.9601783752441406
    },
    {
        "BLOCK_SIZE_M": 256,
        "BLOCK_SIZE_N": 128,
        "BLOCK_SIZE_K": 16,
        "GROUP_SIZE_M": 8,
        "num_stages": 3,
        "num_warps": 8,
        "ms": 6.34653377532959,
        "min_ms": 6.34653377532959,
        "max_ms": 6.34653377532959,
        "compile_time": 2.3617780208587646
    },
    {
        "BLOCK_SIZE_M": 128,
        "BLOCK_SIZE_N": 256,
        "BLOCK_SIZE_K": 64,
        "GROUP_SIZE_M": 8,
        "num_stages": 3,
        "num_warps": 16,
        "ms": 6.347699165344238,
        "min_ms": 6.347699165344238,
        "max_ms": 6.347699165344238,
        "compile_time": 2.3000540733337402
    },
    {
        "BLOCK_SIZE_M": 64,
        "BLOCK_SIZE_N": 128,
        "BLOCK_SIZE_K": 32,
        "GROUP_SIZE_M": 8,
        "num_stages": 6,
        "num_warps": 2,
        "ms": 6.351936340332031,
        "min_ms": 6.351936340332031,
        "max_ms": 6.351936340332031,
        "compile_time": 2.6209990978240967
    },
    {
        "BLOCK_SIZE_M": 128,
        "BLOCK_SIZE_N": 64,
        "BLOCK_SIZE_K": 128,
        "GROUP_SIZE_M": 8,
        "num_stages": 3,
        "num_warps": 8,
        "ms": 6.352524757385254,
        "min_ms": 6.352524757385254,
        "max_ms": 6.352524757385254,
        "compile_time": 2.185697555541992
    },
    {
        "BLOCK_SIZE_M": 128,
        "BLOCK_SIZE_N": 256,
        "BLOCK_SIZE_K": 64,
        "GROUP_SIZE_M": 8,
        "num_stages": 4,
        "num_warps": 16,
        "ms": 6.36352014541626,
        "min_ms": 6.36352014541626,
        "max_ms": 6.36352014541626,
        "compile_time": 2.2886314392089844
    },
    {
        "BLOCK_SIZE_M": 128,
        "BLOCK_SIZE_N": 64,
        "BLOCK_SIZE_K": 64,
        "GROUP_SIZE_M": 8,
        "num_stages": 2,
        "num_warps": 2,
        "ms": 6.390092372894287,
        "min_ms": 6.390092372894287,
        "max_ms": 6.390092372894287,
        "compile_time": 2.6974945068359375
    },
    {
        "BLOCK_SIZE_M": 64,
        "BLOCK_SIZE_N": 128,
        "BLOCK_SIZE_K": 128,
        "GROUP_SIZE_M": 8,
        "num_stages": 3,
        "num_warps": 4,
        "ms": 6.393229007720947,
        "min_ms": 6.393229007720947,
        "max_ms": 6.393229007720947,
        "compile_time": 2.543707847595215
    },
    {
        "BLOCK_SIZE_M": 64,
        "BLOCK_SIZE_N": 128,
        "BLOCK_SIZE_K": 32,
        "GROUP_SIZE_M": 8,
        "num_stages": 7,
        "num_warps": 2,
        "ms": 6.400312900543213,
        "min_ms": 6.400312900543213,
        "max_ms": 6.400312900543213,
        "compile_time": 2.736496686935425
    },
    {
        "BLOCK_SIZE_M": 128,
        "BLOCK_SIZE_N": 256,
        "BLOCK_SIZE_K": 32,
        "GROUP_SIZE_M": 8,
        "num_stages": 2,
        "num_warps": 8,
        "ms": 6.408902168273926,
        "min_ms": 6.408902168273926,
        "max_ms": 6.408902168273926,
        "compile_time": 2.391963005065918
    },
    {
        "BLOCK_SIZE_M": 64,
        "BLOCK_SIZE_N": 128,
        "BLOCK_SIZE_K": 16,
        "GROUP_SIZE_M": 8,
        "num_stages": 8,
        "num_warps": 2,
        "ms": 6.4117584228515625,
        "min_ms": 6.4117584228515625,
        "max_ms": 6.4117584228515625,
        "compile_time": 2.350872755050659
    },
    {
        "BLOCK_SIZE_M": 128,
        "BLOCK_SIZE_N": 64,
        "BLOCK_SIZE_K": 32,
        "GROUP_SIZE_M": 8,
        "num_stages": 5,
        "num_warps": 8,
        "ms": 6.419467926025391,
        "min_ms": 6.419467926025391,
        "max_ms": 6.419467926025391,
        "compile_time": 2.059272050857544
    },
    {
        "BLOCK_SIZE_M": 64,
        "BLOCK_SIZE_N": 128,
        "BLOCK_SIZE_K": 16,
        "GROUP_SIZE_M": 8,
        "num_stages": 8,
        "num_warps": 4,
        "ms": 6.419516086578369,
        "min_ms": 6.419516086578369,
        "max_ms": 6.419516086578369,
        "compile_time": 2.0698585510253906
    },
    {
        "BLOCK_SIZE_M": 64,
        "BLOCK_SIZE_N": 128,
        "BLOCK_SIZE_K": 16,
        "GROUP_SIZE_M": 8,
        "num_stages": 3,
        "num_warps": 4,
        "ms": 6.43038272857666,
        "min_ms": 6.43038272857666,
        "max_ms": 6.43038272857666,
        "compile_time": 1.911508321762085
    },
    {
        "BLOCK_SIZE_M": 128,
        "BLOCK_SIZE_N": 64,
        "BLOCK_SIZE_K": 128,
        "GROUP_SIZE_M": 8,
        "num_stages": 2,
        "num_warps": 4,
        "ms": 6.4330878257751465,
        "min_ms": 6.4330878257751465,
        "max_ms": 6.4330878257751465,
        "compile_time": 2.497591495513916
    },
    {
        "BLOCK_SIZE_M": 64,
        "BLOCK_SIZE_N": 128,
        "BLOCK_SIZE_K": 32,
        "GROUP_SIZE_M": 8,
        "num_stages": 4,
        "num_warps": 8,
        "ms": 6.4385504722595215,
        "min_ms": 6.4385504722595215,
        "max_ms": 6.4385504722595215,
        "compile_time": 1.926908254623413
    },
    {
        "BLOCK_SIZE_M": 256,
        "BLOCK_SIZE_N": 128,
        "BLOCK_SIZE_K": 32,
        "GROUP_SIZE_M": 8,
        "num_stages": 2,
        "num_warps": 8,
        "ms": 6.44287109375,
        "min_ms": 6.44287109375,
        "max_ms": 6.44287109375,
        "compile_time": 2.6384477615356445
    },
    {
        "BLOCK_SIZE_M": 64,
        "BLOCK_SIZE_N": 128,
        "BLOCK_SIZE_K": 128,
        "GROUP_SIZE_M": 8,
        "num_stages": 2,
        "num_warps": 4,
        "ms": 6.449062347412109,
        "min_ms": 6.449062347412109,
        "max_ms": 6.449062347412109,
        "compile_time": 2.3847477436065674
    },
    {
        "BLOCK_SIZE_M": 64,
        "BLOCK_SIZE_N": 128,
        "BLOCK_SIZE_K": 128,
        "GROUP_SIZE_M": 8,
        "num_stages": 3,
        "num_warps": 8,
        "ms": 6.455679893493652,
        "min_ms": 6.455679893493652,
        "max_ms": 6.455679893493652,
        "compile_time": 2.1311824321746826
    },
    {
        "BLOCK_SIZE_M": 128,
        "BLOCK_SIZE_N": 64,
        "BLOCK_SIZE_K": 32,
        "GROUP_SIZE_M": 8,
        "num_stages": 4,
        "num_warps": 8,
        "ms": 6.4576568603515625,
        "min_ms": 6.4576568603515625,
        "max_ms": 6.4576568603515625,
        "compile_time": 2.0430259704589844
    },
    {
        "BLOCK_SIZE_M": 128,
        "BLOCK_SIZE_N": 128,
        "BLOCK_SIZE_K": 32,
        "GROUP_SIZE_M": 8,
        "num_stages": 3,
        "num_warps": 16,
        "ms": 6.462054252624512,
        "min_ms": 6.462054252624512,
        "max_ms": 6.462054252624512,
        "compile_time": 1.8343281745910645
    },
    {
        "BLOCK_SIZE_M": 64,
        "BLOCK_SIZE_N": 128,
        "BLOCK_SIZE_K": 32,
        "GROUP_SIZE_M": 8,
        "num_stages": 5,
        "num_warps": 8,
        "ms": 6.464800834655762,
        "min_ms": 6.464800834655762,
        "max_ms": 6.464800834655762,
        "compile_time": 1.9326975345611572
    },
    {
        "BLOCK_SIZE_M": 128,
        "BLOCK_SIZE_N": 64,
        "BLOCK_SIZE_K": 32,
        "GROUP_SIZE_M": 8,
        "num_stages": 6,
        "num_warps": 8,
        "ms": 6.471005439758301,
        "min_ms": 6.471005439758301,
        "max_ms": 6.471005439758301,
        "compile_time": 2.046910047531128
    },
    {
        "BLOCK_SIZE_M": 128,
        "BLOCK_SIZE_N": 128,
        "BLOCK_SIZE_K": 128,
        "GROUP_SIZE_M": 8,
        "num_stages": 1,
        "num_warps": 4,
        "ms": 6.472184658050537,
        "min_ms": 6.472184658050537,
        "max_ms": 6.472184658050537,
        "compile_time": 2.881574869155884
    },
    {
        "BLOCK_SIZE_M": 64,
        "BLOCK_SIZE_N": 128,
        "BLOCK_SIZE_K": 32,
        "GROUP_SIZE_M": 8,
        "num_stages": 7,
        "num_warps": 8,
        "ms": 6.479269504547119,
        "min_ms": 6.479269504547119,
        "max_ms": 6.479269504547119,
        "compile_time": 1.956130027770996
    },
    {
        "BLOCK_SIZE_M": 128,
        "BLOCK_SIZE_N": 64,
        "BLOCK_SIZE_K": 128,
        "GROUP_SIZE_M": 8,
        "num_stages": 2,
        "num_warps": 8,
        "ms": 6.481638431549072,
        "min_ms": 6.481638431549072,
        "max_ms": 6.481638431549072,
        "compile_time": 2.1486809253692627
    },
    {
        "BLOCK_SIZE_M": 64,
        "BLOCK_SIZE_N": 128,
        "BLOCK_SIZE_K": 32,
        "GROUP_SIZE_M": 8,
        "num_stages": 6,
        "num_warps": 8,
        "ms": 6.484919548034668,
        "min_ms": 6.484919548034668,
        "max_ms": 6.484919548034668,
        "compile_time": 1.942476511001587
    },
    {
        "BLOCK_SIZE_M": 128,
        "BLOCK_SIZE_N": 128,
        "BLOCK_SIZE_K": 32,
        "GROUP_SIZE_M": 8,
        "num_stages": 5,
        "num_warps": 16,
        "ms": 6.490576267242432,
        "min_ms": 6.490576267242432,
        "max_ms": 6.490576267242432,
        "compile_time": 1.8567566871643066
    },
    {
        "BLOCK_SIZE_M": 128,
        "BLOCK_SIZE_N": 64,
        "BLOCK_SIZE_K": 32,
        "GROUP_SIZE_M": 8,
        "num_stages": 7,
        "num_warps": 8,
        "ms": 6.491641998291016,
        "min_ms": 6.491641998291016,
        "max_ms": 6.491641998291016,
        "compile_time": 2.0428006649017334
    },
    {
        "BLOCK_SIZE_M": 128,
        "BLOCK_SIZE_N": 128,
        "BLOCK_SIZE_K": 32,
        "GROUP_SIZE_M": 8,
        "num_stages": 6,
        "num_warps": 16,
        "ms": 6.502877712249756,
        "min_ms": 6.502877712249756,
        "max_ms": 6.502877712249756,
        "compile_time": 2.0192947387695312
    },
    {
        "BLOCK_SIZE_M": 128,
        "BLOCK_SIZE_N": 128,
        "BLOCK_SIZE_K": 32,
        "GROUP_SIZE_M": 8,
        "num_stages": 4,
        "num_warps": 16,
        "ms": 6.519753456115723,
        "min_ms": 6.519753456115723,
        "max_ms": 6.519753456115723,
        "compile_time": 1.8429746627807617
    },
    {
        "BLOCK_SIZE_M": 256,
        "BLOCK_SIZE_N": 128,
        "BLOCK_SIZE_K": 64,
        "GROUP_SIZE_M": 8,
        "num_stages": 2,
        "num_warps": 16,
        "ms": 6.52054500579834,
        "min_ms": 6.52054500579834,
        "max_ms": 6.52054500579834,
        "compile_time": 2.2719006538391113
    },
    {
        "BLOCK_SIZE_M": 64,
        "BLOCK_SIZE_N": 128,
        "BLOCK_SIZE_K": 32,
        "GROUP_SIZE_M": 8,
        "num_stages": 3,
        "num_warps": 8,
        "ms": 6.52069091796875,
        "min_ms": 6.52069091796875,
        "max_ms": 6.52069091796875,
        "compile_time": 1.841827630996704
    },
    {
        "BLOCK_SIZE_M": 128,
        "BLOCK_SIZE_N": 128,
        "BLOCK_SIZE_K": 32,
        "GROUP_SIZE_M": 8,
        "num_stages": 7,
        "num_warps": 16,
        "ms": 6.523412227630615,
        "min_ms": 6.523412227630615,
        "max_ms": 6.523412227630615,
        "compile_time": 1.9322068691253662
    },
    {
        "BLOCK_SIZE_M": 128,
        "BLOCK_SIZE_N": 64,
        "BLOCK_SIZE_K": 32,
        "GROUP_SIZE_M": 8,
        "num_stages": 3,
        "num_warps": 8,
        "ms": 6.525824069976807,
        "min_ms": 6.525824069976807,
        "max_ms": 6.525824069976807,
        "compile_time": 1.9548733234405518
    },
    {
        "BLOCK_SIZE_M": 128,
        "BLOCK_SIZE_N": 128,
        "BLOCK_SIZE_K": 32,
        "GROUP_SIZE_M": 8,
        "num_stages": 8,
        "num_warps": 16,
        "ms": 6.532614707946777,
        "min_ms": 6.532614707946777,
        "max_ms": 6.532614707946777,
        "compile_time": 1.9046235084533691
    },
    {
        "BLOCK_SIZE_M": 128,
        "BLOCK_SIZE_N": 64,
        "BLOCK_SIZE_K": 64,
        "GROUP_SIZE_M": 8,
        "num_stages": 4,
        "num_warps": 2,
        "ms": 6.58511209487915,
        "min_ms": 6.58511209487915,
        "max_ms": 6.58511209487915,
        "compile_time": 2.9528005123138428
    },
    {
        "BLOCK_SIZE_M": 64,
        "BLOCK_SIZE_N": 128,
        "BLOCK_SIZE_K": 128,
        "GROUP_SIZE_M": 8,
        "num_stages": 2,
        "num_warps": 8,
        "ms": 6.587993621826172,
        "min_ms": 6.587993621826172,
        "max_ms": 6.587993621826172,
        "compile_time": 2.068399667739868
    },
    {
        "BLOCK_SIZE_M": 64,
        "BLOCK_SIZE_N": 256,
        "BLOCK_SIZE_K": 16,
        "GROUP_SIZE_M": 8,
        "num_stages": 3,
        "num_warps": 8,
        "ms": 6.648473262786865,
        "min_ms": 6.648473262786865,
        "max_ms": 6.648473262786865,
        "compile_time": 1.9332518577575684
    },
    {
        "BLOCK_SIZE_M": 64,
        "BLOCK_SIZE_N": 256,
        "BLOCK_SIZE_K": 16,
        "GROUP_SIZE_M": 8,
        "num_stages": 8,
        "num_warps": 8,
        "ms": 6.663718223571777,
        "min_ms": 6.663718223571777,
        "max_ms": 6.663718223571777,
        "compile_time": 1.9981334209442139
    },
    {
        "BLOCK_SIZE_M": 128,
        "BLOCK_SIZE_N": 64,
        "BLOCK_SIZE_K": 64,
        "GROUP_SIZE_M": 8,
        "num_stages": 2,
        "num_warps": 8,
        "ms": 6.670248508453369,
        "min_ms": 6.670248508453369,
        "max_ms": 6.670248508453369,
        "compile_time": 1.872020959854126
    },
    {
        "BLOCK_SIZE_M": 64,
        "BLOCK_SIZE_N": 256,
        "BLOCK_SIZE_K": 16,
        "GROUP_SIZE_M": 8,
        "num_stages": 5,
        "num_warps": 8,
        "ms": 6.673766136169434,
        "min_ms": 6.673766136169434,
        "max_ms": 6.673766136169434,
        "compile_time": 1.961925983428955
    },
    {
        "BLOCK_SIZE_M": 128,
        "BLOCK_SIZE_N": 128,
        "BLOCK_SIZE_K": 128,
        "GROUP_SIZE_M": 8,
        "num_stages": 2,
        "num_warps": 8,
        "ms": 6.674344062805176,
        "min_ms": 6.674344062805176,
        "max_ms": 6.674344062805176,
        "compile_time": 2.2252438068389893
    },
    {
        "BLOCK_SIZE_M": 256,
        "BLOCK_SIZE_N": 64,
        "BLOCK_SIZE_K": 64,
        "GROUP_SIZE_M": 8,
        "num_stages": 1,
        "num_warps": 4,
        "ms": 6.682664394378662,
        "min_ms": 6.682664394378662,
        "max_ms": 6.682664394378662,
        "compile_time": 2.6538116931915283
    },
    {
        "BLOCK_SIZE_M": 64,
        "BLOCK_SIZE_N": 256,
        "BLOCK_SIZE_K": 16,
        "GROUP_SIZE_M": 8,
        "num_stages": 7,
        "num_warps": 8,
        "ms": 6.690354824066162,
        "min_ms": 6.690354824066162,
        "max_ms": 6.690354824066162,
        "compile_time": 1.9885544776916504
    },
    {
        "BLOCK_SIZE_M": 64,
        "BLOCK_SIZE_N": 256,
        "BLOCK_SIZE_K": 16,
        "GROUP_SIZE_M": 8,
        "num_stages": 4,
        "num_warps": 8,
        "ms": 6.699788570404053,
        "min_ms": 6.699788570404053,
        "max_ms": 6.699788570404053,
        "compile_time": 1.9580082893371582
    },
    {
        "BLOCK_SIZE_M": 64,
        "BLOCK_SIZE_N": 256,
        "BLOCK_SIZE_K": 16,
        "GROUP_SIZE_M": 8,
        "num_stages": 6,
        "num_warps": 8,
        "ms": 6.706982612609863,
        "min_ms": 6.706982612609863,
        "max_ms": 6.706982612609863,
        "compile_time": 1.9784603118896484
    },
    {
        "BLOCK_SIZE_M": 64,
        "BLOCK_SIZE_N": 512,
        "BLOCK_SIZE_K": 16,
        "GROUP_SIZE_M": 8,
        "num_stages": 7,
        "num_warps": 16,
        "ms": 6.7667555809021,
        "min_ms": 6.7667555809021,
        "max_ms": 6.7667555809021,
        "compile_time": 1.962306022644043
    },
    {
        "BLOCK_SIZE_M": 64,
        "BLOCK_SIZE_N": 128,
        "BLOCK_SIZE_K": 32,
        "GROUP_SIZE_M": 8,
        "num_stages": 2,
        "num_warps": 2,
        "ms": 6.771903038024902,
        "min_ms": 6.771903038024902,
        "max_ms": 6.771903038024902,
        "compile_time": 2.4723970890045166
    },
    {
        "BLOCK_SIZE_M": 64,
        "BLOCK_SIZE_N": 128,
        "BLOCK_SIZE_K": 32,
        "GROUP_SIZE_M": 8,
        "num_stages": 2,
        "num_warps": 4,
        "ms": 6.77251672744751,
        "min_ms": 6.77251672744751,
        "max_ms": 6.77251672744751,
        "compile_time": 1.9433143138885498
    },
    {
        "BLOCK_SIZE_M": 64,
        "BLOCK_SIZE_N": 512,
        "BLOCK_SIZE_K": 16,
        "GROUP_SIZE_M": 8,
        "num_stages": 4,
        "num_warps": 16,
        "ms": 6.7734055519104,
        "min_ms": 6.7734055519104,
        "max_ms": 6.7734055519104,
        "compile_time": 1.9157607555389404
    },
    {
        "BLOCK_SIZE_M": 128,
        "BLOCK_SIZE_N": 64,
        "BLOCK_SIZE_K": 32,
        "GROUP_SIZE_M": 8,
        "num_stages": 2,
        "num_warps": 4,
        "ms": 6.780736446380615,
        "min_ms": 6.780736446380615,
        "max_ms": 6.780736446380615,
        "compile_time": 2.0459983348846436
    },
    {
        "BLOCK_SIZE_M": 64,
        "BLOCK_SIZE_N": 512,
        "BLOCK_SIZE_K": 16,
        "GROUP_SIZE_M": 8,
        "num_stages": 8,
        "num_warps": 16,
        "ms": 6.781187534332275,
        "min_ms": 6.781187534332275,
        "max_ms": 6.781187534332275,
        "compile_time": 1.9840478897094727
    },
    {
        "BLOCK_SIZE_M": 64,
        "BLOCK_SIZE_N": 128,
        "BLOCK_SIZE_K": 32,
        "GROUP_SIZE_M": 8,
        "num_stages": 8,
        "num_warps": 8,
        "ms": 6.805654048919678,
        "min_ms": 6.805654048919678,
        "max_ms": 6.805654048919678,
        "compile_time": 1.8779621124267578
    },
    {
        "BLOCK_SIZE_M": 64,
        "BLOCK_SIZE_N": 512,
        "BLOCK_SIZE_K": 16,
        "GROUP_SIZE_M": 8,
        "num_stages": 6,
        "num_warps": 16,
        "ms": 6.821874141693115,
        "min_ms": 6.821874141693115,
        "max_ms": 6.821874141693115,
        "compile_time": 1.9641201496124268
    },
    {
        "BLOCK_SIZE_M": 128,
        "BLOCK_SIZE_N": 256,
        "BLOCK_SIZE_K": 64,
        "GROUP_SIZE_M": 8,
        "num_stages": 2,
        "num_warps": 16,
        "ms": 6.8312506675720215,
        "min_ms": 6.8312506675720215,
        "max_ms": 6.8312506675720215,
        "compile_time": 2.2188374996185303
    },
    {
        "BLOCK_SIZE_M": 64,
        "BLOCK_SIZE_N": 512,
        "BLOCK_SIZE_K": 16,
        "GROUP_SIZE_M": 8,
        "num_stages": 5,
        "num_warps": 16,
        "ms": 6.848471641540527,
        "min_ms": 6.848471641540527,
        "max_ms": 6.848471641540527,
        "compile_time": 1.9453513622283936
    },
    {
        "BLOCK_SIZE_M": 64,
        "BLOCK_SIZE_N": 128,
        "BLOCK_SIZE_K": 64,
        "GROUP_SIZE_M": 8,
        "num_stages": 2,
        "num_warps": 8,
        "ms": 6.858824729919434,
        "min_ms": 6.858824729919434,
        "max_ms": 6.858824729919434,
        "compile_time": 1.817781686782837
    },
    {
        "BLOCK_SIZE_M": 128,
        "BLOCK_SIZE_N": 64,
        "BLOCK_SIZE_K": 32,
        "GROUP_SIZE_M": 8,
        "num_stages": 8,
        "num_warps": 8,
        "ms": 6.866097450256348,
        "min_ms": 6.866097450256348,
        "max_ms": 6.866097450256348,
        "compile_time": 1.9764819145202637
    },
    {
        "BLOCK_SIZE_M": 64,
        "BLOCK_SIZE_N": 512,
        "BLOCK_SIZE_K": 16,
        "GROUP_SIZE_M": 8,
        "num_stages": 3,
        "num_warps": 16,
        "ms": 6.906733512878418,
        "min_ms": 6.906733512878418,
        "max_ms": 6.906733512878418,
        "compile_time": 1.8727433681488037
    },
    {
        "BLOCK_SIZE_M": 512,
        "BLOCK_SIZE_N": 64,
        "BLOCK_SIZE_K": 64,
        "GROUP_SIZE_M": 8,
        "num_stages": 2,
        "num_warps": 8,
        "ms": 6.919914245605469,
        "min_ms": 6.919914245605469,
        "max_ms": 6.919914245605469,
        "compile_time": 2.9405899047851562
    },
    {
        "BLOCK_SIZE_M": 128,
        "BLOCK_SIZE_N": 256,
        "BLOCK_SIZE_K": 128,
        "GROUP_SIZE_M": 8,
        "num_stages": 2,
        "num_warps": 8,
        "ms": 6.922137260437012,
        "min_ms": 6.922137260437012,
        "max_ms": 6.922137260437012,
        "compile_time": 2.9524781703948975
    },
    {
        "BLOCK_SIZE_M": 128,
        "BLOCK_SIZE_N": 256,
        "BLOCK_SIZE_K": 128,
        "GROUP_SIZE_M": 8,
        "num_stages": 1,
        "num_warps": 16,
        "ms": 6.970412254333496,
        "min_ms": 6.970412254333496,
        "max_ms": 6.970412254333496,
        "compile_time": 2.1902475357055664
    },
    {
        "BLOCK_SIZE_M": 64,
        "BLOCK_SIZE_N": 128,
        "BLOCK_SIZE_K": 64,
        "GROUP_SIZE_M": 8,
        "num_stages": 2,
        "num_warps": 4,
        "ms": 6.97445011138916,
        "min_ms": 6.97445011138916,
        "max_ms": 6.97445011138916,
        "compile_time": 2.0647966861724854
    },
    {
        "BLOCK_SIZE_M": 128,
        "BLOCK_SIZE_N": 128,
        "BLOCK_SIZE_K": 32,
        "GROUP_SIZE_M": 8,
        "num_stages": 1,
        "num_warps": 8,
        "ms": 6.97747802734375,
        "min_ms": 6.97747802734375,
        "max_ms": 6.97747802734375,
        "compile_time": 1.903869390487671
    },
    {
        "BLOCK_SIZE_M": 256,
        "BLOCK_SIZE_N": 128,
        "BLOCK_SIZE_K": 128,
        "GROUP_SIZE_M": 8,
        "num_stages": 2,
        "num_warps": 16,
        "ms": 7.047656059265137,
        "min_ms": 7.047656059265137,
        "max_ms": 7.047656059265137,
        "compile_time": 2.379568576812744
    },
    {
        "BLOCK_SIZE_M": 128,
        "BLOCK_SIZE_N": 128,
        "BLOCK_SIZE_K": 32,
        "GROUP_SIZE_M": 8,
        "num_stages": 1,
        "num_warps": 4,
        "ms": 7.076659202575684,
        "min_ms": 7.076659202575684,
        "max_ms": 7.076659202575684,
        "compile_time": 2.2787246704101562
    },
    {
        "BLOCK_SIZE_M": 128,
        "BLOCK_SIZE_N": 128,
        "BLOCK_SIZE_K": 128,
        "GROUP_SIZE_M": 8,
        "num_stages": 2,
        "num_warps": 16,
        "ms": 7.102999687194824,
        "min_ms": 7.102999687194824,
        "max_ms": 7.102999687194824,
        "compile_time": 2.009829521179199
    },
    {
        "BLOCK_SIZE_M": 64,
        "BLOCK_SIZE_N": 256,
        "BLOCK_SIZE_K": 32,
        "GROUP_SIZE_M": 8,
        "num_stages": 7,
        "num_warps": 16,
        "ms": 7.109281063079834,
        "min_ms": 7.109281063079834,
        "max_ms": 7.109281063079834,
        "compile_time": 1.8684971332550049
    },
    {
        "BLOCK_SIZE_M": 128,
        "BLOCK_SIZE_N": 128,
        "BLOCK_SIZE_K": 256,
        "GROUP_SIZE_M": 8,
        "num_stages": 2,
        "num_warps": 8,
        "ms": 7.114373683929443,
        "min_ms": 7.114373683929443,
        "max_ms": 7.114373683929443,
        "compile_time": 2.884979248046875
    },
    {
        "BLOCK_SIZE_M": 256,
        "BLOCK_SIZE_N": 128,
        "BLOCK_SIZE_K": 64,
        "GROUP_SIZE_M": 8,
        "num_stages": 1,
        "num_warps": 8,
        "ms": 7.126267910003662,
        "min_ms": 7.126267910003662,
        "max_ms": 7.126267910003662,
        "compile_time": 2.4757180213928223
    },
    {
        "BLOCK_SIZE_M": 128,
        "BLOCK_SIZE_N": 128,
        "BLOCK_SIZE_K": 64,
        "GROUP_SIZE_M": 8,
        "num_stages": 1,
        "num_warps": 4,
        "ms": 7.127764701843262,
        "min_ms": 7.127764701843262,
        "max_ms": 7.127764701843262,
        "compile_time": 2.4261794090270996
    },
    {
        "BLOCK_SIZE_M": 64,
        "BLOCK_SIZE_N": 256,
        "BLOCK_SIZE_K": 32,
        "GROUP_SIZE_M": 8,
        "num_stages": 8,
        "num_warps": 16,
        "ms": 7.127918243408203,
        "min_ms": 7.127918243408203,
        "max_ms": 7.127918243408203,
        "compile_time": 1.8742566108703613
    },
    {
        "BLOCK_SIZE_M": 64,
        "BLOCK_SIZE_N": 256,
        "BLOCK_SIZE_K": 32,
        "GROUP_SIZE_M": 8,
        "num_stages": 3,
        "num_warps": 16,
        "ms": 7.128064155578613,
        "min_ms": 7.128064155578613,
        "max_ms": 7.128064155578613,
        "compile_time": 1.8834218978881836
    },
    {
        "BLOCK_SIZE_M": 64,
        "BLOCK_SIZE_N": 256,
        "BLOCK_SIZE_K": 32,
        "GROUP_SIZE_M": 8,
        "num_stages": 5,
        "num_warps": 16,
        "ms": 7.131983757019043,
        "min_ms": 7.131983757019043,
        "max_ms": 7.131983757019043,
        "compile_time": 1.8611102104187012
    },
    {
        "BLOCK_SIZE_M": 64,
        "BLOCK_SIZE_N": 64,
        "BLOCK_SIZE_K": 64,
        "GROUP_SIZE_M": 8,
        "num_stages": 4,
        "num_warps": 2,
        "ms": 7.1354079246521,
        "min_ms": 7.1354079246521,
        "max_ms": 7.1354079246521,
        "compile_time": 2.219836711883545
    },
    {
        "BLOCK_SIZE_M": 128,
        "BLOCK_SIZE_N": 128,
        "BLOCK_SIZE_K": 64,
        "GROUP_SIZE_M": 8,
        "num_stages": 2,
        "num_warps": 8,
        "ms": 7.140430450439453,
        "min_ms": 7.140430450439453,
        "max_ms": 7.140430450439453,
        "compile_time": 2.1438910961151123
    },
    {
        "BLOCK_SIZE_M": 64,
        "BLOCK_SIZE_N": 256,
        "BLOCK_SIZE_K": 32,
        "GROUP_SIZE_M": 8,
        "num_stages": 4,
        "num_warps": 16,
        "ms": 7.140878200531006,
        "min_ms": 7.140878200531006,
        "max_ms": 7.140878200531006,
        "compile_time": 1.864678144454956
    },
    {
        "BLOCK_SIZE_M": 64,
        "BLOCK_SIZE_N": 256,
        "BLOCK_SIZE_K": 32,
        "GROUP_SIZE_M": 8,
        "num_stages": 6,
        "num_warps": 16,
        "ms": 7.14125919342041,
        "min_ms": 7.14125919342041,
        "max_ms": 7.14125919342041,
        "compile_time": 1.8638451099395752
    },
    {
        "BLOCK_SIZE_M": 64,
        "BLOCK_SIZE_N": 64,
        "BLOCK_SIZE_K": 32,
        "GROUP_SIZE_M": 8,
        "num_stages": 5,
        "num_warps": 2,
        "ms": 7.16690731048584,
        "min_ms": 7.16690731048584,
        "max_ms": 7.16690731048584,
        "compile_time": 2.126004695892334
    },
    {
        "BLOCK_SIZE_M": 64,
        "BLOCK_SIZE_N": 64,
        "BLOCK_SIZE_K": 32,
        "GROUP_SIZE_M": 8,
        "num_stages": 6,
        "num_warps": 2,
        "ms": 7.1675214767456055,
        "min_ms": 7.1675214767456055,
        "max_ms": 7.1675214767456055,
        "compile_time": 2.154716730117798
    },
    {
        "BLOCK_SIZE_M": 256,
        "BLOCK_SIZE_N": 128,
        "BLOCK_SIZE_K": 64,
        "GROUP_SIZE_M": 8,
        "num_stages": 1,
        "num_warps": 16,
        "ms": 7.170567989349365,
        "min_ms": 7.170567989349365,
        "max_ms": 7.170567989349365,
        "compile_time": 2.0926928520202637
    },
    {
        "BLOCK_SIZE_M": 128,
        "BLOCK_SIZE_N": 256,
        "BLOCK_SIZE_K": 16,
        "GROUP_SIZE_M": 8,
        "num_stages": 5,
        "num_warps": 16,
        "ms": 7.17471170425415,
        "min_ms": 7.17471170425415,
        "max_ms": 7.17471170425415,
        "compile_time": 1.9206547737121582
    },
    {
        "BLOCK_SIZE_M": 64,
        "BLOCK_SIZE_N": 64,
        "BLOCK_SIZE_K": 32,
        "GROUP_SIZE_M": 8,
        "num_stages": 7,
        "num_warps": 2,
        "ms": 7.201723575592041,
        "min_ms": 7.201723575592041,
        "max_ms": 7.201723575592041,
        "compile_time": 2.1715385913848877
    },
    {
        "BLOCK_SIZE_M": 64,
        "BLOCK_SIZE_N": 64,
        "BLOCK_SIZE_K": 32,
        "GROUP_SIZE_M": 8,
        "num_stages": 3,
        "num_warps": 2,
        "ms": 7.206393241882324,
        "min_ms": 7.206393241882324,
        "max_ms": 7.206393241882324,
        "compile_time": 2.0690155029296875
    },
    {
        "BLOCK_SIZE_M": 128,
        "BLOCK_SIZE_N": 256,
        "BLOCK_SIZE_K": 16,
        "GROUP_SIZE_M": 8,
        "num_stages": 3,
        "num_warps": 16,
        "ms": 7.2082037925720215,
        "min_ms": 7.2082037925720215,
        "max_ms": 7.2082037925720215,
        "compile_time": 1.977241039276123
    },
    {
        "BLOCK_SIZE_M": 64,
        "BLOCK_SIZE_N": 512,
        "BLOCK_SIZE_K": 32,
        "GROUP_SIZE_M": 8,
        "num_stages": 2,
        "num_warps": 8,
        "ms": 7.209242820739746,
        "min_ms": 7.209242820739746,
        "max_ms": 7.209242820739746,
        "compile_time": 2.3387653827667236
    },
    {
        "BLOCK_SIZE_M": 128,
        "BLOCK_SIZE_N": 256,
        "BLOCK_SIZE_K": 128,
        "GROUP_SIZE_M": 8,
        "num_stages": 1,
        "num_warps": 8,
        "ms": 7.2127885818481445,
        "min_ms": 7.2127885818481445,
        "max_ms": 7.2127885818481445,
        "compile_time": 2.7535831928253174
    },
    {
        "BLOCK_SIZE_M": 64,
        "BLOCK_SIZE_N": 64,
        "BLOCK_SIZE_K": 64,
        "GROUP_SIZE_M": 8,
        "num_stages": 3,
        "num_warps": 2,
        "ms": 7.216245174407959,
        "min_ms": 7.216245174407959,
        "max_ms": 7.216245174407959,
        "compile_time": 2.189767837524414
    },
    {
        "BLOCK_SIZE_M": 256,
        "BLOCK_SIZE_N": 64,
        "BLOCK_SIZE_K": 32,
        "GROUP_SIZE_M": 8,
        "num_stages": 4,
        "num_warps": 16,
        "ms": 7.243907928466797,
        "min_ms": 7.243907928466797,
        "max_ms": 7.243907928466797,
        "compile_time": 2.0730526447296143
    },
    {
        "BLOCK_SIZE_M": 256,
        "BLOCK_SIZE_N": 64,
        "BLOCK_SIZE_K": 32,
        "GROUP_SIZE_M": 8,
        "num_stages": 6,
        "num_warps": 16,
        "ms": 7.246145725250244,
        "min_ms": 7.246145725250244,
        "max_ms": 7.246145725250244,
        "compile_time": 2.0938587188720703
    },
    {
        "BLOCK_SIZE_M": 128,
        "BLOCK_SIZE_N": 128,
        "BLOCK_SIZE_K": 128,
        "GROUP_SIZE_M": 8,
        "num_stages": 3,
        "num_warps": 32,
        "ms": 7.251605987548828,
        "min_ms": 7.251605987548828,
        "max_ms": 7.251605987548828,
        "compile_time": 1.8775970935821533
    },
    {
        "BLOCK_SIZE_M": 64,
        "BLOCK_SIZE_N": 64,
        "BLOCK_SIZE_K": 64,
        "GROUP_SIZE_M": 8,
        "num_stages": 4,
        "num_warps": 4,
        "ms": 7.261228084564209,
        "min_ms": 7.261228084564209,
        "max_ms": 7.261228084564209,
        "compile_time": 1.9277195930480957
    },
    {
        "BLOCK_SIZE_M": 128,
        "BLOCK_SIZE_N": 64,
        "BLOCK_SIZE_K": 32,
        "GROUP_SIZE_M": 8,
        "num_stages": 1,
        "num_warps": 2,
        "ms": 7.270210266113281,
        "min_ms": 7.270210266113281,
        "max_ms": 7.270210266113281,
        "compile_time": 2.35353422164917
    },
    {
        "BLOCK_SIZE_M": 256,
        "BLOCK_SIZE_N": 64,
        "BLOCK_SIZE_K": 32,
        "GROUP_SIZE_M": 8,
        "num_stages": 8,
        "num_warps": 16,
        "ms": 7.281838893890381,
        "min_ms": 7.281838893890381,
        "max_ms": 7.281838893890381,
        "compile_time": 2.0949060916900635
    },
    {
        "BLOCK_SIZE_M": 256,
        "BLOCK_SIZE_N": 64,
        "BLOCK_SIZE_K": 32,
        "GROUP_SIZE_M": 8,
        "num_stages": 7,
        "num_warps": 16,
        "ms": 7.28720760345459,
        "min_ms": 7.28720760345459,
        "max_ms": 7.28720760345459,
        "compile_time": 2.0853984355926514
    },
    {
        "BLOCK_SIZE_M": 64,
        "BLOCK_SIZE_N": 64,
        "BLOCK_SIZE_K": 64,
        "GROUP_SIZE_M": 8,
        "num_stages": 3,
        "num_warps": 4,
        "ms": 7.288612365722656,
        "min_ms": 7.288612365722656,
        "max_ms": 7.288612365722656,
        "compile_time": 1.9160916805267334
    },
    {
        "BLOCK_SIZE_M": 64,
        "BLOCK_SIZE_N": 64,
        "BLOCK_SIZE_K": 32,
        "GROUP_SIZE_M": 8,
        "num_stages": 6,
        "num_warps": 4,
        "ms": 7.289527893066406,
        "min_ms": 7.289527893066406,
        "max_ms": 7.289527893066406,
        "compile_time": 1.9453041553497314
    },
    {
        "BLOCK_SIZE_M": 64,
        "BLOCK_SIZE_N": 64,
        "BLOCK_SIZE_K": 32,
        "GROUP_SIZE_M": 8,
        "num_stages": 4,
        "num_warps": 4,
        "ms": 7.291603088378906,
        "min_ms": 7.291603088378906,
        "max_ms": 7.291603088378906,
        "compile_time": 1.9344215393066406
    },
    {
        "BLOCK_SIZE_M": 256,
        "BLOCK_SIZE_N": 64,
        "BLOCK_SIZE_K": 32,
        "GROUP_SIZE_M": 8,
        "num_stages": 3,
        "num_warps": 16,
        "ms": 7.307337284088135,
        "min_ms": 7.307337284088135,
        "max_ms": 7.307337284088135,
        "compile_time": 2.0111196041107178
    },
    {
        "BLOCK_SIZE_M": 64,
        "BLOCK_SIZE_N": 64,
        "BLOCK_SIZE_K": 32,
        "GROUP_SIZE_M": 8,
        "num_stages": 5,
        "num_warps": 4,
        "ms": 7.309776306152344,
        "min_ms": 7.309776306152344,
        "max_ms": 7.309776306152344,
        "compile_time": 1.9142086505889893
    },
    {
        "BLOCK_SIZE_M": 64,
        "BLOCK_SIZE_N": 64,
        "BLOCK_SIZE_K": 32,
        "GROUP_SIZE_M": 8,
        "num_stages": 3,
        "num_warps": 4,
        "ms": 7.3203840255737305,
        "min_ms": 7.3203840255737305,
        "max_ms": 7.3203840255737305,
        "compile_time": 1.9088289737701416
    },
    {
        "BLOCK_SIZE_M": 64,
        "BLOCK_SIZE_N": 64,
        "BLOCK_SIZE_K": 64,
        "GROUP_SIZE_M": 8,
        "num_stages": 6,
        "num_warps": 4,
        "ms": 7.325652122497559,
        "min_ms": 7.325652122497559,
        "max_ms": 7.325652122497559,
        "compile_time": 2.006854295730591
    },
    {
        "BLOCK_SIZE_M": 64,
        "BLOCK_SIZE_N": 128,
        "BLOCK_SIZE_K": 64,
        "GROUP_SIZE_M": 8,
        "num_stages": 4,
        "num_warps": 2,
        "ms": 7.328011512756348,
        "min_ms": 7.328011512756348,
        "max_ms": 7.328011512756348,
        "compile_time": 2.836388349533081
    },
    {
        "BLOCK_SIZE_M": 256,
        "BLOCK_SIZE_N": 64,
        "BLOCK_SIZE_K": 32,
        "GROUP_SIZE_M": 8,
        "num_stages": 5,
        "num_warps": 16,
        "ms": 7.335540771484375,
        "min_ms": 7.335540771484375,
        "max_ms": 7.335540771484375,
        "compile_time": 2.0947930812835693
    },
    {
        "BLOCK_SIZE_M": 512,
        "BLOCK_SIZE_N": 64,
        "BLOCK_SIZE_K": 32,
        "GROUP_SIZE_M": 8,
        "num_stages": 2,
        "num_warps": 8,
        "ms": 7.352241516113281,
        "min_ms": 7.352241516113281,
        "max_ms": 7.352241516113281,
        "compile_time": 2.772508382797241
    },
    {
        "BLOCK_SIZE_M": 64,
        "BLOCK_SIZE_N": 64,
        "BLOCK_SIZE_K": 32,
        "GROUP_SIZE_M": 8,
        "num_stages": 7,
        "num_warps": 4,
        "ms": 7.356005668640137,
        "min_ms": 7.356005668640137,
        "max_ms": 7.356005668640137,
        "compile_time": 1.9464893341064453
    },
    {
        "BLOCK_SIZE_M": 256,
        "BLOCK_SIZE_N": 64,
        "BLOCK_SIZE_K": 16,
        "GROUP_SIZE_M": 8,
        "num_stages": 7,
        "num_warps": 4,
        "ms": 7.368404388427734,
        "min_ms": 7.368404388427734,
        "max_ms": 7.368404388427734,
        "compile_time": 2.4854936599731445
    },
    {
        "BLOCK_SIZE_M": 128,
        "BLOCK_SIZE_N": 64,
        "BLOCK_SIZE_K": 16,
        "GROUP_SIZE_M": 8,
        "num_stages": 3,
        "num_warps": 2,
        "ms": 7.370814323425293,
        "min_ms": 7.370814323425293,
        "max_ms": 7.370814323425293,
        "compile_time": 2.2735185623168945
    },
    {
        "BLOCK_SIZE_M": 128,
        "BLOCK_SIZE_N": 256,
        "BLOCK_SIZE_K": 16,
        "GROUP_SIZE_M": 8,
        "num_stages": 4,
        "num_warps": 16,
        "ms": 7.371145725250244,
        "min_ms": 7.371145725250244,
        "max_ms": 7.371145725250244,
        "compile_time": 1.955542802810669
    },
    {
        "BLOCK_SIZE_M": 64,
        "BLOCK_SIZE_N": 64,
        "BLOCK_SIZE_K": 32,
        "GROUP_SIZE_M": 8,
        "num_stages": 8,
        "num_warps": 4,
        "ms": 7.373589992523193,
        "min_ms": 7.373589992523193,
        "max_ms": 7.373589992523193,
        "compile_time": 1.899951457977295
    },
    {
        "BLOCK_SIZE_M": 128,
        "BLOCK_SIZE_N": 64,
        "BLOCK_SIZE_K": 16,
        "GROUP_SIZE_M": 8,
        "num_stages": 5,
        "num_warps": 2,
        "ms": 7.374658107757568,
        "min_ms": 7.374658107757568,
        "max_ms": 7.374658107757568,
        "compile_time": 2.348412275314331
    },
    {
        "BLOCK_SIZE_M": 128,
        "BLOCK_SIZE_N": 64,
        "BLOCK_SIZE_K": 16,
        "GROUP_SIZE_M": 8,
        "num_stages": 6,
        "num_warps": 2,
        "ms": 7.381495475769043,
        "min_ms": 7.381495475769043,
        "max_ms": 7.381495475769043,
        "compile_time": 2.342719793319702
    },
    {
        "BLOCK_SIZE_M": 128,
        "BLOCK_SIZE_N": 256,
        "BLOCK_SIZE_K": 16,
        "GROUP_SIZE_M": 8,
        "num_stages": 6,
        "num_warps": 16,
        "ms": 7.384253025054932,
        "min_ms": 7.384253025054932,
        "max_ms": 7.384253025054932,
        "compile_time": 1.9480667114257812
    },
    {
        "BLOCK_SIZE_M": 128,
        "BLOCK_SIZE_N": 256,
        "BLOCK_SIZE_K": 16,
        "GROUP_SIZE_M": 8,
        "num_stages": 8,
        "num_warps": 16,
        "ms": 7.386711120605469,
        "min_ms": 7.386711120605469,
        "max_ms": 7.386711120605469,
        "compile_time": 1.9835529327392578
    },
    {
        "BLOCK_SIZE_M": 128,
        "BLOCK_SIZE_N": 64,
        "BLOCK_SIZE_K": 16,
        "GROUP_SIZE_M": 8,
        "num_stages": 7,
        "num_warps": 2,
        "ms": 7.387282371520996,
        "min_ms": 7.387282371520996,
        "max_ms": 7.387282371520996,
        "compile_time": 2.4330806732177734
    },
    {
        "BLOCK_SIZE_M": 256,
        "BLOCK_SIZE_N": 128,
        "BLOCK_SIZE_K": 16,
        "GROUP_SIZE_M": 8,
        "num_stages": 5,
        "num_warps": 16,
        "ms": 7.390444278717041,
        "min_ms": 7.390444278717041,
        "max_ms": 7.390444278717041,
        "compile_time": 2.040916681289673
    },
    {
        "BLOCK_SIZE_M": 256,
        "BLOCK_SIZE_N": 64,
        "BLOCK_SIZE_K": 16,
        "GROUP_SIZE_M": 8,
        "num_stages": 6,
        "num_warps": 4,
        "ms": 7.392964839935303,
        "min_ms": 7.392964839935303,
        "max_ms": 7.392964839935303,
        "compile_time": 2.4134254455566406
    },
    {
        "BLOCK_SIZE_M": 256,
        "BLOCK_SIZE_N": 64,
        "BLOCK_SIZE_K": 16,
        "GROUP_SIZE_M": 8,
        "num_stages": 8,
        "num_warps": 4,
        "ms": 7.393484592437744,
        "min_ms": 7.393484592437744,
        "max_ms": 7.393484592437744,
        "compile_time": 2.469651937484741
    },
    {
        "BLOCK_SIZE_M": 128,
        "BLOCK_SIZE_N": 256,
        "BLOCK_SIZE_K": 16,
        "GROUP_SIZE_M": 8,
        "num_stages": 7,
        "num_warps": 16,
        "ms": 7.395327568054199,
        "min_ms": 7.395327568054199,
        "max_ms": 7.395327568054199,
        "compile_time": 2.0639493465423584
    },
    {
        "BLOCK_SIZE_M": 256,
        "BLOCK_SIZE_N": 128,
        "BLOCK_SIZE_K": 16,
        "GROUP_SIZE_M": 8,
        "num_stages": 3,
        "num_warps": 16,
        "ms": 7.398163795471191,
        "min_ms": 7.398163795471191,
        "max_ms": 7.398163795471191,
        "compile_time": 2.082550525665283
    },
    {
        "BLOCK_SIZE_M": 128,
        "BLOCK_SIZE_N": 64,
        "BLOCK_SIZE_K": 16,
        "GROUP_SIZE_M": 8,
        "num_stages": 4,
        "num_warps": 2,
        "ms": 7.403636932373047,
        "min_ms": 7.403636932373047,
        "max_ms": 7.403636932373047,
        "compile_time": 2.3301494121551514
    },
    {
        "BLOCK_SIZE_M": 256,
        "BLOCK_SIZE_N": 64,
        "BLOCK_SIZE_K": 16,
        "GROUP_SIZE_M": 8,
        "num_stages": 4,
        "num_warps": 4,
        "ms": 7.412878513336182,
        "min_ms": 7.412878513336182,
        "max_ms": 7.412878513336182,
        "compile_time": 2.4037957191467285
    },
    {
        "BLOCK_SIZE_M": 64,
        "BLOCK_SIZE_N": 512,
        "BLOCK_SIZE_K": 32,
        "GROUP_SIZE_M": 8,
        "num_stages": 3,
        "num_warps": 16,
        "ms": 7.414090633392334,
        "min_ms": 7.414090633392334,
        "max_ms": 7.414090633392334,
        "compile_time": 1.9739673137664795
    },
    {
        "BLOCK_SIZE_M": 128,
        "BLOCK_SIZE_N": 256,
        "BLOCK_SIZE_K": 64,
        "GROUP_SIZE_M": 8,
        "num_stages": 1,
        "num_warps": 16,
        "ms": 7.415886878967285,
        "min_ms": 7.415886878967285,
        "max_ms": 7.415886878967285,
        "compile_time": 1.9925076961517334
    },
    {
        "BLOCK_SIZE_M": 256,
        "BLOCK_SIZE_N": 64,
        "BLOCK_SIZE_K": 16,
        "GROUP_SIZE_M": 8,
        "num_stages": 5,
        "num_warps": 4,
        "ms": 7.425480842590332,
        "min_ms": 7.425480842590332,
        "max_ms": 7.425480842590332,
        "compile_time": 2.4249823093414307
    },
    {
        "BLOCK_SIZE_M": 64,
        "BLOCK_SIZE_N": 64,
        "BLOCK_SIZE_K": 64,
        "GROUP_SIZE_M": 8,
        "num_stages": 5,
        "num_warps": 2,
        "ms": 7.425492286682129,
        "min_ms": 7.425492286682129,
        "max_ms": 7.425492286682129,
        "compile_time": 2.3198819160461426
    },
    {
        "BLOCK_SIZE_M": 64,
        "BLOCK_SIZE_N": 64,
        "BLOCK_SIZE_K": 64,
        "GROUP_SIZE_M": 8,
        "num_stages": 6,
        "num_warps": 2,
        "ms": 7.426764488220215,
        "min_ms": 7.426764488220215,
        "max_ms": 7.426764488220215,
        "compile_time": 2.388847589492798
    },
    {
        "BLOCK_SIZE_M": 64,
        "BLOCK_SIZE_N": 512,
        "BLOCK_SIZE_K": 32,
        "GROUP_SIZE_M": 8,
        "num_stages": 4,
        "num_warps": 16,
        "ms": 7.437989711761475,
        "min_ms": 7.437989711761475,
        "max_ms": 7.437989711761475,
        "compile_time": 2.056309223175049
    },
    {
        "BLOCK_SIZE_M": 64,
        "BLOCK_SIZE_N": 64,
        "BLOCK_SIZE_K": 64,
        "GROUP_SIZE_M": 8,
        "num_stages": 5,
        "num_warps": 4,
        "ms": 7.450009346008301,
        "min_ms": 7.450009346008301,
        "max_ms": 7.450009346008301,
        "compile_time": 1.9857473373413086
    },
    {
        "BLOCK_SIZE_M": 64,
        "BLOCK_SIZE_N": 512,
        "BLOCK_SIZE_K": 32,
        "GROUP_SIZE_M": 8,
        "num_stages": 5,
        "num_warps": 16,
        "ms": 7.463479518890381,
        "min_ms": 7.463479518890381,
        "max_ms": 7.463479518890381,
        "compile_time": 2.0422847270965576
    },
    {
        "BLOCK_SIZE_M": 128,
        "BLOCK_SIZE_N": 64,
        "BLOCK_SIZE_K": 64,
        "GROUP_SIZE_M": 8,
        "num_stages": 1,
        "num_warps": 4,
        "ms": 7.464199066162109,
        "min_ms": 7.464199066162109,
        "max_ms": 7.464199066162109,
        "compile_time": 2.0961503982543945
    },
    {
        "BLOCK_SIZE_M": 64,
        "BLOCK_SIZE_N": 64,
        "BLOCK_SIZE_K": 32,
        "GROUP_SIZE_M": 8,
        "num_stages": 4,
        "num_warps": 2,
        "ms": 7.476988315582275,
        "min_ms": 7.476988315582275,
        "max_ms": 7.476988315582275,
        "compile_time": 2.157874345779419
    },
    {
        "BLOCK_SIZE_M": 256,
        "BLOCK_SIZE_N": 64,
        "BLOCK_SIZE_K": 16,
        "GROUP_SIZE_M": 8,
        "num_stages": 3,
        "num_warps": 4,
        "ms": 7.492356300354004,
        "min_ms": 7.492356300354004,
        "max_ms": 7.492356300354004,
        "compile_time": 2.364779233932495
    },
    {
        "BLOCK_SIZE_M": 64,
        "BLOCK_SIZE_N": 64,
        "BLOCK_SIZE_K": 32,
        "GROUP_SIZE_M": 8,
        "num_stages": 8,
        "num_warps": 2,
        "ms": 7.492535591125488,
        "min_ms": 7.492535591125488,
        "max_ms": 7.492535591125488,
        "compile_time": 2.176142692565918
    },
    {
        "BLOCK_SIZE_M": 256,
        "BLOCK_SIZE_N": 64,
        "BLOCK_SIZE_K": 32,
        "GROUP_SIZE_M": 8,
        "num_stages": 1,
        "num_warps": 4,
        "ms": 7.506503105163574,
        "min_ms": 7.506503105163574,
        "max_ms": 7.506503105163574,
        "compile_time": 2.46675443649292
    },
    {
        "BLOCK_SIZE_M": 256,
        "BLOCK_SIZE_N": 128,
        "BLOCK_SIZE_K": 16,
        "GROUP_SIZE_M": 8,
        "num_stages": 6,
        "num_warps": 16,
        "ms": 7.517247200012207,
        "min_ms": 7.517247200012207,
        "max_ms": 7.517247200012207,
        "compile_time": 2.084669351577759
    },
    {
        "BLOCK_SIZE_M": 256,
        "BLOCK_SIZE_N": 64,
        "BLOCK_SIZE_K": 32,
        "GROUP_SIZE_M": 8,
        "num_stages": 1,
        "num_warps": 8,
        "ms": 7.521547794342041,
        "min_ms": 7.521547794342041,
        "max_ms": 7.521547794342041,
        "compile_time": 2.074842929840088
    },
    {
        "BLOCK_SIZE_M": 256,
        "BLOCK_SIZE_N": 128,
        "BLOCK_SIZE_K": 16,
        "GROUP_SIZE_M": 8,
        "num_stages": 4,
        "num_warps": 16,
        "ms": 7.523076057434082,
        "min_ms": 7.523076057434082,
        "max_ms": 7.523076057434082,
        "compile_time": 2.072160005569458
    },
    {
        "BLOCK_SIZE_M": 128,
        "BLOCK_SIZE_N": 64,
        "BLOCK_SIZE_K": 128,
        "GROUP_SIZE_M": 8,
        "num_stages": 3,
        "num_warps": 16,
        "ms": 7.523155212402344,
        "min_ms": 7.523155212402344,
        "max_ms": 7.523155212402344,
        "compile_time": 1.964691400527954
    },
    {
        "BLOCK_SIZE_M": 128,
        "BLOCK_SIZE_N": 64,
        "BLOCK_SIZE_K": 16,
        "GROUP_SIZE_M": 8,
        "num_stages": 8,
        "num_warps": 2,
        "ms": 7.523201942443848,
        "min_ms": 7.523201942443848,
        "max_ms": 7.523201942443848,
        "compile_time": 2.3593380451202393
    },
    {
        "BLOCK_SIZE_M": 256,
        "BLOCK_SIZE_N": 128,
        "BLOCK_SIZE_K": 16,
        "GROUP_SIZE_M": 8,
        "num_stages": 7,
        "num_warps": 16,
        "ms": 7.525848388671875,
        "min_ms": 7.525848388671875,
        "max_ms": 7.525848388671875,
        "compile_time": 2.162946939468384
    },
    {
        "BLOCK_SIZE_M": 64,
        "BLOCK_SIZE_N": 64,
        "BLOCK_SIZE_K": 128,
        "GROUP_SIZE_M": 8,
        "num_stages": 6,
        "num_warps": 4,
        "ms": 7.526618957519531,
        "min_ms": 7.526618957519531,
        "max_ms": 7.526618957519531,
        "compile_time": 2.3614299297332764
    },
    {
        "BLOCK_SIZE_M": 128,
        "BLOCK_SIZE_N": 64,
        "BLOCK_SIZE_K": 64,
        "GROUP_SIZE_M": 8,
        "num_stages": 1,
        "num_warps": 2,
        "ms": 7.531976222991943,
        "min_ms": 7.531976222991943,
        "max_ms": 7.531976222991943,
        "compile_time": 2.5621373653411865
    },
    {
        "BLOCK_SIZE_M": 256,
        "BLOCK_SIZE_N": 128,
        "BLOCK_SIZE_K": 16,
        "GROUP_SIZE_M": 8,
        "num_stages": 8,
        "num_warps": 16,
        "ms": 7.53366231918335,
        "min_ms": 7.53366231918335,
        "max_ms": 7.53366231918335,
        "compile_time": 2.189748764038086
    },
    {
        "BLOCK_SIZE_M": 128,
        "BLOCK_SIZE_N": 64,
        "BLOCK_SIZE_K": 128,
        "GROUP_SIZE_M": 8,
        "num_stages": 4,
        "num_warps": 16,
        "ms": 7.538593292236328,
        "min_ms": 7.538593292236328,
        "max_ms": 7.538593292236328,
        "compile_time": 1.9780900478363037
    },
    {
        "BLOCK_SIZE_M": 128,
        "BLOCK_SIZE_N": 128,
        "BLOCK_SIZE_K": 256,
        "GROUP_SIZE_M": 8,
        "num_stages": 2,
        "num_warps": 16,
        "ms": 7.556300163269043,
        "min_ms": 7.556300163269043,
        "max_ms": 7.556300163269043,
        "compile_time": 2.366339683532715
    },
    {
        "BLOCK_SIZE_M": 64,
        "BLOCK_SIZE_N": 64,
        "BLOCK_SIZE_K": 128,
        "GROUP_SIZE_M": 8,
        "num_stages": 3,
        "num_warps": 4,
        "ms": 7.563498020172119,
        "min_ms": 7.563498020172119,
        "max_ms": 7.563498020172119,
        "compile_time": 2.193495273590088
    },
    {
        "BLOCK_SIZE_M": 64,
        "BLOCK_SIZE_N": 256,
        "BLOCK_SIZE_K": 32,
        "GROUP_SIZE_M": 8,
        "num_stages": 1,
        "num_warps": 8,
        "ms": 7.563878059387207,
        "min_ms": 7.563878059387207,
        "max_ms": 7.563878059387207,
        "compile_time": 1.8638536930084229
    },
    {
        "BLOCK_SIZE_M": 64,
        "BLOCK_SIZE_N": 64,
        "BLOCK_SIZE_K": 64,
        "GROUP_SIZE_M": 8,
        "num_stages": 8,
        "num_warps": 4,
        "ms": 7.574496269226074,
        "min_ms": 7.574496269226074,
        "max_ms": 7.574496269226074,
        "compile_time": 2.00775408744812
    },
    {
        "BLOCK_SIZE_M": 64,
        "BLOCK_SIZE_N": 128,
        "BLOCK_SIZE_K": 128,
        "GROUP_SIZE_M": 8,
        "num_stages": 3,
        "num_warps": 16,
        "ms": 7.577520847320557,
        "min_ms": 7.577520847320557,
        "max_ms": 7.577520847320557,
        "compile_time": 1.8653969764709473
    },
    {
        "BLOCK_SIZE_M": 64,
        "BLOCK_SIZE_N": 64,
        "BLOCK_SIZE_K": 64,
        "GROUP_SIZE_M": 8,
        "num_stages": 7,
        "num_warps": 4,
        "ms": 7.591589450836182,
        "min_ms": 7.591589450836182,
        "max_ms": 7.591589450836182,
        "compile_time": 2.0094640254974365
    },
    {
        "BLOCK_SIZE_M": 128,
        "BLOCK_SIZE_N": 128,
        "BLOCK_SIZE_K": 64,
        "GROUP_SIZE_M": 8,
        "num_stages": 3,
        "num_warps": 32,
        "ms": 7.599135398864746,
        "min_ms": 7.599135398864746,
        "max_ms": 7.599135398864746,
        "compile_time": 1.8383276462554932
    },
    {
        "BLOCK_SIZE_M": 128,
        "BLOCK_SIZE_N": 128,
        "BLOCK_SIZE_K": 64,
        "GROUP_SIZE_M": 8,
        "num_stages": 4,
        "num_warps": 32,
        "ms": 7.609816551208496,
        "min_ms": 7.609816551208496,
        "max_ms": 7.609816551208496,
        "compile_time": 1.8597040176391602
    },
    {
        "BLOCK_SIZE_M": 64,
        "BLOCK_SIZE_N": 64,
        "BLOCK_SIZE_K": 32,
        "GROUP_SIZE_M": 8,
        "num_stages": 2,
        "num_warps": 2,
        "ms": 7.610698699951172,
        "min_ms": 7.610698699951172,
        "max_ms": 7.610698699951172,
        "compile_time": 1.9492602348327637
    },
    {
        "BLOCK_SIZE_M": 64,
        "BLOCK_SIZE_N": 64,
        "BLOCK_SIZE_K": 128,
        "GROUP_SIZE_M": 8,
        "num_stages": 5,
        "num_warps": 4,
        "ms": 7.615692138671875,
        "min_ms": 7.615692138671875,
        "max_ms": 7.615692138671875,
        "compile_time": 2.2542166709899902
    },
    {
        "BLOCK_SIZE_M": 128,
        "BLOCK_SIZE_N": 128,
        "BLOCK_SIZE_K": 64,
        "GROUP_SIZE_M": 8,
        "num_stages": 5,
        "num_warps": 32,
        "ms": 7.6299028396606445,
        "min_ms": 7.6299028396606445,
        "max_ms": 7.6299028396606445,
        "compile_time": 1.8718035221099854
    },
    {
        "BLOCK_SIZE_M": 64,
        "BLOCK_SIZE_N": 128,
        "BLOCK_SIZE_K": 128,
        "GROUP_SIZE_M": 8,
        "num_stages": 4,
        "num_warps": 16,
        "ms": 7.637999534606934,
        "min_ms": 7.637999534606934,
        "max_ms": 7.637999534606934,
        "compile_time": 1.9008073806762695
    },
    {
        "BLOCK_SIZE_M": 128,
        "BLOCK_SIZE_N": 128,
        "BLOCK_SIZE_K": 64,
        "GROUP_SIZE_M": 8,
        "num_stages": 6,
        "num_warps": 32,
        "ms": 7.640599727630615,
        "min_ms": 7.640599727630615,
        "max_ms": 7.640599727630615,
        "compile_time": 1.8702054023742676
    },
    {
        "BLOCK_SIZE_M": 64,
        "BLOCK_SIZE_N": 64,
        "BLOCK_SIZE_K": 64,
        "GROUP_SIZE_M": 8,
        "num_stages": 2,
        "num_warps": 4,
        "ms": 7.681921482086182,
        "min_ms": 7.681921482086182,
        "max_ms": 7.681921482086182,
        "compile_time": 1.8495104312896729
    },
    {
        "BLOCK_SIZE_M": 64,
        "BLOCK_SIZE_N": 256,
        "BLOCK_SIZE_K": 16,
        "GROUP_SIZE_M": 8,
        "num_stages": 3,
        "num_warps": 16,
        "ms": 7.702433109283447,
        "min_ms": 7.702433109283447,
        "max_ms": 7.702433109283447,
        "compile_time": 1.7668843269348145
    },
    {
        "BLOCK_SIZE_M": 64,
        "BLOCK_SIZE_N": 256,
        "BLOCK_SIZE_K": 16,
        "GROUP_SIZE_M": 8,
        "num_stages": 4,
        "num_warps": 16,
        "ms": 7.70479679107666,
        "min_ms": 7.70479679107666,
        "max_ms": 7.70479679107666,
        "compile_time": 1.7807137966156006
    },
    {
        "BLOCK_SIZE_M": 64,
        "BLOCK_SIZE_N": 64,
        "BLOCK_SIZE_K": 128,
        "GROUP_SIZE_M": 8,
        "num_stages": 2,
        "num_warps": 4,
        "ms": 7.705174922943115,
        "min_ms": 7.705174922943115,
        "max_ms": 7.705174922943115,
        "compile_time": 2.0616466999053955
    },
    {
        "BLOCK_SIZE_M": 64,
        "BLOCK_SIZE_N": 256,
        "BLOCK_SIZE_K": 16,
        "GROUP_SIZE_M": 8,
        "num_stages": 7,
        "num_warps": 16,
        "ms": 7.70577335357666,
        "min_ms": 7.70577335357666,
        "max_ms": 7.70577335357666,
        "compile_time": 1.7968838214874268
    },
    {
        "BLOCK_SIZE_M": 128,
        "BLOCK_SIZE_N": 64,
        "BLOCK_SIZE_K": 32,
        "GROUP_SIZE_M": 8,
        "num_stages": 8,
        "num_warps": 2,
        "ms": 7.7092180252075195,
        "min_ms": 7.7092180252075195,
        "max_ms": 7.7092180252075195,
        "compile_time": 2.746006965637207
    },
    {
        "BLOCK_SIZE_M": 64,
        "BLOCK_SIZE_N": 256,
        "BLOCK_SIZE_K": 16,
        "GROUP_SIZE_M": 8,
        "num_stages": 8,
        "num_warps": 16,
        "ms": 7.71393346786499,
        "min_ms": 7.71393346786499,
        "max_ms": 7.71393346786499,
        "compile_time": 1.815990686416626
    },
    {
        "BLOCK_SIZE_M": 64,
        "BLOCK_SIZE_N": 64,
        "BLOCK_SIZE_K": 128,
        "GROUP_SIZE_M": 8,
        "num_stages": 4,
        "num_warps": 4,
        "ms": 7.717887878417969,
        "min_ms": 7.717887878417969,
        "max_ms": 7.717887878417969,
        "compile_time": 2.1937108039855957
    },
    {
        "BLOCK_SIZE_M": 64,
        "BLOCK_SIZE_N": 256,
        "BLOCK_SIZE_K": 16,
        "GROUP_SIZE_M": 8,
        "num_stages": 5,
        "num_warps": 16,
        "ms": 7.718597412109375,
        "min_ms": 7.718597412109375,
        "max_ms": 7.718597412109375,
        "compile_time": 1.7962298393249512
    },
    {
        "BLOCK_SIZE_M": 64,
        "BLOCK_SIZE_N": 256,
        "BLOCK_SIZE_K": 16,
        "GROUP_SIZE_M": 8,
        "num_stages": 6,
        "num_warps": 16,
        "ms": 7.722960472106934,
        "min_ms": 7.722960472106934,
        "max_ms": 7.722960472106934,
        "compile_time": 1.7939846515655518
    },
    {
        "BLOCK_SIZE_M": 128,
        "BLOCK_SIZE_N": 64,
        "BLOCK_SIZE_K": 16,
        "GROUP_SIZE_M": 8,
        "num_stages": 3,
        "num_warps": 4,
        "ms": 7.7302703857421875,
        "min_ms": 7.7302703857421875,
        "max_ms": 7.7302703857421875,
        "compile_time": 1.9804058074951172
    },
    {
        "BLOCK_SIZE_M": 512,
        "BLOCK_SIZE_N": 64,
        "BLOCK_SIZE_K": 32,
        "GROUP_SIZE_M": 8,
        "num_stages": 4,
        "num_warps": 16,
        "ms": 7.74007511138916,
        "min_ms": 7.74007511138916,
        "max_ms": 7.74007511138916,
        "compile_time": 2.3561601638793945
    },
    {
        "BLOCK_SIZE_M": 128,
        "BLOCK_SIZE_N": 64,
        "BLOCK_SIZE_K": 16,
        "GROUP_SIZE_M": 8,
        "num_stages": 6,
        "num_warps": 4,
        "ms": 7.742999076843262,
        "min_ms": 7.742999076843262,
        "max_ms": 7.742999076843262,
        "compile_time": 2.088691234588623
    },
    {
        "BLOCK_SIZE_M": 64,
        "BLOCK_SIZE_N": 128,
        "BLOCK_SIZE_K": 64,
        "GROUP_SIZE_M": 8,
        "num_stages": 1,
        "num_warps": 2,
        "ms": 7.7520551681518555,
        "min_ms": 7.7520551681518555,
        "max_ms": 7.7520551681518555,
        "compile_time": 2.4026410579681396
    },
    {
        "BLOCK_SIZE_M": 128,
        "BLOCK_SIZE_N": 64,
        "BLOCK_SIZE_K": 16,
        "GROUP_SIZE_M": 8,
        "num_stages": 4,
        "num_warps": 4,
        "ms": 7.757508754730225,
        "min_ms": 7.757508754730225,
        "max_ms": 7.757508754730225,
        "compile_time": 1.9862124919891357
    },
    {
        "BLOCK_SIZE_M": 256,
        "BLOCK_SIZE_N": 64,
        "BLOCK_SIZE_K": 64,
        "GROUP_SIZE_M": 8,
        "num_stages": 2,
        "num_warps": 8,
        "ms": 7.757891654968262,
        "min_ms": 7.757891654968262,
        "max_ms": 7.757891654968262,
        "compile_time": 2.263690710067749
    },
    {
        "BLOCK_SIZE_M": 128,
        "BLOCK_SIZE_N": 64,
        "BLOCK_SIZE_K": 16,
        "GROUP_SIZE_M": 8,
        "num_stages": 7,
        "num_warps": 4,
        "ms": 7.7734198570251465,
        "min_ms": 7.7734198570251465,
        "max_ms": 7.7734198570251465,
        "compile_time": 2.0235249996185303
    },
    {
        "BLOCK_SIZE_M": 128,
        "BLOCK_SIZE_N": 64,
        "BLOCK_SIZE_K": 16,
        "GROUP_SIZE_M": 8,
        "num_stages": 5,
        "num_warps": 4,
        "ms": 7.7736406326293945,
        "min_ms": 7.7736406326293945,
        "max_ms": 7.7736406326293945,
        "compile_time": 1.9814479351043701
    },
    {
        "BLOCK_SIZE_M": 64,
        "BLOCK_SIZE_N": 64,
        "BLOCK_SIZE_K": 32,
        "GROUP_SIZE_M": 8,
        "num_stages": 2,
        "num_warps": 4,
        "ms": 7.782431125640869,
        "min_ms": 7.782431125640869,
        "max_ms": 7.782431125640869,
        "compile_time": 1.798262119293213
    },
    {
        "BLOCK_SIZE_M": 64,
        "BLOCK_SIZE_N": 512,
        "BLOCK_SIZE_K": 64,
        "GROUP_SIZE_M": 8,
        "num_stages": 2,
        "num_warps": 8,
        "ms": 7.809928894042969,
        "min_ms": 7.809928894042969,
        "max_ms": 7.809928894042969,
        "compile_time": 2.5530850887298584
    },
    {
        "BLOCK_SIZE_M": 128,
        "BLOCK_SIZE_N": 64,
        "BLOCK_SIZE_K": 64,
        "GROUP_SIZE_M": 8,
        "num_stages": 3,
        "num_warps": 16,
        "ms": 7.812237739562988,
        "min_ms": 7.812237739562988,
        "max_ms": 7.812237739562988,
        "compile_time": 1.8523833751678467
    },
    {
        "BLOCK_SIZE_M": 64,
        "BLOCK_SIZE_N": 64,
        "BLOCK_SIZE_K": 128,
        "GROUP_SIZE_M": 8,
        "num_stages": 2,
        "num_warps": 2,
        "ms": 7.827188014984131,
        "min_ms": 7.827188014984131,
        "max_ms": 7.827188014984131,
        "compile_time": 2.4784157276153564
    },
    {
        "BLOCK_SIZE_M": 128,
        "BLOCK_SIZE_N": 64,
        "BLOCK_SIZE_K": 64,
        "GROUP_SIZE_M": 8,
        "num_stages": 4,
        "num_warps": 16,
        "ms": 7.830182075500488,
        "min_ms": 7.830182075500488,
        "max_ms": 7.830182075500488,
        "compile_time": 1.9802932739257812
    },
    {
        "BLOCK_SIZE_M": 64,
        "BLOCK_SIZE_N": 64,
        "BLOCK_SIZE_K": 64,
        "GROUP_SIZE_M": 8,
        "num_stages": 4,
        "num_warps": 8,
        "ms": 7.842674255371094,
        "min_ms": 7.842674255371094,
        "max_ms": 7.842674255371094,
        "compile_time": 1.7973706722259521
    },
    {
        "BLOCK_SIZE_M": 128,
        "BLOCK_SIZE_N": 256,
        "BLOCK_SIZE_K": 64,
        "GROUP_SIZE_M": 8,
        "num_stages": 1,
        "num_warps": 8,
        "ms": 7.84824275970459,
        "min_ms": 7.84824275970459,
        "max_ms": 7.84824275970459,
        "compile_time": 2.370487928390503
    },
    {
        "BLOCK_SIZE_M": 64,
        "BLOCK_SIZE_N": 128,
        "BLOCK_SIZE_K": 64,
        "GROUP_SIZE_M": 8,
        "num_stages": 1,
        "num_warps": 4,
        "ms": 7.849353790283203,
        "min_ms": 7.849353790283203,
        "max_ms": 7.849353790283203,
        "compile_time": 2.003072738647461
    },
    {
        "BLOCK_SIZE_M": 128,
        "BLOCK_SIZE_N": 64,
        "BLOCK_SIZE_K": 16,
        "GROUP_SIZE_M": 8,
        "num_stages": 8,
        "num_warps": 4,
        "ms": 7.851071357727051,
        "min_ms": 7.851071357727051,
        "max_ms": 7.851071357727051,
        "compile_time": 2.04638934135437
    },
    {
        "BLOCK_SIZE_M": 256,
        "BLOCK_SIZE_N": 64,
        "BLOCK_SIZE_K": 16,
        "GROUP_SIZE_M": 8,
        "num_stages": 3,
        "num_warps": 8,
        "ms": 7.8512468338012695,
        "min_ms": 7.8512468338012695,
        "max_ms": 7.8512468338012695,
        "compile_time": 2.086097478866577
    },
    {
        "BLOCK_SIZE_M": 64,
        "BLOCK_SIZE_N": 256,
        "BLOCK_SIZE_K": 64,
        "GROUP_SIZE_M": 8,
        "num_stages": 2,
        "num_warps": 8,
        "ms": 7.8631768226623535,
        "min_ms": 7.8631768226623535,
        "max_ms": 7.8631768226623535,
        "compile_time": 2.1171469688415527
    },
    {
        "BLOCK_SIZE_M": 64,
        "BLOCK_SIZE_N": 64,
        "BLOCK_SIZE_K": 64,
        "GROUP_SIZE_M": 8,
        "num_stages": 3,
        "num_warps": 8,
        "ms": 7.8739142417907715,
        "min_ms": 7.8739142417907715,
        "max_ms": 7.8739142417907715,
        "compile_time": 1.7804350852966309
    },
    {
        "BLOCK_SIZE_M": 64,
        "BLOCK_SIZE_N": 256,
        "BLOCK_SIZE_K": 128,
        "GROUP_SIZE_M": 8,
        "num_stages": 2,
        "num_warps": 8,
        "ms": 7.881300926208496,
        "min_ms": 7.881300926208496,
        "max_ms": 7.881300926208496,
        "compile_time": 2.2984981536865234
    },
    {
        "BLOCK_SIZE_M": 64,
        "BLOCK_SIZE_N": 64,
        "BLOCK_SIZE_K": 64,
        "GROUP_SIZE_M": 8,
        "num_stages": 5,
        "num_warps": 8,
        "ms": 7.892834663391113,
        "min_ms": 7.892834663391113,
        "max_ms": 7.892834663391113,
        "compile_time": 1.8001277446746826
    },
    {
        "BLOCK_SIZE_M": 256,
        "BLOCK_SIZE_N": 128,
        "BLOCK_SIZE_K": 128,
        "GROUP_SIZE_M": 8,
        "num_stages": 1,
        "num_warps": 8,
        "ms": 7.8942413330078125,
        "min_ms": 7.8942413330078125,
        "max_ms": 7.8942413330078125,
        "compile_time": 2.785191297531128
    },
    {
        "BLOCK_SIZE_M": 64,
        "BLOCK_SIZE_N": 64,
        "BLOCK_SIZE_K": 64,
        "GROUP_SIZE_M": 8,
        "num_stages": 6,
        "num_warps": 8,
        "ms": 7.9018144607543945,
        "min_ms": 7.9018144607543945,
        "max_ms": 7.9018144607543945,
        "compile_time": 1.836087942123413
    },
    {
        "BLOCK_SIZE_M": 64,
        "BLOCK_SIZE_N": 64,
        "BLOCK_SIZE_K": 128,
        "GROUP_SIZE_M": 8,
        "num_stages": 3,
        "num_warps": 8,
        "ms": 7.90441370010376,
        "min_ms": 7.90441370010376,
        "max_ms": 7.90441370010376,
        "compile_time": 1.938796043395996
    },
    {
        "BLOCK_SIZE_M": 64,
        "BLOCK_SIZE_N": 128,
        "BLOCK_SIZE_K": 64,
        "GROUP_SIZE_M": 8,
        "num_stages": 4,
        "num_warps": 16,
        "ms": 7.924783229827881,
        "min_ms": 7.924783229827881,
        "max_ms": 7.924783229827881,
        "compile_time": 1.8245837688446045
    },
    {
        "BLOCK_SIZE_M": 64,
        "BLOCK_SIZE_N": 128,
        "BLOCK_SIZE_K": 64,
        "GROUP_SIZE_M": 8,
        "num_stages": 5,
        "num_warps": 16,
        "ms": 7.933069705963135,
        "min_ms": 7.933069705963135,
        "max_ms": 7.933069705963135,
        "compile_time": 1.8386378288269043
    },
    {
        "BLOCK_SIZE_M": 64,
        "BLOCK_SIZE_N": 128,
        "BLOCK_SIZE_K": 64,
        "GROUP_SIZE_M": 8,
        "num_stages": 3,
        "num_warps": 16,
        "ms": 7.9379377365112305,
        "min_ms": 7.9379377365112305,
        "max_ms": 7.9379377365112305,
        "compile_time": 1.8219518661499023
    },
    {
        "BLOCK_SIZE_M": 64,
        "BLOCK_SIZE_N": 128,
        "BLOCK_SIZE_K": 64,
        "GROUP_SIZE_M": 8,
        "num_stages": 6,
        "num_warps": 16,
        "ms": 7.948162078857422,
        "min_ms": 7.948162078857422,
        "max_ms": 7.948162078857422,
        "compile_time": 1.8575184345245361
    },
    {
        "BLOCK_SIZE_M": 128,
        "BLOCK_SIZE_N": 128,
        "BLOCK_SIZE_K": 64,
        "GROUP_SIZE_M": 8,
        "num_stages": 2,
        "num_warps": 16,
        "ms": 7.961002349853516,
        "min_ms": 7.961002349853516,
        "max_ms": 7.961002349853516,
        "compile_time": 1.896876573562622
    },
    {
        "BLOCK_SIZE_M": 128,
        "BLOCK_SIZE_N": 128,
        "BLOCK_SIZE_K": 256,
        "GROUP_SIZE_M": 8,
        "num_stages": 1,
        "num_warps": 8,
        "ms": 7.975935459136963,
        "min_ms": 7.975935459136963,
        "max_ms": 7.975935459136963,
        "compile_time": 2.8308539390563965
    },
    {
        "BLOCK_SIZE_M": 256,
        "BLOCK_SIZE_N": 64,
        "BLOCK_SIZE_K": 16,
        "GROUP_SIZE_M": 8,
        "num_stages": 6,
        "num_warps": 8,
        "ms": 7.98663330078125,
        "min_ms": 7.98663330078125,
        "max_ms": 7.98663330078125,
        "compile_time": 2.151301622390747
    },
    {
        "BLOCK_SIZE_M": 128,
        "BLOCK_SIZE_N": 64,
        "BLOCK_SIZE_K": 32,
        "GROUP_SIZE_M": 8,
        "num_stages": 1,
        "num_warps": 4,
        "ms": 7.989657402038574,
        "min_ms": 7.989657402038574,
        "max_ms": 7.989657402038574,
        "compile_time": 1.9354310035705566
    },
    {
        "BLOCK_SIZE_M": 64,
        "BLOCK_SIZE_N": 64,
        "BLOCK_SIZE_K": 128,
        "GROUP_SIZE_M": 8,
        "num_stages": 3,
        "num_warps": 2,
        "ms": 7.993105411529541,
        "min_ms": 7.993105411529541,
        "max_ms": 7.993105411529541,
        "compile_time": 2.6944756507873535
    },
    {
        "BLOCK_SIZE_M": 64,
        "BLOCK_SIZE_N": 128,
        "BLOCK_SIZE_K": 64,
        "GROUP_SIZE_M": 8,
        "num_stages": 7,
        "num_warps": 16,
        "ms": 7.994604587554932,
        "min_ms": 7.994604587554932,
        "max_ms": 7.994604587554932,
        "compile_time": 1.873140811920166
    },
    {
        "BLOCK_SIZE_M": 256,
        "BLOCK_SIZE_N": 64,
        "BLOCK_SIZE_K": 16,
        "GROUP_SIZE_M": 8,
        "num_stages": 7,
        "num_warps": 8,
        "ms": 8.000606536865234,
        "min_ms": 8.000606536865234,
        "max_ms": 8.000606536865234,
        "compile_time": 2.1762049198150635
    },
    {
        "BLOCK_SIZE_M": 256,
        "BLOCK_SIZE_N": 128,
        "BLOCK_SIZE_K": 64,
        "GROUP_SIZE_M": 8,
        "num_stages": 1,
        "num_warps": 32,
        "ms": 8.003396987915039,
        "min_ms": 8.003396987915039,
        "max_ms": 8.003396987915039,
        "compile_time": 1.9681658744812012
    },
    {
        "BLOCK_SIZE_M": 256,
        "BLOCK_SIZE_N": 64,
        "BLOCK_SIZE_K": 16,
        "GROUP_SIZE_M": 8,
        "num_stages": 4,
        "num_warps": 8,
        "ms": 8.00744342803955,
        "min_ms": 8.00744342803955,
        "max_ms": 8.00744342803955,
        "compile_time": 2.172498941421509
    },
    {
        "BLOCK_SIZE_M": 64,
        "BLOCK_SIZE_N": 64,
        "BLOCK_SIZE_K": 64,
        "GROUP_SIZE_M": 8,
        "num_stages": 2,
        "num_warps": 2,
        "ms": 8.018790245056152,
        "min_ms": 8.018790245056152,
        "max_ms": 8.018790245056152,
        "compile_time": 2.0744271278381348
    },
    {
        "BLOCK_SIZE_M": 256,
        "BLOCK_SIZE_N": 64,
        "BLOCK_SIZE_K": 16,
        "GROUP_SIZE_M": 8,
        "num_stages": 8,
        "num_warps": 8,
        "ms": 8.026616096496582,
        "min_ms": 8.026616096496582,
        "max_ms": 8.026616096496582,
        "compile_time": 2.1877243518829346
    },
    {
        "BLOCK_SIZE_M": 256,
        "BLOCK_SIZE_N": 64,
        "BLOCK_SIZE_K": 16,
        "GROUP_SIZE_M": 8,
        "num_stages": 5,
        "num_warps": 8,
        "ms": 8.02877426147461,
        "min_ms": 8.02877426147461,
        "max_ms": 8.02877426147461,
        "compile_time": 2.144279718399048
    },
    {
        "BLOCK_SIZE_M": 256,
        "BLOCK_SIZE_N": 64,
        "BLOCK_SIZE_K": 128,
        "GROUP_SIZE_M": 8,
        "num_stages": 3,
        "num_warps": 32,
        "ms": 8.03237533569336,
        "min_ms": 8.03237533569336,
        "max_ms": 8.03237533569336,
        "compile_time": 2.111743927001953
    },
    {
        "BLOCK_SIZE_M": 128,
        "BLOCK_SIZE_N": 256,
        "BLOCK_SIZE_K": 32,
        "GROUP_SIZE_M": 8,
        "num_stages": 2,
        "num_warps": 16,
        "ms": 8.032597541809082,
        "min_ms": 8.032597541809082,
        "max_ms": 8.032597541809082,
        "compile_time": 2.067216634750366
    },
    {
        "BLOCK_SIZE_M": 256,
        "BLOCK_SIZE_N": 64,
        "BLOCK_SIZE_K": 128,
        "GROUP_SIZE_M": 8,
        "num_stages": 2,
        "num_warps": 8,
        "ms": 8.065023422241211,
        "min_ms": 8.065023422241211,
        "max_ms": 8.065023422241211,
        "compile_time": 2.588202476501465
    },
    {
        "BLOCK_SIZE_M": 256,
        "BLOCK_SIZE_N": 128,
        "BLOCK_SIZE_K": 128,
        "GROUP_SIZE_M": 8,
        "num_stages": 1,
        "num_warps": 16,
        "ms": 8.081544876098633,
        "min_ms": 8.081544876098633,
        "max_ms": 8.081544876098633,
        "compile_time": 2.338627576828003
    },
    {
        "BLOCK_SIZE_M": 512,
        "BLOCK_SIZE_N": 64,
        "BLOCK_SIZE_K": 64,
        "GROUP_SIZE_M": 8,
        "num_stages": 3,
        "num_warps": 16,
        "ms": 8.104823112487793,
        "min_ms": 8.104823112487793,
        "max_ms": 8.104823112487793,
        "compile_time": 2.506864547729492
    },
    {
        "BLOCK_SIZE_M": 128,
        "BLOCK_SIZE_N": 64,
        "BLOCK_SIZE_K": 64,
        "GROUP_SIZE_M": 8,
        "num_stages": 6,
        "num_warps": 16,
        "ms": 8.112264633178711,
        "min_ms": 8.112264633178711,
        "max_ms": 8.112264633178711,
        "compile_time": 1.894502878189087
    },
    {
        "BLOCK_SIZE_M": 128,
        "BLOCK_SIZE_N": 64,
        "BLOCK_SIZE_K": 64,
        "GROUP_SIZE_M": 8,
        "num_stages": 5,
        "num_warps": 16,
        "ms": 8.11588191986084,
        "min_ms": 8.11588191986084,
        "max_ms": 8.11588191986084,
        "compile_time": 1.8779358863830566
    },
    {
        "BLOCK_SIZE_M": 64,
        "BLOCK_SIZE_N": 256,
        "BLOCK_SIZE_K": 128,
        "GROUP_SIZE_M": 8,
        "num_stages": 1,
        "num_warps": 4,
        "ms": 8.137250900268555,
        "min_ms": 8.137250900268555,
        "max_ms": 8.137250900268555,
        "compile_time": 2.8577637672424316
    },
    {
        "BLOCK_SIZE_M": 128,
        "BLOCK_SIZE_N": 64,
        "BLOCK_SIZE_K": 128,
        "GROUP_SIZE_M": 8,
        "num_stages": 1,
        "num_warps": 8,
        "ms": 8.145509719848633,
        "min_ms": 8.145509719848633,
        "max_ms": 8.145509719848633,
        "compile_time": 1.9827702045440674
    },
    {
        "BLOCK_SIZE_M": 64,
        "BLOCK_SIZE_N": 256,
        "BLOCK_SIZE_K": 128,
        "GROUP_SIZE_M": 8,
        "num_stages": 3,
        "num_warps": 32,
        "ms": 8.146806716918945,
        "min_ms": 8.146806716918945,
        "max_ms": 8.146806716918945,
        "compile_time": 1.939929723739624
    },
    {
        "BLOCK_SIZE_M": 64,
        "BLOCK_SIZE_N": 64,
        "BLOCK_SIZE_K": 128,
        "GROUP_SIZE_M": 8,
        "num_stages": 5,
        "num_warps": 8,
        "ms": 8.148838996887207,
        "min_ms": 8.148838996887207,
        "max_ms": 8.148838996887207,
        "compile_time": 1.9539721012115479
    },
    {
        "BLOCK_SIZE_M": 64,
        "BLOCK_SIZE_N": 64,
        "BLOCK_SIZE_K": 256,
        "GROUP_SIZE_M": 8,
        "num_stages": 2,
        "num_warps": 4,
        "ms": 8.152097702026367,
        "min_ms": 8.152097702026367,
        "max_ms": 8.152097702026367,
        "compile_time": 2.478290319442749
    },
    {
        "BLOCK_SIZE_M": 128,
        "BLOCK_SIZE_N": 256,
        "BLOCK_SIZE_K": 128,
        "GROUP_SIZE_M": 8,
        "num_stages": 2,
        "num_warps": 16,
        "ms": 8.154436111450195,
        "min_ms": 8.154436111450195,
        "max_ms": 8.154436111450195,
        "compile_time": 2.301527976989746
    },
    {
        "BLOCK_SIZE_M": 128,
        "BLOCK_SIZE_N": 64,
        "BLOCK_SIZE_K": 64,
        "GROUP_SIZE_M": 8,
        "num_stages": 7,
        "num_warps": 16,
        "ms": 8.16868782043457,
        "min_ms": 8.16868782043457,
        "max_ms": 8.16868782043457,
        "compile_time": 1.889134407043457
    },
    {
        "BLOCK_SIZE_M": 64,
        "BLOCK_SIZE_N": 64,
        "BLOCK_SIZE_K": 128,
        "GROUP_SIZE_M": 8,
        "num_stages": 4,
        "num_warps": 8,
        "ms": 8.17440414428711,
        "min_ms": 8.17440414428711,
        "max_ms": 8.17440414428711,
        "compile_time": 1.9260621070861816
    },
    {
        "BLOCK_SIZE_M": 128,
        "BLOCK_SIZE_N": 64,
        "BLOCK_SIZE_K": 128,
        "GROUP_SIZE_M": 8,
        "num_stages": 1,
        "num_warps": 4,
        "ms": 8.192750930786133,
        "min_ms": 8.192750930786133,
        "max_ms": 8.192750930786133,
        "compile_time": 2.3477559089660645
    },
    {
        "BLOCK_SIZE_M": 64,
        "BLOCK_SIZE_N": 64,
        "BLOCK_SIZE_K": 128,
        "GROUP_SIZE_M": 8,
        "num_stages": 6,
        "num_warps": 8,
        "ms": 8.195618629455566,
        "min_ms": 8.195618629455566,
        "max_ms": 8.195618629455566,
        "compile_time": 1.995253324508667
    },
    {
        "BLOCK_SIZE_M": 64,
        "BLOCK_SIZE_N": 128,
        "BLOCK_SIZE_K": 16,
        "GROUP_SIZE_M": 8,
        "num_stages": 2,
        "num_warps": 4,
        "ms": 8.200639724731445,
        "min_ms": 8.200639724731445,
        "max_ms": 8.200639724731445,
        "compile_time": 1.7426607608795166
    },
    {
        "BLOCK_SIZE_M": 64,
        "BLOCK_SIZE_N": 64,
        "BLOCK_SIZE_K": 256,
        "GROUP_SIZE_M": 8,
        "num_stages": 3,
        "num_warps": 4,
        "ms": 8.23004150390625,
        "min_ms": 8.23004150390625,
        "max_ms": 8.23004150390625,
        "compile_time": 2.7798895835876465
    },
    {
        "BLOCK_SIZE_M": 64,
        "BLOCK_SIZE_N": 128,
        "BLOCK_SIZE_K": 128,
        "GROUP_SIZE_M": 8,
        "num_stages": 1,
        "num_warps": 8,
        "ms": 8.230245590209961,
        "min_ms": 8.230245590209961,
        "max_ms": 8.230245590209961,
        "compile_time": 1.9156944751739502
    },
    {
        "BLOCK_SIZE_M": 64,
        "BLOCK_SIZE_N": 64,
        "BLOCK_SIZE_K": 16,
        "GROUP_SIZE_M": 8,
        "num_stages": 8,
        "num_warps": 2,
        "ms": 8.239069938659668,
        "min_ms": 8.239069938659668,
        "max_ms": 8.239069938659668,
        "compile_time": 1.960568904876709
    },
    {
        "BLOCK_SIZE_M": 256,
        "BLOCK_SIZE_N": 64,
        "BLOCK_SIZE_K": 64,
        "GROUP_SIZE_M": 8,
        "num_stages": 4,
        "num_warps": 32,
        "ms": 8.240144729614258,
        "min_ms": 8.240144729614258,
        "max_ms": 8.240144729614258,
        "compile_time": 2.0074617862701416
    },
    {
        "BLOCK_SIZE_M": 256,
        "BLOCK_SIZE_N": 64,
        "BLOCK_SIZE_K": 64,
        "GROUP_SIZE_M": 8,
        "num_stages": 3,
        "num_warps": 32,
        "ms": 8.249958992004395,
        "min_ms": 8.249958992004395,
        "max_ms": 8.249958992004395,
        "compile_time": 1.9883568286895752
    },
    {
        "BLOCK_SIZE_M": 256,
        "BLOCK_SIZE_N": 64,
        "BLOCK_SIZE_K": 64,
        "GROUP_SIZE_M": 8,
        "num_stages": 5,
        "num_warps": 32,
        "ms": 8.253064155578613,
        "min_ms": 8.253064155578613,
        "max_ms": 8.253064155578613,
        "compile_time": 2.0237960815429688
    },
    {
        "BLOCK_SIZE_M": 128,
        "BLOCK_SIZE_N": 64,
        "BLOCK_SIZE_K": 16,
        "GROUP_SIZE_M": 8,
        "num_stages": 2,
        "num_warps": 4,
        "ms": 8.259360313415527,
        "min_ms": 8.259360313415527,
        "max_ms": 8.259360313415527,
        "compile_time": 1.8458268642425537
    },
    {
        "BLOCK_SIZE_M": 512,
        "BLOCK_SIZE_N": 64,
        "BLOCK_SIZE_K": 32,
        "GROUP_SIZE_M": 8,
        "num_stages": 3,
        "num_warps": 16,
        "ms": 8.262712478637695,
        "min_ms": 8.262712478637695,
        "max_ms": 8.262712478637695,
        "compile_time": 2.222414493560791
    },
    {
        "BLOCK_SIZE_M": 64,
        "BLOCK_SIZE_N": 64,
        "BLOCK_SIZE_K": 16,
        "GROUP_SIZE_M": 8,
        "num_stages": 3,
        "num_warps": 2,
        "ms": 8.279245376586914,
        "min_ms": 8.279245376586914,
        "max_ms": 8.279245376586914,
        "compile_time": 1.847891092300415
    },
    {
        "BLOCK_SIZE_M": 64,
        "BLOCK_SIZE_N": 64,
        "BLOCK_SIZE_K": 16,
        "GROUP_SIZE_M": 8,
        "num_stages": 6,
        "num_warps": 2,
        "ms": 8.287931442260742,
        "min_ms": 8.287931442260742,
        "max_ms": 8.287931442260742,
        "compile_time": 1.958451747894287
    },
    {
        "BLOCK_SIZE_M": 64,
        "BLOCK_SIZE_N": 256,
        "BLOCK_SIZE_K": 64,
        "GROUP_SIZE_M": 8,
        "num_stages": 1,
        "num_warps": 4,
        "ms": 8.290116310119629,
        "min_ms": 8.290116310119629,
        "max_ms": 8.290116310119629,
        "compile_time": 2.4732413291931152
    },
    {
        "BLOCK_SIZE_M": 64,
        "BLOCK_SIZE_N": 64,
        "BLOCK_SIZE_K": 16,
        "GROUP_SIZE_M": 8,
        "num_stages": 7,
        "num_warps": 2,
        "ms": 8.298086166381836,
        "min_ms": 8.298086166381836,
        "max_ms": 8.298086166381836,
        "compile_time": 1.9598946571350098
    },
    {
        "BLOCK_SIZE_M": 64,
        "BLOCK_SIZE_N": 256,
        "BLOCK_SIZE_K": 64,
        "GROUP_SIZE_M": 8,
        "num_stages": 5,
        "num_warps": 32,
        "ms": 8.299229621887207,
        "min_ms": 8.299229621887207,
        "max_ms": 8.299229621887207,
        "compile_time": 1.8292806148529053
    },
    {
        "BLOCK_SIZE_M": 64,
        "BLOCK_SIZE_N": 64,
        "BLOCK_SIZE_K": 16,
        "GROUP_SIZE_M": 8,
        "num_stages": 4,
        "num_warps": 2,
        "ms": 8.302284240722656,
        "min_ms": 8.302284240722656,
        "max_ms": 8.302284240722656,
        "compile_time": 1.8658664226531982
    },
    {
        "BLOCK_SIZE_M": 64,
        "BLOCK_SIZE_N": 512,
        "BLOCK_SIZE_K": 64,
        "GROUP_SIZE_M": 8,
        "num_stages": 3,
        "num_warps": 16,
        "ms": 8.309480667114258,
        "min_ms": 8.309480667114258,
        "max_ms": 8.309480667114258,
        "compile_time": 2.1081461906433105
    },
    {
        "BLOCK_SIZE_M": 64,
        "BLOCK_SIZE_N": 64,
        "BLOCK_SIZE_K": 16,
        "GROUP_SIZE_M": 8,
        "num_stages": 5,
        "num_warps": 2,
        "ms": 8.318532943725586,
        "min_ms": 8.318532943725586,
        "max_ms": 8.318532943725586,
        "compile_time": 1.8864212036132812
    },
    {
        "BLOCK_SIZE_M": 64,
        "BLOCK_SIZE_N": 128,
        "BLOCK_SIZE_K": 16,
        "GROUP_SIZE_M": 8,
        "num_stages": 5,
        "num_warps": 8,
        "ms": 8.322320938110352,
        "min_ms": 8.322320938110352,
        "max_ms": 8.322320938110352,
        "compile_time": 1.7589185237884521
    },
    {
        "BLOCK_SIZE_M": 64,
        "BLOCK_SIZE_N": 128,
        "BLOCK_SIZE_K": 16,
        "GROUP_SIZE_M": 8,
        "num_stages": 4,
        "num_warps": 8,
        "ms": 8.329198837280273,
        "min_ms": 8.329198837280273,
        "max_ms": 8.329198837280273,
        "compile_time": 1.7529206275939941
    },
    {
        "BLOCK_SIZE_M": 64,
        "BLOCK_SIZE_N": 128,
        "BLOCK_SIZE_K": 16,
        "GROUP_SIZE_M": 8,
        "num_stages": 8,
        "num_warps": 8,
        "ms": 8.330649375915527,
        "min_ms": 8.330649375915527,
        "max_ms": 8.330649375915527,
        "compile_time": 1.8962140083312988
    },
    {
        "BLOCK_SIZE_M": 128,
        "BLOCK_SIZE_N": 64,
        "BLOCK_SIZE_K": 128,
        "GROUP_SIZE_M": 8,
        "num_stages": 2,
        "num_warps": 2,
        "ms": 8.33479118347168,
        "min_ms": 8.33479118347168,
        "max_ms": 8.33479118347168,
        "compile_time": 3.330430030822754
    },
    {
        "BLOCK_SIZE_M": 64,
        "BLOCK_SIZE_N": 64,
        "BLOCK_SIZE_K": 64,
        "GROUP_SIZE_M": 8,
        "num_stages": 7,
        "num_warps": 8,
        "ms": 8.347562789916992,
        "min_ms": 8.347562789916992,
        "max_ms": 8.347562789916992,
        "compile_time": 1.837782859802246
    },
    {
        "BLOCK_SIZE_M": 64,
        "BLOCK_SIZE_N": 128,
        "BLOCK_SIZE_K": 16,
        "GROUP_SIZE_M": 8,
        "num_stages": 7,
        "num_warps": 8,
        "ms": 8.34978199005127,
        "min_ms": 8.34978199005127,
        "max_ms": 8.34978199005127,
        "compile_time": 1.7793192863464355
    },
    {
        "BLOCK_SIZE_M": 64,
        "BLOCK_SIZE_N": 256,
        "BLOCK_SIZE_K": 128,
        "GROUP_SIZE_M": 8,
        "num_stages": 2,
        "num_warps": 16,
        "ms": 8.35044002532959,
        "min_ms": 8.35044002532959,
        "max_ms": 8.35044002532959,
        "compile_time": 1.9684443473815918
    },
    {
        "BLOCK_SIZE_M": 32,
        "BLOCK_SIZE_N": 512,
        "BLOCK_SIZE_K": 16,
        "GROUP_SIZE_M": 8,
        "num_stages": 5,
        "num_warps": 4,
        "ms": 8.363110542297363,
        "min_ms": 8.363110542297363,
        "max_ms": 8.363110542297363,
        "compile_time": 2.294767379760742
    },
    {
        "BLOCK_SIZE_M": 32,
        "BLOCK_SIZE_N": 256,
        "BLOCK_SIZE_K": 32,
        "GROUP_SIZE_M": 8,
        "num_stages": 5,
        "num_warps": 4,
        "ms": 8.365738868713379,
        "min_ms": 8.365738868713379,
        "max_ms": 8.365738868713379,
        "compile_time": 2.04502010345459
    },
    {
        "BLOCK_SIZE_M": 256,
        "BLOCK_SIZE_N": 64,
        "BLOCK_SIZE_K": 128,
        "GROUP_SIZE_M": 8,
        "num_stages": 2,
        "num_warps": 16,
        "ms": 8.36982250213623,
        "min_ms": 8.36982250213623,
        "max_ms": 8.36982250213623,
        "compile_time": 2.2005956172943115
    },
    {
        "BLOCK_SIZE_M": 64,
        "BLOCK_SIZE_N": 256,
        "BLOCK_SIZE_K": 64,
        "GROUP_SIZE_M": 8,
        "num_stages": 4,
        "num_warps": 32,
        "ms": 8.371541023254395,
        "min_ms": 8.371541023254395,
        "max_ms": 8.371541023254395,
        "compile_time": 1.8141953945159912
    },
    {
        "BLOCK_SIZE_M": 64,
        "BLOCK_SIZE_N": 128,
        "BLOCK_SIZE_K": 16,
        "GROUP_SIZE_M": 8,
        "num_stages": 6,
        "num_warps": 8,
        "ms": 8.376559257507324,
        "min_ms": 8.376559257507324,
        "max_ms": 8.376559257507324,
        "compile_time": 1.771360158920288
    },
    {
        "BLOCK_SIZE_M": 64,
        "BLOCK_SIZE_N": 64,
        "BLOCK_SIZE_K": 64,
        "GROUP_SIZE_M": 8,
        "num_stages": 8,
        "num_warps": 8,
        "ms": 8.379341125488281,
        "min_ms": 8.379341125488281,
        "max_ms": 8.379341125488281,
        "compile_time": 1.8530659675598145
    },
    {
        "BLOCK_SIZE_M": 32,
        "BLOCK_SIZE_N": 256,
        "BLOCK_SIZE_K": 64,
        "GROUP_SIZE_M": 8,
        "num_stages": 3,
        "num_warps": 4,
        "ms": 8.379460334777832,
        "min_ms": 8.379460334777832,
        "max_ms": 8.379460334777832,
        "compile_time": 2.2865068912506104
    },
    {
        "BLOCK_SIZE_M": 128,
        "BLOCK_SIZE_N": 64,
        "BLOCK_SIZE_K": 64,
        "GROUP_SIZE_M": 8,
        "num_stages": 2,
        "num_warps": 16,
        "ms": 8.382447242736816,
        "min_ms": 8.382447242736816,
        "max_ms": 8.382447242736816,
        "compile_time": 1.831125020980835
    },
    {
        "BLOCK_SIZE_M": 256,
        "BLOCK_SIZE_N": 128,
        "BLOCK_SIZE_K": 32,
        "GROUP_SIZE_M": 8,
        "num_stages": 1,
        "num_warps": 16,
        "ms": 8.392889976501465,
        "min_ms": 8.392889976501465,
        "max_ms": 8.392889976501465,
        "compile_time": 2.026082992553711
    },
    {
        "BLOCK_SIZE_M": 64,
        "BLOCK_SIZE_N": 256,
        "BLOCK_SIZE_K": 64,
        "GROUP_SIZE_M": 8,
        "num_stages": 3,
        "num_warps": 32,
        "ms": 8.395895004272461,
        "min_ms": 8.395895004272461,
        "max_ms": 8.395895004272461,
        "compile_time": 1.7986526489257812
    },
    {
        "BLOCK_SIZE_M": 512,
        "BLOCK_SIZE_N": 64,
        "BLOCK_SIZE_K": 16,
        "GROUP_SIZE_M": 8,
        "num_stages": 4,
        "num_warps": 8,
        "ms": 8.396428108215332,
        "min_ms": 8.396428108215332,
        "max_ms": 8.396428108215332,
        "compile_time": 2.4804861545562744
    },
    {
        "BLOCK_SIZE_M": 512,
        "BLOCK_SIZE_N": 64,
        "BLOCK_SIZE_K": 16,
        "GROUP_SIZE_M": 8,
        "num_stages": 3,
        "num_warps": 8,
        "ms": 8.399406433105469,
        "min_ms": 8.399406433105469,
        "max_ms": 8.399406433105469,
        "compile_time": 2.43117356300354
    },
    {
        "BLOCK_SIZE_M": 32,
        "BLOCK_SIZE_N": 512,
        "BLOCK_SIZE_K": 32,
        "GROUP_SIZE_M": 8,
        "num_stages": 5,
        "num_warps": 8,
        "ms": 8.40697193145752,
        "min_ms": 8.40697193145752,
        "max_ms": 8.40697193145752,
        "compile_time": 2.0561773777008057
    },
    {
        "BLOCK_SIZE_M": 64,
        "BLOCK_SIZE_N": 128,
        "BLOCK_SIZE_K": 128,
        "GROUP_SIZE_M": 8,
        "num_stages": 1,
        "num_warps": 4,
        "ms": 8.408212661743164,
        "min_ms": 8.408212661743164,
        "max_ms": 8.408212661743164,
        "compile_time": 2.2048697471618652
    },
    {
        "BLOCK_SIZE_M": 512,
        "BLOCK_SIZE_N": 64,
        "BLOCK_SIZE_K": 16,
        "GROUP_SIZE_M": 8,
        "num_stages": 5,
        "num_warps": 8,
        "ms": 8.409870147705078,
        "min_ms": 8.409870147705078,
        "max_ms": 8.409870147705078,
        "compile_time": 2.4776690006256104
    },
    {
        "BLOCK_SIZE_M": 64,
        "BLOCK_SIZE_N": 128,
        "BLOCK_SIZE_K": 16,
        "GROUP_SIZE_M": 8,
        "num_stages": 3,
        "num_warps": 8,
        "ms": 8.415948867797852,
        "min_ms": 8.415948867797852,
        "max_ms": 8.415948867797852,
        "compile_time": 1.7569031715393066
    },
    {
        "BLOCK_SIZE_M": 512,
        "BLOCK_SIZE_N": 64,
        "BLOCK_SIZE_K": 16,
        "GROUP_SIZE_M": 8,
        "num_stages": 6,
        "num_warps": 8,
        "ms": 8.419682502746582,
        "min_ms": 8.419682502746582,
        "max_ms": 8.419682502746582,
        "compile_time": 2.5047507286071777
    },
    {
        "BLOCK_SIZE_M": 512,
        "BLOCK_SIZE_N": 64,
        "BLOCK_SIZE_K": 16,
        "GROUP_SIZE_M": 8,
        "num_stages": 8,
        "num_warps": 8,
        "ms": 8.426887512207031,
        "min_ms": 8.426887512207031,
        "max_ms": 8.426887512207031,
        "compile_time": 2.603781223297119
    },
    {
        "BLOCK_SIZE_M": 512,
        "BLOCK_SIZE_N": 64,
        "BLOCK_SIZE_K": 16,
        "GROUP_SIZE_M": 8,
        "num_stages": 7,
        "num_warps": 8,
        "ms": 8.427576065063477,
        "min_ms": 8.427576065063477,
        "max_ms": 8.427576065063477,
        "compile_time": 2.6099696159362793
    },
    {
        "BLOCK_SIZE_M": 512,
        "BLOCK_SIZE_N": 64,
        "BLOCK_SIZE_K": 32,
        "GROUP_SIZE_M": 8,
        "num_stages": 5,
        "num_warps": 16,
        "ms": 8.451481819152832,
        "min_ms": 8.451481819152832,
        "max_ms": 8.451481819152832,
        "compile_time": 2.334320545196533
    },
    {
        "BLOCK_SIZE_M": 32,
        "BLOCK_SIZE_N": 256,
        "BLOCK_SIZE_K": 32,
        "GROUP_SIZE_M": 8,
        "num_stages": 3,
        "num_warps": 4,
        "ms": 8.457864761352539,
        "min_ms": 8.457864761352539,
        "max_ms": 8.457864761352539,
        "compile_time": 1.9863433837890625
    },
    {
        "BLOCK_SIZE_M": 32,
        "BLOCK_SIZE_N": 512,
        "BLOCK_SIZE_K": 32,
        "GROUP_SIZE_M": 8,
        "num_stages": 3,
        "num_warps": 4,
        "ms": 8.459656715393066,
        "min_ms": 8.459656715393066,
        "max_ms": 8.459656715393066,
        "compile_time": 2.6046760082244873
    },
    {
        "BLOCK_SIZE_M": 32,
        "BLOCK_SIZE_N": 256,
        "BLOCK_SIZE_K": 32,
        "GROUP_SIZE_M": 8,
        "num_stages": 4,
        "num_warps": 4,
        "ms": 8.475919723510742,
        "min_ms": 8.475919723510742,
        "max_ms": 8.475919723510742,
        "compile_time": 2.0250163078308105
    },
    {
        "BLOCK_SIZE_M": 32,
        "BLOCK_SIZE_N": 256,
        "BLOCK_SIZE_K": 64,
        "GROUP_SIZE_M": 8,
        "num_stages": 5,
        "num_warps": 4,
        "ms": 8.502238273620605,
        "min_ms": 8.502238273620605,
        "max_ms": 8.502238273620605,
        "compile_time": 2.4375813007354736
    },
    {
        "BLOCK_SIZE_M": 64,
        "BLOCK_SIZE_N": 64,
        "BLOCK_SIZE_K": 256,
        "GROUP_SIZE_M": 8,
        "num_stages": 3,
        "num_warps": 8,
        "ms": 8.506402015686035,
        "min_ms": 8.506402015686035,
        "max_ms": 8.506402015686035,
        "compile_time": 2.245314836502075
    },
    {
        "BLOCK_SIZE_M": 128,
        "BLOCK_SIZE_N": 32,
        "BLOCK_SIZE_K": 64,
        "GROUP_SIZE_M": 8,
        "num_stages": 3,
        "num_warps": 4,
        "ms": 8.510258674621582,
        "min_ms": 8.510258674621582,
        "max_ms": 8.510258674621582,
        "compile_time": 1.9755127429962158
    },
    {
        "BLOCK_SIZE_M": 32,
        "BLOCK_SIZE_N": 512,
        "BLOCK_SIZE_K": 16,
        "GROUP_SIZE_M": 8,
        "num_stages": 5,
        "num_warps": 8,
        "ms": 8.510600090026855,
        "min_ms": 8.510600090026855,
        "max_ms": 8.510600090026855,
        "compile_time": 1.9169275760650635
    },
    {
        "BLOCK_SIZE_M": 64,
        "BLOCK_SIZE_N": 64,
        "BLOCK_SIZE_K": 32,
        "GROUP_SIZE_M": 8,
        "num_stages": 4,
        "num_warps": 8,
        "ms": 8.518451690673828,
        "min_ms": 8.518451690673828,
        "max_ms": 8.518451690673828,
        "compile_time": 1.7777657508850098
    },
    {
        "BLOCK_SIZE_M": 64,
        "BLOCK_SIZE_N": 64,
        "BLOCK_SIZE_K": 32,
        "GROUP_SIZE_M": 8,
        "num_stages": 3,
        "num_warps": 8,
        "ms": 8.522530555725098,
        "min_ms": 8.522530555725098,
        "max_ms": 8.522530555725098,
        "compile_time": 1.7797164916992188
    },
    {
        "BLOCK_SIZE_M": 64,
        "BLOCK_SIZE_N": 128,
        "BLOCK_SIZE_K": 32,
        "GROUP_SIZE_M": 8,
        "num_stages": 1,
        "num_warps": 4,
        "ms": 8.5293607711792,
        "min_ms": 8.5293607711792,
        "max_ms": 8.5293607711792,
        "compile_time": 1.8774843215942383
    },
    {
        "BLOCK_SIZE_M": 256,
        "BLOCK_SIZE_N": 64,
        "BLOCK_SIZE_K": 64,
        "GROUP_SIZE_M": 8,
        "num_stages": 2,
        "num_warps": 16,
        "ms": 8.532135009765625,
        "min_ms": 8.532135009765625,
        "max_ms": 8.532135009765625,
        "compile_time": 2.0001394748687744
    },
    {
        "BLOCK_SIZE_M": 256,
        "BLOCK_SIZE_N": 32,
        "BLOCK_SIZE_K": 32,
        "GROUP_SIZE_M": 8,
        "num_stages": 2,
        "num_warps": 2,
        "ms": 8.532770156860352,
        "min_ms": 8.532770156860352,
        "max_ms": 8.532770156860352,
        "compile_time": 2.7938132286071777
    },
    {
        "BLOCK_SIZE_M": 32,
        "BLOCK_SIZE_N": 256,
        "BLOCK_SIZE_K": 16,
        "GROUP_SIZE_M": 8,
        "num_stages": 4,
        "num_warps": 2,
        "ms": 8.535398483276367,
        "min_ms": 8.535398483276367,
        "max_ms": 8.535398483276367,
        "compile_time": 2.2256648540496826
    },
    {
        "BLOCK_SIZE_M": 32,
        "BLOCK_SIZE_N": 512,
        "BLOCK_SIZE_K": 32,
        "GROUP_SIZE_M": 8,
        "num_stages": 5,
        "num_warps": 4,
        "ms": 8.539597511291504,
        "min_ms": 8.539597511291504,
        "max_ms": 8.539597511291504,
        "compile_time": 2.7580060958862305
    },
    {
        "BLOCK_SIZE_M": 64,
        "BLOCK_SIZE_N": 64,
        "BLOCK_SIZE_K": 32,
        "GROUP_SIZE_M": 8,
        "num_stages": 6,
        "num_warps": 8,
        "ms": 8.539937973022461,
        "min_ms": 8.539937973022461,
        "max_ms": 8.539937973022461,
        "compile_time": 1.7850837707519531
    },
    {
        "BLOCK_SIZE_M": 64,
        "BLOCK_SIZE_N": 64,
        "BLOCK_SIZE_K": 32,
        "GROUP_SIZE_M": 8,
        "num_stages": 5,
        "num_warps": 8,
        "ms": 8.540672302246094,
        "min_ms": 8.540672302246094,
        "max_ms": 8.540672302246094,
        "compile_time": 1.7702953815460205
    },
    {
        "BLOCK_SIZE_M": 32,
        "BLOCK_SIZE_N": 256,
        "BLOCK_SIZE_K": 64,
        "GROUP_SIZE_M": 8,
        "num_stages": 3,
        "num_warps": 8,
        "ms": 8.54149055480957,
        "min_ms": 8.54149055480957,
        "max_ms": 8.54149055480957,
        "compile_time": 1.934960126876831
    },
    {
        "BLOCK_SIZE_M": 32,
        "BLOCK_SIZE_N": 256,
        "BLOCK_SIZE_K": 32,
        "GROUP_SIZE_M": 8,
        "num_stages": 8,
        "num_warps": 4,
        "ms": 8.54393196105957,
        "min_ms": 8.54393196105957,
        "max_ms": 8.54393196105957,
        "compile_time": 2.191561222076416
    },
    {
        "BLOCK_SIZE_M": 128,
        "BLOCK_SIZE_N": 128,
        "BLOCK_SIZE_K": 256,
        "GROUP_SIZE_M": 8,
        "num_stages": 1,
        "num_warps": 16,
        "ms": 8.54490852355957,
        "min_ms": 8.54490852355957,
        "max_ms": 8.54490852355957,
        "compile_time": 2.2051949501037598
    },
    {
        "BLOCK_SIZE_M": 32,
        "BLOCK_SIZE_N": 512,
        "BLOCK_SIZE_K": 16,
        "GROUP_SIZE_M": 8,
        "num_stages": 8,
        "num_warps": 4,
        "ms": 8.544939041137695,
        "min_ms": 8.544939041137695,
        "max_ms": 8.544939041137695,
        "compile_time": 2.442532539367676
    },
    {
        "BLOCK_SIZE_M": 128,
        "BLOCK_SIZE_N": 256,
        "BLOCK_SIZE_K": 16,
        "GROUP_SIZE_M": 8,
        "num_stages": 7,
        "num_warps": 32,
        "ms": 8.550251960754395,
        "min_ms": 8.550251960754395,
        "max_ms": 8.550251960754395,
        "compile_time": 1.8957674503326416
    },
    {
        "BLOCK_SIZE_M": 128,
        "BLOCK_SIZE_N": 256,
        "BLOCK_SIZE_K": 16,
        "GROUP_SIZE_M": 8,
        "num_stages": 3,
        "num_warps": 32,
        "ms": 8.550809860229492,
        "min_ms": 8.550809860229492,
        "max_ms": 8.550809860229492,
        "compile_time": 1.8800055980682373
    },
    {
        "BLOCK_SIZE_M": 128,
        "BLOCK_SIZE_N": 256,
        "BLOCK_SIZE_K": 16,
        "GROUP_SIZE_M": 8,
        "num_stages": 6,
        "num_warps": 32,
        "ms": 8.55455207824707,
        "min_ms": 8.55455207824707,
        "max_ms": 8.55455207824707,
        "compile_time": 1.841853141784668
    },
    {
        "BLOCK_SIZE_M": 128,
        "BLOCK_SIZE_N": 256,
        "BLOCK_SIZE_K": 16,
        "GROUP_SIZE_M": 8,
        "num_stages": 4,
        "num_warps": 32,
        "ms": 8.557791709899902,
        "min_ms": 8.557791709899902,
        "max_ms": 8.557791709899902,
        "compile_time": 1.855362892150879
    },
    {
        "BLOCK_SIZE_M": 32,
        "BLOCK_SIZE_N": 512,
        "BLOCK_SIZE_K": 16,
        "GROUP_SIZE_M": 8,
        "num_stages": 4,
        "num_warps": 4,
        "ms": 8.558096885681152,
        "min_ms": 8.558096885681152,
        "max_ms": 8.558096885681152,
        "compile_time": 2.3030853271484375
    },
    {
        "BLOCK_SIZE_M": 128,
        "BLOCK_SIZE_N": 256,
        "BLOCK_SIZE_K": 16,
        "GROUP_SIZE_M": 8,
        "num_stages": 8,
        "num_warps": 32,
        "ms": 8.560844421386719,
        "min_ms": 8.560844421386719,
        "max_ms": 8.560844421386719,
        "compile_time": 1.8824043273925781
    },
    {
        "BLOCK_SIZE_M": 512,
        "BLOCK_SIZE_N": 64,
        "BLOCK_SIZE_K": 16,
        "GROUP_SIZE_M": 8,
        "num_stages": 3,
        "num_warps": 16,
        "ms": 8.562464714050293,
        "min_ms": 8.562464714050293,
        "max_ms": 8.562464714050293,
        "compile_time": 2.138868808746338
    },
    {
        "BLOCK_SIZE_M": 128,
        "BLOCK_SIZE_N": 256,
        "BLOCK_SIZE_K": 16,
        "GROUP_SIZE_M": 8,
        "num_stages": 5,
        "num_warps": 32,
        "ms": 8.562799453735352,
        "min_ms": 8.562799453735352,
        "max_ms": 8.562799453735352,
        "compile_time": 1.8377900123596191
    },
    {
        "BLOCK_SIZE_M": 256,
        "BLOCK_SIZE_N": 128,
        "BLOCK_SIZE_K": 32,
        "GROUP_SIZE_M": 8,
        "num_stages": 1,
        "num_warps": 32,
        "ms": 8.565258026123047,
        "min_ms": 8.565258026123047,
        "max_ms": 8.565258026123047,
        "compile_time": 1.9657788276672363
    },
    {
        "BLOCK_SIZE_M": 512,
        "BLOCK_SIZE_N": 64,
        "BLOCK_SIZE_K": 16,
        "GROUP_SIZE_M": 8,
        "num_stages": 5,
        "num_warps": 16,
        "ms": 8.566411972045898,
        "min_ms": 8.566411972045898,
        "max_ms": 8.566411972045898,
        "compile_time": 2.1571431159973145
    },
    {
        "BLOCK_SIZE_M": 128,
        "BLOCK_SIZE_N": 32,
        "BLOCK_SIZE_K": 64,
        "GROUP_SIZE_M": 8,
        "num_stages": 3,
        "num_warps": 2,
        "ms": 8.566937446594238,
        "min_ms": 8.566937446594238,
        "max_ms": 8.566937446594238,
        "compile_time": 2.4369704723358154
    },
    {
        "BLOCK_SIZE_M": 512,
        "BLOCK_SIZE_N": 64,
        "BLOCK_SIZE_K": 16,
        "GROUP_SIZE_M": 8,
        "num_stages": 6,
        "num_warps": 16,
        "ms": 8.568608283996582,
        "min_ms": 8.568608283996582,
        "max_ms": 8.568608283996582,
        "compile_time": 2.191075086593628
    },
    {
        "BLOCK_SIZE_M": 128,
        "BLOCK_SIZE_N": 32,
        "BLOCK_SIZE_K": 64,
        "GROUP_SIZE_M": 8,
        "num_stages": 5,
        "num_warps": 4,
        "ms": 8.579839706420898,
        "min_ms": 8.579839706420898,
        "max_ms": 8.579839706420898,
        "compile_time": 2.259352207183838
    },
    {
        "BLOCK_SIZE_M": 64,
        "BLOCK_SIZE_N": 256,
        "BLOCK_SIZE_K": 256,
        "GROUP_SIZE_M": 8,
        "num_stages": 2,
        "num_warps": 8,
        "ms": 8.590426445007324,
        "min_ms": 8.590426445007324,
        "max_ms": 8.590426445007324,
        "compile_time": 3.0145695209503174
    },
    {
        "BLOCK_SIZE_M": 64,
        "BLOCK_SIZE_N": 64,
        "BLOCK_SIZE_K": 16,
        "GROUP_SIZE_M": 8,
        "num_stages": 4,
        "num_warps": 4,
        "ms": 8.592691421508789,
        "min_ms": 8.592691421508789,
        "max_ms": 8.592691421508789,
        "compile_time": 1.775512933731079
    },
    {
        "BLOCK_SIZE_M": 512,
        "BLOCK_SIZE_N": 64,
        "BLOCK_SIZE_K": 16,
        "GROUP_SIZE_M": 8,
        "num_stages": 7,
        "num_warps": 16,
        "ms": 8.594525337219238,
        "min_ms": 8.594525337219238,
        "max_ms": 8.594525337219238,
        "compile_time": 2.269472360610962
    },
    {
        "BLOCK_SIZE_M": 64,
        "BLOCK_SIZE_N": 64,
        "BLOCK_SIZE_K": 32,
        "GROUP_SIZE_M": 8,
        "num_stages": 7,
        "num_warps": 8,
        "ms": 8.597025871276855,
        "min_ms": 8.597025871276855,
        "max_ms": 8.597025871276855,
        "compile_time": 1.7958087921142578
    },
    {
        "BLOCK_SIZE_M": 64,
        "BLOCK_SIZE_N": 64,
        "BLOCK_SIZE_K": 16,
        "GROUP_SIZE_M": 8,
        "num_stages": 3,
        "num_warps": 4,
        "ms": 8.598408699035645,
        "min_ms": 8.598408699035645,
        "max_ms": 8.598408699035645,
        "compile_time": 1.7679433822631836
    },
    {
        "BLOCK_SIZE_M": 128,
        "BLOCK_SIZE_N": 32,
        "BLOCK_SIZE_K": 64,
        "GROUP_SIZE_M": 8,
        "num_stages": 5,
        "num_warps": 2,
        "ms": 8.606874465942383,
        "min_ms": 8.606874465942383,
        "max_ms": 8.606874465942383,
        "compile_time": 2.6205453872680664
    },
    {
        "BLOCK_SIZE_M": 512,
        "BLOCK_SIZE_N": 64,
        "BLOCK_SIZE_K": 16,
        "GROUP_SIZE_M": 8,
        "num_stages": 4,
        "num_warps": 16,
        "ms": 8.608414649963379,
        "min_ms": 8.608414649963379,
        "max_ms": 8.608414649963379,
        "compile_time": 2.1529953479766846
    },
    {
        "BLOCK_SIZE_M": 32,
        "BLOCK_SIZE_N": 256,
        "BLOCK_SIZE_K": 16,
        "GROUP_SIZE_M": 8,
        "num_stages": 4,
        "num_warps": 4,
        "ms": 8.611788749694824,
        "min_ms": 8.611788749694824,
        "max_ms": 8.611788749694824,
        "compile_time": 1.8620212078094482
    },
    {
        "BLOCK_SIZE_M": 32,
        "BLOCK_SIZE_N": 256,
        "BLOCK_SIZE_K": 32,
        "GROUP_SIZE_M": 8,
        "num_stages": 7,
        "num_warps": 4,
        "ms": 8.61382007598877,
        "min_ms": 8.61382007598877,
        "max_ms": 8.61382007598877,
        "compile_time": 2.1540982723236084
    },
    {
        "BLOCK_SIZE_M": 32,
        "BLOCK_SIZE_N": 256,
        "BLOCK_SIZE_K": 16,
        "GROUP_SIZE_M": 8,
        "num_stages": 3,
        "num_warps": 2,
        "ms": 8.619708061218262,
        "min_ms": 8.619708061218262,
        "max_ms": 8.619708061218262,
        "compile_time": 2.2215065956115723
    },
    {
        "BLOCK_SIZE_M": 64,
        "BLOCK_SIZE_N": 64,
        "BLOCK_SIZE_K": 64,
        "GROUP_SIZE_M": 8,
        "num_stages": 7,
        "num_warps": 2,
        "ms": 8.62234115600586,
        "min_ms": 8.62234115600586,
        "max_ms": 8.62234115600586,
        "compile_time": 2.3490140438079834
    },
    {
        "BLOCK_SIZE_M": 32,
        "BLOCK_SIZE_N": 512,
        "BLOCK_SIZE_K": 32,
        "GROUP_SIZE_M": 8,
        "num_stages": 4,
        "num_warps": 8,
        "ms": 8.623699188232422,
        "min_ms": 8.623699188232422,
        "max_ms": 8.623699188232422,
        "compile_time": 2.0095245838165283
    },
    {
        "BLOCK_SIZE_M": 64,
        "BLOCK_SIZE_N": 64,
        "BLOCK_SIZE_K": 128,
        "GROUP_SIZE_M": 8,
        "num_stages": 2,
        "num_warps": 8,
        "ms": 8.626733779907227,
        "min_ms": 8.626733779907227,
        "max_ms": 8.626733779907227,
        "compile_time": 1.8190011978149414
    },
    {
        "BLOCK_SIZE_M": 64,
        "BLOCK_SIZE_N": 64,
        "BLOCK_SIZE_K": 64,
        "GROUP_SIZE_M": 8,
        "num_stages": 8,
        "num_warps": 2,
        "ms": 8.62686538696289,
        "min_ms": 8.62686538696289,
        "max_ms": 8.62686538696289,
        "compile_time": 2.4284021854400635
    },
    {
        "BLOCK_SIZE_M": 32,
        "BLOCK_SIZE_N": 256,
        "BLOCK_SIZE_K": 32,
        "GROUP_SIZE_M": 8,
        "num_stages": 5,
        "num_warps": 8,
        "ms": 8.631841659545898,
        "min_ms": 8.631841659545898,
        "max_ms": 8.631841659545898,
        "compile_time": 1.8350191116333008
    },
    {
        "BLOCK_SIZE_M": 64,
        "BLOCK_SIZE_N": 64,
        "BLOCK_SIZE_K": 16,
        "GROUP_SIZE_M": 8,
        "num_stages": 6,
        "num_warps": 4,
        "ms": 8.632046699523926,
        "min_ms": 8.632046699523926,
        "max_ms": 8.632046699523926,
        "compile_time": 1.8561136722564697
    },
    {
        "BLOCK_SIZE_M": 64,
        "BLOCK_SIZE_N": 64,
        "BLOCK_SIZE_K": 64,
        "GROUP_SIZE_M": 8,
        "num_stages": 2,
        "num_warps": 8,
        "ms": 8.635019302368164,
        "min_ms": 8.635019302368164,
        "max_ms": 8.635019302368164,
        "compile_time": 1.6897306442260742
    },
    {
        "BLOCK_SIZE_M": 512,
        "BLOCK_SIZE_N": 64,
        "BLOCK_SIZE_K": 16,
        "GROUP_SIZE_M": 8,
        "num_stages": 8,
        "num_warps": 16,
        "ms": 8.640400886535645,
        "min_ms": 8.640400886535645,
        "max_ms": 8.640400886535645,
        "compile_time": 2.2296228408813477
    },
    {
        "BLOCK_SIZE_M": 32,
        "BLOCK_SIZE_N": 256,
        "BLOCK_SIZE_K": 32,
        "GROUP_SIZE_M": 8,
        "num_stages": 6,
        "num_warps": 4,
        "ms": 8.64101505279541,
        "min_ms": 8.64101505279541,
        "max_ms": 8.64101505279541,
        "compile_time": 2.0203614234924316
    },
    {
        "BLOCK_SIZE_M": 256,
        "BLOCK_SIZE_N": 32,
        "BLOCK_SIZE_K": 32,
        "GROUP_SIZE_M": 8,
        "num_stages": 3,
        "num_warps": 8,
        "ms": 8.64104175567627,
        "min_ms": 8.64104175567627,
        "max_ms": 8.64104175567627,
        "compile_time": 1.999664068222046
    },
    {
        "BLOCK_SIZE_M": 32,
        "BLOCK_SIZE_N": 256,
        "BLOCK_SIZE_K": 16,
        "GROUP_SIZE_M": 8,
        "num_stages": 5,
        "num_warps": 2,
        "ms": 8.652083396911621,
        "min_ms": 8.652083396911621,
        "max_ms": 8.652083396911621,
        "compile_time": 2.2925772666931152
    },
    {
        "BLOCK_SIZE_M": 64,
        "BLOCK_SIZE_N": 64,
        "BLOCK_SIZE_K": 16,
        "GROUP_SIZE_M": 8,
        "num_stages": 5,
        "num_warps": 4,
        "ms": 8.65308952331543,
        "min_ms": 8.65308952331543,
        "max_ms": 8.65308952331543,
        "compile_time": 1.8451755046844482
    },
    {
        "BLOCK_SIZE_M": 64,
        "BLOCK_SIZE_N": 64,
        "BLOCK_SIZE_K": 16,
        "GROUP_SIZE_M": 8,
        "num_stages": 7,
        "num_warps": 4,
        "ms": 8.65553092956543,
        "min_ms": 8.65553092956543,
        "max_ms": 8.65553092956543,
        "compile_time": 1.8434152603149414
    },
    {
        "BLOCK_SIZE_M": 32,
        "BLOCK_SIZE_N": 256,
        "BLOCK_SIZE_K": 64,
        "GROUP_SIZE_M": 8,
        "num_stages": 5,
        "num_warps": 8,
        "ms": 8.655939102172852,
        "min_ms": 8.655939102172852,
        "max_ms": 8.655939102172852,
        "compile_time": 2.017744779586792
    },
    {
        "BLOCK_SIZE_M": 128,
        "BLOCK_SIZE_N": 32,
        "BLOCK_SIZE_K": 64,
        "GROUP_SIZE_M": 8,
        "num_stages": 4,
        "num_warps": 2,
        "ms": 8.657882690429688,
        "min_ms": 8.657882690429688,
        "max_ms": 8.657882690429688,
        "compile_time": 2.4229936599731445
    },
    {
        "BLOCK_SIZE_M": 32,
        "BLOCK_SIZE_N": 512,
        "BLOCK_SIZE_K": 16,
        "GROUP_SIZE_M": 8,
        "num_stages": 7,
        "num_warps": 4,
        "ms": 8.659578323364258,
        "min_ms": 8.659578323364258,
        "max_ms": 8.659578323364258,
        "compile_time": 2.3263514041900635
    },
    {
        "BLOCK_SIZE_M": 32,
        "BLOCK_SIZE_N": 512,
        "BLOCK_SIZE_K": 16,
        "GROUP_SIZE_M": 8,
        "num_stages": 4,
        "num_warps": 8,
        "ms": 8.664712905883789,
        "min_ms": 8.664712905883789,
        "max_ms": 8.664712905883789,
        "compile_time": 1.9197883605957031
    },
    {
        "BLOCK_SIZE_M": 32,
        "BLOCK_SIZE_N": 512,
        "BLOCK_SIZE_K": 32,
        "GROUP_SIZE_M": 8,
        "num_stages": 5,
        "num_warps": 16,
        "ms": 8.671163558959961,
        "min_ms": 8.671163558959961,
        "max_ms": 8.671163558959961,
        "compile_time": 1.8520092964172363
    },
    {
        "BLOCK_SIZE_M": 128,
        "BLOCK_SIZE_N": 32,
        "BLOCK_SIZE_K": 32,
        "GROUP_SIZE_M": 8,
        "num_stages": 6,
        "num_warps": 2,
        "ms": 8.671589851379395,
        "min_ms": 8.671589851379395,
        "max_ms": 8.671589851379395,
        "compile_time": 2.2497785091400146
    },
    {
        "BLOCK_SIZE_M": 64,
        "BLOCK_SIZE_N": 64,
        "BLOCK_SIZE_K": 16,
        "GROUP_SIZE_M": 8,
        "num_stages": 2,
        "num_warps": 2,
        "ms": 8.678772926330566,
        "min_ms": 8.678772926330566,
        "max_ms": 8.678772926330566,
        "compile_time": 1.8026885986328125
    },
    {
        "BLOCK_SIZE_M": 64,
        "BLOCK_SIZE_N": 64,
        "BLOCK_SIZE_K": 16,
        "GROUP_SIZE_M": 8,
        "num_stages": 8,
        "num_warps": 4,
        "ms": 8.682649612426758,
        "min_ms": 8.682649612426758,
        "max_ms": 8.682649612426758,
        "compile_time": 1.862475872039795
    },
    {
        "BLOCK_SIZE_M": 32,
        "BLOCK_SIZE_N": 512,
        "BLOCK_SIZE_K": 64,
        "GROUP_SIZE_M": 8,
        "num_stages": 3,
        "num_warps": 8,
        "ms": 8.689142227172852,
        "min_ms": 8.689142227172852,
        "max_ms": 8.689142227172852,
        "compile_time": 2.258751392364502
    },
    {
        "BLOCK_SIZE_M": 128,
        "BLOCK_SIZE_N": 32,
        "BLOCK_SIZE_K": 32,
        "GROUP_SIZE_M": 8,
        "num_stages": 5,
        "num_warps": 2,
        "ms": 8.690603256225586,
        "min_ms": 8.690603256225586,
        "max_ms": 8.690603256225586,
        "compile_time": 2.193425416946411
    },
    {
        "BLOCK_SIZE_M": 128,
        "BLOCK_SIZE_N": 32,
        "BLOCK_SIZE_K": 32,
        "GROUP_SIZE_M": 8,
        "num_stages": 8,
        "num_warps": 2,
        "ms": 8.69102954864502,
        "min_ms": 8.69102954864502,
        "max_ms": 8.69102954864502,
        "compile_time": 2.3112895488739014
    },
    {
        "BLOCK_SIZE_M": 32,
        "BLOCK_SIZE_N": 256,
        "BLOCK_SIZE_K": 16,
        "GROUP_SIZE_M": 8,
        "num_stages": 5,
        "num_warps": 4,
        "ms": 8.693896293640137,
        "min_ms": 8.693896293640137,
        "max_ms": 8.693896293640137,
        "compile_time": 1.8938424587249756
    },
    {
        "BLOCK_SIZE_M": 32,
        "BLOCK_SIZE_N": 256,
        "BLOCK_SIZE_K": 32,
        "GROUP_SIZE_M": 8,
        "num_stages": 4,
        "num_warps": 8,
        "ms": 8.69874382019043,
        "min_ms": 8.69874382019043,
        "max_ms": 8.69874382019043,
        "compile_time": 1.8235094547271729
    },
    {
        "BLOCK_SIZE_M": 64,
        "BLOCK_SIZE_N": 256,
        "BLOCK_SIZE_K": 32,
        "GROUP_SIZE_M": 8,
        "num_stages": 1,
        "num_warps": 4,
        "ms": 8.702455520629883,
        "min_ms": 8.702455520629883,
        "max_ms": 8.702455520629883,
        "compile_time": 2.1873650550842285
    },
    {
        "BLOCK_SIZE_M": 128,
        "BLOCK_SIZE_N": 32,
        "BLOCK_SIZE_K": 32,
        "GROUP_SIZE_M": 8,
        "num_stages": 4,
        "num_warps": 2,
        "ms": 8.705467224121094,
        "min_ms": 8.705467224121094,
        "max_ms": 8.705467224121094,
        "compile_time": 2.175199508666992
    },
    {
        "BLOCK_SIZE_M": 128,
        "BLOCK_SIZE_N": 32,
        "BLOCK_SIZE_K": 32,
        "GROUP_SIZE_M": 8,
        "num_stages": 7,
        "num_warps": 2,
        "ms": 8.706014633178711,
        "min_ms": 8.706014633178711,
        "max_ms": 8.706014633178711,
        "compile_time": 2.250518560409546
    },
    {
        "BLOCK_SIZE_M": 256,
        "BLOCK_SIZE_N": 32,
        "BLOCK_SIZE_K": 32,
        "GROUP_SIZE_M": 8,
        "num_stages": 2,
        "num_warps": 4,
        "ms": 8.710997581481934,
        "min_ms": 8.710997581481934,
        "max_ms": 8.710997581481934,
        "compile_time": 2.1871912479400635
    },
    {
        "BLOCK_SIZE_M": 512,
        "BLOCK_SIZE_N": 32,
        "BLOCK_SIZE_K": 32,
        "GROUP_SIZE_M": 8,
        "num_stages": 2,
        "num_warps": 4,
        "ms": 8.711427688598633,
        "min_ms": 8.711427688598633,
        "max_ms": 8.711427688598633,
        "compile_time": 2.907078266143799
    },
    {
        "BLOCK_SIZE_M": 64,
        "BLOCK_SIZE_N": 256,
        "BLOCK_SIZE_K": 64,
        "GROUP_SIZE_M": 8,
        "num_stages": 2,
        "num_warps": 16,
        "ms": 8.714128494262695,
        "min_ms": 8.714128494262695,
        "max_ms": 8.714128494262695,
        "compile_time": 1.8343896865844727
    },
    {
        "BLOCK_SIZE_M": 64,
        "BLOCK_SIZE_N": 256,
        "BLOCK_SIZE_K": 256,
        "GROUP_SIZE_M": 8,
        "num_stages": 1,
        "num_warps": 16,
        "ms": 8.720328330993652,
        "min_ms": 8.720328330993652,
        "max_ms": 8.720328330993652,
        "compile_time": 2.1698713302612305
    },
    {
        "BLOCK_SIZE_M": 512,
        "BLOCK_SIZE_N": 32,
        "BLOCK_SIZE_K": 32,
        "GROUP_SIZE_M": 8,
        "num_stages": 5,
        "num_warps": 4,
        "ms": 8.72657299041748,
        "min_ms": 8.72657299041748,
        "max_ms": 8.72657299041748,
        "compile_time": 2.9385247230529785
    },
    {
        "BLOCK_SIZE_M": 128,
        "BLOCK_SIZE_N": 256,
        "BLOCK_SIZE_K": 128,
        "GROUP_SIZE_M": 8,
        "num_stages": 1,
        "num_warps": 32,
        "ms": 8.738685607910156,
        "min_ms": 8.738685607910156,
        "max_ms": 8.738685607910156,
        "compile_time": 1.9347560405731201
    },
    {
        "BLOCK_SIZE_M": 256,
        "BLOCK_SIZE_N": 128,
        "BLOCK_SIZE_K": 32,
        "GROUP_SIZE_M": 8,
        "num_stages": 2,
        "num_warps": 16,
        "ms": 8.740026473999023,
        "min_ms": 8.740026473999023,
        "max_ms": 8.740026473999023,
        "compile_time": 2.190314769744873
    },
    {
        "BLOCK_SIZE_M": 32,
        "BLOCK_SIZE_N": 512,
        "BLOCK_SIZE_K": 32,
        "GROUP_SIZE_M": 8,
        "num_stages": 4,
        "num_warps": 4,
        "ms": 8.740248680114746,
        "min_ms": 8.740248680114746,
        "max_ms": 8.740248680114746,
        "compile_time": 2.6429736614227295
    },
    {
        "BLOCK_SIZE_M": 256,
        "BLOCK_SIZE_N": 32,
        "BLOCK_SIZE_K": 32,
        "GROUP_SIZE_M": 8,
        "num_stages": 4,
        "num_warps": 4,
        "ms": 8.740899085998535,
        "min_ms": 8.740899085998535,
        "max_ms": 8.740899085998535,
        "compile_time": 2.338705539703369
    },
    {
        "BLOCK_SIZE_M": 128,
        "BLOCK_SIZE_N": 32,
        "BLOCK_SIZE_K": 128,
        "GROUP_SIZE_M": 8,
        "num_stages": 3,
        "num_warps": 4,
        "ms": 8.741292953491211,
        "min_ms": 8.741292953491211,
        "max_ms": 8.741292953491211,
        "compile_time": 2.392690420150757
    },
    {
        "BLOCK_SIZE_M": 128,
        "BLOCK_SIZE_N": 32,
        "BLOCK_SIZE_K": 64,
        "GROUP_SIZE_M": 8,
        "num_stages": 4,
        "num_warps": 4,
        "ms": 8.745834350585938,
        "min_ms": 8.745834350585938,
        "max_ms": 8.745834350585938,
        "compile_time": 2.0276334285736084
    },
    {
        "BLOCK_SIZE_M": 128,
        "BLOCK_SIZE_N": 32,
        "BLOCK_SIZE_K": 64,
        "GROUP_SIZE_M": 8,
        "num_stages": 7,
        "num_warps": 4,
        "ms": 8.746468544006348,
        "min_ms": 8.746468544006348,
        "max_ms": 8.746468544006348,
        "compile_time": 2.1997997760772705
    },
    {
        "BLOCK_SIZE_M": 64,
        "BLOCK_SIZE_N": 128,
        "BLOCK_SIZE_K": 16,
        "GROUP_SIZE_M": 8,
        "num_stages": 2,
        "num_warps": 2,
        "ms": 8.751792907714844,
        "min_ms": 8.751792907714844,
        "max_ms": 8.751792907714844,
        "compile_time": 2.0828258991241455
    },
    {
        "BLOCK_SIZE_M": 256,
        "BLOCK_SIZE_N": 32,
        "BLOCK_SIZE_K": 32,
        "GROUP_SIZE_M": 8,
        "num_stages": 5,
        "num_warps": 4,
        "ms": 8.754789352416992,
        "min_ms": 8.754789352416992,
        "max_ms": 8.754789352416992,
        "compile_time": 2.3301777839660645
    },
    {
        "BLOCK_SIZE_M": 128,
        "BLOCK_SIZE_N": 32,
        "BLOCK_SIZE_K": 64,
        "GROUP_SIZE_M": 8,
        "num_stages": 8,
        "num_warps": 4,
        "ms": 8.758495330810547,
        "min_ms": 8.758495330810547,
        "max_ms": 8.758495330810547,
        "compile_time": 2.27303147315979
    },
    {
        "BLOCK_SIZE_M": 512,
        "BLOCK_SIZE_N": 32,
        "BLOCK_SIZE_K": 32,
        "GROUP_SIZE_M": 8,
        "num_stages": 4,
        "num_warps": 4,
        "ms": 8.761798858642578,
        "min_ms": 8.761798858642578,
        "max_ms": 8.761798858642578,
        "compile_time": 2.8850367069244385
    },
    {
        "BLOCK_SIZE_M": 32,
        "BLOCK_SIZE_N": 256,
        "BLOCK_SIZE_K": 16,
        "GROUP_SIZE_M": 8,
        "num_stages": 6,
        "num_warps": 2,
        "ms": 8.763015747070312,
        "min_ms": 8.763015747070312,
        "max_ms": 8.763015747070312,
        "compile_time": 2.325801372528076
    },
    {
        "BLOCK_SIZE_M": 32,
        "BLOCK_SIZE_N": 256,
        "BLOCK_SIZE_K": 16,
        "GROUP_SIZE_M": 8,
        "num_stages": 6,
        "num_warps": 4,
        "ms": 8.763067245483398,
        "min_ms": 8.763067245483398,
        "max_ms": 8.763067245483398,
        "compile_time": 1.9228720664978027
    },
    {
        "BLOCK_SIZE_M": 128,
        "BLOCK_SIZE_N": 32,
        "BLOCK_SIZE_K": 32,
        "GROUP_SIZE_M": 8,
        "num_stages": 2,
        "num_warps": 2,
        "ms": 8.764527320861816,
        "min_ms": 8.764527320861816,
        "max_ms": 8.764527320861816,
        "compile_time": 2.030174732208252
    },
    {
        "BLOCK_SIZE_M": 128,
        "BLOCK_SIZE_N": 32,
        "BLOCK_SIZE_K": 32,
        "GROUP_SIZE_M": 8,
        "num_stages": 5,
        "num_warps": 4,
        "ms": 8.764739990234375,
        "min_ms": 8.764739990234375,
        "max_ms": 8.764739990234375,
        "compile_time": 1.9918065071105957
    },
    {
        "BLOCK_SIZE_M": 32,
        "BLOCK_SIZE_N": 512,
        "BLOCK_SIZE_K": 16,
        "GROUP_SIZE_M": 8,
        "num_stages": 6,
        "num_warps": 4,
        "ms": 8.76707935333252,
        "min_ms": 8.76707935333252,
        "max_ms": 8.76707935333252,
        "compile_time": 2.2728121280670166
    },
    {
        "BLOCK_SIZE_M": 64,
        "BLOCK_SIZE_N": 64,
        "BLOCK_SIZE_K": 256,
        "GROUP_SIZE_M": 8,
        "num_stages": 2,
        "num_warps": 8,
        "ms": 8.767413139343262,
        "min_ms": 8.767413139343262,
        "max_ms": 8.767413139343262,
        "compile_time": 2.10315203666687
    },
    {
        "BLOCK_SIZE_M": 128,
        "BLOCK_SIZE_N": 256,
        "BLOCK_SIZE_K": 32,
        "GROUP_SIZE_M": 8,
        "num_stages": 1,
        "num_warps": 16,
        "ms": 8.768865585327148,
        "min_ms": 8.768865585327148,
        "max_ms": 8.768865585327148,
        "compile_time": 1.9345645904541016
    },
    {
        "BLOCK_SIZE_M": 32,
        "BLOCK_SIZE_N": 256,
        "BLOCK_SIZE_K": 16,
        "GROUP_SIZE_M": 8,
        "num_stages": 8,
        "num_warps": 4,
        "ms": 8.772727966308594,
        "min_ms": 8.772727966308594,
        "max_ms": 8.772727966308594,
        "compile_time": 1.951371192932129
    },
    {
        "BLOCK_SIZE_M": 64,
        "BLOCK_SIZE_N": 128,
        "BLOCK_SIZE_K": 32,
        "GROUP_SIZE_M": 8,
        "num_stages": 1,
        "num_warps": 2,
        "ms": 8.783480644226074,
        "min_ms": 8.783480644226074,
        "max_ms": 8.783480644226074,
        "compile_time": 2.2638156414031982
    },
    {
        "BLOCK_SIZE_M": 256,
        "BLOCK_SIZE_N": 64,
        "BLOCK_SIZE_K": 128,
        "GROUP_SIZE_M": 8,
        "num_stages": 2,
        "num_warps": 4,
        "ms": 8.785191535949707,
        "min_ms": 8.785191535949707,
        "max_ms": 8.785191535949707,
        "compile_time": 3.397911548614502
    },
    {
        "BLOCK_SIZE_M": 32,
        "BLOCK_SIZE_N": 512,
        "BLOCK_SIZE_K": 32,
        "GROUP_SIZE_M": 8,
        "num_stages": 4,
        "num_warps": 16,
        "ms": 8.790480613708496,
        "min_ms": 8.790480613708496,
        "max_ms": 8.790480613708496,
        "compile_time": 1.7736423015594482
    },
    {
        "BLOCK_SIZE_M": 256,
        "BLOCK_SIZE_N": 32,
        "BLOCK_SIZE_K": 32,
        "GROUP_SIZE_M": 8,
        "num_stages": 4,
        "num_warps": 8,
        "ms": 8.794351577758789,
        "min_ms": 8.794351577758789,
        "max_ms": 8.794351577758789,
        "compile_time": 2.154209613800049
    },
    {
        "BLOCK_SIZE_M": 64,
        "BLOCK_SIZE_N": 256,
        "BLOCK_SIZE_K": 128,
        "GROUP_SIZE_M": 8,
        "num_stages": 2,
        "num_warps": 4,
        "ms": 8.79609203338623,
        "min_ms": 8.79609203338623,
        "max_ms": 8.79609203338623,
        "compile_time": 3.1255738735198975
    },
    {
        "BLOCK_SIZE_M": 64,
        "BLOCK_SIZE_N": 64,
        "BLOCK_SIZE_K": 32,
        "GROUP_SIZE_M": 8,
        "num_stages": 8,
        "num_warps": 8,
        "ms": 8.797952651977539,
        "min_ms": 8.797952651977539,
        "max_ms": 8.797952651977539,
        "compile_time": 1.8344228267669678
    },
    {
        "BLOCK_SIZE_M": 128,
        "BLOCK_SIZE_N": 32,
        "BLOCK_SIZE_K": 32,
        "GROUP_SIZE_M": 8,
        "num_stages": 3,
        "num_warps": 4,
        "ms": 8.800546646118164,
        "min_ms": 8.800546646118164,
        "max_ms": 8.800546646118164,
        "compile_time": 1.9628279209136963
    },
    {
        "BLOCK_SIZE_M": 32,
        "BLOCK_SIZE_N": 256,
        "BLOCK_SIZE_K": 32,
        "GROUP_SIZE_M": 8,
        "num_stages": 8,
        "num_warps": 8,
        "ms": 8.801825523376465,
        "min_ms": 8.801825523376465,
        "max_ms": 8.801825523376465,
        "compile_time": 1.9244511127471924
    },
    {
        "BLOCK_SIZE_M": 128,
        "BLOCK_SIZE_N": 32,
        "BLOCK_SIZE_K": 32,
        "GROUP_SIZE_M": 8,
        "num_stages": 6,
        "num_warps": 4,
        "ms": 8.8027982711792,
        "min_ms": 8.8027982711792,
        "max_ms": 8.8027982711792,
        "compile_time": 2.010265827178955
    },
    {
        "BLOCK_SIZE_M": 32,
        "BLOCK_SIZE_N": 512,
        "BLOCK_SIZE_K": 16,
        "GROUP_SIZE_M": 8,
        "num_stages": 8,
        "num_warps": 8,
        "ms": 8.80943489074707,
        "min_ms": 8.80943489074707,
        "max_ms": 8.80943489074707,
        "compile_time": 1.92275071144104
    },
    {
        "BLOCK_SIZE_M": 128,
        "BLOCK_SIZE_N": 256,
        "BLOCK_SIZE_K": 64,
        "GROUP_SIZE_M": 8,
        "num_stages": 1,
        "num_warps": 32,
        "ms": 8.812041282653809,
        "min_ms": 8.812041282653809,
        "max_ms": 8.812041282653809,
        "compile_time": 1.851733684539795
    },
    {
        "BLOCK_SIZE_M": 32,
        "BLOCK_SIZE_N": 256,
        "BLOCK_SIZE_K": 64,
        "GROUP_SIZE_M": 8,
        "num_stages": 4,
        "num_warps": 4,
        "ms": 8.813196182250977,
        "min_ms": 8.813196182250977,
        "max_ms": 8.813196182250977,
        "compile_time": 2.3108153343200684
    },
    {
        "BLOCK_SIZE_M": 128,
        "BLOCK_SIZE_N": 32,
        "BLOCK_SIZE_K": 128,
        "GROUP_SIZE_M": 8,
        "num_stages": 5,
        "num_warps": 4,
        "ms": 8.814648628234863,
        "min_ms": 8.814648628234863,
        "max_ms": 8.814648628234863,
        "compile_time": 2.597216844558716
    },
    {
        "BLOCK_SIZE_M": 32,
        "BLOCK_SIZE_N": 512,
        "BLOCK_SIZE_K": 16,
        "GROUP_SIZE_M": 8,
        "num_stages": 7,
        "num_warps": 8,
        "ms": 8.827402114868164,
        "min_ms": 8.827402114868164,
        "max_ms": 8.827402114868164,
        "compile_time": 1.8933534622192383
    },
    {
        "BLOCK_SIZE_M": 128,
        "BLOCK_SIZE_N": 32,
        "BLOCK_SIZE_K": 128,
        "GROUP_SIZE_M": 8,
        "num_stages": 3,
        "num_warps": 2,
        "ms": 8.839372634887695,
        "min_ms": 8.839372634887695,
        "max_ms": 8.839372634887695,
        "compile_time": 3.406663179397583
    },
    {
        "BLOCK_SIZE_M": 32,
        "BLOCK_SIZE_N": 512,
        "BLOCK_SIZE_K": 16,
        "GROUP_SIZE_M": 8,
        "num_stages": 3,
        "num_warps": 4,
        "ms": 8.8447904586792,
        "min_ms": 8.8447904586792,
        "max_ms": 8.8447904586792,
        "compile_time": 2.2611753940582275
    },
    {
        "BLOCK_SIZE_M": 128,
        "BLOCK_SIZE_N": 32,
        "BLOCK_SIZE_K": 32,
        "GROUP_SIZE_M": 8,
        "num_stages": 4,
        "num_warps": 4,
        "ms": 8.847223281860352,
        "min_ms": 8.847223281860352,
        "max_ms": 8.847223281860352,
        "compile_time": 1.982846975326538
    },
    {
        "BLOCK_SIZE_M": 128,
        "BLOCK_SIZE_N": 32,
        "BLOCK_SIZE_K": 64,
        "GROUP_SIZE_M": 8,
        "num_stages": 6,
        "num_warps": 4,
        "ms": 8.848569869995117,
        "min_ms": 8.848569869995117,
        "max_ms": 8.848569869995117,
        "compile_time": 2.2286715507507324
    },
    {
        "BLOCK_SIZE_M": 32,
        "BLOCK_SIZE_N": 256,
        "BLOCK_SIZE_K": 16,
        "GROUP_SIZE_M": 8,
        "num_stages": 7,
        "num_warps": 4,
        "ms": 8.848639488220215,
        "min_ms": 8.848639488220215,
        "max_ms": 8.848639488220215,
        "compile_time": 1.9484467506408691
    },
    {
        "BLOCK_SIZE_M": 32,
        "BLOCK_SIZE_N": 256,
        "BLOCK_SIZE_K": 32,
        "GROUP_SIZE_M": 8,
        "num_stages": 7,
        "num_warps": 8,
        "ms": 8.856081008911133,
        "min_ms": 8.856081008911133,
        "max_ms": 8.856081008911133,
        "compile_time": 1.9088454246520996
    },
    {
        "BLOCK_SIZE_M": 256,
        "BLOCK_SIZE_N": 128,
        "BLOCK_SIZE_K": 32,
        "GROUP_SIZE_M": 8,
        "num_stages": 1,
        "num_warps": 8,
        "ms": 8.856947898864746,
        "min_ms": 8.856947898864746,
        "max_ms": 8.856947898864746,
        "compile_time": 2.412121295928955
    },
    {
        "BLOCK_SIZE_M": 128,
        "BLOCK_SIZE_N": 64,
        "BLOCK_SIZE_K": 16,
        "GROUP_SIZE_M": 8,
        "num_stages": 4,
        "num_warps": 8,
        "ms": 8.8597412109375,
        "min_ms": 8.8597412109375,
        "max_ms": 8.8597412109375,
        "compile_time": 1.8418633937835693
    },
    {
        "BLOCK_SIZE_M": 256,
        "BLOCK_SIZE_N": 32,
        "BLOCK_SIZE_K": 32,
        "GROUP_SIZE_M": 8,
        "num_stages": 8,
        "num_warps": 4,
        "ms": 8.861184120178223,
        "min_ms": 8.861184120178223,
        "max_ms": 8.861184120178223,
        "compile_time": 2.460676431655884
    },
    {
        "BLOCK_SIZE_M": 32,
        "BLOCK_SIZE_N": 256,
        "BLOCK_SIZE_K": 16,
        "GROUP_SIZE_M": 8,
        "num_stages": 3,
        "num_warps": 4,
        "ms": 8.861845016479492,
        "min_ms": 8.861845016479492,
        "max_ms": 8.861845016479492,
        "compile_time": 1.787792682647705
    },
    {
        "BLOCK_SIZE_M": 128,
        "BLOCK_SIZE_N": 32,
        "BLOCK_SIZE_K": 128,
        "GROUP_SIZE_M": 8,
        "num_stages": 2,
        "num_warps": 2,
        "ms": 8.869552612304688,
        "min_ms": 8.869552612304688,
        "max_ms": 8.869552612304688,
        "compile_time": 2.951814889907837
    },
    {
        "BLOCK_SIZE_M": 32,
        "BLOCK_SIZE_N": 256,
        "BLOCK_SIZE_K": 32,
        "GROUP_SIZE_M": 8,
        "num_stages": 6,
        "num_warps": 8,
        "ms": 8.869852066040039,
        "min_ms": 8.869852066040039,
        "max_ms": 8.869852066040039,
        "compile_time": 1.7674543857574463
    },
    {
        "BLOCK_SIZE_M": 32,
        "BLOCK_SIZE_N": 128,
        "BLOCK_SIZE_K": 64,
        "GROUP_SIZE_M": 8,
        "num_stages": 3,
        "num_warps": 2,
        "ms": 8.870615005493164,
        "min_ms": 8.870615005493164,
        "max_ms": 8.870615005493164,
        "compile_time": 2.286902666091919
    },
    {
        "BLOCK_SIZE_M": 128,
        "BLOCK_SIZE_N": 64,
        "BLOCK_SIZE_K": 16,
        "GROUP_SIZE_M": 8,
        "num_stages": 6,
        "num_warps": 8,
        "ms": 8.882307052612305,
        "min_ms": 8.882307052612305,
        "max_ms": 8.882307052612305,
        "compile_time": 1.8992962837219238
    },
    {
        "BLOCK_SIZE_M": 256,
        "BLOCK_SIZE_N": 32,
        "BLOCK_SIZE_K": 32,
        "GROUP_SIZE_M": 8,
        "num_stages": 6,
        "num_warps": 4,
        "ms": 8.895197868347168,
        "min_ms": 8.895197868347168,
        "max_ms": 8.895197868347168,
        "compile_time": 2.3544986248016357
    },
    {
        "BLOCK_SIZE_M": 32,
        "BLOCK_SIZE_N": 128,
        "BLOCK_SIZE_K": 32,
        "GROUP_SIZE_M": 8,
        "num_stages": 6,
        "num_warps": 2,
        "ms": 8.89533805847168,
        "min_ms": 8.89533805847168,
        "max_ms": 8.89533805847168,
        "compile_time": 2.4370410442352295
    },
    {
        "BLOCK_SIZE_M": 128,
        "BLOCK_SIZE_N": 64,
        "BLOCK_SIZE_K": 16,
        "GROUP_SIZE_M": 8,
        "num_stages": 7,
        "num_warps": 8,
        "ms": 8.896474838256836,
        "min_ms": 8.896474838256836,
        "max_ms": 8.896474838256836,
        "compile_time": 1.8709566593170166
    },
    {
        "BLOCK_SIZE_M": 128,
        "BLOCK_SIZE_N": 64,
        "BLOCK_SIZE_K": 16,
        "GROUP_SIZE_M": 8,
        "num_stages": 8,
        "num_warps": 8,
        "ms": 8.897424697875977,
        "min_ms": 8.897424697875977,
        "max_ms": 8.897424697875977,
        "compile_time": 1.8760569095611572
    },
    {
        "BLOCK_SIZE_M": 128,
        "BLOCK_SIZE_N": 64,
        "BLOCK_SIZE_K": 16,
        "GROUP_SIZE_M": 8,
        "num_stages": 5,
        "num_warps": 8,
        "ms": 8.897610664367676,
        "min_ms": 8.897610664367676,
        "max_ms": 8.897610664367676,
        "compile_time": 1.8410108089447021
    },
    {
        "BLOCK_SIZE_M": 512,
        "BLOCK_SIZE_N": 64,
        "BLOCK_SIZE_K": 64,
        "GROUP_SIZE_M": 8,
        "num_stages": 1,
        "num_warps": 8,
        "ms": 8.909917831420898,
        "min_ms": 8.909917831420898,
        "max_ms": 8.909917831420898,
        "compile_time": 2.8732426166534424
    },
    {
        "BLOCK_SIZE_M": 256,
        "BLOCK_SIZE_N": 64,
        "BLOCK_SIZE_K": 256,
        "GROUP_SIZE_M": 8,
        "num_stages": 2,
        "num_warps": 8,
        "ms": 8.9103364944458,
        "min_ms": 8.9103364944458,
        "max_ms": 8.9103364944458,
        "compile_time": 3.1617226600646973
    },
    {
        "BLOCK_SIZE_M": 256,
        "BLOCK_SIZE_N": 32,
        "BLOCK_SIZE_K": 32,
        "GROUP_SIZE_M": 8,
        "num_stages": 7,
        "num_warps": 4,
        "ms": 8.9129638671875,
        "min_ms": 8.9129638671875,
        "max_ms": 8.9129638671875,
        "compile_time": 2.4423351287841797
    },
    {
        "BLOCK_SIZE_M": 128,
        "BLOCK_SIZE_N": 32,
        "BLOCK_SIZE_K": 64,
        "GROUP_SIZE_M": 8,
        "num_stages": 4,
        "num_warps": 8,
        "ms": 8.913529396057129,
        "min_ms": 8.913529396057129,
        "max_ms": 8.913529396057129,
        "compile_time": 1.88222336769104
    },
    {
        "BLOCK_SIZE_M": 32,
        "BLOCK_SIZE_N": 128,
        "BLOCK_SIZE_K": 32,
        "GROUP_SIZE_M": 8,
        "num_stages": 5,
        "num_warps": 2,
        "ms": 8.913714408874512,
        "min_ms": 8.913714408874512,
        "max_ms": 8.913714408874512,
        "compile_time": 2.0056254863739014
    },
    {
        "BLOCK_SIZE_M": 32,
        "BLOCK_SIZE_N": 512,
        "BLOCK_SIZE_K": 64,
        "GROUP_SIZE_M": 8,
        "num_stages": 3,
        "num_warps": 16,
        "ms": 8.91429328918457,
        "min_ms": 8.91429328918457,
        "max_ms": 8.91429328918457,
        "compile_time": 1.914428472518921
    },
    {
        "BLOCK_SIZE_M": 32,
        "BLOCK_SIZE_N": 256,
        "BLOCK_SIZE_K": 16,
        "GROUP_SIZE_M": 8,
        "num_stages": 5,
        "num_warps": 8,
        "ms": 8.914961814880371,
        "min_ms": 8.914961814880371,
        "max_ms": 8.914961814880371,
        "compile_time": 1.7883081436157227
    },
    {
        "BLOCK_SIZE_M": 32,
        "BLOCK_SIZE_N": 128,
        "BLOCK_SIZE_K": 32,
        "GROUP_SIZE_M": 8,
        "num_stages": 4,
        "num_warps": 2,
        "ms": 8.91750431060791,
        "min_ms": 8.91750431060791,
        "max_ms": 8.91750431060791,
        "compile_time": 2.0423102378845215
    },
    {
        "BLOCK_SIZE_M": 256,
        "BLOCK_SIZE_N": 32,
        "BLOCK_SIZE_K": 32,
        "GROUP_SIZE_M": 8,
        "num_stages": 5,
        "num_warps": 8,
        "ms": 8.917640686035156,
        "min_ms": 8.917640686035156,
        "max_ms": 8.917640686035156,
        "compile_time": 2.1252973079681396
    },
    {
        "BLOCK_SIZE_M": 128,
        "BLOCK_SIZE_N": 32,
        "BLOCK_SIZE_K": 32,
        "GROUP_SIZE_M": 8,
        "num_stages": 2,
        "num_warps": 4,
        "ms": 8.919188499450684,
        "min_ms": 8.919188499450684,
        "max_ms": 8.919188499450684,
        "compile_time": 1.8569929599761963
    },
    {
        "BLOCK_SIZE_M": 512,
        "BLOCK_SIZE_N": 32,
        "BLOCK_SIZE_K": 32,
        "GROUP_SIZE_M": 8,
        "num_stages": 3,
        "num_warps": 8,
        "ms": 8.91961669921875,
        "min_ms": 8.91961669921875,
        "max_ms": 8.91961669921875,
        "compile_time": 2.347913980484009
    },
    {
        "BLOCK_SIZE_M": 64,
        "BLOCK_SIZE_N": 128,
        "BLOCK_SIZE_K": 32,
        "GROUP_SIZE_M": 8,
        "num_stages": 8,
        "num_warps": 2,
        "ms": 8.920045852661133,
        "min_ms": 8.920045852661133,
        "max_ms": 8.920045852661133,
        "compile_time": 2.665391683578491
    },
    {
        "BLOCK_SIZE_M": 32,
        "BLOCK_SIZE_N": 256,
        "BLOCK_SIZE_K": 16,
        "GROUP_SIZE_M": 8,
        "num_stages": 6,
        "num_warps": 8,
        "ms": 8.927470207214355,
        "min_ms": 8.927470207214355,
        "max_ms": 8.927470207214355,
        "compile_time": 1.8069956302642822
    },
    {
        "BLOCK_SIZE_M": 128,
        "BLOCK_SIZE_N": 32,
        "BLOCK_SIZE_K": 64,
        "GROUP_SIZE_M": 8,
        "num_stages": 5,
        "num_warps": 8,
        "ms": 8.933953285217285,
        "min_ms": 8.933953285217285,
        "max_ms": 8.933953285217285,
        "compile_time": 2.0064258575439453
    },
    {
        "BLOCK_SIZE_M": 32,
        "BLOCK_SIZE_N": 128,
        "BLOCK_SIZE_K": 64,
        "GROUP_SIZE_M": 8,
        "num_stages": 3,
        "num_warps": 4,
        "ms": 8.938291549682617,
        "min_ms": 8.938291549682617,
        "max_ms": 8.938291549682617,
        "compile_time": 1.8901197910308838
    },
    {
        "BLOCK_SIZE_M": 32,
        "BLOCK_SIZE_N": 512,
        "BLOCK_SIZE_K": 16,
        "GROUP_SIZE_M": 8,
        "num_stages": 6,
        "num_warps": 8,
        "ms": 8.939204216003418,
        "min_ms": 8.939204216003418,
        "max_ms": 8.939204216003418,
        "compile_time": 1.8930943012237549
    },
    {
        "BLOCK_SIZE_M": 32,
        "BLOCK_SIZE_N": 256,
        "BLOCK_SIZE_K": 128,
        "GROUP_SIZE_M": 8,
        "num_stages": 2,
        "num_warps": 4,
        "ms": 8.939576148986816,
        "min_ms": 8.939576148986816,
        "max_ms": 8.939576148986816,
        "compile_time": 2.7427477836608887
    },
    {
        "BLOCK_SIZE_M": 64,
        "BLOCK_SIZE_N": 128,
        "BLOCK_SIZE_K": 32,
        "GROUP_SIZE_M": 8,
        "num_stages": 1,
        "num_warps": 8,
        "ms": 8.939892768859863,
        "min_ms": 8.939892768859863,
        "max_ms": 8.939892768859863,
        "compile_time": 1.8346703052520752
    },
    {
        "BLOCK_SIZE_M": 128,
        "BLOCK_SIZE_N": 128,
        "BLOCK_SIZE_K": 128,
        "GROUP_SIZE_M": 8,
        "num_stages": 1,
        "num_warps": 8,
        "ms": 8.94977855682373,
        "min_ms": 8.94977855682373,
        "max_ms": 8.94977855682373,
        "compile_time": 2.1908063888549805
    },
    {
        "BLOCK_SIZE_M": 32,
        "BLOCK_SIZE_N": 256,
        "BLOCK_SIZE_K": 64,
        "GROUP_SIZE_M": 8,
        "num_stages": 4,
        "num_warps": 8,
        "ms": 8.954116821289062,
        "min_ms": 8.954116821289062,
        "max_ms": 8.954116821289062,
        "compile_time": 1.9279766082763672
    },
    {
        "BLOCK_SIZE_M": 128,
        "BLOCK_SIZE_N": 256,
        "BLOCK_SIZE_K": 32,
        "GROUP_SIZE_M": 8,
        "num_stages": 1,
        "num_warps": 32,
        "ms": 8.956220626831055,
        "min_ms": 8.956220626831055,
        "max_ms": 8.956220626831055,
        "compile_time": 1.847069263458252
    },
    {
        "BLOCK_SIZE_M": 256,
        "BLOCK_SIZE_N": 64,
        "BLOCK_SIZE_K": 256,
        "GROUP_SIZE_M": 8,
        "num_stages": 2,
        "num_warps": 16,
        "ms": 8.961973190307617,
        "min_ms": 8.961973190307617,
        "max_ms": 8.961973190307617,
        "compile_time": 2.5737226009368896
    },
    {
        "BLOCK_SIZE_M": 32,
        "BLOCK_SIZE_N": 256,
        "BLOCK_SIZE_K": 32,
        "GROUP_SIZE_M": 8,
        "num_stages": 3,
        "num_warps": 8,
        "ms": 8.965343475341797,
        "min_ms": 8.965343475341797,
        "max_ms": 8.965343475341797,
        "compile_time": 1.7516064643859863
    },
    {
        "BLOCK_SIZE_M": 128,
        "BLOCK_SIZE_N": 32,
        "BLOCK_SIZE_K": 128,
        "GROUP_SIZE_M": 8,
        "num_stages": 4,
        "num_warps": 4,
        "ms": 8.970685958862305,
        "min_ms": 8.970685958862305,
        "max_ms": 8.970685958862305,
        "compile_time": 2.480123996734619
    },
    {
        "BLOCK_SIZE_M": 256,
        "BLOCK_SIZE_N": 32,
        "BLOCK_SIZE_K": 128,
        "GROUP_SIZE_M": 8,
        "num_stages": 2,
        "num_warps": 4,
        "ms": 8.973666191101074,
        "min_ms": 8.973666191101074,
        "max_ms": 8.973666191101074,
        "compile_time": 2.948908567428589
    },
    {
        "BLOCK_SIZE_M": 32,
        "BLOCK_SIZE_N": 128,
        "BLOCK_SIZE_K": 64,
        "GROUP_SIZE_M": 8,
        "num_stages": 5,
        "num_warps": 2,
        "ms": 8.978022575378418,
        "min_ms": 8.978022575378418,
        "max_ms": 8.978022575378418,
        "compile_time": 2.3821067810058594
    },
    {
        "BLOCK_SIZE_M": 32,
        "BLOCK_SIZE_N": 256,
        "BLOCK_SIZE_K": 32,
        "GROUP_SIZE_M": 8,
        "num_stages": 5,
        "num_warps": 2,
        "ms": 8.979028701782227,
        "min_ms": 8.979028701782227,
        "max_ms": 8.979028701782227,
        "compile_time": 2.700972080230713
    },
    {
        "BLOCK_SIZE_M": 32,
        "BLOCK_SIZE_N": 128,
        "BLOCK_SIZE_K": 32,
        "GROUP_SIZE_M": 8,
        "num_stages": 6,
        "num_warps": 4,
        "ms": 8.981485366821289,
        "min_ms": 8.981485366821289,
        "max_ms": 8.981485366821289,
        "compile_time": 2.139493703842163
    },
    {
        "BLOCK_SIZE_M": 32,
        "BLOCK_SIZE_N": 512,
        "BLOCK_SIZE_K": 16,
        "GROUP_SIZE_M": 8,
        "num_stages": 3,
        "num_warps": 8,
        "ms": 8.981541633605957,
        "min_ms": 8.981541633605957,
        "max_ms": 8.981541633605957,
        "compile_time": 1.8756279945373535
    },
    {
        "BLOCK_SIZE_M": 128,
        "BLOCK_SIZE_N": 64,
        "BLOCK_SIZE_K": 64,
        "GROUP_SIZE_M": 8,
        "num_stages": 1,
        "num_warps": 8,
        "ms": 8.983818054199219,
        "min_ms": 8.983818054199219,
        "max_ms": 8.983818054199219,
        "compile_time": 1.7758305072784424
    },
    {
        "BLOCK_SIZE_M": 512,
        "BLOCK_SIZE_N": 64,
        "BLOCK_SIZE_K": 32,
        "GROUP_SIZE_M": 8,
        "num_stages": 1,
        "num_warps": 16,
        "ms": 8.99311637878418,
        "min_ms": 8.99311637878418,
        "max_ms": 8.99311637878418,
        "compile_time": 2.1195199489593506
    },
    {
        "BLOCK_SIZE_M": 32,
        "BLOCK_SIZE_N": 512,
        "BLOCK_SIZE_K": 32,
        "GROUP_SIZE_M": 8,
        "num_stages": 3,
        "num_warps": 8,
        "ms": 8.998204231262207,
        "min_ms": 8.998204231262207,
        "max_ms": 8.998204231262207,
        "compile_time": 1.9851460456848145
    },
    {
        "BLOCK_SIZE_M": 32,
        "BLOCK_SIZE_N": 128,
        "BLOCK_SIZE_K": 32,
        "GROUP_SIZE_M": 8,
        "num_stages": 3,
        "num_warps": 4,
        "ms": 8.99965763092041,
        "min_ms": 8.99965763092041,
        "max_ms": 8.99965763092041,
        "compile_time": 1.7141406536102295
    },
    {
        "BLOCK_SIZE_M": 32,
        "BLOCK_SIZE_N": 128,
        "BLOCK_SIZE_K": 32,
        "GROUP_SIZE_M": 8,
        "num_stages": 5,
        "num_warps": 4,
        "ms": 9.00114631652832,
        "min_ms": 9.00114631652832,
        "max_ms": 9.00114631652832,
        "compile_time": 1.7759785652160645
    },
    {
        "BLOCK_SIZE_M": 256,
        "BLOCK_SIZE_N": 32,
        "BLOCK_SIZE_K": 32,
        "GROUP_SIZE_M": 8,
        "num_stages": 7,
        "num_warps": 8,
        "ms": 9.002579689025879,
        "min_ms": 9.002579689025879,
        "max_ms": 9.002579689025879,
        "compile_time": 2.1474461555480957
    },
    {
        "BLOCK_SIZE_M": 256,
        "BLOCK_SIZE_N": 32,
        "BLOCK_SIZE_K": 32,
        "GROUP_SIZE_M": 8,
        "num_stages": 3,
        "num_warps": 4,
        "ms": 9.006762504577637,
        "min_ms": 9.006762504577637,
        "max_ms": 9.006762504577637,
        "compile_time": 2.2579550743103027
    },
    {
        "BLOCK_SIZE_M": 256,
        "BLOCK_SIZE_N": 32,
        "BLOCK_SIZE_K": 64,
        "GROUP_SIZE_M": 8,
        "num_stages": 3,
        "num_warps": 4,
        "ms": 9.008108139038086,
        "min_ms": 9.008108139038086,
        "max_ms": 9.008108139038086,
        "compile_time": 2.5283052921295166
    },
    {
        "BLOCK_SIZE_M": 64,
        "BLOCK_SIZE_N": 64,
        "BLOCK_SIZE_K": 64,
        "GROUP_SIZE_M": 8,
        "num_stages": 1,
        "num_warps": 2,
        "ms": 9.010289192199707,
        "min_ms": 9.010289192199707,
        "max_ms": 9.010289192199707,
        "compile_time": 1.9901025295257568
    },
    {
        "BLOCK_SIZE_M": 512,
        "BLOCK_SIZE_N": 32,
        "BLOCK_SIZE_K": 32,
        "GROUP_SIZE_M": 8,
        "num_stages": 4,
        "num_warps": 8,
        "ms": 9.010771751403809,
        "min_ms": 9.010771751403809,
        "max_ms": 9.010771751403809,
        "compile_time": 2.416425943374634
    },
    {
        "BLOCK_SIZE_M": 128,
        "BLOCK_SIZE_N": 64,
        "BLOCK_SIZE_K": 32,
        "GROUP_SIZE_M": 8,
        "num_stages": 5,
        "num_warps": 16,
        "ms": 9.011466979980469,
        "min_ms": 9.011466979980469,
        "max_ms": 9.011466979980469,
        "compile_time": 1.8275387287139893
    },
    {
        "BLOCK_SIZE_M": 128,
        "BLOCK_SIZE_N": 64,
        "BLOCK_SIZE_K": 16,
        "GROUP_SIZE_M": 8,
        "num_stages": 2,
        "num_warps": 2,
        "ms": 9.016545295715332,
        "min_ms": 9.016545295715332,
        "max_ms": 9.016545295715332,
        "compile_time": 2.136915922164917
    },
    {
        "BLOCK_SIZE_M": 128,
        "BLOCK_SIZE_N": 32,
        "BLOCK_SIZE_K": 64,
        "GROUP_SIZE_M": 8,
        "num_stages": 3,
        "num_warps": 8,
        "ms": 9.019335746765137,
        "min_ms": 9.019335746765137,
        "max_ms": 9.019335746765137,
        "compile_time": 1.8656656742095947
    },
    {
        "BLOCK_SIZE_M": 128,
        "BLOCK_SIZE_N": 32,
        "BLOCK_SIZE_K": 32,
        "GROUP_SIZE_M": 8,
        "num_stages": 7,
        "num_warps": 4,
        "ms": 9.024698257446289,
        "min_ms": 9.024698257446289,
        "max_ms": 9.024698257446289,
        "compile_time": 1.9655060768127441
    },
    {
        "BLOCK_SIZE_M": 128,
        "BLOCK_SIZE_N": 32,
        "BLOCK_SIZE_K": 128,
        "GROUP_SIZE_M": 8,
        "num_stages": 2,
        "num_warps": 4,
        "ms": 9.025071144104004,
        "min_ms": 9.025071144104004,
        "max_ms": 9.025071144104004,
        "compile_time": 2.265199899673462
    },
    {
        "BLOCK_SIZE_M": 32,
        "BLOCK_SIZE_N": 256,
        "BLOCK_SIZE_K": 16,
        "GROUP_SIZE_M": 8,
        "num_stages": 8,
        "num_warps": 8,
        "ms": 9.02804946899414,
        "min_ms": 9.02804946899414,
        "max_ms": 9.02804946899414,
        "compile_time": 1.748096227645874
    },
    {
        "BLOCK_SIZE_M": 128,
        "BLOCK_SIZE_N": 32,
        "BLOCK_SIZE_K": 32,
        "GROUP_SIZE_M": 8,
        "num_stages": 8,
        "num_warps": 4,
        "ms": 9.032462120056152,
        "min_ms": 9.032462120056152,
        "max_ms": 9.032462120056152,
        "compile_time": 1.978522539138794
    },
    {
        "BLOCK_SIZE_M": 128,
        "BLOCK_SIZE_N": 64,
        "BLOCK_SIZE_K": 32,
        "GROUP_SIZE_M": 8,
        "num_stages": 6,
        "num_warps": 16,
        "ms": 9.035478591918945,
        "min_ms": 9.035478591918945,
        "max_ms": 9.035478591918945,
        "compile_time": 1.8754894733428955
    },
    {
        "BLOCK_SIZE_M": 32,
        "BLOCK_SIZE_N": 128,
        "BLOCK_SIZE_K": 32,
        "GROUP_SIZE_M": 8,
        "num_stages": 4,
        "num_warps": 4,
        "ms": 9.035725593566895,
        "min_ms": 9.035725593566895,
        "max_ms": 9.035725593566895,
        "compile_time": 1.8391382694244385
    },
    {
        "BLOCK_SIZE_M": 256,
        "BLOCK_SIZE_N": 32,
        "BLOCK_SIZE_K": 32,
        "GROUP_SIZE_M": 8,
        "num_stages": 8,
        "num_warps": 8,
        "ms": 9.038810729980469,
        "min_ms": 9.038810729980469,
        "max_ms": 9.038810729980469,
        "compile_time": 2.1509649753570557
    },
    {
        "BLOCK_SIZE_M": 512,
        "BLOCK_SIZE_N": 64,
        "BLOCK_SIZE_K": 64,
        "GROUP_SIZE_M": 8,
        "num_stages": 2,
        "num_warps": 16,
        "ms": 9.039401054382324,
        "min_ms": 9.039401054382324,
        "max_ms": 9.039401054382324,
        "compile_time": 2.389275074005127
    },
    {
        "BLOCK_SIZE_M": 32,
        "BLOCK_SIZE_N": 256,
        "BLOCK_SIZE_K": 16,
        "GROUP_SIZE_M": 8,
        "num_stages": 8,
        "num_warps": 2,
        "ms": 9.04106330871582,
        "min_ms": 9.04106330871582,
        "max_ms": 9.04106330871582,
        "compile_time": 2.3480734825134277
    },
    {
        "BLOCK_SIZE_M": 128,
        "BLOCK_SIZE_N": 64,
        "BLOCK_SIZE_K": 32,
        "GROUP_SIZE_M": 8,
        "num_stages": 3,
        "num_warps": 16,
        "ms": 9.041938781738281,
        "min_ms": 9.041938781738281,
        "max_ms": 9.041938781738281,
        "compile_time": 1.8659491539001465
    },
    {
        "BLOCK_SIZE_M": 512,
        "BLOCK_SIZE_N": 32,
        "BLOCK_SIZE_K": 32,
        "GROUP_SIZE_M": 8,
        "num_stages": 5,
        "num_warps": 8,
        "ms": 9.043268203735352,
        "min_ms": 9.043268203735352,
        "max_ms": 9.043268203735352,
        "compile_time": 2.522784471511841
    },
    {
        "BLOCK_SIZE_M": 128,
        "BLOCK_SIZE_N": 64,
        "BLOCK_SIZE_K": 32,
        "GROUP_SIZE_M": 8,
        "num_stages": 4,
        "num_warps": 16,
        "ms": 9.045252799987793,
        "min_ms": 9.045252799987793,
        "max_ms": 9.045252799987793,
        "compile_time": 1.8999850749969482
    },
    {
        "BLOCK_SIZE_M": 128,
        "BLOCK_SIZE_N": 32,
        "BLOCK_SIZE_K": 32,
        "GROUP_SIZE_M": 8,
        "num_stages": 3,
        "num_warps": 2,
        "ms": 9.046964645385742,
        "min_ms": 9.046964645385742,
        "max_ms": 9.046964645385742,
        "compile_time": 2.1070871353149414
    },
    {
        "BLOCK_SIZE_M": 256,
        "BLOCK_SIZE_N": 128,
        "BLOCK_SIZE_K": 128,
        "GROUP_SIZE_M": 8,
        "num_stages": 1,
        "num_warps": 32,
        "ms": 9.047368049621582,
        "min_ms": 9.047368049621582,
        "max_ms": 9.047368049621582,
        "compile_time": 2.02018141746521
    },
    {
        "BLOCK_SIZE_M": 32,
        "BLOCK_SIZE_N": 256,
        "BLOCK_SIZE_K": 16,
        "GROUP_SIZE_M": 8,
        "num_stages": 7,
        "num_warps": 2,
        "ms": 9.050950050354004,
        "min_ms": 9.050950050354004,
        "max_ms": 9.050950050354004,
        "compile_time": 2.3146812915802
    },
    {
        "BLOCK_SIZE_M": 32,
        "BLOCK_SIZE_N": 256,
        "BLOCK_SIZE_K": 32,
        "GROUP_SIZE_M": 8,
        "num_stages": 2,
        "num_warps": 4,
        "ms": 9.051732063293457,
        "min_ms": 9.051732063293457,
        "max_ms": 9.051732063293457,
        "compile_time": 1.9584546089172363
    },
    {
        "BLOCK_SIZE_M": 32,
        "BLOCK_SIZE_N": 256,
        "BLOCK_SIZE_K": 16,
        "GROUP_SIZE_M": 8,
        "num_stages": 7,
        "num_warps": 8,
        "ms": 9.05178451538086,
        "min_ms": 9.05178451538086,
        "max_ms": 9.05178451538086,
        "compile_time": 1.8226325511932373
    },
    {
        "BLOCK_SIZE_M": 32,
        "BLOCK_SIZE_N": 128,
        "BLOCK_SIZE_K": 32,
        "GROUP_SIZE_M": 8,
        "num_stages": 3,
        "num_warps": 2,
        "ms": 9.052215576171875,
        "min_ms": 9.052215576171875,
        "max_ms": 9.052215576171875,
        "compile_time": 1.9337859153747559
    },
    {
        "BLOCK_SIZE_M": 128,
        "BLOCK_SIZE_N": 32,
        "BLOCK_SIZE_K": 128,
        "GROUP_SIZE_M": 8,
        "num_stages": 3,
        "num_warps": 8,
        "ms": 9.052606582641602,
        "min_ms": 9.052606582641602,
        "max_ms": 9.052606582641602,
        "compile_time": 2.104264736175537
    },
    {
        "BLOCK_SIZE_M": 32,
        "BLOCK_SIZE_N": 256,
        "BLOCK_SIZE_K": 16,
        "GROUP_SIZE_M": 8,
        "num_stages": 4,
        "num_warps": 8,
        "ms": 9.05474853515625,
        "min_ms": 9.05474853515625,
        "max_ms": 9.05474853515625,
        "compile_time": 1.7006187438964844
    },
    {
        "BLOCK_SIZE_M": 128,
        "BLOCK_SIZE_N": 64,
        "BLOCK_SIZE_K": 32,
        "GROUP_SIZE_M": 8,
        "num_stages": 7,
        "num_warps": 16,
        "ms": 9.056572914123535,
        "min_ms": 9.056572914123535,
        "max_ms": 9.056572914123535,
        "compile_time": 1.8610045909881592
    },
    {
        "BLOCK_SIZE_M": 64,
        "BLOCK_SIZE_N": 256,
        "BLOCK_SIZE_K": 16,
        "GROUP_SIZE_M": 8,
        "num_stages": 2,
        "num_warps": 8,
        "ms": 9.065900802612305,
        "min_ms": 9.065900802612305,
        "max_ms": 9.065900802612305,
        "compile_time": 1.8736193180084229
    },
    {
        "BLOCK_SIZE_M": 128,
        "BLOCK_SIZE_N": 256,
        "BLOCK_SIZE_K": 32,
        "GROUP_SIZE_M": 8,
        "num_stages": 1,
        "num_warps": 8,
        "ms": 9.067950248718262,
        "min_ms": 9.067950248718262,
        "max_ms": 9.067950248718262,
        "compile_time": 2.19834041595459
    },
    {
        "BLOCK_SIZE_M": 32,
        "BLOCK_SIZE_N": 128,
        "BLOCK_SIZE_K": 128,
        "GROUP_SIZE_M": 8,
        "num_stages": 2,
        "num_warps": 2,
        "ms": 9.071523666381836,
        "min_ms": 9.071523666381836,
        "max_ms": 9.071523666381836,
        "compile_time": 2.710150718688965
    },
    {
        "BLOCK_SIZE_M": 128,
        "BLOCK_SIZE_N": 64,
        "BLOCK_SIZE_K": 16,
        "GROUP_SIZE_M": 8,
        "num_stages": 1,
        "num_warps": 4,
        "ms": 9.073049545288086,
        "min_ms": 9.073049545288086,
        "max_ms": 9.073049545288086,
        "compile_time": 1.8177917003631592
    },
    {
        "BLOCK_SIZE_M": 128,
        "BLOCK_SIZE_N": 64,
        "BLOCK_SIZE_K": 16,
        "GROUP_SIZE_M": 8,
        "num_stages": 3,
        "num_warps": 8,
        "ms": 9.076066017150879,
        "min_ms": 9.076066017150879,
        "max_ms": 9.076066017150879,
        "compile_time": 1.876509666442871
    },
    {
        "BLOCK_SIZE_M": 256,
        "BLOCK_SIZE_N": 64,
        "BLOCK_SIZE_K": 16,
        "GROUP_SIZE_M": 8,
        "num_stages": 7,
        "num_warps": 16,
        "ms": 9.08275032043457,
        "min_ms": 9.08275032043457,
        "max_ms": 9.08275032043457,
        "compile_time": 2.013970136642456
    },
    {
        "BLOCK_SIZE_M": 128,
        "BLOCK_SIZE_N": 32,
        "BLOCK_SIZE_K": 64,
        "GROUP_SIZE_M": 8,
        "num_stages": 2,
        "num_warps": 4,
        "ms": 9.083401679992676,
        "min_ms": 9.083401679992676,
        "max_ms": 9.083401679992676,
        "compile_time": 2.0070180892944336
    },
    {
        "BLOCK_SIZE_M": 512,
        "BLOCK_SIZE_N": 32,
        "BLOCK_SIZE_K": 32,
        "GROUP_SIZE_M": 8,
        "num_stages": 3,
        "num_warps": 16,
        "ms": 9.09015941619873,
        "min_ms": 9.09015941619873,
        "max_ms": 9.09015941619873,
        "compile_time": 2.2029335498809814
    },
    {
        "BLOCK_SIZE_M": 256,
        "BLOCK_SIZE_N": 32,
        "BLOCK_SIZE_K": 64,
        "GROUP_SIZE_M": 8,
        "num_stages": 3,
        "num_warps": 8,
        "ms": 9.090201377868652,
        "min_ms": 9.090201377868652,
        "max_ms": 9.090201377868652,
        "compile_time": 2.1937551498413086
    },
    {
        "BLOCK_SIZE_M": 128,
        "BLOCK_SIZE_N": 128,
        "BLOCK_SIZE_K": 128,
        "GROUP_SIZE_M": 8,
        "num_stages": 1,
        "num_warps": 16,
        "ms": 9.093241691589355,
        "min_ms": 9.093241691589355,
        "max_ms": 9.093241691589355,
        "compile_time": 1.8572494983673096
    },
    {
        "BLOCK_SIZE_M": 512,
        "BLOCK_SIZE_N": 64,
        "BLOCK_SIZE_K": 128,
        "GROUP_SIZE_M": 8,
        "num_stages": 2,
        "num_warps": 8,
        "ms": 9.100314140319824,
        "min_ms": 9.100314140319824,
        "max_ms": 9.100314140319824,
        "compile_time": 3.34420108795166
    },
    {
        "BLOCK_SIZE_M": 256,
        "BLOCK_SIZE_N": 32,
        "BLOCK_SIZE_K": 64,
        "GROUP_SIZE_M": 8,
        "num_stages": 2,
        "num_warps": 4,
        "ms": 9.102745056152344,
        "min_ms": 9.102745056152344,
        "max_ms": 9.102745056152344,
        "compile_time": 2.4272513389587402
    },
    {
        "BLOCK_SIZE_M": 64,
        "BLOCK_SIZE_N": 64,
        "BLOCK_SIZE_K": 64,
        "GROUP_SIZE_M": 8,
        "num_stages": 1,
        "num_warps": 4,
        "ms": 9.10779094696045,
        "min_ms": 9.10779094696045,
        "max_ms": 9.10779094696045,
        "compile_time": 1.797464370727539
    },
    {
        "BLOCK_SIZE_M": 32,
        "BLOCK_SIZE_N": 128,
        "BLOCK_SIZE_K": 16,
        "GROUP_SIZE_M": 8,
        "num_stages": 3,
        "num_warps": 2,
        "ms": 9.109503746032715,
        "min_ms": 9.109503746032715,
        "max_ms": 9.109503746032715,
        "compile_time": 1.7962660789489746
    },
    {
        "BLOCK_SIZE_M": 128,
        "BLOCK_SIZE_N": 32,
        "BLOCK_SIZE_K": 64,
        "GROUP_SIZE_M": 8,
        "num_stages": 2,
        "num_warps": 2,
        "ms": 9.11214828491211,
        "min_ms": 9.11214828491211,
        "max_ms": 9.11214828491211,
        "compile_time": 2.290013074874878
    },
    {
        "BLOCK_SIZE_M": 32,
        "BLOCK_SIZE_N": 128,
        "BLOCK_SIZE_K": 32,
        "GROUP_SIZE_M": 8,
        "num_stages": 7,
        "num_warps": 2,
        "ms": 9.126874923706055,
        "min_ms": 9.126874923706055,
        "max_ms": 9.126874923706055,
        "compile_time": 2.378350257873535
    },
    {
        "BLOCK_SIZE_M": 512,
        "BLOCK_SIZE_N": 32,
        "BLOCK_SIZE_K": 32,
        "GROUP_SIZE_M": 8,
        "num_stages": 4,
        "num_warps": 16,
        "ms": 9.132143020629883,
        "min_ms": 9.132143020629883,
        "max_ms": 9.132143020629883,
        "compile_time": 2.183427572250366
    },
    {
        "BLOCK_SIZE_M": 64,
        "BLOCK_SIZE_N": 512,
        "BLOCK_SIZE_K": 32,
        "GROUP_SIZE_M": 8,
        "num_stages": 2,
        "num_warps": 16,
        "ms": 9.133874893188477,
        "min_ms": 9.133874893188477,
        "max_ms": 9.133874893188477,
        "compile_time": 1.891777515411377
    },
    {
        "BLOCK_SIZE_M": 32,
        "BLOCK_SIZE_N": 128,
        "BLOCK_SIZE_K": 32,
        "GROUP_SIZE_M": 8,
        "num_stages": 8,
        "num_warps": 2,
        "ms": 9.13879108428955,
        "min_ms": 9.13879108428955,
        "max_ms": 9.13879108428955,
        "compile_time": 2.3311357498168945
    },
    {
        "BLOCK_SIZE_M": 32,
        "BLOCK_SIZE_N": 128,
        "BLOCK_SIZE_K": 64,
        "GROUP_SIZE_M": 8,
        "num_stages": 5,
        "num_warps": 4,
        "ms": 9.141322135925293,
        "min_ms": 9.141322135925293,
        "max_ms": 9.141322135925293,
        "compile_time": 1.9904050827026367
    },
    {
        "BLOCK_SIZE_M": 32,
        "BLOCK_SIZE_N": 256,
        "BLOCK_SIZE_K": 32,
        "GROUP_SIZE_M": 8,
        "num_stages": 4,
        "num_warps": 2,
        "ms": 9.14387321472168,
        "min_ms": 9.14387321472168,
        "max_ms": 9.14387321472168,
        "compile_time": 2.643606662750244
    },
    {
        "BLOCK_SIZE_M": 128,
        "BLOCK_SIZE_N": 128,
        "BLOCK_SIZE_K": 16,
        "GROUP_SIZE_M": 8,
        "num_stages": 5,
        "num_warps": 16,
        "ms": 9.144216537475586,
        "min_ms": 9.144216537475586,
        "max_ms": 9.144216537475586,
        "compile_time": 1.77608323097229
    },
    {
        "BLOCK_SIZE_M": 256,
        "BLOCK_SIZE_N": 64,
        "BLOCK_SIZE_K": 16,
        "GROUP_SIZE_M": 8,
        "num_stages": 8,
        "num_warps": 16,
        "ms": 9.144561767578125,
        "min_ms": 9.144561767578125,
        "max_ms": 9.144561767578125,
        "compile_time": 2.036618709564209
    },
    {
        "BLOCK_SIZE_M": 32,
        "BLOCK_SIZE_N": 256,
        "BLOCK_SIZE_K": 128,
        "GROUP_SIZE_M": 8,
        "num_stages": 3,
        "num_warps": 4,
        "ms": 9.1513090133667,
        "min_ms": 9.1513090133667,
        "max_ms": 9.1513090133667,
        "compile_time": 3.186192274093628
    },
    {
        "BLOCK_SIZE_M": 128,
        "BLOCK_SIZE_N": 32,
        "BLOCK_SIZE_K": 256,
        "GROUP_SIZE_M": 8,
        "num_stages": 2,
        "num_warps": 4,
        "ms": 9.152921676635742,
        "min_ms": 9.152921676635742,
        "max_ms": 9.152921676635742,
        "compile_time": 2.7976067066192627
    },
    {
        "BLOCK_SIZE_M": 64,
        "BLOCK_SIZE_N": 64,
        "BLOCK_SIZE_K": 128,
        "GROUP_SIZE_M": 8,
        "num_stages": 1,
        "num_warps": 2,
        "ms": 9.157352447509766,
        "min_ms": 9.157352447509766,
        "max_ms": 9.157352447509766,
        "compile_time": 2.382185935974121
    },
    {
        "BLOCK_SIZE_M": 32,
        "BLOCK_SIZE_N": 512,
        "BLOCK_SIZE_K": 32,
        "GROUP_SIZE_M": 8,
        "num_stages": 3,
        "num_warps": 16,
        "ms": 9.161561012268066,
        "min_ms": 9.161561012268066,
        "max_ms": 9.161561012268066,
        "compile_time": 1.81410551071167
    },
    {
        "BLOCK_SIZE_M": 128,
        "BLOCK_SIZE_N": 32,
        "BLOCK_SIZE_K": 64,
        "GROUP_SIZE_M": 8,
        "num_stages": 8,
        "num_warps": 8,
        "ms": 9.162676811218262,
        "min_ms": 9.162676811218262,
        "max_ms": 9.162676811218262,
        "compile_time": 2.0556695461273193
    },
    {
        "BLOCK_SIZE_M": 128,
        "BLOCK_SIZE_N": 128,
        "BLOCK_SIZE_K": 16,
        "GROUP_SIZE_M": 8,
        "num_stages": 6,
        "num_warps": 16,
        "ms": 9.164349555969238,
        "min_ms": 9.164349555969238,
        "max_ms": 9.164349555969238,
        "compile_time": 1.811840295791626
    },
    {
        "BLOCK_SIZE_M": 128,
        "BLOCK_SIZE_N": 32,
        "BLOCK_SIZE_K": 64,
        "GROUP_SIZE_M": 8,
        "num_stages": 7,
        "num_warps": 8,
        "ms": 9.164446830749512,
        "min_ms": 9.164446830749512,
        "max_ms": 9.164446830749512,
        "compile_time": 2.0035476684570312
    },
    {
        "BLOCK_SIZE_M": 128,
        "BLOCK_SIZE_N": 32,
        "BLOCK_SIZE_K": 64,
        "GROUP_SIZE_M": 8,
        "num_stages": 6,
        "num_warps": 8,
        "ms": 9.181239128112793,
        "min_ms": 9.181239128112793,
        "max_ms": 9.181239128112793,
        "compile_time": 2.048696756362915
    },
    {
        "BLOCK_SIZE_M": 256,
        "BLOCK_SIZE_N": 64,
        "BLOCK_SIZE_K": 32,
        "GROUP_SIZE_M": 8,
        "num_stages": 7,
        "num_warps": 32,
        "ms": 9.185093879699707,
        "min_ms": 9.185093879699707,
        "max_ms": 9.185093879699707,
        "compile_time": 2.0003342628479004
    },
    {
        "BLOCK_SIZE_M": 256,
        "BLOCK_SIZE_N": 32,
        "BLOCK_SIZE_K": 32,
        "GROUP_SIZE_M": 8,
        "num_stages": 6,
        "num_warps": 8,
        "ms": 9.186155319213867,
        "min_ms": 9.186155319213867,
        "max_ms": 9.186155319213867,
        "compile_time": 2.0623767375946045
    },
    {
        "BLOCK_SIZE_M": 512,
        "BLOCK_SIZE_N": 32,
        "BLOCK_SIZE_K": 32,
        "GROUP_SIZE_M": 8,
        "num_stages": 5,
        "num_warps": 16,
        "ms": 9.192392349243164,
        "min_ms": 9.192392349243164,
        "max_ms": 9.192392349243164,
        "compile_time": 2.2058541774749756
    },
    {
        "BLOCK_SIZE_M": 128,
        "BLOCK_SIZE_N": 128,
        "BLOCK_SIZE_K": 16,
        "GROUP_SIZE_M": 8,
        "num_stages": 4,
        "num_warps": 16,
        "ms": 9.1953763961792,
        "min_ms": 9.1953763961792,
        "max_ms": 9.1953763961792,
        "compile_time": 1.7876169681549072
    },
    {
        "BLOCK_SIZE_M": 256,
        "BLOCK_SIZE_N": 32,
        "BLOCK_SIZE_K": 64,
        "GROUP_SIZE_M": 8,
        "num_stages": 4,
        "num_warps": 4,
        "ms": 9.196767807006836,
        "min_ms": 9.196767807006836,
        "max_ms": 9.196767807006836,
        "compile_time": 2.6015236377716064
    },
    {
        "BLOCK_SIZE_M": 32,
        "BLOCK_SIZE_N": 128,
        "BLOCK_SIZE_K": 16,
        "GROUP_SIZE_M": 8,
        "num_stages": 8,
        "num_warps": 2,
        "ms": 9.20155143737793,
        "min_ms": 9.20155143737793,
        "max_ms": 9.20155143737793,
        "compile_time": 1.9267842769622803
    },
    {
        "BLOCK_SIZE_M": 32,
        "BLOCK_SIZE_N": 256,
        "BLOCK_SIZE_K": 64,
        "GROUP_SIZE_M": 8,
        "num_stages": 2,
        "num_warps": 4,
        "ms": 9.201745986938477,
        "min_ms": 9.201745986938477,
        "max_ms": 9.201745986938477,
        "compile_time": 2.1091506481170654
    },
    {
        "BLOCK_SIZE_M": 128,
        "BLOCK_SIZE_N": 32,
        "BLOCK_SIZE_K": 256,
        "GROUP_SIZE_M": 8,
        "num_stages": 3,
        "num_warps": 4,
        "ms": 9.204147338867188,
        "min_ms": 9.204147338867188,
        "max_ms": 9.204147338867188,
        "compile_time": 3.3469226360321045
    },
    {
        "BLOCK_SIZE_M": 256,
        "BLOCK_SIZE_N": 64,
        "BLOCK_SIZE_K": 128,
        "GROUP_SIZE_M": 8,
        "num_stages": 1,
        "num_warps": 8,
        "ms": 9.211679458618164,
        "min_ms": 9.211679458618164,
        "max_ms": 9.211679458618164,
        "compile_time": 2.4713785648345947
    },
    {
        "BLOCK_SIZE_M": 32,
        "BLOCK_SIZE_N": 128,
        "BLOCK_SIZE_K": 16,
        "GROUP_SIZE_M": 8,
        "num_stages": 4,
        "num_warps": 2,
        "ms": 9.215869903564453,
        "min_ms": 9.215869903564453,
        "max_ms": 9.215869903564453,
        "compile_time": 1.8898346424102783
    },
    {
        "BLOCK_SIZE_M": 256,
        "BLOCK_SIZE_N": 64,
        "BLOCK_SIZE_K": 32,
        "GROUP_SIZE_M": 8,
        "num_stages": 4,
        "num_warps": 32,
        "ms": 9.218978881835938,
        "min_ms": 9.218978881835938,
        "max_ms": 9.218978881835938,
        "compile_time": 2.014666795730591
    },
    {
        "BLOCK_SIZE_M": 128,
        "BLOCK_SIZE_N": 128,
        "BLOCK_SIZE_K": 16,
        "GROUP_SIZE_M": 8,
        "num_stages": 7,
        "num_warps": 16,
        "ms": 9.224764823913574,
        "min_ms": 9.224764823913574,
        "max_ms": 9.224764823913574,
        "compile_time": 1.8095190525054932
    },
    {
        "BLOCK_SIZE_M": 256,
        "BLOCK_SIZE_N": 32,
        "BLOCK_SIZE_K": 128,
        "GROUP_SIZE_M": 8,
        "num_stages": 3,
        "num_warps": 4,
        "ms": 9.227622032165527,
        "min_ms": 9.227622032165527,
        "max_ms": 9.227622032165527,
        "compile_time": 3.3346619606018066
    },
    {
        "BLOCK_SIZE_M": 256,
        "BLOCK_SIZE_N": 64,
        "BLOCK_SIZE_K": 32,
        "GROUP_SIZE_M": 8,
        "num_stages": 8,
        "num_warps": 32,
        "ms": 9.228231430053711,
        "min_ms": 9.228231430053711,
        "max_ms": 9.228231430053711,
        "compile_time": 2.0033345222473145
    },
    {
        "BLOCK_SIZE_M": 32,
        "BLOCK_SIZE_N": 128,
        "BLOCK_SIZE_K": 16,
        "GROUP_SIZE_M": 8,
        "num_stages": 7,
        "num_warps": 2,
        "ms": 9.231508255004883,
        "min_ms": 9.231508255004883,
        "max_ms": 9.231508255004883,
        "compile_time": 1.8842430114746094
    },
    {
        "BLOCK_SIZE_M": 64,
        "BLOCK_SIZE_N": 128,
        "BLOCK_SIZE_K": 32,
        "GROUP_SIZE_M": 8,
        "num_stages": 5,
        "num_warps": 16,
        "ms": 9.231790542602539,
        "min_ms": 9.231790542602539,
        "max_ms": 9.231790542602539,
        "compile_time": 1.6859889030456543
    },
    {
        "BLOCK_SIZE_M": 32,
        "BLOCK_SIZE_N": 128,
        "BLOCK_SIZE_K": 128,
        "GROUP_SIZE_M": 8,
        "num_stages": 3,
        "num_warps": 4,
        "ms": 9.23189926147461,
        "min_ms": 9.23189926147461,
        "max_ms": 9.23189926147461,
        "compile_time": 2.2290151119232178
    },
    {
        "BLOCK_SIZE_M": 32,
        "BLOCK_SIZE_N": 256,
        "BLOCK_SIZE_K": 128,
        "GROUP_SIZE_M": 8,
        "num_stages": 3,
        "num_warps": 8,
        "ms": 9.233128547668457,
        "min_ms": 9.233128547668457,
        "max_ms": 9.233128547668457,
        "compile_time": 2.257887601852417
    },
    {
        "BLOCK_SIZE_M": 128,
        "BLOCK_SIZE_N": 64,
        "BLOCK_SIZE_K": 256,
        "GROUP_SIZE_M": 8,
        "num_stages": 2,
        "num_warps": 8,
        "ms": 9.23504638671875,
        "min_ms": 9.23504638671875,
        "max_ms": 9.23504638671875,
        "compile_time": 2.356046676635742
    },
    {
        "BLOCK_SIZE_M": 256,
        "BLOCK_SIZE_N": 64,
        "BLOCK_SIZE_K": 32,
        "GROUP_SIZE_M": 8,
        "num_stages": 6,
        "num_warps": 32,
        "ms": 9.237093925476074,
        "min_ms": 9.237093925476074,
        "max_ms": 9.237093925476074,
        "compile_time": 2.0027265548706055
    },
    {
        "BLOCK_SIZE_M": 128,
        "BLOCK_SIZE_N": 128,
        "BLOCK_SIZE_K": 128,
        "GROUP_SIZE_M": 8,
        "num_stages": 2,
        "num_warps": 32,
        "ms": 9.23713493347168,
        "min_ms": 9.23713493347168,
        "max_ms": 9.23713493347168,
        "compile_time": 1.8538336753845215
    },
    {
        "BLOCK_SIZE_M": 128,
        "BLOCK_SIZE_N": 32,
        "BLOCK_SIZE_K": 64,
        "GROUP_SIZE_M": 8,
        "num_stages": 6,
        "num_warps": 2,
        "ms": 9.24071979522705,
        "min_ms": 9.24071979522705,
        "max_ms": 9.24071979522705,
        "compile_time": 2.6122169494628906
    },
    {
        "BLOCK_SIZE_M": 32,
        "BLOCK_SIZE_N": 128,
        "BLOCK_SIZE_K": 64,
        "GROUP_SIZE_M": 8,
        "num_stages": 4,
        "num_warps": 2,
        "ms": 9.243330955505371,
        "min_ms": 9.243330955505371,
        "max_ms": 9.243330955505371,
        "compile_time": 2.367501974105835
    },
    {
        "BLOCK_SIZE_M": 256,
        "BLOCK_SIZE_N": 32,
        "BLOCK_SIZE_K": 64,
        "GROUP_SIZE_M": 8,
        "num_stages": 5,
        "num_warps": 8,
        "ms": 9.244504928588867,
        "min_ms": 9.244504928588867,
        "max_ms": 9.244504928588867,
        "compile_time": 2.2624759674072266
    },
    {
        "BLOCK_SIZE_M": 128,
        "BLOCK_SIZE_N": 32,
        "BLOCK_SIZE_K": 64,
        "GROUP_SIZE_M": 8,
        "num_stages": 8,
        "num_warps": 2,
        "ms": 9.244916915893555,
        "min_ms": 9.244916915893555,
        "max_ms": 9.244916915893555,
        "compile_time": 2.830308675765991
    },
    {
        "BLOCK_SIZE_M": 128,
        "BLOCK_SIZE_N": 32,
        "BLOCK_SIZE_K": 128,
        "GROUP_SIZE_M": 8,
        "num_stages": 5,
        "num_warps": 8,
        "ms": 9.246496200561523,
        "min_ms": 9.246496200561523,
        "max_ms": 9.246496200561523,
        "compile_time": 2.1801726818084717
    },
    {
        "BLOCK_SIZE_M": 128,
        "BLOCK_SIZE_N": 32,
        "BLOCK_SIZE_K": 64,
        "GROUP_SIZE_M": 8,
        "num_stages": 7,
        "num_warps": 2,
        "ms": 9.248952865600586,
        "min_ms": 9.248952865600586,
        "max_ms": 9.248952865600586,
        "compile_time": 2.6891133785247803
    },
    {
        "BLOCK_SIZE_M": 128,
        "BLOCK_SIZE_N": 128,
        "BLOCK_SIZE_K": 16,
        "GROUP_SIZE_M": 8,
        "num_stages": 2,
        "num_warps": 4,
        "ms": 9.253622055053711,
        "min_ms": 9.253622055053711,
        "max_ms": 9.253622055053711,
        "compile_time": 2.2514913082122803
    },
    {
        "BLOCK_SIZE_M": 32,
        "BLOCK_SIZE_N": 256,
        "BLOCK_SIZE_K": 32,
        "GROUP_SIZE_M": 8,
        "num_stages": 2,
        "num_warps": 2,
        "ms": 9.256345748901367,
        "min_ms": 9.256345748901367,
        "max_ms": 9.256345748901367,
        "compile_time": 2.4198834896087646
    },
    {
        "BLOCK_SIZE_M": 32,
        "BLOCK_SIZE_N": 256,
        "BLOCK_SIZE_K": 16,
        "GROUP_SIZE_M": 8,
        "num_stages": 3,
        "num_warps": 8,
        "ms": 9.26297378540039,
        "min_ms": 9.26297378540039,
        "max_ms": 9.26297378540039,
        "compile_time": 1.7123794555664062
    },
    {
        "BLOCK_SIZE_M": 256,
        "BLOCK_SIZE_N": 32,
        "BLOCK_SIZE_K": 64,
        "GROUP_SIZE_M": 8,
        "num_stages": 5,
        "num_warps": 4,
        "ms": 9.264909744262695,
        "min_ms": 9.264909744262695,
        "max_ms": 9.264909744262695,
        "compile_time": 2.6773736476898193
    },
    {
        "BLOCK_SIZE_M": 32,
        "BLOCK_SIZE_N": 128,
        "BLOCK_SIZE_K": 32,
        "GROUP_SIZE_M": 8,
        "num_stages": 7,
        "num_warps": 4,
        "ms": 9.26854133605957,
        "min_ms": 9.26854133605957,
        "max_ms": 9.26854133605957,
        "compile_time": 2.0741233825683594
    },
    {
        "BLOCK_SIZE_M": 64,
        "BLOCK_SIZE_N": 128,
        "BLOCK_SIZE_K": 32,
        "GROUP_SIZE_M": 8,
        "num_stages": 3,
        "num_warps": 16,
        "ms": 9.269658088684082,
        "min_ms": 9.269658088684082,
        "max_ms": 9.269658088684082,
        "compile_time": 1.7642786502838135
    },
    {
        "BLOCK_SIZE_M": 64,
        "BLOCK_SIZE_N": 128,
        "BLOCK_SIZE_K": 16,
        "GROUP_SIZE_M": 8,
        "num_stages": 2,
        "num_warps": 8,
        "ms": 9.27160358428955,
        "min_ms": 9.27160358428955,
        "max_ms": 9.27160358428955,
        "compile_time": 1.675616979598999
    },
    {
        "BLOCK_SIZE_M": 32,
        "BLOCK_SIZE_N": 128,
        "BLOCK_SIZE_K": 32,
        "GROUP_SIZE_M": 8,
        "num_stages": 8,
        "num_warps": 4,
        "ms": 9.271928787231445,
        "min_ms": 9.271928787231445,
        "max_ms": 9.271928787231445,
        "compile_time": 1.9734342098236084
    },
    {
        "BLOCK_SIZE_M": 64,
        "BLOCK_SIZE_N": 256,
        "BLOCK_SIZE_K": 256,
        "GROUP_SIZE_M": 8,
        "num_stages": 1,
        "num_warps": 8,
        "ms": 9.272340774536133,
        "min_ms": 9.272340774536133,
        "max_ms": 9.272340774536133,
        "compile_time": 2.884486675262451
    },
    {
        "BLOCK_SIZE_M": 64,
        "BLOCK_SIZE_N": 128,
        "BLOCK_SIZE_K": 32,
        "GROUP_SIZE_M": 8,
        "num_stages": 6,
        "num_warps": 16,
        "ms": 9.273996353149414,
        "min_ms": 9.273996353149414,
        "max_ms": 9.273996353149414,
        "compile_time": 1.7936406135559082
    },
    {
        "BLOCK_SIZE_M": 128,
        "BLOCK_SIZE_N": 128,
        "BLOCK_SIZE_K": 16,
        "GROUP_SIZE_M": 8,
        "num_stages": 8,
        "num_warps": 16,
        "ms": 9.275003433227539,
        "min_ms": 9.275003433227539,
        "max_ms": 9.275003433227539,
        "compile_time": 1.8184659481048584
    },
    {
        "BLOCK_SIZE_M": 256,
        "BLOCK_SIZE_N": 64,
        "BLOCK_SIZE_K": 32,
        "GROUP_SIZE_M": 8,
        "num_stages": 3,
        "num_warps": 32,
        "ms": 9.275473594665527,
        "min_ms": 9.275473594665527,
        "max_ms": 9.275473594665527,
        "compile_time": 1.874380350112915
    },
    {
        "BLOCK_SIZE_M": 64,
        "BLOCK_SIZE_N": 128,
        "BLOCK_SIZE_K": 32,
        "GROUP_SIZE_M": 8,
        "num_stages": 4,
        "num_warps": 16,
        "ms": 9.283193588256836,
        "min_ms": 9.283193588256836,
        "max_ms": 9.283193588256836,
        "compile_time": 1.7908930778503418
    },
    {
        "BLOCK_SIZE_M": 32,
        "BLOCK_SIZE_N": 128,
        "BLOCK_SIZE_K": 64,
        "GROUP_SIZE_M": 8,
        "num_stages": 5,
        "num_warps": 8,
        "ms": 9.286767959594727,
        "min_ms": 9.286767959594727,
        "max_ms": 9.286767959594727,
        "compile_time": 1.8188495635986328
    },
    {
        "BLOCK_SIZE_M": 256,
        "BLOCK_SIZE_N": 32,
        "BLOCK_SIZE_K": 64,
        "GROUP_SIZE_M": 8,
        "num_stages": 4,
        "num_warps": 8,
        "ms": 9.288703918457031,
        "min_ms": 9.288703918457031,
        "max_ms": 9.288703918457031,
        "compile_time": 2.184849977493286
    },
    {
        "BLOCK_SIZE_M": 64,
        "BLOCK_SIZE_N": 128,
        "BLOCK_SIZE_K": 256,
        "GROUP_SIZE_M": 8,
        "num_stages": 2,
        "num_warps": 4,
        "ms": 9.290853500366211,
        "min_ms": 9.290853500366211,
        "max_ms": 9.290853500366211,
        "compile_time": 3.053645610809326
    },
    {
        "BLOCK_SIZE_M": 64,
        "BLOCK_SIZE_N": 256,
        "BLOCK_SIZE_K": 16,
        "GROUP_SIZE_M": 8,
        "num_stages": 2,
        "num_warps": 4,
        "ms": 9.291059494018555,
        "min_ms": 9.291059494018555,
        "max_ms": 9.291059494018555,
        "compile_time": 2.0981087684631348
    },
    {
        "BLOCK_SIZE_M": 128,
        "BLOCK_SIZE_N": 128,
        "BLOCK_SIZE_K": 16,
        "GROUP_SIZE_M": 8,
        "num_stages": 2,
        "num_warps": 8,
        "ms": 9.291366577148438,
        "min_ms": 9.291366577148438,
        "max_ms": 9.291366577148438,
        "compile_time": 1.951308250427246
    },
    {
        "BLOCK_SIZE_M": 64,
        "BLOCK_SIZE_N": 128,
        "BLOCK_SIZE_K": 32,
        "GROUP_SIZE_M": 8,
        "num_stages": 7,
        "num_warps": 16,
        "ms": 9.296728134155273,
        "min_ms": 9.296728134155273,
        "max_ms": 9.296728134155273,
        "compile_time": 1.808610439300537
    },
    {
        "BLOCK_SIZE_M": 128,
        "BLOCK_SIZE_N": 32,
        "BLOCK_SIZE_K": 128,
        "GROUP_SIZE_M": 8,
        "num_stages": 4,
        "num_warps": 8,
        "ms": 9.308849334716797,
        "min_ms": 9.308849334716797,
        "max_ms": 9.308849334716797,
        "compile_time": 2.130378484725952
    },
    {
        "BLOCK_SIZE_M": 64,
        "BLOCK_SIZE_N": 128,
        "BLOCK_SIZE_K": 256,
        "GROUP_SIZE_M": 8,
        "num_stages": 2,
        "num_warps": 8,
        "ms": 9.31074047088623,
        "min_ms": 9.31074047088623,
        "max_ms": 9.31074047088623,
        "compile_time": 2.291071653366089
    },
    {
        "BLOCK_SIZE_M": 32,
        "BLOCK_SIZE_N": 128,
        "BLOCK_SIZE_K": 16,
        "GROUP_SIZE_M": 8,
        "num_stages": 5,
        "num_warps": 2,
        "ms": 9.312255859375,
        "min_ms": 9.312255859375,
        "max_ms": 9.312255859375,
        "compile_time": 1.8841419219970703
    },
    {
        "BLOCK_SIZE_M": 32,
        "BLOCK_SIZE_N": 128,
        "BLOCK_SIZE_K": 64,
        "GROUP_SIZE_M": 8,
        "num_stages": 2,
        "num_warps": 4,
        "ms": 9.317376136779785,
        "min_ms": 9.317376136779785,
        "max_ms": 9.317376136779785,
        "compile_time": 1.9574217796325684
    },
    {
        "BLOCK_SIZE_M": 64,
        "BLOCK_SIZE_N": 128,
        "BLOCK_SIZE_K": 128,
        "GROUP_SIZE_M": 8,
        "num_stages": 3,
        "num_warps": 32,
        "ms": 9.327860832214355,
        "min_ms": 9.327860832214355,
        "max_ms": 9.327860832214355,
        "compile_time": 1.6955585479736328
    },
    {
        "BLOCK_SIZE_M": 64,
        "BLOCK_SIZE_N": 64,
        "BLOCK_SIZE_K": 128,
        "GROUP_SIZE_M": 8,
        "num_stages": 3,
        "num_warps": 16,
        "ms": 9.330129623413086,
        "min_ms": 9.330129623413086,
        "max_ms": 9.330129623413086,
        "compile_time": 1.8056550025939941
    },
    {
        "BLOCK_SIZE_M": 32,
        "BLOCK_SIZE_N": 128,
        "BLOCK_SIZE_K": 16,
        "GROUP_SIZE_M": 8,
        "num_stages": 6,
        "num_warps": 2,
        "ms": 9.333648681640625,
        "min_ms": 9.333648681640625,
        "max_ms": 9.333648681640625,
        "compile_time": 1.895273208618164
    },
    {
        "BLOCK_SIZE_M": 256,
        "BLOCK_SIZE_N": 64,
        "BLOCK_SIZE_K": 32,
        "GROUP_SIZE_M": 8,
        "num_stages": 5,
        "num_warps": 32,
        "ms": 9.334803581237793,
        "min_ms": 9.334803581237793,
        "max_ms": 9.334803581237793,
        "compile_time": 1.9156947135925293
    },
    {
        "BLOCK_SIZE_M": 256,
        "BLOCK_SIZE_N": 32,
        "BLOCK_SIZE_K": 64,
        "GROUP_SIZE_M": 8,
        "num_stages": 2,
        "num_warps": 8,
        "ms": 9.335360527038574,
        "min_ms": 9.335360527038574,
        "max_ms": 9.335360527038574,
        "compile_time": 2.1134092807769775
    },
    {
        "BLOCK_SIZE_M": 32,
        "BLOCK_SIZE_N": 128,
        "BLOCK_SIZE_K": 64,
        "GROUP_SIZE_M": 8,
        "num_stages": 8,
        "num_warps": 4,
        "ms": 9.336106300354004,
        "min_ms": 9.336106300354004,
        "max_ms": 9.336106300354004,
        "compile_time": 2.12274169921875
    },
    {
        "BLOCK_SIZE_M": 32,
        "BLOCK_SIZE_N": 128,
        "BLOCK_SIZE_K": 128,
        "GROUP_SIZE_M": 8,
        "num_stages": 2,
        "num_warps": 4,
        "ms": 9.336114883422852,
        "min_ms": 9.336114883422852,
        "max_ms": 9.336114883422852,
        "compile_time": 2.0241053104400635
    },
    {
        "BLOCK_SIZE_M": 128,
        "BLOCK_SIZE_N": 64,
        "BLOCK_SIZE_K": 128,
        "GROUP_SIZE_M": 8,
        "num_stages": 3,
        "num_warps": 32,
        "ms": 9.338162422180176,
        "min_ms": 9.338162422180176,
        "max_ms": 9.338162422180176,
        "compile_time": 1.7966651916503906
    },
    {
        "BLOCK_SIZE_M": 256,
        "BLOCK_SIZE_N": 32,
        "BLOCK_SIZE_K": 32,
        "GROUP_SIZE_M": 8,
        "num_stages": 4,
        "num_warps": 2,
        "ms": 9.338303565979004,
        "min_ms": 9.338303565979004,
        "max_ms": 9.338303565979004,
        "compile_time": 2.8877336978912354
    },
    {
        "BLOCK_SIZE_M": 512,
        "BLOCK_SIZE_N": 64,
        "BLOCK_SIZE_K": 64,
        "GROUP_SIZE_M": 8,
        "num_stages": 1,
        "num_warps": 16,
        "ms": 9.35692310333252,
        "min_ms": 9.35692310333252,
        "max_ms": 9.35692310333252,
        "compile_time": 2.254028558731079
    },
    {
        "BLOCK_SIZE_M": 128,
        "BLOCK_SIZE_N": 64,
        "BLOCK_SIZE_K": 128,
        "GROUP_SIZE_M": 8,
        "num_stages": 4,
        "num_warps": 32,
        "ms": 9.357844352722168,
        "min_ms": 9.357844352722168,
        "max_ms": 9.357844352722168,
        "compile_time": 1.832942008972168
    },
    {
        "BLOCK_SIZE_M": 64,
        "BLOCK_SIZE_N": 128,
        "BLOCK_SIZE_K": 128,
        "GROUP_SIZE_M": 8,
        "num_stages": 4,
        "num_warps": 32,
        "ms": 9.359359741210938,
        "min_ms": 9.359359741210938,
        "max_ms": 9.359359741210938,
        "compile_time": 1.731370210647583
    },
    {
        "BLOCK_SIZE_M": 128,
        "BLOCK_SIZE_N": 64,
        "BLOCK_SIZE_K": 32,
        "GROUP_SIZE_M": 8,
        "num_stages": 2,
        "num_warps": 8,
        "ms": 9.36525821685791,
        "min_ms": 9.36525821685791,
        "max_ms": 9.36525821685791,
        "compile_time": 1.8020505905151367
    },
    {
        "BLOCK_SIZE_M": 32,
        "BLOCK_SIZE_N": 128,
        "BLOCK_SIZE_K": 128,
        "GROUP_SIZE_M": 8,
        "num_stages": 5,
        "num_warps": 4,
        "ms": 9.365987777709961,
        "min_ms": 9.365987777709961,
        "max_ms": 9.365987777709961,
        "compile_time": 2.448575973510742
    },
    {
        "BLOCK_SIZE_M": 32,
        "BLOCK_SIZE_N": 256,
        "BLOCK_SIZE_K": 64,
        "GROUP_SIZE_M": 8,
        "num_stages": 5,
        "num_warps": 16,
        "ms": 9.3682222366333,
        "min_ms": 9.3682222366333,
        "max_ms": 9.3682222366333,
        "compile_time": 1.8168466091156006
    },
    {
        "BLOCK_SIZE_M": 256,
        "BLOCK_SIZE_N": 32,
        "BLOCK_SIZE_K": 64,
        "GROUP_SIZE_M": 8,
        "num_stages": 5,
        "num_warps": 16,
        "ms": 9.385108947753906,
        "min_ms": 9.385108947753906,
        "max_ms": 9.385108947753906,
        "compile_time": 2.1247336864471436
    },
    {
        "BLOCK_SIZE_M": 256,
        "BLOCK_SIZE_N": 32,
        "BLOCK_SIZE_K": 64,
        "GROUP_SIZE_M": 8,
        "num_stages": 4,
        "num_warps": 16,
        "ms": 9.38931655883789,
        "min_ms": 9.38931655883789,
        "max_ms": 9.38931655883789,
        "compile_time": 2.0294253826141357
    },
    {
        "BLOCK_SIZE_M": 32,
        "BLOCK_SIZE_N": 128,
        "BLOCK_SIZE_K": 64,
        "GROUP_SIZE_M": 8,
        "num_stages": 3,
        "num_warps": 8,
        "ms": 9.389781951904297,
        "min_ms": 9.389781951904297,
        "max_ms": 9.389781951904297,
        "compile_time": 1.782611608505249
    },
    {
        "BLOCK_SIZE_M": 32,
        "BLOCK_SIZE_N": 128,
        "BLOCK_SIZE_K": 16,
        "GROUP_SIZE_M": 8,
        "num_stages": 4,
        "num_warps": 4,
        "ms": 9.398980140686035,
        "min_ms": 9.398980140686035,
        "max_ms": 9.398980140686035,
        "compile_time": 1.7609162330627441
    },
    {
        "BLOCK_SIZE_M": 32,
        "BLOCK_SIZE_N": 256,
        "BLOCK_SIZE_K": 64,
        "GROUP_SIZE_M": 8,
        "num_stages": 2,
        "num_warps": 8,
        "ms": 9.40185546875,
        "min_ms": 9.40185546875,
        "max_ms": 9.40185546875,
        "compile_time": 1.8270392417907715
    },
    {
        "BLOCK_SIZE_M": 32,
        "BLOCK_SIZE_N": 128,
        "BLOCK_SIZE_K": 64,
        "GROUP_SIZE_M": 8,
        "num_stages": 7,
        "num_warps": 4,
        "ms": 9.411563873291016,
        "min_ms": 9.411563873291016,
        "max_ms": 9.411563873291016,
        "compile_time": 2.003349781036377
    },
    {
        "BLOCK_SIZE_M": 32,
        "BLOCK_SIZE_N": 128,
        "BLOCK_SIZE_K": 32,
        "GROUP_SIZE_M": 8,
        "num_stages": 2,
        "num_warps": 2,
        "ms": 9.415494918823242,
        "min_ms": 9.415494918823242,
        "max_ms": 9.415494918823242,
        "compile_time": 1.8371734619140625
    },
    {
        "BLOCK_SIZE_M": 64,
        "BLOCK_SIZE_N": 64,
        "BLOCK_SIZE_K": 128,
        "GROUP_SIZE_M": 8,
        "num_stages": 1,
        "num_warps": 4,
        "ms": 9.432022094726562,
        "min_ms": 9.432022094726562,
        "max_ms": 9.432022094726562,
        "compile_time": 1.8996329307556152
    },
    {
        "BLOCK_SIZE_M": 64,
        "BLOCK_SIZE_N": 512,
        "BLOCK_SIZE_K": 64,
        "GROUP_SIZE_M": 8,
        "num_stages": 1,
        "num_warps": 8,
        "ms": 9.43781852722168,
        "min_ms": 9.43781852722168,
        "max_ms": 9.43781852722168,
        "compile_time": 2.39233136177063
    },
    {
        "BLOCK_SIZE_M": 256,
        "BLOCK_SIZE_N": 32,
        "BLOCK_SIZE_K": 128,
        "GROUP_SIZE_M": 8,
        "num_stages": 3,
        "num_warps": 8,
        "ms": 9.444686889648438,
        "min_ms": 9.444686889648438,
        "max_ms": 9.444686889648438,
        "compile_time": 2.5005061626434326
    },
    {
        "BLOCK_SIZE_M": 32,
        "BLOCK_SIZE_N": 128,
        "BLOCK_SIZE_K": 64,
        "GROUP_SIZE_M": 8,
        "num_stages": 4,
        "num_warps": 4,
        "ms": 9.447649002075195,
        "min_ms": 9.447649002075195,
        "max_ms": 9.447649002075195,
        "compile_time": 1.8824427127838135
    },
    {
        "BLOCK_SIZE_M": 32,
        "BLOCK_SIZE_N": 128,
        "BLOCK_SIZE_K": 64,
        "GROUP_SIZE_M": 8,
        "num_stages": 4,
        "num_warps": 8,
        "ms": 9.454423904418945,
        "min_ms": 9.454423904418945,
        "max_ms": 9.454423904418945,
        "compile_time": 1.8122975826263428
    },
    {
        "BLOCK_SIZE_M": 64,
        "BLOCK_SIZE_N": 128,
        "BLOCK_SIZE_K": 64,
        "GROUP_SIZE_M": 8,
        "num_stages": 1,
        "num_warps": 8,
        "ms": 9.465322494506836,
        "min_ms": 9.465322494506836,
        "max_ms": 9.465322494506836,
        "compile_time": 1.7457213401794434
    },
    {
        "BLOCK_SIZE_M": 32,
        "BLOCK_SIZE_N": 128,
        "BLOCK_SIZE_K": 64,
        "GROUP_SIZE_M": 8,
        "num_stages": 6,
        "num_warps": 4,
        "ms": 9.468887329101562,
        "min_ms": 9.468887329101562,
        "max_ms": 9.468887329101562,
        "compile_time": 1.9821968078613281
    },
    {
        "BLOCK_SIZE_M": 32,
        "BLOCK_SIZE_N": 256,
        "BLOCK_SIZE_K": 64,
        "GROUP_SIZE_M": 8,
        "num_stages": 4,
        "num_warps": 16,
        "ms": 9.46894645690918,
        "min_ms": 9.46894645690918,
        "max_ms": 9.46894645690918,
        "compile_time": 1.8176844120025635
    },
    {
        "BLOCK_SIZE_M": 32,
        "BLOCK_SIZE_N": 128,
        "BLOCK_SIZE_K": 128,
        "GROUP_SIZE_M": 8,
        "num_stages": 3,
        "num_warps": 2,
        "ms": 9.480806350708008,
        "min_ms": 9.480806350708008,
        "max_ms": 9.480806350708008,
        "compile_time": 3.172574520111084
    },
    {
        "BLOCK_SIZE_M": 64,
        "BLOCK_SIZE_N": 128,
        "BLOCK_SIZE_K": 16,
        "GROUP_SIZE_M": 8,
        "num_stages": 1,
        "num_warps": 4,
        "ms": 9.487606048583984,
        "min_ms": 9.487606048583984,
        "max_ms": 9.487606048583984,
        "compile_time": 1.7791025638580322
    },
    {
        "BLOCK_SIZE_M": 256,
        "BLOCK_SIZE_N": 32,
        "BLOCK_SIZE_K": 32,
        "GROUP_SIZE_M": 8,
        "num_stages": 5,
        "num_warps": 2,
        "ms": 9.493969917297363,
        "min_ms": 9.493969917297363,
        "max_ms": 9.493969917297363,
        "compile_time": 3.0111563205718994
    },
    {
        "BLOCK_SIZE_M": 32,
        "BLOCK_SIZE_N": 128,
        "BLOCK_SIZE_K": 128,
        "GROUP_SIZE_M": 8,
        "num_stages": 3,
        "num_warps": 8,
        "ms": 9.505736351013184,
        "min_ms": 9.505736351013184,
        "max_ms": 9.505736351013184,
        "compile_time": 1.9862020015716553
    },
    {
        "BLOCK_SIZE_M": 128,
        "BLOCK_SIZE_N": 64,
        "BLOCK_SIZE_K": 32,
        "GROUP_SIZE_M": 8,
        "num_stages": 8,
        "num_warps": 16,
        "ms": 9.538949966430664,
        "min_ms": 9.538949966430664,
        "max_ms": 9.538949966430664,
        "compile_time": 1.8362421989440918
    },
    {
        "BLOCK_SIZE_M": 32,
        "BLOCK_SIZE_N": 256,
        "BLOCK_SIZE_K": 32,
        "GROUP_SIZE_M": 8,
        "num_stages": 5,
        "num_warps": 16,
        "ms": 9.541166305541992,
        "min_ms": 9.541166305541992,
        "max_ms": 9.541166305541992,
        "compile_time": 1.754157304763794
    },
    {
        "BLOCK_SIZE_M": 128,
        "BLOCK_SIZE_N": 64,
        "BLOCK_SIZE_K": 256,
        "GROUP_SIZE_M": 8,
        "num_stages": 2,
        "num_warps": 4,
        "ms": 9.544089317321777,
